Line Number,Sentence
1443,முற்கால இந்தியா எப்படிக் குலைந்தது?,False
1444,அதையுணர்தற்கு இடைக்கால இந்தியாவை ஆராய்தல் வேண்டும்.,False
1445,இடைக்கால இந்திய நிலைமீது சிறிது சிந்தை செலுத்துவோம்.,False
1446,பின்னே அவ்வொளி கால்வதைக் குன்றச் செய்யும் வழியில் ஆட்சிமுறைகள் நடை பெற்றன சமூகங்கள் மாறின.,False
1447,அதனால் மத்திய ராஜ்யத்தின் உயிர் நாடிகளுக்குத் தளர்ச்சி ஏற்பட்டது நாளடைவில் நாடிகளின் ஓட்டத்துக்கு தடை நேர்ந்தது.,False
1448,மாகாணத் தலைவர்களும் மற்றவர்களும் மத்திய ராஜ்யத்தை மதித்தார்களில்லை பொருட்படுத்தினார் களில்லை மத்தியத்தின் கட்டளைகளை மீறவும் முற்பட்டார்கள்.,False
1449,கட்டுக் குலைந்தது எங்கணுங் கிளர்ச்சிகளும் புரட்சிகளும் எழுந்தன.,False
1450,மத்திய ராஜ்யத்தின் நானா பக்கத் தொடர்புகளெல்லாம் அறுந்தன அதன் உறுப்புக்கள் குறைந்தன.,False
1451,அவ்வவ்விடத்தில் ஒவ்வோர் இராஜ்யம் தனித்தனியே கிளம்பிற்று.,False
1452,கிளம்பிய சில வளர்ந்து மறைந்தன சில உடனே மறைந்தன.,False
1453,"தோன்றிச் சிலகாலம் நின்று மறைந்தனவற்றுள் குறிக்கத்தக்கன கலிங்கம், பழைய ஆந்திரம், கர்நாடகம், இராஜபுதனம் முதலியன.",False
1454,கிரேக்கம் மீண்டும் சிறிது தலைகாட்டிச் சாய்ந்தது.,False
1455,இடையிடைச் சிலர் இளைய இடைக்கால இந்தியாவை நன்முறையில் வளர்க்க முயன்றனர்.,False
1456,முயன்று ஒரே வழியில் வெற்றியும் பெற்றனர்.,False
1457,"அவருள் கனிஷ்கர், சமுத்திரகுப்தர், சமுத்திரகுப்த விக்கிரமாதித்தர், ஹர்ஷர் ஆகிய நால்வரைச் சிறப்பாகச் சொல்லலாம்.",False
1458,நால்வர் கனிஷ்கர் கி.பி. பேஷாவரைத் தலைநகராகக் கொண்டவர்.,False
1459,அவர் பௌத்த தர்மத்தில் பெரும்பற்று வாய்ந்தவர்.,False
1460,"கனிஷ்கர் துருக்கிதானத்திலே சில பகுதிகளையும், சீனத்திலே பல பகுதிகளையும்பற்றி ஆங்காங்கே பௌத்த தர்மத்தை நுழைத்தவர்.",False
1461,அவர் காலத்தில் பௌத்த தர்ம வாயிலாகச் சீனத்துக்கும் இந்தியா வுக்கும் பல வழியிலும் அன்புத் தொடர்பு ஏற்பட்டது.,False
1462,கனிஷ்கர் காலத்தில் பாடலிபுத்திரத்தில் அவகோஷர் என்ற பௌத்தப் புலவர் ஒருவர் இருந்தனர்.,False
1463,அவரைக்கொண்டு பௌத்த நூல்களை எழுதுவிக்க வேண்டுமென்பது கனிஷ்கரின் வேட்கை.,False
1464,அவ்வேட்கையை நிறைவேற்றிக் கொள்ள அவர் பலவகையில் முயற்சி செய்தனர்.,False
1465,ஒன்றேனுங் கைகூடவில்லை.,False
1466,இறுதியில் கனிஷ்கர் பாடலி புத்திரத் தலைவருடன் போர்புரிந்து அவர் தமது வேட்கையை நிறைவேற்றிக் கொண்டனர்.,False
1467,கனிஷ்கர் காலத்தில் அரிய மருத்துவ நூல்கள் அறிஞரால் எழுதப்பட்டன.,False
1468,சமுத்திரகுப்தர் கி.பி. பல கலைகளில் வல்லவர் இசைக்கலையில் சிறந்த புலவர்.,False
1469,அவர் காலத்தில் இராஜ்யம் சிறிது பெருகிற்று என்று கூறலாம்.,False
1470,சமுத்திரகுப்தர் ஹிந்து தர்மத்தில் பற்றுடையவர்.,False
1471,"ஆனால், அவர் மற்ற மதங்களிடத்தில் வெறுப்போ பகைமையோ கொண்டவரல்லர்.",False
1472,சந்திரகுப்த விக்கிரமாதித்தர் கி.பி. ஆட்சி நல்லதே.,False
1473,அவர் சம்கிருத கலைகள் வளரத் துணை புரிந்தவர்.,False
1474,"தட்சணத்தை ஆண்ட பிரபாவதி, சந்திர குப்த விக்கிரமாதித்தரின் புதல்வியாரே.",False
1475,சந்திரகுப்த விக்கிரமாதித்தரைப் பற்றிப் பலபடப் பேசவேண்டுவ தில்லை.,False
1476,அவ்வெளியீட்டை நோக்குழிச் சந்திரகுப்த விக்கிரமாதித்தரின் ஆட்சித்திறன் நன்கு புலனாகும்.,False
1477,பாஹியான் வெளியிட்ட கருத்துக்களின் சாரம் வருமாறு யான் பாடலிபுத்திரத்தில் ஒரு பௌத்தமடத்தில் தங்கி சம்கிருதம் பயின்றேன்.,False
1478,"மக்கள் செல்வராய், தூயராய், உரிமையுணர்வுடைய ராய், இன்ப வாழ்வு நடாத்தியதைக் கண்டேன்.",False
1479,பாதைகளில் எந்த நேரத்திலும் எவரும் நடக்கலாம்.,False
1480,யான் பலவிடங்கள் சென்றேன்.,False
1481,என்னை ஒருவருந் தடுத்ததில்லை.,False
1482,கள்ளரால் யான் தாக்கப்பட்டதேயில்லை.,False
1483,"ஆடு, மாடு, கோழி, பன்றிகள் வாணிபத்திற்கென்று வளர்க்கப்படுவதில்லை.",False
1484,"ஊன் கடை என் கண்ணில் பட்டதே இல்லை, பெரும்பான்மையோர் சைவ உணவு உண்டதை யான் பார்த்தேன்.",False
1485,குடி கிடையாது.,False
1486,"வெங்காயம், வெள்ளைப் பூண்டு தின்பவர் சிலராகவே காணப்பட்டனர்.",False
1487,அறவோர் ஆதரிக்கப்பட்டனர்.,False
1488,"அறச்சாலைகள் பல எண் கண்ணைக் கவர்ந்தன, பாதை களில் தங்குமிடங்களிருந்தன.",False
1489,அரசினராலும் செல்வ ராலும் இலவச மருத்துவச் சாலைகள் நடத்தப் பட்டன.,False
1490,ஹர்ஷர் கி.பி. இந்தியச் சரித்திரத்தில் பேர் பெற்ற வருள் ஒருவர்.,False
1491,அவர் நாளில் ஹூயூன்ஸியாங் என்ற சீனப் பெரியார் இந்தியா அடைந்து பலவிடம் போந்து பலவற்றைக் கண்டனர்.,False
1492,அவரும் தாங் கண்டனவற்றை எழுதிச் சென்றனர்.,False
1493,அவற்றின் சுருக்கம் வருமாறு ஹர்ஷர் ஆட்சி நன்முறையில் நடந்து வந்தது.,False
1494,வரிச்சுமை பெரிதும் இல்லை.,False
1495,"பெரும்பான்மையோர் தொழில், விவசாயம், வாணிபம் செவ்வனே நடை பெற்றது.",False
1496,ஆற்று வழியிலும் சாலையிலும் சுங்கச்சாவடிகள் இருந்தன.,False
1497,தேர்ச்சி பெற்ற சேனைகளிருந்தன.,False
1498,ஹர்ஷர் சோர்வில்லாதவர் சுறுசுறுப்புடையவர் நாட்டின் பல பாகங்களைத் தாமே நேரிற்சென்று பார்த்து நிலைமைகளை யுணர்ந்து வேண்டுவ செய்ய முயன்றவர்.,False
1499,மக்களிடம் உண்மையும் நீதியும் விளங்கின.,False
1500,ஹர்ஷர் பௌத்தர்.,False
1501,மற்ற மதங்களின் உரிமையில் அவர் குறுக்கிடுவதில்லை.,False
1502,கனோஜில் ஒருசமயம் மகாநாடு அவரால் கூட்டப் பட்டது.,False
1503,"அம்மகாநாட்டைப் பத்தொன்பது மன்னரும், மூவாயிரம் பௌத்த பிராமண சந்நியாசிகளும், நளந்தா கழகத்தினின்றும் போந்த ஆயிரம் புலவரும் அணி செய்தனர்.",False
1504,சில இடங்களில் ஹிந்துமதம் செல்வாக்குப் பெற் றிருந்தது சில இடங்களில் பௌத்தம் செல்வாக்குப் பெற்றிருந்தது.,False
1505,நேபாளத்தில் பௌத்தம் மறைந்தே போயிற்று.,False
1506,காசியில் ஹிந்துக்களே ஏராளமாக இருந் தார்கள்.,False
1507,பாடலி புத்திரம் பாழ்பட்டது.,False
1508,சபையில் பிராமணர் மலிந்திருந்தனர்.,False
1509,போதியைச் சுற்றியிருந்த பாழிகள் நன்னிலையிலில்லை.,False
1510,ஆப்கன் தானத்தில் நுழைந்த பௌத்தம் சிறப்புடன் விளங்கிற்று.,False
1511,அதன் காப்புக் கென்று இரு நூறு கிராமங்கள் மன்னர்களாலும் மற்றவர் களாலும் விடப்பட் டிருந்தன.,False
1512,யான் பார்த்த நாடுகளில் எனக்கு இனிமை யூட்டியது தமிழ்நாடு.,False
1513,ஹர்ஷர் ஐந்தாண்டுக்கு ஒருமுறை பிரயாக்கில் அறவிழா நிகழ்த்துவர்.,False
1514,அவ்விழா எழுபத்தைந்துநாள் நடைபெறும் ஐந்து லட்சம் பேர் கூடுவர்.,False
1515,"முதல் மூன்றுநாள் புத்தர் பெயராலும், சூரியன் பெயராலும், சிவன் பெயராலும் முறையே தானங்கள் வழங்கப்படும்.",False
1516,நான்காம் நாள் பதினாயிரம் பௌத்த சந்நியாசிகளுக்குப் பொருள் வழங்கப்படும்.,False
1517,"ஒவ்வொருவரும் நூறு பொன்னும், ஒரு நல்முத்தும், ஓர் உடையும் பெறுவர்.",False
1518,இருபதுநாள் பிராமணருக்கென்றும்.,False
1519,"பத்துநாள் மற்ற சந்நியாசி கட்கென்றும் ஒரு மாதம் ஏழை, எளியவர் அநாதைகட் கென்றும் ஒதுக்கப்படும்.",False
1520,அவர்கட்கு முறை முறையே தானங்கள் செய்யப்படும்.,False
1521,இக்குறிப்புக்கள் ஹர்ஷர் காலத்திய நிலைமையை உணர்த் துவனவாம்.,False
1522,முற்பகுதி இடைக்கால இந்தியாவின் முற்பகுதியில் மன்னர் ஆட்சியில் கலைகள் உச்சநிலை யடைந்தன என்று கூறல் மிகையாகாது.,False
1523,கலை வளர்ச்சிக்குச் சிறப்பாக இரண்டு வேண்டும்.,False
1524,ஒன்று செல்வச் செழுமை மற்றொன்று அமைதி.,False
1525,இன்னோரன்ன காரணங்களால் நாட்டுக் கலைகள் நன்முறையில் வளர்ந்தன.,False
1526,பல விடங்களில் சிவ விஷ்ணு புத்த கோயில்கள் கட்டப் பட்டன.,False
1527,அவை ஓவியக் கூடங்களாகவே அமைக்கப்பட்டன.,False
1528,குகைகள் பலவும் ஓவியங்களாயின.,False
1529,"படத்தில் உருவெடுப்பு, பூ வேலை, சித்திர அணிகள் முதலியனவும் வளர்ந்தன.",False
1530,இசை பலவழியிலும் ஓங்கியது.,False
1531,பலதிற இசைக் கருவிகள் காணப்பட்டன.,False
1532,பரதநாட்டியக் கலை சிறப்புற்றது.,False
1533,"காவியம், கணிதம், மருத்துவம், சோதிடம் முதலியன வளம் பெற்றன.",False
1534,ஜைனப் புலவரும் பௌத்தப் புலவரும் வடமொழிக்குப் பேராக்கந் தேடினர்.,False
1535,பாளி மொழியிலும் தத்துவ நூல்கள் வரையப்பட்டன.,False
1536,புராணங்களும் தர்ம சாதிரங்களும் பெருவாரியாக எழுதப்பட்டன.,False
1537,"அந்நாளில் இந்தியக் கலைகள் பல சீனம், ஜப்பான், கிரீ முதலிய இடங்களிலும் பரவின.",False
1538,இந்தியக் கலைச் செல்வத்தைக் கண்டின்புற உலகின் நானா பக்கங்களிலிருந்து அறிஞர் இந்தியா போந்ததும் இங்கே குறிக்கற்பாலது.,False
1539,அரசு எவ்வழி அவ்வழிக் குடிகள் என்பது பழமொழி.,False
1540,"இடைக்கால இந்தியாவின் முதற்பகுதியில் வாழ்ந்த மன்னர்களிற் பெரும்பான்மையோர், மதம் தர்மம் கலை முதலியவற்றில் கருத் திருத்தியே ஆட்சி புரிந்தனர்.",False
1541,இது சரித்திரத்தால் நன்கு தெரிகிறது.,False
1542,"அந்நாளில் மன்னர் மனம் ஒரு மதத்தில் பற்றுக் கொண்டிருப்பினும், அம்மனம் மற்ற மதத்தவரைத் துன்புறுத்த எழுந்ததில்லை.",False
1543,காரணம் அவர் மனத்தில் மதத்துடன் தர்மமும் இரண்டறக் கலந்திருந் தமையே யாகும்.,False
1544,"அதனால் மக்களிடத்திலும் நல்ல குணங்களும், குணங்களுக்கேற்ற கலைகளும் அரும்பி மலரலாயின.",False
1545,பிற்பகுதி பின்னாளில் கலை இந்தியாவில் கலகம் நுழைந்தது.,False
1546,கலகம் தர்மத்தைச் சாய்த்தது.,False
1547,தர்மச் சாய்வால் மதவெறி எழுந்தது.,False
1548,கலகம் வெளிநாட்டினின்றும் வரவில்லை.,False
1549,கலகம் பிற்கால மன்னர் மனத்தி னின்றும் பிறந்தது.,False
1550,அது நாட்டையே கெடுத்தது.,False
1551,நாளடைவில் மன்னர் மனோநிலை மாறுபட்டது அதற் கேற்ப மக்கள் மனோநிலையும் மாறலாயிற்று.,False
1552,மன்னர் மனம் வெறும் மதப்பித்தில் தோய்ந்தது தர்மத்தினின்றும் ஒருவியது.,False
1553,தர்மம் அற்ற மதம் வெறும் பித்தாய் வெறியாய்ப் போவது இயல்பு.,False
1554,மன்னர் மத வெறியராயினர் மக்களும் மத வெறியரானார்கள்.,False
1555,வெறிக்கேற்ற கலைகள் பிறந்தன.,False
1556,மதப் பூசல்கள் ஆங்காங்கே தோன்றின பரவின.,False
1557,பூசலுக்குக் காரணம் மதங்களின் தத்துவங்களல்ல மக்கள் மனோ நிலையே யாகும்.,False
1558,இதையுணராதார் மதங்கள்மீது பாய்ந்து அவற்றைக் குறைகூறப் புகுகிறார்.,False
1559,மதங்களின் அடிப்படை ஒன்றே.,False
1560,மதங்களின் தத்துவ மூலங்கள் ஏடுகளிலுள்ள படியே மக்கள் மனங்களிற் படிந்து செயல்களாக அரும்பினால் போருக்கு இடம் ஏது?,False
1561,எம்மதம் தீயொழுக்கத்தை அறிவுறுத்துகிறது?,False
1562,தீயொழுக் கத்தை அறிவுறுத்துவது மதமாகுமா?,False
1563,அது மூர்க்கமாகும்.,False
1564,மனிதனிடத்துள்ள மூர்க்கத்தைப் போக்கவே மதம் தோன்றியது.,False
1565,அம்மதத்தை மூர்க்கத்துக்கு இரையாக்குவது அறமன்று.,False
1566,எந்த மதத்தை ஆராய்ந்தாலும் அதனடியில் அறமிருக்கும் அருளிருக்கும்.,False
1567,இவையற்ற மதமே யில்லை.,False
1568,இவையற்றது மதமு மாகாது.,False
1569,"ஆதலின், பூசலுக்குக் காரணம் மதம் என்று கொள்ளற்க.",False
1570,பூசலுக்குக் காரணம் மத தர்மமற்ற மூர்க்கமேயாகும்.,False
1571,மூர்க் கத்தை மதமாகக் கொள்வது தவறு.,False
1572,மும்மதம் இடைக்கால இந்தியாவின் முற்பகுதியில் மூன்று மதங்களே பெரிதும் சிறந்து விளங்கின.,False
1573,அவை ஹிந்துவும் ஜைனமும் பௌத்தமு மாம்.,False
1574,அம்மூன்றற்கும் அடிப்படையாக நிற்கும் அறம் ஒன்றே.,False
1575,ஓர் அற மன்றம் மூன்று கிளையாகப் பிரிந்ததென்க.,False
1576,ஒவ்வொரு கிளை ஒவ்வொரு விதமாகப் பருத்தது.,False
1577,அடிப்படை அறமே இதில் ஐயமில்லை.,False
1578,அறம் பின்னாளில் மக்களால் திரிபாகக் கொள்ளப் பட்டது.,False
1579,"தவறு, கோளாளரிடத்ததே அறத்தினிடத்ததன்று.",False
1580,மக்க ளிடைத் தோன்றிய திரிபுணர்வே இந்தியா உரிமையின் கழுத்தை யறுக்குங் கூரிய வாளாயிற்று.,False
1581,இடம் நேர்ந்துழி அதைப் பற்றி விரித்துக்கூற எண்ணியுள்ளேன்.,False
1582,மக்கள் மனோநிலைகளில் திரிபு உண்டாதற்குக் காரணம் பல கூறலாம்.,False
1583,எல்லாவற்றிற்கும் வேராக நின்றது ஆட்சி முறையே.,False
1584,"இடைக்கால இந்தியாவில் ஹர்ஷர் ஆட்சிவரை அசோகர் ஆட்சியின் ஒளி கான்றிக்கொண் டிருந்தமையான், சாதிமதப் பூசல்கள் வெளிப்படையாகத் தோன்றி நிகழவில்லை.",False
1585,ஹர்ஷர் அற விழாவில் எல்லாச் சமயத்தவருக்கும் தானம் வழங்கப்பட்டதை மறத்தலாகாது.,False
1586,அசோகர் ஆட்சியிலிருந்து ஹர்ஷர் ஆட்சிவரை பூசல்கள் வெளிப்படையாகத் தோன்றி நிகழவில்லை என்றே சொல்லலாம்.,False
1587,சிறு சிறு பூசல் சிற்சிலவிடங்களில் கனன்றிருந்தன என்பதுமட்டும் சரித்திரத்தால் விளங்குகிறது.,False
1588,கனல் பெருந்தீயாகி எழுநாவிட்டெரிய வில்லை.,False
