Line Number,Sentence
313,செய்யுள் வடிவுடைய தென்பது சிதைவுடன் கிடைத்துள்ள பகுதியால் அறியக் கிடக்கின்றது.,False
314,கொடாவிடின் ஓர் இருதுக் காட்சி ஒருவனைச் சாராது கழிந்த விடத்து ஒரு பார்ப்பனக் கொலையோடு ஒக்கும் என்பது.,False
315,இதனை அறநிலை என்றுணர்வது.,False
316,"பிரசா பத்தியம் என்பது, மைத்துன கோத்திரத்தான் மகள் வேண்டிச் சென்றால் மறாது கொடுப்பது.",False
317,இதனை ஒப்பு என்று உணர்வது.,False
318,"ஆரிடம் என்பது, ஆவும் ஆனேறும் பொற்கோட்டுப் பொற்குளம் பினவாகச் செய்து அவற்றிடை நீரிற் கொடுப்பது.",False
319,இதனைப் பொருள்கோள் என உணர்வது.,False
320,தெய்வம் என்பது வேள்வி ஆசிரியற்கு வேள்வித் தீமுன் வைத்துக் கொடுப்பது.,False
321,இதனைத் தெய்வம் என்று வழிபடப்பட்டது.,False
322,"காந்தர்வம் என்பது, இருவர் ஒத்தார் தாமே கூடும் கூட்டம்.",False
323,இதனை யாழோர் கூட்டம் என்று உணர்வது.,False
324,இஃது அரும்பொருள் வினை நிலை என்பது.,False
325,"இராக்கதம் என்பது, அவள் தன்னினுந் தமரினும் பெறாது வலிந்து கொள்வது.",False
326,"பைசாசம் என்பது, மூத்தாள் மாட்டும், துயின்றாள் மாட்டும், களித்தாள் மாட்டும், சார்வது.",False
327,இது பேய்நிலை எனப்படும். ...,False
328,"இருபத்திரண்டாம் நூற்பாவுரை, களவு, கற்பு பற்றிய ஆராய்ச்சிக் குறிப்புகள் பலவற்றை மேற்கொண்டு தடைவிடைகளுடன் செல்கின்றது.",False
329,அகப்பொருள் முடிந்தது .,False
330,களவொழுக்கம் களவொழுக்க வகை உங.,False
331,"இச்சூத்திரம் என்னுதலிற்றோ எனின், தமிழ் நெறி விளக்கத்திற் பொருளியலுடையாருங் களவொழுக்கம் ஆறு வகைப்படும் என்றார்.",False
332,அவையறிவித்தலைக் கருதிற்று.,False
333,அவையாவன தெய்வப் புணர்ச்சியும்.,False
334,"பாங்கற் கூட்டமும், தோழியாலாய கூட்டத்திற் பகற்குறியும், இரவுக்குறியும், வரைவுகடாதலும், உடன்போக்கு வலித்தலும் என அவற்றை அறிந்து கொள்க.",False
335,அகப்புறம் உச.,False
336,"இக்சூத்திரம் என்னுதலிற்றோ எனின், ஒருதலைக் காமமென்னும் அகப்புற முணர்த்துதல் நுதலிற்று.",False
337,காட்சி முதலாக் கலவியின் ஒருதலை வேட்கையிற் றோன்றுதல் கைக்கிளை யதுதான் கேட்போ ரில்லாக் கிளவிய தாகும் என்றாராகலின்.,False
338,காட்சி மையந் தெளிதலென.,False
339,"சுரும்பின பூம்பொழிற் சுடர்வேற் காளை கருந்தடங் கண்ணியைக் கண்டுமகிழ்ந் தன்று வெண்பாமாலை ,.",False
340,ஐயம் ஐயமாக வுள்ளது.,False
341,தெளிதல் தலைமகனைக் கண்ணிமைத்தன் முதலாகிய கருவிகளால் மானிடமெனத் தெளிதல்.,False
342,மாநிலத் தியலு மாத ராமெனத் தூய்மலர்க் கோதையைத் துணிவுரைத் தன்று வெண்பாமாலை .,False
343,அதற்குச் செய்யுள் வருமாறு.,False
344,கைக்கிளை மிக்க பெருந்திணை என்றாங் கத்திணை யிரண்டும் அகத்திணைப் புறனே என்றமையால் இவை மூன்றும் அகப்புறமானபடி அறிக.,False
345,அகப்புறம் முடிந்தது .,False
346,இயற்கைப் புணர்ச்சி .,False
347,"என் னின், உரைத்த முறையானே இயற்கைப் புணர்ச்சி எழுவகைப்பட்ட கிளவியாம் என்பது அறிவித்தலைக் கருதிற்று.",False
348,"நயப்பு என்பது, இயற்கைப் புணர்ச்சி புணர்ந்த தலைமகன் தலைமகள் கேட்ப விருப்புரைத் தயர்வு நீக்குதல்.",False
349,அழிவுபட ரெவ்வங் கூர ஆயிழை பழிதீர் நன்னலம் பாராட் டின்று வெண்பாமாலை .,False
350,கழுநீர்பூத் தோருருவக் காமருபூந் தொண்டை முழுநீர முத்த மரும்பியெழுநீர் இளம்பிறையுஞ் சூடி யெழிற்கமல முண்டேல் விளம்புவாய் நீவண்டே வேறு.,False
351,பிரிவுணர்த்தல் என்பது தலைவியை நீங்க நின்ற தலைவன் நின்னிற் பிரியேன் பிரியினு மாற்றேன் என்பதுபடச் சொல்லுதல்.,False
352,அதற்குச் செய்யுள் வருமாறு.,False
353,இனையல் வாழி பிரிவொன் றிலனே நனைமலர் நறும்பூங் கோதை அமையே னின்னையா னகன்ற ஞான்றே பொருளியல் .,False
354,இடமணித் தென்றல் என்பது பிரிய நினைந்த தலைமகள் இடம் அணித்தென்றல்.,False
355,"எய்துதற் கருமை யென்பது புணர்ந்து நீங்கிய தலைமகன், ஆய வெள்ளத்துட் கண்ட தலைமகளை அரியள் என்பது படச் சொல்லுதல்.",False
356,கொய்தழை அல்குல் கூட்டம் வேண்டி யெய்துதற் கருமையின் இறப்பப் புகழ்ந்தன்று வெண்பாமாலை .,False
357,மனவே ரல்குன் மடந்தை கூட்டங் கனவோ தெரியின் யாவதும் நனவே யெனினு நண்ணலோ வரிதே பொருளியல் .,False
358,உயிரென வியத்தல் என்பது தலைவியினிடத்து வைத்த ஆதரவின் மிகுதியாலே தனதுயிரென வியத்தல்.,False
359,புலனன் றென்ப வின்னுயிர் அதுவே அலர்முலை யாகந் தாங்கி நிலவொளி மதியென நிலவுமென் னுயிரே பொருளியல் .,False
360,பாங்கனை நினைதல் என்பது இவ்வகைப் பாங்கியை யுணர்ந்து ஆற்றானாகிய தலைவன் பாங்கனை நினைந்து ஆற்றுதல்.,False
361,"இவையெல்லாம், அதுவே.",False
362,தானே யவளே தமியர் காணக் காமப் புணர்ச்சி யிருவயி னொத்தல் இறையனார் களவியல் .,False
363,என்னும் இலக்கணத்துள் கண்டு கொள்க.,False
364,இயற்கைப் புணர்ச்சி முற்றும் .,False
365,பாங்கனாலாய கூட்டம் இடந்தலைப்பாடு கிளவித்தொகை .,False
366,"இச் சூத்திரம் மூன்றும் என்னுதலிற்றோ வெனின், பாங்கற் கூட்டம் பதினெட்டு வகைப்பட்ட கிளவியாம் என்ப தறிவித் தலைக் கருதிற்று.",False
367,"அவற்றுள், உற்றது வினாதல் என்பது பிரிந்த தலைமகள் வேறுபாடு கண்டு பாங்கன் வினாதல்.",False
368,முன்னினை முடிப்பதொன் றுளதுகொல் மூவகை நுண்ணிய பனுவலின் நுழைந்துகொல் என்னைகொல் வாடிய தண்ணனின் எழிலே பொருளியல் .,False
369,உற்றது உரைத்தல் என்பது உற்றது வினாவிய பாங்கனுக்குத் தலைவன் தான் உற்றது உரைத்தல்.,False
370,கழறல் என்பது தலைவனுக் குற்றது கேட்ட பாங்கன் சொல்லுதல்.,False
371,அதற்குச் செய்யுள்.,False
372,பொருந்தா தம்ம புனையிழை யரிவை முருந்தேர் முறுவல் நோக்கின் வருந்தின னென்பது பெருந்தகை பெரிதே.,False
373,பொருளியல் .,False
374,கழற்றெதிர்மறை யென்பது பாங்கன் கழறத் தலைமகன் எதிர் மறுத்தல்.,False
375,காண்குவி ராயிற் கழறலிர் மன்னோ பூண்புனை வளரிள வனமுலை மாண்குழை மாதர் மடங்கெழு நோக்கே பொருளியல்.,False
376,உளங்கவன் றுரைத்தல் என்பது தலைமகன் தனது ஆற்றாமையின் கழற்றெதிர் மறுத்துரைப்பக் கேட்ட பாங்கன் கவன்றுரைத்தது.,False
377,புலந்துறை போகிய நெஞ்சுநிறை யழிந்து கலங்குவ தாயின் மாதோ சிலம்பனை யாரோ தெளிக்குநர் பிறரே பொருளியல் .,False
378,இடம் வினாதல் என்பது உளங்கவன்றுரைத்த பாங்கன் எவ்விடத்து?,False
379,நின்னாற் காணப்பட்ட உரு?,False
380,என்று தலைவனை வினாவுதல்.,False
381,வாழ்பதி யாவது கொல்லோ வான்புகழ்ச் சூழ்கழ லண்ண னெஞ்சம் ஆழ்துய ரெய்த வணங்கிய வணங்கே பொருளியல் .,False
382,இடத்தியல் புரைத்தல் என்பது பாங்கற்குத் தலைமகன் கண்ட இடமும் வடிவும் உரைத்தல்.,False
383,முறிமேனி முத்தம் முறுவல் வெறிநாற்றம் வேலுண்கண் வேய்த்தோ ளவட்கு திருக்குறள் .,False
384,குறிவழிச் சேறல் என்பது இடத்தியல் புரைப்பக் கேட்ட பாங்கன் அவ்விட நோக்கிச் சேறல்.,False
385,இடங்கண்டு துணிதல் என்பது தலைமகன் கூறின குறிவழிச் சென்ற பாங்கன் இடத்தெதிர்ப்பட்டுத் துணிதல்.,False
386,? .,False
387,வியத்தல் என்பது குறியிடத்துச் சென்ற பாங்கன் தலைவனை வியத்தல்.,False
388,திருக்கோவையார் .,False
389,பாண்டிக் கோவை .,False
390,நிலைகூறு கிளவி என்பது பாங்கன் குறியிடத்துச் சென்று தலைமகள் நிலைமை கண்டு தலைமகற்குக் கூறுதல்.,False
391,ஆய்தளிர் பொதுளிய வீததை தண்சினைக் காய்கதிர் நுழையாக் கடிபொழில் யாவயி னோரும் விழைவுறுந் தகைத்தே பொருளியல் .,False
392,பொழில் கண்டு வியத்தல் என்பது இவ்வகை அவயவந்தெளிந்த தலைமகன் றான்புகுந்த பொழில் கண்டு வியத்தல்.,False
393,தனிமை நெஞ்சத்து முனிவுகண் ணகற்றலின் விணைமாண் பாவை யன்ன புனையிழை மாதரும் போன்றதிப் பொழிலே பொருளியல் .,False
394,திருவென உரைத்தல் என்பது பொழிலகத் தெதிர்ப்பட்ட தலைவன் தலைமகளைத் திருவென் றயிர்த்துச் சொல்லுதல்.,False
395,ஆற்றான் கிளத்தல் என்பது இவ்வகை சொல்லக் கேட்டு நாணினாற் கண் புதைத்தாளுக்குத் தலைமகன் கூறுதல்.,False
396,காவியங் கருங்கட் செவ்வாய்ப் பைந்தொடி பூவிரி சுரிமென் கூந்தலும் வேய்புரை தோளும் அணங்குமா லெம்மே பொருளியல் .,False
397,புணர்ச்சி மகிழ்தல் என்பது தலைவியை மெய் தொட்டுப் பயின்ற தலைவன் அவ்வின்பஞ் சொல்லி மகிழ்தல்.,False
398,இருத்தல் என்பது புணர்ந்து நீங்கிய தலைவன் தலைவியை ஆய்த்துய்த்துப் பிரிவாற்றாது வருந்தியிருத்தல்.,False
399,என்னுஞ் சூத்திரத்துட் கண்டு கொள்க.,False
400,பாங்கனாலாய கூட்டம் கிளவித்தொகை இடந்தலைப்பாடு முற்றும் .,False
401,தோழியாலாய கூட்டம் அ.,False
402,மதியுடம் படுத்தல் .,False
403,"என் எனின், இரந்து குறையுற்ற இடத்துக் குறையுறுதல் என்னுங் கிளவி ஒன்றாம்.",False
404,அது வருமாறு குறையுறுதல் என்பது இடந்தலைப்பட்ட தலைமகன் தழையுங்கண்ணியும் கொண்டு தோழி பின்னிலை முனியாது இரந்து நிற்றல்.,False
405,அந்தழை அல்குல் அணிநலம் புணரா வெந்துயர் பெருக வெளிப்பட இரந்தன்று வெண்பாமாலை .,False
406,என்னுஞ் சூத்திரத்துட் கண்டு கொள்க.,False
407,மதியுடம் படுத்தல் கிளவித் தொகை .,False
408,"என்னின், மதியுடம் படுத்தல் ஐவகைப்பட்ட கிளவியாம் என்பதறிவித்தலைக் கருதிற்று.",False
409,"பதிவினாதலும், வேழம் வினாதலும், கலை வினாதலும், வழி வினாதலும், வாய்மொழிக் கிரங்கலும் என.",False
410,அதற்குச் செய்யுள் வருமாறு.,False
411,வேழம் வினாதல் என்பது தலைமகளுந் தோழியும் ஓரிடத்திருப்பச் சென்று தன்குறை யறிவிப்பான் சில வேழம் போந்தனவுளவோ என்று சொல்லுதல்.,False
412,கலைவினாதல் என்பது தலைமகளுந் தோழியும் இருந்த இடத்துச் சென்று சிலமான் போந்தன உளவோ எனச் சொல்லுதல்.,False
413,அம்பு முகங் கிழித்த வெம்புண் வாய கலைமான் போந்தன உளவோநும் மடமா னோக்க மரீஇயின படர்ந்தே பொருளியல் .,False
414,வழி வினாதல் என்பது நும் ஊர்க்கு வழி சொல்லுமின் எனச் சொல்லுதல்.,False
415,உரைமின் நீர்மன் னெமக்கே வரையிடை யரும்படர்க் கவலை நீந்திப் பெருந்துய ரருப்பம் பெயர்தரு நெறியே பொருளியல் .,False
416,வாய்மொழிக்கு இரங்கல் என்பது இவ்வகை பலவும் வினாவவுரைபெறாது நின்ற தலைமகன் வருந்தல்.,False
417,என்னுஞ் சூத்திரத்துட் கண்டு கொள்க.,False
418,மதியுடன் படுத்தல் முற்றும் தோழியாலாய கூட்டக் கிளவித் தொகை .,False
419,பகற்குறி .,False
420,அவற்றுள் அயிர்த்தல் என்பது இயற்கைப் புணர்ச்சி புணர்ந்த தலைமகள் கண்சிவப்பு வேறுபாடு கண்ட தோழி அயிர்த்துரைத்தல்.,False
421,கண்ணிறைந்த காரிகைக் காம்பேர்தோட்பேதைக்குப் பெண்ணிறைந்த நீர்மை பெரிது.,False
422,திருக்குறள் .,False
423,சுனைவியந்துரைத்தல் என்பது சுனையாடினார்க்கு இந்நீர்மை பெறலாம் எனின் யானுங் குடைவேன் எனச் சொல்லுதல்.,False
424,? .,False
425,தகையணங்குறுத்தல் என்பது தலைவியை வரையணங் காகச் சொல்லுதல்.,False
426,நடுங்கநாட்டம் என்பது தலைவியை நடுங்கச் செய்து உண்மை அறிதல்.,False
427,குறையுணர்வு என்பது தலைவன் இரந்து பின்னிற்றல் எற்றிற்கு என்று தோழி உணர்தல்.,False
428,அதற்குச் செய்யுள் வருமாறு.,False
429,இருவரும் உள்வழி அவன்வர வுணர்தல் என்பது தலைமகன் சொல்வேறுபாடு கண்ட தோழி துணிந்துணர்தல்.,False
430,கரவுநாட்டம் என்பது தோழி தலைமகளையும் தலைமகனையும் நோக்கித் தன் மதியுடம் படுத்தல்.,False
431,இவையெல்லாம் முன்னுற வுணர்தல் இறையனார் அகப்பொருள் என்னு மிலக்கணத்துட் கண்டு கொள்க.,False
432,சேட்படுத்தல் என்பது இப்புனம் மிகவும் காவ லுடைத்து நீர் இயங்கன்மின் எனச் சொல்லுதல்.,False
433,தண்ணுத லரிதே தண்ணென் சாரல் எண்ணிய குறையொன் றுளதெனின் நண்ணாது முடித்தி அண்ணல் நீயே பொருளியல் .,False
434,மறையேன் என்பது தோழி தலைமகனை நின்குறை யென்னை மறையா தொழிதி எனச் சொல்லுதல்.,False
435,அதற்குச் செய்யுள் வருமாறு.,False
436,கடிகமழ் கண்ணி நெடுவரை யாயத்து வடிவே லண்ணல்நீ மறைப்பின் முடியா தாகு முன்னிய வினையே பொருளியல் .,False
437,கூறென விடுத்தல் என்பது தோழி தலைமகனை நின் குறை நீயே சென்றுரை எனச் சொல்லியது.,False
438,பொன்னியல் சுணங்கின் மென்முலை அரிவைக்கு மின்னிவ ரொளிவே லண்ணல் நின்னுறு விழுமங் கூறுமதி நீயே பொருளியல் .,False
439,அறியேன் என்றல் என்பது தோழி தலைமகனை நீ சொல்லுகின்றவளை நானறியேனெனச் சொல்லுதல்.,False
440,வாங்கிருஞ் சிலம்பில் வண்டல் அயரும் தேங்கமழ் கூந்தல் மகளிருள் யாங்கா கியதோ வேந்தநின் னருளே பொருளியல் .,False
441,? .,False
442,குலமுறை கிளத்தல் என்பது தலைமகனை நீர் உயர்ந்த குலத்துள்ளீர் நும் குலத்துக்கு ஆகோம் எனத் தோழி சொல்லுதல்.,False
443,பாண்டிக்கோவை .,False
444,திருந்தா வாழ்க்கைச் சிறுகுடி எமக்குப் பெருந்தகை அண்ண னின்னிடைப் பொருந்திய கேண்மையும் புரைவதோ வன்றே பொருளியல் .,False
