Line Number,Sentence
1,நாவலர் நாட்டார் தமிழ் உரைகள் சிலப்பதிகாரம் வஞ்சிக் காண்டம் உரையாசிரியர் நாவலர் ந.மு.வேங்கடசாமி நாட்டார் பதிப்பாசிரியர் பேராசிரியர் பி.
2,விருத்தாசலம் பதிப்பாளர் கோ.
3,"விருத்தாசலம், பதிப்பாளர் கோ."
4,இளவழகன் முதற்பதிப்பு தாள் .கி.
5,என்.எஸ்.மேப்லித்தோ அளவு தெம்மி எழுத்து புள்ளி பக்கம் நூல் கட்டமைப்பு இயல்பு சாதாரணம் விலை உருபா.
6,"படிகள் நூலாக்கம் பாவாணர் கணினி தி.நகர், சென்னை ."
7,அட்டை வடிவமைப்பு மு.
8,"இராமநாதன், வ."
9,"மலர் அச்சிட்டோர் வெங்கடேசுவரா ஆப்செட் பிரிண்டர்ஸ் ஆயிரம் விளக்கு, சென்னை ."
10,"வெளியீடு தமிழ்மண் பதிப்பகம் , சிங்காரவேலர் தெரு, தியாகராயர்நகர், சென்னை ."
11,தொ.பே.
12,அதுகாரணமாக நாட்டார் ஐயா அவர்கள் தாமே பயின்ற தமிழ்ப் பேராசான் என்று நாட்டு மக்களால் அன்புடன் அழைக்கப் பெற்றார்.
13,கல்லூரியில் இல் பணியில் சேர்ந்து வரை இருபத்து இரண்டு ஆண்டுகள் தமிழ்ப் பேராசிரியராகப் பணிபுரிந்தார்.
14,அக்கல்லூரி இல் மூடப்பெற்றது.
15,நாட்டார் ஐயா அவர்கள் தம்முடைய வாழ்நாளில் அறிஞர் பெருமக்களால் மிகுதியும் மதிக்கப்பெற்றார்.
16,மறைமலை அடிகளாரின் மகள் நீலாம்பிகை அம்மையாரின் கணவர் திருவரங்கனார் ஆவார்.
17,தொண்டை மண்டலத்தில் வாழ்ந்த குடிமக்களுள் சேக்கிழார் வழிவந்த தொண்டை மண்டல முதலியார்கள் இன்றைக்கும் பெருஞ்சிறப்புடன் வாழ்ந்து வருகின்றனர்.
18,இல் சென்னை மாகாணத் தமிழர் மாநாட்டில் நாட்டார் ஐயா அவர்களுக்கு நாவலர் என்னும் பட்டம் வழங்கப்பெற்றது.
19,அக்கோயில் நாட்டார் திருக்கோயில் என்று தமிழன்பர்களால் பெருமையுடன் அழைக்கப் பெறுகின்றது.
20,"இவ்வாறு நாட்டார் ஐயா அவர்கள் இல் நிறுவ விரும்பிய திருவருள் கல்லூரி, ஆண்டுகள் கழிந்ததற்குப் பிறகு நாவலர் ந.மு."
21,"அவை, பின்வருமாறு ."
22,திரிகடுகம் ந.மு.வே.உரை .
23,மணிமேகலை வரலாறு .
24,தொல்காப்பிய ஆராய்ச்சிச் சொற்பொழிவுகள் .
25,நாவலர் நாட்டார் நாட்குறிப்பு முதலியனவாம்.
26,"இவ்வாறு, நாட்டார் ஐயா அவர்கள் எழுதிய நூல்கள் வெளிவந்த ஆண்டுகளைப் பற்றிய விவரம் வருமாறு ."
27,வேளிர் வரலாற்று ஆராய்ச்சி .
28,நக்கீரர் .
29,கபிலர் .
30,கள்ளர் சரித்திரம் .
31,இன்னா நாற்பது .
32,களவழி நாற்பது .
33,கார் நாற்பது .
34,ஆத்திசூடி .
35,கொன்றை வேந்தன் .
36,வெற்றி வேற்கை .
37,மூதுரை .
38,நல்வழி .
39,நன்னெறி .
40,கண்ணகி வரலாறும் கற்பு மாண்பும் .
41,சோழர் சரித்திரம் .
42,பரஞ்சோதி முனிவர் திருவிளையாடல் புராண உரை .
43,அகத்தியர் தேவாரத் திரட்டு உரைத்திருத்தம் .
44,தண்டியலங்காரப் பழைய உரைத்திருத்தம் யாப்பருங்கலக்காரிகை உரைத்திருத்தம் .
45,கட்டுரைத் திரட்டு முதல் தொகுதி .
46,சிலப்பதிகார உரை .
47,மணிமேகலை உரை .
48,அகநானூறு உரை .
49,கட்டுரைத் திரட்டு இரண்டாம் தொகுதி .
50,நாவலர் ந.மு.வேங்கடசாமி நாட்டார் இலக்கணக் கட்டுரைகள் .
51,நாவலர் ந.மு.வேங்கடசாமி நாட்டார் இலக்கியக் கட்டுரைகள் .
52,நாவலர் ந.மு.வேங்கடசாமி நாட்டார் சொற்பொழிவுக் கட்டுரைகள் .
53,"இராகவன், பன்மொழிப்புலவர் கா."
54,அப்பாத்துரையார் முதலிய தமிழறிஞர்களின் நூல்கள் மற்றும் தொல்காப்பிய பழைய உரைகள் அனைத்தையும் முழுமையாக வெளியிட்ட பெருமைக்குரியவர்.
55,அவர் இப்பொழுது நாட்டார் ஐயா அவர்களின் நூல்கள் அனைத்தையும் ஒரு சேர வெளியிடுவது மிகவும் துணிவான செயல் ஆகும்.
56,அவரது இந்த முயற்சி இமயமலையைப் பெயர்த்தெடுத்துக் கொண்டுபோய் வங்காள விரிகுடாவில் வைப்பது போன்ற அரிய பெரிய முயற்சி ஆகும்.
57,"அவர் வாழ்க, அவர் முயற்சி வெல்க என்று நான் வாயார மனமார வாழ்த்துகின்றேன்."
58,".. பேராசிரியர் பி.விருத்தாசலம் நிறுவனர் நாவலர் ந.மு.வேங்கடசாமி நாட்டார் திருவருள் கல்லூரி, கபிலர் நகர், வெண்ணாற்றங்கரை, தஞ்சாவூர் ."
59,தொ.பேசி அணிந்துரை தமிழர்க்கு வாய்த்துள்ள முதல் பெருங்காப்பியம் சிலப்பதிகாரம்.
60,"தண்டியலங்காரம் என்னும் அணியிலக்கணநூல், காப்பியநூல் அமைதியை அருமையாகக் கூறுகிறது."
61,சிலம்பு அணிகலப் பெயர்.
62,அப்பெயர் ஒலியால் பெற்றது..
63,சிலம்புதல் ஒலித்தல்.
64,"சிலம்பு, மலையின் பெயர்களுள் ஒன்று பல்வகை ஒலிகளைத் தன்னகத் துடைமையை அன்றித் தன் எதிரொலியால் பெற்ற பெயரதும் அது."
65,"சிலம்பு, தமிழரின் வீரப் போர் விளையாடல்களுள் ஒன்று."
66,கம்பும் கம்பும் மோதுதலால் பெற்ற ஒலிப் பெயர் அது.
67,வான்குருவியின் கூடு வல்லரக்குத்தொல் கறையான் தேன் சிலம்பி யாவர்க்கும் செய்யரிதால் என்பது ஒளவையார் தனிப்பாடல்களுள் ஒன்று.
68,தினைச் சிலம்புவ தீஞ்சொல் இளங்கிளி என்னும் பாடற்செய்தி இது.
69,"சிலம்பரசன், சிலம்பரசி, சிலம்பாயி இன்னவை சிலம்பொடு கூடிய பெறலரும் பெயர்கள்!"
70,அம் பொற்சிலம்பி அரவிந்தத் தாளணியும் செம்பொற் சிலம்பே சிலம்பு என்பதும் புகழ்வாய்ந்த தனிப்பாடலின் பின்னிரண்டடிகள்.
71,அழகர் மலையில் வீழ்ந்ததோர் ஆறு அருவியும் ஆயது.
72,"அது, நிலம்பக வீழ்ந்த சிலம்பாறு எனப்பட்டது."
73,"இரும்பு இருப்பு, செம்பு செப்பு என மக்கள் வழக்கில் வருவது போலச் சிலம்பு, சிலப்பு ஆனதும் இல்லை."
74,"வலியா வழி வலித்தல் என ஆக்கவா, அடிகள் சிலப்பதிகாரம் எனப் பெயரிட்டார்?"
75,"அல்லது, சிலம்பு சிலப்பு என வலித்தல் விகாரம் பெற்றது என்று, இலக்கணவாணர் சொல்லிக் கொள்வதற்காகவோ பெயரிட்டார்?"
76,"ஏதோ ஒரு பாரிய நோக்கு இருந்தால் அன்றிச், சிலம்பைச் சிலப்பு ஆக்கி நெற்றிச் சூடு போட்டிருக்கமாட்டார்?"
77,சிலம்பு திருடியவன் என்று திருட்டறியா ஒருவன் கொல்லப்பட்டானே!
78,"அவனை இழந்தாள் அவல அரற்றால், அரசனும் அரசியும் அவலப்பட்டனரே!"
79,"அடைக்கலம் இழந்தேன், இடைக்குல மக்காள் என மாதரி எரிபாய்ந்து இறந்தனளே!"
80,மதுரைக்குத் தாயாய்த் தாங்கி வந்த காவுந்தி ஐயை உண்ணா நோன்பு இருந்து உயிர் நீத்தனரே!
81,"அவலச் செய்தி, மாடலன் வழியே அறிந்த கோவலன் தாயும், கண்ணகி தாயும் பெரும் பிறிது உற்றனரே!"
82,"கோவலன் தந்தையும், கண்ணகி தந்தையும் துறவு பூண்டனரே!"
83,இன்றும் என்ன!
84,"ஆயிரம் பொற் கொல்லர் கண்ணகியார் அமைதியுற வேண்டி, ஆடு மாடு கோழி என உயிர்ப்பலி ஊட்டினரே!"
85,"ஏன், இவ்விளக்கம்?"
86,நூலாசிரியன் நுண்ணோக்கு அறிந்தார் அறிந்து உரை காண வல்லார் அருமை சுட்டுதற்கேயாம்!
87,தமிழ்வள உரைப்பரப்பில் மூவர்க்குத் தனிச்சிறப்பாம் இடம் உண்டு.
88,"அம்மூவர் அடியார்க்கு நல்லார், யாப்பருங்கல விருத்தியார், நச்சினார்க்கினியர் என்பார்."
89,முக்கடல் அன்ன முத்தமிழ் விளக்கப் பேருரைஞர் இம்மூவர்.
90,இச் சிலப்பதிகாரத்திற்கு முதற்கண் நமக்கு வாய்த்தது அரும்பொருள் உரையாம்.
91,அவ்வுரையை முழுதுற ஏற்று நடை யிடுவது அடியார்க்கு நல்லார் உரை.
92,அவ்வடியார்க்கு நல்லாரின் பாரித்த உரைதானும் நமக்கு முழுவதாகக் கிடைத்திலது.
93,அடியார்க்கு நல்லார் உரைவளம் நலம் பெறுதற்கு ஊற்றுக் கண்ணாக இருந்தவர் பொப்பண்ண காங்கேயர் என்பார்.
94,இதனை உரைச் சிறப்புப் பாயிரம் சுட்டுகின்றது.
95,காற்றைப் பிடித்து என்னும் பாட்டு அது.
96,"இக் காங்கேயன், ஈழத்துக் காங்கேயன் துறையினர் என்பதை விளக்கும் நூல், அடியார்க்கு நல்லார் என்னும் அரிய ஆய்வு நூலாகும்."
97,"இப்புத்துரைப் பதிப்பில் தானும் திருந்த வேண்டும் இடங்களும் உண்டு என்பதற்கு, ஒரு சான்று காட்டுவோம்."
98,வாழ்த்துக் காதையில் வள்ளைப் பாட்டு மூன்றுள.
99,"அவற்றுள் இரண்டாம் பாடல் பாண்டியன் மாலையாம் வேப்பந்தாரும், மூன்றாம் பாடல் சேரன் மாலையாம் பனந்தோடும் சுட்டப் படுகின்றன."
100,முதற்பாடல் சோழனைப் பற்றியது.
101,அதில் முறைப்படி சோழன் மாலையாம் ஆர் இடம் பெற்றிருக்க வேண்டும்.
102,ஆர் ஆத்தி.
103,போந்தை வேம்பே ஆரென வரூஉம் மாபெருந் தானையர் மலைந்த பூவும் என்பது தொல்காப்பியம்.
104,சென்னைப் பல்கலைக்கழக அகராதியிலும் அச்சொல் அப்பொருள் காட்டுவதாயிற்று.
105,"இதனை, அகராதி நினைவுகள் என்னும் தம் சுவடியில், வையாபுரியார் சுட்டிக் காட்டினார்."
106,"ஆயினும், உ.வே.சா."
107,"அவர்களின் பதிப்புகளிலும், புதுப்பதிப்பாம் இப்பதிப்பிலும் ஏறிற்றில்லை."
108,எம் கைவயம் இருந்து இதுகால் திராவிடப் பல்கலைக் கழக ஆய்வுச் சுவடியாக உள்ள எ.ஆ.
109,கிருட்டிண பிள்ளை அவர்கள் எழுத்துப்படியில் ஆர் இரக்கும் என்றே உள்ளமை சுட்டத்தக்கதாம்.
110,சுவடிக்கலை என்னும் எம் நூலில் இது விளக்கம் பெற்றது.
111,வடசொற்களை முன்னை ஆசிரியர் ஆண்டிருப்பின் தமிழாக்கச் சொல்லைச் சுட்டிச் செல்லுதல் இவ்வுரைச் சிறப்பாம்.
112,முந்தையர் உரைவாய்க்காத பன்னிரு பகுதிகளுக்கும் புத்துரைகண்டு பொலிவுறுத்துகிறார் நாவலர்.
113,அவர்தம் உரைநடை ஆற்றொழுக்கென அமைந்து தூய ஆழ்ந்த நீருள் மின்னும் பொன்னெனப் பொலிகின்றது.
114,நாவலர்தம் பேரருள் உள்ளம் ஓரிடத்து அவர் செய்யும் விளக்கக் குறிப்பால் புலப்படும்.
115,எடுத்துக் காட்டாம் எழிலினது அது.
116,"ஆயிரம் பொற்கொல்லரைக் கொன்றமை, உரைபெறு கட்டுரையாலும், உரையாசிரியர்களாலும் சுட்டப்படுகின்றது."
117,காப்பியம் குறிப்பிடும் செய்தியைச் சங்கநூல் பரப்பை அன்றி பின்னூல்கள் கொண்டும் தெளிவிக்கிறார்.
118,சொல் விளக்க நுணுக்கங்களைத் தெள்ளத் தெளியவும் சுருங்கவும் அமைக்கிறார்.
119,"நாவலர் பெருமகனார் உரைத் திறநயம் குறித்து, முனைவர் அ.ஆறுமுகம் அவர்கள் தனி ஒருநூல் யாத்துளார்."
120,.அதனைக் கற்றல் நலமிகச் செய்வதாம்.
121,"வ.சுப்பையா பிள்ளை பேருதவியாலும் வெளிப்பட்டுப், பல்வேறு பதிப்புகளைக் கண்டது."
122,"இதுகால் பெருமக்கள் அறிவாக்கம் நாட்டுடைமைப் பொருளாக்கப்படுதல் என்னும் நன்னோக்கால், பொதுமை பூத்துப் பொலியும் வளமாக வெளிப்படுகிறது."
123,"அவ்வெளிப்பாட்டைச் செய்பவர், தமிழ்மண் பதிப்பக உரிமையாளர் திருமலி கோ.இளவழகனார்."
124,"தமிழ்மண், தமிழ்மொழி, தமிழ் இனம் என்னும் முக்காவல் கடனும் முறையாக ஆக்குவதே நோக்காகக் கொண்டவர் இப்பெருமகனார்!"
125,"நாவலர் தம் முழுதுறு படைப்புகளையும் தமிழுலகம் கூட்டுண்ண வழங்கும் இத்தோன்றல், தொண்டு வழிவழிச் சிறப்பதாக!"
126,இன்ப அன்புடன் இரா.
127,"இளங்குமரன் திருவள்ளுவர் தவச் சாலை திருவளர்குடி அஞ்சல் அல்லூர், திருச்சிராப்பள்ளி தொ.பே."
128,நல்ல தமிழ் நூல்களைத் தமிழர்களுக்கு அளிக்கும் போதெல்லாம் எனக்குப் புத்துணர்ச்சியும் பெருமகிழ்வும் ஏற்படுகின்றன.
129,பதிப்புத் துறையில் துறைதோறும் மேலும் பல ஆக்கப் பணிகளைச் செய்ய உறுதி கொள்கிறேன்.
130,தமிழ்நூல் பதிப்பில் எம் பதிப்பகம் இதுகாறும் ஆற்றிய தமிழ்ப் பணியை எண்ணிப் பார்க்கிறேன்.
131,நெஞ்சில் ஒரு நிறைவு.
132,இனிச் செய்ய வேண்டிய பணியை எண்ணிப் பார்க்கிறேன்.
133,"எனவே, முன்னிலும் வேகமாக என் பதிப்புப் பணிகளைத் தொடர்கின்றேன்."
134,தொண்டு செய்வாய்!
135,தமிழுக்கு.....
136,", செயல் செய்வாய் தமிழுக்கு......"
137,",ஊழியஞ் செய் தமிழுக்கு ......., பணி செய்வாய்!"
138,"தமிழுக்கு ........, இதுதான் நீ செயத் தக்க எப்பணிக்கும் முதல் பணியாம்."
139,நாட்டார் யார்?
140,"ஆம் நூற்றாண்டின் பிற்பகுதியிலும், ஆம் நூற்றாண்டின் முற்பகுதியிலும் தமிழ்த் தேரை இழுத்த பெருமக்களுள் நாவலர் ந.மு.வே."
141,நாட்டார் திருவருள் கல்லூரியின் நிறுவனர் பேராசிரியர் பி.விருத்தாசலனார் ஆவார்.
142,அவர் கெடல்எங்கே தமிழின்நலம் அங்கெல்லாம் தலையிட்டுக் கிளர்ச்சி செய்க!
143,எனும் பாவேந்தர் வரிகளுக்கு நம்மிடையே இன்று சாட்சியாக வாழ்ந்து கொண்டிருப்பவர் வாழும் தமிழறிஞர்களில் நான் வணங்கும் சான்றோருள் ஒருவர்.
144,குமுகாய மாற்றத்துக்கு அடிப்படையானது தாய்மொழி வழிக் கல்வி ஒன்றுதான்.
145,இக்கல்விதான் மக்களுக்கு ஊற்றுக் கண்.
146,"தாய்மொழியைப் புறக்கணித்த எந்த இனமும் , எந்த நாடும், வளர்ந்ததாகவோ, வாழ்ந்ததாகவோ, செழித்ததாகவோ வரலாறு இல்லை."
147,பழந்தமிழ்க் கருவூலமான நாட்டாரின் இவ்வருந்தமிழ்ப் புதையல்கள் தமிழர்கள் இல்லந்தோறும் இருப்பதற்கு உங்களின் பங்களிப்பையும் செய்ய முன் வாருங்கள்.
148,"மொழி, இன நாட்டின் அடையாளங்களை மீட்டெடுக்கும் எம் தமிழ்ப் பணிக்குக் கைகொடுத்து உதவுங்கள்."
149,இந் நூல்கள் அனைத்தும் தமிழ் மக்கள் உள்ளங்களிலும் இல்லங்களிலும் வைத்துப் போற்றத் தக்க பாதுக்காக்கத்தக்க கருவூலங்கள் ஆகும்.
