Line Number,Sentence
1,தமிழமுது மறு பதிப்பு தாள் . கி.,False
2,மேப்லித்தோ அளவு தெம்மி பக்கம் படிகள் விலை உரு.,False
3,நூலாக்கம் டெலிபாய்ண்ட் சென்னை .,False
4,அட்டை வடிவமைப்பு வி.,False
5,"சித்ரா அச்சு வெங்கடேசுவரா ஆப்செட் பிரிண்டர் இராயப்பேட்டை, சென்னை .",False
6,"பதிப்புரை ஆம் நூற்றாண்டின் இறுதிப்பகுதியும், ஆம் நூற்றாண்டின் தொடக்கப்பகுதியும் தமிழ்ப்புலமையும் தமிழாய்வும் மேலோங்கி வளர்ந்த பொற்காலமாகும்.",False
7,இப் பொற்காலப் பகுதியில்தான் தமிழ்ப்பேரவைச் செம்மல் பெருந்தமிழறிஞர் க.,False
8,வெள்ளைவாரணனார் தோன்றி வளர்ந்து வாழ்ந்து தாய்மொழித் தமிழுக்கு வளமும் வலிமையும் சேர்த்தார்.,False
9,கைக்குக் கிடைக்கப் பெறாத நூல்களைத் தேடியெடுத்து இனிவரும் காலங்களில் வெளியிட முயல்வோம்.,False
10,"தம்முடைய தமிழாய்வுப்பணி மூலம் தமிழ் வரலாற்றில் நிலைத்து நிற்பவர், தமிழையும் சைவத்தையும் இரு கண்களெனக் கொண்டவர்.",False
11,தம் ஆய்வுப் புலமையால் பல புதிய செய்திகளையும் தமிழ் உலகுக்கு அளித்தவர்.,False
12,இவர் எழுதிய நூல்கள் தமிழ்உலகிற்குப் பெருமை சேர்ப்பன.,False
13,தமிழ் இலக்கிய வரலாற்றிற்கு கூடுதல் வரவாக அமைவன.,False
14,இவருடைய அறிவுச் செல்வங்கள னைத்தையும் ஆவணப்படுத்தும் நோக்குடன் தொகுத்து தமிழ் உலகிற்கு வைப்பாகக் கொடுத்துள்ளோம்.,False
15,எம் தமிழ்க் காப்புப் பணிக்கு துணை நிற்க வேண்டுகிறோம்.,False
16,பதிப்பகத்தார் தமிழ்ப்பதிப்பு முன்னோடிகளை வணங்குவோம்!,False
17,தமிழாராய்ச்சியின் வளர்ச்சியில் புதிய போக்குகளை உண்டாக்கிய பெருமைக்குரியவர்கள் பழந்தமிழ் நூல்களைப் பதிப்பித்த அறிஞர் களேயாவர்.,False
18,"மேலை நாட்டார் வருகையினால் தோன்றிய அச்சியந்திர வசதிகளும், கல்வி மறுமலர்ச்சியும் புதிய நூலாக்கங்களுக்கு வழி வகுத்தன.",False
19,ஆறுமுக நாவலர் சி.வை.,False
20,"தாமோதரம் பிள்ளை , உ.வே.",False
21,"சாமிநாதையர் ஆகியோர் தமிழ்ப்பதிப்பு முன்னோடிகளாய் விளங்கித் தமிழுக்கு வளம் சேர்த்தனர் என்று தமிழ்ப் பல்கலைக்கழகத்தின் மேனாள் துணைவேந்தர், இ.",False
22,சுந்தரமூர்த்தி தனது பதிப்பியல் சிந்தனைகள் எனும் நூலில் பதிவு செய்துள்ளார்.,False
23,இந்நூல் தொகுதிகளை வெளியிடுவதன் மூலம் தமிழ்ப்பதிப்பு முன்னோடிகளை வணங்குவோம்.,False
24,ஐங்குறுநூறு கலி.,False
25,கலித்தொகை கானல்.,False
26,கனால்வரி கிளவி கிளவியாக்கம் குறள்.,False
27,திருக்குறள் குறுந்.,False
28,குறுந்தொகை சிலப்.,False
29,சிலப்பதிகாரம் சிறுபாண்.,False
30,சிறுபாணாற்றுப்படை செய்.,False
31,செய்யுளியல் சொல்.,False
32,சொல்லதிகாரம் தண்டியலங்.,False
33,தண்டியலங்காரம் திருமுரு.,False
34,திருமுருகாற்றுப்படை தொல் தொல்காப்பியம் நச்.,False
35,நச்சினார்க்கினியர் நற்.,False
36,நற்றிணை நாலடி.,False
37,நாலடியார் பக்.,False
38,பக்கம் பட்டினப்.,False
39,பட்டினப்பாலை பத்து.,False
40,பத்துப்பாட்டு பதிற்.,False
41,பதிற்றுப்பத்து பரிபா.,False
42,பரிபாடல் பா.,False
43,பாடல் பா.வே.,False
44,பாட வேறுபாடு புறம்.,False
45,"புறநானூறு பெரும்பாண் பெரும்பாணற்றுப்படை ., பொரு நராற்றுப்படை பொருள்.",False
46,பொருளதிகாரம் மணிமே.,False
47,மணிமேகலை மலைபடு.,False
48,மலைபடுகடாம் முத்தொள்.,False
49,"முத்தொள்ளாயிரம் தொல்காப்பியம் உவமையியல் தொல்காப்பியம் பொருளதிகாரம் உவமையியல் இவ்வோத்து என்ன பெயர்த்தோ எனின், உவமை யியல் என்னும் பெயர்த்து.",False
50,ஒருபுடை ஒப்புமை பற்றி யுவமை உணர்த்தினமையாற் பெற்ற பெயர்.,False
51,தாமரை போல் வாள்முகத்துத் தையலீர் என்றவழி அலங்காரமாகிக் கேட்டார்க்கு இன்பம் பயக்கும்.,False
52,"அஃதாவது மேற்சொல்லப்பட்ட எழுதிணையினும் யாதனுள் அடங்கும் எனின், அவையெல்லாவற்றிற்கும் பொதுவாகிப் பெரும்பான்மையும் அகப்பொருள் பற்றி வரும்.",False
53,மேற்குறிப்புப் பற்றி வரும் மெய்ப்பாடு கூறினார் இது பண்புந் தொழிலும் பற்றி வருதலின் அதன்பின் கூறப்பட்டது.,False
54,வினைபயன் மெய்உரு என்ற நான்கே வகைபெற வந்த உவமைத் தோற்றம் என்பது சூத்திரம்.,False
55,"இளம்பூரணம் இதன் தலைச்சூத்திரம் என்னுதலிற்றோ வெனின், உவமத் தினை யொருவாற்றாற் பாகுபாடு உணர்த்துதல் நுதலிற்று.",False
56,எனவே கட்புலமல்லாதனவு முள என்றவாறாம்.,False
57,அவை செவி யினானும் நாவினானும் மூக்கினானும் மெய்யினானும் மனத்தினானும் அறியப்படுவன.,False
58,இவ்விருவகையும் பாகுபடவந்த உவமையாம்.,False
59,"அவற்றுட், கட்புலனாகியவற்றுள் வினையாவது நீட்டல், முடக்கல் விரித்தல், குவித்தல் முதலாயின.",False
60,"பயனாவது நன்மையாகவும், தீமையாகவும் பயப்பன.",False
61,"வடிவாவது வட்டம், சதுரம், கோணம் முதலாயின.",False
62,"நிறமாவன வெண்மை, பொன்மை முதலாயின.",False
63,இனிச்செவிப்புலனாவது ஓசை.,False
64,"நாவினான் அறியப்படுவது கைப்பு, கார்ப்பு முதலிய சுவை மெய்யினான் அறியப்படுவன வெம்மை தண்மை முதலாயின.",False
65,"மூக்கால் அறியப்படுவன நன்னாற்றம், தீநாற்றம்.",False
66,மனத்தால் அறியப்படுவன இன்ப துன்ப முதலியன.,False
67,உதாரணம் புலிபோலப் பாய்ந்தான் என்பது வினை.,False
68,மாரி யன்ன வண்கை புறம்.,False
69,என்பது பயன்.,False
70,துடி போலும் இடை என்பது வடிவு.,False
71,தளிர் போலும் மேனி என்பது நிறம்.,False
72,குயில்போன்ற மொழி செவியாலறியப்பட்டது.,False
73,வேம்புபோலக் கைக்கும் நாவினாலறியப்பட்டது.,False
74,தீப்போலச் சுடும் மெய்யினாலறியப்பட்டது.,False
75,ஆம்பல் நாறுந் துவர்வாய் குறுந்.,False
76,தம்பி லிருந்து தமதுபாத் துண்டற்றால் அம்மா அரிவை முயக்கு குறள்.,False
77,பிறவு மன்ன.,False
78,"பேராசிரியம் இவ்வோத்து என்ன பெயர்த்தோவெனின், உவமவியல் என்னும் பெயர்த்து.",False
79,உவமம் என்பது ஒரு பொருளோடு ஒரு பொருளினை ஒப்புமை கூறுதல்.,False
80,இதனானே இவ்வோத்து நுதலியதூஉம் உவமப்பொருளே கூறுதலாயிற்று.,False
81,"மற்று அகம்புறம் என்பனவற்றுள், இஃது என்ன பொருள் எனப்படுமோவெனின், அவ்விரண்டுமெனப்படும் மெய்ப்பாடுபோல என்பது.",False
82,"உவமப் பொருளி னுற்ற துணருந் தெளிமருங் குளவே திறத்திய லான தொல், பொருள்.",False
83,என மேல்வருகின்றதாகலின்.,False
84,"மற்றிவ்விருதிணைப் பொருளும் உவமம்பற்றி வழக்கினுள் அறியப்படுதலானும், உவமம்பற்றியும் பொருள் கூறுகின்றானென்பது.",False
85,மேல் அகத்திணையியலுள் உவமத்தினை இரண்டாக்கி ஓதினான் உள்ளுறையுவமம் ஏனையுவமமென.,False
86,அது செய்யுட்குரித்தென்னுங் கருத்தானென்பது.,False
87,"எனவே, எழுத்தினுஞ் சொல்லினும் போலச் செய்யுட்குரியன செய்யுட்கென்றே ஓதலும் ஒருவகையாற் பெற்றாம்.",False
88,மற்றிது மேல் எவ்வோத்தினோடு இயைபுடைத்தோவெனின்.,False
89,மேற்பொருள் புலப்பாடு கூறிய மெய்ப்பாட்டியலொடு இயைபுடைத்து என்னை?,False
90,உவமத்தானும் பொருள் புலப்பாடே கூறுகின்றனாகலின்.,False
91,"இ ள். தொழிலும், பயனும், வடிவும் வண்ணமும் என்னும் நான்கெனப்படுங் கூறுபட வரும் உவமத்தோற்றம்.",False
92,"உவமம் என்பதனை வினைமுதலாகிய நான்கினொடுங் கூட்டி வினையுவமம், பயனுவமம், மெய்யுவமம், உருவுவமமெனப் பெயர் கூறப்படும்.",False
93,மற்று மெய்யெனப்படுவது பொருளாதலின்.,False
94,அது புலிமறவன் எனத் தொகாது புலியன்ன மறவன் என விரிந்தே நிற்றலும்.,False
95,புலிப்பாய்த்துள் எனத் தொக்கு வருதலும் உடைத் தென்பது.,False
96,மாரி யன்ன வண்கைத் தேர்வே ளாயைக் காணிய சென்மே புறம்.,False
97,என்பது பயவுவமம் என்னை?,False
98,மாரியான் விளைக்கப்படும் பொருளும் வண்கையாற் பெறும் பொருளும் ஒக்குமென்றவாறு.,False
99,துடியிடை யென்பது மெய்யுவமம் அல்குலும் ஆகமும் அகன்றுகாட்ட அஃகித்தோன்றும் மருங்குலால் துடி அதனோடு ஒத்தத.,False
100,"பொன்மேனி யென்பது உருவுவமம் பொன்னின்கண்ணும் மேனியின் கண்ணுங் கிடந்த நிறமே ஒத்தன, பிற ஒத்தில வென்பது.",False
101,இந்நான்கும் பற்றி உவமந் தோன்றுமென்பது கருத்து.,False
102,உவமத் தோற்றம் என்பது மூன்றாவதன் தொகை உவமத்தாற் பொருள் தோன்றுந் தோற்றமென்றவாறு. மற்றுஅடைசினைமுதல் தொல்.,False
103,அல்லாக்காற் பகற் குறிக்கட் கூறப்படும் வண்ணம் முதலாயினவும் இரவுக் குறிக்கண் எய்துவான் சொல்லும் வடிவும் பண்பும் ஒன்றாகக் கூறினானென்பது.,False
104,"அல்லதூஉம், உணர்த்துகின்ற திணைப்பொருளினை எளிதிற் புலப்படுத்தலுபகாரம் நோக்கியும் அவ்வாறு பகுத்தா னென்பது.",False
105,களிற்றிரை தெரீஇய பார்வ லொதுக்கின் ஒளித்தியங்கு மரபின் வயப்புலி போல அகம்.,False
106,என்புழிப் பார்வலொதுக்கமாகிய வினை பண்பெனப்படாது.,False
107,பண்பென்பது குறிப்பின்றி நிகழுங் குணமாகலினென்பது.,False
108,அடையெனினும் அதுவேயெனக் கூறி மறுக்க.,False
109,மாரி யன்ன வண்கை புறம்.,False
110,என்பதூஉம் பண்பாயின்.,False
111,அதன் நிறத்து மேற்கொண்டு வண்மையுங் கரிதெனல் வேண்டுமாகலின் அது பண்பென அடங்காது.,False
112,அணைத்தோள் கலி.,False
113,என்பதும் அது.,False
114,உருவுகிள ரோவினைப் பொலிந்த பாவை யியல்கற் றன்ன வொதுக்கினள் அகம்.,False
115,"என்றக்கால், வடிவுபற்றி உவமங்கொள்ளவே, உயிரில்லாதாள் போல, அச்சமின்றி, இரவிடை வந்தாளென்னும் பொருள் தோன்றும்.",False
116,வடிவு பண்பெனப்படாது பண்பு இழிபாகலின்.,False
117,மாரிப் பீரத் தலர்சில கொண்டே குறுந்.,False
118,"காட்டி, இன்ன ளாயின ணன்னுதல் குறுந்.",False
119,"என்றவழிக், குறித்த பருவங் கழிந்ததென்னும் பொருண்மை விளங்கிற்று.",False
120,உருவுவமம் இவ்வாறு பொருளுணர்த்துதற் பகுதி நோக்கி உவமப்பகுதி யென்றான் என்பது.,False
121,பறைக்குர லெழிலி அகம்.,False
122,கடைக்கண்ணாற் கொல்வான்போனோக்கி கலி.,False
123,என்பதூஉம் தன் வகை.,False
124,வந்த என்றதனான் இல்லாத வினை வருவிததுஞ் சொல்லப் படும்.,False
125,"அவை, விசும்புரி வதுபோல அகம்.",False
126,மணிவாழ் பாவை நடைகற் றன்ன நற்.,False
127,"வான்றோய் வன்ன குடிமையும் பாயிரம் இவை, உவமையும் பொருளும் ஆகிய வினைபற்றி வந்தில வாகலின் அதன் வகையெனப்பட்டன.",False
128,"அன்ன, ஆங்க என் பன இடைச்சொல்லாகலின் வினைப்பின்னும் வந்தன.",False
129,நடைகற்றன்ன என்புழிக் கற்று என்னும் வினையெச்சந் தன்னெச்சவினை இகந்த தாயினும் அஃது உவமப்பகுதியாகலான் அங்ஙனம் வருதலும் வகையென்றதனானே கொள்ளப்படும்.,False
130,கொன்றன்ன வின்னா செயினும் குறள்.,False
131,என்பதும் அது.,False
132,இணரெரி தோய்வன்ன வின்னா செயினும் குறள்.,False
133,என்பது வினைப்பெயர்பற்றி உவமஞ் சென்றது.,False
134,பொன்மரம் போலக் கொடுக்கு மென்பது பயவுவமத்தின் பகுதியாய் அடங்கும் என்னை?,False
135,குணமாத லொப்புமையான் அவை நிறப்பண்பிற்கு இனமெனவும் படும்.,False
136,அவ்வாறு திரிபுடைமையின் அவற்றை விதந்தோதாது வகை யென்றதனாற் கொண்டானென்பது. தளிர்சிவந் தாங்குச் சிவந்தமேனி யென்பது உருவுவமத்தின் வகையெனப்படும் என்னை?,False
137,உவமத்தாற் கொள்ளப்பட்ட பொருள் நிறமாயினும் அதனை வினை விரித்தாங்கு விரித்தமையின் அவ்வேறுபாடு நோக்கி வகை யெனப்பட்டது.,False
138,பிறவும் அவ்வாறே கொள்க.,False
139,இப்பகுதியுடைமை நோக்கி வகைபெறவந்த என்றானென்பது.,False
140,இவ்வாறு பிறி தொன்றினை ஒப்புமையாக எடுத்துக்காட்டித் தான் சொல்லக்கருதிய பொருளின் இயல்பினை விளக்குவதே உவமம் எனப்படும்.,False
141,"இவ்வுவமத்தினைக் கருவியாகக் கொண்டே இருதிணைப் பொருள்களும் உலகவழக்கினுள் நன்கு உணர்த்தப்பெற்று வருதல், காணலாம்.",False
142,அதனால் இஃது உவமவியல் என்னும் பெயர்த்தாயிற்று.,False
143,இவ்வியலிலுள்ள சூத்திரங்களை இளம்பூரணர் முப்பத்தெட்டாகவும் பேராசிரியர் முப்பத்தேழாகவும் பகுத்து உரை வரைந்துள்ளார்கள்.,False
144,"பொருள், உவமம் என்னும் இவ்விரண்டினையும் முறையே உவமேயம் என்றும் உபமானம் என்றும் வழங்குவர் வடநூலார்.",False
145,"உவமமும் பொருளும் ஆகிய இவ்விரண்டின்கண்ணும் வண்ணம், வடிவு, தொழில், பயன் என்பனபற்றியமைந்த ஒப்புத்தன்மை பொதுத்தன்மை யெனப்படும்.",False
146,இவ்வாறு உவமமும் பொருளும் அவற்றிடையே யமைந்த பொதுத்தன்மையும் ஆகிய இவை இன்னவென வெளிப்படையாக உணர்தற்கேற்ற சொல்லமைப்பினையுடையது ஏனையுவமம் எனப்படும்.,False
147,இஃது உவமத்தின் பாகுபாடு உணர்த்துகின்றது.,False
148,"இதன்பொருள் உவமத்தாற் பொருள்தோன்றும் தோற்றம் வினை, பயன், மெய், உரு என நால்வகைப்படும் என்றவாறு.",False
149,வினையாற் கிடைப்பது பயனாதலின் வினையின் பின்னர்ப் பயனும்.,False
150,மெய்யின்கண் புலப்பட்டுத் தோன்றுவது நிறமாதலின் மெய்யின்பின்னர் உருவும் முறையேவைக்கப்பட்டன.,False
151,மெய்யாகிய வடிவினை இருப்பொழுதிலும் கையினால் தொட்டறிதல் கூடும் வண்ணமாயின் அவ்வாறு தொட்டறிந்து கொள்ளுதல் இயலாது.,False
