Line Number,Sentence
5576,புகுமுகம் புரிதல் பொறிநுதல் வியர்த்தல் நகுநயம் மறைத்தல் சிதைவுபிறர்க் கின்மையொடு தகுமுறை நான்கே ஒன்றென மொழிப.
5577,இதுகாறும் அகத்திணைக்கும் புறத்திணைக்கும் பொதுவாகி வரும் மெய்ப்பாடு கூறினார்.
5578,இவை நிகழுமிடங்கள் களவியலில் அங்கங்கே காட்டப்பட் டுள்ளன.
5579,இச்சூத்திரத்து முதற்பகுதி கூறுகின்றார்.
5580,இ ள் புகுமுகம் புரிதல் முதலிய நான்கும் முதற்பகுதி என்றவாறு.
5581,தகுமுறை நான்கு இங்ஙனம் ஒன்றன்பின் ஒன்று தோன்று தற்குத் தகுமெனப்பட்ட முறையானே வந்த நான்கும்.
5582,ஒன்றென மொழிப களவிற்கு முதற்கூறு என்று சொல்லுவர்.
5583,இவை நான்கும் தலைவனும் தலைவியும் எதிர்ப்பட்டதிலிருந்து முறையாகத் தலைவி மாட்டு நிகழுமென்பதாம்.
5584,புகுமுகம் புரிதல் தலைமகன் தன்னைப் பார்த்தலைத் தலைமகள் விரும்புதல்.
5585,புகுதல் தலைமகன் நோக்கெதிர் தான் சென்று புகுதல்.
5586,முகநோக்கி நிற்க அமையும் அகநோக்கி உற்ற துணர்வார்ப் பெறின்.
5587,குறள் எனக் காண்க.
5588,புரிதல் விரும்புதல்.
5589,அவன் நோக்கில் தான்சென்று புக விரும்புதல்.
5590,"இது, எதிர்ப் பட்டதும் உண்டாவது."
5591,"அது, யானோக்குங்கால் நிலனோக்கும், நோக்காக்காற் றானோக்கி மெல்ல நகும்."
5592,குறள் எனவரும்.
5593,"இது, தலைவன் கூற்று."
5594,பொறிநுதல் வியர்த்தல் தலைமகன் தன்னை நோக்கியவழி அச்சமும் நாணும் ஒருங்குவந் தடைதலின் நெற்றியில் வியர்வை அரும்புதல்.
5595,பொறி வியர்வை நீர்த்துளி.
5596,"அது, பெரும்புழுக் குற்றநின் பிறைநுதற் பொறிவியர் உறுவளி யாற்றச் சிறுவரை திறவென."
5597,அகம் எனவரும்.
5598,"அது, முகைமொக்கு ளுள்ளது நாற்றம்போற் பேதை நகைமொக்குள் உள்ளதொன் றுண்டு."
5599,குறள் எனவரும்.
5600,நிறை மறைத்து வைக்கக் கூடியதைப் பிறரறியாமல் மறைத்தல்.
5601,சிதைவு உள்ள முடைதல்.
5602,"அது, அகமலி யுவகைய ளாகி முகனிகுத் தொய்யென இறைஞ்சி யோளே."
5603,அகம் எனவரும்.
5604,"இது, இயற்கைப் புணர்ச்சி புணர்ந்து நீங்கிய தலைவன் தன் நெஞ்சிற்குச் சொல்லியது."
5605,"தான்பெரிது மகிழாள் என்பது, சிறிது மகிழும் என்றமையின், புகுமுகம் புரிதல்."
5606,"வாணுதல் வியர்ப்ப நாணின ளிறைஞ்சி என்பது, பொறி நுதல் வியர்த்தல்."
5607,"நகைமுகங் கரந்த என்பது, நகுநயமறைத்தல்."
5608,"தன்மனஞ் சிதைந்ததை நீயறிந்திலையால் என்பது, சிதைவு பிறற்கின்மை."
5609,"மிகை வெளிப் படாது என்பது, நகை மொக்குள் வாய்க்குட் சிரித்தல்."
5610,"இது, அன்னபிறவும் மெய் என்பதனாற் கொள்க."
5611,இரண்டாம் பகுதி .
5612,கூழை விரித்தல் காதொன்று களைதல் ஊழணி தைவரல் உடைபெயர்த் துடுத்தலோ டூழி நான்கே இரண்டென மொழிப.
5613,இ ள் கூழைவிரித்தல் முதலிய நான்கும் இரண்டாம் பகுதி என்றவாறு.
5614,ஊழ் இ நான்கு முறைமையையுடைய நான்கு.
5615,கூழைவிரித்தல் மயிர்முடி அவிழ்தல்.
5616,மெய்யும் மெய்யுந் தீண்டியவழி மெல்லியல் மகளிர்க்கு இது நிகழும்.
5617,"உடம்பொடு தொடர்புடைய கை, கால், முதலிய உறுப்புக்கள் நம் எண்ணப்படி நடக்கும்."
5618,"உகிரும் நகம், மயிரும் உடம்பொடு தொடர்புடையதாகி வேறுபட்ட பொருளாகையால் நம் விருப்பம்போல் நடவா இயங்கா."
5619,காதொன்று களைதல் உள்ள நெகிழ்ச்சியால் காதில் அணியப்பட்ட தோடு வீழ்தல்.
5620,"அதனால், தோடு வீழ்ந்த தென்க."
5621,கூழைபோலாது இது காது ஊற்றுணர்வுடைய தாகலின் கூழையின் பின் வைத்தார்.
5622,ஒன்று தோடு.
5623,"ஊழணி தைவரல் வளை, மோதிரம் இவற்றை மேலே தள்ளுதல்."
5624,"கைநெகிழ்ச்சியால் கீழ்வரவே வளையல்களை முன்கை மேற் செறித்தலும், மோதிரத்தைத் திருத்து தலுமாம்."
5625,இவை தோடுபோல உட்பெய்து வையாமையின் அதன்பின் வைத்தார்.
5626,"தைவரல் தடவுதல், மேலே தள்ளுதல்."
5627,உடை பெயர்த்துடுத்தல் உடுத்த உடையினைப் பலமுறை அவிழ்த்து உடுத்துதல்.
5628,இடைமெலிவால் உடை அவிழுமென்க.
5629,கழல் தொடி போலாது உடை செறிவுடைமையின் உடை நெகிழ்ச்சியைத் தொடி நிகழ்ச்சியின் பின் வைத்தார்.
5630,தொடி வளை.
5631,"இது, தலைமகள் தோழிக் கறத்தொடு நின்றது."
5632,"இதனுள் ஓதி முந்துறநெகிழ என்பது, கூழைவிரித்தல்."
5633,"காதொன்று நெகிழ என்பது, காதொன்றுகளைதல்."
5634,"மணிப்பூண் நெஞ்சொடு கழல என்பது, ஊழணிதைவரல்."
5635,நெடிது நிமிர்ந்தன்று துகிலும் பன் முறை என்பது.
5636,மூன்றாம் பகுதி .
5637,அல்குல் தைவரல் அணிந்தவை திருத்தல் இல்வலி யுறுத்தல் இருகையு மெடுத்தலொடு சொல்லிய நான்கே முன்றென மொழிப.
5638,இ ள் அல்குல் தைவரல் முதலிய நான்கும் மூன்றாம் பகுதி என்றவாறு.
5639,அல்குல் தைவரல் அரையை இடையின் கீழ்ப் பாகத்தை தடவுதல்.
5640,உடை பெயர்த்து உடுத்தபின் உடை பெரிதும் அவிழ்வ தாயிற்று.
5641,அவிழ்ந்துவிழும் உடையை உடனே பிடித்தலே அல்குல் தைவரலாகும்.
5642,அல்குல் தொடைகளுக்குமேலும் இடைக்குக்கீழும் உள்ளபாகம்.
5643,அரையின் பின்பக்கமே அல்குல் எனப்படும்.
5644,கலி உரை பார்க்க. .
5645,"அணிந்தவை திருத்தல் அரைஞாண், தோளாடை முதலியன திருத்தல்."
5646,ஞெகிழ்ந்த அரைஞாணை இடையிற்சேர்த்து ஆடையை உடுத்துமென்க.
5647,அக்கால் பெண்டிரும் அரைஞாண் அணிந்திருந்தமை இதனால் தெரிகிறது.
5648,கடிசூத்திர முதலியன திருத்துதல் பேரா.
5649,கடிசூத்திரம் அரைஞாண்.
5650,கடி உடைக்குப் பாதுகாப்பு.
5651,"சூத்திரம் கயிறு, ஞாண்."
5652,உடையைப் போலக் காக்கவேண்டுதலின் இதை அல்குல் தைவரலின் பின்வைத்தார்.
5653,இல்வலி உறுத்தல் புணர்ச்சி வேண்டாதாள் போல்வதோர் வன்மை படைத்துக் கொண்டு செய்தல்.
5654,உள்ளத்திசைந்தும் வெளிக்கு இசையாள்போற் காட்டுதல்.
5655,உறுத்தல் மிகுத்தல்.
5656,இல்லாத வலியை மிகுத்தலென்க.
5657,"அல்குல் தைவரலும், அணிந்தவை திருத்தலும் தன் வலியின்மை காட்டவும், வலிதோற்றிக் கொண்டு செய்வதாகலின் இதனை மூன்றவாது வைத்தார்."
5658,அச்சமும் நாணும் எழுப்பக் கைகளை முன்பக்கத்தில் விரித்து அசைத்தல்.
5659,இவை பன்னிரண்டும் புணர்ச்சிக்கு முன்னிகழ்வன.
5660,"சொல்லிய என்றதனால், இவையெல்லாம் இவ்வாறு நிகழுமெனச் சொல்லப்படுவதல்லது சொல் நிகழ்த்துதல் இல்லை."
5661,இவை பன்னிரண்டும் தலைமகன் ஏதுவால் தலைமகள் பால் நிகழ்வனவென்க.
5662,"இது, இயற்கைப் புணர்ச்சிக்கண் தலைமகன் தன்னிலை யுரைத்தது."
5663,"இதனுள், உள்ளத்து நகுநள் என்பது, அல்குல் தைவரல்."
5664,"உள்ளம் போல உடம்பும் சிதைந்தனள் போன்றனள் என்பதால், அவ்வேறுபாட்டானே தைவரலி னென்க."
5665,"அல்குலின் ஞெகிழ்நூல் கலிங்கமொடு என்பது, அல்குலிற் கட்டிய நூலிற்கு அரைஞாணிற்கு நெகிழ்ச்சி கூறினமையின், அணிந்தவை திருத்தல்."
5666,அல்குலின் ஞெகிழ்நூல் அல்குலின் மேலிடத்தே கட்டிய அரைஞாண்.
5667,"மெலிந்திலளாகி வலிந்துபொய்த் தொடுங்கவும் என்பது, இல் வலியுறுத்தல்."
5668,"யாமெடுத் தணைத்தொறும் தாமியைந் தெழுதல் என்பது, இருகையு மெடுத்தல்."
5669,நான்காம் பகுதி .
5670,இ ள் பாராட்டெடுத்தல் முதலிய நான்கும் நான்காம் பகுதியாகும் என்றவாறு.
5671,பாராட்டு எடுத்தல் புணர்ச்சி நிகழ்ந்த பின்னர்த் தலைமகனை இயற்பட நினையுங் குறிப்பு.
5672,இயற்பட நினைதல் இயல்பைக்கூற எண்ணுதல்.
5673,இயல் தன்மை.
5674,"எடுத்த என்ற தனால், வாயாற் கூறாது உள்ளத்தால் எனக் கொள்க."
5675,"இது, தலைமகற்கும் ஒக்கும்."
5676,இருவரும் ஒருவர் ஒருவருடைய தன்மையை எண்ணுவரென்க.
5677,மடந்தப உரைத்தல் விளையாடும் பருவத்து நிகழ்ந்த அறிமட நீங்கக் காமப்பொருட்கண்ணே சிறிது அறிவு தோன்றுதலும் தோழியிடம் சில கூறுவள்.
5678,அறிமடம் சொன்னதை அப்படியே கொள்ளும் அறிவு.
5679,அம்மடம் நீங்க உரைக்குமென்க.
5680,தபுதல் நீங்குதல்.
5681,மடந்தப வுரைத்தற்கு ஏதுவாய கருத்து எண்ணம் ஈண்டு மெய்ப்பாடு எனப்படும்.
5682,"இது, புணர்ந்து நீங்கி ஆயத்தொடு விளையாடும்போது நிகழும்."
5683,அந்நிகழ்ச்சியால் தோழி தலைமகளின் களவொழுக்கத்தை நாடுவளென்க.
5684,"தலைவி அக்கடுஞ் சொற்களை முனியாது ஏற்றுக்கொண்டு, பிறர் இதை அறிவாரோ என்று நாணுவள்."
5685,ஈரமில் கூற்றம் அன்பில்லாத சொல்.
5686,ஈரம் அன்பு.
5687,அலர்நாணல் அலருக்கு நாணல்.
5688,அலர் பிறர் தலைமகள் களவை யறிந்து பழித்தல்.
5689,கொடுப்பவை கோடல் தலைமகனால் கொடுக்கப்பட்ட தழை முதலிய கையுறையை ஏற்றுக் கொள்ளுதல்.
5690,அத்தழை முதலியவற்றின்மேல் அன்பு கொள்ளும் நினைவு மெய்ப்பாடாகும்.
5691,"இது, கையுறை மறுத்தது."
5692,"இதனுள், நிற்பாராட்டி என்பது, பாராட்டெடுத்தல்."
5693,"சொற்கொளலின்றி என்பது, மடந்தப வுரைத்தல்."
5694,சொன்னதைக் கொள்வதே மடமை சொன்னதைக் கொள்ளாமை மடனன் றாகலானென்க.
5695,"யாயெதிர் கழறலிற் பேரலர் நாணி என்பது, ஈரமில் கூற்றம் ஏற்றலர் நாணல்."
5696,"துயர் மருந்தாயினும் என்பது, கொடுப்பவை கோடல்."
5697,துயர்மருந்து துயருக்கு மருந்து.
5698,ஐந்தாம் பகுதி .
5699,தெரிந்துடம் படுதல் திளைப்புவினை மறுத்தல் கரந்திடத் தொழிதல் கண்டவழி யுவத்தலொடு பொருந்திய நான்கே ஐந்தென மொழிப.
5700,இ ள் தெரிந்துடம்படுதல் முதலிய நான்கும் ஐந்தாம் பகுதியாகும் என்றவாறு.
5701,"மேற்கூறிய கொடுப்பவை கோடல் நிகழ்ந்தவழி, அவ் வொழுகலாறு பிறர்க்கெல்லாம் ஐயமாகலின் அதன் பின்னர்த் தோன்றுவது தெரிந்துடம்படுதல் என்க."
5702,தெரிந்துடம் படுதல் தம் களவொழுக்கத்தைத் தெரிந்து கொண்டு இன்னவாறு நிகழ்ந்ததெனத் தோழிக்கு உடம்படுதல்.
5703,உடம்படுதல் தன் நடத்தையை ஆம் என ஒத்துக் கொள்ளுதல்.
5704,தோழி செவிலிக்கு உடம்படுவளென்க.
5705,உடம்பாட்டின் பின் மறுக்குமாகலின் தெரிந்துடம்படுதலின் பின் இதை வைத்தார்.
5706,"கரந்திடத்து ஒழிதல் அக்காலத்து இற்செறிக்கப்படுதலான், தான் அவனை மறுத்த குற்றத்திற்கு நாணியும் அஞ்சியும் அவற்கு வெளிப்படாது மறைந்தொழுகுதலை உடையளாதல்."
5707,"தன்னிடத்தே தங்குதலை, இடத்தொழிதல் என்றார்."
5708,கரந்த இடத்து மறைவான இடத்து.
5709,ஒழிதல் தங்குதல்.
5710,"உடம்பட்டபின் வெளிச் செல்லாமலும், தினைக் காவல் செய்யாமலும் இற்செறிப்பரென்க."
5711,இற்செறித்தல் வீட்டைவிட்டு வெளிச்செல்லாமற் காத்தல்.
5712,கண்டவழி உவத்தல் அங்ஙனம் கரந்தொழுகுங் காலத்து அவனை ஒருநாட் கண்டவழி மிக்க உவகை எய்தல்.
5713,"இது, தலைமகற்கும் ஒக்கும்."
5714,திளைப்புவினை மறுத்தும் கரந்திடத் தொழிந்தும் ஒழுகினளேனும் தலைவன்பாலுள்ள அன்பு ஒழிந்தாளல்லள்.
5715,"பொருந்திய நான்கு என்றது, இவை நான்கும் இடையறவின்றி ஒருங்கு தொடர்தலு முடையவென்பது."
5716,"அதாவது, தெரிந்துடம்பட்டதும் திளைப்புவினை மறுப்பள், கரந்திடத்தும் ஒழிவள் இதற்கிடையே காணின் உவப்பள் என்பதாம்."
5717,இதனானே இவை ஐந்து கூறும் நன்னான்காக வருகின்றதற்குச் சிறிது இடையறவும் படுமென்பது.
5718,"அதாவது, புகுமுகம் புரிதல் முதலிய நான்கும் தலைமகளனவேயாகி ஓரினத்தவாயின."
5719,"கூழை விரித்தல் முதலியன நான்கும் தலைமகன் அவளைப் பொருந்தியவழி நிகழ்ந்தமையின் அவை, அவற்றோடு சிறிது இடையறவு பட்டன."
5720,அல்குல் தைவரல் முதலிய நான்கும் புணர்ச்சிக்கு மிகவும் இயைபுடைமையின் மேலவற்றோடு பொருந்தாது வேறாயின.
5721,பாராட்டெடுத்தல் முதலாயின புணர்ந்து நீங்கியபின் நிகழ்ந்தமையின் அவையும் அவற்றிற்குச் சிறிது வேற்றுமையுடைய.
5722,தெரிந்துடம் படுதல் முதலாயின களவு வெளிப்படுத்தற் குறிப்பினவாகலின் மேலவற்றோடு தழுவாது வேறாயின.
5723,"முன்னது கண்டவழி யுவத்தலானும், இனிவருவது காணாதவழி நிகழ்கின்ற தாகலானும் இனமின்றி வேறாயிற்று."
5724,"மேல் வருவன நான்கும் புலம்பிய மெய் என்பதால், தனிக்கூறு என்பது பெற்றாம்."
5725,"இது, பகற்குறிக்கண் தலைமகளை இடத்துய்த்து வந்து, தலைமகனை எதிர்ப்பட்டு நின்று தோழி வரைவு கடாயது."
5726,"இதனுள், யாய்க்கறிவுறாலின் என்பது, அவள் நோக்கு தொறும் பனித்தலென்று அறிவுறுத்தாள் என்றமையின், தெரிந்துடம்படுதல்."
5727,பனித்தல் அஞ்சுதல்.
5728,"நின்னெதிர் நாணி என்பது, தமர்க்கு மறைத்தாள் இம்மறையினையென்று தலைமகன் எண்ணுமென நாணி எதிர்ப்படாமையின், திளைப்புவினை மறுத்தல்."
5729,"மனைவயிற் பிரியலள் என்பது, கரந்திடத் தொழிதல்."
5730,ஆறாம் பகுதி .
5731,புறஞ்செயச் சிதைதல் புலம்பித் தோன்றல் கலங்கி மொழிதல் கையற வுரைத்தலொடு புலம்பிய நான்கே ஆறென மொழிப.
5732,இள் புறஞ்செயச் சிதைதல் முதலிய நான்கும் ஆறாம் பகுதியாகும் என்றவாறு.
5733,புறஞ்செயச் சிதைதல் பூவும் சாந்தும் பூணும் துகிலும் முதலாயின கொண்டு புறத்தே கோலஞ் செய்ய அகத்தே சிதைவுண்டாதல்.
5734,கோலங்கண் டுவக்கும் தலைவனின்மையால் சிதையுமென்க.
