Line Number,Sentence
1578,பிள்ளைகளுக்குப் பெற்றோர் பங்குபாகம் வைத்துத் தருவது வழக்கம்.
1579,பசப்புதல் பசப்புதல் நயமாகப் பேசி ஏய்த்தல்.
1580,"இல்லாததை இருப்பதாகக் காட்டி, சொல்லாத வகை எல்லாம் சொல்லி, நம்புமாறு நடித்தல் பசப்புதலாக வழங்குகின்றது."
1581,"நினைவு, சொல், செயல் ஆகிய முந்நிலைகளிலும் ஏமாறச் செய்தல் பசப்புதலாக வழங்குகின்றது."
1582,அந்தப் பசப்பெல்லாம் இங்கு வேகாது என்பது ஒரு மரபுத்தொடர்.
1583,வேகாது என்பதும் வழக்குச் சொல்லே.
1584,நிறைவேறாது என்பது பொருள்.
1585,அவனோடு அவனாகிப் பசைபோல் ஒட்டிப் பசப்பினாலும் வெற்றி பெற முடியாது போகும் இடமும் உண்டு.
1586,அத்தகையர் பசப்புதலைக் குறிப்பால் உணரும் திறமிக்கவராம்.
1587,பசளை பசுந்தாள் உரமே பயிர்க்கு உயிர் உரம் ஆகும்.
1588,இயற்கை உரமே இயைந்தது எனச் செயற்கை உரம் செய்த அறிவாளிகள் திரும்பி அல்லது திருந்தியுள்ளது நலமே.
1589,ஆனால் பசுந்தாள் உரம் பயிருரம் என்பதைப் பட்டறிவுடைய உழவர் கண்டு பசளை என உரத்திற்குப் பெயர் சூட்டியுளர்.
1590,இது யாழ்ப்பாண வழக்கு.
1591,யாழ்ப்பாண வழக்கு என்பது என்ன?
1592,குமரிக்கண்ட ஏழ்பனை நாட்டு வழக்குத்தானே!
1593,பசியாறல் பசித்துக் கிடந்தவன் தன் பசித்தீ ஆறுமாறு உண்ணுதல்.
1594,ஆற்றுநர்க் களிப்போர் அறவிலை பகர்வோர் ஆற்றா மாக்கள் அரும்பசி களைவோர் மேற்றே யுலகின் மெய்ந்நெறி வாழ்க்கை மணிமே.
1595,பசிப்பிணி என்னும் பாவியது தீர்த்தோர் இசைச்சொல் அளவைக் கெந்நா நிமிராது மணிமே.
1596,", என்பனவும், பசிப்பிணி மருத்துவன் பண்ணன் என்று பாராட்டப் பெறுவதும் நோக்கத் தக்கன."
1597,பசிப்பாழி என்பது உடலுக்கு ஒருபெயர் என்பதும் அறியத் தக்கது.
1598,பசுமை பசுமை பொற்கொல்லர் வழக்கில் பசுமை என்பது வெள்ளியைக் குறிக்கிறது.
1599,நிறத்தால் பொருந்தவில்லை.
1600,பசுமை வளமைப் பொருளது.
1601,அப் பசுமை வெள்ளிக் காசின் பசுமை வளமை குறித்ததாகலாம்.
1602,"பசுமை பசுமை செழிப்பு, செழுமை."
1603,பசுமை வண்ணத்தைக் குறியாமல் அதன் செழுமையைக் குறிப்பதாக அமைகின்றது.
1604,அந்த நிகழ்ச்சி அல்லது நினைவு பசுமையாக இருக்கிறது என்பது இதனை விளக்கும்.
1605,"பசுமையான இயற்கைச் செடி கொடி மரங்கள், ஊட்டமும் கொழுமையும் மிக்கவை."
1606,அதன் வளமை பசுமையாலேயே அறியப்படும்.
1607,"பச்சை இலை, பிடிப்போடு இருக்கும்."
1608,பழுத்தது உதிரும்.
1609,தோலுக்குப் பச்சை என்பதொரு பொருள்.
1610,அது வளமையாம் செழுமையைச் சேர்த்து வைக்கும் இடமாக இருத்தலால் பெற்ற பெயராம்.
1611,"பசுமை, பாசம் கட்டுக்கிடை நீர்மேல் பசுமையாகத் தோன்றும் அழுக்குப் படலம் பாசி, பாசம் எனப்படும்."
1612,"நீர்மேல் மிதப்பதை அன்றி ஈரக்கசிவு மாறா நிலத்தில் தளத்தில் பச்சை நிறத்தில் படிவதும் பாசி, பாசம் எனப்படும்."
1613,"பாசி, பாசம் என்பவை வழுக்கிவிடக் கூடியவை."
1614,"பசுமை என்பது ஆதி நீண்டு, வேண்டும் திரிபுகளை அடைந்து பாசி ஆயிற்று."
1615,மக்கள் வழக்கில் பாசாங்கு என்றொரு சொல் உண்டு.
1616,பாசிபோல் குளிர்ச்சியாகத் தோற்றம் தந்து பலவகைக் கேடுகளைச் செய்வது பாசாங்கு எனப்பட்டதாம்.
1617,பாசாணம் என்பது பச்சை நாவி எனப்படுதலால் அதன் நிறமும் தீமையும் புலப்படும்.
1618,தாய் குழந்தை மேல் காட்டும் விடாப்பற்றுமை பாசமாம்.
1619,"அக்குழந்தை பச்சைக் குழந்தை, பச்சிளம் குழந்தை, பச்சைப் பிள்ளை என்று வழங்கப்படும்."
1620,பச்சைப் பிள்ளைக்காரி எனத் தாய் குறிக்கப்படுவாள்.
1621,அவள் மகப் பெற்ற உடல் பச்சை உடல் எனப்படும்.
1622,"பேசும் பேச்சில் அவைக்குத் தகச் சொல்வதைச் சொல்லாமல் வாய்க்கு வந்தவாறு பேசுதல், பச்சை பச்சையாகப் பேசுதல் எனப்படும்."
1623,"இப்பச்சை நிறத்தைக் குறியாமல் இளமை, அறியாமை, மென்மை என்னும் பொருளில் வருவது."
1624,பயிர்பச்சை என்பது இணைச்சொல்.
1625,பயிர் என்பது தவசம் தருவது.
1626,பச்சை என்பது பயறுவகை தருவது.
1627,பை இர் பயிர்.
1628,பை பசுமை.
1629,பையன் இளமையானவன்.
1630,பைய மெதுவாக.
1631,"பையப்பைய மெதுமெதுவாக, மெல்லென."
1632,"பையன், பையல் பயல் என வழங்கும்."
1633,"பசன், பசன்கள் எனப் பால் வேறுபாடின்றிச் சிறுபிள்ளைகளை இந்நாள் குறிக்கின்றது."
1634,பைதல் என்பது இளமைப் பொருளது.
1635,பைங்கண் அரவு கூர்மையான கண்ணுடைய பாம்பைக் குறிக்கும்.
1636,"எண்ணம் மாறாது மறவாது இருப்பது பசுமையான காட்சி, பசுமையான நினைவு எனப் போற்றப்படும்."
1637,பசளை எனப் பச்சை நிறக்கீரை உண்டு.
1638,பசலைக் கன்று என்பது இளங்கன்றைக் குறிக்கும்.
1639,பச்செனல் பசுமையாம்.
1640,பச்சைப் பசேர் பச்சைப் பசேல் என்பவை மிகுபச்சை.
1641,"பச்சம் பற்று, அன்பு."
1642,"பச்சிலை, மருந்து."
1643,பச்சி பச்சைக் காய் கொண்டு செய்யப்படும் மாப்பண்டம்.
1644,பச்சை மிளகாய் முற்றாமல் வற்றலாகாமல் உள்ள பசுமையான மிளகு அன்ன காரமுடைய காய்.
1645,பச்சோந்தி பலவண்ணங்களுள் பசுமையைச் சிறப்பாகக் கொண்டு மாறும் வண்ணங்களையுடைய ஓணான்.
1646,பச்சைக்கிளி வண்ணத்தால் பெற்ற பெயர்.
1647,"பஞ்சரம், கிளி அடையும் கூடு."
1648,பஞ்சரம் விட்டு அகலாது உறையும் அஞ்சொற் கிளிகள் அந்தகக்கவி வீரராகவர் தனிப்பாடல்.
1649,"உயிருள்ள மொழி தமிழ் என்பதன் சான்று இத்தகைய விரிவாக்கச் சொல் வழக்குகளும், விளக்கங்களுமாம்."
1650,"பசை பசை ஒட்டிக் கொள்ளல், பசுமை, வளமை."
1651,பசை ஒட்டிக் கொள்ளும் தன்மையது என்பது வெளிப்படை.
1652,பசை பிசின் எனவும் வழங்குகிறது.
1653,பயின் என்பது பழஞ்சொல்.
1654,பசை பச்சை என்பதன் இடைக்குறையாக வழங்குதல் ஆயிற்று.
1655,பச்சை என்பது நீர்மைப்பொருள்.
1656,ஒட்டிக் கொள்ளும் தன்மையது.
1657,அவர் பசையான ஆள் என்னும் பொழுது பணக்காரர் என்பதைச் சுட்டுகிறது.
1658,"பசை இருந்தால் பக்கம் பத்துப் பேர் என்பதில் பசை என்பது பண வளமையுடன், கொடை வளமையும் சேர்தல் அறிக."
1659,பச்சைப் பிள்ளை என்பதில் பச்சை பசைத் தன்மையொடு ஒட்டிக் கொள்ளும் குறிப்புள்ளமை அறிக.
1660,பச்சரி அரி என்பது பழந்தமிழ் வழக்கு.
1661,"நெல்லையும், நெல் அரிந்த தாளையும், அரிசியையும் குறிப்பது அது."
1662,பச்சரிசி என்னும் பொதுவழக்கைப் பச்சரி என விளவங்கோடு வட்டாரத்தில் வழங்குகின்றனர்.
1663,பச்சி சிலர் பச்சி என்பதை பஜ்சி என்பதால் வேற்றுச்சொல் தோற்றம் தருகிறது.
1664,நல்ல தமிழ்ச்சொல்லே அது.
1665,பச்சைக் காய்கறிகளைக் கொண்ட ஒரு கறி பச்சடி என வழங்குதல் எவரும் அறிந்தது.
1666,நாம் சட்டினி என்பதை ஈழத்தமிழர் பச்சுணி என்பர்.
1667,பச்சைமிளகாய் மல்லித்தழை கறிவேப்பிலை முதலிய பசுமை நிறப்பொருள்கள் சேர்தலால் அப்பெயர் பெற்றது.
1668,பச்சிலை பசுமை இலை பச்சிலை.
1669,"பசுமையான இலையாதலால் பச்சிலை எனப்பட்டது எனின், பெரிதும் இலை எல்லாம் பசுமையானவையே."
1670,"ஆதலின், அப்பசுமையுள் சிறப்பொன்று கொண்டமையால் பச்சிலை எனச் சிறப்பித்துக் கூறப்பட்டது."
1671,எல்லாவற்றினும் பசுத்திருத்தலில் பச்சிலை என்று பெயர் பெற்றது என்பார் நச்.
1672,திருமுரு.
1673,.
1674,பச்சை பத்துநாள்கள் அடைமழை தளத்தில் ஈரம் உலராமல் பசுமை கப்பிக் கொண்டது பச்சைக் கம்பளம் விரித்தது போலாயிற்று.
1675,அப் பச்சையைப் பாசம் பிடித்துவிட்டது என்றும் பாசி பிடித்துவிட்டது என்றும் கூறுகின்றனர்.
1676,தெருவில் கூவிக் கூவிப் பாசி ஊசி என விற்றுப் போகிறாள் ஒருத்தி.
1677,அது பசுவானாலும் அதன் பாசத்தைப் பார்த்தாயா?
1678,கன்றை நெருங்கும் நாயை என்ன முட்டு முட்டியது?
1679,என்கின்றனர்.
1680,பச்சை காட்டல் பச்சை காட்டல் வழி பிறத்தல்.
1681,பச்சைக் கொடி காட்டல் என்பதும் இது.
1682,தொடரி புறப்படுவதற்கு நிலையங்களில் பச்சைக் கொடி காட்டுவர்.
1683,"பச்சைக் கொடி காட்டிவிட்டால் தடையில்லை, போகலாம் என்பதற்கு அடையாளம்."
1684,"பச்சைக் கொடி காட்டல் தடையில்லை என்னும் பொருளில், வழி பிறத்தலைக் காட்டுவதாம்."
1685,வீட்டில் பச்சைக் கொடி காட்டி விட்டார்கள் என ஒப்புதலால் உவப்பார் மிகப் பலர்.
1686,பச்சைத் தாள் பச்சைத் தாள் நூறு உரூபாத்தாள்.
1687,அவர்கள் அதற்கெனச் சில குறியீடுகள் வைத்துளர்.
1688,சில விரல்களைப் பிடித்து இத்தனை பச்சைத் தாள் என்பர்.
1689,பச்சைத் தாள் என்பது நூறு உரூபா என்பதாம்.
1690,கடுவாய்த் தாள் என்றாலும் நூறு உரூபாவேயாம்.
1691,மற்றை உரூபா தாள்களினும் நூறு உரூபாத்தாள் வண்ணம் வேறுபட்டுப் பச்சையாக இருந்திருத்தல் வேண்டும்.
1692,இல்லையேல் பச்சை செழிப்பு ஆதலால் வளமான பெரிய தொகையைக் குறித்திருத்தல் வேண்டும்.
1693,பச்சை பசப்பு பச்சை வளமை அல்லது பசுமை.
1694,பசப்பு ஏய்ப்பு அல்லது ஒப்பிதம்.
1695,பச்சை பசப்புக்காரன் என்று ஏய்ப்பவரைக் குறிப்பர்.
1696,"தம் பசுமையைக் காட்டி ஏய்ப்பாரும், இல்லாததும் பொல்லாததும் சொல்லி ஏய்ப்பாரும் என அவர் இருவகையர்."
1697,அவர் தன்மையை இவ்விணைச் சொல்லால் சுட்டினராம்.
1698,பசப்புதல் ஏய்த்தல் என்னும் பொருளில் இன்றும் வழங்குகின்றது.
1699,பச்சை இப்பொழுது பசையாக வழங்குகின்றது.
1700,பசையானவன் என்றால் வளமானவன் என்பதாம்.
1701,பச்சை பதவல் பச்சை சிறிதும் காயாத ஈரம் உடையது.
1702,பதவல் சற்றே காய்ந்து ஈரப்பதமுடையது.
1703,பச்சை பதவலை அடைத்து வைத்தால் வெந்து போகும் பூஞ்சணம் பிடித்தும் போகும் உலரப் போடு என்பர்.
1704,உலரப் போடுதல் என்பது ஆலாற்றுதல் எனப்படும்.
1705,"ஆல், என்பது நீர் ஆல் அகற்றுதல் என்பது ஆலாற்றுதல் ஆயிற்று."
1706,நீர்ப்பதம் போக்கல் என்பதாம்.
1707,பதவல் என்பது மக்கள் பொருளும் தருதல் உண்டு.
1708,பதவல் பெருத்துவிட்டது என்பது ம.வ.
1709,"பஞ்சம் பஞ்சம் வற்கடம், வறுமை."
1710,"பஞ்சு பறப்பது போல் மக்கள் உணவுக்கும் உடைக்கும் உண்ணு நீருக்கும் பிறபிறவற்றுக்கும் பறக்கின்ற நிலை, பஞ்சமாம்."
1711,இலவின் பஞ்சு பறத்தலைப் பார்ப்பவர் பஞ்சாய்ப் பறத்தலை அறிவர்.
1712,"பஞ்சாகப் புலவர் பறத்தலைப் பாடிய புலவர்களும், அதனைத் தீர்த்த புரவலர்களும் தனிப்பாடல்களில் இடம் பெற்றனர்."
1713,ஆலாய்ப் பறத்தல் என்பதும் வழங்குமொழி.
1714,"பஞ்ச லட்சணம் என்பதொரு நூல், பஞ்சத்தால் மக்கள் படும் பாட்டைப் பாடும் சுவைமிக்கது."
1715,பஞ்சம் என்பது புதுவழக்கு.
1716,பழஞ்சொல் வற்கடம் என்பது.
1717,பன்னீரியாண்டு வற்கடம் செல்ல களவியலுரை.
1718,தாது ஆண்டுப் பஞ்சம் ம.வ.
1719,ஆலாய்ப் பறத்தல் காண்க.
1720,பஞ்சு பைஞ்சு பஞ்சு.
1721,.. நைஞ்சு நஞ்சு.
1722,பை மென்மை இலவம் பஞ்சில் துயில் ஔவை.
1723,ஆத்தி. பஞ்சை கொடிய வறுமைக்கு ஆட்பட்டவரைப் பஞ்சை என்பது ம.வ.
1724,பஞ்சத்துக்கு வறுமைக்கு ஆட்பட்டவர் என்க.
1725,பஞ்சை பரதேசி என்பது இணைச்சொல்.
1726,"படக்கு வெடி வெடித்தல், வெடி போடுதல் என்பது பொதுவழக்கு."
1727,வெடியை வேட்டு என்பதும் பொதுவழக்கே.
1728,ஆனால் வேட்டு தீப்பற்றிய அளவில் பட்டென வெடிப்பதால் அவ்வொலிக் குறிப்பைக் கருதிப் படக்கு என்பது குமரி மாவட்ட வழக்காகும்.
1729,"படங்காட்டல் படங்காட்டல் பகட்டுதல், நடித்தல்."
1730,படங்காட்டினால் மயங்காதவர் உண்டா?
1731,குழந்தைகள் தானா படங்காட்ட மயங்குகின்றனர்.
1732,"எவ்வளவு பெரியவர்கள், படங்காட்ட மயங்கும் குழந்தை நிலையில் உள்ளனர்."
1733,படந்தால் படர்ந்த ஆல் படந்தால்.
1734,படபடத்தல் படபடத்தல் கோவப்படல்.
1735,பித்தப் படபடப்பென ஒரு நோயுண்டு.
1736,அப்படபடப்பு மயக்கத்தை உண்டாக்கி வீழ்த்துவது.
1737,அதனினும் கொடுமையானது இப் படபடப்பு.
1738,"ஏனெனில், சிலர் படபடப்பு குடும்பத்தையே கெடுத்ததுண்டு."
1739,படமாடம் ஓவியம் தீட்டி வைக்கப்பட்ட பெருமாளிகை படமாடமாம்.
1740,படமாடமாக இருந்தவை கோயில்கள் எனவும் வழங்கப்பட்டன.
1741,ஆதலால் அவை படமாடக் கோயில் எனப்பட்டன.
1742,"படமாடம் ஓவியக் கூடம் மட்டுமன்று, ஓவியம் இறையுருவு தீட்டப்பட்டவை."
1743,"ஆதலால், வழிபாட்டுக்கும் உரியவையாயின."
1744,படமாடக் கோயில் என்றே வழங்குவார் திருமூலர் திருமந்.
1745,.
1746,உயிரிகள் நடமாட்டம் உடைமையால் அவை நடமாடக் கோயில்கள் என அவரால் வழங்கப்பட்டன.
1747,படலை படலை என்பது சீப்பு என்னும் பொருளில் அகத்தீசுவர வட்டார வழக்காக உள்ளது.
1748,முடி காற்றில் எழும்பாமல் படிவாக இருக்க மகளிர் தம் கூந்தலில் சீப்பைச் செருகுதல் வழக்கம்.
1749,அவ் வழக்கத்தில் இருந்து படலை என்பது ஏற்பட்டிருக்கும்.
1750,"படர்ந்து அமைந்தது, படலை."
1751,"படல் படர்தல், விரிதல், அகலுதல்."
1752,தென்னங்கீற்றுகளைப் பின்னியது படல் எனப்படும்.
1753,அது கூரை வேயும் வகையில் காற்று மழை வெயில் புகாவகையில் வேய் பொருளாகின்றது.
1754,படர் படல்.
