Line Number,Sentence
669,அதனை இங்கே சீதையின் மூலமாகக் கம்பன் காட்டுகின்றான்.,False
670,இவ்வாறே தமிழ்நாட்டு மக்களின் பழக்க ஒழுக்கங்களையே அடிப்படையாகக்கொண்டு ஆக்கி அமைந்திருக்கின்றான் கதையை.,False
671,பிறர் செய்த நன்றியை மறத்தலாகாது என்பதற்கு எடுத்துக்காட்டாய் விளங்கினான் கம்பன்.,False
672,கம்பனின் கற்பனைத்திறம் வேறு எந்த நூல்களிலும் காணாத இயல்பினது.,False
673,கம்பனின் கருத்து மிக்க ஆழமுடையது.,False
674,இயற்கையைப் பாடுவதிலே கம்பனுக்கு மட்டற்ற மகிழ்ச்சி உண்டாவதுண்டு.,False
675,இராமன் சீதை முதலியோரைக் கண்ணீர்க் கடலில் அழைத்து வருகின்றான்.,False
676,அயோத்தியிலிருந்து கங்கைக் கரையை அடைகின்றான்.,False
677,தோணியில் இராமன் முதலியோரை ஏற்றி ஆற்றில் விட்டுவிடுகின்றான்.,False
678,கம்பன் இந்தக் கரையிலேயே உட்கார்ந்துகொள்கின்றான்.,False
679,கங்கை அவன் கருத்தைக் கவருகிறது.,False
680,அதிலுள்ள மீனும் அருகிலோடும் மானும் அவனுள்ளத்தைப் பிணிக்கின்றன.,False
681,கதையை மறந்துவிடுகின்றான்.,False
682,இயற்கைக் காட்சியிலீடுபட்டு எண்ணற்ற பாடல்களைப் பாடுகின்றான்.,False
683,கவிவெறி தீரப் பாடுகிறான்.,False
684,வெறி தீர்ந்தபிறகு கண்களைத் திறந்து பார்க்கின்றான்.,False
685,படகிலே இராமன் முதலியோர் போவதைப் பார்க்கின்றான்.,False
686,நாவாய் இள அன்னத்தின் நடைபோன்ற இயக்கத்தை உடையதாய் வந்ததுஎன்று பாடி அவர்களைக் கொண்டுபோய்க் கரை சேர்க்கின்றான்.,False
687,கதையையும் மறந்து இயற்கைக் காட்சியில் ஈடுபட்டுப் பாடி மகிழ்ந்தவன் கம்பன்.,False
688,உலக அநுபவம் கம்பனுக்கு நிறைய உண்டு.,False
689,உலகிலே கண்ட காட்சிகளைக் கதையிலே தக்க இடங்களிலே அமைத்துப் பாடுவதில் கம்பன் மிக வல்லவன்.,False
690,ஒரு வீட்டிலே திருமணம் நடந்தது என்று வைத்துக்கொள்ளுங்கள்.,False
691,அவர் வரவில்லையே என்று ஒருவரைக் குறித்து ஒருவர் கூறுவார்.,False
692,அவர் வந்திருந்தார் என்பார் ஒருவர்.,False
693,நான் பார்க்கவே இல்லையே என்பார் மற்றொருவர்.,False
694,வந்திருந்தால் எனக்குத் தெரியாமலாயிருக்கும் என்பார் மற்றொருவர்.,False
695,இதுதான் திருமணம் நடந்த அடுத்தநாள் அல்லது அதற்கடுத்த நாள் நடைபெறும் பேச்சு.,False
696,கம்பன் இந்தக் காட்சியைக் கண்டான்.,False
697,கதையில் காட்டுகின்றான்.,False
698,காணுங்கள் இராமன் முடிசூட்டுவிழாவிற்கு உலகமக்கள் அனைவரும் வந்து சூழ்ந்தார்கள் அயோத்தியை.,False
699,முடிசூட்டுவிழா நடை பெறாமையால் அனைவரும் பெருத்த ஏமாற்றத்துடன் திரும்பினார்கள் தங்கள் தங்கள் நகருக்கு.,False
700,வீரர்களின் தொகைதான் அதிகம் என்றார் மற்றொருவர்.,False
701,ஆண்களின் தொகையே அதிகம் என்றார் ஒருவர்.,False
702,மங்கையரின் தொகையை மிகுதி என்றார் மற்றொருவர்.,False
703,இவ்வாறாக ஒருவரோடு ஒருவர் சண்டையிட்டுக் கொண்டனர்.,False
704,கம்பனும் கணக்கிட்டான்.,False
705,முன்னர் எண்ணியவர்கள் அனைவரும் தவறாகக் கணக்கிட்டார்கள் என்று கருதுகின்றான்.,False
706,தானும் கணக்கிட்டு ஒவ்வொரு வகையிலும் கணக்கிலடங்காத மக்கள் வந்தார்கள் என்று தனது முடிவினையும் கூறுகின்றான்.,False
707,இவ்வாறு படிக்கின்றவர்கள் உள்ளத்தை அள்ளுதற்கேற்ற கருத்துக்களை அங்கங்கே அள்ளித் தெளிக்கின்றான் கம்பன்.,False
708,மகிழ்ச்சியான செய்திகளைப் பற்றியும் துன்பமான நிகச்சிகளைப் பற்றியும் கம்பன் பாடும்பொழுது அந்தந்த நிகழ்ச்சிகளிலே தொடர்பு உடையவனாகவே பாடுவான்.,False
709,இராமன் முடிசூடப்போகிறான் அரசவீதிவழியே.,False
710,கம்பனுக்கு மட்டற்ற மகிழ்ச்சி.,False
711,ஒரே மகிழ்ச்சிப் பெருக்குத்தான் எங்கும்.,False
712,துக்க நிகழ்ச்சிகளைக் கம்பன் பாடும்பொழுதும் அப்படியே பாடுவன் தன்னை மறந்து பாடுவான் அழுது பாடுவான்.,False
713,இராமன் அயோத்தியை விட்டு வனத்திற்குப் புறப்படுங் காட்சி கம்பனின் கருத்தைக் கவர்ந்த காட்சி.,False
714,சோகச் சுவையைப் பாடிய போதிலும் நகைச்சுவையைக் கம்பன் மறப்பதில்லை.,False
715,நகைச்சுவை கலப்பதினாலே சோகச்சுவை குறைவதில்லை.,False
716,"இராமன் காட்டுக்குச் செல்வதை யறிந்து பசுக்கள் அழுதன, பசுக்கன்றுகள் அழுதன என்று பாடுகின்றான்.",False
717,ஏன் அவை அழுதன?,False
718,"பசுக்கள் அழுதமையால், பசுக்கன்றுகள் அழுதன என்று மற்றொரு கருத்தையும் தோற்றுவித்து நமது உள்ளங்களை அள்ளிக் கொள்ளுகின்றன.",False
719,அன்று மலர்ந்த பூக்கள் அழுதன என்கின்றான்.,False
720,கதைப்போக்கில் இராமன் பிரிவால் பூக்களும் அழுகின்றன என்று பொருள் கொள்ளப் பேசுகின்றான்.,False
721,குளத்திலுள்ள பூக்களில் வாழும் பறவைகளும் அழுதனவாம்.,False
722,"அலைகள் அடிக்குந்தோறும் எழுந்து எழுந்து உட்கார்ந்து இரைவது, அழுவது போலத்தானே இருக்கும்!",False
723,தேன் ஒழுகின்ற மலர்கள் நிறைந்த சோலைகளும் அழுதனவாம்.,False
724,தேனொழுகும் காட்சி கண்களிலிருந்து நீரொழுகும் காட்சிதான்.,False
725,இவ்வாறு சோகச் சுவையிலும் நகைச்சுவையைக் கலந்து சுவை கெடாது பாடுகின்ற பண்பு கம்பனுக்கு இயற்கையாக வாய்த்த பண்பு.,False
726,கம்பனின் கதையைப் படியுங்கள்.,False
727,காவியத்தின் சிறப்பை உணருங்கள்.,False
728,கம்பன் காட்டுகின்ற திறமையைக் காணுங்கள்.,False
729,ஆயிரக்கணக்கான பாடல்கள் உங்கள் மனத்தில் புகுந்து வெளிவரப் பெற்றால் உங்கள் மனமும் அறிவும் மென்மையும் கூர்மையும் பெறும்.,False
730,பெரியோர்களாக வாழ ஆசைப்படுவீர்கள்.,False
731,இலக்கியம் மனதைச் செம்மைப்படுத்தும்.,False
732,கம்பன் இராமாயணம் அதைச் செய்யும் என்பதைச் சொல்லவும் வேண்டுமோ?,False
733,நாவல் நாவல் என்பது புதுமையாய்ப் புனைந்து உரைக்கப்படும் ஒரு நீண்ட கதை.,False
734,இக்கதை உலகில் நடைபெறும் சம்பவங்களை அடிப்படையாகக்கொண்டே பெரும்பாலும் எழுதப்படும்.,False
735,சில கதைகள் கற்பனையாகவும் புனைந்து உரைக்கப்படும்.,False
736,வேறு சில கதைகள் மனித அறிவிற்கு அப்பாற்பட்ட தெய்வ சக்திகளின் நிகழ்ச்சிகளாகத் தீட்டப்படும்.,False
737,"குடும்ப நிகழ்ச்சிகள், மதநிகழ்ச்சிகள், சமுதாய நிகழ்ச்சிகள் இவற்றை அடிப்படையாகக் கொண்டே பல நாவல்கள் எழுதப்படுகின்றன.",False
738,இவ்வகையில் துப்பறிவும் நாவல்கள் சிறந்தவை.,False
739,"சில நாவல்கள் அமைதிக்கு இருப்பிடமாய் ஒரு குடும்பத்தாரின் நல்லியல்புகளை விளக்கி, குடும்பம் இருக்கவேண்டிய நிலையையும் விளக்கிச் செல்லும்.",False
740,இத்தகைய நாவல்கள் படிப்பவர்க்கு மிகுந்த பயனைத் தருவன.,False
741,மனிதரின் தீய பண்புகளையே படம் பிடித்துக்காட்டி அத்தீய பண்புகளால் அம்மனிதர் அடையும் முடிவையும் சுட்டிச் செல்லும் நாவல்கள் சில.,False
742,இவையும் மனிதர்க்குப் பல நீதிகளை ஊட்டும் நாவல்களாகும்.,False
743,"இத்தகைய பலதிறப்பட்ட நாவல்களை எழுதி வெளியிட்ட வருள் ஆங்கில ஆசிரியர்களும், பிரஞ்சு ஆசிரியர்களும், அமெரிக்க ஆசிரியர்களும் தலை சிறந்தவராவர்.",False
744,ரெயினல்ட் என்பவர் மிகச்சிறந்த ஆங்கில நாவலாசிரியர்.,False
745,இன்றைய நாவல் உலகத்தில் மிக்க புகழ் பெற்றவராகத் கருதப்படுபவர் பெர்ல்எபக் என்னும் அமெரிக்க நூலாசிரியர்.,False
746,இந்த அம்மையார் சீனத்தில் பல ஆண்டுகள் இருந்தவர்.,False
747,அதனால் சீனர் வாழ்க்கையைச் சித்திரித்துப் பல நாவல்களை எழுதியுள்ளார்.,False
748,இவருடைய நாவல்கள் உலக நாடுகள் அனைத்திலும் உள்ள அறிஞரால் பாராட்டப்படுகின்றன.,False
749,"இவருடைய நாவல் ஒன்று நோபெல் பரிசும் பெற்றது என்றால், இவரது நாவல்களின் சிறப்பை நாம் நன்கு அறியலாம்.",False
750,தொடக்கம் முதல் இறுதிவரைப் படிப்பவர்க்குப் பலவகைச் சுவைகளையும் ஊட்டும் இவருடைய நாவல்கள் இலட்சக்கணக்கில் விற்பனையாகின்றன.,False
751,நமது இந்தியாவில் பங்கிம் சந்திர சாட்டர்ஜி என்பவர் எழுதிய நாவல்கள் உலகப் புகழ் பெற்றவை.,False
752,நமது தமிழ்நாட்டில் முதன் முதலாக எழுதப்பட்ட நாவல் பிரதாப முதலியார் சரித்திரம் என்பது.,False
753,இதனை எழுதியவர் மாயூரம் முனிசீப்பாக இருந்த வேதநாயகம் பிள்ளை என்பவர்.,False
754,படிக்கப் படிக்கச் சுவை ததும்பும் இக்கதை நூல் இன்றளவும் பலரால் பாராட்டப்பட்டு வருகிறது.,False
755,மாதவய்யா என்வர் எழுதிய கமலாம்பாள் சரித்திரம் தமிழ் நாவல் உலகத்தில் மிகச் சிறந்ததெனப் பாராட்டப்படுகிறது.,False
756,இரங்கூன் பொன்னுசாமி பிள்ளை என்பவர் எழுதிய ஞானாம்பிகை முதலிய நாவல்களை குடும்பச் சித்திரங்களாகும்.,False
757,இவை குடும்ப வாழ்கையையும் குடும்பத்தார்க்கு இருக்கவேண்டிய குணங்களையும் மிகத் தெளிவாக விளக்குவன.,False
758,கும்பகோணம் துரைசாமி என்பவர் எழுதிய கருங்குயில் குன்றத்துக் கொலை என்னும் நாவல் இனிய எளிய தமிழ் நடையில் இயன்றது.,False
759,இக்கதைப் போக்குப் படிக்கப்படிக்க இன்பத்தைக் கொடுப்பது.,False
760,"இவர் நம்நாட்டிற்கு ஏற்ப, ஆங்கிலப் பெயர்களைத் தமிழ்ப்பெயர்களாக மாற்றி, இந்தியநாட்டு நிகழ்ச்சிகளாகக் கதைகளை மாற்றி அமைத்துள்ளார்.",False
761,ரெயினால்ட் நாவல்களி லுள்ள பலவகைக் குறைகளையும் இவர் தம் நூல்களில் வெளிப்படுத்தியுள்ளது பாராட்டத்தக்கது.,False
762,ஏறத்தாழ ஆண்டுகளுக்கு முன் இவர் எழுதிய நாவல்கள் தமிழ்நாட்டில் ஆயிரக்கணக்கில் செலவாயின.,False
763,"மேனகா என்னும் நூல் ஓர் உத்தம மனைவியின் உயர்ந்த பண்புகளையும், அவளுடைய நாத்திமாருடைய தீய பண்புளையும் விளக்க வல்லது.",False
764,திகம்பரசாமியார் என்பது சிறந்த துப்பறியும் நாவல்.,False
765,நம் தமிழ் நாட்டில் புகழ்பெற்ற நாவலாசிரியை இந்த அம்மையாரே ஆவர்.,False
766,"சந்திரகாந்தா, இராஜாம்பாள் முதலிய நாவல்களை எழுதி அழியாப் புகழ் பெற்றவர் ரங்கராஜு என்பவர்.",False
767,"மடாதிபதிகளின் ஒழுக்கக் கேட்டையும், சமுதாயச் சீர்கேடுகளையும் இவருடைய நூல்கள் படம் பிடித்துக் காட்டுவன.",False
768,இக் கதைகள் திரைப்பட உலகிலும் பெயர்பெற்றுவிட்டன.,False
769,ஏறத்தாழ முதல் வரையில் தமிழ் நாவல் உலகம் உறக்கத்திலிருந்தது.,False
770,இவை சிறந்த கருத்துக்களையும் சமூக சீர்திருத்தக் கொள்கை களையும் கொண்டுள்ளவை.,False
771,இக்காலத்திற்கு ஏற்ற சீர்திருத்தக் கொள்கைகளை அடிப்படையாக வைத்துப் பல நாவல்கள் சீர்திருத்த மனப்பான்மையுள்ள நூலாசிரியர்களால் எழுதப்படுகின்றன.,False
772,அவை சீர்திருத்த மனப்பான்மைகொண்ட இளைஞர்கள் விரும்பிப் படிக்கின்ற நூல்களாக இருக்கின்றன.,False
773,"பொன்னியின் செல்வன், சிவகாமியின் சபதம் முதலிய நாவல்கள் தென்னிந்திய வரலாற்றை அடிப்படையாகக்கொண்டவை.",False
774,அவை கல்கி ஆசிரியரால் எழுதப்பட்டவை.,False
775,எளிய நடையையும் உயர்ந்த கருத்துக்களையும் அவற்றில் காணலாம்.,False
776,இத்தகைய வரலாற்று நாவல்கள் மிகப்பலவாக நம் நாட்டில் பெருகுதல் வேண்டும்.,False
777,வரதராசனாரால் எழுதப்பட்டு வருகின்றன.,False
778,"செந்தாமரை, கள்ளோ காவியமோ, மலர்விழி முதலிய நாவல்கள் பலமுறையும் படிக்கத்தக்கவை.",False
779,இவை மிக எளிய தமிழ் நடையில் உயர்ந்த கருத்துக்களைக்கொண்டு விளங்குகின்றன.,False
780,சிறப்பாகத் தமிழ்நாட்டுக் கல்லூரி மாணவர்களும் உயர்நிலைப்பள்ளி மாணவர்களும் இந் நாவல்களைப் படித்துச் சுவைக்கின்றார்கள்.,False
781,தமிழ்ப்பண்பாட்டை அடிப்படையாகக்கொண்டு எழுதப்படும் இந்நாவல்கள் தமிழ் மாணவர்கள் உள்ளங்களைக் கவர்வதில் வியப்பில்லை அல்லவா?,False
782,இந் நாவல்கள் எல்லோரும் படிக்கத்தக்க எளிய ஆனால் பிழையற்ற நடையில் எழுதப்படுதல்வேண்டும்.,False
783,கருத்துக்களைக் கூறுவதோடு மொழிவளர்ச்சியிலும் துணைசெய்யும் நாவல்களே நாட்டுக்குத் தேவை.,False
784,"திரைப்பட வசனங்களும் பிழையற்ற முறையில் வெளிவரும் இக்காலத்தில், தமிழ் நாவல்கள் பிழையற்ற எளிய தமிழில் வெளிவருதல் மிகவும் அவசியமாகும்.",False
785,"அப்பேச்சு முறையில் எழுவாய், பயனிலைகளை ஒழுங்காக அமைத்து எழுதப்படுவதே வசனம் என்பது.",False
786,"எழுவாய், பயனிலைகள் முறைப்படியோ, மாறியோ அமையப் பல்வேறு இராகங்களில் அமைத்துப் பாடப்படுவது செய்யுள் அல்லது பாட்டு எனப்படும்.",False
787,அதனால் வசனம் பலரும் உணர்ந்து கொள்வது எளிது.,False
788,மேலும் செய்யுள் செய்வது பலரால் இயலாது.,False
789,பேச்சு நடையை இலக்கண அமைதிப்படுத்தி வரைவதே வசனம்.,False
790,"ஆதலால், பெரும்பாலோர் வசனம் எழுத வாய்ப்பு உண்டாகின்றது.",False
791,"ஆயினும், நமது தமிழ் இலக்கியவுலகில் செய்யுளே ஏறக்குறைய இரண்டாயிரம் வருடங்கள் தனி ஆட்சி புரிந்து வந்தது.",False
792,"கடைக்கு அனுப்பப்பட்ட சீட்டும், கவியிலேயே எழுதப் பட்டது.",False
793,அதுதான் சீட்டுக்கவி என்பது.,False
