Line Number,Sentence
3798,மாந்தர்க்கு மட்டுமா?
3799,பாகன் சொல்வழி நில்லாத யானையைச் சூத்திர யானை என்று பாகன் அடித்த அடியைக் கண்டு பாரதியார் வருந்தி எழுதினார்.
3800,வருணக் கூத்து இவ்வளவு அவ்வளவா?
3801,"சூத்திர எழுத்து ழ, ள என்னும் இரண்டேயாம்!"
3802,பன்னீர் உயிரும் முன்னொற்று ஆறும் மன்னிய அந்தணர் வருணம் ஆகும்.
3803,தநபம யர எனச் சாற்றிய ஆறும் மனமகிழ் அரசர் வருணம் ஆகும்.
3804,லவறன என்னும் நான்கும் புள்ளியும் இவர்தரு வணிகர்க்கு எய்தும் என்ப.
3805,ழள எனும் இரண்டும் வளமையர்க் காகும்.
3806,"இவை இலக்கண விளக்க நூற்பாக்கள், வளமையர் என்று நூற்பா கூறினும் உரை சூத்திர வருணம் என்றே கூறுகின்றது."
3807,"நூலியற்றியவரோ வைத்திய நாத தேசிகர், வெண்பா, அகவல், கலி, வஞ்சி என்னும் பாவகைகளுக்கும் வருணம் பூசினர்."
3808,இந்நிலையில் வள்ளுவப் பார்வை எப்படியுள்ளது.
3809,பிறப்பு ஒக்கும் அவ்வாறே சிறப்பும் ஒக்கும் என்கிறது.
3810,ஏன்?
3811,இன்ன தொழில் செய்வது சிறப்பு என்றோ இன்ன தொழில் செய்வது இழிவு என்றோ வள்ளுவம் கூறியது இல்லை.
3812,எத்தொழிலும் சிறப்புக் குரியதே என்பது அதன் விரி பார்வை.
3813,"வினைத் தூய்மை, வினைத்திட்பம், வினை செயல்வகை என்பவற்றில் இன்ன வினை என்னும் குறிப்பு உண்டோ?"
3814,இன்ன வினை உயர்வு.
3815,இன்ன வினை தாழ்வு என்னும் இரைச்சல் உண்டோ?
3816,இல்லையே!
3817,அம்மட்டோ?
3818,இனிப் புகழ் என்பதோர் அதிகாரம் திருக்குறளில் உண்டே!
3819,புகழை எப்படிச் சொல்கிறது குறள்?
3820,உயிர்க்கு ஊதியம் என்கிறது!
3821,புகழ் எப்படி வரும் என்கிறது?
3822,ஈதலால் வரும் என்கிறது!
3823,ஈதல் என்பது என்ன?
3824,பசிக்கு வழங்கும் உணவு அளவோ ஈகை?
3825,ஏனை ஏனை உதவிகளைச் செய்வதெல்லாம் ஈகையே!
3826,குருதிக் கொடை என்ன!
3827,கண்கொடை என்ன!
3828,சிறுநீரகக் கொடை என்ன!
3829,எல்லாம் ஈகையே!
3830,ஈகமே!
3831,"பிறர் நலம் கருதிய வாழ்வு உயர்வாழ்வு, மேல் வாழ்வு என்பது வள்ளுவப் பிழிவு."
3832,"தொழிற் சிறப்பு ஒக்கும் என்றால், சிறப்பொவ்வா செய்தொழில் வேற்றுமையான் என்கிறாரே திருவள்ளுவர்."
3833,இது முரண் அல்லவோ!
3834,என்று வினவத் தோன்றும்.
3835,"திருவள்ளுவர் இக்குறளில் தொழிலில், உயர்ந்த தொழில் தாழ்ந்த தொழில் என்று பேசவில்லை."
3836,எத்தொழில் ஆனாலும் அத்தொழிலைச் செய்யும் முறையிலேயே பெருமையும் சிறுமையும் உண்டு என்கிறார்.
3837,திருத்தமாக தெளிவாக நிறைவாக செம்மையாக எத் தொழிலைச் செய்தாலும் அத்தொழில் சிறப்பினதே!
3838,அவ்வாறு செய்யப்படாதவை சிறப்பில்லனவே என்கிறார்.
3839,கோயிற் சிலையினைப் பூசை செய்வோர் கொண்டு விற்றல் ஏற்ற தொழிலுக்குச் சிறப்பாகுமா?
3840,"கற்பித்தல் என்பது கண்ணளித்தல் புண்ணைக் கண்ணாக்கல், உள்ளொளி பெருக்கல் என்பவை வள்ளுவம்."
3841,"மதிப்புக்குரீய அத்தொழிலைச் செய்தார், கண்ணைக் கெடுத்துள்ளமை நாடறி பொருளாக உள்ளதே!"
3842,தொழில் செய் வேற்றுமை சிறுமைப்படுத்தி விட்டதன்றோ!
3843,ஓருயிரின் துடிப்பை மற்றோர் உயிர் தாங்கிக்கொள்ள மாட்டாமல் ஓடிப்போய்ச் செய்யும் உதவிக்குப் பெயர் மருத்துவம் என்பது உணர்வுடையோர் உரை.
3844,"ஒருவர் இருவர் அல்லர் முப்பதின்மர்க்கு மேற்பட்டவர், மேலை நாட்டுச் செய்தி இது."
3845,"தொழில் செய்முறை, தொழிலுக்குச் சிறப்புத் தந்ததா?"
3846,நாம் ஆய்ந்த குறள்!
3847,பெருமை அதிகாரஞ் சார்ந்தது என்று அறிந்து கொள்வதும் இப்பொருளுக்கு வலுவான சான்றாகும்.
3848,பெருமைக்கும் ஏனைச் சிறுமைக்கும் தத்தம் கருமமே கட்டளைக்கல் .
3849,.
3850,கல்வி ஒப்பு உயிரி என்பது உயிருடையவை அனைத்துக்கும் ஆகிய பொதுப் பெயர்.
3851,ஆனால் வாழும் உயிர் என்று சிறப்பித்துச் சொல்வது ஆறறிவு வாய்ந்த மாந்தரையே யாம்.
3852,"அவை, எண்ணும் எழுத்தும் என்பன."
3853,வாழும் உயிர்களுக் கெல்லாம் பிறப்போடு கண்கள் உண்டாயமை போல எண் எழுத்துக்களாம் கண்களையும் உண்டாக்கிக் கொள்ளுதல் கட்டாயக் கடமையாம்.
3854,அக் கண்களை உருவாக்கிக் கொள்வதற்குத் தகவே உடலாக்கங்கள் அமைந்துள.
3855,இவற்றின் புலன்களாக ஊறு சுவை ஒளி உயிர்ப்பு கேட்பு சிந்திப்பு என்னும் ஆறும் அமைந்துளவே.
3856,இப்புலன்களின் விளைவுதானே புலமை என்பது.
3857,புலமை அமைதல் தானே புலப்பாடு!
3858,புலன்கள் இருந்தும் புலப்படுதல் இல்லை என்றால் அது பிறவிக்கே இழிவு இல்லையா?
3859,படைப்பின் நோக்கத்தைப் பாழாக்குவது இல்லையா?
3860,"கல்வியா, கேள்வியா, அறிவுடைமையா எல்லாம் பொதுமைய."
3861,"இன்னவர்க்கே கல்வி, இன்னவர்க்குக் கற்பித்தலே ஆகாது!"
3862,இன்ன பாலினர்க்கே கல்வி இன்ன பாலினர்க்குக் கற்பித்தல் ஆகாது!
3863,தமிழர் பண்பாட்டில் அமைந்தது இல்லை.
3864,மக்கட்குப் பொதுப் பொருள் கல்வி என்பதே தேர்ந்த முடிவு!
3865,கண்ணொடு ஒப்பிட்டுக் கல்வியைக் கூறிய ஒன்றே அதனை மெய்ப்பிக்கும்!
3866,"பாட்டரங்கேறிய வேந்தர்கள், ஆய்வரங்கில் பங்கேற்ற அரசர்கள், நூல்களைத் தொகுப்பித்த காவலர்கள் பலர்."
3867,அரசரோடு பாவன்மையமைந்த அரசியாரும் பலர்.
3868,"வணிகப் புலவரென்ன, கொல்லர், கொற்றர், தச்சர், பூண்கொல்லர், குயவர் என்னப் பல்வேறு தொழில் வல்ல புலமையர் எண்ணறோர்."
3869,"மலைவாழ் எயினர் வேடர் புலமை நலமும், காவல் பணியர் புலமைத் திறமும் சிறந்து விளங்கினர்."
3870,"தொழிற் பொதுமை போலவே, பால் பொதுமையும் அப்புலமையர் பட்டியலைப் பார்த்த அளவில் புலப்படும்."
3871,"சாவுமளவும் கற்றல் கடமை என்று அவர்கள் கொண்டமை, சாந்துணையும் கல்லாதவாறு என்?"
3872,என்று வள்ளுவம் வினாவு வதாலேயே புலப்படுமே!
3873,அடுப்பை ஊதும் பெண்களுக்குப் படிப்பு எதற்கு?
3874,"என்று பெண்மையைப் பெரும் பழிக்கு ஆளாக்கி, வழிவழிச் சிறுமையைச் செய்தது ஏன்?"
3875,கலைமகளை உருவாக்கி வழிபடச் செய்து விட்டுக் கல்விக் கண்ணில் மண்ணை மூடியது ஏன்?
3876,தமிழரில் விழுக்காட்டினர்க்கு மேற்பட்டாரும் தற் குறியராகவும் கீறலிடுபவராகவும் போயது ஏன்?
3877,அதற்கு மேலேயும் மெய்ம்மையுணர்ந்த பாவேந்தர் ஊரைத் தீயிட்டு ஆவதென்ன?
3878,கற்க.
3879,கசடறக் கற்க.
3880,கற்ற பின் நிற்க.
3881,கேடில் விழுச்செல்வம் கல்வி.
3882,களரனையர் கல்லாதவர்.
3883,விலங்கனையர் கல்லாதவர்.
3884,இறை மாட்சி எதனால் உண்டாம்?
3885,இறை மாட்சிக்கு மூலம் எது?
3886,வள்ளுவ வழி ஆட்சியை மேற்கொள்ள வேண்டுமே!
3887,பல்கலைக் கழகங்கள் வள்ளுவப் பண்ணைகளாக விளங்க வேண்டுமே!
3888,இவற்றை உருவாக்கும் ஒரு தலைவன் உருவாகும் நாளே உலகில் நான்னாளாம்!
3889,"ஏனெனில் கல்வியைப் போலவே, வையகப் பொது நூல் அல்லவோ வள்ளுவம்!"
3890,.
3891,கல்விப் பயன் ஒப்பு கல்வி ஒப்பு முன் கண்டோம்.
3892,இனிக் கல்விப் பயன் ஒப்புக் காணலாம்.
3893,ஒரு சொல்லைத் தானும் பயன் இல்லாமல் சொல்வதைத் தாங்காதவர் திருவள்ளுவர்.
3894,அதற்கெனவே பயனில சொல்லாமை என்றோர் அதிகாரம் வகுத்தவர்.
3895,"பயனிலாச் சொல்லைப் பதர்ச்சொல் என்றும் அச்சொல் சொல்பவனையும், அதனை நன்று என்றும் பாராட்டுபவனையும் பதர்கள் என்றும் கடிந்தவர் திருவள்ளுவர்."
3896,"பதர்ச்சொல் படியாமல், செலச் சொல்ல வேண்டும் என்ற செந்தாப்புலவர் தம் நூலை அச்செம்மையில் வழுவிப் படைப்பரோ?"
3897,முழுமுதனை வாழ்த்தும் முதற்பாட்டை அடுத்தே கல்விப் பயனைக் காட்டி வைத்தார்.
3898,இறைமாட்சியை அடுத்தே கல்வியை வைத்த சிறப்பை மறவாது நினைத்தல் வேண்டும்.
3899,கல்லாரும் கற்றறி நூலோர்பால் கேட்டறிதல் வேண்டும் என்பதற்காகக் கேள்வியை வைத்தவர் அவர்.
3900,"எனைத்தானும் நல்லவை கேட்க என்றவரும் அவர் .அக்கல்வி, பயன் செய்யாமல் பயன்படாமல் ஒழிதல் ஆகுமா?"
3901,பதரைப் பெறவோ பாடுபடுவான்!
3902,"அப்படியே, ஓதி உணர்ந்தும் பிறர்க்குரைத்தும் தானடங்காப் பேதையிற் பேதையார் இல் என்னும் பேதையரைப் பெருக்கவோ கற்க வேண்டும்?"
3903,மனம் மன்னுதற் கருவி!
3904,"அங்கே மாசு மன்னினால், வாழ்வே மாசில் மன்னும்!"
3905,"அங்கே மாசின்மை மன்னினால், மாசிலாமணியாய்த் திகழும்!"
3906,மனம்போல் வாழ்வு என்பது அது தானே!
3907,இனிக் கல்வியைத்தான் எப்படிக் கற்க எத்தகையதாய்க் கற்க ஏவுகிறார் வள்ளுவர்!
3908,ஒரு முகப்பட்டுக் கற்க என்கிறாரே?
3909,"பன்முகப்பட்டுச் சிதறும் கல்வி, சிந்தையில் ஊன்றும் கல்வியாகுமா?"
3910,"சிதறும் கல்வி, காலமெல்லாம் பாதுகாப்பாம் கல்வி ஆகுமா?"
3911,அதனால்தான் எழுமையும் ஏமாப்பாம் பின்வரும் கால மெல்லாம் பாதுகாப்பாம் கல்வியாக ஒருமுகக் கல்வி விளங்கும் என்றார்.
3912,கல்வியில் மாசு இருத்தல் ஆகாது இருந்தால் கற்றவரிடம் மாசு இல்லாமல் ஒழியாதே!
3913,அவர் வாழ்வு மாசின் உறையுளாகத் தானே இருக்கும்?
3914,"இவற்றை எண்ணியே, கற்க என்றவர் கசடறக் கற்க என்றும், நிற்க அதற்குத் தக என்றும் கூறினார்."
3915,கற்றதனால் ஆய பயன் என் கொல்?
3916,என்று வினாவுகிறாரே திருவள்ளுவர்!
3917,கற்ற தன் பயன் இதுதானா?
3918,தூய அறிவன் வழியில் ஒழுகத்தானே கற்றனர்!
3919,கற்றவர் அறிவன் வழியைப் பற்றிக் கொண்டனரா?
3920,பற்றிக் கொள்ளாதவர் கற்றவர் ஆவரா?
3921,"அறிவறிந்த மக்கட்பேறு, பழிபிறங்காப் பேறாகவும் இருத்தல் அல்லவோ இலங்கறிவின் பயன்?"
3922,"விளங்கறிவு, இலங்கறிவு, வாலறிவு என்பனவெல்லாம் மக்கட் பேற்றின் மாண்பு அல்லவோ!"
3923,"கற்றும் அவற்றை அடையார் ஏட்டுக்கல்வி, கேட்டுக் கல்வியே அன்றித் தேட்டுக் கல்வி ஆகாதே!"
3924,"அக்கல்வி கற்பித்தலும், அடைதலும், அதனால் வாழ்தலும் ஏமாற்றும், வஞ்சமும் ஆதலன்றிக் கல்விச்சீர் ஆகாதே!"
3925,வாணிகம் செய்வார் கோல் சீரை எனப்படும்!
3926,மன்னவர் கோல் செங்கோல் எனப்படும்!
3927,உழவர் கோல் உயர்கோல் எனப்படும்!
3928,கற்பிப்பார் கோலும் கற்பார் கோலும் வஞ்ச ஏமாற்றுக் கோல்களாயின் அவர் வஞ்சரும் நஞ்சரும் ஆவரன்றிக் கற்போரும் கற்பிப்போரும் ஆகாரே!
3929,அவர்க்கு உறைவாம் கல்வி நிலையங்களும் கசடர் நிலையங்களேயன்றிக் கற்றோர் நிலையங்கள் ஆகாவே!
3930,ஏய்த்துப் பிழைக்கவும் எத்திப் பிழைக்கவும் பயிற்சி பெறுதற்கோ கல்வி நிலையங்களில் கால் வைத்தல் வேண்டும்?
3931,"காலக் கழிவும், பொருட் கழிவும் ஆனதன்றிக் கண்ட பயனும், கொண்ட பயனும்தான் என்ன?"
3932,கேடில் விழுச்செல்வம் கல்வியைப் பெற்றும் கேடராகவும் கேட்டுக்குத் துணை செல்பவராகவும் இருப்பாரை ஏற்பரோ?
3933,எந்நாடும் எம்நாடே!
3934,"இவற்றால், வள்ளுவக் கல்விப் பொதுமை போலவே கல்விப் பயன் பொதுமையும் வள்ளுவர் கண்ட கல்விச் சிறப்பாம்!"
3935,"அதனாலே, நூலை எடுத்த எடுப்பிலே, கற்றதனால் ஆய பயனென்கொல் வாலறிவன் நற்றாள் தொழாஅர் எனின் எனக் கல்விப்பயனை காட்டினார்."
3936,.
3937,செல்வ ஒப்பு செல்வ ஒப்பினைச் சிந்தித்தாரா வள்ளுவர்?
3938,குமுகாய ஒப்பந்தங் கண்டார் உரூசோ!
3939,பொதுவுடைமை கண்டவர் காரல்மார்க்கசு!
3940,அவர்களுக்கு முன்னைய பொருளியல் சிந்தனையாளர் சிலரும் இருந்துளர்!
3941,ஆனால் திருவள்ளுவர் அச்சிந்தனையில் ஊன்றியவரா?
3942,கல்வி செல்வம்.
3943,கேள்வியும் செல்வமே.
3944,"எனப் பல்லான்ற செல்வங்களைக் கண்ட திருவள்ளுவர், பொருட் செல்வத்தின் சீர்மையையும், செம்மையையும், செழுமையையும் சொல்லாமல் விடவில்லை!"
3945,அருளென்னும் அன்பு ஈன்ற குழந்தை பொருளென்னும் செல்வச் செவிலியால் வளர்க்கப்படும் என்றவர் அவர்.
3946,பொருட்டாக எண்ணக்கூடாதவரையும் பொருட்டாக எண்ணவைக்கும் பொருளே பொருள் என்றவரும் அவர்.
3947,பொருள் என்பது பொய்யாவிளக்கு என்று புகன்றவரும் அவர்.
3948,இல்லையே என்று இரவாமையை உரமாகக் கொண்டு உழைத்து வாழும் உயர்வைப் பாராட்டுகிறார்.
3949,அப்படிப்பட்ட நிலையிலும் பிறர் உதவி தேவைப்படும் வறியர்க்கும் தக்கோர்க்கும் உதவாதார் செல்வம் பாழ்ச் செல்வம் எனப் பழிக்கிறார்.
3950,அத்தகையரைக் கரும்பை ஆட்டிச் சாறு எடுப்பது போல் எடுக்க வேண்டும் என்கிறார்.
3951,"அரசு வருவாய்க்குரிய வழிகளைக் கண்டு அதனால் பொருள் சேர்த்து, தக்க வழிகளில் செலவிடத் தூண்டுகிறார்."
3952,"அதற்கு மாறாக மக்களை வருத்தியும் வாட்டியும், அரசு பொருள் கொள்வது வழிப்பறிக் கொள்ளையர்க்கு ஒப்பு என்று பழிக்கிறார்."
3953,நிலத்தில் பயிரிடுவோர் முதற்கண் பண்படுத்துவர்.
3954,பண்படுத்துதலில் முதன்மையானது நிலத்தை ஒப்புரவு செய்தல்.
3955,நிலம் மேடும் பள்ளமுமாக இருப்பின் மேட்டில் ஊன்றிய வித்தும் நாற்றும் அழுகிப் போய் அழியும்.
3956,ஒப்புரவு நிலமாக இருந்தால்தான் பயிர்கள் ஒப்ப வளர்ந்து உரிய பயனைத் தரும்.
