Line Number,Sentence
1470,எடு பற்றுக பற்றற்றான் பற்றினை அப்பற்றை கு.
1471,இது கூழை மோனை.
1472,இள. முதல் எதுகை அடி எதுகைத் தொடை அது காண்க.
1473,"முதல்நிலை அளபெடை முதல் நின்ற சொல்லின்கண்பின்னும் எழுத்து இருப்ப, முதலெழுத்து அளபெழுதல்."
1474,எடு காஅரி கொண்டான் கதச்சோ மதனழித்தான் ஆஅழி ஏந்த லவன்.
1475,உரை முதல் முரண் அடிமுரண் அது காண்க.
1476,முதல் மோனை அடிமோனை அது காண்க.
1477,முதற்குறை செய்யுட்கண் ஒரு பகாப்பதம் தன் முதலெழுத்துத் தொடை நயம் கருதிக் குறைக்கப்பட்டவழியும் தன்பொருளைத் தவறாது புலப்படுத்துவது.
1478,எடு மரைஇதழ் புரையும் அஞ்செஞ் சீறடி தாமரை எனற்பாலது மரை என முதல் குறைக்கப்பட்ட வாறு.
1479,"உரை முதற்சீர் கருவிளம், கூவிளம், தேமா, புளிமா என்னும் ஈரசைச் சீர் நான்கும் வீரசோழியத்துள் முதற்சீர் எனப்பட்டன."
1480,முதற்பா முற்பா அஃதாவது வெண்பா.
1481,"இதனுள், நுண்மை முதலிய நான்கும் காணப்படும்."
1482,பழமொழி என்னும் பதினெண்கீழ்க்கணக்கு நூல் இவ்விலக் கணம் பற்றிச் செய்ததே.
1483,நச். எடு முதுமொழி இல் காண்க.
1484,ஏது நுதலிய முதுமொழி என்ற தலைப்பும் காண்க.
1485,"முப்பான் சீர் அசை , ஈரசை , மூவசை , நாலசை ஆக, ."
1486,. மும்மூன்றாம் ஆவி இழிவு ஒன்பதாம் உயிராகிய ஐகாரக் குறுக்கம்.
1487,எடு கண்கெண் டையைமருட்டும் காண். சீர் முதற்கண் இரண்டு ஐகாரம் குறுகிக் குற்றெழுத்துக்களின் நீரவாய் நிரையசையாயின.
1488,உரை. முரண் முரண்தொடை தொ.
1489,முரண்அளபெடைத் தொடை ஈரடிகளிலும் தொடக்கச் சீரில் முரணான சொற்கள் வந்து அளபெழுவது.
1490,"எடு சீஇறடி மாதர் சினத்தினைக் காண்குவல் பேஎரெழில் கண்க ளிடை. சிறுமை, பெருமை முரண்."
1491,முரண் இயைபு இயைபுத் தொடை முரண்தொடையோடு இணைந்து வருவது.
1492,இவ்விரண்டும் இணைந்து வந்தவாறு.
1493,உரை முரண் இனக்குறள் வெண்பா அடி முதலில் முரண்தொடை அமைய வரும் குறள்வெண்பா.
1494,எடு இன்பம் விழையான் வினைவிழையான் தன்கேளிர் துன்பம் துடைத்தூன்றும் தூண் கு.
1495,உரை முரண்தொடை சொல்லாலும் பொருளாலும் மறுதலைப்பட்ட சொற் களைத் தொடுத்தல்.
1496,நச். முரண்தொடையின் ஐவகை .
1497,கருங்கை கருமை என்ற வண்ணம் இல்லை கொன்று வாழும் கை என்ற பொருளது.
1498,"ஆயின், சிறுமை என்ற சொல்லே இரண்டாமடியில் உள்ளது."
1499,"ஆகவே, பெருமை என்ற சொல்லும் மலை என்ற பொருளும், சிறுமை என்ற சொல்லொடு முரணின."
1500,"நீர் நசைஇ என்புழி, நீர் என்ற பொருளே தீ என்ற பொருளொடு முரணியது."
1501,"ஆகவே, செந்தீ என்ற சொல்லும் பொருளும், நீர் என்ற பொருளொடு முரணின."
1502,பைங்கிளி என்புழி யும் கிளி என்ற பொருளும் உண்டு பசுமையாகிய நிறப் பண்புச்சொல்லும் உண்டு.
1503,"ஆகவே, சொல்லும் பொருளும் சொல்லொடும் பொருளொடும் முரணியவாறு."
1504,"உரை முரண்தொடையின் மூவகை சொல் முரண், பொருள் முரண், சொல்லும் பொருளும் முரண் என்பன."
1505,இவ்விகற்பம் அளவடிக் கண்ணேயே கொள்ளப் படும் என்பது.
1506,உரை. முரண் நிரல்நிறை முரண்பட்ட சொல்லையும் பொருளையும் வரிசையாக அமைத்தல்.
1507,எடு பகல்செய்யும் செஞ்ஞாயிறும் இரவுச் செய்யும் வெண்திங்களும் மதுரைக்.
1508,", பகல், இரவு செம்மை, வெண்மை ஞாயிறு, திங்கள் என முரண்பட்ட சொல்லும் பொருளும் நிரல்நிறையாக அமைந்த வாறு."
1509,"பொருள் என்றது, ஈண்டு முடிக்க வரும் சொல்லை என்க. யா."
1510,முரற்கை கலிப்பா.
1511,முரிநிலை இயற்றமிழில் தேவபாணியாய் இறுதியிற் பாடும் தரவு.
1512,உரை முழுவிரளச் செந்தொடை அசை சீர் இசை இவை அடிதோறும் மாறிவருவது.
1513,எடு பூத்த வேங்கை வியன்சினை ஏறி மயிலினம் அகவும் நாடன் நன்னுதல் கொடிச்சி மனத்தகத் தோனே .
1514,யா .க.
1515,உரை முற்கட்டு பாட்டின் தொடக்கத்திலுள்ள எடுப்பு விறலிவிடு.
1516,டு முற்சீர் முதற்சீர்.
1517,முற்பா நால்வகைப் பாவினுள் முதலாவதாகிய வெண்பா.
1518,டு முற்றடி தூக்குப்பட்டு முடியும் அடி.
1519,முட்டடி என்று பேராசிரிய ரும் இளம்பூரணரும் பாடம் கொள்ப.
1520,முட்டடி நாற்சீரடி.
1521,இள. தொ.
1522,நச். முற்றியலுகரம் ஈற்றடி இறுதியில் வருதல் எடு இனத்துள்ள தாகும் அறிவு கு.
1523,இன்னாது இனியார்ப் பிரிவு கு.
1524,பேரறி வாளர் துணிவு ஆசாரக் பாடறியா தானை இரவு புன்கண் உடைத்தால் புணர்வு கு.
1525,"இவ்வாறு முற்றியலுகரம் ஈற்றடியிறுதியில் வருதல் தொல் காப்பியனார்க்கு உடன்பாடன்று, பிற்பட்ட வழக்கேயாம். தொ."
1526,அதனால் அஃது உயிர்முதன்மொழி வந்தியையுங்கால் கெடும் என்பது.
1527,இவை நிலைமொழித் தொழில்.
1528,இதுவும் நிலைமொழித் தொழில்.
1529,நாணுடை என்பது நேர்பு நேர் அன்று நேர் நிரையே யாம்.
1530,"ஆகவே, வருமொழி உகரத்தை இணைத்து உரியசை ஆக்குதல் கூடாது என்பது."
1531,நச். முற்றியலுகரமும் குற்றியலுகரமும் வருமொழியைச் சிதைத்து உரியசை கொண்டு நிற்றலில்லை.
1532,ச.பால. முற்று அளபெடை அளவடிக்கண் நாற்சீரினும் அளபெடை நிகழ்தல்.
1533,எடு குராஅம் விராஅம் பராஅம் உராஅம் யா.
1534,உரை முற்று இயைபு அளவடியில் நான்கு சீரிலும் இயைபுத்தொடை வருவது.
1535,இறுதி எழுத்தேனும் அசையேனும் சொல்லேனும் சீர்களில் ஒன்றிவரத் தொடுப்பது.
1536,எடு கண்ணும் புருவமும் மென்தோளும் இம்மூன்றும் ஈற்றசை உம்மை இயைபுத்தொடையாக நாற்சீரிலும் வந்தவாறு.
1537,உரை முற்று எதுகை அளவடிக்கண் நான்கு சீரிலும் எதுகை வருவது.
1538,எடு கல்லிவர் முல்லையும் மெல்லியலார் பல்லரும்பும் யா.
1539,முதல் இரு சீரும் ஒருவகையான் முரணிப் பின் கடை இரு சீரும் பிறிதொருவகையான் முரணுதலும் முற்று முரணாம்.
1540,முற்றுமுரண் காண்க.
1541,முற்று மோனை முதலியவற்றை அவ்வத்தலைப்புள் காண்க.
1542,உரை முற்று நிரல்நிறை நாற்சீர்களிலும் நிரல்நிறை அமைய வருவது.
1543,முடிக்கும் சொற் களும் முடிக்கப்படும் சொற்களும் முறையான வரிசையால் அமைவது நிரல்நிறையாம்.
1544,உரை முற்று முடுகு வெண்பா நான்கடியும் முடுகுச் சந்தமாக வரும் வெண்பா.
1545,"காய்ச்சீரான் அன்றி, கருவிளம் மிகவும் பயிலும் வெண்பாவில் இச்சந்தம் நிகழும். சங்."
1546,"அக. முற்று முரண் அளவடிக்கண், நாற்சீரிலும் முரண்தொடை யமையப் பாடுவது."
1547,எடு நெடுந்தோள் குறுந்தொடி வீங்குபிணி நெகிழ முதலிரு சீர்களும் தனிமுரண் பின்னிரு சீர்களும் தனி முரண் யா.
1548,உரை முற்றுமோனை அளவடிக்கண் நாற்சீரிலும் மோனைத்தொடை யமையப் பாடுவது.
1549,எடு அணியிழை அமைத்தோள் அம்பசப்பு அடைய யா.
1550,உரை முறை நிரல்நிறை முடிக்கப்படும் சொற்களையும் முடிக்கும் சொற்களையும் வரிசையாக நிறுத்தி அம்முறை பிறழாமல் பொருள் கொள்ளும் பொருள்கோள்.
1551,"அடிநிரல்நிறையும், இணை பொழிப்பு முதலாய நிரல் நிறையும் அவ்வத் தலைப்புள் காண்க."
1552,பொருள்கோடலைக் கருதியவழி இது பொருள்கோள் செய்யுள் அணிநலம்.
1553,கருதியவழி அணியாம் என்பது.
1554,யார் இவன் எம்கூந்தல் கொள்வான்? கலி.
1555,என் கூந்தலைத் தீண்டுகின்றவன் யார்? என்று கூறுபவள் தலைவி அதனைக் கேட்பான் தலைவன் என்பது முன்னத்தான் அறியப்பட்டவாறு.
1556,முன்னம் என்னும் உறுப்பின்றியும் செய்யுள் நிகழும்.
1557,பேரா. முன்னமாவது இடமும் செவ்வியும் தகுதியும் பற்றிய குறிப்பு.
1558,"இம்முன்னம் பிழையாமல் தலைவன்தலைவியரொடு செவிலி, தோழி, பாங்கன், பரத்தை முதலியோர் கூற்று நிகழ்த்துவர்."
1559,"பால. முன்னுதல் இல் வரப்பெறா, புகா என்பது."
1560,ஆசிரியம் வெண்பா என்னும் இரண்டு பாவிலும் முடுகியலடி மூன்றும் புகா. தொ.
1561,"பேரா., நச். மூவகைச் சீர்கள் இயற்சீர், உரிச்சீர், பொதுச்சீர் என்பன."
1562,இவற்றுள் இயற்சீர் எல்லாச் செய்யுள்களிலும் இயன்று நடத்தலின் சிறப்புடைத் தாதலின் முற்கூறப்பட்டது.
1563,"உரிச்சீர் எல்லாச் செய்யுட்கண் ணும் வருமெனினும், வெண்பாவிற்கும் வஞ்சிப்பாவிற்கும் உரிமை பூண்டு நிற்றலின் இடைக்கண் வைக்கப்பட்டது."
1564,பொதுச்சீர் அருகியன்றி வாராமையின் இறுதிக்கண் வைக்கப் பட்டது.
1565,"இனி, அவை ஈரசைச்சீர் மூவசைச்சீர் நாலசைச்சீர் என்னும் என்று முறைபற்றி வைக்கப்பட்டன எனினும் ஆம்."
1566,"தொல்காப்பியனார் நேர்பசை நிரைபசை கோடலின், நாலசைச் சீர் வேண்டார்."
1567,காக்கைபாடினியார் முதலாயினார் நேர்பசை நிரைபசை கொள்ளாமையின் நாலசைச்சீர் கொண்டனர்.
1568,"யாப்பருங்கலம், காரிகை என்பன இவ்வகையன."
1569,பல்காயனார் முதலாயினோர் நேர்பு நிரைபு அசைகளையும் கொண்டு நாலசைச்சீரும் கொண்டனர்.
1570,"நேர்பசை நிரைபசை கோடல் நுண்ணுணர்வினார்க்கல்லது புலனாகாமையின், அவற்றை விடுத்து நாலசைச்சீர் கொள்ளப்பட்டது."
1571,இவ்வாற்றான் மூவசைச் சீர் ஆம்.
1572,நச். இனி யாப்பருங்கல விருத்தி உரை வருமாறு.
1573,நேரசை நிரையசை என இரண்டசையானும் அமைந்த மூவகைச் சீர்கள் எட்டாம்.
1574,இம்மூவசைச்சீர் எட்டும் இருவகைப் பாக்களுக்கும் பெரும்பான்மையும் உரிமை பூண்டு நிற்றலின் உரிச்சீர் எனப்பட்டன.
1575,"அடிபிடியா, மடிபடியா மா."
1576,இவற்றுள் முற்றுகரம் எழுத்தாகக் கணக்கிடப்பட்டுள்ளது.
1577,"நச். மூன்றடிப்பா மூன்றடியான் இயன்ற ஆசிரியப்பா ச் சிறுமை, சிந்தியல் வெண்பா என்பன."
1578,"பிற, பாவினமாய் அடங்கிவிடும் என்பது."
1579,"மூன்றாம் எழுத்து ஒன்று எதுகை இரண்டாமெழுத்து ஒன்றாது, அடிதோறும் மூன்றாவது எழுத்து ஒன்றிவரத் தொடுப்பது."
1580,உரை. மெய் மிக்கு வருதல் எடு பற்றுக பற்றற்றான் பற்றினை அப்பற்றைப் பற்றுக பற்று விடற்கு கு.
1581,"உரை மெய்யின் மறுபெயர்கள் ஒற்று, உடம்பு, உறுப்பு என்பன."
1582,மெய்யுரை நூலுக்குப் பொருத்தமான உரை.
1583,உரை. மெய்வசை ஒருவனைப் பற்றி உண்மையாகவே வசை தோன்றப் பாடுவது.
1584,கல்வியறிவில்லாதவனையும் குறிப்பறியாதவனையும் மரம் என்று பழித்தவாறு.
1585,மெய்வாழ்த்து ஒருவனைப் பற்றி உண்மையாகவே வாழ்த்திக் கூறுவது.
1586,எடு கார்நறு நீலம் கடிக்கயத்துள் வைகலும் நீர்நிலை நின்ற பயன்கொலோ?
1587,மெல்லிசை வண்ணம் மெல்லெழுத்து மிகப் பெற்று வருவது.
1588,எடு பொன்னி னன்ன புன்னைநுண் டாது தொ.
1589,"இஃது அன்ன நடையும் தண்ணம் பறையும் போலவும், மணல்மேல் நடந்தாற் போலவும் வருவது."
1590,"மெல்லின எதுகை அடிதோறும் முதலெழுத்து அளவொத்து நிற்ப, இரண்டா மெழுத்தாகிய மெய் மெல்லினமெய்யாக இருப்பின், அவ்வெதுகை மெல்லின எதுகையாம்."
1591,எடு அன்பீனும் ஆர்வம் உடைமை அதுவீனும் நண்பென்னும் நாடாச் சிறப்பு குறள் யா.
1592,உரை மெல்லின நடை மெல்லெழுத்து மிகவும் வரச் செய்யுளைத் தொடுப்பது.
1593,எடு நன்னீரை வாழி யனிச்சமே நின்னினு மென்னீரள் யாம்வீழ் பவள்.
1594,மெல்லெழுத்தே வரத் தொடுப்பது மிறைக்கவியாம் இஃது அன்னதன்று.
1595,உரை மெலித்தல் விகாரம் செய்யுட்கண் தொடைநயம் கருதி வல்லெழுத்து அதன் இனமாகிய மெல்லெழுத்தாகத் திரித்துக் கொள்ளப்படுதல்.
1596,உரை மென்பா ஆசிரியப் பாவிற்கு ஒரு பெயர்.
1597,மென்மை எளிதிலே பொருள் தெரிதல்.
1598,இதன்கண் மெல்லினம் மெய்யும் உயிர்மெய்யுமாக மிகுதியுற வந்தவாறு.
1599,இயைபுக்கு ஈற்றுச்சீரையே முதற்சீராகக் கொண்டு கணக்கிடப் பெறும்.
1600,மேற்கதுவாய் நிரல்நிறை நிரல்நிறைத் தொடை விகற்பங்கள் காண்க.யா.
1601,உரை மேற்கோள் ஆசிரிய வசனமாகிய எடுத்துக்காட்டு.
1602,மொழிமாற்றுப் பொருள்கோள் அ.
1603,நாற்சீரடி இரண்டிலுள்ள சொற்களைப் பொருள் பொருந்துமாறு அறிந்து பிரித்து இணைத்துப் பொருள் கொள்ளுதல் சுண்ணமொழிமாற்று எனப்படும்.
1604,யாதோரடியை எடுத்து முதல் நடு இறுதியாக உச்சரிப்பி னும் ஓசையும் பொருளும் மாறாது வருவது அடிமறி மொழிமாற்று எனப்படும்.
1605,ஒவ்வோரடியிலும் கருத்துத் தனித்தனியே முடிந்துமாறுத லானும் ஏகாரத்தான் ஒவ்வோரடியும் முடிதலாலும் இப்பொருள்கோளுக்கு இப்பாடல் ஏற்றவாறு காண்க.
1606,இரண்டடி மொழிமாற்று எனவும்பட்டு இரண்டடிகளில் உள்ள சொற்களைப் பிரித்துப் பொருள் பொருத்தமுறக் கூட்டிப் பொருள் செய்வது அடிமொழிமாற்று எனப்படும்.
1607,எடு ஆலத்து மேல குவளை குளத்துள வாலின் நெடிய குரங்கு.
1608,"ஆலத்துமேல வாலின் நெடிய குரங்கு, குவளை குளத்துள என இரண்டடியிலும் மொழி மாற்றியவாறு காண்க."
1609,உரை மோனை அளபெடைத் தொடை சீர்களில் முதலெழுத்து ஒன்றி வந்து அளபெடுப்பது.
1610,அடிதோறும் முதற்சீர்கள் முத லெழுத்து ஒன்றிவந்து இரண்டாமெழுத்து ஆகாரம் அள பெழுந்தமையால் அடிமோனை அளபெடையும் அமைந்த வாறு.
1611,இனி இவற்றால் ஊரப்பட்ட மெய்யெழுத்துக்களும் இவ்வாறே கொள்ளப்படும்.
1612,தக்க இடத்தே வருமோனை அரசாக நிற்கும் தகுதியுடையது.
