Line Number,Sentence
958,"காதலரைப் பிரிந்தவர்க்கு மாலைப்போதும், மனக்கினிய இயற்கைக் காட்சியும் பெருவருத்தம் செய்வனவாகும்."
959,குறுந்.
960,"எருமையினம் தம் கழுத்திற்கட்டிய மணியொலிக்க, நடு யாமத்தில் இயங்கும் மாலைவரற்பாலராகிய அவர், மாலை கழிந்து நடுவியாமமாகியும், வந்திலர் குறுந்."
961,"அவர் நம்மை யுள்ளினராயின், வருவாரல்லரோ? என்று வருந்து கின்றாள்."
962,அனைமது கையர்கொல்?
963,இவ்வுரையாட்டால் பொழுது கழிய மாலை வருகிறது.
964,தனிமைத் துன்பம் ஒரு புடையே தோன்றித் தலைவிக்குத் துயர் விளைவிக்கின்றது.
965,"ஆற்றாத தலைவி தோழியை நோக்கி, தோழி, அவர் சென்ற நாட்டில், புன்கண் மாலையும் புலம்பும் இல்லையோ?"
966,"இருந்தால், அவரும் நம்போல் துயரெய்தி, நம்மை நினைந்து வந்திருப்பாரன்றோ? குறுந்."
967,என்று வினவுகின்றாள்.
968,"தோழி, தலைவியின் தலைமைப் பண்புகளை எடுத்தோதி ஆற்றுவிக் கின்றாள்."
969,இதனால் தலைவி கருத்தழிகின்றாள்.
970,"இது கேட்கப் பொறாத தோழி, நீ இவ்வாறு கூறல் நன்றன்று என்று கழறுகின்றாள்."
971,எனக் கலங்கி மொழிகின்றாள்.
972,"இவையாவும், இரங்கற் பொருளவாகத் தோன்றினும், தோழியோடு சொல்லாடி ஓராற்றால் ஆற்றியிருத்தற்கு ஏதுவாதலால் முல்லைத் திணையேயாகும் என்றே ஆசிரியன்மார் கூறுவர்."
973,"தலைவன் குறித்த பருவம் வருகின்றது மற்று, அவன் வரவு நீட்டிக்கின்றது."
974,தலைவிக்கு ஆற்றாமை மிகுகின்றது.
975,"அவள் தோழியைப் பார்த்து, தோழி காதலர் குறித்த கார்ப்பருவம் வந்தது அவர் வந்திலர் வருவர் என ஆற்றியிருப்பேமாக."
976,"கணவனைப் பிரிந்த பின்னரும் நீவிர் உயிர் வாழ்கின்றீர் போலும் என்பது போல, இக்காரின் வரவு இருக்கின்றது, காண் குறுந்."
977,"இவற்றைக் கேட்கும் தோழி, இது பருவமன்று என்று வற்புறுத்துகின்றாள்."
978,"நின்னையே வினவுகின்றேன், கூறுக குறுந்."
979,என்று பேசுகின்றாள்.
980,கார்காலம் வந்து விடுகிறது.
981,"விசும்பு முழுதும் கார் மழை பரவிக் கறுத்து, மின்னி, இடித்து, குன்றும் காடும் குளிர்ப்புமிகப் பெய்கிறது."
982,அவல்கள் பள்ளங்கள் தோறும் நீர் நின்று தெளிந்திருக் கிறது.
983,"மானினம் பிணையுடன்கூடி, பள்ளங்களில் நிற்கும் தண்ணீரையுண்டு இன்புற்றுத் திரிகின்றன."
984,"இக்காலத்தே, பெரும்பாலும் மாலைப்போது தொடங்கி நள்ளிரவு முற்றும் மழை பெய்வது இயல்பு."
985,ஆனேறுகளின் கழுத்தில் மணியோசை கேட்போர்க்கு மாலைப்போதின் மாண்பு காட்டி மகிழ்வுறுத்தும் ஒருபால் கானமஞ்ஞைகள் அகவும்.
986,"தோழி எய்தும் கவற்சியைத் தலைவி கண்டு, அவளைத் தேற்றுவதும் தன் கடனாதலை யுணர்கின்றாள்."
987,இதனால் இக் கருத்து அழகுற்று நிற்றலைக் காணலாம்.
988,"பிறாண்டும், தோழி, தலைவியை நோக்கி, கார்ப்பருவம் வருகின்றது நீ ஆற்றுவையோ? என்று கேட்கின்றாள்."
989,என்று பெருமிதம் படக் கூறுகின்றாள்.
990,என்று பேசுகின்றாள்.
991,"மேலும், தோழி, இத்துணை யன்புடைய நின்னைப் பிரிந்திருக்கும் தலைவர் நின்பால் அன்பிலர் போலும் என்று சொல்லாற் சுடுகின்றாள்."
992,இதன்கண் ஊர் என்றது தோழியை.
993,"இப் பேச்சினைச் சாக்கிட்டுப் பேசுவது என்று யாவரும் இக் காலத்து, வழங்குகின்றனர்."
994,இவ்வாறு சிலநாட்கள் கழிகின்றன.
995,"தலைவன் வாராமை யால் ஆற்றாத தலைவி, தன் வேறுபாட்டைத் தலைமகற்கு உணர்த்தக் கருதுகின்றாள்."
996,அவளது மாந்தளிர்போலும் மேனி வெளுத்துத் தோன்றுகிறது.
997,"அது கேட்டுத் தூதுவிடத் துணிந்த தோழி, அவர் யாண்டு உள்ளனரோ?"
998,"இவ்வண்ணம் தூது விட்டுத் தலைவன் வரவு நோக்கி யிருக்கும் தலைமகட்கு ஒருநாள் பாணன் போந்து, தலைவனது வருகையை உணர்த்துகின்றான்."
999,"அது கேட்டு எல்லையில் இன்பமுறும் தலைமகள், பாண, ஒன்று தெளிவாக அறிய விரும்புகின்றேன் காதலர் வருகையை நீயே கண்டனையோ?"
1000,அன்றிக் கண்டார் சொல்லக் கேட்டனையோ?
1001,"யார் வாய்க் கேட்டனை, கூறுக."
1002,எடுத்தனை யன்றோ? என்கின்றாள்.
1003,"இனி, இத் தோழியாவாள் யாவள்?"
1004,இவள் தலைமகளை வளர்த்து நற்குண நற்செய்கைகளால் தலைமை எய்துவித்த செவிலியின் மகள் என்பர்.
1005,"சுருங்கக் கூறின், அறிவே இவளது வடிவு அன்பே இவளது உள்ளம் அறமே இவளது நினைவு என்னலாம்."
1006,"இளமையிலிருந்தே இவள் தலைமகட்குச் சிறந்தவளாய், அவளோடு உடனிருந்து, உடன் பயின்று, உடனொழுகி வருபவளாவாள்."
1007,"இவ்வுரிமையால், வாய்த்த விடத்துத் தலைமகட்கு உற்றனவெல்லாம் தனக்கு உற்றனவாகக் கருதி இவள் கூற்று நிகழ்த்துவ துண்டு."
1008,"அதனையுடன்பட்டே ஆசிரியரும், ஒன்றித் தோன்றும் தோழிமேன் என அமைத்தோது கின்றனர்."
1009,"இத்தோழி, தலைமகள் தலைமகனை மணந்து இல்லிருந்து நல்லறம் புரிவதைக் கண்ணும் மனமும் குளிரக் கண்டு களித்திருக் கின்றாள்."
1010,"அக்காலத்தே, தலைவன், தலைவியொடு சுடி இன்புறுதற்குப் பெருவிதுப்புக்கொள்கின்றாள் அவனது உள்ளம் இன்ப நுகர்ச்சி குறித்துப் பெரிதும் துடிக்கின்றது."
1011,அது கழிகாமமாய் நோய் செய்யும் என்பது அறநூல் முடிவு.
1012,"அதனால், அவனைத் தெருட்டி நெறிநிறுத்துகின்றாள் தோழி."
1013,இதற்கு யான் என் செய்வேன் குறுந். என்று நயம்படக் கூறுகின்றாள்.
1014,"இவ்வண்ணம் ஒழுகுமிடத்துத் தலைவன் பிரிந்தேகிய வழி, தலைமகளை ஆற்றுவித்திருக்கும் பொறுப்புத் தோழிக்கு எய்துகின்றது."
1015,"பிரிந்தோர்க்கு மாலைப்போதும், அப்போது நிகழும் நிகழ்ச்சிகளும் பெருந்துயர் செய்வன வல்லவோ?"
1016,"அக்காலையில், கற்புவழி யொழுகும் தலைவியை ஆற்றுவிப் போர், அக் கற்பிற்குக் கேடு தருவனவற்றைத் தம் சொல்லில் மறந்தும் சொல்லக்கூடாது."
1017,தலைவியோ கற்பே உருவாயரைமந்த பொற்புடையவள்.
1018,அறக்கழி வுடைய சொல்லும் செயலும் தோன்றின் அவள் அப்போதே உயிர் விடுவள்.
1019,அச்சொல்லும் பொருட்பயம் படவரின் அமையும் என்பது குறிக்கொள்ள வேண்டியதாகும்.
1020,இப்பெற்றியளாய தலைமகளை ஆற்றுவிப்போர் நுண்ணறிவும் மென்மொழியும் உடையராதல் வேண்டும்.
1021,"அதனால், தோழி இவ்வமைதி முற்றும் உடையளாய் விளங்கு கின்றாள்."
1022,"இவள், தலைமகன் பிரிந்தேகியது கண்டு, ஆற்றாளாகிய தலைமகளை, ஆற்றுவிக்கத் தொடங்கி, முதற்கண் அவனது காதன்மை கூறித் தலைமகளை வற்புறுத்துகின்றாள்."
1023,"இவ்வாறிருக்கையில், தலைமகனது வரவு நீட்டிக்கின்றது தலைமகளும் பிரிவாற்றாது பெரிதும் துயரடைகின்றாள்."
1024,அறிவர் ஒருவர் அவள் கண்ணெதிர்ப்படுகின்றார்.
1025,"தோழி, அவரை யண்மி, ஐய, எம் காதலர் கார்ப்பருவத்தே வருவரென மொழிந்து பிரிந்தேகினர்."
1026,வாடைக்காற்று எறியும் காலத்தை யேனும் சொல்லுக.
1027,"அதன் இறுதியே கார்காலமாதலின், அதுகொண்டு அவர் வரவினை உணர்ந்து கொள்வோம்."
1028,"பின்னர், அதனைத் தலைமகட்குரைத்து அவளை யாற்றுவிக்கின்றாள்."
1029,பின்னரும் தலைமகளது பிரிவுத்துன்பம் மிகுகின்றது.
1030,"அது காணும் தோழி, கவலை மிகவுற்று எத்துணையோ நய மொழிகள் நவில்கின்றாள்."
1031,இதற்குள் அறிவர் உரைத்த வாடைக்காலம் வருகிறது.
1032,தலைமகள் துயர் மிகுந்து வருந்துகிறாள்.
1033,என்கின்றாள்.
1034,இச்சொல் தலைவிக்கு வருத்தம் செய்கிறது.
1035,அவள் அச் சொல்லைக் கேட்கப் பொறாது அமைந்தொழிகின்றாள்.
1036,என்று தேற்றுகின்றாள்.
1037,இவ் வகையில் சின்னாட்கள் கழிகின்றன.
1038,கார்ப்பருவமும் வந்தேவிடுகிறது.
1039,தலைமகன் வாராமையால் தலைவிக்குப் பிரிவு நோய் பெருகிப் பேதுறவு செய்கின்றது.
1040,அதனினின்றும் அவளைப் பாதுகாக்கும் கடன் தோழிக்கு மிகுகின்றது.
1041,தலைவன் வரவிருக்கும் காலத்தையும் நாளடைவில் தோழி உணர்ந்து கொள்கிறாள்.
1042,இதோ கார்ப்பருவம் வந்துவிட்டது.
1043,"மாலைப்போது வருதலால், கோவலர் வீடு நோக்கி வருகின்றனர்."
1044,இருந்தாற்போல் இருந்து மணியோசை கேட்கின்றது.
1045,"அது கேட்கும் தோழி, இது தலைமகன் தேர் மணியோ? ஆனினத்தின் கழுத்திற் கட்டப்பெற்றிருக்கும் மணியோ?"
1046,என்று ஐயுறுகின்றாள்.
1047,"பின்னர்த் தலைவி, கார்ப்பருவம் வந்தால் ஏன்?"
1048,தலைவர் தம் வரவு நீட்டியாரோ? என்று ஏங்கி வினவுகின்றாள்.
1049,"சிறது போதில், தலைமகன் தேர் வருகின்றது."
1050,"இனி, இத் தோழியின் தாயாகிய செவிலியின் செயல்கள் சில இம் முல்லைத் திணைக்கண் இந் நூலுட் காணப்படு கின்றன."
1051,"ஆசிரியர் தொல்காப்பியனாரும், ஆய் பெருஞ் சிறப்பின் அருமறை கிளத்தலின், தாய் எனப்படுவோள் செவிலியாகும் என்று கூறினர்."
1052,கற்பினும் இச் செவிலியது சொல்லே சான்றேரால் உயர்த்துப் பேசப்பெறுகின்றது.
1053,"தலைமகனது காதற் சிறப்பும், இருவரது வாழ்க்கைச் சிறப்பும் செவிலிக்குப் பெரு மகிழ்ச்சியைத் தருகின்றன."
1054,"அவள் பின்பு, தன் மனைக்குச் சென்று, ஆங்கே, தலைமகளின் நற்றாயைக் காண்கின்றாள்."
1055,செவிலி நற்றாய்க்குத் தோழி என்பது முன்பே கூறப்பட்டது.
1056,"நற்றாய், செவிலியை நோக்கி, தோழி, நம் நன்மகள் வாழும் கடிமனைக்கண் நீ கண்ட சிறப்பென்னை? என்கின்றாள்."
1057,"அது கேட்டவழி, நற்றாய்க்கும் சூழ இருந்தார்க்கும் தலைமகள் புளிக்குழம்பு அட்டவகையை அறிதற்கு அவ உண்டாகின்றது."
1058,அதனால்.
1059,தயிர் பிசைந்த கையைக் கழுவுதற்குக் காலமில்லை என்கின்றாள்.
1060,இது கேட்டு அனைவரும் மகிழ்ச்சியால் நகைக்கின்றனர்.
1061,"இச்செவிலியே, பிறிதொருநாள் தலைமகளது கடிமனைக்குச் சென்று வருகின்றாள்."
1062,"முன்பு சென்று வந்த போது, தலைமகளது அடிசிற் றொழில் வன்மையை வியந்து கூறினாளன்றோ?"
1063,"இதுபோது, தலைமகனதுஅயரா அன்பினை வியந்து பேசுகின்றாள்."
1064,"இஃது, அவள் நற்றாயிடம் சொல்லியதாகும்."
1065,தலைமக்கள் களவொழுக்கம் பூண்டு ஒழுகும் காலத்தும் தலைமகன் பொருள் குறித்துப் பிரிவதுண்டென மேலே கூறினோ மன்றோ?
1066,அப்பிரிவை ஆற்றி யிருத்தலும் தலைமக்கட்குக் கடனாகும் முல்லைத் திணைக்கு உரியது மாகும்.
1067,அந் நிலையில் இவர்கள் நிகழ்த்தும் கூற்றுக்கள் பலவும் ஈண்டு விரிக்கலுறின் பெருகும்.
1068,"இனி, இம் முல்லை யொழுக்கத்தின்கண் நிகழும் கூற்று வகைகளுள் பலவகைக் கருப் பொருள்கள் காணப்படுகின்றன."
1069,"இவ் வொழுக்கம் முல்லை நிலத்தேயன்றி, சிறு பான்மை, பிற நிலங்களிலும் நிகழும்."
1070,"அக்காலத்தே, ஆங்குத் தோன்றும் கருப் பொருள்களே அவர் கூற்றுக்களிற் காணப்படும்."
1071,"ஆயினும், முல்லைத் திணைக் கென்றே வரை யறுத்தோதும் கருப்பொருள்கள் சிலவற்றை ஈண்டுக் கூறுகின்றோம்."
1072,"முல்லைத் திணைக்குக் கார்ப்பருவமும் மாலைப் பொழுதும் முதற் பொருளாக வருமாதலின், மழையும் கானமும் முதற்கண் தோன்றுவனவாகும்."
1073,"இம்மழை குன்றிடையும், கானத்தும் மின்னி யிடித்துப் பெயல் மிகுவது பாட்டுத் தோறும் பெரும்பாலும் வருகிறது."
1074,இடி முழக்கம் நன்கு இசைக்கப் பெறுகிறது.
1075,"இவ்வாறு மழை பெய்யுமிடத்து, உண்டாகும் மின்னல் இரவுக் காலத்துப் படரும் காரிருளைக் கெடுக்கும் என்பது அனைவரும் அறிந்த செய்தி."
1076,தாழிருள் துமிய மின்னி என்று இக் குறுந்தொகை குறிக்கின்றது.
1077,"கார் காலத்து மழை பெரும்பாலும் மாலையில் வருவது அதுபோது, கார் மழை விசும்பை மூடிக்கொள்வதால் இருள் மிகுகிறதன்றோ?"
1078,மழை பெய்யுங்கால் உழவர் இனிது உழுதல் முடியாது ஆகவே உழவு மாடுகள் ஓய்ந்திருக்கும் என்பது உலகறிந்தது.
1079,"இது, உவரி ஒருத்தல் உழாது மடிய........"
1080,இடியொடு மயங்கி இனிது வீழ்ந்தன்று மழை என இயம்பப்பெறுகிறது.
1081,மழையில்லாமையால் புழுதி படிந்து தோன்றும் துறுகற்கள் மாறு படிந்த யானை போலத் தோன்றுமென்பது.
1082,"மழை கழூஉ மறந்த மாயிருந் துறுகல், துகள்சூழ் யானையின் பொலியத் தோன்றும் என்ற அடிகளால் காட்டப் பெறுகின்றது."
1083,"மழைபெய்த கானத்தில் மானினம் துணையொடு கூடி, பள்ளங்களில் நிற்கும் நீர் பருகி இனிது திரிகின்றன."
1084,"இச்செய்தி வன்பரல் தெள்ளறல் பருகிய இரலைதன், இன்புறு துணையொடு மறுவந்து உகள என வருகிறது."
1085,களிறுகள் பிடிபுணர்ந்து மலையகத்தே ஒடுங்கிக் கிடக்கின்றன.
1086,"மாலைப்போதில், ஆனினம் தாம் மேய்ந்திருந்த கானத்தின் நீங்கி மனையகம் நோக்கி வருகின்றன."
1087,"முல்லை நிலத்தவர், காடு கெடுத்துப் பண்டே யாக்கிய கொல்லையை நன்கு உழுது வரகு முதலியவற்றை விதைப்பர்."
1088,அவர் தலையிலும் முல்லையால் தொடுக்கப்பெற்ற கண்ணிகள் இருந்து நறுமணம் கமழும்.
1089,"இந்நிலத்தே, பலவகைப் பூவினம் காணப்படுமெனினும், இக்குறுந்தொகை சிலவற்றை எடுத்துச் சிறப்பிக்கின்றது."
