Line Number,Sentence
1472,இவ்வாறு பண்பாட்டுப் பெருமித ஒட்டு மொத்தத்தை இன்று நம்முன் எவரொருவரேனும் நெஞ்சாரக் கூற முடியுமா?
1473,"ஓரவை, கற்றோர் பேரவை ஆங்குளார் எத்தகையார்?"
1474,என்று அருமையாகக் கூறுகிறது ஆசிரியமாலை என்னும் நூல் புறத் திரட்டு.
1475,"இவ்வளவு விரைவிலா மக்களாட்சி, மாக்களாட்சி ஆகிவிட வேண்டும் ஆக்கி விடவும் வேண்டும்!"
1476,வள்ளுவத்தின் நூறாம் அதிகாரம் பண்புடைமை ஆம் அதிகாரம் சான்றாண்மை.
1477,"குடிமை மானம் பெருமை , , என்பவற்றைக் கூறிய வரிசையின் நிறைவு பண்புடைமையாம்."
1478,"தோற்றத்தால் வேற்றுகை இல்லாப்பிறப்பினர் எனினும் என்ன, பண்பாட்டில் ஒத்தவராகத் திகழ்கிறார்களா?"
1479,பண்பாட்டின் ஒப்பே மாத்தர் ஒப்பு.
1480,தன் கூர்மையால் பிற கருவிகளையும் கூர்மையாக்குவது அரம்.
1481,அதுபோல் தன் அறிவுத்திறத்துடன் பிறரையும் அறிவுத் திறத்தராக மாற்ற வல்லாரும் உளர்.
1482,சான்றாண்மையின் மேல்வைப்பாய்ப் பண்பாடு அமைதலை விளக்குவன இவை.
1483,அவ்வறுமையைத் தொலைத்து மீட்டெடுப்புச் செய்தல் பண்பாட்டுக் காதலர் கடமையாம்.
1484,.
1485,"ஒரு தீர்மானம் ஒரு காலத்தில், சப்பான் உருவாக்கமா?"
1486,தரக் குறைவானது என்னும் எண்ணம் உலகவர் கருத்தில் இருந்தது.
1487,"தர மேம்பாட்டை இசாசோ, என்பவர் விரும்பினார்."
1488,அமெரிக்காவில் இருந்து உருவாக்க மூளையர் சிலரைச் சப்பானுக்கு அழைத்து உருவாக்கத்தில் மேம்பாட்டைப் புகுத்தினார்.
1489,தரக் கட்டுப்பாட்டையும் மேம்பாட்டையும் உலகுக்கு வழங்கிய முதல்வரும் மூலவரும் இசவோ என அவருக்குப் பெயராயிற்று.
1490,இப்பொழுது தரக்கட்டுப்பாட்டு ஆய்வில் சப்பான் தலைநிற்கும் நாடாகத் திகழ்கின்றது.
1491,அதன் திட்டவழியை இந்தியாவும் பற்றிக் கொள்ளும் நிலையில் உள்ளது.
1492,தரக் கட்டுப்பாட்டுக் குழுமம் குவாலிடி கண்ட்ரோல் சர்க்கிள் கெக்கந்திராபாத்தில் இருந்து இயங்கு கின்றது!
1493,சிந்திக்க வேண்டும் ஓர் எளிய.
1494,ஆனால் அரிய செய்தி இது!
1495,?
1496,என்றது பாவேந்தர் வினா?
1497,"ஆனால், விலை தந்து தான் வாங்க முடியும் என்பது நாம் காணும் இன்றை நிலை!"
1498,ஒவ்வொரு மாணவர் பெயராலும் பல இலக்கங்கள்!
1499,வறிய நாட்டின் பெரிய செலவு.
1500,ஆனால் நிகழ்வது என்ன?
1501,அந்நாட்டைக் கொழுக்க வைக்க ஆங்கேயே குடியுரிமை யராகவும் நினைக்கின்றனரே!
1502,இந்த நிலை பெற்று வளர்த்து ஆளாக்கிய பெருந்தகைமைத் தாய்நாட்டுக்குச் செய்யும் கைம்மாற்றுக் கடனாமா?
1503,அவர்களுக்கு அவ்வார்வம் கற்கும் பருவத்திலேயே கருவாகக் காரணம் என்ன என்பதையும் எண்ணத்தான் வேண்டும்.
1504,இல்லையே!
1505,"இந்நிலைமை மாறாத வரை, அயல்நாட்டு மோகம் நீங்க வழியுண்டா?"
1506,அதற்கும் இல்லையே என்பதா மறுமொழி!
1507,அண்மையில் நிகழ்ந்த வளரும் நாடுகள் மாநாட்டில் வலியுறுத்தப்பட்ட முடிவுகளுள் ஒன்று இன்றியமையாதது.
1508,இவ்விரண்டு கடமைகளும் ஒன்றற்கு ஒன்று தாங்குதலாய் அமைபவை.
1509,ஆனால் நம் கண்காண வாழ்ந்த தமிழகத்து எடிசனார் கோ.
1510,துரைசாமியார் சி.டி.
1511,"நாயுடு மூளைக்கூர்ப்பும், உருவாக்கத் திறனும் நாட்டுக்கு முழுதுறு பயனாக்க அரசு முயன்றதா?"
1512,முனைந்ததா?
1513,"முயலாத, முனையாத கேடு, அவர்க்குத் தீமையானதா?"
1514,நாட்டுத் தீமையானதா?
1515,"புத்தாக்கம் புரிவாரைப் போற்றிப் பயன் கொள்ளாத நாடு, புத்தாக்கிகளை அயல் நாடுகளுக்கு ஓட ஓட வெருட்டியடிக்கும் நாடேயாம்!"
1516,செய்தக்க அல்ல செயக்கெடும் செய்தக்க செய்யாமை யானும் கெடும் என்பது நம் மறை.
1517,.
1518,இப்பழம் பாடல் மட்டும் தானா இப்படிக் கூறுகிறது?
1519,திருக்குறளில் எல்லாப் பொருளும் உண்டு என்றால் எல்லாப் பொருளும் தாம் எவை என்று கேட்கத் தோன்றும்.
1520,ஆடு மேய்ப்பவன் ஒருவன் தான் ஆட்டை ஓட்டும் டோ டோ என்னும் ஒலி திருக்குறளில் உண்டா?
1521,சேது அவர்கள்.
1522,இப்படியெல்லாம் ஒவ்வொருவர் நினைத்த சொல்லும் பொருளும் செய்தியுமெல்லாம் திருக்குறளில் உண்டா என்று ஆய்ந்து பார்க்கவேண்டியது இல்லை.
1523,"புத்தம் புதுத் துறைகள் மெத்த வளரும் இற்றைக் காலநிலைக்கு, ஈராயிரம் ஆண்டுகளுக்கு முற்பட்ட திருக்குறள் ஈடு தருமா?"
1524,ஒத்து வருமா?
1525,என்று ஐயுறுவார் உளர்.
1526,பிறப்பு ஒக்கும் எல்லா உயிர்க்கும் என்னும் திருக்குறளில் பிறப்பு வேற்றுமைக்கு என்ன இடம் உண்டு?
1527,மனத்துக்கண் மாசிலனாதல் அனைத்தறன் என்னும் அற நூலில் மாசேற்ற என்ன வழியுண்டு?
1528,ஒத்தது அறிவான் உயிர் வாழ்வான் என்பதனை வரம்பிடும் குறளில் இல்லாத வாழ்வியல் என்ன இருக்க முடியும்?
1529,விருந்து இத்தனை வகை இன்னவகை என்பதா?
1530,உடை இவ்வகையது இவ்வண்ணத்து என்பதா?
1531,உறைவிடம் வடிவு இது வனப்பு இது என்பதா?
1532,"காவல் என்பது கருவி இது, ஆள் எண்ணிக்கை இப்படி ஊர்தி இவ்வகை என்பதா?"
1533,இவற்றின் அடிப்படைகளையே கூறும் குறளின் பொருள் எப்படி மாற்றம் அடையக்கூடும்?
1534,மாறாதவற்றைத்தானே அது கூறவே எடுத்துக் கொண்டு கூறுகின்றது.
1535,ஒற்றும் தூதும் இத்தகைய என்பதை அன்றி ஆள் உயரம் அளவு உடைக் குறிப்புகளையா அது சொல்கின்றது?
1536,ஆதலால் காலம் காலமாக ஞாலம் முழுமைக்கும் வழிகாட்டும் உலக ஒப்புரவு நூலாகத் திகழ்கின்றது திருக்குறளாகும்.
1537,அல்லது இட்டுக் கட்டியதாகும்.?
1538,நம் அறிவு வளர்கிறதா?
1539,நம் எண்ணம் சிறக்கிறதா?
1540,புத்தம் புதுத் துறையில் புகுகிறோமா?
1541,திருக்குறள் அவற்றுக்கெல்லாம் ஈடு தருகின்றது.
1542,"நாம் வளர வளர, நம் பார்வை வளர வளரத் திருக்குறள் பயன்பாடும் வளர்கின்றது."
1543,திருக்குறளைக் கற்பார் தேடுவார் நோக்கம் என்ன?
1544,அந்நோக்கத்திற்குத் தக அது நுண்ணியற் கருத்துகளை வழங்குகின்றது.
1545,இந்நோக்கில் நீங்கள் ஊன்றிய துறை என்ன?
1546,உழைத்து உழைத்து உயரும் துறை என்ன?
1547,அதன் நோக்கில் திருக்குறளை நோக்குங்கள்!
1548,உங்கள் நோக்குக்கு நூறு நூறு கருத்துகள் திருக்குறளில் வாய்க்கும்!
1549,வைப்பகத் துறை உண்டா?
1550,காப்பகத்துறை உண்டா?
1551,மாசுகட்டுப்பாடு உண்டா?
1552,மகக்கட்டுப்பாடு உண்டா?
1553,? விண்ணியல் ஆய்வு உண்டா?
1554,தோய்ந்து தோய்ந்து பாருங்கள்!
1555,ஆய்ந்து ஆய்ந்து பாருங்கள்!
1556,கையிற் கனியெனக் கருதுவனவற்றைக் கண்டு மகிழ்வீர்கள்!
1557,இவ்வுரை படிப்பறிவு உரைமட்டுமன்று.
1558,பட்டறிவும் கூட்டிச் சேர்ந்து வழங்கிய பட்டய உரையாம்.
1559,.
1560,எல்லாரும் இதற்கு உரியர் எல்லாப் பொருளும் இதன்பால் உள என்னும் பொருளை முன் கண்டோம்.
1561,"மாந்தராவார், எல்லாரும் இதற்கு உரியர் என்பதை ஓரளவில் எண்ணுவோம்."
1562,திருக்குறளைப் பொதுமறை என்றும்.
1563,தமிழ்மறை என்றும் முந்தையோர் கொண்டனர்.
1564,அதனை நம்மறை எனக் கண்டார் குறளாயத் தோன்றலும் குறளிய நிறுவனரும் ஆகிய வேலா அரச மாணிக்கனார்.
1565,நம்மறை எனின் சுருங்கிய வட்டமாகி விடுமா?
1566,"ஆதலால், குறளை ஏற்றுக் கொள்ளும் நெஞ்சுடையார் தம்மையெல்லாம் தன்னகத்துக் கொள்ளும் கொள்கை நூல் சுருங்கியது ஆகாதாம்."
1567,திருக்குறள் நம்மறை எனப் புதுவை வேலாயுதனார் தம் இல்ல முகப்பில் இரும்புக் கதவு வார்ப்படத்தில் அமைக்க விரும்பினார்.
1568,அவ்வாறே செய்ய ஆணையும் தந்தார்.
1569,வந்த வார்ப் படத்தைப் பார்த்து அதிர்வுற்றார்!
1570,ஏன்?
1571,திருக்குறள் நன்மறை என்று வார்ப்படம் ஆகி இருந்தது.
1572,நம்மறை என்பது நன்மறை ஆக வார்ப்புப் பெற்றதும் பொருட் குறைவு உடையதாகி விடவில்லையே.
1573,திருக்குறள் உலகுக்கு வாய்த்த நன்மறை தானே!
1574,பிற எம்மறைக்கும் இல்லாத தனிமறை அல்லவா அது!
1575,நம் நூல் என்றும் நம் தமிழ் நூல் என்றும் நம் காதலால் மொழிவதா இது?
1576,உலகம் ஏற்றுக் கொண்டு உவக்க உவக்கப் பாராட்டும் இவ்வுண்மையைத் தமிழன் உரைப்பதால் தாழ்வாகி விடுமா?
1577,என்று அறிஞர் துறு கூறும் இது திருக்குறளின் விரிவுச்சிறப்பை விளக்குவது அல்லவா!
1578,அப்படிச் சமயப்பார்வை கொண்டு எந்த ஒருவராலும் விலக்கக் கூடிய நூல் அல்லவே திருக்குறள்!
1579,அதனால் அல்ல வோ எவ்வெச் சமயத்தாரும் தத்தம் சமயத்தோடு சார்த்திக் கூறும் சால்பு நூலாகத் திருக்குறள் திகழ வாய்க்கின்றதாம்!
1580,இதோ சமயச்சார்பு மிக்குடைய கல்லாடர் என்ன சொல்கிறார்?
1581,சமயக் கணக்கர் மதிவழி கூறாது உலகியல் கூறிப் பொருளிது என்ற வள்ளுவர்!
1582,என்று பாராட்டுகிறோரே!
1583,"சமயத்தால் பிரித்துப் பார்க்க இயலாச் சால்புடைய திருக்குறள், பிறப்பு வேற்றுமையேனும் பார்ப்பதோ?"
1584,பிறப்பு வேறுபட்டால் உயர்வு தாழ்வு கற்பிப்பதோ?
1585,தொழில் வழிப் பிரிப்பால் ஏற்றத் தாழ்வு காண்பதோ?
1586,இவையெல்லாம் இல்லாதது என்பதன் ஒட்டு மொத்தச் சான்றாக இலங்குவது.
1587,பிறப்பொக்கும் எல்லா உயிர்க்கும் சிறப்பொவ்வா செய்தொழில் வேற்றுமை யான் என்னும் குறள் அல்லவோ?
1588,"தமிழர்க்கென மொழியின் பெயரால்கூட, நாட்டின் பெயரால் கூடப் பிரித்துக் காணற்கில்லாப் பெருநிலையை அல்லவா பேணுவது பெருமைக் குறள்!"
1589,"ஆளும் சாதி, அடிமையுற்று வீழும் சாதி எனப் பிரிப்பு உண்டா?"
1590,"தொழப்படும் பிரிவார், தொழும் பிரிவார் எனப் பிரிவு உண்டா?"
1591,"கற்றுச் சிறப்புறும் கூட்டம், சற்றும் அறிவிலார் தொழும்புக் கூட்ட மெனும் பிரிப்பு உண்டா?"
1592,"மக்கள், மாந்தர் என்னும் பொதுப்பார்வை, பார்ப்பதை அன்றிப் பிரித்துக் காணாப் பெருமையது அல்லவோ திருக்குறள்."
1593,"அரசு, வணிகம், தொழில், கல்வி என்பவையெல்லாம் விரிய விரியக் கூறும் திருவள்ளுவர் இதற்குரியார் இவர் என எவரையேனும் குறித்துளாரா?"
1594,"வண்ண வேறுபாட்டை, செல்வ ஏற்றத் தாழ்வை இனப் பாற்படுத்தினாரா?"
1595,ஒப்புரவறிதல் ஒத்த தறிவான் உயிர் வாழ்வான் என்கிறதே!
1596,ஈகை வறியார்க்கு ஒன்று ஆவதே ஈகை அற்றார் அழிபசி தீர்த்தல் என்கிறதே!
1597,புகழ் வசையொழிய வாழ்வாரே வாழ்வார் என்கிறதே.
1598,"அதனைப் பாடிய பாவலர் வெள்ளி வீதியார், அவர் எத்தகு தேர்ச்சி மிக்காராய்த் திருக்குறளின் சீர்மையை, இதற்குரியர் அல்லாதார்இல் என்கிறார்."
1599,.
1600,வாளும் கேளும் திருக்குறளின் ஒளி திக்கெல்லாம் பரவுகிறது!
1601,திருக்குறள் வானொலியிலும் தொலைக்காட்சியிலும் இடம் பெறுகிறது!
1602,"அலுவலகங்கள், போக்குவரத்து ஊர்திகள், இல்லப் பகுதிகள் ஆகியவற்றிலும், அங்கும் இங்கும் பளிச்சிடுகிறது!"
1603,"திருக்குறள் எண்கவனகம், பதின்கவனமாய் பதினாறு கவனமாய் வளர்ந்தோங்குகின்றது!"
1604,சதாவதானி நூற்றுக் கவனகர் முன்னே இருந்ததுமுண்டு.
1605,மூன்று வயதுச் சீரிளமையர் வாய்முதல் தொண்ணுறு முழுதுறக் கொழிக்கின்றன!
1606,"ஒலியிழை உலகமும், இசை உலகமும் கூடத் திருக்குறளை இனிப்புற இசைக்கின்றன."
1607,திருக்குறள் ஆய்வுநூல்கள் ஆண்டுக்கு ஆண்டு பெருகுகின்றன!
1608,எப்படி எப்படியோ எத்தனை எத்தனையோ புதுப்புது உரைகளும் பதிப்புகளும் வெளி வருகின்றன.
1609,"திருக்குறளில் குறை குற்றம் சுட்டுவார், முதற்கண் தம் மனச் சான்றுக்கு மதிப்புத் தருபவர் தாமா?"
1610,தருபவர் எனின் பூதங்கள் ஐந்தும் அகத்தே நகுமே!
1611,தொல்காப்பியம் சங்க இலக்கியம் ஆகிய தமிழ் நெறிமை களைக் கற்றுணர்ந்தாரும் அல்லர்!
1612,ஆயிரம் சான்று காட்டினும் என் முடிவே முடிவு என்று முன்னுறவே முடிவு செய்து கொண்டு விட்டவர்!
1613,இவர்கள் வண்ணமும் எண்ணமும் வெளிப்படை யானவை!
1614,"தமிழ்ம்மையோ, தமிழ்ம்மைக் குறளோ ஓங்கி உயர்ந்து உலகப் புகழுக்கு உரியதாகிவிடக் கூடாது என்னும் எரிவின் வெளிப்பாடானவை!"
1615,"ஆதலால், இப்பகை, வள்ளுவர் வாய்மொழி வழியில் வாள் போல் பகையாம்!"
1616,"இப்பகை, அத்துணை அஞ்சக்கத்தக்க பகை அன்றாம்!"
1617,ஆனால்!
1618,அஞ்சத் தக்க பகையாவது கேள் போல் பகை என்பதாம்!
1619,வாள் போல் பகையை நம் விழிப்புணர்வாலும் அறிவுத் திறத்தாலும் கட்டொழுங்காலும் செயலறச் செய்துவிடலாம்!
1620,"ஆனால், கேள்போல் பகை அத்தகைத் தன்றே!"
1621,உள்ளுள்ளாக இருந்தே உருக்குலைப்ப தாயிற்றே அது!
1622,ஆக்கம் செய்வது போன்றே அழிவு செய்வதாயிற்றே!
1623,நஞ்சை அமுதெனக் காட்டி நாடியை ஒடுங்கச் செய்வதாயிற்றே.
1624,"ஆதலால், கேள் போல் பகையாய்ச் செயல்படுவார்க்குச் செவிதாராமை மட்டும் நெறிக்காவலாகாது."
1625,புறக்கணித்தல் மட்டும் கூடக்காவலாகாது!
1626,கண்டித்தலும் கட்டாயம் வேண்டும்!
1627,உண்மை உணர்த்தி ஒழுங்குறுத்தல் என்னும் உயர் நோக்கிலேயே கண்டித்தல் இனிய நூற்காப்பாகும்!
1628,கண்டித்தல் புண்படுத்தல் அன்று!
1629,பண்படுத்தல் ஆகும்!
