Line Number,Sentence
1700,செருக்கு .,False
1701,சமூகவியல் .,False
1702,குடும்பம் .,False
1703,அன்புப் பயிரோங்கி ஆனந்தம் வாழ்கழனி இன்பக் குடும்பமே ஆம்.,False
1704,காதல்மனைவி கனிவாய்ச் சிறுவர்களின் ஆதரவே குடும்ப மாம்.,False
1705,மனித இயல்பனைத்தும் மாசின்றி வாழும் புனிதமனை தான்குடும்ப மாம்.,False
1706,கூட்டுறவு வாழ்க்கைமுறை தோன்றி வளரவழி காட்டு வதுகுடும்ப மாம்.,False
1707,ஊக்கத்தை ஊட்டி உழைக்கவழி காட்டிநலம் ஆக்கு வதுகுடும்பந் தான்.,False
1708,துரைத்தனமும் நல்ல குடித்தனமும் ஒன்றென் றுரைத்தனர் முன்உணர்ந் தோர்.,False
1709,கட்டுப்பா டும்நெறியும் காலூன்றி வாழுமோர் வட்டம் குடும்பமே யாம்.,False
1710,இலக்கியச் சோலைகளுக் கின்னீரைப் பாய்ச்சி வளர்ப்பது குடும்ப மாம்.,False
1711,இல்லத்திற் கெவ்வறமும் ஈடாகா தென்றுண்மை சொல்லினர் முன்னறி ஞர்.,False
1712,நாட்டிற் குடும்பமெலாம் நல்வாழ்வு வாழவழி காட்டுவது மக்கள் கடன்.,False
1713,காதல் .,False
1714,காதலே இன்பநெறி காட்டும் பெருவிளக்காம் ஆதலின் ஓங்கவளர்ப் போம்.,False
1715,மாறாத அன்புக்கு மாற்றுப்போர் காதலென ஓராதார் உண்மையுண ரார்.,False
1716,காதல் கதைபேசிக் காமத்தீ மூட்டுவோர் நீதிக்கு நஞ்சூட்டு வார்.,False
1717,ஆண்டான் அடிமையினால் ஆண்பெண் உயர் விழிவால் மாண்டழியும் காதல் மலர்.,False
1718,பேதம் ஒழிக்கப் பெருமுயற்சி செய்யாதார் காதற் கொலைபுரி வார்.,False
1719,ஒத்த நிலையுடையார்க் குள்ளேதான் காதலொளி மெத்த விளங்கிநிற் கும்.,False
1720,காதல் எனும்கயிறால் கட்டுண்டு வாழ்பவரே வேதனைத் தீயழிப் பார்.,False
1721,நாடகத்துக் காவியத்துக் காதல் நலமென்பார் வீடகத்தில் வாழ விடார்.,False
1722,காதற் கவிபாடிக் கன்னியரைக் கற்பழிக்கும் பாதகரும் உண்டு பலர்.,False
1723,காம வெறிகொண்ட கயவர்தாம் காதலினைப் பூமியிலே மாளவைத் தார்.,False
1724,மணம் .,False
1725,அன்பை வளர்க்கும் அமைதிக்கு வழிகாட்டும் இன்பம் தரும்இல் லறம்.,False
1726,நல்லறமும் ஒற்றுமையும் நாட்டில் செழிப்படைய இல்லறமே ஏற்ற நிலம்.,False
1727,ஊக்கமுடன் மக்கட் பணிசெய்யும் உள்ளத்தை ஆக்குவதே நன்மண மாம்.,False
1728,ஒற்றுமையும் அன்பும் உயர்ந்த திருமணத்தின் நற்றுணைகள் ஆகிநிற் கும்.,False
1729,தங்கட் கிசைந்த துணைவரைத் தாமணக்க இங்குரிமை உண்டெவர்க் கும்.,False
1730,ஆண்பெண் இருவோரும் அன்பால் இணைவதற்கு வீண்சடங் கொன்றும்வேண் டாம்.,False
1731,மந்திரம் சொல்லி மணமக்கள் ஆக்கிவைத்தல் அந்தநாள் ஆசாத மாம்.,False
1732,இல்லறத் தம்பதிகள் என்றும் ஒருகருத்தாய் நல்லநெறி காத்தல் கடன்.,False
1733,மாதர் பலரை மணக்கும் முறையினால் காதல் சிதைந்து விடும்.,False
1734,இச்சை யிலைமணத்தில் என்றுதனித் திருத்தல் நிச்சயம் தீது தரும்.,False
1735,பாலகர் .,False
1736,உரத்தால் பயிர்வளரும் உள்ளத்தில் ஏறும் கருத்தால் வளர்விளை ஞர்.,False
1737,ஊக்கம் உடலுறுதி உள்ளவராய்ப் பாலகரை ஆக்குதலே நற்பணி யாம்.,False
1738,கெட்ட வசைமொழிகள் சொல்லிக் குழந்தைகளைத் திட்டும் செயல்மறப் பீர்.,False
1739,சோம்பேறிப் பாலர் சுறுசுறுப்பாய் முன்னேறிப் போமுறைகள் காணல் நலம்.,False
1740,துள்ளித் திரிகின்ற பாலருளம் தூயவழி செல்ல வளர்த்தல் சிறப்பு.,False
1741,நாட்டன்பும் நற்பணியும் நாடோறும் பாலகர்க்கு ஊட்டுதலே உத்தம மாம்.,False
1742,பற்றெந்த வித்தையிலே பாலகருக் கென்றறிந்து கற்றறியச் செய்தல் கடன்.,False
1743,பொல்லாத பேய்பூதப் பூச்சாண்டி யாற்குழந்தை உள்ளம் குழப்பிவி டேல்.,False
1744,வீரர்க ளாய்வளர்ந்து வெற்றிபெறப் பாலகர்க்குக் கூறுவீர் நல்லுரை கள்.,False
1745,வேதனைகள் இன்றி விளையாட்டாய்ப் பாலகர்க்குப் போதனைகள் செய்தல் நலம்.,False
1746,வீரம் .,False
1747,அன்பும் இரக்கமும் வீரமெனும் அன்னையின் இன்பக் குழவிக ளாம்.,False
1748,செல்வத் திமிரால் சிறுமை புரிவோர்க்கு நல்லறி வூட்டல்வீ ரம்.,False
1749,உள்ளத்தே தேர்ந்த உறுதிகளில் நல்வெற்றி கொள்ளுவதே வீரக் குணம்.,False
1750,படைவலிமை கொண்டிருந்தப் பாரில்போர் மூட்டும் கடையரை மாற்றல்வீ ரம்.,False
1751,துன்பமெனும் காட்டாற்றில் வீழ்ந்து துடிப்போரை இன்பத்தில் சேர்ப்பர்வீ ரர்.,False
1752,வல்லார்க்குத் தாழார் வறியோர்க்குப் பின்னிற்பார் நல்லதொரு வீரர்என் பார்.,False
1753,நெஞ்சத் துறுதியும் நேர்மைக் குணமுமே அஞ்சாத வீரர்க் கணி.,False
1754,இரத்த வெறிப்பேயர் ஏழைகளைக் கொல்வோர் உரத்தைச் சிறைப்பர்வீ ரர்.,False
1755,துன்பங்கள் சூழ்ந்துபல தொல்லை கொடுத்தாலும் புன்முறுவல் கொள்ளல்வீ ரம்.,False
1756,வாக்குத் தெளிவும் வயிர மனமும் ஆக்குமே வீரத் தனம்.,False
1757,கோழை .,False
1758,வாழ்க்கைத் துயரத்தைப் போக்க வழிதெரிந்தும் தாழ்க்கைபயம் கொள்ளித் தனம்.,False
1759,உள்ளத்தின் உண்மைகளைக் கூறா தொளிப்பவர்கள் குள்ளர்கள் கோழைகள் தாம்.,False
1760,செப்பித் திரிவார் செயலுக்குப் பின்னடைவார் எப்பொழுதும் கோழைகள் தாம்.,False
1761,பாழும் பசிக்கே படையேந்திப் போர்புரிந்து வாழுவோர் கோழைக ளாம்.,False
1762,படைக்கும் பணத்துக்கும் அஞ்சிப் பணியும் கடையர் பயங்கொள்ளி கள்.,False
1763,கொள்ளைக் கொடியோர் கொழுக்கத் துணைசெய்யும் புல்லர் பயங்கொள்ளி கள்.,False
1764,ஏழைகளைத் துன்புறுளுத்தும் ஈனர்களைக் கண்டஞ்சித் தாழுவோர் கோழைகள் தாம்.,False
1765,தன்னலந் நீக்கார் தவிப்போரைக் காப்பாற்ற முன்வரார் கோழைகள்என் பார்.,False
1766,மறைவாகக் குற்றம் மனந்துணிந்து செய்தே உறைவார் பயங்கொள்ளி கள்.,False
1767,தீமையிவை என்று தெரிந்தும் எதிர்ப்பதற்குத் தாமதிப்பார் கோழைகள் தாம்.,False
1768,ஒற்றுமை .,False
1769,அன்புடனே மக்கள் அனைவரும் ஒன்றாயின் இன்பம் பெருகிவள ரும்.,False
1770,எல்லோரும் ஒன்றென்னும் எண்ணம் பிறந்தாலே தொல்லை ஒழிந்துவி டும்.,False
1771,நாடு மொழி பேதம் நவில்வதுவே ஒற்றுமைக்குக் கேடுசெயும் நஞ்சரவ மாம்.,False
1772,ஓர்மரத்தில் பல்கிளைகள் ஓங்கி வளர்வதுபோல் பார்ஒன்று நாடுபல வாம்.,False
1773,உலகத்தில் மக்கள்முன் ஓரிடத்தில் தோன்றிப் பலதிசை யும்பரவி னர்.,False
1774,ஆதிமொழி ஒன்றே அதுவே பலமொழியாய்ப் பூதலத்தில் வாழ்கின்ற தே.,False
1775,எண்ணத்தில் வாழ்க்கையில் எல்லோரும் ஒன்றுபடின் மண்ணுலகம் ஒன்றுபடு மாம்.,False
1776,சாதி மதபேதம் சற்றும் இருந்ததிலை ஆதி மனிதகுலத் தில்.,False
1777,இச்சை பிறப்பிறப் பெல்லா மனிதர்க்கும் இச்சகத்தில் ஓர்விதமே யாம்.,False
1778,வாழ்வளிக்கும் ஒற்றுமை வல்லமையும் சேர்ப்பிக்கும் வீழ்வளிக்கும் வேற்றுமை தான்.,False
1779,நன்னடத்தை .,False
1780,நல்லொழுக்கம் இல்லார்க்கு நாட்டில் மதிப்பில்லை செல்லா தவர்வாயிற் சொல்.,False
1781,மக்கட் சமுதாயம் ஒன்றாய் மகிழ்வடையத் தக்கசெயல் நன்னடத்தை யாம்.,False
1782,காலத்திற் கேற்ற கருத்தும் நடத்தையுமே ஞாலத்தில் நல்லொழுக்க மாம்.,False
1783,பேசுவதைச் செய்து பிறர்க்குவழி காட்டுவதே மாசற்ற நன்னடத்தை யாம்.,False
1784,முன்னாள் தவறுகளை முற்றும் உணர்வதுவும் நன்னடத்தை சேரும் நெறி.,False
1785,கூடா நடத்தையெனக் கூறிய செய்கைகளை நாடாமை நன்னடத்தை யாம்.,False
1786,நெஞ்சில் உறுதியும் நேர்மையும் உள்ளவர்கள் அஞ்சார் நெறிதவ றார்.,False
1787,எண்ணத்தைத் தன்போக்கில் போகா தியக்குவதே நன்னடத்தை காக்கும் வழி.,False
1788,கட்டுண்டு நன்னெறியில் வாழ்வதற்குக் கற்றவரே முட்டின்றி நன்மைபெறு வார்.,False
1789,கல்வி யறிவிருந்தும் கட்டற்று வாழ்பவர்கள் பல்பழிகட் காட்படு வார்.,False
1790,தன்னலம் .,False
1791,சாதி வெறிகிளப்பிச் சண்டைத்தீ மூட்டுது நீதியிலாத் தன்னல மாம்.,False
1792,நாசப் படுகுழியில் நாட்டைக் கவிழ்த்துவிடும் மோசமெலாம் தன்னல மாம்.,False
1793,பூனைச் செயலாற்றி வாழ்வார் புகழ்பெறுவார் ஈனச் சுயநலத் தார்.,False
1794,ஏழை உழைப்பாளர் இரத்தம் உறிஞ்சியே வாழுவது தன்னலந் தான்.,False
1795,வட்டிக்கு வட்டியென வாங்கிக் குடிகெடுக்கும் திட்டம் சுயநல மாம்.,False
1796,செல்வாக்குக் காகவே செய்யும் தடபுடல்கள் பொல்லாமை வாழும் புதர்.,False
1797,ஊருக்குச் சங்கொலிப்பார் ஒன்றையும் பின்பற்றார் நேர்மையிலாத் தன்னலத் தார்.,False
1798,எல்லார்க்கும் தொண்டேஎன் கொள்கையெனப் பேச்சளவில் சொல்லல் சுயநலந் தான்.,False
1799,ஊர்எரியும் காலத்தும் உண்டுகளித் தாடுவார் பேராசைத் தன்னலத் தார்.,False
1800,பேசிச் சிறுவர்க்குள் பேதம் வளர்ப்பவர்கள் நீசர் சுயநலத் தார்.,False
1801,வஞ்சகர் .,False
1802,பொதுமக்கள் அஞ்சும் புலைத்தொழில்கள் செய்வோர் அதிவஞ்சப் பாதகர் கள்.,False
1803,உள்ளம்சொல் செய்கையிவை ஒன்றுபட வாழாதார் கள்ளர் கருணையற் றோர்.,False
1804,தித்திக்கும் சொற்பேசித் தீமைகளைச் செய்பவர்கள் எத்திக்கும் வாழ்ந்திருப் பார்.,False
1805,வேடத்தைக் கண்டவுடன் ஏமாந்து வீண்போகேல் நாடு நடத்தையி னால்.,False
1806,தேசத்தின் பக்தரெனத் தில்லுமுல்லு பேசுவார் மோசத்தில் முன்னிருப் பார்.,False
1807,நஞ்சை உணவென்று நாவால் சுவைப்பதாம் வஞ்சகரை நம்பிவாழ் தல்.,False
1808,வேதம் கலைகள் விளம்புவதே உண்மையென ஓதுவோர் சூதர்க ளாம்.,False
1809,எல்லாம் அவன்செயலே என்று பிறர்க்குரைத்துக் கொள்ளை யடிப்பார்வஞ் சர்.,False
1810,உங்கள் துயரனைத்தும் ஓட்டுவோம் என்றுபணம் இங்குபறிப் பார்வஞ்ச கர்.,False
1811,நாணலும் கூனலும் பூண்டு நடிப்பவர்கள் வீணர் நயவஞ்ச கர்.,False
1812,சாதி வேற்றுமை .,False
1813,சாதிக் களையெடுத்தால் அன்றிச் சமூகத்தில் நீதிப் பயிர்விளை யாது.,False
1814,கட்டு விரியனாம் சாதிக் கொடுமைகளைச் சுட்டெரித்தால் உண்டு சுகம்.,False
1815,மனித குலவாழ்வுக் கானதொழில் செய்வோர் புனிதர் ஒருகுலத் தார்.,False
1816,ஒருவகுப்புக் கோர்நீதிச் சட்டம் வகுத்தோர் பெரும்சமூகப் போர்மூட்டி னார்.,False
1817,கொள்ளைச் சுயநலக் கும்பலே சாதியெனும் பள்ளம் பறித்துவைத் தார்.,False
1818,"பள்ளம் படுகுழிசேர் பூமியே, மேல்கீழாய் உள்ள சமூகம் உணர்.",False
1819,நிலத்தின் இயல்பால் நிறம்திரிந்த மக்கள் குலத்தில்வே றாவதுண் டோ?,False
1820,எக்குலத்தார் ஆனாலும் இன்ப மணம்புரிந்தால் மக்கட் பெறுவார் மகிழ்ந்து.,False
1821,நல்லபசும் பாலிற் கலந்ததுளி நஞ்சாகும் பொல்லாத சாதிப் புழு.,False
1822,சாதியெனும் வேர்தான் சமூகத்தில் ஊன்றாமல் ஆதி யுடனறுப் பீர்.,False
1823,வெறியர் .,False
1824,என்குடியே மேற்குடியாம் எல்லோரும் என்னடிமை என்பர் குடிவெறி யர்.,False
1825,எங்கள் இனத்தால்தான் இவ்வுலகில் நாகரிகம் பொங்குவதென் பார்வெறி யர்.,False
1826,தாய்மொழியைப் போற்றல் தகவே பிறமொழியை நாய்போலச் சீறல் வெறி.,False
1827,தங்கொள்கை போற்றலே பற்றாம் பிறர்கொள்கை இங்குபழித் தல்வெறி யாம்.,False
1828,நிறத்தால் பிறர்தமை நிந்திக்கும பேயர் அறங்கொல் வெறியர்க ளாம்.,False
1829,யாமே அறிவுடையோம் எம்மொழியே உண்மையெனத் தாமுரைப் பார்வெறி யர்.,False
1830,யார்மொழியும் காதிலே ஏற்கார் தமதுரையே கூறியுறை வார்வெறி யர்.,False
1831,எல்லோரும் எம்சொல்லைக் கொள்க எனவுரத்துச் சொல்லுத லேவெறிக் குணம்.,False
1832,வெறியரே இவ்வுலகில் வேற்றுமைத் தீயைப் பெரிதாய் வளர்த்துவிட் டார்.,False
1833,மக்களினப் பண்பை மாற்றியிம் மாநிலத்தைத் துக்கத்தில் ஆழ்த்தும் வெறி.,False
1834,அறம் .,False
1835,இன்பமும் துன்பமும் எல்லாம் விதியென்று நம்புவதை மாற்றல் அறம்.,False
1836,இல்லையென வந்தவர்க் கீதல் அறமன்று தொல்லை வளர்க்குமது தான்.,False
1837,பிச்சைத் துயர்வாழ்வின் வேரைப் பிளந்தெறிதல் மெச்சுபுகழ் நல்லற மாம்.,False
1838,உழைப்பவர் வாழ்வை உறிஞ்சும் கொடுமை அழிப்பதே நல்லற மாம்.,False
1839,பட்டினிச் சாவென்னும் பாதக நச்சரவைச் சுட்டெரிப்ப தேயற மாம்.,False
1840,ஊரார் மதிக்கும் ஒழுக்கம் உடையோரைப் பாராட்ட லேயற மாம்.,False
1841,இன்னதொழில் செய்தல் எனக்கெளி தென்பவர்கள் அன்னதையே செய்தல் அறம்.,False
1842,சாதி நிலைப்பதற்குச் சாற்றும் மொழிகளெலாம் நீதியல வென்றல் அறம்.,False
1843,காலத்திற் கேற்ற கருத்தும் செயல்களும் சீலமாய்க் கொள்ளல் அறம்.,False
1844,செல்வத்தில் வீழ்ந்து சிந்தை கலங்காமல் நல்வழி போற்றல் அறம்.,False
1845,மறம் .,False
1846,அறத்தைச் சிதைக்கின்ற செய்கை அனைத்தும் மறத்தை வளர்க்கும் நெறி.,False
1847,நல்லன யாவையென நாடாமல் தன்னலத்தால் அல்லன செய்தல் மறம்.,False
1848,நெஞ்சைத் தமதாக்கி நேர்வழியில் போக்காத பஞ்சைகளே பாவிக ளாம்.,False
1849,அன்பர் மனம்பதைக்க ஆற்றும் கொடும்செயல்கள் துன்பம் கிளைக்கும் மறம்.,False
1850,நாசச் செயல்புரிந்து நல்லோர் பகைகொள்ளல் நீசத் தனம்தீ மறம்.,False
1851,நீதி வழிநடப்போர் நேசத்தை நாடாமல் பாதகரைச் சேர்தல் மறம்.,False
1852,சாலை நிழல்மரத்தைச் சாய்த்துக் கொலைசெய்யும் வேலை பழிதருவ தாம்.,False
1853,காலத்திற் கேற்ற ஒழுக்கத்தைக் கைவிட்டுச் சீலம் குலைத்தல் மறம்.,False
