Line Number,Sentence
1,தேவநேயம் பதிப்பாசிரியர் புலவர்.
2,இரா.
3,இளங்குமரன் தமிழ்மண் பதிப்பகம் நூற்குறிப்பு நூற்பெயர் தேவநேயம் தொகுப்பாசிரியர் புலவர்.
4,இரா.
5,இளங்குமரன் பதிப்பாளர் கோ.
6,இளவழகன் முதற்பதிப்பு மறுபதிப்பு தாள் . கி.
7,மேப்லித்தோ அளவு தெம்மி பக்கம் படிகள் விலை உரு.
8,"நூலாக்கம் பாவாணர் கணினி தியாகராயர் நகர், சென்னை ."
9,"அட்டை வடிவமைப்பு தமிழ்க்குமரன் அச்சு வெங்கடேசுவரா ஆப்செட் பிரிண்டர் இராயப்பேட்டை, சென்னை ."
10,"அஃது அவர் வரலாற்றிலும், அவர் பெயரால் உலகத்தமிழ் ஆராய்ச்சி நிறுவனஅறக்கட்டளைப்பொழிவாகியதேவநேயப்பாவணரின்சொல்லாய்வுகள் என்னும்பாழிவு நூலிலும்வெளிப்பட்டது."
11,"அதன் பின்னர்த் தமிழ்நாட்டு அரசு, பாவாணர் அகரமுதலித் திட்ட மேலாய்வுக்கென அமைத்த ஐவர் குழுவின் அறிக்கையிலும் வலியுறுத்தப்பட்டது."
12,தேவநேய உருவாக்க முன்வரைவுகள் இவை.
13,"தேவநேயரின் அகரமுதலி அவராலேயே முற்றுற முடிக்கப் பெற்றிருப்பின், மற்றொன்று வேண்டா என்னும் நிலையில் அஃதொன்றே தேவநேயமாகத் திகழ்ந்திருக்கும்!"
14,அதனைப் பெரும்பேறு தமிழ்மண்ணுக்கு வாய்க்காமையால் கிடைத்த கிடைக்கின்ற அளவிலேனும் தேவநேயத்தை உருவாக்கி விடுதல் வேண்டும்.
15,அதனை உருவாக்குதல் எவ்வண்ணம்?
16,தேவநேயப் படைப்பெல்லாம் சொல்லாய்வாகவே வெளிப் பட்டவை.
17,"அவர், எப்பொருளை எடுத்துக் கொண்டு பேசினாலும் எழுதினாலும் அவர்க்கு முந்துற நிற்பது சொல்லாய்வே!"
18,சொல் லாய்வு இல்லாத உரையாட்டும் கூட அவர்மாட்டு அமைந்தது இல்லை!
19,"ஆகலின், அவர்தம் படைப்புகளில் உள்ள சொல்லாய்வுக் குறிப்புகளை எல்லாம் அகர முறையில் தொகுக்க வேண்டும்."
20,அவ்வாறு அமைந்துவிடு மானால் சொல்லாய்வாளர்க்குத் தேடிவைத்த திருவாகத் திகழ்தல் உறுதியாம்.
21,அவர்வழியில் ஆயத்தலைப் படுவார்க்குக் கிடைத்தற் கரிய கருவிநூலாம்.
22,அது தலையாய கடமையாம்.
23,"திருவாசகம் இன்றில்லையேல் சாழல், தெள்ளேணம் முதலிய சொற்களை வேறெங்குக் காணமுடியும்?"
24,என ஏங்குபவர் பாவாணர்.
25,ஆயிரம் ஆயிரம் சொற்களை மணிமொழியார் தம் நூலில் படைத்திருந்தாலும் சாழலும் தெள்ளேணமும் தனித்துயர்ந்து தலைதூக்கி நிற்பானேன்?
26,அவ்வாட்சி பிறர்மாட்டுக் காண இயலாப் பெற்றியவை.
27,"பத்தோடு பதினொன்று என்று இல்லாமல், அவருக்கே உரிமை பூண்ட ஆட்சிச் சொற்கள் அவை."
28,ஆதலால் அவையே மணிவாசகனார்க்குத் தனிவீறும் தனிப்பேறும் அருளிக் கொண் டுள்ளனவாம்.
29,அவ்வாறு பாவாணர்க்கே உரியபாவாணரையே அடையாளம் காட்டக் கூடியசொற்கள் ஒன்றா?
30,இரண்டா?
31,பண்டாரகரா பண்டுவரா பாவாணரை நினைவு கூராமல் முடியுமா?
32,குளம்பி வேண்டுமா?
33,கொழுந்துநீர் வேண்டுமா?
34,என்று வினவுவாரிடைப் பாவாணர் அன்றோ மென்னகை புரிகிறார்.
35,நான் அணியமாக இருந்தேன் நீங்கள் இப்பொழுது வந்தது ஏந்தாக இருந்தது என்பாரிடைப் பாவாணர் இரண்டறக் கலந்து திகழ்கிறார்.
36,இந்த மொட்டான்தான் அந்த மேடைக்கு அமைவாக இருக்கும் என்பவர் இன்றமிழ் உள்ளத்தில் பாவாணர் வீற்றிருக் கிறார்.
37,பொந்திகை யாக உண்டு சடுத்தமாக வருவாருடனே பாவாணரும் அன்றோ பொந்திகையாக வருகின்றார்.
38,"பிறப்பியம் எழுதி ஐந்திறம் அறிவாரிடத்தும், தொன்மம் படித்துத் தோற்றரவை நம்புவாரிடத்தும் கூடத் தமிழால் ஒன்றியுள்ளார் பாவாணர்."
39,அறிவன் காரி பார்த்து நீராடுவாரிடத்தும் செந்தணப்பில் வீற்றிருப்பாரிடத்தும் பாவாணர் உறைகின்றார்.
40,தூவல் கொண்டு எழுதுவாரிடத்தும் பாடகராகிய பாடுவாரிடத்தும் பாவாணர் ஒன்றியுள்ளார்.
41,குமுகாய மேம்பாட்டுக்கு எடுப்பை அகற்றி அடிப்பைப் பயன்படுத்த வேண்டும் என்று சூளிட்டுக் கொள்வாரிடத்தே பாவாணர் சுடர்விடுகின்றார்.
42,அரத்தம் படைச்சால் வைத்தூற்றி மணிப்பவழம் இன்ன வற்றை அகரமுதலியில் இணைப்பாரிடத்தே பாவாணர் இணைந் திருக்கிறார்.
43,"இங்குச் சுட்டிக் காட்டிய ஐம்பது சொற்கள்தாமோ, தேவ நேயம்."
44,இப்படி எத்துணை எத்துணை ஐம்பதுகள்!
45,அதற்கு அரசும் அமைப்புகளும் ஆர்வலர்களும் முந்து நின்று பணி செய்வார்களாக என்பது எம் வேண்டுகையாக இருந்தது.
46,.
47,"டாக்டர், ."
48,மருத்துவர் .
49,"காபி, ."
50,"தேநீர், ."
51,"தயார், ."
52,"வசதி, ."
53,"டூல், ."
54,"மேசை, ."
55,"புரூட் சாலிட், ."
56,"ஐகிரீம், ."
57,"திருப்தி, ."
58,"விரைவு, ."
59,"சாதகம், ."
60,"பஞ்சாங்கம், ."
61,"புராணம், ."
62,"அவதாரம், ."
63,"புதன், ."
64,"சனி, , ஏர்கண்டிசன், ."
65,"பேனா, ."
66,"பாகவதர், ."
67,"சமுதாயம், ."
68,"எடுப்புமலக்கூடம், ."
69,"பிளஅவுட், ."
70,"இரத்தம், ."
71,"பர்லாங், ."
72,"புனல், ."
73,"மணிப்பிரவாளம், ."
74,"சுந்தரம், ."
75,"இராமச்சந்திரன், ."
76,"கருணாநிதி, ."
77,"பசுமலை சுந்தரம், ."
78,"சோம சுந்தரம், ."
79,"கலியாணசுந்தரம், ."
80,"கருணை, ."
81,"மனோகரன், ."
82,"சின்னசாமி, ."
83,"சந்தோசம், ."
84,"பெங்களூர், ."
85,"மும்பை, ."
86,"ஆக்சு போர்டு, ."
87,"கிரீன்லாண்ட், ."
88,"பசிபிக் கடல், ."
89,"பாய்லர் தொழிற்சாலை, ."
90,"கிரேண்ட் டிரங்கு எக்சுபிரசு, ."
91,"தினசரி, ."
92,"மாத இதழ், ."
93,"மிருகாண்டி மிராண்டி , ."
94,"பட்டதாரி, ."
95,பாவாணர் நூல்களையெல்லாம் வாரமுறையில் ஐம்பான் ஆண்டுகளாக வெளியிட்டு வந்த தெ.இ.சை.சி.
96,"கழகமோ, மணிவாச கர் பதிப்பகமோ நாம் இப்பணியை முடித்துக் கொடுத்தால், வெளியிடும் என்னும் உறுதியால் பணியைத் தொடங்கினேம்."
97,"இடையே தவச்சாலை நிறுவி நூல்வெளியீடும் மேற் கொண்டமை யால், அதன்வழி வெளியிடலும் வாய்க்கும் எனக் கிளர்ந்தேம்."
98,"இந்நிலையில், பாவாணர் நூற்றாண்டு விழா எய்தியது."
99,முன் வரவாக ஆம் ஆண்டு தொட்டே பாவாணர் தமிழியக்கத் திங்கள் பொழிவுகள் நிகழ்ந்தன.
100,"அரசும் பாவாணர் நூல்கள் நாட்டுடைமை ஆக்கல், நூற்றாண்டு விழா எடுத்தல் என்பவற்றை மேற்கொண்டது."
101,"பள்ளிகள், அமைப்புகள் பல்கலைக்கழகங்கள் எனப் பாவாணர் புகழ் நாடளாவிய அளவில் நிகழ்ந்தது."
102,தமிழாக்கம் கருதி நிறுவப்பட்ட தமிழ்மண் பதிப்பகம் ஒரு மாப்பெருந் திட்டம் மேற்கொண்டது.
103,நூல் வடிவுற்றவற்றை அன்றிக் கட்டுரைபொழிவுதுண்டு வெளியீடு இதழ் வெளியீடு என்பனவற்றையும் முன்வெளி யீட்டுத் திட்டம் உருவாக்கி வெளியிட்டது.
104,"சென்னையில் ..இல் நூல் வெளியீட்டு விழாப் பொழிவுக்கெனச் சென்ற காலை, சிங்கபுரி செந்தமிழ்க்காவலர் கோவலங்கண்ணனாரைக் கண்டேம்."
105,எம் குண்டலகேசி வெளி யீட்டுப் புரவலர் அவர்.
106,நெட்ட நெடுந் தொடர்பினர்.
107,மலையகச் சுற்றுலாவில் உடனாகிச் சிங்கைச் சுற்றுலாவில் புரவாண்மை மேற்கொண்டவர்.
108,அவர்க்கும் எமக்கும் ஊடகம் எது?
109,இருவர்க்கும் உயிர்ப்பாகி விட்ட தேவநேயக் காதலேயாம்!
110,விழாவுக்கு முதல் நாள் இரவு கோவலங்கண்ணனார் தாம் தங்கியிருந்த மாளிகைக்கு அழைத்தார்.
111,இனிய அன்பர் பாவாணர் தமிழியக்கச் செயலர் முனைவர் கு.
112,"திருமாறனார் உடனாகச் சென்று, உரையாடியும் உறைந்தும் மகிழ்ந்தோம்."
113,அதன் வழியாகத் தேவநேயம் வெளியிடுவோம்.
114,மெய்யாகவே அவரியல்பை அறிந்திருந்த எமக்கும் எடுத்த எடுப்பிலேபல இலக்கப் பணிப்பொறுப்பை இப்படி எவரே ஏற்று மொழிவர்?
115,என்னும் வியப்பே கிளர்ந்தது.
116,"அன்று இரவு முகிழ்த்த பாவாணர் அறக்கட்டளை, விடியலிலேயே, அறக்கட்டளை முன்வைப்பாக முளைத்தது."
117,அந்நாள் ...
118,திருவள்ளுவர் தவச்சாலையே பணிக்களமும் ஆயது.
119,"தவச்சாலையின் நூலகம், பாவாணர் ஆராய்ச்சி நூலகம் என்பது."
120,"பாவாணர் பெரும்பிரிவுற்ற அணிமை நாளிலேயே, அவர் பெயரால் மதுரைத் திருநகரில் உருவாயது."
121,அதன் முன்னரே ஏழாயிரத்திற்கு மேற்பட்ட நூல்களைக் கொண்டிருந்தது.
122,இல் யாம் காவிரித் தென் கரையில் திருவள்ளுவர் தவச்சாலை உருவாக்கிய நிலையில் அப்பெயருடன் நூலகமும் எய்தியது.
123,அக்காலத்திருந்த நூல்களின் எண்ணிக்கை இரட்டிப்பு ஆகிய வளர்வில் ஆய்வுப் பயன் செய்கின்றது.
124,ஏன்?
125,நூலுக்கெனத் தேடியோட வேண்டுவதில்லையே!
126,பாவாணர் தொடர்புடைய இதழ்கள்மலர்கள்இயல்பாகவே இருந்தன.
127,பிறருக்கு வாய்க்காத எழுத்துப் படிகள் அருநூல்கள் சில இருந்தன.
128,செந்தமிழ்ச் செல்வி முற்றாக உண்டு.
129,பாவாணர் வரைந்த கடிதம்படிகள் ஈராயிரத்திற்கு மேல் அவர்தம் வரலாற்றுக்காகத் தொகுக்கப்பட்டவை கைவயமிருந்தன.
130,இன்னவை எல்லாம் இத்தொகைக்கு உதவின.
131,"இவற்றுக்கு மேலே, மேலும் ஓர் அரிய வாய்ப்புத் தேடி வந்தது."
132,"அதனால், அதன்முன் கிட்டாத சில மலர்கள் இதழ்கள் தாங்கிய கட்டுரைகளும் வாய்த்தன."
133,இவ்வகையால் இடையறவின்றி இத்தொகையாக்கம் நடைபெறுவதாயிற்று.
134,புலவர் இரா.
135,"இளங்குமரன், முனைவர் கு."
136,"திருமாறன், முனை வர் கு."
137,"பூங்காவனம், புலவர் மு."
138,"படிக்கராமு, முனைவர் ப."
139,கங்கை என்பாரை அடைவுப் பணியாளராகக் கொண்டு திங்கள் மதிப் பூதியமாக ஒவ்வொருவருக்கும் ஈராயிரம் வழங்குவது என முதற்கண் திட்டப்படுத்தப்பட்டது.
140,பின்னர்ப் பணியை மேலும் சிலர் வழியே செய்யப் பெறின் விரைந்து இயல வாய்க்குமெனக் கொண்டோம்.
141,அதனால் தக்கார் சிலரை இக்குழுவில் மேலும் இணைத்துக் கொள்வதென முடிவு செய்தோம்.
142,"முன்னே தீர்மானித்தவர்களுடன் முனைவர் திருஞானம், முனைவர்.சக்திவேல், முனைவர்.நாராயணன், புலவர் தமிழகன், புலவர் குறளன்பன், பாவலர் மு.வ."
143,"பரமசிவம், பாவலர் அருள்செல்லத்துரை ஆகியோரையும் இணைத்து அகர வரிசையில் தேவநேயம் அடைவு செய்தலை ஆய்ந்தோம்."
144,சிலர் தாங்கள் அடைவுக்கு உதவுவதாகக் கூறித் தனித்தனி நூல்களைக் குறித்தனர்.
145,தாம் ஏற்றுக் கொண்டவாறு முன்னவரும் பின்னவருமாகிய எவரும் மதிப்பூதியமாவது மாண்பணியே எனத்தொகை விழையாது வினை விழைவாராயினர்.
146,ஆகலின் ஒளியச்சு எழுதுதாள் இன்னசெலவன்றி என்ன செலவும் ஏற்படாது தொகை உருவாக்கம் கிளர்ந்தது.
147,முனைவர் திருமாறனார் முனைவர் இளவரசு ஆகியோர் பாவாணர் சொல்வளம் தனிச் சொற்பொருள் அடைவு செய்து கணினிப் படுத்தி உதவினர்.
148,"சொற்பொருள் விளக்கம், சொற்பொருள் என்பனவற்றுடன் ஆங்கிலப் பகுதி தனிமடலமாக்குதல் வேண்டும் என்றும் கருதினேம்."
149,பாவாணர் அறக்கட்டளை நிறுவனர் திருமலி கோவலங் கண்ணனார் பதிப்புரை வரைந்து உதவினார்.
150,தேவநேயம் அச்சீடு தொடர்பான கருத்து எழுந்தபோது திருக்குறள் திறவோரும் பொறிஞருமாகிய திரு.
151,பாலகங்காதரனார் தாமே தவச்சாலையில் கணினி அமைப்புச் செய்து தர முன்னுரைத் தார்.
152,"தவத்திரு கருவூர் அடிகளாரும், புதுவை இயற்கைக் காவலர் ஆசிரியர் வை.வேலாயுதனாரும் தம்மிடம் கைவயமாக உள்ள கணினியை வழங்க இசைந்தனர்."
153,சிங்கைப் புரவலர் கோவலங் கண்ணனார் தாமே தக்க கருவி விடுப்பதாக உரைத்தார்.
154,பேரா.
155,திருஞானம் அவர்கள் அச்சிடுதலுடன் முதல் மெய்ப்புப் பார்க்கவும் நேர்ந்தார்.
156,கோ.
157,இளவழகனாரிடம் அச்சீட்டுப் பணியை ஒப்படைப்பது என முடிவு செய்யப்பட்டது.
158,புரவலரும் அது பொருந்துமென ஏற்றுப் பொறுப்பை ஒப்படைக்க இசைந்தார்.
159,திருவள்ளுவராண்டு ஆடித்திங்கள் ஆம் நாள் கி.பி... ஞாயிறு திரு.இளவழகனாரிடம் அச்சுப்பணி ஒப்படைக்கப்பட்டது.
160,உடனே பணி தொடங்கப் பட்டது.
161,முதற் பதினாறு பக்கங்கள் அச்சிட்டுப் பார்வைப்படியாகப் பலர் கருத்துக்கு வைக்கப்பட்டது.
162,"அச்சு அமைப்பு, எழுத்து அமைப்பு பற்றிய முன்னோட்ட ஆய்வு அது."
163,அறக்கட்டளை அமைப்புக் குழுவினரொடு தக்கார் சிலரும் கருதப்பெற்றனர்.
164,கழக அமைச்சர் இரா.
165,"முத்துக்குமாரசாமி, பேரா.முனைவர் பொற்கோ, பொறிஞர் பாலகங்காதரனார், தவத்திரு."
166,சூசைமாணிக்க அடிகள் ஆயோர் தக்க கருத்துதவினர்.
167,முனைவர் தமிழண்ணல் உவந்து ஊக்கினார்.
168,முனைவர் அரண முறுவல் அமைப்பு முறையை முறைப்படுத்துதலில் அழுத்தமாக ஈடுபட்டு உடனாகித் திட்டப்படுத்தினார்.
169,"மெய்ப்புப் பார்க்க முனைவர் திருமாறன், முனைவர் அரணமுறுவல், முனைவர் இளங்கோ, முனைவர் ப.கங்கை, திரு."
170,மதிவாணன் ஆகியோர் இசைந்தனர்.
171,திசம்பர் நிறைவுக்குள் அச்சுப் பணி நிறைவுற வேண்டும் என்னும் திட்டம் சுணக்கமாகா வகையில் நிறைந்தது.
172,தமிழ்மண் பதிப்பக நிறுவனர் திரு.இளவழகனார் தமிழ்க் காவலர் கோவலங் கண்ணனார் ஆகிய இருவர் ஒத்துழைப்பும் எண்ணுதோறும் இனிப்பதாம்.
173,பாவாணர் வாழ்க்கைக் குறிப்புகள் .. சங்கரநயினார் கோயிலில் ஞானமுத்தர் பரிபூரணத் தம்மையார் ஆகிய பெற்றோர்க்குப் பத்தாம் மகவாகப் பிறந்தார்.
