Line Number,Sentence
1362,அக் காலத்தில் பெண்கள் இராணுவப் பயிற்சி பெற்றார்கள்.,False
1363,அவர்கள் அரசரின் மெய்காப்பாளராக இருந்து வந்தனர்.,False
1364,அவர்கள் வில்லைப் பயன்படுத்த நன்கு பயிற்சி பெற்றிருந்தனர்.,False
1365,கன்னடப் பெண்கள் இம் முறையில் சிறந்து விளங்கினர்.,False
1366,மைசூரில் சித்தங்காலி என்னும் இடத்தில் ஓர் வீரப்பெண் கிராமத்தில் நிகழ்ந்த போரில் கி.பி.இல் மாண்டாள்.,False
1367,"இல் வீரப் பெண் ஒருத்தி, கொள்ளைக்காரனை மடக்கி அடித்ததற்காக மூக்கு அணி ஒன்று வீரப் பதக்கமாகப் பெற்றாள்.",False
1368,"நில்கொண்ட என்னும் இடத்தில் காணப்பட்ட பட்டையமொன்றில் ஒரு சிற்றரசுக்குரிய இராணி, படை ஒன்றை நடத்திச் சென்ற நிகழ்ச்சி குறிப்பிடப்பட்டுள்ளது.",False
1369,அவள் இல் தனது தந்தையைக் கொன்ற பகைவரைப் பழி வாங்கும் பொருட்டுப் புரிந்த போரில் மாண்டாள்.,False
1370,"இராசபுத்திர குடும்பப் பெண்கள் வாளும், ஈட்டியும் பயன்படுத்தினர்.",False
1371,"அவர்கள் படையை நடத்திச் செல்லக்கூடியவர்களாகவும், வேண்டிய போது ஆட்சியை நடத்தக்கூடியவர்களாகவும் இருந்தனர்.",False
1372,"கூர்மதேவி என்னும் அரசி, தன்னுடைய கணவன் இறந்தபின் இராச்சியத்தை நடத்தி, குதாம் உத்தின் என்பவனின் படையைச் சிதற அடித்தாள்.",False
1373,யவாகிஹிர் தேவி என்பவள் தனது கணவனின் மரணத்துக்குப்பின் போர் முனையின் முன்னணியில் நின்று போர்செய்து மடிந்தாள்.,False
1374,இராசபுத்திரர் வரலாற்றில் இவ்வகை நிகழ்ச்சிகள் பல காணப்படுகின்றன.,False
1375,பெண்களுக்கு இராணுவப் பயிற்சி அளிக்கும் வழக்கம் மராட்டிய அரச குடும்பங்களிலும் இருந்து வந்தது.,False
1376,"படையை நடத்துவதற்குக் கணவன் அல்லது புதல்வன் இல்லாதபோது, அரசியே படையை நடத்திச் சென்றாள்.",False
1377,"கோலாப்பூர் சமஸ்தானத்தைத் தாபித்த தாதாபாய் என்பவள், ஆட்சி நடத்தியதோடு தானே படையையும் நடத்திச் சென்றாள்.",False
1378,இவளுக்கு இலக்குமிபாய் என்பவள் படைத் தலைமை வகித்துத் தனது வீரத்தைக் காண்பித்தாள்.,False
1379,நூல் நூற்றல் பெண்களின் தொழிலாக நீண்டகாலம் இருந்து வந்தது.,False
1380,"பெண்களும் மறுமணமும் உயிர்ப் படைப்புக்களின் நோக்கம் சந்ததிகளைப் பெருக்குவது என, முன் ஓர் இடத்திற் கூறியுள்ளோம்.",False
1381,உயிர்களில் ஆண் பெண் என்னும் வேறுபாடுகளும் சந்ததியைப் பெருக்குவதற்காகவே உண்டாகியிருக் கின்றன.,False
1382,"சில உயிர்களில் ஆண், பெண் சேர்க்கையின் பின் மடிந்து விடு கின்றது.",False
1383,இதற்கு எடுத்துக்காட்டுத் தேனீ.,False
1384,உயிர்கள் சந்ததியைப் பெருக்கு வதாகிய இயற்கை விதிக்கு மாறாக எழுந்ததே விதவைகளின் விவாக மறுப்பாகும்.,False
1385,இச்செயற்கைக் கட்டுப்பாடு இயற்கை விதிக்கு மாறுபட்டது.,False
1386,"இந்திய நாட்டில் விதவைகள் கொடுமை அடைந்து வருவதுபோல, வேறெந்த நாட்டிலும் அடைந்ததில்லை.",False
1387,"பிரமசாரிணியைப் போல, அவள் வெற்றிலை போட்டுக் கொள்ளக்கூடாது வெண்கல வட்டிலில் உணவு கொள்ளக்கூடாது.",False
1388,அவள் தினமும் இறந்த கணவனுக்கு அமுதுபடைத்தல் வேண்டும்.,False
1389,இவ்வகையான கொடிய சட்டங்கள் வேத காலத்தில் இருக்கவில்லை.,False
1390,"கணவனை இழந்த பெண், கணவனின் சகோதரனை மணந்தாள்.",False
1391,இது அக் காலத்தில் பொது வழக்காக விருந்தது.,False
1392,திவாரா என்பதற்கு இரண்டாவது கணவன் என்று பொருள்.,False
1393,இச் சொல் பெண்ணின் கொழுநனைக் குறிக்கின்றது.,False
1394,பிணத்தைக் கொளுத்துஞ் சமயத்தில் இறந்தவனின் சகோதரன் கொழுந்தியின் கையைப் பிடித்து அவளைத் தனது மனைவியாகும்படி கேட்டான்.,False
1395,"இறந்தவனின் மனைவி, அவன் சகோதரனை சேர்தலைப்பற்றி வேதங் கூறுகின்றது.",False
1396,"தைத்திரிய சங்கிதை ஒரு மனைவி, ஒரே காலத்தில் இரண்டு கணவரை வைத்திருத்தல் தகுதியன்று எனக் கூறுகின்றது.",False
1397,இக்கருத்து ஐதரேயப் பிராமணத்திலும் காணப்படுகின்றது.,False
1398,மாபாரதத்தின் சாந்தி பருவத்தில் பெண்களுக்கு மறுமணஞ் செய்தல் இயல்பு என்று கூறப்பட் டுள்ளது.,False
1399,"யாக்ஞவல்கி, யாருக்கும் சொந்தமல்லாதிருக்கும் பெண்ணை விதவையை மணம் முடிக்கும்படி கூறுகின்றார்.",False
1400,"இதிகாச காலத்தில், மணம் செய்து கொள்ளப்படும் பெண், கன்னியாக இருக்க வேண்டுமென்னும் கட்டாயம் இருக்கவில்லை.",False
1401,"கிருட்டிணன், கொல்லப்பட்ட நரகனின் பெண் களைச் சேர்ந்தான்.",False
1402,"திரிசங்கு, தான் கொன்ற விதர்ப்ப அரசனின் மனைவியை மணந்து இரண்டு புதல்வர்களைப் பெற்றான்.",False
1403,"தமயந்தி இன்னொருவனின் மனைவியாக விருந்தாள் என்பதை அறிந்தும், இருதுபன்னன் அவளை மணக்க விரும்பினான்.",False
1404,இதிகாச காலத்தில் மறுமணங்கள் புதுமையானவை யல்ல.,False
1405,"பழைய நூல்கள், பழம் போக்குடைய புரோகிதரால் திருத்தப்பட்ட பின்பும், விதவைகளின் மணத்தைக் குறிப்பிடும் நிகழ்ச்சிகள் காணப்படுதல் வியப்புக்குரியதே.",False
1406,வேதகால முடிவில் பெண்களின் மறுமணம் இழிவாகக் கருதப்பட லாயிற்று.,False
1407,ஒருமுறை மணஞ்செய்தவளை மணக்கும் ஒருவன் பாவியாவான் என ஆபத்தம்பர் கூறியுள்ளார்.,False
1408,ஆபத்தம்பர் காலத்தும் விதவைகளின் மணத்தைத் தடுப்பதற்கு எத்தனங்கள் நடந்துவந்தன வென்றும் தெரிகின் றது.,False
1409,மறுமணம் மூலம் விதவை வயிற்றில் பிறந்தவனுக்குத் தந்தையின் சொத்தில் நாலிலொன்றுக்கு உரிமையுண்டு எனக் கௌதமர் கூறியுள்ளார்.,False
1410,"வசிட்டரும், விட்டுணுவும் விதவை வயிற்றில் மறுமணத்தாற் பிறக்கும் பிள்ளைகள் வளர்ப்புப் பிள்ளை களுக்குச் சமமானவர்கள் எனக் கூறியுள்ளார்கள்.",False
1411,"ஒரு பெண் வலிதில் கவரப்பட்டுக் கிரியைகள் மூலம் மணஞ்செய்து கொடுக்கப்படாவிட்டால், அவள் இன்னொருவனுக்குக் கொடுக்கப்படலாமென்று வசிட்டர் கூறி யுள்ளார்.",False
1412,இதனால் கணவன் இறந்த பெண்கள் மாத்திரமல்லர் கணவனை இழக்காத பெண்களும் மறுமணம் செய்யலாம் என்னும் சட்டங்கள் இருந்தனவென்று தெரிகிறது.,False
1413,கலியாண நீக்கம் மோக்ஷம் எனப்பட்டது.,False
1414,"நாரதர் சொல்லும் சட்டம் வருமாறு கணவன் வெளிநாட்டுக்குச் சென்று திரும்பாவிடில், பிராமணப் பெண் எட்டு ஆண்டுகள் காத்திருக்கவேண்டும்.",False
1415,அவளுக்குப் பிள்ளை இல்லாவிட்டால் நான்கு ஆண்டுகள் பொறுத்திருக்கலாம்.,False
1416,பிள்ளையுள்ள சத்திரியப் பெண் நான்கு ஆண்டுகள் காத்திருக்கலாம்.,False
1417,அதன்பின் அவள் இன்னொருவனை மணக்கலாம்.,False
1418,"பிள்ளையுள்ள வைசியப் பெண் நான்கு ஆண்டுகளும், பிள்ளையில்லாதவள் இரண்டு ஆண்டுகளும் பொறுத் திருக்கலாம்.",False
1419,சூத்திரப் பெண் காத்திருக்க வேண்டியதில்லை.,False
1420,இது பிரசாபதி யின் சட்டம். இக் காரணங்களால் மறுமணம் குற்றமாகாது.,False
1421,"நாரதர் கூறுவது பெண், சந்ததியைப் பெருக்குவதற்காகப் படைக்கப் பட்டவள்.",False
1422,பெண்வயல் ஆண் விதையை விதைப்பவன்.,False
1423,விதையில்லாத வனுக்கு வயலைக் கொடுக்கக்கூடாது.,False
1424,விதையில்லாதவன் வயலை ஆளுவ தற்குத் தகுதியற்றவன்.,False
1425,கோசல தேசத்தரசன் காசி தேசத்தரசன் மனைவியை மணந்தா னென்று அசதரூப என்னும் சாதகம் கூறுகின்றது.,False
1426,குப்த அரசர் காலத்தில் விதவையை அவள் கொழுநன் மணக்கும் வழக்கு இருந்தது.,False
1427,"மனுகாலத்துக்கு முன், விதவைகள் கடுந்தவம் செய்யவேண்டுமென்னும் சட்டம் இருக்கவில்லை.",False
1428,இவ்வகைச் சட்டம் வேத காலத்தில் இருக்கவும் இல்லை.,False
1429,பழைய நீதி நூல்களை எழுதிய கௌதமர் அதைப்பற்றிக் குறிப்பிடவில்லை.,False
1430,"போதாயனரும், வசிட்டரும், அவர்கள் சிலகாலம் கட்டுப்பாடாக வாழவேண்டுமெனக் கூறுகின்றனர்.",False
1431,"மௌத்கலியர் என்பவர், அவர்கள் அவ்வாறு ஆறு திங்கள் செய்தால் போதுமானது என்று கூறியுள்ளார்.",False
1432,அக் காலத்தின் பின் அவள் கொழுநனைச் சேர்ந்து பிள்ளைகளைப் பெறலாம்.,False
1433,"பெண் களுக்குக் கல்வி கூடாது என்னும் கருத்து அமெரிக்கா, இங்கிலாந்து முதலிய இடங்களிலும் இருந்து வந்தது.",False
1434,ஜப்பானிலும் பெண்கள் சிலரே ஆரம்பக் கல்வி கற்க அனுமதிக்கப்பட்டார்கள்.,False
1435,இந்நிலை சென்ற நூற்றாண்டின் பிற் பகுதி வரையில் ஜப்பானில் நிலவிற்று.,False
1436,அதன் பின் பெண்கள் ஆண் களுக்குத் தாழ்ந்தவர்கள் என்னும் கொள்கை கைவிடப்பட்டது.,False
1437,இன்று ஆயிரக்கணக்கான ஜப்பானியப் பெண்கள் கல்லூரிகளிலும் கலாசாலை களிலும் கல்வி கற்று வருகின்றார்கள்.,False
1438,அங்கு ஐம்பது ஆண்டுகளுக்கு முன் உண்டான விழிப்பு இன்று இந்தியாவில் உண்டாகவில்லை.,False
1439,"எண்ணம், புத்தி, ஒழுக்கங்களை வளர்ப்பதற்கு ஆணுக்காயினும் பெண்ணுக்காயினும் கல்வி தேவை.",False
1440,"விதைபோன்ற குழந்தை வளர்ந்து மரம்போல ஆவதற்கு, அல்லது புழுப்போன்றுள்ள குழந்தை வளர்ந்து மனிதன் போல விளங்குவதற்குக் கல்வியே துணைபுரிகின்றது.",False
1441,இவ்வகையான உதவி ஆணுக்காவது பெண்ணுக்காவது மறுக்கப்படுதல் கூடாது.,False
1442,"கல்வி நம்மை ஆள்வதற்கும், நம் போன்ற பிறரை ஆள்வதற்கும் பயன்படுகின்றது.",False
1443,இன்று குடியாட்சிக் காலம்.,False
1444,இன்று ஆளும் உரிமை எல்லா மக்களின் உரிமையாக மாறிக் கொண்டு வருகின்றது.,False
1445,இவ்வாறிருக்கும் போது பெண்ணாவது ஆணாவது தனது உரிமையைப் பயன்படுத்தாவிடில் யாது பயன்?,False
1446,"பொதுமக்கள் எவ்வளவு கல்வியறிவுடையவர்களாகின்றார்களோ, அவ்வளவுக்கு ஆட்சி நிலை உயர்கின்றது.",False
1447,"எங்குச் சுயஆட்சி வேண்டப்படுகின்றதோ, அங்கெல் லாம் எல்லா மக்களுக்கும் கல்வி அவசியமாகின்றது.",False
1448,இந்திய நாட்டில் மக்களில் பாதித் தொகையினர் பெண்பாலினர்.,False
1449,"அவர்கள் கல்லாதவர்களாயும், அறியாமையுடையவர்களாகவும் இருக்க முடியாது.",False
1450,மக்கள் கல்வியறிவுடையவர்களாக இருந்தால் மாத்திரம் குடி ஆட்சி நடைபெறும் என அரசியல் அறிஞர் கூறிகின்றனர்.,False
1451,எப்பொழுதும் ஆடவன் கல்வியறிவுள்ள பெண்ணையே மணக்க விரும்புகிறான்.,False
1452,நாள் முழுதும் உழைத்து ஓய்ந்த கணவனுக்குப் புத்திசாலி யான மனைவியோடு உரையாடுவது களையைப் போக்குவதா யிருக்கும்.,False
1453,"மனைவி படியாதவளாயும், கணவனுக்குப் புத்தி கூறமாட்டாத அனுபவமற்ற வளாயும், மூடத்தனமுடையவளாயும் இருப்பாளாயின், அவள் கணவனின் நட்பினளாயிருக்கத் தகுதியற்றவளாவாள்.",False
1454,படிப்பதால் பெண் குழந்தை களை நேரான வழியில் பழக்குவாள்.,False
1455,பெண்களுக்குக் கல்வி பயிற்றுவதால் நாம் படித்த குடும்பங்களை உண்டாக்குகின்றோம்.,False
1456,பையன் ஒருவனைப் படிக்க வைப்பதால் நாம் படித்த ஒருவனை மாத்திரம் பெறுகின்றோம்.,False
1457,பொருளாதார முறையிலும் பெண்களுக்குக் கல்வி இன்றியமையாதது.,False
1458,"பெண்கள் கல்வி கற்பதால் பொருளுற்பத்திகளும், பொருள்களை வாங்கும் தகுதியும் அதிகரிக்கும்.",False
1459,ஆகவே ஒரு நாட்டுக்குரிய பொருளுற்பத்தி முதலியன இரட்டிக்கும்.,False
1460,ஆண் பெண் என்ற வேறுபாடு இன்றி எல்லோரும் தமது வாழ்க்கைக்குப் போதுமான பொருளீட்டக்கூடிய கல்வியை அளிப்பது அரசினரின் கடமை.,False
1461,"ஒவ்வொரு கணவனும், தன் மனைவிக்கும் பிள்ளைகளுக்கும் சரியான முறையில் கல்வி அளிக்கப்படுகின்றதா என்று கவனிக்க வேண்டும்.",False
1462,கணவனின் மரணத்துக்குப்பின் பெண் ஆதரவற்றவளாகக் கூடாது அவள் பிறர் கையை எதிர்பார்த்து வாழ்தல் கூடாது.,False
1463,ஆதரவற்ற காலங்களில் பெண் களுக்குக் கல்வியே ஆதரவளிக்கின்றது.,False
1464,"பெண், விரும்பினால் மணஞ் செய்துகொள்ளாது வாழலாம்.",False
1465,அப்போது அவள் தனது வாழ்க்கைச் செலவைத் தானே தேடுபவளாக விருத்தல் வேண்டும்.,False
1466,பெண்ணுக்குத் தக்க கல்வியளிக்கா விட்டால் தந்தை தனது கடமையைச் செய்தவனாக மாட்டான்.,False
1467,ஒரு நாட்டுக்குரிய மக்களின் ஒழுக்கத்தை உயர்த்தி அவர்களை மேல் நிலையில் வைத்தலால் கல்வி ஒவ்வொருவருக்கும் அவசியமானது.,False
1468,"கல்வி, அறிவை வளர்ப்பது மாத்திரமல்லாமல் நேர்மை, பொதுத் தொண்டு களில் ஊக்கம் முதலியவைகளையும் கொடுக்கும்.",False
1469,"ஆடவர், பெண்களுக்குக் கல்வியளிக்க மறுத்து வந்தார்கள்.",False
1470,"அதற்குக் காரணம், அவர்கள் அறிவின் மேன்மையால் தமக்கு என்றும் கீழ்ப்படிந்து இருக்கமாட்டார்கள்.",False
1471,என்ற சுயநலமேயாகும்.,False
1472,"இக்கருத்து இந்தியாவில் மாத்திரமன்று, உலகம் முழுமையிலும் இருந்தது.",False
1473,உரோமாபுரி யில் அரச குடும்பப் பெண்கள் சிலர் மாத்திரம் கல்வி கற்றார்கள்.,False
1474,மற்றப் பெண்களுக்குக் கல்வி பயில இடம் கிடைக்கவில்லை ஆண்களைப் போலவே பெண்களுக்கும் கல்வி வேண்டுமென வாதாடியவர் மார்ட்டின் லூதர்.,False
