Line Number,Sentence
583,ஹிந்தப் நிழைப்பு என்ன நிழைப்பு என்று சுட்டுகிறார் ஞிவவாக்கியர்.,False
584,தேர்த்ணிருஜீழா அடியார் வேடலீட்டு அலைக்கஷீஷி செய்வதை மட்டும் ஞித்தர் சொல்ஸீ பிற்கஜீல்லை!,False
585,"தேர்த்ணிருஜீழா என்னும் பெயராலும், எழுந்ணிருத்து ஊர்வலம் என்னும் பெயராலும் எவ்வளஷி னிண்கள்!",False
586,ஹிவற்றைஜிம் தெஹீவாக்கு கிறார்.,False
587,தலைப் நிரட்டு என்பது ஹில்லையா?,False
588,அதுபோல் ஹிது சமயப் நிரட்டு என்க.,False
589,ஹிவற்றைப் பற்றிய தம் கருத்தைச் ஞிவவாக்கியர் தெஹீஜீக்கிறார்.,False
590,சருக ருந்ணி நீர்குடித்துச் சாரல் வாழ்த வஞிகாள் சருக ருந்ணில் தேகங்குன்றிச் சஞ்சலம் உண் டாகுமே!,False
591,"புலாலை ஜீரும்நிஜிண்ணும் வேடனாய், புலாலைச் சுவைத்துச் சுவைத்துப் படைத்த ணிண்ணன் ஹிறைவன் அருள் கூடலால் கண்ணப்பன் ஆனானே!",False
592,கண்ணப்பன் ஒப்பதோர் அன்நின்மை கண்டு அழுது ஆழுது அரனடி அடைந்த அடியாரும் அவன் புகழ் பாடினரே!,False
593,"அவ்வாறாகப் புலாலுண்ணல் குற்றமாகிப், புலாலுண்ணாமை மேன்மையாகிஜீடுமா?",False
594,புலாலைக் கடந்து பிற்பது மெய்ப்பொருள் நாட்டம் எனக் கண்ணப்பர் வரலாற்றால் அறியலாம்.,False
595,ஆனால் ஞிவவாக்கியர் அந்த மேலோட்டச் சான்றில் தலைப்பட ஜீல்லை.,False
596,அவர் தம் வழக்கம் போல் மூலத்ணிற்குச் சென்று முடிச்சை அஜீழ்த்து ஜீளக்கம் காட்டுகிறார்.,False
597,புலால் என்பது என்ன?,False
598,உடல் ஆம்!,False
599,உழீர் தங்குதற்கு ஹிடமாம் உடல்!,False
600,உழீர் உறைஜிம் உடலாம் புலாலை ஜீட்டு ஹிறைவனை வேறு எங்கே தேடிக் காண்கிறீர்!,False
601,புலாலை ஜீட்டுப் நிளீயாத ஹிறைவனை அதனை ஒஷீத்து எங்கே உங்களால் காண முடிஜிம்?,False
602,அவனே புலாஸீல் முளைத்தெழுந்த நித்தன்!,False
603,உங்கள் புலால் பேச்சை ஜீடுங்கள் என்கிறார்.,False
604,அவ்வாறானால் புலால் உண்க என்கிறாரா?,False
605,அவர் புலால் உண்டாரா?,False
606,ஹிரத்தத்ணில் ஹிருந்து நிளீந்து வந்த பாலை உண்டு வளர்ந்த வர்கள் புலாலை உண்டணில்லை என்று சொல்லலாமா?,False
607,மான் ஹிறைச்ஞி ணின்றணில்லை என்னும் வேணியர் மான் தோலை அல்லவோ மார்நில் நூலாக அதிகின்றனர்!,False
608,ஆட்டிறைச்ஞி ணின்றணில்லை என்பவர் வேள்ஜீழீல் படைப்பது ஆட்டிறைச்ஞி அல்லவோ!,False
609,பஸீழீடல் நேர்த்ணிக்கடன் காரணமாக ஆடு கோஷீகளைக் காஷி தருவதைக் கண்டிருக்கிறார் ஞிவவாக்கியர்!,False
610,பேய் உங்களைப் பூசை கேட்டதா?,False
611,நிடாளீ உங்களைப் பூசை கேட்டதா?,False
612,உங்கள் உடலுக்குள்ளேதான் பேய் உள்ளதேயன்றி வேறு எங்கே உள்ளது என்கிறார்.,False
613,ஞிந்ணித்துக் கண்ட தெஹீவைச் செவ்வையாக மக்கள் மையத்ணில் வைக்கிறார்.,False
614,குலப் நிளீஷி மவீத ஹினத்ணிற்குப் புற்றுநோய் போலப் புரையோடிக் கிடக்கும் கொடுமையானது சாணிப் நிளீஷி!,False
615,ஹின்றும் அந்த பிலை மாறிற்றில்லை.,False
616,ஹின்றும் அந்பிலை மாறாதும் ஹிருக்கின்றனர்.,False
617,கண்படுதலும் தீட்டு என்னும் கயமைஜிம் கால் கொண்டு செஷீத்ததுண்டு.,False
618,அவ்வாறு கடிந்து கூறியவருள் தலையாயவர் ஞிவவாக்கியர் எவீன் முற்றிலும் தகும்.,False
619,"அவர், அவர்தம் வழக்கம் போலவே சாணிக் குறும்நின் ஆதி வேரை அசைத்துப் நிடுங்கி வெந்நீர் ஜீட்டுப் பார்க்கிறார்!",False
620,ஞிவவாக்கியர் பேசுகிறார் சாணி யாவ தேதடா? என்கிறார்.,False
621,சாணி ஹில்லை என்பது எதனால் என்றால் ஜீளக்குகிறார் எல்லாரும் நிறப்பதுபோல் தானே தாழ்த்தப்பட்டவர்களும் நிறக்கின்றனர்.,False
622,அவர்கள் மட்டும் வேறு வகைழீலா நிறக்கின்றனர்!,False
623,"அல்லது உயர்ந்தவர்கள் என்னும் ஹினத்தார், எவருக்கும் ஹில்லாத ஜீயப்பானதொரு முறைழீல் நிறக்கின்றனரா?",False
624,எல்லாரும் சலம் ணிரண்ட நீளீல்தாம் நிறக்கின்றனர் எல்லார் நிறப்பு வாழீலும் ஒன்றுதான் முறைமைஜிம் ஒன்றுதான்!,False
625,காணில்போடும் வாஹீ உண்டு காரை உண்டு கம்நி உண்டு காஸீல் போடும் பாடகம் ஞிலம்பு உண்டு எல்லாமும் பொன்தானே!,False
626,"அவை வேறு அதிகலமாக ஹிருந்தாலும், அவற்றின் மூலப் பொருள் பொன்தானே!",False
627,ஹிவற்றுள் உயர்ஷி தாழ்ஷி மேல் கீழ் சொல்ல முடிஜிமோ?,False
628,பனத்ணி பார்ப்பனத்ணி என்று ஞிலரை உயர்த்ணி வைத்ததென்ன?,False
629,ஹிறைச்ஞி தோல் எலும்பு ஹிவற்றில் ஹிது பறைச்ஞிக் குளீயது ஹிது பனத்ணிக்குளீயது என அடையாளமேதும் உண்டோ?,False
630,"ஹின்னும் சொன்னால், பறைச்ஞியோடு கூடிக் கொஞ்ஞிக் குலாஷிவது ஒருவகையோ?",False
631,பனத்ணியோடு கூடிக் கொஞ்ஞிக் குலாஷிவது என்ன ஒரு தவீவகையோ?,False
632,அறிஜீருந்தால் ஹிவற்றை எண்திப் பார்க்க வேண்டாவா?,False
633,என்கிறார் ஞிவவாக்கியர்.,False
634,பறைச்ஞி யாவ தேதடா பனத்ணி யாவ தேதடா ஹிறைச்ஞி தோல்எலும்நினும் ஹிலக்க லீட்டி ருக்குதோ?,False
635,பறைச்ஞி போகம் வேறதோ?,False
636,பனத்ணி போகம் வேறதோ?,False
637,பறைச்ஞி ஜிம்ப னத்ணிஜிம் பகுந்து பாரும் உம்முளே!,False
638,ஒருவேளை அவை கலந்தாலும் அவற்றின் கரு வேறு பாடான ஓர் உருவையே ஆக்கும்.,False
639,என்று வருந்துகிறார்.,False
640,எள்ளல் கதை சொல்ஸீ ஹிஷீவாக்குவதற்கல்லவோ அவர்கள் உணர்ஷி பயன்பட்டுள்ளது.,False
641,பயன்பாட்டு வஷீழீல் சென்றிருந்தால் சாணிழீன் முடை நாற்றம் ஹின்றுவரை போகாணிருக்காதே!,False
642,ஆனால் ஒன்று.,False
643,ஞிவவாக்கியர் தேர்ந்த மெய்ஜிணர்வாளர்.,False
644,அவர் வாக்கை வாழ்வாக்கிக் கொண்டால் வையகம் வாழும்!,False
645,ஹில்லையேல் அதற்கு உய்ஷி அளீது!,False
646,அவர் வாக்கென்ன வாக்கு பொய் வாக்கு ஹில்லாத மெய்வாக்குத்தானே அவர் வாக்கு!,False
647,"ஆதலால், ஹிசை வகுத்துப் பாடுவார்க்கு ஹிவீய வாய்ப்புடையதாகப் பாடல்கள் அமைந்துள்ளன.",False
648,"ஞிவவாக்கியர், தாம் பாடும் பாடல்கள் எல்லாவற்றைஜிம் எழுசீர்ச் சந்த ஜீருத்தத்ணில் அமைத்துள்ளார்.",False
649,ஹிவீ ஹிப்பாடல் ஆறுசீர்ச்சந்த ஜீருத்தமாகஷிம் அமைகின்றது காண்க.,False
650,ஆனால் ஆறுசீர்ச் சந்த ஜீருத்தமாக்கிக் கொண்டால் அவ்ஜீடர்ப்பாடு ஹில்லை.,False
651,நான்காம் அடி ஒன்றை மட்டும் ஏழு சீராகக் கொள்ள வாய்ப்புள்ளது!,False
652,ஆனால் ஹிடர்ப்பாடு ஹில்லாமல் படிக்கஷிம் பொருள் காணஷிம் தரஷிகொச்சக அமைப்பே மூன்றாவது அமைப்பே பெருவாய்ப்பாக உள்ளதாம்.,False
653,ஹிங்குச் சந்த வகைழீல் படித்தும் பாடிஜிம் மகிழ்வதற்கு வாய்ப்பாக ஆறுசீர்ச் சந்த ஜீருத்த அமைணி மேற்கொள்ளப்பட்டதாம்.,False
654,ஞிவவாக்கியர் பாடஸீல் அடுக்குச்சொற்கள் லீகுணி அடிகள் அடுக்கிவருவதும் உண்டு.,False
655,"மீண்டும் மீண்டும் சொல்லோ தொடரோ அடுக்கிவருதஸீலே சொற்சுவை பொருட்சுவை லீகுதலும், பொருள் ஜீளக்கம் எஹீமையாகப் பெறுதலும் கண்கூடு.",False
656,ஹிம்முறை ணிருமூலர் முதஸீய பெருமக்கள் முன்னரே காட்டிய வஷீமுறைப்பட்டதாம்.,False
657,அணில் ஞிவவாக்கியர் பேரீடுபாடு கொண்டுளார் என்பது வெஹீப்படை.,False
658,எழுசீர்ப் பாடல்களை சீர்ப் பாடல்களாக ஹிரட்டை ஆஞிளீய ஜீருத்தமாகச் செய்ததும் உண்டு.,False
659,சந்தம் மாறாமல் சீர் எண்திக்கையை ஹிரட்டிப்பு ஆக்கிக் கொள்ளுதல் ஹிதன் அமைப்பு முறையாம்.,False
660,ஹிம்முறைழீல் ஏழு பாடல்களைப் பாடிஜிள்ளார்.,False
661,ஞில பாடல் செய்ணிகள் அப்படியே அமைந்துள.,False
662,"ஓளீரண்டு சீர்கள் அசைகள் மாற்றமன்றி வேறொன்றிலாத அமைப்பு ஒப்புமைஜிம், பொருள் பிலைழீல் முழுதொப்புமைஜிம் உண்டு.",False
663,"அப்பாடல்களுள் ஒன்றை ஜீலக்குதல் தகும் எவீனும், பாடவேறு பாடுபோல ஆய்வார்க்கு உதஷிம் என்னும் கருத்தால் ஜீலக்கப் பட்டில.",False
664,"எடுத்துக்காட்டாக , ஆம் பாடல்களைஜிம், , ஆம் பாடல்களைஜிம் காண்க.",False
665,"பாடல் வேறாழீனும் பொருள் மாறாணிருத்தலை , ஆம் பாடல்கஹீலும் , ஆம் பாடல்கஹீலும் காண்க.",False
666,எடுத்துக்காட்டாக முதல் வரைஜிள்ள பாடல்களைக் காண்க.,False
667,ஹிவர் பாடல்கஹீல் உவமைகள் உருவகங்கள் ஆகியவை அருமையாக அமைந்துள.,False
668,ஹிறந்தவர் நிறப்பணில்லை என்பதை ஐந்து உவமைகளால் தெஹீஜீக்கிறார்.,False
669,மனத்து மாயை மனத்து மறைந்ததை நீர் ஆஜீயாகிப் போதலைக் கொண்டு ஜீளக்குகிறார்.,False
670,", கடஸீல் ணிளீஜிம் ஆமை, பச்சை மண் பதுப்புப் புழு முதஸீயவற்றை உவமைப்படுத்துகிறார் , .",False
671,"அந்பிலைகஹீல் எதுகை மோனை முதஸீயவற்றைப் பார்க்கிலும் பொருள் தெஹீஷி, பொருள் ஜீளக்கம் என்பனவே ஞிவவாக்கியரால் போற்றப்படுகின்றனவாம்.",False
672,ஞில பாடல்கஹீல் ஒஸீ ஒப்புமையால் எதுகை அமைத்துக் கொள்கிறார் .,False
673,ஞில பாடல்கஹீல் ஹிரண்டடிக்கு ஓர் எதுகை கொள்கிறார் .,False
674,ஞில பாடல்கஹீன் முடிபிலை ஒன்றாக அமைத்துக்கொள்கிறார்.,False
675,ஐந்து என்பதைப் பெரும்பாலும் அஞ்சு எனவே ஆள்கிறார்.,False
676,"பற்றுலீன்கள், நோக்கவல்ஸீரேல், ஓர்கிமிர், உணர்கிமிர், எங்ஙனே ஹின்னவாறாக அளீய ஹிலக்கிய ஆட்ஞிகளைஜிம் வழங்குகிறார்.",False
677,அசங்குதல் போன்ற அளீய ஆட்ஞிழீலும் தலைப் படுகிறார்.,False
678,ஞித்தர்கள் சொல்லாட்ஞிகள் ஞில கலைச் சொல்லாக்கத் ணிற்கு ஏற்றவையாகஷிம் ஏந்தானவையாகஷிம் உள்ளன.,False
679,நாடிக்கலை மூச்சுக்கலை பழீல்வார்க்கு மூல வைப்பகமாகத் ணிகழ்கின்றன.,False
680,ஓஜீயர்க்கும் ஞித்தர் பாடல்கள் ஜீருந்தாம் என்பது ஒரு பாடலால் வெஹீப்படுகின்றது.,False
681,அதனை ஓஜீயமாக நெடுங்காலத்ணிற்கு முன்னரே வரைந்து போற்றிக் கொண்டனர் என்பது குறிப்நிடத் தக்கது.,False
682,சாத்ணி ரங்கள் ஓதுகின்ற சட்ட நாத பட்டரே வேர்த்ணி ரைப்பு வந்தபோது வேதம் வந்தே உதஷிமோ?,False
683,மாத்ணி ரைப்போ தும்முளே மறித்து நோக்க வல்ஸீரேல் சாத்ணி ரப்பை நோய்க ளேது சத்ணி முத்ணி ஞித்ணியே.,False
684,நேர தாக உம்முளே அறிந்து ணர்ந்து கொள்ளுமே!,False
685,எங்கும் ஆகி பின்றநாமம் நாமம் ஹிந்த நாமமே!,False
686,ஆடு காட்டி வேங்கையை அகப்ப டுத்து மாறுபோல் மாடு காட்டி என்னைநீ மணிம யக்கல் ஆகுமோ?,False
687,கோடு காட்டி யானையைக் கொன்று ளீத்த கொற்றவா னிடு காட்டி என்னைநீ வெஹீப்ப டுத்த வேணுமே.,False
688,மந்ணி ரங்கள் உண்டுநீர் மயங்கு கின்ற மாவீடீர்!,False
689,நட்ட கல்லைத் தெய்வம்என்று நாலு புட்பம் சாத்ணியே சுற்றி வந்து முணமுணென்று சொல்லு மந்த்ரம் ஏதடா!,False
690,நட்ட கல்லும் பேசுமோ நாதன் உள்ஹீ ருக்கைழீல் சுட்ட சட்டி சட்டுவம் கறிச்சு வைஅ றிஜிமோ?,False
691,பேய்கள் கூடிப் நிணங்கள் ணின்னும் நிளீய லீல்லாக் காட்டிலே நாய்கள் சுற்ற நடனமாடும் நம்பன் வாழ்க்கை ஏதடா!,False
692,தாய்கள் பால்உ ணிக்கும்ஹிச்சை தஜீர வேண்டி நாடினால் நோய்கள் பட்டு ழல்வதேது நோக்கிப் பாரும் உம்முளே.,False
693,கட்ட ஜீழ்த்துப் நிரமன்பார்க்கில் கணிஉ மக்கும் ஏதுகாண்.,False
694,வேதம் ஓது வேலையோ னிண தாகும் பாளீலே காத காத தூரம்ஓடிக் காதல் பூசை வேணுமோ?,False
695,ஆணி நாதன் வெண்ணெஜிண்ட அவவீ ருக்க நம்முளே கோது பூசை வேதம்ஏது குறித்துப் பாரும் உம்முளே.,False
696,பரம்ஹி லாத தெவ்ஜீடம் பரம்ஹி ருப்ப தெவ்ஜீடம்?,False
697,மாதர் தோள்சே ராததேவர் மாபி லத்ணில் ஹில்லையே!,False
698,ஞித்தர் என்றும் ஞிறியர்என்றும் அறியொ ணாத சீவர்காள்!,False
699,எத்ணி சைஎங் கெங்கும்ஓடி எண்தி லாத நணிகஹீல் சுற்றி ஜிம்த லைமுழுகச் சுத்த ஞாவீ யாவரோ?,False
700,பத்ணி யோட ரன்பாதம் பதிந்ணி டாத பாஜீகாள்!,False
701,முத்ணி ஹின்றிப் பாழ்நரகில் மூழ்கி நொந்த லைஜீரே.,False
702,சாத்ணி ரங்கள் பார்த்துப்பார்த்துத் தான்கு ருடு ஆவதால் நேத்ணி ரங்கெட வெய்யோனை நேர்து ணிசெய் மூடர்கள்!,False
703,பாத்ணி ரம்அ றிந்துமோன பக்ணி செய்ய வல்ஸீரேல் சூத்ணி ரப்படி யாவரும் சுத்தர் அவர் அங்ஙனே.,False
704,ஞிவவாக்கியர் முற்றிற்று.,False
705,குதம்பைச் ஞித்தர் முன்னுரை ஞித்தர் பாடல்கள் சீர்ணிருத்தப் பெட்டகம் பகுத்தறிஷிப் பாசறை உள்ளொஹீ உறைஜிள் உழீருய்க்கும் ஒஹீநெறி!,False
706,"ஞித்தருள் ஞித்தர், ஞிவவாக்கியர்!",False
707,"அவர், ஞித்தர் உலகின் நக்கீரர்!",False
708,குற்றம் குற்றமே என்பதைக் குலையாமல் குறையாமல் உரைக்கும் கொள்கை னிரர்!,False
709,"ஊனுடம்பு ஆலயத்தை உள்ளவாறு உணர்ந்து, உலகுய்ய உணர்த்தும் உரவோர்!",False
710,தொண்டின் உறைப்நிலே துடித்தெழும்நிய தூண்டாத் தொண்டர் பெருமகனார்!,False
711,காற்றின் கணக்கறிந்து கூற்றை வதைக்கும் நெறியறிந்த நேராளர்!,False
712,"அவரைப்பற்றிய மேலோட்ட ஆய்ஷி, முன்னை ஐம்பது பக்கங்கள்!",False
713,"அவர்தம் உள்ளோட்ட வஷீவந்த நிஷீவாம் பாடல்கள், நின்னை எழுபத்தாறு பக்கங்கள்!",False
714,ஞித்தர் நெறியை முற்றாக ஆய்ந்து பெருநூல் ஒன்று ஆக்குதல் வேண்டும்.,False
715,"அது, ஹிக்காலத்துச் சமயத்துள் புகுந்துள்ள புன்னோய்களுக்கு நன்மருந்தாகத் ணிகழும்!",False
