Line Number,Sentence
1,மேப்லித்தோ அளவு தெம்மி எழுத்து . புள்ளி பக்கம் படிகள் விலை உரு.,False
2,நூலாக்கம் டெலிபாய்ண்ட் சென்னை .,False
3,"அட்டை வடிவமைப்பு கா.பாத்திமா அச்சு வெங்கடேசுவரா ஆப்செட் பிரிண்டர் இராயப்பேட்டை, சென்னை .",False
4,தொ.பே நூல்கிடைக்கும் இடம் தமிழ்மண் பதிப்பகம் தொ.பே .,False
5,பதிப்புரை இருபதாம் நூற்றாண்டு தமிழுக்கும் தமிழருக்கும் பெருமை சேர்த்த நூற்றாண்டாகும்.,False
6,இந் நூற்றாண்டில் தமிழுக்கு அருந் தொண்டாற்றியவர்கள் வரிசையில் அறிஞர் சாமி.,False
7,சிதம் பரனாரும் ஒருவர்.,False
8,தந்தை பெரியாரின் தலைமையில் கலப்புமணம் செய்து கொண்ட சீர்திருத்த முன்னோடி.,False
9,இவர் எழுதி வெளிவந்த நூல்கள் என்று அறிஞர்கள் பதிவில் காணப்படுகிறது.,False
10,கைக்குக் கிடைக்கப் பெறாத ஏனைய நூல்களைத் தேடியெடுத்து எதிர்வரும் ஆண்டில் வெளியிட முயலுவோம்.,False
11,தம் எழுதுகோலை பொழுதுபோக்குக்காகவோ பிழைப்புக் காகவோ கையாளாத தன்மானத் தமிழறிஞர்.,False
12,தம் எழுத்தை இலட்சிய நோக்குடன் தமிழர்களின் நலனுக்காக எழுதியவர்.,False
13,தனித்தமிழியக்கம் நீதிக்கட்சி திராவிடர் கழக ஈடுபாடு கொண்டவர்.,False
14,பன்முகப் படைப்பாளி.,False
15,புதிய பார்வையுடன் திருக்குறளின் அருமை பெருமைகளை ஆழ்ந்து அகழ்ந்து காட்டி யவர்.,False
16,"பட்டமும் பதவியும், செல்வமும் செல்வாக்கும், இளமை யும் அழகும், பொன்னும் பொருளும் மாந்த வாழ்வில் நிலையற்றது.",False
17,சிலப்பதிகாரம் அரசியல் புரட்சியை அறிவுறுத்த எழுந்த நூல்.,False
18,மணிமேகலை சமுதாயப் புரட்சியை அறிவுறுத்த எழுதப்பட்ட நூல்.,False
19,"ஐம்பெருங்காப்பியங்கள் புலவர்கள் போற்றும் பெருமைக்குரிய பழந்தமிழர் பண்பாட்டுச் செல்வங்கள், சாதி வேற்றுமையையும், பெண்ணடிமைத்தனத்தைக் கண்டித்தும்.",False
20,பிறப்பால் வேற்றுமைப் பாராட்டப்படும் கொடுமைகளுக்கு ஓங்கிக் குரலை கொடுத்தவர்.,False
21,முற்போக்கு இயக்கத்தின் முன்னணித் தலைவர் களில் ஒருவராய்த் திகழ்ந்தவர்.,False
22,புலமை மிக்க தமிழ் அறிஞராக இருந்தபோதும் அவர் பழைமைவாதி யாக இருக்கவில்லை.,False
23,சமுதாய மாற்றத்தையும் பரிணாம வளர்ச்சியையும் கணக்கில் கொண்டு தமிழ் இலக்கியத்தை ஆய்வு செய்தவர்.,False
24,பிற்போக்கு வாதிகளால் உருவாக்கி விடப்பட்ட பல கட்டுக் கதைகளையும் கற்பனைகளையும் இவருடைய கட்டுரைகள் தவிடுபொடியாக்கின.,False
25,என்று திரு.டி.செல்வராஜ் அவர்கள் இப்படி பதிவு செய்கிறார்.,False
26,"இவருடைய எழுத்துக்களில் ஆழ்ந்த சமூக அக்கறையும், தொலைநோக்குப் பார்வையும் படிந்து கிடக்கிறது.",False
27,இதனைத் தொகுத்தும்.,False
28,பஞ்சப் பேய் கால மழையில்லை சுழல் காற்று மழை!,False
29,கோடை மழையின் சிறப்பு மழை !,False
30,என்ன அழகு!,False
31,அரசியல் .,False
32,சமூகவியல் .,False
33,அறிவியல் .,False
34,பொதுவியல் அறிவு கவிதை இந்நூல் உரிமை தமிழ்ப் பெருமகனார் அறிஞர்.,False
35,அதிதீவிரக் கருத்துக்கள் அமைந்தவை.,False
36,இப் பாடல்கள் பலப்பலசமயங் களில் பாடப்பட்டவை பலபத்திரிகைகளிலும் வெளிவந்தவை அவைகளின் தொகுப்பே இவை.,False
37,இந்நூலைத் தமிழர் படித்துச் சீர்திருத்த வாதிகளாக வேண்டும் என்பதே நமது ஆசை.,False
38,இதன் இரண்டாம் பாகம் விரைவில் வெளி வரும்.,False
39,வேண்டுவது அன்பர்களின் ஆதரவே.,False
40,சாமி சிதம்பரனார்.,False
41,அறிவுப்பகுதி வெற்றி .,False
42,ஆண்மை யுடன்செயல் செய்யமுன் நிற்பாய்!,False
43,கச்சையை நன்கு வரிந்து நீ கட்டி காரண காரியம் கண்டு புரிவாய்!,False
44,சக்தியை நழுவிடச் செய்வது வேண்டாம்!,False
45,சந்ததம் ஊக்கம் கொண்டு முயல்வாய்!,False
46,எத்தொழில் செய்யினும் யாவினும் வெற்றி எய்துதல் நிச்சயம் என்ப துணர்வாய்!,False
47,ஆத்திரம் கொண்டெதும் செய்திடல் வேண்டாம் அறிவில் உணர்ந்தபின் செய்கை புரிவாய்!,False
48,நேத்திரம் யாவினும் சோர்வின்மை கண்டாய்!,False
49,நீ யிந்த உண்மை மறந்திடல் வேண்டாம்!,False
50,சாத்திரம் பார்த்து வினைசெயல் ஏனோ?,False
51,சமயம் இடம்பொருள் கண்டு புரிவாய்!,False
52,காத்திரன் ஆகியே வெற்றி பெறுவாய்!,False
53,கலக்கம் இன்றிநற் காரியம் செய்வாய்!,False
54,அறிவே விடுதலை ஆனந்தக் களிப்பு பல்லவி அறிவே விடுதலை என்போம் அதுவே அனைவர்க்கும் இன்பம் அளித்திடும் என்போம்.,False
55,சரணங்கள் .,False
56,அறிவே .,False
57,மக்கள் துன்பம்ஒழிப்போம்!,False
58,அறி சரணங்கள் .,False
59,அறி .,False
60,அறி பகுத்தறிவின் மாட்சி இராகம் வராளி.,False
61,தாளம் ஆதி. பல்லவி பாடுவோமே துள்ளிப் பாடுவோமே பகுத்தறிவுணர்ச்சியைப் பெற்று விட்டோமென்று பாடுவோமே சரணங்கள் .,False
62,அது குருவே!,False
63,கூடுவோம் ஒற்றுமை தோற்றும் அடிமை குலையுமே தேற்றம்!,False
64,நாடுவோம் தொகை.,False
65,நமதுரிமை யறியாமல் வாழ்கின்ற வாழ்வினால் நலமென்ன உண்டு சொல்வீர்!,False
66,சமரச மொடுகூடி மனிதர்கள் ஒன்றாகச் சார்வதே இன்பம் கண்டீர்!,False
67,நாடுவோம் பாட்டு காணுவோம் மதஞ்செயும் சூது அதன்பின் வைதிக மிங்கேது?,False
68,பேணுவோம் அறிவைஎன் றோது இன்றேல் பெருகுமே தீது.,False
69,அவர்சொன்னார் இவர்சொன்னார் என்று நம்பி அறிவிழந்து தடுமாற்றம் அடைய வேண்டாம்!,False
70,எவர் சொன்ன சொல்லேனும் அதனை உன்றன் இயல்பான பகுத்தறிவால் எண்ணிப் பார்ப்பாய்!,False
71,தவறான வழியினிலே ஒட்டி னாலும் தான் போகும் விலங்கல்ல அப்பா நீதான்!,False
72,அவமானம் ஒன்றின்றி வாழ்வில் வெற்றி அடைந்திடுவாய்!,False
73,அறிவுதனைத் துணையாக்கொள்வாய்!,False
74,பாழான இருட்டறையில் புகுந்து நின்று பலபொருளும் பார்த்தறிதல் கூடாதப்பா!,False
75,கீழாக உள்ளனவும் காண மாட்டாய்!,False
76,மேலாக இருப்பனவும் தெரியா தங்கே வாழாமல் நமையழிக்கச் சுயநலத்தார் வைத்திட்டார் மதம் என்னும் இருட்டறைக்குள் ஆழாதே!,False
77,"அதற்குள்ளே, சொல்லிவிட்டேன்!",False
78,அறிவென்னும் வெளிச்சத்தை ஏற்றிப் பார்ப்பாய்!,False
79,மாறாத ஒருநிலையில் நிற்பாய் என்று மதக்காரர் கூறும்உரை நம்பாதே நீ!,False
80,நேராகப் பார்த்தறிந்து பரிசோதித்தே நிலைநாட்டும் விஞ்ஞான முறைகள் தேர்வாய்!,False
81,தேராமல் சுயநலத்தார் பேச்சைநம்பித் தேசத்தார் முழுமூடர் ஆகிநின்றார் ஊரார்கள் எதிர்த்தாலும் அச்சமின்றி உண்மையென அறிந்தபடி நடந்துகொள்வாய் மகிழ்ந்து வாழ்!,False
82,வாட்டமின்றி மகிழ்ச்சியுடன் வாழ்வதற்கே வழிகள்சில சொல்லுகின்றேன் கவனமாய்க் கேள்!,False
83,நாட்டினிலே உனைக் குறித்து மற்ற மக்கள் நவில் உரைகள் நோக்காமல் கருமஞ் செய்வாய்!,False
84,கூட்டு பலவீனமுடன் நோயடைந்து குறையுற்றோம் என வெண்ணிக் கவலை கொள்ளேல்!,False
85,காட்டுமுன்பு தலைவனிடம் பணிபுரிவாய்!,False
86,காலத்துக் கேற்றபடி நடந்து கொள்வாய்!,False
87,ஆண்மைதனை உயிரென்றே கொள்வாயானால் அவனியிலே உனக் கென்றும் கவலையில்லை.,False
88,மாண்புதரும் மனைவி தான் எவ்விதத்தும் மகிழ்ந்துன்றன் வசமொழுக நடந்து கொள்வாய்!,False
89,அந்தரத்தில் உலவி வரும பறவை போல அனுதினமும் துயரின்றிக் குதூகலிப் பாய்!,False
90,சிந்தை தனில் இவ்வுண்மை மொழியே கொள்வாய்!,False
91,சினேகிதர்க்கும் எடுத்துரைத்துக் கவலை தீர்ப்பாய்!,False
92,ஒற்றுமைப் பகுதி வேடம் அழிப்பீர் கரும்புத் தோட்டத்திலே என்பது போல .,False
93,வேடம் பலவணிந்தே இங்கு வேற்றுமை தோன்றிட வாழும மனிதரே!,False
94,நாடும் மனத்தினிலே இந்த ஞாலத்து மக்களுள் ஒற்றுமை செய்யவே கூடும் சுகம் உடனே!,False
95,என்றும் கொள்ளுங்கள் உங்கள் அறிவில் இவ்வுண்மையை ஓடுந் துயர் ஒழிந்தே நல்ல ஒற்றுமையோடு சமத்துவம் ஓங்குமே.,False
96,வேடம் .,False
97,உச்சிக் குடுமிகளால் இந்த உலகினில் வஞ்சகம் செய்கின்ற தேசதுக்கோ?,False
98,வைச்சு மயிர்தனையே நீங்கள் வளர்த்து முடிவதில் என்ன பயனுண்டோ?,False
99,சிச்சீ மயிர்தனிலே பேதம் செய்யும் வழக்கத்தை விட்டு விடுங்களே!,False
100,இச்சை கொள்ளும் மயிரால் மண்ணில் ஏதும்பலனில்லை வேற்றுமை போக்குவீர்!,False
101,வேடம் .,False
102,நாமம் குழைத்திடுவீர்!,False
103,சிலர் நன்றென்று சாம்பலும் கரியும் அணிகுவீர்!,False
104,சேமம் வரும் எனவே மனம் சிந்தித்துக் குங்குமம் கோபியும் தரிப்பீர்!,False
105,தீமை கெடும் எனவே பல திலகங்கள் நெற்றியில் அப்பியே திரிவீர்!,False
106,பூமியில் வாழும் மக்காள்!,False
107,நீங்கள் பூணும் இவ்வேடத்தால் பேதங்கள் செய்வதேன்?,False
108,வேடம் .,False
109,உளத்தினில் பேதங்கொண்டே நீர் ஒருவர் ஒருவரை ஏசிப் பகைகொள்வீர்!,False
110,வேடம் .,False
111,தாடியை வளர்த்திடுவீர் அது தானெங்கள் வேதம் உரைக்கும் மொழியென்பீர்!,False
112,ஆடை பலவிதமாய் நீங்கள் அணிந்ததன் மூலம்பல் சாதிகள் காட்டுவீர்!,False
113,கூடி வசிப்பதற்கே இடம்ட கொஞ்சமும் இல்லாமல் பேதங்கள் பண்ணினீர்!,False
114,மூட மதங்களினால் இந்த மோசங்கள் நம்மிடம் வந்து புகுந்தவே!,False
115,வேடம் .,False
116,பெண்களின் வேடங்களோ அப்பா!,False
117,பேசவும் நாவெழ வில்லை பலவகை!,False
118,வேடம் .,False
119,மாதர்க்கும் ஆடவர்க்கும் பல மாறுதல் காட்டிடும் ஆடை அணிகளை ஏதுக்குக் கொண்டிருப்பீர்!,False
120,இதனால் என்ன பயனுண்டு சொல்லும் உகைத்தே?,False
121,கொட்டு சரணங்கள் .,False
122,மாநிலத்தில் வாழும் மக்கள் யாரும் ஒன்றாய் மகிழ்ந்து கூடி வாழ்க வென்று கொட்டு முரசே!,False
123,தீ நினைப்புக் கொண்டவர்கள் செய்கை மாயத் தீர்த்து வெற்றிக் கூத்திடுவோம் கொட்டு முரசே!,False
124,நான்கு சாதிமக்களுக்குள் நாட்டிவைத்தார் நாலாயிர மாகியவை கூடினவே நான்குடனே நாலாயிரம் சாதிமாயந்தே நாசமாயிற் றென்று சொல்லிக் கொட்ட முரசே!,False
125,கொ .,False
126,சாதி சொல்லும் சாத்திரங்கள்போக வென்றே சாற்றி நின்று வெற்றியென்று கொட்டுமுரசே!,False
127,நீதியற்றார் சாதி பேதஞ் சொல்லி நிற்பார் நீசரவர் மாய்க வென்று கொட்டுமுரசே கொ .,False
128,மேற்குலத்தார் என்பவர்க்குள் மூட ரிலையோ மேதையர்கள் கீழ்க்குலத்தில் தோன்றல் இலையோ!,False
129,ஏற்கும்அறி வோடு தீரம் ஊக்க மெல்லாம் ஆர்க்கும் பொது வென்று கூறிக் கொட்டுமுரசே!,False
130,மாநிலமுந் தாழ்ந்தவரைத் தாங்க விலையோ!,False
131,மாரிவளங் கீழவர்க்குப் பெய்தல் இலையோ!,False
132,மேனிலையர் என்பார்க்கிவை வேறுமுளவோ?,False
133,மேலுமில்லை கீழுமில்லைக் கொட்டு முரசே!,False
134,கொ .,False
135,பசிப்பிணிகள் தூக்கமிவை யாவ ரிடமும் பண்பெனவே நின்றிடுதல் பார்த்தி லீரோ!,False
136,நசிக்க வஞ்சர் கட்டி வைத்த சாதிபேதம் நாட்டினின்றும் ஓட வென்று கொட்டு முரசே!,False
137,கலப்புமணம் ஓங்க வென்று கொட்டு முரசே!,False
138,காதல் மணம் வாழ்கவென்று கொட்டு முரசே!,False
139,பலத்த சாதி பேதம் போகக் கொட்டு முரசே!,False
140,பாரில் யாரும் ஒன்று சேரக் கொட்டு முரசே!,False
141,கொ ஒற்றுமைக் கும்மி .,False
142,ஒற்றுமை .,False
143,ஒற்றுமை .,False
144,பிறப்பினுள் வேற்றுமை ஏதுமுண்டோ?,False
145,என்று பேதையர் தங்களைக் கேட்டிடுவோம் அன்றி இறப்பினுள் வேற்றுமை ஏதுமுண்டோ என ஏழையர் தம்மையும் கேட்டிடுவோம்.,False
146,ஒற்றுமை .,False
147,மாந்தரின் உட்புறக் கருவியெல்லாம் ஒன்றாய் மன்னியிருப்பதும் பொய்யாமோ?,False
148,அவர் ஏந்துடல் என்பு தசைநாரில் சற்றும் ஏற்றம் இழிவுகள் இல்லையன்றோ?,False
149,ஒற்றுமை .,False
150,ஒற்றுமை .,False
151,சிறப்பினில் வேற்றுமை யானதுவே பின்பு செல்வத்தில் வேற்றுமையானதுவே சம பிறப்பினுள் வேற்றுமை எண்ணியதே இந்தப் பேச்சுக்குக் காரணம் நண்ணியதே.,False
152,ஒற்றுமை .,False
153,ஒற்றுமை .,False
154,ஒற்றுமை ஜாதி அழிப்பு அடைக்கலமே அடைக்கலமே என்பதுபோல பல்லவி அழித்திடுவீர்!,False
155,அழித்து வேற்றுமை யெல்லாம் ஒழித்து நலம்பெறுவீர்!,False
156,வஞ்சகர் நலம்பெற வகுத்தனர் சாதி வைத்ததைக் கட்டியே அழுவதென் நீதி?,False
157,நஞ்சென நிலை நின்று நலிகின்ற பேதி நசித்திட நாட்டினில் அறிவுரை ஓதி அழிந்திடுவீர் .,False
158,மனிதருள் ஒற்றுமை வளந்திடில் ஊக்கம் மரமென வேர்கொண்டு செழித்திடும் ஆக்கம் இனிமையைக் கெடுக்கின்ற வதுமையின் நீக்கம் எய்திடும் ஏனையா!,False
159,உமக்கின்னும் தூக்கம்?,False
160,அழி .,False
161,அழித்திடு ஒன்று சேரும்!,False
162,ஆத்ம தியாகம் பூர்த்தி செய்தார் என்பதுபோல் பல்லவி ஆண்மை போக்கும் தீமை யெல்லாம் அழித்திட ஒன்று சேரும்!,False
163,பாட்டு அச்சம் அறிவின்மை சோம்பலும் நீங்க ஆக்கம் பெருக்கும் ஊக்கமும் ஓங்க.,False
164,சாற்றின் ஒரு பேயதே!,False
165,அநுபல்லவி பாதியிலே தீய மக்கள் படைத்தனர் இந்தச் சிக்கல்!,False
166,சாதி தொகை பாழான சாதியினால் மக்களும் பிரிந்து நின்று தானே கீழான மிருகங்கள் ஆகிச் சண்டை தொடுத்தனர் வீணே.,False
167,சாதி பாட்டு வேறு வேறு வழக்கங்களால் வேடம் பல ஆயினவே மாறுபட்டு மனிதர் அன்பை மாய்ந்துவிடச் செய்ததுவே!,False
