Line Number,Sentence
1,தேவநேயம் பதிப்பாசிரியர் புலவர்.
2,இரா.
3,இளங்குமரன் தமிழ்மண் பதிப்பகம் நூற்குறிப்பு நூற்பெயர் தேவநேயம் தொகுப்பாசிரியர் புலவர்.
4,இரா.
5,இளங்குமரன் பதிப்பாளர் கோ.
6,இளவழகன் முதற்பதிப்பு மறுபதிப்பு தாள் . கி.
7,மேப்லித்தோ அளவு தெம்மி பக்கம் படிகள் விலை உரு.
8,"நூலாக்கம் பாவாணர் கணினி தியாகராயர் நகர், சென்னை ."
9,"அட்டை வடிவமைப்பு தமிழ்க்குமரன் அச்சு வெங்கடேசுவரா ஆப்செட் பிரிண்டர் இராயப்பேட்டை, சென்னை ."
10,கிறித்து பெருமான் சமய மீட்பர் காரல்மார்க்கசு பொருளியல் மீட்பர் மொழிமீட்பர் யானே என்னும் பெருமித மிக்கார் பாவாணர்.
11,இருபதாம் நூற்றாண்டைத் தம் ஆய்வு மதுகையால் தேவநேய ஊழி ஆக்கிய புகழும் வேண்டாப் புகழ் மாமணி தேவநேயப் பாவணர்.
12,"கோவலங் கண்ணனார் அவர்கள் தமிழ் விழா ஒன்றற்காகச் சென்னை வந்த போது யானும், முனைவர் கு."
13,தேவநேயர் படைப்புகள் அனைத்திலும் உள்ள சொல்லாய்வுகளைத் திரட்டி அகர நிரல் படுத்திப் பதின்மூன்று தொகுதிகள் ஆக்கினேன்.
14,இளவழகனாரிடம் ஒப்படைக்கப்பட்டு வெளியிடப்பட்டது.
15,"மொழி இன நாட்டுப் பற்றாளர் அனைவரிடமும் இருக்க வேண்டிய நூல், பல் பதிப்புகள் காண வேண்டும்."
16,வருங்கால இளைஞர்க்கு வழிகாட்டும் ஒளிவிளக்காகத் திகழ வேண்டும்.
17,அதற்குத் தூண்டலும் துலக்கலுமாக இருக்க வேண்டியவர்கள் தமிழ் மீட்டெடுப்புப் பற்றுமையரும் தொண்டரு மாவர்.
18,வெளியீட்டாளர்க்கும் பரப்புநர்க்கும் பெருநன்றியுடையேன்.
19,வாழிய நலனே!
20,இன்ப அன்புடன் வாழிய நிலனே!
21,இரா.
22,இளங்குமரன் பதிப்புரை ஆம் நூற்றாண்டில் தோன்றிய இணையற்றத் தமிழ்ப் பேரறிஞர் மொழிஞாயிறு தேவநேயப் பாவாணர்.
23,இவர் வடமொழி ஆதிக்கத்திலிருந்து தமிழை மீட்டெடுப்பதற்காகத் தம் வாழ்வின் முழுப் பொழுதையும் செலவிட்டவர்.
24,"இவர் எழுதிய நூல்கள், கட்டுரைகள் அனைத்தையும் தொகுத்து ஒரு சேர தமிழ்மண் பதிப்பகம் வெளியிட்டதைத் தமிழ் உலகம் அறியும்."
25,முதுமுனைவர் இரா.
26,இளங்குமரனார் பாவாணர் வழி நிலை அறிஞர்.
27,வாழும் தமிழுக்கு வளம் பல சேர்ப்பவர்.
28,பாவாணரின் அறிவுச் செல்வங்களை யெல்லாம் தேவநேயம் என்னும் தலைப்பில் தமிழ் உலகம் பயன்கொள்ளும் வகையில் தொகுத்துத் தந்துள்ளார்.
29,இத்தேவநேயத் தொகுப்புகள் தமிழர் களுக்குக் கிடைத்த வைரச்சுரங்கம்.
30,இத் தொகுப்புகளை வெளியிடுவதில் பெருமைப் படுகிறோம்.
31,"அறிஞருலகமும், ஆய்வுலகமும் இவ்வருந்தமிழ்க் கருவூலத்தை வாங்கிப் பயன் கொள்வீர்."
32,பதிப்பாளர் கோ.
33,வடசொல்லா?
34,"அப்பொருள் இடைவிடாது வேண்டியிருத்தலின், அது வரும் வழிகளும் நிலையானவையாயிருத்தல் வேண்டும்."
35,"அரசியல் வருவாய்கள் மூவேந்தர்க்கு மிருந்த பொருள் வருவாய்கள், வரி, இயற்கைச் செல்வம்."
36,"திறை, புதையல், பிறங்கடை வாரிசு இல்லாச் சொத்து, கையுறை, நன்கொடை என எழுதிறத்தன."
37,இயற்கைச் செல்வம் யானையும் முத்தும் பொன்னும் மணியும் போல்வன.
38,கையுறை குன்றக்குறவர் சேரன் செங்குட்டுவனுக்குக் கண்ணகியைப் பற்றிக் கூறினபோது கொடுத்த மலைப் பொருள்கள் போல்வன.
39,சிலப்.
40,.
41,தெய்வத்திருமுன் கையுறையோடு செல்வது போன்று அரசத்திருமுன்னும் செல்வது மரபு.
42,நன்கொடை கரிகால்வளவனுக்கு.
43,அவந்தி வேந்தன் உவந்தனன் கொடுத்த நிவந்தோங்கு மரபின் தோரண வாயில் சிலப்.
44,.
45,போல்வது.
46,பிற வெளிப்படை.
47,"சேரனுக்கு யானையும் பொன்னும் மணியும், சோழனுக்குப் பொன்னும் வயிரமும், பாண்டியனுக்கு யானையும், முத்தும், சிறந்த இயற்கைச் செல்வங்களாயிருந்தன."
48,கோடிபல வடுக்கிய பொருணுமக் குதவிய நீடுநிலை யரையத்து...................................................
49,புறம்.
50,"என்று கபிலர் பாடியிருப்பதால், கொங்குநாடு பொன்னுக்கும் மணிக்கும் சிறந்திருந்தமை அறியப்படும்."
51,கொங்குநாடு முற்காலத்திற் சேரனுக்கும் பிற்காலத்திற் சோழனுக்கும் உரியதாயிருந்தது.
52,"சோழநாட்டின் வடவெல்லைப் புறத்திலுள்ள கிருட்டிணை யாற்றங்கரை யிலும், அதன் கிளையான துங்கபத்திரைக் கரையி லும், வயிரச் சுரங்கங்கள் இருந்தன."
53,உலக ஒளிமணியான கோகி னூர் வயிரம் கிருட்டிணை யாற்றங் கரையில் எடுக்கப் பெற்றதே.
54,பாண்டிநாட்டில் வச்சிரநாடு எனப் பெயர்பெற்ற ஒரு கடற்கரை நாடு இருந்ததாகத் களவியற்காரிகை என்னும் நூல் கூறுகின்றது.
55,இறைவகை அரசியல் வருவாய்களுள் நிலையானதும் முதன்மை யானதும் குடிகள் செலுத்தும் வரியே.
56,"இனி, நன்னீர் புன்னீர் எனவும் வேறுபாடுண்டு."
57,"தொழில்வரி, உழவொழிந்த பிற தொழில்கட்கு வாங்கப்படுவது."
58,"விலங்குவரி, ஆடு பெற்றம் பசு எருது எருமை முதலிய விலங்குகட்கு வாங்கப்படுவது."
59,"உய்ப்பு வரி, நிலத்திலும் நீரிலும் பொருள்களை உய்த்தற்குச் செலுத்துவது."
60,அது ஆயம் உல்கு சுங்கம் என்னும் பெயர்களாற் குறிக்கப்பெறும்.
61,"மணவரி திருமணத்திற்கு விதிக்கப்படுவது, அது அரைக்கால் பணமாகும்."
62,"தண்டவரி, குற்றவாளிகட்குத் தண்டமாக விதிக்கப் படுவது."
63,"கொடைவரி, அரசன் அந்தணர்க்குச் செய்யும் பெருங் கொடைகட்குத் தண்டப்படுவது."
64,"ஊழியப்பேற்றுவரி, ஊரவை யார் பாடி காவலன் முதலியவரின் சம்பளத்திற்காகத் தண்டப்படு வது."
65,பாடி காவலன் சம்பளத்தை அவனே தண்டிக் கொள்ள உத்தரவிருந்தது.
66,"அவன் சம்பளம், நன்செய் விளைவில் மாவிற்கு ஒரு கலமும்."
67,அவற்றுக்கெல்லாம் வரி என்பது பொதுப்பெயராகும்.
68,ஊர்த்தலைவன் அல்லது ஊரவையார் விதிக்கும் வரி ஊரிடுவரிப்பாடு எனப்பட்டது.
69,வேறு வரி குறிப்பனபோல் தோன்றும் பல பெயர்கள் ஒரே வரி குறிப்பனவாகும்.
70,"இக்காலத்துத் தொழில் வரியெனப்படும் ஒன்றே, அக்காலத்துத் தொழில் தொறும் கருவிதொறும் வெவ்வேறு பெயர்பெற்று நூற்றுக்கணக்கான வரிபோல் தோன்றிற்று."
71,ஆள்வரி சோழ நாட்டில் முன்னியூர் தவிரப் பிறவூர்களில் கூனர் குறளரிடத்தும் வாங்கப்பட்டதாகத் தெரிகின்றது.
72,"வரிப் பாகுபாடு வரிகளெல்லாம், கீழிறைப்பாட்டம் சிறுவரி மேலிறைப் பாட்டம் பெருவரி என இருபாலாய்ப் பகுக்கப்பட் டிருந்தன."
73,", . சில வரிகள் காசாகவும், சில வரிகள் கூல தானியமாகவும், சில வரிகள் அவ்விரண்டிலொன்றாகவும், செலுத்தப்பட்டன."
74,"பெரும்பாலும் தொழில்வரிகள் பணமாகவும், நிலவரி இனமாக வும், செலுத்தப்பட்டன."
75,செக்கிறை தறியிறை கடைவரி முதலியன ஆண்டுக்கு ஆறு பணமாகும்.
76,"சந்தை அங்காடி தெரு திருவிழா முதலியவற்றில் பலவகைப் பொருள்கள் விற்கும் சில்லறைக் கடைகட்கு, நாள்வரி வாங்கப் பட்டது."
77,அரசனுக்குச் செலுத்த வேண்டியவை அரசிறையெனப்பட்டன.
78,"மேனாட்டுப் பொருளியல் நூற்படி, நேர்வரி நேரல்வரி ஆகிய இருவகை வரிகளும் அக்காலத்து வாங்கப் பட்டன."
79,"ஆள்வரி மணவரி முதலியன நேர் வரியும், விற்பனை வரி ஓடக் கூலி முதலியன நேரல் வரியும், ஆகும்."
80,நிலவரி வரிகளுட் சிறந்தது நிலவரி.
81,அதனால் அது சிறப்பாக இறை அல்லது அரசிறை எனப்படும்.
82,அதற்குச் செய்க்கடன் காணிக்கடன் என்னும் பெயர்கள் வழங்கின.
83,"வரிவிதித்தற்கு, விளைநிலம் விளையாநிலம் என இருபாலாக ஊர்நிலங்கள் பகுத்துக்கொள்ளப்பட்டன."
84,"இவற்றுள், விளையா நிலம், ஊர்ப்பொதுநிலமும் பட்டப்பாழ் என்னும் தரிசுமாக இருபகுதிப்பட்டது."
85,இவ்விரு பகுதியும் இறையிலி நிலமாயிருந் தன.
86,"விளைநிலம், நீர்நிலம், கொல்லை, காடு என மூவகையாக வகுக்கப் பட்டிருந்தது."
87,"இவை, முறையே, நன்செய்யும் இறைவைப் புன்செயும் வானாவாரிக் காடுமாகும்."
88,"நன்செய்கள், அவற்றின் விளை விற்குத் தக்கபடி பலதரமாகப் பாகுபாடு செய்யப் பட்டிருந்தன."
89,"நிலவரி, தீர்வை என்றும் வாரம் என்றும் இரு வகையாயிருந்தது."
90,"இவற்றுள் முன்னது ஒரு குறிப்பிட்ட அளவும், பின்னது கண்டு முதலில் ஒரு பகுதியுமாகும்."
91,"பெரும்பாலும், அளந்து கண்டுமுதல் காணக்கூடிய கூல வெள்ளாண்மைக்கு வாரமும், அங்ஙனஞ் செய்ய இயலாத பிறவற்றிற்குத் தீர்வையும், விதிக்கப்பட்டதாகத் தெரிகின்றது."
92,வாரம் பொதுவாய் ஆறிலொரு பங்காயிருந்தது.
93,"இது தொன்றுதொட்டு வந்தமுறையென்பது, தென்புலத்தார் தெய்வம் விருந்தொக்கல் தானென்றாங் கைம்புலத்தா றோம்பல் தலை என்னுங் குறளால் அறியப்படும்."
94,வாரம் ஆறிலொரு பகுதியா யிருந்த தினாலேயே அது பகுதியெனப் பெயர் பெற்றது.
95,வரி வாங்குவதற்குப் பொதுவாக நல்விளைவே கவனிக்கப்பட்டது.
96,"அழிவாவது, நன்றாய் விளைந்தும் கள்வராலும் பகைவ ராலும் விலங்காலும் அழியுண்டநிலை."
97,"நல்விளைவுக் காலத்தில், வரி கண்டிப்பாய் வாங்கப்பட்டது."
98,ஈராண்டாக வரி செலுத்தாதார் நிலமுழுதும் பறிமுதல் செய்யப் பட்டது.
99,பிசிராந்தையார் பாடிய காய்நெல் லறுத்து என்னும் புறப்பாட்டால் .
100,"நல்லரசர் காலத்திலும் கடுந்தண்டலாளர் இருந்து, குடிகளை வருத்தியமை அறியப்படும்."
101,"வரிப்பளுவைக் குடிகள் தாங்கமுடியாதபடி கடுவரி விதிக்கப்படுங் காலத்தில், குடிகள் முறையிடுவதும் அரசன் வரிவீதத்தை மாற்றி யமைப்பதும் உண்டு."
102,"வரிப்பளுவினாலோ பஞ்சத்தினாலோ ஓர் ஊர் முழுதும் குடிபோயின், அவ்வூருக்குரிய வரியை அவ்வூரைக் கொண்ட நாடு ஏற்றுக் கொள்ளும்."
103,"அவ்வூர், அண்மையிலுள்ள தெய்வத்திற்கு நாடு செழிக்கக் காணிக்கை செலுத்துமாறு, ஓரிரு செல்வரிடத்தில் ஒப்படைக்கப்படும்."
104,"இத்தகைய நிகழ்ச்சி, மாறவர்மன் குலசேகரன் ஆட்சியில், திருச்சிமாவட்டத்தைச் சேர்ந்த மருதூரில் நிகழ்ந்தது."
105,அன்று குடிகள் உள்ளதுரியதெல்லாம் விற்றுக்கொடுக்கநேரும்.
106,வரிதண்டும் இடத்திற்கு நிலைக்களம் என்றுபெயர்.
107,"தலைநகரல் லாத வூர்களிலும் நகர்களிலும், தண்டலாளரால் தண்டப்பட்ட காசுங்கூலமுமாகிய இருவகைப்பொருள்களும், முதலாவது, நாட்டுப்பண்டாரம் என்னும் ஊர்ப் பண்டாரத்திற் சேர்க்கப்படும்."
108,"நாட்டிலாயினும், தலை நகரிலாயினும், பண்டாரத்தை மேற்பார்ப்பவன் பண்டாரக் கண்காணி எனப்படுவன்."
109,"பொருள்களை அளப்பதற்கும் நிறுப்பதற்கும், பண்டார நாழி என்றும் பண்டாரக்கல் என்றும் அரசமுத்திரையிட்ட படியும் நிறைகல்லும் அங்கிருக்கும்."
110,களஞ்சியம் என்றும் கருவூலம் என்றும் பண்டாரம் இருபகுதியதாகும்.
111,முன்னதில் கூலமும் பின்னதில் காசும் சேர்க்கப்படும்.
112,களஞ்சியத்திற்குக் கொட்டாரம் கொட்ட காரம் என்றும் பெயருண்டு.
113,"ஆண்டுதோறும், ஊர்ப்பண்டாரத் தில் சேர்க்கப்பட்டுள்ளவற்றில் செலவுபோக எஞ்சியவெல்லாம், தலைநகரிலுள்ள மூலபண்டாரத்திற்கனுப்பப் பெறும்."
114,"நாட்டுப்புறத்தூர்களிலும் தலைநகரிலும் தண்டப்படும் வரிகட் கெல்லாம், தலைநகரிலுள்ள வரியதிகாரிகளால் வசதியாகக் கணக்கு வைக்கப்பட்டிருந்தது."
115,வரிப் பொத்தகம் வரியிலீடு என்னும் புத்தகப் பெயர்கள்.
116,அவற்றிற்குப் பொறுப்பான அதிகாரிகளையுங் குறிக்கும்.
117,"இயற்றலாவது, மேன்மேலும் பொருள்கள் வரும்வழிகளை அமைத்தல் ."
118,"பொருள்களாவன நெல், மருந்து, பருத்தி, பொன், மணி, கோழி, ஆடு, மாடு, குதிரை, யானை முதலியன."
119,அவைவரும் வழிகளாவன.
120,"பகைவரைக் கொள்ளை யடித்தலும் பிறநாடுகளைக் கைப்பற்றித் திறைகோடலும், தன் நாட்டையும் குடிகளையும் காத்தலும் முதலாயின."
121,"ஈட்டலாவது, அமைக்கப்பட்ட வருவாய்களினின்று வரும் பொருள்களை மூலபண்டாரத்திற் சேர்த்தல்."
122,"காத்தலாவது, அங்ஙனஞ் சேர்க்கப்பட்ட பொருள்களை, பகை வர் கள்வர் சுற்றத்தார் அரசியல்வினைஞர் ஆகியவர் கவராமற் காத்தல்."
123,"வகுத்தலாவது, அங்ஙனங் காக்கப்பட்ட பொருள்களை அறம் பொருளின் பங்களின் பொருட்டுச் செலவிடல்."
124,"கடவுள், அந்தணர், அடியார், வறியார், உறுப்பறையர்."
125,பெருநிலப் பகுதிகளும் சிறுநிலப் பகுதிகளும் தனித்தனி பெருஞ்சோலையும் சிறு சோலையுமாக இருந்தன.
126,இதனால் மண்ணுலகமும் அதன் கண்டங்களும் நாடுகளும் பொழில் என்னும் பொதுப் பெயர் பெற்றன.
127,பொழில் என்பது சோலை.
128,பொழிதல் திரளுதல் பொழித்தல் திரட்டுதல்.
129,மரங்களின் பொழிப்பு அல்லது தொகுப்பு பொழில்.
130,ஒரு பாட்டின் சொற்பொருளைத் தொகுத்துக் கூறும் உரையைப் பொழிப்புரை என்றல் காண்க.
131,"தோப்பு, தோட்டம் என்னும் ஒத்த பொருட் சொற்களும் இக்காரணம் பற்றியவையே."
132,அமையம் என்பது சந்தர்ப்பம்.
133,"செவ்வி என்பது, ஒருவனின் மனம் செவ்வையான அல்லது இசைவான நிலை."
