Line Number,Sentence
4396,"பாந்தம் குழி, பள்ளம், ஓட்டை என்னும் பொருள்களில் குமரி மாவட்ட வட்டார வழக்காகப் பாந்தம் என்னும் சொல் வழங்குகின்றது."
4397,"பாத்தி என்னும் பொருளில் நெல்லை, முகவை மாவட்ட வழக்குகளில் உள்ளது."
4398,பா என்னும் முதனிலை விரிவுப் பொருள் தருவது.
4399,"அகன்ற குழி, பள்ளம், பாத்தி என்பதை விளக்கும்."
4400,உரியதும் முறையானதுமாம் அன்பைப் பாந்தம் என்பது ம.வ.
4401,பெண்ணைப் பாந்தமாக நடத்து.
4402,பாம்பு படமெடுத்தாற் போலத் தோன்றும் கொடி பாந்தள் எனப்பட்டது.
4403,அதனை நெருங்கவோ தின்னவோ விலங்குகள் அஞ்சும்.
4404,வெண்கோட் டியானை விளிபடத் துழவும் அகல்வாய்ப் பாந்தள் படாஅர்ப் பகலும் அஞ்சும் பனிக்கடுஞ் சுரனே அகம்.
4405,பாந்தள் என்பதன் விளக்கம் அகல்வாய்ப் பாந்தள் என்பதில் புலப்படும்.
4406,பா என்பது பரவிச் செல்வம் ஓசை என்பது எண்ணத்தக்கது.
4407,படாஅர் படர்கொடி.
4408,பாம்பிஞ்சு பூம் பிஞ்சு என்பது பொது வழக்கு.
4409,பிஞ்சும் பூவும் இணைந்து நிற்கும் நிலை.
4410,வெள்ளரிப் பிஞ்சில் பூம்பிஞ்சை விரும்பியுண்பது வழக்கம்.
4411,பூம் பிஞ்சு என்பது செட்டி நாட்டு வழக்கில் பாம்பிஞ்சு எனப்படுகிறது.
4412,பாவுதல் என்பது ஒன்றி அல்லது பரவி இருத்தல்.
4413,பூவொடு ஒன்றி இருக்கும் பிஞ்சு பாம் பிஞ்சு எனப்பட்டிருக்கலாம்.
4414,பாம்பிஞ்சு மிகப் பிஞ்சு.
4415,பாம்பு பா பாம்பு விரிந்தகன்ற படத்தை யுடையது.
4416,பாந்தள் என்பதும் அது.
4417,"நஞ்சுடைமை தானறிந்து நாகம் கரந்துறையும் நாகம் நாகப்பாம்பு, நல்லபாம்பு."
4418,"பாம்பேறி கிணறுகளின் உள்ளே பாறை கண்ட அளவில், ஆள் நடமாட்டம் கொள்ளுமளவு இடம் விட்டுச் சுவர் எழுப்புவது வழக்கம்."
4419,அச் சுற்றுவெளிக்கு ஆளோடி என்பது பெயர்.
4420,இது கல்வெட்டுகளிலும் உண்டு.
4421,பழனி வட்டாரத்தார் ஆளோடி என்பதைப் பாம்பேறி என்கின்றனர்.
4422,"நெல்லை, முகவை மாவட்டங்களில் பாம்புரி என்பர்."
4423,பாம்பின் சட்டை அப் பகுதியில் கிடத்தல் கண்டு அப் பெயரீடு உண்டாகியதாம்.
4424,பாய்கால் தண்ணீர் பாய்கின்ற வாய்க்கால் தமிழகம் அறிந்தது.
4425,மடைவாய் வழிவந்த கால் ஆதலால் வாய்க்கால் எனப்பட்டது.
4426,அது நிலத்தில் நீர்பாய்வதற்குரிய காலாக இருப்பதால் பாய்கால் என வழங்கினர் யாழ்ப்பாணத் தமிழர்.
4427,பாய்ச்சல் நடக்காது பாய்ச்சல் நடக்காது சூழ்ச்சி நிறைவேறாது.
4428,ஆடு மாடுகளைப் பாய்ச்சல் காட்டி முட்டிக் கொள்ள விட்டு வேடிக்கை பார்ப்பது விளையாட்டுப் பிள்ளைகள் வேலை.
4429,விளையாட்டால் வினையாக்க நினைவார் வேலையுமாம்.
4430,பாய்ச்சல் காட்டலாம்.
4431,பாய்ச்சல் காட்டாமலே பாய்ச்சல் நடத்துவது பாச்சை.
4432,அதன் வாழ்வே பாய்ச்சல்.
4433,"இப் பாய்ச்சல் கேட்டை ஆக்குவதன்று, அப் பாய்ச்சலால் அங்கே முட்டு இல்லையே!"
4434,பார தூரம் பாரம் தாங்கிய நிலை.
4435,தூரம் தொடர்ச்சி நிலை.
4436,பாரதூரம் தெரியாதவன் என்பதொரு பழித்தொடர்.
4437,நம் குடும்பத்தை இதுவரை தாங்கி உதவியவர் யார் என்பதைத் தெரிந்திருந்தால் அதற்கு ஏற்றபடி நன்றியோடு இருக்கத் தோன்றும்.
4438,அவ்விரண்டும் அறியாதவனுக்கு என்ன தோன்றும் என்னும் வினாவில் பிறந்தது இப் பழித்தொடராம்.
4439,பாரம் தாங்குவார் தூரம் பழந்தொடர்பார்.
4440,பாரி உயிர்க்கு ஊதியமாவன ஈதலும் இசைபட வாழ்தலும் என்றார் பொய்யா மொழியார்.
4441,இம்மொழிக்கு ஏற்பச் சங்க நாளில் வாழ்ந்த பெருமக்களை எண்மர் என எண்ணிக் கணக்கிட்டனர்.
4442,அவருள் தலைமையாளன் பாரி.
4443,பாரியின் புகழ் முல்லைக்குத் தேர் ஈந்தது என்பதை நாடறியும்.
4444,"இப் பாரியொடும் சேர்த்து, இணைத்து எண்ணப் பெறுபவன் பேகன் அவன் மயிலுக்குப் போர்வை வழங்கிய வள்ளியோன்."
4445,ஏனை அறுவரினும் இவ்விருவர் புகழும் புலவர்களால் பெரிதும் போற்றப் பெறுதல் கண்கூடு.
4446,முல்லைக்குத் தேரும் மயிலுக்குப் போர்வையும் தொல்லை யளித்தாரைக் கேட்டறிதும் பழமொழி.
4447,புறப்.பொ.வெ.
4448,"எண்மருள் பாரியும், பேகனும் எடுத்தோதிச் சிறப்பிக்கப் பெறுவது ஏன்?"
4449,"என்றும், உடாஅ போரா ஆகுதல் அறிந்தும் படாஅ மஞ்ஞைக் கீந்த எங்கோ கடாஅ யானைக் கலிமான் பேகன் புறம்."
4450,என்றும் இவை புறப்பாடல்களால் பாராட்டப் பெறுகின்றன.
4451,இவற்றைப் பாடியவர்களோ முறையே கபிலபரணர் என்று சான்றோரால் சிறப்பிக்கப் பெறும் சீர்த்தியர்.
4452,பாரியின் சிறப்பு முல்லைக்குத் தேரளித்த அளவில் நின்றுவிடவில்லை.
4453,தனக்கு உரிமையாக இருந்த முந்நூறு ஊர்களையுமே முழுமையாகப் பரிசிலர்க்கு வாரி வழங்கி விட்டான்.
4454,அவன் வழங்காமல் வைத்திருந்தது பறம்பு மலை ஒன்று மட்டுமே!
4455,"அன்றியும், தன்னையும், தன் உயிரன்புப் புலவர் கபிலரையும் பிறர்க்கென வழங்கினான் அல்லன்."
4456,என்று பாடுவதால் அறியலாம்.
4457,பார் என்னும் சொல்லுடன் இ எனும் இறுதி நிலை இணைந்து பாரி என்னும் பெயர் அமைந்ததாம்.
4458,காரி ஓரி என்னும் பெயர்களும் இவ்வாறு அமைந்தனவே.
4459,பார் என்பது பரவுதல் பண்பால் அமைந்த பெயர்.
4460,"இனிப் பாரி என்னும் சொல்லும் பரவுதல் பண்பாலேயே கட்டில், கடல், உடற்பருமை, உடை, பூந்துகள், புவி ஆகியவற்றைக் குறிக்கும்."
4461,புகழ் பரப்பும் இல்லாளைப் பாரி என்பதும் இக் கரணியம் கொண்டேயாம்.
4462,புகழ்புரிந்த இல்லிலோர்க் கில்லை இகழ்வார்முன் ஏறுபோல் பீடு நடை என்பது திருக்குறள் .
4463,"பாரித்தல் என்பது விரித்துரைத்தல், பரப்புதல், வளர்த்தல், மிகுதல் முதலிய அகன்மைப் பொருளிலேயே வரும்."
4464,அங்கண் விசும்பின் அகல்நிலாப் பாரிக்கும் திங்கள் நாலடி.
4465,பகல்செல் மண்டிலம் பாரித்தாங்கு பெரும்.
4466,தந்நலம் பாரிப்பார் திருக்.
4467,பயனில பாரித் துரைக்கும் உரை திருக்.
4468,பாரிய பராரை வேம்பு நற்.
4469,என்பவற்றை நோக்குக.
4470,"இவற்றை நோக்குவார், பாரி என்னும் பெயர்ப் பொருளின் நயம் நன்கறிந்து மகிழ்வர்."
4471,தேர் வீசிருக்கை நெடியோன் புறம்.
4472,நெடுமாப் பாரி புறம்.
4473,மலர்ந்த மார்பின் மாவண் பாரி பதிற்.
4474,இலங்கு தொடித் தடக்கைப் பாரி புறம்.
4475,பரந்தோங்கு சிறப்பிற் பாரி புறம்.
4476,என வருவன தெளிவித்தல் அறிக!
4477,"பரந்து விரிந்த உலகினும், பரந்து விரிந்தது புகழ் என்பதை மண் தேய்த்த புகழ் என்னும் இளங்கோவடிகள் வாக்காலும் சிலப்."
4478,என்று கபிலர் குறிப்பதால் அறிக!
4479,அம் முறைமையைப் போற்றி முத்தமிழ் வளர்க்க!
4480,பாரிய பரிய பாரிய.
4481,"பாரிய போர்க்கருவி விற்றனர் அதன்பொருள் ஈட்டல் பற்றி எண்ணினரே அன்றி, உயிரழிவுக்கு உரியதெனச் சற்றும் எண்ணினாரல்லர் ம.வ."
4482,பரியது கூர்ங்கோட்டது திருக்.
4483,"தமிழகத்தில் இலக்கிய வழக்காக இருக்கும் பாரிய என்னும் சொல், ஈழத்தில் பொதுமக்கள் வழக்காகவும் ஊடகங்களின் வழக்காகவும் பயில வழங்குகின்றது."
4484,பார்ப்பான் இப்பெயர் குடிப்பெயராக இந்நாள் வழங்குகின்றது.
4485,ஆனால் நூல் ஓதுவார்க்குரிய பொதுப்பெயர் என்பதைத் திருவள்ளுவர் அருள்கின்றார்.
4486,ஓதும் கடமையை மேற் கொண்டவன் பார்ப்பான்.
4487,அவன் ஓதுதலை மறந்தாலும் மீண்டும் ஓதிக் கண்டு கொள்ளலாம்.
4488,"ஆனால், ஒழுக்கம் தவறிவிட்டானே ஆனால் அவன் ஓதும் தொழிலுக்கே இழிவாகும் என்கிறார்."
4489,பொச்சாப்புப் பார்ப்பார் திருக்.
4490,"என்பதில் வந்துள்ள பார்ப்பார் என்ன பொருளைத் தருமோ, அதே பொருளையே பார்ப்பான் என்பதும் திருக்."
4491,தரும்.
4492,"கணியம் சோதிடம் பார்த்தல், ஏடு பார்த்தல், குறி பார்த்தல் என்னும் வழக்குகளை அறிக."
4493,தம்போற் பிறரைத் தாம்பார்ப் பாரே பார்ப்பார் என்பார் சிவஞான யோகிகள் தமிழக ஒழுகு.
4494,பார்ப்பும் பறழும்...
4495,...
4496,...
4497,இளமைப் பெயரே தொல்.
4498,அது மக்கள் இளமையின் பெண்பாற் பெயராய்ப் பார்ப்பு பாப்பு பாப்பா என வழங்கலாயிற்று.
4499,பாப்பா என்னும் பெயர் கொண்டாரும் உளர்.
4500,ஓடி விளையாடு பாப்பா நீ ஓய்ந்திருக்கலாகாது பாப்பா எனும் பாரதியாரின் பாடல் பாப்பாப் பாட்டு எனவே வழங்கலாயிற்று.
4501,பாலம் பால் அம் பாலம்.
4502,"பால் பக்கம் மேல்பால், கீழ்பால் தென்பால், வடபால்."
4503,"அப்பாலையும் அப் பக்கத்தையும், இப்பாலையும் இப் பக்கத்தையும் இணைப்பது பாலம்."
4504,இடத்தை இணைக்கும் இப் பாலம் போல இருவரை இணைத்து வைப்பதும் பாலமாம்.
4505,எங்களுக்குள் தகராறும் பகையும் வழக்குமாக இருந்ததை இவர் பாலமாக இருந்து தீர்த்து வைத்தார் என்பது ம.வ.
4506,"பாலம், பாலக்கரை, பாலப்பட்டி என ஊர்ப்பெயர்களும் ஆயின."
4507,பாலர் பால் அர் பாலர் பால்பருகும் பருவத்தர்.
4508,"இளம்பாலர், பாலர் இளம்பாலர் பள்ளி, பாலர் பள்ளி இளம்பாலர் வகுப்பு, பாலர் வகுப்பு இளம்பாலாசிரியர், பாலாசிரியர்."
4509,இவையெல்லாம் கழகக்கால ஆட்சிகள்.
4510,மதுரை இளம்பாலாசிரியர் சேந்தங் கூத்தனார் பழம்புலவர் பெயர்.
4511,"பாலன், பாலகுமரன், பாலு இக்காலப் பெயர்கள்."
4512,பாலாடை பாலின்மேல் படியும் ஆடையைப் பாலாடை என்பது பொது வழக்கு.
4513,பாலாடை என்பது சங்கு என்னும் பொருளில் கும்பகோண வட்டார வழக்கு உள்ளது.
4514,பாலடை என்பது பாலாடை எனப்பட்டிருக்கலாம்.
4515,குழந்தைக்குப் பால் விட்டுப் புகட்டும் ஊட்டும் சங்கு.
4516,ங்கு என மக்களால் வழங்கப்பட்டது.
4517,"சங்கை, ஊட்டி என்பதும் வழக்கு."
4518,ஊட்டி என்பது கண்டம் என்னும் கழுத்துறுப்புமாம்.
4519,பாலாடை போலும் நூலாடை நெய்தவர் பழந்தமிழர் என்பார் திரு.வி.க.
4520,பாலிகை பால் பாலி பாலிகை வெள்ளை வெளேர் என்னும் பயிர் முளை.
4521,பால் வெண்மை.
4522,"முளைப்பாலிகை என்னும் அது, முளைப்பாரி என மக்களால் வழங்கப்படுகிறது."
4523,"பாலிகை, இலக்கிய ஆட்சி."
4524,நிழலிலேயே சட்டி கலயம் பானைகளில் விதையைப் பாவி பரவி வளர விடுவதால் அதன் இயல் கருதி முளைப்பாலிகை எனப்பட்டது.
4525,பாலிகை கோயில் விழாவுக்கும் மங்கல விழாவுக்கும் ஊரவர் பலரும் ஓரிடத்தில் தனித்தனியே வளர்த்து வருவதாகும்.
4526,பாலிதம் பால் இதம் பாலிதம் பாளிதம்.
4527,பால்விட்டுக் காய்ச்சி இனிப்பும் மணப்பொருளும் கலந்து ஆக்கப்பட்ட பால் பொங்கல் அல்லது பாற்சோறு பாலிதம்.
4528,இதமாவது இனிமை.
4529,அது லகரம் ளகரமாகத் திரிந்து வழக்கில் ஊன்றிவிட்டது.
4530,அதன் பழவடிவு பாலிதமாம்.
4531,உரைகாரரும் நூலாசிரியரும் மக்களும் பாளிதத்தையே கொள்வாராயினர்.
4532,பாலூற்றல் பாலூற்றல் இறுதிக் கடன் செய்தல்.
4533,இறந்தார்க்கு எரியூட்டிய பின்னரோ புதைத்த பின்னரோ மறுநாள் செய்யும் கடன்களில் ஒன்று பாலூற்றல் என்பதாம்.
4534,உயிர் ஊசலாடும் போதும் பாலூற்றல் உண்டு.
4535,பால் இறங்குகிறதா இல்லையா என்று பார்த்து உயிர் நிலை அறியும் வழிப்பட்டதாம்.
4536,"இறுதிக்கடன் பால் தெளிப்பு, இறந்தவர் உயிர் அமைதி யுறுக என்பதன் அடையாளமாகலாம்."
4537,"பால் மங்கலப் பொருளாகவும், தெய்வப் பொருளாகவும் தூய்மைப் பொருளாக வும் கொள்ளப்படுவதை வழக்குகளால் அறியலாம்."
4538,"பாலூற்று, பாலாறு, பால்குடம் என்பவை பெயரீடுகள்."
4539,"பாலை பாலை பாலை, நாருடைய பட்டையைக் கொண்டது."
4540,பட்டை உரித்த மரக்கொம்பு வெண்மையானது.
4541,பூக்களும் வெண்மையானவை.
4542,கொடிறு போன்ற காயை உடையது.
4543,கொடிறு பற்றுக்குறடு.
4544,காய் நெற்றாகி ஒலி செய்வது.
4545,"பால் நிறக்கொம்பு, பால் நிறப்பூ உடையது பாலை ஆயிற்று."
4546,வெள்பாலை வெட்பாலை தந்தப் பாலை என்பனவும் பாலையின் பெயர்.
4547,பாலை நின்ற பாலை நெடுவழி சிறுபாண்.
4548,அப் பாலைப் பிரிவு ஒழுக்கப் பிரிவுக்கும் பெயராயிற்று.
4549,பால் என்பது ஒரு முழுமையைப் பகுத்து வைக்கப்பட்ட பகுப்பு.
4550,இப்பால் உப்பால் அப்பால் எனச் சுட்டியது நூலை அறத்துப்பால் பொருட்பால் காமத்துப்பால் எனப் பகுத்தது.
4551,"இருவேறு உலகத்து இயற்கையாம் ஊழைப் பால், பால் அல்ல எனப் பிரித்தது திருக்."
4552,"பாலை பாடுதலில் வல்லார் பாலை பாடிய பெருங்கடுங்கோ, இளங்கடுங்கோ என்பார்."
4553,அகநானூற்றில் செம்பாதி பாலைப் பாடல் பாடல்.
4554,பால் பகல் பால்.
4555,"நாள், இரவு பகல் என இருபிரிவுடையது."
4556,"பகல், நாளில் ஒரு பிரிவு பகுதி பக்கம் ஆயமையால் பலபொருள் தருவதாயிற்று."
4557,"ஆண்பால், பெண்பால், பலர்பால், ஒன்றன்பால், பலவின்பால்."
4558,திருக்குறள் முப்பால்.
4559,அப்பால் அப் பக்கம் இப்பால் இப் பக்கம்.
4560,பால் வெண்மை பால்நிலா வெண்ணிலா.
4561,பால்நுரை.
4562,சுவை.
4563,பால்மொழி பான்மொழி இனிய மொழி.
4564,பாலொடு தேன்கலந் தற்றே என்பது திருக்குறள் .
4565,பால்மரம் பால்மரம் ஆலமரம்.
4566,"கால்மரம், பழமரம் பழமைமரம், முதுமரம் முதலனவும் ஆலமரமேயாம்."
