Line Number,Sentence
547,இங்குச் சொல்லப்பட்ட கற்பொழுக்கம் ஒன்பது வகையினுள்ளும் வெளிப்படைநிலை பத்தொன்பது வகைப் பட்ட கிளவியாம்.,False
548,அவை வருமாறு .,False
549,இச்சூத்திரம் நான்கும் என்னுதலிற்றோவெனின் முன் சொன்ன வெளிப்படை நிலை பத்தொன்பது வகைப்பட்ட கிளவியாம் என்றார்.,False
550,அவை யறிவித்தலைக் கருதிற்று.,False
551,"வரைவு மறுத்தலும், பரிசமொடு வருதலும், வரைவு மலிவுரைத்தலும், வரைவுடன் படுத்தலும், முரசினுக்கிரங்கலும், முரசு வினாதலும் எனப்படும் என்றவாறு.",False
552,"வெளிப்படை எனினும், அறத்தொடு நிலை எனினும் அமையும்.",False
553,"அவற்றுள், பூத்தரு புணர்ச்சி என்பது என்மகட்க இவ் வேறுபாடு எற்றினான் ஆயிற்று என்ற செவிலிக்கு அறத்தொடு சொல்லுதல்.",False
554,கயஞ்சால் மறுசுழி யழுந்தின மாக முயங்கினள் எழுந்த அண்ணலை வயங்கிணர்க் கோதை மறவலள் பெரிதே பொருளியல் .,False
555,கட்டுவிக் கேட்டல் என்பது தலைமகள் மெலிவுகண்ட செவிலி இவளுற்ற நோயைத் தெரிய வறிந்து சொல்லுமின் எனக் கட்டுவித்தியிடம் கேட்டல்.,False
556,வெறியெடுத்தல் என்பது கட்டுவிக் கேட்ட செவிலித் தாய் வெறியெடுப்பித்தல்.,False
557,வெறியினுக்கு அழிதல் என்பது செவிலித்தாய் வெறியெடுப்பக் கண்டு ஆற்றாமல் தன்னுள் தலைமகள் சொல்லுதல்.,False
558,அறிவுக் கிளத்தல் என்பது நாண்துறந்தும் வெறிவிலக்கு விப்பன் எனத் தலைமகள் தோழியைக் கொண்டு வெறிவிலக்கு விக்க நினைத்தல்.,False
559,தலைமகள் அறத்தொடு நிற்றல் என்பது யாய்க்கு அறிவிக்க வேண்டுந் தோழிக்குத் தலைமகள் அறத்தொடு நிற்றல்.,False
560,தோழி வாழி மேனா ளொருவ னாழ்கய மருங்கி னழுந்தத் தாழ்பெருந் தடக்கையின் வாங்கினன் தகைத்தே பொருளியல் .,False
561,வெறிவிலக்கு என்பது இவ்வகை சொல்லக் கேட்ட தோழி வெறி விலக்குதல்.,False
562,தண்ணென் சாயலிவ ளுண்ணோய் தணிய எண்ணினை கொடுத்தி யாயின் அண்ணல் ஆகமு முண்ணுமோ பலியே பொருளியல் .,False
563,முருகற் குரைத்தல் என்பது இவ்வகைப்பட்ட வெறியை விலக்கி வைத்து முருகற்கு உரைப்பாளாய் அயலார் கேட்பச் சொல்லுதல்.,False
564,பேதை வாழிய முருகே யாவது மேதில னென்பதை யுணர்ந்து வாராநோய் தணிய வருத லானே பொருளியல் ? .,False
565,செவிலி அறத்தொடு நிற்றல் என்பது தோழி அறத்தொடு நிற்றல் கேட்ட செவிலி நற்றாய்க்குக் கூறுதல்.,False
566,முளையெயிறு நிரம்பா இளமைப் பருவத் தொளிதிகழ் ஒருவன் நீட்டிய தழையவிழ் கண்ணி தாங்கின ளுவந்தே பொருளியல் .,False
567,"நற்றாய் தன் ஐயன்மார்க்கு அறத்தொடு நிற்றல் என்பது செவிலி அறத்தொடு நிற்ப, நற்றாய் தந்தை முதலாயினார்க்குக் கூறுதல்.",False
568,வரைவு மறுத்தல் என்பது தலைவியின் சுற்றத்தார் தலைவற்கு வரைவு மறுத்து உரைத்தல்.,False
569,பரிசமொடு வருதல் என்பது தலைமகள் தமர் வேண்டியபடி நிதியுடன் தலைமகன் தமர் வருதல்.,False
570,வரைவு மலிவுரைத்தல் என்பது தோழி தமர் வரைவு எதிர்ந்தமை தலைமகட்கு உரைத்தல்.,False
571,வரைவுடன் படுத்தல் என்பது தலைமகனது மேம்பாடுந் தலைமகளது சிறப்புடைமையுந் தோழி யுணர்த்தல்.,False
572,முரசு வினாதல் என்பது இவ்வகை சொல்லக்கேட்ட தோழி தந்தை முதலாயினார் கேட்கச் சொல்லுதல்.,False
573,என்னுமிலக்கணத்துட் கண்டுகொள்க.,False
574,வெளிப்படைநிலை முடிந்தது .,False
575,வரைபொருட் கேகல் கிளவித்தொகை ரு.,False
576,"இச்சூத்திரம் என்னுதலிற்றோ வெனின், வரைபொருட் ககறல் மூன்று வகைப்பட்ட கிளவியாம் என்ப தறிவித்தலைக் கருதிற்று.",False
577,"இயற்பழித்தல், இயற்படமொழிதல், தணப்பிடரொழித்தல் என.",False
578,இயற்பட மொழிதல் என்பது இவ்வகை சொல்லி யியற்பழித்த தோழிக்குத் தலைமகள் இயற்பட மொழிதல்.,False
579,தணப்பிடர் ஒழித்தல் என்பது ஒருவழித் தணத்தற்கு ஆற்றாளாகிய தலைமகளைத் தோழி ஆற்றுவித்தல்.,False
580,என்னுஞ் சூத்திரத்துட் கண்டுகொள்க.,False
581,வரைபொருட் கேகல் முடிந்தது .,False
582,உடனிலைச் செலவு கிளவித்தொகை ருக.,False
583,இச்சூத்திரங்கள் என்னுதலிற்றோவெனின் உடனிலைச் செலவு இத்துணைக் கிளவியாம் என்ப தறிவித்தலைக் கருதிற்று.,False
584,அவற்றுட் கையடை என்பது உடன்போக விரைந்த பின்றைத் தலைமகளைக் காட்டிக் கொடுத்துத் தோழி தலை மகனுக்கு ஒம்படை சொல்லுதல்.,False
585,சுரத்துய்த்தல் என்பது தலைமகளை வழியில் மெல்லெனத் தலைவன் கொண்டு செல்லுதல்.,False
586,மெல்ல மெல்லநின் நல்லடி யாற்றி வருந்தா தேகுமதி மடவோய் யிருந்தண் பொழிலயாஞ் செல்லு மாறே பொருளியல் .,False
587,விருந்து விலக்க என்பது புணர்ந்துடன் போக்கின்கண் இடைச் சுரத்துக் கண்டார் தலைமகனை விலக்குதல்.,False
588,பதியளவுரைத்தல் என்பது இவ்வகைச் சொல்லி விருந்து விலக்கிய இடைச்சுரத்தார் தலைமகள் ஊரளவு சொல்லுதல்.,False
589,தோழியை வினாதல் என்பது தலைமகளை ஆடிடத்துக் காணாத செவிலித்தாய் வருந்திச் சொல்லுதல்.,False
590,வலியை மன்ற நீயே பொலிவளை காதற் றோழி கையகன் றொழியவும் பேதுற லிலையால் உயிரொடும் புணர்ந்தே பொருளியல் .,False
591,செவிலி இரங்கல் என்பது தலைவியின் உடன்போக்கைத் தோழியின் வழியாக அறிந்து கொண்ட செவிலி தலைவியின் கற்பு நிலைக்கு வருந்தியுரைத்தல்.,False
592,மென்மை கூறல் என்பது தலைவியின் மெல்லியற் றன்மையைக் கூறிச் சுரஞ் சென்றமைக்குச் செவிலி வருந்துதல்.,False
593,நற்றாய்க் குரைத்தல் என்பது மென்மை நினைந்திரங்கிய செவிலி தலைவி உடன்போனமை ஆற்றாது நற்றாய்க்கு உரைத்தல்.,False
594,நற்றாய் இரங்கல் என்பது செவிலி வழியாகத் தலைவி உடன் போக்கறிந்த நற்றாய் வருந்தி யுரைத்தல்.,False
595,சூன்முதிர் கொண்மூ மின்னுபு பொழியக் கானங் கடுமை நீங்குக மானுண் கண்ணி போகிய சுரனே பொருளியல் .,False
596,கருமகட் குரைத்தல் என்பது செஞ்சுடர்ப் பரவிய நற்றாய் இளம்பருவம் நீங்காத் தலைவியை நினைந்து வருந்தியுரைத்தல்.,False
597,பின்செல வலித்தல் என்பது தலைமகளின் இளமை நினைந்து வருந்திய தாய்க்கு நீ கவன்று மெலிய வேண்டா.,False
598,யான் அவள் புக்க விடம் புக்குத் தேடுவேன் எனச் செவிலி பின் செல்லுதல்.,False
599,சுரத்து இரங்கல் என்பது தலைமகள் சென்ற சுரத்திற் கண்ட பொருள்களுடன் வருந்திக் கூறுதல்.,False
600,காய்ந்திலை மறவை மன்னோ வேந்திழை அழல்கெழு வெஞ்சுரஞ் செலவும் எழில்கெழு பாவை ஏந்திய குரவே பொருளியல் .,False
601,புறவொடுரைத்தல் என்பது தலைவியைத் தேடிச் செல்லும் செவிலி ஆங்குக் கண்ட புறாவினிடம் ஆற்றாமை உரைத்தல்.,False
602,சுரத்திறம் வினாதல் என்பது சுரத்தின்கண் வருவாரிடம் வினாவுதல்.,False
603,சேர்விட முரைத்தல் என்பது கண்டோரிடை வினாவிய செவிலிக்குத் தலைவன் தலைவியர் போய்ச் சேர்ந்த இடத்தை அவர் உரைத்தல்.,False
604,செவிலியை ஆற்றல் என்பது வழியிடைக் கண்டோர் ஆற்றாது செல்லும் செவிலியை ஆற்றுதல்.,False
605,மடவரல் மாதர்க்கு வருந்தா தீமோ கடல்வயிறு பயந்த நித்திலம் உடையோர்க் காதல் உலகியல் வழக்கே பொருளியல் .,False
606,துடரகந் தணித்தல் என்பது ஆற்றவும் ஆற்றாது நின்ற செவிலியைத் தலைவன் தலைவியர் சேரிடம் உரைத்து மீட்டுக் கொண்டு போதல்.,False
607,வளங்கெழு கானம் வருகுவ ரின்றென விளம்புமின் விரைந்தனிர் செலினே உளங்கெழு காதல் உயிரன் னோர்க்கே பொருளியல் .,False
608,கிளையது மகிழ்ச்சி என்பது தலைமகள் பெயர்ந்து வருதலை முன்னர் அறிந்த கிளைகள் அடைந்த மகிழ்ச்சியைச் சொல்லுதல்.,False
609,முதுவாய் வேல மொழிந்திசின் எமக்கே மதுவார் கூந்தல் மடந்தையைக் கதிர்வே லண்ணல் கருதிய திறனே பொருளியல்.,False
610,ஈன்றாட் புகழ்தல் என்பது ஈன்றதாயின் பேரன்புத்திறங் கூறிச் செவிலி புகழ்தல்.,False
611,மணங் கண்டுரைத்தல் என்பது தலைவன் தன்மனைக் கண் வரைந்து கொண்டான் என்பதறிந்து நற்றாய் கூறுதல்.,False
612,கற்புநிலை விளம்பல் என்பது தலைமகள் கடிமனை சென்று மீண்ட செவிலி அவர்கள் கற்பு நிலையை நற்றாய்க்குக் கூறுதல்.,False
613,மகள்நிலை கூறல் என்பது இருவர் கற்பு நிலையையுங் கூறிய செவிலி தலைமகள் வாழ்வுநிலையை உரைத்தல்.,False
614,"அகத்திணை , , , .",False
615,அரையர் கோவை .,False
616,"இறையனார் அகப்பொருள் , , , , , , , , , , ,.",False
617,"இன்னிசை மாலை , .",False
618,"ஐங்குறுநூறு , , , , , , , , , , , , .",False
619,ஐந்திணை .,False
620,ஐந்திணை எழுபது .,False
621,"கண்டனலங்காரம் , , , , , , , , , , , .",False
622,கலித்தொகை .,False
623,காரிகைச் செய்யுள் .,False
624,"கிளவிமாலை , , , .",False
625,"கிளவி விளக்கம் , .",False
626,"கோயில் அந்தாதி , , , .",False
627,"சிலப்பதிகாரம் , , , , , .",False
628,"சிற்றெட்டகம் , , , , , , .",False
629,"திணைமாலை நூற்றைம்பது , , , .",False
630,திணைமொழி .,False
631,"திருக்குறள் , , .",False
632,திருவிடைமருதூர் மும்மணிக்கோவை .,False
633,தில்லை அந்தாதி .,False
634,திவாகரம் .,False
635,"தொல்காப்பியம் , , , , , , , , , , , , .",False
636,நந்திக் கலம்பகம் .,False
637,நறையூர் அந்தாதி .,False
638,"நெடுந்தொகை , , , , , .",False
639,"பல்சந்தமாலை , , , , , , , .",False
640,மழவை எழுபது .,False
641,"வங்கர் கோவை , , .",False
642,"வெண்பாமாலை புறப்பொருள் வெண்பாமாலை , , , , , , .",False
643,மேற்கோள் நூற்குறிப்பு .,False
644,அகத்திணை அகப்பொருள் பற்றிக் கூறும் நூல்களுள் இஃதொன்று.,False
645,இதன் மூன்று பாடல்கள் களவியற் காரிகையில் மேற்கோளாக ஆளப்பெற்றுள.,False
646,அவற்றுள் நெடுவேல் துடக்கிய என்னும் பாடல் நம்பியகப் பொருளிலும் மேற்கோளாக ஆளப் பெற்றுள்ளது.,False
647,தொல்காப்பியத்தில் அகப்பொருள் பற்றிய பொது இலக்கணங்களைக் கூறும் அகத்திணை இயலுள்ளது.,False
648,அவ்வகப் பொருளை விரித்தும் சுருக்கியும் செய்யப்பெற்ற நூல் அகத் திணைபோலும்.,False
649,ஒவ்வொரு பொருள் பற்றியும் தனித்தனி நூல் யாத்தல் வேண்டும் என்னும் காட்டத்தால் பல நூல்கள் தோன்றின.,False
650,அவற்றுள் அகத்திணையும் ஒன்றாகலாம்.,False
651,களவியற் காரிகையால் அகத்திணையில் இருந்து அறிந்து கொண்ட பாடல்கள் மூன்றும் வெண்பாக்களாக இருத்தலால் வெண்பாவால் அமைந்த நூலாகலாம்.,False
652,அவ்வகையில் எழுந்த நூல் புறப்பொருள் வெண்பாமாலை யாதல் அறிக.,False
653,"இனி, அகத்திணை என்னும் இலக்கண நூலுக்கு மேற்கோளாக ஆளப்பெற்ற இலக்கிய வெண்பாக்களாகவும் இவை இருத்தல் கூடும்.",False
654,அரையர் கோவை களவியற் காரிகையால் அறியப்பெறும் கோவை நூல்களுள் அரையர் கோவை என்பதுவும் ஒன்று.,False
655,இக் கோவையில் இருந்து வரவுணர்ந்துரைத்தல் என்னும் கிளவிக்கு மேற்கோளாகக் கட்டளைக் கலித்துறைப் பாடல் ஒன்றைக் காட்டியுள்ளார்.,False
656,இப் பாடலில் தயாபரன் என்றோர் அரசன் குறிக்கப் பெறுகின்றான்.,False
657,அவனுக்குரியதாகத் தஞ்சை குறிக்கப் பெறுகின்றது.,False
658,தஞ்சை வாணன் கோவையின் பாட்டுடைத் தலைவனாகிய வாணனின் பாண்டி நாட்டுத் தஞ்சாக்கூர் இப் பாடலால் குறிக்கப்பெறுகின்றதா?,False
659,சோணாட்டுத் தஞ்சை குறிக்கப் பெறுகின்றதா?,False
660,என்பது அறியக்கூடவில்லை.,False
661,அரையர் என்பது அரசர் என்பதாம்.,False
662,முத்தரையர் என்பார் வள்ளல்களாய்த் திகழ்ந்தனர் என்பதை நாலடியார் நவில் கின்றது.,False
663,அரையர் என ஒரு குடியினர் இருந்தனர்போலும்.,False
664,அவருள் வந்து ஆட்சிபுரிந்து ஒருவனைப் பாட்டுடைத் தலைவனாகக் கொண்டெழுந்த நூல் அரையர் கோவை யாதல் வேண்டும்.,False
665,இன்னிசை மாலை அகப்பொருள் பற்றி வெண்பா யாப்பில் அமைந்த ஒரு நூல் இவ்வின்னிசை மாலையாகும்.,False
666,குறிஞ்சி நாட்டு வேந்தன் ஒருவனைப் பாட்டுடைத் தலைவனாகக் கொண்டு எழுந்த நூல் இது.,False
667,"இந் நூலில் இருந்து கழறல், இடம் வினாதல் என்னும் இரண்டு துறைகட்கும் இரண்டு வெண்பாக்கள் காட்டப் பெற்றுள.",False
668,", அவற்றுள் இரண்டாம் பாடல் சிதை வடைந்துள்ளது.",False
669,இஃது இசைத்தமிழ் பற்றிய நூலோ என்ற ஐயம் உண்டாகும்.,False
670,ஆனால் இஃது இசைத்தமிழ் நூல் அன்று.,False
671,அகப்பொருள் கூறும் நூல்.,False
672,இன்னிசை என்பதற்கு ஈண்டு இனிய புகழ் என்று பொருள் கொள்ள வேண்டும்.,False
673,"கொடை, வீரம் முதலியவற்றில் இசைபெற்ற ஒருவன்மீது அகப்பொருள் துறைகள் அமையப் பாடப்பெற்ற நூல் இது என்பது தெரிகிறது.",False
674,செட்டியார்களின் புகழைக் கூறும் நூல் ஒன்று இருந்தது.,False
675,அதனை இயற்றியவர் செயங்கொண்டார் என்னும் புலவர்.,False
676,செட்டிமார்களின் புகழைக் கூறும் அந் நூலுக்கு இசையாயிரம் என்று பெயர் சூட்டப்பட்டது.,False
677,அதுபோன்ற இன்னிசை மாலை என்னும் நூலும் ஒருவருடைய புகழைக் கூறுவதாக இருத்தல் வேண்டும் என்று அறிஞர் மயிலை சீனி.,False
678,வேங்கடசாமி அவர்கள் கூறுகிறார்கள்.,False
679,"மறைந்துபோன தமிழ் நூல்கள் இனி, இன்னிசை என்பது வெண்பா யாப்பினுள் ஒன்று என்பது எவரும் அறிந்ததே.",False
680,இன்னிசை வெண்பா யாப்பான் அமைந்த நூல் இன்னிசை மாலையெனப் பெயர் பெற்றது என்றுமாம்.,False
