Line Number,Sentence
1671,தினை விதைப்பவன் தினை அறுப்பான் என்பது பழமொழி!
1672,அருளாளனுக்குத் துன்பம் என்பது இல்லை!
1673,எதனால்?
1674,ஊரார் பிள்ளையை ஊட்டி வளர்த்தால் தன் பிள்ளை தானே வளரும்!
1675,ஏன்?
1676,அருளாளன் பிள்ளை ஊரார் அனைவரின் உள்ளன்புக்கும் உரித்தாகிப் போகிவிடுகின்றது அல்லவா!
1677,ஒருவன் கவனிப்புச் சிறக்குமா?
1678,ஊராரின் ஒத்த கவனிப்புச் சிறக்குமா?
1679,"தமக்கு அழிவு நேரினும், அருளாளனுக்கு அழிவு ஏற்படக்கூடாது என அமைந்து காத்து வாழவே செய்யும்."
1680,அருள் என்பது யாது?
1681,அன்பு என்னும் அருமைத்தாய் பெற்றெடுத்த பிள்ளையே அருள்.
1682,தொடர்பு உடையவர்களிடத்து ஏற்படும் நேயம் அன்பு!
1683,தொடர்பில்லாத உயிரிடத்தும் ஏற்படும் நேயம் அருள்!
1684,"உற்றார் நோய்வாய்ப்பட, இறப்பு வாய்ப்பட அலமருகிறோம்இஃது அன்பு!"
1685,"அதே பாரி, ஆடி அசைந்து பற்றிப் படரக் கொழு கொம்பில்லாத முல்லைக் கொடிக்குத் தேரளித்தது அருள்!"
1686,அரிசில்கிழார் முதலாம் பெருமக்களைப் பேகன் ஆதரித்தது அன்புத் தொண்டு.
1687,எனை அடுத்தார் சுகம் வாய்ந்திடல் வேண்டும் என்பது அன்பு வாக்கு.
1688,ஆருயிர்கட் கெல்லாம் அன்பு செயல் வேண்டும் என்பது அன்பின் முதிர் நிலையாம் அருள்வாக்கு.
1689,இப்பொழுது அன்புக்கும் அருளுக்கும் உள்ள வேற்றுமை புலனாகும்.
1690,அருளாளருக்குத் துன்பம் இல்லையா?
1691,கிரேக்கப் பெரியார் மெய்யுணர்வுப் பேரறிஞர் சாக்ரடீசு போலும் அருளாளர் உலகில் உளரா?
1692,அவர் இறக்கு மாறு நஞ்சு தரவில்லையா?
1693,ஆட்சிப் பொறுப்பு உடையவர்களும் சமய மன்றில் தலைநின்றவர்களும் என்ன பாடுபடுத்தினர்?
1694,ஆகையால் அருளாளருக்குத் துன்பமில்லை என்பது எப்படி உண்மையாம்?
1695,எனலாம்!
1696,ஆம் கேட்க வேண்டிய கேள்விகள் தாம்.
1697,கருத்தினை மாற்றிக்கொண்டால் சரி இல்லையேல் கொடுநஞ்சு கொடுக்கப்படும் என்று நீதிமன்றம் கூறியபோது சாக்ரடீசு அஞ்சினாரா?
1698,இன்ன நாள் உமக்கு நஞ்சு தருவோம் என்று திங்கட் கணக்குக்குமுன் முடிவு செய்து அச்சுறுத்தியும் அதனைப் பொருட்டாக எண்ணினாரா?
1699,"நஞ்சைக் குவளையில் கொண்டுவந்து தந்த பொழுதும், குடித்தபொழுதும் சிறு அளவிலேனும் சோர்ந்தாரா?"
1700,இல்லையே!
1701,அஞ்சியவர் இது செய்வாரா?
1702,சாச்ரடீசை அச்சுறுத்தித் தலைகால் தெரியாமல் ஆடியவர்களே இவரது அஞ்சாமை கண்டு தோல்விப் படுகுழியில் வீழ்ந்து விடவில்லையா?
1703,துன்பத்தில் இருந்து தங்களைக் காத்துக் கொள்ளவே எல்லா உயிர்களும் விரும்புகின்றன.
1704,"தீ, மேல்நோக்கி எழும்புவது போல, நீர், கீழ்நோக்கி ஓடுவதுபோல இஃது உயிரின் இயற்கை."
1705,"மாந்தன் மற்றை உயிர்களைத் துன்புறுத்தாததுடன், அவற்றை அருளுடன் நோக்கவும் காக்கவும் முனைந்துவிட்டால் போர் உண்டா?"
1706,போட்டி உண்டா?
1707,தாக்குதல் உண்டா?
1708,தவிப்பு உண்டா?
1709,எவையும் இல்லை!
1710,இவ் வுண்மையை வள்ளுவர் ஆய்ந்து எழுதினார்.
1711,புத்தர் உணர்ந்து நடந்தார் காந்தியடிகள் இவ்வுணர்விலே ஊன்றினார்.
1712,இந்த ஒன்றையே உயிர்க் கொள்கையாகக் கொண்டு உலகில் நிலைத்தார்.
1713,ஆம்!
1714,வள்ளுவர் கண்ட அருட்கொள்கையே துன்புறுத்தாக் கொள்கையே அண்ணல் காந்தி மூச்சு ஆயிற்று!
1715,அவர் பெற்ற வெற்றியனைத்தும் அருள் வெற்றியே!
1716,தனக்கென்றே வாழ்வது கீழ்மை!
1717,தனக்கும் பிறருக்கும் என வாழ்வது பொதுநிலை!
1718,பிறருக்கு பிறவுயிர்களுக்கு எனவே வாழ்வது பெருமை!
1719,பெருமைக் குரியவற்றைப் பேணுபவர் பெரியர்!
1720,"மன்னுயிர் ஓம்பி அருளாள்வார்க் கில்லென்ப தன்னுயிர் அஞ்சும் வினை, ."
1721,படைகொண்டார் நெஞ்சு பாலை நிலக் கொடுமையைப் பகர வேண்டியது இல்லை.
1722,காடும் மலையும் வளங்குன்றி வறண்டு பயனற்றுப் பாறையும் பொடியும் ஆகிக் காணப்பெறுவது பாலை.
1723,நிழலைக் காண்பதற்கே அரிதான அந் நிலத்தில் நீரைக் காண்டற்கு இயலுமா?
1724,நீரும் நிழலும் இல்லா நிலம்போல ஈரமும் இணக்கமும் இல்லா நெஞ்சமும் பாலைக்கு இயல்பு போலும்!
1725,பாலை நிலமக்கள் மட்டும் அல்லர்!
1726,கையிலே எத்தகைய படைக் கருவிகளைக் கொண்டிருப்பவர்களுக்கும் இரக்கமின்மை படிப்படியாகப் படிந்து விடும் போலும்!
1727,"இரக்கமற்று மரத்துப்போன உள்ளத்திற்கும், விலங்குக்கும் என்ன வேற்றுமை?"
1728,தான் வாழ எந்த ஒரு கொடுமை புரிதற்கும் அஞ்சாது விலங்கு விலங்குணர்வு!
1729,அந்நிலைமைக்கு ஆட்பட்ட ஆறறிவு உள்ளமும் விலங்கு உள்ளமேயாம்!
1730,கீழான சொற்களைச் சொல்லிச் சொல்லித் திரிபவனுக்குத் தான் சொல்வது கீழ்மைச்சொல் என்பது தெரியாது.
1731,"அது பழக்கமாகி விடுகின்றது சொல்லின் பொருள் இன்னது, அதன் விளைவு இன்னது என்பது அறியாமலே போய்விடுகின்றது."
1732,ஓருணர் வுடையனவாய் அமைந்து விடுமாமே!
1733,பன்றியொடு சேர்ந்த கன்றும் மலந்தின்னும் என்னும் பழமொழி எதை உறுதி செய்கின்றது?
1734,தீய பழக்கத்தின் கொடுமையைக் காட்டும் கலங்கரை விளக்கம் ஆகின்றது.
1735,இப்படித்தான் படைகொண்டவர் செய்யும் கொடுமை உள்ளது படை கொண்டவரைச் சேர்ந்தவர் செய்யும் கொடுமையும் உள்ளது.
1736,தன்னை வடிவாகக் கொண்டு இறைவன் மனிதனைப் படைத்தான்.
1737,தன் ஆற்றலில் ஒரு கூறினை மனிதனிடம் வைத்தான்.
1738,அத்தகைய மனிதன் என்ன நினைக்கவேண்டும்?
1739,ஒருநாள் கடவுளாகவே இருப்பேன் என்று நினைப்பானேல் கீழ்மைப் பண்பில் உழல இடமில்லை.
1740,இதனைத் தடுப்பது எது?
1741,மனிதனிடம் உயர்ந்த இயல்பு படிந்து கிடப்பது உண்மை.
1742,எழில்மிகு மலையை மூடுபனி மறைத்து விடுவது இல்லையா?
1743,மூடுபனி அகலவேண்டும் அவ்வளவு தான்!
1744,மலையை மறைக்கும் மூடுபனிபோல் மனிதனை மறைக்கும் மூடுபனிகள் பலப்பல!
1745,"அவற்றுள் ஒன்று கொடுமையின் வடிவாய் நின்று, தன்னைக் கொண்டிருப்பவனையும் கொடியவன் ஆக்கி வைக்கும் கொலைக்கருவி!"
1746,அமைதியாளனையும் அருளாளனையும் வெறியாளனாகத் தூண்டிவிடும் கொலைமது!
1747,இரும்பு இருந்தவன் கை சும்மா இராது என்பது பழமொழி!
1748,கொல்லிரும்பு வைத்திருப்பவன் கை சும்மா இருக்குமா?
1749,உணர்ச்சி ஓய்ந்து கிடக்குமா?
1750,உள்ளம் அமைந்து கிடக்குமா?
1751,கொலைக்கருவி கொண்டிருப்பவன் கொடியவன் அவனுக்கு இணையான கொடியவன் இல்லையா?
1752,உண்டு!
1753,அவன் கொலைக் கருவியைப் பயன்படுத்துதற்குப் பயிற்சிக் களமாக இருந்த ஒன்று உண்டு!
1754,அதுவே ஊன்கடை!
1755,"ஊனைத் தருவோனும் சரி, அதனைப் பெறுவோனும் சரி!"
1756,இரக்கம் இல்லாதவர்களே!
1757,ஏன் கொல்லுபவர் ஒருவர் கொலைக்குத் துணை நிற்பவர் ஒருவர்!
1758,ஏன் கொல்லுகிறார் உயிர்களை?
1759,"வாங்குவோர் இருக்கும் காரணத்தால், அவர்கள் தலையில் கட்டி ஊதியம் தேட வாய்ப்பு இருக்கும் காரணத்தால் கொலை நடக்கிறது!"
1760,இக் கொலையைக் கொடுமையானது என்று எவரேனும் முற்கூறிய இருவருள் எவரேனும் கருது கின்றனரா?
1761,மற்றவர்கள்?
1762,"சுவையான ஊன் உண்ண நினைபவர் பிறிதோர் உயிரின் துடிப்பை, துயரை, இறப்பை எண்ணுவது இல்லை."
1763,ஏன்?
1764,தன்னலம் நாடும் நெஞ்சம் அவர்க்கு உடமையாகின்றது பிறர் நலம் நாடும் நெஞ்சம் ஒழிகின்றது.
1765,தன் உடல் பருக்க விரும்புகின்றான் அவ்விருப்பு பிறவுடலைத் தின்ன ஏவுகின்றது.
1766,இப்படிப் பட்ட கொலைக் கொடுமை படிந்துவிட்ட உள்ளத்திலே அன்பு நிலைக்க முடியாது அருள் அரும்ப முடியாது.
1767,அறம் தளிர்க்க முடியாது.
1768,அன்பும் அருளும் அறமும் முகிழ்த்து எழாத நெஞ்சில் நல்ல எண்ணம் எழும்புதல் கூடுமோ?
1769,புள்ளிமான் துள்ளி ஓடித் தப்புதற்குத்தான் நினைகின்றது.
1770,ஓடி ஓடி ஒளிகின்றது அஞ்சி அஞ்சி நடக்கின்றது என்றாலும் புலி அதற்காகப் பரிவு காட்டுகின்றதா?
1771,கொல்லுவதைப் பற்றிச் சிறிய அளவில் கூட நடுக்கம் ஏற்படுவது அதற்கு இல்லை.
1772,அதுபோலவே தன் உணவுக்குப் பிறிதொன்றன் உடலைத் தின்னத் தொடங்கியவன் உள்ளத்திற்கும் அதன் துடிப்புப் பற்றிக் கவலையற்றுப் போகின்றது.
1773,ஒன்றைக் கொல்லுதற்குப்போகும் ஒருவன் தன் நெஞ்சத்து ஒரு நொடிப் பொழுது எண்ணவேண்டும்.
1774,இவ்வாறு எண்ணும் நெஞ்சம் அமைந்துவிட்டால் பெரும்பாலான கொலைகள் ஒழியும்.
1775,சமயங்களும் கூறுகின்றன.
1776,இஃது இயற்கை அல்லா நெறியாம்.
1777,"இவ்வாறு கொலை பற்றியும், கொன்றுதின்பது பற்றியும் ஆன்றோர்கள் கடிந்து உரைப்பது ஏன்?"
1778,தீயவற்றில் நிலைத்த நெஞ்சம் நல்லவற்றை நினையாது என்பதனாலேயாம்.
1779,இக் கோட்பாட்டில் அழுத்தமாக நின்ற பெருந்தகை வள்ளுவர்!
1780,"தொல் பழமைக் காலந்தொட்டு, இக்காலம் வரை வாழ்ந்துள்ள பெருமக்களுள் வள்ளுவருக்கு இணையாகப் புலாலுண்ணலையும், கொலைபுரிதலையும் கடிந்து கூறியவர் இவர்!"
1781,"அவர் நெஞ்சினின்று முகிழ்ந்த அனைத்துக் கருத்துக்களிலும் அருளும் அறமும் பின்னிப் பிணையாமலோ, மின்னி மிளிராமலோ இல்லை!"
1782,இவ் விரண்டையும் புலமைத் துலைக்கோலின் இணைத் தட்டுகளாகக் கொண்டே வாழ்வியலாம் வாணிகம் புரிகின்றார் வள்ளுவர்.
1783,அப்பெருந்தகையின் வாணிகப் பெருஞ்சந்தையில் கிடைக்கும் நற்பொருள்களைத் தேடிப் பெற்றுக்கொண்டால் ஒழிய வாழ்வுக்குப்பேறு இல்லை!
1784,பேறு பயக்கும் உயர்பண்டம் ஒன்று வருமாறு!
1785,படைகொண்டார் நெஞ்சம்போல் நன்றூக்காது ஒன்றன் உடல்சுவை யுண்டார் மனம்.
1786,.
1787,புகழ்மிக்க தவம் காந்தியடிகள் உலகில் தோன்றினார் கதர்த்துணிக்கு ஒரு பெருமை ஏற்பட்டது.
1788,மற்றைத்துணிகளிலும் கதர்த்துணிக்கு ஏன் பெருமை ஏற்பட்டது.
1789,"மற்றைத் துணிகள் நூல்மதிப்பால், நெசவின் தரத்தால், சாயச் சிறப்பால் மதிக்கப்படுகின்றன."
1790,ஆனால் கதர் இவற்றுடன் நில்லாமல் வேறு பலவற்றால் மதிக்கப்படுகின்றது.
1791,"புகழ் மல்கிய கோவில் கருவறைச் சிலைக்கும், பொருட் காட்சிச்சாலைக்கும் எத்துணை வேறுபாடு?"
1792,அத்துணை வேறுபாடு உண்டாக்கிவிட்டது கதர்த் துணிக்கும் மற்றைத் துணிகளுக்கும்.
1793,"காந்தியடிகளின் தொண்டன், உரிமைக்கட்சிக்கு உழுவலன்பன் என்பதைக்காட்டும் புறக்கோலமாக அமைந்து விட்டது கதர்!"
1794,துணியால் அமைந்த சிறப்பு அன்று!
1795,துணியால் எனின் காந்தியடிகள் கதரை வளர்க்கு முன்னரே தனிப்பெருமை இருந்திருக்கவேண்டும்!
1796,அஃதில்லை.
1797,கதர்த்துணியின் உள்ளின் உள்ளாக ஒளிந்து கிடந்துஆனால் பளிச்செனத்தோன்றிஒளிவிடும் உணர்வால் ஏற்பட்ட சிறப்பு.
1798,இதுபோலவே ஒரு காலத்தே காவித்துணிக்குத் தமிழகத்தில் தனிப்பெருமை ஏற்பட்டது.
1799,என்கடன் பணிசெய்து கிடப்பதே என்னும் நிலைக்குத் தம்மை ஆட்படுத்திக் கொண்டவர் காவியுடுத்தனர்.
1800,தின்ன வரும் புலிதன்னையும் அன்பொடு நோக்கும் அருளாளர் காவியுடுத்தனர்.
1801,புகை நடுவினில் தீ இருப்பது போல் பகை நடுவிலும் இறைவன் உள்ளான் எனக் கருதிய ஆன்றோர்கள் காவியுடுத்தனர்.
1802,"பிறவுயிர்கள் ஈடேறுதற்குக் கல்வியறிவும், மெய்யுணர்வும் தருவதும், தொண்டு புரிவதும் இவர்கள் கடப்பாடுகளாக இருந்தன."
1803,"ஆகலின் இத்தகையரே அருளாளர் என்றும், அறவோர் என்றும், துறவிகள் என்றும், தவத்தோர் என்றும் பெரும்பேறு பெற்றனர்."
1804,"இவர்கள் சிறப்பு, இவர்களால் உடுத்தப்பெற்ற காவியுடைக்கும் ஏறியது ஏன்?"
1805,"காந்தியடிகள் மேல் தேய்த்துக் குளிக்கப் பயன்படுத்திய கருங்கல், வைரத்தினும் மதிக்கப்பெற்று, கலைக்காட்சியாகவும், திகழ்கின்றது அல்லவா!"
1806,"துறவி என்பதும், துறவி அல்லன் என்பதும் அவன் உள்ளுணர்வைப் பொறுத்த நிலை!"
1807,என்றாலும் புறத் தோற்றங்களால் வெளிப்படுத்துக் காட்டும் தன்மை நாட்டில் ஏற்பட்டுவிட்டது.
1808,"முக்கோல் கொண்டிருத்தலும், கமண்டலம் வைத்திருத்தலும் துறவிக்கு உரியன ஆயின."
1809,சடை வளர்த்தலும் மழுக்க வழித்தலும் வழக்கமாயின மரவுரியுடுத்துதலும் காவி யுடுத்துதலும் நிலைத்துவிட்டன.
1810,இவை போல் பலப்பல புற கோலங்களும் தலையெடுத்தன.
1811,இவற்றைக் கொண்டிருப்பது ஒன்றே துறவு தவம் என்று கருதும் குழுவும் இரண்டாயிரம் ஆண்டுகளுக்கு முன்னமே கிளைத்துவிட்டது.
1812,"நெற்பயிர் தோன்றிய நாளிலேயே, புற்களையும் தோன்றியிருக்கக்கூடும் அல்லவா!"
1813,"உள்ளத்தே தவத்தன்மை கொண்டிருப்பான் ஒருவன், புறத்தேயும் அதனைக்காட்டுமாறு ஏதேனும் கோலம் கொள்வன் ஆயின் குற்றமில்லை."
1814,பசுத்தோல் போர்த்த புலி என்று உவமை காட்டிக் கூறலாம்.
1815,இத்தகைய தவக் கோலம் கேடு செய்வதேயாம்.
