Line Number,Sentence
572,"இவ்வேதுக்களானே களவியற் பொருள் கண்டார் நக்கீரனாரல்லர் எனக் கொள்வாமெனின், அது பொருந்தாது."
573,அவரே என்று அடிப்பட்ட சான்றோர் வழக்குள்ளது.
574,"சிலப்பதிகாரத்து வேனிற் காதை முதற்கண், கணக்காயனார் மகனார் நக்கீரனாருரைத்த இறையனார் பொருளுரை என்று அடியார்க்குநல்லார் கூறினார்."
575,"திணைமயக்குறுதலும் என்னும் அகத்திணையியற் சூத்திரவுரையில், இக்கருத்தானே நக்கீரரும் ஐந்திணையுள்ளுங் களவு நிகழுமென்று கொண்டவாறுணர்க. என்று நச்சினார்க்கினியர் கூறினர்."
576,களவியலுரைப்பாயிரமே இவ்வுரை கண்டார் நக்கீரரே என வற்புறுத்துக் கூறுகிறது.
577,"இவ்வுரையியற்றினார் பிறரொருவராயின், அவர், நக்கீரரியற்றினர் எனக் கூறுதற்குக் காரணந்தான் என்னை?"
578,"காரணமின்றியே கூறினார் என்னினும், நாம் முன்பு காட்டிய தடைகளை அவர் உணர்ந்திலராவரோ?"
579,அவர் அத்துணை எளியரல்லர்.
580,"இன்னணம் பின்னுளோரொருவர் எழுதிய காரணத்தால் முன்னையுரை சிறுபான்மை குறைந்தும், திரிந்து மிருத்த லியல்பே."
581,"இது நிற்க, இவ்வுரையெழுதினார் முசிறியாசிரியர் நீலகண்டனார் எனச் சிலரும், இளம்பூரணவடிகள் எனச் சிலரும் துணிந்தனர்."
582,தக்க ஆதார மின்றியே அங்ஙனம் துணிதல் ஏதமாகும்.
583,"இவ்வுரைதானே, தொல்காப்பியத்தை இடைச் சங்கத்தார்க்கும் கடைச்சங்கத்தார்க்கும் நூல் என்று கூறுகிறது."
584,தொல்காப்பியச் சூத்திரங்களைப் பலவிடத்தும் எடுத்தாளுகிறது.
585,அகத்தியம் முதலாயினவும் அக்காலத்து இருந்தனவாகும்.
586,"பொருட்பயிற்சி குன்றிய காரணத்தால், தொன்னூல்களில் பரந்துபட்டுக் கிடக்கும் பொருளிலக் கணங்களை வழுவின்றித் தொகுத்துரைக்க வல்லார் அரியராயினர் என்பதே கருத்தாகும்."
587,பொருளுளும் அகப்பொருளே விரிந்த தாகலின் அதனைத் தொகுத்துணர்த்துதல் இன்றியமையா தாயிற்று.
588,இறையனார் களவியலும் அகப்பொருளுணர்ச்சிக்குக் கட்டளை மாத்திரமாக இயற்றப்பெற்றதென்க.
589,"அக்காலத்தும், அதற்கு முற்பட்ட காலத்தும் தமிழில் எழுத்து வழக்கம் உண்டென்பதற்குப் பல சான்றுகள் உள்ளன."
590,எழுத்துத் தொழில் பற்றி எழுத்தாளன் என்று பெயருற்றாரும் உளர் எனினும் ஆசிரியர் பாற்கேட்டு நூல் பயிலுதலே மரபாம் என்க.
591,"இரண்டாஞ் சூத்திரவுரை மிக்க நுட்பமுடைய தாய், கற்றார்க்குக் கழிபேருவகை பயக்குஞ் சிறப்பினதாய் நிலவுகின்றது."
592,"அஃது, உலகத்தில் எம்மொழியினுமுள்ள சிறந்த உரைகளுடன் ஒட்டி முன்னிற்கும் ஒட்பம் உடையது எனலாம்."
593,"இவ்வுரை, ஐந்து தலையுடைய நாகத்தை ஐந்தலை நாகமும் என்ப ஐந்து தலை நாகமும் என்ப இருமுடிபுடைத்து என்னை?"
594,"குற்றியலுகரப் புணரியலுள், முதனிலை ."
595,நிலனும் நீரும் காலமும் வித்துமென இவற்றினது கூட்டத்தினாய முளையை நென்முளை யென்ப.
596,இவ்வுரையில் இடத்துக்கேற்பப் பல அழகிய உவமைகள் காட்டப்பட்டுள.
597,அவற்றுட் சில வருமாறு .
598,ஆவிற்கு இருகோடுபோல .
599,புனலோடுவழிப் புற்சாய்ந் தாற்போல .
600,வேலேறுபடத் தேளேறு மாய்ந்தாற்போல .
601,கண்ணாடி மண்டிலத்து ஊது ஆவி போல .
602,சந்தனமும் காஞ்சிரையும் மரமெனப்பட்டது போல .
603,நாண்வழிக் காசுபோல .
604,நீர்வழி மிதவை போல .
605,பள்ளத்துவழி வெள்ளம் போல .
606,குன்ற முருண்டாற் குன்றி வழியடை யாகாவாறுபோல .
607,கடல்வெதும்பின் வளாவு நீரில்லதுபோல என்பன.
608,"இஃது, உலகத்தார் மனோபாவங்களையும் ஏற்புழிக் கூறிச் செல்கின்றது."
609,பின்வருமாறு காண்க.
610,"ஆசிரியர் தொல்காப்பியனார், முதனூல், வழிநூல் என நூல் இருவகைப்படுமென்று கொண்டு அவற்றுக் கிலக்கணங் கூறினார்."
611,"பின்வந்த நூலசிரியர், சிலர் அவற்றொடு சார்புநூல் என்பதொன்று கொண்டு நூல் மூன்று என்றனர்."
612,"தமிழ் நான்குவகைப்படும் எழுத்தும், சொல்லும், பொருளும், யாப்பும் என என்பது இவ்வுரை."
613,"தொல்காப்பியம் எழுத்து, சொல், பொருள் என மூன்று அதிகாரமாக வகுக்கப்பட்டது."
614,யாப்பு ஓர் அதிகாரமாகக் கொள்ளப்பட்டிலது.
615,"பின்னுளோர் அணியையுங் கூட்டி, இலக்கணம் ஐந்து என்பா ராயினார்."
616,"அணியிலக்கணம் என ஒன்று கோடல் அமையாதென்று, நிரனிறுத்தமைத்த என்னும் உவமவியற் சூத்திரவுரையில் பரக்கக் கூறப்பட்டுள்ளது."
617,"இவ்வுரையில் மாலை, யாமம், வைகறை, எற்பாடு, நண்பகல் எனச் சிறுபொழுது ஐந்து கூறப்பட்டன."
618,"சிவஞான முனிவர், சிறுபொழுது ஐந்தேயாமெனச் சாதித்து, எற்பாட்டினை ஞாயிறு தோன்றுங்காலை என்று சூத்திர விருத்தியுட்கூறினர்."
619,"பசுப்போல்வாளைப் பசுவென்றலும், பாவைபோல் வாளைப் பாவையென்றலும் உவமந்தொகுத்தவாறு என இவ்வுரை கூறாநிற்கும்."
620,சேனாவரையர் முதலாயினாரெல்லாம் பாவை முதலாயின ஆகுபெயரெனக் கொண்டனர்.
621,"யாப்பு என்பது தொகுத்தல் முதலிய நூல்யாப்பு என்றும் கேட்போர், என்பது நூலரங்கேறும் அவைக்களத்துக் கேட்டோ ரென்றும் இவ்வுரை கூறிற்று."
622,பின் வந்த உரையாளர்களும் அவ்வாறே கூறினர்.
623,சிவஞான முனிவர் அக்கொள்கையை மறுத்து வேறு பொருள் கூறினர்.
624,"என்மனார் என்னுஞ் சொன்முடிபுபற்றி இவ்வுரை கூறுவதும், சேனாவரையர் முதலியோர் கூறுவதும் மாறு பாடுடையன."
625,"அகப்பொருள் நாற்பத்து மூன்றாஞ் சூத்திரத்து, மூன்றுநாள் சொற்கேட்கும் வழி யுறைதலும், ஒன்பது நாள் கூடியுறைதலும் கூறுகின்றது."
626,நீராடியபின் னீரறுநாளும் என்று அகப்பொருள் விளக்கம் கூறுகின்றது.
627,அதனை யடுத்த சூத்திரம் பொருள்கோளின்றியும் பாட்டு வருமெனக் கூறுகின்றது.
628,"நிரனிறை, சுண்ணம், அடிமறி, மொழிமாற்று என நான்கு பொருள்கோள் கூறினர் தொல்காப்பியனார்."
629,இது மொழி மாற்றுப் பொருள்கோளன்றிப் புலவர் வேறுசெய்வதோர் செய்கை என்று கூறிப் பின்னும் விரித்துரைத்தார் நச்சினார்க்கினியர்.
630,நன்னூலார் முதலாயினார் பொருள்கோள் எட்டுக்கூறினர்.
631,ஒன்பது பொருள் கோள் கூறினாருமுளர்.
632,இங்ஙனம் வரும் உரை விகற்பமெல்லாம் ஆராய்ந்தறிக.
633,"இவ்வுரையில், மதுரை ஆவணியவிட்டம், உறையூர்ப்பங்குனி யுத்திரம், கருவூர் உள்ளிவிழா என்பன பெரிய திருவிழாக்களாகக் கூறப்பட்டுள."
634,பல அரிய நூற் பெயர்களும் புலவர் பெயர்களும் இதிற் காணப்படுகின்றன.
635,நக்கீரர் இயற்றிய பாட்டுக்களின் ஆராய்ச்சி .
636,"திருமுருகாற்றுப்படை இது, கடைச்சங்கப்புலவர் தொகுத்த பத்துப்பாட்டுள் முதலாவதாக வுள்ளது."
637,பதினோராந்திருமுறைத் தொகுப்பிலும் இது சேர்ந்துளது.
638,பத்துப் பாட்டுத் தொகுத்தார் சங்கப் புலவரென்பது நச்சினார்க்கினியர் கருத்து.
639,"இது மலைபடு கடாத்தில் தீயினன்ன என்பதற்கு ஆளவந்தபிள்ளை யாசிரியர் குற்றங் கூறினரெனச் சொல்லி, அவரை மறுத்துரைக்கும் உரையால் விளங்குகிறது."
640,"எனினும், பத்துப்பாட்டு, ஏனைத் தொகை நூல்கள்போன்று ஓர் தொகையாக வழங்கப் படவில்லை."
641,திருமுருகாற்றுப்படை பாடிய வரலாறு புராணங் கூறுவதனை முன்பு கூறியுள்ளாம்.
642,பிறவாறு அறிவாரும் அறிக.
643,முருகாற்றுப்படை என்னுந் தொடர் முருகனிடத்து ஆற்றுப் படுத்ததென விரியும்.
644,பத்துப்பாட்டுள் ஐந்து பாட்டுக்கள் ஆற்றுப்படையாகவுள்ளன.
645,ஏனை ஆற்றுப்படை யெல்லாம் மக்களிடத்து ஆற்றுப்படுப்பன.
646,பரிசில் பெறற் குரியாரைக் கிளந்தெடுத்து பொருநராற்றுப்படை முதலிய பெயரானே வழங்குவன.
647,இஃதொன்றும் கடவுள்பால் ஆற்றுப் படுவது.
648,பரிசிலளித்தற் குரியார் பெயர் கிளந்து முருகாற்றுப் படை என ஏழாம் வேற்றுமையாகவும் திரு என்னும் அடை புணர்த்தும் வழங்குவது.
649,இதற்குப் பொருளாயினார் நித்தராகலின் இதன் முக்கியப் பொருளொடு எக்காலத் தெவ் வெவர்க்கும் இயைபுண்டு.
650,இன்ன பல சிறப்பு நோக்கியே இது முதலாவதாக வைக்கப்பட்டுளது.
651,முந்நூற்றுப் பதினேழு அடிகளையுடைய இப்பாட்டு ஆறு பிரிவினதாக அமைந்துளது.
652,"இதன்கண் வரையுறையும் சூரரமகளிர் விளையாட்டும், பேய்மகள் துணங்கையாடலும் வருணிக்கப்பட்டுள."
653,சாம்பூநதம் என்னும் பொன் நாவலொடு பெயரிய பொலம் எனக் கூறப் பட்டுளது.
654,வரிப்புனை பந்து என முதனிலை வினையெச்சப் பொருளிள் வந்துளது.
655,அரசர்கள் பகைவரை மகளிராக்கி அவர்கொண்டு விளையாடுதற் குறிப்பாகத் தம் கொடிக்கருகே பந்தும் பாவையும் தூங்கவிடுதலாகிய வழக்கம் கூறப்பட்டுளது.
656,அறுவேறு வகையி னஞ்சு வர மண்டி.......
657,"மாமுதல் தடிந்த என்புழி, முருகக்கடவுளின் றிருவவதாரம் முதலியபற்றிக் கந்தபுராணத்தின் வேறுபடக் கூறுவர் நச்சினார்க்கினியர்."
658,அவர் கூற்றுக்கு ஆதாரமாகவுள்ளது பாயிரும் பனிக்கடல் என்னும் பரி பாடற் பாட்டாகும்.
659,இரண்டாம்பிரிவு முருகக்கடவுளானவர் யானையேறிப் பல்லியமியம்பத் திருச்செந்தூருக்கு ஆகாயவழியாக எழுந்தருளு தலும் அவருக்கு நிலைபெற்ற குணம் என்று கூறுகிறது.
660,ஒரு முகம் .
661,"வள்ளியொடு நகையமர்ந்தன்று என்னு மிடத்து, காமநுகர்ச்சியில்லாத இறைவன் இங்ஙனம் நகைய மர்ந்தான் உலகில் இல்வாழ்க்கை நடத்தற்கென்றுணர்க."
662,தன்னை யுன்னி யென்னையாக்கிய போழ்தே யானவனாயினேன் என்பதனா னுணர்க. என்ற வுரையும் சிந்திக்கற்பாலன.
663,அலைவாய் என்பது நாமனூரலைவாயென்னும் திருப்பதி யென்பர் உரைகாரர்.
664,நாமனூர் என ஒன்று பாண்டிநாட்டிலுள்ள தாகப் பழைய திருவிளையாடல் கூறுகிறது.
665,திருச்செந்திலுக்கு நாமனூர் என்பதும் ஒரு பெயர்போலும்?
666,திருவாவினன் குடி பழனித்திருப்பதி பொதினிமலை முற்காலத்து ஆவி குடியினர் ஆண்டமையால் ஆவினன்குடி எனப்பட்டது.
667,சித்தன் வாழ்வு என்றும் இதற்கொரு பெயருண்டு போலும்?
668,பிள்ளையார் அயனைச் சபித்த வரலாறாக உரைகாரர் எழுதியிருப்பது கருதத்தக்கது.
669,முனிவரியல்பு இதில் நன்கு கூறப்பட்டுளது.
670,ஏரகம் மலைநாட்டகத்தொரு திருப்பதி என்பர் நச்சினார்க்கினியர்.
671,பிற்காலத்துப் பெரியார் பலரும் ஏரகம் சுவாமிமலை என்று கொண்டே பாடியுள்ளார்கள்.
672,இதில் மலைவாழ் கானவர் தொண்டகப் பறைமுழக்கிக் குரவையாடுதல் கூறப் பட்டுளது.
673,இதிலுள்ள குன்றுதோறாடல் என்னுந் தொடரை ஓர் திருப்பதியின் பெயராகக் கொண்டார் பலர்.
674,அஃது ஓர் பதியின் பெயரன்று.
675,மலைதோறுஞ் சென்று விளையாடுதல் என்பதே அதற்குப் பொருளாகும்.
676,நச்சினார்க்க்கினியாரும் இப்பொருளே கூறியிருத்தல் காண்க.
677,"கந்தபுராணத்துள் குன்று தோறாடிய என்றும், தணிகையாதிப் பூவுலகுள்ளவெற்பில் என்றும் கூறியிருத்தலுங் காண்க."
678,ஏனைத் திருப்பதிகளோடு உடன் எண்ணவேண்டிய வழி குன்றுகள் எனக் கொள்ளல் பொருத்தமாகும்.
679,மயிலேறும் பெருமாள்பிள்ளையும் குன்றுகள் என்றே கூறினர்.
680,அருணகிரிநாதர் தணிகையாதி மலைகளைத் தனித் தனியாகவும் குன்றுகள் எனப் பொதுவாகவும் பாடியுள்ளார்.
681,ஆல் கெழு கடவுட் புதல்வ!
682,மால்வரை மலைமகள் மகனே!
683,"குரிசில்! என்று நான் கூறியபடியே, நீயும் கூறிப் புகழ்ந்து, ஒப்பாரில்லாத மெய்ஞ் ஞானத்தை யுடையோய்!"
684,"கோழி கொடி நிறுத்தி, மறியறுத்து, ஊர்களில் விழாச் செய்தல் இதிற் கூறியுளது."
685,குறமகள் முருகவேளை யழைத்து ஊர்ச்சாந்தி செய்தல் விளங்கக் கூறப்பட்டுளது.
686,"தெய்வத்திற்கு நறும்புகை யெடுத்தலும், மலர்த்தூவலும், மணியசைத்தலும், இயம் ஒலிப்பித்தலும், பண்பாடுதலும், கொம்பு ஊதுதலும் அக்கால வழக்கங்களாக இதனாலறியப்படுகின்றன."
687,மதி என்னும் அசைச்சொல் படர்க்கையில் வந்துளது.
688,இதில் அருவி வீழ்ச்சி கூறியுள்ளது இயற்கை நவிற்சியாக மகிழ்ச்சி பயப்பதாகும்.
689,"இதனிறுதியிலுள்ள பழமுதிர் சோலைமலை என்பதில், பழமுதிர் சோலை ஓர் திருப்பதியின் பெயரெனக்கொண்டு, ஆறு திருப்பதியாக எண்ணினர் ஒரு சாரார்."
690,சோலைமலை ஓர் திருப்பதியின் பெயரெனக் கொண்டார் ஒரு சாரார்.
691,சோலை மலை முருகக் கடவுளுடையதாகப் பழைய தமிழ் நூல்களால் விளங்கவில்லை.
692,அது திருமால் குன்றென்று பரிபாடல் சிலப்பதிகாரம் முதலியவற்றால் தெரிகிறது.
693,"அஃது, இருங்குன்றம், திருமாலிருங்குன்றம், திருமாலிருஞ் சோலைமலை என்னும் பெயர்களானும் வழங்கும்."
694,கிழவோனென்ற பெயர் உடம்பொடு புணர்த்தலாற்கொள்க என்று அவர் எழுதியிருப்பதனைச் சிலர் திரியக்கொண்டோராவர்.
695,உரையாளர் கருத்து ஒன் என்னும் ஈறுபெற்றுக் கிழவோன் என நிற்பதற்கு இலக்கணங் காட்டிய தாகும்.
