Line Number,Sentence
410,சிந்துவெளி மக்கள் மருத்துவக் கலையிலும் ஓரளவு தேர்ச்சி பெற்றவர் ஆவர்.
411,இக்கால ஆயுர்வேத யூனானி மருத்துவப் புலவர் கையாளும் சிலா சித்து என்னும் மருந்து மொஹஞ்சொதரோவிற் கிடைத்துள்ளது.
412,சிலா சித்து என்பது வயிற்றில் உண்டாகும் குடலைப்பற்றிய நுரையீரலைப் பற்றியநோய்களைக் குணப்படுத்தும் ஆற்றல் பெற்றது.
413,"அஃது, இமயமலைப் பாறைகளில் கசிந்து வருவது."
414,அதனை மலைநாட்டார் கொண்டுவந்து கொடுத்தனர் இன்றும் கொடுக்கின்றனர்.
415,அவர்கள் சம்பர்மான் கொம்புகளைப் பொடியாக்கி மருந்தாகப் பயன்படுத்தினர் என்பதும் தெரிகிறது.
416,"மாட்டுக் கொம்புகள் கிண்ணம்போலக் குடையப்பட்டுள்ளதை நோக்க, அவை மருந்துவைக்கப் பயன்பட்டன வாதல் வேண்டும் என்பது அறியக்கிடக்கிறது."
417,சிந்துவெளி மக்கள் வீடுகள் கட்டியுள்ள முறையிலிருந்து இராசி கணங்களின் இயக்கங்களைக் கவனித்து வந்தவர் என்பதை அறியலாம்.
418,அவர்கள் காலத்தில் இராசி மண்டலத்தில் எட்டு இராசிகளே இருந்தன.
419,அக்காலம் ஏறக்குறைய கி.
420,மு.
421,எனக் கூறலாம்.
422,அது சுமேரியர் நாகரிகமே தோன்றாத காலம் என்று ஹீரா பாதிரியார் கூறியுள்ளார்.
423,கைத்தொழிற் கலைகளில் சிந்துவெளி மக்கள் மிக்க தேர்ச்சி பெற்றவர் என்பது முன் பகுதியில் விளக்கப்பெற்றது.
424,அவர்கள் உடற் பயிற்சியிலும் ஓரளவு பயிற்சி பெற்றவர் என்பது சில முத்திரைகளில் உள்ள ஓவியங்களைக் கொண்டு கூறலாம்.
425,"மொஹஞ்சொதரோ சிறந்த வாணிபத்தலம் ஆதலால், நகரெங்கும் காவற் கூடங்கள் இருந்தன."
426,அங்கிருந்த காவலாளிகள் கள்வரைப் பிடிக்கத்தக்க அறிவு நன்கு பெற்றவராதல் வேண்டும்.
427,"இன்றேல், நகரம் நன்னிலையில் இருத்தல் இயலாதன்றோ?"
428,"இனி, அடுத்த பகுதியில் அவர்தம் சமயக் கலை அறிவைக் காண்போம்."
429,.
430,"உலகத்துப் பண்டை மக்கள், தமக்குப் பலவகை உணவுப் பொருள்களைத் தரும் தரையைத் தாயாக மதித்து வழிபட்டனர்."
431,அத்தேவதை நிரம்ப நகைகளை அணிந்திருந்தது தலையில் விசிறிப் பாகையை உடையது.
432,சிந்துவெளி மக்களிடம் சிவ வணக்கமே சிறப்பாகக் குடிகொண்டு இருந்தது என்பதைக் குறிப்பன போலக் கணக்கற்ற இலிங்கங்கள் கிடைத்துள்ளன.
433,"இடைக்காலைத் தூக்கி ஆடும், நடராசர் சிலை போன்றது கிடைத்துள்ளது."
434,ஒரு முத்திரையில் மனித உருவம் ஒன்று யோகத்தில் இருப்பது போலப் பொறிக்கப் பட்டுள்ளது.
435,மார்பில் முக்கோண வடிவப் பதக்கங்கள் காண்கின்றன.
436,கைகள் நியைக் கடகங்கள் பூட்டப் பெற்றுள்ளன.
437,இடுப்பில் இரட்டைப் பட்டையாக ஓர் அரைக்கச்சை காணப்படுகிறது.
438,இவ் வுருவத்தின் வலப்புறம் யானையும் புலியும் இடப்புறம் எருதும் காண்டா மிருகமும் நிற்கின்றன.
439,பீடத்தின் அடியில் இரண்டு மான்கள் இருக்கின்றன.
440,யோகியின் தலைமீது வளைந்த எருமைக் கொம்புகள் இருக்கின்றன.
441,"மூன்று தலைகள் நன்கு தெரிவதால், பின்பக்கம் இரண்டு தலைகள் இருக்கும் என்று ஆராய்ச்சியாளர் அறைகின்றனர்."
442,இலிங்கங்கள் பலவடிவினவாகக் கிடைத்துள்ளன.
443,ஹரப்பாவில் மட்டும் க்கு மேற்பட்ட சிவலிங்கங்கள் கிடைத்துள்ளன.
444,"இக்காட்சி, புத்தர் பெருமானை நாக அரசர்கள் வணங்குவது போன்ற காட்சியை நினைப்பூட்டுகிறது."
445,"இஃது உண்மையாயின், அப் பழங்காலத்திலேயே வைணவமும் இந்நாட்டில் இருந்தது என்பது புலனாகும்."
446,"கொம்புள்ள தெய்வங்கள், நாற்றைத் தெய்வங்கள் போன்றவை சில முத்திரைகளில் காணப்படுகின்றன."
447,வேறு சிலவற்றில் அறுவர் நின்று யோகம் செய்வதுபோல ஓவியங்கள் தீட்டப்பட்டுள்ளன.
448,நிற்கும் நிலையில் யோகம் புரிதல் சமணர்க்கே சிறப்பானது.
449,மேலும் இவை வட மதுரையில் உள்ள சமணர் சிலைகளை ஒத்துள்ளன.
450,எருது சமணரது அடையாளக் குறி ஆகும்.
451,சில முத்திரைகளில் யோகியின் முன்புறம் எருது இருத்தல் குறிப்பிடத்தக்கது.
452,சூரிய வணக்கமும் மொஹஞ்சொதரோவில் இருந்தது.
453,"கலப்பு உருவங்கள் பல, வணக்கம் பெற்றிருந்தன."
454,எருதுக் கொம்புகளுடன் கூடிய மனித உருவம் ஒன்று காணப்படுகிறது.
455,அதன் கால்கள் எருதின் கால்கள் ஆகும்.
456,இத்தகைய விநோத உருவங்கள் சுமேரியாவில் நிம்பக் கிடைத்துள்ளன.
457,இம் மனிதர் தெய்வ சக்தி வாய்ந்தவர் என்பது அப்பண்டை மக்கள் எண்ணம்.
458,பெண்ணும் புலியும் சேர்ந்த உருவம் ஒன்றும் கிடைத்தது.
459,புலியை ஒரு தேவதையாகப் பழைய மக்கள் எண்ணினர் போலும்!
460,கொம்பு முளைத்த பாம்புகள் வணங்கப் பெற்றன.
461,கருடப் பறவைகள் வணங்கப் பெற்றன.
462,மர வணக்கம் சிந்து வெளியில் சிறப்பாக இருந்தது.
463,"மரங்களின் அடியில் மேற்சொன்ன பலவகை விநோத உருவங்கள், இருப்பதாகச் சில முத்திரைகளில் பொறிக்கப் பட்டுள்ளன."
464,மரத்தின் அடியில் ஆடு முதலியவற்றை மர தேவதைகட்குப் பலி இடுதல் சில முத்திரைகளால் புலனாகிறது.
465,மர தேவதைகள் இன்றும் தமிழ் மக்களால் வணக்கம் பெறுதல் ஈண்டு நினைக்கத்தக்கது.
466,"ஆற்று வணக்கமும், அக்காலத்தில் இருந்தது."
467,சமய சம்பந்தமாகத் தாயித்து அணிதல் அக்கால வழக்கம்.
468,இவ்வழக்கம் இன்றும் நடைமுறையில் இருக்கின்றதன்றோ?
469,அவை கயிறு கொண்டு கட்டிக்கொள்ளப் பயன்பட்டன.
470,தலைப்பில் முடியிடப்பெற்ற சிப்பியாலான தாயித்து ஒன்று மந்திர சத்தி உடையதாகக் கருதப்படுகிறது.
471,"சில தாயித்துக்களில் சுவதிகா, கிரேக்கச்சிலுவை போன்ற குறிகள் காணப்படுகின்றன."
472,சமய சம்பந்தமான பதக்கங்களும் பண்டைக் காலச் சிந்துவெளி மக்களால் அணியப்பட்டு வந்தன.
473,விழாக்கள் நடைபெற்றன கடவுள் உருவங்கள் ஊர் வலமாக எடுத்துச் செல்லப்பட்டன சமய சம்பந்தமாக இசையும் நடனமும் வழக்கில் இருந்தன.
474,"மொஹஞ்சொதரோவில் கோவில்கள் இருந்திருத்தல், வேண்டும்."
475,இப்பழக்கம் தமிழரிடையே இன்றளவும் இருந்து வருகின்றது.
476,எனக்கூறல் தவறாகாது.
477,.
478,திபேத்தில் இறந்தார் உடலைப் பல பாகங்களாக வெட்டிப் பன்றிகட்கும் நாய்கட்கும் போட்டனர் இன்றும் போடு கின்றனர்.
479,"இத்தகைய தாழிகள் பல பல்லாவரம், புதுக்கோட்டை, ஆதிச்ச நல்லூர் முதலிய இடங்களில் கண்டெடுக்கப்பட்டன."
480,இன்னும் வெளியில் எடுக்கப்படாத தாழிகள் ஆயிரக்கணக்கில் புதுக்கோட்டைச் சீமையில் இருக்கின்றன.
481,"இங்ஙனம் புதைத்த இடங்கள் மீது அடையாளக் குறிகள் வைத்தலோ, கட்டலோ பழைய வழக்கம்."
482,எகிப்திய அரசர்களைப் புதைத்த இடங்களில் கண்ணையும் கருத்தையும் கவரவல்ல பிரமிட் கோபுரங்கள் கட்டப்பட்டன.
483,அவை ஆண்டுகட்கு முன் கட்டப்பட்டன.
484,"ஆயினும், இன்றும் புதியனவாகக் காணப் படுகின்றன."
485,இத்தகைய கோவில்களோ பிற சின்னங்களோ சிந்து வெளியிற் கிடைத்தில் இடுகாடோசுடுகாடோ கிடைத்தில.
486,"ஆயின், சந்துகளில், வீடுகட்கு அடியில் நீர் அருந்தும் குவளைகட்குள் இருந்த எரித்த சாம்பலும் எலும்புத் துண்டுகளும் ஏராளமாகக் கிடைத்துள்ளன."
487,இப் பழக்கம் இன்றும் நம்மிடை இருந்துவருதல் குறிப்பிடத்தக்கது.
488,ஹரப்பாவில் கிடைத்த சவக் குழிகளில் இரண்டு மூன்று அடுக்குகள் உண்டு.
489,நிலத்திற்கு அடியில் புதைக்கப்பட்ட உடல்கள் மூன்று வகையாக அடக்கம் செய்யப்பட்டுள்ளன சில உடல்கள் தனித்தனியே இடம்விட்டுப் புதைக்கப்பட்டுள்ளன.
490,சில நெருக்கமாகப் புதைக்கப் பட்டிருக்கின்றன சில ஒன்றன்கீழ் ஒன்றாகப் புதைக்கப்பட்டுள்ளன.
491,இப்பழக்கம் பலுசித்தானத்திலும் பெரு வழக்குடையதாக இருந்தது.
492,"அவ்வுடல்களின் அருகில் நீருடைய மட்பாண்டங்கள், கோப்பைகள், தட்டுகள் இறந்தார் பயன்படுத்திய பிறபொருள்கள் முதலியன புதைக்கப்பட்டன."
493,ஹரப்பாவில் எடுக்கப்பட்ட தாழிகள் எல்லாம் ஓவியங்கள் தீட்டப்பெற்றன.
494,ஒவ்வொன்றின் மேலும் வித விதமான ஓவியங்கள் காணப்படுகின்றன.
495,அக்கால மக்கள் மயில்களைத் தெய்வத்தன்மை உடையவையாக மதித்தனர்.
496,ஒரு தாழி மீதுள்ள சித்திரங்களில் மூன்று மயில்கள் பறப்பனப்போலத் தீட்டப்பட்டுள்ளன.
497,அம் மயில்கட்கு நடுவில் விண்மீன்கள் வரையப் பட்டுள்ளன.
498,"ஆதலின், மயில்கள் சூக்கும் உடல்களைக் குறிப்பன அவை மேல் உலகத்தை அடைவதாகப்பண்டையோர் எண்ணினர், என்று ஆராய்ச்சியாளர் அறைகின்றனர்."
499,சில தாழிகள்மீது சிறிய மயில்கள் அணியணியாக இருப்பனபோல ஓவியங்கள் தீட்டப்பட்டுள்ளன.
500,வேறு சிலவற்றின்மீது ஐந்து மயில்கள் பறப்பனபோலக் காணப்படுகின்றன.
501,சிலதாழிகள் மீது காணப்படும் மயில்களின் தோகை திரிசூலம் போலக் காணப் படுகிறது.
502,சில மயில்களின் தலை மீது இரண்டு கொம்புகளும் அவற்றுக்கு இடையில் நிமிர்ந்த மலர்க்கொத்தும் காணப்படு கின்றன.
503,சில தாழிகள்மீது பறவைமூக்குடைய மனித உருவங்கள் காணப்படுகின்றன.
504,ஒரு தாழிமீது பறவைமூக்குடைய மனித உருவம் தீட்டப்பட்டுள்ளது.
505,அவ்வுருவம் இடக்கையில் அம்பும் வில்லும் வைத்துள்ளது.
506,அதன் இருபுறமும் இரண்டு எருதுகள் நிற்கின்றன.
507,"அவ்வெருதுகளைக் கயிறுகொண்டு கட்டி, அவற்றின் கயிற்றை மனித வுருவம் தன் வலக்கையில் பிடித்துள்ளது."
508,"இடப்புறமுள்ள எருதை நாய் ஒன்று துரத்திவந்து, வாலைப் பிடித்துக் கடித்து இழுக்கின்றது."
509,"நாய்க்குப் பின், தலைமீது கொம்பு முளைத்த மயில்கள் இரண்டு பறக்கின்றன."
510,அவற்றிற்கு அருகில் பெரிய வெள்ளாடு ஒன்று நிற்கிறது.
511,அதன் கொம்புகள் திரிசூலங் களால் அலங்கரிக்கப்பட்டிருக்கின்றன.
512,"இறந்தவர் அணிந்திருந்த அணிகளும், பயன்படுத்திய பாண்டங்களும், பிற பொருள்களும் உணவுப் பொருள்களும் தாழிகளில் இருந்து எடுக்கப்பட்டன."
513,இவற்றை எல்லாம் இறந்தவர் சாம்பலுடன் தாழிகளில் இட்டுப் புதைத்துவிடல் அப்பண்டை மக்கள் பழக்கம் என்பது தெரிகிறது.
514,தாழிகளில் சூளை இடப்பெற்ற மண் அப்பங்கள் கிடைத்ததைக் குறிப்பாகக் கூறலாம்.
515,பல தாழிகளில் தங்க நகைகள் அகப்பட்டன நவரத்தினங்கள் கிடைத்தன.
516,இவ்வாறு தாழிகளில் இறந்தார் அணிகளைப் புதைத்தல் பண்டை மேற்குப்புற நாடுகளிலும் இருந்து வந்த பழக்கமே ஆகும்.
517,"ஒரு பிணக் குழியிற் கிடைத்த முத்திரை ஒன்றில், கட்டில்மீது மங்கை ஒருத்தி சாய்ந்துகொண்டு இருப்பதுபோல உருவம் செதுக்கப்பட்டுள்ளது."
518,"இதனால், இறந்த ஆடவனுக்கு உரிய மனைவி கணவனுடன் இறக்கும் வழக்கம் அக்காலத்தில் இருந்திருக்கலாம்."
519,"மேலும், சிந்துவெளி மக்கள் மறு பிறவு உணர்ச்சி உடையவராக இருந்தனர் என்பதும் அறியத்தக்கது."
520,.
521,சிந்துவெளி எழுத்துகள் சிந்துவெளியிற் கிடைத்த முத்திரைகளில் பெரிறிக்கப் பட்டுள்ள சித்திரக் குறிகளே சிந்து மக்கள் மொழிக்குரிய எழுத்துக்கள்.
522,அவர்களுக்குப் பிறகு டாக்டர் ஹன்ட்டர் என்னும் பேரறிஞர் விரிவாக ஆராய்ந்து அழகிய நூல் ஒன்றை ல் வெளி யிட்டார்.
523,இந்த எழுத்துகள் படிக்கமுடியாத நிலையில் இருக்கின்றன.
524,இவை படிக்கப்பட்ட பிறகே சிந்து வெளி மக்களின் உண்மை வரலாற்றை உள்ளவாறு உணரக்கூடும் இத்தகைய எழுத்துகள் சுமேரியாவிலும் கிடைத்துள்ளன.
525,"எகிப்தியப் பழைய எழுத்துக்களும், பிற மேல்நாடுகளில் கிடைத்த எழுத்துகளும் சிறிது வேறுபாட்டுடன் பெரிதும் ஒத்துள்ளன."
526,"டெனடட் என்னும் ஒருவகைக் கல்மீது சுண்ணம் தடவிச் சுட்டு, அதன்மீது எழுத்துக்களும் விலங்கு முதலிய உருவங்களும் பொறிக்கப்பப் பெற்றுள்ளன."
527,சில முச்சதுரமாக அமைந்துள்ளன.
528,அவை சீட்டுகள் இரசீதுகள் என்று டாக்டர் ஹன்ட்டர் கருதுகிறார்.
529,வேறு சில கயிற்றிற் கோத்துக் கழுத்தில் கட்டிக்கொள்வன போல அமைந்துள்ளன.
530,செம்பாலாய நீள் சதுரத் தகடுகள் பல நாணயங்கள் என்று கருதப்படுகின்றன.
531,சிந்துவெளி மக்கள் இவற்றோடு நின்றுவிடவில்லை.
532,"அவர்கள் தோல், பட்டு, பாபிர என்பவற்றையும் பயன்படுத்தி எழுதி இருக்கலாம்."
533,எழுத்துகள் மேலிருந்து கீழ் நோக்கி எழுதப் பட்டுள்ளன நேராக அமைந்துள்ளன.
534,இந்த எழுத்துக்கள் அகர வரிசை உடையன அல்ல.
535,இவற்றுள் சித்திர எழுத்துகள் பல ஒலிக் குறிப்பு உடையன பல.
536,இவை வலம் இடமாக வாசிக்கப்பட வேண்டியவை சில இடங்களில் இடம் வலமாக வாசிக்கத் தக்கபடி அமைந்துள்ளன.
537,இவை பலவேறு காலங்களின் வளர்ச்சி உடையனவாகக் காணப்படுகின்றன.
538,இந்த எழுத்துக்களால் அறியப்படுபவை பின் வருவன ஆகும் .
539,சிந்துவெளி எழுத்துகள் உச்சரிப்பைக் குறிப்பன.
540,.
