Line Number,Sentence
133,இந்திர விழா புகார் நகரத்தில் வருடந்தோறும் இந்திரனுக்கு விழா செய்யப்பட்டு வந்தது.
134,அவ்விழாச் சித்திரை மாதம் சித்திரை நட்சத்திரம் தொடங்கி இருபத்தெட்டு நாட்கள் நடைபெற்று வந்தது.
135,அம்மாநகரத்தார் அவ்விழாவினைச் சிறப்பாகக் கொண்டாடி வந்தனர்.
136,விழா முடிவில் நகரமாந்தர் கடலில் நீராடி இன்பமாகப் பொழுது போக்குவர்.
137,இச் சொற்பொழிவுகளால் பொதுமக்கள் பல சமயங்களைப் பற்றிய செய்திகளை அறிய வசதி உண்டானது.
138,துறைமுகம் காவிரிப்பூம்பட்டினத்துத் துறைமுகம் பெரியது.
139,அங்குச் சுங்கச் சாவடி ஒன்று இருந்தது.
140,அதற்குக் காரணம் அவர்கள் செய்துவந்த கடல் வாணிகமே ஆகும்.
141,இங்ஙனம் அரச போகத்தில் வாழ்ந்த வணிகருள் இருவர் பெயர் பெற்றவராக இருந்தனர்.
142,ஒருவன் மாசாத்துவான் என்பவன்.
143,மற்றவன் மாநாய்கன் என்பவன்.
144,மாசாத்துவான் என்பவனுக்குக் கோவலன் என்பவன் தவமகனாக விளங்கினான்.
145,மாநாய்கன் என்பவனுக்குக் கண்ணகி என்பவள் தவமகளாக விளங்கினாள்.
146,கோவலன் கோவலன் இளமைதொட்டே நற்குண நற்செயல்களிற் சிறந்து விளங்கினான்.
147,அவன் தன்காலத்துத் தமிழ் நூல்கள் பலவற்றைத் தக்க ஆசிரியரிடம் பயின்றான்!
148,வாணிகத் துறைக்குரிய கல்வியையும் வளமுறக் கற்றான் தந்தைக்கு உதவியாக இருந்து வாணிகத்தைப் பெருக்கி வந்தான்.
149,ஏழைகளைக் காக்கும் இயல்பு அவனிடம் இளமை முதலே குடி கொண்டிருந்தது.
150,"செல்வத்திலும் கல்வியிலும் ஒழுக்கத்திலும் ஒருங்கே சிறப்புப் பெற்று இருந்த அவன், அறிஞரது பெருமதிப்புக்கு உரியவன் ஆனான்."
151,சிவந்த ரேகைகள் படர்ந்த அவள் கண்கள் அகன்று இருந்தன.
152,அவள் புருவங்கள் வில்லைப் போல வளைந்து இருந்தன.
153,அவள் பற்கள் ஒரே வகையும் ஒரே அளவும் உடைய முத்துக்களை ஒத்திருந்தன.
154,"அவளுடைய கரிய நீண்ட கூந்தல், கார் மேகத்தை ஒத்திருந்தது."
155,அவள் பேச்சு கிளிப் பேச்சை ஒத்திருந்தது.
156,அவளது நடை அன்ன நடையைப் போல இருந்தது.
157,"அப்பேரழகி அடக்கம், அன்பு முதலிய நல்ல இயல்புகளைப் பெற்றிருந்தாள்."
158,மாநாய்கன் தன் செல்வ மகளைப் பல கலைகளில் வல்லவளாக்க விரும்பினான்.
159,"கண்ணகி, செல்வச் சீமான் செல்வமகள் ஆதலின், அவளுக்குத் தோழியர் பலர் இருந்தனர்."
160,அவள் அவர்களிடையில் இன்பமாகப் பொழுது போக்கி வந்தாள்.
161,திருமண எண்ணம் மாநாய்கனும் மாசாத்துவானும் நெருங்கிய உறவினர்.
162,"அதனால் கோவலனை மாநாய்கன் நன்கு அறிவான் எனவே, கண்ணகியும் நன்கு அறிவாள்."
163,அங்ஙனமே கண்ணகியைக் கோவலன் அறிவான்.
164,இருவரும் மணப்பருவம் அடைந்த பிறகு ஒருவரை ஒருவர் காணச் சந்தர்ப்பம் கிடைக்கவில்லை.
165,"எனினும், கண்ணகியின் தோழியர் கோவலன் குண நலங்களைக் கண்ணகியிடத்துப் பலவாறு பாராட்டிப் பேசுதல் வழக்கம்."
166,"அதனால், கண்ணகியின் உள்ளம் கோவலனைக் கணவனாகப் பெறவேண்டும் என்று நாடியது."
167,மண் ஆர்ப்பு ஊரெங்கும் காணப்பட்டது.
168,மணப்பந்தல் அழகாக அலங்கரிக்கப்பட்டு இருந்தது.
169,வயிரம் பதித்த தூண்களையும் நீலப்பட்டுக் கட்டப்பட்ட கூரையையும் கொண்ட இடத்தில் முத்துப்பந்தல் அமைக்கப்பட்டு இருந்தது.
170,அப்பந்தலில் இருந்த ஆசனத்தில் மணமக்கள் வீற்றிருந்தனர்.
171,அவர்களைச் சுற்றிலும் உற்றாரும் உறவினரும் பெரு மகிழ்ச்சியுடன் கூடியிருந்தனர்.
172,கண்ணகி மணப்பெண் கோலத்தில் விளங்கினாள்.
173,அவளது இயற்கை அழகும் ஆடை அணிகளால் பெற்ற செயற்கை அழகும் கலந்து கண்டோரைப் பரவசப்படுத்தின.
174,கோவலன் இயற்கையில் வடிவழகன் அவன் கொண்டிருந்த செயற்கைக் கோலம் பின்னும் அழகு செய்தது.
175,ஏற்ற மணமக்கள் என்று கண்டோர் கூறிக் களிப்புற்றனர்.
176,குறித்த நேரத்தில் சடங்குகள் தொடங்கப் பெற்றன.
177,வயதிலும் ஒழுக்கத்திலும் சாத்திர அறிவிலும் மிகவும் முதிர்ச்சி பெற்ற பார்ப்பான் சடங்குகளை ஒன்றன் பின் ஒன்றாகச் செய்விக்கத் தொடங்கினான்.
178,மணமக்கள் இருவரும் தீ வலம் வந்தனர்.
179,"பிள்ளைகளைப் பெற்று, வாழ்க்கை அநுபவம் மிகுந்த பெண்மணிகள், கணவனும் மனைவியும் நிறைந்த அன்புடன் நீடுழி வாழ்க!"
180,என்று மலர்களைத் தூவி வாழ்த்தினர்.
181,அத்துடன் மணவினை மங்கல முடிவு பெற்றது.
182,"மணத்திற்கு வந்திருந்தவர் அனைவரும், சோழர் பெருமானான கரிகாலன் இமயத்தில் இருத்திய புலி முத்திரை அவ்விடத்தில் நிலைபெற்று இருப்பதாகுக!"
183,எவனது ஒப்பற்ற அரச ஆழி வாழ்வதாகுக!
184,என்று வாழ்த்தினர்.
185,அவர்கட்காகத் தனி மாளிகை ஒன்று விடப்பட்டது.
186,கண்ணகிக்கு உதவியாகப் பணிப் பெண்கள் பலர் அமர்த்தப் பட்டனர்.
187,மணமான பிறகு இவ்வாறு மணமக்களைத் தனி வாழ்க்கை நடத்த விடதலே பண்டைப் பழக்கமாகும்.
188,இப்பழக்கமே இன்று மேனாட்டாரிடம் மிகுந்து காணப்படுகின்றது.
189,இன்ப மாளிகை மணமக்கள் தங்கி இருந்த விடுதி மிக்க அழகானது இரண்டு அடுக்கு மாடி வீடாகும்.
190,மூன்றாம் தளம் திறந்த நிலையில் இருந்தது.
191,அதன் மீது பகற் காலத்தில் வெயிலும் இரவு காலத்தில் நிலவும் காய்தல் உண்டு.
192,மாளிகையில் எங்குப் பார்ப்பினும் அழகிய ஓவியங்கள் காட்சி அளித்தன.
193,வறுமைக்குச் சிறிதும் இடம் கொடாத அம்மாளிகை இன்ப மாளிகையாக இலங்கியது.
194,இன்ப வாழ்க்கை கோவலன் தன் கருத்திற்கு இசைந்த காதலியான கண்ணகியுடன் மனம் ஒத்து இல்லறம் நடத்தி வந்தான்.
195,மனம் ஒத்த காதலர் நடத்தும் வாழ்க்கையே இன்ப வாழ்க்கை எனப்படும்.
196,எல்லா வீடுகளிலும் இன்ப வாழ்க்கை இருத்தல் அரிது.
197,கணவன் விரும்புவதை மனைவி விரும்பாள் மனைவி விரும்புவதைக் கணவன் விரும்பான்.
198,"இத்தகைய பல காரணங்களால், பெரும்பாலான இல்லங்களில் கணவன்மனைவியர்க்குள் ஒத்த மனவுணர்ச்சி உண்டாவ தில்லை."
199,ஒத்த மனவுணர்ச்சி இல்லாத இடத்தில் வாழ்க்கை இன்பம் உண்டாதல் முயற்கொம்பே ஆகும்.
200,"பெண்கள் ஆண்களைப் போலத் தாராளமாகக் கல்வி கற்க விடப்படின், எல்லாப் பெண்களும் கல்வி அறிவு நிரம்பப் பெறுவர்."
201,கல்வி அறிவு ஏற்படின் உலக அறிவுதானாக உண்டாதல் இயல்பு.
202,நன்றாகப் படித்து உயர்ந்த கணவனும் மனைவியும் நடத்தும் இன்ப இல்லற வாழ்க்கையே இதற்குத் தக்க சான்றாகும்.
203,ஒத்த உணர்ச்சி கோவலன் பலகலை விற்பன்னன் கண்ணகியும் பல கலைகளில் வல்லவள் கவிபாடும் ஆற்றல் பெற்றவள்.
204,"ஆதலின் அவர்க்குள்,இவர் உயர்ந்தவர் இவர் தாழ்ந்தவர் என்று கூறுவதற்கில்லை."
205,பா விருந்து கண்ணகி பாக்கள் இயற்றலில் வல்லவள்.
206,"அவள் இயற்கைக் காட்சிகளைக் கண்டு கண்டு, இயற்கை அழகில் தோய்ந்து தோய்ந்து தன்னை மறந்திருத்தல் வழக்கம்."
207,அவ்வாறே தெய்வ பக்தியிலும் அவள் மெய்மறந்து இருப்பதுண்டு.
208,"கண்ணகி, தன் உள்ளம் கவர்ந்த இயற்கைப் பொருள்களைப் பற்றியும் கடவுளைப் பற்றியும் பாக்கள் பாடுதல் வழக்கம்."
209,கண்ணகி வெண்பாக்கள் பாடுவதிலும் விருப்பம் கொண்டவள்.
210,பலவகைப் பாக்களில் அவளது உள்ளத்தைக் கவர்ந்தது வெண்பாவே ஆகும்.
211,"இங்ஙனம் கண்ணகி குழைந்த அன்பினாற் பாடும் செய்யுட்களைக் கோவலன் படித்தும், கண்ணகி பாடக் கேட்டும் இன்பக் கடலில் மூழ்குவான்."
212,இசைவிருந்து கண்ணகி யாழ் வாசிப்பதில் தேர்ச்சி பெற்றவள்.
213,கோவலனும் அக்கருவி மீட்டிப் பாடுதலில் வல்லவன்.
214,"அதனால், அவர்கள் அடிக்கடி யாழ் வாசித்துப் பாடுதலில் ஈடுபட்டு இருந்தனர்."
215,அக்காலத்தில் தமிழ்ப் பண்புகள் வழக்கில் இருந்தன.
216,"அவை குரல் துத்தம், கைக்கிளை, இளி, உழை, விளரி, தாரம் என்று ஏழாகும்."
217,இவை ஏழ் இசை எனப்படும்.
218,இந்த ஏழிசையிலும் கண்ணகியும் கோவலனும் வல்லவராக விளங்கினர்.
219,கண்ணகி யாழை மீட்டிக் குரல் எடுத்துப் பாடும் பொழுது கோவலன் இசை இன்பத்தில் ஈடுபட்டிருப்பான்.
220,அவ்வாறே அவன் யாழ் இசைத்துப் பாடுங்கால் கண்ணகி பரவசமாதல் வழக்கம்.
221,கண்ணகியின் குண நலங்களில் ஈடுபட்ட கோவலன் அவளை.
222,மாசறு பொன்னே!
223,வலம்புரி முத்தே காசறு விரையே!
224,கரும்பே தேனே!
225,அரும்பெறற் பாவாய்!
226,ஆருயிர் மருந்தே!
227,பெருங்குடி வாணிகன் பெருமட மகளே!
228,மலையிடைப் பிறவா மணியே!
229,அலையிடைப் பிறவா அமிழ்தே என்கோ!
230,யாழிடைப் பிறவா இசையே!
231,தாழிருங் கூந்தல் தையல்!
232,நின்னை என்று நாள்தோறும் பாராட்டுவான் ஆயினன்.
233,"கண்ணகி, தன் மாளிகை தேடிவந்த இல்லறத்தார்க்கும் துறவறத்தார்க்கும் இன்முகம் காட்டி விருந்தூட்டி உபசரித்து வந்தாள்."
234,அதனால் எல்லோரும் அவளது இல்லறப் பண்பைப் பாராட்டி வாழ்த்துவார் ஆயினர்.
235,"அவற்றில் அடிக்கடி நாடகங்கள், நடன வகைகள், இசை விருந்து என்பன நடைபெற்று வந்தன."
236,இந்த இன்பக் கலைகளில் ஈடுபட்டிருந்தவர் நாடகக் கணிகையர் எனப்பட்டனர்.
237,அவர்கள் ஓர் ஆடவரை மணந்து கொள்வதும் உண்டு மணந்து கொள்ளாமல் தனி வாழ்க்கை நடத்துதலும் உண்டு.
238,இந்தப் பலவகைக் கலைகளைப் போதிக்கும் ஆசிரியர்கள் பரம்பரையாகவே இக்கலைகளில் பண்பட்ட புலமை பெற்றவர் ஆவர்.
239,சித்திராபதி பூம்புகாரில் கணிகையர் தெருக்கள் சில இருந்தன.
240,அவற்றில் ஒன்று முதல்தர நாடகக் கணிகையர் தெருவாகும்.
241,அத் தெருவில் இருந்த கணிகையருள் புகழ்பெற்று இருந்தவள் சித்திராபதி என்பவள்.
242,அவள் ஆடல்பாடல்களில் வல்லவள் அவற்றில் நீண்ட காலம் பயிற்சி உடையவள் சாத்திர முறையில் அணுவளவேணும் தவறாதபடி நடிக்க வல்லவள்.
243,அவள் நடனத்தைப் பார்ப்ப பூம்புகார் மக்கள் பெருங் கூட்டமாகக் கூடுவர்.
244,அவளைப் பற்றிச் சோழ நாடு முழுவதிலும் இருந்த மக்கள் நன்கு அறிந்திருந்தனர்.
245,சோழ அரசன் அவளது நடனத் திறனைப் பல முறை பாராட்டி மகிழ்ந்தான்.
246,மாதவி இவ்வாறு ஈடும் எடுப்பும் அற்ற நடிக மாதாக விளங்கிய சித்திராபதிக்குத் தவமகள் ஒருத்தி இருந்தாள்.
247,அவள் பெயர் மாதவி என்பது.
248,அவள் தன்னைப் போல நடனக் கலையில் பெரும் புலமை பெறவேண்டும் என்பது சித்திராபதியின் விருப்பம்.
249,அதனால் அவள் பண்பட்ட நடன ஆசிரியரை வைத்து மாதவிக்கு நடனப் பயிற்சி அளிக்கத் தொடங்கினாள்.
250,இப்பயிற்சி மாதவியின் ஐந்தாம் வயதிலிருந்தே தொடக்கம் ஆயிற்று.
251,மாதவி ஏழு ஆண்டுகள் பயிற்சி பெற்றாள் நடனக் கலைத் தொடர்பான நுட்பங்கள் எல்லாவற்றையும் தெளிவாகத் தெரிந்து கொண்டாள்.
252,மாதவிபேரழகி மாதவிக்கு வயது பன்னிரண்டு ஆனது.
253,அவள் கட்டழகுடன் காணப்பட்டாள்.
254,"அவளது கூந்தல், நிறத்தில் கருநாவல் பழத்தை ஒத்திருந்தது."
255,அவளுடைய கண்கள் அகன்று சிவந்த ரேகைகளைப் பெற்றிருந்தன புருவம் வான் வில்லைப் போல வளைந்து மயில் அடர்ந்து இருந்தது.
256,அம் மங்கையின் முகம் அகன்று மலர்ந்த தாமரை மலரை ஒத்திருந்தது.
257,அவள் மூக்குக் குமிழம் பூவைப் போல இருந்தது பல் வரிசைகள் முத்து வரிசை போலக் காணப்பட்டன.
258,அவளுடைய உதடுகள் கொவ்வைக் கனிபோலச் சிவந்து இருந்தன.
259,அவள் பேச்சு கிளி கொஞ்சுவதுபோல இருந்தது.
260,அவளது நடை அன்னப் பறவையின் அழகிய நடையை ஒத்திருந்தது.
261,அது மிக்க சிறப்புடன் கொண்டாடப்படும் அஃது அரங்கு ஏற்றம் எனப்படும்.
262,"அரசர், பிரபுக்கள் இவர்கள் வீட்டு விசேடங்களில் வந்து நடிப்பதற்கும் அவளுக்குச் சந்தர்ப்பம் அளிக்கப்படும்."
263,"சுருங்கக்கூறின், அரங்கேற்று விழா அக்கணிகையது எதிர்கால வாழ்வினைத் தீர்மானிப்பது என்னலாம்."
264,இத்தகைய முறையில் மாதவியும் தனது நடனத் திறமையை உலகத்திற்குக் காட்ட வேண்டியவள் ஆனாள்.
265,அரங்கேற்றத்திற்கு ஒரு நாள் குறிக்கப்பட்டது.
266,புகழ்பெற்ற நடிகப் பெண்மணியான சித்திராபதி மகளான மாதவி நடனம் ஆடப் போகிறாள் என்ற செய்தி நகரம் எங்கும்பரவியது.
267,நடன அரங்கம் மாதவியின் நடன அரங்கேற்றத்திற்காகப் பெரிய நடன அரங்கம் ஒன்று தேர்ந்தெடுக்கப்பட்டது அங்கு நடனமேடை தனிச்சிறப்புச் செய்யப்பட்டது.
268,நீங்கள் இக்கால நாடக மேடைகளைப் பார்த்திருக்கிறீர்கள் அல்லவா அது போலவே அங்கு நடன அரங்கமும் இருந்தது.
269,மேடையில் கணிகை நடிப்பதற்கு அகன்ற இடம் இருந்தது.
270,நடிப்பவளுக்குப் பின்பக்கம் நடன ஆசிரியர்களும் இசை ஆசிரியர்களும் நின்று துணை செய்ய வசதியாக இடம் இருந்தது.
271,நடன மண்டபம் அரங்கேற்றத்திற்கு உரியநாள் வந்தது.
272,"அன்று, முன் சொன்ன நடன அரங்கம் சிறந்த முறையில் ஒப்பனை செய்யப்பட்டது."
273,நகரம் எங்கும் தோரணங்கள் கட்டப்பட்டன.
