Line Number,Sentence
580,எழுத்தினான் மொழியாமாறு கூறத்தொடங்கி ஓரெழுத்தொரு மொழி யாமாறு கூறுகின்றார்.
581,இள் நெட்டெழுத்துக்களாகிய உயிர்களேழும் ஓரெழுத் தானாகும் ஒரு மொழியாம்.
582,"உம் ஆ, ஈ, ஊ, ஏ, ஐ, ஓ, எனவரும்."
583,ஔகாரம் உயிர்மெய்க் கண்ணல்லது வாராது.
584,ஊ தசை.
585,இவ் விதி உயிர்க்கும் உயிர் மெய்க்கும் பொது.
586,இவை தம்மையுணர நின்றவழி எழுத்தாம்.
587,இடை நின்று பொருளுணர்த்திய வழி சொல்லாம்.
588,குற்றெழுத் தைந்தும் மொழிநிறை பிலவே.
589,தொல்.
590,இள் குற்றெழுத்தைந்தும் ஓரெழுத்தாய் நின்று ஒரு மொழியாய் நிறைதலில்லை.
591,"உம் து, நொ எனவரும்."
592,மொழி நிறைபு மொழியியல்பில் நிறைந்து முழுப்பொருள் தரல்.
593,இச் சூத்திரமும் உயிர்க்கும் உயிர்மெய்க்கும் பொது.
594,ஓரெழுத் தொருமொழி யீரெழுத் தொருமொழி இரண்டிறந் திசைக்குந் தொடர் மொழி யுளப்பட மூன்றே மொழிநிலை தோன்றிய நெறியே.
595,தொல்.
596,இஃது எழுத்தினால் ஆகும் மொழிகளின் பெயரும் முறையும் தொகையும் கூறுகின்றது.
597,அவை தோன்றிய நெறிக்கண் என்றவாறு.
598,பவணந்தியாரும் எழுத்தே தனித்தும் தொடர்ந்தும் பொருள்தரிற் பதமாம் என எழுத்துக்கள் சொல்லாகும் நிலையை இரண்டாக அடக்கிக் கூறினார்.
599,இம்மொழி வகைகளைத் தாமே வகுத்துக் கூறுவதாகக் கூறாது.
600,"தொல்காப்பியர் ஒன்று, இரண்டு, பல என வடநூல் வழக்கினைப் பின்பற்றி இங்ஙனம் மொழிகளை மூவகைப்படுத்தினார் எனக் குற்றங் கூறினாருமுளர்."
601,"உம் ஆ, மணி, வரகு, எனவரும்."
602,மெய்யி னியக்கம் அகரமொடு சிவணும்.
603,தொல்.
604,இது தனி மெய்கள் இயங்கும் முறை கூறுகின்றது.
605,தன்னையுணர்த்தாது வேறு பொருளுணர்த்துஞ் சொல் போல டறலள சூத்.
606,இவ்விதி இன்றியமையாததாகவும் சுருக்க நூலாதலின் நன்னூலார் இதனைக் கூறிற்றிலர்.
607,தம்மியல் கிளப்பின் எல்லாவெழுத்தும் மெய்ந்நிலை மயக்க மான மில்லை தொல்.
608,இது மெய்மயக்கத்திற்குப் புறனடை கூறுகின்றது.
609,புள்ளி மயங்கு.
610,இங்ஙனம் மயங்கிவருதல் மொழியாய்த் தொடருமிடத் தாகலான் இது மொழிமரபின்கண் வைக்கப்பட்டது.
611,"மெய் மயக்கத்திற்கு அவற்றுள், லளஃகான் என்பதனைக் காட்டில் அஃதிருமொழிக் கண்ணதென மறுக்க என்பர் நச்சினார்க்கினியர்."
612,இம் மெய்மயக்கப் புறனடையை நன்னூலார் முதனிலை யெழுத்துக் களின் புறனடையோடு சேர்த்துக் கூறுவர்.
613,ஈரொற்றுடனிலை யரழவென்னு மூன்று மொற்றக் க ச த ப ங ஞ ந ம ஈரொற்றாகும்.
614,தொல்.
615,மேற்கூறிய எழுத்துக்கள் மொழியாமிடத்து வேறுபட்ட மெய் களிரண்டும் ஒற்றாய் உடனிற்கும் நிலையை இச் சூத்திரத்தாற் கூறுகின்றார் ஆசிரியர்.
616,என்றவாறு.
617,உம் க.
618,ச.
619,த.
620,ப.
621,"யவேய்க்க, வாய்ச்சி, பாய்த்தல், வாய்ப்பு."
622,"ரபீர்க்கு, நேர்ச்சி, வார்த்தல், ஆர்ப்பு."
623,"ழ வாழ்க்கை, தாழ்ச்சி தாழ்த்தல், தாழ்ப்பு."
624,ங.
625,ஞ.
626,ந.
627,ம.
628,"யகாய்ங்கனி, தேய்ஞ்சது, சாய்ந்தது, காய்ம்புறம்."
629,"ர நேர்ங்கல், நேர்ஞ்சிலை, நேர்ந்திலை, நேர்ம்புறம்."
630,"ழ தாழ்ங்குலை, தாழ்ஞ்சினை, தாழ்ந்திரள், பீழ்ம்படை எனவரும்."
631,"அவற்றுள், ரகார, ழகாரங் குற்றொற் றாகா."
632,தொல்.
633,இஃது எய்தியது ஒருமருங்கு மறுத்தது.
634,"இள் மேற் கூறப்பட்ட மூன்றனுள்ளும் ரகாரமும், ழகாரமும் குறிற்கீழ் ஒற்றாய் வாரா."
635,என்றவாறு.
636,எனவே அவை நெடிற்கீழ் ஒற்றாம் குறிற்கீழ் உயிர் மெய்யாம்.
637,"உம் தார், தாழ் என நெடிற்கீழ் ஒற்றாய் நின்றன."
638,"கரு, மழு, எனக் குறிற்கீழ் உயிர்மெய்யாய் நின்றன."
639,"இவ்வாறு இரண்டையும் விலக்கினமையின் ஒழிந்த யகரம், பொய், நோய் என ஈரிடத்தும் வருமென்பதாம்."
640,குற்றொற்று குறிதாகிய ஒற்று எனப் பண்புத் தொகை குறிற்கீழ் நிற்றலான் குறியதெனப் பட்டது என்பர் உரையாசிரியர்.
641,கீழ் என்னும் உருபு தொகுத்துக் கூறினாரென்பர் நச்சினார்க்கினியர்.
642,எனவே அவர் குற்றொற் றென்பதனை வேற்றுமைத் தொகையாகக் கொண்டார் என்பது புலனாம்.
643,நன்.
644,என்ற சூத்திரத்தால் தொகுத்துக் கூறினார்.
645,குறுமையும் நெடுமையு மளவிற் கோடலிற் றொடர்மொழி யெல்லாம் நெட்டெழுத்தியல.
646,தொல்.
647,இது மேலைச் சூத்திரத்தின் மேலெழுந்த ஐயம் அகற்றுகின்றது.
648,என்றவாறு.
649,செய்யு னிறுதிப் போலு மொழிவயின் னகார மகார மீரொற்றாகும்.
650,தொல்.
651,இது செய்யுட்கண் ஈரொற்றுடனிலையமாறு கூறுகின்றது.
652,"இள் செய்யுட்கண் போலும் என்னும் சொல்லினிறுதி யில் னாகரமும், மகாரமும், வந்து ஈரொற்றுடனிலையாய் நிற்கு மென்றவாறு."
653,உம் அந்நூலை முன்னூலாகக் கொள்வானும் போன்ம் என வரும்.
654,னகாரை முன்னர் மகாரங் குறுகும்.
655,தொல்.
656,இது மேல் ஈரொற்றாய் வரும் என்ற மகரம் தன்மாத் திரையிற் குறுகுமென்கின்றது.
657,இள் முற்கூறிய னகரத்தின் முன்னர் வந்த மகரம் தன் அரைமாத்திரையிற் குறுகி நிற்கும்.
658,இனித் தன்னின முடித்தல் என்பதனால் ணகார வொற்றின் முன்னும் மகரங் குறுகுதல் கொள்க.
659,நன்.
660,என்பதனாற் குறிப்பிடுவர்.
661,மொழிப்படுத் திசைப்பினுந் தெரிந்துவேறிசைப்பினும் எழுத்தியல் திரியா வென்மனார் புலவர்.
662,தொல்.
663,இஃது எழுத்துக்கட்கு மொழிக்கண் மாத்திரை காரணமாகப் பிறப்பதோர் ஐயந் தீர்க்கின்றது.
664,ஈண்டு எழுத்தியல் திரியாவென்றது மொழிக்கட்பட்டுத் தெரிந்து வேறிசைக்கப்படும் முப்பதெழுத்துக்களையுமே.
665,மொழிக்கண் படுத்துச் சொல்லினும் தெரிந்து வேறு சொல்லினும் எழுத்தியல் திரியா வெனவே இவற்றாற் பொருள் திரியுமென்றாராயிற்று.
666,வேறு இசைத்தல் என்றதனால் எடுத்தல் படுத்தல் முதலிய ஓசை வேற்றுமைக் கண்ணும் எழுத்தியல் திரியா வென்பது கொள்க.
667,இவ்வாறே எழுத்துக்கள் தனித்துச் சொல்லுமிடத்துப் போல மொழியாய்த் தொடருமிடத்தும் தம்மியல்பிற் றிரியாது நிற்குமென்பதனை நன்னூலார்.
668,மொழியாய்த் தொடரினும் முன்னனைத் தெழுத்தே.
669,நன்.
670,என்பதனாற் கூறினார்.
671,.
672,போலி அஃதாவது ஓரெழுத்தினைப் போன்று பிறவெழுத்துக்கள் நின்றொலித்தல்.
673,அகர விகரம் ஐகாரமாகும்.
674,தொல்.
675,இள் அகரமும் இகரமும் கூட்டிச் சொல்ல ஐகாரம் போல் விசைக்கும்.
676,"உம் ஐவனம், அஇவனம் எனவரும்."
677,அகர வுகரம் ஔகாரமாகும்.
678,தொல்.
679,இள் அகரமும் உகரமுங் கூடி ஔகாரம் போல விசைக்கும்.
680,"உம் ஔவை, அஉவை எனவரும்."
681,ஆகும் என ஆக்கச் சொற்கொடுத்து ஓதியவதனால் இவ்வொலிகள் செயற்கை என்பது உணர வைத்தார்.
682,அகரத்திம்பர் யகரப் புள்ளியும் ஐயெ னெடுஞ்சினை மெய்பெறத் தோன்றும்.
683,தொல்.
684,இள் அகரத்தின் பின் இகரமேயன்றி யகர மாகிய புள்ளியும் ஐயெனப்பட்ட நெட்டெழுத்தின் வடிவுபெறத் தோன்றும்.
685,"உம் ஐவனம், அய்வனம் எனவரும்."
686,இவ்வெழுத்துப் போலிகளை நன்னூலார்.
687,அம்ம னிகரம் யகர மென்றிவை எய்தின் ஐயொத் திசைக்கும் அவ்வோடு உவ்வும் வவ்வும் ஔவோ ரன்ன.
688,நன்.
689,என்பதனாற் றொகுத்துரைத்தார்.
690,இச் சூத்திரத்திற்கு அகரத்தின் முன் இகரமும் யகரவொற்றும் வருமாயின் ஐகாரம் போன்றொலிக்கும்.
691,"அகரத்தோடு உகரமும் வகர வொற்றும் வருமாயின் ஔகாரம் போன்றொலிக்கும் எனப் பொருள் கூறி, உம் அ."
692,"இவ்விதி தொல்காப்பியர்க் குடன்பாடாயின், அகரத் திம்பர் வகரப் புள்ளியும் ஔவெ னெடுஞ்சினை மெய்பெறத் தோன்றும் என்றொரு சூத்திரம் செய்திருப்பர்."
693,அங்ஙனமாகவும் வ.உ.
694,எனப் பாடத்தினைத் திரித்துப் புதுப்பொருள் கொள்ளுதல் முற்றும் பொருந்தாத தொன்றாம்.
695,எனவே இச் சூத்திரங்கள் செயற்கை யோசையாய்ப் போலியெழுத்துணர்த்தின எனவே படும்.
696,நன்னூலார்க்கும் இதுவே கருத்தாதல் அம்முனிகரம் என்ற சூத்திரத்திற்குச் சங்கர நமச்சிவாயர் உரைத்த உரையாற் புலனாம்.
697,ஓரளபாகு மிடனுமா ருண்டே தேருங் காலை மொழிவயி னான.
698,தொல்.
699,இஃது உயிர்களுள் ஒன்றற்கு மாத்திரைச் சுருக்கம் கூறுகின்றது.
700,இள் ஐகாரம் ஆராயுங் காலை மொழிக்கண் ஒரு மாத்திரையாய் நிற்குமிடமும் உண்டு.
701,"உம் இடையன், குவளை என வரும்."
702,"இக்கருத்தேபற்றி நன்னூலாரும், தற்சுட் டளவொழி ஐம்மூ வழியும் நையும், ஔவும் முதலற் றாகும்."
703,நன்.
704,எனச் சூத்திரஞ் செய்தார்.
705,"எனவே ஔகாரக் குறுக்கம் என ஒன்று இன்றென்பதும், ஐகாரம் மொழிமுதலிற் குறுகா தென்பதும் ஆசிரியர் கருத்தாதல் விளங்கும்."
706,இகர யகரம் இறுதி விரவும்.
707,தொல்.
708,இதுவும் போலி கூறுகின்றது.
709,இள் இகரமும் யகர மெய்யும் ஒரு மொழியின் இறுதிக்கண் ஓசை விரவிவரும்.
710,"உம் நாய், நாஇ எனவரும்."
711,இப்போலியினை இறந்தது விலக்கலென்னும் உத்தியால் நன்னுலார் தம் நூலிற் கூறா தொழிந்தார்.
712,மொழிமுதல் எழுத்துக்கள் பன்னீரு ருயிரும் மொழி முதலாகும்.
713,உயிர்மெய் யல்லன மொழிமுத லாகா.
714,"க, த, ந, ப, ம வெனு மாவைந் தெழுத்தும் எல்லா வுயிரொடுஞ் செல்லுமார் முதலே."
715,தொல்.
716,அதனால் சுட்டியா வெகர வினாவழி யவ்வை ஒட்டி ஙவ்வும் முதலா கும்மே.
717,நன்.
718,நன்.
719,எனச் சூத்திரஞ் செய்தனர்.
720,சகரக் கிளவியும் அவற்றோ ரற்றே அ ஐ ஔவெனு மூன்றலங் கடையே.
721,நன்.
722,"எனவே அ, ஐ, ஔ, என்னும் மூன்று உயிரோடுங்கூடிச் சகரம் மொழிக்கு முதலாகாதென்பது கூறப்பட்டது."
723,"உ, ஊ, ஒ, ஓ, என்னு நான்குயிர் வ என் எழுத்தொடு வருத லில்லை."
724,நன்.
725,"இள் உ, ஊ, ஒ, ஓ, என்னும் நான்குயிரும் வகரமெய் யோடு மொழிக்கு முதலாய் வருதலில்லை என்பதாம்."
726,எனவே ஒழிந்தன வற்றோடு மொழிக்கு முதலாமென்றவாறாயிற்று.
727,"உ, ஊ, ஒ, ஓ வலவொடு வம்முதல் நன்."
728,எனச் சூத்திரஞ் செய்தார் நன்னூலார்.
729,"ஆ, எ, ஒ வெனு மூவுயிர் ஞகாரத்துரிய."
730,தொல்.
731,"இள் ஆ, எ, ஒ, என்ற மூன்றுயிரும் ஞகரமெய்யொடு கூடி முதலாதற்குரிய."
732,எனவே ஏனையீறோடு ஞகரம் முதலாகாதென்பது பெற்றாம்.
733,என அகரத்தையுஞ் சேர்த்துக் கூறினார்.
734,ஆவோ டல்லது யகர முதலாது.
735,தொல்.
736,இள் யகரவொற்று ஆகாரத்தோடு கூடியல்லது மொழிக்கு முதலாகாது என்பதாம்.
737,நன்.
738,என முதனூல் விதியொடு மாறுபடச் சூத்திரம் செய் துள்ளார்.
739,தமிழிலக்கணங் கூறுமிடத்து வடமொழி இலக் கணத்தை யுங்கூட்டி உரைத்தல் கடிசொல் இல்லைக் காலத்துப்படினே என்னும் விதியொடு பட்டதாகும்.
740,முதலா வேன தம்பெயர் முதலும்.
741,தொல்.
742,"இள் மொழிக்கு முதலாகாத ஒழிந்த மெய்களும் எழுத்துக் களாகிய தம் பெயர் கூறும் வழி மொழிக்கு முதலாம், என்றவாறு."
743,முதலாயின மெய்கள் க த ந ப ம வ ச ஞ ய என்பன.
744,முதலாகாத மெய்கள் ங ட ண ர ல ழ ள ற ன என்பன.
745,"உம் ஙக்களைந்தார், டப்பெரிது என வரும்."
746,"இப்புறனடை விதியோடு மெய்ம்மயக்கப் புறனடையுங் கூட்டி, தம் பெயர் மொழியின் முதலும் மயக்கமும் இம்முறை மாறியு மியலு மென்ப."
747,நன்.
748,எனச் சூத்திரஞ் செய்தார் நன்னூலார்.
749,குற்றிய லுகர முறைப்பெயர் மருங்கின் ஒற்றிய நகரமிசை நகரமொடு முதலும்.
750,தொல்.
751,இது சார்பெழுத்தினுள் ஒன்றாகிய குற்றியலுகரமும் ஒருவாற்றான் முதலாமாறு கூறுகின்றது.
752,"இள் குற்றியலுகரமானது முன்னிலை முறைப் பெயரிடத்துத் தனிமெய்யாய் நின்ற நகரத்தின் மேலுள்ள நகரத்தோடு கூடி மொழிக்கு முதலாம், என்றவாறு."
753,உம் நுந்தை என வரும்.
754,இவ்விதி நன்னூலார்க்கு உடன்பாடன்மையின் அவர் கூறாதொழிந்தா ரென்பர் சங்கர நமச்சிவாயர்.
755,முற்றிய லுகரமொடு பொருள்வேறு படாஅ தப்பெயர் மருங்கி னிலையில லான.
756,தொல்.
757,இது மேலதற்கோர் புறனடை கூறுகின்றது.
758,மொழியிறுதி எழுத்துக்கள் மொழிக்கீறாம் எழுத்துக்களையும் அவற்றது வரை யறையை யும் முதல் வரையுள்ள சூத்திரங்களால் தொல்காப்பியர் உணர்த்துகின்றார்.
759,உயிர் ஔ வெஞ்சிய விறுதி யாகும்.
760,தொல்.
761,"இஃது, உயிர் மொழிக்கு ஈறாமாறு உணர்த்துகின்றது."
762,இள் உயிர்களுள் ஔகாரம் ஒழிந்தனவெல்லாம் மொழிக்கு ஈறாம்.
763,"உம் பல, பலா, கிளி, குரீ, கடு, தூ, சேஎ, நே, பனை, ஓஒ, போ எனவரும்."
764,கவவோ டியையின் ஔவு மாகும்.
765,தொல்.
766,இள் முன் ஈறாகாதென்ற ஔகாரமும் ககர வகரத்தோடு இயைந்தவழி ஈறாம்.
767,"உம் கௌ, வௌ எனவரும்."
768,"எ, என வருமுயிர் மெய்யீ றாகாது."
769,தொல்.
770,இள் எ என்று கூறப்படும் உயிர் தானே ஈறாவதன்றி யாண்டும் மெய்களோடு இயைந்து ஈறாகாது.
771,ஒவ்வு மற்றே நவ்வலங் கடையே.
772,தொல்.
773,இள் ஒகரமும் நகரவொற்றோ டல்லாத விடத்து முன் சொன்ன எகரம்போலத் தானே ஈறாவதன்றி மெய்களோடு இயைந்து ஈறாகாது.
774,எனவே நகரத்தோடு ஈறாமென்பது பெற்றாம்.
775,உம் நொ அலையல் நின்னாட்டை நீ எனவரும்.
776,ஏ ஓ எனுமுயிர் ஞகாரத் தில்லை.
777,தொல்.
