Line Number,Sentence
4130,மண்ணாங்கட்டி நடுங்குகிறான்.
4131,அவர்களை நோக்கி ஓடுவதை மண்ணாங்கட்டி பார்க்கிறான்.
4132,அவன் உள்ளமும் கைகால்களும் நடுங்குகின்றன.
4133,"மண்டையுடைந்தோடும், அந்தக் குறவனைப் பின் பற்றி மண்ணாங்கட்டி ஓட முயல்கிறான்."
4134,ஆயினும் குறவன் மறைந்து விடுகின்றான்.
4135,மண்ணாங்கட்டி ஏரிக்கரையிலிருந்த ஓர் ஆல மரத்தின் மேல் ஏறி நடப்பதைப் பார்க்கும் கருத்தால் காத்திருக் கிறான்.
4136,"சிறிது நேரத்தில் பெரிய பண்ணையும், அவர் ஆட்கள் சிலரும் குறவர் குடிசையை நோக்கி வருகிறார்கள்."
4137,குறவர்கள் பலர் பிள்ளை குட்டிகளுடன் வீட்டைவிட்டு வெளிநோக்கி ஓடி மறைகிறார்கள்.
4138,மண்டையை உடைத்த குறவன் தலையைத் துணியால் மறைத்துக் கொண்டு அச்சத்துடன் ஓடி மறைகிறான்.
4139,"பெரிய பண்ணையாரும் ஆட்களும் மண்டையுடைந்த குறவனும், குடிசைகளை அடைகிறார்கள்."
4140,"பல மண்வெட்டிகள், இருப்புப் பாரைகள், தோண்டி எடுக்கப்படுகின்றன."
4141,குடிசைகளிலும் மண்வெட்டிகள் எடுத்து ஒருபுறமாக வைக்கப்படுகின்றன.
4142,ஆட்கள் சிலர் குறவர் ஓடிய வழிநோக்கி விரைவாகச் செல்லுகிறார்கள்.
4143,பெரிய பண்ணையார் வீடு நோக்கிச் செல்லுகிறார்.
4144,பதினைந்து இரவு பத்து மணியாகிறது பெரிய பண்ணையார் வீட்டு மணிப் பொறியில்!
4145,நகரத்தினின்று குதிரைகள் பெரிய பண்ணையாரின் வீட்டை நோக்கி வருகின்றன.
4146,குதிரைகளினின்று இறங்கிய அரசினர் பெரிய பண்ணையாரை சூழ்ந்து கொள்ளுகிறார்கள்.
4147,அவர் இரு காவலர்பால் ஒப்படைக்கப்படுகிறார்.
4148,"மற்றும் காவலர் பலரும், ஏழை மக்களின் வீட்டுக்கிருவர் விழுக்காடு சூழ்ந்துகொள்ளுகிறார்கள்."
4149,ஒவ்வொரு குடும்பத்தின் தந்தை தாய் பிள்ளைகளும் ஒன்று சேர்த்துச் சங்கிலியால் பிணிக்கப்படுகிறார்கள்.
4150,ஏழை மக்களின் குடும்பங்கள் அனைத்தும் பிணிக்கப்படுகின்றன.
4151,மண்ணாங்கட்டி கண்ணீர் விடுகிறான்.
4152,ஒரு புறமாக ஓடுகிறான்.
4153,வேறு புறமாக ஓடிவருகிறான்.
4154,"இதே நேரத்தில், மண்டையுடைந்த குறவனை இருவர் அவன் கைகளைக் கட்டியபடி பிடித்து வருகிறார்கள்."
4155,ஊரில் காவலர் நிறைந்திருப்பதை அவர்கள் பார்க்கிறார்கள்.
4156,ஆயினும் அவர்கள் அக்குறவனை ஊரில் அருகிலிருந்த மாந்தோப்பில் ஒரு மரத்தில் கட்டிவிட்டுச் சிறிது தொலைவில் உட்காருகிறார்கள்.
4157,சிறிது நேரத்தில் அவர்கள் உறங்கத் தொடங்குகிறார்கள்.
4158,இதைக்கண்ட மண்ணாங் கட்டியின் முகம் துன்பக் கடலில் மூழ்குகிறது.
4159,அவன் தன் இடையில் இருந்த இறகு தாள் எடுத்து ஏதோ எழுதுகிறான்.
4160,எழுதிய தாளோடு தான் எடுத்த சுழல் துப்பாக்கியையும் சேர்த்துக் கட்டுகிறான்.
4161,பெரிய பண்ணையாரைச் சூழ்ந்திருந்த காவல் தலைவரின் எதிரில் விழும்படி அதைத் தொலைவிலிருந்து விட்டெறிகிறான்.
4162,காவல் தலைவர் அதை ஆவலாய் எடுத்துப் பிரித்துப் பார்க்கிறார்.
4163,சிறிது நேரத்தில் தலைவரும் ஏறக்குறைய இருபது காவலரும் குதிரை ஏறி ஏரிக்கரைக்கு அப்புறமுள்ள சிற்றூர் நோக்கிப் புறப்படுகிறார்கள்.
4164,"பதினாறு நள்ளிருளில் மண்ணாங்கட்டி, தோப்பில் கட்டப்பட்டிருக்கும் குறவனைச் சுற்றிச் சுற்றி வருகிறான்."
4165,குறவனைக் கட்டியவர்கள் உறங்குமிடத்தை நெருங்குகிறான்.
4166,அவர்கள் நிலையை உற்றுப் பார்க்கிறான்.
4167,விரைந்து வந்து கட்டப்பட்டிருக்கும் குறவனை அவிழ்க்கிறான்.
4168,குறவன் விரைவாக ஓடி மறைகிறான்.
4169,உறங்கிய வர்கள் திடுக்கிட்டு விழிக்கிறார்கள்.
4170,மாமரத்தை விரைவில் அடைகி றார்கள்.
4171,மண்ணாங்கட்டியைப் பிடிக்கிறார்கள்.
4172,கட்டி விடுகிறார்கள்.
4173,மண்ணாங்கட்டி தாக்கப்படுகிறான்.
4174,இரண்டு தடிகள் மாறிமாறி மண்ணாங்கட்டி மேல் பாய்கின்றன.
4175,அடிகள் நின்றபோதெல்லாம் அவன் விழிகள் ஏழை மக்களின் வீட்டை நோக்குகின்றன.
4176,அடித்தவர்கள் சற்று தொலைவில் சென்று உட்காருகிறார்கள்.
4177,இருள் நிறம் கட்டுக் குலைகிறது.
4178,கருநிற வானில் வெண்ணிறம் மிதக்கத் தொடங்குகிறது.
4179,சங்கிலியால் பிணிக்கப்பட்டுத் தத்தம் குடிசைக்கு நேரில் நிற்கும் ஏழை மக்களின் விழிகள் கோழியை மூடி வைத்துள்ள கூடையைப் பார்க்கின்றன.
4180,மீண்டும் அவ்விழிகள் தம் கைகள் விலங்கிடப் பட்டிருப்பதைப் பார்த்து நீர் சொரிகின்றன.
4181,கிழக்கில் இளங்கதிர் தலை நீட்டுகின்றது.
4182,மண்ணாங் கட்டிக்குக் காவல் இருப்போர் கிழக்கே பார்க்கிறார்கள்.
4183,அதே நேரத்தில் ஏரிக்குப் புறத்திலுள்ள சிற்றூருக்குச் சென்ற காவல் தலைவன்.
4184,ஊரில் நுழைகிறான்.
4185,மண்ணாங்கட்டியை நோக்கி விரைவாகக் கையில் தடியுடன் வருகிறார்கள் முன்னே அடித்தவர்கள் மற்றும் வேலையைத் தொடங்குகிறார்கள்.
4186,மண்ணாங்கட்டி விலங்கிடப்பட்ட மக்கள் பால் செலுத்திய ஆவல் முகம் திடுக்கென அதிர்கிறது.
4187,"மண்ணாங் கட்டியின் உடலில் ஓங்கியடிக்கும் தடிகள், உடலிலேயே பதிகின்றன."
4188,அவன் தலையில் செந்நீர் அருவி இழிகின்றது.
4189,மண்ணாங்கட்டி ஆவலோடு ஏழை மக்களின் நிலையைப் பார்க்கிறான்.
4190,"அவன் கழுத்து, தலையைச் சுமக்க மறுத்துவிடுகிறது."
4191,தொங்குகின்ற தலையிலிருக்கும் விழிகள் ஏழை மக்களின் வீட்டை நோக்குகின்றன.
4192,மற்றோர் அடி.
4193,மண்ணாங்கட்டியின் தலை விழுகிறது.
4194,வீடுதோறும் சங்கிலியாற் பிணித்து நிறுத்தப்பட்டிருந்த ஏழை மக்கட்கு மீட்சி கிடைக்கின்றது.
4195,காவலர்கள் அவர்களின் விலங்கு களை அகற்றுகின்றார்கள்.
4196,விடுபட்ட ஏழை மக்கள் ஒன்று கூடுகின் றார்கள்.
4197,அவர்கள் கண்கள் யாரையோ தேடுகின்றன.
4198,கூட்டம் அங்குமிங்கும் போகின்றது.
4199,தோப்பை நோக்கி ஆவலாக அவர்கள் ஓடி வருகிறார்கள்.
4200,காலைக் கதிர் வெளிச்சம் காட்டுகின்றது.
4201,"தோள்மேல் விழுந்து கிடந்து, செங்குருதி ஒழுக விழிகள், விடுபட்ட மக்களை நோக்குகின்றன."
4202,மண்ணாங்கட்டியின் இதழ் விலகுகிறது.
4203,முத்துப்பற்கள் திகழ்கின்றன.
4204,வாய்க்கடையிற் சிரிப்பு மின்னுகிறது.
4205,கண்ணில் பெருமகிழ்ச்சி மலர்கிறது.
4206,அவன் தலை நிமிர்ந்தது!
4207,ஆயினும் பழையபடி வீழ்ந்தது.
4208,மக்கள் ஓடி மொய்த்துக் கட்டவிழ்த்தார்கள்.
4209,"அடித்தவர்கள் கண்களில் அச்சமும், வியப்பும் தோன்றுகின்றன."
4210,அவர்கள் கையுதறுகிறார்கள்.
4211,மண்ணாங்கட்டியின் தலை மற்றொரு முறை நிமிருமா!
4212,அவன் நீண்ட அமைதியில் நிலைத்துவிட்டான்.
4213,ஏழை மக்கள் அள்ளியணைத்த மண்ணாங்கட்டி பத்தரை மாற்றுப் பொன்னாங்கட்டி!
4214,முன்னுரை ஆம் ஆண்டு வாக்கில் நான் தமிழரசில் முறையாகக் கட்டுரை கவிதை எழுதி வந்தேன்.
4215,அதற்குரியவர் உயர்திரு.
4216,டாக்டர் மே.
4217,மாசிலாமணி முதலியாராவார்.
4218,அவர் இல்லத்தில் யான் இடை யிடையே தொடர்பாகக் பன்னாள் தங்குவதுண்டு.
4219,"அப்போதெல்லாம் முதலியார் எனக்குத் தந்தை போல் உண்டி, உறையுள் தந்து காத்து வருவார்."
4220,தமிழரசு நிலையத்தில் எழுதியதாகும் இச் சௌமியன் நாடகம்.
4221,"மேலட்டை, முகவுரை சேர்க்குமுன் வையப் பெரும் போர் தொடங்கிவிட்டது."
4222,இந்நாள் குறை முடித்து வெளியிடலாயிற்று.
4223,இப்பணியில் டாக்டர் எனக்குச் செய்த உதவி மறப்பதரிது.
4224,பாரதிதாசன் காட்சி இடம் வஞ்சிக்கிராமம் குடியானவர் வீடு.
4225,"உறுப்பினர் குடியானவன், சீனன், பூங்கோதை, சேவகன்."
4226,அதிர்ஷ்டம் வருகிறது உனக்கு!
4227,சொல்லிக்கொண்டே குடியானவன் வீட்டில் நுழைந்தான் கிராமச் சேவகன்.
4228,"சீனன் என்னும் வஞ்சிக் கிராமத்துக் குடியானவன், தன் மகள் பூங்கோதைக்கு நிச்சயித்திருந்த கலியாண மகிழ்ச்சியிலிருந்தான்."
4229,சேவகனைக் கண்டதும் அவன் திடுக்கிட்டான்.
4230,சந்தோஷ உள்ளத்தில் அச்சம் . வாங்க உக்காருங்க என்ன சேதிங்க?
4231,பயத்தோடு கேட்டான் குடியானவன் சேவகன் இனி உனக்கு என்ன குறைச்சல்!
4232,நான் கூட இனி உனக்குப் பயந்துதான் நடக்க வேண்டும்.
4233,குடியானவன் நீங்க இந்த ஏழைக்குப் பயப்படுவதாவது.
4234,"சேவகன் கிராமபதி உன்னிடம் அகப்பட்டுக் கொண்டார் இனி, நீ சொன்னபடிதான் அவர்."
4235,"குடியான ஐயா, எனக்கு ஒண்ணும் புரியலிங்களே."
4236,சேவகன் நேற்றுக் கிராமபதியவர்கள் கிராமத்தைச் சுற்றி வந்தாரல்லவா?
4237,அவர் கிருபை உன் குடும்பத்தின் மேல் விழுந்தது!
4238,குடியான இன்னதென்று சொல்லமாட்டேன் என்கிறீங்களே?
4239,சேவகன் உன் மகள் தெரு வாசலில் கோலமிட்டுக் கொண்டிருந் தாளாமே.
4240,குடியானவனுக்கு விஷயம் முற்றும் விளங்கி விட்டது.
4241,தன் ஒரே பெண்ணின் நன்மையில் ஓடியது அவன் நெஞ்சம் குடியான இருக்கலாங்க அதுபற்றி என்னாங்க?
4242,பயத்தோடு . சேவகன் வேறொன்றுமில்லை.
4243,கிராமபதியவர்களின் வீட்டில் தோழிப்பெண் இல்லை.
4244,குடியான ஐயோ!
4245,என் குடும்பத்தில் அந்த மாதிரி வழக்கம் இல்லிங்களே!
4246,"ஐயா, உங்க காலைப் பிடித்துக் கொள்கிறேன் கிராமபதி ஐயாவுக்குச் சமாதானம் நீங்கதான் சொல்லணும்."
4247,"என்று அங்கு வந்தாள், அச்சமயம் சேவகனைக் கண்டாள், அவளின் சிரித்த உதடு பயத்தால் மாறியது."
4248,திடுக்கிட்டு நின்றாள்.
4249,வேறு வழியில்லை.
4250,பழையபடி பறந்தாள் . சேவகன் கூப்பிடு!
4251,அவள் தானா உன் மகள்?
4252,குடியானவன் மனம் பயத்துக்கு அப்பால் போய்விட்டது அதெல்லாம் முடியாது!
4253,"என்று கண்டிப்பாகக் கூறினான், சேவகன் உன் மகளை நான் சொல்வதைக் கேள் உன் மகளைக் கிராமபதியிடம் அனுப்பு."
4254,அவர் உன் மகள் ஞாபகமாகவே இருப்பார்.
4255,அவள் பச்சைக்கிளி போல் இருக்கிறாள்.
4256,இதைக்கேட்ட குடியானவன் மரம்போல் சும்மா இருந்து தனக்குச் சிறிதும் சம்மதம் இல்லாமையைத் தெரிவித்தான்.
4257,"சேவகனுக்குக் . சேவகன் அவளைக் கையோடு இழுத்துவா என்று கிராமபதி என்னிடம் கூறியிருந்தால், விட்டுப்போகமாட்டேன்."
4258,அடே வந்ததைப் படு!
4259,கோபத்தோடு சென்றான்.
4260,ஆட்கள் கோணிப் பைகளில் நெல்லை வாரிக் கட்டிக் கொண்டிருந்தார்கள்.
4261,உக்கிரம் இல்லாத அந்தி புழுக்கமில்லாத சமயம்.
4262,கலகம் செய்வதும் கைப்பொருள் கவர்வதும் கயவர் செய்கை ஆயினும் அன்னது சிலதினங்கள் இருக்கும் பின் அது தீர்ந்து போகும்.
4263,செம்மை யுண்டாகுமே!
4264,ஓர் தமிழ்ப்பாட்டு குடியானவன் காதில் வீழ்ந்தது.
4265,"எதிரில் ஆசிரமவாசி ஒருவன், ஆலமரத்தின் அடியில் நிற்பதைக் குடியானவன் கண்டான்."
4266,அதே சமயத்தில் இரு சேவகரும் கொள்ளைக்காரரும் குடியானவனை நோக்கி வந்தார்கள்.
4267,குடியானவன் மரத்தில் கட்டப்படுகிறான்.
4268,நெற்குவியல் கொள்ளையடிக்கப்படுகிறது.
4269,குடியான அரசாங்கம் இல்லை நீதியில்லை!
4270,என்று கூவியழுதான் ஆலமரத்தடியில் இரு கண்கள் எரிந்தன.
4271,ஆரமவாசி தன் உடைவாளை உருவுகிறான்.
4272,அதற்குள் கொள்ளைக்காரரும் சேவகரும் போய் விட்டார் கள்.
4273,"ஆரமவாசி குடியானவனை , ஆரமி ஐயா, என் கைகள், என் குருவினால் கட்டப்பட்டிருக் கின்றன.!"
4274,குடியான அப்பனே!
4275,நீ பார்த்திருந்தாயல்லவா இந்தக் கீழான நடவடிக்கைகளை?
4276,கிராமபதியிடம் செல்லுவோம்.
4277,ஆரமி ஞாயம் கிடைக்குமென்று நினைக்கிறீரா?
4278,என்னால் தடையில்லை.
4279,சொல்லிக் குடியானவனைக் கூட்டிக் கொண்டு கிராமபதியிடம் நடந்தான் . காட்சி ஆ பல சேவகர்கள் சகிதம் கிராமபதி உட்கார்ந்திருந்தான்.
4280,இரு சேவகர்கள் பூங்கோதையை இழுத்து வந்தார்கள்.
4281,அவள் அவர்கள் கைகளினின்று தப்பிப் பறந்துபோக முயன்றாள்.
4282,"அந்தச்சிறகு அற்ற அன்னம், மீண்டும் இழுத்து நிறுத்தப்பட்டாள் கிராமபதி எதிரில் பூங்கோதை என்னை ஏன் தொல்லை பண்ணுகிறீர்கள்?"
4283,"என்று துடிதுடிப்போடு கேட்டாள் கிராமபதி நீ என் வீட்டில் தோழிப் பெண்ணாயிருந்தால், உனக் கென்ன முழுகிவிடும்?"
4284,எல்லாச்சுகமும் உனக்கு உண்டாகுமே!
4285,"பூங்கோ வேண்டாம் ஐயா, என்று அழுது நிற்கையில் ஆரமியும், குடியானவனும் வந்தனர்."
4286,குடியானவன் தன் மகள் அங்குத் துன்புறுவதைக் கண்டு ஆத்திரத்தோடு இது ஞாயமா ஐயா?
4287,கலியாணம் ஆகவேண்டிய பெண்ணாச்சுதே!
4288,கிராமபதி ஏன் ஆரமியே!
4289,நீ எங்கு வந்தாய்?
4290,ஊர் விவகாரத் தில் கலந்து கொள்ளக்கூடாது என்று உனது குரு சந்த்ரசேனர் உனக்குக் கட்டளை இட்டிருக்க வில்லையா?
4291,ஆரமி ஆம்!
4292,கிராமபதி அப்படியா!
4293,என்ன நடந்தது?
4294,சேவகன் நானும் தண்டலதிபரும் இந்தக் குடியானவனிடம் போய் வரி கேட்டோம்.
4295,என்னையடித்ததோடு இந்த ஆரமியும் குடியானவனும் தங்களையும் தங்கள் ஆட்சியையும் குறை கூறினார்கள்.
