Line Number,Sentence
967,"ஆகவே, தொல்காப்பியஞ் செய்யப்பட்டு நீண்ட காலத்துக்குப் பின்னரே தவிர்க்கப்பட்ட சகர முதற் சொற்களும் பிறவும் நூல்களில் வழங்கப்பட்டிருத்தல் வேண்டும்."
968,பாணினி முனிவர் குறிப்பிடுகின்ற ஆசியர்களுள் இந்திரன் என்பார் ஒருவராகக் காணப்படுகின்றனர்.
969,பாணினிக்குப் பின் பாணினீயமே எவராலும் கைக்கொள்ளப்பட்டு வருகின்றது.
970,தொல்காப்பியர் பாணினிக்குப் பின்னிருந்தவராயின் தொல்காப்பியத்தில் ஐந்திரம் என்பதற்குப் பதில் பாணினீயமே கூறப்பட்டிருக்கும்.
971,பாணினி முனிவர் கி.மு.
972,"ஆம் நூற்றாண்டில் விளங்கியவர் என்று சிலரும், கி.மு."
973,ஆம் நூற்றாண்டில் விளங்கியவரென வேறு சிலரும் கூறுவர்.
974,"ஆகவே, தொல்காப்பியர் கி.மு."
975,ஆம் நூற்றாண்டுக்குப் பிந்தியவரல்லார்.
976,வடசொல் வடசொல் என்பதற்கு இளம்பூரணவடிகள் ஆரியர் சொற் போலுஞ் சொல் எனப் பொருள் கூறினார்.
977,தமிழின் பகுதியாகிய வட சொல் நன்றாகச் செய்யப்பட்டுச் சமக்கிருதம் என்னும் பெயர் பெற்றதென் பது சிலர் கருத்து.
978,யாழ்ப்பாணத்துப் பேரகராதியில் வடசொல் கிரந்தம் என்னுஞ் சொற்களுக்கு வடதமிழ் என்னும் பொருள் காணப்படுகின்றது.
979,வடசொல் வடதமிழாயின் அது தமிழேயென்பது துணிபு. ஆரியர் பேசுந் தமிழை நகைச்சுவைக்கு உதாரணமாகப் பேராசிரியர் காட்டுகின்றனர்.
980,ஆரியர் திருத்தமில்லாத பேச்சுடையவராதலினாலேயே அவரைத் தமிழர் திருந்தாத மொழியுடையவர் என்னும் பொருள்பட மிலேச்சர் என்னும் பெயராலழைத்தனர்.
981,"ஆனால், தொல்காப்பிய காலத்தில் வடசொல் தவிர மற்ற இரண்டு சொற்களும் உலகில் எங்கேனும் இருந்தனவா?"
982,இருப்பின் தமிழ் கூறு நல்லுலகத்தில் வழங்கினவா?
983,வழங்கின் மூன்று சொற்களும் ஒரு பொருளினவாக வழங்கினவா என்பன இன்னும் ஆராய்ந்து தெளிதற்குரியன.
984,தமிழில் வழங்கும் சொல் வகைகள் நான்கினுள் இயற்சொல் முதன்மையானது வடசொல் கடைப்படியிலுள்ளது.
985,வடசொல்லென்பது தமிழுக்குரிய சொல்லென்று நேராகவே பொருள் கொள்ள இடங்கொடுப் பது.
986,உய்த்துப் பொருள்கோடல் வேண்டாதது.
987,அத்தகைய வடசொல் என்னுந் தமிழ்ச்சொல் தான் என்னை?
988,என்கிற ஆராய்ச்சிக்குத் தொல்காப்பியத்தினின்றே ஆரியச் சொல்தான் அல்லது சமக்கிருதந்தான் என்று தெளிவிக்கக்கூடிய கூற்று எனக்கெட்டிய வரையில் கிடைக்கவில்லை.
989,"அவ்வாறாகத் திசைச் சொல்லென்பதையுஞ் சொல்லி, வடசொல்லென்பதையுஞ் சொல்லவேண்டியதன் பொருட்டு விளங்கவில்லை."
990,வடசொல்லென் பதைத் திசைப்பொருளில் வழங்கியிருத்தல் பொருந்தாததாகத் தோன்று கிறது.
991,தொல்காப்பிய காலத்தில வடக்கு என்னுஞ் சொல் எவ்வெப்பொரு ளில் வழங்கியதென்பது காட்ட நமக்கு நிகண்டுமில்லை அகராதியுமில்லை.
992,வடக்கிருத்தல் என்னுஞ் சொற்றொடரொன்று உளது.
993,"அத் தொடரிலேனும் வடக்கென்பது திசையைக் குறிக்காது, ஊண் துறந்திருத் தலையே குறிக்கின்றது."
994,ஆனால் தீர்க்கமாகச் சொல்லற்கேற்ற சான்றுகள் இதுவரையில் கிட்டவில்லை. .
995,"தொல்காப்பியர் கூறும் மறை தொல்காப்பியர் பல்லிடங்களிற் குறிப்பிட்டுள்ள மறை, தமிழ் நூலேயெனக் கருத இடமுண்டு."
996,வியாசர் வேதங்களை நான்கு கூறுபடுத்துவதன்முன் தொல்காப்பியம் இயற்றப்பட்டதென்பது நச்சினார்க்கினியர் கூற்று.
997,திருவாளர் பா.வே.
998,வியாசருக்கு முந்திய தொல்காப்பியத்தில் வியாசருக்குப் பிந்தியதும் அவரால் திருத்தப்பட்டதுமான ஆரிய வேதங்களினின்று உய்த்துப் பொருள்கோடல் ஆர்க்கியாலாஜிகல் முறைக்கு ஒவ்வாது.
999,தொல்காப்பியத்திற் சொன்ன மறை இத்தகைய தென்பது தெரிவதற்கு நூலாவது சுருதியாவது இப்போதில்லை.
1000,ஆனால் அந்த அந்தணர் யாவர்?
1001,அவர் மறையாது? என்பனதான் புலப்படாதவற்றுட் சில.
1002,வடவேங்கடந் தென்குமரி ஆயிடைத் தமிழ் உலகத்து அந்தணர் என்பாரும் சிந்து நாட்டுப் பராமணரென்பாரும் ஒன்றேயா?
1003,தமிழ்நாட்டு அந்தணர் மறையும் சிந்து நாட்டுப்பிராமணர் வேதமும் ஒன்றேயா?
1004,உட்கிடை வேற்றுமை கண்டு அன்றென்பதா?
1005,"தொல்காப்பியஞ் சொன்ன தமிழகத்து அந்தணர் மறை, வியாசருக்குப் பிந்திய ஆரியவேத மன்றென்பதற்குச் சான்று தொல்காப்பிய நூலிற் பல்லிடங்களிற் காணலாம்."
1006,சிற்சிலவே இம்முடங்கலில் குறிக்க வியலும்.
1007,ஆயினும் அவையல் கிளைவிகளை மாத்திரம் ஆரிய மொழியில்தான் வழங்குவார்கள்.
1008,பழைய திராவிடருக்கும் ஆரியருக்கும் இடையிலிருந்த வெறுப்பு இன்றும் குறிச்சான் என்னும் மலையாள மலைச்சாதியினர்களிடையே காணப்படுகின்றது.
1009,இவர்கள் தமிழ்நாட்டுக் குறவரை ஒத்தவர்கள்.
1010,பிராமணன் ஒருவன் இவர்கள் வீட்டில் நுழைந்தால் இவர்கள் அத் தீட்டைப் போக்குவதற்கு வீட்டைச் சாணியால் மெழுகுகிறார்கள்.
1011,தமிழ் ஆராய்ச்சி பக்..
1012,"மந்திரம் நிறைமொழி மாந்தர் ஆணையிற் கிளந்த, மறைமொழி தானே மந்திர மென்ப என மந்திரப் பண்பு தொல்காப்பியத்துட் கூறப்பட்டது."
1013,திரி திரி சுவாகா கன்று கொண்டு கறவையும் வத்திக்க சுவாகா எனக் காட்டியுள்ளார்.
1014,சமக்கிருத மொழியிற் சொல்லப்படுவன வெல்லாம் மந்திரங்களென ஒரு பிழையான விளக்கம் நம்மவர் பெரும் பாலார் உள்ளத்தில் வேரூன்றி யிருக்கின்றது.
1015,இது சமக்கிருத மொழியைச் சமய மொழியாகக் கொண்டதினால் நேர்ந்ததாகும்.
1016,தமிழ் நூல்களின் அழிவு தமிழுக்குக் காலாந்தரத்தில் இரண்டு பெரும் பூதங்களால் இரண்டு பேரிடையூறுகள் நிகழ்ந்தன.
1017,இவர்கள் கைக்குத் தப்பிய சின் னூல்களே நமக்குப் பெரிய அரிய நூல்களாயின.
1018,ஒரு நாவிதன் அலங்காரம் என்னும் நாவிதநூல் இயற்றி அரசனிடம் பரிசு பெற்றதாகச் சிந்தாமணியிற் சொல்லப்படுகிறது.
1019,வீமனாற் செய்யப்பட்ட மடைநூலொன்று உளதாகச் சிறுபாணாற்றுப்படை கூறுகின்றது.
1020,இன்ப சாகரம் முதலிய பல இன்ப நூல்கள் இறந்தன என்ப.
1021,காமக்கணிகையர்க்கு அறுபத்துநான்கு கலைகள் உரித்தாக மணிமேகலையிற் சொல்லப்படு கிறது.
1022,இன்னும் கந்தர்வநூல் கருடநூல் மந்திரநூல் கணக்குநூல் முதலிய பல நூல்களைப்பற்றி யாப்பருங்கல விருத்தியிற் சொல்லப்படுகின்றது.
1023,தமிழ்ச் சொற்கள் பிறமொழிகளில் புகுங்கால் அம்மொழி இயைபுக் கேற்பத் திரித்து வழங்கப்படும்.
1024,அப்படியே பிறமொழிச் சொற்கள் தமிழிற் புகுங்கால் அவை தமிழின் அமைதிகேற்பத் திரித்து வழங்கப்பட்டன.
1025,இம்முறையினால் அவை தமிழ்ச் சொற்களோ அன்றோவெனப் பிரித்தறிவது அரிதாயிருந்தன.
1026,பிற்காலங்களில் இம்முறை கவனிக்கப்படாது விடப்பட்டது.
1027,"ஆரியச் சொற்கள் கணக்கின்றித் தமிழுடன் கலக்கப் புகுந்த பிற்காலத்தில், அவை தம்முருவுடனேயே வழங்கப்படலாயின."
1028,அதனால் தமிழின் சுவை பெரிதுங் குறைவுற்றது.
1029,"ஒரு பொருளைக் குறிப்பதற்குரிய தமிழ்ச் சொல்லிருப்ப, அதனைப் பிறமொழிச் சொற்களால் வழங்கத் தலைப்படுதல் தமிழின் அழிவுக்கு ஏதுவாகும்."
1030,அப்பால் முன் எண்ணூறு வருடம் இதிகாச காலம்.
1031,பற்பல புராண காவியங்களும் கலைஞான நூல்களும் இக்காலத்தில் எழுதப்பட்டனவாயினும்.
1032,"தமிழிற் சிறந்த இதிகாசங்களாகிய நைடதம், பாரதம், இராமாயணம், இரகுவமிச மென்பன தோன்றிய காலமாதலின், இதிகாசகால மென்றாம்."
1033,இதனாற் றமிழுக்கு வருங் கெடுதியைக் குறித்து மிகவும் அஞ்ச வேண்டியிருக்கிறது.
1034,வீ.ப.உரை. .
1035,தமிழர் நாகரிகம் .
1036,இவற்றால் பூமிக்கு நானிலம் என்னும் பெயர் தமிழில் வழங்குவதாயிற்று.
1037,இவர் இவர் இன்ன இன்ன நிலத்தில் உறைபவர் என்பதைக் குறிக்கும் பெயர்களுண்டு.
1038,அப்பெயர் ஆடவருக்கும் மகளிருக்கும் வெவ்வேறாக வழங்கின.
1039,"குறிஞ்சி நில மக்களுள் கல்வி, கேள்வி, வீரம் முதலியவற்றால் ஒப்புயர்வற்றனாகிய ஆடவன், பொருப்பன்."
1040,"வெற்பன், சிலம்பன் எனப்படுவன்."
1041,இவனே இந்நிலமக்களின் தலைவன்.
1042,மற்ற ஆடவர் கானவர் எனப்படுவர்.
1043,"கல்வி முதலியவற்றால் அங்ஙனஞ் சிறந்த பெண் குறத்தி, கொடிச்சி யெனப்படுவாள் இவள் இந்நிலத் தலைவன் மனைக்கிழத்தி."
1044,மற்றைப் பெண்கள் குறத்தியர் எனப்படுவர்.
1045,முல்லைநில மக்களுள் முற்கூறியாங்குச் சிறந்த ஆடவன் குறும்பொறைநாடன் தோன்றல் எனப்படுவன்.
1046,இவன் இந்நில மக்களின் தலைவன்.
1047,"மற்றை ஆடவர் இடையர், ஆயர் எனப்படுவர்."
1048,"முற்கூறியாங்குச் சிறந்த பெண் மனைவி, கிழத்தி எனப்படுவாள்."
1049,"இவள் இந்நிலத் தலைவன் மனைவி, மற்றைப் பெண்கள் இடைச்சியர் எனப்படுவார்கள்."
1050,"மருதநில மக்களுள் அங்ஙனம் உயர்ந்த ஆடவன் ஊரன், மகிழ்நன் எனப்படுவன் இவன் இந்நிலமக்களின் தலைவன்."
1051,"மற்றை ஆடவர் உழவர், கடையர் எனப்படுவர்."
1052,"முற்கூறியாங்குச் சிறந்த பெண் கிழத்தி, மனைவி எனப்படுவாள் இவள் இந்நிலத் தலைவன் இற்கிழத்தி."
1053,மற்றைப் பெண்கள் உழத்தியர் கடைசியர் எனப்படுவார்கள்.
1054,நெய்தல் நில மக்களுள் முற்கூறியாங்குச் சிறந்த ஆடவன் சேர்ப்பன்.
1055,புலம்பன் எனப்படுவன் இவன் இந் நில மக்களின் தலைவன்.
1056,"மற்றை ஆடவர் பரதர், அளவர், நுளையர் எனப்படுவர்."
1057,"முற்கூறியாங்குச் சிறந்த பெண் பரத்தி, நுளைச்சி எனப்படுவாள் இவள் இந்நிலத் தலைவன் மனைவி."
1058,"மற்றைப் பெண்கள் பரத்தியர், அளத்தியர், நுளைச்சியர் எனப்படுவார்கள்."
1059,"பாலை நில மக்களுள் முற்கூறியாங்குச் சிறந்த ஆடவன் விடலை, காளை, மீளி எனப்படுவன் இவன் இந்நிலமக்களின் தலைவன்."
1060,மற்றை ஆடவர் எயினர்.
1061,மறவர் எனப்படுவர்.
1062,முற்கூறியாங்குச் சிறந்த பெண் எயிற்றி எனப்படுவாள் இவள் இந்நிலத் தலைவன் மனையாள்.
1063,"மற்றைப் பெண்கள் எயிற்றியர், மறத்தியர் எனப்படுவார்கள்."
1064,தமிழர்கள் பண்டைக் காலத்தில் இங்ஙனம் நிலம் பற்றிய பகுப்பையே உடையவர்களாயிருந்தார்கள்.
1065,நிலம் பற்றிய இப்பகுப்பு உயர்வு தாழ்வைக் குறித்து வந்ததன்று இவர் இன்ன நில மக்கள் என்பதை உணர்த்தும் அளவினதேயாகும்.
1066,"இப்பகுப்பு எதுபோன்ற தெனில் இவன் கோவூரான், இவன் குன்றத்தூரான், இவன் காஞ்சிபுரத்தான், இவன் காவேரிப்பாக்கத்தான் என்பன போன்றதாகும். ."
1067,சாதி பழைய தமிழர்கள் பிறப்பினால் உயர்வு தாழ்வு கற்பிக்கவில்லை.
1068,ஒவ்வொருவரும் தம் சீவனத்தின் பொருட்டு மேற்கொண்ட தொழில்கள் பற்றியே சாதி ஏற்படுவதாயிற்று.
1069,தகப்பனாயுள்ள ஒருவன் தான் பிழைப்புக் காகச் செய்துவந்த தொழிலையே தன் மகனும் பின்பற்ற வேண்டுமென விரும்புவதியல்பு.
1070,இவ்விருப்பமே தொடக்கத்தில் தனித்தனி சாதி தோன்று வதற்குக் காரணமாயிருந்தது.
1071,இப்போது ஒவ்வொரு சாதியினரைக் குறிக்கும் பெயரும் அவ்வவர் மேற்கொண்டிருக்கும் தொழிலைப் பற்றிய தாகவே காணப்படுகின்றது.
1072,பிற்காலத்து ஒவ்வொரு குலமும் பிறப்பினாலே உண்டானதென்னும் நம்பிக்கை உண்டாயது.
1073,"ஆரிய நாட்டவர்க்குரிய சாதிக் கட்டுப்பாடு, சமயம், பழக்க வழக்கம் முதலாயின தமிழரினின்றும் புறம்பானவை."
1074,முதற்கண் அவர்கள் சாதிப் பிரிவு நிறம்பற்றி ஏற்பட்டது.
1075,வருணம் என்னும் பெயரே அதனைப் புலப் படுத்துகின்றது.
1076,இவர்களுக்கு அடிமைத் தொழில் மாத்திரம் உரித்து.
1077,இவற்றின் பிரிவு அவர்கள் நீதிநூல்களாகிய மிருதிகளில் பரக்கக் காணலாம்.
1078,உதாரணம் பிராமணனுக்கு வைசிய நங்கையிடத்திற் பிறந்தவன் அம்பஷ்டன்.
1079,இவனுக்குத் தொழில் இரண வைத்தியஞ் செய்தல்.
1080,க்ஷத்திரியனுக்குப் பிராமணப் பெண்ணிடத்துப் பிறந்தவன் சூதன்.
1081,இவனுக்குத் தொழில் தேரோட்டுதல்.
1082,"இக்கருத்தைத் தழுவியே பிற்காலத்து விளங்கிய இளம்பூரண வடிகள், நச்சினார்க்கினியர், பேராசிரியர் முதலாயினோர் நூல்களுக்குகுரை வகுத்தனர்."
1083,அது பெரும் பிழையாம்.
1084,கவிச்சக்கரவர்த்தியாகிய கம்பநாடர் தொல்லாசிரியர்களின் கருத்தை நன்குணர்ந்தவராதலின் வேளாளரைச் சூத்திரரென எங்குங் கூறாராயினார்.
1085,பிராமணர் க்ஷத்திரியர் வைசியர் சூத்திரர் என மக்களை நான்கு குலங்களாகப் பிரிக்கும் முறை முற்றும் தென்னாட்டவர்க்குப் புதிது.
1086,பிராமணர்களுடைய கருத்துக்களும் கொள்கைகளும் எல்லாப் பகுதிகளி லும் பரவியிருந்த போதும் அவை முற்றாக வெற்றி பெறவில்லை.
1087,"திராவிட மொழிகள் வழங்கும் நாடுகளில் மக்களிடையே பழைய காலத்தைய ஆரியரல்லாதாரின் வழிபாடுகளும் பழக்க வழக்கங்களுமே, காணப்படு கின்றன."
