Line Number,Sentence
2607,"இவ் விரண்டற்ற ஒருமை நிலையே அவர்களை, வீழ்வார்க்கு வீழ்வார் விரும்புவார்க்கு விரும்புவார் ஆக்கி வைக்கின்றது."
2608,வீழ்வார் என்னும் இரண்டுள்ளும் பால் பொதுமைதானே திகழ்கின்றது!
2609,"வீழ்வாளுக்கு வீழ்வான் என்றோ, விழ்வானுக்கு வீழ்வாள் என்றோ சொல்லாத திட்பம் நனிநயம் மிக்கதாம்!"
2610,உடலால் ஆண் தோற்றம் ஆகலாம் பெண்தோற்றம் ஆகலாம்!
2611,உயிரால் ஆண் தோற்றம் பெண் தோற்றம் உண்டா?
2612,உயிர்க்குப் பால் வேறுபாடு இல்லை என்றால் உயிரொத்த காதல் வாழ்வில் உயர்வு தாழ்வு உண்டா?
2613,உண்டாகலாமா?
2614,உண்டானால் உயிர் ஒத்த காதல் எனப்படுமா?
2615,அது பெண்ணை இழிவுபடுத்துதல் இல்லையா என்பார்!
2616,அவர் ஓரப்பார்வையர்.
2617,"செல்வம், முத்து, மணி, வயிரம், பொன், தங்கம் என்றெல்லாம் பெயரிட்டுப் பெருமையுறப் பாராட்டும் நாவாலேயே பொருள் இழிவு என்கிறாரே!"
2618,தம்பொருள் என்ப தம் மக்கள் என்பதைப் படியாமல் பேசுகிறாரே!
2619,பொருட்டாக எண்ணப்படுதலே பொருள்வழியாக வருவது என்பதைப் புரிந்தும் புரியாமல் புகல்கிறாரே!
2620,இன்னும் என்ன?
2621,பெருங்கனிவால்.
2622,"பெண்மையைப் பேணிக்காக்கும் காப்பே பிறனில் வழையாமை, பெண்வழிச் சேறல், வரைவின் மகளிர் என்வவை என அறிதல் வேண்டும்."
2623,பிறன் கடை நின்றான் அறன்கடை நின்றான் இது பெண்மைப் பழிப்பா?
2624,இல்வாழ்விலோ இன்பப் பாலிலோ இடம் பெறாதவை பெண்வழிச் சேறலும் வரைவின் மகளிரும்.
2625,"கள், சூது என்பவற்றின் முன்னுள்ளவை."
2626,"அவள், மனப் பெண்டும் அல்லள்!"
2627,மணப்பெண்டும் அல்லள்!
2628,"ஆண் கயமைப் பிறவியன்ன, பெண்கயமைப் பிறவியர்."
2629,வரைவு என்பது கட்டு கட்டுப்பாடு கட்டொழுங்கு எல்லை இவற்றை இல்லாப் பிறவியர் வரைவின் மகளிர் எனப்பட்டார்.
2630,"புதுமைப்பெண் என்னும் பாரதியியமும், குறளோவியம் குடும்ப விளக்கு என்னும் பாவேந்தரியமும், பெண்ணின் பெருமை என்னும் திரு.வி.க."
2631,.
2632,எச்சம் வாழையடி வாழையென வந்த திருக்கூட்டம் என்பது வள்ளலார் வாக்கு.
2633,மரபு நிலை திரியா மாட்சி என்பது தொல்காப்பியம்.
2634,அன்றும் இன்றும் ஏன்?
2635,"என்றும், பண்புடையவர்களால் தான் உலகம் உய்கிறது என்பது வரலாறு வாழ்வு."
2636,பண்பாடும் சான்றாண்மையுமே உலகங் காக்கும் தெய்வக் குணங்கள்.
2637,"பண்புடையார்ப் பட்டுண் டுலகம் என்பதும், உலகம் என்பது உயர்ந்தோர் மேற்றே என்பதும் நம் முந்தையர் மொழிகள்."
2638,"வழிவழியாகப் பழிதீர் உலகக் காவலராய் வருவார், எங்கு வருவார்?"
2639,அவரெல்லாம் இல்லறக் கால்முளைகளேயாம்!
2640,"ஆதலால், மங்கலம் என்ப மனைமாட்சி மற்றதன் நன்கலம் நன்மக்கட் பேறு என்றார் பொய்யாமொழியார்."
2641,மக்கள் என்பார் நன்மக்கள் என்றவர் அறிவறிந்த மக்கள் என்றும் சுட்டினார்.
2642,அம்மட்டோ?
2643,அம்மக்கள் பழிபிறங்காப் பண்புடை மக்கள் என்றும் குறித்தார்.
2644,"ஆக, உலக நலங்கருதிய மக்கட்பேறே உயர் மக்கட்பேறு என்பது வள்ளுவம்."
2645,அம் மக்கள் உலக நலங்கருதியவர் எனின்.
2646,"பெற்றோர் நலமோ, உற்றார் நலமோ, ஊர் நலமோ, நாட்டு நலமோ கருதார் என்பதன்று!"
2647,"வள்ளுவம், தன்னில் இருந்து தோன்றி உலகாக வளரும் வளர்ச்சியே சீரிய செவ்விய நேரிய வளர்ச்சி என்பதை அடிப்படையாகக் கொண்டது."
2648,மக்கட் பேற்றின் மாண்பை இவ்வாறு மகிழ்ந்துரைக்கும் வள்ளுவம் மக்கட்பேறு இல்லாமையைப் பழியாகக் கருதாது.
2649,மக்கட் பேறு இல்லாமை ஏன்?
2650,ஆண் மக்கள் இல்லாமை கீழா நரகத்துச் சேர்க்கும் என்னும் கீழானவுரை உரையாது!
2651,அது உடற்கூறு பற்றியது.
2652,உறவு நிலை பற்றியது.
2653,"அறம், பாவம் பற்றிய தன்று!"
2654,என்பது வள்ளுவ உட்கிடை.
2655,மக்கட்பேறு இல்லாமை மாப்பழி என்னும் கருத்து இம்மண்ணில் ஊடாடியது.
2656,களப்போர் புகுந்தாருள் மகப்பேறு பெறாதாரைக் களம் விட்டுச் செல்லுமாறு பறையறைந்த செய்தியும் புறப் பாடலில் உண்டு.
2657,மகப்பேறு இன்றேல் மாண்பு இல்லை என்னும் கருத்தின் ஊடாட்டம் இவை.
2658,"திருவள்ளுவர் மக்கட் பேற்றை மதித்துப் போற்றியவர் எனினும், அம் மக்கட்பேறே மாண்பாவது எனக் கொண்டார் அல்லர்."
2659,அவரவர் இயல் செயல் என்பவையே அம் மக்களினும் உயர் எச்சம் எனக் கண்டார்.
2660,அவையே தனிப் பேரெச்சம் என்றும் கண்டார்.
2661,"இசை அல்லது புகழ் என்னும் எச்சம், என்றும் அழியா எச்சம்!"
2662,என்றும் உலகில் அழியாத ஒன்றாகிய எச்சம் இசை எச்சமே என்றும் கூறினார்.
2663,அவருள் மக்கட்பேறு பெறாதவர் எத்தனை எத்தனை பேர்கள்?
2664,"இவற்றால் மக்கட்பேறு இல்லாமை குறையன்று என்பதும், பழிநிரயத்திற்கு உட்படுத்துவது அன்று என்பதும் வள்ளுவ நோக்காதல் விளங்கும்."
2665,"அறிவன், ஆசான், கொடைஞன், மூத்தான், உற்றுழி உதவியோன் இன்னவரெல்லாம் தந்தையென எண்ணிய எண்ணுதல் தமிழ்மரபில் உண்டு."
2666,பெற்றால்தான் பிள்ளையா?
2667,"என்னும் பெருமொழியும் தமிழ் மண்ணில் வழங்கும் ஈன்றாள், வளர்த்தாள்,."
2668,"பாலூட்டினாள், ஓலாட்டினாள்."
2669,"உதவினாள், மூத்தாள் எனத் தாயரும் எண்ணப்படுதல் வழக்கே!"
2670,புத்தர் பெருமானுக்கு எச்சம் துணையா?
2671,மகனா?
2672,புத்தமே அன்றோ!
2673,கிறித்து பெருமானின் எச்சம் சிலுவைப்பாட்டின் வழி உண்டாய கிறித்தவமே அன்றோ!
2674,வள்ளற் பெருமானார் எச்சம் அருளாட்சியே அன்றோ!
2675,வள்ளுவர் வைத்துச் சென்ற எச்சம் மனையா?
2676,மக்களா?
2677,கட்டடமா?
2678,நிலபுலங்களா?
2679,நம்மறையாம் வள்ளுவமே அன்றோ!
2680,.
2681,பிறப்பொப்பு ஊன் உடம்பு ஆலயம் என மந்திர மொழி மொழிந்த மண் இம்மண்!
2682,ஊன் உடம்பு உடையவை இயங்கு உயிர்கள்!
2683,இவையெல்லாம் ஆலயம் என்ற மண்ணில் பிறப்பு வேற்றுமை புகுந்தது!
2684,"நிலை உயிராம் மரம் செடி கொடியும், தெய்வத் திருக்கோயிலாக் கண்டதும் இம் மண்!"
2685,ஆம்!
2686,நிலைத்திணை யுயிர்களிலும் இறைமை உண்டு எனக் கண்டது அது!
2687,அம்மட்டோ?
2688,"மழை வழிபாடு தானே, மாரி, காளி வழிபாடுகள்!"
2689,வான் சிறப்பென்னும் தேன்சிறப்பு இறைமைக் காட்சி யல்லவோ!
2690,"சுடரும் கதிரும், குளிரும் மதியும், ஒளிரும் தீயும் ஒளி வடிவ இறைமைக் காட்சி தானே!"
2691,"அவ்வூனுடம்பில் அரியதாம் மாந்தப் பிறவியை, அரிது அரிது மானிடராய்ப் பிறத்தல் அரிது என்னும் பாட்டி மொழி பகருமே!"
2692,உரைப்பவர் உள்ளனரே!
2693,தாளம் போடு பவரும் தறிகெட்டு ஆடுபவரும் காணப்படுகின்றனரே!
2694,இக் கொடுமை இன்றா கிளர்ந்தது?
2695,புதிய நோயா இது?
2696,பழைமையில் பழைமையாய்ப் புகுந்து வாழும் நச்சு நோய் அல்லவோ!
2697,"ஆறாம் அறிவுக்கு ஏறிய பிறவி, எண்ணிப் பார்க்க வேண்டாவா?"
2698,கண்ணாரக் கண்டும் கல்லாய் இரும்பாய்க் கடு நஞ்சாய்க் கற்றவர் நெஞ்சம் இருக்க வேண்டுமா?
2699,கல்லேனும் ஒரு காலத்துருகும் என்று கரைந்தாரே தாயுமானவர்!
2700,கல்லார் மிக நல்லார் என்பதைக் காட்டுதற்கா கற்றோர் கல்வி பயன்பட வேண்டும்?
2701,"தொல்காப்பியர் நாளிலேயே, வடமொழியும் வடமொழி வழக்காறும் புகுந்தது."
2702,அறிவறிந்த அவர் அரண் வகுத்தார்.
2703,செந்தமிழ் வழக்குக் காவலே எம் நூல் எனத் தேர்ந்து செய்தார்.
2704,செந்தமிழ் நூல் வழக்கு மட்டுமன்று செந்தமிழ் மக்கள் வழக்கும் காப்பதே எம் நோக்கு எனக் கொண்டார்.
2705,"மொழிக்காவலாகத், தமிழ் எழுத்துடன் பிறமொழி எழுத்தைச் சேர்க்காதே என்றார்."
2706,பிறமொழிச் சொற்களை எழுதநேரின் தமிழ் மரபு கெடாமல் தமிழ் எழுத்திலேயே எழுது என்றார்.
2707,இந் நெறிகள் பதினேழாம் நூற்றாண்டு வரையிலும் கூடச் செவ்வையாகப் போற்றப்பட்டன.
2708,கம்பரைத் தலைமேல் வைத்துக் கொண்டாடலாம்!
2709,கொண்டாடுகின்றனர்!
2710,"ஆனால், அவர் செய்த மொழிக் காவலைக் காலில் போட்டு மிதித்துக் களிக்கின்றனரே!"
2711,"இராமன், இலக்குவன் என்றும் பெயர்களைக் கம்பர் ஓரிடத்தாவது இ கரம் இல்லாமல் சொல்லியது உண்டா?"
2712,லக்ஷ்மண் என்பதை இலட்சுமணன் என்று கூட அவர் கூறவில்லையே!
2713,இலக்குமணனையும் இலக்குவன் ஆக்கித் தந்த படைப்பாளி அவர் என்பதை இப்பொழுதேனும் பார்த்து நடையிடக் கூடாதா?
2714,"ஹிரண்யன் ஹிரண்யாட்சன் கம்பர் பாடலில் இடம் பெற்ற வகை, பொன்னன், பொற்கண்ணன் என்பவை அல்லவா!"
2715,"கம்பரைப் பழிப்பார், இம் மொழி மரபுக் காவலைப் போற்றிக் கூற வேண்டாவா?"
2716,குணம் நாடிக் குற்றமும் நாடல் ஆய்வு நெறியல்லவா!
2717,"இடைச் செருகல் மட்டும் இல்லை தலைச் செருகல், கடைச் செருகல், விடுபாடு, சேர்பாடு என்பனவும் உண்டு!"
2718,திண்மையாம் கட்டொழுங்கே திணை எனப்பட்டது!
2719,மேலிருந்தும் மேலல்லார் மேலல்லர் கீழிருந்தும் கீழல்லார் கீழல் லவர் என்பது காண்க.
2720,மேல் கீழ் சாதிப் பகுப்பன்று ஒழுக்கப் பகுப்பு.
2721,இட்டார் பெரியோர் இடாதார் இழிகுலத்தோர் எனக் கொடையால் உயர்வு தாழ்வு காணலும் காட்டலும் வள்ளுவ நோக்காகாது!
2722,கொள்ளையடித்தும் கொடுக்கலாமே!
2723,அவன் உயர் குலமாய்க் கொடிகட்டிப் பறக்கலாமே!
2724,அது பெரு நாவலர் பெருநோக்கில் கிளர்ந்த பொது நெறி நோக்கு.
2725,.
2726,தொழிலொப்பு பிறப்பு ஒக்கும் என்ற பெருநோக்குக் கண்டோம்.
2727,அவர் சிறப்பு ஒவ்வா என்றாரே ஏன்?
2728,"அச் சிறப்பு ஒவ்வாமைக்குக் காரணமும் அவரே காட்டினாரே, செய்தொழில் வேற்றுமை என்று."
2729,"அவ்வாறானால் புகழ்த் தொழில், பழித் தொழில் எனத் தொழில்களுள் உண்டா?"
2730,"பண்புகளுள், உயர்பண்பு இழிபண்பு என உண்டேயன்றிச் செய் தொழிலில் உயர்வு தாழ்வு இல்லை."
2731,அதில் உயர்வு தாழ்வு காணலும் காட்டலும் தெளிவிலாத் தன்மை!
2732,செய்தொழில் வேற்றுமை என்பதைத் தெளிவாக்க வேண்டுமா?
2733,!
2734,தவம் செய்வார் எவர்?
2735,"தம் கருமம் செய்வார் என்பதை வள்ளுவர், தவம் செய்வார் தம்கருமம் செய்வார் என்று கூறவில்லையா?"
2736,"அதனைத் தம் கருமம் செய்வார், தவம் செய்வார் எனின் தெள்ளத் தெளிவாகி விடுகின்றது அல்லவோ!"
2737,அப்படியே தொழில் செய் வேற்றுமை என்பதும் அமைவுற்றதாம்!
2738,மருத்துவப்பணி உயர்பணியே!
2739,ஓருயிரின் துடிப்பை மற்றோர் உயிர் தாங்கிக் கொள்ள முடியாமல் ஓடிப் போய் உதவும் உளப்பாங்கே மருத்துவம்!
2740,"இத்தகையரை எண்ணி, விரல்விட உடனே முடிகின்றதா?"
2741,"ஒன்று, இரண்டு எனக் கூட எண்ண முடியுமா?"
2742,ஆனால் அத்தகையர் இல்லவே இல்லை எனச் சான்றோடு சொல்லிவிட முடியுமா?
2743,ஆசிரியத் தொழிலின் சிறப்பென்ன?
2744,எழுத்தறிவித்தவன் இறைவன் ஆவன் என்பதனினும் ஆசிரியனுக்குச் சிறப்பு உண்டா?
2745,"பெற்றோரினும் பெருமையும், கடவுளைப் போன்ற சிறப்பும் உடையன் ஆசிரியன் எனின், அனைவரும் அதற்குத் தக்கார் தாமா?"
2746,"அவர்கள் இழிமை, அவர்கள் செய்தொழில் இழிமையாகி விடவில்லையா?"
2747,ஆடு மாடு மேய்த்தல் இழிமையா?
2748,திருமூலர் செய் தொழில் என நாம் அறிந்ததென்ன?
2749,"ஆனாயர் என்பார், ஆநேயர் அல்லரோ?"
2750,கண்ணன் தொழிற் சிறப்பு ஆயன் என்பதல்லவா?
2751,"கிறித்து பெருமான், மேய்ப்பர் எனப் படுகின்றாரே!"
2752,"நபிகள் நாயகம், வாணிகர் தாமே!"
2753,வாணிகம் இழிந்ததாகி விடுமா?
2754,"வாணிகம் செய்வார்க்கு வாணிகம், பிறர் பொருளையும் தம் பொருள் போல் பேணல் என்றல்லவோ சொல்கிறார் திருவள்ளுவர்."
2755,காந்தியடிகளார் வாணிகக் குடும்பத்தில் தோன்றியவர் தாமே!
2756,எத்தொழில் இழிந்தது?
2757,எத்தொழில் உயர்ந்தது?
2758,தொழில் செய்யும் பாங்கே இழிமையும் புகழும் அன்றித் தொழிலில் உயர்வு தாழ்வு இல்லையாம்!
2759,கோயில் பூசை செய்வோர் சிலையினைக் கொண்டு விற்கும் கொள்ளையர் எனப்பட்டனரே நாட்டியற் பாவலர் பாரதியாரால்.
2760,வேலோடு நின்றான் இடுவென்றது போலும் கோலொடு நின்றான் இரவு என வேந்தன் பழிக்கப் பட்டானே வள்ளுவரால்!
2761,"பெருந்தக்க ஓவியன் கை, பிறந்த மேனிப் படங்களை வரைந்து வைத்துக் காசு பறித்தற்கு முனையுமா?"
2762,"முனையின், ஓவியன் குற்றமா?"
2763,ஓவியக் கலையின் குற்றமா?
2764,பூசை செய்தலும் ஆட்சி புரிதலும் கலைக் கூடமாக்கலும் இழிந்தவையா?
2765,"இழிந்தவன் செயலால், தொழில் இழிவுக்கு ஆட்பட்டது என்பது தானே உண்மை."
2766,இதோ!
2767,செருப்புத் தைத்தவர் கோடி கோடிப் பேர்களின் பாலை வாழ்வைப் பசுஞ்சோலை ஆக்கியதை வரலாற்றில் காண்கிறோமே!
2768,சவப்பெட்டி செய்த தொழிலாளி நிறவேற்றுமை எம் மண்ணில் இருத்தல் கொடுமையினும் கொடுமை!
2769,"மாற்றியே தீர்வேன் எனத் தம் இனமே முற்றாக எதிர்த்தும் முனைந்து நிறைவேற்றி, அதனாலேயே மூச்சையும் முடித்தாரே?"
2770,தையலும் தச்சும் இழிந்தவையா?
2771,அத் தொழில் செய்தமை இழிவுக்கா ஆட்படுத்திற்று?
2772,தொழிலில் உயர்வும் இல்லை!
2773,தொழிலில் தாழ்வும் இல்லை!
2774,தொழில் தொழில் தான்!
2775,தொழத் தக்கது தான்!
