Line Number,Sentence
3216,செயப்பாட்டுவினை ஆசிரியரால் ஒருநாளும் பாடப் படவில்லை.
3217,செய்வினை ஆசிரியர் ஒருநாளும் பாடிய தில்லை.
3218,செயப்பாட்டுவினை ஆசிரியரால் ஒருநாளும் பாடப்பட்ட தில்லை.
3219,செய்வினை ஆசிரியர் ஒருநாளும் பாடியிலர்.
3220,செயப்பாட்டுவினை ஆசிரியரால் ஒருநாளும் பாடப் பட்டிலது..
3221,இருமடியேவலொருமை செய்வினை அவன் கதை சொல்லட்டு.
3222,செயப்பாட்டு வினை அவனால் கதை சொல்லப்பட்டு.
3223,இருமடியேவற் பன்மை செய்வினை அவன் கதை சொல்லட்டும்.
3224,செயப்பாட்டுவினை அவனால் கதை சொல்லப்படட்டும்.
3225,"செய்வினை திரிசிரபுரம்பெரும்புலவர் மீனாட்சி சுந்தரம் பிள்ளை, ஒரு நாளைக்கு முந்நூறு பாட்டுப் பாடுவது முண்டு."
3226,"செயப்பாட்டு வினை திரிசிபுரம் பெரும்புலவர் மீனாட்சி சுந்தரம் பிள்ளையால், ஒரு நாளைக்கு முந்நூறு பாட்டுப் பாடப்படுவது முண்டு."
3227,செய்வினை பதனீரைச் சென்னையார் பனஞ் சாறென்பர்.
3228,செயப்பாட்டுவினை பதனீர்சென்னையாராற் பனஞ்சா றெனப்படும்.
3229,செய்வினை பண்டைக்காலத்தில் தீராப் பெருங் கடன்பட்டவரெல்லாம் பெரும் பாலும் அடிமையராயினர்.
3230,செயப்பாட்டுவினை பண்டைக் காலத்தில் தீரா பெருங் கடன் பட்டவரெல்லாம் பெரும் பாலும் அடிமையராக்கப்பட்டனர்.
3231,பயிற்சி கீழ்வரும் வாக்கியங்களிலுள்ள செய்வினைகளைச் செயப்பாட்டு வினையாக மாற்றுக பிரான்சிசு திரேக்கு உலகமுழுதும் சுற்றிவந்தார்.
3232,அச்சுத்தொழில் முதன்முதல் சீனத்தில் தோன்றியது.
3233,ஒரு பழஞ் சோழவேந்தன் கரும்பைச் சாலித் தீவிலிருந்து தமிழ்நாட்டிற்குக் கொண்டுவந்தான்.
3234,செருமானியரான இராண்டுசென் ல் உட்காட்டியை கண்டமைத்தார்.
3235,"இற்றிலர் இந்தியாவைக் கைப்பற்றிவிடுவார் என்று இந்தியருள் யார் யார் எதிர்பார்த்தனரோ, அவரெல்லாம் செருமானிய மொழியைக் கற்கத் தொடங்கினர்."
3236,ஆங்கிலேயர் இரசியாவைச் செருமானிய உறவிலிருந்து பிரிப்பதற்கு ஒரு சூழ்ச்சி செய்தனர்.
3237,"பொதுவாக, நாட்டாண்மை நகராண்மைத் தேர்தல்கள் மூன்றாண்டிற் கொருமுறை நடைபெறும்."
3238,"நாட்டுமொழி யிலக்கிய வளர்ச்சியின் பொருட்டு, ஆண்டு தொறும் பற்பல புதிய நூல்கட்குப் பல்கலைக் கழகத்தார் பரிசு வழங்குகின்றனர்."
3239,பயிற்சி கீழ்வரும் வாக்கியங்களிலுள்ள செயப்பாட்டு வினைகளைச் செய்வினையாக மாற்றுக இந்தியச் சட்டசபை முதன்முதல் ல் தோற்று விக்கப்பெற்றது என்னலாம்.
3240,"நோபெல் பரிசு, ஆண்டுதோறும், இலக்கியம் பூதநூல் வேதிநூல் மருத்துவம் சமாதானம் ஆகிய ஐந்துறையில் அருந்தொண்டாற்றியவர்க்கு அளிக்கப்பெறும்."
3241,இத்தாலி தேசத்து மார்க்கோனியால் கம்பியிலி ல் புதிதாய்ப் புனையப்பெற்றது.
3242,பண்டைக்காலத்திற் பழிக்குப்பழி வாங்கப்பட்டது.
3243,இந்தியா இரு பிரிவாகப் பிரிக்கப்பட்டது நல்லதன்று.
3244,"வகுப்புவாரித் திட்டத்தை விலக்கும்பொருட்டுச் சென்னை உயர்நிலைமன்றத்தில் வழக்குத் தொடரப்பட்டு, அதை விலக்குமாறு தீர்ப்பும் கூறப்பட்டுள்ளது."
3245,ல் இந்தியாவின் ஆங்கில ஆட்சித் தலைமை நிலையம் கல்கத்தாவிலிருந்து தில்லிக்கு மாற்றப்பட்டது.
3246,நீ அளக்கிற அளவின்படியே உனக்கு அளக்கப்படும்.
3247,உடன்பாட்டுவினை எதிர்மறைவினைப் பரிமாற்றம் கீழ்வரும் வாக்கிய இணைகளை ஆய்க பேதை தானே தனக்குக் கேடு செய்து கொள்கின்றான்.
3248,பேதைக்குக் கேடு செய்ய வேறொருவர் வேண்டுவ தில்லை.
3249,உலகில் மக்கட் செறிவு மிகுந்த இடம் சாவகம்.
3250,உலகில் சாவகத்தைப்போல் மக்கட் செறிவு மிகுந்த இடம் வேறொன்று மில்லை.
3251,அதிகங் கற்றவரிடத்திலும் அறியாமை யுண்டு.
3252,அதிகங் கற்றவரிடத்திலும் அறியாமை இல்லாமலில்லை.
3253,இப் பாட்டின் பொருள் கருகலாயிருக்கின்றது.
3254,இப்பாட்டின் பொருள் தெளிவாயில்லை.
3255,பாரதம் இராமாயணத்திற்குப் பிந்தியது.
3256,பாரதம் இராமாயணத்திற்கு முந்தியதன்று.
3257,பயிற்சி கீழ்வரும் வாக்கியங்களின் பொருளை எதிர்மறை வடிவில் அமைத்துக் காட்டுக வியாழன் மிகப் பெரிய கோள்.
3258,தேசியப் போராட்டம் காந்தியடிகளின் முயற்சியால் வலுத்தது.
3259,அவர் என்னைவிடத் தகுதிவாய்ந்தவர்.
3260,என் தந்தையார்க்குக் கண்ணாடியிருந்தால்தான் படிக்க முடியும்.
3261,கம்பராமாயணத்தில் சில உயர்வுநவிற்சிகள் வரம்பு கடந்தன.
3262,தூங்கினவன் கன்று சேங்கன்று.
3263,தமிழ் மிகப் பழைமையான மொழி என்பது அனை வர்க்கும் உடன்பாடு.
3264,ஆசிரியர் சில சமையங்களில் முட்டாள்தனமாய்ப் பேசுவதுண்டு.
3265,பயிற்சி கீழ்வரும் எதிர்மறை வாக்கியங்களின் பொருளை உடன் பாட்டு வடிவில் அமைத்துக்காட்டுக பாண்டவரும் கௌரவரும் ஒருபோதும் ஒற்றுமையா யிருந்ததில்லை.
3266,பட்டினத்தாருக்கிருந்த செல்வம் கொஞ்சநஞ்சமன்று.
3267,பன்னீர்ச்செல்வம் மறைந்த இடம் இன்னதென்று இன்னும் ஒருவருக்கும் தெரியவில்லை.
3268,வித்தில்லாமல் விளைவுண்டா?
3269,யாரும் பிறந்தவுடன் பேசமுடியாது.
3270,வேளாளன் என்பான் விருந்திருக்க வுண்ணாதான்.
3271,வள்ளுவர் வாக்கு வாய்க்காமற் போகாது.
3272,இதை வேறொருவரும் செய்திருக்க முடியாது.
3273,வினாவாக்கியச் சாற்றுவாக்கியப் பரிமாற்றம் கீழ்வரும் வாக்கிய இணைகளை ஆய்க நீ சொன்னபடியெல்லாம் செய்வதற்கு நான் உன் அடிமையா?
3274,நீ சொன்னபடியெல்லாம் செய்வதற்கு நான் உன் அடிமை யல்லேன்.
3275,நாம் வேலைபெறுதற்கு மட்டுமா கல்வி பயில்வது?
3276,நாம் கல்வி பயில்வது வேலைபெறுதற்கு மட்டுமன்று.
3277,"தீமை செய்கிறவனைத் தண்டிப்பதற்கு, அவனுக்கு நன்மை செய்வதைவிடச் சிறந்த வழி ஏது?"
3278,"தீமை செய்கிறவனைத் தண்டிப்பதற்கு, அவனுக்கு நன்மை செய்வதே சிறந்த வழி."
3279,"எத்தனையோ அறிவியல் முழுமணி நூல்கள் உள்ள இக்காலத்தும், குட்டிக்கதைகளை ஏன் படிக்க வேண்டும்?"
3280,"எத்துணையோ அறிவியல் முழுமணி நூல்கள் உள்ள இக்காலத்தும், குட்டிக்கதைகளைப் படிப்பது அறிவுடை மையாகாது."
3281,சிவிங்கி தன் புள்ளியையும் எத்தியோப்பியன் தன் கருமை யையும் மாற்ற முடியுமா?
3282,சிவிங்கி தன் புள்ளியையும் எத்தியோப்பியன் தன் கருமை யையும் மாற்ற முடியாது.
3283,"இத்தனை ஆயிரம்பேர் உண்ணுமிடத்தில், இச் சிறு பிள்ளைக்கு உணவளிப்பதனாலா செலவு மிகுந்துவிடும்?"
3284,"இத்தனை ஆயிரம்பேர் உண்ணுமிடத்தில், இச் சிறு பிள்ளைக்கு உணவளிப்பதனால் செலவொன்றும் மிகுந்து விடாது."
3285,கோடிக்கணக்கான செல்வமுள்ளவனுக்கு ஒரு காசு போனால்தானென்ன?
3286,கோடிக்கணக்கான செல்வமுள்ளவனுக்கு ஒரு காசு போனதினால் ஒன்றும் கெட்டுவிடாது.
3287,பயிற்சி கீழ்வரும் வினாவாக்கியங்களைச் சாற்று வாக்கியங்களாக மாற்றுக மாந்தனுக்காகச் சட்டம் ஏற்பட்டதா?
3288,சட்டத்திற்காக மாந்தன் ஏற்பட்டானா?
3289,உயிர் பெரிதா?
3290,பணம் பெரிதா?
3291,வணிகரும் வழக்கறிஞரும் பொய்சொல்லாம லிருக்க முடியுமா?
3292,இவ்வுலக வாழ்க்கை யாருக்குத்தான் காயம்?
3293,எத்தனை காரியங்களை ஒருவன் கவனிக்கமுடியும்?
3294,ஆசிரியன் தவறி நடக்கலாமா?
3295,அகராதியிற் பிழையிருக்க லாமா?
3296,இத்தனை செய்திகளையும் எப்படி நினைவில் வைத் திருக்கிறது?
3297,"ஆயிரம் உருபா வந்தாலென்ன, ஆயிரம் உருபா போனா லென்ன?"
3298,பயிற்சி கீழ்வரும் சாற்று வாக்கியங்களை வினாவாக்கியங்களாக மாற்றுக தென்னைமரத்தைக் கோணலாக்கியவரும் தேக்குமரத்தை நேராக்கியவரும் இல்லை.
3299,பசியால் வருந்துகிறவனுக்குப் பணமலை யிருந்தும் பயனில்லை.
3300,கற்புடை மனைவியே பொற்புடைச் செல்வம்.
3301,களங்காய் இருண்டிருப்பதும் விளங்காய் திரண்டிருப் பதும் இயற்கை.
3302,கடன் வாங்கியும் பட்டினி கலியாணம் செய்தும் துறவி.
3303,கவலைப்படுவதினால் ஒருவனும் தன் உடம்புடன் ஒரு முழத்தைக் கூட்டமுடியாது.
3304,மறதியிருப்பது மாணவனுக்கு நன்றன்று.
3305,சோவியத்து அரண்மனையைப்போல உயரமான கட்டடம் வேறொன்றுமில்லை.
3306,உணர்ச்சிவாக்கியச் சாற்றுவாக்கியப் பரிமாற்றம் கீழ்வரும் வாக்கிய இணைகளை ஆய்க என்னே அழகு இம் மலைக்காட்சி!
3307,இம் மலைக்காட்சி மிக அழகாயிருக்கின்றது.
3308,நான்மட்டும் அரசனா யிருந்திருந்தால்!
3309,நான் அரசனாயிருந்திருந்தால் மிக நன்றாயிருந்திருக்கும்.
3310,என்னே உலக வாழ்க்கை!
3311,உலக வாழ்க்கை நிலையற்றதும் துன்பம் நிறைந்தது மானது.
3312,என் இளமை திரும்பிவரட்டுமே!
3313,என் இளமை திரும்பி வரவேண்டுமென்பது என் வேணவா.
3314,என்னத்தைச் சொல்ல!
3315,நான் சொல்லமுடியாதபடி எது சொல்லியும் பயனிலாத வாறு கேடு விளைந்துள்ளது.
3316,என் அருமை நண்பனை மீளவும் காணப் பெறேனா!
3317,என் அருமை நண்பனை மீளவும் காணப்பெற்றால் மிக இன்பமாயிருக்கும்.
3318,தமிழ் வாழ்க!
3319,தமிழ் அழியாதிருக்கவேண்டும்.
3320,என் செய்வேன்!
3321,நான் என்ன செய்தும் தப்பமுடியாத துன்பத்தில் அகப் பட்டு வருந்துகின்றேன்.
3322,இவ் அகதிக் குருடன் நிலை.
3323,நான் நினைத்தவிடமெல்லாம் செல்லும் சித்தி பெற்றிருந்தால் எவ்வளவு வசதியாயிருக்கும்!
3324,என்னிடம் பணமிருந்தால் உனக்கென்னதான் வாங்கித் தரமாட்டேன்!
3325,பசியாதிருக்க வழியில்லையா!
3326,இவ்விடத்தில் ஒரு புதையல் இருக்கட்டுமே!
3327,"நான் ஒரு நிமையம் நிமிஷம் பிந்தியிருந்தால், என் கதி என்னவாயிருக்கும்!"
3328,என்னே இனிமை இன்று யான் வாங்கிய மாங்கனி!
3329,என்றைக்குத் தீருமோ என் வறுமை!
3330,நான் என்ன செய்யட்டும்!
3331,நான்மட்டும் அந்தச் சமையத்தில் அங்கிருந்திருக்க வேண்டும்!
3332,என் தந்தையார் உயிரோடில்லையே!
3333,நகரங்களிலும் சில தெருக்கள் மிக அருவருப்பாயுள்ளன.
3334,தொழு குஷ்ட நோயரையும் தொத்துநோயரையும் தெருக்களுக்கு வரவிடுவது மிகக் கேடானது.
3335,"கணவனையிழந்த கைம்பெண்கள் கைக்குழந்தையை ஏந்திக்கொண்டு கண்டவிடமெல்லாம் இரந்து திரிவது, மிகத் துன்பமான காட்சி."
3336,நான் என் சொந்தவூர் போய்ச் சேர்ந்தால் நன்றாயிருக்கும்.
3337,கற்றவரும் பெருஞ் சம்பளக்காரருமான அதிகாரிகள் கையூட்டு லஞ்சம் வாங்குவது மிக இழிவானது.
3338,தந்தையிறந்த பின்பும் கந்தன் கவலையற்றிருப்பது வருந்தத்தக்கது.
3339,இச் செய்தி நம்ப முடியாததாயிருக்கின்றது.
3340,கூட்டுவாக்கியம் கேடிலியப்பர் சிவபெருமானை நோக் கித் தவங்கிடந்தார் அதன் பயனாய்த் தாயுமானவரைப் பெற்றார்.
3341,தனிவாக்கியம் பாணபத்திரர் பரிசுபெறும் பொருட்டுச் சேரமான் பெருமாள் நாயனாரிடம் சென்றார்.
3342,கூட்டுவாக்கியம் பாணபத்திரர் பரிசுபெற விரும்பினார் அதற்காகச் சேரமான் பெருமாள் நாய னாரிடம் சென்றார்.
3343,தனிவாக்கியம் தலைமையாசிரியர்மாணிக்கம் பிள்ளை இங்கிலாந்திற்கு மேற்கல்வி பயிலச்சென்றார்.
3344,கூட்டுவாக்கியம் தலைமையாசிரியர் மாணிக்கம் பிள்ளை மேற்கல்வி பயில விரும்பினார் அதற் காக இங்கிலாந்திற்குச் சென்றார்.
3345,தனிவாக்கியம் திருநாவுக்கரசர் பரடு தேயக் கயிலைக்கு நடந்தார்.
3346,கூட்டுவாக்கியம் திருநாவுக்கரசர் கயிலைக்கு நடந்தார் அதனால் அவருக்குப் பரடு தேய்ந்தது.
3347,தனிவாக்கியம் யானை கொழுத்தால் பாகனுக் கடங் காது.
3348,கூட்டுவாக்கியம் யானை ஒருசமையம் கொழுக்கும் அதன்பின் பாகனுக்கு அடங்காது.
3349,தனிவாக்கியம் மருதன் நன்றாய்ப் படித்தும் தேற வில்லை.
3350,கூட்டுவாக்கியம் மருதன் நன்றாய்ப் படித்தான் ஆனா லும் தேறவில்லை.
3351,தனிவாக்கியம் வடமலையன் சேலங் கல்லூரியிற் சேர்ந்து கற்றுத்தேறிப் பதவிபெற்று வாழ்ந்தான்.
3352,"கூட்டுவாக்கியம் வடமலையன் சேலங் கல்லூரியிற் சேர்ந்தான், கற்றான், தேறினான், பதவி பெற்றான், வாழ்ந்தான்."
3353,பயிற்சி கீழ்வரும் தனிவாக்கியங்களைக் கூட்டுவாக்கியமாக மாற்றுக செங்கோடன் மாடுபிடிக்கக் காங்கேயம் போயிருக் கின்றான்.
3354,"வாலேசு கீழிந்தியத் தீவகணத்திற்குச் சென்று, ஆயிரக் கணக்கான பூச்சி புழுவகைகளைச் சேர்த்தார்."
3355,உதிபெருத்தால் உத்திரத்திற்காகுமா?
3356,நக்கீரனார் இரந்துண்டு வாழாமல் சங்கை அரிந்துண்டு வாழ்ந்தார்.
3357,சர் தி.
3358,"முத்துசாமி ஐயர் தெருவிளக்கிற் படித்துத் தேறி, உயர்நிலைமன்றத் தீர்ப்பாளரானார்."
3359,சிலர் கருமந் தொலைத்தற்பொருட்டுக் கங்கையில் முழுகுகின்றனர்.
3360,சிலர் குளிக்கப்போய்ச் சேற்றைப் பூசிக்கொள்கின்றனர்.
3361,எழுந்து படி.
3362,சின்னப்பன் சென்னை சென்றும் கடலைப் பார்க்கவில்லை.
3363,ஆடாமல் பாடாமல் அமைதியாயிரு.
