Line Number,Sentence
4782,"இது வாழ்க்கைக்கு அடிப்படையாக இருப்பதுடன் கொள்கைகள், பழக்க வழக்கங்கள், நாகரிகம், சமூக அமைப்பு, வாழ்க்கைத்தரம் ஆகியவற்றிலும் மாறுபாடுகளை உண்டாக்குகின்றது."
4783,"உணவுச் சத்துக்கள் உணவின் எந்தெந்தப் பகுதி எந்தெந்தத் தொழில் புரிகின்றது என்று அறிய வேண்டுமாயின், உணவினைச் சோறு, பழம்."
4784,புலால் என்று கருதாமல் அதனைச் சத்துக்களாகக் கருதவேண்டும்.
4785,"கார்போஹைட் ரேட்டுக்கள், பிசிதங்கள், கொழுப்புக்கள், கரிமமிலா உப்பு வகைகள், விட்டமின்கள், நீர் என்பவை உணவுச்சத்துக்களாகும்."
4786,இவை ஒவ் வொன்றையும் பற்றிச் சற்று விரிவாகத் தெரிந்து கொள்வது மிகவும் இன்றிய மையாதது.
4787,கார்போஹைட்ரேட்டுகள் சருக்கரைப் பொருள்களும் மாப்பொருள்களும் இவற்றுள் அடங்கும்.
4788,"இவற்றின் பெயருக்கேற்ப இவற்றில் கரி,ஹைட் ரொஜென் ஆசியவை அடங்கியுள்ளன."
4789,பின்னிரண்டும் நீரிலுள்ளது போல் என்ற விகிதத்தில் அமைந்துள்ளன.
4790,இவை உடலுக்கு வேண்டிய ஆற்றலில் அரை முதல் முக்கால் பங்கு வரை தருகின்றன.
4791,"தானியங்கள், கிழங்குகள், பருப்புக் கள், கொட்டைகள் ஆகியவற்றில் மாப்பொருளும், பழம், தேன், வெல்லம் முதலியவற்றில் சருக்கரைப் பொருளும் உள்ளன."
4792,கார்போஹைட்ரேட்டுக்கள் எளிதில் செரிமானம் ஆகக் கூடியவை.
4793,"இவை யாவும் தாவர மூலங் களாதலின், மலிவானவை."
4794,பிசிதங்கள் இவை சிக்கலான சேர்க்கைகளாகும்.
4795,"இவற்றில் கரி, ஹைட்ரொஜென், நைட்ரொஜன், ஆக்ஸிஜென் ஆகியவை அடங்கியுள்ளன."
4796,"சில பிசிதங்களில் கந்தகமும், சிலவற்றில் பாவரமும் இருக்கின்றன."
4797,உடல் வளர்ச்சியும் உடலுறுப்புப் புத்தமைப்பும் பெரும்பாலும் பிசிதங்களாலேயே நடைபெறுகின்றன.
4798,பிசிதங்கள் உயிரின் உறைவிடமாகிய ஊன்பசைப் பொருளின் முக்கிய பகுதிகளாக உள்ளன.
4799,கொழுப்புக்களிலும் கார்போ ஹைட்ரேட்டுக்களிலும் நைட்ரொஜென் இன்மையால் அவை உடல் வளர்ச்சிக்கும் உடலுறுப்புப் புத்தமைக்கும் பயன்படா.
4800,பிசிதங்களைப் பிரிக்கும்பொழுது அமினோ அமிலங்கள் கிடைக்கின்றன இவை கிட்டத்தட்ட இருபது வகைகள் உள்ளன.
4801,சில வளர்ச்சிக்கும் உயிர் வாழ்வதற்கும் அவசியம்.
4802,அத்தகைய அமினோ அமிலங்களைக் கொண்ட பிசிதங்களை முதல் தரப் பிசிதங்கள் என்று வழங்குவர்.
4803,"அவை பால், முட்டை, இறைச்சி முதலிய உணவுகளில் உள்ளன."
4804,"அவை பருப்புக் களிலும், பயறுகளிலும் அதிகமாக உள்ளன."
4805,இதர பிசிதங்கள் மூன்றாந்தரமானவை.
4806,"கொழுப்புக்கள் இவற்றிலும் கரி, ஹைட்ரொஜென், ஆக்ஸிஜென் என்ற மூன்று தனிப்பொருள்கள் உள்ளன."
4807,"ஆயினும், கார்போஹைட்ரேட்டுக்களில் இருக்கும் அளவுக்கு ஆக்ஸிஜென் இவற்றில் இல்லை."
4808,"வெண்ணெய், மீன்எண்ணெய்போன்ற பிராணமூலக் கொழுப்புக்களில் ஹ, னு, விட்டமின்களும் அடங்கியுள்ளன."
4809,குளிர் நாடுகளில் கொழுப்புக்கள் சிறந்த உணவாக அமைகின்றன.
4810,"காரணம், அவற்றிலிருந்து அதிகமான சூடு கிடைப்பதே."
4811,அப்படிச் செய்வதால் உடலின் உள் சூழ்நிலை காக்கப்பெறுகின்றது.
4812,நமது சமையல்முறையில் காய்கறிகளையும் வேக வைத்து நீரை வடிப்பதால் இவ்வுப்புக்கள் இழக்கப்பெறுகின்றன.
4813,நீராவியில் வேகவைத்தால் இவை பாதுகாக்கப்பெறும்.
4814,கால்சியம் எலும்பிலும் பற்களிலும் உள்ள முக்கியமான பகுதி.
4815,"அது இதயத் துடிப்பு, குருதி உறைதல், நரம்புத்தூண்டல் ஆகியவற்றைக் கட்டுப்படுத்துகின்றது."
4816,"கால்சியக் குறைவால் மிகுதியான நரம்புத் துடிப்பு, குறைந்த தசை இயக்கம் நேரிடுகின்றன கால்சியக் குறைவு ஆத்மாவுக்கும் தோல்நோய்களுக்கும் காரணமாகின்றது."
4817,"பால், பாலாடைக்கட்டி, பச்சைக் காய்கறிகள், ஆரஞ்சு போன்றவற்றில் கால்சியம் அதிகம் இருக்கின்றது."
4818,"பாவரமும் எலும்புகளுக்கும், குருதி உறையாப் பகுதிக்கும், நரம்பு மண்டலத்திற்கும் மிகவும் இன்றியமையாதது."
4819,"பாவரக் குறைவால் வளர்ச்சித் தடை, சரியான எலும்பின்மை, பற்கள் அழிவு முதலியவை நேரிடுகின்றன."
4820,"பாலாடைக்கட்டி, முட்டை, கொட்டைகள், கோதுமை, பால், உருளைக்கிழங்கு ஆகியவற்றில் பாவரம் உள்ளது."
4821,அயம் குருதியின் செவ் வணுக்களுக்கு மிகவும் இன்றி யமையாதது.
4822,"ஈரல், முட்டை, கோதுமை, பேரீச்சம் பழம் முதலியவற்றில் அயம் அதிகமாக உள்ளது."
4823,அயோடின் புரிசைச் சுரப்பியின் முக்கிய பகுதியாகும்.
4824,அயோடின் குறைவால் தொண்டைக் கழலை நோய் உண்டா கின்றது குள்ளத் தன்மையும் கூழைமை நேரிடுகின்றது.
4825,"கடல் மூல உணவுகளும், மீன் எண்ணெய்களும் தேவையான அயோடினைத் தருகின்றன."
4826,நீர் நீர் உடலின் வளர்சிதை மாற்றத்திற்கு மிகவும் இன்றியமையாதது.
4827,ஒவ்வொருவரும் நாளொன்றுக்கு தம்ளர் நீராவது பருகவேண்டும்.
4828,"நார் உணவாகச் சேராதெனினும், உணவும், கழிவுப் பொருள்களும் அசைந்து செல்வதற்குத் துணையாக இருக்கின்றது."
4829,"காய் கறிகள், பழங்கள், தவிடு முதலிய பண்டங்களில் நார் கிடைக்கின்றது."
4830,"நார், உணவில் இல்லாவிடில் மலச்சிக்கல் ஏற்படும்."
4831,முதலில் மேற்கொண்டிருக்கும் வேலையின்பால் களைப்புண்டாகின்றது பிறகு வெறுப்பும் அதனைப் பின் தொடர்கின்றது.
4832,பின்வேலையை நிறுத்த வேண்டும் அல்லது மாற்ற வேண்டும் என்ற தீவிரமான ஆசை உண்டாகின்றது.
4833,"அந்த வேலையையே மீண்டும் தொடர்ந்து செய்தால், தலைவலி, உறுப்புக்களில் வலி, உழைச்சல் முதலியவை ஏற்படுகின்றன."
4834,வரம்பிகந்த நிலையில் உடல் செயல்களும் உள்ளச் செயல்களும் மிகவும் குன்றிவிடுகின்றன நம்மால் ஒன்றுமே செய்ய முடிவதில்லை.
4835,களைப்பு இருவகைப்படும்.
4836,"ஒன்று, உடல் களைப்பு."
4837,இது நீடித்த இயக்கத்தால் ஏற்படும் மாறுதல்களால் உண்டாகின்றது.
4838,நெடுநேரம் தட்டச்சுப் பொறியை இயக்கி வேலை செய்தால் விரல் தசைகள் ஒரே வகையாக இயங்குகின்றன.
4839,இதனால் அவை களைப்படைகின்றன.
4840,இது தசைக் களைப்பு எனப்படும்.
4841,"இரண்டு, மனக்களைப்பு."
4842,தொடர்ந்த மன வேலையின் பயனாக மூளையில் ஏற்படும் மாறுதல்களால் இஃது உண்டாகின்றது.
4843,நெடு நேரம் கணக்குப் பாடம் படித்தால் மனக் களைப்பு உண்டாகும்.
4844,"சலிப்பு சலிப்பு, களைப்பினின்றும் வேறுபட்டது."
4845,ஒரு வேலையைச் செய்ய ஆர்வமின்மையும் வெறுப்பும் உண்டாகும் நிலையே சலிப்பு என்பது.
4846,சலிப்பு களைப்புக்கு முன்னதாகத் தோன்றி அதனினும் விரைவாகப் பெருகுகின்றது.
4847,பலர் சலிப்பு வந்துற்றபோது தாம் களைப்பு விட்டதாகக் கருதுகின்றனர்.
4848,இது தவறு.
4849,ஒரு களைப்பு உணர்ச்சி தோன்றுகின்றதேயன்றி ஆற்றல் அழிந்துவிடுகதில்லை.
4850,கவர்ச்சியின்மையாலேயே நாம் சிலிப்படைகின்றோம்.
4851,தொழிலை மாற்றினால் சலிப்பு நீங்கும்.
4852,செயலில் கவர்ச்சி உண்டாக்கிக் கொள்வதாலும் சலிப்பைத் தடுக்கலாம்.
4853,"காரணம் களைப்பு பொதுவாக மிகுந்த சிரமமான வேலையைச் செய்வதாலும், அல்லது சாதாரண வேலையை நெடுநேரம் செய்வதாலும் உண்டாகும்."
4854,இழையங்களில் இரண்டு விதமான வளர்சிதை மாற்றச் செயல்கள் சதா நடைபெற்றுக் கொண்டேயிருக்கின்றன.
4855,"முதலாவது, நரம்புச் செயல்களிலும் தசை இயக்கங்களிலும் ஆற்றல் செலவழியும் பொழுது உயிரணுக்கள் தேய்ந்து சிதை வடைகின்றன."
4856,இரண்டாவதாக தேய்வுற்ற பகுதியைப் புதுப்பிக்க உடலணுப் புத்தமைப்பு நடைவெறுகின்றது.
4857,"இஃது உணவாலும், உடற் பயிற்சியாலும், காற்றாலும், தூக்கத்தாலும், வேண்டாப் பொருள் அகற்றப்பெறுவதாலும் உண்டாகின்றது."
4858,"இத் தேய்வு முறையும் புத்தமைப்பு முறையும் இல்லாவிடில், உடல் நலத்தையும் தொழில் இசைவையும் பெற முடியாது."
4859,முதலில் குறிப்பிட்ட தேய்வுச் சிதைவு முறையில் சில கழிவுப் பொருள்கள்முக்கியமாக லாக்டிக் அமிலம் உண்டா கின்றன.
4860,இவை நச்சுப் பொருள்கள்.
4861,"அஃதாவது, தொழிலும் இயக்கமும் விரை வாக நடைபெறுவதால், தேய்வின்வேகம் புத்தமைப்பை மிஞ்சு கின்றது."
4862,இதனால் நச்சுப் பொருள்கள் அதிகமாக ஏற்பட்டு உயிரியின் செயலாற்றல் குறைகின்றது.
4863,"சிறிது ஓய்வின்றி வன்தொழிலை நீடித்தால், இந்நச்சுப் பொருள்கள் உயிரி முழுமையும் பரவி முழுக்களைப்பு நிலையை உண்டாக்கி விடுகின்றது."
4864,களைப்புக்கு மற்றொரு காரணம் ஆக்ஸிஜென் குறைவு.
4865,குருதியில் செவ்வணுக்கள் எடுத்துச் செல்லும் ஆக்ஸிஜெனின் உதவியாலன்றி ஆற்றல்தரும் சேர்க்கைகளைச் சிதைத்து உடலாற்றல் பெற முடியாது.
4866,மனக் களைப்பு உடற்களைப்போடு நெருங்கிய உறவினைக் கொண்டது.
4867,இரண்டுவிதக் களைப்புக்களும் ஒன்றையொன்று தூண்டக்கூடிய ஆற்றலையுடையவை.
4868,"ஒரு தேர்வு அல்லது அதுபோன்ற தொடர்ச்சியான மனவேலைக்குப் பிறகு, ஏதாவது உடல் வேலையை மேற் கொள்வதென்பது சாத்தியப்படுவதில்லை."
4869,"இதனால்தான் சில உளவியலறிஞர்கள் உடற்களைப்பு, மனக்களைப்பு என்ற பாகுபாட்டை ஒப்புக் கொள்வதில்லை."
4870,மனச் சோர்வுக்கும் காரணங்கள் தரப்பெறுகின்றன.
4871,மனச்சோர்வு ஏற்பட்டால் நரம்புகள் சரியாகச் செயற்படா.
4872,இன்னொரு செய்தியையும் ஈண்டு கூறுதல் பொறுத்த முடைத்து.
4873,"ஆகவே, மூளைக்கு உண்டாகும் களைப்பு உடலுக்கு உண்டாகும் களைப்பைவிடக் குறைவேயாகும்."
4874,"செய்யும் தொழில் கவர்ச்சியுடையதாக இருக்குமாயின், மூளையும் எளிதில் களைப் படைந்து விடுவதில்லை."
4875,"ஒரு பொருளைக் கவனிக்கும் பொழுது மூளை களைப்படையுமாயின், அதற்கு ஓய்வு தராமல் வேறு ஒரு பொருளைக் கவனிக்கும்படி செய்யலாம்."
4876,அந்தப் பொருள் கவர்ச்சியுடையதாக இருந்தால் அதை மூளை சலிப்பின்றிக் கவனிக்கும்.
4877,இது தவறு.
4878,குழந்தைகள் விரைவில் களைப் பெய்துகின்றனர்.
4879,வயதுக் குறைவிற்கேற்ப இக்களைப்பு அதிகப் படுகின்றது.
4880,களைப்பை நீக்கும் முறைகளைக் கையாள்வது பள்ளிகளின் கடமையாகும்.
4881,பள்ளிப் பாடவேளைப்பட்டியைத் தக்கமுறையில் தயாரித் தலாலும் களைப்பை அகற்றலாம்.
4882,ஆசிரியரின் உற்சாகமும் ஒரளவு மாணாக்கர்களின் களைப்பைப் போக்கும்.
4883,"இவற்றைத் தவிர, வேறு சில முறைகளும் உள."
4884,அவற்றையும் சிறிது கவனிப்போம்.
4885,ஓய்வு களைப்பைத் தடுப்பதற்கு ஓய்வு மிகவும் இன்றியமையாதது.
4886,களைப்பில் அரைகுறைத் தூக்கநிலைத் தென்பட்டால் தூக்கமும் ஓய்வும் அவசியம் என்பதைக் காட்டுகின்றது.
4887,"தூக்கத்திலும் ஓய்விலும் புதிய உடலணுக்கள் அமைவதுடன், புதிய ஆற்றல் மீண்டும் கிடைக்கின்றது."
4888,உயிரி புத்துணர்ச்சியைப் பெறுகின்றது.
4889,மன வேலையில் மூளையின் சிலபகுதிகளே செயற்படுகின்றன.
4890,அப்பொழுது உடலுக்கு வேலைகொடுத்தால் மூளையின் வேறு மையங்கள் செயற்படும் முதலில் செயற்பட்ட மையங்களும் ஓய்வு பெறும்.
4891,கவர்ச்சி களைப்புக்கு மருந்துபோல் உதவுவது தீவிரமான கவர்ச்சி.
4892,செயலாற்றுவதில் கவர்ச்சி சிறந்ததோர் இயக்கவன்மையாகும்.
4893,நாம் மேற்கொள்ளும் வேலையில் கவர்ச்சியை உண்டாக்கிக்கொண்டால் மன ஊக்கம் மிகும் களைப்பும் தடைப்படும்.
4894,ஊட்ட உணவு ஊட்ட உணவு எளிதில் களைப்பைத் தெளிவிக்கின்றது.
4895,"பால், பழம், சருக்கரைப் பொருள் ஆகியவை சிறப்பாகப் பயன்தருபவைகள்."
4896,"தேயிலை, காப்பி, கொக்கோ ஆகியவை தற்காலிகமாகக் களைப்பைத் தள்ளிவைக்கின்றன."
4897,"இன்றைய நாளில், சிறப்பாக திரு."
4898,சுந்தரவடிவேலு அவர்கள் கல்வித்துறை இயக்குநராக வந்த பிறகு பிள்ளைகட்கு நடுப்பகல் உணவு அளிப்பது குறிப்பிடத்தக்கதாகும்.
4899,பலர் களைப்பை நீக்குவதற்காகவே அடிக்கடி சிறிதளவு உணவு கொள்கின்றனர்.
4900,"விரைந்து செயலாற்றுதல் ஒரு வேலையை மெதுவாகச் செய்வதை விட, விரைந்து செயலாற்றுதல் களைப்பினைக் குறைப்பதாகும்."
4901,"காரணம், விரைந்து செயலாற்றும்பொழுது தடங்கல்களையும் கவனச்சிதறல் களையும் நாம் அகற்றி வேலையிலும் நல்ல பொருத்தப்பாட்டை எய்துவிக்கின்றோம்."
4902,இதனால் நம் திறமைக்கு மிஞ்சிய வேலையை முடிக்க வேண்டு மென்று முனைதல் கூடாது.
4903,நல்ல பழக்கங்கள் நற்பழக்கங்களை அமைத்துக் கொண்டு வேலையை எளிதாகச் செய்துமுடிக்க நாம் கற்றுக் கொள்ள வேண்டும்.
4904,நாம் நெடுநாள் செய்து வந்த வேலையைக் களைப்பின்றி நீண்ட நேரம் செய்யலாம்.
4905,"ஆனால், பழகாத புதிய வேலையை மேற்கொள்ளும்பொழுது எளிதில் களைப்புறுகின்றோம்."
