Line Number,Sentence
564,பரிவு பண்ணினேனாய் அன்பு செய்தேனாய்.
565,பணி கட்டளை.
566,எண்ணம் வாய்ப்ப அடியேன் கருத்துக்கைகூட.
567,போதும் என்ன நிதி இரண்டும் குறைவன் ஒருவன் பெற்று உவந்தால் போலக் கொண்டு மனை புகுந்தார்.
568,இறையும் நொடியும் கணமும்.
569,போதும் வருவோம்.
570,.போல வறியவன் ஒருவன் பதுமநிதி சங்கநிதி என்னும் இருநிதியை யும் பெற்று மகிழ்வெய்தினாற்போல.
571,சந்தம் அழகு.
572,தாமம் மாலைகள்.
573,நாற்றி தூக்கி தொங்க விட்டு.
574,"மந்தமலர் தவிசடுத்த அணைபோன்ற ஆசனங்காட்டி, மணங்கமழ் நீர்."
575,.குஞ்சி என்றார்.
576,படி வகையை.
577,பரிகலமும் உண்கலத்தையும்.
578,பாவடையில் நிலத்தில் விரிக்குஞ் சீலையில்.
579,சாலியால் சம்பா அரிசியால் ஆக்கப்பெற்ற சோற்றையும்.
580,.நிலையான முக்காலியின்மேல் விரித்த வெள்ளை வதிரத்தின் மீது.
581,படுத்தபசுத்தொடர்ந்த கொன்றை பசுவிலேயுள்ள.
582,மாண சிறக்க.
583,திருநீறிட்டவர்க்கே அன்னமிடும் வழக்கத்தைக் குறிப்பிட்ட வாறாம் நீறிட்டார் ஒருவரையும் சிறுத்தொண்டர் காணாமை விளங்குதல் காண்க.
584,தம்மை வயிரவரை.
585,அவர் சிறுத்தொண்டர்.
586,ஆறு திங்கள் ஒழிந்து உண்போம் உண்ணும் அளவும் தரியாது சோறு நாளும் உண்பீர் முன் உண்பது என்?
587,அவன் வந்தால் வந்தாலே வந்த பின்னரே நாம் இங்கு உண்பது.
588,அவர்தம் மனைவியாரும் வயிர வரிடங் கொண்ட அன்பு வெறியால் களித்திருத்தல் ஆம் பாட்டுக் குறிப்பில் சுருங்கச் சொல்லப்பட்டது.
589,அஃது இங்கே உறுதிப்படுதல் காண்க.
590,தம் கையால் அரிந்த புதல்வரை மீட்டும் அழைக்க எவரே புறப்படுவர்!
591,இங்கே இருவரும் வயிரவர் சொற்படி இருவர் மனமும் அவர்தம் வசமின்றி வயிரவர்மாட்டுக்கொண்ட அன்பு வெறியில் ஈடுபட்டிருத்தல் வெள்ளிடைமலை.
592,அவர் சொல்வழியே இருவரும் உழன்றது உறுகரியாமென்க.
593,தரம்இல் வனப்பின் ஒப்பில்லாத அழகினையுடைய.
594,முந்தவே முன்னமே.
595,தெருமந்தார் மனஞ் சுழலப் பெற்றார்.
596,வெருவுற்றார் அஞ்சித் திடுக்கிட்டார்.
597,செய்ய மேனிக் கருங் குஞ்சிச் செழுங் கஞ்சுகத்துப் பயிரவர்யாம் உய்ய அமுது செய்யாதே ?
598,கஞ்சுகம் சட்டை.
599,சரவணத்துத் தனயர் முருகன்.
600,துளங்க அசைய.
601,சிறுத்தொண்ட நாயனார் திருச்செங்காட்டங்குடி சோழநாட்டில் உள்ளது.
602,அப் பதியில் மாமாத்திரர் குலம் என்றொரு குலம் உண்டு.
603,அதன்கண் தோன்றியவர் பரஞ்சோதியார்.
604,"பரஞ்சோதியார், சோழ மன்னனிடத்தில் அமைச்சராய் அமர்ந்து கடனாற்றி வந்தார்."
605,"அவர், வேற்றரசர்களை வெல்வதிலும், அவர்கள் நாடுகளைப் பற்றுவதிலும் பேர் பெற்று விளங்கினார்."
606,ஒரு முறை வடபுலத்திலே உள்ள வாதாபி என்னும் நகரத்தில் போர் மூண்டது.
607,அப்போரில் பரஞ்சோதியார் தலைப்பட்டு வெற்றி பெற்றார்.
608,"அவற்றைக் கண்ட மன்னன், பரஞ்சோதியார் திறத்தை வியந்து வியந்து பேசினான்."
609,"அது கேட்ட மன்னன், நடுக்குற்றான் அந்தோ!"
610,என் பிழை பொறுத்தருளல் வேண்டும் என்று வேண்டினான்.
611,"பரஞ்சோதியார், என் கடமையை யான் செய்தேன் அதனால் என்ன தீங்கு?"
612,என்று சொன்னார்.
613,பரஞ் சோதியார் விடைப்பெற்றுத் தம் திருப்பதி சேர்ந்தார்.
614,"அவர், அடியவர்களிடத்தில் மிகச் சிறியறாய் நடப்பார்."
615,அதனால் அவருக்குச் சிறுத்தொண்டர் என்னுந் திருநாமம் வழங்கலாயிற்று.
616,"இவ்வாறு ஒழுகுவரும் நாளில், சிறுத்தொண்டர் மனைவியார் கருவுற்றார்."
617,அவருக்குக ஒரு புதல்வர் பிறந்தார்.
618,அப் புதல்வருக்குச் சீராள தேவர் என்னும் பெயர் சூட்டப்பட்டது.
619,சீராளதேவர் பிறை என வளர்ந்து வந்தார்.
620,அவர் தக்க பருவத்தில் பள்ளிக்கனுப்பட்டார்.
621,திருச்செங்காட்டங்குடிக்குத் திருஞானசம்பந்தப் பெருமான் எழுந்தருளினார்.
622,"அவர்தம் வருகையைக் கேள்வியுற்ற சிறுத் தொண்டர், அவரை எதிர்கொண்டு அழைத்து வந்தார் அன்பில் மூழ்கிப் பலவித உபசாரஞ் செய்தார்."
623,"திருஞானசம்பந்தப் பெருமான், சிறுத்தொண்டரைத் தமது திருப்பதிகத்தில் வைத்துச் சிறப்பித் தருளினார்."
624,"சிறுத்தொண்டரின் திருத்தொண்டு, திருக்கயிலையையும் ஈர்த்தது."
625,"சிறுத்தொண்டரது வீட்டை அணுகி, வாயிலிலே நின்றார் சிறுத்தொண்டர் வீட்டில் உளரா?"
626,அடிகள் உள்ளே எழுந்தருளலாம் என்று சொன்னார்.
627,"அதற்கு வயிரவர், பெண்கள் உள்ள இடத்தில் நாம் தனித்துப் புகுவதில்லை என்று திருவாய் மலர்ந்தருளினார்."
628,"அவ் வுரை, திருவெண்காட்டு நங்கையார்க்குகக் கேட்டது."
629,"அடியவர் போய் விடுவாரோ என்று எண்ணி ஓடி வந்தார் வந்து, அடிகளே!"
630,"நாயனார், அடியவர்களுக்கு நாடோறும் அமுது செய்விப்பது வழக்கம் இன்று ஓர் அடியவரும் வரவில்லை."
631,"அதனால் அவர், அடியவர்களைத் தேடிப் போயுள்ளார் இப்பொழுது வருவார்."
632,புதிதாக அடிகள் எழுந்தருளி இருக்கிறீர்.
633,"அடிகள் திருவேடத்தைப் பார்த்தால், நாயனார் மகிழ்வெய்துவார்."
634,அடிகள் உள்ளே எழுந்தருள்க என்று வேண்டினார்.
635,சிறுத்தொண்டர் வந்ததும் இதைத் தெரிவியுங்கள் என்று கூறிக் கணபதீச்சுரத்தை அணைந்தார் திரு ஆத்தியின்கீழ் வீற்றிருந்தார்.
636,சிறுத்தொண்டர் அடியவர்களைத் தேடித் தேடி அலைந்தார் ஒருவரையுங் காணாது வீடு சேர்ந்தார் நிலைமையயை மனைவியார்க்குக் கூறி வருந்தினார்.
637,"அம்மையார், நாயனனாரைப் பார்த்து, இப்பொழுது இங்கே ஒரு வயிரவர் வந்தார் என்று சொன்னார்."
638,"அச் சொற் கேட்டதும், நாயனார் உய்ந்தேன் உய்ந்தேன் என்று கூத்தாடினார் அவர் எங்கே?"
639,என்று கேட்டார்.
640,"அம்மையார், அவர் வடதேசத்தவாரம்."
641,அவரை இங்கே இருக்கக வேண்டினேன்.
642,அவர் இசையாது சென்றார்.
643,அவர் கணபதீச்சுரத் துள்ள திரு ஆத்தியின் கிழ் அமர்ந்திருக்கிறார் என்று கூறினார்.
644,என்று கேட்டார்.
645,"அன்பர், சிவனடியார்கள் எளியேனை அப்படிச் சொல்வது வழக்கம் என்றார்."
646,"நாயனார் வயிரவரை மீண்டும் வணங்கி, அடிகளே!"
647,"அதற்குச் சிறுத்தொண்டர், அடிகள் ஏன் அப்படிச் சொல்கிறீர்கள்?"
648,அடிகளின் உணவு முறையைத் தெரிவியுங்கள் அவ்வாறே செய்விப்பேன் அருமை ஒன்றும் இல்லை என்றார்.
649,"அது கேட்ட வயிரவர், நாம் ஆறுமாதத்துக்கு ஒருமுறை உணவு கொள்ளும் இயல்பினோம்."
650,அந் நாள் இந் நாளாகும்.
651,"இன்று, பசுவைக் கொன்று சமைத்து உண்பது நமது வழக்கம்."
652,இஃது உமக்கு அருமையன்றோ?
653,அதற்குச் சிறுத்தொண்டர் சால நன்று!
654,எனக்கு முந்நிரையும் உண்டு.
655,ஒன்றுங் குறைவில்லை.
656,அடிகளுக்குத் திருவமுதமாகும் பசு இன்னதென்று தெரிதல்வேண்டும்.
657,"தெரிந்தால், யான் போய் அமுதாக்குவித்து விரைவில் திரும்புவேன் என்று சொல்லி வணங்கினார்."
658,"வயிரவர், தொண்டரே!"
659,நாம் உண்ணும் பசு நரப் பசுவாகும்.
660,"அஃது ஐந்து வயதுடையதாய், உறுப்பில் பழுதில்லாதாய் இருத்தல் வேண்டும்."
661,இன்னும் அதன் இயல்பைக் கூறுவோம்.
662,"கூறினால், அஃது உமக்குப் புண்ணில் வேல் எறிந்தாற்போல் தோன்றுமே!"
663,"சிறுத்தொண்டர், நன்றாகக் கூறலாம் என்றார்."
664,இவ்வாறு அரிந்து சமையல் செய்தால் நாம் உண்போம் என்றார்.
665,"சிறுத்தொண்டர், இஃதும் எனக்கு அரியதன்று அடிகள் திருவமுது செய்ய இசைவது போதும் என்று கூறி வேண்டினார்."
666,வயிரவர் இசையலானார்.
667,சிறுத்தொண்டர் பேரானந்தத்துடன் வீடு நோக்கி விரைந்து நடந்தார்.
668,அவர்தம் வருகையை வெண்காட்டு நங்கையார் ஆவலுடன் எதிர்நோக்கிக் கொண்டிருந்தார்.
669,"நாயனார் முகமலர்ச்சி யோடு வருதலை நங்கையார் கண்டார் கண்டு, அகமகிழ்ந்தார்."
670,"அம்மையார் நாயனாரை வணங்கி, வயிரவர் செய்கையைக் கேட்டார்."
671,"நாயனார், வயிரவர் விருப்பத்தைத் தெரிவித்தார்."
672,"அதுகேட்ட அம்மையார், ஒரு குடிக்கு ஒருவனாக உள்ள சிறுவனை எப்படிப் பெறுவது?"
673,என்று வணங்கி நின்றார்.
674,"நாயனார் அம்மையாரைப் பார்த்து, நிரம்பப் பொருள் கொடுத்தல் சிறுவனைப் பெறு சிறுவனை உவப்புடன் அரியத் துணியும் பெற்றோர் கிடைப்பரோ!"
675,கிடைத்தல் அரிது.
676,இனிக் காலந்தாழ்த்தல் ஆகாது.
677,நமது அருமைப் புதல்வனை அழைப்போம் என்று துணிந்து கூறினார்.
678,"அம்மையார், நங்குலமணியைப் பள்ளியி னின்றும் அழைத்து வாரும் என்றார்."
679,உடனே சிறுத்தொண்டர் பள்ளிக்குப் போனார்.
680,சீரான தேவர் ஓடிவந்து தந்தையைத் தழுவிக்கொண்டார்.
681,சிறுத்தொண்டர் பிள்ளையைத் தூக்கித் தோள்மேல் வைத்து வீட்டுக்கு வந்தார்.
682,சிறுத்தொண்டர் புத்திரனை அன்போடு வாங்கினார் அடுக்களைக்குச் செல்லாமல் வேறார் இடத்திற்குச் சென்றார்.
683,அம்மையார் பாத்திரங்களைக் கழுவி எடுத்துக்கொண்டு உடன் போனார்.
684,"சிவபத்தியிலேயே ஈடுபட்டு நின்ற சிறுத்தொண்டர், பிள்ளையின் தலையைப் பிடித்தார்."
685,அம்மையார் பிள்ளையின் காலை மடியிலே இடுக்கினார் இரண்டு கைகளையும் தமது இரண்டு கைகளால் பற்றினார்.
686,சீராளதேவர் பெற்றோர் மகிழ்கிறார் என்று கருதி நகை செய்தார்.
687,சிறுத்தொண்டரும் அம்மையாரும் நம் புதல்வன் நமக்குப் பெரும்பேறு அளித்தான் என்று மகிழ் வெய்தினர்.
688,அம் மகிழ்வுடன் சிறுத்தொண்டர் செயற்கருஞ் செய்கை செய்தார்.
689,தலை இறைச்சி அமுதுக்கு உதவாதென்று அதை விலக்குமாறு அம்மையார் தோழியாரிடங் கூறினார்.
690,மற்ற உறுப்புகள் எல்லாம் சமைக்கப்பட்டன.
691,வேறு கறி வகைகளும் செய்யப்பட்டன.
692,சோறும் ஆக்கப்பட்டது.
693,சமையல் வேலை முடிந்ததை அம்மையார் நாயனார்க்குத் தெரிவித்தார்.
694,"சிறுத்தொண்டர் களிகூர்ந்து, திருஆத்தியை அடைந்தார் வயிரவரைத் தொழுதார் தொழுது, அடிகள் விரும்பியவாறு சமையல் செய்யப்பட்டது."
695,கருணை கூர்ந்து எழுந்தருள்க என்று வேண்டி நின்றார்.
696,வயிரவர் புறப்பட்டார்.
697,நாயனாரும் உடன் போந்தார்.
698,இருவரும் விடு சேர்ந்தனர்.
699,"நாயனாரும் அம்மையாரும் வயிரவர்க்கு முறைப்படி வழிபாடு செய்தனர் செய்து, அமுது படைக்கும் வகை எப்படி?"
700,என்று வயிரவரைக் கேட்டனர்.
701,"வயிரவர், சோற்றுடன் கறிகளையும் ஒக்கப் படைக்க என்றார்."
702,"வெண்காட்டு நங்கையார், பரிகலந் திருத்திச் சோறு கறிகளை முறைப்படி படைத்தார்."
703,"வயிரவர் அதனைத் திருநோக்குஞ்செய்து, பசுவின் உறுப்புகள் எல்லாவற்றையுஞ் சமைத்தீரா?"
704,என்று கேட்டார்.
705,"அம்மையார், தலை இறைச்சி திருவமுதுக்கு ஆகாதென்று அதைக் கழித்தோம்."
706,பிற சமைக்கப் பட்டுள்ளன என்றார்.
707,வயிரவர் தலையும் வேண்டும் என்றார்.
708,நாயனாரும் நாயகியாரும் திகைத்து நின்றனர்.
709,திருவெண்காட்டுநங்கையார் அகம் மலர்ந்தது.
710,நங்கையார் அத்தலை இறைச்சியையும் வாங்கி அன்புடன் படைத்தார்.
711,"பிறகு வயிரவர் சிறுத்தொண்டரைப் பார்த்தார் பார்த்து, நாம் தனியே உண்பதில்லை சிவனடியார்களுடன் உண்பது வழக்கம்."
712,அவர்களை அழைத்து வாரும் என்றார்.
713,நாயனார்க்குச் சொல்லாணோ வருத்தந் தோன்றிற்று.
714,இவர் திருவமுதுசெய்ய இடையூறு நேர்ந்ததே என்று ஏங்கினார் வெளியே போனார் சிவனடியார்களைத் தேடினார் ஒருவரையுங் கண்டாரில்லை.
715,சோர்வுடன் வீட்டிற்குத் திரும்பினார்.
716,நிலைமையை வயிரவர்க்குத் தெரிவித்துத் திருநீறு அணிந்தவர்க்கே யான் சோறிடுவது வழக்கம் என்று சொல்லி வணங்கினார்.
717,"வயிரவர் நாயனாரை நோக்கி, உம்மைப்போலத் திருநீறு இட்டவரும் உளரோ?"
718,"ஆகவே, நீர் எம்முடன் அமர்ந்து அமுது செய்க என்று அருளினார்."
719,"அதற்குமேல் வயிரவர், நங்கையாரை நோக்கி, நமக்குப் படைத்த சோறு கறிகளில் இருந்து எடுத்து இவருக்கும் படைக்க என்று பணிந்தார்."
720,உடனே நங்கையார் அப்படியே செய்தார்.
721,"சிறுத்தொண்டர் நாம் உண்டால் வயிரவரும் உண்பார் என்று எண்ணி, முதலில் உண்ணப் புகுந்தார்."
722,"வயிரவர், சிறுத்தொண்டரைத் தடுத்தார் தடுத்து, நாம் அன்னம் உண்டு ஆறுமாதகாலமாயிற்று."
723,நீர் நாள்தோறும் உண்பவர்.
724,நாம் உண்ணும்வரை நீர் பொறுத்தலாகாதா?
725,நம்முடன் உணவு கொள்வதற்குப் புத்திரன் இல்லையோ?
726,இருப்பின் அவனையும் அழையும் என்றார்.
727,"நாயனார், எனக்குப் புதல்வன் உண்டு ஆனால் அவன் இப்போது இங்கு உதவான் என்று சொன்னார்."
728,"வயிரவர், அவன் வந்தாலன்றி நாம் உண்ணோம் அவனைத் தேடி அழைத்து வாரும் என்றார்."
729,நாயனாரும் நாயகியாரும் என்செய்வர்!
730,திருவருளை நினைந்து வெளியே போந்தனர் மைந்தா!
731,வயிரவர் உடனுண்ண அழைக்கிறார் வாராய்!
732,என்று ஓலமிட்டு அழைத்தனர்.
