Line Number,Sentence
2858,இவ்விலையுயர்ந்த பொருள்களை எவ்வாறு கைவிட்டுப் போகாமற் காப்பது?,False
2859,இக்கற்களை நாம் விழுங்கி வயிற்றில் வைத்துக் கொள்வோம்.,False
2860,அப்போது திருடர் பயம் ஏது? என்றான்.,False
2861,அவ்வாறே அம் மூவரும் அன்றிரவு உணவருந்தும்போது தத்தம் கற்களை உணவோடு உட்கொண்டுவிட்டனர்.,False
2862,அவன் பொல்லாத வேளை அவனுக்கு ஒரு கல்லும் அகப்பட வில்லை.,False
2863,இந்நிலையில் அவன் அங்கு ஓரிடத்தில் உட்கார்ந்து கொண்டு சிந்தனையில் ஆழ்ந்தான்.,False
2864,அவனிருந்த இடத்திற்கு அருகிலேயே முன்சொன்ன மூவரும் அப்போது உணவருந் தினர்.,False
2865,"ஆனால், இவர்கள் அங்கு அம்மனிதனிருப்பை அறிந்தார்களில்லை.",False
2866,"ஆனால், அவனோ இவர்கள் செய்கையை யெல்லாம் பார்த்துக்கொண்டு பேசாமலிருந்தான்.",False
2867,நான் கொடுத்து வைக்காமையால் எனக்கொன்றுங் கிட்டவில்லை.,False
2868,இவர்கள் ஒவ்வொருவருக்கும் ஒவ்வொரு கல் அகப்பட்டிருக்கின்றது.,False
2869,நான் இவர்களைப் பின் தொடர்ந்து போய் இவர்களுடன் சேர்ந்து கொள்வேன்.,False
2870,இவர்கள் அயர்ந்து தூங்கும் போது இவர்களை வெட்டிப்போட்டு இவர்கள் வயிறுகளிலுள்ள மாணிக்கங்களைக் கவர்ந்து கொள்வேன்.,False
2871,"நினைத்தவன், மூன்று நண்பர்களும் வழிக்கொண் டேகப் பார்த்து அவர்களைப் பின் தொடர்ந்தான்.",False
2872,அவன் சில நேரத்துக்கெல்லாம் அவர்களைக் கூடி அவர்களிடஞ் சொல் கின்றான்.,False
2873,யான் ஒரு வழிப்போக்கன் இந்தக் காட்டு வழியே ஒன்றியாகப் போக மனந் துணியவில்லை.,False
2874,நல்ல காலமாக நீங்கள் என் கண்ணுக்கு அகப்பட்டீர்கள்.,False
2875,அவ்வூரின் கோடியில் அவ்வூராளியின் மாளிகை இருந்தது.,False
2876,அவன் பல பறவைகளை வேடிக்கைக்காக அம்மாளிகையில் வளர்த்து வைத்துக்கொண்டிருந்தான்.,False
2877,அவைகளில் ஒன்று பாட்டுப் பாடிற்று.,False
2878,அவ்வூராளிக்குப் பறவைகள் பாட்டுக்களின் கருத்து நன்கு தெரியும்.,False
2879,"அப்பறவை பாடினதைக் கேட்டு, அவன் அவ்வழிப்போக்கர்களைக் கூவியழைத்தான்.",False
2880,அக்கூக்குரலைக் கேட்டுத் திடுக்கிட்டுத் திரும்பி வராமலிருக்க அஞ்சி மெதுவாய் நடந்துவந்து அவ்வூராளியினெதிரில் நின்றனர்.,False
2881,அதற்கு மேல் அவன் ஆட்களைவிட்டு அவர்கள் உடைகளைச் சோதிக்கும்படி கட்டளையிட்டான்.,False
2882,ஆட்கள் அவ்வாறு செய்தும் மாணிக்கத்தைக் கண்டார்களில்லை.,False
2883,ஊராளி மனக்கிலேசத் துடனே அவ் வழிப்போக்கர்களைப் போகவிட்டுவிட்டான்.,False
2884,அவர்கள் இரண்டோரடி எடுத்து வைப்பதற்குள் அப் பறவை மறுபடியும் அவ்வாறே பாடிற்று.,False
2885,பார்த்தும் அவன் கைக்குங் கண்ணுக்கும் மாணிக்கம் அகப்படாததனால் அவர்களை மறுபடியும் போகவிட்டான்.,False
2886,அவர்கள் முகந் திரும்பினார்களோ இல்லையோ உடனே அப்பறவை அவ்வாறாகவே பெருங்குரலோடு பாடிற்று.,False
2887,"அவர்களை அவ்வூராளி போகவொட்டாமற் றடுத்து அவர்களை நோக்கி, பாட்டை சாரிகளே!",False
2888,இப்பறவை எப்போதும் பொய்ப்பாட்டுப் பாடுவதில்லை.,False
2889,உண்மையையே பாடும்.,False
2890,உங்களிடம் மாணிக்கம் உண்டென்று முக்காலுஞ் சொன்னது.,False
2891,அதனை யான் முற்றும் நம்புகிறேன்.,False
2892,என்ன சொல்லுகின்றீர்கள்? என்று கண்டித்துக் கடுங்குரலொடு கேட்டான்.,False
2893,"அதற்கு அவர்கள் அவனை நோக்கி ஆண்டவரே, தாங்கள் கடுஞ்சோதனை செய்தீர்களே, உங்கள் கைக்குங் கண்ணுக்கும் அணுக்களும் மறைந்திருக்க வொண்ணாவே!",False
2894,எங்களை என்ன சொல்லச் சொல்லுகின்றீர்கள்? என்றார்கள்.,False
2895,"இதனைக் கேட்ட அவ்வூராளி அவர்களை நோக்கி, பறவையோ பொய்யாதது உங்களிடம் மாணிக்கம் கட்டாயமாய் உள்ளதென்று ஊன்றி யூன்றிச் சொல்கின்றது.",False
2896,"அம்மாணிக்கம் உங்கள் உடைகளிற் காணப்படாவிட்டாலும், உங்கள் ஊனுக்குள் மறைந்து கிடக்கின்றதென்றே யான் உறுதியாக உளங்கொண்டிருக் கின்றேன்.",False
2897,இப்போது பொழுது போயிற்று.,False
2898,நாளைக் காலையில் உடலையே சோதித்துச் சோதித்துப் பார்க்கவேண்டும் என்ற சொல்லி அந் நால்வரையும் ஓரிருட்டறையில் தள்ளித் தாளிட்டுவிட்டான்.,False
2899,அன்றிரவு மூவருடன் வந்த நடுவழியிற் சேர்ந்த நச் செண்ணத் தோனாகிய நான்காமவன் நள்ளிரவின்கண் தனக்குள்ளேயே நினைக்கின்றான்.,False
2900,அஃதாவது நாளைக் காலையில் இவ்வூராளி ஒவ்வொருவர் வயிற்றையும் கீறிப் பார்க்கப் போகின்றான் போலும்!,False
2901,முதன் முதல் அம்மூவரில் ஒருவனைச் சோதித்துப் பார்த்தானாயின் கட்டாயமாய் மாணிக்கத்தைக் காணவே போகிறான்.,False
2902,உடனே ஏனைய மூவருக்கும் விதி முடிய வேண்டியது தானே அவர்களில் யானும் ஒருவனல்லனோ!,False
2903,எப்படியாயினும் என்னுயிர் போகவே போகின்றது இப்போது என்ன செய்யலாம்?,False
2904,தன்னுயிர் நீத்தும் பிறர் உயிர்களைக் காப்பவன் நற்கதியடைவானன்றோ!,False
2905,ஆகையினாலே அவ்வூராளியின் கொடுஞ்செயலுக்கு யான் முந்திக் கொள்வேன்.,False
2906,அவன் என் உடலைச் சோதித்துப் பார்த்து விட்டானானால் அவன் பேராசை அடங்கிப்போய்விடும்.,False
2907,ஓருயிரை வீணே கொன்றொமென்று கழிவிரக்கங்கொண்டு தான் கொல்லவேண்டுமென்று வந்த அம்மூவரையும் கொல்லாமலே விட்டுவிடுவான்.,False
2908,"என்னோருயிரை இழந்து உடன்வந்த மூவருயிரையுங் காத்து, இனிவரும் பிறப்பிலாவது நல்வாழ்வு பெற இதுவே வழியாகும்.",False
2909,"சாவுக்குப் பயப்படுவானேன் அஃது ஆறிலும் உண்டு, நூறிலும் உண்டு என்பதே.",False
2910,"அப்போது நான்காமவன் ஊராளியை நோக்கி, அப்பனே!",False
2911,என் நண்பர்களின் வயிற்றை அறுக்கும்போது யான் என் கண்ணால் அதனைப் பார்த்துக் கொண்டிருக்க முடியாது.,False
2912,"ஆகையால், ஆண்டவனே!",False
2913,மாணிக்கமே காணோம்.,False
2914,ஊராளிக்கு மட்டற்ற மன வருத்தம் உண்டாய் விட்டது.,False
2915,குருவின் பேச்சைக்கேட்டுக் கோரவதை செய்துவிட்டேன்.,False
2916,பறவையின் பேச்சைக் கேட்டுப் பாவத்துக்காளேனேன்.,False
2917,பேராசையாற் பிணிப்புண்டு தீராவருத்தம் வைத்துக்கொண்டேனே!,False
2918,பெருங்கொலை செய்து பெற்ற பயன் யாது?,False
2919,எண்ணம் ஈடேறிற்றா?,False
2920,இல்லையே இவன் தன் வயிற்றிற் போலவே அவர்கள் வயிற்றிலும் மாணிக்கங் காணப்போகிறதில்லை.,False
2921,நான் ஏன் கொலைமேற் கொலை செய்யவேண்டும்.,False
2922,அப்படிச் செய்தாலும் பலன் யாதொன்றுங் காணப் போகிறதில்லை.,False
2923,உங்கள் நண்பனைப் படுகொலை செய்ததற்காக உங்களை மன்னிப்புக் கேட்டுக்கொள்கின்றேன்.,False
2924,உங்கள் மனங்கொண்ட இடத் திற்கு நீங்கள் போகலாம் என்றான்.,False
2925,உடனே அம்மூவரும் அவ்விடம் விட்டுச் சரேலென நடந்தார்கள்.,False
2926,வழியில் தங்களுக்கு நேர்ந்த பேரிடையூற்றைக் குறித்துப் பேசலாயினர்.,False
2927,அரசமகன் நண்பர்களே!,False
2928,"எவனோ ஒருவன், வழியில் வந்து சேர்ந்தான்.",False
2929,முதன் முதல் அவன் தன்னுயிரை விடுவதற்குக் காரணமென்ன?,False
2930,அஃது எனக்கு விளங்கவில்லையே.,False
2931,செட்டிமகன் அவன் துணிச்சல் யாருக்கு வரும்.,False
2932,உயிரை விட்டு உயிர்களைக் காப்பாற்றினான்.,False
2933,அவனல்லனோ வீரசிகாமணி!,False
2934,வாத்திமகன் அவன் எப்படியோ நம்மிடம் மாணிக்கம் இருப்பதைக் கண்டு கொண்டிருக்கின்றான்.,False
2935,எண்ணிப் புண்ணியஞ் சம்பாதித்துக் கொண்டான் என்றே தோன்று கின்றது.,False
2936,மூவரும் இவ்வாறு பேசிக்கொண்டே நடந்துபோய் ஒரு நகரை யடைந்து மாணிக்கங்களை விற்றுப்பெரும் பொருள் அடைந்தனர்.,False
2937,அரச மகன் அந் நாட்டுச் சேனையிற் சேர்ந்து படிப்படி யாகத் தளகர்த்தனானான்.,False
2938,வாத்தியின் மகனோ கல்வியில் மேன்மேலுந் தேறிப் பெரு நாவலனாய் அந் நகர்க் கலாசாலை யில் சிறந்த சொற்பொழிவாளனானான்.,False
2939,பேராசைப் பேயன் நட்பிற் சிறந்த நான்கு அந்தணர் ஓரூரில் உறைந்திருந் தனர்.,False
2940,அவர்களை வறுமை பிடுங்கித் தின்றது.,False
2941,இப்பொல்லாத வறுமையை போக்கடிக்க ஒரு வழி தேடவேண்டுமே!,False
2942,"ஒருவன் வலுவுடையவனாக இருக்கலாம், அழகுடையவனாக இருக் கலாம், பேச்சு வன்மையுடைவனாக இருக்கலாம், கற்றுவல்ல பெரும்புலவனாகவுமிருக்கலாம்.",False
2943,அவனுக்குப் பணமின்றேல் இவ்வுலகு என்னத்திற்கு!,False
2944,அவன் நடைபிணத்திற்கு நேரன்றோ!,False
2945,வறுமைப் பிணியால் வருந்தியிருப்பதைக் காட்டிலும் எமனால் பிணிக்கப்பட்டு உயிர்விட்டுப் போய்விடுவதே நலாமன்றோ!,False
2946,அந் நால்வரும் பல காவதங்கள் நடந்து ஓருரை யடைந்தனர்.,False
2947,நடக்கும் வழியில் மாயவித்தையிற் பேர்போன ஒரு மந்திரக்காரனைக் கண்டார்கள்.,False
2948,கண்டு வணங்கி அவர்கள் அவனுடன் சென்று ஒரு குகைக்குள் புகுந்தனர்.,False
2949,"புகுந்ததும் அவன் இந்நால்வரை நோக்கி, நீங்கள் எந்த ஊர், எங்கே போகின்றீர்கள்?",False
2950,ஏங்கி இளைத்து இவ்வாறு கால்நடையாகப் போவதின் நோக்கம் என்ன?என்று கேட்டான்.,False
2951,"அதற்கு அவர்கள், நாங்கள் மிகத்தொலைவிலிருந்து வருகின்றோம் பணக்காரர் ஆனால் ஆவது இன்றேல் பிணங்களாகப் போய்விடுவது என்று உறுதி கொண்டிருக்கின்றோம்.",False
2952,அதற்குத் தக்க ஆசிரியரைத் தேடியலைகின்றோம்.,False
2953,இவர்களை நோக்கிச் சொல்லுகின்றான்.,False
2954,"இதோ, நீங்கள் ஒவ்வொருவரும் ஓரிறகு எடுத்துக்கொள்ளுங்கள்.",False
2955,இம்மலைச் சாரலுக்குச் சென்று மேலேறி நடவுங்கள்.,False
2956,"எவனுடைய இறகு கீழே எங்கு விழுகின்றதோ, அங்கே அவனுக்குப் பொருள் கிடைக்கும்.",False
2957,"ஆனால், உங்களுக்கு ஒன்று சொல்கின்றேன்.",False
2958,"ஆசைக்கோ ரளவுண்டு, என்பதை மறவாதீர்கள்.",False
2959,போய்வாருங்கள் இதனைக் கேட்டுக்கொண்டு மந்திரக்காரனை வணங்கி அந் நால்வரும் இமயமலைச்சாரலை நோக்கி நடந்தனர்.,False
2960,"மலைச்சாரலைக் கண்டு, அதன் மீதே நால்வரும் சில மணி நேரம் நடக்க, ஆங்கோர்மேட்டின்மேல் முதலாவதாக ஒருவன் இறந்து விழுந்தது.",False
2961,நால்வருஞ் சேர்ந்து அவ்விடத்தைத் தோண்டினர்.,False
2962,மற்றவர்கள் அவனை நோக்கி முழுமுட்டாளே!,False
2963,இச்செம்பினால் நமக்கென்ன பயன்!,False
2964,இதனால் நமது வறுமை தீர்ந்துவிடுமா?,False
2965,இவ்விடம் விட்டு இன்னும் ஏறிப்போகலாம்என்றனர்.,False
2966,இச் செப்புத்தூள்களே எனக்குப் போதும் என்றான்.,False
2967,மற்ற மூவரும் இவன் அறிவில்லாதவன் என்று சொல்லிவிட்டு மலையின்மேல் ஏறிப்போனார்கள்.,False
2968,"செம்பு கண்டவனோ தான் தூக்கக் கூடியவரையில் செப்புத்தூள்களைச் சேகரித்து வாரி, மூட்டை கட்டிக்கொண்டு திரும்பிப் போய்விட்டான்.",False
2969,"அப்போது இரண்டாவது மனிதன் அவர்களை நோக்கி, நீங்கள் போகலாம்.",False
2970,நான் வரமாட்டேன்.,False
2971,நான் ஆசாரியன் மொழிப்படி நடக்கவேண்டும்.,False
2972,இந்த வெள்ளித் தகடுகளே எனக்குப் போதும் என்றான்.,False
2973,இதனைக் கேட்ட மற்றை இருவரும் மலையேறிப் போயினர்.,False
2974,வெள்ளித் தகட்டுக்காரனோ சுமக்கக் கூடிய வரையில் வெள்ளித் தகடுகளை யெடுத்துத் தலைமேல் வைத்துக்கொண்டு தன்னூர் திரும்பினான்.,False
2975,திட்டென நின்று இருவரும் அவ்விடத்தைக் கொத்தினர் மண்ணெல்லாம் பொன்னாக விருந்தது.,False
2976,பார்த்தான் பொன்னுடையான்.,False
2977,மட்டற்ற மகிழ்ச்சி மேற்கொண்டான்.,False
2978,நண்பனே பொன்னே அகப்பட்டு விட்டது அதுவும் மட்டற்றுக் கிடக்கின்றது.,False
2979,நாம் இருவரும் வேண்டியவரையிற் கட்டி யெடுத்துக்கொண்டு கடுகென ஊர் போய்ச் சேரலாம்.,False
2980,பொன்னை விட மேலான பொருளும் உண்டா!,False
2981,வீணாசை வேண்டா.,False
2982,கட்டிக்கொள் மூட்டை.,False
2983,சட்டெனச் செல்லலாம். என்றான்.,False
2984,"இதனைக்கேட்ட கடையானவன் பொன்னாளனை நோக்கி, அடா அடிமுட்டாளே!",False
2985,செம்பும் வெள்ளியும் பொன்னும் முறையாக அகப்பட்டுக்கொண்டு வந்தனவே!,False
2986,இனி மாணிக்கமே அகப்படுமென்பதற்கு மாறேதாயினு முண்டோ!,False
2987,இன்னும் போய்ப் பார்க்கவேண்டும்.,False
2988,எழுந்திரு போகலாம். என்றான்.,False
2989,"பொன்னாளன், போடா போ!",False
2990,ஆசைக்கும் ஓர் அளவு வேண்டுமென்றாரே நமது மந்திரகுரு.,False
2991,அதனை நீ சிறிதளவும் எண்ணிப் பார்க்கவில்லையே.,False
2992,வேண்டுமானால் நீ போய்வா யான் உனக்காக இங்குக் காத்துக்கொண்டிருக்கின்றேன் என்றான்.,False
2993,பொன் வெறுத்துக் கன்மேலாசை வைத்தவன் தனி வழியே போயினான்.,False
2994,சில தூரஞ்சென்று சுற்றிச் சுழன்று ஓரிடத்தைச் சேர்ந்தான்.,False
2995,அங்கு அனல் வீசுகின்றது.,False
2996,கண் பஞ்சடைகின்றது.,False
2997,நாக்கு வறட்சி கொடுக்கின்றது தாகமோ சொல்லுந்தரமன்று.,False
2998,அவன் உடம்பெல்லாம் செந்நீர் ஒழுகினபடியே இருந்தது.,False
2999,"பேராசைப் பேயன் அவனைப் பார்த்து, ஐயாவே!",False
3000,"தலையின் மேலிருந்தொரு சக்கரங் சுழன்றுகொண்டிருக்க, நீர் இங்கு என் செய்துகொண்டிருக்கின்றீர்?",False
