Line Number,Sentence
1077,சிறுதேர் உருட்டி அருளே!,False
1078,தில்லைநட ராசனுக்குப் பல்லாவர வாசகனே!,False
1079,சிறுதேர் உருட்டி அருளே!,False
1080,சூல்கொண்ட காலத்தில் கால்கொள்ளும் எண்ணங்கள் சூழுமே கருவி னுக்கும்!,False
1081,சுவையான எண்ணங்கள் துணிவான வீரங்கள் சூலிலே கருவி லேறும்!,False
1082,வற்றாத எண்ணங்கள் முற்றாகக் கருவாகும் வாய்மையைத் தாயர் எண்ணித் தேள்போலும் மனம்நீக்கிப் பால்மனம் கொளச்சொன்னோய்!,False
1083,சிறுதேர் உருட்டி அருளே!,False
1084,தில்லைநட ராசனுக்குப் பல்லாவர வாசகனே!,False
1085,சிறுதேர் உருட்டி அருளே!,False
1086,தங்கை சுபத்திரை.,False
1087,அறிவுரைக் கொத்தில் அடிகள் பெற்றோள் கடமை எனும் தலைப்பில் மேற்கண்ட கருத்துக்களைக் கூறி உள்ளார்.,False
1088,கல்லாத மூடர்க்குப் பொல்லாத பிறவியது கடல்அலையாய்ப் பெருகி நிற்கும் கைசலிக்க வேதாவும் மெய்சமைக்க வையாமல் கல்வியினைக் கற்க வேண்டும்.,False
1089,பொல்லாத உலகநூற் கல்வியது வையத்தில் போற்றுமே உடலை மட்டும்.,False
1090,புகழ்மிக்க அறிவுநூற் கல்வியினால் நிலையான போற்றுதல் உயிருக் குண்டு.,False
1091,வெல்லாத பொருளில்லை கொள்ளாத புகழில்லை வெற்றியும் குறைவதில்லை.,False
1092,விலங்காக இல்லாமல் அறிவுநூல் கற்றோர்கள் விற்பன்னர் ஆகக் கல்வி செல்லாத பிறவியிலை எனஉண்மை செப்பியவா!,False
1093,சிறுதேர் உருட்டி அருளே!,False
1094,தில்லைநட ராசனுக்குப் பல்லாவர வாசகனே!,False
1095,சிறுதேர் உருட்டி அருளே!,False
1096,வேதா பிரமன்.,False
1097,உலகநூற் கல்வி உடம்பை வளர்க்கும்.,False
1098,கார்மேகம் பொய்த்தாலும் கல்வியெலாம் பொய்த்தாலும் கடவுள்நிலை பொய்ப்ப தில்லை கற்கண்டு கசந்தாலும் கனிச்சாறு கசந்தாலும் கலைத்தமிழ் கசப்ப தில்லை.,False
1099,சீர்நிறைந்த தனித்தமிழைப் பார்நிறைக்க வந்தவனே!,False
1100,சிறுதேர் உருட்டி அருளே!,False
1101,தில்லைநட ராசனுக்குப் பல்லாவர வாசகனே!,False
1102,சிறுதேர் உருட்டி அருளே!,False
1103,போராட்டத்திற்கிடையில் அடிகள் தனித்தமிழ்க் கொள்கையில் வெற்றி கண்டார்.,False
1104,ஆனால் அவர் பல மொழி பயின்றவர் என்பது குறிப்பிடத் தக்கது.,False
1105,பிள்ளைத்தமிழ் சி.,False
1106,அன்பானந்தம் ஆராய்ச்சி முன்னுரை புலவர்.,False
1107,", ..,..., முதல்வர், இராமசாமி தமிழ்க்கல்லூரி, காரைக்குடி காலத்திற் கேற்பக் கவிஞர்கள் தோன்றுவார்கள் என்பது ஆன்றோர் வாக்கு.",False
1108,அதன்படி காலத்திற்குக் காலம் மொழியில் கலைவளர்ச்சியும் இலக்கிய வளர்ச்சியும் தொடர்ந்து நடை பெறுவது வரலாறு காட்டும் உண்மையாகும்.,False
1109,தொல் காப்பியத்தில் சுட்டப்பெறும் வனப்பு எட்டனுள் ஒன்றாகிய விருந்து புதிய புதிய இலக்கியத் தோற்றத்திற்கு வழி கோலியது.,False
1110,இதனால் சங்க காலத்தில் இல்லாத எத்தனையோ இலக்கியங்கள் பிற்காலத்தில் தோன்றலாயின.,False
1111,காலத்திற்குக் காலம் இலக்கியங்கள் மாறி மாறியமைந்தன போலவே தமிழ்க் கவிதைகளின் வடிவமும் மாறி மாறியமைந்தன.,False
1112,அந்த வகையில் இடைக்காலத்தில் தோன்றிய இலக்கிங்கள் சிற்றிலக்கியங்கள் எனப்பட்டன.,False
1113,பொதுவாகச் சிற்றிலக்கியங்களைத் தொண்ணுற்றாறு வகையாகக் கூறுவர்.,False
1114,அவைகளுள் பிள்ளைத் தமிழ் என்பதும் ஒன்று.,False
1115,குழவி மருங்கினும் கிழவதாகும் என்ற தொல்காப்பிய நூற்பாவை ஆதாரமாகக் கொண்டு இந்நூல் அமைந்ததாகக் கொள்வர்.,False
1116,இளமைப்பருவத்தில் குழந்தைகள் செய்யும் ஒவ்வொரு செயலும் கண்டு மகிழத்தக்கனவாகவே இருக்கும்.,False
1117,இம்மகிழ்ச்சி உந்தலின் வெளிப்பாடு தாயின் பாடல்களாக வெளிவருகின்றன.,False
1118,இப்படியாகத் தாய் தான் துய்த்துப் பாடிய பாடல்களே பிற்காலத்தில் புலவர்களால் பாடப் பெற்ற பிள்ளைத் தமிழ்ப் பாடல்களாக வெளிவரலாயின.,False
1119,பிள்ளைச் செல்வத்தின் வழிப் பிறப்பது அன்பு.,False
1120,இவ்வன்பே பின் உலகில் பிறரிடமும் பரவிச் சென்று யாதும் ஊரே யாவரும் கேளிர் என்ற உயரிய பண்பை வளர்க்கிறது.,False
1121,எனவே பிள்ளைப் பாசத்தின் அடிப்படையில் எழுந்தனவே பிள்ளைத் தமிழ் நூல்கள் என்றும் கூறலாம்.,False
1122,அங்ஙனம் பாராட்டுகையில் ஆண் பெண் இருபாலார்க்கும் தனித்தனியே பிள்ளைத்தமிழ் செய்வது மரபாகும்.,False
1123,இந்த வகையில் இலக்கிய இன்பம் பூத்துக் குலுங்கும் பிள்ளைத் தமிழ் நூல்கள் பல தோன்றின.,False
1124,இப்பிள்ளைத்தமிழ் வரிசையில் கவிஞர் திரு.சி.அன்பானந்தம் எழுதிய மறைமலையடிள் பிள்ளைத் தமிழும் ஒன்று.,False
1125,நூலெழுந்த வரலாறு காரைக்குடி இராமசாமி தமிழ்க் கல்லூரி நிறுவனர் திரு.,False
1126,பெரியகருப்பன் செட்டியார் அவர்கள் தமிழ் மொழியிடத்தும் தமிழ்ச் சான்றோர்களிடத்தும் அளப்பரிய பற்றுக்கொண்டவர்கள்.,False
1127,அதனால் மறைமலையடிகள் பிள்ளைத் தமிழ்க் கவிதைப் போட்டி என்ற ஒன்று உருவானது.,False
1128,", முதற்பரிசு பெற்ற வகையில் வெளிவருகிறது.",False
1129,நூலமைப்பு பிள்ளைத் தமிழ்பாடும் மரபிற்கேற்ப இந்நூலும் ஆசிரிய விருத்தத்தால் பாடப்பட்டுள்ளது.,False
1130,பன்னிருசீர்க் கழிநெடிலடி ஆசிரிய விருத்தங்களே மிகுதியாகப் பாடப்பட்டுள்ளன.,False
1131,இடையிடையே சீர்கள் மிகுந்தும் குறைந்தும் உள்ள பாடல்களும் சந்த விருத்தங்களும் காணப்படுகின்றன.,False
1132,வாழ்வில் மனிதன் எப்படி வாழவேண்டும் என்ற குறிப்பை இந்நூலின் அமைப்பு உணர்த்துகிறது.,False
1133,பருவ விளக்கம் பருவ விளக்கம் பற்றிய கருத்துக்களைப் புலவர்கள் ஒரோவழி சில பருவங்களில் அகச் சான்றாகக் கூறுவது உண்டு.,False
1134,குமரகுருபரர் குழந்தை செங்கீரை ஆடுகின்ற முறையை முத்துக் குமாரசாமி பிள்ளைத் தமிழில் குறிப்பிடுகிறார்.,False
1135,பிள்ளையை என்ற அவர் தம் அவையடக்கக் குறிப்பும் பணியுமாம் என்று பெருமை என்பதைக் காட்டுகிறது.,False
1136,"மேலும், பிள்ளை என்றழைக்கும் வேளாளர் குலத்தைச் சார்ந்த குறிப்பையும் உணர்த்துகிறது.",False
1137,குருவினிடம் சீடன் ஒருவன் காட்டும் உணர்ச்சியைப்போல் ஆசிரியர் அடிகளிடம் காட்டி யுள்ள உணர்வை இந்நூலைக் கற்போர் உணரலாம்.,False
1138,தமிழைக் கூறுமிடங்களில் எல்லாம் அடை கொடுத்தே கூறுகிறார்.,False
1139,தமிழ்மொழி ஐந்திணை நெறியளாவிய மொழி.,False
1140,எம்மொழியிலும் இல்லாத அன்பின் ஐந்திணைப் பகுப்பு நம் தமிழில் மட்டுமே காணும் தனிப்பெரும் சிறப்பாகும்.,False
1141,இந்நுட்பத்தை உணர்ந்த கவிஞர் சிறுதேர்ப் பருவத்தில் ஐந்திணைகளையும் மறைமலையடிகளுடன் பொருத்திப் பாராட்டியிருப்பது நீள நினைந்து இன்புறத்தக்கதாக உள்ளது.,False
1142,தானமர்தற்குரிய தேரை முல்லைக்குத் தந்த பாரி வள்ளலைவிட அடிகள் முல்லைப்பாட்டு என்னும் நூலுக்குத் தேர்ந்த உரை தந்தனர்.,False
1143,நிலம் பகுக்கப்படாத பாலை என்னும் பெயரையுடைய பட்டினப்பாலை என்னும் நூலுக்கும் சிறந்த உரையீந்தனர்.,False
1144,குறிஞ்சி நிலக் கடவுளாகிய முருகனுக்கு மும்மணிக்கோவை என்னும் நூலைச் செய்தனர்.,False
1145,சொல்லாட்சி இந்நூலுள் பழமையும் புதுமையும் எளிமையும் கலந்த சொற்கள் கையாளப்பட்டுள்ளன.,False
1146,கச்சிதமாய் கண்ணியம் சளையாது தலைமை வகித்து என்பன எளிய வழக்குச் சொற்கள்.,False
1147,பாவலரின் புது ஆட்சியாக நறுமணம் என்ற பொருளில் கமழ்ச்சி என்ற சொல் கையாளப்பட்டுள்ளது.,False
1148,மேலும் கலப்புத் தமிழ் என்பதைச் சரளத் தமிழ் என்றழைக்கிறார்.,False
1149,"வாழ்த்துதல், புதிய கொள்கை என்ற பொருள்களில் வரும் முகம்மதியரின் தீன் என்ற சொல்லாட்சி சிறப்பாக உள்ளது.",False
1150,"ஆங்கிலேயரை வெண்மக்கள் , என்றும் அவர்களது நூலை வெள்ளை நூல் என்றும் சுட்டும் சொற்கள் நகைச்சுவை தருவனவாக உள்ளன.",False
1151,ஓசையின்பம் பாடல்கள் இனிமையும் ஓசை நயமும் மிக்கனவாக உள்ளன.,False
1152,உவமை உவமை என்பது கவிதைக்கு அணி செய்யும் செய்யுட் பகுதி.,False
1153,அடிகளின் வாழ்வு காலத்தோடு ஒட்டிய தேவையை யுணர்த்தும் காலக் கண்ணாடி என்பதை நன்குணர்ந்த இந்நூலாசிரியர் அதற்கேற்ற உவமைகளைக் கையாளுகிறார்.,False
1154,வான்முறை வைத்துமும் மாரியும் பெய்திட வந்ததை யொத்தவனை என்று அடிகள் மழைக்குச் சமமாகப் போற்றப்படுகிறார்.,False
1155,அதிலும் மாதம் மும்மாரியைப் போன்றவராம்.,False
1156,நாடு செழிக்க வந்த மும்மாரியைப் போலத் தமிழ்ப்பயிர் செழித்து வாழவேண்டி அடிகள் தோன்றினார் என்பது பொருள்.,False
1157,பெய்யெனப் பெய்யும் மழை என்ற வள்ளுவரின் கருத்து ஈண்டு ஒப்புநோக்கற்குரியது.,False
1158,வாராது வந்த மாமணி என்ற பாரதியின் தொடர் ஈண்டு ஒப்புநோக்குதற்குரியதாகும்.,False
1159,அடிகள் திருவெண்ணீறணிந்துள்ள நெற்றியில் பொட்டணிந்துள்ள காட்சி சொல்லும் பொருளும் போல் உள்ளதாம்.,False
1160,சொல்லும் பொருளும் பிரியாதது போலத் திருநீறும் பொட்டுமாகவே அடிகள் எப்போதும் காட்சியளிப்பார் எனத் தெரிகிறது.,False
1161,சிலையுடனொரு மாரன் புவிவரல் போலானாய் என்று அடிகளின் மன்மதனை ஒத்த மேனியழகைப் பாராட்டுகிறார்.,False
1162,உருவகம் உவம உருபினை நீக்கி உவமையை மாற்றிப் போட்டால் உவமை உருவகமாகி விடும்.,False
1163,உவமையில் உவமேயத்தைவிட உவமானம் உயர்ந்தது.,False
1164,ஆனால் உருவகத்தில் இரண்டும் ஒன்றே என்ற சமநிலையைக் கூறி உவமேயத்திற்கு முதலிடம் கொடுப்பது மரபு.,False
1165,இவ்வுருவக அணியின் அருமையை யறிந்த கவிஞர் அரிதான ஓர் உருவகத்தைப் படைக்கிறார்.,False
1166,ஈண்டு மனம் என்பது பூ.,False
1167,மனதில் வந்து தங்கும் தும்பிக்கையானாகிய விநாயகன் வண்டின் இனமாகிய தும்பி சொற்களாலான கவிதை என்பது தேன்.,False
1168,பூவில் தேனிருப்பது இயல்பு.,False
1169,அத்தேனை வண்டு உண்ண வருவதும் மரபு.,False
1170,ஆனால் ஈண்டுத் தும்பி தேனை உண்ண வாராமல் கொடுக்க வருகிறது என்கிறார் கவிஞர்.,False
1171,சொற்களாலானது கவி.,False
1172,சொல் தேன் என்றால் சொற்களாலான கவிதையும் தேனன்றோ!,False
1173,எனவே சொற்சுவைத் தேன் மணம் சூழ்கவி என்பது கவித்தேன் என்பதாகப் பொருள்படும்.,False
1174,கவிதந்திடும் தும்பி என்றதால் மனமாகிய பூவில் இயல்பாகத் தேறாமல் தும்பி கொணரும் தேனையே மனப்பூப் பெற்றுக்கொண்டது என்பது பொருள்.,False
1175,மறைமலையடிகளைப் பற்றி சின்னம்மை சொக்கனார் தாம் பெற்ற செல்வமே என்று அடிகளின் தாய் தந்தையரை அறிமுகப்படுத்துகிறார் கவிஞர்.,False
1176,நாகப்பட்டினத்தையடுத்த காடம்பாடியில் அடிகளின் தந்தை சொக்கநாதர் மருத்துவராக விளங்கினார் .,False
1177,பெற்றோர் குழந்தைப் பேற்றிற்காகத் திருக்கழுக்குன்றத்துச் சிவனை யெண்ணி நோன்பிருந்து பெற்றதால் அடிகள் வேதாசலம் எனப் பெயர் பெற்றார்.,False
1178,சைவ வேளாளர் வகுப்பைச் சார்ந்தவர் .,False
1179,"பரணியிற் பிறந்தார் தரணியை ஆள்வார் என்பதற் கொப்ப ஓங்கிய தரணி யாண்டிடப் பரணி ஓச்சிய நன்னாளில் , பிறந்தார்.",False
1180,இறையருளால் தோன்றிய காரணத்தால் மீண்டும் பிறவாப் பெருநெறியுடன் வாழ்ந்தார்.,False
1181,தாயின் கருப்பேறார் நெறி தாம் போற்றிடத் தோன்றி என்கிறார் பாவலர்.,False
1182,மறைமலையடிகள் என்றாலே தனித்தமிழ்த் தந்தை என்ற நினைவு அனைவருக்கும் எழுவது இயல்பு.,False
1183,என்ற இராமலிங்கரின் அருட்பாவிலுள்ள தேகம் என்ற சொல் தனித்தமிழ்ப் பணியாற்றத் தூண்டியது.,False
1184,இதனால் தனித்தமிழ்ச் செப்பமும் செய்துலகு திறம்புரிய வைத்த செம்மல் எனப் பாவலரால் பாராட்டப் பெற்றார்.,False
1185,தற்காலத் தமிழ்மொழி வரலாற்றில் இந்தி எதிர்ப்பு என்பது மிகவும் குறிப்பிடத்தக்க ஒன்றாகும்.,False
1186,அடிகள் காலத்தில் தான்இந்தி எதிர்ப்புணர்ச்சி உருப்பெற்றது.,False
1187,எனவே அவ்வெதிர்ப்புணர்ச்சியாகிய வரலாற்று நிகழ்ச்சியை நீக்கி அடிகளைத் தனித்துப் பார்ப்பதென்பது இயலாது.,False
1188,"எங்கும் தமிழ், எதிலும் தமிழ் என்ற கொள்கையைப் பரப்பியவர் மறைமலையாரே யாவார்.",False
1189,தமிழ் வழிச் சிந்தனையே தமிழரை வாழ வைக்கும் என்ற உயர்ந்த நம்பிக்கை கொண்டவர்.,False
1190,"மொழித் தொண்டைப் போலவே சமயத்தொண்டும், சமூகத்தொண்டும் செய்தவர்.",False
1191,தமிழ்மொழி வாழ வேண்டி இறைவனே மறைமலையை யனுப்பி வைத்தார் எனப் பாவலர் கூறுகிறார்.,False
1192,தன்னை நன்றாகத் தமிழ்செய்யுமாறே என்ற திருமூலரின் கருத்தோடு ஒப்புநோக்குதற்குரியது.,False
1193,திருவள்ளுவர் ஆண்டு என்ற ஒன்றை அடிகள் உறுதிப்படுத்தித் தமிழர்களுக்கு அறிமுகப்படுத்தியது அடிகளின் வரலாற்றில் மிக மிகப் போற்றுதற்குரிய பகுதியாகும்.,False
1194,திருஞான சம்பந்தர் சமணர்களைச் சைவர்களாக மாற்றியது போலவே அடிகள் கடம்பவன சுந்தரப் பாதிரியாரின் குடும்பத்தையே கிருத்துவத்திலிருந்து சைவத்திற்கு மாற்றினார்.,False
