Line Number,Sentence
3736,வெளியே வா!
3737,"ஏழைகளின் பேச்சினிலே, உழைப்பாளிகளின் மூச்சினிலே வாழ வா!"
3738,.
3739,இருதய சுதந்திரம் தோன்றி மறைந்துபோகக் கூடிய இந்த வாழ்க்கையை மணம் பெறச்செய்வது எது?
3740,சுதந்திரம்!
3741,ஒளிபெறச் செய்வது எது?
3742,சுதந்திரம்!
3743,சுதந்திரமில்லாத வாழ்க்கை பிடுங்கி எறியப்பட வேண்டிய களை மாதிரி.
3744,ஆனால் ஒருவகையான சுதந்திரம் இருக்கிறது.
3745,அடக்கு முறையாகட்டும்.
3746,சிறைவாச மாகட்டும் எதுவும் அதனைப் பந்தப் படுத்திவிட முடியாது.
3747,அதனை யுடையவர்களை யாரும் அடிமைப் படுத்திவிட முடியாது.
3748,அப்படிப்பட்ட சுதந்திரம் என்ன?
3749,அதுதான் இருதய சுதந்திரம்.
3750,அது தெய்வலோகத்திலிருந்து வந்தது.
3751,மனிதனோடு கூடப் பிறந்தது.
3752,"அது, கடவுளாணை என்கிற முத்திரையிடப் பெற்ற சாஸனம்."
3753,கடவுளால் மானிட சமுதாயத்திற்கு அருளப் பட்ட எல்லா நன்கொடைகளிலும் அதுவே சிறந்தது.
3754,.
3755,அன்பின் ஆட்சி ஆள்கின்ற பொறுப்பை ஏற்றுக் கொண்டிருக்கும் அறிஞர்களே!
3756,நீங்கள் பாக்கியசாலிகள்!
3757,அன்பினால் ஜனங்களை உங்கள் வசப்படுத்துங்கள்.
3758,அன்புக்கு ஆட்பட மறுப்போர் இவ்வுலகில் யாருமில்லை.
3759,ஆட்பட்டிருக்கும் ஜனங்கள் உங்களிடம் விசுவாச முடைவர்களா யிருக்கவேண்டு மல்லவா?
3760,"அதற்கு ஒரு வழி உண்டு அவர்கள், தங்களுடைய நன்மைக்குத்தான் முக்கியத்துவம் அளிக்கப் படுகிறது."
3761,தங்களுடைய நன்மைக்குத்தான் ஆட்சி நடை பெறுகிறது என்று மனப்பூர்வமாக உணர வேண்டும்.
3762,அப்படி அவர்களை உணரச் செய்வதில்தான் உங்கள் ஆட்சியின் வெற்றி இருக்கிறது.
3763,அதிகாரத்திற்கு அடங்காதவர் அன்பிற்கு அடங்குவர் என்ற உண்மையை நீங்கள் என்றும் மறவாதிருப்பீர்களாக!
3764,.
3765,"நன்மையும் தீமையும் நன்மை, எவ்வளவு நிதானமாக வளர்கிறது?"
3766,தீமையோ?
3767,வளர்ச்சியில் எவ்வளவு வேகம்?
3768,உலகத்தின் இயற்கையே இப்படித்தானா?
3769,வெடிமருந்தே!
3770,மனிதனை அழிக்கப் பிறந்த கரிய பொடியே!
3771,நீ தோன்றியதெல்லாம் ஆறு நூற்றாண்டுகளுக்கு முந்திதான்.
3772,எவ்வளவு வேகமாக வளர்ந்துவிட்டாய்!
3773,அணுகுண்டாக உருக்கொண்டு மானிட ஜாதியை அச்சுறுத்திக் கொண்டிருக்கிறாய்!
3774,சமாதான தேவதையே!
3775,அறிவுத் தெய்வமே!
3776,விஞ்ஞான மூர்த்தியே!
3777,நீங்கள் எங்கே இருக்கிறீர்கள்?
3778,உங்கள் வளர்ச்சிக்கு எத்தனை இடையூறுகள்!
3779,உங்கள் நடையில்தான் எவ்வளவு சோர்வு!
3780,உங்களால் வாழ வேண்டிய மனிதர்கள் உங்களாலேயே மடிந்து போகிறார்கள்!
3781,என்ன வேடிக்கை!
3782,ஒரு ஞானி இப்பொழுது இந்நிலவுலகைப் பார்ப்பானாகில் மனிதர்களுடைய தவறான போக்கைக் கண்டு ஒன்று அழுவான் அல்லது சிரிப்பான்.
3783,.
3784,"எங்களுக்கு என்ன கொடுமைகள் இழைக்கப்பட்டாலும் அவை களைப் பொறுமையோடு சகிப்போம் ஆம், பொறுமையோடு சகித்துக் கொண்டிருப்போம்."
3785,வாழ்ந்து கொண்டிருப்பதுதான் வாழ்க்கை மூச்சு விட்டுக் கொண்டிருப்பது வாழ்க்கையல்ல.
3786,மற்றவர்களுடைய தேவைக்காக நமது உடலை ஒடித்து உழைப்பது வாழ்க்கையல்ல.
3787,ஆனால் அந்த உழைப்பைப் பெறவேண்டு மென்பதற்காகத்தான் இன்று உலகம் ரத்தக் களரியில் இறங்கியிருக்கிறது.
3788,அப்படி இறங்கியிருப்பதைக் கண்டு நாம் நம்பிக்கை இழக்க வேண்டாம்.
3789,உதயமாவதற்குமுன் நீண்ட இரவு இருப்பதைப் போல இது.
3790,ஆதலின் நம்பிக்கை இழக்க வேண்டாம்.
3791,இக்கரையும் அக்கரையும் .
3792,இக்கரையும் அக்கரையும் இக்கரைக்கு அக்கரை பச்சை என்ற வாசகத்தை அறியாதார் யார்?
3793,"வாழ்க்கையின் எந்தத் துறையில் ஒருவன் ஈடுபட்டிருந்தாலுஞ் சரி, அவனுக்கு அந்தத் துறையில் சிறிது காலங்கழித்து, கசப்பு ஏற்பட்டு விடுகிறது."
3794,ஏன் இந்தத் துறையில் ஈடுபட்டோம் என்று ஏங்குகிறான்.
3795,மாதந் தோறும் குறிப்பிட்ட தேதியில் ஒழுங்காகச் சம்பளம் பெற்றுக் கொண்டிருக்கிற அரசாங்க உத்தியோகதனைக் கேளுங்கள்.
3796,என்ன உத்தியோகம் வேண்டியிருக்கிறது?
3797,"செய்த வேலையையே செய்து கொண்டு, எப்பொழுதும் மேலதிகாரிகளின் ஆணைக்கும் தயவுக்கும் காத்துக்கிடக்க வேண்டியிருக்கிறது."
3798,சுயமாகச் சிந்தித்துச் சுயமாக ஒரு வேலையைச் செய்ய முடிகிறதா?
3799,எதற்கும் வாய்ப்பில்லை.
3800,ஒரு வியாபாரியைக் கேளுங்கள்.
3801,விலைவாசிகள் ஒரு நிலை யில்லாத இந்தக் காலத்தில் வியாபாரத்தில் என்ன சம்பாதிக்க முடியும்?
3802,பாக்கிகளை வசூலிப்பது பெருந்தொல்லையாயிருக்கிறது.
3803,ஒரு மாதத்தில் லாபமென்றால் அடுத்த மாதத்தில் நஷ்டம் ஓயாத கவலை.
3804,"அரசாங்க உத்தியோகத்தில் புகுந்திருந்தால், நாம் செய்கிற வேலை எதுவா யிருந்தாலும், எப்படியிருந்தாலும், மாதந்தோறும் ஒழுங்கான வருவாய் கிடைத்துக் கொண்டிருக்கும்."
3805,இத்தனை நாட்களுக்குள் பெரிய பதவிக்கு வந்து நான்குபேர் மத்தியில் கண்ணியமும் கௌரவமுமாக இருந்திருக்கலாம் கவலையில்லாத வாழ்க்கை.
3806,கடைசியில் பென்ஷனும் வந்து கொண்டிருக்கும்.
3807,வியாபாரத்தில் பிரவேசித்தது என் பெரிய குற்றம் என்று ஏக்கம் தோய்ந்த குரலில் கூறுகிறான்.
3808,எத்தனையோ அனுகூலங்களை எதிர்பார்த்து ஒருவன் ராணுவத்தில் போய்ச் சேருகிறான்.
3809,சொற்பகாலத்திற்குள் என்ன பிழைப்பு?
3810,தினந்தோறும் செத்துப் பிழைக்க வேண்டியிருக்கிறது என்று சொல்லத் தொடங்கி விடுகிறான்.
3811,"உஷ்ணப்பிரதேசத்தில் வசிக்கிறவன், குளிர்ப்பிரதேசத்தில் வசதி ஏற்பட்டால் தேவலையென்று நினைக்கிறான்."
3812,அப்படியே குளிர் மிகுதி யான நாட்டிலே வசிக்கிறவனுக்கு வெயில் மிகுந்த நாட்டிற்குச் சென்று குடியேறிவிடலாமா என்று தோன்றுகிறது.
3813,இப்படி இவர்கள் விரும்பியபடியே இவர்களுக்கு மாறுதல் கிடைக்கிறதென்று வைத்துக் கொள்வோம்.
3814,அப்பொழுது அந்த மாறுதல் நிலையில் சிறிது காலம் இருந்த பிறகு பழைய நிலையை ஏன் விட்டு வந்தோம்?
3815,"புதிய மாறுதல், பழைய நிலையைக் காட்டிலும் மோச மாகவல்லவோ இருக்கிறது?"
3816,அந்த நிலைக்கே திரும்பிப் போய்விடக்கூடிய வாய்ப்புக் கிடைக்காதா என்று எண்ணமிட்ட வண்ணமிருக்கிறார்கள்.
3817,"ஆக, யாருக்கும், இருக்கிற நிலையில் அதிருப்தி இல்லாத நிலையை எண்ணி மகிழ்ச்சி."
3818,உலகத்தில் சர்வசாதாரணமாக இதைப் பார்க்கிறோமில்லையா?
3819,இதற்கு என்ன காரணம்?
3820,"பொதுவாக மனிதன், மாறுதலை விரும்பும் சுபாவமுடையவன்."
3821,"அவனுடைய அகவாழ்க்கையிலாகட்டும் புறவாழ்க்கையிலாகட்டும், இந்தச் சுபாவம் அடிக்கடி பிரதிபலிக்கிறது."
3822,"அவன் உண்ணும் உணவு, உடுக்கும் உடை, இப்படிச் சாதாரண விஷயங்களில் கூட அவன் மாறுதலைக் காண விழைகிறான்."
3823,காதல் வாழ்க்கையைத் தான் எடுத்துக் கொள்ளுங்கள்.
3824,"காதல் மாறுதலடையாதது, அழியாதது, தெய்வத் தன்மை யுடையது என்றெல்லாம் சொல்கி றோம்."
3825,"வாழ்க்கையில் பரிணமிக்கிற போது, அடிக்கடி இல்லா விட்டாலும் ஏகதேசமாகவாவது மாறுதலைப் பெற்றால்தான் சோபிதம் பெறுகிறது புனிதமடைகிறது."
3826,"ஊடலும் கூடலுமாகிய மாறுதல்கள், காதல் வாழ்க்கையின் இயற்கையான நியதிகளா யிருக்கின்றனவல்லவா?"
3827,"மற்றும் மனிதன், கிட்ட ஒன்றைக் காட்டிலும் எட்ட இருக்கின்ற ஒன்றின்மீது பிரமை கொள்கிற சுபாவமுடையவனா யிருக்கிறான்."
3828,"ஏனென்றால், எட்ட இருப்பது அவனுக்கு தூலமாக அல்லது ஒருபிண்டமாகத்தான் தெரிகிறது."
3829,அதாவது அதன் புறத் தோற்றத்தை மட்டுந்தான் பார்க்கிறான்.
3830,அப்பொழுது அது வழவழப்புடையது போலத் தெரிகிறது.
3831,"அதன் மீது ஏற்பட்டுள்ள வரிகள், பிளவுகள் முதலியன தெரிவதில்லை."
3832,"அதன் உள் அமைப்புக் கள், அந்த அமைப்புக்களின் அசைவுகள், அந்த அசைவுகளின் விளைவுகள் ஆகியவை அவனுக்குச் சரியாகப் புலனாவதில்லை."
3833,"பூனைக்காஞ்சி இலை, சிறிது தூரத்திலிருந்து பார்த்தால் பசுமை யாகத்தான் இருக்கிறது தீண்டிப் பார்த்த பிறகல்லவோ அதன் தன்மை வெளிப்படுகிறது."
3834,ஒரே எரிச்சல்.
3835,நமது கண்பார்வை எட்டுகின்ற எல்லையிலிருக்கும் ஒரு கட்டடத்தைப் பார்க்கிறோம்.
3836,நல்ல விதமாகவே தென்படுகிறது.
3837,நாம் அதுகாறும் வசித்துக் கொண்டிருந்த இடமே மேலானதென்று தோன்றிவிடுகிறது.
3838,"அப்படிப்பட்ட சமயங்களில் அவன் மனம், எட்டவிருக்கின்ற ஒன்றின்மீது செல்கிறது."
3839,அது சலிப்புத் தராமலிருக்குமென்று கருதுகிறான்.
3840,ஆனால் அதுவும் ஒரு பிரமை என்பது அப்பொழுது அவனுக்குத் தெரிவதில்லை.
3841,இங்ஙனம் இருக்கின்ற நிலையில் ஒருவனுக்கு அதிருப்தி ஏற்படுவதற்கான காரணங்கள் பலவற்றைச் சொல்லிக்கொண்டு போகலாம்.
3842,அவை ஒரு பக்கம் இருக்கட்டும்.
3843,இருக்கிற நிலையில் திருப்தி காண்பதற்கு என்ன வழி?
3844,வாழ்க்கை பூராவிலும் கூடியமட்டில் கசப்பை அனுபவிக்காமலிருப்பதற்கு ஒருவன் எப்படி நடந்து கொள்ளவேண்டும்?
3845,இவைகளைப் பற்றிச் சிறிது பேசுவோம்.
3846,"அறிவு, பல துறைகளுடையது."
3847,ஒவ்வொருவருக்கும் ஒவ்வொரு துறைபற்றின அறிவு இயல்பாகவே அமைந்திருக்கிறது.
3848,இப்படி அமைந் திருப்பதை ஒவ்வொருவருடைய குழந்தைப் பருவ நடவடிக்கைகளி லிருந்து தெரிந்து கொள்ளலாம்.
3849,"ஒரு குழந்தை, இசை வரும் திசையில் தன் இரு செவிகளையும் நீட்டுவதில் ஆர்வம் காட்டுகிறது."
3850,"ஒரு குழந்தை, ஏதோ ஒரு குச்சியை எடுத்துக்கொண்டு தரையில் உருவங்கள் பலவற்றை வரைவதில் ஈடுபாடு கொள்கிறது."
3851,சிலருக்கு ஆயுள் பூராவிலும் ஆசாபங்கமே நிறைந்திருக்கக் கூடும்.
3852,"சிலரை, சலிப்பும் சோர்வும் வாழ்க்கை முழுவதிலும் அரித்துக் கொண்டிருக்கும்."
3853,"ஆனால் அவன் உள் மனமென்னவோ, தன்னுடைய இளமையில் தன்னை வசப்படுத்திக் கொண்டிருந்த இசைக் கலையோடுதான் உறவாடிக் கொண்டிருக்கும்."
3854,அந்த உறவிலேதான் அவன் இனிமை காண்பான் அமைதி பெறுவான்.
3855,சி.வி.
3856,"ராமன், கணித சாதிரத்தில் நல்ல தேர்ச்சி பெற்றவர்."
3857,அதனால்தான் அவருக்கு அரசாங்கக் கணக்குத்துறை அலுவலகத்தில் உயர்தர உத்தியோகம் கிடைத்தது.
3858,அதைத் திறமையாகவும் வகித்தார்.
3859,"ஆனால் அவர் ருசியெல்லாம், ஊக்கமெல்லாம் விஞ்ஞான ஆராய்ச்சி யிலேயே ஒன்றி நின்றது."
3860,எனவே சிறிது காலத்திற்குப் பிறகு அந்த உத்தியோகத்தை உதறிவிட்டு விஞ்ஞான ஆராய்ச்சியில் ஈடுபட்டார்.
3861,அதில் வெற்றி கண்டார்.
3862,நோபல் பரிசும் கிடைத்தது.
3863,"அறிவு, பலதுறைகளுடையதாயிருப்பது போல், ஒவ்வொரு துறைபற்றின அறிவும் பல பிரிவுகளுடையதாயிருக்கிறது."
3864,இதையும் ஒருவன் தெரிந்து தெளிதல் வேண்டும்.
3865,விஞ்ஞான சாதிரம் என்று பொதுப்படையாகச் சொல்கிறோம்.
3866,ஆனால் அதில் பௌதிக சாதிரம் என்றும் ரசாயன சாதிரம் என்றும் இரண்டு பெரும் பிரிவுகள் அடங்கியிருக்கின்றன.
3867,ஒரு விஞ்ஞான சாதிரிக்கு இரண்டு பிரிவுகளிலும் பொதுவான பயிற்சி இருக்கலாம்.
3868,ஆனால் ஏதோ ஒரு பிரிவில்தான் இயல்பான அக்கரை இருக்கும்.
3869,அதில்தான் அவன் கவனம் அதிகமாகச் செல்லும்.
3870,"வாய்ப்பாட்டு பாடுகிறவனும், குழல் ஊதுகிறவனும், வீணை வாசிக்கிறவனும், மிருதங்கம் அடிக்கிறவனும் எல்லோரும் சங்கீத வித்துவான்கள்தான்."
3871,ஆனால் ஒவ்வொரு வித்துவானுக்கும் ஒவ்வொன்றில்தான் இயல்பான திறமை இருக்கும் மற்றவைகளில் பரிச்சயம் இருக்கலாம்.
3872,அது வேறு விஷயம்.
3873,"எந்த ஒன்றில் ஒருவனுக் குத் திறமை இருக்கிறதோ அந்த ஒன்றைப் பின்பற்றினால்தான், அவன், வாழ்க்கையில் வெற்றி காணமுடியும்."
3874,"எனவே, இந்த உட்பிரிவுகளையும் மனத்தில் கொண்டு ஒருவன் தன் வாழ்க்கையை அமைத்துக் கொள்ளவேண்டும்."
3875,ஏதோ ஒரு விதமாக வாழ்க்கைப் போக்கிலே மிதந்து சென்றுகொண்டிருக்கலாம்.
3876,குடும்ப காலட்சேபம் நடக்க வேண்டுமே யென்பதற்காகத் தன்விதியை நொந்து கொண்டு வேலை செய்வான்.
3877,அவ்வளவுதான்.
3878,எழுத்தாளனை எடுத்துக் கொள்வோம்.
3879,சிறுகதை எழுதுகிற வனும் எழுத்தாளன்தான்.
3880,சரித்திரம் எழுதுகிறவனும் எழுத்தாளன் தான்.
3881,ஒவ்வொருவனுக்கும் ஒவ்வொன்றில் இயற்கையான ருசியும் ஆற்றலும் மிகுந்திருக்கும்.
3882,அந்த வழியில்தான் அவன் செல்ல வேண்டும்.
3883,இவர்களை அதிமேதைகள் என்று அழைக்கலாம்.
3884,லோகமான்ய பாலகங்காதர திலகர் இப்படிப்பட்ட அதிமேதாவி களிலே ஒருவர்.
3885,மன்ஹார் பார்வே என்ற ஒரு சங்கீத மேதை இருந்தான்.
3886,இப்படி ஒவ்வொரு நாட்டிலும் ஒவ்வொரு காலத்திலும் அதிமேதையர் அநேகர் இருந்து வந்திருக்கின்றனர்.
