Line Number,Sentence
2500,"கோவிந்தசாமி செட்டியார், சுப்பராய நாயகர், வேங்கடாசல ஆச்சாரியார், மோகாம்பர அப்பா, துரைசாமி செட்டியார் முதலியோர் திருக்கூட்டத்தின் தூண்கள்."
2501,யான் தலைவன் என்ற முறையில் அத் திருக்கூட்டத்தின் சார்பில் ஏறக்குறைய ஏழாண்டு ஞாயிறுதோறும் பெரியபுராணப் பிரசங்கஞ் செய்தேன்.
2502,அப்பிரசங்கத்துக்குச் சென்னையின் பல பாகங்களினின்றும் அன்பர் குழாம் திரண்டு திரண்டு அணை யும்.
2503,யான் பெரிய புராணப் பிரசங்கஞ் செய்தேனோ!
2504,பெரிய புராண வகுப்பு நடத்தினேனோ!
2505,ஒவ்வொரு பாட்டுக்கும் விரிந்த முறையில் விளக்கவுரை சொல்வேன்!
2506,சாத்திரக் கருத்துக்களை எளிய நடையில் தெளிவு செய்வேன்.
2507,அம்முறை அன்பர்கட்கு மகிழ்ச்சியூட்டும்.
2508,ஏழாண்டில் ஒரு காண்டமே முற்றுப் பெற்றது.
2509,பிரசங்கம் திருவல்லிக்கேணியிலே சுப்பராய நாயகர் வீட்டு மாடியிலே நடக்கும்.
2510,சுப்பராய நாயகர் சோமசுந்தர நாயகரின் சொல்லமிழ்துண்டு சிவம் பழுத்த மனமுடையவர்.
2511,அவரும் அன்பு அவர்தம் வீடும் அன்பு.
2512,"ஞாயிற்றுக்கிழமை உற்றதும் நாயகரும் அவர்தம் அருமை மனைவியாரும் எனக்கு நல்லாவின்பால் தேடுவதிலும், அதைப் பதஞ் செய்வதிலும் பெருங்கவலை செலுத்துவர்."
2513,யான் சுமார் மூன்றரை மணி நேரம் பேசுவேன் அடிக்கடி பால் அருந்துவேன்.
2514,அது பாலா?
2515,அன்பா?
2516,அன்பு தெவிட்டாத அன்பு.
2517,கிருஷ்ணாம்பேட்டை கோவிந்தசாமி முதலியாரால் கையேடு படிக்கப்படும்.
2518,அவர் இசை ஞானியர் யான் இசை ஞானமில்லாததவன்.
2519,அவர் பாட்டைப் படிக்கும்போது சபை ஆனாயர் குழலோசை கேட்ட கன்றாகும்.
2520,அவர்தம் இசை எனது பிரசங்கத்துக்குப் பெருந்துணை செய்யும்.
2521,திருவல்லிக்கேணிச் சிவனடியார் திருக்கூட்டத்தின் ஆண்டு விழா விழாக்களுக்கோர் எடுத்துக்காட்டாயிலங்கும்.
2522,பேர்பெற்ற திருவல்லிக்கேணி வாணிபரால் என்ன செய்தல் இயலாது?
2523,மாகேசுர பூஜையின் சிறப்பை என்னென்று சொல்வேன்?
2524,அத்தகைய மாகேசுர பூசையை இனிச் சென்னை காணுமோ?
2525,சாதிச் சைவர் தொல்லையன்றி வேறு தொல்லையை மாகேசுர பூசை அநுபவித்ததில்லை.
2526,ஆயிரக்கணக்கான அடியவரைக் கவனிப்பதா?
2527,ஒரு சில சாதிச் சைவரைத் தனித்தனியே கவனிப் பதா?
2528,மாகேசுர பூசையில் சாதி வேற்றுமை பாராட்டுவது தவறு என்று யான் அறைவேன்.
2529,"சாதிக்குறும்பர், இளமைத் தலைமை என்று இறுமாந்து நடப்பர்."
2530,ஓர் ஆண்டு விழாவிலே யான் வழக்கம் போல நன்றி செலுத்துகையில்.
2531,மாகேசுர பூசையில் பிறப்பில் உயர்வு தாழ்வு கருதல் கூடாது.
2532,"சாதி வேற்றுமையைத் தொலைக்கவும், அன்பு நெறியை யோம்பவுமே மாகேசுர பூசை ஏற்பட்டது."
2533,அதிலே சாதி வேற்றுமை பாராட்டுவது சாத்திர விரோதம்.
2534,சாதியர் மாகேசுர பூசையில் கலந்து கொள்ளாதிருப் பது நல்லது என்று முழங்கினேன்.
2535,அதனால் நற்பயனே விளைந்தது.
2536,பெரிய புராணம் ஒரு சீர்திருத்த நூல் என்று சொல்வேன் தக்க சான்றுகள் காட்டுவேன்.
2537,சாதிச் சைவர் என்னைச் சீறிச் சீறி நோக்குவர்.
2538,அந்நோக்கால் யான் நீறாகவில்லை.
2539,சாதிச் சைவத்தை வளர்ப்பதற்கென்று சில புலவர் புறப்பட்டனர்.
2540,அவ ரால் பெரியபுராணப் பிரசங்கங்கள் ஆங்காங்கே செய்யப்பட் டன.
2541,அவைகளில் பொறாமைக் கனல் தழல்விட்டெரியும்.
2542,புராணப் பிரசங்கத்தை எனது வாழ்க்கைக்குரிய தொண் டாகக் கொண்டேனில்லை.
2543,யான் பள்ளி ஆசிரியத் தொழில் புரிந்து ஊதியம்பெற்று வந்தேன்.
2544,புராணப் பிரசங்கத்தைப் பொழுது போக்காகவும் தொண்டாகவுமே யான் கொண்டேன்.
2545,அதையே தொழிலாக் கொண்டவர் சிலர் என்னைக் கண்டதும் காய்வர்.
2546,அவர்க்குப் பல வழியிலுஞ் சமாதானஞ் சொல்வேன்.
2547,பெரிய புராணப் பிரசங்கத்திலே பரவையார் திருமணப் பகுதி உற்றது.
2548,அது பெரு விழாவாகக் கொண்டாடப்பட்டது.
2549,அவ்விழாவிலே பொன்னும் மணியும் வேய்ந்த கௌரி சங்கம் எனக்கு அன்பால் அணியப்பட்டது.
2550,அது நீண்ட நாள் என் கழுத்தில் ஒளிரவில்லை.
2551,அஃது ஒரு மாத காலமே என் கழுத்தில் ஒளிருமாறு ஆண்டவன் அருள் சுரந்தான்.
2552,திருக்கூட்ட அன்பர் ஒருவர் வேங்கடாசல ஆச்சாரியார் என்பவர் திருத்தணிகையில் ஒரு சத்திரங் கட்டினர்.
2553,திறப்பு விழாவில் கலந்து கொள்ளுமாறு திருக்கூட்டத்தினரும் யானும் அழைக்கப்பட்டோம்.
2554,குளக்கரையிலே எனது கௌரி சங் கத்தைப் புராணிகர் சோமசுந்தர முதலியாரிடத்தில் சேர்த்துத் தண்ணீரில் இறங்கினேன்.
2555,அவர் இன்னொருவரிடத்தில் அதைக் கொடுத்து வெளியே போனார்.
2556,எப்படியோ கௌரி சங்கம் களவு போயிற்று.
2557,திருக்கூட்டத்தவர் முகங்களெல்லாம் வாட்டமுற்றன.
2558,ஆரிமுத்துச்செட்டியார் பட்டபாடு இன்னும் என் முன்னே காட்சியளிக்கிறது.
2559,அடியவர் வாட்டமே என்னை வருத்தியது.
2560,அவர்கட்கெல்லாம் ஆறுதல் கூறினேன்.
2561,உருத்தி ராட்ச மாலை பொன்னும் மணியும் அற்றதாயின் களவு போயிருக்குமோ?
2562,என்னுடைய திருமணத்தின்போது மீண்டும் திருவல்லிக்கேணிச் சிவனடியார் திருக்கூட்டத்தவரால் முன்னையதைப் போன்றதொரு கௌரி சங்கம் வழங்கப்பட்டது.
2563,அது நீண்டகாலம் என்னிடத்திருந்தது.
2564,யான் பல துறைகளில் தொண்டாற்றப் புகுந்தமையால் அவ்வக்கமணி பெரிதும் பயன்படாமலே கிடந்தது.
2565,சும்மா கிடந்த அஃது ஒரு நண்பருக்கு அன்பளிப்பாயிற்று.
2566,பின்னே யான் ஏற்ற பலவகைத் தொண்டுகள் ஞாயிறு தோறும் திருவல்லிக்கேணிக்கு என்னை விடுவதில்லை.
2567,அதனால் ஒரு காண்டத்துடன் பெரிய புராணப் பிரசங்கம் ஆம் ஆண்டில் முற்றுப்பெற்றது.
2568,சிவசுப்பிரமணிய பக்தஜன சபை புதுப்பாக்கத்திலே ஸ்ரீ சிவசுப்பிரமணிய பக்தஜன சபை என்றொரு சபை ஆம் ஆண்டில் காணப்பட்டது.
2569,அதன் முதல் தலைவனும் யானே.
2570,அச்சபையில் ஜடி கட்சி வாடை வீசியதை யான் உணர்ந்தேன்.
2571,ஒரு சபையில் பலதிற அரசியல் கட்சியினர் இருக்கலாம்.
2572,தவறில்லை.
2573,கட்சியைப் பாராட்டிப் பிணக்குறுவது அறியாமை.
2574,நமது நாட்டில் அரசியல் கட்சிகள் பிணக்கை வளர்க்கும் நிலையையே அடைந் துள்ளன.
2575,சிவசுப்பிரமணிய பக்தஜன சபையில் செல்வாக் குடையவர் ஜடி கட்சியினர்.
2576,அன்னார் வெளிப்படையாக ஒன்றுஞ் செய்ததில்லை.
2577,ஐயம் எனக்குள் புகுந்தது.
2578,யானே வலிந்து தலைமைப் பதவியினின்றும் விலகினேன்.
2579,உட் காரணத்தை விளக்கிக் கூறினேனில்லை.
2580,சமயம் நேரும் போதெல்லாம் சபைக்குச் செல்வேன் பேசுவேன் ஆண்டு விழாக்களில் தலைமை வகிப்பேன்.
2581,அச்சபையின் வெள்ளி விழா நடைபெற்றது.
2582,முதல் தலைவன் என்ற முறையில் அவ் விழாவில் தலைமை தாங்கும்பேறு எனக்கே நல்கப்பட்டது.
2583,சைவ சித்தாந்த மகா சமாஜம் ஆம் ஆண்டு டிசம்பரில் சென்னை விக்டோரியா மண்டபத்தில் ஜெ.
2584,எம்.
2585,அக்கூட்டத்தில் யான் பேசிய பொருள் சைவன் எவன் என்பது.
2586,என் பேச்சு சாதிச் சைவர் முகத்தைக் கறுகச் செய்தது.
2587,ஆம் ஆண்டுக்கு அமைச்சராகச் சச்சிதானந்தம் பிள்ளை தெரிந்தெடுக்கப்பட்டார்.
2588,அத்தெரிவு ஜெ.என்.
2589,இராமநாதனுக்கும் எனக்கும் ஊக்கமூட்டிற்று.
2590,நாங்கள் மூவரும் பாதிரிமாரைப்போல வேலை செய்யத் தொடங்கினோம் ஆதிதிராவிடச் சகோதரர்கள் உறையும் இடங்கட்குச் செல்ல உறுதிகொண்டோம்.
2591,முதல் முதல் நுங்கம்பாக்கம் எங்கள் கருத்தில் படிந்தது.
2592,சிவ நேயர் பழனிசாமி பிள்ளையின் நட்பு எனக்கு அப்பொழுதே கிடைத்தது.
2593,பலப்பல இடங்கட்கு வலிந்து வலிந்து சென்று சைவப் பிரசாரம் செய்வோம் சென்னையின் நானா பக்கங்களிலும் உழல்வோம்.
2594,பிள்ளையார் கோயில் மண்டபங்களெல்லாம் எங்கள் பிரசார மேடை களாயின.
2595,"திருவொற்றியூர், திருமயிலை, திருவான்மியூர், திருமுல்லைவாயல் முதலிய திருப்பதிகளின் திருவிழாக்களிலே எங்களைக் காணலாம்."
2596,சைவசித்தாந்த மகா சமாஜத்தின் ஆக்கத்துக்குப் பாடுபட்டோம் பட்டோம் பெரும்பாடு பட்டோம்.
2597,ஆண்டுக் கூட்டம் காஞ்சியில் பொன்னம்பலம் பிள்ளை தலைமையிற் கூடிற்று.
2598,யான் அப்பர் கொள்கை என்ற பொருள் பற்றிப் பேசினேன்.
2599,"கடவுளைப் பற்றியும், சமயத்தைப்பற்றியும், சீர்திருத்தத்தைப் பற்றியும், பிறவற்றைப்பற்றியும், அப்பர் அருளியுள்ளனவற்றைச் சுருங்கிய முறையில் சைவப்புலவர் பாதிரியார்க்கு விளக்கினர்."
2600,அவ்விளக்கம் பாதிரியார் நெஞ்சை அப்பர் கொள்கையில் படிவித்தது.
2601,இருவருந் திருத்தணிகை அடைந்தனர்.
2602,"பாதிரியார் சைவப் புலவரைப் பார்த்து, யானும் உம்முடன் கோயிலுக்கு வருகிறேன் என்றார்."
2603,"சைவப்பழம் விழித்தது, ஏற இறங்கப் பார்த்தது."
2604,இவ்வளவு தானா உமது ஏட்டுச் சைவம்!
2605,அப்பர் கொள்கைப்படி நடக்க உமது சமூகம் இடங்கொடுக்கவில்லையே!
2606,சமூகச் சீர்திருத்தஞ் செய்ய முற்படுங்கள்.
2607,சைவசித்தாந்த சமாஜம் சீர்திருத்தத்தில் ஏன் தலையிடலாகாது?
2608,?
2609,என்று கேட்டார் பாதிரியார்.
2610,இவ்வாறு முழங்கிப் பேச்சை முடித்தேன்.
2611,தலைவர் என் கருத்தை முற்றுந் தழுவியே பேசினர்.
2612,சாதிச்சைவர் உள்ளம் கொதித்தது.
2613,அவர் என் செய்தல் கூடும்!
2614,காலக் கடவுள் என் பக்கம்!
2615,ஆம் ஆண்டிலே சமாஜ ஆண்டு விழா வேலூரில் நடை பெற்றது.
2616,தலைமை வகித்தவர் சிவசண்முக மெய்ஞ்ஞான சிவாச்சாரிய சுவாமிகளென்னும் ஞானியார் சுவாமிகள்.
2617,சுவாமிகளை யான் முன்னே நேரிற்கண்டதில்லை.
2618,முதல்காட்சி வேலூரிலேயே.
2619,அடிகளின் தோற்றம் மரகதமலையில் முளைத்த ஞாயிறே போன்றிருந்தது.
2620,யான் பேச எடுத்த பொருள் சிவ ஞானபோத நுட்பம்.
2621,?
2622,"என்றதும், மேடை அதிர்ந்தது வீறிட்டது."
2623,"நல்லசாமி பிள்ளை தப்புதப்பு என்று சீறினார் யாழ்ப்பாணம் முதலியார் சபாரத்தினம், நிறுத்தும்நிறுத்தும் என்று உறுத் தார்."
2624,குழப்பத்தை அடக்கக் குரலை உயர்த்தி வேகத்தில் இறங்கி னேன்.
2625,சபை அமைதியடைந்தது.
2626,"மேலுந் தொடர்ந்து பேசி, சிவஞான போதத்தின் மூலமொழியென்ன?"
2627,வடமொழியா?
2628,?
2629,என் பேச்சு முற்றுப்பெற்றது.
2630,நல்லசாமி பிள்ளை பேச எழுந்தார் சபா ரத்தினம் பேச எழுந்தார்.
2631,இஃது ஒழுங்கு முறையா என்று தலைவர் காதைக்கடித்தேன்.
2632,இருவரும் என் கூற்றை மறுத்தனர்.
2633,விடைகூற விரைந்தேன்.
2634,பெருந்தலைமை என்விரைவை அடக் கியது.
2635,", ?"
2636,என்று குறிப்பிட்டார்.
2637,கூட்டங் கலைந்தது.
2638,பலர் பலவாறு பேசிச் சென்றனர்.
2639,பார்த்தசாரதி முதலியார் வெளிப்படையாகப் பலர் கேட்க விளம்பினார்.
2640,நடுநிலையர் எங்கும் உள்ளனர் என்று சொல்லிக்கொண்டு யான் இரத்தினவேல் முதலியார் வீட்டுக்குச் சென்றேன்.
2641,அவ்வீடு ஒரு சொற்போர்க் களமாயிற்று.
2642,அடுத்தநாள் காலையிலே ஞானியார் சுவாமிகளிடத்திருந்து அழைப்பு வந்தது.
2643,யான் அடிகளைக் கண்டேன்.
2644,ஏறக்குறைய ஒரு மணி நேரம் அடிகள் என்னிடம் உரையாடினர்.
2645,முன்னாள் நிகழ்ச்சியை அவருந் தொடவில்லை யானுந் தொடவில்லை.
2646,அந்நிகழ்ச்சி என்னை உறுத்தவே இல்லை.
2647,அடிகளின் அறிவும் அன்பும் என்னை ஆண்டன.
2648,அவர்தம் தொண்டர் குழாத்திலே யானும் ஒருவனானேன்.
2649,ஆம் ஆண்டில் விழா கூடலூரில் நடந்தது.
2650,தலைவர் ஞானியார் சுவாமிகளே.
2651,அதில் யான் முப்பொருளுண்மை யைப் பற்றிப் பேசினேன்.
2652,முன்னே பேசிய பலர் கால வரம்பை மீறிய காரணத்தால் காலநெருக்கடி ஏற்பட்டது.
2653,"மணம்பூண்டி குமாரசாமி பிள்ளையும், மணிமங்கலம் திருநாவுக்கரசு முதலியாரும், சச்சிதானந்தம் பிள்ளையும், யானும் சுருங்கிய நேரத்தில் பேசுவதென்று உறுதி செய்தோம்."
2654,"யான் பாசத்தைப் பற்றி ஐந்து நிமிடமும், பசுவைப் பற்றி ஐந்து நிமிடமும், பதியைப்பற்றி ஐந்து நிமிடமும் பேசினேன்."
2655,பின்னே சமாஜம் மேலும் மேலும் இவரவில்லை இழிந்தே போயிற்று.
2656,"காரணம் சமாஜத்தில் அழுக்கு மூட்டைகள் நிரம்பினமையும், சீர்திருத்தக்காரர் ஒதுங்கினமையும்."
2657,யான் பலதிற வேலைச் சூழலிடை மூழ்கலானேன்.
2658,அதனால் சமாஜ நினைவு எனக்கு அடிக்கடி தோன்றுவதுமில்லை.
2659,சமாஜம் மறையுமோ என்று ஐயுறத்தக்க நிலைமையும் உற்றது.
2660,ஆம் ஆண்டில் ஞானியார் சுவாமிகள் முயற்சியால் சமாஜம் மீண்டும் உயிர்த்தெழுந்தது.
2661,விட்டும் தொட்டும் சமாஜக் கூட்டங்களுக்கு யான் போவதுண்டு.
2662,முதல் நாள் விழா என் தலைமையில் கொண்டாடப்பட்டது.
2663,அத்தலைமையுரை நினைப்பவர் மனம் என்னும் நூலாக வெளிவந்துள்ளது.
2664,ஆம் ஆண்டுக் கூட்டம் திருவதிகையில் ஈண்டியது.
