Line Number,Sentence
1873,மகப்பெயர்க் கிளவிக் கின்னே சாரியை.
1874,அத்தவண் வரினும் வரைநிலை யின்றே.
1875,தொல்.
1876,நிலாவென் கிளவி அத்தொடு சிவணும்.
1877,தொல்.
1878,"என்பதனால், ஆகாவீற்றுள் நிலாவென்பது அத்துச் சாரியை பெறுமென்றார்."
1879,"உம் நிலா கொண்டான் நிலா அத்துக் கொண்டான் சென்றான், தந்தான், போயினான் எனவரும்."
1880,"ஆ என்னும் சொல் முன்பெற்று னகர ஒற்று அகரத்தோடு கூடி நிற்கும் என்பதனை, ஆனொற் றகரமொடு நிலையிட னுடைத்தே."
1881,தொல்.
1882,எனவரும் சூத்திரத்தாற் கூறினார் ஆசிரியர்.
1883,உம் ஆனநெய் தெளித்து எனவரும்.
1884,பனியென வரூஉங் கால வேற்றுமைக் கத்து மின்னுஞ் சாரியை யாகும்.
1885,தொல்.
1886,"எனவும், மழையென் கிளவி வளியியல் நிலையும்."
1887,தொல்.
1888,எனவும் வரும் சூத்திரங்களால் முறையே வளியென்னும் சொல்லுக்கும் மழையென்னுஞ் சொல்லுக்கும் எய்துவித்தார்.
1889,"உம் பனியத்துக் கொண்டான், பனியிற் கொண்டான்."
1890,"வளியத்துக் கொண்டான், வளியிற் கொண்டான்."
1891,"மழையத்துக் கொண்டான், மழையிற்கொண்டான்."
1892,"சென்றான் தந்தான், போயினான் எனவரும்."
1893,புளிமரக் கிளவிக் கம்மே சாரியை.
1894,தொல்.
1895,", , எனவருஞ் சூத்திரங்களால் முறையே புளி எனவும் எரு, செரு, எனவும், பனை."
1896,"அரை, ஆவிரை யெனவும் வரும் இகர உகர ஐகார வீற்றுச் சொற்கள் அம்சாரியை பெறும் என்றார்."
1897,நாண்முற் றோன்றுந் தொழினிலைக் கிளவிக் கானிடை வருதல் ஐய மின்றே.
1898,தொல்.
1899,தொல்.
1900,"இவ்விதியை, திங்களு நாளு முந்துகிளந் தன்ன."
1901,தொல்.
1902,என்ற சூத்திரத்தால் ஆதிரை சித்திரை முதலிய ஐகார வீற்று நாட் பெயர்க்கும் திங்கட் பெயர்க்கும் மாட்டெறிந்து கொண்டார்.
1903,"ஊ வென்னும் பெயர் னகரவொற்றோடு அக்குச்சாரியை பெற்று முடிதலுமுரித் தென்பதனை, ஊவெ னொருபெயர் ஆவொடு சிவணும்."
1904,அக்கென் சாரியை பெறுதலு முரித்தே தக்கவழி யறிதல் வழக்கத் தான.
1905,தொல்.
1906,", என்பவற்றாற் குறிப்பிட்டார்."
1907,"உம் ஊகுறை ஊன்குறை, செய்கை, தலை, புறம் எனவும் ஊனக்குறை, செய்கை தலை, புறம், எனவும் வரும்."
1908,ஆடூஉ மகடூஉ வாயிரு பெயர்க்கும் இன்னிடை வரினு மானமில்லை.
1909,பெற்றமாயின் முற்றவின் வேண்டும்.
1910,தொல்.
1911,"உம் ஆடூஉ வின்கை, செவி, தலை, புறம், எனவும், சேவின், கோடு, செவி, தலை, புறம் எனவும் வரும்."
1912,அகரவீறு பலவற் றிறுதி யுருபியல் நிலையும்.
1913,தொல்.
1914,ஈகாரவீறு நீயென் ஒருபெயர் உருபியல் நிலையும் ஆவயின் வல்லெழுத் தியற்கையாகும்.
1915,தொல்.
1916,அவ்வாறு முடிவுழி இயைபு வல்லெழுத்து மிகா தென்றவாறு.
1917,"உம் நின்கை, செவி, தலை, புறம் என வரும்."
1918,இயற்கையாகுமெனவே நிலைமொழித் தொழில் அதிகார வல்லெழுத்தை விலக்காதாயிற்று என்பர் நச்சினார்க்கினியர்.
1919,உகரவீறு சுட்டுமுத லிறுதி யுருபியல் நிலையும் ஒற்றிடை மிகா வல்லெழுத் தியற்கை.
1920,"உம் அதன்கோடு, செதிள், தோல், பூ இதன்கோடு, செதிள், தோல், பூ உதன்கோடு, செதிள், தோல், பூ எனவரும்."
1921,ஐகாரவீறு சுட்டுமுத லிறுதி யுருபியல் நிலையும் தொல்.
1922,ஓகாரவீறு உருபியல் நிலையும் மொழியுமா ருளவே ஆவயின் வல்லெழுத் தியற்கை யாகும்.
1923,தொல்.
1924,இள் ஓகார வீற்றுட்சில பொருட்புணர்ச்சிக்கண் உருபு புணர்ச்சியது இயல்பிலே நின்று ஒன்சாரியை பெற்று முடியும் மொழிகளும் உள.
1925,அவ்விடத்து வல்லெழுத்தின்றி இயல்பாய் முடியும் என்பதாம்.
1926,"உம் கோஒன்கை, செவி, தலை, புறம் எனவரும்."
1927,ஏனையதிரிபுகள் உயிரீற்றுப் பொருட்புணர்ச்சிக்கண் வரும் ஏனைய திரிபுகளை இனி நோக்குவாம்.
1928,"இதனை, சாவ வென்னுஞ் செயவென்னெச்சத் திறுதி வகரங் கெடுதலு முரித்தே."
1929,தொல்.
1930,"எனவும், வாழிய வென்னுஞ் செயவென் கிளவி யிறுதி யகரங் கெடுதலு முரித்தே."
1931,தொல்.
1932,எனவும் வரும் சூத்திரங்களாலுணர்த்தினர் தொல்காப்பியனார்.
1933,"இவ்விரு சொற்களிலும் இறுதி யுயிர்மெய் கெடுதலை, சாவவென் மொழியீற் றுயிர்மெய் சாதலும் விதி."
1934,நன்.
1935,வாழிய வென்பத னீற்றி னுயிர்மெய் ஏகலு முரித்தஃ தேகினு மியல்பே.
1936,நன்.
1937,எனவரும் சூத்திரங்களாலுணர்த்தினார் நன்னூலார்.
1938,"இதனை, உரிவரு காலை நாழிக் கிளவி இறுதி யிகரம் மெய்யொடுங் கெடுமே டகரம் ஒற்றும் ஆவயி னான."
1939,தொல்.
1940,என்பதனாற் கூறினார் தொல்காப்பியனார்.
1941,உம் நாழி உரி நாடுரி எனவரும்.
1942,தொல்.
1943,என்ற சூத்திரத்தினாற் கூறினார் நன்னூலார்.
1944,"உகரவீற்றுள் அம்சாரியை பெறுவனவற்றுள் செரு என்பதன் முன் வரும் அம்சாரியையின் மகரங்கெட்டு வல்லெழுத்து மிக்குமுடியும் இதனை, எருவும் செருவும்."
1945,.....................ம் மகரஞ் செருவயிற் கெடுமே தம்மொற்று மிகூஉம் வல்லெழுத் தியற்கை.
1946,தொல்.
1947,என்ற சூத்திரத்தாற் கூறினார் தொல்காப்பியர்.
1948,"உம் செரு களம் செருவக்களம், சேனை, தானை படை எனவரும்."
1949,தொல்.
1950,தொல்.
1951,என்ற சூத்திரத்தாலும் கூறினார் தொல்காப்பியனார்.
1952,கொடிமுன் வரினே யையவ ணிற்பக் கடிநிலையின்றே வல்லெழுத்து மிகுதி.
1953,தொல்.
1954,என்பதனால் பனை என்றதன்முன் கொடியென்ற சொல்வரின் இறுதி ஐகாரங் கெடாது நிற்ப வல்லெழுத்து மிக்கு முடியுமென வற்புறுத்தினார்.
1955,இவ்வைகார வீற்றுச் சொற்களின் திரிபினைப் பவணந்தி முனிவர்.
1956,வேற்றுமை யாயி னைகா னிறுமொழி ஈற்றழி வோடும் அம் மேற்பவு முளவே.
1957,பனைமுன் கொடிவரின் மிகலும் வலிவரின் ஐபோ யம்மும் திரள்வரி னுறழ்வும் அட்டுறி னைகெட்டந் நீள்வுமாம் வேற்றுமை.
1958,தொல்.
1959,", எனவரும் இரு சூத்திரங்களாலுந் தொகுத்துக் கூறினார்."
1960,தொல்.
1961,என்ற சூத்திரத்தாற் கூறினார் ஆசிரியர்.
1962,றகரத்தை யொற்றெனக் குறிப்பிட்டுக் கூறினமையால் முற்கூறிய லகரம் உயிர்மெய்யாதல் தெளியலாம்.
1963,நன்.
1964,என்ற சூத்திரத்தாற் கூறினார் நன்னூலார்.
1965,தொல்.
1966,என்ற சூத்திரத்தாற் கூறினார் தொல்காப்பியனார்.
1967,உம் உப்பின்று புற்கை யுண்கமா கொற்கையோனே எனவரும்.
1968,நன்.
1969,என்பதனாற் குறிப்பிட்டார்.
1970,உம் நாளன்று போகி எனவரும்.
1971,தொல்.
1972,என்பதனாற் கூறினார் தொல்காப்பியர்.
1973,அது முன்வரும் அன்றான்றாந் தூக்கின்.
1974,நன்.
1975,என்பது நன்னூல்.
1976,"உம் அதான்று, எனவரும்."
1977,"நன்னூலார், கருத்துப்படி அது என்பத னுகரம் முற்றுமற்றொரோ வழி என்பதனாற் கெட்டுத் தகரவொற்றின் மேல் வருமொழியுயிரேறி முடியும் என்பதாம்."
1978,தொல்.
1979,என்ற சூத்திரத்தாற் கூறப்பட்டது.
1980,உம் வேணவா நலிய வெய்யவுயிரா என வரும்.
1981,வேட்கை யாவது பொருள்கள் மேற்றோன்றும் பற்றுள்ளம்.
1982,அவாவாவது அப்பொருள்களைப் பெறவேண்டுமென்னும் ஆசை.
1983,எனவே வேணவா என்பதற்கு வேட்கையாலுண்டாகிய அவாவென மூன்றனுருபு விரித்துப் பொருள் கூறுவர் நச்சினார்க்கினியர்.
1984,.
1985,"புள்ளி மயங்கியல் இது, மெய்யீறு வன்கணத்தோடும் பிறகணத்தோடும் புணருமாறு கூறலின் புள்ளிமயங்கியல் எனப் பெயர்பெற்றது."
1986,மெய்கள் புள்ளி பெறுதலாற் புள்ளியென வழங்கப் பெறுவன வாயின.
1987,.
1988,தொல். ஞநமவ இயையினும் உகரம் நிலையும்.
1989,தொல்.
1990,"இவ்விதிகளை, நகர விறுதியும் அதனோ ரற்றே."
1991,தொழிற் பெயரெல்லாந் தொழிற் பெயரியல.
1992,தொழிற் பெயரெல்லாந் தொழிற் பெயரியல.
1993,தொழிற் பெயரெல்லாத் தொழிற் பெயரியல.
1994,தொழிற் பெயரெல்லாந் தொழிற் பெயரியல.
1995,தொல்.
1996,வேற்றுமைக் குக்கெட அகரம் நிலையும்.
1997,தொல்.
1998,"என்பதனால், நகர வீற்றுத் தொழிற்பெயர் வேற்றுமைக்கண் உகரம் பெறாது அகரம் நிலைபெற்று முடியும் என்றார்."
1999,"ஞண நமலவளன வொற்றிறு தொழிற்பெயர் ஏவல் வினை நனி யவ்வல் மெய்வரின் உவ்வுறும், ஏவல் உறாசில சில்வழி."
2000,நவ்விறு தொழிற்பெயர்க் கவ்வுமாம் வேற்றுமை.
2001,நன்.
2002,", எனவரும் நன்னூற் சூத்திரங்கள் இங்கு ஒப்பு நோக்கத் தக்கனவாகும்."
2003,ஈமுங் கம்மும் உருமென் கிளவியும் ஆமுப் பெயரும் அவற்றோ ரன்ன.
2004,மின்னும் பின்னும் பன்னுங் கன்னும் அந்நாற் சொல்லுந் தொழிற்பெய ரியல.
2005,வல்லென் கிளவி தொழிற்பெய ரியற்றே.
2006,ஏனை வகரந் தொழிற்பெய ரியற்றே புள்ளும் வள்ளுந் தொழிற்பெய ரியல.
2007,தொல்.
2008,"இம்முடிபு, ஏனை எகினே அகரம் வருமே வல்லெழுத் தியற்கை மிகுதல் வேண்டும்."
2009,வேற்றுமை யாயின் ஏனை யெகினொடு தோற்ற மொக்கும் கன்னென் கிளவி.
2010,தொல்.
2011,", எனவரும் சூத்திரங்களாற் குறிக்கப்பட்டது."
2012,"வல் என்ற சொல்லின்முன், நாய், பலகை என்பன."
2013,"வருமொழியாய்வரின் அவ்விடத்து விதிக்கப்பட்ட உகரம் கெடுதலும் உண்டு எனவும், அவ்வழி அகரம் வந்து நிலைபெறும் எனவும் கூறுவர் தொல்காப்பியர்."
2014,"நாயும் பலகையும் வரூஉங் காலை ஆவயின் உகரம் கெடுதலும் உரித்தே உகரங் கெடுவழி அகர நிலையும், தொல்."
2015,என்பது தொல்காப்பியம்.
2016,என வேற்றுமையிலும் வந்தன.
2017,மரமல் லெகின்மொழி யியல்பும் அகரம் மருவ வலிமெலி மிகலுமாகும்.
2018,மின் பின் பன்கன் தொழிற்பெய ரனைய கன்னவ் வேற்று மென்மையோ டுறழும்.
2019,வல்லே தொழிற்பெய ரற்றிரு வழியும் பலகை நாய்வரினும் வேற்றுமைக் கவ்வுமாம்.
2020,தெவ்வென் மொழியே தொழிற் பெயரற்றே மவ்வரின் வஃகான் மவ்வு மாகும்.
2021,புள்ளும் வள்ளுந் தொழிற்பெயரு மானும் நன்.
2022,", , , , , எனவரும் இச்சூத்திரங்களால் எடுத்தோதி முடித்துள்ளார்."
2023,.
2024,இறுதிகெட்டு முடிவன.
2025,"வெரிநெ னிறுதி முழுதுங் கெடுவழி வருமிட னுடைத்தே மெல்லெழுத் தியற்கை, ஆவயின் வல்லெழுத்து மிகுதலும் உரித்தே."
2026,தொல்.
2027,"உம் வெரிங்குறை, செய்கை, தலை, புறம்."
2028,"வெறிக்குறை, செய்கை, தலை, புறம் எனவரும்."
2029,மகர விறுதி வேற்றுமை யாயின் துவரக் கெட்டு வல்லெழுத்து மிகுமே.
2030,தொல்.
2031,இதன்பொருள் மகரவீற்றுப் பெயர் வேற்றுமைக் கண் ஆயின் ஈற்று மகரம் முற்றக் கெட்டு வருமொழி வல்லெழுத்து மிக்குமுடியும் என்பதாம்.
2032,"உம் மரக்கோடு, செதிள், தோல், பூ எனவரும்."
2033,மெல்லழுத் துறழு மொழியுமா ருளவே செல்வழி யறிதல் வழக்கத்தான.
2034,தொல்.
2035,இதன்பொருள்நிலைமொழியீற்று மகரம் வேற்றுமைக்கண் கெட்டவிடத்து வருமொழி வல்லெழுத்தோடு மெல்லெழுத்து உறழ்ந்து மிக்குமுடியும் மொழிகளும் உள என்பதாம்.
2036,"உம் குளங்கரை, சேறு, தாது, பூழி குளக்கரை, சேறு, தாது, பூழி எனவரும்."
2037,நும் என்னும் விரவுப்பெயர் பொருட் புணர்ச்சிக் கண் மகரங்கெட மெல்லெழுத்து மிக்குமுடியும் என்பது.
2038,நும்மெனொரு பெயர் மெல்லெழுத்து மிகுமே.
2039,தொல்.
2040,என்பதனாற் கூறப்பட்டது.
2041,"உம் நுங்கை, செவி, தலை, புறம் எனவரும்."
2042,தொல்.
2043,எனவருஞ் சூத்திரத்தால் எடுத்துரைத்தார் நன்னூலார்.
2044,தொல்.
2045,எனவரும் சூத்திரத்தாற் குறிப்பிடப் பெற்றது.
2046,மேல் தொல்எழுத்து துவர என்ற இலேசினால் இயல்பு கணத்துக்கண் எய்திய மகரக்கேடு ஈண்டுங் கொள்ளப் படும் என்பர் இளம்பூரணர்.
2047,"உம் ஆயிரம் நாழி ஆயிரநாழி, வட்டி, அகல் எனவரும்."
2048,பதினாயிரக்கலம் என்றாற்போன்று ஆயிரம் என்ற சொல் அடையடுத்து வந்துழியும் மேற்கூறிய விதி கொள்ளப்படும் என்பர் உரையாசிரியர்.
2049,நன்.
2050,என்ற பொது விதியால் தழுவினார் நன்னூலார்.
2051,தொல்.
2052,என்பதனாற் கூறப்பட்டது.
2053,"உம் இல்லம் கோடு இல்லங்கோடு, செதிள், பூ எனவரும்."
2054,இல்லம் தோற்றாமரம்.
2055,தொல். என்ற சூத்திரத்தால் உணர்த்தப்பட்டது.
2056,"உம் தரும் வளவன் எனவும் போன்ம் எனவும் இவ்விருவகை மகரக் குறுக்கங்களையும், ணனமுன்னும் வஃகான் மிசையுமக் குறுகும்."
2057,நன்.
2058,எனவரும் சூத்திரத்தால் பவணந்தியார் தொகுத்துக் கூறியுள்ளார்.
2059,தொல்.
2060,என்பதனாற் கூறப்பட்டது.
2061,"உம் அழன்குடம் அழக்குடம், சாடி, தூதை, பானை எனவரும்."
2062,அழன் பிணம்.
2063,.
2064,"இம் முடிபினை, யகர விறுதி வேற்றுமைப் பொருள்வயின் வல்லெழுத் தியையின் அவ்வெழுத்து மிகுமே."
2065,ரகார விறுதி யகார வியற்றே.
2066,ழகார விறுதி ரகார வியற்றே.
2067,தொல்.
2068,", , , எனவரும் சூத்திரங்களால் தொல்காப்பியனார் மாட்டெறிந்து கூறியுள்ளார்."
2069,மகன்வினை கிளப்பின் முதனிலை யியற்றே.
2070,தொல்.
2071,என்பதனாற் கூறப்பட்டது.
2072,"உம் மகன்றாய்க்கலாம், செரு, துறத்தல், பகைத்தல் எனவரும்."
2073,மகன்றாய்க்கலாம் மகன் தாயொடு நிகழ்த்திய கலகம் எனப் பொருள் விரித்துரைக்க.
2074,"மகன் வினை என்றது, ஈண்டுப் பகைமேற்று என்பர் நச்சினார்க்கினியர்."
2075,"இவற்றின் இயல்பினை, ஆரும் வெதிருஞ் சாரும் பீரும் மெல்லெழுத்து மிகுதல் மெய்பெறத் தோன்றும்."
2076,குமிழென் கிளவி மரப்பெய ராயிற் பீரென் கிளவியோ டோரியற் றாகும்.
2077,தொல்.
2078,", எனவரும் சூத்திரங்களால் உணர்த்துவர் தொல்காப்பியர்."
