Line Number,Sentence
1,"பல்வேறு ஊழிகளிற் றோன்றிய கடற் பெருக்குகளால் நிலப்பரப்பு நீர்ப்பரப்பாகவும், நீர்ப்பரப்பு நிலப்பரப்பாகவும் மாறுதலடைந்ததுண்டு."
2,இம் மண்ணகம் பல்வேறு காலங்களில் அடைந்திருந்த வடிவங்களை நிலநூலார் தமது உய்த்துணர்வு கொண்டு படங்களமைத்துக் காட்டியிருக்கின்றனர்.
3,இல் உண்டானதென்றும் குறிப் பிட்டிருக்கின்றனர்.
4,இப்போது அட்லாண்டிக் கடல் அலைகொழிக்கின்ற இடத்தில் முன் ஒரு பூகண்டம் விளங்கியது.
5,அப்பூகண்டம் கடலுள் மூழ்கிப்போக அதில் மிச்சமாக விளங்கிய பொசிடோனிஸ் என்னும் தீவு கி.மு.
6,ஆம் ஆண்டில் உண்டான வெள்ளத்தால் மறைந்த தெனச் சொல்லப்படுகின்றது.
7,இக்குழப்பங்கள் இன்னும் நிலைத்தமையால் பல இடங்களில் பல முறைகளில் நிலங்கள் எழுந்தும் மறைந்தும் போயின.
8,இறுதியில் நிலம் வெடித்தமையால் பத்து நாடுகள் ஒன்றிலிருந்து ஒன்று பிரிக்கப்பட்டன.
9,இஃது ஒருகாலத்து இவ்வுலகம் அடைந்திருந்த வடிவினைக் குறிப்பதாயிருக்கலாம்.
10,தயிர்க்கடல் பாற்கடல் எனச் சொல்லப்பட்ட பெயர்கள் இக்காலம் கருங்கடல் செங்கடல் வெண்கடல் என வழங்கும் பெயர்களை மானுதல் கூடும்.
11,மேலே காட்டியவை இவ்வுலகம் காலத்துக்குக் காலம் பல்வேறு மாறுதல்களடைந்து வருகின்றதென்பதை வலியுறுத்துவன.
12,இந்திய நாடு இன்று காணப்படும் வடிவினை முன் அடைந்திருக்க வில்லை.
13,கன்னியாகுமரிக்குத் தெற்கே காணப்படும் இந்து மாகடல் முன் ஒரு பெரிய நிலப்பரப்பாக விளங்கியது.
14,அந் நிலப்பரப்புக்கு ஆங்கில பௌதிக நூலார் லெமூரியா என்னும் பெயர் இட்டனர்.
15,தமிழ் முன்னோர் இதனைக் குமரிக்கண்டம் என வழங்கினர்.
16,மிக முற்காலத்தில் இந்தியக் குடாநாடு ஒரு பெரிய பூகண்டத்தின் பகுதியாக விருந்தது.
17,இவ்வாறு கொள்வ தற்கு நிலநூல் சான்று உள்ளது.
18,"ஒருகாலத்துக் கடல், பொங்கியெழுந்து அதன் பல பகுதிகளைத் தன்னகப்படுத்திக்கொண்டது."
19,"முன் ஒன்றாயிருந்த ஆத்திரேலியா, சீனா, ஆப்பிரிக்கா, இந்தியா முதலிய நாடுகள் அக்காலத்திலேயே பிளவு பட்டிருத்தல் வேண்டும்."
20,அதன்கண் நாவன் மரங்கள் செழித்தோங்கி வளர்ந்தமையான்.
21,அது நாவலந் சம்புத் தீவு என்னும் பெயரைப் பெறுவ தாயிற்று.
22,குமரித்தீவு குமரி நாடு என்றும் அது வழங்கப்பட்டது.
23,குமரி நாட்டின் வடக்கெல்லை விந்திய மலையாகவிருந்தது.
24,இமயமலையும் சிந்து கங்கைச் சமவெளிகளும் அக்காலத்தில் தோன்றவில்லை.
25,ஆகவே குமரி நாடு அல்லது பழைய தமிழகம் ஆசியாக் கண்டத்தின் பகுதியாக இருக்க வில்லை.
26,தெற்கே கிடந்த நிலப்பரப்புகளிற் பெரும் பகுதி கடலுள் மறைந் தது.
27,அப்போது இமயமலையும் சிந்து கங்கைச் சமவெளிகளும் கடலாழத் தினின்றும் மேற்கிளம்பின.
28,இமயமலைச் சாரல்களில் நீர்வாழ் உயிர்களின் என்புக்கூடுகள் காணப்படுகின்றன.
29,அதனால் இமயமலை ஒருகாலத்தில நீரின் மூழ்கிக்கிடந்ததெனத் துணியப்படுகின்றது.
30,இமயமலையும் அதனைச் சார்ந்த நிலங்களும் மேற்கிளம்பிய பின்னும் விந்திய மலைக்கு வடக்கே நிலவிய கடல் முற்றாக மறைந்துவிடவில்லை.
31,அதன் ஒரு சிறு பாகம் வட இந்தியாவைத் தென் இந்தியாவினின்றும் பிரித்தது.
32,"நிலநூலார் அதன் ஒரு பகுதிக்குக் கிழக்குக் கடலென்றும், மற்றைப் பகுதிக்கு இராசப் பட்டினக் கடலென்றும் பெயரிட்டனர்."
33,குமரி நாட்டின்கண் வடக்கே குமரியாறும் தெற்கே பஃறுளி பல்துளி ஆறும் ஓடிக்கொண்டிருந்தன.
34,பஃறுளியாறு வடிம்பலம்ப நின்ற பாண்டியனுக்கு உரியதாகப் புறம் ஆம் பாட்டால் விளங்குகின்றது.
35,குமரியாறு கன்னியாகுமரிக்குத் தெற்கே சிறிது தொலைவில் இருந்திருத்தல் கூடும்.
36,முற்காலத்தில் இப்பொழுதைய இராசபுதானத்தின் பெரும் பகுதி தெற்கிலும் கிழக்கிலும் அராவலி மலைவரை கடலால் மூடப்பட்டிருந்தது.
37,நிலநூலார் அக்கடலுக்கு இராசபுத்தானாக் கடலென்று பெயரிட் டுள்ளார்கள்.
38,அப்பகுதியே இப்பொழுது காணப்படும் பெரிய இந்திய பாலைநிலமாகும். அதனையடுத்து அதன் பெயரால் ஒரு மலைத்தொடரும் விளங்கியது.
39,பிற்காலத்தோர் அதற்கு மகேந்திரம் எனப் பெயரிட்டனர்.
40,இரண்டு ஆறுகளுக்குமிடையே எழுநூறு காவதம் நிலப்பரப்பிருந்தது.
41,ஒரு காவத மென்பது எண்ணாயிர முழங்கொண்ட தூரம்.
42,எழுநூறு காவதம் நிலப்பரப்பும் நாற்பத்தொன்பது சிறு நாடுகளாகப் பிரிக்கப்பட்டிருந்தது.
43,குமரி நாடு என்னும் பெயர்க் காரணம் மனு என்பவன் ஒரு தமிழ்வேந்தன்.
44,இவனுக்கு இளை என்னும் ஒரு பெண் மகவும் இயமன் என்னும் ஓர் ஆண் மகவும் இருந்தனர்.
45,மனு தான் ஆண்டுவந்த நாட்டின் தென் பகுதியை இயமனுக்கும் வட பகுதியை இளைக்கும் அளித்தான்.
46,இயமன் ஆண்ட தென்னாடு கடல்வாய்ப்பட்டது.
47,இதுபற்றியே இயமனுடைய உலகம் தெற்கில் உள்ளது என்னும் கோட்பாடு இன்றுவரையும் உள்ளது.
48,வடக்கே இருந்த நாடு பெண்ணால் ஆளப்பட்டமையின் குமரிநாடு என்று வழங்கப்பட்டது.
49,தமிழகத்தின் ஒரு பகுதியாகிய மலையாளத்தில் பெண்களுக்கே ஆண்களிலுங் கூடிய அதிகார முண்டு.
50,அரசுரிமையும் சொத்துரிமையும் பெண் வழியையே சாருகின்றன.
51,தமிழ்நாட்டில் பெண்களே நெடுங்காலம் ஆட்சி புரிந்திருக்கிறார்கள்.
52,கடலுள் மறைந்துபோன தென்தேசம் இன்றுவரையும் இயமன் நாடு என மக்கள் ஞாபகத்திற் கொண்டுவருகின்றனர்.
53,இளையின் நாடு பெண்களால் ஆளப்பட்டுவந்தது.
54,தமிழகத்தின் ஒரு பகுதியாகிய தமிழ்நாட்டில் அரசி நாட்டுக்குரியவள் அவளுக்குப் பதில் ஆளாக அவள் உடன் பிறந்தான் நாட்டை ஆளுகின்றான்.
55,அரசுரிமை பெண் வழியாக வருகின்றது.
56,மலை யாளத்தில் பெண்களே சொத்துக்கு உரியோர்.
57,சற்றுச் சரிந்து தென் கிழக்காகவிருக்கலாம்.
58,ஆசியாக் கண்டத்தின் ஒரு படம் எடுத்துப் பார்த்தால் நான் கூறுவது எளிதிற் புலப்படும்.
59,இக்கருத்தை ஐரோப்பிய கலைஞர்களும் சரித்திர ஆசிரியர்களும் உறுதிப்படுத்துகின் றார்கள்.
60,"கடலின் கண்ணுள்ள, மண் கல் முதலியவற்றை ஆராயும்போது மேற்குறித்த கருத்தை நிலைநாட்டுகின்றார்கள்."
61,இக்கொள்கையை நிலைநிறுத்த வேறு காரணங்களுண்டோவென ஆராய்வோம்.
62,மேற்கூறிய யாவாமுதலிய தீவுகளில் நடைபெற்றுவரும் மொழிகள் தமிழ் மொழிக்கு மிக உறவுள்ளனவாகக் காணப்படுகின்றன.
63,மேற்கூறிய காரணங்களால் தென்னிந்தியாவின் மேற்குக் கரையி லிருந்து நியூசீலந்து வரைக்கும் பண்டு ஒரே மொழி நடைபெற்று வந்ததாகக் காணப்படுகின்றது.
64,இதில் ஆத்திரேலியாவும் உட்பட்டிருக்கலாம். திருவாளர் டி.
65,"பொன்னம்பலம் பிள்ளை, ...."
66,பல காரணங்களால் தென் னிந்தியா தெற்கேயிருந்த பெரிய கண்டத்தில் மிச்சமெனக் கருதப்படு கின்றது.
67,இதிலுள்ள குன்றுகள் உலகத்தி லுள்ள மிகப் பழையவற்றுட் சேர்ந்தன.
68,இவை ஒருகாலத்திலும் நீருள் மூழ்கி யிருந்த குறிகள் இல்லவேயில்லை.
69,இக்குன்றுகளின் பலவிடங்களிற் கருங்கற்பாறை தகடாகப் பரவியிருக்கின்றது.
70,ஆகையால் அஃது உலகில் முற்காலத்தில உயிர்கள் தோன்றும் முன்னர் இருந்தபடியே தெற்கில் இருக்கின்றது.
71,சிந்து கங்கைச் சமவெளி சிந்துநதி தொடங்கிக் கங்கைக் கழிமுகம் வரையில் ஆயிரத்திருநூறு மைல் தொலைவு இடைவெளியின்றி நீண்டிருக்கின்றது.
72,மண்ணுலகு பதப்பட்டுக் கொண்டுடிருக்கும்போது இமயமலை கிளம்பும் முன்னர்க் கங்கை நிலவெளியிருக்கும் இடம் கடலாயிருந்தது.
73,அந்தக் கடலின் தெற்குக் கரையில் தென்னிந்தியா விருக்கிறது.
74,இமயமலை கிளம்பியபோது கடல் மறைந்தது.
75,அக்காலம் நடு ஆசியாவில் நிலவிய கடல் இந்தியாவில் வடமேற்கெல்லை யாயிருந்தது.
76,முன் பிறநாடுகளிற் குடியேறிய மக்கள் தமிழர் வடஇந்தியாவை அடையவில்லை.
77,அக்காலத்து இந்தியாவின் தென்பாகம் வடபாகத்தோடு முற்றாக இணைக்கப்பட்டிருக்கவில்லை.
78,தமிழர் வடக்கேயுள்ள சாதி யாரில் வேறுபட்டவர்களாகக் காணப்படுகின் றனர்.
79,ஒருகாலம் வங்காளத்தின் கீழ்ப்பாகம் தமிழர் அதிகாரத்தின்கீழ் இருந்தது.
80,புத்தருடைய காலத்துக்குமுன் தமிழர் அனம் என்னும் நாட்டைவென்று அதற்குப் பொங் லொங் என்னும் பெயரிட்டார்கள்.
81,வங்காளத்தில் லக்லம்உடைய சந்ததியார் கி.மு.
82,ஏழாம் நூற்றாண்டு தொடங்கிக் கி.பி. வரை நீண்ட காலம் அரசு புரிந்திருக்கிறார்கள்.
83,திராவிடர் முற்காலத்தில் தோற்றத்திலாவது மன வலிமையிலாவது ஆரியருக்குக் குறைந்தவரல்லர்.
84,அக்காலத்தில் வட இந்தியாவுக்கும் தென் இந்தியாவுக்கும் இடையே கிடந்த கடல் தரையாக மாற இருநாடுகளும் தொடுக்கப்பட்டன.
85,தெற்கே இருந்தவர்கள் வடக்கே சென்றார்கள்.
86,இந்தச் செழிப்பும் செல்வமும் பொருந்திய வடநாட்டை அடைய முடியாதவர்களாயிருந்தால் அவர்கள் தமிழர் புதிதாக வந்தவர்களைத் துரத்தியிருப்பார்கள்.
87,இக்கரைப்பாகத்தில் அமிழ்ந்திப்போய்க் காட்டின் பகுதிகளாகக் கண்டுபிடிக்கப்பட்ட குறிகள் இன்னும் இருக்கின்றன.
88,இது துவாபார ஊழியில் நிகழ்ந்தது.
89,இராசாவளி பாஸ்கராசாரியார் எழுதிய வான நூற்குறிப்பில் நடுக்கோடு பழைய இலங்கைக் கூடாகச் செல்கின்றது.
90,அப்படியிருந்தால் இந்நிலப் பரப்பு நீருள் மறைவதன் முன் தமிழர் தெற்கினின்றும் இந்தியாவை அடைந்திருத்தல் வேண்டும்.
91,", ."
92,சாவா என்னும் தீவின் வடகரையில் மதுரை நீரிணையென்னும் ஒரு சிறிய நீரிணை உளது.
93,அதற்கு வடக்கே மதுரை யெனும் ஒரு சிறு தீவும் உண்டு.
94,போணியோவின் கிழக்குக்கரையிலும் மேற்படி பெயருடன் ஒரு தீவு இருக்கின்றது.
95,இது முற்றாக அல்லது சிறிதாகக் கடலாற் சூழப்பட்டது.
96,இவ்விடங்களிலொன்று பழைய மதுரையாயிருத்தல் கூடும்.
97,திருவாளர் .
98,பொன்னம்பல பிள்ளை ....
99,மூன்றாம் காலப் பகுதியின் பெரும் பகுதியில் இலங்கையும் தென்னிந்தியாவும் வடக்கே கடலை எல்லையாகப் பெற்றிருந்தன.
100,ஒருகால் திமிங்கிலங்கள் உலாவிய இடங்களில் இன்று கழுகுகள் வாழ்கின்றன.
101,இரண்டாம் காலப் பகுதியில் தென்னிந்தியா கடுந்தரையாக விருந்தது.
102,அது மூன்றாம் காலப் பகுதியில் இந்து சமுத்திரத்துக் கூடாக தென் ஆப்பிரிக்கா வரையில் அகன்றிருந்த கண்டத்தின் பகுதியாகும்.
103,அதன் வடக்குக் கரையில் எதே கடல் இருந்தது.
104,அக்கடல் மூன்றாம் காலப் பகுதியின் நடுப்பகுதியிலும் பிற்பகுதியிலும் கிழக்கு மேற்காக ஆசியாவுக்கு ஊடாகப் பரந்திருந்தது.
105,மக்களும் அவ்வாறே.
106,"இவற்றால் கொள்ளக் கிடப்பது யாதெனில், ஆஸ்திரேலியா முதலில் உலகொடு சார்பு பெற்றிராத ஒரு நில உருண்டை என்பதே."
107,உண்மையில் இதுவோர் விண்வீழ்மீன் .
108,இது விசும்பினின்று யாதோ காரணத்தால் இம் மண்ணுலகின்மீது வீழ்ந்திருக்க வேண்டும்.
109,"இருவகை இயக்கத்தோடு கூடிய உலகின் மேல் வீழ்ந்தபோதுதான், லெமூரியா கடல்வாய்ப்பட்டது."
110,"சிந்து, கங்கைவெளி, இமயமலை, மத்திய ஆசியா முதலிய நிலப்பகுதிகள் வெளிக்கிளம்பின."
111,இவ்வாறு கொள்ளுமிடத்து இப்போது பூகோள நூலாராய்ச்சியில் காரணங்காட்ட முடியாவாறு நம்மை மலைவுறுத்தும் இருபத்து மூன்று இடையூறுகள் விலகிவிடுகின்றன.
112,அத்தடைகட்கெல்லாம் தக்க விடை ஏற்படுகின்றன.
113,இவற்றையெல்லாம் இங்கு விரித்துரைக்க இயலாது.
114,ஒன்றுமட்டும் கூறலாம்.
115,அதுபோன்றே இவ்வுலகம் பண்டை நாளில் செங்குத்தாய்ச் சுழன்று கொண்டிருக்க வேண்டும்.
116,அதுகாலை மேற் குறித்த வண்ணம் ஆஸ்திரேலியா வானத்தினின்றும் தவறிப் பூமியின்மேல் தாக்கியிருக்க வேண்டும்.
117,"அதனால் மேற்குறித்த நில நீர் மாறுதல்கள் உண்டானதோடு, பூமியும் சாய்ந்து சுழலலாயிற்று."
118,இன்றைக்கு நூறாண்டுகளுக்கு முன்னர் டிக்கிரி சாய்வோடு சுழன்றது.
119,அதற்கு முன்னர் இன்னும் அதிகச் சாய்வுற்றிருந்திருக்க வேண்டும்.
120,இப்போதுள்ள சாய்வு டிக்கிரிகளுக்கு மேலில்லை.
121,இவ்வாறு சென்றால் நாளடைவில் இச்சாய்வு அடியொடு மறைந்தொழியலாம்.
122,அந்நாளில் இருவகை அயனங்களும் பட்டொழியும் பருவ வேறுபாடுகளும் சுருங்கிவிடும்.
123,உயிர்த்திரள்களின் வாழ்க்கை நிலையும் பெரிய மாறுதலடையும்.
124,இன்னும் தொடர்ந்து இது குறித்து நாமிப்போது எண்ணிப்பார்க்க வேண்டியதில்லை.
125,இங்குக் குறிக்கத்தக்க தெல்லாம் ஆஸ்திரேலியா இப்புவியின்மீது வீழ்ந்து தாக்கிய ஒரு விண்மீனா மென்பதே.
