Line Number,Sentence
2717,"எனவே ஆண்கள் ஆடவர் பயன்படுத்திய கருவி, கலங்களை அவை அவர்களுடனே புதைக்கப்படாவிட்டால் பிற ஆடவரும், பெண்களுக்குரியவற்றைப் பெண்களும் பெற்றிருப்பர்."
2718,ஆண்களைப் பொறுத்தவரை இன்ன உறவினருக்குத்தான் சென்றிருக்கும் என்று உன்னிக்க முடியாது.
2719,பெண்டிரைப் பொறுத்தவரை இறந்தவளின் பொருள்கள் அவள் புதல்வியருக்கே சென்றிருக்கும்.
2720,.
2721,வேட்டையே குழுவின் முக்கிய பிழைப்புத் தொழில் என்று இருந்த வரையிலும் இம்முறைக்கு எதிர்ப்பில்லை.
2722,இப்போது சமூகச் சரிசம நிலை கொஞ்சம் நிலை குலைந்தது.
2723,"ஆயினும் எகிப்திலும் மெசபொட்டோமியாவிலும் இருந்தது போல, இம்முறை நீடித்து இருந்திருக்கலாம்."
2724,ஆனால் நீடிக்கவிடாமல் ஏதோ ஒரு சமுதாய அதிர்ச்சியினால் மக்கள் அம்முறையை மாற்றக் கருதியிருக்கலாம்.
2725,அவ்வதிர்ச்சி போர் ஆக இருந்திருக்கலாம்.
2726,.
2727,அண்மைக் காலம்வரை கேரளத்தைக் கடலும் மலையும் இயற்கை அரண்களாக அயலார் படையெடுப்புக்களிலிருந்து காத்து வந்தன.
2728,வேளாண்மையில் கேரளத்தில் முக்கியம் பெற்ற தென்னையை நட்டால் போதும் தானாகவே வளர்ந்து நூறாண்டுகளுக்குப் பயன்தரும்.
2729,ஆண்டுதோறும் அது பத்துமாதங்களுக்கு நன்கு விளைந்த தேங்காய் தரும்.
2730,மிகக் குறைந்த உழைப்பில் நிலத்திலிருந்து பிழைப்பு நடத்தலாம்.
2731,.ய மேற்கூறிய சூழ்நிலைகள் மட்டும் காரணமாயிருந்திருக்க முடியாது.
2732,திராவிடரிடையேயும் குருமார் பணியும் யீசநைளவடல கரஉவடி மந்திரவாத முறையும் பிறரைப்போல பெரும்பாலும் ஆடவரிடமே இருந்தன.
2733,"பார்ப்பனருடன் சம்பந்தம் நாயருடன் சம்பந்தத்தைவிட மதிப்புடையது, விரும்பத்தக்கது என நாயர் பெண்கள் கருதும் வகையில் நம்பூதிரிகள் செல்வாக்கு பயன்படுத்தப்பட்டது."
2734,தரவாட்டுப் பெண்கள் நம்பூதிரிகளுக்குப் பெறும் பிள்ளைகள் அவர்கள் தாய்மாரின் தரவாட்டைச் சேர்ந்த நாயர்களாகவே ஆகிறார்கள்.
2735,உ திருமணம் செய்யும் உரிமையுடைய நம்பூதிரி குடும்ப மூத்த பையன் எத்தனை மனைவிகளை வேண்டுமானாலும் திருமணம் செய்யலாம்.
2736,இருந்த போதிலும் நம்பூதிரிப் பெண்களில் பலர் திருமணம் செய்ய இயல்வதேயில்லை.
2737,இக்கன்னிப் பெண்களைக் கண்டிப்பான காவற் கட்டுப்பாட்டில் வைக்கின்றனர்.
2738,குறிப்பாக நம்பூதிரி ஆடவரிடமிருந்து.
2739,"இயலும் வழியில் எல்லாம் நிலச் சொத்தைப் பெருக்குவதும், பெற்றதை எக்காரணங் கொண்டும் விட்டு விடாதிருப்பதும் நம்பூதிரிகளின் பண்பு."
2740,நம்பூதிரி சொத்தில் .
2741,"குடும்பத்தின் நேரடி மேற்பார்வையில் பயிரிடும் இல்லப்பண்ணை ஒன்றும், ."
2742,நாயர் தரவாடு தலைவர்களைக் குத்தகையாளர் காணம்தார் ஆக்கி ஆண்டு ஒற்றிக்கு விட்ட மீதி நிலங்களும் உண்டு.
2743,.
2744,சென்னையிலுள்ள பெண்கள் கல்லூரி இரண்டிலும் பயில்பவர்கள் நாயர் பெண்களும் மருமக்கட்தாய முறையையே பின்பற்றும் சிரியன் கிறித்துவப் பெண்களுமே.
2745,நன்கு படித்து உயர்பவர்களும் அவர்களே.
2746,திருவனந்தபுரம் மகாராஜா கல்லூரியிலும் அவ்விரு ஜாதிப்பெண்கள் பெரும் எண்ணிக்கையில் ஆண்களையொப்ப நன்கு பயில்கின்றனர்.
2747,.
2748,வங்காள மாகாண மன்றமும் பிற மாகாண மன்றங்களும் பெண்களுக்கு வாக்குரிமை தர மறுத்தன!
2749,அல்லது விவாதத்துக்கு எடுத்துக்கொள்ளவே மறுத்து விட்டன!
2750,.
2751,பெண்களுக்கு மதிப்பு வகையில் வடஇந்தியாவுக்கும் தென் இந்தியாவுக்கும் இடையேயுள்ள இப் பெரிய வேறுபாட்டுக்கு வேறு காரணங்களும் இருக்கின்றன.
2752,ஒன்று தெற்கே முகமதியமதத் தாக்கம் குறைவு.
2753,.
2754,நாயர் சாதி இந்திய அரசியல் வாழ்வில் சர்சங்கரன் நாயர் வடிவில் ஒரு ஆற்றல்மிக்க சென்னை மாகாணசட்டமன்ற உறுப்பினரைத் தந்தது.
2755,டாக்டர்.டி.எம்.
2756,நாயரின் வாழ்க்கைப்பணியானது சாதிச்சூழலின் தாக்கத்தை இன்னும் தெளிவாகக் காட்டுகிறது.
2757,ஆம் ஆண்டு தொழிற்சாலைச் சட்டம் பிற்போக்கான பெரும்பான்மையினர் கருத்தை ஏற்காமல் டி.எம்.
2758,நாயருடைய சிறுபான்மைக் குறிப்பையே பின்பற்றியது.
2759,மேலும் ல் ஏற்கப்படாத அவர் யோசனைகள் சில ல் ஏற்கப்பட்டன.
2760,அவரே பார்ப்பனரல்லாதார் அரசியல் கட்சியை அமைத்தவர்.
2761,அவர் இறந்தபின் நீதிக்கட்சி சென்னைச் சட்ட மன்ற டநபளைடயவஎந உடிரஉடை முதல் தேர்தலில் வெற்றி கண்டது.
2762,"பார்ப்பனரல்லாதார் பத்திரிகையாகிய, ஜஸ்டிஸ்தரளவஉந அவர் தொடங்கியது."
2763,அதன் ஆசிரியரும் நாயர் சாதியினரான கருணாகரனே.
2764,.
2765,மலையாளக்கரை சிறந்த இயற்கை வளமுடையது.
2766,பல்வேறு வாழ்க்கைத் திறத்தினரில் யாவரும் தத்தம் வாழ்க்கைக்கு நாள்தோறும் போதுமான வருவாயைச் சில மணி நேர உழைப்பில் பெறலாம்.
2767,ஆனால் இதே காரணத்தினால் உயர்ந்த சாதிக்கும் மிகத் தாழ்ந்த சாதிக்கும் இடையே பயங்கர வேறுபாடும் ஏற்பட்டது.
2768,வயது வந்தவர்களில் மக்கள் உற்பத்திப்பெருக்கத் தொழில் எதிலும் ஈடுபடுவதில்லை.
2769,அந்த சுகவாசிகள் அனைவருக்கம் உழைத்து உணவளிக்கும் மக்களுக்குக் கிட்டும் வாழ்க்கைத் தேவைக்கான வசதிகள் மிகமிகக் குறைவு.
2770,உழைப்புக்கு நன்றியாக அவர்களுக்குக் கிடைத்ததெல்லாம் தீண்டத்தகாதவர்களாக கொடுமைப்பட்டதுதான்.
2771,.
2772,ஆயினும் அவர்களும் பிற நாடுகளின் உழைக்கும் மக்களை விட மன நிறைவுடையவர்களாக இருப்பதாகவே கூறுகின்றனர்.
2773,காரணம் தம் நிலைமையில் நல்ல மாறுபாடு ஏற்படலாமென்ற நம்பிக்கையே அவர்களிடம் இல்லை.
2774,ஜனநாயகக் கருத்து இப்போது இத்தகையவர்கள் உள்ளத்திலும் எழுந்திருக்கிறது.
2775,இவர்கள் க்குச் சில ஆண்டுகள் முன்னர் வரை அடிமையாகவே இருந்தனர்.
2776,.
2777,கருநாடகப்பகுதியில் தமிழகம் மக்களின் வாழ்வுக்கு நெல்லும் பிற கூலங்களுமே ஆதாரம்.
2778,இவற்றை விளைவிக்கக் கடும் உழைப்பு தேவை.
2779,தெக்காண பூமியில் உழைப்பு இன்னும் கடுமையாகத் தேவைப்படுகிறது.
2780,.
2781,.
2782,இரண்டு நாடுகளிலும் தந்தைமரபு வழியினதான பிரிவினையற்ற கூட்டுக் குடும்ப முறைதடிவே கயஅடைலஇருக்கிறது.
2783,ஆயினும் இந்தியாவில் சீனாவைவிட எளிதாக கூட்டுக் குடும்பம் உடைகிறது .
2784,இரண்டு நாடுகளிலுமே திருமணங்களை மிகச் சிறுவயதில் பெரும்பாலும் தாய் தந்தையரே நடத்து கின்றனர்.
2785,மண வயது இந்தியாவில் இன்னும் குறைவு.
2786,"ஆயினும் இந்தியாவில் பிரிட்டிஷ் ஆட்சி தனிமனிதனுக்குத் தன் பங்கை வாங்க, விற்க ஒற்றி வைக்க உரிமை அளித்துள்ளது."
2787,இரு நாடுகளிலுமே தனி நபருக்கும் குடும்பத்துக்கும் வாங்க விற்க உள்ள உரிமைகளை அரசாங்கம் கட்டுப்படுத்துகிறது.
2788,இருநாடுகளிலும் இவ் அரசுரிமைகள் தேய்வடைந்துள்ள போதிலும் இத்தேய்மானம் இங்கு சீனாவைவிடக் குறைவுதான்.
2789,எ.
2790,"இந்தியாசீனா இடையேயுள்ள வேறுபாடுகளுள் முதன்மை யானது தாய்தந்தைப் பற்றுக்கும், வழிபாட்டுக்கும் தலைசிறந்த நாடு சீனா என்பதாகும்."
2791,இந்தியா செல்லங்கொடுத்துக் கெடுத்த பிள்ளைகள் நிறைந்த நாடு.
2792,இக்கதையுடன் கோயமுத்தூர் மாவட்டச் சிற்றூர்க் கிழவி ஒருத்தி சார்ந்த உண்மை வரலாற்றை ஒத்துப்பாருங்கள் கிழவி வலுவிழந்து விட்டாள்.
2793,தன்னைப் பாதுகாக்கவும் தன் புதல்வன் செய்யும் செலவுக்கும் தன் உழைப்பின் பயன் சரிக்கட்டி வராது என்று உணருகிறாள்.
2794,குழந்தைகளிடம் இந்தியர்களுக்குள்ள அதீதமான பற்றைக்காண ஒருவன் இந்தியாவுக்குத்தான் வரவேண்டுமென்றில்லை.
2795,கப்பல் கூலிகள் கப்பலிலுள்ள வெள்ளையர் குழந்தைகளை ஆர்வத்துடன் நோக்கும் பார்வை யிலிருந்தே உணரலாம்.
2796,பேரரசர் அக்பர் கூறியதாக ஒரு கதை ஒவ்வொரு மனிதனுக்கும் வாழ்வின் முழு இன்பந்துய்க்க நான்கு மனைவிகள் வேண்டும்.
2797,.
2798,திராவிட மொழிப் பாடல் ஒன்றில் குழந்தைப் பற்று அடிப்படைக் கவிதை உணர்ச்சியாயுள்ளது.
2799,"மன்னன் சாலமன் வெளிப்படையாகக் கூறாமல் பிரம்புக்கு ஓய்வு, பிள்ளைக்குத் தோய்வு என்று நீதி கூறினான்."
2800,இதைக் கேட்கும் தமிழர் அவள் ஞானத்தைக் குறைகூறிவிடுவர்!
2801,"குழந்தைகளை இயக்க நல்லவழி, கதை கூறுவதே என்பர்."
2802,பொது மக்களிடையே ஏராளமான கதைகள் புழங்கும் நாடாக இந்தியா இருப்பதற்கான காரணம் இதுவே.
2803,தமிழ்ப் பெண்ணை ஆயாஆக அமர்த்திய ஒவ்வொரு பிரிட்டிஷ் தாய்க்கும் இது நன்கு தெரியும்.
2804,சென்னைக்கு வந்த இரண்டொரு நாளுக்குள் நானும் கண்டேன்.
2805,.
2806,"சீனர் இம்முறையை முதலில் சாமை அடைடநவமுதலிய தானியவகைகளையும், பின் சமவெளிக்கு வந்தபின்னர் நெல்லையும் பயிரிட்டுப் பழகித் தேர்ச்சி அடைந்தனர்."
2807,வெற்றிக்குக் காரணம் சிறந்த பாசன முறைதான்.
2808,மிகச் சிறிய நிலப்பரப்பில் மிக அதிக தானியம் விளைவித்தாலன்றிப் போதிய உணவு கிட்டாது.
2809,.
2810,இன்று வரை சீனக் குடியானவர் குடும்பங்கள் ஒவ்வொரு நெல் நாற்றையும் தனிக் கவனத்துடன் பேணுகிறார்கள்.
2811,கோதுமை யையும் இதுபோலவே.
2812,"இதனால் ஓர் ஏக்கர் நிலத்துக்குக் கிட்டும் விளைச்சல், ஐரோப்பியரைத் தலைகுனியச் செய்யும்."
2813,இப் பெருவிளைச்சல்பெற எண்ணற்ற கைகள் பாடுபட வேண்டியிருக்கிறது.
2814,தொட்டிலிலிருந்தே தாய் தந்தையர் நோக்கங்களை ஆர்வத்துடன் நிறைவேற்றுவதே தங்கள் வாழ்வின் நோக்கம் என்று அவர்கள் கருதும்படி பயிற்சியளிக்கப்படுகிறது.
2815,இந்நிலைக்குக் காரணமாக நாம் நிலவியல் பநடிபசயயீஉயட காரணம் சொல்லிப் பயனில்லை.
2816,சீனர்கள் உருவாக்கியுள்ள சமூகநிலையை உணரவேண்டும்.
2817,.
2818,இந்தியமக்களின் சூழ்நிலை இத்தகைய கடுமையான நிலைமை களை ஏற்படுத்தவில்லை .
2819,இந் நெற்பயிர் விளைப்பில் கருத்தும் முயற்சியும் இங்கு குறைவு.
2820,நாற்று நடாமல் சில பகுதிகளில் விதையைத் தூவி விதைத்தும் பயிரிடுகின்றனர்.
2821,நாற்று நடவும் கவனிப்பில்லாமலே நடக்கிறது பெரும்பாலும் நடுபவர் பெண்டிரே.
2822,சென்னை அரசின் வேளாண்மைத்துறை தனி நாற்றுநடும் முறையை புகுத்தி அது மெள்ளப் பரவி வருகிறது.
2823,"ஆனால், அதை மேற்கொள்ளும் நிலக்கிழார்களும் கூலிப்பெண்களையே அமர்த்து கின்றனர்."
2824,ஏழைக் குடும்பக் குழந்தைகள் தாய் தந்தையருக்கு தாமாகவே இவ்வகையில் உதவ முன்வருகின்றனர்.
2825,"ஆனால், இவ்உதவியானது சுற்றித் திரிந்து ஓடியாடுவது ஆடுமாடுகளைப் பார்த்துக்கொண்டு விளையாடுவது என்ற அளவில் முடிகிறது."
2826,இந்தியாவில் நாய்கள்கூட நன்கு பயிற்றுவிக்கப் படுவதில்லை.
2827,"ஒரு சில வேட்டைநாய் ரகங்களைத் தவிர, தென் இந்தியர்கள் நாய் வளர்ப்பது குரைப்பதற்கு மட்டும்தான்."
2828,.
2829,குறிப்பு ஊர்க்கட்சிப் பிணக்கு .
2830,நான் அப்போது திருநெல்வேலி மாவட்டத்தில் துணைகலெக்டர் னுநயீரவல ஊடிடடநஉவடிச ஆகஇருந்தேன்.
2831,அப்பகுதி ஊர்களில் பொதுவாக உள்ள ஒரு ஊரில் இருபிரிவின ரிடையேகயஉவடிளே பகை வெறி குமுறிக்கொண்டிருந்தது.
2832,ஏ கட்சி இரவில் ஆரவாரமிக்க ஒரு கூட்டம் நடத்தி.
2833,"பி கட்சி கொடுமைகளை இனிப் பொறுத்திருக்க முடியாது, ஏதேனும் செய்து தான் ஆகவேண்டும் என்று ஒருமனதாகத் தீர்மானித்து."
2834,ஆராய்ந்தபின் பி கட்சியின் முக்கிய உறுப்பினர் இருவர் மீது பொய்யான கொலை வழக்குத் தொடுப்பதென முடிவு செய்தனர்.
2835,.
2836,குருசாமி என்ற ஓர் இளைஞன் அக்கூட்டத்திற்கு வந்திருந்தான்.
2837,"ஆனால், வீட்டுக்குச் சென்றபின் தன் முடிவை மாற்றிக்கொண்டான்."
2838,.
2839,அதன்பின் அதிக வெறியுடன் இரண்டாவது கூட்டம் கூடிற்று.
2840,குருசாமியை மிக வற்புறுத்த அவன் மறுத்துவிட்டான்.
2841,"ஆனால், அவனை விடத் துணிந்த மற்றொரு இளைஞன் இசைந்தான்."
2842,அவனுக்கும் ஒரு கிழத்தந்தை இருந்தார்.
2843,அன்றிரவு அக்கிழவனைக் கொன்று பிணம் ஏ கும்பலைச் சேர்ந்த ஒருவன் வீட்டின் முன்னால் தெருவில் போடப்பட்டது.
2844,விடியற் காலம் ஏகும்பல்காரன் அதைக் கண்டு காவல் துறையினருக்கு அறிவித்தான்.
2845,போலீகாரர் புலனாராய அனுப்பப்பட்டார்.
2846,எ.
2847,போலீகாரர் கூரிய அறிவுடையர்.
2848,மிஞ்சினால் தெருவின் போனவன் கால் மட்டுமே தெரிந்திருக்கும் என்பதை உணர்ந்தார்.
2849,எ.
2850,என் நண்பர் ஒருவரை அணுகினர்.
2851,இளைஞராயினும் அவர் சிறந்த வக்கீல் எனப் பெயர் எடுத்துக் கொண்டிருந்தார்.
2852,நிலைமையை விளக்கிப் பெருந் தொகையும் தருவதாகவும் கூறினர்.
2853,"ஆனால், அவர் அவ்வழக்கை ஏற்கமுடியாது என்று கூறியபோது, அவர்கள் நொந்து போயினர்."
2854,எ.
