Line Number,Sentence
920,பொறுப்பு வாய்ந்த ஒரு தலைவர் என்றும் கூறலாம்.
921,"தழுவப்படுவது அஃறிணைப் பெயராயின், நல்லது என்னும் குறிப்பு வினையாலணையும் பெயருக்குப் பின் எண்ணுச் சொல் வரலாம்."
922,எடு நல்லதொரு காலம்.
923,"எண்ணுச் சொற்களோடு கூடிவரும் பல சொற்கள் பிளவுபடா திசைப்பின், அவற்றுக்கு முன்னரே எண்ணுச்சொல் நிற்றல் வேண்டும்."
924,எடு ஒரு நல்ல தென்னாட்டுத் தமிழ்ப் பையன் ஒரு சிறு நல்ல பெண்பிள்ளை.
925,"இவற்றில், தெரிநிலைப் பெயரெச்சமின்மையே பிளவுபடா திசைத்தற்காரணம்."
926,இவற்றை அளவையாகக் கொண்டு குறிப்புப் பெயரெச்சங்கள் தொடர்ந்துவரும் முறை அறிக.
927,வாக்கியங்களிற் சொற்கள் அமைந்து கிடக்கும் முறை பலவகைப்படும்.
928,"அவற்றுள், உரைநடைக்குரியன அல்லது மாணவர் கையாளத்தக்கன மூன்று."
929,"அவை, ஆற்றுநீர், நிரனிறை, அளைமறி பாம்பு என்பன."
930,"ஒரே தொடர்ச்சியாய்ச் செல்லும் ஆற்றுநீர்போல், ஒரே தொடர்ச்சியாய்ப் பொருள் செல்லுமாறு சொற்கள் அமைந்து கிடக்கும் முறை, ஆற்றுநீர் ஆகும்."
931,எடு நாங்கள் நால்வரும் நேற்று ஒரு காட்டுணா போனோம்.
932,காட்டிற்குப் போனவுடன் எங்கள் மூட்டை முடிச்சுகளை யெல்லாம் இறக்கி ஒரு மரத்தடியில் வைத்துவிட்டுச் சிறிதுநேரம் விளையாடிக் கொண்டிருந்தோம்.
933,திடுமென்று ஒரு புலிக்குரல் கேட்டது.
934,"நாங்கள் யாவரும் திகிலடைந்து மெல்ல நடந்து, பக்கத்திலுள்ள ஒரு புதரிற்போய்ப் பதுங்கிக்கொண் டோம்."
935,சிறிதுநேரத்திற்குள் புலி வந்துவிட்டது.
936,அன்று எங்கள் உயிர் எங்களிடமில்லை.
937,வீடுவந்து சேர்ந்தபின்தான் எங்கள் நெஞ்சாங்குலைத் துடிப்பு நின்றது.
938,"பிற நாடுகளிலெல்லாம் அரசியற்கட்சி பல விருப்பினும், நாட்டுமொழி அவை யெல்லாவற்றிற்கும் பொதுவாகும்."
939,"இப் பாழாய்ப்போன தமிழ்நாட்டிலோ, ஒவ்வொரு கட்சியொடும் ஒவ்வொரு மொழி தொடர்புறுத்தப்படு கிறது."
940,"அதிலுங் கேடாக, நாட்டுமொழியே நாட்டவரால் வெறுக்கவும் படுகின்றது."
941,மொழியல்லவா மக்கள் முன்னேறும் வழி?
942,தாய்மொழியைப் பேணாத நாடு தமிழ்நாடு தவிர வேறு ஏதேனும் உண்டா?
943,எடு முருகனும் பெருமாளும் கணக்கில் முறையே நாற்பது வரையமும் ஐம்பது வரையமும் பெற்றார்கள்.
944,வரையம் மயிலுங் குயிலும் கார்காலத்தை முறையே விரும்புவதும் வெறுப்பதும் இயல்பு.
945,அளை வளை.
946,மறிதல் மடங்குதல்.
947,எடு குத்தினான் வேங்கையைக் கத்தியால்.
948,எடுத்தான் தடியைப் பெருமாள் அடித்தான் புலியை அவனே.
949,"இங்ஙனம் அமைப்பது இயற்கையன்மையாலும், கருத்து மாற்றத்தை யுண்டுபண்ணுவதாலும், நெடுகலும் இம் முறையைக் கையாளுவது வழுவாகும்."
950,வலிகருதிய இடத்தில்மட்டும் கையாளலாம்.
951,சொற்கிடக்கை முறைக்கு இலக்கணத்தில் பொருள்கோள் என்று பெயர்.
952,பொருள்கொள்ளும் முறை பொருள்கோள்.
953,"வினா மரபு ஒரு பொருளைப்பற்றி வினவும்போது, வினவப்படும் பொருளைக் குறிக்கும் சொல்லின் ஈற்றில் வினாவெழுத்திருத்தல் வேண்டும்."
954,வினா வினவப்படும் பொருள் எடு கண்ணானா வந்தான்?
955,ஆள் கண்ணன் நேற்றா வந்தான்?
956,காலம் கண்ணன் நேற்று என்னிடமா வந்தான்?
957,இடம் கண்ணன் நேற்று என்னிடம் வண்டியிலா வந்தான்?
958,ஊர்தி கண்ணன் நேற்று என்னிடம் வேகமாகவா வந்தான்?
959,வந்தவகை கண்ணன் நேற்று என்னிடம் புத்தகமா தந்தான்?
960,"பொருள் ஐயமும் சினமும் பற்றிய வினாவில், சிறிதறியப்பட்ட பொருளும் உண்மைப் பொருளும் முன்னர்க் கூறப்படல் வேண்டும்."
961,எடு அவ் வுருவம் மாந்தனா?
962,நீ மனிதனா?
963,சின வினா.
964,எடு தமிழ்நாட்டிற்கு இந்தி வேண்டுமா?
965,எந்திரத்தினால் நன்மையா?
966,"வினவுவான் கருத்தின்படி, எதிர்மறைச்சொல்லும் தீமைச் சொல்லும் உண்மை குறிப்பின், அவை முன்வரலாம்."
967,எடு உனக்குத் தண்டனை வேண்டாவா?
968,குடியினால் தீமையா?
969,"குறித்த கருத்தின்றிக் கேட்கப்பெறும் வினாக்களிலெல்லாம், எதிர்மறைச் சொல்லும் தீமைச்சொல்லும், உண்மை குறிக்கும் போதுகூட, பின்வருவதே இயல்பாம்."
970,எடு ஆள் வரி விதிக்கலாமா?
971,சூதாட்டம் நல்லதா?
972,"ஒரு சொல் முன்நிற்கும்போது இரட்டுறலையோ மயக்கத் தையோ விளைக்குமாயின், அதைப் பின்நிறுத்தல் வேண்டும்."
973,எடு ஆடு எருமை மாடு என்னுமிவற்றின் நிரை முந்நிரை எனப்படும்.
974,"இதை, ஆடு மாடு எருமை என்னுமிவற்றின் நிரை முந்நிரை எனப்படும் என மாற்றுக."
975,"பயனிலை, முற்றுப் பயனிலை எச்சப்பயனிலை என இருவகைப்படும் என்பது, முற்றுப்பயனிலை எச்சப்பயனிலை எனப் பயனிலை இருவகைப்படும் என்றிருத்தல் நல்லது."
976,அமங்கலச் சொல்லை ஒருவரது பெயரொட்ட நிறுத்துதல் கூடாது.
977,எடு பண்டித நாவலர் ந.மு.
978,"வேங்கடசாமி நாட்டார் அவர்கள், மரணத்தின்பின் மாந்தன் நிலையைப்பற்றி மிக அருமை யாகப் பேசினார்கள்."
979,நாட்டார் அவர்கள் காலஞ்சென்றுவிட்டதனால் இவ் வாக்கியத்தில் அமங்கலக் குற்றத்திற்கு இடமில்லை.
980,"ஆனால், இன்றும் உயிர் வாழ்பவருடைய பெயரையொட்ட அமங்கலச் சொல்லை நிறுத்துதல் கூடாது."
981,"ஆங்கிலக் கலைப்பட்டங்களைப் பெயரொடு சேர்த்துக் கூறும்போது, அவர்கள் என்னும் உயர்வுச் சொல்லின்பின் அவற்றை நிறுத்துதல் வேண்டும்."
982,", .., பி.எல்."
983,"அவர்கள் என்னும் சொல் வராதபோது, கலைப்பட்டங்கள் இயற்பெயரை அடுத்துநிற்கும்."
984,"கனம் லீத்து, எம்.ஏ."
985,"வேற்றுமைப் பொருத்தம் வேற்றுமைத் தொடர்மொழிகளிற் பல, தொகைநிலைத் தொடர்களாகவே வழங்குகின்றன."
986,அவற்றை அங்ஙனமே வழங்குதல்வேண்டும்.
987,"எடு பால் குடிக்கிற பிள்ளை, காய்ச்சல் மருந்து, சாத்தன் புத்தகம், தம்பி மகன், மலைவாழ்நர்."
988,இவற்றைப் பொதுவாய் உருபு விரிக்கவேண்டியதில்லை.
989,"ஆனால், ஒரு பயன் நோக்கிச் சிலவிடத்து விரிக்கலாம்."
990,"கூலிவேலை என்பது வேலையின் வகையையும், கூலிக்கு வேலை என்பது வேலையின் நோக்கத்தையும் குறிக்கின்றது."
991,"இங்ஙனமே, சோறுண்கிறான் என்பது பொதுவான பொருளிலும், சோற்றை யுண்கிறான் என்பது குறிப்பிட்ட சோற்றையுண்கிறான் என்னும் சிறப்புப் பொருளிலும் வழங்கலாம்."
992,வேற்றுமையுருபுகளைச் சிலவிடத்து விரித்தே வழங்குதல் கூடும்.
993,"அவனைக் கூப்பிடு என்பதை அவன் கூப்பிடு என்றும், மரத்திலிருந்து விழுகிறது என்பதை மரம் விழுகிறது என்றும் சொல்லமுடியாது."
994,"வேற்றுமையுருபுகளைப் பெயரொடு சேர்க்கும்போது, அவ்வப் பொருட்குரியவற்றையே சேர்த்தல்வேண்டும்."
995,உருபு மாறின் பொருளும் மாறிவிடும் அல்லது பொருள இராது.
996,"கல்லை யெறிந்தான் என்பது குறியில்லாமற் கல்லையெறிவதையும், கல்லால் எறிந்தான் என்பது குறிமேற் கல்லையெறிவதையும் குறிக்கும்."
997,இங்ஙனமே பிறவும்.
998,பல பொருளுக்குப் பல வேற்றுமையுருபுகள் ஏற்கும்.
999,அவற்றுள் எதை வேண்டுமானாலும் பயன்படுத்தலாம்.
1000,"ஆனால், செய்யுள் வழக்கைவிட உலக வழக்கையும், உலக வழக்கிலும் பெருவழக்கையும், தழுவுதல் நன்று."
1001,சில பொருட்கு உருபுமட்டும் வரும் சில பொருட்கு உருபுஞ் சொல்லும் வரும்.
1002,சார்பு கருமச் சார்பு கருமமல்லாச் சார்பு எனச் சார்பு இருவகைப்படும்.
1003,உடம்பால் தொடுதல் கருமச்சார்பு உதவியை நாடல் கருமமல்லாச் சார்பு.
1004,இவ்விரு பொருளிலும் ஆம் வேற்றுமையும் ஆம் வேற்றுமையும் வரும்.
1005,"எடு முசலொனி இற்றிலரைச் சேர்ந்தவர், முசலொனி இற்றில ரோடு சேர்ந்தவர்."
1006,"குடும்பத்தொடு சேர்ந்துகொண்டான், குடும்பத்தில் சேர்ந்து கொண்டான்."
1007,. . . வரும்.
1008,"எடு ஊரை நீங்கினான், ஊரைவிட்டு நீங்கினான்."
1009,"ஊருக்கு நீங்கினான் செ. ஊரின் நீங்கினான், ஊரினின்று நீங்கினான்."
1010,"., .."
1011,"எடு அதையொத்தது அதற்கொத்தது ., ., .."
1012,"எடு சாத்தனைவிட நெடியன் சாத்தற்கு நெடியன் சாத்தனின் நெடியன், சாத்தனில் நெடியன், சாத்தனிலும் நெடியன்."
1013,"., . வரும்."
1014,எடு மதுரைக்கு வடக்குத் தில்லை.
1015,மதுரையில் வடக்குத் தில்லை.
1016,. . வரும்.
1017,எடு சென்னைக்குத் தில்லி தொலைவு.
1018,சென்னையிலிருந்து தில்லி தொலைவு.
1019,"., . வரும்."
1020,"எடு மண்ணாற் செய்த குடம், வாணிகத்தால் முன்னேறினான்."
1021,"மண்ணிற் செய்த குடம், வாணிகத்தின் முன்னேறினான்."
1022,"., . வரும்."
1023,எடு இப் பிள்ளையினால் உயிர் வாழ்கிறேன்.
1024,"இப் பிள்ளைக்காக உயிர் வாழ்கிறேன், இப் பிள்ளையின் பொருட்டு உயிர் வாழ்கிறேன்."
1025,. . . வரும்.
1026,எடு பழியை அஞ்சுவேன்.
1027,செ. பழிக்கு அஞ்சுவேன்.
1028,பழியின் அஞ்சுவேன்.
1029,"செ. செய்யுள் வழக்கில், ஆம் வேற்றுமைக் கொப்பாகப் பழியால் அஞ்சுவேன் என ஆம் வேற்றுமையும் வரும்."
1030,. . வரும்.
1031,"எடு பூவிற்குச் சிறந்தது தாமரை, காவியத்திற்குச் சிறந்தது சிலப்பதிகாரம்."
1032,"பூவிற் சிறந்தது தாமரை, காவியத்திற் சிறந்தது சிலப்பதிகாரம்."
1033,"., . வரும்."
1034,எடு தேவர்க்குப் பலி.
1035,தேவரது பலி.
1036,பெயராய் வரும்போது தேவர்பலி எனத் தொகையாய் இருத்தலே நன்று.
1037,. . வரும்.
1038,"எடு கண்ணனுக்குத் தம்பி, நம்பிக்கு மகன்."
1039,"கண்ணனுடைய தம்பி, நம்பியின் மகன்."
1040,"பெயராய் வரும்போது, கண்ணன் தம்பி, நம்பிமகன் எனத் தொகையாயிருத்தலே நன்று."
1041,"., . வரும்."
1042,எடு இச் சொற்குப் பொருளென்ன?
1043,இச் சொல்லின் பொருளென்ன?
1044,. . வரும்.
1045,எடு அச்சப் பொருட்கு எந்த வேற்றுமை வரும்?
1046,அச்சப் பொருளில் எந்த வேற்றுமை வரும்?
1047,"., . வரும்."
1048,எடு இந்த ஆவணம் பத்திரம் யார் பேருக்கு இருக்கின்றது?
1049,இந்த ஆவணம் யார் பேரில் இருக்கின்றது?
1050,"., . . வரும்."
1051,எடு அதைப்பற்றி ஐயமில்லை.
1052,அதற்கு ஐயமில்லை.
1053,அதில் ஐயமில்லை.
1054,"., . வரும்."
1055,"எடு ஆண்டால் மூத்தவன், அறிவால் மூத்தவன்."
1056,"ஆண்டில் மூத்தவன், அறிவில் மூத்தவன்."
1057,"ஆண்டால் இளைஞன், அறிவால் இளைஞன்."
1058,"ஆண்டில் இளைஞன், அறிவில் இளைஞன்."
1059,இப் பொருளில் ஆம் வே.
1060,வருவதே சிறப்பாம்.
1061,. . வரும்.
1062,"எடு வழியைச் சென்றான், நெறியைச் சென்றான் செ. வழியிற் சென்றான், நெறியிற் சென்றான், நெறிக்கண் சென்றான்."
1063,. . வரும்.
1064,"எடு ஆற்றோடு போய்விட்டான், வெள்ளத்தோடு போய்விட்டான்."
1065,"ஆற்றிலே போய்விட்டான், வெள்ளத்திலே போய்விட்டான்."
1066,நோயாலிறத்தலைக் குறிக்க ஆம் வே.
1067,"எடு காய்ச்சலிற் போய்விட்டான், கொள்ளையிலே போக."
1068,. . வரும்.
1069,எடு போரை வென்றான்.
1070,போரில் வென்றான்.
1071,. . வரும்.
1072,எடு வருகிற ஆவணிக்குக் கலியாணம்.
1073,வருகிற ஆவணியிற் கலியாணம்.
1074,. . . . வரும்.
1075,எடு நூலைக் குற்றங் கூறினான்.
1076,நூலுக்குக் குற்றங் கூறினான்.
1077,நூலது குற்றங் கூறினான்.
1078,நூலின்கண் குற்றங் கூறினான்.
1079,. . வரும்.
1080,"எடு முதலியாருக்கு வேலை செய்கிறான், ஆசிரியனுக்கு ஏவல் செய்கிறான்."
1081,"முதலியாரது வேலை செய்கிறான், ஆசிரியனது ஏவல் செய்கிறான்."
1082,இப் பொருளில் ஆம் வேற்றுமையே பெருவழக்காம்.
1083,. . வரும்.
1084,எடு வீணுக்கு உழைக்கிறான்.
1085,வீணில் உழைக்கிறான்.
1086,"., ., . வரும்."
1087,"எடு அதுபற்றி வருந்தினான், மகிழ்ந்தான்."
1088,"அதனால் வருந்தினான், மகிழ்ந்தான்."
1089,"அதற்கு வருந்தினான், மகிழ்ந்தான்."
1090,ஆம் வேற்றுமை ஒடு உருபு சிறந்தவர்கள் பெயரொடு சேர்ந்துவரும்.
1091,"எடு தந்தையொடு மக்கள் வந்தார், நம்பியொடு நாய் வந்தது."
1092,"இரு சாராரும் சமமானவராயின், ஆம் வேற்றுமையிற் கூறாது முதல்வேற்றுமையிற் கூறல்வேண்டும்."
1093,"எடு முதலியாரும் செட்டியாரும் வந்தார்கள், நாயும் கழுதையும் வந்தன."
1094,"இருவரிடைப்பட்ட தொடர்பும் நட்பும் பகையும்பற்றிய கூற்று, பின்வருமாறு வேற்றுமை பெறும் எனக்கும் அவருக்கும் தொடர்புண்டு."
1095,எனக்கு அவரொடு தொடர்புண்டு.
1096,எனக்கு அவருடைய தொடர்புண்டு.
1097,எனக்கு அவன் நட்பு.
1098,"எனக்கும் அவனுக்கும் நட்பு, நட்புண்டு."
1099,"எனக்கு அவனொடு நட்பு, நட்புண்டு."
1100,எனக்கு அவனுடைய நட்புண்டு.
1101,எனக்கு அவன் பகை.
1102,"எனக்கும் அவனுக்கும் பகை, பகையுண்டு."
1103,"எனக்கு அவனொடு பகை, பகையுண்டு."
1104,எனக்கு அவனுடைய பகையுண்டு.
1105,"எடு எனக்கு அவனுடைய நட்புண்டு அவன் என்னிடத்து அன்பு பூண்டிருக்கின்றான் ஆனால், யான் அவனிடத்து அன்பு பூணவில்லை."
1106,இங்ஙனமே பிறிதும்.
1107,எடு யானையின் காலை வெட்டினான்.
1108,யானையைக் காலின்கண் வெட்டினான்.
1109,குடத்தின் விளிம்பைக் குறைத்தான்.
1110,குடத்தை விளிம்பின்கண் குறைத்தான்.
1111,"இசைபு தழுவுஞ்சொல்லும் தழுவப்படும் சொல்லும், திணை பால் எண் இடங்களில் ஒத்திருத்தல் இசைபு ஆகும்."
