Line Number,Sentence
2466,ஒரு வேளை நில்லாது போகிவிட்டால் மீண்டு அவனிடம் வருமா என்பது அதனினும் ஐயம்!
2467,.
2468,ஆசை அறுமின்கள் மனித வாழ்வு பலப்பல துன்பங்களுக்கு இடனாக இருக்கிறது.
2469,துன்பத்திற்கு உறைவிடமே மனித வாழ்வு என்று கருதுபவர்களும் இல்லாமல் இல்லை.
2470,வாழ்வு துன்பமானது தானா?
2471,துன்பமே உருவானது தானா?
2472,இவற்றுக்கு விடை காண வேண்டுமாயின் துன்பத்தைப் பற்றி ஓரளவு அறிதல் வேண்டும்.
2473,துன்பம் எவரையும் தானே தேடி வருவது இல்லை.
2474,துன்பத்தை நாமே தேடிக் கொள்கிறோம்!
2475,இது இல்லை என்ற ஏக்கம் எங்கு எங்கு ஏற்படுகின்றதோ அங்கு அங்கு எல்லாம் துன்பம் தலைகாட்டுகிறது தங்கியும் விடுகிறது.
2476,"பேராசிரியர் உரைக்கின்றார், வறுமை என்பதற்கு ஓர் விளக்கம்!"
2477,அனுபவிக்க இது கிடைக்கவில்லையே என்று கருதிக்கிடக்கும் பேராசையுள்ளமே வறுமை என்பது அவர் தெளிவுரை.
2478,ஒன்றை விரும்பிச் சென்றால் துன்பம் வெறுத்து ஒதுக்கினால் இன்பம்!
2479,துன்ப இன்பங்களுக்கு யார் காரணம்?
2480,இதனைத் தெளிவாக ஆராய்ந்த பெரியார் கணியன் பூங்குன்றன்.
2481,அவர் கணக்கியல் மேதை அன்றியும் வாழ்வியல் மேதை வாழ்வியல் யாது?
2482,மெய்யுணர்வு எய்தித் தெளிவுடன் வாழ்பவரே வாழ்பவர்!
2483,வாழ்வதே வாழ்வியல்!
2484,பிறரெல்லாம் தாழ்பவர் அவர்கள் இயலெல்லாம் தாழ்வியல்!
2485,இவர் உரை பொய்யா மெய்யா என்பதைப் பேசித் தீர்த்து விட முடியாது நொடிப் பொழுதில் முடிவு கட்டிவிடவும் முடியாது!
2486,வாழ்ந்து பார்க்க வேண்டும் காலம் பொறுத்திருந்தும் முடிவு காண வேண்டும்!
2487,"செயற்கைச் சட்டம் எப்பொழுதும், உடனே வெளிப் பட்டு விடும்."
2488,ஆனால் இயற்கைச் சட்டமோ பொறுத்திருந்து தான் தன் ஆற்றலைக் காட்டும்.
2489,செயற்கைச் சட்டத்தின் விளைவுகளில் தவறுகள் நேரலாம்.
2490,இயற்கைச் சட்டத்தில் அவ்வாறு ஒரு நாளும் நேர்வது இல்லை!
2491,காரணம் செயற்கைச் சட்டம் அறிவின் ஆட்சி மிக்கது இயற்கைச் சட்டம் அறத்தின் ஆட்சி மிக்கது.
2492,இதனை தெளிவுறக் காண்பவன் மெய்யுணர்வு பெற்றவன்!
2493,துன்ப இன்பங்களுக்கு அப்பாற்பட்டவன்!
2494,துன்ப இன்பங்களை நாமே உண்டாக்கிக் கொள்கிறோம்!
2495,எப்படி?
2496,இத்தகையவர்களுக்கு இவர்கள் பயன்படுத்தும் இப் பொருள்கள் கிடைக்காவிட்டால் ஏற்படும் துன்பத்தைக் கண்ணாரக் காண வேண்டும்!
2497,எவ்வளவு அற்பமான பொருள்கள் இவை?
2498,இவற்றைப் பெற முடியாமைக்கு இவர்கள் பயன்படுத்தும் இப்பொருள்கள் கிடைக்காவிட்டால் ஏற்படும் துன்பத்தைக் கண்ணாரக் காண வேண்டும்!
2499,எவ்வளவு அற்பமான பொருள்கள் இவை?
2500,இவற்றைப் பெற முடியாமைக்கு இவர்கள் படும் அல்லல்கள் இவ்வளவு அவ்வளவா?
2501,என்று அவர்கள் நிலைமைக்காக வருந்தாமல் முடியாது.
2502,இப்பொருள் இல்லாமல் என்னால் இருக்கவே முடியாது.
2503,அப்படிப் பழகிவிட்டேன் என்று பெருமைப்பட்டுக் கொள் பவர்களும் இருக்கிறார்கள்.
2504,இவர்கள் உரை இவர்களுக்குப் பெருமை தருகிறதா?
2505,"என்பது ஒரு பக்கம் இருந்தாலும், நன்மையாவது தருகிறதா?"
2506,என்றால் அதுவும் இல்லை!
2507,பதனீர்ப் புழு என ஒன்று உண்டு.
2508,அதற்கு அளவும் கிடையாது அறிவும் கிடையாது என்று சொல்ல வேண்டும் போல் இருக்கிறது.
2509,"பதனீர்ப் புழு, பதனீர்ச் சட்டிக்குள் புகும் வெளியேறாது."
2510,குடித்துக் குடித்து வயிறு புடைத்து வெளியேறா வண்ணம் அங்கேயே சாகும்!
2511,எத்தனையோ செத்து மிதப்பதைப் பார்த்துக் கொண்டும் தானும் அவ்வழியிலேயே நிலைத்துவிடும்.
2512,அறிவிலாத அதற்கு அது தகுதியாகலாம் அறிவுடைய ஏன் ஆறறிவுடைய மனிதனும் பதனீர்ப் பூச்சிக்கு மூத்த பூச்சியாக இருக்கலாமா?
2513,குடி குடியைக் கெடுக்கிறது என்பதைத் தெளிவாக அறியாதவர் முன்னும் இல்லை பின்னும் இல்லை.
2514,கெடுப்பதைக் கண்ணாரக் கண்டறிந்தும் மதுவே மகேசன் மதுவே சுவர்க்கம் என்று மண்டிக் கிடப்பவர்கள் எத்துணைப் பேர்கள்!
2515,பழங்கால அரசர்களை விட்டதா சூது!
2516,சூதாடிய வேந்தர்கள் கதையை நாளெல்லாம் படிக்கிறோம்.
2517,என்றாலும் சூதாட்டம் ஒழிந்ததா?
2518,முன்னாவது ஒரு வகையில் சூதாட்டம்!
2519,இப்பொழுது நோக்குமிடமெங்கும் நீக்கமறச் சூதாட்டம் பெயர் மட்டும் வெவ்வேறு!
2520,சூதாட்டம் ஒரு பங்கு மறைமுகச் சூதாட்டம் நூறு பங்கு!
2521,"உண்மைச் சூதாட்டச் சங்கத்திற்கே வெட்கமின்றிப் படித்தவனும், பட்டம் பெற்றவனும், பேச்சாளியும், எழுத்தாளியும், அறிஞனும், கலைஞனும் வாணாள் உறுப்பினன் ஆகின்றான்!"
2522,வெட்கம்!
2523,வெட்கம்!
2524,சூதாடி!
2525,ஒரு நாளும் திருந்தி மனிதனாக வாழாத வாழ்நாள் சூதாடி!
2526,என்று முத்திரை வைத்துக் கொண்டு செத்துமடிய வேண்டும் என்றால் அவர்கள் நிலைமைக்கு இணை அவர்கள் நிலைமைதான்!
2527,மது விற்காதே மது குடிக்காதே சூது ஆடாதே என்று அரசு தடை விதித்திருக்கிறது.
2528,பெறாத ஒன்றைப் பெற வழியென்ன?
2529,கை கண்டது கரவு வழி ஒன்றே.
2530,மறைந்து மறைந்து குடிக்கின்றனர்.
2531,சூதாடுகின்றனர்.
2532,விளைவு என்ன?
2533,"குற்றக் கூண்டு ஏறுதல், சிறைக் கூடம் செல்லுதல், ஒறுப்புத் தொகை கட்டுதல் இப்படியாகின்றது."
2534,என்றாலும் தம் பழக்கத்தை விடுகின்றனரா?
2535,மறந்து விடுகின்றனர்!
2536,எதை?
2537,குடியை சூதை அன்று!
2538,தண்டனைகளைத் தான் மறந்து விடுகின்றனர்.
2539,தண்டனைகளை மறந்து மரத்துப்போன உள்ளம் உயிர் அன்ன மானத்திற்கும் மரத்துப் போய்விடுகின்றது.
2540,அடுத்தவர்கள் இழிவாக நினைப்பார்களே.
2541,நான்கு பேர்களின் முன் தலை நிமிர்ந்து நடமாட முடியாதே என்றெல்லாம் நினைப்பது இல்லை.
2542,அற்பமான பற்று எத்தகைய நல்ல பண்புகளையெல்லாமோ கொன்று விடுகின்றது!
2543,"புகை பிடிக்காதவர்களுக்கு, அது எவ்வளவு நாற்றமாக இருக்கிறது!"
2544,"பிறர் ஊதிவிடும் புகை மூக்கின் பக்கம் வரும்போதே அருவருப்பும், குமட்டலும் ஏற்பட்டு விடுகின்றது."
2545,"இருந்தாலும் குடித்துப் பழகியவர்களுக்கு அது எவ்வளவு நறுமணமும், இன்சுவையும் ஊட்டுவதாகக் கருதாவிட்டால் விடாப்பிடியாகப் பற்றிக்கொண்டு இருப்பார்களா?"
2546,"குடித்துக் குடித்து உயிரையாவது விடுவேனே அல்லாமல், குடியை விடமாட்டேன் என்றல்லவோ பிடிவாதம் செய்கின்றனர்."
2547,இத்தகைய தீய பற்றுகளுக்கு அடிமையாகாத ஒருவனுக்கு இவை பற்றிய துன்பம் உண்டா?
2548,காபி குடிக்கும் பழக்கம் இல்லாத ஒருவனுக்கு அதனை எதிர்பார்த்திருக்கும் துன்பம் இல்லை காசு கிடைக்கவில்லையே என்னும் ஏக்கம் இல்லை.
2549,காபி நன்றாக இல்லை என்னும் குறைபாடு இல்லை!
2550,ஆம்!
2551,காபி குடிக்காத ஒருவன் காபி பற்றிய துன்பத்திலிருந்து விடுதலை அடைந்து விடுகிறான்.
2552,இப்படியே வேண்டாம் வேண்டாம் என்று எத்தனை எத்தனை பொருட்களை ஒதுக்குகிறானோ அவ்வளவுக்குத் துன்பத்திலிருந்து விலகுகிறான் இன்பத்திற்கும் அணுகுகிறான்.
2553,கால்பட்டவுடன் நீர்ப்பாசி அகலும் காலை எடுத்தவுடன் நீர்ப்பாசி கூடிச்சேரும்.
2554,அதுபோல் வேண்டாமை என்னும் உயர் எண்ணம் தலைதூக்கினால் துன்பப் பாசி அணுகிச் செறியும்.
2555,இதனால் தான் மெய்யுணர்வுடைய வள்ளுவப் பெருமகனார்.
2556,வேண்டாமை அன்ன விழுச்செல்வம் ஈண்டில்லை என்றார்.
2557,"பின் அதன் முடிவாக, அடுத்த அடியிலேயே யாண்டும் அஃதொப்ப தில் என்றார்."
2558,முற்கால மனிதன் நம் அளவுக்குக் கவலைப்பட்டிருக்க வேண்டியது இல்லை.
2559,ஏனெனில் அவன் தேவை மிகமிகக் குறைவு.
2560,"உண்ண உணவு, உடல் மறைக்க உடை, குடியிருக்க வீடு வாய்ப்புக் கிடைத்தால் ஆடல் பாடல்!"
2561,இவ்வளவோடு அவன் தேவையை முடித்துக் கொண்டான்.
2562,உண்பது நாழி உடுப்பவை இரண்டே என்பது பண்டையோர் மொழி!
2563,இன்று நம் ஒவ்வொருவர் வீட்டிலும் பார்க்க வேண்டும்!
2564,ஆழமாக ஆராய்ந்து பார்க்க வேண்டியது இல்லை மேலோட்ட மாகப் பார்த்தாலே போதும்.
2565,"வயிற்றுப் பாட்டுக்கு என்றும், மானங் காப்பதற்கென்றும் பயன்படும் பொருள்கள் தவிர எத்துணைப் பொருள்கள் குவிந்துள?"
2566,பயன் பொருள்களைப் பார்க்கிலும் பகட்டுப் பொருள்கள் மிகுந்துவிட்டன அன்றோ!
2567,காரணம் என்ன?
2568,இப்பொருள் இல்லாமல் வாழ முடியாது வாழ்வதும் நாகரிகக் குறைவு என்று எண்ணும் அளவுக்கு இறங்கிவிட்டோம்.
2569,இக் கொடிய பழக்கங்கள் நம் முதுகின் மீது ஏறிக்கொண்டு நம்மைச் சுமக்க வைத்துவிட்டது.
2570,தேவை மிகமிக நம் பாரத்தை மிகப் படுத்திக் கொண்டே போகின்றோம்.
2571,"உணவும் உடையும், உயிர்வாழவும் மானங் காக்கவும் தேவை."
2572,உயிர் வளர்க்கும் உணவில் ஊட்டச்சத்து வேண்டும்.
2573,மற்றவர்களும் இதைப் பார்த்துப் பார்த்துப் பழகிப் பழகிக் கெடுகின்றனர்.
2574,முடிந்த அளவும் பிறரையும் கெடுக்கின்றனர்.
2575,நாக்கின் தேவை எங்குபோய் நிற்குமோ தெரியவில்லை!
2576,மானம் உடையில் இருக்கிறதா?
2577,உடையின் விலையிலே இருக்கிறதா?
2578,"உடல் வெளிப்படுமாறு மெல்லியதாய் இருப்பதும், தங்கக் கரை, வெள்ளிக் கரை, சரிகை போட்டு இருப்பதும்தான் உடையா?"
2579,ஏனெனில் அந்நாகரிகம் அநாகரிகமாகி எத்தனை துன்பங்களை உண்டாக்குகின்றன.
2580,துன்ப நீக்கம் வேண்டுமென்றால் நாட்டை விட்டுப் போலி நாகரிகத்தை ஓட்டியாகவேண்டும்.
2581,ஒழித்தாகவேண்டும்.
2582,அதற்கு முதற்படி மக்களிடம் ஆசை அகலுதலே!
2583,போதுமென்ற மனமே பொன் செயும் மருந்து என்னும் பழமொழி எத்தனையோ அரிய கருத்துக்களை உள்ளடக்கிக் கொண்டிருக்கிறது எனலாம்!
2584,தேவைக்கு மேல் சேர்த்துவைப்பது திருட்டு என் கிறார்கள்.
2585,அப்படியானால் தேவையற்றவைகளைக் கொள்வது திருட்டுக்கு மூத்தது என வேண்டும்.
2586,"ஏனென்றால், அவன் தேவையற்ற தேவைகள்தான் பொருட்களை நிரப்பிக் குவிக்கவும், பதுக்கி வைக்கவும் தூண்டுகின்றன."
2587,"சேர்த்து வைப்பது குற்றம் என்றால், சேர்க்கத் தூண்டிய உணர்வே பெருங்குற்றம் ஆதல் வேண்டும்."
2588,ஒரு பக்கம் தேவைக்கு இல்லாமை இன்னொரு பக்கம் தேவைக்கு விஞ்சித் தேக்கம்.
2589,இது என்ன செய்யும்?
2590,"இதுதான் பொறாமை, போட்டி, களவு, வஞ்சம் அனைத்தையும் உரு வாக்கும்."
2591,ஆசை போலி ஆசை எங்குக் கொண்டுபோய் விடுகின்றது?
2592,தேவையைக் குறைக்க அனைவராலும் இயலுவது இல்லை.
2593,"மன உரமும், மனநலமும், மெய்யுணர்வும் உடையவர்க்கே எளிதாம்."
2594,"இவையற்றவர்களோ, மற்றவர்களைப் பார்த்துப் பார்த்துப் பழகிக் கெடுகிறார்கள்."
2595,துன்பப் பிடியுள் நீக்கமறப் பிணைந்தும் விடுகிறார்கள்.
2596,"பற்றறுத்து வாழ்பவர்களே தொண்டர்களாக, துறவர்களாக, துறவிகளாக, அருளாளராக ஆகின்றனர்."
2597,உலகுக்கும் வழிகாட்டுகின்றனர்.
2598,தன் தேவையைக் குறைத்து அடக்கி வாழ முடியாதவர் பிறருக்காகப் பாடுபடும் பெருநெறியைக் கடைப்பிடிக்க முடியுமோ?
2599,அவர்கள் ஆசையை நிறைவேற்றவே பொழுது இல்லையே பிறருக்கு உழைக்க ஆசைப்பட முடியுமோ?
2600,ஒன்றில் ஆசையை விடவேண்டுமானால் அதனினும் விஞ்சிய ஒன்றில் ஆசை செலுத்தவேண்டும்.
2601,பொய் உணர்வின் ஆசையைத் தொலைக்கவேண்டுமாயின் மெய்யுணர்வில் நிலைக்கவேண்டும்.
2602,"ஒரு புலவர், இரண்டாயிரம் ஆண்டுகளுக்கு முன் இயம்பினார்."
2603,திருப்பரங்குன்றத் திருமுருகன் முன்னிலையில் இயம்பினார்.
2604,கடம்பு மாலை அணிந்த பெரும!
2605,நின்னிடம் யான் வேண்டுவது பொன்னும் பொருளும் போகமும் அல்ல அன்பும் அருளும் அறமும் ஆய இம் மூன்றுமே என்றார்.
2606,மதுவை ஒழிக்கச் சட்டம் உண்டாக்கிய அரசு என்ன செய்தது.
2607,நல்லதில் பொழுதைச் செலுத்தத் தொடங்கினால் கெட்டது தொலை தூரம் ஓட்டம் பிடிக்கும்!
2608,பருந்து வட்டமிட்டுப் பறக்கும் இடத்தே கோழியும் குஞ்சும் பதுங்கி விடுவது இல்லையா?
2609,வலியவர் ஆட்சி செய்தால் மெலியவர் தாமே அடங்கி விடுவர்.
2610,"போலியான பற்று ஒழிய, வேறு பற்றுகளும் உள."
2611,அவையும் துன்பம் தருவனவேயாம் எந்த ஒன்றில் ஆசை கொண்டாலும் துன்பமே என்பதில் ஐயமில்லை.
2612,"சாதிப்பற்று, மதப்பற்று இவையும் துன்புறுத்துவனவே!"
2613,உலகுக்கும் கேடு செய்வனவே.
2614,இப்பற்றுகள் கெடுதலாயின் இன்பம் உண்டு.
2615,"அதனைக் கெடுக்க, உலகெல்லாம் ஒன்றெனக் கருதும் தாயுள்ளம் தூயவுள்ளம் வேண்டும்."
2616,அதற்கு முழு முதலாம் இறையன்பு வேண்டும்.
2617,"அவரே, ஆசையும் அன்பும் அறுமின் அறுத்தபின் ஈசன் இருந்த இடம்எளி தாமே என்றும் கூறுவர்."
2618,உயிரின் அடையாளமாம் அன்பையும் விட்டு ஒழிக்க வேண்டிய நிலையே பற்றறுத்தல் எனின் அதன் அருமைப்பாடு பெரிதாம்!
2619,இந்நிலையுற்றார்க்கு இன்பம் ஏது?
