Line Number,Sentence
1397,"உரை உம், கெழு என்ற சாரியைப் புணர்ச்சி உம் என்பதும், கெழு என்பதும் சாரியையாகவும் வரும்."
1398,வானவரி வில்லுந் திங்களும் போலும் உம்மின் மகரம் வருமொழி நோக்கி நகரஒற்றாகவும் திரியாமல் இயல்பாகவும் அமைந்தது.
1399,இதற்கு வானவரி வில்லிடைத் திங்கள் என ஏழனுருபு விரித்துப் பொருள் செய்தல் வேண்டும்.
1400,மாநிதிக் கிழவனும் போன்ம் அகம்.
1401,மாநிதிக் கிழவனைப் போலும் என்று பொருள் செய்க.
1402,கல்கெழு கானவர் குறுந்.
1403,கல்லைக் கெழீஇயின கானவர் என்று பொருள் செய்க.
1404,கான்கெழு நாடு அகநா.
1405,கானைக் கெழீஇயின நாடு என்று பொருள் செய்க.
1406,பூக்கேழ்த் தொடலை அக.
1407,துறைகேழ் ஊரன் ஐங்.
1408,செங்கேழ் மென்கொடி அக.
1409,கெழு என்பது கேழ் எனத் திரிந்து நின்றது.
1410,இயல்புகணம் வருமொழியாக வரினும் அகரம் பெறும்.
1411,இங்ஙனம் விடு போன்ற விகுதிகள் பகுதிகளோடு இணைந்து பகுதித் தன்மைப் பட்டு மேல்வரும் விகுதிகளோடு இணைதல் வடநூலார்க்கும் உடன்பாடாம்.
1412,"ஆசீவகப் பள்ளி, நிக்கந்தக் கோட்டம் நிலை மொழி னகரஈறு கெட்டு வல்லெழுத்து மிக்குப் புணர்ந்தன."
1413,"ஈழவக் கத்தி, வாணிகத் தெரு நிலைமொழி ரகர ஈறு கெட்டு, வல்லெழுத்து மிக்குப் புணர்ந்தன."
1414,"பிரம கோட்டம், பிரமக் கோட்டம் நிலைமொழி னகரஈறு கெட்டு, வல்லெழுத்து உறழ்ந்தது."
1415,"பலர் சங்கத்தார், பலர் அரசர் பல்சங்கத் தார், பல்லரசர் இவை ரகரஈறும் அதன்முன் நின்ற அகரமும் கெட்டுப் புணர்ந்தன."
1416,இகர ஈற்று உயர்திணைப் பெயர் வேற்றுமையிலும் அல்வழியி லும் மிக்கு முடிதல் பெரும்பான்மை.
1417,"எடு நங்கைப் பெண், நங்கைச்சானி தொ."
1418,", நச்."
1419,"உரை ஆடூஉக் குறியன், மகடூஉக் குறியள் ஊகார ஈறு உகரமும் வல்லெழுத்தும் பெற்ற அல்வழிப் புணர்ச்சி."
1420,"உரை ஆடூஉக்கை, மகடூஉக்கை ஊகார ஈறு உகரமும் வல்லெழுத்தும் பெற்ற வேற்றுமைப் புணர்ச்சி தொ.எ."
1421,"உரை ஆடூவின்கை, மகடூவின்கை ஊகாரஈறு இன்சாரியை பெற்ற வேற்றுமைப் புணர்ச்சி தொ.எ."
1422,"மக்கட் குணம், மக்கட்சுட்டு, மக்கட்டலை, மக்கட் புறம் எனத் திரிந்தன."
1423,"கபிலபரணர், பலசான்றார் என ஈறு ன்,ர் கெட்டு இயல்பாயின."
1424,விரவுப்பெயர் நிலையும் அதுவே.
1425,உரை உயர்திணை வினைச்சொல் முடிபு உயர்திணை வினைச்சொல் இயல்பாயும் திரிந்தும் முடிவன உள.
1426,"உண்டீர் சான்றீர், உண்டீர் பார்ப்பீர் என முன்னிலைக் கண்ணும், உண்ப, உண்டார் சான்றார் பார்ப்பார் எனப்படர்க்கைக்கண்ணும் இயல்பாகப் புணர்ந்தன."
1427,உண்டனெஞ் சான்றேம் மகரம் திரிந்து புணர்ந்தது.
1428,உண்டே நாம் மகரம் கெட்டுப் புணர்ந்தது.
1429,"உயிர் பன்னிரண்டும், மெய் பதினெட்டனையும் இயக்கி உயிர்மெய்யாம் நிலையில் வரிவடிவின்றி நிற்றலின், உயிர் என்ற பெயர் காரணம் பற்றியதாயிற்று."
1430,"உரை உயிர் இயல் உயிரின் மாத்திரையும், பெயரும், ஒன்று என்னும் எண்ணிக்கை யும் உயிரின் இயல்பாம்."
1431,"அ,க ஒரு மாத்திரை, அகரம் என்ற பெயர், ஒன்று என்ற எண் என்பன இவற்றில் உயிரின் இலக்கணமாம்."
1432,உரை உயிர்இயல் திரியாமை உயிரானது மெய்யொடு கூடி உயிர்மெய் ஆகிய காலத்தும் தன் மாத்திரையும் குறியும் எண்ணும் திரியாதிருத்தல்.
1433,"இள., நச்."
1434,"எடு உண்டி, உண்டனை."
1435,"அவை நட, வா, மடி, சீ, விடு, கூ, ஏ, வை, நொ, போ, வெள என வரும்."
1436,"எடு நிற்றி கொற்றா, உண்டனை கொற்றா."
1437,"முன்நின்றானைத் தொழிற்படுத்தும் உயிரீறுகள் வன்கணம் வரின் இயல்பாகப் புணர்வனவும், உறழ்ந்து முடிவனவும் உள."
1438,"எடு கொணா கொற்றா, எறி கொற்றா இயல்பு நட கொற்றா, நடக் கொற்றா உறழ்வு தொ."
1439,உரை உயிர்த்தொடர்க் குற்றியலுகரம் ஈற்றுக் குற்றியலுகரத்தை அடுத்த எழுத்து உயிர்மெய்யாக இருப்பின் அச்சொல்லீற்றுக் குற்றியலுகரம் உயிர்த்தொடர்க் குற்றியலுகரம் எனப்படும்.
1440,"அஃது அல்வழிக்கண் வன்கணம் மென்கணம், இடைக்கணம் இவை வருமொழி முதற்கண் வருமிடத்து இயல்பாகப் புணரும்."
1441,"எடு வரகு கதிர் வரகுகதிர், வரகின் கதிர் வெருகு கண் வெருக்குக்கண் எருது கால் எருத்துக்கால்."
1442,"சிறுபான்மை வேற்றுமைக்கண் இரட்டாமையும், அல்வழிக் கண் இரட்டுதலும், சிறுபான்மை இருவழியும் பிற ஒற்று இரட்டுதலும் உள."
1443,"எடு நாடு கிழவோன் எனவும், காட்டரண் எனவும், வெருக்குக்கண் எருத்துமாடு எனவும் முறையே காண்க."
1444,"உரை இருபெயரொட்டுப் பண்புத்தொகை வன்கணம் வரின் இனஒற்று மிக்கு வல்லெழுத்துப் பெறுதலும், இயல்புகணம் வருவழி இனஒற்று மிகுதலும் உள."
1445,வறடு ஆடு வறட்டாடு குருடு எருது குருட்டெருது.
1446,இவை இயல்புகணம் புணர்ந்தன.
1447,பகடு ஞாற்சி பகட்டுஞாற்சி முயிறு ஞாற்சி முயிற்றுஞாற்சி இவை இயல்புகணம் புணர்ந்தன.
1448,பிற ஈறுகளும் கொள்க. உருபுபுணர்ச்சி போல இன்சாரியை பெறுதலுமுண்டு.
1449,எடு வரகினை வரகின் கதிர் தொ.எ.
1450,உரை உயிர் மயங்கியல் இது தொல்காப்பிய எழுத்ததிகாரத்து ஏழாம் இயல்.
1451,புணர்ச்சி பற்றிய அகத்தோத்தின் முதல் இயல் இது.
1452,உயிர்மெய் உயிரும் மெய்யும் இணைந்து தோன்றும் சார்பெழுத்து உயிர் மெய்யாம்.
1453,பன்னிரண்டு உயிரும் பதினெட்டு மெய்யுடன் பொருந்த உயிர்மெய் யெழுத்துத் தோன்றும்.
1454,நச். உயிர்மெய் ஈறு உயிரீறே மொழிகளின் ஈற்றிலே நின்ற உயிர்மெய்யை உயிரீறு எனலாம் என்னை?
1455,மெய்யின் வழியது உயிர்தோன்று நிலையே தொ.நூன்.
1456,என்றார் ஆகலின்.
1457,உயிர்மெய் ஈறும் உயிரீற்று இயற்றே தொ.
1458,"என்பதனால், பிரித்தால் உடல் முன் உயிர் பின்னாம் ஆதலான் எனக் கொள்க."
1459,"அன்றியும், வாளும் கூடும் இருப்பின், வாளைக் கொடுவா என்னும் அத்துணை யல்லது, கூட்டைக் கொண்டுவா என்பது இல்லை."
1460,ஆதலான் இங்ஙனம் சொல்லப்பட்டது.
1461,உ ஊ ஒ ஓ ஓள என்பன பல எழுத்துக்கள் ஒரே இடத்தில் பிறப்பதற்கு எடுத்துக்காட்டு.
1462,எ.ஆ உயிர்மெய்யினைத் தனி ஓரெழுத்தாகக் கோடல் ஒற்றுமை நயம்.
1463,", , நச். எ.ஆ.பக்."
1464,"இனி, உயிர்மெய்யினை மெய்யெழுத்தாகக் கோடல் வேற்றுமை நயம் வல்லெழுத் தென்ப கசட தபற தொ."
1465,நச். இங்குக் ககரம் முதலிய உயிர்மெய்கள் ககரஒற்று முதலியவற்றைக் குறிப்பிடுதல் வேற்றுமை நயம்.
1466,உயிர்மெய்யினை ஓரெழுத்தாகக் கொண்டு மாத்திரை கோடல் ஒற்றுமை நயம்.
1467,அவ்விடத்து உயிர்மெய் உம்மைத்தொகைப் புறத்துப் பிறந்த அன்மொழித்தொகை.
1468,உயிர்மெய்யினை ஒலி பற்றி ஈரெழுத்தாக எண்ணுதல் வேற்றுமை நயம்.
1469,வேற்றுமை கொள்ளு மிடத்தே உயிர்மெய் உம்மைத்தொகையாம்.
1470,"உரை உயிர்மெய்க்கு மாத்திரை கொள்ளுங்கால், உப்பும் நீரும் போல ஒன்றேயாய் நிற்றல் ஒற்றுமைநயம்."
1471,அதனை வேறுபடுத்துக் கூறுங்கால் விரலும் விரலும் சேர நின்றாற்போல வேறாய் நிற்றல் வேற்றுமைநயம்.
1472,"உயிரும் மெய்யும் கூடுகின்ற கூட்டத்தினை எல்லா மெய்யும் என மெய்மேல் வைத்துக் கூறியது, அது முன்னர்க் கூறப்படுதல் நோக்கிப்போலும்."
1473,இங்ஙனம் வருதலான் உயிர் மெய் சார்பெழுத்து என முதலெழுத் தின் வேறாயிற்று.
1474,உயிர்மெய்க் குறில் நெடில்களை வல்லெழுத்து மெல்லெழுத்து இடையெழுத்து என்று குறிப்பிடுதல் இக் கருத்துப் பற்றியே.
1475,"ஆகவே, உயிர்மெய் என்பது ஒலிப்பு வகையால் உம்மைத்தொகை மாத்திரை கோடற்கண் உம்மைத் தொகை அன்மொழி என்க."
1476,"ஆகவே, உயிர்மெய்க்குறில் ஒரு மாத்திரையும், உயிர்மெய்நெடில் இரு மாத்திரையும் பெறும் என்பது."
1477,"ஒலிவகையான் உம்மைத் தொகையாகும் உயிர்மெய், மாத்திரை வகையான் உம்மைத் தொகைப் புறத்துப் பிறந்த அன்மொழித் தொகையாம்."
1478,எடு ஆலிலை ஆல்இலை அதனை அதுஅன்ஐ தொ.
1479,ஆதலின் உயிரளபெடை சார்பெழுத்தென உயிரின் வேறா யிற்று.
1480,ஒற்றளபெடை ஒருமாத்திரையாய் அலகு பெறுதலானும் பிறவாற்றானும் சார்பெழுத்து என ஒற்றின் வேறாயிற்று.
1481,சந்தனக்கோல் குறுகினால் பிரப்பங்கோலாகாது சந்தனக் கோலேயாம்.
1482,"அதுபோல, உயிரினது குறுக்கமும் உயிரேயாம் எனினும், புணர்ச்சி வேற்றுமையானும்."
1483,"பொருள் வேற்றுமை யானும், சீரும் தளையும் சிதையுமிடத்தே அலகுகாரியம் பெறாமையானும் குற்றிகரமும் குற்றுகரமும் சார்பெழுத்து என உயிரின் வேறாயின."
1484,"கை பை மை என்பனவும், கௌ வெள என்பனவும் பொருளைச் சுட்டியவழிக் குறுகும்."
1485,கால் மாத்திரையாக அளவு குறுகியொலிக்கும் மகரக்குறுக்க மும் சார்பெழுத்து என ஒற்றின் வேறாயிற்று.
1486,இவ்வாற்றான் உயிர்மெய் முதலாய ஒன்பதும் சார்பெழுத்து எனப்பட்டன.
1487,ஏனைய உயிர்மெய் முதலியன சார்பெழுத்து ஆகா.
1488,உடல்மேல் உயிர்வந்து ஒன்றுவது பொன்மணி போல இயல்புபுணர்ச்சியேயாம்.
1489,புணர்ச்சியில் மெய்யையும் உயிரையும் பிரித்துக் கொள்வர்.
1490,ஆதலின் கலப்பெழுத்தாகிய உயிர்மெய் சார்பெழுத்து ஆகாது.
1491,கால்மாத்திரை பெறும் வன்றொடர்க் குற்றியலுகரம் மாத்திரைக் குறுக்கம் பற்றித் தனியெழுத்தாகக் கொள்ளப்பட வில்லை.
1492,இவற்றை நோக்கச் சார்பெழுத்து மூன்றேயாம் என்பது.
1493,", உயிர்மெய் முதலியன சார்பெழுத்தாதல் சார்பெழுத்தென மூன்றே கொண்டார் தொல்காப்பியனார்."
1494,மயிலை. உயிர் மெய்யோடு இயைதல் உயிர்மெய் என்ற கலப்பெழுத்தை உண்டாக்க உயிரானது மெய்யொடு பொருந்தும்.
1495,அங்ஙனம் பொருந்தினும் அது தன் மாத்திரையும் பெயரும் எண்ணும் திரிந்து நில்லாது.
1496,"அ என்புழி நின்ற ஒரு மாத்திரையும், குறில் என்ற பெயரும், ஒன்று என்ற எண்ணும் க என்புழியும் ஒக்கும்."
1497,"உரை ஏனை உயிரோடு உருவு திரிந்து உயிர்த்தல் இள., நச்."
1498,உரை தொ.
1499,"என்னையெனில், இது தொகைவகைவிரிபடச் செய்கின்ற நூல் ஆகலானும், முதல்வினா எ, யா என்னும் பொருள் ஒப்புமையானும் என்பது."
1500,"இள., நச்."
1501,"ஆகவே, ஒலியின் குறுக்கம் நீட்டம் இவற்றைக் கொண்டே குறிலும் நெடிலும் தோன்றின."
1502,"எனவே, புணர்ச்சியிடத்துக் குறிலிணையை நெடிலாகக் கொள்ளலாம்."
1503,உயிர்மெய்க்கும் இஃது ஒக்கும்.
1504,உரை உயிரளபெடை எழுத்துப் பல ஆயின ஒலிவேற்றுமையானன்றே?
1505,சிவஞா. உயிரளபெடை உயிருள் நெட்டெழுத்து ஏழும் அளபெடுக்கும்.
1506,அவை அளபெடுக்கு மிடத்துத் தனிநிலை முதனிலை இடைநிலை இறுதிநிலை என்னும் நான்கனோடும் உறழ ஒ ஆம்.
1507,", . என்றாராகலின்."
1508,"வரலாறு ஆஅ, ஈஇ, ஊஉ, ஏஎ, ஐஇ, ஓஒ, ஒளஉ என்பன தனிநிலை அளபெடை."
1509,"பலாஅ, குரீஇ, கழுஉ, விலேஎ, விரைஇ, உலோஒ, அநௌஉ இவை இறுதிநிலை அளபெடை."
1510,பிறவும் அன்ன.
1511,"ஒரோ விடத்து நிலைமொழியினது ஈற்றில் நின்ற பதமாவது, உயிர் மெய்யாவது, உயிராவது, ஒற்றாவது அழிந்து புணரும்."
1512,இதனை யொட்டியே நன்னூல் விதிக்கும்.
1513,நிலைமொழியீறு கெட்டு முடிவது நேமிநாதத்தில் விளக்கப் பட்டுள்ளது.
1514,வருமாறு ஒருபது ஒன்று ழூ ஒருபதுஆன் ஒன்று ஒருபானொன்று நிலைமொழியில் பது என்ற பதத்தின் அது கெட்டது.
1515,வாழிய சாத்தா வாழிசாத்தா நிலை மொழி யில் யகர உயிர்மெய் கெட்டது.
1516,மரம்அடி ழூ மரஅடி மரவடி நிலை மொழியீற்று மகரமெய் கெட்டது.
1517,வகரம் உடம்படுமெய் நேமி.
1518,"விதி உயிரீறாவனமுன்னைய உயிரீறும் மெய்யீறும் ஒழிய உயிரீறாய் நிற்பனவும், யாதானுமோர் உயிர் இறுதிக்கண் தோன்றி நிற்பனவும் ஆம்."
1519,"வட்டக் கல், தாழக்கோல் அஃறிணைக்கண் விதி அகரஈறுகள் வலி மிக்கன."
1520,இவை அல்வழிப் புணர்ச்சி.
1521,"நம்பிப்பூ, ஆடூஉக் கை உயர்திணைக்கண் இயல்பு இகரஈறும் விதி உகரஈறும் வலி மிக்கன."
1522,"விளக்கோடு, கடுக்காய், ஆட்டுக்கால் அஃறிணைக்கண் இயல்பு அகர உகர ஈறும் விதிக் குற்றியலுகரஈறும் வலி மிக்கன."
1523,இவை வேற்றுமைப் புணர்ச்சி.
1524,"மற்றைச் சாதி, கடிக் கமலம், சொன்றிக் குழிசி, கங்கைக் கரை இடை உரி திசை வடசொற்களின் உயிரீறுகள் வலிமிக்கன."
1525,"நொக் கொற்றா, துக் கொற்றா உயிரீற்று ஏவல் முன் வலி மிக்கன."
1526,தலைமை பற்றி உயிரீற்றுப் புணரியல் என்ற விசேடணம் கொடுக்கப்பட்டது.
1527,இக் குறியீடு ஆ தீண்டு குற்றி என்பது போலத் தலைமை பற்றிய அடையடுத்து வந்தது.
1528,இது வேற்றுமைப் புணர்ச்சி.
1529,"எடு பலாக்காய், இலந்தைக்கனி வல்லெழுத்து மிக்கன."
1530,"விளங்காய், களங்கனி, மாங்கொம்பு, மாம்பழம் இனமெல்லெழுத்து மிக்கன."
1531,அகரம் தவிர்த்த ஏனைய உயிரெழுத்துக்கள் மெய் யொலிகளைச் சிறிது திரியச் செய்யும்.
1532,யாவும் அவற்றிற்குக் குறுமை நெடுமைகளைக் கற்பித்தலைச் செய்யும்.
1533,", ச."
1534,இவ்அகரம் எல்லா எழுத்துக்களுக்கும் மூலமாகவும் துணை யாகவும் அகநிலையில் எழுத்தாம்.
1535,அஃதாவது அகர ஒலியின் திரிபுகளே பல்வேறு எழுத்துக்களாகச் செவிப்புலனாம்.
