Line Number,Sentence
1,மேப்லித்தோ அளவு தெம்மி எழுத்து . புள்ளி பக்கம் படிகள் விலை உரு.
2,நூலாக்கம் டெலிபாய்ண்ட் சென்னை .
3,"அட்டை வடிவமைப்பு கா.பாத்திமா அச்சு வெங்கடேசுவரா ஆப்செட் பிரிண்டர் இராயப்பேட்டை, சென்னை ."
4,தொ.பே நூல்கிடைக்கும் இடம் தமிழ்மண் பதிப்பகம் தொ.பே .
5,பதிப்புரை இருபதாம் நூற்றாண்டு தமிழுக்கும் தமிழருக்கும் பெருமை சேர்த்த நூற்றாண்டாகும்.
6,இந் நூற்றாண்டில் தமிழுக்கு அருந் தொண்டாற்றியவர்கள் வரிசையில் அறிஞர் சாமி.
7,சிதம் பரனாரும் ஒருவர்.
8,தந்தை பெரியாரின் தலைமையில் கலப்புமணம் செய்து கொண்ட சீர்திருத்த முன்னோடி.
9,இவர் எழுதி வெளிவந்த நூல்கள் என்று அறிஞர்கள் பதிவில் காணப்படுகிறது.
10,கைக்குக் கிடைக்கப் பெறாத ஏனைய நூல்களைத் தேடியெடுத்து எதிர்வரும் ஆண்டில் வெளியிட முயலுவோம்.
11,தம் எழுதுகோலைப் பொழுதுபோக்குக்காகவோ பிழைப்புக் காகவோ கையாளாத தன்மானத் தமிழறிஞர்.
12,தம் எழுத்தை இலட்சிய நோக்குடன் தமிழர்களின் நலனுக்காக எழுதியவர்.
13,தனித்தமிழியக்கம் நீதிக்கட்சி திராவிடர் கழக ஈடுபாடு கொண்டவர்.
14,பன்முகப் படைப்பாளி.
15,புதிய பார்வையுடன் திருக்குறளின் அருமை பெருமைகளை ஆழ்ந்து அகழ்ந்து காட்டி யவர்.
16,"பட்டமும் பதவியும், செல்வமும் செல்வாக்கும், இளமை யும் அழகும், பொன்னும் பொருளும் மாந்த வாழ்வில் நிலையற்றது."
17,சிலப்பதிகாரம் அரசியல் புரட்சியை அறிவுறுத்த எழுந்த நூல்.
18,மணிமேகலை சமுதாயப் புரட்சியை அறிவுறுத்த எழுதப்பட்ட நூல்.
19,"ஐம்பெருங்காப்பியங்கள் புலவர்கள் போற்றும் பெருமைக்குரிய பழந்தமிழர் பண்பாட்டுச் செல்வங்கள், சாதி வேற்றுமையையும், பெண்ணடிமைத்தனத்தைக் கண்டித்தும்."
20,பிறப்பால் வேற்றுமைப் பாராட்டப்படும் கொடுமைகளுக்கு ஓங்கிக் குரலை கொடுத்தவர்.
21,முற்போக்கு இயக்கத்தின் முன்னணித் தலைவர் களில் ஒருவராய்த் திகழ்ந்தவர்.
22,புலமை மிக்க தமிழ் அறிஞராக இருந்தபோதும் அவர் பழைமைவாதி யாக இருக்கவில்லை.
23,சமுதாய மாற்றத்தையும் பரிணாம வளர்ச்சியையும் கணக்கில் கொண்டு தமிழ் இலக்கியத்தை ஆய்வு செய்தவர்.
24,பிற்போக்கு வாதிகளால் உருவாக்கி விடப்பட்ட பல கட்டுக் கதைகளையும் கற்பனைகளையும் இவருடைய கட்டுரைகள் தவிடுபொடியாக்கின.
25,என்று திரு.டி.செல்வராஜ் அவர்கள் இப்படி பதிவு செய்கிறார்.
26,"இவருடைய எழுத்துக்களில் ஆழ்ந்த சமூக அக்கறையும், தொலைநோக்குப் பார்வையும் படிந்து கிடக்கிறது."
27,பதிப்பகத்தார் உள்ளுறை குறுந்தொகைப் பெருஞ்செல்வம் பக்கத்து வீட்டுக்காரி வாழ்க!
28,என் நெஞ்சு நோகும் குற்றம் யார் மேல்?
29,காமம் என்பது ஒரு விருந்து பசலைக்கும் அறிவுண்டோ?
30,தலைவன் தவறு செய்திலன் காமத்திற்கு அறிவில்லை நினைத்தால் வராமல் இருப்பாரோ?
31,நீயும் ஆச்சு!
32,காதலன் மணந்து கொள்வான் தாய்க்குத் தலைவனைத் தெரியும் மலைக்காட்சியால் மனத்துயர் நீங்கினேன்.
33,ஆடவர் அன்பு பொய்ப்பருவம் கண்டு புலம்பாதே!
34,இரவெல்லாம் விழித்திருந்தேன் தாய் தனியாகக் தவிக்கட்டும் காம நோய்க்கு இதுவா மருந்து?
35,அவர் அன்பை நான் அறிவேன் பழிக்கு நாணும் பண்புடையோன் நன்றி மறப்பது நன்றாகுமா?
36,உலகமே கிடைத்தாலும் உன்னைக் கைவிடேன் இரவிலும் உறங்கேன் ஊருக்கு அஞ்சுவதால் என்ன பயன்?
37,உன் கொடுமை அதிகம் பழிச் சொல்லால் நன்மை தான் விளையும் என் கண்கள் தூங்கவில்லையே?
38,மாலைப் பொழுதும் துன்பமும் அங்கில்லையோ?
39,அரும் பொருளுக்காக அவர் பிரியார் உன் துன்பத்தை உரைத்தால் என்ன?
40,நமது இரகசியத்தை வெளியிட்டால் என்ன?
41,இந்த ஆற்றலை எப்படிப் பெற்றாள்?
42,அந்நாளில் அழகாக இருந்தன வருந்தேல்!
43,முல்லைகள் மலர்ந்தன பார்!
44,இதுவன்றோ கற்புடைமை அவன் வராமல் இருப்பதே நன்று காந்தள் செடியே என்னைக் காத்தது சினம் உறேல்!
45,வினவுகின்றேன் அன்புடையாளைப் பிரிதல் அறமோ?
46,அவள் சென்ற வழி இன்பந் தருக உன்னைக் காதலித்த தலைவன் எங்கே?
47,பனிப்பருவத்தில் என் செய்வோம் இன்பத்தின் பயன் துன்பமா?
48,"இது புது மழை, பருவ மழை அன்று வாக்குறுதியை மீறலாமா?"
49,உன் உறுதியை எப்படி நம்புவது?
50,அன்றுபோல் இன்றும் அன்பினர் மாலையை இப்பொழுதுதான் காண்கின்றேன் இரவை நீந்துவது எப்படி?
51,சிதம்பரனார் குறுந்தொகைப் பெருஞ்செல்வம் பாகம் பக்கத்து வீட்டுக்காரி வாழ்க!
52,பாட்டு தமக்கு நன்றி செய்தவரை என்றும் மறவாமலிருப்பது நல்லோர் இயல்பு.
53,செய்த நன்றியை மறப்பதைப் போலத் தீமை வேறொன்றும் இல்லை என்பர்.
54,பிறர் செய்த தீமையை உடனே மறந்துவிட வேண்டும் நன்றியை என்றும் மறக்கவே கூடாது என்பது தமிழர் நீதி.
55,வேறு எந்த நன்மைகளை மறந்தாலும் மறக்கலாம்.
56,ஆனால் பிறர் செய்த நன்மையை மட்டும் மறந்துவிடவே கூடாது.
57,வேறு எந்த நன்மைகளை மறந்தாலும் பிறர் செய்த நன்றியை மறந்தவர்கள் அத்தீமையிலிருந்து தப்பவே முடியாது.
58,இவ்வாறு நீதி நூல்கள் எல்லாம் முழங்குகின்றன.
59,"இத்தகைய சிறந்த நீதியை, அறத்தைப் பண்டைத் தமிழர்கள் பெரிதாகப் போற்றி வந்தனர்."
60,இத் தமிழர் பண்பை இக்காதற் செய்யுளிலும் காணலாம்.
61,தலைவனும் தலைவியும் மணம் புரிந்து கொண்டு இல்லறம் நடத்துகின்றனர்.
62,தோழி அவர்களுடைய மனை வாழ்க்கையைக் கண்டு மகிழ்வதற்காக வந்திருந்தாள்.
63,"காதலனும், காதலியும் கருத்தொருமித்து வாழ்வதைக் கண்டாள்."
64,"காதலி, தன் காதலன் மேல் காட்டுகின்ற அளவற்ற அன்பு முறையையும் பார்த்தாள்."
65,தோழியின் உள்ளத்திலே உவகையும் வியப்பும் தோன்றின.
66,நீ உன் காதலனை மணந்து கொள்ளும் வரையில் உன் காதலை எப்படித் தாங்கியிருந்தாய் என்று கேட்டாள் தோழி.
67,அதற்குத் தலைவி நான் என் காமநோயைப் பொறுத்துக் கொண்டிருந்ததற்குக் காரணம் பக்கத்து வீட்டுக்காரிதான்.
68,"அவள், உன் காதலன் உன்னை நாடி வருவது உறுதி."
69,அவன் உன்னை மணந்து கொள்ளுவது திண்ணம் என்று எனக்குக் கூறி என் துயரைத் தணித்தாள்.
70,அவள் இனிய உணவுகளை உண்டு இன்பமாக வாழ்க என்று கூறினாள்.
71,தலைவி இந்த நிகழ்ச்சியை உரைப்பதே இச்செய்யுள்.
72,நமது பக்கத்து வீட்டுத் தலைவி அமிழ்தத்தை அருந்தி இன்பமாக வாழ வேண்டும்.
73,"நீல நிறமுள்ள மெல்லிய சிறகுகளையும், கூர்மையான நகங்களையும் உடைய வவ்வால்கள் மாமரத்தை நாடிச் செல்லும்."
74,அம்மரத்தின் பால் கலந்தாற் போன்ற இனிய பழங்களைத் தெவிட்டும் வரையிலும் தின்னும்.
75,அதன்பின் அந்தத் தெவிட்டல் தீரப் புளிக்கின்ற நெல்லிக்கனிகளை உண்ணும்.
76,இவ்வாறு உண்ட மயக்கம் தீரப் பக்கத்திலே உள்ள முள் இல்லாத மூங்கிலிலே தொங்கிக் கொண்டு உறங்கும்.
77,இப்படிப்பட்ட மூங்கில்கள் உயர்ந்து வளர்ந்திருக்கின்ற மலையையுடைய நாடு அவனுடைய நாடு.
78,இதுவே இச்செய்யுளில் அமைந்திருக்கும் பொருள்.
79,தலைவி கூற்று.
80,பதவுரை நம் அயல் இல் ஆட்டி நமது பக்கத்து வீட்டின் தலைவி.
81,அமிழ்தம் உண்க இனிய அமிழ்தத்தை உண்டு வாழ்வாளாக.
82,"பால் கலப்பு அன்ன சர்க்கரையையும், பாலையும் கலந்தது போன்ற, தேம் கொக்கு அருந்துபு இனிய மாம்பழத்தைத் தின்று."
83,நீல மெல் சிறை நீல நிறமுள்ள மெல்லிய சிறகுகளையும்.
84,வள்உகிர் கூர்மை யான நகங்களையும் உடைய.
85,பறவை வவ்வால்கள்.
86,நெல்லி அம்புளி மாந்தி நெல்லியினது புளிப்புள்ள காயையும் தின்று.
87,அயலது பக்கத்தில் உள்ள.
88,முள் இல் அம்பணை முள் இல்லாத அழகிய பருத்த.
89,மூங்கில் தூங்கும் மூங்கிலிலே தொங்கிக் கொண்டிருக்கின்ற.
90,கழை நிவந்து ஓங்கிய மூங்கில்கள் உயர்ந்து வளர்ந்திருக்கின்ற.
91,சோலை சோலையோடு கூடிய.
92,மலை கெழு நாடனை மலைகள் நிறைந்த நாட்டையுடைய தலைவனைப் பற்றி.
93,வரும் என்றோள் ஏ அவன் மணந்து கொள்ள வருவான் நீ அஞ்சாதே வருந்தாதே என்று கூறினாள்.
94,கருத்து தலைவன் மணந்து கொள்ள வருவான் என்று எனக்கு உறுதி கூறிய அயல் வீட்டுத் தலைவி வாழ்க.
95,இச்செய்யுளின் ஆசிரியர் பெயர் தெரியவில்லை.
96,என் நெஞ்சு நோகும் பாட்டு பண்டைத் தமிழன் ஒரு வகையில் பெண்களை அடக்கித் தான் ஆண்டான்.
97,தன் விருப்பம்போல் பல பெண்களை மணந்து கொண்டான்.
98,இதைத் தவிரப் பரத்தையர் விலைமாதர் பொதுமகளிர் என்று சொல்லப்படும் பெண்களையும் நேசித்து வந்தான்.
99,இது பண்டைத் தமிழனுடைய வழக்கமாக இருந்தது.
100,ஆனால் அக்காலத்திலேயே பெண்கள் ஆண்களின் இவ் வழக்கத்தை வெறுத்தனர்.
101,ஒருவனைப் பற்றியிருத்தலே பெண்களின் கடமை கற்பு அறம் என்று கருதப்பட்டது.
102,ஆண்கள் மட்டும் இந்த அறத்திற்கு விரோதமாக நடந்து வந்தனர்.
103,அயினும் எந்தப் பெண்களும் தம் கணவன் பரத்தையர்பால் நேசங் கொண்டிருப் பதை விரும்பவில்லை.
104,அவனுடைய நடத்தையைக் கண்டிப்பார்கள்.
105,இது வழக்கமாக ஒவ்வொரு வீட்டிலும் நடந்து வந்தது.
106,இந்த வழக்கத்தை இச் செய்யுளால் காணலாம்.
107,தலைவன் பரத்தையர் வீட்டிலிருந்து திரும்பி வந்தான்.
108,நேரே மனைவியிடம் செல்ல அவன் நெஞ்சம் துணியவில்லை.
109,தன் செய்கை அவளுக்குக் கோபத்தை விளைவித்திருக்கும் என்பது அவனுக்குத் தெரியும்.
110,"ஆதலால், அவன் தலைவியின் தோழியிடம் நெருங்கினான்."
111,தலைவியின் சினத்தை ஆற்றித் தன்னுடன் சமாதானம் செய்து வைக்க வேண்டிக் கொண்டான்.
112,தோழியும் தலைவனுடைய இரங்கத்தக்க நிலையைக் கண்டாள்.
113,தலைவியிடம் சென்று தலைவனுடைய பரிதவிப்பை எடுத்துச் சொன்னாள்.
114,அவன் தனது குற்றத்தை ஒப்புக் கொள்ளு கின்றான் இனிமேல் இத்தகைய குற்றம் புரியமாட்டேன் என்று உறுதிமொழியுரைக்கின்றான்.
115,அவன் குற்றத்தை மன்னித்து அவனிடம் அன்பு காட்டவேண்டியது நமது கடமைதான் என்றாள்.
116,உடனே தலைவி அவர் இப்பொழுது முன்புபோல் இல்லை.
117,அவருடைய நடத்தை மாறிவிட்டது.
118,அவருடைய ஒழுக்கம் எனக்குத் துன்பத்தைத் தருகின்றது.
119,அவரை நான் எப்படி ஏற்றுக் கொள்ளுவேன்?
120,என்று கூறினாள்.
121,இந்த நிகழ்ச்சியைக் காட்டுவதுதான் இச்செய்யுள்.
122,"தோழியே, என் நெஞ்சம் அளவற்ற துக்கத்தால் ஆட்டி அலைக்கழிக்கின்றது."
123,அவருடைய நடத்தை எனக்குச் சிறிது கூடப் பிடிக்கவில்லை.
124,அவர் இவ்வளவு அன்பற்றவராக மாறிவிடுவார் என்று அப்பொழுது நான் நினைக்கவே யில்லை.
125,அவர் நெருஞ்சியைப் போன்றவர் என்று இப்பொழுதுதான் அறிந்து கொண்டேன்.
126,பின்னால் அதுவே முள்ளாக மாறி நாம் அடி வைக்கும்போது சுருக்கென்று தைக்கும்.
127,இதைப்போலவே நமக்கு முதலில் அன்புடன் மகிழ்ச்சி தந்த காதலர் இப்பொழுது துன்பஞ் செய்கின்றார்.
128,அவருடைய இத்தீய நடத்தையினால் என் மனம் மிகவும் வேதனையடை கின்றது.
129,இதுவே இச்செய்யுளில் அமைந்திருக்கும் பொருள்.
130,பதவுரை நோம் என் நெஞ்சே பெரிதும் வருந்தும் என்மனம்.
131,நோம் என் நெஞ்சே பெரிதும் வருந்தும் என் மனம்.
132,புன் புலத்து முல்லை நிலத்திலே.
133,அமன்ற முளைத்திருக்கின்ற.
134,சிறியிலை நெருஞ்சி சிறிய இலைகளையுடைய நெருஞ்சியின்.
135,கட்கு இன்புதுமலர் கண்ணுக்கு இனிமையான புதிய மலர்.
136,முள் பயந்து ஆங்கு பின்பு முள்ளைப் பெற்று நடப்பவரைத் துன்புறுத்து வதைப் போல.
137,இனிய செய்த முன்பு நமக்கு நன்மையைச் செய்த நம் காதலர் நமது அன்பர்.
138,இன்னா செய்தல் இப்பொழுது நமக்குத் துன்பம் செய்வதை நினைக்கும் போது.
139,நோம் என் நெஞ்சு மிகவும் வருந்துகின்றது எனது உள்ளம்.
140,கருத்து தலைவர் நடத்தை எனக்குத் துன்பந்தருவதால் என் மனம் வருந்துகின்றது.
141,விளக்கம் இது அள்ளூர் நன் முல்லை என்னும் புலவர் பாட்டு.
142,பரத்தையர் வீட்டுக்குப் போய் வந்த தலைவனுக்குத் தூதாக வந்த தோழியிடம் தலைவி சொல்லியது.
143,மருதத் திணை.
144,"பயந்தாஅங்கு அ, உயிர் அளபெடை."
145,ஏ அசைகள்.
146,நோம் நோகும் வருந்தும்.
147,புன்புலம் முல்லைநிலம்.
148,"ஒரு கணவன், தன் மனைவிக்குத் துன்பம் செய்தல், மற்றொருத்தியிடம் அன்பு காட்டுவதாகும்."
149,எந்த மனைவியும் மற்றொருத்தியிடம் அன்பு காட்டும் கணவனிடம் ஆத்திர மடையாமல் இருக்கமாட்டாள்.
150,இது பெண்ணின் இயல்பு.
151,குற்றம் யார் மேல்?
152,"பாட்டு ஒவ்வோர் ஆண்மகனும், தன் மனைவி தன் மேல் அன்புடன் இருக்க வேண்டும் என்றுதான் விரும்புவான்."
153,மனைவி இதற்கு எதிராக இருந்தால் அதற்குக் காரணம் அவள் மட்டும் அல்லள்.
154,பெரும்பாலும் கணவன்தான் காரணமாக இருப்பான்.
