Line Number,Sentence
3970,இம்மண்டபங்கள் மதிலுக்கு ஆதரவாக இருப்பதோடு மக்கள் உட்கார்ந்து இளைப்பாறவும் வசதியாக இருக்கின்றன.
3971,மதில்களின் மேல் அழகிய பூ வேலைப்பாடுகளும் காணப்படு கின்றன.
3972,இம்மதில்களிலே தான் பெரும்பாலான கல்வெட்டுகள் பொறிக்கப்பட்டுள்ளன.
3973,"இதில், கோயில் வரலாறும் நாட்டு வரலாறும் உள்ளன."
3974,இத் திருமதில்களைக் கட்டியவர்கள் அது என்றும் அழிந்து படாமல் பழுது பார்ப்பதற்காக நில தானஞ் செய்திருக்கின்றார்கள்.
3975,ஆதியில் அக நாழிகை மட்டும் கட்டப்பட்டு உள்ளே சிவலிங்கம் மட்டும் நிலைபெறச் செய்யப் பெற்றன.
3976,எந்த தெய்வத்திற்கும் ஆதியில் தனிக் கோயில் கட்டப்படவில்லை.
3977,பின்னால் திருஉண்ணாழிகையை அடுத்து உமா தேவித் தனி அக நாழிகை கட்டப்பட்டது.
3978,பின் திருச்சு மதில்கள் தோன்றியதால் ஒவ்வொரு மதிலுக்கும் நான்கு வாயில்கள் எழுந்தன.
3979,அந்த உட்சுற்று மதில்கள் ஒவ்வொன்றிற்கும் நான்கு கோபுரங்களை எழுப்பினர்.
3980,"எனவே மதுரை, திருவண்ணாமலை, சிதம்பரம், திருவரங்கம் முதலிய கோயில்களில் பல கோபுரங்கள் எழுந்தன."
3981,"மிகப் பெரிய கோபுரங்கள் மதுரை, திருவண்ணாமலை, சிதம்பரம், விருத்தாசலம், திருவில்லிப்புத்தூர், திருச்செந்தூர், இராமேச்சுவரம் முதலிய இடங்களில் உண்டு."
3982,கோபுரங்கள் ஏழு நிலைகள் உடையதாய் உயரே ஏறப் படிகள் அமைக்கப்பட்டிருக்கின்றன.
3983,ஒவ்வொரு நிலையிலும் பெரிய அறைகள் இருக்கின்றன.
3984,"ஒரு நிலையில் , பேர்கள் இருக்கத் தக்க அளவுகள் கொண்டது."
3985,சிதம்பரம் கோயில் பல மன்னர்களால் கட்டப்பட்டது.
3986,கீழக் கோபுரத்தைக் கோப்பெருஞ் சிங்கன் கட்டினான்.
3987,இங்கு தான் நூற்றெட்டு விதமான நடன வடிவங்கள் அமைக்கப்பட்டுள்ளன.
3988,திருச் சுற்றுகளில் உள்ள மண்டபங்களில் பிற்காலத்தில் பரிவார தேவர்கள் இடம் பெற்றன.
3989,பின்னர் பிரகாரத்தில் இவைகளுக்குத் தனித்தனிக் கோயில்கள் எழுந்தன.
3990,திருச்சுகளில் அறுபத்து மூன்று நாயன்மார்களும் நவக்கிரகங்களும் இடம் பெற்றன.
3991,நமது சாசனங்கள் பல திருவிளக்கு எரிக்க விடப்பட்ட ஆடுமாடுகளும் நஞ்சை புஞ்சைகளும் பொற்காசுகளுமாகவே காணப்படுகின்றன.
3992,இந்த அதிகாரம் எழுதத் துணையாய் இருந்த நூற்கள் .
3993,ஆலயங்களின் உட் பொருள் விளக்கம்.
3994,எனது எண்ணம் இருபத்தைந்து ஆண்டுகாலமாக ஈடேறவில்லை.
3995,நான் ஆம் ஆண்டிலிருந்து எழுத்தாளனாக ஆண்டுகட்கு மேலாக எழுத்துப் பணியாற்றி வருகின்றேன்.
3996,இல் இலங்கைக்கு பொருள் தேடச் சென்றேன்.
3997,"அங்கு போனதும் அறிஞர் ஆனந்தக் குமாரசாமி, இலங்கைத் தொல் பொருள் ஆய்வு துணை ஆணையாளர் சு."
3998,"சண்முகநாதன், கலைப்புலவர்கள் நவரத்தினம், புலவர் கே."
3999,கணேஷ்தலத்துயா டாக்டர் தனிநாயக் அடிகள் போன்றோர் நட்பைப் பெற்றேன்.
4000,இவர்கள் நட்பு எனது வாழ்க்கையின் ஒரு திருப்புமையமாய் விட்டது.
4001,"பழங்காசுகள் சேகரிக்கமுற்பட்டேன், நவமணிகளைச் சேகரித்தேன், சிப்பி சங்குகள் சேகரித்தேன், அணிகலன்கள், விளக்குகள், இசைக் கருவிகள் சேகரித்துச் சிறப்புப் பெற்றேன்."
4002,"அப்பால், ."
4003,"திருவிளக்கு, ."
4004,"வெண்கலப் படிமங்கள், ."
4005,"தமிழர் பண்பாட்டில் தாமரை, ."
4006,"மலர்கள், ."
4007,"தமிழ்நாட்டு ஓவியங்கள், ."
4008,"தமிழ்நாட்டுக் கப்பல்கள், ."
4009,"தமிழ்நாட்டுச் சிப்பி, சங்குகள், ."
4010,"தமிழ்நாட்டு இசைக்கருவிகள், ."
4011,"தமிழ்நாட்டு அணிகலன்கள், ."
4012,"தமிழ்நாட்டுப்படைக்கலன்கள், ."
4013,"தமிழர் இசை, ."
4014,"தமிழகச் சாவகக் கலைத் தொடர்புகள், ."
4015,"தமிழக மேற்காசிய இனத்தொடர்புகள், ."
4016,"தமிழ் இசை அகராதி, ."
4017,"தமிழர்களின் ஆடைகள், ."
4018,"சிந்துவெளிச் சைவ வேளாளர் பண்பாடு, ."
4019,"தமிழர்களின் கலைகளும் கைப்பணி களும், ."
4020,"தமிழர் நாடகம், ."
4021,"தமிழ்நாட்டியம், ."
4022,இசையும் யாழும் தமிழ்நாட்டுக் காசுகள் என்று பல நூல்களை எழுதிக் குவித்தேன்.
4023,சில சிங்கப்பூர் தமிழ்முரசு என்னும் நாள் ஏட்டில் தொடர் கட்டுரைகளாக வெளிவந்தன.
4024,சில நூல் வடிவில் வெளிவந்து அறிஞர்கள் பாராட்டைப் பெற்றன.
4025,"திருவிளக்கு, தமிழர் பண்பாட்டில்தாமரை, தமிழகச் சாவகக் கலைத் தொடர்புகள் என்ற நூற்கள் தமிழக அரசின் பாராட்டையும் பரிசையும் பெற்றன."
4026,தமிழர் பண்பாட்டில் தாமரை என்ற நூல் மதுரைப் பல்கலைக் கழகத்தில் பி.
4027,"., பி."
4028,எ.சி வகுப்புகளுக்கு ஆம் ஆண்டில் பாடப் புத்தகமாக அங்கீகரிக்கப்பட்டது.
4029,என்றாலும் கோயிலைப்பற்றி நான் நூல் எழுதத் தொடங்க வில்லை.
4030,ஒன்றிரண்டு முறை சிலபக்கங்கள் எழுதி அவற்றைத் தவறவிட்டதும் உண்டு.
4031,படித்துப் பார்த்தேன்.
4032,கட்டுரை வரைந்த அறிஞர் கோந்ரோத் அவர்கள் தெளிந்த ஆய்வுடன் எழுதியிருப்பினும் உறுதியாக அவரது எழுத்துக்கள் புலப்பட வில்லை.
4033,தமிழில் மொழியாக்கம் செய்தவர் வேண்டும் என்றே பல பகுதிகளை மொழியாக்கம் செய்யாது விட்டுவிட்டார்.
4034,என்றாலும் ஆங்கிலக் கட்டுரையைப் படித்து ஓரளவு நிறைவு கொண்டேன்.
4035,நூல் எழுதுவதற்கு வேண்டிய நிழற்படங்களும் வரைபடங்களும் என்னிடம் இருந்தன.
4036,எழுதவும் தொடங்கினேன்.
4037,ஆனால் எதிர்பாராது வேறு வேலைகள் எழுந்ததால் எழுதி முடிக்கமுடியாமற் போய்விட்டது.
4038,மீண்டும் ஆம் ஆண்டு இறுதியில் திருக்கோயில் என்னும் நூலை தொடர்ந்து எழுதத் தொடங்கினேன்.
4039,"எனது சிந்தனையும், ஆய்வின் போக்கும் அறிவும் மாறிவிட்டதால் முன் எழுதியவற்றை எழுதியும் மாற்றியும் விரிவாக எழுதத் தொடங்கினேன்."
4040,முன்னர் எழுதிய பக்கங்களை மாற்றியும் திருத்தியும் புதிதாக எழுதுவதற்கு இரண்டு திங்கள் சென்றன.
4041,காரணம் முன்போல் விரைவாக எழுத என் உடல் நிலை இடங்கொடுக்கவில்லை.
4042,ஏனெனில் எனக்கு வயது நடந்து கொண்டிருக்கிறது.
4043,"கோயில்களைப் பற்றிப்படிக்குந்தோறும் படிக்குந்தோறும், எனக்கு ஆக்கம் அரும்புகின்றது."
4044,ஆம் ஆண்டில் சுப்ரீம் கோர்ட்டில் உயர்நீதிமன்றத்தில் தமிழக அரசின் பெரிய வழக்குறைஞர் அட்வக்கேட் செனரல் திரு.
4045,"எனவேதான் ஆத்திரத்தோடும், ஆர்வத்தோடும், அபிமானத் தோடும் ஊக்கத்தோடும் உண்மை உணர்வோடும் இந்நூலை எழுத முன்வந்துள்ளேன்."
4046,எனவே இந்நூல் அச்சிட்டு வெளிவந்தாலும் சரி வராவிடினும் சரி எழுதி முடிப்பது எனது கடமை என்று எழுதி முடித்துள்ளேன்.
4047,"இந்நூலை எழுதி, விற்றுப் பணம் சேகரிக்கவேண்டும் என்ற எண்ணம் எனக்கு எள்ளளவும் இல்லை."
4048,இதற்கு முன்பு சில நூல்கள் எழுதி சில வெளியீட்டாளர் மூலம் வெளிவரச் செய்துள்ளேன்.
4049,மூன்று நூற்கள் நானே எழுதி வெளியிட்டுமுள்ளேன்.
4050,அவைகளில் கிடைத்த ஊதியம் மிகச்சொற்பம்.
4051,அவைகள் எழுதி முடிக்க நான் செலவிட்டதொகையில் பாதிகூட எனக்கு வரவில்லை.
4052,இந்த நூல்களை எழுதிமுடிக்க எனது இல்லத்தில் இருபதாயிரத்துக்கு மேல் செலவிட்டு ஒரு நூலகம் அமைத்துள்ளேன்.
4053,நூல்கள் எழுதி விற்று செலவில் பாதியையேனும் பெறமுடியாத நிலையில் என் போன்ற எழுத்தாளர் தமிழகத்தில் பலர் உளர்.
4054,"இஃதின்றி, பக்தி கொண்டும் தியாக உணர்ச்சியோடும் இந்நூலை எழுத நான் முன்வரவுமில்லை."
4055,"இந்நூலில், எங்கும் எனது கொள்கைகளை, அரசியல் கருத்துக்களையோ புகுத்த எண்ணியதே இல்லை."
4056,பெரியார் ஜி.யு.
4057,அதோடு எவ்.
4058,கிரேவ்லி ..
4059,. எழுதிய இந்தியக் கோயில் கட்டிடக் கலையின் பொதுக் கோட்பாடுகள் எய்ச்.
4060,ஆர் ஹேவல் ..
4061,எழுதிய இந்தியக் கட்டிடக் கலை பெர்கூசன் .
4062,அதற்காக அவர்களைத் தமிழன் இன்றும் என்றும் பாராட்டக்கடமைப் பட்டுள்ளான்.
4063,"நம்மால் உயர்ந்த நூல்களைப் படைக்கத்தக்க அறிவும் ஆற்றலும் பண்பும், பாங்கும், சூழ்நிலையும், திறமான மொழியும் உண்டு."
4064,ஆனால் இத்துறையில் ஈடுபடாது சிந்தனையைச் செலுத்தாது இருந்துவிட்டோம்.
4065,இது தமிழ் இனத்திற்கு மாறா இழுக்காகும்.
4066,ஆனால் இந்த வாய்ப்பு இன்னும் எத்தனை ஆண்டில் கிட்டுமோ அறியேன்?
4067,தமிழர் வாழும் இந்த மாநாடு கோடானு கோடி ஆண்டுகளாய்த் தோன்றி மாற்றம் எய்து வருகின்றது.
4068,கோடி ஆண்டுகளுக்குமுன் கோண்ட்வானா என்னும் கண்டமாக இருந்தது.
4069,அப்பால் கோண்ட்வானா அழிந்து சிதைந்தபின் லெமூரியா என்னும் கண்டம் தோன்றியது.
4070,இலெமூரியாவில்தான் குரங்கு மனிதத் தன்மையை அடைந்து இன்றைய மனித இனமாக மாறுதல் அடைந்தது என்ற உண்மையை உலகம் ஏற்றது.
4071,சிலர் குமரி தொட்டு இமயம் வரை அசாம் தொட்டு இந்து குஷ் வரை பரவி நின்றனர்.
4072,அப்பால் அவர்கள் வாழ்ந்த நாட்டின் பெரும்பகுதியைக் கடல் விழுங்கிவிட்டது என்று தமிழ் இலக்கியங்கள் கூறுகின்றன.
4073,கடல் கொண்ட தமிழகம் மனிதவர்க்கத்தின் தொட்டில்.
4074,இதிலிருந்து பழமையான நாகரிகுங்கள் பல திராவிட மொழி பேசும் மக்களுடன் தொடர்பு கொண்டுள்ளது தெரிய வருகிறது.
4075,"பேராசிரியர் எர்னட் ஹெக்கல் டாக்டர் லாங்டன், எய்ச்."
4076,"ஆர் ஹண்டர், ஹால், பண்டேகார் போன்ற அறிஞர்கள் பலரும் கொண்ட முடிபு இதுவே யாகும்."
4077,மக்கள் முதலில் தோன்றி உலகின் நான்கு பகுதிகளுக்கும் சென்று குடியேறிய மக்கள் குளத்தின் தாயகம் தென் இந்தியாவே யாகும்.
4078,கிழக்குக் கரைகளில் மக்களின் என்பு முதலிய சின்னங்கள் கண்டெடுக்கப் பட்டுள்ளன.
4079,அவை இத்துணைகாலத்திற்கு முற்பட்டனவென்று கூறமுடியாத பழமை வாய்ந்தனவாகும்.
4080,"அமெரிக்கா எகிப்து இந்தியா போன்ற நாடுகளிலுள்ள கோயிற்கட்டிடங்களிற் காணப்படும் அணிகள், கொத்து வேலைப்பாடுகளும் ஒரே வகையின."
4081,சுவரில் எழுதப்பட்டுள்ள சித்திரங்கள் சிலவும் ஒரே வகையின.
4082,"அமெரிக்க மக்களிடையே, தம்முன்னோர் ஞாயிறு உதயமாகும் நாட்டினின்றும் வந்தார்கள் என்னும் பழைய நம்பிக்கை உண்டு."
4083,சுமேரியரின் உடற்கூறு முதலியன அவர்களைச் சூழ இருந்த மக்கள் குலத்தைவிட வேறுபாடு உடையனவாய் இருந்தனர்.
4084,"அவ்வாறே அவர்கள் மொழியும், செமிட்டியர் அல்லது ஆரியர் அல்லது மற்றவர்களுடைய மொழிகளோடு சம்மந்தம் இல்லாமல் இருந்தது."
4085,அவர்கள் திட்டவட்டமாக இந்தியரின் இனத்தைச் சேர்ந்தவர்கள்.
4086,பொதுவாகத் தற்கால இந்தியனின் முகவெட்டு இற்றைக்கு ஆயிரக் கணக்கான ஆண்டுகளுக்கு முன்னிருந்த திராவிட இனத்தின் முன்னோர்களின் வடிவை ஒத்திருக்கின்றது.
4087,இன்று தெக்காணத்தில் திராவிட மொழிகளைப் பேசுகின்ற இந்தியரை சுமேரியர் முற்றிலும் ஒத்தவர்களாகக் காணப்படுகின்றன.
4088,இந்தியாவிலேயே அவர்களின் நாகரிகம் வளர்ச்சி யுற்றது.
4089,அங்கே அவர்கள் எழுதும் முறையை அறிந்திருத்தல்கூடும்.
4090,முதல் ஓவிய முறையாகவும் அதிலிருந்து இலகுவாகவும் சுருக்கமாக வும் எழுதும் முறையை அவர்கள் பயின்றனர்.
4091,அவர்கள் பாபிலோன் நாட்டை அடைந்தபோது சதுரமான எழுது கோலினால் மிருதுவான களிமண்ணில் எழுதி வந்தார்கள்.
4092,இதனால் எழுத்துக்கள் கூர்நுதி வடிவினவாகக் காணப்பட்டன.
4093,மக்கள் முதலில் நாகரிகம் அடைந்தவிடம் இந்தியா என்பதில் சிறிதும் சந்தேகம் இல்லை.
4094,இந்திய நாகரிகம் ஆரியருக்கு முற்பட்டது.
4095,ஆகவே இந்திய நாகரிகம் என்பது ஆரியருடையது அன்று.
4096,அங்கு உழுது பயிரிட்டு தானிய மணிகளை மலைமலையாகக் குவித்தனர்.
4097,கைப்பணிப் பொருட்களை வண்ணந்தீட்டி செய்து எங்கும் பரப்பினர்.
4098,காடுகளை வெட்டித்திருத்தி வீடுகள் கட்டி சிற்றூர் களும் நகரங்களும் ஆட்சி முறைகளும் அமைத்தனர்.
4099,எங்கும் சிறு குடிசைகளும் பெரிய இல்லங்களும் மாளிகை களும் கோயில்களும் பள்ளிகளும் கட்டினர்.
4100,இசைக் கருவிகளும் படைக்கலன்களும் அமைத்தனர்.
4101,"தமிழர் குடியேறிய இடமெல்லாம் நகரங்களும் பட்டினங் களும், பாக்கங்களும் எழுந்தன."
4102,"தோணிகளும், அம்பிகளும் மரக்கலன்களும் பெருகின."
4103,கடல் வணிகம் வளர்ந்தது.
4104,மக்கள் கட்டிடக் கலையில் நல்ல நிபுணர்களாய் விளங்கினர்.
4105,எகிப்தில் கி.மு.
4106,"ஆம் ஆண்டிற்கு முன் கட்டிடக்கலை மட்டுமின்றி இசை அறிவும், வானநூற்புலமையும், மருத்துவக்கலையும், ஆடற்கலையும், நாகரிகமும் சிறப்புற்றோங்கி இருந்தன."
4107,"பண்டைய எகிப்திய நாட்டினின்றே கட்டிடக் கலை அறிவும், வானநூற்புலமையும், இசை நுணுக்கமும் மேனாட்டிற்குச் சென்றன."
