Line Number,Sentence
3029,"கூறுகளெல்லாம் இயல்புடையனவாயின், அவற்றுள் எதை எடுத்து இயம்பினா லென்ன?"
3030,சிறியதைச் சிறப்பித்தால் பெரியதன் மாண்பு தானே விளங்கும்.
3031,வறுமையால் பீடிக்கப்பட்ட ஒருவன் பசிக் கொடுமை யால் வதைகிறான்.
3032,"இவ்வாறு வயிறார உணவு கிடைக்கும் நிலை அவனுக்கு நேர்ந்ததும், அவனது நெஞ்சம் எதை வேட்கும்?"
3033,சுவையுணவை யன்றோ?
3034,பின்னே பிறவற்றை வேட்கும்.
3035,இதே போல உலகமும் படிப்படியே ஒவ்வொரு துறையில் தனது வேட்கையைப் பெருக்கிச் செல்லும்.
3036,"வான் பொய்த்து, மண் வறண்டு, உயிர்கள் வருந்தும் போது, உயிர்கள் எதை நோக்கும்?"
3037,என்ன நினைக்கும்?
3038,உயிர்கள் வானை நோக்கும் துளியாதல் வீழாதா?
3039,பூமி நனையாதா என்று நினைக்கும்.
3040,சிறியதினின்றும் பெரியதிற் செல்வது உலக இயற்கை.
3041,இவ்வியற்கை பற்றி ஆசிரியர் மழை நிலையை விரிக்கிறார்.
3042,இங்கே துளி என்றார் பின்னே புயல் என்கிறார்.
3043,மழைத்துளிக்கும் ஒருவிதத் தனிச் சிறப்புண்டு.
3044,அச்சிறப்புப் பெருமழைக்குமில்லை.
3045,புல் உள்ளிட்ட தாவர வர்க்கத்துக்கு மழைத்துளி உணவாவதுபோலப் பெரு மழையும் ஆவதில்லை.
3046,பெரு மழை மண்ணில் நின்றும் ஊறியும் தாவரத்தின் வேர் வழிப் பெரிதும் சத்தூட்டும்.
3047,"மழைத்துளி தாவரத்தின் இதழ், கணு, நரம்பு முதலியவற்றில் நிலவி நல்லுணவூட்டும்."
3048,"மழைத்துளி வீழ்வதால் தாவர வர்க்கம் செழிப்புறலும், அத்துளி வீழாதொழியின் புல்லுந் தோற்றமுறாமையுஞ் சொல்லப்பட்டன."
3049,"மழைத்துளியால் விளையும் நலனும், அஃதின்மையால் விளையுங்கேடும் உணர்த்தப்பட்டன."
3050,"மழை யின் மாண்பை உடன்பாட்டானும், எதிர்மறையானும் விளக்கிய வாறு காண்க."
3051,மற்றாங்கே மற்று வினைமாற்று வீழாதாயின் என்னும் பொருளின் மேலது அசையாகக் கொள்வோருமுளர்.
3052,ஆங்கே அப்பொழுதே வனப்புறக் கொள்வன நாடி அணிந்தனள் ஆங்கே கலித்தொகை அவ்விடத்து என்பர் மணக்குடவர்.
3053,மழைத்துளி வீழ்ந்ததும் புல் பச்சைப் பசேலெனத் தலை காட்டலால் ஆங்கே அப்பொழுதே என்றார்.
3054,பசும்புற்றலை காண்பரிது பசும்புல் பசிய புல் இளம்புல் என்னலுமாம்.
3055,புல் தாவர வர்க்கத்தை உணர்த்துவது.
3056,தலை தலையையும்.
3057,உம்மை இழிவு சிறப்பு இங்கே தொக்கது.
3058,காண்பு காண்டல்.
3059,தலை காண்பு முளைத்தல்.
3060,அரிது இன்மைப் பொருளின்மேலது.
3061,"பசும்புல் மழைத்துளி வீழ்ந்ததும் தலைகாட்டுந் தாவரம் பசும்புல் ஆதலின், பசும் புல் என்றார்."
3062,மழைத் துளி என்றதற்கேற்பப் பசும் புல் என்றார்.
3063,மழை நிலைகளில் சிறியது துளி.
3064,தாவரத்தில் சிறியது புல்.
3065,புல் என்னுஞ் சொல்லே சிறுமைப் பொருளு டையது.
3066,வெறும் புல் என்னாது பசும் புல் என்றார்.
3067,மழைத்துளியால் புல் பசுமையுற்றெழலா னென்க.
3068,பசுமை மழையின் சத்து.
3069,மழைக்கவின் றெழுந்த வார்கொண்மணிநிற அறுகை சிந்தாமணி .
3070,"தலை காண்பு விண்ணின்று பொய்க்கும்போது, உயிர்களைப் பசி நின்று உடற்றும்."
3071,அவ்வேளையில் உயிர்கள் மழைத்துளியை யாதல் வேட்டு நிற்கும்.
3072,துளி வீழ்ந்ததும் பூமியின் புகை தணியும் புல் தலைகாட்டும்.
3073,பசியால் வருந்தும் உயிர்கள் புல்லின் தலை கண்டதும் மகிழ்ச்சியுறும்.
3074,பசும் புல் தலை காண்பு.
3075,"மேலும் மேலும் மழை யின் வருகைக்கு நற்குறியாதலின், அதன் காட்சி உயிர்கட்கு மகிழ்வூட்டுதல் இயல்பு."
3076,"உயிர்களுள் மகிழ்ச்சி காண்பு, ஈண்டுப் பசும் புல் தலை காண்பு என்னப்பட்டது."
3077,பசும்புல்லின் எழுச்சி கண்ணைக் கவர்கிறது.
3078,என்னே மழைத் துளியின் மாண்பு!
3079,சிறு பொழுதில் பூமியை நனைத்துப் புல்லை அரும்பச் செய்தல் எவரால் இயலும்?
3080,பின்னே துளி தூறலாய்த் தூறல் பெரு மழையாய் விடாமழையாய்ப் பொழியும்.
3081,தாவரமெல்லாந் தளிர்க்கும் தழைக்கும் செழிக்கும் வளங்கொழிக்கும்.
3082,"மழைத் துளி வீழா தொழியின், சிறுமைப் புல்லுந் தலைகாட்டுங்கொல்?"
3083,இதனால் அரிது என்றார்.
3084,தாவர மாண்பு தாவரத்தின் நலம் மற்ற உயிர்களின் நலமுமாகும்.
3085,அதன் கேடும் அவ்வுயிர்களின் கேடாகும்.
3086,தாவர வர்க்க வாழ்வுக்கும் மற்ற உயிர்களின் வாழ்வுக்கும் நெருங்கிய தொடர்பு உண்டு.
3087,ஒன்றை ஒன்றைப் பொறுத்தே இரண்டின் வாழ்வும் இயங்கல் வேண்டும்.
3088,ஒன்றின்றி ஒன்று வாழ்தல் இயலாது.
3089,இது பொதுமுறை.
3090,உயிர்களின் வாழ்வு தாவர வர்க்கத்தைப் பெரிதும் பொறுத்திருக்கிறது.
3091,"தாவர வர்க்கத்தில் மண்ணிலுள்ள இரும்பு முதலியவற்றின் சத்துக்களும், ஞாயிறு உமிழும் ஒளிச்சத்தும், பிறவும் அடங்கியிருக்கின்றன."
3092,சத்துக்களெல்லாம் மழைத்துளி இல்வழி ஆக்கம் பெறா.
3093,தாவர வர்க்கத்தைச் செழிப்பிக்கும் ஆற்றல் மழை நீர்க்குப் பெரிதுமுண்டு.
3094,இத்தகைய ஆற்றல் வாய்ந்த மழையின் சிறப்பை என்னென்று கூறுவது?
3095,இவ்வதிகாரத்தில் வான் சிறப்பை ஆசிரியர் எவ்வெவ்விதமாக விளக்கிச் செல்கிறாரென்பது உன்னற்பாலது.
3096,"முற்பாட்டில் விண்ணின்று பொய்த்தாலும், உயிர்களைப் பசி நின்று உடற்றலுஞ் சொல்லப்பட்டன."
3097,"இப்பாட்டில் விசும்பிற்றுளி வீழ்தலும், பசும்புற்றிலை காண்டலுஞ் சொல்லப் பட்டன."
3098,வரும் பாட்டில் மழை வாரியையும் உழவையுங் காண்க.
3099,மழையால் நலம் வளர்தலை உற்று நோக்குக.
3100,கருத்து உழவுக்கு மழை வேண்டும்.
3101,விருத்தி முன்னைப் பாட்டில் மழைத்துளி வீழ்தலும் பசும்புல் தலைகாட்டலுஞ் சொல்லப்பட்டன.
3102,இப்பாட்டில் மழை வாரியும் ஏருழவுஞ் சொல்லப்பட்டன.
3103,துளிப்பெருக்கு வாரியால் தோன்றும்.
3104,பசும்புற் காட்சி உழவரை ஏர் கட்டத் தூண்டும்.
3105,குன்றியக் காலென்பது குறைந்து நின்றது என்பது அவர்தம் குறிப்புரை.
3106,புயலாகிய வாரியின் வளங்குறைந்த காலத்து என்பது மணக்குடவர் உரை.
3107,புயலென்னும் வாரி புயல் மழை.
3108,புயற் புனிறு போகிய பூமலி புறவின் மலைபடுகடாம் .
3109,மாமேகம் பெய்த கொழும்புயல் சிந்தாமணி .
3110,வியன்மூவுலகு புயல் மேகம்போல் திருமேனி என்பது ஆழ்வார் திருவாக்கு.
3111,"புயல் காற்று, இடி, மேகம், மழை முதலியவற்றிற்கு வழங்கப்படும் ஒருசொல்."
3112,இவை சேர்ந்ததன் பயன் மழையே.
3113,"வாரி வருவாய் நீர், வெள்ளம் என்னும் பொருளுங் கூறலாம்."
3114,கடலும் வெள்ளமும் பகுதியும் விளைவும் சுற்றும் கதவும் வருவாயும் நீரும் வட்டையும் மதிலும் வாரியாமே பிங்கலந்தை .
3115,என்னும் என்பதில் பாடபேதமிருத்தல் வேண்டுமென்று தோன்றுகிறது.
3116,புயலென்னும் வாரி மழையென்னும் வருவாய் மழைநீர் என்றபடி.
3117,"வளத்துக்கு வருவாய் என்னும் பொருள் கொள்ளுங்கால், வாரிக்கு நீர் என்று பொருள் கொள்ளுதல் வேண்டும்."
3118,மழைநீரின் வருவாய் என்று கொள்க.
3119,குன்றிய குறைந்த அழிந்துபட்ட எனினுமாம்.
3120,கால் காலம் பொழுது.
3121,குன்றிக்கால் குன்றியக்கால் காலீறு பெற்ற வினையெச்ச மாகக் கொண்டு குன்றின் என்று பொருள் கூறினர் பரிமேலழகர்.
3122,"மணக்குடவர், குன்றிய என்பதைப் பெயரெச்சமாகவும், கால் காலம் என்பதைப் பெயராகவுங் கொண்டு குறைந்த காலத்து என்று பொருள் கூறினர்."
3123,உழவர் ஏரின் உழாஅர் உழவர் நிலத்தை உழுவோர் நிலத்தில் உழைப்போர்.
3124,"உழவு, உழப்பு, உழக்கு இவற்றின் ஒருமைப்பாட்டை நோக்குக."
3125,சீயமன்னான் இம்மையும் வனப்பும் ஏரும் சிந்தாமணி .
3126,வாழ்வுக்கு எழுச்சி பொலிவு ஊட்டுவது என்பது கருத்து.
3127,இக்கருத்தை உள்ளுறையாக் கொண்டது ஏர்.
3128,உழவன் ஏர் பூட்டுதலைக் காணும் உலகம் எழுச்சியும் பொலிவும் உறுவது இயல்பு.
3129,"உழா அர் அளபெடை, உழமாட்டார் மாட்டார் என்னும் உறுதியை உணர்த்துவது."
3130,உழவு உழைப்பு நல்லுடலுடையார் மனம் சாம்பிக் கிடவாது.
3131,அதன் கண் கிண்டுதல் இயல்பாக நிகழும்.
3132,கிண்டுதலினின்றும் எழுச்சி பிறக்கும்.
3133,எழுச்சியே ஊக்கம் என்பது.
3134,ஊக்கம் பலதிற முயற்சியாகும்.
3135,முயற்சிக்கு அடிப்படை உள்ளக் கிண்டுதல்.
3136,"கிண்டல், கிளறல், கிளைத்தல் இவையாவும் ஒரு பொருட்சொற்கள்."
3137,உழவு உழப்பு இரண்டும் ஒன்றே.
3138,இதனின்றும் வந்தது உழைப்பு.
3139,ஏர் உழவு உழவு என்பது பொதுவாக முயற்சிகளெல்லாவற்றையும் உணர்த்துவது சிறப்பாக ஏர் கொண்டு நிலத்தை உழுதலைக் குறிப்பது.
3140,முயற்சிகளுள் உயிராயது தலையாயது உழவாதலின் என்க.
3141,திருக்குறள் உழவு அதிகாரம் பார்க்க.
3142,பிறவுழவுகளை நீக்கி ஏரால் நிலத்தை உழுதலைக் குறிக்க வேண்டி ஏரான் என்றார்.
3143,"உழவு மழை கேணி, ஏரி, ஆறு முதலியன இருக்கின்றன."
3144,"இவைகளிற் சில மழை நீராலும், சில ஊற்று நீராலும், சில இரண்டாலும் நிரம்புதலுண்டு."
3145,"மழை நெடுங்காலம் பெய்யாதொழியின், ஊற்று நீரும் அற்றுப்போகும்."
3146,"எனவே, எல்லாவற்றிற்கும் வேண்டற் பாலது மழை நீரே யாகும்."
3147,"கேணி, ஏரி, ஆறு முதலியவற்றில் எஞ்சி நிற்கும் நீரை நம்பியும், ஊற்றை நம்பியும் உழவர் ஏர் கட்டப் புகார்."
3148,மழையின் வருவாய் கண்டே அன்னார் ஏர் கட்டுவர்.
3149,இக்கருத்து இக்குறட்பாவில் திகழ்தல் காண்க.
3150,வரவு செலவு என்னும் வழக்காற்றை என்னுக.
3151,வரவின்றிச் செலவு செய்தல் இயலாது.
3152,செலவுக்குத் தக்க வரவு வேண்டும்.
3153,ஒருமுறை மழை பெய்கிறது.
3154,நீர்நிலைகள் நிரம்புகின்றன.
3155,அவற்றிலுள்ள நிர் செலவாகிறது.
3156,செலவுக்கு வருவாய் வேண்டுமன்றோ?
3157,வருவாயின் வளங் குன்றினால் உழவர் எங்ஙனம் ஏர் பூட்டுவர்?
3158,"அதனால், புயலென்னும் வாரி வளங் குன்றிக்கால் உழவர் ஏரின் உழாஅர் என்றார்."
3159,பருவ மழைக்கு உழவு மழை என்றொரு பெயருண்டு.
3160,உழவுமழைக் குறி உழவருக்கு நன்கு தெரியும்.
3161,உழவின் மாண்பு உலகிலுள்ள தொழில்களிலெல்லாம் சிறந்தது உழவே யாகும்.
3162,உழவு இல்லையேல் வாழ்வேது?
3163,உழவு நடந்தால் உலகம் வளம்பெறும் வாணிபம் நிகழும் அரசும் இயங்கும் பிறவும் நலம் பெறும்.
3164,உழவுக்கு ஒப்பாக எதைக் கூறுவது?
3165,உழவுக்கு உழவே ஒப்பாகும்.
3166,இத்தகைய உழவுக்கு மழையின் வருவாய் இன்றியமையாததெனில் மழையின் மாண்பை என்னென்று கூறுவது?
3167,தெய்வத் திருவள்ளுவர் மழையின் பெற்றியை எதைக் குறிப்பிட்டு விளக்குகிறார்?
3168,உழவைக் குறிப்பிட்டு மழையின் மாண்பை விளக்கிறார் மழைவளங் குன்றின் உழவு நடைபெறாதென்கிறார்.
3169,உழவோ உலகின் உயிர்த் தொழில்!
3170,அத் தொழிற்கு மழைமுதல் வேண்டும்.
3171,எதைக்காட்டி வான்சிறப்புக் கூறுகிறார் ஆசிரியர் என்பதை ஓர்க.
3172,உழவும் அமைதியும் மழையின் வருவாய் காணும் உழவர் புத்தமிர்தம் உண்டவர் போலாவர்.
3173,புதுப்புனல் அவர்க்கு மகிழ்ச்சியூட்டுவது போல வேறெதுவும் ஊட்டாது.
3174,களிப்பினின்று என்ன எழும்?
3175,பாட்டன்றோ எழும்?
3176,"மன்பதை பாட்டு மயமாம்போது, அதனிடை என்ன என்ன நிலவும்?"
3177,அறம் நிலவும் அன்பு நிலவும் அமைதி நிலவும்.
3178,ஏருழவின் முடிந்த விளைவு அமைதி அமைதியே யாகும்.
3179,அவ்வேரின் உழவு குன்றினால் மக்களின் எண்ணங்கள் பலவாறு செல்லும் அமைதி கெடும்.
3180,மக்களுள் ஏரோட்டுவோர் பல்லோர்.
3181,ஏருழுது மணி கொழிப்போர் உள்ளம் போர் கொழிக்க எழுங்கொல்?
3182,அவர்தம் பெரும்பொழுது இயற்கையில் ஈடுபட்டு உழைப்பில் செலவா கிறது.
3183,அதனால் அவர் சோம்பிக்கிடத்தற்குப் போதிய பொழு தில்லை.
3184,சோம்பிக் கிடப்போர் நெஞ்சமே பெரிதும் தீமைகளை நினைக்கும்.
3185,"தீய எண்ணங்களே பிணக்கு, போர் முதலிய கொடுமைகளாகப் பரிணமிக்கும்."
3186,நற்றொழிலில் ஈடுபடும் நெஞ்சம் பிணக்கில் போரில் இன்ன பிறவற்றில் ஈடுபடுதல் அரிது.
3187,பெரும்பான்மையோர் வழி உலகம் நடைபெறுதல் இயல்பு.
3188,பெரும்பான்மையோர் ஏர் பூட்டுவோரானால் உலகில் போர் மூட்டுதற்கு இடம் எது?
3189,ஏர் பூட்டுவோர் போர் மூட்டார் வில் பூட்டார்.
3190,திருவில் வானவில் நாஞ்சில் கலப்பை.
3191,உலகில் அமைதியை நிலைபெறுத்த வல்லது ஏரின் உழவு.
3192,உழவுக்கு மழை முதன்மை வேண்டற்பாலது.
3193,இதனால் மழை மாண்பு ஏரின்வழி இப்பாட்டால் அறிவுறுத்தப்பட்டது.
3194,கடலாக்கம் நெடுங்கடலுந் தன்னீர்மை குன்றுந் தடிந்தெழிலி தானல்கா தாகி விடின்.
3195,கருத்து மழை பெய்யாவிடின் கடல் வளமுங் குறையும்.
3196,"விருத்தி மேற்போந்த பாக்கள், மழை, நிலத்துக்கு இன்றியமை யாதது என்பதைத் தெரிவித்தன."
3197,"இப்பாடல், மழை, கடலுக்குத் தேவை என்பதைத் தெரிவிக்கிறது."
3198,மழை நிலத்துக்கன்றிக் கடலுக்குந் துணை செய்வது.
3199,"கடல் கெடின், உலகமுங் கெடும்."
3200,இரண்டின் நலத்துக்கும் மழை தேவை.
