Line Number,Sentence
2046,சிவபெருமானுடைய வலது சீர்பாதம் மேலே தூக்கி முயலகன் மீது வைத்து அழுத்திக் கொண்டு நிற்பது போல் காணப்படுகிறது.
2047,சிவபெருமானைச் சுற்றி நான்கு அடியவர்கள் வழிபட்டு நிற்கின்றனர்.
2048,மேலே விண்ணில் யாழோர் கந்தருவர்கள் பறந்து கொண்டு நிற்கின்றனர்.
2049,சிவபெருமான் தலைக்கு மேலே ஒரு சிறிய மனித உருவம் மேகத்தினின்று வெளியே கிளம்பி வருவது போல் செதுக்கப் பெற்றுள்ளது.
2050,அதன் தலையும் இடுப்பிற்கு மேற்பட்ட பகுதியும் நன்றாகத் தெரிகிறது.
2051,கைகளை உயர்த்தி வணங்குவது போல் காணப்படுகிறது.
2052,மற்றொரு பக்கம் ஒரு சிறிய விலங்கு காணப்படுகிறது.
2053,அது மானாக இருக்கலாம்.
2054,மான் மாடு போல் படுத்திருக்கும் நிலையில் உள்ளது.
2055,மண்டகப்பட்டு குடைவரைக் கோயில் மண்டகப் பட்டு தென் ஆர்க்காடு மாவட்டத்தில் விழுப்புரம் வட்டாரத்தில் இருக்கிறது.
2056,மேலும் இது தளவானூருக்கு தென் மேற்கில் கல் தொலைவிலும் இருக்கிறது என்று கூறலாம்.
2057,இந்தப் பல்லவர் குடைவரைக் கோயில் தளவானூர் கோயிற் பாணியில் உருவாக்கப் பெற்றுள்ளது.
2058,இங்கு சிற்ப வேலைப்பாடுகள் அதிகம் இல்லை.
2059,மண்டபத்தின் வெளிப் பக்கத்தில் இரு வாயில் காப்போர் உருவங்கள் உள்ளன.
2060,மண்டபத்தில் வடக்கு நோக்கி இரு சதுரத் தூண்கள் வழக்கம் போல் நடுவில் இருக்கின்றன.
2061,மண்டபத்தில் தூண்கள் மூன்று இடை வெளிகள் உள்ளதாக இருக்கின்றன.
2062,மண்டபத்தின் இரு கோடிகளிலும் இரண்டு பெரிய அரங்கங்கள் மண்டபத்தின் மூன்று இடைவெளிகளைப் போல் உருவிலும் பரப்பிலும் உள்ளன.
2063,கரடு முரடாக செதுக்கப் பெற்ற வாயில் காவலர் உருவங்கள் வாயிலின் இருமருங்கினும் நிற்கின்றன.
2064,கிழக்குப் பக்கத்தில் நிற்கும் வாயில் காப்போன் தோற்றம் மற்றக் காவலன் உருவத் தோற்றத்தினின்று வேறுபட்டுக் காணப்படுகிறது.
2065,இயற்கையான பூமியினின்று கோயிலின் தளம் அடி உயரத்தில் உள்ளது.
2066,பல பழம் பல்லவர்கள் கோயில்களைப் போல வாயிலை அடைவதற்கு தகுந்த படிகள் இன்றி இக்கோயிலும் இருப்பது குறிப்பிடத்தக்கது.
2067,படம் இ நான்கு சதுரத் தூண்கள் மேற் கூரையைத் தாங்கி நிற்கின்றன.
2068,பின் புறத்தில் தெற்குச் சுவரில் வடக்கு நோக்கி அடி ஆழமான மாடங்கள் உள்ளன.
2069,இது தனித் தன்மை வாய்ந்த கோயில் போல் திகழ்கின்றது.
2070,இந்தச் சதுரத் துவாரங்கள் மூலம் தெளிவாகச் சிலைகளைப் பார்க்கலாம்.
2071,ஆனால் கோயிலில் அமைக்கப் பட்டிருக்கும் சிவலிங்கத்தை அதன் வழியாகப் பார்க்க முடியாது.
2072,"மேற்கூறிய சதுரத்துவாரங்கள் மூலம் சிவன், திருமால், நான்முகன் உருவங்களைப் பார்க்க மாடங்கள் செய்யப்பட்டிருக்கலாம் என்று எண்ணப்படுகிறது."
2073,இப்பொழுது இங்கு திரு உருவங்கள் எதுவும் காணப்படவில்லை.
2074,இங்குள்ள கல்வெட்டு இங்கு சிவன் திருமால் நான்முகன் உருவங்கள் இருந்திருக்கலாம் என்பதை உறுதிப்படுத்து கின்றன.
2075,இக்கோயிலில் உண்ணாழிகை முன் நிற்கும் வாயில் காப்பாளர்கள் பாம்பணிந்துள்ளார்கள்.
2076,அதனால் நடுவில் உள்ள உண்ணாழிகையில் சிவபெருமான் திரு உருவம் இருந்திருக்கலாம் என்று கருதப்படுகிறது.
2077,இந்தக் கோயிலில் உள்ள கல்வெட்டில் கோயில் அரசன் ஆணைப்படி கட்டப்பட்டு அவன் பெயர் பொறிக்கப்பட்டுள்ளது.
2078,அதில் அரசன் பெயர் விசித்திர சித்தன் என்று குறிப்பிடப்படுகிறது இப்பெயர் முதலாம் மகேந்திரவர்மனுடைய சிறப்புப் பெயராகும்.
2079,இந்தக் கல்வெட்டின் எழுத்துக்கள் தளவானூர்க் கல்வெட்டின் எழுத்துக்களைப் போன்று இருக்கின்றன.
2080,இவ்விரு கோயில்களும் அருகருகே ஒரு சில கல் தொலைவிற்குள் அமைக்கப் பட்டிருப்ப தோடு ஒரே விதமான பாணியில் உருவாக்கப்பட்டுள்ளன.
2081,இதனால் மண்டகப்பட்டு குடை வரைக் கோயில் மன்னன் முதலாம் மகேந்திரவர்மன் காலத்தில் உருவாக்கப்பட்டது என்று கூற முடியும்.
2082,"கல்வெட்டின் மூலம் கல், மரம், சுண்ணாம்பு, தாதுப் பொருள்களின் துணையின்றி பல்லவன் கோயில் அமைத்தான் என்று அறிகிறோம்."
2083,ஆதலால் இக் கோயிலே மகேந்திரவர்மன் சைவந் தழுவிய பின் அமைத்த முதற் கோயில் என்று எண்ணப்படுகிறது.
2084,அழியாத ஆண்டவனுக்கு அழிவில்லாத கோயில்களை உருவாக்க வேண்டும் என்று மகேந்திரவர்மன் கி.பி.
2085,ஆம் நூற்றாண்டின் ஆரம்பத்தில் குகைகளைச் செதுக்கிக் கோயிலாக்கினான்.
2086,அப்பால் மலைகளைக் குடைந்து குடைவரைக் கோயில்களைக் கண்டான் என்று கல்வெட்டு ஆராய்ச்சிகளின் மூலம் அறிகின்றோம்.
2087,"பல்லாவரம் குடை வரைக் கோயில் பல்லாவரம், செங்கற்பட்டு மாவட்டம், சைதாப்பேட்டையில் உள்ள சிற்றூராகும்."
2088,பல்லாவரம் தென் இந்திய இருப்புப் பாதையில் உள்ள ஒரு புகைவண்டி நிலையம் ஆகும்.
2089,"இது பழைய பல்லாவரம், புதிய பல்லாவரம் என்னும் ஊருக்கு இரண்டு கல் தெற்கில் இருக்கிறது."
2090,எதிரே பல குன்றுகள் அரை வட்ட வடிவில் அமைந்துள்ளன.
2091,கீழ்பக்கம் உள்ள குன்று பஞ்ச பாண்டவர் மலை என்று அழைக்கப்படுகிறது.
2092,அங்கு தான் பல்லவர் குடைவரைக் கோயில் உருவாக்கப் பெற்றிருக்கிறது.
2093,பல்லவர் புரம் பல்லாவரம் எனத் திரிபுற்றிருக்கிறது என்று அறிஞர்களால் கருதப்படுகிறது.
2094,பல்லவ அரச குடும்பத்தவர்கள் வாழ்ந்து வந்ததும் குடைவரைக் கோயில்களையுடையதுமான மூன்று பல்லாவரங் களில் இது ஒன்று.
2095,மகேந்திரவர்மன் எடுப்பித்த பல்லாவரம் குகைக்கோயிலில் இன்று சைவக் கோயிலின் சின்னங்கள் ஒன்றும் இல்லை.
2096,இப்பொழுது முலிம்களின் சமாதியாக மாற்றப்பட்டிருக்கிறது.
2097,இது முலிம்களின் ஆதிக்கத்திலே இருந்து வருகிறது.
2098,குகையில் சுண்ணாம்பு தீட்டப் பெற்றிருக்கிறது.
2099,இந்தக் குடை வரைக் கோயில் மண்டகப் பட்டுக் கோயிலைப் போல் இருக்கிறது.
2100,இதில் உள்ள மண்டபம் அடி நீளமும் அடி அகலமும் அடி உயரமும் உள்ளது.
2101,இம்மண்டபத்தில் இரு வரிசையாக நான்கு நான்காக எட்டுத் தூண்கள் உள்ளன.
2102,தூண்கள் சதுர வடிவில் உள்ளன.
2103,தூண்கள் ஐந்து சம அளவுள்ள இடை வெளியுள்ளதாய் அமைக்கப் பட்டுள்ளன.
2104,இங்கு ஐந்து திரு உண்ணாழிகைகள் உள்ளன.
2105,உள்ளே சிலைகள் எதுவும் இல்லை.
2106,வாயில்காப்போர் உருவங்களும் சிற்ப வேலைப்பாடுகளும் காண முடியவில்லை.
2107,இக்கோயில் அமைப்பு மண்டகப்பட்டுக் கோயில் அமைப்பை ஒத்ததாகத் தெரிகிறது.
2108,இது தவறாகச் செதுக்கப்பட்டிருக்கலாம் என்று எண்ணப்படுகிறது.
2109,தூணின் மேற்பகுதி பிற்காலத்தில் செதுக்கப்பட்டதாகக் கூற முடியவில்லை.
2110,மண்டபத்தில் உள்ள உட்புறத் தூண்களிலும் மேற்குப் பக்கத்தில் உள்ள பாறையிலும் பல்லவர் கல்வெட்டுகள் உள்ளன.
2111,இவை பல்லவ கிரந்த எழுத்துக்களால் பொறிக்கப் பட்டுள்ளன.
2112,அதில் பல்லவ மன்னர்களின் சிறப்புப் பெயர்கள் காணப்படுகின்றன.
2113,அதில் முதன் முதலாகக் காணப்படுவது சிரி மகேந்திர விக்கிரவர்மன் என்பதாகும்.
2114,இதே பெயர் திருச்சிராப்பள்ளி குடைவரைக் கோயிலிலும் உள்ளது.
2115,"இந்தக் கல்வெட்டில் சிரி மகேந்திரவர்மன், விசித்திரசித்தன், மத்தவிலாசன் வலிதாங்குரன் சேத்தகாரி, பகாப்பிடுகு, சித்திரகாரப்புலி என்ற பெயர்கள் காணப்படுகின்றன."
2116,இந்த விருதுப் பெயர்கள் அனைத்தும் முதலாம் மகேந்திர வர்மப் பல்லவனுடையதேயாகும்.
2117,இந்தக் குடைவரைக் கோயிலின் முன் மண்டபத்தின் பின்புறம் ஐந்து திரு உண்ணாழிகைகள் கர்ப்பகிருகங்கள் உள்ளன.
2118,அவைகள் அடிச் சதுரமாக உள்ளமாடங்கள் போல் காணப்படுகின்றன.
2119,இந்த அரைகளில் தான் சிலைகள் வைக்க மேடைகள் உள்ளன.
2120,முற்காலத்தில் இங்கு ஐந்து தெய்வச் சிலைகள் வைத்திருக்க வேண்டும் என்று எண்ணப்படுகிறது.
2121,இன்று நடு அறையில் உண்ணாழிகையில் முலிம்களின் பீலி வைக்கப் பட்டுள்ளது.
2122,பக்கத்தில் உள்ள அரைகள் நான்கினும் ஒன்றும் காணப்படவில்லை.
2123,கடைசிப் பக்க அறைகளில் இரண்டில் கதவுகள் போட்டு பூட்டப்பட்டுள்ளன.
2124,கல்வெட்டுகள் இன்று படிக்க முடியாத நிலையில் உள்ளன.
2125,ஆனால் அங்கு மகேந்திரவர்மன் காலத்து சிலைகள் இல்லாது இருப்பதை அறிந்த பிற்காலப் பல்லவர் புர மக்கள் உண்மையை உணராது.
2126,இக் கோயிலுக்கு பஞ்ச பாண்டவர் கோயில் என்று பெயரிட்டனர்.
2127,அப்பெயரே இன்றளவும் வழங்கி வருகிறது.
2128,கல்வெட்டுகளில் மகேந்திரன் விருதுப் பெயர்கள் வட மொழியிலும் தெலுங்கிலும் உள்ளன.
2129,"மகேந்திர பாடி என்பதின் திரிபே, மகேந்திர வாடி என்று கருதப்படுகிறது."
2130,மன்னன் மகேந்திரவர்மன் காலத்தில் இவ்வூர் அமைக்கப்பட்டதால் மகேந்திர வாடி என்று பெயர் பெற்றது.
2131,இங்கு அதிகமாக வைணவப் பார்ப்பனர்கள் வாழ்ந்து வருகிறார்கள்.
2132,ஊருக்கு அருகில் ஒரு நல்ல குளம் உள்ளது.
2133,குளத்தின் பக்கத்தில் முற்காலத்தில் பெரிய அரண்கள் அமைக்கப்பட்டிருந்தது என்பதற்கு அடையாளமாக தரை மீது சுவர்கள் காணப்படுகின்றன.
2134,இங்குள்ள குன்றில் குடைவரைக் கோயில் அமைக்கப்பட்டுள்ளது.
2135,அதில் முன் மண்டபமும் திரு உண்ணாழிகையும் உள்ளது.
2136,மண்டபத்தின் இறுதியில் வாயில் காவலர் உருவங்கள் உள்ளன.
2137,படம் அ மண்டபத்தின் நடுவே சதுரமான நான்கு தூண்கள் இரண்டு வரிசையாக நிலை நாட்டப் பட்டுள்ளன.
2138,அவைகளில் ஏனைய பல்லவர்கள் தூண்களைப் போல் தாமரைப் பூ வடிவமுள்ள சிற்பங்கள் காணப்படுகின்றன.
2139,படம் இ நீண்ட சதுரமான இம்மண்டபம் அடி நீளமும் அடி அகலமும் அடி உயரமும் உள்ளது.
2140,நான்கு தூண்களும் மேற்கூரையைத் தாங்கி நிற்கின்றன.
2141,இக்கோயில் திருமால் கோயிலாகும்.
2142,இதனை மகேந்திர விட்னுக் கிருகம் என்று அழைக்கப் பெறும்.
2143,இங்கு ஒரு நரசிங்கப் பெருமான் சிலை உள்ளது.
2144,வாயில் காவலர்கள் உருவம் நிலையும் கைகளும் தளவானுர் கோயில் வாயில் காவலர்கள் உருவம் போல காணப்படுகின்றன.
2145,"கோயில், குளம், ஊர் அனைத்திற்கும் மகேந்திரன் பெயர் சூட்டப்பட்டுள்ளது."
2146,இவ்வூர் திருக்கழுக்குன்றம் செல்லும் அரச பாட்டையில் இருக்கிறது.
2147,இங்குள்ள குன்றுக்குக் கிழக்குப் பக்கத்தில் மூன்று குகைகள் உள்ளன.
2148,இவற்றில் இரண்டு குகைகளில் வேலைப்பாடுகள் முற்றுப் பெறவில்லை.
2149,ஒரு கோயில் நன்றாக அமைக்கப்பட்டுள்ளது.
2150,இது ஒரு சிவன் கோயிலாகும்.
2151,இக் கோயிலுக்கு திருவயந் தீசுவரமுடைய நாயனார் கோயில் என்று பெயர் கூறப்படும்.
2152,இது தமிழகத்தில் உள்ள பழைய கோயில்களில் ஒன்றாகக் கருதப்படுகிறது.
2153,இந்தக் கோயிலில் பழைய கல்வெட்டுகள் உள்ளன.
2154,அதில் கோயிலை உருவாக்கியவர்கள் யார் என்று குறிப்பிடப் பட்டுள்ளது.
2155,இந்தக் கல்வெட்டு பல்லவத் தமிழ்க் கல்வெட்டாகும்.
2156,மகேந்திரவர்மன் காலத்தில் எழுதப் பெற்ற தமிழ் கல்வெட்டு ஒன்றிரண்டே உள்ளன.
2157,அவைகளில் இது ஒன்று.
2158,இங்கு குறிப்பிடப்பட்ட மகேந்திரவர்மன் முதலாம் மகேந்திர வர்மனேயாகும்.
2159,பெரிய கோயில்கள் அதாவது முற்றுப் பெற்ற கோயில்களும் சீரற்றே கிடக்கின்றது.
2160,இந்தப் பெரிய கோயில் மேலச்சேரி கோயில் போல காணப்படுகிறது.
2161,மண்டபத்தின் தூண்கள் சாதாரணத் தூண்களாகவே இருக்கின்றன.
2162,சதுர வடிவமான திரு உண்ணாழிகையில் இலிங்கம் உருண்டை வடிவில் உருவாக்கப் பெற்றுள்ளது.
2163,இன்றும் இங்கு வழிபாடுகள் நடை பெற்று வருகின்றன.
2164,முன் மண்டபத்தில் பிற்காலத்தில் செங்கற் சுவர் எழுப்பி அடைத்து விட்டதால் கோயில் பெருமை குன்றிவிட்டது.
2165,உண்ணாழிகையின் முன் வாயிலில் இரு பக்கங்களிலும் வாயிற் காப்போர் உருவங்கள் காணப்படுகின்றன.
2166,தலையில் இரு கொம்புகள் உள்ளவர்களாயும் கையில் தடி தாங்கியவர்களாயும் வாயில் காவலர்கள் நிற்கின்றார்கள்.
2167,பிள்ளையார் உருவம் பிற்காலத்தில் இடம் பெற்றிருக்கலாம் என்று கருதப்படுகிறது.
2168,மண்டபத் தூண்களின் இடை வெளிகளில் செங்கற் சுவர் எழுப்பி மரக்கதவு இடப் பட்டுள்ளது.
2169,இந்தக் குடை வரைக் கோயில் கல்வெட்டு கி.பி.
2170,ஆம் நூற்றாண்டில் கோப்பெருஞ்சிங்கன் என்னும் அரசன் காலத்தில் எழுதப்பட்டது.
2171,இக் கோயிலுக்கு நுந்தா விளக்குத் தானம் செய்யப் பட்ட செய்தியைக் கூறுகிறது.
2172,அது ஒரு சிற்றூராகும்.
2173,அவ்வூருக்கு வடக்கில் சிறு கருங்கன் மலை மேற்கு நோக்கி இருக்கிறது.
2174,அதன் நடுவில் ஒரு குடைவரைக் கோயில் இருக்கிறது.
