Line Number,Sentence
1668,எங்கெங்கும் என்றென்றும் ஏற்றொழுக நல்லறத்தை மங்கும் மனமாசு மாய்ந்து.,False
1669,கற்றலும் கேட்டலும் காண்டலும் எல்லாமும் உற்றறம் ஆக உழை.,False
1670,அறம்பொதுச் செல்வமே யார்க்கும் உரிமை புறம்பென் றொதுங்கல் புரை.,False
1671,"உலக நடையாய் உயிர்அறம் ஆக, பலகலை ஆவிபெறும் பார்த்து.",False
1672,உலகிடைத் தோன்றிய உத்தமர் வாய்மைக் கலைகள் அறமே கருது.,False
1673,ஆன்றவர் சொல்லில் அறக்கடவுள் வீற்றிருக்கும் சான்றவழி பாடுசெய் சார்ந்து.,False
1674,பொய்யாமை கொல்லாமை பூக்களால் அர்ச்சிக்க பொய்யா யினவெல்லாம் போம்.,False
1675,அறவழி பாடுசெய் அன்புலகம் ஆக்க உறவுகொண் டென்றும் உழை.,False
1676,"அறவழி பாட்டினில் அந்தண்மை ஓங்கும், உறஉலகு தொண்டுசெய் ஓர்ந்து.",False
1677,அறவோர் தொகைபெருக அன்புலகம் வாழ மறவோர் தொகைஅருக மாய்ந்து.,False
1678,அறநெறி வெல்க அறவுரை மல்க உறவுயிர் வாழ்க உலகு.,False
1679,சமயம் சமயத்தின் உள்ளே தழைத்தது குப்பை அமைவு குலைந்ததை ஆய்.,False
1680,"தாதுப் பொருளுரைத்தார், தர்க்கங்கள் செய்தலுத்தார், வாதுமத மூர்க்கர் வரிந்து.",False
1681,வேந்தரிடம் சென்றதுவும் வேடிக்கை பூண்டதுவும் சாந்தமதம் பேயாச்சே தாழ்ந்து.,False
1682,மடங்கள் புகுந்ததும் மடிந்தது கட்டால் இடங்கள் சமயமோ?,False
1683,"கோயில், திருடர் குகையாய் மலிந்தது தாயில் மகவாய்த் தனித்து.",False
1684,வேடம் சமயமன்று வேடிக்கை அஃதன்று வாடும் விரதமன்று வம்பு.,False
1685,மூக்கைப் பிடித்தலும் மூச்சை ஒடுக்கலும் வாக்கை அடக்கலும் மாறு.,False
1686,மண்புனல் மூழ்கி மறையப் புகும்வித்தை கண்கட்டு சாலம் கருது.,False
1687,வேற்றுருக் கொள்ளலும் விண்ணில் பறத்தலும் காற்றுச் சமயக் கலை!,False
1688,"காற்றைப் பிடிக்கும் கணக்குச், சமயமன்று ஏற்றம் உடம்புக் கினிது.",False
1689,பெண்பொன்னை மண்ணைப் பிரிந்து துறந்திடல் கண்பிடுங்க எண்ணுவதாம் கைத்து.,False
1690,எங்கெங்கும் உள்ளபரம் இம்மூன்றில் இல்லையோ பங்கம் பரத்துக்குப் பார்.,False
1691,இல்லற வாழ்வில் இருத்தல் சமயமாம் பல்லறம் பாலிக்கும் பாங்கு.,False
1692,அன்புப் பெருக்கினில் ஆழ்தல் சமயமாம் இன்னது வாழ்வென் றிரு.,False
1693,தன்னைப் பிறர்க்குத் தருதல் அருட்சமயம் மன்னுமது இல்வாழ்வின் மாட்டு.,False
1694,"சேர்க்கையில், அன்புச் செறிவினில், சீர்சமயம் ஆர்க்கஇல் வாழ்க்கை அடை.",False
1695,தேவைக்கு மேலீட்டாச் செல்வம் சமயமே ஆவி வளர்க்கும் அரண்.,False
1696,தேவைக்கு மேலே திரட்டிச் சமயமென்றும் தேவென்றும் கூவல் திருடு.,False
1697,பாவத்துக் கஞ்சுமனம் பார்க்கும் சமயஅறம் ஆவிக் குரிய அமுது.,False
1698,குற்றம் பொறுத்தலில் கூடும் சமயநலம் மற்றுமதை மன்னித்தல் மாண்பு.,False
1699,தன்னுயிராய் மன்னுயிரைத் தாங்கல் சமயம் அது மன்னிப்பின் பொங்கல் மதி.,False
1700,பகைவரை நேசிக்கும் பான்மை சமயம் இகலை அழிக்கும் இசை.,False
1701,செபம்செய்யச் செய்யச் சிறக்கும் சமயம் அபயம் அளிக்கும் அருள்.,False
1702,செகஞ்செழிக்கச் செய்யும் செபத்துள் சமயம் அகஇருள் போக்கும் அறம்.,False
1703,ஓயா திறையினை உன்னல் சமயமே காயா மரங்கனிசெய் கார்.,False
1704,எல்லாம் பரமாய் இருத்தல் சமயமென வல்லார் வகுத்தார் வழி.,False
1705,தொண்டுநெறி நின்றால் தொடரும் சமயஉண்மை அண்டிப் பிழைக்க அறி.,False
1706,தொண்டைப் புரிந்திருத்தல் தூய பரசமயம் மண்டு புகழேன்?,False
1707,உற்பத்திக் கென்றுழைத்தல் உண்மைச் சமயமாய் அற்பில் கிடத்தும் அறம்.,False
1708,"சமய ஒருமையைச் சாந்தமிலார், பன்மைச் சமயங்கள் ஆக்கினர் சாட்டு.",False
1709,பல்சமயத் தீயுணர்வு பற்றி எரித்ததே மல்லல் உலகை மறித்து.,False
1710,சமயங்கள் ஒன்றென்றே சார்ந்தறிஞர் சொற்றார் அமயத்தில் அங்கங்கே ஆர்ந்து.,False
1711,சமயப் பொதுமையைச் சன்மார்க்கம் என்றும் இமயத் தவர்புகன்றார் இன்பு.,False
1712,ஒன்றே குலமும் ஒருவனே தேவனும் என்றே எழுந்தமொழி ஏற்பு.,False
1713,"கோயில் சமயம், குணத்தை அளியாது போயிற்றுப் பிற்காலப் போக்கு.",False
1714,கோயில்கள் தோன்றியபின் கோதுகளும் தோன்றினவே மாயிரு ஞாலத்தின் மாண்பு!,False
1715,கோயில் திருத்தம் குலவியே வானளவு போயிற்று மேலென்ன போக்கு?,False
1716,மண்டபம் கொண்டனர் மாண்மதியர் அங்கேனும் ஒண்டியதோ சீர்திருத்தம் ஓய்ந்து?,False
1717,அமைப்பேவேண் டாஎன் றறிந்தசிலர் சொன்னார் அமைப்புடலில் நின்றே அறி.,False
1718,ஆன்றோர் மொழிகோயில் அர்ச்சனை ஓதலதை ஊன்தோல் உளம்உருக ஓது.,False
1719,சமயம் விடுத்துச் சமயம் புகுதல் இமையும் பொருந்தாதே எண்.,False
1720,ஒருதெய்வ மார்க்கமே உத்தமச்சன் மார்க்கம் கருதல்பொய் மெய்எங்கே?,False
1721,நாகரிகம் இல்லாத நாடுகளில் புன்மதப்போர் வேகம் மிகநடக்கும் வீண்.,False
1722,மக்களில் கீழ்கள் மதப்போர் இடுவார்கள் புக்கஅறி யாமையைப் போக்கு.,False
1723,பன்மார்க்கத் தீங்குகளைப் பாரில் ஒழிக்கஎழு சன்மார்க்க ஓருணர்வே சால்பு.,False
1724,சன்மார்க்கம் ஒன்றே சகமார்க்கம் ஆகுமினித் துன்மார்க்கம் போக்குந் துணை.,False
1725,சன்மார்க்கத் தொண்டுசெய் சன்மார்க்கத் தொண்டுசெய் சன்மார்க்கத் தொண்டே தவம்.,False
1726,சித்தர் மரபின் திரட்சியே சன்மார்க்கம் இத்தரையில் தொன்மையென் றெண்.,False
1727,உபநிடத உள்ளம் உணர்த்துமெய்ம் மார்க்கம் அபயம் எவர்க்கும் அருள்.,False
1728,அருகரொடு புத்தர் அருட்கிறிது வாய்மை பெருகுசன் மார்க்கமெனப் பேசு.,False
1729,மகம்மது சொல்மார்க்கம் மாநிலச் சன்மார்க்கம் அகமணி போகும் அழுக்கு.,False
1730,திருமூலர் மந்திரம் தெய்வச்சன் மார்க்கக் கருமூலம் என்று கருது.,False
1731,மூலர் மரபை முதுதாயு மானவர் சீல வழிவளர்த்தார் தேர்ந்து.,False
1732,இராமலிங்க வள்ளல் எழில்அருட்பா எங்கும் இராமலிரா சன்மார்க்க இன்பு.,False
1733,"உலகியல் மார்க்கம் உயர்பர மார்க்கம், கலவைச்சன் மார்க்கத்தில் காண்.",False
1734,உலகினைக் கொண்டே உயர்பரத்தைக் காட்டல் இலகுசன் மார்க்க இயல்.,False
1735,பிறப்பிறப்பை ஆய்ந்தால் பிறங்குஞ்சன் மார்க்கச் சிறப்புக் கிடைக்கும் திறப்பு.,False
1736,பிறந்தான் வளர்ந்தான் பெரிய மனிதன் இறந்தானே பாவம்!,False
1737,இறப்பைத் தவிர்க்கும் இனியசன் மார்க்கம் பிறப்புக் கிடமேது?,False
1738,மைந்தன் திடீரென மாநிலத்தில் தோன்றவிலை சிந்திக்க முன்பின் தெளி.,False
1739,முன்பார்க்கப் பின்பார்க்க மூத்தஉயிர் மைந்தனது தொன்மார்க்கம் தோன்றும் தொடர்ந்து.,False
1740,முன்பார்க்கப் பின்பார்க்க மூலத்தை மைந்தனுக்குச் சன்மார்க்கம் போதிக்கும் சார்.,False
1741,முன்பார்க்கப் பின்பார்க்க மூலம் உணர்மைந்தன் சன்மார்க்கன் ஆவன் தணிந்து.,False
1742,வளர்ச்சியை நோக்க மனிதனது முன்பின் உணர்ச்சியில் தோன்றும் உறைந்து.,False
1743,விஞ்ஞானச் சத்திக்கு மேம்பட்ட சன்மார்க்க மெய்ஞ்ஞானச் சத்திபெற வேண்டு.,False
1744,மைந்த னிடத்துள்ள மாண்புகளை விஞ்ஞானம் எந்த வழிகாணும் இங்கு!,False
1745,விஞ்ஞானம் காணாத வேறுபல சத்திகளை மெய்ஞ்ஞானம் காட்டும் மிகுந்து.,False
1746,விஞ்ஞானக் கல்வி விலங்கிட்டு நின்றுகொண்டு மெய்ஞ்ஞானம் என்னஎனல் வீண்.,False
1747,மெய்ஞ்ஞானம் தோன்றியதும் மெய்ப்பொருள்முன் அண்டமெலாம் உய்யஇயங் கல்தெரியும் ஒத்து.,False
1748,சன்மார்க்கக் கல்வியே சாகாத கல்வியாம் கொல்மார்க்கம் வீயும் குலைந்து.,False
1749,சன்மார்க்கச் சத்தியே சாந்தம் அளித்தருளும் வன்மார்க்கம் மாயும் மடிந்து.,False
1750,சன்மார்க்க ஆட்சி சகத்தில் பரவிவரப் புன்மார்க்க ஆட்சியெலாம் போம்.,False
1751,சன்மார்க்க வாழ்க்கை தழைத்துப் பெருகிவரத் துன்மார்க்கம் சாகும் தொலைந்து.,False
1752,சன்மார்க்கம் நின்றொழுக சத்திகளைக் கண்டடைக பன்மார்க்கம் ஓடும் பறந்து.,False
1753,சன்மார்க்க வாழ்வு சமயப் பெருவாழ்வு மன்மார்க்கம் வெல்க வளர்ந்து.,False
1754,தீர்க்கர் தீர்க்கர் வரலாற்றைத் தேடாதே ஆயாதே யார்க்கும் தெரிவரிதே அஃது.,False
1755,அகண்ட பரம்அடைவே அத்தைக்கண் காண்டல் விதண்டையாம் தீர்க்கரடி வேண்டு.,False
1756,இயற்கையுள் தீர்க்கருள் ஈசன் இருத்தல் பயிற்சியில் காணப் பழகு.,False
1757,யோகிகள் ஞானிகள் தீர்க்கரலர் யோசிக்க வேகமனம் விடுத்து மேல்.,False
1758,யோகிமெய்ஞ் ஞானி இயற்கைநீத் தால்நோய்கள் ஏகியே பீடிக்கும் எய்த்து.,False
1759,தீர்க்கரை நோயொன்றும் சேராதே அன்னவரைப் பார்க்கவும் நில்லா பயந்து.,False
1760,"தெய்வநிலை பெற்றவர்கள், சீரியற்கை வென்றவர்கள் செய்யவுடல் தீர்க்கர் சிறந்து.",False
1761,தீர்க்கர் பலரென்பர் செந்நெறியில் நில்லாதார் பார்க்க ஒருவரே பாடு.,False
1762,ஒருதெய்வம் நிற்கும் உளமுடைய தீர்க்கர் ஒருவரே என்றுணர்க ஓர்ந்து.,False
1763,ஈசன் எனஉலகம் ஏத்துவது தீர்க்கரையே நேச மிகவிளங்க நேர்.,False
1764,நபிஇயற்கை ஏசுபுத்தர் நாதர்சேய் கண்ணன் சுபமவுனன் தீர்க்கரெனச் சொல்.,False
1765,விரும்பும் ஒருவரை வேண்டுதல் செய்க அரும்பும் ஒருமையுணர் வாழ்ந்து.,False
1766,தீர்க்கருள் தாழ்வுயர்வு சிந்தனையில் கொள்ளாதே ஆர்க்கும்பொய்ப் பேய்கள் அணைந்து.,False
1767,ஒருதெய்வ உள்ளத்தார் ஒன்றாவர் உள்ளின் மருவலெங்கே தாழ்வுயர்வு மாசு?,False
1768,தீர்க்கருள் பேதங்கள் சேர்ந்துவிட்ட காலத்தில் பார்க்குள் பிணக்கதிகம் பார்.,False
1769,ஞாலம் அமைதியுற நாதாந்த தீர்க்கரிடம் சால அபேதங்கொள் சார்ந்து.,False
1770,சிந்திக்கத் தீர்க்கரைச் செப்பிய போதனையாய்ச் சந்தமிக மாறிடுவர் சத்து.,False
1771,போதனைகள் ஒன்றாய்ப் பொருந்திய நல்லுயிரில் நாதம் இசைக்கும் நயந்து.,False
1772,"நாதம், அகண்டத்தில் நல்லுயிரைச் சேர்த்துவிடும் பேதமறும் ஒன்றாகும் பேறு.",False
1773,செடிமரம் கால்நடைக்குச் செய்பணி நெஞ்சில் படியுமே தீர்க்கநெறிப் பண்பு.,False
1774,பன்றிக்குப் பால்கொடுத்தல் முல்லைக்குத் தேர்அளித்தல் நன்றுடைய தீர்க்கநெறி நாடு.,False
1775,"மக்களின் துன்பமும், மற்றஉயிர்த் துன்பமும் ஒக்கநினை தீர்க்கம் உயர்வு.",False
1776,தெய்வம் அகண்டிதம் சிந்திக்க ஒண்ணாதே உய்யஅருள் தீர்க்கரை உன்.,False
1777,தீர்க்கரை எண்ணுக தீர்க்கரை வாழ்த்துக தீர்க்கரைப் போற்றுக சேர்ந்து.,False
1778,தீர்க்கரைச் சேர்க்கும் திருப்படிகள் தத்துவங்கள் ஆர்க்கும்இழி தர்க்கநிலை அன்று.,False
1779,அத்துவிதம் பேச்சன் றடைவே அதைஎய்தச் சத்தியத் தீர்க்கரைச் சார்.,False
1780,கலையெலாம் கற்பனையே கற்பனையின் நுண்மை அலைவிலாத் தீர்க்கர் அறி.,False
1781,கற்பனையின் நுண்மையைக் காணாதே ஏசுதல் அற்ப மதிக்குறும் பாம்.,False
1782,பாடியும் ஆடியும் பக்திசெய் தீர்க்கரைக் கூடும் பரகதி கூர்ந்து.,False
1783,சன்மார்க்க போத நூல் சாற்றும் விளக்கவுரை தொன்மார்க்கம் வாழ்க தொடர்ந்து.,False
1784,வாழ்த்து பெற்றோர்கள் வாழ்க பெரியோர்கள் வாழ்கவே கற்றோர்கள் வாழ்க கலித்து.,False
1785,உடல்வாழ்க ஊர்வாழ்க ஒங்குலகம் வாழ்க கடந்தபரம் வாழ்க கலந்து.,False
1786,வாழ்க இயற்கைத்தாய் வாழ்க மழைவளம் வாழ்க பசுக்கள் மலிந்து.,False
1787,இல்லறம் வாழ்க இனியபெண் வாழ்கவே நல்லமகார் வாழ்க நயந்து.,False
1788,கூட்டுறவு வாழ்கவே கூர்தலறம் வாழ்கவே பாட்டிசையும் வாழ்கவே பார்.,False
1789,வாழ்கநன் னூலெலாம் வாழ்க குருகுலம் வாழ்க இளைஞர் மகிழ்ந்து.,False
1790,தொழிற்கல்வி வாழ்க தொழிற்சாலை வாழ்க தொழிலரசு வாழ்க தொடர்ந்து.,False
1791,வாழ்கபொருள் வாழ்கஅருள் வாழ்கமெய் வாழ்கபணி வாழ்கஅறம் வாழ்க மலர்ந்து.,False
1792,பழமைத்தாய் வாழ்க புதுமைச்சேய் வாழ்க கிழமைக்கால் வாழ்க கிளர்ந்து.,False
1793,தீர்க்கர் வழிவாழ்க தீம்போ தனைவாழ்க பார்க்குள் சபைவாழ்க பற்று.,False
1794,நற்கருத்து வாழ்கவே நன்மொழி வாழ்கவே நற்செயல் வாழ்கவே நாடு.,False
1795,சன்மார்க்கம் வாழ்கவே சன்மார்க்கம் வாழ்கவே சன்மார்க்கம் வாழ்க தழைத்து.,False
1796,இருமையும் ஒருமையும் முன்னுரை உலகை நோக்குக.,False
1797,அஃது எக்காட்சி வழங்குகிறது?,False
1798,இந்நாளில் கலகக் காட்சி என்னும் விடையே பிறக்கும்.,False
1799,"உலகம், உயிர் நலத்தின் பொருட்டு ஆண்டவன் அருளால் அமைந்தது.",False
1800,அதனுள் எப்படிக் கலகம் புகும்?,False
1801,பின்னைக் கலகம் பிறக்கும் இடம் எங்கே?,False
1802,கற்பனை கற்றுக் கேட்பன கேட்டுச் சிந்தனையில் ஆழ ஆழத் தெளிவு உண் டாகும்.,False
1803,தெளிவு நிட்டையைக் கூட்டும்.,False
1804,"நிட்டையில், கலகத்துக்குப் பிறப்பிடம் உலகம் அன்று என்பதும், உள்ளமே என்பதும் நன்கு விளங்கும்.",False
1805,"விவகார உலகில், நன்மை தீமை அறிவு அறியாமை கொலை கொல்லாமை பிறப்பு இறப்பு முதலிய இரட்டைகள் இருக்கின்றன.",False
1806,"இவ்விரட்டைத் தோற்றம் மறைந்தாலன்றி, உலகில் அமைதி நிலைபெறுதல் அரிது.",False
1807,அமைதிக்கு என் செய்வது?,False
1808,கடவுளை அடைதல் வேண்டும்.,False
1809,வேறு வழியில்லை.,False
1810,கடவுள் ஒன்று ஒருமை.,False
