Line Number,Sentence
384,"இனிச், செம்போத்தென்பதும் ஈண்டுக் கொள்ளாமோ வெனின், அது பெண்பாற்கும் பெயராகலின் ஒரு பெயரே பண்புகொள் பெயரன் றென்பதுணர்க."
385,"அது என்றது, போத்து என மேற்குறித்த மரபுப் பெயரினை."
386,நீர்வாழ் சாதியுள் அறுபிறப் புரிய எனப் பாடங் கொண்டார் பேராசிரியர்.
387,இவை பறவையினத்துள் பயின்று வழங்குதலின் வேறு கூறினர் என்பர் போரசிரியர்.
388,எழால்வல்லூறு என்னும் பறவை.
389,புல்லூறு எனவும் கூறுவர்.
390,"சவளான் இராசாளி என்பது வழக்கு என்பது, முன்பதிப்பில் மன்னார்குடி இயற்றமிழாசிரியர் ம.நா."
391,சோமசுந்தரம் பிள்ளையவர்கள் எழுதிய அடிக்குறிப்பு.
392,"விலங்கு, நீர்வாழ்வன."
393,பறவை என்னும் மூவேறு இனங்களும் போத்து என்னும் ஆண்பாற் பெயர் கொள்வன என்பார் இனம்பற்றி மூன்று சூத்திரங்களாற் கூறினார்.
394,இரலையும் கலையும் புல்வாய்க் குரிய.
395,இளம்பூரணம் இள் இரலை என்னும் பெயரும் கலை என்னும் பெயரும் புல்வாயில் ஆண்பாற்குரிய என்றவாறு.
396,பேராசிரியம் இவை மூன்று சூத்திரமும் எண்ணிய மூன்று சாதிக்கும் இரலையுங் கலையுமென்னும் ஆண்பாற் பெயர் இன்னவாறுரிய வென்கின்றன.
397,இள் இரலையுங் கலையுமென்பன புல்வாய்க்குரிய அவற்றுட் கலையென்பது உழைக்குமுரித்து அக்கலையென்பது முசுவிற்கு வருங்கால் உழைக்குப்போலச் சிறுவரவிற்றன்றி வரும் எறு.
398,"ஆய்வுரை இள் இரலை, கலை என்னும் மரபுப் பெயர்கள் இரண்டும் புல்வாய் இனத்துள் ஆண்பாற்கு உரியன எறு."
399,இள் கலை என்னும் மரபுப் பெயர் உழையினத்துள் ஆணுக்குரியதாய் வழங்கும்.
400,அம்மரபுப் பெயர் முசுஎன்னும் குரங்கினத்துள் நிலைபெற்று வழங்குவதாகும்.
401,மோத்தையுந் தகரும் உதளும் அப்பரும் யாத்த என்ப யாட்டின் கண்ணே.
402,யாத்தல்மிகவும் பொருட்பிணிப்புடையதாதல்.
403,இதனால் கிடாய் என்னும் ஆண்மை பற்றிய மரபுப்பெயரும் ஆட்டினத்திற் குரியதாய் வழங்கும் வழக்கு எனக்கொண்டார் பேராசிரியர்.
404,அப்பர் என்னும் பெயர் யாட்டினத்துள் ஆணுக்குரியதாய் வழங்கும் வழக்கு பிற்காலத்தில் வீழ்ந்தது என்றார் பேராசிரியர்.
405,சிறகு என்றது ஆகுபெயர்.
406,"புறம் , மலைபடு எனவும், உள்ளூர்க் குரீஇத் துள்ளுநடைச் சேவல் குறுந் எனவும் வரும், பிறவும் அன்ன."
407,மாயிருந் தூவி மயில் என்றதனான் அவை தோகை யுடையவாகிப் பெண்பால் போலுஞ் சாயலவாகலான் ஆண் பாற்றன்மை இலவென்பது கொள்க.
408,"எனவே, செவ்வேள் ஊர்ந்த மயிற்காயின் அதுவும் நேரவும்படுமென்பது."
409,"இங்குச் சிறகு என்றது, சிறகினையுடைய பறவையினத் தினைக் குறித்து நின்றது சினையாகுபெயர்."
410,அல் கடை என்பது அலங்கடை யென்றாயிற்று.
411,அல்கடைஅல்லாத விடத்து.
412,"மாயிருந்தூவி மயில் என்றதனான், அவை தோகை யுடையவாகிப் பெண்போலும் சாயல ஆகலான் ஆண்பாற்றன்மை இல என்பதுகொள்க என்றார் பேராசிரியர்."
413,ஆற்றலொடு புணர்ந்த ஆண்பாற் கெல்லாம் ஏற்றைக் கிளவி உரித்தென மொழிப.
414,இளம்பூரணம் இள் ஆற்றலுடைத்தாகிய ஆண்பாற் கெல்லாம் ஏற்றை யென்னும் பெயர் உரித்தென்றவாறு.
415,ஏற்புழிக்கோடல் என்பதனான் அஃறிணைக் கண்ணும் கொள்ளப்படும். பேராசிரியம் இள் ஏற்றையென்னுஞ் சொல் ஆற்றலொடு கூடிய ஆண்பாற்கெல்லாம் உரித்து எறு.
416,அவையும் அப்பெயரானே வழங்குதல் ஆற்றலுடையவாகத் தோன்றும்.
417,எல்லா மென்றதனாற் சிறுபான்மை ஆற்றல் இல் லாதனவுங் கொள்க.
418,இடுகாட்டு ளேற்றைப் பனை என்பது போன்று வருவன பிறவும் அன்ன.
419,எனவே ஏறு என்பதும் ஏற்றை என்பதும் ஆண்மை குறித்த இருவேறு மரபுப்பெயர் என்பது புலனாம்.
420,ஆண்பால் எல்லாம் ஆணெனற்குரிய பெண்பால் எல்லாம் பெண்ணெனற்குரிய காண்பவை அவையவை அப்பா லான.
421,வேழக்குரித்தென்னும் சூத்திர முதலாக இத்துணையும் ஆண் பெயர் கூறினார்.
422,இனிப் பெண்பெயர் கூறுகின்றாராகலின் அதிகாரப்பட்ட பொருள் சே.
423,"கடுவன், கண்டி என்பன சிறப்புச் சூத்திரத்தாகலின் அதற்குரியவெனக் கூறிற்றிலராலெனின் அவற்றுள் கடுவனும் கண்டியும் முன்னரெடுத்தோதப்படும்."
424,சே என்பது ஆவினுள் ஆணையே குறித்து வழங்கலின் ஓதாராயினார்.
425,"நீர்வாழ் சாதியுள் ஆண், வராற்போத்து, வாளைப் போத்து என வரும்."
426,"முசுவில் ஆண் கலை எனப்படும் குரங்கும், ஊகமும் இவ்வாறே கொள்ளப்படும் கடுவன் எனவும் வரும்."
427,"புள்ளினுள் மயிலாண் ஆண் எழால், சேவல், போத்து, ஏற்றை எனப்படும் புள்ளினுள் ஆணெல்லாவற்றிலும் மயிலல்லாதன வெல்லாம் சேவல்."
428,"ஏற்றை எனப்படும் ஓரறிவுயிருள் ஆண் பெண் என வேறுபடுத்தலாவன ஏற்றைப்பனை, ஆண்பனை எனவரும்."
429,"பேராசிரியம் இது, மேற்கூறிய ஆண்பாற் பெயர்க்கும் இனிவரும் பெண் பாற் பெயர்க்கும் புறனடை."
430,"அவை ஆண்யானை, பெண்யானை, ஆண்குரங்கு, பெண் குரங்கு, ஆண்குருவி, பெண்குருவி என்றாற்போல்வன இவை காணப்படும்."
431,"எனவே, இத்துணை விளங்கவாராது சிறுவர வினான் வருவனவுமுள இருபாலு மல்லாதனவென்பது."
432,"ஆணலி, பெண்ணலி எனவும், ஆண்பனை, பெண்பனை எனவும் வரும் பிறவும் அன்ன."
433,"இச்சூத்திரத்தில் ஆண், பெண் என்பன அஃறிணைக்கு உரியவாகக் கூறப்பட்டன."
434,மரபியல் முதல் முடிய ஆண்மை பற்றிய மரபுப் பெயர்களை வகுத்துரைத்தார்.
435,"சே.கடுவன், கண்டி என்பன ஆண்பெயர்."
436,அவற்றுள் சே என்பது பசுவினுள் ஆணினையே குறித்து வழங்குதலின் அதனைத் தனியே கூறிற்றிலர்.
437,ஏனையிரண்டும் இவ்வியல் அதிகாரப்புறனடையில் சூ விரித்துரைக்கப்படும்.
438,பிடியென் பெண்பெயர் யானை மேற்றே.
439,இளம்பூரணம் இனிப் பெண்பெயர் உணர்த்துகின்றார் இச்சூத்திர முதலாக.
440,இள் பிடி என்னும் பெண்பெயர் ஆனையின் மேலது என்றவாறு.
441,இள் பிடியென்னும் பெயர் யானைக் கண்ணதுஎறு பிடிபடி முருக்கிய பெருமரப் பூசல் அகம் என வரும்.
442,"பெய ரென்றதென்னை யெனின், அவை தொடங்கு கின்றதென்பது அறிவித்தற்கென்பது."
443,ஆய்வுரை இதுமுதல் முடியவுள்ள சூத்திரங்களால் பெண்மை பற்றிய மரபுப்பெயர் கூறுகின்றார்.
444,இள் பிடி என்னும் பெண்பாற் பெயர் யானையினத்துக்கு உரியதாகும் எறு.
445,"இனி, பெண்மை பற்றிய மரபுப்பெயர் கூறத் தொடங்கு கின்றாம் எனப் புலப்படுத்துவார்."
446,பிடி யென்னாது பிடியென் பெண்பெயர் என விரித்துக் கூறினார்.
447,பேராசிரியம் இள் ஒட்டகமுங் குதிரையுங் கழுதையும் மரையாவும் பெட்டையென்னும் பெயர்பெறும் எறு.
448,"ஒட்டகப்பெட்டை, குதிரைப்பெட்டை, கழுதைப்பெட்டை மரையான்பெட்டை என வரும்."
449,"எழுந்து விண்படரும் சிங்கப் பெட்டைமேல் இவர்ந்து எனவரும் சீவக சிந்தாமணிச் செய்யுளுரையில், ஒட்டகம்..."
450,புள்ளும் உரிய அப்பெயர்க் கென்ப.
451,இளம்பூரணம் இள் பெட்டை என்னும் பெயருக்குப் புள்ளிற் பெண்பாலு முரிய என்றவாறு.
452,"பேராசிரியம் இள் எல்லாம் புள்ளுப்பெட்டை யென்னும் பெயரான் வழங்குதற்குரிய எறு. அவை, கோழிப்பெட்டை மயிற்பெட்டை யென வரும்."
453,பிறவும் அன்ன.
454,ஆய்வுரை இள் பெட்டை என்னும் அப்பெண்மைப் பெயர்க்குப் பறவையும் உரியனவாம் எறு.
455,புள் பறவை இது புள்ளின் வைத்தமையாற் புள்ளின்பின் வருதல் பெரும்பான்மை.
456,பேராசிரியம் இள் பேடையும் பெடையுமென்னும் இரண்டும் முன்னர் நின்ற புள்ளிற்கு ஒன்றும் எறு.
457,"அவை குயிற்பேடை அன்னப்பெடை, என வரும்."
458,நாடின் என்றதனால் பெட்டை என்பது வழக்கினுட் பயிலா என்றார் பேராசிரியர்.
459,கோழி கூகை ஆயிரண் டல்லவை சூழுங் காலை அளகெனல் அமையா.
460,இளம்பூரணம் இள் கோழியுங் கூகையும் அளகெனப்படும்.
461,பெண்பா லான அப்பெயர்க் கிழமை மயிற்கு முரித்தே.
462,இளம்பூரணம் இள் அளகென்னும் பெண்பாற் பெயர் மயிலுக்குப் பெண்பாற்கும் உரித்து என்றவாறு.
463,பேராசிரியம் இள் கோழியுங் கூகையும் மயிலுமென்பனவற்றுக்கு அளகென்னும் பெயர் உரியது எறு.
464,"மனைவாழ் அளகின் வாட்டோடு பெறுகுவிர் பெரும்பாண் என்பது, கோழி, பிறவும் அன்ன."
465,"அளகுசேவலோடாடி சீவக எனவரும் பாடலுரை யில், அளகுகூகை காட்டுக்கோழியும் ஆம் என்றார் நச்சினார்க்கினியர்."
466,இள்அளகு என்னும் பெண்மைப் பெயரால் வழங்கப் பெறும் உரிமை ஒரோவழி மயிலுக்கும் உரியதாகும் எறு.
467,புல்வாய் நவ்வி உழையே கவரி சொல்வாய் நாடிற் பிணையெனப் படுமே.
468,இளம்பூரணம் இள் புல் வாய் முதலாகிய நான்கிற்கும் பிணை என்னும் பெண்மைப்பெயர் வழங்குதற்குரித்து என்றவாறு.
469,பேராசிரியம் இள் பிணையென்னும் பெண்பெயர்க்குரியன இவை நான்கும் எறு.
470,"ஆய்வுரை இள் புல்வாய், நவ்வி, உழை, கவரி என்னும் நான்கிற்கும் சொற்பொருளமைப்பினை ஆராய்ந்தால் பிணையென்னும் பெண்மைப்பெயர் உரியதாகும் எறு."
471,"சொல்வாய் நாடுதலாவது, சொல்லில் இடம் பெற்றுள்ள பொருட்பகுதியை ஆராய்தல்."
472,பன்றி புல்வாய் நாயென மூன்றும் ஒன்றிய என்ப பிணவென் பெயர்க்கொடை.
473,இளம்பூரணம் இள் பன்றி முதலாகிய மூன்றிற்கும் பெண்பாற்குப் பிணவு என்னும் பெயர் பொருந்திற்று என்றவாறு.
474,பேராசிரியம் இள் இவை மூன்று சாதியும் பிணவென்னும் பெயர்க் குரியன எறு.
475,ஒன்றிய என்றதனான்.
476,ஈருயிர்ப் பிணவின் வயவுப்பசி களைஇய அகம் எனப் புலிக்குங் கொள்க பிறவும் அன்ன.
477,பிணவல் எனினும் அவற்றின் மேற்றே.
478,இளம்பூரணம் இள் பிணவல் என்று சொல்லினும் மேற்சொல்லப் பட்ட வற்றின் மேல என்றவாறு.
479,பேராசிரியம் இள் பிணவல் என்பதூஉம் அம்மூன்றற்கும் உரித்து.
480,இரியற் பிணவற்றீண்டலின் அகம் என்பது பன்றி.
481,நான்முலைப் பிணவல் சொலியக் கானொழிந்து அகம் என்பதுவும் அது ஒழிந்தனவும் அன்ன.
482,"ஆய்வுரை இள் பிணவல் என்ற பெண்மைப் பெயரும் மேற்குறித்த பன்றி, புல்வாய், நாய் என்னும் அம்மூன்றிற்கும் உரியதாகும்."
483,பெற்றமும் எருமையும் மரையும் ஆவே.
484,இளம்பூரணம் இள் ஆ என்னும் பெண்பெயர் பெற்றம் முதலாகிய மூன்றிற்கு முரித்து என்றவாறு.
485,இள் ஆவென்னும் பெயர் பெற்றமும் மரையும் எருமையும் எ று.
486,"ஆய்வுரை இள் ஆ என்னும் பெண்மைப்பெயர் பெற்றம் பசு எருமை, மரை என்னும் மூவின உயிர்கட்கும் உரியதாகும் எறு."
487,அங்ஙனம் தழுவிக் கொண்டமை பற்றியே அம்மரபுப் பெயரினை ஆசிரியர் இங்கு வகுத்துரைக் கின்றார் என்பது பேராசிரியர் தரும் விளக்கமாகும்.
488,பெண்ணும் பிணவு மக்கட் குரிய.
489,இளம்பூரணம் இள் பெண்ணென்னும் பெயரும் பிணவு என்னும் பெயரும் மக்களிற் பெண்பாற் குரித்து என்றவாறு.
490,பேராசிரியம் இ ள் பெண்ணும் பிணாவும் உயர்திணைப் பெண்மைக் குரிய எறு.
491,"பெண்ணென்பது, பெண்பா லெல்லாம் பெண்ணெனற் குரிய தொல்."
492,"மர என்றமையின், ஈண்டுக் கூறுதலின் மிகையாம் பிறவெனின், அற்றன்று அச்சூத்திரம் அஃறிணை யதிகாரமாகலின், ஈண்டு விதந்தோதினானென்பது."
493,"ஓன்றென முடித்த லென்பதனான், உயர்திணை ஆணென்பதும் ஈண்டே கொள்ளப்படும்."
494,"பெண்கோ ளொழுக்கங் கண்கொள நோக்கி அகம் எனவும், ஈன்பிண வொழியப் போகி பெரும்பாண் எனவும் வரும்."
495,ஆண்கட னாகலிற் பாண்கட னாற்றிய புறம் என ஆணென்பது உயர்திணைக்கண் வந்தது.
496,பிறவும் அன்ன.
497,பிணாவென்னும் ஆகாரவிறுதி வன்கணமன்மையிற் குறியதன் இறுதிச் சினைகெட்டு உகரம்பெறாது நின்றது.
498,"மக்கட்குரிய வெனவே, உரியவன்றித் துறுகல் விடரளைப் பிணவுப்பசி கூர்ந்தென அகம் எனப் புலி முதலியன வற்றிற்குங் கொள்க."
499,ஆய்வுரை இள் பெண் என்னும் பெயரும் பிணவு என்னும் பெயரும் மக்களினத்திற் பெண்பாற்குரிய மரபுப் பெயர்களாம் எ று.
500,பெண்ணும் பிணாவும் மக்கட்குரிய என்ற பாடம் கொண்டார் பேராசிரியர்.
501,கோயிற் பிணாப்பிள்ளைகாள் திருவெம்பாவை எனத் திருவாசகத்தில் பிணா என்னும் பெண்மைப்பெயர் மக்கட் குரியதாக வழங்கியுள்ளமை காண்க.
502,எருமையும் மரையும் பெற்றமும் நாகே.
503,இளம்பூரணம் இள் எருமை முதலாகச் சொல்லப்பட்ட மூன்றிற்கும் நாகு என்னும் பெண்பெயர் உரித்து என்றவாறு.
504,நீர்வாழ் சாதியுள் நந்தும் நாகே.
505,இளம்பூரணம் இள் நீர்வாழ்வனவற்றுள் நந்தென்பதூஉம் நாகு என்னும் பெண்பெயர் பெறும் என்றவாறு.
506,பேராசிரியம் இள் இந்நான்கற்கும் நாகெனும் பெயர் உரித்து எறு.
507,"ஆய்வுரை இள் நாகு என்னும் பெண்மைப்பெயர் எருமை, மரை பெற்றம் என்னும் மூன்றினத்திற்கும் உரியதாகும்."
508,சோமசுந்தரம் பிள்ளையவர்கள் குறிப் பிட்டுள்ளார்.
509,அவர்கள் பதிப்பித்த இளம்பூரணர் உரையில் இப்பாடமும் விளக்கமும் இடம் பெறவில்லை.
