Line Number,Sentence
1214,உளங்குமுறிப் பார்த்திருப்போம் உழைத்த பலன் காணோம்!,False
1215,உழைப்பவர்கள் கதியிதுவோ உரைத்திடுவீர்நீதி!,False
1216,தயங்குகின்றீர் ஏனிதனைச் செய்வதற்கே நீங்கள்?,False
1217,ஆதலினால் எமக் குரிமை வேண்டும் எனக் கேட்டார் அவர் உரிமை கோருவதில் தவறுண்டோ சொல்வீர்!,False
1218,"வேதனைகள் படும் உழவர் துன்ப மெலாம் நீங்கின், விளைபொருள்கள் மிகப் பெருகும் சாந்தி நிலை கொள்ளும்.",False
1219,துன்பமெனும் கடல் கடக்கக் கப்பல் துணை காணோம் இன்பமெனும் கரை சேர்தற் கிச்சை மிக வுடையோம்.,False
1220,தரிசு நிலம் வளம்படுப்போம் தானியங்கள் விளைப்போம் அரிசிகிடை யாமல் துயர் அடைந்திருப்போம் நாங்கள்.,False
1221,எட்டடுக்கு மாளிகைள் எழுப்பிவைப்போம் நாங்கள் கட்டடங்கள் இன்றிவெய்யில் கடுங்குளிரால் மாய்வோம்.,False
1222,ஆடுகளும் மாடுகளும் வளர்த்திருப்போம் நாங்கள் வாடுமிளங் குழந்தைகட்கும் பாலுட்டும் வகையறியோம்.,False
1223,பூமியினுள் உள்ள பொருள் கொணர்ந்திடுவோம் நாங்கள்.,False
1224,சேமமுடன் வாழ்தல் இலோம் சிரமமுற்றோம் நாங்கள்.,False
1225,கடல்கடந்து குடிபுகுந்து நிதிவிளைப்போம் நாங்கள் உடல் இளைப்போம் உயிர் துடிப்போம் உணவுபெறோம் நாங்கள்.,False
1226,காடுகளும் வளர்த்திடுவோம் கழனிகளும் செய்வோம் வீடுவெறும் வழியறிவோம் வீணுழைப்பில் மடிவோம்.,False
1227,ஒரு வினைக்கும் உதவாத பொருளையெல்லாம் உழைப்பால் பெருநலங் கொள் பல பொருளாய்ச் செய்தமைத்தோம் நாங்கள்.,False
1228,அப்பொருளை அனுபவித்து மகிழ்வதில்லை நாங்கள் எப்பொழுதும் வறுமையினால் ஏங்கிடுவோம் நாங்கள்.,False
1229,ஊரார்கள் உழைப்பினிலே உயிர் வளர்க்கும் மாந்தர் பேராசை கொண்டம்மைப் பெருந்துயரில் வைத்தார்.,False
1230,மக்கள்மனை படுதுயரைப் பார்த்தறியோம் மனத்துள் அக்கணத்தே புரிவதொன்றும் அறியாமல் அயர்வோம்.,False
1231,சாக்கடையும் குப்பைகளும் சார்ந்திருக்கும் குடிலில் நீக்கமறும் பிணிகளுடன் நிலைகுலைவோம் நாங்கள்.,False
1232,செல்வரிலை வறியரிலை கொடியரிலை எனவே நல்வகையில் உலகிருக்க நாமுழைப்போம் இனியே.,False
1233,லோகோபகாரி .. உழைப்பே உயர்வு இன்பம் உண்டு துன்பம்இல்லை என்னும் எண்ணம் கொள்ளுவோம்!,False
1234,அன்புகொண்டு பேதம் நிங்க நற்பணிகள் ஆற்றுவோம்!,False
1235,தன்சுகத்தை மட்டும்நாடித் தளர்வடையும் மாந்தரே!,False
1236,கண்விழித்துக் கண்டுகொள்வீர் உலகியற்கைக் காட்சியை!,False
1237,ஆண்மை யுடன்செயல் செய்யமுன் நிற்பாய்!,False
1238,கச்சையை நன்கு வரிந்து நீகட்டி காரண காரியம் கண்டு புரிவாய்!,False
1239,சத்தியை நழுவிடச் செய்வது வேண்டாம்!,False
1240,சந்ததம் ஊக்கம் கொண்டு முயல்வாய்!,False
1241,எத்தொழில் செய்யினும் யாவினும் வெற்றி எய்துதல் நிச்சயம் என்ப துணர்வாய்!,False
1242,ஆதிதிரம் கொண்டெதும் செய்திடல் வேண்டாம்!,False
1243,அறிவில் உணர்ந்தபின் செய்கை புரிவாய்!,False
1244,நேத்திரம் யாவினும் சோர்வின்மை கண்டாய்!,False
1245,நீயிந்த உண்மை மறந்திடல் வேண்டாம்!,False
1246,"லோகோபகாரி, தீபாவளி மலர் சாத்திரம் பார்த்து வினைசெயல் ஏனோ?",False
1247,சமயம் இடம்பொருள் கண்டு புரிவாய்!,False
1248,காத்திரன் ஆகிய வெற்றி பெறுவாய்!,False
1249,கலக்கம் இன்றிநற் காரியம் செய்வாய்!,False
1250,மூக்கின் மேல் விரல் வைத்தார் உலக மக்கள்.,False
1251,"ஆண்ட வனின் வடிவந்தான் சத்யம், அன்பு, அறிந்திடுவீர்!",False
1252,ஒன்றாகிக் கூடி வாழ்வீர்!,False
1253,வேண்டாமே மனிதர்க்குள் கலகம் என்றார் விவேகமே உருவெடுத்த மாகாத்மா காந்தி.,False
1254,நாமார்க்கும் இனிஅடிமை ஆகமாட்டோம் என்னுமொரு ஞானநீர் அருந்தி நிற்பீர்!,False
1255,சேமம்உற வழி காட்டும் இந்த ஞானம்!,False
1256,சிறிதும் இதை மறவாதீர் என்றார் காந்தி.,False
1257,கதிரவர்கள் பலகோடி சேர்ந்து நின்றே காசினியில் ஒளிபரப்பி மறைந்தார் போல அதிக புகழ் உடனிங்கே இருந்து சென்றார்.,False
1258,அப்பெரியார் காந்தி மகான் தன்மை கேளீர்!,False
1259,லோகோபகாரி தீபாவளி மலர் .,False
1260,சென்றவரை நாம்நினைந்து செய்யும் வேலை சிறப்பாக அவர்வழியில் நடப்ப தொன்றே!,False
1261,தீது வரும் முன்னறிந்து காத்தல் வேண்டும் தீர்க்கதரி சனம் இதுவே தெரிந்து கொள்வீர்!,False
1262,ஓதுகிறேன் அனைவருமே ஒன்றாய் வாழ்வோம் உயர்வான உண்மைநெறி கண்டு கொள்வோம்!,False
1263,மோதுதலை விட்டொழிப்போம்!,False
1264,மோசக்காரர் மொழி நம்பி முரடர்களாய் மாற வேண்டாம்!,False
1265,வேதனையால் உடல்நெஞ்சம் சோர்வ டைந்தே வீழ்கின்றார் துயர்தீர்ப்பீர்!,False
1266,என்றார் காந்தி.,False
1267,உத்தமராம் காந்தி மகான் பெயரைச் சொல்லி ஊரையெலாம் ஏமாற்றும் வஞ்ச மக்காள்!,False
1268,சத்தியமாய்ச் சொல்கின்றேன் மனதிற் கொள்வீர்!,False
1269,"சதிகாரர் என்றும்மை மக்கள் கண்டால், பத்திரமாய் உயிர்வாழ விடவே மாட்டார்!",False
1270,பாமரர்கள் கோபத்திற் காளா காதீர்!,False
1271,இத்தனைநாள் இழைத்தபல தீமை போதும் இனியேனும் நல்வழியில் நடந்து கொள்வீர்!,False
1272,லோகோபகாரி .. ஆ!,False
1273,என்ன அழகு!,False
1274,தெளிவீர் உண்மை!,False
1275,"தன்னலம் இன்றித் தரணியோர்க் கெல்லாம் இளநீர், தேங்காய், எண்ணெய்,ஓலைகள் வளம்பெறத் தந்து வாழ்வது காண்மின்!",False
1276,இம்மர மாண்புகள் எல்லாம் கண்டோர் தம்மனக் களிப்புத் தாங்காது அம்மரச் சோலையில் உலவுதல் அறிமினோ!,False
1277,அறிவுக்கொடி கலை உணர்ச்சி இயற்கையிலே பொங்கிவரும் அழகுக்கு நிகராக எக்கலையும் தலைநிமிர்ந்து நிற்பதிலை இதை உணர்வீர்!,False
1278,"மக்களொலம் இருள்வழியைக் கடந்தேறி ஒளிகண்டு, மகிழ்ச்சியுடன் வாழ்வதற்கு வழிகாட்டும் இலக்கியமே.",False
1279,மிக்கவனப்புடையனவாய் வாழ்கின்ற மெய்க்கலையாம் மேன்மைமிகு கருத்துரைகள் உதிர்க்கும் இதில் ஐயமில்லை.,False
1280,நலமென்று வெறுங்காமச் சுவைபுனைந்து கவிபாடி நாசவழி போதிக்கும் ஆபாச நூலைப்போல் விலகென்று கண்டிப்பாய்வெறுத்தொதுக்கித்தள்ளிவிட வேண்டியதே அக்கலைதான் கண்டுணர்வீர்.,False
1281,லோகோபகாரி .. திரைப்படத்தின் தெளிவுரை படக்காட்சி என்னுமொரு பகைவன் தோன்றி நாடகத்தைப் பாழாக்கி விட்டான் என்றார் அடசனியே!,False
1282,லோகோபகாரி தீபாவளி மலர் இன்பநெறி செல்வக் கல்வியிற் சிந்தையைச் செலுத்திப் பல்வகைக் கலைகளும் பலகறப் பயில்வோம்!,False
1283,"பிறநா டுறைவோர், பெருஞ்செயல் அனைத்தையும் திறமுடன் ஆய்ந்து பலநலம் தெளிவோம்!",False
1284,செயற்கைப் பொருள்கள் செய்வகைகள் அறிய இயற்கையின் மாண்புள் எல்லாம் உணர்வோம்!,False
1285,இது என் தாய்நிலம் இவர் என் சோதரர் இது என் தாய் மொழி என மனங் கொள்வோம்!,False
1286,மன்னுயிர் யாவும் நன்னிலை வாழ்வுறப் பன்னலம் இயற்றப் பரிவுடன் புகுவோம்!,False
1287,ஆக்கம் அதர்வினாய்ச் செல்லும் அசைவிலா ஊக்கம் உடையான் உழை எனும் மொழியை உண்மையாய்க் கொள்ளுவம்!,False
1288,குறிப்பு இல் சாமி.சிதம்பரனார் அவர்கள் எழுதி வெளியிட்ட படிவம் பாட புத்தகத்தில் வெளிவந்த செய்யுள்.,False
1289,நாட்டின் மேன்மை தமிழறிஞர் திரு.,False
1290,இனிய புதிய தமிழகத்தை ஏற்படுத்த முந்துவோம்!,False
1291,ஏழை அடிமை நிலைமை மாற்றி எவரும் ஒன்றாய் வாழுவோம்?,False
1292,மனிதர் தம்மை மனிதர் ஏய்க்கும் மாயவாழ்வை வீழ்த்துவோம்!,False
1293,மக்கள் வாழ்வில் இன்பம் வளரும் வழிகள் கண்டு மகிழுவோம்!,False
1294,அன்னியர்கள் நமது நாட்டில் ஆட்சி செய்ய இனிவிடோம்!,False
1295,அவர்கள் தோட்டம் தொழில்கள் யாவும் நமக்குச் சொந்தம் ஆக்குவோம் இன்னும் உழவர் வாழ்வை உறிஞ்சும் முறைமை நாட்டில் இருப்பதா?,False
1296,இந்த நிலையை நீக்கி உணவுப் பண்டம் பெருக் வழி செய்வோம்!,False
1297,"தமிழில் ஆட்சி, தமிழில் கல்வி தாயகத்தில் நாட்டுவோம்!",False
1298,தரணியெங்கும் தமிழைக் கலையைப் பண்பைப் புகழைப் பரப்புவோம்!,False
1299,தமிழர் என்று தலை நிமிர்ந்தே உரிமையோடு வாழுவோம்!,False
1300,தயக்கம் இன்றிப் பிறரும் நமது நிலையில் வாழ உதவுவோம்!,False
1301,குறிப்பு ஆம் ஆண்டு வெளிவந்த திரு சாமி.,False
1302,அறிவை நல் வாழ்க்கையை விளக்கும் அணையாத விளக்கு.,False
1303,அறிவின் ஒளியால் நம்மிடம் காலமெல்லாம் பேசும் புதுக்குறள்.,False
1304,சிதம்பரனார் அவர்கள் எழுதி வைத்திருக்கும் கை எழுத்துப் பிரதிகளாக உள்ள நூல்களில் முதலில் வெளியிடப் படும் நூல் இது.,False
1305,புதுக்குறள் எனும் இந்த ஒப்பற்ற நூல் ல் எழுதி முடிக்கப்பட்டது.,False
1306,நூலாசிரியரின் புலமை நிறைந்த முன்னுரை யுடன் கூடியது.,False
1307,இத்தனை ஆண்டுகளாக வெளியிடப்பட முடியாமலோ இருந்தது.,False
1308,நூல்களை வெளியிடும் வேலைகளைக் கவனிப்பதால் தனது எழுதும் நேரம் குறையுமே என்ற எண்ணம்.,False
1309,நல்ல முன்னுரைகளடங்கிய இருபதிற்கு அதிகமான கையெழுத்துப் பிரதிகள் இன்னும் தொடமர்ந்து நூல்வடிவில் வெளியிட வேண்டிய கடமையும் நம்முன் இருக்கிறது.,False
1310,சிதம்பரனார் அவர்கள் காணமுடியாமல் நம்மைவிட்டுப் பிரித்து விட்டது!,False
1311,பொல்லாத இயற்கை.,False
1312,தமிழ்ப் பெரியார் மறைந்தாரா?,False
1313,"நமக்கு விட்டிருக்கும் வேலைகளை, ஆவல் மிகுந்த இலட்சியங்களை நினைவுகளை, யாவும் நாம் நல்ல முறையில் நிறைற்ற வேண்டும்.",False
1314,அதுவே எனது ஆறுதல்.,False
1315,சீக்கிரத்தில் தொடர்ந்து நூல்கள் வெளியிடப் படும்.,False
1316,வேண்டுவது வாசக அன்பர்களின் ஆதரவே.,False
1317,அன்புடன் இந்தநூல் வெளியிட முன்வந்த என்.சி.பி.எச்.,False
1318,பிரைவேட் லிமிடெட் நூல் வெளியீட்டாளருக்கு நன்றி.,False
1319,வது தெரு சவுராஷ்டிர நகர் சிவகாமி சிதம்பரனார்.,False
1320,சென்னை இலக்கிய நிலையம் நூலாசிரியர் முன்னுரை புதிய கருத்துக்களைக்கொண்டது புதுக்குறள்.,False
1321,பாட்டு பழய குறள் வெண்பாதான்.,False
1322,குறள் என்பது ஒருவகைப் பாடலின் பெயர்.,False
1323,இரண்டு வரிகள் அடிகள் கொண்ட வெண்பாப் பாட்டுக்குக் குறள் வெண்பா என்று பெயர்.,False
1324,பழங்குறள் திருவள்ளுவரால் செய்யப்பட்ட திருக்குறள்.,False
1325,அது அதிகாரங்களைக்கொண்டது.,False
1326,அதன் பாடல்கள் .,False
1327,அது எழுதப்பட்ட காலம் ஏறக்குறைய ஆண்டுகளுக்கு முன்.,False
1328,அக்காலத்துப் பழக்க வழக்கக்கங்களை அதன் மூலம் அறியலாம்.,False
1329,இது புதிய காலம்.,False
1330,மக்கள் பல வகையில் மாற்ற மடைந்துவிட்டனர்.,False
1331,ஆண்டுகளுக்கு முன்னிருந்த பழக்க வழக்கங்களிலே பல இப்பொழுது மறைந்துவிட்டன.,False
1332,பழங்காலத்து நீதிகளிலே சில இன்று அநீதிகளாகக் கருதப்படுகின்றன.,False
1333,"மக்களின் மனப்பான்மையும், நடத்தையும் மாறிவருவது போலவே, மக்களின் நீதியும், ஒழுக்கமுங்கூட மாறிக்கொண்டு வருகின்றன.",False
1334,இவ்வாறு மாறுவது இயல்பு மாற்றத்தைத் தடுக்கமுடியாது மாற்ற மில்லாவிட்டால் நாகரிகமில்லை.,False
1335,"இந்தப் புதுக்குறளிலே, பழங்குறளுக்கு மாறான கருத்துக்களும் உண்டு.",False
1336,இது கால மாறுபாடு.,False
1337,இக்காலத்து மக்களின் எண்ணங்களையும் கொள்கைகளையும் பிற்காலத் தாரும் அறிந்துகொள்வதற்காகவே இக்குறள் எழுதப்பட்டது.,False
1338,காலத்திற்கேற்ற கருத்துக்களைக் கூறவேண்டும் என்பது தான் இந்தப் புதுக்குறளின் நோக்கம்.,False
1339,எல்லாப் புதிய கருத்துக் களும் இதில் அடங்கி விட்டன என்று சொல்லுவதற்கில்லை.,False
1340,ஒரு சில கருத்துக்கள்தான் உரைக்கப்பட்டிருக்கின்றன.,False
1341,சொல்லப்பட்டவை சில சொல்லாமல் விடப்பட்டவை பல என்று சுருக்கமாகக் கூறிவிடலாம்.,False
1342,எல்லாப்பொருளும் இதன்பால் உள இதன்பால் இல்லாத எப்பொருளும் இல்லையால் என்று வள்ளுவர் பழங்குறளைப்பற்றி அறிஞர்கள் பாராட்டிக் கூறியிருக்கின்றனர்.,False
1343,அத்தகைய அரும்பெரும் செந்தமிழ்த் திருக்குறளுக்கு இது எந்த வகையிலும் ஈடாகாது.,False
1344,திருக்குறள் ஒரு பூரணச் சந்திரன்.,False
1345,இப்புதுக்குறள் ஒரு மின்மினிப்பூச்சி.,False
1346,வள்ளுவர் குறள் ஒரு செங்கதிர் இப்புதுக்குறள் ஒரு தீப்பொறி.,False
1347,ஓய்வு நேரத்தில் அவ்வப்போது எண்ணிய செய்திகளை அமைத்துப் பாடியதே இப் புதுக்குறள்.,False
1348,"சிந்திப்பதற்குப் போதுமான நேரமும், வசதியும் உள்ளவர்களே சிறந்த நூல்களை எழுதமுடியும்.",False
1349,வாழ்க்கைப் போராட்டத்தில் உழல்பவர்கள் உயர்ந்த கருத்துள்ள நூல்களை எழுதுவது அரிது.,False
1350,எப்படியோ சிறு பிள்ளைகள் வீடு கட்டுவதுபோல் காமாச் சோமாவென்று இதைஎ ழுதிமுடித்தேன்.,False
1351,"இப்புதுக்குறள் நான்கு இயல்களைக்கொண்டது.அவை அரசியல், சமூகவியல், அறிவியல், பொதுவியல் என்பன.",False
1352,எல்லார்க்கும் புரியும் எளிய நடையிலே பாடல்கள் இருக்கவேண்டும் என்பது என் ஆசை.,False
1353,கூடியவரையிலும் எளிய சொற்களை அமைத்தே பாடல்களை எழுதியிருக்கிறேன்.,False
1354,பெரிய செய்திகளை சிறிய இரண்டடிகளிலே அமைத்து எழுதுவது அவ்வளவு எளிதல்ல.,False
