Line Number,Sentence
1932,கரந்தை மருத்துவச்சியம்மாள் மிக்க அநுபவமுடையவளே.
1933,ராஜமும் குழந்தையும் நலமாக இருந்து வருவது மகிழ்ச்சிக்குரியது.
1934,சோதிடர் இலட்சுமணராவ் குழந்தையின் ஜாதகக் குறிப்பைக் குறித்து இன்று கொண்டு வந்தார்.
1935,ஜாதகம் மிகவும் சிறப்பாக இருக்கின்றது எனத் தெரிவித்தார்.
1936,சுந்தரத்திற்கு முழந்தாளில் ஏற்பட்ட புண் பெரிதாகித் துன்புறுத்துகின்றது.
1937,வலிபொறுக்க முடியாது இரவு பகலாகக் கதறி அழுகின்றான்.
1938,"சொக்கலிங்கம் பிள்ளையிடம் காட்டி வந்ததை மாற்றி, இவ்வீதியிலுள்ள மற்றொரு ஆங்கில மருத்து வரிடம் இன்று காட்டுகிறது."
1939,மக்கட்கு ஏதாவது ஒருவகையில் துன்பம்.
1940,பாடப்புத்தகங்கள் பிப்ரவரியில் அங்கீகாரம் ஆனவுடன் அச்சிடுதற்கு இப்பொழுதே காகிதம் வாங்கி வைத்திருக்க வேண்டும்.
1941,காகிதவிலை மிக ஏறிவிட்டதுடன் கிடைப்பது அரிதாகவும் உள்ளது.
1942,இப்பொழுதுள்ள நிலைமையில் அச்சிடாது நிறுத்த நேரினும் நேரும்.
1943,நாளில் நிலைமை தெளிவுபடும்.
1944,மணிமேகலை உரை முதல் காதைகள் அச்சிடுதற்கு இன்று கழகத்திற்கு அநுப்பப்பெற்றன.
1945,சுந்தரம் வலிபொறுக்க முடியாமல் கதறிக் கொண்டி ருக்கிறான்.
1946,ஆங்கிலமுறையும் தெரிந்த முத்துரத்தின முதலியார் என்ற தமிழ் மருத்துவரை இன்று அழைத்து வந்தது.
1947,"அவர் புண்களைத் தூய்மை செய்து, தாம் செய்து வைத்திருக்கிற இரணவீர் என்னும் தயிலத்தைப் பூசிக்கட்டிச் சென்றார்."
1948,இன்று மாலை வரையில் அழுகையின்றி இருந்தான்.
1949,பின் வழக்கம் போல் அழ ஆரம்பித்தான்.
1950,இன்று ராஜத்திற்குத் தலைக்கு நீர் விட்டுப்புண்ணிய வாசனஞ் செய்து வீட்டிற்கு அழைத்தது.
1951,குழந்தையின் நலங்கருதி நவக்கிரக சாந்தியும் ஆயுள் ஓமமும் செய்யப்பெற்றன.
1952,இடைவிடாத மழையும் மிக்க குளிருமாயிருந்தும் ராஜத்திற்குத் தொந்தரையொன்றும் ஏற்படாமை கடவுளின் அருளே.
1953,மருத்துவர் முதலியார் நாள் தோறும் வந்து கட்டி வந்ததில் சுந்தரத்திற்கு இன்றுதான் சீழ்வடிதல் நின்றிருக்கிறது.
1954,இன்று கார்த்திகை விரதம் இனிது நிறைவேறியது.
1955,திருக் கார்த்திகை இன்று பகல் இரவெல்லாம் மழையும் புயற்காற்று மாக இருந்தன.
1956,சிவப்பிரகாசத்திற்குத் திருவையாற்று வேலையின் பொருட்டு இன்று திரு .
1957,கிருஷ்ணசாமிவாண்டையாரவர் களைப் பார்த்தேன்.
1958,நாடிமுத்துப் பிள்ளையவர்களைப் பார்க்க முடியவில்லை.
1959,சென்னை .
1960,வினாக் கடிதம் இன்று அநுப்பப் பெற்றது.
1961,அப்துல்கரீம் சாகிப் புலவர் என்பவர் இன்று வந்தனர்.
1962,சித்திரச் செய்யுட்கள் இயற்றும் ஆற்றலும் கணிதப் புலமையு முடையவர்.
1963,ஒன்பது மக்களையுடைய குடும்ப வாழ்க்கையுடன் வறுமையால் வாடுபவர்.
1964,அவருக்கு இரண்டே ரூபாய் இன்று கொடுக்கப் பெற்றன.
1965,இராமசாமி பிள்ளை இன்று வந்து மனை சம்பந்தமான ஆதரவுகளைக் கொடுத்தார்.
1966,டிசம்பர் ஜப்பான் அமெரிக்காவோடு போர் தொடங்கிப் பல இடங்களைத் தாக்குவதாகச் செய்திகள் வருகின்றன.
1967,ஆகவே உலக முழுதும் போரில் ஈடுபட்டுவிட்டன.
1968,இனி என்னென்ன விபரீதங்கள் நிகழுமோ?
1969,சிங்கப்பூரில் பிரமாண்டமான பிரின்ஸ் ஆப் வேல்ஸ் என்னும் பிரிட்டிஷ் போர்க்கப்பலை ஜப்பான் மூழ்கடித்து விட்டதாம்.
1970,தேவகோட்டையில் குழந்தை பார்வதியம்மாளுக்கு உடம்பு மிகவும் அசௌகரியமாயிருப்பதாக இன்று கடிதம் வந்தது.
1971,திருச்சி ஜங்ஷனில் மணி நேரத்திற்கு வண்டி கிடைக்கவில்லை.
1972,வழி விசாரிப் பதற்குத் தெருக்களில் ஆள் நடமாட்டமும் இல்லை.
1973,இந் நிலையில் எப்படியோ மைல் தூரம் நடந்து சென்று மனையை அடைந்தோம்.
1974,பார்வதி யம்மாள் படுக்கையில் இருந்தது.
1975,மங்கிய குரலாகப் பேசிற்று.
1976,நோய் கடுமையாயும் அஞ்சுமாறும் இருந்து சிறிது வேகம் தணிந்திருப்பது தெரிந்தோம்.
1977,இன்று லேடி டாக்டரால் என்னும் பால் இஞ்சக்ஷன் பார்வதியம்மாளுக்குச் செய்யப் பெற்றது.
1978,"வெட்டைச் சூட்டினால் குடல் முழுதும் வெந்திருப்பது தெரிந்து, அதனை மாற்றுவதற்கு இது செய்யப்பெற்றது."
1979,ஊசிபோட்டு மருந்துண்பதனால் பார்வதியம்மாளுக்கு உடம்பு குணமடைந்து வருகிறது.
1980,ஒரு மாதமாக இருந்த தலைவலி இன்றுதான் நின்றுளதாம்.
1981,பகல் மணிக்குப் புறப்பட்டு இரவு மணிக்குத் தஞ்சை வந்து சேர்ந்தேன்.
1982,ஜப்பான் போர் மிகக் கடுமையாகி வருகிறது.
1983,பர்மாவிலும் அடி வைத்துள்ளார் களாம்.
1984,இந்தியாவிலும் விமானப் படையெடுப்பு நிகழ்வதை எதிர்பார்த்துக் கல்கத்தாவில் உள்ளவர்களை உள்நாட்டுக்கு வெளியேற்றுகிறார்களாம்.
1985,சென்னையிலும் குண்டுகட்குப் பதுங்கக் கூடிய நிலவறைகள் அமைக்கின்றார் களாம்.
1986,"சென்னையிலும், நாகையிலும் உள்ள ஜனங்கள் வெவ்வேறிடங் களுக்குக் குடியேறுகின்றார்களாம்."
1987,இந்நிலையில் உள்நாட்டுக் குழப்பமும் மிகுகின்றது.
1988,சில நாட்களின் முன் மதுரையில் கடைகள் சூறையாடப் பெற்றன.
1989,இதுபோலும் செய்கை எங்கும் பரவிவருகிறது.
1990,"நாகையிலும், சென்னையிலும் சூறையாடல் நிகழ்ந்ததாக இன்று பத்திரிகையில் வெளியாகி யிருக்கிறது."
1991,இவற்றிற்குப் பஞ்சமும் விலையேற்றமும் காரண மாகும்.
1992,வியாபாரிகள் பேராசையினால் பண்டங்களின் விலையை மிக ஏற்றுவதே இதற்கு முதன்மைக் காரணமாகும்.
1993,இன்றும் ஒரு மாதத்திற்குள் என்னென்ன நிகழுமோ?
1994,யார் அறிவார்?
1995,திருச்சிராப்பள்ளியில் நேற்றுத் தமிழ் இசைமாநாடும் இன்று தமிழ்ப்புலவர் மாநாடும் நடைபெற்றன.
1996,"யானும் இங்குள்ள அன்பர் சிலரும் இன்று வைகறை மணிக்கே எழுந்து, நீராடிவிட்டுக் காலை மெயிலில் திருச்சி சென்றோம்."
1997,தமிழ்ப் புலவர் மாநாட்டைத்திறக்கும் பொறுப்பு எனக்கிருந்தது.
1998,காலை மணிக்குத் தொடக்கம் கா.
1999,பிள்ளையவர்கள் கொடி யேற்றினர்.
2000,நான் திறந்து வைத்தேன்.
2001,தலைவர் சோமசுந்தர பாரதியார்.
2002,முனிசிபல் நாடகக் கொட்டகை முழுதும் கூட்டம் நிரம்பியிருந்தது.
2003,ஒலிபெருக்கியும் வைக்கப்பட்டிருந்தது.
2004,தமிழ் பற்றிய கிளர்ச்சி மிகுதியாகவே இருந்தது.
2005,தமிழ் வளர்ச்சிக்குப் பார்ப்பனர் தடையாயிருக்கின்றன ரென்பதையே பலரும் பல படியாகப் பேசினர்.
2006,"எது எவ்வாறாயினும், சமயப் பற்றும் சமய மரியாதையும் குறைந்து வருவது வருந்தத்தக்கது."
2007,தலைவராய் இருந்த பாரதி நாவை அடக்கியோ மரியாதையாகவோ பேசுமியல்பில்லாதவர்.
2008,அவருடைய பேச்சு என்னளவில் மிக்க அருவருப்புடையதே.
2009,இம் மாநாடுகளைத் திறம்பட நடத்திய பொறுப்பு கி.
2010,விசுவநாத பிள்ளையைச் சேர்ந்தது.
2011,இரவு மெயிலில் மணிக்கு மேல் தஞ்சை வந்து சேர்ந்தோம்.
2012,இன்று காலை மணிக்கு என் பெயரக்குழந்தைக்குச் சிறப்பாகக் காப்பிடும் விழா நடைபெற்றது.
2013,புதல்வன் நடராஜன் லேயே நீலகிரியிலிருந்து இங்கு வந்திருக்கின்றான்.
2014,"தேவ கோட்டையிலிருந்து மாப்பிள்ளை, புதல்வி, பேரக் குழந்தைகள் யாவரும் நேற்று வந்து சேர்ந்தனர்."
2015,உறவினர்கள் இன்று வந்தனர்.
2016,பகல் உணவிற்குப் புலவர் கல்லூரி மாணவர்கள் அழைக்கப் பெற்றிருந்தனர்.
2017,விருந்து கூடிய வரை சிறப்பாகவே நடைபெற்றது.
2018,குழந்தைக்குத் திருஞானவள்ளல் என்னும் வேங்கடசாமி என்று பெயரிடப் பெற்றது.
2019,திருவருள் துணை.
2020,"ஆனால் ஊசிபோட்ட சிறிது பொழுதுக் கெல்லாம் வயிற்றுப் போக்கும் வாந்தியும் படபடப்பும், மயக்கமும் ஏற்பட்டு மிகுந்த அச்சம் விளைத்தது."
2021,எல்லையம்மன் கோவில் தெருவில் இருக்கும் பிரசித்திபெற்ற குழந்தை மருத்துவர் அழைத்து வரப் பெற்றார்.
2022,அவர் மருந்துகள் கொடுத்துள்ளார்.
2023,சுந்தரத்திற்கும் காய்ச்சல் திரும்பியுளது.
2024,ஞானியாரடிகளின் பேச்சு வழக்கம் போல் பொருள் நிறைந்து மகிழ்ச்சியளித்தது.
2025,எப்படியும் தாயுமானேசரை வழிபட வேண்டும் என்ற ஆவலால் மாலை மணிக்கு மேல் மலைக்கோயிலை அடைந்து வழிபட்டு மீண்டேன்.
2026,பகல் உணவுக்கு அன்பர் கி.
2027,"விசுவநாதத்தால் அழைக்கப் பெற்று, உடன் வந்த அன்பர்களுடன் சென்று உண்டேன்."
2028,உணவின் பின் திரு.
2029,"விசுவநாதம், தம் பத்தினியுடனும், குழந்தைகளுடனும் அடியில் வணங்கித் திருநீறு பெற்றுக் கொண்டமை மிக்க உருக்கமாக இருந்தது."
2030,என் மாட்டு அவர் வைத்திருக்கும் அன்பும் மதிப்பும் அளவிடற்பால வல்ல.
2031,வணக்கமெல்லாம் இறைவனைச் சார்தல் வேண்டும்.
2032,மாலை மணியளவில் சமாஜ விழாக் கூட்டத்தில் திருநாவுக்கரசர் என்ற பொருள் பற்றிப் பேசினேன்.
2033,இரண்டு நாளும் நிறைந்த கூட்டம்.
2034,ஒலிபெருக்கி அமைக்கப் பெற்றிருந்தமையின் கீழ்மண்டபத்திலுங்கூடப் பலர் இருந்து கேட்டனர்.
2035,"நேற்று இரவிலும், இன்று காலையிலும் அன்பர், திரு."
2036,நடேச முதலியார் இல்லத்தில் சிற்றுண்டியருந்தினேன்.
2037,இன்றுமாலை மணிக்குச் சென்னை மாகாணத் தமிழ்ச் சங்கத்தின் எட்டாவது தமிழர் மாநாடு கரந்தைத் தமிழ்ச்சங்க மன்றத்தில் கூடியது.
2038,தலைவராகக் குறிப்பிட்டிருந்த ராவ்பகதூர் சி.
2039,இராமச்சந்திரஞ் செட்டியார் வந்திலாமையின் திரு.
2040,நாடிமுத்துப் பிள்ளை தலைமை வகித்தனர்.
2041,முதலில் அவரே கொடியேற்றுதலும் செய்தனர்.
2042,அவர் தமிழில் நன்றாகவே பேசினர்.
2043,செட்டி நாட்டரசர் சர் அண்ணாமலைச் செட்டியார வர்களுக்கு பல்கலை வள்ளல் என்னும் பட்டம் அளிக்கப் பெற்றது.
2044,நெல்லை ராவ்பகதூர் .
2045,ஆவுடையப்பப் பிள்ளை மாநாட்டைத் திறந்து வைத்தனர்.
2046,"இன்று காலை மணிக்கு நேற்று நிகழ்ந்த சங்கச்சார்பில், தமிழ்ப்புலவர் மாநாடு அவ்விடத்திலேயே கூடிற்று."
2047,தலைவர் திரு.
2048,"பிள்ளையவர்களும், திறப்பாளர் திவான்பகதூர் கீ."
2049,தெய்வசிகாமணி முதலியாரும் வந்திலர்.
2050,தத்தம் உரைகளை எழுதியநுப்பியிருந்தனர்.
2051,நான் வரவேற்புரை நிகழ்த்தினேன்.
2052,மாலை மணிக்கு மேல் இரு மாநாட்டின் சார்பிலும் பல தீர்மானங்கள் செய்யப் பெற்றன.
2053,இளைஞர் சிலர் உணர்ச்சியுடன் பேசினர்.
2054,அகநானூற்று உரை வேலை ஒரு திங்களின் மேலாக நிறுத்தியிருந்தது.
2055,இன்று தொடங்கப் பெற்றது.
2056,"ஆம் ஆண்டு ஆங்கிலப் புதிய ஆண்டின் தொடக்கமாகிய இன்று உலகமெங்கணும், கிறிஸ்தவர்களால் சிறப்பாகக் கொண்டாடப் பெறும்."
2057,ஆனால் போர் நிகழ்ச்சிகளினால் கொண்டாட்டம் குறைந்திருந்தல் ஒருதலை.
2058,குழந்தை மருத்துவரால் மருத்துவம் செய்யப் பெறுகின்றது.
2059,இஃது எழுதும் பகல் மணியளவில் சிறிது நலம் ஏற்பட்டுளது.
2060,இறைவன் திருவருள் பாலித்தல் வேண்டும்.
2061,கைதேர்ந்த குழந்தை மருத்துவர் பார்த்து மருந்து கொடுத்தமையால் நேற்றிரவு மணிக்கு மேல் பேரக்குழந்தைக்கு இழுப்பு ஏற்படவில்லை.
2062,யாவும் இறைவன் திருவருள்.
2063,திருவாதிரை நன்னாளாகிய இன்று உடல் நலங்குன்றினமையின் தலை முழுகவுங் கூடவில்லை.
2064,செட்டிநாட்டரசர் திரு.
2065,செய்தியறிந்து நான் காலை மணிக்கே சென்றிருந்தேன்.
2066,மணிக்கு மேல் வந்து சேர்ந்தனர்.
2067,மாலையிட்டு அழைத்து வந்தோம்.
2068,நான் சிறிது பாராட்டிப் பேசினேன்.
2069,வாழ்த்துப் பத்திரமும் அளிக்கப் பெற்றது.
2070,மிக்க அன்புடன் பேசினர்.
2071,பேரக்குழந்தைக்கு மீட்டும் இரண்டு மூன்று நாளாகக் கணையின் தொந்தரை மிகுதியாயிருக்கிறது.
2072,சிறிது காய்ச்சலும் உளது.
2073,"கபம் மிகுந்து இழுப்பதும், இருமுவதும் பார்க்கச் சகிக்கவில்லை."
2074,இன்று மீட்டும் இசிவும் புலப்பட்டது.
2075,அதனால் பெண்டிர்கள் அடையும் துன்பங்களுக்கு அளவில்லை.
2076,இரவில் தூக்கமுமில்லை.
2077,மருத்துவர் பார்க்கிறார்.
2078,பல வகையான சிகிற்சைகள் செய்யப்பெறுகின்றன.
2079,நேற்றிரவு பார்வதியம்மாள் கண்டதாகச் சொன்ன கனவினால் முருகப்பிரான் காப்பாற்றி யருள்வன் என நினைக்கிறேன்.
2080,தஞ்சையிலும் மின்விளக்குகளுக்கு மேன்மூடி இன்று போடப்பட்டுளது.
2081,தெருக்களில் நல்ல வெளிச்சம் இல்லை.
2082,போகிப் பண்டிகையாகிய இன்று அன்னையாரின் திதி நடைபெற்றது.
2083,நேற்றிரவு முதல் குழந்தை திருஞான வள்ளலுக்குக் கபத்தின் தொந்தரை சிறிதளவு குறைந்துளது.
2084,பொங்கற் பண்டிகை இனிது நிறைவேறியது.
2085,புதல்வன் திரு.
2086,நடராஜன் மட்டுமே அருவங் காட்டில் தனித்திருக்க நேர்ந்தது.
2087,இரண்டு மூன்று நாளாகப் பஞ்சாக்கர ஜெபம் சிறிது மிகுதியாகச் செய்கின்றேன்.
