Line Number,Sentence
1,மறைந்த நகரம் அல்லது மொஹெஞ்சொதாரோ பொருநை வரலாற்றுப் பேரறிஞர் மா.
2,"இராசமாணிக்கனார் நிலவன் பதிப்பகம் நூற் குறிப்பு நூற்பெயர் மறைந்த நகரம், பொருநை ஆசிரியர் வரலாற்றுப் பேரறிஞர் மா."
3,இராசமாணிக்கனார் பதிப்பாளர் முனைவர் க.
4,படிகள் மேலட்டை தமிழ்க்குமரன் வி.
5,சித்ரா நூலாக்கம் திருமதி வி.
6,"சித்ரா அச்சிட்டோர் வெங்கடேசுவரா ஆப்செட் பிரிண்டர் வடபழனி, சென்னை ."
7,"வெளியீடு நிலவன் பதிப்பகம், பி , பாண்டியன் அடுக்ககம், சீனிவாசன் தெரு, தியாகராய நகர், சென்னை ."
8,நூல் கிடைக்குமிடம் தமிழ்மண் பதிப்பகம் .
9,இத்தகைய அழிந்த பழைய நகரங்கள் பல நம் தமிழகத்தில் உண்டு.
10,"அவை கொற்கை, காயல், புகார், உறையூர், வஞ்சி, மாமல்லபுரம் முதலியன."
11,இத்தகைய சிறு நூல்கள் பல வெளிவரல் நாட்டுக்கு நன்மை விளைக்கும்.
12,"சேக்கிழார் அகம், மா."
13,என் தந்தையின் பதிப்புச் சுவடுகளைப் பின்பற்றி எம் பதிப்புப் பணியைச் செய்து வருகிறேன்.
14,தமிழ்ப் பேரறிஞர் முனைவர் மா.
15,இவற்றில் நூல்களை இல் எம் பதிப்பகம் வெளியிட்டுள்ளது.
16,தொடர் பணியாக இல் நூல்களை தமிழுலகம் பயன்படும் வகையில் எம் பதிப்பகம் வெளியிட்டுள்ளது.
17,இதனை அனைவரும் படித்துப் பயன்பெற வேண்டுகிறேன்.
18,க.
19,தமிழமுது நுழையுமுன் மனிதரில் தலையாய மனிதரே!
20,"மொழி, இனம், நாடு எனத் தமிழ் கூறும் நல்லுலகம் பற்றி ஆழச் சிந்தித்தவர்களுள் அவர் குறிப்பிடத்தக்கவர்."
21,"தாமுண்டு, தம் குடும்பமுண்டு, தம் வேலையுண்டு என்று அவரால் இருக்க முடியவில்லை."
22,"மொழி நலம், தமிழ்த் திருமணம், சாதி மறுப்பு என்பன அவருடைய தொடக்கக் காலக் களங்களாக அமைந்தன."
23,"தாய்மொழித் தமிழ், தமிழரிடையே பெறவேண்டிய மதிப்பையும் பயன்பாட்டையும் பெறாமலிருந்தமை அவரை வருத்தியது."
24,தமிழ் நமது தாய்மொழி ஈன்ற தாயைப் போற்றுதல் மக்களது கடமை.
25,?
26,ஒரு தமிழன் மற்றொரு தமிழனோடு பேசும்போது பெரும்பாலும் பிறமொழிச் சொற்களைக் கலந்தே பேசுவதைக் காண்கிறோம்.
27,இப்பிறமொழிச் சொற்கள் நம் மொழியிற் கலந்து தமிழ் நடையைக் கெடுத்துவிடுகின்றன.
28,மொழிக் கொலை புரிவதில் முதற்பரிசு பெறத்தக்கவர் நம் தமிழரே ஆவர்!
29,நம் தமிழ்நாட்டுச் செய்தித் தாள்களில் தமிழ்ப் புலமையுடையார் பெரும்பாலும் இல்லையென்றே கூறலாம்.
30,இவற்றைத் தமிழ்ச் செய்தித்தாள்கள் என்று கூறுவதற்குப் பதிலாக கலப்பு மொழிச் செய்தித்தாள்கள் என்று கூறுதலே பொருந்தும்.
31,"இவ்வாறு செய்தித் தாள்களில் மொழிக் கொலை புரிவோர் வேற்று நாட்டவரல்லர், வேறு மொழி பேசும் அயலாரல்லர்."
32,தமிழகத்தில் பிறந்து தமிழிலேயே பேசிவரும் மக்களாவர் என்பதை வெட்கத்துடன் கூற வேண்டுபவராக இருக்கிறோம்.
33,நாடு முழுவதும் மொழி நலம் குன்றியிருந்தமையைத் துறை சார்ந்த சான்றுகளோடும் கவலையோடும் சுட்டிக் காட்டியதோடு இராசமாணிக்கனார் நின்றுவிடவில்லை.
34,"மொழியை எப்படி வளர்ப்பது, காப்பாற்றுவது, உயர்த்துவது என்பதே அவருடைய தொடர்ந்த சிந்தனையாக இருந்தது."
35,காலங் காலமாக அடிமைப்பட்டுக் கிடந்த சமுதாயம் அவர் கண் முன் நின்றது.
36,வடமொழி ஆதிக்கமும் ஆங்கிலப்பற்றும் தமிழ் மக்களின் கண்களை மூடியிருந்தன.
37,அக்கடமையை நிறைவேற்ற அவர் கையாண்ட வழிகள் போற்றத்தக்கன.
38,தம்முடைய மாணவர்களை அவர் முதற்படியாகக் கொண்டார்.
39,நல்ல தமிழில் பேசவும் எழுதவும் அவர்களுக்குப் பயிற்றுவித்தார்.
40,சிறுசிறு கட்டுரைகளை உருவாக்கப் பயிற்சியளித்தார்.
41,மொழிநடை பற்றி அவர்களுக்குப் புரியுமாறு கலந்துரையாடினார்.
42,மொழி நடையைச் செம்மையாக்குவது இலக்கணமும் பல நூல்களைப் படிக்கும் பயிற்சியுமே என்பதை விளங்க வைத்தார்.
43,இலக்கணப் பாடங்களைப் பள்ளிப் பிள்ளைகள் விரும்பிப் படிக்குமாறு எளிமைப்படுத்தினார்.
44,அதற்கெனவே நூல்களை உருவாக்கினார்.
45,பயிலும் நேரம் தவிர்த்த பிற நேரங்களிலும் மாணவர்களுடன் உரையாடித் தமிழ் மொழியின் வளமை குறித்து அவர்களைச் சிந்திக்கச் செய்தார்.
46,"அவரிடம் பயின்றவர்களுள் பலர் பின்னாளில் சிறந்த தமிழறிஞர்களாகவும், நூலாசிரியர்களாகவும் உருவானமைக்கு இத்தகு பயிற்சிகள் உரமிட்டன."
47,வண்ணையம்பதியில் தனலட்சுமி தொடக்கப் பள்ளியில் பேராசிரியரின் தமிழ்த்தொண்டு தொடங்கியது.
48,அங்குத் தொடர்ந்து வகுப்புகள் நடத்தினார்.
49,பணிகளில் இருந்தவர்களுக்கு வார இறுதி நாட்களில் தமிழ் வகுப்பெடுத்தார்.
50,உறவினர்களைக் கூட அவர் விட்டு வைக்க வில்லை.
51,குடியரசு இதழில் சொற்ப ஊதியத்தில் பணியாற்றிக் கொண்டிருந்த தம் மைத்துனர் பு.
52,"செல்வராசனை வித்துவான் படிக்க வைத்து, சென்னை அப்துல் அக்கீம் உயர்நிலைப் பள்ளியில் தலைமைத் தமிழாசிரியராகப் பணிபெறச் செய்தார்."
53,"கல்வி வழி விழிப்புணர்வில் பெருநம்பிக்கை கொண்டிருந் தமையால், அரசியலாரும் சமூகத் தலைவர்களும் நாடெங்கும் கல்விக் கூடங்களை ஏற்படுத்த வேண்டும்."
54,பெண்கள் பின்தங்கிய காலம் அது.
55,அடுப்பூதும் பெண்ணுகளுக்குப் படிப்பெதற்கு என்று கேட்டவர்கள் மிக்கிருந்த காலம்.
56,அந்தக் கால கட்டத்தில்தான் பேராசிரியர் பெண் கல்விக்காகக் குரல் கொடுத்தார்.
57,"எட்டாம் வகுப்பே படித்திருந்த தம் மனைவிக்குத் தாமே ஆசிரியராக இருந்து பயிற்றுவித்து அவரை, வித்துவான் பட்டம் பெறச் செய்தார்."
58,என் கணவர் எனக்கு ஆங்கிலப் பாடமும் தமிழ்ப்பாடமும் கற்பித்து வந்தார்.
59,பாடம் கற்பிக்கும் நேரத்தில் பள்ளி ஆசிரியராகவே காணப்பட்டார்.
60,ஒவ்வொரு பெண்ணும் தன்னைக் காத்துக் கொள்ளும் வகையில் கல்வி கற்றுப் பொருளீட்ட வேண்டும் என்பது என் கணவர் கருத்து.
61,"அதனால், என்னைப் பெண்கள் பள்ளியில் தமிழாசிரியராக அமர்த்தினார்."
62,அவருடைய ஆசிரியப் பணி அதற்குத் துணையானது.
63,தம்மிடம் பயில வந்தவர்க்கு மொழியுணர்வூட்டினார்.
64,தமிழகத்தில் ஆட்சி தமிழிலேயே இயங்க வேண்டும்.
65,எல்லாக் கல்வி நிலையங்களிலும் ஆங்கிலம் ஒழிந்த எல்லாப் பாடங்களையும் தமிழில் கற்பித்தல் வேண்டும் என்பது அவர் கொள்கையாக இருந்தது.
66,அறிவியல் மனப்பான்மையை ஊட்டி வளர்க்கும் முறையில் அமைந்த பாடநூல்களையே பிள்ளைகள் படிக்கும்படிச் செய்தல் வேண்டும்.
67,உலக நாடுகளோடு தம் நாட்டை ஒப்பிட்டுப் பார்த்துக் குறைகளை நிறைவாக்கும் மனப்பாங்கு வளரும்படியான முறையில் கல்வி அளிக்கப்படல் வேண்டும்.
68,அதற்காகவே தாம் பணியாற்றிய பள்ளிகளிலும் கல்லூரிகளிலும் இருந்த மாணவர் மன்றங்களைச் செயலூக்கம் பெற வைத்தார்.
69,தமிழ் மன்றங்கள் இல்லாத கல்வி நிலையங்கள் அவற்றைப் பெறுமாறு செய்தார்.
70,பேச்சையும் எழுத்தையும் இளைஞர்கள் வளப்படுத்திக் கொள்ள உதவுமாறு வழியும் வகையும் என்றொரு சிறு நூல் படைத்தளித்தார்.
71,இங்ஙனம் மொழியுணர்ச்சி கொள்ளும் மக்களிடையே தான் நாட்டுப்பற்றும் இனவுணர்ச்சியும் சிறந்து தோன்றும்.
72,"ஆதலின், ஓரினத்தவர் இனவொற்றுமையோடு நல் வாழ்வு வாழ மொழிநூலறிவு உயிர்நாடி போன்ற தாகும்."
73,"தமிழ் மக்களுக்கு மொழிப் பற்றையும், மொழியறிவையும் ஊட்டிய அதே காலகட்டத்தில், அவர்களை நாட்டுப்பற்று உடையவர்களாகவும் மாற்றினார்."
74,நாட்டுக்காக உழைத்த அறிஞர்களின் வரலாறுகளைச் சிறுசிறு நூல்களாக்கி இளைஞர்கள் அவற்றைப் படித்துய்ய வழிவகுத்தார்.
75,"இளைஞர்கள் படித்தல், சிந்தித்தல், தெளிதல் எனும் மூன்று கோட்பாடுகளைக் கைக்கொண்டால் உயரலாம் என்பது அவர் வழிகாட்டலாக இருந்தது."
76,தாமாக எண்ணும் ஆற்றல் உள்ளவரும் உண்மையான தமிழ்ப்பற்று உடையவருமே நல்ல எழுத்தாளர்.
77,"தமிழ் எழுத்தாளர் தமிழ் இலக்கண, இலக்கியங்களைப் படித்தவராக இருப்பது நல்லது."
78,தாழ்ந்துள்ள தமிழ்ச் சமுதாயத்தை உயர்த்தப் பயன்படும் நூல்களை எழுதுவதையே எழுத்தாளர்கள் தங்கள் சிறந்த கடமையாகக் கருத வேண்டும்.
79,சிறந்த கருத்துக்களோடு பிழையற்ற எளிய நடையையும் பொதுமக்களுக்கு ஊட்டுவது எழுத்தாளர் கடமை என்பதை அவர்கள் மறந்து விடலாகாது.
80,இதுவே அறநெறிப்பட்ட எழுத்தாளர் கடமை என்பதை நான் வற்புறுத்த விரும்புகிறேன்.
81,"சாதிகள் ஒழிந்து சடங்குகள் அற்ற சமயம் நெறிப்படத் தமிழர், தமிழ் வாழ்வு வாழ வேண்டுமென்பதில் அவர் கருத்தாக இருந்தார்."
82,"அதனால் தான், வாழ்க்கையின் தொடக்க நிலையான திருமணம் தமிழ்த் திருமணமாக அமைய வேண்டுமென அவர் வற்புறுத்தினார்."
83,"இதற்காகவே அவர் வெளியிட்ட தமிழர் திருமண நூல், தமிழ்ப் பெரியார்களின் ஒருமித்த வரவேற்பையும் பாராட்டையும் பெற்றது."
84,எல்லோரும் வேலை செய்து பிழைக்கவேண்டும்.
85,ஒழுக்கம் வேண்டும்.
86,எல்லோரும் ஒழுக்கத்திற்கு மதிப்பைத் தரவேண்டும்.
87,ஒழுக்கம் உயிரினும் சிறந்தது.
88,ஒழுக்கத்தோடு உறையும் கல்விதான் மனிதனை உயர்விக்கும் என்று தெளிவுபடுத்தியுள்ளார்.
89,"மறுபிறப்பு நேர்ந்தால், மீண்டும் தமிழகத்தே பிறக்க வேண்டும் என்று அவாவிக் கட்டுரைத்த தமிழ்மண் பற்றாளர்."
90,அவரை முழுமையாகப் படம்பிடித்துக் காட்டும் நூற்பா வடிவிலான ஒருவரி சொல்லட்டுமா?
91,டாக்டர் இரா.
92,கலைக்கோவன் உள்ளுரை எண் பக்கம் மறைந்த நகரகம் .
93,மண்ணுள் மறைந்த வரலாறு .
94,நகர அமைப்பு .
95,கட்டிடங்கள் .
96,வீட்டுப் பொருள்கள் .
97,உணவுஉடைதொழில் .
98,வாணிபம் .
99,கலைகள் .
100,சமயக்கலை .
101,இடுதலும் சுடுதலும் .
102,சிந்துவெளி எழுத்துகள் .
103,சிந்துவெளி மக்கள் திராவிடரா?
104,.
105,நமது கடமை பொருநை .
106,மேற்கு மலைத் தொடர் .
107,பொருநையாறு .
108,அணைக் கட்டுகள் .
109,பொருநை நாட்டு வரலாறு .
110,பொருநைக்கரை ஊர்கள் .
111,பொருநைக்கரை ஊர்கள் .
112,பொருநைக்கரை ஊர்கள் .
113,பொருநைக்கரை நாகரிகம் .
114,மண்ணுள் மறைந்த வரலாறு மலைப்பாங்கான இடங்களில் இருந்த மிகப் பழைய மனிதன் மலைக்குகைகளில் வாழ்ந்துவந்தான்.
115,காடுகளில் இருந்த மனிதன் மரங்களிலும் மர அடியிலும் வசித்து வந்தான்.
116,"கடற்கரை ஓரங்களில் இருந்த மனிதன், அங்கிருந்த மரங்களின் அடியில் சிறு குடில்களை அமைத்துக் கொண்டு வாழ்ந்தான்."
117,மக்கள் அறிவு நாளடைவில் வளர்ச்சி பெறுதல் இயல்புதானே!
118,பல குடும்பங்கள் ஒன்றாகத் தகுதிவாய்ந்த இடங்களில் குடியேறி வாழலாயினர்.
119,"அவ்விடங்கள் சிறியனவாயின் சிற்றூர் எனவும், பெரியனவாயின் பேரூர் எனவும், மிகப் பெரியன ஆயின் பட்டினம் எனவும் வழங்கலாயின."
120,அறிவும் நாகரிகமும் வளர வளர மக்கள் உலோகங்களை மிகுதியாகப் பயன்படுத்தத் தொடங்கியதும் பயனற்ற கற்கருவிகளையும் மட்பாத்திரங்களையும் விலக்கி விட்டனர்.
121,அவை கவனிப்பார் அற்று நாளடைவில் மண்ணுள் புதையுண்டன.
122,அவையும் நாளடைவில் மண்ணிற் புதையுண்டன.
123,கடல் ஓரங்களில் இருந்த பல ஊர்கள் கடல் கொந்தளிப்பால் துறக்கப்பட்டன.
124,ஆற்றோரம் அமைந்திருந்த அழகிய நகரங்கள் ஆற்று வெள்ளத்திற்கு அஞ்சித் துறக்கப்பட்டன.
125,பல நகரங்கள் வேற்றார் வரவினால் பாழாக்கப்பட்டன.
126,சில நகரங்கள் மண் மாரியால் அழிந்தன.
127,இங்ஙனம் பல நகரங்கள் நாளடைவில் துறக்கப்பட்டன அழிக்கப்பட்டன.
128,அவை பல ஆண்டுகட்குப் பின்னர் மண் மூடுண்டு விட்டன பல நகரங்கள் புதையுண்ட இடங்களில் அடர்ந்த காடுகள் தோன்றிவிட்டன.
129,பல நகரங்கள் ஆறுகளின் அடியிலும் கடல் அடியிலும் அடக்கமாயின.
130,இந் நிகழ்ச்சிகள் நடந்து ஆயிரக் கணக்கான ஆண்டுகள் ஆகிவிட்டன.
131,பின்னர்ப் பல புதிய நகரங்கள் தோன்றின அவற்றுள்ளும் பல மேற் சொன்னவாறே மறைந்தன சில இன்றும் இருக்கின்றன.
132,இங்ஙனம் பல நகரங்கள் மண்ணுள்ளும் ஆற்றடியிலும் கடலடியிலும் மறைப்புண்ட செய்தி இப்பொழுது எப்படி வெளியாகிறது?
133,என்பது தகுந்த கேள்வி அன்றோ?
134,"இவ்வாறு மண்ணைத்தோண்டி, மறைந்த நகரங்களைக் கண்டறியும் முயற்சியே புதைபொருள் ஆராய்ச்சி எனப்படும்."
135,இந்த ஆராய்ச்சி உலகம் முழுவதிலும் நடைபெறுகின்றது.
136,இது நிற்க.
137,"நீங்கள் படிக்கும் இந்திய வரலாற்று நூலில், இந்தியாவின் பழங்குடிகள் முண்டர், திராவிடர், என்பவராவர்."
138,அவர்கட்குப் பின் இந்தியா வந்தவர் ஆரியர்.
139,அவர்கள் சிந்து நதிக்கரையில் இருந்த பழங்குடிகளை விரட்டித் தங்களைத் தாபித்துக் கொண்டனர் என்று படிக்கிறீர்கள் அல்லவா?
