Line Number,Sentence
670,அதற்கு ஒரு சான்று எடுத்துக் காட்டுதும் முன்னொரு கால் சரசுவதி யாற்றங்கரையிலே இருடிகள் ஒரு வேள்வி வேட்கலாயினர்.
671,அப்போது இல்லூஷை என்னும் ஓர் அடிமைப் பெண்ணின் புதல்வரான கவஷா என்பவர் அவ் வேள்விக்கு வந்திருந்தனர்.
672,இக் கவஷா என்பவரே இருக்கு வேதத்தின் பத்தாம் மண்டிலத்திற் பல பதிகங்களை இயற்றி யிருக்கின்றனர்.
673,இவ்வாற்றாற்பிராமணங்கள் எழுதப்பட்ட காலத்திலும் சாதி வேற்றுமை நிலைபெறவில்லை யென்பது புலனாகின்றதன்றோ?
674,இவ்வாறே இன்னும் பலர் உளர்.
675,மேற்சொல்லிய இருக்குவேதப் பதிகங்களை ஆக்கிய சத்திரிய வைசியர் என்பார் தமிழ வேளாள வகுப்பினரே யாவர்.
676,"ரிக் வேத ஆங்கில வடிவம், பக்."
677,என்னும் நூலில் விரித்து விளக்கியிருக்கின்றார்.
678,குமரி நாடு கடல்கொண்டபின் அங்கிருந்த தமிழர்களே வடநாடு வரையிற் சென்று ஆங்காங்குக் குடியேறிப் பத்துவகை அரசியலை நாட்டி னார்கள்.
679,அவர்களுள் வடமதுரையில் அரசாண்ட யது குலத்தவர்களே பின்னர்க் கண்ணனைத் தலை வனாய்க் கொண்டு துவாரகையில் வந்து குடியேறினர்.
680,அவ் யது குலத்தவரில் ஒரு பகுதியாரே பெயர்த்துந் தமிழ்நாட்டிற் போந்து எருமையூரிற் குடியேறினர்.. ஐ பக்.
681,எருமையூரிற் குடியேறிய யதுகுலத்தவராகிய வேளிர்க்குத் தலைவனே புறநானூற்றிற் கூறப்படும் இருங்கோ வேள் என்னும் மன்னன் ஆவான்.
682,"எனவே, இருக்கு வேதத்திற் பலப்பல பதிகங்கள் இயற்றிய சத்திரிய வைசியர்கள் அனைவரும் தமிழ வேளாளர்களே யாதலைத் தெற்றென உணர்ந்துகொள்க."
683,"சதபதபிராமணத் திலும் , , , கௌஷீதகி உபநிடதத்திலுமே , பூணூல் அணியுங் குறிப்பு முதன்முதற் காணப்படுகின்றது."
684,", , , ."
685,", ."
686,", , , ."
687,", ."
688,.
689,", ."
690,.
691,", , .."
692,", ."
693,அடிகளாரின் மேற்சொன்ன கருத்துக்களின் கருவைப் பின்வரு மாறு கா.
694,அதில் எல்லாச் சமயமூலமும் காணலாம்...
695,பிராமணச் சமுதாயத்தோடு முழுமையாக ஒப்பிடக்கூடிய அமைப்பு உலகில் வேறு எந்த நாட்டிலும் இல்லை.
696,பிராமணருடைய நோக்கம் குறிப்பாக இந்த சமயத்தைத்தான் பரப்ப வேண்டும் என்பதாக என்றும் இருந்ததில்லை.
697,இந்தியாவில் பரவும் எந்தச் சமயமாயினும் சரி அதனை வழிநடத்திக் கையாளுபவர்கள் தாங்களாக இருக்கவேண்டும் என்பதே அவர்கள் குறிக்கோள்.
698,"சர் சார்லஸ் எலியட் . , ."
699,", , , , . , , விஷ்ணு தென்னாட்டில் திராவிடர் வழிபட்ட ஒரு தெய்வம்."
700,பின்னர் ஆரியர் விஷ்ணுவைத் தம் தெய்வமாகவும் ஏற்றுக் கொண்டனர் ஜே.
701,பிரிஸ்லஸ்கி .
702,ரிக்வேத காலத்திலேயே ஆரியர் பண்பாடு முழு ஆரியத் தன்மையை இழந்துவிட்டது என்பதை அவ்வேத ஆம் மண்டலத்தி லிருந்து உன்னிக்கலாம்.
703,ஆரியரல்லாதார் பண்பாடு ரிக்வேதத்தில் உள்ளது அதுவும் குறிப்பாகப் பெருமளவுக்கு எட்டாம் மண்டலத்தில்.
704,குஞ்ஞன் ராஜா கே.வி.
705,"ரங்கசாமி ஐயங்கார் பாராட்டு மலர் , ."
706,", ."
707,இல்திகோ புகாஸ் கருத்து ரிக்வேத ரிஷிகளில் பெரும் பாலோர் ஆரியரல்லாதாராகத்தான் இருந்திருக்கவேண்டும்.
708,", இந்தியாவில் வேதகாலத்துக்கு முந்தைய காலச் சமயம் பெருமளவுக்கு ஹாரப்பா நாகரிகத்தில் வழங்கிய திராவிடசமய மாகவே இருந்தது."
709,"சாவித்திரி தொன்மமும் அதனுடைன் தொடர் புடைய சடங்குகளும் சிந்து நாகரிக காலத்திலேயே உருவானவை. அஸ்கோ பர்போலா , ."
710,", , , ."
711,.
712,.
713,", , , , , ."
714,இல் வெளிவந்த நூலில் ஆல்சின் கருத்து சிந்து நாகரிக முதுநிலைக் காலத்திலேயே .
715,இந்து சமயத்தில் யாண்டும் காணப்படும் உருவ வழிபாடு இந்தியாவில் இருந்த ஆரியரல்லாதார் வழிபாட்டு முறைகளில் இருந்தே பிராமணீயத்துக்கு வந்தது.
716,..
717,", ."
718,வால்பர்ட் ஆர்.சி.
719,"தண்டா கருத்துப்படி பிருகு சைந்தவர், சுக்ர, ச்யவன, ஆங்கிரஸ், மஹிதாஸ், வசிஷ்டர் முதலியவர்கள் திராவிடரே."
720,.
721,.
722,..
723,.
724,.
725,தாய்த் தெய்வ வழிபாடும் தென்னாட்டில்தான் மிகுந்து காணப்படுகிறது. ஜி.எம்.
726,ராபர்ட்ஸ்புதிய பெங்குயின் உலக வரலாறு இன்று வழிபடப்படும் இந்துக் கடவுளர்களில் தலைமைச்சிறப்பு வாய்ந்தவர் களில் ஒருவன் சிவன்.
727,தொன்மையான சிவன் வடிவம் போன்ற ஒன்றை மொகஞ்சோதரோ முத்திரை ஒன்று கொண்டுள்ளது.
728,"சிவன் அடையாளமாகக் கொள்ளப்படுவதும், தற்காலக் கோயில்களில் மக்கள் வழிபடுவதுமான லிங்கம் போன்ற கற்கள் ஹாரப்பா நாகரிக எச்சங்களில் உள்ளன."
729,எனவே இன்று உலகத்தில் நின்று நிலவிவரும் சமயங்களில் சிவன் வழிபாடே அனைத்தையும்விடத் தொன்மைவாய்ந்தது என உய்த்துணரச் சான்றுகள் உள்ளன.
730,.
731,அச் சமயங்களின் வேர்கள் சிந்து வெளி நாகரிகத்தில் இருந்திருக்கவேண்டும்.
732,.
733,சாங்கியம் ஆரியரல்லாதாருடையது உபநிஷத்துக்கள் சாங்கியக் கருத்துகளைக் கடன் கொண்டுள்ளன என்பதை மேலே கண்டோம்.
734,யோகமும் ஆரியல்லாதாரிடம் திராவிடர் ஆஸ்திரிக் உருவான தென்பர் ஏ.பி.
735,கர்மர்கர் குடலை என்னும் சொல்லிலிருந்து குண்டாலினி உருவாகியது என்பர் அவர்.
736,இத்தகைய பலவகைப்பட்ட சமயச் சுயசிந்தனை இயக்கங்களில் யோகப் பயிற்சி பொதுவான கூறாக இருந்தது.
737,சாங்கிய தத்துவமும் வேதகாலத்திற்கு முந்தியே இந்தியாவில் தோன்றியதாகத் தெரிகிறது.
738,.
739,"சிந்துநாகரிக மக்களைப் பூசாரி அரசர்கள் ஆண்டு வந்தனர் என்ற மார்ஷல், வீலர் ஆகியோர் கருத்து ஆதாரமற்றது என்பர் பொசெல்."
740,.
741,.
742,ஏனைய விழுக்காட்டினர் நிலைவேறு.
743,முந்து தமிழ்ச் சிந்து நாகரிக மக்கள் சமயத்துக்கும் இது பொருந்துவதுதான்.
744,இதே கருத்தை ஹெச்.
745,ஆர்.
746,குறிகளுக்குள் உள்ளவை மட்டுமே அவர் எழுதியவை பற்றிய சில கருத்துகள்.
747,"ரிக்வேதம் உபநிஷத்துக்கள் காலத்தி லிருந்தே திராவிடத்தாக்கம் வினைக்கொள்கை, மறுபிறப்பு, யோகம் உள்ளது."
748,"வேத, புராணப் பகுதிகளில் பல பண்டைத் திராவிட நூல்களின் மொழிபெயர்ப்புகளே."
749,ஹீராசுக்கு .. அன்று எழுதிய கடிதத்தில் வி.எஸ்.
750,இங்கிருந்து அங்கு சென்று பின்னர் உலகெங்கும் நாகரிகத்தைப் பரப்பியவர்கள் இவர்களே.
751,இத்துறை ஆய்வுகள் நிறைவடையும் பொழுது திராவிட நாகரிகமாகிய சிந்துநாகரிகம் உலகநாகரிகத்தின் தொட்டில் என்பது ஏற்கப்படும்.
752,", , , , , , ."
753,", . ."
754,இயல் மொகெஞ்சொதரோ எழுத்தை வாசித்தல் .
755,சிந்து எழுத்திலிருந்து தான் பிரமி எழுத்து தோன்றியது.
756,அது கருத்தெழுத்து லிபியானது .
757,"அவை அசையெழுத்து அல்ல மெய்யெழுத்து மட்டும் அல்ல முழுமையான சொற்களைக் குறிப்பவை விவரணைகள், கூற்றுகள் முதலியவை ஆகும்."
758,சிந்து நாகரிகத் தொல் திராவிடமொழியின் இலக்கணம் வளர்ச்சியடையாத நிலையில் இருந்திருக்கும்.
759,முத்திரைகளைப் பதித்துப் படிக்கும் வாசகங்களை வலமிருந்து இடமாக படிக்கவேண்டும்.
760,படவெழுத்துகள் சில .
761,ஆள் .
762,மீன் .
763,மரம் .
764,கோ உருவகப்படுத்திய படவெழுத்துகள் சில .
765,பாழி .
766,ஊர் .
767,கலக்கூர் .
768,"ஆக, இவ்வியலில் தந்த சான்றுகளின் அடிப்படையில் சிந்து நாகரிக மக்கள் திராவிட மொழி பேசிய திராவிடர்தாம்."
769,அவர்கள் பேசியமொழி தொல் திராவிடம் .
770,அந்தப் பொதுவான மூல வடிவம் சிந்து வரி வடிவம்தான் எனலாம்.
771,.
772,எனவே சுமெரிய வடிவங்களுள் பெரும்பாலானவை சிந்து வரிவடிவங்களிலிருந்து உருவானவையே .
773,ஆகவே உலகின் வரிவடிவங்களில் மிகு தொன்மை வாய்ந்தது சிந்துநாகரிக வரி வடிவமே.
774,.
775,திராவிட மொழிகள் போல சுமேரியமும் ஒட்டுநிலை மொழியாகும் சொல் ஒப்புமைகளும் இலக்கண ஒப்புமைகளும் பல.
776,.
777,பாவேரு ஜாதக க்கதை அச்செய்தியை மெய்ப்பிக்கும் இந்தியத் தொன்மம் எனலாம்.
778,.
779,சிந்து நாகரிகம் கி.மு. கால அளவிலேயே முன்னேறி விட்டதால் இது இயல்வது தான்.
780,.
781,"சிந்து நாகரிகத்தின் தாக்கம் சுமேரியத்தைத் தாண்டி சிரியா எகிப்து, சைப்ரஸ், கிரீட், இத்தாலி, ஸ்பெயின் என்றவாறு சென்றுள்ளது."
782,ஆனு வை வென்ற திருவிழா பாரோ வோக்கள் காலத் திலும் கொண்டாடப்பட்டு வந்தது.
783,பாரோவாக்கள் காலத்துக்கு முந்திய எகிப்தியரும் சுமேரியரும் ஒரே இனத்தவர் என்பது கீத் கருத்து.
784,"தொடக்கக் காலங்களில் சுமேரிய எகிப்திய அரசர்கள் தொடர்புடையவர்களாக இருந்திருப்பர் என்பர் கார்டன் சைல்டு, மார்கன், நைட் முதலியவர்கள்."
785,பிற் காலத்தில் பாரோ வாக்கள் காலத்தில் பாபிலோனியப் பாணிக் கலைப் பொருள்கள் கைவிடப்பட்டன.
786,..
787,பிளின்டர்ஸ் பெட்ரியும் பண்டை எகிப்தியரும் இந்தியரும் தொல் இந்தியர் ஆகிய திராவிடர் ஒரே இனத்தவர் என்பார் .
788,இரண்டு புலிகளை வெல்லும் புலிகடி மாலைச் சிந்து முத்திரைகளில் ஒன்று குறிக்கிறது.
789,சுமேரியாவில் அவ்வாறே கில்காமெஷ் இரண்டு சிங்கங்களை வெல்லும் காட்சி வரையப் பட்டுள்ளது.
790,ஜெப்ல் எல் அராக் இல் கிடைத்த பிளின்ட் கத்தியின் பிடியிலும் ஒருவீரன் இரண்டு சிங்கங்களைக் கொல்லும் காட்சி உள்ளது.
791,.
792,தென்னிந்தியாவில் இன்றும் பரவலாகக் காணும் பிணைந்த நாக வடிவுகளை சுமேரிய முத்திரைகளிலும் எகிப்து நாட்டுத் தந்தப் பிடிகளிலும் காணலாம்.
793,.
794,.
795,தமிழ மீனவர் ஏமன் சென்றபோது அந்நாடு அவர்களுக்கு வலக்கைப் பக்க நாடு.
796,அவர்கள் அவ்வாறு வைத்தபெயர் அரபியிலும் நிலைத்துவிட்டது.
797,அரபிக்கடலைத் தாண்டி ஏடன் கிரேக்க மொழியில் நற்கடவுள் என முதலில் அழைக்கப்பட்டது.
798,"எகிப்து நாகரிகத்தில் தொடக்க காலத்திலிருந்து கருடன் கலுழன் கருடன் , நாகம் இவற்றுக்கு முதன்மை தரப்படுகிறது."
799,தமிழிய சிந்து நாகரிகக் காலக்கதைகளையும் உள்ளடக்கிய மகாபாரதத்தில் காளி நதியாகிய நைல் பற்றிய குறிப்புகள் உள்ளன.
800,மீனுண்ணிகளை அடுத்து மகர மக்கள் இருந்தனர்.
801,மகரம் மகரான் கடற்கரை பலூ சிஸ்தான் கடலோரப் பகுதி.
802,தென் அரபியாவிலிருந்து பாம்புகள் நாகர் எகிப்து மீது படையெடுத்தனர் என்பர் ஹெரதோதஸ்.
803,.
804,கி.மு. காலத்தில் அவ்வாறு சென்றவர்கள் சிந்துமக்கள் இந்தியர் சிந்துப்பகுதித் திராவிடர்களேயாவர்.
805,.
806,எகிப்து பாரோவாவின் மகளுக்குத்தான் அரசுரிமை என்னும் மகள்வழி அரசுரிமைதான் எகிப்தில் வழங்கியது.
807,ஆயினும் மகனை மகளுக்குக் கணவனாக்கி மகனும் பாரோவா ஆக ஆனதுடன் பெரும்பாலும் நடைமுறையில் மகனே அரசனாகி ஆண்டான்.
808,"புத்த ஜாதகம் கூறும் சாக்கியர் கதைகள், மகாபாரதக் கதைகள் ஆகியவை சகோதர சகோதரி திருமணங்கள் நடந்ததைக் குறிப்பிட்டுள்ளன."
809,மெனஸ் என்ற பெயரில் குறிக்கப்படும் பண்டைய எகிப்து அரசன் பெயர் மீனா என்றுதான் உண்மையில் பலுக்கப்பட்டது.
810,மீனா மின்னுவது என்பது பட்டப் பெயர்தான்.
811,கிரீட் தீவின் அரசன் பெயர் மீனாஸ் என்பது அதேபொருளில்வழங்கிய பட்டப் பெயர்தான்.
812,.
813,எகிப்தில் கழிபழங்காலத்தில் ராசிகள் ஆக இருந்து பின்னர் ஆகப் பெருகியது.
814,பின்னர் கிரேக்கரும் ராசி எனக் கொண்டனர்.
815,ராசி எனக் கொண்ட காலத்தின் எச்சங்களை தமிழர் வானியலில் ராசிக்கு வழங்கும் பெயர்களிலிருந்து உன்னிக்கலாம்.
816,"சர்வில்லியம் ஜோன்ஸ் கிரேக்கர், அராபியர் ஆகியோருடைய ராசி கணக்கைவிட இந்தியர் ராசிக்கணக்குத்தான் பழமை வாய்ந்தது என்று கூறியுள்ளதுதான் சரி."
817,மனுவின் பிரளயக் கதைபற்றி ரிக்வேதத் தில் ஒன்றுமே குறிப்பிடப்படவில்லை.
818,"முதன்முதலில்சதபத பிராமணம் , . தான் அதைக் குறிப்பிடுகிறது பின்னர் மகாபாரதம், மத்ஸய புராணம் ஆகியவையும் அதைக் குறிப்பிடுகின்றன."
819,அது ஆரியர் கதை அல்ல என்று முதலில் குறிப்பிட்டவர் பர்னோ .
820,"பாகவதபுராணம் மனு திராவிட மன்னன், அவன் பெயர் சத்யவிரதன் என்கிறது."
821,பாரதமும் பாகவத புராணமும் அவனை முடிதுறந்த ரிஷி என்கின்றன.
822,"துறவு, முனிவன் ரிஷி முதலியவையெல்லாம் திராவிடரைச் சார்ந் தவையே, ஆரியருடையவையல்ல."
823,"இந்த மனுவை வைத்து சுமேரிய பைபிள் பிரளயக்கதை போன்ற ஒன்றை சதபதபிராமண ம், பாரதம் முதலியனவும் கட்டியுள்ளன."
824,ஒருசிறுமீனை மனு காப்பாற்றுகிறான்.
825,"கிரீட்தீவில் கண்ட தந்த முத்திரை ஒன்றில், இக்காட்சி வருகிறது."
826,அக்கதை சிந்து வெளித் திராவிடரிடமிருந்துதான் சுமேரியரிடத்துச் சென்றிருக்க வேண்டும்.
827,இயல் ஹாமைத்திய இந்தியநண்ணிலக்கரை இனத்தார்.
828,.
829,ஹெரோதோதஸ் நண்ணிலக்கரைக் கிழக்குப்பகுதியில் வாழ்ந்ததாகக் குறிப்பிடும் தெர்மிலய் என்பவர்களும் தமிழரும் ஓரினத்தவரே.
