Line Number,Sentence
2102,பரைவாக்கு உந்திஓசை பைசந்திவாக்கு நெஞ்சு ஓசை அல்லது நினைவு ஓசை மத்திமைவாக்கு மிடற்று ஓசை வைகரிவாக்கு செவிஓசை.
2103,இவற்றின் விகற்பமெல்லாம் சைவாகமத்துள் காண்க.
2104,"எழுவாயுருபும் விளியுருபும் தொக்கு நிற்கும் ஆற்றலின்றி விரிந்தே நிற்றலின், அவற்றை வேற்றுமைப் புணர்ச்சியில் சேர்க்காது அல்வழிப்புணர்ச்சி என்றனர்."
2105,எழுவாய் வேற்றுமை ஆறு பயனிலையொடும் தொ.
2106,"சொ. சேனா. புணர்ந்த புணர்ச்சியும், விளிவேற்றுமை தன் பொரு ளொடு முடிக்கும் சொல்லொடு புணர்ந்த புணர்ச்சியும் அல்வழியாயின."
2107,நச். நெடிலையும் குறிலையும் சேர்த்துச் சொன்னாலன்றித் தனித்துச் சொல்லுமிடத்து அளபெடை ஒலி புலப்படாது.
2108,"எள்ளாட்டுதல் சேர்த்துச் சொல்லுதற்கும், எண்ணெய் புலப்படுதல் அளபெடை ஒலி தோன்றுதற்கும் உவமமாம்."
2109,"என்ப சொல்லிலக்கணம் என்ப என்பது பகர ஈற்றுப் பலரறிசொல்லாகவும், அகர ஈற்றுப் பலவறி சொல்லாகவும் வரும்."
2110,பலரறிசொல் என் ப எனப் பகுக்கப்பட்டு இறுதிநிலை யாகிய பகரமே எதிர்காலம் காட்ட அமைந்திருப்பதாம்.
2111,"ஆகவே, என்ப என்ற பலரறிசொல் பகர ஈற்றது, பலவறிசொல் அகர ஈற்றது என்பது உணரத்தக்கது."
2112,பலவறிசொல் ஈறு அகரம் அன்று வகரமே என்பது பாலசுந்தரனார் கருத்து.
2113,என்மனார் சொல்லமைப்பு செய்ம்மன என்னும் தொழில்இறு சொல்லும் தொ.
2114,நச். செய்ம்மன செய்யும் செய்த என்னும் தொ.
2115,சேனா. இசைக்குமன சொல்லே தொ.
2116,என்று செய்ம்மன என்னும் வாய்பாடு ஒன்று தொல்காப்பியத் தில் குறிப்பிடப்பட்டுள்ளது.
2117,இதனை வினைமுற்றுச் சொல் என்பர் சேனாவரையர் பெயரெச்சச் சொல் என்பர் நச்.
2118,அதே வாய்பாட்டினதாகும் என்மன என்னும் முற்றுச்சொல்லோடு ஆர்விகுதி சேர என்மனார் என்று ஆகும்.
2119,"சேனாவரையர் என் மன்ஆர் எனக் கொண்டு, மன் எதிர்கால இடைநிலை என்னும் கருத்துடையார்."
2120,"ஏவினா இடைச்சொல் ஏவன், அவனே எனமொழி முதலிலும் இறுதியிலும் வரும்."
2121,ஏ எம்பெருமான் விளிக்குறிப்பு விளியிறுதியில் வருதலே பெரும்பான்மை.
2122,ஏ எ இஃதொத்தன் நாணிலன் இகழ்ச்சிக் குறிப்பு.
2123,ஏஏ இவளொருத்தி பேடியோ என்றார் இசைநிறை.
2124,ஏஎ பாவம் இகழ்ச்சிக்குறிப்பு முதற்கண்ணேயே வரும்.
2125,", நச்."
2126,எடு யானே கள்வன் யானோ தேறேன் குறுந். நன்.
2127,எடு யானே கொண்டேன்?
2128,என்பது யான் கொண் டிலேன் என மாறுகோடல் ஆகிய எதிர்மறைப் பொருளைச் சொல்லு வானது ஒலித்தல் குறிப்பான் உணர்த்துவது.
2129,நீயே கொண்டாய்?
2130,ஏகாரம் சொல்வானது ஒலித்தல் குறிப்பான் வினாப்பொருளை உணர்த்துவது.
2131,"அவருள் இவனே தக்கவன் ஏகாரம் பலரினின்றும் ஒருவனைப் பிரித்தமையான், பிரிநிலைப் பொருளை உணர்த்துவது."
2132,காடு கழிந்தோரே காதலர் ஈற்றசைப் பொருளில் வந்தது.
2133,நிலனே நீரே தீயே எண்ணுப் பொருளில் வந்தது.
2134,இவையாவும் இயல்பாகப் புணர்ந்தவாறு.
2135,சாத்தனே செல்க ஏகாரம் விளிப்பொருளில் வந்தது.
2136,அது வருமொழி வன்கணம் வரினும் இயல்பாகப் புணரும்.
2137,அஃறிணை ஏவற்பொருண்மையை முற்ற முடிக்காது.
2138,"எடு அது செல்க காட்டின்கண்,...."
2139,தொல்காப்பியனார் அகரஈறு ஒன்றனையே வியங்கோள் ஈறாக எடுத்தோதியுள்ளார் வியங்கோள் படர்க்கையிடத் திற்கே உண்டு என்றும் கூறியுள்ளார்.
2140,நச். ஏவல் கண்ணாத வியங்கோளுக்கு மன்னிய பெரும நீயே என்று இளம்பூரணர் எடுத்துக்காட்டுத் தந்துள்ளார் இள..
2141,"கூறுகின்றான், அவன் நிலைபெற்றிருத்தல் வேண்டும் என்றே கருதிக்கூறலின், அதுவும் ஏவல் கண்ணிற்றேயாம் என்பர் நச்."
2142,"வாழிய என்பது ஏவல் கண்ணாதது என்பதும், வாழி என்பது ஏவல் கண்ணியதுஎன்பதும் இளம்பூரணர் கருத்து."
2143,இஃது இடைச்சொல்லாம்.
2144,இது வருமொழி வன்கணத்தோடு இயல்பாகப் புணரும்.
2145,எடு கேண்மியா கொற்றா கேண்மியா கொற்றா தொ.
2146,நச். முன்னிலையில் ஏவல்வினைச்சொல்லைக் குறித்து வரும் உரை யசையாகிய மியா என்னும் ஆகார ஈற்று இடைச்சொல்.
2147,இள. நச்சினார்க்கினியர் உரையசை என்பதற்குக் கேள் என்றாற் போன்ற எதிர்முகமாக்கும் சொல் என்று பொருள் கொண் டார்.
2148,இளம்பூரணர் வினையைச் சேர்ந்தே முன்னிலைப் பொருள் தரும் மியா என்ற இடைச்சொல் என்றே பொருள் கொண்டார்.
2149,"ஏவல் குறித்த உரையசை என்பதும், முன்னிலை அசைச்சொல் என்பதும் ஒருபொருட் கிளவியாகும்."
2150,"ஆகவே, முன்னிலை அசைச்சொல்லாகிய மியா என்பதே ஏவல் குறித்த உரை யசைச் சொல்லாம்."
2151,ஏவல் விகுதி ஒருமை ஆய் தி மோ விகுதி ஒருமை ஏவலாம்.
2152,உரை ஏவல்விகுதிப் பன்மை ஈர் தீர் மின் மினீர் விகுதி பன்மை ஏவலாம்.
2153,"ஈர் உரையீர் கேளீர், தீர் போதீர் அருள்தீர், மின் உரைமின் கேண்மின், மினீர் உரைமினீர் கேண்மினீர் என்று வரும்."
2154,"அன்றி, குவ்விகுதி ஒருமைக்கும் பன்மைக்கும் ஆகும்."
2155,அன்னையே அனையார்க் கிவ்வா றடுத்தவாறு அருளுகு என்றான் கம்பரா.
2156,ஐ நீ இங்கு இருக்கு என் றேகி சிலப்.
2157,ஏற்றியல் காண்டும் நாம் இவண் தருகு என்னவே சீவக.
2158,"என்பவற்றில் அருளுகு, இருக்கு, தருகு என்பன ஒருமைக்கு ஏவலாம்."
2159,"மீளவும், எந்தைமார்கள் எழுகு என்றான் சீவக. என்பதனுள் எழுகு பன்மைக்கு ஏவலாம்."
2160,பாட்டடி நிகழிடம் தெரிந்திலது. ஒரோவழி இவ்விகுதி வியங்கோள் வினைக்கும் ஆம்.
2161,ஆயிர மாதர்க்குள்ள அறிகுறி உனக்குண் டாகு என்று ஏயினன் கம்பரா.
2162,ஐ பசியும் பிணியும் பகையும் நீங்கி வசியும் வளனும் சுரக்குஎன வாழ்த்தி சிலப்.
2163,", என்பவற்றில் உண்டாகு, சுரக்கு என்பன உண்டாக, சுரக்க என வியங்கோளாய் வந்தவாறு காண்க."
2164,"நனி என்றதனால், மணலை வாரு, சருகை வாரு என ரகரம் ஏவற்கண் உகரம் அரிதின் பெறும்."
2165,உரை ஏவல்வினைக்குச் சிறப்பு விதி செய் என்பது ஏவல்.
2166,"அதனொடு பிறவினை விகுதியாகிய வி, பி இவற்றில் ஏற்றதொன்று இணையின் ஈரேவலாம்."
2167,மீண்டும் பிவ்விகுதி இணையின் மூவேவலாம்.
2168,"அஃதாவது செய்யென்ற ஏவல்மேல் ஏவலும், ஈரேவலும் ஆம்."
2169,எடு செய் செய்வி செய்விப்பி உண் உண்பி உண்பிப்பி வா வருவி வருவிப்பி நன்.
2170,"வருமாறு ஏழனை, ஏழனொடு, ஏழற்குஏழினை, ஏழி னொடு, ஏழிற்கு தொ."
2171,நச். ஏழ் என்ற எண்ணுப்பெயர்ப் புணர்ச்சி ஏழ் என்ற ழகர ஈற்று எண்ணுப்பெயர் உருபேற்குங்கால் அன்சாரியை பெறும்.
2172,"நச். வருமாறு ஏழனை, ஏழனொடு பொருட்புணர்ச்சிக் கண்ணும் ஏழ் அன்சாரியை பெறும்."
2173,"எடு எழுநான்கு, எழுகழஞ்சு, எழுநாழி சிறுபான்மை பொருட்பெயர் வருமொழியாய வழியும், ஏழ் எழு எனத் திரிந்து புணரும்."
2174,"எடு எழுகடல், எழுசிலை, எழுதிசை, எழுபிறப்பு நச்."
2175,உரை ஏழ் நிலைமொழியாக வருமொழியாகப் பத்து என்பது வரின் எழுபஃது எனப் புணரும்.
2176,"நச். ஏழ் நிலைமொழியாக ஆயிரம் வருமொழியாகவரின், ஏழ் என்பது எழ் எனக் குறுகி, எழாயிரம் எனப்புணரும்."
2177,"நச். ஏழ் நிலைமொழியாக வருமொழி நூறாயிரம் வரின், இயல்பாக ஏழ் நூறாயிரம் என்றே புணரும்."
2178,"நச். சிறுபான்மை ஏழாயிரம் எனவும், எழு நுறாயிரம் எனவும் அமைதலும் உண்டு."
2179,"உரை தாமரை வெள்ளம் ஆம்பல் என்ற பேரெண்கள் வர, ஏழ் தாமரை ஏழ்வெள்ளம் ஏழாம்பல் என இயல்பாகப் புணரும்."
2180,"உயிர்முதல் மொழி வரினும், ஏழகல் ஏழுழக்கு ஏழொன்று என இயல்பாகப் புணரும்."
2181,"எடு வரைபாய் வருடை, புலம்புக்கனனே புல்லணல் காளை புற."
2182,"அவ்வழி, இவ்வழி, உவ்வழி, ஆங்கவை, ஈங்கிவை, ஊங்கவை, யாங்கவை என்னுமிவை வன்கணம் வந்துழி இயல்பாயும் மிக்கும் உறழ்ந்தும் புணரும்."
2183,இவை பெயர் நிலையின.
2184,உரை இள.உரை ஆயிடை முதலியன திரிபுடையனவாம் இவையும் வன் கணம் வந்துழி உறழ்ந்து புணரும்.
2185,"உரை இனி, அணி என்பன மிக்குப் புணரும்."
2186,"உரை நச். ஆன், ஈன், பின், முன் என்னுமிவை வன்கணம் வந்துழி னகரஒற்று றகரஒற்றாகத் திரிந்தேபுணரும்."
2187,"நச். அவ்வயின், இவ்வயின், உவ்வயின், எவ்வயின் என்னுமிவையும் வன்கணம் வந்துழி னகர ஒற்று றகர ஒற்றாகத் திரிந்தே புணரும்."
2188,நச். ஊன் உவ்விடம் என்பது ஊன் கொண்டான் என்றாற்போல இயல்பாகவே புணரும்.
2189,"உரை அவ்வாய், இவ்வாய், உவ்வாய், எவ்வாய் என்னுமிவை வன்கணம் வரின் வந்த வல்லெழுத்து மிக்குப் புணரும்."
2190,உரை. அக்கால் என்பது வன்கணம் வரின் லகரம் றகரமாகத் திரிந்து புணரும்.
2191,"உரை அதோள், இதோள், உதோள், எதோள் என்னுமிவை வன்கணம் வரின் ளகரம் டகரமாகத் திரிந்து புணரும்."
2192,", நச்."
2193,"உரை முந்து, பண்டு, இன்று, அன்று என்பன வன்கணம் வரின் இயல்பாகப் புணரும்."
2194,"உரை முந்தை, பண்டை, இன்றை, அன்றை என்பன வன்கணம் வரின் வல்லெழுத்து மிக்கே புணரும்."
2195,இவை யாவும் பெயர் நிலையின.
2196,உரை ஏனை எகின் புணருமாறு எகின் என்பது புளிய மரத்தையும் அன்னப் பறவையையும் குறிக்கும்.
2197,ஏனை ஏகின் என்பது அன்னப்பறவையைக் குறிக்கும் சொல்.
2198,எகின் காண்க.
2199,ஆசிரியரும் இக்கருத்தைப் பின்பற்றிக் கூறியுள்ளார்.
2200,நச். ஏனை வகரம் புணருமாறு வகரத்தை ஈறாக உடைய சொற்கள் அவ் இவ் உவ் தெவ் என நான்காம்.
2201,முதலன மூன்றும் சுட்டுப்பெயர்களாம்.
2202,ஏனை வகர ஈற்றுச் சொல்லாகிய தெவ் என்பது உரிச்சொல்லாம்.
2203,அது படுத்தல் ஓசையான் பெயராம்.
2204,அது பெயராகியவழி இன் சாரியை பெற்று உருபேற்றுத் தெவ்வினை தெவ்வினொடு தெவ்விற்கு என்றாற் போலப் புணரும்.
2205,"மகர முதல்மொழி வருவழி, தெவ் என்பதன் ஈற்று வகரஒற்று மகரஒற்றாகத் திரிந்து புணர்தலுமுண்டு."
2206,உரை ஐ ஐ இஃது ஒன்பதாம் உயிரெழுத்து.
2207,"அகரமும் இகரமும், அகரமும் யகரமும் இதற்குப் போலியாக வருவன."
2208,இஃது அண்பல் முதலை நாவிளிம்பு உறுதலால் பிறக்கிறது.
2209,இது விலங்கல் வளியான் தோன்றுவது என்ப.
2210,சேனா. எனப் பல திறமாக வருவது.
2211,அ இ ய் இவற்றின் சேர்க்கையால் ஐகாரம் உண்டாயிற்று என்பர் சிவஞான முனிவர்.
2212,ஐ தாமரைஅம் வெள்ளம் பல் ஆம்பல்.
2213,தாமரை வெள்ளம் ஆம்பல் என்பன தமிழில் பேரெண்கள்.
2214,"இவை வருமொழியாக, நிலைமொழி ஏழ் என்பதுநிற்பின், இயல்பாக ஏழ்தாமரை, ஏழ்வெள்ளம், ஏழ்ஆம்பல் எனப் புணரும்."
2215,நச். ஐ ஒரு மாத்திரை அளவிற்றாதல் ஐகாரம் ஒரு சொல்லின் முதல் இடைகடை என்ற மூவிடத் தும் குறுகும்.
2216,அது செய்யுட்கண் ஓசை இடர்ப்பட்டு ஒலிக்கு மிடத்துக் குறுகுதலே பெரும்பான்மை.
2217,சிவ. அவிநயம். மொழிமுதற்கண் ஐகாரம் குறுகாது என்றார் இளம்பூரணர்.
2218,சிவஞானமுனிவரும் இக்கருத்தினர்.
2219,ஓரெழுத்தொருமொழியும் குறுகும் என்றார்.
2220,"கை, பை என்பன குறுகின் கய், பய், என ஒன்றரை மாத்திரை அளவினவாம்."
2221,உரை ஐகாரம் மொழிமுதற்கண் குறுகாது.
2222,இடையினும் இறுதி யினும் சிறுபான்மை குறுகும்.
2223,அவ்வாறு குறுகுமிடத்து ஒரு மாத்திரையளவு ஒலித்தல் பெரும்பான்மை ஒன்றரை மாத்திரை ஒலித்தல் சிறுபான்மை எனக் கொள்க.
2224,ஐகாரம் ஒன்றரை மாத்திரை அளவிற்றாய்க் குறுகும் என்பது யாப்பருங்கல உரை.
2225,நேமிநாதம் மூன்றிடத்தும் ஐகாரம் குறுகும் என்றது.
2226,வீரசோழியம் ஐகாரம் ஒன்றரை மாத்திரை யாய்க் குறுகும் என்றது.
2227,நன்னூல் ஐகாரம் மூவிடத்தும் குறுகும் என்றது.
2228,இலக்கண விளக்கமும் அதுவே.
2229,ஐ ஒளக் குறுக்கங்களின் மாத்திரை ஐகாரக் குறுக்கத்திற்கும் ஒளகாரக் குறுக்கத்திற்கும் ஒரோ வொன்று ஒன்றரை மாத்திரை.
2230,"அவ்வாறு உய்த்துணர்ந்து கொள்ளாக்கால், வைகலும் வைகல் வரக்கண்டும் அஃதுணரார் வைகலும் வைகலை வைகுமென் றின்புறுவார் நாலடி."
2231,"எனவும், கைவேல் களிற்றொடு போக்கி வருபவன் குறள் எனவும், ஒளவிய நெஞ்சத்தான் ஆக்கமும் குறள்."
2232,எனவும் வரும் இலக்கியங்களுக்கு இலக்கணம் இன்றாய் முடியும்.
2233,"இங்ஙனம் அளவு குறுகலானும், சீரும் தளையும் சிதையுமிடத்து அலகு பெறாமையானும், ஐகார ஒளகாரக் குறுக்கங்கள் சார்பெழுத்து எனஉயிரின் வேறாயின."
2234,உரை ஐ ஒளத் தோற்றம் பற்றி வீரசோழியம் குறிப்பது ஐ ஒள என்பன ஈரெழுத்தொலிச் சேர்க்கையால் ஆகிய சந்தியக்கரங்கள்.
2235,இவை உயிர்நெடிலேயாயினும் ஒன்றரை மாத்திரையே ஒலிக்கும் என்கிறது வீரசோழியம்.
2236,அகரம் வகரத்தோ டியைந்து ஒள ஆகும் போலியைத் தொல் காப்பியனார் குறிப்பிடவில்லை.
2237,அவர்கருத்துப்படி ஐ என்பது அய் எனப் போலிஎழுத்தாக வரும்.
2238,அவை சந்தியக்கரங்கள் ஆதலின் அம் மாத்திரையளவே பெறும் என்பது ஆசிரியர் புத்த மித்திரனார் கருத்து.
2239,அவற்றைக் குறுக்கங்களாகக் கொண்டு எழுதும் பெருந்தேவனார் உரைப்பகுதி பிழைபட்டுள்ளது. சந்திப்.
