Line Number,Sentence
4978,"குணத்தைக் குறிப்பது என்றும், பருமை வடிவத்தைக் குறிப்பதன்று என்றும் விளக்கிக் கிறிது பெண்மை நிலை எய்தினவர் என்பதை வலியுறுத்தினேன்."
4979,பரிசுத்த ஆவியென்பது அருள் என்னும் பெண்மை என்பதை விளக்கினேன்.
4980,"கிறிது மணவாளன் என்பதற்கும், யான் கூறும் பெண்மைக்கும் தொடர்பில்லை என்று தெளிவு செய்தேன்."
4981,"பெண்மக்கள் ஏறக்குறைய அனைவரும், ஆடவர் பலரும் என் கொள்கையை ஏற்றனர்."
4982,மறுப்பறைந்த பாதிரியார் மனமாற்றம் அடைந்தாரில்லை.
4983,யான் பின்னே அரசியல் துறையில் இறங்கியதை அச்சங்கம் விரும்பவில்லை.
4984,யானும் அச்சங்கஞ் செல்லா தொழிந்தேன்.
4985,கைம்பெண் ஜடி சதாசிவ ஐயரிடம் பலவகை உதவி பெறப் பல திறத்தினர் வருவர்.
4986,எளிய கைம்பெண்களும் வருவார்கள்.
4987,இவர்கட்கென்று ஏதேனும் ஓர் அமைப்பிருந்தால் அது நிலைபேறான உதவியளிப்பதாகும் என்று அடிக்கடி ஐயர் சொல்வர்.
4988,அச்சொல் வீணாகவில்லை சிறு முயற்சியாகியது.
4989,சிறு முயற்சி சௌந்தர்ய மஹாலில் ஒரு கூட்டமாய்த் திரண்டது.
4990,அக்கூட்டத்தில் தலைமை பூண்டவர் ஸர்.வேங்கட ரத்தினம்.
4991,லேடி சதாசிவ ஐயரும் யானும் பேசினோம்.
4992,"என் பேச்சினிடை ஓர் அம்மையார் எழுந்து, பெண்களுக்குரியதைப் பெண்களே பேசி முடிவு காண்டல் நல்லது."
4993,?
4994,என்று கடாவினர்.
4995,"தலைவர், ஆண்கள் தலையிடலாமா?"
4996,தலையிடலாகாதா?
4997,என்று பெண்களை மட் டும் வாக்களிக்குமாறு கேட்டனர்.
4998,"கேள்வி விடுத்த அம்மையார் தவிர மற்றவரெல்லாம், ஆண்களுந் தலையிடலாம் என்றே தீர்ப்பளித்தனர்."
4999,தொடர்ந்து பேசத் தொடங்கினேன்.
5000,மீண்டும் அம்மையார் கிளம்பினார்.
5001,?
5002,என்று வினவினர்.
5003,"தலைவர் ஆணை பெற்று, இக்கூட்டம் விதவை மணத்தை மட்டுங் குறிக்கொண்டதன்று விதவைகளின் வேறு பல நலன்களையுங் குறிக்கொண்டது."
5004,உங்கள் மனம் மணத்தின் மீது மட்டுஞ் செல்கிறது.
5005,விதவை மணமே கூடாது என்னுங் கட்சியில் யான் சேர்ந்தவனல்லன் கைம்மை மணத்துக்கே பயன்படல் வேண்டும் என்னும் எண்ணமுடையவனுமல்லன்.
5006,மணம் அவரவர் விருப்பத்தை யொட்டி நிகழ்வதாதல் வேண்டும்.
5007,அதுவே கட்டாயம் என்று வலியுறுத்தல் கூடாது.
5008,"மனைவியை இழந்த யான், என் மனம் விரும்பினால் கைம்பெண்ணையோ, வேறு எவரையோ மணஞ்செய்து கொள்வேன்."
5009,அஃது என் மனோ நிலையைப் பொறுத்தது.
5010,உங்கள் மனம் பொதுமையிலே கிடந்திருக்கும்.
5011,ஆனால் உங்கள் கேள்வி தனி மனிதரை யொட்டி எழுந்தது.
5012,யான் அதைப் பொதுமையாகவே கொள்ளலானேன்.
5013,தனி மனிதன் உங்கள் உள்ளத்தில் நிலவவில்லை என்றே நினைக்கி றேன் என்ற கருத்துப் பொதுள விடையிறுத்தேன்.
5014,பின்னே கூட்டம் செவ்வனே நடைபெற்றது.
5015,ஒரு சிறு அமைப்புங் காணப்பட்டது.
5016,அது வட நாட்டுக் கிளையொன்றுடன் ஒன்றியது.
5017,தாசிகள் வடநாட்டிலேயே பெண்களுக்கென்று ஒரு மகாநாடு கூடியது.
5018,அதில் தாசிகள் சேர்க்கப்படவில்லையாம்.
5019,அதை மறுத்து அற்புதானந்த சுவாமிகள் தேச பக்த னுக்கு ஒரு கட்டுரை வரைந்து விடுத்தார்.
5020,ஆசிரியக் கட்டுரை ஒன்றும் எழுதப்பட்டது.
5021,திருநெல்வேலியினின்றுஞ் சில கட்டுரைகள் வந்தன.
5022,அங்கே ஒரு மகாநாடுங் கூட இருந்தது.
5023,சாதிவெறியால் அது குலைக்கப்பட்டதென்று கேள்வியுற்றேன்.
5024,தாசி யார்?
5025,தேவடியாள் யார்?
5026,பொருள் வெளிப்படை.
5027,இரண்டும் நல்ல பொருளுடையன.
5028,பின்னே அவை வேறு பொருள் பெறலாயின.
5029,அச்சகோதரிகளை வழுக்கி வீழ்ந்தவர் என்று காந்தியடிகள் சொல்வது வழக்கம்.
5030,அவ் வாட்சியை யானுங் கொள்ளலானேன்.
5031,பெண்ணுலகில் வழுக்கி வீழ்தல் நேர்தலுக்கு ஆணுலகிலுள்ள விலங்கு நீர்மையே மூலம் என்று அடிகள் பேசுவர் எழுதுவர்.
5032,அப்பேச்சும் எழுத்தும் நாட்டில் நல்லுணர்ச்சியை எழுப்பின.
5033,அவை எனது முயற் சிக்குத் துணையாயின.
5034,கபாலீச்சுரத்தில் நீறணிந்து சிவப் பொலிவுடன் தாசிகள் வருவார்கள்.
5035,அந்நிலையிலும் அவர்களைச் சிலர் விலங்குணர் வுடன் நோக்குவர்.
5036,இச்சகோதரிகள் ஏன் பொட்டுக் கட்டிப் பதியிலார் என்னும் பெயரைத் தாங்குதல் வேண்டும்?
5037,பதியிலார் என்னும் பெயரே இவர்களைப் பாழ்படுத்துகிறது.
5038,இவர்கள் மணவாழ்க்கை ஏற்பது நலம்.
5039,இவர்களை மணக்க ஆடவர்க்கு அஞ்சாநெஞ்சம் வேண்டும்.
5040,இவர்களை மணக்க வெளி வருவோரே சிறந்த சீர்திருத்தக்காரராவர் நாட்டுக்கு நலஞ் செய்வோராவர் என்றெல்லாம் எண்ணுவேன்.
5041,அவ்வெண்ணம் பின்னாளில் தேசபக்தனில் ஒரோ வழி எழுத்தாய்ப் பரிணமித்தது.
5042,மாயவரம் மாயவரத்திலே நாக பாசத்தார் சங்கம் என்றொன்று காணப்பட்டது.
5043,அது பின்னே இசை வேளாளர் சங்கம் என்று மாற்றப்பட்டது.
5044,அச்சங்கத்துக்குத் தூண்போன்றவாரயிருந்தவர் மூவலூர் இராமாமிர்த அம்மையார்.
5045,அவ்வம்மையாரை யான் முதல் முதல் நவசக்தி நேயராகவே கண்டேன்.
5046,நாளடைவில் அவர் தாம் போகும் இடங்களிலெல்லாம் நவசக்தி யைப் பரப்பாமலிரார் அதை முதல் தொண்டாகவுங் கருதினார்.
5047,தஞ்சையிலே மாயவர வட்டம் ஒரு சிறந்த காங்கிர கோட்டையாயிற்று.
5048,அக்கோட்டையைக் காத்து வந்த வீரர் சிலர்.
5049,அவருள் இராமாமிர்தமும் ஒருவர்.
5050,அந்நாளில் அவர்க்குக் காந்தியம் இனித்ததுபோல் வேறொன்றும் இனித் திராது.
5051,நூல் நூற்பதில் இராமாமிர்தம் பேர்பெற்றவரானார்.
5052,தஞ்சை ஜில்லாவில் காங்கிர தொண்டாற்ற யான் செல்லுமிடங்களி லெல்லாம் அம்மையாரைக் காணாமலிருத்தல் அரிது.
5053,மகாநாடு இராமாமிர்தம் முன்னணி வேலை செய்வதில் வல்லவர் திறமை வாய்ந்தவர்.
5054,அவர் எங்கே சென்றாலும் வழுக்கி வீழ்ந்த சகோதரிமார் கூட்டம் அவரைச் சூழும்.
5055,அச்சூழல் வாயிலாகக் குறைகள் வெளியாகும்.
5056,குறைகள் அம்மையாரால் திரட்டப் படும்.
5057,பெண்ணுலகில் நேர்ந்த வழுக்களைப் போக்கவந்த கற்பகம் இராமாமிர்தம் என்றே யான் நினைத்தேன்.
5058,அக்கற்பகம் மாயவரத்தில் ஒரு மகாநாடு கூட்ட முயன்றது.
5059,இசை வேளாளர் மகாநாடு கூட்டுதல் எளிதன்று.
5060,அதன் அருமைப்பாட்டை யான் நன்கு உணர்ந்தவன்.
5061,இராமாமிர் தத்தின் முயற்சி அருமையை எளிமையாக்கிற்று.
5062,"மயூரமணி சின்னையா பிள்ளை, எ.இராமநாதன் முதலிய காங்கிர காரர் சகோதரியார் முயற்சிக்குத் துணை நின்றனர்."
5063,முதலில் எனது தலைமை விரும்பட்டதென்று தெரியவந்தது.
5064,இசை வேளாளருள் ஒருவர் தலைமை பூண்பேத சிறப்பு.
5065,மகா நாட்டை உடனிருந்து யான் நடத்துவேன் நவசக்தியில் முழு ஆதரவு தருவேன் என்று மொழிந்து விடுத்தேன்.
5066,அவரையும் தண்டபாணி பிள்ளை யையும் எழும்பூரில் சந்தித்தேன்.
5067,எல்லோரும் மாயவரஞ் சேர்ந்தோம்.
5068,இராமசாமி நாயக்கரும் எங்களுடன் கலந்தனர்.
5069,எங்களை வரவேற்க இசை வேளாளர் குழு திரண்டிருந்தது.
5070,அவர் முகங்களில் நிலவு பொழிந்தது.
5071,இராமாமிர்தத்துக்கு ஆனந்தம்.
5072,நம்முடைய எண்ணம் ஈடேறிற்று.
5073,தமிழ் நாட்டுக்கு நல்ல காலம் பிறந்தது என்று யான் இறுமாப்படைந்தேன்.
5074,எல்லாரும் கூறை நாட்டுக்குப் போந்தோம்.
5075,மகா நாடு காலையில் முறைப்படி நடந்தது.
5076,பிற்பகல் மகாநாடு பேச்சுக்கென்று கூடியது.
5077,யான் முதலில் பேசினேன்.
5078,நீண்ட காலம் என்னுள் அடங்கிக் கிடந்த ஆர்வம் பொங்கியது.
5079,பலநாள் எண்ணிய எண்ணங்களெல்லாம் மிடைந்து குமுறிக் குமுறி வெளிவந்தன.
5080,யான் ஒருபோழ்து எரிமலையானேன் இன்னொருபோழ்து அருவியானேன்.
5081,உங்கள் பெருமை என்ன?
5082,நீங்கள் கலைமகளின் கூறுகள் இசைக்கலையின் நிலைக்களன்கள் உறைவிடங்கள் அது சுரக்குமிடம் நீங்கள்.
5083,இறைவன் எங்கே இருக்கிறான்?
5084,அவன் பொதுவாக எங்கும் இருக்கிறான் சிறப்பாகக் கலைகளில் இருக்கிறான் இசைக் கலையில் இருக்கிறான்?
5085,இறைவன் ஏழிசையாய் இசைப்பயனாயிருக்கிறான் என்று பரவையார் கேள்வர் அருளியதை நினைந்து பாருங்கள்.
5086,உங்கள் உள்ளம் கோயில்இசைக் கோயில்.
5087,அதில் மாசு படர்தலாகாது.
5088,இவ்வேளையில் உங்கள் உள்ளம் எப்படி இருக்கிறது?
5089,உங்களில் அழகுக் கடவுளின் ஒளி கால்கிறது.
5090,அவ்வொளியை யான் காண்கிறேன்.
5091,அதை வாழ்த்துகிறேன் வணங்குகிறேன்.
5092,நீங்கள் என்றுங் கலைக் கோயிலாக விளங்குவீர்களாக.
5093,வணக்கம் வணக்கம் என்றேன்.
5094,மகாநாடு பூம்பொழிலாயிற்று.
5095,சகோதரி மார் சித்திரப் பதுமையாயினர்.
5096,இன்னும் யானே அந்நிலையை வருணித்தல் கூடாது.
5097,எனது சொற்பொழிவு இரண்டேகால் மணி நேரம் நிகழ்ந்தது.
5098,அஃது இரண்டேகால் நிமிடமென ஓடியது.
5099,பின்னே இராமசாமி நாயக்கர் எழுந்தார் என் நண்பர் கலைஞர் அநுபவமில்லாதவர்.
5100,யான் அநுபவமுடையவன் என்று தோற்றுவாய் செய்து பச்சைப் பச்சையாகப் பேசினர்.
5101,தலைவர் முகம் கூம்பிற்று மற்றவர் முகங்களுஞ் சூம்பின.
5102,கூட்டத்தில் மலர்ச்சி மறைந்தது.
5103,தலைவர்க்கும் சகோதரிமார் சிலர்க்கும் கடிதப் போக்கு வரவு நடந்தது.
5104,"நாயக்கர், என் பேச்சை நீங்கள் விரும்பவில்லை என்று தெரிகிறது என்று உரைத்துக் கதர் பிரசாரஞ் செய்தனர்."
5105,நகைச்சுவை அவர் பேச்சில் வழக்கம்போலப் பொதுளியது.
5106,அறிக்கைகள் அன்று மாலை அறிக்கைகள் திரட்டப்பட்டன.
5107,அவைகள் வெளிவரவில்லை.
5108,நினைவிலுள்ள சிலவற்றையும் இங்கே எப்படிக் கூறுதல் கூடும்?
5109,பானை சோற்றுக்கு ஒரு சோறு பதம் பார்ப்பது வழக்கமன்றோ?
5110,இங்கே மூன்று சோற்றைப் பதத்துக்குக் காட்டுகிறேன்.
5111,ஒரு பெரும் நிலக் கிழவர்.
5112,அவர் தம் வைப்பாட்டி ஓர் இசை வேளாளப் பெண் மகள்.
5113,அவள் கருவுற்றனள்.
5114,கருவைச் சிதைக்கக் கிழவர் முயன்றார்.
5115,முயற்சி வெற்றி பெறவில்லை.
5116,குழந்தை பிறந்தது.
5117,கிழவர் ஆணையும் உடன் பிறந்தது.
5118,என்ன ஆணை!
5119,"தாயைப் பார்த்து, இக்குழவியைக் காவேரியில் எறிந்துவிட்டு மறுவேலை பார் என்றார் கிழவர்."
5120,ஈன்ற தாய் என்ன செய்தாள்?
5121,குழவியை ஓரிடத்தில் சேமித்து வைத்துக் கிழவர் ஆணைப்படி நடந்ததாகப் பொய் கூறினாள்.
5122,இஃதோர் அறிக்கையின் சுருக்கம்.
5123,இசை வேளாளர் சங்கத் தொண்டின் பயனாக ஒரு சகோதரி மனந் திரும்பினள்.
5124,அவள் ஆசிரியத் தொழில் மீது நாட்டங்கொண்டாள்.
5125,அதை உணர்ந்த மிராசு தாரர் ஒருவரது வெறி அவளது அழகிய முகத்தைக் கீறிக் கீறிக் கேடு செய்தது.
5126,இஃதோர் அறிக்கையின் சாரம்.
5127,ஓரிளம் பெண்மணி.
5128,அவள் முகத்தில் அறிவு ஒழுகுகிறது.
5129,அவளைக் கண்டதும் அம்மா!
5130,நீர் பள்ளியிற் சேர்ந்து படிக்கின்றீரா என்று கேட்டேன்.
5131,படிப்பா என்று கண்ணீர் உகுத்தாள்.
5132,யான் தேறுதல் கூறி மேலுங் கேட்டேன்.
5133,யான் உயர்தரப் படிப்பை நினைத்தல் முடியுமா?
5134,வெளியூர்க் கேகல் முடியுமா?
5135,தலை போய்விடும்.
5136,இப்பொழுதும் காவல் தெரு விலுண்டு என்றாள்.
5137,உன் தலையை வாங்குவோர் எவர்?
5138,என்று வினவினேன்.
5139,"பக்கத்திலிருந்த மற்றொரு சகோதரி, ஒரு பெயரைச் சொல்லி, இம்மடாதிபதி என்றாள்."
5140,என் பேனா கீழே விழுந்தது.
5141,இஃதோர் அறிக்கையின் கருத்து.
5142,அறிக்கைகள் பலரால் எடுக்கப்பட்டன.
5143,அவைகள் வெளி வந்தால் பல உண்மைகளைச் சீர்திருத்த உலகம் அறிந்து தக்க முறையில் கழுவாய் தேடப்புகும்.
5144,மறுநாள் காலை சீர்திருத்தப் பேச்சுக்கள் பேசப்பட்டன.
5145,சில தீர்மானங்கள் நிறைவேறின.
5146,மகாநாட்டு நடைமுறைகள் வழுக்கி வீழ்ந்தோர்க்கு ஒருவிதப் புத்துணர்ச்சியை உண்டு பண்ணின.
5147,காஞ்சி மாயவர இசைவேளாளர் மகாநாட்டை அடுத்துக் காஞ்சியில் எனது தலைமையில் தமிழ்நாட்டுக் காங்கிர மாகாண அரசியல் மகாநாடு கூடியது.
5148,"அம்மகாநாட்டுக்கும் இராமமிர்தம் போந்து, காங்கிர தொண்டுடன் தஞ் சகோதரிமார் நலத்துக்குரிய பணியுஞ் செய்தனர்."
5149,மூவலூர் ஆம் ஆண்டில் என் பெரும்பொழுது காங்கர தேர்தல் பிரசாரத்தில் கழிந்தது.
5150,ஆம் ஆண்டு மாயவரத்தில் ஈண்டிய ஜடி மகாநாட்டுக் கொட்டகையில் எனது தலைமையில் சன்மார்க்க மகாநாடுங் கூடிற்று.
5151,அதிலும் என் தலைமை யுரையில் வழுக்கி வீழ்ந்த சகோதரிமாரைப் பற்றிக் குறிக்கலானேன்.
5152,அவர் நலத்தை மேம்படுத்தவல்ல தீர்மானங் கள் சிலவும் நிறைவேறின.
5153,அச் சன்மார்க்க மகாநாட்டுக்குப் பின்னர் நாயக்கரது பரபரப்பு இயக்கம் தோற்றமுற்றது.
5154,தொடக்கத்தில் அவ்வியக்கத்தின் மூளையாக எ.
5155,"இராமநாத னும், நுரையீரலாக மயூரி மணி சின்னையா பிள்ளையும் விளங்கினர்."
5156,மாயவரத்து மூளையும் ஈரலும் மூவலூரை ஈர்த்தன.
5157,ஆளைப் பற்றிய கவலை எனக்குக் கிடையாது.
