Line Number,Sentence
6130,இந்தக் கல்வெட்டு இந்தக் குடை வரைக் கோயில் சந்திராதித்திய அரசனால் கட்டப் பெற்றது என்று குறிப்பிடப்பட்டுள்ளது.
6131,ஆனால் ஆண்டுகள் எதுவும் காணப்பட வில்லை.
6132,சந்திராதித்தியன் என்னும் பெயர் பல்லவ மன்னர்களில் ஒருவருடைய பெயராக இருக்கலாம்.
6133,ஆனால் இது எந்தப் பல்லவ அரசனின் விருதுப் பெயர் என்று நம்மால் கூற முடியவில்லை.
6134,வேறு எந்த கல்வெட்டுத் துறை நிபுணர்களும் இது வரை விளக்கமாகக் கூறவில்லை.
6135,இதனை நிழற் படமாக எடுக்க முடியவில்லை.
6136,இதன் தோற்றத்தை முன்னர் கட்டப்பட்டுள்ள செங்கற் சுவர் மறைத்து நிற்கிறது.
6137,எனவே இது இங்கு வெளியிடப்பட்டுள்ளது.
6138,சிங்கவரம் தென் ஆர்க்காடு மாவட்டத்தில் மேலச் சேரிக்கு ஒரு கல் தொலைவில் சிங்கவரம் என்னும் ஊர் உள்ளது.
6139,இங்கு பல்லவர்களால் எடுப்பிக்கப் பெற்ற குடைவரைக் கோயில் ஒன்று உள்ளது.
6140,இது இரங்கநாதர் கோயில் என்று அழைக்கப்படுகிறது.
6141,"இது, மகாபலிபுரம் கடற்கரைக் கோயிலைப் போல் அனந்தசயனம் காட்சி தரும் பெரிய பாறையில் செதுக்கப் பெற்ற சிலையாக இருக்கிறது."
6142,இந்த உருவம் பிற்காலத்தில் செதுக்கப்பட்டது போல் காணப்படுகிறது என்று அறிஞர்கள் கருதுகிறார்கள்.
6143,கோயில் முன்புள்ள குடை வரை மண்டபத்தில் சதுர வடிவான ஒற்றைக் கல் தூண்கள் உள்ளன.
6144,அது வழக்கமான சிற்பவேலைப்பாடுகளும் வழக்கில் உள்ள தாமரை மலர்களாலான வேலைப்பாடுகளுடனும் நிற்கின்றன.
6145,வாயிலின் ஒவ்வொரு சுவர் இறுதியிலும் வாயில் காப்போர் உருவம் உள்ளது.
6146,இது பெரிதும் தளவானூர் கோயில் மண்டபத்தின் வாயிலில் காணப்படுவதைப் போன்று காணப் படுகிறது.
6147,இங்கு பல்லவர் கல்வெட்டு ஒன்றும் காணப்படவில்லை.
6148,அதோடு இங்கு ஏதாவது இருந்திருக்கும் என்ற அடையாளம் எதுவும் இல்லை.
6149,ஏனெனில் கோயிலின் மண்டபத்திற்கு எதிராக இப்பொழுது புதிதாகக் கட்டப்பட்ட மண்டபம் தூண்களின் அடிப்பகுதியை மறைத்து நிற்கிறது.
6150,கோயில் வழிபடுவதற்காக உள்ளது போல் இருக்கிறது.
6151,இக் கோயிலின் ஒரு பகுதியில் புரோகிதர்களின் பண்டங்கள் வைப்பதற்காகக் கட்டப்பட்டுள்ள பகுதிகள் அப்புறப்படுத்தப் பட்டது போல் காணப்படுகிறது.
6152,எனவே இந்தக் குடைவரைக் கோயிலைத் தோண்டிய மூல அரசன் யார் என்பதைக் கூறுவதில் பல்வேறு ஐயப்பாடுகள் காணப்படுகின்றன.
6153,இவ்வூர் வேத கிரீசுவரர் மலை என்னும் அழகிய குன்றின் அடிவாரத்தில் அமைந்திருக்கிறது.
6154,பாதி வழியில் கிழக்கு மேற்காகப் பாதை பிரிந்து செல்கிறது.
6155,கிழக்கே சென்றால் குடைவரைக் கோயிலை அடையலாம்.
6156,இந்தக் கோயில் மலையுச்சியுள் வேத கிரீசுவரர் கோயிலுக்கு அடி கீழே இருக்கிறது.
6157,மண்டபம் கிழக்கு நோக்கி சிற்ப வேலைப்பாடுகள் அதிகமின்றி எளிய முறையில் இருக்கிறது.
6158,இங்கு எழுதகங்கள் எதுவும் புடைத்துக் கொண்டு இருக்கவில்லை.
6159,மேலும் இங்கு பெரிய அறைகள் எதுவுமில்லை.
6160,மண்டபத்தின் இறுதியில் வாயில் காப்போர்களின் உருவங்கள் உள்ளன.
6161,"இது தோற்றத்திலும், தரைப்படத்திலும் மகேந்திரவாடியிலுள்ள பல்லவர் கோயிலைப் போன்று காணப்படுகிறது."
6162,"மத்திய இடைவெளி, பூமியினின்று தளவரிசை அடி உயரத்தில் உள்ளது."
6163,மேலே ஏறுவதற்குக் கற்படிகள் அமைக்கப் பட்டுள்ளன.
6164,மண்டபம் அடி நீளமும் அடி அகலமும் அடி உயரமும் உள்ளதாக இருக்கிறது.
6165,இரு வரிசையாகத் தூண்கள் நிலை நிறுத்தப்பட்டுள்ளன.
6166,மேற்குச் சுவரை ஒட்டி திரு உண்ணாழிகை அடி நீளமும் அடி அகலமும் உள்ளதாக இருக்கிறது.
6167,கிழக்கு நோக்கி ஒரு சிறு வாயில் இருக்கிறது.
6168,உண்ணாழிகையின் தளம் மண்டபத் தளத்தினின்று அடி உயரத்தில் உள்ளது.
6169,உண்ணாழிகையின் நடுவில் சிவலிங்கம் சீர் பெற நிலைநாட்டப் பெற்றுள்ளது.
6170,வாயிலில் காவலர் உருவங்கள் உள்ளன.
6171,வாயில் காப்போர்கள் இரு கைகளை உடையவர்களாய்க் காணப் படுகின்றனர்.
6172,ஒரு கையை மடக்கி இடுப்பின் மீது வைத்திருக் கின்றனர்.
6173,மற்றொரு கையில் பெரிய தண்டாயுதத்தை வைத்திருக் கின்றனர்.
6174,"அவர்களது தலைப்பாகையும், நிற்கும் நிலையும் அமைப்புப் பாணியும் மகேந்திரன் காலத்தில் உள்ளவைகள் என்பதை எடுத்துக் காட்டுவதாக உள்ளன."
6175,உண்ணாழிகையின் மேல் வாயிலில் வழக்கம் போல் கார்னி புடைத்துக் கொண்டு இருக்கிறது.
6176,பல கணிகளின் அணிகளும் உள்ளன.
6177,இரு உருவங்களும் தனித் தனியே நான்கு கைகள் உடையதாகச் செய்யப்பட்டுள்ளன.
6178,இதனால் மூலக் கோயில் சிவ பெருமான் திருக்கோயிலாக உருவாக்கப்பட்டிருக்கிறது.
6179,பிற்காலத்தில் இந்து மத எழுச்சியில் மும்மூர்த்திகள் நான்முகன் திருமால் சிவன் ஆகிய தெய்வங்களை வழிபடும் இடமாக மாற்றப்பட்டிருக்கிறதாகத் தெரிகிறது.
6180,இப்பொழுது இக் கோயிலில் அன்றாடப் பூசை எதுவும் நடைபெறவில்லை.
6181,ஆனால் மக்கள் அடிக்கடி வந்து வழிபட்டுச் செல்கிறார்கள்.
6182,இங்கு ஒரு தல புராணம் உண்டு.
6183,அதில் இரு முனிவர்கள் சாபத்தினால் பறவையாக மாறி தங்கள் சாபம் நீங்க வழிபட்டு வருவதாகக் கூறப்பட்டுள்ளது.
6184,இந்த பரிசுத்த முனிப் பறவைகள் இன்றும் ஒழுங்காக மாலை தோறும் மலைக்குப் போந்து திருக்கோயிலைத் தெரிசிக்க வருகிறது.
6185,பூசாரி கைகளின் மூலம் கொடுக்கும் சோற்றைப் பெற்றுச் செல்லுகிறது.
6186,அவைகள் உயர்ந்த புடை சிற்பமாக கண்ணைக் கவரும் முறையில் மூலப்படிமத்தினின்று படியெடுத்த உருவம் போல் செதுக்கப்பட்டுள்ளன.
6187,இந்தக் கோயிலில் காணப்படும் கல்வெட்டுகள் படியெடுக்கப் பட்டுப் படிக்கப்பட்டுள்ளன.
6188,ஆம் ஆண்டைய தெற்குப் பகுதிக் கல்வெட்டு ஆராய்ச்சித் துறையினர் ஆண்டு அறிக்கையின் ஆம் பக்கங்களில் வெளியிடப்பட்டுள்ளன.
6189,உலாந்தா அதிகாரிகள் குழுவொன்று பக்கத்தில் உள்ள சத்ரா துறைமுகத்தினின்று பார்வையிட்டது சம்பந்தமாகக் காணப் படுகிறது.
6190,"சுவர்களிலும், தூண்களிலும் உள்ள எல்லா இடங் களிலும் இந்தக் கையொப்பங்களால் நிரப்பப்பட்டுள்ளன."
6191,பின் பக்கத்திலுள்ள தூண்கள் ஒன்றின் தலைப்புறுப்பில் பழந்தமிழ் கல்வெட்டு ஒன்று காணப்படுகிறது.
6192,இந்தக் கல்வெட்டின் தொடக்கப் பகுதி சீர்குலைந்துள்ளது.
6193,அதோடு எக்காரணத்தி னாலோ இறுதிப் பகுதி நிறைவு பெறாதிருக்கிறது.
6194,ஆனால் மற்றப் பகுதிகள் நன்றாகப் பாதுகாத்து வைக்கப்பட்டிருக்கிறது.
6195,ஆரம்ப முதல் இறுதி வரை வாதாபி கொண்ட நரசிங்கப் போத்தரசர் என்ற பெயர் தெளிவாகக் காணப்படுகிறது.
6196,இது முதலாம் மகேந்திர வர்மப் பல்லவன் மகன் முதலாம் நரசிம்மவர்மன் காலத்தில் வரையப்பட்ட கல்வெட்டு என்று உறுதியாகத் தெரிகிறது.
6197,"இது, முதலாம் நரசிம்மவர்மன் கி.பி."
6198,இல் மேலைச் சாளுக்கியர்களின் தலை நகரான வாதாபியைக் கைப்பற்றி வெற்றிக் கொடி நாட்டியதை நினைவூட்டுவதாக வரையப்பட்டது.
6199,வாதாபி பம்பாய் மாநிலத்தில் உள்ளது.
6200,வாதாபியை வெற்றி கொண்டதால் முதலாம் நரசிம்ம வர்மன் வாதாபி கொண்டான் என்ற தமிழ்ப் பட்டத்தைச் சூடிக் கொண்டான்.
6201,இங்குள்ள திருமால் நான்முகன் உருவங்கள் ஒரு வேலை நரசிம்மன் காலத்தில் உருவாக்கப்பட்டிருக்கலாமோ என்ற ஐயப்பாட்டை எழுப்புகிறது.
6202,ஒரு சிலர் மகேந்திரவர்மன் காலத்தில் இக்கோயில் பணி தொடங்கப் பெற்று நரசிம்மவர்மன் காலத்தில் நிறைவெய்தி இருக்கலாம் என்று எண்ணுகின்றனர்.
6203,நரசிம்மவர்மன் வாதாபியை வெற்றி கொண்டது.
6204,ஆம் ஆண்டாகும்.
6205,அவனுடைய படைத்தலைவர்களில் ஒருவர் சிறுத் தொண்ட நாயனார் என்னும் சைவப் பெரியார் ஆகும்.
6206,பெருய சிறுத் தொண்டர் என்று கூறுவதன் மூலம் நரசிம்மன் வாதாபியைக் கொண்டது சிறுத் தொண்டர் மூலம் என்று தெரிகிறது.
6207,திருக்கழுக்குன்றம் வேத கிரீசுவரர் கோயிலில் உள்ள அறையின் மேற்குச் சுவரில் ஒரு கல்வெட்டு இருக்கிறது.
6208,"அதை காலஞ் சென்ற திரு வெங்கையா அவர்கள், படியெடுத்துப் படித்து புத்தகமாக அளித்துள்ளார்."
6209,இதன் மூலம் ஒற்றைக் கல் மண்டபத்தின் ஆதி மூலத்தானத்தில் உள்ள இலிங்கம் அகற்றப்பட்டிருக்கலாம் என்று எண்ணப்படுகிறது.
6210,தென் இந்தியாவில் உள்ள திருக்கழுக்குன்றத்து சைவத் திருக்கோயில் களிலெல்லாம் மிகத் தொன்மையான தொன்றாக கந்தவர்மனால் உருவாக்கப் பட்டதாகும்.
6211,வேதகிரீசுவரர் கோயில் மலை நடுவே குடைந்து உருவாக்கப் பெற்றது.
6212,இது மிகத் தொன்மை வாய்ந்த கோயில்களில் ஒன்று இதில் சில பகுதிகள் பிற்காலத்தில் உருவாக்கப் பெற்றது.
6213,பிரதான கோயில் மூன்று பெரிய கல்பாளங்களால் கட்டப்பட்டிருக்கிறது.
6214,அங்கே சுவர்கள் மீது புடைசிற்பங்களால் பல உருவங்கள் ஆக்கப்பட்டன.
6215,தென் பக்கத்தில் நான்முகனும் வட பக்கத்தில் திருமாலும் காணப்படுகிறார்கள்.
6216,கீழே சிவபெருமான் திருவடிகளின் கீழே மார்க்கண்டன் அமர்ந்துள்ளார்.
6217,தெற்குச் சுவர் மீது கையில் ஆயுதத்துடன் சண்டிகேசுவரரும் நந்திக்கேசுவரரும் இருக்கிறார்கள்.
6218,சோமகந்த அரங்கம் பிரதான கோயிலின் பின்புறச் சுவர் மீது செதுக்கப் பெற்றுள்ளது.
6219,இந்தக் கோயில் ஒற்றைக் கல் மண்டபத்தை விடப் பிந்தியது.
6220,மலை உச்சியில் சில அடிகளுக்கு அப்பாலிருந்து கோயில் வரை கற்படிகள் செதுக்கப்பட்டுள்ளன.
6221,பூமியில் கருங்கல் தூண் இருக்கும் பாதைப் பக்கத்தில் நிலை நாட்டப்பட்டுள்ளது.
6222,அதில் இராச சிம்மன் பாணியில் கட்டப்படும் கோயில் வழக்கமாகப் பெரிதும் காணப்படும் சிங்கங்கள் தீட்டப்பட்டுள்ளது.
6223,இந்தத் தூணின் தோற்றம் இராச சிம்மன் காலத்தைச் சேர்ந்த பல்லவர்கள் குகைக் கோயில் என்பதை தெளிவாக எடுத்துக்காட்டுகிறது.
6224,எனவே இக்கோயில் கி.பி.
6225,ஆம் நூற்றாண்டிற்கு முந்திய காலத்தில் உள்ள பல்லவர்களின் அரண் என்பதை மெய்ப்பிப்பதற்கு போதிய சான்றாக இருக்கிறது.
6226,வடக்குச் சுவர் மீது யோக தட்சணாமூர்த்தி காணப் படுகிறார்.
6227,அவருக்கு அருகில் சிவ பெருமானின் சாபத்தைப் பெற்ற இரு முனிவர்கள் இருக்கின்றார்கள்.
6228,அவ்விருவர்களும் புனிதப் பறவையாக மாறி மலைக்கு நாடோறும் வந்து கண்டு உணவு பெற்று செல்கிறார்கள்.
6229,சீய மங்கலம் குடைவரைக் கோயில் சீயமங்கலம் வட ஆர்க்காடு மாவட்டம் வந்தவாசி வட்டாரத்தில் உள்ளது.
6230,இது தேசூரில் இருந்து தெற்கே ஒரு கல் தொலைவில் உள்ளது.
6231,சீயம் என்பதற்குச் சிங்கம் என்று பொருள் கொள்ளப்படும்.
6232,எனவே இது மகேந்திரவர்மன் தந்தை சிம்ம விட்ணுவின் பெயரால் இவ்வூர் எழுந்திருக்கலாம் என்று எண்ணப்படுகிறது.
6233,இந்தக் கோயில் ஏனைய பல்லவர் குடைவரைக் கோயில் களைப் போல் முன் மண்டபத்தையும் உண்ணாழிகையும் உடையது.
6234,உண்ணாழிகையின் உள்ளே சிவலிங்கமும் வாயிலின் இரு மருங்கினும் வாயில் காப்போர் உருவங்களும் உள்ளன.
6235,இஃதன்றி மண்டபத்தின் இரு கோடிகளிலும் இரு போர் வீரர் உருவங்கள் காணப்படுகின்றன.
6236,இந்த உருவங்கள் கையில் கேடயமும் வாளும் தாங்கி நிற்கின்றன.
6237,இத்தகைய உருவங்கள் ஏனைய கோயில்களில் காணப்படவில்லை.
6238,மண்டபத்தில் உள்ள தூண்களில் சிங்க உருவம் நின்று கொண்டு முன்காலைத் தூக்கி நிற்பது போல் காணப்படுகின்றது.
6239,வழக்கம் போல் தாமரைப் பூவும் உள்ளது.
6240,ஆகையால் கோயிலுக்குள் எப்பொழுது இருள் சூழ்ந்து இருக்கிறது.
6241,இந்தத் தடுப்புச் சுவர் பிற்காலத்தில் கட்டப்பட்டதாகும்.
6242,இங்குள்ள கல்வெட்டில் கோயிலை அமைத்தவன் லலிதாங்குரன் என்றும் கோயிலின் பெயர் அவனபாசன பல்லவேசுவரம் என்று குறிப்பிடப்படுகிறது.
6243,அதாவது சாசனத்தில் லலிதாங்குரேண ராஜ்ஞாவ ரிபாஜன பல்லவேவரந்நாம் காரிதமே தத் ஸவேதா கரண்ட மிவபுண்ய ரத்நாநம் என்று கூறப்பட்டுள்ளது.
6244,சீயமங்கலம் குடைவரைக் கோயில் தளவானூர்க் கோயிலுக்குப் பக்கத்தில் உள்ளது.
6245,இது சைவ சமய நாயன்மாரால் பாடல் பெற்ற கோயில்.
6246,குரங்கணின் முட்டத்துக்கு அருகில் பல்லாவரம் பல்லவ புரம் என்ற ஊர் உள்ளது.
6247,அதன் அருகில் ஒரு குடைவரைக் கோயில் உண்டு.
6248,இது பஞ்ச பாண்டவர் மலை என்று கூறப்படுகிறது.
6249,பல்லவபுரம் என்ற மூன்று ஊர்களில் இது ஒன்று.
6250,இது ஏனைய குடைவரைக் கோயிலை விட புதிய முறையில் உள்ளது.
