Line Number,Sentence
274,ஊர்ச்சிறுவர் நடன அரங்கின் ஒப்பனையைக் காணக் காலை முதல் அணியணியாக வந்து கொண்டிருந்தனர்.
275,அன்று நகரம் எங்கும் ஒரே பரபரப்பாகக் காணப்பட்டது.
276,கணிகையர் தெருக்களில் இருந்த கணிகையர் அனைவரும் நடன மண்டபத்திற் கூடிவிட்டனர்.
277,"குறித்த நேரத்திற்கு முன்பே நகரத்தில் இருந்த பிரபுக்கள், அரசியல் அலுவலர்கள், வணிகப் பெருமக்கள் முதலியோர் மண்டபத்தில் குழுமி இருந்தனர்."
278,நடன மேடை அரங்கேற்றத்திற்குக் குறித்த நேரம் வந்தது.
279,சோழ வேந்தன் தலைமையில் பேரவை கூடியது.
280,யாவரும் ஆவலோடு மேடையை நோக்கினர்.
281,அங்குப் புகழ்பெற்ற சித்திராபதி தோன்றினாள்.
282,"அவளுடன் இசை ஆசிரியன், மத்தளம், யாழ், குழல் முதலிய பல வகை வாத்தியம் வல்லுநர் காட்சி அளித்தனர்."
283,மாதவிக்கு ஆடல் பயிற்றுவித்த ஆடல் ஆசிரியனும் அங்கு இருந்தான்.
284,அவையினர் இமைகொட்டாது மாதவி வருகையை எதிர் நோக்கினர்.
285,அரங்கேற்றம் நடிப்பக்கேற்ற நேரம் வந்தது.
286,அவள் ஆடிக் காட்டிய நடன வகைகளைக் கண்ணுற்ற அவையோர் மிக்க மகிழ்ச்சி அடைந்தனர்.
287,யாவரும் மாதவியின் நடனச் சிறப்பைப் பாராட்டி மகிழ்ந்தனர்.
288,"அன்று முதல் மாதவி, நடன அரசி என மாநகரத்தாரால் பாராட்டப்பட்டாள்."
289,அப்பொழுது அங்குச் சித்திராபதி அனுப்பிய தோழி ஒருத்தி வந்தாள்.
290,அவள் கையிற் சோழ அரசன் மாதவிக்குப் பரிசளித்த மாலை இருந்தது.
291,அவள் இதனை ஆயிரத்தெண்கழஞ்சு பொன் தந்து விலையாகப் பெறுபவர் மாதவிக்குக் கணவராகத் தகுவர் என்றாள்.
292,அவள் மனம் என்ன பாடுபட்டிருக்கும்?
293,"அவள், காதலன் பிரிந்த நாள் முதல் கால்களில் சிலம்பை அணிவதில்லை மேகலாபரணத்தைக் கழற்றிவிட்டாள்."
294,அதனைக் குறிப்பாக உணர்ந்த கோவலனுடைய பெற்றோர் சொல்லொணாத் துயர் உற்று வருந்தினர்.
295,கற்புக்கரசி தம் மருமகன் நாடகக் கணிகையின் சேர்க்கையில் ஈடுபட்டு இருந்ததைக் கண்ணகியின் பெற்றோர் அறிந்தனர் அறிந்து என் செய்வது?
296,அவர்கள் அடிக்கடி வந்து தம்செல்வ மகளைக் கண்டு போயினர்.
297,உத்தம பத்தினியாகி கண்ணகி தன் பெற்றோரிடமும் தன் மனவருத்தத்தைக் காட்டாது மலர் முகத்துடன் நடந்து கொண்டாள்.
298,அப்பெரு மகளது சிறந்த ஒழுக்கத்தைக் கண்ட உற்றாரும் உறவினரும் அவளைக் கற்புக்கரசி என்று பாராட்டினார்.
299,"இங்ஙனம் வாழ்ந்து வருகையில், சித்திரை மாதத்தில் ஆண்டுதோறும் இந்திர விழாத் தொடக்கம் ஆயிற்று."
300,முசுகுந்தன் என்ற சோழ அரசன் கால முதல் காவிரிப் பூம்பட்டினத்தில் இந்திர விழா ஆண்டுதோறும் நடைபெற்று வந்தது.
301,அவ்விழா இருபத்தெட்டு நாட்கள் நடைபெற்றது.
302,அந்த நாட்களில் தமிழ்நாட்டுப் பல பகுதிகளிலிருந்து மக்கள் பூம்புகார்க்கு வந்து விழாவில் கலந்துகொண்டனர்.
303,பல சமய வாதிகளும் புகார் நகரத்திற் கூடிச் சமயப் பிரசாரம் செய்தனர்.
304,நகரம் முழுவதும் கண்கொள்ளாக் காட்சியைத் தந்தது.
305,விழாவின் கடை நாளில் நகரமாந்தர் அனைவரும் தத்தம் பரிவாரங்களுடன் கடலில் நீராடிச் சென்றனர்.
306,கடற்கரையில் பாட்டு கோவலனும் மாதவியுடன் கடலாடச் சென்றான்.
307,இருவரும் நீராடித் தனி இடம் ஒன்றில் தங்கினர்.
308,அப்பொழுது கோவலன் யாழை எடுத்து இன்பப்பாடல் ஒன்றைப் பாடினான்.
309,அப்பாடல் காவிரியாற்றைப் பற்றிய பாடல்.
310,"காவிரி என்ற உன்னை மணந்த சோழன் கங்கை என்னும் வேறொருத்தியை மணந்தாலும், நீ அதற்காக அவனைக் கோபிப்பதில்லை."
311,உனது கற்பின் சிறப்பே உன் மன அமைதிக்குக் காரணமாகும் என்னும் பொருள் கொண்டது அப்பாடல்.
312,"மாதவி, ஊழ்வினை வசத்தால், இதனைத் தவறாகக் கருதினாள் கோவலன் வேறொரு பெண்மீது அன்பு கொண்டான் என்று எண்ணினாள்."
313,"ஆதலின், உன் கணவனை வாழ்த்துகிறேன், என்னும் பொருள் கொண்டது அப்பாடல்."
314,என்று தவறாக எண்ணி விட்டான்.
315,உடனே அவன் முகம் சிவந்தது உதடுகள் துடிதுடித்தன விழிகள் சிவந்தன ஆசனத்தை விட்டு எழுந்தான்.
316,கோவலன் படபடப்பைக் கண்ட மாதவிக்கு ஒன்றும் விளங்கவில்லை.
317,அவள் அவனை அச்சத்தோடு நோக்கினாள்.
318,"நான் செல்கிறேன் இனி உனது முகத்தில் விழிப்பதில்லை, என்று சினந்து கூறி அகன்றான்."
319,"கோலலன் வெறுப்பு மாதவி அவன் சீற்றவுரை கேட்டு, இடியோசை கேட்ட நாகம்கோல் ஆனாள்."
320,"அவள் கடைத் தெருவில் இருந்த கோவலனைச் சந்தித்து, மாதவியின் துன்ப நிலையைக் கூறிக் கடிதத்தை நீட்டினாள்."
321,"கோவலன் அக்கடிதத்தை வாங்காமல் ஆடல் மகள் பொய்யை மெய்போல நடிப்பதில் வல்லவள், என்று கூறி அகன்றான்."
322,அவன் கூற்றை வசந்த மாலை கூறக் கேட்ட மாதவி மனம் வருந்திக் கட்டிலிற் சாய்ந்தான்.
323,மதுரைப் பிரயாணம் கண்ணகி கண்ட கனவு மாதவியை விட்டுப் பிரிந்த கோவலன் எங்குச் சென்றான்?
324,அவன் நேரே கங்ணணகி இருந்த மாளிகையை நோக்கிச் சென்றான்.
325,அங்கு வீண்பழி ஒன்றை என் கணவர் மேல் சுமத்தி அவருக்குத் தீங்கு இழைக்கப்பட்டது.
326,"பின்னர், யான் அந்நகரக் காவலன் முன்சென்று வழக்குரைத்தேன்."
327,"ஆதலால், அவ்வரசனுக்கும் அவ்வூருக்கும் தீங்கு நேரிட்டது."
328,இக்கனவு தீக்கனவு ஆதலின் நினைக்கு யான் சொல்லாதிருந்தேன்.
329,காவிரி கடலோடு கலக்கும் இடத்தில் இரண்டு குளங்கள் இருக்கின்றன.
330,அவை சோமகுண்டம் சூரியகுண்டம் என்னும் பெயர்களைப் பெற்றவை.
331,"கண்ணகி நகைத்து, அங்ஙனம் துறைமூழ்கித் தெய்வம் தொழுதல் எங்கட்கு இயல்பன்று, என்று சொல்லி இருந்தாள்."
332,கண்ணகி அன்பு அவ்வமயம் கோவலன் அங்குத் தோன்றினான் அவனைக் கண்ட தேவந்தி தன் அறைக்குச் சென்று விட்டாள்.
333,இந்நிலை எனக்கு நாணத்தைத் தருகின்றது என்றான்.
334,மாதவிக்குத் தரத் தன்னிடம் பொருள் இல்லை ஆதலின் இங்ஙனம் மனம் வருந்திக் கூறுகிறான் என்று கண்ணகி கருதினாள்.
335,"அதனால் அவள் புன்னகை புரிந்து, இன்னும் என் காற்சிலம்புகள் இருக்கின்றன."
336,அவற்றைக் கொள்க என்றாள்.
337,"கோவலன் யோசனை உடனே கோவலன், பெண்ணே, நாம் வேற்றூர்க்கு செல்லலாம்."
338,"அங்குச் சென்று உள் சிலம்பை விற்றுவரும் பணத்தை முதலாகக் கொண்டு வாணிகம் செய்து, இழந்த பொருளை ஈடுசெய்யலாம்."
339,இன்று இரவின் கடையாமத்தில் நீ என்னுடன் வருக நாம் பீடுமிக்க மாட மதுரைக்குச் செல்வோம் என்றான்.
340,கண்ணகி கற்புடைமடந்தை ஆதலின் கணவன் விருப்பப்படி மதுரை செல்ல உடன்பட்டாள்.
341,இருவரும் பல இடங்களில் தங்கித் தங்கி நடந்தனர் நடந்து.
342,சீரங்கத்தை அடைந்தனர் அங்கிருந்த சோலையில் மாதவர் இருந்து சமய ஆராய்ச்சி செய்து கொண்டிருந்தனர்.
343,மறுநாள் அவரும் அவர்களோடு மதுரை செல்லப் புறப்பட்டனர் புறப்பட்டு வழி நடந்து உறையூரில் தங்கினர்.
344,மூன்று வழிகள் மறுநாள் அவர்கள் உறையூரைவிட்டு மதுரை நோக்கி நடக்கலாயினர் நடுப்பகலில் ஒரு சோலையில் தங்கி இளைப்பாறினர்.
345,அப்பொழுது அங்கு மறையவன் ஒருவன் பாண்டியனை வாழ்த்திக் கொண்டு வந்தான்.
346,"அவன், இங்குள்ள பாலைநிலத்தைக் கொம்பாளூர் வழியே கடந்து சென்றால், மூன்று வழிகள் செல்வதைக் காண்பீர்கள்."
347,"கோவலன் உடனே இது தேவதை என்பதை எண்ணி, மந்திரம் செபித்தான்."
348,அஃது அவ்வளவில் மறைந்தது.
349,பின்னர்க் கோவலன் மற்ற இருவருடன் வழிநடந்து பாலைநிலத் தேவதையாகிய துர்க்கையின் கோவிலை அடைந்தனன்.
350,கண்ணகியைப் புகழ்தல் அப்பொழுது துர்க்கை அம்மனுக்கு மறவர் பலியிட்டு வழிபட்டனர்.
351,கண்ணகி அப்புகழுரைக்கு நாணிக் கணவன் பின் சென்று நின்றாள்.
352,கௌசிகன் தூது பின்னர் மூவரும் அக்கோவிலை விட்டு புறப்பட்டு வழி நடந்தனர் வழியில் மறையவர் வாழ்பதியில் தங்கினர்.
353,கோவலன் இருவருக்கும் தண்ணீர் கொண்டு வரப் போனான்.
354,அதனால் கோவலன் அதனைத்தான் எழுதியதாகக் கூறித் தன் பெற்றோரிடம் தருமாறு வேண்டி அகன்றான்.
355,"அத்தென்றல், சங்கப் புலவரது செந்நாவினால் புகழப்பட்ட இச்சிறப்புகளைப் பெற்றிருந்ததால் பொதியில் தென்றல் என்பதை விடச் சிறந்து விளங்கியது."
356,வையை யாறு மதுரை மாநகர்க்குத் தன் நன்னீரால் உண்ணீர் உதவும் தாய் போன்றவள் வையை என்னும் பொய்யாக் குலக்கொடி.
357,இரண்டு பக்கங்களிலும் அலைகள் அரித்த கருமணல் கூந்தலாகத் தெரிந்தது.
358,பல கோவில்கள் மதுரை மாநகரம் பழைய காலத்திலிருந்தே சமயத்திற்கும் வரலாற்றுக்கும் பெயர் பெற்ற இடமாகும்.
359,அங்குப் பல கோவில்கள் நீண்ட காலமாக இருந்தன.
360,மாநகரம் மதுரை மாநகரம் ஒருகோட்டை மதிலுக்குள் இருந்தது.
361,அதனைச் சூழ ஆழமான அகழி ஒன்று இருந்தது.
362,அதற்கு அப்பால் காவற்காடு இருந்தது.
363,கோட்டை வாயிலை யவனர் வாளேந்திக் காத்து தந்தனர்.
364,பாண்டி நாட்டுத் துறைமுக நகரமான தொண்டியில் இறக்குமதியான அகிலும் பட்டும் சந்தனமும் கர்ப்பூரமும் பிறவும் மதுரையில் விற்கப்பட்டன.
365,அங்கங்கு நாடக அரங்குகள் இருந்தன இசை அரங்குகள் இயங்கின நடன சாலைகள் காட்சி அளித்தன.
366,சங்கப் புலவர் இனிதிருந்து தமிழ் ஆராய்ந்து வந்த மண்டபம் வானுற ஓங்கி வளம்பெற இருந்தது.
367,அரசனது கோவில் நகரத்தின் நடுவிடத்தில் நடுநாயகமாக விளங்கியது.
368,"அதனைச் சூழ அமைச்சர், சேனைத்தலைவர் முதலிய அரசியல் அலுவலாளர் தெருக்கள் இருந்தன."
369,மணத்தை மகிழ்விக்கும் மணமிகு பூஞ்சோலைகள் அங்கங்குக் காட்சி அளித்தன.
370,அச்சோலைகளில் மாலை நேரங்களில் மாநகரத்து ஆடவரும் பெண்டிரும் அன்புடன் அமர்ந்து நற்காற்று நுகர்ந்தனர்.
371,கடைத்தெரு மதுரை மாநகரத்துக் கடைத்தெரு மிக்க சிறப்புடைய தாகும்.
372,அங்குப் பலவகை வண்டிகள் செய்து விற்கப்பட்டன.
373,பலவகைப் பூக்களைக் கொண்டும் ஒரே வகை மலர்களைக் கொண்டும் பலவகை மாலைகளைக் கட்டி விற்ற கடைகள் காட்சி அளித்தன.
374,"நெல், தினை, சாமை, தோரை, சோளம், கேழ்வரகு முதலிய கூலவகைகளை விற்ற கடைகள் பல இருந்தன."
375,"எள், நெய், தேங்காய், நெய், முத்துக்கொட்டை."
376,"நெய், பசுநெய் முதலியன விற்கும் நெய்க்கடைகள் பல இருந்தன."
377,கொற்கையிலிருந்து கொண்டு வரப்பட்ட முத்து வகைகளை விற்ற கடைகள் பலவாகும்.
378,"கொடிப் பவளம், பவள மாலைகள் இவற்றை விலை கூறிய கடைகள் பலவாகும்."
379,இங்ஙனம் பல வளங்களாலும் பொலிவுற்றுத் திகழ்ந்த பீடு மிக்க மாட மதுரையைக் கோவலன் சென்று கண்டான்.
380,கோவலனும் கண்ணகியும் அடிகள் அறிவுரை மாதவர் இருக்கையில் தங்கிய கவுந்தியடிகள் கோவலனின் வருத்தத்தை அகற்ற எண்ணினார்.
381,அருந்தவத்தோர் செய்யும் நல்ல உபதேச மொழிகளைக் கேளாமல் தீயசெயல் களில் ஈடுபடுபவர் பலராவார்.
382,அவர் அத்தீச்செயலால் துன்பத்தை அநுபவிக்கும் பொழுது செயலற்று வருந்துகின்றனர்.
383,இராமன் பட்டபாட்டை நீ அறியாயா?
384,"அவன் சீதைக்காக வில்லை வளைத்த துன்பம், பின்னர் அவளைப் பிரிந்ததால் வந்த துன்பம் முதலியவற்றை நீ அறிவாய் அல்லவா!"
385,நீ நளன் வரலாற்றை அறிவாய் அல்லவா?
386,நீ நளன் வரலாற்றை அறிவாய் அல்லவா?
387,இவையாவும் தீவினை வசத்தால் வந்தனவாகும்.
388,இராமனும் நளனும் தம் நாடு நீங்கிப் புதிய இடங்கள் பலவற்றுக்கும் சென்று சொல்லொணாத் துன்பம் உற்றனர்.
389,மாடலன் வாழ்த்துரை இவ்வாறு கோவலன் மாதவர் ஆசிரமத்தில் தங்கி இருக்கையில் மாடலன் என்ற மறையவன் அங்கு வந்தான்.
390,அவன் பொதிய மலையை வலம் கொண்டு குமரித்துறையில் நீராடி மதுரையை அடைந்தான்.
391,கோவலன் அவனை வணங்கினான்.
392,அம்மறையவன் பூம்புகாரைச் சேர்ந்தவன்.
393,நீ இப்பிறவியில் செய்த அரிய செயல்கள் பல.
394,மணிமேகலைக்குப் பெயர் வைத்துக் கொண்டாடிய அன்று மறையவர்க்குப் பொன்தானம் செய்தனை.
395,அம்மறையவருள் ஒருவன் முதியவன்.
396,அவன் தள்ளாடிச் சென்று கொண் டிருந்தான் அப்பொழுது மதயானை ஒன்று பாய்ந்து வந்து அவனைத் தூக்கிச் சென்றது.
397,மறையவன் அலறினான்.
398,அச்செயல் செயற்கரும் செயல் ஆகும்.
399,மற்றொரு நாள் கீழ் மகன் ஒருவன் பத்தினி ஒருத்தி மீது பொய்ப்பழி கூறினான்.
400,அதனை நம்பிய அவள் கணவன் அவளை வெறுத்தான்.
401,இங்ஙனம் கணவன்மனைவியர்க்குள் குழப்பம் உண்டாக்கிய அக்கீழ் மகனை ஒரு பூதம் பற்றித் துன்புறுத்தத் தொடங்கியது.
402,"அப்பொழுது அப்பூதம் கோவல, நீ நல்லவன்."
403,இவன் தீயவன்.
404,இவனைப் புடைத்து உண்பதே நல்லது.
405,நீ கவலைப்படாதே என்று கூறிக் கொன்றது.
406,"நான் அறிந்த அளவில், நீ இப் பிறவியில் நல்லறமே செய்தனை."
