Line Number,Sentence
2219,வரைந்து கோடலே இனி செய்தற்குரியதென அதற்கு வேண்டிய முயற்சியில் ஈடுபடுகின்றான் காலம் சிறிது நீளுகிறது.
2220,அவனைச் சின்னாளாய்க் காணப்பெறாமையால் காதலியாகிய தலைமகள் மனநோய் மிகுந்து மேனி வாடுகின்றாள்.
2221,சில நாட்களாய் நாம் அவரைக் காணப் பெறாமையால் வரைவிற்குரிய முயற்சி மேற்கொண்டுள்ளார்.
2222,அவர் என்பது மெய்யேயாகும் நீ அது வரை பொறுத்திருக்க வேண்டும். எனத்தோழி சொல்லுகிறாள்.
2223,இந்நிலையில் ஒரு கால் அவன் வந்து தலைவியினுடைய மனையின் சிறைப்புறத்தே நிற்கின்றான்.அதனைக் கண்டுகொள்கிறாள் தலைமகள்.
2224,"அவன் செவிப்படுமாறு தன் தோழிக்கு உரைப்பவள் போல, தோழி, நமது வருத்தமும் கைம்மிக்கு விட்டது."
2225,மெய்யும் தீயுமிழ் தெறலின் வெய்தாயிற்று.
2226,"இதனால், தலைமகளது காதல் மிகுதியைத் தலைமகன் செவ்வையாக உணர்ந்து ஊக்கம் மிகுகின்றான்."
2227,தேய்கமா தெளிவே. என்று சொல்லி அவன் கூற்றை மறுக்கின்றாள்.
2228,"இதன்கண், மற்றொரு செய்தியையும் அவள் கூறாமல் கூறுகின்றான்."
2229,நின் நாட்டுக் கழிகளில் ஆம்பல்கள் நிறைய உள்ளன.
2230,"நுதல் கவின் இன்னது என்றது, நினது நுதலழகு பசலையுற்றுப் பிறர் அலர் தூற்றுதற்கு ஏதுவாயிற்று, என்பதாம்."
2231,மனைவாழ்வில் வினை குறித்தும் பொருள் கருதியும் ஆண்மகன் மனையின் நீங்கி வேற்றூர்க்குச் செல்வது இயல்பு.
2232,அப்போது களில் மனைவியாகிய காதலி அவன் பிரிவாற்றாது கண்துயில் இன்றிக் கையற்று வருந்துவள்.
2233,படீஇயாஎன் கண்ணே. என்று சொல்லுகிறாள்.
2234,இனி அவனை மனத்தால் உள்ளுவதைக் கைவிடுகிறேன்.
2235,"என் கண்கள் உறங்குக, என்பாளாய், பெருங்கடல் சேர்ப்பனை உள்ளேன், தோழி!"
2236,"என் கண் படீஇயர், என்று இசைக்கின்றாள்."
2237,இதனை நீ அறியவில்லையா? என்ற கருத்து ஒன்று பொதிந்து கிடப்பதைக் காணலாம்.
2238,"இவர் மருதத்திணைக்குரிய பாட்டுக்கள் பாடியதனால், மருதம் பாடிய இளங்கடுங்கோ எனப்படுகின்றார்."
2239,பெருங் கடுங்கோவின் பாட்டுக்களைப்போல இவர் பாடியனவாக அகத்தில் இரண்டும் நற்றிணையில் ஒன்றுமே கிடைத்துள்ளன.
2240,சோழ நாட்டில் வாழ்ந்த வேளிர் குடியில் அஃதை என்பவள் தோன்றி உருநலத்தால் உயர்ந்து விளங்கினாள்.
2241,அவளை மணக்க விரும்பிப் பாண்டியர் குடியிலும் சேரர் குடியிலும் தோன்றிய செல்வர்கள் அவள் தந்தையை அணுகினார்கள்.
2242,"அந்நாளில் அவர்கள் நிலை தாழ்ந்திருந்த காரணத்தாலோ, எதனாலோ, அவன் மகள் மறுத்தான்."
2243,"அதனால், இருவரும் சேர்ந்து அஃதை தந்தைபால் போர் தொடுத்தனர்."
2244,அவனுக்குத் துணையாகச் சோழ வேந்தன் நின்று போர் செய்தான் அப்போர் சோழநாட்டுப் பருவூரில் நடைபெற்றது.
2245,சேர பாண்டியர் குடித்தோன்றல்கள் போர்ப்பரிசு அழிந்து தோற்றோடினர்.
2246,அவ்வுரையில் தோற்றோடிய சேர பாண்டியர் இயற்பெயரைக் குறியாது குடிப்பழி மறைக்கும் இவரது செயல் இவருடைய மான மாண்பைக் காட்டுகிறது.
2247,கோட்டம்பலத்துத் துஞ்சிய சேரமான் மாக்கோதை சேர மன்னர் குடி நிரலில் இறுதியில் நின்றது கோதையர் குடி.
2248,"அக்குடியில் தோன்றிய வேந்தர்களான குட்டுவன் கோதை, கோக்கோதை மார்பன் என்போர் வழியில் இச்சேரமான் மாக்கோதை காணப்படுகின்றான்."
2249,இவன் முடிவில் இறந்து பட்ட இடம் கோட்டம்பலம் என்பது.
2250,அஃது இப்போது கொச்சி நாட்டு முகுந்தபுரம் தாலுக்காவில் அம்பலக்கோடு என்ற பெயரைத் தாங்கிக் கொண்டு உளது.
2251,"இந்த மாக்கோதை தன் மனத்துக்கினிய மங்கையொருத்தியை மணந்து, உயிரொத்த காதலாற் பிணிப்புண்டு, இனிது வாழ்ந்தான்."
2252,"அவள் இறந்து போகவே, இவன் கொண்ட துயரத்துக்கு எல்லையில்லை."
2253,"ஒருவனுக்கு மனைவியை இழப்பதால் உண்டாகும் துன்பம் மிகப்பெரிது அதனிற் பெரியது பிறதில்லை, என அறிஞர் கூறினர்."
2254,என்னை இதன் பண்பு! என்று அவன் எண்ணினான்.
2255,அந்த எண்ணம் ஒரு பாட்டாய் உருக்கொண்டது.
2256,யாங்குப்பெரி தாயினும் நோய்அளவு எனைத்தே உயிர்செகுக் கல்லா மதுகைத்து அன்மையின்?
2257,என் இதன் பண்பே என்பது அப்பாட்டு.
2258,"எனக்கும் அவகும் உயிர் ஒன்று என்பது உண்மையானால், அவளது உயிர் நீங்கிய போதே எனது உயிரும் நீங்கவேண்டும் நீங்கவில்லையே!"
2259,"உயிர் வாழ்கின்றேனே! என்பானாய், இன்னும் வாழ்வல்! என்று நோக்கினான்."
2260,இப்பெற்றியோன் சின்னட்கெல்லாம் உடல் நலம் குன்றிக் கோட்டம்பலத்தே இருந்து இறந்து போகின்றான்.
2261,வஞ்சி நகர்க்கண் இவன் உறைந்த பகுதி மாக்கோதை என்ற பெயர் எய்திற்று.
2262,இவனைப் பள்ளி படுத்த இடம் மாக்கோதைப் பள்ளி என வழங்குவதாயிற்று.
2263,இம்மாக்கோதை வழியில் இறுதியாக இருந்தவர் பெருமாக்கோதை யாராவர்.
2264,"இவர்காலத்தே வஞ்சிக்களம் வஞ்சிக்குளம் எனவும், அஞ்சைக்களம் எனவும் மாக்கோதை மகோதை எனவும் மக்கள் வழக்கில் மருவத் தலைப்பட்டு விட்டன."
2265,வஞ்சி மாநகரிடத்தே கொடுங்கோளூர் தோன்றிவிட்டது.
2266,முசிறி கடலில் மூழ்கி மறைந்தது.
2267,இப்பெருமாக்கோதையார் சைவசமய குரவருள் ஒருவ ராகிய நம்பியாரூரர் காலத்தில் இருந்து சிவநெறியிற்சிறந்த சேரமான் பெருமாள் நாயனாராய்த் திகழ்ந்தவர்.
2268,பிற்காலக் கல்வெட்டுக்கள் அவர்கள் கண்ட மகோதையை மகோதையார் பட்டினம் எனச் சிறிது மாற்றின.
2269,டாக்டர் சேய்சு .
2270,அவ்வேந்தர் செயல் வகைகளில் தமிழ் மொழிபால் அவர் களுக்கிருந்த பற்று மிகுந்திருந்தது.
2271,செய்தி தெரிந்ததும் வேந்தன் சினத்துடன் அவரை நெருங்கினான்.
2272,தமிழ் முழுதறிந்த சான்றோர் என்பது தெரிந்து அவருக்கு அவன் தன் கையில் விசிறிகொண்டு வீசலுற்றான்.
2273,"சான்றோர் விழித்தெழுந்து, அவனுடைய தமிழன்பை வியந்து பாராட்டி அரசியல் அறிவுரை பல வழங்கினார் என்ற வரலாறு நாடறிந்த தொன்று."
2274,"இதனால், சேர வேந்தரின் செந்தமிழ்ப் பற்று எத்துணை சிறந்திருந்தது என்பது தெற்றென விளங்கும்."
2275,"இவ்வேந்தர் காலத்து அரசியல், வாணிகம், சமயம், சமுதாயம் முதலிய கூறுகள் தனித்தனியே ஆராயத் தகுவன."
2276,இங்கே பண்டை நாள் என வழங்குவது கடைச் சங்க கால மாகும்.
2277,அக்காலத்தே சேரநாடு செந்தமிழ் நலம் சிறந்து தமிழ் கூறும் நல்லுலகமாய் விளங்கிற்று.
2278,சேரநாடு பிற்காலத்தே கேரள நாடென வழங்கத் தலைப்பட்டது.
2279,"அதன் பின் கேரளோற்பத்தி, கேரள மகாத்துமியம் என்ற வரலாற்றுப் போலிகள் உண்டாயின."
2280,மேலை மலைத் தொடரின் தென்கோடியில் நிற்கும் பொதியிலும் தென்குமரியும் பாண்டியர்க்குரியவாகக் குறிக்கப்படுகின்றன.
2281,கி.பி.
2282,"அந்த அறிஞர்கள் குறிக்கும் தொண்டி, முசிறி முதலியன சேரர்களைப் பாடிய சங்க இலக்கியங்களிலும் காணப்படுவன."
2283,இவ்வாறே வடகன்னட நாட்டில் வழங்கும் செய்திகளால் பண்டை நாளைச் சேரநாடு கோகரணத்துக்கு வடக்கேயும் பரந்திருந்தமை தெளிவாய்த் தெரிகிறது.
2284,கி.பி.
2285,இக்குறிப்புக்களால் சேரநாட்டின் வடவெல்லை வடகன்னடத்துக் கோகரணம் வரையில் பரவி இருந்த தென்ற கொள்கை மேற்கொள்ளத் தக்கதாகின்றது.
2286,பிற்காலத்தே சேரநாட்டுக்கு எல்லை பலவகையாகக் கூறப்படுவதாயிற்று.
2287,மலையாளம் சில்லாவில் குறும்பர் நாடு தாலுக்காவைச் சேர்ந்த ஒரு பகுதிக்குப் பழநாடு என்ற பெயர் உண்டு.
2288,"அதன் வடவெல்லை வடகரையென்றும், அதனருகே வந்து கடலிற்கலக்கும் ஆறு சேரவாறு என்றும் பெயர் பெறும்."
2289,"வடகரையென்னும் ஊர் படகரா என்றும், அந்த ஆறு தோன்றும் இடத்தருகேயுள்ள ஊர் சேரபுரம் என்றும் இப்போது வழங்குகின்றன."
2290,"இதனால், ஒரு காலத்திற் சேரநாடு வடக்கிற் பழநாட்டோடு நின்றமை தெரிகிறது."
2291,இதற்கு வடக்கில் கோகரணத்தையும் பின்பு ஹோனவாற்றையும் எல்லையாகக் கொண்டு கொண்கான நாடு விளங்கிற்று.
2292,"பிற்காலத்தறிஞர் பொங்கர் நாடு, ஒளிநாடு என்ற இரண்டையும் விலக்கி, வேணாடு, புனனாடு என்ற இரண்டையும் பெய்து கூறுவர்."
2293,"இவற்றுள் தென்பாண்டி, குட்டம், குடம் என்பன நன்கு தெரிகின்றன."
2294,"திண்டுக்கல்லுக்கு மேற்கிலுள்ள குன்றுகட்குப் பன்றி மலையென்று பெயர் வழங்குவதால், அப்பகுதியைப் பன்றி நாடெனக் கொள்ளலாம்."
2295,வேணாடென்பது மேனாட்டு யவனர் குறிப்புக்களால் கொல்லத்துக்கும் அதங்கோட்டுக்கும் இடையிலுள்ள பகுதி யென்பதை அறிகின்றோம்.
2296,"புனனாடென்பதைப் புன்னாடெனக் கொள்ளின், அது, கொங்கு நாட்டின் வடக்கிலுள்ள நாட்டைக் குறிப்பதாகும்."
2297,தென்பாண்டி நாட்டுப்பகுதி பல்லாண்டுகளாக மலையாள வேந்தர் அரசியற்கீழ் அகப்பட்டொழிந்தது.
2298,கன்னடமொழிந்த ஏனைப்பகுதி முற்றும் இப்போது கேரள நாடு என்ற ஒரு பெயர் தாங்கி நிலவுகிறது.
2299,"இப்பகுதியின் தொன்மை கூறுவனவாகக் கேரளோற்பத்தி, கேரளமான்மியம் என்னும் இரு நூல்கள் உள்ளன."
2300,"பெரும்புழையாறு முதல் புதுப்பட்டினம் வரையில் உள்ளது கூபகநாடு என்றும், புதுப் பட்டினத்தி லிருந்து கன்னெற்றி வரையில் உள்ளது."
2301,"கேரளநாடென்றும், கன்னெற்றிக்கும் தென்குமரிக்கும் இடையில் கிடப்பது மூஷிக நாடென்றும் கூறப்படுகின்றன."
2302,மூஷிக நாடு கூசல நாடெனவும் வழங்கப்படும்.
2303,கன்னெற்றி என்பது தென் கொல்லமாமென இராபர்ட்டு சூவெல் கூறுகின்றார்.
2304,பிற் காலத்தே வேணாட்டின் வடபகுதி வேளகமென்றும் தென்பகுதி வானவாசியென்றும் வழங்கலாயின.
2305,கொண்கான நாட்டிலுள்ள ஏழில் மலை பிற்காலத்தே எலிமலையெனக் குழறிக் கூறப்படுகிறது.
2306,"கேரள வரலாறு கூறுவோருட்சிலர், வேணாடென்பது வானவநாடு என்பதன் திரிபு எனக் கூறுகின்றனர்."
2307,மேலைக் கடற்கரைப் பகுதியான சேரநாட்டின் வடக்கிற்பகுதி கொண்கான நாடு.
2308,அதன் தெற்கில் உள்ளது குடநாடு அதனையடுத்து நிற்கும் தென்பகுதி குட்டநாடு அதன் தெற்கு வேணாடு என்பது முன்னர்க் காணப்பட்டது.
2309,சேரநாட்டு வடகரைக்கும் கோகரணத்துக்கும் இடை நின்ற நாடு கொண்கான நாடு.
2310,இது துளுநாடென்றும் வழங்கியதுண்டு.
2311,பொன் வானியாற்றுக்கும் வடகரைச் சேரவாற்றுக்கும் இடையிலுள்ளது குட நாடு பொன்வானி .இந்நாளில் பொன்னானியென வழங்குகிறது.
2312,கொல்லத்துக் கும் பொன் வானிக்கும் இடையிலுள்ளதாகிய நாடு குட்டநாடாகும்.
2313,இதனால் குட்டநாட்டின் பரப்புத் தெளிவாகத் தோன்றுகிறது.
2314,இந்தச் சேர நாட்டை ஏனைத் தமிழ் நாட்டினின்றும் பிரித்து வைப்பது மேற்கு மலைத்தொடர்.
2315,"வஞ்சிக்களம் அஞ்சைக்களமெனவும், வஞ்சனாடு, அஞ்சனாடு எனவும் மருவுவது மலை நாட்டிற் பெருவழக்கு."
2316,"தெற்கிற் பொதியின்மலையிலிருந்து வடக்கு நோக்கிச் செல்லும் இம்மலைத் தொடர், பம்பாய் மாகாணத்துத் தபதி நதிக்கரை வரையில் தொடர்ந்து நிற்கிறது."
2317,இதன் நீளம் கல்.
2318,இவற்றுள் மலையாளம் சில்லாவிலுள்ள பிளவு போல ஏனைய பிளவுகள் இடைக்காலத்தில் மக்கட்போக்கு வரவுக்குப் பெருந்துணை செய்யவில்லை.
2319,இப்பெரும்பிளவைப் பாலைக் காட்டுக் கணவாய் என்பது வழக்கம்.
2320,"இப்பிளவின் வடபகுதி வடமலைத் தொடரெனவும், தென்பகுதி தென் மலைத் தொடரெனவும் வழங்கும்."
2321,இப்பிளவின் இடையகலம் இருபது கல்.
2322,சென்னையிலிருந்து கோயம்புத்தூர் வழியாக மேலைக் கடற்கரைக்குச் செல்லும் இருப்புப்பாதையும் பெருவழியும் இப்பிளவினூடே செல்கின்றன.
2323,"இப்பிளவில் பாரதப்புழை என்ற பெயர் தாங்கி வரும் ஆறு மேற்கே ஓடி, பொன்வானி யாற்றோடு கலந்து, மேலைக்கடலிற்சென்று சேர்கிறது."
2324,அப்பிளவின் கீழை வாயிலாகப் பாலைக்காடு நிற்கிறது.
2325,சேரநாட்டின் வடபகுதியான குடநாட்டு மலைகளுள் ஏழில் மலை அடி உயரமுள்ளது.
2326,இது நிற்கும் பகுதி கொண்கானமென்பது முன்பே கூறப்பட்டது.
2327,"இதுவே கொங்கணமென்றும், இங்கே வாழும் கொண்கானிகள் கொங்கணிகள் என்றும் வழங்கப்படுவது நாளடைவில் உண்டான சிதைவு."
2328,இவ்வாறே குதிரை முகம் போலக் காட்சியளிக்கும் மலை முடியைக் குதிரைமலையென்று வழங்கினர்.
2329,இவ்வேழில் மலைக்குக் கிழக்கில் தோன்றும் குன்றுகளில் ஒன்று நீலகிரி எனப்படுகிறது.
2330,சேரன் செங்குட்டுவன் வடநாடு சென்ற போது தங்கினது இவ்விடத்தேயாம் இதற்கு இங்குள்ள செங்கோட்டூர் இனிய சான்று பகருகிறது.
2331,"மேனாட்டவர் முதற்கண் அப்பகுதிக்கு வந்தபோது, அங்கே துளுவும் கன்னடமும் கலந்து தமிழ் தனது செந்நிலை வழுவி வந்த காலமாகும்."
2332,"அதனால், அவர்கள் ஏழில் மலை என்னாது எலிமலை என்றும், அங்கே எலிகள் மிக நிறைந்திருந்தன என்றும் தவறு கூறியிருக்கின்றனர்."
