Line Number,Sentence
1233,ஆராய்ச்சி யென்பது எல்லாருஞ் செய்யக்கூடிய எளிசெயலன்று.
1234,"மதிநுட்பம், பரந்தகல்வி, நடுநிலை, அஞ்சாமை, தன்னலமின்மை, மெய்யறி யவா என்னும் ஆறும் ஆராய்ச்சியாளர்க்கு இன்றியமையாத பண்புகளாகும்."
1235,"உலகத்திலுள்ள மூவாயிரம் போன்ற மொழிகளுள், தமிழைப் போன்று அடிமுதல் முடிவரை தருக்கப் பொருளாக விருப்பது வேறொன்றுமில்லை."
1236,எல்லா நாட்டிலும் காட்டிக் கொடுப்பார் இருக்கவே யிருக்கின்றனர்.
1237,"ஆயினும், வெற்றித் தொகையினர் தமிழ்நாட்டிலேயே உள்ளனர்."
1238,இங்ஙனம் எதையெடுத்தாலும் தமிழனுக்கு உரிமையில்லாவாறு வரலாறு திரித்தெழுதப்பட்டுள்ளது.
1239,பிறமொழி யெழுத்துகள் எகிபதிய சுமேரிய நாகரிகத் தோற்றம் கி.மு.
1240,ஆண்டுகட்கு முற்பட்டது.
1241,எகிபதிய எழுத்து முதற்கண் படவெழுத்து பின்னர்க் கருத்தெழுத்து .
1242,சுமேரிய நாகரிக வழிப்பட்ட சேமிய வெழுத்து முதற்கண் அசை யெழுத்து கி.மு.
1243,பின்னர் ஒலியெழுத்து கி.மு.
1244,கிரேக்கர் சேமிய ஒலியெழுத்தைப் பினீசிய வணிகர் வாயிலாகக் கற்றுத் தமக்கேற்றவாறு திருத்திக்கொண்டதாகச் சொல்லப்படு கின்றது.
1245,"கிரேக்க எழுத்தினின்று இலத்தீன் எழுத்தும், இலத்தீன் எழுத்தி னின்று ஆங்கிலம் முதலிய பிற ஐரோப்பிய மொழி யெழுத்துகளும் அமைந்துள்ளன."
1246,"கிரேக்க எழுத்துகள் அல்பா , பேற்றா என்று தொடங்குவதால், அவ் வண்ணமாலை அல்பாபேற்று எனப் பெயர் பெற்றது."
1247,"இது தமிழில் உலக வழக்கில் அஅன்ன ஆவன்னா அ ஆ, அவ்வா என்று வழங்குவது போன்றது."
1248,"கிரேக்க வண்ணமாலை முதற்கண், , , , , , , ."
1249,", ,,,,, , ,,, , , , ."
1250,", என்னும் எழுத்துகளைக் கொண்டிருந்தது."
1251,பின்னர்த் திகம்மா என்னும் நீக்கப்பட்டுவிட்டது.
1252,"பின்னர் , , , என்னும் எழுத்துகள் சேர்க்கப்பட்டன."
1253,கிரேக்க எழுத்துகளுட் பலவற்றின் வடிவம் வேறு.
1254,அவற்றை இங்குக் காட்டலாகாமையால் ஆங்கில வடிவிற் குறிக்கப்பட்டுள்ளன.
1255,"சீன எழுத்து, கி.மு."
1256,ஆண்டுகட்கு முற்பட்டது.
1257,அது கருத் தெழுத்துகளைக் கொண்டது.
1258,சப்பானியர் கி.பி.
1259,ஆம் ஆம் நூற்றாண்டுகளில் சீனக் கருத் தெழுத்துகளைக் கடன் கொண்டனர்.
1260,அவை ஐயாயிரமாகப் பெருகி ஈராயிரமாகக் குறைக்கப்பட்டுள்ளன.
1261,", ."
1262,அரபி யிலக்கியம் கி.பி.
1263,ஆம் நூற்றாண்டில் தொடங்கிற்று.
1264,அதன் எழுத்தும் அக் காலத்ததே.
1265,அது எழுத்துகளைக் கொண்டது.
1266,"அவற்றுள் ஒன்று அ , இ , உ என்னும் முக்குறிற்கும் பொதுவான குறி."
1267,வகர வெழுத்து உகரத்தையும் யகரவெழுத்து இகரத்தையும் இடத்திற்கேற்ப உணர்த்தும்.
1268,"இருவேறு குறிகள் சேர்ந்து ஆ, ஈ, ஊ என்னும் நெடில்களைக் குறிக்கும்."
1269,சில இணைப்பெழுத்துகளும் உண்டு.
1270,அரபிக்கு இனமான எபிரேய இலக்கியம் கி.மு.
1271,ஆம் நூற்றாண்டில் தோன்றியது.
1272,அது எழுத்துகளைக் கொண்டது.
1273,உயிரொலிகளை யுணர்த்தும் முறையில் அது அரபியொத்ததே.
1274,"அவ்விரு மொழிகளின் வண்ணமாலைகளும் வெவ்வேறு வடிவுகொண்டனவேனும், கிரேக்கத்தைப் போன்று கானானிய மூலப் பினீசிய வண்ணமாலையினின்று திரிந்தவையே."
1275,தமிழின் தொன்மை கி.மு.
1276,"ஆண்டுகட்கு முற்பட்ட ஊர் என்னும் பாபிலோனிய நகரகழ்வில், கி.மு."
1277,ஆண்டுகட்குமுன் சேரநாட்டினின்று ஏற்றுமதி செய்யப்பட்ட தேக்குமர உத்தரம் கண்டெடுக்கப்பட்டுள்ளது.
1278,ஊர் என்பது நகர் என்று பொருள்படும் அக்கேடியச் சொல்.
1279,அதுவே பண்டைத் தமிழகத்தில் மருதநில நகரைக் குறித்த பொதுச்சொல்.
1280,அவனே அரபியர்க்கும் இசரவேலர்க்கும் பொதுவான முன்னோன்.
1281,அவன் காலத்தில் அவ் வீரினத்தாரும் தோன்றவே யில்லை.
1282,"ஆகவே, அரபியும் எபிரேயமுமான அவர் மொழிகளுந் தோன்ற வில்லை."
1283,ஆபிரகாம் பேசின மொழி அக்கேடியன்.
1284,தமிழர் தோற்றமும் பரவலும் குமரிநாட்டு மக்கள் தமிழின் வெவ்வேறு நிலையில் வெவ்வேறு திசை சென்று பரவியுள்ளனர்.
1285,கால்டுவெல் திரவிட ஒப்பியல் இலக்கணம் சென்னைப் பதிப்பு ஆம் பக்கம் பார்க்க.
1286,தன்மைப் பன்மைப் பெயர் ஆங்கிலத்தில் என்றும் வடமொழியில் வயம் என்றும் திரிந்திருத்தல் காண்க.
1287,மேன் என்பது சீனத்தில் வகுப்பைக் குறிக்கும் தொகுதிப் பெயர்.
1288,அது மன் என்னும் தென்சொல்லோடு தொடர்புடையதாயிருக்கலாம்.
1289,மன் மன்று மந்து மந்தை.
1290,"மன்னுதல் கூடுதல், மிகுதல், பெருத்தல்."
1291,ஐம்பாற் படர்க்கைச் சுட்டுப் பெயர்கள் தோன்றுமுன் தான் தாம் என்பன படர்க்கைச் சுட்டுப் பெயர்களாகவே யிருந்தன.
1292,எடு மல்வளம்.
1293,மல்லல் வளனே தொல்.
1294,மல்மலை இயற்கை வளம் மிக்கது.
1295,வறப்பினும் வளந்தரும் வண்மையும் மலைக்கே நன்.பாயி..
1296,"இப் பொருளை மேலை மொழிகளிற் காண முடியாது, இங்ஙனமே ஏனையவும்."
1297,", , , , , . , , , ., பேரா."
1298,"இராமச்சந்திர தீட்சிதரின், , என்னும் வரலாற்று நூல்களைப் பார்க்க."
1299,மடகாசுக்கர் மட்டத்திற் சற்றுக் கிழக்கே தள்ளியிருந்ததே தமிழன் பிறந்தகம்.
1300,தமிழ் எழுத்துத் தோற்றக் காலம் தலைக்கழகத் தோற்றம் கி.மு.
1301,", ஆண்டுகட்கு முந்தியது."
1302,அதற்குமுன் மூவதிகார இலக்கணமும் வகுக்கக் கால்நூற்றாண்டேனுஞ் சென்றிருத்தல் வேண்டும்.
1303,இலக்கணத்திற்கு முன் பல்துறை இலக்கியம் தோன்ற அரை நூற்றாண்டு சென்றிருக்கும்.
1304,இலக்கிய விலக்கணப் புலவியம் பனையேட்டில் எழுத்தாணி கொண்டு சுழித்துக் கீச்சி எழுதப்பட்டது.
1305,"ஏட்டின் இடப்பக்கம் அடிப்பக்கம் அகன்றும் வலப்பக்கம் நுனிப்பக்கம் சிறுத்தும் இருப்பதனால், இடம் வலமாக எழுதப்பட்டது."
1306,"பட்டவன் பீடு கல்லிலும், வேந்தன் பட்டயம் கல்லிலும் செம்பிலும், பொறிக்கப்பட்டன."
1307,ஏட்டெழுத்து வளைகோடும் வெட்டெழுத்து நேர்கோடும் மிக்கிருப்பதே இயற்கை.
1308,"உயிரும் மெய்யும் மட்டும் உள்ள வண்ணமாலை குறுங்கணக்கு என்றும், உயிர்மெய்யொடுங் கூடியது நெடுங்கணக்கு என்றும், பெயர் பெற்றன."
1309,பிறநாட்டு வண்ணமாலைகளெல்லாம் குறுங்கணக்கே.
1310,"பிற்காலத்தில், வடமொழி வண்ணமாலையைப் பின்பற்றிப் பல திரவிட இனத்தாரும் தத்தமக் கேற்றவாறு வண்ணமாலை வகுத்துக் கொண்டனர்."
1311,வடமொழி வண்ணமாலையின் பின்மை .
1312,வடமொழி காலத்தால் தமிழுக்குப் பல்லாயிரம் ஆண்டு பிந்தியது.
1313,"தமிழ் திரிந்து திரவிடமாகித் திரவிடம் ஆரியமாக மாறியபின், அதன் ஒரு பகுதி வடஇந்தியப் பிராகிருதத்துடன் கலந்து வேதமொழியாயிற்று."
1314,அவ் வேதமொழி தமிழுடன் கலந்து சமற்கிருதந் தோன்றிற்று.
1315,"கிரேக்கத்தில் , , என்ற மூவெழுத்துகளே மூச்சொலியுடன் கூடியவை."
1316,"ஆ, ஈ, ஊ அ,இ,உ ஆகிய மூன்றும் தமிழில் முதன்முதல் தோன்றிய சுட்டெழுத்துகள்."
1317,ஆரியச் சுட்டுச் சொற்கட்கெல்லாம் மூலம் தமிழ்ச் சுட்டெழுத்துகளே.
1318,கால்டுவெல் திரவிட ஒப்பியலிலக்கணம் சென்னைப் பதிப்பு மற்றும் ஆம் பக்கம் பார்க்க.
1319,"ரு, லு என்பவை உயிரெழுத்துகளல்ல குற்றியலுகரத்தொடு கூடிய ரகர லகர மெய்கள்."
1320,"கிரேக்கத்தில் க்ஸ் , என்றுள்ள இணைமெய் வடமொழியில் க்ஷ் க்ஷ், என்று வளர்ச்சியடைந்துள்ளது."
1321,தமிழ் ஆய்தமே வடமொழி விஸர்க்கம்.
1322,"வண்ணமாலை வரிசையமைப்பிலும் உயிர்மெய் யமைப்பிலும், வடமொழி முற்றும் தமிழைப் பின்பற்றியதே."
1323,சுப்பிரமணியன் தவறு திரு.
1324,"சுப்பிரமணியனார் தமிழின் தொன்மை முன்மைகளை அறியாது, கி.மு."
1325,தமிழ்க்காப்புத் தமிழர் கையினின்றும் நழுவிவிட்டது.
1326,"வடசொற்களும் சொற்றொடர்களும் வடவெழுத்துகளும் கல்வெட்டிற் கலந்ததொடு, வடமொழிக் கல்வெட்டுகளும் படிப்படியாய்த் தோன்றியுள்ளன."
1327,இரண்டோ ரிடத்தில் வடமொழிக் கல்வெட்டே தோன்றியுள்ளது.
1328,"யாப்பருங்கல விருத்தியில் கூறப்பட்ட உருவெழுத்து, உணர்வெழுத்து, ஒலியெழுத்து, தன்மை யெழுத்து என்னும் நான்கையும், திரு."
1329,சுப்பிர மணியனார் பிறழ வுணர்ந்திருக்கின்றார்.
1330,"வரலாற்றின் மாறாத்தன்மை மக்கள் விரும்பின், மறைநூல்களையும் மாற்றலாம்."
1331,"ஆயின், உண்மையான வரலாற்றை எல்லாம் வல்ல இறைவனும் மாற்ற முடியாது."
1332,"மாற்றின், மெய்யனான இறைவன் பொய்யனாகித் தன் இறைமையை முற்றும் இழந்துவிடுவான்."
1333,செந்தமிழ்ச் செல்வி சனவரி ஐ ஔ அய் அவ் தானா?
1334,"ஐ ஔ வரிவடிவுகள் முன்போன்றே யிருக்கலாமென்று திருவள்ளுவர் விழா முடிப்புரையில், தமிழ்நாட்டு முதல்வர் மாண்புமிகு ம."
1335,"இராமச்சந்திரனார் என்னும் அழகமதியர் குடியரசு முறைக்கேற்ப முடிபு கூறியது, தமிழுலகம் அனைத்தும் மகிழ்ச்சியொடும் நன்றியறி வொடும் பாராட்டத் தக்கதாகும்."
1336,இனி அதுபற்றிக் கவல எள்ளளவும் இடமில்லை.
1337,"திரவிட ஒப்பியல் இலக்கணம் ஆய்ந்தெழுதிய கால்டுவெலாரே, தமிழ் நெடுங்கணக்கு வடமொழியைப் பின்பற்றியதென்று கூறியிருக் கின்றாரே யென்று, சிலர் வினவலாம்."
1338,"அவர் தமிழாய்ந்த கால நிலைமை களை நோக்கினால், அவர் அங்ஙனங் கூறியதற்குக் காரணம் தெளிவாகப் புலனாகும்."
1339,அந் நிலைமைகளாவன .
1340,தொல்காப்பியமும் பதினெண் மேற்கணக்கும் சிலப்பதிகாரமும் தமிழ்ப் புலவர்க்குந் தெரியாது மறைந்து கிடந்தமை.
1341,மறைமலையடிகள் போன்ற வழிகாட்டி எவருமின்றி அவர் தன்னந் தனிமையாகத் தமிழாய்ந்தமை.
1342,"அரசியல் துறையிலோ, குமுகாயத் துறையிலோ, இலக்கியத் துறையிலோ, மொழித் துறையிலோ, தமிழரிடை இன்றிருக்கும் விழிப்பு அக்காலத் தில்லாதிருந்தமை."
1343,"எல்லா வகையிலும் தமிழர் ஆரியர்க்கு முற்றும் அடிமைப் பட்டிருந்தமையும், தென்சொற்கு வடசொன் மூலங்காட்டுவதிற் பெருமை கொண்டமையும்."
1344,"பிராமணர் நிலத்தேவரென்றும், வடமொழி தேவமொழியென்றும் தமிழ்ப் பொதுமக்களால் நம்பப்பட்டமை."
1345,"மாக்கசுமுல்லர் கூட்டம் சமற்கிருதமே ஆரிய மூலமொழி யென்றும், அனைத்துலகத் தாய்மொழியென்றும், கொட்டமடித்துக் கொண்டிருந்தமை."
1346,"கால்டுவெலார் குமரிநாட்டுண்மை யறியாது, கொற்கையே தமிழ் நாகரிகத் தோற்றகம் என்று கொண்டமை."
1347,"அவர் ஏதேன் தோட்டக் கதையை எழுத்துப்படி உண்மை யென்றும், தமிழரின் முன்னோர் மேனாட்டினின்று வந்தவ ரென்றும், நம்பியமை."
1348,"உடன்பிறந்தான் உடன்பிறந்தாள் என்னும் உலக வழக்கும், உடன்பிறந்தார் சுற்றத்தார் என்றிருக்க வேண்டா மூதுரை."
1349,"என்னும் இலக்கிய வழக்கும், அவர்க்குத் தெரியாமற்போனது மருட்கை விளைப்பதே."
1350,சிலப்பதிகாரக் காடுகாண் காதையில் அடியிற் றன்னளவு.....
1351,"தென்னவன் வாழி என்னும் பகுதிக்கு வரைந்த உரையில், அடியார்க்குநல்லார், ........ பொறாது..."
1352,இங்ஙனம் முழுகிப் போனது முற்றும் முத்தமிழ் நாட்டுள் பாண்டிநாடென்னும் ஒரு நாடே.
1353,"ஆகவே, திரு."
1354,நா சுப்பிரமணியன் குறித்த கி.மு.
1355,"குமரிநாட்டுத் தொடக்கக் கால வரலாற்றை அறிதற்குத் துணையாக, இன்று எஞ்சியுள்ள பழம்பொருட்டுறைச் சான்று தமிழ் என்னும் மொழி ஒன்றே."
1356,பிராமியெழுத்துப் பல்வேறு வடிவத்தில் வழங்கி அசோகன் காலத்தில் வளர்ச்சியடைந்ததாகத் தெரிகின்றது.
1357,அஃது அந்த நிலையை எப்பொழுது அடைந்தது என்பது தெரியவில்லை.
1358,"ஆயினும், பழைய காலத்திலேயே இந் நாட்டில் பலவகை லிபிகள் வழங்கி வந்தனவென்பது, பண்டை நூல்களினின்றும் தெரியவருகின்றது."
1359,சற்றேறக் குறைய கி.மு.
1360,ஆம் ஆண்டில் எழுதப்பட்டதாகக் கொள்ளப்படும் ஸமவாயாங்க ஸூத்ரம் கி.மு.
1361,"மஹாவஸ்து என்னும் நூலில், முப்பது வகை லிபிகளின் பெயர்கள் கொடுக்கப்பட்டுள்ளன."
1362,"லலிதவிஸ்தரம் என்னும் நூலோ, புத்தர் காலத்தில் அறுபத்து நான்கு வகை லிபிகள் இருந்தனவென்று தெரிவிக்கின்றது...."
1363,அந்த நூல்களில் உள்ள அட்டவணைகளில் காணப்படும் பெயர்களுள் பல ஒத்திருக்கின்றன.
1364,"அவற்றுள் நான்கு முக்கியமானவை களாகவும், சரித்திர உண்மைக் கேற்பனவாகவும் உள்ளன."
1365,அவை பின்வருமாறு .
1366,ப்ராஹ்மீ அல்லது பம்பி .
1367,கரோஷ்டீ அல்லது கரோட்டி .
1368,த்ராவிடீ அல்லது டாமிலீ .
1369,யவணாணியா அல்லது யவணாலியா ப..
1370,நெடுங்கணக்கு வண்ணமாலை முதன்முதல் தமிழிலேயே தோன்றிற்று.
1371,அதைப் பின்பற்றிய வடநாட் டெழுத்தே பிராமி.
1372,சமணமும் புத்தமும் கி.மு.
1373,ஆம் நூற்றாண்டில் தோன்றின.
1374,அவற்றிற்கு முந்தினது ஆரிய வேதமதம் அல்லது வேள்வி மதம்.
1375,ஆரியர் இந்தியாவிற்குட் புகுந்தது கி.மு.
1376,ஆரிய மொழிகட்கு அடி மூலம் வட திரவிடம்.
1377,அது தென்றமிழின் திரிபு.
1378,கரோட்டி வடமேலையிந்தியாவிற் சில நூற்றாண்டு வழங்கிக் கி.பி.
1379,ஆம் நூற்றாண்டில் மறைந்தது.
