Line Number,Sentence
265,அவர் அதற்கிணங்கி மூன்று காண்டங்கட்கும் நல்லுரை வரைந்துதவினர்.
266,"அவ்வுரையுடன் அச்சிட்டு மதுரைக்காண்டம், கூடற்காண்டம், திருவாலவாய்க்காண்டம் என்ற மூன்றினையும் மூன்று புத்தகமாகப் பகுத்து இல் வெளியிட்டுதவினர்."
267,நூற் பெருமை திருவிளையாடல் நூல்களிற் சிறப்புடையது பரஞ்சோதி முனிவர் இயற்றிய திரவிளையாடற் புராணமே.
268,வேம்பத்தூரார் திருவிளையாடல் என்பது காலத்தால் இதற்கு முற்பட்டது.
269,பழைய தமிழ் வழக்குக்களையே தழுவிச் செல்வது.
270,இது பிற்பட்டது வடமொழி வழிவந்தது வடமொழிப்பெயர்களையே பாண்டியர் களுக்கும் கடவுளர்களுக்கும் இட்டு வழங்குவது.
271,இவ்வேறுபாடு இருப்பினும் முனிவர் பாடல் இனிமையும் தெளிவுமுடையது.
272,மோனையெதுகை முதலிய தொடைநயங்கள் அமைந்தது.
273,பத்திச்சுவை கனிந்தது.
274,ஒழுகிய வோசையும் விழுமிய பொருளும் அமைந்து கற்பார்க்கு மேன்மேலும் விழை வெழுப்புவது.
275,இதனாலன்றோ நம்பி திருவிளையாடல் கற்பார் சிலரும் இதனைக் கற்பார் பலரும் ஆயினர்.
276,எடுத்தாண்ட பழைய இலக்கியப் பகுதி பரஞ்சோதி முனிவர் பல நூற் பயிற்சியுடையவர் என்பது அவர் இயற்றிய திருவிளையாடலால் அறியலாம்.
277,இன்னும் பல நூற் கருத்துக்களும் பொருள்களும் பல விடங்களில் வந்துள்ளன.
278,இவை இவரது புலமையாற்றலை யெடுத்துக் காட்டுவனவாம்.
279,வங்கிய சேகரன் பிறந்து வளர்ந்து ஆளத்தொடங்கினன்.
280,ஆதியின் மதுரை நகரமைந்திருந்த எல்லை காணக் கருதி இறைவனை இறைஞ்சினான்.
281,இறைவன் ஒரு சித்தராய் வந்து தங் கங்கணமாக அமைந்திருந்த பாம்பினை ஏவி எல்லை காட்டும்படி பணித்தார்.
282,அப் பாம்பு உடலை வளைத்து வாயில் வால் பொருந்தும்படி புரிந்து முன்னுள்ள எல்லையைத் தன் ஆலவாயான் அளந்து காட்டியது.
283,அன்று முதல் ஆலவாய் எனச் சிறப்புப் பெயர் பெற்றது.
284,"சோழனது படைப் பெருமை கண்டு, பாண்டியன் அஞ்சி, இறைவனை வணங்கிக் குறையிரந்து வேண்டினன்."
285,"அப்போது இறைவன் நீ சென்று, வந்த சோழனுடன் போர் புரிவாய் நாம் வந்து உதவி புரிவோம்."
286,வெற்றி உனக்குக் கிட்டும் என்று அசரீரியாய் நின்று கூறினன்.
287,கூறியபடியே வந்து உதவி செய்தனன் இறைவன்.
288,சோழ மன்னன் தோற்றான்.
289,சங்கப்பலகை தந்த படலம் காசியிற் பிரமன் பரிமகம் புரிந்தது.
290,"பின் காயத்திரி, சாவித்திரி, வாணி இவர்களுடன் கூடிக் கங்கையாடச் சென்றான்."
291,வாணி வழியில் விஞ்சை மாதொருத்தி பாடிய கானங்கேட்டுத் தாமதித்து வந்தனள்.
292,அது குறித்துப் பிரமன் வெகுண்டு நாற்பத்தெட்டுப் புலவராகப் பிறக்கும்படி நாமகளைச் சபித்தனன்.
293,அதன்படி சங்கப் புலவராய் வந்தமர்ந்து தமிழ் வளர்த் தனள் வாணி.
294,பாண்டியன் சங்க மண்டபம் அமைத்துத் தந்தனன்.
295,வந்து வந்து பல புலவரும் வாது செய்தனர்.
296,அவ்வாதத்தாற் புலவருக்குண்டாய வருத்தம் நீங்க இறைவன் சங்கப்பலகை தந்தனன்.
297,பின்னர் இறைவன் ஒரு புலவராய் வந்து சங்கப் புலவர் கருத்து மாறுபாட்டினைத் தவிர்த்துத் தலைவராயமர்ந்திருந்து தமிழாய்ந்தனன் என்பது.
298,தருமிக்குப் பொற்கிழியளித்த படலம் இப் படலத்தில் வங்கிய சூடாமணி மாறன் நந்தனவனம் வைத்தனன்.
299,சண்பக மலர் புனைந்து சிவனை வணங்கினன்.
300,செண்பகமாற னெனப்பெயர் பூண்டனன்.
301,இளவேனில் வந்தது.
302,மைந்தரும் மகளிரும் நந்தன வனத்தமர்ந்து இன்பம் நுகர்ந்தனர்.
303,புதுமது நுகரப் புக்க மைந்தரும் மகளிரும் மயங்கி யறியாது புரியுஞ் செயல்களாக ஆசிரியர் கூறுவதையும் ஆங்குக் காணலாம்.
304,மங்கை யொருத்தி வள்ளத்திலுள்ள கள்ளிற் சந்திரன் சாயை தோன்றக் கண்டு சந்திரா!
305,என் கணவன் வந்தென்னைத் தேடினால் யான் என்ன செய்வேன் தோழி!
306,நகைச்சுவை நயப்போர் உண்டாட்டுச் செயல்களை ஊன்றி நோக்குக.
307,இப்பூங்கொம்பும் ஊடிய மகளிரேயே கொய்யென வளைத்து நின்றான் காதலன் கண் முத்தங்கொழிப்ப நின்றாள் காதலி எனவும்.
308,ஊடற்குக் காரணம் உய்த்துணர வைத்திருப்பதைக் கண்டு கண்டு களிப்பீர்கள்.
309,நக்கீரன் புரிந்த பிழையைப் பொறுத்து அவனை உய்விக்க வேண்டினர்.
310,இறைவன் இறைவியோடு எழுந்தருளி வந்து பொன்னளினப் பூந்தடத்து ஞாங்கர்ப் புலவர் குழாத்துடன் நின்று அருட்கணா னோக்கினன்.
311,உடனே கீரன் அன்பு வடிவமாயமர்ந்து கைலைபாதி காளத்திபாதி என்னும் அந்தாதி நூல் பாடி யடியிணையிற் சாத்தினன்.
312,இறைவன் நேர்வந்து கரம் பற்றி யீர்த்துக்கரையேற்றினன்.
313,பின் கோபப் பிரசாதம் என்னும் நூல் பாடினன்.
314,திருவருளை நாடினன்.
315,"பின்னர்ப் பெருந்தேவ பாணியும், திருவெழு கூற்றிருக்கையும் பாடிச் சாத்திப் பணிந்தனன்."
316,இறைவன் நல்லருள் சுரந்து முன்போல நாவலர் குழாத்திடை வதிக எனக் கூறி மறைந்தான்.
317,அது கண்ட இறைவன் இலக்கணங் கற்பிக்கவெண்ணினன்.
318,அங்கயற் கண்ணம்மை அப்போது குறுமுனிவன் வரலாறு கூறி அவனை வருவித்து இவனுக்கு இலக்கணம் உணர்த்துமாறு செய்வதே தக்கதெனக் கூறினள்.
319,அவ்வாறே இறைவன் மனத்தி னினைத்தனன் மாதவனை.
320,அம்முனிவனும் தன் பன்னியுடனோடி வந்து பணிந்தான்.
321,இலக்கணம் கற்பிக்குமாறு பணித்தான்.
322,அவனும் அவ்வாறே கற்பித்து முடித்து விடைபெற்றுத் தன்னிருக்கை சேர்ந்தான்.
323,"பின் இறைவி இறைவனை நோக்கி, கீரனுக்கு இலக்கணம் நீ யுணர்த்தாது மாதவனால் உணர்த்திய காரணம் யாது? என வினவினள்."
324,இவன் மனத்து மற்சமிரருப்பதே காரணம் என்று கூறினள்.
325,கீரன் தானிழைத்த பிழையை யெண்ணி யெண்ணி வருந்தினான்.
326,எடுத்துக் காட்ட வேண்டும் என்று வேண்டினர்.
327,அவ்வமையத்தில் மூல விலிங்கத் தினின்றும் ஒரு புலவனாகத் தோன்றி இந்நகரில் ஒரு வணிகன் தனபதி என்ற பெயருடையான் உளன்.
328,அவன் மனைவி குணசாலினி என்ற பெயருடையாள்.
329,இவ்விருவர்க்கும் புதல்வ னொருவ னுளன்.
330,மதன் போலும் வனப்புடையன்.
331,அவன் மூங்கைப் பிள்ளை.
332,அவன்பால் நுங்கவியைப் படித்துக் காட்டுங்கள்.
333,அவன் மதிக்குந் தமிழே யுயர்ந்த தமிழ் எனக் காணுங்கள் என்று கூறினன்.
334,புலவர்கள் ஐயமுற்று இறைவா!
335,வணிகனும் ஊமனுமாகிய ஒருவன் எம் கவிகளின் நன்று தீது ஆய்ந்து எங்ஙனம் கூறுவன் என வினவினர்.
336,இடைக்காடன் பிணக்குத் தீர்த்த படலம் குலேச பாண்டியன் என்பவன் அரசுபுரிந்தான்.
337,அம் மன்னன் இலக்கணம் இலக்கியமாகிய நூல்களின் வரம்பு கண்டவன்.
338,எத்தகைய சிறந்த நூலினுட்பமும் அறியும் புலமையுடையவன்.
339,ஆதலால் அவனுக்குச் சங்கப்பலகை யிடந்தந்தது.
340,அம் மன்னன் பெருமையைக் கேள்வி யுற்ற இடைக்காடன் கவி பாடிவந்து கண்டு தான் இயற்றிய கவியை யரங்கேற்றினன்.
341,"தமிழருமையறிந்தவனான அவன் அழுக்காறு மனத்துட்கொண்டு, முடி துளக்காது, முகமலர்ச்சி காட்டாது ஒன்று முரையாது வாளா இருந்தான்."
342,இடைக்காடனுக்குச் சின மூண்டெழுந்து இறைவன் சந்நிதியில் வந்து பணிந்து தமிழறியும் பெருமானே!
343,செல்வமும் கல்வியும் உள்ளவன் என்று மதித்துக் கவிபாடிப் பாண்டியனைக் கண்டேன்.
344,அவன் என் கவியை மதித்திலன்.
345,"கருங்கடல், நெடுங்கழி, கொடு விலங்கு, பறக்கும் புள், பருமரம், பாலைவனம் போன்ற அஃறிணைப் பொருள்களை யொத்திருந்தான்."
346,"என்னை யிகழ்ந்திலன், சொல் வடிவாம் இமயப்பாவையையும் பொருள் வடிவாகிய நின்னையுமே யிகழ்ந்தனன்."
347,எனக்கு மட்டும் இழிவோ?
348,ஆய்ந்து பார் என்று தன் குறைகூறிக் கோயிலைவிட்டு நீங்கிச் சென்றான்.
349,உடனே இலிங்கவுரு மறைய இறைவன் உமையோடு வையை நதித் தென்பால் ஓர் ஆலயம் தோன்றக் கண்டங்கிருந்தான்.
350,இடைக்காடன் முன் சென்றான்.
351,இறைவன் பின் சென்றான்.
352,இருந்த புலவர் யாவரும் பின்றொடர்ந்து சென்று தங்கினார்.
353,விடியலின் அடியார் இலிங்கவுருக்கண்டிலோம் என மன்னற்குக் கூறினர்.
354,அவன் எங்குச் சென்றாய்?
355,"யான் எப்பிழை செய்தேன் என்று பலவாறு புலம்பிப் பின் இருந்தஇடமறிந்து கண்டு, காரண மறியாது கலங்கி வருந்தினன்."
356,அவ்வமயம் இறைவன் தான் இங்கு வந்துறைந்ததற்குக் காரணமும் இடைக்காடன் செய்யுளை யிகழ்ந்ததையுங் கூறக் கேட்டு மீண்டும் கோயிற்கு வரவேண்டினன்.
357,அவ்வாறே இறைவன் வந்தமர்ந்தான்.
358,பரஞ்சோதி முனிவர் பாடலிலமைந்துள்ள சொன்னயமும் பொருணயமும் சந்தமும் தொடையும் தொடை விகற்பமும் ஆகிய எல்லாம் படித்து இன்புறுக.
359,அழல் வழுதியுடல் குளிப்பப் பதிகமோதிய வரலாற்றை மேல் பாண்டியன் சுரந்தீர்த்த படலத்திற் காண்க.
360,சேய் பிள்ளையார் சேயுடை யாரணம் என்புழி ஆறாவது செய்யுட்கிழமைக்கண் வந்தது கபிலரது பாட்டு என்புழிப்போல.
361,திசைகள் எட்டும் தோயுடையார் திகம்பரர்.
362,அம்மியின்மேல் வைத்தமை முன் திருமணப்படலத்திற் காண்க.
363,வைத்த பாதமலர் என்க.
364,"பிறவி ஏழாவன தேவர், மக்கள், விலங்கு, புள், ஊர்வன, நீர்வாழ்வன, தாவரம் என்பன."
365,"பிறவி காரண காரியத் தொடர்ச்சியாய் அனாதியாக வந்து கொண்டு இருத்தலின் அளவிட முடியாத தென்பார், கடல் என்றார்."
366,"ஓலம், நீலம் என்பன ஈறுகெட்டன."
367,அம்ம இடைச்சொல்.
368,சித்ர என்பது தமிழியற்கு மாறாயினும் சீர்நோக்கித் திரியாது நின்றது பின்வரும் பராக்ரம என்பதும் அது.
369,ஆயோதனம் போர்.
370,பிரவீணன் வல்லன்.
371,மன்னும் ஓவும் அசைநிலை.
372,"மாது, ஓ அசைகள்."
373,தேரார் பகைவர்.
374,இருபத்திரண்டு மைந்தர் வழிவழித்தோன்றி வையகம் புரந்தனர்.
375,அங்ஙனம் புரந்த வேந்தருள் என விரித்துரைத்துக் கொள்க.
376,புனைதலும் பொழிதலும் மிகுதலை உணர்த்தின.
377,கருமை பெருமையுமாம்.
378,உறுத்துச்சீறி ஒருபொருட் பன்மொழி.
379,கடி காவலுமாம்.
380,"அன்று, ஏ அசைகள்."
381,அழுந்தன முற்றெச்சம்.
382,பொழில் உலகம்.
383,"இஃது இப்பொருட்டாதலை, செழும்பொழில்கள் பயந்துகாத் தழிக்கு மற்றை மூவர்கோ னாய்நின்ற முதல்வன் என்னும் திருவாசகத்திற் காண்க."
384,நிற்பனவான திணை நிலைத் திணை.
385,செல்வவான திணை இயங்குதிணை.
386,தேன் இழி என்பதற்குத் தேனும் புறங்கொடுக்கும் என்றுரைத்தலுமாம்.
387,சேல் நெடுங்கண்ணி அங்கயற்கண்ணம்மை.
388,கான் இழி சோலைகளையுடைய என வருவித்துரைக்க.
389,முதல் முதலான.
390,ஆக்கச் சொல்விரித்து அழிவிலாதனவாயின என்க.
391,"போல், அசையுமாம்."
392,"உம்பர், இம்பர் என்பன அவ்விடங்களிலுள்ளாரை உணர்த்தின."
393,"திங்கள் மரபினர் பாண்டியரும், ஞாயிற்றின் மரபினர் சோழரும், அங்கி மரபினர் சேரரும் ஆம்."
394,தொடக்கமும் ஈறும் தோன்றாது நெடிதாய் வருதலின் மதிமரபை ஆழியாக உருவகித்தார்.
395,இவன் அறுபத்துநான்கு கலையும் நிரம்பினான் ஆகலின் எண்ணான்கிரட்டி கலையொடும் பொங்கிய மதிபோல என்றார் இஃது இல்பொருளுவமை.
396,கோள் அணிபுரிசை கோட்களை அணிந்த மதில் மதிலின் உயர்ச்சி கூறியவாறு.
397,கலி வறுமை முதலிய தீமை.
398,வைகலும் என்பதனை ஈரிட துங் கூட்டுக.
399,"ஆல், அரோ அசைகள்."
400,உறுதல் எல்லாம் துணை வினை.
401,வண்டு ஆயும் என விரிக்க.
402,மல்குதல் விளங்குதன்மேற்று.
403,மருங்கர் ஈற்றுப்போலி.
404,இள். கறை அணி கண்டனைத் தாழ்ந்து நஞ்சக்கறையினை அணிந்த திருமிடற்றினையுடைய இறைவனை வணங்கி.
405,"பொறையது, குறையது என்பவற்றில் அது பகுதிப்பொருள் விகுதி."
406,பத்தனம் பட்டணம் நகரம்.
407,அறைசெய்துவைத்த என மாறுக.
408,மற்று அசை.
409,"இறைவன் எவற்றினும் நுண்பொருளாதலை, அணுத்தருந் தன்மையி லையோன் காண்க நூலுணர் வுணரா நுண்ணியோன் காண்க என்னும் திருவாசகம்."
410,அவரைக் கண்ட துணையானே அறக்கடலென்றும் அருட்கடலென்றும் அனைவரும் கருதுமாறு போது வாராயினர் என்க.
411,பசுந்தாட் பாம்பு முதலியவற்றைச் சுட்டாகக் கொள்க.
412,பசுமை இன்மை மேற்று அருங்கேடன் என்புழிப்போல இல்லாத தாளையுடைய பாம்பு என்றார் பச்சைத்தா ளரவாட்டி என்னும் தமிழ்மறையுங் காண்க.
413,சன்னவீரம் மார்பிலும் முதுகிலும் மாறியணியும் ஒருவகை வெற்றிமாலை சன்னவீரம் திருமார்பில் வில்லிலக என்பது திருக்கைலாய ஞானவுலா.
414,பரித்தனர் முற்றெச்சம்.
415,பந்தம் கட்டு கங்கணம்.
416,"இள். பெரும பெருமானே, இந்நகர் அடியனேன் பெயரினால் விளங்க இந்த நகரம் அடியேன் பெயரினால் விளங்குமாறு,."
417,செய்தி செய்வாய் த் எழுத்துப்பேறு.
418,ஆக என்பதன் அகரந் தொக்கது.
419,உரு உட்கு அச்சம்.
420,உருவுட்காகும் என்பது தொல்காப்பியம்.
421,ஒல்லென விரைவுக் குறிப்பு.
422,செல்லா செய்யா வென்னும் வாய்பாட்டு வினையெச்சம்.
423,கீழ்த்திசை என்பது கீட்டிசை என மருவியது.
424,கோட்டி வளைத்து.
