Line Number,Sentence
930,"அருள் சேர்ந்த நெஞ்சினராய கபிலரும், பேகனை யடுத்து, வளமிக்க மலைபொருந்திய நாட்டை யுடையானே!"
931,தாளாற்றலும் கைவண்மையும் உடைய பேக!
932,"பின்பொருகால், அவனது வீரத்தையும், வண்மையையும் பாராட்டி, வீரக் கழலணிந்த திருந்திய அடியை யுடைய காரியே!"
933,இதற்குக் காரணமென்னை? என்று வியப்புறக் கூறினர்.
934,"காக்கையின் இரு கண்ணிற்கும் மணி ஒன்றாதல் போல, இவ்விருவ ருடம்பிற்கும் உயிர் ஒன்றென்னுமாறு விளங்கினார்கள்."
935,"இவ்வாறு, வேள் பாரியானவன் கபிலர் பாடும் புகழுடை யோனாய் விளங்கினன்."
936,அவனது புகழ் நாடெங்கும் பரந்தது.
937,"அக்காலத்துச் சேர, சோழ, பாண்டியர்களில் வீரத்தினும், நீதியினும் மேம்பட்ட பேரரசர் சிலரிருந்தனர்."
938,அவருடன் பகை கொண்டு அரசின்றித் திரிந்தாரும் சிலருண்டு.
939,"அங்ஙனம் திரியலுற்றார் மூவர், ஒருங்கு கூடிப் படைகளைத் திரட்டிச் சென்று, பாரியின் பறம்பென்னும் மலையரணை முற்றுகை யிட்டனர்."
940,"அவ்வரணோ, நீர், நிலன், காடு என்பவற்றாற் சூழப்பட்டது."
941,அகத்தோர்க்கு வேண்டும் பொருள் களெல்லா வற்றையும் உடையது.
942,"தலைவன் மாட்டன்பும், மானமும், மறமும், சோர்வின்மையும் முதலிய நற்குணங் களுடைதாய், உற்றுழி யுதவும் வீரரையுடையது."
943,"ஆகலின், அஃது எத்துணைப் படை மாட்சியுடைய ரானும் எளிதிற் பற்றப் படுவதொன் றன்று."
944,மூவரது முற்றுகையும் நெடுங்காலஞ் சென்றது.
945,"இதனைக் கேட்டலும், பாரிக்குச் சினம் மூண்டது."
946,கவரிமான் போலும் மானமுடைய வீரனானவன் இவ்விழிமொழியை எங்ஙனம் பொறுத்திருப்பன்?
947,கடியதோர் வாளராவெனச் சீறி யெழுந்து உழிஞையார் மேற் சேறலுற்றான்.
948,"மூங்கில் நெல்லும், பலாப்பழமும், வள்ளிக் கிழங்கும், தேனும் என்னும் நான்கு பொருளையும் அது மிகுதியாக வுடைத்து."
949,இவை உழவரது முயற்சியின்றியே இயற்கையிற் கிடைப்பன.
950,"நீங்கள் எண்ணிலாத களிறும் தேரும் கொணர்ந்து அமர்விளைப்பினும், நுமது முயற்சியால் அரணைப் பற்ற மாட்டீர்."
951,நும்வாள் வலியால் பாரி அதனைத் தருவானல்லன்.
952,அதனைக் கொள்ளுமாறு யான் அறிகுவன்.
953,குளிர்ந்த நல்ல பறம்புநாடு முந்நூறு ஊர்களை யுடைத்து.
954,அம்முந்நூறூர் களையும் பரிசிலர் பெற்றனர்.
955,"நீவிர் பாடிக் கொண்டு வரின், நுமக்குப் பரிசிலாக மலையுள்ளது."
956,அதுவேயன்றி யாமும் பாரியும் உள்ளேம். பாரியது பெரியமலை இரங்கத்தக்கதொன்றே.
957,"கூற, மூவேந்தரும், இனி நாம் பாரியை வெல்லுதலரிதென ஊக்க மழிந்தனர்."
958,பாரியின் படைவீரர் ஆராவாரித் தெழுந்தனர்.
959,பாரியும் புகுந்து மந்தர மனைய திண்டோள் வலியால் பகைக் கடலை யுழக்குவனாயினான்.
960,மூவேந்தரும் படையுடன் முரிபட்டோடினர்.
961,வெற்றித் திருவும் பாரியின் வெற்புத் தோளை மேவலுற்றனள்.
962,"இஃதிவ்வாறாக, ஊழ்வினை பயனூட்டுங் காலம் அணுகியது."
963,அதனை யொழிக்க வல்லவர் யாவர்?
964,பாரியுடன் சமர் புரியலாற்றாது நிலைகெட்டோடிய மூவரும் ஓரிடத்துக் கூடினர்.
965,"கூடிப் பாரியின் அருமை, பெருமைகளை யறியாத பண்பிலிகளாய் அன்னார், அந்தோ!"
966,அவனை வஞ்சத்தாற் கோறல் கருதினர்.
967,அதற்கொரு சூழ்ச்சியும் புரிந்தனர்.
968,நஞ்சனையார் புரிந்த வஞ்சனை இன்னதென யாரா லியம்பலாகும்?
969,"மாரியனை யான் பாரியும் பூதவுடம்பை விடுத்துப், புகழுடம்பை நிறுத்தினான்."
970,"விண்ணவர் மலர்மாரி பொழிய, மண்ணவர் கண்மாரி பொழிந்தனர்."
971,இரவல ரிரங்கினர்.
972,புலவர்கள் புலம்பினர்.
973,அவனுக்கு ஆருயிர்த் தோழராயிருந்த கபிலரது பெற்றியை உரைப்பதென்னே!
974,பாரி தடுத்திராவிடின் தாமும் உயிர் துறந்திருப்பாரல்லரோ?
975,பறம்பு நாட்டு முந்நூறூரையும் பரிசிலர்க் களித்த பெருமையை நினைந் திரங்குவர் ஒரு கால்.
976,முல்லைக் கொடிக்குப் பொற்றே ரளித்துக் கழலடி சிவப்ப நடந்து சென்ற பேரருளை நினைந் திரங்குவர் ஒரு கால்.
977,"அறிவும், அன்பும், செறிவும், பொறையும் முதலிய குணனெல்லாம் நினைந்திரங்குவர் ஒவ்வொரு கால்."
978,அன்புடையாரைப் பிரிதலினும் துன்பமென்ப தியாதுண்டு?
979,புலமை நிறைந்த அவரது உள்ளமும் நிலையழிந்தது.
980,பலவாறு அழுங்கிக் கூறுவர்.
981,"ஏகுகின்றவர், பறம்பினை நோக்கி நின்று ஓ!"
982,பெரிய புகழை யுடைய பறம்பே!
983,"முன்பு பல சிறந்த வுணவையும் விரும்பியவாறே தரும் மிக்க செல்வம் முதிர்ந்து, எம்முடன் நட்புச் செய்தாய்!"
984,மதியமானது வெள்ளிய நில வினை விரித்து விளங்குவது கண்டனர் பாரிமகளிர்.
985,"சென்ற திங்களில் அந்நிலாப் பொழுதில் தாம் இருந்த நிலைமையும், இப்பொழுது இருக்கும் நிலைமையும் அவர்கள் மனத்திலுதித்தன."
986,"உடனே உள்ளுடைந்துருகி, ஆ!"
987,அற்றைத் திங்களில் அவ் வெண்ணிலாவில் யாம் எந்தையை உடையேமா யிருந்தேம் எம் குன்றும் பிறராற் கொள்ளப் பட்டிலது.
988,"நெடிய வேலும், கடுங்கண் யானையும், விளங்கு மணிப்பூணு முடைய விச்சிக்கோவே!"
989,"பின், புலவர் பெருமான், இருங்கோவேள் என்பானுழைச் சென்றனர்."
990,புலிகடிமால் என்பதொரு பெயரினை யுடையாய்!
991,பொன்னுண்டாகும் பெரிய மலைக்குத் தலைவ!
992,"பகைவ ரஞ்சும் தானையும், கேடில்லாத நாடும் உடையோய்!"
993,"யான் இவர் தந்தையின் றோழனாதலால், இவர் என்னுடைய மகளிர்."
994,அந்தணனாகிய புலவன் யான் கொண்டு வந்தேன்.
995,"ஆதலால், யான் நினக்குத் தர, நீதான் இவரைக் கொள்வாயாக! என்றனர்."
996,"கபிலரும், உள்ளம் நொந்து, அன்னவனை நோக்கி, நுந்தையின் உரிமையை நிறையப் பெற்ற புலிகடிமாலே!"
997,"வேங்கையின் ஒள்ளிய பூக்கள் பரந்த பாறை, பெரிய புலியின் வரியையுடைய நாட்டையுடையோய்!"
998,"சிற்றரையம், பேரரையம் என இருகூறு பட்டதும், பல்கோடி பொருளை நுங்கட்கு உதவியதுமாகிய அரையத்தினது கேட்டையும் கேட்பாயாக!"
999,"அது கெடுதலுற்றது, நும்போலும் அறிவினையுடைய நும்குடியு ளொருவன் கழாத் தலையார் என்னும் புலவரை அவமதித்தமை யாலாகும்."
1000,நின்பால் விடைகொண்டேன்!
1001,"நின்வேல் வெல்வதாக! என்று வெறுப்புடன் கூறி, அவ்விடம் விட்டு அகன்றனர்."
1002,"சென்று செல்வக் கடுங்கோவைக் கண்டு, வெற்றி பொருந்திய வேந்தே!"
1003,நீ என்னை அளிப்பாயாக வென்று இரப்பேனு மல்லேன்.
1004,"அஃதன்றி, உண்மை யொழியப் புகழ்ந்து சொல்வேனு மல்லேன்."
1005,கபிலரது செந் நாவினின்றும் போந்த தீஞ்சுவைச் செந்தமிழ்ப் பாட்டுக் களை வேந்தர் பெருமான் செல்வக் கடுங்கோ வாழியாதன் கேட்டனன்.
1006,உள்ளத்தே கிளர்ந்தெழுந்த உவகைப் பெருக்கினி லாழ்ந்தனன்.
1007,"கபிலரது ஒண்மையையும், சேரமானது வண்மையையும் யாவரும் பாராட்டுவாராயினர்."
1008,"அதனால், நீ எனக்கு உதவி செய்த காலங்களினும் என்னை வெறுத் திருந்தாயாதல் வேண்டும்."
1009,பெயர் முதலியவற்றின் ஆராய்ச்சி பெயர்க்காரணம் கபிலர் என்னும் பெயரினர் பலர்.
1010,"கபிலம் என்பது செந்நிறத்திற்கு ஒரு பெயராகலின், கபிலர் என்பது செந்நிறமுடைய சிவனார்க்கு உரிய பெயராயிற்று."
1011,"குலம் இவரது குலம், தமிழ் நாட்டு ஐந்திணை மக்களினின்றும் வேறாகத் தொல்லோரால் வகுக்கப் பெற்ற நாற்பாலுள்ளே அந்தணர் குலமாகும்."
1012,அவ் வகவல் கபிலர் கூறியதாகவே அது தெரிவிக்கின்றது.
1013,இதிற் கூறப்பட்டுள்ள நீதிகளிற் சிற்சில யாவரும் ஒத்துக் கொள்ளற் பாலனவே.
1014,"வேறு சில கொள்கைகள் நேர்மையானவை அல்லது, தவறானவை யென்று யாம் இங்குக் கூறத்துணிந்திலம்."
1015,"அவை நேர்மையுள்ளவே யெனினும், சங்கப் புலவராகிய கபிலருடைய கொள்கையல்ல என்பது தேற்றம்."
1016,இது சங்கப் புலவர் பாட்டு என்பதற்கு யாதொரு சான்றும் இல்லை.
1017,சான்றோர் பாட்டுடன் சேர்த்து எண்ணத்தகும் நடைப் பெருமை முதலியன இதன்கட் சிறிதும் இல்லை.
1018,"சில தொன்னூற் கருத்துக் களையும், தொடர்களையும், ஓரோவழி அமைத்திருப்பதே இதிற் காணப்படும் அழகாகும்."
1019,தன் கொள்கையினை உலகில் வெளிப்படுத்தற்கு ஏற்ற பெற்றியாக இக்கதையினை ஆக்கிக் கொண்டதே அவனது சூழ்ச்சித் திறனாகும்.
1020,"ஒளவையார், கபிலர், அதியமான் என்னும் மூவரும் ஒருகாலத்தினர் என்ற வளவு உண்மையாகக் கொள்ளலாம்."
1021,"வள்ளுவர், அக் காலத்தோ, அதனின் முற்காலத்தோ விளங்கினராவர்."
1022,"இஃது இப்பெற்றித் தாகலின், இதனை விடுத்துப் புறப்பாட்டுக்களின் சான்று கொண்டு, கபிலர் அந்தணராவரென அறுதியிடுதலே ஏற்புடைத்தாகும்."
1023,சமயம் திருவிளையாடல் முதலிய புராணங்களிலிருந்து இவர் சைவ சமயத்தவர் என்று கொள்ளப் படுகின்றது.
1024,"இவரே யன்றிச், சங்கப் புலவர் பலரும் சைவரென்றே புராணங்களும், வேறு சைவ நூல்களும் கூறாநிற்கும்."
1025,என்று கூறியிருத்தலுங் காண்க.
1026,கபிலர் நற்றிணை முதலியவற்றிலும் இக்கடவுளரை யெடுத்துக் கூறியுள்ளார்.
1027,குறிஞ்சிக் கலியில் இலக்குமிப் பிராட்டியாரையும் எடுத்தியம்பி யுள்ளார்.
1028,"பெருமை இவ் வாசிரியரது கல்விப் பெருமையை, இவரியற்றிய பாட்டுக்களானே நன்கு அறியலாகும்."
1029,"சங்கத்தார் தொகுத்த எட்டுத் தொகை, பத்துப் பாட்டு, பதினெண்கீழ்க் கணக்கு என்னும் மூன்று வகுப்பிலும் இவருடைய பாட்டுக்கள் உள்ளன."
1030,"எட்டுத் தொகையுள், பரிபாட லொழிந்த ஏழனுள்ளும், இவரியற்றியன காணப் படுகின்றன."
1031,தமிழுலகு இதனினும் மிகுதியான பயனையும் எய்தியிருக்கும்.
1032,"இவ்வாறு புலமையிற் சிறந்து விளங்கிய இவ் வாசிரியர், அருளும், அன்பும் முதலிய சிறந்த குணனெல்லாம் ஒருங்கமையப் பெற்றவராயும் இருந்தனர்."
1033,"அக்காலத்துப் புலவ ரெல்லாரும் வாய்மையையே அணியெனப் பூண்டு விளங்கின ரென்றால், இவர் அவ்வாய்மைக்கே அணியெனத் திகழ்ந்தா ரென்னலாம்."
1034,"இவரது பாட்டியற்றும் வன்மையையும், வாய்மையையும், மனத்தூய்மை யையும், புகழ் மேம்பாட்டையும் சங்கத்துச் சான்றோர்களே ஒருங் கொப்பப் புகழ்ந்து கூறியுள்ளார்கள்."
1035,"உலகுடன் றிரிதரும் பலர்புகழ் நல்லிசை வாய்மொழிக் கபிலன், அகம்."
1036,என்று புலவரேறாகிய நக்கீரனார் புகழ்ந்து கூறினார்.
1037,தாழாது செறுத்த செய்யுட் செய்செந் நாவின் வெறுத்த கேள்வி விளங்குபுகழ்க் கபிலன் புறம் என்று பொருந்திலிளங்கீரனார் பாடினர்.
1038,"இங்ஙனம் புலவரெல்லாம் போற்றும் புலமையும், சான்றாண்மையும் உடையராய இவர்பால், அக்காலத்து வேந்தர்களும், வள்ளல்களும் எவ்வளவு மதிப்பு வைத்திருத்தல் வேண்டும்?"
1039,"பறம்பிற் கோமானாகிய வேள்பாரி, இவரை ஆருயிர்த் துணையாகக் கொண்டொழுகினமையே, இவர்பால் அவ்வள்ளல் வைத்த பெரு மதிப்புக்குச் சான்றாகும்."
1040,"இது கேட்ட பொருந்திலிளங் கீரனார் என்ற புலவர், அவ்வரசனைப் பாடுங்கால் இதனைக் கொண்டு மொழிந்தனர்."
1041,"இன்னணம் புலவரும், மன்னரும் புகழமைந்த இவர் தொல்லாணை நல்லாசிரியரும் ஆவர்."
1042,"அன்னாருடைய கொள்கைகள், தம்மில் ஒன்று பட்டனவும், வேறுபட்டனவுமாய்ப் பல திறப்பட்டுள்ளன."
1043,"விரிவு கருதி அவற்றையெல்லாம் எடுத்துக் காட்டா தொதுக்கி, ஓர்வழியால் கபிலரது காலத்தை இங்கு ஆராய்ந்து காண்பாம்."
1044,நரசிம்மனும் வாதாபிகொண்ட நரசிம்மன் எனப் பெயரெய்தினான்.
1045,என்று பெரியபுராணத்துக் கூறப்பட்டது.
1046,"மகேந்திரவர்மன் புதல்வனாகிய வாதாபி கொண்ட நரசிம்மவர்மனின் காலம், கி.பி."
1047,"ஏழாம் நூற்றாண்டின் முற்பகுதி எனத் தெரிதலால், திருஞான சம்பந்தரும் அக்காலத்தவ ரென்பது கூறாதே யமையும்."
1048,"திருநாவுக்கரசராகிய அப்பர், அப்பொழுது ஆண்டின் முதிர்ந்தோ ராகலின், ஆறாம் நூற்றாண்டி னிறுதியும் அவர்க்குரியதே யாகும்."
1049,"நெடுமாறன், மாறவர்மனுக்கு அறுபது எழுபது ஆண்டின் முன்விளங்கினோன் என்க."
1050,"இனி, கடைச் சங்கமானது, இந் நாயன்மார் காலத்திற்குப் பல நூற்றாண்டுகளின் முன்னர் நிகழ்ந்ததாகும்."
1051,"காலத்தை வரையறுத்தற் குரிய கருவிகளில், அக்காலத்துச் செய்யுணடைப் போக்கும் ஒன்று."
1052,சங்கச்செய்யுள்களுக்கும் தேவாரத்துக்கும் உள்ள நடை வேற்றுமையோ பெரிதாகின்றது.
1053,"இஃதொரு புறமிருக்க, இவ் விருவேறு காலங்களின் சேய்மையைக் குறிக்கும் வேறு சான்றுகள் இங்கே காட்டப்படும்."
1054,சம்பந்தர் காலத்தின் முன்பு தொட்டுச் சுந்தரர் காலத்தின் பின்னருங் கூடச் சோணாடு பல்லவரது ஆட்சியிற்றானே யிருந்தது.
1055,"பல்லவரிற் சிற்சிலர் சமண, பௌத்த மதங்களைத் தழுவி யிருந்தனர்."
1056,"சிற்சிலர் சைவ, வைணவங்களைச் சார்ந்து செங்கோலோச்சி வந்தனர்."
1057,திருத் தொண்டத் தொகையிற் கூறப்பட்ட சிவனடியார்களில் பல்லவ அரசர்களும் உள்ளனர்.
