Line Number,Sentence
1,தமிழமுது மறு பதிப்பு தாள் . கி.
2,மேப்லித்தோ அளவு தெம்மி பக்கம் படிகள் விலை உரு.
3,நூலாக்கம் டெலிபாய்ண்ட் சென்னை .
4,அட்டை வடிவமைப்பு வி.
5,"சித்ரா அச்சு வெங்கடேசுவரா ஆப்செட் பிரிண்டர் இராயப்பேட்டை, சென்னை ."
6,"பதிப்புரை ஆம் நூற்றாண்டின் இறுதிப்பகுதியும், ஆம் நூற்றாண்டின் தொடக்கப்பகுதியும் தமிழ்ப்புலமையும் தமிழாய்வும் மேலோங்கி வளர்ந்த பொற்காலமாகும்."
7,இப் பொற்காலப் பகுதியில்தான் தமிழ்ப்பேரவைச் செம்மல் பெருந்தமிழறிஞர் க.
8,வெள்ளைவாரணனார் தோன்றி வளர்ந்து வாழ்ந்து தாய்மொழித் தமிழுக்கு வளமும் வலிமையும் சேர்த்தார்.
9,கைக்குக் கிடைக்கப் பெறாத நூல்களைத் தேடியெடுத்து இனிவரும் காலங்களில் வெளியிட முயல்வோம்.
10,"தம்முடைய தமிழாய்வுப்பணி மூலம் தமிழ் வரலாற்றில் நிலைத்து நிற்பவர், தமிழையும் சைவத்தையும் இரு கண்களெனக் கொண்டவர்."
11,தம் ஆய்வுப் புலமையால் பல புதிய செய்திகளையும் தமிழ் உலகுக்கு அளித்தவர்.
12,இவர் எழுதிய நூல்கள் தமிழ்உலகிற்குப் பெருமை சேர்ப்பன.
13,தமிழ் இலக்கிய வரலாற்றிற்கு கூடுதல் வரவாக அமைவன.
14,இவருடைய அறிவுச் செல்வங்கள னைத்தையும் ஆவணப்படுத்தும் நோக்குடன் தொகுத்து தமிழ் உலகிற்கு வைப்பாகக் கொடுத்துள்ளோம்.
15,எம் தமிழ்க் காப்புப் பணிக்கு துணை நிற்க வேண்டுகிறோம்.
16,ஐங்குறுநூறு கலி.
17,பரிபாடல் பா.
18,தமிழாராய்ச்சியின் வளர்ச்சியில் புதிய போக்குகளை உண்டாக்கிய பெருமைக்குரியவர்கள் பழந்தமிழ் நூல்களைப் பதிப்பித்த அறிஞர் களேயாவர்.
19,"மேலை நாட்டார் வருகையினால் தோன்றிய அச்சியந்திர வசதிகளும், கல்வி மறுமலர்ச்சியும் புதிய நூலாக்கங்களுக்கு வழி வகுத்தன."
20,ஆறுமுக நாவலர் சி.வை.
21,"தாமோதரம் பிள்ளை , உ.வே."
22,"சாமிநாதையர் ஆகியோர் தமிழ்ப்பதிப்பு முன்னோடிகளாய் விளங்கித் தமிழுக்கு வளம் சேர்த்தனர் என்று தமிழ்ப் பல்கலைக்கழகத்தின் மேனாள் துணைவேந்தர், இ."
23,சுந்தரமூர்த்தி தனது பதிப்பியல் சிந்தனைகள் எனும் நூலில் பதிவு செய்துள்ளார்.
24,இந்நூல் தொகுதிகளை வெளியிடுவதன் மூலம் தமிழ்ப்பதிப்பு முன்னோடிகளை வணங்குவோம்.
25,தொல்காப்பியம் பொருளதிகாரம் மரபியல் தொல்காப்பியம் பொருளதிகாரம் உரைவளம் மரபியல் .
26,". இளம்பூரணம் இவ்வோத்து இவ்வதிகாரத்துக் கூறப்பட்ட பொருட்கு மரபு உணர்த்தினமையான், மரபியல் என்னும் பெயர்த்து."
27,இதனானே ஓத்து நுதலியதூஉம் மரபு உணர்த்துதலென்பது பெற்றாம்.
28,இவ்வோத்தின் முதற்சூத்திரம் என்னுதலிற்றோவெனின் எல்லாப் பொருளின்கண்ணும் இளைமைக்குணம் பற்றி நிகழுஞ் சொல் இவையென்று வரையறுத்துக் கூறுகின்றது.
29,மேலன எட்டுங் குழவியுமென இளமைப்பெயர் ஒன்ப தாயின.
30,குழவியோடொன்பதென்னாது ஒன்பதுங் குழவியோ டென மயங்கக் கூறியதனாற் போத்தென்பதும் இளமைப் பெயரெனவும் பிறவும் வருவன உளவாயினுங் கொள்ளப்படும்.
31,இவற்றையெல்லாம் மேல்வரையறுத்து இன்ன பொருட்கு இன்ன பெயர் உரித்தென்பது சொல்லும்.
32,மாற்றருஞ் சிறப்பின் என்றதனானே இவை ஒரு தலையாகத் தத்தம் மரபிற் பிறழாமற் செய்யுள் செய்யப்படுமென்பதூஉம்.
33,ஈண்டுக் கூறாதனவாயின் வழக்கொடுபட்ட மரபு பிறழவுஞ் செய்யுளின்பம் படின் அவ்வாறு செய்பவென்பதூஉங் கூறியவாறாயிற்று.
34,"அவற்றுள் பரிதியஞ் செல்வனைப் பருகும் காலும் என்றலும், புன்னைமரத்தினை நுவ்வை யென்றலும் மரபன்மையின் வழக்கினுண் மாற்றுதற்கு உரியவாமென்பது கருத்து."
35,ஆய்வுரை உலகவழக்கிலும் செய்யுள் வழக்கிலும் நெடுங்காலமாக வழங்கி வரும் சொற்பொருள் மரபு உணர்த்தினமையின் இது மரபியல் என்னும் பெயர்த்தாயிற்று.
36,இவ்வதிகாரத்திற் கூறப் பட்ட பொருட்கு மரபு உணர்த்தினமையான் மரபியல் என்னும் பெயர்த்து என்றார் இளம்பூரணர்.
37,"முன்னர் வழக்கிலக்கணங் கூறி அதன்பின் செய்யுளிலக்கணங் கூறினான், அவ்விரண்டற்கும் பொதுவாகிய மரபு ஈண்டுக் கூறினமையின் இது, செய்யுளியலோடு இயைபுடைத்தாயிற்று."
38,செய்யுளியலுட் கூறப்படும் இது செய்யுட் கேயுரித்து.
39,மரபு என்னும் சொல் உயர்திணை நான்கு சாதியையும் குறித்து வழங்குதல் தொல்காப்பியனார் காலத்திற்கு மிகமிகப் பிற்பட்ட வழக்காகும்.
40,முதற்சூத்திரம் இளமைப் பெயராமாறு கூறுகின்றது.
41,குழவியொடு ஒன்பதும் இளமைப் பெயரே என இயைத்துப் பொருள்கொள்க.
42,பிறவும் என்றதனான் ஆணென்றும் விடையென்றும் வருவன போல்வனவுங் கொள்க.
43,இவற்றை வரையறை கூறும்வழி உதாரணங் காட்டுதும்.
44,"பிறவும் என்றதனால், ஆண், விடை, கிடாய் என வருவன போல்வனவும் ஆண்மைப் பெயராகக் கொள்ளப்படும்."
45,இளம்பூரணம் இச்சூத்திரம் என்னுதலிற்றோ எனின் பெண்பாற் பெயர் உணர்த்துதல் நுதலிற்று.
46,இள் இக்கூறப்பட்ட பதின்மூன்றும் பெண்பாற் பெயராம் என்றவாறு. பேராசிரியம் இள் கூறப்பட்ட பதின்மூன்று பெயரும் பெண்மைப் பெயர் எறு.
47,"ஆனேறென்பது ஆவினுள் ஏறெனப்படுதலின், ஆவென்பது ஆண்பாற்கும் பொதுவாகலின், அது முடிபமையாதெனப் பட்டது அது மேற்காட்டுதும்."
48,இவற்றுக்குமேல் வரையறை கூறும்வழி உதாரணங்காட்டுதும்.
49,"ஆய்வுரை இது, பெண்மைப் பெயராமாறு கூறுகின்றது."
50,"அந்தம் என்பது, அழகு என்னும் பொருளில் வழங்கும் தமிழ்ச்சொல் எனக் கொள்ளுதல் பொருத்தமாகும்."
51,அந்தஞ்சான்ற பிடிஅழகு நிறைந்த பெண்யானை.
52,மாதர் மடப்பிடி என்பது சம்பந்தர் தேவாரம்.
53,"அவற்றுள், பார்ப்பும் பிள்ளையும் பறப்பவற் றிளமை."
54,இளம்பூரணம் என்னுதலிற்றோ எனின் மேல் அதிகரிக்கப்பட்ட மூவகைப் பெயர்க்குஞ் சிறப்பு விதியுடையன இச்சூத்திர முதலாக வருகின்ற சூத்திரங்களாற் கூறப்படுகின்றன.
55,இள் மேற் சொல்லப்பட்டவற்றுட் பார்ப்பு பிள்ளை யென்னும் இரண்டும் பறவையி னிளமைப் பெயர் என்றவாறு.
56,இவ்வோத்திற் சூத்திரத்தாற் பொருள் விளங்குவனவற்றிற்கு உரையெழுதுகின்றிலம்.
57,"பேராசிரியம் இது, நிறுத்த முறையானே இளமைப்பெயருண் முற்கூறிய பார்ப்பினைக் கூறுவான் அதனோடொப்புமை கண்டு பிள்ளைப் பெயருங் கூறுகின்றது."
58,இள் இவ்விரண்டும் புள்ளிளமைக்குரிய. எறு.
59,இவையெல்லாம் இக்காலத்து வழக்கினுள் அரியவாகலிற் சான்றோர் செய்யுளுட் காணப்படும் அல்லன வழக்கின்மேற் காட்டுதும்.
60,எனவும் இவை பருந்தும் ஊர்க்குருவியும் கிளியுமென்னும் பறவைமேல் வந்தன பிறவும் அன்ன.
61,"இள் பார்ப்பு, பிள்ளை யென்பன இரண்டும் பறவை யினத்தின் இளமையினை உணர்த்தும் பெயர்களாகும் எறு."
62,தவழ்பவை தாமும் அவற்றோர் அன்ன.
63,அவை ஆமையும் உடும்பும் ஓந்தியும் முதலையும் முதலாயின.
64,ஆமையும் முதலையும் நீருள் வாழினும் நிலத்தியங்குங் கால் தவழ்பவை யெனப்படும்.
65,உ ம்.
66,தாமும் என்றதனான் ஊர்வன நடப்பனவுஞ் சிறு பான்மை பிள்ளைப்பெயர்க்கு உரியன கொள்க.
67,"அது, பிள்ளைப் பாம்பென ஊர்வன மேல் வந்தது."
68,பிள்ளை வெருகிற் கல்கிரை யாகி குறுந் என நடப்பனமேல் வந்தது.
69,மூங்காப்பிள்ளை என்பதும் ஈண்டே கொள்ளப்படும்.
70,பார்ப்பும் அவ்வாறே வருவன உளவேற் கொள்க.
71,இதுவுந் தவழுஞ் சாதிக்கெல்லாம் பொதுவாகிய பரப்புடைமையின் இரண்டாவது வைத்தானென்பது.
72,"ஆய்வுரை இள் ஊர்வனவற்றுக்கும் மேற்சொல்லப்பட்ட பார்ப்பு, பிள்ளை என்னும் இளமைப்பெயர் இரண்டும் உரியனவாகும் எறு."
73,தவழ்பவை ஊர்வன.
74,மூங்கா வெருகெலி மூவரி அணிலொடு ஆங்கவை நான்குங் குட்டிக் குரிய.
75,"இளம்பூரணம் இள் என்றது, இவை நான்குங் குட்டி என்று சொல்லப் படும் என்றவாறு."
76,மூங்கா என்பது கீரி.
77,"பேராசிரியம் இது, மேல் எடுத்தோத்தானும் இலேசானும் அதிகாரப் பட்ட தவழ்வனவும், நடப்பனவும் பற்றிக் குட்டியென்னும் பெயரினையு முறையன்றிக் கூறுகின்றது."
78,இள் குட்டியெனப்படுவன இவை நான்கும் எறு.
79,"அவை, மூங்காக்குட்டி, வெருகுக்குட்டி, எலிக்குட்டி, அணிற்குட்டி யெனவரும்."
80,"மற்றுக் கீரியும் நாவியும் போல்பவற்றையுங் குட்டி யென்னாரோ வெனின், என்னார் அவற்றைப் பிள்ளை யென்றலே பெரும் பான்மையாகலின்."
81,உரிய வென்றதனாற் சிறுபான்மை குட்டி யென்பதுங் கொள்க.
82,மூங்காவின் விகற்ப மென்பாருமுளர்.
83,ஆங்கவை நான்கும் என்றதனால் தத்துமியல்பினவாகிய தவளை முதலியவற்றிற்கும் குட்டி என்னும் இளமைப் பெயர் உரியதாகும் என்பர் பேராசிரியர்.
84,"எனவே, இரண்டுமாம் என்றவாறாம்."
85,"இரண்டு என்றது பறழ், குட்டி என்னும் இளமைப்பெயர் இரண்டினையும்."
86,பேராசிரியம் இள் மேற்கூறிய நான்கும் பறழெனவும்படும் எறு.
87,இவை இக்காலத்து வீழ்ந்தன.
88,மற்று முற்கூறிய நான் கினையும் இப்பெயரானே முற்கூறுக.
89,முதற்சூத்திரத்துள் ஓதிய முறைமைக் கேற்பவெனின்அற்றன்று அவற்றுக்கு இப்பெயர் சிறுபான்மை யென்பான் பிற்கூறினானென்பது.
90,உறழ் உறழ்ச்சி முரண்.
91,நாயே பன்றி புலிமுயல் நான்கும் ஆயுங் காலைக் குருளை என்ப.
92,இள் நாயும் பன்றியும் புலியும் முயலும் என நான்குங் குருளையென்று சொல்லப்படும் எறு.
93,"ஆயுங்காலை யென்றதனால், சிறுவெள் ளரவி னவ்வரிக் குருளை குறுந் என்பதுங் கொள்க."
94,ஆயுங்காலை என்றதனால் ஊர்வனவாகிய பாம்புக்கும் குருளை என்னும் இளமைப்பெயர் வழங்குதல் கொள்வர் பேராசிரியர்.
95,"நரியும் அற்றே நாடினர் கொளினே இளம்பூரணம் இள் என்றது, நரியின் இளமைப்பெயரும் ஆராயுங் காலத்துக் குருளை எனப்படும் என்றவாறு."
96,இது மேலனவற்றோடு ஒரு நிகரனவாக ஓதாமையிற் சிறு பான்மை வருமென்று கொள்க.
97,பேராசிரியம் இ ள். நரியுங் குருளை யெனப்படும் எ று.
98,பிணந்தின் பெண்டிர்க்குக் குருளை காட்டிப் புறங்காட் டோரி புலவுத்தசை பெறூஉம் எனவரும்.
99,ஆய்வுரை இள். குருளையென்னும் இவ்விளமைப்பெயரை ஆராய்ந்து மனங்கொள்ளுங்கால் நரியும் குருளையென வழங்கும் அத்தன்மையதாகும் எறு.
100,நாடினர் கொளின் நரியும் அற்றே என இயையும்.
101,அற்று அத்தன்மைத்து குருளை என்னும் இளமைப்பெயரால் வழங்கும் அவ்வியல்பினையுடையது.
102,மேலைச் சூத்திரத்தோடு ஒருங்கு கூறாமையால் நரிக்குருளை யென வழங்குதல் சிறுபான்மை வழக்கெனக் கொள்வர் உரையாசிரியர்.
103,குட்டியும் பறழுங் கூற்றவண் வரையார் இளம்பூரணம் இச்சூத்திரம் என்னுதலிற்றோவெனின் எய்தாததெய்து வித்தல் நுதலிற்று.
104,இள் மேற்சொல்லப்பட்ட ஐவகை உயிர்க்குங் குட்டி பறழ் என்பனவும் ஆம் என்றவாறு.
105,"மேற்சொல்லப்பட்ட ஐவகை உயிர்கள் ஆவன நாய், பன்றி, புலி, முயல், நரி என்பன."
106,"இவற்றுக்குக் குருளை என்பதோடு குட்டி, பறழ் என்பனவும் இளமைப் பெயர்களாக வழங்கப்படும் என்பதாம்."
107,பேராசிரியம் இள் மேற்கூறிய ஐந்தினையுங் குட்டியென்றும் பறழென்றுங் கூறுதல் வரையார் எறு.
108,அவை நாய்க்குட்டி பன்றிக்குட்டி புலிக்குட்டி முயற் குட்டி நரிக்குட்டி என வழக்கினுள் வந்தன.
109,பாசிப் பரப்பிற் பறழொடு வதிந்த வுண்ணாப் பிணவி னுயக்கஞ் சொலிய நாளிரை தரீஇய வெழுந்த நீர்நாய் அகம் எனவும்.
110,வயநா யெறிந்து வன்பறழ் தழீஇ ...
111,"நாயெனச், செந்நாய், நீர்நாய் முதலாயினவும் அடங்கு மென்பது."
112,மூவரியணிலென்றவழிச் சொல்லப்பட் டவாறும் உய்த்துணர்க.
113,பிறவும் அன்ன.
114,ஆய்வுரை இஃது எய்தாதது எய்துவித்தது.
115,அவண் கூற்று வரையார்அவ்விடத்துக் கூறுதலை நீக்கார்.
116,பிள்ளைப் பெயரும் பிழைப்பாண் டில்லை கொள்ளுங் காலை நாயலங் கடையே இளம்பூரணம் என்னுதலிற்றோ எனின்.
117,ஏனையவும் இவ்வாறே ஒட்டிக் கொள்க.
118,பேராசிரியம் இள் மேற்கூறிய ஐந்து சாதியுள்ளும் நாயொழித்து ஒழிந்த நான்கற்கும் பிள்ளையென்னும் பெயர்க்கொடையும் உரித்து எறு.
119,இவை செய்யுட்கண் வருவன கண்டுகொள்க.
120,கொள்ளுங் காலை யென்றதனான் முற்கூறிய நாய் முதலாகிய நான்கும் விலக்கி நரிப்பிள்ளை யென்பதே கோடலும் ஒன்று.
121,ஆய்வுரை இதுவும் அது.
122,"கொள்ளுங்காலை நாய் அலங்கடை பிள்ளைப் பெயரும் ஆண்டுப் பிழைப்பு இல்லை, என இயையும்."
123,பிழைப்பு குற்றம்.
124,அல் கடை யெனற்பாலது அலங்கடை யென்றாயிற்று.
125,அலங் கடை அல்லாத விடத்து.
126,மறிக்குதிரையெனவும் மறி நூக்கிற்றெனவுஞ் சொல்லுதலின் இது குதிரைக்கும் உரித்தாயிற்று.
127,"நவ்வி நாண்மறி கவ்விக்கடன் கழிக்கும் குறுந் எனவும், மறியாடு மருங்கின்மடப்பிணையருத்தித் தெள்ளறல்தழீஇய....."
