Line Number,Sentence
1,நாவலர் நாட்டார் தமிழ் உரைகள் நாட்டார் நாட்குறிப்புக்கள் ஆசிரியர் நாவலர் ந.மு.வேங்கடசாமி நாட்டார் பதிப்பாசிரியர் பேராசிரியர் பி.
2,விருத்தாசலம் பதிப்பாளர் கோ.
3,விருத்தாசலம் பதிப்பாளர் கோ.
4,இளவழகன் முதற்பதிப்பு தாள் . கி.
5,என்.எஸ்.மேப்லித்தோ அளவு தெம்மி எழுத்து புள்ளி பக்கம் நூல் கட்டமைப்பு இயல்பு சாதாரணம் விலை உருபா.
6,"படிகள் நூலாக்கம் பாவாணர் கணினி தி.நகர், சென்னை ."
7,அட்டை வடிவமைப்பு வ.
8,"மலர் அச்சிட்டோர் வெங்கடேசுவரா ஆப்செட் பிரிண்டர்ஸ் ஆயிரம் விளக்கு, சென்னை ."
9,"வெளியீடு தமிழ்மண் பதிப்பகம் , சிங்காரவேலர் தெரு, தியாகராயர்நகர், சென்னை ."
10,நாவலர் ந.மு.
11,வேங்கடசாமி நாட்டார் ஆம் ஆண்டு நினைவு வெளியீடு வல்லுனர் குழு .
12,முனைவர் கு.திருமாறன் .
13,முனைவர் இரா.கலியபெருமாள் .
14,பேராசிரியர் சண்முக.மாரி ஐயா .
15,பேராசிரியர் நா.பெரியசாமி .
16,முனைவர் பி.தமிழகன் .
17,அதுகாரணமாக நாட்டார் ஐயா அவர்கள் தாமே பயின்ற தமிழ்ப் பேராசான் என்று நாட்டு மக்களால் அன்புடன் அழைக்கப் பெற்றார்.
18,கல்லூரியில் இல் பணியில் சேர்ந்து வரை இருபத்து இரண்டு ஆண்டுகள் தமிழ்ப் பேராசிரியராகப் பணிபுரிந்தார்.
19,அக்கல்லூரி இல் மூடப்பெற்றது.
20,நாட்டார் ஐயா அவர்கள் தம்முடைய வாழ்நாளில் அறிஞர் பெருமக்களால் மிகுதியும் மதிக்கப்பெற்றார்.
21,மறைமலை அடிகளாரின் மகள் நீலாம்பிகை அம்மையாரின் கணவர் திருவரங்கனார் ஆவார்.
22,தொண்டை மண்டலத்தில் வாழ்ந்த குடிமக்களுள் சேக்கிழார் வழிவந்த தொண்டை மண்டல முதலியார்கள் இன்றைக்கும் பெருஞ்சிறப்புடன் வாழ்ந்து வருகின்றனர்.
23,இல் சென்னை மாகாணத் தமிழர் மாநாட்டில் நாட்டார் ஐயா அவர்களுக்கு நாவலர் என்னும் பட்டம் வழங்கப்பெற்றது.
24,அக்கோயில் நாட்டார் திருக்கோயில் என்று தமிழன்பர்களால் பெருமையுடன் அழைக்கப் பெறுகின்றது.
25,"இவ்வாறு நாட்டார் ஐயா அவர்கள் இல் நிறுவ விரும்பிய திருவருள் கல்லூரி, ஆண்டுகள் கழிந்ததற்குப் பிறகு நாவலர் ந.மு."
26,"அவை, பின்வருமாறு ."
27,திரிகடுகம் ந.மு.வே.உரை .
28,மணிமேகலை வரலாறு .
29,தொல்காப்பிய ஆராய்ச்சிச் சொற்பொழிவுகள் .
30,நாவலர் நாட்டார் நாட்குறிப்பு முதலியனவாம்.
31,"இவ்வாறு, நாட்டார் ஐயா அவர்கள் எழுதிய நூல்கள் வெளிவந்த ஆண்டுகளைப் பற்றிய விவரம் வருமாறு ."
32,வேளிர் வரலாற்று ஆராய்ச்சி .
33,நக்கீரர் .
34,கபிலர் .
35,கள்ளர் சரித்திரம் .
36,இன்னா நாற்பது .
37,களவழி நாற்பது .
38,கார் நாற்பது .
39,ஆத்திசூடி .
40,கொன்றை வேந்தன் .
41,வெற்றி வேற்கை .
42,மூதுரை .
43,நல்வழி .
44,நன்னெறி .
45,கண்ணகி வரலாறும் கற்பு மாண்பும் .
46,சோழர் சரித்திரம் .
47,பரஞ்சோதி முனிவர் திருவிளையாடல் புராண உரை .
48,அகத்தியர் தேவாரத் திரட்டு உரைத்திருத்தம் .
49,தண்டியலங்காரப் பழைய உரைத்திருத்தம் யாப்பருங்கலக்காரிகை உரைத்திருத்தம் .
50,கட்டுரைத் திரட்டு முதல் தொகுதி .
51,சிலப்பதிகார உரை .
52,மணிமேகலை உரை .
53,அகநானூறு உரை .
54,கட்டுரைத் திரட்டு இரண்டாம் தொகுதி .
55,நாவலர் ந.மு.வேங்கடசாமி நாட்டார் இலக்கணக் கட்டுரைகள் .
56,நாவலர் ந.மு.வேங்கடசாமி நாட்டார் இலக்கியக்கட்டுரைகள் .
57,நாவலர் ந.மு.வேங்கடசாமி நாட்டார் சொற்பொழிவுக் கட்டுரைகள் .
58,"அவர் மொழிஞாயிறு தேவநேயப் பாவாணர், திரு.வி.க., யாழ்ப்பாணத்துத் தமிழ் அறிஞர் ந.சி.கந்தையா பிள்ளை, வெ.சாமிநாத சர்மா, சாத்தான்குளம் அ."
59,"இராகவன், பன்மொழிப்புலவர் கா."
60,அப்பாத்துரையார் முதலிய தமிழறிஞர்களின் நூல்கள் மற்றும் தொல்காப்பிய பழைய உரைகள் அனைத்தையும் முழுமையாக வெளியிட்ட பெருமைக்குரியவர்.
61,அவர் இப்பொழுது நாட்டார் ஐயா அவர்களின் நூல்கள் அனைத்தையும் ஒரு சேர வெளியிடுவது மிகவும் துணிவான செயல் ஆகும்.
62,"அவர் வாழ்க, அவர் முயற்சி வெல்க என்று நான் வாயார மனமார வாழ்த்துகின்றேன்."
63,".. பேராசிரியர் பி.விருத்தாசலம் நிறுவனர் நாவலர் ந.மு.வேங்கடசாமி நாட்டார் திருவருள் கல்லூரி, கபிலர் நகர், வெண்ணாற்றங்கரை, தஞ்சாவூர் ."
64,மங்கையர்க்கரசி அவர்களின் மறைவிற்குப் பின் தொய்வுற்றது.
65,"நீ ஓர் மலர்க்காடு, நான் ஓர் தும்பி எனும் உண்மையை உணராத வயதிலேயே நாட்டாரய்யாவின் தமிழ்ப்பேச்சைத் துய்க்கும் தும்பியானேன்."
66,போட்டியின் போது கொடுக்கப் பட்ட தலைப்பு அழியாச் செல்வம்.
67,அவர் ஈட்டிய புகழே அழியாச் செல்வம் தானே என்று வலியுறுத்தும் நோக்கத்திலே மேடையேறினேன்.
68,"எந்தக் கருத்தையும் கசடறக் கற்றுத் தெளிவு பெறவேண்டும், கற்றுத் தெளிந்த கருத்தை துணிவோக எடுத்துச் சொல்ல வேண்டும்."
69,"அவ்வாறு சொல்லும் போதுதெளி வோடும், துணிவோடும், கனிவும் கட்டாயம் தேவையென்று வலியுறுத்தினார்."
70,தன்னிடம் கற்க வந்தவர்களுக்குத் தெளிவும் திறனும் ஏற்படுமாறு கற்றுத் தந்த பேராசிரியர் அவர்.
71,இந்நிகழ்ச்சி நாட்டாரய்யாவின் அறிவுத் தெளிவை வெளிப் படுத்தும்.
72,"அதன்பின் பேசிய கூட்டத்தலைவர் நாவலர் அவர்கள் முருங்கைமரம் மருத்துவ நலங்கள் செறிந்த சிறந்த மூலிகைமரம், ஏழைகளின் கற்பக மரம்."
73,"நாட்டாரய்யாவின் பேச்சும் போக்கும் தெளிவும், துணிவும், கனிவும் நிறைந்ததாகவே இருந்த தென்பதைத் தெள்ளிதின் உணரலாம்."
74,"நாட்டாரய்யா எழுத்து நடை, பேச்சுநடை இரண்டிற்கும் தூய நடை எடுத்து வைத்தார்."
75,நாட்டார் நினைவு அறக்கட்டளையினர் விழாவெடுத்தனர்.
76,அதன் தொடர்ச்சியாக ஏதாவது குறிப்பிட்டுச் சொல்லும்படியாகச் செய்யவேண்டுமென்ற ஆர்வமெழுந்தது.
77,"அத்துடன் திப்புசுல்தான் ஆய்வு, தொல்பொருள் மையத்தின் தலைவர் திரு."
78,நல்ல தமிழ் நூல்களைத் தமிழர்களுக்கு அளிக்கும் போதெல்லாம் எனக்குப் புத்துணர்ச்சியும் பெருமகிழ்வும் ஏற்படுகின்றன.
79,பதிப்புத் துறையில் துறைதோறும் மேலும் பல ஆக்கப் பணிகளைச் செய்ய உறுதி கொள்கிறேன்.
80,தமிழ்நூல் பதிப்பில் எம் பதிப்பகம் இதுகாறும் ஆற்றிய தமிழ்ப் பணியை எண்ணிப் பார்க்கிறேன்.
81,நெஞ்சில் ஒரு நிறைவு.
82,இனிச் செய்ய வேண்டிய பணியை எண்ணிப் பார்க்கிறேன்.
83,"எனவே, முன்னிலும் வேகமாக என் பதிப்புப் பணிகளைத் தொடர்கின்றேன்."
84,தொண்டு செய்வாய்!
85,"தமிழுக்கு..., செயல் செய்வாய் தமிழுக்கு......,ஊழியஞ் செய் தமிழுக்கு......., பணி செய்வாய்!"
86,நாட்டார் யார்?
87,"ஆம் நூற்றாண்டின் பிற்பகுதியிலும், ஆம் நூற்றாண்டின் முற்பகுதியிலும் தமிழ்த் தேரை இழுத்த பெருமக்களுள் நாவலர் ந.மு.வே."
88,நாட்டார் திருவருள் கல்லூரியின் நிறுவனர் பேராசிரியர் பி.விருத்தாசலம் ஆவார்.
89,அவர் கெடல்எங்கே தமிழின்நலம் அங்கெல்லாம் தலையிட்டுக் கிளர்ச்சி செய்க!
90,எனும் பாவேந்தர் வரிகளுக்கு நம்மிடையே இன்று சாட்சியாக வாழ்ந்து கொண்டிருப்பவர் வாழும் தமிழறிஞர்களில் நான் வணங்கும் சான்றோருள் ஒருவர்.
91,குமுகாய மாற்றத்துக்கு அடிப்படையானது தாய்மொழி வழிக் கல்வி ஒன்றுதான்.
92,இக்கல்விதான் மக்களுக்கு ஊற்றுக் கண்.
93,"தாய்மொழியைப் புறக்கணித்த எந்த இனமும் , எந்த நாடும், வளர்ந்ததாகவோ, வாழ்ந்ததாகவோ, செழித்ததாகவோ வரலாறு இல்லை."
94,பழந்தமிழ்க் கருவூலமான நாட்டாரின் இவ்வருந்தமிழ்ப் புதையல்கள் தமிழர்கள் இல்லந்தோறும் இருப்பதற்கு உங்களின் பங்களிப்பையும் செய்ய முன் வாருங்கள்.
95,"மொழி, இன நாட்டின் அடையாளங்களை மீட்டெடுக்கும் எம் தமிழ்ப் பணிக்குக் கைகொடுத்து உதவுங்கள்."
96,இந் நூல்கள் அனைத்தும் தமிழ் மக்கள் உள்ளங்களிலும் இல்லங்களிலும் வைத்துப் போற்றத் தக்க பாதுக்காக்கத்தக்க கருவூலங்கள் ஆகும்.
97,"கவுதமன், ச.சிவசங்கரன் , நாட்டாரின் மரபு வழி உறவினர் திருமிகுகுரு.செயத்துங்கன், பேரா."
98,கணேசமூர்த்தி ஆகியோர்க்கு எம் நெஞ்சம் நிறைந்த நன்றிகள்.
99,இவர்களுக்கு என் நெஞ்சம் நிறைந்த நன்றிகள்.
100,இப்பதிப்பில் பிழை காணின் சுட்டி எழுதுங்கள் சொல்லுங்கள்.
101,அடுத்த பதிப்பில் பிழை நீக்கி நிறைவு செய்வேன்.
102,"சென்னை இங்ஙனம், கோ.இளவழகன் இவர்களுக்கு எம் நன்றி என்றும் ."
103,செயதுங்கன் அவர்கள் நாட்டார் அய்யாவின் மகன் வழிப் பெயர்த்தி திருமதி.
104,அங்கயற்கண்ணியை திருமணம் செய்து கொண்டவர்.
105,இவர் பல ஆண்டு காலம் கையெழுத்துப் படியாக இருந்த ந.மு.வே.
106,நாட்டாரின் நாட்குறிப்புக்களையும் மற்றும் பல செய்திகளையும் எங்களுக்கு கொடுத்து உதவினார் அவருக்கு எங்கள் நெஞ்சம் நிறைந்த நன்றி.
107,ஆம் ஆண்டு அன்னையார் உத்தர கிரியை.
108,திருச்சிராப்பள்ளி வந்தது.
109,மிக்க உழைப்புள்ளவர்.
110,எல்லோருடைய அன்புக்கும் பாத்திர ராயிருந்தவர்.
111,கரந்தைத் தமிழ்ச்சங்க ஆண்டுவிழா தலைவர் ஸ்வாமி விபுலாநந்தர்.
112,கரந்தை விழாத் தொடர்ச்சி.
113,தமிழராய்ச்சிக் கழகத்தில் .
114,சேதுப்பிள்ளையவர்கள் சொற்பொழிவிற்குத் தலைமை வகித்தது.
115,சிறையிருந்த செல்வி.
116,அப்பூதியடிகள் திருநாள்.
117,சைவசித்தாந்த சபையில் தலைமை.
118,அன்னையார் வது ஊனமாசியம்.
119,"விருதைச் சிவஞானயோகிகளின் சத்துச் செந்தூரம் என்னும் மருந்தினை, ஆடாதோடைச் சாறும் தேனும் கலந்த அநுபானத்துடன் உண்ணத் தொடங்கியது."
120,இக்காலத்தில் இப்படியிருக்குமேல் ஞானசம்பந்தர் காலத்தில் எப்படியிருந் திருக்குமோ என நினைந்து மிக மனம் உருகினேன்.
121,இன்று மகாசிவராத்திரி.
122,சென்ற ஆண்டு சிவராத்திரிக்குக் குடும்பத்துடன் மலைக்கோயில் சென்று வழிபட்டு வந்தேன்.
123,அதன்பின் போகமுடியவில்லை.
124,இன்றும் போகவில்லை.
125,"ஆனால் நாகநாத சுவாமி கோயிலில் தரிசனஞ் செய்துவிட்டு, மலைவலம் வந்தேன்."
126,இன்று முழுதும் சில ஆராய்ச்சியுரை களைப் படித்துக் கொண்டிருந்தேன்.
127,இவ்வாண்டு ஜூனியர் .
128,வகுப்பிற்குத் தமிழ்ப்பாடம் சொல்வது இன்றுடன் முடிகின்றது.
129,இன்று நற்றிணை பாடம் நடத்தவேண்டும்.
130,"ஆனால், பாடமொன்றும் நடத்தாமல் நான் கல்லூரிக்கு வந்த வரலாறு முதலியவற்றைச் சொல்லிக் கொண்டிருந்தேன்."
131,இன்று பகல் மணிக்கு ஜூனியர் இண்டர்மீடியேட் வகுப்பு.
132,நான் பாடமொன்றுஞ் சொல்லாது கல்லூரியின் பழைய வரலாறு முதலியவற்றைச் சொல்லிக் கொண்டிருந்தேன்.
133,நான் இக்கல்லூரியில் தமிழ் கற்பிக்கும் செயல் இன்றுடன் முடிவுறு வதாதல் ஒருதலையென எண்ணுகிறேன்.
134,யாவும் திருவருட் செயல்.
135,இன்று கரந்தைத்தமிழ்ச்சங்கத்தில் திருவள்ளுவர் திருநாட் கொண்டாட்டம்.
136,நான் தலைமை வகித்ததுடன் நல்லந்துவனார் என்னும் பொருள் பற்றிப் பேசினேன்.
137,"பூவராகம் பிள்ளை, திரு."
138,"சரவண முதலியார், திரு."
139,"கந்தசாமி பிள்ளை ஆகியவர்கள் முறையே திருவள்ளுவர், நம்பியாரூரர், திருக்குறள் மூன்றாம் பால் என்பன பற்றிப் பேசினார்கள்."
140,கரந்தை போய் வந்ததன் பயனாக நேற்று இரவு முதல் நோய் பெரிதும் துன்புறுத்துகிறது.
141,சென்ற புதன்கிழமை கல்லூரியில் பாடம் கற்பிப்பது முடிவுற்றது.
142,இன்று பகல் மணிக்குப் பிரின்சிபால் முடிவு கூறிவிட்டனர்.
143,"ன் பிற்பகுதியில் இங்கு வேலை பார்த்து விட்டு, பின் ஜனவரி ம் தேதி முதல் தொடர்ச்சியாய் வேலை பார்த்துளேன்."
144,வாழ்நாளின் நடுப்பகுதி இங்கே சென்றது.
145,வாழ்க்கையில் இஃது ஓர் பெரியமாறுதலாகும்.
146,மே வரையில் இக்கல்லூரியின் தொடர்பு உளது.
147,சிந்தாமணிப் படித்துறையில் இருக்கும் புதுக்கோட்டை சாம்பவசிவ சாஸ்திரியார் என்பவரின் மருந்துண்ணத் தொடங்கியது.
148,"இன்று காலை மணிக்குப் புறப்பட்டுப் பூதலூர் வந்து அங்கே பகலுணவுண்டு, மாலை மணியளவுக்கு நடுக்காவேரி சேர்ந்தோம்."
149,"சித்தாந்த சாஸ்திரங்களை ஒருமுறை உரையுடன் முறை யாகப் படிக்க வேண்டுமென்னும் கருத்துடன், வருடப் பிறப்பாகிய இன்று திருவுந்தியார் தொடங்கியுள்ளேன்."
150,"கல்லடிவயல் கலம் என்று பேசி, செ."
151,தண்டாயுதபாணி நாட்டாரிடம் குத்தகைக்கு விடப்பெற்றது.
152,இண்டர்மீடியட் தமிழ் செலக்ஷன் புரூப் முடிந்து அச்சடிக்க ஆர்டர் கொடுத்தது.
153,வித்துவான் பரீஷை ரிசல்ட் அநுப்பியது.
154,பேப்பர் .
155,"மகாத்மா காந்தியடிகள் இன்று பகல் மணி முதல் நாட்கள் உபவாசம் இருப்பதெனச் சங்கற்பித்துக் கொண்டு, அங்ஙனமே தொடங்கிவிட்டார்."
156,இச்செய்தி நாளின் முன் ஆநந்தபோதினி வாரப் பத்திரிகையில் பார்த்தேன்.
157,"கடவுள் காக்க இன்று காலை திருவையாறு சென்று, ஐயாறப்பர் ஏழூர்."
