Line Number,Sentence
1807,"கல்லாடனார் புலமைச் சிறப்புக் கண்டு பெருமகிழ் வுற்ற பாண்டியன், பின்னர் அவருக்குப் பெரும் பொருள் நல்கிச் சிறப்பித் தான்."
1808,அவரும் அவன்பால் விடைபெற்றுச் சென்றார்.
1809,"அவனும், ஒரு கால அளவு கூறிவிட்டுச் சென்றான்."
1810,"அதற்குள்ளே, காதல் நோய் வருத்தக் காதலி உடம்பு வாடலானாள்."
1811,அவளைப் பெற்ற தாயும் நோய்முதல் நாடியறியும் திறனின்றி மிக்க துயருற்றாள்.
1812,அவளுடைய தோழிக்கு அவளைத் தேற்றித் தெளிவிக்கும் பொறுப்பு பெரிதாயிற்று.
1813,"அம்மே, என் உடம்பு மெலிந்துவிட்டது உன் தாய்க்கும் துயர் பெரிதாயிற்று."
1814,நார்முடிச் சேரல் அரசு கட்டிலேறிய சில நாட்களில் நன்னனுக்கும் அவனுக்கும் போருண்டாயிற்று.
1815,அதனால் நன்னன் சேரர்க்குரிய பகுதியான நாடொன்றைக் கவர்ந்து கொண்டான்.
1816,நன்னனது செயல் அந்நாளைச் சான்றோர்க்கு வருத்தமே விளைவித்தது.
1817,இன்றைய பொள்ளாச்சி நாட்டில் உள்ள ஆனைமலை யென்பது அப்போது நன்னனூர் எனப்பட்டது.
1818,"அந்த ஆனைமலை யிலுள்ள கல்வெட்டும், அதனை வீரகேரள வளநாட்டு நன்னனூர் ..."
1819,என்று கூறுகிறது.
1820,களங்காய்க்கண்ணி நார்முடிச் சேரலும் தான் இழந்த நாட்டைப் பெறவேண்டுமென்ற கருத்தால் காலம் நோக்கி யிருந்தான்.
1821,அதனால் அவன் புகழும் மேம்படுவதாயிற்று.
1822,இக் கொல்லிக் கூற்றம் ஒரு காலத்தே சேரர்களுக்குரியதா யிருந்தது.
1823,பின்பு ஓரி யென்பவன் அதனை வென்று தனக்குரியதாக்கிக் கொண்டான்.
1824,அக்காலத்தே காரியென்பவன் மலையமானாட்டை முள்ளூரிலிருந்து ஆண்டு வந்தான்.
1825,சேரலன் காரியைத் துணையாகக் கொண்டு கொல்லிக் கூற்றத்தைத் தான் கொள்ள விரும்பினான்.
1826,அதற்கிசைந்த காரி ஓரியொடு பொருது அவனைக் கொன்று அக் கொல்லிக் கூற்றத்தைச் சேரனுக்கு அளித்தான்.
1827,எவ்வூரினர்?
1828,என்பன இனி ஆராய வேண்டுவன.
1829,"வேங்கட நாடும் பெரும்பாணப்பாடி நாடும் தமிழகத்தின் வடவெல்லையாகிய வேங்கடமும், அதனைச் சேர்ந்த பகுதியும் வேங்கடக் கோட்டம் எனப்படும்."
1830,"ஒரு காலத்தில், இக் கோட்டத்தின் வடவெல்லை வேங்கட மலைத் தொடரையும், தென்னெல்லை பாலியாற்றையும் கொண்டிருந்தன."
1831,இக் கோட்டங்கள் பல கொண்டது தொண்டை நாடு.
1832,"தொண்டை நாட்டையாண்ட வேந்தர் சோழரேயாயினும், அவர்க் கீழிருந்து ஆட்சி நடத்திய குறுநிலத் தலைவர் தொண்டையர் எனப்படுவர்."
1833,"தொண்டை நாட்டின் வடவெல்லை வேங்கடவரைத் தொடரும் வடபெண்ணை யாறும், தென்னெல்லை தென்பெண்ணையுமாகும்."
1834,"கல்லாடனார் காலத்தே, வேங்கடக்கோட்டத்து வேங்கடத்தில் புல்லி யென்பவன் தலைவனாயிருந்து வந்தான்."
1835,அவன் செய்த செயலொன்றையும் கல்லாடனார் குறிக்கின்றார் இல்லை.
1836,"ஆயினும், அப் புல்லியையும் அவனது வேங்கடத்தையும் பலபட எடுத்தோது கின்றார்."
1837,இவ் வேங்கடக் கோட்டத்தின் தென்மேற்குப் பகுதி பெரும்பாணப்பாடி நாடு எனப்படும்.
1838,அதற்குத் தலைமை தாங்கி ஆட்சி செய்தவன் பாணன் எனப்படுவன்.
1839,"அவன் வழி வந்தவர் இடைக்காலத்தே வாணாதிராய ரெனவும், வாணகோவரைய ரெனவும் நிலவினவராவர்."
1840,"அந்தப் பாணனது நாட்டையும் நம் கல்லாடனார், எழா அப்பாணன் நன்னாடு அகம். என்று பாடியுள்ளார்."
1841,"ஆகவே, கல்லாடனாருடைய நாடு தொண்டை நாட்டு வடபகுதி யென்பது தெளிவாம்."
1842,அப்பகுதி வேங்கடக் கோட்டத்தைச் சேர்ந்த தென்பதும் தெள்ளிதாம்.
1843,வேங்கட நாட்டு வேட்டுவர் பிறிதோரிடத்தில் வேங்கட நாட்டில் வாழும் வேட்டுவர் இயல்பை எடுத்துரைக்கின்றார்.
1844,வேங்கடத்தில் கடம்புமரங்கள் செறிந்திருக்கும்.
1845,அவற்றின் பூக்களைக் கொய்து அங்கு வாழும் வேட்டுவ இளையர் தம் தலையில் சூடிக்கொள்வர்.
1846,கள்ளில் என்பது தொண்டை நாட்டுப் புழற் கோட்டத்துக் குன்றக நாட்டுக் கள்ளில் .
1847,.
1848,.
1849,"என்றும், இடைக்காலத்தில் ஒருகால் இது சந்திரகிரி ராஜ்யத்தில் இருந்ததென்றும் அவ்வூர்க் கல்வெட்டுக்களால் அறிகின்றோம்."
1850,"ஆகவே, இவ்வூரவரான ஆத்திரையனார் கூறும் வேங்கடநாட்டு நிகழ்ச்சி வலிமிக்க தென்பது தெள்ளிது."
1851,"மேலும் கல்வெட்டுக் கூறும் குன்றக நாடு என்பது, ஆத்திரையனார் கூறும் குன்றக நல்லூர் என்றும் நினைவிற்கொள்ளற்பாலதாகும்."
1852,"இக்கள்ளில் ஆத்திரையனார், புன்றலை மடப்பிடி யினையக் கன்றுதந்து, குன்றக நல்லூர் மன்றத்துப் பிணிக்கும், கல்லிழி யருவி வேங்கடம் புறம்."
1853,என்று கூறுகின்றார்.
1854,கல்லாடம் எங்கே உளது ?
1855,"இனி, கல்லாடனார் தொண்டைநாட்டவராயின், அவரது ஊரும் தொண்டை நாட்டின்கண்ணதாம்."
1856,தொண்டை நாட்டு ஊருள்ளும் வேங்கட நாட்டைச் சார்ந்த வூர்களுள் ஒன்றாதல் வேண்டும்.
1857,கல்லாடனார் கல்லாடம் என்ற ஊரினர் என்பது எல்லார்க்கும் ஒப்ப முடிந்தது.
1858,அவ்வூர் எங்குள்ள தென்பது பற்றி இதுகாறும் ஆராய்ச்சியாளர் பலரும் ஒரு முடிபும் கூறினாரல்லர்.
1859,சென்னை மாநிலத்து ஊர்ப் பட்டியலை நோக்கினும் கல்லாடமென்ற ஊர் உருத் திரிந்தும் காணப் படவில்லை.
1860,"இனி, கல்வெட்டுத் துறையினர் இதுகாறும் வெளியிட்டிருக்கும் கல்வெட்டுக்களையும் ஆண்டறிக்கைக் குறிப்புக்களையும், ஆராய வேண்டியது இன்றியமையாதாகிறது."
1861,இத்துறையில் அரசியற் கல்வெட்டுத் துறையினர் சென்ற ஆண்டிலும் கல்வெட்டுக்கள் கண்டு படியெடுத்துள்ளன ரெனக்கேள்விப்படுகிறோம்.
1862,ஆம் ஆண்டுக்குப்பின் ஆண்டறிக்கைகூட வெளிவருவது நின்றுபோயிற்று.
1863,ஆண்டுக்குப்பின் எடுக்கப்பட்ட கல்வெட்டுக்களில் பல்லவர் காலத்துக் கல்வெட்டுக்கள் மட்டில் வெளியாகி யுள்ளன.
1864,ஏனையவை இன்னும் வெளியாகவில்லை.
1865,செவ்விய அரசியற் கலைக்கு இவற்றின் வெளியீடு சிறந்த துணையாம் என்பதை அரசியல் தலைவர்களும் அறிஞர்களும் உணர்வார்களாக.
1866,இதனால் கல்லாடீச்சுரம் உள்ள ஊர் கல்லாடம் என்பது பெறப்படும்.
1867,"படவே கல்லாடீச்சுரம் உள்ள மீஞ்சூர், பண்டை நாளில், கல்லாடம் என வழங்கிற் றென்பது துணிபாம்."
1868,மீஞ்சூரிலுள்ள சிவன் கோயிற்குக் கல்லாடீச்சுர மென்று பெயரென்பதனை அவ்வூர் அக் கோயில் கல்வெட்டு .
1869,.
1870,.
1871,கூறுகிறது.
1872,.
1873,"சொகினனார், சொகிரனார் சங்கத்தொகை நூல்களிற் காணப்படும் நல்லிசைச் சான்றோர் களில் சிலருடைய பெயர்கள் நமக்கு வியப்பாக இருக்கும்."
1874,இக்கால மக்கள் கூட்டத்தில் சில சான்றோருடைய பெயர்களைச் சொன்னால் எல்லோரும் நகைப்பதும் உண்டு.
1875,சில இளைஞர்கள் இப்படியும் பெயர்கள் வழங்குவதுண்டோ என்றுகூட வினவுவ துண்டு.
1876,இதற் கெல்லாம் காரணம் அப்பெயர்கள் மக்களிடையே பயில வழங் காமையேயாகும்.
1877,வடமொழிப் பெயர்களும் மேனாட்டவர் பெயர்களும் அடிக்கடி கேட்கக்கூடிய வாய்ப்புக்கள் இடைக் காலத்தே பெருகியதால் தூயதமிழ்ப் பெயர்கள் வழக்கிலிருந்து மறையலாயின.
1878,அறுநூறு எழுநூறு ஆண்டுகட்கு முன்பெல்லாம் வழக்கிலிருந்த தமிழ்ப்பெயர்கள் நாள் செல்லச்செல்ல மறைந்து போயின.
1879,"தெய்வப் பெயர்களை மக்களுக்கு இட்டு வழங்கும் வழக்கம் உண்டாகிய போதும், சில தூய தமிழ்ப் பெயர்கள் வழக்கில் இருந்தன."
1880,தெய்வத் தமிழ்ப்பெயர்கள் பின்பு வடமொழியில் மொழிபெயர்க்கப்பட்டன.
1881,பின்பு எல்லாம் வடமொழிப் பெயர்களாக மாறிவிட்டன.
1882,"போதாக் குறைக்கு இக்காலத்து நாட்டாள்களும், கிழமைத்தாள்களும், திங்கட்டாள் களும் சிறு கதைகள் எழுதத் தலைப்பட்டன."
1883,இவற்றை எழுதும் ஆசிரியர் அனைவரும் வடமொழி யறியாராயினும் அறிந்தாற்போல வடமொழிப் பெயர்களை வழங்குவாராயினர்.
1884,இந்தக் கதைகாரார்களின் ஆதரவை நாடியிருக்கும் சினிமாக் காரர் களும் இவ்வடமொழிப் பெயர்களை பரப்பத் தொடங்கி விட்டனர்.
1885,இந்திப் படங்கள் சில வந்துவிட்டன.
1886,அவற்றில் வழங்கும் கொச்சைப் பெயர்கள் சில குடும்பங்களிவ் மக்கட்கிட்டு வழங்கும் பெயராய்விட்டன.
1887,இவ்வகையில் தமிழ் மக்களுக்குத் தங்கள் இனிய தமிழ்ப் பெயர்களும் தமிழ்ச்சான்றோர் பெயர்களும் அருமையாய்விட்டன.
1888,அதனால் அவர் களுக்கும் அவர்கள் மக்களுக்கும் நல்லிசைத் தமிழ்ச்சான்றோர் பெயர் கேட்பதற்கு வியப்புத் தருகிறது.
1889,இவற்றை ஓரொரு கால் சொல்லும்போதே சிறுவர்களுக்கு வியப்பும் நகையும் தோன்றுகின்றன.
1890,"இங்கே எடுத்துக் கொண்ட சொகினனார் என்ற பெயரைக் கூறுவோமாயின், அவர்கள்பால் உண்டாகக்கூடிய ஆரவாரத்துக்கு எல்லை யிராது."
1891,இதற்காகத் தமிழ் முன்னோர் பெயரை வெளியிடாமல் இருப்பது தவறு.
1892,"உரிமை பெற்ற இந்நாளில், தமிழராகிய நாம், உரிமை வாழ்வு வாழ்ந்த தமிழ் முன்னோர்களின் பெயர், வரலாறு முதலியவற்றை அறியவேண்டியவர்களாகின்றோம்."
1893,இடையிலே நம்மை வந்து மூடிய இரவற்போர்வைகளைக் களைந்து எறிய வேண்டும்.
1894,"இரவற்போர்வையைக் களைய இதுவரையில் நமக்கு உரிமையுணர்வு இல்லாதிருந்தது, இப்போது தான் நமக்கு அந்த உணர்வு உண்டாகி விட்டதே !"
1895,இனி ஏன் தாழ்க்க வேண்டும்?
1896,நாம் தமிழ் வாழ்வு வாழும் உண்மைத் தமிழராக வேண்டும்.
1897,"சங்க நூல்களில், தமிழ் மக்களின் மனைவாழ்வு இன்பவாழ்வாக இருக்கவேண்டும் என்றே தமிழ்ச்சான்றோர் பல வாழ்க்கை முறைகளைக் கூறியிருக்கின்றனர்."
1898,இன்ப வாழ்வு வேண்டா தவன் எவனும் இருக்கமாட்டான்.
1899,"இன்ப வாழ்வில் முதற்கண் இன்பமும், பிறகு பொருளும், பின்னர் அறமும் முறையாக நிற்கும்."
1900,இம் மூன்றையும் அன்பு பிணித்துக்கொண்டு நிற்கும்.
1901,"இன்பமும் பொருளும் அறமும் என்றாங்கு, அன்பொடு புணர்ந்த இன்ப வாழ்வு என்றே தொல்காப்பியரும் கூறி வைத்தார்."
1902,அன்பால் பிணிக்கப்பட்ட இன்ப வாழ்வு ஒருவனும் ஒருத்தியும் கூடி நடத்துவதாகும்.
1903,"இவர் கருத்துக் களைத் தெளிய அறியும் திறமில்லாத மடவர் சிலர், இவர்களையும் இவர்கள் பாட்டுக்களையும் இந்நாளில் இகழ்தலும் செய்கின்றனர்."
1904,"சொகினனாரென்பவர், சங்கத்தொகை நூல்களிற் காணப்படும் சான்றோருள் ஒருவர்."
1905,"இவர் பெயர் தும்பி சொகினனா ரென்றும், தும்பி சேர்கீரனாரென்றும் காணப்படும்."
1906,"இவருடைய பாட்டுக்கள் புறநானூற்றில் ஒன்றும், நற்றிணையில் ஒன்றும், குறுந்தொகையில் ஐந்துமாக ஏழு பாட்டுக்களாகும்."
1907,இத்தொகை நூல்களுள் புறநானூற்றை வெளியிட்ட டாக்டர் திரு.
1908,உ.
1909,வே.
1910,"இனி, நற்றிணையை உரையெழுதி வெளியிட்ட பின்னத்தூர் திரு."
1911,அ.
1912,"நாராயணசாமி ஐயரவர்கள், தும்பி சோகீரனார் என்று கொண்டு, இவர் பெயர் தும்பி சோகீரன் கீரன் என்பது இயற்பெயர்."
1913,"சோ, அடைமொழி."
1914,"இதன் பொருள் விளங்காமையால், இவர் பெயரைத் தும்பி சேக்கீரனார் என்று பதிப்பிக்கலாயிற்று."
1915,"தமது பாடலிலே தும்பியை நோக்கி, கொடியை வாழி தும்பி நற்."
1916,"எனவும், அம்ம வாழியோ மணிச் சிறைத் தும்பி குறுந்."
1917,உ.
1918,வே.
1919,"ஆயினும், பாட்டின் ஆசிரியர் பெயர் குறிக்குமிடத்து நற்றிணையுரைகாரர் குறித்தபடியே தும்பி சேர் கீரனார் என்று குறித்தனர்."
1920,புறநானூற்றுக் கையெழுத்துப்படி யொன்றில் இப்பெயர் தும்பைச் சொகினனாரென்று காணப்பட்டது.
1921,"இஃது இவர் பெயராயின், இப்பெயரின் பொருள் யாது?"
1922,எனக் காண்பது முறையாகின்றது.
1923,"சொகினன் என்பதற்குப் பொருள் கண்டோர், சொகினம் என்பது நிமித்தம் என்னும் பொருளது என்று கூறுகின்றனர்."
1924,அது பொருளாயின் சொகினம் என்பது சகுனம் என்பதன் திரிபாதல் வேண்டும்.
1925,நிமித்தம் காண்பதென்பது போர்க்குச் செல்வோரிடத்துப் பெரு வழக்கில் இருந்த தொன்று.
1926,நிமித்தம் காண்பதே போர்த் துறையில் ஒரு துறையாகக் காணப்படுகிறது.
1927,வெ.
1928,மா.
1929,என்று வரக் காண்கின் றோம்.
1930,"இதனல் நிமித்தமென்பது சொகினமென வழங்குவது காணப்படுவதால், நிமித்தம் கூறு வோனைச் சொகினன் என்று வழங்குப என்பது விளங்குகிறது."
1931,கணியன் பூங்குன்றன் என்றாற்போலக் கணி கூறுவோனைக் கணியன் என்று சான்றோர் கூறுவது ஈண்டு நினைவுகூரத்தக்கது.
1932,"தொழில்பற்றி வந்ததாயின், சொகினம் கூறும் தொழிலில் இவர் சிறப்புற்றிருந்தவராம்."
1933,இச்சிறப்பால் இவர்க்கு வேந்தர்கள் பல சிறப்புக்கள் நல்கினராதல் வேண்டும்.
1934,"ஒள்வாள் மலைந் தார்க்கும் ஒற்றாய்ந் துரைத்தார்க்கும், புள்வாய்ப்பச் சொன்ன புலவர்க்கும் பு."
1935,வெ.
1936,மா.
1937,. வேந்தர் சிறப்புச் செய்வதைப் பழமையான நூல்கள் கூறுகின்றன.
