Line Number,Sentence
689,வளர்ந்த புதல்வர் குடும்பத்தைப் பாதுகாப்போராகவிருந்தனர் புதல்வியர் பெண்களுக்குரிய கடமைகளில் உதவி புரிவோராயிருந்தனர்.,False
690,"இந் நிலைமையினால் தோன்றிய தாயாட்சியே ஆஸ்திரேலியா, ஆப்பிரிக்கா, அமெரிக்கா, ஆசியா முதலிய நாடுகளின் பழங்குடி களிடையே நிலைத்துள்ளன.",False
691,பழைய நாகரிக மக்களிடையே தாயாட்சி முறை இருந்தது.,False
692,"பாபிலோனிய ஆவணங்களில் தாயும் தந்தையும், மனைவியும் கணவனும் என்பன போலப் பெண்ணின் பெயரே முதலிற் கூறப்படுகின்றது.",False
693,மனிதன் நாகரிகமடைந்திருந்த காலத்திலும் தாயாட்சி முறை அசைக்க முடியாத படி வலிமையடைந்திருந்ததெனத் தெரிகின்றது.,False
694,பாபிலோனியப் பெண்கள் ஆண்களை ஒத்த உரிமை பெற்றிருந்தார்கள் என்பதைப் பட்டையங்கள் வழியாக அறிகின்றோம்.,False
695,"ஹமுராபி காலத்தில் கி.மு., பெண்கள் கோவில்களில் குருமாராகவிருந்தார்கள்.",False
696,ஆவணங்களில் பெண்கள் சாட்சிகளாகவும் கையெழுத்திட்டார்கள்.,False
697,எகிப்திய ஆவணங்களில் இன்ன தாயின் மகன் என்றே பெரும் பாலும் காணப்படுகின்றது.,False
698,தந்தையின் பெயர் அருமையாக ஓரோரிடத்திற் காணப்படுகின்றது.,False
699,கிரேக்கர் எகிப்தை வெற்றி கொண்ட காலத்தில் எகிப்தியர் தாய் வழியாலேயே அறியப்பட்டார்கள்.,False
700,பின்பு சிறிது சிறியதாகத் தாயின் பெயருக்குப் பதில் தந்தையின் பெயர் இடம் பெற்றது.,False
701,எகிப்தில் பெண்கள் கடைத்தெரு வுக்குப் போய் கொள்வனவு விற்பனவுகளைச் செய்கிறார்கள்.,False
702,ஆண்கள் வீட்டிலிருந்து துணி நெய்கிறார்கள்.,False
703,ஏரதோதசுக்கு கி.மு.,False
704,திருமண உடன்படிக்கையில் கணவன் மனைவிக்குக் கீழ்ப்படிவதாக வாக்களித்தான் என்றும் அவர் குறிப்பிட்டார்.,False
705,எகிப்திய பெண்களின் சொத்து அவர்கள் அதிகாரத்துக்குட் பட்டு இருந்தது.,False
706,அவர்கள் அதனைத் தமது எண்ணப்படி எவ்வாறு வேண்டினும் செய்து கொள்ளலாம்.,False
707,எகிப்திலே அரசர் முதல் எல்லா மக்களிடையும் சகோதரன் சகோதரியை மணக்கும் வழக்கம் தோன்றி வளர்ந்திருந்தது.,False
708,இரண்டாம் தாலமி கி.மு. என்னும் எகிப்திய அரசன் பிலாடல்போஸ் எனத் தனக்கு மறு பெயர் வைத்துக் கொண்டான்.,False
709,பிலாடல்போஸ் என்பதற்கு சகோதரியைக் காதலிக்கின்றவன் என்பது பொருள்.,False
710,பழைய வழக்கத்தைப் பின்பற்றி அவன் ஆர்சினோ என்னும் தனது சகோதரியை மணந்தான்.,False
711,எகிப்து பல சிற்றரசர் நாடுகளாகப் பிரிக்கப்பட்டிருந்தது.,False
712,ஒவ்வொரு சிறிய நாட்டையும் ஒவ்வொரு அரசன் ஆண்டான்.,False
713,அவ்வரசனுக்கு ஆட்சி யுரிமை தந்தை வழியாலன்றித் தாய் வழியாகவே வந்தது.,False
714,அது இன்று திருவிதாங்கூரில் நடைமுறையிலுள்ள மருமக்கள் தாயத்தை ஒத்தது.,False
715,சரித்திரகாலம் வரையில் தாயாட்சி எம்மட்டும் சமூகங்களில் வலிமை பெற்றிருந்ததென்பதை விளக்குவதற்குத் தாயாட்சியைக் குறித்துக் கூறியுள்ளோம்.,False
716,வரவர அதிகாரத்தால் வளர்ந்து வந்த ஆடவர் பெண்களை நியாயமாக நடத்தத் தவறினார்கள் எனக் கூறமுடியாது.,False
717,ஆடவன் பல பெண்களை மணத்தல் எகிப்திலே செல்வந்தனாயுள்ளவன் தான் விரும்பிய அத்தனை பெண்களையும் வைப்பாட்டிகளாக வைத்திருந்தான்.,False
718,ஆனால் அவனுடைய முறையான மனைவியே வீட்டின் தலைவி எனப்பட்டாள்.,False
719,அரண்மனை களில் பெண்களின் வீடு எனப்பட்ட தனிமையான ஒரு இடம் இருந்தது.,False
720,எல்லா நாடுகளிலும் கீழ் நிலையிலுள்ள மக்களிடையே பெண்கள் வியபிசாரத்திற்குத் தண்டிக்கப்படுகிறார்கள் ஆண் சிறிதேனும் தண்டனை அடைவதில்லை.,False
721,சில சமயங்களில் வியபிசாரக் குற்றஞ் சாட்டப்பட்டவன் நட்ட ஈடு கொடுக்க வேண்டியிருந்தது சில சமயம் கொலைத் தண்டனையும் பெற்றான்.,False
722,எகிப்தில் வியபிசாரக் குற்றத்துக்குட் பட்ட பெண்களின் மூக்கு அறுக்கப்பட்டது.,False
723,அபாசி என்னும் அமெரிக்கரிடையே இவ்வழக்கு இன்றும் நடைபெறுகின்றது.,False
724,மூக்கு அறுக்கப்படாவிட்டால் அவள் உயிரோடு புதைக்கப்பட்டாள்.,False
725,குற்றத்துக் குள்ளானவன் அடிக்கப்பட்டான்.,False
726,"அவர்கள் பலவகை மேனிமினுக்குப் பொருள்கள், மணப் பொருள்கள், சாயங்கள், உடை அலங்காரங்கள் போன்றவைகளைப் பயன் படுத்தினர்.",False
727,தாயாட்சி வலியடைந்திருந்தபோதும் ஆடவன் எவ்வாறு சமூகத்தில் தன்னை உயர்வாக வைக்க முடிந்தது என்பதை இவை விளக்குகின்றன.,False
728,"பதாஹோதெப் கி.மு., என்னும் அரசன் பெண்களை ஆடவருக்குப் பின்வருமாறு புத்திமதி கூறியுள்ளான்.",False
729,இன்னும் அவளுக்கு மகிழ்ச்சி கொடுக்கக் கூடியவைகளை நீ இருக்குமட்டும் செய்.,False
730,அவள் தன்னையுடையவனின் தகுதிக்கேற்றவளாய் வாழ வேண்டும்.,False
731,நீ அவளிடம் கொடுமையாக நடவாதே.,False
732,முரட்டுத்தனமான அதிகாரத்திலும் பார்க்க அன்பு நன்மைகளைச் செய்கின்றது.,False
733,முகக்கண்ணாடியில் தன்னைப் பார்க்கும்போது அவள் மகிழ்ச்சியடைவாள்.,False
734,யூதரிடையே தாயாட்சி முறை கிறித்துவ வேத காலத்தில் யூதரிடையே தாயாட்சி முறை இருந்ததெனக் காண்கின்றோம்.,False
735,கிறித்துவ வேதத்தில் அரசரைப் பற்றிய புத்தகத்தில் அரசனின் பெயரோடு தாயின் பெயர் இணைக்கப்பட்டிருக் கின்றது.,False
736,அரச சபையில் அரசனின் தாய்க்கு முதன்மை அளிக்கப்பட்டது.,False
737,"இதி னுடைய பொருள், ஒருத்தன் ஒரு பெண்ணை மணந்து தாயாட்சி வழக்கப் படி அவள் குடும்பத்தைச் சேர்ந்தவனாவான் என்பதே.",False
738,புல்வெளிகளில் வாழ்ந்த எபிரேய மக்களிடையே தாயாட்சி முன்னமே மறைந்து போயிற்று.,False
739,"தந்தையின் அதிகாரம் வேட்டையாடும், ஆடவரே தொடக்கத்தில் விலங்குகளைப் பிடித்துப் பழக்கி வளர்த்தார்கள்.",False
740,புல்வெளிகளில் மேய்ந்து மனிதரின் கவனிப்புக்குட்படாது பெருகும் ஆடுமாடுகளின் கூட்டங்களுக்கும் ஆடவரே தலைவராகவிருந்தனர்.,False
741,"மந்தைகள் பால், இறைச்சி முதலிய உணவுகளையும், தோல், கம்பளி முதலிய உடைகளையும் கொடுத்தன.",False
742,இதனால் அவை மிகவும் மதிப்புக்குரிய சொத்தாகப்பெருகின.,False
743,"ஆட்டு மந்தை, மாட்டு மந்தைகளை அதிகமாக வைத்திருப்பதால் அவைகளின் சொந்தக்காரன் புதிய மேய்ச்சல் நிலத்தைத் தேட வேண்டியிருந்தது.",False
744,ஆகவே அவன் தனது உறைவிடத்தை அடிக்கடி மாற்ற வேண்டியிருந்தது.,False
745,"பெரிய ஆடு மாடுகளின் கூட்டங்களைப் பாதுகாப்பதற்கு அவனுக்கு வேட்டை யாடுதல், போர் செய்தல்களிற் பயிற்சியுள்ள உதவியாளர் தேவைப்பட்டனர்.",False
746,ஆகவே அவன் அடிமைகளைப் பெறும் அவசியம் உண்டாயிற்று.,False
747,அடிமை களைப் பெற்றதும் அவன் தனது புதல்வர்களுக்கு மந்தை மேய்க்கும் பயிற்சியளித்து மந்தையை அவர்கள் கவனிக்கும்படி செய்தான்.,False
748,ஆப்பிரிக்காவிலே ஆடுமாடுகளை வளர்க்கும் கூட்டத்தினரிடையே அவை விடப்பட்டிருக்கும் பட்டிக்குள் பெண்கள் செல்ல அனுமதிக்கப் படமாட்டார்கள்.,False
749,"அவைகளை மேய்ப்பது, பால்கறப்பது எல்லாம் ஆடவரால் செய்யப்படுகின்றன.",False
750,பெண்களுக்கும் ஆண்களுக்குமுள்ள சமூகத் தொடர்பை பொருளா தாரத் தொடர்பான மாற்றங்களும் வேறுபடுத்தியுள்ளன.,False
751,தாய் வழியிலிருந்து உரிமை உண்டாவதற்குப் பதில் தந்தை ஆட்சி உண்டாயிற்று.,False
752,மந்தைக் குரியவனே தன்னை உணவுக்கு எதிர்பார்க்கும் குடும்பத்தின் மற்றையவர் களுக்கெல்லாம் தலைவனானான்.,False
753,அவனுக்குத் துணை புரிவதற்குப் பல ஆட்களின் உதவி வேண்டியிருந்தது.,False
754,ஆகவே அவனுக்குப் பல குழந்தை களைப் பெறுவதற்குப் பல பெண்கள் தேவைப்பட்டார்கள்.,False
755,பாபிலோனிலும் எகிப்திலும் பெண்கள் சம்பந்தமான மாற்றம் உண்டாகத் தொடங்கியிருந்தன.,False
756,பிற்காலத்தில் ஓரிடத்தில் தங்கியிருந்த எபிரேயரிடையே மேலும் தாயாட்சி விழுகையடைவதாயிற்று.,False
757,பெண்கள் பெற்றோர் களுடைய சொத்தாயிருந்தது பின்பு கணவனின் சொத்து ஆனார்கள்.,False
758,பெண் விலை மதிப்புள்ள வேலையாளாயிருந்தாள்.,False
759,அவள் மிகக் கடுமையான வீட்டு வேலைகளைச் செய்தாள்.,False
760,அவள் அடிமைபோல் வேலை செய்தது மாத்திரமல்லாமல் அவளிடம் தான் உரிமை பாராட்டக்கூடிய சொத்து எதுவும் இருக்கவில்லை.,False
761,பாபிலோனியரால் சிறை பிடிக்கப்படும் காலம் வரையில் ஆண்கள் பல பெண்களை மணந்தார்கள்.,False
762,"ஆடவன் பெண்ணை விலை கொடுத்து வாங்கினான், சொத்து ஆண் வழியைச் சேர்ந்தது.",False
763,இலக்கிய கால மக்களை நாம் நோக்கும்போது எரதோதசு கூறி யிருக்கும் ஒரு நிகழ்ச்சி இதற்கு மாறாகக் காணப்படுகின்றது.,False
764,ஒருவனை நோக்கி அவன் குடும்ப வழியை வினாவினால் அவன் தனது தாய் அல்லது தாயின்தாய் பெயரைக் கூறுவான்.,False
765,"பெண், அடிமை ஒருவனைச் சேர்ந்து பிள்ளையைப் பெற்றால் பிள்ளை முறைமையானதாகக் கொள்ளப்பட்டது.",False
766,"ஆண், அடிமைப் பெண்ணைச் சேர்வதால் பிறந்த பிள்ளைகள் அடிமைகளாகவும் முறைகேடாகப் பிறந்தனவாகவும் கொள்ளப்பட்டன.",False
767,சொத்து தாயிட மிருந்து மகளை அடைந்தது மகனை அடையவில்லை.,False
768,கிரேக்க நாகரிகத்தின் முன்முறையில் நாம் தாயாட்சியைக் காண் கின்றோம்.,False
769,இவ்வடையாளங்கள் பழங்கதைகளிலேயே காணப்படுகின்றன.,False
770,பழைய கிரேக்கரிடத்தில் காதல் என்பது இன்றைய கீழ் நிலையிலுள்ள மக்களிடையே காணப்படும் காதலைப் பற்றிய கருத்தைவிட வேறாக இருக்கவில்லை.,False
771,அவள் கணவனின் வீட்டுக்குச் சென்று அங்குப் பெண்கள் இருக்கும் அறையில் வாழ்ந்தாள்.,False
772,அவள் கல்வி யறிவில்லாதிருந்தாள் அவளுக்குப் பெண்களுக்குரிய தையல் வேலை மாத்திரம் தெரியும்.,False
773,அவள் வெளியே செல்லவும் ஆடவரோடு பழகவும் மன வளர்ச்சிக்குரியவைகளை அறியவும் முடியாமல் இருந்தாள்.,False
774,பிற்காலத்தில் ஆட்சி முறைகளில் மாற்றம் உண்டான போது கிரேக்கப் பெண்களின் நிலை இன்னும் மோசமடைந்தது.,False
775,மனைவியிருக் கும் அறையைக் காவல் காப்பதற்கு அடிமைப் பெண் ஒருத்தி நியமிக்கப் பட்டாள்.,False
776,மனைவியிருக்கும் அறையை அடைத்துத் தாள் இட்டு அவளைக் காவல் காப்பதே நல்ல முறை என்று கணவன் கருதினான்.,False
777,"பழைய தத்துவ சாத்திரிகள், பெண்கள் ஆண்களுக்குச் சமமானவர்களல்லர் எனக் கருதி னார்கள்.",False
778,ஆகவே சட்டத்தில் பெண்களுக்கு வாய்ப்பானவை எவையும் இருக்கவில்லை.,False
779,"கிரீசிலே ஸ்பாட்டிய, டோரியப் பெண்கள் விடுதலை யடைந்திருந்தார்கள் எனச் சிலர் கூறுவதுண்டு.",False
780,இக் கருத்துத் தவறுடையது.,False
781,"ஸ்பாட்டிய, டோரியப் பெண்கள் வெளியே சென்று விளையாட்டுகளிலும் மல்யுத்தங்களிலும் கலந்து கொள்ளும்படியும் விடப்பட்டார்கள்.",False
782,"இது அவர்கள் உடல் நலம் பெற்று நல்ல குழந்தைகளைப் பெறும் பொருட்டும், ஆடவரின் நன்மையைக் கருதியும் அனுமதிக்கப்பட்ட வழக்கமேயாகும்.",False
783,அக் காலத்தில் கிரீசில் இன்னொரு வகையாகப் பெண்கள் முன்னுக்கு வந்தார்கள்.,False
784,இவர்கள் பரத்தையராவர் .,False
785,இவர்கள் ஆடவரின் கவர்ச்சிக்குடையவர்களாயிருந்தனர்.,False
786,"வீட்டு மனைவியர்களிலும் பார்க்க இவர்களுக்கு உலக நடையும், கல்வியும், ஆடவரை வசியப் படுத்தும் தன்மையும், நல்ல பழக்கங்களும் தெரியும்.",False
787,கிரேக்கக் கணவர்கள் இவர்களையே சுற்றித் திரிந்தனர்.,False
788,"சாகிராட்ஸ், அரிஸ்டோட்டில் முதலிய தத்துவ ஞானிகளும் இவர்களின் கவர்ச்சிக்குட்பட்டிருந்தனர்.",False
789,வீட்டுக்காரி எனப்பட்ட பெண் இவ்வாறு பரத்தையைச் சுற்றித்திரியும் கணவனைக் கலியாண நீக்கம் செய்து கொள்ளலாம்.,False
790,அப் பரத்தையை வீட்டுக்குக் கொண்டு வராத அளவில் அவள் அவ்வாறு செய்தல் முடியாது.,False
791,பெரிக்கிளிஸ் இவ்வாறு செய்தமையால் கலியாண நீக்கம் செய்யப்பட்டார்.,False
792,"அவர் ஐம்பது வயதுடையவராயும், வளர்ந்த மக்களை உடையவராயும் இருந்தபோதும் அஸ்பேசியா என்னும் பரத்தையை மணந்தார்.",False
793,ஆடவனின் இயல்பான தன்மை ஒரு பெண்ணை மணப்பதன்று.,False
794,திருமணங்கள் ஒழுக்க சம்பந்தத்திலும் பார்க்கப் பொருளாதார சம்பந்தமுடையன.,False
795,கீழ் நிலையிலுள்ள மக்களிடையே இன்றும் இம்முறை காணப்படுகின்றது.,False
796,கிறித்துவ வேதத்தின் பழைய ஏற்பாட்டில் கூறப்படும் சாலமன் அரசனிடத் தில் மனைவியரும் வைப்பாட்டிகளுமாக ஆயிரம் பெண்கள் வரையிலிருந் தார்கள்.,False
797,"பலமில்லாதவரும், வறியவரும் ஒரு மனைவியை வைத்திருந்தனர், அல்லது மனைவி இல்லாது இருந்தனர்.",False
798,இவ்வடிப்படையிலிருந்தே ஒழுக்கம் ஒழுக்கமின்மை என்னும் நியாயங்கள் தோன்றுகின்றன.,False
