Line Number,Sentence
2216,"நிர்வாணம், நாணமின்மை, கருவழிப்பு, கட்டுப்பாடில்லாத கலியாணம் முதலியன ஏற்றனவாகக் கொள்ளப்படுகின்றன.",False
2217,முற்காலத்தில் ஆண் பெண் சம்பந்தமான கருமங்கள் பேசுவது மிக இரகசியம் எனக் கருதப்பட்டது.,False
2218,இன்ற ஆண் பெண் சேர்க்கை சம்பந்தமாகத் தோன்றும் நோய்களைப் பற்றிய பேசப்படும் பொதுக் கூட்டங்களில் உயர்நிலையிலுள்ள பெண்களும் சமூகமளிக்கின்றனர்.,False
2219,கற்பு ஆடவர் மகளிரிடத்திற் கொண்ட காதல் சம்பந்தமான பொறாமை யினாலேயே கற்பு உண்டாயிற்று.,False
2220,இவ்வகைப் பொறாமை தோன்றா விட்டால் கற்புச் சிறந்த குணமாகக் கருதப்படமாட்டாது.,False
2221,முற்காலத்தில் மணமான பெண்களின் கற்பு மதிப்புக்குரியதாக இருக்கவில்லை.,False
2222,ஆகவே பெண்கள் விருந்தினருக்கு இரவலளிக்கப்பட்டார்கள்.,False
2223,பிற்போக்கான மக்கள் மணத்துக்கு முற்பட்ட கன்னிமையையும் மதிக்கவில்லை.,False
2224,பல கூட்டத்தாரிடையே பெண்கள் மணத்துக்கு முன் தமது தயவை ஆடவருக்கு விற்று அதனால் சீதனம் சம்பாதித்தார்கள்.,False
2225,இலிதிய மக்கள் சீதனஞ் சம்பாதிக்கும் பொருட்டுத் தமது புதல்வியரைப் பரத்தைத் தொழிலுக்கு அனுமதித்தார்கள் என்று எரதோதசு கூறியுள்ளார்.,False
2226,பரத்தைத் தொழில் அவர்கள் மணமாகும் வரையும் நடைபெற்றது.,False
2227,மெக்சிக்க மக்கள் மணப்பருவமடைந்த பெண்களைத் தமது காதல் மூலம் அழகிய உடை களைச் சம்பாதிக்கும்படி வெளியே போக்கினார்கள்.,False
2228,பேலோ தீவுப் பெண்கள் தமது காதலை ஆடவருக்கு விற்கிறார்கள்.,False
2229,நிகரகுவா அமெரிக்கர் பரத்தைத் தொழிலால் சீதனம் சம்பாதிக்கும்படி தமது பெண்களை அனுமதித்தார்கள்.,False
2230,ஜப்பானிய தந்தை பணமுடை நேர்ந்தால் தனது குமாரத்திகளை சிவாரா என்னும் களியாட்டு விடுதிகளுக்குப் போக்கினான்.,False
2231,இது பெண்களின் மதிப்பை எவ்வகையிலும் குறைக்கவில்லை.,False
2232,சில மக்கட் கூட்டத்தினர் தம்மிடையே வளர்ந்த பெண்கள் கன்னிய ராய் இருப்பதில் வெட்கமடைந்தார்கள்.,False
2233,திருமணத்துக்கு முன் அவர்கள் பல ரின் காதலியராயிருத்தல் மதிப்புக்குரியதாயிருந்தது.,False
2234,குழந்தையைப் பெற்றுத் தான் மலடி அல்லள் எனக் காட்டிய ஒருத்தியையே அந்நாட்டு வாலிபர் மணஞ் செய்துகொள்ள விரும்பினர்.,False
2235,இந்தியாவில் தேவடியாள் என்னும் நாட்டியப் பெண்கள் மரியாதை பெற்றனர் பெறுகின்றனர்.,False
2236,பரத்தையரோடு ஆடவர் சேர்தலில் அவர்களின் கற்புப் பங்கம் அடைகின்றதென்று கருதப்படவில்லை அது சிறுபொழுதைய திருமண மாகக் கருதப்பட்டது.,False
2237,ஆதென்ஸ் பட்டினத்தில் பரத்தையர் பலர் அரசிக் குரிய மதிப்பைப் பெற்றிருந்தனர்.,False
2238,அவர்கள் பலருக்கு உருவச் சிலைகள் நாட்டப்பட்டன.,False
2239,சில சமயக் கொள்கைகளோடு பரத்தைமையும் கலந்திருந் தது.,False
2240,முற்காலத்திற் சமய சம்பந்தமான பரத்தைமை பொதுவாக விருந்தது.,False
2241,கிரீசில் அபிரடோயிற் என்னும் தெய்வத்தின் கோயிலைச் சேர்ந்த பரத்தையர் விடுதிகள் இருந்தன.,False
2242,"கோமம் என்னும் கோயிலில் , பரத்தையர் இருந்தனர் என்று தயதோரஸ் கூறியுள்ளார்.",False
2243,வாணிகமும் தொழிலும் வளர்ந்தபோது செல்வம் வளர்ந்தது.,False
2244,"அக் காலத்தில் மற்றப் பண்டங்களை வாங்குவதைப்போல மனைவியரை வாங்கு வதும் வழக்கமாயிருந்தது, விலை கொடுத்து வாங்குவது.",False
2245,பெண்ணைப் பண்டங்கள்போல் ஆக்கினாலும் சமூகத்தில் அவளுக்குச் சில வாய்ப்புகள் இருந்தன.,False
2246,தான் அரிதில் முயன்று தேடி பொருள்களைப் பெண்ணுக்காகக் கொடுத்தமையால் அவன் அவளைத் தானே வைத்திருக்க விரும்பினான்.,False
2247,"ஆகவே, எனது உனது என்ற வகையான உணர்ச்சி எழுந்தது.",False
2248,விலை கொடுத்து வாங்கப்பட்டமையின் பெண் நன்கு கவனிக்கப்பட்டாள்.,False
2249,அவ னுடைய சொத்து அவன் பிள்ளைகளைச் சேர்ந்தது.,False
2250,தன் மூலம் பிறக்கும் பிள்ளைகளல்லாத மற்றவர்களுக்குத் தனது சொத்துச் செல்லுதல் கூடாதென அவன் நினைத்தான்.,False
2251,பெண்ணை விலை கொடுத்து வாங்குதலால் பெண்ணின் கற்பில் மாற்றம் உண்டாயிற்று.,False
2252,மணமாகாத பெண்களின் நிலையையும் மாறுதல் அடையச் செய்தது.,False
2253,பெண்ணுக்கு ஒரு குறித்த விலை உண்டு.,False
2254,அவ்விலை கொடுத்து வாங்கப்படா விட்டால் அவளுக்கும் அவள் குடும்பத்துக்கும் மரியாதைக் குறைவெனக் கருதப்பட்டது.,False
2255,"வாணிக முறையில், ஒரு பொரு ளின் விலையாகக் கொடுக்கப்பட்ட பொருள் பெருமதிப்புள்ளதாக மாட் டாது.",False
2256,நாகரிகத்தின் கீழ்நிலையில் இவ்வகைக் கருத்தே உண்டாகியிருந்தது.,False
2257,பெண்ணுக்காகக் கொடுக்கப்படும் பொருளோடு அவள் மரியாதை இணைக்கப்பட்டிருப்பதாகக் கருதப்பட்டது.,False
2258,விலை கொடுத்து வாங்கப் படாத பெண்கள் பரத்தையராகச் சில கூட்டத்தினரிடையே கருதப்பட்டனர்.,False
2259,தொடக்கத்தில் கற்பு கீழான கருத்தோடு ஆரம்பித்ததெனத் தெரிகின் றது.,False
2260,பல கூட்டத்தினரிடையே காணப்படும் குழந்தை மணப் பேச்சுக்களும் கற்புக்குக் காரணமாகும்.,False
2261,இரண்டு குடும்பங்களையும் இணைக்கும் பொருட்டு இளமையிற் குழந்தை மணங்கள் முடிவு செய்யப்பட்டன.,False
2262,"ஆகவே, மணமான சிறுமிகள் மணமான வளர்ந்த பெண்களைப்போலக் கட்டுப்பாடு உடையவர்களானார்கள்.",False
2263,ஆண் பெண் பொறாமைக்குப் பொருளாதாரமும் ஒரு காரணமாக விருந்தது.,False
2264,ஆடவரின் தொழில்கள் வெவ்வேறு வகைகளாயிருந்தன.,False
2265,பெண் வீட்டு வேலை ஒன்றையே கவனிப்பவளாயிருந்தாள்.,False
2266,அவள் பொருள் ஈட்ட வில்லை.,False
2267,அவள் தனக்கு வேண்டிய எல்லாவற்றையும் கணவனிடமிருந்து தனது காதலின் விலையாகப் பெற்றாள்.,False
2268,இதில் இடையூறு நேரும்போது பொறாமை தோன்றுவது இயல்பு.,False
2269,ஆடவரின் வேலைகள் வெவ்வேறாக இருந்தமையால் வேறு விளைவுகள் தோன்றின.,False
2270,ஆடவர் பொதுக் கருமத்தின் பொருட்டு ஒன்று சேர்வதால் சமூகமும் ஆட்சியும் தோன்றின.,False
2271,இதனால் நாட்டு அமைப்பில் மாறுதல் உண்டாயிற்று.,False
2272,"நாட்டின் நலனுக்காக ஒழுங்கான குடும்பங்களும், திருமணச் சட்டங்களும் தோன்றின.",False
2273,"மக்கள் குடிகளாகவும், குலங்களாகவும் பிரிந்து வாழ்ந்தபோது மணமாகாத தாய்மார் தாழ்ந்தவராகக் கருதப்பட்ட னர் ஆயினும், குடும்பங்கள் அவர்களைப் பாதுகாத்தன.",False
2274,குலங்கள் என்னுங் கட்டுக் குலைந்ததும் நாடு குடும்பங்களில் தங்கியிருந்தது.,False
2275,"ஆகவே, ஆட்சி ஒருதார மணத்தையும் கற்பையும் வற்புறுத்தி ஆண் பெண் தொடர்பான பொறாமையை வளரச் செய்தது.",False
2276,அவள் புதிய காதலன் பொருட்டுக் கணவனை விட்டுப் பிரியலாம்.,False
2277,இது திருமணக் குழப்பமாவ துடன் அவன் ஏய்க்கப்பட்டவனுமாகின்றான்.,False
2278,இக்காரணம் பற்றியும் கற்பு வற்புறுத்தப்பட்டது.,False
2279,உடம்பு சம்பந்தமான வெறுப்பும் ஆண் பெண் பொறா மைக்குக் காரணமாகும்.,False
2280,ஒருவன் காதலிக்கின்ற ஒருத்தி இன்னொருவ னோடு கள்ளச் சேர்க்கை உடையவளாகின்றாள்.,False
2281,ஒருவன் குடித்த பாத்திரத்தில் இன்னொரு வன் குடிக்க அருவருப்படைவதோடும் சிலர் இதனை உவமிப்பர்.,False
2282,நல்ல தோற்றத்தினாலும் மனிதன் இன்பம் அடைகின்றான்.,False
2283,பழங் கால மனிதன் கட்டான தேகமும் பெண்ணுக்குரிய தன்மைகளும் உள்ள ஒருத்தியை விரும்பினான்.,False
2284,"அவன் பெண்ணின் நடை, உடை, அசைவு, அழகு, நிறங்களைப்பற்றிப் பொருட்படுத்தவில்லை.",False
2285,இவ்வாறு பெண்ணைப் பற்றி முற்கால மனிதனின் உள்ளத்தில் எழுந்த உணர்ச்சியே இன்றைய புதுமுறையான காதலாக வளர்ச்சியடைந்தது.,False
2286,கற்பு ஒரு கடமையாக வளர்ந்தது கற்பு பெண்ணைக் கட்டுப்படுத்திற்றேயன்றி ஆணைக் கட்டுப்படுத்த வில்லை.,False
2287,சில சமயங்களில் பெண்களையும் கட்டுப்படுத்தவில்லை.,False
2288,"ஆண், ஆண் தன்மை உடையவனாயிருந்த போது பெண் கற்பாயிருக்க வேண்டு மென்று கொள்ளப்பட்டது.",False
2289,ஆண் சம்பந்தப்பட்டவளவில் அவன் இவ்வா றிருக்க வேண்டியதில்லை பிறமாதரைச் சேர்தல் அவன் வல்லமைக்குட் பட்டிருந்தது.,False
2290,உயர்ந்த குடும்பங்களில் அவ்வாறிருத்தல் அவசியம் எனவும் கருதப்பட்டது.,False
2291,கோயிற் குருமார் மாத்திரமல்லர் விசுப்பாண்டவர்களும் பரத்தையர் விடுதிகளில் வரி தண்டினார்கள்.,False
2292,உரோமில் போப்பு பரத்தையர்களிடமிருந்து வரி தண்டினார்.,False
2293,"பத்தாம் நூற்றாண்டில் போப்பின் காரியாலயத்தில் , டக்கட் இவ்வகையில் வரியாகக் கிடைத்ததற்குப் பற்றுச் சீட்டுகள் காணப் படுகின்றன.",False
2294,ஜெர்மனியிலுள்ள மேயின் என்னுமிடத்தில் ஆட்சி விசுப்பு இவ்வகை வரி தண்டினார்.,False
2295,"பொதுப் பெண்கள், பரத்தையரோடு போட்டியிடு வதால் தமது வருவாய் குறைந்ததைப்பற்றி அவர் குறிப்பிட்டுள்ளார்.",False
2296,ஸ்ராஸ் பேக்கின் விசுப்பு பரத்தையர் விடுதி ஒன்றைத் தொடக்கினார்.,False
2297,சில வகுப்பினரிடையே விலைமாதர் மிக மதிப்புப் பெற்றனர்.,False
2298,அவர்கள் மனைவியரிலும் மேலானவர்களாகக் கொள்ளப்பட்டனர்.,False
2299,அபிசீனியாவிலே பரத்தையர் அரசன் அரண்மனையில் மிக மதிப்புக் குரியவர்களாயிருந்தனர்.,False
2300,ஒரு நகர் அல்லது மாகாணத்தினர் ஆட்சி அவர் பொறுப்பில் விடப்பட்டது.,False
2301,அரசியரைப் போல் உடுத்து அவர்கள் தமது மத்தியில் இருப்பதைப் பார்த்து முறைமையான மனைவியர் பெருமை கொண்டனர்.,False
2302,"கணவர், பிற ஆடவர் மூலம் தமது மனைவியர், பிள்ளைகளைப் பெற அனுமதிக்கும் நிகழ்ச்சிகள் பல உண்டு.",False
2303,அவ்வாறு பிறக்கும் பிள்ளைகளைக் கணவன் தனது பிள்ளைகளாகவே பாவிக்கின்றான்.,False
2304,எஸ்கிமோவர் தம் மனைவியர் தம் மதகுரு மூலம் பிள்ளைகளைப் பெறுவதை விரும்பினார்கள்.,False
2305,அவள் விருந்தாளி மூலம் கருவடைந்தாள் என்று அறியு முன் கணவன் அவளைத் தீண்டமாட்டான்.,False
2306,"பெண், பிள்ளை இல்லாதவளான போது நாகரிக காலத்திலும் இவ்வகைச் செயல்கள் நிகழ்ந்தன.",False
2307,பழைய யூதரின் திருமணச் சட்டபடி இறந்துபோன தமையனின் மனைவியைச் சேரும்படி ஒருவன் அனுமதிக்கப்பட்டான்.,False
2308,அவ் வகையிற் பிறக்கும் பிள்ளை இறந்தவனின் பிள்ளையாகக் கருதப்பட்டது.,False
2309,கபீர் மக்க ளுள் தந்தையின் மனைவி அவன் மரணத்துக்குப்பின் அவள் மகனுக்குச் சொந்தமானாள்.,False
2310,மகன் தந்தையின் மனைவியைத் தீண்ட மாட்டான்.,False
2311,அவன் அவளை இன்னொருவனோடு இருக்கும்படி சிலகாலம் அனுமதித்தான்.,False
2312,அவள் வயிற்றில் பிறக்கும் பிள்ளை தந்தை மூலம் வந்த சொத்தாகக் கருதப் பட்டது.,False
2313,ஓசெடிஸ் மக்களிடையே ஒருவன் தனது ஆறு வயது மகனுக்கு வளர்ந்த பெண்ணைக் கலியாணம் கட்டி வைத்தான்.,False
2314,கணவனின் தந்தை மூலம் அவள் வயிற்றில் பிறக்கும் பிள்ளைகள் கணவனின் பிள்ளைகளாகக் கருதப்பட்டன.,False
2315,தென்னிந்திய பிற்போக்கான மக்கள் சிலரிடையும் இவ்வழக்கம் காணப்படு வதைத் தென்னிந்திய குலங்களும் குடிகளும் என்னும் நூலில் தேஸ்ரன் காட்டியுள்ளார்.,False
2316,கற்பின் சின்னமாகிய நாணம் நாணம் இயற்கையான குணமன்று.,False
2317,அது பிற்காலத்தில் தோன்றி வளர்ந்தது.,False
2318,சில நாடுகளில் ஆண் பெண் சேர்க்கை வெளிப்படையாக நிகழ்கின்றது.,False
2319,"தென் கடல் தீவுகள், தாகிதி போன்ற பற்பல இடங்களில் இது பொது நிகழ்ச்சி.",False
2320,சில பிற்போக்கான மக்களுள் ஆண்களும் பெண்களும் உடையின்றிச் செல்கின்றனர்.,False
2321,பக்காரி மக்களைக் குறித்து ஸ்டினென் கூறியிருப்பது வருமாறு நமது ஊரவர்களுக்கு உடம்பில் மறைவான இடமென்பது கிடையாது.,False
2322,மறைவான உறுப்பு எனக் கூறுவதே மூடத்தனம் என அவர்கள் கூறுகிறார்கள்.,False
2323,மற்றவர்கள் காணாமல் உண்பது நற்பழக்கமென அவர்களால் கொள்ளப்படுகின்றது.,False
2324,"முகம், கால், மயிர், பாதம், வயிறு என்பவைகளில் ஒவ்வொன்றைக் காட்ட நாணும் மக்களும் காணப்படுகின்றார்கள்.",False
2325,முகமதியப் பெண்கள் முகத்தைக் காட்டமாட்டார்கள்.,False
2326,பல மக்களிடையே மகன் பன்னிரண்டு வயதான பின் தாய் அவனைப் பார்க்க அனுமதிக்கப்படமாட்டாள்.,False
2327,எகிப்திலே வெலகீன் பெண்கள் ஆடவரின் மத்தியில் தமது உடையை உரிந்து உடுப்பில் நாண மாட்டார்கள்.,False
2328,"ஆனால், தமது முகத்தை மற்றவர்கள் பார்க்கும்படி விடமாட் டார்கள்.",False
2329,ஹொற்றன் ரோவர் என்னும் ஆப்பிரிக்கப் பெண்கள்.,False
2330,சீனப் பெண்கள் தமது பாதத்தை வெளியே காட்ட நாணுவர்.,False
2331,பாதத்தைக் குறித்துப் பேசுவதே விரும்பத்தகாத செயலாகும்.,False
2332,மத்திய ஆப்பிரிக்காவில் பல கூட்டத்தின ரிடையே பெண்கள் மரக்கிளை ஒன்றை அணிவர்.,False
