Line Number,Sentence
761,"செய்யுளுறுப்புகளுள் ஒன்றாகிய மரபு என்பதனைக் குறித்து, மரபே தானும் நாற்சொல் லியலான் யாப்பு வழிப்பட்டன்று செய்யுளியல் என்றார் தொல்காப்பியனார்."
762,அங்குக் குறித்த மரபு என்பது உலகியல் வழக்குப் பற்றியது.
763,அம்மரபு சொய்யுளின் உறுப்பாதற் குரிய காரணத்தினை இச்சூத்திரத்தாற் கூறினார் ஆசிரியர் என்பது இச்சூத்திரத்திற்குப் பேராசிரியர் தரும் விளக்கமாகும்.
764,மரபுநிலை திரியிற் பிறிது பிறிதாகும்.
765,"இளம்பூரணம் இள் மரபுநிலை திரிந்துவரிற் பொருள் வேறுவேறாகு மென்றவாறு. எனவே, வழுவென்றவாறாம்."
766,"பேராசிரியம் இது, மேற்போன வழக்கிற்குஞ் செய்யுட்கும் வருகின்ற இலக்கணத்திற்கும் பொது."
767,"இள் மரபினை நிலைதிரித்துச் சொல்லுபவெனின், உலகத்துச் சொல்லெல்லாம் பொருளிழந்து பிறிதுபிறிதாகும் எறு."
768,வழக்கெனப் படுவ துயர்ந்தோர் மேற்றே நிகழ்ச்சி அவர்கட் டாக லான.
769,"இளம்பூரணம் என்னுதலிற்றோ எனின், ஐயமறுத்தலை நுதலிற்று."
770,இள் வழக்கென்று சொல்லப்பட்டது உயர்ந்தோர் மேலது நூலின் நிகழ்ச்சி அவர்மாட்டாதலான் என்றவாறு.
771,இள் வழக்கென்று சொல்லப்படுவது உயர்ந்தோர் வழங்கிய வழக்கே என்னை?
772,"என்னும் ஐயத்தினை நீக்குவது இச்சூத்திரமாதலின், ஐயம் அறுத்தலை நுதலிற்று எனக் கருத்துரை வரைந்தார் இளம்பூரணர்."
773,இள் மரபாவது நூற்கு இன்றியமையாத இயல்பு.
774,அவ்வியல்பு திரியாத மரபுடைத்தாகி உரைக்கப்படும் நூல்தாம் இருவகைய முதனூல் எனவும் வழிநூல் எனவும் என்றவாறு.
775,எதிர்நூல் என்பதும் ஒன்றுண்டு.
776,அதுவும் ஒரு முனைவனாற் செய்யப்படின் முதனூலாம் பிறர் செய்யின் வழங்காது.
777,"ஒன்றன்வழியேயன்றியுந் தாந்தாம் அறிந்தவாற்றானும் நூல் செய்யப் பெறாரோவெனின்,அதுமரபன்று அது நோக்கியன்றே."
778,மரபுநிலை திரியிற் பிறிதுபிறி தாகும் என்றவிதி நூலிற்கும் எய்துவித்துப் புகுந்ததென்பது என்னை?
779,"பிறிதுபிறி தாகுமாறெனின்,ஒரு பொருட்கண்ணே மாறுபட்ட இலக்கணங் கூறின் அவ்விரண்டும் அதற்கிலக்கண மாகாது என் போல?"
780,"அல்லதூஉம், நற்காலத்து வழங்கிவந்ததனை வழுவென்று களைபவாயினன்றே பிற்காலத்துப் பிறந்த வழக்கு இலக்கணமெனத் தழீஇக்கொள்வதென்க."
781,"எனவே, பிறபாடை நூல்களாயின் இம்மரபு வேண்டுவதன்றாயிற்று."
782,மற்று முதனூலினை இன்னதென்பது துணிந்து உரையாரோவெனின் அதுவன்றே இனிக்கூறுகின்றதென்பது.
783,"ஆய்வுரை இது, மேற் செய்யுளியலில் அடிவரையில் எனப்பட்ட ஆறனுள் நூலுக்குரிய மரபு உணர்த்தத்தொடங்கி நூலின் வகையுணர்த்துகின்றது."
784,இறையனார் களவியலுரையாசிரியர் நூல்தான் மூன்று வகைப்படும்.
785,முதல்நூலும் வழிநூலும் சார்புநூலும் என என்னை?
786,முதல்வழி சார்பென நூன்மூன் றாகும் என்றாராகலின் இறையனார் களவியலுரை.
787,சூ என நூல்களை மூவகைப்படக் குறித்துள்ளார்.
788,ஓர் ஆசிரியன் சார்புநூல் செய்ததனாற் பயன்யாது?
789,வினையின் நீங்கி விளங்கிய அறிவின் முனைவன் கண்டது முதனூ லாகும்.
790,இளம்பூரணம் என்னுதலிற்றோஎனின் நிறுத்தமுறையானே முதனூலாமாறு உணர்த்துதல் நுதலிற்று.
791,சூத்திரத்தாற் பொருள் விளங்கும்.
792,வினையென்பன இருவினை இன் நீக்கத்துக்கண் வந்தது விளங்கிய அறி வென்பது முழுதும் உணரும் உணர்ச்சி.
793,னென நின்ற இன் சாரியை.
794,இன்ன அறிவினொடுகூடிய முனைவன் அறிவின் முனைவனெனப்படும்.
795,முன்னோனை முனைவனென்பது ஓர்சொல் விழுக்காடாம்.
796,முன்னென்பதனை முனையென்பவாகலின்.
797,வழிநூலுஞ் சார்புநூலுமெனப் பலவும் செய்தாரெனவுங் கூறுப.
798,"எனவே, அகத்தியமே முற்காலத்து முதனூலென்பதூஉம் அதன் வழித்தாகிய தொல்காப்பியம் அதன் வழி நூலென்பதூஉம் பெற்றாம்."
799,"இனிப், பன்னிருபடலம் முதனூலாக வழிநூல் செய்த வெண்பாமாலை ஐயனா ரிதனாரும் இது கூறினார் என்னை?"
800,இள் வினைத்தொடர்பினின்றும் இயல்பாகவே நீங்கி விளங்கிய முழுதுணர்வுடைய முதல்வனாற் செய்யப்பட்டது முதல்நூலாகும் எறு.
801,"வினையென்பது, வேண்டுதல் வேண்டாமை காரணமாகச் செய்யப்படும் நன்றுந் தீதுமாகிய வினைத்தொடர்பு."
802,வினையின் நீங்கி என்புழி இன் என்னும் ஐந்தாம் வேற்றுமையுருபு நீக்கப் பொருளில் வந்தது!
803,"முனைவன்முதல்வன் என்றது உலக முதல்வனாகிய இறைவனைக் காணுதல்செய்தல், இயற்றுதல்."
804,"முதல் நூலாவது, வரம்பிலறிவன் பயந்ததாகும்."
805,வழியெனப் படுவ ததன்வழித் தாகும்.
806,"இளம்பூரணம் என்னுதலிற்றோஎனின், வழிநூலாமாறு உணர்த்துதல் நுதலிற்று."
807,"பேராசிரியம் இது, வழிநூலாமா றுணர்த்துகின்றது."
808,இள் நுதலிய நெறியானன்றி வழிநூலென்றற்குச் சிறப்புடையது அம்முதனூல்வழிப் பிறந்த வழிநூல் எறு.
809,அது தொல்காப்பியம்.
810,"மற்றுப் பல்காப்பியம் முதலியன வோவெனின்,அவை வழிநூலே தொல்காப்பியத்தின்வழித் தோன்றின வென்பது என்னை?"
811,"இனிச், சில குன்றக்கூறினார் தொகுத்து நூல்செய்தாராகலினென்பாரும் உளர்."
812,ஒழிபொருளவாயினது தொகையெனப்படாமையின் அங்ஙனங் கூறுதல் வழிநூலிலக் கணமன்றென்பது.
813,"ஆய்வுரை இது, வழி நூலாமாறு உணர்த்துகின்றது."
814,"இனி, அந்நூலோடு முதல் நூலோடு ஒத்தமரபிற்றாய், ஆசிரியமதவிகற்பம்படக் கிளப்பது வழிநூல் எனப்படும்."
815,வழியின் நெறியே நால்வகைத் தாகும்.
816,இளம்பூரணம் என்னுதலிற்றோ எனின் வழிநூல் பாகுபடுமாறு உணர்த்துதல் நுதலிற்று.
817,இள் வழிநூல் எனப்படுவது நான்கு வகைப்படும் என்றவாறு. அது முன்னர்க் கூறுதும்.
818,பேராசிரியம் இது வழிநூல் இனைத்துவகைத் தென்கின்றது.
819,"இள் மேல், வழி நூலெனப்பட்டது நான்குவகையாற் செய்யப்படும் எறு."
820,இதன் பயன் ஒருநூலுள் ஒன்றல்லது பல வாராவெனவும்.
821,"அதனானே நான்குவகைய வழிநூலெனவும், முதனூலாயின் ஒன்றேயாமெனவுங் கூறியவாறாயிற்று."
822,"அவையாவன மேற்கூறுப ஆய்வுரை இது, வழிநூல் செய்யும் முறை இத்தனை வகைப்படும் என்கின்றது."
823,இள் வழிநூல் இயற்றப்படும் முறை நால்வகைப்படும் எறு.
824,அவ்வகை அடுத்த சூத்திரத்தில் விரித்துரைக்கப்படும்.
825,தொகுத்தல் விரித்தல் தொகைவிரி மொழிபெயர்த் ததர்ப்பட யாத்தலோ டனைமர பினவே.
826,இளம்பூரணம் என்னுதலிற்றே எனின்.
827,வழிநூல் வகையாமாறு உணர்த்துதல் நுதலிற்று.
828,இது வழிநூலானாய பயன்.
829,பேராசிரியம் இந்நான்கு வகையுங் காரணமாக மேற் கூறிய நால்வகை வழி நூலும் பெறலாம் என்றவாறு.
830,மொழிபெயர்த் தென்பது பிறபாடையாற் செய்யப்பட்ட பொருளினைத் தமிழ் நூலாகச் செய்வது அதுவுந் தமிழ்நூலுள் வழிநூற்கு மரபாமென்றவாறு.
831,"மொழிபெயர்த் தெனவே, பொருள் பிறழாமை பெற்றாம்."
832,வழக்கு நூலுள்ளும் மொழி பெயர்த்து யாக்கப்படுவன உளவோவெனின் அற்றன்று அது வேண்டுமே?
833,இம்மரபியற் சூத்திரத்தினை அடியொற்றியமைந்தது.
834,நூற்கு இலக்கணம் உணர்த்து தல் நுதலிற்று.
835,உரைப்பின் என்பதனை முன்னே கூட்டி நூலுரைப்பின் எனப்பொருளுரைக்க.
836,அவையாமாறு முன்னர்க் காட்டுதும்.
837,"பேராசிரியம் இஃது, எல்லா நூற்கும் ஆவதோர் இலக்கண முணர்த்துதல் நுதலிற்று."
838,ஒத்த சூத்திர மென்றதனான் நூலின் வேறாகிய இரு வகைப் பாயிரமுஞ் சூத்திரத்தோடு ஒத்த இலக்கணத்த வென்பது கொள்க.
839,உரைப்பி னென்றதனான்.
840,உரைப்பினென்னும் வினையெச்சங் கிளத்தலென்பத னோடு முடியும்.
841,வகையென்றதனான் உரையெனப்பட்டது தானும் அக்காண்டிகையின் மெய்ப்படக்கிளந்ததே யாகலின் அவ்விரண்டுஞ் செய்யுளியலுட் கூறிவந்த உரைவிகற்பமே யென்பதுணர்த்தியவாறு.
842,"அஃதேற் காண்டிகையென்றாற் போல இதற்குப் பெயர் வேறு கூறானோவெனின், வேண்டியார் வேண்டியவாறு."
843,மற்று இல்லதற்கும் இலக்கணஞ் சொற்லுவார்போல ஈரைங்குற்றமுமின்றி யென்றதென்னையெனின் அவற்றை எதிர் மறுத்துக்கொள்ளும் பத்துவகைக் குணமுங் கோடற்குத் தந்து கூறினானென்பது.
844,"அவை, எதிர்மறுத் துணரின் றிறத்தவு மவையே தொல்மர என்புழிச் சொல்லுதும்."
845,அவையும் அவற்று விரிச்சூத்திரத்துட் கூறுதும்.
846,ஈரைங்குற்றமு மென்ற உம்மையை எச்சப்படுத்துப் பிறவுங் குற்றம் உளவென்பதுங் கொள்க.
847,அவை முதனூலோடு மாறுகோடலும் யாப்பினுட் சிதைதலும் போல்வன.
848,அவை முன்னர்ச் சொல்லும்.
849,அவையும் முன்னர்ச் சொல்லும்.
850,வகையதாகி யென்பது புணரினென்பதனோடு முடிந்தது.
851,இதனது பயம் இவற்றது விரிசூத்திரங்களான் உய்த்துணர் வான் எடுத்தோதித் தொகுத்துக் காட்டலாயிற்று.
852,இவையெல்லாஞ் சூத்திரத்தோடு ஒத்த இலக்கணமேயாதலின் ஒத்தவென்னும் மாட்டேற்றானடங்கின.
853,அவற்றிற்குச் சூத்திரவுரையோடு மயங்காமல் வேறுரையும் ஆண் டெழுதப்பட்டன.
854,என்பது பாயிரம்.
855,என்னுதலிற்றோ வெனின்வெனப் பாயிர வுரைக்கு முகவுரை வந்தவாறு கண்டு கொள்க.
856,பிறவும் அன்ன.
857,"ஆய்வுரை இது, நூலின் இலக்கணம் உணர்த்துகின்றது."
858,"ஒத்த சூத்திரம் என்றதனால் பொதுவும் சிறப்புமாகிய இருவகைப் பாயிரங்களோடும் உரைப்பாயிரத்தோடும் தொடர்புடையன நூலிற் கூறப்படும் இலக்கணங்கள் எனவும், சூத்திரம்காண்டிகை."
859,"உரை என மூன்றும் அவற்றோடு குற்ற மின்மையும், உத்திவகையும் சேர்க்க நூலின் இலக்கணம் ஐந்தாம் எனவும் விளக்குவர் பேராசிரியர்."
860,இளம்பூரணம் இதுவுமது.
861,இள் சூத்திரத்தின் முன்னர் உரையை விரித்துரைக்கு மிடத்துஞ்.
862,"பேராசிரியம் இஃது, ஐயம் அறுத்தனுதலிற்று என்னை?"
863,இள் உரையெடுத்து அதன்முன் யாப்பினும்காண்டிகையினை விளக்குங் கருத்தினாலும் அக்கருத்தின்றியும் அச்சூத்திரத்திற்கு உரைதொடர்ந்தெழுதினும் சூத்திரத்தினை அதுவென்று சுட்டினான்.
864,முற்படக் கிளத்தல் செய்யுளு ளுரித்து தொல்சொல் கிள என்பதனா னெனவுணர்க.
865,உடன்பட என்பதனாற் காண்டிகையல்லாத முகவுரைக்கண்ணே முன்னும் பின்னுங் காண்டிகை பெய்து உரைத்தலுங் கொள்க.
866,"கொள்ளவே, முற்கூறிய ஐந்தும் ஒருங்கு வருதலும் இவ்வாறே பெற்றாம்."
867,விடுத்தலெனவே வினாவினை விடுத்தல் பெற்றாம்.
868,விலக்கலெனவே அஃதல்லாப் போலியை விலக்குதலென்பது பெற்றாம்.
869,புரைதப நாடிப் புணர்க்கவும் படுமே காண்டிகை யிரண்டும் உரையிரண்டுமென்று வருகின்ற நான்கன்கண்ணும் இடை அந்தரமின்றிப் புணர்க்கவும்படும் அவ்விருபகுதியும் எறு.
870,உம்மை இறந்தது தழீஇயிற்று என்னை?
871,காண்டிகையும் உரையும் ஒன்று ஒன்றனை ஒழித்தும் வருமென்றமையின் ஒழியாதுவருதல் உடன்பட வென்றதனால் தழுவப்பட்டது.
872,இவற்றிற்கு உதாரணமாமாறு தத்தம் விரிச்சூத்திரத்துட் சொல்லுதும்.
873,"பொழிப்பு, அகலம், நுட்பம், நூலெச்சம் என்னும் உரையில் பொருள் விளங்கும் நுண்மை வரம்பாக நோக்குடையது என்னை?"
874,அவர் இவ்வுரையில் இரண்டாவதாக எடுத்துக்காட்டிய நூற்பா தொல்காப்பியச் செய்யுளியல் ஆம் சூத்திரத்தின் பாடவேறுபாடுடைய வேறு வடிவமாக அமைந்துள்ளமை காணலாம்.
875,இம்மரபியற் சூத்திரத்திற்குறிக்கப்பட்ட காண்டிகை யென்னும் உரைக்குரிய பெயர் தமிழிலக்கண நூல்களில் மட்டுமே பயின்று வழங்குகின்றது.
876,"அவற்றுள் மூன்று வகையாவன தந்திரம், சூத்திரம், விருத்தி என இவை."
877,"மூவரின் நடைபெறலாவது, அம்மூன்றும் நடத்துவார் மூவர் ஆசிரியர் எனக் கொள்க."
878,நால்வகைப் பயனாவன அறம் பொருள் இன்பம் வீடு என்பன.
879,"எழுவகை ஆசிரியர் மதவிகற்பமாவன உடன்படல், மறுத்தல் என்பன முதலாகவுடையன எனக் கொள்க."
880,பத்துவகைக் குற்றமாவன குன்றக்கூறல் முதலாகவுடைய எனக் கொள்க.
881,"பத்துவகை மாண்பாவன, சுருங்க வைத்தல் முதலாகவுடையன எனக் கொள்க."
882,பதின்மூன்றுவகை உரையாவன சூத்திரம் தோற்றல் முதலாகவுடையன எனக் கொள்க.
883,"முப்பத்திரண்டு தந்திர வுத்தியாவன,நுதலிப்புகுதல்...........எஇபாடலனாஉரைஎன்பயாப்பருங்கலவிருத்யாசிரியர்தம்நூலைப்பற்யவிளக்கமாகு."
884,"என்னுதலிற்றோ எனின், நூற்கு அங்கமாகிய சூத்திரத் திலக்கணம் உணர்த்துதல் நுதலிற்று."
885,அளக்கலாகா அரும்பொருளாவது பலமுகத்தானும் பொருள் கொள்ளக்கிடத்தல்.
886,"செய்யுளியலுள், சூத்திரந் தானே ஆடிநிழலின் அறியத்தோன்றி நாடுத லின்றிப் பொருள்நனி விளங்கி யாப்பினுள் தோன்றயாத்தமைப் பதுவே."
887,என்பதூஉம் இதற்கிலக்கணம்.
888,"பேராசிரியம் இது, நிறுத்தமுறையானே சூத்திரமாமா றுணர்த்துதல் நுதலிற்று."
889,பல சூத்திரந் தொடர்ந்து நூலாகி ஈண்டே மரபு கூறப்படுதலின்.
