Line Number,Sentence
932,குப்பாயம் சட்டைக்கு மேல் போட்டுக் கொள்ளும் மூடுசட்டை குப்பாயம் கோட்டு ஆகும்.
933,இதனைத் தென்தமிழக வழக்கில் கேட்கலாம்.
934,குப்பி என்பது கொம்புப் பூண் கூந்தல் இறுக்கி.
935,இவற்றைப் போல் உடலை இறுக்கிப் பிடித்து மூடுவது குப்பாயம் ஆகும்.
936,முன்னாளில் நாடக உடையாகப் பயன்படுத்தினர் நம்மவர்.
937,குப்பாயம் என்பது மகளிர் அணியும் சட்டைப் பெயராக ஒட்டன் சத்திர வட்டார வழக்கில் உள்ளது.
938,குப்பை கூளம் குப்பை குவியலாகப் போடப்பட்ட உரமும் கழிவுப் பொருள்களும்.
939,கூளம் மாடு தின்று எஞ்சிய வைக்கோல் தட்டை முதலியவற்றின் துண்டு துணுக்குகள்.
940,குப்பை கூளம் சேரவிடாதே பூச்சி பொட்டை சேர்ந்து விடும் என உழவர் வீடுகளில் கூறுவது வழக்கம்.
941,குப்பைக்குப் போவதைக் குப்பை என்கின்றனர் என்க.
942,கூளம் என்பது செத்தை செதும்பு என்பவையாம்.
943,கீரையில் கிடக்கும் புல் முதலியவற்றை எடுத்தலைக் கூளம் பார்த்தல் என்பது நடைமுறை.
944,கூளம் என்பது மாட்டுத் தீனியாம் தட்டை தாளைக் குறித்தலும் உண்டு.
945,"கூலம், தவசத்தையும் கூழ் உணவையும் குறித்தல் இவண் அறிக."
946,குப்பை கொட்டல் குப்பை கொட்டல் சங்கடத்தோடு அல்லது சலிப்போடு வாழ்தல்.
947,உன்னோடு இவ்வளவு காலமாகக் குப்பை கொட்டி என்ன கண்டேன் என்று சலித்துப் பேசுவது கேட்கப்படும் செய்தி.
948,குப்பை கொட்டல் என்பது உரம்போடல்.
949,பயிர் ஊட்டமாக வளர்தற்கு வேண்டியது குப்பை.
950,அக்குப்பை கொட்டாக்கால் பயிர் வளமாக வளராது வாய்த்த பயன் தராது.
951,"அப்படியே, நான் இக்குடும்பத்துக்கு உரமாகவும் ஊட்டமாகவும் இருந்து பாடுபட்டேன்."
952,அதற்குப் பயன் என்ன?
953,உன் வசையும் திட்டும் அடியும் தடியும் அல்லாமல் கண்டதென்ன?
954,என்னும் உவர்ப்பின் வழி வந்த வழக்குச் சொல் குப்பை கொட்டலாம்.
955,குமரி இருட்டு கும்மிருட்டு என்பது நள்ளிருட்டு ஆகும்.
956,அது விடியுங்கால் சற்றே இருட் செறிவு நீங்கும் நிலையைக் குமரி இருட்டு என்பது சீர்காழி வட்டார மீனவர் வழக்காகும்.
957,"கடலுள் சென்றவர் மீண்டுவிட்டதும், கடலில் செல்வார் புகாததும் ஆகிய கருக்கல் அல்லது வைகறைப் பொழுதின் இருட்டே குமரி இருட்டு."
958,"கன்னிமதில், மதில் குமரி என்பவை பகைவரால் தீண்டப்படாத மதில் என்பதைக் கருதுக."
959,கும்பல் கும்பு அல் கும்பல்.
960,அல் சொல்லீறு.
961,"கூடிச் சேர்ந்த பெருங்கூட்டத்தைக் கும்பல் என்றும், கூட்டம் கூட்டமாய்ப் போதலைக் கும்பல் கும்பலாய் என்பதும் மக்கள் வழக்கு."
962,அந்தக் கும்பலுக்குள் எப்படிப் போக முடியும் தேடிப் பார்க்க முடியும் ம.வ.
963,சந்தனக்கும்பா என்பதும் உண்டு.
964,கும்பு கும்பா.
965,"கும்புக்கு மாறு, கும்பா."
966,கும்பாட்டம் கும்ப ஆட்டம் கும்பம் குடம்.
967,குடம் கொண்டு ஆடிய ஆட்டம் குடமாடல் சிலப்பதிகாரத்தில் வரும் பதினோராடல்களில் ஒன்று.
968,"அது, இந்நாளில் கரகாட்டம் எனப்படுகிறது."
969,அதனைக் கும்பாட்டம் என்பது நாகர்கோயில் வட்டார வழக்கு ஆகும்.
970,கும்பி கும்பி வயிறு.
971,கும் கும்பு கும்பி.
972,கொலைகாரப் பாவியை நினைத்தால் கும்பி கொதிக்கிறது என்பர்.
973,"கும்பிடு சுவர் கூரை, ஓடு வேயப்பட்ட கட்டடங்களின் குறுஞ் சுவர்கள் இரண்டும் முகடுவரை முக்கோண வடிவில் எழுப்பப்படுவது."
974,ஆதலால் அச்சுவர் அமைதியும் கும்பிடுவார் கை அமைதியும் ஒப்பு நோக்கிக் கும்பிடு சுவர் என்பது கொற்றர் வழக்காகும்.
975,கும்பிடுதல் கூம்பு கும்பு இடுதல் கும்பிடுதல்.
976,இரு கைகளையும் இணைத்துக் கூம்பு வடிவில் தோற்றம் தரப் பணிதல் கும்பிடுதல் எனப்படும்.
977,ஊளைச் சதை என்பது உள்ளாற்றல் இல்லாத் தசை.
978,ஊளைக் கும்பிடு என்பது உள்மை உண்மை இல்லாத கும்பிடு.
979,கும்பிட்ட கையால் அம்பிட்ட பயல் மக்கள் பழிப்பு.
980,தொழுத கையுள்ளும் படை ஒடுங்கும் வள்ளுவம் .
981,கும்புதல் கும்புதல் அடிப்பிடித்தல்.
982,சோறு கறி வேகுங்கால் நீர் இன்மையாலும் கிண்டி விடாமையாலும் அடிப்பிடித்து விடுவது உண்டு.
983,அடிப் பிடித்தலைக் கும்புதல் என்பர்.
984,அதனால் ஏற்படும் நெடியைக் கும்பி மணக்கிறது எனக் கூறுவர்.
985,கும்பிப் போய்விட்டது கும்பிக்கு ஆகாது என்பர்.
986,பின்வரும் கும்பியாவது வயிறு.
987,உடலுக்கு ஒவ்வாதது என்பதாம்.
988,"குப்பல், குப்புதல், குப்பை, குப்பென்று முளைத்தல், குப்பென்று வியர்த்தல் என்பன வெல்லாம் செறிவுப் பொருளன."
989,ஓரிடத்துத் திரண்டு பற்றிக் கொண்டது கும்புதலாம்.
990,திரட்டி உருட்டிய மாப்பண்டம் கும்மாயம் எனப்படுதல் பண்டே உண்டு.
991,"கும்மி, கும்பல், குப்பை முதலியவும் திரட்டிக் கூட்டியது உணர்த்துவதே."
992,கும்மாயம் உருட்டித் திரட்டிய உளுந்தங்களியைக் கும்மாயம் என்பது செட்டிநாட்டு வழக்கு.
993,கும்முதல் திரட்டுதல்.
994,"துணியைச் சலவை செய்ய அடிப்பவர், அதனைப் பின்னர்க் கும்முவர் கும்முதல் திரட்டுதல் பொருளது ஆகும்."
995,கும்மாயத்துக்குப் பயிற்றுப் பருப்பு இருநாழி தெ.க.தொ . கும்மி கும்மி கும்மி தமிழக விளையாட்டு ஆகும்.
996,ஆடவரும் மகளிரும் தனித்தனியேயும் இணைந்தும் கும்மியடிப்பர்.
997,கும்முதல் கூடிச் சேர்தலாகும்.
998,"ஒயில் கும்மி, கும்மி கோலாட்டம் முதலாகக் கும்மியடிப்பர்."
999,இதனைக் கொம்மி என்றார் வள்ளலார்.
1000,கொம்மியடி பெண்கள் கொம்மியடி எனத் தொடங்கும் பாடலும் ஆடலும் உடையது.
1001,கும்முதல் பொருள் கொம்முதல் என்பதற்குமுண்டு.
1002,கொம்மை என்பது மகளிர்தம் திரண்ட மார்பு.
1003,கொம்மை என்பது உழவர் களத்தில் தூற்றப்பட்ட மணியற்ற பதரின் குவியல்.
1004,"கொம்மை, கொழுமை, திரட்சி, கூடிச் சேர்தல் என்னும் பொருளன."
1005,கும்மி வெண்டளையான் அமைந்த ஓரெதுகை யுடைய எழுசீர்க் கழிநெடிலடிகள் இரண்டு வரப் பாடப்பெறும் பாடல்களைக் கொண்டது கும்மி என்பதாகும்.
1006,பல பேர் கூடி நின்று ஆடிப் பாடுதலால் கும்மி என்று பெயர் பெற்றது.
1007,"கும்பல், கும்மிருட்டு, குப்பல், குப்பை முதலியவாகத் தொகுதி குறிக்கும் சொற்கள் பல உளவாதல் அறிக."
1008,ஒவ்வோர் அடியின் நான்காஞ் சீரையும் தனிச் சொல்லாக அமைத்துப் பாடுவதும் கும்மியில் உண்டு.
1009,"கொங்கண நாயனார் அருளிய வாலைக்கும்மி, மதுரை வாலை சாமி அருளிய ஞானக்கும்மி முதலியவற்றைக் காண்க."
1010,கும்மியைக் கொம்மி என்பார் வள்ளலார்.
1011,நடேசர் கொம்மி காண்க.
1012,கும்மிகள் சந்தம் பலப்பல கொண்டு இயலும் என்பது சாக்கோட்டை உமையாண்டவள் சந்தக் கும்மியால் விளங்கும்.
1013,செந்தமிழ் நாடெனும் போதினிலே எனவரும் பாரதியார் பாடல் கும்மிப் பாட்டேயாம்.
1014,கும்மி கோலாட்டம் கும்மி பலர் குழுமி கைகொட்டி ஆடும் ஆட்டம்.
1015,கோலாட்டம் பலர் குழுமி கோல்கொட்டி ஆடும் ஆட்டம்.
1016,பெரும்பாலும் கும்மியும் கோலும் மகளிர் ஆட்டங்களாம்.
1017,கும்முதல் கூடுதல்.
1018,கொம்முதல் கொம்மி எனவும் படும்.
1019,கொம்முதலும் கூடுதலேயாம்.
1020,கோலாட்டத்திற்கெனத் தனிக் கோல்களும் கோல்களில் சலங்கை இணைப்பும் உண்டு.
1021,ஒன்பான் இரவு விழாக்களிலும் ஊர் விழாக்களிலும் கும்மி கோலாட்டம் நிகழ்த்தப்படுவது உண்டு.
1022,கும்மிருட்டு கும்மு இருட்டு கும்மிருட்டு.
1023,கும்முதல் செறிதல் குழுமிச் செறிந்த இருள்.
1024,"இயல்பாக இருள், ஒளி குன்றி மறைந்தது."
1025,கும்மிருட்டு என்பதோ இருட்டோடு விண்மீன் மதி முதலியனவும் வெளிப்படாமல் கருமுகிலால் மறைக்கப் பட்டுவிட்ட இருளாம்.
1026,கும்மிருட்டுப் போதில் வெளியே எவரும் உலவார்.
1027,குடும்ப விளக்குப் பாடிய பாரதிதாசனார் இருண்ட வீடு பாடியது எண்ணத்தக்கது.
1028,இருள் கப்பிக் கொண்டது என்பதும் கும்மிருட்டாம்.
1029,கும்முதல் துணி துவைக்கும் போது பந்து போல் திரட்டி உருட்டி அமுக்கித் தேய்த்தலைக் கும்முதல் என்பர்.
1030,"கும்பல், கும்மி, குப்பல், குப்பை என்பனவெல்லாம் திரளல் கூடுதல் பொருளவேயாம்."
1031,கும்முதல் நெல்லைச் சொல்வழக்கு.
1032,கும்மித் தப்பினால் அழுக்குப் போகும் என்பர்.
1033,குயவரி குயம் வரி குயவரி.
1034,குயம் வளைவு அரிவாள்.
1035,வளைந்த வரிகளையுடைய புலி குயவரியாகும்.
1036,குயவர் மண்கலம் வனைபவர் வனைதல் வளைதல்.
1037,குயம் வளைவு.
1038,மண்கலங்களை எல்லாம் சுழல் ஆழியின்மேல் சக்கரத்தின் மேல் இட்டு வனைதலால் குயவர் எனப்பட்டனர்.
1039,"அக்கலங்கள், குயக்கலம் எனப்பட்டன."
1040,குரக்கன் குரங்கின் கை போன்ற கதிர் உடையது கேழ்வரகு.
1041,அக் கதிரையும் அத்தவசத்தையும் குரக்கன் என்பது யாழ்ப்பாண வழக்காகும்.
1042,குரக்குவலி குரக்கு வளைவு.
1043,குரக்கு குரக்கை.
1044,நரம்பு வெட்டி இழுப்பதைக் குரக்குவலி என்பர்.
1045,குரக்கை வலி என்பதும் அது.
1046,குரங்கன் என்பது பிறை நிலா.
1047,வளைவுப் பொருளில் வருவதே.
1048,நரம்பு வளைந்து சுண்டி இழுப்பதால் குரக்கைவலி எனப்பட்டதாம்.
1049,விரல் குரக்கை பிடித்துக் கொண்டது என்றால் சுடக்குப் போட்டு நீவுவதை மக்கள் வழக்கில் காணலாம்.
1050,கெண்டை வலி என்பதும் கெண்டை புரட்டல் என்பதும் நரம்பு சுண்டி இழுப்பதாம்.
1051,இருபக்கமும் பற்றிப் பிடித்த கைபோல் தோன்றிய தோற்றத்தின் வழியாக ஏற்பட்ட வட்டார வழக்குச் சொல் இது.
1052,எனினும் அகரமுதலிகளிலும் இவ்வாட்சி பொது வழக்காகி யுள்ளது.
1053,குரம்பை குரம்பை குடிசை.
1054,"அது புல்லால் வேயப்பட்டமை, புல்வேய் குரம்பை புறம்."
1055,"என்பதாலும், அது குறுகிய உயரத்ததாயும் சிறியதாயும் இருந்தமை, குறியிறைக் குரம்பை புறம்."
1056,என்பதாலும் புலப்படும்.
1057,"அதில் பட்ட நீர் ஒழுகுதலைக் கூறுவார் போல, வால்வெள் ளருவி கொன்இலைக் குரம்பையின் இழிதரும் குறுந்."
1058,என்னும் நயம் சுட்டத் தக்கதாம்.
1059,குரம் என்பது கோரைப் புல் புல்லால் வேயப்பட்டதால் குரம்பை எனப்பட்டது.
1060,பின்னை மற்றையவை கொண்டு வேயப்பட்ட குடிசைப் பொதுப் பெயராயது.
1061,குரவை குலவு குலவை குரவை.
1062,மகளிர் எழுவர் அல்லது மிகப்பலர் கூடி வளைய வந்து குரலெழுப்பி ஆடிப்பாடல் குரவை எனப்படும்.
1063,பொதுவகையில் நானிலங்களுக்கும் உரியது எனினும் முல்லைக்குத் தனி உரிமையதாம்.
1064,எடு ஆய்ச்சியர் குரவை எனப்படும்.
1065,குன்றக் குரவை சிலப்.
1066,குரால் ஈனாததும் ஈனும் பருவம் வந்ததும் ஆகிய ஆட்டைக் குரால் என்பது ஆயர் வழக்கம்.
1067,வெடிப்பாகவும் எடுப்பாகவும் துள்ளித் திரிதல் குறித்த பெயர் இது.
1068,குர் குரு குருத்து குருவி இவற்றை எண்ணினால் இதன் அடிப்பொருள் விளக்கமாம்.
1069,இது தென்தமிழகப் பொதுவழக்கு.
1070,கபிலம் குரால் நிறம்புகர் புற்கு மாமே சேந்.
1071,குரால் என்பதும் புகர் கபிலம் என்பவும் வெண்ணிறமற்ற அழுங்கல் வெண்ணிறமாம்.
1072,புகர் மக்களால் போர் என்றும் புல்லை என்றும் வழங்கும்.
1073,"புற்கெனும் நிறம், புல்லை என்பதாம்."
1074,"புல்லை, மயிலை, வெள்ளை, செவலை, காரி என்பவை ம.வ."
1075,குரு பெரிய அம்மையைக் குரு என்பது விளவங்கோடு வட்டார வழக்காகும்.
1076,வெப்பும் குருவும் தொடர என்பது சிலப்பதிகாரத் தொடர் உரைபெறு கட்டுரை.
1077,நீர் கோத்த பெரிய அம்மைக் கட்டி வெண்ணிறமாகத் தோற்றம் தருதலால் இப்பெயர் பெற்றது.
1078,குருவும் கெழுவும் நிறனா கும்மே என்பது தொல்காப்பியம் .
1079,குருக்கள் உள்ளொளி பெருக்க வல்ல ஆசிரியர் குரு எனப்பட்டார்.
1080,இறைநிலைகளுள் ஒன்று குருவர் நிலை.
1081,"இவற்றை எண்ணினால் தாய், தந்தை, குரு, இறை, என்பதன் வரிசை விளக்கமாம்."
1082,குருவின் தன்மையும் இறைமைச் சிறப்பும் உடையார் குருக்கள் எனப்பட்டார்.
1083,அவர்கள் என்பதில் வரும் பன்மை போல் அவர் ஒருவர் எனினும் பன்முகத் தெளிவு மாண்பர் என்பதன் சான்று அது.
1084,அப்பொருளறியவும் மாட்டார் குருக்களாகத் தோற்றம் தருவது தம்நல இறக்கச் சான்று!
1085,இரங்கத்தக்க நிலையும் அது.
1086,"குருச்சி குரு, குருவன், குருத்துவம் என்னும் வழியில் இலக்கிய ஆட்சி பெறும் சொல்லன்று குருச்சி."
1087,"இது, தக்கலை வட்டாரத்தில் விதை என்னும் பொருளில் வழங்குகின்றது."
1088,ஒளி என்னும் பொருள் தருவது குரு.
1089,அது தொல்காப்பிய வழியது .
1090,விதையை முளைக்க வைத்தால் முளை ஒளியொடு வெளிப்படுதல் கண்கூடு.
1091,இதனைக் கொண்டு குருச்சி எனப் பெயரீடு செய்துள்ள வட்டார வழக்கு.
1092,பொது மக்களும் புலமைப் பெருமக்களை ஒப்பவர் என்னும் எண்ணத்தை உண்டாக்கத் தவறாது.
