Line Number,Sentence
566,உடனே பீடு மிக்க மாட மதுரையில் பெருந் தீப்பற்றிக் கொண்டது.
567,பாண்டியன் அரண்மனை தீப்பற்றிக் கொண்டது.
568,அதனுள் முன்னரே இறந்து கிடந்த பாண்டியன் உடலமும் அவனது கோப்பெருந்தேவியின் உடலம் எரிந்து சாம்பலாயின.
569,அழகிய பல கட்டடங்கள் எரிந்து பாழ்பட்டன.
570,அவர் அனைவரும் பூம்புகார்ப் பத்தினியைத் தெய்வமாகப் போற்றினர்.
571,"மதுராபதி கண்ணகி, தீப்பற்றி எரிந்த மதுரையைப் பார்த்துக் கொண்டே சென்றாள்."
572,"அவள் உள்ளம் கனன்றது, அவள் கொல்லனது உலைக்களத்துத் துருத்திப் போல பெருமூச்சு விட்டாள் பெருந்தெருக்களிலே திரிந்தாள் சந்துகளில் நடந்தாள்."
573,"உடனே கண்ணகி வலப்பக்கமாகத் திரும்பிப் பார்த்து, என் பின் வருகின்ற நீ யார்?"
574,நீ என் துயரத்தை அறிவையோ?
575,என்று கேட்டாள்.
576,"பாண்டியன் சிறப்பு உடனே மதுராபதி, அம்மே!"
577,நான் உனது பொறுத்தற்கரிய துன்பத்தை அறிவேன்.
578,நான் சொல்ல வந்தேன்.
579,நான் உனது கணவற்கு நேர்ந்த கதியினை எண்ணி மிக வருந்துகிறேன்.
580,நான் இந் நகரத்தைக் காக்கும் அதிதேவதை.
581,என் பெயர் மதுராபதி என்பது.
582,நான் கூறுவதைக் கேள்.
583,இன்று இறந்த பாண்டியன் மரபு ஆராய்ச்சி மணி ஓசை கேட்டறியாதது.
584,"இப்பாண்டியன், குடிகளால் பெரிதும் விரும்பப்பட்டவன்."
585,பாண்டியர் ஒழுக்கம் தவறிய செயலைச் செய்தறியார்.
586,"முற்காலத்தில் கீரந்தை என்ற பார்ப்பனன் காசியாத்திரை சென்றான் சென்ற பொழுது தன் மனைவியை நோக்கி, நின் தனிமைக்கு வருந்தாதே."
587,பாண்டியன் காவல் நினக்குப் பாது காவல் ஆகும் என்று கூறினான்.
588,"அதனை, அப்பக்கமாக நகர் சோதனைக்கு வந்த பாண்டியன் கேட்டான்."
589,உடனே கீரந்தை யார் அது?
590,என்று அதட்டினான்.
591,"உடனே பாண்டியன், சரி வீட்டிற்கு உரியவன் வந்துவிட்டான் நமக்குக் கவலை இல்லை."
592,"ஆனால், நாம் அவசரப்பட்டுக் கதவை தட்டியதை அவன் தவறாகக் கருதித் தன் மனைவியின் ஒழுக்கத்தில் ஐயம் கொள்வானே!"
593,என்ன செய்வது?
594,"என்று யோசித்து, முடிவில், நான் இப்பொழுது இந்தத் தெருவிலுள்ள எல்லா வீட்டுக் கதவுகளையும் தட்டிவிட்டுப் போவதே நல்லது."
595,"அரசன், அறிஞரே, அப்பித்தன் அகப்பட்டால் அவனுக்கு என்ன தண்டனை விதிக்கலாம்?"
596,என்று கேட்டான்.
597,"உடனே மறைவர், கதவுகளைத் தட்டின அக் கையை வெட்டிவிட வேண்டும் என்றனர்."
598,"உடனே அரசர் மகிழ்ந்து, அந்தக் கை இதுதான் என்று கூறித் தன் கையை வெட்டிக் கொண்டான்."
599,அத்தகைய பாண்டியன் மரபில் வந்தவன் இந்த நெடுஞ்செழியன்.
600,அது மெய்யாயிற்று.
601,"உங்கட்கு இக்கேடு வந்ததற்குக் காரணம் கூறுவேன், கேட்பாயாக."
602,முன்வினை பல ஆண்டுகட்குமுன் கலிங்க நாட்டுச் சிங்கபுரத்தில் வசு என்பவனும் கபிலபுரத்தில் குமரன் என்பவனும் ஆண்டு வந்தனர்.
603,நகை வியாபாரி ஒருவன் தன் மனைவியுடன் சிங்கபுரத்திற்குச் சென்று வியாபாரம் செய்து வந்தான்.
604,என்று சபித்து இறந்தாள்.
605,"நீ பதினான்காம் நாள் நின் கணவனைக் கண்டு களிப்பாய், என்று கூறி மறைந்தது."
606,அப்பொழுது தேவர் உலகத்தில் இருந்து விமானம் ஒன்று வந்தது.
607,அதனில் கோவலன் இருந்தான்.
608,அவனுடன் கண்ணகி விண்ணகம் புகுந்தாள்.
609,"சேரன் செங்குட்டுவன் செங்குட்டுவன் கண்ணகி வானுலகம் செல்வதற்கு நின்றிருந்த மலை, சேர நாட்டைச் சேர்ந்தது."
610,அக்காலத்தில் சேர நாட்டைச் சேரன்செங்குட்டுவன் என்பவன் அரசாண்டு வந்தான்.
611,வட நாட்டுப் போர் செங்குட்டுவன் ஏறத்தாழ இருபது வயதிற் பட்டம் பெற்றான் ஐம்பது வருடகாலம் அரசாண்டான்.
612,சோழருடன் போர் செங்குட்டுவன் மாமனான மணக்கிள்ளி இறந்தவுடன் அவன் மகனான நெடுமுடிக்கிள்ளி பட்டம் பெற முயன்றான்.
613,அம்முயற்சியை அவன் தாயத்தார் எதிர்த்துச் சோழ நாட்டில் கலகம் விளைவித்தனர்.
614,சோழபாண்டியருடன் போர் ஒரு முறை சோழ மரபினர் சிலர் பாண்டிய அரசனுடன் சேர்ந்து சேரனை எதிர்த்தனர்.
615,போர் கொங்கர் செங்களம் என்ற இடத்தில் நடந்தது.
616,"சேரன், யானைக் கூட்டத்தில் புலி பாய்வதைப் போலப் பாய்ந்து பகைவரைப் புறங்காட்டி ஓடச் செய்தான்."
617,அது முதல் அவன் ஆயுட்காலம் வரை சோழ பாண்டியர் அடங்கிக் கிடந்தனர்.
618,சேரன் தமிழ்நாட்டுத் தலைவனாக விளங்கினான்.
619,"பேரரசன் சேரன் கங்கர், கொங்கர், கொங்கணர் முதலிய பல நாட்டரசரை வென்று தென் இந்தியாவிற் பெருவீரனாக விளக்கமுற்று இருந்தான்."
620,அவனது பெயர் இமய முதல் குமரி வரை பரவி இருந்தது.
621,மலைவளம் காணல் கண்ணகி வானுலகம் சென்று சில மாதங்கள் ஆயின.
622,ஓருநாள் செங்குட்டுவன் தன் கோப்பெருந்தேவியுடனும் இளங்கோ அடிகளுடனும் பரிவாரங்களுடனும் பேரியாற்றங் கரை வழியே மலைவளம் காணச் சென்றான்.
623,யாவரும் மலை நாட்டு வளத்தைக் கண்டு கொண்டே ஆற்றோரம் சென்றனர் பிறகு ஓரிடத்தில் தங்கினர்.
624,சாத்தனார் சாத்தனார் என்பவர் மதுரையில் இருந்த தமிழ்ப் புலவர்.
625,"அவர் நெல், வரகு, சோளம் முதலிய கூல தானிய வகைகளைக் கொண்ட கடை ஒன்றை வைத்திருந்தார்."
626,அவர் நம் செங்குட்டுவனுக்கும் இளங்கோ அடிகட்கும் உயிர் நண்பர் ஆவர்.
627,அவர் அடிக்கடி சேரநாட்டுக்கு வந்து போவது வழக்கம்.
628,அப்புலவர் சேரனைக் காண வஞ்சி மாநகரம் சென்றார் அரசன் மலைவளம் காணப் போயிருப்பதை அறிந்தார்.
629,அரண்மனை ஆட்கள் வழி காட்ட வந்து சேரர் பெருமானையும் அடிகளையும் கண்டு அடி பணிந்தார்.
630,"மன்னன் மகிழ்ந்து, மலைவாணரே உங்கள் மலை நாட்டில் ஏதேனும் விசேஷம் உண்டோ?"
631,என்று கேட்டான்.
632,அவள் கணவனைப் பறி கொடுத்தவள் பொறுக்க முடியாத துன்பத்தை அநுபவித்தவள்.
633,அவள் கண்ணெதிரே ஒருவிமானம் வந்து நின்றது.
634,அவள் அதனில் இருந்தவனைப் பார்த்து மகிழ்ந்தாள்.
635,அவன் அவள் கணவன் போலும்!
636,அவள் அவ் விமானத்தில் ஏறிக் கொண்டாள்.
637,விமானம் மறைந்தது.
638,அவள் எந்த நாட்டவளோ?
639,யார் மகளோ என்றனர்.
640,சாத்தனார் விளக்கம் அரசனுக்கு ஒன்றும் விளங்கவில்லை.
641,அரச மாதேவி ஆச்சரியப்பட்டாள்.
642,இளங்கோவடிகள் சாத்தனார் முகத்தைப் பார்த்தார்.
643,"சாத்தனார் புன்முறுவலுடன், அவள் வரலாற்றை யான் அறிவேன், என்று கூறினர்."
644,"உடனே அனைவரும், கூறியருளுக என்றனர்."
645,சாத்தனார் வீரபத்தினியின் வரலாற்றை விளங்கவுரைத்தார்.
646,அவன் கோப்பெருந்தேவி அறக்கற்பு உடையவன்.
647,அரசன் ஒரு நாட்டைக் காப்பது துன்பமுடைய செயலே ஆகும் என்றான்.
648,"பின்னர் அவன் தன் பட்டதரசியைப் பார்த்து, நன்னுதால் கணவனுடன் இறந்த கோப்பெருந்தேவி போற்றத்தக்கவளா?"
649,தன் கணவன் குற்றவாளி அல்லன் என்பதை உணர்த்திப் பழிக்குப்பழி வாங்கிய கண்ணகி போற்றத்தக்கவளா?
650,என்று கேட்டான்.
651,"அரசி பதில் பட்டத்தரசி, ஐயனே, இருவரும் போற்றத்தக்கவரே."
652,ஒருத்தி அறக்கற்பு உடையவள் மற்றவள் மறக்கற்பு உடையவள்.
653,"நாம், நமது நாடு அடைந்து துறக்கம் புகுந்து பத்தினிக் கடவுளைப் பரவுதல் வேண்டும்."
654,"அவள் தெய்வமாகத் தொழத்தக்க தகுதியுடையவள், என்று பதில் அளித்தாள்."
655,சேரன் செய்த முடிவு உடனே சேரர் பெருமான் அமைச்சரைப் பார்த்தான்.
656,தேவரீர் விருப்பப்படி இரண்டில் ஒன்றைச் செய்யலாம் என்றனன்.
657,"அரசன், அமைச்சரே, நமது தாயார் பொருட்டு நாம் இமயம் சென்றபோது ஆரிய மன்னரை வென்றோம் அல்லவா?"
658,அவர் மரபினர் அச்சேரன் இப்பொழுது இங்கு வரட்டும் பார்ப்போம் என்று வீரம் பேசுகின்றனராம்.
659,ஆதலால் நாம் இமயம் சென்று கல்லைக் கொணர்வதே தக்கது.
660,நமது வடநாட்டு யாத்திரையை மாநகரத்தார்க்கு அறிவித்திடுக.
661,இச்செய்தி பல நாட்டு ஒற்றர் மூலம் பல நாடுகட்கும் பரவி விடும்.
662,நம் நண்பரான நூற்றுவர் கன்னர்க்கும் அறிவித்திடுக.
663,நாம் அவர்கள் உதவி கொண்டே கங்கையாற்றைக் கடக்கவேண்டும் என்றான்.
664,பின்னர் யாவரும் வஞ்சி மாநகரத்திற்குத் திரும்பினர்.
665,அவன் சிறந்த சிவபக்தன் சிவபிரான் அருளால் பிறந்தவன் ஆதலின் சிவபெருமானைப் பூசித்துப் புறப்பட்டான்.
666,"வஞ்சி மாநகரத்து மக்கள், எங்கள் பெருமான் வெற்றி பெற்று மீள்வானாக என்று வாழ்த்தி வழியனுப்பினர்."
667,அப்பொழுது திருமால் பிரசாதம் சேர வேந்தனுக்குக் கொடுக்கப்பட்டது.
668,செங்குட்டுவன் தன் படைகள் புடைசூழ இமயம் நோக்கிச் செல்லலானான்.
669,குதிரைப் படைகளின் செலவினால் கிளம்பிய புழுதி மேல் எழுப்பி மேகங்கள் எனப் படர்ந்தன.
670,வீரர் ஏந்திய ஈட்டிகளின் பளபளப்புத் தூரத்தில் இருந்து காண்போர்க்கு மின்னலைப் போலக் காட்சி அளித்தது.
671,நீலகிரியில் தங்கல் சேரர் பெருந்தகை இங்ஙனம் சென்று நீலகிரியில் இளைப்பாறத் தங்கினான் அங்குச் சில நாட்கள் இருந்தான்.
672,சேரப்பெருமான் அவர்களுக்குத் தக்கவாறு பரிசில் நல்கி விடை கொடுத்தான்.
673,"சஞ்சயன் நூற்றுவர் கன்னர் அனுப்பிய சஞ்சயன் என்ற தூதுவர் தலைவன், பல வரிசைகளுடன் வந்து சேர வேந்தனைக் கண்டான்."
674,சஞ்சயன் அவ்வாறே செய்வதாக வாக்களித்து அகன்றான்.
675,அங்குச் சஞ்சயன் பல கப்பல்களுடன் காத்திருந்தான்.
676,உடனே இருதிறத்துப் படைகளும் கைகலந்தன.
677,புலிக்கூட்டத்து நடுவில் சிங்க ஏறு பாய்வதைப் போலச் சேரர் பெருந்தகை உருவிய வாளுடன் பாய்ந்து அரசர் பலரைக் கொன்றான்.
678,"வஞ்சி வீரர் வாட்போரில் வல்லவர் அதனால், அவர்கள் வாளுக்குப் பகைவர் பலர் இரையாயினர்."
679,போர் பதினெட்டு நாழிகை நடைபெற்றது.
680,முடிவில் கனக விசயர் சிறைப்பட்டனர்.
681,சேரன்செங்கட்டுவன் வெற்றி பெற்றான்.
682,அவன் பூம்புகார் நகரத்தினன்.
683,வஞ்சி மீளுதல் சேரன் செங்குட்டுவன் முப்பத்திரண்டு மாதங்கள் கழித்து வஞ்சி மீண்டான்.
684,அப்பேரரசன் சேரர் அரண்மனைக்குள் நுழையும் பொழுது யாவரும் வாழ்த்தி மலர்மழை பொழிந்தனர்.
685,உள் நுழைந்த சேரர் பெருமானை அரச மாதேவி அன்று அலர்ந்த மலர்களால் பாதபூசை செய்து வரவேற்றாள்.
686,கண்ணகிக்குக் கோவில் கண்ணகித் தெய்வம் வந்து நின்ற மலையருகில் கோவில் கட்டப்பட்டது.
687,இமயத்திலிருத்து கொண்டு வரப்பட்ட சிலையில் பத்தினியின் திருவுருவம் செதுக்கப்பட்டது.
688,உருவத்தின் அடியில் பெயரும் பீடும் எழுதப்பட்டன.
689,பத்தினி வாழ்த்தல் அப்பொழுது விண்ணில் ஓர் உருவம் தோன்றியது.
690,அது கைகளில் வளையல்களும் கழுத்தில் மாலைகளும் காதுகளில் தோடுகளும் அணிந்திருந்தது.
691,"அவ்வுருவம், தோழிகளே, யான் இம்மலையில் விளையாடல் புரிவேன்."
692,என் கணவரைக் கொல்வித்த பாண்டியன் குற்றமுடையவன் அல்லன்.
693,அவன் தேவேந்திரன் அரண்மனையில் விருந்தினனாக இருக்கிறான்.
694,நான் அவன் மகள்.
695,எனக்குச் சிறப்புச் செய்த செங்குட்டுவன் வாழ்க!
696,என்று வாழ்த்தி மறைந்தது.
697,பிறகு வஞ்சி மகளிரும் தேவந்தி முதலியவரும் கண்ணகித் தெய்வத்தைப் பலவாறு வாழ்த்தினர்.
698,பிரதிட்டை விழாச் சிறப்பாக நடைபெற்றது.
699,அப்பொழுது தந்தேன் வரம் என்று ஒரு குரல் விண்ணிடை எழுந்தது.
700,அக்கோவில் அன்று முதல் பத்தினிக் கோவில் எனப் பெயர் பெற்றது.
701,மாளுவ மன்னர் தம் நாட்டில் கட்டிய கோவிலுக்கு இப்பெயரே இட்டனர்.
702,அப்பெயர் நாளடைவில் மருவி இன்று பைதனி கோவில் என்று வழங்குகிறது.
703,கயவாகு மன்னன் பத்தினிக்கு எடுப்பித்த சிலை இன்று லண்டனில் உள்ள பிரிட்டிஷ் பொருட்காட்சிச் சாலையில் இருக்கின்றது.
704,சிலப்பதிகாரம் இளங்கோ அடிகளும் சாத்தனாரும் பத்தினி விழாப் பாங்குற முடிந்தது.
705,கனக விசயர் செறுக்கு அடங்கிச் சேரனைப் பணிந்து விடைப் பெற்று தம் நாடு சென்றனர்.
706,தமிழ்நாடு எங்கணும் பத்தினியின் பெயர் பரவியது.
707,தமிழ் மக்கள் பத்தினியைக் கண்கண்ட தெய்வமாகக் கொண்டாடினர்.
708,"தேவந்தி என்ற பார்ப்பனத் தோழி, பத்தினிக் கோவிலில் தங்கிப் பூஜையை நாள்தோறும் தவறாது செய்து வந்தாள்."
709,அவளது பெயரும் புகழும் தமிழ் நாட்டில் நன்கு பரவின.
710,இரு பெருங் காவியங்கள் இவ்விரண்டு வரலாறுகளும் நடைபெற்று ஆண்டுகள் சில கழிந்தன.
711,சாத்தனாரும் அதற்கு இசைந்தனர்.
712,சிலப்பதிகார அரங்கேற்றம் பல மாதங்கள் கழிந்தன.
713,பின்னர் ஒரு நாள் நாள் வஞ்சிமாநகரத்தில் வஞ்சி வேந்தனது தெய்வமாக வணங்கப்பட்டவள்.
714,"இந்நூலில், இயற்றமிழ் இசைத்தமிழ் நாடகத்தமிழ் என்னும் மூவகைத் தமிழையும் கண்டு மகிழலாம்."
715,பண்டைக்கால நடன வகைகள் இந்நூலைக் கொண்டுதான் அறிய முடிகின்றன.
716,"சுருங்கக் கூறின், இந்நூலைக் கொண்டு கி.பி."
