Line Number,Sentence
1,விருத்தாசலம் பதிப்பாளர் கோ.
2,விருத்தாசலம் பதிப்பாளர் கோ.
3,இளவழகன் முதற்பதிப்பு தாள் . கி.
4,என்.எஸ்.மேப்லித்தோ அளவு தெம்மி எழுத்து புள்ளி பக்கம் நூல் கட்டமைப்பு இயல்பு சாதாரணம் விலை உருபா.
5,"படிகள் நூலாக்கம் பாவாணர் கணினி தி.நகர், சென்னை ."
6,அட்டை வடிவமைப்பு மு.
7,"இராமநாதன், வ."
8,"மலர் அச்சிட்டோர் வெங்கடேசுவரா ஆப்செட் பிரிண்டர்ஸ் ஆயிரம் விளக்கு, சென்னை ."
9,"வெளியீடு தமிழ்மண் பதிப்பகம் ,சிங்காரவேலர் தெரு, தியாகராயர்நகர், சென்னை ."
10,நாவலர் ந.மு.
11,அதுகாரணமாக நாட்டார் ஐயா அவர்கள் தாமே பயின்ற தமிழ்ப் பேராசான் என்று நாட்டு மக்களால் அன்புடன் அழைக்கப் பெற்றார்.
12,கல்லூரியில் இல் பணியில் சேர்ந்து வரை இருபத்து இரண்டு ஆண்டுகள் தமிழ்ப் பேராசிரியராகப் பணிபுரிந்தார்.
13,அக்கல்லூரி இல் மூடப்பெற்றது.
14,நாட்டார் ஐயா அவர்கள் தம்முடைய வாழ்நாளில் அறிஞர் பெருமக்களால் மிகுதியும் மதிக்கப்பெற்றார்.
15,மறைமலை அடிகளாரின் மகள் நீலாம்பிகை அம்மையாரின் கணவர் திருவரங்கனார் ஆவார்.
16,தொண்டை மண்டலத்தில் வாழ்ந்த குடிமக்களுள் சேக்கிழார் வழிவந்த தொண்டை மண்டல முதலியார்கள் இன்றைக்கும் பெருஞ்சிறப்புடன் வாழ்ந்து வருகின்றனர்.
17,இல் சென்னை மாகாணத் தமிழர் மாநாட்டில் நாட்டார் ஐயா அவர்களுக்கு நாவலர் என்னும் பட்டம் வழங்கப்பெற்றது.
18,அக்கோயில் நாட்டார் திருக்கோயில் என்று தமிழன்பர்களால் பெருமையுடன் அழைக்கப் பெறுகின்றது.
19,"இவ்வாறு நாட்டார் ஐயா அவர்கள் இல் நிறுவ விரும்பிய திருவருள் கல்லூரி, ஆண்டுகள் கழிந்ததற்குப் பிறகு நாவலர் ந.மு."
20,"அவை, பின்வருமாறு ."
21,திரிகடுகம் ந.மு.வே.உரை .
22,மணிமேகலை வரலாறு .
23,தொல்காப்பிய ஆராய்ச்சிச் சொற்பொழிவுகள் .
24,நாவலர் நாட்டார் நாட்குறிப்பு முதலியனவாம்.
25,"இவ்வாறு, நாட்டார் ஐயா அவர்கள் எழுதிய நூல்கள் வெளிவந்த ஆண்டுகளைப் பற்றிய விவரம் வருமாறு ."
26,வேளிர் வரலாற்று ஆராய்ச்சி .
27,நக்கீரர் .
28,கபிலர் .
29,கள்ளர் சரித்திரம் .
30,இன்னா நாற்பது .
31,களவழி நாற்பது .
32,கார் நாற்பது .
33,ஆத்திசூடி .
34,கொன்றை வேந்தன் .
35,வெற்றி வேற்கை .
36,மூதுரை .
37,நல்வழி .
38,நன்னெறி .
39,கண்ணகி வரலாறும் கற்பு மாண்பும் .
40,சோழர் சரித்திரம் .
41,பரஞ்சோதி முனிவர் திருவிளையாடல் புராண உரை .
42,அகத்தியர் தேவாரத் திரட்டு உரைத்திருத்தம் .
43,தண்டியலங்காரப் பழைய உரைத்திருத்தம் யாப்பருங்கலக்காரிகை உரைத்திருத்தம் .
44,கட்டுரைத் திரட்டு முதல் தொகுதி .
45,சிலப்பதிகார உரை .
46,மணிமேகலை உரை .
47,அகநானூறு உரை .
48,கட்டுரைத் திரட்டு இரண்டாம் தொகுதி .
49,நாவலர் ந.மு.வேங்கடசாமி நாட்டார் இலக்கணக் கட்டுரைகள் .
50,நாவலர் ந.மு.வேங்கடசாமி நாட்டார் இலக்கியக்கட்டுரைகள் .
51,நாவலர் ந.மு.வேங்கடசாமி நாட்டார் சொற்பொழிவுக் கட்டுரைகள் .
52,"அவர் மொழிஞாயிறு தேவநேயப் பாவாணர், திரு.வி.க., யாழ்ப்பாணத்துத் தமிழ் அறிஞர் ந.சி.கந்தையா பிள்ளை, வெ.சாமிநாத சர்மா, சாத்தான்குளம் அ."
53,"இராகவன், பன்மொழிப்புலவர் கா."
54,அப்பாத்துரையார் முதலிய தமிழறிஞர்களின் நூல்கள் மற்றும் தொல்காப்பிய பழைய உரைகள் அனைத்தையும் முழுமையாக வெளியிட்ட பெருமைக்குரியவர்.
55,அவர் இப்பொழுது நாட்டார் ஐயா அவர்களின் நூல்கள் அனைத்தையும் ஒரு சேர வெளியிடுவது மிகவும் துணிவான செயல் ஆகும்.
56,"அவர் வாழ்க, அவர் முயற்சி வெல்க என்று நான் வாயார மனமார வாழ்த்துகின்றேன்."
57,".. பேராசிரியர் பி.விருத்தாசலம் நிறுவனர் நாவலர் ந.மு.வேங்கடசாமி நாட்டார் திருவருள் கல்லூரி, கபிலர் நகர், வெண்ணாற்றங்கரை, தஞ்சாவூர் ."
58,நல்ல தமிழ் நூல்களைத் தமிழர்களுக்கு அளிக்கும் போதெல்லாம் எனக்குப் புத்துணர்ச்சியும் பெருமகிழ்வும் ஏற்படுகின்றன.
59,பதிப்புத் துறையில் துறைதோறும் மேலும் பல ஆக்கப் பணிகளைச் செய்ய உறுதி கொள்கிறேன்.
60,தமிழ்நூல் பதிப்பில் எம் பதிப்பகம் இதுகாறும் ஆற்றிய தமிழ்ப் பணியை எண்ணிப் பார்க்கிறேன்.
61,நெஞ்சில் ஒரு நிறைவு.
62,இனிச் செய்ய வேண்டிய பணியை எண்ணிப் பார்க்கிறேன்.
63,"எனவே, முன்னிலும் வேகமாக என் பதிப்புப் பணிகளைத் தொடர்கின்றேன்."
64,தொண்டு செய்வாய்!
65,"தமிழுக்கு..., செயல் செய்வாய் தமிழுக்கு......,ஊழியஞ் செய் தமிழுக்கு......., பணி செய்வாய்!"
66,நாட்டார் யார்?
67,"ஆம் நூற்றாண்டின் பிற்பகுதியிலும், ஆம் நூற்றாண்டின் முற்பகுதியிலும் தமிழ்த் தேரை இழுத்த பெருமக்களுள் நாவலர் ந.மு.வே."
68,நாட்டார் திருவருள் கல்லூரியின் நிறுவனர் பேராசிரியர் பி.விருத்தாசலம் ஆவார்.
69,அவர் கெடல்எங்கே தமிழின்நலம் அங்கெல்லாம் தலையிட்டுக் கிளர்ச்சி செய்க!
70,எனும் பாவேந்தர் வரிகளுக்கு நம்மிடையே இன்று சாட்சியாக வாழ்ந்து கொண்டிருப்பவர் வாழும் தமிழறிஞர்களில் நான் வணங்கும் சான்றோருள் ஒருவர்.
71,குமுகாய மாற்றத்துக்கு அடிப்படையானது தாய்மொழி வழிக் கல்வி ஒன்றுதான்.
72,இக்கல்விதான் மக்களுக்கு ஊற்றுக் கண்.
73,"தாய்மொழியைப் புறக்கணித்த எந்த இனமும் , எந்த நாடும், வளர்ந்ததாகவோ, வாழ்ந்ததாகவோ, செழித்ததாகவோ வரலாறு இல்லை."
74,பழந்தமிழ்க் கருவூலமான நாட்டாரின் இவ்வருந்தமிழ்ப் புதையல்கள் தமிழர்கள் இல்லந்தோறும் இருப்பதற்கு உங்களின் பங்களிப்பையும் செய்ய முன் வாருங்கள்.
75,"மொழி, இன நாட்டின் அடையாளங்களை மீட்டெடுக்கும் எம் தமிழ்ப் பணிக்குக் கைகொடுத்து உதவுங்கள்."
76,இந் நூல்கள் அனைத்தும் தமிழ் மக்கள் உள்ளங்களிலும் இல்லங்களிலும் வைத்துப் போற்றத் தக்க பாதுக்காக்கத்தக்க கருவூலங்கள் ஆகும்.
77,"கவுதமன், ச.சிவசங்கரன் , நாட்டாரின் மரபு வழி உறவினர் திருமிகுகுரு.செயத்துங்கன், பேரா."
78,கணேசமூர்த்தி ஆகியோர்க்கு எம் நெஞ்சம் நிறைந்த நன்றிகள்.
79,இவர்களுக்கு என் நெஞ்சம் நிறைந்த நன்றிகள்.
80,இப்பதிப்பில் பிழை காணின் சுட்டி எழுதுங்கள் சொல்லுங்கள்.
81,அடுத்த பதிப்பில் பிழை நீக்கி நிறைவு செய்வேன்.
82,"சென்னை இங்ஙனம், கோ.இளவழகன் வல்லுனர் குழு ."
83,முனைவர் கு.திருமாறன் .
84,முனைவர் இரா.கலியபெருமாள் .
85,பேராசிரியர் சண்முக.மாரி ஐயா .
86,பேராசிரியர் நா.பெரியசாமி .
87,முனைவர் பி.தமிழகன் .
88,நாட்டாரையா அவர்களின் உரைநடை நூல்களில் உள்ள ஆராய்ச்சிப் பகுதிகளில் எனக்குத் தெரிந்த சிலவற்றை ஈண்டுக் கூறுகிறேன்.
89,நக்கீரர் ஆம் ஆண்டில் நக்கீரர் என்னும் ஆராய்ச்சி உரைநடை நூல் வெளியிடப்பட்டது.
90,நக்கீரர் என்னும் நூலின் உரைநடையிலிருந்து சிறிது காண்போம்.
91,"இந்நூலில் தமிழ்ச்சங்க வரலாறு மிகுந்த ஆராய்ச்சியுடனும், மேற்கோள்களுடனும் விளக்கப்பட்டுள்ளது."
92,இவரைத் திருவள்ளுவருடன் பிறந்தவர் என்று சிலர் கூறுவர்.
93,அதனை மறுத்துப் பாண்டிநாட்டிலுள்ள மாணிக்கவாசகப் பெருமான் தோன்றிய திருவாதவூர் எனப்பல மேற்கோள்களுடன் விளக்கப்பட்டுள்ளது.
94,"இவர் சைவ சமயத்தைச் சேர்ந்தவர் எனவும், அந்தணர் மரபில் உதித்தவர் எனவும் அய்யா அவர்கள் ஆராய்ந் திருக்கிறார்கள்."
95,இவர் இயற்றிய நூல்கள் பலவாகும்.
96,"குறிஞ்சிப்பாட்டு, குறிஞ்சிக்கலி ஆகியவற்றிற்கு உச்சிமேற் புலவர்கொள் நச்சினார்க்கினியர் எழுதியுள்ள உரையையும், விளக்கத்தையும் அய்யா அவர்கள் எடுத்துரைப்பது மிகவும் சிறப்புடையதாகும்."
97,வாழ்க்கை வரலாற்றுக் குறிப்புகள் பிறந்த ஊர் தஞ்சைக்கு வடமேற்கில் சுமார் கி.
98,தொலைவில் உள்ள நடுக்காவேரி என்னும் ஊர் நாவலர் ந.
99,பிறந்த ஊராகும்.
100,பெற்றோர் தந்தையார் திரு.
101,முத்துச்சாமி அவர்கள் தாயார் திருவாட்டி தைலம்மையார் அவர்கள்.
102,பிறந்த நாள் தாரண ஆண்டு சித்திரைத் திங்கள் இரண்டாம் நாள் .
103,பெயர் வைப்பு நாவலர் ந.
104,அவர்களுக்குப் பெற்றோர் முதலில் வைத்த பெயர் சிவப்பிரகாசம் என்பதாகும்.
105,"இவருக்கு முன் பிறந்த தட்சணாமூர்த்தி, இராமச்சந்திரன் ஆகிய இருவரும் இளமையிலேயே இயற்கை எய்தினர்."
106,கல்வி நடுக்காவேரியில் இருந்த தொடக்கப் பள்ளியில் நான்காம் வகுப்பு வரை ந.
107,அப்போதெல்லாம் நான்காம் வகுப்புத் தேர்வு அரசினர் தேர்வாக இருந்தது.
108,தேர்வில் ந.
109,ஒவ்வொரு பாடத்திலும் முதன்மையாகத் தேறினார்.
110,இதற்காகப் பல பரிசுகளையும் பெற்றார்.
111,தொடக்கக் கல்வி முடிந்த பின் தம் தந்தையாரிடமே சில நூல்களைப் பாடம் கேட்டார்.
112,"பிறகு, பகற்பொழுதில் வேளாண்மையில் ஈடுபட்டு உழைத்துவிட்டு, இரவில் தாமாகவே நன்னூல் முதலிய இலக்கண நூல்களைக் கற்றறிந்தார்."
113,பின்னர்த் திருவாளர் ஐ.
114,அதற்குரிய பரிசுகளையும் பெற்றார்.
115,மூன்றாம் தேர்வாகிய பண்டிதத் தேர்வை ஆம் ஆண்டில் எழுதி முதல் வகுப்பில் தேர்ச்சி பெற்றுத் தங்கத்தோடா பரிசு பெற்றார்.
116,இப்பரிசினைப் பாண்டித்துரைத் தேவர் தம் கைகளாலேயே வழங்கி நாவலருக்குப் பெருமை சேர்த்தார்.
117,மூன்று தேர்வு களிலும் முதன்மையாளராகத் தேர்ச்சி பெற்றுப் பரிசுகளும் பெற்றதால் ந.
118,அவர்களின் புகழ் தமிழ் நாடெங்கும் பரவியது.
119,கல்வி முடிந்தபின் ந.
120,அவர்கட்குத் திருமணம் ஆயிற்று.
121,ஆற்றிய பணிகள் ந.
122,அவர்கள் இல் திருச்சி எஸ்.
123,கல்லூரியில் தமிழாசிரியராகச் சேர்ந்து பணியாற்றினார்.
124,பின் இல் கோயம்புத்தூர் தூய மைக்கேல் உயர்நிலைப் பள்ளியில் தமிழாசிரியராகச் சேர்ந்தார்.
125,நாவலரின் அறிவாற்றலையும் பாடம் கற்பிக்கும் திறனையும் அறிந்து மீண்டும் எஸ்.
126,"கல்லூரி, தமிழாசிரியர் பணி ஏற்குமாறு வேண்டி ந."
127,அவர்களுக்கு அழைப்பு விடுத்தது.
128,அவர் கி.
129,இல் மீண்டும் எஸ்.
130,கல்லூரியில் ஆசிரியர் பணியில் சேர்ந்தார்.
131,இவர் தமிழ் கற்பித்து வரும் காலத்தில் பெரும்பாலான ஆண்டுகளில் பி.
132,வகுப்பிற்குரிய தமிழ்த் தேர்வில் இக்கல்லூரி மாணவர்களே முதற்பரிசாகிய தங்கப்பதக்கம் பெற்று வந்தனர்.
133,அங்குச் சிறப்புறப் பணியாற்றி இல் ஓய்வு பெற்றார்.
134,தம் குடும்பத்துடன் தஞ்சை வந்து தங்கினார்.
135,பின்னர்க் கரந்தைப் புலவர் கல்லூரியில் முதல்வர் பணியை ஏற்றுக்கொண்டு ஊதியம் பெறாமல் சிறப்புறப் பணியாற்றினார்.
136,இயற்றிய நூல்கள் .
137,வேளிர் வரலாற்று ஆராய்ச்சி இல் வெளியிடப் பட்டது.
138,நக்கீரர் என்னும் நூல் இல் எழுதப்பட்டது.
139,கபிலர் என்னும் நூல் இல் எழுதப்பட்டது.
140,"இவ்விரு நூல்களும் சென்னைப் பல்கலைக் கழகம், காசி இந்து பல்கலைக் கழகம், இலண்டன் பல்கலைக் கழகம் ஆகியவற்றில் பி."
141,வகுப்பிற்குப் பாடமாக வைக்கப் பட்டிருந்தன.
142,கள்ளர் சரித்திரம் என்னும் நூல் இல் எழுதப் பட்டது.
143,"கள்ளர் வகுப்பினரைப் பற்றி எழுதப்பெற்ற தாயினும், தமிழ் மக்கள் அனைவரைப் பற்றியும் பொதுவாக இதில் ஆராயப்பட்டுள்ளது."
144,கண்ணகியின் வரலாறும் கற்பு மாண்பும் என்னும் நூல் இல் எழுதப்பட்டது.
145,சோழர் சரித்திரம் என்னும் நூல் இல் எழுதப் பட்டது.
146,"கட்டுரைத் திரட்டு , கட்டுரைத் திரட்டு ஆகியவையும் வெளிவந்துள்ளன."
147,இதில் நாவலர் ந.
148,எழுதிய பற்பல கட்டுரைகள்அடங்கியுள்ளன.
149,எழுதிய உரைகள் .
150,இல் திருவிளையாடற் புராணத்திற்கு உரை எழுதப்பட்டது.
151,"இல் அகத்தியர் தேவாரத் திரட்டு உரைத் திருத்தம், ."
152,"தண்டியலங்கார பழைய உரைத்திருத்தம், ."
153,யாப்பருங்கலக்காரிகை உரைத்திருத்தம் ஆகியன எழுதப்பட்டன.
154,"கரந்தைப் புலவர் கல்லூரியில் பணியாற்றிக் கொண்டிருந்த போது இல் சிலப்பதிகார உரையும், ."
155,"இல் மணிமேகலை உரையும், ."
156,கரந்தைக் கவியரசு அரங்கவேங்கடாசலம் பிள்ளையுடன் அகநானூறு உரையும் ந.
157,அவர்களால் எழுதப் பட்டன.
158,சொற்பொழிவுத் திறன் நாவலர் ந.
159,சொற்பொழிவாற்றும் திறன் மிக்கவர்.
160,தமிழ்த்தாத்தா உ.
161,"சாமிநாத அய்யர், மு."
162,"இராகவையங்கார், இரா."
163,"இராகவையங்கார், திரு."
164,"க., இரா."
165,"சேதுப்பிள்ளை, அரசஞ் சண்முகனார், கந்தசாமிக் கவிராயர், அருணாசலக் கவிராயர், மு."
166,அவர்களின் சொற்பொழிவு என்றால் தமிழன்பர்கள் மிக்க மகிழ்ச்சியோடு கூடிவிடுவர்.
167,தமிழ் இலக்கியங்களுக்கு அவர் பொருள் விரித்துக் கூறும் அழகை அனைவரும் மெய்ம்மறந்து சுவைப்பர்.
168,கேட்டார்ப் பிணிக்கும் தகையவாய்க் கேளாரும் வேட்ப மொழிவதாம் சொல்.
169,என்பார் வள்ளுவப் பெருந்தகை.
170,அவர்களின் சொற்பொழிவால் நல்ல தமிழ் நடை ஓங்கியது.
171,நாவலர் ந.
