Line Number,Sentence
1,ஆசிரியர் புலவர் குழந்தை நூற்பெயர் புலவர் குழந்தை படைப்புகள் ஆசிரியர் புலவர் குழந்தை பதிப்பாளர் இ.
2,"படிகள் நூலாக்கம் பாவாணர் கணினி தி.நகர், சென்னை ."
3,அட்டை வடிவமைப்பு வ.
4,"மலர் அச்சிட்டோர் ஸ்ரீ வெங்கடேசுவரா ஆப்செட் பிரிண்டர்ஸ் இராயப்பேட்டை, சென்னை ."
5,"வெளியீடு வளவன் பதிப்பகம் , சிங்காரவேலர் தெரு, தியாகராயர்நகர், சென்னை ."
6,பதிப்புரை பகுத்தறிவுப் பகலவன் தந்தை பெரியாரால் அடையாளம் காட்டப்பட்டவர்.
7,திராவிட இயக்கச் சான்றோர்கள் வரிசையில் முன்னவர்.
8,இல் தோன்றி இல் மறைந்தார்.
9,ஆண்டுகள் தமிழ் மண்ணில் வாழ்ந்தவர்.
10,"பாவேந்தர் பாரதிதாசன், பேரறிஞர் அண்ணா போன்ற பெருமக்களால் பாராட்டப்பட்டவர்."
11,தமிழர்கள் ஆரிய சூழ்ச்சியால் பட்ட அவலங்களை எண்ணியெண்ணி நெஞ்சம் குமுறியவர்.
12,தம் நெஞ்சத்து உணர்வுகளை எதிர்காலத் தமிழ்ச் சமுதாயத்திற்கு பதிவுகளாக எழுதி வைத்துச் சென்றவர்.
13,தமிழ் இன எழுச்சி வரலாற்றில் அளப்பரும் தொண்டாற்றியவர்.
14,இவர் எழுதிய நூல்கள் .
15,பல்வேறு அணிகலன்கள் அடங்கிய முத்து மாலை யாகத் தந்துள்ளோம்.
16,"இவர் நூல்கள் அனைத்தும் தமிழ்மொழி இன நாட்டின் மேன்மைக்கும், வாழ்வுக்கும், வளத்துக்கும் வித்திடுபவை."
17,குறிப்பாக இராவண காவியம் படைப்பு திராவிட இயக்க வரலாற்றில் பெரும் தாக்கத்தை ஏற்படுத்திய நூல்.
18,ஆரிய எதிர்ப்பு உணர்வைக் கட்டியமைத்த இன எழுச்சிக் காவியம்.
19,"இப்படைப்புகள் வெளிவரப் பல்லாற்றானும் துணை நின்ற தமிழ்ப்பெருமக்களுக்கும், இந்நூல்களுக்கு அறிமுகவுரை தந்துதவிய பெரும்புலவர் இரா."
20,"வடிவேலன் அவர்களுக்கும், எம் பதிப்பக ஊழியர்களுக்கும் நெஞ்சம் நிறைந்த நன்றி."
21,"தமிழ் ஆய்வாளர்களுக்கும், தமிழ் ஆர்வலர்களுக்கும் பயன் கொள்ளும் வகை யில் பிழையற்ற பதிப்பக வெளிவருகின்றது."
22,வாங்கிப் பயனடையுங்கள்.
23,இராவண காவியம் நூலுக்கு மிகச்சிறந்த தெளிவுரை எழுதப்பட்டு வருவதால் இப்படைப்பு வரிசையில் சேர்க்க முடியவில்லை.
24,விரைவில் வெளிவரும். கோ.
25,இவர்தம் பெற்றோருக்கு ஒரே மகனாக வளர்ந்தார்.
26,தாம் பிறந்த சிற்றூரில் திண்ணைப் பள்ளியில் தொடக்கக் கல்வி பயின்றார் தொடர்ந்து படிக்காமல் இடையிடையே விட்டு விட்டுப் படித்தார்.
27,மொத்தத்தில் எட்டு மாதங்களே திண்ணைப் பள்ளியில் பயின்றார்.
28,கருவிலே திருவுடையவராகிய இவர் பத்தாம் ஆண்டில் இளம் பருவத்திலேயே கவிபாடும் ஆற்றலைப் பெற்றிருந்தார்.
29,யாரேனும் ஒருவர் ஒரு பாட்டைப் பாடக் கேட்டால் உடனே இவர் அப்பாட்டின் ஓசையில் புதுப்பாட்டு ஒன்றினைப் பாடுவார்.
30,எப்போதும் ஏதேனும் ஒருபாட்டை எழுதிக் கொண்டே இருப்பார்.
31,பாட்டு எழுதுவது இவருக்குக் கைவந்த கலையாக அமைந்து விட்டது.
32,இவர் காலத்தில் இவர் வாழ்ந்த பகுதியில் தமிழ் கற்பிக்கும் ஆசிரியர்கள் இல்லை.
33,ஆகவே தானாகவே முயன்று படித்துக் கவிபாடும் திறம் பெற்றிருந்தார்.
34,இவர் முதன் முதலில் இசைப்பாடல்களைப் பாடினார்.
35,"தாம் பிறந்த ஓலவலசிலோ, அதனைச் சுற்றியுள்ள ஊர்களிலோ தமிழ்ப் புலவர்கள் எவரும் அக்காலத்தில் இல்லை."
36,ஆகவே இவர் ஆசிரியர் துணையின்றித் தாமாகவே முயன்று இலக்கிய இலக்கணங்களைப் படித்துத் தமிழில் சிறந்த புலமை பெற்றார்.
37,இவர் பவானியில் மாவட்டக் கழகப் பள்ளியில் ஆம் ஆண்டில் ஆசிரியர் பணியைத் தொடங்கினார்.
38,வரை தமிழாசிரியராகத் தொண்டாற்றினார்.
39,முதல் ஆம் ஆண்டுவரை தலைமைத் தமிழாசிரியராகப் பணியாற்றினார்.
40,மாணவர்கள் வியந்து பாராட்டும்வகையில் ஆண்டுகள் பணியாற்றி ஓய்வு பெற்றார்.
41,ஆசிரியர் பணியினின்று ஓய்வு பெற்ற பின்பும் எழுத்துப் பணியினின்று ஓய்வு பெறவில்லை.
42,இவருக்கு முன் ஓலவலசில் படித்தவர் எவருமில்லை.
43,அவ்வூரில் உள்ளவர் களுக்குக் கையொப்பம் இடவும் தெரியாது.
44,இளமைப் பருவத்திலேயே பொதுத் தொண்டில் குமுகாயத் தொண்டில் ஆர்வமுடையவராக இருந்தார்.
45,"தாமாகத் தமிழ் இலக்கிய இலக்கணங்களைப் படித்துக் கொண்டிருந்த காலத்தில், தம் ஊரிலிருந்த தம்மையொத்த அகவையுடைய இளைஞர்களுக்குக் கல்வி கற்பித்தார்."
46,அவர்கள் மூலமாகப் பெரியவர்களுக்குக் கையொப்பம் போடப் பயிற்சியளிக்கச் செய்தார் கை நாட்டு போடுவதை அறவே ஒழித்தார்.
47,அக்காலத்தில் இவரைவிட மூத்தவர் பலர் இவரிடம் கல்வி கற்றனர்.
48,ஓலவலசில் கல்லாமை இருளைப் போக்கினார்.
49,அவ்விதழில் இவர் எழுதிய கட்டுரைகள் அவ்வின இளைஞர்களிடையே புத்துணர்ச்சியை வளர்த்தது.
50,"விதவை மணம், கலப்புத் திருமணம், சீர்த்திருத்த மணம் முதலியன செய்யவும் அம்மக்களிடையே விழிப்புணர்வை ஊட்டினார்."
51,வேளாள சமூகத் தலைவரான திரு.
52,"வெள்ளியங்கிரி கவுண்டர் தலைமையில், தகடூர் தருமபுரி மாவட்டத்திலுள்ள அரூரில் வேளாள மாநாடு நடைபெற்றது."
53,அம்மாநாட்டில் புலவர் குழந்தை அவர்கள் விதவை மணம் தீர்மானங் கொண்டு வந்தார் ஒருமனமாக நிறைவேறச் செய்தார்.
54,அதன்படி நூற்றுக்கணக்கான விதவை மணங்களைச் செய்து வைத்தார்.
55,இச்செயல்கள் இவர்தம் சமூகத் தொண்டிற்குச் சிறந்த சான்றுகளாகும்.
56,"இவர், யாப்பிலக்கணம் படிப்பதற்கு முன்னே இல் கன்னியம்மன் சிந்து என்னும் கவிதை நூலை வெளியிட்டார்."
57,இவர் பாடிய அச்சாகாத பாடல்களும் நூல்களும் பல உள்ளன சில நூல்கள் அச்சாகி வெளியிடப்பட்டன.
58,யாப்பிலக்கணம் கற்பதற்கு முன்பு பாடிய பாடல்கள் யாப்பிலக்கணப்படி அமைந்துள்ளன.
59,தீரன் சின்னமலை நாடகம் இன்னும் அச்சாகவில்லை.
60,நெருஞ்சிப் பழம் என்னும் நூல் தமிழில் இதுவரை வெளிவராத கற்பனைக் கருவூலமான காதல் கதையாகும்.
61,புலவர் குழந்தை அவர்கள் பெருங்கவிஞர் மட்டுமல்லர்.
62,சிறந்த எழுத்தாளர் கேட்போர் பிணிக்கும் தகையவாய்க் கேளாரும் விரும்பும் வண்ணம் பேசும் பெரும் பேச்சாளர்.
63,இவருடைய எழுத்துகள் உறுதியும் அஞ்சாமையும் ஆய்வும் செறிந்த புரட்சிக் கனல் தெறிக்கும் இயல்புடையவை.
64,இவருடைய செய்யுள் நடையும் உரைநடையும் எளிய இனிய தனித்தமிழில் அமைந்தவை.
65,இவர் படைத்த நூல்களெல்லாம் தமிழுக்கும் தமிழர்க்கும் ஆக்கம் தரும் வகையில் அமைந்துள்ளன.
66,தந்தை பெரியார் இல் சுயமரியாதை இயக்கத்தைத் தொடங்கினார்.
67,இவர் அவ்வியக்கத்தில் சேர்ந்தார் பெரியாரின் அணுக்கத் தொண்டரானார்.
68,பகுத்தறிவுக்கு ஒவ்வாத எதனையும் செய்யாதவர்.
69,இவரது சுயமரியாதை உணர்ச்சிப் பிழம்பே இராவண காவியம் படைக்கத் தூண்டியது இவருக்குப் புகழைச் சேர்த்தது.
70,இல் சென்னையில் திருக்குறள் மாநாடு நடைபெற்றது.
71,அக் குழுவில் புலவர் குழந்தையும் ஒருவர்.
72,இவரே தனிஒருவராக இருந்து திருக்குறளுக்கு உரை எழுதி திருக்குறள்குழந்தையுரை என்று வெளியிட்டார்.
73,அவ்வுரையை நாட்களில் எழுதி முடித்த பெருமைக்குரியர்.
74,அறிஞர் அண்ணா அவர்கள் ஈரோட்டில் விடுதலை ஆசிரியராக இருந்தபோது அவருடன் நெருங்கிப் பழகும் வாய்ப்பினைப் பெற்றார்.
75,அதைக்கண்டு தமிழகமே அகமிக மகிழ்ந்தது தமிழவேள் கலைஞரை உளமார வாழ்த்தியது.
76,புலவர் குழந்தை ஒழுக்கத்தை உயிரினும் மேலாகக் கொண்டவர்.
77,புலவர் குழந்தை அவர்களின் வாழ்க்கைத் துணைவியார் முத்தம்மையார்.
78,"இவ்விணையருக்குச் சமத்துவம், சமரசம் என்னும் இரு பெண்மக்கள் உள்ளனர்."
79,தமிழுக்குத் தொண்டு செய்து வந்த புலவர் பெருந்தகை தமது ஆம் அகவையில் இல் இயற்கை அடைந்தார்.
80,மாண்புமிகு தமிழக முதல்வர் கலைஞர் அவர்கள் புலவர் குழந்தையிடம் அன்பும் மதிப்பும் உடையவர்.
81,"அவர் மறைந்த பிறகு, அவர் நூற்றாண்டு பிறந்த நாளை முன்னிட்டு அவருடைய நூல்கள் அன்று அரசுடைமை ஆக்கப்பட்டதாக அறிவித்தார்."
82,குழந்தை அவர்களின் மகள்கள் இருவருக்கும் தலா ரூ. இலட்சம் பரிவுத் தொகை வழங்கினார்.
83,புலவர் குழந்தை அவர்களால் எழுதப்பட்ட நூல் களையும் அரசுடைமையாக்கிப் பரிவுத் தொகையாக ரூபாய் இலட்சத்தையும் அளித்துள்ளது.
84,அவர் இயற்றிய இராவண காவியம் இனவரலாற்றில் இயக்க வரலாற்றில் ஈடு இணையில்லாதது.
85,அவ்விழாவில் பகுத்தறிவாளர் கழக மாநிலப் புரவலர் என்கிற முறையில் ஆசிரியர் மானமிகு கி.வீரமணி அவர்களும் பங்கேற்றுப் பாராட்டுரை புகன்றார்.
86,இராமன் கடவுளல்ல என்கின்ற உணர்ச்சியினைத் தமிழக மக்களிடையே ஏற்படுத்த வேண்டுமென்பதற்காக இராவண காவியத்தை எழுதினேன்.
87,எனக்குத் துணிவினைத் தந்தவர் தந்தை பெரியாரவர்களே ஆவார்கள் என்று குறிப்பிட்டுள்ளார் விடுதலை .. பக்கம் .
88,"புரட்சிக் கவிஞர் பாரதிதாசன் ஆனாலும், புலவர் குழந்தையானாலும் தொடக்கத்தில் பக்திப் பாட்டெழுதிக் கிடந்தவர்கள் தாம்."
89,விழுப்புரம் பாராட்டு விழாவில் தந்தை பெரியார் கூறினார்.
90,"புலவர் குழந்தையவர்கள் இராவண காவியம் எழுதி இருக்கின்றார், அது ஒரு இராமாயணம் போன்றதே!"
91,எத்தனையோ இராமாயணங்கள் இருக்கின்றன என்றாலும் நம் நாட்டிலிருப்பது பார்ப்பன இராமாயணமாகும்.
92,இந்த இராமாயணத்தின் தத்துவம் நம்மை இழிவுபடுத்துவதேயாகும்.
93,முதன்முதல் நண்பர் பாரதிதாசன் அவர்கள்தான் துணிந்து பார்ப்பானைக் கண்டித்தார்.
94,புலவர் குழந்தை அவர்கள் பார்ப்பனர்களின் அயோக் கியத்தனங்களையெல்லாம் காவிய நடையில் எழுதியுள்ளார்.
95,அதுவும் இலக்கணப்படி எழுதியுள்ளார்.
96,அந்தப் புத்தகத்தை நீங்களெல்லாம் வாங்கிப் படித்துப் பயனடைய வேண்டும்.
97,பார்ப்பான் தன் இனத்திற்காக பிரச்சாரம் செய்கின்ற காலிகளை யெல்லாம் சாமியாக்குகின்றான்.
98,"அதுபோல நமக்காகப் பாடுபடு கின்றவர்களை, தொண்டு செய்கிறவர்களை, எழுதுகிறவர்களைப் பெருமைப் படுத்த வேண்டும்."
99,அப்பொழுதுதான் அவர்கள் துணிந்து முன்வருவார்கள் விடுதலை .. பக்கம் என்று தந்தை பெரியார் பாராட்டுதலுடன் ஆழமான கருத்தினை எடுத்துரைத்தார்கள்.
100,", ஆம் ஆண்டுகளில் நடைபெற்ற இந்தி எதிர்ப்புப் போராட்டங்களிலும் முக்கிய பங்கெடுத்துக் கொண்டவரும் கூட!"
101,எந்த இடத்திலும் தாம் ஏற்றுக் கொண்ட தன்மான இயக்க பகுத்தறிவுக் கருத்துக்களைக் கம்பீரமாகச் சொல்லத் தயங்காதவர்.
102,சேதுப்பிள்ளையின் பாராட்டு!
103,"கம்பன் கவிநயத்தை லயித்து, சப்புக் கொட்டிப் பேசும் சொல்லின் செல்வர் என்று போற்றப்பட்ட இரா."
104,சேதுப்பிள்ளை அவர்கள்கூட புலவர் குழந்தையின் இராவண காவியத்தில் சொக்கிப் போயிருக்கிறார்.
105,தேனினும் இனிய செந்தமிழ்க் குழந்தை! நான் கம்பராமாயணக் கவிச் சுவையில் கட்டுண்டு கிடந்தனன்.
106,தங்கள் இராவண காவியம் அக்கட்டை அவிழ்த்து விட்டது.
107,கருத்து மாறுபாடு வேறு என்று குறிப்பிட்டதி லிருந்து புலவர் அவர்களின் புலமைத் திறன் குன்றின் மேல் ஒளிர்கிறது.
108,கம்ப இராமாயண அன்பரான புலவர் அய்யன் பெருமாள் கோனார் ஒருபடி மேலே தாவிப் பாடினார்.
109,இனியொரு கம்பனும் வருவானோ?
110,இப்படி யும்கவி தருவானோ?
111,"கம்பனே வந்தான் அப்படிக் கவிதையும் தந்தான் ஆனால், கருத்துதான் மாறுபட்டது என்று கவியால் ஒப்புதல் வாக்குமூலம் தந்தார்."
112,இத்தகைய தமிழ்ப் புலவர் பெருமகனாருக்குத்தான் தமிழக அரசு உரிய சிறப்பினைச் செய்திருக்கிறது.
113,கம்பனைப் போல் காட்டிக் கொடுத்து காவியம் புனைந்திருந்தால் இவருக்கு இமயப்புகழ் கிடைத்திருக்கும்.
114,என்றாலும் காலங் கடந்தாவது ஒரு அரசின் அங்கீகாரம் கிடைத்தது என்பது வரவேற்கத் தகுந்ததாகும்.
115,தமிழ்நாட்டிலேயே இராவண காவியத் தொடர் சொற் பொழிவை அரங்கேற்றிய பெருமை அதற்குண்டு.
116,சிலம்பொலி செல்லப்பனார் அவர்களைக் கொண்டு ..ல் தொடங்கி ..வரை சொற்பொழிவுகள் நிகழ்த்தப்பட்டன.
117,அதே போல் பேராசிரியர் அறிவரசன் அவர்கள் .. முதல் ..வரை சொற்பொழிவுகளை நிகழ்த்தினார்.
118,முனைவர் மறைமலை இலக்குவனார் .. முதல் .. வரை தொடர் சொற்பொழிவுகளை நிகழ்த்தினார்.
119,"இவையன்றி, தனித்தனிச் சிறப்புக் கூட்டங்களும் நடத்தப்பட்டதுண்டு."
120,இத்திசையில் மொத்தம் நிகழ்ச்சிகள் நடத்திய சாதனை பெரியார் நூலக வாசகர் வட்டத்துக்கு உண்டு.
121,தமிழர் தலைவர் மானமிகு கி.
122,வீரமணி அவர்கள் விழாவில் நிறைவுரையாற்றினார்.
123,அவ்விழாவில் முக்கிய பல தீர்மானங்கள் நிறைவேற்றப்பட்டன.
