Line Number,Sentence
1304,பேராசிரியம் தரவும் போக்கும் பாட்டிடை மிடைந்தும் ஐஞ்சீ ரடுக்கியும் ஆறுமெய் பெற்றும் வெண்பா வியலான் வெளிப்படத் தோன்றும்.
1305,"இது, மேல் வெளிப்படு பொருட் டெனப்பட்ட வெண்கலி விரவுறுப்புடைமையின் அதனை வேறு கூறுகின்றது. இள்."
1306,"தரவும் போக்கும் பாட்டிடை மிடைந்தும் என்பது, தரவிற்கும் போக்கிற்கும் இடையின்றிப் பாட்டாகிப் பயின்று வருதலும் எறு."
1307,"தரவும் போக்கு மெனப் பாட்டிறுதி நின்ற போக்கினைமுன்வைத்தான், அவை ஓரினத்த வாகலின் என்னை?"
1308,"தரவிறுதி, சீரான் இறுமாறு போல வெள்ளைச் சுரிதகவிறுதியும் ஒரோவழிச் சீரானே இறுதலின்."
1309,"அது, தாதுதேர் வண்டின் கிளைபாடத் தைஇய கோதை பரிபாடக் காண்கும் கலி என நான்கசையானுமின்றித் தேமாவா னிற்றது."
1310,இங்ஙனம் வைப்பலே வருகின்ற ஐஞ்சீரடுக்கலும் ஆறுமெய் பெறுதலும் அவற்றுக்கன்றி ஏலாவாயின அல்லதூஉம்.
1311,இதனை இறுதி வைத்தான்.
1312,"இதனோடொக்குமென முற்கூறப்படுங் கொச்சகம், தரவும் போக்குமின்றிப் பாட்டு மிடைந்தே வருமென்பது இவ்வதிகாரத்தாற் கோடற்கென்பது."
1313,அது முன்னர்க் காட்டுதும்.
1314,எறு.
1315,பாட்டிடை மிடைந்தும் என்பது முதலாக வந்த உம்மை மூன்றும் இறந்தது தழீஇய எச்சவும்மை என்னை?
1316,"இனி, வெள்ளைச் சுரிதகத்தான் வந்தனவும், கண்டுகொள்க."
1317,காராரப் பெய்த கலி என்னும் முல்லைப்பாட்டு ஐஞ்சீரடுக்கி வெள்ளைச்சுரிதகத் தானிற்றது.
1318,"என்பதனுள், வாழி சான்றீர் அம்ம சான்றீர் என ஐஞ்சீரடுக் கியாங்கு அடுக்கிச் சொல்ல அறுசீராயின."
1319,இதற்கும் ஐஞ்சீர் அடுக்கியுமென்றதுபோல அறுசீரடுக்கியுமென்று அடுக்குதற்றொழில் கொள்ளப்படும்.
1320,ஈண்டு இரண்டளவடி தொடைப்படச் செய்தமையினென்க.
1321,இதனுள்ளும் என்றாங்கே என்பது தனிச்சொல்.
1322,புரிவுண்ட புணர்ச்சியுட் புல்லாரா மாத்திரை யருகுவித் தொருவரை யகற்றலிற் றெரிவார்கட் செயநின்ற பண்ணினுட் செவிசுவை கொள்ளாது கலி.
1323,"என்பதனுள், இனைந்துநோந் தழுதன ணினைந்துநீ டுயிர்த்தனள் எனவும்."
1324,இயற்சீர் நிரையொன்றியும் பா வேறுபடாமையின் இதுவும் கலிவெண்பாட்டாயிற்றென்பது கொள்க.
1325,"இங்ஙனம் பா வேறுபடாமையினன்றே, உறாஅர்க் குறுநோ யுரைப்பாய் கடலைச் செறாஅய் வாழியென் னெஞ்சு குறள்."
1326,"என்பதனை வெண்பா என்பாமாயிற்றென்பது இனி, எல்லிரா நல்கிய கேள்வ னிவன்மன்ற மெல்ல கலி."
1327,என வெள்ளைச் சுரிதகத்துள் ஐஞ்சீரடியும் வந்தது.
1328,"வெண்பா விற்கு முன்னர், வெண்டளை விரவியு மாசிரியம் விரவியு மைஞ்சீ ரடியு முள தொல்செய் என்றானாகலின்."
1329,மேற்கூனெனவுஞ் சொற்சீரெனவுங் கூறப்பட்டனவே ஈண்டு ஐஞ்சீரடுக்கியும் ஆறுமெய் பெற்றுங் கூறுபட்டன என வுணர்க.
1330,இனிப் பலவுறுப்பின்றி அவ்வாறு ஒருபாட்டே வரின் அதனை வெண்கலி யென்பாரும் உளர்.
1331,துள்ளலுஞ் செப்பலுமென்னும் இருவகைக் கொச்சகமும் ஒருங்குவாராமையிற் கொச்சகமென்னாம்.
1332,இதனாலும் பெற்றாம் இது கொச்சக்கலி யல்லாமை. நச்சினார்க்கினியம் இஃது மேல் வெளிப்படுபொருட்டெனப்பட்ட கலிவெண்பா விரவுறுப்புடைமையின் வேறுவேறு கூறுகின்றது.
1333,இள் தரவு ....
1334,தும் எது தரவிற்கும் போக்கிற்கும் இடையன பாட்டாகிய பயின்றும்.
1335,"ஐஞ் ...... எ து, வேறு நின்றவொருசீரியளவடியோடடக்கிக்கூஐஞ்சீராகியும்,ஆ....."
1336,றும் எதுஅவ்வாயிருசீரடுக்ஆறுசீபெற்றும்.
1337,வெண் ......
1338,றும் எது வெண்பா வெனப் பட்டவுறுப்பினியற்கை சிதையாமற் பொருள் புலப்படத் தோன்றும்.
1339,எறு.
1340,உம்.
1341,இனிப் பாட்டினைப் போக்கின்பின் வைத்ததனாற் போக்குப்போல் நாற்சீரா னிறும்பாட்டும் வருஞ் சிறுபான்மையென்று கொள்க.
1342,உம்.
1343,கரந்தாங்கே யின்னாநோய் செய்யுமற் றிஃதோ பரந்த சுணங்கிற் பணைத்தோளாள் பண்பு கலி.
1344,எனவரும்.
1345,இங்ஙனம் வைப்பவே வருகின்ற ஐஞ்சீரடுக்கலும் ஆறுமெய் பெறுதலும் இப்பாட்டின்கணன்றி யேலாவாயின.
1346,இதனை யீற்றுக்கண் வைத்ததனானே மேற்கூறுங் கொச்சகமுந் தரவும் போக்குமின்றி யிப்பாட்டு மிடைந்தும் வருமென்பதூஉம் இவ்வதிகாரத்தாற் கொள்க.
1347,மெய்யென்றதனான் அடுக்குஞ்சீர் அதன் முதலினும் இறுதியினும் வருமென்று கொள்க.
1348,இயற்கை சிதையாமற் றோன்றுமெனவே கட்டளையுங் கட்டளையல்லது மென்ற வெண்பாவிலக்கணமிரண்டுஞ் சிதையாமை வருமென் றாராம்.
1349,வெளிப்படவென்றதனாற் றளைவிரவி வருதலுங் கொள்க.
1350,தரவும் போக்குமென்ற உம்மைகள் எண்ணும்மைகள்.
1351,ஒழிந்த மூன்றும் இறந்ததுதழீஇய எச்சவும்மை.
1352,"கலிவெண்பாட்டுத் தனிநிலையின்றி விரவுறுப்பாயும் வருமென்றலின், சான்றவிர் வாழியோ சான்றவி ரென்றும் ..."
1353,...
1354,...
1355,...
1356,...
1357,...
1358,...
1359,...
1360,...
1361,துயர்நிலை தீர்த்த னுந்தலைக் கடனே கலி.
1362,இது தரவும் போக்கும் பாட்டிடைமிடைந்த கலிவெண்பாட்டு ஆசிரியச் சுரிதகத்தான் வந்தது.
1363,இவ்வாறே வெள்ளைச் சுரிதகத்தான் வருவனவுங் கொள்க.
1364,கண்டவி ரெல்லாங் கதுமென வந்தாங்கே ...
1365,...
1366,...
1367,...
1368,...
1369,...
1370,...
1371,...
1372,...
1373,செயினுமக் கறனுமா ரதுவே கலி.
1374,"இது பாடெனி லென்றும, ஆடெனி லென்றும் எதுகை யியைந்த அளவடி என்னானும் எனவேறு நின்ற சீரொடுங்கூடி ஐஞ்சீரடுக்கிற்று."
1375,இதனுள் ஆங்க எனத் தனிச்சொல் வந்தது.
1376,அரிதி னிற்றோன்றிய யாக்கை புரிபுதாம் ...
1377,...
1378,...
1379,போலக் கொடுத்தார் தமர் கலி.
1380,இதற்கும் அறுசீரடுக்கியும் எனக்கூட்டிப் பொருளுரைக்க.
1381,என்றாங்கு.
1382,தனிச்சொல்.
1383,புரிவுண்ட கலி.
1384,இதற்கினமாகிய முடுகியலும் அவ்விரண்டிற்கும் வாராமை கொள்க. இவற்றிற்கு வரையறை அம்போதரங்கத்திற் கோதிய வரையறையே வேறின்றென வுணர்க.
1385,இனிப் பலவுறுப்பின்றி யவ்வாறு ஒரு பாட்டே வரின் அதனை வெண்கலியென்பாரு முளர்.
1386,நூற்றைம்பது கலியுள் அவ்வாறுவருவன இன்மையின் அது சான்றோர் செய்யுளொடு மாறுகொள்ளுமென மறுக்க.
1387,எ று.
1388,பேராசிரியம் பாநிலை வகையே கொச்சகக் கலியென நூனவில் புலவர் நுவன்றறைந் தனரே.
1389,"இது, நிறுத்தமுறையானே, அகநிலைக் கொச்சகக்கலி யுணர்த்துகின்றது."
1390,பாநிலைவகை யென்பது உம்மைத்தொகை பாநிலையும் வகையுமென விரியும்.
1391,"பாநிலை யென்பது, ஆறாம் வேற்றுமைத்தொகை."
1392,இ ள் மேற் பாவிநின்ற வகையானே கொச்சகக்கலியா மென்று நூலாசிரியர் கூறித் துணித்தனர்.
1393,"எ று அறைதலெனினுந் துணித்தலெனினும் ஒக்கும், என்னை?"
1394,துணித்த கரும்பினை.
1395,அறைக் கரும்பு பொருந.
1396,என்பவாகலின்.
1397,"பாநிலை யென்றது, யாதனை நோக்கியெனின் இது கொச்சகமாதலான் அதுவும் மேலே ஒருபோகெனக் கூறப் பட்ட கொச்சகப்பாநிலை யெனக்கொள்க."
1398,"அஃதேல், அதனைப் பாநிலை யென்னாது வகை யென்ப தெற்றுக்கெனின்,வெண்கலிப்பாத், தரவும் போக்கும் பாட்டிடை மிடைந்து ..."
1399,...
1400,...
1401,...
1402,...
1403,...
1404,வெண்பா யலான்வளிப்படத்தான்றும் தொல்செய் வெண்பாவிற் சிதையாது வருமென்று உறுத்துக் கூறினானென்பது.
1405,எனவே பாவொழிந்த உறுப்பெல்லாம் பொருணுதலாது வெளிப்படத் தோன்றுங் கலிவெண்பாட்டின் உறுப்புவகையான் வருதலும் உடைத்தென்றவாறு.
1406,"அங்ஙனம் வருங்கால் இடைநின்ற கொச்சகங்களை, ஐஞ்சீ ரடுக்கலும் தொல்செய் என்ற கலிவெண்பாவிற்கு ஓதியவாறே கொள்க."
1407,...
1408,...
1409,"மகனல்லை மன்ற வினி கலி எனவும், செல்லினிச் சென்றுநீ செய்யும் வினைமுற்றி ..."
1410,...
1411,அவலம் படுதலு முண்டு கலி எனவுந் தரவிரண்டு அடுக்குதலின் தரவிணைக் கொச்சக மெனப்படும்.
1412,இது நூற்றைம்பது கலியுளொன்றாகலின் வெண் பாவாகியுந் தனித்து வரும்.
1413,வருங்காற் றாயிற்று.
1414,ஒரு பொருணுதலி இவ்வாறு வரினும் இஃதொக்கும்.
1415,இது தாழிசையோடு கோடாத் தரவாகலின் வெண்பாவாகியும் வந்தது. மாமலர் முண்டகந் தில்லையோ டொருங்குடன் ...
1416,...
1417,...
1418,சென்றனை களைமோ பூண்கநின் தேரே கலி என்பது தனிச்சொல் இன்றி ஆசிரியச்சுரிதகம் பெற்ற தரவிணைக் .
1419,மின்னொளி ரவிரற விடை போழும் பெயலேபோல் ...
1420,யேழைத் தன்மையோ வில்லை தோழி கலி.
1421,"இது, தனிச்சொல்லும் ஆசிரியச்சுரிதகமும் பெற்ற தரவிணைக் ."
1422,வெல்புகழ் மன்னவன் விளங்கிய வொழுக்கத்தான்.
1423,பான்மருண் மருப்பி னுரல்புரை பாவடி ...
1424,...
1425,...
1426,அமைக்கவின் கொண்ட தோளிணை மறந்தே கலி என்னும் கலிப்பாட்டுத் தனிச்சொல்லும் அடக்கியலுமின்றி அடிநிமிர்ந்தொழுகிற்று.
1427,எஃகிடை தொட்டகார்க் கவின்பெற்ற வைம்பால்போல் கலி என்னும் பாலைப்பாட்டும்.
1428,அகன்ஞாலம் விளக்குந்தன் பல்கதிர் வாயாக கலி என்னும் நெய்தற்றிணைப்பாட்டும் அங்ஙனமாமாறு கண்டு கொள்க.
1429,இருசீர் நான்கடித் தரவுக் .
1430,இஃது ஐஞ்சீர் நான்கடித்தரவு .
1431,பிறவும் அன்ன.
1432,"இஃது, அறுசீர் மூன்றடித்தரவுக் ."
1433,இன்னும் மேற்கூறிய கொச்சக வொருபோகின் பகுதியுள் ஒழிந்தனவும் இவ்வாற்றான் வருவனவெல்லாம் வந்தவழிக் கண்டுகொள்க.
1434,...
1435,...
1436,"மற்றவன் மேஎவழி மவாய்நஞ்சேகலி, தரவுக் கொச்சகமுஞ் சுரிதகமும் முறையானே வந்து ஆசிரியச்சுரிதகத்தான் இற்றது."
1437,இதனுள் ஒன்று எனவும் அவனை எனவுஞ் சொற்சீருந் தனிச்சொல்லும் வந்தன.
1438,இப்பாட்டு மூன்றனுளொன்று ஓரடிமிக்கு மற்றைய நான்கடியாயே வருதலின் மூன்றும் ஒருபொருண்மேல் வரினும் நூலறிபுலவரான் ஒத்தாழிசை யெனப்படாக் கொச்சகமாயிற்று.
1439,பிறவும் இன்னோரன்னவற்றாற் கலியோடு இதனிடை வேறுபாடு தெரிந்து உணரப்படும் அஃதறியாதார்க்கு ஒன்றுபோலக் காட்டினுமென்பது.
1440,வேனி லுழந்த வறிதுயங் கோய்களிறு ...
1441,...
1442,...
1443,"முன்னிய தேஎத்து முயன்றுசெய் பொருளே கலி என்னும் பாட்டுத், தரவும் போக்கும் பாட்டிடைமிடைந்து ஐஞ்சீரடுக்கி வந்தது."
1444,இதனுள் தரவடி நான்கும் வெண்பாவாயினும் அச்செய்யுண் முழுதும் வெண்பாவன்மையிற் கொச்சகமாயிற்று.
1445,"இனி, அறுசீரான் வருவனவும் வந்தவழிக் கண்டுகொள்க."
1446,இவை யிரண்டும் வெண்பா.
1447,இதனுள் ஒழிந்தபா மயங்கியவாறு கண்டுகொள்க.
1448,மலிதிரை யூர்ந்துதன் மண்கடல் வௌவலின் கலி.
1449,இவற்றுளெல்லாஞ் சொற்சீரடி வந்தன.
1450,ஒழிந்த கொச்சகப் பகுதியும் இவ்வாறே வந்தவழிக் கண்டுகொள்க.
1451,வெண்பா வியலான் வெளிப்படத் தோன்றும் என வேறொரு பாவினை உறுப்பாகக் கூறுதன் மற்றொரு பாவிற்கேதுவாகக் கூறுதலாமோவென மறுக்க.
1452,மற்று இதற்கு அளவை கொள்ளுமாறென்னை?
1453,அடிநிமிர்ந்தோடியதற்கு இழிந்த எல்லை பத்து அடியென்றமையின்.
1454,"இனி, அடிநிமிர்ந்தோடிய தொவ்வாமையின் அதற்களவை இத்துணையென்று, ஒருபான் சிறுமை யிரட்டியத னுயர்பு தொல்செய் என விதந்தோதினான்."
1455,என்புழிச் சொல்லுதும்.
1456,நச்சினார்க்கினியம் இஃது நிறுத்தமுறையே அகநிலைச் கொச்சகக்கலி கூறுகின்றது.
1457,இள் மேற்பாவிநின்ற நிலைவகையான் கொச்சகக்கலியா மென்று நூலறிந்த ஆசிரியர் கூறித்துணிந்தனர்.
1458,எறு.
1459,அறைதுணித்தல் அறைக்கரும்பு பொருந.
1460,போல.
1461,பாநிலை யென்றது மேல் ஒருபோகெனக்கூறிய கொச்சகப்பா நிலையை நோக்கிற்று.
1462,அதுவுங் கொச்சகமாதலின்.
1463,துணித்தன ரென்றதனால் அதிகாரத்தாற் சேட்படக்கூறிய தரவின் றாகித் தாழிசை பெற்றும் செய். என்ற தொன்றனையுமே துணிந்து மாற்றி யொழிந்தன.
1464,பாவிநின்ற வகையான் இவ்வகநிலைக் கொச்சகமும் வருமென்றுணர்க.
1465,எனவே பரணிப்பாட்டுப்போல வெளிப்பட்டு அகநிலைக் கொச்சகம்வாரா வென்றாராம்.
1466,வகையென்றதனான் அதிகாரத்தானின்ற கலிவெண்பாவினது பாநிலையுங் கொள்ளப்படும்.
1467,அது கொள்ளுங்கால் முன்னிற் சூத்திரத்திற்கூறிய நிலையெல்லாங் கொள்ளப்படும்.
1468,ஒரு பொருணுதலிய செய். என்னுஞ் சூத்திரத்தினிலை கொள்ள லாகாதென் றுணர்க.
1469,இவ்வாறு வந்தன வெண்பாவிற் சிதைந்து ஓசையும் பொருளும் வேறாகலிற் கொச்சகமென்றார்.
1470,தரவிணைந்து வாராது யாப்பின் வேறுபட்டு ஒருதரவே வந்தாற் கொச்சகமென்றலுந் தர விணைந்துழிச் சுரிதகம் பெறுதலும் வேறாகலிற் கொச்சகமென்றார்.
1471,"எனவே, கொச்சகக்கலியுள் ஒருசாரனவற்றை இனமென்பார்க்கு அவை அவ்வப்பாக்களுள் வரின் இவ்வகையே கொச்சகமெனல் வேண்டும்."
1472,அது பொருந்தா தென்றவாறாயிற்று.
1473,உம்.
1474,கொச்சகம் வெண்பாவாயும் வருதலானுந் தாழிசையொடு தொடராது வருதலானும் இவை கொச்சகமாயிற்று.
1475,ஒரு பொருணுதலி யிவ்வாறு வரினுங் கொச்சகமென்றுணர்க.
1476,இனி அகன் ஞாலம்...
1477,...
1478,மயங் கியோரே கலி. எஃகிடை தொட்டகார் கலி. இவையும் இவ்வாறே வந்தன.
1479,இனி யாப்பின் வேறுபடவந்த அருடீர்ந்த காட்சி கலி. நயனும் வாய்மையும் கலி. என்பனவும் ஒக்கும்.
