Line Number,Sentence
813,"இயற்றமிழைப் புலவரும், இசையைப் பாணரும், கூத்தினைக் கூத்தரும் பயின்று வளர்த்தனர்.",False
814,அதனால் அவர்களும் பார்ப்பாரைப் போல அரசர் செல்வர் முதலிய வளமுடை யோரைச் சூழ்ந்து வாழ்ந்தனர்.,False
815,"அவர்களும் உழவு வாணிகம் முதலிய தொழில் செய்யராகலின், அவர்களைப் புரப்பதும் பொது மக்கள் கடனாயிற்று.",False
816,"அவர்கட்குச் செய்யும் உதவி புலவர் கடன் பாணர்கடன் என வழங்கிற்று அவர்களைப் பரிசிலர் எனவும், இரவலர் எனவும் குறித்தனர்.",False
817,புலவர் முதலாயினாராற் பாடப்படும் சிறப்புடையோர் வானவூர்தியில் மேலுலகம் சென்று இன்ப வாழ்வு பெறுவர் என்பது அந்நாளையோர் நம்பிக்கை.,False
818,அதனால் அவர்கட்கு எவரும் தடை விதிப்பது கிடையாது.,False
819,எத்தகைய வேந்தரையும் எந்தக் காலத்திலும் எவ்விடத் தும் சென்று காண்டற்குப் புலவர் முதலாயினார் உரிமை பெற்றிருந்தனர்.,False
820,அவர்கட்குப் போர்க்களமும் ஒன்றே ஏர்க்களமும் ஒன்றே.,False
821,செல்வக் காலமும் அல்லற் காலமும் எல்லாக் காலமும் ஒன்றுதான்.,False
822,எங்கும் எக்காலத்தும் அவர்கள் இனிதின் இயங்கினர்.,False
823,வேந்தரும் பிறரும் அவர்களை மகிழ்வித்தலில் மாண்புற்று நின்றனர்.,False
824,அவன் காலத்தில் குமரி மலையும் அதனை அடுத்திருந்த நாடும் கடலுக்கு இரையாக வில்லை.,False
825,அந்நாட்டின்கண் பஃறுளி என்னும் ஓர் யாறு ஓடிக் கொண்டிருந்தது.,False
826,அதனால் மண்ணிடம் வேண்டிப் பிற வேந்தருடன் வஞ்சிப் போர் செய்வதில் அவன் கருத்து முற்றும் தோய்ந்து நின்றது.,False
827,அவன் கருத்தறியா எதிர்த்த வேந்தர் பால் அவனுக்குக் கடுஞ்சினம் உண்டாயிற்று.,False
828,செய்த போரின் கடுமையால் தோற்ற வேந்தருடைய நாடுகள் மிகுதியும் பாழ் பட்டன.,False
829,வயல்கள் தேரும் மாவும் சென்று உழக்கியதால் சேறுபட்டுப் புழுதியாகிப் புன்செய்க் கொல்லைகளாக மாறின.,False
830,மக்கள் உண்ணுநீர் பொருட்டு அமைத்திருந்த கயங்கள் பலவும் யானைகள் படிந்து கலக்குவதால் சேறாகிச் சீரழிந்தன.,False
831,இவ்வகையால் முதுகுடுமியின் மனத்தில் போர் வெறி மிகுந்திருப்பது கண்ட சான்றோர்.,False
832,அவன்பால் தோன்றிய மறவுணர்வை மாற்றி அறம் நிரம்புதற்கான அருளுரைகளை உரைக்கலுற்றனர்.,False
833,அவர் ஒருகால் முதுகுடுமியின் போர்க்களம் காணச் சென்றார்.,False
834,அவனைக் கண்டதும் நெட்டிமையார்க்கு நெஞ்சில் வியப்பு நிறைந்தது.,False
835,"வேந்தே, இவையாவும் நீ பகைப் புலத்துக் கொண்டவை பகைவர் இவற்றை இழந்த போது எத்துணை இன்னாமையுற்றிருப்பர், அறிவாயோ?",False
836,பிறிதொருகால் முதுகுடுமி பகைப்புலம் சென்று போர் தொடுத்த திறத்தை நேரிற் காணும் வாய்ப்பினை நெட்டிமையார் பெற்றார்.,False
837,விழா நிகழ்ந்த இடமாகிய பஃறுளியாற்றின் மணற் பரப்பும் அவர் மனக் கண்ணில் தோன்றிற்று.,False
838,"அக் காட்சியைத் தமது பாட்டில் வைத்து, ............",False
839,வேந்தன் மிக்க பொன்னும் பொருளும் அளித்தான்.,False
840,இம்முது குடுமியின் காலத்துக்குப்பின் குமரிக்கோடும் பஃறுளி யாறும் தென்கடலின் தீய வாய்க்கு இரையாயின.,False
841,"பிற்காலத்தார், குமரிக்கு வடக்கில் மேலைக் கடலில் கலக்கும் சிற்றாற்றுக்குப் பழைய பஃறுளியாற்றின் பெயரை வைத்தனர்.",False
842,அது நாளடைவில் பறளியாறு என மருவி விட்டது.,False
843,நெடும்பல்லியத்தனார் என்றொரு நல்லிசைப் புலவர் முதுகுடுமியைக் காணப் போந்தார்.,False
844,அப்போது அவன் பகைப் புலத்தில் பாசறையிட்டிருந்தான்.,False
845,அவர்க்கோ பொருள் வேண்டி யிருந்தது.,False
846,என் செய்வார்?,False
847,"அவனும் அவரது புலமையை நயந்து, வேண்டுவன நல்கி, விடையளித்தான்.",False
848,அறுதொழிலாளரான பார்ப்பனர் கூட்டம் பாண்டி நாட்டில் நீர்வள முடைய நிலப்பகுதிகளில் நிறையலுற்றது.,False
849,அவர்களுடைய அறுவகைத் தொழில்களும் முறையே அமைதியாக நடந்து வந்தன.,False
850,நாட்டில் பல்வேறு வகையான வேள்விகள் நடை பெற்றன.,False
851,பல இடங்களில் வேள்விக்கென நட்ட கம்பங்கள் நிலைபெற்றிருந்தன.,False
852,அவற்றை யூபம் என உரைப்பர்.,False
853,பின்பு ஒருகால் காரி கிழார் என்னும் சான்றோர் முதுகுடுமிப் பெருவழுதியைக் கண்டார்.,False
854,அவரை அன்புடன் வரவேற்று வேண்டிய சிறப்புக்களைத் தன் வண்மை விளங்குமாறு நல்கினான்.,False
855,"அதனால் பெரு மகிழ்வுகொண்ட அவர், அவனை மனமார வாழ்த்தினார்.",False
856,நண்பர்கட்கு அவன் செய்யும் தண்ணளியும் பகைவர் பால் அவன்காட்டும் வெம்மையும் மிக்கத் தோன்றின.,False
857,அந்நாடுகளைத் தீயிட்டு எரிக்குமிடத்து அதன் வெம்மையால் நீ அணிந்த மாலைகள் வாட வேண்டும்.,False
858,இப்போதுள்ள சோழவந்தான் பகுதி பாகனூர்க் கூற்றத்தைச் சேர்ந்தது.,False
859,அதனால் பாண்டி வேந்தர் அவனுக்குக் கொற்கை கிழான் என்ற சிறப்பை நல்கி மிகுவித்தனர்.,False
860,அதனால் முதுகுடுமிப் பெருவழுதி அவனை வருவித்துப் பாகனூர்க் கூற்றத்து ஓர் இடம் கண்டு வேள்வியைச் செய்வித்தான்.,False
861,"அவனும், சொற்கணாளர் சொலப்பட்ட சுருதி மார்க்கம் பிழையாது அவ்வேள்வியை முற்றுவித்தான்.",False
862,அது கண்டு பேரின்பம் கொண்டான் பெருவழுதி.,False
863,வேள்வி வேதியரும் பிறரும் நற்கொற்றனது வைதிக நூற் புலமையைப் பாராட்டினர்.,False
864,தலையாலங்கானத்துச் செருவென்ற நெடுஞ்செழியன் நெடுஞ்செழியன் பல்யாகசாலை முதுகுடுமிப் பெருவழுதிக்குப் பின்னே தோன்றிய பாண்டிவேந்தருள் நெடுஞ்செழியன் மிக்க சிறப்புற்று விளங்குபவன்.,False
865,அவன் மிக்க இளையனாயிருந்தபோதே அவன் தந்தை இறந்தான்.,False
866,அதனால் அவன் இளமை வளம் பெறுதற்குள்ளேயே பாண்டி நாட்டு அரசு கட்டில் ஏற வேண்டியவனானான்.,False
867,அவனது அரசவையில் பெருமை மிக்க அரசியலறிஞரும் நல்லிசைச் சான்றோரும் இருந்து அறத்துணை புரிந்தனர்.,False
868,"நாட்டு வளம் மருதம், முல்லை, பாலை, குறிஞ்சி, நெய்தல் என்ற ஐவகைத் திணைவளமும் பாங்குற அமைந்தது பாண்டிவள நாடு.",False
869,"மருதப் பகுதியில் நிலவளம் சிறந்திருந் தமையின், வயல்களில் களிறு மறைக்கும் அளவில் நெல் வளர்ந்து விளைந்தது.",False
870,அவற்றின் இடையிடையேயுள்ள நீர்நிலைகளில் தாமரை நெய்தல் நீலம் முதலிய பூக்கள் மலர்ந்து இனிய காட்சி நல்கின.,False
871,பொய்கைகள் மீன்வளம் மிகுந்து நீர்க்கோழிகள் நெடிதிருந்து வாழும் நீர்மை கொண்டு நிலவின.,False
872,அண்மையில் நிற்கும் பரங்குன்றத்துப் பெருமுழக்கமும் செல்வமக்கள் விளையாடி மகிழும் இன்ப ஓசையும் இடையறாது முழங்கின.,False
873,பாண்சேரிகளில் மீனுணக்குவோர் புள் கடியும் ஓசையும் அவற்றைக் கவர்தற்கு வரும் புள்ளினத்தின் ஒலியும் பரந்திருந்தன.,False
874,முல்லை நிலத்தில் தினையும் வரகும் செழுமையாக விளைந்தன.,False
875,நிலத்திலுள்ள குழிகளுள் மணிவகைகளும் கடறுகளில் பொன் தூள்களும் காணப்பட்டன.,False
876,புன்செய்க் காடுகளில் மானினம் கூட்டம் கூட்டமாய் மேய்ந்து திரிந்தன.,False
877,மேட்டுப் பகுதியில் கொன்றையும் கோங்கும் நின்று விளங்கப் பள்ளப் பாங்கில் பசுமையான பயறும் எள்ளும் விளைந்தன.,False
878,ஆங்காங்கு முசுண்டையும் முல்லையும் பசும்புற்றரையில் படர்ந்துள்ளன.,False
879,ஆழமில்லாத நீர்நிலைகளில் நெய்தலும் தொய்யிலும் நிறைந்து கிடந்தன.,False
880,"குறிஞ்சிப் பாங்கரில் தோரை, ஐயவி, ஐவனம் முதலியன விளையும் செய்களும், இஞ்சி, மஞ்சள், மிளகு முதலியனவும் மல்கி யிருக்கின்றன.",False
881,வேனிலின் வெம்மையும் கோடைக் காற்றின் கொடுமையும் நிலவும் பாலைப் பகுதியில் மூங்கில்கள் தம்மில் இழைதலால் தீப்பிறந்து எங்கும் வெதுப்புகிறது.,False
882,அதனால் வெப்புற்ற யானையினம் மேய்புலம் படர்ந்து அணி அணியாகச் செல்லும்.,False
883,கடல்வாணிகர் வேற்று நாடுகளிலிருந்து கொண்டு வரும் குதிரைகள் நாளும் பெருகிய வண்ணமிருக்கின்றன.,False
884,திமில் வாணரெனப்படும் மீன்வேட்டுவர் பெருமீன்களைக் கொணர்ந்து சிறு சிறு துண்டங்களாக வெட்டி வைக்கின்றனர்.,False
885,இவ்வாறு ஐந்திணைச் செல்வமும் ஆரப்பெற்று விளங்கும்.,False
886,இப்பாண்டி நாட்டின்கண் ஓடும் யாறுகளுள் சிறந்து விளங்குவது வையையாறு.,False
887,"அதுகண்டே, இளங்கோவடிகள், புனல்யாறு அன்று, இது பூம் புனல்யாறு எனப்புகழ்ந்து பாடினர்.",False
888,பூம்பொழில்களில் மயிலினம் மகிழ்ந்து அகவா நிற்கும்.,False
889,பெருமரக்காவில் மந்திகள் வாழும் ஆற்றின் இருமருங்கும் நீர் கொணரும் மணல் பரந்து மாண்பு செய்கிறது.,False
890,கரைகளிலும் பிறஇடங்களிலும் கோங்க மரங்கள் மலர்ந்து விளங்குகின்றன.,False
891,சோலையிடங்களில் பெரும் பாணர் பெருகி வாழ்கின்றனர்.,False
892,ஊர்களில் செல்வமனை தோறும் முழவு முழங்குகிறது வீதி தோறும் விழாக்கள் நடைபெறுகின்றன சேரிகளில் மகளிர் துணங்கை ஆடுகின்றனர்.,False
893,எவ்விடமும் பாடல் சான்ற பண்பு மேம்பட்டுள்ளது.,False
894,அதனைக் கடந்து உள்ளே சென்றால் அகலமான தெருக்கள் காட்சியளிக்கும்.,False
895,மனைகளில் ஏற்போர் ஏற்க ஈவோர் ஈய இன்பமும் பொருளும் அறநெறியில் இயங்கின.,False
896,கூத்தும் இசையும் விழவும் வேள்வியும் மிக்கு விளங்கின.,False
897,கடைத் தெருக்களில் கடைதோறும் பெயரும் பொருளும் எழுதிய கொடிகள் கட்டப்பெற்றுள்ளன.,False
898,வானுற நிமிர்ந்த மாடத்தின் உச்சியினின்று அசைந்து வீழும் கொடிகள் மலைமிசை வீழும் அருவி போல அழகிய தோற்றம் அளித்தன.,False
899,நாட்டவரும் நகரவரும் பல்வகைத் தொழிலினரும் விற்போரும் வாங்குவோருமாய்த் தெரு முழுதும் நிறைந்திருந்தனர்.,False
900,தெருக்களின் இருவிளிம்பிலும் பீடிகைகள் அமைந்து நடந்து செல்வோர்க்கு வழி செய்தன.,False
901,அப்பீடிகைகளில் இன்று போலவே அன்றும் பூவும் மாலையும் வண்ணமும் சுண்ணமும் காய்கனி வகையும் பண்ணியம் பலவும் விற்கப் பட்டன.,False
902,வளங்கெழு செல்வரும் அணங்கு நிகர் மகளிரும் அணிந்த நறுமணம் தெருவெங்கும் கமழ்ந்தது.,False
903,தெய்வக் கோயில்கட்குப் பேரிளம் பெண்டிர் புதல்வர் உடன்வரச் சென்று பூப்பலியிட்டுப் புகை யெழுப்பி வழிபாடாற்றினர்.,False
904,கால நிலையும் மக்கள் கருத்து வகையும் அறிந்து உறுநர்க்கு உரைக்கும் துறவோர் தமக்குரிய தவப்பள்ளிகளில் இருந்து அறம் புரிந்தனர்.,False
905,புத்தப்பள்ளிகளிலும் சமணப் பள்ளிகளிலும் சமய அறங்கள் வழங்கப்பெற்றன.,False
906,ஒருசார் அறங்கூறும் அவையம் இருந்தது.,False
907,அவ்வவையின்கண் இருந்து அறம் ஆராயும் பணிபுரிந்த பெருமக்களைக் காவிதி மாக்கள் என அந்நாளைத் தமிழகம் அன்புடன் பாராட்டியது.,False
908,நெடுஞ்செழியன் காலத்து மதுரைமாநகர் பல்வகைத் தொழிலுக்கும் பெரும்புகழ் பெற்று விளங்கிற்று.,False
909,"அதனை விரித்துரைத்தற்கு இடமின்மையின், விடியற்காலக் காட்சியை மாத்திரம் காட்டி அமைக்கின்றாம்.",False
910,நெடுஞ்செழியன் அவன் முருகவேளைப் போன்ற மேனியும் வலிமையும் அழகும் உடையவன்.,False
911,காலையில் எழுந்து நீராடி அரசர்க்குரிய ஆடையணி பூண்டு திருவோலக்கம் எய்துவான்.,False
912,"பின்னர், பாணர் புலவர் வயிரியர் போந்து பாட்டும் இசையும் கூத்தும் நிகழ்த்துவர்.",False
913,அரசன் அவரவர் வரிசையறிந்து அமைவன நல்கி இயல் இசை கூத்து என்ற முத்தமிழ்ப் பைங்கூழ் வளர்க்கும் முதுபணி புரிவன்.,False
914,"ஆக, இவ்வெழுவர் படையும் கடல் போற் பெருகிப் பாண்டி நாட்டுள் படர முற்பட்டது.",False
915,பாண்டிநாட்டின் வடவெல்லையாகிய வடவெள்ளாறு கடலொடு கலக்கும் நாட்டுக்கு அந்நாளில் கோனாடு என்பது பெயர்.,False
916,"அவ்யாற்றின் வடகரைப் பகுதி வடகோனாடு எனவும், தென் கரைப்பகுதி தென்கோனாடு எனவும் வழங்கியதுண்டு.",False
917,வடகோனாட்டில் வடபகுதியில் இருந்து காவல் புரிந்தான் சோழன்.,False
918,அதன் தென்பகுதியான கோனாட்டில் வேளிர் இருந்து நாடு காவல் செய்தொழுகினர்.,False
919,பாண்டியன் நெடுஞ்செழியனை இப்பகுதிக்கு ஈர்த்துப் போர் தொடுப்பின் அவன் படை நெடிது போதர ஆற்றாது வலிகுன்றுமென எண்ணினர்.,False
920,அதனால் அப்பகுதியில் போர் தொடங்கிற்று.,False
921,பாண்டியன் சூளுரை அவர்கள் பாண்டி நாட்டின் அப்பகுதியில் வாழ்ந்த வேளிர் ஊர்க்குள் நுழைந்து வெட்சிப் போர் தொடுத்தனர்.,False
922,"அவர்களை எதிர்த்துக் கரந்தைப்போர் உடற்றி வேளிர் வலியிழந்து நெடுஞ்செழியன்பால் முறையிடலும், அவன் போர்க்கு எழுந்தான்.",False
923,அவனை இளையன் என இகழ்ந்து சினம் கொள்ளுமாறு சிறுசொல் சொல்லிப் பகைவர் எழுவரும் தூற்றினர்.,False
924,நெடுஞ்செழியன் அப்பகுதிக்குத் தான் தலைமை பூண்டு போர் செய்யத் தலைப்பட்டான்.,False
