Line Number,Sentence
3214,அவ்விழா ஆண்டுகளாய் நடைபெறாது இப்பொழுது நடைபெறவிருப்பது போற்றத்தக்கது.,False
3215,என் சம்பந்தப்பட்டில் தேர்த்திருவிழா மட்டுமல்ல தெப்ப உற்சவமும் நடைபெற்றால் சிறப்பாக இருக்கலாம் என்பது எனது பணிவான எண்ணமாகும்.,False
3216,தேரும் விழாவும் நிற்க தமிழ்நாட்டில் உள்ள எல்லாப் பெரிய கோயில்களிலும் தேர் இருக்கும்.,False
3217,"திருநெல்வேலி, திருச்செந்தூர், சங்கரன்கோயில், சிரிவில்லிப்புத்தூர், மதுரை, திருவாரூர் போன்ற இடங்களில் பெரிய தேர்கள் உண்டு.",False
3218,சிரிவில்லிப்புத்தூரில் உள்ளதேர் பெரிய தேர் என்று கூறுவர்.,False
3219,"பலர் திருநெல்வேலி, திருச்செந்தூர், சங்கரன் கோயில் முதலிய தேர்களைப் பார்த்திருக்கலாம்.",False
3220,தேர் இழுப்பதில் மக்களுக்குள் இருக்கும் ஒற்றுமையும் உற்சாகமும் வியக்கத்தக்கது.,False
3221,தேர் இழுப்பது என்றால் சுசீந்தரத்தில் ஒரு சிறு தேரை இழுக்கிறார்கள்.,False
3222,அதற்கு கன்னியாகுமரி மாவட்டத்திலிருந்து ஆண்களும் பெண்களும் குழந்தைகளும் ஏராளமாகக் கூடி வருகின்றார்கள்.,False
3223,"திருநெல்வேலி, மதுரை போன்ற பேரூர்களில் அம்மன் தேர், சுவாமி தேர், பிள்ளையார் தேர் எனப் பல தேர்கள் இழுக்கப்படுகின்றது.",False
3224,இவைகளில் பெரியது சாமி தேர்தான்.,False
3225,சாமிதேர்தான் இழுத்து நிலைக்கு வரச் சிரமம்.,False
3226,மற்றையத் தேர்களை எளிதில் இழுத்து நிலைக்கு கொண்டு வந்து விடுகின்றனர்.,False
3227,தேரிற் செல்வர்.,False
3228,தேர் இத்துணை பெரிதாக இராது.,False
3229,சிறிதாக இருக்கும்.,False
3230,முற்காலத்தில் தமிழ்நாட்டில் தேரை மாடுகள் இழுத்துச் சென்றன.,False
3231,பிற்காலத்தில் குதிரைகள் மிக விரைவாக இழுத்துச் சென்றன.,False
3232,ஆதியில் மாடுகள் இழுக்கக்கூடிய தேர்களைத்தான் செய்தனர்.,False
3233,"அப்பால் , மாடுகள் இழுக்கக் கூடிய தேர்களைச் செய்தனர்.",False
3234,"பின்னர் ,, குதிரைகள் இழுக்கக் கூடிய தேர்களைச் செய்தனர்.",False
3235,பதினாயிரக்கணக்கான மக்கள் தேரில் பெரிய வடத்தை கட்டி இழுக்கத் தொடங்கினர்.,False
3236,"ஒவ்வொரு பெரிய கோயிலிலும் ஒன்று, இரண்டு, மூன்று, நான்கு ஏன்?",False
3237,அதற்கு மேற்பட்ட தேர்களும் உள்ளன.,False
3238,தேர் விழாவை இரத மகோற்சவம் என்பர்.,False
3239,உற்சவம் என்னும் சொல்லிற்கு உயர்ந்த அறிவையும் அழிவிலாத துறக வாழ்வையும் கொடுப்பது என்று சில அறிஞர்கள் பொருள் கொள்ளுகின்றனர்.,False
3240,முடியாத காலத்தில் அதில் குறைந்த காலத்தையும் இத்தொழில்கள் அமையத்தக்கவாறு வகுத்துக் கொள்ளலாம் என்று அறிஞர்கள் கூறியுள்ளனர்.,False
3241,ஆறுமுக நாவலர் அவர்கள் சைவ நெறியை நன்குணர்ந்தவர்கள்.,False
3242,நமது பள்ளிச்சிறார்களுக்கு சைவ சமய அடிப்படையில் பாடப் புத்தகம் எழுதியவர்கள் கிறித்தவ மறையாகிய பைபிளை நன்கு பயின்றவர்கள்.,False
3243,எனது பாட்டனார் திரு.,False
3244,யாழ்ப்பாணத்தில் சைவமும் தமிழும் வளரத் தமிழ் மீது இறுதி மூச்சுள்ள வரைப் பாடுபட்ட சைவ சமயப் பாதுகாவலர் ஆவர்.,False
3245,பல்வகைத் தேர்கள் தேர்கள் பலவகைப்பட்டன என்று கூறப்படுகின்றன.,False
3246,என்றாலும் அதன் உருவ அமைப்பின் அதிக மாறுதல்களைக் காண முடியவில்லை.,False
3247,தேரை வட மொழியாளர்கள் இரதம் என்பர்.,False
3248,தேர்கள் பெரும்பாலும் மரத்தாலே செய்யப்படும் மிக அபூர்வமாக வெள்ளித் தேர்களும் பொற்றேர்களும் உண்டு.,False
3249,தேர்களில் தான் தச்சர்களின் மிக நுண்ணிய வேலைப்பாடுகள் துலங்கும்.,False
3250,தேர்களில் உருளை முதல் வரை இருக்கும்.,False
3251,தமிழ் நாட்டில் திருவாரூர்த் தேர் அழகுள்ளது.,False
3252,சிரிவில்லிப்புத்தூர் தேர் மிகப் பெரியது.,False
3253,"மதுரை, திருநெல்வேலி, திருச்செந்தூர் தேர்களும் பெரியவைகள்தான்.",False
3254,தேர் ஓட்டும் கலை சிறப்பானது.,False
3255,எல்லோரா லும் தேர் ஓட்ட முடியாது.,False
3256,தேர் புறப்பட்டபின் நிலைக்குக் கொண்டு சேர்த்தல் மிகச் சிரமம்.,False
3257,ஆயிரக்கணக்கான மக்கள் ஒன்று சேர்த்து ஒருமித்து தேரின் முன்னுள்ளபெரிய வடத்தைப் பிடித்து இழுக்கவேண்டும்.,False
3258,வெள்ளித் தேர் திருவண்ணாமலை பழனி முதலிய இடங்களில் உண்டு.,False
3259,தேர்கள் செய்வது சுலபமானதன்று.,False
3260,நல்ல சிற்பத்திறன் வாய்ந்தவர்கள்தான் இத்தொழிலில் ஈடுபடவேண்டும்.,False
3261,தேர் பெரிதும் தாமரை அரும்பு வடிவிலே அமைக்கப்படும்.,False
3262,தேர்களில் கொடுஞ்சி என்ற உறுப்பும் அமைக்கப்படும்.,False
3263,நெடுந்தேர்க் கொடுஞ்சி பற்றி நின்றோன் அகம் மணித்தேர்க் கொடுஞ்சி கையாற் பற்றி மணி பூண்ட பொன்னுகக் கொடுஞ்சி .,False
3264,இது ஆய்வதற்குரியது.,False
3265,இதுவும் மிகவும் பொருத்தமாகத் தெரிகின்றது.,False
3266,எங்கு நுழைந்து பார்ப்பினும் தமிழர்களின் நுண்மான் நுழை நயம் சிறப்புற்று ஒளிர்கிறது.,False
3267,இன்னும் பூ வடிவில் செய்த தேர்களும் உண்டு.,False
3268,சாமிநாதையர் பெருங்கதையில் குறிப்பிட்டுள்ளார்.,False
3269,பக்கத்தில் பட்டர்கள் நின்று பூசை செய்வார்.,False
3270,"தேர்கள் துணிகளாலும் பூக்களாலும் வாழை, கமுகு, இளநீர் முதலியவைகளாலும் அணி செய்யப்பட்டிருக்கும்.",False
3271,தேரின் பின்புறம் தேர் இழுப்பதற்கு ஊக்க மூட்டுவதற்காக இருக்கும் நகராவை அடிக்கடி அடிப்பர்.,False
3272,மக்கள் அடிக்கடி அரகர மகாதேவா!,False
3273,தேரின் உயரத்திற்கேற்பத் தேருக்கு முதல் சக்கரங்கள் வரை இருக்கும்.,False
3274,சக்கரங்கள் உறுதியான மரக்கட்டைகளால் செய்யப் பட்டு கனத்த இரும்புப் பட்டைகளால் செய்யப்பட்டிருக்கும்.,False
3275,இந்த சக்கரங்கள் உறுதியான எஃகு அச்சும் அச்சாணிகளையும் உடையனவாய் இருக்கும்.,False
3276,இந்தத் தேர்களில் ஆபாசமான சிற்பங்கள் செய்யப் பட்டுள்ளன.,False
3277,ஏனென்று எமக்குப் புலப்படவில்லை.,False
3278,பழைய தேர்கள் ஓட முடியாத நிலையில் கோயில் அதிகாரிகள் அதை ஏலம் போடுவார்கள்.,False
3279,"வெளி நாட்டினர் அதிலுள்ள சிற்ப அழகுக்கு ஒவ்வொரு பகுதியையும் ,, என்று விலைக்கு வாங்கிச் செல்லுகின்றனர்.",False
3280,தேரின் உறுப்புகள் .,False
3281,பூதப்பார் அச்சின் மேலுள்ள பாகத்தைப் பூதங்கள் தாங்குவது போன்ற அமைப்பு.,False
3282,கன்னிலப்பா முதல் வரிசை திருஉருவங்களின் அமைப்பிற்கு ஆதாரமாயமைந்திருப்பது.,False
3283,கபோதப்பார் திரு உருவங்களின் மேல் அமைப்பாக இருப்பது.,False
3284,கன்னிலப்பாருக்கும் கபோதப்பாருக்கும் இடையில் முதல் வரிசைத் திருஉருவங்கள் உண்டு.,False
3285,ஆனைத் தொட்டிப்பார்.,False
3286,இவ்வாறு திருஉருவங்கள் அமைப்பதற்கு ஆதாரமாய் இருப்பது ஆனைத் தொட்டிப்பார்.,False
3287,அச்சப்பார் தேரின் பட்டங்களை அமைப்பதற்காக விருப்பது.,False
3288,அச்சப்பூத்தலைப்பார் பட்டங்களை அமைப்பதற்கு மேலாக ஆதாரமாய் உள்ளது.,False
3289,பூத்தலைப்பார் மகரக்காய்கள் பூட்டிய பூத்தலைகளை உடையது.,False
3290,இரண்டாவது நிலம் முதல் வரிசைத் திருஉருவங்களுக்குப் பின் இரண்டாவது வரிசைத் திருஉருவங்கள் இதில் உண்டு.,False
3291,உட்பக்கம் ஆனைத் தொட்டிப்பார் சேர்த்து திருஉருவங்கள் உள்ளும் புறமும் இருந்து புலப்படக் கூடியனவாய் அமைந்துள்ளன.,False
3292,இதற்கு அசுவதைப்பார் என்றும் பெயர்.,False
3293,சிம்மப்பூத்தலைப்பார் சிங்கத்தின் உருவத்தையும் பூத்தலையையும் கொண்டு இணைத்த அமைப்பு .,False
3294,மூன்றாவது நிலம் உட்பக்கக் கோணங்களையுடைய ஆனைத்தொட்டிப்பார் இணைத்து வெளித்தோற்றத்தில் திருஉருவங்கள் அமைத்துச் செய்யப்பட்டது.,False
3295,நாகத் தலைப்பார் இது நாகபந்த மாதிரி உள்ள தலைப்புடன் கூடியது.,False
3296,விதாரப்பார் தேரின் பரப்பைக் குறிக்கின்றது.,False
3297,இந்தப் பாகத்துக்கு மான வாசனம் என்றும் பெயர்.,False
3298,"தேவாசனம் தேவர்கள், தேவியை நின்று வழிபடும் இடம் என்ற முறையில் அமைக்கப் பெற்றது.",False
3299,சிம்மாசனம் தேவி வீற்றிருக்கும் ஆசனம் .,False
3300,கம்பங்கள் ஓவிய வேலைப்பாடமைந்த குத்துக் கால்கள்.,False
3301,"பண்டிகை முதற்பண்டிகை, இரண்டாம் பண்டிகை மூன்றாம் பண்டிகை.",False
3302,கர்ண கூடம் .,False
3303,இன்றும் கோயில்கள் மரத்தாலே அமைக்கும் வழக்கம் கேரள நாட்டில் இருந்து வருகிறது.,False
3304,"முற்காலத்தில் நமது நாட்டில் தேக்கு கோங்கு, வேங்கை, கருங்காலி, ஆச்சா முதலிய மரங்கள் செதுக்கு வேலைகளுக்கு பொருத்தமானவைகளாய் இருந்தன.",False
3305,இம்மரங்கள் வைரம் பாய்ந்தவை உரமானவை உறுதி வாய்ந்தவை கரையான் அண்மையில் நெருங்காதவை.,False
3306,அக்காலத்தில் சிப்பிசுண்ணத்தினால் சுவர்களைப் பூசி அரிய சிற்ப வேலைப்பாடு களைச் செய்து வந்தனர்.,False
3307,"மரத்தச்சர்கள் பதுமைகளையும், மலர் களையும், செடிகொடி,சிலைகளையும் மரத்திற் செதுக்குவதில் கைதேர்ந்தவர்களாய் விளங்கினர்.",False
3308,இந்த வாகனங்களை யெல்லாம் அழகு பெறச் செய்வதற்கு தேர் செய்வதில் பட்டறிவும் சிற்ப நூற் பயிற்சியுமுடைய தபதிகளினாலேதான் முடியும்.,False
3309,அவர்களுக்கு ஓரளவு ஆகம விதியும் தெரியும்.,False
3310,"தேரின் தத்துவம் ஏழாம் நாளிலே, இரதாரோகண காட்சியுண்டாம் இது சில கோயில்களில் ஒன்பதாம் நாளிலும் நடக்கும்.",False
3311,மானசாரம் .,False
3312,ஆனந்தவிகடன் மலர் .,False
3313,கல்கி மலர் .,False
3314,கலைக் களஞ்சியம் .,False
3315,"மக்களினம் தொல் பழங் காலத்தில் மலைகளிலும், காடுகளிலும் வாழ்ந்து வந்தனர்.",False
3316,அவர்கள் விலங்குகளோடு விலங்குகளாய் வாழ்ந்து வந்தனர்.,False
3317,அக்காலத்தில் விலங்குகள் மக்களை எளிதில் கொன்று தின்று வந்தன.,False
3318,அவைகளின் இயற்கையான உடல் அமைப்பே காடுகளில் உள்ள பிற உயிரினங்களை வேட்டையாடுவதற்கு ஏற்றதாக அமைந்திருந்தன.,False
3319,மக்கள் இனத்தின் உடல் அமைப்பு அத்தகைய வலுவுடையதாக அமையவில்லை.,False
3320,அதன் உடல் அமைப்பு உறுதியாக அமைந்திருக்கவில்லை.,False
3321,அதன் உடம்பின் தோல் மெல்லியதாக உள்ளது.,False
3322,"அதன் கால்களும், கைகளும், பற்களும் விலங்குகளோடு போரிடுவதற்கு ஏற்றதாக இல்லை.",False
3323,"எனவே மனிதன், தன் பகைவர்களாகிய விலங்குகளை வெல்ல சிந்தனை செய்ய முனைந்தான்.",False
3324,அவன் அறிவு வளர்ந்தது.,False
3325,விலங்குகளோடு போரிட்டு வெற்றி கொள்ள பல ஆயுதங்களைக் கண்டான்.,False
3326,ஆதியில் மக்கள் கண்ட ஆயுதங்கள் கல்லும் வில்லுமே யாகும்.,False
3327,நாளடைவில் .இவைகளை விருத்தி செய்தான்.,False
3328,"தொடக்க காலத்தில் தந்தை, வேட்டையாடி உயிர் வாழும் பொருட்டு காடுகளில் அலைந்து திரிந்து வந்தான்.",False
3329,அவன் நிலையாக ஓரிடத்தில் நிலைத்து வாழவில்லை.,False
3330,மக்களைக் காப்பாற்ற விலங்குகளை எதிர்த்து அடிக்கடி போரிட்டு வந்தாள்.,False
3331,எனவே அவள் பல்வேறு ஆயுதங்களைப் பெற்றிருந்தாள்.,False
3332,"தாய் இறந்தபின் அவளைப் புதைத்து, அவளுடைய புதைகுழியில் அவளுடைய ஆயுதங்களை வைத்து மக்கள் வழிபட்டு வந்தனர்.",False
3333,இவ்வாறு மக்கள் சமுகத்தில் தாய்த் தெய்வ வழிபாடும் ஆயுத வழிபாடும் எழுந்தன.,False
3334,மனிதன் தெய்வ உருவங்களை அமைக்கும் பொழுது உலகிலுள்ள உயிரினங்களில் உயர்ந்த அறிவைப் பெற்ற மனித உருவிலே அமைத்தான்.,False
3335,அப்பால் அரசன் வடிவிலும் அமைத்தான்.,False
3336,"கண்களும், தலைகளும், கைகளும் தெய்வங்களின் ஆற்றலைக் காட்டுவதாக அமைந்தன.",False
3337,"இந்து சமயத்தில் பெருந்தெய்வங்கள் ஒன்றிற்கு மேற்பட்ட தலைகளையும், இரண்டிற்கு மேற்பட்ட கைகளையுடையதாகவும் கற்பிக்கப்பட்டது.",False
3338,கைகளுக்கு ஏற்ப ஆயுதங்களும் அதிகமாக்கப் பெற்றன.,False
3339,அவைகளுட் சில அடியில் வருமாறாகும் .,False
3340,"மான், .",False
3341,"பரசு, .",False
3342,"சூலம், .",False
3343,"அங்குசம், .",False
3344,"பாசம், .",False
3345,"வச்சிரம், .",False
3346,"சக்தி, .",False
3347,"சங்கு, .",False
3348,"சக்கரம், .",False
3349,"கதை, .",False
3350,"வில்லு, .",False
3351,"அம்பு, .",False
3352,"வாள், .",False
3353,"கேடயம், .",False
3354,"குக்குடம், .",False
3355,"கொடி, .",False
3356,"கமண்டலம், .",False
3357,"தாமரை, .",False
3358,"நீலோற்பலம், .",False
3359,"வேல், .",False
3360,"கட்வாங்கம், .",False
3361,"நெருப்பு, .",False
3362,ஒரு திரு உருவத்தில் திகழும் ஆயுதங்கள் ஏனையத் திருஉருவத்தில் காணப்படுவதில்லை.,False
3363,சத்தி உருவத்தின் கரங்களில் காணப்படும் ஆயுதங்கள் சில சிவனது உருவங்களில் காணப் படுகின்றன.,False
3364,திருமால் உருவங்களில் வேறு ஆயுதங்களும் முருகன் திருக்கரங்களில் வேறு சில ஆயுதங்களும் காணப்படுகின்றன.,False
3365,கைகளிலுள்ள ஆயுதங்களைக் கொண்டு திருஉருவங்கள் எந்த மூர்த்தத்தை உடையது என்று தீர்மானிக்க முடியும்.,False
3366,"தெய்வத் திருஉருவங்கள், நிற்றல், இருத்தல், கிடத்தல் ஆகிய திருக்கோலங்களைக் கொண்டு பல பெயர்களைப் பெற்றுள்ளன.",False
3367,தானகமூர்த்தி நிற்கும் தோற்றம் உடையது நிருத்த மூர்த்தி தாண்டவம் ஆடும் தோற்றம் வாய்ந்தது.,False
