Line Number,Sentence
704,இப்பெயருடைய தலைச்சங்கப் புலவர் பலர் இருந்தனர் என்று இறையனார் அகப்பொருள் உரை கூறுகின்றது.
705,கழஞ்சு ஏருடைய விழுக் கழஞ்சிற் சீருடைய இழை பெற்றிசினே என்னும் புறப்பாட்டடிகளில் கழஞ்சு பயின்று வருகிறது.
706,"ஆகவே, ஒன்றேகால் வராகனெடைகொண்டது ஒரு கழஞ்சு என்பது நன்கு துணியப்படும்."
707,இது பண்டைத் தமிழ்மக்களுடைய வரலாறுகளையும் வழக்க ஒழுக்கங்களையும் நம்மனோர்க்கு நன்குணர்த்தும் பெருமை உடையது.
708,காலஞ்சென்ற பேராசிரியர் பெ.
709,"இதில் ஆற்றுப்படைகளாக வுள்ளவை, திருமுருகாற்றுப் படை, சிறுபாணாற்றுப் படை, பெரும்பாணாற்றுப்படை, மலைபடுகடாம் என்பன."
710,"எஞ்சியவை முல்லைப் பாட்டு, மதுரைக் காஞ்சி, நெடுநல்வாடை, குறிஞ்சிப்பாட்டு, பட்டினப் பாலை ஆகிய ஐந்தும் ஆகும்."
711,இப்பாடல்களைத் தன்பாற் கொண்ட பத்துப்பாட்டு கி.பி.
712,இரண்டாம் நூற்றாண்டிலாதல் அதற்கு முன்னராதல் தோன்றியிருத்தல் வேண்டும் என்பது அறிஞர்களது கொள்கை.
713,தமிழ் நாட்டில் கோயில் சுவர்களில் பொறிக்கப் பெற்றுள்ள தமிழ்க் கல்வெட்டுக்கள் கி.பி.
714,ஏழாம் நூற்றாண்டு முதல்தான் காணப்படுகின்றன.
715,"ஆகவே, தமிழ்க் கல்வெட்டுக்கள் எல்லாம் பத்துப்பாட்டிற்குக் காலத்தால் மிகப் பிற்பட்டனவே யாம்."
716,"எனினும், பத்துப்பாட்டும் கல்வெட்டுக் களும் தமிழ் மக்களுடைய வரலாறுகளை யுணர்த்துவதில் தம்முள் ஒற்றுமையுடையனவேயாம்."
717,"இனி, கல்வெட்டுக்களால் விளக்கமுற்று உறுதி யெய்தும் பத்துப்பாட்டுச் செய்திகளுள் சிலவற்றைக் காண்போம்."
718,ல் வரையப்பெற்ற கல்வெட்டொன்று கூறுகின்றது.
719,அகவற் பாவில் அமைந்துள்ள அக் கல்வெட்டுப் பகுதி.
720,"ஏஐஐ, சூடி."
721,"என்பதாம், ."
722,மாறவர்மன் சுந்தரபாண்டியன் கி.பி.
723,திருவண்ணாமலையில் கி.பி.
724,"ஏஐஐ, சூடி."
725,"இந் நவிரமலை இக்காலத்தில் திருவண்ணாமலைக்கு வடமேற்கே திரிசூலகிரி, பர்வதமலை என்ற பெயர்களுடன் உளது."
726,மலை படுகடாத்தில் நன்னன் குன்றுசூழ் இருக்கை நாடு கிழவோன் என்று பெருங்கௌசிகனார் என்ற புலவர் பெருமானால் பாராட்டப் பெற்றுள்ளனன்.
727,மலைபடுகடாத்தின் ஆசிரியராகிய பெருங்கௌசிகனாரது பெருங் குன்றூர் இரணியமுட்ட நாட்டிலுள்ளதோர் ஊராகும்.
728,"ஐஐஐ, சூடி."
729,"எனவே, பெருங்கௌசி கனாருடைய பெருங்குன்றூரும் அப்பதியில்தான் இருத்தல் வேண்டும் என்பது திண்ணம்."
730,"ஆகவே, அக் கவிஞர் கோமான் பாண்டி நாட்டுப் புலவர் என்பது உணரற்பாலதாம்."
731,"இதுகாறும் பத்துப்பாட்டுச் செய்திகளுள் சில, கல்வெட்டுக்களின் துணைகொண்டு விளக்கப் பெற்றமை உணர்க."
732,"பதிற்றுப்பத்தும் பதிகங்களும் அண்ணாமலைப் பல்கலைக் கழகத்தில் தமிழாராய்ச்சிப் பகுதியில் விரிவுரையாளராகவுள்ள என்னுடைய அரிய நண்பர், திருவாளர் ஓளவை."
733,துரைசாமிப்பிள்ளை அவர்கள் எட்டுத் தொகை நூல்களுள் ஒன்றாகிய பதிற்றுப்பத்துக்குச் சிறந்த புத்துரை யொன்று எழுதி வந்தார்கள்.
734,"அதற்கேற்ப, சைவசித்தாந்த நூற்பதிப்புக் கழகத்தின் செயற்றலைவரும் என்னுடைய நண்பருமாகிய திருவாளர் வ."
735,சுப்பையாப்பிள்ளை யவர்கள் அந் நூலைப் பிள்ளையவர்களது உரையுடன் வெளியிடும் பணியை ஏற்றுக் கொண்டு அதனை நிறைவேற்றினார்கள்.
736,பிள்ளையவர்கள் பதிற்றுப்பத்தின் பதிகங்களைப் பற்றி ஒரு கட்டுரை வரைந்து தருமாறு கூறினார்கள்.
737,அதனை ஏற்றுக் கொண்ட யான் அடியிற் காணும் கட்டுரையை எழுதியுள்ளேன்.
738,சங்கத்துச் சான்றோர் இயற்றியுள்ள தொகை நூல்களுள் பதிற்றுப்பத்தும் புறநானூறும் தனிச் சிறப்புடையனவாகும்.
739,"சுருங்கச் சொல்லுமிடத்து, அவை தமிழ்நாட்டின் பழைய வரலாற்று நூல்கள் என்று கூறுவது எவ்வாற்றானும் பொருந்தும்."
740,"புறப்பொருளைப் பற்றுக் கோடாகக் கொண்டெழுந்த அவ்விரு நூல்களுள் பதிற்றுப்பத்து எனப்படுவது, சேரமன்னர் பதின்மர்மீது பாடிய ஒரு தொகை நூல்."
741,"ஒவ்வொரு பத்தும், பத்துப் பாடல்களைத் தன்னகத்துக் கொண்டது."
742,"ஆகவே ஒவ்வொரு பத்தின் இறுதியிலுள்ள பதிகமும், உரைநடைப் பகுதியும் வரலாற்றாராய்ச்சிக்குப் பெரிதும் பயன்படும் என்பதும் ஒருதலை."
743,"கல்வெட்டுக்களில் முதலில் மெய்க்கீர்த்தி எழுதத் தொடங்கியவன், முதல் இராசராச சோழன் ஆவன்."
744,அந்நிகழ்ச்சியும் அவ்வேந்தனது எட்டாம் ஆட்சியாண்டாகிய கி.பி.
745,ல் தான் முதலில் நிகழ்ந்துள்ளது.
746,எனவே மெய்க் கீர்த்தியைப் பின்பற்றிப் பதிற்றுப்பத்தில் பதிகங்கள் அமைக்கப் பெற்றிருந்தால் அவை கி.பி.
747,பத்தாம் நூற்றாண்டிற்குப் பிறகு இயற்றப்பட்டனவாதல் வேண்டும்.
748,ஆனால் பதிற்றுப் பத்தில் பதிகங்கள் இறுதியிலுள்ளன கல்வெட்டுக்களில் மெய்க்கீர்த்திகள் தொடக்கத்தில் உள்ளன.
749,"எனவே, கி.பி."
750,இக் கொள்கை உறுதியெய்துமாயின் கி.பி.
751,பத்தாம் நூற்றாண்டிற்கு முன்னரே பதிகங்கள் இயற்றப் பெற்றுப் பதிற்றுப்பத்தும் தொகுக்கப்பட்டனவாதல் வேண்டும்.
752,பதிகங்களுக்கும் உரை காணப்படுகின்றமையால் அவை உரையாசிரியர் காலத்திற்கு முற்பட்டவை என்பது திண்ணம்.
753,அவ்விரு மரபினரும் தாயத்தினர் ஆவர்.
754,அவர்களுள் எண்மரே இப்பொழுது கிடைத்துள்ள எட்டுப் பத்துக்களின் பாட்டுடைத் தலைவர்கள் என்பது உணரற்பாலதாம்.
755,இரண்டாம் பத்தின் தலைவன் இமயவரம்பன் நெடுஞ் சேரலாதன் உதியஞ் சேரலுடைய மகன் என்பது பதிகத்தால் அறியப் படுகிறது.
756,"ஆகவே, இந்நாளில் கிடைக்காத முதல்பத்து, நெடுஞ்சேரலாதன் தந்தையாகிய உதியஞ்சேரலின் மீது பாடப் பட்டதாயிருத்தல் வேண்டும்."
757,மூன்றாம் பத்தின் தலைவன் பல்யானைச் செல்கெழுகுட்டுவன் என்போன் நெடுஞ்சேரலாதனுக்குத் தம்பியாவன்.
758,"ஏழாம்பத்தின் தலைவன் செல்வக் கடுங்கோவாழி யாதன் என்பான், அந்துவஞ்சேர லிரும்பொறையின் மகன் ஆவன்."
759,"எட்டாம் பத்தின் தலைவன் தகடூரெறிந்த பெருஞ்சேரலிரும் பொறை என்பவன், செல்வக் கடுங்கோவின் புதல்வன் ஆவன்."
760,ஒன்பதாம் பத்தின் தலைவன் இளஞ்சேரலிரும்பொறை என்போன் பெருஞ்சேரலிரும்பொறையின் மகன் ஆவன்.
761,அதனை ஒருதலையாகத் துணிதற்கு இயலவில்லை.
762,"ஆகவே, அஃது இன்னும் ஆராய்தற்குரிய தொன்றாகும்."
763,"இனி, அச் சேரமன்னர் தம்மைப் பாடிய புலவர் பெரு மக்கட்கு வழங்கியுள்ள பரிசில்களை நோக்குவாம்."
764,அந்தணர்க்குக் கொடுக்கப்படும் இறையிலி நிலங்களே பிரம தாயம் என்று சொல்லப்படும்.
765,அவை பிரமதேயம் எனவும் பட்டவிருத்தி எனவும் முற்காலத்தில் வழங்கப்பட்டன என்பது பல கல்வெட்டுக்களால் அறியக்கிடக்கின்றது.
766,ஒரே காலப் பகுதியில் சேர நாட்டிலிருந்த இவ்விரு வேந்தர்களின் பெருங்கொடைத்திறம் யாவர்க்கும் இறும்பூதளிக்கும் இயல்பின தாகும்.
767,இவ்வேந்தன் இறுதியில் துறவுபூண்டு காடு போந்தனன் என்பர்.
768,"களங்காய்க்கண்ணி நார்முடிச்சேரல், காப்பியாற்றுக் காப்பியனார்க்கு நாற்பது நூறாயிரம் பொன்னும் தான் ஆளுவதிற் பாகமும் அளித்தான்."
769,"இவன் தம்பி ஆடுகோட் பாட்டுச் சேரலாதன், காக்கைபாடினியார் நச்செள்ளையார்க்கு அணிகலனுக்காக ஒன்பது துலாம் பொன்னும் நூறாயிரம் பொற்காசும் வழங்கினான்."
770,இவர்களுள் பின்னோன் மேல் கடற்கரையிலிருந்த தொண்டியைத் தலைநகராகக் கொண்டு அதனைச் சூழ்ந்த நிலப்பரப்பை ஆட்சி புரிந்தனன் என்று தெரிகிறது.
771,இவன் தன் புதல்வன் அப்புலவர் பெருமான்பால் கற்று வல்லனாதலை விரும்பி அங்ஙனம் அளித்தனன் போலும்.
772,"தகடூர் எறிந்த பெருஞ்சேரலிரும்பொறை, அரிசில் கிழார்க்கு ஒன்பது நூறாயிரம் பொற்காசும், தன் அரசு கட்டிலையும் வழங்கினான்."
773,"அப் புலவர்பிரன் அரியணையை ஏற்றுக் கொள்ளாமல், நீ அரசு வீற்றிருந்தாளுக என்று கூறி, இவனுக்கு அமைச்சுரிமை பூண்டனர்."
774,"இளஞ்சேர லிரும்பொறை, பெருங்குன்றூர் கிழார்க்கு முப்பத்தீராயிரம் பொற்காசும், அவர் அறியாமல் ஊரும் மனையும் வளமுற அமைத்துக் கொடுத்தான்."
775,இவ்வுண்மை ஒன்பதாம் பத்தின் இறுதியிலுள்ள உரைநடைப் பகுதியால் உறுதியெய்துதல் அறியத்தகக்து.
776,"இனி, பதிற்றுப்பத்திலுள்ள பாடல்களுக்குப் பெயர்கள் இடப் பெற்றிருத்தலைப் பதிகங்களின் இறுதியிற் காணலாம்."
777,அப்பெயர்கள் எல்லாம் ஒவ்வொரு பாட்டிலும் காணப்படும் பொருள் நயம் பொருந்திய அருந் தொடர்களாக இருத்தல் அறியத்தக்கது.
778,அவர்களுள் தொடித்தலை விழுத்தண்டினார்.
779,அவர்கள் பாடல்களில் காணப்படும் அருந்தொடர்கள் அன்னோரின் இயற்பெயர்களை மறக்கும்படி செய்து விட்டமை உணரற்பாலதாம்.
780,"அவ்வேந்தர்கள் பால் அமைச்சர்களாகவும், படைத்தலைவர்களாவும் பிற அதிகாரி களாகவும் திகழ்ந்து நாட்டிற்கு நலம் புரிந்தவர்கள் பலர் ஆதல் வேண்டும்."
781,அவர்களது வீரச் செயல்களும் கொடைச்சிறப்பும் அருந்தொண்டுகளும் நம் தமிழகத்திலுள்ள கோயில்களில் காணப்பெறும் கல்வெட்டுக்களால் இன்றும் அறியக் கிடக் கின்றன.
782,"வச்சத் தொள்ளயிரம், அரும்பைத் தொள்ளாயிரம், புதுவைக் காங்கேயன் நாலாயிரக்கோவை முதலியன இவ்வகையைச் சேர்ந்தனவேயாம்."
783,அத்தகைய பிரபந்தங்களுள் விக்கிரமசோழன் உலாவும் ஒன்றாகும்.
784,இதனை இயற்றியவர் கவிச் சக்கரவர்த்தியாகிய ஒட்டக்கூத்தர் ஆவர்.
785,இது முதற் குலோத்துங்க சோழன் புதல்வனாகிய விக்கிரமசோழன்மீது பாடப்பெற்றது.
786,அங்ஙனம் கூறுமிடத்துச் சில அரசியல் தலைவர்களின் பெயர்களை நிரல்பட வைத்து அன்னோரது வீரச்செயல்களையும் பெருமைகளையும் மிகப் பாராட்டிச் செல்கின்றனர்.
787,என்னும் பெரும்போர் இகல்வேந்தர் மண்டலிகர் முன்னு மிருமருங்கு மொய்த்தீண்ட என்னும் விக்கிரம சோழனுலாவடிகளிற் காண்க.
788,இதில் குறிக்கப்பெற்ற தலைவர்கள் எல்லோரும் விக்கிரம சோழன் ஆட்சிக்காலத்தில் விளங்கியவர்கள் என்பதில் சிறிதும் ஐயமில்லை.
789,அவர்களைப் பற்றி இந்நூலால் அறியக்கூடியது இவ்வளவேயாகும்.
790,"ஆயினும், விக்கிரமசோழன் காலத்திய கல்வெட்டுக்களின் துணை கொண்டு அவர்களைப் பற்றிய செய்திகளை நாம் ஆராய்தல் அமைவுடையதேயாம்."
791,"இனி, இவ்வுலா எழுதப் பெற்ற காலத்தை ஒருவாறு உய்த்துணர்வதற்கு இடமுண்டு."
792,இவ்வுலாவிற் குறிக்கப் பெற்ற தலைவர்களுள் காலிங்கர்கோன் என்பானும் ஒருவன் என்பதும் மேலே காட்டியுள்ள பகுதியினால் நன்கு விளங்கும்.
793,இவன் மணவிற்கூத்தனான காலிங்கராயன் எனவும் அரும்பையர் கோன் எனவும் அரும்பாக்கிழான் எனவும் வழங்கப் பெற்றனன் என்பது கல்வெட்டுக்களால் அறியப்படுகின்றது.
794,"அதுபற்றியே, கவிச்சக்கரவர்த்தியாகிய ஒட்டக்கூத்தரும் இத் தலைவனைத் தாம் பாடிய உலாவில் உரிய இடத்தில் வைத்துப் பாராட்டு வாராயினர்."
795,இவனது கல்வெட்டுக்கள் விக்கிரம சோழனது ஆட்சியின் ஆறாம் ஆண்டிற்குப் பின்னர் நம் நாட்டில் காணப்பட வில்லை.
796,யாதலின் அவ்வாண்டிற்குப் பிறகு இத்தலைவன் இருந்திலன் என்பது ஒரு தலை.
797,விக்கிரம சோழன் கி.பி.
798,முதல் முடிய பதினெட்டு ஆண்டுகள் ஆட்சி புரிந்தனன் என்பது கல்வெட்டுக்களால் அறியப்படும் செய்தியாகும்.
799,"எனவே, விக்கிரம சோழனது ஆட்சியின் ஆறாம் ஆண்டாகிய கி.பி."
800,க்கு முன்னரே விக்கிரம சோழனுலா இயற்றப்பட்டிருத்தல் வேண்டு மென்பது நன்கு துணியப்படும்.
801,"இனி, அத்தலைவர் களைப் பற்றிய செய்திகளை ஆராய்வோம்."
802,தொண்டைமான் இவன் கலிங்கம் வென்ற கருணாகரத் தொண்டைமானே யாவன் என்பது பரணி மலையத் தருந்தொண்டைமான் என்ற சொற்றொடர்களால் பெறப்படுகின்றது.
803,இவன் உலா இயற்றப் பெற்ற காலத்தில் அரசியல் துறையிலிருந்து விலகியிருத்தல் வேண்டுமென்பது உய்த்து உணரப்படுகின்றது.
804,இவன் முதற் குலோத்துங்க சோழன் காலத்தில் சிறந்த தலைவனாக விளங்கியவன்.
805,அவ் வேந்தனது ஆட்சியில் பிற் பகுதியில் இவன் முதலமைச்ச னாகவும் படைத்தலை வனாகவும் இருந்தவன்.
806,இவனது மனைவியார் அழகிய மணவாளனி மண்டையாழ்வார் எனப்படுவர்.
807,இவ் வம்மையார் காஞ்சியிலுள்ள அருளாளப் பெருமாளுக்கு நுந்தாவிளக்கு ஒன்று வைத்துள்ளமை ஒரு கல்வெட்டால் புலப்படுகின்றது.
808,அஃதிலதேல் இவனைப் பற்றிய சில செய்திகள் மறைந் தொழிந்திருக்கு மென்பது திண்ணம்.
809,அக் கல்வெட்டை அடியிற் காண்க.
810,"ஐஏ, சூடி."
811,முனையர்கோன் இவன் விக்கிரம சோழனது அமைச்சர்களுள் ஒருவன்.
