Line Number,Sentence
872,எண்ணிப் பார்ப்பவர் ஓரிருவர் உளராயின் அவர்க்கு நெஞ்சார்ந்த நன்றி!
873,ஏனையோர் நிலைமை என்ன?
874,தன்னலங் காரணத்தால் பொது நலத்தைக் கொன்று புதைக்கின்றனர் அல்லது சுட்டு எரிக்கின்றனர்.
875,இவர்களைப் போலும் கொலைஞர்கள் உலகில் உளரோ?
876,அறக்கொலைஞர் இவர்களே!
877,பிற உயிர்க் கொலைஞர் அறிவிலாஅருளிலாக் கொலைஞர்!
878,மறைந்து திருடும் திருடரைச் கண்டுபிடித்துத் தண்டிக்கக் காவலாளிகள் உளர்.
879,ஆனால் கண்காண நேரில் திருடிக் கொண்டே வாழும் வெள்ளைச் சட்டைக் கருஞ்சந்தைக் காரர்களைக் குற்றக் கூண்டேற்ற வழியில்லை!
880,வழியிருந்தாலும் வாய்ப்பு இல்லை!
881,"குற்றவாளி ஆக்காமல் இருக்கும் குற்றத்தோடு நிற்காமல், புகழ்ந்து பேசிப் புடைசூழ்ந்து வாழ்வதும் இயற்கையாகி விட்டது."
882,எல்லாம் பணத்தின் திருவிளையாடல்.
883,பண்டமாற்று பணமாற்றாக என்று உருவெடுத்ததோ அன்றே அறத்தின் தலையில் மண் விழுந்துவிட்டது.
884,"அவர்கள் செய்தாலும், அறங்கூறும் பெரியராகிய நடுவர்கள் நீதிபதிகள் செய்தல் கூடவே கூடாது!"
885,நடுவு நிலை நிற்கவேண்டியோர் சிறு பிறழ்ச்சிக்கு உள்ளத்தே இடந்தருவர் ஆயினும் அது பெரும் பெரும் கேடுகளாகச் சூழலாம்.
886,இறைவன் திருமுன்னிலை போல்வது நீதிமன்றம்!
887,அறக் கடவுளே உருக் கொண்டு வந்து திருத்தொண்டு புரிவது போல்வது அவர்கள் பதவி!
888,இத்தகையர் எத்தகு நடுவு நிலை பேணுதல் வேண்டும்?
889,அவர்களின் ஒரு சொல் கொல்லவும் செய்யும் உயிர் ஊட்டவும் செய்யும் என்றால் அச்சொல்லின் மதிப்புத்தான் என்னே!
890,ஆம்!
891,சொல்லே இறைவனாக இருந்தது இறைவனோடு இருந்தது என்னும் மணிமொழிகளைப் போற்றி வாழ்வோரே நடுவு நிலை நாடும் சான்றோர்!
892,இதனை வற்புறுத்த விழைந்த சான்றோர் பலர்.
893,"அவர்களுள் வள்ளுவனார், நடுவு நிலையைக் கண்முன் காட்டும் சமன்கோல் கொண்டு நிலைநாட்டினார்."
894,கூரிய துலைநாக்கு நேர்நின்று செம்மை காட்டுகின்றது.
895,அதுபோல் அறவோர் செந்நாவும் நடுநிற்க வேண்டும்.
896,என்பது அவர்தம் கருத்து.
897,நீதிநெறியில் நெஞ்சம் நிலைத்த சான்றோர் சிலர் ஒரு கற்பனைப் படைப்புச் செய்துளர்.
898,அது நீதி தேவன் குருடன் அவன் கையில் சமன்கோல் இருக்கும் என்பதே.
899,இக்கற்பனை காட்டுவது யாது?
900,கண்ணோட்டம் காட்டி அறந்திறம்பி விடக்கூடாது என்பதேயாம்.
901,அந்த ஓர் அணிகலம் நடுவுநிலை என்பதே என்பது அறநூலின் நடுவுநிலைத் தொகுப்புரை.
902,சமன்செய்து சீர்தூக்கும் கோல்போல் அமைந்தொருபால் கோடாமை சான்றோர்க் கணி.
903,.
904,அடக்கு!
905,அடங்கு!
906,தோட்டக்காரன் தன் தோட்டத்தை எப்படிக் காக்கிறான் என்பதை எண்ணிப் பார்க்கவேண்டும் அல்லது நேரிடையாகக் காணவேண்டும்.
907,அவ்வாறு கண்டோமானால் அவன் காவற் சிறப்பு நமக்கு எத்துணை எத்துணையோ அறிவுகளை வழங்கத் தவறாது.
908,தோட்டக்காவலை ஆராயும் வேளையிலே இரு தோட்டக் காரர்களை எடுத்துக் கொள்ளவேண்டும்.
909,"ஒருவன் நூற்றுக் கணக்கான ஏக்கர் நிலத்திற்கு உரிமையானவன், மற்றொருவன் அவனினும், பன்னூறு பங்கில் ஒரு பங்குகூட இல்லாதவன்."
910,அகன்று பரந்த தோட்டக்காரனுக்கும் காவலில் அக்கறையுண்டு.
911,"எனினும், சுருங்கிய தோட்டக்காரன் அளவுக்கும் பேரக்கறை இல்லை!"
912,"ஓரொரு வேளை பெருந்தோட்டக்காரன் காவலில் தவறினால் கூட, அவன் வாழ்வு கெட்டுவிடாது."
913,ஆனால் சுருங்கிய தோட்டக்காரன் காவலில் சிறிது அயர்ச்சி எய்தினால் போதும் பேரிழப்புக்கு ஆளாவான்.
914,வருவாய் அனைத்தும் பாழானாலும் ஆகலாம்!
915,"இவ்வாறாயின் இருவேறு தோட்டக்காரர்களும் காவல் போற்றுவர் எனினும், வேற்றுமை உண்டு அல்லவா!"
916,"இனிக், காவலை உற்று நோக்குவோம்."
917,இம்மூன்று வழிகளாலும் காப்பதே காவல்!
918,"எந்த ஒரு காவல் நெறி தவறினாலும் வருவாய் கெட்டு, வாழ்வும்வறண்டு போவது உறுதியே."
919,இக்காவல் முறை நமக்கு என்ன வலியுறுத்துகின்றது?
920,நம்மையும் அக்காவல் முறையைக் கைக்கொள்ளுமாறு வலியுறுத்துகின்றது.
921,நாம் எந்தத் தோட்டத்தை இவ்வாறு காப்பது?
922,நம் மனமே தோட்டம் சின்னஞ்சிறிய தோட்டம்!
923,இத் தோட்டத்திற்கும் முன் கண்ட மூவகைக் காவல்களும் வேண்டும்.
924,ஒன்று தவறினாலும் பேரிழப்பேயாம்!
925,மனத்தை உள்ளிருந்து கிளம்பும் கோபம் காமம் முதலாம் உணர்ச்சிகள் கெடுக்கலாம்.
926,"வெளியே யிருந்து பழகும் நண்பர்கள், பார்க்கும் காட்சிகள் ஆய சூழ்நிலைகளும் கெடுக்கலாம்."
927,உள்ளிருந்தே உருவாகி வரும்கருவொடு பற்றிவரும்நோய் நொடிகளும் இயற்பண்புகளாகிய மரபு நிலைகளும் கெடுக்கலாம்.
928,இம்மூன்று வகைக் கேடுகளும் பற்றாமல் தக்க வழித் தக்கவழிக் காத்தோம்பினால் மனநிலம் மாண் நிலம் ஆகும்!
929,ஆங்கு அறப்பயிர் செழிக்க வளரும்!
930,இன்பப் பயன் எளிதில் கிட்டும்!
931,முறைபெறக் காக்க வேண்டுமே!
932,தோட்டத்தைக் காப்பது எளிது ஆகலாம்.
933,மனத்தைக் காப்பது அரிது அல்லவா எனலாம்.
934,ஆம்!
935,மனத்தைக் காத்தல் அரிதினும் அரிது என்றும் சொல்லலாம் அதே வேளையில் எளிதினும் எளிது என்று சொல்லவும் வேண்டும்.
936,அவரவர் உள்ளத் திண்மையைப் பொறுத்ததே அது.
937,"மனக்காவலில் முதற்காவல் மனத்தின் வாயில்களைக் காத்தல் மனவாயில்கள் வாய், கண், மெய், செவி, மூக்கு என்னும் ஐந்துமாம்."
938,இவற்றை எப்படிக் காப்பது?
939,அடக்குதல் வேண்டுமா?
940,அடங்குதல் வேண்டுமா?
941,அடக்குதல் முதல்நிலை அடங்குதல் முடிநிலை.
942,ஒடுக்குதல் முதல்நிலை ஒடுங்குதல் முடிநிலை.
943,"அடக்கி அடக்கி, ஒடுக்கி ஒடுக்கிப் பழகித் தன் இயற்கையாகிவிட்ட காலையில் அடங்குதலும் ஒடுங்குதலும் இயற்கையாகிவிடும்."
944,அடக்குதலும் ஒடுங்குதலும் உள்ள அருமைப்பாடு அடங்கு தலிலும் ஒடுங்குதலிலும் இல்லை.
945,ஏனெனில் பழகிப் பழகி இயற்கையாகிவிடுகிறது.
946,பழகி முதிர்ந்த ஒன்று எளிமையாதல் இயல்பே.
947,"இளங் கன்று தொட்டு நாள் தவறாமல் தூக்கித்தூக்கிப் பழகிவந்த ஒருவன், கன்று காளையான போதும் தூக்கினானாம்."
948,அவனுக்கு நாள் தவறாமல் சிறிதுசிறிதாக வளர்ந்து வந்த பழக்கம் எளி தாயிற்று.
949,ஆனால் புதிதாக ஒருவன் காளையைத் தூக்க முடியுமா?
950,"இத்தகையதுதான் அடக்கமும், காவலும் பிறவும்."
951,அடக்கத்திற்குச் சான்றாகப் பன்றியைக் கூறுவர்.
952,ஆம்!
953,அடக்கத்தில் உயர்ந்துததான் அது.
954,"என்ன நிலை ஏற்பட்டாலும் சரி, பன்றி தன்னை அடைத்திருக்கும் தொழுவத்தில் மலமும் நீரும் கழிக்காது."
955,அதன் உணர்வோடு படிந்துவிட்ட தன்மை இது.
956,பன்றியினும் அடக்கத்திற்குத் தக்க சான்றாவது ஆமையே.
957,அஞ்சி வாழும் உயிர் வகையுள் ஒன்று ஆமை.
958,அது சிறிதளவு அலைப்புஅல்லல்ஏற்படுமாயினும் அஞ்சும்.
959,"அச்சத்தால் தன்னைக் காக்குமாறு தலையையும், கால்களையும் தன் ஓட்டுக்குள் இழுத்துக் கொள்ளும்."
960,இதனைச் சுரித்தல் என்பர் ஆராய்ந்தோர்.
961,ஏன் சுரிக்கிறது?
962,அஞ்சவேண்டிய ஒன்று அடுக்குமானால்.
963,எப்படிச் சுரிக்கிறது?
964,"உணர்ச்சிகளை உள்ளடக்கி, எத்தகைய தாக்குதல் ஏற் பட்டாலும் கேடு நேரா அளவில் கல்லாக இருக்கும் ஓட்டினுள் சுரிக்கிறது."
965,எவற்றைச் சுரிக்கிறது?
966,"நான்கு கால்கள், ஒரு தலை ஆய ஐந்தையும்."
967,இப்பொழுது ஆமையை அடக்கத்திற்குக் காட்டிய பொருத்தம் புலப்படுகிறதா?
968,ஐம்புலன்களை அடக்கிக் காப்பதற்கு ஐந்துறுப்புக்களை அடக்கும் ஆமைபோலும் சான்று உண்டோ?
969,எல்லாரும் செய்யத்தக்க எளிய செயலையும் செய்யாமை சிறுமை!
970,எல்லாரும் செய்தற்கு அரிய செயலைச் செய்வது பெருமை!
971,"பெருமை அடைய விரும்புதலும், விருப்புக்கு ஏற்ப முனைதலும் பெரியர் தன்மை."
972,அடக்குதற்கு அரியதாம் புலன்களை அடக்கிவாழ்தல் பெரியர் தன்மையே!
973,ஆமை முதுகில் அலவன் நண்டு துயில் கொள்ளும் என்கிறது இலக்கியம்.
974,இது பொய்யுரையன்று மெய்யுரையே.
975,"அடக்கிவாழும் ஆமை, வலிய ஓட்டின்மேல் நண்டு உறங்குவது பற்றிக் கவலையுற ஒன்றுமில்லை."
976,அதன் அடக்கம் அவ்வளவு செரிவுடையது.
977,இன்றேல்.
978,நெல்லரிவோர் பல்லரிவாளின் கூர்மழுங்கினால் ஆமை ஓட்டில் தீட்டுவர் என்று இலக்கியம் புனைந்துரைக்குமா?
979,"இவை நாவடங் காமையையும், அடங்கியமையையும் காட்டும்."
980,"இப்படியே பிற அடக்கங்களைக் கொண்டவர்களையும், கொள்ளாதவர்களையும் நாம் நாள்தோறும் கண்டுகொண்டு தானே இருக்கிறோம்."
981,ஊக்கமுடைமை என்பதும் அதுவே!
982,அடக்கமுடைமை எனினும் சரியே!
983,ஒருமையுள் ஆமைபோல் ஐந்தடக்க லாற்றின் எழுமையும் ஏமாப் புடைத்து.
984,.
985,கல்லார் மிக நல்லர் படித்தவனாக நடந்து கொள்ள வேண்டாமா?
986,என்று இடித்துரைப்போரை இன்று எங்கும் காண்கிறோம்.
987,படித்தவனுக்கும் படிக்காதவனுக்கும் என்ன தான் வேற்றுமை பண்பினைத் தராத கல்வியும் ஒரு கல்வியா?
988,என்று வெறுத்துரைப்போரைப் பார்க்கிறோம்.
989,படித்தால் போதுமா?
990,உலகநிலை தெரிய வேண்டாம்?
991,இவற்றில் இருந்து புலனாவது என்ன?
992,கற்றவர்களிடமிருந்து உலகம் பலவற்றை எதிர் நோக்கு கின்றது.
993,அவ்வெதிர் நோக்கத்திற்கு ஏற்பக் கற்றோர்கள் இல்லாதபோது பட்டபாடு எல்லாம் வீண்தானா என்று ஏங்குகிறது.
994,அவ்வேக்கம் தான் சொல் உருக்கொண்டு அடி போடுகின்றது.
995,நிலத்தைத் தரிசாக போட்டிருக்கிறான் ஒருவன்.
996,"மற்றொருவன் பருவம் அறிந்து உழுது பட்டம் அறிந்து விதைத்து, முறையறிந்து பேணி, வருகின்றான்."
997,"வந்தும், கண்ட பயன் ஏதும் இல்லை என்றால் இவனுக்கும் தரிசு போட்டவனுக்கும் என்ன வேற்றுமை?"
998,இவன் முயன்றான்.
999,அவன் முயலவில்லை இவனுக்குப் பயனில்லை.
1000,அவனுக்கும் பயன் இல்லை!
1001,பயனெதிர் நோக்காப் பணி!
1002,"என்பது கல்விக்கும், உழவுக்குமா?"
1003,உழைத்தும் கண்டு முதல் இல்லாதவன் தரிசாகப் போட்டிருந்தால் கூட நன்றாக இருந்திருக்குமே என்று அப்பொழுது எண்ணமாட்டானா?
1004,ஏரும் கலப்பையும் சார்த்தி விடு மாடு வண்டியை விற்றுவிடு என்று எவனேனும் சொல்ல மாட்டானா?
1005,இது இயற்கை தானே!
1006,படித்தவன் படித்தவனாக நட என்று சொல்வதில் என்ன தவறு இருக்கிறது?
1007,குழந்தை தவறும் போது தாய் வருந்துவது இல்லையா?
1008,திட்டுவது இல்லையா?
1009,குழந்தை கெட்டுப்போக வேண்டும் என்பதா அவள் கருத்து?
1010,கற்றவர் மாந்தர் கல்லாதார் விலங்கு என்று கருதும் மன்பதை கற்றும் கல்லாராய் நிற்பவரைக் கடிந்துரைப்பதில் என்ன வியப்பு?
1011,போற்றும் உரிமையுடைய மன்பதைக்குத் தூற்றும் உரிமை மட்டும் இல்லாமல் எப்படிப் போகும்?
1012,அப்படியானால் கற்றவர்களிடமிருந்து மன்பதை எவற்றை எதிர்பார்க்கிறது?
1013,கற்றவர்களிடமிருந்து மன்பதை எத்துணை எத்துணையோ காரியங்களை எதிர்நோக்குகின்றது.
1014,அவற்றுள் எல்லாம் ஒன்றே ஒன்றை மிக எதிர்நோக்குகின்றது.
1015,அந்த ஒன்றும் கற்றோரிடம் அமைந்துவிட்டால் மற்ற எல்லாமும் உடன்வரும் என்று திண்ணிதாய் நம்புகிறது.
1016,அதுவும் உண்மையே!
1017,"இளவேனில் வரவும், தென்றல், வருதலும், குயில் கூவுதலும், தேமா தளிர்த்தலும் தொடர்ந்து நிகழ்வது இல்லையா?"
1018,அந்த ஒன்று எது?
1019,உலகம் எவ்வாறு நடக்கிறது என்பதைப் பின் பற்றி நடத்தல் வேண்டும் என்பதே.
1020,உலகம் என்பது என்ன?
1021,"உயர்ந்தோர் பெரியோர், வழி காட்டுவோர் ஆயோர்களே உலகம்."
1022,பெரியோர்களே உலக வளர்ச்சிக்கும் வாழ்வுக்கும் காரணமானவர்கள்.
1023,அவர்கள் நடைமுறையே உலக நடைமுறை அவர்களைப் பின்பற்றிச் செல்வதே கற்றோர் கடமை கல்விப் பயன்!
1024,நடந்து காட்டுதல் அரிது அதனினும் அரிது நடக்க வேண்டிய நெறிகளை நடைமுறையால் கண்டு நெறிப்படுத்துவது!
1025,"நடப்பதையும், வண்டி ஓட்டிச் செல்வதையும் விட, சாலைக்கு வரைப்படம் தயாரிப்பதும், சாலையமைப்பதும் அரிய செயல்கள் அல்லவா!"
1026,செவ்விய சாலை அமைந்தபின் எளிதாய் இனிதாய் நடக்க வாய்ப்பு இருந்தும் எத்தனைப்பேர் சாலை ஒழுங்கு முறைகளைக் கடைப்பிடிக்கின்றனர்?
1027,பெற்றிருக்கும் பட்டங்களைக் கொண்டு மதிக்கும் இந் நாளையிலே ஒருவன் ஒழுகுமுறை கொண்டு மதிப்பிடுதல் கூடுமா?
1028,என்னும் வினா எழும் எழுதலும் வேண்டும்.
1029,பட்டத்தை மதிக்க வேண்டும் அறிவுடைமை காரணத்தால் பெற்றது ஆகலின்.
1030,அனால் பெற்ற பட்டத்தின் பயன் என்ன?
1031,"பயனில்லாப் பட்டம், சிறார்பட்டம், தம்பட்டம் என்று விடுக!"
1032,பயனில்லா ஒன்றால் பயன்?
1033,உப்புமலைமேல் உட்கார்ந்து இருக்கலாம்.
1034,அங்கே இலைபோட்டும் உண்ணலாம்.
