Line Number,Sentence
1,மயிலை சீனி.
2,வேங்கடசாமி ஆய்வுக் களஞ்சியம் தமிழக ஆவணங்கள் மறைந்துபோன தமிழ் நூல்கள் பதிப்பு வீ.
3,அரசு இளங்கணி பதிப்பகம் நூற்பெயர் மயிலை சீனி.
4,வேங்கடசாமி ஆய்வுக்களஞ்சியம் ஆசிரியர் மயிலை சீனி.
5,வேங்கடசாமி பதிப்பாசிரியர் பேரா.
6,வீ.
7,அரசு பதிப்பாளர் முனைவர் இ.
8,படிகள் மேலட்டை கவி பாஸ்கர் நூலாக்கம் வி.
9,சித்ரா வி.
10,"ஹேமலதா அச்சிட்டோர் ஸ்ரீ வெங்கடேசுவரா ஆப்செட் பிரிண்டர் வடபழனி, சென்னை ."
11,"நூல் கிடைக்குமிடம் தமிழ்மண் பதிப்பகம், , சிங்காரவேலர் தெரு, தியாகராயர் நகர், சென்னை ."
12,.
13,"பதிப்புரை ஆம் நூற்றாண்டின் இறுதிப் பகுதியும், ஆம் நூற்றாண்டின் தொடக்கப் பகுதியும் தமிழுக்கும், தமிழினத்திற்கும் புகழ்பூத்த பொற் காலமாகும்."
14,"தமிழ்மொழியின் மீட்டுருவாக்கத்திற்கும், தமிழின மீட்சிக்கும் வித்தூன்றிய காலம்."
15,தமிழ்மறுமலர்ச்சி வரலாற்றில் ஓர் எல்லைக் கல்.
16,இப் பொற்காலத்தில்தான் அறிஞர் மயிலை சீனி.
17,வேங்கடசாமி அவர்கள் ..இல் தோன்றி ..இல் மறைந்தார்.
18,வாழ்ந்த காலம் ஆண்டுகள்.
19,தமிழ்கூறும் நல்லுலகம் வணங்கத்தக்கவர்.
20,"இவர் எழுதிய நூல்கள் அனைத்தும் தமிழினம் தன்னை உணர்வதற்கும், தலைநிமிர்வதற்கும், ஆய்வாளர்கள் ஆய்வுப் பணியில் மேலாய்வை மேற்கொள்வதற்கும் வழிகாட்டுவனவாகும்."
21,ஆய்வுநோக்கில் விரிந்த பார்வையுடன் தமிழுக்கு அழியாத அறிவுச் செல்வங்களை வைப்பாக வைத்துச் சென்றவர்.
22,தமிழ் தமிழரின் அடையாளங்களை மீட்டெடுத்துத்தந்த தொல்தமிழ் அறிஞர்களின் வரிசையில் குறிப்பிடத்தக்கவர்.
23,"தமிழ்மண்ணில் இல் நடந்த முதல் இந்தி எதிர்ப்புப் போரை முன்னெடுத்துச்சென்ற தலைவர்கள், அறிஞர்கள் வரிசையில் இவரும் ஒருவர்."
24,"வரலாறு, இலக்கியம், கலை, சமயம் தொடர்பான ஆய்வு நூல்களையும், பொதுநலன் தொடர்பான நூல்களையும், பன்முகப் பார்வையுடன் எழுதியவர்."
25,பேராசிரியர் முனைவர் வீ.
26,அரசு அவர்கள் எழுதிய சாகித்திய அகாதெமி வெளியிட்டுள்ள இந்திய இலக்கியச் சிற்பிகள் நூல்வரிசையில் மயிலை சீனி.
27,முறையான தமிழ் இலக்கிய வரலாற்றை இனி எழுதுவதற்கு எதிர்கால ஆய்வாளர்களுக்கு வழிகாட்டிச் சென்றவர் என்பார் கா.
28,சுப்பிரமணியபிள்ளை அவர்கள்.
29,மயிலை சீனி.
30,"வேங்கடசாமி ஆண்டில் இளையவராக இருந்தாலும், ஆராய்ச்சித் துறையில் முதியவர், நல்லொழுக்கம் வாய்ந்தவர்."
31,சென்னைப் பல்கலைக்கழக தமிழ் இலக்கியத்துறைத் தலைவர் வீ.
32,அவருக்கு எம் நன்றி.
33,இவ்வருந்தமிழ்ச் செல்வங்களை அனைவரும் வாங்கிப் பயனடைய வேண்டுகிறோம்.
34,இவ்வாராய்ச்சி நூல்கள் எல்லா வகையிலும் சிறப்போடு வெளி வருவதற்கு உதவிய அனைவர்க்கும் நன்றி.
35,இந்நூல்களில் காணப்படும் பல்வேறு தகவல்கள் புதியனவாக அமைந்திருப்பதைக் காண்கிறோம்.
36,மேலும் தமிழில் உருவான நூல்கள் பல பெயரளவில் மட்டும் பதிவாகி யிருப்பதையும் காணமுடிந்தது.
37,இவ்வகைப் பதிவுகளைக் கண்ட மயிலை சீனி.வேங்கடசாமி அவர்கள் அவற்றைத் தொகுத்து உருவாக்கியதே மறைந்துபோன தமிழ்நூல்கள் எனும் இத்தொகுதியாகும்.
38,யாப்பருங்கல விருத்தி உரையில் பல நூல்களின் பெயர்கள் இடம்பெற்றுள்ளன.
39,ஆனால் அந்நூல்கள் புழக்கத்தில் இல்லை.
40,அதைப்போலவே யாப்பருங்கலக் காரிகை போன்ற நூல்களுக்கு உரை எழுதிய உரையாசிரியர்கள் பல்வேறு நூல்களின் பெயர்களைக் குறிப்பிடுகிறார்கள்.
41,சிலப்பதிகாரத்திற்கு உரையெழுதிய அடியார்க்கு நல்லார் பல நூல்களைக் குறிப்படுகிறார்.
42,அவை புழக்கத்தில் இல்லை.
43,இவ்வகையில் காணப்படும் நூல்களின் பட்டியலை இந்நூலில் மயிலை சீனி.
44,வேங்கடசாமி குறிப்பிடுகிறார்.
45,வாய்மொழி மரபிலோ அல்லது சுவடியாகவோ இருந்த இந்நூல்கள் அழிந்துவிட்டன.
46,ஆனால் அந்நூற்செய்திகளைப் பிற்கால நூலாசிரியர்களும் உரையாசிரியர்களும் எடுத்துப் பயன்படுத்தி யுள்ளனர்.
47,சுமார் இரண்டாயிரத்து ஐந்நூறு ஆண்டுகள் பழமையுள்ள தமிழ்மொழி மற்றும் இலக்கிய மரபில் இவ்வகையான நிகழ்வு சாத்தியமே.
48,ஆனால் மறைந்து போனவற்றில் எஞ்சியுள்ளவற்றை பதிவு செய்வது அவசியம்.
49,அப்பணியை மயிலை சீனி.வேங்கடசாமி அவர்கள் சிறப்பாகச் செய்துள்ளார்.
50,இத்தொகுப்புகள் உருவாக்கத்தில் தொடக்க காலத்தில் உதவிய ஆய்வாளர்கள் மா.
51,"அபிராமி, ப."
52,சரவணன் ஆகியோருக்கும் இத்தொகுதிகள் அச்சாகும் போது பிழைத்திருத்தம் செய்து உதவிய ஆய்வாளர்கள் வி.
53,"தேவேந்திரன், நா."
54,கண்ணதாசன் ஆகியோருக்கும் நன்றி.
55,சென்னை தங்கள் ஏப்ரல் வீ.
56,அரசு தமிழ்ப்பேராசிரியர் தமிழ் இலக்கியத்துறை சென்னைப் பல்கலைக்கழகம் அறிஞர் மயிலை சீனி.
57,இப்படியான தோற்றத்துடன் சென்னை மியூசியத்தை அடுத்த கன்னிமாரா லைப்ரெரியை விட்டு வேகமாக நடந்து வெளியே வருகிறாரே!
58,அவர்தான் மயிலை சீனி.
59,வேங்கடசாமி அவர்கள். எழுத்தாளர் நாரண.
60,"துரைக்கண்ணன் அவர்களின் மேற்கண்ட விவரிப்பு, அறிஞர் மயிலை சீனி."
61,வேங்கடசாமி அவர்களைக் கண்முன் காணும் காட்சி அனுபவத்தைத் தருகிறது.
62,"திருமணம் செய்து கொள்ளாமல், இல்லறத் துறவியாக வாழ்ந்தவர்."
63,"எண்பதாண்டு வாழ்க்கைக் காலத்தில், அறுபது ஆண்டுகள் முழுமையாகத் தமிழியல் ஆய்வுப் பணிக்கு ஒதுக்கியவர்."
64,இருபதாம் நூற்றாண்டில் பல புதிய தன்மைகள் நடைமுறைக்கு வந்தன.
65,அச்சு எந்திரத்தைப் பரவலாகப் பயன்படுத்தும் வாய்ப்பு உருவானது.
66,சுவடிகளிலிருந்து அச்சுக்குத் தமிழ் நூல்கள் மாற்றப் பட்டன.
67,"இதன்மூலம் புத்தக உருவாக்கம், இதழியல் உருவாக்கம், நூல் பதிப்பு ஆகிய பல துறைகள் உருவாயின."
68,இக் காலங்களில்தான் பழந்தமிழ் நூல்கள் பரவலாக அறியப்பட்டன.
69,"இலக்கிய, இலக்கணப் பிரதிகள் அறியப்பட்டதைப்போல், தமிழர்களின் தொல்பழங்காலம் குறித்தும் பல புதிய கண்டுபிடிப்புகள் வெளிவந்தன."
70,பிரித்தானியர் களால் உருவாக்கப்பட்ட தொல்பொருள் ஆய்வுத்துறை பல புதிய வரலாற்றுத் தரவுகளை வெளிக்கொண்டு வந்தது.
71,பாரம்பரியச் சின்னங்கள் பல கண்டறியப்பட்டன.
72,தொல்லெழுத்துக்கள் அறியப்பட்டன.
73,பல்வேறு இடங்களில் எழுதப்பட்ட கல்வெட்டுக்கள் படி எடுக்கப்பட்டு வாசிக்கப்பட்டன.
74,"தமிழ் மக்களின் எழுத்துமுறை, இலக்கிய, இலக்கண உருவாக்கமுறை ஆகியவை குறித்து, இந்தக் கண்டுபிடிப்புகள் மூலம் புதிதாக அறியப்பட்டது."
75,அகழ்வாய்வுகள் வழிபெறப்பட்ட காசுகள் புதிய செய்திகளை அறிய அடிப்படையாக அமைந்தன.
76,"வடக்கு, தெற்கு என இந்தியாவின் பண்பாட்டுப் புரிதல் சிந்துசமவெளி அகழ்வாய்வு மூலம் புதிய விவாதங்களுக்கு வழிகண்டது."
77,"தமிழகச் சூழலில், தொல்பொருள் ஆய்வுகள் வழி பல புதிய கூறுகள் உறுதிப்படுத்தப்பட்டன."
78,மயிலை சீனி.
79,"வேங்கடசாமி அவர்கள் மேலே விவரிக்கப்பட்ட சூழலில்தான், தமது ஆய்வுப் பணியைத் தொடங்கினார்."
80,வேங்கடசாமி சுயமரியாதை இயக்கச் சார்பாளராக வாழ்வைத் தொடங்கினார்.
81,"பின்னர் பௌத்தம், சமணம் ஆகிய சமயங்கள் குறித்த அக்கறை உடையவராக இருந்தார்."
82,"இவ்வகை மனநிலையோடு, தமிழ்ச் சூழலில் உருவான புதிய நிகழ்வுகளைக் குறித்து ஆய்வுசெய்யத் தொடங்கினார்."
83,"கிறித்தவம், பௌத்தம், சமணம் ஆகிய சமயங்கள், தமிழியலுக்குச் செய்த பணிகளைப் பதிவு செய்தார்."
84,இவ்வகைப் பதிவுகள் தமிழில் புதிய துறைகளை அறிமுகப்படுத்தின.
85,"புதிய ஆவணங்கள் மூலம், தமிழ்ச் சமூகப் பண்பாட்டு வரலாறுகளை எழுதினார்."
86,"சங்க இலக்கியப் பிரதிகள், பிராமி கல்வெட்டுகள், பிற கல்வெட்டுகள், செப்பேடுகள் முதலியவற்றை வரலாறு எழுதுவதற்குத் தரவுகளாகக் கொண்டார்."
87,கலைகளின்மீது ஈடுபாடு உடைய மன நிலையினராகவே வேங்கடசாமி இளமை முதல் இருந்தார்.
88,தமிழ்க் கலை வரலாற்றை எழுதும் பணியிலும் தம்மை ஈடுபடுத்திக் கொண்டார்.
89,"கட்டடம், சிற்பம், ஓவியம் தொடர்பான இவரது ஆய்வுகள், தமிழ்ச் சமூக வரலாற்றுக்குப் புதிய வரவாக அமைந்தன."
90,இருபதாம் நூற்றாண்டின் தொடக்க காலங்களில் இந்தியவியல் என்ற வட்டத்திற்குள் தமிழகத்தின் வரலாறும் பேசப்பட்டது.
91,இந்திய வியலைத் திராவிட இயலாகப் படிப்படியாக அடையாளப் படுத்தும் செயல் உருப்பெற்றது.
92,இப் பணியில் தம்மை முழுமையாக ஈடுபடுத்தி யவர் வேங்கடசாமி அவர்கள்.
93,"இன்று, திராவிட இயல் தமிழியலாக வளர்ந்துள்ளது."
94,இவ் வளர்ச்சிக்கு வித்திட்ட பல அறிஞர்களுள் வேங்கடசாமி முதன்மையான பங்களிப்பாளர் ஆவார்.
95,மயிலை சீனி.
96,வேங்கடசாமி அவர்களின் வரலாற்றுச் சுவடுகள் அடங்கிய இந்திய இலக்கியச் சிற்பிகள் மயிலை சீனி.
97,வேங்கடசாமி என்ற நூலை சாகித்திய அகாதெமிக்காக எழுதும்போது இத்தொகுதி களை உருவாக்கினேன்.
98,அப்போது அவற்றை வெளியிட நண்பர்கள் வே.
99,"இளங்கோ, ஆர்."
100,இராஜாராமன் ஆகியோர் திட்டமிட்டனர்.
101,ஆனால் அது நடைபெறவில்லை.
102,அத்தொகுதிகள் இப்போது வெளிவருகின்றன.
103,அந்த வரிசையில் மயிலை சீனி.
104,வேங்கடசாமி அவர்களின் உழைப்பால் விளைந்த அறிவுத் தேடல்களை ஒரே வீச்சில் பொருள்வழிப் பிரித்து முழுமைமிக்க படைப்புகளாக இல் உருவாக்கினேன்.
105,அதனை வெளியிட இளங்கணிப் பதிப்பகம் இப்போது முன்வந்துள்ளது.
106,இதனைப் பாராட்டி மகிழ்கிறேன்.
107,தமிழர்கள் இத்தொகுதிகளை வாங்கிப் பயன்பெறுவர் என்று நம்புகிறேன்.
108,வீ.
109,அரசு மயிலை சீனி.
110,வேங்கடசாமி ஆய்வுகள் சுயமரியாதை இயக்க இதழ்களில் செய்திக் கட்டுரைகளை எழுதுவதைத் தமது தொடக்க எழுத்துப் பயிற்சியாக இவர் கொண்டிருந்தார்.
111,அது இவருடைய கண்ணோட்ட வளர்ச்சியில் குறிப்பிடத்தக்க செல்வாக்கைச் செலுத்தியுள்ளது.
112,"தமிழ் உரைநடை, தமிழ் அச்சு நூல் போன்ற துறைகள் தொடர்பான ஆவணம் அதுவாகும்."
113,பௌத்தம் தமிழுக்குச் செய்த பங்களிப்பை மதிப்பீடு செய்யும் நிலையில் இவரது அடுத்தக் கட்ட ஆய்வு வளர்ந்தது.
114,சமண சமயம் மீது ஈடுபாடு உடையவராக வேங்கடசாமி இருந்தார்.
115,"மணிமேகலை, சீவக சிந்தாமணி, ஆகியவற்றை ஆய்வதின் மூலம் தமிழ்ச் சூழலில் சமண வரலாற்றை ஆய்வு செய்துள்ளார்."
116,சமண சமய அடிப்படைகளை விரிவாகப் பதிவு செய்துள்ளார்.
117,"சமணச் சிற்பங்கள், குறித்த இவரது ஆய்வு தனித் தன்மையானது."
118,பல்வேறு சாசனங்கள் புதிதாகக் கண்டுபிடிக்கப்பட்டன.
119,"ஓலைச் சுவடிகளிலிருந்து இலக்கியங்கள், இலக்கணங்கள் அச்சு வாகனம் ஏறின."
120,இந்தப் பின்புலத்தில் கி.மு.
121,முதல் கி.மு.
122,ஆம் நூற்றாண்டு முடிய உள்ள தமிழ்ச் சமூகத்தின் ஆட்சி வரலாற்றை இவர் ஆய்வு செய்தார்.
123,பல்லவ மன்னர்கள் மூவர் குறித்த தனித்தனி நூல்களைப் படைத்தார்.
124,இதில் தமிழகச் சிற்பம் மற்றும் கோயில் கட்டடக்கலை வரலாற்றையும் ஆய்வு செய்தார்.
125,"அண்ணாமலைப் பல்கலைக்கழக அறக்கட்டளைச் சொற்பொழிவை அடிப்படையாகக் கொண்டு, தமிழ் நூல்களின் கால ஆய்விலும் இவர் அக்கறை செலுத்தினார்."
126,"தொல்காப்பியம், சிலப்பதிகாரம் குறித்த கால ஆய்வில் ச."
127,வையாபுரிப்பிள்ளை போன்றோர் கருத்தை மறுத்து ஆய்வு நிகழ்த்தியுள்ளார்.
128,இச் சொற்பொழிவின் இன்னொரு பகுதியாக சங்கக் காலச் சமூகம் தொடர்பான ஆய்வுகளிலும் கவனம் செலுத்தினார்.
129,சென்னைப் பல்கலைக்கழக அறக்கட்டளைச் சொற்பொழிவில் சேரன் செங்குட்டுவனை ஆய்வுப் பொருளாக்கினார்.
130,இதன் தொடர்ச்சியாக கி.பி.
131,ஆம் நூற்றாண்டுக்கு முற்பட்ட தமிழகத்தின் வரலாற்றைப் பல நூல்களாக எழுதியுள்ளார்.
132,"சேர சோழ பாண்டியர், பல குறுநில மன்னர்கள் குறித்த விரிவான ஆய்வை வேங்கடசாமி நிகழ்த்தியுள்ளார்."
133,இதன் தொடர்ச்சியாகக் களப்பிரர் தொடர்பான ஆய்வையும் செய்துள்ளார்.
134,"இவ் வாய்ப்புகளின் ஒரு பகுதியாக அன்றைய தொல்லெழுத்துக்கள் குறித்த கள ஆய்வு சார்ந்து, ஆய்வுகளை மேற்கொண்டுள்ளார்."
135,ஒவ்வொரு தேசிய இனத்திற்கும் அதன் பாரம்பரியச் செழுமை குறித்த அறியும் தரவுகள் தேவைப்படுகின்றன.
136,இவற்றை ஆவணப் படுத்துவது மிகவும் அவசியமாகும்.
137,மறைந்து போனவற்றைத் தேடும் முயற்சி அதில் முக்கியமானதாகும்.
138,இப் பணியையும் வேங்கடசாமி மேற்கொண்டிருந் தார்.
139,அரிய தரவுகளை இவர் நமக்கு ஆவணப்படுத்தித் தந்துள்ளார்.
140,தமிழர்களின் கலை வரலாற்றை எழுதுவதில் வேங்கடசாமி அக்கறை செலுத்தினார்.
