Line Number,Sentence
1,விருத்தாசலம் பதிப்பாளர் கோ.,False
2,"விருத்தாசலம், பதிப்பாளர் கோ.",False
3,இளவழகன் முதற்பதிப்பு தாள் .கி.,False
4,என்.எஸ்.மேப்லித்தோ அளவு தெம்மி எழுத்து புள்ளி பக்கம் நூல் கட்டமைப்பு இயல்பு சாதாரணம் விலை உருபா.,False
5,"படிகள் நூலாக்கம் பாவாணர் கணினி தி.நகர், சென்னை .",False
6,அட்டை வடிவமைப்பு மு.,False
7,"இராமநாதன், வ.",False
8,"மலர் அச்சிட்டோர் வெங்கடேசுவரா ஆப்செட் பிரிண்டர்ஸ் ஆயிரம் விளக்கு, சென்னை .",False
9,"வெளியீடு தமிழ்மண் பதிப்பகம் , சிங்காரவேலர் தெரு, தியாகராயர்நகர், சென்னை .",False
10,நாவலர் ந.மு.,False
11,வேங்கடசாமி நாட்டார் ஆம் ஆண்டு நினைவு வெளியீடு வல்லுனர் குழு .,False
12,முனைவர் கு.திருமாறன் .,False
13,முனைவர் இரா.கலியபெருமாள் .,False
14,பேராசிரியர் சண்முக.மாரி ஐயா .,False
15,பேராசிரியர் நா.பெரியசாமி .,False
16,முனைவர் பி.தமிழகன் .,False
17,அதுகாரணமாக நாட்டார் ஐயா அவர்கள் தாமே பயின்ற தமிழ்ப் பேராசான் என்று நாட்டு மக்களால் அன்புடன் அழைக்கப் பெற்றார்.,False
18,கல்லூரியில் இல் பணியில் சேர்ந்து வரை இருபத்து இரண்டு ஆண்டுகள் தமிழ்ப் பேராசிரியராகப் பணிபுரிந்தார்.,False
19,அக்கல்லூரி இல் மூடப்பெற்றது.,False
20,நாட்டார் ஐயா அவர்கள் தம்முடைய வாழ்நாளில் அறிஞர் பெருமக்களால் மிகுதியும் மதிக்கப்பெற்றார்.,False
21,மறைமலை அடிகளாரின் மகள் நீலாம்பிகை அம்மையாரின் கணவர் திருவரங்கனார் ஆவார்.,False
22,தொண்டை மண்டலத்தில் வாழ்ந்த குடிமக்களுள் சேக்கிழார் வழிவந்த தொண்டை மண்டல முதலியார்கள் இன்றைக்கும் பெருஞ்சிறப்புடன் வாழ்ந்து வருகின்றனர்.,False
23,இல் சென்னை மாகாணத் தமிழர் மாநாட்டில் நாட்டார் ஐயா அவர்களுக்கு நாவலர் என்னும் பட்டம் வழங்கப்பெற்றது.,False
24,அக்கோயில் நாட்டார் திருக்கோயில் என்று தமிழன்பர்களால் பெருமையுடன் அழைக்கப் பெறுகின்றது.,False
25,"இவ்வாறு நாட்டார் ஐயா அவர்கள் இல் நிறுவ விரும்பிய திருவருள் கல்லூரி, ஆண்டுகள் கழிந்ததற்குப் பிறகு நாவலர் ந.மு.",False
26,"அவை, பின்வருமாறு .",False
27,திரிகடுகம் ந.மு.வே.உரை .,False
28,மணிமேகலை வரலாறு .,False
29,தொல்காப்பிய ஆராய்ச்சிச் சொற்பொழிவுகள் .,False
30,நாவலர் நாட்டார் நாட்குறிப்பு முதலியனவாம்.,False
31,"இவ்வாறு, நாட்டார் ஐயா அவர்கள் எழுதிய நூல்கள் வெளிவந்த ஆண்டுகளைப் பற்றிய விவரம் வருமாறு .",False
32,வேளிர் வரலாற்று ஆராய்ச்சி .,False
33,நக்கீரர் .,False
34,கபிலர் .,False
35,கள்ளர் சரித்திரம் .,False
36,இன்னா நாற்பது .,False
37,களவழி நாற்பது .,False
38,கார் நாற்பது .,False
39,ஆத்திசூடி .,False
40,கொன்றை வேந்தன் .,False
41,வெற்றி வேற்கை .,False
42,மூதுரை .,False
43,நல்வழி .,False
44,நன்னெறி .,False
45,கண்ணகி வரலாறும் கற்பு மாண்பும் .,False
46,சோழர் சரித்திரம் .,False
47,பரஞ்சோதி முனிவர் திருவிளையாடல் புராண உரை .,False
48,அகத்தியர் தேவாரத் திரட்டு உரைத்திருத்தம் .,False
49,தண்டியலங்காரப் பழைய உரைத்திருத்தம் யாப்பருங்கலக்காரிகை உரைத்திருத்தம் .,False
50,கட்டுரைத் திரட்டு முதல் தொகுதி .,False
51,சிலப்பதிகார உரை .,False
52,மணிமேகலை உரை .,False
53,அகநானூறு உரை .,False
54,கட்டுரைத் திரட்டு இரண்டாம் தொகுதி .,False
55,நாவலர் ந.மு.வேங்கடசாமி நாட்டார் இலக்கணக் கட்டுரைகள் .,False
56,நாவலர் ந.மு.வேங்கடசாமி நாட்டார் இலக்கியக்கட்டுரைகள் .,False
57,நாவலர் ந.மு.வேங்கடசாமி நாட்டார் சொற்பொழிவுக் கட்டுரைகள் .,False
58,"இராகவன், பன்மொழிப்புலவர் கா.",False
59,அப்பாத்துரையார் முதலிய தமிழறிஞர்களின் நூல்கள் மற்றும் தொல்காப்பிய பழைய உரைகள் அனைத்தையும் முழுமையாக வெளியிட்ட பெருமைக் குரியவர்.,False
60,அவர் இப்பொழுது நாட்டார் ஐயா அவர்களின் நூல்கள் அனைத்தையும் ஒரு சேர வெளியிடுவது மிகவும் துணிவான செயல் ஆகும்.,False
61,அவரது இந்த முயற்சி இமயமலையைப் பெயர்த்தெடுத்துக் கொண்டுபோய் வங்காள விரிகுடாவில் வைப்பது போன்ற அரிய பெரிய முயற்சி ஆகும்.,False
62,"அவர் வாழ்க, அவர் முயற்சி வெல்க என்று நான் வாயார மனமார வாழ்த்துகின்றேன்.",False
63,".. பேராசிரியர் பி.விருத்தாசலம் நிறுவனர் நாவலர் ந.மு.வேங்கடசாமி நாட்டார் திருவருள் கல்லூரி, கபிலர் நகர், வெண்ணாற்றங்கரை, தஞ்சாவூர் .",False
64,அதனைப் பதிப்பிக்கும் காலத்திலேயே அதைப் பற்றி நன்கறிந்த தி.த.,False
65,கனகசுந்தரம் பிள்ளை ..இல் ஒரு கடிதம் எழுதியுள்ளார்.,False
66,மணிமேகலையில் அச்சிடப் பெற்ற மூன்று படிவங்களைப் பார்த்த பின்னர் அக் கடிதத்தை வரைந்துள்ளார்.,False
67,ஆதலால் இல் சண்முகம் பிள்ளை மணிமேகலையைப் பதிப்பித்தார் என்பது விளங்குகின்றது.,False
68,ஆனால் அப்பதிப்பு நூலைக் காண்டற்கு இயலவில்லை.,False
69,ஆம் ஆண்டில் வெளிவந்த நூலை அறிய முடிகின்றது.,False
70,அதனை மேலே காண்போம்.,False
71,மணிமேகலை மூலம் கையில் கிடைத்துள்ள அளவில் மணிமேகலையின் முதற்பதிப்பு இதுவேயாகும்.,False
72,கயப்பாக்கம் இரத்தின செட்டியார் மைந்தர் முருகேச செட்டியார் சென்னை ரிப்பன் அச்சுக் கூடத்தில் பதிப்பித்தார்.,False
73,வெளியிடப்பெற்ற காலம் விஜயஸ்ரீ தனுர் ரவி எனக் குறிப்பிடப் பெற்றுள்ளது.,False
74,சண்முகம் பிள்ளையின் ஆம் ஆண்டு மணிமேகலைப் பதிப்பையே முருகேச செட்டியார் பதிப்பாசிரியராக இருந்து மீண்டும் பதிப்பித்திருக்கக் கூடும்.,False
75,இந்நூலின் முற்குறிப்பில் விலை அணா என்றுள்ளது.,False
76,பிற்குறிப்பில் விலை ரூ.க.,False
77,"சண்முகனார், மணிமேகலை ஏடுகள் சிலவற்றைக் கொண்டு ஆராய்ந்து மூலத்தை ஒழுங்கு செய்து கொண்டார்.",False
78,மணிமேகலை முப்பது காதைகளிலுமாகப் பாட வேறுபாடுகள் காட்டியுள்ளார்.,False
79,பின்னேயும் சில சுவடிகள் கிடைத்தன.,False
80,அச்சுவடிகளால் மேலும் சில திருத்தங்களும் பாட வேறுபாடுகளும் கிடைத்தன.,False
81,அவ்வகையால் கிடைத்த பாட வேறுபாடுகள் ஆகும்.,False
82,ஆக மொத்தம் பாட வேறுபாடுகள் இவர் பதிப்பில் காட்டப் பெற்றுள்ளன.,False
83,ஆனால் டாக்டர் சாமிநாதையர் பதிப்பில் பாட வேறுபாடுகள் காட்டப் பெற்றுள்ளன.,False
84,"இவற்றால் அவர் எடுத்துக் கொண்ட முயற்சியும், சுவடிப் பெருக்கமும் இனிதின் விளங்கும்.",False
85,மணிமேகலை அரும்பதவுரையுடன் இது டாக்டர் சாமிநாதையர் பதிப்பாகும்.,False
86,நான்கு ஆண்டுகளின் முன்னே திருமயிலை சண்முகம் பிள்ளையின் மணிமேகலை மூலப்பதிப்பு வந்ததைச் சாமிநாதையர் அறிவார்.,False
87,அதனை ஆராய்ந்து பார்த்தார்.,False
88,அதில் திருத்தம் பெறவேண்டிய பகுதிகள் மிகுதியாக இருப்பதை உணர்ந்தார்.,False
89,அவர் தொகுத்து வைத்திருந்த சுவடிகள் அவர் செய்ய வேண்டிய திருத்தங்களை எடுத்துரைத்தன.,False
90,"அன்றியும் அறிஞர்கள் சிலரும் மணிமேகலைப் பதிப்பு, உரையுடன் வெளிவருதலை மிக விரும்பி வலியுறுத்தினர்.",False
91,குறிப்பாக யாழ்ப்பாணம் தி.த.கனகசுந்தரம் பிள்ளை ஏட்டுப் பிரதியில் இருக்கின்றபடியே இருக்கின்றது.,False
92,ஏட்டுப் பிரதியில் இருப்பது இதிலும் நலமென்று சொல்லலாம்.,False
93,"ஏட்டில் சொக்கலிங்கம் என்றிருப்பதை ஒருவர் முழுவதும் கலிங்கமென்று பொருள் பண்ணி வாசித்தபோதிலும், மற்றொருவராவது சந்தர்ப்பம் நோக்கிச் சொக்கலிங்கமென்று வாசிப்பார்.",False
94,இவர்கள் அதனைச் சேரக் கலிங்கமென்று அச்சிலிட்ட தன் பின் ஏட்டைக் காணாதவர்களெல்லாம் சேரக் கலிங்கமென்றுதானே படிக்க வேண்டும்?,False
95,தம் வேட்கையும் அன்பர்கள் தூண்டுதலும் மணிமேகலைப் பதிப்பை விரைவு படுத்தின.,False
96,தமிழ் நூல்களில் பௌத்த சமயம் தொடர்பாக வரும் பகுதிகளைத் தேடித் தொகுத்தார்.,False
97,வீரசோழியத்தில் புத்ததேவனைப் பற்றி வரும் வாழ்த்துப் பாடல்களை எழுதி ஆய்ந்தார்.,False
98,"வடமொழித் தொடர்களில் எழுந்த ஐயங்களை, பெருகவாழ்ந்தான் அரங்காசாரியராலும், திருமலை ஈச்சம்பாடி சதாவதானம் சீனிவாசாசாரியராலும் அகற்றிக் கொண்டார்.",False
99,"இவ்வாறு பல்வேறு அறிஞர்களின் அருந்துணையாலும், தம் அயராமுயற்சியாலும் மணிமேகலை நூல் நுட்பம் கண்டார்.",False
100,அரும்பதவுரை எழுதி அதனுடன் பதிப்பிக்கத் தொடங்கினார்.,False
101,இப்பதிப்பின் செலவை பொ.பாண்டித்துரைத் தேவர் ஏற்றுக்கொண்டார்.,False
102,உடனிருந்து ஆராய்வார்க்குச் சிறுவயல் குறுநிலமன்னர் முத்துராமலிங்கத் தேவர் மாத ஊதியம் வழங்கினார்.,False
103,கொழும்பு பொ.குமாரசாமி முதலியார் அவ்வப்போது தக்க உதவி புரிந்தார்.,False
104,இதன் முதற்பதிப்பு ஆம் ஆண்டிலும் இரண்டாம் பதிப்பு ஆம் ஆண்டிலும் வெளியிடப் பெற்றன.,False
105,இப்பதிப்பு களுக்கு சுவடிகள் ஆராய்வுக்குக் கிடைத்தன.,False
106,ஆராய்ச்சிக்குக் கிடைத்த சுவடிகளில் மிதிலைப்பட்டிச் சுவடியின் சிறப்பு தன்னிகரற்றதாகும்.,False
107,இன்னும் சில காதைகளின் தலைப்பை விரித்து விளக்குமாப் போலவும் இச்சுவடித் தலைப்புகள் இருந்தன.,False
108,மணிமேகலா தெய்வம் சக்கரவாளக் கோட்டமுரைத்து அவளை மணிபல்லவத்துக் கொண்டுபோன பாட்டு என்றும் இவ்வாறே பிறவும் விளக்கம் பெற வந்துள்ளன.,False
109,பாகனேரி தனவைசிய இளைஞர் தமிழ்ச் சங்க வெளியீடாக வெளிவந்தது மணிமேகலை.,False
110,முழுதுறும் உரைப்பதிப்பு.,False
111,உரையாசிரியர் நாவலர் ந.மு.வேங்கடசாமி நாட்டார் அவர்கள்.,False
112,வெளியிட்டவர் வெ.பெரி.பழ.மு.காசிவிசுவநாதன் செட்டியார்.,False
113,விற்பனை உரிமை திருநெல்வேலித் தென்னிந்ததிய சைவசித்தாந்த நூற்பதிப்புக் கழகம் பெற்றிருந்தது.,False
114,விசுவநாதர் கழகத் தலைவராகவும் நெடுங் காலம் இருந்தார் என்பதும் எண்ணத் தக்கதாம்.,False
115,நாவலர் ந.மு.வே.,False
116,அவர்கள் தம் உடல்நலம் குன்றிய நிலையில் மணிமேகலைக்கு உரை எழுதினார்.,False
117,அறிவறிந்த தம் அருமை மகளார் சிவ.பார்வதியம்மையார் தக்காங்கு உதவினார்.,False
118,எனினும் மணிமேகலை முதல் இருபத்தாறு காதைகளுக்கே உரையெழுதி முடிக்கப்பட்ட நிலையில் புகழ்வாழ்வு பெற்றார்.,False
119,ஆதலால் சிலப்பதிகாரத்திற்கு எழுதிய முன்னுரை ஆய்வுரை அருஞ்சொல் அடைவு என்பவை இடம் பெற்றில.,False
120,"இதுகால் பெருமக்கள் அறிவாக்கம் நாட்டுடைமைப் பொருளாக்கப்படுதல் என்னும் நன்னோக்கால், பொதுமை பூத்துப் பொலியும் வளமாக வெளிப்படுகிறது.",False
121,"அவ்வெளிப் பாட்டைச் செய்பவர், தமிழ்மண் பதிப்பக உரிமையாளர் திருமலி கோ.இளவழகனார்.",False
122,"தமிழ்மண், தமிழ்மொழி, தமிழ் இனம் என்னும் முக்காவல் கடனும் முறையாக ஆக்குவதே நோக்காகக் கொண்டவர் இப்பெருமகனார்!",False
123,"நாவலர் தம் முழுதுறு படைப்புகளையும் தமிழுலகம் கூட்டுண்ண வழங்கும் இத்தோன்றல், தொண்டு வழிவழிச் சிறப்பதாக!",False
124,இன்ப அன்புடன் இரா.,False
125,"இளங்குமரன் திருவள்ளுவர் தவச் சாலை திருவளர்குடி அஞ்சல் அல்லூர், திருச்சிராப்பள்ளி தொ.பே.",False
126,நல்ல தமிழ் நூல்களைத் தமிழர்களுக்கு அளிக்கும் போதெல்லாம் எனக்குப் புத்துணர்ச்சியும் பெருமகிழ்வும் ஏற்படுகின்றன.,False
127,பதிப்புத் துறையில் துறைதோறும் மேலும் பல ஆக்கப் பணிகளைச் செய்ய உறுதி கொள்கிறேன்.,False
128,தமிழ்நூல் பதிப்பில் எம் பதிப்பகம் இதுகாறும் ஆற்றிய தமிழ்ப் பணியை எண்ணிப் பார்க்கிறேன்.,False
129,நெஞ்சில் ஒரு நிறைவு.,False
130,இனிச் செய்ய வேண்டிய பணியை எண்ணிப் பார்க்கிறேன்.,False
131,"எனவே, முன்னிலும் வேகமாக என் பதிப்புப் பணிகளைத் தொடர்கின்றேன்.",False
132,தொண்டு செய்வாய்!,False
133,"தமிழுக்கு....., செயல் செய்வாய் தமிழுக்கு......",False
134,",ஊழியஞ் செய் தமிழுக்கு ......., பணி செய்வாய்!",False
135,நாட்டார் யார்?,False
136,"ஆம் நூற்றாண்டின் பிற்பகுதியிலும், ஆம் நூற்றாண்டின் முற்பகுதியிலும் தமிழ்த் தேரை இழுத்த பெருமக்களுள் நாவலர் ந.மு.வே.",False
137,நாட்டார் திருவருள் கல்லூரியின் நிறுவனர் பேராசிரியர் பி.விருத்தாசலனார் ஆவார்.,False
138,அவர் கெடல்எங்கே தமிழின்நலம் அங்கெல்லாம் தலையிட்டுக் கிளர்ச்சி செய்க!,False
139,எனும் பாவேந்தர் வரிகளுக்கு நம்மிடையே இன்று சாட்சியாக வாழ்ந்து கொண்டிருப்பவர் வாழும் தமிழறிஞர்களில் நான் வணங்கும் சான்றோருள் ஒருவர்.,False
140,குமுகாய மாற்றத்துக்கு அடிப்படையானது தாய்மொழி வழிக் கல்வி ஒன்றுதான்.,False
141,இக்கல்விதான் மக்களுக்கு ஊற்றுக் கண்.,False
142,"தாய்மொழியைப் புறக்கணித்த எந்த இனமும் , எந்த நாடும், வளர்ந்ததாகவோ, வாழ்ந்ததாகவோ, செழித்ததாகவோ வரலாறு இல்லை.",False
143,பழந்தமிழ்க் கருவூலமான நாட்டாரின் இவ்வருந்தமிழ்ப் புதையல்கள் தமிழர்கள் இல்லந்தோறும் இருப்பதற்கு உங்களின் பங்களிப்பையும் செய்ய முன் வாருங்கள்.,False
144,"மொழி, இன நாட்டின் அடையாளங்களை மீட்டெடுக்கும் எம் தமிழ்ப் பணிக்குக் கைகொடுத்து உதவுங்கள்.",False
