Line Number,Sentence
1555,"கால அறிவு பெருகுதல் குழந்தை வளரவளர இடத்தால் சேய்மையிலுள்ள பொருள்களைப் போலவே, காலத்தினால் சேய்மையிலுள்ள நிகழ்ச்சிகளும் கவனம் பெறுகின்றன."
1556,முன்னைய அநுபவங்களும் வருங்கால எண்ணங்களும் குழந்தையின் அறிவில் பங்கு கொள்ளுகின்றன.
1557,அவற்றிற்கேற்றவாறு செயல்புரியும் ஆற்றலையும் குழந்தை அடைகின்றது.
1558,குறியீடுகளைப் பயன்படுத்தும் திறன் வளர்தல் நாளாக நாளாக நிகழ்ச்சி களின் பகுதிகளும் குறியீடுகளும் குழந்தையிடம் துலங்கல்களை எழுப்பு கின்றன.
1559,பால் உருளியில் கரண்டியின் ஒலி கேட்டவுடன் குழந்தை உணவை எதிர்பார்க்கின்றது.
1560,முன்னால் இவ்வொலி பால்குடிக்கும்பொழுது எழுந்தது அந்நிகழ்ச்சியின் பகுதியாகிய ஒலியிலிருந்து முழு நிகழ்ச்சியின் பொருள் தோன்று கின்றது.
1561,மொழி வளர்ச்சி துலங்கியதும் குறியீடுகளைக்கையாளும் திறன் வளரத் தொடங்குகின்றது.
1562,பிற மாறுதல்கள் முன்னைய அநுபவங்களைப் பயன் படுத்தும் திறனை யொட்டிப் பல திறன்கள் தோன்றுகின்றன.
1563,நாளடைவில் குழந்தை உடனே பயன்தரும் நோக்கங்களைத் தவிர்த்து நீண்ட பயன் தரும் விழுப்பொருள் களைக் குறிக்கோள் களாகக் கொள்ளுகிறது.
1564,காலப்போக்கில் சிறுவன் குறியீடுகளைத் தானாகவே கையாளும் திறனைப் பெறுகின்றான்.
1565,"மன வளர்ச்சியில் மேற்கூறிய மாறுதல்கள் நிகழுங்கால், அங்குத் தனித்தனி நிலைகள் இல்லை என்பது உணர்தற்பாலது."
1566,"ஆயினும், சில வளர்ச்சிப் போக்குகள் ஒரு சமயம் தெளிவாகவும் பிறிதொரு சமயம் தெளிவற்றும் தோன்றுகின்றன."
1567,"எனவே, மனத்தில் நிகழும் செயல்களை ஈண்டு ஓரளவு ஆராய்தல் இன்றியமையாத தாகின்றது."
1568,முதலாண்டில் புலன்கள் செயற்படுகின்றன அவற்றினைப் பயன்படுத்தும் திறன் மிகுதியாக வளர்கின்றது.
1569,இரண்டாம் யாண்டில் பேச்சு மேன்மையடைகின்றது.
1570,"உறுமுதல், மழலைச் சொல், சொற்கள் என்ற வரிசையில் மொழி வளர்கின்றது."
1571,முதலிரண்டு யாண்டுகளில் குழந்தை புலன்களின் துணையால் சூழ்நிலையை நன்கு ஆராய்கின்றது.
1572,மூன்றாம் யாண்டில் யார்?
1573,என்று பல வினாக்களைக் குழந்தை விடுக்கின்றது.
1574,அந்த யாண்டை வினாநிலை எனலாம்.
1575,இந் நிலையில் மொழி வளர்ச்சி சிறப்பெய்துகின்றது.
1576,குழந்தையின் நாவில் முதன் முதல் சொல் எழுந்து ஒளிர்வது பத்தாம் திங்களிலாகும்.
1577,ஆம் வாரத்திற்குள் இரண்டு சொற்களும் ஆம் வாரத்திற்குள் சொற்களும் விளங்குகின்றன.
1578,ஆம் வாரத்திற்குமேல் இச் சொற்களின் எண்ணிக்கை விரைந்து வளர்கின்றது.
1579,அறிவுப் பரப்பிலும் ஆழத்திலும் வளர்ச்சி பெறு கின்றது.
1580,முதலில் அவன் பொருள்களைப் பற்றிக் கூறும் இலக்கணம் அவற்றின் பயனைத் தழுவியதாகவே இருக்கும்.
1581,எடு. கத்திவெட்டுகிறது தாய்பாலூட்டுபவள்.
1582,முழுமையான இலக்கணம் நாளடைவில்தான் தோன்றும்.
1583,அறிவுச் செயல்களில் முதலாவது புலன் உணர்ச்சி யாகும்.
1584,"அஃது ஒலி, ஒளி போன்ற பண்புகளைப் புலன்களைக் கொண்டு அறிதலாகும்."
1585,"ஆனால், புலன்காட்சி ஞநசஉநயீவடி என்பது இப்பண்புகளையுடைய பொருள்களை அறிதல் ஆகும்."
1586,எடு. இஃது ஒரு எலுமிச்சம்பழம் என்பது புலன்காட்சி.
1587,முன்னைய அநுபவத்தைக் கொண்டு புலன் உணர்ச்சியை விளக்குவது புலன் காட்சியாகும்.
1588,உருண்டை வடிவத்தையோ மஞ்சள் நிறத்தையோ பார்த்தல் புலன் உணர்ச்சியாகும்.
1589,இன்னொரு எடுத்துக்காட்டு ஒருவர் தன் அறையில் துயில்கின்றார்.
1590,யாரோ ஒருவர் கதவைத் தட்டுகின்றார்.
1591,ஒலியலைகள் உண்டாகி துயில் பவரின் காதை அடைகின்றன.
1592,"அவர் எழுந்திராததால், அவ் வொலியலைகளை அறிய முடியவில்லை."
1593,திரும்பத் திரும்ப வரும் ஒலியலைகள் அவரை எழுப்புகின்றன இப்பொழுது ஓரளவு ஒலி கேட்கின்றது.
1594,அது புலன் உணர்ச்சியாகும்.
1595,யாரோ தட்டும் ஒலி என்று அறிந்தால் அது புலன் காட்சியாகின்றது.
1596,அறிவுச் செயல்களில் மற்றொரு வகை நினைவு என்பது.
1597,முன்னர் நடைபெற்ற நிகழ்ச்சியைப் பின்னர் வேண்டுமிடத்து அறிவது நினைவாகும்.
1598,"நினைவுச் செயல் கற்றல் இருத்துதல், நினைவூட்டுதல் என்ற முக்கூறுகளைக் கொண்டது."
1599,சிறுவர்களுக்கு வெகு விரைவில் நினைவு உண்டாகின்றது.
1600,கவனமும் ஓர் அறிவுச்செயலே.
1601,அது தேர்ந்தெடுத்த உற்று நோக்கல்.
1602,சிறுவர்களின் கவனம் ஒன்றிலிருந்து பிறிதொன்றிற்குப் பாயும் பிறகுதான் நிலையான கவனம் உண்டாகின்றது.
1603,ஒரு செயல் அல்லது பொருளை நெடுநேரம் காண்பது பயிற்றலின் பயன் ஆகும்.
1604,அது பொருளின்மீது அச்சிறுவன் கொண்ட கவர்ச்சி அல்லது அக்கறையைப் பொறுத்தது.
1605,மனத்தின் ஆற்றல்களில் சிறந்தது சிந்தனை யாகும்.
1606,சிந்தனையிலும் முறையான வளர்ச்சியுண்டு.
1607,"குழந்தைப் பள்ளிகள், தொடக்கநிலைப் பள்ளிகள் ஆகியவற்றில் பயிலும் சிறுவர்களைக்கொண்டு இதனை அறியலாம்."
1608,இதனைக் கருத்தில் கொண்டுதான் முதல் மூன்று வகுப்புகளுக்குரிய மொழிப்பாட நூல்களின் முதலிலுள்ள சில பாடங்கள் அமைக்கப்பெறுகின்றன.
1609,சிந்தனைக்குக் கருத்துப் பொருள்கள் தேவை.
1610,புலன்காட்சியிலிருந்து பொதுஉணர்வு உண்டாகிறது.
1611,நாய் என்ற பொது உணர்வு எவ்வாறு உண்டா கின்றது என்று காண்போம்.
1612,ஒரு குழந்தை ஒரு நாயை முழு வடிவமாகவே காண்கின்றது அதைப்பற்றிய ஓர் அநுபவம் பெறுகின்றது.
1613,அதை நன்கு கவனிக்கும்பொழுது அதைப்பற்றிய அறிவு குழந்தையிடம் நன்றாக வளர்கின்றது.
1614,இப்பொழுது மாறுபட்ட பண்புகள் மறைகின்றன ஒன்றுபட்ட பண்புகள் மட்டிலும் ஒருங்கிணைந்து உரம்பெறுகின்றன.
1615,நாயைப்பற்றிய முன்னைய எண்ணத்தைவிட இப்புதிய எண்ணம் வலுவாகவுள்ளது.
1616,இதில் மூன்று பண்புகளே இடம் பெற்றுள்ளன மூன்று பண்புகள்புலன்காட்சிகள்ஒரு பொது உணர்வாக அமைந்துள்ளது.
1617,"எனவே, புலன்களின் முன்னர்த் தனித்துத் தோன்றுவது புலன்காட்சி மனத்தின்கண் பொதுவாகக் காண்பது பொது உணர்வு."
1618,பொது உணர்வை மானதக் காட்சி என்றும் வழங்குவர்.
1619,கற்பனை என்பது இன்னொரு அறிவுச் செயலாகும்.
1620,கற்பனை என்பது புலன்களுக்கு எட்டாத பொருள்களை அறிவது.
1621,புலன்களை உறுத்தும் பொருள்களை அறிவது புலன் காட்சி.
1622,என் வீட்டிற்கு எதிரேயுள்ள கோவிலின் கோபுரத்தைக் காண்பது புலன்காட்சி இராசராசசோழன் எடுத்த தஞ்சைக் கோபுரத்தை மனத்தின்கண் பார்ப்பது கற்பனை.
1623,புலன்காட்சியில் வெளிப் பொருள்கள் மனத்தின் செயலை எழுப்புகின்றன கற்பனையில் மனத்தின் தொழில் உள்ளிருந்தே எழுகின்றது.
1624,சிறுவர்களின் விளையாட்டுகளில் தோன்றும் ஒருவிதக் கற்பனை பாவனை என்பது.
1625,சிறுவர்களின் விளை யாட்டில் நாற்காலி கப்பலாகின்றது செங்கற்பொடி வெடிமருந்தாகின்றது.
1626,ஊசல் பலகை இரயில் வண்டியாகின்றது.
1627,அவர்கள் விளையாட்டில் விலங்குகளும் பேசுகின்றன.
1628,குழந்தை எல்லாத் துறைகளிலும் சேர்ந்தே வளர் கின்றது என்பதை நாம் அவசியம் அறிதல்வேண்டும்.
1629,வளர்ச்சிப் பருவங்கள் குழந்தையின் வளர்ச்சி தொடர்ச்சியாக இருந்தாலும் அதில் சில முக்கிய மான பருவங்களை உளவியலறிஞர்கள் பகுத்துப் பேசுவர்.
1630,அவை வருமாறு குழவிப் பருவம் ஙூ அல்லது வயது.
1631,முன்பிள்ளைப் பருவம் அல்லது வயது மனவளர்ச்சிக் குரியது.
1632,நிலைமாறு பருவம் அல்லது வயது உடல்வளர்ச்சிக் குரியது.
1633,பின்பிள்ளைப் பருவம் வயது மனவளர்ச்சிக்குரியது.
1634,முன்குமரப் பருவம் வயது உடல்வளர்ச்சிக்குரியது.
1635,பின்குமரப் பருவம் வயது மனவளர்ச்சிக்குரியது.
1636,சில சமயம் நிலைமாறு பருவத்தை நடுப் பிள்ளைப் பருவம் எனவும் குறிப்பிடுவதுண்டு.
1637,"மேலும், ஒவ்வொரு பருவத்திற்குரிய வயது எல்லையையும் மறைமொழி யாகக் கொள்ளவும் வேண்டியதில்லை."
1638,இது குழந்தை பெரும்பாலும் பெற்றோ ரைச் சார்ந்திருக்கும் பருவம்.
1639,இப் பருவத்திலும் குழந்தை அன்னையின் பராமரிப்பிலிருக்கும்.
1640,இதில் குழந்தை விரைவான வளர்ச்சி பெறுகின்றது.
1641,உடல் வேகமாக வளர்கிறது.
1642,இயக்க ஆற்றலும் தோன்றுகின்றது.
1643,குழந்தை படிப்படியாகத் தசை இயக்கங்களை ஒன்றுபடுத்தவும் தன்னுடைய உறுப்புகளை ஒரு நோக்கத்திற்குப் பயன்படுத்தவும் கற்றுக் கொள்கின்றது.
1644,"இப் பருவத்தில் குழந்தையின் நோக்கம் யாவும் தசை, நரம்பு இயக்கங் களையும் உறுப்புகளையும் ஒருமைப்படுத்தலேயாகும்."
1645,இயக்கத் தூண்டல்களையுடைய பொருள்கள் யாவும் குழந்தைக்குக் கவர்ச்சி தரும்.
1646,உடலும் உறுப்புகளும் செயற்படுவதற்கு வாய்ப் பினைத் தரும் விளையாட்டுகள் யாவும் குழந்தையைக் கவரும்.
1647,சாதாரணமாக ஓடுதலையும் தாண்டுதலையும்கூட குழந்தை அதிகமாக விரும்பும்.
1648,இப் பருவத்தில் புலன்கள் துலக்கமடைகின்றன.
1649,"இதனால்தான் குழந்தை துருதுரு வென்று இருக்கின்றது, தனக்கு முன்னுள்ள உலகைச் சதா ஆராய்கின்றது."
1650,இதை யறியாத மூத்தோர் குழந்தைக்கு குறும்புச் செயல் அதிகம் என்று கருதுகின்றனர்.
1651,குழந்தையின் வயதிற்கும் ஆற்றலுக்கும் ஏற்றவாறு எளிதில் இயக்கக்கூடிய பொருள்கள் அதற்குக் கிடைக்கச் செய்வது மூத்தோர் கடமையாகும்.
1652,குழந்தையின் விருப்பங்களும் உள்ளக்கிளர்ச்சிகளும் தீவிர மானவை ஆனால் விரைவில் மாறக் கூடியவை.
1653,தான் உணர் வதையெல்லாம் ஆர்ப்பாட்டங்களுடன்தான் வெளியிடும்.
1654,"எனவே, நாம் அது வெகுள்கின்றதா, பொறாமைப்படுகின்றதா, மகிழ்கின்றதா, அன்பு கொள்கின்றதா, அஞ்சுகின்றதா என்பதை அறிந்து கொள்வதில் சிரமம் ஒன்றுமில்லை."
1655,"இப்பருவத்தில் உண்ணுதல், உறங்குதல், கழிவுப் பொருள்களை அகற்றுதல் போன்ற உடல் நலத்துடன் தொடர்பு கொண்ட செயல்களில் நற்பழக்கங்களை வளர்க்கவேண்டும்."
1656,முன்பிள்ளைப் பருவம் அல்லது வயது இப் பருவத்திலும் சிறப்பியல்பாகக் காணப் பெறுபவை உடலியக்கமே.
1657,சிறு குழவியிடம் தேங்கிக் கிடக்கும் வற்றாத ஆற்றலைக் கண்டு நாம் வியப்படையத்தான் செய்கின்றோம்.
1658,விளையாட்டில் தீவிரமான கவர்ச்சியுண்டாகின்றது திரும்பத் திரும்ப நடைபெறும் செயல்களைக் கொண்ட விளையாட்டு களையே சிறுவன் அதிகமாக நாடுகின்றான்.
1659,"இப் பருவச் சிறுவன் பிறருடைய கூட்டுறவில் விளையாட விரும்பினாலும், அவன் விளையாட்டு தனியாக விளையாடக் கூடியதாகவே உள்ளது."
1660,"குதித்தல், ஓடுதல், விரட்டுதல் போன்ற விளையாட்டுகள் இன்பம் தருபவை."
1661,உருளை விளையாட்டுப் பொருள்கள்மேல் சிறுவனுக்கு விருப்பம் அதிகம்.
1662,சிறுவன் தானாகவே குளிப் பாட்டிக் கொள்ள விரும்புகின்றான்.
1663,பல பிள்ளைகளுடன் கூடி விளையாடும் விளையாட்டு இன்பம் தரும்.
1664,ஆனால் சிறு குழுக்களே அமைகின்றன.
1665,சிறுவர்களும் சிறுமியரும் சேர்ந்து விளையாடுகின்றனர்.
1666,சிறுவர்கள் தம் நண்பர் களுடன் மற்போர் தொடுத்துச் சண்டையிடுகின்றனர் தம் ஆண்மையை நிலைநாட்ட முயலுகின்றனர்.
1667,விருந்தினையும் குழுக் கூட்டங்களையும் விரும்புகின்றனர்.
1668,"ஆனால், அங்கு மூத்தோரின் விதிப்படி நடந்து கொள்வதில்லை."
1669,ஆசிரியரின் கருத்துகளுக்கும் எண்ணங்களுக்கும் அதிக மதிப்புத் தருகின்றனர்.
1670,நன்னடத்தையும் தீய நடத்தையும் மாறி மாறித் தோன்றுகின்றன.
1671,இப் பருவத்தில் குழந்தைகளின் ஆற்றல் வெளிப்படுவதற்கும் கற்பனை செயற்படுவதற்கும் ஏற்ற வாய்ப்புகளை நல்குதல் வேண்டும்.
1672,"மனவிருப்பம், பாவனை விளையாட்டு, பகற்கனவு, மோகினிக் கதைகள் முதலியவற்றைச் சிறுவர்கள் அதிகமாக விரும்புவர்."
1673,சாதாரணமாகக் காணும் இயக்கங்களையும் ஒலிகளையும் திரும்பத்திரும்ப உண்டாக்குவதில் சிறுவன் அதிக விருப்பத்தைக் காட்டுகின்றான்.
1674,"இந்நிலையில் பாப்பா பாடல்கள், செவிலிப் பாடல்கள், ஆட்டப் பாடல்கள் ஆகியவற்றை மிகவும் விரும்பு கின்றான்."
1675,பெர்ஸிநண் என்ற அறிஞர் கருதுவர்.
1676,திரும்பச் செய்தலும் சந்த இயக்கமும் ஆழ்ந்ததோர் உணர்வைத் திருப்திப் படுத்துகின்றன.
1677,"ஆசிரியர் இவற்றைச் சரியாகக் கையாண்டால் அவை முருகுணர் கலையாகவும், நல்ல நடத்தையாகவும், வரையறையுடன் கூடிய பழக்கங்களாகவும் வளரும்."
1678,இப் பருவத்தின் சிறப்பியல்புகளில் ஒன்று விடுப்பூக்கம் குழந்தைகளிடம் அதிகமாகத் துலங்குவதாகும்.
1679,என்ற வினாக்களால் குழந்தைகள் நம்மைத் துளைத்து விடும்.
