Line Number,Sentence
3222,"அவ்விடம் நேரி மலையின் அடியில் பேரியாற்றங் கரையில், இப்போது உள்ள நேரி மங்கலம் என்னும் இடமாகும்."
3223,இன்றும் அங்கே இடிந்து பாழ்பட்டுப்போன அரண்மனைக் கட்டடங்கள் உள்ளன எனத் திருவாங்கூர் நாட்டியல் நூல் கூறுகிறது.
3224,இடைக் காலத்தில் வாழ்ந்த அரசகுடும்பத்தின் ஒரு கிளை அங்கே யிருந்ததென அங்கு வாழ்பவர் கூறுகின்றனர்.
3225,"உடனிருந்த சாத்தனார், கண்ணகியின் வரலாற்றை எடுத்து உரைத்தார்."
3226,நம் நாடு அடைந்த இப்பத்தினிக் கடவுளைப் பரசல் வேண்டும் என்று தெரிவித்தாள்.
3227,"கேட்ட வேந்தன் சாத்தனாரை நோக்க, அவரும் அதுவே தக்கதெனத் தலையசைத்தனர்."
3228,"பின்னர், வேந்தன் பத்தினிக் கடவுளாகிய கண்ணகியின் உருவம் சமைத்தற்குக் கல் வேண்டுமென அரசியற் சுற்றத்தாரை ஆராய்ந்தான்."
3229,முடிவில் இமயத்தினின்று கல் கொணர்வதே செயற்பாலது எனத் துணிந்தனர்.
3230,இதற்கிடையே வடநாட்டில் ஒரு நிகழ்ச்சியுண்டாயிற்று.
3231,சேரவேந்தர் வானவரம்பராகிப் பின் இமயவரம்பரான கால முதல் அந்நூற்றுவர் கன்னர் சேரரோடு நண்பர்களாகவே இருந்தனர்.
3232,அவர்கட்கு வடக்கிலிருந்த கடம்பரும் பிற ஆரியவேந்தரும் சேரர்பால் அழுக்காறும் மனக் காய்ச்சலும் கொண்டிருந்தனர்.
3233,"அதனால், அவ்வடவாரிய வேந்தரின் செருக் கடக்குதற்கு இதுவே செவ்வியெனச் செங்குட்டுவன் கருதினான்."
3234,கணிகள் கூறிய நன்னாளில் சேரர் பெரும்படை இமயம் நோக்கிப் புறப்பட்டுச் சென்றது.
3235,நூற்றுவர் கன்னர் வழியிற் குறுக்கிட்டோடிய ஆறுகளைக் கடத்தற்கு வேண்டும் துணை புரிந்தனர்.
3236,கனகவிசயர் வஞ்சி நகர்ச்சிறைக் கோட்டத்தே இருந்தனர்.
3237,பின்னர்ச் செங்குட்டுவன் கண்ணகி யின் உருவமைந்த கோயிலுக்குக் கடவுள் மங்கலம் செய்தான்.
3238,"தமிழ் நாட்டினின்றும், ஈழம் முதலிய நாட்டினின்றும், பிறநாடுகளிலிருந்தும் வேந்தர் பலர் அவ்விழாவுக்கு வந்திருந்தனர்."
3239,ஈழ நாட்டிலிருந்துவந்த வேந்தன் முதற் கயவாகு எனப்படுகின்றான்.
3240,"கண்ணகித் தெய்வமும் தந்தேன் வரம், என்று மொழிந்தது."
3241,இது செய்த காலத்துச் செங்குட்டுவன் ஐம்பதாண்டு நிரம்பியிருந்தான்.
3242,மேலும் ஐந்தாண்டுகள் தன்வாழ்நாளைச் செங்குட்டுவன் அறத்துறைவேள்விகள் செய்து கழித்து வந்தான்.
3243,பதிற்றுப்பத்து ஐந்தாம்பதிகம் செங்குட்டுவன் ஐம்பத்தையாண்டு வீற்றிருந்தானென்று கூறுகிறது.
3244,அவையிரண்டும் யவன அறிஞரான தாலமியின் குறிப்பில் உள்ளமை ஆராய்ச்சியறிஞர் கண்டு இன்புறுவாராக. .
3245,"இவன் நார்முடிச் சேரலுக்கும் செங்குட்டுவனுக்கும் இளையவனாதலின், செங்குட்டுவற்குப் பின் சேரநாட்டு அரசு கட்டில் ஏறினான்."
3246,செங்குட்டுவனுக்குப் பின் வஞ்சி நகரடைந்து சேரநாடு முழுதிற்கும் இச்சேரலாதன் முடி வேந்தனானான்.
3247,அதன் தென்பகுதியியே குடநாடாகப் பெயர் வழங்கிற்று.
3248,"நார்முடிச் சேரலால் கொங்கு நாட்டில் நன்னன் வலியழிந்து போகவே, அவன் வழி வந்தோர் சதகன்னர்களுக்கு அஞ்சி அவர்வழி நிற்கலாயினர்."
3249,இரு திறத்தாரும் தம்மிற்கூடிக் குடநாட்டுட் புகுந்து குறும்பு செய்தனர்.
3250,அச்செய்தி ஆட்கோட்பாட்டுச் சேரலாதனுக்குத் தெரிந்தது.
3251,தமிழ்ப் பெரும்படை திரண்டு குடபுலம் நோக்கிச் சென்றது.
3252,அக்காலத்தே பொறை நாட்டின் கீழ்ப்பகுதியில் நச்செள்ளையார் என்ற புலவர் பெருமாட்டியார் வாழ்ந்தார்.
3253,இப்போது அப்பகுதி பாலைக்காடு நாட்டில் நடுவட்டம் என வழங்குகிறது.
3254,அது முதல் அவர் காக்கை பாடினியார் நச்செள்ளையார் என்று விளங்குவாராயினர்.
3255,அதனை அறிந்த வேந்தன் அவர் இருந்த ஊரைக் காக்கையூர் என்று பெயரிட்டு அவர்க்கு இறையிலி முற்றூட்டாக வழங்கினான்.
3256,அவர் தமது காக்கையூரிலிருந்து வந்தார்.
3257,சேரநாட்டு வடக்கில் வடவர் செய்யும் குறும்பும் அவர் களையொடுக்குதற்குச் சேரலாதன் படைகொண்டு செல்லும் மேற்செலவும் அவருக்குத் தெரிந்தன.
3258,"சேரவேந்தர், மகளிர் பாடும் இசையிலும், ஆடும் கூத்திலும் பேரீடுபாடுடையர்."
3259,செங்குட்டுவன் வடநாடு சென்றபோது பாடல் மகளிரும் ஆடல் மகளிரும் உடன் சென்ற திறம் இதற்குப் போதிய சான்றாயிற்று.
3260,"ஆடுகோட்பாட்டுச் சேரலாதன், ஆண்டில் இளையனாதலால், இன்பத்துறையில் மிக்க எளியனாயிருந்தது தெரிந்திருந்தது."
3261,சேரலாதன் போர்ச்செலவை மேற்கொண்டபோது மகளிர் கூட்டம் உடன் சென்றதென்றும் கேள்வியுற்றார்.
3262,இந்த எளிமை வேந்தரது கொற்றத்தைச் சிதைக்கும் என்று காக்கை பாடினியார் அஞ்சிக் கொண்டேயிருந்தார்.
3263,இதுகேட்டு வேந்தன் முறுவலித்துத் தன் செய்கையின் விளைவைச் சிந்திக்கலானான்.
3264,"களிறும் குதிரையும் தேரும் வீரரும் கூடிய தமிழ்ப்படை, வடவர்தானையை வென்று வெருட்டிற்று."
3265,தமிழ் மறவர்கள் தங்கள் மெய்புதை யரணம் கிழிந்தொழிந்ததை நினையாமலும் தும்பை சூடிப் பொருதழித்தனர்.
3266,எண்ணிறந்த வீரர் துறக்கம் புகுந்தனர்.
3267,"முடிவில் சேரலாதன் தானை, வானவாசி நாட்டுட்புகுந்து அங்கேயே பாடிவீடு அமைத்து நின்றது."
3268,பகைவர் பலரும் புறந்தந்தோடினர்.
3269,"ஆற்றாத சதகன்னருட் சிலர் அடிபணிந்து அருங்கலம் பல தந்து, எம்மை அருளுக! எனவேண்டினர்."
3270,"சேரலாதன் அவர்கட்கு அருள் செய்து பண்டுபோல வானமலையை வரம்பு நிலைநிறுத்து, அவர்களையும் எல்லை கடவாது காக்குமாறு பணித்துவிட்டுத் திரும்பலானான்."
3271,"அதனால், சேரலாதனைச் சான்றோர் வானவரம்பன் என்று பாராட்டினர்."
3272,"இது நிலைபெறுமாறு அந்நாட்டுப் பார்ப்பனரைக் கொண்டு பெருவேள்வி செய்து, அவர்கட்குக் குடநாட்டில் ஓரூரையும் கொடுத்தான்."
3273,"இதுபற்றியே பதிகமும் பார்ப்பாருக்குக், கபிலையொடு குடநாட்டு ஓர் ஊர் ஈத்து, வானவரம்பன் எனப் பேரினிது விளக்கி என்று கூறுவதாயிற்று."
3274,நெடும் பொறை நாட்டை அடுத்திருக்கும் மீகொங்கு நாடும் குறும்பு நாடும் சேரர் ஆட்சியில் இருந்தன.
3275,அவருட்சிலர் சேரர் ஆட்சியில் தலைவராயும் தானை மறவராயும் இருந்தனர்.
3276,"ஆயினும், மழவரது குறும்பு நாளடைவில் மீகொங்கு நாட்டிலும் பொறை நாட்டிலும் பரவத் தலைப்பட்டது."
3277,அவர்கள் சிறந்த குதிரை வீரர்கள்.
3278,"அதனால், பதிகமும் மழவரைச் செருவிற் சுருக்கி என்று கூறுகிறது."
3279,அதன்கண் சேரர் குடியில் தோன்றிய அரசியற்செல்வருள் ஒருவரை நிறுவிச் சேரர் கொங்கில் நாடு காவல் புரியச் செய்தான்.
3280,இடைக்காலச் சோழ வேந்தர் கொங்கு வஞ்சியைக் கைப்பற்றி அதற்கு இராசராசபுரம் என்று பெயரிட்டனர்.
3281,"இதனை அவர்களுடைய கல்வெட்டுக்கள், நறையனூர் நாட்டுக் கொங்கு வஞ்சியான ராஜராஜபுரம் என்று குறிப்பதனால் அறிகின்றோம்."
3282,பிற்காலத்தே இதன் ஒருபகுதி ராஜாதிராஜ சதுர்வேதி மங்கலமாகியது.
3283,"இப்போது இந்த ராஜராஜபுரம், தாராபுரம் என்று மருவிக் கோயம்புத்தூர் மாவட்டத்தில் உளது."
3284,வரும் வழியில் குறும்பு செய்து பகைத்தொழுகிய வேந்தனுடைய அரண்மனை நின்றது.
3285,வேந்தனும் அவ்வாறே செய்து சிறப்புற்றான்.
3286,பொறை நாட்டின் வடபகுதியில் நறவு என்னும் ஒரு பேரூர் இருந்தது.
3287,அதனைத் தாலமி நறவூர் என்று குறித்திருக்கின்றனர். ஆங்குள்ள அரண்மனையில் ஒருகால் சேரலாதன் சென்று தங்கியிருந்தான்.
3288,அவனோடு மகளிர் பலர் இருந்தனர்.
3289,"அக்காலத்தே அவனைக் கண்ட நச்செள்ளையார், விறலியொருத்தியை அவன்பால் ஆற்றுப் படுக்கும் வகையால், ஒரு பாட்டைப் பாடினர்."
3290,பிறிதொருகால் சேரலாதன் வஞ்சி நகர்க்கண் இருந்த போது இனிய நிகழ்ச்சியொன்று நடைபெற்றது.
3291,இரவுக்காலத்தில் ஆடல் மகளிர் சிலர் துணங்கையாடலுற்றனர்.
3292,உயரிய கால் விளக்கு நிறுத்திப் பெருவிளக்கம் செய்யப்பட்டது.
3293,துணங்கைக் களத்தில் முழவு முதலிய இசைக் கருவிகள் முழங்கின.
3294,அரங்கேறும் மக்கட்கு வேந்தர் தலைக்கை தந்து அவர்களுடைய ஆடல் பாடல்களைத் தொடங்கிவைப்பது வழக்கம்.
3295,அவ்வாறே சேரலாதன் ஆடல் மகள் ஒருத்திக்குத் தலைக்கை தந்து துணங்கை யாடி வந்தான்.
3296,மனைக்கண் புகுதலும் அவன் மனைவி ஊடிப்பிணங்கலுற்றாள்.
3297,வேந்தன் அவளது ஊடலை உணர்த்தும் இன்சொற்கள் பல எடுத்துரைத்தான்.
3298,உரைக்குந்தோறும் அவட்கு ஊடல் மிகுந்ததேயன்றிக் குறையவில்லை.
3299,"அவள், அதற்குடன்படாது, நீ எமக்கு யாரையோ? என்று அவ்விடம் விட்டுப் பெயர்ந்தாள்."
3300,இவ்வாறு ஆடுகோட்பாட்டுச் சேரலாதன் முப்பத்தெட்டி யாண்டு வீற்றிருந்தான் என்று பதிகம் கூறுகிறது.
3301,காக்கை பாடினியார் சேரலாதனை வாழ்த்திய வாழ்த்துரைகள் ஒரு தனிச் சிறப்புடையவை.
3302,இவ்வுலகில் நல்வினை செய்பவர் துறக்கவுலகு சென்று நெடிது வாழ்வர் என்று சான்றோர் கூறுவர்.
3303,அதனை நிலமிசை நீடு வாழ்வார் எனத் திருவள்ளுவர் கூறுவதனாலும் அறியலாம்.
3304,"காக்கை பாடினியார், சேரலாதனை வாழ்த்துங்கால், எனையதூஉம் உயர்நிலை யுலகத்துச் செல்லாது இவண்நின்று, இருநிலமருங்கின் நெடிது மன்னியரோ! என்று வாழ்த்துவர்."
3305,வள்ளியோர்க்கு மழைமுகிலை உவமம் கூறுவது மரபு.
3306,அம்மழை முகில் மழையைப் பெய்தபின் வெளுத்துப் பஞ்சுத்துய் போலப் பறந்து கெடும்.
3307,"நின் நாளே, என்று கூறுவர்."
3308,அரசன் பக்கத்திருப்பதென்பது அமைச்சராதல் என்பது எனத் திருக்குறள் படித்த இளஞ் சிறுவரும் அறிவர்.
3309,.
3310,இந்நாடு கிழக்கிற் கொங்கு நாட்டில் பூவானியாறு வரையிற் பரந்திருந்தது.
3311,"பவானிக்கருகில் காவிரியொடு கலக்கும் பூவானியாறும், அவினாசி வட்டத்திலுள்ள இரும்பொறை என்னும் ஊரும் பொறை நாட்டின் பரப்பை வற்புறுத்துகின்றன."
3312,இப்பொறை நாட்டில் குறும்பர் நாட்டுப் பகுதியில் மாந்தரம் என்றொரு மலை முடியும் அதனையடுத்து மாந்தரம் என்றோர் மூதூரும் உண்டு.
3313,அவ்வூரைத் தலைநகராகக் கொண்டு வேந்தர் சிலர் ஆண்டு வந்தனர்.
3314,"மாந்தரம் மாந்தை எனவும் வழங்கிற்று. தொண்டி நகரைத் தலைநகராகக் கொண்டு ஆட்சி செய்தவர், இரும்பொறை என வழங்கப் பெற்றனர்."
3315,வள்ளுவ நாட்டுப் பகுதியில் இருந்த ஒரு கிளையினர் கடுங்கோ எனப்பட்டனர்.
3316,"இவர்களின் வேறாகக் குட்டுவர், குடக்கோ என இரு கிளையுண்டென்பது முன்பே கூறப்பட்டது."
3317,இவ்வேந்தர்கள் இமயவரம்பன் நெடுஞ்சேரலாதன் காலத்துக்கு முன்பிருந்தே சேர நாட்டில் இருந்து வரும் தொண்மையுடையராவர்.
3318,மாந்தரஞ்சேரர்களுள் மாந்தரம் பொறையன் கடுங்கோ என்பவன் மிக்க பழையோனாகக் காணப்படுகின்றான்.
3319,இந்த மாந்தரன் உயர்ந்தோர் பரவும் ஒள்ளிய குணம் படைத்தவன்.
3320,அப்பகுதியில் இவன் காலத்தில் விளங்கிய வேந்தருள் இவனே மேலோனாகக் கருதப்பட்டான்.
3321,நிறையருந்தானையும் பெருங்கொடை வன்மையும் இவன்பால் சிறந்து விளங்கின.
3322,இவனைப் பாடிச் சென்ற இரவலர் பெரும் பொருளும் பெருமகிழ்ச்சியும் கொண்டே திரும்புவர்.
3323,மழை வளம் தப்பாவாறு நாளும் கோளும் உரியவிடத்தில் நின்றன.
3324,நாட்டில் எவ்வகை அச்சமும் மக்கட்கு ஏற்படவில்லை எல்லோரும் இன்பமாய் வாழ்ந்தனர்.
3325,மாந்தரன் தனக்குரிய கல்வி முற்றும் குறைவறக் கற்று உயர்ந்தான்.
3326,நடுவுநிலை திறம்பாத செங்கோன்மையால் இவன் கெடாத புகழ் பெற்று விளங்கினான்.
3327,இவனது புகழ் விசும்பு முற்றும் பரந்திருந்தது.
3328,இவனுடைய வாளாற்றலைப் பகைவர் நன்கு தெரிந்திருந்தனர்.
3329,இவனை அறக்கடவுள் துணையாய் நின்று வாழ்த்தியது.
3330,"அதனால், இவனை அறன் வாழ்த்த நன்காண்டவிறன் மாந்தரன் என்று சான்றோர் பரவினர்."
3331,மாந்தரம் பொறையன் கடுங்கோவின் அரசியற் செயல் இவற்றின் வேறாக நூல்களில் ஒன்றும் காணப்படவில்லை.
3332,அக்காலத்தே அப்பகுதி யையும் காவிரிக்கு வடகரையிலுள்ள மழநாட்டையும் சோழவேந்தர் கைப்பற்றி இருந்தனர்.
3333,இச்செயல்களால் இவ்வேந்தனைச் சான்றோர் கருவூர் ஏறிய ஒள்வாள் கோப்பெருஞ்சேரல் இரும்பொறை என வழங் கலுற்றனர்.
3334,அக்காலத்தே நரிவெரூஉத்தலையார் என்ற புலவர் பெருமான் ஒருவர் இருந்தார்.
3335,அவர் ஒருவகை நோய்வாய்ப்பட்டு உடல் நலம் குன்றி மிகவும் மெலிந்திருந்தார்.
3336,அரசர் பார்வையும் ஒரு வகை மருந்தாம் என்பது மேனாட்டவர்க்கும் உடன்பாடு.
3337,அரசர் பார்வையால் நோய் நீக்கப்பெற்ற செய்தி கிரேக்க நாட்டு வரலாறுகளிலும் உண்டு.
