Line Number,Sentence
752,உலகவூழியரவர்களோடு யானும் எங்கள் ஆசிரியர் திரு.வேங்கடாசலம் பிள்ளையவர்கள் ஆணைவழி நின்று செய்து வந்த காலத்தில் ஒருவாறு அறிந்தேன்.
753,"பின்னர், எங்கள் வீட்டிலிருந்த ஞானாமிர்த நூலின் ஏட்டுப் பிரதியிலிருந்து பெயர்த்தெழுதிய காலத்து, இவ்விடரினை நன்கு கண்டேன்."
754,"அதுபோது பதிப்பாசிரியன்மார் மேற்கொள்ளும் மனத்தூய்மையும், அதற்கேதுவாகிய அவரது அறிவொட்பமும் எங்களுக்குப் புலனாயின."
755,"இம்மாண்பே, நற்றிணைப்பதிப்பாசிரியர் மாட்டும் அமைந்திருந்த தென்று கூறுதல் மிகையே."
756,அவர் இப்பாட்டினை யுணர்ந்து உரையெழுதிப் பதிப்பித்த காலத்துப் பிற்கூறுமாறு துணிந்து கூறியிருப்பரென்று நினைக்கின்றேன்.
757,"ஏட்டுப் பிரதியில், ஆகில் கலங்கழீ இயற்றும் என்பது ஆகில கலங்கழீ இயற்றும் என்று தோன்றிற்று."
758,"இந் நிலையில் பொருள் விளங்காமையின், பிற பிரதிகளைநோக்கி, ஆண்டும் அதுவே தோன்றக்கண்டு, அதன் பொருளாராய்ச்சியில் அவர் கருத்தைச் செலுத்தியிருப்பர்."
759,இத்துணை வருத்தமேன்?
760,ஆசி லகந்தழீ இயற்று என்று திருத்திக் கொண்டால் என்னை?
761,"எனின், அது திருத்துவோர் கருத்தாமேயன்றி, நூலாசிரியர் கருத்தாகாது அன்றியும், அஃது அந்நூலைப் படிப்பாரை வஞ்சித்தலுமாம் என்பது அப்பெருமக்கள் கருத்து."
762,இதற்கு டாக்டர்.
763,உ.வே சாமிநாதையரவர்களே நிலைத்த சான்றாவர்.
764,"ஆகவே, அது நீக்கற் பாலதேயன்றி, நீக்காது கோடற்பால தன்றாம்."
765,"ஆகவே, இத்துணையும் கூறியவாற்றால்."
766,"இனி, இந்நூலாராய்ச்சியாளர், கடைஇக் கவவுக்கை தாங்கு மதுகைய என்றது பொருணெறியாற் பொருந்தாமையினைக் காட்டுகின்றேன்."
767,அவ்வறிவு நெறியே பற்றி இதனையாராய்தல் வேண்டும்.
768,இதுவும் அவர் பாட்டன்றோ!
769,"இதனைச் சாதித்ததற்குப் பயனையேது வாகக் கொண்டு, விடாத வழியெய்தும் ஆக்கமும், விட்டவழி யெய்தும் கேடும் கூறும் கருத்தினளாயினள்."
770,"ஆக்கம், என் தொல்கவின் தொலையினும் தொலைக என்பது."
771,"விடாவழி நினக்கெய்தும் வருத்தத்தினும், விடுக்கு வெனாயின் எய்தும் வருத்தம் பெரிதாம் என்றற்கு உவம முகத்தாற் கூறினாள்."
772,"உள்ளதன் உண்மைகூறி யூடுகின்றாளாகலின், மார்பிற் குறியை, குவவுமுலை சாடிய சாந்தினை வாடிய கோதையைய் யென வகுத்துக் கூறினாள்."
773,"ஆகவே அக்கூடாமைப் பொருள் விளங்காமையினாலும், கவவுக்கை தாங்கும்மதுகைய என்ற பாடம் பொருந்தாதொழிதல் காண்க."
774,"ஏனைச் சாந்தினை, கோதையை என நின்றாற்போல இதுவும் மதுகையை, சாந்தினை, கோதையை யாகலின்."
775,ஆகில் கலங் கழீ இயற்று என இயைந்து முடியுமாறு காணப்படும்.
776,"படவே, இப்பகுதி, ................................................."
777,இதன்பொருள் நின்னைச் சாரவிடாவழி என் பழமைக்கவின் கெடுவதாயினும் கெடுக.
778,நின்னை என்னருகில் வரவிடேன்.
779,என் அருகுவாரல்.
780,"நின்வரவு அவள் அறியின் பிறிது படுவாளாகலின், நின்னைக் கூடி நின்ற அப்பரத்தை வாழ்வாளாக என்பது."
781,"பிரிவருமை தோன்றத் தன்கவினைத் தலைவி, தொல்கவின் என்றாள்."
782,"சார்பு, கருமச்சார்பு."
783,தாங்கும் என்பது உறுநர்த்தாங்கும் என்றாற்போல நின்றது.
784,"கைகள் பன்மையாயும், மதுகையை என்பது ஒருமையாயும் இருத்தலின், பன்மைப்பெயர் ஒருமை வினைகொள்ளுதல் குற்றமன்றோ எனின் குற்றமாகாது."
785,"என்னையெனின், பன்மைச் சினைப்பெயர், முதற்குரிய வினைகொண்டு முடியும்வழி பன்மைகூறுங் கடப் பாடிலவே தொல்."
786,என்று ஆசிரியர் தொல்காப்பியனார் கூறியுள்ளார்.
787,"இச்சூத்திரத்து ஆசிரியர் கையினைக் கூறிற்றிலரெனின், சினைவினை முதன்மே னின்றதென்று கூறிக்கொள்க."
788,என்றும் முறையே வந்தமை காண்க.
789,"அற்றும் என்பதில் உம்மை, ஆக்கங் குறித்து வந்தது."
790,"இசைநிறை என்றுமாம் உம்மை இல்லையாயின், சொல்லொழுக்கம் அறுபட்டு, வாரல் வாழிய என்பன முதலியவற்றோடு தொடராதொழியும்."
791,"ஆகையால், ஆசிலகலந்தழீ இயற்று என உம்மையின்றிக் காட்டலும் குற்றமாம்."
792,"கற்புக் கடம்பூண்ட பொற்புடை மகளிரே வாழ்த்துதற்குரியராகலின், வாழிய வென்றாள்."
793,எள்ளின் இளிவாமென்றெண்ணியவர் திறம் உள்ளும் உயிர்க்காதல் நெஞ்சு குறள்.
794,. என்று கூறும் இயல்பினளாய தலைமகட்கு இக்கருத்து நிகழ்ந்து வாயாற் கூறப்பட்டதாகக் கூறுவது பொருளிலக்கணம் அறியாதார் கூறும் கூற்றன்றோ.
795,"ஆகலின், அதுபொருளின்றெனத் தள்ளுக."
796,"தலைமகனைப் புலந்து மறுக்கும் தலைமகள், பரத்தை செய்த குறிகண்டு பொறாது ஊடுபவள்."
797,"மேலும், குற்றமில்லாத மார்பு என்றது குறிப்பு என்கின்றார், வெளிப்படையாயின் குற்ற முடைய மார்பு என்பதாம்."
798,"ஆகவே, அவள், வாரல் என்றதனோடு நில்லாது வாழிய கவைஇ நின்றோளே என வாழ்த்து கின்றாளாகவின் அக்குறிப்பு வேண்டாமையறிக."
799,"கற்பு வழிப்பட்டவள் பரத்தையேத்தினும், உள்ளத் தூடலுண்டெனமொழிப என்பர் ஆசிரியர் தொல்காப்பியனார்."
800,இனி விரிப்பிற் பெருகும்.
801,என்பதெய்தவும் கூறியவாறாம்.
802,பிற பாட்டுக்களிலும் பெரும்பான்மை இப்பெற்றியவே என்றற்கு ஒரு பாட்டு எடுத்துக் கொள்ளப்பட்டது.
803,இனி இந்நூல் ஆராயும் இலக்கணப்பகுதி அடுத்த கட்டுரையில் ஆராயப்படும்.
804,"இனி, அக்கட்டுரையின் முடிப்புரையில் தோற்றுவாய் செய்தவாறு, இந் நூல் ஆராயும் இலக்கண வேறுபாடு என்னும் பகுதியினை ஆராய்வாம்."
805,அறிஞர்கள் ஈண்டுக் கூறுவன வற்றைச் சீர்தூக்கி உண்மை துணிந்து உரைப்பார்களாக.
806,இந்நூலாசிரியராகிய திரு.
807,"வேங்கடராஜுலு ரெட்டி யாரவர்கள், பெரும் புலவராகிய பரணர் தம் செய்யுட்களின் அமைதி, தொல்காப்பியத்திற்கு மாறு படுகின்றது.........."
808,"உயர் திணைப் பெயர்களில், இரண்டாம் வேற்றுமையுருபு விரிந்தே வருதல் வேண்டும் என்பது உயர்திணைமருங்கின் ஒழியாது வருதலும் தொல் தொகை."
809,என்னும் இரண்டாம் வேற்றுமைச் சிறப்பு விதிச் சூத்திரத்தால் பெறப்படும்.
810,உருவக் குதிரை மழவரோட்டிய அகம். என்று மாமூலர் பாடியிருப்பதும் இது போன்றதே.
811,இவ்வாறு வருதலைக் கண்டே நன்னூலார்.
812,உயர்திணையிடத்து விரிந்தும் தொக்கும் என்று இலக்கணம் அமைப்பாராயினர் என்று கூறுகின்றார்கள்.
813,"கூறவே, ஆசிரியர் தொல்காப்பியனார், இரண்டாம் வேற்றுமை யுருபாகிய ஐயுருபு."
814,"மேலும், அவ்வாறு வருதலே நேரிது தொக்குநின்றவழிப் பொருள் இனிது விளங்காது என்பது திரு ரெட்டியாரவர்கள் கருத்து."
815,"இக்கூறியவாற்றால், பரணர் செய்யுட்கள், தொல்காப் பியத்துக்கு மாறாகவும், நன்னூலிலக்கணத்துக்கு ஒப்பவும் நிற்றல் பெறப்படும்."
816,"இனி, ஆசிரியர் தொல்காப்பியனார் உயர்திணை மருங்கின் ஒழியாது வருதலும் என எழுத்ததிகாரத்து விதித்தவர்."
817,திரு.ரெட்டி யாரவர்கள் அடிக்குறிப்பில் ஆடுஉவறிசொல் என்று ஆசிரியர் கூறியிருத்தலின் இஃது அமையும் என்பர் என்று குறித்தனர் பக்.
818,இதன்கண் என்பார் எனப் பிறர்மேல் வைத்துக் கூறியிருத்தலின் அஃது அவர்க்கும் உடன் பாடன்று என்பது துணியப்படும்.
819,மேலும் அவ்வாறு தொக்கு நிற்பக் கூறுதல் சிறவாது என்பது தமக்குக் கருத்து என்பது எய்தவே திரு.
820,"இனி, நன்னூலார் ஐயுருபு உயர்திணையிடத்து விரிந்தும் தொக்கும் வரும் என்றும் கூறியது நேரிது என்று திரு."
821,ரெட்டியா ரவர்கள் கருதுவர்.
822,ஐ முதலிய வேற்றுமையுருபுகள் தம்மையேற்கும் பெயர்களின் ஈற்றில் விரிந்தும் தொக்கும் தம்பொருளை யுணர்த்தும்.
823,என்பது பண்டைய ஆசிரியன்மார் அனைவருக்கும் ஒப்ப முடிந்தது.
824,இது வேற்றுமைகளின் பொது விலக்கணமாகும்.
825,அஃறிணை யிடத்தும் இப்பெற்றியாகவே வரும் இலக்கணத்ததாகிய இதனை உயர் திணைக்கே உரியது போலக் கூறுதல் குற்றம் அன்றோ?
826,மக்களுடைய மனவுணர்வு நாளும் வளர்ந்து விரியும் இயல்பிற்று அதனை வெளிப்படுக்கும் சிறப்புடைக் கருவியாகிய சொற்றொகுதியும் விரிந்து பல்கும் இயல்பினதாகும்.
827,ஆகவே அதன் முடிபு வகைகளும் பலவாய் விரிதல் பெறப்படும்.
828,"அவற்றை வரைந்து, திணிந்த முடிபுவகைக்கண் அடக்கலுறின், அவ்வளர்ச்சி குன்றும்."
829,"அவை, இலேசு, உத்தி என்பன முதலாகக் கூறப்படும்."
830,அவற்றிற்கு உரைகாணப்புகும் புலவர் பெருமக்கள்.
831,அவ்வமைதியின் ஒட்பம் தேர்ந்து வேண்டுமாற்றால் அமைப்பது கடனாகும்.
832,உயர்திணையிடத்தும் விரிந்தும் தொக்கும் வரும் இயல்யிற்றாகிய ஐயுருபு.
833,"ஆகவே, அதனையும் அடக்குமாறு சூத்திரம் அமைந்திலதாயின்."
834,"அதன் இயல்பு குன்றுதலின், அதுவும் அடங்குதற்கு."
835,"விரிந்தே வருதலும் என்னாது, ஒழியாது வருதலும் என்று ஆசிரியர் கூறுவாராயினர்."
836,"ஆகவே, அவர்பால் முன்கண்ட குற்றமின்மை பெறப்படும்."
837,"அவ்வுண்மை தோன்றவே, சொல்லதிகாரத்தும், பொருளதி காரத்தும் ஒரு சில சூத்திரங்களுள் உயர்திணையிடத்து ஐயுருபு தொக்குவரக் கூறினார் எனக் கோடல்வேண்டும்."
838,இலக்கண முடிபு நாட்டும் தொல்காப்பியத்துக்கு மாறுபட்டனவாம் என்றல் நிரம்பாதாம்.
839,"இந்நெறிமையின் ஒட்பங்களை யுணர்ந்தே உரையாசிரியன்மாரும், இன்னோரன்னவற்றை இலேசினாலும் உத்தியாலும் பிறவற்றாலும் அமைத்துக் காட்டுவாராயினர்."
840,இலக்கணமும் வழக்கு நூலேயாகும்.
841,"இனி, பரணர் என்னும் இவ்வாராய்ச்சிநூல் கூறும் வேறோர் இலக்கண வேறுபாட்டினை யாராய்ந்து காட்டி, இக்கட்டுரையின் இப்பகுதியினை முடிக்கின்றாம்."
842,பனைத்திர ளன்ன பரேரெறுழ்த் தடக்கை அகம். என்னும் அடியில் பனைத்திரள் என்பது பனந்திரள் என வருதலே யமைதி.
843,"இது, பனையும் அரையும் தொல்."
844,என்னும் சூத்திரத்தால் அறியலாகும்.
845,ரெட்டியாரவர்கள் கூறுகின்றார்கள்.
846,"இதற்கு அவர் கூறும் ஏது, ஆசிரியர், பனையென்னும் சொல்லைக் குறித்து மூன்று சூத்திரங்களில் உயி."
847,"சிறப்பு விதி கூறுகின்றார் என்பதும், பொதுவிதி சிறப்பு விதியால் கெடும் என்பதுமாகும்."
848,"பனையின் முன்னர் அட்டுவரு காலை, நிலையின்றாகும் ஐயென் உயிரே, ஆகாரம் வருதல் ஆவயினான என்பது வேறொரு சிறப்பு விதி."
849,"கொடி முன் வரினே ஐயவண் நிற்பக், கடிநிலை யின்றே வல்லெழுத்து மிகுதி யென்பது மூன்றாவது சிறப்பு விதி."
850,"இனி, இவ்விதிகள் செய்யும் செய்கையினை யாராய்வாம்."
851,"படவே, பனை யென்னும் இச்சொல், பொதுவிதியால் முடிதல் அமையாது என்றல் நிரம்பாதாம்."
852,"இந்நிலையில், விதிகளின் இயல்பினைச் சிறிதாராய்தல் இன்றியமையாதாகின்றது."
853,பொது சிறப்பு எனவரும் இருவகையும் அடங்க விதியெல்லாம் எனப் பொதுப்படக் கூறியது காண்க.
854,"என்னும் சிறப்புவிதி, அவ்வா றெய்தியவிதி வல்லெழுத்து மிகுதியினை விலக்கிற்று."
855,"இப்பொருள்கோள், எடுத்தோத்தும் இலேசும் இல்வழி உத்திவகை யாலும் பிறவாற்றாலும் அமைக்கப் படும் மரபு கருதி."
856,"இனி, திரு."
857,"ரெட்டியாரவர்கள், பொதுவிதி, சிறப்புவிதியால் கெடும் என்று கூறுகின்றனர்."
858,"மேலே ஆராய்ந்து காட்டிய வற்றால், சிறப்புவிதிகளால் பொதுவிதி கெட்டழியாது."
859,"ஓராற்றால் வற்புறுத்தப் பெற்றமை புலனாமாகலின், அவர் கூறுவது பொருந்தாமை பெறப்படும்."
860,"மேலும், சிறப்பு விதிகளால், பொதுவிதிகள் கெடுவது உண்மையாயின் ஆசிரியன்மார்பொது விதி வகுத்துக் கூறல் பயனில கூறலாம்."
861,"ஆகவே, அவற்றைத் தெரிந் துணர்தற்காகவே சிறப்பு விதிகள் தோன்றுகின்றன."
862,"இனி, திரு."
863,"ரெட்டியாரவர்கள் கொடிமுன்வரினே என ஆசிரியர் விதந்தோதியதுபோல, திரள் என்பதனையும் ஓதாமையின் பனைத்திரள் என்று வருதல் அமைதியன்று என்கின்றனர்."
864,"கொள்ளவே, பனைத்திரள் பனைப்போழ் புறம். என்பன பனந்திரள், பனம்போழ் எனமுடிவது தோன்றும்."
865,"நச்சினார்க் கினியரும், நன்னூலாரும், உறழ்ச்சி முடிபு கூறுதல் காண்க."
866,இரும்பனை வெண்டொடுபுறம். பனைநுகும்பு புறம். எனப் பிறாண்டும்.
867,"பனையென்னும் சொல், அம்முப்பெறாமை முடிதல் காண்க."
868,"இவையனைத்தையும் ஆசிரியர் எடுத்தோதா மையின், தொல்காப்பியத்துக்கு மாறுபட்டன என்றல்வேண்டும்."
869,"அன்றி, ஆசிரியர் தொல்காப்பியனார், பரந்துபட்ட வழக்கின வாய்வரும் இம்முடிபுகளை அறியாது கூறினர் என்றல் வேண்டும்."
870,"வரலாற்று நெறிக்கண் இனிது உணரப்படுதலின், பெரும் பான்மைத்தாகிய இம்முடிபு அந்நெறியின் பாற்படும் என்று கோடலும் பொருந்தாதாம்."
871,"மேலும், குறித்து வருகிளவிகள் அனைத்தையும் எடுத்தோதி அமைக்கலுறின் இலக்கண விதிகள் வரம்பின்றிப் பல்கும்."
872,", , .."
