Line Number,Sentence
1,இளங்குமரனார் தமிழ்வளம் களவியற் காரிகை இரா.,False
2,இளங்குமரன் வளவன் பதிப்பகம் சென்னை .,False
3,நூற் குறிப்பு நூற்பெயர் இளங்குமரனார் தமிழ்வளம் பதிப்பாசிரியர் இரா.,False
4,இளங்குமரன் பதிப்பாளர் இ.,False
5,"படிகள் நூலாக்கம் பாவாணர் கணினி தி.நகர், சென்னை .",False
6,அட்டை ஓவியம் ஓவியர் மருது அட்டை வடிவமைப்பு வ.,False
7,"மலர் அச்சிட்டோர் ஸ்ரீ வெங்கடேசுவரா ஆப்செட் பிரிண்டர்சு இராயப்பேட்டை, சென்னை .",False
8,"வெளியீடு வளவன் பதிப்பகம் எண் சிங்கார வேலர் தெரு, தியாகராயர் நகர், சென்னை .",False
9,இவர் தந்நலம் கருதாமல் தமிழ் நலம் காத்து வருபவர்.,False
10,தம்மைமுன்னிறுத்தாது தமிழை முன்னிறுத்தும் பெருந்தமிழறிஞர்.,False
11,தமக்கென வாழாது தமிழ்க்கென வாழ்பவர்.,False
12,ஒருநாளின் முழுப்பொழுதும் தமிழாகவே வாழும் தமிழ்ப் போராளி.,False
13,சங்கச் சான்றோர் வரிசையில் வைத்து எண்ணத்தக்க அருந்தமிழறிஞர்.,False
14,தமிழ் இலக்கண இலக்கிய மரபைக் காத்து வரும் மரபு வழி அறிஞர்.,False
15,மொழிநூல் கதிரவன் பாவாணரின் வேர்ச்சொல் ஆய்வில் அவர் காட்டிய வழியில் தம் தமிழாய்வைத் தொடர்பவர்.,False
16,தமிழர் இல்லம்தோறும் இருக்கத்தக்க இவ்வருந்தமிழ்ச் செல்வங்களைத் தமிழ் இளம் தலைமுறைக்கு வைப்பாகக் கொடுத்துள்ளோம்.,False
17,ஒண்டமிழ்த்தாய் சிலம்படியின் முன்னேற்றம் ஒவ்வொன்றும் உன்முன் னேற்றம்!,False
18,இதுதான்நீ செயத்தக்க எப்பணிக்கும் முதற்பணியாம் எழுக நன்றே.,False
19,எனும் பாவேந்தரின் தமிழியக்க உணர்வுகளை நெஞ்சில் ஏந்தி வாழ முற்படுவோம்.,False
20,பெறும் பேறு வளம் எங்கே இருக்கிறது?,False
21,வளம் எங்கேயும் இருக்கிறது!,False
22,அஃது இல்லாத இடமே இல்லை!,False
23,வளம் எங்கும் இருப்பதை எப்படி அறியலாம்?,False
24,"வளத்தைத் தேடும் உளம் இருந்தால், வளம் எங்கேயும் இருப்பதை அறியலாம்?",False
25,வளத்தின் அளவு என்ன?,False
26,வளத்தின் அளவும் உளத்தின் அளவேயாம்!,False
27,"உளத்தில் வளம் இல்லையானால், உள்ள வளமும் உடையவனுக்கும் உதவாது ஊருக்கும் உலகுக்கும் உதவாது!",False
28,வளத்தைத் தரும் உளத்தை ஒருவர் வாய்க்கப் பெற்றால் போதும்!,False
29,அவ்வளம் குன்றியளவானால் என்ன?,False
30,குன்றத்தனைய வளமானால் என்ன?,False
31,தினை அளவானால் என்ன?,False
32,பனை அளவானால் என்ன?,False
33,வளம் வளமே!,False
34,தேனீ வளம்?,False
35,"தினைத்தனை அளவுப் பூவில், தேனீ கொள்ளும் தேன் எவ்வளவு இருக்கும்?",False
36,கோத்தும்பி கொணரும் தேன் வளம் எவ்வளவு இருக்கும்?,False
37,"கோத்தும்பி கொணர்வதே வளம், தேனீ கொணர்வது வளமில்லை என எவராவது கூறுவாரா?",False
38,வளம் வளமே!,False
39,"அவரவர் உழைப்பு, அறிவுத்திறம், உண்மையறிவு, பட்டறிவு, காலஇடசூழல் கொடை ஆகியவற்றைப் பொறுத்தது அது.",False
40,பொருள் மட்டுமா வளம்?,False
41,புலமை வளமில்லையா?,False
42,ஊக்குதல் உதவுதல் உறுதுணையாதல் ஒன்றுதல் ஆயவை வளமில்லையா?,False
43,எல்லாம் வளமே!,False
44,மல்லல் வளனே என்பது தொல்காப்பியம்.,False
45,உரி. உடலாலும் வளம் உழைப்பாலும் வளம் உணர்வாலும் வளம் உரையாலும் வளம் வளம் பட வாழ வேண்டாதார் எவர்?,False
46,வளம் பெற வேண்டாதார் எவர்?,False
47,வளந்தலை மயங்கிய வஞ்சி முற்றம் என்பது சிலம்பு!,False
48,"வளத்தின் அளவு, அளந்து கடை அறியாவளம் என்பது நாடென்ப நாடா வளத்தன என்பது நாட்டின் இலக்கணம்!",False
49,"எளிமை, இனிமை, இறைமை, நிறைமை என மக்கள் வாழ்ந்த நாள் இலக்கணம்!",False
50,"இன்றோ, நானில வளங்களையும் நாடா நாடில்லை!",False
51,எந்த நாடு ஏற்றுமதி செய்யவில்லை?,False
52,எந்த நாடு இறக்குமதி செய்யவில்லை?,False
53,"பாலைவளத்தை நாடிச்சோலை நிற்றல் வெளிப்படை என்றால், சொல்வானேன்?",False
54,நாடாவளத்தில் குப்பைக்கீரை சேராதா?,False
55,குறுந்தூறு சேராதா?,False
56,வளத்தை வழங்குதல் தான் பிறவிக் கடனே யன்றி அளவிடும் பொறுப்பு வழங்குவார்க்கு இல்லை!,False
57,பெறுவார் பொறுப்பு.,False
58,பெற்றவர் வழியாகக் கருவிலே பெற்ற திரு என்ன!,False
59,கற்ற கல்வியால் பெற்ற வளம் என்ன!,False
60,பட்டறிவால் ஆழ்மன ஆய்வால் தேடிக் கொண்ட வளங்கள் என்ன என்ன!,False
61,"கூற்றையும் ஆடல் கொள்ளும் கொள்கை இதுவென உணர்வார் ஓயார், ஒழியார் சாயார் சரிந்தும் போகார்!",False
62,"என் இளந்தைப் பருவமே, ஆசிரியப் பருவமாகிவிட்டது.",False
63,அக்காலச் சூழல் அது.,False
64,மூன்றாண்டு ஆசிரியப் பணி செய்தால் போதும்!,False
65,புலவர் தேர்வைத் தனியாக எழுதலாம் என்னும் வாய்ப்பு!,False
66,"உயர்பள்ளி, மேல்பள்ளி என்பவற்றிலும் பல்கலைக் கழகத் தமிழியல் ஆய்வுக் களத்திலுமாக ஏறத்தாழ ஆண்டுகள் தமிழ்வாழ்வாக வாழ வாய்த்தது.",False
67,"தமிழ்த்தொண்டும், தமிழ்நெறித் தொண்டும் என்றும் விடுதல் அறியா விருப்பொடு செய்து கொண்டிருத்தலே இயற்கையோடு இயைந்த வாழ்வாகி விட்டது!",False
68,"புலமைத் தேர்வுக்குரிய பாடத்தளவிலோ, நூல்களின் அளவிலோ என் கல்வி நின்றது இல்லை!",False
69,தொல்காப்பியம் முதல் இற்றைநாள் நூல்கள் வரை இயன்ற அளவால் தமிழ்வளம் பெறுதலை நோன்பாகக் கொண்டு கற்கும் பேறுபெற்றேன்.,False
70,"இளந்தைப் பருவத்திலேயே பாவேந்தர், ஓகி சுத்தானந்த பாரதியார், கவிமணியார், கவிராச பண்டித செகவீர பாண்டியனார், அறிஞர் மு.வ.",False
71,ஆயோர் அரிய காட்சியும் சின்முறைச் சந்திப்புகளும் என்னுள் பசுமை நல்கின.,False
72,"தமிழ்ப் பொழிவுகளும், ஆய்வுக் கட்டுரைகளும், குடும்பச் சடங்குகளும் என் மீட்டெடுப்புப் பணிகள் ஆயின!",False
73,எம் குடும்பக் கடமைகள் எம் பணியையோ தொண்டையோ கவர்ந்து கொள்ளா வகையில் இனிய துணையும் மக்களும் அமைந்தனர்.,False
74,"அதனால், காலமெல்லாம் கற்கவும் கற்பிக்கவும் நூல் படைக்கவும் வாய்த்த வாய்ப்புப் பெரிதாயிற்று.",False
75,"செந்தமிழ், செந்தமிழ்ச் செல்வி, தமிழ்ப்பாவை, குறள் நெறி, குறளியம், மலர்கள், ஆய்வரங்கங்கள் எனக் கட்டுரைகள் பெருகின.",False
76,அச்சுக்கு வாராதவையும் ஆகின!,False
77,இவை என்றும் ஒருமுகமாய்க் கிடைக்க வாய்ப்பில்லை.,False
78,எம் நூல்கள் எம்மிடமே முப்பதுக்குமேல் இல்லாமல் மறைந்தன.,False
79,எழுதியன எல்லாவற்றையும் ஒருமுகமாகப் பெறப் பலர் அவாவினார்.,False
80,தவத்திரு ஆத்துமானந்த அடிகளார் ஆருயிர்க்கு அன்பர் அதில் தலைப்பட்டு நின்றார்.,False
81,ஆயர் ஆண்டகை சூசைமாணிக்கனார் சுடரேற்றினார்.,False
82,பாரதிதாசன் பல்கலைக்கழகம் மதிப்புறு முதுமுனைவர் பட்டம் வழங்கியது.,False
83,"அதற்கு மகிழ்வுற்ற வகையால் பாவாணர் தமிழியக்கம் முதலாம் அமைப்புகளும், முனைவர் திருமாறனார் முதலாம் ஆர்வலர்களும் விழா ஒன்று எடுத்தனர்.",False
84,அவ்விழாத் தலைமையைத் திருத்தகு துணைவேந்தர் பொன்னவைக்கோ ஏற்றார்.,False
85,தவத்திரு ஆத்துமானந்த அடிகளார் வாழ்த்துரைத்தார்.,False
86,தமிழாக்கப் பதிப்பே வாழ்வாக ஒன்றிய இளவழகனார் முழுதுற அச்சிட ஒப்பினார்.,False
87,அடிகளார் வெளியீட்டுப் பொறுப்பு ஏற்பதாகக் கூறினார்.,False
88,"அவ்வகையில் வாய்ப்பதே, இளங்குமரனார் தமிழ்வளம் என்னும் இத் தொகை நூல்களாம்!",False
89,"இத் தொகையில் விடுபடும் நூல்கள் கட்டுரைகள், பாடல்கள் பல்லபல.",False
90,தொகுக்க வாய்க்கா வகையில் கிட்டாவகையில் மறப்பு வகையில் விடுபாடுடையவை உள.,False
91,எனினும் தொண்ணுறு விழுக்காடேனும் ஒரு முகமாகப் பெறும் பேறு வாய்க்கின்றது என்பது மகிழ்வூட்டுவதாம்!,False
92,மக்கள் வாழ்வு வளர்நிலையது!,False
93,நூல்களும் வளர் நிலையவை!,False
94,ஆதலால் ஒருவாழ்வுக் கொடை மட்டுமன்று ஈது ஒருவாழ்வு பெறத் தக்க பல்பருவக் கொடையுமாம் எனல் சாலும்!,False
95,இவ்வளத்தை முழுதுற எண்ணின் ஒன்று உறுதியாக வெளிப்படும்.,False
96,நலவாழ்வு நல்வாழ்வு கருதாத இயற்கை இறைமைப் பொதுமை கருதாத எப்படைப்பும் எம்படைப்பில் இரா என்பதேயாம்.,False
97,இவற்றைப் பயில்வார் பெறும் பேறும் அதுவாக அமையின் அப்பேறே யாம் பெறும் பேறாம்.,False
98,இவ்வளம் வெளிவர விரும்பினோர் உழைத்தோர் உதவினோர் ஆய அனைவர்க்கும் நன்றிக் கடப்பாடுடையேன்!,False
99,வாழிய நலனே!,False
100,வாழிய நிலனே!,False
101,அகப்பொருள் .,False
102,களவொழுக்கம் .,False
103,தோழியாலாய கூட்டம் .,False
104,"அச்சொல் ஈண்டுக் களவு, கற்பு என்னும் கைகோள் இரண்டனுள் களவினைக் குறிப்பதாம்.",False
105,கைகோள் எனினும் ஒழுக்கம் எனினும் ஒக்கும்.,False
106,உலகியலில் பொதுவாகக் கடிந்து கூறப்பெறுவது களவு.,False
107,அது பொருட் களவாம்.,False
108,அவற்றுள் ஒன்றன்றாலோ இதுவெனின் அற்றன்று.,False
109,"களவு என்னுஞ் சொற்கேட்டுக் களவு தீதென்பதூஉம், காமம் என்னுஞ் சொற் கேட்டுக் காமம் தீதென்பதூஉம், அன்று.",False
110,மற்று அவை நல்ல ஆமாறும் உண்டு.,False
111,அவன் அக்களவினான் அவளை உய்யக் கொண்டமையின் நல்லூழிற் செல்லும் என்பது.,False
112,மற்றும் இதுபோல்வன களவாகா நன்மை பயக்கும் என்பது.,False
113,இனிக் காமம் நன்றாமாறும் உண்டு.,False
114,"மேன்மக்களாலும் புகழ்ப்பட்டு மறுமைக்கும் உறுதி பயக்கும் ஆதலின், இக்காமம் பெரிதும் உறுதியுடைத்து என்பது.",False
115,"இனி, உரையாசிரியர் இளம்பூரணவடிகள் தொல்காப்பியக் களவியல் உரைக்கண் இவ்வோத்து என்ன பெயர்த்தோ எனின் களவியல் என்னும் பெயர்த்து.",False
116,களவொழுக்கம் உணர்த்தினமையாற் பெற்ற பெயர்.,False
117,"களவாவது, பிறர்க்குரிய பொருள் மறையிற் கோடல்.",False
118,இது வேதத்தை மறை நூல் என்றாற் போலக் கொள்க என்று கூறுவதும் இக்கருத்தை வலியுறுத்துவனவாம்.,False
119,", ?",False
120,"என்னும் எனவே, மக்கள் பாட்டினானும் வலியானும் வனப்பானும் பொருளானும் பெறலாவது அன்று தவஞ்செய்தால் பெறல் ஆம்.",False
121,"என்னை, வேண்டிய வேண்டியாங் கெய்தலாற் செய்தவம் ஈண்டு முயலப் படும் என்பதாகலான் என்பது.",False
122,என்று வீடுபேற்றின்பத்தை விரித்துரைக்கும்.,False
123,அவனை வஞ்சித்துக்கொண்டு சென்று நன்னெறிக்கண் நிறீஇனமையின் களவியல் என்னுங் குறி பெற்றது.,False
124,"பாலது ஆணையால் ஊழால் இஃதியல்வதாகலின் தெய்வப் புணர்ச்சி, இயற்கைப் புணர்ச்சி முதலிய குறியீடுகளையும் களவுப் புணர்ச்சி பெறுவ தாயிற்று.",False
125,"ஆதலால், பழிப்புக் குரியதொன்றன்று இஃது என்பது போதரும்.",False
126,களவொழுக்கம் பற்றிக் கூறும் நூல் களவியல் ஆகும்.,False
127,"இறையனார் அகப்பொருளுக்குக் களவியல் என்றும், இறையனார் களவியல் என்றும் பெயருண்மை அறிந்ததே.",False
128,களவொழுக்கத்திற்கு இலக்கியமாக அமைந்த ஓரிலக்கியப் பகுதியும் களவியல் என்று பெயர் பெறுவது திருக்குறட் களவியலால் விளங்கும்.,False
129,இவ் விடங்களில் எல்லாம் இயல் என்பது நூலின் உட்பிரிவாகிய ஓத்து என்னும் பொருளதாம்.,False
130,களவியல் என்னும் பெயரே சாலுமாகவும் களவியற் காரிகை எனல் வேண்டுமோ எனின் வேண்டும் என்பதாம்.,False
131,"ஆதலால், தெளிவு கருதிக் களவியற் காரிகை எனல் வேண்டும் என்பது.",False
132,இனிக் காரிகை என்பதன் பொருள் யாதோ எனின் கூறுதும் களவு போலவே காரிகை என்பதும் பலபொருள் ஒரு சொல்லாம்.,False
133,"அவற்றுள் அழகு, பெண், கட்டளைக் கலித்துறை என்னும் மூன்று பொருள்கள் குறிப்பிடத் தக்கனவாம்.",False
134,இம்முப் பொருளும் ஒருங்கமையச் செய்யப் பெற்றது களவியற் காரிகை.,False
135,"திட்டமிட்ட அழகிய பகுப்பும், அந்தாதி அமைப்பும் உடையது பெண்ணை முன்னிலைப்படுத்துக் கூறுவது கட்டளைக் கலித்துறை யாப்பில் அமைந்தது.",False
136,களவியற் காரிகை என்னும் நூற்பெயர்த் தகவினை அறிந்தோம்.,False
137,"ஆயின், களவியலும், கற்பியலும் கூறும் நூற்குக் களவியல் எனக் குறியிட்டது தகுமோ எனின் தகும் என்பதாம்.",False
138,அது மிகுதியால் பெற்ற பெயராம்.,False
139,முதனூல் கருத்தன் எனத் தொடங்கும் நூற்பாவின் நன்.,False
140,உரைக்கண் மிகுதியால் பெயர் பெற்றது களவியல் என்று உரைகாரர் பலரும் உரைத்தமை அறியத் தக்கது.,False
141,முற்பகுதியும் பிற்பகுதியும் இடைப் பகுதி சிலவும் சிதைந்து போன இந் நூற் பெயர் தானும் அறியக் கூடாது ஒழிந்தது.,False
142,நூலாசிரியர் பெயரும் உரையாசிரியர் பெயரும் அறியக் கூடவில்லை.,False
143,இவ்வரிய நூலுக்கு இப்போது கிடைத்துள்ளது ஒரு கையெழுத்துப் பிரதியேயாகும்.,False
144,இது சென்னை அரசாங்கத் தாரது தொன்னூல் நிலையத்திலுள்ளது.,False
145,இப் பிரதி குறைப் பிரதியே இதன்கண் நூலின் முதலும் இறுதியும் காணப்பட வில்லை.,False
146,"அன்றியும், வாசிப்போர் பயனடையக்கூடாத வண்ணம் பிழை பொதிந்தும் இதழ்கள் முறை பிறழ்ந்தும் பலவாறாகக் கேடுற்றிருக்கின்றது.",False
147,இடையிடையே செய்யுள்களும் வாக்கியத் தொடர்களும் மறைந்து போய்விட்டன.,False
148,"எனவே, எத்துணை முயன்றாலும் முழுவதும் இதனைச் செப்பஞ் செய்தல் இயலாத தொன்றாம்.",False
149,இதன் உரை மிகவும் பாராட்டற்பாலது.,False
