Line Number,Sentence
324,தீத் தொழிற் படா அள் தீத்தொழிற் படுத்தற்குரியளல்லள் என்க.,False
325,பாவங்கள் பத்துவகைப்படு மென்பர்.,False
326,இவற்றின் விரியை இந்நூலின் ஆம் காதைகளானறிக.,False
327,"சீலம் ஐந்தனையும், கள்ளும் பொய்யுங் காமமுங் கொலையுங், உள்ளக் களவுமென் றுரவோர் துறந்தவை என்பதனானறிக.",False
328,"உய்வகை இவை என்றமையால் வீட்டைவார்க்கு வாய்மையும் சீலமும் இன்றியமையாதன வென்ப தாயிற்று,.",False
329,உரவோன் அருளினன் ஆதலால் யாம் தவநெறி நிற்றற்கே யுரியம் என விரித்துரைக்க.,False
330,ஊரலருரைத்த காதை முற்றிற்று.,False
331,"இதிற் கூறப்பட்டுள்ள களிமகன், பித்தன் என்போருடைய இயல்புகள் படித்து இன்புறற்பாலன.",False
332,ஒரு நகர வீதியில் இயல்பாக நிகழும் நிகழ்ச்சிகளை இடனறிந்து ஆசிரியர் வெளிப்படுத்தியுள்ள திறம் பாராட்டற்குரியது.,False
333,உரை .,False
334,மாமலர் நாற்றம்போல் என்ற உவமையால் நல்வினை பயனளித்தற் கெதிர்ந்துள தென்பது பெற்றாம்.,False
335,மலரின்கண் நாற்றம் அடங்கியிருந்து பின் வெளிப்படுதல் போல் கன்மமும் மறைந்திருந்து பயனளிக்குங் காலம் வந்துழி வெளிப்படு மென்க.,False
336,வரிமையெழுதிய கீற்று வரிவனப் புற்ற என்பது புறம்.,False
337,புலம்புநீர்தனித்து வீழ்கின்ற நீர்த் துளியுமாம்.,False
338,நீராட்ட நனைக்க என்றபடி.,False
339,"போல போலும்படி, தாமரை மலர் மாதவி கைக்கும், மதி மணிமேகலை முகத்திற்கும் உவமை.",False
340,காமர் விருப்பம் உடையாளது விருப்பம் கையின்மேல் ஏற்றப்பட்டது அழகுமாம்.,False
341,நிகர்ஒளி நீர்வார் நிகர் மலர் அரும்பவிழ் முல்லை நிகர் மலர் என்பன காண்க.,False
342,நீயே கொணர்வாய் என்றது கழுவாய் கூறுவது போன்று அவளது துயரினை மாற்றுவதோ ருபாயங் கருதியாம்.,False
343,ஆவின் கடைமணி யுகுநீர் என்பது ஈண்டு அறியற்பாலது.,False
344,அவளாற் பகைவெல்லக் கருதியிருந்த காமன் இனி வெல்லுதலரிதென்று படையை எறிந்து நடுங்குவா னென்க.,False
345,"உண்டோ, ஓ எதிர்மறை.",False
346,பெற்றி இயல்பு.,False
347,பெற்றியில் நிற்றலாவது இவளை விரும்பாது நிற்றல்.,False
348,ஆடவர் என்றது ஈண்டு இன்பத்துறை நிற்பாரைக் கருதிற்று.,False
349,பேடியர் பெண்ணின்பம் துய்க்குந் தகுதியில்லாதவர்.,False
350,ஈங்கு அசை.,False
351,காராளர்ஓர் சாதியார் வேளாளருமாம்.,False
352,சண்பை ஒரு நகரம் சீகாழியுமாம்.,False
353,"தாரன் ......படிமையன், என்னும் இவ்விரண்டடியும் சிலப்பதிகாரத்தும் வந்துள்ளமை அறிக.",False
354,காணாப் படிமையன் பலர்தொழு படிமையன் என்க.,False
355,கண்மாறி கண்ணோட்டமின்றி என்றுமாம்.,False
356,உழையோர் ஆங்குளர் என்றது அதன்கட் போகலாகாது என்றபடியாம்.,False
357,வானவர் விரும்புதலால் வண்டு இமிராவாயின சுரும்பு மூசாச் சுடர்ப்பூங்காந்தள் என்பது காண்க.,False
358,வாடாத மலர் மாலைகள் தேவர்களால் நிருமிக்கப்பட்டன.,False
359,மாலைகள் தூக்கலின் பூதங் காக்குமென்று கருதுவாராவர்.,False
360,உய்யானம் உத்தியானம் அரசர் விளையாடுஞ்சோலை.,False
361,புகார் நகரம் அப்பதிக்கு அணித்தாகலின் சம்பாதி ஆண்டு வந்திருத்தல் இயல்பேயாகும்.,False
362,யாப்புடைத்தாகஇழுக்கில்லனவாக யாப்புடைத்தாக அணங் குடைய என்றியைத்தலுமாம்.,False
363,அன்பு அருட்கு முதலாகி மனத்தில் நிகழும் நேயம்.,False
364,பூட்கை மேற்கோள்.,False
365,அறை போதல்வெளியே போதல்.,False
366,"தன்னுள் எய்தினவரது ஓசையை வெளிப்படுத்தாது, உருவினை மட்டும் வெளிப் படுத்துவதென்று பளிங்கு மண்டபத்தின் இயல்பு கூறியபடி.",False
367,பளிக்கறை மண்டபம்பளிங்கறையாகிய மண்டபம் பளிங்குப் பாறையாலாகிய மண்டபமுமாம்.,False
368,தாமரைப் பீடிகைபுத்தன் பாதபீடம்.,False
369,மறந்தேன் என்றது உலக வழக்குப் பற்றி.,False
370,கடம் கடன் காணிக்கை.,False
371,வைத்தோர் முற்றெச்சம்.,False
372,மலரை இடின் என்க.,False
373,செம்மை ஈண்டுத் தகுதி.,False
374,கரண்டை கரண்டகம் குண்டிகை கல்பொளிந் தன்ன விட்டுவாய்க் கரண்டைப் பல்புரிச் சிமிலி நாற்றி என்பது காண்க.,False
375,அராந்தாணம் அருகத்தானம்.,False
376,"வந்தீரடிகள், எந்தமடிகள், மெய்த்தவத்தீர் எனக் களிமகன் பலகாற் கூறுவது இகழ்ச்சி.",False
377,மண்ணா மேனியன் ஆகலின் அழுக்குடை யாக்கை என்றான்.,False
378,தலைமகன் ஆசான்.,False
379,கொலையுமுண்டோ என்றது கொலை யொன்றுமே கடியற்பாலதென்பதனை உடன்பட்டபடி.,False
380,தெங்கின் விளைபூந் தேறல் என்றது தேறலின் தூய்மை கூறியபடியாம்.,False
381,இவ் யோகத்து நும்முடைய தவத்தில்.,False
382,இதனினும் உறுபயன் என விரிக்க.,False
383,"இனி, யோகம் தேறலின் சேர்க்கை யென்றுமாம் இதற்கு, கண்டால் அகற்றும் என்றது கண்டபின் அகற்றகில்லீர் என்னும் குறிப்பிற்று.",False
384,கையுதிர் கொள்ளுதல்கையை.அசைத்து விலக்குதல் சீலமில்லாரைக் காணின் அவருடன் பேசாது அவரைப் போம்படி கையசைத்துக் குறிப்பித்தல் சைன முனிவர்க்கு இயல்பு.,False
385,கரண்டையனும் பிரம்பின்னும் ஆகிய ஆராந்தாணத்துள்ளோன் நோன்போடு மேனியனாய் நீத்து ஏங்கி வருபவனை என்றியைத்துலுமாம்.,False
386,தருவதும் உரைத்ததுமாகிய தேறலில் கொலையுமுண்டோ எனக் கூட்டுக.,False
387,தரூஉம் தலைமகன் எனலுமாம்.,False
388,"கொள்ளும், உண்ணும் என்னும் ஏவல் முற்றுக்களில் ஈற்றுமிசை யுகரம் மெய்யொடுங் கெட்டது.",False
389,உரீஇஉருவி பூசி.,False
390,ததர்கொத்துமாம் சிதர்நனை முருக்கின் சேணோங்கு நெடுஞ்சினைத் ததர் என்பதும் காண்க.,False
391,வெண்பலிவெண் ணீறு சாம்பல்.,False
392,வெண்பலியாகிய சாந்தமெனக் கொண்டு வல்லொற்று விகாரத்தாற் றொக்க தெனினுமாம்.,False
393,சுழலலும் சுழலும்சுழலுதலையும் செய்யும் பின்வருவன வற்றிற்கும் இங்ஙனம் பொருள் கொள்க இயங்கலு மியங்கு மயங்கலு மயங்கும் என்பதூஉம் அது.,False
394,கொடி ஒழுங்குமாம்.,False
395,புருவமும் இரண்டு பக்கத்தும் வளைந்து நுதலும் என்றுரைத்தலும் பொருந்தும்.,False
396,இகந்ததாள் முழுவதும் இல்லாத.,False
397,முன் ஆடிய பேடு இப்பொழுது நடிக்கப்படுவ தனை யென்க.,False
398,"பேடுபதினோராடலுள் ஒன்றுஅப் பதினொன்றையும், அவற்றை நிகழ்த்தியவர்களையும்.",False
399,படிவம் தெய்வ வடிவம்.,False
400,வித்தகர்சிற்பாசாரியர் வித்தக ரியற்றிய என்பர் பின்னும்.,False
401,கயிற்கடைகொக்கி கொக்கின் வாய்போல்வதாகலின் கொக்கி எனப்பட்டது.,False
402,பிறைச் சென்னிபிறைவடுவாகிய அணியின் இரு கோடுகளில் என்றுரைப் பாருமுளர்.,False
403,சிறிதாய நீரைச் சின்னீர் என்றல் ஓர் இலக்கணை வழக்கு.,False
404,கம்பலை மாக்கள் வேறு சில காட்சி கண்டு முழங்கித் திரியுமவர்.,False
405,அணி அமை தோற்றத்து அணிகள் இல்லாத தோற்றத்துடன் என்றுமாம்.,False
406,சீவக சிந்தாமணியில் உப்பமை காமத்துப்பின் நிகரமைந்த முழந்தாளும் என்னுமிடங்களில் அமை என்பதற்கு இப்பொருள் கூறப்படுதல் காண்க.,False
407,மயில்கள் கற்றற்குத்தானும் முன்வந்து நிற்கமாட்டா என்றபடி.,False
408,சாயல் மென்மை.,False
409,எஞ்சுதல் குறைதல் தோற்றல்.,False
410,சென்று என ஒரு சொல் வருவிக்க.,False
411,"பிடவம்குட்டிப் பிடவம் என்னும் கொடி புதன்மிசைத் தளவினிதன்முட் செந்நனை, நெருங்குகுலைப் பிடவமோ டொருங்கு பிணியவிழ என்பது அகம்.",False
412,பரப்பி பரப்ப வென்க.,False
413,புத்தன் பாதபீடிகையுள்ள தாகலின் வனத்தைத் தொழுது காட்டினள் என்க.,False
414,மலர்வனம் புக்க காதை முற்றிற்று.,False
415,"பளிக்கறை புக்க காதை உவவனத்திலும், அதன்கண் உள்ள பொய்கையிலும் நிகழும் இயற்கைக் காட்சிகளைச் சுதமதி காட்ட மணிமேகலை காண்பாளாயினாள்.",False
416,இக்காதையின் முதற்கண் உள்ள இயற்கைப் புனைவுகள் இன்பம் விளைப்பன.,False
417,உரை .,False
418,"தானைக்குதானையால், ஞாயிற்றின் கதிரால் துரத்தப்பட்ட உலகினிருளெல்லாம் புகுந்திருந்தாற் போலும் இருட்சியையுடைய பொழில் என்க.",False
419,மருள்மருட்கை வியப்பு.,False
420,தும்பி வண்டின் ஓர் கிளை.,False
421,"கொம்பர்த் தும்பி குழலிசை காட்டப், பொங்கர் வண்டின நல்லியாழ் செய்ய எனப் பின்னரும் வருதல் காண்க.",False
422,இலை களின் செறிவாலே குயில்கள் நுழைந்து செல்லும் இளமரக்கா வென்க வெயினுழை பறியாக் குயினுழை பொதும்பர் என்பது பெரும்பாண்.,False
423,காண்பன காண்டல் எனத் தொழிற் பெயருமாம்.,False
424,மயில் தனக்குமயிலினது ஆட்டத்திற் கியைய.,False
425,விளித்தல்பாடுதல் விளியாதான் கூத்தாட்டு விளித்தலின்னமிர் துறழ் கீதம் என்புழி விளித்தல் இப்பொருள்படுதல் காண்க.,False
426,இது மலர் எனக் கூட்டி இம் மலர் என உரைக்க.,False
427,"அது, சாதி யொருமை பிறழ்வனவென மேல் வந்தமையின்.",False
428,இரை இழந்து பெறாமையால் அவ்விரையை யிழந்தென்க.,False
429,மணி நீலமணி புலவுக்கய லெடுத்த பொன்வாய் மணிச்சிரல் என்பது காண்க.,False
430,சிரல் சிச்சிலிப்புள் இது மீன் கொத்தி யென்றும் கூறப்படும்.,False
431,"பொய்கை வனத்தின் உறுப்பாகலின், வனங்காண்புழி யென அதிலடக்கிக் கூறினர்.",False
432,மன்னவன் சோழன்.,False
433,பிளவை அங்குசத் தாற் பிளக்கப்பட்ட புண்.,False
434,பாகின் பிளவைபாகனுடைய உடற் பிளவு என்றுமாம்.,False
435,"இருவகைப் பெயரினை, இருபாற் பெயரிய வுருகெழு மூதூர் என்பதன் உரையா லறிக.",False
436,"பாகு பாகன் பறை பறையடிப் போர் யானைக்கு முன்பு பறையடிக்கப்படுதல் மரபென்பதனை, நிறையழி கொல்யானை நீர்க்குவிட் டாங்குப்.",False
437,"பறையறைந் தல்லது செல்லற்க வென்னா, இறையே தவறுடை யான் என்பதனாலறிக.",False
438,ஆதுலமாக்கள் தெருவிலே திரிவராகலின் அவரையுங் கூறினார்.,False
439,"பருந்தின் பந்தர் உணவின்பொருட்டுப் பந்தரிட்டாற்போல் மேலே செல்லும் பருந்தினம், வரை நிலனொடு படர்ந்தென என்பது இல் பொருளுவமம்.",False
440,நிலனொடு நிலமிசை.,False
441,களி மதம்.,False
442,"கொடிஞ்சிதாமரைப்பூ வடிவமாகப் பண்ணித் தேர்த் தட்டின் முன்னே நடுவது, என்பர் நச்சினார்க்கினியர்.",False
443,"கொடிஞ்சி நெடுந்தேர், என்பதன் உரை காண்க.",False
444,இது தாமரை மொட்டு வடிவமுள்ளதென்று கூறுவாருமுளர்.,False
445,இச் சொல்லினுருவம் கொடுஞ்சி யெனவும் காணப்படும்.,False
446,ஆர் ஆத்தி.,False
447,கால்போகு பெருவழியாகிய பொளித்த சாளரம் என்க.,False
448,மகரயாழ் நால்வகை யாழினுளொன்று பதினேழு நரம்புடையது என்பர்.,False
449,கோடு யாழ்த்தண்டு.,False
450,வட்டிகை எழுதுகோல்.,False
451,எட்டி வணிகர் பெறும் பட்டப் பெயர் எட்டிப் பூப்பெற் றிருமுப் பதிற்றியாண் டொட்டிய செல்வத் துயர்ந்தோ னாயினன். என்பர்.,False
452,மயங்கி மாதர் தன்னொடும் இருந்தோய் என்க.,False
453,பாங்கில் முறைமையால் என்றுமாம்.,False
454,"மணிமேகலையைக் கண்டவுடன் கோவலனுற்ற துன்பம் நினைவிற்கு வந்தமையின், மணிமேகலை யொடு...துயர்தோன்ற, என்றான் இறைகொண்டயாழிலே தங்கிய.",False
455,கோவலன் தன் குலத்தோன்றலாகலின் அவனுற்ற துயரை நினைந்து மயங்கினேனென்றானென்க.,False
456,மாடங்கட்கு மழையும் தேருக்கு மதியமும் உவமை மதியினை உதயகுமரனுக்கு உவமை யாக்கலுமாம் .,False
457,கலை நிரம்பினமையின் இதற்கு மதியம் போலக் குறுக வென்றியைக்க.,False
458,கார் அணி மேகத்தை மீது அணிந்த.,False
459,ஆயிழை விளி.,False
460,"பணியாளர் ஐந்துவிற்கிடை தூரத்தே நிற்றல் மரபு ஐவிலினகல நின்றாங் கடிதொழு தறைஞ்சினாற்கு, என்பது காண்க.",False
461,"நீங்காது நின்றனள் அங்ஙனம் நின்ற நேரிழையை என அறுத்துரைத்து, நேரிழையைக் கண்டு என ஒரு சொல் விரித்துரைக்க.",False
462,அரசிளங்குமரன் சுதமதியைக கண்டு உன் திறம் அறிந்தேன் என்று கூறியென்க.,False
463,முளை எயிறு முளைபோலும் எயிறு முளைத்த எயிறுமாம்.,False
464,வெங்கணைவிருப்பத்தைச் செய்யுங் கணையுமாம்.,False
465,வியப்பு வியக்குஞ் செய்தி.,False
466,செவிமருங்கோடுதல் உரைப்பது போலு மென்றானென்க.,False
467,சங்கத்தை நீங்கினளாதலைத் தமியள் என்றான்.,False
468,மருகற்கு முன்னிலையிற் படர்க்கை.,False
469,"புனைவன சந்தனம், மலர் முதலியன.",False
470,மூப்பு என்பதும் பாடம்.,False
471,அரவு அடங்கு புற்றின் என மாறுக.,False
472,என்றாள் என்று அவளுரைத்த சொல் என வேறறுத் துரைக்க.,False
473,பளிக்கறை புக்க காதை முற்றிற்று.,False
474,கூறுதி என்றான்.,False
475,"கூறலும் அவன், சிறையுமுண்டோ செழும்புனல் மிக்குழி, நிறையுமுண்டோ காமம் காழ்க்கொளின்?",False
476,அப்பொழுது பகற்பொழுது நீங்க அந்திமாலை வந்துற்றது.,False
477,இதன்கண் சுதமதி வரலாறு கூறும் வாயிலாகச் சமணரினும் புத்தர்கள் அருளுடையோ ரென்பது வலியுறுத்தப்படுகின்றது.,False
478,புத்த தேவனைப் பரவுதல் நன்கமைந் துள்ளது.,False
479,உரை .,False
480,திருவின் செய்யோள் திருவாகிய செய்யோள் திருமகள் இன் சாரியை.,False
481,உருவி லாளனொ டுருவம் பெயர்ப்ப என்பதன் கருத்து இவளுருவைக் கண்டவுடன் இளங்கோவனுக்குக் காமவுபாதை உண்டாயிற் றென்பதாம்.,False
482,வாயில் காண்டற்கு மண்டபத்தைத் தடவிச் சூழ்ந்தனனென்க.,False
483,சுதமதி காவற் பெண்டாகலின் நின் இளங்கொடி என்றான்.,False
