Line Number,Sentence
1,சிலப்பதிகாரக் காட்சிகள் வரலாற்றுப் பேரறிஞர் மா.
2,இராசமாணிக்கனார் நிலவன் பதிப்பகம் நூற் குறிப்பு நூற்பெயர் சிலப்பதிகாரக் காட்சிகள் ஆசிரியர் வரலாற்றுப் பேரறிஞர் மா.
3,இராசமாணிக்கனார் பதிப்பாளர் முனைவர் க.
4,படிகள் மேலட்டை தமிழ்க்குமரன் வி.
5,சித்ரா நூலாக்கம் வி.
6,"சித்ரா அச்சிட்டோர் வெங்கடேசுவரா ஆப்செட் பிரிண்டர் வடபழனி, சென்னை ."
7,"வெளியீடு நிலவன் பதிப்பகம், பி , பாண்டியன் அடுக்ககம், சீனிவாசன் தெரு, தியாகராய நகர், சென்னை ."
8,நூல் கிடைக்குமிடம் தமிழ்மண் பதிப்பகம் .
9,"காட்சிகள், தேவையான இடங்கள் விளக்கமாகவும் தேவையற்ற செய்திகள் சுருக்கமாகவும் அமையப் பெற்றவை."
10,"சேக்கிழார் அகம், சென்னை."
11,என் தந்தையின் பதிப்புச் சுவடுகளைப் பின்பற்றி எம் பதிப்புப் பணியைச் செய்து வருகிறேன்.
12,தமிழ்ப் பேரறிஞர் முனைவர் மா.
13,இவற்றில் நூல்களை இல் எம் பதிப்பகம் வெளியிட்டுள்ளது.
14,தொடர் பணியாக இல் நூல்களை தமிழுலகம் பயன்படும் வகையில் எம் பதிப்பகம் வெளியிட்டுள்ளது.
15,இதனை அனைவரும் படித்துப் பயன்பெற வேண்டுகிறேன்.
16,தமிழமுது நுழையுமுன் மனிதரில் தலையாய மனிதரே!
17,"மொழி, இனம், நாடு எனத் தமிழ் கூறும் நல்லுலகம் பற்றி ஆழச் சிந்தித்தவர்களுள் அவர் குறிப்பிடத்தக்கவர்."
18,"தாமுண்டு, தம் குடும்பமுண்டு, தம் வேலையுண்டு என்று அவரால் இருக்க முடியவில்லை."
19,"மொழி நலம், தமிழ்த் திருமணம், சாதி மறுப்பு என்பன அவருடைய தொடக்கக் காலக் களங்களாக அமைந்தன."
20,"தாய்மொழித் தமிழ், தமிழரிடையே பெறவேண்டிய மதிப்பையும் பயன்பாட்டையும் பெறாமலிருந்தமை அவரை வருத்தியது."
21,தமிழ் நமது தாய்மொழி ஈன்ற தாயைப் போற்றுதல் மக்களது கடமை.
22,ஒரு தமிழன் மற்றொரு தமிழனோடு பேசும்போது பெரும்பாலும் பிறமொழிச் சொற்களைக் கலந்தே பேசுவதைக் காண்கிறோம்.
23,இப்பிறமொழிச் சொற்கள் நம் மொழியிற் கலந்து தமிழ் நடையைக் கெடுத்துவிடுகின்றன.
24,மொழிக் கொலை புரிவதில் முதற்பரிசு பெறத்தக்கவர் நம் தமிழரே ஆவர்!
25,நம் தமிழ்நாட்டுச் செய்தித் தாள்களில் தமிழ்ப் புலமையுடையார் பெரும்பாலும் இல்லையென்றே கூறலாம்.
26,இவற்றைத் தமிழ்ச் செய்தித்தாள்கள் என்று கூறுவதற்குப் பதிலாக கலப்பு மொழிச் செய்தித்தாள்கள் என்று கூறுதலே பொருந்தும்.
27,"இவ்வாறு செய்தித் தாள்களில் மொழிக் கொலை புரிவோர் வேற்று நாட்டவரல்லர், வேறு மொழி பேசும் அயலாரல்லர்."
28,தமிழகத்தில் பிறந்து தமிழிலேயே பேசிவரும் மக்களாவர் என்பதை வெட்கத்துடன் கூற வேண்டுபவராக இருக்கிறோம்.
29,நாடு முழுவதும் மொழி நலம் குன்றியிருந்தமையைத் துறை சார்ந்த சான்றுகளோடும் கவலையோடும் சுட்டிக் காட்டியதோடு இராசமாணிக்கனார் நின்றுவிடவில்லை.
30,"மொழியை எப்படி வளர்ப்பது, காப்பாற்றுவது, உயர்த்துவது என்பதே அவருடைய தொடர்ந்த சிந்தனையாக இருந்தது."
31,காலங் காலமாக அடிமைப்பட்டுக் கிடந்த சமுதாயம் அவர் கண் முன் நின்றது.
32,வடமொழி ஆதிக்கமும் ஆங்கிலப்பற்றும் தமிழ் மக்களின் கண்களை மூடியிருந்தன.
33,அக்கடமையை நிறைவேற்ற அவர் கையாண்ட வழிகள் போற்றத்தக்கன.
34,தம்முடைய மாணவர்களை அவர் முதற்படியாகக் கொண்டார்.
35,நல்ல தமிழில் பேசவும் எழுதவும் அவர்களுக்குப் பயிற்றுவித்தார்.
36,சிறுசிறு கட்டுரைகளை உருவாக்கப் பயிற்சியளித்தார்.
37,மொழிநடை பற்றி அவர்களுக்குப் புரியுமாறு கலந்துரையாடினார்.
38,மொழி நடையைச் செம்மையாக்குவது இலக்கணமும் பல நூல்களைப் படிக்கும் பயிற்சியுமே என்பதை விளங்க வைத்தார்.
39,இலக்கணப் பாடங்களைப் பள்ளிப் பிள்ளைகள் விரும்பிப் படிக்குமாறு எளிமைப்படுத்தினார்.
40,அதற்கெனவே நூல்களை உருவாக்கினார்.
41,பயிலும் நேரம் தவிர்த்த பிற நேரங்களிலும் மாணவர்களுடன் உரையாடித் தமிழ் மொழியின் வளமை குறித்து அவர்களைச் சிந்திக்கச் செய்தார்.
42,"அவரிடம் பயின்றவர்களுள் பலர் பின்னாளில் சிறந்த தமிழறிஞர்களாகவும், நூலாசிரியர்களாகவும் உருவானமைக்கு இத்தகு பயிற்சிகள் உரமிட்டன."
43,வண்ணையம்பதியில் தனலட்சுமி தொடக்கப் பள்ளியில் பேராசிரியரின் தமிழ்த்தொண்டு தொடங்கியது.
44,அங்குத் தொடர்ந்து வகுப்புகள் நடத்தினார்.
45,பணிகளில் இருந்தவர்களுக்கு வார இறுதி நாட்களில் தமிழ் வகுப்பெடுத்தார்.
46,உறவினர்களைக் கூட அவர் விட்டு வைக்க வில்லை.
47,குடியரசு இதழில் சொற்ப ஊதியத்தில் பணியாற்றிக் கொண்டிருந்த தம் மைத்துனர் பு.
48,"செல்வராசனை வித்துவான் படிக்க வைத்து, சென்னை அப்துல் அக்கீம் உயர்நிலைப் பள்ளியில் தலைமைத் தமிழாசிரியராகப் பணிபெறச் செய்தார்."
49,"கல்வி வழி விழிப்புணர்வில் பெருநம்பிக்கை கொண்டிருந் தமையால், அரசியலாரும் சமூகத் தலைவர்களும் நாடெங்கும் கல்விக் கூடங்களை ஏற்படுத்த வேண்டும்."
50,பெண்கள் பின்தங்கிய காலம் அது.
51,அடுப்பூதும் பெண்ணுகளுக்குப் படிப்பெதற்கு என்று கேட்டவர்கள் மிக்கிருந்த காலம்.
52,அந்தக் கால கட்டத்தில்தான் பேராசிரியர் பெண் கல்விக்காகக் குரல் கொடுத்தார்.
53,"எட்டாம் வகுப்பே படித்திருந்த தம் மனைவிக்குத் தாமே ஆசிரியராக இருந்து பயிற்றுவித்து அவரை, வித்துவான் பட்டம் பெறச் செய்தார்."
54,என் கணவர் எனக்கு ஆங்கிலப் பாடமும் தமிழ்ப்பாடமும் கற்பித்து வந்தார்.
55,பாடம் கற்பிக்கும் நேரத்தில் பள்ளி ஆசிரியராகவே காணப்பட்டார்.
56,ஒவ்வொரு பெண்ணும் தன்னைக் காத்துக் கொள்ளும் வகையில் கல்வி கற்றுப் பொருளீட்ட வேண்டும் என்பது என் கணவர் கருத்து.
57,"அதனால், என்னைப் பெண்கள் பள்ளியில் தமிழாசிரியராக அமர்த்தினார்."
58,அவருடைய ஆசிரியப் பணி அதற்குத் துணையானது.
59,தம்மிடம் பயில வந்தவர்க்கு மொழியுணர்வூட்டினார்.
60,தமிழகத்தில் ஆட்சி தமிழிலேயே இயங்க வேண்டும்.
61,எல்லாக் கல்வி நிலையங்களிலும் ஆங்கிலம் ஒழிந்த எல்லாப் பாடங்களையும் தமிழில் கற்பித்தல் வேண்டும் என்பது அவர் கொள்கையாக இருந்தது.
62,அறிவியல் மனப்பான்மையை ஊட்டி வளர்க்கும் முறையில் அமைந்த பாடநூல்களையே பிள்ளைகள் படிக்கும்படிச் செய்தல் வேண்டும்.
63,உலக நாடுகளோடு தம் நாட்டை ஒப்பிட்டுப் பார்த்துக் குறைகளை நிறைவாக்கும் மனப்பாங்கு வளரும்படியான முறையில் கல்வி அளிக்கப்படல் வேண்டும்.
64,அதற்காகவே தாம் பணியாற்றிய பள்ளிகளிலும் கல்லூரிகளிலும் இருந்த மாணவர் மன்றங்களைச் செயலூக்கம் பெற வைத்தார்.
65,தமிழ் மன்றங்கள் இல்லாத கல்வி நிலையங்கள் அவற்றைப் பெறுமாறு செய்தார்.
66,பேச்சையும் எழுத்தையும் இளைஞர்கள் வளப்படுத்திக் கொள்ள உதவுமாறு வழியும் வகையும் என்றொரு சிறு நூல் படைத்தளித்தார்.
67,இங்ஙனம் மொழியுணர்ச்சி கொள்ளும் மக்களிடையே தான் நாட்டுப்பற்றும் இனவுணர்ச்சியும் சிறந்து தோன்றும்.
68,"ஆதலின், ஓரினத்தவர் இனவொற்றுமையோடு நல் வாழ்வு வாழ மொழிநூலறிவு உயிர்நாடி போன்ற தாகும்."
69,"தமிழ் மக்களுக்கு மொழிப் பற்றையும், மொழியறிவையும் ஊட்டிய அதே காலகட்டத்தில், அவர்களை நாட்டுப்பற்று உடையவர்களாகவும் மாற்றினார்."
70,நாட்டுக்காக உழைத்த அறிஞர்களின் வரலாறுகளைச் சிறுசிறு நூல்களாக்கி இளைஞர்கள் அவற்றைப் படித்துய்ய வழிவகுத்தார்.
71,"இளைஞர்கள் படித்தல், சிந்தித்தல், தெளிதல் எனும் மூன்று கோட்பாடுகளைக் கைக்கொண்டால் உயரலாம் என்பது அவர் வழிகாட்டலாக இருந்தது."
72,தாமாக எண்ணும் ஆற்றல் உள்ளவரும் உண்மையான தமிழ்ப்பற்று உடையவருமே நல்ல எழுத்தாளர்.
73,"தமிழ் எழுத்தாளர் தமிழ் இலக்கண, இலக்கியங்களைப் படித்தவராக இருப்பது நல்லது."
74,தாழ்ந்துள்ள தமிழ்ச் சமுதாயத்தை உயர்த்தப் பயன்படும் நூல்களை எழுதுவதையே எழுத்தாளர்கள் தங்கள் சிறந்த கடமையாகக் கருத வேண்டும்.
75,சிறந்த கருத்துக்களோடு பிழையற்ற எளிய நடையையும் பொதுமக்களுக்கு ஊட்டுவது எழுத்தாளர் கடமை என்பதை அவர்கள் மறந்து விடலாகாது.
76,இதுவே அறநெறிப்பட்ட எழுத்தாளர் கடமை என்பதை நான் வற்புறுத்த விரும்புகிறேன்.
77,"சாதிகள் ஒழிந்து சடங்குகள் அற்ற சமயம் நெறிப்படத் தமிழர், தமிழ் வாழ்வு வாழ வேண்டுமென்பதில் அவர் கருத்தாக இருந்தார்."
78,"அதனால் தான், வாழ்க்கையின் தொடக்க நிலையான திருமணம் தமிழ்த் திருமணமாக அமைய வேண்டுமென அவர் வற்புறுத்தினார்."
79,"இதற்காகவே அவர் வெளியிட்ட தமிழர் திருமண நூல், தமிழ்ப் பெரியார்களின் ஒருமித்த வரவேற்பையும் பாராட்டையும் பெற்றது."
80,எல்லோரும் வேலை செய்து பிழைக்கவேண்டும்.
81,ஒழுக்கம் வேண்டும்.
82,எல்லோரும் ஒழுக்கத்திற்கு மதிப்பைத் தரவேண்டும்.
83,ஒழுக்கம் உயிரினும் சிறந்தது.
84,ஒழுக்கத்தோடு உறையும் கல்விதான் மனிதனை உயர்விக்கும் என்று தெளிவுபடுத்தியுள்ளார்.
85,"மறுபிறப்பு நேர்ந்தால், மீண்டும் தமிழகத்தே பிறக்க வேண்டும் என்று அவாவிக் கட்டுரைத்த தமிழ்மண் பற்றாளர்."
86,டாக்டர் இரா.
87,கலைக்கோவன் உள்ளுரை பக்கம் .
88,காவிரிப்பூம்பட்டினம் .
89,கோவலன் கண்ணகி திருமணம் .
90,மணமக்கள் வாழ்க்கை .
91,மாதவி நடனம் .
92,கோவலனும் மாதவியும் .
93,மதுரைப் பிரயாணம் .
94,மதுரை மாநகரம் .
95,கோவலனும் கண்ணகியும் .
96,கோவலன் கொல்லப்படுதல் .
97,கண்ணகி துயரம் .
98,கண்ணகி வழக்குரைத்தல் .
99,கண்ணகி விண்ணகம் புகுதல் .
100,சேரன் செங்குட்டுவன் .
101,பத்தினிக் கோவில் .
102,"அது, காவிரியாறு கடலொடு கலக்கும் இடத்தில், அதன் இரண்டு கரைகளிலும் அமைந்திருந்தது."
103,அந்நகரம் கடலுக்கு இரையாகி விட்டது.
104,இப்பொழுது அங்கு மணல் மேடுகளும் வயல்களும் சிலு வீடுகளுமே இருக்கின்றன.
105,"அந்த இடத்தில் பழைய காலத்துப் பானை ஓடுகள், உறை கிணறுகள், பண்டைக்கால நாணயங்கள் முதலியன பூமிக்குள் இருந்து கிடைக்கின்றன."
106,பண்டைய நிலைமை ஆண்டுகளுக்கு முன் அந்த இடம் பெரிய நகரத்தைப் பெற்றிருந்த இடமாகும்.
107,காவிரிப்பூம்படினம் சோழ நாட்டுத் தலைநகரம் ஆகும்.
108,"சோழ நாடு என்பது தஞ்சாவூர், திருச்சிராப் பள்ளி மாவட்டங்களைக் கொண்ட நிலப்பகுதியாகும்."
109,அதனைச் சோழர் என்ற அரச மரபினர் நெடுங்காலமாக ஆண்டு வந்தனர்.
110,நகரப் பிரிவுகள் காவிரிப்பூம்பட்டினம் சோழர் தலைநகரமாக இருந்தது சோழ நாட்டுக்குத் துறைமுக நகரமும் அதுவே ஆகும்.
111,இந்த இருவகைச் சிறப்பினால் அந்த நகரம் மிக்க சிறப்படைந்து விளங்கியது.
112,"அதற்குப் புகார், பூம்புகார் என்ற பெயர்களும் வழங்கின."
113,"புகார் நகரம் மிகப் பெரியது அக நகர், புற நகர் என்ற இரண்டு பிரிவுகளாகப் பெற்றிருந்தது."
114,அக நகர் அக நகர் நடுவில் மன்னவன் மாளிகை நடுநாயகமாக வானுற ஓங்கி வளம்பெற விளங்கியது.
115,"அதனைச் சூழ்ந்து தேர்ப்பாகர், யானைப்பாகர், குதிரைப்பாகர், படைத்தலைவர், வீரர் என்பவர் விடுதிகளைக் கொண்ட தெருக்கள் திகழ்ந்தன."
116,அரச மரபினர் வாழும் அழகிய தெருக்கள் இருந்தன.
117,அந்தணர் உறையும் அகன்ற தெருக்கள் இருந்தன.
118,வணிகர் வாழும் வளம்மிக்க வீதிகள் காணப்பட்டன..
119,உழவர் வசிக்கும் உணவு மிக்க தெருக்கள் காட்சி அளித்தன.
120,இடையிடையே பல கோவில்கள் இருந்தன.
121,அக்கோவில்கட்கு அப்பால் அறச்சாலைகளும் வேள்விச் சாலைகளும் கல்விச்சாலைகளும் அமைந்து விளங்கின.
122,பொதுமக்கள் வந்து தங்கியிருப்பதற்கும் அயல் ஊராரும் நாட்டாரும் வந்து தங்குவதற்கும் வசதியாகப் பல மன்றங்கள் பொது இடங்கள் இருந்தன.
123,புறநகர் புறநகர் என்பது கடற்கரை ஓரத்தில் இருந்த நகரப் பிரிவாகும்.
124,அங்குப் பெரிய மாளிகைகள் பொலிவுற்று விளங்கின.
125,அவற்றில் மான் கண்களைப் போன்ற சாளரங்கள் பல இருந்தன.
126,திசை மயங்கிச்செல்லும் கப்பல்களுக்குத் திசை அறிவித்து நின்ற கலங்கரை விளக்கம் இருந்தது.
127,"பருத்தி நூல், பட்டு நூல், எலி மயிர், ஆட்டு மயிர் இவற்றால் ஆடை நெய்யும் சாலியர் தெருக்கள் இருந்தன."
128,"இரும்பு, வெண்கலம், பித்தளை, செம்பு, வெள்ளி இவற்றால் பலவகைப் பொருள்களைச் செய்யும் தொழிலாளர் தெருக்கள் இருந்தன."
129,நாள் அங்காடி இந்த இரண்டு நகரங்கட்கும் இடையில் பெரிய சோலை ஒன்று உண்டு.
130,அச்சோலையில் பெரிய சந்தை நாள்தோறும் கூடும்.
131,அது நாள் அங்காடி எனப்பட்டது.
132,அங்குப் பெரிய பூதத்தின் கோவில் இருந்தது.
