Line Number,Sentence
1165,இக் கருத்து முன்னரும் வந்துள்ளமை காண்க.,False
1166,இனி மயங்கி யென்பதற்குச் சீதையைப் பிரிந்து கையா றெய்தி யென் றுரைத்தலுமாம்.,False
1167,"முந்நீர் படைத்தல், காத்தல், அழித்தல் என்னும் மூன்று நீர்மையை யுடையது கடல்.",False
1168,இட்டது வினைப்பெயர்.,False
1169,"ஆருயிர் மருந்து அடிசில், மருத்துவி மருந்தினையுடையாள்.",False
1170,"காரிகை நோக்கி வணங்கி, என்னோய் துடைப்பா யென்றலு மென்க.",False
1171,பசி நீங்கி பசி நீங்க எச்சத்திரிபு.,False
1172,உருப்ப அழலவென்றுமாம்.,False
1173,காணிய செய்யிய வென்னும் வினையெச்சம்.,False
1174,வந்தேன் எச்சமுற்றுமாம்.,False
1175,இடு மணல் எக்கர்.,False
1176,ஓர் அசை.,False
1177,"நாறு பூ எனவும், பரப்பிற் பொய்கை யெனவும் இயையும்.",False
1178,விருச்சிக னென்போன் நாவற்பழமொன்றை ஏந்தி வைத்துப் பொய்கையாடச் சென்றானாக என்க.,False
1179,திப்பியம்தெய்வலோகத்திலிருந்து உண்டாய தென்றுமாம்.,False
1180,உண் கனி திப்பியமான நாவல் தந்த கனியாகிய யான் உண்டற்குரிய கனியென்க .,False
1181,சாபம் கெடுத்தனை யென்றியையும்.,False
1182,போலும் ஒப்பில் போலி.,False
1183,சாப முடிவெல்லையாகிய நாள் இந்நாள் என்றுமாம்.,False
1184,விலகொளி எனப் பிரித்தலுமாம் விலகு ஒளி விட்டு விளங்கும் ஒளி.,False
1185,காரண மின்றியே கனியைச் சிதைத்துக் கடுநோயுழந்தனை என விரித் துரைத்துக்கொள்க.,False
1186,நல்லனவென்பதைக் கனி முதலிய ஒவ்வொன்றோடுங் கூட்டுக.,False
1187,ஆற்றேனாக பசி தணியப்பெறேனாக.,False
1188,நோற்றோர் பெருஞ்செல்வர் துணையாகி உறைவதென்க.,False
1189,"நோன்மைஈண்டுப் பெருமை, நிலனொடு போதல் காலால் நடந்து செல்லுதல்.",False
1190,ஆண்டுதோறும் இந்திரவிழா நடக்கும்நாளில் வந்து கண்டு இரங்கிக் கழியும் என்க.,False
1191,பின்வரும் யாண்டு சாபம் நிற்கும் பன்னீராண்டில் எஞ்சிய ஆண்டு.,False
1192,மணிமேகலை தவிர்த்தனை வணங்கினேன் படர்கேன் என்றாளென்க.,False
1193,மணிமேகலை விளி.,False
1194,"ஊரூர் ஆங்கண் பல ஊர்களிலும், ஆங்கு, ஆல் அசைகள்.",False
1195,கூந்தல் விளி.,False
1196,நெடு நிலையுடைக் கந்து என மாறுக.,False
1197,காட்டுவதற்கு மயனால் எழுதப்பட்டவென விரித்துரைக்க.,False
1198,"மணிமேகலையுடன் மற்றையோரையும் உளப்படுத்தி, தந்துணைப்பாவை என்றார்.",False
1199,தின என்றது இலக்கணை வழக்கு.,False
1200,வருகவென அழைத்துச் சொரிய வந்துண்ணும் ஆரவாரம் என விரித்துரைக்க.,False
1201,மழை தோன்றிப் பொழிந்தாற்போல ஆயிழை தோன்றிச் சொரிய வென்க.,False
1202,ஒலியரவம் ஒருபொரு ளிருசொல்.,False
1203,அம்பல மருங்கு ஒலியெழுந்தன்றென்க.,False
1204,உலகவறவி புக்க காதை முற்றிற்று.,False
1205,உரை .,False
1206,குரம்பு வரம்பு கொண்டு தாண்டி யென்னும் பொருட்டு குரம்பெழுந்து குற்றங்கொண் டேறார் என்பது காண்க.,False
1207,மேல் வருவன சித்திராபதி கூற்று.,False
1208,இதுமணிமேகலை பிக்குணிக் கோலம் பூண்டு பிச்சை யேற்கின்றாள் என்னும் உரை.,False
1209,தக்குதக்கது விகாரம்.,False
1210,தக்கென்போர் தகவுடைமையை அறிந்து கூறும் அறிஞர்.,False
1211,முளியெரி காய்ந்த விறகிற் பற்றிய தீ யென்றுமாம்.,False
1212,நயன் இல் காலை ஆடவரிடத்துச் செல்வமில்லாத காலத்தில் என்றுமாம்.,False
1213,வினை நல்வினை.,False
1214,திருவின் செல்விதிருவாகிய செல்வி.,False
1215,தாபதக்கோலம் தவக்கோலம்.,False
1216,இக்காதையுட் பின்னரும் உதயகுமரன் வண்டாக உருவகிக்கப்படுகின்றனன்.,False
1217,பிறர் கைக்காட்டி பிறரிடம் பறித்துக் கொடுத்தென்றபடி.,False
1218,மடந்தையர் தம்மோர் ஓர் அசை.,False
1219,"மரபினன் அன்விகுதி, தன்மைக்கண் வந்தது மரபினளன்றென என்பதும் பாடம் வஞ்சக்கிளவி மணிமேகலையை உதயகுமரன் வயமாக்கற்கேற்ற சொல்.",False
1220,கோல முகத்து வியர்பொடித்தவளாய் எனப் பிரித்துக் கூட்டுதலுமாம்.,False
1221,மணல் பரந்த முற்றத்தை யுடையவென விரித்துரைத்துக் கொள்க தருமணன் ஞெமிரிய திருநகர் முற்றத்து என்பது காண்க.,False
1222,ஊர்திஏறுதற்கிடமாகவுள்ள ஆதனம் என்னும் பொருள் குறித்து நின்றது.,False
1223,மண்டபத்துப் பள்ளியில் இருந்தோன் என்க.,False
1224,ஏத்தி ஏத்தவெனத் திரிக்க.,False
1225,காமர் செவ்விக் கடிமலர் அவிழ்ந்ததுவிரும்பப்படும் செவ்வியையுடைய.,False
1226,"காஞ்சிமரத்தைப் புனைந்துரைப்பது போன்ற இதன்கண், குருகு என்பது மாதவியையும், மணிக்காஞ்சி என்பது மணிமேகலையையும் குறித்து நின்றன.",False
1227,மாதவிபெற ஓங்கிய மணிமேகலை நாடகம் விரும்பப் பருவ மெய்தினளென்க.,False
1228,குருகுகுருக்கத்தி இது மாதவியெனவும் படும்.,False
1229,"காஞ்சி மேகலையாதலைத் திவாகரம் முதலியவற்றானறிக, நாடகம் நாட்டினிடம், நாடகக்கலை.",False
1230,நாடகம் இவளாற் சிறப்பெய்து மாகலின் நாடகம் விரும்ப என்றார் நாடக மேத்து நாடகக் கணிகை என வருதல் காண்க.,False
1231,நலம் கவினி நலம் நிறைந்து என்னும் பொருட்டு.,False
1232,உதயகுமரனெனு மொருவண்டு என்றது முன்னிலைப் புறமொழி.,False
1233,பறந்தலை புறங்காடு.,False
1234,கண்ணிதலையிற் சூடும் மாலை.,False
1235,நின் கண்ணி வாழ்க வென்றல் மரபு.,False
1236,உடைகலப் பட்டோன் கலம் உடையப் பட்டோன் என மாறுக.,False
1237,உடைகலப் பட்டாங் கொழிந்தோர் தம்முடன் என முன் வந்தமையுங் காண்க.,False
1238,விடா அஎதிர்மறை வினையெச்சமுற்று.,False
1239,இறை சிறிது.,False
1240,அருந்த என்னும் பெயரெச்சத் தகரம் தொக்கது அருந்தே மாந்த வாருயிர் முதல்வனை என முன்னரும் இங்ஙனம் போந்தது.,False
1241,செவியில் உரைக்கப் புக்கதுபோற் சென்ற வென்க.,False
1242,கண்ணின் இயல்பாகிய நீட்சியையோ அல்லது மீட்சியையோ இங்ஙனங் கற்பித்துக் கூறுதலால் இதுதற்குறிப்பேற்றம்.,False
1243,"கொண்டு நெரித்ததூஉம் அரும்பியதூஉம் செவ்வியுமாகிய இவற்றைக் கொண்டு, பாவை கொண்டு உயிர்க்காப்பிட்டு என் உளத்து ஒளித்தாள் என்க.",False
1244,"இருந்தேன் முன்னர் துயிலாதிருந்தேனுடைய முன்பு பொங்கு மெல்லமளியிற் பொருந்தா திருந்தோன், முன்னர்த் தோன்றி என முன்பு வந்திருத்தல் காண்க.",False
1245,இருந்தேன் அங்ஙன மிருந்த என் முன்னர் என வேறறுத்துரைக்க.,False
1246,தேவர்களும் மயங்கிச் செய்தன பல வென்றபடி.,False
1247,மேரு இமயம் இமையவில் வாங்கிய என்பது காண்க.,False
1248,ஊர்தல் பரத்தல்.,False
1249,சரவணம் தருப்பைக் காடு அதனை யுடையதொரு பொய்கையை உணர்த்திற்று.,False
1250,"மகளிர், நிறைகாக்குங் காப்பே தலை, தெய்வந் தொழாஅள் கொழுநற் றொழுதெழுவாள் என்பன காண்க.",False
1251,அரும்பு மொட்டறாமலர்.,False
1252,செருக்கயல் ஒன்றை யொன்று எதிர்ந்து போர் செய்யுங் கயல்.,False
1253,"கொண்டி மகளிர்பொருளைக் கொள்ளும் பரத்தையர், கோன்முறைஅரசநீதி என்றுமாம்.",False
1254,குமரற்குமுன்னிலையிற் படர்க்கை.,False
1255,குடியிற் பிறந்தாளல்லள்.,False
1256,கொண்டி மகளிருட் பட்டாள்.,False
1257,அவளைப் பிணித்து அடக்குதல் கோன்முறை யன்றோ வென்க.,False
1258,ஊட்டுநளாகிய செல்வி போல வென்க.,False
1259,"அறைபோதல் கீழறுத்துச் செல்லுதல், அணுகினும் பற்றினும் என்பன எதிர்காலத்தில் வந்தன.",False
1260,மறுத் தலாவது விடைகூறா தொழிதல்.,False
1261,மக்கள் யாக்கையாகிய இது உடையது கொள்கலம் என வுணர்ந்தென்க.,False
1262,களிறனை யார்க்கு என்றது முன்னிலைப்புறம்.,False
1263,குச்சரம் கூர்ச்சர நாடு குச்சரக் குடிகை கூர்ச்சர நாட்டுப் பணியமைந்த சிறிய கோயில் என்பர்.,False
1264,மாயவிஞ்சை மந்திரம் என்றது மணிமேகலா தெய்வம் அருளிய வேற்றுரு எய்துவிக்கும் மந்திரத்தை.,False
1265,ஈண்டு இமையோர் பாவாய் என்றது போலப் பின்னர் வானோர் பாவாய் எனச் சிந்தாதேவியை விளித்தலுங் காண்க.,False
1266,பிக்குணியாதலின் கண்ணுக்கு மைதீட்டிற்றில ளென்க.,False
1267,வரிந்த சிலை கட்டமைந்த வில் நாணேற்றிய வில்லுமாம்.,False
1268,"நகை குவிமுட் கருவியும், கண் கோணமும், புருவம் கவைமுட் கருவியுமாகி என நிரனிறையாக்குக.",False
1269,காப்பு என்றது வலைக்கு அடை.,False
1270,கலையாகிய வலையென உருவகம் விரித்துரைக்க.,False
1271,தன் கலைத்திறங்களால் புறம்போகாது தடுத்தாள் என்றபடி.,False
1272,"காழ்வரை நில்லாக் கடுங்களிற் றொருத்தல், யாழ்வரைத் தங்கி யாங்கு என்பதனால் யானை யாழுக்கு வயமாத லறிக.",False
1273,முதுமொழி முதுவோர் மொழி நீதிமொழி.,False
1274,சூளுறுவார் அடிதொடுதல் வழக்காதலை அறவ ரடிதொடினும் கோனடி தொட்டேன் அடல்வலி யெயினர்நின் அடி தொடு கடனிது என்பவற்றானு மறிக.,False
1275,உதயகுமரன் அம்பலம் புக்க காதை முற்றிற்று.,False
1276,"அதனைக் கேட்ட அரசன், அம் மங்கையை இங்கே அழைத்து வருக என்றனன்.",False
1277,"உடனே காவலாளர் வந்து அதனைத் தெரிவிக்க, அவள் சென்று அரசனைக் கண்டு வாழ்த்தி நின்றனள்.",False
1278,"அரசன், அரிய தவமுடையாய் நீ யார் ?",False
1279,"கையிலேந்திய பாத்திரம் எங்கே கிடைத்தது? என்ன, அவள், அரசே!",False
1280,"அரசன், அவள் விரும்பிய வண்ணமே செய்வித்தனன்.",False
1281,இதன்கண் அரசனது பொழில் விளையாட்டுக் கூறுமிடத்துள்ள இயற்கைப்புனைவு முதலியன மிக்க இன்பம் பயப்பன.,False
1282,நா நல்கூர்தலாவது பயனில மொழிதல்.,False
1283,"வித்தகர்சிற்பம் வல்லோர் வித்தக ரியற்றிய விளங்கிய கைவினைச், சித்திரச் செய்கை என முன்னர் வந்தமையுங் காண்க.",False
1284,ஒன்றுபொருந்திய அதிட்டித்த.,False
1285,தெய்வம்மணிமேகலா தெய்வம்.,False
1286,தெய்வம் கூறியதுமென்க.,False
1287,திப்பியம் ஈண்டு வியப்பென்னும் பொருட்டு தெய்வத்தன்மையுமாம்.,False
1288,அரவின் பை யென மாறுக.,False
1289,பாத்திரமும் என எண்ணும்மை விரிக்க முத்தை விகாரம்.,False
1290,இராத்திரியை யானையாக உருவகிப்பவர் அதற் கியைபுபடப் பிறவற்றையும் உருவகஞ் செய்கின்றார்.,False
1291,"ஞாலம் ஆரிருள் உண்ண என்பது உண்டற்குரிய வல்லாப் பொருளை, யுண்டன போலக் கூறலுமரபே என்பதனான் அமைக்கப்படும்.",False
1292,கொல்களிற்றின் செல்கையை அறிவித்தற்குப் பறையறைவித் தலுண்மையின் பணையெழுந்தார்ப்ப என்றார்.,False
1293,"மேலோரின்றி என்றது பாகரை வீசி யென்றபடி மேலோர் வீசி என்றார் பிற சான்றோரும், காமர் காமம் என்னும் பொருட்டு.",False
1294,கடக்களிறு கைவீசிச் செல்லுமாகலின் காமர் செங்கை நீட்டி என்றார்.,False
1295,பூ வேங்கைப்பூ ஏழிலைப் பாலையின் மலருமாம் யானையின் மதம்.,False
1296,கால்கிளர்ந் தன்ன வேழமேல் கொண்டு என்பதனால் யானை காற்றுப்போற் கிளர்ந்தெழு மென்பதறிக.,False
1297,பெயர்வோன்றன்னை நீலயானை தொடர வென்க இரவு வர என்றவாறாயிற்று.,False
1298,நம்பியரும் வளையோரும் வடித்த இளிபுணர் இன்சீர் என்க.,False
1299,மகர வீணை மகரயாழ் நால்வகை யாழுளொன்று பதினேழு நரம்புகளையுடையது.,False
1300,வடித்தல் நரம்பை உருவுதல் தெறித்தலுக் காயிற்று.,False
1301,"இளியென்பது ஏழுநரம்பினுள் ஒன்றன் பெயராதலன்றி, இசையைக் குறிக்கும் பொதுப் பெயருமாம், சீருடன்கூடிய இளியாகிய எஃகு என்க.",False
1302,பறாஅக் குருகு கொல்லன் உலைமூக்கு பூவா வஞ்சி முதலியன போல வெளிப்படையென்னும் இலக்கணத்தது.,False
1303,அவன் உதயகுமரன்.,False
1304,விடலீயான் வினைத்திரி சொல்.,False
1305,கைவிடேனென நினைந்து என ஒரு சொல் வருவித்துரைக்க.,False
1306,நுனித்தல் நுண்ணிதின் உணர்தல்.,False
1307,என என்று கருதி.,False
1308,பைந்தொடி மடந்தை என்பதும் பாடம்.,False
1309,தண்டத்து உறு தண்டத் தினைப் பொருந்தி நுகரும்.,False
1310,பசியுற்று வெய்துயிர்த்துப் புலம்பும் மாக்களென மாறுக.,False
1311,"ஆருயிர் மாக்கள் என்றது, பெறுதற்கரிய மக்களுயிரைப் பெற்றார் இங்ஙனம் வருந்துகின்றனரே யென இரங்கிக் கூறியபடி.",False
1312,அடக்கியஅடக்க செய்யிய வென்னும் வினையெச்சம் பெயரெச்சமாக்கோடலுமாம்.,False
1313,நீரிற் பெய்தநீருடன் பெய்த தாரை வார்த்தளித்த என்றபடி.,False
1314,மாவலி மாபலியென்பதன் திரிபு.,False
1315,பாண குலத்தரசர்கள் மாவலியின் வழியினரெனக் கூறப்படுவர்.,False
1316,இன்னோர் வாணகப்பாடி முதலிய இடங்களிலிருந்து அரசுபுரிந் தோராவர்.,False
1317,அக் குலத்தரசருளொருவன் மகளென்க.,False
1318,பந்தரில் ஆடுதலைக் கண்டு என மாறுதலுமாம்.,False
1319,கடுவன் ஊசலில் பிணவுக் குரங்கை யேற்றி ஊக்குவது கண்டு நகையெய்தியும் என்க.,False
1320,கழைக்குக் கண்ணனும் வெண் கடம்பிற்குப் பலதேவரும் உவமைகள்.,False
1321,நாடகக் காப்பியமாகிய நன்னூலென்க இன்பத் துறையில் நிற்பவராகலின் நாடகக் காப்பியங் கூறினார்.,False
1322,முன்னின்ற பண் யாழுக்கு அடை.,False
1323,யாழ்பேரியாழ் முதலிய நால்வகை யாழ்.,False
1324,"நரம்பு குரல், துத்தம், கைக்கிளை, உழை, இளி, விளரி, தாரம் என்பன.",False
1325,எறி முதனிலைத் தொழிற் பெயர் பண்ணமை முழவின் கண் ணெறியறிந்து என்பதுங் காண்க.,False
1326,பழுநிய இசை முற்றிய.,False
1327,திமிர்தல்தடவி யுதிர்த்தல் குடைவோர் துவரினும் ஓமாலிகையினும் ஊறிய நன்னீரால் கூந்தலை ஆட்டுவோர் என்றுமாம்.,False
1328,அவிநயந் தெரிவோர் முதலாகிய அவர்தம்மோடு சென்று விளையாட்ட யர்ந்து என்க.,False
1329,பொங்கர் சோலை சோலை போலும் மரச் செறிவு.,False
1330,இறும்பு குறுங்காடு.,False
1331,வெறி ஆடு.,False
