Line Number,Sentence
1,இளங்குமரனார் தமிழ்வளம் .,False
2,சிவ வாக்கியர் .,False
3,குதம்பைச் சித்தர் .,False
4,சிவஞானபோதம் ஆசிரியர் இரா.இளங்குமரனார் வளவன் பதிப்பகம் சென்னை .,False
5,நூற் குறிப்பு நூற்பெயர் இளங்குமரனார் தமிழ்வளம் ஆசிரியர் இரா.,False
6,இளங்குமரன் பதிப்பாளர் கோ.,False
7,படிகள் நூலாக்கம் செவன்த்சென் கம்யூனிகேசன் அட்டை ஓவியம் ஓவியர் மருது அட்டை வடிவமைப்பு வ.,False
8,"மலர் அச்சிட்டோர் ஸ்ரீ வெங்கடேசுவரா ஆப்செட் பிரிண்டர்சு இராயப்பேட்டை, சென்னை .",False
9,"வெளியீடு வளவன் பதிப்பகம் எண் சிங்கார வேலர் தெரு, தியாகராயர் நகர், சென்னை .",False
10,இவர் தந்நலம் கருதாமல் தமிழ் நலம் காத்து வருபவர்.,False
11,தம்மைமுன்னிறுத்தாது தமிழை முன்னிறுத்தும் பெருந்தமிழறிஞர்.,False
12,தமக்கென வாழாது தமிழ்க்கென வாழ்பவர்.,False
13,ஒருநாளின் முழுப் பொழுதும் தமிழாகவே வாழும் தமிழ்ப் போராளி.,False
14,சங்கச் சான்றோர் வரிசையில் வைத்து எண்ணத்தக்க அருந்தமிழறிஞர்.,False
15,தமிழ் இலக்கண இலக்கிய மரபைக் காத்து வரும் மரபு வழி அறிஞர்.,False
16,மொழிநூல் கதிரவன் பாவாணரின் வேர்ச்சொல் ஆய்வில் அவர் காட்டிய வழியில் தம் தமிழாய்வைத் தொடர்பவர்.,False
17,தமிழர் இல்லம்தோறும் இருக்கத்தக்க இவ்வருந்தமிழ்ச் செல்வங்களைத் தமிழ் இளம் தலைமுறைக்கு வைப்பாகக் கொடுத்துள்ளோம்.,False
18,ஒண்டமிழ்த்தாய் சிலம்படியின் முன்னேற்றம் ஒவ்வொன்றும் உன்முன் னேற்றம்!,False
19,இதுதான்நீ செயத்தக்க எப்பணிக்கும் முதற்பணியாம் எழுக நன்றே.,False
20,எனும் பாவேந்தரின் தமிழியக்க உணர்வுகளை நெஞ்சில் ஏந்தி வாழ முற்படுவோம்.,False
21,பெறும் பேறு வளம் எங்கே இருக்கிறது?,False
22,வளம் எங்கேயும் இருக்கிறது!,False
23,அஃது இல்லாத இடமே இல்லை!,False
24,வளம் எங்கும் இருப்பதை எப்படி அறியலாம்?,False
25,"வளத்தைத் தேடும் உளம் இருந்தால், வளம் எங்கேயும் இருப்பதை அறியலாம்?",False
26,வளத்தின் அளவு என்ன?,False
27,வளத்தின் அளவும் உளத்தின் அளவேயாம்!,False
28,"உளத்தில் வளம் இல்லையானால், உள்ள வளமும் உடையவனுக்கும் உதவாது ஊருக்கும் உலகுக்கும் உதவாது!",False
29,வளத்தைத் தரும் உளத்தை ஒருவர் வாய்க்கப் பெற்றால் போதும்!,False
30,அவ்வளம் குன்றியளவானால் என்ன?,False
31,குன்றத்தனைய வளமானால் என்ன?,False
32,தினை அளவானால் என்ன?,False
33,பனை அளவானால் என்ன?,False
34,வளம் வளமே!,False
35,தேனீ வளம்?,False
36,"தினைத்தனை அளவுப் பூவில், தேனீ கொள்ளும் தேன் எவ்வளவு இருக்கும்?",False
37,கோத்தும்பி கொணரும் தேன் வளம் எவ்வளவு இருக்கும்?,False
38,"கோத்தும்பி கொணர்வதே வளம், தேனீ கொணர்வது வளமில்லை என எவராவது கூறுவாரா?",False
39,வளம் வளமே!,False
40,"அவரவர் உழைப்பு, அறிவுத்திறம், உண்மையறிவு, பட்டறிவு, காலஇடசூழல் கொடை ஆகியவற்றைப் பொறுத்தது அது.",False
41,பொருள் மட்டுமா வளம்?,False
42,புலமை வளமில்லையா?,False
43,ஊக்குதல் உதவுதல் உறுதுணையாதல் ஒன்றுதல் ஆயவை வளமில்லையா?,False
44,எல்லாம் வளமே!,False
45,மல்லல் வளனே என்பது தொல்காப்பியம்.,False
46,உரி. உடலாலும் வளம் உழைப்பாலும் வளம் உணர்வாலும் வளம் உரையாலும் வளம் வளம் பட வாழ வேண்டாதார் எவர்?,False
47,வளம் பெற வேண்டாதார் எவர்?,False
48,வளந்தலை மயங்கிய வஞ்சி முற்றம் என்பது சிலம்பு!,False
49,"வளத்தின் அளவு, அளந்து கடை அறியாவளம் என்பது நாடென்ப நாடா வளத்தன என்பது நாட்டின் இலக்கணம்!",False
50,"எளிமை, இனிமை, இறைமை, நிறைமை என மக்கள் வாழ்ந்த நாள் இலக்கணம்!",False
51,"இன்றோ, நானில வளங்களையும் நாடா நாடில்லை!",False
52,எந்த நாடு ஏற்றுமதி செய்யவில்லை?,False
53,எந்த நாடு இறக்குமதி செய்யவில்லை?,False
54,"பாலைவளத்தை நாடிச்சோலை நிற்றல் வெளிப்படை என்றால், சொல்வானேன்?",False
55,நாடாவளத்தில் குப்பைக்கீரை சேராதா?,False
56,குறுந்தூறு சேராதா?,False
57,வளத்தை வழங்குதல் தான் பிறவிக் கடனே யன்றி அளவிடும் பொறுப்பு வழங்குவார்க்கு இல்லை!,False
58,பெறுவார் பொறுப்பு.,False
59,பெற்றவர் வழியாகக் கருவிலே பெற்ற திரு என்ன!,False
60,கற்ற கல்வியால் பெற்ற வளம் என்ன!,False
61,பட்டறிவால் ஆழ்மன ஆய்வால் தேடிக் கொண்ட வளங்கள் என்ன என்ன!,False
62,"கூற்றையும் ஆடல் கொள்ளும் கொள்கை இதுவென உணர்வார் ஓயார், ஒழியார் சாயார் சரிந்தும் போகார்!",False
63,"என் இளந்தைப் பருவமே, ஆசிரியப் பருவமாகிவிட்டது.",False
64,அக்காலச் சூழல் அது.,False
65,மூன்றாண்டு ஆசிரியப் பணி செய்தால் போதும்!,False
66,புலவர் தேர்வைத் தனியாக எழுதலாம் என்னும் வாய்ப்பு!,False
67,"உயர்பள்ளி, மேல்பள்ளி என்பவற்றிலும் பல்கலைக் கழகத் தமிழியல் ஆய்வுக் களத்திலுமாக ஏறத்தாழ ஆண்டுகள் தமிழ்வாழ்வாக வாழ வாய்த்தது.",False
68,"தமிழ்த்தொண்டும், தமிழ்நெறித் தொண்டும் என்றும் விடுதல் அறியா விருப்பொடு செய்து கொண்டிருத்தலே இயற்கையோடு இயைந்த வாழ்வாகி விட்டது!",False
69,"புலமைத் தேர்வுக்குரிய பாடத்தளவிலோ, நூல்களின் அளவிலோ என் கல்வி நின்றது இல்லை!",False
70,தொல்காப்பியம் முதல் இற்றைநாள் நூல்கள் வரை இயன்ற அளவால் தமிழ்வளம் பெறுதலை நோன்பாகக் கொண்டு கற்கும் பேறுபெற்றேன்.,False
71,"இளந்தைப் பருவத்திலேயே பாவேந்தர், ஓகி சுத்தானந்த பாரதியார், கவிமணியார், கவிராச பண்டித செகவீர பாண்டியனார், அறிஞர் மு.வ.",False
72,ஆயோர் அரிய காட்சியும் சின்முறைச் சந்திப்புகளும் என்னுள் பசுமை நல்கின.,False
73,"தமிழ்ப் பொழிவுகளும், ஆய்வுக் கட்டுரைகளும், குடும்பச் சடங்குகளும் என் மீட்டெடுப்புப் பணிகள் ஆயின!",False
74,எம் குடும்பக் கடமைகள் எம் பணியையோ தொண்டையோ கவர்ந்து கொள்ளா வகையில் இனிய துணையும் மக்களும் அமைந்தனர்.,False
75,"அதனால், காலமெல்லாம் கற்கவும் கற்பிக்கவும் நூல் படைக்கவும் வாய்த்த வாய்ப்புப் பெரிதாயிற்று.",False
76,"செந்தமிழ், செந்தமிழ்ச் செல்வி, தமிழ்ப்பாவை, குறள் நெறி, குறளியம், மலர்கள், ஆய்வரங்கங்கள் எனக் கட்டுரைகள் பெருகின.",False
77,அச்சுக்கு வாராதவையும் ஆகின!,False
78,இவை என்றும் ஒருமுகமாய்க் கிடைக்க வாய்ப்பில்லை.,False
79,எம் நூல்கள் எம்மிடமே முப்பதுக்குமேல் இல்லாமல் மறைந்தன.,False
80,எழுதியன எல்லாவற்றையும் ஒருமுகமாகப் பெறப் பலர் அவாவினார்.,False
81,தவத்திரு ஆத்துமானந்த அடிகளார் ஆருயிர்க்கு அன்பர் அதில் தலைப்பட்டு நின்றார்.,False
82,ஆயர் ஆண்டகை சூசைமாணிக்கனார் சுடரேற்றினார்.,False
83,பாரதிதாசன் பல்கலைக்கழகம் மதிப்புறு முதுமுனைவர் பட்டம் வழங்கியது.,False
84,அவ்விழாத் தலைமையைத் திருத்தகு துணைவேந்தர் பொன்னவைக்கோ ஏற்றார்.,False
85,தவத்திரு ஆத்து மானந்த அடிகளார் வாழ்த்துரைத்தார்.,False
86,தமிழாக்கப் பதிப்பே வாழ்வாக ஒன்றிய இளவழகனார் முழுதுற அச்சிட ஒப்பினார்.,False
87,அடிகளார் வெளியீட்டுப் பொறுப்பு ஏற்பதாகக் கூறினார்.,False
88,"அவ்வகையில் வாய்ப்பதே, இளங்குமரனார் தமிழ்வளம் என்னும் இத் தொகை நூல்களாம்!",False
89,"இத் தொகையில் விடுபடும் நூல்கள் கட்டுரைகள், பாடல்கள் பல்லபல.",False
90,தொகுக்க வாய்க்கா வகையில் கிட்டாவகையில் மறப்பு வகையில் விடு பாடுடையவை உள.,False
91,எனினும் தொண்ணுறு விழுக்காடேனும் ஒரு முகமாகப் பெறும் பேறு வாய்க்கின்றது என்பது மகிழ்வூட்டு வதாம்!,False
92,மக்கள் வாழ்வு வளர்நிலையது!,False
93,நூல்களும் வளர் நிலையவை!,False
94,ஆதலால் ஒருவாழ்வுக் கொடை மட்டுமன்று ஈது ஒருவாழ்வு பெறத் தக்க பல்பருவக் கொடையுமாம் எனல் சாலும்!,False
95,இவ்வளத்தை முழுதுற எண்ணின் ஒன்று உறுதியாக வெளிப்படும்.,False
96,நலவாழ்வு நல்வாழ்வு கருதாத இயற்கை இறைமைப் பொதுமை கருதாத எப்படைப்பும் எம்படைப்பில் இரா என்பதேயாம்.,False
97,இவற்றைப் பயில்வார் பெறும் பேறும் அதுவாக அமையின் அப்பேறே யாம் பெறும் பேறாம்.,False
98,இவ்வளம் வெளிவர விரும்பினோர் உழைத்தோர் உதவினோர் ஆய அனைவர்க்கும் நன்றிக் கடப்பாடுடையேன்!,False
99,வாழிய நலனே!,False
100,வாழிய நிலனே!,False
101,"சித்தருள் சித்தர், சிவவாக்கியர்!",False
102,"அவர், சித்தர் உலகின் நக்கீரர்!",False
103,குற்றம் குற்றமே என்பதைக் குலையாமல் குறையாமல் உரைக்கும் கொள்கை வீரர்!,False
104,"ஊனுடம்பு ஆலயத்தை உள்ளவாறு உணர்ந்து, உலகுய்ய உணர்த்தும் உரவோர்!",False
105,தொண்டின் உறைப்பிலே துடித்தெழும்பிய தூண்டாத் தொண்டர் பெருமகனார்!,False
106,காற்றின் கணக்கறிந்து கூற்றை உதைக்கும் நெறியறிந்த நேராளர்!,False
107,"அவரைப்பற்றிய மேலோட்ட ஆய்வு, முன்னை ஐம்பது பக்கங்கள்!",False
108,"அவர்தம் உள்ளோட்ட வழிவந்த பிழிவாம் பாடல்கள், பின்னை எழுபத்தாறு பக்கங்கள்!",False
109,சித்தர் நெறியை முற்றாக ஆய்ந்து பெருநூல் ஒன்று ஆக்குதல் வேண்டும்.,False
110,"அது, இக்காலத்துச் சமயத்துள் புகுந்துள்ள புன்னோய்களுக்கு நன்மருந்தாகத் திகழும்!",False
111,"சித்தரை எண்ணுதற்கு நிலைக்களம் வகுத்துத் தந்தவர்கள் சிங்கம்புணரி, சித்தர் வழிபாட்டுத் திருக்கூட்டத்தார்.",False
112,நூலுருத் தந்து தமிழுலா அருளியவர்கள் கழக ஆட்சியாளர் திரு.,False
113,", .., பி.லிப் அவர்கள்.",False
114,இவர்களுக்கு நெஞ்சார்ந்த நன்றியைச் செலுத்துகின்றேன்.,False
115,சித்தர் நெறி செந்நெறி!,False
116,செந்தண்மை நெறி!,False
117,பின்னைப் புன்மைகளைக் களைந்து முன்னைப் பெருமையை முடித்து வைக்க வல்லது!,False
118,அந்நெறி தழைத்து உலகம் உய்வதாக!,False
119,"தமிழ்ச் செல்வம், தமிழ்த் தொண்டன், பாவாணர் ஆராய்ச்சி நூலகம் இரா.",False
120,"இளங்குமரன் திருநகர், மதுரை .",False
121,சிவ வாக்கியர் சித்தர் பொது நிலை சித்தர் என்பவர் சித்தத்தை வென்றவர் என்பர்.,False
122,சித்து வேலை செய்தலில் தேர்ந்தவர் என்றும் கூறுவர்.,False
123,"இப்பழமொழி, சித்தராவார் எவர் என்பதை வெளிப்ட விளக்கும்.",False
124,சித்தமலம் அறுவித்துச் சிவமாக்கி எனையாண்ட அத்தன் எனவரும் திருவாசகம் சித்தர் தன்மை இன்னதெனத் தெரிவிக்கும்.,False
125,"மேலும், சித்தர் என்பார் இவர் இவர் தன்மைகள் இவை என்பதை ஒரு பாடலில் விளக்குகிறார் திருமூலர்.",False
126,அடுத்தவேளை உணவைப் பற்றி அக்கறைப்படுவது சித்தர் தன்மை இல்லை!,False
127,"அந்த வேளை உணவுக்கும் உண்கலம் கொள்ளலும், தேடிப்போய்ப் பெறுதலும் மேனிலைச் சித்தர் தன்மை இல்லை!",False
128,கையில் ஓடு கொண்டிருப்பதும் கூட ஆசைக்கு வித்து என்று அறிந்து அறிவுறுத்தி நிலைபெறுத்துபவர் சித்தர்!,False
129,பிணி தீர்க்கும் பணியில் அவர்கள் காட்டிய முழுத்திற முனைப்பே சித்த மருத்துவச் செல்வமாக இந்நாள் வரை திகழ்ந்து வருகின்றதாம்!,False
130,வாழும் நாளை நீட்டித்து உயிர்தளிர்ப்பச் செய்தற்கும் வழிவகை அறிந்தவர்.,False
131,மந்திர தந்திரங்களில் வல்லுநர் சித்தர் என்பதற்கு ஊரூர் தோறும் எத்தனை எத்தனை கதைகள்!,False
132,கண்டவை என்றவை எத்தனை!,False
133,கண்டதாய் உரைத்ததைக் கேட்ட கட்டுமானச் செய்திகள் எத்தனை!,False
134,இரும்பு பித்தளை முதலியவற்றை வெள்ளியும் பொன்னுமாய்ச் செய்த விளையாடல் செய்திகள் எத்தனை!,False
135,இவையெல்லாம் சித்தர் செல்வாக்கைச் சிற்றுணர் வோரும் ஒத்துக் கொள்ளுதற்கு வாய்த்தவை.,False
136,சித்தர் கைபட்டால் தீராப்பிணியும் தீரும்!,False
137,"சித்தர் கண்பட்டால், கண்ணேறுகள் எல்லாம் கழியும்!",False
138,அவர் மிச்சில் மிசைந்தார் விட்ட குறை தொட்ட குறை எதுவும் இல்லையாய் முற்று நிறைவாய்த் திகழ்வர்!,False
139,ஏவல் செய்வினை முதலிய எல்லாமும் சித்தர் திருவடி பட்ட இடத்தே பொடியாய் ஒழியும்!,False
140,இவையெல்லாம் சித்தர்மேல் மக்களுக்கு எத்துணை நம்பிக்கை என்பதை எளிதாய் விளக்குவன.,False
141,பாடியவர் கருத்து மட்டும் படிக்கக் கிடைத்துள்ளது!,False
142,"மற்றையோர் செய்திகள், கண்டவர் கேட்டவர் வழியே அங்கொன்றும் இங்கொன்றுமாகக் குறிப்புச் செய்தி களாய்க் கிடைத்துள.",False
143,சித்தர் அடங்கிய இடங்கள் ஆங்காங்குண்டு.,False
144,ஆங்காங்கு ஆணடுதோறும் நினைவு விழாக்கள் உண்டு.,False
145,நாள் வழிபாடு கூட்டு வழிபாடு என்பவையும் உண்டு.,False
146,படையலும் பொங்கலும் பாலிப்பதும் உண்டு!,False
147,இக்கால முறைப்படி பொழிவுகளும் நிகழ்வது உண்டு.,False
148,ஆயினும் சித்தர் நெறிகளை ஏற்றுப் போற்றுதல் பெரிதும் இல்லை!,False
149,மற்றை வழிபாடுகள் போலவே நூற்றொடு நூற்றொன்றாய்ப் பூசை போடும் அளவில் புகழ்பாடும் அளவில் அமைந்து விடுகின்றது.,False
150,சித்தர்கள் என்றும் இருந்துளர் எங்கும் இருந்துளர் எவ்வெக் குடி வழிகளிலும் இருந்துளர்.,False
151,அதனால்தான் இறைவனையும் சித்தராகக் கண்டது இந்த மண்!,False
152,இறையருட்பேறாம் வீடு பேற்றையும் சித்த நிலை அல்லது சித்தியாகக் கண்டது இந்த மண்!,False
153,சித்தர் நெறி நடைமுறையில் உள்ளதா?,False
154,நடைமுறைப் படுத்தப்பட்டுவிட்டதா?,False
