Line Number,Sentence
447,"அல்லாக்கால், வந்தேன் என்னும் தொகை வாக்கியத்தில் நான் என்னும் எழுவாய் அவாய்நிலையால் வருவிக்கப்படாமை காண்க."
448,"ஏற்பின், பொதுவியலின் கூறும் இடைப்பிறவரல் கூறியது கூறலாய்க் குற்றந் தங்கும்."
449,"யாழ அம்மி மிதப்ப என்பது செய்யுட்குரிய மொழிமாற்றுப் பொருள்கோளாதலின், அதுவும் ஈண்டைக் கேலாது."
450,ஆங்கிலத்திலும் தழுவுதொடர் தழாத்தொடர்கட்கு இலக்கணப் பொருத்த முண்மை யின்மைகளையே இலக்கணமாகக் கொள்வர்.
451,", ."
452,இறப்பின் நிகழ்வின் எதிர்வின் என்றா அம்முக் காலமுங் குறிப்பொடுங் கொள்ளும் தொல்.
453,முந்நிலைக் காலமுந் தோன்றும் இயற்கை எம்முறைச் சொல்லும் நிகழுங் காலத்து மெய்ந்நிலைப் பொதுச்சொற் கிளத்தல் வேண்டும் தொல்.
454,வாராக் காலத்து வினைச்சொற் கிளவி இறப்பினும் நிகழ்வினும் சிறப்பத் தோன்றும் இயற்கையுந் தெளிவுங் கிளக்குங் காலை தொல்.
455,இறப்பே எதிர்வே ஆயிரு காலமும் சிறப்பத் தோன்றும் மயங்குமொழிக் கிளவி தொல்.
456,ஏனைக் காலமும் மயங்குதல் வரையார் தொல்.
457,என்னுந் தொல்காப்பிய நூற்பாக்களானேயே பெறப்படும்.
458,", , உரை."
459,பாலீறுகொண்ட வினைமுற்றுகள் இன்றும் மலையாளச் செய்யுளில் ஆளப்பெறும்.
460,"வினைமுற்றை அடிப்படையாகக் கொண்ட வினையாலணையும் பெயர்கள், மலையாள உலக வழக்கில் இயல்பாக வழங்குகின்றன."
461,என்று கி.மு.
462,இதுவே மொழிநூற்கும் பொருந்தும் முடிபாகும்.
463,"ஆயினும், மலையாள நாட்டில் பாலீற்று வினைமுற்றே அவ்வீறு நீங்கிப் பழைய வடிவில் வழங்கி வருகின்றது."
464,கழுத போல.
465,பாபம் போக்குந்நோந் ஆர்?
466,"எரும கறக்குந்நது அயல் அறியும், கஞ்சி வார்த்துண் ணுந்நது நெஞ்சு அறியும்."
467,அந்நந்நு வெட்டுந்ந வாளிந்நு நெய்யிடுக.
468,உறங்ஙுந்ந பூச்ச எலிபிடிக்க இல்ல.
469,மலையாளத்தில் றன்னகரம் இல்லை.
470,"ஆயினும், மலையாள ஒலியைக் குறித்தற்பொருட்டு இங்கு றன்னகரம் ஆளப்பெற்றது. கரயுந்ந குட்டிக்கெ பால் உள்ளு."
471,குரெக்குந்ந நாயி கடிக்க யில்ல.
472,மண்ணு திந்நுந்ந மண்டெலியே போல.
473,ஆகாரத்தை ஓகாரமாக ஒலிப்பது மலையாளியர் இயல்பு.
474,"கொங்குநாட்டைச் சேர்ந்த வடார்க்காட்டுப் பாங்கரில் இன்று கொச்சைத் தமிழே வழங்கிவரினும், அங்கும் இலக்கியத் தமிழ் செந்தமிழாகவே யிருந்துவருதல் காண்க."
475,வடார்க்காட்டுத் தமிழுக்கு எடுத்துக்காட்டு வருமாறு இசுத்து இசுத்து ஒச்சான்.
476,இழுத்து இழுத்து உதைத்தான். கொயந்த வாயப்பயத்துக்கு அய்வுது.
477,குழந்தை வாழைப்பழத்திற்கு அழுகிறது. பசங்க உள்ளே துண்ராங்க.
478,பையன்கள் உள்ளே தின்கிறார்கள். கண்ணாலம் மூய்க்கணும்.
479,கல்யாணம் முடிக்கவேண்டும் வந்துகினு போயிகினேக் கீரான்.
480,"வந்துகொண்டு போய்க்கொண்டே யிருக்கிறான். சேரநாட்டுச் சொற்கள் பல செந்தமிழுக் கொவ்வாவிடினும், திசைச்சொல் வகையில் அவற்றுள் ஒன்றிரண்டு இலக்கியத்தில் இடம்பெற்றுள்ளன."
481,இயற்சொல் திரிசொல் திசைச்சொல் வடசொலென் றனைத்தே செய்யுள் ஈட்டச் சொல்லே தொல்.
482,செந்தமிழ் சேர்ந்த பன்னிரு நிலத்தும் தங்குறிப் பினவே திசைச்சொற் கிளவி தொல்.
483,"என்று திசைச்சொல்லும் செய்யுளுக்குரியதென்றும், அது கொடுந் தமிழ்நாட்டு வழக்கென்றும், தொல்காப்பியத்திற் கூறப்பட்டிருத்தல் காண்க."
484,"நிகழ்கால வினையாலணையும் பெயர்கள் சேரநாட்டியல்புபடி, முதலாவது பின்வருமாறு திரிந்திருத்தல் வேண்டும்."
485,"ரகரத்தின் வன்னிலையாகிய றகரம் தோன்றிய பின்பே, அதற்கின மான னகரம் தோன்றிற்று."
486,"இதனாலேயே, றனக்கள் நெடுங்கணக்கில் பமக்களின் பின் வைக்கப்பெறாது, இடையினத்தின்பின் இறுதியில் வைக்கப்பெற்றுள."
487,"முதற்காலத்தில் தந்நகரமே றன்னகரத்திற்குப் பதிலாக வழங்கி வந்ததென்பதற்கு, பொருந், வெரிந், பொருநை முதலிய சொற்களே போதிய சான்றாகும்."
488,"என்னும் வடிவம், சற்றுப் பிற்காலத்தில் குகரம் நீங்கி, செய்யுந்நான்செய்யுநன்செய்நன் என முறையே திரிந்திருக்கின்றது."
489,"இங்ஙனமே, செய்குந்ந என்னும் பெயரெச்சமும், செய்யுந்நசெய்யுநசெயுந என முறையே திரிந்திருக்கிறது."
490,"என்ற வாய்பாட்டு வடிவிலேயே, கீழ்க்காணும் பெயர்கள் அமைந்துள்ளன."
491,கொள்நன் கொழுநன் கணவன் பொருநன் போர் செய்கின்றவன்.
492,மகிழ்நன் மகிணன் இன்புறும் மருதநிலத் தலைவன்.
493,வாழ்நன் வாணன் வசிக்கின்றவன்.
494,இத்தகைய சொற்களைப் பிற சங்க நூலினும் சங்க மருவிய நூலினும் பரக்கக் காணலாம்.
495,தொல்காப்பியத்திலேயே பல நூற்பாக்கள் இத்தகைய சொற்களைக் கொண்டுள்ளன.
496,அவையாவன இயல்பா குநவும் உறழா குநவும்என்று தொல்.
497,இயல்பா குநவும் வல்லெழுத்து மிகுநவும் உறழா குநவும் என்மனார் புலவர் தொல்.
498,வல்லெழுத்து மிகுநவும் உறழா குநவும் தொல்.
499,நெடியதன் இறுதி இயல்பா குநவும் தொல்.
500,கிளந்த வல்ல செய்யுளுள் திரிநவும் வழங்கியல் மருங்கின் மருவொடு திரிநவும் தொல்.
501,சொன்முறை முடியாது அடுக்குந வரினும் தொல்.
502,தத்தங் கிளவி அடுக்குந வரினும் தொல்.
503,பாலறி மரபிற் பொருநர் கண்ணும் தொல்.
504,அன்புறு தகுந இறைச்சியுட் சுட்டலும் தொல்.
505,நினையுங் காலைக் கேட்குநர் அவரே தொல்.
506,சொல்லுந போலவும் கேட்குந போலவும் தொல்.
507,நிகழ்கால இடைநிலை கின்று எனும் ஒன்றே.
508,கிறு என்பது அதன் தொகுத்தலே.
509,"கிருஷ்ணமூர்த்தி .., ..., .. அவர்கள் வரைந் துள்ளார்கள் என ஒரு தமிழன்பர் எழுதியுள்ளார்."
510,உண்மையில் பெண்பால் விகுதி இ அல்ல.
511,"அது பெண்பால் விகுதியாயின் வில்லி, நாற்காலி முதலியவற்றில் அப் பொருளில் வராதிருப்பதேன்?"
512,"உண்மை என்னவென்றால், இ என்பது ஸ்திரி என்பதன் சிதைவு."
513,"பெரும்பாலும், த்தி, ச்சி, ட்டி என்பவையே பெண்பால் விகுதிகளாக வருகின்றன."
514,இவை ஸ்திரி என்பதன் மாறுபட்ட உருவங்கள் என்பது தெளிவு.
515,எடு குற ஸ்திரி குறத்தி புலை ஸ்திரி புலைச்சி.
516,வெள்ளான் ஸ்திரி வெள்ளாட்டி.
517,வலை ஸ்திரி வலைச்சி வண்ணான் ஸ்திரி வண்ணாத்தி.
518,ஆய் ஸ்திரி ஆய்ச்சி.
519,பார்ப்பான் ஸ்திரி பார்ப்பாத்தி பிராமண ஸ்திரி பிராமணத்தி.
520,"ராஜா ஸ்திரி ராஜாத்தி பறை ஸ்திரி பறைச்சி பெண்டு ஆம் ஸ்திரி பெண்டாட்டி கண்ஆம்ஸ்திரி கண்ணாட்டி, பொம்மனாட்டி."
521,முதற்காலத்திலேயே பகுத்தறிவுள்ளதும் இல்லதும் எனப் பொருள்களைத் தமிழர் இரு பகுப்பாகப் பகுத்திருக்க முடியாது.
522,"நாகரிகமும் அறிவு வளர்ச்சியுமாகிய பண்பாடடைந்த பின்னரே, அவர் அவ்வாறு செய்திருத்தல் வேண்டும்."
523,"இன்றும், இருதிணைக்கும் பொதுவாகப் பல சொற்களும் விகுதிகளும் வழங்கக் காண்கின்றோம்."
524,அவை முந்துகால மொழிநிலையைக் காட்டும் எஞ்சு குறிகளாகும்.
525,"எடு சொற்கள் ஆண், பெண், தாய், தந்தை, பிள்ளை, குட்டி, தான், தாம்."
526,"பால்காட்டும் விகுதிகள், இன்று எங்ஙனம் பெரும்பாலும் சுட்டுப் பெயர்களும் அவற்றின் குறுக்கமுங் குறையுமாயிருக்கின்றனவோ, அங்ஙனமே முற்காலத்தும் இருந்தன."
527,"எடு அது வலது, தனது, உளது, நல்லது."
528,"இது வெளிது, வலிது, கரிது, புதிது உது விழுது, பழுது, எருது ஏருது, மருது."
529,அவன் ஆன் அன் நல்லவன் நல்லான் நல்லன்.
530,அவர் ஆர் அர் வல்லவர் வல்லார் வல்லர்.
531,இவர் ஈர் இர் மகளிவர் மகளீர் மகளிர்.
532,இகர வுகரவடி விகுதிகள் இக்காலத்துப் பெரும்பாலும் வழக்கிறந்தன.
533,"தமிழின் அசைநிலைக் காலத்தில் , சுட்டுச்சொற்கள் விகுதி பெறாமல் சுட்டடியாகவே வழங்கி வந்தன."
534,இன்று வழங்கும் பலவின்பால் அகரவிகுதி முந்துநிலையை யுணர்த்தும் அடையாளமாம்.
535,எடு நல்ல நல்லவை பெயர் வந்த வந்தன வினைமுற்று ஒப்ப நாடி அத்தக வொறுத்தி புறம்.
536,"எச்சொல்லும் வேறொரு சொல்லின் விகுதியாக அமைந்தவுடன், தன் விதப்புப் பொருளை இழந்துவிடும்."
537,"ஆகவே, சுட்டுச்சொற்களும் விகுதியா யமைந்தபின் தம் சுட்டுப்பொருளையிழந்து பால்மட்டும் உணர்த்தி நிற்கும்."
538,"ஒருமைக்கும் பன்மைக்கும் வெவ்வேறு விகுதிகள் வகுக்கப்பட்ட காலத்தில், இகரச்சுட்டு ஒருமை விகுதிகளுள் ஒன்றாகக் கொள்ளப்பெற்றது."
539,அது ஒரு குறித்த சொல்லில் மேற்கூறிய முப்பாலுள் ஒன்றை உணர்த்துமே யன்றித் தனித்த நிலையில் உணர்த்தாது.
540,"கண்ணன் என்னும் ஆண்பாற் சொற்கு நேரான பெண்பாற் சொல், கண்ணள் என்பதே யன்றிக் கண்ணி என்பதன்று."
541,கண்ணான் என்பது கண்ணன் என்று குறுகுவது போலக் கண்ணாள் என்பதும் கண்ணள் என்று குறுகும்.
542,"வந்தான் என்பதற்கு வந்தாள் என்பது எங்ஙனம் பெண்பாலோ, அங்ஙனமே கண்ணன் என்பதற்கும் கண்ணள் என்பதே நேரான பெண்பாலாம்."
543,அவ் விகுதி பெண்பால் விகுதியா யிருக்கக் கூடியதே யன்றிப் பெண்பாலுக்கே யுரிய விகுதியன்று.
544,"இவ் விகுதி அள் விகுதியைவிடப் பலுக்குவதற்கு உச்சரிப்பதற்கு எளிதாயும் இன்னோசையுள்ளதாயு மிருத்தலே, அது பெருவழக்காய் வழங்குவதற்குக் காரணமாகும்."
545,கண்ணள் கண்ணி என்னும் இரு சொற்களையும் பலுக்கிக் காண்க.
546,"இக் காரணம் பற்றியே, தாயைக் குறிக்கும் சொற்களுட் சில அள் விகுதியைவிட்டு இவ் விகுதியை ஏற்றுள்ளன."
547,அத்தன் என்பதன் திரிபே அச்சன் என்பது.
548,"அச்சன் என்னும் ஆண்பாற்பெயர் சேரநாடான மலையாள நாட்டிலும், அச்சி என்னும் பெண்பாற் பெயர் பாண்டிநாட்டிலும், வழங்கி வருகின்றன."
549,அச்சி அக்கை பாண்டிநாட்டு வழக்கு அக்கை தாய் போன்றவளாதலால் அச்சி எனப்பட்டாள்.
550,"ஓர் ஆடவரை ஐயா என்றும், ஒரு பெண்டை அம்மா என்றும் அழைத்தல் காண்க."
551,எடு குற அத்தி குறத்தி தட்டான் அத்தி தட்டாத்தி குலம்.
552,"அத்தி அச்சி என்னும் பெயர்கள் ஈறாக நின்று புணரும்போது, அவற்றின் அகரமுதல் கெட்டுவிடுகின்றது."
553,கெடாது நிற்பதும் உண்டு.
554,எடு கள்ளவத்தி வெள்ளைச்சி குப்பச்சி என்னும் பெயர்களை வெள்ளையம்மா குப்பம்மா என்பவற்றுடன் ஒப்புநோக்குக.
555,"அது என்னும் சொல்லின் குறையான துவ்வீறும், இங்ஙனமே டுவ்வீறாகத் திரிதல்."
556,தாள் து தாட்டு. ஆளன் ஆள் அன் என்னும் ஆண்பாலீற்றிற்கு எதிராக ஆட்டி ஆள்தி என்பது பெண்பாலீறாய் வரும்.
557,"மகன் என்னும் ஆண்பாலீறு மான் என்று மருவுவது போல், மகள் என்னும் பெண்பாலீறு மாள் என்று மருவும்."
558,"எடு பெருமகன் பெருமான், குறுமகன் குறுமான், மருமகன் மருமான், திருமகன் திருமான், வெளிமகன் வெளிமான்."
559,"பெருமகள் பெருமாள், வேண்மகள் வேண்மாள், திருமகள் திருமாள்."
560,"மாள் என்னும் பெண்பாலீற்றொடு மேற்காட்டிய தி என்னும் ஈறும் சேரும்போது, அவ் விரண்டுமே மாட்டி எனத் திரியும்."
561,பெருமாள் திருமாள் என்னும் ஒற்றையீற்றுப் பெண்பாற் பெயர்கள் இன்று வழக்கிறந்தன.
562,"விகுதிமேல் விகுதி வந்து இரட்டைப்பன்மைப் பெயர்கள் வழங்குவது போன்றே, ஈற்றின்மேல் ஈறு வந்து இரட்டைப்பெண்மைப் பெயர்களும் வழங்கும்."
563,எடு வெள்ளாட்டி அச்சி வெள்ளாட்டிச்சி.
564,பெண்டாட்டி பெண்டுஆட்டி என்பதிலுள்ள ஆட்டி ஈறு மனைவிப் பொருள் குறிக்க வந்ததாகும்.
565,"பெண், பெண்டு என்பன இடம்நோக்கி மனைவிப் பொருளுணர்த்தும் பெண்பாற் பொதுப்பெயராம்."
566,கை பெண் கைம்பெண் கை பெண்டு கைம்பெண்டு கை பெண்டாட்டி கைம்பெண்டாட்டி.
567,"பெண்பெண்டாட்டி என்பது, ஆண்பிள்ளைப் பிள்ளை காரான்பசு அரைஞாண் கயிறு என்பன போன்ற மிகைபடு சொற்றொடர்."
568,ஒரு பெண்பெண்டாட்டி ஆணுடை யுடுத்து ஈடு.
569,"கைம்பெண்டாட்டி பெண்பெண்டாட்டி என்பன, முறையே, கம்ம னாட்டி பொம்மனாட்டி எனக் கொச்சை வழக்கில் மருவி வழங்குகின்றன."
570,"இயல்பிலும் போக்கி லும், வடமொழியும் தென்மொழியும் வடக்கும் தெற்கும்போல் நேர் மாறானவை."
571,"மொழியாராய்ச்சி யில்லாதார் வடசொல்லென மயங்கும் தென் சொற்களுள், காரன், காரி ஈறுகளும் அடங்கும்."
572,இவை காரம் என்னும் தென்சொல்லடியாகப் பிறந்த ஆண்பால் பெண்பாற் பெயரீறுகள்.
573,"செய் என்னும் ஏவற்பொருள்படும் க்ரு என்னும் வடசொல்லினின்று, காரன் காரி யீறுகள் பிறந்திருப்பதாக, வடமொழியாளரும் அவர் வழியினரும் கொள்வர்."
574,இதன் புரைமையை விளக்கிக் காட்டுவல்.
575,"காரி யீறுகட்கு அடியான காரம் என்னும் தென்சொல், கடு என்னும் அடிவேரினின்று பிறந்ததாகும்."
576,கடுத்தல் மிகுதல்.
577,"மிகுதற் கருத்தினின்று கடுமை, வன்மை, வலி, எரிவு, வெம்மை, விறைப்பு, சினம் முதலிய கருத்துகள் முறையே தோன்றும்."
