Line Number,Sentence
2187,புளிமா வரகு புளிமா கணவிரி எழுத்துக்களானாகிய அடி.
2188,புளிமா புளிமா புளிமா கணவிரி எழுத்துக்களானாகிய அடி.
2189,புளிமா புலிவருவாய் காருருமு தேமா எழுத்துக்க ளானாகிய அடி.
2190,அரவு என முதற்சீர் நிற்பினும் இது பொருந்தும்.
2191,கணவிரி வண்டு வரகு வரகு எழுத்துக்களானாகிய அடி.
2192,கணவிரி வண்டு வரகு கடியாறு எழுத்துக்களானாகிய அடி.
2193,கணவிரி வண்டு புளிமா கடியாறு எழுத்துக்களானாகிய அடி.
2194,கணவிரி வண்டு புளிமா கணவிரி எழுத்துக்களானாகிய அடி கணவிரி தேமா வரகு கணவிரி எழுத்துக்களானாகிய அடி.
2195,கணவிரி காருருமு காருருமு தேமா எழுத்துக்களானாகிய அடி.
2196,"ஏனையவற்னையும் ஏற்குமாறு ஓட்டவே, வரும் வெண்பா அடிகள் ஒ ஆகும்."
2197,முதல் எழுத்து முடிய உயரும் வெண்பா அடிகள் வருமாறு நனிமுழவு வண்டு வரகு வரகு எழுத்துக்களானாகிய அடி.
2198,நனிமுழவு வண்டு வரகு கடியாறு எழுத்துக்களானாகிய அடி.
2199,நனிமுழவு வண்டு வரகு கணவிரி எழுத்துக்களானாகிய அடி.
2200,நனிமுழவு காருருமு வண்டு புளிமா எழுத்துக்களானாகிய அடி.
2201,நனிமுழவு காருருமு பாதிரி தேமா எழுத்துக்களானாகிய அடி.
2202,புலிவருவாய் என முதற்சீர் நிற்பினும் இது பொருந்தும்.
2203,இவ்வாற்றான் வரும் வெண்பா அடிகள் ஒ ஆம்.
2204,"ஆகவே, வெண்பாவிற்குரிய அடிகள் ஆமாறு அறியப்படும்."
2205,"இவற்றுள் எழுத்துக்களானாகிய அடி தன்னொடு தன்னைத் தொடுக்குமிடத்தே தளை வழுவுதலின், அது நீக்கிக் கொள்ளப்படும்."
2206,பிறவும் இவ்வாறே தளை வழுவாது தொடுக்கப்படும்.
2207,"பேரா. இனி நச்சினார்க்கினியர் உரையுள் கண்டவாறு வெண்பாவிற்கு இயற்சீர் வெண்சீர் அசைச்சீர் ஆக, சீர்கள் ."
2208,வெண்பா அடிகள் முதல் எழுத்து முடிய உயரும்.
2209,அவ்வாறு உயர்கையில் வகை அடியாம்.
2210,"எழுத்தளவின் மிக உயரின் அவ்வடி செப்பலோசை சிதையும் ஆதலின், அது கட்டளைவெண்பாஅடிக்கு ஆகாது."
2211,அடிதோறு முள்ள நாற்சீர்களான் உறழ்ந்தால் பெறும் கூடுதல் ஒ .
2212,"ஆகவே, வெண்பா அடிகள் என்றவாறு."
2213,"எழுத்தாலாகிய அடி தன்னொடு தன்னைத் தொடுக்குமிடத்தே தளை வழுவுதலின், நீக்கப்பட்டது."
2214,அவ்வாறே தளை வழுப்படும் அடிகளும் நீக்கப்படும். தொ.
2215,"எடு நின்று நினைந்து நெடிது பெயர்ந்து ஏழ் எழுத்தடி இதன்கண், அசைச்சீர் நான்கும் இயற்சீராய் நின்றன."
2216,"நேர்பு, நிரைபு, நிரைபு, நிரைபு என்ற நான்கும் நேர் நேர், நிரைநேர், நிரைநேர், நிரைநேர் எனச் சீர்நிலை எய்தின."
2217,கற்றவரைச் சேர்வர் கலைநிறையும் காட்சியார் எழுத்தடி.
2218,முதல் எழுத்து முடிய இடைப்பட்ட அடிகளும் கொள்ளப்படும்.
2219,கட்டளைவெண்பாவின் ஈற்றடி முதல் எழுத்து அள வினதாதல் வேண்டும்.
2220,வானவரும் நான்முகனும் வாசவனு மாமுனிவர் இது எழுத்துடைய சீர்வகை அடிவெண்பாவாம்.
2221,பின்னுள்ளோர் கூறும் ஏந்திசைச் செப்பலடி எழுத்து மிகுதற்கும் உரித்தாதலின் கட்டளைவெண்பாவிற்கு ஏலாது.
2222,ஏனைய ஒழுகிசைச் செப்பலும் தூங்கிசைச் செப்பலும் எழுத்தின் இகந்து வாராமையின் கட்டளைவெண்பா அடிக்கு ஏற்கும்.
2223,"நச் வெண்பாவின் அளவு குறுவெண்பாட்டு அடி, அடி யுடையது அளவடிவெண்பா முதல் அடிகாறும் நடப்பது."
2224,நெடுவெண் பாட்டு முதல் அடிகாறும் நடப்பது.
2225,"இவற்றுள், குறள்வெண்பாவாகிய ஈரடி வெண்பாவும், அடி அளவியல்வெண்பாவுமே பெரும்பான்மைய."
2226,நச். யா.க.
2227,எடு கையொத்து நேர்கூப்பு க பு.வெ.மா.
2228,கடவுள். நேர் நற்றாள் தொழாஅ ரெனின் கு.
2229,நிரை சாந்துணையும் கல்லாத வாறு கு.
2230,நேர்பு பற்றுக பற்று விடற்கு கு.
2231,சிறுபான்மை வெண்சீர்களும் ஈற்றயற் சீர்களாக வரும்.
2232,முச்சீரடியின் முதற்சீர்க்குத் தளையினை ஆசிரியர் கூறவில்லை.
2233,"ஏனெனின், முச்சீரடியின் முதற்சீரும் இரண்டாம் சீரும் தளைவகையானும் வரலாம் தளைவகையின்றியும் வரலாம்."
2234,செறாஅய் வாழியென் நேரொன்றாசிரியத்தளை.
2235,கலாஅற் கிளிகடியும் கானக நாட இலாஅர்க் கில்லை தமர். நாலடி.
2236,இலாஅர்க் கில்லை நேரொன்றாசிரியத்தளை.
2237,இவை தளைவகை யின்றி வந்தன.
2238,பேரா. இவற்றை செறாஅஅய் இலாஅஅர்க் என நான்கு மாத்திரையாக்கித் தளைவகை பிழையாமல் வந்ததாகவே கொள்வர்.
2239,", , நச்., பேரா. இனி, யா."
2240,கூறுவன வருமாறு வெண்பாவின் ஈற்றுச்சீர் நேரசையாயின் அதன் வாய்பாடு நாள்.
2241,இந்நேரசை பெரும்பாலும் தனி நெட்டெழுத்தாக வருவதே சிறப்பு குற்றெழுத்தாக வருவது சிறப்பின்று.
2242,நெட்டெழுத்தும் குற்றெழுத்தும் ஒற்றடுத்தும் வரும்.
2243,எடு தாவாத மாதவா நீ வாலெயி றூறிய நீர் கு.
2244,இவை சிறப்புடையன கையொத்து நேர்கூப்பு க பு.வெ.மா.
2245,கடவுள். கருமமே கட்டளைக் கல் கு.
2246,இவை சிறப்பில்லன.
2247,வெண்பாவின் ஈற்றுச்சீர் நிரையசையாயின் குறிலிணையும் குறிலிணை ஒற்றும் வருதலே சிறப்பு குறில் நெடிலும் குறில் நெடிலொற்றும் வருதல் சிறப்பின்று.
2248,எடு நினைப்பானை நீங்கும் திரு கு.
2249,நற்றாள் தொழாஅ ரெனின் கு.
2250,இவை சிறப்புடையன.
2251,வேம்போஎன் வாயின் வினா சொல்லாத சொல்லப் பெறார் இவை சிறப்பில.
2252,எடு சாந்துணையும் கல்லாத வாறு கு.
2253,இவை சிறப்புடையன ஆக்கம் எவனோ உயிர்க்கு கு.
2254,குற்றுகர ஈற்றன.
2255,புனைமலர்த்தா ரகலம் புல்லு இவை சிறப்பில்லன உள்ளத் தனைய துயர்வு கு.
2256,முற்றுகர ஈற்றன.
2257,வெண்பாவின் ஈற்றடி வெண்பா ஈற்றடி சிந்தடியாம்.
2258,அதன் இறுதிச்சீர் ஈரசைச் சீராகவோ அசைச்சீராகவோ வரும்.
2259,"ஈற்றுச்சீர் அசைச்சீராக அமையுமிடத்தே, தனிக்குறிலினாகிய நேரசையும் நெட்டெழுத்தைக் கொண்ட நிரையசையும் வருதல் சிறப்பின்று."
2260,"நேர் நேர், நிரை நேர் என்ற இயற்சீர்களே இறுதிச்சீராக வருதற்குரியன."
2261,அவையும் உகர ஈறாக அன்றி வாரா.
2262,அவற்றுள் குற்றியலுகர ஈறாய் வருதல் சிறப்புடைத்து முற்றியலுகர ஈறு சிறப்பின்று.
2263,வெண்பாவின் பேரளவிற்கு எல்லை வெண்பாவின் பேரளவிற்கு எல்லை அடிகளாம்.
2264,அடி பேரெல்லை என்பர் உரையாசிரியன்மார்.
2265,"உரை வெண்பாவின் பொதுவகை நூற்றிருபது குறள், சிந்து, நேரிசை, இன்னிசை, பஃறொடை என வெண்பா வின் தொகை ஐந்து."
2266,இவற்றை வெண்சீர் வெண்டளை யான் வருவன இயற்சீர் வெண்டளை வருவன என விகற்பிக்க இருபது வகைப்படும்.
2267,"வெண்பாவின் மூவகை ஓசை பற்றி ஒருசாரார் கூற்று செப்பல், வெண்கூ, அகவல் என்னும் மூவோசை உடைத்து வெண்பா."
2268,செப்பல் வெண்பா என்பது எழுசீரால் நடப்பது.
2269,எடு சிறப்பீனும் செல்வமு மீனும் அறத்தினூஉங் காக்க மெவனோ உயிர்க்கு. கு.
2270,வெண்கூ வெண்பா என்பது நேரிசை வெண்பா இனவெழுத்து மிக்கு நடப்பது.
2271,எடு தண்டடைந்த திண்டோளாய்!
2272,"இனி, அகவல் வெண்பாவாவது இன்னிசை வெண்பா."
2273,வெண்பாவின் அளவு காண்க.
2274,உரை வெள்ளடி வெண்பாவிற்குரிய அடி.
2275,அவை அளவடியும் சிந்தடியுமாம்.
2276,", நச். வெள்ளை விருத்தம் வெண்பா விருத்தம் காண்க."
2277,வெள்ளொத்தாழிசை சிந்தியல் வெண்பா ஒரு பொருள் மேல் மூன்றடுக்கி வருவன வெண்பாவின் இனமாகிய தாழிசை வகைகளுள் ஒன்று.
2278,எடு அம்பேருண் கண்ணார்க் கழிந்த மடநெஞ்சே கொம்பே றுடையான் கழலிறைஞ்சா தென்கொலியாம் வம்பே இறந்து விடல்.
2279,வாணேருண் கண்ணார்க் கழிந்த மடநெஞ்சே!
2280,நீணாகம் பூண்டான் கழலிறைஞ்சா தென்கொலியாம் வீணா இறந்து விடல்.
2281,கோளாருண் கண்ணார்க் கழிந்த மடநெஞ்சே!
2282,ஆளாக ஆண்டான் கழலிறைஞ்சா தென்கொலியாம் வாளா இறந்து விடல் சி.
2283,வெள்ளோசை வெண்பாவிற்குரிய செப்பலோசை இது வெண்டளையால் நிகழ்வது.
2284,வெளி வெண்பா இலக்.
2285,வெளி விருத்தம் வெண்பா விருத்தம் என்பதன் பிறிதொரு பெயர் அது காண்க.
2286,வெறுத்திசைப்பு ஓசைக்குற்றம் மூன்றனுள் ஒன்று.
2287,"ஏனையன அறுத்திசைப்பு, அகன்றிசைப்பு என்பன செவிக்கு இன்னாதாக இசைத்தல்."
2288,"வேற்றொலி வெண்டுறை முன் சில அடிகள் ஓரோசையாகவும், ஏனைய அடிகள் வேறோர் ஓசையாகவும் வரும் வெண்பா இனமாகிய வெண்டுறை."
2289,"வைப்பு தரவு தாழிசைகளின் பொருள்களைக் கொண்டு தொகுத்து வைத்தலின், சுரிதகம் வைப்பு எனப்பட்டது."
2290,"நச். விருத்தம், வண்ணம் அ அசுவகதி விருத்தம் இஃது அடிக்குப் பதினாறு எழுத்துக்கள் கொண்ட வட மொழி விருத்தம்."
2291,"இதன் அமைப்பு, முதற்கண் குருவான கணம் ஐந்து வந்து ஈற்றில் ஒருகுரு வருதல் மாத்திரைகள் கொண்டது ஓரடி."
2292,ஆ இதே வகைப் பாவில் ஆம் சீர் தேமாங்காயாகவே மாத்திரை பெற்று அடியிலும் வருமாறு அமைவது.
2293,"முதற்சீர் மாத்திரை, இறுதிச்சீர் மாத்திரை, ஏனைய சீர்கள் மாத்திரை."
2294,"போதி, யாதி, பாத, மோது என்றாற்போல வருவது இச்சந்தம்."
2295,ஒற்றொழித்து உயிராவது உயிர்மெய்யாவது அடியொன்றற்கு இரண்டெழுத்துப் பெறும் இச்சந்தம்.
2296,ஒற்றெ ழுத்தை நீக்கி உயிரும் உயிர்மெய்யுமாக அடிக்கு எழுத்து எனக் கொள்ளப்படும்.
2297,உரை அதிசக்குவரி எழுத்துவகையால் இருபத்தாறு பேதப்படும் சந்தங்களுள் ஒன்று இது.
2298,ஒற்றெழுத்து நீங்கலாக உயிரும் உயிர்மெய்யும் ஓரடிக்கு எழுத்து எனக் கொள்க.
2299,உரை அதிசயதி எழுத்துவகையால் இருபத்தாறு பேதம் ஆம் எனப்பட்ட சந்தங்களுள் ஒன்று.
2300,ஐஞ்சீர்களை அடிதோறும் உடைய கலிநிலைத்துறை.
2301,ஒற்றொழித்து உயிரும் உயிர்மெய்யுமாக ஓரடிக்கு எழுத்து என்க.
2302,உரை அதிதிருதி எழுத்துவகையான் இருபத்தாறுபேதமாம் எனப்பட்ட சந்தங்களுள் ஒன்று.
2303,உரை அதியாடி எழுத்துவகையான் இருபத்தாறு பேதமாம் எனப்பட்ட சந்தங்களுள் ஒன்று.
2304,மாச்சீரால் இயன்ற எழுசீர் விருத்த யாப்புள் இச்சந்தம் பயிலும் விளச்சீர் சிறுபான்மை விரவினும் இழுக்காது.
2305,ஒற்றொழித்து உயிரும் உயிர்மெய்யுமாக ஓரடிக்கு எழுத்து எனக் கொள்க.
2306,உரை அதியுத்தம் அதிஉத்தம் காண்க.
2307,உரை அபிகிருதி எழுத்து வகையால் பேதமாம் எனப்பட்ட சந்தத்துள் ஒன்றாம்.
2308,அடிதோறும் எழுத்துக்கள் ஒற்று நீக்கி எண்ணப் படுமாறு காண்க.
2309,இவ்வாறு காய்ச்சீரும் விளச்சீரும் சிறுபான்மை கனிச்சீரும் அறுசீரடியுள் விரவுமாறு நாலடியால் நிகழும் விருத்த யாப்பினுள் இச்சந்தம் பயிலுமாறு காண்க.வீ.
2310,ஏனைய ஓசைகளோடும் ஒட்டிக்கொள்க.
2311,"இது முதலடி எழுத்தாய், இரண்டாமடி எழுத்தாய், பின்னிரண்டு அடிகளும் எழுத்தாய் வந்தமையால் அளவழிச் சந்தப் பையுள் ஆயிற்று."
2312,எழுத்தெண்ணிக்கையில் புள்ளியெழுத்து விலக்குண்ணும். யா.
2313,இஃது எழுத்து ஒவ்வாதது.
2314,", அளவழித் தாண்டகம் எழுத்து முதலாக உயர்ந்த அடியினவாய் எழுத்தும் குருலகுவும் ஒவ்வாது வருவன அளவழித் தாண்டகமாம்."
2315,"மூவடிவி னாலிரண்டு சூழ்சுடரும் நாண, சூளா."
2316,அளவழிப் பையுட் சந்தம் நான்கடிகளும் சீரான் ஒத்து எழுத்துக்களான் வேறுபட்டு வரும் சந்தப்பாடல்.
2317,"இது முதலடி எழுத்தாயும், இரண்டாமடி எழுத்தாயும், மூன்றாமடி எழுத்தாயும், நான்காமடி எழுத்தாயும் வந்தமையால் அளவழிப் பையுட் சந்தம்."
2318,உரை பக்.
2319,அளவியல் தாண்டகம் எழுத்து முதலாக உயர்ந்த எழுத்தின் அடியினவாய் எழுத்தும் குருலகுவும் ஒத்து வருவன அளவியல் தாண்டக மாம்.
2320,எடு வானிலவி முகிலார்ப்ப மருவி மாண்பால் எனத் தொடங்கும் எண்சீர்விருத்தம் யா.
2321,எழுத்தடி அளவியல் தாண்டகம்.
2322,அறுசீர்ச் சந்த விருத்தம் மூன்று மாத்திரையுடைய அறுசீரும் ஈற்றில் ஒரு நெட்டெழுத்தும் பெற்ற அறுசீரடி நான்கால் அமைவது.
2323,பாரதம் நீண்ட புளிமாச்சீர் ஆறும் ஈற்றில் ஒருநெட்டெழுத்தும் பெற்ற அறுசீரடி நான்கான் அமைவது.
2324,குற்றுயிர் ஈற்றினுடைய ஆறு கூவிளச்சீரொடு நெட் டெழுத்து ஈற்றில் பெற்ற அறுசீரடி நான்கான் அமைவது.
2325,ஒற்றடுத்த குறில் அல்லது நெடிலை ஈற்றினுடைய ஐந்து விளச்சீரும் இறுதி விளங்காய்ச்சீரும் கொண்ட அறுசீரடி நான்கான் அமைவது.
2326,திருப்போரூர் சந்நிதிமுறை காப்பு. நான்கு மாத்திரை மாச்சீர் ஆறுகொண்ட அறுசீரடி நான்கான் வருவது.
2327,அறுபத்துநாலடிச் சிந்து என்ற அடிவரையறையுடைய தாளத்தொடு பாடப்படும் இசைப்பாட்டு.
2328,உரை ஆ ஆகிருதி வீ.
2329,உரையில் மூலத்தில் அதிகிருதி என்றிருக்கிறது.
2330,ஆகிருதி என்பதே பொருந்தும். உருவம் அடிதோறும் ஒற்று நீங்கிய உயிரும் உயிர்மெய்யுமாகிய எழுத்துக் கொண்ட நான்கடியை யுடைய சந்தம்.
2331,கருவிளம் கூவிளம் கருவிளம் கூவிளம் கருவிளம் புளிமாங்காய் என அடிதோறும் நிகழ்வது.
2332,எடு தளையவி ருட்புது நறைவிரி யும்பொழில் தடமலி துறைமாடே வளைமொழி நித்தில மனநில வைத்தரு மயிலையி லெழுகாரே!
