Line Number,Sentence
7482,போக நான்கு கல் வர நான்கு கல் சுவாமிகளுடன் நடக்க நடக்க ஊக்கமே தோன்றியது.
7483,இளைப்போ களைப்போ சலிப்போ தலைகாட்டவில்லை.
7484,சுவாமிகள் என்னைத் தக்கமுறையில் நீரால் ஆட்டிய அன்பை அன்பே உணரவல்லது.
7485,சுவாமிகளுடன் யான் மூன்று திங்களிருந்தால் இழந்த இளமையை மீண்டும் பெற்று விடுதல் கூடும் போலும்!
7486,"கடந்த ஆடித்திங்களில் வெட்டுவாணத்திலே சுவாமிகளை நோக்கி, யான் பல ஆண்டு சுவாமிகளுடன் பழகி வருகிறேன்."
7487,?
7488,என்று கேட்டேன்.
7489,சுவாமிகள் சுண்டுவிரலை உயர்த்திச் சுழற்றினர்.
7490,அதன் பொருள் இன்னும் உலகத் தொண்டு செய்க என்பது.
7491,?
7492,என்று மீண்டுங் கேட்டேன்.
7493,அது தானே வரும் என்ற பதில் கிடைத்தது.
7494,யான் கண்ட முடிவும் சுவாமிகளின் கருத்தும் ஒன்றாகவே இருந்தன.
7495,மௌன சுவாமிகள் உலகத்துடன் ஒட்ட ஒழுகித் தொண்டு செய்தவண்ணமிருக்கிறார்.
7496,அவருக்கு ஓய்வே கிடையாது.
7497,எந்நேரமும் ஏதேனும் ஒன்றை அவர் செய்து கொண்டே யிருப்பர்.
7498,அவர் வாழ்க்கை சோம்பலை அறியாது.
7499,சுவாமிகளை யான் ஒரு பெருந் தொண்டரென்றே போற்றுகிறேன்.
7500,அவ்வற வோருடன் பல ஆண்டு பழகும் பேற்றையும் எளியேன் வாழ்க்கை அடைந்தது.
7501,.
7502,சின்மயானந்தர் இராணிப்பேட்டையில் அச்சுதானந்தர் சன்மார்க்க சங்கம் என்றொரு வேதாந்த சபை இருக்கிறது.
7503,அதன் மூல மூர்த்தி சின்மயானந்தர் நிர்வாகத் தலைவர் ஸ்ரீநிவாசலு நாயுடு.
7504,ஆம் ஆண்டில் தலைவரிடத்திருந்து தலைமைத் தொண் டுக்கு அழைப்பு வந்தது.
7505,இராணிப்பேட்டைச் சன்மார்க்க சங்கத்தின் நடைமுறைகள் போற்றற்குரியனவாயிருந்தன.
7506,அங்கத்தவரிடைச் சாதி வேற்றுமை கண்டேனில்லை.
7507,"மகமதியர், கிறிதுவர், ஆதிதிராவிடர், சாதி திராவிடர் முதலியோர் சகோதரராய் உறவுகொண்டுள்ளனர் பரிமாறுகின்றனர் உணவு கொள்கின்றனர்."
7508,சின்மயானந்தர் தொண்டு என்னே!
7509,"எத்தனையோ சீர்திருத்த மகாநாடுகளும், சட்டங்களும், திட்டங் களும், செய்யத்தக்க வேலையை ஒரு சின்மயானந்தர் தொண்டு செய்தது."
7510,வேதாந்தம் சின்மயானந்தரிடத்தில் நூலாக விளங்க வில்லை அவர் வாழ்க்கையாயிற்று.
7511,வேதாந்த வாழ்க்கை மக்களைச் சகோதரராக்க வல்லது.
7512,நாடும் பெரியோர்வழி நிற்கும் இயல்புடையது.
7513,சின்மயானந்தர் நோக்கில் நடைபெற்று வரும் பல வேதாந்த சபைகளின் சாதிமதங் கடந்த தொண்டுகள் என்னை அடிக்கடி அழையா நிற்கின்றன.
7514,.
7515,சுத்தானந்த பாரதியார் நீல வானம் ஒரே அமைதி மணிகள் ஒளிர்கின்றன ஒரு தமிழ் மணி பொலிகிறது.
7516,அம்மணியே சுத்தானந்தம்.
7517,சுத்தானந்த பாரதியாரிடம் தொண்டு எப்பொழுது ஊற்றெடுத்ததோ யான் அறிகிலேன்.
7518,எனக்கு ஆம் ஆண் டிலே சேரமாதேவியினின்றும் அவர்தந் தொண்டு என் செவிக்கு எட்டியது.
7519,அத்தொண்டு மேலும் மேலும் அங்கும் இங்கும் பெருகிப் பெருகி இப்பொழுது புதுவையில் வாரிதியா யிருக்கிறது.
7520,"பாரதியார் பத்திரிகாசிரியராய், நூலாசிரியராய், பிரசாரகராய்ச் சென்னையில் வாழ்ந்தபோது அவரும் யானும் கேண்மையரானோம்."
7521,ஒருநாள் சுத்தானந்தர் நிலக்கடலை உண்டுகொண்டே நவசக்தி நிலையம் போந்தனர்.
7522,அன்று அவரது பரந்து நீண்ட கூந்தலும் தாடியும் நிலவுபொழிவதனமும் முனிவர் தோற்றத்தை வழங்கின.
7523,அன்றுமுதல் அவரை யான் சுத்தானந்த முனிவரென்றே கொள்ளலானேன்.
7524,பெரியபாளையம் ஒரு பலிபீடம்.
7525,அங்கே ஏழை உயிர் களின் இரத்தம் குளமெனத் தேங்கும்.
7526,அவ்விடத்தில் ஜீவ ரட்சா பிரசார சபையின் தொண்டு ஆண்டுதோறும் நடைபெற்று வருகிறது.
7527,ஆம் ஆண்டில் சுத்தானந்தபாரதி யாருடன் யானும் போனேன்.
7528,அங்கே பாரதியாரிடத்திருந்து புதுப் பாட்டொன்று கிளம்பியது.
7529,"அப்பாட்டின் முழக்கம் அன்று பெரியபாளைத்திலும், பின்னே பலவிடங்களிலும் பரந்தது."
7530,எங்கள் பிரசாரம் அங்கே நடந்தது.
7531,சில ஆடுகள் விடுதலை யடைந்தன.
7532,ஓர் அழகிய ஆட்டைச் சுத்தானந்தர் கைகள் பற்றின ஆடு அவர் கழுத்தில் ஏறியது.
7533,முனிவர் ஊர்வலம் வந்த காட்சி நினைவிலுறுகிறது.
7534,அக்காட்சியை என்னென்று சொல்வேன்!
7535,புத்தர் காட்சி என்று சொல்லால் சொல்லுதல் கூடும்.
7536,கோலார் தங்க வயலிலே ஜீவகாருண்ய சங்க ஆண்டு விழா.
7537,முதல்நாள் தலைவர் பாரதியார் மற்ற இரண்டுநாள் தலைமை என்னுடையது.
7538,இரண்டாம் நாள் மழை பொழிந்தது.
7539,அம்மழைநீரில் சுத்தானந்தர் ஆடி ஆடிச் சுத்த ஆனந்தரா கியதைக் கண்டேன்.
7540,இப்பொழுது சுத்தானந்தம் எங்கே உறைகிறது?
7541,எப்படி நிலவுகிறது?
7542,அரவிந்தக் கோட்டத்தில் உறைகிறது அன்பு நிலையமாய் நிலவுகிறது.
7543,அன்பு நிலையத்தினின்றும் என்ன பிறக்கும்?
7544,தொண்டு பிறக்கும்.
7545,"தொண்டு, வெள்ளமாய் வாரிதியாய் தமிழ் வாரிதியாய்ப் பரந்து உலகுக்குப் பயன்படுகிறது."
7546,சுத்தானந்த முனிவர் கருவி கரணங்கள் ஓய்ந்த முதல் தொண்டராய் வீற்றிருக்கிறார்.
7547,மணி விழா மலர் பார்க்க.
7548,அறிவுப்புரட்சி என்று பேசி வருகிறேன் எழுதி வரு கிறேன்!
7549,அப்புரட்சி சுத்தானந்தரிடத்திலுங் கால்கொண் டுள்ளது.
7550,அக்கால்கோள் என்னை உவகைக் கடலாடச் செய்துள்ளது.
7551,சுத்தானந்தம் வாழ்க தமிழ் வெல்க.
7552,.
7553,சண்முகானந்தர் எங்களைக் கண்டதும் சிவ சிவ என்று வர வேற்றார்.
7554,அவரது தோற்றம் வெள்ளைக் கலையணிந்த குறு முனிவர் போன்றிருந்தது.
7555,பதில் கிடைக்க வில்லை.
7556,இவ்வாண்டாதல் வருதல்வேண்டும் என்று சொன் னார்.
7557,அஃது உச்சநிலை அடைந்திருந்தது.
7558,அந்நாளில் சுவாமிகள் காங்கிர தொண்டுக்கென்றே வாழ்ந்தார் என்று சுருங்கச் சொல்கிறேன்.
7559,ஆம் ஆண்டு முதல் பல ஆண்டு ஆடித்திங்கள் தோறும் சண்முகானந்த சுவாமிகள் வெட்டுவாணத்தில் என்னைச் சந்திப்பர்.
7560,நான்கு நாள் ஆனந்தமாகக் கழியும்.
7561,யான் காலையில் பாலாற்றுக்குப் புறப்படுவேன்.
7562,அன்பர் கூட்டம் என்னைத் தொடரும்.
7563,அக்கூட்டத்தில் சுவாமிகள் திலகமெனத் திகழ்வர்.
7564,வெள்ளிக் கம்பித் துதைந்து போர்த்த முடியும்.
7565,"தண்டமேந்திய கையும், வெள்ளை அங்கியும், தெத்திய நடையும், சிங்கநோக்கும் வழியெலாம் வருவோர் போவோர் கருத்தைக் கவரும்."
7566,அவர்கள் விழிகள் சுவாமிகள் மீது தவழ்ந்த வண்ண மிருக்கும்!
7567,அக்காட்சியைக் கண்டு கண்டு யான் நடப்பேன்.
7568,அன்பர் பாகர முதலியார் தொண்டு வியக்கத்தக்கதா யிருக்கும்.
7569,பாலிநீர் பளிங்கெனச் சுரந்து ஓடும்.
7570,அன்புக் கூட்டம் ஆற்றங்கரையை அடையும்.
7571,சண்முகா னந்த சுவாமிகள் தடியை நாட்டுவர் அங்கியைக் களைவர் ஏறென அமர்வர்.
7572,உலகப் பேச்சுக்கள் தாண்டவம் புரியும்.
7573,மணல்மேடு மன்றமாகும்.
7574,சுவாமிகள் வடிவத்தில் ஆண்டி கட்டளையில் அரசர்.
7575,அன்பர் பணிகள் வியக்கத்தக்கனவா யிருக்கும்.
7576,யான் வாய்திறந்து எவரையும் பணி புரியுமாறு கேளேன்.
7577,சுவாமிகள் கட்டளையும் அன்பர்கள் பணியும் எல்லாஞ் செய்யும்.
7578,நீராடல் முடியும்.
7579,எல்லோரும் மீண்டுந் திரும்புங் காட்சியை ஈண்டு வருணிக்க வேண்டுவதில்லை.
7580,சில ஆண்டு சுவாமிகள் வெட்டுவாணம் நோக்கினா ரில்லை சென்னை அவரை விடுவதில்லை.
7581,ஆற்றங்கரையில் ஆனந்தமில்லை.
7582,மணல்மேட்டை அடைந்ததும் ஸ்ரீநிவாசலு நாயுடு சண்முகானந்த சுவாமிகளை நினைந்து கொள்வார்.
7583,மணல்மேடு ஏங்கும்.
7584,அந்நிலையில் என் நெஞ்சமும் ஏங்கும்.
7585,அங்கே எல்லார் உள்ளத்திலும் சண்முகானந்தம் நிலவும்.
7586,ஆம் ஆண்டு உப்புச் சத்தியாக்கிரக ஆண்டு!
7587,சக்கர வர்த்தி இராசகோபாலாச்சாரியாரிடத்திருந்து ஓர் அறிக்கை பிறந்தது.
7588,அதில் தமிழ்நாட்டில் வேதராண்யந் தவிர மற்ற இடங்களில் சத்தியாக்கிரகம் நிகழ்தல் கூடாது என்று குறிக்கப்பட்டிருந்தது.
7589,அவ்வறிக்கை சண்முகானந்தரைக் கட்டுப் படுத்தவில்லை.
7590,"அவர் ஒரு கூட்டத்தைத் திரட்டிச் சோழங்க நல்லூர் போந்து, சத்தியாக்கிரகஞ் செய்து சிறைக்கோட்டம் நண்ணினார்."
7591,சட்ட மீறலுக்குச் சட்டமீறல் நடந்தது என்று யான் நினைத்தேன்.
7592,சண்முகானந்த சுவாமிகள் சிறைக்கோட்டத்திலிருந்து வெளிப்பட்டார் மீண்டும் அக்கோட்டம் புக முயன்றார்.
7593,யான் வீண் என்றேன்.
7594,முயற்சி கைவிடப்பட்டது.
7595,இல் வடஆர்க்காட்டு ஜில்லா போர்டில் காங்கிர அங்கத்தவர்க்குள் ஒற்றுமை குலைந்தது.
7596,அது குறித்து இந்நூல் அரசியல் தலைப்பில் விளக்கியுள்ளேன்.
7597,"வட ஆர்க்காட்டு நிலைமையும், வேறு பல இடங்களின் நிலைமையும் ஒரு புது மாகாணக் காங்கிரசை நிறுவுமாறு என்னைத் தூண்டின."
7598,யான் அம்முயற்சியில் தலைப்பட்டேன்.
7599,அதற்குச் சுவாமிகள் துணையுங் கிடைத்தது.
7600,காங்கிரஸுக்கு முன்னர் பிராமண ரல்லாதார் என்னும் வகுப்பு முத்திரையிடுமாறு சிலர் என்னை நெருக்கினர்.
7601,அவருள் சுவாமிகளும் ஒருவரானார்.
7602,வகுப்பு முத்திரையிட யான் இணங்கினேனில்லை.
7603,"ஆம் ஆண்டு, காங்கிர மந்திரிசபை ஆட்சியில் எழுந்தது கிளர்ச்சி ஹிந்திக்கிளர்ச்சி."
7604,சண்முகானந்தரிடத் திருந்து கிளம்பியது வீரசக்தி.
7605,அச்சக்தி புயலாயிற்று பெரும் புயலாயிற்று.
7606,சென்னைக் கடற்கரையில் கூட்டம் பெருங் கூட்டம் இலட்சக்கணக்கில் திரண்டது பெண்கள் பட்டாள முந் திரண்டது.
7607,சென்னை சண்முகானந்த மயமாகியது.
7608,அவரே முதல் முதல் பிடிபட்டார்.
7609,சிறைக்கோட்டம் தனது பழைய நண்பரை வரவேற்றது.
7610,யான் எப்பக்கமுஞ் சேராமல் ஹிந்தியை இஷ்டபாடமாகச் செய்து கிளர்ச்சியை ஒடுக்குவது நல்லது என்று நவசக்தி யில் எழுதிவந்தேன்.
7611,சுவாமிகள் உழைப்புத் தமிழ் உணர்ச்சியாயிற்று.
7612,கிளர்ச்சிக் காலத்திலே சண்முகானந்த சுவாமிகட்கும் அருணகிரி அடிகட்குங் கூட்டுறவு ஏற்பட்டது.
7613,அஃது என்ன செய்தது?
7614,சண்முகானந்தரின் வெண்கலையைச் சிவப்பாக மாற்றியது.
7615,அம்மாற்றம் என்னை மகிழ்விக்கவில்லை.
7616,சுவாமிகள் சில காலம் திருப்போரூரில் வதிந்தனர்.
7617,அங்கு யான் அடிக்கடி போவேன் வருவேன் தங்குவேன் அப் போரூரிலும் அவர் ஆட்சி நடவாமலில்லை.
7618,மடத்திலும் மலையிலும் குளத்திலும் எங்கணும் அவர் ஆட்சியே.
7619,சண்முகானந்தர் கிளர்ச்சியில் பழகியவர்.
7620,அவர் மனமும் அவ்வண்ணமாயிற்று.
7621,கிளர்ச்சி மனத்தின் இயல்பு என்ன?
7622,இரக்கம்.
7623,திருப்போரூரில் எங்கிருந்தோ போந்த ஒரு குடும்பம் பட்டினியால் வதையுண்டது.
7624,"அதைச் சுவாமிகள் கண் கண்ட தும், அவர் இதயம் கசிந்தது நடை தளர்ந்தது பேச்சுந் தளர்ந்தது."
7625,அக்குடும்பத்தின் துயர் நீக்கச் சுவாமிகள் முயன்றார்.
7626,துயர் நீக்கங் கண்ட பின்னரே அவர் முகம் மலர்ந்தது.
7627,இந் நிகழ்ச்சியை யான் நேரே கண்டேன்.
7628,"சுவாமிகள்மனம் பளிங்குஅதனால்அது,.....பற்றின்அதன்இயல்பாய்நிற்கும்...... யுமானார்ருவாக்குக்குலக்கியமாகிறது."
7629,அவர் மனம் கிறிது பெருமான் மலைப்பொழிவில் தோயவேண்டுமென்பது எனது வேட்கை.
7630,மலைப்பொழிவு வடிவாக ஒரு நிலையம் அவரால் நடத்தப்படல் வேண்டுமென்பதும் என் கனவு.
7631,ஆண்டவன் சித்தம் எப்படியோ?
7632,.
7633,சாரங்கபாணி டி.ஆர்.சாரங்கபாணியின் குழந்தைமையும் எனக்குத் தெரியும் பிள்ளைமையும் எனக்குத் தெரியும்.
7634,"அவர் என் தமையனார் மைந்தன் பாலசுப்பிரமணியத்தையும், தமக்கையார் மைந்தன் சண்முகசுந்தரத்தையும் பார்க்க எங்கள் வீட்டுக்கு வருவர்."
7635,அந்நாளிலேயே அவரது அறிவுத்திறம் ஒரோ வழி எனக்கு விளங்கி வந்தது.
7636,சாரங்கபாணி இளைஞராய் எம்.ஏ.பரீட்சையில் தேறிய பின்னர் என்னுடன் நெருங்கிப் பழகினார்.
7637,அவர் தமிழ் நூல் களை ஆராய்ந்து வந்தமை எனக்குத் தெரியாது.
7638,அது பின்னரே தெரியவந்தது.
7639,உரையாடலில் சாரங்கபாணியின் நுண்ணறிவில் என் மனம் ஈடுபட்டது.
7640,அம்மனம் அவரை நவசக்தி யில் கட்டுரை வரையுமாறு கேட்கத் தூண்டியது.
7641,அவரால் கட்டுரை கள் வரையப்பட்டன.
7642,அவரது சொற்பொழிவுகள் சிலவும் என் தலைமையில் நடைபெற்றன.
7643,சாரங்கபாணியின் கட்டுரைகளும் சொற்பொழிவுகளும் நடக்கையும் அவர் உரிமை உணர்வினர் என்பதைச் செவ்வனே விளக்கின.
7644,உரிமை உணர்வு என்றால் என்ன?
7645,செருக்கா?
7646,தருக்கா?
7647,செருக்கும் தருக்கும் போலி உரிமை உணர்வின் பயன்.
7648,பின்னை உரிமை உணர்வின் பயன் எது?
7649,தொண்டு.
7650,சாரங்க பாணி தொண்டராயினர்.
7651,இவை உரிமை உணர்வினின்றும் எழுந்தவை.
7652,இவ்வுணர்வுடைய பெருமான் வாழ்க்கை எதில் ஈடுபட்டது?
