Line Number,Sentence
916,ஏழை குருடரும் ஈனச்சப் பாணியும் வாழ அழைத்தல் வளம்.,False
917,திரும்ப விருந்திவர் செய்யார் அதனால் அரும்புதல் கைம்மா றரிது.,False
918,நல்லதே உப்பு நகர்ந்துவிடின் சாரமெலாம் செல்லுமோ மீண்டுமவை சேர்ந்து.,False
919,உப்புடைய ராகுங்கள் ஓங்குசமா தானத்தில் ஒப்புரவுக் கேற்க உழைப்பு.,False
920,இன்றழும் நீவிர் இதமுற வாழியே என்றும் நகைப்பீர் இனி.,False
921,செறிந்தது கேடுநீர் புல்லிய ஆறுதல் போம்.,False
922,நிகழ்ந்தது கேடு வறுமை பசிவாட்டும் வந்து.,False
923,நளிர்ந்தது கேடு புகையுமே துன்பப் புலம்பு மற்றவர் உன்னை மகிழ்ந்து புகழுங்கால் உற்றது கேடென் றுணர்.,False
924,"ஏவனே கேட்பினும் ஈக, பறிப்போனை மேவியே கேளற்க மீண்டு.",False
925,கற்பழிந்தாள் காண்பளேல் கல்லெறிக என்பதுமுன் கற்பனை என்றீர் கவிழ்ந்து.,False
926,பாவமிலார் ஈங்கிருப்பின் பார்த்துக்கல் வீசுக மேவிய இப்பெண்ணின் மீது.,False
927,ஒவ்வொருவ ராக ஒதுங்கி அகன்றனர் செவ்வையிர்!,False
928,காண்மின் சிறந்து.,False
929,பெண்ணேஉன் பாவங்கள் பெற்றன மன்னிப்பை எண்ணாதே பாவமினி ஏகு.,False
930,தியாகம் என்பின் வரவிரும்பின் ஏந்தியே தன்சிலுவை தன்னை வெறுத்தல் தகவு.,False
931,என்பொருட்டென் செய்திபொருட்டில்லநிலம் சோதரர்கள் தன்பெற்றோர் ஆதிவிடல் சால்பு.,False
932,இம்மையில் நூறாகி எல்லாம் பெருகுமே அம்மையில் வீடுண் டமை.,False
933,பின்பற்றி வாஎன்றேன் பெற்றோனை மண்ணடக்கம் முன்செய்யக் கேட்கின்றாய் மோந்து.,False
934,மரித்தோர் மரித்தோரை மண்ணிற் புதைப்பர் வரித்தென்னைப் பின்பற்றி வா.,False
935,காசுபலர் இட்டனர் காணிக்கை யாயிங்கே ஆசிஇக் கைம்மைக்கே ஆம்.,False
936,காசுநிதி இல்லாள் கடைவாழ்வுக் குள்ளதையும் வீசினள் நேசத்தில் வீழ்ந்து.,False
937,நிதியிருந்து செல்வரெலாம் நீட்டினர் கையைக் கதிஇரு காசளித்தாள் கண்டு.,False
938,மரணம் என்சொல் வழிநடப்போன் என்றும் மரணத்தில் துன்னி அதைக்காணான் துச்சு.,False
939,உயிரோ டிருந்தென்னில் உண்மை உறுதி பயில்வோன் மரணம் படும்.,False
940,உறுதிஎன் பால்வைப்போன் உற்றிடான் சாவை உறினெழுவன் மீண்டும் உயிர்த்து.,False
941,மார்த்தாளே மார்த்தாளே மாழ்கிப் பலநினைந்து கூர்த்துக் கவல்கின்றாய் கோது.,False
942,தேவையை ஆய்ந்தால் சிறிதாம் அலதொன்றாம் ஆவி வதைஏன் அதற்கு?,False
943,மரியாளோ கண்டாள் மகிழ்தக்க நல்ல மரியாத பங்கை மதி.,False
944,ஈண்டுநிற்போர் சில்லோர் இறையுலகைக் காணுமுன் மாண்டசுவை பார்ப்பதிலை மாண்பு.,False
945,தொண்டு சாப்பிடும் என்கின்றீர் சாப்பா டெனக்கெது?,False
946,சாப்பிடல் சொல்கின்றேன் சற்று.,False
947,என்னை அனுப்பினவன் எண்ணம் நிறைவேற உன்னிப் பணிசெய்தல் ஊண்.,False
948,அழியும் உணவேன்?,False
949,அழியா உயிர்கட் குழையுமது சீவ உணவு.,False
950,கலம்பகம் பிடிக்கின் றீர் மீனைஎன் பின்வாரும் மக்கட் பிடிப்பவ ராக்குவேன் பேறு.,False
951,"ஆவிக்கோ ஊக்கம், அணிந்த புலாலுக்கோ மேவிக் குடையும் மெலிவு.",False
952,இத்தகைய பேயோட்டல் ஏதாலும் ஏலாது சத்திய நோன்புசெபம் சால்பு.,False
953,பட்டயத்தைப் போடுறையில் பட்டயந் தாங்கினவன் பட்டயத்தால் மாண்டிடுவன் பட்டு.,False
954,"சிறிதிலே மெய்யன் பெரிதிலும் மெய்யன் சிறுநேர்மை சேர்க்கும் பெரிது அல்ல பலியை, அருளை விரும்புகின்றேன் நல்லபொருள் கற்றிடுக நாள்.",False
955,தன்வீட்டில் ஊரில் தவிரஒரு தீர்க்கன்அயல் மன்வீட்டில் ஊரில் மதிப்பு.,False
956,என் கையைப்பார் தொட்டு விலாவைப்பார் ஏமாறா நம்பிக்கை ஏல்.,False
957,அய்யனே அப்பனே ஆண்டவ என்கின்றாய் மெய்யினைப் பார்த்தபின் மேல்.,False
958,"பார்த்தென்னை நம்பினை, பாராமல் நம்புவோர் ஆர்த்தபெரும் பேறுடையார் அன்பு.",False
959,இறுவாய் பிரான்ஸி அந் தண்மை பெறச்செய்த ஏசு பிரான் மலைச்சொல் வாழி பெரிது.,False
960,தத்துவ வாழ்வடையத் தால்தாயைச் செய்தபெருஞ் சத்தியம் வாழி தழைத்து.,False
961,காந்தி யடிகளைக் காத்த மலைமொழி சாந்தமே வாழியது சத்து.,False
962,முத்தி நெறியறியா மூர்க்கஉல குய்யஅருள் பத்திமொழி வாழி பரம்.,False
963,எங்கும் பொதுமை இயங்க அருள்வளர்க்கும் பொங்கு மலைமொழியைப் போற்று.,False
964,கொலையுலகம் மாய்ககொடுங் குண்டாட்சி வீழ்க மலைமொழி வாழ்க மலர்ந்து.,False
965,சேவக ரின்றியும் சேனைக ளின்றியும் ஏவரும் வாழ்க இனிது.,False
966,மக்களின் ஆட்சி மலர்க மலைப்பொழிவால் தக்கஅறம் ஓங்க தழைத்து.,False
967,மலைமொழி வாழி மணிமொழி வாழி நிலைவழி வாழி நிகழ்ந்து.,False
968,ஏசு ஒளிவளர்க இவ்வுலகம் ஒன்றாக நேச வழியால் நிறைந்து.,False
969,"இருளில் ஒளி கண்கள் , , , , , , ? .",False
970,", , .",False
971,", .",False
972,முன்னுரை உலகம் போராட்டம் என்று சொல்லப்படுகிறது.,False
973,இஃது அநுபவ மொழி.,False
974,போராட்டம் ஒருவிதமா?,False
975,பல விதம் என்னும் விடையே பிறக்கும்.,False
976,யான் ஒருவிதப் போராட் டத்தை இங்கே குறிக்க விரும்புகிறேன்.,False
977,"அது, கடவுள் நெறிக்கும் உலக நெறிக்கும் நிகழ்வது.",False
978,அப்போராட்டம் ஒழிந்தால் உலகம் சீர்படும் அமைதியுறும் உய்யும்.,False
979,கடவுளே பொருளென்பர் சிலர் உலகமே பொருளென்பர் வேறு சிலர் இரண்டும் பொருளென்பர் மற்றுஞ் சிலர்.,False
980,இவர்க் குள் போராட்டம் நிகழ்ந்தவண்ணம் இருக்கிறது.,False
981,கடவுளும் பொருள் உலகமும் பொருள் என்ற கொள்கை சன்மார்க்கம் என்று வழங்கப்படுகிறது.,False
982,சத் மார்க்கம் சன் மார்க்கம்.,False
983,சத் உண்மை மாறாத உண்மை கடவுள்.,False
984,மார்க்கம் வழி உலகவழி இயற்கைவழி.,False
985,கடவுளை அடைதற்குரிய வழி உலகம் அல்லது இயற்கை என்க.,False
986,இப்பொருளில் சன்மார்க் கத்தைப் பற்றி யான் பேசியும் எழுதியும் வருவது நேயர்கட்குத் தெரியும்.,False
987,அச்சன்மார்க்கம் இந்நூற்கண்ணும் பெய்யப்பட்டிருக் கிறது.,False
988,என்று சிலர் கேட்கலாம்.,False
989,இந்நூல் விவகார உலகிலேயே இயற்றப்பெற்றது.,False
990,இவ்வுலகைப் பொய்யென்று எவ்வறிஞரும் கூறினாரில்லை.,False
991,"விவகார உலகில் உயிர்கள் வாழ்ந்து, கடவுள்நெறி நின்று ஒழுகின், உலகம் பலதிறப் போராட்டங்களினின்றும் விடுதலையடைந்து அமைதியுறும்.",False
992,"அமைதி, மேல்நிலைக்குக் கால்கொள்ளும்.",False
993,மேல்நிலையில் உலகம் பொய்யா?,False
994,என்னும் ஆராய்ச்சியை ஈண்டு நிகழ்த்தவேண்டுவதில்லை.,False
995,சன்மார்க்க வழிபாட்டுத் துறைகள் பல பலதிறம்.,False
996,அவற்றுள் ஒன்று தொண்டு.,False
997,தொண்டில் எனது வாழ்க்கை ஈடுபட்டது படிந்தது ஒன்றியது.,False
998,"சமயத்தொண்டு, நாட்டுத்தொண்டு, மொழித்தொண்டு, சீர்திருத்தத் தொண்டு, அரசியல்தொண்டு, தொழிலாளர்தொண்டு, பத்திரிகைத் தொண்டு முதலியன என்னைச் சூழ்ந்தன.",False
999,அச்சூழல் எனது நூற்றொண்டை இரவில் ஆற்றுமாறு என்னை உந்தியது நெருக்கியது.,False
1000,"எனக்கு இரவு, பகலாயிற்று இயற்கையே மாறியது.",False
1001,நாளடைவில் உறக்கம் என்னை அணுகா தொழிந்தது.,False
1002,படுக்கையில் கிடந்து கிடந்து பார்ப்பேன்.,False
1003,என்னை மறந்து உறங்குவது அற்றுப்போயிற்று.,False
1004,அறிதுயில் மட்டும் ஒவ்வொரு போது வரும் போகும்.,False
1005,"உறங்காமை, தொடக்கத்தில் எனக்குத் தொல்லை விளைத்ததில்லை பின்னே விளைத்தது.",False
1006,"உறங்காமை, படிப் படியே எனது உடல்வளத்தைக் குலைத்தது அதனால் உள் ளுறுப்புக்கள் மெலிவுற்றன.",False
1007,அக்குலைவும் இம்மெலிவும் சீறிப் படையெடுத்து என் கண்களைத் தாக்கின.,False
1008,படலம் முதல்முதல் வலது கண்ணை மறைத்தது பின்னே இடது கண்ணையும் மறைத்தது.,False
1009,எனது நூல்களில் உடலோம்பற் குறிப்புக்கள் ஆங்காங்கே வெள்ளிடை மலையெனத் திகழும்.,False
1010,இந்நூலிலும் உடலோம்பலை யான் மறந்தேனில்லை அதை வலியுறுத்தியே இருக்கிறேன்.,False
1011,", ?",False
1012,என்னும் கேள்வி பிறத்தல் இயல்பு.,False
1013,இதற்கு என்ன விடையிறுப்பது?,False
1014,உட லோம்பல் மட்டும் பெரிதா?,False
1015,தொண்டு பெரிதா?,False
1016,இங்கே காந்தியடிகளுக்கும் கோபாலகிருஷ்ண கோகுலர்க்கும் ஒரு போது நடந்த உரையாடல் உள்ளத்தில் உறுகிறது.,False
1017,"செல்வக் குடியில் பிறவாத செல்வம் பெற்ற என் வாழ்க்கை, பலதிறத் தொண்டுகளால் நெருக்குண்டது.",False
1018,நெருக்கு இயற்கை வரம்பை யும் மீறச் செய்தது!.....,False
1019,பொதுமுறையில் சிகிச்சை துவங்கப்பட்டது.,False
1020,படுக்கை என் உடலைத் தன்வயப்படுத்தியது ஆனால் என் உள்ளத்தைத் தன் வயப்படுத்தவில்லை.,False
1021,படலமும் எனது புறக்கண்ணை மறைத்தது அகக்கண்ணை உள்ளொளியை மறைக்கவில்லை.,False
1022,இந்நிலை யில் சிந்தனாசக்தி பெருகுவதை யான் உணரலானேன்.,False
1023,படுக்கையில் எனது உள்ளம் வாளா கிடப்பதில்லை.,False
1024,உள்ளத்தில் திரளும் பலதிறக் கருத்துக்களில் சிலவற்றையாதல் வெளியிடுதல் நல்லதென்று எண்ணினேன்.,False
1025,முதலில் உரைநடை மீது எண்ணம் சென்றது.,False
1026,பின்னே அவ்வெண்ணம் குறள் வெண்பாமீது படர்ந்தது நிலைத்தது.,False
1027,"செய்யுள்யாப்பு, படுக்கை யில்கிடப்பவன் பொழுதுபோக்குக்கு நற்றுணை செய்யுமென்று குறள் வெண்பா அமைப்பைக் கொள்ளலானேன்.",False
1028,யான் எண் ணியவாறே எனது மானத உலகம் நிகழ்த்தியது.,False
1029,அவ்வப்போது சாது அச்சகப் பொறுப்பாளர் திரு.,False
1030,நாராயணசாமியை அழைப்பேன் உள்ளத்தில் உருக்கொண்ட வெண்பாக்களைச் சொல்வேன்.,False
1031,அவற்றை அவர் எழுதுவர்.,False
1032,இவ்வாறு படிப்படியே இந்நூல் அமைந்தது.,False
1033,நாராயணசாமிக்கு எனது நன்றி உரியதாக.,False
1034,எனது அருமைத் தமையனார் திரு.,False
1035,"உலகநாத முதலியார் பேர்த்திமார் செல்வி கற்பகவல்லிக்கும், செல்வி சிவ யோகவல்லிக்கும் பள்ளியில் வேனிற்கால விடுமுறை கிடைத்தது.",False
1036,அவ்விடுமுறை இந்நூலுக்குப் பயன்பட்டது.,False
1037,ஓய்வு நேரத்தில் இரு செல்வியரையும் கையெழுத்துப் பிரதியை மாறி மாறிப் படிக்குமாறு சொன்னேன்.,False
1038,அவ்வாறே அவர் ஒவ்வொரு போது பிரதியைப் படிப்பர்.,False
1039,வெண்பாக்களை உற்று உற்றுக் கேட்பேன்.,False
1040,அக்கேட்டல் எனது காதுகளைக் கண்களாக்கி யிருக்கும் என்றும் நினைந்தேன்.,False
1041,"சிற்சில இடங்களில் திருத்தல், கூட்டல், மாற்றல், கழித்தல் முதலியன விளம்புவேன்.",False
1042,அவை முறைமுறையே செல்விமாரால் ஏட்டில் ஆங்காங்கே குறிக்கப் பெறும்.,False
1043,மூலப் பிரதியைச் செவ்விய முறையில் பெயர்த்தெழுதி ஒருபடி எடுக்குமாறு செல்வி சிவயோகவல்லிக்கு விண்ணப்பம் செய்தேன்.,False
1044,அப்பணி செல்வியால் சிறப்புற ஆற்றப்பெற்றது.,False
1045,இரு வல்லியர்க்கும் எனது வாழ்த்து உரியதாக.,False
1046,நூலுக்கு எத்தலைப்பு வேயலாம் என்று சிந்தித்தேன்.,False
1047,"முதலில், முதுமை உளறல், காலக் குறள், கட்டில் காற்று முதலியன தோன்றின.",False
1048,அவற்றிடை இருளில் ஒளி என்று ஒன்று ஒலித்தது.,False
1049,அதையே தலைப்பாக வேய்ந்தேன்.,False
1050,புற இருளில் அகஒளியால் ஆக்கப்பெற்ற ஒரு நூலுக்கு இருளில் ஒளி என்னும் தலைப்புப் பொருந்தியதே சாலப் பொருந்தியதே.,False
1051,"அவ்வவ் வதிகாரத் தலைப்புக்கேற்ப, ஒல்லும்வகை, முறை முறையே கருத்துக்களை வெளியிட்டுள்ளேன்.",False
1052,"ஆனாலும் சிற்சில இடங்களில் ஒழுங்கின்மை, தொடர்பின்மை, கூறியது கூறல் முதலியன உற்றுள்ளதை உணரலானேன்.",False
1053,அவற்றைச் செம்மை செய்ய என் மனம் எழவில்லை ஒருப்படவுமில்லை.,False
1054,படுக்கையில் யான் உளறியவாறே நூல் உலவுதல் வேண்டுமென் பது எனது கருத்து.,False
1055,குறள் வெண்பாக்கள் பெரிதும் உரைநடை போல் அமைந்துள்ளன.,False
1056,அணிபெற வெண்பாக்களை யாத்தேனில்லை.,False
1057,இதைப் புலவர் உலகுக்குத் தெரிவித்துக்கொள்கிறேன்.,False
1058,முதல்முதல் எனது வலது கண்ணில் சிறு சிகிச்சை செய்யப்பட்டது பின்னே பெருஞ் சிகிச்சை செய்யப்பட்டது.,False
1059,எதிர்பார்த்த ஒளி வரவில்லை இன்னும் வரவில்லை.,False
1060,"மில்டன் நினைவும், சுந்தரர் நினைவும் அடிக்கடி தோன்றும்.",False
1061,எல்லாம் ஆண்டவன் செயல் என்று நெஞ்சம் ஆறுதல் அடையும்.,False
1062,"அவ னன்றி ஓரணுவும் அசையாது என்ற ஆன்றோர் மொழி, அவ்வப் போது எனக்குத் துணைபுரியும்.",False
1063,நள்ளிருளில் நட்டம் பயின்றாடு நாதனே என வரும் மணிவாசகத்தில் என் சிந்தை மூழ்கி மூழ்கி எழும்.,False
1064,இப்பொழுது இப்பிறவியிலேயே அக்கவலை செலுத்தல் இயலாமை நேர்ந்து விட்டது!,False
1065,என்னே உலகம்!,False
1066,என்னே வாழ்க்கை!,False
1067,அவ்விருப்பம் பேராசிரியர் டாக்டர் மு.,False
1068,வரதராசனாரிடம் அணைந்து நின்றது.,False
1069,அவரும் எனது விருப்பத்துக்கு இணங்கி னர் இணங்கிப் பலதிற வேலைச்சூழலிடை இந்நூலையும் பார்வையிட்டு உதவினர்.,False
1070,அவர்க்கு என்ன கைம்மாறு செலுத்த வல்லேன்?,False
1071,தேவைக்குமேல் பொருளீட்டாமை இந்நாளில் எங் கணும் பேசப்படுகிறது.,False
