Line Number,Sentence
1289,"இவ் வருமொழித் தகர நகரத் திரிபினை, னலமுன் றனவும் ணளமுன் டணவும் ஆகுந் தநக்கள் ஆயுங் காலே."
1290,நன்.
1291,என்பதனால் குறிப்பிட்டார் நன்னூலார்.
1292,இவற்றின் நிலைமொழித் திரிபினைத் தத்தம் ஈற்றுட் கூறுவர் தொல்காப்பியனார்.
1293,தொல்.
1294,இது முன்னிலை வினைச்சொல் வன்கணத்துக்கண் முடியுமாறு கூறுகின்றது.
1295,"உம் எறி கொற்றா, கொணா கொற்றா, உண் கொற்றா, தின் கொற்றா, சாத்தா, தேவா, பூதா இவை இயல்பு."
1296,"நட கொற்றா, நடக்கொற்றா, ஈர் கொற்றா, ஈர்க்கொற்றா, சாத்தா, தேவா, பூதா, இவை உறழ்ச்சி."
1297,ஈறு என்றமையின் வினைச் சொல்லே கொள்க என்பர் நச்சினார்க்கினியர்.
1298,அவ்விரண்டினையும் இச் சூத்திரத்து முன்னிலைக் கிளவியென ஆசிரியர் ஒன்றாக அடக்கினார்.
1299,"இச்சூத்திர விதியினை நன்னூலார், ஆவியரழ இறுதி முன்னிலை வினை ஏவல்முன் வல்லினம் இயல்பொடு விகற்பே."
1300,நன்.
1301,என்ற சூத்திரத்துட் கூறிப்போந்தார்.
1302,தொல்.
1303,இஃது எய்தியது விலக்குகின்றது.
1304,உயிரீ றாகிய உயர்திணைப் பெயரும் புள்ளி யிறுதி உயர்திணைப் பெயரும் எல்லா வழியும் இயல்பென மொழிப.
1305,தொல்.
1306,இஃது உயர்திணைப் பெயர் நான்கு கணத்துக் கண்ணும் இரு வழியும் முடியுமாறு கூறுகின்றது.
1307,"ஒருவேன் என நிறுத்தி, குறியேன் தீயேன் என இவ்வாறே ஒட்டித் தன்மைப் பெயர்க் கண்ணும் இயல்பாமாறு கொள்க."
1308,இவற்றுள் வன்கண மொழிந்தவற்றை ஞநமயவ என்பதனால் முடிப்பாருமுளர்.
1309,"உயர்திணைப் பெயரையும் விரவுப் பெயரையும் எடுத்தோதியே முடித்தல் ஆசிரியர் வழக்கமாதலின், இச்சூத்திரத்தில் அடக்குதலே பொருத்த முடையதாம்."
1310,அவற்றுள் இகர வீற்றுப் பெயர் திரிபிடனுடைத்தே.
1311,தொல்.
1312,இஃது உயர்திணைப் பெயருள் சிலவற்றிற்கு எய்தாது எய்துவித்தது.
1313,இள் முற்கூறிய உயர்திணைப் பெயர்களுள் இகர வீற்றுப் பெயர் இருவழியுந் திரிந்து முடியும் இடனுடைத்து என்றவாறு.
1314,உரையிற் கோடலால் இதனை மிக்க திரிபாகக் கொண் டனர் இளம்பூரணர்.
1315,இவ்வீற்று உயர்திணைப் பெயர்கள் எட்டிப்பூ.
1316,"காவிதிப்பூ, நம்பிப்பேறு என வேற்றுமையினும், நம்பிக் கொல்லன், நம்பிச் சான்றான், நம்பிப் பிள்ளை என அல்வழியினும் மிக்கன."
1317,"எட்டி, காவிதி என்பன தேய வழக்காகிய சிறப்புப்பெயர்கள் என்பர் நச்சினார்க்கினியர்."
1318,அஃறிணை விரவுப் பெயர் இயல்புமா ருளவே.
1319,தொல்.
1320,இது விரவுப் பொருள் இயல்பாய் முடிவனவும் உளவென்கின்றது.
1321,இள் உயர்திணைப் பெயரோடு அஃறிணை விரவிய விரவுப் பெயர் இயல்பாய் முடிவனவும் உள என்பதாம்.
1322,உம்மையான் இயல்பின்றி முடிவனவும் உள என்றவாறு.
1323,இம்மூன்று சூத்திர விதியினையும் நன்னூலார்.
1324,"பொதுப் பெயர் உயர்திணைப் பெயர்க ளீற்றுமெய் வலிவரின் இயல்பாம், ஆவி யரமுன் வன்மை மிகா, சில விகாரமாம் உயர்திணை."
1325,நன்.
1326,என ஒரு சூத்திரத்தாற் கூறினார்.
1327,.
1328,தொல்.
1329,இது மேல் உயிரீற்றிற்கும் புள்ளியீற்றிற்கும் வேற்றுமைக் கட் கூறும் முடிபு பெறாது நிற்கும் மூன்றாம் வேற்றுமைத் திரிபு கூறுகின்றது.
1330,அவற்றை மேலே வேற்றுமைப் பொருட் புணர்ச்சி சொல்லுமிடத்துப் போற்றியறிதல் வேண்டும் என்றவாறு.
1331,"உம் நாய் கோட்பட்டான், புலி கோட்பட்டான், சாரப் பட்டான், தீண்டப்பட்டான், இவை இயல்பு."
1332,"சூர்கோட் பட்டான், சூர்க்கோட்பட்டான், வளிகோட்பட்டான், வளிக் கோட்பட்டான் இவை உறழ்ச்சி."
1333,இவற்றுள் தம்மினாகிய தொழிற் சொல் பட்டான் என்பது.
1334,கோள் என்பது முதலாக இடைப் பிற வருவன தம் தொழிலாகும்.
1335,"இம் மூன்றாம் வேற்றுமைத் திரிபினை, நன்னூலார்."
1336,புள்ளியு முயிரு மாயிறு சொல்முன் தம்மினாகிய தொழின் மொழி வரினே வல்லினம் விகற்பமும் இயல்பு மாகும்.
1337,நன்.
1338,என்பதனாற் கூறினார்.
1339,தொல்.
1340,இஃது இரண்டாம் வேற்றுமைத் திரிபு கூறுகின்றது.
1341,"அன்னபிறவும் என்றதனால் கழிகுறைத்தான், பனை பிளந்தான் என இயல்பாதல் கொள்க."
1342,நன்.
1343,என்பதனால் இத்திரிபினைக் கூறினார் நன்னூலார்.
1344,தொல்.
1345,இஃது இகர ஐகார வீற்றுப்பெயர்க்கு அல்வழி முடிபு கூறுகின்றது.
1346,"உம் பருத்தி, குறிது, சிறிது, தீது, பெரிது இவை இயல்பு."
1347,"மாசித் திங்கள், சித்திரைத் திங்கள் அலிக்கொற்றன், புலைக் கொற்றன் இவை மிகுதி."
1348,"கிளி குறிது, கிளிக் குறிது, தினை குறிது, தினைக் குறிது இவை உறழ்ச்சி."
1349,இகர ஐகார வீற்று அவ்வழிக்கண் உண்டாம்.
1350,இம் மூவகை முடிபுகளையும்.
1351,அவ்வழி இஐம் முன்ன ராயின் இயல்பும் மிகலும் விகற்பமும் மாகும்.
1352,நன்.
1353,என்பதனாற் கூறினார் நன்னூலார்.
1354,தொல்.
1355,இஃது ஏழாம் வேற்றுமை இடப்பொருள் உணர்த்தி நின்ற ஐகார ஈற்று இடைச்சொன் முடிபு கூறுகின்றது.
1356,"உம் அதோளிக் கொண்டான், இதோளிக் கொண்டான், ஆண்டைக் கொண்டான், யாண்டைக் கொண்டான் இவை மிக்கன."
1357,"அவ்வழி கொண்டான் அவ்வழிக்கொண்டான், எவ்வழி கொண்டான், எவ்வழிக் கொண்டான், யாங்கவை கொண்டான், யாங்கவைக் கொண்டான் இவை உறழ்ந்தன."
1358,நெடியதன் முன்னர் ஒற்றுமெய் கெடுதலும் குறியதன் முன்னர்த் தன்னுரு பிரட்டலும் அறியத் தோன்றிய நெறியிய லென்ப.
1359,தொல்.
1360,"இது, புள்ளி மயங்கியலை நோக்கியதோர் நிலைமொழிக் கருவி கூறுகின்றது."
1361,"இங்ஙனம் நெடியதன் முன்னர் ஒற்றுக்கெடுவன ணகாரமும், னகாரமும், மகாரமும், லகாரமும், ளகாரமும் என ஐவகையாம் என்பர் நச்சினார்க்கினியர்."
1362,மண் அகல் மண்ணகல் பொன் அகல் பொன்னகல் எனக் குறியதன்முன்னர் ஒற்றுத் தன்னுருபு இரட்டின.
1363,அடுத்த சூத்திரத்து ஆறனுருபு முற்கூறியவதனான் ஒற்றிரட்டுதல் உயிர் முதன்மொழிக் கண்ணதென்பர் உரையா சிரியர்.
1364,"இக்கருத்தே பற்றி நன்னூலாரும், குறிலணை வில்லா ணனக்கள் வந்த நகரந் திரிந்துழி நண்ணுங் கேடே."
1365,நன்.
1366,நன்.
1367,எனவும் வரும் இரண்டு சூத்திரங்களான் விளங்க உரைத்தார்.
1368,இஃது உருபியலை நோக்கியதோர் நிலைமொழிக் கருவி கூறுகின்றது.
1369,"அறுவகைப்பட்ட மொழிகளாவன தாம், நாம், யாம், தான், யான், நீ என்பன."
1370,குவ்வின் அவ்வரும் நான்காறு இரட்டல என்பது நன்னூல்.
1371,நும்மெ னிறுதியும் அந்நிலை திரியாது.
1372,தொல்.
1373,இதுவும் அது.
1374,"உம் நுமது, நுமக்கு எனவரும்."
1375,உகரமொடு புணரும் புள்ளி யிறுதி யகரமும் உயிரும் வருவழி இயற்கை.
1376,தொல்.
1377,"இது, புள்ளி மயங்கியலை நோக்கியதோர் நிலை மொழிச் செய்கை கூறுகின்றது."
1378,"இள் உகரப் பேற்றொடு புணரும் புள்ளியீறுகள், யகரமும் உயிரும் வருமொழியாய் வருமிடத்து அவ்வுகரம் பெறாது இயல்பாய் முடியுமென்பதாம்."
1379,அவ்வீறுகளாவன பின் புள்ளி மயங்கியலுள் உகரம் பெறுமென்று விதிக்கும் பல ஈறுகளுமாம்.
1380,"உம் உரிஞ், யானா, அனந்தா, பொருந் யானா, அனந்தா எனவும் வரும்."
1381,தொல்.
1382,"இஃது அளவு, நிறை, எண்ணுப் பெயர்கள் தம்முள் புணருமாறு கூறுகின்றது."
1383,முந்தை முத்தையெனத் திரிந்து நின்றது.
1384,"உம் நாழியே யாழாக்கு, கலனே பதக்கு இவை அளவுப் பெயர்."
1385,"தொடியே கஃசு, கொள்ளே யையவி இவை நிறைப் பெயர்."
1386,"ஒன்றே கால், காலே காணி இவை எண்ணுப் பெயர்."
1387,அரையென வரூஉம் பால்வரை கிளவிக்குப் புரைவ தன்றாற் சாரியை இயற்கை.
1388,தொல்.
1389,இஃது எய்தியது விலக்கிற்று.
1390,"உம் உழக்கரை, தொடியரை, ஒன்றரை எனச் சாரியை பெறாது வந்தமை காண்க."
1391,குறையென் கிளவி முன்வரு காலை நிறையத் தோன்றும் வேற்றுமை இயற்கை.
1392,தொல்.
1393,இஃது எய்தியது விலக்கிப் பிறிது விதி கூறுகின்றது.
1394,"இள் குறையென்னுஞ் சொல், அளவு முதலியவற்றின் முன்வருங்காலத்து, மேல் வேற்றுமைப் பொருட் புணர்ச்சிக்குச் சொல்லும் இயல்பு நிறையத் தோன்றும்."
1395,வேற்றுமை யியற்கை யெனவே இவை வேற்றுமை யன்றென்பது நன்கு புலனாம்.
1396,"உம்உரிக்குறை, கலக்குறை, தொடிக்குறை, கொட்குறை, காணிக் குறை, காற் குறை என வரும்."
1397,குற்றிய லுகரக் கின்னே சாரியை.
1398,தொல்.
1399,"இது குற்றுகரவீற்று அளவுப் பெயர், நிறைப்பெயர், எண்ணுப் பெயர்கட்கு வேற்றுமை முடிபு விலக்கி இன் சாரியை வகுக்கின்றது."
1400,இள் குற்றியலுகர வீற்று அளவுப்பெயர் முதலியவற்றிற்கு வருஞ் சாரியை இன்சாரியையேயாம் என்றவாறு.
1401,"உம் உழக்கின் குறை, கழஞ்சின் குறை, ஒன்றின் குறை, என வரும்."
1402,அத்திடை வரூஉம் கலமென் னளவே.
1403,தொல்.
1404,இதுவுமது.
1405,இள் கலம் என்னும் அளவுப் பெயர் குறையொடு புணருமிடத்து இடையில் அத்துச் சாரியை வரப்பெறும் என்றவாறு.
1406,உம் கலம் அத்து குறை கலத்துக்குறை என வரும்.
1407,பனையென் அளவுங் காவென் நிறையும் நினையுங் காலை இன்னொடு சிவணும்.
1408,தொல்.
1409,இதுவுமது.
1410,இள் பனையென்னும் அளவுப் பெயரும் காவென்னும் நிறைப் பெயரும் குறையென்பதனொடு புணருமிடத்து ஆராயுங் காலத்து இன்சாரியையோடு பொருந்தும்.
1411,"உம் பனையின் குறை, காவின் குறை என வரும்."
1412,"நினையுங்காலை என்றதனால் பனைக்குறை, காக்குறை என இன்சாரியை பெறாது வல்லெழுத்து மிகுதலுங் கொள்க என்பர் உரையாசிரியர்."
1413,தொல்.
1414,இது முற்கூறிய மூன்றனுள் அளவுப் பெயர்க்கும் நிறைப் பெயர்க்கும் முதலாமெழுத்து இனைத் தென்கிறது.
1415,நிறைக்கு உகரமுதற் பெயர் காணப்படவில்லை.
1416,தொல்.
1417,இஃது இவ்வோத்தின் புறனடை.
1418,தொல்.
1419,இது மரூஉ முடிபு கூறுகின்றது.
1420,"உம் அவர் யார் எனவும், அது யாவது எனவும் வரும்."
1421,ஒன்றியவகரம் என்றதனால் இவ்வகரம் உயிர்மெய் என்பது இனிது புலனாம்.
1422,பயின்று என்றதனால் இச் சொற்கள் யாரவர்.
1423,யாவதது என வருமொழி நிலைமொழியாகிய ஈரிடத்தும் இம்மரூஉ முடிபினைப் பெறுமெனக் கொள்க.
1424,.
1425,உருபியல் வேற்றுமை உருபுகளோடு புணரும் இயல்பு உணர்த்தின மையின் இஃது உருபியல் என்னும் பெயர்த்தாயிற்று.
1426,தொல்.
1427,இஃது அகர ஆகார ஊகார ஏகார ஔகார வீறுகள் உருபினோடு புணருமாறு கூறுகின்றது.
1428,"உம் விளவினை, பலாவினை, கடுவினை, தழூஉவினை, சேவினை, வௌவினை எனவரும்."
1429,இவ்வாறே ஏனை யுருபு களையும் ஒட்டுக.
1430,பல்லவை நுதலிய அகர விறுபெயர் வற்றொடு சிவணல் எச்ச மின்றே.
1431,தொல்.
1432,இஃது எய்தியது விலக்கிப் பிறிதுவிதி வகுக்கின்றது.
1433,இள் பன்மைப் பொருளைக் கருதின பெயர்களின் இறுதி அகரம் வற்றுச் சாரியையோடு பொருந்துதலை ஒழிதல் இல்லை என்றவாறு.
1434,"உம் பலவற்றை, சிலவற்றை, உள்ளவற்றை, இல்லவற்றை எனவரும்."
1435,பல்லவை நுதலியவற்றின்கண் மூன்றாமுருபு சிலவற்றோடு என வற்றுப்பெற்றே முடியுமென்பர் நச்சினார்க்கினியர்.
1436,யாவென் வினாவும் ஆயியல் திரியாது.
1437,தொல்.
1438,இதுவுமது.
1439,"உம் யாவற்றை, யாவற்றொடு எனவரும்."
1440,சுட்டு முதலுகரம் அன்னோடு சிவணி ஒட்டிய மெய்யொழித் துகரங் கெடுமே.
1441,தொல்.
1442,இதுவுமது.
1443,"உம் அதனை, இதனை, உதனை எனவரும்."
1444,சுட்டுமுத லாகிய ஐயென் இறுதி வற்றொடு சிவணி நிற்றலும் உரித்தே.
1445,தொல்.
1446,இஃது ஐகார வீற்றுள் சிலவற்றுக்கு முடிபு கூறுகின்றது.
1447,இள் சுட்டெழுத்தினை முதலாகவுடைய ஐகார வீற்றுச் சொல்வற்றுச் சாரியையொடு பொருந்தி நிற்றலு முரித்து என்றவாறு.
1448,"உம் அவையற்றை, இவையற்றை, உவையற்றை என வரும்."
1449,இங்ஙனம் ஐகாரம் நிற்க வற்று வந்துழி வற்றின் வகாரம் கெட்டு முடிதல் வஃகான் மெய்கெட என்பதனால் கூறப்பட்டது.
1450,"நிற்றலும் உரித்தே என்ற உம்மையால், ஐகாரம் நில்லாது கெடுதலும் உரித்தென்பது பெறப்படும்."
1451,"ஐகாரம் கெட்டவழி நின்ற வகரத்தினை வற்றின்மிசை யொற்றென்று கெடுத்து, அவற்றை இவற்றை உவற்றை என முடிப்பர் உரையாசிரியர்."
1452,இங்ஙனம் ஐகாரமும் மெய்யும் கெட்ட சுட்டுப் பெயர்களை ஐயும் மெய்யும் கெட்ட விறுதி எழுத்து என்பர் ஆசிரியர்.
1453,சூத்திரம் யாவென் வினாவின் ஐயென் இறுதியும் ஆயியல் திரியாது என்மனார் புலவர் ஆவயின் வகரம் ஐயொடுங் கெடுமே.
1454,தொல்.
1455,இதுவுமது.
1456,"உம் யாவற்றை, யாவற்றொடு என வரும்."
1457,"உம் கரியவற்றை, செய்யவற்றை, நெடியவற்றை, குறியவற்றை எனவரும்."
1458,நீயென் ஒருபெயர் நெடுமுதல் குறுகும் ஆவயின் னகரம் ஒற்றாகும்மே.
1459,தொல்.
1460,இஃது ஈகார வீற்றுள் ஒருமொழிக்கு முடிபு கூறுகின்றது.
1461,"இள் நீயென்னும் ஒருபெயர் தன்மேல் நெடியதாகிய ஈகாரங் குறுகி இகரமாம், அவ்விடத்து னகரம் ஒற்றாய் வந்து நிற்கும்."
1462,"நீ யென்பதே பெயர் நின் என்பது அதன் திரிபென்பார், நீயென ஒரு பெயர் என்றார்."
1463,"உம் நின்னை, நின்னொடு, நினக்கு என வரும்."
1464,நன்.
1465,என்ற சூத்திரத்து நெடுமுதல் குறுகும் மொழிகளோடு சேர்த்துக் கூறினார் நன்னூலார்.
