Line Number,Sentence
1,உரைவேந்தர் தமிழ்த்தொகை பெருங்கதைச் சுருக்கம் ஆசிரியர் ஒளவை துரைசாமி இரா.,False
2,இளங்குமரன் பதிப்பாசிரியர்கள் முனைவர் ஒளவை நடராசன் முனைவர் இரா.,False
3,குமரவேலன் இனியமுது பதிப்பகம் சென்னை .,False
4,நூற்பெயர் உரைவேந்தர் தமிழ்த்தொகை ஆசிரியர் ஒளவை துரைசாமி இரா.,False
5,இளங்குமரன் பதிப்பாளர் இ.,False
6,"படிகள் நூலாக்கம் பாவாணர் கணினி தி.நகர், சென்னை .",False
7,அட்டை ஓவியம் ஓவியர் மருது அட்டை வடிவமைப்பு வ.,False
8,"மலர் அச்சிட்டோர் ஸ்ரீ வெங்கடேசுவரா ஆப்செட் பிரிண்டர்சு இராயப்பேட்டை, சென்னை .",False
9,"வெளியீடு இனியமுது பதிப்பகம் பி. குல்மொகர் குடியிருப்பு, செவாலிய சிவாசி கணேசன் சாலை, தியாகராயர் நகர், சென்னை .",False
10,பதிப்புரை ஒளவை சு.துரைசாமிப் பிள்ளை தமது ஓய்வறியா உழைப்பால் தமிழ் ஆய்வுக் களத்தில் உயர்ந்து நின்றவர்.,False
11,ஆம் நூற்றாண்டில் தமிழ் மறுமலர்ச்சிக்கு புத்துயிர் ஊட்டிய தமிழ்ச் சான்றோர்களுள் முன் வரிசையில் நிற்பவர்.,False
12,"நற்றிணை, புறநானூறு, ஐங்குறுநூறு, பதிற்றுப்பத்து ஆகிய சங்க நூற் செல்வங்களுக்கு உரைவளம் கண்டவர்.",False
13,சைவ பெருங்கடலில் மூழ்கித் திளைத்தவர்.,False
14,உரைவேந்தர் என்று தமிழுலகம் போற்றிப் புகழப்பட்ட ஒளவை சு.துரைசாமிப் பிள்ளை இல் பிறந்து இல் மறைந்தார்.,False
15,வாழ்ந்த ஆண்டுகள் .,False
16,எழுதிய நூல்கள் .,False
17,இதனை பொருள் வழிப் பிரித்து உரைவேந்தர் தமிழ்த்தொகை எனும் தலைப்பில் தொகுதிகளாக வெளி யிட்டுள்ளோம்.,False
18,இவருடைய நூல்களில் எம் கைக்குக் கிடைக்கப் பெறாத நூல்கள் .,False
19,மற்றும் இவர் எழுதிய திருவருட்பா நூல்களும் இத் தொகுதிகளில் இடம் பெறவில்லை.,False
20,துரைசாமி அவர்கள் என்று மூதறிஞர் வ.சுப.,False
21,அவர் காலத்தில் வாழ்ந்த சமகால அறிஞர்களால் போற்றிப் புகழப் பட்டவர்.,False
22,சைவ உலகில் தனக்கெனத் தனியிடத்தைப் பெற்றவர்.,False
23,இவர்கள் இத் தமிழ்த்தொகைக்கு தக்க மதிப்புரையும் அளித்து எங்களுக்குப் பெருமைச் சேர்த்து உள்ளனர்.,False
24,தமிழ் நூல் பதிப்பில் எங்களின் இந்த அரிய முயற்சிக்குத் தோள் தந்து உதவுங்கள்.,False
25,நன்றி பதிப்பாளர் பேருரை வரைந்த பெருந்தமிழ்க் கடல்!,False
26,வாக்கு நயங்காட்டிச் செவிக்குத்தேன் தந்த தாலே நக்கீரர்தான் தாங்கள் இந்த நாளில் கயன்மன்னர் தொழுதமொழி காத்ததனால் தொல் காப்பியர்தான்!,False
27,காப்பியர்தான் தாங்கள்!,False
28,எங்கும் தயங்காமல் சென்றுதமிழ் வளர்த்த தாலே தாங்கள்அவ்ஒளவைதான்!,False
29,"ஒளவை யேதான்! என்று புகழ்ந்ததோடு, அதியன்தான் இன்றில்லை இருந்தி ருந்தால் அடடாவோ ஈதென்ன விந்தை!",False
30,தூயசங்கத் தமிழ் நடையை எழுத்து வன்மையிலும் சொல்வன்மையிலும் ஒருங்கு பேணிய தனித் தமிழ்ப்பண்பு ஒளவையின் அறிவாண்மைக்குக் கட்டியங் கூறும்.,False
31,"எட்டுத் தொகையுள் ஐங்குறுநூறு, நற்றிணை, புறநானூறு, பதிற்றுப்பத்து என்ற நான்கு தொகை நூல்கட்கும் உரைவிளக்கம் செய்தார்.",False
32,இவ்வுரை விளக்கங்களில் வரலாற்றுக் குறிப்பும் கல்வெட்டுக் குறிப்பும் மண்டிக் கிடக்கின்றன.,False
33,ஐங்குறு நூற்றுச் செய்யுட்களை இந்நூற்றாண்டின் மரவியல் விலங்கியல் அறிவு தழுவி நுட்பமாக விளக்கிய உரைத்திறன் பக்கந்தோறும் பளிச்சிடக் காணலாம்.,False
34,"உரை எழுதுவதற்கு முன், ஏடுகள் தேடி மூலபாடம் தேர்ந்து தெரிந்து வரம்பு செய்துகோடல் இவர்தம் உரையொழுங்காகும்.",False
35,தமிழ் இலக்கிய வரலாற்றில் நான்கு சங்கத் தொகை நூல்கட்கு உரைகண்டவர் என்ற தனிப்பெருமையர் மூதறிஞர் ஒளவை துரைசாமி ஆவார்.,False
36,இதனால் உரைவேந்தர் என்னும் சிறப்புப் பெயரை மதுரை திருவள்ளுவர் கழகம் வழங்கிற்று.,False
37,"சிலப்பதிகாரம், மணிமேகலை, சீவகசிந்தாமணி, சூளாமணி, யசோதர காவியம் என்னும் ஐந்து காப்பியங்களின் இலக்கிய முத்துக்களை ஒளிவீசச் செய்தவர்.",False
38,உரைவேந்தர் உரை வரையும் முறை ஓரு தனிச்சிறப்பு வாய்ந்தது.,False
39,"இவ்வாறு பாட்டின் முன்னுரை அமைவதால், படிப்போர் உள்ளத்தில் அப்பாட்டைப் படித்து மகிழ வேண்டும் என்ற அவா எழுந்து தூண்டுகிறது.",False
40,பாட்டுக் களம் இனிது படிப்பதற்கேற்ற உரிய இடத்தில் சொற்களைப் பிரித்து அச்சிட்டிருப்பது இக்காலத்து ஒத்த முறையாகும்.,False
41,அதனால் இரண்டாயிரம் ஆண்டுகட்கு முன் தோன்றிய நற்றிணையின் அருமைப்பாடு ஓரளவு எளிமை எய்துகிறது.,False
42,"இலக்கணநூற் பெரும்பரப்பும் இலக்கியநூற் பெருங்கடலும் எல்லாம் ஆய்ந்து, கலக்கமறத் துறைபோகக் கற்றுணர்ந்த பெரும்புலமைக் கல்வி யாளர்!",False
43,"கலைப்பொலிவும், கருத்துத்தெளிவும், பொதுநோக்கும் பொலிந்த நம் உரைவேந்தர், வள்ளலாரின் திருவருட்பா முழுமைக்கும் பேருரைகண்ட பெருஞ் செல்வம்.",False
44,இஃது தமிழ்ப் பேழைக்குத் தாங்கொணா அருட்செல்வமாகும்.,False
45,"இனியமுது பதிப்பக உரிமையாளர், தமிழ்மண் பதிப்பகத்தின் உரிமையாளர் கோ.இளவழகனாரின் அருந்தவப்புதல்வி இ.தமிழமுது ஆவார்.",False
46,தமிழ்மண் பதிப்பகம் அவர்தம் நெஞ்சக் கனலுக்கு வழிகோலுவதாகும்.,False
47,இப் பதிப்புப் புதையலை பொற்குவியலை தமிழுலகம் இரு கையேந்தி வரவேற்கும் என்றே கருதுகிறோம்.,False
48,தமிழும் சைவமும் தம் இருகண்களாகக் கொண்டு இறுதிவரை செயற்பட்டவர்.,False
49,செந்தமிழ் அவர் எழுதட்டும் என்று காத்திருப்பதுபோல் அருவியெனக் கொட்டும்.,False
50,நினைவாற்றலில் வல்லவராதலால் எழுந்து சென்று வேறு நூல்களைப் பக்கம் புரட்டி பார்க்க வேண்டும் என்னும் நிலை அவருக்கிருந்ததில்லை.,False
51,எந்தெந்த நூல்களுக்குச் செம்மையான உரையில்லையோ அவற்றிற்கே உரையெழுதுவது என்னும் கொள்கை உடையவர் அவர்.,False
52,சைவ மாநாடுகளுக்குத் தலைமை தாங்கிச் சொற் பொழிவுகள் நிகழ்த்தினார்.,False
53,தம் உரைகள் பலவற்றைக் கட்டுரைகள் ஆக்கினார்.,False
54,"செந்தமிழ்ச் செல்வி, செந்தமிழ், குமரகுருபரன், சித்தாந்தம் முதலான பல இதழ்களுக்குக் கட்டுரைகளை வழங்கினார்.",False
55,"பெருந்தகைப் பெண்டிர், மதுரைக் குமரனார், ஒளவைத் தமிழ், பரணர் முதலான கட்டுரை நூல்களை எழுதினார்.",False
56,அவர் ஆராய்ச்சித் திறனுக்குச் சான்றாக விளங்கும் நூல் பண்டை நாளைச் சேரமன்னர் வரலாறு என்னும் ஆய்வு நூலாகும்.,False
57,அண்ணாமலைப் பல்கலைக் கழகத்தில் ஒளவை பணியாற்றியபோது ஆராய்ந்தெழுதிய சைவ சமய இலக்கிய வரலாறு அத்துறையில் இணையற்றதாக இன்றும் விளங்குகிறது.,False
58,சங்க நூல்களுக்கு ஒளவை வரைந்த உரை கற்றோர் அனைவருடைய நெஞ்சையும் கவர்ந்ததாகும்.,False
59,ஒவ்வொரு பாட்டையும் அலசி ஆராயும் பண்புடையவர் அவர்.,False
60,முன்னைய உரையாசிரியர்கள் பிழைபட்டிருப்பின் தயங்காது மறுப்புரை தருவர்.,False
61,தக்க பாட வேறுபாடுகளைத் தேர்ந்தெடுத்து மூலத்தைச் செம்மைப்படுத்துவதில் அவருக்கு இணையானவர் எவருமிலர்.,False
62,உழுதசால் வழியே உழும் இழுதை நெஞ்சினர் அல்லர்.,False
63,பெரும்பாலும் பழமைக்கு அமைதி காண்பார்.,False
64,அதே நேரத்தில் புதுமைக்கும் வழி செய்வார்.,False
65,"தமிழோடு ஆங்கிலம், வடமொழி, பாலி முதலானவற்றைக் கற்றுத் தேர்ந்தவர் அவர்.",False
66,எப்போதும் ஏதேனும் ஆங்கில நூலைப் படிக்கும் இயல்புடையவர் ஒளவை அவர்கள்.,False
67,"சமய நூல்களுக்கு உரையெழுதுங்கால் வடமொழி நூல்களிலிருந்து மேற்கோள் காட்டுவதும், கருத்துகளை விளக்குவதும் அவர் இயல்பு.",False
68,"அதுமட்டுமன்றி, ஒளவை அவர்கள் சட்டநூல் நுணுக்கங்களையும் கற்றறிந்த புலமைச் செல்வர்.",False
69,ஒளவை அவர்கள் கட்டுரை புனையும் வன்மை பெற்றவர்.,False
70,கலைபயில் தெளிவு அவர்பாலுண்டு.,False
71,நுண்மாண் நுழைபுலத்தோடு அவர் தீட்டிய கட்டுரைகள் எண்ணில.,False
72,ஒளவை நடை தனிநடை.,False
73,ஒளவை ஆற்றிய அருந்தமிழ்ப் பணிகளுள் தலையாயது பழந்தமிழ் நூல்களுக்கு அறிவார்ந்த உரைகளை வகுத்துத் தந்தமையே ஆகும்.,False
74,எதனையும் காய்தல் உவத்தலின்றி சீர்தூக்கிப் பார்க்கும் நடுநிலைப் போக்கு அவரிடம் ஊன்றியிருந்த ஒரு பண்பு.,False
75,அவர் உரை சிறந்தமைந்ததற்கான காரணம் இரண்டு.,False
76,"முதலாவது, வைணவ உரைகளில் காணப்பெற்ற பதசாரம் கூறும் முறை.",False
77,தாம் உரையெழுதிய அனைத்துப் பனுவல்களிலும் காணப்பெற்ற சொற்றொடர்களை இந்தப் பதசார முறையிலே அணுகி அரிய செய்திகளை அளித்துள்ளார்.,False
78,"இரண்டாவது, சட்ட நுணுக்கங்களைத் தெரிவிக்கும் நூல்களிலமைந்த ஆய்வுரைகளும் தீர்ப்புரைகளும் அவர்தம் தமிழ் ஆய்வுக்குத் துணை நின்ற திறம்.",False
79,ஜூரிஸ்புரூடன்ஸ் லா ஆஃப் டார்ட்ஸ் முதலானவை பற்றிய ஆங்கில நூல்களைத் தாம் படித்ததோடு என்னைப் போன்றவர்களையும் படிக்க வைத்தார்.,False
80,வடமொழித் தருக்கமும் வேறுபிற அளவை நூல்களும் பல்வகைச் சமய அறிவும் அவர் உரையின் செம்மைக்குத் துணை நின்றன.,False
81,இவற்றை அவர்தம் ஐங்குறுநூற்று விரிவுரை தெளிவுபடுத்தும்.,False
82,ஒளவை அவர்களின் நுட்ப உரைக்கு ஒரு சான்று காட்டலாம்.,False
83,பின்னத்தூரார் தம் உரையில் அவ்வாறே எழுதி இருந்தார்.,False
84,இந்தப் பாடலை இயற்றியவர் பாரதம் பாடிய பெருந்தேவனார்.,False
85,இவரே வேறு சில சங்கத்தொகை நூல்களுக்கும் கடவுள் வாழ்த்து இயற்றியவர்.,False
86,ஒளவை உரை அமைக்கும் பாங்கே தனித்தன்மையானது.,False
87,முதலில் பாடலைப் பாடிய ஆசிரியர் பெயர் பற்றியும் அவர்தம் ஊர்பற்றியும் விளக்கம் தருவர்.,False
88,தேவைப்பட்டால் கல்வெட்டு முதலானவற்றின் துணைகொண்டு பெயர்களைச் செம்மைப் படுத்துவர்.,False
89,தும்பி சொகினனார் இவர் ஆய்வால் தும்பைச் சொகினனார் ஆனார்.,False
90,நெடுங்கழுத்துப் பரணர் ஒளவையால் நெடுங்களத்துப் பரணர் என்றானார்.,False
91,பழைய மாற்பித்தியார் ஒளவை உரையில் மாரிப் பித்தியார் ஆக மாறினார்.,False
92,வெறிபாடிய காமக்கண்ணியார் ஒளவையின் கரம்பட்டுத் தூய்மையாகி வெறிபாடிய காமக்காணியார் ஆனார்.,False
93,இவ்வாறு எத்தனையோ சங்கப் பெயர்கள் இவரால் செம்மை அடைந்துள்ளன.,False
94,"அடுத்த நிலையில், பாடற் பின்னணிச் சூழலை நயம்பட உரையாடற் போக்கில் எழுதுவர்.",False
95,அதன் பின் பாடல் முழுதும் சீர்பிரித்துத் தரப்படும்.,False
96,"அடுத்து, பாடல் தொடர் களுக்குப் பதவுரைப் போக்கில் விளக்கம் அமையும்.",False
97,பின்னர் ஏதுக்களாலும் எடுத்துக் காட்டுகளாலும் சொற்றொடர்ப் பொருள்களை விளக்கி எழுதுவர்.,False
98,தேவைப்படும் இடங்களில் தக்க இலக்கணக் குறிப்புகளையும் மேற்கோள்களையும் தவறாது வழங்குவர்.,False
99,உள்ளுறைப் பொருள் ஏதேனும் பாடலில் இருக்குமானால் அவற்றைத் தெளிவு படுத்துவர்.,False
100,முன்பின் வரும் பாடல் தொடர்களை நன்காய்ந்து வினைமுடிபு தருவது அவர் வழக்கம்.,False
101,"இறுதியாகப் பாடலின்கண் அமைந்த மெய்ப்பாடு ஈதென்றும், பயன் ஈதென்றும் தெளிவுபடுத்துவர்.",False
102,ஒளவையின் உரைநுட்பத்திற்கு ஒரு சான்று.,False
103,பகைவர் புல் ஆர்க என்பது ஐங்குறுநூற்று நான்காம் பாடலில் வரும் ஒரு தொடர்.,False
104,மனிதர் புல் ஆர்தல் உண்டோ என்னும் வினா எழுகிறது.,False
105,"எனவே, உரையில் பகைவர் தம் பெருமிதம் இழந்து புல்லரிசிச் சோறுண்க என விளக்கம் தருவர்.",False
106,"இக்கருத்தே கொண்டு, சேனாவரையரும் புற்றின்றல் உயர்திணைக்கு இயைபின்று எனப்படாது என்றார் என மேற்கோள் காட்டுவர்.",False
107,மற்றொரு பாட்டில் முதலைப் போத்து முழுமீன் ஆரும் என வருகிறது.,False
108,"ஒளவை இளம்பூரணர், நச்சினார்க்கினியர் முதலான பழைய உரையாசிரியர் களையும் மறுக்கும் ஆற்றல் உடையவர்.",False
109,தன் பார்ப்புத் தின்னும் அன்பில் முதலை என்னும் பாடல் தலைவனையும் வாயில்களையும் இகழ்ந்து தலைவி கூறுவதாகும்.,False
110,"ஆனால், இதனைப் பேராசிரியரும், நச்சினார்க்கினியரும் தத்தம் தொல்காப்பிய உரைகளில் தோழி கூற்று என்று தெரிவித்துள்ளனர்.",False
111,ஒளவை இவற்றை நயம்பட மறுத்து விளக்கம் கூறித் தோழி கூற்றென்றல் நிரம்பாமை அறிக என்று தெளிவுறுத்துவர்.,False
112,ஒளவை ஒவ்வொரு நூலுக்கும் எழுதிய உரைகளின் மாண்புகளை எடுத்துரைப்பின் பெருநூலாக விரியும்.,False
113,தொகுத்துக் கூற விரும்பினாலோ எஞ்சி நிற்கும்.,False
114,கற்போர் தாமே விரும்பி நுகர்ந்து துய்ப்பின் உரைத் திறன்களைக் கண்டுணர்ந்து வியந்து நிற்பர் என்பது திண்ணம்.,False
115,இப்பதிப்பகத்தின் உரிமையாளர் செல்வி இ.தமிழமுது தமிழ்மண் பதிப்பகத்தின் உரிமையாளரின் மகள் ஆவார்.,False
116,வாழ்க அவர்தம் தமிழ்ப்பணி.,False
117,வளர்க அவர்தம் தமிழ்த்தொண்டு.,False
118,உலகெங்கும் மலர்க தமிழாட்சி.,False
