Line Number,Sentence
307,நாகரிகமிக்க இக்காலத்தே போர்க்களங்களில் அமைப்பது போன்ற முறையிற்றான் பழந்தமிழர்களிடையும் பாசறையின் அமைப்பு இருந்ததென்பது தெரிகின்றது.,False
308,"பாசறையின் வாயில் முகப்புயவன ஓவியரைக் கொண்டு ஓவியம் தீட்டப்பட்டும், பலநிறத்திரைச்சீலைக் குஞ்சங் களுடனும் அழகுபடுத்தும் வழக்கம் அக்காலத்திருந்தது.",False
309,பாசறையின் அரண்முறை இக்காலப் போர்ப்பாடி வீடுகளை ஒத்தது.,False
310,"ஆறு சூழ்ந்த காடு, பாடி வீட்டிற்குரிய இடமாகத் தேர்ந்தெடுக்கப்படுகிறது.",False
311,இவ்வியற்கை அரணுடன் நாற்புறமும் முள்வேலியை வளைத்து அரணமைக்கப்படுகிறது.,False
312,இற்றைக்காலப் போர்ப் பாசறைகளைக் கண்டவர்கள் முள்வேலி வளைவைக் கண்டிருப்பர்.,False
313,இவ்வழக்கம் தமிழ்ப் பெருமக்களிடையே அக்காலத்தே இருந்து வந்தது.,False
314,"பள்ளியறையில் ஊமையரைக் காவலாராக வைக்கும் வழக்கத்தால், போர் மர்மங்கள் வெளிச் செல்லாமல் தடுப்பது அக்காலத்தே கைக்கொள்ளப்பட்டிருந்தது என்பது தெளியலாம்.",False
315,.சொல்லோசை முத்தமிழ் வளர்ச்சி தமிழ் நாட்டில்தான் முதன் முதலில் மக்கள் தோன்றினர் என்பது அறிஞர் துணிபு.,False
316,மக்கள் கூடி வாழும் இயல்பினர்.,False
317,ஒருவர் கருத்தை மற்றவர்க்கு அறிவிக்கும் இன்றியமையாமை உடையவர்.,False
318,"முதலில் மக்கள் தமது உள்ளக்கருத்துக்களைக் கை, கால், உடல் ஆகியவற்றின் அசைவுகளால் வெளிப்படுத்தினர்.",False
319,இந்தச் சைகை மொழியே முதன் முதல் தோன்றிய இயற்கை மொழியாகும்.,False
320,உடலுறுப்புக்களின் அசைவுகளால் உள்ளக் கருத்தை அறியும் நிலையை மெய்ப்பாடு என்பர் தொல்காப்பியர்.,False
321,இத்தகைய ஒலியற்ற கூத்தியல் பைக் கூறும் தமிழே நாடகத் தமிழாகும்.,False
322,முத்தமிழில் முதலில் எழுந்தது நாடகத்தமிழே என்பது துணிவு.,False
323,உடலுறுப்புக்களின் அசைவால் உள்ளக் கருத்தை வெளியிடுங்கால் சிறிது சிறிதாக வாய் ஒலியும் அவ் வசைவு கட்குத் துணைபுரியத் தொடங்கின.,False
324,நாளடைவில் வாயொலிகளே கருத்து வெளியிடுதலாகிய தொழிலை நன்கு செய்தன ஆதலின் உடலசைவுகள் சிறிது சிறிதாகக் குறைந்தன.,False
325,இவ்வோசைகள் முதலில் பாட்டுவடிவைப் பெற்றிருந்தன என்பர் எபர்சன் முதலிய மொழியறிஞர்கள்.,False
326,இத்தகைய பாட்டுத் தமிழையே இசைத்தமிழ் என்றான் பண்டைத்தமிழ் மகன்.,False
327,"நீளமான ஓசைகளால், அதாவது, பாட்டுக்களால் கருத்தை வெளியிட்டு வந்த தமிழ் மக்கள், சிறிது சிறிதாக அவ்வோசைகளின் நீளத்தைக் குறைத்தனர்.",False
328,குறைத்துக் குறைத்துச் சொல் வடிவாகப் பண்ணினர்.,False
329,அத்தகைய குறுகிய ஒலிகளாகிய சொற்கள் பலவற்றைச் சேர்த்து நீண்ட சொற்றொடர்களாக்கினர் இச் சொற்றொடர்களால் தங்கள் கருத்தை வெளியிட்டனர்.,False
330,இத்தகைய சொற்றொடர்களாலாகிய செய்யுட்களே இயற்றமிழ் என வழங்கப் பெற்றன.,False
331,இயற்றமிழின் சிறப்பு முத்தமிழிலும் இறுதியில் தோன்றியது இயற்றமிழ் என்பது தெளிவு எனினும் இயற்றமிழில் ஏனையிரண்டு தமிழும் அடங்கும்.,False
332,இயற்றமிழ் இல்லாத இசை நாடகங்கள் இல்லை இசையும் நாடகமும் இயலையே அடிப்படையாகப் பெற்றிருக்கின்றன.,False
333,"நால்வகைப் பாவொலிகள் இயற்றமிழ்ப் பாக்கள் நான்கு வகைப்படும் வெண்பா, ஆசிரியப்பா, கலிப்பா, வஞ்சிப்பா என்பவையே அவை.",False
334,பா என்பது பரந்துபட்ட ஓசை.,False
335,"தூரத்திலிருந்து ஒருவன் பாடினால் அவன் பாடுவது இன்னபண், இன்னதிறம் என்று வேறுபடுத்தி அறிவதற்கு ஏற்ற பரந்துபட்ட ஓசையே பாவெனப்படும்.",False
336,இது நச்சினார்க்கினியர் கருத்து.,False
337,இந் நால்வகைப் பாக்களுக்கும் தனித்தனி ஓசை நலம் உண்டு.,False
338,ஓசை நலம் சொற்கள் ஒன்றோடொன்று சேரும் வகையால் உண்டாகும்.,False
339,எனவே சொல்லோசையே பாட்டோசை என்பது தெளிவு.,False
340,பேசுவதுபோலவே இப்பாட்டின் ஓசை அமைந்துள்ளது.,False
341,விநாயகரிடம் தான் ஒன்று செப்புவது போல் உள்ளது.,False
342,ஆதலின் இது செப்பலோசை.,False
343,இதுதான் வெண்பாவுக் குரிய ஓசை.,False
344,இப்பாடலைப் பாருங்கள்.,False
345,இஃது ஆசிரியப்பா.,False
346,தலைவி தன் தோழியை விளிக்கின்றாள் கூப்பிடுகின்றாள் அகவுகின்றாள்.,False
347,அகவுதல் என்றால் கூப்பிடுதல்.,False
348,கூப்பிட்டு அவளிடம் தன் கருத்தொன்றைச் சொல்லுகின்றாள்.,False
349,கூப்பிடுதல் போலவே இப்பாட்டின் ஓசை அமைந்துள்ளது அதனால் இதனை அகவலோசை என வழங்குவர்.,False
350,ஆசிரியப் பாவிற்குரியது அகவலோசை.,False
351,இப்பாட்டிலுள்ள ஒவ்வொரு சீரும் துள்ளித் துள்ளிச் செல்வதுபோல் ஒலிக்கின்றதல்லவா?,False
352,கன்றுக்குட்டி துள்ளுவது போல் சொற்கள் துள்ளுகின்றன.,False
353,"இதுதான் கலிப்பாவிற்குரிய ஓசை துள்ளலோசை, தூங்கலோசை.",False
354,தொடியுடைய தோண்மணந்தனன் கடிகாவிற் பூச்சூடினன் நறைகமழ் சாந்தநீவினன் செற்றோரை வழிதேய்த்தனன் நட்டோரை யுயர்வுகூறினன் .,False
355,ஆங்குச் செய்வகை யெல்லாஞ் செய்தன னாதலி னிடுக வொன்றோ சுடுக வொன்றோ படுவழிப் படுகவிவ் விகல்வெய்யோன் றலையே.,False
356,இச்செய்யுளின் ஓசை மெதுவாய் நடக்கிறது.,False
357,நடந்துகொண்டே சிலர் தூங்குவர் அல்லது தூங்கிக்கொண்டே நடப்பர்.,False
358,அதுபோல் உள்ளது இப்பாடலின் ஓசை அதனால் இது தூங்கலோசை.,False
359,வஞ்சிப்பாவிற்கு உரியது தூங்கலோசையே யாகும்.,False
360,"தூங்கல் என்பது தங்கித் தங்கிச் செல்லுதல், ஆதாவது, படிப்படியாகத் தாழ்ந்து செல்லும் ஓசை.",False
361,பேச்சிலும் ஓசை செய்யுளில் மட்டுமா ஓசை நடமாடுகிறது?,False
362,பேசும் பேச்சும் ஓசை பலவற்றைப் பெற்றிருத்தல் காணலாம்.,False
363,ஒருவர் வீட்டிற்கு அவர்தம் நண்பர் வந்தால் வாருங்கள் என்று அவர் அழைக்கிறார்.,False
364,இம்மூவகை ஒலியையும் உரை நடையில் மட்டுமா காண்கின்றோம்?,False
365,செய்யுளிலும் புலவர் இவ்வேறுபட்ட ஓசை நயங்களை அமைத்து உணர்ச்சி நயங்களை விளக்குவர்.,False
366,தாழ்ந்த குரலில்.,False
367,கண்களால் என இயம்புகின்றான் இது படுத்தல் என்னும் ஓசை நயம்.,False
368,கண்டனன் கற்பினுக் கணியைக் கண்களால் என்பது கம்பர் காட்டும் உணர்ச்சி ஓவியம்.,False
369,சொல்லோசைக்கான நல்வழிகள் சொற்களின் ஓசை நலத்தைச் சிறப்பிக்கப் பண்டைப் புலவர் கையாண்ட வழிகள் பலப்பலவாகும்.,False
370,செய்யுளின் இறுதிப்பகுதி ஒத்துவந்தாலும் அச்செய்யுளின் ஓசை இனிக்கும்.,False
371,"போதினிலே, காதினிலே, பேச்சினிலே, மூச்சினிலே இவை எவ்வளவு இனிமையாக ஒலிக்கின்றன?",False
372,இவ்வாறு இறுதிப் பகுதி ஒத்து ஒலித்துப் பயக்கும் இன்பமே இயைபு எனப்படும்.,False
373,இவ்வியைபின்பம் ஆங்கிலச் செய்யுட் களில் மிகுதி.,False
374,", என்னும் இறுதிப் பகுதிகள் தமிழ் கூறும் இயைபு என்னும் சொல்லின்பத்தைத் தருகின்றன அல்லவா?",False
375,"இப் பாடலைப் பாருங்கள் ஆனினம், மானினம், மீனினம்எவ்வளவு இனிமை?",False
376,இரண்டாம் எழுத்து முதலானவை ஒத்து வந்ததாலன்றோ இவ்வினிமை.,False
377,இந்த இன்பம்தான் எதுகை இன்பம் ஆகும்.,False
378,செய்யுளில் சில இடங்களில் ஓசை குறைந்திருக்கும்.,False
379,அங்குள்ள நெட்டெழுத்துக்களை மேலும் நீட்டி ஒலித்து இனிய இசையமைப்பர் நல்லிசைப் புலவர்கள்.,False
380,கெடுப்பதும் கெட்டார்க்குச் சார்வாய் மற்றாங்கே எடுப்பதும் எல்லாம் மழை கெடுப்பதும் எடுப்பதும் என்பன ஓசை குறைந்துள்ளன.,False
381,"இசையுணர்வு சான்ற வள்ளுவர் கெப்பதூஉம், எடுப்பதூஉம் என அங்குள்ள குறில்களை நெடிலாக்கி, மேலும் அவற்றை நீட்டி இனிய இசையமைக்கின்றார்.",False
382,இத்தகைய நீட்டத்தை அளபெடை என வழங்குவர்.,False
383,ஒருவகையான சொற்களே பன்முறை ஒரு செய்யுளில் அடுக்கி வருதலும் செவிக்கு ஓசையின்பம் பயக்கும்.,False
384,இதனை இரட்டைத்தொடை என்பர் யாப்பிலக்கணக்காரர்.,False
385,சொற்பின் வருநிலையணி என்பர் அணியிலக்கணக்காரர்.,False
386,சொல் நயமும் பொருள் நயமும் சொல்லோசையின் நயம் மட்டுமா பண்டைப் புலவர்தம் பாடல்களில் நாம் காண்கின்றோம்?,False
387,சொல் நயத்துடன் பொருள் நயமும் பின்னிப் பிணைந்து கூடி யியங்குவதை யல்லவா காண்கின்றோம்!,False
388,ஓசை செய்யுளின் உடல் பொருள் செய்யுளின் உயிர்.,False
389,"இழுமென் மொழியால் விழுமியது நுவலின் என்னும் தொல்காப்பியம் செய்யுளின் உடல், உயிர் கூறவந்ததல்லவா?",False
390,இழுமென்மொழி என்பது இனிய ஓசை.,False
391,இது செய்யுளின் உடல்.,False
392,விழுமியது என்பது சிறந்த பொருள்.,False
393,இது செய்யுளின் உயிர்.,False
394,இவ்விரண்டும் கூடியியங்குவதே சீரீய செய்யுளாகும்.,False
395,"இனிய கருத்துக்களை இனிய ஓசையிலும், இன்னாத கருத்துக்களை இன்னாத ஓசையிலும் புலப்படுத்தும் புலவர்களின் திறம் பாராட்டுதற் குரியதன்றோ?",False
396,உணர்வுகளைச் சுவையென்னும் பெயரால் அழைத்தான் பண்டைத்தமிழ் மகன்.,False
397,மக்கள் மனத்தில் எழும் உணர்வுகள் சுவைகள் பலப்பல.,False
398,அவற்றை எண் வகையுள் அடக்கிப் போந்தனர் நம் தமிழ்ப் புலவர்கள்.,False
399,"வீரம், நகை, உவகை, வியப்பு என்பன இனிய உணர்வுகள் அழுகை, இளிவரல், அச்சம், வெகுளி என்பன இன்னா உணர்வுகள்.",False
400,இவ்வுணர்வுகளை ஓவியத்தில் காட்டுதல் எளிது.,False
401,காவியத்தில் தீட்டுதல் அருமை யினும் அருமை.,False
402,சோழ வீரர் செல்லுகின்றனர்.,False
403,நாற்படைகளின் ஆரவாரம் யானைப் படைகளின் முழக்கம் குதிரைகளின் பேரொலி தேர்களின் மணியொலி வீரர்களின் வீர ஆரவாரம்.,False
404,இத்தகைய வீர உணர்வைப் பாட்டில் அமைக்கின்றார் பெரும் புலவர் சயங்கொண்டார்.,False
405,இதனைச் சொல்லியா தெரியவேண்டும்?,False
406,பாட்டே அறிவிக்கின்றதல்லவா?,False
407,இருவர் அன்பிற்கும் எல்லையில்லை.,False
408,இருவரும் மாறிப்புக்கு இதயம் எய்தினார்.,False
409,காதலின் பின் இருவரும் ஒருவரையொருவர் பாராட்டுகின்றனர்.,False
410,தலைவன் தலைவியை முன் பின் அறியான் அவளும் அப்படியே.,False
411,தலைவன் தாய்க்கும் தலைவி தாய்க்கும் எவ்வகை உறவுமில்லை.,False
412,தலைவன் தந்தையும் தலைவி தந்தையும் எவ்வகை முறையும் உடையாரல்லர்.,False
413,அவ்வாறிருக்கவும் இருவர் நெஞ்சமும் ஒன்று கலந்தன.,False
414,செந்நிலத்தில் பெய்த நீர் அந்நிறமாய் மாறி ஒன்றுபடும்.,False
415,அது போலவே இருவர் மனமும் ஒன்றுபட்டன.,False
416,இப்பாட்டில் காதற் பொருள் பொங்குகின்றது.,False
417,பொருள் மட்டுமா காதல்?,False
418,ஓசையுடன் படியுங்கள் ஓசையும் காதல் ஓசை வல்லெழுத்துக்கள் பெரும் பாலும் கலக்கவில்லை.,False
419,மெல்லினமும் இடையினமுமாகிய எழுத்துக்களைக் கொண்டே இப்பாடல் மென்மையாக இனிமையாக அமைந்து காதலாகிய உவகைச் சுவையை இசைக்கின்றது.,False
420,தாம்வீழ்வார் மென்றோள் துயிலின் இனிதுகொல் தாமரைக் கண்ணான் உலகு.,False
421,என்பது வள்ளுவர் காட்டும் காதற் சித்திரம்.,False
422,இதிலும் காதலுக்குரிய மெல்லோசையமைந்து பாட்டு இனிக்கிறது.,False
423,"இவரே சில இடங்களில், வல்லோசையமைத்து வெறுப் புணர்வைப் புலப்படுத்துதலையும் காண்கிறோம்.",False
424,எற்றிற் குரியர் கயவர்ஒன்றுற்றக்கால் விற்றற் குரியர் விரைந்து.,False
425,இப்பாட்டு வெறுப்புப்பாட்டு.,False
426,"கயவரை வெறுக்கும் இளிவரல் உணர்ச்சி பொருளால் மட்டுமன்றிச் சொல்லாலும், சொல் ஓசையாலும் வெளிப்படுத்து கின்றதல்லவா?",False
427,பொருளில் ஓசையைப் பிணைத்தல் எப்பொருளின் இயல்பையும் பாட்டில் அழகுறப் புலவர் கூறுவர்.,False
428,பொருளுடன் அதற்குரிய ஓசையைப் பிணைக்கும் புலவரியல்பு போற்றற்குரியது.,False
429,தலைவன் சில பெரியோர்களை அழைத்துக் கொண்டு தான் காதலித்த தலைவியை மணம் பேசச் செல்கின்றான்.,False
430,அவ்வியல்பைப் புலவர் கூறுகின்றார்.,False
431,நெறியறி செறிகுறி புரிதிரி பறியா அறிவனை முந்துறீஇந் தகைமிகு தொகைவகை யறியுஞ் சான்றவர் இனமாக சேய்உயர் வெற்பனும் வந்தனன்இனியே.,False
432,இப்பாடலைக் கவனியுங்கள்.,False
433,தமிழர் தம் நிலைகண்டு இரங்குகின்றார் ஒரு புலவர்.,False
434,"உணவில்லை, கதியில்லைஇத்துன்ப நிலைகள் யாவும் விரைவில் ஒழிய வேண்டும் என்று கருதுகின்றார்.",False
435,புலவர்கள் தாம் கருதியது முடிந்தது போலவே பாட்டில் அமைத்து விடுவார்கள்.,False
436,அவ்வியல்பில் இப்புலவரும் பாடுகின்றார்.,False
437,இலையே உணவிலையே கதிஇலையே எனும்எளிமை இனிமேலிலை எனவேமுர சறைவாய் முரசறைவாய்.,False
438,இதுதான் புரட்சிக் கவிஞர் பாரதிதாசன் பாட்டு.,False
439,இல்லை என்ற சொல் இரவலனும் வெறுக்கும் சொல்.,False
440,அவ் ஒலியே துன்பத்தை விளைப்பது.,False
441,துன்ப ஒலியை இன்ப ஒலியாக்கும் கவிஞர் இயல்பினை என்னென்பது!,False
442,அவளது ஆடல் கண்ணுக்கு இனிமை தருகின்றது.,False
443,அவளது மத்தள ஒலி காதுக்கு இனிமை தருகின்றது.,False
