Line Number,Sentence
686,இக் கந்தங்களுள் எதுவும் உயிரன்று என்பது எம்முடைய பிடகநூல்களில் மறித்தும் மறித்தும் வற்புறுத்தப்படுகின்றது.,False
687,உடம்பும் ஏனைப் பொருள்களும் இடையறாது மாறிக்கொண்டே யிருக்கின்றன.,False
688,முற் கணத்திருந்த அதே ஆண்மகன் பிற்கணத்து உள்ளவன் அல்லன் அவனிடத்தில் என்றும் நிலைபேறாய் உள்ளது எதுவும் இல்லை.,False
689,இவ்வைவகைக் கந்தங்களும் ஒருங்கு தொக்கவழி யான் ஒருவன் உளன் என்னும் உணர்ச்சி தோன்றா நிற்கின்றது.,False
690,இவ்வைந்துங் கூடிய தொகை அழிந்தவழி யான் உளன் என்னும் உணர்வும் அழியா நிற்கும்.,False
691,விஞ்ஞான கந்தமாவது ஐம்பொறிகளையும் மனத்தையும் பற்றி நிகழும் ஆறறிவுகளாம் என்று இவ்வாறு உணர்ந்து கொண்மின்!,False
692,என்று விடை கூறினார்.,False
693,இனிக் கணங்கடோறுந் தோன்றும் நிகழ் காலவறிவும் நிலைபேறின்றி மாய்ந்தொழிதலின் அவ்வறிவு நிகழ்ச்சியாற் போந்த பயனும் ஒன்றும் இன்றாம்.,False
694,ஓருயிர்க்கு வந்த துன்பத்தை நீக்கலுறுவோன் தான் அத்துன்பத்திற் பற்றப்படாதவனாய் இருந்தாலன்றி அத்துன்பத்தை நீக்க மாட்டுவான் அல்லன்.,False
695,"அதுவேயுமன்றி, நும் முனிவன் நரியும் புலியும் அரிமாவுமாகப் பிறந்தவழி வேறு மெல்விலங்குகளைக் கொன்று தின்றானாதல் வேண்டுமன்றோ?",False
696,அதனாலும் அவன் இரக்க முடையானென்றலுஞ் செல்லாது கொலை முதலியன கடிந்தானென்றலுஞ் செல்லாதென்றுணர்ந்துகொள்க.,False
697,"இனி, நும் புத்தமுனிவன் வழுவில்லாத பிடகநூல்களை அருளிச்செய்தனன் என்றலும் ஆகாது.",False
698,"மேலும், ஐவகைக் கந்தங்களையன்றி வேறு உயிர் இல்லையாயின், ஒருவன் விழித்திருக்கையிலும் உறங்குகையிலும் அவன் ஒரு படித்தான வுணர்வுடையனாதல் வேண்டும்.",False
699,"அவ்வாறன்றி விழித்திருக்கையிற் பாம்பைக் கண்டாலும் அஞ்சுமவன், உறங்குகையில் அஃது அவன் மேல் ஏறிச் சென்றாலும் அதனையவன் உணராதிருத்தல் என்னை?",False
700,விழிப்பினும் உறக்கத்தினும் அவ் வைவகைக் கந்தங்களும் உளவல்லோ?,False
701,"அல்லாக்கால், ஒரு சிலர் வேறு பலரினும் மிக்க நினைவுடையராய்க் கழிந்தகால நிகழ்ச்சிகளை யெல்லாம் நன்கு நினைவுகூர்தல் ஆகாது.",False
702,"இனி, மக்களல்லாத சிற்றுயிர்களும் தொடர்புபட்ட வுணர்வுடைமையினாலேதான் தத்தம் வாழ்நாள் எல்லை யளவும் உயிர்வாழ்கின்றன.",False
703,பறவைகள் தாம் முட்டையிடுங் காலம் வந்ததுணை யானே பலநாட்களும் முயன்று கூடுகள் கட்டுகின்றன.,False
704,அதுகிடக்க உடம்பும் உலகமும் ஆகிய கருவிகளை உயிரின்கட் கூட்டுதற்குச் சிவம் என்று ஒரு கடவுள் வேண்டிற்றென்னை?,False
705,"அற்றேல், நீர் கூறும் அவ் விறைவற்குரிய இலக்கணந்தான் என்னை?",False
706,"என்று அப் புத்த முனிவன் வினாவ, அடிகள் அருளிச் செய்வார்.",False
707,"சைவ சமயக் கோட்பாடுகளை விளக்கல் எம்மிறைவன் எண்ணிறந்த உயிர்கட்கு உடம்புகளைத் தந்து, அவை தம்மை எண்ணிறந்த உலகங்களில் வைத்து,.",False
708,நள்ளுங் கீழுளும் மேலுளும் யாவுளும் எள்ளும் எண்ணெயும் போல்நின்ற எந்தையே.,False
709,இருளை வெளியே இகபர மாகி இருந்தவனே.,False
710,"நீத்தல் விண்ணப்பம், ஈசனேநீ யல்ல தில்லை இங்கும் அங்கும் என்பதும் பேசி னேன்ஓர் பேத மின்மை.",False
711,"திருச்சதகம், பித்தனே எல்லா வுயிருமாய்த் தழைத்துப் பிழைத்து அவை அல்லையாய் நிற்கும்.",False
712,"எத்தனே பிடித்தபத்து, வான்கெட்டு மாருதம் மாய்ந்து அழல்நீர் மண்கெடினுந் தான்கெட்ட லின்றிச் சலிப்பு அறியாத் தன்மையனுக்கு.",False
713,"இங்ஙன மல்லாக்கால், ஆணும் பெண்ணுமாய் நின்று நடைபெறும் இவ்வுலகத்தின் இயல்பு வேறு எவ்வாற்றானும் விளங்கா தென்றறிக.",False
714,"திருப்பள்ளியெழுச்சி, அண்ணல் தன் ஒருபால் அவள் அத்தனாம் மகனாம்.",False
715,"திருச்சிற்றம்பலக்கோவையார், யாவையும் ஆம் ஏகத்து ஒருவன்.",False
716,"எனவே, அவற்கு அருவம் உருவம் என்னும் இருவகைத் திருமேனியும் உளவாம்.",False
717,யாவராயினும் அன்பரன்றி அறியொணாமலர்ச் சோதியான்.,False
718,"சென்னிப்பத்து, மூவரும் முப்பத்து மூவரும் மற்றொழிந்த தேவருங் காணாச் சிவபெருமான்.",False
719,"திருத்தெள்ளேணம், பத்தி வலையிற் படுவோன் காண்க.",False
720,"திருவண்டப்பகுதி, அருவாய் உருவமும் ஆனபிரான்.",False
721,"திருத்தெள்ளேணம், உருமூன்று மாகி உணர்வரிதாம் ஒருவனுமே.",False
722,"திருப்பூவல்லி, செந்தழல்புரை திருமேனியுங் காட்டி.",False
723,"திருப்பள்ளி யெழுச்சி, தொண்டனேற்கு உள்ளவா வந்து தோன்றினாய் கண்டுங் கண்டிலேன் என்னகண் மாயமே.",False
724,"திருச்சதகம், மற்றும் யாவர்க்குந் தந்தையாய் தம்பிரான் தனக்கு அஃது இலான்.",False
725,இன்னும் ஆண்டன்மைக்கு அடையாளமான கடுந்தன்மையுடைய தீ சிவந்த நிறம் உடையதாதல் பற்றியே ஆண் உருவினனாகிய சிவபிரானுக்குச் சிவந்த திருமேனியும்.,False
726,சுடர்கின்ற கோலம் தீயேயென மன்னுசிற்றம் பலவர்.,False
727,"திருச்சிற்றம்பலக் கோவையார், செந்தழல்புரை திருமேனியுங்காட்டி திருப்பள்ளி யெழுச்சி, எமக்கு வெளிப் படா யென்ன வியன்தழல் வெளிப்பட்ட எந்தாய்.",False
728,"அருட்பத்து, சோதியாய்த் தோன்றும் உருவமே அருவாம் ஒருவனே.",False
729,"கோயிற்றிருப்பதிகம், அரத்தமேனியாய்.",False
730,"திருச்சாழல், மூலமாகிய மும்மலம் அறுக்கும்.",False
731,"கீர்த்தித்திருவகவல், உள்ளமலம் மூன்றும் மாய.",False
732,"பண்டாய நான்மறை, செம்மைநல மறியாத சிதடரொடுந் திரிவேனை மும்மைமலம் அறுவித்து.",False
733,"அச்சோப் பதிகம், நீறு இட்ட அன்பரோடு.",False
734,"திருச்சதகம், திருநீற்றை யுத்தூளித் தொளி மிளிரும் வெண்மையனே.",False
735,"நீத்தல் விண்ணப்பம், செம்மேனி யான் வெண்ணீற் றான்.",False
736,"திருவம்மானை, தோள் உலாம் நீற்றன் ஏற்றன்.",False
737,"அச்சப்பத்து, ஏறு உடையான்.",False
738,"திருப்படையாட்சி, கோமான் நின் திருக்கோயில் தூகேன் மெழுகேன்.",False
739,"இதுவே வீடுபேறாம் இப்பேற்றை எய்தினார்க்கு மீளப் பிறவி உண்டாகாது, எஞ்ஞான்றும் ஒரு பெற்றித்தாம் அழியாப் பேரின்பமே உளதாம்.",False
740,"வல்வினையேன் றன்னை, மறைந்திட மூடிய மாயஇருளை.",False
741,"சிவபுராணம், , கழிவில் கருணையைக் காட்டிக் கடியவினை யகற்றிப் பழமலம் பற்றறுத் தாண்டவன்.",False
742,"திருச்சதகம், நின் மலர்கொள் தாளிணை வேறிலாப் பதப்பரிசு பெற்றநின் மெய்ம்மையன்பர் உன்மெய்ம்மை மேவினார்.",False
743,"திருவம்மானை, புகுவதாவதும் போதரவு இல்லதும்.",False
744,"திருச்சதகம், பேராவுலகம் புக்கார் அடியார்.",False
745,"திருச்சதகம், என்னையுந் தன் இன்னருளால் இப்பிறவி யாட்கொண்டு இனிப் பிறவாமே காத்து.",False
746,"திருவம்மானை, பேதைகுணம் பிறருருவம் யான்என தென் உரை மாய்த்துக் கோதுஇல் அமுதானானை, கண்டபத்து, நாம் ஒழிந்து சிவமான வாபாடி.",False
747,"திருத்தெள்ளேணம், பேரா ஒழியாப் பிரிவில்லா மறவா நினையா அளவிலா மாளா இன்ப மாகடலே.",False
748,மும்மல வயப்பட்ட சிற்றயிர்களாகிய அவரெல்லாந் தவத்தால் எம்மிறைவனருளைப் பெற்றுத் தேவராயினர்.,False
749,"அதனால், எம் முன்னோரும் யாமும் எம்மனோரும் அச்சிவமாகிய முழுமுதற் கடவுளையன்றி வேறொன்றனைத் தெய்வமாகக் கனவிலும் நினையேம்.",False
750,"ஆகவே, எல்லா வுயிர்களும் தத்தம் உடம்புகளில் இருந்து உயிர்வாழ்தற்கு ஏற்ற உதவிகளை எம்மாலியன்ற வரையிற் செய்யக் கடமைப்பட்டிருக்கின்றோம்.",False
751,இவ்வசைவு அவ்வுடம்புகளிலிருந்து பலவகை முயற்சிகளைப் புரியும் உயிர்கள் தம்மால் நடத்தப்படுவதன்று.,False
752,இங்ஙனம் எம்மிறைவன் இயற்றும் அருட்கூத்து உயிர்கள் உய்தற் பொருட்டேயன்றித் தன் பொருட்டு அன் றென்பதூஉம் உணரற்பாற்று.,False
753,இவையே எமது சைவசமய வுண்மையென்று அறிவிராக!,False
754,உருகுதலைச் சென்ற உள்ளத்தும் அம்பலத்தும் ஒளியே பெருகுதலைச் சென்று நின்றேன்.,False
755,"கண்டபத்து, நள்ளிருளின் நட்டம் பயின்றாடு நாதனே தில்லையுட் கூத்தனே.",False
756,"சிவபுராணம், .",False
757,"புத்தகுரு தோற்றபின் நிகழ்ந்தவை இவ்வளவிற் புத்தகுருவுக்கும் திருவாதவூரடிகட்கும் நடந்த எதிர்முக வழக்கு முடிந்தது,.",False
758,"எல்லாம் வல்ல சிவபிரான் திருவருள் வழிநின்று அடிகள் பணித்தபடியே, அப்புத்தகுரு பேசும் வலியிழந்து ஊமை ஆயினார்.",False
759,"அப்பொழுது, அப் புத்தகுரு வினோடு உடன் போந்த இலங்கை மன்னன் எழுந்துநின்று அடிகளை வணங்கிப், பெருமானே!",False
760,என்று பணித்தருளினார்.,False
761,"அங்ஙனம் அடிகள் பணித்தவளவிலே, அவ்வரசன் புதல்வி பிறவி முதற் றனக்கிருந்த ஊமைநீங்கிப், பேசும் ஆற்றலும் பேரறிவும் வரப்பெற்றாள்.",False
762,அவர் நிகழ்த்திய அவ்வினாக்கட் கெல்லாம் அந் நங்கையார் மிகவும் பொருத்தமான விடை களைப் பேரறிவோடும் எடுத்துக் கூறினார்.,False
763,"என்று குறையிரக்க, அடிகள் உளம் இரங்கி அவற்குத் திறுநீறு அளித்து அவனைச் சிவபிரான் திருவடிக்கு ஆளாக்கினார்.",False
764,"அரசன் அவ்வாறானபின், அப் புத்தகுருவின் மாணாக்கரும் அடிகளை வணங்கித் திருநீறு பெற்றுச் சைவசமயந் தழீஇயினார்.",False
765,அது நிற்க.,False
766,"ஒருநாள் அவர் அங்ஙனம் உலவுகையில், ஆழ்ந்த நினைவுடையராய் எது மெய்யான வழி?",False
767,என்று தமக்குள் உசாவலாயினர்.,False
768,"அவ்விருவருந் தாந்தாம் அறிந்த பார்ப்பன மறை ஆசிரியரை மேற் கோளாகக் காட்டி உரையாடியும், ஒருவர்க்கும் உறுதி பிறக்கவில்லை.",False
769,"ஆகவே, வாசெட்டன் மற்றவனை நோக்கிக் கூறுவான் பாரத்துவாச!",False
770,சாக்கியகுலத்திற் பிறந்த சமண கோதமர் என்பார் அக்குலத்தை நீங்கிப் போய்த் துற வொழுக்கம் பூண்டார்.,False
771,அவர் இப்போது மன சாகடத்திற்குத் தெற்கே யாற்றங்கரையில் உள்ள மாந்தோப்பில் வந்து தங்கியிருக்கின்றார்.,False
772,மாட்சிமை தங்கிய அக்கோதமரைப்பற்றி எங்கும் பெரும்புகழ் பரம்பியிருக்கின்றது.,False
773,"ஆதலாற், பாரத்துவாச!",False
774,அங்ஙனமே அவர்கள் அவர்பாற் சென்று தமக்கு நேர்ந்த இடர்ப்பாட்டை அறிவிக்கலாயினர்.,False
775,வாசெட்டன் உரைப்பான் கோதமரே!,False
776,இவையெல்லாம் வீடு பயக்கும் வழிகளா?,False
777,"அவை, தம்முட் கூறியபடி ஒழுகுபவனைப் பிரமத்தோடு ஒன்று கூட்டும் வழிகள் தாமா?",False
778,அவை யெல்லாந் தவறாமற் செலுத்து மென்று நீ சொல்லுகின்றனையா?,False
779,என்று கோதமர் வினாயினார்.,False
780,யான் அங்ஙனந்தான் சொல்கின்றேன்.,False
781,"அங்ஙனமாயின், வாசெட்ட!",False
782,இல்லை என்று இவை யெல்லாவற்றிற்கும் வாசெட்டன் விடைகூறினான்.,False
783,"நல்லது, வாசெட்ட!",False
784,அங்ஙனஞ் சொல்லவில்லை.,False
785,"அங்ஙனமாயின், வாசெட்டனே!",False
786,ஏழு தலைமுறை வரையில் ஒரு பார்ப்பனனாவது பிரமத்தை நேருக்கு நேர் என்றுங் கண்டதில்லையென நீயே சொல்லுகின்றனை.,False
787,எங்கே செல்லுகிறதெனத் தாம் பார்த்ததாகவாதல் அறிந்ததாகவாதல் கூறவில்லை என்கின்றாய்.,False
788,", , , , !",False
789,என்று உண்மையைச் சொல்லிவிட்டார்கள்.,False
790,மூன்று வேதங்களிலும் வல்லுநராயினும் பார்ப்பனர் கூறும் உரைகளுங் குருட்டு உரைகளாகவே இருக்கின்றன.,False
791,"முன்னோரும் அதனைக் காணவில்லை, அவர்தம் ஆசிரியரும் அதனைக் காணவில்லை, அவர்தம் மாணாக்கருங் காணவில்லை.",False
792,அவ்வாற்றவன் ஒத்துக்கொண்ட பின் கௌதமர் பின்னும் அவனை உசாவுவார் வாசெட்டனே!,False
793,"என்று வினாவ, அவன் அதற்கு இல்லை என்றுரைப்ப, மேலும் அக்குடிமக்கள் அவனை நோக்கி, நல்லது இனிய நேசனே!",False
794,", , , , , ?",False
795,நீ அறியாத அல்லது காணாத அந் நங்கையையோ நீ காதலிப்பதூஉம் விழைவதூஉம்?,False
796,"என்று வினாவ, அதற்கும் அவன் இல்லை என்று விடுப்பனாயின், வாசெட்டனே நீ யாது நினைக்கின்றாய்?",False
797,அத்தகைய அவ்வாண்மகனது உரை அறிவற்ற மடவோனது உரையென்று முடிக்கப்படுமன்றோ?,False
798,"உண்மையாகவே அஃது அப்படித்தான் ஆகும், என்று வாசெட்டன் விடை நவின்றான்.",False
799,"அதன்பிற் கௌதமர் வேறோர் உவமையும் எடுத்துக் காட்டும் தொடுத்துக்காட்டி மேலுங் கூறுவார் மறுபடியும், வாசெட்டனே!",False
800,"திண்ணமாய் வராது, கோதமரே!",False
801,"அங்ஙனமே, வாசெட்ட!",False
802,என்று கூறுகின்றார்கள்.,False
803,"உண்மையாகவே உண்டாதல் இல்லை, கோதமரே!",False
804,"அங்ஙனமாயின், வாசெட்ட!",False
805,"இந்தப் பார்ப்பனர் தமது வேதவுணர்ச்சியில் நம்பிக்கையுடையராய் அமர்ந்திருக்கை யிலேயே, அவர்கள் மெய்யாகவே சேற்றுள் அமிழ்ந்திப் போகிறார்கள்.",False
806,"அவ்வாறு அமிழ்ந்தியும், தாம் ஏதோ ஓர் இன்ப வுலகத்திற்குச் செல்வதாக நினைந்து, இறுதியில் மனத்தளர்ச்சி அடைகின்றார்கள்.",False
807,ஆதலினாற்றான் வேதங்களில் வல்ல அப் பார்ப்பனரின் மூவகைப்பட்ட உணர்ச்சியானது நீர் அற்ற பாலை நிலம் என்று சொல்லப்படுகின்றது.,False
