Line Number,Sentence
1516,முதல் வரையில் அரசாண்டார்.
1517,எனவே ஆம் நூற்றாண்டின் முற்பகுதியில் இந்நூல் இயற்றப் பட்டது.
1518,"மஞ்சரிப்பா, புறத்திணையும் அகத்திணையும் விரவி வந்த செய்யுள்களைக் கொண்டது என்பர்."
1519,இந்நூல் இப்போது கிடைக்கவில்லை.
1520,.
1521,மல்லிநாதர் புராணம் இது ஒரு சமண சமய நூல்.
1522,"மேற்கோள் காட்டப் பட்ட செய்யுட் பகுதிகளை இங்குக் காட்டுவதற்கு முன்பு, மல்லிநாதர் என்னும் தீர்த்தங்கரருடைய கதையை அறிந்துகொள்ளுவது அமைவுடைத்து."
1523,"அந்த அரசன், கார்காலத்தில் ஒரு நாள் வனக் காட்சியைக் காணச் சென்றான்."
1524,வனத்திலே மிகப் பெரியதோர் ஆலமரத்தினைக் கண்டு வியந்து மகிழ்ந்தான்.
1525,"சில காலத்திற்குப் பின்னர், அரசன் அவ்வழியாக வந்தபோது, அந்த ஆலமரம் அங்குக் காணப்படவில்லை."
1526,இடி விழுந்து இருந்த இடம் தெரியாமல் மறைந்துவிட்டது.
1527,இதனைக் கண்ட அரசன் மனம் துணுக்குற்றது.
1528,அப்போது அரசனுடைய மனத்திலே நிலையாமை நன்கு விளங்கியது.
1529,"இதுபோலவே தனது வாழ்க்கையும் அரசபதவியும் நிலையற்றன என்பதையும், இளமையும் யாக்கையும் செல்வமும் நிலையற்றவை என்பதையும் உணர்ந்தான்."
1530,"அப்போதே அரசாட்சியைத் துறந்து, துறவு பூண்டு ஸ்ரீதர முனிவரிடத்தில் தீக்கை பெற்று, தவம் செய்து கடைசியில் இந்திரபதவியடைந்தான்."
1531,"இந்திர பதவியை யடைந்த அரசன், பிறகு மண்ணுலகத்திலே வங்க நாட்டு மிதிலாபுரத்தின் அரசனான கும்பன் என்வனுக்கு மகனாய்ப் பிறந்தான்."
1532,இந்த மல்லிநாதர் சரிதையை அடிப்படையாகக் கொண்ட ஒரு நூல் முற்காலத்தில் செய்யுளாக இயற்றப்பட்டிருந்தது.
1533,அந்த நூலுக்கு என்ன பெயர் இருந்தது என்பது தெரியவில்லை.
1534,மல்லி நாதர் புராணம் என்னும் பெயரே இருந்திருக்கக்கூடும்.
1535,அந்நூல் இப்போது மறைந்து விட்டது.
1536,அந்நூலிலிருந்து இரண்டு செய்யுட் பகுதிகள் ஸ்ரீபுராணத்தில் மேற்கோள் காட்டப்பட்டுள்ளன என்று கூறினோம்.
1537,இது அகவற்பாவாலான நூல் எனத் தோன்றுகிறது.
1538,இந்நூலைப் பற்றி வேறு செய்திகள் தெரியவில்லை.
1539,.
1540,மாடலம் இப்பெயரையுடைய நூல் ஒன்றிருந்தது என்பது தக்கயாகப் பரணி உரையினால் தெரிகிறது.
1541,மாடலனார் என்பவர் இயற்றியபடியினாலே இந்நூலுக்கு இப்பெயர் வாய்த்தது என்று கருதலாம்.
1542,"தக்கயாகப் பரணி, காளிக்குக் கூளி கூறியது."
1543,"ஆம் தாழிசை உரையில், உரையாசிரியர் இந்நூற் செய்யுள் ஒன்றை மேற்கோள் காட்டுகிறார்."
1544,.
1545,மார்க்கண்டேயனார் காஞ்சி குணசாகரர் என்னும் உரையாசிரியர் யாப்பருங்கலக் காரிகை உரையில் இந்நூலைக் குறிப்பிடுகிறார்.
1546,"குறிப்பிடுவதோடு, இந்நூற் செய்யுள் ஒன்றினை மேற்கோள் காட்டுகிறார்."
1547,"ஆனால், அவர், இச்செய்யுள் எந்நூலைச் சேர்ந்தது என்பதைக் குறிப்பிடவில்லை."
1548,குணசாகரர் கூறியதிலிருந்து இச்செய்யுள் மார்க்கண்டேயனார் காஞ்சியில் உள்ளது என்பது தெரிகிறது.
1549,இந்நூலைப் பற்றி வேறு செய்திகள் தெரியவில்லை.
1550,.
1551,இவர்களில் கொடிகொண்டான் பெரியான் ஆதிச்ச தேவர் இவ்வரசன்மேல் பிள்ளைக் கவியொன்று பாடினார்.
1552,.
1553,"முப்பேட்டுச் செய்யுள் இப்பெயருள்ள நூலையும், இந்நூலிலிருந்து மூன்று செய்யுளையும் யாப்பருங்கல உரையாசிரியர் தமது உரையில் குறிப்பிடுகிறார்."
1554,இந்நூலைப் பற்றி வேறு செய்திகள் தெரியவில்லை.
1555,.
1556,மூவடி முப்பது மூவடி முப்பது என்னும் ஒரு நூல் இருந்ததென்பதைப் பேராசிரியர் உரையினால் அறிகிறோம்.
1557,"தொல்காப்பியம், பொருளதிகாரம், செய்யுளியல், ஆம் சூத்திர உரையில் பேராசிரியர் இந்நூலைக் குறிப்பிடுகிறார்."
1558,"அவர் கூறுவது இது மற்று மூவடி முப்பது முதலாயின அம்மையெனப்படுமோ அழகெனப்படுமோ வெனின், தாய பனுவலின்மையின் அம்மை யெனப்படாவென்பது."
1559,இவற்றுள்ளும் ஓரோர் செய்யுட்கண்ணே மாத்திரை முதலாகிய உறுப்பும் ஏற்ற வகையான் வருவன அறிந்துகொள்க. .
1560,வாசுதேவனார் சிந்தம் யாப்பருங்கல விருத்தியுரையாசிரியர் இந்நூலைத் தமது உரையில் குறிக்கிறார்.
1561,"யாப்பருங்கலம், செய்யுளியல், ஆம் சூத்திர விருத்தியுரையில் கீழ்க்காணுமாறு எழுதுகிறார் ..."
1562,...
1563,...
1564,குடமூக்கு என்பது கும்பகோணம்.
1565,கும்ப கோணத்தில் இருந்த பகவர் என்பவரால் இந்நூல் இயற்றப்பட்டது.
1566,இந்த நூலைப் பற்றி வேறு செய்திகள் தெரியவில்லை.
1567,.
1568,வீரணுக்க விசயம் வீரசோழ அணுக்கர் என்பவர்மீது இந்நூல் இயற்றப்பட்டது.
1569,"இந் நூலை இயற்றியவர், பூங்கோயில் நம்பி என்பவர்."
1570,இசைத்தமிழ் நூல்கள் .
1571,"இசைத்தமிழ்ச் செய்யுட்டுறைக் கோவை இப்பெயருள்ள ஒரு நூல் இருந்தது என்பது, குணசாகரரின் யாப்பருங்கலக் காரிகை உரைப் பாயிரத்தினால் தெரிகிறது."
1572,என்னை?
1573,"அற்றேல் இந்நூல் என்ன பெயர்த்தோ எனின், ..."
1574,...
1575,...
1576,...
1577,...
1578,செய்யப்பட்டமையான் யாப்பருங்கலக் காரிகை என்னும் பெயர்த்து. என்று அவர் கூறுவது காண்க.
1579,இந்நூலைப் பற்றிய வேறு செய்திகள் தெரிய வில்லை.
1580,.
1581,இசைநுணுக்கம் இந்நூலை இயற்றியவர் சிகண்டி என்னும் முனிவர்.
1582,வேனிற்காதைவரி. உரை.
1583,என்னை?
1584,"கடலாடு காதை, ஆம் அடி, உரை."
1585,மேற்கோள் சிகண்டி என்பவரைப் பற்றிப் பௌத்த சமய நூல்களில் ஒரு செய்தி காணப்படுகிறது.
1586,சக்கன் இந்திரன் உடைய தேர்ப்பாகனான மாதவியின் மகன் சிகண்டி என்பவன்.
1587,பஞ்சசிகா என்னும் கந்தருவன் பதினாறு வயதுடைய இளைஞன் அழகன் இசைக்கலையில் தேர்ந்தவன்.
1588,சக்கனுடைய இந்திரனுடைய இசைப்புலவனாக இருந்தவன்.
1589,பஞ்சசிகா பத்தவச்சசாலின்மேல் காதல்கொண்டு அக்காதலைப் பற்றி இசைப்பாட்டு ஒன்றை இயற்றினான்.
1590,அவன் அப்பாடலை அவளிடம் பாடினான்.
1591,"இந்தக் கதையில் கூறப்பட்ட சிகண்டியும் இசைநுணுக்கம் செய்த சிகண்டியும் ஒருவரா, அல்லது வெவ்வேறு ஆண்களா என்பது ஆராய்ச்சிக்குரியது."
1592,.
1593,"இந்திர காளியம் அடியார்க்கு நல்லார், சிலப்பதிகார உரைச்சிறப்புப் பாயிரத்தில், இந்திர காளியம் என்னும் நூலைக் குறிப்பிடுகிறார்."
1594,பாரசவ முனிவரில் யாமளேந்திரர் செய்த இந்திர காளியம் என்று அவர் கூறுகிறார்.
1595,"எனவே, இந்நூலாசிரியர் பாரசவ இனத்தைச் சேர்ந்தவர் என்றும், யாமளேந்திரர் என்பது அவர் பெயர் என்றும் கருதலாம்."
1596,இது இசைத் தமிழ் நூல்.
1597,பாரசவன் என்பது கொற்றவை துர்க்கையைப் பூசை செய்கிற வர்களுக்குப் பெயர்.
1598,என்னை?
1599,தேவிக்குத் திருவுடையாக உபாசக பாரசவன் சார்த்துவன கௌசிகப் பட்டாடைகளேயோ?
1600,...
1601,...
1602,...
1603,"இனி, யாமளேந்திரர் என்னும் பெயரும் இவருடைய இயற் பெயர் அன்று சிறப்புப் பெயர் ஆகும்."
1604,என்னை?
1605,தேவியைப்பற்றிக் கூறும் நூல்களுக்கு யாமள நூல் என்பது பெயர்.
1606,"இதனை, தக்கயாகப் பரணி கோயிலைப் பாடியது உரையினால் அறியலாம்."
1607,யாமள சாத்திரத்தினாற் சொல்லப்படுகின்ற ஈசுவரியின் பதிணெண் கண நாதராலும் விரும்பப்படுகின்ற கோயில் என்று அவ்வுரை கூறுவதி லிருந்து அறியலாம்.
1608,"இந்திரகாளியம், சிலப்பதிகார உரை எழுத அடியார்க்கு நல்லார்க்கு உதவியாயிருந்தது என்பதைத் தவிர அதைப் பற்றி வேறு செய்திகள் தெரியவில்லை."
1609,.
1610,"குலோத்துங்கன் இசைநூல் குலோத்துங்க சோழன், சோழ அரசர்களில் பேர்பெற்றவன்."
1611,"இவனுக்கு விசயதரன், செயங்கொண்டான் என்னும் சிறப்புப் பெயர்களும் உண்டு."
1612,கலிங்கப் போரை வென்றவன் இவனே.
1613,"அதனால், கலிங்கத்துப் பரணி என்னும் நூலைச் செயங்கொண்டார் என்னும் புலவரால் பாடப் பெற்றவன்."
1614,"இவன் இசைக் கலையில் வல்லவன் என்றும், இசைத்தமிழ் நூல் ஒன்றை இயற்றினான் என்றும் கலிங்கத்துப்பரணி கூறுகிறது."
1615,"கலிங்கத்துப் பரணி, அவதாரம், ஆம் தாழிசை."
1616,"மேற்படி, காளிக்குக் கூளி கூறியது."
1617,இவ்வரசன் இயற்றிய இசைநூலின் பெயர் தெரிய வில்லை.
1618,அந்நூலைப்பற்றிய வேறு செய்திகளும் தெரியவில்லை.
1619,.
1620,"இதில் கூறப்பட்ட நெடுந்தொகை அகநானூறு, குறுந்தொகை, நற்றிணை, ஐங்குறுநூறு, கலித்தொகை என்னும் நூல்கள் இப்போதும் உள்ளன."
1621,புறநானூற்றில் சில பாடல்கள் தவிர மற்றப் பாடல்கள் கிடைத்துள்ளன.
1622,"பதிற்றுப்பத்தில் முதல்பத்தும் கடைசிப்பத்தும் தவிர, ஏனைய எட்டுப் பத்து களும் கிடைத்துள்ளன."
1623,பரிபாடலில் சில பாடல்கள் மட்டும் கிடைத் துள்ளன.
1624,"சிற்றிசை, பேரிசை என்னும் நூல்கள் கிடைக்கவில்லை."
1625,சிற்றிசை பேரிசை என்பன இசைத்தமிழ் நூல்கள் என்பது இவற்றின் பெயரினால் தெரிகிறது.
1626,தொல்.
1627,பொருள்.
1628,"செய்யுளியல், ஆம் சூத்திர உரையில், இளம் பூரணர், பண்ணைத் தோற்றுவித்தலாற் பண்ணத்தி என்றார்."
1629,"அவை யாவன, சிற்றிசையும் பேரிசையு முதலாக இசைத்தமிழில் ஒதப்படுவன என்று எழுதுகிறார்."
1630,"இவர்கள் கூறுகிற சிற்றிசை, பேரிசை, வரி என்பன இசையின் பகுதிகள்."
1631,இவை சிற்றிசை பேரிசை என்னும் நூலின் பெயர்களைக் குறிப்பன அல்ல.
1632,.
1633,"பஞ்ச பாரதீயம் இப்பெயருடைய நூல் ஒன்று இருந்தது என்பது, சிலப்பதிகாரத்திற்கு அடியார்க்குநல்லார் எழுதிய உரையினால் தெரிகிறது."
1634,இந்நூலை இயற்றியவர் நாரதன் என்பவர்.
1635,இந்த நூல் அடியார்க்குநல்லார் காலத்திலேயே மறைந்து விட்டது.
1636,இந்நூலிலிருந்து ஒரே ஒரு செய்யுளே அடியார்க்கு நல்லார் மேற்கோள் காட்டியிருக்கிறார்.
1637,.
1638,பஞ்சமரபு இஃதோர் இசைத்தமிழ் நூல்.
1639,அறிவனார் என்பவர் இந் நூலாசிரியர்.
1640,அறிவனார் செய்த பஞ்சமரபு என்று அடியார்க்குநல்லார் சிலப்பதிகார உரைச்சிறப்புப் பாயிரத்தில் கூறுகிறார்.
1641,"அவை சிந்து, திரிபதை, சவலை, சமபாத விருத்தம், செந்துறை, வெண்டுறை, பெருந்தேவ பாணி, சிறுதேவ பாணி, வண்ணமென விவை."
1642,என்னை?
1643,பதினாறு படலம் பல ஒத்துகளாகப் பிரிக்கப்பட்டிருந்தது என்பதும் தெரிகிறது.
1644,"இவை இசைத்தமிழ்ப் பதினாறு படலத்துள் கரணவோத்துட் காண்க. சிலம்பு, கானல்வரி, அரும்பத உரையாசிரியர் உரை மேற்கோள் ."
1645,.
1646,"பெருநாரை, பெருங்குருகு இவை இசைத்தமிழ் நூல்கள்."
1647,இவற்றை அடியார்க்கு நல்லார் சிலப்பதிகாரப் பாயிரவுரையில் குறிப்பிடுகிறார்.
1648,"இறையனார் அகப்பொருளுரை யாசிரியர் குறிப்பிடுகிற முதுநாரை முதுகுருகு என்னும் நூல்கள், பெருநாரை பெருங்குருகு போலும்."
1649,"அவர்களால் தலைச்சங்கத்தார் பாடப்பட்டன எத்துணையோ பரிபாடலுடன் முதுநாரையும், முதுகுருகும், களரியா விரையுமென இத்தொடக்கத்தன என்று அவ்வுரையாசிரியர் கூறுகிறார்."
1650,இந்நூல்களைப் பற்றி வேறு செய்திகள் தெரியவில்லை.
1651,.
1652,வாய்ப்பியம் யாப்பருங்கல விருத்தியுரையில் வாய்ப்பியம் என்னும் நூல் கூறப்படுகிறது.
1653,"இந்நூல் ஆசிரியரை வாய்ப்பியனார் என்றும், வாய்ப்பியமுடையார் என்றும் கூறுகிறார் யாப்பருங்கல விருத்தியுரை காரர்."
1654,"வாய்ப்பியம், இசைத்தமிழ் இலக்கணத்தைக் கூறுகிற நூல் என்று தெரிகிறது."
1655,இந்நூலைப் பற்றிய வேறு செய்திகள் தெரியவில்லை.
1656,இவையெல்லா மொருபுடை யொப்பினாற் பெயர் பெற்றன எனக் கொள்க.
1657,"ஒன்றுக்கொன்று சிறப்புடைமை நோக்கி வெண்பா, ஆசிரியம், கலி, வஞ்சியென விம்முறையே பாற்படுத்துவைத்தாரென்க."
1658,வெள்ளை யென்றும் பாவென்றும் நின்று வெண்பாவென்று முடிந்தது.
1659,"வேதியர், அரசர், வணிகர், சூத்திரர் என்று சாதிமேற் சார்த்தி வழங்குவாருமுளர்."
1660,என்னை?
1661,பாலை குறிஞ்சி மருதஞ்செவ் வழியென நால்வகைப் பண்ணா நவின்றனர் புலவர் என்றார் வாய்ப்பியனார்.
1662,விளரி யாழோ டைந்து மென்ப.
1663,"இனிப் பண் சார்பாகத் தோன்றியன திறமாம், என்னை?"
1664,"பண்சார் வாகப் பரந்தன வெல்லாந் திண்டிற மென்ப திறனறிந் தோரே என்றாராகலின், அத்திறம் இருபத்தொரு வகைய."
1665,அகத்தியம் அகத்திய முனிவர் தமது பெயரால் அகத்தியம் என்னும் நூலை இயற்றினார் என்பர்.
1666,"அகத்தியம், இயல் இசை நாடகம் என்னும் முத்தமிழ் இலக்கணத்தைக் கூறும் நூல் என்பர்."
1667,"நாடகத்தமிழ் நூலாகிய பரதம், அகத்திய முதலாவுள்ள தொன்னூல்களு மிறந்தன. என்று அடியார்க்கு நல்லார் சிலப்பதிகார உரைப் பாயிரத்தில் கூறுகிறார்."
1668,அகத்தியம் அக்காலத்திலேயே மறைந்து விட்டது.
1669,.
1670,இராஜஇராஜேசுவர நாடகம் இப்பெயருள்ள நாடகநூல் ஒன்று இருந்ததென்பதைக் தஞ்சைப் பெருவுடையார் கோவில் கல்வெட்டுச் சாசனத்தினால் அறிகிறோம்.
1671,கி.பி.
