Line Number,Sentence
1,வரலாற்றறிஞர் வெ.
2,சாமிநாத சர்மா நூல் திரட்டு மகாத்மா காந்தி மொழிபெயர்ப்பு நூல் ஆசிரியர் வெ.
3,சாமிநாத சர்மா நூற் குறிப்பு நூற்பெயர் வெ.
4,சாமிநாத சர்மா நூல்திரட்டு ஆசிரியர் வெ.
5,சாமிநாத சர்மா பதிப்பாளர் இ.
6,"படிகள் நூலாக்கம் பாவாணர் கணினி தி.நகர், சென்னை ."
7,"அட்டை வடிவமைப்பு வ.மலர் அச்சிட்டோர் வெங்கடேசுவரா ஆப்செட் பிரிண்டர் ஆயிரம் விளக்கு, சென்னை ."
8,"வெளியீடு வளவன் பதிப்பகம் , சிங்காரவேலர் தெரு, தியாகராயர்நகர், சென்னை ."
9,தொ.பே.
10,அணிந்துரை எழுத்திடைச் செழித்தச் செம்மல் வெ.
11,ஆங்கிலக் கணக்குப்படி இன்று என்னுடைய வது பிறந்த நாள்.
12,வாழ்க்கைப் பாதையில் அறுபத்தைந்தாவது மைல் கல்லைக் கடந்து விட்டேன்.
13,என்ன சாதித்துவிட்டேன்?
14,அதைச் சொல்ல எனக்கு சந்ததிகள் இல்லை.
15,ஆனால் வருங்காலத் தமிழுலகம் ஏதாவது சொல்லுமென்று நினைக்கிறேன்.
16,அதைக் கேட்டு அவர் புன்னகை பூத்தார்.
17,"ஆமாம், வெ."
18,சாமிநாத சர்மாவின் நூல்கள் தமிழக முதல்வர் கலைஞர் மு.
19,கருணாநிதி ஆட்சி காலத்தில் கி.பி.
20,த்தில் நாட்டுடைமை யாக்கப்பட்டது.
21,"இவற்றிற்கெல்லாம் மணிமகுடம் வைப்பது போன்று, வளவன் பதிப்பகம் சாமிசாத சர்மா அவர்களுடைய நூல்கள் அனைத்தையும் பல தொகுதிகளாக வெளியிடுகின்றது."
22,ஆண்டுகால வாழ்க்கையில் சாமிநாத சர்மாவின் இலக்கிய வாழ்க்கை ஆண்டுகாலமாகும்.
23,அவருடைய நூல்கள் அவருடைய இலக்கிய வாழ்க்கையின் சுடர் மணிகளாக ஒளிவீசிக் கொண்டிருக் கின்றன.
24,"இராமகிருஷ்ணபுரம், வது தெரு, மேற்குமாம்பலம், சென்னை ."
25,பெ.சு.
26,மணி வெ.
27,"இன்றும், என்றும் நாம் நன்றியுடன் நினைவு கூறவேண்டியவர்களில் பெரும் பங்காற்றியச் சிறப்புக்கு உரியவர், திரு."
28,வெ.
29,சாமிநாத சர்மா அவர்கள்.
30,சர்மாஜி என்று அனைவராலும் அழைக்கப் பட்டவர்.
31,தமிழ்த் தென்றல் திரு.வி.க.வின் தம்பி என போற்றப்பட்டவர்.
32,அவருடன் குருசீடர் உறவுப் பிணைப் போடு பணியாற்றியவர்!
33,"சுதந்திரமான எழுத்துத் துறையில் ஈடுபாடு கொண்டதால் அரசுப் பணியை உதறிவிட்டு, இதழியல் துறையைத் தேர்ந்தெடுத்தவர்."
34,மூன்று ஆண்டுகள் திரு.
35,வி.
36,க.
37,சென்னை தமிழ் எழுத்தாளர் சங்க வெளியீடான பாரதியில் ஓராண்டு ஆசிரியராக இருந்தார்.
38,திரு.
39,ஏ.கே.
40,செட்டியார் அயல் நாடு சென்றிருந்தபோது அவரது குமரி மலர் மாத இதழுக்கு ஆசிரியராய்ப் பொறுப்பேற்றிருந்த பெருமையும் இவருக்கு உண்டு.
41,தமிழ்த் தென்றல் திரு.
42,"வி.க., மகாகவி பாரதியார், பரலி சு."
43,"நெல்லையப்பர், வீர விளக்கு வ."
44,வே.
45,சு.
46,"ஐயர், தியாகச் செம்மல் சுப்பிரமணிய சிவா, அக்ரஹாரத்து அதிசய மனிதர் வ."
47,ரா.
48,"பேராசிரியர் கல்கி, உலகம் சுற்றிய தமிழர் திரு."
49,ஏ.கே.
50,செட்டியார் முதலான தமிழ் கூறும் நல்லுலக மேதைகளுடன் நெருங்கிய தொடர்பு கொண்டிருந்தவர் சர்மாஜி.
51,"இவரது இல்லற வாழ்க்கை இலட்சியப் பிடிப்பாலும், தமிழ்ப்பணியாலும் சிறப்பு பெற்றது."
52,தம்பதியர் இருவருமே அண்ணல் காந்தியின் பக்தர்கள்.
53,இத்தகைய பாக்கியம் பெற்ற எழுத்தாளர்கள் ஒரு சிலரே!
54,தம்மிருவரின் ஒத்துழைப்பால் தோன்றிய நூல்களையே தங்கள் குழந்தைகளாக எண்ணி மகிழ்ந்தனர் அந்த ஆதர்ச தம்பதியர்.
55,"ஆங்கிலம், தமிழ், வட மொழி, தெலுங்கு, கன்னடம், இந்தி ஆகிய ஆறு மொழிகளை அறிந்திருந்தவர் அம்மையார்."
56,தனக்கு உற்றத் துணையாயிருந்த மனையாள் உயிர் நீத்தது சர்மாஜியைத் துயரக் கடலில் ஆழ்த்தியது.
57,தனது ஆற்றாமையைத் தன் நண்பருக்கு எழுதிய கடிதங்கள் வாயிலாக வெளிப்படுத்தினார்.
58,இவைதான் பின்னர் அவள் பிரிவு என்று நூலாக்கம் பெற்றது.
59,இரங்கூனுக்குச் சென்ற சர்மாஜி இல் ஜோதி மாத இதழை தொடங்கினார்.
60,பத்திரிகை உலகிற்கு ஒரு புதிய வெளிச்சமாக அமைந்தது ஜோதி.
61,பிற்காலத்தில் பிரபலமான எழுத்தாளர்களில் பலரும் ஜோதியில் தங்கள் எழுத்தாற்றலை வெளிப்படுத்தியவர்கள்தாம்.
62,புதுமைப் பித்தனின் விபரீத ஆசை முதலான கதைகள் ஜோதியில் வெளிவந்தவையே!
63,இரண்டாம் உலகப் போரில் இரங்கூனில் பெய்த குண்டு மழைக்கு நடுவிலும் ஜோதி அணையாமல் தொடர்ந்து சுடர்விட்டது குறிப்பிடத்தக்கது.
64,போர்க் காலத்தில் குடும்பத்தோடு அவர் மேற்கொண்ட பர்மா நடைப் பயணம் துன்பங்கள் நிறைந்தது.
65,தனது உடமைகளில் எழுது பொருட் களையே முதன்மையாகக் கருதினார்.
66,"உயிருக்கு உத்திரவாதமற்ற சூழலில், உயிர் போவதற்குள் தான் மேற்கொண்டிருந்த மொழிபெயர்ப்புப் பணியை முடித்தே ஆகவேண்டும் என்பதில் தீர்க்கமாக இருந்தார்."
67,மெழுகுவர்த்தி வெளிச்சத்தில் பாதுகாப்புக் குழியில் இருந்தபடி மொழிபெயர்த்து எழுதி முடிக்கப்பட்டதுதான் பிளாட்டோவின் அரசியல் என்ற உலகம் போற்றும் நூல்.
68,"சர்மாவின் நூல்களை வெளியிடுவதற்காகவே இரங்கூனில் தோற்றுவிக்கப்பட்ட பிரபஞ்ச ஜோதி பிரசுராலயம், பின்னர் புதுக்கோட்டைக்கு மாற்றப்பட்டது."
69,வரலாறு என்பது உண்மை களை மட்டுமே தாங்கி நிற்க வேண்டும் என்பதில் பிடிவாதமாக இருந்தவர் சர்மாஜி.
70,இன்றளவும் இச்சிறப்பில் இவருக்கு இணை இவரே என்பது மிகையல்ல!
71,இப்பண்பே அவரது நூல்களின் மிகச் சிறந்த அம்சமாகும்.
72,சர்மாவின் மொழிபெயர்ப்பு நூல்கள் தமிழ் மக்களிடையே மிகவும் புகழ்ப் பெற்றவை.
73,சாதாரண வாசகனுக்கும் புரியக் கூடியவை.
74,மூல நூலின் வளத்தைக் குறைக்காதவை.
75,"ஆக்கியோன் உணர்த்த நினைத்ததை சற்றும் பிசகாமல் உள்ளடக்கி, மொழியின் லாவகத்தோடு சுவைக் குன்றாமல் பெயர்த்துத் தரப்பட்டவை."
76,.
77,முதலான நூல்களைப் படித்தவர்களுக்கு இது நன்கு விளங்கும்.
78,எழுபதுக்கும் மேற்பட்ட மணி மணியான நூல்களை சர்மாஜி எழுதினார்.
79,என்ற ஆங்கில நூலும் அவற்றில் அடங்கும்.
80,ஏற்கனவே படித்து அனுபவித்த வர்கள் தங்கள் அனுபவத்தைப் புதுப்பித்துக் கொள்ளலாம்.
81,இதன் பொருட்டு திரு.
82,கோ.
83,"இளவழகன் அவர்களுக்கும், அவர்தம் மகன் இனியனுக்கும் நாம், தமிழர் என்ற வகையில் நன்றி பாராட்ட கடமைப்பட்டுள்ளோம்."
84,பதிப்புத் துறையில் வரலாறு படைத்து வரும் திரு கோ.
85,இளவழகன் வரலாற்றறிஞர் சர்மாவின் நூல்களை வெளியிடுவது பொருத்தமே!
86,", பழனியப்பா நகர், திருகோகர்ணம் அஞ்சல், ஞானாலயா பி."
87,கிருஷ்ணமூர்த்தி புதுக்கோட்டை .
88,சர்மா வாழ்ந்த காலத்தில் நிகழ்ந்த உலக நிகழ்வுகளை தமிழர் களுக்குப் படம் பிடித்துக் காட்டியவர்.
89,அரசியல் கருத்துகளின் மூலம் புத்துணர்ச்சியும் விடுதலை உணர்ச்சியும் ஊட்டி வீறு கொள்ளச் செய்தவர்.
90,உலக அரசியல் சிந்தனைகளைத் தமிழில் தந்து தமிழிலேயே சிந்திக்கும் ஆற்றலுக்கு வழிகாட்டியவர்.
91,தமிழ் மக்களுக்கு விடுதலை உணர்வையும் தேசிய உணர்வையும் சமுதாய உணர்வையும் ஊட்டும் வகையில் அரும்பணி ஆற்றியவர்.
92,தமிழ்ப்பண்பாட்டின் சிறப்புக்களை போற்றியவர் பொருளற்ற பழக்க வழக்கங்களைச் சாடியவர்.
93,தமிழ் மட்டுமே தெரிந்த தமிழர்களும் உலகளாவிய அரசியல் பார்வையைப் பெறுவதற்கு வழி அமைத்தவர்.
94,மேலை நாட்டுஅறிஞர்களின் தத்துவச் சிந்தனைகளை எளிய இனிய தமிழில் தந்தவர்.
95,வரலாற்று அறிவோடு தமிழ்மொழி உணர்வை வளர்த்தவர்.
96,அரசியல் தத்துவத்தை அவர் காலத்தில் வாழ்ந்த தமிழ்நாட்டுத் தலைவர்களுக்குக் கற்றுத் தந்தவர்.
97,தமிழகத்தின் விழிப்பிற்கு உழைத்த முன்னோடிகளில் ஒருவர்.
98,தமிழர்கள் கல்வியில் வளர்ந்தால்தான் உலகில் உயர்ந்து நிற்க முடியும் என்பதை தம் நூல்களில் வாயிலாக உணர்த்தியவர்.
99,நன்மையும் தீமையும் இருவேறுநிலைகள் தீமையை ஓங்கவிடாமல் நன்மையை ஒங்கச் செய்வதே மக்களின் கடமையென்று கூறியவர்.
100,"சாதிப்பித்தும், சமயப்பித்தும், கட்சிப்பித்தும் தலைக்கேறி தமிழ்க் குமுகாயத்தைத் தலைநிமிரா வண்ணம் சீரழித்து வருகின்றன."
101,மொழி இன நாட்டுணர்வு குன்றிக் குலைந்து வருகிறது.
102,இச்சீரழிவில் இருந்து தமிழர்களை மீட்டெடுக்க வேண்டும்.
103,இளமைப் பழக்கம் வாழ்நாள் முழுவதும் உதவும்.
104,சர்மா தாம் எழுதிய நூல்களின் வழியாக மக்களிடம் பேசியவர்.
105,இவர் நூல்களைப் படிப்பவர்களுக்கு அந்தந்த நூல்களின் விழுமங்களோடு நெருக்கம் ஏற்படுவது உறுதி.
106,இவரின் உரைநடை நீரோட்டம் போன்றது.
107,தமிழ் உரைநடைக்குப் புத்துயிர் ஊட்டிப் புதுவாழ்வு அளித்தவர்.
108,வேம்பாகக் கசக்கும் வரலாற்று உண்மைகளை சர்க்கரைப் பொங்கலாக தமிழ்க் குமுகாயத்திற்குத் தந்தவர்.
109,சாமிநாத சர்மா நூல்களை எழுதியுள்ளார்.
110,இதில் கட்டுரை இலக்கிய நூல்கள் .
111,இந்நூல்களை நூல் திரட்டுகளாக வெளியிட்டுள்ளோம்.
112,இவரின் தமிழ் நூல்கள் வெளிவந்த காலம் வடமொழி ஆளுமை ஒங்கியிருந்த காலமாகும்.
113,அந்தக் காலப் பேச்சு வழக்கையே மொழி நடையின் போக்காக அமைத்துக் கொண்டு நூலினை உருவாக்கி யுள்ளார்.
114,"மரபு கருதி உரை நடையிலும், மொழி நடையிலும், நூல் தலைப்பிலும் எந்த மாற்றமும் செய்யாது நூலை அப்படியே வெளியிட்டுள்ளோம்."
115,"தமிழ் இளம் தலைமுறைக்கும், எதிர்வரும் தலைமுறைக்கும் வழிகாட்டும் ஒளிவிளக்காக சர்மாவின் நூல்களைப் படைக்கருவி களாகத் தந்துள்ளோம்."
116,உணர்வுகள் ஊற்றாகப் பெருகி நல்ல செயல்களுக்கு வழிகோலட்டும்.
117,பதிப்பாளர் பொருளடக்கம் அணிந்துரை சர்மாவின் சாதனைகள் சர்மாவின் பொன்னுரைகள் பதிப்புரை நகைத்தல் நல்லது .
118,நகைத்தல் நல்லது .
119,எனது கல்யாணம் .
120,எனது மாப்பிள்ளை .
121,எனது வக்கீல் அண்ணா .
122,வரன் தேடப் போகிற வக்கணை .
123,பெண்மையிலேதான் வாழ்வு .
124,பெண்மை .
125,காதல் .
126,உனக்காக வாழ்வேன் .
127,உன்னை நான் எப்படி மறக்க முடியும்?
128,.
129,என்னை ஏன் காதலிக்கிறாய்?
130,.
131,விடுதலை ஆனால் கட்டுப்பட்டேன் .
132,பெண் கல்வி .
133,பெண்களின் சமூக அந்தது .
134,பெண்களைப் பார்த்தல் .
135,தாய் யார்?
136,.
137,அம்மா!
138,.
139,தாய்மை .
140,இரு குலத்திற்கும் ஒரே நீதி .
141,இல்லறம் .
142,தாயும் சேயும் .
143,குழந்தை .
144,குழந்தையின் தேவைகள் .
145,குழந்தை வளர்ப்பு .
146,குழந்தைகள் போதிக்கும் பாடம் மனிதன் யார்?
147,.
148,மனிதன் யார்?
149,.
150,பெரிய மனிதன் .
151,மனிதன் பண்பு .
152,மனிதனே கேள்!
153,.
154,சின்னஞ் சிறு செயல்கள் .
155,மனிதனும் சமுதாயமும் .
156,மனிதப் பிராணி .
157,வாழ்க்கை .
158,லட்சிய வாழ்க்கை .
159,வாழ்க்கைப் போராட்டம் .
160,நீ யார்?
161,.
162,வாழ்ந்து வீழ்ந்தவர் .
163,வீழ்ந்தும் வாழ்ந்தவர் .
164,எது நாகரிகம்?
165,.
166,நாகரிகமும் பண்பாடும் .
167,மனிதனும் யந்திரமும் .
168,வருங்கால சமுதாயம் .
169,சுதந்திரமே வா!
170,.
171,இருதய சுதந்திரம் .
172,அன்பின் ஆட்சி .
173,நன்மையும் தீமையும் .
174,நமது கடமை இக்கரையும் அக்கரையும் .
175,இக்கரையும் அக்கரையும் .
176,உழைப்பும் பிழைப்பும் .
177,படிப்பும் பண்பாடும் .
178,அறிவும் அன்பும் .
179,வெற்றியும் வாழ்க்கையும் .
180,பணமும் மனமும் .
181,இளமையும் முதுமையும் .
182,நன்மையும் தீமையும் .
183,சான்றோரும் சிற்றினமும் .
184,இன்பமும் துன்பமும் .
185,வீடும் நாடும் .
186,காலமும் கடவுளும் சர்மாவின் பொன்னுரைகள்.......
187,மாந்தப்பண்பின் குன்றில் உயர்ந்து நில்.
188,ஒழுக்கத்தையும் தன்னம்பிக்கையையும் கைவிடாதே.
189,பிறரிடம் நம்பிக்கையுடனும் நாணயத்துடனும் நடந்து கொள்.
190,அது உன்னை உயர்த்தும்.
191,உழைத்துக் கொண்டேயிரு ஓய்வு கொள்ளாதேஉயர்வு உன்னைத் தேடி வரும்.
192,பொய் தவிர் மெய் உன்னைத் தழுவட்டும் பெண்மையைப் போற்றி வாழ்.
193,"மொழியின்றி நாடில்லை மொழிப் பற்றில்லாதவன்,நாட்டுப் பற்றில்லாதவன்."
194,தாய்மொழியைப் புறந்தள்ளி அயல் மொழியைப் போற்றுவதைத் தவிர்.
195,தாய்மொழியின் சொல்லழகிலும் பொருளழகிலும் ஈடுபட்டு உன் அறிவை விரிவு செய்.
196,பெற்ற தாய்மொழியறிவின் விரிவைக் கொண்டு உன் தாய் மண்ணின் உயர்வுக்குச் செயல்படு.
197,ஈட்டிய பொருளை அனைவருக்கும் பகிர்ந்தளித்து வாழக் கற்றுக்கொள்.
198,உதவா வாழ்க்கை உயிரற்ற வாழ்க்கை.
199,கடமையைச் செய் தடைகளைத் தகர்த்தெறி விருப்புவெறுப்புகளை வென்று வாழ முற்படு.
200,ஒழுக்கமும் கல்வியும் இணைந்து வாழ முற்படு ஒழுக்கத்திற்கு உயர்வு கொடு.
201,எந்தச் செயலைச் செய்தாலும் முடிக்கும் வரை உறுதி கொள்.
202,தோல்வியைக் கண்டு துவளாதே உயர்ந்தாலும் தாழ்ந்தாலும் ஒரே நிலையில் வாழக் கற்றுக்கொள்.
