Line Number,Sentence
410,இவர் குழவிப் பருவங்கடந்து இளமைப்பருவத்தை எய்தியகாலத்தே.,False
411,"மேலும், அடிகள் இறைவனை முன்னிலைப்படுத்து அழுதுரைக்கும் பாக்களைப் போல்வன, ஏனை ஆசிரியன்மார் தேவாரத்திருப்பதிகங்களில் மிகுதியாயில்லை.",False
412,அவர் அருளிச்செய்த திருப்பதிகங்களெல்லாம் பெரும்பாலுஞ் சிவபிரானைப் படர்க்கையிடத்துவைத்தே பரவுகின்றன.,False
413,"இவ் வியற்கை மன நிகழ்ச்சிக்கு இசையவே, இறைவனை முன்னிலைப்படுத்துப் பாடிய அடிகளின் திருவாசகமுங் கன்னெஞ்சினையும் உருக்குந்திறம் பெறலாயிற்றென்றும்.",False
414,பலகாற் பல்லாருங் காணவந்து இறைவன் மாணிக்கவாசகர்க்கு அருள்செய்தவாறு போல் வேறெவர்க்குஞ் செய்திலன்.,False
415,திருஞானசம்பந்தப்பெருமானுக்குப் புலனாய்த் தோன்றிய இறைவனுருவம் வேறெவர்க்கும் புலனாயிற்றில்லை.,False
416,"இனி, இந் நூல் எழுதுதற்கட் கைக்கொள்ளப் பட்ட ஆராய்ச்சி முறைகள் சிலவற்றைப்பற்றிச் சில கூற வேண்டுவது இன்றியமையாததாகின்றது.",False
417,"மாணிக்கவாசகர் வரலாற்றுக் குறிப்புகளிற் பல, அவ்வரலாறு நுவலும் நூல்களில் உள்ள படியே இங்கு எடுத்து எழுதப்படவில்லை.",False
418,அடிகளின் வரலாறு கிளக்கும் பகுதியில் இம்முறை மிக்கு நிற்றல் தெற்றெனப் புலனாம்.,False
419,இத் தலைதடுமாற்றப் பேயாற் பிடியுண்டு நிற்கும்வரையில் மக்கள் பொய்யான வழிகளில் அலைந்து திரிந்து மீளாத் துன்பத்திற்கு ஆளாகி நிற்பர்.,False
420,"இங்ஙனம் ஆராய்ந்து செல்லும் நெறியிற் பிழையெனக் கண்டவைகளை மறையாது, அவை பிழைபடுதலைக் கிளந்து சொல்லியிருக்கின்றேம்.",False
421,எல்லாராலுந் தெய்வத்தன்மை யுடைய வராகக் கொள்ளப்பட்ட ஆசிரியர் நூல்களிலும் பிழையெனக் கண்டவைகளை மறையாது வெளிப்படையாக எடுத்துக் காட்டியிருக்கின்றேம்.,False
422,கடவுளல்லாத ஏனை மக்களெல்லாரும் எத்துணைதான் சிறந்தவராயிருப்பினும் பிழைபடாதிரார்.,False
423,"இது, தெய்வப் புலமைத் திருவள்ளுவ நாயனாரே.",False
424,அரியகற்று ஆசற்றார் கண்ணுந் தெரியுங்கால் இன்மை யரிதே வெளிறு என்று அருளிச்செய்தமையானுந் தெளியப்படும்.,False
425,"மாணிக்கவாசகப் பெருமான் இருந்த காலம் இற்றைக்கு ஆயிரத்து எழுநூறு ஆண்டுகட்குமுன், அஃதாவது கி.பி.",False
426,அக்கட்டுரையும் இந் நூலின் இறுதியிற் சேர்க்கப்பட்டிருக்கின்றது.,False
427,மூன்றாம் நூற்றாண்டின்கண் மிளிர்வதாதலை இப்போது மீண்டும் வலியுறுத்தியிருக்கின்றோம்.,False
428,"பல்லவபுரம், மறைமலையடிகள் பொதுநிலைக்கழக நிலையம், திருவள்ளுவர் ஆண்டு மாசி, முதல்நாள் மாலை.",False
429,பொருளடக்கம் மாணிக்கவாசகர் வரலாறு பக்கம் .,False
430,மாணிக்கவாசகர் பிறப்பு .,False
431,அருள்பெற்றவரையுள்ள ஆய்வு .,False
432,ஆட்கொள்ளப்பட்டபின் நிகழ்வு .,False
433,ஆவணி மூலத்திற் குதிரை வருமென்றல் குதிரைப்பாகற்கும் மன்னற்கும் இடை நிகழ்ந்த நிகழ்ச்சி .,False
434,நரியைப்பரியாக்கியது அடிகள் பொருட்டே .,False
435,இறைவன் மண்சுமந்து அடிபடுதல் .,False
436,பாண்டியன் பிழைபொறுக்க வேண்டுதல் .,False
437,புத்தரொடு சொற்போர் தொடங்குதல் .,False
438,புத்த சமயக் கோட்பாடுகளை மறுத்தல் .,False
439,சைவ சமயக் கோட்பாடுகளை விளக்கல் .,False
440,புத்தகுரு தோற்றபின் நிகழ்ந்தவை .,False
441,சமயக் கொள்கைகள் ஆராய்ச்சி .,False
442,நால்வரே நல்லாசிரியர்கள் .,False
443,பொருந்தாக் கொள்கைகள் புகுந்தமை .,False
444,பொருந்தாக் கொள்கைகள் தொடர்ச்சி .,False
445,பௌத்தகுருவுக்கு விளக்கிக்காட்டிய உண்மைகள் .,False
446,சிவவொளியில் மறைந்தமை மாணிக்கவாசகர் காலம் .,False
447,வாசகன் என்னும் சொல் அடிகளையே உணர்த்தும் .,False
448,நான்காம் நூற்றாண்டிற்கு முற்பட்ட தமிழ்வேந்தர் பெயர் கல்வெட்டில் காணப்பெறாது .,False
449,திருமுகப்பாசுரம் கல்லாடத்திற் காணப்படுதல் .,False
450,சிவனடியார் பலர் திருத்தொண்டத் தொகையிற் கூறப்படாமை .,False
451,திருவாசகம் கல்லாடம் புத்த சமண காலங்களில் தோன்றினமை .,False
452,திருக்கோவையாரின் செய்யுட்பொருள் பழந்தமிழ் நூல்களோடு ஒத்தல் .,False
453,வடநாட்டிற் கல்வெட்டுகள் உண்டானமைக்கு ஏது .,False
454,கடைச்சங்கம் இல்லையாய்ப் போன காலம் .,False
455,"இனி, இவர் பிள்ளைப் பருவத்தினராய் இருந்தஞான்று இவர்க்கு வழங்கிய பெயரும் இன்னதென்று புலனாகவில்லை.",False
456,அது நிற்க.,False
457,என மொழிந்தனர்.,False
458,", , !",False
459,அகன்று பரிவாரங்களோடும் பெருவழி கடந்து திருக் கானப்பேர் என்னுஞ் சிவபிரான் திருக்கோயில் கொண் டருளிய ஊருக்கு வந்துசேர்ந்தார்.,False
460,"அங்கே பரிவாரங் களுந்தாமுமாக இறங்கி நாட்கடன்கள் கழிப்பிச் சிவபிரானை வழிபட்டு, அயர்வு தீர்ந்தபின், அவ்வூரைவிட்டுப் புறப்பட்டு வழிச் செல்வாராயினார்.",False
461,"இவ்வாறு நெடுவழி போய், முடிவாகத் திருப்பெருந்துறை என்னும் ஊருக்கு அணித்தாக வந்தனர்.",False
462,என ஏவினார்.,False
463,அருள்பெற்றவரையுள்ள ஆய்வு இதுவரையிற்போந்த வரலாற்றின்கண் ஆராய்ந்தறியற்பாலன சில உள.,False
464,"நம்பியார் திருவிளையாடலிலும், கடவுள் மாமுனிவர் திருவாதவூரர் புராணத்திலுங் காணப் படும் இவ்வரலாற்றுப் பகுதியிற் சிற்சில மாறுபாடுகள் உள்ளன.",False
465,அடிகள் திருப்பெருந்துறைக்கு அருகில் வருதலும் தஞ்நெஞ்சம் ஒடுங்கி அன்பின்வழிப்படுதல் கண்டு.,False
466,என்று சொல்லி விடுத்தருளினாரென்று நம்பியார் திருவிளையாடல் கூறாநிற்கும்.,False
467,இவ்வாறு முரணும் இவ்விருவேறு வரலாறு களையும் ஆராய்ந்து பார்க்குங்கால் திருவாதவூரர் புராணவுரையே இவ்விடத்திற்குப் பொருத்தமாகக் காணப்படுகின்றது.,False
468,தஞ்செயலற்றுச் சிவன்செயலாய் நின்று உலகியல் நிகழ்ச்சிகளை மறந்திருப்பாரைக் குற்றங் கூறுவார் யாண்டும் இலர்.,False
469,பேய்பிடி யுண்டாரையும் வெறிபிடித்தாரையுந் தங் கடமைகளின் வழிஇயனார் எனக் குறை கூறுதல் எவர்க்கும் உடன்பாடன்று.,False
470,என்று வினவினாரென்றும் அது சிவஞான போதம் என்று ஆசிரியரின் விடையளிக்க அடிகள் மறித்தும் சிவமாவது யாது?,False
471,ஞானமாவது என்னை?,False
472,"ஆனால், இங்ஙனமொரு வரலாறு பெரும்பற்றப் புலியூர்நம்பி திருவிளையாடலிற் காணப்படுகின்றிலது.",False
473,"அவர் காலத்தில் அந்நூலும், அந்நூலை அறிவுறுத்தருளி னாரென்னும் வரலாறும் வழங்காமையின் அவர் அவற்றைக் கூறிற்றிலர்.",False
474,"என்றழைத்து, நம்மைத் தில்லையம்பலத் தின்கண்ணே வந்துகாண் இப்போது இங்குநில்!",False
475,என்று கட்டளையிட்டுத் தன்னடியார் குழுவினோடும் மறைந்தருளினன்.,False
476,"இங்ஙனம் முரணும் இவ்விருவேறு வரலாறுகளுள் எதுமெய்யென்று ஆராயின், நம்பியார் உரையே உண்மையாமென்பது புலனாம்.",False
477,"மாணிக்கவாசகப் பெருமானை ஆண்டருளிய ஆசிரியன் இந்நிலவுலகத்து மக்களுள் ஒருவனாயின், அவன் பலநாள் இந்நிலமிசைத் தங்கினான் என்றல் பொருத்தமேயாம்.",False
478,"அதனால், அவரை அடிமைகொண்டு ஐந்தெழுத்துண்மை உணர்த்திய ஞான்றே இறைவன் மறைந்தருளினான் என்னும் நம்பியார் உரையே வாய்வதா மென்க.",False
479,மேலான அருந்தவத்தினர்க்கு வழங்குமின்!,False
480,நுகர்தற்கின்றி வறுமையான் நலிந்தார்க்கு உதவுமின்!,False
481,"என்று அருள்செய்து மறைந்தமையின், அடிகளும் அப்பொருண் முழுமையும் அங்ஙனமே செலவிட்டார்.",False
482,"அடிகள் இறைவனால் அடிமை கொள்ளப்பட்டபின் தந்நிலை திரியாது முன்னையுணர்வொடு நின்றனராயின், தாம் மேற்கொண்டு வந்த அமைச்சியற் கடனை மறந்திரார்.",False
483,பிறர் பழிதூற்று முரையைக் கேட்குங்கால் வருந்துமுணர்வுங் கெடுதல் வேண்டுமென இப்பாட்டின்கண் அடிகள் வேண்டுதலும் நினைவுகூரற்பாற்று.,False
484,"அதனால், குதிரைத் திரள் கொள்ளுதற்கு அவன் தந்த பொருளை வேறு நல்ல துறைகளிற் பயன்படுத்துமாறு செய்தது இறைவற்குக் குற்றமாகாதென்க.",False
485,இவ்வாறு பல நாட்கள் கழிந்தன.,False
486,இதற்கடுத்த திருவம்மானை திருவண்ணாமலையில் அருளிச் செய்ததாகல் வேண்டும் என்னை?,False
487,இதற்கடுத்த திருக்கோத்தும்பி என்பதூஉந் தில்லையம் பலவனையே பலகாலுங் குழைந்துருகிப் பாடுதலின் அதுவுந் தில்லைக்கண் அருளிச் செய்யப்பட்டதெனவே கருதற்பாற்று.,False
488,இதற்கடுத்த திருத்தெள்ளேணம் ன்பதூஉம் தில்லை யம்பலவன் மேற்றாய் வருதலின் அதுவுந் தில்லைக்கட் பாடப்பட்டதெனவே கோடற்பாற்று.,False
489,இதற்கடுத்த திருத்தோணோக்கம் என்பது தில்லையம் பலவன் மேற்றாய் வருதலின் இது தில்லைக்கண் அருளிச்செய்ததாகு மென்க.,False
490,இதன் மூன்றாஞ்செய்யுளிற் றென்னன் பெருந்துறை அத்தரை நினைவு கூரும் அவ்வளவே சொல்லப் படுதலின் இஃது அங்கு அருளிச்செய்த தாகாது.,False
491,அடிக்குறிப்புகள் .,False
492,திருச்சதகம் .,False
493,திருத்தெள்ளேணம் .,False
494,கோயின்மூத்த திருப்பதிகம் .,False
495,திருச்சதகம் .,False
496,திருச்சதகம் .,False
497,அமைச்சற்கு இப்படிச் செய்தல் தக்கதாங்கொல்!,False
498,"அருள்செய்யாய், குருந்தின் மறைந்ந மறைக்கொழுந்தே!",False
499,அக்குதிரைகள் வந்திறங்கிய துறை முகங்களும் நாடுகளும் எவ்வெவை?,False
500,அக்குதிரைகள் எவ்வளவு உயரமும் எவ்வெந் நிறங்களும் உடையன?,False
501,அவை தம்முள் எமக்கு இசைந்தது யாது?,False
502,அதன் இலக்கணங்கள் யாவை?,False
503,அப்பரிகளை நேரே காணும்போது மாட்சிமையுடையீரே நன்குணர்வீர்.,False
504,"குறிப்பிட்ட நாளிற் சிறந்த பரித்தொகுதி இங்கு வரும், என்று விடை கூறினார்.",False
505,அது பற்றி இனி நீர் வருந்துதல் ஒழிமின்!,False
506,அது கேட்டலும் ஆறுதல் உடையராய் அடிகள் தம் மனையகஞ் சென்று தம் மனைவியார் மக்கள் சுற்றத்தாரிடை அமர்ந்திருந்தார்.,False
507,யாம் யார்?,False
508,எல்லீரும் எமக்கு அயலவரே யாவீர் இம் மாநிலத்தின்கண் எம்மை வெறுப்பார் யார்!,False
509,உவப்பார் யார்!,False
510,நீவிர் நுமக்குரிய வினைமேற் சென்மின்!,False
511,"என்று கூற, அவரெல்லாரும் அடிகளை யகன்றுபோயினார்.",False
512,"மற்றை ஞான்று, அரசற்கு நெருங்கிய ஏவலாளராய் உள்ளார் அடிகள்பாற் போந்து புரவிகள் வந்தனவோ?",False
513,யாம் உரைத்தசொல் தப்பாது அரசற்குக் கூறுமின்!,False
514,என்று பணித்தான்.,False
515,பரிகளைக் கண்டிலேம் எனப் பகர்ந்தார்.,False
516,என்று கட்டளையிட்டான்.,False
517,என்பதை முதலாகவுடைய அருட்பத்தும் அருளிச்செய்து அடிகள் மிக நைந்துருகினார் என்பது புலனாகின்றது.,False
518,"இவ்வாறு வந்தமையினை அடிகளே, குதிரையைக் கொண்டு குடநா டதன்மிசைச் சதுர்படச் சாத்தாய்த் தானெழுந் தருளியும் என்று கூறுதல் காண்க.",False
519,திருப்பெருந்துறையிலிருந்தே சிவ பெருமான் குதிரை கொண்டு குதிரைச்சேவகனாய் வந்தருளினா னென்பதூஉம்.,False
520,ஒரு மேற்கோடானும் இன்றி முன்னை நூல்கட்கெல்லாம் முழுதும் முரணாகக் கூறும் இவரது பிழையுரை தான் ஆராய்ச்சியுரை போலும்!,False
521,இவர் தம் இப் பிழைபாட்டுரையை அறிவுடையார் கண்டு நகுதலே செய்வராகலின் அதுபற்றி வரக்கடவதோர் இழுக்கின்று.,False
522,"இப் பிழைபாட்டுரையின் இயல்பை, அடிகள் காலம் இதுவென்று வரையைறுக்கும் மூன்றாம் பகுதியிற் பரக்க ஆராய்ந்தொழிப்பாம்.",False
523,"இனி, இறைவன் பதிமீதிவர்ந்து வராநிற்ப, அடிகளோ தாம் பிறந்தருளிய திருவாதவூரின்கண்ணே சிறையில் இடப்பட்டு வருந்தாநின்றார்.",False
524,அடிக்குறிப்புகள் .,False
525,"கீர்த்தித் திருவதவல், , .",False
526,"திருவம்மானை, .",False
527,"குயிற்பத்து, .",False
528,"திருவார்த்தை, .",False
529,"திருவார்த்தை, .",False
530,"பண்டாய நான்மறை, .",False
531,"பண்டாய நான்மறை, .",False
532,"ஆனந்த மாலை, .",False
533,"கீர்த்தித் திருவகவல், , .",False
534,"திருவேசறவு, .",False
535,"திருவேசறவு, .",False
536,"திருப்பொனூஞ்சல், .",False
537,"திருப்பாண்டிப் பதிகம், .",False
538,"கீர்த்தித் திருவகவல், , .",False
539,"அதனைக் கேட்டதும், அடிகளும் அளவில்லாத மகிழ்ச்சிமிக்காராய், மதுரை ஏகிப் பாண்டிய மன்னனை நெருங்கித் தென்னர் பெருமானே!",False
540,அச்சொற் கேட்ட மன்னன் வெஞ்சினம் மிக்கு ஐயகோ!,False
541,நமக்கு நல்ல அமைச்சன் வாய்த்தான்!,False
542,"நம் பொருளையெல்லாம் எடுத்துச் சென்று வீணே அழித்ததல்லாமலும், வென்றி மிக்க குதிரைகள் இப்போது வரும்!",False
543,இதோ வந்தன!,False
544,எனவும் பொய்த்து உரையாடா நின்றான்.,False
545,குறும்பனாகிய இவ்வமைச்சனை ஊர்க்குட் கொண்டுபோய் நிறுத்திப் புளிய மிலாறுகளால் இவனை முதுகின்மேல் அடித்துத் துன்புறுத்துமின்கள்!,False
546,அங்ஙனஞ் செய்தற்கு நீவிர் அஞ்சிக் கூசாதீர்கள்!,False
547,இதற்குட் சொல்லுதற்கரிய சிறப்பினையுடைய அப் பரிகளைச் செலுத்திக் கொண்டு குதிரைச்சாத்தவர்கள் அம்மதுரைமா நகரின் கோமறுகினூடே வந்தார்கள்.,False
