Line Number,Sentence
1,தனித்தமிழியக்க நூற்றாண்டு வெளியீடு சமயம் மாணிக்கவாசகர் வரலாறும் காலமும் தொகுதி ஆசிரியர் மும்மொழிச்செம்மல் மறைமலையடிகள் பதிப்பாளர் கோ.,False
2,இளவழகன் தமிழ்மண் முதல்பதிப்பு பக்கம் விலை மறைமலையம் ஆசிரியர் மும்மொழிச் செம்மல் மறைமலையடிகள் பதிப்பாளர் கோ.,False
3,இளவழகன் வெளியீடு தமிழ்மண் பதிப்பகம் எண்.,False
4,", சிங்காரவேலர் தெரு, தியாகராயர் நகர், சென்னை .",False
5,".. , செல் மின்னஞ்சல் . . கி.",False
6,"மேப்லித்தோ, அளவு தெம்மி எழுத்து . புள்ளி, பக்கம் இயல்பு படிகள் வி.",False
7,யான் ஐம்பது ஆண்டுகளுக்கு மேலாக ஏராளமான நூல்களில் ஆராய்ந்து கண்ட முடிவுகளை நூல்களாக எழுதியிருக்கின்றேன்.,False
8,"பாற்கடலைக் கடைந்து அமுதம் எடுத்தது போல, உண்மை காணும் உணர்ச்சியினால் நடுநிலை நின்று ஆராய்ந்திருக்கின்றேன்.",False
9,ஒருவர் தம் வாழ்நாள் முழுவதும் கற்றாலும் அறியமுடியாத உண்மைகளை எல்லாம் எளிதாக எழுதி வைத்திருக்கின்றேன்.,False
10,"எல்லாரும் தமிழ் இலக்கியங்கள் யாவற்றையும் கற்கும் தொல்லையை மேற்கொள்ள வேண்டிய தில்லை, அது முடியவும் முடியாது, தேவையுமில்லை.",False
11,எல்லா நூல்களிலும் உள்ள சிறந்த உண்மைகளை எல்லாம் பிழி சாறாக யான் வடித்துத் தந்துள்ளேன்.,False
12,"என் நூல்களைப் படித்தாற்போதும், அதனால், தமிழ் முழுதுங் கற்ற பயனை அடையலாம்.",False
13,மறைமலையடிகள் சான்றிதழ் நாகை திரு.,False
14,"வேதாசலம் பிள்ளையவர்கள் ஒருபோது திருவனந்தபுரத்தில் ஒருவாரந் தங்கியிருந்த ஞான்று, அவருடன் நெருங்கிப் பழகும் வாய்ப்புக் கிடைத்ததற்குச் சாலவும் மகிழ்கின்றேம்.",False
15,வருங்காலத் தமிழ் மக்களுக்கு மட்டற்ற தமிழ்ப்புலமை மிகுந்து வருமென்பதற்குச் சான்றாக இவர் இளமையிலேயே நுண்மாண் நுழைபுலம் உடையராயிருப்பது களிப்பூட்டுகிறது.,False
16,"மற்றும் தாய்மொழிப் பற்றுக் குறைந்த இக்காலத்தில், இவர் தமது நுண்ணறிவைத் தமிழ் நூல்களில் முற்றும் செலுத்தி நன்காராய்ந்துள்ளதும் பாராட்டற்குரியது.",False
17,"பத்துப்பாட்டு, கலித்தொகை, சீவகசிந்தாமணி முதலிய பழந்தமிழ் நூல்களில் ஆராய்ச்சியுடன் கூடிய இவர்தம் அறிவுடைமையே என்னை இவர்பால் மதிப்புறுமாறு செய்தது.",False
18,தமிழாசிரியர்களின் தொகை சுருங்கிவரும் இக்காலத்தில் இவருக்குச் சிறந்த ஊக்கமளித்தால் இவர் ஒரு சிறந்த தமிழாசிரியராவாரென்று நாம் உறுதியாக நம்புகின்றேம்.,False
19,முன்னரே இரண்டாந்தரக் கல்லூரிகளில் தமிழ்கற்பிக்கப் போதுமான அளவு இலக்கண இலக்கியத்திற் சிறந்த தேர்ச்சி பெற்றவராயிருக்கின்றாரெனக் கருதுகின்றோம்.,False
20,வண்ணாரப்பேட்டை மனோன்மணீயம் பெ.,False
21,மொழிஞாயிறு ஞா.,False
22,தேவநேயப் பாவாணர் மறைமலையடிகள் நூற்றாண்டு நினைவு மலர் பக்.,False
23,மறைமலைய மாண்பு நுழைவுரை தனித்தமிழ் என்ற அளவில் முன் நிற்கும் முழுதுரு எழில்வடிவர் தவத்திரு.,False
24,மறைமலையடிகளாரே ஆவர்!,False
25,"முந்தை அடிகள் ஆகிய இளங்கோவடிகள், முத்தமிழ் அடிகள் என முழக்கமிட நின்றார்!",False
26,"இருபதாம் நூற்றாண்டு மறைமலையடிகளோ, தனித்தமிழ்த் தந்தை என்னும் தகவார்ந்த பெருமை பெற்றார்.",False
27,தனித் தமிழ்த் தந்தையார் என்ற பாராட்டும் இப் பாட்டின் தலைப்பில் வழங்கினார்.,False
28,பல்துறை ஆற்றல் அடிகளின் பல்துறை ஆற்றலை .,False
29,"பேராசிரியர், .",False
30,"பெரும் புலவர், .",False
31,"பாவலர், .",False
32,"ஆராய்ச்சியாளர், .",False
33,"மும்மொழிப் புலவர், .",False
34,"மொழிபெயர்ப்பாளர், .",False
35,"சொற்பொழி வாளர், .",False
36,"எழுத்தாளர், .",False
37,"பல்கலைச் செல்வர், .",False
38,தனித்தமிழ்த் தந்தையார் என்று பாவாணர் பகுத்துக் காட்டுகிறார்.,False
39,பனிமலை இமயம் நீல ஆறு நைல் அமைதிவாரி பசிபிக்கு மாகடல்.,False
40,"முத்துக் குமாரசாமி அவர்களும் வகைமைப்படுத்தி வைத்தமை பெரும் பாராட்டுக்கு உரியதாம் அவை, .",False
41,மருத்துவம் .,False
42,மறைபொருள் .,False
43,இலக்கியம் .,False
44,இதழ்கள் .,False
45,சங்க இலக்கியம் .,False
46,பாடல் .,False
47,நாடகம் .,False
48,புதினம் .,False
49,கடிதம் .,False
50,கட்டுரை .,False
51,சமயம் .,False
52,தத்துவம் .,False
53,வரலாறு .,False
54,சமூக இயல் என்பன.,False
55,"அடிகளார் வரலாறு கீழ்கடல் சார் நாகப்பட்டினத்தைச் சார்ந்த சிற்றூர் காடம்பாடி, ஆங்கு வாழ்ந்த அருந்தவப் பெருந்தகையர் சொக்கநாதர் சின்னம்மையார்!",False
56,இவ்விணையர் கொடையாய்த் தமிழன்னை செய்த தவப் பேற்றால் பிறந்தவர் வேதாசலம்.,False
57,பிறந்த பெரு மங்கல நாள் கி.பி.,False
58,"சொக்கநாதர், சித்தமலம் அறுவித்த சித்தமருத்துவர் அறிவ மருத்துவம் என்பதும் அது.",False
59,அத்தொழில் அவர்க்கு வளத்தை வழங்கியது.,False
60,அதனால் வேதாசலம் குறைவற வாழ்ந்தார்.,False
61,நாகப்பட்டினத்து வெசிலியன் மிசன் பள்ளியில் ஐந்து வகுப்புவரை பயின்றார் சிறந்த மாணவராக விளங்கினார்.,False
62,"ஆறாம் வகுப்பில் சேரும் நிலையில், அருமைத் தந்தையார் இயற்கை எய்தினார்.",False
63,ஆயினும் அன்னையார் உறுதியால் கல்வியைத் தொடர்ந்தார்.,False
64,அப்பள்ளியில் ஆங்கிலக் கல்விக்கு இருந்த முதன்மை தமிழுக்கு இல்லை.,False
65,கிறித்தவ சமயம் பற்றி அன்றிச் சிவனியம் பற்றி அறிய வாய்ப்பில்லை என்னும் இரண்டு குறைகளையும் இளமையிலேயே உணர்ந்தார்.,False
66,"வீட்டிலேயே தமிழ் நூல்களைப் பயின்று முதற் குறையையும், நாகையில் இருந்த இந்துமதாபிமான சங்கம் வழி இரண்டாம் குறையையும் நீக்கினார்.",False
67,பள்ளியிலும் குறையறக் கற்றார்.,False
68,ஆதலால் அவரிடம் தனியே இலக்கிய இலக்கண சமய நூல்களைக் கற்றார்.,False
69,நாராயணரின் முன்னை மாணவர் பேரா.,False
70,மனோன்மணீயம் பெ.,False
71,சுந்தரனார் என்பதையும் அறிந்தார்.,False
72,ஒன்பதாம் வகுப்பொடு பள்ளிக் கல்வியை நிறுத்தித் தனிக்கல்வியே கற்றார்.,False
73,"தொல்காப்பியம், தொகை நூல்கள், திருக்குறள், திருச்சிற்றம்பலக் கோவை, இறையனார் அகப் பொருள் எனக்கற்றார்.",False
74,அவ்வாண்டு கி.பி.,False
75,"அவர் பொழிவில் வந்த கருத்தொன்றனை மறுத்து ஒருவர் எழுத, அதற்கு மறுப்பாக முருகவேள் என்னும் புனைபெயரில் மறுப்புரை எழுதினார்.",False
76,"அதனைக்கற்ற நாயகர், மீளப் பொழிவுக்கு வருங்கால் முருக வேளைச் சந்திக்க விரும்பினார்.",False
77,அச்சந்திப்பின் பயனே உன்னை விரைவிலே சென்னைக்கு வருவிப்போம்.,False
78,நீ அந்தப் பக்கங்களில் இருப்பதே நல்லது என்று கூறினார்.,False
79,இதுவே அடிகளார்க்குச் சென்னை வாழ்வு அமைய முதல் தூண்டல் ஆயிற்று.,False
80,அடிகளுக்குப் பதினேழாம் வயதில் திருமணம் நிகழ்ந்தது.,False
81,துணைவி தம் மாமன் மகள் சவுந்தர வல்லி என்பார்.,False
82,திருவனந்தபுரம் நாராயணசாமி அவர்களின் முன்னை மாணவராம் பேரா.,False
83,சுந்தரனார் திருவனந்த புரத்தில் இருந்தார்.,False
84,"அவரியற்றிய மனோன்மணீய நாடக நூல் கற்று அதன் அருமை கண்டு, பேராசிரியரைக் காணவிரும்பினார்.",False
85,அதனால் தம் ஆசிரியரோடு திருவனந்தபுரம் சென்று பேராசிரியரோடு உரையாடினார்.,False
86,வேதாசலனார் இளம் பருவத்தையும் மூதறிவையும் அறிந்த சுந்தரனார் வியப்புற்றுத் தகுதிச் சான்று ஒன்று வழங்கினார்.,False
87,சிறிது காலம் திருவனந்த புரத்தில் ஆசிரியப் பணியும் செய்தார்.,False
88,அவ்விடத்தின் பருவநிலை ஒவ்வாமையால் நாகைக்கே திரும்பினார்.,False
89,அதுகால் தமிழ்த்துறைத் தலைவராக இருந்தவர் வி.கோ சூரியநாராயண சாத்திரியார் என்னும் பரிதிமால் கலைஞர்.,False
90,கல்லூரி முதல்வர் வில்லியம் மில்லர் என்பார்.,False
91,.. இல் வேதாசலனார் பணியேற்றார்.,False
92,அங்குப் பதின்மூன்று ஆண்டுகள் பணியாற்றியுள்ளார்.,False
93,அக்கல்லூரிக் காலத்தே இளங்கலை மாணவர்க்குப் பாடமாக இருந்த முல்லைப்பாட்டு பட்டினப்பாலை என்பவற்றுக்கு ஆராய்ச்சி உரை எழுதினார்.,False
94,ஒரு பாடம் விருப்பப்பாடம் எனப்பட்ட பின்னர் அதனைக் கற்க வருவார் எவர்?,False
95,"தமிழ் கற்கும் மாணவர் எண்ணிக்கை குறையவே ஆசிரியப் பணியிடமும் குறைய வேண்டுவதாகி, அடிகளார் ..",False
96,ஆம் நாளுடன் கல்லூரிப் பணியை முடிக்க வேண்டிய தாயிற்று.,False
97,"மாணவர் இக்காலத்தில் அடிகளின் மாணவராக இருந்தாருள், தணிகைமணி செங்கல்வராயர், இரசிகமணி டி.கே.சி, நாவலர் ச.சோ.",False
98,"பாரதி, பேரறிஞர் ச.",False
99,வையாபுரியார் முதலோர் சிலர்.,False
100,"தணிகைமணியின், தேவார திருவாசகச் சொல்லடைவு ஒரு பிறப்பளவில் செய்யக் கூடியதா?",False
101,நாவலர் ச.,False
102,பாரதியாரின் ஆய்வுத் துணிவு எத்தனை கசடுகளை நீக்கியது?,False
103,"புறத்திரட்டு, களவியல், காரிகை ஆயவற்றின் பதிப்புச் சிறப்பு என்ன?",False
104,இவர்கள் பணியும் அடிகளாரைத் தழுவுதல் உண்மை தானே!,False
105,"சமரச சன்மார்க்கம் கல்லூரிப் பணியில் இருந்து வீடுபெற்ற அடிகளார், பல்லவபுரத்தை வாழ்விடமாகக் கொண்டார்.",False
106,சமரச சன்மார்க்க நிலையம் தோற்றுவித்தார்.,False
107,பல்லவுரம் புகுந்த பின் திரிபுர சுந்தரி பிறக்கப் பதின்மன் குடும்பம் ஆயிற்று.,False
108,இந்நிலையிலேயே ..இல் சைவத் துறவியர்க்குரிய துறவாடை காவி கொண்டு சுவாமி வேதாசலம் ஆனார்.,False
109,சுவாமி வேதாசலம் என்பதன் தனித்தமிழாக்கமே மறைமலையடிகள் என்பது வெளிப்படை.,False
110,முன்னேயே அவரை அடிகள் என்றது அவர்தம் மாண்பு கருதியேயாம்.,False
111,மீள்பார்வை நாம் மீள்பார்வை ஒன்றுபார்க்க வேண்டும்.,False
112,அடிகள் ஆம் அகவையிலேயே தனித்தமிழ் ஆய்வுத்திறம் கைவரப் பெற்றார்.,False
113,அவ் வெளிப்பட்ட நிலையும் உடனே பற்றிப் படரவில்லை!,False
114,ஒன்றே ஆயினும் தனித்தமிழ் உண்டா?,False
115,"நூலகம் அடிகள் நூற்றொகை, அருமணிக் குவையன்ன நாலாயிரம் நூல்களைக் கொண்டது.",False
116,முதல் வரை முதற்பதிப்பாக வெளிவந்தவை.,False
117,அவற்றுள் படிகள் கிட்டுதற்கு அரியவையும் உண்டு.,False
118,முன்னறிவிப்புத் திட்டப்படி நூலுக்கு ஆர்வமாய்ப் பணம் செலுத்தியோர்க்கும் நூல் காலத்தில் கிட்டா உளைச்சல் இல்லாமல் போகாதே!,False
119,"அவர்களும் அமைந்து தாங்கல், இயற்கை இயங்கியல் வழியதாம்.",False
120,முன்னை வந்த முதற்பகுதி பேரிழப்பாக்கியும் அதன் பின்னைப் பகுதிகளையும் அரிதின் முயன்று வெளியிட்டது!,False
121,மொழிஞாயிறு பாவாணர் ஈழத்து அறிஞர் ந.சி.,False
122,"கந்தையா வரலாற்றறிஞர் சாமிநாத சர்மா, உரைவேந்தர் ஔவை சு.து நாவலர் ந.மு.வே பண்டித வித்துவான் தி.வே.",False
123,கோபாலர் சாமி சிதம்பரனார் மயிலை சீனி.,False
124,வேங்கட சாமியார் பேரறிஞர் க.,False
125,"மறைமலைய மாண்பு மறைமலையம், தனித்தமிழ் இயக்கம்!",False
126,தமிழ்த் தனிப் பெருவளம்!,False
127,முத்தமிழ்ச் சுரப்பு!,False
128,சீர்திருத்தச் செழுமை!,False
129,வாழ்வியல் வளம்!,False
130,கலைச் சொல்லாக்கக் களஞ்சியம்!,False
131,பண்டைத் தமிழர் வரலாற்றுப் புதையல்!,False
132,ஆய்வியல் வழிகாட்டி!,False
133,பொழிவுப் பொலிவு!,False
134,எழுத்தின் எழில்!,False
135,மொழிக் காவல் முனையம்!,False
136,முட்டறுக்கும் முழுதுறு கொடை!,False
137,மீட்டெடுக்கும் மேதகைமை!,False
138,அள்ள அள்ளக் குறையா அணிமணிக் குவியல்!,False
139,எனல் மெய்மை விளக்கமாம்!,False
140,புத்தகம் ஏற்றுப் பொலிவதே புத்தகம் வாழிய நலனே!,False
141,வாழிய நிலனே!,False
142,"திருவள்ளுவர் நிலையம், இன்ப அன்புடன் , இராமன் தெரு, இரா.",False
143,"இளங்குமரன் திருநகர், மதுரை .",False
144,மலைக்க வைக்கும் மறைமலையம்!,False
145,உலகம் முழுதும் இவ்வுண்மை உணரப்பட்டுள்ளதை வரலாறு காட்டுகிறது.,False
146,பாவாணரை அறிவுலகம் சரியாக அடையாளம் காண்பதற்குக் காரணமானது மறைமலையடிகளார் தந்த பாராட்டு!,False
147,மறைமலையடிகள் .. .. தேவநேயப் பாவாணர் .. .. இருவரும் தனித்தமிழியக்கத்தைத் தாங்கி நிற்கும் தூண்களாகப் போற்றப்படுபவர்கள்.,False
148,"மறைமலையடிகளார் இல் தோற்றுவித்த தனித்தமிழ் இயக்கம், நூற்றாண்டை எட்டியுள்ள மகிழ்வான நேரம் இது!",False
149,தனித்தமிழ் இயக்க அறிஞர்களும் ஆர்வலர்களும் அடிகளாரின் அரிய படைப்புகள் பலவற்றையும் தேடித்தேடி வழங்கி வழிகாட்டினர் வலிமையூட்டினர்.,False
150,மறைமலையடிகளார் ஆம் ஆண்டிலிருந்து எழுதி வந்துள்ளார்.,False
151,அறிவுக்கடல் ஞானசாகரம் இதழை ஆம் ஆண்டிலிருந்து வெளியிட்டு வந்துள்ளார்.,False
152,அவரின் படைப்புகள் பெருவெள்ளமாய் வெளிவந்திருக்கின்றன.,False
153,"அச்சேறாதவை, பெயர் கூடக் கேட்டறியாதவை, பெயர் தெரிந்தும் பார்வைக்குக் கிட்டாதவை எனப் பலவகையாய்க் கிடைத்தன அடிகளாரின் அரும்படைப்புகள்!",False
154,"அவற்றை மறைமலையம் எனும் தலைப்பில் தொகுப்புகளாக ஒருசேரப் பார்க்கும்போது, தமிழுலகம் வியப்படைவது உறுதி.",False
155,மொழிநலம் இனநலம் பேணுதல் அன்றோ முழுநலம் பெறுவழி!,False
156,நாம்பெறல் என்றோ?,False
