Line Number,Sentence
2447,"தத்தங் கிளவியைத் தம்மிற்றாம் கேட்ப ரென்றலை விதந்தோத வேண்டாமையின், தலைவனுந் தலைவியுங் கேட்ப ரென்னாரா யினார்."
2448,"எனவே தலைவன் கூறப் பரத்தை கேட்டலுந் தலைவி கூறப் பரத்தை கேட்டலு முதலியவற்றுள், புலனெறி வழக்கிற்கு ஏலாதன விலக்கப்பட்டன."
2449,உம்.
2450,விளங்குதொடி முன்கை வளைந்துபுறஞ் சுற்ற நின்மார் படைதலி னினிதா கின்றே அகம்.
2451,இது தலைவி கூற்று.
2452,தலைவன் கேட்டது.
2453,வருந்தா தேகுமதி வாலெயிற் றோயே நற்றிணை.
2454,இது தலைவன் கூற்று.
2455,தலைவி கேட்டது.
2456,நின்கேள் புதுவது பன்னாளும் பாராட்ட யானு மிதுவென் றுடைத்தென வெண்ணி யதுதேர கலி.
2457,"எனவும், தண்டா ரகலமு முண்ணுமோ பலியே குறுந்."
2458,"எனவும், எல்லீரும் என்செய்தீர் என்னை நகுதிரோ கலி."
2459,எனவும் இவை தோழியும் பாணனும் செவிலியும் அறிவருங் கேட்பத் தலைவி கூற்று வந்தது.
2460,இடிக்குங் கேளிர் நுங்குறை யாக குறுந்தொகை.
2461,"எனவும், எலுவ சிறாஅ ரேமுறு நண்ப குறுந்தொகை."
2462,"எனவும், ஊர்க பாக வொருவினை கழிய அகம்."
2463,"எனவும், பேரமர் மழைக்கண் ணின்றோழி செய்த வாரஞர் வருத்தங் களையா யோவென எனவும், சான்றவிர் வாழியோ சான்றவிர் கலி."
2464,"எனவும், இவை பார்ப்பானும் பாங்கனும் பாகனும் தோழியும் கண்டோரும் கேட்பத் தலைவன் கூற்று நிகழ்ந்தன."
2465,இள் தலைமகள் கூற்றினையும் தலைமகன் கூற்றினையும் கேட்போர் யார்?
2466,என நினையுங்கால் கூற்று நிகழ்த்தற் குரியராக முன்னர்க் கூறப்பட்ட பன்னிருவருள் தலைவன் தலைவியல்லாத ஏனைப் பதின்மரும் எறு.
2467,தலைவன் தலைவி இருவரும் ஒருவருக்கொருவர் கூறுவன தம் கூற்றேயாதலின் அக்கூற்றினைத் தாம் கேட்பர் என விதந்து கூறவேண்டிய இன்றியமையாமையில்லை.
2468,"கேட்போர் என்னும் உறுப்பாவது, இக்கூற்றினைக் கேட்போர் இன்னார் எனச் செய்யுளுட் புலப்பட நின்ற அமைப்பாகும்."
2469,.
2470,பார்ப்பார் அறிவர் என்றிவர் கிளவி யார்க்கும் வரையார் யாப்பொடு புணர்ந்தே.
2471,இளம்பூரணம் என்எனின்.
2472,பார்ப்பாரும் அறிவருங் கூறுங் கூற்றுக் கேட் போரை உணர்த்துதல் நுதலிற்று.
2473,"யார்க்கும் வரையா, ரென்ற தனை, எச்சப்படுத்துச் சிலர்க்கு வரையப்படுமென்பது கொள்க. என்னை?"
2474,நச்சினார்க்கினியம் இதுவுமது.
2475,இனி வரையாரென்றதனை யெச்சப்படுத்துச் சிலர்க்கு வரையப்படு மென்று கொள்க.
2476,அவை பார்ப்பார் கூற்றுந் தலைவனுஞ் செவிலியும் நற்றாயுங் கேட்பினல்லது பிறர்கேட்டற் கேலாமையும்.
2477,எனவே தலைவி அறிவர்வாயிலாயவழி மறாமையும் புறத்திணைத் தலைவர்க்கு மவ்வாறே அவர்வழி நிற்றல்வேண்டு மென்பதூங் கூறிற்று.
2478,அறிவராவார் முக்காலமு முணர்ந்தோரும் புலநன்குணர்ந்த புலமையோரும்.
2479,உம்.
2480,கூறிய வற்றுள்ளும் பிறவற்றுள்ளுங் காண்க.
2481,"ஆய்வுரை இது, பார்ப்பார், அறிவர் கூற்றினைக் கேட்போர் இன்னார் என்கின்றது."
2482,"இள் பார்ப்பார், அறிவர் என்போர் கூறுங்கூற்று கேட்போர் இன்னார் என்று வரையப்படுதல் இல்லை."
2483,அகமும் புறமும் என யாக்கப்படும் செய்யுள் எல்லாவற்றொடும் பொருந்தும் எறு.
2484,"பார்ப்பார் அறிவர் என்னும் இவ்விருதிறத்தார் கூறும் கூற்றினையும் அகத்திணை மாந்தர், புறத்திணை மாந்தராகிய எல்லோருங் கேட்டற்குரியர் என்பதாம்."
2485,பரத்தை வாயில் எனவிரு வீற்றுங் கிழத்தியைச் சுட்டாக் கிளப்புப் பயனிலவே.
2486,இளம்பூரணம் என்எனின்.
2487,இதுவு மொருசார் கூற்றிற்குரியா ரியல்பு உணர்த்துதல் நுதலிற்று.
2488,இள்.
2489,இள் பரத்தையும் வாயில்களுமென்னும் இரண்டு வேறுபாட்டின்கண்ணும் எழுந்த கிளவி கிழத்தி கேட்பாளாகக் கருதிச் சொல்லாக்காற் பயனில எறு.
2490,கிழத்தியைச் சுட்டுதலெனவே பாங்காயினார் கேட்பச் சொல்லினும் அமையுமென்பதாயிற்று.
2491,வாயில்களுந் தலைமகளை ஊடல் காப்ப அல்லது சொல்லாராகலான் தலைமகள் கேட்பாளாகச் சொல்லவேண்டு மென்பது.
2492,சுட்டாக் கிளப்புப் பயனில வென்றதனான் வாயில்கள் கூறுவனவுங் கிழத்திக்குப் பாங்காயின தோழி கேட்பச் சொல்லினும் அமையும்.
2493,அவற்றுக்குச் செய்யுள்.
2494,நச்சினார்க்கினியம் இதுவுமது.
2495,கிழத்தியைச் சுட்டாவெனத் தலைவி பாங்காயினார் கேட்பக் கூறுதலு மமையும்.
2496,உம்.
2497,"ஓருயிர் மாத ராகலி னிவளுந் தேரா துடன்றனண் மன்னே இது வாயில்கள் கூறத் தலைவி கேட்டலும், தோழி கேட்டலுமாம்."
2498,ஆய்வுரை இஃது ஒருசாரார் தமக்குக் கூறிக்கொள்ளும் கூற்றுப் பயனற்றது என்கின்றது.
2499,"கிளப்புகிளத்தல், கூறுதல் ஈண்டுக் கூறப்படும் மொழிமேல் நின்றது."
2500,பரத்தையும் வாயில்களும் ஆகிய ஈரிடத்தும் நிகழும் உரையாடல்கள் கேட்பவள் தலைமகள் எனக்கருதிக் கூறாக்கால் பயனற்றவை.
2501,எனவே அம்மொழி தலைமகட்குப் பாங்காயினார் கேட்பச் சொல்லின் பயனுடையவாம் என்பது பெறப்படும்.
2502,வாயில் உசாவே தம்மு ளுரிய இளம்பூரணம் என்எனின்.
2503,வாயில்கட்குரியதோர் மரபு உணர்த்துதல் நுதலிற்று.
2504,இள் வாயில்கள் உசாவுமிடத்துக் கிழத்தியைச் சுட்டாது தம்முள் உசாவுதலுரித்து என்றவாறு.
2505,உதாரணம் வந்தவழிக் கண்டுகொள்க.
2506,பேராசிரியம் இதுவுமது.
2507,"தம்முளும் என்ற உம்மை எதிர்மறை யாகலான், கேட்குநர் அவரெனப்பட்டவாறன்றித் தம்முள் தாங் கேட்டல் சிறுபான்மை யெனக்கொள்க. நச்சினார்க்கினியம் இதுவுமது."
2508,இள்.
2509,முற்கூறிய அதிகாரத்தாற் றலைவியைச் சுட்டி யொருவரொருவர்க் குரைப்பார்போல வாயில்கள் தம்முட் கூறவும் பெறும்.
2510,எறு.
2511,அவையுந் தலைவிகேட்பவென தண்ணந் துறைவன் கொடுமை நம்மு ணாணிக் கரப்பா டும்மே குறுந் இது பாடினி பாணர்க்குரைத்தது.
2512,உம்மை யெதிர்மறையாகலின் கேட்குந ரவரெனப்பட்டவரன்றித் தம்முட் டாங்கேட்டல் சிறுபான்மையாம்.
2513,"ஆய்வுரை இது, வாயில்கட் குரியதோர் மரபு கூறுகின்றது."
2514,உதாரணம் பேராசிரியருரையிற் காண்க.
2515,உசாவுதல் உரை யாடுதல்.
2516,தம்முளும் என்புழி உம்மை எதிர்மறையால் தமக்குள்தாம் உரையாடுதல் சிறுபான்மை என்பதாம்.
2517,.
2518,இளம்பூரணம் என் எனின்.
2519,இதுவுங் கேட்டற் பொருண்மைக்கண் வருவதோர் மரபு வழுவமைத்தலை உணர்த்துதல் நுதலிற்று.
2520,ஆங்கு அசை.
2521,கலித்.
2522,மாதர் முகம்போல் ஒளிவிட வல்லையேற் காதலை வாழி மதி.
2523,குறள்.
2524,உறுதி தூக்கத் தூங்கி அறிவே சிறிதுநனி விரையல் என்னும் ஆயிடை நற்றிணை.
2525,சிலப்.
2526,கானல் இதனுட் கடலுங் கானலும் புள்ளு மரனுங் கூறப்பட்டது.
2527,"மாலைநீ, தையெனக் கோவலர் தனிக்குழல் இசைகேட்டுப் பையென்ற நெஞ்சத்தோம் பக்கம்பா ராட்டுவாய் வருந்தினை வாழிய நெஞ்சே அகம்."
2528,பிறவு மென்றதனான்.
2529,எனவும் இந்நிகரன கொள்க.
2530,இத்துணையுங் கூறப்பட்டது கேட்போ ரியல்பு.
2531,"பேராசிரியம் இது, கேளாதென சில பொருள், கேட்பனவாகப் பொருளிலுயல் வழுவமைக்கப்பட்டனவற்றை இலக்கணவகையாற் கூறுவனவும் கேட்குநவும் ஆகற்கண்ணும் ஆராய்கின்றானென்பது."
2532,பிறவு மென்றதனால் புல் புதல் முதலியன கொள்க.
2533,நச்சினார்க்கினியம் இது கேட்போருங் கூற்றும் வேறுபட வருமாறு கூறுகின்றது.
2534,அவை பொருளியலுள் வழுவமைதி கூறுவனவுங் கேட்குநவுமாய் ஈண்டு வருதலின் ஆராய்கின்றார்.
2535,இள்.
2536,கூற்றும் உடன்கூறினார் மேற்கூற்றிற்குரியன இவையென் வரையறாமையின்.
2537,"பொழுதாவன மாலையும், யாமமும், எற்பாடும், காரும், கூதிரும், பனியும், இளவேனிலும் போல்வன."
2538,பிறவுமென்றதனால் புல்லும் புதலும் முதலியனவுங்கொள்க.
2539,உம்.
2540,...
2541,...
2542,...
2543,மாலை கலி நீ காணவும் பெற்றாயோ காணாயோ மடநெஞ்சே கலி எனவரும்.
2544,புள்ளெனவே வண்டு முதலியனவும் அடங்கும்.
2545,அம்மெ னிணர வடம்புகா ளன்னங்காள் சிலப்கானல் ஒழிந்தன வந்துழிக்காண்க.
2546,"ஆய்வுரை இது, கேட்டற் பொருண்மைக்கண் வருவதோர் மரவு வழு அமைக்கின்றது."
2547,ஏகாரம் எண்ணுதற் பொருளில் இடையிட்டு வந்தமை காண்க.
2548,கேளாதன சில பொருள்கள் கேட்பனவாகவும் மறுத்துரைப் பனவாகவும் செய்யுந் திறமில்லாதன செய்வனவாகவும் பொருளியலுள் வழுவமைக்கப்பட்டன.
2549,அவற்றுட் சில இலக்கண வகையாற் கூறுவனவும் கேட்பனவுமாகச் செய்யுள் செய்தலும் புலனெறி வழக்கமாம் என்பதுணர்த்துவார்.
2550,நுதலிய நெறியாற் சொல்லுந போலவும் கேட்குந போலவும் சொல்லி யாங்கு அமையும் என்மனார் புலவர் என்றார் ஆசிரியர்.
2551,உதாரணம் முன்னுரைகளிற் காட்டப்பெற்றன.
2552,.
2553,ஒருநெறிப் பட்டாங் கோரியல் முடியுங் கரும நிகழ்ச்சி இடமென மொழிப.
2554,இளம்பூரணம் என்எனின்.
2555,நிறுத்த முறையானே இடமாமாறு உணர்த்து தல் நுதலிற்று.
2556,"இள். ஒருவழிப்பட்டு ஓரியல்பாக முடியும் வினை நிகழ்ச்சி இடமென்று சொல்லுவர் என்றவாறு. நிகழ்ச்சி, நிகழ்ந்தவிடம்."
2557,ஒருநெறிப் புறமாயினும் ஒரு பொருண்மேல் வருதல்.
2558,ஓரியல் களவென்றானும் கற் பென்றானும் அவற்றின் விரிவகையில் ஒன்றானும் பற்றி வருதல்.
2559,புறத்தின்கண் நிரைகோடலானு மீட்டலானு மேற்செலவானும் எயில் வளைத்தலானும் யாதானுமோ ரியல்புபற்றி வருதல்.
2560,கரும யாதானு மொரு வினை நிகழுமிடம் இன்னுங் கருமநிகழ்ச்சி என்றதனால் தன்மை முன்னிலை படர்க்கை யென்பனவுங் கொள்ளப்படும்.
2561,செல்லாமை உண்டேல் எனக்குரை மற்றுநின் வல்வரவு வாழ்வார்க் குரை குறள் என்றவழிப் பிரிவுப் பொருண்மை நிகழும் இடமாயிற்று.
2562,ஒருநெறிப்படாதும் ஓரியன் முடியாதும் வருமிடம் வழுவாம்.
2563,"அஃதாவது, தலைமகளொடு புணர்தல்வேண்டித் தோழியை யிரந்து குறையுறுவான் அவ்விடத்திற்குத் தக்கவுரை கூறாது தன்னாற்றலும் பிறவுங் கூறுதல்."
2564,நாலடி.
2565,இதனானு மறிக.
2566,"அன்றியும், நெடும்புனலுள் வெல்லு முதலை அடும்புனலுள் நீங்கி னதனைப் பிற குறள்."
2567,இதுவும் இடனறிதல்.
2568,உண்ணற்க கள்ளை உணிலுண்க சான்றோரால் எண்ணப் படவேண்டா தார்.
2569,குறள்.
2570,இது தன்மையானையும் முன்னின்றானையும் ஒழித்துப் படர்க்கையானைத் தொழிற்படுத்துதல்.
2571,உண்ணற்க வென்னும் படர்க்கைச்சொல் படர்க்கைப் பெயரொடு முடிந்தது.
2572,பிறவு மன்ன.
2573,"பேராசிரியம் இஃது, களனெனப்பட்ட உறுப்புணர்த்துகின்றது."
2574,இள் பலவும் ஒருவழிப்பட்டு ஓரிலக்கணத்தான் முடியுங் கருமநிகழ்ச்சியை இடமென்று கூறுப எறு.
2575,இடமெனினுங் களமெனினும் ஒக்கும்.
2576,ஒரு செய்யுட்கேட்டால் இஃது இன்னவிடத்து நிகழ்ந்ததென்று அறிதற்கேதுவாகிய தோர் உறுப்பினை இடமென்றானென்பது.
2577,கருமநிகழ்ச்சி யென்பது காமப்புணர்ச்சி யென்னுஞ் செயப்படு பொருணிகழ்ச்சி அஃது இடமெனப்பட்டது. இது வினைசெய்யிடம் நிலமாயின முன்னர்த் திணையெனப்பட்டது.
2578,அவை மேற்கூறிய வகையானே கண்டுகொள்க.
2579,நச்சினார்க்கினியம் இஃது களமெனப்பட்ட வுறுப்புக் கூறுகின்றது.
2580,இள் பலவும் ஒருவழித் தொக்கவற்றுக்கெல்லாம் ஓரிலக் கணத்தான் முடியுங் கருமநிகழ்ச்சியை யிடமென்று கூறுப.
2581,எறு.
2582,களமெனினும் இடமெனினு மொக்கும்.
2583,அது ஒருசெய்யுட் கேட்டால் இது இன்ன இடத்து நிகழ்ந்ததென் றறிதற்கு ஏதுவாயதோ ருறுப்பு.
2584,கரும நிகழ்ச்சியென்பது காமப்புணர்ச்சியென்னுஞ் செயப்படுபொருணிகழ்ச்சி.
2585,இது வினைசெயிடம்.
2586,எலுவ சிறாஅர் குறுந் கேளிர் வாழியோ குறுந் என்பன பாங்கற் கூட்டமிடனாக ஒருவழிப்பட்டன.
2587,பிறவு மன்ன.
2588,"இது புறத்திணைக்கு மொக்கும். ஆய்வுரை இது, நிறுத்தமுறையானே செய்யுட்குரிய களன் என்னும் உறுப்பு உணர்த்துகின்றது."
2589,இள் ஒருநெறிப்பட்டு ஓரியல்பாக முடியும் கரும நிகழ்ச்சி இடம் எனப்படும் எறு.
2590,"ஒருநெறிப்படுதலாவது, அகத்திணை புறத்திணை என்ப வற்றுள் ஏதேனும் ஒருதிணைக்கண் வருதல்."
2591,இது வினைசெய்இடம் எனப்படும்.
2592,"இனி, கருமநிகழ்ச்சி யென்றதனால் அந்நிகழ்ச்சிக்கு நிலைக்களமாகிய தன்மை முன்னிலை படர்க்கை என்பனவும் இடமெனக் கொள்ளப்படும்."
2593,.
2594,இறப்பே நிகழ்வே எதிர தென்னுந் திறத்தியல் மருங்கில் தெரிந்தனர் உணரப் பொருள்நிகழ வுரைப்பது கால மாகும்.
2595,இளம்பூரணம் என்எனின்.
2596,நிறுத்தமுறையானே காலமாமாறு உணர்த்துதல் நுதலிற்று.
2597,இள் இறந்தகாலம் நிகழ்காலம் எதிர்காலமெனக் கூறப் பட்டியலும் பக்கத்தின் ஆராய்ந்து நோக்குமாறு பொரு ணிகழ்ச்சியைக் கூறுவது காலமாகும் என்றவாறு.
2598,"பேராசிரியம் இது, கால முணர்த்துகின்றது."
