Line Number,Sentence
1,விருத்தாசலம் பதிப்பாளர் கோ.
2,விருத்தாசலம் பதிப்பாளர் கோ.
3,இளவழகன் முதற்பதிப்பு தாள் . கி.
4,என்.எஸ்.மேப்லித்தோ அளவு தெம்மி எழுத்து புள்ளி பக்கம் நூல் கட்டமைப்பு இயல்பு சாதாரணம் விலை உருபா.
5,"படிகள் நூலாக்கம் பாவாணர் கணினி தி.நகர், சென்னை ."
6,அட்டை வடிவமைப்பு மு.
7,"இராமநாதன், வ."
8,"மலர் அச்சிட்டோர் வெங்கடேசுவரா ஆப்செட் பிரிண்டர்ஸ் ஆயிரம் விளக்கு, சென்னை ."
9,"வெளியீடு தமிழ்மண் பதிப்பகம் , சிங்காரவேலர் தெரு, தியாகராயர்நகர், சென்னை ."
10,தொ.பே.
11,நாவலர் ந.மு.
12,வேங்கடசாமி நாட்டார் ஆம் ஆண்டு நினைவு வெளியீடு வல்லுனர் குழு .
13,முனைவர் கு.திருமாறன் .
14,முனைவர் இரா.கலியபெருமாள் .
15,பேராசிரியர் சண்முக.மாரி ஐயா .
16,பேராசிரியர் நா.பெரியசாமி .
17,முனைவர் பி.தமிழகன் .
18,அதுகாரணமாக நாட்டார் ஐயா அவர்கள் தாமே பயின்ற தமிழ்ப் பேராசான் என்று நாட்டு மக்களால் அன்புடன் அழைக்கப் பெற்றார்.
19,கல்லூரியில் இல் பணியில் சேர்ந்து வரை இருபத்து இரண்டு ஆண்டுகள் தமிழ்ப் பேராசிரியராகப் பணிபுரிந்தார்.
20,அக்கல்லூரி இல் மூடப்பெற்றது.
21,நாட்டார் ஐயா அவர்கள் தம்முடைய வாழ்நாளில் அறிஞர் பெருமக்களால் மிகுதியும் மதிக்கப்பெற்றார்.
22,மறைமலை அடிகளாரின் மகள் நீலாம்பிகை அம்மையாரின் கணவர் திருவரங்கனார் ஆவார்.
23,தொண்டை மண்டலத்தில் வாழ்ந்த குடிமக்களுள் சேக்கிழார் வழிவந்த தொண்டை மண்டல முதலியார்கள் இன்றைக்கும் பெருஞ்சிறப்புடன் வாழ்ந்து வருகின்றனர்.
24,இல் சென்னை மாகாணத் தமிழர் மாநாட்டில் நாட்டார் ஐயா அவர்களுக்கு நாவலர் என்னும் பட்டம் வழங்கப்பெற்றது.
25,அக்கோயில் நாட்டார் திருக்கோயில் என்று தமிழன்பர்களால் பெருமையுடன் அழைக்கப் பெறுகின்றது.
26,"இவ்வாறு நாட்டார் ஐயா அவர்கள் இல் நிறுவ விரும்பிய திருவருள் கல்லூரி, ஆண்டுகள் கழிந்ததற்குப் பிறகு நாவலர் ந.மு."
27,"அவை, பின்வருமாறு ."
28,திரிகடுகம் ந.மு.வே.உரை .
29,மணிமேகலை வரலாறு .
30,தொல்காப்பிய ஆராய்ச்சிச் சொற்பொழிவுகள் .
31,நாவலர் நாட்டார் நாட்குறிப்பு முதலியனவாம்.
32,"இவ்வாறு, நாட்டார் ஐயா அவர்கள் எழுதிய நூல்கள் வெளிவந்த ஆண்டுகளைப் பற்றிய விவரம் வருமாறு ."
33,வேளிர் வரலாற்று ஆராய்ச்சி .
34,நக்கீரர் .
35,கபிலர் .
36,கள்ளர் சரித்திரம் .
37,இன்னா நாற்பது .
38,களவழி நாற்பது .
39,கார் நாற்பது .
40,ஆத்திசூடி .
41,கொன்றை வேந்தன் .
42,வெற்றி வேற்கை .
43,மூதுரை .
44,நல்வழி .
45,நன்னெறி .
46,கண்ணகி வரலாறும் கற்பு மாண்பும் .
47,சோழர் சரித்திரம் .
48,பரஞ்சோதி முனிவர் திருவிளையாடல் புராண உரை .
49,அகத்தியர் தேவாரத் திரட்டு உரைத்திருத்தம் .
50,தண்டியலங்காரப் பழைய உரைத்திருத்தம் யாப்பருங்கலக்காரிகை உரைத்திருத்தம் .
51,கட்டுரைத் திரட்டு முதல் தொகுதி .
52,சிலப்பதிகார உரை .
53,மணிமேகலை உரை .
54,அகநானூறு உரை .
55,கட்டுரைத் திரட்டு இரண்டாம் தொகுதி .
56,நாவலர் ந.மு.வேங்கடசாமி நாட்டார் இலக்கணக் கட்டுரைகள் .
57,நாவலர் ந.மு.வேங்கடசாமி நாட்டார் இலக்கியக்கட்டுரைகள் .
58,நாவலர் ந.மு.வேங்கடசாமி நாட்டார் சொற்பொழிவுக் கட்டுரைகள் .
59,"அவர் மொழிஞாயிறு தேவநேயப் பாவாணர், திரு.வி.க., யாழ்ப்பாணத்துத் தமிழ் அறிஞர் ந.சி.கந்தையா பிள்ளை, வெ.சாமிநாத சர்மா, சாத்தான்குளம் அ."
60,"இராகவன், பன்மொழிப்புலவர் கா."
61,அப்பாத்துரையார் முதலிய தமிழறிஞர்களின் நூல்கள் மற்றும் தொல்காப்பிய பழைய உரைகள் அனைத்தையும் முழுமையாக வெளியிட்ட பெருமைக்குரியவர்.
62,அவர் இப்பொழுது நாட்டார் ஐயா அவர்களின் நூல்கள் அனைத்தையும் ஒரு சேர வெளியிடுவது மிகவும் துணிவான செயல் ஆகும்.
63,அவரது இந்த முயற்சி இமயமலையைப் பெயர்த்தெடுத்துக் கொண்டுபோய் வங்காள விரிகுடாவில் வைப்பது போன்ற அரிய பெரிய முயற்சி ஆகும்.
64,"அவர் வாழ்க, அவர் முயற்சி வெல்க என்று நான் வாயார மனமார வாழ்த்துகின்றேன்."
65,".. பேராசிரியர் பி.விருத்தாசலம் நிறுவனர் நாவலர் ந.மு.வேங்கடசாமி நாட்டார் திருவருள் கல்லூரி, கபிலர் நகர், வெண்ணாற்றங்கரை, தஞ்சாவூர் ."
66,தொ.பேசி அணிந்துரை .
67,புராண இலக்கியம் தமிழில் தோன்றி வளர்ந்துள்ள இலக்கிய வகைகளில் புராணம் என்பதும் ஒன்றாகும்.
68,"புராணம் என்ற சொல்லிற்குப் பழமை, தொன்மை என்பது பொருள்."
69,.
70,"மிகப் பழைய காலத்தில் நடந்ததாகக் கருதப்படும் கதை விளக்க மாகவும், பழைய நம்பிக்கைகளையும் மரபுகளையும் உரைப்பதாகவும் அமைவது புராணம்."
71,"இவை தெய்வங்கள், முனிவர்கள், அரசர்கள் பற்றிய புனைவுகளாக இலங்குவன."
72,இதிகாசத்துடன் புராணத்தையும் சேர்த்து ஐந்தாம் வேதமாகச் சாந்தோக்கிய உபநிடதத்தில் ஏழாம் இயலில் முதற் காண்டம் சொல்லப்பெற்றது.
73,சுஹ்ருத் நண்பன் சம்மிதை போன்றது என்று பொருள் கூறுவர்.
74,எல்லாப் புராணங்களையும் வேதவியாசரே தொகுத்துச செய்தனர் என்பது ஒரு கருத்து.
75,இவையாவும் நைமிசாரண்யத்தில் இருந்த முனிவர்களுக்குச் சூதன் என்னும் பாடகன் கூறியவை என்பது மற்றொரு கருத்து.
76,புராணங்களை .
77,மகாபுராணம் .
78,உபபுராணம் .
79,தலபுராணம் என்று மூன்று வகையாகப் பாகுபடுத்துவர்.
80,முன்னைய இருவகைப் புராணங்களும் வடமொழியில் தோன்றியவை அவற்றுள் ஒரு சில தமிழில் மொழி பெயர்க்கப்பெற்றவை.
81,"எனின், மூன்றாவதாகக் குறிக்கப் பெற்றுள்ள தலபுராணங்கள் பலவும் தமிழில் மூல இலக்கியமாக முகிழ்த்தவை."
82,இவற்றுள் ஒரு சில வடமொழியில் மொழி பெயர்த்துக் கொள்ளப் பெற்றவை.
83,.
84,பெரும்பாலும் தலத்தின் பெயரினாலேயே புராணங்கள் பெயர் பெற்றன.
85,"எனின், சிராமலை நாதரின் மீது சைவ எல்லப்ப நாவலர் பாடியது செவ்வந்திப் புராணம் ஆகும்."
86,இது தலத்தின் பெயரால் அமையவில்லை.
87,சிராமலையில் திருச்சி மலைக்கோட்டையில் கோயில் கொண்டுள்ள ஈசனுக்கு உகப்பான செவ்வந்தி மலரின் பெயரினால் இப்புராணம் வழங்கப்பெற்றது.
88,தல புராணங்களை மிகுதியாகப் பாடிய சிறப்புக்குரியவர் திரிசிரபுரம் மகாவித்துவான் மீனாட்சி சுந்தரம் பிள்ளை ஆவர்.
89,.
90,இப்படைப்பும் தலத்தின் பெயரால் வழங்கப்பெறாமல் இறைவனின் அற்புத விளையாட்டின் பெயரினால் வழங்கிவருதல் நோக்கத்தக்கது.
91,"மாணிக்கவாசகர், காத்தும் படைத்தும் கரந்தும் விளையாடி என்று இறைவனின் விளையாட்டினைக் குறித்துள்ளார்."
92,இதனை வடமொழிவாணர் லீலை என்று கூறினர்.
93,இதுவே கி.பி.
94,ஆம் நூற்றாண்டின் முற்பகுதியில் வாழ்ந்த பரஞ்சோதி முனிவர்க்கு மூலமாதல் வேண்டும்.
95,"எனினும், தம் நூலுக்கு மூலம் வடமொழியில் ஈசசங்கிதை என்று பாயிரத்தின் தொடக்கத்தில் குறித்துள்ளார்."
96,"சைவப் பெருமக்கள் பெரிய புராணம், திருவிளையாடற் புராணம், கந்தபுராணம் என்ற மூன்றினையும் சிவபிரானின் முக்கண்ணாகப் போற்றுதல் மரபு."
97,இவற்றுள் நடுவணதாகிய திருவிளையாடற் புராணத்தினைப் பாடிய பரஞ்சோதியாரின் புலமைத் திறத்தையும் புராணத்தின் அமைப்பியல் அழகினையும் முதற்கண் சுருக்கமாகக் காண்போம்.
98,.
99,பரஞ்சோதியார் படைப்புக்கள் பரஞ்சோதியார் திருமறைக்காடு எனும் வேதாரண்யத்தில் தோன்றியவர்.
100,இவர்தம் தந்தையார் மீனாட்சி சுந்தர தேசிகர் ஆவர்.
101,இளமையிலேயே பரஞ்சோதியார் செந்தமிழையும் வடமொழியையும் குறைவறக் கற்றார்.
102,"சாத்திர, தோத்திரங்களிலும் தேர்ச்சி பெற்றுச் சிவநேசம் பூண்டு விளங்கினார்."
103,இப்படைப்புக்கள் பரஞ்சோதியாரின் புலமை வளத்திற்கும் கற்பனைத் திறத்திற்கும் படைப்பாற்றலுக்கும் கட்டியங் கூறுவன எனலாம்.
104,.
105,திருவிளையாடற் புராணம் அமைப்பியல் வனப்பு ஒரு பெருங்காப்பியத்திற்குரிய அமைப்பியல் முழுமையும் வாய்க்கப் பெற்ற இலக்கியமாகத் திருவிளையாடற் புராணம் திகழ்கின்றது.
106,"மதுரைக்காண்டம், கூடற் காண்டம், திருவாலவாய்க் காண்டம் என்ற மூன்று காண்டங்களையும் படலங்களையும் இப்புராணம் கொண்டுள்ளது."
107,இப்பாடல்களின் தொகை ஆகும்.
108,"இம்முனிவர், விரிமுறை விருத்தச் செய்யுள் வகைமையால் விளம்பலுற்றேன் என்று இயம்புதல் எண்ணத்தக்கது."
109,இப்புராணத்தின் முதற்பாடல் சத்தியாய்ச் சிவமாகி எனத் தொடங்குவது விநாயகர்க்கு வணக்கம் கூறுவதாய் அமைந்தது.
110,வாழ்த்துச் செய்யுளும் நூற்பயன் நுவலும் பாடலும் தொடர்ந்து வருவன.
111,"பெரும் பாலும் நூற்பயன் கூறுதல் நூலின் முடிவில் இடம் பெறும் எனின், இங்குத் தொடக்கத்தில் இடம்பெறுதல் சுட்டுதற்குரியது."
112,"தொடர்ந்து சிவம், சத்தி உள்ளிட்ட கடவுள் வணக்கப் பாடல்களும், சிவனருட் செல்வராகிய அடியார்க்குரிய பாடல்களும் அமைந்துள்ளன."
113,"பாயிரப் பகுதியின் எச்சமாக நூல் செய்தற்குரிய காரணமும், முறையும், அவையடக்கமும், அரங்ககேறிய வரலாறும் சொல்லப்பெற்றன."
114,இவற்றைப் படிப்பவரின் மனத்தில் சிலப்பதிகாரம் மதுரைக் காண்டத்தில் இளங்கோவடிகள் படைத்துள்ள மதுரை மாநகரின் மாண்புகள் தோன்றுதல் கூடும்.
115,"புராண வரலாறு, தலம், தீர்த்தம், மூர்த்தி விசேடங்களும், புராணச் சுருக்கமாக அமையும் பதிகப் பகுதியும் படித்து மகிழத்தக்கவை."
116,பரம்பொருளே விண்ணகத்தினின்றும் மண்ணகத்தில் தோன்றி நீதிநெறி நிலைபெறவும் யாவரும் இன்புறவும் அரசு புரிந்த திருவிளையாடல்கள் சுட்டத்தகுவன.
117,என வியந்து போற்றுதல் எண்ணி இன்புறத்தக்கது.
118,இறைவன் திருவருட் சிறப்புடன் அருந்தமிழ்ச் சிறப்பும் இப்புராணத்தில் எங்கும் இடம்பெறக் காணலாம்.
119,மூவேந்தரும் செந்தமிழ்மொழியைப் பேணி வளர்த்தனர்.
120,"எனினும், பாண்டியரின் பணியே விஞ்சி நிற்பது."
121,முச்சங்கம் அமைத்துப் புலவர்களைப் புரந்து முத்தமிழ்ப் பணிபுரிந்த பாண்டியரின் சிறப்பு இப்புராணத்தின் பல இடங்களிலும் பரவியும் விரவியும் வந்துள்ளது.
122,தமிழிசையின் தனிப்பெரும் சிறப்பினையும் ஆற்றலையும் விறகுவிற்ற படலத்தில் பரஞ்சோதியார் சுவைபடப் பாடியுள்ளார்.
123,யாழ் நரம்பு யாணரம்பு எனப்புணர்ச்சி பெறுதற்கு வீரசோழிய இலக்கண நூலில் விதியுள்ளது.
124,"பன்றிக்குட்டிக்கு முலை கொடுத்த படலம், பன்றிக் குட்டிகளை மந்திரிகளாக்கிய படலம் என்பன ஆலவாயண்ணலின் அரிய அருள் விளையாட்டிற்குச் சான்றாவன."
125,மாணிக்கவாசகரின் பொருட்டுச் சோமசுந்தரக்கடவுள் புரிந்த திருவிளையாடல்கள் பற்பல.
126,"நரி பரியாக்கிய படலம், பரி நரியாக்கிய படலம், மண் சுமந்த படலம் என்பன எண்ணுதற்குரியன."
127,வந்தி மூதாட்டிக்கு ஏழைபங்காளன் ஆகிய ஈசன் ஏவலனாக மண்சுமந்த திருவிளையாடலையும் பரஞ்சோதியார் பாடியுள்ளார்.
128,திருஞானசம்பந்தர் மதுரைமாநகரில் சமணர்களுடன் சொற்போர் புரிந்து சைவத்தினை நிலைநாட்டிய வரலாற்றினையும் பரஞ்சோதி முனிவர் புராணத்தின் இறுதிப்பகுதியில் பாடியுள்ளார்.
129,"இவர் நோக்கில், மாணிக்கவாசகர்க்குப் பிற்பட்டவராகச் சம்பந்தர் தோன்றுகிறார் எனலாம்."
130,இத்தகைய சீரிய இலக்கியப் படைப்பிற்கு உரைகள் பல எழுந்தன.
131,இத்திறம் பற்றிச் சுருங்கக் கூறலாம்.
132,.
133,அதன்விளைவாக உரைகள் தோன்றலாயின.
134,அவற்றுள் ஒரு சிலவற்றைக் குறிப்பிடுதல் தகும்.
135,மகாவித்துவான் மீனாட்சி சுந்தரம் பிள்ளையின் மாணாக்கர் சோடசாவதானம் சுப்புராயச் செட்டியாரவர்கள் எழுதிய உரை பலராலும் பயிலப் பெற்று வந்துள்ளது.
136,இவ்வுரையினைப் பின்பற்றி ஈக்காடு இரத்தினவேலு முதலியார் பொழிப்புரை எழுதி வெளியிட்டனர்.
137,மதுரைக் காண்டத்திற்கு மட்டும் மதுரை ஞானசம்பந்தப் பிள்ளை என்பார் பொழிப்புரை எழுதினார்.
138,இவர்கள் உரை திருவிளையாடற் புராணத்தின் பொருளைப் புரிந்து கொள்ளுதற்குப் பயன்தந்தன.
139,.
140,நாவலர் ந.மு.வே.
141,உச்சிமேற் புலவர்கொள் நச்சினார்க்கினியர் உள்ளிட்ட உரையாசிரியர்களின் கருத்துக்களையும் இடையிடையே எடுத்துக் காட்டித் தம்உரைக்கு ஆக்கம் சேர்த்தல் இவர்தம் இயல்பு.
142,பாக்களுக்குரிய யாப்பினைச் சுட்டுதலும் அணிகளை விரித்து விளக்குதலும் தனிச்சிறப்பு.
143,பாக்களில் அகன்று கிடக்கும் சொற்களை அணுகிய நிலையில் கொணர்ந்து பொருளியைந்து முடிய உரைவரைதல் சுட்டுதற்குரியது.
144,சைவசித்தாந்தச் செம்பொருளை ஏற்புழி இவர்தம் உரை இயைபுறுத்திக் காட்டுதல் எண்ணி இன்புறத்தக்கது.
