Line Number,Sentence
1,தொழில் நுட்ப வரலாறு நூற்களஞ்சியம் தொகுதி பத்து தமிழ்நாட்டுக் கோயிற் கட்டடக் கலை சாத்தன்குளம் அ.,False
2,இராகவன் சிதைந்து போகும் நிலையில் இருந்த கையெழுத்துப்படியினைப் பெற்று இந்த நூலை முதன்முதலாக வெளியிடுகின்றோம்.,False
3,அமிழ்தம் பதிப்பகம் சாத்தன்குளம் அ.,False
4,இராகவன் நூற்களஞ்சியம் தொகுதி பத்து தமிழ்நாட்டுக் கோயிற் கட்டடக்கலை சாத்தன்குளம் அ.,False
5,இராகவன் பதிப்பாளர் இ.,False
6,"படிகள் நூலாக்கம் மலர், அட்டை வடிவமைப்பு இ.",False
7,"அரசு மற்றும் ஆய்வாளர், இர.",False
8,கடந்த காலத்தில் நூலாசிரியர் சாத்தன்குளம் அ.இராகவன் எழுதிய எட்டு நூல்களை அமிழ்தம் பதிப்பகம் வாயிலாக வெளியிட்டுள்ளோம்.,False
9,எங்களுடைய வேண்டு கோளை ஏற்று மனமுவந்து கையெழுத்துப் படியினை கொடுத்து உதவினார்.,False
10,இதனை முதன் முதலாக வெளியிடுகின்றோம்.,False
11,அரசு அவர்கள் தோன்றாத் துணையாக இருந்து வருகிறார்.,False
12,அவருடைய வழிகாட்டுதலின் பேரில்தான் நூலாசிரியரின் இன்னபிற நூல்களும் வெளிவரு கின்றன.,False
13,இந்த நூல்கள் செப்பமாகவும் நல்ல வடிவமைப்போடும் வருவதற்கு பல்லாற்றானும் துணை இருந்து உதவியவர்.,False
14,"மேலும், அவரே இந்நூல்கள் ஒவ்வொன்றுக்கும் தனித்தனியே மதிப்புரை அளித்துச் சிறப்பு செய்துள்ளார்.",False
15,இவருக்கு எம் நெஞ்சார்ந்த நன்றி என்றும் உரிய தாகும்.,False
16,மரபு கருதி மூல நூலில் உள்ளவாறே வெளியிட்டுள்ளோம்.,False
17,செல்வி இர.,False
18,"பிருந்தாவதி, பேரா.",False
19,அரசு அவர்களின் ஆய்வு மாணவர்.,False
20,இவர் பேராசிரியரின் வழி காட்டுதலோடு பல்வேறு வகையில் பங்காற்றியும் இந் நூல்கள் பிழையின்றி வருவதற்கு மெய்ப்புப் பார்த்தும் உதவினார்.,False
21,செல்வி பிருந்தாவதி அவர்களை நன்றி யுணர்வோடு பாராட்டுகிறேன்.,False
22,திருநெல்வேலி மாவட்டத்தைச் சேர்ந்த புலவர் முத்துராமலிங்கம் அவர்கள் பாவாணர் நூல்கள் வெளியிட்டபோது பல்லாற்றானும் துணையிருந்த பெருமைக்குரியவர்.,False
23,அவர் அண்மையில் மறைந்து விட்டார்.,False
24,"மறைவுக்கு முன்பாக நூலாசிரியரின் தங்கை வீரலக்குமி அம்மையாரிடமும், மகன் இரா.",False
25,மதிவாணனிடமும் உரிமையுரை வாங்கி உதவியதோடு இத் தொகுதிகள் வெளிவருவதற்குப் பெரிதும் துணை இருந்தவர்.,False
26,அவருக்கும் எம் நன்றி.,False
27,இந்நூல் தொகுதிகள் நல்ல வடிவமைப்போடு வெளிவருவதற்கு உதவிய திருமதி.,False
28,"செல்வி குட்வில் கணினி அவர்களுக்கும், மெய்ப்புப் பார்த்து உதவிய கி.",False
29,"குமரேசன், மு.ந.",False
30,"தனசேகரன்,இல.தருமராசு, ரெ.",False
31,"விஜயகுமார் ஆகியோர்க்கு எம் நன்றியும், பாராட்டும்.",False
32,இந்நூல் தொகுதிகள் தமிழ் ஆய்வாளர் களுக்கும் தமிழ் உணர்வாளர்களுக்கும் பெரிதும் பயன்படத்தக்க அரிய நூல்களாகும்.,False
33,இதனை அனைவருக்கும் பயன்படத் தக்க வகையில் வெளியிட்டுள்ளோம்.,False
34,வாங்கிப் பயன் பெறுவீர்.,False
35,பதிப்பாளர் உரிமையுரை நுண்கலைச் செல்வர் சாத்தன்குளம் அ.,False
36,இராகவன் அவர்கள் தமிழ்க்கலைகள் பற்றி விரிவாக ஆய்வு செய்து நூல்கள் எழுதியவர்.,False
37,அவர் எழுதிய நூல்கள் இப்பொழுது மீண்டும் அச்சாவது எங்களுக்கு மிகுந்த மகிழ்ச்சியை அளிக்கிறது.,False
38,இந்நூல்கள் மீண்டும் அச்சாகுமா?,False
39,என்ற சந்தேகத்தில் இருந்த எங்களுக்கு இச் செயல் மிகுந்த மகிழ்ச்சி அளிக்கும் செயலாகும்.,False
40,தமிழ்மண் பதிப்பக உரிமையாளர் கோ.,False
41,இளவழகன் அவர்களுக்கு எங்களது நன்றி என்றும் உரியது.,False
42,அமிழ்தம் பதிப்பகத்தின் மூலம் இந்நூலை வெளியிடும் திரு இனியன் அவர்களை நாங்கள் பெரிதும் போற்றிப் பாராட்டுகிறோம்.,False
43,அமிழ்தம் பதிப்பகத்தார் நுண்கலைச் செல்வர் நூல்களை வெளியிடுவதை வாழ்த்தி வரவேற்று மகிழ்கிறோம்.,False
44,மதிவாணன் திருநெல்வேலி அறிஞர் அ.,False
45,இராகவனின் மகன் கா.,False
46,வீரலட்சுமி அம்மையார் அறிஞர் அ.,False
47,இராகவனின் தங்கை பொருளடக்கம் பதிப்புரை உரிமையுரை .,False
48,தோற்றுவாய் .,False
49,தமிழ்நாட்டுத் திருக்கோயில்கள் .,False
50,கட்டிடக் கலை .,False
51,சிந்து வெளி அகழ் ஆய்வு .,False
52,தமிழ் நாட்டுக் கட்டிடக்கலை இலக்கியச் சான்றுகள் .,False
53,கட்டிடக் கலையின் தோற்றமும் வளர்ச்சியும் .,False
54,அக நாழிகை கர்ப்பக் கிரகம் .,False
55,குடைவரைக் கோயில் .,False
56,மண்டபங்கள் .,False
57,தூண்கள் கால்கள் .,False
58,ஒருமைப்பாடுடைய கட்டிடக் கலை .,False
59,மாமல்லபுரம் மாதிரிக் கோயில்களும் கற்றளிகளும் .,False
60,கலைப் பண்புக் கூற்றின் வளர்ச்சி .,False
61,வரலாறும் கோயில்களின் ஒழுங்கும் தமிழ்நாட்டுக் கோயிற் கட்டடக்கலை கோயிற் பிரிவுகள் கோயில் என்றால் கடவுள் இல்லம் என்று பொருள்படும்.,False
62,கோ என்றால் அரசன் என்றும் பொருள்படும்.,False
63,எனவே ஆதியில் கோயில் என்னும் பதம் அரசன் இல்லத்திற்குப் பயன்படுத்தப்பட்டது.,False
64,இது தவறு என்று மறுப்பார் பலர் உண்டு.,False
65,பொதுவாக நமது கட்டிடக் கலையைச் சிற்ப வல்லுநர்கள் மூன்று பிரிவாகப் பிரித்துள்ளார்கள்.,False
66,"சிலர் இந்தியப் பாணி, தக்காணப்பாணி, தென் இந்தியப் பாணி என்று மூன்று பிரிவாகப் பிரித்துள்ளார்கள்.",False
67,சிலர் வரட்டி வரட்பாரர் பங்காளி என்றும் கூறுவர்.,False
68,"வரட்டி, வரட் பாரர் நாட்டினின்றும் கலிங்கி கலிங்க நாட்டினின்றும் பங்காளி வங்காள நாட்டினின்றும் அரும்பியது என்றும் கூறப்படும்.",False
69,"பொதுவாக இவைகள் அனைத்தையும் இணைத்து இந்தியப்பாணி, சர்வ தேசீகப் பாணி என்றும் கூறுவாரும் உண்டு.",False
70,இவைகளின் ஒவ்வொரு உறுப்புகளிலும் வேற்றுமைகள் காணப்படுகின்றன.,False
71,இந்த வேற்றுமைகள் சிறப்பாகக் கோயில்களிலும் அதன் நடுவில் உள்ள திரு உண்ணாழிகையிலும் இடம் பெற்றிருப்பதை திரு.,False
72,"நாகரம், வேசரம் என்ற வார்த்தைகள் திராவிடம் என்ற வார்த்தையின் தோற்றம் தெளிவாகத் தெரியவில்லை.",False
73,அவைகள் சந்தேகத்திற்கிடமின்றி கலை சம்பந்தப் பட்ட பெயராகும்.,False
74,"எண்ணற்ற பலர், இதைப் போன்ற பழக்கமான பதங்களைப் பயன்படுத்தி இருக்கின்றனர்.",False
75,"அவர்களுடைய கருத்துக்களை, அதிகார பூர்வமான நூற்களில் காணும் மேற்கோள்கள் மூலம் அறிய முடிகிறது.",False
76,ஆனாலும் நாம் சம்பந்தப்பட்டவரை அவ்விருபதங்களின் தோற்றத்தை இன்னும் தெளிவாக அறிய முடியாதவர்களாகவே இருக்கின்றோம்.,False
77,நிச்சயமாக இத் தொடர்வாக்கியத் தினின்று இலிங்கம் சிவனுடைய சின்னத்தின் ஒப்பனையாக நாம் உணர்ந்து கொள்ளக் கூடும்.,False
78,"பிண்டி, பீடமாக அல்லது இலிங்கம் இருக்கும் சிலையினடியாகவும் பெரம் படிம வடிவின் முழு உருவமாக உணர்ந்து கொள்ள முடியும்.",False
79,நாகரா என்ற பதம் நாகரி என்ற வரி வடிவங்களோடு மட்டும் தொடர் புடையதாகத் தெரிகிறது.,False
80,வாத்சாயனரின் காம சூத்திர நூலில் நாகரா பெண்களில் ஒரு வகுப்பாக கூறப்பட்டிருக்கிறது.,False
81,கட்டிட அமைப்புகளைப் பற்றிய பிரிவுகளை சில்பரத்தினம் மயமதம் ஆகிய நூற்களில் விளக்கிக் கூறப்பட்டுள்ளன.,False
82,"இஃதன்றி சிவாகமங்களிலும், சிற்ப நூற்கள் சிலவற்றிலும் இவைகளைப் பற்றிய விவரங்கள் காணப்படுகின்றன.",False
83,என்றாலும் காமிகா ஆகமம் கட்டிட அமைப்புகளுக்கு ஒரு அரிய பிரமாண நூலாகத் திகழ்கிறது.,False
84,கட்டிட அமைப்புகளின் அடிப்படையான அம்சங்கள் அனைத்தும் இதனுடைய பல்வேறு அத்தியாயங்களில் விரிவாகக் கூறப் பட்டுள்ளன.,False
85,"இவைகளில் நாகரத்திற்கும் திராவிடத்திற்கும், வேசரத்திற்கும் இடையேயுள்ள வேற்றுமைகளைப் பற்றி விவரிக்கப்பட்டுள்ளன.",False
86,இந்தக் கோயில் அமைப்புகளின் பிரிவுகளின் நோக்கம் நாட்டை மூன்று பாகமாகப் பிரிப்பதேயாகும்.,False
87,இந்தக் கோயிற் பிரிவுகள் மூன்று தெளிவான தன்மைகளை அடிப்படையாகக் கொண்டு எழுந்ததாகத் தெரிகிறது.,False
88,"அதாவது சத்வம் ரசம், தாம்சம் எனப்படும்.",False
89,"நாகரம், வேசரம் திராவிடம் என்ற பிரிவுகள் சிறிய வேற்றுமைகளைக் கொண்டு எழுந்ததாகும்.",False
90,இவைகள் மூன்றையும் சேர்த்து சர்வதேசிக அமைப்பு என்ற கண்ணோட்டத்தோடே நமது கட்டிடக் கலையை ஆராய வேண்டும் என்று திரு.,False
91,எ கிருஷ்ணசாமி ஐயங்கார் போன்ற அறிஞர்கள் நமக்கு வற்புறுத்தி கூறியுள்ளார்கள்.,False
92,நாகர அமைப்புக் கட்டிடங்கள் சாத்வீகக் குணம் சிறப்பாகத் துலங்கும் விதத்தில் கட்டப்பட்டுள்ளது.,False
93,வேசர அமைப்புக் கட்டிடத்தில் தாம்ச குணங்கள் பிரதிபலிக்கிறது.,False
94,திராவிடக் கட்டிட அமைப்பில் ராஜச குணங்கள் சிறப்புற்று ஒளிர்கிறது.,False
95,"மற்றும் இரு பிரிவாகிய கலிங்க வரதப் பிரிவுக் கட்டிடங்கள் சாத்வீகம், ராஜசம் ஆகிய இரு குணங்களும் கலந்து காணப்படுகிறது.",False
96,ஒரு வேளை சமமான அளவில் இருந்தாலும் இருக்கலாம்.,False
97,இந்த எட்டுப் பகுதிகளின் பல்வேறு அமைப்புகளையும் பல விதமான அலங்காரங் களையும் பொறுத்தே கட்டிடங்களுக்கிடையயேயுள்ள பிரிவுகள் உணரப்படுகின்றது.,False
98,ஆனால் நாகரப் பிரிவுக் கட்டிடங்கள் விமான அமைப்பு வேறு விதமாகக் காணப்படுகிறது.,False
99,நாகரப் பிரிவுக் கட்டிடங்கள் எட்டுக் கலப்பான பகுதிகள் உடையதாக இருக்க வேண்டும்.,False
100,அவைகள் சோடி சோடியான இரதங்கள் அலங்கரிக்கப் பட்டு ஒவ்வொன்றிற்கும் எதிராக நிலை நாட்டப் பெற்றிருக்கும்.,False
101,பத்திரகா ஒன்று மற்றொன்றிற்கு மேலாக உயர்ந்திருக்க வேண்டும்.,False
102,"அதை மூன்று, ஐந்து, ஏழு அல்லது ஒன்பது கோணங்கள் தெரியுமாறு அமைக்க வேண்டும்.",False
103,அதோடு முன்பக்கம் சிறிது துருத்தியிருக்குமாறு அமைத்து அதில் பறவைகள் தங்கி இருக்கக் குழிகள் அடைக்க வேண்டும்.,False
104,ஒரு பிரதாரத்தினின்று மற்றொரு பிரதாரம் மேலே படிகளில் ஒவ்வொரு பாகத்திலும் அலங்கரிக்கப்பட்டிருக்க வேண்டும்.,False
105,ஓஹா பிரத்தியுகாவில் சிகரங்களோடு தனியாக அல்லது சோடியாக கலங்களோடு அல்லது அஃதன்றி அமல சரத்தோடு சுற்றி இருக்க வேண்டும்.,False
106,முன்பக்கமும் பின்பக்கமும் பக்க வாட்டில் இருப்பது போல் சுகானசி தலைவாயில் என்று கூறப்படும் மண்டபங்கள் கூட அமைக்கப்பட்டிருக்க வேண்டும்.,False
107,அதில் கீழ்ப்படியிலும் கூட அமைக்கலாம்.,False
108,இந்த அழகு உறுப்புகள் கட்டிடக் கலைஞர்களின் சாதுரியத்திற்கேற்ப வேறுபட் டிருக்கலாம்.,False
109,அது நல்ல தோற்றத்தை தருவதற்குத் துணையாக இருக்கும்.,False
110,பத்திரகா தோரண வாயில் இந்தக் கட்டிடங்களில் குறிக்கப்பட்ட அளவிற்கு வெளியில் மூலைகளில் அமைக்கப்பட வேண்டும்.,False
111,தூண்களுக்கு இடையில் உள்ள தூரங்கள் சமமாக இருக்க வேண்டும்.,False
112,பிரதாரங்களுக்கு இடையில் உள்ள இடைவெளிகள் கட்டப்பட்டிருக்க வேண்டும்.,False
113,வெளியே தண்ணீர் செல்வதற்கு குழாய்கள் அமைத்திருக்க வேண்டும்.,False
114,இடைவெளியில் அமைக்கப்பட்டுள்ள உருவங்கள் மாலைகளோடு அலங்கரிக்கப்பட்டிருப்பதோடு மேலே மணிகளை அமைப்பதற்காக பலகைகளைத் தாங்கிக் கொண்டும் இருக்க வேண்டும்.,False
115,விளிம்பில் பள்ளங்கள் இருக்கப்பட வேண்டும்.,False
116,அவைகளுக்கு முக்கிய வாயில் பிரமத்துவாகம்.,False
117,கொடிகள் இலங்கும் முக மண்டபத்திற்கு வழியாக இலங்கும் பின்புறமுள்ள மகா மண்டபத்தில் பதின் மூன்று பிரிவுகள் கொண்டதாக இருக்கும்.,False
118,சிறிய மண்டபங்கள் பன்னிரண்டு பிரிவுகள் கொண்டிருக்கும்.,False
119,அவைகள் ஆறு அல்லது ஏழு மாடிகள் உடையதாய் இருக்கும்.,False
120,அவைகள் பதினைந்து அல்லது இருபத்தொரு பாகங்களாக பிரிக்கப்பட்டிருக்கலாம்.,False
121,இத்தகைய அமைப்புகள் வீடுகளில் எட்டு அல்லது ஒன்பது மாடிகளாகக் கூடக் கட்டியிருக்கலாம்.,False
122,எத்தகைய சிறிய அமைப்பும் அணி செய்யப்பட்ட விமானத்தின் நடுவிலிருந்து வெளியே வளைந்திருக்க வேண்டும்.,False
123,திராவிடப் பிரிவில் நிர்மாணிக்கப்பட்டிருக்கும் கட்டிடங்கள் திராவிடப் பாணி துலங்க விமானங்களில் சிறந்த அணிகள் விலங்க அழகு செய்யப்பட்டிருக்க வேண்டும்.,False
124,இத்தகை அழகு அமைந்த அணி பெறும் விமானங்களை யுடைய கட்டிடம் வேசரம் எனப்படும்.,False
125,கட்டிடம் அடித்தளத் தினின்று ஒன்றிற்கு மேல் ஒன்றாகத் தொடர்ந்து உயர்த்தப்படும்.,False
126,தூண்கள் உருவத்திற்கேற்ப அணி செய்யப் பட்டிருக்கும் பிரதாரத்தினின்று இறுதிப்பகுதி முன்னே துருத்திக் கொண்டு இருக்கும்.,False
127,இவ்வாறு அணி செய்யப்பட்ட கட்டிடங்கள் வேசரம் என்ற பிரிவைச் சேர்ந்தது என்று கூறப்படும்.,False
