Line Number,Sentence
751,.உரை நிறைமொழி சொல்லிய சொல்லின் பொருளை யாண்டும் குறைவின்றிப் பயக்கச் சொல்லும் சொல்.
752,பயத்தல்பயன்கொடுத்தல் தொ.
753,பேரா. நிறையீற்று ஒரு பொருள் இரட்டை அடுக்கிவரும் நான்கு சீர்களும் ஓரெழுத்தும் குறையாது அமைதல்.
754,எடு பாடுகோ பாடுகோ பாடுகோ பாடுகோ.
755,"நான்கு சீர்களும் குறையாது அமைந்த இவ்வடியில், பாடுவேனோ என்ற சொல் ஒரு பொருளையே தந்தவாறு."
756,உரை நிறையீற்றுப் பல பொருள் இரட்டை பலவாறு பொருள் பெற்று நான்காக அடுக்கிவரும் சொற்கள் ஈற்றில் குறையின்றி இயல்வது.
757,உரை நிறையெண்நிரல் நிறை முன் நிறுவிய பொருள்களுக்குப் பொருத்தமான பொருள் களைப் பின்னர் நிறுவி அமைப்பது.
758,இதனுள் இரண்டு பொருள்களை நிறுவிப் பின்னும் இரண்டு பொருள்களை நிறுவியமை நிறைஎண் நிரல்நிறை.
759,உரை. நீட்டல் விகாரம் செய்யுட்கண் தொடை நயம் கருதிக் குறில் நெடிலாக நீட்டப் படுதல்.
760,நச். நுவன்று அறைதல் கூறித் துணித்தல்.
761,"அறைதல்துணித்தல், அறைக் கரும்பு பொருந."
762,என்புழிப் போல.
763,சொற்சீரடியானும் நூற்பா அமையும்.
764,நூற்பா அமைப்புக் காண்க.
765,நூற்பா அகவல் நூற்பா இயலும் அகவற்பா.
766,இவ்வகவல் நிலைமண்டில ஆசிரியமாகவே பெரும்பான்மையும் நிகழும்.
767,"இவ்வகவல், தொல்காப்பியப் பாயிரம் போல, இடையே சொற்சீரடி பயின்று வரவும் பெறும்."
768,இஃது இலக்கணம் அமைத்தற்குரிய அகவல் வகை திவா.
769,"நூல்இலக்கணம் எனவே, நூலுட் பயிலும் சூத்திர அமைப்பு ஈண்டுக் கூறினார்."
770,அரியே ஐம்மை தொ.சொ.
771,முதலாகச் சொற்சீரடியான் வருதலும் கொள்ளப்பெறும்.
772,துவன்று நிறை வாகும் தொ.சொ.
773,என்பதும் அது.
774,இவை முறையே குறளடி யானும் சிந்தடியானும் வந்தன நிறை அசைச்சீராகக் கொள்க.
775,இவை தொல்காப்பிய உரியியல் நூற்பாக்கள்.
776,"இதன்கண் அடிதோறும் இரண்டாமெழுத்துக்கள் உயிர் மெய் நெடில்களாக அமைந்துள்ளமையின், நெடில் எதுகை யாம்."
777,நெடில் மிக்கு வருதல் ஒரு செய்யுட்கண் நெட்டெழுத்தே மிக்கு வருதல்.
778,"உரை நெடில்மோனை முதலெழுத்து அடிதோறும் வெவ்வேறாயினும் அவை உயிர் நெட்டெழுத்தாக இருப்பின், அவ்வியைபு பற்றி நிகழ்வது."
779,எடு ஆர்கலி உலகத்து மக்கட் கெல்லாம் ஓதலிற் சிறந்தன் றொழுக்க முடைமை.
780,"ஆ, ஓ என்னும் இம் முதலெழுத்துக்கள் நெடிலாதல் ஒற்றுமை பற்றி, இது நெடில்மோனை யாயிற்று."
781,நெடிலடி .
782,ஐஞ்சீரான் வருமடி யா.கா.
783,இனித் தொல்காப்பிய னார் நாற்சீரடிதன்னையே பதினைந்தெழுத்து முதலாகப் பதினேழ் எழுத்து வரை உயர்ந்த மூன்றடியும் நெடிலடி என்ப.
784,பேரா. எடு .
785,மூவா முதலா உலகம்மொரு மூன்று மேத்த சீவக.
786,நெடுஞ்சீர் வண்ணம் நெட்டெழுத்துப் பயின்று வரும் சந்தம்.
787,எடு மாவா ராதே மாவா ராதே நெட்டுயிர் மடக்காக வரும் மிறைக்கவியும் அது.
788,நச் நெடுந்தூக்கு தூக்கு ஏழனுள் எழுசீர் கொண்டது.
789,அரும். டு நெடுவெண்பாட்டு ஏழு அடிமுதல் பன்னீரடிவரை நிகழும் வெண்பா.
790,"மூன்றடிப் பேரெல்லையுடைய குறுவெண்பாட்டினும், ஆறடிப் பேரெல்லையுடைய அளவியல் வெண்பாட்டினும் இது நெடிதாயிற்று."
791,நான்கடி முதல் நிகழினும் ஒரோவழி நெடுவெண்பாட்டாம்.
792,கலித்தொகையுள் நச்.
793,உரையுள் காண்க. தொ.
794,உரை நெறி பெற்று வருதல் வழக்கப்பட்டு நடத்தல் வழக்குப் பெற்று நடத்தல்.
795,நேர் அசைச்சீர் நேர் என்னும் ஓரசைச் சீர்க்குரிய வாய்பாடு நாள் என்பது.
796,வெண்பாவின் ஈற்றிலேயே இது வாய்பாடு பெறும்.
797,எடு நிலமிசை நீடுவாழ் வார் குறள்.
798,நேர் என்பதன் சொற்பொருள் நேர் என்ற சொற்குப் பொருள் பல.
799,"அச்சொல், ."
800,"நேர்ந்தார், அரண்பல கடந்த அடுபோர்ச் செழிய என மாறாதற்கண்ணும்."
801,"நேர்பொருள் நிறுத்தனன், நேர்இன மணியை நிரல்பட வைத்தாங்கு நன்."
802,"என ஒத்தற்கண்ணும், ."
803,நேர்அசை என தனிமைக்கண்ணும் .
804,"நேரே நல்லன நேரே செல்வன என மிகுதிக்கண்ணும், ."
805,"நேர்நூல், நேர்ஆடை என நுட்பத்தின்கண்ணும், ."
806,"நாற்சீர் கொண்டது நேரடி எனச் சமனாதற்கண்ணும், ."
807,"நெட்டெழுத்தா நேரப்படும், என உடன்படுதற்கண்ணும் ."
808,நேர்போகி எனப் பாதிக்கண்ணும் .நேர்பட்ட இரண்டு படையும் எனத் தலைப்பாட்டின் கண்ணும் .
809,"நேராமல் காப்பது கல்வி,நேரா நோன்பு, நேரா நெஞ்சத் தான் நட்டான் அல்லன் என நிலைப்பாட்டின்கண்ணும் ."
810,"உப்பு நேர்ந்தார், புளிநேர்ந்தார் எனக் கொடையின்கண்ணும், ."
811,நேரிழை மகளிர் எனப் பொருத்தத்தின்கண்ணும் வரும்.
812,உரை நேர் ஒன்று ஆசிரியத்தளை நேர்ஈற்று இயற்சீர் நின்று வரும்சீர் முதல்அசையொடு நேராக ஒன்றும் தளை.
813,எடு உள்ளார் கொல்லோ தோழி முள்ளுடை இவ்வடிக்கண் வரும் மூன்றுதளையும் நேர்ஒன்றாசிரியத் தளையாம்.
814,நேர்நிரை வாய்பாடு இவ்வியற்சீர்க்குரிய வாய்பாடு கூவிளம்.
815,"பாதிரி, வாய்த்தலை எனப் பல கூறுப."
816,"நச். நேர் நிரை நிரை வாய்பாடு இம்மூவசைச் சீர்க்குரிய வாய்பாடு கூவிளங்கனி யா.கா., மாவரு சுரம் தொ.செய்."
817,நச் என்பன.
818,"நேர்நிரை நிரைபு வாய்பாடு இம்மூவசைச் சீர்க்குரிய வாய்பாடு மாவரு கடறு, மாவரு குரவு தொ."
819,நச் என்பன.
820,"ஒன்று குற்றுகர ஈறு, ஏனை யது முற்றுகர ஈறு."
821,பின் வருவனவற்றுள்ளும் ஏற்றவிடத்தே கொள்க.
822,நேர்நிரை நேர் வாய்பாடு இம்மூவசைச் சீர்க்குரிய வாய்பாடு கூவிளங்காய் யா.
823,", மாவருவாய் தொ."
824,நச் என்பன.
825,"நேர் நிரை நேர்பு வாய்பாடு இம்மூவசைச் சீர்க்குரிய வாய்பாடு மாவருகாடு, மாவருகாவு தொ."
826,"நேர் நிரைபு வாய்பாடு இவ்வீரசைச் சீர்க்குரிய வாய்பாடு பூ மருது, காருருமு என்பன."
827,"இவை பாதிரி போல, வருஞ்சீரொடு தளை கொள்ளும்."
828,"நேர் நிரைபு நிரை வாய்பாடு இம்மூவசைச் சீர்க்குரிய வாய்பாடு மாவழங்குசுரம், மாவிரவு சுரம் என்பன தொ."
829,"நேர் நிரைபு நிரைபு வாய்பாடு இம்மூவசைச் சீர்க்குரிய வாய்பாடு மாவழங்கு கடறு, மாமருவு குரவு என்பன."
830,"மாமருவு கடறு, மாவழங்கு குரவு என்பனவும் கொள்க."
831,இவ் வாய்பாட்டு வேறுபாடு ஏற்புழிஎல்லாம் கொள்க.
832,"நேர் நிரைபு நேர் வாய்பாடு இம் மூவசைச் சீர்க்குரிய வாய்பாடு மாவழங்குவாய், மாவிரவு வாய் என்பன."
833,"நேர் நிரைபு நேர்பு வாய்பாடு இம்மூவசைச் சீர்க்குரிய வாய்பாடு மாவழங்குகாடு, மாமருவு காவு என்பன தொ."
834,நேர்நிலை வஞ்சி சமநிலைவஞ்சி அஃது இருசீரான் வரும்.
835,நச். எடு ஓங்குதலை வியன்பரப்பின் .
836,நேர்நேர் வாய்பாடு இவ்வியற்சீர்க்கு வாய்பாடு தேமா என்பது.
837,நேர் நேர் நிரை வாய்பாடு இம்மூவசைச்சீர்க்கு வாய்பாடு தேமாங்கனி.
838,", மாசேர்சுரம் தொ.செய்."
839,நச் என்பன தூஉமணி என்பதும் ஒன்று யா.
840,"இவற்றுள் முதலாவது குற்றுகர ஈறு, ஏனையது முற்றுகர ஈறு."
841,பின் வருவனவற்றுள்ளும் ஏற்றவாறு கொள்க.
842,நேர் நேர் நேர் வாய்பாடு இம்மூவசைச் சீர்க்கு வாய்பாடு தேமாங்காய் யா.கா.
843,", மாசேர்வாய் தொ."
844,நச். என்பன.
845,நேர் நேர் நேர்பு வாய்பாடு இம்மூவசைச் சீர்க்கு வாய்பாடு மாசேர்காடு.
846,மாசேர்காவு என்பன.
847,"நச். நேர் நேர்பு வாய்பாடு இவ்வீரசைச் சீர்க்கு வாய்பாடு போரேறு, நன்னாணு என்ப."
848,"இவை பாதிரி போல நின்று, வருஞ்சீரொடு தட்கும் தொ."
849,"நச். நேர் நேர்பு நிரை வாய்பாடு இம்மூவசைச்சீர்க்கு வாய்பாடு மாபோகு சுரம், மாமேவு சுரம் என்பன."
850,"நச். நேர் நேர்பு நிரைபு வாய்பாடு இம்மூவசைச் சீர்க்கு வாய்பாடு மாபோகு கடறு, மாமேவு குரவு என்பன."
851,"நச். நேர் நேர்பு நேர் வாய்பாடு இம்மூவசைச் சீர்க்கு வாய்பாடு மாபோகுவாய், மாமேவுவாய் என்பன தொ."
852,"நச். நேர் நேர்பு நேர்பு வாய்பாடு இம்மூவசைச் சீர்க்கு வாய்பாடு மாபோகு காடு, மா மேவு காவு என்பன."
853,நச். நேர்பு அசை குற்றுகரமுற்றுகரங்களோடு இயைந்து வரும் நேரசை.
854,"எடு வண்டு, நாகு, காம்பு மின்னு, நாணு, தீர்வு."
855,"செய். நச். இதனை நேர் நேர் எனக் கொள்ப, பிற்காலத்தார் யா."
856,உரை நேர்பு ஈற்று மூவசைச்சீர் பதினாறு .
857,"நேர் நேர் நேர்பு மா சேர் காடு, மா சேர் காவு ."
858,"நேர் நிரை நேர்பு மா வரு காடு, மா வரு காவு ."
859,"நேர் நேர்பு நேர்பு மா போகு காடு, மா மேவு காவு ."
860,"நேர் நிரைபு நேர்பு மா வழங்கு காடு, மா மருவு காவு ."
861,"நிரை நேர் நேர்பு புலி சேர் காடு, புலி சேர் காவு ."
862,"நிரை நிரை நேர்பு புலி வரு காடு, புலி வரு காவு ."
863,"நிரை நேர்பு நேர்பு புலி போகு காடு, புலி மேவு காவு ."
864,"நிரை நிரைபு நேர்பு புலி வழங்கு காடு, புலி மருவு காவு ."
865,"நேர்பு நேர் நேர்பு பாம்பு சேர் காடு, மின்னுச் சேர் காவு ."
866,"நேர்பு நிரை நேர்பு பாம்பு வரு காடு, மின்னு வரு காவு ."
867,"நேர்பு நேர்பு நேர்பு பாம்பு போகு காடு, மின்னு மேவு காவு ."
868,"நேர்பு நிரைபு நேர்பு பாம்பு வழங்கு காடு, மின்னு விரவு காவு ."
869,"நிரைபு நேர் நேர்பு களிறு சேர் காடு, அரவு சேர் காவு ."
870,"நிரைபு நிரை நேர்பு களிறு வரு காடு, அரவு வரு காவு ."
871,"நிரைபு நேர்பு நேர்பு களிறு போகு காடு, அரவு மேவு காவு ."
872,"நிரைபு நிரைபு நேர்பு களிறு வழங்கு காடு, அரவு விரவு காவு தொ."
873,"நச் நேர்பு என்ற அசைச்சீர் வாய்பாடு வண்டு, மின்னு முதலியனவாம்."
874,"நச் நேர்பு நிரை வாய்பாடு இவ்வீரசைச் சீர்க்கு வாய்பாடு நீடு கொடி, நாணுத்தளை என்பன."
875,"இவை பாதிரி போல, வரும் சீரொடு தட்கும்."
876,"நச் இவற்றுள் முதலாவது குற்றுகர ஈறு, ஏனையது முற்றுகர ஈறு."
877,பின் வருவனவற்றுள் ளும் ஏற்ற இடத்துக் கொள்க.
878,"நேர்பு நிரை நிரைபு வாய்பாடு இம்மூவசைச் சீர்க்கு வாய்பாடு பாம்பு வரு கடறு, மின்னு வரு குரவு என்பன."
879,"நச் நேர்பு நிரைநேர் வாய்பாடு இம்மூவசைச்சீர்க்கு வாய்பாடு பாம்பு வரு வாய், மின்னு வரு வாய் என்பன தொ."
880,"நச் நேர்பு நிரைபு வாய்பாடு இவ்வீரசைச் சீர்க்கு வாய்பாடு, பாறு குருகு என்பது."
881,நச் முற்றுகர ஈறு காட்டப்பட்டிலது.
882,பேணு நிலவு என்று கொள்ளலாம்.
883,"இதனைச் செயற்பாலது வேறோர் அசைக்கு உறுப்பு ஆக்குதல் நோக்கி, நேர்பசை நிரைபசை என்பன தொல்காப்பியனாரான் கொள்ளப்பட் டன."
884,நச். தொல்காப்பியனார் தனிச்சொல்லின் இறுதியில் வரும் குற்றியலுகரம் அல்வழி வேற்றுமைப்பொருளில் தொடரில் வரும்போது முற்றியலுகர மாகும் தொ.
885,"தமிழ் மொழியில் சொற்களுக்குச் சிறப்புத் தந்து எண்ணினமையின், இந்நான்கு அசைகளும் இன்றியமையா தவை ஆயின."
886,தமிழில் யாதேனும் ஒரு பொருளைத் தருவதொரு சொல்லே அசையாகும் என்ற மரபு பண்டு கொள்ளப்பட்டது.
887,ஆதலின் இவ்வீரெழுத்துக் களையும் தனித்தனியே பிரித்து இரண்டு அசைகளாகக் கோடல் முறையன்று.
888,"இவ்வாறே ஓங், கு வர, கு குரங், கு எனப்பிரித்து அசைகோடலும் அமைதியன்று."
889,அசை இலக்.
890,"பொருள் பயந்து நிற்கும் அசைகளே சிறப்பசை எனவும், அங்ஙனம் நில்லாத அசைகள் சிறப்பில் அசை எனவும் யாப்பருங்கல."
891,உரையாசிரியர் குறிக்கிறார்.
892,"எடு பறவை, தோல்வி, பற, தோல் சிறப்பசை."
893,"மாலை, ஞாயிறு மா, ஞா சிறப்பில்லாஅசை."
894,இவ்வாற்றால் நேர்பு நிரைபு அசைகளது இன்றியமையாமை உணரப்படும்.
895,"நேர்பு நிரைபு காணும் முறை நேர்பு, நிரைபு அசைகள் வருமொழி வல்லெழுத்து வரு மிடத்தே வல்லொற்றொடு தோன்றி நிற்கவும்பெறும்."
896,எடு சேற்றுக்கால் நீலம் குற்றுகரம் நேர்பசை ஒற்றடுத்து வந்தது.
897,நாணுத் தளையாக அகநா.
898,முற்றுகரம் நேர்பசை ஒற்றடுத்து வந்தது.
899,நெருப்புச்சினம் தணிந்த புறநா.
900,குற்றுகரம் நிரைபசை ஒற்றடுத்து வந்தது.
901,கனவுக்கொல் நீ கண்டது கலி.
902,முற்றுகரம் நிரைபசை ஒற்றடுத்து வந்தது.
903,"எனவே, நடக்கும் உண்ணும் போல்வன புளிமா தேமா ஆவதல்லது நிரைபசை நேர்பசை ஆகா என்பது."
904,ஒற்று அடாது வருதலே பெரும்பான்மை.
905,எடு பொருள்சேர் புகழ்புரிந்தார் மாட்டு குறள்.
906,குற்றுகரம் புனைமலர்த் தாரகலம் புல்லு முற்றுகரம்.
907,நேர்பு அசை ஒற்றடாது வந்தது.
908,பகவன் முதற்றே உலகு குறள் குற்றுகரம் நாணுத்தாள் வீழ்த்த கதவு குறள் முற்றுகரம்.
909,நிரைபு அசை ஒற்றடாது வந்தது.
910,"நச். நேர்பு நிரைபு நிரை வாய்பாடு இம்மூவசைச்சீர் வாய்பாடு பாம்பு வழங்கு சுரம், மின்னு விரவு சுரம் என்பன."
911,"நச். முதலது குற்றுகர ஈறு, ஏனையது முற்றுகர ஈறு."
912,பின்வருவனவற்றுள்ளும் ஏற்ற விடத்துக் கொள்க.
913,"நச். நேர்பு நிரைபு நேர் வாய்பாடு இம்மூவசைச்சீர் வாய்பாடு பாம்பு வழங்கு வாய், மின்னு விரவு வாய் என்பன."
914,"நச்.. நேர்பு நேர் வாய்பாடு இவ்வீரசைச்சீர் வாய்பாடு போது பூ, மேவு சீர், சேற்றுக்கால், வேணுக்கோல் முதலாயின."
