Line Number,Sentence
1155,"அவற்றுள், சங்கர பக்தன் ஈசுவர பக்தன் என்ற சிறப்புப் பெயர்கள் குறிப்பிடத்தக்கனவாகும்."
1156,ஏநசளந .
1157,காசாக்குடிச் செப்பேடுகள் பரமேசுவரனே இராசசிங்க பல்லவனாக அவதரித்தனர் என்று சிறப்பித்துக் கூறுகின்றன.
1158,உதயேந்திரச் செப்பேடுகள் இவனைப் பரம மாகேசுவரன் என்று புகழ்ந்துரைக்கின்றன ளு.ஐ.ஐ.
1159,வேலூர்ப் பாளையச் செப்பேடுகள் இவ்வேந்தன் காஞ்சிமா நகரில் சிவபெருமானுக்குக் கயிலாயத்தை ஒத்த கோயில் எடுப்பித்த பெருமையுடையவன் என்றுணர்த்து கின்றன.
1160,"எனவே, இவன் சிறந்த சிவபக்தி யுடையவனாய்த் திகழ்ந்தவன் என்பது நன்கு வெளியாதல் காண்க."
1161,ஏநசளந .
1162,"ஆகவே, இவன் ஈடும் எடுப்புமற்ற சிவபக்தனாக அந்நாளில் இருந் திருத்தல் வேண்டும் என்பது ஒருதலை."
1163,"இத்துணைச் சிறந்த சிவபக்தி வாய்ந்த இப்பல்லவ வேந்தனே, சுந்தர மூர்த்திசுவாமிகளால் திருத்தொண்டத் தொகையில் கூறப்பெற்ற காடவர்கோன் சுழற்சிங்கனாதல் வேண்டும்."
1164,"இனி, இவ்வேந்தன் இயற்பெயரால் குறிக்கப்படாமல் சுழற்சிங்கன் என்று அடிகளால் கூறப்பெற்றமைக்குக் காரணம் யாது என்பது ஆராய்தற்குரியதாகும்."
1165,"எனவே, இவன் நரசிம்மன், இராசசிம்மன், க்ஷத்திரியசிம்மன் என்ற பெயர்களை யுடையவனாயிருந்தமை உணரற்பாலது."
1166,"ஆகவே, அடிகளால் பாராட்டப் பெற்ற காடவர் கோன் கழற்சிங்கன் என்பான் காஞ்சி மாநகரிலிருந்து கி.பி."
1167,முதல் வரையில் ஆட்சிபுரிந்த பல்லவ வேந்தனாகிய இரண்டாம் நரசிங்கவர்மனே என்பது நன்கு துணியப்படும்.
1168,அடிகளோடு கயிலாயஞ்சென்ற சேரமான் பெருமான் நாயனார் வாழ்ந்த காலமும் அதுவேயாகும்.
1169,ஏட்டுச் சுவடிகள் பழுதுற்று அழிந்து போகுந் தன்மையவாகும்.
1170,"இலண்டன் மாநகரிலுள்ள பொருட்காட்சிச் சாலையில் வெள்ளி யேடுகளில், பாலி மொழியில் எழுதப்பெற்ற சிறு நூல் ஒன்று உளதாம்."
1171,"அன்றியும், ஈயத் தகட்டில் எழுதப்பெற்ற பௌத்த நூல் ஒன்றும் அங்கிருக்கின்றதாம். கி.பி."
1172,"அத்தகைய கல்வெட்டுக்களுள் ஒன்று, சீர்காழியிலுள்ள திருஞான சம்பந்த மூர்த்திகள் கோயில் கருப்பகிரகத்தின் தென்புறத்தில் உள்ளது."
1173,இந்நிலம் இருமாவரை அரைக்காணி முந்திரிகை...
1174,..இனினிலஞ் சூழ்ந்த குலையும் திடலும் குளமும் கிழக்கடைய கொழ....
1175,மேற்கடைய குன குடியிருப்புத் திடர் நிலமும் சுத்தமலி வதிக்கு மேற்கு நின்ற..
1176,"பணியால் ஊர்க்கணக்குப் பிரியன் எழுத்து, என்பதாம்."
1177,இஃது அரிய செய்திகளை அறிவிக்கும் ஒரு சிறந்த கல்வெட்டாகும்.
1178,தஞ்சாவூர் சென்னை இராச்சியத்திலுள்ள பெரிய நகரங்களுள் தஞ்சாவூரும் ஒன்றாகும்.
1179,இம்மாநகர் இந்நாளில் தஞ்சை மாவட்டத்திற்குத் தலைநகராகச் சிறப்புடன் விளங்குவதை யாவரும் காணலாம்.
1180,"தஞ்சாவூரோ அவ்வாறு அண்மையில் தோன்றி வளர்ச்சி எய்திய நகரமன்று, இது மிக்க பழமை வாய்ந்த நகரம் ஆகும்."
1181,ஏழாம் நூற்றாண்டிலேயே புகழுடன் விளங்கியதாதல் வேண்டும்.
1182,இது ஆம் ஆண்டில் நிகழ்ந்ததாகும்.
1183,இச்செய்தி கங்கை கொண்ட சோழனுடைய திருவாலங்காட்டுச் செப்பேடு களிலும் வீராராசேந்திர சோழனது கன்னியாகுமரிக் கல்வெட்டிலும் சொல்லப்பட்டுள்ளது.
1184,அவ்வம்மையின் பெயர் நிசும்பசூதனி என்று தெரிகிறது.
1185,இப்பெயருடைய துர்க்கையின் கோயில் இப்போது தஞ்சை மாநகரில் காணப்பட வில்லை.
1186,கோடியம்மன் கோயில் காளியின் கோயிலாகவே காணப்படுவதால் அன்னோர் கருத்து ஒருவாறு பொருந்தும் எனலாம்.
1187,அதற்கு வீரசோழ வடவாறு என்று இவ்வேந்தனது சிறப்புப் பெயர் அந்நாளில் இடப்பட்டிருந்தது என்பது கல்வெட்டுக்களால் அறியக் கிடக்கின்றது.
1188,பொது மக்கள் நலங்கருதித் தன் தலைநகர்க்கு அணித்ததாக அவ்வாற்றை இவன் வெட்டுவித்திருப்பது குறிப்பிடத்தக்கதோர் அரிய செயலாகும்.
1189,இவ்வேந்தன் சிறந்த சிவபக்தன் சிவபாத சேகரன் என்ற சிறப்புப் பெயர் எய்தியவன்.
1190,சோழர்கால ஓவியத்தின் சிறப்பினையும் இத்திருக்கோயிலி லிருந்து நன்கறியலாம்.
1191,இதில் குறிக்கப்பட்டுள்ள அரசர்கள் இராசராச சோழனுக்குத் திறை செலுத்தும் பொருட்டுத் தஞ்சை மாநகர்க்கு வந்து தங்கியிருந்த குறுநில மன்னராவர்.
1192,"அவற்றுள், உள்ளாலை என்பது உள் நகராகும்."
1193,புறம்படி என்பது புற நகரமாகும்.
1194,"ஆகவே, இஃது எத்துணைப் பெரிய நகரமாக அப்போது இருந்திருத்தல் வேண்டும் என்பதை ஒருவாறு உணர்ந்து கொள்ளலாம்."
1195,முதல் மாறவர்மன் சுந்தர பாண்டியன் கி.பி.
1196,ல் சோழ மண்டலத்தின் மேல் படையெடுத்து வந்தபோது இம்மாநகர் பேரழிவிற்கு உள்ளாயிற்று.
1197,பதினாறாம் நூற்றாண்டின் இடையில் தோன்றிய தஞ்சை நாயக்கர் ஆட்சியில்தான் இது மீண்டும் பழைய சிறப்பை எய்துவதாயிற்று.
1198,தஞ்சையிலிருந்து அரசாண்ட நாயக்க மன்னர்களில் முதல்வனாகிய சேவப்ப நாயக்கனால் சிவகங்கைக் கோட்டையும் சேவப்பன் ஏரியும் அமைக்கப்பட்டன.
1199,இப்போதுள்ள தஞ்சை அரண்மனையும் இராசகோபால சுவாமி கோயிலும் இறுதியிலிருந்த விஜயராகவ மன்னனால் கட்டப்பெற்றனவாகும்.
1200,தஞ்சை யிலிருந்த கோட்டையும் அகழியும் இவ்வேந்தனால் புதுப்பிக்கப்பட்டனவே யாம்.
1201,நீலமேகப் பெருமாள் கோயில் முன்னர் வடவாற்றின் தென்கரையில் வம்புலாஞ் சோலையில் இருந்தது.
1202,அதனை இடித்துக்கொண்டு போய் இரண்டு மைலுக்கு வடக்கே வெண்ணாற்றங் கரையில் கோயில் அமைத்துள்ளவர்கள் நாயக்க அரசர்களே ஆவர்.
1203,நாயக்கர் ஆட்சிக்குப் பின்னர் கி.பி.
1204,ல் இம் மாநகர் மராட்டிய மன்னர்கட்குத் தலைநகராக விளங்கியது.
1205,திருவோலக்க மண்டபத்தின் சுவர்களில் மராட்டிய மன்னர்களின் உருவங்கள் பல வண்ணங் களோடு வரையப்பட்டிருத்தலை இன்றும் காணலாம்.
1206,இவ்வேந்தர் களுள் இரண்டாம் சரபோஜி மன்னன் சிறந்த ஆங்கிலப் பயிற்சியும் பல்வகைக் கலைகளில் பற்றும் உடையவன்.
1207,இவ்வரசன் தஞ்சை இராசராசேச்சுரத் திருக்கோயிலுக்குப் புரிந்த திருப்பணிகள் எல்லாம் அங்குள்ள கல்வெட்டுகளில் கூறப்பட்டுள்ளன.
1208,ஒரு கல்வெட்டில் மராட்டிய மன்னர்களின் பரம்பரை வரையப் பெற்றிருத்தல் குறிப்பிடத் தக்கதாகும்.
1209,இவன் இம் மாநகரில் புரிந்துள்ள அருஞ்செயல் ஒன்றுளது.
1210,"அது, தமிழ், சமஸ்கிருதம், தெலுங்கு."
1211,மகாராஷ்டிரம் முதலான மொழிகளிலுள்ள ஏட்டுச் சுவடிகளைத் தேடிக் கொணர்ந்து அரண்மனையில் சரஸ்வதிமால் புத்தகசாலை அமைத்தமையே யாம்.
1212,இவன் உருவச்சிலையை அரண்மனைக் கொலு மண்டபத்தில் இன்றும் பார்க்கலாம்.
1213,இத்தஞ்சை மாநகர் புகழுடன் என்றும் நின்று நிலவுவதாக!
1214,திருச்சிராப்பள்ளி தென்னிந்தியாவிலுள்ள புகைவாண்டி நிலையங்களுள் முதன்மை பெற்று விளங்கும் திருச்சிராப்பள்ளியைப் பலரும் அறிவர்.
1215,அவற்றுள் திருச்சிராப்பள்ளி என்பது ஒன்றாகும்.
1216,அப்பெரு நகரின் பண்டைப் பெயர் யாது என்பதை ஈண்டு ஆராய்வோம்.
1217,சைவசமய குரவர்களாகிய திஞானசம்பந்தரும் திருநாவுக்கரசரும் அக்குன்றின்மேல் திருக்கோயில்கொண்டு எழுந்தருளியுள்ள சிவபெருமான்மீது பாடியுள்ள பதிகங்களிலேதான் சிராப்பள்ளி என்ற பெயர் காணப்படுகின்றது.
1218,அந்நிகழ்ச்சிகள்தான் மகேந்திரவர்மன் சமண சமயந் துறந்து சைவனாகும்படி செய்துவிட்டது என்பது தேற்றம்.
1219,"அங்ஙனமே, அவன் தன் நாட்டிலிருந்த பல அமண் பள்ளிகளை இடித்து அவ்விடங்களிற் சிவன் கோயில்கள் அமைந்திருத்தல் வேண்டும்."
1220,அவற்றுள் சிராப்பள்ளிக் குன்றின் மேலுள்ள சிவாலயமும் ஒன்றாகும்.
1221,அத்தலையணைகளில் அவற்றை உபயோகித்த சமண முனிவர்களின் பெயர்கள் வரையப் பெற்றிருக்கின்றன.
1222,"அவ்வெழுத்துக்களைக் கொண்டு அவற்றின் காலத்தை ஆராய்ந்த கல்வெட்டிலாகா அறிஞர்கள், அவை கி.பி."
1223,"ஐந்தாம் நூற்றாண்டில் அமைக்கப்பெற்றிருத்தல் வேண்டும் என்று கூறுகின்றனர். எனவே, கி.பி."
1224,ஐந்தாம் நூற்றாண்டில் குன்றின்மெற் சில சமண முனிவர்கள் தங்கித் தவம் புரிந்து கொண்டிருந்தனர் என்பது நன்கு தெளியப்படும்.
1225,அவர்களுள் சிரா என்ற முனிவர் ஒருவர் இருந்தமை அங்குள்ள கல்வெட்டுக்களால் அறியப்படு கின்றது.
1226,அந்நாட்களிலே தான் அவன் சிராப்பள்ளி என்னும் அமண் பள்ளியை இடித்து அக் குன்றின் மேல் சிவன்கோயில் எடுப்பித்திருத்தல் வேண்டும்.
1227,அச் சிவாலயமும் சிராப்பள்ளி என்னும் பழைய பெயருடன் வழங்கி வருவதாயிற்று.
1228,"அம் முறையிற் சிராப்பள்ளி என்பது கோயிற்பெயரா யிருத்தலால், அக்கோயில் அமைந்துள்ள ஊரின் பெயர் யாது என்பது இனி ஆராய்தற்குரியதாகும்."
1229,திருச்சிராப்பள்ளியில் முதல் இராசராசசோழனது ஆட்சியின் பதினாறாம் ஆண்டாகிய கி.பி.
1230,"இக் கல்வெட்டில் அவ்வூர், சிற்றம்பர்நகர் எனவும் சிற்றம் பர்பதி எனவும் குறிக்கப்பட்டிருத்தல் காண்க."
1231,"நம் தமிழ்நாட்டில் அம்பர், இன்னம்பர், நல்லம்பர் என்ற ஊர்கள் இருத்தலைப் பலர் அறிந்திருத்தல் கூடும்."
1232,அவ்வூர்களைப் போற் சிற்றம்பர் என்ற ஊரும் இருந்துளது.
1233,சோழர்களும் இராஷ்டிரகூடர்களும் கி.பி.
1234,அவன் தன் புதல்வன் முதல் ஆதித்த சோழனுக்குக் கி.பி.
1235,ல் இளவரசுப் பட்டங் கட்டி அரசியல் நிகழ்ச்சிகளில் ஈடுபடும்படி செய்தான்.
1236,அவன் இளவரசனாயிருந்த காலத்தில் கி.பி.
1237,ஆம் ஆண்டில் இரண்டாம் வரகுண பாண்டியன் சோழ நாட்டின் மேல் படையெடுத்து அதனைப் பல அல்லல்களுக்கு உள்ளாக்கினான்.
1238,அந்நாட்களில் சோழ நாட்டின் மற்றொரு பகுதி பல்லவ வேந்தனாகிய அபராஜித வர்மன் ஆட்சிக் குட்பட்டிருந்தது.
1239,"அதனால், அப் பல்லவன் ஆதித்த சோழனுக்கு உதவி புரிந்து, வரகுண பாண்டியனைச் சோழ நாட்டை விட்டுத் துரத்துவது இன்றியமையாததாயிற்று."
1240,"எனவே, அபராஜித வர்மன் பாண்டியனோடு போர் புரிவதற்குப் பெரும்படையோடு புறப்பட்டான்."
1241,வெற்றி பெற்ற அபராஜிதவர்மன் தன் ஆட்சிக்குட்பட்டிருந்த சோழ நாட்டுப் பகுதியை முதல் ஆதித்த சோழனுக்கு அளித்தனன்.
1242,அப்போர் நிகழ்ச்சியில் கலந்து கொண்ட மன்னர்களில் முதல் பிருதுவிபதி என்ற கங்க அரசன் போர்க்களத்தில் உயிர் துறந்தான்.
1243,அத் திருமணமும் விரைவில் நிறைவேறியது.
1244,"முதல் ஆதித்தசோழனும் இளங்கோப்பிச்சியும், சோழ நாட்டின் தலைநகராகிய தஞ்சை மாநகரில் இனிது வாழ்ந்து வருவாராயினர்."
1245,இனி கிருஷ்ணதேவன் என்பது கன்னட மொழியில் கன்னரதேவன் என்று வழங்கும்.
1246,"எனவே, வடபுலத்தில் பேரரசாக நிலவிய இராஷ்டிரகூட இராச்சியத்தின் வலிமையை அவன் நன்குணர்ந்திருந்தான் என்பது தேற்றம்."
1247,அவனுக்குப் பிறகு அவன் தம்பியும் முதற் பராந்தக சோழன் மருமகனுமாகிய நான்காம் கோவிந்தன் என்பான் கி.பி.
1248,"ல் முடிசூட்டப் பெற்று, கி.பி."
1249,வரையில் அந்நாட்டில் அரசாண்டான்.
1250,ல் முடி சூட்டினன்.
1251,அவ்வேந்தனும் கி.பி.
1252,ல் இறந்தான்.
1253,இப்போர் நிகழ்ச்சிக்குப் பிறகு நான்காம் கோவிந்தனைப் பற்றிய செய்தி ஒன்றுமே தெரியவில்லை.
1254,ஆகவே அவ்வேந்தன் இப் போரில் உயிர்துறந்திருத்தல் கூடும் என்று கருதற்கு இடமுள்ளது.
1255,இராஷ்டிகூடரது நாட்டில் மூன்றாம் கிருஷ்ணதேவன் கல்வெட்டுக்கள் கி.பி.
1256,முதல் கி.பி.
1257,வரையில் காணப்படுகின்றன.
1258,"எனவே, அவன் இருபத்தெட்டு ஆண்டுகள் அந்நாட்டில் ஆட்சி புரிந்தனன் என்பது தேற்றம்."
1259,கிருஷ்ணதேவன் தமக்கையின் கணவன் இரண்டாம் பூதுகனும் பராந்தக சோழனுக்குப் பகைவன் ஆயினான்.
1260,அவ்வெண்ணத்தை நிறைவேற்றும் பொருட்டுச் சுமார் எட்டு ஒன்பது ஆண்டுகள் வரையில் தன் படைகளைப் பெருக்கிக் கொண்டு கி.பி.
1261,ல் அவ்வேந்தன் சோழ இராச்சியத்தின் மேல் படையெடுத்தான்.
1262,அவனுக்கு உதவி புரிய வேண்டி மேலைக்கங்க மன்னனாகிய இரண்டாம் பூதுகனும் பெரும் படையுடன் வந்து சேர்ந்துகொண்டான்.
1263,வடஆர்க்காடு ஜில்லாவில் அரக்கோணத்திற்குத் தென்கிழக்கே ஆறுமைல் தூரத்திலுள்ள தக்கோலத்தில் பெரும் போர் நடைபெற்றது.
1264,அப்போரில் இருபக்கங்களிலும் பல்லாயிரவர் உயிர் துறந்தனர்.
1265,"இச்செய்தி, திருவாலங்காட்டுச் செப்பேடுகளிலும்ஆனமைங்கலச் செப் பேடுகளிலும் சொல்லப்படுகிறது."
1266,"இராஷ்டிரகூடர் ஆட்சியும் தொண்டை மண்டலத்திலும், திருமுனைப்பாடி நாட்டின் வட பகுதியிலும் நிலைபெற்றது எனலாம்."
