Line Number,Sentence
1298,"இனி, இதிலுள்ள உவமைகளில் இன்றியமையாதவற்றை உரைநடைப் படுத்து இங்கு எழுதுகின்றாம்."
1299,பாட்டின் முதலுறுப்பாகிய தரவுகளிற் பெரும்பாலன உள்ளுறை அமைந் தனவே.
1300,"அவையனைத்தையும், காட்டலுறின் மிக விரியுமாதலின், சான்றாக ஒன்று காட்டுதும்."
1301,"இங்ஙனம் மலையியற்கை கூறு முகத்தால், தோழி தான் கருதிய வேறு பொருளைத் தலைவனுக்கு உணர்த்து கின்றாள்."
1302,"இனி, இதில் நாடகத்திற்கு இன்றியமையாத இன்பச் சுவையும் நகைச் சுவையும் தோற்றுவிக்கும் தொடர்கள் ஆண்டாண்டுக் காணப்படுகின்றன."
1303,அவற்றுட் சிலவற்றை உரைப்படுத்துக் காட்டுதும்.
1304,யான் நின்னுடைய கண்ணாலே தலைவன் கோலத்தை மிகவும் காண்பேனன்றோ? என்றாள்.
1305,குறிஞ்சி .
1306,"தலைவன் தம் வேட்கை மிகுதியால் நிகழ்த்தியன இவை யென்று தலைவி தோழிக்குக் கூறுவாளாய், தோழி!"
1307,"அவன்றான், பொற்பூவாற் செய்த கோதையும், தொடி செறிந்த முன்கையும், அணைபோலும் மென்றோளும் உடையாய்!"
1308,"நாணிலனாயிருந்தான் எனத் தலைவி கூறினாள் அது கேட்ட தலைவன், அக்குறிப்பால் நிகழ்வனவெல்லாம் நீ அறிவாய் யான் அறியேன்."
1309,மெல்லிய பூங் கொத்துக்களையுடைய கொடியை யொப்பாய்!
1310,"நின் மேனி புல்லுதற்கு இனிதாயிருத்தலால் நின்னை யான் புல்லினேன் என்றான் என்றலும் தலைவி, ஏடா!"
1311,உண்ணார் காண் என்றான் என்பது.
1312,"இனி, இதில், தலைவன் பண்பும், தலைவி பண்புமாகக் கூறியுள்ள சிற்சில தொடர்கள் அறிந்து மகிழற்பாலன."
1313,"தலைவி பண்பு, அருமழை தரல் வேண்டில் தருகிற்கும் பெருமையள் என்று கூறப்பட்டுள்ளது."
1314,"பாரி பறம்பிற் பனிச்சுனைத் தெண்ணீரும், அவனது மாரியனைய வண்மையும், தேர்க் கொடையும் வேறு பல்லிடத்தும் எடுத்துரைக்கப்படுதலின் என்க."
1315,இங்கெடுத்துக் காட்டிய தொடர்களில் பலவற்றின் கருத்துக்கள் பின்வரும் குறட்பாக்களிலும் ஒருவாறு அமைந் திருத்தல் காண்க.
1316,உடுக்கை இழந்தவன் கைபோல வாங்கே யிடுக்கண் களைவதா நட்பு. சமன்செய்து சீர்தூக்குங் கோல்போ லமைந்தொருபாற் கோடாமை சான்றோர்க் கணி.
1317,அஞ்சுவ தஞ்சாமை பேதைமை யஞ்சுவ தஞ்ச லறிவார் தொழில்.
1318,நல்கூர்ந்தார் செல்வமகள் என்று தலைவி அருமை பாராட்டிக் கூறப்படுகிறாள்.
1319,பிள்ளையால் மிடிப்பட்டாருடைய செல்வத்தையுடைய மகள் என்பது இதன் பொருளாம்.
1320,நெறியறி செறிகுறி புரிதிரி பறியா வறிவன் என்று கணி கூறப்படுகிறான்.
1321,என் செய்வாம் என்றார்க்குப் பொன்செய்வாம் என்பது ஓர் நாகைக் குறிப்பு மொழியாகக் கூறப்பட்டுளது.
1322,மெய் தொட்டுச் சூளுறுதல் கூறியுள்ளது.
1323,"இதிலுள்ள திரிசொற்களைக் காணுங்கால், இவ்வாசிரியர், சொற்களைத் தம் வழிப்படுத்து ஆண்டுளார் என்பது புலனாம்."
1324,"பின்வரும் பாட்டுக்களிலுள்ள இயற்கை நவிற்சியும், பிற அழகும் ஓர்ந்து கொள்க."
1325,"இதிலுள்ள பாக்களெல்லாம் ஒன்பதடிச் சிறுமையும், பன்னிரண்டடிப் பெருமையும் உள்ளன."
1326,இதில் இருபது பாட்டுக் கபிலர் பாடியன.
1327,கிடங்கில் என்ற ஊரும் சிறப்பிக்கப் பெற்றுளது.
1328,"ஆளில் பெண்டிர் தாளிற் செய்த, நுணங்கு நுண்பனுவல் என்னும் தொடர் நினைவு கூரத்தக்கது."
1329,"புறப்பாட்டிலும், பருத்திப் பெண்டின் பனுவல் என்று கூறப்பெற்றுள்ளது."
1330,அக்காலத்து இல்லிலிருந்து மகளிரும் புரிந்து சிறப்பெய்திய இத்தொழில் இப்பொழுது நம் நாட்டில் அருகினது பெரிதும் இரங்கத்தக்கது.
1331,"காட்டகத்து வேட்டுவன் பெறும் உணவுப் பொருள்களும் , தலைவி கிளியைத் தூது விடுதலும் நன்றாகக் கூறப்பட்டுள்ளன."
1332,இவற்றிலுள்ள உள்ளுறை யுவமங்களெல்லாம் வியக்கற் பாலனவே.
1333,குறுந்தொகை எட்டுத்தொகையுள் ஒன்றாகிய இந்நூல் கடவுள் வாழ்த்து உட்பட நாநூற்றிரண்டு அகவற்பாக்களையுடையது.
1334,"இதிலுள்ள பாக்களெல்லாம் நான்கடிச் சிறுமையும், எட்டடிப் பெருமையும் உள்ளன."
1335,இதில் கபிலர் பாடியன இருபத்தொன்பது பாட்டு.
1336,தலைவிக்குக் கொல்லி மலையிலுள்ள பாவை உவமிக்கப் பட்டுளது.
1337,மிளகின் றழையைக் குரங்கு அருந்தும் என்று கூறியிருக்கிறது.
1338,சிறுகுடி பசிப்பின் யானையின் கொம்புகளை விற்று உண்பிக்கும் ஓரி யென்பானது கொல்லிமலை என்கின்றார்.
1339,மலையனது முள்ளூர்க் கானத்தைப் பலவிடத்துச் சிறப்பித் தோதுகிறார்.
1340,"இதிலுள்ள பாக்களெல்லாம் மூன்றடிச் சிற்றளவும், ஆறடிப் பேரளவும் உள்ளன."
1341,இதன் ஒவ்வொரு நூறும் பப்பத்துப் பாக்கள் ஒல்வொரு தன்மையினவாக இயன்றுள்ளன.
1342,"குன்றக்குறவன் பத்து, கேழற் பத்து, குரக்குப்பத்து, கிள்ளைப்பத்து, மஞ்ஞைப்பத்து என்பனவாகும்."
1343,"இதிலுள்ள பாக்களெல்லாம் சொற்சுவை, பொருட்சுவை துவன்றிக் கற்பார்க்குக் கழிபேரினிமை பயப்பன."
1344,இயற்கை வளங்களை யெழில் பெற விளக்குவன.
1345,"இவ்வொரு பாட்டிலிருந்தே இந்நூலின் அருமை, பெருமை களைத் தெரிந்து கொள்ளலாகும்."
1346,"தலைவனுடன் அவனூர்க்குச் சென்று மீண்ட தலைமகள், நீ சென்ற நாடு எவ்வியல்பிற்று? என வினாவிய தோழிக்குக் கூறியது இது."
1347,இதன் பொருள் அன்னையே!
1348,யான் சொல்லு மிதனை விரும்பிக் கேள்.
1349,"தலைவரது நாடு எவ்வியல்பிற்று எனினும், அதுவே எனக்குச் சிறந்ததாவது என்று கூறுவதே தலைவியின் அன்பின் திறனைப் புலப்படுப்பதாகும்."
1350,"உண்ணின், அஃது அப்பொழுது இனிமை சிறிதும் இலதாதலே யன்றிப் பின்பு பல பிணியும் உண்டாக்கிப் பெருந்துன்பத்தை விளைப்பதுமாகும்."
1351,"தேனும், பாலும் தனித்தனி மிக்க இனிமை யுடையவாய், எத்துணைப் பெரியாராலும் விரும்பி யுண்ணப்படுவன."
1352,"அவற்றுள் ஒன்று மற்றையதுடன் கலக்கப்பெறின், அக்கலவை பருகுதற்கு அதன் மேலும் இனிமையுடைத்தாகும்."
1353,"அவ்வளவன்றி, அஃது உடம்பிற்கு உறுதி பயந்து, பிற் பொழுதுகளில் இன்பம் விளைப்பது மாகும்."
1354,"கலங்கற் சின்னீர் தெருளாமையால் உண்பான் என்னும் இறையனாரகப் பொருளுரையும், பாலொடு தேன் கலந்தற்றே என்னும் திருக்குறளும் இங்கு நினைக்கற்பாலன."
1355,"இவ்வாற்றால், யாவரானும் வெறுக்கத்தகும் கலங்கல் நீர், யாவரானும் விரும்பத் தகும் தேன்பாற் கலவையினும் தலைமகட்கு இனிமை யுடைத் தாயிற்று."
1356,இதற்கு என்னை காரணம்?
1357,அன்பு என்பதொன்று எத்துணை யிழிந்த பொருளையும் உயர்ந்த பொருளாக்க வல்ல மருந்தாகவுள்ளது.
1358,"அன்பு என்ப தொன்றின் தன்மை அமரரும் அறிந்ததன்று என்னில், இதன் பெருமையை யாம் எங்ஙனம் உரைக்கேம்?"
1359,"தேன் என வாளா கூறாது, நம் படப்பைத் தேன் என்றது, அது பிறவிடத்துள்ளதினும் இனிது என்பது தோற்றுதற்கு."
1360,தோழியை அன்னாய் என்றது அருமை பாராட்டி.
1361,இரு முறை விளித்தது ஆர்வம் பற்றி.
1362,வாழியென்றது அவள் உடன் போக்கிற்குத் துணை புரிந்த உதவி பற்றி.
1363,வேண்டு என்றது தான் சொல்லும் பொருளின் இன்றியமையாமை பற்றி.
1364,இவ்வாறு இவ்வாசிரியர் அன்பினது திறத்தை இரண்டு மூன்றடிகளால் விளங்க வைத்த மாட்சியை எங்ஙனம் வியந்துரைக்க வல்லேம்?
1365,"ஆகலால், பெரிய மலை நாடனே!"
1366,இவளை விரைய வரைந்து கொள்வாயாக. என்று வியப்புத் தோன்றக் கூறப்பட்டுளது.
1367,"பின்னுளோரும், ஆயோ வெனுங் குரலையோ புனத்தை யழிக்கின்றதே என இக்கருத்தை எடுத்தமைத்துளார்."
1368,"மற்றும் பல உவமை களும், உள்ளுறைகளும் இதிற் கூறப்பட்டுள்ளன."
1369,வெள்ள வரம்பின் ஊழி என இதில் வந்துளது.
1370,"ஆண் குரங்கினை, மந்திக் கணவன் கல்லாக்கடுவன், குரங்கின்றலைவன் என்றிங்ஙனம் இதிற் கூறியிருக்கிறது."
1371,குரங்கி னேற்றினைக் கடுவனென்றலும் எனத் தொல்காப்பியனார் வழுவமைத் திருத்தலும் காண்க.
1372,"அகநானூறு எட்டுத் தொகையுள் ஒன்றாகிய இந்நூல், கடவுள் வாழ்த்து உட்பட நானூற்றொரு அகவற் பாக்களை யுடையது."
1373,"இஃது, அகம் எனவும், அகப்பாட்டு எனவும், நெடுந்தொகை எனவும் வழங்கும்."
1374,"இதிலுள்ள பாக்களின் அடியளவு சிறுமை பதின்மூன்று, பெருமை முப்பத்தொன்று."
1375,இதிற் கபிலர் பாடியன பதினெட்டுப் பாக்கள்.
1376,"தலைவன் வரைந்து கொள்ள வருகின்றமையைத் தலைவிக்கு அறிவிக்கலுறும் தோழியானவள், குளிர்ந்த கண்ணும், தளிர் போலும் மேனியும் உடையாளே!"
1377,ஏரி நிறைந்தனைய செல்வன் கண்டாய் என்ற தேவாரம் இங்கே கருதத்தக்கது.
1378,"தலைமகன் சிறைப் புறத்தானாகத் தலைமகள் தோழிக் குரைக்கு மிடத்து, தோழீ!"
1379,"கரு நாயிறு போல்பவர் காலொடு போய், வருநா ளயலே வருவாய் மனனே என்று கம்பர் கூறியது இங்கே நினைக்கத்தக்கது."
1380,"வண்டினை, அறுகால் யாழிசைப் பறவை என்று கூறியிருக் கிறது."
1381,"நள்ளி யானவன், இரப்போர்க்கு மழை சுரந்தாற்போல், தேரும், களிறும் நல்குவன் என்று கூறப்பட்டிருக்கிறது."
1382,புறப்பொருட் பகுதியும் பிறவும் புறநானூறு எட்டுத் தொகையுள் ஒன்றாகிய இந்நூல் கடவுள் வாழ்த்து உட்பட நானூற்றொரு அகவற் பாக்களையுடையது.
1383,புறத்தின் பகுதியாகிய வெட்சி முதலிய திணைகளுக்குரிய துறைப் பொருளமைந்த நானூறு பாக்களை யுடைமையின் புறநானூறு எனப் பெயர் பெற்றது.
1384,"இது புறம் எனவும், புறப்பாட்டு எனவும் வழங்கும்."
1385,"இந்நூலின் இறுதியிலுள்ள பாடல்கள் பல சிதைந்து விட்டமையின், பாக்களினுடைய அடிகளின் சிறுமை பெருமை தெரிந்து கொள்ளக் கூடவில்லை."
1386,"அவற்றுள், இரண்டு பாட்டுச் செல்வக் கடுங்கோ வாழியாதனைப் பாடியவை திருமுடிக்காரியைப் பாடியவை நான்கு."
1387,பேகனைப் பாடியது ஒன்று.
1388,பாரியைப் பாடியவை ஏழு.
1389,பாரி துஞ்சிய வழி இரங்கிப் பாடியவை எட்டு.
1390,பாரி மகளிரைக் கொண்டு சென்று விச்சிக்கோனைப் பாடியது ஒன்று.
1391,இருங்கோவேளைப் பாடியவை இரண்டு.
1392,தாம் வடக்கிருக்கும் பொழுது பாரியை விளித்துப் பாடியது ஒன்று.
1393,மகட்பாற் காஞ்சியாகப் பொதுவே பாடியவை இரண்டு.
1394,பாரி துஞ்சியதற்கு இரங்கிப் பாடிய பாட்டுக்கள் மிகவும் உருக்கமானவை.
1395,"எனினும், நல்லிசைப் புலவராகிய கபிலர் இவ்வழக்கமுடையார் என்பதற்கு யாம் எளிதில் இணங்கக் கூடவில்லை."
1396,இவ்வாசிரியர் தாமே இன்னா நாற்பதில் இவற்றைக் கடிந்திருக்கின்றனர்.
1397,"பெரும்பாணாற்றுப் படையில், அந்தணர்க்கு வேறு தூய உணவு கூறப்பட்டிருத்தலும் கருதற்பாலது."
1398,"இங்ஙனம் பாடுவதுண் டென்பது, சிறுகுடி கிழான் பண்ணனைக் கிள்ளிவளவன் பாடிய, யான் வாழுநாளும் பண்ணன் வாழிய ."
1399,"பசிப்பிணி மருத்துவனில்லம், அணித்தோ சேய்த்தோ கூறுமி னெமக்கே என்னும் புறப் பாட்டால் நன்கு துணியப்படும்."
1400,"பப்பத்துப் பாக்களுள்ள பத்துப் பகுதிகளைத் தொகுத்த தாகலின், இது பதிற்றுப்பத்து எனப் பட்டது."
1401,இதிலுள்ள பாக்களெல்லாம் புறத்திணைக்குரிய துறைப் பொருளமைந்தன.
1402,"இங்ஙனம் பெயர் முதலியவும், பதிகமும் எழுதினோர் இன்னாரின்னாரெனத் துணியக் கூடவில்லை எனினும், அவை மிக்க பழமையுள்ளனவென்றே தெரிகிறது."
1403,"பதிற்றுப்பத்தில், எழாம் பத்துக் கபிலர் பாடியதாகும்."
1404,அதனாற் பாடப்பட்டோன் செல்வக் கடுங்கோ வாழியாதன் என்னும் சேரர் பெருமானாவன்.
1405,"ஏழாம் பத்தின் முதற்பாட்டிலிருந்து, வேள்பாரி துஞ்சிய பின்பு கபிலர் செல்வக்கடுங்கோவை யடுத்து இது பாடினாரென்று தெரிகின்றது."
1406,"கொடுமணம், பந்தர் என்ற ஊர்களும், நேரி, அயிரை என்ற மலைகளும் செல்வக்கோவுக்கு உரியவாகக் கூறப்பட்டுள்ளன."
1407,இன்பமே துய்க்கும் வடபுலம் உத்தர குரு இதிற் கூறப்பட்டுள்ளது.
1408,"இன்னா நாற்பது பதினெண் கீழ்க்கணக்கினுள் ஒன்றாய இந்நூல், கடவுள் வாழ்த்து உள்பட நாற்பத்தொரு வெண்பாக்களை யுடையது."
1409,"இதிலுள்ள ஒவ்வொரு பாட்டும், இன்னது இன்னது இன்னா எனக் கூறுதலின், இஃது இன்னா நாற்பது எனப் பெய ரெய்திற்று."
1410,"இதற்கு எதிராக, இன்னது இன்னது இனிது எனக் கூறும் பாக்களை யுடைய நூல் இனியவை நாற்பது என வழங்குகிறது."
1411,இவற்றுள் ஒன்று மற்றொன்றைப் பார்த்துப் பாடியதாகும் எனக் கருதற்கு இடனுண்டு.
1412,"பதினெண் கீழ்க்கணக்கு நூல்கள், கடைச் சங்கப் புலவர்களாலும், சிறிது பிற்காலத்து விளங்கிய புலவர் களாலும், இயற்றப் பட்டனவெனத் தெரிகிறது."
1413,"இவற்றுட் சில நூல்கள் அகப் பொருளாகிய இன்பத்தைக் கூறாநிற்க, பல நூல்கள் அறம் முதலியன பற்றிய நீதிகளைக் கூறுகின்றன."
1414,"அவை கூறும் நீதிகள் தாம், பெரும்பாலும் எல்லா மக்களும் மேற் கொள்ளத் தக்கவாயும், உறுதி பயப்பனவாயும் உள்ளன."
