Line Number,Sentence
322,சேலம் நகர சபைத்தலைவர் ஆச்சாரியார் இல் சேலம் நகர சபைத் தலைவராய்த் தேர்ந்தெடுக்கப்பட்டார்.
323,சீர்திருத்த வேலைகள் சேலம் நகரத்தில் பிராமணர்கள் வாழும் தெருக்கள் சில உண்டு.
324,அவற்றில் உள்ள நீர்க் குழைகள் ஒரு சமயம் பழுதுபட்டன.
325,அவற்றைப் பழுது பார்க்க ஆச்சாரியார் சில ஆட்களை அனுப்பினார்.
326,அவர்கள் தாழ்த்தப்பட்ட இனத்தினர்.
327,அதனை உணர்ந்த பிராமணர்கள் பெருங் கிளர்ச்சி செய்தனர்.
328,இதுபற்றி நகர சபைக் கூட்டத்தில் ஒரு கண்டனத் தீர்மானமும் கொண்டுவரப்பட்டது.
329,"நகர சபைத்தலைவரான ஆச்சாரியார், இக்கண்டனத் தீர்மானம் நகரசபை விதிகட்கு மாறுபட்டது, என்று கூறித் தீர்மானத்தைத் தள்ளிவிட்டார்."
330,வைதிகர் கிளர்ச்சியோடு நின்றுவிட்டனர்.
331,சேலம் கல்லூரியைச் சேர்ந்த மாணவர் விடுதியில் எல்லா வகுப்பு மாணவரும் இருந்தனர்.
332,ஆச்சாரியார் அவ்விடுதியில் வேலைபார்க்கத் தாழ்த்தப்பட்ட இளைஞர் இருவரை நியமித்தனர்.
333,உடனே வைதிகர் மீண்டும் கிளர்ச்சி செய்தனர் தங்கள் பிள்ளைகளை விடுதியிலிருந்து நிறுத்திக் கொள்வதாக அச்சுறுத்தினர்.
334,"சிறந்த காங்கிரஸ்காரரான விஜய ராகவாச் சாரியா ணர் வைதிகர் சார்பில் ஆச்சாரியாரைக் கண்டு, இது குறித்துப் பேசினார்."
335,"இரும்புத்தலையரான ஆச்சாரியார், இன்னும் எவ்வளவு காலத்திற்குப் தாழ்த்தப் பட்டவர் என்னும் ஓரினத்தை வைத்திருக்கப் போகிறீர்கள்?"
336,அவர்கள் இந்துக்கள் அல்லரா?
337,அவர்கள் செய்த பாவம் என்ன?
338,அவர்களை நம்முடன் தாராளமாகப் பழகவிட்டு முன்னுக்குக் கொண்டுவருதல் நமது கடமை அன்றோ?
339,"நீங்கள் பிள்ளைகளை விடுதியிலிருந்து நீக்கினால், அப்பிள்ளைகளைப் பள்ளியிலிருந்து நீக்க எங்கட்குத் தெரியும், என்று உருக்கமாகவும் அழுத்தமாகவும் அறைந்தார்."
340,வைதிகர் சோர்ந்தனர்.
341,ஆச்சாரியார் நகர சபைத்தலைவராய் இருந்தபொழுது தாழ்த்தப்பட்ட மக்களுக்குக் கல்வி வசதி அளித்தார் குடிதண்ணீர் வசதியும் அளித்தார்.
342,சீர்திருத்தத் திருமணம் சேலம் மாவட்டத்தில் குமாரமங்கலம் என்பது ஒரு சிற்றூர்.
343,டாக்டர் சுப்பராயன் என்பவர் அதன் பெருநிலக் கிழவர்.
344,அவர் கன்னட நாட்டுப் பிராமணப் பெண்மணியாரை மணக்க விரும்பினார்.
345,அந்த அம்மையார் பெயர் இராதாபாய் என்பது.
346,அக்கலப்பு மணத்தைப் பலர் பலமாக எதிர்த்தனர்.
347,ஆச்சாரியார் அக்கலப்பு மணத்தை ஆதரித்தார் தாமே முன்னின்று அத்திருமணத்தைச் சிறப்புற நடத்திவைத்தார்.
348,தாழ்த்தப்பட்டவருடன் விருந்துண்ணல் சிதம்பரத்தைச் சேர்ந்த சகஜனந்தர் என்பவர் ஒரு துறவியார்.
349,அவர் தாழ்த்தப்பட்ட வகுப்பினர் வட மொழியும் தென் மொழியும் நன்கு பயின்றவர்.
350,அவர் சிதம்பரத்தில் நந்தனார் பெயரால் பள்ளி ஒன்றை வைத்துத் தாழ்த்தப்பட்டவர்க்குக் கல்வி வசதி அளித்து வருகின்றவர்.
351,அவர் வ.
352,சிதம்பரம் பிள்ளையவர்களிடம் தமிழ் பயின்றவர் நாட்டு விடுதலையில் நாட்டம் கொண்டவர்.
353,அவர் இல் சேலம் நகரத்திற்குச் சென்றார்.
354,ஆச்சாரியார் அவரை அன்புடன் வரவேற்றார் அவரைச் சிறப்பிக்க விருந்தொன்றை நடத்தினார்.
355,அவவிருந்தில் பெரு மக்கள் பலர் கலந்துக் கொண்டனர்.
356,ஆச்சாரியாரும் அவர் நண்பர்களும் அக்கட்டுப்பாட்டைக் கண்டு கலங்கவில்லை.
357,அவர்கள் தங்கள் வீட்டுச் சடங்குகளைத் தாங்களே ஒருவர்க்கொருவர் செய்து கொண்டனர்.
358,ஆச்சாரியாரின் தந்தையார் இல் காலமான போதும் வைதிகர் வரவில்லை.
359,ஆச்சாரியார் தம் நண்பர் உதவியால் எல்லாச் சடங்குகளையும் குறைவின்றிச் செய்து முடித்தார்.
360,மகாராஷ்டிரப் பிராமணரான பால கங்காதர திலகர் உரிமைப் போரில் தலை சிறந்து விளங்கினார்.
361,ஆச்சாரியார் அவர் உழைப்பைப் பாராட்டி அவரது சுயாட்சி இயக்கத்திற்கு ஆதரவு நல்கினார்.
362,கவியரசியார் சரோஜனி தேவியார் மாநாட்டுக்குத் தலைமை தாங்கினார்.
363,"பெசன்ட் அம்மையார், நிபந்தனை இன்றியே ஆங்கிலேயர்க்கு நாம் உதவி புரிய வேண்டும் என்னும் தீர்மானம் கொணர்ந்தார்."
364,அம்மையார் அத்தீர்மானத்தைப் பற்றி அழகாகப் பேசினார்.
365,"அதனை எதிர்த்து ஆச்சாரியார் பேசி, முதல் தீர்மானத்தை ஆதரித்தார்."
366,இறுதியில் முதல் தீர்மானம் நிறைவேறியது அம்மையார் தீர்மானம் தோற்றது.
367,அதுமுதல் பெசன்ட் அம்மையார் அரசியலிற் கலக்காது ஒதுங்கிவிட்டார்.
368,அவர் இல் பம்பாயிற் கூடிய காங்கிரஸ் சிறப்பு மாநாட்டில் ஒரு தீர்மானத்தைக் கொணர்ந்தார் அதனைப் பலர் எதிர்த்தனர்.
369,அதனை ஆச்சாரியார் இரண்டோரிடங்களில் சொற்களை மாற்றி அமைத்துச் செவ்வைப்படுத்தினார்.
370,உடனே தீர்மானம் நிறைவேறியது.
371,தாசர் ஆச்சாரியாரது நுண்ணறிவை வியந்து பாராட்டினார்.
372,சென்னை வாழ்க்கை சென்னையிற் குடியேற்றம் ஆச்சாரியார் நுண்ணறிவும் வாதத்திறனும் ஆட்சித்திறனும் சென்னை மாகாணத்திற் பரவியது.
373,அறிவாற்றல்களிற் சிறந்த அவர் சேலத்தில் இருத்தலைவிடச் சென்னையில்மாகாணத்தின் தலைநகரில்இருத்தல் நல்லது என்பதை உணர்ந்த ஹிந்து பதிப்பாளர் எஸ்.
374,"கஸ்தூரிரங்க ஐயங்கார் என்பவர், சென்னையிற் குடியேறுமாறு ஆச்சாரியாருக்குக் கடிதம் வரைந்தார்."
375,"ஆதலின் அவற்றை அடக்கும் முறைகளை ஆராய்ந்து சட்டம் இயற்றவேண்டும், என்று இந்திய அரசாங்கம் ஒரு குழுவை நியமித்தது."
376,"அக்குழு நிலைமையை நன்கு ஆராய்ந்து, அடக்குமுறைச் சட்டம் ஒன்றைத் தயாரித்து, இந்திய அரசாங்கத்துக்குக் கொடுத்தது."
377,அக்குழுவின் தலைவர் நீதிபதி ரௌலட் என்பவர்.
378,"ஆதலின், அச்சட்டம் ரௌலட் சட்டம் எனப் பெயர் பெற்றது."
379,காந்தியடிகள் ரௌலட் சட்டம் தோன்றிய இல் காந்தியடிகள் காங்கிரசில் தீவிரப்பங்கு கொண்டார்.
380,இச் சட்டம் நமது உரிமைப் போரைத் தடை செய்ய எழுந்ததாகும்.
381,இதனை அமைதியான முறையில் எதிர்த்து ஒழித்தலே நல்லது.
382,இக்கொள்கையை நாடு முழுவதும் பரப்ப யாத்திரை செய்தார்.
383,அப்பொழுது ஆச்சாரியாரும் அடிகளும் நன்கு கலந்து பேச வாய்ப்பு ஏற்பட்டது.
384,அடிகளைக் காண அறிஞர் பலர் வந்தனர்.
385,அடிகள் அவர்கட்குத் தமது புதிய அறப்போர் முறையை விளக்கினார்.
386,வந்திருந்தோருள் பலர் அப்புதிய போர் முறையின் உட்பொருளைத் தெளிவுற அறியாது மயங்கினர்.
387,உடனே ஆச்சாரியார் மிகத் தெளிவாக விளக்கிப் பேசினார்.
388,"அவ்விளக்கத்தைக் கேட்டு அடிகள் பெருவியப்புற்று, ஆச்சாரியாரது நுண்ணறிவைப் பாராட்டினார்."
389,இறுதியில் சென்னையில் சத்தியப் போர்க் கழகம் ஒன்று நிறுவப்பட்டது.
390,"ஆச்சாரியார் அதன் செயலாளராக இருந்தாற்றான் கழகம் சீரிய முறையில் பணியாற்றும் என்று பலர் கூறி, அவரைச் செயலாளராய்த் தேர்ந்தெடுத்தனர்."
391,ஒத்துழையாமைப் போர் ஆங்கிலேயர்க்குத் தீங்கு செய்யாதே அவர்களது துப்பாக்கிக்கு எதிராகத் தடியைப் பயன்படுத்தாதே.
392,"தூய உள்ளம், உரிமையில் நாட்டம், இன்னா செய்யாமை, அமைதியான மறியல், பொறுமை இவற்றைக் கைக்கொள்."
393,இவற்றில் நம்பிக்கை வை.
394,"இவையே இறுதியில் வெற்றி தரும், என்பது அடிகள் அறவுரை."
395,உடனே நாடு முழுவதிலும் இருந்த காங்கிரஸ்காரர்கள் அவரைப் பின்பற்றினர்.
396,ஆச்சாரியார் தமது வழக்கறிஞர் தொழிலை விட்டார் கல்லூரியிற் படித்து வந்த தம் மைந்தர் இருவரையும் கல்லூரியி லிருந்து நிறுத்தினார்.
397,சொல்வதொன்று செய்வதொன்று என்பது அவர் சாதகத்தில் இல்லை அன்றோ?
398,ஆச்சாரியார் தியாகத்தைக் கண்டு மக்கள் வியந்து பாராட்டினர்.
399,அத்தியாகத் துக்குப் பிறகு அவரது செல்வாக்கு மிகுதிப்பட்டது.
400,ஆச்சாரியார் அத்தடையை மீறிப்பேசினார்.
401,அரசாங்கம் அவருக்கு மூன்று திங்கள் சிறைத்தண்டனை அளித்தது.
402,ஆச்சாரியார் சிறையில் என்ன செய்தார்?
403,அவர்தம் சிறை அநுபவங்களை நாடோறும் எழுதி வந்தார் சாக்ரடீஸ் என்ற கிரேக்க தத்துவ அறிஞரது வரலாற்றை எழுதினார்.
404,இவை இரண்டும் பின்னர் இரண்டு நூல்களாக வெளிவந்தன.
405,ஆச்சாரியார் ஆம் ஆண்டு மார்ச்சுத் திங்கள் ஆம் நாள் விடுதலை பெற்றார்.
406,அவருடன் காங்கிரஸ் தொண்டில் ஈடுபட்டிருந்த எம்.
407,"சிங்கார வேல் செட்டியாரும், ஈ."
408,இராமசாமி நாயக்கரும் அவரை வேலூரில் வரவேற்றுச் சிறப்புச் செய்தனர்.
409,யங் இந்தியா ஆசிரியர் ஆச்சாரியார் விடுதலை பெற்ற இரண்டாம் நாள் காந்தியடிகள் ஆறு ஆண்டுகள் சிறைத்தண்டனை பெற்றார்.
410,அவர் தாம் வெளியிட்டு வந்த யங் இந்தியா என்னும் ஆங்கிலத் தாளை ஆச்சாரியாரிடம் ஒப்புவித்தார் ஆச்சாரியார் அதன் ஆசிரியரானார்.
411,"ஆயின் ஆச்சாரியார், அடிகளைப் பின்பற்றி வாளா இருந்தார்."
412,"ஆச்சாரியார் தமது ஆச்சிரமத்தில் காந்திசேவா சங்கம் என்பதை அமைத்து, அமைதியான முறையில் மேற் சொன்ன திட்டங்களை நிறைவேற்றிவந்தார்."
413,"வளமனையில் வாழ்ந்த அவர், ஒரு சிறு குடிலில் வாழலானார்."
414,"சுற்றுப்புறக் கிராம மக்கட்குப் பஞ்சும், இராட்டைகளும் கொடுக்கப்பட்டன."
415,அவர்கள் நூற்ற நூலைப் பெற்றுக்கொண்டு கூலிதரப்பட்டது.
416,ஆச்சாரியார் மதுவிலக்குப் பிரசாரத்தைச் சுற்றுப்புறச் சிற்றூர் களில் நிகழ்த்தினார்.
417,அதன் பயனாகப் பல கடைகள் மூடப்பட்டன.
418,குடிகாரர் மனைவிமார்களும் பிள்ளைகளும் ஆச்சாரியாரை மனமார வாழ்த்தினர்.
419,அடிகள் உப்பெடுக்கும் உரிமையை ஏழைகட்கு வழங்க வேண்டும் என்று அரசாங்கத்தை வேண்டினார் அரசாங்கம் மறுக்கவே உப்புப் போரைத் தொடங்கினார்.
420,புனா ஒப்பந்தம் இல் மீண்டும் சட்ட மறுப்புப் போர் தொடங்கியது.
421,ஆச்சாரியார் அதில் ஈடுபட்டுச் சிறை சென்றார் சில மாதங்கட்குப் பிறகு விடுதலை பெற்றார்.
422,அப்போது தாழ்த்தப்பட்டவர்க்குத் தனித் தொகுதி வழங்கலாகா தென்று சிறையில் காந்தியடிகள் உண்ணவிரதம் இருந்தார்.
423,இருதிறத்தாருக்கும் ஓர் ஒப்பந்தம் உண்டாயிற்று.
424,அதுவே புனா ஒப்பந்தம் என்பது.
425,அவ்வொப்பந்தத்திற்குப் பிறகு காங்கிரஸ் தாழ்த்தப்பட்டவர் நலனில் மிக்க கவனம் செலுத்தத் தொடங்கியது.
426,இலட்சுமி தேவதாஸ் திருமணம் தேவதாஸ் என்பவர் காந்தியடிகளின் மைந்தருள் ஒருவர்.
427,அவர் தந்தையாருடன் உரிப் போரில் ஈடுபட்டவர்.
428,அவர் இந்திமொழியைத் தென்னாட்டிற் பரப்புங்காரணமாக இல் சுற்றுப் பிரயாணம் செய்தார் ஆச்சாரியாரது காந்தி ஆச்சிரமத்தில் தங்கினார்.
429,அப்பொழுது ஆச்சாரியாரது இரண்டாம் மகளாரான இலட்சுமி அம்மாளும் தேவதாஸ் காந்தியும் ஒருவரை ஒருவர் சந்தித்துக் காதல் கொண்டனர்.
430,இக்காதற் செய்தி காந்தியடிகட்கு எட்டியது.
431,இளங்காதலர் இருவரும் அடிகள் திட்டத்திற்கு இணங்கினர்.
432,ஐந்தாண்டுகள் பறந்தன.
433,இல் அடிகள் உப்புப் போரில் ஈடுபட்டுச் சிறை சென்றார் பின்னர் ஒத்துழையாமைப் போரில் ஈடுபட்டார்.
434,இவற்றால் மூன்றாண்டுகள் கழிந்தன.
435,மணமக்களை அடிகளும் ஆச்சாரியாரும் உளமார வாழ்த்தினர்.
436,"மாகாண முதலமைச்சர் இல் மாகாண சுயாட்சி வழங்கப்பட்டதால், காங்கிரஸ் தேர்தலில் நின்றது."
437,"நாட்டுக்காக அரிய தியாகங்களைச் செய்த காங்கிரஸ்காரர்கள் நின்றதால், மக்கள் அவர்களையே தேர்ந்தெடுத்தனர்."
438,அதனால் பல மாகாணங்களில் காங்கிரஸ் அமைச்சர் அவைகள் ஏற்பட்டன.
439,சென்னையில் ஆச்சாரியாரை முதலமைச்சராய்க் கொண்ட அமைச்சர் அவை ஏற்பட்டது.
440,அஃது முதல் வரை இரண்டாம் உலகப்போர் தோன்றும் வரை மாகாணத்தை ஆட்சி புரிந்தது.
441,அத்தீர்மானத்தின்படி காங்கிரஸ் அமைச்சர் அவைகள் கலைக்கப்பட்டன.
442,போரில் ஈடுபடாதீர்கள் என்று பிரசாரம் செய்வதன் வாயிலாகத் தனிப்பட்டவர் சிறை சென்றுகொண்டே இருத்தல் வேண்டும் என்று காங்கிரஸ் தீர்மானித்தது.
443,பாகிஸ்தான் ஆதரிப்பு முஸ்லிம் லீகர் பாகிஸ்தானை விரும்பினர்.
444,காந்தியடிகள் உள்ளிட்ட தலைவர்கள் ஆச்சாரியார் போக்கிற்கு வருந்தினர் தமிழ் நாட்டார் அவர்மீது சீற்றம் கொண்டனர்.
445,"எனவே ஆச்சாரியார் காங்கிரசிலிருந்து விலகி நின்று, தமது பிரசாரத்தைச் செய்துவந்தார்."
446,இடைக்கால அமைச்சர் அவை இல் தொழிற் கட்சியார் இங்கிலாந்தில் வெற்றி பெற்றனர்.
447,அப்பொழுது முதலமைச்சரான ஆட்லி விரைவில் இந்தியர்க்கு ஆட்சியுரிமை அளிப்பதாக வாக்களித்தார்.
448,உடனே தேர்தல்கள் நடைபெற்றன.
449,காங்கிரஸ்காரர்களே வெற்றி பெற்றனர்.
