Line Number,Sentence
291,"புலிபோலப் பாய்ந்தான் என்பதன்றிப் பிழையாமற் பாயும் என்பதேபற்றிப் பூசைபோலப் பாய்ந்தான் எனின், அதுவும் ஒப்பென்று கொள்ளாது உலகமென்றவாறு.",False
292,"ஈண்டு ஒத்தவென்பதனை, ஒத்த தறிவான் குறள்.",False
293,என்பதுபோலக் கொள்க. ஆய்வுரை இஃது உவமைக்குரியதோர் இயல்புணர்த்துகின்றது.,False
294,இள் உவமானமும் உவமேயமும் தம்மின் ஒத்துள்ளன என உலகத்தார் ஏற்கும் வண்ணம் உவமையமைதல் வேண்டும்.,False
295,இந்நுட்பத் தினைப் பேராசிரியர் காட்டிய உவமை விளக்கங்களால் நன் குணரலாம்.,False
296,பொருளே யுவமஞ் செய்தனர் மொழியினும் மருளறு சிறப்பின ஃ துவம மாகும்.,False
297,இளம்பூரணம் என்எனின்.,False
298,இதுவும் உவமைக்கண் வருவதோர் வேறுபாடு உணர்த்துதல் நுதலிற்று.,False
299,இவ்வாறு வருவன வெல்லாம் இச் சூத்திரத்தாற் கொள்க.,False
300,"பேராசிரியம் இது, மேற்கூறியவாறன்றி வருவதோர் உவமை விகற்பங் கூறுகின்றது இ.ள் உயர்ந்ததன் மேற்றே யுள்ளுங் காலைதொல்.",False
301,இவை உவமைத்தொகையாங்கால் முலைக்கோங்கம் முகத் தாமரை எனப்படும்.,False
302,இவற்றை வேறு உருவகமென்றும் பிறர் மயங்குப.,False
303,சிறப்பென்றதனான் ஒப்புமை மாத்திரையன்றித் தான் புனைந்துரைக்கக் கருதிய முலையினையும் முகத்தினையும் உயர்ந்த பொருளாகிய உவமத்தினும் உயர்ந்தவாகச் சிறப்பித்துரைத்தா னென்பது.,False
304,மருளறு சிறப்பின் என்றதனான் அங்ஙனஞ் சிறப்பிக் குங்கால் மயக்கந்தீரச் சிறப்பித்தல் வேண்டும்.,False
305,"அஃது உலகினுள் உயர்ந்ததென்று ஒப்ப முடித்த பொருளினையுஞ் சிறப்பித்தற்கு உவமஞ் செய்பவோ வெனிற், செய்யாரென்பது, என்னை?",False
306,"முகமொக்குந் தாமரை என்றால் முகத்திற்குந் தாமரைக்குஞ் சிறப்புடைமை மயங்கி வாராது, பின்னும் முகத்திற்கே சிறப்பா மென்பது கருத்து.",False
307,அஃதெனப்பட்டது பொருளாகலான் உயர்ந்ததன் மேற்று என்னும் விதி அப்பொருட்கு எய்துவிக்க.,False
308,ஆய்வுரை இஃது உவமைக்கண் வருவதோர் வேறுபாடுணர்த்துகின்றது.,False
309,பெருமையுஞ் சிறுமையுஞ் சிறப்பிற்றீராக் குறிப்பின் வருஉ நெறிப்பா டுடைய.,False
310,இளம்பூரணம் என்எனின்.,False
311,இதுவும் உவமைக் குரியதோர் மரபுணர்த்துதல் நுதலிற்று.,False
312,அவை சிறப்புப் பற்றி வந்தன.,False
313,"இனி, நெறிப்பாடின்றி வருவன இறப்ப உயர்தலும் இறப்ப இழிதலும் என இருவகைப்படும்.",False
314,இந்திரனே போலு மிளஞ்சாத்தன்.... யாப்.வி.ஒழி. இஃது இறப்பவுயர்ந்தது.,False
315,வழக்கிறந்துவருதலின் இவ்வாறு வரும் உவமை கூறப்படாது.,False
316,வள்ளெயிற்றுப் பேழ்வாய் ஞமலிக்கு மான்குழாம் எள்ளி யிரிவதுபோ லெங்கெங்கும்வள்ளற்கு மாலார் கடல்போல மண்பரந்த வாட்டானை மேலாரு மேலார் விரைந்து.,False
317,ஒழி. இஃது இறப்ப இழிதலின் இதுவு மாகாது.,False
318,"அஃதேல் நாயனையார் கேண்மை தழீஇக் கொளல் வேண்டும் நாலடி னருமால்னின்,துயின்கட்டந்ததார்ற்குணம்பற்றிருதலின்றப்பழிதல்காது. பேராசிரியர் இஃது, உவமத்திற்கு ஆவதோர் இலக்கணமுணர்த்துதல் துதலிற்று.",False
319,இ றப்பயர்வும் றப்பழிவும்வமிக்குங்கால்ன்னாவாகச்சய்யாதுறப்புடைமையில்ராவாகிக்கட்டார்னங்கொள்ளுமாற்றான்ருதலைழக்குலியாகவுடைய. அவாப்போ லகன்றத னல்குன்மேற் சான்றோர் உசாஅப்போ லுண்டே நுசுப்பு என்றவழி.,False
320,உலகத்தார் அவாப்போலப் பெரிதாகிய அல்குலெனக் கழிபெரும் பரப்பிற்றாகக் கூறினும் அது சிறப்பிற்றீராக் குறிப்பிற்றாதல் வழக்குண்டாகலின் உடம்படப்படும் என்றவாறு.,False
321,மாக்கட னடுவ ணெண்ணாட் பக்கத்துப் பசுவெண் டிங்க டோன்றி யாங்குக் கதுப்பயல் விளங்குஞ் சிறுநுதல் குறுந்.,False
322,"என்றவழிக், கடல்போன்றது கூந்தலெனவுங், கடனடு எழுந்த எண்ணாட் பக்கத்து மதிபோன்றது நுதலெனவுங் கூறினான்.",False
323,சுரும்பு மூசாச் சுடர்ப்பூங் காந்தள் திருமுரு.,False
324,என்பதும் அது.,False
325,யானை யானையவர் நட்பொரீஇ நாயனையார் கேண்மை கெழீஇக் கொளல்வேண்டும் நாலடி.,False
326,என்பதும் அது.,False
327,இவை பெருமையுஞ் சிறுமையுஞ் சிறப்பிற் றீராக் குறிப்பின் வந்த வழக்காதல் அமைந்தன வென்பது.,False
328,சோறுவாக்கிய கொழுங்கஞ்சி யாறுபோலப் பரந்தொழுகி பத்துப்.,False
329,என்பதோ வெனின்.,False
330,"யாறென்ற துணையானே பேர்யாறெனக் கொண்டு உலகிறந்தனவாகாமைக்கன்றே, ஏறபொரச் சேறாகித் தேரோடத் துகள்கெழுமி பத்துப்.",False
331,பட்டினப். என்பதாயிற் றென்பது.,False
332,ஆய்வுரை இஃது உவமைக்குரியதோர் மரபுணர்த்துகின்றது.,False
333,இளம்பூரணம் என்எனின்.,False
334,இஃது உவமையுணர்த்துஞ் சொற்களை வரை யறுத்து உணர்த்துதல் நுதலிற்று.,False
335,புலிபோன்ற சாத்தன் புலிபோலுஞ் சாத்தன் என்பன பெயரெச்சம்.,False
336,புலிபோன்று வந்தான் புலிபோலப் பாய்ந்தான் என்பன வினையெச்சம்.,False
337,புலிபோலும் புலிபோன்றனன் என்பன முற்று.,False
338,"அன்ன, இன்ன இடைச்சொல்.",False
339,ஈண்டு எடுத்தோதப்பட்ட முப்பத்தாறினும் ஒன்ற.,False
340,ஏனைய ஈண்டுக் காட்டுதும்.,False
341,இறந்தாரை யெண்ணிக்கொண் டற்று குறள்.,False
342,மருப்பிற் றிரிந்து மறிந்துவீழ் தாடி கலித்.,False
343,துணைமல ரெழினீலத் தேந்தெழின் மலருண்கண் கலித்.,False
344,முத்தேர் முறுவலாய் கலித்.,False
345,எச்சிற் கிமையாது பார்த்திருக்கு மச்சீர் நாலடி.,False
346,யாழ்கெழு மணிமிடற் றந்தணன் அகம்.,False
347,கடவுள் வாழ்த்து கிளைசெத்து மொய்த்த தம்பி நற்.,False
348,என வரும்.,False
349,பிறவு மன்ன.,False
350,"பேராசிரியம் இஃது, உவமத்தினையும் பொருளினையும் ஒப்பிக்குங்கால் இடைவருஞ் சொல் இனைத்தென்கின்றது. அவைதா மென்பது.",False
351,வினை பயன் மெய் யுரு வென்னு நான்குவமையு மென்றவாறு.,False
352,ஆண்டு எடுத்தோதாதன ஆறெனப்படும்.,False
353,"அவை, ஒன்ற என்ற மாற்ற பொற்ப நாட நடுங்க என்பன.",False
354,அஃதேல் ஆண்டு வரையறை கூறப்பட்டன எண்ணான்கு முப்பத்திரண்டாயின வாறென்னை?,False
355,மழையொன்று வண்டடக்கை வள்ளியோற் பாடி என்பது பயனுவமம்.,False
356,வேயொன்று தோளொருபால் வெற்பொன்று தோளொருபால் என்பது மெய்யுவமம்.,False
357,குன்றியுங் கோபமு மொன்றிய வுடுக்கை என்பது உருவுவமம்.,False
358,ஒழிந்தனவும் இவ்வாறே நான்கு பகுதியும்பற்றி வருமாறு கண்டுகொள்க.,False
359,வாயென்ற பவளம் என்றது பண்புவமைபற்றி வந்தது.,False
360,இது வாயாகிய பவளம் என்று ஆக்கச் சொல்லானும் வரும்.,False
361,மணிநிற மாற்றிய மாமேனி என்பது உருவுவமம்.,False
362,மதியம் பொற்ப மலர்ந்த வாண்முகம் என்பது மெய்யுவமம்.,False
363,வேயொடு நாடிய தோள் என்பது நாடவென்பது வந்த மெய்யுவமம்.,False
364,"படங்கெழு நாக நடுங்கு மல்குல் என்புழி, நடுங்கவென்பது மெய்யுவமம்பற்றி வந்தவாறு.",False
365,"இவ்வோதிய வாய்பாட்டோடு பொருந்த வருஞ் சொல்லெல்லாம் பல்குறிப்பின வென்பனாதற் கொள்ளப்படும், இப்பகுதி யெல்லாம் புறனடையாற் கொள்வனவற்றிற்கும் ஒக்கும்.",False
366,"என்பதனுள், துணைப்பவென்பதூஉம் அற்றென்பதூஉம் வந்தன.",False
367,குன்றி னனையாருங் குன்றுவர் குன்றுவ குன்றி யனைய செயின் குறள்.,False
368,என்று அனையவென்பது வந்தது.,False
369,பிறவுமன்ன கயமூழ்கு மகளிர் கண்ணின் மானும் குறுந்.,False
370,"என, இன் வேற்றுமையும் உவமவுருபோடு வந்தது.",False
371,"என்பது எனவெனெச்சத்தால் உவமம் வந்தது, பிறவுமன்ன.",False
372,இவை எல்லாம் வரைவின்றி நான்குவமமும்பற்றி வருமாறு கண்டுகொள்க.,False
373,"ஐந்தாம் வேற்றுமைப் பொருள் வந்த உவமங்களும் பிறவும் உவமத்தொகை யெனப்படா, தொகைப் படாமையி னென்பது.",False
374,அன்ன வாங்கு மான இறப்ப என்ன உறழத் தகைய நோக்கொடு கண்ணிய எட்டும் வினைப்பா லுவமம்.,False
375,இளம்பூரணம் என்எனின்.,False
376,மேற்சொல்லப்பட்டவற்றுள் சிறப்பு விதியுடையன உணர்த்துவான் எடுத்துக்கொண்டார்.,False
377,அவற்றுள் வினையுவமத்திற் குரிய சொல் வரையறை யுணர்த்தல் நுதலிற்று.,False
378,இள். அன்னமுதலாகச் சொல்லப்பட்ட எட்டும் வினை யுவமத் திற்குரிய சொல்லாம் என்றவாறு. கொன்றன்ன வின்னா செயினும் குறள்.,False
379,பலர்புகழ் ஞாயிறு கடற்கண் டாங்கு திருமுருகாற்.,False
380,புலவுநுனைப் பகழியுஞ் சிலையு மானச் செவ்வரிக் கயலொடு பச்சிறாப் பிறமும் பெரும்பாணாற்.,False
381,புலியிறப்ப வொலிதோற்றலின் புலியென்னக் கலிசிறந் துராஅய் செறுநர்த் தேய்த்த செல்லுறழ் தடககை திருமுருகாற்.,False
382,"இ ள். இவ்வெட்டும் வினையுவமம், எறு.",False
383,எரியகைந் தன்ன தாமரைப் பழனத்து அகம்.,False
384,கயநா டியானையின் முகனமர்ந் தாங்கு அகம்.,False
385,கயமூழ்கு மகளிர் கண்ணின் மானும் குறுந்.,False
386,"இனிக், கார்மழை முழக்கிசை கடுக்கும் அகம்.",False
387,யாழ்கெழு மணிமிடற் றந்தணன் அகம்.,False
388,கடவுள் வாழ்த்து ஒளித்தியாங்கு மரபின் வயப்புலி போல அகம்.,False
389,ஒழுகை நோன்பக டொப்பக் குழீஇ அகம்.,False
390,குறுந்தொடி யேய்க்கு மெலிந்துவீங்கு திவவின் பத்துப்.,False
391,"எனப் பிறவாய்பாட்டாற் சிறுபான்மை வரும் வினையுவமம் பொது விதியாற் கொள்ளப்படும், பிறவுமன்ன.",False
392,"ஆய்வுரை இது, மேற்கூறிய உவமவுருபுகளுள் வினையுவமத்திற்குரிய உருபுகள் இவையென்கின்றது.",False
393,"இள் அன்ன, ஆங்க, மான, விறப்ப, என்ன, உறழ, தகைய, நோக்க எனக் கருதத்தகும் எட்டும் வினையுவமத்திற்குரிய உருபுகளாம்.",False
394,எறு இவையெட்டுருபுகளும் தொழில்நிலை சுட்டும் குறிப் புடைமையின் வினையுவமத்திற்குரிய உருபுகளாயின.,False
395,அன்னஎன் கிளவி பிறவொடுஞ் சிவணும்.,False
396,இளம்பூரணம் என்எனின்.,False
397,எய்தாதது எய்துவித்தல் நுதலிற்று.,False
398,இள். மேற்சொல்லப்பட்டவற்றுள் அன்னஎன்னுஞ் சொல் ஒழிந்தபொருளொடுஞ் செல்லும் என்றவாறு. மாரி யன்ன வண்கை புறம்.,False
399,இது பயன்.,False
400,பரியரைக் கழுகின் பாளையம் பசுங்காய் கருவிருந் தன்ன கண்கூடு சிறுதுளைபெரும்பாணாற்.எறு இது மெய்.,False
401,செவ்வா னன்ன மேனி அகம்.,False
402,கடவுள் வாழ்த்து பாலன்ன மென்மொழி இவை உரு.,False
403,"போராசியம் இஃது, எய்தியது இகந்துபடாமற்காத்தது.",False
404,"கடவுள் வாழ்த்து எனவுஞ், செவ்வா னன்ன மேனி அகம்.",False
405,கடவுள் வாழ்த்து எனவும் ஒழிந்த மூன்றற்கும் பெருவரவினான்?,False
406,வந்தவாறு வழக்கு நோக்கி உணர்க.,False
407,ஆய்வுரை இது முற்குறித்த வினையுவமவுருபுகளுள் ஒன்றன்பொது வியல்பினைப் புலப்படுத்துகின்றது.,False
408,"இள் மேற்குறித்த வினையுவ மவுருபுகள் எட்டனுள் அன்ன என்பது, பயன், மெய், உரு என்னும் பிறஉவமைகட்கும் உரியதாய்ப் பொருந்திவரும்.",False
409,எள்ள விழையப் புல்லப் பொருவக் கள்ள மதிப்ப வெல்ல விழ என்றாங் கெட்டே பயனிலை யுவமம். இளம்பூரணம் என்எனின்.,False
410,பயனிலை யுவமைக்குரிய சொல் வரையறுத் துணர்த்துதல் நுதலிற்று.,False
411,இள் இவை எட்டும் பயனிலையுவமம் .,False
412,இவை எட்டும் பெருவரவின வெனவே சிறுவரவினான்.,False
413,அழல்போல் வெங்கதிர் பைதறத் தெறுதலின் அகம்.,False
414,மகன்றா யாதல் புரைவதா லெனவே அகம்.,False
415,ஊறுநீ ரமிழ்தேய்க்கு மெயிற்றாய் கலி.,False
416,பல்லேர் நிகர்ப்ப வந்த வுவகை யெல்லா மென்னுட் பெய்தற் தற்றே யாழ்கொண்ட விமிழிசை யியன்மாலை யலைத்தரூஉம் கலி.,False
417,உருமெனச் சிலைக்கு மூக்கமொடு அகம்.,False
418,"யாழ்செத், திருங்கல் விடரளை யசுண மோர்க்கும் அகம்.",False
419,செறுநர்த்தேய்த்த செல்லுறழ் தடக்க திரு முரு.,False
420,விண்ணதி ரிமிழிசை கடுப்பப் பண்ணமைத்து மலைபடு.,False
421,எனவரு பிறவுமன்ன.,False
422,மேலைச்சூத்திரதிற் சொல்லியவாறே இதற்கும் வேண்டுவன உரைத்துக்கொள்க.,False
423,"ஆய்வுரை இது, பயனிலையுவமத்திற்குரிய உருபுகள் இவையென் கின்றது.",False
424,"இள் எள்ள, விழைய, புல்ல, பொருவ.",False
425,"கள்ள, மதிப்ப, வெல்ல, வீழ எனச் சொல்லப்பட்ட எட்டும் பயனிலையுவமத்திற் குரிய உருபுகளாம்.",False
426,"எறு எள்ளுதல், விழைதல், முதலியன ஒன்றின் பயனுடைமை பற்றியவாதலின் இவை பயனிலையுவமவுருபுகளாயின.",False
427,கடுப்ப ஏய்ப்ப மருளப் புரைய ஒட்ட ஒடுங்க ஒட்ட நிகர்ப்பவென் றப்பா லெட்டே மெய்பா லுவமம்.,False
428,இளம்பூரணம் என்எனின்.,False
429,மெய்யுவமத்திற் குரிய சொல் உணர்த்துதல் நுதலிற்று.,False
430,இள் கடுப்ப என்பது முதலாகச் சொல்லப்பட்ட எட்டும் மெய்யுவமத்திற்குரிய சொல்லாம் என்றவாறு. விண்ணதிர் இழிழிசை கடுப்ப மலைமடு.,False
431,அகலிரு விசும்பிற் குறைவில் ஏய்ப்ப வேய்மருள் பணைத்தோள் நெகிழ அகம்.,False
432,வேய்புரை மென்றோள் கலித்.,False
433,"பேராசிரியம் இது, முறைனே மெய்யுவமத்திற்குரிய வாய்பாடு கூறு கின்றது.",False
434,இ ள் இவ்வெட்டும் மெய்யுவமம் எ .,False
435,"இவற்றை உரிமைகூறிப் பெருவரவினவெனவே, ஒழிந்தன வுஞ் சிறுபான்மை வருமென்பதூஉம் அவை பொதுச் சூத்திரத்தான் அடங்குமென்பதூஉங் கொள்க.",False
436,அவை கடல்போ றோன்றல காடிறந் தோரே அகம்.,False
