Line Number,Sentence
675,எவ்வகை உயிர்களும் இன்புற ஆங்கே அவ்வகை தெருட்டும் அருட்பெருஞ்சோதி .,False
676,களங்கம் நீத்துஉலகங் களிப்புற மெய்ந்நெறி விளங்க என்னுள்ளே விளங்கும் மெய்ப்பொருளே .,False
677,உயிரெலாம் பொதுவின் உளம்பட நோக்குக செயிர்எலாம் விடுகஎனச் செப்பிய சிவமே .,False
678,அருளே நம்மியல் அருளே நம்உரு அருளே நம்வடிவு ஆம்என்ற சிவமே .,False
679,அருளே நம்அடி அருளே நம்முடி அருளே நம்நடுவாம் என்ற சிவமே .,False
680,அருளே நம்அறிவு அருளே நம்மனம் அருளே நம்குணம் ஆம்என்ற சிவமே .,False
681,அருளே நம்துணை அருளே நம்தொழில் அருளே நம்விருப்பு ஆம்என்ற சிவமே .,False
682,அருளே நம்பொருள் அருளே நம்ஒளி அருளே நாம்அறி வாய்என்ற சிவமே .,False
683,அருளே நம்குலம் அருளே நம்இனம் அருளே நாம்அறி வாய்என்ற சிவமே .,False
684,அருளே நம்சுகம் அருளே நம்பெயர் அருளே நாம்அறி வாய்என்ற சிவமே .,False
685,தூக்கமும் சோம்பும்என் துன்பமும் அச்சமும் ஏக்கமும் நீக்கிய என்தனித் தாயே .,False
686,ஏதிலர்சார் உலகினிடை எங்ஙனம்நான் புகுவேன் யார்க்குரைப்பேன் என்னசெய்வேன் ஏதும் அறிந்திலேனே .,False
687,சாதிமதம் சமய முதல் சங்கற்ப விகற்பம் எல்லாம் தவிர்ந்து போக ஆதிநடம் புரிகின்றான் அருட்சோதி எனக்களித்தான் அந்தோ!,False
688,உமர்கய்யாம் கவலையற்று வாழ் முன்னுரை இன்பம்!,False
689,இதுவே மக்கள் விரும்புவது.,False
690,இதை விரும்பியே உலக மக்கள் உழைக்கின்றனர் வாழ்கின்றனர்.,False
691,இன்பத்தில் அன்பற்ற எரும் இவ்வுலகில் வாழ விரும்பார்.,False
692,மனித வாழ்வில் இன்பம் உண்டு.,False
693,இன்பத்தைத் தேடிக் கொள்ளக்கூடிய சக்தி மக்களுக்கு உண்டு.,False
694,இயற்கையை மாற்றி அமைத்துக்கொள்ளும் வலிமை மனிதனுக்கே சொந்தம்.,False
695,வேறு எவ்வுயிர்க்கும் இவ்வாற்றல் இல்லை.,False
696,மற்ற உயிர்களைக் காட்டிலும் சிறப்பறிவு படைத்தவன் மனிதன் அன்றோ?,False
697,எல்லா ஊர்களும் நம்முடைய ஊர்கள் உலக மக்கள் எல்லோரும் நம்முடைய உறவினர்.,False
698,நமக்குத் தீமை வருவதும் பிறரால் அன்று நன்மையுண்டாவதுஅம் பிறரால் அன்று நாமே தீமைக்கும் நன்மைக்கும் காரணம்.,False
699,நாம் துன்ப மடைவதும் இன்பமடைவதும் அதைப்போல் தான் இது ஒரு பழந் தமிழ்ப் புலவர் கருத்து.,False
700,இக்கருத்துடைய பாட்டு யாதும் ஊரே யாவரும் கேளிர் தீதும் நன்றும் பிறர்தர வாரா நோதலும் தணிதலும் அவற்றோர் அன்ன.,False
701,புறநானூறு இப்பாடல் மனித சக்தியைக் கண்ணாடிபோல் காட்டுகின்ற தன்றோ.,False
702,இத்தகைய ஆற்றல் படைத்த மக்கள் ஏன் தங்கள் வாழ்க்கையைப் பாழாக்கிக் கொள்ளவேண்டும்?,False
703,இன்புற்று வாழ்வதற்கு வழிதேட வேண்டாமா?,False
704,மனித வாழ்க்கையே துன்பமுடையது பிறப்பின்றி இருத்தலே இன்பமுடையது என்பர் சிலர்.,False
705,பிறந்தோர் உறுவது பெருகிய துன்பம் பிறவார் உறுவது பெரும்பேர் இன்பம் என்பது போன்றவைகள் அத்தகையோர் கூற்றைக் காட்டுவன.,False
706,இதை நாம் ஒப்புக் கொள்வதற்கில்லை.,False
707,துன்பம் இன்றேல் இன்பம் ஏது?,False
708,கசப்பின் சுவைதெரிந்தால் அன்றோ இனிப்பின் இயல்பு தெரியும்.,False
709,தன்னம்பிக்கை யற்றவர்கள் தான் வாழ்க்கையைத் துன்பம் என்பர்.,False
710,உழைப்பில் முயற்சியில் நம்பிக்கை யற்றவர்களே வாழ்க்கையை வெறுப்பர்.,False
711,எல்லாம் வல்ல தன்மை மனிதனிடம் உண்டு என்பதை உணர்ந்தோர் வாழ்க்கையை வெறுக்க மாட்டார்.,False
712,பல மக்கள் எல்லா இன்பங்களும் பெற்று உயர்ந்த வாழ்க்கை வாழ்வதைப் பார்க்கின்றோம்.,False
713,கோடிக் கணக்கான மக்கள் பட்டினி கிடந்து சாவதையும் பார்க்கின்றோம்.,False
714,இந்த நிலை மாற வேண்டும்.,False
715,உலகில் பிறந்த எல்லா மக்களும் துன்பம் இன்றி வாழவேண்டும்.,False
716,இதில் கருத்து வேற்றுமை யே இல்லை.,False
717,பண்டும் இல்லை இன்றும் இல்லை.,False
718,"ஒருவன் துன்புறுவதும், பட்டினி கிடந்து மடிவதும் தலை விதி முன் பிறப்பில் செய்த தீவினை.",False
719,ஒருவன் அளவுக்குமேல் போக போக்கியங்கள் அநுபவிப்பதும் தலைவிதி முன்செய்த நல்வினை.,False
720,என்று தன்னம்பிக்கையற்ற மக்கள் கூறி விடுகின்றனர்.,False
721,இக்கூற்று பொருந்துமா?,False
722,திருவள்ளுவரைப் பற்றி உங்களுக்குத் தெரியும்.,False
723,"கடவுள், மறுபிறப்பு, கர்மம், சுவர்க்கம், நரகம் எல்லாவற்றிலும் நம்பிக்கையுடையவர்.",False
724,அவர் கூறுகிறார்.,False
725,பிச்சை எடுத்து உயிர்வாழும்படி உலகில் எந்த மனிதனும் படைக்கப்பட வில்லை.,False
726,இரந்தும் உயிர்வாழ்தல் வேண்டின் பரந்து கெடுக உலகியற்றி யான் இதுவே மேற்கூறிய கருத்தை விளக்கும் குறள்.,False
727,இன்னாமை வேண்டின் இரவு எழுக துன்பம் வேண்டுமானால் பிச்சையெடுக்கத் தொடங்குக என்றார் ஒருவர்.,False
728,பிச்சை யெடுப்பதைக் காட்டிலும் துன்ப வாழ்வு வேறில்லை என்பதே இவர் கருத்து.,False
729,இதுதான் திருவள்ளுவர் கருத்தும்.,False
730,"இதே கருத்தை பாரதியார், வேறு மொழியில் ஆவேசத்துடன் கூறி விட்டார்.",False
731,தனியொருவனுக்கு உணவில்லை யெனில் ஜகத்தினை அழித்திடுவோம் என்றார்.,False
732,இதுவன்றோ மனித சக்தி.,False
733,எ ல்லா மக்களையும் வாழ்க்கையில் இன்பம் நுகரும்படி செய்யும் சக்தி மனிதனுக்கு உண்டு.,False
734,உலகத்தை அழிக்கும் சக்தியும் மனிதனுக்கு உண்டு என்று அன்று நம்பினார் பாரதியார்.,False
735,"இன்று, அணுக்குண்டு இதை மெய்ப்பித்து விட்டது.",False
736,யான் பெற்ற இன்பம் பெறுக இவ்வையகம் என்றார்.,False
737,"ஒருவர் எல்லோரும் இன்புற்றிருக்க நினைப்பதுவே, அல்லாமல் வேறொன்று அறியேன் என்றார் மற்றொருவர்.",False
738,இக்கருத்து இன்று நேற்று எழுந்தது அன்று.,False
739,"மனித சமூகம் அறிவு பெற்ற நாள் முதல், எந்நாட்டிலும், எச்சமயத்தாரும், இக் கருத்தை வெளியிட்டு வந்திருக்கின்றனர்.",False
740,"முன்னோர், மக்கள் மகிழ்ச்சியுடன் வாழ்வதற்கு அவ்வப்போது காட்டிய வழிகள் வெவ்வேறானவை.",False
741,அவைகள் நிலையாக மனித சமூகத்தில் மகிழ்ச்சியை வளர்த்து விடவில்லை.,False
742,மனிதவாழ்ககையை என்றும் இன்பமுடைய தாக்க இக்காலத்தினர் கண்ட முடிவு வேறு.,False
743,"முன்னோர், தருமம், பக்தி, கடவுள், நம்பிக்கை.",False
744,"இக்காலத்தினர் அரசியல், பொருளாதாரம், ஆகியவைகளின் மூலமே மனித சமூகத்தை இன்புறச் செய்யலாம் எனக் கூறுகின்றனர்.",False
745,முன்னோர் கூற்று அனுபவத்தில் பயன் அளிக்கவில்லை பின்னோர் கூற்று கண்கண்ட உண்மை.,False
746,இதற்கே இன்று உலகம் உழைக்கின்றது.,False
747,"ஆதலின் அறிவுடையோர், ஆற்றலுடையோர், சமரச மனப்பான்மையுடையோர், முயன்றால் உலகத்தையே இன்ப மயமாக்கிவிட முடியும்.",False
748,துன்பத்தை மறக்க இன்பம் வேண்டும்.,False
749,"இன்பத்தை ஆக்குவது மகிழ்ச்சி, உள்ளத்தில் தோன்றும் கவலையை மறந்தால் மகிழ்ச்சி தோன்றும்.",False
750,"மகிழ்ச்சியின்முன், அதாவது சிரிப்பின் முன் எத்தகைய துன்பமும் தலை காட்டாது.",False
751,துன்பத்திற்கு மருந்து மகிழ்ச்சியைத் தவிர வேறில்லை.,False
752,"இடுக்கண் வருங்கால் நகுக, அதனை அடுத்து ஊர்வது அஃது ஒப்பது இல் என்றார் வள்ளுவர்.",False
753,துன்பம் வந்தால் அதனைப் பொருட்படுத்தாதே.,False
754,இந்த இழவுக்கு என்ன செய்வோம் என்று தலையில் கையை வைத்துக் கொண்டு கவலைப்படாதே.,False
755,ஏ துன்பமே!,False
756,என்னிடமா வந்தாய் பார் உன்னை மாண்டு மடியச் செய்கிறேன்!,False
757,என்று கடகடவென்று சிரித்து விடு.,False
758,அதன் பின் வருவது இன்பம்.,False
759,அந்த இன்பத்திற்கு நிகர் எதையும் கூற முடியாது.,False
760,இது மேலே காட்டிய வள்ளுவர் வாய்மொழியின் கருத்து.,False
761,"ஆகவே கவலையை மறப்பதற்கு முதல் வழிமகிழ்ச்சி, நகைப்பு, சிரிப்பு என்பது எவரும் மறுக்க முடியாத உண்மை.",False
762,"மகிழ்ச்சி, பெறவழி யென்ன?",False
763,கேள்வி எளிது எல்லோரும் கேட்கக் கூடியது ஆனால் பதில் கூறுவதுதான் அரிது.,False
764,வெவ்வேறு போக்கில் உள்ளவர்கள் மகிழ்ச்சிக்கு வெவ்வேறு வழிகளைக் கூறுவர்.,False
765,ஆண்டவனைத் துதிப்பதே ஆராத இன்பம் என்பர் கடவுள் பக்தர்.,False
766,"நாடகம், சினிமா, சங்கீதம் மகிழ்ச்சியுடன் பொழுது போக்க ஏற்றவை என்பர் கலாரசிகர்.",False
767,காவியம் கற்போம் ஓவியம் பார்ப்போம் விளையாடுவோம் நண்பர்களுடன் கூடி நகைச்சுவையுடன் பேசி மகிழ்வோம் காதல் செய்வோம் என்பர் பலர்.,False
768,"உண்டு, களித்து, உறங்குவதே சுகமென்பர் சோம்பேறிகள்.",False
769,குடித்து வெறிப்பதே சுகமென்பர் குடியர்.,False
770,"ஆம், குடியில் மகிழ்ச்சியில்லை யென்று எவரும் கூற முடியாது.",False
771,"மதுவானது வயிற்றில் பாய்ந்தவுடன், மனக்கவலையை மாற்றுகிறது.",False
772,உணர்ச்சியை ஊட்டுகின்றது.,False
773,"தன்னை மீறிய மகிழ்ச்சி, களிப்பு தலைதூக்கி ஆடுகின்றது.",False
774,களிப்பு என்னும் சொல்லே கள்ளிலிருந்து பிறந்தது.,False
775,கள் என்னும் பகுதியே களிப்பு என்னும் சொல்லுக்குப் பிறப்பிடம்.,False
776,கள்ளுண்டு மகிழும் நிலைக்கே களிப்பென்னும் பெயர் சூட்டினர் முன்னோர்கள்.,False
777,கள் இன்றேல் பண்டைக்களிப் பென்னும் சொல் இல்லை.,False
778,பண்டை நாளில் மக்கள் வாழ்க்கையைக் களிப்புறச் செய்வதற்குக் கள் அவசியமாக இருந்தது.,False
779,இக்காலத்தில் அது தேவையில்லை.,False
780,"கள்ளைக் காட்டிலும் களிப்புறச் செய்யும் பொருள்கள், நிகழ்ச்சிகள் செயல்கள் மலிந்து விட்டன.",False
781,இவற்றை இப்போது எல்லோரும் எளிதில் காணலாம் நடத்தலாம் அனுபவிக்கலாம்.,False
782,இவைகள் பண்டைக்காலத்தில் எல்லோர்க்கும் கிட்டாதவை.,False
783,ஒரு சிலர்க்கே கிடைத்தன.,False
784,ஆதலின் எளிதில்கிடைக்கும் கள்ளைக் கொண்டு களிப்புறலாம் என்று நம்பினர் நடந்தனர்.,False
785,"பண்டைக்காலத்தில் தோன்றிய கவிதைகள் காவியங்கள், ஓவியங்கள், வீரத்தன்மை, வள்ளல் தன்மை எல்லாம் கள்ளின் மயக்கத்தால் பொங்கி வழிந்தவைகளே.",False
786,"நமது தமிழ் நாட்டுப் பெருநாவலர்களான, கபிலர், அவ்வையார் முதலியவர்கள் இந்தச் சுவையில் ஊறினவர்கள் தான்.",False
787,வள்ளல்களும் களிமயக்குடன் பொருளை வாரி வாரி இறைத்தவர்களே.,False
788,அக்காலத்தில் உலக முழுதும் இந்த நிலையில் தான் இருந்திருக்க வேண்டும்.,False
789,இதில் ஐயமில்லை.,False
790,காலப் பறவை தங்காது சிறகை விரித்துக் கொண்டு பறந்துபோய்விடும்.,False
791,பறக்கும் சமயம் நெருங்கிவிட்டது.,False
792,விரைவில் மதுவுண்டு மகிழ்ச்சிகொள்.,False
793,மதுவருந்துதல் பாவம் அல்ல.,False
794,அதுவும் ஆண்டவன் படைத்த பொருள்களில் ஒன்று.,False
795,தீமையானவற்றை ஆண்டவன் படைக்க மாட்டான்.,False
796,"கொடி நிழல், ரொட்டித்துண்டு, சுவையுள்ள திராட்சை ரசம், இனிய பாடல், பெண்ணின் சங்கீதம் இவையே எனக்கு இன்பம்.",False
797,என்பனபோன்ற கருத்துக்களை உள்ளத்திலிருந்து உதிர்த்திருக்கிறார் உமர் கய்யாம்.,False
798,ஏன் இந்தக் கருத்துக்கள் அவர் மனத்தில் தோன்றின?,False
799,உலகம் நிலையற்றது.,False
800,இவ்வெண்ணம் உமர் கய்யாம் மனத்தில் ஊன்றி நின்றது.,False
801,ஆதலால் வாழ்நாளை வீண்நாளாகக்காதே!,False
802,இருக்கும் வரையிலும் மகிழ்ந்திரு.,False
803,"களித்திரு, கவலையற்றிரு, இறப்பது ஒன்றே உண்மை!",False
804,மற்றவைகள் மாயம்.,False
805,இறந்தபின் என்ன ஆவோம் என்பதும் தெரியாது!,False
806,என்றெல்லாம் மனித சமூகத்திற்குக் கூறினார்.,False
807,உமர் கய்யாம் ஒரு பாரசீகக் கவி.,False
808,"கவிமட்டிலும் அல்ல, சிறந்த வான சாதிரி.",False
809,வான சாதிரக் கணக்குகளை முடிவு கட்டுதற்கான சிறந்த நூல் ஒன்றை இவர் இயற்றியுள்ளார்.,False
810,பாரசீக மொழியில் கணிக்கப்பட்டுள்ள பஞ்சாங்கத்தில் பெரும் பங்கு இவருடையது.,False
811,"மதுவைப் பற்றியே புகழ்கிறாரே நாக்கில் தண்ணீர் சொட்டும்படி எழுதியிருக்கிறாரோ இவர் ஒரு நாதிகரோ, என்று எண்ணிவிடவேண்டாம்.",False
812,கடவுள் நம்பிக்கை யுடையவர் முலிம் குரான் பயின்றவர் மதநூல்களில் தேர்ச்சியுடையவர்.,False
813,இவர் உண்மையாகவே மதுதேவதைக்கு அடிமையாகி யிருப்பாரா?,False
814,அதைப் பணிந்து இன்புறும்படி உலகிற்குக் கூறி இருப்பாரா?,False
815,என்று சந்தேகப்படுவோர் பலர்.,False
816,நாமும் இச் சந்தேகத்தை ஆதரிக்கிறோம்.,False
817,இதுவே உண்மையென நாமும் கொள்வோம்.,False
818,இவர் கி.பி.,False
819,ம் நூற்றாண்டில் பாரசீகத்தில் வாழ்ந்தவர்.,False
820,இவர் பிறப்பிடம் நைசாப்பூர் என்பது.,False
821,இவருடன் கல்வி பயின்ற தோழரே அக்காலத்தில் பாரசீக நாட்டு மந்திரியாயிருந்தார்.,False
822,அவர் தயவில் இவர் பெற்றது ஒரு சிறிய திராட்சைத் தோட்டம்.,False
823,அதிலேயே வாழ்ந்து வந்தார்.,False
824,"ஆடம்பரமற்ற வாழ்க்கை தத்துவநூல், வானநூல் ஆராய்ச்சி, இவைகளே அவருடைய பொழுது போக்கு.",False
825,இவர் மறைந்த காலம் என்பர்.,False
826,அவர் பாடிய பாடல்களுக்கு ரூபயாத் என்று பெயர்.,False
