Line Number,Sentence
1021,நெருங்கிய உறவினர் பலர் திருமணத்தின் பொருட்டு இன்றே வந்திருந்தனர்.
1022,இரவில் கூட்டமாக இருந்தது.
1023,பார்ப்பனச் சமையற்காரர்கள் இன்று மாலைவந்து சேர்ந்து இரவு சமைத்தனர்.
1024,"சிவப்பிரகாசமும், உலகநாயகியும் செங்கிபட்டி சென்று காரில் பெண்ணை அழைத்துக் கொண்டு இரவு மணியளவுக்கு வந்து சேர்ந்தனர்."
1025,காலை மணிஅளவில் முகூர்த்தக்கால் நடப்பெற்றது.
1026,அடுத்து அரசாணி எடுத்து வரப்பெற்றது.
1027,காலை மணிக்குத் தம்பி புதல்வன் திருஞானசம்பந்தனுக்குக் காதணி மங்கலம் நிகழ்ந்தது.
1028,"வந்திருந்தோர் அனைவர்க்கும் இட்டலி, காபி காலையுணவு அளிக்கப்பெற்றது."
1029,காலை மணிக்குத் திருமண வினை தொடங்கப் பெற்றது.
1030,நள்ளிரவில் பூதலூர் ஸ்டேஷன் வந்திருந்த அ.
1031,அவர்கட்குக் கார் அனுப்பி இரவே வந்து சேரும்படியும் செய்திருந்தது.
1032,அவற்றை ஒவ்வொன்றுக்கும் அடுத்தடுத்துச் சொல்கின்றனர்.
1033,"நான், அவ்வாறு சொல்லிக் காலத்தைப் போக்காதபடி வற்புறுத்திக் குறித்திருந்த சிங்க இலக்கினத்தில் மங்கல நாண் பூட்டுமாறு செய்வித்தேன்."
1034,திருவளர் செல்வன் நடராஜன் திருவளர் செல்வி இராசம்மையை முற்பகல் மணியளவில் திருமங்கல நாண் பூட்டி மகிழ்ந்தனன்.
1035,எரிவலம் வருதல் முதலியன நிகழ்ந்தன.
1036,அன்பர்கள் பலர் வெள்ளிப் பாத்திரங்கள் பரிசிலாக வழங்கினர்.
1037,"அளவற்ற வாழ்த்துக் கடிதங்களும், தந்திகளும் வந்திருந்தன."
1038,பலர் வாழ்த்துப்பாடல்கள் பாடி அனுப்பியிருந்தனர்.
1039,வாலாஜாபாத் இந்துமத பாடசாலையார் கனிந்த அன்புடன் வாழ்த்துப் பத்திரம் எழுதி அச்சிட்டு அநுப்பி யிருந்தனர்.
1040,திருப்பாதிரிப்புலியூர் உயர் திரு.
1041,ஞானியார் சுவாமிகள் மணமக்கள் நல்வாழ்வு கருதி வள்ளிமணாளனை அருச்சித்துத் திருநீறு குங்குமம் அநுப்பினமை யோடு மணமகனுக்கு ரூ. வாழ்த்தியநுப்பியிருந்தார்கள்.
1042,திருப்பனந்தாள் மடாதிபதி உயர் திரு.
1043,சுவாமிநாதத்தம்பிரான் சுவாமிகளும் பிரசாதம் அநுப்பி யிருந்தனர்.
1044,"யான், சபையிலே, பரிசில் முதலியன அநுப்பியவர்களைத் தெரிவித்துவிட்டு, அனைவர்க்கும் நன்றி கூறுமுகத்தால் நிமிடத் திற்கு மேல் பேசினேன்."
1045,"திருமணம் நிகழ்த்து முறைமை குறித்து நான் எண்ணியிருந்ததையும், பின் வேறு விதமாக நிகழ்ந்ததையும், அதற்குரிய காரணத்தையும் விளக்கினேன்."
1046,கூட்டத்தில் இருந்த பெண்ணின் மாமனாகிய திரு.
1047,வல்லத்தரசினைப் பேசும் படி கேட்டுக் கொண்டேன்.
1048,அவரும் மணி நேரத்திற்கு மேல் பார்ப்பனப் புரோகிதத்தைக் கண்டித்துப் பேசினர்.
1049,பாமர மக்களுக்கு அவரது பேச்சு எழுச்சியை உண்டாக்கக் கூடியதே.
1050,"நான் அவருக்கு நன்றி கூறுமுகத்தால் அவர் பேசியவற்றில் உடன் பாடானவற்றைத் தெரிவித்துவிட்டு, சமய மாறுபாடான கொள்கைகளைக் கண்டித்துப் பேசினேன்."
1051,"இந்நிகழ்ச்சிகள் புதுமையாகவும், கூடியிருந்தவர்கட்கு மகிழ்ச்சி விளைப்பன வாகவும் இருந்தன."
1052,"பந்தர், கூட்டம், உணவு முதலாய் எல்லா வகையானும் இத்திருமணம் வழக்கத்தின் மேலாகச் சிறப்புடன் விளங்கியது."
1053,"நிகழ்ந்த ஒரு குறை யாது எனின், பகல் விருந்துக்கு நேரம் கடந்துவிட்டமையே."
1054,"சமையற்காரர்கள் கறிவகைகள் எல்லாம் சித்தஞ் செய்து வைத்தும், அடிசில் ஆக்குவதற்குக் காலம் தாழ்த்து விட்டனர்."
1055,காலையில் சிற்றுண்டி நீண்டநேரம் அளித்துக் கொண்டிருந்தது.
1056,இங்ஙனம் பொழுது தாழ்ந்தமைக்கு ஒரு காரணமாகும்.
1057,உரிய பொழுதில் உணவளிக்க வேண்டுமென் பதனைச் சமையற்காரர்களுக்குக் கண்டிப்பாகத் தெரிவியா திருந்தது என் மேலுள்ள குறையாகும்.
1058,"இயல்பாக நடக்கு மென்றெண்ணி, நான் கொட்டகையில் இருந்து விட்டேன்."
1059,உரிமையுடைய பிறரும் கவனியாதிருந்து விட்டனர்.
1060,"பகல் மணி வரையில் உணவுண்ணாமல் யாவரும் காத்திருக்க நேர்ந்ததை நினைத்து மிக்க நாணமும், வருத்தமும் எய்தினேன்."
1061,நீலகிரியி லிருந்து வருவித்த காய்கறிகள் முதலாகப் பெருஞ்செலவில் நன்கு ஆயத்தஞ் செய்தும் பொழுது தாழ்த்தமை ஓர் பெருங் குறையாயிற்று.
1062,"அன்பர் சிலர் பழம், பலகாரம், கலர் முதலியன உண்டு ஊருக்கு ஏகினர்."
1063,இத்தெய்தியில் தேதியில் பல இடங் களில் திருமணம் நிகழ்தலின் போதிய கூட்டம் வராமையால் உணவுப் பொருள் முதலியன.
1064,மிஞ்சிவிடுமே என எண்ணியதும் உண்டு.
1065,ஆனால் எப்பொழுதையினும் மிகுதியாகக் கூட்டம் வந்துவிட்டது.
1066,பெரிய கொட்டகையில் நாலைந்து முறை பந்தி வைக்க நேர்ந்தது.
1067,பகல் மணி முதல் மணி வரையில் உணவு நடந்தது.
1068,இதுபெரிதும் மகிழ்ச்சிக்குரிய செய்தி.
1069,உணவின் பாகம் மிக நன்றாயிருந்ததென்று பலரும் கூறினராம்.
1070,என்னை நிருவாகத் திறமையுடையவனாக எண்ணியிருந்தேன்.
1071,அவ்வெண்ணம் பழுதாயிற்று.
1072,"வந்தோரை உபசரிப் பதிலும், விருந்தளிப்பதிலும் யான் மிக்க திறமையுடன் நடந்திருக்க வேண்டும்."
1073,இம்முறை என் குறை நன்கு புலனாயிற்று.
1074,திருமணத்திற்கு வந்திருந்த உறவினரல்லாத நண்பர்களில் முக்கியமானவர்கள் கோயமுத்தூரைச் சேர்ந்த உப்பிலிபாளையம் திரு.
1075,"ராஜுநாயுடு புதல்வர் இராமசாமி நாயுடு, இடிகரை கரிவரத ராஜலு நாயுடு."
1076,சிவகங்கை .
1077,"சோமசுந்தரம் பிள்ளை திருக்காட்டுப்பள்ளி சப் ரிஜிஸ்தரார் சோம சுந்தரம் பிள்ளை குடும்பத்துடன், செங்கோட்டை திரு."
1078,"பெரியசாமித் தேவர், மே."
1079,"இராமசுவாமி, லாலுகுடி திரு."
1080,"அவர்கள், திருச்சி திரு."
1081,"பெரியசாமி பிள்ளை, பரமசிவம் ஆச்சாரியார், கடலூர் திரு."
1082,"சுப்பராய முதலியார், திருவையாறு திரு."
1083,கரந்தை தக்ஷிணாமூர்த்தி பிள்ளை முதலானவர்கள்.
1084,இன்று காலை மணிக்கு மேல் மணமக்களைச் செங்கி பட்டிக்கு அழைத்துச் சென்றனர்.
1085,மணமக்களை அழைப்பதற் கென்று மாலை மணிக்கு மூன்று நான்கு வண்டிகளில் நடுக்காவேரியிலிருந்து சென்றனர்.
1086,"சிவப்பிரகாசமும், பார்வதியம்மாளும் இரவு மணிக்கு மேல் தேவகோட்டைக்குப் புறப்பட்டார்கள்."
1087,மணமக்கள் வந்து சேர்ந்தனர்.
1088,நடராஜன் நீலகிரி போவதற்குப் போலீஸ் இன்ஸ்பெக்டரிடம் சர்டிபிகேட் பெறுவதற்காகத் தஞ்சை சென்றனன்.
1089,"நடராஜன் காலையில் ஊர்வந்து, மாலை மணிக்கு மேற்கே செல்லும் காரில் நீலகிரி அருவங்காட்டுக்குப் புறப்பட்டுச் சென்றுள்ளான்."
1090,"தஞ்சையில் வாடகை வீடுபார்ப்பதற்காக இன்று பகல் மணிக்குப் புறப்பட்டுச் சென்று சில வீடுகளைப் பார்த்துவிட்டு, இரவு கரந்தையில் தங்கினேன்."
1091,செல்வி இராசம்மையைப் படிப்பிப்பதற்கு இன்று இரவே தொடங்கச் செய்தேன்.
1092,இன்று நானே பாடம் கற்பிக்கவும் தொடங்கினேன்.
1093,கையெழுத்து நன்றாக இருக்கிறது.
1094,முயற்சியுடன் பயின்றால் விரைவில் ஓரளவு கல்வி கற்கலாம் என நினைக்கிறேன்.
1095,"நேற்றும், இன்றும் நடராஜனிடமிருந்து கடிதங்கள் வந்தன."
1096,இராசம்மாளுக்குத் தொடர்ந்து பாடம் கற்பித்து வருகின்றேன்.
1097,கணக்கில் நல்ல அறிவு இருப்பது தெரிகிறது.
1098,ஹிட்லரின் பிரசங்கம் இன்று பத்திரிகையில் வெளிவந்துளது.
1099,பிரிட்டனைச் சமாதானத்திற்கு அழைக்கின்றார்.
1100,காங்கிரஸ் காரியக் கமிட்டியானது காந்தியடி களின் அஹிம்ஸா தர்மக் கொள்கையைக் கைவிட்டுவிட்டது.
1101,இன்று காலை மணிக்கு யாவருமே நடுக்காவேரி யினின்றும் புறப்பட்டுத் தஞ்சை வேங்கடேசப் பெருமாள் கோயில் தெருவில் ரூ.
1102,வாடகையில் அமர்த்தப் பெற்ற வீட்டுக்குக் குடிவந்து பகல் மணிக்கு மேல் சேர்ந்தோம்.
1103,தம்பி மு.
1104,கோவிந்தராஜா குடும்பத்துடன் காலையிலிலேயே இவ்வீட்டிற்கு வந்திருந்தனர்.
1105,வீடு பெரிதா யிருப்பினும் எனக்குப் போதிய வசதியுடையதன்று.
1106,பிள்ளைகளின் பூசல் என் அமைதியைக் கெடுக்கும் எனவும் நினைக்கிறேன்.
1107,திருஞான சம்பந்தன் வது பாரத்திலும் திருநாவுக்கரசு வது பாரத்திலும் .
1108,ஸ்கூலில் இன்றே சேர்ப்பிக்கப் பெற்றனர்.
1109,ஏனைய பேரப்பிள்ளைகளும் தம்பிபிள்ளைகளும் பெண்கள் ஆரம்பப் பாடசாலையில் இன்று சேர்ப்பிக்கப் பெற்றனர்.
1110,"அவருக்கு ஓர் புதிய சேலம் குண்டஞ்சியும், ரூ.ம் கொடுத்தநுப்பினேன்."
1111,இறைவன் வருவாயை நிறுத்தி இத்தகைய செலவுகளை ஏற்படுத்தி வருகின்றனர்.
1112,இறைவனருள் எவ்வாறு நடத்துவது என்பது பின்னர்த் தெரியும்.
1113,ஆனால் நேற்றிரவே உடல் நலம் குன்றலாயிற்று.
1114,இன்று தொந்தரை மிகுதி.
1115,இரவில் மனைவி துணைக்கு வந்திருக்க நேர்ந்தது.
1116,இந்நிலையில் எனக்குப் புலனடக்கம் இல்லாதது வருந்தத்தக்கது.
1117,நான்கு நாட்களாக இருமலின் தொந்தரை மிகுதி.
1118,இரவில் பெரும்பாலும் துயில் இல்லை.
1119,இந்நிலையில் இன்று கார்த்திகை விரதம் பாராயணங்களுடன் இனிது நிறைவேறிற்று.
1120,சில நாட்களாகச் செய்தித்தாள்கள் படிப்பதில்லை.
1121,நாடொறும் சில கடிதங்கள் எழுதுவதே வேலை.
1122,"ஆனால், மயிலை சீனி வேங்கடசாமி என்பவர் எழுதிய பௌத்தமும் தமிழும் என்னும் புத்தகத்திற் பெரும்பகுதியை இன்று படித்து முடித்தேன்."
1123,அவருடைய அன்பும் முயற்சியும் பலராலும் பாராட்டப்படுகின்றன.
1124,இறைவன் தன் காரியத்தை எளிய நிலையிலுள்ள அன்பர்களால் நிறைவேற்றிக் கொள்வதற்கு இஃதோர் உதாரணமாகும்.
1125,அவர் வசூலுக்காக இன்று என்னிடம் வந்தனர்.
1126,"பலவகையிலும் எனக்குச் செலவு மிகுந்து, வருவாய் குறைந்த நிலையில் இது நேர்ந்தது வியப்பாயிருந்தது."
1127,"எனினும், ஏதோ பொருள் கையிலிருக்கும் பொழுதே இதற்குப் பயன்படுத்த வேண்டுமென்னும் ஆவல் உண்டாயது."
1128,ஐந்து ரூபாய் சேர்ப்பித்தேன்.
1129,"அவர் போல் திருப்பணிக்கு உழைக்கும் பேறு வாய்க்காவிடினும், இது செய்த அளவில் என் நெஞ்சம் உருகியது."
1130,என் தம்பி மு.
1131,கோவிந்தராஜாவை இவ்வரிய அறச் செயலில் சிறிதேனும் ஈடுபடுத்த எண்ணினேன்.
1132,அவன் சிறிதும் இதனைக் கவனிக்கவில்லை.
1133,அவனுடைய படாடோப ஆரவாரச் செய்கைகள் எனக்கு வருத்தம் விளைக்கின்றன.
1134,நாடொறும் உடல்நலங் குன்றி இராப்பொழுது கழிவது அரிதாகி வந்தது.
1135,மென்டாகோ முதலிய மருந்துகளால் முன்போல் பயனில்லாமையால் பத்துப் பன்னிரண்டு நாட்களாக அவை உண்பதை நிறுத்திவிட்டேன்.
1136,தொந்தரை மேன்மேலும் மிகுந்து வந்தமையால் எபசோன் என்ற மாத்திரையை இன்று வாங்கி உண்ணத் தொடங்கினேன்.
1137,நேற்றும் இன்றும் யான் குளிக்கவு மில்லை.
1138,"ஆவணி முதற்றெய்தியாகிய இன்று ஆவணி முதல் நாளில் திருச்சியை விட்டு, அண்ணாமலை நகர் சென்றதை ஞாபகப்படுத்துகிறது."
1139,இன்று முதல் உடல் நலம் பெறும் என எண்ணுகிறேன்.
1140,"உரத்தநாட்டு வைத்தியரொருவர் செய்து கொடுத்த திப்பிலிச் சூர்ணமும், கோஷ்ட ஷர்பத்தும் உண்ணத் தொடங்கினேன்."
1141,இன்று காலை நடுக்காவேரி சென்று மாலையில் மீண்டேன்.
1142,இன்று பித்தக் கொதிப்பு மேலிட்டுச் சிறிது காய்ச்சலும் உண்டாகித் துன்புறுத்திற்று.
1143,இது புதிய மருந்தின் விளைவு போலும்?
1144,இன்று மாலை சென்னை கவர்னர் இந்நகருக்கு வந்து சென்றனர்.
1145,அவரது சொற்பொழிவைக் கேட்கவும் வேடிக்கை பார்க்கவும் பெருந்திரளாக மக்கள் கூடியிருந்தனராம்.
1146,"கவர்னரின் பேச்சை, திரு."
1147,உமா மகேசுவரம் பிள்ளையவர்கள் அருமையாகத் தமிழில் மொழி பெயர்த்தனராம்.
1148,இன்று காலை பூதலூர் சென்றோம்.
1149,சிவகாமுக்கும் திருமணம் நடைபெற்றது.
1150,"திருவையாற்றில் மணமகனுடன் கல்வி பயிலும் மாணவர் பலர் வந்திருந்ததும், அவர்கள் வாழ்த்துப் பாக்கள் பாடி அளித்ததும் மகிழ்ச்சி விளைத்தன."
1151,நான் இன்று பத்திய உணவுண்டு ஒருவாறு பொழுது கழித்தேன்.
1152,உடல் நலமில்லாமையால் நான் இன்று ஆற்காடு செல்லாமல் காலை மணிக்குப் புறப்பட்டுத் தஞ்சை வந்தேன்.
1153,மைந்தன் திரு.
1154,நடராஜன் நீலகிரியிலிருந்து இன்று காலை வந்திருந்தனன்.
1155,எப்பொழுது யாது நிகழும் என்பதனை யாவரே அறிய வல்லார்!
1156,இன்று என் மைந்தன் திரு.
1157,"நடராஜனுக்கு வதுவைக் கல்யாணம் செய்வித்து, நான்கு நாளில் மனைவியுடன் நீலகிரிக்கு அநுப்ப எண்ணியிருந்தது."
1158,உடனே இறந்தவர் மகன் இங்கே படித்துக் கொண்டிருந்தவனை அழைத்துக் கொண்டு புறப்படலானேன்.
1159,இரவு மணிக்கு மீட்டும் தஞ்சை வந்தேன்.
1160,குறித்தபடி நற்காரியம் இன்று நிகழாதாயிற்று.
1161,சிவப்பிரகாசமும் பார்வதியம்மாளும் படுகையிலிருந்து இன்று இங்கு வந்தனர்.
