Line Number,Sentence
2821,அவை நாட்டிலேயே தொழிற்படாது பிற நாடுகளுக்குச் சென்று தொழிற்பட்டுத் திரும்பும் தீவினையைப் பெற்றுள்ளன.,False
2822,அதனால் இந்தியத் தொழின் முறைகள் மாய்ந்தன.,False
2823,செல்வம் சுருங்கிற்று.,False
2824,இவ்வளவில் சுரண்டல் நிற்கவில்லை வேறு வழியிலும் சுரண்டல் இன்னும் நிகழ்கிறது.,False
2825,நாடு ஒருவித விடுதலை பெற்றுள்ள இந்நாளிலாதல் மக்கள் கருத்துச் சுரண்டலை நிறுத்துவதில் படிகிறதா?,False
2826,சாதி மதப் பூசல்களின் மீதே மக்கள் கருத்துப் படிகிறது.,False
2827,வரியும் செலவும் இந்தியன் பலவித நெருக்கடியில் நின்று வரி செலுத்துகிறான்.,False
2828,அவ்வரிப் பணமாதல் இந்தியாவில் சுழன்று இந்தியாவுக்கே பயன்படுகிறதா?,False
2829,இந்தியாவில் ஐரோப்பியரும் வேலை செய்கின்றனர் இந்தியரும் வேலை செய்கின்றனர்.,False
2830,ஐரோப்பியர் இந்தியாவைத் தாய்நாடாகக் கொண்டவரல்லர்.,False
2831,அவரீட்டும் பொருள்களெல்லாம் இந்நாட்டில் தங்குவதில்லை.,False
2832,இந்தியர் பெறும் சம்பளமாதல் இந்தியாவுக்கே பயன்படுகிறதா?,False
2833,"அவை எங்கேயோ செய்யப்பட்டு, இந்தியர் பொருளை உறிந்து இந்தியர் உடலிலும் உறைவிடத்திலும் வாழ்வு பெறுகின்றன.",False
2834,மற்றும் பல வழியிலும் இந்தியாவின் செல்வம் பிற நாடுகளுக்குச் சென்று கொண்டே யிருக்கிறது.,False
2835,இந்தியாவின் வரிப்பணம் செலவாகும் முறைகள் முன்னர்க் குறிக்கப் பெற்ற தாதாபாய் முதலியோரால் நன்கு விளக்கப் பட்டிருக்கின்றன.,False
2836,இந்நாளில் அவற்றிற் பலவற்றை எடுத்துக்காட்ட வேண்டுவதில்லை.,False
2837,அம்முறைகள் பலவழியிலும் பிரசாரஞ் செய்யப்பட்டுள்ளன.,False
2838,இந்திய வரிப்பணத்தில் ஏறக்குறைய ஒரு பகுதி இராணுவத்துக்கு நிவேதனமாதல் பத்திரிகை படிக்கும் ஒவ்வொருவருக்குந் தெரியும்.,False
2839,"ஆகவே, இங்கே சுரண்டலைப் பற்றிய விளக்கவுரை வேண்டுவதில்லை.",False
2840,.இல்கான் விருபியவறுசபளப்பட்டிஒன் .,False
2841,அதில் உத்தி யோகதர் வருஷ வாரியில் பெறும் சம்பளம் குறிக்கப் பட்டுள்ளது.,False
2842,"அதன்படி , ஐரோப்பியருக்கு ரூ.,,,, யூரேஷியருக்கு ரூ.,, , இந்தியருக்கு ரூ.,,, சம்பளம்.",False
2843,இவரனைவரும் ஆயிரத்துக்குமேல் வாங்கு வோர்.,False
2844,மற்றவர் சம்பளம் இக்கணக்கில் வரவில்லை.,False
2845,"இந்திய வரிப்பணத்திலிருந்து இங்கிலாந்தி லுள்ள ஐரோப்பியருக்குப் பவுன் கணக்கில் ,, ரூ.,,, தொகை அளிக்கப்படுகிறது.",False
2846,இந்தியப் பணத்திலிருந்து மற்றுமோர் அநியாய வழியில் செலவு செய்யப்படுகிறது.,False
2847,"அது கிறிதுவச்சபைக்குஆண்டுதோறும் சலவுய்யப்படுவது.க ப்புக்குரூ.,ன்னை பபாய்பிப்புக்கள்ஒவொருவருக்கும்ரூ.,லகூர்,லசுமணபுரி,நகப்பூர்,இங்கூன்ஆஇடன்பிஷப்புருக்குரூ.,சீனியர் சாப்பியின்கட்குரூ.,.ஆங்கிலிகசாப்பியின்களும்,பிரபிரியன்சாப்பியின்களும்இருக்கிறர்கள்.கத்தோ வெலியன்களும் உதவிபெறுகிறார்கள்.",False
2848,கோயில்கள் கட்டப் படுதற்கும் பழுது பார்த்தற்கும் அரசாங்கம் உதவி செய்கிறது......,False
2849,"இல் வருவாய் ,, பவுன் செலவு ,, பவுன், அரசாங்கம் இந்தியருடையதாயின் எவ்வளவு செலவு குறைக்கப்படலாம் என்பதைச் சால்லவண்டுவதில்லை.......",False
2850,சர்க்கார் சொல்வது இந்தியா பிரிட்டனின் சார்புநாடு.,False
2851,தனது சார்பு நிலைக் கேற்றபடி இந்தியா பெரிய ஆங்கிலேய உத்தியோகதரை அமர்த்தும் கட்டுப்பாடுடையதாகிறது.,False
2852,இல் பிரிட்டிஷாரைக் கொண்ட பட்டாளம் இந்தியாவிலிருந்தது.,False
2853,"அவர்களின் கையிருப்பும், பென்ஷனும் இங்கிலாந்துக்கு அனுப்பப்படுகின்றன.",False
2854,அவர்தம் பிள்ளைகள் நான்கு வயதுக்கு மேற்பட்டவர்கள் கல்வி பெறுதற்கென்று தாய் நாட்டுக்கு அனுப்பப்படுகிறார்கள்.,False
2855,அப்பிள்ளைகளின் செலவுக்கு இந்தியாவில் தந்தைமார் பெறும் இந்தியப் பணம் அனுப்பப்படுகிறது!,False
2856,உயர்தரக் கல்விக்கென்று இங்கிலாந்துக்கு இந்திய மாணாக்கர் அனுப்பப்படுகின்றனர்.,False
2857,அவருள் இந்தியர் அறுபது பேரே என்று ராயல் கமிஷன் முன்னர்ச் சான்று பகர்ந்துள்ளதும் ஈண்டுக் குறிக்கத்தக்கது.,False
2858,இந்தியாவின் நிலை இப்புள்ளிக் கணக்குகளால் இந்தியாவின் செல்வம் உத்தியோக வழியில் செலவாகியது.,False
2859,ஓரளவில் புலனாதல் காண்க.,False
2860,"அயலவரின் வாணிபம், இந்தியாவின் செல்வத்தைச் சுரண்டுவதைப் பற்றிய சில குறிப்புக்கள் மேலே பொறிக்கப்பட்டன.",False
2861,"பல வழியிலும் இந்தியாவின் செல்வம் பிற நாடுகளுக்குப் போவதால், இந்தியாவில் பட்டினியும் பஞ்சமும் நிலைத்து நிற்கலாயின.",False
2862,இந்தியா காமதேனுவே.,False
2863,எதற்கும் ஓரளவு உண்டு.,False
2864,காமதேனு வற்றக் கறக்கப்பட்டால் ஓராண்டு தாங்கும் ஈராண்டு தாங்கும் பத்தாண்து தாங்கும் குறைந்தது ஐம்பதாண்டுந் தாங்கலாம்.,False
2865,அதற்கு மேல் காமதேனு என் செய்யும்?,False
2866,இரத்தஞ் சொரியும்.,False
2867,இப்பொழுது அதற்கு இரத்தமுமில்லை.,False
2868,மயக்கத்தால் காமதேனு சாய்ந்து கிடக்கிறது.,False
2869,பட்டினியும் பஞ்சமும் இந்தியாவை அரிக்கின்றன.,False
2870,"இந்திய மக்கள், வாழ்வு நலமிழந்து கிடக்கிறார்கள்.",False
2871,அவர்கள் வருவாய் சுருங்கிற்று வயது சுருங்கிற்று.,False
2872,"சராசரியில் ஓர் இங்கிலீஷ்காரனது ஒருநாள் வருவாய், ஓர் இந்தியனின் மாத வருவாயாதல் காண்க.",False
2873,உலகில் எந்த நாடும் வருவாயிலும் வயதிலும் இந்தியாவைக் காட்டிலும் சுருங்கி நிற்க வில்லை.,False
2874,காரணம் என்ன?,False
2875,இந்தியா தன்னாட்சி இழந்தமையே யாகும்.,False
2876,இனி இந்தியர் வருவாயும் வயதும் பெருகலாம்.,False
2877,இதற்குச் சாதி மதப் பூசல் அற்ற இந்தியா முகிழ்த்தல் வேண்டும்.,False
2878,கல்வி வருவாய் குறைந்து பட்டினியாலும் பஞ்சத்தாலும் வாடி வதங்கும் இந்தியன் எக்கலையில் கருத்துச் செலுத்த வல்லவனாவன்!,False
2879,கலையின்பம் நுகர்தற்குப் பொருளாதாரச் செழுமை வேண்டும்.,False
2880,இந்தியா பொருளாதாரச் செழுமை இழந்து நீண்ட காலமாகி விட்டது.,False
2881,இந்தியன் வயிற்றுக்கே வனவாசஞ் செய்கிறான் அவன் பொறிபுலன்கள் ஒடுங்கிக் கிடக்கின்றன.,False
2882,அவன் கண் எக்கலையைக் காணும்?,False
2883,அவன் காது எக்கலையைக் கேட்கும்?,False
2884,அவன் கை எக்கலை யைத் தொடும்?,False
2885,அவன் கருத்தில் எக்கலை பதியும்?,False
2886,அவன் பட்டினிப் பஞ்சக்கலை யன்றிப் பிறிதொரு கலையை அறியாத நிலையிலிருக் கிறான்.,False
2887,அறுபத்து நான்கு கலைகளை ஈன்ற இந்தியன் நிலை இவ்வாறாயிற்று!,False
2888,"சாதிமத வெறியும், வேற்றுமை யுணர்வும், பிறவும் தன்னாட்சியை வீழ்த்தின.",False
2889,என் செய்வது?,False
2890,"இவ்வுரையைக் காணுஞ் சிலர், என்ன!",False
2891,முன்னாளை விட இந்நாளில் கல்வி பெருகவில்லையா என்று கருதல் கூடும்.,False
2892,இது வெறும் உருவெளித் தோற்றமே.,False
2893,இந்நாளில் வளருங் கல்வி எத்தகையது?,False
2894,இப்பொழுது கல்வி என்னுஞ் சொல் வளர்கிறதேயன்றி அதன் பொருள் வளர்வதில்லை.,False
2895,இக்காலக் கல்வியாளர் தொகையில் பெருகுகின்றனரா குணத்தில் பெருகுகின்றனரா என்பது ஆராயற்பாலது.,False
2896,கல்வி எற்றுக்கு?,False
2897,குணமென்னுங் குன்றேறி நின்று வாழ்வு நடாத்துதற்கென்க.,False
2898,இதற்குத் துணை செய்வது கல்வி.,False
2899,கல்வி அறியாமையைக் கல்லுவது.,False
2900,அறிவு குணம் செயல் என்னும் ஆட்சியை நோக்குக.,False
2901,குணம் சிங்க நோக்காக நிற்பதை ஓர்க.,False
2902,"அறிவி னின்று நற்குணம் முகிழ்த்தால், அதனின்றும் நற்செயல் தானே மலரும்.",False
2903,இன்றியமையாதது குணம் குணமே.,False
2904,"ஆதலின், கல்வி என்னும் பெயரால் வெறும் அறிவு மட்டும் விளங்கிக் குணம் விளங்காவிடின், அக்கல்வியால் என்ன பயன் விளையும்?",False
2905,கல்வி இயற்கை வழியே பெறுவதாயிருத்தல் வேண்டும்.,False
2906,"அதில் நல்லறிவு விளங்கும் நல்லறிவில் நற்குணம் பொலியும், செயற்கை வழிப் பெறுங் கல்வியினின்றும் நல்லறிவே பிறவாது.",False
2907,நல்லறிவில்லா விடத்தில் நற்குணம் எப்படிப் பொலிவதாகும்.,False
2908,இக்காலக் கல்வி எவ்வழியில் வளர்கிறது?,False
2909,இயற்கை வழியிலா?,False
2910,செயற்கை வழியிலா?,False
2911,அவற்றில் அமர்ந்து கல்வி பயில்வோர் பலர் குணமிலராய் வாழ்தல் வெள்ளிடைமலை.,False
2912,குறை மக்கள் மேலதா?,False
2913,கல்விமுறையின் மேலதா?,False
2914,கல்வி முறையின் மேலதே.,False
2915,"வாரன் ஹேடிங் காலத்திலும், லார்ட் ஹேடிங் காலத்திலும் மேல்நாட்டு முறையில் மிகச் சில பள்ளிகள் அமைக்கப் பட்டன.",False
2916,அவற்றில் ஆங்கிலம் கட்டாயப்படுத்தப்படவில்லை.,False
2917,ஆங்கிலக் கல்வி விதை லார்ட் பெண்டிக் காலத்திலேயே இந்தியாவில் விதைக்கப்பட்டது.,False
2918,அதற்கென்று முயன்றவர் இருவர்.,False
2919,ஒருவர் ஆங்கிலேயர் மற்றொருவர் இந்தியர்.,False
2920,ஆங்கிலேயர் மெக்காலே.,False
2921,இந்தியர் ராஜாராம் மோஹன்ராய்.,False
2922,ஆங்கிலக் கல்வியால் நலம் விளையுமென்றே மோஹன்ராய் கருதியிருப்பர்.,False
2923,"கல்கத்தா, சென்னை, பம்பாய் ஆகிய மூன்று பெரிய நகரங்களில் பல்கலைக் கழகங்கள் காணப்பட்டன.",False
2924,பின்னே தொடர்ந்து தொடர்ந்து ஆங்காங்கே பல கழகங்கள் அமைக்கப்பட்டன.,False
2925,கோகுலே முதலியோர் கட்டாய மூலாதாரக் கல்விக்கென்று செய்த முயற்சி அளவிடற்பால தன்று.,False
2926,அவர் தம் முயற்சி அவர் காலத்தில் வெற்றியளிக்கவில்லை.,False
2927,பின்னே அம் முயற்சி ஒரோ வழியில் வெற்றி யளித்தது.,False
2928,ஆங்கிலப் பயிற்சி காட்டுத் தீப்போல் நாட்டில் பல பாகங் களில் பரவலாயிற்று.,False
2929,இப்பொழுது கோடிக் கணக்கினராய்ப் பெருகி நிற்கின்றனர்.,False
2930,இவ்வளவு பேரும் அடிமை வேலையைக் குறிக் கொண்டே ஆங்கிலம் பயின்றனர்.,False
2931,அடிமை வேலைக்கென்று கல்வி பயில்வது எங்ஙனம் இயற்கையினதாகும்?,False
2932,"ஆதலின், இக்காலக் கல்வி செயற்கையின்பாற்பட்ட தென்பதில் என்ன ஐயம்?",False
2933,ஆங்கிலக் கல்வி செயற்கையின தன்று.,False
2934,அதைப் பயிலும் முறையிலேயே செயற்கை யிருக்கிறது.,False
2935,"செயற்கை முறையில் ஆங்கிலம் பயில்வதால், அஃது அடிமை உணர்வை உண்டாக்குகிறது போலும்!",False
2936,அறிவு விளக்கத்துக்கு எம்மொழி பயின்றாலென்ன?,False
2937,அதைத் தீய வழியில் பயன்படுத்துவது அறியாமை.,False
2938,ஒருவன் முதலில் தாய்மொழி பயில்வது சிறப்பு.,False
2939,பின்னே அவனுக்குப் போதிய வாய்ப்புக்களிருப்பின் அவன் பல மொழி பயிலலாம்.,False
2940,இப்போது ஆங்கிலம் பயின்றோர் தொகை அடிமை முழை களை நிரப்பி மேலும் மேலுந் ததும்பி வழிகிறது.,False
2941,"கேள்வி நன்றாயிருக்கிறது பொருந்தியது போலவுந் தோன்றும், ஆனால் அதை ஊன்றி நோக்கினால் அது பொருந்திய தன்று என்று விளங்கும்.",False
2942,என்று கேள்வி கேட்போர் கருதுவதில்லை போலும்!,False
2943,இந்தியாவில் விஞ்ஞான வழியில் தொழில் வளரப் பிரிட்டிஷ் ஆட்சிமுறை இடந் தந்ததில்லை.,False
2944,அதனால் மேல் நாட்டுக்குப் பலதிற இடர்கள் உண்டாகும்.,False
2945,இடர்களை உண்டாக்கப் பிரிட்டிஷ் ஆட்சி முறை முனைந்ததில்லை விரைந்ததில்லை.,False
2946,நிலைமை இவ்வாறிருந்தமையால் இந்தியக் கல்வியாளர் விஞ்ஞான வழியில் தொழில்களை வளர்க்கப் புகுந்தாரில்லை.,False
2947,இப்பொழுது இந்தியா ஒருவித உரிமை பெற் றுள்ளது.,False
2948,"விஞ்ஞானக் கலை நன்முறையில் பரவின், அஃது ஒருவாறு வேலையில்லாத் திண்டாட்டத்தை ஒழிப்பதாகும்.",False
2949,இக்காலக் கல்வியின் அடிப்படையில் விதேசியம் ஊர்ந்து கொண்டிருத்தல் கருதற்பாலது.,False
2950,"கல்வி பயிலும் பள்ளி முழுவதும் விதேசியமாயின், பிள்ளைகளிடம் சுதேசியம் எங்ஙனம் வளரும்?",False
2951,பிள்ளைகள் கற்பதும் கேட்பதும் காண்பதும் பிறவும் விதேசியம்!,False
2952,"அவர்கள் படிக்கும் புத்தகம், எழுதும் காகிதம், விளையாடுங் கருவிகள் யாவும் விதேசியம்!",False
2953,விதேசியச் சூழலிடை நின்று வளரும் பிள்ளைகள் நெஞ்சில் என்ன வளரும்?,False
2954,இளமையிலேயே மக்களுக்கு விதேசிய விதை விதைக்கப்படுகிறது!,False
2955,தொட்டிற் பழக்கம் சுடுகாடு மட்டும் என்பது பழமொழி.,False
2956,இந்திய மகனே மாஜிட்ரேட்டாயமர்ந்து தேசபக்தரைத் தண்டித்தான்.,False
2957,இச்செயல்கள் இக்காலக் கல்வியின் இயல்பைப் புலப்படுத்துவனவாம்.,False
2958,"இக்காலக் கல்வி பயின்ற ஆண்களும், பெண்களும் காலையி லெழுந்ததும் எந்தச் சோப்பால் உடலைக் கழுவுகிறார்கள்?",False
2959,எந்த உடை உடுத்துகிறார்கள்?,False
2960,எந்த உணவு உண்கிறார்கள்?,False
2961,எந்த வண்டியில் ஏறுகிறார்கள்?,False
2962,அவர்கள் வீட்டில் எவ்விசிறி சூழல்கிறது?,False
2963,எவ்விளக்கு எரிகிறது?,False
2964,எக்கருவி பாடுகிறது?,False
2965,அவர்கள் இருக்கும் நாற்காலி எவ்விடத்தது?,False
2966,உறங்கும் கட்டில் எவ்விடத்தது?,False
2967,பார்க்குங் கண்ணாடி எவ்விடத்தது?,False
