Line Number,Sentence
1,"இலெமூரியா அல்லது குமரிக்கண்டம் முதற் பதிப்பு இந்நூல் இல் தமிழ்மண் பதிப்பகம், சென்னை ."
2,வெளியிட்ட பதிப்பை மூலமாகக் கொண்டு வெளிவருகிறது .
3,குமரிநாடு பற்றிய தமிழ்நூற் குறிப்புகள் இன்றைய தமிழ்நாடு திருவேங்கடம் முதல் கன்னியாகுமரி வரை பரந்து கிடக்கின்றது.
4,இதில் இன்றைய அரசியல் பிரிவு முறைப்படி ஏறக்குறைப் பத்துக் கோட்டங்கள் ஜில்லாக்கள் அடங்கியுள்ளன.
5,"ஆனால், முன் நாட்களில் தமிழ் நாட்டின் பரப்பு இதனினும் பன்மடங்கு மிகுதியாக இருந்ததென்று கொள்ளச் சான்றுகள் பல உள்ளன."
6,"ஆங்கிருந்த மலைகளுள் குமரிமலை ஒன்று என்றும், ஆறுகளுள் குமரி, பஃறுளி இவை தலைமையானவை என்றும் தெரிகின்றன."
7,"இந் நாடு தமிழகத்தின் ஒரு பகுதி மட்டுமன்று தமிழரினம், தமிழ் நாகரிகம் என்பவற்றின் தாயகம் என்றே கூறவேண்டும்."
8,தமிழ் நூல்களில் மூன்று கடல்கோள்களைப் பற்றித் தெளிவாகக் குறிப்புகள் காணப்படுகின்றன.
9,"முதல் கடல்கோளால் பஃறுளியாறும், குமரிக்கோடும் கடலில் கொள்ளப்பட்டன."
10,"பஃறுளியாற்றின் கரையிலிருந்த தென் மதுரையே பாண்டியன் தலைநகரும், தலைச்சங்கமிருந்த இடமும் ஆகும்."
11,கடல்கோளில் பின்னர் இவன் வடக்கே போய்க் கவாட புரத்தைத் தலைநகராக்கிக் கொண்டான்.
12,இங்கே தான் இடைச்சங்கம் நடைபெற்றது.
13,"அது நாடுகளாக வகுக்கப்பட்டிருந்த தென்றும், இரண்டு ஆறுகட்கு மிடையே காவத அளவு அகன்று கிடந்ததென்றும் அறிகிறோம்."
14,இரண்டாவது கடல்கோளால் கவாடபுரம் கடல் கொள்ளப் பட்டது.
15,சிலப்பதிகாரத்தில் மாடலன் குமரியாற்றில் நீராடியதாகக் கூறப்பட்டிருக்கிறது.
16,"ஆனால், கதைமுடிந்தன்பின் எழுதப்பெற்ற பாயிரத்தில் தொடியோன் பௌவமெனக் குமரி கடலாகக் கூறப்பட்டுள்ளது."
17,"இவ்விரு காலப்பகுதிகளுக்கிடையே, அஃதாவது கோவலனிறந்து சில நாட்களுக்குப் பின்னாகக் குமரியாறு கடல் கொள்ளப்பட்டுக் குமரிக்கடலாயிற்று என்பர் பேராசிரியர்."
18,குமரியாறு கடலுள் அமிழ்ந்த காலத்தை ஒட்டியே மணி மேகலையுட் கூறப்பட்டபடி காவிரிப்பூம்பட்டினம் கடல் வயமானது.
19,வங்காளக் குடாக்கடலில் உள்ள சில பெரிய தீவுகளும் இதனுடன் அழிந்திருக்க வேண்டும்.
20,"நாகநன்னாட்டு நானூறி யோசனை வியன்பா தலத்து வீழ்ந்து கேடெய்தும், என்றது காண்க."
21,"முருகன், சிவன் முதலிய தமிழ்த் தெய்வங்கள் மகேந்திர மலையில் உறைந்தனர் என்றே தமிழர் முதலில் கொண்டனர்."
22,"கடல்கோளின் பின் அவர்களது இடம் அன்றைய தமிழ்நாட்டின் வடக்கில் இருந்த மேலைத் தொடர் என்று கொள்ளப்பட்டு, வடமலை ஆயிற்று."
23,நாளடைவில் வடமலை என்பதே மேரு என்றும் கயிலை என்றும் கருதப்பட்டது.
24,"தமிழ்நாட்டின் தென்கரை மட்டுமன்று, அதன் கீழ்க்கரையும் இலங்கையுங் கூடப் பல சிறு கடல்கோள்களுக்கு உட்பட்டன என்று தோன்றுகிறது."
25,வடமொழி வானநூலார் தமது உலக நடுவரை ஆநசனையையை இலங்கையில் ஏற்படுத்தினர்.
26,இதிலிருந்து தாமிரபரணி என்ற பொருநையாறு கடலுள் மூழ்கிய நிலத்தின் வழியாக இலங்கையூடு சென்றிருக்க வேண்டும் என்றேற்படும்.
27,கந்தபுராணத்தில் சொல்லப்படும் வீரமகேந்திரம் இலங்கை யின் தெற்கே பல கடல்கோள்களுக்குத் தப்பிக் கிடந்த ஒரு சிறு தீவேயாகும்.
28,கிழக்குக் கரையில் காவிரிப்பூம்பட்டினமேயன்றி வேறு பல தீவுகளும் அழிந்தன என்று மேலே கூறினோம்.
29,புதுச்சேரிக்கு மேற்கே பாகூர்ப்பாறை யிலுள்ள கல்வெட்டில் அது கடலிலிருந்து நாலுகாதம் மேற்கே இருப்பதாகக் குறிப்புக் காணப்படுகிறது.
30,"ஆனால், இன்று அது கடலிலிருந்து ஒரு காதமே விலகியிருப்பதால் கடல் காதம் உட்போந்த தென்பது விளங்கும்."
31,தலை இடை கடைச் சங்கங்களில் இன்னின்ன புலவர்கள் இருந்தனர்.
32,இன்னின்ன நூல்கள் செய்தனர்.
33,"இன்ன இலக்கணம் கையாளப்பட்டது என்ற விவரங்கள் இறையனாரகப் பொருளுரையிலும், பிற நூல்களிலும் கூறப்படுகின்றன."
34,"கடல்கோள்கள் காரணமாகவும், போற்றுவாரற்றும் அந் நாளைய நூல்களுள் பல இறந்துபட்டன."
35,"இங்ஙனம் தலைச்சங்க இடைச்சங்க நூல்கள் மிகுதியாக அழிந்து போக, நமக்கு இன்று மீந்துள்ளது தொல்காப்பியம் என்ற இலக்கண நூலொன்றேயாகும்."
36,மரபு வழக்காக வந்த மிகப்பழைமை யானதொரு செய்தியே என்பதை மெய்ப்பிக்கும்.
37,வடமொழிச் சான்றுகளுட் சிலவற்றை முன்பே குறிப்பிட்டுள் ளோம்.
38,அவற்றுள் மறுக்கக்கூடாத தெளிவான சான்று முதல் கடல்கோள் பற்றியாகும்.
39,ஊழிவெள்ளத்தினின்றும் தப்பி அவனது பேழை தங்கிய இடம் பொதிகைமலை ஆகும்.
40,இதனையே வடமொழியாளர் மலையமலை என்பர்.
41,இஃது அன்றைய பாண்டிநாட்டின் பெரும்பகுதிக்கும் வடக்கே இருந்ததால் வடமலை என்னப்பட்டுப் பின் பெயர் ஒற்றுமையால் மேருவுடன் வைத்தெண்ணப்பட்டது.
42,இவ் வெள்ளக் கதைகள் பல புராணங்களிலும் காணப் படுபவை.
43,"இங்ஙனம் இயற்கைச் சான்றுகளும், தென்மொழி, வடமொழி மேற்கோள்களும் ஒரே முகமாக நிலைநாட்டும் இவ்வுண்மையை எளிதில் மறுக்கவோ, புறக்கணிக்கவோ இயலாது."
44,.
45,"ஆயினும், முதன் முதலாக அத்துறையில் வழி காட்டியாய் நின்றது மொழியியல் என்றே கூறவேண்டும்."
46,உலகிலுள்ள பல மொழிகளையும் பயின்று ஆராய்ந்து அவற்றின் ஒற்றுமை வேற்றுமைகள் மூலம் அவற்றைக் கோவைப் படுத்துவது மொழியியலார் போக்கு.
47,அவற்றுள் ஒன்று தென் இந்தியா முதல் இங்கிலாந்து நாட்டிலுள்ள வேல்ஸ் வரை கோவையாய்க் கிடக்கின்றது.
48,இக் கோவையை அறிஞர் ஆரிய இனம் என்றனர்.
49,ஆரியர் முதலிடமும் இதற்கேற்ப நடு ஆசியா அல்லது தென் உருசியா என்று கொள்ளப்பட்டது.
50,"இக்கொள்கை ஆரிய இனத்தைப் பற்றிய வரையில் ஒவ்வு மாயினும், மனிதநாகரிகத்தின் தொடக்கத்திற்குப் பயன்படாத தாயிற்று."
51,கிரேக்க நாட்டில் முகைனிய ஆலஉயநயை நாகரிகமும் ஐகய ஹநபநய நாகரிகமும் கி.மு.
52,ஆண்டு முதல் மேலோங்கி யிருந்தன.
53,"இந்தியாவில் திராவிட நாகரிகத்தின் சிறப்பை வான் மீகியார் இராமாயணமும், இருக்குவேத உரைகளும் ஏற்கின்றன."
54,ஆரிய இனக்கோவையே யன்றி வேறு பல கோவைகளும் தென் இந்தியா வரை எட்டுகின்றன என்று மேலே கூறினோம்.
55,"எனவே, நாகரிகம் தெற்கிலிருந்து வடக்கு நோக்கி ஏன் சென்றிருக் கக்கூடாது என்பதும் ஆராயத்தக்க தொன்றாகும்."
56,"மொழியில் ஆராய்ச்சி, இத்தகையதொரு கொள்கையை எழுப்பப் போதியதாயினும் அதன் உண்மையை நிலைநாட்டப் போதிய சான்றுகள் உடைய தன்று."
57,"ஆயினும், உண்மையை நிலைநாட்டும் வகையில் மொழி இயல் ஆராய்ச்சியால் ஏற்படும் துணை கொஞ்ச நஞ்சமன்று."
58,கற்காலம் ளுவடிநே ஹபந என்ற தலைப்புக் கொண்ட நூலில் திரு.
59,பி.டி.
60,மேலும் மொழியியலின் தந்தை என்று புனைந்து கூறப்படும் பேரறிஞர் கால்டுவெல் னுச.
61,ஊயடனறநடட அவர்கள் திரவிட மொழிகள் சித்திய ளுஉலவாயை மொழிகளுடன் இன்றியமையா உறவுடையது என்று கூறுகிறார்.
62,பேரறிஞர் போப்பையர் னுச.
63,ழு.ரு.
64,"ஞடியீந தமிழ், ஐரோப்பிய மேலை நாடுகளில் உள்ள கெலத்திய ஊநடவள தெயுத்தானிய கூநரவடிளே மொழிகளை ஒத்திருக்கின்றது என்கிறார்."
65,இவ்விரண்டு இனங்களும் ஆரிய இனத்தின் மிகத் தொலைவுக் கிளைகள் என்பர்.
66,"இன்னும் ஆப்பிரிக்க, ஆஸ்திரேலிய, அமெரிக்க மொழிகளும் வியக்கத்தக்க முறையில் தமிழ்க்குழுவை ஒத்துள்ளன என்று அறிஞர் கூறுகின்றனர்."
67,இதனால் தமிழ்க்குழு உலக முழுமையும் உறவுடையது என்பது பெறப்படுகிறது.
68,.
69,இதுவே உயிர் வகைகள் பெருகுதற்கேற்ற தட்பவெப்ப நிலைகளைச் சிறப்பு வகையிற் பெற்றுள்ளது.
70,இப் பகுதிக்கு வடக்கிலும் தெற்கிலும் செல்லச் செல்ல உயிர் வளர்ச்சிக்குப் பலவகைச் செயற்கைத் துணைகள் வேண்டியிருப்பது தெரியவரும்.
71,"உயிர்த்திரளின் வகை மிகுதிக்கும், செழித்த வளர்ச்சிக்கும் அழகமைப்பிற்கும், எண்ணிக்கைப் பெருக்கிற்கும் நடுக்கோட்டுப் பகுதியே தலைசிறந்து நிற்கின்றது."
72,துருவங்களண்டைப் பாசிகள் கூட மிக அருமையாகவே காணப்படுகின்றன.
73,"ஆனால், நம் தென் இந்தியா போன்ற நடுக்கோட்டுப் பகுதியிலோ நூறு, நூற்றிருப்பது அடி உயரமுள்ள மூங்கில்கூடப் புல் எனப்படுகிறது."
74,புறக்கா ழனவே புல்லென மொழிப என்னும் தொல்காப்பிய உரை காண்க.
75,மற்றும் ஆலமரம் நமக்கு ஒரு மரமே குளிர்ந்த வடநாட்டினர் அஃது ஒரு காடு எனக் கணிப்பாராம்.
76,"எனவே, உயிர்வகைகளின் பிறப்பிடம் தென் பகுதியாயிருப் பதே பொருத்தமுடையது."
77,"நடு ஆசியா, தென் உருசியா, வடதுருவம் இவை ஒருகாலத்து உறைவிடங்களாயிருந்திருந்தால் கூடுமேயன்றி முதலிடங்களாக இருந்திருக்க முடியா."
78,நிலநூல் கூறுகின்றபடி இம் மண்ணுலகம் ஞாயிறோடு ஞாயிறாய் அதன்பாரிய ஒளிப்பிழம்பின் ஒரு பகுதியாய் இருந்தது.
79,ஞாயிறு தன்னைத் தானே சுற்றும் விரைவினால் அதனினின்றும் சிதறி வீழ்ந்த திவலைகளே கோள்களும் துணைக்கோள்களும் ஆகும்.
80,நமது மண் உலகமாகிய கோளும் அத்தகைய ஒரு பிழம்புத் திவலையேயாம்.
81,இங்ஙனம் மாறுவதில் நாம் உற்று நோக்கத்தக்க உண்மை ஒன்றுண்டு.
82,"ஒரு பம்பரம் சுழலும்பொழுது அதில் அசையாத பகுதிகள், நடு அச்சு பம்பரத்தைத் துளைக்கும் இடமான உச்சியும் அடிப்பகுதியுமேயாகும்."
83,பம்பரத்தின் நடுவட்டமே மிக விரை வாகச் சுழலும்.
84,இக் காரணத்தால் மேல்தோடு குளிரும்போது பிற பகுதி களைவிட இந் நடுக்கோட்டுப் பகுதியே முன்கூட்டிக் குளிர்ச்சி அடைந்திருக்க வேண்டும்.
85,கொதிக்கின்ற பிழம்பில் உயிர்வகைகள் இருக்க முடியாத தல்லவா?
86,இனித் தென் இந்திய மண் இயல்புபற்றி ஞாலநூலார் ழுநடிடடிபளைவள கூறுவதைப் பார்ப்போம்.
87,"இவர்களது ஆராய்ச்சி யின்படி, தென் இந்தியா இலங்கை இவை பெரும்பாலும் கருங்கற் பாங்காகவே இருக்கின்றன."
88,இவற்றின் பாறைகள் நெருப்பு வண்ணப்பாறை ஐபநேடிரள சடிஉமள என்ற வகையைச் சேர்ந்தவை.
89,இதுவே முதலில் கொதிக்கின்ற நெருப்புக் குழம்பாயிருந்து பின் இறுகிய பாறையாகும்.
90,"எனவே, இதில் எத்தகைய உயிர்வகையும் இருப்பதற்கு இடமில்லை."
91,"இதிலிருந்து உயிரினங்கள் தோன்றுவதற்கு முன்னைய காலம் தொட்டே, தென் இந்தியா நிலப்பகுதியாக இருந்தது தெளிவாகின்றது."
92,வட இந்தியப் பகுதிகளின் நிலத்தில் எவ்வளவு ஆழந் தோண்டினாலும் கருங்கல் பாங்கான நிலம் காண்பதரிது.
93,"ஏனெனில், அப்பகுதி முழுமையும் உண்மையில் பல்லாயிர ஆண்டுகளாகச் சிந்து, கங்கை ஆறுகள் அடித்துக் கொணர்ந்த வண்டல்களால் ஏற்பட்டதேயாகும் என்க."
94,இதனினும் சற்றுப் பழைமையான இமாலயமோ எனில் உலக வரலாற்றின் மிகப்பிந்திய நாள்வரையிற் கடலுள் அமிழ்ந்தே இருந்தது.
95,"அதில் இன்றும் காணப்படும் கடற்சிப்பிகளும், நண்டு முதலிய கடலுயிர்களின் எலும்புக் கூடுகளும், சுவடுகளும் இவ் வுண்மைக்குச் சான்று பகர்வனவாம்."
96,"மேலும், இவ் விடங்களின் நில அடுக்குகளில் செடி கொடி வகை உயிர் வகைகளின் சுவடுகள் காணப்படுகின்றன."
97,அவையும் மிகப்பழைய உயிர் வகைகளாக இல்லை.
98,"அதன் மேற்பகுதிகளில் மிகப்பழைய செடி கொடி வகைகள், உயிர்வகைகள் வளர்ச்சி முறைப்படி காணப்படுகின்றன."
99,"அதில் சென்ற ,, அல்லது ,, ஆண்டுகளாகத் தென் இந்தியா, நிலப்பகுதியாகக் இருந்து வந்திருப்பதாகக் காட்டப்பட்டுள்ளது."
100,இன்னும் தமிழ்நாட்டின் பழைமையைக் காட்ட வரலாற்றுச் சான்றுகளும் பல உள.
101,ஆரியர் வட இந்தியா வந்தது கி.மு.
102,"என்றும் என்றும், என்றும் பலவாறாக வரலாற்றிஞர் உரைக்கின்றனர்."
103,"எப்படியும் திராவிடர் நாகரிகம் இதனினும் பழைமையானதாதலின், இது வரலாற்றுக் காலத்திற்கு அப்பாற் பட்டதென்பதற்கு ஐயமில்லை."
104,"அதோடு இந்தியாவிற்கு வந்தபின், ஏற்பட்டதாதலால் அதற்கும் திராவிட நாகரிகம் முற்பட்டதென்பது சொல்லாமே அமையும்."
105,வரலாற்றறிஞர் பலர் இருக்கு வேதமே உலகின் முதல் இலக்கியம் என்று கருதுகின்றனர்.
106,இவர்களுக்குத் தமிழிலக்கியத் தைப் பற்றிய அறிவும் ஆராய்ச்சியும் இருந்திருக்க இடமில்லை.
107,தமிழ்நாட்டாரின் நான்கு ஊழிகளும் வட நாட்டார் பாகுபாடாகிய யுகங்களும் ஒன்றே என்று கீழே காட்டுகிறோம்.
108,இதனைத் தொல்காப்பியம் நச்சினார்க்கினியர் உரையாலும் காணலாம்.
109,"இனி இருக்கும் யசுவும், சாமமும், அதர்வணமும் என்பாரும் உளர்."
110,இதனால் தமிழின் பழைய நூலாகிய தொல்காப்பியம் இருக்கு முதலிய வேதநூல்களுக்கு முந்தியதென்பது பெறப்படும்.
111,கி.மு.
