Line Number,Sentence
1057,பொருளுண்மையறியாக் குறை பாடாய் முடியுமென்க.,False
1058,இங்ஙனமே வரலாற்றுண்மைக்கு மாறான செய்யுள்கள் பற்பல பின்னையோரால் எழுதிப் பெரிய புராணத்தின்கட் சேர்க்கப்பட்டமையும்.,False
1059,"ஆகவே, பாணபத்திரரைச் சுந்தரமூர்த்திகள் திருத்தொண்டத் தொகையுள் எடுத்தோதாமையால், சுந்தரமூர்த்திகட்கு முன்னிருந்த திருஞானசம்பந்தப் பெருமானும் தாரமுய்த்தது பாணற் கருளொடே.",False
1060,பாணனிசை பத்திமையால் பாடுதலும் பரிந்தளித்தான் என்பனவற்றுட் பாணபத்திரரைக் குறித்துச் சொல்லியிரார் என வழக்குப்பேசுதல் ஆ!,False
1061,எவ்வளவு முறை யுள்ளதா யிருக்கின்றது!,False
1062,"மற்றுப் பின்வந்தோரான சுந்தர மூர்த்திகள் சொல்லாது விட்டமையால், அவர்க்கு முன்னிருந்த திருஞானசம்பந்தரும் அவரைச் சொல்லாது விட்டனரென்பது யாங்ஙனம் பொருந்தும்?",False
1063,இன்னோரன்ன மயக்கவுரைகள் வழக்கு முறையாகா வென்றுணர்க.,False
1064,"பெறப்படவே, கி.பி.",False
1065,அதனாற் கல்லாடம்கி.பி.,False
1066,ஐந்தாம் நூற்றாண்டின் ஈற்றிலாதல் ஆறாம் நூற்றாண்டின் துவக்கத்திலாதல் இயற்றப்பட்டதொரு நூலாதல் தேற்றமாம்.,False
1067,அடிக்குறிப்புகள் .,False
1068,சிலப்பதிகாரம் வேனிற்காதை .,False
1069,இற்றைக்கு ஆயிரத்து நானூறாண்டின் முன் வடமொழியில் இசைநூல் இயற்றிய பரதரும்.,False
1070,அறுநூற்றெண்ப தாண்டின் முன் இசைநூல் இயற்றிய சாரங்கதேவரும் தமிழிசையிலிருந்தெடுத்தே வடமொழிக்கண் இசை வகுக்கப்பட்டதெனக் கூறினாரென்பர் இவ்வாராய்ச்சிவல்ல விருதைச் சிவஞானயோகிகள்.,False
1071,விறகுவிற்ற படலம் .,False
1072,விறகுவிற்ற படலம் .,False
1073,"திருவண்டப்பகுதி , .",False
1074,கல்லாடம் .,False
1075,கல்லாடம் .,False
1076,"செந்தமிழ் மொழிக்குப் பழைமையாக உரிய பாக்கள் அகவலும் வெண்பாவுங் கலியும் வஞ்சியுமென நான்கேயாம் தொல்காப்பியம், செய்யுளியல், ,,,.",False
1077,இவற்றுள்ளும் அகவற்பாவே மிகச் சிறந்ததாம்.,False
1078,"கட்டளைக் கலித்துறை கலிவிருத்தம், ஆசிரிய விருத்தம் முதலிய பாக்கள் கி.பி.",False
1079,இரண்டாம் நூற்றாண்டிற்கு முற்பட்ட பழைய தமிழ் நூல்களுள் யாண்டுங் காணப்படாமை பெரிதுங் கருத்திற் பதிக்கற் பாலதாகும்.,False
1080,இஃதொன்றே தொல் காப்பியம் இவற்றிற்கெல்லாம் முற்பட்ட மிகப் பழைய நூலாதலைத் தெரிக்கும்.,False
1081,பழைய தமிழ்ச் செய்யுள் வழக்கும்.,False
1082,அவர் திறம் நிற்க.,False
1083,"இப் பாக்களைப்பற்றிய இலக்கணங்களும் அங்ஙனமே தொல்காப்பியத் துட் காணப்படாமையும் என்னையென்று நடுவுநின்று நோக்கவல்ல சான்றோர்க்குச் சிலப்பதிகாரமும், தொல்காப்பியமும் கி.பி.",False
1084,மூன்றாம் நூற்றாண்டிற்கு முற்றொட்டே உள்ள நூல்களாதல் நன்குவிளங்கும்.,False
1085,"இனிக், கி.பி.",False
1086,அவற்றோடு தாமும் இருக்க இடம் பெற்றது முதன்முதல் திருவாசகம் ஒன்றிலேதான்.,False
1087,"இனித், திருவாசகத்திற் பழைமையும் புதுமையும் ஒருங்கு விரவிநிற்றலைச் சிறிது காட்டுதும்.",False
1088,திருவாசகத்தின் முதற்செய்யுள் பழந்தமிழ்ப் பாவாகிய கலிவெண்பா வால் ஆக்கப்பட்டிருக்கின்றது.,False
1089,"அதற்குப் பின்னுள்ள மூன்று செய்யுட்களும், பத்துப்பாட்டுக்களிலுள்ள அகவற்பாக் களைப்போல் நீண்ட அகவற்பாக்களால் ஆக்கப் பட்டிருக்கின்றன.",False
1090,முதற் கணுள்ள இந் நான்குபாக்களும் சொன்னடையிலும் பொருளமைப்பிலும் பத்துப்பாட்டுகளை ஒத்திருக்கின்றன.,False
1091,இரண்டு மட்டுமே வடசொற்கள்.,False
1092,"ஆகவே, திருவாசகத்தில் நூற்றுக்குப் பத்து விழுக்காடும் வடசொற்கள் விரவியிருத்தல் இச்சிறு பகுதிகளைக் கொண்டு ஒருவாறு துணியப்படும்.",False
1093,"மணிமேகலை, சிலப்பதிகாரம் இயற்றப்பட்ட இரண்டாம் நூற்றாண்டிற்கு முன்னெழுந்த சங்கத்தமிழ் நூல்களுள்ளும் மிகப் பழைய பகுதிகளுள் ஐந்நூற்றுக்கு ஒன்றிரண்டு விழுக்காடும்.",False
1094,"அங்ஙனமல்லாத பிற்பகுதிகளுள் நூற்றுக்கு ஒன்றிரண்டு விழுக்காடும் வடசொற்கள் அரிதாய்க் காணப்பட, மணிமேகலை காலத்தில் நூற்றுக்கு நாலைந்து விழுக்காடும்.",False
1095,வெற்றி கண்டபின் அக் கருவிகளைப் புறந்தள்ளாது தன்னிலும் தன் தமிழிலும் அவை இருந்து உயிர்வாழ இடமும் தந்தது.,False
1096,இவ்வாறு இருக்க இடம்பெற்ற வடசொற்களும் வடசொற் றொடர்களும் தாம்பெற்ற இடம் இனிதாயிருக்கக் கண்டு.,False
1097,இயலுமாயின் அதனை இல்லாமலே ஒழித்து விடுதற்கும் முனைந்து நிற்கின்றன.,False
1098,அது நிற்க.,False
1099,"மேலே, திருவாசகத்தின் திருவண்டப்பகுதியி லிருந்தெடுத்த பாட்டின் பகுதியையும், பழைய சங்கச் செய்யுளாகிய முல்லைப் பாட்டிலிருந்தெடுத்த பகுதியையும் ஒப்பிட்டுக் காண்புழி.",False
1100,"எனவே, பழைய செந்தமிழ் வழக்கே மிக முனைத்து நிற்க.",False
1101,அதன்கண் வடமொழி வழக்குச் சிறிது புகுந்த காலத்திலேதான் திருவாசகம் இயற்றப்பட்ட தென்பதூஉம்.,False
1102,அது தமிழோடு வடமொழி வழக்கையுஞ் சிறிது தழுவியதா மென்பதூஉம் பெறப்படும்.,False
1103,இவைகளின்பின் அறுபது விருத்தப்பாக்கள் காணப்படுகின்றன.,False
1104,இவற்றின்பிற் கலிப்பாவிலிருந்து தோன்றிய கலிநிலைத்துறையிற் பத்துச் செய்யுட்கள் இருக்கின்றன.,False
1105,"தொடக்கத்திலுள்ள நான்கு நீண்ட பாட்டுக்களையும் நந்நான்கடியாகப் பகுத்தலால், அவை நூற்றறுபத்திரண்டு செய்யுட்களுக்கு ஒப்பாகும்.",False
1106,கலிநிலைத்துறையும் கலிப் பாவினோசைபற்றி அவ்வாறு அவற்றோடு சேர்க்கப் பட்டன கலித்தாழிசை பழைய தமிழ்ப்பாவே யல்லது புதிது புகுந்தது அன்று.,False
1107,"இஃது இவ்வாறாகவும் தமிழ் வரலாறு எழுதினவர், சங்ககாலத்துச் சான்றோர் செய்யுட்களில் தாழிசை இல்லையெனப் பிழைபடக் கூறினர்.",False
1108,கலித்தொகை என்னுஞ் சங்கநூலில் தாழிசை வருதலை இவர் உணர்ந்திலர்.,False
1109,இரண்டாம் நூற்றாண்டிற்கு முற்பட்ட செந்தமிழ் நூல்க ளெல்லாம் பண்டைத் தமிழ்ப் பாக்களாலும் பாவினங்களாலுமே ஆக்கப்பட்டிருப்பக் கி.பி.,False
1110,இத் திருவாசகத்தைப்போற் பழைய வழக்கும் புதிய வழக்கும் ஒருங்கு விரவிய பிறிதொரு தமிழ்நூலைக் காண்டல் அரிது.,False
1111,"இவை, பழந்தமிழ் வழக்கே பற்றிவந்த கல்லாடத்தைச் சிறிதும் ஒவ்வாமற் புதுத் தமிழ் வழக்கின் கட்படுவனவா மென்றே துணியப்படும்.",False
1112,என்றற் றொடக்கத்துச் சங்கற்பநிராகரணச் செய்யுளையும் ஒப்பிட்டு நோக்குக.,False
1113,"அஃதாவது, ஆறாம் நூற்றாண்டின் இறுதியில் இயற்றப்பட்டதோர் அரிய நூலாதல் தெளியப்படும்.",False
1114,"மற்றுச் சங்கற்பநிராகரணமோ, ஏழஞ் சிருநூ றெடுத்த ஆயிரம் வாழுநற் சகனம் மருவா நிற்ப.",False
1115,மணிமேகலையில் எவ்வகையான வடசொற்கள் கலந்தன?,False
1116,"திருமந்திரம், ஞானாமிர்தம் என்பவற்றில் எவ்வகையான வடசொற்கள் கலந்தன?",False
1117,என்று ஆராய்ந்து பார்த்துப் பின்னர் ஒரு முடிபுக்கு வருதல் வேண்டும்.,False
1118,மணிமேகலையுட் கலந்த வடசொற்கள் புத்த மதத் தொடர்புடையனவாகும்.,False
1119,இவ்வளவே யல்லாமற் சைவசமயத் தொடர்புடைய வடசொற்கள் சொற்றொடர்கள் அதன்கட் காணப்படுகின்றில.,False
1120,இதுவும் வடநாட்டிலிருந்தே வந்ததொன் றாகையால் நான்காம் நூற்றாண்டுமுதல் இதனோடு தொடர்புடைய சொற்களுஞ் சொற்றொடர்களுந் தமிழில் வந்து கலப்பவாயின.,False
1121,"இங்ஙனம் வந்த சமணமதக் குறியீடுகளைப் பெருங்கதை, சூளாமணி, சிந்தாமணி முதலிய நூல்களுட் காண்க.",False
1122,"இனி, ஆறாம் நூற்றாண்டிலிருந்து சைவ சமயமானது சமணமதத்தோடு போராடவேண்டி வந்தமையால், அச் சமணமதச் சொற்கள் குறியீடுகளையுந் தானெடுத்து வழங்கியதோடு.",False
1123,இத்தகைய பிரிவுகளும் மதவேற்றுமைகளும் பொய்க் கதைகளும் பழைய தனித்தமிழ் நூல்களிற் காணப்படாமை கற்றறிவுடையார் பெரிதுங் கருத்திற் பதிக்கற்பாலர்.,False
1124,பழைய தனித்தமிழில் இயற்றப்பட்டிருப்பதனாலேயே திருக்குறள் என்னும் அரியபெரிய நூல் எல்லாச் சாதியினர்க்கும் எல்லாச் சமயத் தினர்க்கும் பொதுவாய்.,False
1125,எல்லாரானும் பொன்னே போற் போற்றித் தழுவப்படும் ஒப்புயர்வற்ற நூலாய்த் துலங்குகின்றது.,False
1126,"ஆனால், அத்தகைய தனித்தமிழ் மாட்சி திரும்பவும் முன்போல் ஒளியுடன் விளங்கிப் பயன்படுநாள் எந்நாளோ அறிகிலம்!",False
1127,நிலநூலார் நிலத்தினைத் துருவி அதன் கீழுள்ள பற்பல படைகளையும்.,False
1128,அவ்வப் படைகளிற் புதைந்துகிடக்கும் பற்பல பொருள்களையும் ஆராய்ந்துபார்த்து.,False
1129,"அவ்வப்படைகள் உண்டான காலத்தையும், அவற்றில் உலவிய உயிர்கள்.",False
1130,பாரதப்போர் நிகழ்ந்தபோது உடனிருந்த முதஞ்சியூர் முடிநாகராயர் காலந்தொட்டுக் கி.பி.,False
1131,"முதல் நூற்றாண்டுவரையிற் சென்றகாலத்தைத் தனித்தமிழ்க் காலமெனவும், கி.பி.",False
1132,இவ் வறுவகைக் காலங்களிற் றோன்றிய நூல்களை நன்காராயும் முகத்தாற் றெளியலாம்.,False
1133,"இவற்றுட் புத்தகாலத்துத் தோன்றிய சமயநூல்களில் அப் புத்தசமயச் சொற்கள், குறியீடுகள், கொள்கைகளே முனைந்துநிற்கக் காண்டுமல்லது.",False
1134,"பின்னர் அவ்வக்காலங்களிற் றோன்றிய மாணிக்கவாசகர், திருஞானசம்பந்தர் முதலான அருட்டிருவாளரால் வகுக்கப் பட்ட அருளரண்களுள் நிலைபெற்றுச் சுடர்ந்து ஒளிர்கின்றன.",False
1135,அவ்வக்கால வகுப்புகளில் முனைத்துக் கிளர்ச்சியாய் நின்ற கொள்கைகள் பற்றிப் புத்தகாலம் சமணகாலம் என்றதல்லது.,False
1136,அக் காலங்களிற் சைவ வைணவங்கள் இருந்திலவென்பது கருத்தன்று.,False
1137,எல்லாக்கால வகுப்பு களினூடும் இவ்விரு சமயங்களும் நிலைபெற்று வருதல் நுனித்தறிவார்க்கு விளங்கா திராது.,False
1138,அடிக்குறிப்புகள் .,False
1139,"தொல்காப்பியம், செய்யுளியல்.",False
1140,"தொல்காப்பியம், செய்யுளியல், .",False
1141,"தொல்காப்பியம், செய்யுளியல், .",False
1142,"குறுந்தொகை, .",False
1143,"கல்லாடம், .",False
1144,"ஞானாமிர்தம், .",False
1145,மாயாவாதி சங்கற்ப நிராகரணம் .,False
1146,", .",False
1147,பாரதப் போர் ..மூ நிகழ்ந்ததென்று ஒருசாராரும் கி.மு.,False
1148,ஆயிரத்தில் நிகழ்ந்ததென்று மற்றொரு சாராரும் வழக்காடா நிற்பர்.,False
1149,"திருக்கோவையாரின் செய்யுட்பொருள் பழந்தமிழ் நூல்களோடு ஒத்தல் இனித், தேவாரத்தில் விருத்தங்கள் மட்டும் உள்ளன.",False
1150,திருவாசகந் திருக்கோவையாரில் அவ்விருத்தங்களோடு துறைகளும் உள்ளன வரவரப் பாவினங்கள் பெருகுதல் இயல்பாதலால்.,False
1151,திருவாசகந் திருக்கோவை யாரில் உள்ள கட்டளைக் கலித்துறைப் பாக்கள் போல்வன எத்தனையோ தேவாரத்தின்கண் உள்ளன.,False
1152,நேரசையை முதலாகவுடைய செய்யுளாயின் ஒவ்வோரடியிலும் ஒற்றுத் தள்ளிப் பதினா றெழுத்தே இருத்தல்வேண்டும் இதுவே கட்டளைக் கலித்துறைக்கு இலக்கணமாதல்.,False
1153,இவ்வாறு கட்டளைக் கலித்துறை யிலக்கணம் வழுவாமல் வருஞ் செய்யுட்கள் தேவாரத்தின்கண் எவ்வளவோ உள்ளன!,False
1154,"உண்மை யிவ்வாறிருப்பவும், இதனைத் திரித்து முழுதும் பிறழக்கூறிய தமிழ்வரலாறு உடையார் திறம் எத்துணைச் சிறந்தது!",False
1155,"இனிப், பாட்டியலிற் சொல்லப்படும் நூல்வகைகளுட் பெரும்பாலான தேவாரகாலத்திற்குப்பின் எழுந்தனவேயா மென்றும்.",False
1156,"ஆகவே, வச்சணந்திமாலையிற் காணப்படும் நூல் வகைகளிற் பல இந்திரகாளியம் என்னும் நூலிற் சொல்லப் பட்டவைகளே யாதல் பெறப்படும்.",False
1157,"இனித், தசாங்கம், பிள்ளைத்தமிழ் முதலிய வகைகளும் பழைய திவாகர நிகண்டிற் சொல்லப்பட்டிருத்தலின் அவையும் பழைய காலத்தனவேயாம்.",False
1158,"இன்னுந் திருக்கோவையாரிற் காணப்படுஞ் செய்யுட் பொருள்களோடு ஒத்த அகப்பொருள்கள் அகநானூறு, நற்றிணை, குறுந்தொகை முதலியவற்றில் அமைந்திருக்கின்றன.",False
1159,பொருள்வகையில் இச் சங்கத் தமிழ் நூல்களுக்கும் திருக்கோவையாருக்கும் ஏதொரு வேற்றுரையுங் காணேம்.,False
1160,"இனி, அளவினாலும் அவற்றிற்கும் இதற்கும் வேறுபாடு காண்கின்றிலம்.",False
1161,"பிற்காலத் தெழுந்த தஞ்சைவாணன் கோவை முதலாயின நானூறுக்கு மேற்பட்ட செய்யுட்களான் மிக்கு முடிந்தவாறுபோல் இல்லாமல், திருக்கோவையா ரின்கண் உள்ளவை.",False
1162,"அகநானூறு, நற்றிணை, குறுந்தொகை யிற்போல நானூறு செய்யுட் களாலேயே முடிந்திருக்கின்ற வாகலின் என்க.",False
1163,அது பழைய கலிப்பாவினின்று பிறந்த தொன்றாம்.,False
1164,என்று ஓதுமாற்றால் அறியப்படும்.,False
1165,"இவ்வாறு இவை வளர்ந்து வந்தமுறை திருவாசகம் ஒன்றிலன்றி, வேறெந்த நூல்களினுங் காணப்படமாட்டாது.",False
1166,அவற்றினிடை யிடையே தோன்றுகின்றன.,False
1167,"இனிக், கி.பி.",False
1168,இவை தம்மை யடுத்துத்தோன்றிய ஞானா மிர்தமும் முழுவதூஉம் அகவற்பாவினாலேயே யாக்கப்பட்டு விளங்குவவாயின.,False
1169,இதனை முன்னேயும் விளக்கினோம்.,False
