Line Number,Sentence
2714,பின்பு அவர் சேரநாட்டுக்குச் சென்றார்.
2715,திருக்கோவலூரில் பார்ப்பார் ஆதரவில் பாரிமகளிர் இருந்து வருகின்றனர்.
2716,இச்செய்தியை முற்றும் அப்போது தகடூரி லிருந்த ஒளவையார் அறிந்தார்.
2717,அவருக்குண்டான துயரத்துக்கு அளவில்லை.
2718,உடனே சென்று அந்த மகளிர்களைக் காணவேண்டும் என்றெழுந்தார்.
2719,"அக்காலம் மழையும் குளிரும் மிக்க காலம், பழுத்த முதுமை நிரம்பிய ஒளவைக்கு அது தக்க காலமாகுமா?"
2720,இருந்தாலும் அவர் உடம்பில் முதுமையே தவிர உள்ளத்தில் இளமை தான்.
2721,இளமை மழை குளிருக்கு அஞ்சுமோ?
2722,அவரும் வந்தார் மழையும் வந்தது கோவலூரை யடையும்போது பொழுதும் மறைந்தது இருளும் பரந்தது குளிரும் மிகுந்தது.
2723,மெல்ல நடந்து சென்று பாரி மகளிர் இருந்த வீட்டைக் கேட்டுக் கொண்டு சென்று அடைந்தார்.
2724,மிக்க துயரத்தில் மூழ்கித் தடுமாறிய ஒளவையார் சிறிது தேறி அம்மகளிரையும் தேற்றினார்.
2725,அம்மகளிர் தமக்கு நீலச்சிற்றாடை போர்த்துக் குளிர் போக்கியதை யுணர்ந்தார்.
2726,அம்மகளிரின் மன நிலையை அறிந்தார்.
2727,அவர்களின் அன்பு நிலையை எண்ணினார் அரம்பையின் கீழ்க்கன்றும் கனியுதவும் என்ற பழமொழியை நினைந்தார்.
2728,பெரும் மகிழ்ச்சி பிறந்தது.
2729,அது பாட்டாய் வெளிவந்தது.
2730,"இப் பாட்டோசையில் ஒளவையின் பசியினை உணர்ந்த மூத்தவள் ஓடி இலை திருத்தி, ஒளவையை யுணவுண்ண வழைத்தாள்."
2731,உணவைப் பரிமாறுங்கால் அவள் உள்ளத்தே நினைவுகள் பல எழுந்தன.
2732,நெஞ்சுக் கலங்கிற்று உடம்பு சுருங்கிற்று அவள் கையிலிருந்த கடகம் தளர்ந்து முன் கையில் வீழ்ந்தது.
2733,ஒளவையின் புலமை நிறைந்த கண்ணுக்கு இவையெல்லாம் தெரிந்தன.
2734,"அம் மகளிரை மகிழ்விக்க எண்ணி, ......................................................."
2735,"அடகென்று சொல்லி யமுதத்தை யிட்டீர் கடகஞ் செறியாதோகைக்கு, என்று பாடி மகிழ்வித்தார்."
2736,மகளிர் இருவரும் பாட்டின் நயமறிந்து மகிழ்ந்திருந்தார்கள்.
2737,"இவ்வாறிருக்கையில், சில நாட்கள் கழிந்தும் முழு நிலா பௌர்ணமி வந்தது."
2738,அதனுடைய பால்போலும் வெள்ளிய நிலா எங்கணும் விரிந்த இன்பம் செய்தது.
2739,ஒளவையார் என்று கருதுகின்றனர்.
2740,"அக்கருத்து அவர்கள் உள்ளத்தில் முன்னைய தங்கள் செல்வ நிலையையும், இற்றைய தாழ் நிலையையும் காட்டிற்று."
2741,கண்களில் நீர் அரும்பிற்று.
2742,அவர்கள் மலர்போன்ற வாயிலிருந்து தேன் போன்ற கருத்து அமைந்த பாட்டு ஒன்று பிறந்தது.
2743,"இதனைக் கேட்டதும் ஒளவையாருக்கு அடக்க முடியாத துயரமுண்டாயிற்று, சிறிது நேரம் அனைவரும் அவலித்திருந்து ஒருவாறு தேறி உறங்கச் சென்றனர்."
2744,சில நாட்கட்குப் பின் சேரநாடு சென்று இருந்த கபிலர் கோவலூர் வந்து சேர்கின்றார்.
2745,ஒளவையார் வந்திருப்பதைக் காண அவர்க்கு மிக்க மகிழ்ச்சி யுண்டாகிறது.
2746,ஒளவையார் மனம் களித்தது.
2747,"கபிலரும் தாம் சேரநாட்டிலிருந்து இம்ம களிர் திருமணத்துக்கெனப் பொன்னும், பொருளும் பெற்று வந்து இருப்பதாகச் சொல்லி இன்புறுகின்றார்."
2748,மேலும் ஒளவையார் மகளிர் திருமணம் முடியும் வரையில் தான் உடனிருக்கப் போவ தாகச் சொல்வது அவருக்குப் பேரின்பத்தைச் செய்கிறது.
2749,ஒளவை யார் இவ்வாறு மனம் கொள்ளுதற்குக் காரணம் பாரி செய்த அறமே என்று பாராட்டினார்.
2750,மறுநாளே திருமுடிக் காரியையும் இது குறித்துக் காண்கின்றார்கள்.
2751,அக்கோவலூர் மன்னனும் பெரு மகிழ்ச்சியுடன் வரவேற்று அவர்கள் கருத்திற்கிசைந்து தன் புதல்வர்களை அழைத்து உசாவு கின்றார்.
2752,அவர்களும் அத்திருமணத்தை மனமார விரும்புகின்றார்கள்.
2753,அம்மகளிரைக் கண்ட வேந்தனும் பெருமகிழ்ச்சி அடைகின்றான்.
2754,அங்கே கூடியிருந்த அரசரும் சான்றோரும் அவருக்குக் கல்நட்டுச் சிறப்புச் செய்கின்றார்கள்.
2755,இச்செய்தி திருக்கோவலூர் வீரட்டேசுரர் கோயில் கல்வெட்டில் இன்றும் நாம் காணுமாறு பொறிக்கப் பட்டிருக்கிறது.
2756,திருமணம் நடைபெறுகிறது.
2757,திருமணம் சிறப்பொடு முடிகிறது எல்லோரும் மணமக்களை வாழ்த்திவிட்டு ஒளவையாரை வணங்கி விடைபெற்றுச் செல் கின்றார்கள்.
2758,நாட்கள் சில கழிந்ததும் ஒளவையார் தகடூருக்குப் போக விரும்பிப் பாரி மகளிரை விடை தருமாறு கேட்கின்றார்.
2759,அம்மகளிர் அவரை வணங்கி நின்று.
2760,"ஒளவையாரும் மனம் மகிழ்ந்து, தூண்டா விளக்கனையீர், தோ மின்றி வாழ்மின் என வாழ்த்தி நீங்குகின்றார்."
2761,பாரி மகளிர் இன்பவாழ்வில் இனிது இருக்கின்றனர்.
2762,..ல் திருச்சி வானொலியிற் பேசியது.
2763,.
2764,நாடகத்தில் ஒருவன் சிவனடி யார் வேடம் பூண்டு நடிக்கின்றான்.
2765,நடிக்கும் போது அவனுடைய உள்ளமும் சொல்லும் மெய்யும் சிவனடியாராகவே ஒன்றி நிற்கின்றன.
2766,"அவ்வாறு சிவனடியாராக மாறினாலன்றி அவனது நடிப்புக் காண் பார்க்குச் சுவை பயவாது, அவனுக்கும் மனவமைதி எய்தாது."
2767,"அவனுடைய நடிப்புக்கும் தோற்றம், இடைநிலை, முடிவு என முத்திறம் உண்டு."
2768,அந் நடிப்பு முடிவதற்குள் அவன் சிவனடியார் எய்தும் வீடு பேற்றை விரும்புவானாயின்.
2769,அது நகைப்புக்கு இடமாகும்.
2770,காரணம் வீடு பேற்றுக்கு இன்றியமையாத மெய்யன்பு அவனுக்குச்சிவன்பால் இல்லை.
2771,அவனைப் போல் நானும் அடியார் வேடம் பூண்டு வீடு பேறு எய்துதற்கு விரைகின்றேன்.
2772,அதற்கு வேண்டிய உண்மை யன்பை எனக்கு அருள வேண்டும் என்று வேண்டுகின்றார் மணிவாசகர்.
2773,"அதனால்தான், அவர் ஆடகச் சீர்மணிக்குன்றே இடையறா அன்புனக்கு என் ஊடுருகத் தந்தருள் என வேண்டுகிறார்."
2774,"இந்நாடக வழக்கு உலகியல் நிகழ்ச்சியே, ஆயினும் உலகியல் நிகழ்ச்சிகள் அவற்றிற்குரிய இடத்தாலும் காலத்தாலும் வேறு வேறு இயல்பின."
2775,இவற்றை ஒரு சேரத் தொகுத்து நாடகமேடையில் காண்பார் கண்டு இன்புறுமாறு செய்வதில் நாடக வழக்கு வேறு படுகிறது.
2776,இவ்வுண்மை புலப்படுத்தற்கே தொல்காப்பியர் இலக்கிய உலகிற்கு உரியன நாடக வழக்கும் உலகியல் வழக்கும் என இரண்டினையும் வேறுபடுத்திக் காட்டுகின்றார்.
2777,தொல்காப்பியர்க்கு முன்பே நிலவிய இலக்கியங்களில் நாடக நன்னூல்கள் பெருக இருந்தமையின் அவற்றை ஆராய்ந்து பொருள் இலக்கணம் வகுத்த அவர்.
2778,நாடக வழக்கினும் உலகியல் வழக்கினும் பாடல் சான்ற புலன் நெறி வழக்கம் என்று குறிப்பாராயினர்.
2779,பாடற் கமைந்தது என்று ஒன்றை நல்லி சைப்புலவர் மேற்கொண்டு பாடுகிற முறை புலனெறி வழக்கம் எனப்படும்.
2780,புலனெறியாவது அறிவு நெறி.
2781,அதுபற்றியே அகமும் புறமுமாகிய பொருள்களைச் சான்றோர் நாடகவுரை யாடல் போலவே உரைத்துள்ளனர்.
2782,பின்னர்த் தோன்றிய சிலப்பதிகாரம் முதலிய நூல்கள் அவி நயத்தோடு கூடிய நடனத்தையும் ஓரொருகால் நாடகம் என்று குறிக்கலுற்றன.
2783,ஆயினும் கதை தழுவி வரும் கூத்தையே நாடகம் என்று அந்நூல்கள் சிறப்பாக வுரைக்கின்றன.
2784,"தனி நின்று அவிநயம் காட்டி நடித்தற்கு அரங்குகள் இருந்தமை போல, கதை தழுவிய நாடகங்களை நடித்தற்கு நாடகசாலைகள் இருந்தன."
2785,இவ்வரங்குகளிலும் சாலைகளிலும் குறிஞ்சி முதலாக ஐவகை நிலங்களைக் காட்டும் திரைகள் நிறுத்தப் படுவதும் வழக்கம்.
2786,மாதவி அரங்கேறியபோது இத்திரைகள் எழினி என்ற பெயரால் நிறுத்தப்பட்ட திறத்தைச் சிலப்பதிகாரம் தெரிவிக்கிறது.
2787,இந்நாடகசாலைகளில் நடித்தற் கமைந்த நாடகத்தை எழுது பவன் புலநெறி அறிந்த புலமைச் செல்வனாதல் வேண்டுமென்பதை முன்பே கண்டோம்.
2788,நாத்தொலைவில்லா நன்னூற் புலவன் என்று கூறுகின்றார்.
2789,மக்கட்கு உணர்வு பெருகும் வாயில் கண்ணும் காதும் சிறப்புடையவை.
2790,கண்ணினும் செவியினும் திண்ணிதின் உணரும் உணர்வுடை மாந்தர் எனத் தொல்காப்பியர் உரைப்பர்.
2791,இவை யிரண்டிற்கும் ஏற்ப அமைந்தது நாடகக் காட்சி.
2792,அது பற்றியே ஜான்சனும் சேக்சுபியரின் நாடகத்தை என்று கூறுகின்றார்.
2793,நாடகத்தில் தோன்றும் மாந்தர் யாவராயினும் நினைப்பதும் பேசு வதும் செய்வதும் உலகியலில் மக்களின் நினைவு சொல் செயல்களேயாகும்.
2794,நாடகத்தில் காணப்படும் மாந்தரிடையே தெய்வங்களும் முனிவர்களும் பேய் முதலிய வைகளும் உண்டு.
2795,அவையும் மக்கள் நிலையிலே நின்று நினைப்பதும் பேசுவதும் செய்யுமே யன்றி வேறில்லை.
2796,இன்னோரன்ன காரணங் களால்தான் பழந் தமிழர் நாடகத்தைத் தமிழின் முக்கூறுகளில் ஒன்றாக்கி அறிவு நெறிக்கு இன்றியமையாத தாக்கினர்.
2797,"அந்நாட்களில் புதிது புகுந்த சமயக் கருத்துக்கள், இசை நாடகம் இரண்டும் காமமும் நோயும் விளைவிக்கின்றன எனப் பழித்தன."
2798,தமிழர் நாளும் புதுவோர் மேவலர் புதுமைப் பித்தராதலின் அவற்றை மெய்யெனக் கொண்டனர்.
2799,"அதனால் இசைவாணரும், கூத்தரும் மக்களினத்தில் தாழ்வும் இழிவும் எய்தி மறைந்தொழிந்தனர்."
2800,இசைத் தமிழும் நாடகத் தமிழும் கைவிடப் பட்டு இறந்து போயின.
2801,அக்கால வேந்தரும் செல்வர்களும் திருக்கோயில் விழாக்களில் இசை நாடகங்கட்கு இடம் அமைத்து இசைவாணர்க்கும் கூத்தர்க்கும் ஓரளவு உதவி செய்தனர்.
2802,கூத்தாடுதற்கு வேந்தர்கள் நிவந்தங்கள் ஏற்படுத்திய செய்தியைக் கல் வெட்டுக்கள் குறிக்கின்றன.
2803,கி.பி.
2804,"இவ்வாறே இராசராசன், குலோத்துங்கன் என்ற சோழ வேந்தர் வரலாறும் நாடகமாக எழுதப்பட்டதைக் கல்வெட்டுக்கள் உரைக்கின்றன."
2805,சோழ பாண்டியராட்சியில் பாரத ராமாயணக் கதைகள் பேராதரவு பெற்றன.
2806,அவற்றின் உட்கூறுகள் சிலவற்றை நாடகங் களாக எழுதி நடிக்கும் முறை மக்களிடையே தக்கஇடம் பெற்றது.
2807,ஆங்கிலக் கல்வி பரவத் தொடங்கியதும் நாடக இலக்கியங்கள் பல தோன்றுவனவாயின.
2808,திரைப் படங்கள் நாடகசாலையைக் கைப் பற்றியதும் நாடகங்கள் நன்முறையில் வளம்பெறத் தலைப்பட்டு விட்டன.
2809,இங்ஙனம் வரலாற்றுக் காலத்துக்கு முன்பே தோன்றி வளர்ந்த நாடகங்களின் உட்கிடை பெரும் பாலும் ஒருதன்மைத்தாகவே இருந்து வந்துள்ளது.
2810,காதலுறவையே நாடகங்கள் பெரும்பான்மையும் கருவாகக் கொண்டது கண்டே சமயவாதிகள் நாடகத்தைப் புறம் பழித்தனர்.
2811,அரசியலில் அவர்களது தொடர்பு பெருகினமையின் நம் நாட்டில் நாடகத் தமிழ் கற்ற நன் மக்களால் கைவிடப்பட்டது.
2812,அதனால் நாடகங்கள் போதிய கல்வி அறிவில்லாத கீழ்மக்கள் கையில் அகப்பட்டுச் சீர் குலைந்தன.
2813,காதலுறவு ஒன்றுதான் உலகியலில் மக்கள் விருப்பு வெறுப்புக் கட்குப் பொருளாவது என்று கருதுவது தவறு.
2814,"பெண்ணாசை, பொன்னாசை, மண்ணாசை என மூன்றாகச் சான்றோர் நாடகம் பொருட்டு அடிப்படையாகக் காட்டுவர்."
2815,"மக்களாட்சி தோன்றிய பின் கட்சி வெறியும், பதவி மயக்கமும் நாடகத்துக்குப் பொருளாய் வந்து சேர்ந்துள்ளன."
2816,இவற்றால் விளையும் நன்மை தீமைகளைக் காட்டி மக்கள் வாழ்க்கைக்கு நலம் விளை விப்பதில் நாடகங்கட்குப் பெருவாய்ப்புண்டு.
2817,இப்பெருமை கருதியே இளங்கோவடிகள் நாடக நூல்களை நாடக நன்னூல் என்று சிறப்பிக்கின்றார்.
2818,"ஏனெனில் மக்களுயிர்க்கு இன்பம் பெறுவதே நாட்டம், அதனை நன்னெறியிற் பெறுவதையே நல்லோர் விரும்பினர்."
2819,"தீநெறியின் விளைவே துன்பமாதலால், தீமையில் முடியும் துன்பியல் நாடகத்தை அவர்கள் விரும்பவில்லை."
2820,"நாடக முறையில் அமைந்த சிலப்பதிகாரம் துன்பியலாயினும் கண்ணகியைத் தெய்வ மாக்கியும், கோவலனைத் தெய்வவுலகில் வைத்தும் மங்கல முடிபு பெறுகிறது."
2821,"மணிமேகலை துன்பியலுமாகாது, இன்பியலுமாகாது தெய்வ வாழ்வு பெறும் துறவு நெறியில் நின்று மங்களமாய் முடிகிறது."
2822,இன்பமும் இடும்பையும் புணர்வும் பிரிவும் நன்பகல் அமையமும் இரவும் போல வேறு வேறு இயலவாகி என அகநானூறு கூறுகிறது.
2823,உலகியல் காட்டும் நாடகத்துள் துன்பியல் நாடகத்தில் இன்பியற் கூறுகளும் விரவி வரும்.
2824,ஆயினும் துன்பியல் உணர்ச்சி மீதூர்ந்து அதனை விளக்கம் பெறாதவாறு மறைத்துவிடும்.
2825,நாடக வகைகளில் வரலாற்று நாடகம் என ஒருவகையுண்டு.
2826,சேக்சுபியர் இத்தகைய நாடகங்கள் பலவற்றை எழுதியுள்ளார்.
2827,அவற்றில் நிகழ்ச்சிகள் யாவும் ஒன்றற் கொன்று காரணகாரிய முறையில் ஆற்றொழுக்காக வரும்.
2828,அதனால் ஏனைய நாடகங்களிற் போலச் சிக்கல்கள் தோன்றிய பின் படிப்படியாக உடைந்து செம்மையாக முடிவது இல்லை.
2829,பொருந்து மிடத்து நிற்பதும் பின்பு தொடர்வதும் வரலாற்று நாடகங்கட்கு இயல்பாகும்.
