Line Number,Sentence
1,இளங்குமரனார் தமிழ்வளம் .
2,வள்ளுவமும் வாழ்வியலும் .
3,திருக்குறள் நோக்கு .
4,திருக்குறளில் ஒப்புரிமை .
5,தரக்கட்டுப்பாடும் திருக்குறளும் ஆசிரியர் இரா.இளங்குமரனார் வளவன் பதிப்பகம் சென்னை .
6,நூற் குறிப்பு நூற்பெயர் இளங்குமரனார் தமிழ்வளம் ஆசிரியர் இரா.
7,இளங்குமரன் பதிப்பாளர் கோ.
8,படிகள் நூலாக்கம் செவன்த்சென் கம்யூனிகேசன் அட்டை ஓவியம் ஓவியர் மருது அட்டை வடிவமைப்பு வ.
9,"மலர் அச்சிட்டோர் ஸ்ரீ வெங்கடேசுவரா ஆப்செட் பிரிண்டர்சு இராயப்பேட்டை, சென்னை ."
10,"வெளியீடு வளவன் பதிப்பகம் எண் சிங்கார வேலர் தெரு, தியாகராயர் நகர், சென்னை ."
11,இவர் தந்நலம் கருதாமல் தமிழ் நலம் காத்து வருபவர்.
12,தம்மைமுன்னிறுத்தாது தமிழை முன்னிறுத்தும் பெருந்தமிழறிஞர்.
13,தமக்கென வாழாது தமிழ்க்கென வாழ்பவர்.
14,ஒருநாளின் முழுப் பொழுதும் தமிழாகவே வாழும் தமிழ்ப் போராளி.
15,சங்கச் சான்றோர் வரிசையில் வைத்து எண்ணத்தக்க அருந்தமிழறிஞர்.
16,தமிழ் இலக்கண இலக்கிய மரபைக் காத்து வரும் மரபு வழி அறிஞர்.
17,மொழிநூல் கதிரவன் பாவாணரின் வேர்ச்சொல் ஆய்வில் அவர் காட்டிய வழியில் தம் தமிழாய்வைத் தொடர்பவர்.
18,தமிழர் இல்லம்தோறும் இருக்கத்தக்க இவ்வருந்தமிழ்ச் செல்வங்களைத் தமிழ் இளம் தலைமுறைக்கு வைப்பாகக் கொடுத்துள்ளோம்.
19,ஒண்டமிழ்த்தாய் சிலம்படியின் முன்னேற்றம் ஒவ்வொன்றும் உன்முன் னேற்றம்!
20,...............
21,இதுதான்நீ செயத்தக்க எப்பணிக்கும் முதற்பணியாம் எழுக நன்றே.
22,எனும் பாவேந்தரின் தமிழியக்க உணர்வுகளை நெஞ்சில் ஏந்தி வாழ முற்படுவோம்.
23,பதிப்பாளர்.
24,பெறும் பேறு வளம் எங்கே இருக்கிறது?
25,வளம் எங்கேயும் இருக்கிறது!
26,அஃது இல்லாத இடமே இல்லை!
27,வளம் எங்கும் இருப்பதை எப்படி அறியலாம்?
28,"வளத்தைத் தேடும் உளம் இருந்தால், வளம் எங்கேயும் இருப்பதை அறியலாம்?"
29,வளத்தின் அளவு என்ன?
30,வளத்தின் அளவும் உளத்தின் அளவேயாம்!
31,"உளத்தில் வளம் இல்லையானால், உள்ள வளமும் உடையவனுக்கும் உதவாது ஊருக்கும் உலகுக்கும் உதவாது!"
32,வளத்தைத் தரும் உளத்தை ஒருவர் வாய்க்கப் பெற்றால் போதும்!
33,அவ்வளம் குன்றியளவானால் என்ன?
34,குன்றத்தனைய வளமானால் என்ன?
35,தினை அளவானால் என்ன?
36,பனை அளவானால் என்ன?
37,வளம் வளமே!
38,தேனீ வளம்?
39,"தினைத்தனை அளவுப் பூவில், தேனீ கொள்ளும் தேன் எவ்வளவு இருக்கும்?"
40,கோத்தும்பி கொணரும் தேன் வளம் எவ்வளவு இருக்கும்?
41,"கோத்தும்பி கொணர்வதே வளம், தேனீ கொணர்வது வளமில்லை என எவராவது கூறுவாரா?"
42,வளம் வளமே!
43,"அவரவர் உழைப்பு, அறிவுத்திறம், உண்மையறிவு, பட்டறிவு, காலஇடசூழல் கொடை ஆகியவற்றைப் பொறுத்தது அது."
44,பொருள் மட்டுமா வளம்?
45,புலமை வளமில்லையா?
46,ஊக்குதல் உதவுதல் உறுதுணையாதல் ஒன்றுதல் ஆயவை வளமில்லையா?
47,எல்லாம் வளமே!
48,மல்லல் வளனே என்பது தொல்காப்பியம்.
49,உரி. உடலாலும் வளம் உழைப்பாலும் வளம் உணர்வாலும் வளம் உரையாலும் வளம் வளம் பட வாழ வேண்டாதார் எவர்?
50,வளம் பெற வேண்டாதார் எவர்?
51,வளந்தலை மயங்கிய வஞ்சி முற்றம் என்பது சிலம்பு!
52,"வளத்தின் அளவு, அளந்து கடை அறியாவளம் என்பது நாடென்ப நாடா வளத்தன என்பது நாட்டின் இலக்கணம்!"
53,"எளிமை, இனிமை, இறைமை, நிறைமை என மக்கள் வாழ்ந்த நாள் இலக்கணம்!"
54,"இன்றோ, நானில வளங்களையும் நாடா நாடில்லை!"
55,எந்த நாடு ஏற்றுமதி செய்யவில்லை?
56,எந்த நாடு இறக்குமதி செய்யவில்லை?
57,"பாலைவளத்தை நாடிச்சோலை நிற்றல் வெளிப்படை என்றால், சொல்வானேன்?"
58,நாடாவளத்தில் குப்பைக்கீரை சேராதா?
59,குறுந்தூறு சேராதா?
60,வளத்தை வழங்குதல் தான் பிறவிக் கடனே யன்றி அளவிடும் பொறுப்பு வழங்குவார்க்கு இல்லை!
61,பெறுவார் பொறுப்பு.
62,பெற்றவர் வழியாகக் கருவிலே பெற்ற திரு என்ன!
63,கற்ற கல்வியால் பெற்ற வளம் என்ன!
64,பட்டறிவால் ஆழ்மன ஆய்வால் தேடிக் கொண்ட வளங்கள் என்ன என்ன!
65,"கூற்றையும் ஆடல் கொள்ளும் கொள்கை இதுவென உணர்வார் ஓயார், ஒழியார் சாயார் சரிந்தும் போகார்!"
66,"என் இளந்தைப் பருவமே, ஆசிரியப் பருவமாகிவிட்டது."
67,அக்காலச் சூழல் அது.
68,மூன்றாண்டு ஆசிரியப் பணி செய்தால் போதும்!
69,புலவர் தேர்வைத் தனியாக எழுதலாம் என்னும் வாய்ப்பு!
70,"உயர்பள்ளி, மேல்பள்ளி என்பவற்றிலும் பல்கலைக் கழகத் தமிழியல் ஆய்வுக் களத்திலுமாக ஏறத்தாழ ஆண்டுகள் தமிழ்வாழ்வாக வாழ வாய்த்தது."
71,"தமிழ்த்தொண்டும், தமிழ்நெறித் தொண்டும் என்றும் விடுதல் அறியா விருப்பொடு செய்து கொண்டிருத்தலே இயற்கையோடு இயைந்த வாழ்வாகி விட்டது!"
72,"புலமைத் தேர்வுக்குரிய பாடத்தளவிலோ, நூல்களின் அளவிலோ என் கல்வி நின்றது இல்லை!"
73,தொல்காப்பியம் முதல் இற்றைநாள் நூல்கள் வரை இயன்ற அளவால் தமிழ்வளம் பெறுதலை நோன்பாகக் கொண்டு கற்கும் பேறுபெற்றேன்.
74,"இளந்தைப் பருவத்திலேயே பாவேந்தர், ஓகி சுத்தானந்த பாரதியார், கவிமணியார், கவிராச பண்டித செகவீர பாண்டியனார், அறிஞர் மு.வ."
75,ஆயோர் அரிய காட்சியும் சின்முறைச் சந்திப்புகளும் என்னுள் பசுமை நல்கின.
76,"தமிழ்ப் பொழிவுகளும், ஆய்வுக் கட்டுரைகளும், குடும்பச் சடங்குகளும் என் மீட்டெடுப்புப் பணிகள் ஆயின!"
77,எம் குடும்பக் கடமைகள் எம் பணியையோ தொண்டையோ கவர்ந்து கொள்ளா வகையில் இனிய துணையும் மக்களும் அமைந்தனர்.
78,"அதனால், காலமெல்லாம் கற்கவும் கற்பிக்கவும் நூல் படைக்கவும் வாய்த்த வாய்ப்புப் பெரிதாயிற்று."
79,"செந்தமிழ், செந்தமிழ்ச் செல்வி, தமிழ்ப்பாவை, குறள் நெறி, குறளியம், மலர்கள், ஆய்வரங்கங்கள் எனக் கட்டுரைகள் பெருகின."
80,அச்சுக்கு வாராதவையும் ஆகின!
81,இவை என்றும் ஒருமுகமாய்க் கிடைக்க வாய்ப்பில்லை.
82,எம் நூல்கள் எம்மிடமே முப்பதுக்குமேல் இல்லாமல் மறைந்தன.
83,எழுதியன எல்லாவற்றையும் ஒருமுகமாகப் பெறப் பலர் அவாவினார்.
84,தவத்திரு ஆத்துமானந்த அடிகளார் ஆருயிர்க்கு அன்பர் அதில் தலைப்பட்டு நின்றார்.
85,ஆயர் ஆண்டகை சூசைமாணிக்கனார் சுடரேற்றினார்.
86,பாரதிதாசன் பல்கலைக்கழகம் மதிப்புறு முதுமுனைவர் பட்டம் வழங்கியது.
87,"அதற்கு மகிழ்வுற்ற வகையால் பாவாணர் தமிழியக்கம் முதலாம் அமைப்புகளும், முனைவர் திருமாறனார் முதலாம் ஆர்வலர்களும் விழா ஒன்று எடுத்தனர்."
88,அவ்விழாத் தலைமையைத் திருத்தகு துணைவேந்தர் பொன்னவைக்கோ ஏற்றார்.
89,தவத்திரு ஆத்துமானந்த அடிகளார் வாழ்த்துரைத்தார்.
90,தமிழாக்கப் பதிப்பே வாழ்வாக ஒன்றிய இளவழகனார் முழுதுற அச்சிட ஒப்பினார்.
91,அடிகளார் வெளியீட்டுப் பொறுப்பு ஏற்பதாகக் கூறினார்.
92,"அவ்வகையில் வாய்ப்பதே, இளங்குமரனார் தமிழ்வளம் என்னும் இத் தொகை நூல்களாம்!"
93,"இத் தொகையில் விடுபடும் நூல்கள் கட்டுரைகள், பாடல்கள் பல்லபல."
94,தொகுக்க வாய்க்கா வகையில் கிட்டாவகையில் மறப்பு வகையில் விடுபாடுடையவை உள.
95,எனினும் தொண்ணுறு விழுக்காடேனும் ஒரு முகமாகப் பெறும் பேறு வாய்க்கின்றது என்பது மகிழ்வூட்டுவதாம்!
96,மக்கள் வாழ்வு வளர்நிலையது!
97,நூல்களும் வளர் நிலையவை!
98,ஆதலால் ஒருவாழ்வுக் கொடை மட்டுமன்று ஈது ஒருவாழ்வு பெறத் தக்க பல்பருவக் கொடையுமாம் எனல் சாலும்!
99,இவ்வளத்தை முழுதுற எண்ணின் ஒன்று உறுதியாக வெளிப்படும்.
100,நலவாழ்வு நல்வாழ்வு கருதாத இயற்கை இறைமைப் பொதுமை கருதாத எப்படைப்பும் எம்படைப்பில் இரா என்பதேயாம்.
101,இவற்றைப் பயில்வார் பெறும் பேறும் அதுவாக அமையின் அப்பேறே யாம் பெறும் பேறாம்.
102,இவ்வளம் வெளிவர விரும்பினோர் உழைத்தோர் உதவினோர் ஆய அனைவர்க்கும் நன்றிக் கடப்பாடுடையேன்!
103,வாழிய நலனே!
104,வாழிய நிலனே!
105,உலகு இயற்றியான் .
106,பொறியின்மை .
107,சுடச்சுடரும் .
108,தம் பொருள் .
109,முதல் இழப்பு .
110,வள்ளியப் பெருமிதம் .
111,ஊக்கம் உடையார் .
112,இனநலப் பேறு .
113,அறம் சாரா நல்குரவு .
114,பகை நட்பு .
115,வளரும் பயிர் .
116,பயிர் மேய் வேலி .
117,எள்ளாதன செய்தல் .
118,பொருள் போற்றல் .
119,மக்கட்கு இறை .
120,இன்பமும் துன்பமும் .
121,தம் இல் .
122,அறிதோறறியாமை .
123,எவன் தொண்டன் .
124,பயனெதிர் பாராமையும் பயனே .
125,பற்றறுத்தலும் பற்றே .
126,பண்பாட்டின் மூலக்கூறும் வளர்ச்சியும் .
127,ஒரு தீர்மானம் .
128,எல்லாப் பொருளும் இதன்பால் உள.
129,.
130,எல்லாரும் இதற்கு உரியர் .
131,வாளும் கேளும் .
132,அறிவும் அழிவும் .
133,கேட்டதும் கிடைத்ததும் .
134,உய்வு தரும் ஒளிநூல் .
135,திருக்குறளின் முதல் உரையாசிரியர் .
136,திருக்குறட்படி படி .
137,இறை முறை .
138,ஊழிற் பெருவலி யாவுள?
139,.
140,ஈகிதியாகியர் தேவை!
141,திருக்குறள் நோக்கு .
142,பொது விளக்கம் .
143,இறை நிலை .
144,உயிர் தளிர்த்தல் .
145,அறம் .
146,உடல் நலம் .
147,வீடும் உலகும் .
148,வேள்வி .
149,தற்காவல் .
150,துணை நலம் .
151,எச்சம் .
152,பிறப்பொப்பு .
153,தொழிலொப்பு .
154,பொருட் பயன் .
155,முயற்சிச் சிறப்பு .
156,ஊழ் .
157,வினை .
158,காலமறிதல் .
159,மதுவிலக்கு .
160,சூதொழிப்பு .
161,குறை நீக்கும் குடிமை .
162,இருவரும் ஒருவர் .
163,வாழ்த்துதல் பண்பு .
164,அறிதோ றறியாமை .
165,இணைப்பொறுப்பு .
166,உலக நல வாழ்வு திருக்குறளில் ஒப்புரிமை .
167,ஒத்தது அறிதல் .
168,பிறப்பு ஒப்பு .
169,சிறப்பு ஒப்பு .
170,கல்வி ஒப்பு .
171,கல்விப் பயன் ஒப்பு .
172,செல்வ ஒப்பு .
173,ஈகை ஒப்பு .
174,அச்ச ஒப்பு .
175,நாண ஒப்பு .
176,சமய ஒப்பு .
177,ஒத்தது அறிவான் உயிர் வாழ்வான்!
178,தரக்கட்டுப்பாடும் திருக்குறளும் .
179,திருக்குறளில் தொழில் தரமும் உறவும் .
180,திருக்குறளில் தொழில் தரம் .
181,உலகவர் அனைவரும் நலமுற வாழவேண்டும் என்னும் நோக்கிலே அருளப்பட்டது வள்ளுவம் ஆகும்.
182,"வள்ளுவத்தைத் கற்பார் தமக்கும், அதற்கும் உள்ள வாழ்வியல் தொடர்பை இனிது அறிவர்."
183,"மேலும், எவ்வாறு வாழ்வியலை அமைத்துக் கொள்ளக் கூடும் என்பதைச் சிந்திக்கவும் தூண்டல் ஏற்படும்."
184,"நல்ல தூண்டலின் பயன், அரிய துலங்கலேயாம்."
185,"அவ்வகை யில் வாழ்வொடும், வரலாற்றொடும் கைகோர்த்து நடையிடும் இச்சுவடி கட்டுரைகளையுடைது."
186,சுட்டிக்காட்டும் அளவில் ஏறத்தாழ நாற்பதின்மர்க்கு மேலும் உலகளாவிய பார்வையில் பெருமக்கள் இடம் பெற்றுள்ளனர்.
187,மேற்கோள் காட்டப்பட்ட அவர்களும் மேற்கோளாம் வள்ளுவமும் பலர் வாழ்வில் மேற்கொண்டொழுகச் செய்ய வல்லன என்னும் ஆர்வத்தால் வெளிப்படுவது இச்சுவடி.
188,குறளியத்தில் தொடர்ந்து எழுதப்பட்ட இக்கட்டுரைகள் நூலுருப் பெற்றுப் பயனாற்ற உதவும் பெருமகனார் தவத்திரு.
189,ஆத்மானந்த அடிகள் ஆவர்.
190,தாயுமானம் என்பவற்றின்மேல் அளப்பரும் பற்றாளர்.
191,"திருவள்ளுவர் தவச்சாலைப் புரவலரும், அறங்காவலரும் ஆவர்."
192,அவர்தம் கொடைமையே இச்சுவடியாய்த் தமிழ் வளமாகத் திகழ்கின்றது.
193,அடிகளார் அவர்களின் நயனார்ந்த பயன் கொடைக்கு நனிமிகு நன்றியன் இன்பமே சூழ்க வாழிய வையகம்!
194,"அன்புடன், இரா.இளங்குமரன் ."
195,"உலகு இயற்றியான் திருக்குறளின் பிழிவு, தமக்கென வாழாமை பிறர்க்கென வாழ்தல் என்பவை."
196,"இத்தன்மைகளை ஒருவர் கொள்வதற்கு முதல் நிலை, அன்பு!"
197,முடி நிலை அருள்!
198,"அன்பு, இல்லறம் வாழ்வியற் பயிற்சியின் தொடக்கமும் வளர்ச்சியுமாம் நிலை!"
199,"அருள், துறவுநிலை குடி நலன் காத்து, அதன்மேல் குமுகாய நலனாகவும், முழுதுலகு நலனாகவும்."
200,உயிரிகள் அனைத்தும் உய்யும் ஒருபெரு நெறியாகவும் உள்ளி நிறை நிலை!
201,உயிர் நின்ற உடம்பு என்பதன் பண்பியல் அடையாளம்.
202,"அன்பு, ஆகலின், அன்பின் வழியது உயிர்நிலை என்பது திருக்குறள்."
203,அன்பு சிறக்கும் உடலமே உயிர்நிலை!
204,அன்புடையார்க்கு அமைந்த அளவு கோல் பிறர் நலம் நாடல் அன்பிலார்க்கு அமைந்த அளவுகோள் தந்நலத்திலேயே அடங்கல்!
205,உடலையே வழங்கும் அவர் மற்றைப் பொருள் களை வழங்கத் தயங்குவரோ?
206,"அடுக்கிய கோடி சொத்து உடையாராயினும், உம் உயிர் வேண்டுமா?"
207,உடைமை வேண்டுமா?
208,"என்னும் ஓர் இடர் நேருங்கால், உடைமையை விடுத்தேனும் உயிரைக் காத்துக் கொள்ளவே விரும்புதல் கண் கூடு!"
209,உயிரைக் காத்தல் என்பது என்ன?
210,உடலைப் போற்றுதல் தானே!
211,"உடல்போனால், உயிருக்கு வடிவு ஏது?"
212,வடிவு உண்டானால்.....
213,அதன் பெயர் என்ன?
214,என்பு என்பது எலும்பு என்பும் வழங்கும் அன்பர் என்பானேன்?
215,என்பே மாந்தர் நிமிர்ந்து நடக்க நிமிர்ந்து வாழ அமைந்த கருவி!
216,குனிந்து நடக்கவும் குறுக்கே இயங்கவும் வேண்டாமல் நிமிர்வைத் தருவது என்பே!
