Line Number,Sentence
1045,இயற்சொல் திரிசொல் திசைச்சொல் வடசொல் என்று அனைத்தே செய்யுள் ஈட்டச் சொல்லே என்பார் தொல்காப்பியர்.,False
1046,இவற்றிலுள்ள சொற்கள் எவ்வகையான மாறுபாடும் இல்லாமல் இயல்பாக இருப்பவை.,False
1047,இவ்வாறு இயல்பாக எளிதல் பொருளை விளக்கும் சொற்கள் இயற் சொற்கள் எனப்படும்.,False
1048,தமிழ் நாட்டில் மக்கள் பேச்சுவழக்கில் உள்ள தூய சொற்களே இயற் சொற்களாகும்.,False
1049,"இச்சொற்களால் அமைந்த மொழி பாமரர்க்கும், பண்டிதர்க்கும், யாவர்க்கும் எளிதல் விளங்குவதாகும்.",False
1050,ஆதலின் இந்நால் வகையுள் இன்றியமையாத சிறப்பு வாய்ந்தது இயற்சொல்லே என்பதில் ஐயமில்லை.,False
1051,இயற்சொல் தாமே செந்தமிழ் நிலத்து வழக்கொடு சிவணித் தம்பொருள் வாழாமை இசைக்கும் சொல்லே என்பது தொல்காப்பியம்.,False
1052,"இத்தகைய இயற்சொற்களால் இயன்ற செய்யுள் நூல்களும், உரைநடை நூல்களும் அனைவரும் அறிந்து இன்புறத் தக்கனவாகும்.",False
1053,"பண்டைச் சங்கச் சான்றோர் சிலர்தம் பாடல்களும், ஔவையார் முதலான இடைக்காலப் புலவர்தம் பாடல்களும், ஆறுமுக நாவலர், திரு வி.",False
1054,"க, டாக்டர்.",False
1055,"முதலான பிற்காலப் புலவர்தம் உரைநடைகளும் இத்தகைய இனிய, தூய, எளிய இயற் சொற்களால் இயன்றவையாகும்.",False
1056,இவை கற்போர் மனங்கவர்ந்து களிப்பூட்டும் இயல்பு வாய்ந்தவையாகும்.,False
1057,என்னும் ஔவையாரது இயற்றமிழ்ப் பாடலின் எளிமையும் இனிமையும் நயமும் அறந்து இன்புறத் தக்கவையாகும்.,False
1058,யானை வந்தது என்றால் பொருள் எளிதில் விளங்குகின்றது.,False
1059,இதனையே வாரணம் போந்தது என்றால் எளிதல் விளங்குகின்றதா?,False
1060,இவை பண்டிதர்க்கு விளங்குமேயன்றிப் பாமரர்க்கு விளங்கா.,False
1061,"இவ்வாறு படித்தவர்க்கு மட்டும் விளங்கும்படி அமைந்துள்ள திரிபுடைய, மாறுபாடான, மயக்கம் தரும் தமிழ்ச்சொற்கள் திரிசொற்கள் எனப்படும்.",False
1062,இவை பேச்சு வழக்கில் இல்லாதவை புலவர்தம் செய்யுள் வழக்கிலேயே வருபவை பண்டிதர்க்கு மட்டும் விளங்குபவை பாமரர்க்கு விளங்காதவை.,False
1063,அவன் தாயாரும் தமிழ்ப்புலமை மிகுந்தவராக இருந்தால் அல்லவா இத்திரிசொல் வழக்குப் பயன்படும்?,False
1064,இத்தகைய பாடல்களையும் பாமரரேயன்றிப் பொருள் உணர்வு நிறைந்த அறிஞரும் வெறுத்தொதுக்குவர்.,False
1065,இயற் சொற்களைப்போலவே திரி சொற்களும் தூய தமிழ்ச் சொற்களேயாயினும் அவற்றைக் கூடியவரையில் குறைத்துப் பயன்படுத்தலே மிகவும் சிறப்புடையதாகும்.,False
1066,இந்த அநாகரிகம் வடமொழிக் கலப்பின் விளைவேயாகும்.,False
1067,"ஜலம், சாதம், நமகாரம் முதலானவை தமிழில் கலந்துவிட்ட வடசொற்கள்.",False
1068,வடமொழியை மட்டுமாகைய ண்டனர்!,False
1069,வந்த எந்தப் பிற மொழியையும் கையாண்டனர்.,False
1070,ஐயர் என்ற சொல் தமிழ் உலகில் டாக்டர் உ.,False
1071,சம்கிருதச் சொற்கள் சம்கிருதத்திற்கே உரிய எழுத்தொலி யால் வழங்கப்படாமல் தமிழுக்கும் சம்கிருதத்திற்கும் பொதுவான எழுத்தொலியால் வழங்கப்பட்டன.,False
1072,வடசொற் கிளவி வடவெழுத் தொரீஇ எழுத்தொடு புணர்ந்த சொல்லா கும்மே என்பர் தொல்காப்பியர்.,False
1073,தொல்காப்பியர் ஏறத்தாழக் கி.,False
1074,மூன்றாம் நூற்றாண்டினர் என்று கூறலாம்.,False
1075,அவர் காலத்தில் தமிழ்நாடு பன்னிரண்டு நிலப்பகுதிகளாகப் பிரிந்திருந்தது.,False
1076,"அவை தென்பாண்டிநாடு, குட்டநாடு.",False
1077,"குடநாடு, கற்காநாடு, வேணாடு, பூமிநாடு, பன்றி நாடு, அருவாநாடு, அருவா வடதலைநாடு, சீதநாடு, மலாடு, புனல்நாடு என்பவை.",False
1078,பன்னிரு நாட்டினுள்ளும் ஒவ்வொரு நாட்டிற்கும் உரியனவாகச் சில சில சொற்கள் வழங்கி வந்தன.,False
1079,பிற எல்லாச் சொற்களும் செந்தமிழ் நாடு முழுமைக்கும் பொதுவான செந்தமிழ்ச் சொற்களாக இருந்தன.,False
1080,ஒவ்வொரு நாட்டிலும் அதற்கே உரியனவாக வழங்கிவந்த சொற்கள் அவ்வந்நாட்டுப் புலவரால் செய்யுட்களில் சேர்க்கப்படுதல் இயல்பேயன்றோ!,False
1081,பசு என்பது செந்தமிழ்நாட்டுப் பொதுச்சொல்.,False
1082,இது தமிழ் நாட்டின் பன்னிரு பகுதியிலும் வழங்குவது.,False
1083,ஆனால் தமிழ் நாட்டின் ஒரு பகுதியான தென்பாண்டி நாட்டில் வாழ்வார் பசுவைப் பெற்றம் என்று வழங்கினர்.,False
1084,இப்படியே தாயைத் தள்ளை என்று குட்டநாட்டார் வழங்கினர்.,False
1085,தந்தையை அச்சன் என்றனர் குடநாட்டார்.,False
1086,வஞ்சரைக் கையர் என்பது கற்கா நாட்டு வழக்கம்.,False
1087,வேணாட்டார் தோட்டத்தைக் கிழார் என வழங்கினார்.,False
1088,சிறு குளத்தைப் பாழி என்பர் பூழி நாட்டார்.,False
1089,வயலைச் செய் என்பது பன்றிநாட்டு வழக்கு.,False
1090,அருவா நாட்டார் சிறு குளத்தைக் கேணி என்று வழங்கினர்.,False
1091,புளியை எகின் என வழங்கினர் அருவா வடதலை நாட்டார்.,False
1092,தோழனை எலுவன் என்றும் தோழியை இகுளை என்றும் சீதநாட்டார் வழங்கினர்.,False
1093,மலைநாட்டார் நல்லநீரை வெள்ளம் என்றனர்.,False
1094,தாயை ஆய் என்பது புனல்நாட்டு வழக்கு.,False
1095,அவ்வந்நாட்டுக்கேயுரிய இச்சிறப்புச் சொற்கள் அவ்வந்நாட்டுப் புலவர் பாடிய செய்யுட்களில் இடம் பெற்றன.,False
1096,செந்தமிழ் நிலஞ்சேர் பன்னிரு நிலத்தும் தம்குறிப் பினவே திசைச்சொல் என்ப என்பது தொல்காப்பியம்.,False
1097,செந்தமிழ் சேர்ந்த பன்னிரு நிலம் என்பது செந்தமிழ் வழங்கும் தமிழ்நாட்டுப் பகுதி பன்னிரண்டனையும் குறிப்பதாகும்.,False
1098,தொல்காப்பியர்க்கு ஏறத்தாழ ஆண்டுகட்குப் பின்னர் வந்த சேனாவரையர் முதலியோர் தொல்காப்பியத்திற்கு உரை வகுத்தனர்.,False
1099,"அவர்கள் இச்சூத்திரத்திற்கு, செந்தமிழ்நாடு என ஒன்று தனியாகக் கொண்டு அதனைச் சேர்ந்த நிலங்கள் என்று பொருள் கொண்டனர்.",False
1100,ஆதலின் இங்ஙனம் பொருள் கொள்ளுதல் பொருத்தமாக இல்லை.,False
1101,தொல்காப்பியர்க்குப் பின் கடைச்சங்ககாலம் தோன்றி மறைந்நது.,False
1102,அதன் பின் கி.,False
1103,வரையில் பல்லவர் தமிழகத்தின் பெரும் பகுதியை ஆண்டனர்.,False
1104,"அக்காலத்தில் தமிழகத்திற்கு அப்பால் உள்ள ஆந்திரம், கன்னடம், துளுவம் முதலிய பல நாடுகளிலிருந்து மக்கள் தமிழகத்திற் குடியேறினர்.",False
1105,"இக்குடியேற்றத்தோடு தமிழகம், இலங்கை, சீனம் முதலிய பல நாடுகளுடன் வாணிகத் தொடர்பும் கொண்டது.",False
1106,பல்லவர்க்குப் பின் தமிழகத்தை ஒரு குடைக்கீழ் ஆண்ட சோழப் பேரரசர்கள் கிருஷ்ணையாறு வரைத் தங்கள் ஆட்சியைச் செலுத்தினர்.,False
1107,அதற்கு அப்பால் இருந்த நாடுகளிலும் அவர்தம் செல்வாக்குப் பரவியது.,False
1108,கிழக்கிந்தியத் தீவுகளிலும் தமிழ் வணிகர் குடியேறி வாணிகம் செய்தனர்.,False
1109,சீனம் முதலிய கடல் கடந்த நாடுகளும் வடஇந்திய நாடுகளும் தமிழகத்தோடு வாணிக உறவு கொணடிருந்தன.,False
1110,"இங்ஙனம் ஏற்பட்ட வாணிக உறவினாலும், அரசியல் உறவினாலும், பண்பாட்டு உறவினாலும் பல நாட்டுச் சொற்கள் தமிழில் இடம் பெற்றன்.",False
1111,மாமரத்தைக் கொக்கு என்பது துளுவநாட்டிலிருந்து வந்து வழங்கும் திசைச் சொல்.,False
1112,அகப்படுத்தலைச் சிக்குதல் என்பர் கன்டை நாட்டார்.,False
1113,ஐயோ என்பதை அந்தோ என்பர் சிங்கள நாட்டார்.,False
1114,அங்கே என்பதை அக்கட என்பர் தெலுங்கு நாட்டார்.,False
1115,இத்தகைய சொற்கள் இலக்கியங்களிலும் பின்னர் வழங்கின.,False
1116,வேட்டையில் ஒரு கொக்குப்பட்டது குற்றாலக்குறவஞ்சி.,False
1117,யானுனைத் தொடர்ந்து சிக்கெனப் பிடித்தேன் திருவாசகம்.,False
1118,அக்கட இராவணற் கமைந்த ஆற்றலே கம்பராமாயணம்.,False
1119,நன்னூலாருக்குப் பிறகு இந்நாட்டில் முலிம் படையெடுப்பும் ஆட்சியும் உண்டாயின.,False
1120,தமிழ் மக்களில் சிலர் இசுலாம் மதத்தைத் தழுவினர்.,False
1121,"முலிம்கள் பயன்படுத்திவந்த அராபியச் சொற்கள், பாரசீகச் சொற்கள், உருதுச் சொற்கள், இந்துதானிச் சொற்கள் பலவாகும்.",False
1122,அவற்றுள் சில தமிழில் வழக்குப் பெற்றன.,False
1123,"ஜமீன், சிபாரிசு, சிப்பந்தி, சிப்பாய், சுமார், பக்கிரி, மேஜை முதலியன உருதுச் சொற்கள்.",False
1124,இவற்றுள் சில இலக்கியங்களிலும் ஏறின.,False
1125,விஞ்சையர் மாகர் சபாசு என திருப்புகழ் குறமகட்குச் சலாம் இடற்கு ஏக்கலுகுமரன்.,False
1126,முத்துக்குமாரசாமிப் பிள்ளைத் தமிழ்.,False
1127,"முலிம்களுக்குப் பிறகு போர்த்துகேசியர், பிரெஞ்சுக்காரர், ஆங்கிலேயர் முதலான ஐரோப்பியர்கள் இந்நாட்டில் குடியேறினர்.",False
1128,அவர்களால் தமிழிற் புகுந்த ஐரோப்பிய மொழிச் சொற்கள் சில உண்டு.,False
1129,"அலமாரி, சன்னல், சாவி, பாதிரி, முதலியன போர்த்துக்கீசியச் சொற்கள்.",False
1130,"ஆவுகா, ஒப்பித்தால் .",False
1131,முதலியன பிரெஞ்சுச் சொற்கள்.,False
1132,"சீக்கு, கோர்ட்டு, பீ, பென்ஸில், டிக்கட், ஆபீசு முதலியன ஆங்கிலச் சொற்கள்.",False
1133,முடிவுரை இன்றைய தமிழ்மக்கள் பேச்சுவழக்கில் மேலே சொல்லப்பட்ட பலநாட்டுச் சொற்களும் இருக்கின்றன.,False
1134,"இவை தமிழ்ச் சொற்களா, பிறமொழிச் சொற்களா என்று தெரிந்துகொள்ள இயலாத நிலையில் தமிழில் கலந்து விட்டன.",False
1135,வளரும் ஒரு மொழியில் இவ்வாறு பலநாட்டு மக்கள் கூட்டுறவால் பிறமொழிச் சொற்கள் வந்து கலத்தல் இயல்பேயாகும்.,False
1136,இயற்கைக் காட்சி உலகமக்களின் உயிர்வாழ்க்கை பலபல காட்சிகள் மலிந்த ஒரு நாடகமாகும் என்பது செகப்பிரியர் போன்ற பெரும்புலவர்கள்களின் துணிபாகும்.,False
1137,கடவுள் நெறிமேற்கொண்டு துறவுள்ளத்துடன் வாழும் அடியார்களும் இக்கருத்தினரேயாவர்.,False
1138,மக்கள் வாழ்வாகிய நாடகம் நிகழுதற்கு இயற்கை என்னும் மேடை இன்றியமையாததாகும்.,False
1139,"இயற்கை ஆற்றல் என்னும் துணையின்றி மக்கள் வாழ்வு சிறவாது, நம் பண்டைத்தமிழ்ப் புலவர்கள் இவ்வுண்மையை நன்குணர்ந்தவர்கள்.",False
1140,இயற்கையின் எழிலையும் ஆற்றலையும் ஏனைய பண்புகளையும் கூர்ந்து நோக்கித் தேர்ந்துரைத்தனவே இலக்கியங்கள் எனப்பெற்றன.,False
1141,இன்று அறிவியல் வல்லுநர்கள் இயற்கையின் ஆற்றலைத் தேர்ந்துணர்ந்து மக்களின் புறவாழ்வு இன்பம் எய்தற்குரிய பலபல வழிவகைகளைக் கண்டனர்.,False
1142,அவைகளே இன்று நாம் பெற்றிருக்கும் விஞ்ஞானச் சாதனங்களாகும்.,False
1143,அவையே நாம் இன்று பெற்றிருக்கும் தேனினுமினிய செந்தமிழ் இலக்கியங்களாகும்.,False
1144,விஞ்ஞானம் புறவாழ்வைச் செம்மைப்படுத்தும் உடல் வாழ்வதற்கு வேண்டிய இன்பத்தை அளிக்கும்.,False
1145,இலக்கியம் அகவாழ்வைச் செம்மைப்படுத்தும் உள்ளம் வாழ்வதற்கு வேண்டிய இன்பத்தை அளிக்கும்.,False
1146,இயற்கையின் அழகாற்றல்களை நுனித்தறியும் பண்பு மிக்க பண்டைப் பெரும் புலவர்களில் கபிலர் தலைசிறந்தவராவர்.,False
1147,"தமிழ் நாட்டு அந்தணர்குடியிற் பிறந்த இவர், தமிழ்ப் புலமை நிறைந்தவராய் விளங்கினார்.",False
1148,பாரி என்னும் தமிழ்ப்பெரு வள்ளலின் அவைக்களப் புலவராய் இலங்கினார்.,False
1149,பாரியும் கபிலரும் சிறந்த நண்பர்களாய் வாழ்ந்தனர்.,False
1150,கபிலர் பாரியைத் தம் உயிர் நண்பராகக் கொண்டமைக்குக் காரணம் ஒன்றுண்டு.,False
1151,இயற்கையில் தோய்ந்திடும் பாரியின் உள்ளப் பண்பே அக்காரணமாகும்.,False
1152,ஓரறிவுடைய இயற்கைப் பொருள்களாகிய மரஞ் செடி கொடிகள்பாலும் பாரி வள்ளல் கொண்ட உள்ள உருக்கமே கபிலரை அவனுக்கு நண்பராக்கியது.,False
1153,பாரி மறைந்த பின்பும் அவனது இப்பண்பு கபிலர் மனத்தை விட்டு அகலவில்லை.,False
1154,"பாரியின் பறம்பு, முல்லையும் குறிஞ்சியும் நல்லியல் பழியாது திகழும் பெருமலையாகும்.",False
1155,இம்மலை மீதுள்ள இயற்கை எழில் அனைத்தையும் பருகியவர் கபிலர்.,False
1156,"அவரறியாத விலங்கில்லை, மரமில்லை, பூவில்லை.",False
1157,குறிஞ்சிப் பாட்டில் அவர் கூறும் பூவகைகள் மரநூல் வல்லாரும் வியப்புறும் தன்மையின.,False
1158,செங்காந்தட் பூ முதல் மலையெருக்கம் பூ முடியத் தொண்ணுற் றொன்பது பூக்களைக் கபிலர் ஒரு சேரக் கூறியுள்ளார்.,False
1159,"அப் பூக்களின் இயல்புகளைக் கபிலர் நன்கறிந்தவர் என்பது, அப்பூக்களுக்கு அவர்தரும் அடை மொழிகளே அறிவிக்கும்.",False
1160,என்பன அவற்றுள் சிலவாகும்.,False
1161,சில மலர்களின் வடிவங்களைத் தக்க உவமைகளால் விளக்குகின்றார் கபிலர்.,False
1162,முல்லையரும்பு வெருகுப் பூனைக் குட்டியின் முள்ளெயிறு போல் இருக்கும்.,False
1163,மூங்கில் முளை புள்ளிமான் கன்றின் செவிபோல் விளங்கும்.,False
1164,தெறுழம்பூ யானை முகத்தில் உள்ள புள்ளிகள் போல மலரும்.,False
1165,"கபிலர்தம் மரநூலறிவும், விலங்கு நூலறிவும் இவ்வுவமைகளால் புலப்படும்.",False
1166,புலவர்கள் இயற்கையில் காணும் காட்சிகள் பலப்பலவாகும்.,False
1167,கேட்கும் இன்னியம் பலவாகும்.,False
