Line Number,Sentence
1604,"ஹிவற்றைத் ணிருவருள் ஆணையால் ஹிறைவன் செய்ஜீக்கின்றான் ஆகஸீன், ஆணைழீன் போக்குவரஷி புளீய என்றார் ஆஞிளீயர்.",False
1605,"ஆனால், ஜீனை, தானே ஜீனைஜிடை யானைச் சேரும் தன்மைத்தன்று.",False
1606,ஹிறையருள் கூட்டலால் சேரும் என ஜீளக்கினார் ஆஞிளீயர்.,False
1607,"செலுத்தும் ஒன்று ஹில்லை யேல், செலவென்பது ஒன்று ஹில்லையே!",False
1608,ஹியக்குவது அல்லது ஹியக்குவோன் ஹில்லையேல் ஹியக்கம் என்பது ஒன்று ஹில்லையே!,False
1609,ஆகஸீன் ஜீனையை ஹியக்கும் ணிருவருளாணையைத் தெளீஜீத்தார் ஆஞிளீயர்.,False
1610,"ஆழீன், ஹிறை வேறு ணிருவருளாணை வேறு என்று ஆகின்றதே!",False
1611,ஹிறை பிற்கும் பிலையென்ன?,False
1612,ணிருவருளாணை பிலை என்ன?,False
1613,என்று ஜீனஷிவார் உளராழீன் அவர்க்கு ஜீடை வேண்டுமே என்னுங்கருத்தால் மேலே சுட்டுகிறார் மெய்கண்டார்.,False
1614,"நீக்கம் ஹின்றி பிற்கும் ஹிறைஜிம் ஆணைஜிம், நீக்கம் ஹின்றிநிளீதல் ஹின்றிபிற்குமாம்.",False
1615,ஹிறைவனே ஆணையை நீங்காமல் பிற்பான் என்பதாம்.,False
1616,நீக்கம் ஹின்றி பிற்றல் என்பது எப்படி?,False
1617,தேன் வேறு ஹிவீமை வேறு எனப் நிளீக்க முடியாதவாறு பிற்றல் நீக்கம் ஹின்றி பிற்றலாம்.,False
1618,"செந்தாமரைப் பூஜீன் செம்மை பிறம் வேறுபடுத்த முடியாதவாறு ஒன்றிழீருத்தல், நீக்கம் ஹின்றி பிற்றலாம்.",False
1619,பண்பும் பண்புடையதும் ஒன்றாகி ஹிருப்பதுபோல் ஹிறைஜிம் ணிருவருளாணைஜிம் என்றும் ஒன்றிஜிடனாகி ஹிருத்தல் நீக்கம் ஹின்றி பிற்பதாம்.,False
1620,அன்றே அன்றே என்பதற்கு ஆமே என்பது பொருளாம்.,False
1621,அல்லையாம் என்னும் பொருள் அதற்கு ஹிங்கு ஹில்லையாம்.,False
1622,அசைபிலை என்று சொல்ஸீ அமைஜிம் பொருளும் அதற்கு ஹிங்கு ஹில்லையாம்.,False
1623,ஆமே என்னும் பொருளே அதற்கு ஹிங்குக் கொள்ளல் சால்பு!,False
1624,ஹிந்நூற்பாஜீன் பொருளருமைழீல் தோய்ந்து தோய்ந்து ஹின்புற்ற பேராஞிளீயர் ஒளவை.,False
1625,துரைசாலீப்நிள்ளை அவர்கள் ஓர் எடுத்துக்காட்டால் ஜீளக்கும் அருமை தவீப் பேளீன்பம் பயப்பதாகும்.,False
1626,மூன்றாம் நூற்பா உழீரைப் பற்றிய ஆய்ஜீலே தொல்பழந்தலீழர் ஊன்றி ஈடுபட்டிருந்தனர் என்பது தொல்காப்நியத்தால் நன்கு தெஹீவா கின்றது.,False
1627,"ஆனால், அவர் கண்டுநிடித்ததற்குப் பல்லாழீரம் ஆண்டுகளுக்கு முன்னரே தலீழறிஞர்களால் கண்டுநிடிக்கப்பட்டு நாடறிந்த செய்ணியாக ஜீளங்கியது.",False
1628,"உழீர்என்னும் பெயர், உய்ப்பது உழீர் என்னும் ஜீளக்கம் தருவதாம்.",False
1629,"உய்த்தல் என்பது செலுத்துதல், ஹியக்குதல் என்னும் பொருட்டது.",False
1630,உழீளீலா உடல் ஹியக்கமற்றது என்பதை உவரே அறியார்?,False
1631,செத்தாரைச் சாவார் சுமப்பார் என்பதை எவரே உணரார்?,False
1632,"ஹியக்கும் உழீர், உய்ஷிக்கும்கடைத்தேற்றத்ணிற்கும்வஷீகாட்டும் என்றும் முந்தையோர் கண்டிருந்தனர்.",False
1633,அவர்கள் உழீரை ஓரறிஷிழீர் முதலாக ஆறறிஷிழீர் ஹிறுணியாகப் பகுத்துக் காட்டினர்.,False
1634,"ஹிவை ஹிவை ஓரறிஷிழீர், ஹிவை ஹிவை ஈரறிஷிழீர் என்றும் பிலைப்படுத்ணிழீருந்தனர்.",False
1635,"அதனால் மாஷிம் மாக்களும் ஐயறி ஜீனவே என்றும், மக்கள் தாமே ஆறறி ஷிழீரே என்றும் சுட்டினர்.",False
1636,"சுவை, ஒஹீ, ஊறு, ஓசை, நாற்றம் என்பவற்றின் வகையறிந்தார் வஷீயாகவே உலகம் ஹியல்கின்றது என்று தெஹீந்தனர்.",False
1637,ஹிவற்றைஜிம் தமக்கு முன்னே ஹிருந்த மூதறிஞர்கள் கண்டு தெஹீந்து உரைத்த தாக நேளீணின் உணர்ந்தோர் நெறிப்படுத்ணினரேஎன்றும் குறித்தனர்.,False
1638,உழீரை ஆய்ந்த பெருமக்கள் உடலைஜிம் நன்கு ஆய்ந்தனர்.,False
1639,உடல் என்னும் பெயரால் உழலுதலுக்குதுன்புக்குஹிடமானது என்றும் தேர்ந்ணிருந்தனர்.,False
1640,பிலையாமைக்கு ஹிடமாம் வாழ்வை பிலைக்கச் செய்வது நிறப்நின் பேறு ஆகஸீன் மெய் என்று பெயளீட்டது தகவேயாம்!,False
1641,"ஹிதனை, மங்கல வழக்கெனக் கொள்வார் கொள்ஹீனும், உடஸீன் மெய்ந்பிலை கண்டு வைக்கப்பெற்ற பெயரே ஈதெனக் கொள்ளல் முறையாம்.",False
1642,மன்னா உலகத்து மன்னுதல் குறித்தோர் தம்புகழ் பிறீஹித் தாம்மாய்ந் தனரே என்னும் புறப்பாட்டு ஹிதனைத் தெஹீஜீக்கும்.,False
1643,"பிலையாமை சுட்டும் ஹிலக்கண ஹிலக்கியச் செய்ணிகள் எல்லாம் நிற்காலப் போஸீத் துறவோர் கூறுவது போல, ஒப்பாளீப் பாட்டும் அன்று!",False
1644,புலம்பலும் அன்று!,False
1645,அழுகுதிச் செய்ணிஜிம் அன்று!,False
1646,அஷீஜிம் வாழ்வைக் கொண்டு அஷீயாப் பேற்றை அடைதற்கு வஸீஜிறுத் ணிக் கூறிய வாய்மொஷீகளேயாம்.,False
1647,"சாவா உடம்நினவர் என்றும், உளதாகும் சாக்காடு என்றும் மேலோர் ஆட்ஞிகள் உண்மை ஹிதனை வஸீஜிறுத்தும்.",False
1648,"ஹிவீ அந் நாஹீல் நிறர் நிறர் அறிஷி ஐந்ணின் மேல் ஹில்லை என்றாராக, ஆஞிளீயர் தொல்காப்நியனார்.",False
1649,ஆறாம் அறிஷி உண்டு என ஆய்ந்து கூறியமை அருமைப்பாடு உடையதாம்.,False
1650,"மூலநூல் அவ்வாறு கூறிஜிம், வஷீநூல் செய்த நன்னூலார் ஐயறிஷி அளஷிடன் அமைந்தது அவர்மம் சமயக் கொள்கைழீல் பின்று உரைத்ததேயாம்!",False
1651,உழீளீயல் ஆய்ஷி ஹிவ்வாறாக மெய்கண்டார் உழீர் உண்மையை வஸீஜிறுத்த மேற்கொண்ட மேற்கோளைக் காணலாம்.,False
1652,"உழீர் உண்மையை வஸீஜிறுத்துவதற்கு அவர், ஆழ்ந்து அகன்று நுணுகிச் செல்கிறார்.",False
1653,உடஸீன் தோற்றரவை உரைத்து அதன் கண் உழீர் உறைகலை ஏழு வகையாகப் பகுத்துக் காட்டித் தெஹீஜீக்கிறார்.,False
1654,"ஆன்மாஜீன் ஹிருப்நிடம் ஹிது என்றும், ஆன்மா ஹிருப்பை அறிஜிம் வகை ஹிவை என்றும் ஹிந் நூற்பாஜீல் உரைக்கிறார்.",False
1655,மாயா ஹியந்ணிர தனுஜீனுள் ஆன்மா ஆன்மா என்பது உழீர்.,False
1656,அதனை ஆதன் என்றும் கூறுவர் ஆதன் எங்கே உள்ளது?,False
1657,மாயா ஹியந்ணிர தனுஜீனுள் உள்ளது.,False
1658,"அதாவது, பொறிகஹீன் கூட்டத்தால் அமைந்த ஹிவ்ஷிடலுக்கு முதற் காரணமாக ஹிருப்பது மாயையாம்.",False
1659,"மாயைழீன் செயலால், பொறிகளைஜிடைய உடல் வாய்த்தது.",False
1660,அவ் ஷிடற்கண் ஆதன் உள்ளது என்பது ஹித் தொடளீன் பொருளாம்.,False
1661,ஹியந்ணிரம் பொறிகள் தனு உடல்.,False
1662,ஹிவ்ஷிடலே ஆன்மாவோ என ஐஜிறுவார்க்கு அல்லது கொள்கையாக உடையார்க்குஹிவ்ஷிடல் ஆன்மா அன்று உடஸீனுள் வேறாக ஆன்மா உண்டு என்றார்.,False
1663,உடற் பொறியே ஆன்மா எவீன் நிணத்ணிடத்தும் கூட உடற்பொறி உண்டன்றோ!,False
1664,உழீளீன் அறிஷி ஜீருப்பு செயல் அப் நிணத்ணில் ஹில்லையே!,False
1665,ஆதலால் பொறிகஹீன் வேறானதே ஆன்மாவாம் என்றார்.,False
1666,ஜீல்லை வளைத்து அதன் முடியைஜிம் அடியைஜிம் நாணாற் பூட்டி வைத்தாற் போன்ற அமைப்புடையது ஹிது!,False
1667,ஹிணைப்பு அழகை ஹிவீது காண்க.,False
1668,ஹிலது என்றஸீன் ஆன்மா உளது ஹில்லதற்கு ஹில்லை பெயர் என்பது பழமொஷீ.,False
1669,ஹில்லாத ஒன்றற்குப் பெயர் எப்படி ஹிருக்கமுடிஜிம்?,False
1670,பாழ் என வான் வெஹீயைக் குறிக்கின்றனர்!,False
1671,வெஹீயாக ஹிருத்தல் உண்மை யால் தானே அதற்கொரு பெயர் வைத்தனர்?,False
1672,"அவ்வாறே உழீர் என ஒருபெயர் உண்மையாக ஹிருக்கும்போது, அதனை ஹில்லை என்று எப்படிச் சொல்லலாம்?",False
1673,"ஹில்லை என்று ஒன்று சொல்லு மானால், அதனைச் சொன்னது எதுவோ, அதுவே உழீர்தானே!",False
1674,ஹில்லை என்று சொன்னதே உழீர் உள்ளது என்பதனை ஜீளக்கு கின்றது அல்லவா!,False
1675,"ஹிவ்வாறு ஹில்லை என்பாரைக் கொண்டே, உழீர் உண்டு என்பதை எடுத்த எடுப்நிலே பிலைப்படுத்ணினார் ஆஞிளீயர்.",False
1676,ஹில்லை என்று கூறுவார் உளரா?,False
1677,அதனால் அவர்க்கு மறுமொஷீயாக ஹிலது என்றஸீன் ஆன்மா உளது என்றார்.,False
1678,"ஆனால், உடல் ஆன்மா ஆகுமோ எவீன் ஹில்லையாம்.",False
1679,"உடலே ஆன்மாவாக ஹிருந்தால், எனது உடல் என்று சொல்ல வேண்டுவது என்ன?",False
1680,"எனது என்று உளீமை கொண்டது எதுவோ, அதுவே யல்லவோ ஆன்மா?",False
1681,ஐம்புலன் அறிதஸீன் ஆன்மா உளது ஐம்பொறிகள் என்பவை மெய் வாய் கண் மூக்கு செஜீ என்பன.,False
1682,"ஐம்புலன்கள் என்பவை ஊறு, சுவை, ஒஹீ, நாற்றம், ஓசை என்பன.",False
1683,மெய்ழீல் ஓளீடத்ணில் தேனை வைத்தால் அதன் ஹிவீமை புலப்படுமோ?,False
1684,அதனை நாஜீல் வைத்தால் அல்லவோ சுவை தெளீகின்றது?,False
1685,கண்தில் ஒஹீ தோன்றுகின்றது.,False
1686,அதே கண்தில் சுவையோ நாற்றமோ கேள்ஜீயோ தெளீவணில்லையே?,False
1687,செஜீழீல் ஓசை கேட்கின்றது.,False
1688,ஒஹீயோ சுவையோ நாற்றமோ புலப்படுவது ஹில்லையே!,False
1689,ஒவ்வொரு புலனும் ஒவ்வொன்றைத் தானே உணர வல்லனவாய் உள்ளன?,False
1690,ஆனால் ஐம்புல உணர்வைஜிம் ஒருங்கே அறிந்துகொள்ளும் ஒன்று ஹிருக்கிறதே!,False
1691,அதுவே ஆன்மாவாம் என்பாராய் ஐம்புலன் அறிதஸீன் ஆன்மா உளது என்றார்.,False
1692,ஒடுக்கம் என்பது நுண்ணுடல்.,False
1693,அதனை வடமொஷீயாளர் சூக்கும உடம்பு என்பர்.,False
1694,"கனஜீன்கண் பருஷிடல் எங்கோ ஓளீடத்ணிருக்க, நுண்ணுடல் எங்கோ ஒரு காட்ஞியைக் கண்டு உணர்ந்து கொள்கின்ற தன்றோ!",False
1695,"அந்நுண்ணுடல் காட்ஞியை ஜீஷீத் தெழுந்த காலை, பருஷிடல் கண்டதாகக் கூறுவது வழக்கம் அல்லவோ?",False
1696,அவ்வாறாழீன் நுண்ணுடல் காட்ஞியைப் பருஷிடற் காட்ஞியாக்கிக் காட்டத் தக்க ஒன்று உள்ளது அன்றோ!,False
1697,"அவ்வொன்றே ஆன்மாவாம், என்பாராம் ஒடுக்கம் அறிதஸீன் ஆன்மா உளது என்றார்.",False
1698,கண்படில் உண்டிஜீனை ஹின்மைழீன் ஆன்மா உளது கண்படில் என்பது உறங்குதல் உண்டிஜீனை என்பது ஹின்ப துன்ப நுகர்ஷிகள்.,False
1699,"உறங்காமல் ஜீஷீத்ணிருக்கும் போணில், ஹின்ப துன்ப நுகர்ஷிகள் உண்டாகின்றன.",False
1700,உறங்கும்போது ஹின்ப துன்ப நுகர்ஷிகள் உண்டாவது ஹில்லை.,False
1701,அவ்வாறு தோன்றாமையால் மூச்சுக் காற்றின் வேறாக உழீர் ஹிருக்கவேண்டும் என்பது தெஹீவாம்.,False
1702,ஹிதனைக் கருணியே உண்டிஜீனை ஹின்மைழீன் ஆன்மா உளது என்று ஆஞிளீயர் தெஹீஜீத்தார்.,False
1703,உணர்த்த உணர்தஸீன் ஆன்மா உளது ஹிறைவனுக்கு எண்திறந்த தன்வீயல்புக் குணங்கள் உள.,False
1704,"அவற்றுள் ஹிரண்டு குணங்கள், தானே அறிகிற குணமும், ஆன்மாஜீற்கு அறிஜீக்கிற குணமுமாம். ஆன்மாக்களுக்கு எண்திறந்த தன்வீயல்புக் குணங்கள் உள.",False
1705,ஹிவ்வாறாக ஹிறையறிவே உழீர் என்பது பொருந்தாதாம்.,False
1706,"ஏனெவீல் ஆன்மாஜீன் அறிஷி, உணர்த்த உணரும் ஞிறுமைஜிடையது என்பாராய் உணர்த்த உணர்தஸீன் ஆன்மா உளது என்றார்.",False
1707,ஹிவ்வாறு பகுத்தும் நிளீத்தும் ஆஞிளீயர் உழீருண்மையை ஜீளக்கவேண்டுவது என்ன?,False
1708,ஹிவ்வெழுவர் தம் கொள்கைகளை முறைமுறையே மறுத்து அவற்றின் வேறாம் ஆன்மாஜீன் உண்மை காட்டுவாராய் ஹிந்நூற்பாவை மெய்கண்டார் அருஹீனார் என்க.,False
1709,மேலும் உழீரைத் தொடர்ந்து ஆய்கின்றார்.,False
1710,"நான்காம் நூற்பா உழீர்களுக்கு அமைந்துள்ள மெய், வாய், கண், மூக்கு, செஜீ என்பவை அறிஷி பெறுவதற்காக அமைந்த கருஜீகள்.",False
1711,ஆகஸீன் ஹிவ்வைந்தைஜிம் அறிகருஜீ என்பர்.,False
1712,ஹிவற்றின் வேறாகச் ஞில கருஜீகளும் உள.,False
1713,"அவை வாய், கால், கை, மலவாய், நீர்வாய் என்பன.",False
1714,"அவை பேசுதல், நடத்தல், புளீதல் முதஸீய செயல்களுக்கு உளீயவை.",False
1715,ஆதலால் அவற்றைச் செயற்கருஜீகள் என்பர்.,False
1716,"உழீர்கள் அறிஷிறுதற்கும் செயலாற்றுவதற்கும் ஹிவ் வறிகருஜீகளும், செயற் கருஜீகளும் ஹின்றியமையாதவை.",False
1717,ஹிவ்ஜீருவகைக் கருஜீகளும் உருஷிடன் வெஹீப்படத் தெளீபவை.,False
1718,"ஹிவ்வாறு ஒருஷிடன் வெஹீப்படத் தெளீயாமல், அருவமாய்த் தோன்றும் உட்கருஜீகளும் உள.",False
1719,"அவற்றைஜிம், நுண்திய மெய்ப் பொருள் ஆய்வாளர்கள் கண்டறிந்து ஹிவையெனக் கூறிஜிள்ளனர்.",False
1720,"அவை, மனம், பினைஷி, முனைப்பு, அறிஷி மனம், ஞித்தம், அகங்காரம், புத்ணி என்பன.",False
1721,ஹிவை ஒன்றின் ஒன்று வளர்பிலைழீல் அமைந்தவை.,False
1722,ஹிவ்ஜீரண்டைஜிம் சேர்த்து ஆன்மஜீயல் ஆன்மதத்துவம் எனப்படும்.,False
1723,ஹிவற்றின் வேறாகக் கலைழீயல் ஜீத்ணியாதத்துவம் ஹிறைழீயல் ஞிவதத்துவம் என்பனஷிம் உண்டு.,False
1724,"ஹிவீ, அவை தொஷீற்படுமாற்றைஜிந் தெஹீஜீப்பர்.",False
1725,ஹிவ்ஜீடத்தே ஞில குறியீடுகளை அறிந்துகொளல் நலம்.,False
1726,"ஓளீடத்து ஏற்படுத்தும் முடுக்கம் அடுத்ததை ஹியக்கி, அது நிறிதொன்றை ஹியக்கித் தொஷீற்படச் செய்வதுபோலாம்.",False
1727,"ஹிவ்ஜீடத்தே, உழீர்க்கலன் ஊநடட நுண்மைஜிம் அதன்படிப்படி ஜீளீவாக்கமும் அதனுள் அடங்கிக்கிடக்கும் உறுப்புகஹீன் அமைணிஜிம் எண்ணத் தக்கவையாம்.",False
1728,ஆலம்ஜீதைஜிள் அதன் அத்தனை பகுணிகளும் அடங்கிக் கிடக்கின்றன அல்லவோ!,False
1729,"அதனால் அன்றே ஆலமர் ஜீத்ணின் அருங்குறள் என்பதன் வஷீயாகக் கம்பர் ணிருக்குறளைஜிம், ணிருமால் குறளைஜிம் ஹிணைத்து ஹிரட்டுறலாக்கிக் கூறினார்.",False
1730,"ஹிவீ, நான்காம் நூற்பாவைஜிம் அதன் பொருள் ஹியைவைஜிம் காணலாம்.",False
