Line Number,Sentence
2127,செம்பு போலும் நிறமுடைய மணிக்கல் கெம்பு ஆகும்.
2128,பொன்னில் இக்கல்லைப் பதித்து அணிகலம் செய்வர்.
2129,கெலித்தல் வெற்றி பெறுதலைக் கெலித்துவிட்டான் என்பது மக்கள் வழக்கு.
2130,கலியோசை துள்ளலோசை.
2131,"துள்ளலும், எழும்பலும், ஆர்த்தலும், கூடியது கலித்துள்ளல்."
2132,ஆர்கலி காண்க.
2133,கெழுதகைமை கெழுவுதல் பொருந்துதல்.
2134,"கெழீஇய நட்பு, பாராட்டுப் பெறும்."
2135,கெழுதகைமை பலரும் பாராட்டும் உயரிய பண்பாகும்.
2136,"கெழுதகைப் பொதுச் சொல் அன்புரிமையோடு கூறும் பொதுவகை மொழி, எல்லா என்பது."
2137,இளவழ. பழையம் எனக்கருதிப் பண்பல்ல செய்யும் கெழுதகைமை கேடு தரும் திருக்.
2138,கேண்மை காண்க.
2139,கெழுமல் கெழுமுதல் கெழுமல்.
2140,கெழும் அல் கெழுமல்.
2141,உள்ளம் ஒரு நிலைப்படப் பொருந்தி நில்லா மயக்க நிலை.
2142,வேட்கையிற் கெழுமி பெருங்.
2143,கே வரிசைச் சொற்கள் கே கேடு கெடு கேடு.
2144,கெடுதலாம் கேடு வறுமைப் பொருளதாதல்.
2145,கேடும் பெருக்கமும் இல்லல்ல என்பதால் திருக்.
2146,கேடும் பெருக்கமும் ஒப்ப நோக்குவார் திருட்தொண்.
2147,பாயிரம் உயர் தொண்டர்.
2148,கேடு கெடுதல்.
2149,கெடுவான் கேடு நினைப்பான் என்பது பழ.
2150,"கேடு கெட்டவன் என்பது, கேடு செய்தலால், தான் கெட்டுப் போனவன் என்பதன் தொகையாம்."
2151,கேட்டல் கேள் கேட்டல்.
2152,ஒருவர் கூறுவதைச் செவிகொடுத்துக் கேட்டல்.
2153,கேள்வி என்பதும் அதுவாம்.
2154,உறுபெயர் கேட்டல் தொல்.
2155,பொருள் தலைமகன் ஊரும் பேரும் கேட்டு மகிழ்தல் கேட்டை கேட்டனை என முன்னிலைப்படுத்திச் சொல்லும் சொல்.
2156,கேட்டை என்றா நின்றை என்றா தொல்.
2157,மக்கள் வழக்கில் நான் கெட்ட கேட்டையும் பட்ட பாட்டையும் சொல்லி மாளாது எனவரும்.
2158,இது பலவகைகளால் பலரால் அடைந்த துயரைக் கூறுவது.
2159,கேட்பா சமுத்தி இன்ன வகையாய்ப் பாடுக என்றதும் அன்ன வகையாய்ப் பாடும் பாடல் சமுத்தி எனப்படும்.
2160,கேட்டவாறு பாடப்படுவது ஆகலின் கேள்பா கேட்பா எனத் தக்கதாம்.
2161,அகப்பொருள் புறப்பொருள் ஆகிய இருபொருள் வழியிலும் இப்பாப் பாடப்படும்.
2162,நிற்றலே என்ற அளவில் சுவடிச் சிதைவு.
2163,"காளமேகப் புலவரும், மாம்பழக் கவிச்சிங்க நாவலரும் சமுத்தி பாடுதலில் கொடிகட்டிப் பறந்தவர்கள்."
2164,இரட்டைப் புலவர்களும் இத்துறையில் வல்லவர்களே.
2165,எழுத்துச் சொற்பொருள் அணியாப் பிவையின் விழுத்தக ஒருவன் விளம்பிய உள்ளுறை அப்பொழு துரைப்ப தாசு கவியே இலக்.
2166,என வரும் ஆசு கவி இச்சமுத்தி பாடுவோன் என்க.
2167,ஆசு கவி கடும்பா பாவா..
2168,வினாவிடைப் பாடல் காண்க.
2169,கேட்போர் கேட்போர் கேட்போர் கேட்பவர்.
2170,கேட்போர் கேட்போர் மாணவர்.
2171,ஒருகுறி கேட்போன் நன்.
2172,கேட்போர் அகப்பொருள் துறைகளுள் ஒன்று.
2173,"அது, கேட்போர் கூற்று என்பது."
2174,கேட்போர் களனே காலவகை எனாஅ தொல்.
2175,கேணி கேணி என்பது நீர்நிலை.
2176,கேணி பூவா எரிமருள் தாமரை புறம்.
2177,ஊருண் கேணி புறம்.
2178,"ஊருண் கேணி, ஊருணியாம்."
2179,ஊருணி நீர்நிறைந் தற்றே திருக்.
2180,கீ கீழ் கீண் கீண்டு கிழித்து.
2181,அகடுகீண் டொழுகிய தன்றே நைட.
2182,"நிலத்தை அறுத்தோடும் ஆறு போல், நிலத்தைக் கிழித்தமைத்தது கேணியாம்."
2183,கேண்மை கேள் கேண் கேண்மை.
2184,"கேள் உறவு, நட்பு."
2185,கேளிர் கேளார்.
2186,யானை அனையவர் நண்பொரீஇ நாயனையார் கேண்மை கெழீஇக் கொளல்வேண்டும் நாலடி.
2187,காது கொடுத்தும் சொல்வதைக் கேளாதவர் கனிவுடைய உறவினராவரா?
2188,"கேதம் ஏதம் என்பது இடையூறு, இறப்பு என்னும் பொருள் தருவது இலக்கிய வழக்கு."
2189,ஏதம் என்பது ககர ஒற்றுப் பெற்று கேதம் என்றாகி இறப்பைக் குறிப்பது பொதுவழக்காக உள்ளது.
2190,பொதுவழக்கு என்பது மாவட்டம் வட்டம் தழுவி நில்லாமல் தமிழ் வழங்கும் பரப்பெல்லாம் தழுவி நிற்பதாகும்.
2191,கேழல் பன்றியின் பெயர்களுள் ஒன்று கேழல்.
2192,கேழ் என்பதும் கெழு என்பதும் ஒளிப்பொருளதாகும்.
2193,குருவும் கெழுவும் நிறனா கும்மே என்பது தொல்காப்பியம் .
2194,கெழு கேழ்.
2195,ஒளி இல்லாக் கரு நிறத்தது ஆதலால் கேழ் அல் கேழல் எனப்பட்டது.
2196,சேற்றுவளர் தாமரை பயந்த ஒண்கேழ் நூற்றிதழ் அலரி புறம்.
2197,கேழற் பன்றி புறம்.
2198,கேழ் கேழ் என்பது வண்ணமாம்.
2199,வண்ணத்தில் அழகு பொதுளி நிற்பதாகலின் அழகு கேழ் எனப் பெற்றதாம்.
2200,கேழ்வரகு கூல வகைகளுள் ஒன்று இது.
2201,வரகு வகை சார்ந்தது.
2202,வரகு போலவே கரிய அல்லது கருஞ்சிவப்பு நிறத்தது.
2203,வரகின் நிறத்தினும் பளிச்சிட்டுத் தோன்றுவது.
2204,ஆதலால் கேழ்வரகு என்றனர்.
2205,குருவும் கெழுவும் நிறனா கும்மே என்பது தொல்காப்பியம் .
2206,கெழு பளிச்சிட்ட நிறம்.
2207,கெழு கேழ் ஆயது.
2208,வரகு காண்க.
2209,கேளார் கேள் ஆ ஆர் கேளார்.
2210,கேளாதார் என்னும் பொருளது.
2211,சொன்னதைக் கேளாதவர் என்பதனொடு பகைவர் என்னும் பொருளும் தரும்.
2212,கேளிர் கேளார்.
2213,உறுப்புக் குறையால் கேளார் ஆதல் குறையன்று.
2214,செவிப் புலன் செவ்வையாக அமைந்தும் நல்லவை கேளாரே மரத்துப் போன செவியராம்.
2215,கேளிக்கை விளையாட்டாக எள்ளலாக ஒருவரைப் பேசுதல் கேளிக்கையாகும்.
2216,கேள் என்பது உறவு என்னும் பொருளது.
2217,இக்கேளி என்னும் சொல் மேலும் சிதைந்து கேலி எனவும் ஆய்விட்டது.
2218,"இது உறவுப் பொருள்விட்டு, பொதுவாகவும் ஆயிற்று."
2219,"கேளும் கிளையும் கேள் உடன்பிறந்தாரும், கொண்டவர் கொடுத்தவரும் கேள் ஆவர்."
2220,"கிளை உடன்பிறந்தவர்க்கும்,கொண்டவர் கொடுத்தவர்க்கும் கேள்ஆகியவர் கிளையாவர்."
2221,ஒட்டுறவு காண்க.
2222,கேள் ஒருவர் கூறும் இன்ப துன்பங்களைக் கேட்கும் பரிவுடைய செவியினர் எவர் எனினும் அவர் கேளிர் உறவினர்.
2223,"அவ்வாறு கேளாதவர், கேளார் பகைவர்."
2224,கேளிர் என்பதன் எதிர்ச்சொல் கேளார்.
2225,கேள்வி செவியால் கேட்கும் செய்தி கேள்வியாகும்.
2226,அது வினா என்னும் பொருளில் வழங்குதல் வழுவாம்.
2227,செல்வத்துள் செல்வம் செவிச்செல்வம் அச்செல்வம் செல்வத்துள் எல்லாம் தலை திருக்.
2228,எனப்படும் செல்வம்.
2229,கற்றலில் கேட்டலே நன்று என்பது பழமொழி.
2230,சுருக்கமில் கேள்வி யா.கா.
2231,உளங்கூர் கேள்வி இளம்பூரணர் என்பது ஒரு சிறப் பியல்.
2232,அரசர் ஆணை மொழி கேட்டு எழுதுபவர் திருவாய்க் கேள்வி.
2233,கல்வியறிவு போலவே கேள்வி யறிவும் சிறப்புடையதாம்.
2234,கேள்வி முறை கேள்வி நிகழ்ந்ததைக் கேட்டல்.
2235,முறை அறமுறை இதுவெனக் கூறல்.
2236,கேள்வி முறை இல்லையா என்று முறைகேடான துயருக்கு ஆட்பட்டவர் கூறுதல் உண்டு.
2237,என்ன நடந்தது எனக் கேட்பது உசாவுவது கேள்வி.
2238,இந்தக் குற்றத்திற்கு இதுவே தண்டனை என்று நீதி வழங்குவது முறை.
2239,கேள்வியும் இல்லை முறையும் இல்லை என்றால் அந்நாடு விலங்குறையும் காடேயாம்.
2240,கொடுங்கோல் மன்னர் வாழும் நாட்டில் கடும்புலி வாழும் காடே நன்று என்பது ஒரு காவலன் உரை.
2241,"கேறுதல் கோழி முட்டை இடுவதற்குக் கத்துதல், கேறுதல் எனப்படும்."
2242,"இதுவும், பொதுவழக்கே ஆகும்."
2243,"கூவுதல், கத்துதல் என்பது விலக்கிய ஒலி, கேறுதல் ஆகும்."
2244,கை வரிசைச் சொற்கள் கை கை உறுப்பின் பெயர்.
2245,கை செய்தல் என்னும் பொருளில் வருவது.
2246,செய்கை என்பது அதன்விரி.
2247,கை ஒழுக்கப் பொருளது கைகோள்.
2248,கைந்நிலை என்பதும் ஒழுக்கப் பொருள் தருவது.
2249,கை சிறுமைப் பொருளது.
2250,"எடு கை வாய்க்கால், கைக்குட்டை."
2251,கை கடைப்பிடி வகை அல்லது நோன்பு.
2252,எடு கைம்மை.
2253,கை உழைப்பு.
2254,எடு கைசெய்தூண் மாலை யவர் திருக்.
2255,கை எண்ணலளவை.
2256,கை என்பது ஐந்து என்னும் பொருளில் தரகுத் தொழில் வழக்காக உள்ளது.
2257,ஐந்து விரல் கருதியது அது.
2258,பூட்டு என்பதும் இலை விற்பாரிடம் ஐந்து என்னும் பொருளில் வழங்குகின்றது.
2259,கை என்பது இரண்டு என்னும் பொருளில் செட்டிநாட்டில் வழங்குகின்றது.
2260,"அது, கைவிரல் கருதாமல் கையிரண்டு கருதிய வழக்கு ஆகும்."
2261,கை வஞ்சகம் என்னும் பொருளது.
2262,எடு அவன் பெரிய கைகாரன்.
2263,கை கை ஆள்.
2264,ஆட்டத்திற்கு ஒரு கை குறைகிறதுஎன்பது ம.வ.
2265,கை வெறுப்புச் சுவை.
2266,கைப்பு மனவெறுப்பு.
2267,எடு உன் உறவு கைத்துப் போனது கை இடப்பொருள் பின்னொட்டு.
2268,"எடு கடிகை, பொதிகை."
2269,கைகழுவல் உண்டபின் கைகழுவுதல் நம் வழக்கு.
2270,"இவ்வழக்கு உறவைத் துண்டித்து விடுதல், தீர்த்து விடுதல் என்னும் பொருளில் வழங்குகின்றது."
2271,அவர் நடக்கின்ற வகை நமக்கு ஆகாது அவரைக் கைகழுவி விடுவதுதான் நமக்கு மதிப்பு என்பர்.
2272,"உணவை முடித்துக் கைகழுவும் வழக்கு, உறவை முடித்து விடுவதற்கு ஆகின்றது."
2273,"கைகாரன் கைகாரன் திறமையாளன், சூழ்ச்சியாளன், ஏமாற்றாளன்."
2274,அவன் பெரிய கைகாரன் என்றால் திறமையாளன் என்பது பொருள்.
2275,ஆனால் அத்திறமை பாராட்டுக்குரிய பொதுநலத் திறமையைக் குறியாமல் தன்னலச் சூழ்ச்சியைக் குறிக்கும்.
2276,கை என்பது செயல் திறம் என்னும் பொருளது.
2277,அதன் எதிர்மறையாவது இது.
2278,கைகூடும் எடுத்த செயல் நிறைவேறும் என்பதைக் கைகூடும் என்பது மக்கள் வழக்கு.
2279,"கைசேரும், கையேறும் என்பனவும் அது."
2280,கைகொடுத்தல் கைகொடுத்தல் உதவுதல்.
2281,ஏற மாட்டாதவரைக் கை தந்து மேடேற உதவுதல் உண்டு.
2282,வெள்ளத்துள் வீழ்வாரைக் கை கொடுத்துக் கரையேற்றுதல் உண்டு.
2283,அக் கைகொடுத்துத் துயர் தீர்க்கும் நடைமுறையில் இருந்து கைகொடுத்தல் என்பது உதவுதல் பொருள் தருவதாயிற்று.
2284,சைவ சித்தாந்த நூற்பதிப்புக் கழகம் கை கொடுத்தால் நூலெழுதுதற்கே பொழுதெலாம் செலவிடுவேன் என்று பாவாணர் குறிப்பிடுகிறார் பாவா.
2285,கைகோள் கை ஒழுக்கம்.
2286,கோள் கொள்ளுதல்.
2287,ஒழுக்கத்தைக் கடைப்பிடித்தல் என்னும் அகப்பொருள் ஆட்சி இது.
2288,"களவு, கற்பு எனப்படும் இருவகைக் கைகோள்."
2289,திணையே கைகோள் கூற்றுவகை எனாஅ தொல்.
2290,கைக்கிளை இலக்கிய வகை.
2291,ஒருதலைக் காமத்தினை ஐந்து விருத்தப் பாக்களால் கூறுவது கைக்கிளை எனப்பெறும்.
2292,ஒருதலைக் காமம் ஓரைந்து விருத்தம் கருத உரைத்தல் கைக்கிளை யாகும் இலக்.
2293,"செய்யுள் வகைமையுடையார், கைக்கிளை தானே கருதும் விருத்தம் ஐந்தும் மூன்றும் ஆகவும் பெறுமே நவநீத."
2294,மேற் என்பார்.
2295,ஐந்து விருத்தத் தாலே ஒருதலைக் காமத்தைக் கூறுவது கைக்கிளை முத்துவீ.
2296,அன்றியும் வெண்பா ஆறைந் திரண்டு பாடுவ ததன்பாற் படுமென மொழிப முத்துவீ.
2297,என்பார் முத்துவீரியமுடையார்.
2298,கைக்கிளையாவது ஒருதலைக் காமம் எனப்படும்.
2299,திரையுலா வந்த ஒருதலை ராகம் கைக்கிளைப் பொருளதே.
2300,கைக்கிளை வெண்பா யாப்பிலும் மருட்பா யாப்பிலும் வருமெனத் தொல்காப்பியர் குறிப்பார்.
2301,கலிப்பா வகையும் கைக்கிளைப் பொருளில் வருதல் கலித்தொகையால் அறியவரும்.
2302,"கை சிறுமைப் பொருட்டெனக் கொண்டு கைக்குட்டை, கைவாய்க்கால் முதலியவற்றை எடுத்துக் காட்டி விளக்குவார் இளம்பூரணர்."
2303,முத்தொள்ளாயிரப் பாடல்களாகக் கிடைத்தனவற்றுள் பெரும்பாலன பெண்பாற் கைக்கிளைப் பாடல்களேயாம்.
2304,சங்கச் சான்றோர் பாடிய கலித்தொகையில் இடம்பெற்ற கைக்கிளைப் பாடல்கள் ஆண்பாற் பட்டனவே என்றறிதல் தெளிவிக்கும்.
2305,கைக்கிளை மாலை ஒருதலைக் காதலால் வருந்துவது பற்றி அந்தாதியாகப் பாடப்பெறுவது கைக்கிளை மாலை எனப்பெறும்.
2306,வருந்தச் செய்வன இவை என்பதையும் வருத்தும் மன்மதன் அம்புகள் இவை என்பதையும் பன்னிரு பாட்டியல் விரித்துரைக்கும்.
2307,முல்லை அசோகு மாந்தளிர் தாமரை யல்லி நீலம் ஐங்கணை யாகும் பன்னிரு.
2308,தாமரை யல்லி தாமரையாகிய அல்லி என்க.
2309,கைக்கிளைக்கும் கைக்கிளை மாலைக்கும் பொருளொப் புடையதேனும் முடிமுதல் தொடையாகப் பாடுதல் மாலைக் குரியதென வேறுபாடறிக.
2310,இனிப் பாடல் எண்ணிக்கை பகராமை யும் கருதுக.
2311,இனிக் கைக்கிளை மாலை மருட்பாவாற் பாடப்படும்.
2312,அல்லாத வழி ஆசிரியம் வஞ்சி ஒழிந்த பாக்களாலும் இனங் களாலும் பாடப்பெறும்.
2313,"சிறுபான்மை ஆசிரியப் பாவானும் பாடப்படும் என்றும் கூறுவர் பன்னிரு , உரை."
2314,கைசெய்தல் கையால் வினைசெய்தல் என்னும் பொருளதாம்.
2315,"கைசெய்தல் பொதுவில் தொழில் செய்தல், கடமை யாற்றல் என்னும் பொருளில் வழங்குகின்றது."
2316,கைசெய்தூண் மாலை யவர் திருக்.
2317,கை தலை வைத்தல் கை தலை வைத்தல் துயரமுறல்.
2318,தம் தலைமேல் கைவைத்தல் துயரமுறுதல் அடை யாளமாம்.
2319,தலையில் கையால் அடித்துக் கொள்வதும் கண்கூடு.
2320,கறைகெழு குடிகள் கைதலை வைப்ப சிலப்.
