Line Number,Sentence
1059,ஆம் நூற்றாண்டிற்கு பின்னர் கட்டப்பட்டிருக்கலாம் என்று எண்ண இடமுண்டு.,False
1060,இஃதன்றி இத் திருக்கோயில் எந்த மன்னனால் எந்த ஆண்டில் அடிப்படை இடப்பட்டது என்று திட்டவட்டமாக இன்னும் முடிபு கட்டப்படவில்லை.,False
1061,இந்த திருக்கோயில் இயற்கை எழிலுடன் மிகக் கம்பீரமாய்த் திகழ்கிறது.,False
1062,இதற்குப் பெரிய சுற்று மதில்கள் இல்லை.,False
1063,சுமார் ஏழு அடி உயரமுள்ள சிறிய மதில்களே உள்ளன.,False
1064,சுற்றிலும் தென்னை மரங்கள் அழகுடன் பொலிகின்றன.,False
1065,இதன் எழிலை மறைக்கவிடாது தென்னையின் இலைகள் அகற்ற பட்டிருந்தால் மிக நல்லது என்று எண்ணுகிறேன்.,False
1066,இது நீண்ட நாளாகவே கவனிக்கப்படாமல் இருந்து வந்தது.,False
1067,சமீபத்தில் இந்திய அரசாங்கம் தொல்பொருள் துறை இதனை பார்த்து வருந்தி பழுது பார்த்துப் பராமரித்து வருவதாக அறிந்து மகிழ்கின்றேன்.,False
1068,இதன் சுற்றுப்புறங்களில் உள்ள சிறுசெடிகொடிகள் அகற்றபட்டு நல்ல தளமிடப்பட்டு பாதுகாக்கப்படவேண்டும்.,False
1069,தமிழகத்திலுள்ள அழகிய ஞாழற் கோயிலுக்கு நல்ல எடுத்துக்காட்டாக இது காணப்படுகிறது.,False
1070,இது பாடல் பெற்ற திருக்கோயிலாக இல்லாவிடினும் புனித நகரமாகிய காஞ்சியில் உள்ள புராணப் பிரசித்திப் பெற்ற கோயிலாக இருக்கிறது.,False
1071,தமிழகம் இதனை உணர்ந்து இத்திருக்கோயிலை சீர்பெறச் செய்து பாதுகாக்க வேண்டியது இன்றியமையாததாக இருக்கிறது.,False
1072,"இத்திருக்கோயிலை இந்திய அரசாங்க, தொல்பொருள் துறையினர் இரு கோணத்தினின்று படம் எடுத்துள்ளனர்.",False
1073,இரு படங்களும் இந்தக் கோயிலின் சிறப்பை நன்குணர்வதற்கு ஏற்றதாக இருக்கிறது.,False
1074,கொகுடிக் கோயில் கொகுடி என்பது ஒருவகை முல்லை என்று பல அறிஞர்கள் கூறுகிறார்கள்.,False
1075,இத் திருக்கோயிலுக்குச் சுந்தரரும் சென்று இறைவன் மீது பாடிக் களித்துள்ளார்.,False
1076,இவ்வூர் மாயவரத்திற்கு அண்மையில் உள்ளது.,False
1077,இன்று மக்கள் இவ்வூரை தலை ஞாயிறு என்று கூறி வருகின்றார்கள்.,False
1078,இதைத் தவிர வேறு எங்கும் கொகுடிக் கோயில் என்ற பெயரில் கோயில் இருப்பதாகத் தெரியவில்லை.,False
1079,சதாசிவ பண்டாரத்தார் அவர்கள் கூறியுள்ளார்கள்.,False
1080,இந்தக் கொகுடிக் கோயில் சிற்ப நூற்களில் ஸ்ரீபோகம் என்று கூறப்பட்டிருக்கலாம் என்று நான் எண்ணுகிறேன்.,False
1081,நண்பர் திரு.,False
1082,"மயிலை சீனி வேங்கடசாமி அவர்கள், இந்தக் கோயிலின் விமான அமைப்பு எப்படி இருந்ததென்று திட்டமாகச் சொல்வதற் கில்லை.",False
1083,நாம் ஏற்கெனவே பெருங்கோயில் ஸ்ரீவிசாலம் என்று கூறிவிட்டோம்.,False
1084,கொகுடிக் கோயில் எங்கு உள்ளது எப்படி இருக்கும் என்பதற்கு இதைவிட நமக்கு ஏற்ற சான்றுகள் இல்லை.,False
1085,மேலும் கொகுடிக் கோயிலைப் பற்றி ஆயிரம் ஆண்டுகளுக்கு முன் எவராது குறிப்பிட்டாரா என்பது நமக்குப் பெருஞ் சந்தேகமாக இருக்கிறது.,False
1086,அது மட்டுமல்ல அச்சுவாகனம் வந்த பின்னர் கூட கொகுடிக் கோயிலைப் பற்றி யாராவது ஒரு நல்ல விளக்கம் தந்துள்ளாரா?,False
1087,என்றால் என்னால் மிகத் தைரியமாக இல்லை!,False
1088,என்று விடை கூற முடியும்.,False
1089,தலை ஞாயிற்றை கருப்பறியலூரைத் தவிர வேறு எங்கும் கொகுடிக் கோயில் இருப்பதாக நமக்குத் தெரியவில்லை.,False
1090,அப்பர் பெருமான் பெருங்கோயில்கள் எழுபத்தெட்டு உளதென்று குறிப் பிட்டுள்ளார்.,False
1091,அவ்வாறு சுந்தரர் ஒருவர் மட்டும் கருப்பறியலூர் கொகுடிக் கோயில் என்று தம் திருப்பதிகத்தில் சுட்டிக்காட்டியுள்ளார்.,False
1092,இதைத் தவிர சுந்தரர் வேறு எந்தக் கொகுடிக் கோயிலைப்பற்றியும் தம் திருப்பதிகத்தில் குறிப்பிடவில்லை.,False
1093,இஃதன்றி திருநாவுக்கரசரோ திருஞான சம்பந்தரோ தம் திருப்பதிகத்தில் ஒரு கொகுடிக் கோயிலைப் பற்றியும் பாடியதாகத் தெரியவில்லை.,False
1094,இதைத் தவிர வேறு எந்த அறிஞரும் பிறிதோர் கொகுடிக் கோயிலைக் கண்டதாகத் தெரியவில்லை.,False
1095,திருக் கருப்பறியலூர் தஞ்சாவூர் மாவட்டத்தில் உள்ளது.,False
1096,இவ்வூர் இன்று தலைஞாயிறு என்று அழைக்கப்படுகிறது.,False
1097,இது மாயவரம் விழுப்புரம் இருப்புப்பாதையில் வைத்தீசுவரன் கோயில் புகைவண்டி நிலையத்திலிருந்து கல் தொலைவில் உள்ளது.,False
1098,திருப்புன்கூர் போகும் வழியில் இரண்டு கல் தொலைவில் இருக்கிறது.,False
1099,இத்தலம் காவிரி ஆற்றின் வட கரைத் தலங்களுள் ஒன்று.,False
1100,இவ்வூரின் இருபக்கமும் விநாயக நதி பிரிந்து செல்கிறது.,False
1101,இவ்வூருக்கு யூதிகாவனம் கன்மநாசபுரம் ஆதித்தபுரம் மேலைக்காழி என்ற பெயர்களும் உண்டு.,False
1102,இங்குள்ள கொகுடிக் கோயிலில் குடிகொண்டிருக்கும் இறைவன் குற்றம் பொறுத்த நாதர்.,False
1103,இறைவி கோல்வளை நாயகி.,False
1104,"இஃதன்றி கர்ப்பஞானேசுவரர் கர்ப்பஞான பரமேசுவரி, சட்ட நாதர் முதலிய தெய்வப்படிமங்களும் இங்குண்டு.",False
1105,சீர்காழியைப் போலவே சட்டை நாதர் இங்கும் மலையுச்சியில் எழுந்தருளி இருக்கிறார்.,False
1106,இங்கு அழகான சிற்பங்கள் காட்சி தருகின்றன.,False
1107,இவ்வூருக்கு மேலைக்காழி என்ற சிறப்புப் பெயர் உண்டு.,False
1108,புராணக்கதைகள் ஆதிசேடனும் வாயுவும் ஒரு காலத்தில் சண்டை இட்டுக் கொண்டனர்.,False
1109,அப்பொழுது ஆதிசேடன் தன் படங்களால் கயிலைச் சிகரங்களை அமுக்கிக் கொண்டான்.,False
1110,வாயு பெரும் புயலாக மாறி சிகரங்களைப் பிய்த்தெறிந்து தன் வலிமையைக் காட்டினான்.,False
1111,அவ்வாறு எறியப்பட்ட சிகரங்களும் இம்மலையும் ஒன்று.,False
1112,"ஞாயிறு தேவன் தக்கன் யாகத்திற்குப் போய் பங்கு கொண்ட பாதகத்தால் உக்கிர வீர பத்திரர், பல்லை உடைத்தார்.",False
1113,அதனால் ஞாயிறு ஒளி மங்கியது.,False
1114,உலகு இருண்டது.,False
1115,ஆகையால் இத்தலத்து நீரில் மூழ்குவோர் தொழுநோயாய் இருந்தாலும் நோய் நீங்கி இன்புறலாம் என்ற ஐதீகம் உண்டு.,False
1116,"இந்திரனைத் தேடித்திரிந்த சூரன், இந்திரன் இருக்குமிடம் மழைவளம் பெற்று செழிப்பாக இருக்கும் என்று மேகங்களைச் சிறையிட்டான்.",False
1117,அதனால் இந்திரன் பேணி வளர்த்த பூங்கா வாடியது.,False
1118,அதனால் இந்திரன் கணபதியை வேண்ட அவர் அகத்தியரின் கமண்டல நீரைப் பெருகி வரும்படி செய்தார்.,False
1119,அது இவ்வூரின் மேல்பாலும் வடபாலும் சூழ்ந்து வந்தது.,False
1120,இது விநாயகரால் உண்டாக்கப் பெற்றதாதலால் விநாயக நதி எனப் பெயர் எழுந்தது.,False
1121,"முன், ஒரு நாள் இராவணன் தன் புஷ்பக விமானத்தில் ஏறி ஆகாய மார்க்கமாகச் சென்றான்.",False
1122,திடீரென்று விமானம் இயங்காது நின்றது.,False
1123,எனவே அவன் சினந்து கீழே இறங்கினான்.,False
1124,கீழே திருக்கருப் பறியலூர்க் கொகுடிக் கோயிலைக் கண்டான்.,False
1125,களிப்புற்றுக் காரணம் உணர்ந்தான்.,False
1126,இறைவனை வழிபட்டு இன்பம் எய்தினான்.,False
1127,அங்கு கோயில் கொண்டுள்ள குற்றம் பொறுத்த நாதரை வேண்டி உய்ந்தான்.,False
1128,அவ்வாறே இந்த தலத்தில் அனுமான விசித்திராங்கதன் போன்றோர்கள் வழிபட்டு நலம் பல பெற்றுள்ளனர்.,False
1129,ஒரு காலத்தில் இந்திரன் இறுமாப்புடன் கயிலைக்குச் சென்றான்.,False
1130,அவ்வமயம் பூதவடிவில் இறைவன் அவன் முன் தோன்றினார்.,False
1131,இந்திரன் இதை அறியாது அவர் மீது தனது வச்சிராயுதத்தை எறிந்தான்.,False
1132,இறைவன் இந்திரனுக்கு தான் யார் என்பதை அறிவுறுத்தினார்.,False
1133,அப்பால் இந்திரன் இறைவனிடம் தன் பிழையைப் பொறுத்தருளுமாறு வேண்டினார்.,False
1134,குற்றம் பொறுத்த காரணம் பற்றி இறைவனுக்கு குற்றம் பொறுத்த நாதர் என்று பெயர் வந்தது.,False
1135,கல்வெட்டுகள் இத் தலத்தைப் பற்றி பதினெட்டு கல்வெட்டுகள் உள்ளன.,False
1136,அவைகள் ஆம் ஆண்டில் படி எடுக்கப்பெற்றுள்ளன.,False
1137,ஊர்ச் சபை உறுப்பினர்கள் ஆவதற்குரிய சட்ட திட்டங்கள் இக்கோயிலின் வடபுறச் சுவரில் பொறிக்கப்பெற்றுள்ளன.,False
1138,மகாமண்டபம் விக்கிரம சோழவேளாளரால் எடுப்பிக்கப்பெற்றது.,False
1139,மூன்றாம் குலோத்துங்கன் காலத்தில் இவ்வூர் தனி நாயகச் சதுர்வேதி மங்கலம் என்னும் பெயரால் அழைக்கப்பட்டது.,False
1140,அப் பெயரே மருவித் தலை ஞாயிறு என்று கூறப்பட்டது என்றும் தெரிகிறது.,False
1141,இவ்வூர் தனிநாயகச் சதுர்வேதி மங்கலம் என்று கல்வெட்டுகளில் காணப்படுகிறது.,False
1142,மூன்றாம் குலோத்துங்கன் காலத்தில் சோழ குலத்தைச் சேர்ந்த மங்களாதிராசர் இக் கோயிலின் விமானத்தைச் சீர்பட வைத்தவர் என்று தெரிகிறது.,False
1143,இக் கோயிலின் பள்ளியரை நாச்சியாரை எழுந்தருள வைத்தவர் வில்லவரையர் என்பவராவார்.,False
1144,இங்கு வழிபடவரும் மாகேவரர் களுக்கும் கூத்தப் பெருமானைத் திருவாதிரையில் எழுந்தருளச் செய்வதற்கு மானியங்கள் விடப்பட்டுள்ளன. .,False
1145,இளங்கோயில் இளங் கோயிலைச் சிலர் பாலாலயம் என்று கூறுவர் அது தவறு.,False
1146,இளங் கோயில் அப்பர் பாடிய எழுவகைக் கோயில்களில் ஒன்று.,False
1147,இளங் கோயில் என்பது ஆகமத்தில் வடமொழியில் ஸ்ரீ கரம் என்று கூறப்பெற்றுள்ளது.,False
1148,மாமல்லபுரம் திரௌபதை யம்மன இரதம் என்று கூறப்படும் ஒற்றறைக் கல் தேரை இளங் கோயில் என்று கூறலாம்.,False
1149,மீயச்சூர் என்பது இன்று பேரளம் என்று வழங்கப்படுகிறது.,False
1150,கடம்பூர் இளங்கோயிலும் கயிலாய நாதனையே காணலாமே தேவாரத்தில் கூறப்பெற்றுள்ளது.,False
1151,அக்கோயில் இன்று பழுதுற்ற நிலையில் உள்ளது.,False
1152,கடம்பூரில் கரக்கோயில் உள்ளது.,False
1153,அது சிறப்பான நிலையில் உள்ளது.,False
1154,முதலாம் இராச ராசன் சாசனம் ஒன்றில் கடம்பூர் இளங்கோயில் குறிப்பிடப்பட்டுள்ளது.,False
1155,சுந்தரபாண்டியன் கி.பி.,False
1156,கொடும்பாளூர் மூவர் கோயிலும் இளங் கோயிலேயாகும்.,False
1157,இளங் கோயில் இளங்கோயில் என்ற வார்த்தையை வைத்து இளம் கோயில் எப்படி இருக்கும் என்று சொல்லிவிடுவதற்கில்லை.,False
1158,"இளங் கோயில் என்றால் சிறுகோயில், அழகிய கோயில் என்றெல்லாம் பொருள் கூறலாம்.",False
1159,அவ்வாறு கோயில்களுக்கு வழங்கும் பெயர்களைக் கொண்டு கோயிலின் அமைப்பை நிர்ணயித்து விட முடியாது.,False
1160,அது நம்மை ஒரு தவறான முடிபிற்கு இட்டுச் சென்று விடும்.,False
1161,இளங் கோயில் என்றால் சிலர் பாலாலயம் என்று கூறுகின்றனர்.,False
1162,அந்த இடத்தைப் பாலாலயம் என்று கூறப்படும்.,False
1163,இளங் கோயில் என்பது அத்தகைய தற்காலிகக் கோயிலாகிய பாலாலயம் என்று கூறப்படுவது தவறாகும்.,False
1164,ஆனால் அண்ணாமலைப் பல்கலைக் கழக ஆராய்ச்சித் துறை வித்துவான் திரு.,False
1165,இராமச்சந்திரன் செட்டியார் அவர்கள் பீ.,False
1166,அவர்கள் பழைய கோயில் பழுதுபடப் புதுப்பித்ததற்கு முன் பாலாலயம் செய்வதுண்டு.,False
1167,. அண்ணாமலைப் பல்கலைக்கழகத்தின் தமிழ் ஆராய்ச்சித்துறை விரிவுரையாளர் வித்துவான்.,False
1168,இதனைப் பாலாலயம் எனவும் வழங்குவர்.,False
1169,இவ் விளங்கோயில் திருப்பணி நடைபெறும் பழைய கோயிலை யொட்டியே அமைக்கப் பெறும் என்று கூறியுள்ளார். இந்த அபிப்பிராயம் தவறானது.,False
1170,இளங்கோயில் ஒரு நிலையான கோயில்.,False
1171,ஆகமங்களிலும் சிற்ப நூற்களிலும் கூறப்பெற்ற எழுவகைக் கோயில் வகைகளில் ஒன்று.,False
1172,அது தற்காலிகக் கோயில் என்று எண்ணுவது சரியன்று.,False
1173,"வை சதாசிவப்பண்டாரத்தார் அவர்கள், பிற்காலத்தில் பாலாலயம் வேறு இளங்கோயில் வேறு என்ற அபிப்பிராயத்தை ஏற்றுக் கொண்டார்கள்.",False
1174,புறம்பயமுடைய பெருமானுக்கு அத்தலைவன் கட்டுவித்த சிறு கோயிலை நாகேசுவரர் ஆலயத்தில் இன்றும் காணலாம்.,False
1175,இதனால் இதைச் சிலர் பாலாலயம் என்று கருத முற் பட்டனர்.,False
1176,அவர் கூறுவதாவது நெல்லூர் மாவட்டம் நெல்லூரில் உள்ள ஒரு வடமொழிச் சாசனம் எளங்கோயில் ஒன்றைக் கூறுகிறது.,False
1177,சிற்ப நூற்களிலும் சிரிகரம் நான்கு பட்டையான விமானத்தையுடையது என்றே தெரிகிறது.,False
1178,சிற்ப நூற்களும் அதை ஆதரிக்கின்றன.,False
1179,இதைப் பல அறிஞர்களும் ஏற்றுக் கொள்கின்றார்கள்.,False
1180,திருமீயச்சூர் இளங் கோயில் மீயச்சூர் தஞ்சை மாவட்டத்தில் உள்ள ஒரு சிற்றூர்.,False
1181,இது மாயவரம் காரைக்குடி இருப்புப் பாதையில் உள்ளது.,False
1182,"மீயச் சூருக்கு பேரளம் புகைவண்டி நிலையத்தில் இறங்க வேண்டும், புகை வண்டி நிலையத்திலிருந்து கோயில் கல் தொலைவில் இருக்கிறது.",False
1183,இது பாடல் பெற்ற தலம்.,False
1184,தேவாரப் பாடல் பெற்ற ஒரு கோயிலுக்குள் வேறு தேவாரம் பாடல் பெற்ற கோயில்களைக் காண்பது அரிது.,False
1185,ஆனால் தஞ்சை மாவட்டத்தில் பாடல் பெற்ற கோயில்களுக்குள் மேலும் பாடல் பெற்ற கோயில்கள் மூன்று இருக்கின்றன.,False
