Line Number,Sentence
695,அக்கடிதம் படித்த பிறகே தமையனார் உள்ளம் அமைதி அடைந்தது.
696,அவர் மாணவராயிருந்த பொழுதே பீகார் மாணவர் கழகத்தை நிறுவியர் பீகாரிகள் நலனுக்காகத் தொண்டாற்றியவர்.
697,ஆதலின் படித்த பீகாரிகள் அவரை நன்கறிந்திருந்தனர்.
698,அவர் வழக்கறிஞரானதும் பீகாரிகளின் வழக்குகள் பல அவரிடமே வரத் தொடங்கின.
699,அவர் கூறும் சட்ட நுணுக்கங்கள் நீதிபதிகளையும் வழக்கறிஞர்களையும் திணறச் செய்யும்.
700,அவர் வழக்கில் வாகை புனைவார்.
701,இராஜேந்திரர் இங்ஙனம் தொடக்க நிலையிலேயே பல வழக்குகளில் வெற்றி பெற்றமையின் வங்காளிகளும் அவரிடம் பலராக வரத்தொடங்கினர்.
702,"எனவே, அவரது தொழில் வளர்பிறை போல வளரலாயிற்று வருமானமும் பெருகத் தொடங்கியது."
703,"அதனால் அவரது குடும்பம், அவர் தமையனார் எதிர் பார்த்தாற்போல வறுமையின்றி வளம் பெற்று இன்பமாய் நடைபெற்று வந்தது."
704,பட்டம் இராஜேந்திரர் வழக்கறிஞரா யிருந்துகொண்டே எம்.
705,பட்டத் தேர்வுக்குப் படித்துவந்தார்.
706,முயற்சி திருவினையாக்கும் முயற்றின்மை இன்மை புகுத்தி விடும் என்பது அனுபவ வாக்கன்றோ?
707,"முயற்சியுடையார் இகழ்ச்சி யடையார் என்பதற்கிணங்க, அவர் ஆம் ஆண்டு நடைபெற்ற எம்."
708,தேர்வில் முதல் வகுப்பில் தேறிப் பல்லோர் பாராட்டுக்கும் உரியவரானார்.
709,பாடலியில் வழக்கறிஞர் தொழில் ஆம் ஆண்டில் பீகார் மாகாணத்தின் தலைநகரான பாடலியில் பாட்னாவில் உயர் நீதிமன்றம் புதிதாக ஏற்பட்டது.
710,ஆதலின் இராஜேந்திரர் கல்கத்தாவை விட்டுத் தமது மாகாண உயர் நீதி மன்றத்தில் தொழில் புரிய விரும்பிப் பாடலியிற் குடியேறினார்.
711,அங்கும் அவரிடம் வழக்குகள் வந்து குவிந்தன.
712,அவர் உயர் நீதிமன்ற வழக்கறிஞருள் சிறந்தவரெனப் பெயர் பெற்றார்.
713,காந்தியடிகளைச் சந்தித்தல் காந்தியடிகள் தென்னாப்பிரிக்காவிலிருந்து வந்து காங்கிரசிற் கலந்துகொண்டதும் இந்தியக் குடியானவர் நலன்களைக் கவனிக்கலானார்.
714,பீகார் மாகாணத்தில் சம்பரான் என்பது ஒரு பகுதி.
715,அங்குள்ள நிலங்களிற் பெரும்பகுதி நிலைத்த குத்தகைமீது ஐரோப்பியருக்குச் சொந்தமானது.
716,"வேலை செய்யலாம் எனின், உழைப்புக்கேற்ற ஊதியம் இல்லை."
717,உழவர்கள் கல்வியறிவு அற்றவர்கள் வாயில்லாப் பூச்சிகளாய் மனம் மாழ்கி அடிமைகளாக உழைத்து வந்தனர்.
718,அவ்வமயம் இராஜேந்திரர் வீட்டில் இல்லை.
719,"ஆயின், அவர் பின்னர்ச் சம்பரான் சென்று அடிகளுடன் கலந்து கொண்டார்."
720,காந்தியடிகள் ஐரோப்பியர் தூண்டுதலால் சம்பரானில் சிறை செய்யப்பட்டார்.
721,அவர் மீது வழக்குத் தொடரப்பட்டது.
722,"உழவர்க்கு நலன் விளைப்பதே நமது நோக்கம், என்றார்."
723,அவரது தந்நலமற்ற உரையைக் கேட்ட அடிகள் அகமகிழ்ந்து அவரைத் தழுவிக் கொண்டார்.
724,அன்று முதல் அடிகள் இராஜேந்திரரிடம் தனி மதிப்புக் கொள்ளலானார்.
725,"இங்ஙனம் அடிகள் சிறைப்படின், பலரும் பின்வரத் தயாராயிருந்த உண்மையை அரசாங்கத்தினர் உணர்ந்தனர் அடிகளை விட்டனர் வழக்கும் ஒழிந்தது."
726,உழவர் நிலையை ஆராய்ந்தறிய ஒரு குழு அமைப்புண்டது.
727,அடிகள் அக்குழுவில் ஓர் உறுப்பினராயிருந்தார்.
728,குழுவினர் உழவர் குறைகளை ஆராய்ந்து அறிக்கை வெளியிட்டனர்.
729,அதன் பயனாக உழவர் நலனைக் காக்க ஒரு சட்டம் பிறந்தது.
730,இத்தொண்டில் இராஜேந்திரர் தொடக்க முதல் இறுதி வரை அடிகளுடன் இருந்தார்.
731,அடிகள் அவருடைய நற்பண்புகளை நன்கறிந்து பாராட்டினார்.
732,பாடலியில் பல்கலைக் கழகம் பீகார் மாகாணத்துக்கெனத் தனிப் பல்கலைக் கழகம் நிறுவ இந்திய அரசாங்கம் ஒரு சட்டத்தைப் பிறப்பித்தது.
733,அப்பொழுது இந்திய அரசாங்கத்தின் கல்வி அமைச்சராய் இருந்தவர் சர்.
734,இந்திய அரசாங்கம் இராஜேந்திரர் கூறிய திருத்தங்களிற் பலவற்றை ஏற்றுக் கொண்டது.
735,பொதுமக்கள் நலனில் அவர் காட்டிய ஊக்கத்தை மற்றவரும் ஆதரித்தனர்.
736,அவர் விரும்பியவற்றுள் பல நடைமுறையில் ஏற்றுக்கொள்ளப்பட்டன.
737,இராஜேந்திரர் காங்கிரசில் தீவிரமாக ஈடுபடும் வரை அப்புதிய பல்கலைக் கழக வேலைகளில் தீவிரமாக ஈடுபட்டிருந்தார்.
738,அவரது தந்நலமற்ற சேவையை அரசியலாரும் பிற அறிஞர்களும் பாராட்டினர்.
739,அவரது பொது நலவுழைப்பால் அவர் பீகார் மாகாணத் தலைவருட் சிறந்தவரானார்.
740,உழவர் முதலிய மக்கள் அவரிடமே தம் வழக்குகளைக் கொணர்ந்தனர்.
741,பொருள் மிகுந்த வணிகரும் அவரையே நாடினர்.
742,அவர் தமது அலுவலில் பெரும் பொருள் ஈட்டினார்.
743,தொழிலைத் துறத்தல் ஆம் ஆண்டில் காந்தியடிகள் ஒத்துழையா இயக்கத்தைத் தொடங்கினார்.
744,"அஃதாவது, அரசாங்கத்த ருடன் ஒத்துழையாமைமாணவர் பள்ளிகளைத் துறத்தல், வழக்கறிஞர்கள் நீதிமன்றங்களைத் துறத்தல், சட்டசபை உறுப்பினர்கள் சட்டசபைகளைத் துறத்தல் என்பது."
745,இதனை நாடு முழுவதும் பிரசாரம் செய்யவேண்டும் என்று அடிகள் விரும்பினார்.
746,உண்மைத் தியாகம் இதுவன்றோ?
747,பள்ளிகளைத் துறந்த இளைஞர்க்காகப் பீகாரில் பெரிய கலாசாலை ஒன்று இராஜேந்திரர் உள்ளிட்ட காங்கிரஸ் காரரால் ஏற்படுத்தப்பட்டது.
748,அதன்கண் மாணவர் நாட்டுக் குரிய நன்முறையில் கல்வியும் கைத்தொழிலும் கற்றனர்.
749,இராஜேந்திரர் அக் கலாசாலையின் துணைத் தலைவராயிருந்து தொண்டாற்றி வந்தார்.
750,உரிமைப்போர் தீவிரமாக நடைபெறத் தொடங்கியவுடன் இல் அரசாங்கத்தார் அதனைக் கைப்பற்றி மூடிவிட்டனர்.
751,வாழ்க்கையில் மாற்றம் இராஜேந்திரர் காந்தியடிகளுடன் நெருங்கிப் பழகத் தொடங்கியது முதல் அவரது வாழ்க்கையில் பல மாற்றங்கள் உண்டாயின.
752,அவர் அந்த அறிவுரையைத் தம் மாகாண மக்கட்கு எடுத்துக் கூறினார் தம்மளவில் அனைவருடனும் வேறுபாடின்றிக் கலந்து உறவாடினார்.
753,இவ்வரிய செயல்களால் மக்கள் அவரைப் பீகார் காந்தி என்று போற்றலாயினர்.
754,மேனாட்டுச் செலவு இராஜேந்திரர் தம் வழக்கறிஞர் அலுவலைத் துறந்த பொழுது பெரிய வழக்கொன்று முடிவுபெறாதிருந்தது.
755,அதனை அறிந்த காந்தியடிகள் அவ்வழக்கை இறுதிவரை நடத்துமாறு கட்டளையிட்டார்.
756,அது ஆம் ஆண்டில் இங்கிலாந்தில் பிரிவி கவுன்சில் முன்பு விசாரணைக்கு வந்தது.
757,அப்பெரியார் காந்தியடிகளின் நண்பர்.
758,அவர் இந்தியாவினிடம் அன்பு கொண்டவர்.
759,அவர் நீண்ட நேரம் இராஜேந்திரரிடம் அளவளாவினார்.
760,அவரது சொற்பொழிவின் பிற்பகுதியில் சினங் கொண்ட சிலர் அவரைத் தாக்கி ஊறு விளைத்தனர்.
761,"அவர் இவ்வயல் நாட்டுச் செலவில் கதர் ஆடை, கதர்ச்சட்டை, கதர்க்குல்லாய் ஆகியவற்றையே அணிந்திருந்தார்."
762,"அவருடைய புதிய உடைகளைக் கண்ட ஐரோப்பியர் பலர், இஃதென்ன வேஷம்! என்று கேட்டனர் சிலர் எள்ளி நகையாடினர்."
763,"இராஜேந்திரர் அவர்கட்குக் கதர்த் தயாரிப்பு, அதன் நோக்கம் முதலியவற்றைத் தெளிவாக விளக்கினார்."
764,"சிறை வாழ்க்கை இராஜேந்திரர் இந்தியா மீண்ட பிறகு, காந்தியடிகள் இல் உப்புப் போரைத் தொடங்கினார்."
765,நாடு முழுவதும் உப்புப் போராட்டம் நடைபெற்றது.
766,தலைவர்களும் தொண்டர்களும் சிறை செய்யப்பட்டனர்.
767,"அந்த ஆண்டு, சூலைத் திங்களில் இராஜேந்திரரும் சிறைப்பட்டார்."
768,அவருக்கு ஆறு திங்கள் சிறை வாழ்க்கை கிடைத்தது.
769,"அவர் மெலிந்த உடலினர் காங்கிரஸ் இயக்க வேலைகளிலும் மிகுதியாக ஈடுபட்டவர் ஆதலின், காசநோய்க்கு இரையானார்."
770,அவர் அந்நோயால் சிறையில் துன்புற்றார்.
771,அரசாங்கத்தார் வேண்டிய மருத்துவ வசதிகளை அளித்தனர்.
772,"உரிமைப் போராட்டம் உச்சநிலையை அடைய அடைய, அரசாங்கமும் அடக்கு முறையை மிகுதிப் படுத்தியது அவரச் சட்டங்களைப் பிறப்பித்தது."
773,அந்தத்தாள் ஆயிரக்கணக்கில் செலவாயிற்று.
774,பீகாரில் நில அசைவு இராஜேந்திரர் சிறையில் காசநோயால் துன்புற்ற சமயம் இல் பீகாரில் கொடிய நில அசைவு உண்டானது.
775,தம் மாகாண மக்கட்கு ஏற்பட்ட அவதியினைச் சிறைக்கூடத்தில் இருந்த செம்மல் அறிந்தார்.
776,அவரது மனவேதனை மிகுதிப் பட்டது.
777,காசநோயும் மிகுதிப் பட்டது.
778,அரசாங்கம் நோயின் காரணமாக அவரை விடுதலை செய்தது.
779,ஒன்பது மாதங்களில் முப்பது லட்ச ரூபாய்கள் சேர்த்தார் நில அசைவால் துன்புற்ற மக்கட்கு ஏற்ற முறையில் உதவினார்.
780,பொது நல ஊழியரான அவர் சேர்த்த பெருந் தொகையைக் கண்டு இந்தியாவில் வியவாதார் இலர்.
781,அனைவரும் அவரது தந்நலமற்ற திருத்தொண்டைப் பாராட்டினர்.
782,அப்பொழுது காந்தியடிகள் இராஜந்திரரது பெருந் தொண்டினைப் பாராட்டி அறிக்கை விட்டனர்.
783,காங்கிரஸ் தலைவர் இராஜேந்திரரது தந்நலமற்ற தொண்டு இந்தியர் உள்ளங்களைக் கொள்ளை கொண்டது.
784,காங்கிரஸ்காரரும் அரசியலாரும் பொது மக்களும் அவரது பேரூழியத்தைபீகாரில் செய்த திருத்தொண்டினைப் பாராட்டினர்.
785,ஆயின் தம் ஊழியத்தைப்பற்றி உண்மையாகவே பெருமைப் படாதவர் இராஜேந்திரர்.
786,அவர் பிறர் பாராட்டுதலைக் கண்டு வெட்கினார் கடமையைச் செய்வதில் பாராட்டா? என்று எண்ணினார்.
787,அவரது அடக்கம் அனைவரையும் தன்பால் ஈர்த்தது.
788,ஆம் ஆண்டு அக்டோபர் ஆம் நாள் காங்கிரஸ் மாநாடு பம்பாயிற் கூடியது.
789,அதன் தலைவர் யார்?
790,நமது இராஜேந்திரரே ஆவர்.
791,அவர்கள் அனைவருக்கும் அம்மாகாணச் சார்பில் நான் நன்றி செலுத்துகின்றேன்..
792,மக்கள் சென்ற நான்காண்டுகளாகப் பெருந்தியாகங்களைச் செய்துள்ளனர் ஆயிரக்கணக்கானவர் சிறை சென்றனர் தடியடிபட்டனர்.
793,துப்பாக்கிக் குண்டுகட்கு இரையானவர் பலர் தண்டம் கட்டியவர் பலர் சொத்துக்கள் பறிமுதலானவர் பலர்.
794,"பலர் தம் உடல், பொருள், உயிர் என்னும் மூன்றையுமே இழந்தனர்."
795,அவர்கள் அனைவருக்கும் காங்கிரஸ் சார்பில் வணக்கமும் நன்றியும் கூறுகின்றேன்.
796,"உண்மையுடைமை, இன்னா செய்யாமை, நேர்மை என்னும் மூன்று கருவிகளுடன் நமது உரிமைக்கு நாம் போராடுகின்றோம்."
797,"அவர் ஒரு கூட்டத்தில், தீண்டாமை இருக்கும் வரை இந்து மதம் தூய சமயமாகக் கருதப்படாது."
798,"தீண்டத்தகாதவர் நம்மவர்இந்துக்கள் என்பதை நீங்கள் உணர்ந்து, அவர்களோடு பழகி, அவர்களை மேனிலைக்குக் கொண்டு வரப் பாடுபடல் வேண்டும்."
799,இந்த நாட்டில் ஏறத்தாழ ஏழு கோடி தீண்டப் படாதவர் இருக்கின்றனர்.
800,இவர்களே இந்நாட்டு வயல்களில் வேலை செய்பவர்கள் நமக்கு வேண்டுவன விளைத்துத் தருபவர்கள்.
801,இவர்கள் இல்லை எனில் நமக்கு உணவுப் பொருள்கள் இல்லை.
802,"நமக்கு உணவு தரும் இப் பெருமக்களுக்கு நாம் நன்றி கூறி, அவர்தம் வாழ்க்கைத் தரத்தை உயர்த்த வேண்டும்."
803,இல் மாகாண சுயாட்சி வழங்கப் பெற்றதும் காங்கிரஸ்காரர் தேர்தலில் ஈடுபட்டனர் பல மாகாணங்களில் வெற்றி பெற்றனர்.
804,சென்னையில் மாகாணக் காங்கிரஸ் தலைவரான இராஜ கோபாலாச்சாரியார் முதல் அமைச்சரானார்.
805,அங்ஙனம் பதவி வேண்டா என்று உண்மையாய்க் கூறும் தியாகிகள் மிகச் சிலரேயாவர்.
806,"அறிஞர், இராஜந்திரரது தியாகத்தைப் பாராட்டினார்."
807,காங்கிரஸ் தலைவர் இல் இரண்டாம் உலகப் போர் தொடங்கியது.
808,பிரிட்டிஷ் அரசாங்கம் போரிற் கலந்தது.
809,"அவ்வமயம் சுபாஷ் சந்திர போஸ், நாம் பிரிட்டிஷாரை இந்தியாவிலிருந்து விரட்ட நமது உரிமைப் போராட்டத்தை வலுப்படுத்த வேண்டும், என்றார்."
810,"இச்சமயத்தில் அவர்களை எதிர்த்தல் அறமாகாது, என்று அடிகள் கூறினார்."
811,உடனே காங்கிரசில் இரண்டு கட்சிகள் தோன்றின.
812,ஒன்று அடிகளை ஆதரித்தது மற்றொன்று போஸை ஆதரித்தது.
813,இந்த இரண்டு கட்சிகளையும் ஒன்றுபடுத்தக்கூடிய ஒருவர் அப்பொழுது காங்கிரஸ் தலைவராதல் நல்லது என்று அடிகள் கருதினார்.
814,இருதிறத்தாரும் ஏற்கத்தக்க நிலையில் இருந்த உத்தமர் இராஜேந்திரர் ஒருவரே.
815,ஆதலின் அனைவரும் இராஜேந்திரரைக் காங்கிரஸ் தலைவராக ஏற்றுக் கொண்டனர்.
816,இராஜேந்திரரது ஒப்புயர்வற்ற தனித்தன்மைக்கு இது சிறந்த எடுத்துக்காட்டு அல்லவா?
817,அவர் தலைவராயிருந்த வரையில் இரு கட்சிகளும் ஓரளவு பிணக்கின்றிக் காலம் தள்ளின.
818,சிறைப்படல் போரில் ஆங்கிலேயருடன் ஒத்துழைக்கலாகாது என்று காங்கிரஸ் பேரவை தீர்மானித்தவுடன் இல் காந்தியடிகள் உட்படப் பலர் சிறைப்பட்டனர்.
819,அவருள் இராஜேந்திரரும் ஒருவராவர்.
820,ஆம் ஆண்டு ஆகஸ்டு மாதம் ஆம் நாள் காங்கிரஸ் செயற்குழு பம்பாயிற் கூடியது.
