Line Number,Sentence
1592,இக்கருங்குளத்திலுள்ள இராச சிம்மேகச் சுரத்திற்குத் திருவாங்கூர் மன்னரும் திருப்பணிச் செய்துள்ளன ரென அவ்வூர்க் கல்வெட்டு .,False
1593,கூறுவது பற்றி அவ்வூர்க்குச் சேரர் தொடர்பும் உண்டென உணரலாம் என்பது முடிபாம்.,False
1594,செல்வக் கடுங்கோ ஆடு கோட்பாட்டுச் சேரலாதன் இறந்தபின் உதியஞ்சேரல் வழி காலற்றது.,False
1595,அதனால் பொறையர் குடியில் சிறந்து விளங்கிய அந்துவஞ்சேரல் இரும்பொறையென்பான் சேரவரசுக்குரியனானான்.,False
1596,அக்காலத்தே ஒரு தந்தை எனும் வேளிர் தலைவன் சிறப்புற்று விளங்கினான்.,False
1597,அவன் மகள் பொறையன் தேவி என்பாளை அந்துவன் மணந்து கொண்டு இனிதிருந்தான்.,False
1598,அந்துவன் நுண்ணிய நூல் பல கேட்டுச் சான்றோர் பரவும் நல்லிசைப்புலமை சிறந்தவன்.,False
1599,திருப்பரங்குன்றத்து முருகன் பால் தனித்த பேரன்பு அந்துவற்கு உண்டு.,False
1600,அவன் ஒருகால் திருப்பரங் குன்றம் போந்து முருகனைப்பரவி அவனுடைய பரங்குன்றத்தைத் தமிழ் நலம் கனியப் பாடினார்.,False
1601,அதனால் பரங்குன்றம் சான்றோர் பாடிப்புகழும் பண்பு மேம்பட்டது.,False
1602,அதனை மகளிர் கொண்டையில் வைத்து அணிசெய்து கொள்வர்.,False
1603,"சந்தன மரங்களாலும், சுனையிற்பூத்த செங்கழு நீராலும் தண்ணிதாய் விளங்கும் தண்பரங் குன்றம் அந்துவன்பாடிய அருமையுடையது.",False
1604,அகம் என்று பாராட்டியுள்ளார்.,False
1605,இவனது நல்லிசைப் புலமையை வியந்தே பதிற்றுப்பத்து ஏழாம் பதிகம் நெடுநுண் கேள்வி அந்துவன் என்று சிறப்பித்துக் கூறுகின்றது.,False
1606,இவ்வண்ணம் செந்தமிழ்ப் புலமையும் நல்லிசையும் பெற்றுச் சேரவரசனாகத் திகழ்ந்த அந்துவஞ்சேரல் புலவர் கூட்டத்தைப் பெரிதும் விரும்பினான்.,False
1607,அந்நாளில் தமிழகத்தில் வாழ்ந்த சான் றோர் பலரும் அவன்பால் சென்று அவனுடைய புலமை நலத்தை நுகர்ந்தனர்.,False
1608,அவன் இரவலர்க்கு வேண்டுவன ஈத்து இறவாப் புகழ்படைத்திருந்தான்.,False
1609,அவனிடம் பெருநட்புற்று ஒழுகிய தமிழ்ச் சான்றோருள் ஏணிச் சேரி முடமோசி யார் என்பவர் சிறந்து விளங்கினார்.,False
1610,அவர் அடிக்கடி ஆய் அண்டிரலைப் பாடிப் புலமைப்பயன்பபெற்று மகிழ்ந்தார்.,False
1611,முடமோசி யார் ஆய்குடியில் இருந்து வருகையில் அந்துவஞ்சேரலைக் காண விரும்பி அவனுடைய சேரநாட்டு வஞ்சி நகர்க்குச் சென்றார்.,False
1612,மோசியார் வரக்கண்ட அந்துவனும் அவரை அன்போடு வரவேற்றுச் சிறப்பித்தான்.,False
1613,அவனது வஞ்சி நகர்க்கண் வேண்மாடம் என்பது ஒரு சிறந்த மாளிகை.,False
1614,வேளிர்வேந்தர்கட்கும் சேரர்கட்கும் பெண் கொடுத்துப் பெண் வாங்கும் பெருந்தொடர்பு உண்டென்பதை முன்பே கண்டிருக்கின்றோம்.,False
1615,அவ்வேளிர்கள் வஞ்சி நகர்க்குவரின் அவர்கள் தங்குதற்கென ஒரு பெருமாளிகை இருந்தது.,False
1616,இது வஞ்சி நகர்க்கு வடமேற்கில் கடற்கரையைச்சார இருந்தது.,False
1617,இந்த மாளிகையில் வேணாட்டிலிருந்து வந்த முடமோசியாரை அந்துவன் இருத்தி அவர்க்கு வேண்டும் சிறப்புகளைச் செய்தான்.,False
1618,அக்காலத்தே சேரமானுக்கும் உறையூரிலிருந்து ஆட்சி செய்த சோழன் முடித்தலைக் கோப்பெருநற்கிள்ளிக்கும் எக்காரணத் தாலோ பகைமையுண்டாயிற்று.,False
1619,அதனால் சோழ வேந்தன் பெரும் படைசூழ்வரக் கொங்குநாடு கடந்து சேர நாட்டு வஞ்சி நகரடைந்து முற்றுகை செய்திருந்தான்.,False
1620,சேரர் படையும் சோழர் படையும் கைகலந்து போர்செய்து கொண்டிருந்தன.,False
1621,அந்துவஞ்சேரல் மோசியாருடன் வேண்மாடத்து மேலிருந்து போர் நிகழ்ச்சியை நோக்கிக் கொண்டிருந்தான்.,False
1622,இந்நிலையில் சோழன்களிறொன்றின்மேல் இவர்ந்து கருவூர் நோக்கிச் சென்றான்.,False
1623,வேலேந்திய வீரர் பலர் அவனைச் சூழ்ந்து சென்றனர்.,False
1624,இக்கருவூர் இப்போது கருவூர்ப்பட்டினமென்ற பெயரால் வஞ்சியாகிய கொடுங்கோளுர்க்கு வடக்கில் கண்காணும் எல்லையில் உள்ளது.,False
1625,இதனை யவன ஆசிரியர்கள் கரவுரா என்று குறிக்கின்றனர்.,False
1626,சோழன் ஏறிச் சென்ற களிறு திடீரென மதம்பட்டுப் பக்கத்தே வரும் பரிக்கோற்காரர்க்கு அஞ்சாது மருண்டு செல்லத் தொடங்கிற்று.,False
1627,"மேலிருக்கும் வேந்தன் அதனை அடக்க முயன்றும், அஃது அடங்க வில்லை.",False
1628,வேல்வீரர் பலர் தன்னைச் சூழ இருப்பதையும் எண்ணாது அக்களிறுமதம் செருக்கி மறலிச் சென்றது.,False
1629,களிற்றின் உயர்வும் வேந்தன் விருப்பும் வேல்வீரர்களை அதற்குத் தீங்கு செய்ய வொட்டாது தடுத்தன.,False
1630,அதனால் அக்களிறு சேரர்படை நின்று காக்கும் கருவூர் எல்லையை நோக்கிப் போய்க் கொண்டிருந்தது.,False
1631,அதனை அந்துவந்சேரல் கண்டான்.,False
1632,"யானைமேற் செல்பவன் சோழர்தானை மறவன் என்று கண்டானேயன்றி, அவன் சோழ வேந்தன் என்பதைச் சேரமான் அறிந்திலன்.",False
1633,அவனது போர்க் கோலத்தை நோக்கினான்.,False
1634,அவன் உள்ளத்தே ஓர் ஐயம் பிறந்தது.,False
1635,"மோசியாரைப்பார்த்து, இதோ களிற்றின்மேல் கருவூரிடம் செல்லுவோன் யாவனாகும்? என்று வினவினான்.",False
1636,காற்றினும் கடுகிச்சென்று களிற்றின்மேல் பாய்ந்து அதன் செருக்கடக்கிச் சோழனை உய்வித்து மீண்டான்.,False
1637,"சோழன் முடித்தலைக் கோப்பெருநற்கிள்ளி, சேரமானது அறந்திறம்பா மறப்பண்பை வியந்து பகைமை நீங்கி நட்பால் பிணிப்புண்டான்.",False
1638,இச்செயலால் மடியாவுள்ளமொடு மாற் றோர்ப்பிணி நெடுநுண்கேள்வி அந்துவன் என்று சான்றோர் பாராட்டியுள்ளனர்.,False
1639,அவன்பால் நெருங்கிய நட்புக் கொண்டு ஒழுகிய சான்றோர்களில் கபிலர் என்பவர் சிறந்தவராவர்.,False
1640,அவரது நல்லிசைப் புலமையில் வேள்பாரிக்கு மிக்க அன்புண்டா யிற்று.,False
1641,அதனால் கபிலரும் அவனைப் பிரிய மனமின்றி அவ னோடே உயிர்த்தோழராகவும் அரசியற் சுற்றத்தாராகவும் இருந்து வந்தார்.,False
1642,அவன் முல்லைக்குத் தேரீந்து இறவாப்புகழ்பெற்ற செய்தியைப் பாட்டிடை வைத்து நிலைபெறச் செய்தார்.,False
1643,வேள்பாரி இறந்த பின் அவர் கையற்றுப்பாடிய பாட்டுக்கள் இன்றும் புற நானூற்றில் இருந்து படிப்போர் நெஞ்சை உருக்கி நிற்கின்றன.,False
1644,வேள்பாரி இறக்குங்கால் அவனுக்கு மகளிர் இருவர் இருந்தனர்.,False
1645,அவர்களை மணஞ்செய்து தரவேண்டிய பொறுப்பைக் கபிலரே மேற் கொண்டு சில வேந்தர்களை வேண்டினார்.,False
1646,"அவர்கள் மறுக்கவே, அம்மகளிரைத் திருக்கோவலூர்க்குக் கொண்டுசென்று பார்ப்பாரிடை அடைக்கலப் படுத்திவிட்டுத் தமிழ் வேந்தர்களைக் காணச்சென்றார்.",False
1647,அப்போது அவர்க்குச் சேரநாட்டு வேந்தனான செல்வக் கடுங்கோ வாழியாதன்புகழ் தெரியவந்தது.,False
1648,அவ்வேந்தனைக் காணவிரும்பிக் காடுமலைகளைக் கடந்து சேரநாடு வந்துசேர்ந்தார்.,False
1649,கபிலர் சேரநாடு வந்தபோது செல்வக்கடுங்கோ வஞ்சி நகரில் இல்லை.,False
1650,நாட்டில் நடந்த போர் ஒன்று குறித்துச் சென்று பாசறை இட்டிருந்தான்.,False
1651,போர்வினை முடிந்தது.,False
1652,"பாசறைக் கண், தோற்ற வேந்தர் பணிந்து திறைநல்கினர்.",False
1653,அத்திருவோலக்கம் நோக்கிக் கபிலர் வந்துசேர்ந்தார்.,False
1654,அவரது வருகைகேட்ட சேரமான் வியப்பும் மகிழ்ச்சியும் மீதூர்ந்து அவரை அன்புடன் வரவேற்று இனிய சொல்லாடி இன்புற்றான்.,False
1655,என்றோரு சொல்லைத் தன் உண்மையன்பு விளங்க எடுத்துரைத் தான்.,False
1656,என்னைக் காத்தளிக்க வேண்டுமென இரந்து குறை நிற்கயான் வந்தேனில்லை.,False
1657,அந்த நல்லிசையே என்னையீர்த்துக் கொண்டு வந்து நின்னால் வீழ்த்தப்பட்ட களிறுகளின் புலால் நாறும் இப்பாசறைத் திருவோலக்கத்திற் சேர்த்துளது.,False
1658,அதனால் வந்துளேன்.,False
1659,பதிற் என்று ஓர் இனிய பாட்டால் இசைத்தனர்.,False
1660,"அப்பாட்டின் சொன்னலமும், பொருணலமும் கடுங்கோவின் உள்ளத்தை அவர்பால் பிணித்து விட்டன.",False
1661,அவரைத் தன்னோடே இருக்குமாறு வேண்டி வஞ்சி நகர்க்கு அழைத்துச் சென்றான்.,False
1662,அது பூப்போல மென்மையுற்றிருப்பது அவனுக்குப் புதுமையாக இருந்தது.,False
1663,"அதனால் அவன் கபிலரை நோக்கி, நும்முடைய கைமென்மையாக இருக்கிறதே, என் கை அவ்வாறன்றி வன்மையாக இருக்கின்றதே, என்று சொன்னான்.",False
1664,"அவன் நின்னுடைய என்னாது, நும்முடைய கையெனப் பன்மையிற் கூறியதனால், தன்னையும் தன்னையொத்த பாவலரையும் குறித்ததாகக் கொண்டு.",False
1665,உவகை மிகுதியால் கடுங்கோ உள்ளம் நாணி முறுவலித்தான்.,False
1666,சேரமான் அரச காரியத்தில் ஈடுபட்டிருக்குங்கால் கபிலர் சேரநாட்டைச் சுற்றிப்பார்த்து வந்தார்.,False
1667,"அந்நாட்டின் மலை வளமும், காட்டு வளமும், நிலவளமும், கடல் வளமும், அவர்க்கு மிக்க இன்பத்தைச் செய்தன.",False
1668,கடலிலிருந்து கொணரப்பட்ட முத்துக்களைப் பந்தர் என்னும் ஊரவர் தூய்மைசெய்து மேன்மையுறு வித்தனர்.,False
1669,கொடுமணமென்னும் ஊரினர் அவற்றைக் கொண்டு அருங்கலங்கள் செய்யக்கண்டார்.,False
1670,"முரம்பு நிலப்பகுதியில் பிடவமும், முல்லையும் பூத்து அழகிய காட்சியளித்தன.",False
1671,அங்கு வாழ்பவர் அந்நிலத்தையுழுங்கால் உழுத சரவின் கண்மணிகள் பல கிடைக்கப் பெற்றனர்.,False
1672,களிமயக் குற்ற சிலர் தாம் தலையிற் சூடிய ஆம்பற்கண்ணியில் மொய்க்கும் வண்டினையோப்பினர்.,False
1673,அப்போது அவர் சேரமானை இரந்து நின்று.,False
1674,இடம் சிறிது என்னும் அவ்வுரை கேட்டெழுந்த வூக்கத்தால் வஞ்சிசூடி கொங்குநாட்டிற்குட் சென்றான்.,False
1675,அங்கு வாழ்ந்த வேந்தர் நாட்டில் நல்லரசு புரியாது மக்களை அல்லற் படுத்தினர்.,False
1676,அவரோடு அறம் திறம்பாவகையிற் போர்செய்து வெற்றி கொண்டான்.,False
1677,அப்போது அவன் பாசறைக் கண் தங்கியிருந்தபோது கபிலர் சில சான்றோர் உடன் வரச் சென்று கடுங்கோவைக் கண்டார்.,False
1678,அவன் அவரை இனிது வரவேற்று இன்புற்றான்.,False
1679,அவரும் மிக்க மகிழ்ச்சி கொண்டு பகைவரால் கெட்ட குடிமக்களை நல்வாழ்வு பெறுவித்த வேந்தே.,False
1680,அப்பாசறைக் கண் தோற்ற வேந்தர் பலர் சூழ்ந்திருந்தனர்.,False
1681,பாணரும் கூத்தரும் போந்து குதிரை பூட்டிய தேர்கள் பல பரிசிலாகப் பெற்றுச் சென்றனர்.,False
1682,அதனைக் கண்டு பெருமகிழ்வு கொண்டார் கபிலர்.,False
1683,"அதனைக் கண்டிருக்கையில், ஒரு நாள் வெயிலது வெம்மை மிக்குறக் கண்டார் கபிலர்.",False
1684,அவர் கருத்தறிந்த வேந்தன் தன் நகர்க்குத் திரும்பினான்.,False
1685,"வாகைசூடி, சிறக்கும் தானை மகிழ்ச்சியுடனே மீண்டது.",False
1686,வேந்தன் வஞ்சிநகர்க்கண் இருக்கையில் வேனிற் காலம் வந்தது.,False
1687,கடுங்கோ பேரியாற்றங்கரையில் நிற்கும் நேரி மலைக்கு அரசியற் சுற்றம் சூழச் சென்று தங்கினான்.,False
1688,மலைவாணர் இனியவும் அரியவுமாகிய பொருள்களைக் கொணர்ந்து தந்து மகிழ்வித்தனர்.,False
1689,இங்கே அவனது திருவோலக்கத்துக்குக் கபிலர் வந்துசேர்ந்தார்.,False
1690,அவ்விடத்தே பாணரும் பிற பரிசிலரும் இசையும் பாட்டும் கூத்தும் நிகழ்த்தி மிக்க பெரும் பரிசில்களைப் பெற்று மகிழ்ச்சி கொண்டனர்.,False
1691,சின்னாட்கள் கழிந்தது கபிலருக்கு மலையமானாடு செல்வதற்கு எண்ண முண்டாயிற்று.,False
1692,மேலைக் கடற் கரையில் கோழிக்கோட்டுப் பகுதியில் பாலிக்குன்று என்ற பெயருடன் இருக்கும் பேரூர் குடநாட்டைச் சேர்ந்திருந்ததோரூர்.,False
1693,அதன் தமிழ்ப் பெயர் பாலிக்குன்று என வரும்.,False
1694,இது பண்டை நாளில் குன்றின் கட்பாலியென வழங்கிற்று.,False
1695,அங்கே ஆதனென்றொரு சான்றோர் வாழ்ந்தார்.,False
1696,அவரைக் குன்றின் கட்பாலியாதனார் என வழங்கினர்.,False
1697,குன்றின் கட்பாலி என்பது ஏடெழுதுவோரால் குண்டுகட்பாலி எனத் திரிக்கப் பட்டது.,False
1698,அவர் அந்நாளில் விளங்கிய நல்லிசைச் சான்றோருள் ஒருவர்.,False
1699,அவர் ஒருகால் செல்வக் கடுங்கோவைக் காண்டற்கு வஞ்சி நகர் வந்து சேர்ந்தார்.,False
1700,அவரோடு கிணைப்பொருநரும் உடன் வந்தனர்.,False
1701,அவர்கட்கு அவனது புகழ் பாடிய பாட்டொன்று தந்து பாடச் செய்தார்.,False
1702,இவன் இருபத்தைந்தாண்டு அரசு வீற்றிருந்தான்.,False
1703,இவனது ஆட்சியின் இருபத்தைந்தாமாண்டில் பாண்டி வேந்தன் ஒருவன் கடுங்கோவைப் பகைத் தொழுகினான்.,False
1704,அது தெரிந்ததும் சேரமான் பெரும் படைகொண்டு பாண்டி நாட்டிற்குச் சென்றான்.,False
1705,தென் புறம்பு நாட்டின் கீழ்ப் பகுதியில் இருக்கும் சிக்கல் என்னுமிடத்தே இருவர் படைகளும் கை கலந்து போர் செய்தன.,False
1706,அக்காலைப் பகைவர் எறிந்த வேலொன்று கடுங்கோவின் மார்பிற்பட்டுப் பெரும் புண்செய்தது.,False
1707,அவன் அங்கேயே தன் உயிர்கொடுத்து உலவாப் புகழ் பெற்றான்.,False
