Line Number,Sentence
1201,துறவு நெறியும் அவருக்குக் கைகூடுவ தாயிற்று.
1202,"துறவின்கண் நின்ற திருவள்ளுவர், பற்றற்றா னாகிய மெய்ப் பொருளை யுணரத்தொடங்கினார்."
1203,எப்பொருள் எத்தன்மைத் தாயினும் அப்பொருளின் மெய்ம்மைத் தொடர்பு காண்பதே அறிவெனக் கண்டார்.
1204,இதனை நன்கறிந்த பிற்காலத்தே தோன்றிய மெய்கண்டதேவரும் உயிரை உள்ளம் என்றே வழங்கினார்.
1205,"உடம்போடு கூடியிருந்தே இதனைச் செய்து சிறந்தமை யான், பொருட்சார்புகளாகிய உடம்புலகுகளால் உண்டாகும் நோய்கள் தம்மைச் சாரா தொழிவது கண்டார்."
1206,சார்புணர்ந்து சார்புகெட வொழுகின் மற்றழித்துச் சார்தாரா சார்தரும் நோய் என்று அறிவுறுத்தினார்.
1207,"அதனை அறுத்தற்குரிய எளியவழி, இறைவனை வாழ்த்தி வணங்குவதே எனத் தேர்ந்தார்."
1208,இவ்வாறு மெய்யுணர்ந்து அவா வறுத்தொழுகுங் காலத்தில் இத் திருக்குறளை எழுதலுற்றார்.
1209,அதனால் முதற்கண் கடவுளை வாழ்த்தும் வாழ்த்தினைக் கூறினார்.
1210,இவ்வாறு வாழ்வோர் ஏனையுயிர்கள் இன்புற்று வாழ்வதையே விரும்பி அதற்கேற்ற பணியினைச் செய்வர்.
1211,"அதற்கு அவ்வுயிர்களால் நினைத்தபடியே பெற்றுக்கொள்ள முடியாதது மழையாதலால், பின்பு மழையைக் கூறினார்."
1212,இவற்றையெல்லாம் ஆராய்ந்து கண்டுரைக்கும் ஆற்ற லுடையார் துறவுநெறி நின்று நீத்த பெருமை யுடையோர்.
1213,அவர் பெருமையை மழை யினையடுத்துக் கூறி அறத்தைப் பொதுவகையில் எடுத்தோதி வலியுறுத்தருளினார்.
1214,ஊழ் அறம்பொருள் இன்பம் என்ற முத்திறத்து வாழ்விலும் சில நிகழ்ச்சிகள் காரணம் தெரியாமலே உளவாதலைத் திருவள்ளுவர் கண்டார்.
1215,மேலே கூறிய நிகழ்ச்சிகள் இவ்வாராய்ச் சியால் விளக்கம் பெறாதொழிந்தன.
1216,பூத்து மணஞ்செய் செயலை ஊழ்த்தல் என்பது தமிழ் வழக்கு.
1217,"இணரூழ்த்தும் நாறா மலரனையர் எனத் திருவள்ளுவரும், பூத்து மணங்கமழச் சமைந்த அரும்பினை ஊழ்முகை நற்."
1218,"எனவும், மணங்கமழ்ந்து வயங்கும் பூவை ஊழுறுபூ நற்."
1219,எனவும் சான்றோரும் வழங்குவது காண்க.
1220,"பயனை நோக்க, வினை காலத்தால் முற்படுவதால், காரணம் புலப்படாது நிகழும் வினைப்பயன்கள் ஒருவருடைய முன்னை வினைப்பயன் எனவும் வழங்கப்பட்டன."
1221,"இவ்வாறு, வினையுணர்வு தோன்றிக் கற்றார் கல்லாதார் என்ற இருதிறத் தாரிடையிலும் நன்கு பரவியிருந்த காலம் சங்ககாலம்."
1222,யாம் செய் தொல்வினைக் கெவன் பேதுற்றனையெனப் பேசும் நல்லந்துவனார் முதலிய சான்றோர் இருந்த காலம் அச்சங்க காலம்.
1223,"பெருஞ் செல்வ முடையவரொருவர் நுகரக்கடவ நுகர்பொருள் முற்றவும் நிரம்பப் பெற்றுண்ணும் பீடுடையராயிருந்தும், நுகராது வருந்தக் கண்டார்."
1224,இவர்கள் செயல்களெல்லாவற்றிற்கும் ஊழ்வினையே காரணமாவது உணர்ந்து நம்மனோரறிய எடுத்துரைத்தார்.
1225,"திருவள்ளுவரைப் பற்றிய கதைகள் புலவர் புராணம் கூறும் கதை திருவள்ளுவர், ஒளவையார் முதலிய நல்லோர் சிலருடன் பிறந்தவர்."
1226,இவருடைய தந்தை பகவன் என்னும் பார்ப்பனர்.
1227,தாய் ஆதியென்னும் பெயரினர்.
1228,பகவனார் பிரமன் அங்கிசத்தினர் ஆதியார் கலைமகள் அங்கிசத்தினர்.
1229,இவ்விருவருக்கும் மக்கள் எழுவர் பிறந்தனர்.
1230,"அவருள் ஆண் மக்கள் மூவர் அவர், வள்ளுவன், கபிலன், சேரமான் என்போராவர்."
1231,"பெண் மக்கள் நால்வர் அவர் உப்பை, உறுவை, ஒளவை, வள்ளி எனப்படுவர்."
1232,"இம் மக்கள் எவ்வெவ்விடங்களிற் பிறந்தார்களோ, அவ்வவ்விடத்திலேயே அவர்களை அன்பின்றி விட்டேகுவது பெற்றோராகிய பகவனும் ஆதியும் மேற்கொண்டிருந்த கொள்கை."
1233,"பிள்ளை திருமணத்துக்குரிய செவ்வியெய்தியபின், அவருக்கு வாசுகி என்னும் அரிய பெண்ணொருத்தியை மணம் செய்தனர்."
1234,சின்னாட்களில் வேளாளனும் அவன் மனைவியும் சிவனடியைச் சேர்ந்தனர்.
1235,திருவள்ளுவர் தம் மனைவியோடு கூடி முனிவரும் வியக்கு மாறு இல்லறம் புரிந்துவந்தார்.
1236,வாசுகியும் தன் ஒழுக்கத் தால் கற்புக்கெல்லையாய்ச் சான்றோரால் கருதப்பெறும் பெரும் பேறு பெற்றனர்.
1237,இவ்வாறு வள்ளுவர் கற்புச் சிறந்த வாசுகியாரோடு வாழ்ந் திருந்த இடம் மயிலாப்பூர்.
1238,அக்காலத்தேதான் அவர் திருக்குறள் நூலைச் செய்தார்.
1239,இதனோடு சோதிடம் முதலிய தூய நூல்கள் சிலவற்றைத் திருவள்ளுவர் செய்தாரெனப் புலவர் புராணம் கூறுகிறது.
1240,என்ன பாட்டெவர்சொன்னாலும் இதுபழம் பாடல் என்னப் பன்னலும் எழுதிக் காட்டும் படிறும் பிற தீச்செயலும் அவர்கள் மேற்கொண்டிருந்தனராம்.
1241,வள்ளுவர் அதனையறியாது தாம் எழுதியருளிய திருக்குறளை எடுத்துக் கொண்டு மதுரைத் தமிழ்ச் சங்கத்தில் அதனை அரங்கேற்றக் கருதிச் சென்றார்.
1242,செல்லுங்கால் வழியில் ஒருநாள் பெருமழை பொழிந்தது.
1243,திருவள்ளுவர் வழியருகே நின்ற ஆலமர மொன்றின் அடியில் ஒதுங்கிநின்றனர்.
1244,அங்கே அவர்க்கு முன்னே ஒருவன் வந்திருந்தான்.
1245,அவன் பெயர் இடைக்காடன் என்பது.
1246,"அவ் விடைக்காடன், புத்த கத்துப் பேயா சிற்றிலையின் கீழ்வா, என்று பேரொலி செய்து அழைத்தான்."
1247,வள்ளுவரும் அங்கே சென்றார்.
1248,சிறிதுபோதில் மழையும் நின்றது.
1249,"அவற்கு வள்ளுவர், முற்ற யாவையும் மொழிந்துளேன், என்று மொழிந்தார்."
1250,"இருவரும் சிறிதளவு சென்றதும்,."
1251,வழியில் ஒளவையார் வரக்கண்டு அவர்பால் தங்கள் கருத்தை வெளியிட்டனர்.
1252,அவரும் தான் மதுரைக்குச் செல்வதாகத் தெரிவித்தார்.
1253,பின்பு மூவரும் மதுரை மூதூரைச் சென்று சேர்ந்தனர்.
1254,"மதுரையில் சங்கத்தைச் சார்ந்த சான்றோர் சிலர் இம்மூவரையும் நோக்கி, நீவிர் எந்த ஊர்? என்று கேட்டனர்."
1255,என்று விடையிறுத்தார்.
1256,"பின்பு அவர்கள் வள்ளுவரை நோக்கி, நீவிர் யார்? என்று வினவ, அவர், யான் வள்ளுவன், என்றார்."
1257,"என்றலும், அவர்கள் சற்றும் மதிப்பின்றி, குலைக்குந்தன்மை கொள்ளுதிகொல்லோ? என இகழ்ந்தனர்."
1258,"அவ்விகழ்ச்சியைப் பொருளாகக் கொள்ளாத வள்ளுவனார், குலைக்கவே வந்தேன், என்றார்."
1259,பின்னர் அவர்கள் இடைக்காடனை நோக்கினர்.
1260,இவ்வாறே ஒளவையாரும் பாட்டுக்கள் பாடிச் சங்கப்புலவரின் தருக்கை யழித்தனர்.
1261,"இனி, சங்கப்புலவர்கள் திருக்குறளின் சீர்மை காண்டல் வேண்டித் தாமிருந்த சங்கப்பலகையின் மேலே அதனை வைத்தனர்."
1262,அப்பலகை அவ்வொரு நூலுக்குமட்டில் இடம் தந்து அப்புலவர் களைக் குளத்தில் வீழ்த்திற்று.
1263,அதுகண்டு வியப்புற்ற சங்கப் புலவர்கள் திருக்குறளை வியந்து தனித் தனியே ஒவ்வொரு பாட்டுப் பாடி வள்ளுவரை வாழ்த்தினர்.
1264,அது போது திருவாலங் காட்டில் கூத்தப் பெருமானான இறைவன் காளியொடு வாதக் கூத்து இயற்றி மேம்பட்டான்.
1265,"இறைவனார், நீவிர் திருமயிலை சென்று திருவள்ளுவரைக் கண்டு தெளிந்து வருக, எனப் பணித்தார்."
1266,அவர்களும் மக்களுருக்கொண்டு திருவள்ளுவர் மனைக்குச் சென்றனர்.
1267,அங்கே அற்புதங்கள் பல நடந்தன.
1268,"ஒருநாள் திருவள்ளுவர் பழையது உண்ணுங்கால், தம் மனைவியை நோக்கி, பெண்ணே!"
1269,"இது சுடுகிறது, விசிறி கொணர்க, என்றார்."
1270,வாசுகியார் மறுத்தொன்றும் கூறாமல் விசிறி கொணர்ந்து விசிறினார்.
1271,அப்போது பழஞ்சோற்றில் ஆவி கிளம்பிற்று.
1272,"வேறொரு நாள்வாசுகியார் தண்ணீர் முகத்தற்குக் கயிற்றில் குடமொன்றைக் கட்டிக் கிணற்றில் இட்டிருக்கையில், திருவள்ளுவர் அவரை யழைத்தார்."
1273,மனைவியார் கயிற்றை அங்ஙனே விட்டுவிட்டு வந்தார்.
1274,கிணற்றிற் பாதியளவில் வந்திருந்த குடம் அவர் திரும்பி வருமளவும் அந்தரமாய் நின்று கொண்டிருந்தது.
1275,"இச் செயல்களைக் கண்ட தேவர்கள், வாசுகியாரின் கற்புநலம் கண்டு வியந்து பாராட்டித் தாம் வந்த கருத்தைத் திருவள்ளுவர்க்குத் தெரிவித்தனர்."
1276,தேவர்கள் அதனால் மனந்தேறித் தம் தேவவுலகு சென்று சேர்ந்தனர்.
1277,சிறிது காலத்துக்குப்பின் ஏலேலசிங்கன் என்னும் செட்டி ஒருவன் திருவள்ளுவரைக் குருவெனக்கொண்டு அருளுரை பெற்று உய்தி பெற எண்ணி வந்தான்.
1278,அவனை வள்ளுவர் பலவகையால் ஆராய்ந் தார்.
1279,ஒருநாள் அவர் அவனை ஒரு மரத்தில் ஏற்றி இரு கையையும் விட்டு நிற்குமாறு கூறினார்.
1280,அவன் குருபாதம் துணை என நினைந்து அவ்வாறே செய்தான்.
1281,அவன் கீழே விழவில்லை.
1282,அதன்பின் அவன் திருவள்ளுவர் மனையில் வாசுகியார்க்கு மகன்போல் ஒழுகி வந்தான்.
1283,அக்காலத்தே நாட்டில் பெருவறம் உண்டாயிற்று.
1284,"ஆனால், ஏலேலசிங்கனிடம் குன்றுபோல் செல்வம் குவிந் திருந்தது."
1285,"அவனைப் பார்த்து, நீ வாங்கிக் குவித்துள்ள நெற்குவையை வாங்கியதற்கு மேல் ஒருபடி மிகுதியாக விற்பாயாக! என்றார்."
1286,அவ்வழியும் அது குறை படாமலே இருப்ப தாயிற்று.
1287,அவர் சொல்வழியே அவனும் செய்து மாணவன் என்னும் தனது உண்மைப் பான்மையை நிலைநாட்டினான்.
1288,"இது நிற்க, ஏலேலசிங்கன் புலாலுண்ணும் இயல்பினன்."
1289,அதனை முற்றவும் கைவிடுவதென்பது அவனுக்கு அருஞ் செயலாக இருந்தது.
1290,அவ்வாறே அவன் செய்துவந்தான்.
1291,அவனுக்காக மீன் வலைஞர் செத்த சேல் மீனைக் கொணர்ந்து தந்துவந்தனர்.
1292,ஒருநாள் அம்மீன் வலைஞர் பெரியதொரு சேல்மீனை வலைவீசிப் பிடித்துக் கொன்று அதன் உடலைப் பிளந்தார்கள்.
1293,அவன் அதனைப் பொன்னென நினையாது தன் புறக் கடையில் இட்டான்.
1294,நாளடைவில் அது பாசி நீங்கி முன்னே அவன் கடலில் எறிந்த சதுரப் பொற் கல்லாக இருந்தது.
1295,அது கண்டு வியந்த சிங்கன் திருவள்ளுவர்க்குத் தெரிவித்தான்.
1296,"அவர், அறத்தாற்றிற் செய்த பொருள் அகற்றினும் அகலாது, எனச் சொல்லி அவனைத் தேற்றினார்."
1297,"இது நிகழ்ந்த சிலபல நாட்களுக்குப்பின், வாசுகி யார்க்கு வாழ்நாள் எல்லை குறுகிற்று."
1298,அவர் உயிர் எளிதில் நீங்காது ஊசலாடுவதாயிற்று.
1299,"அதுகண்ட திருவள்ளுவர், பெண்ணே!"
1300,உன் மனத்தில் யாது உளது? என்றார்.
1301,"அப்போது, வாசுகியார், அடிகளே!"
1302,அடியேன் மனத்தில் ஓர் ஐயம் உளது.
1303,யான் உணவு படைக்கும் போதெல்லாம் ஒரு வள்ளத்தில் தண்ணீரும் ஓர் ஊசியும் கொணர்ந்து வைக்குமாறு பணித்திருந் தீர்கள்.
1304,யானும் அது செய்தேனாயினும் தாங்கள் அவற்றை ஒருநாளும் கையாண்ட தில்லை.
1305,"அதற்குக் காரணம் அறிய வேண்டுமென்றோர் அவா உண்டு, என்றார்."
1306,இச் சொற் களைக் கேட்டு மனவமைதி பெற்ற வாசுகியார்க்குச் சிறிதுபோதில் உயிர் நீங்கிற்று.
1307,அவர் கூறியவாறே சில நாட்களுக்குப்பின் அவர் உயிர் உடலின் நீங்கிச் சென்றது.
1308,அது கேட்டு நடுக்கமுற்ற சிங்கன் ஒருவாறு தேறி அவர் பணித்த வண்ணமே செய்தான்.
1309,அவர் உடலைத் தின்ற காகமும் கழுகும் விண்ணவராய் வீடுபெற்றன.
1310,அவர் உடல் தீண்டப்பெற்றவரும் உயர்மிக்க தேவராயினர்.
1311,"இச் செய்தியைக் கச்சிப்பதியில் இருந்த சிற்பியொருவன் அறிந்து, அவரைப்போல் திருவுரு ஒன்றைச் செய்து திருமயிலையில் ஆகமமுறைப்படி நிறுவினான்."
1312,அஃது இன்றும் யாவரும் கண்டு பரவிப் பணியுமாறு விளங்கி வருகிறது.
1313,திருவள்ளுவமாலை குறிக்கும் கதை திருவள்ளுவர் மதுரைச் சங்கத்தில் சங்கப் பலகையேறித் தமது திருக்குறளை அரங்கேற்றத் தொடங்கினார்.
1314,"அப்போது, அப் பலகையில் அவரோடு உடனிருக்கத்தக்கவர் யார் என்ற ஐயம், புலவரிடையே யுண்டாயிற்று."
1315,"அப்போது வானொலி அசரீரி தோன்றி, தெய்வத் திருவள்ளுவரோடு சங்கப் பலகைக் கண் உருத்திரசன்மர் உடனிருப்பாராக, என்றது."
1316,"பின்பு, உருத்திர சன்மர் உடனிருப்ப, வள்ளுவர் தம் திருக்குறளை அரங் கேற்றினார்."
1317,சங்கப் புலவருள் சீத்தலைச் சாத்தனார் என ஒருவர் இருந்தார்.
1318,அவர் தவறுடைப் பாக்களைக் கேட்க நேரும் போதெல்லாம் தம் தலையிற் குத்திக்கொள்வது வழக்கம்.
1319,திருவள்ளுவர் தம் திருக்குறளை அரங்கேற்றியபோது தான் அவர் தலையிற் குத்திக்கொள்ளாது மகிழ்ந்து கேட்டார்.
1320,அவருள் யாளிதத்தன் ஒரு சண்டாளப் பெண்ணைக் காமுற்றுக்கூடிப் பின் அவளைக் கிணற்றிலே தள்ளிவிட்டான்.
1321,அவளை ஒரு பார்ப்பனன் எடுத்துச்சென்று ஆதரித்து வடநாட்டிற்குக் கொண்டு போனான்.
1322,அந் நாட்டிற்குச் சென்ற யாளிதத்தன் அங்கே அப்புலைப் பெண்ணைத் தனக்கு ஏற்றவள் என மணம் செய்து கொண்டான்.
1323,அவள் பெயர் ஆதி யென்பது.
1324,அவட்கு மக்கள் எழுவர் பிறந்தனர்.
1325,அவ்வெழு வருள் திருவள்ளுவர் ஒருவர்.
1326,கபிலரகவல் கூறும் கதை பகவன் என்பவர் ஓர் அருந்தவமுனிவர்.
1327,ஆதி யென்பவள் கருவூர் என்னும் பெரும்பதியில் வாழ்ந்த ஒரு புலைச்சி.
