Line Number,Sentence
481,மற்ற நாடுகளிலுள்ளவர்கள் பாடல்கள் செய்யும் போது அந்நாட்டுச் சொற்களையும் சேர்த்தார்கள்.
482,"அச் சொற்கள் திசைச்சொற்கள் எனப்பட்டன, பாண்டிநாட்டு வழக்குப்படியே தமிழ்நாட்டு இலக்கிய வழக்கு இருத்தல் வேண்டுமென்பது அக்கால மக்கள் கொள்கை."
483,தமிழ்நாட்டைச் சூழ்ந்து பதினேழு பிறநாடுகளும் உண்டு என முன்னோர் கூறியிருக்கின்றனர்.
484,தேசமைம் பத்தாறிற் றிசைச்சொற் பதினேழும் தமிழ் விடு தூது.
485,பாண்டிநாடு இது காவிரிக்குத் தெற்கே மதுரை இராமநாதபுரம் திருநெல்வேலி இந்த மூன்று பற்றுக்களும் சில்லாக்கள் அடங்கிய தேசம்.
486,"இது வெள்ளாற்றிற்குத் தெற்கு, கன்னியாகுமரிக்கு வடக்கு, பெருவெளிக்குக் கிழக்கு, கடற்கரைக்கு மேற்கிலுள்ள நாடு என்று சொல்லப்படுகின்றது."
487,தாம்பிரபர்ணி பொருநை யின் முகத்து வாரத்தில் துறைமுகப் பட்டினமாகிய கொற்கை நகரம் சிலகாலம் இதன் தலைமைப்பட்டினமா யிருந்தது.
488,சோழநாடு சோழநாடு காவிரிக்கரையிலுள்ளது.
489,அதன் தலைநகரம் திருச்சிராப் பள்ளிச் சில்லாவிலுள்ள உறையூர்.
490,காவிரியாறு கடலோடு சந்திக்கு மிடத்திலுள்ள காவிரிபூம்பட்டினம் அதன் துறைமுகமாக விருந்தது.
491,"அதன் பழைய எல்லைகள் வடக்கு திருப்பதி, தெற்கு வெள்ளாறு, கிழக்கு கடல், மேற்கெல்லை, காலத்துக்குக் காலம் மாறிய துண்டு."
492,வடக்குத் திசைபழனி வான்கீழ்தென் காசி குடக்குத் திசைகோழிக் கோடாம்கடற்கரையின் ஓரமே தெற்காகு முள்ளெண் பதின்காதம் சேரநாட் டெல்லையெனச் செப்பு.
493,தொண்டைநாடு ஆ தொண்டைச்சோழன்.
494,இவர் தந்தை தனது இராச்சியத்தின் தென்பாகத்தை மகரிஷியான குமாரனுக்குக் கொடுத்தும் வடபாகத்தை ஆதொண்டருக்குக் கொடுத்தும் ஆளச் செய்தாராம்.
495,இவர் ஆண்ட பாகத்திற்குத் தொண்டை மண்டல மென்று பெயராகியது.
496,நச்சினார்கினியருரைபெரும்பாணாற்றுப் படை .
497,சத்தியமங்கலம் கோயமுத்தூரின் ஒரு பகுதி தாலுகா தெற்கு வைகாவூர் இது பழனிக்கு இன்னொரு பெயர் மேற்குவெள்ளி யங்கிரி மலை.
498,இது மலையாளத்துக்கும் கோயமுத்தூருக்கும் இடை யிலுள்ள மலையின் பெயர் வடக்குகாவிரி நீர்பாய்ச்சும் குழித்தலை .
499,அமராவதி காவிரிச் சங்கமம் குழித்தலைக்குச் சில மைல்கள் மேற்கிலுள்ளது.
500,இது கன்னடம் சேர்ந்த கொங்கு நாடு.
501,"ஆதியில் கொங்கு நாடு, கோயமுத்தூரும் சேலத்தின் தெற்குப் பாதியுமடங்கிய நாடாகவிருந் தது."
502,அது நாடுகளாகப் பிரிக்கப்பட்டிருந்தது.
503,கன்னடரின் வெற்றிக்குப் பின் இதன் எல்லை இக்கால மைசூர் வரையும் அகற்றப்பட்டது.
504,அவ்வரசர்க்குரிய நாடுகள் சிற்றரசர் நாடுகளாம்.
505,"பல்லவர், சாளுக்கியர் பல்லவர்கள் காஞ்சி நகரைத் தலைநகரமாகக் கொண்டு கி.மு. முதல் அறுநூறு ஆண்டுகள் வரையில் ஆண்டிருக்கிறார்கள்."
506,இவர்கள் காலத்தில் அப்பர் சம்பந்தர் சிறுத்தொண்டர் முதலிய சைவ அடியார்கள் விளங்கினார்கள்.
507,தொண்டைமான் என்பதற்குச் சரியான சமக்கிருத மொழி பெயர்ப்பே பல்லவர் எனச் வரலாற்றுக்காரர் கூறுகின்றனர்.
508,பல்லவர்களை வென்று காஞ்சியைக் கைப்பற்றிச் சிலகாலம் சாளுக்கியர் அரசு செய்தார்கள்.
509,மணிபல்லவம் எனப்பட்ட யாழ்ப்பாணத்துப் பண்டை நாகஅரச பரம்பரையிலுள்ளோரே பிற்காலத்துப் பல்லவரெனப்பட்டன ரென்பது ஒரு சாரார் கருத்து.
510,இப்பழைய மொழிகளுள் தமிழ்மொழியை ஒழித்து ஒழிந்தவற்றிற் பெரும்பாலன உலகவழக்கின்றி இறந்தொழிந்தன.
511,தாசுக்கள் எனப்பட்டோர் தமிழர்.
512,இவ்வுணர்ச்சியின் வேகம் நீண்டகாலம் இருந்து வந்தது.
513,இதனால் தமிழை ஆரியத்திலும் தாழ்ந்ததாகக் கூறும் கட்சியொன்று தமிழ்நாட்டில் நீண்டகாலம்தொட்டு இருந்து வருவதாயிற்று.
514,தமிழை இழிவுபடுத்தும் கொடுமை நாளுக்குநாள் வளர்வதாயிற்று.
515,அதில் பட்டு மயங்கிய மக்கள் தமிழின் உயர்வையும் அதன் இன்றியமை யாமையையும் அறியாது அதனை இகழ்வாராயினர்.
516,கல்வியிற் பெரிய கம்பனே தேவபாடையின் இக்கதை செய்தவர் எனக் கூறி வடமொழிக்குப் பணிகின்றமை காண்க.
517,இம்மாறுபட்ட உணர்ச்சி இன்றும் முற்றாக அவிந்துவிடவில்லை.
518,நீறுபூத்த நெருப்புப்போல் அடங்கிக்கிடக் கின்றது எனலாம்.
519,இஞ்ஞான்று தமிழில் விளங்கும் நூல்களுள் தொல் காப்பியம் பழைமையுடையது.
520,இதன்காலம் கி.மு.க்குப் பிற்பட்டதன் றென்பது வரலாற்றாசிரியர்களின் கருத்து.
521,வேதங்கள் வியாசரால் நான்கு கூறுகளாகச் செய்யப்படுவதன்முன் இயற்றப்பட்டதென்பர் நச்சினார்க் கினியர்.
522,அப்படியாயின் தொல்காப்பியர் காலம் ஐயாயிரமாண்டுகளுக்கு முன்னாகும்.
523,தொல்காப்பியத்தில் எழுத்ததிகாரமென ஒரு பகுதி உள்ளது.
524,அதன்கண் எழுத்துக்களின் பிறப்பு வடிவு முதலியன கூறப்படுகின்றன.
525,"ஆகவே, தொல்காப்பியருக்குப் பன்னெடுங் காலத்துக்கு முன் தமிழில் எழுத்துக்கள் ஏற்பட்டிருத்தல் வேண்டும்."
526,இற்றைக்கு ஆயிர வருடங்களுக்கு முன் வழங்கிய எழுத்துக்கள் இன்று வழங்கும் எழுத்துக்களைப் போன்றனவல்ல.கி.பி.
527,பதினாலாம் நூற்றாண்டு வரையில் அவ்வெழுத்துக்கள் திரிபடைந்து வந்தனவாகத் தெரிகின்றன.
528,கிகீ முதலியன மேல் விலங்கு பெற்றன.
529,குகூ முதலியன கீழ் விலங்கு பெற்றன.
530,"கெ,கே முதலியன கோடு பெற்றன."
531,"கா,ஙா முதலியன புள்ளி பெற்றன."
532,அருகே பெற்ற புள்ளியை இக்காலத்தார் காலாக எழுதினார்.
533,மகரம் உட்பெறு புள்ளியை வளைத்து எழுதினார்.
534,"கொ, கோ,ஙெ,ஙோ முதலியன புள்ளியுங் கோடும் உடன்பெற்றன என்னும் நச்சினார்க்கினியர் உரையால் அறியலாகும்."
535,முற்காலத்துத் தொல்காப்பியம் முதலிய நூல்கள் எழுதப்பட்டது வட்டெழுத்திலேயாம்.
536,பழைய வட் டெழுத்து கோலெழுத்து என்னும் பெயருடன் மலையாளத்தில் மிகச் சமீப காலத்தில் வழங்கியுள்ளது.
537,அங்கு இது கி.பி.ஆம் நூற்றாண்டு வரையி லும் வழங்கிற்று.
538,அக்காலத்திலே வழங்கிய தமிழ் எழுத்துக்கள் இக்காலம் வழங்கும் எழுத்துக்களைப் போன்றனவல்ல.
539,மதுரைக்கு வடகிழக்கே மைலுக்கப் பால் இரண்டு மைல் தொடர்ச்சியுள்ள ஆனைமலை யென்னும் ஒரு மலைத்தொடருள்ளது.
540,அம்மலையின் மேற்குப்பக்கத்தில் ஒரு குகையிருக் கின்றது.
541,அக்குகையின் சுவரில் பழைய தமிழெழுத்து வெட்டப்பட்ட சாசனமொன்று காணப்படுகின்றது.
542,இதுதான் வட்டெழுத்து அல்லது பழைய தமிழெழுத்து.
543,எழுத்துக்கள் எழுதப்பட்ட வடிவிலிருந்து அவைக்கு வட்டெழுத்து என்னும் பெயர் வழங்கப்பட்டது.
544,இச் சாசனத்தின் காலம் கி.பி.
545,கிறித்துவுக்குச் சில நூற்றாண்டு களுக்கு முன் தென்னிந்தியாவில் வழங்கிய எழுத்து இதுவேயாகும்.
546,கிறித்துவுக்குப்பின் எட்டாம் நூற்றாண்டில் வட்டெழுத்துடன் வேறு வகையான எழுத்துக்களையுங் கலந்து எழுதப்பட்ட சாசனங்கள் காணப்படுகின்றன.
547,சில நூற்றாண்டுகளுள் வட்டெழுத்தின் இடத்தைப் புதிய எழுத்து எடுத்துக் கொண்டது.
548,இப்போதைய வடிவத்தைத் தமிழ் எழுத்துக்கள் பதினாலாம் நூற்றாண்டில் அடைந்தன. .
549,இப்போது வழங்குகின்ற கிரந்த எழுத்துக்கள் வட்டெழுத்தி னின்றும் தோன்றினவேயாம்.
550,போர்முனையில் இறந்த வீரனுக்குக் கல்நட்டு அதில் அவனுடைய பெயரும் பீடும் எழுதுவது பழந்தமிழர் வழக்கு.
551,இவ் வீரக்கல் நிறுத்தும் வழக்கம் பழந்தமிழர்கள் எழுத்தெழுதும் முறையினை அறிந்திருந்தார்கள் என்பதை வலியுறுத்து கின்றது.
552,தமிழ்மொழியில் நெடுங்கணக்கு மிகவும் அழகு பெற அமைந் துள்ளது.
553,ஒரே எழுத்துக்குப் பல ஒலியில்லை.
554,ஓரொலிக்குப் பல எழுத்துக்கள் வேண்டா கூட்டெழுத்துக்கள் கிடையா.
555,மயங்கா மரபின் எழுத்து முறை காட்டி என்னுந் தொல்காப்பியச் சூத்திரம் இதனை வலியுறுத்தும்.
556,எல்லா எழுத்துக்களும் மொழிக்கு முதலில் வாரா.
557,எல்லா எழுத்துக்களும் மொழிக்கிடையில் மயங்கா.
558,முன் எத்தனை எழுத்துக்களிருந்தனவோ அத்தனையே இன்றுவரையுமுள்ளன.
559,ஆரிய மொழிக்குரிய நெடுங்கணக்கு தமிழர் முறையைப் பார்த்துச் செய்யப்பட்டதென்பது ஆராய்ச்சியாளர் துணிபு.
560,சமக்கிருத மொழிக்கட் காணப்படும் தமிழி லில்லாத சில எழுத்துக்கள் குறைபாடுடைய முயற்சியாற் பிறப்பிக்கப்படும் எழுத்துக்களாம்.
561,தமிழுக்குரிய ஆய்த எழுத்தின் உதவியைக்கொண்டு எம்மொழியிலுள்ள எவ்வகை எழுத்தோசைகளையும் பிறப்பித்தல் எளிதில் அமையும்.
562,"இம்முறையினை விளக்கிக் காட்டினோர் ஆசிரியர் மறைமலை யடிகள், திருவாளர் பா.வே."
563,மாணிக்க நாயக்கர் முதலியோராவர்.
564,வெள்ளிடை விலங்கல்.
565,"பேராசிரியர் இராப்சன், தென்னிந்திய மொழிகள் மிகவும் திருத்தம் பெற்றிருந்தனவென்றும், ஆகவே சமக்கிருதத்தில் திராவிடக் கலப்பிருத்தல் ஆச்சரியப்படத்தக்கதன்று என்றும் குறிப்பிட்டுள்ளார்."
566,தாதுவெனினும் பகுதி யெனினும் ஒன்றே.
567,தமிழ்ச்சொற் பகுதிகள் எல்லாச் சொற்களுக்கும் தெற்றெனக் காண்பதரிது.
568,அதுபற்றியே தொல்காப்பியரும் மொழிப் பொருட் காரணம் விழிப்பத்தோன்றா என்றார்.
569,ஆயினும் நுண்ணியதாக ஆராயுமிடத்துப் புலப்படாமற் போகாது.
570,சில சொற்கள் வினையடியாகவும் சில சொற்கள் உரியடியாகவும் சில சொற்கள் இடையடியாகவும் ஒரு சில பெயரடியாகவும் பிறந்தன.
571,அகத்தியர் காலத்திலே வழங்கிய சொற்கள் பல பிற்காலத்திலே வழக்கிறந்தன.
572,அவர் காலத்திலே வழங்காத சொற்கள் பிற்காலத்தில் வழங்குவனவாயின.
573,அவர் காலத்திலும் தொல்காப்பியர் காலத்திலும் சகர அகரத்தை முதலாகவுடைய தமிழ்ச் சொற்கள் வழங்கவில்லை.
574,இது ஆராய்ச்சிக்குரியது.
575,அகராதிகளில் இரண்டாயிரத்துக்கு மேற்பட்ட சகர முதன் மொழிகள் காணப்படுகின்றன.
576,யாழ்ப்பாணத்திலே எழுதத் தொடங்கிச் சென்னையில் பூர்த்தி யாக்கப்பட்ட வின்ஸ்லோ அகராதி மிகச் சிறந்ததாகும்.
577,இது அறுபத்தேழு வருடங்களுக்கு முன் இயற்றப்பட்டது.
578,"அவ்வகராதியில் , சொற்கள் காணப்படுகின்றன."
579,ஆம் ஆண்டில் புதிய தமிழ்ப் பேரகராதி மதுரையில் தொடங்கப்பட்டது.
580,அது இப்போது சென்னையில் பல்கலைக் கழகத்தாரின் மேற்பார்வையில் இயற்றப்பட்டு வருகின்றது.
581,சென்னை அரசாங்கத்தார் இம்முயற்சிக்கு ஒரு லட்சம் ரூபா உதவியிருக் கின்றனர்.
582,இப்புதிய பேரகராதிக்கு வேண்டிய விஷயங்கள் அகராதிகளிலும் வேறு பலவகைகளிலும் சேகரிக்கப்படுகின்றன.
583,அவற்றுள் நூற்றுக்கு சொற்கள் இன்றும் யாழ்ப்பாணர் வழக்கில் உள்ளனவென்று ஒப்புக் கொண்டனர்.
584,"புதிய பேரகராதி யில் , அல்லது , சொற்கள் வரையில் தான் இருத்தல் கூடும்."
585,வழக்கு தமிழ்மொழி வழக்கு எனவும் செய்யுள் எனவும் இருகூறுபட்டு இயங்குகின்றது.
586,இழிந்தோர் பலவாறு சிதைவுபடக் கூறுவனவும் ஒருவாற்றால் வழக்கேயாயினும் அவை அறிவுடையோரால் மேற்கொள்ளப்படாவாகும்.
587,செய்யுள் நல்லறிவுடையாரால் பலவகைச் சொற்களாலும் அமைதி பெறச் செய்யப்படுவன செய்யுள் எனப்படும்.
588,பாட்டுக்களே யன்றிச் சூத்திரம் உரை முதலாயினவும் செய்யுள் என்னும் பெயரால் சூத்திரச் செய்யுள் என்று இங்ஙனம் பண்டு வழங்கின.
589,உரை யினையும் பல்வகைப்படுத்திக் கூறுகின்றார் தொல்காப்பியனார்.
590,செய்யுட் களின் இடையே விரவிவரும் உரை சிலப்பதிகாரத்திற் காணப்படுவது.
591,செய்யும் அல்லது சூத்திரப் பொருளைத் தெளிவுறுத்தும் உரைகள் தமிழில் மிக்குள்ளன.
592,"யாதானுமொரு வரலாறு அல்லது உண்மையினைச் செய்யு ளின்றித் தொடர்ச்சியாகக் கூறும் உரைநடையானியன்ற நூல், உரைநூல் என்று வழங்கற்குரியது."
593,அத்தகைய நூல் பண்டைச் சான்றோர் செய்ததாக நமக்கு ஒன்றுங் கிடைத்திலது.
594,உரைநடையானது பயில்வாரது அறிவு நுணுகி நின்று ஆராய்தற் கேற்ற திட்பமும் கூறும் பொருளுக்கேற்ற ஓசை யும் உடையதன்று.
595,"ஆதலின் பாட்டுக்கள் போல, உணர்வினை எழுப்பி இன்பஞ் செய்வதாகாது."
596,ஓர் வரையறையின்மையின் சிதைவின்றி நிலை பெறுவது மாகாது.
597,அவ்வகையில் தமிழ்மொழி வளர்ச்சியுறா திருந்தது இரங்கத்தக்க தொன்றே. தமிழ் மொழியிலுள்ள பாட்டுக்களின் மாட்சி அளவிடற்பாலன வல்ல.
598,பிறமொழிச் செய்யுளை யெல்லாம் தமிழ்ச் செய்யுட்கள் வென்று விட்டன என்னலாம்.
599,மடக்கும் திரிபுமாகக் சொற்களை அடுக்கி வைத்து.
600,இரண்டொரு போலிப்பாட்டியற்றினாரைப் புலவர் வரிசையிற் சேர்த் தெண்ணுவாருமுளர்.
