Line Number,Sentence
1252,உயர் குமுறு காதலா உள்ள குற்ற மென்மீதிலா?
1253,து உணர்வு கலங்க லானதோ?
1254,உவகை யனைத்தும் போனதோ?
1255,"ரணவீரா, சுகுமாரா நவில வேண்டுமே உதாரா?"
1256,து சித்ரபானு இதென்ன முகவாட்டமாயிருக்கிறீர்கள்?
1257,உணர்ச்சியற்று போனீர்களா!
1258,கட்டித் தழுவிக் கொண்டு வீரத் தமிழரே!
1259,என்ன யோசிக்கிறீர்கள்?
1260,நல்ல சந்தர்ப்பத்தில் தர்க்கீகத்திற்கு இடந் தரலாமா?
1261,நான் பிறந்தது தங்கள் பொருட்டு.
1262,என் மலருடல் வாடாமல் வதங்காமல் என் பெற்றோர்களால் இந்நாள் வரையில் காப்பாற்றப் பட்டதும் உங்கள் பொருட்டே.
1263,இளமை ததும்பும் எனது அங்கங்கள் இந்நாள் வரை நன்னிலையில் இருப்பதும் உங்கள் பொருட்டே.
1264,நான் ஒரு புதிய மலர் நீங்கள் அதிலுள்ள புதுத்தேனை உண்ணப் பிறந்த வண்டு இத்தனையும் மறந்தீரே!
1265,சேனாதிபதி முகத்தைக் கவனித்திருந்து விட்டு கண்மணி!
1266,நான் ஒன்றும் யோசிக்கவில்லை.
1267,நீ என்ன சொல்ல மறந்து விட்டாய்?
1268,சித்ரபானு அதிருக்கட்டும்.
1269,ஒரு மனிதன் உறுதி கூறுவதென்பது மறந்துவிடக் கூடியதா?
1270,சேனாதிபதி இல்லை காப்பாற்றுவதற்காகவே.
1271,நீ இதை ஏன் இப்பொழுது கூறுகிறாய்?
1272,சித்ரபானு நீங்கள் கூறியுள்ள உறுதிமொழியைத் திரும்பவும் உங்களுக்கு ஞாபகப்படுத்த வேண்டியதில்லையே?
1273,"சேனாதிபதி வேண்டியதில்லை, நான் கூறியுள்ள உறுதி மொழியை உயிர் போகுமளவும் மறவேன்."
1274,நீ என்ன சொல்ல வந்தாய்?
1275,சித்ரபானு வேறொன்றுமில்லை.
1276,இளவரசரை என் சுற்றத்தார் சரிப் படுத்தி வைத்திருக்கிறார்கள்.
1277,அந்தச் சிறுவனுக்கு நீங்கள் அனுசரணையாக நடந்து கொள்ளுங்கள் என்று உம்மிடம் சொல்லச் சொன்னார்கள்.
1278,அதோ யாரோ வருகிறர்களே!
1279,நான் போய் விடுகிறேன்.
1280,போதல் சேவகர்கள் சேனாதிபதியை நோக்கி வருகிறார்கள்.
1281,சேனாபதி மூர்ச்சையாய்க் கிடப்பது போல் தரையில் படுத்துக் கொள்ளுகிறான்.
1282,சேவகர்கள் வந்து கவனித்துவிட்டு சேவகர்கள் அந்தோ!
1283,இதென்ன அநியாயம்!
1284,கொலையாளிகள் வெட்டப் பட்டுக் கிடக்கிறார்கள்!
1285,நமது சேனாதிபதியவர்கள் மூர்ச்சையற்றுக் கிடக்கிறார்!
1286,ஆரியரின் சூழ்ச்சியோ!
1287,அல்லது அந்த ஆரியர் சொல்கிறபடி தெய்வபலமோ தெரியவில்லையே!
1288,"சேனாதிபதியைக் தேற்றுகிறார்கள், சேனாதிபதி மெதுவாக எழுந்து சேனாதிபதி அந்தோ!"
1289,நான் எங்கே இருக்கிறேன்?
1290,சேவர்கள் பிரபு இதென்ன கோலம்?
1291,இவர்கள் வெட்டப்பட்டுக் கிடக்கிறார்கள்!
1292,ஆரியர்கள் எங்கே?
1293,சேனாதிபதி சேவகர்களே!
1294,குற்றவாளிகளை அழைத்துக் கொண்டு கொலைக்களம் வந்து சேர்ந்தேன்!
1295,அதுதான் எனக்குத் தெரியும்.
1296,கொலைக்களத்திற்கு வந்தவுடன் மின்னல்போல் திடீரென்று ஓர் ஒளி தோன்றிற்று.
1297,அதற்குமேல் எனக்கு ஒன்றும் தெரியாது.
1298,இதோ இக் கோலத்தை இப்போது காண்கிறேன்.
1299,சீக்கிரம் இதை விட்டு நீங்குவோம்.
1300,அனைவரும் போதல் காட்சி ஒன்பது இடம் அரண்மனையில் ஒரு பாகம்.
1301,"பாத்திரங்கள் இரணியன், மந்திரி, பிரகலாதன், சேனாதிபதி, சேவகர்கள்."
1302,இரணியன் இருக்கை நோக்கி பிரகலாதன் ஓடிவந்து பணிகிறான்.
1303,இரணியன் கட்டியணைத்துக் கொண்டு இரணியன் அப்பனே வந்துவிட்டாயா?
1304,பிரகலாதன் என் சுற்றுப் பிராயணத்தைச் சுருக்கமாகவே முடித்துக் கொண்டேன்.
1305,என் அன்னை என் பிரிவைச் சகிக்க மாட்டார்க ளாதலால்.
1306,அன்றியும் தங்களைப் பிரிந்திருக்கவும் என்னால் முடியவே இல்லை.
1307,இரணியன் உண்மையில் உனது அன்னைக்கு ஏற்பட்ட துயரத்தை என்னால் மாற்ற முடியாதிருந்தது.
1308,சீக்கிரமாக நீ வந்ததே நல்லதாயிற்று.
1309,நீ சென்ற தேசத்தில் எல்லாம் இந்த ஆரியர்களின் சூழ்ச்சி எவ்வாறிருக்கிறது?
1310,பிரகலாதன் தந்தையே!
1311,ஆரியரை வணங்குவதன் மூலமே ஆங்காங்குள்ள தமது காரியத்தை முட்டின்றி முடித்துக் கொள்கின்றனர்.
1312,குடிகள் அரசனை மதிப்பதைவிட ஆரி யருடைய வேதத்தை மேலானதென எண்ணி வழிபடு கின்றனர்.
1313,அவர்களுடைய தெய்வபலமே அதற்குக் காரணம்.
1314,இரணியன் உண்மைதானா?
1315,அறியாமையென்பது மக்களால் இவ்வாறு பாராட்டப்பட்டுவிட்டதா?
1316,அயோக்கியத் தனம் மக்களுக்குக் கரும்பாகத் தோன்றிவிட்டதா?
1317,சரி நீ போய் உன் அன்னையைப் பார்.
1318,அவள் உன் வரவு கோரி ஆவலாய் இருக்கிறாள்.
1319,சீக்கிரம் உனக்கு இளவரசப் பட்டம் கட்டப் போகிறோம்.
1320,இச்சமயம் சேனாதிபதியும் சேவகர்களும் வந்து சக்கர வர்த்தியைப் பணிகிறார்கள் இரணியன் வீரத் தமிழனே!
1321,உற்சாகமென்பது உன் முகத்தில் சிறிதும் காணப்படவில்லையே?
1322,தண்டனையை நிறைவேற்றி விட்டாயா?
1323,சேனாதிபதி ராஜாதி ராஜரே!
1324,குற்றவாளிகளை அழைத்துக்கொண்டு கொலைக்களத்தை நாடிச் சென்றேன்.
1325,என்னுடன் நான்கு கொலையாளிகளும் வந்தார்கள்.
1326,கொலைக்களத்தையடைந்த வுடன் திடீரென்று ஓர் ஒளி தோன்றிற்று.
1327,அவ்வளவுதான் தெரியும்.
1328,மூர்ச்சையற்றுக் கிடந்த என்னை இந்தச் சேவகர்கள் வந்து எழுப்பினார்கள்.
1329,வட்டப் பாறையில் கொலையாளிகள் நால்வரும் வெட்டப்பட்டுக் கிடந்தார்கள்.
1330,குற்றவாளிகளாகிய ஆரியர்களைக் காணவில்லை.
1331,பாட்டு நோட் திர ஏகம் இரணியன் த்ரோகச் செயலோ எனதிடம் ஆரம்பித்தாய் இதுததி பேடிச் செயல் செய்வதற்கும் எண்ணிட்டாயா?
1332,வீரத் தமிழர் வாழ்வில் மண்ணிட்டாயா?
1333,நீ கற்ற தெலாம்இதுவா?
1334,தீமைக் கனுகூலமதோ?
1335,யூகத்தினிலே மிகுந்த பித்தந்தானோ?
1336,தேகத்தினில் ஓடுவதும் ரத்தந்தானோ?
1337,இரணியன் கோபமாய் துரோகியே!
1338,நீ யாரிடம் பேசுகிறாய்?
1339,இந்நாள் வரைக்கும் தமிழர்களின் பேரால் உனக்கு ஆதரவு தந்த உனது சக்கரவர்த்தியிடம் நீ கூறுவதை யோசித்துக் கூற மாட்டாயா?
1340,நன்றி கெட்டவனே!
1341,தமிழ்த் தன்மையின் வேரைப் பறிக்கத்தக்க அசட்டு வார்த்தையை என்னிடம் அஞ்சாமற் கூற முன்வந்தாயா?
1342,எனக்கிருப்பதாக நீ நினைத்திருந்த அறிவுடைமையை உனது மூடத் தனத்தையிட்டுக் குழப்பிவிட நினைத்த உன் நெஞ்சம் கருங்கல்லா?
1343,எனது தோளும் வாளும் பேடித்தனம் பொருந்தி யவை என்ற முடிவுக்கு வந்தாயா?
1344,மானத்தோடு பேசு!
1345,ஆசனத்திலிருந்து குதித்து எதிர்வந்து நிற்றல் சேனாதிபதி பயத்தோடு பெருமானே!
1346,தங்கள் கோபத்துக்குக் காரணம் தோன்றவில்லையே!
1347,என் வார்த்தையில் தங்கட்கே அவ நம்பிக்கை தோன்றும் காலமும் வந்துவிட்டதா?
1348,நடந்தது உண்மை!
1349,என் வார்த்தையை நீங்கள் நம்ப முடியா விட்டால் இப் பாவியைத் தங்கள் வாளால் பிளந்து போடுங்கள்.
1350,"இரணியன் நிதானிக்கிறான் பிறகு கெஞ்சிய முகத்தோடு அப்பனே, உண்மைதானா?"
1351,ஒளி தோன்றும் என்பதையாவது நீ நம்புகிறாயா?
1352,நீ சொல்லும் இந்த வார்த்தை ஆரியர்களின் அயோக்யத் தனமான வார்த்தைகளை அரண் செய்வதாகவன்றோ இருக்கிறது?
1353,இதைத் தமிழர் அறிந்தால் ஆரிய வலையிற் சிக்கி இவ்வரசாங்கத்தையே கவிழ்க்கவும் ஆயத்தமாகி விடுவார்களே!
1354,ஒருகால் உன்னை ஆரியர் பின்னின்று மூர்ச்சையாகும்படி செய்து விட்டார்கள் என்றாலும் நம்பமுடியும்.
1355,சேனாதிபதி நான் ஒரு வேளை புத்தி தவறி விட்டதாகவும் இருக்கக்கூடும் என்பதை ஒத்துக் கொள்ளுகிறேன்.
1356,இரணியன் இருக்கலாம்.
1357,"ஏனென்றால் இதற்கு முன் எத்தனையோ ஆரியர்களையும், ஆரியப்பாதிரிகளையும் நான் சிரச்சேதம் செய்திருக்கிறேன்."
1358,அப்போதெல்லாம் சோதி தோன்ற வில்லையே!
1359,"கடைசியாக உனக்கு ஒரு வார்த்தை, தமிழர்நாடு."
1360,நாம் தமிழர்.
1361,நமதுடம்பில் தமிழ் ரத்தம் வீறிட்டோடுகிறது.
1362,"தமிழர் நம்மை நம்புகிறார்கள் நான், அவர்களைக் காக்க வேண்டும்."
1363,நாம் நம்மைக் காத்துக் கொள்ளவேண்டும்.
1364,சுயமரியாதையை இழக்கலாகாது.
1365,சேனாதிபதி போய்விடுகிறான் மந்த்ரீ!
1366,என் மைந்தன் சுற்றுப் பிரயாண அனுபவத்தை என்னிடம் சொன்னதை நீ கேட்டாயல்லவா?
1367,எங்கும் ஆரியர் செல்வாக்கே அதிகமாயிருக்கின்றதென்றும் அவர்கள் தெய்வ பலமே அதற்குக் காரணமென்றும் சொன்னான்.
1368,சேனாதிபதியோ வானில் ஒளி தோன்றிற்று என்கிறான்.
1369,இவர்களின் மனோபாவம் நம்மையும் திடுக்கிட வைக்கிறது.
1370,மந்திரி அரசே!
1371,மிக எச்சரிக்கையாக இருக்க வேண்டும்.
1372,இதே நேரத்தில் ஆரியப் பூண்டே இந்நாட்டில் இல்லாதபடி செய்து விடுவதும் நலம் என்று எண்ணுகிறேன்.
1373,தங்கள் குமாரனாலும் இந்தச் சேனாதிபதியாலும் இந்த ராஜ்யத்திற்கு ஏதோ கெடுதி உண்டாகப் போகிறது என்று எனக்குத் தோன்றுகிறது.
1374,நாம் மிக எச்சரிக்கையாக இருக்க வேண்டும்.
1375,இரணியன் மந்த்ரீ!
1376,ஆரியர் சூழ்ச்சியைக் கண்டறிவதில் நாம் கண்ணும் கருத்துமாயிருக்க வேண்டும்.
1377,மந்திரி அவ்வாறே.
1378,இரணியன் நான் விடை பெற்றுக் கொள்ளுகிறேன்.
1379,வீதியில் உள்ள மக்களில் ஒருவன் மற்றவர்களை நோக்கி ஐயையோ!
1380,நாம் சக்கரவர்த்தியின் கட்டளைக்கு இணங்க முடியாது.
1381,சக்கரவர்த்தி பூசுரர்களாகிய ஆரிய ஜனங்களுக்கு விரோதி.
1382,ஆரியர்களின் விரோதிகளாயிருந்தால் தான் திடீரென்று இறந்து போகிறார்களே!
1383,மற்றொருவன் சேனாதிபதி ஆரியர்களுக்குக் கொஞ்சம் வேண்டி யிருந்ததினால்தான் அவர் தலை தப்பிற்று.
1384,இல்லாவிட்டால் நாலு பேரோடு அவரும் மாள வேண்டியதுதானே!
1385,இன்னொருவன் நாம் ஆரியர் சொல்வதைத்தான் நம்பவேண்டும்.
1386,ஒரு வீடு இருக்கிறது.
1387,அதைக் கட்டியவன் ஒருவன் இருப்பான்.
1388,அதுபோலவே இந்த உலகம் இருக்கிறது.
1389,அதை உண்டாக்கியவன் இருப்பானா இல்லையா?
1390,அவன் எப்படிப் பட்டவனாயிருப்பான்?
1391,அவனால் ஆகாதது என்ன இருக்கிறது?
1392,அந்தப் பெரிய மனிதனைத்தான் கடவுள் என்று அவர்கள் சொல்லுகிறார்கள் தெய்வம் என்று சொல்லுகிறார்கள்.
1393,அந்தக் கடவுள்தான் ஆரியரை அனுப்பித் தமிழருக்குப் புத்தி வரும்படி செய்யச் சொன்னாராம்.
1394,அப்படி யிருக்கையில் அந்தக் கடவுள் யார் பேச்சைக் கேட்பார்?
1395,ஆரியர் பேச்சைத்தானே கேட்பார்.
1396,வேறொருவன் மெய்!
1397,அதுவுமில்லாமல் எல்லாந் தெரிந்த இளவரசரே ஆரியர்களை வணங்கும்போது நாம் எந்த மூலை?
1398,மற்றொருவன் உம்!
1399,எவன் இந்த சக்கரவர்த்தியை நம்புவான் இனிமேல்?
1400,திடீரென்று ஒளி உண்டாகிறது!
1401,ஆரியர் சொன்ன படி செய்துவிட்டு ஓடிவிடுகிறது!
1402,இன்னொருவன் நோய் நொடி வந்தால் ஆரியர்களிடம் போய் அவர்களை வணங்கினால் அந்த நோயை ஒளியைக் கொண்டு தீர்த்துவிடுவார்கள்!
1403,வேறொருவன் நேற்று திம்மான் வீட்டுக் குப்பன் இறந்து விட்டா னாம்.
1404,ஆரியப் பாதிரி மந்திரஞ் செய்து பிழைக்க வைத்து விட்டாராம்!
1405,இன்னொருவன் இப்படியெல்லாம் இருக்கும்போது இந்தச் சக்கர வர்த்திக் கென்ன கொழுப்பு?
1406,என்று பலவிதமாய் பேசிக் கொண்டே ஜனங்கள் கலைகிறார் கள்.
1407,காரியம் சாய்வதற்கே கடவுளென் றொன்று சொல்லி ஊரை ஏமாற்றுகின்றார் மந்திரி உணர்விலா ஆரியர்கள்.
1408,சாமார்த்தியம் இல்லாததால் சாமி தன் சொந்தமென்றார் ஏமாற்றை நம்புவதோ மந்திரி இதற்கு நாம் அஞ்சுவதோ?
1409,தீமையே ஒருருவாய்ச் சேர்ந்திட்ட ஆரியரை நாமினி விட்டு வைத்தால் மந்திரி நாசமிகச் சேர்வது மெய்.
1410,இரணியன் மந்த்ரீ!
1411,என் செய்வேன்!
1412,கலங்காத என் சித்தம் கலங்கவும் நேர்ந்தது.
1413,ஆயினும் எனக்கு இன்று ஏற்பட்ட கலக்கம் என் பொருட்டன்று.
1414,எனது தமிழ் மக்கள் பொருட்டே.
1415,தன்மானம் என்ற பெரும்பதவியினின்று மானமற்ற அடிமை வாழ்க்கை யின் பாதையில் அடிவைத்து விட்டார்களே!
1416,ஆரியர்களின் இந்தப் பெரிய பொய்ப் பிரச்சாரத்தில் நமது சேனாதிபதியும் என் குமாரனும் ஈடுபட்டதின் காரணம் தான் புரியவில்லை!
1417,பேரைக் கேட்ட மாத்திரத்தில் எட்டுத்திக்கும் வாழ்த்துக் கூறும்படி செங்கோல் செலுத்தும் இரணியனுக்கு வாய்த்த பிள்ளையின் தன்மையும் நன்றாகயிருக் கிறது!
1418,மந்திரி தங்கள் குமாரரைப் பற்றி எவ்வித முடிவுக்கும் நாம் வந்து விடலாகாது.
1419,இன்னும் பார்க்க வேண்டும்.
1420,இரணியன் தனது சிம்மாசனத்தில் மந்திரி பிரதானிகலுடன் வீற்றிருத்தல் மிதுனபுரி மன்னன் வணங்கி அரசர் பெருமானே!
1421,மிதுனபுரி மன்னன் வணக்கஞ் செலுத்துகிறேன்.
1422,"இரணியன் வணக்கம், ஆசனத்தில் அமர்க."
1423,மச்சபுரி மன்னன் அரசர் பெருமானே!
1424,தங்கள் குமாரன் பிரகலாதனுக்கு இளவரசுப் பட்டங்கட்டுவது பற்றி எனது மகிழ்ச்சியைத் தெரிவிக் கிறேன்.
1425,மச்சபுரி மன்னன் வணக்கம்.
1426,இரணியன் தோழரே!
1427,"நீவிர் வந்ததால் இவ் வைபவத்தைச் சிறப்புறுத்தினீர்கள், அமர்க."
