Line Number,Sentence
701,"இதனால் குற்றியலுகரம் கெடாது என்பதும், மெய்யீறு போல் உயிர்ஏற இடம் கொடுக்கும் என்பதும் பெற்றாம்."
702,". ஆசிரியவசனம் பிற பெயர்கள் ஆசிரியவசனம் எனினும், மேற்கோள் எனினும், பழஞ்சூத்திரத் தின் கோள் எனினும் ஒக்கும்."
703,"சங்கர. ஆட்சியும் காரணமும் பற்றிய குறி குறி அடையாளம், இடப்படும் பெயர்."
704,ஆட்சி அச் சொல்லைப் பின்னர் எடுத்துப் பயன்படுத்துதல் காரணம் அப்பொருளுக்கு அப்பெயர் ஏற்பட்டதன் காரணமாம்.
705,எடு ஒளகார இறுவாய்ப் பன்னீரெழுத்தும் உயிரென மொழிப தொ.
706,உரை ஆடூ மகடூ என்ற சொற்கள் ஆடூ மகடூ என்பன முறையே உயர்திணை ஆண்பால் பெண்பால் ஒருமைப்பெயர்களாம்.
707,இவை ஊகார ஈற்றுச் சொற்கள்.
708,இவை வருமொழியோடு இணையுங்கால் இடையே எழுத்துப் பேறாகிய உகரம் பெறுதலுமுண்டு என்பர் உரை யாசிரியன்மார்.
709,"எடு ஆடூஉக் குறியன், மகடூஉக் குறியள் அல்வழிப் புணர்ச்சி ஆடூஉக்கை, மகடூஉக்கை வேற்றுமைப் புணர்ச்சி தொ."
710,இவை வேற்றுமைப் புணர்ச்சிக்கண் இன்சாரியை பெறுதலு முண்டு என்பர் தொல்காப்பியனார்.
711,"ஆடூஉவின்கை, மகடூஉவின் கை என வரும்."
712,நச். பொதுவாகத் தொல்காப்பியனார் உயர்திணைப் பெயர் களுக்கு இன்சாரியை விதித்தாரல்லர்.
713,"ஆடூ, மகடூ என்ற பெயர்களுக்கு இன்சாரியை அமையாதாயினும், அவை சொல்லால் அஃறிணை போறலின் இன்சாரியை வருதல் குற்றமில்லை எனப்பட்டது."
714,எடு ஆண் கடிது ஆண்கை தொ.
715,"வாளாதே, பெண் வந்தது என்று கூறியவழி அஃறிணைப்பொருள் என்பது உணரலாகாது."
716,பெண்குரங்கு வந்தது என்று விதந்தே கூறவேண்டும்.
717,"பெண் பிறந்தது, ஆண் பிறந்தது, பிள்ளை பிறந்தது என்று அடையடாது சொல்லிய வழி உயர்திணைக்கேயாம்."
718,"ஆண் பெண் என்பன உயர்திணைப் பெயர்களாயினும், அஃறிணைப் பெயர்கள் போலப் புணர்ச்சி விதி பெறும் என்பது."
719,"உரை ஆ, மா, கோ இன் அடைதல் ஆ, மா, கோ இம்மூன்று பெயர்களும் இன்சாரியை பெறு தலுமாம்."
720,"வருமாறு ஆவை ஆவினை, மாவை மாவினை, கோவை கோவினை."
721,இவை உருபுகள் புணருமிடத்து னகரச்சாரியை பொருந்தவும் பெறும்.
722,"வருமாறு ஆ ஐ ஆவை, ஆனை மா ஐ மாவை, மானை கோ ஐ கோவை, கோனை."
723,இவை னகரச்சாரியையோடு உகரச்சாரியையும் பெறும்.
724,எடு நான்கனுருபொடு புணருமிடத்து ஆனுக்கு மானுக்கு கோனுக்கு என வரும்.
725,ஆவுக்கு மாவுக்கு கோவுக்கு உகரச்சாரியை ஒன்றே பெறுதல்.
726,ஆவினுக்கு மாவினுக்கு கோவினுக்கு இன்சாரி யையும் உகரச்சாரியையும் பெறுதல்.
727,"ஆவினை, மாவினை, கோவினை என இப்பெயர்கள் இன்னுருபு ஒழிந்த ஏனை யுருபுகளொடு புணர்கையில் இன் சாரியை பெறுதலும் கொள்க."
728,"எடு ஆ குறிது, மா குறிது, கேண்மியா கொற்றா நன்."
729,ஆய்த இறுதி சுட்டுமுதலாகிய ஆய்த இறுதி சுட்டினை முதலாக வுடைய அஃது இஃது உஃது என்ற சொற்கள்.
730,ஆய்தம் ஈறாக எச்சொல்லிலும் வாராது.
731,அஃது ஈற்றயல் எழுத்தாகவே வந்துள்ளது.
732,தொல்காப்பியனார் ஈற்றயல் எழுத்தையும் ஈறு என்று குறிப்பிடும் வழக்கமுடையவர் என்பது பெறப்படும்.
733,"எனவே, ஆய்த இறுதி என்பது ஆய்த ஈற்றயல் சொல் என்னும் பொருளது."
734,செய்யுளிசை நிறைக்க ஆய்தம் அளபெடுத்தலுண்டு.
735,சிலவிடங்களில் ஆய்தம் இசைநிறைக் காகவே இடையே தோன்றி அளபெடுத்தலுமுண்டு.
736,வருமாறு கஃஃ றென்னும் கல்லதர் அத்தம் நிறம் பற்றியது.
737,சுஃஃ றென்னும் தண்தோட்டுப் பெண்ணை ஓசை பற்றியது.
738,"எஃஃ கிலங்கிய கையராய் இன்னுயிர், வெஃஃகு வார்க்கில்லை வீடு இசை நிறைக்க ஆய்தம் அளபெடுத்தது."
739,"விலஃஃகு வீங்கிருள் ஓட்டுமே மாதர், இலஃஃகு முத்தின் இனம் இசை நிறைக்க ஆய்தம் தோன்றி அள பெடுத்தது."
740,"வெண்பாவில் தேமா என்ற ஈரசைச்சீரை உண்டாக்க எஃஃ, வெஃஃ என ஆய்தம் அளபெடுத்தது."
741,அவ்வாய்தம் தன் அரைமாத்திரையிற் குறுகிக் கால்மாத்திரையாக ஒலிக்கும் ஆய்தக்குறுக்கமாம்.
742,எடு கல் தீது கஃறீது முள் தீது முஃடீது நன்.
743,"ஆய்தக்குறுக்கம் என ஒன்றில்லாமை குறியதன்முன்னர் ஆய்தப் புள்ளி, உயிரொடு புணர்ந்த வல்லாறன் மிசைத்தே எ."
744,ஆய்தத்தின் பிறப்பிடம் ஆய்த எழுத்து நெஞ்சின்கண் நிலைபெற்று ஒலிக்கும் ஓசை யானும் அங்காந்து கூறும் முயற்சியானும் பிறக்கும்.
745,"ஆய்தத்தின் பிறப்பு ஆய்தம் சார்பெழுத்துள் ஒன்று ஆதலின், தனக்குமுன் நிற்கும் வல்லெழுத்தோடு ஒத்து அது பிறக்குமிடத்தில் பிறக்கும்."
746,"முதலிலுள்ள குற்றெழுத்து ஆய்தத்துக்குச் சார்பாயினும், முன்நிற்கும் வல்லெழுத்தின் பிறப்பிடமே ஆய்தத்துக்கும் பிறப்பிடமாக வரும்."
747,ஆய்தம் தலையிடத்தில் பிறக்குமென இளம்பூரணரும் நன்னூலாரும் பிறப்பிடம் கூறுவர்.
748,நச்சி னார்க்கினியரும் இ.வி.
749,நூலாரும் ஆய்தத்துக்குப் பிறப்பிடம் நெஞ்சு என்பர்.
750,"ஆய்தம் தனக்கு முன்னுள்ள வல்லெழுத்துப் பிறக்குமிடத்தே பிறந்து, அதன்ஒலியையே தனது ஒலிக்கும் அடிப்படையாகக் கொண்டது."
751,எனவே ஆய்தம் தனக்கு முன்னுள்ள எழுத்தை நோக்க அறுவகை ஒலிகளை யுடையது எனலாம்.
752,", ."
753,"அவ்வாறே குற்றியலிகரமும் குற்றியலுகரமும், அவற்றின் பற்றுக் கோடாகிய வல்லினமெய் முதலியன பிறக்குமிடங்களில் பிறந்து பலவகைப்பட்டன என்பதும் வெளிப்படை."
754,இவற்றுள் முற்றியலிகரமும் குற்றியலிகரமும் ஓரினம் அல்ல என்பதும் விளங்கும்.
755,"எஃகு, கஃசு, முஃடீது, இஃது, அஃபோகம், கஃறீது என்ற இடங்களில் ஆய்தத்தின் ஒலி மாறுபட்டிருத்தல் வேண்டும் என்பது பெறப்படும்."
756,"இது முட்டீது என்றது முஃடீது என்றேனும், கற்றீது என்றதும் கஃறீது என்றேனும் மாறலாம் என்று கூறப்படுதலால் விளங்கும்."
757,சார்பெழுத்துக்களின் பிறப்பிடம் அவற்றிற்குச் சார்பான எழுத்துக்களுக்கு அருகிலுள்ள அவற்றை ஒலிக்கத் தகுந்த இடமே யாகும்.
758,"ஆய்தத்தைக் குறிக்கும் பெயர்கள் அஃகேனம் எனினும், தனிநிலை எனினும், ஆய்தம் எனினும் ஒக்கும்."
759,"எடு எஃகு கடிது, எஃகு பெரிது அல்வழி தொ."
760,"எடு எஃகு, கஃசு இக்குற்றியலுகரம் அல்வழிக்கண் இயல்பாகப் புணரும்."
761,"வேற்றுமைக்கண் இயல்பாயும், இன்சாரியை அடுத்து இயல்பாயும் புணரும்."
762,"எடு எஃகு கடிது, கஃசு தீர்ந்தது அல்வழி எஃகு கடுமை, எஃகின் கடுமை வேற்றுமை நன்."
763,", ஆய்தப் புள்ளி ஆய்தமான புள்ளி ஆய்தப்புள்ளி."
764,"ஆய்தப்புள்ளி என்றார், இதனையும் ஒற்றின்பால் சார்த்துதற்கு என்க."
765,"ஒற்றேல், உயிரேறப் பெறல் வேண்டுமெனின், சார்பெழுத்தாதலின் உயிர் ஏறப்பெறாது என்க."
766,இவ்வாறு அதன் உண்மை துணிந்து அதனை இறுதிக் கண் விலக்கி ஒற்றளபெடை என்று ஆமாறு காண்க.
767,சங்கர. ஆய்தம் எட்டு ஆதல் வல்லினவகையான் இயல்பாக வந்த ஆய்தம் ஆறு.
768,உரை ஆய்தம் பற்றிய கருத்து ஆய்தம் சார்பெழுத்து மூன்றனுள் ஒன்றாய் ஏனையவை போலப் புள்ளி பெறும்.
769,இதன் தமிழ்ப்பெயர் அஃகேனம் என்பது.
770,ஆய்தம் ஆச்ரிதம் என்பதன் திரிபு.
771,"பழைய ஏடுகளில் ஆய்தமானது, என இவ்வாறு இரண்டு புள்ளிகளோடு எழுதப்பட்டது."
772,ஒலியில் அது தன்முன் வரும் வல்லெழுத்தின் ஒலியைப் பெறுகிறது.
773,முன் இடமுன் நெடுங்கணக்கில் ஆய்தம் உயிர்வரியின் இறுதியில் வைக்கப்பட்டுள்ளது.
774,இது வடமொழியிலுள்ள விஸர்க்கம் போல்வது.
775,வடமொழியில் விஸர்க்கம் ககர பகரங்கள் வருமிடத்து அவற்றின் ஒலி பெறும்.
776,அதனை இக்காலத்தார் நடுவு வாங்கியிட்டு எழுதுப என்று நச்.
777,"கூறுவதால், அவர்காலத்தில் ஆய்தம் இரண்டு புள்ளி வடிவினதாகவே எழுதப்பட்டிருத்தல் வேண்டும்."
778,ஆய்தத்துக்குத் தனியே ஒலியின்று.
779,அஃது அடுத்து வரும் வல்லின மெய்யின் ஒலிக்கு ஏற்பத்தானும் திரிந்தொலிக்கும்.
780,இக்காலத்தார் ககரமெய்யை அடுத்த ஆய்த ஒலியையே ஏனைய வல்லெழுத்துக்களை அடுத்த ஆய்தத்துக்கும் ஒலியாகக் கொண்டுள்ளனர்.
781,ஆய்தமும் மெய்யாதல் மெய்யெழுத்துக்குப் புள்ளி என்பதும் பெயர் ஆய்தமும் புள்ளி யெழுத்தாம்.
782,மெய்யின் மாத்திரை அரை ஆய்தத்தின் மாத்திரையும் அரை.
783,மெய் புணரும் இயலைப் புள்ளி மயங் கியல் என்றே தொல்.
784,ஆய்தத்தை அவர் ஆய்தப் புள்ளி என்றே குறிப்பிடு கிறார்.
785,"ஒருமெய் மற்றொரு மெய்யாகத் திரியும் புணர்ச்சிக்கண், கல் தீது கஃறீது தொ."
786,"நச்., முள் தீது முஃடீது என்பன இடையே கூறப்படுதலானும் ஆய்தம் மெய்யாகவே கொள்ளப்படும்."
787,", நச்."
788,"உரை ஆயிடை உடம்படுமெய் பெறாமை இவ்வணி, ஆயிடை உடம்படுமெய் பெறாமை காண்க."
789,ஆயியல்பு இன்று அவ்வியல்பு என்பது செய்யுளின்கண் அகரச்சுட்டு நீண்டு யகர உடம்படுமெய் பெற்று ஆயியல்பு என்று வரும்.
790,ஆயியல்பு இன்று அந்த இயற்கையைப் பெறாது அஃதாவது அந்த ஈற்றுப் பொதுமுடிபைப் பெறாது என்பது.
791,வருமாறு பூ கொடி பூங்கொடி தொ.
792,சிறுபான்மை மகரம் கெட்டு வல்லெழுத்து மிகுதலுமுண்டு.
793,ஸகஸ்ரம் என்ற ஆரியச்சொல் சாசிரம் எனக் கன்னடத்தில் இன்றும் வழங்குகிறது.
794,சாசிரம் ஆயிரம் எனத் திரிந்து அமைந் திருக்கலாம்.
795,எடு ஆர் கோடு ஆர்ங்கோடு ஆர் கண்ணி ஆரங் கண்ணி அம் பீர் அலர் பீரத்தலர் அத்து தொ.
796,உயிர்க்கணம் வருமிடத்து அம்முச்சாரியை பெறுதலின்று.
797,"நச், செய்யுட்கண் சுட்டு நீண்டு ஆவயின் என்று முடிந்து அவ்விடத்தில் என்ற பொருளில் வரும்."
798,நச். ஆவயினான அவ்விடத்துக்கண் தொ.எ.
799,"இசையின் அளவிறந்து ஒலிக்குமிடத்து உயிர் மாத்திரை ஈறாகவும், மெய் மாத்திரை ஈறாகவும் ஒலிக்கும் என்பர் இசைநூலார்."
800,நாவல் நெற்போர் தெழிப்போர் பகட்டினங்களை ஓட்டுவதொரு சொல்.
801,பண்டமாற்று பண்டங்களை விலை கூவி விற்றல்.
802,ஆவியும் ஒற்றும் தமக்குச் சொன்ன மாத்திரையின் மிக்கு இசைக்கவும் பெறும்.
803,நாவலும் முறையீடும் புலம்பும் குறிப்பிசையும் முதலாயின கொள்க.
804,கஃஃறென்னும் கல்லதர் அத்தம் என்பது குறிப்பிசை.
805,உயிர் மாத்திரையும் ஒற்று மாத்திரையும் நீளும் என்றார் கந்தருவநூலுடையார்.
806,அவை வந்தவழிக் காண்க.
807,"ஆறாம் வேற்றுமையுருபுகள் அது, அ என்பன."
808,அகரத்தொடு புணரும் வழி உடம்படுமெய் பெற்றுத் தமவ எமவ நமவ தனவ எனவ நினவ என முடியும்.
809,"நன்னூலாருக்கு, தாம் அது தமது எனப் புணரும்."
810,தனிக் குறில் முன் ஒற்று ஆறாம் வேற்றுமைக்கு இரட்டாது என்று அவர் விதித்தார்.
811,"கன்னடமொழியில், தனது தமது தன்உயிர் தம்உயிர் முதலியவற்றைத் தொல்."
812,அம் மொழியில் அகரம் ஆறன் உருபாகும்.
813,தெலுங்கில் பன்மை ஏற்ற பெயர்களுக்கு அகரமே உருபாக வருகிறது.
814,தமிழிலும் ஆறன்பன்மை உருபு அ என்று நன்னூலாரும் கூறியுள்ளார்.
815,ஆறாம் வேற்றுமைக்கு நன்னூலார் ஆது என்ற உருபும் கூறினார்.
816,நும் என்பதும் நும் அது ழூ நும து நுமது எனப் புணரும்.
817,ஆகவே செய்யுள் விகாரமும் மூன்றென அமையும்.
818,". ஆன்சாரியை, ஆன்உருபு இவற்றிடை வேறுபாடு ஆன்சாரியை தோன்றியவிடத்து யாதானும் ஓர்உருபினை அஃது ஏற்கும் ஆற்றலுடையது."
819,எடு ஒருபான் ஐ ஒரு பானை ஒருபான் கு ஒருபாற்கு.
820,ஆன்உருபு தோன்றிய விடத்து அது வேறோர் உருபினை ஏலாது.
821,"எடு வாளான் வெட்டினான், வாணிகத்தான் ஆயினான்."
822,உரை ஆன்சாரியை வரும் இடங்கள் ஒருபஃது இருபஃது....
823,"எண்பஃது என்ற சொற்கள் உருபுக ளொடு புணருமிடத்து, அச்சொற்களிலுள்ள அஃது என்பது கெட, ஆன்சாரியை வர, ஒருபான் இருபான்..."
824,"எண்பான் என நின்று உருபேற்று, ஒருபானை, ஒருபானொடு ....."
825,எண்பானை எண்பானொடு எனப் புணரும்.
826,"ஒன்பது என்பதும் ஒன்பான் என ஆன்சாரியை பெற்றுத் திரிந்து, ஒன்பானை ஒன்பா னொடு என உருபேற்றுப் புணரும்."
827,எடு ஒன்பான் முதனிலை தொ.
828,நச். ஒன்பாற்கு ஒற்றிடை மிகுமே தொ.
829,"நச். இகர ஐகார ஈற்று நாட்பெயர், தம் முன்னர் வினைச்சொல் வரு மிடத்து இடையே ஆன்சாரியை பெற்றுப் புணரும்."
830,"எடு பரணியாற் கொண்டான், சித்திரையாற் கொண் டான் தொ."
831,", நச். மகரஈற்று நாட்பெயர் அத்துச் சாரியையோடு ஆன்சாரியை பெற்று வருமொழியாக வரும் வினைச்சொல்லொடு புணரும்."
832,எடு மகத்தாற் கொண்டான் தொ.
833,"நச். வினையெனவே, வினைப்பெயரும் அடங்கும்."
834,"பரணியாற் கொண்டவன், சித்திரையாற் கொண்டவன், மகத்தாற் கொண்டவன் எனக் கொள்க."
835,இவை ஏழாம் வேற்றுமைப் பொருளன.
836,", நச். ஆன்மாச்சிரயம் இது தன்னைப் பற்றுதல் என்னும் குற்றம்."
837,ஏனைய எழுத்துக்களின் தோற்றத்திற்குக் காரணமாக இருக்கும் அகரம் தன் தோற்றத்துக்கும் தானே காரணம் என்று கூறுதல் ஆன்மாச்சிரயமாம்.
