Line Number,Sentence
1957,உரிச்சொல் எடு வடி வேல் வியன் உலகம் வடி கூர்மையான.
1958,வியன் பரந்த.
1959,தொடர்மொழி எடு நன்றியறிவுள்ள நாய் ஆரியப் படைகடந்த நெடுஞ்செழியன் .
1960,கிளவியம் எடு மாந்தன் பேச்சின்றியிருந்த காலமும் உண்டு.
1961,கிளவியத்தையுள்ளிட்ட கிளவியம் எடு கடவுளில்லையென்று சொல்லுகிற காலம் இது.
1962,"இதில், கடவுளில்லை என்பது ஒரு கிளவியம்."
1963,கடவுளில்லை யென்று பலர் சொல்லுகிற காலம் என்பது கிளவியத்தை உள்ளிட்ட கிளவியம்.
1964,"செயப்படுபொருளடை வடிவுகள் எழுவாயும் செயப்படுபொருளும் ஒத்த சொல்லாதலின், எழுவாயடை வடிவுகளே செயப்படுபொருளடை வடிவுகளும் என அறிக."
1965,எடுத்துக்காட்டுகள் மேற்காண்க.
1966,காலம் எடு மாலைப் பதனீர் கார்காலத்து மயில் .
1967,இடம் எடு சீமைச் சரக்கு ஆப்பிரிக்க மடங்கல் கீழிந்தியக் குழும்பு நாட்டுப்புறத்து மக்கள் .
1968,செய்பவன் எடு தட்டான் வேலை செருமானியப் போர் .
1969,நோக்கம் எடு பரிசு பெறும் படிப்பு வந்த காரியம் .
1970,கருவி எடு உளி வெட்டு தாள் வேலை .
1971,காரணம் எடு வெட்டு க்காயம் கத்திபட்ட புண் வழிநடந்த உளைச்சல் வேலை செய்த களைப்பு .
1972,செய்பொருள் எடு நகை வேலை சுருட்டு த்தொழில் .
1973,விளைவு எடு அழுத பிள்ளையும் வாய்மூடும் அதிகாரம் வாயூறும் மாங்கனி கண்கவர் கட்டடம் .
1974,நிலைப்பாடு எடு நாள்வட்டி கொடுக்கும் கடன் .
1975,ஒப்பீடு எடு மிகச் சிறந்த புத்தகம் தேனினு மினிய சொல் .
1976,தன்மை எடு நல்ல பிள்ளை புலவன் வள்ளுவன் பாண்டியன் நெடுஞ்செழியன் திறமை குடிப்பிறப்பு முதலியவெல்லாம் தன்மையுள் அடங்கும்.
1977,"கோடிச்செல்வன் என்பதில், கோடி என்பது அளவுப் பொருளடை உடைமைப் பொருளடையன்று."
1978,ஒரு கருத்துப்பற்றிய அடை பல்வேறு வடிவில் வரலாம் கருத்திற்கேற்ப அதனை வகைப்படுத்திக் கூறல் வேண்டும்.
1979,எடுத்துக்காட்டுகள் மேற்காண்க.
1980,"பயனிலை வடிவுகள் எச்சப் பயனிலை வடிவுகள் எச்சப்பயனிலை, பெயரெச்சம், வினையெச்சம், தொழிற்பெயர், ஆகிய மூவடிவில் வரும்."
1981,பெயரெச்சம் எடு முருகன் வந்த இ.கா.
1982,முருகன் வருகிற நி.கா.
1983,முருகன் வரும் எ.கா.
1984,வினையெச்சம் எடு முருகன் வந்து இ.கா.
1985,முருகன் வர நி.கா.
1986,"முருகன் வரின், வந்தால், எ.கா."
1987,"வருவான், வரற்கு, வருவதற்கு, வரும்படிக்கு, வருமாறு ."
1988,தொழிற்பெயர் எடு முருகன் வருதல்.
1989,முற்றுப் பயனிலை வடிவுகள் முற்றுப்பயனிலை பின்வருமாறு பல வடிவுகளில் வரும் .
1990,"பெயரெச்சம் எடு அது மரம், இது கருங்காலி, இவன் தச்சன், அவர் கா."
1991,வினைமுற்று எடு கந்தன் வந்தான்.
1992,தெரிநிலை இரெட்டியார் நல்லவர்.
1993,குறிப்பு நீ வா.
1994,ஏவல் இறைவன் அருள்க!
1995,வியங்கோள் .
1996,இடைச்சொல் எடு இது மற்றையது.
1997,ஆண்மையும் முயற்சியும் உள்ளவனுக்கு அரசும் தஞ்சம்.
1998,தஞ்சம் எளிமை.மற்றையது தஞ்சம் என்னும் இரண்டும் உண்மையிற் பெயர்ச்சொற்களே.
1999,உரிச்சொல் எடு இக் காய் வம்பு.
2000,வறுமையும் ஒரு சிறுமை.
2001,வம்பு பருவமல்லாக் காலத்தில் தோன்றுவது.
2002,சிறுமை நோய்.
2003,ஏதேனுமொருசொல் எடு அவர் சொன்னது இயங்கி .
2004,அவர் சொன்ன சொல் இயங்கி.
2005,தொடர்மொழி எடு வந்தான் என்பது செயப்படுபொருள் குன்றியவினை.
2006,சோழவரசை மீண்டும் நாட்டியவன் முதலாம் இராசராசன்.
2007,"கிளவியம் எடு உயிர்நூலார் கருத்து, போரும் ஒரு தேவ ஏற்பாடு என்பது."
2008,பயனிலைப் பொருள்வகைகள் பயனிலைப் பொருள்கள் பின்வருமாறு எண்வகைப்படும் .
2009,சொன்மை குறித்தல் எடு கம்பர் மகன் பெயர் அம்பிகாபதி.
2010,சேக்கிழார் பொன்னம்பலத்திற் கேட்ட சொல் உலகெலாம்.
2011,சொற்பொருண்மை அல்லது பொருட்பாடு குறித்தல் எடு உசாவே சூழ்ச்சி.
2012,"உசா என்னும் சொல்லின் பொருள் சூழ்ச்சி என்பது, இவ் வாக்கியப் பொருள்."
2013,பொருண்மை குறித்தல் எடு அவர் இ.மு.
2014,சுப்பிரமணியப் பிள்ளை.
2015,இது நீர்மூழ்கி .
2016,செய்கை குறித்தல் எடு நக்கீரர் இறையனார் அகப்பொருளுக்கு உரை கூறினார்.
2017,இந்த மாம்பழம் இனிக்கிறது.
2018,பண்பு குறித்தல் எடு வள்ளுவர் குறளில் .
2019,பால் விகுதியேற்ற இந்த மாம்பழம் இனியது.
2020,கோபம் சண்டாளம்.
2021,பால் விகுதியேலாப் கூத்தாளுக்கு இருகண்ணும் குருடு.
2022,கடும்பா ஆசுகவி பாடுவது கடினம் .
2023,ஏவல் குறித்தல் எடு புதன் சனி முழுகு.
2024,கண்டொன்று சொல்லேல்.
2025,மதிப்பற்ற ஏவல் ஐயா!
2026,இதை யாரிடமும் சொல்லற்க!
2027,மதிப்புற்ற ஏவல் .
2028,நோக்கங் குறித்தல் எடு தமிழ் வாழ்க!
2029,கள்ளவிலைக் கொள்ளைக்காரர் ஒழிக!
2030,வினாக்குறித்தல் எடு ஒரே நாளில் எழு பகையரசரை வென்ற இளம் பாண்டியன் யார்?
2031,அறிவினா வேப்பெண்ணெய் விற்ற காசு கசக்குமா?
2032,அறிவினா வானூர்தியின் மணி வேகம் எவ்வளவு?
2033,அறியா வினா ஒரு புகைவண்டியின் விலை என்ன?
2034,பயனிலையடை வடிவுகள் பயனிலையடை பின்வருமாறு பல வடிவுகளில் வரும் .
2035,வினையெச்சம் எடு வந்து போனான் தெரிநிலை இல்லாது இருக்கிறான் குறிப்பு .
2036,வேற்றுமையேற்ற பெயர் எடு வீட்டில் இருக்கிறான் மரத்தினின்று விழுந்தது .
2037,இப்பெயரையும் காலப்பெயரையும் தழுவிய பெயரெச்சம் எடு வந்தவிடத்து நேர்ந்தது சொல்லும்போது நன்றாயிருந்தது .
2038,இடைச்சொல் எடு கொன்னே கழிந்தது கொன்னே வீணாக.
2039,உரிச்சொல் எடு சால உண்டான் நனி சிறந்தது .
2040,தொடர்மொழி எடு ஆறுமாத காலமாக நடக்கிறது எத்தனைமுறை சொன்னாலும் தெரியவில்லை .
2041,கிளவியம் எடு உயிர்போனாலும் சொல்லமாட்டான் .
2042,கிளவியத்தை யுள்ளிட்ட கிளவியம் எடு மயிலே மயிலே இறகுபோடு என்றால் போடுமா?
2043,இதன் விரிவு மயிலே மயிலே நீ இறகு போடு என்று ஒருவர் சொன்னால் அது போடுமா?
2044,"இதில், மயிலே மயிலே இறகு போடு என்பது ஒரு கிளவியம்."
2045,இதையுள்ளிட்ட கிளவியம் மயிலே!
2046,இறகு போடு என்றால் என்பது.
2047,பயனிலையடைப் பொருள்வகைகள் பயனிலையடைப்பொருள் பின்வருமாறு பலவகைப்படும் .
2048,காலம் எடு நேற்று வந்தான்.
2049,மழைநாள்களில் வளரும்.
2050,இடம் எடு இங்கே இருக்கிறான்.
2051,ஐந்து கண்டத்திலும் அதைக் காணலாம்.
2052,நோக்கம் எடு பரிசுபெறும் பொருட்டுப் படித்தான்.
2053,மகனைப் படிக்கவைத்தற்காக அவர் இங்கே வந்திருக்கிறார்.
2054,காரணம் எடு சூதாடித் தோற்றான் பொருளையெல்லாம்.
2055,அடிப்படையில்லாததினால் கட்டடம் விழுந்தது.
2056,விளைவு எடு ஊரெல்லாம் கேட்கும்படி உரக்கக் கத்தினான்.
2057,பிறர் நெஞ்சம் புண்படும்படி பேசக்கூடாது.
2058,நிலைப்பாடு எடு இம் மாதம் ஆம் நாளுக்குள் பணம் கட்டிவிட்டால் வட்டி வேண்டியதில்லை.
2059,இன்னும் ஒரு வாரத்திற்குள் தெரிவிக்காவிட்டால் தண்டனை ஏற்படும்.
2060,ஒப்பீடு எடு முன்னிலும் சிறப்பாகப் பேசினார்.
2061,ஞாலம் திங்களைவிட ஐம்பத்தைந்து மடங்கு பெரியது.
2062,வைத்துக்கொள்வு அல்லது இணக்கம் எடு அவர் நேரில் வந்து கேட்டாலும் என் புத்தகத்தை இரவல் கொடுக்க முடியாது.
2063,அடாத மழை பெய்தாலும் விடாது வகுப்பு நடத்தப்பெறும்.
2064,தன்மை எடு நன்றாய் இருக்கிறது படம்.
2065,அன்போடு அளவளாவுவார்.
2066,அளவு எடு சரிசமமாய் இருக்க விரும்புகிறான்.
2067,நெடுங்காலமாக அந்தப் பேச்சு நடந்துவருகிறது.
2068,ஆனைக்கும் பூனைக்கும் உள்ள அளவு அவருக்கும் எனக்கும் வேற்றுமையுண்டு.
2069,தான் வாங்கின ஒரு படியை இருபடியாகக் கொடுத்து விட்டான்.
2070,நிலைப்பாடு உணர்த்தப்பெறும் வகைகள் .
2071,எதிர்கால வினையெச்சம் எடு அவன் வந்தால் கிடைக்கும் உடன்பாடு அவன் வராவிடின் கிடையாது.
2072,"ஏவல் எடு கேள், கொடுப்பார்."
2073,ஒழிய என்னும் சொல்லொடுகூடிய எதிர்கால வினையெச்சம் எடு இவ் வேலையை முடித்தாலொழிய உனக்குக் கூலி கிடையாது.
2074,இவ்வகை என்றும் எதிர்மறையே குறிக்கும்.
2075,"காலப்பெயரோடும் இடப்பெயரோடும் கூடிய பெயரெச்சம் எடு அவர் இங்கு வரும் பக்கத்தில், ஆயிரம் உருபா வேண்டுமாயினும் தருகின்றேன்."
2076,அவர் இங்கு வரும்போது கொடுப்பேன்.
2077,வினையாலணையும் பெயர் எடு படித்தவன் தேறுகின்றான்.
2078,போனவனுக்குக் கிடைக்கின்றது.
2079,வினாச்சொல்லும் அப்படியானால் என்னும் இணைப்புச் சொல்லும் எடு நீயும் அவர்களில் ஒருவனா?
2080,அப்படியானால் இங்கே இராதே.
2081,நீ எதிர்க் கட்சிக் கூட்டத்திற்குப் போனாயா?
2082,"அப்படியானால் உனக்கு வேலையில்லை, போ."
2083,அது புலியானால் என் செய்வோம்?
2084,வரப்போகிற கல்வியமைச்சர் தமிழரானால் தமிழுக்கு ஆக்கம் உண்டாகும்.
2085,"ஆய் என்னும் விகுதியோடும், இருந்தால் என்னும் சொல்லோடும் கூடிய துவ்விகுதித் தொழிற்பெயர், எடு அவர் வருகிறதாயிருந்தால் சொல், வண்டியனுப்புகின்றேன்."
2086,"வினைமுற்று எடு அவன் அங்குப் போனான், செத்தான்."
2087,இப் பொருளில் பெரும்பாலும் இறந்தகால வினைமுற்றும் சிறுபான்மை நிகழ்கால வினைமுற்றும் வரும் எதிர்கால வினைமுற்று வரவே வராது.
2088,இப் பொருளில் வரும் வினைமுற்றை ஒலிக்கும்போது குரல் வேறுபடும்.
2089,எடு இன்றைக்குத் திடுமென்று உண்ணோட்டகர் வந்துவிட்டார் என்று வைத்துக்கொள் வைத்துக்கொள்வோம் அப்போது எப்படிக் கணக்குக் காட்டுகிறது?
2090,"முற்றுப்பயனிலையும் அப்போது அல்லது அப்படியானால்என்னும் சொல்லும் எடு ஐயா, இன்றைக்கு மழையே வந்துவிட்டது, அப்போது இவற்றையெல்லாம் எப்படி அள்ளுவது?"
2091,நீ ஒரு சிறு பையன் அப்படியானால் என்ன செய்வாய்?
2092,இறந்தகால வினையெச்சம் எடு படித்துத் தேறவேண்டும் படித்தால் தேறலாம்.
2093,நிகழ்கால வினையெச்சம் எடு வரப்புயர நீருயரும் நீருயர நெல்லுயரும் நெல்லுயரக் குடியுயரும் குடியுயரக் கோனுயரும் கோனுயரக் கோலுயரும்.
2094,செய்யவேண்டும் என்னும் வாய்பாட்டு வினைமுற்று எடு தேடவேண்டும் தின்னவேண்டும்.
2095,"படிக்கவேண்டும், தேறவேண்டும்."
2096,"தேடினால் தின்னலாம், படித்தால் தேறலாம் என்பது இவற்றின் பொருள்."
2097,வைத்துக்கொள்வு அல்லது இணக்கம் உணர்த்தப்பெறும் வகைகள் .
2098,உம்மீறு பெற்ற இறந்தகால வினையெச்சம் எடு இவ்வூருக்கு வந்தும் என்னைப் பாராது போயிருக்கின்றான்.
2099,"நான் பலமுறை சொல்லியும், அவன் கேட்கவில்லை."
2100,உம்மீறு பெற்ற எதிர்கால வினையெச்சம் எடு ஆயிரம் உருபா கொடுத்தாலும் அவன் இதற்கு இணங்கமாட்டான்.
2101,பால் புளிப்பினும் பகல் இருளினும் நீ இவளைக் கைவிடல் கூடாது.
2102,"உன் பெற்றோர் உன்னைக் காவாவிட்டாலும், நான் உன்னைக் காப்பேன்."
2103,"போதிலும் என்னும் சொல்லோடு கூடிய இறந்தகாலப் பெயரெச்சம் எடு அவன் உன்னைத் தடுத்தபோதிலும், உன் வாக்கை மாற்றக் கூடாது."
2104,"ஏவல் வினை எடு நீ ஆயிரம் சொல், அவன் கேட்கமாட்டான்."
2105,ஏவல் வினையும் ஆனாலும் என்னும் சொல்லும் எடு நீ ஆயிரம் சொல் ஆனாலும் அவன் கேட்கமாட்டான்.
2106,முன்னிலை வினைமுற்று எடு நீ ஆயிரம் சொன்னாய் அவன் கேட்கமாட்டான்.
2107,"முன்னிலை வினைமுற்றும் ஆனாலும் என்னும் சொல்லும் எடு நீ ஆயிரம் சொன்னாய், ஆனாலும் அவன் கேட்கமாட்டான்."
2108,ஆனாலும் இப்படி முரட்டுத்தனமாய் அடிக்கலாமா?
2109,அவன் ஒரு கொலைகாரன்தான் ஆனாலும் அவனைத் திருத்தக் கூடாதா?
2110,"வினைமுற்றும் என்று வைத்துக்கொண்டாலும் என்னும் தொடரும் எடு அவன் திருடன் என்று வைத்துக்கொண்டாலும், நமக் கொரு தீங்கும் செய்யவில்லையே!"
2111,நிரப்பிய வடிவுகள் நிரப்பியம் பின்வருமாறு பல வடிவுகொள்ளும் .
2112,பெயர்ச்சொல் எடு இன்று இருட்டாயிற்று.
2113,வேற்றுமையேற்ற பெயர் எடு மாட்சிமை தங்கிய ஆம் சியார்சு மன்னர் ஆம் அகவையில் பட்டத்திற்கு வந்தார்.
2114,வினைமுற்று எடு இன்று மழை வரும் போலும்.
2115,வினையெச்சம் எடு படம் நன்றாயிருக்கிறது.
2116,இடைச்சொல் எடு குற்றமுள்ள நெஞ்சு குறுகுறு என்னும்.
2117,காலம் பார்த்துச் செய்பவருக்கு ஞாலங் கொள்வதும் தஞ்சம் ஆகும்.
2118,தஞ்சம் எளிமை.
2119,உரிச்சொல் எடு இதில் ஐந்துக்கு மூன்று பழுதாகும்.
2120,தொடர்மொழி எடு மேன்மை தங்கிய பெருமகனார் சக்கரவர்த்தி அரச கோபாலாச்சாரியார் ஆம் ஆண்டில் இந்தியப் பதிலரையர் ஆனார்.
2121,குறிப்பு ஒரே சொல் வெவ்வேறிடத்தில் வெவ்வேறு பொருள்படலாம்.
2122,பொருள் நோக்கி நிரப்பியத்தைக் கண்டுபிடித்தல் வேண்டும்.
2123,இன்று இருட்டாய்விட்டது என்னும் தொடரில் இருட்டாய்விட்டது என்பது இருட்டாக மாறிவிட்டது என்று பொருள்படும் தொடர்மொழி.
2124,"இதில், இன்று எழுவாய் ஆய்விட்டது பயனிலை இருட்டு நிரப்பியம்."
2125,துணைவினைகளை யடுத்துவரும் பிறசொற்களை நிரப்பிய மென்று மயங்குதல் கூடாது.
2126,"எடு குடியிரு, எடுத்துவிடு."
