Line Number,Sentence
1,பாவாணர் தமிழ்க்களஞ்சியம் உயர்தரக் கட்டுரை இலக்கணம் ஙரூபுஹது ஸநிகுணுடகுழூர ஞா.
2,"படிகள் நூலாக்கம் பாவாணர் கணினி தி.நகர், சென்னை ."
3,அட்டை வடிவமைப்பு வ.
4,"மலர் அச்சிட்டோர் ஸ்ரீ வெங்கடேசுவரா ஆப்செட் பிரிண்டர்சு இராயப்பேட்டை, சென்னை ."
5,பாவாணர் வழி நிலை அறிஞர்களான முதுமுனைவர் இரா.
6,"இளங்குமரனார் அவர்களும், மருத்துவர் கு.பூங்காவனம் அவர்களும் இவ்வரிய கட்டுரைப் புதையல்கள் நூல் வடிவம் பெறுவதற்கு மிகவும் உறுதுணையாக இருந்தனர்."
7,இப்பெருமக்களை நன்றியுணர்வுடன் நினைவுகூர்கிறேன்.
8,எதிரிகள் யார்?
9,பாவாணர் நூல்கள் அத்தனையும் தமிழ்மொழிக்கு ஏற்றம் உரைப்பன.
10,தமிழை ஆரிய இருளினின்று மீட்டுக் காப்பன.
11,வீழ்ந்து பட்ட தமிழனுக்கு விழிப்பூட்ட வல்லன.
12,பாவாணரைத் தூக்கிப் பிடித்தால்தான் தமிழினம் உருப் படமுடியும் உயரமுடியும்.
13,இவர்களை இவ்வெளியிட்டின் வாயிலாக நன்றியுணர்வோடு நினைவு கூறுகிறேன்.
14,"தந்தை பெரியாரின் தன்மதிப்பு இயக்கக் கொள்கை களாலும், மொழிஞாயிறு பாவாணரின் தனித்தமிழ் இயக்கக் கொள்கைகளாலும் ஈர்க்கப்பட்டவன்."
15,அத்தகு பின்புலத்தோடு பதிப்புப்பணியில் என் காலடிச் சுவடுகளைப் பதித்து வருகிறேன்.
16,"இளவழகன், பதிப்பாளர்."
17,"முகவுரை எந்த மொழியின் வளர்ச்சிக்கும் அதன் உரைநடையிலக்கணம் இன்றியமையாத தென்பது, எல்லார்க்கும் தெரிந்ததே."
18,"பண்டைத் தமிழிலக்கியம் பெரும்பாலும் செய்யுள் வடிவாயிருந்தமையின், பழந்தமிழிலக்கணங்கள் பெரும்பாலும் செய்யுட்கே இலக்கணம் கூறி வரலாயின."
19,"எடுத்துக்காட்டாக, நிகழ்கால வினையெச்ச எழுவாயையும் வாக்கியப் பாகுபாட்டையும் காண்க."
20,"ஆங்கிலத்திற்கும் தமிழுக்கும் சில ஒற்றுமைகள் இருக்கும்போதே பல வேற்றுமைகளுமிருத்தலின், ஆங்கிலவிலக்கணத்திற் கூறப்பட்டுள்ள சில அமைதிகள் தமிழுக்கேற்றவாறு மாற்றிக் கூறப்பட்டுள்ளன."
21,"இந்நூல், தொடரியல், மரபியல், கட்டுரையியல் என மூவியல்புகளை யுடையது விரிவுபாடு கருதி இருபாகமாக வெளியிடப் பெற்றுளது."
22,"முதற்பாகம் முதலியலையும், இரண்டாம் பாகம் ஏனையியல்களையும் கொண்டவை."
23,இந்நூலிலுள்ள இயற்பிரிவுகளின் உட்பிரிவுகளும் விதிகளும் மறுபதிப்பில் எண்ணீடு பெறும்.
24,"சேலம், .. ஞா.தேவநேயன் உள்ளடக்கம் பக்கம் பதிப்புரை . வான்மழை வளச்சுரப்பு . முகவுரை . ."
25,தொடரியல் .
26,தொடர் வகைகள் . .
27,கிளவியம் .
28,தொடர்மொழி... .
29,தொடர்மொழி வகைகள் ...
30,பெயர்த் தொடர்மொழி . பெயரெச்சத்தொடர்மொழி ...
31,வினையெச்சத்தொடர்மொழி ...
32,கிளவிய வகைகள் . பெயர்க்கிளவியம் .
33,பெயரெச்சக் கிளவியம் .. வினையெச்சக் கிளவியம் . கிளவியத்தை உள்ளிட்ட கிளவியம் .
34,வாக்கிய வகைகள் தனிவாக்கியம் கூட்டுவாக்கியம் கலப்புவாக்கியம் ...
35,கதம்பவாக்கியம் .
36,சொல்முறை . .
37,வேற்றுமைப் பொருத்தம் ...
38,இசைபு .
39,காலமுடிபு . .
40,ஒப்பீட்டுத்தரங்கள் . .
41,வாக்கியக்கூறுபடுப்பு . தனிவாக்கியக் கூறுபடுப்பு கூட்டுவாக்கியக்கூறுபடுப்பு...
42,கலப்புவாக்கியக் கூறுபடுப்பு கதம்பவாக்கியக்கூறுபடுப்பு...
43,எழுவாய் வடிவுகள் எழுவாயடை வடிவுகள் . செயப்படுபொருளடைப் பொருள் வகைகள்...
44,பயனிலை வடிவுகள்...
45,பயனிலையடை வடிவுகள் . பயனிலையடைப் பொருள் வகைகள் . நிலைப்பாடு உணர்த்தப்பெறும் வகைகள்...
46,நிரப்பிய வடிவுகள் .
47,வாக்கிய ஒன்றுசேர்ப்பு ... பெயரெச்ச கிளவிய கலப்பு வாக்கியம் . வினையெச்ச கிளவிய கலப்பு வாக்கியம்...
48,வாக்கிய வடிவு மாற்றம் ...
49,சொல்வகைபரிமாற்ற ...
50,"நேர்கூற்று, நேரல்கூற்று ."
51,நிறுத்தக்குறிகள் உயர்தரக் கட்டுரை இலக்கணம் தொடரியல் .
52,"தொடர் வகைகள் சொற்கள், தனித்து நிற்பதும் தொடர்ந்து நிற்பதும்பற்றி, தனிச்சொல், தொடர்ச்சொல் என இருவகைப்படும்."
53,தொடர்ச்சொல் எனினும் சொற்றொடர் எனினும் ஒக்கும்.
54,"எடுத்துக்காட்டு கடவுள், துணை, செய்வார் தனிச்சொல்."
55,"கடவுள்துணை, கடவுள் துணைசெய்வார் தொடர்ச்சொல்."
56,"தொடர்ச்சொற்கள் அல்லது சாற்றொடர்கள்,வற்றில்மைந்துள்ளசாற்களின்தாகைபற்றி,ருசொற்றொடர், ல்சொற்றொடர்னருவகைப்படும். சாற்கள்சர்ந்ததாடர்ருசொற்றொடர்ரண்டிற்குற்பட்டற்கள்ர்ந்தடர்ப."
57,"எடு ழனிமலை,ருகன்ருவான் ருற்றொடர்அஞ்செயவிம்பு. பல்காற் பயில்க."
58,ஒழுக்கமற்றவன் உயர்திணையைச் சேர்ந்தவ னல்லன்.
59,"இருசொற்றொடர், புணர்ச்சொல் அல்லது புணர்மொழி எனவும் பெயர்பெறும்."
60,"எடு உரையாடு, வந்திடு, எழுந்திரு, கண்ணுறு, வேண்டிக்கொள், வரையப்படு, கொண்டுபோ, உடைத்துப்போடு, கொண்டுவா, தந்துவிடு."
61,"எடு மயிலாடுதுறை, இரப்போர்க்கிடு, எழுந்து இரு, விதியுறு, விலைக்குக்கொள், பாடுபடு, எடுத்துப்போ, நிலத்திற்போடு, எடுத்துவா, குடியைவிடு."
62,வினைகள் துணைவினையாக வரும்போது பொருட் பாட்டில் பின்வருமாறு முந்நிலை யடையும்.
63,பொருள் வேறுபடுதல்.
64,"எடு உரையாடு, வரையப்படு."
65,எடு எழுந்திரு எழு.
66,பிரிக்க முடியாமை.
67,"எடு கொண்டுவா, கொண்டுபோ."
68,"கொண்டுவா அல்லது கொண்டுபோ, என்னும் இருசொற் களும் பொருளால் இணைந்து ஒருசொற்றன்மைப்பட்டு நிற்றல் காண்க."
69,வாக்கிய வுறுப்புகள் .
70,வாக்கியம் எழுவாயும் பயனிலையும் அமைந்து கருத்து முடிந்த இரு சொற்றொடரும் பல்சொற்றொடரும் வாக்கியம் எனப்படும்.
71,நாம் பேசும்போது பல வாக்கியங்களாகப் பேசுகிறோம்.
72,"நாம் பேசுவதையே அல்லது பேசும் முறைப்படியே எழுதுவதினால், எழுதும்போதும் அங்ஙனமே வாக்கியங்களாக எழுதுகிறோம்."
73,ஒவ்வொரு வாக்கியமும் ஒவ்வொரு முடிந்த கருத்தையுடையது.
74,"ஒரு வாக்கியத்தில் பல கருத்துகளிருந்தாலும், முடிந்த கருத்து ஒன்றுதான் இருக்கும்."
75,ஒரு சொற்றொடர் முடிந்த கருத்தையுடையதா யிருப்பதற்கு இரு நிலைமைகள் வேண்டும்.
76,ஒன்று எழுவாயும் பயனிலையு மிருத்தல் இன்னொன்று பயனிலை முற்றுச்சொல்லா யிருத்தல்.
77,"ஒவ்வொரு வாக்கியத்திலும், ஒரு பொருளைப்பற்றி ஒரு செய்தி சொல்லப்பட்டிருக்கும்."
78,"எந்தப் பொருளைப்பற்றி ஒரு செய்தி சொல்லப்பட்டிருக்கிறதோ, அந்தப் பொருளைக் குறிக்கும் சொல் எழுவாய் எனப்படும்."
79,"ஒரு பொருளைப்பற்றி என்ன செய்தி சொல்லப்பட்டிருக்கிறதோ, அன்ன செய்தியைக் குறிக்கும் சொல் பயனிலை எனப்படும்."
80,கந்தன் வந்தான் என்பது ஒரு வாக்கியம்.
81,இதில் கந்தன் என்பவனைப்பற்றி வந்தான் என்னும் செய்தி சொல்லப்பட் டிருக்கின்றது.
82,"ஆகையால், கந்தன் என்பது எழுவாய் வந்தான் என்பது பயனிலை."
83,"கந்தன் வந்து என்னும் சொற்றொடரும் அதே எழுவாயும் அதே பயனிலையும் கொண்டுள்ளதே ஆயினும், வாக்கிய மாகாது."
84,"ஏனெனின், வந்து என்னும் பயனிலை முற்றுச்சொல்லா யில்லை."
85,அது வேறொரு சொல்லைக்கொண்டு பொருள் முடிவதா யிருக்கின்றது.
86,கந்தன் வந்து போனான் என வேறொரு முற்றுச் சொல் வந்துதான் அதன் பொருள் முடிதல் வேண்டும்.
87,அன்றுதான் கந்தன் வந்து என்னும் தொடரும் பொருள் முடியும்.
88,"கந்தன் வந்தான், கந்தன் வந்து போனான் என்னும் சொற்றொடர்கள், முற்றுச்சொற்களைப் பயனிலையாகக் கொண்டுள்ளமையால் வாக்கியமாகும்."
89,"வந்தான், போனான் என்பன முற்றுச்சொற்கள்."
90,எந்த வாக்கியமும் ஒரு பொருளைப்பற்றி ஒரு செய்தி சொல்வதென்பது முன்னர்க் கூறப்பட்டது.
91,இவ் விரு சொல்லுமின்றி வாக்கியமுமில்லை.
92,"ஆதலால், ஒரு பொருளைக் குறிக்கும் சொல்லே அதைப்பற்றி ஒரு வாக்கியம் உண்டாவதற்குக் காரணமாம்."
93,"இதனால், அஃது எழுவாய் எனப்பட்டது."
94,வாக்கியம் எழுவதற்கு உண்டாவதற்கு வாயாக இடமாக இருப்பது எழுவாய்.
95,எழுவாயின் பயன் பொருள் நிற்குமிடம் பயனிலை.
96,"கந்தன் என்று மட்டும் சொன்னால், அதன் பொருள் முடியவில்லை."
97,"அது, கந்தன் என்ன செய்தான்?"
98,கந்தனைப்பற்றி என்ன செய்தி?
99,என்னும் வினாக்கட்கு இடந்தரும்.
100,"கந்தன் வந்தான், கந்தன் நல்லவன் என வேறொரு முற்றுச் சொல்லைச் சேர்த்துக் சொன்னால்மட்டும் அதன் பொருள் முடியும்."
101,"வந்தான், நல்லவன் என்பன கந்தன் என்னும் எழுவாயின் பொருள் நிற்குமிடம் அல்லது முடிந்து நிற்குமிடமாதலால், அவை அதன் பயனிலையாகும்."
102,எழுவாயும் பயனிலையும் சொல்லையுங் குறிக்கும் பொருளையுங் குறிக்கும்.
103,"பொருள், சொற்பொருள் பொருட்பொருள் என இருவகைப்படும்."
104,ஒரு சொல்லின் பொருட்பாடு சொற்பொருள் சொற்களால் நேரடியாய்க் குறிக்கப் பெறும் காட்சியுங் கருத்துமாகிய இருதிணைப்பொருளும் பொருட்பொருள்.
105,"சொல்லையும் சொற்பொருளையும் குறிக்கும்போது, எழுவாயும் பயனிலையும் எச்சொல்லாகவும் இருக்கலாம்."
106,எடு எழுவாய் மாதிரி ஆங்கிலச்சொல் பெயர் விழைந்து விரும்பி வினையெச்சம் சொல் யானை மலையில் வாழும்.
107,பெயர்பொருட் முருகன் வள்ளியை மணந்தான்.
108,பொருட்பொருள் சிவன் நடிக்கின்றான் விழைந்து விரும்பி என்பது ஒரு வாக்கியம்.
109,விழைந்து என்னும் சொல் விரும்பி என்று பொருள்படும் என்பது இவ் வாக்கியத்தின் பொருள்.
110,"செயப்படுபொருள் குன்றாவினைகள் பயனிலையாக வரும் வாக்கியங்களில், எழுவாய் பயனிலையோடு செயப்படுபொருள் என வேறோர் உறுப்புமுண்டு."
111,"எடு சேரன் செங்குட்டுவன் கனகவிசயரை வென்றான், அதிகமான் அருநெல்லிக்கனி யீந்தான்."
112,"இவற்றுள், முதல் வாக்கியத்தில் கனகவிசயர் என்பதும், இரண்டாம் வாக்கியத்தில் அருநெல்லிக்கனி என்பதும், செயப்படுபொருளாம்."
113,செயப்படுபொருளைச் செய்பொருள் என்பதும் உண்டு.
114,செயப்படுபொருள் குன்றாவினைகள் செயப்படு பொரு ளின்றிப் பொருள் நிரம்பா.
115,செயப்படுபொருள் எப்போதும் இரண்டாம் வேற்றுமையி லேயே இருக்கும்.
116,சில வேளைகளில் அவ் வேற்றுமை யுருபு தொக்கு மறைந்து நிற்பதுமுண்டு.
117,"செயப்படுபொருள் குன்றிய வினைகள் பயனிலையாக வரும் வாக்கியங்களில், செயப்படுபொருள் இராது."
118,"எடு மருதன் வருகிறான், கராச்சியிலிருந்து இங்கிலாந்திற்கு வானவூர்தியிற் செல்ல இரண்டு நாள்கள் செல்லும்."
119,"இவ் வாக்கியங்களில், வருகிறான், செல்லும் என்பன செயப்படுபொருள் குன்றிய வினைகள்."
120,"ஆதலால், இவற்றில் செயப்படுபொருள் இல்லை."
121,எழுவாய் சில வாக்கியங்களில் தொக்கு நிற்பதுமுண்டு அது தொகையெழுவாய் அல்லது தோன்றா எழுவாய் எனப்படும்.
122,தொக்கு நிற்றல் மறைந்து நிற்றல்.
123,தொகுதல் மறைதல். எ டு நாளைக்கு வருவேன்.
124,இதில் நான் என்னும் எழுவாய் தொக்குநின்றது.
125,"எழுவாய் தொகும் இடங்கள் உரையாட்டிலும், பேச்சிலும் மூவிடப் பதிற்பெயர்கள் தொகும்."
126,"எடு நான் ஒன்று சொல்கிறேன், நீ கேள்."
127,இனி நாம் நாளைக்கு என்ன செய்கிறது?
128,நீ என்ன சொன்னாய்?
129,அவன் நன்றாயிருக்கிறானா?
130,அது போனால் போகிறது.
131,செய்தி வினவலில் செய்தி என்னும் சொல் தொகும்.
132,எடு செய்தி என்ன?
133,வினாவிற் குறித்த எழுவாய் விடைகளில் தொகும்.
134,எடு வினா முச்சங்கம் இருந்தனவா?
135,விடை முச்சங்கம் இருந்தன.
136,"மரபுச் செய்திகளையும் கேள்விச் செய்திகளையும் அறிவிக்கும் வாக்கியங்களில், அச் செய்தி கூறுவாரைக் குறிக்கும் எழுவாய் தொகும்."
137,எடு அறிஞர் இடைச்சங்க நூலகத்தில் எண்ணாயிரத் தெச்சம் நூல்க ளிருந்தன என்பர்.
138,மூத்தோர் கூட்டத்தில் ஒருவரைச் சுட்டக்கூடாது என்று சொல்லுவர்.
139,மக்கள் விளக்கேற்றா வீட்டில் வேதாளம் குடிபுகும் என்பர்.
140,சிலர் இந்தியப் பொதுவுடைமைக் கட்சியார்க்கு இரசியாவி லிருந்து பணம் வருகிறதாகக் கூறுகின்றனர்.
141,கணக்குதலைமைச் வாக்கியங்களில் முடிப்புச் சொல்லின் எழுவாய் தொகும்.
142,எடு பத்தில் நான்கு போனால் மீதி ஆறு.
143,"தீவினையும் மடச்செயலும்பற்றி ஒருவரைக் கடியும் வினாவில், பொதுவாய் எழுவாய் தொகும்."
144,அவ் வெழுவாய் இடத்திற்கேற்ப மூவிடப்பொருள் எதுவாகவு மிருக்கலாம்.
145,"ஆனால், வினா முன்பின் தொடர்பின்றிப் பழமொழிபோலத் தனித்து நிற்கும்போது, ஒருவன் என்னும் எழுவாயை வருவித்துக்கொள்வது நன்று."
146,இத்தகைய எழுவாய்களைத் திட்டமற்ற எழுவாய் என்னலாம்.
147,எடு நீ பச்சைப்பிள்ளைக்கு இப்படி நெடுநேரம் பால் கொடாம லிருக்கலாமா?
148,அவன் பெற்றவள் பட்டினியிருக்கப் பிறருக் கெல்லாம் விருந்து வைக்கிறது சரியா?
149,ஒருவன் உண்ட வீட்டிற்கு இரண்டகம் பண்ணலாமா?
150,ஒருவன் மடிநிறையப் பணத்தை வைத்துக்கொண்டு தனிவழியே போகலாமா?
