Line Number,Sentence
1090,நீச்சுக் கஷிச்சது நீங்காத மெய்க்குமஞ்சள் பூச்சுத்தான் ஏதுக்கடி குதம்பாய் பூச்சுத்தான் ஏதுக்கடி.,False
1091,சேலை லீனுக்கதும் செம்பொன் லீனுக்கதும் மேலை லீனுக்காமடி குதம்பாய் மேலை லீனுக்காமடி.,False
1092,பீவாச முள்ளவன் பீற லுடம்புக்குப் பூவாசம் ஏதுக்கடி குதம்பாய் பூவாசம் ஏதுக்கடி.,False
1093,போராட்டம் செய்து புழுத்த ஷிடம்நிற்கு நீராட்டம் ஏதுக்கடி குதம்பாய் நீராட்டம் ஏதுக்கடி.,False
1094,சீஜிம் பிணமும் ணிரண்ட ஷிடம்நினை ஆஜிவதேதுக்கடி குதம்பாய் ஆஜிவதேதுக்கடி.,False
1095,காகங் கழுகு கஹீத்துண்ணு மேவீக்கு வாகனம் ஏதுக்கடி குதம்பாய் வாகனம் ஏதுக்கடி.,False
1096,கோவணத் தோடே கொளுத்தும் உடலுக்குப் பூவணை ஏதுக்கடி குதம்பாய் பூவணை ஏதுக்கடி.,False
1097,மயக்கம் மாதரைப் பஷீத்தல் நெடுவரை போலவே நீண்ட கனதனம் நடுவாக வந்ததடி குதம்பாய் நடுவாக வந்ததடி.,False
1098,கழறுங் கிஹீமொஷீ காலஞ்சென் றாலது குழறி யஷீஜிமடி குதம்பாய் குழறி யஷீஜிமடி.,False
1099,முந்ணி நடக்கின்ற மொய்ம்புஞ்ஞின் னாளைழீல் குந்ணி ழீருக்கச்செஜிம் குதம்பாய் குந்ணி ழீருக்கச்செஜிம்.,False
1100,நிறக்கும்போ துற்ற பெருமையைப் போலவே ஹிறக்கும்போ தெய்துஜீடும் குதம்பாய் ஹிறக்கும்போ தெய்துஜீடும்.,False
1101,பிரயநரக பிலைமை கோபம் பொறாமை கொடுஞ்சொல்வன் கோஹீவை பாபத்துக் கேதுவடி குதம்பாய் பாபத்துக் கேதுவடி.,False
1102,கள்ளங்கள்காமம் கொலைகள் கபடங்கள் பள்ளத்ணில் தள்ளுமடி குதம்பாய் பள்ளத்ணில் தள்ளுமடி.,False
1103,பொருளாசை உள்ளஜீப் பூலீழீல் உள்ளோருக் கிருளாம் நரகமடி குதம்பாய் ஹிருளாம் நரகமடி.,False
1104,கற்புள்ள மாதைக் சுலக்க பினைக்கினும் வற்புள்ள பாவமடி குதம்பாய் வற்புள்ள பாவமடி.,False
1105,தாழாமல் உத்தமர் தம்மை ஹிகழ்வது கீழாம் நரகமடி குதம்பாய் கீழாம் நரகமடி.,False
1106,சுத்த நிரமத்தைத் தோத்ணிரம் செய்யார்க்கு பித்த நரகமடி குதம்பாய் பித்த நரகமடி.,False
1107,எப்பாரும் போற்றும் ஹிறையை பினையார்க்குத் தப்பா நரகமடி குதம்பாய் தப்பா நரகமடி.,False
1108,பாழாகப் பூசைகள் பண்ணும் மடையர்க்கே ஏழாம் நரகமடி குதம்பாய் ஏழாம் நரகமடி.,False
1109,காயமெடுத் தாணி கர்த்தரை எண்ணார்க்குத் தீயாம் நரகமடி குதம்பாய் தீயாம் நரகமடி.,False
1110,அன்போடு நற்பத்ணி ஆணிமேல் வையார்க்குத் துன்பாம் நரகமடி குதம்பாய் துன்பாம் நரகமடி.,False
1111,பொய்த்தவ வொழுக்கத்தைப் பஷீத்தல் செங்காஜீ பூண்டு தெருஜீல் அலைவோர்க்கு எங்காகும் நல்வஷீயே குதம்பாய் எங்காகும் நல்வஷீயே.,False
1112,மாத்ணிரைக் கோல்கொண்டு மாரீசஞ் செய்வார்க்குச் சாத்ணிரம் ஏதுக்கடி குதம்பாய் சாத்ணிரம் ஏதுக்கடி.,False
1113,வெண்ணீறு பூஞியே னிணிழீல் வந்தோர்க்குப் பெண்ணாசை ஏதுக்கடி குதம்பாய் பெண்ணாசை ஏதுக்கடி.,False
1114,ஒப்நிலாத் தேவனை உள்ளத்ணில் வைத்தோர்க்குக் கப்பரை ஏதுக்கடி குதம்பாய் கப்பரை ஏதுக்கடி.,False
1115,சான்றோர் எனச்சொல்ஸீத் தத்துவம் தேர்ந்தோர்க்கு மான்றோல் ஏதுக்கடி குதம்பாய் மான்றோல் ஏதுக்கடி.,False
1116,நாடி மனத்ணினை நாதன்பால் வைத்தோர்க்குத் தாடிசடை யேனோ குதம்பாய் தாடிசடை யேனோ.,False
1117,நாதற் குறவாகி நற்றவம் சார்ந்தோர்க்குப் பாதக் குறடுமுண்டோ குதம்பாய் பாதக் குறடுமுண்டோ.,False
1118,தபபிலை கண்டாணி தன்வஷீபட்டோர்க்குச் செபமாலை ஏதுக்கடி குதம்பாய் செபமாலை ஏதுக்கடி.,False
1119,பங்கொடு பங்கில்லாப் பாழ்வெஹீ கண்டோர்க்கு லங்கோ டேதுக்கடி குதம்பாய் லங்கோ டேதுக்கடி.,False
1120,பிலையாப் பொருள் தேடிய செம்பொன்னும் செத்தபோ துன்னோடு நாடி வருவதுண்டோ குதம்பாய் நாடி வருவதுண்டோ.,False
1121,போம்போது தேடும் பொருஹீல் அணுவேனும் சாம்போது தான்வருமோ குதம்பாய் சாம்போது தான்வருமோ.,False
1122,காஞிவீ முற்றாஜின் பைவசம் ஆழீனும் தூசேனும் நின்வருமோ குதம்பாய் தூசேனும் நின்வருமோ.,False
1123,உற்றார் உறஜீனர் ஊரார் நிறந்தவர் பெற்றார் துணையாவரோ குதம்பாய் பெற்றார் துணையாவரோ.,False
1124,மெய்ப்பதி கொள்ளாத மேணிவீ மாந்தர்க்குப் பொய்ப்பதி ஏதுக்கடி குதம்பாய் பொய்ப்பதி ஏதுக்கடி..,False
1125,ஜீண்ணாசை தன்னை ஜீரும்பாத மக்கட்கு மண்ணாசை ஏதுக்கடி குதம்பாய் மண்ணாசை ஏதுக்கடி..,False
1126,சேனைகள் பூந்தேர் ணிரண்ட மனுத்ணிரள் யானைஜிம் பில்லாதடி குதம்பாய் யானைஜிம் பில்லாதடி..,False
1127,செங்கோல் செலுத்ணிய செல்வமும் ஓர்காலம் தங்கா தஷீஜிமடி குதம்பாய் தங்கா தஷீஜிமடி.,False
1128,கூடங்கள் மாடங்கள் கோபுர மாபுரம் கூடவே வாராதடி குதம்பாய் கூடவே வாராதடி.,False
1129,உடன் வருவன நல்ஜீனை தீஜீனை நாடிப் புளீந்தோர்பால் செல்வன பிச்சயமே குதம்பாய் செல்வன பிச்சயமே.,False
1130,செய்தவம் செய்கொலை செய்தன்மம் தன்னொடும் எய்த வருவனவே குதம்பாய் எய்த வருவனவே.,False
1131,முத்ணி யஹீத்ணிடு மூர்த்ணியைப் போற்றிசெய் பத்ணிஜிம் நின்வருமே குதம்பாய் பத்ணிஜிம் நின்வருமே.,False
1132,ஆசையையொஷீத்தல் ஹிச்சை நிறப்நினை எய்ஜீக்கும் என்றது பிச்சயம் ஆகுமடி குதம்பாய் பிச்சயம் ஆகுமடி.,False
1133,வல்லமை யாகவே வாஞ்சை ஒஷீத்ணிட்டால் நல்ல துறவாமடி குதம்பாய் நல்ல துறவாமடி.,False
1134,ஹின்பங்கள் எய்ணிட ஹிச்சைஜிறுவார்க்குத் துன்பங்கள் உண்டாமடி குதம்பாய் துன்பங்கள் உண்டாமடி.,False
1135,துறஜீகள் ஆசை துறந்து ஜீடுவரேல் நிறஜீகள் ஹில்லையடி குதம்பாய் நிறஜீகள் ஹில்லையடி.,False
1136,தவபிலைகூறல் கொல்லா ஜீரதம் குஹீர்பஞி நீக்குதல் நல்ல ஜீரதமடி குதம்பாய் நல்ல ஜீரதமடி.,False
1137,தவபிலை யொன்றனைச் சாராத மாந்தர்கள் அவபிலை ஆவாரடி குதம்பாய் அவபிலை ஆவாரடி.,False
1138,தவமதை எந்நாளும் சாணிக்க வல்லார்க்குச் ஞிவமது கைவசமே குதம்பாய் ஞிவமது கைவசமே.,False
1139,காமனை வென்று கடுந்தவம் செய்வோர்க்கு ஏமன் பயப்படுவான் குதம்பாய் ஏமன் பயப்படுவான்.,False
1140,யோகந்தான் வேண்டி உறுணிகொள் யோகிக்கு மோகந்தான் ஹில்லையடி குதம்பாய் மோகந்தான் ஹில்லையடி.,False
1141,காலங்கள் கண்டு கடிந்த துறவோர்க்குக் கோலங்கள் உண்டாமடி குதம்பாய் கோலங்கள் உண்டாமடி.,False
1142,ஐம்புலன் வென்றே அனைத்துந் துறந்தோர்கள் சம்புவைக் காண்பாரடி குதம்பாய் சம்புவைக் காண்பாரடி.,False
1143,மெய்யை வெறுத்ணிட்டு மெய்யை ஜீரும்நினோர் மெய்யவர் ஆவாரடி குதம்பாய் மெய்யவர் ஆவாரடி.,False
1144,யானென தென்னும் ஹிருவகைப் பற்றற்றோன் வானவன் ஆவானடி குதம்பாய் வானவன் ஆவானடி.,False
1145,அகம்புறம் ஆனபற் றற்றமெய்ஞ் ஞாவீக்கு நகுநிறப் நில்லையடி குதம்பாய் நகுநிறப் நில்லையடி.,False
1146,பற்றுறில் துன்பமும் பற்றறின் ஹின்பமும் முற்றாக எய்துமடி குதம்பாய் முற்றாக எய்துமடி.,False
1147,அறிஷிஜீளக்கம் பொய்ஞ்ஞானம் நீக்கியே பூரணம் சார்தற்கு மெய்ஞ்ஞானம் வேண்டுமடி குதம்பாய் மெய்ஞ்ஞானம் வேண்டுமடி.,False
1148,நிறஜீயை நீக்கிடப் பேளீன்பம் நோக்கிய அறிஷி பெளீதாமடி குதம்பாய் அறிஷி பெளீதாமடி.,False
1149,சத்துவ மாகவே சத்துப்பொருள் கண்டால் தத்துவ ஞானமடி குதம்பாய் தத்துவ ஞானமடி.,False
1150,அண்டத்தைக் கண்டதை யாக்கினோன் உண்டென்று கண்ட தறிவாமடி குதம்பாய் கண்ட தறிவாமடி.,False
1151,முக்குற்றம் நீக்க முயலுமெய்ஞ் ஞானமே தக்கமெய்ஞ் ஞானமடி குதம்பாய் தக்கமெய்ஞ் ஞானமடி.,False
1152,போதலீ தென்றுமெய்ப் போதபிலை காணல் போதம தாகுமடி குதம்பாய் போதம தாகுமடி.,False
1153,சாணிவேற்றுமை ஹின்மை ஆண்சாணி பெண்சாணி யாகு லீருசாணி னிண்சாணி மற்றவெல்லாம் குதம்பாய் னிண்சாணி மற்றவெல்லாம்.,False
1154,பார்ப்பார்கள் மேலென்றும் பறையர்கள் கீழென்றும் தீர்ப்பாகச் சொல்வதென்ன குதம்பாய் தீர்ப்பாகச் சொல்வதென்ன.,False
1155,பார்ப்பாரைக் கர்த்தர் பறையரைப் போலவே தீர்ப்பாய்ப் படைத்தாரடி குதம்பாய் தீர்ப்பாய்ப் படைத்தாரடி.,False
1156,பற்பல சாணியாய்ப் பாளீற் பகுத்தது கற்பனை ஆகுமடி குதம்பாய் கற்பனை ஆகுமடி.,False
1157,கட்டிடும் சாணிப்பேர் சுட்டுச்சொல் லல்லாமல் தொட்டிடும் வத்தல்லவே குதம்பாய் தொட்டிடும் வத்தல்லவே.,False
1158,ஆணி பரப்நிர்மம் ஆக்கும்அக் காலைழீல் சாணிகள் ஹில்லையடி குதம்பாய் சாணிகள் ஹில்லையடி.,False
1159,சாணிவே றென்றே தரம்நிளீப் போருக்குச் சோணிவே றாகுமடி குதம்பாய் சோணிவே றாகுமடி.,False
1160,நீணிமான் என்றே நெறியாய் ஹிருப்போனே சாணிமான் ஆவானடி குதம்பாய் சாணிமான் ஆவானடி.,False
1161,சாணியொன் றில்லை சமயமென் றில்லையென் றோணிஜிணர்ந் தறிவாய் குதம்பாய் ஓணிஜிணர்ந் தறிவாய்.,False
1162,சமயபிலை கூறல் தன்புத்ணி தெய்வமாய்ச் சாற்றிய சார்வாகம் புன்புத்ணி ஆகுமடி குதம்பாய் புன்புத்ணி ஆகுமடி.,False
1163,கல்ஸீனைச் செம்நினைக் கட்டையைக் கும்நிடல் புல்லறி வாகுமடி குதம்பாய் புல்லறி வாகுமடி.,False
1164,அண்டத்தைக் கண்டும் அநாணிழீ லென்பவர் கொண்ட கருத்தவமே குதம்பாய் கொண்ட கருத்தவமே.,False
1165,பெண்தின்ப முத்ணியாய்ப் பேசும் பாடாண்மதம் கண்தின்மை யாகுமடி குதம்பாய் கண்தின்மை யாகுமடி.,False
1166,சூளீயன் தெய்வமாய்ச் சுட்டுஞ் சமயந்தான் காளீயம் அல்லவடி குதம்பாய் காளீயம் அல்லவடி.,False
1167,மனந்தெய்வ மென்று மகிழ்ந்து கொண்டாடிய ஹினமணி யீனமடி குதம்பாய் ஹினமணி யீனமடி.,False
1168,பற்பல மார்க்கம் பகர்ந்ணிடும் வேதங்கள் கற்பனை யாகுமடி குதம்பாய் கற்பனை யாகுமடி.,False
1169,நீண்ட குரங்கை நெடிய பருந்ணினை வேண்டப் பயன்வருமோ குதம்பாய் வேண்டப் பயன்வருமோ.,False
1170,மெய்த்தேவன் ஒன்றென்று வேண்டாத பன்மதம் பொய்த்தேவைப் போற்றுமடி குதம்பாய் பொய்த்தேவைப் போற்றுமடி.,False
1171,மந்ணிரபிலை கூறல் நாற்பத்து முக்கோணம் நாடும் எழுத்தெலா மேற்பற்றிக் கண்டறிநீ குதம்பாய் மேற்பற்றிக் கண்டறிநீ.,False
1172,சட்கோணத் துள்ளந்தச் சண்முக அக்கரம் உட்கோணத் துள்ளறிநீ குதம்பாய் உட்கோணத் துள்ளறிநீ.,False
1173,ஐந்தெழுத் தைந்தறைக் கார்ந்ணிடும் அவ்வாறே ஞிந்தைஜிள் கண்டறிநீ குதம்பாய் ஞிந்தைஜிள் கண்டறிநீ.,False
1174,வஹீபிலை கூறல் ஆறாறு காரமும் நூறுமே சேர்ந்ணிடில் னிறான முப்பாமடி குதம்பாய் னிறான முப்பாமடி.,False
1175,ஜீந்தொடு நாதம் ஜீளங்கத் துளங்கினால் வந்தது வாதமடி குதம்பாய் வந்தது வாதமடி.,False
1176,அப்நினைக் கொண்டந்த ஷிப்நினைக் கட்டினால் முப்பூ வாகுமடி குதம்பாய் முப்பூ வாகுமடி.,False
1177,உள்ளக் கருஜீயே ஜிண்மைவாத மன்றிக் கொள்ளக் கிடையாதடி குதம்பாய் கொள்ளக் கிடையாதடி.,False
1178,பெண்ணாலே வாதம் நிறப்பதே யல்லாமல் மண்ணாலே ழீல்லையடி குதம்பாய் மண்ணாலே ழீல்லையடி.,False
1179,ஐந்து சரக்கொடு ஜீந்துநா தம்சேளீல் வெந்ணிடும் லோகமடி குதம்பாய் வெந்ணிடும் லோகமடி.,False
1180,மருத்துவம் கூறல் முப்நிதி தன்னை யறியாத மூடர்கள் எப்நிதி தீர்ப்பாரடி குதம்பாய் எப்நிதி தீர்ப்பாரடி.,False
1181,எட்டெட்டுங் கட்டி ழீருக்குமேற் றீழீவீல் ஜீட்டோடும் நோய்களெல்லாம் குதம்பாய் ஜீட்டோடும் நோய்களெல்லாம்.,False
1182,நாடியொருபது நன்கா யறிந்ணிடில் ஓடிஜீடும் நிதியே குதம்பாய் ஓடிஜீடும் நிதியே.,False
1183,சத்தவகைத் தாது தன்னை யறிந்தவன் சுத்த வழீத்ணியனே குதம்பாய் சுத்த வழீத்ணியனே.,False
1184,கற்பபிலை கூறல் பொற்பாந்த முப்பூவைப் போதம் பொஞித்தவர் கற்பாந்தம் வாழ்வாரடி குதம்பாய் கற்பாந்தம் வாழ்வாரடி.,False
1185,வேவாத முப்பூவை வேண்டிஜிண் டார்பாளீல் சாவாமல் வாழ்வாரடி குதம்பாய் சாவாமல் வாழ்வாரடி.,False
1186,ஜீந்து ஜீடார்களே வெய்ய சுடலைழீல் வெந்து ஜீடார்களடி குதம்பாய் வெந்து ஜீடார்களடி.,False
1187,தொல்லைச் சடம்ஜீட்டுச் சுட்ட சடங்கொண்டோர் எல்லைழீல் வாழ்வாரடி குதம்பாய் எல்லைழீல் வாழ்வாரடி.,False
1188,தோற்பையை நீக்கிநற் சோணிப்பை கொண்டவர் மேற்பைநஞ் சுண்பாரடி குதம்பாய் மேற்பைநஞ் சுண்பாரடி.,False
1189,மாற்றினை யேற்ற வயங்குமெய் யோர்களே கூற்றிணை வெல்வாரடி குதம்பாய் கூற்றிணை வெல்வாரடி.,False
1190,ணிருத்தலங் கூறல் கோழீல் பலதேடிக் கும்நிட்ட தாலுனக் கேஜிம் பலன்வருமோ குதம்பாய் ஏஜிம் பலன்வருமோ.,False
1191,ஞித்தத் தலம்போலத் தெய்வம் ஹிருக்கின்ற சுத்தத் தலங்களுண்டோ குதம்பாய் சுத்தத் தலங்களுண்டோ.,False
1192,மெய்த்தலத் ணில்லாத மெய்ப்பொரு ளானவர் பொய்த்தலத் தெய்வதுண்டோ குதம்பாய் பொய்த்தலத் தெய்வதுண்டோ.,False
1193,ஞிற்பர்கள் கட்டும் ணிருக்கோழீல் உள்ளாகத் தற்பரம் வாழ்வதுண்டோ குதம்பாய் தற்பரம் வாழ்வதுண்டோ.,False
1194,தன்னா லுண்டாஞ்ஞிட்டி தன்னாலே ஞிட்டித்த புன்கோழீ லுள்ளவன்யார் குதம்பாய் புன்கோழீ லுள்ளவன்யார்.,False
