Line Number,Sentence
1346,"பெற்றோரும் மற்றோரும் கைகளைச் சேர்த்துத் தட்டிக்காட்டிக் குழந்தையை அழைப்பதோடு, கைகொட்டிக் காட்டும் படியும் கூறுவர்.",False
1347,குழந்தை அதற்கேற்ப சப் என்ற ஒலி உண்டாகும்படி பாணி கை யைக் கொட்டும்.,False
1348,குழந்தை நிமிர்ந்து உட்கார்ந்திருக்கும் அமைப்பைச் சப்பாணி என்று கூறும் வழக்கம் உண்டு.,False
1349,சஎன்றால் சேர்த்தல் என்றும் பொருள் கொண்டு கைகளைச் சேர்த்து ஒலியெழுப்புதல் எனவும் கூறலாம்.,False
1350,"மலர்மொட்டு, வண்டு மொய்க்காத மொட்டை மலரும் செவ்வியிலேயே கூந்தலிற் சூடல் சிறப்பு.",False
1351,கற்கண்டு போலினிய சொற்கள்.,False
1352,பல்லக்கின் மேல் அமர்ந்து செல்வது போன்ற உயர்ந்த புகழ்.,False
1353,மாணிக்கவாசகருக்கு இறைவன் ஞானகுருவாய்த்தோன்றி அருளீந்த ஆவுடையார் கோயில் என்னும் இடம்.,False
1354,திருவாசகத்தின் முதற்பகுதி.,False
1355,"சங்கத் தமிழ்க்கொள்கையை, பிற்காலத்தார் சைவசித்தாந்தம் எனக் கொண்டதாக அடிகள் ஆய்ந்துரைந்தார்.",False
1356,பழந்தமிழ்க் கொள்கையே சைவ சமயம் என்பது அடிகள் எழுதிய நூல்.,False
1357,"சிறுவர்க்கான செந்தமிழ் என்பது அறிவுபுகட்டுங் கதைகளும், கட்டுரைகளும் அமைத்து அடிகள் சிறுவர்க்காய் எழுதிய நூல்.",False
1358,மெய்கண்டார் அருளிய சைவசித்தாந்த நூல்.,False
1359,ஞான சம்பந்தரின் தாய் .,False
1360,ஞான சம்பந்தரின் தந்தை .,False
1361,உமையொரு பாகனாய் சிவபெருமான்.,False
1362,வடலூர் வள்ளல் இராமலிங்கரின் திரு.,False
1363,"அருட்பாப் பாடல்கள் பற்றி யெழுந்த, கருத்து வேறுபாட்டில் அடிகள் அருட்பாவின் சிறப்புகளைப் பல மன்றங்களில் எடுத்துரைத்து வென்றார்.",False
1364,காளிதாசரின் சாகுந்தலத்தை அடிகள் வடமொழியிலிருந்து சாகுந்தல நாடகமெனத் தமிழில் மொழி பெயர்த்தார்.,False
1365,வறுமை .,False
1366,வளர்ந்திடும் .,False
1367,நண்டு இடம் மாறி வந்து ஆட்சி பெறல் போல பிறமொழி தமிழில் ஆட்சிபெறல்.,False
1368,அடிகள் யோக நித்திரை என்னும் அறிதுயிலின் பயிற்சியாலே தம் மகள் திருநாவுக்கரசருக்கு நேர்ந்த இளைப்பிருமல் நோயைத் தவிர்த்திருக்கின்றனர்.,False
1369,தொலைவிலுணர்தல் என்னும் மறைபொருளுணர்ச்சி என்பது அடிகள் எழுதிய நூல்.,False
1370,சிவஞானபோதம் இயற்றிய மெய்கண்ட தேவர் திருநாளைச் சென்னையில் கொண்டாட அடிகள் வழிகோலினார்.,False
1371,முத்தப் பருவம் முத்தப் பருவம் என்பது குழந்தையை முத்தம் கொடுக்க வருவாய் என அழைத்துப் பாடும் பருவமாகும்.,False
1372,"குழந்தை தரும் வாய்முத்தத்தால், குழந்தையை ஆரம் துய்க்கின்றன ஊற்றின்பத்தைப் பெற்றோரும், மற்றோரும் பெறுவர்.",False
1373,குழந்தையின் பதினோராம் மாதத்தில் பாடப் பெறுவது.,False
1374,முத்தந்தரும் வாயின் சிறப்புக்கள் பலவற்றைக் கூறுவதும் மரபு.,False
1375,பிள்ளைத் தமிழ்ப் பருவங்களுள் மிகச் சிறப்பான பருவம் முத்தம் பருவமாகும்.,False
1376,.கருவுற்றுப் பிறவாத இயற்கை வடிவினன் சிவபெருமான்.,False
1377,இப்பாடலில் முத்தின் வகைகள் கூறப்படுகின்றன.,False
1378,சங்கு .,False
1379,"அடிகளை, தம் வாழ்க்கைத் துணைவியரின் இதழ்சேர்த்து இன்பமார்ந்த கனி வாயிதழாலே முத்தம் தருமாறு வேண்டப்பட்டது.",False
1380,அடிகட்குத் தொண்டு புரிந்த அன்புத் துணைவி.,False
1381,சைவ சமய வளர்ச்சிக்காக சைவ சித்தாந்த சபை நிறுவி அதன் தலைவரனார்.,False
1382,அடிகள் திருவொற்றியூர் முருகனிடத்துக் கொண்ட ஈடுபாட்டால் திருவொற்றி முருகர் மும்மணிக்கோலை என்னும் நூல் இயற்றினார்.,False
1383,"அடிகள் சிறிதும் நேரத்தை வீணாக்காமல், நூல்களைப் படிப்பதிலும் ஆய்வுகள் எழுதுவதிலும் ஈடுபடுவர்.",False
1384,சென்னையில் எந்தப் பொது சிறப்பு நிகழ்ச்சிகளுக்கும் போகமாட்டார் என்பது வரலாறு.,False
1385,"மன்றம், தில்லைப் பொன்னம்பலத்தைக் குறித்தது.",False
1386,மிகுதியான பற்றுக்கொண்ட .,False
1387,திருவண்ணாமலையில் ஒளியுருவமாக நின்றவன்.,False
1388,"உருத்திரன், திருமால், பிரமன் என மூன்று உருவமாக நின்ற சிவன்.",False
1389,தில்லை மன்றில் நடனமாடி.,False
1390,திருமகளைத் தந்த பாற்கடலில் தோன்றிய அமுதம்போல.,False
1391,தெய்வயானை .,False
1392,திருச்செந்தூர் முருகன் .,False
1393,அசுரர் .,False
1394,அழகு முருகனருள் பெற்ற குமரகுருபரர் நாடு முழுவதும் சென்று தமிழ் பரப்பியது போல அடிகளும் தமிழ் பரப்பினார்.,False
1395,இதை வாரானைப் பருவம் என்றும் கூறுவர்.,False
1396,குழந்தையின் பதின்மூன்றாம் மாதத்தில் பாடப்பெறும்.,False
1397,இப்பருவத்தில் புலவர்கள் தமது அன்பு ஈடுபாட்டை மிகுதியும் வெளிப்படுத்திப்பாடுவர்.,False
1398,ஓரேருழவனின் முயற்சியைப்போல அடிகள் மொழிநலம் பேணலையே தம் கருத்தாய்க் கொண்டு வாழ்ந்தார்.,False
1399,ஒலி .,False
1400,கரும்புபோல் இனிய சொல் .,False
1401,முனிவினை யழியாப் பரிதிமாற் கலைஞர் முதுபுகழ் திரு.வி.க.,False
1402,இப்பாட்டு அடிகளிடம் நட்புக்கொண்டோரைக் குறிப்பிடுகிறது.,False
1403,அடிகள் இலங்கைப் பயணம் சென்று வந்தமை குறிக்கப்படுகிறது.,False
1404,புன்சிரிப்பு .,False
1405,மிகுதி தமிழ்மொழியில் பேசுதற்குக் கூசிய அக்காலத்தில் அடிகள் இனிமையாகப் பேசி அக்குறையை நீக்கிப் பிறரும் தமிழில் பேச ஆர்வந்தோற்றுவித்தார்.,False
1406,எட்டுத்தொகை .,False
1407,பத்துப்பாட்டு .,False
1408,"அடிகள் பூண்ட துறவு தமிழ்த்துறவு மக்களொடு மகிழ்ந்து, மனையறம் காத்து, துறவு பூணல் தமிழ்நெறி.",False
1409,ஐம்பொறிகளையும் கட்டுப்படுத்திய.,False
1410,உள்ளவனே என்பது உளவனே என வந்தது.,False
1411,அம்புலிப் பருவம் அம்புலிப் பருவம் என்பது குழந்தையோடு சந்திரனை விளையாட வருமாறு அழைத்துப் பாடும் பருவமாகும்.,False
1412,அம்புலி என்றால் நிலவு என்று பொருள்.,False
1413,அம்புலியை அம் புல்லி எனப் பிரிக்கலாம்.,False
1414,புல்லி என்பது புல்லும் இயல்புடையது.,False
1415,ஏனைய நாள்களோடு நட்சத்திரங்களோடு புல்லும் சிறப்பு நோக்கிப் புல்லி என்பதன் இடைக்குறையே புலி.,False
1416,அழகுமிக்க தண்ணிய ஒளிக்கதிர்களைப் புல்லியுள்ளதால் அம்புலி என்று நிலவைக் கூறினும் பொருந்தும்.,False
1417,நிலவில் உள்ள களங்கத்தை முயல் என்பர்.,False
1418,புலி என்றும் கூறுவர்.,False
1419,அகம் கை அங்கை என்றானதுபோல அகத்தில் புலி உடையது அம்புலி என்றாயிற்று எனினும் ஆம்.,False
1420,அம்புலிப் பருவமே கவிஞரின் திறனை அளக்கும் அளவுகோல்.,False
1421,பிள்ளைக் கவிக்கு அம்புலி புலியாம் என்று இப் பருவத்தின் அருமைப் பாட்டை விளக்குவர்.,False
1422,எனவே பிள்ளைத் தமிழில் மிகவும் நயம்பெற அமைவதற்குரிய பகுதி அம்புலிப் பருவமாம்.,False
1423,இதையே சாம பேத தான தண்டம் எனக் கூறுவர்.,False
1424,சந்திரன் மறைமலையடிகள் கலைகளையுடையவன்.,False
1425,சிவன் வாழ்வு தருகின்ற மதி அல்லிமலர் மலர வரும்.,False
1426,கடல்பொங்க வரும்.,False
1427,வேதாசலநாதர் முடிமீது தங்கவரும்.,False
1428,சிவன் அருள் பெற்று வரும்.,False
1429,"மேற்கூறிய வண்ணம் சந்திரனுக்கும், அடிகட்கும் ஒப்புமை கூறப்பட்டது.",False
1430,வயதில் கலை முழுதுங் கற்றவன்.,False
1431,தந்தை சொக்கர் வாழ்வு தரவந்தவர் மனைவி சவுந்தரவல்லி மகிழ வருவார்.,False
1432,தமிழ்க் கடல் பொங்க வருவார்.,False
1433,மறைமலை என்னும் பெயர் பெற்றவர்.,False
1434,கலை கற்ற அறிவு பெற்று அருள்வார்.,False
1435,அடிகட்கும் ஒப்புமை கூறப்பட்டது.,False
1436,சந்திரன் மறைமலையடிகள் மலரிதழ் மலர்வித்தல் அல்லி மலரினை இதழ் விரித்து மலரச் செய்தல்.,False
1437,வண்டுகள் மகிழ மலர்களை மலரச் செய்வாய்.,False
1438,வழியில் நின்ற இருள்நீக்கி ஒளி பரப்புவாய்.,False
1439,சிவனின் பால் வாழ்வு பெற்றாய்.,False
1440,மதிமுகம் என உவமையாதல்.,False
1441,வெள்ளுவா முழுநிலா நாளில் உலகை மகிழ்வித்தல்.,False
1442,தமிழ் மலை என உவமையாதல் அடிகள் உருவப் பொலிவினாலும் கலை அறிவினாலும் பிறரை மகிழ்வித்தல்.,False
1443,ஒவ்வொரு திங்களும் பாதிநாள் தேய்பிறை.,False
1444,"வடமேற்குத் திசைக்கு மட்டுமே உரிமை சிவனின் இடதுகண்ணொளியாய், தேய்பிறையில் ஒளி மங்கும் மறைமலையடிகள் சிவனையே தன் மனக்கோயிலில் கொண்டவர்.",False
1445,எல்லா நாளும் நிறைவுடையவர்.,False
1446,கற்றார்க்குச் சென்ற இடமெல்லாம் சிறப்பென எத்திசையிலும் புகழ்மிக்கவர் முக்கண்ணொளியாகத் திகழ்பவர் என்றும் பெருகுகின்ற ஒளியே உண்டு.,False
1447,அங்கயலின் கண்துணை சிவபெருமான்.,False
1448,சந்திரன் கடகராசி சந்திரன் வீடு.,False
1449,கலைகள் பதினாறு மட்டுமே.,False
1450,மன்னர்க்கு வெண் கொற்றக்குடையாக மட்டுமே உள்ளாய்.,False
1451,நேர்மையும் ஒழுக்கமும் இல்லை.,False
1452,சூரியனால் ஒளி பெறுவாய்.,False
1453,மறைமலையடிகள் கடகளிறு போன்ற அடிகட்கு காசினியோர் நெஞ்சே வீடு.,False
1454,"கற்ற கலைகளோ அறுபத்து நான்கு, மன்னரிடத்து குடையோடு பிறபேறுகளும் பெற்றவர்.",False
1455,"நேர்மை கொண்ட செம்மையாளர், நடைகண்டு சூரியன் நாணும்.",False
1456,அருமந்த சேய் அமுதம் போன்ற சேய்.,False
1457,அடிகள் தன் நோய் நீங்க திருவொற்றியூர் முருகன்மீது மும்மணிக் கோவை பாடி நோய் நீங்கப் பெற்றார்.,False
1458,யோக நித்திரை என்ற தம் நூலில் அறிதுயில் மூலமாக நோய்களை நீக்குவது பற்றிக் கூறியுள்ளார்.,False
1459,ஆதலால் சந்திரனே அடிகளிடம் வந்தால் நோய் நீங்கி மகிழலாம் என அழைப்பது.,False
1460,சிவபெருமானின் சடைமுடி.,False
1461,ஆராய்ந்து செய்த அறிவு நூல்.,False
1462,"அது கேட்டு யானைமுகக் கடவுள் நான்முகனிடம் கோபமுற்றார், யானை முகனை வணங்கி நான்முகன் பொறுத்தருள வேண்டினான்.",False
1463,அப்போது சந்திரன் எள்ளலாகச் சிரித்தான் அதனால் கோபமுற்ற யானை முகக்கடவுள் சந்திரனை ஒளியின்றி மறைந்து போகச் சாபமிட்டார்.,False
1464,விநாயக புராணம் வசனம் பக்கம் கழக வெளியீடு தண்டம் வாராக்கால் அம்புலிக்கேற்படும் தீமையைச் சுட்டி அழைத்தல்.,False
1465,தில்லை யாடிட வல்ல ஒருவனைச் சிந்தை தன்னிலே கண்டவன் செங்கை வீணையை மீட்டு மொருத்தியைச் சிவந்த நாவிலே கொண்டவன்.,False
1466,அறிவைத் தருகின்ற கோள் என்று பாராட்டிச் சிவபெருமான் தன்முடி மீது சந்திரனை அமைத்துக் கொண்டார்.,False
1467,வியாழ குரு என்றது தென்முகக் கடவுளாகிய சிவபெருமானைச் சோதிடக் கருத்துக் கேற்ப இப்பாடல் நயம் பாடப்பட்டுள்ளது.,False
1468,"சிற்றிற் பருவம் சிற்றில், சிறுபறை, சிறுதேர் முதலிய மூன்று பருவங்களும் ஆண்பாற் பிள்ளைத் தமிழிற்கே உரிய சிறப்புப் பருவங்களாகும்.",False
1469,ஓடியாடிச் சுற்றித் திரிந்து விளையாடும் குழந்தையின் பதினேழாவது திங்களில் பாடப்படுவதாகும்.,False
1470,தாயர்களும் மற்றவர்களும் பாடுவதாக ஏனைய பருவங்கள் பாடப்பெற இப்பருவம் மட்டும் சிறுமியர் பாடுவதாக அமைத்துப் பாடுவது இயல்பு.,False
1471,"நாயகன், நாயகி என்ற வழக்கில் ஆண்டவனை உயிர்கள் சென்றடையும் தத்துவ விளக்கமாக இப்பருவம் பாடப் பெறுவதும் உண்டு.",False
1472,ஆண் இளமை நிரம்பியபோது அறிவு சிறந்து உணர்வும் வளர்ந்து விளங்குகின்றன.,False
1473,பெண் இளமை நிரம்பியபோது உணர்வு சிறந்து அறிவும் வளர்ந்து விளங்குகிறார்.,False
1474,வளர்ச்சிக்குரிய வித்துக்கள் விளையாட்டுப் பருவத்திலேயே காணப்படுகின்றன.,False
1475,அமைதியாக இருந்து பெண் சிற்றில் இழைக்கும் பருவத்தில் ஆரவாரமாக இருந்து பெண் சிற்றில் இழைக்கும் நிலையில் இருக்கின்றான்.,False
1476,மறையாய்த் திகழும் பதினான்கு மணி நூல்கள் தமிழில் உள்ள பதினான்கு சாத்திரங்கள்.,False
1477,"திருவுந்தியார், .",False
1478,"திருக்களிற்றுப்படியார், .",False
1479,"சிவஞானபோதம், .",False
1480,"சிவஞான சித்தியார், .",False
1481,"இருபா இருபஃது, .",False
1482,"உண்மை விளக்கம், .",False
1483,"சிவப்பிரகாசம், .",False
1484,"திருவருட்பயன், .",False
1485,"வினாவெண்பா, .",False
1486,"போற்றிப் பஃறொடை, .",False
1487,"கொடிக்கவி, .",False
1488,"நெஞ்சுவிடுதூது, .",False
1489,"உண்மை நெறி விளக்கம், .",False
1490,சங்கற்ப நிராகரணம்.,False
1491,என்ற திருவருட்பாப் பாடலை அடிகள் தம் மகள் நீலாம்பிகை உடனிருக்கும் போது பாடினர்.,False
1492,பின் அடிகள் இப்பாடலில் தேகம் என்ற சொல்லுக்கு யாக்கை என இருப்பின் இனிமையாயிருக்கும்.,False
1493,"ஏற்ற தமிழ்ச் சொல்லொன்று கூற, நீலாம்பிகை அம்மை பிறமொழிக் கலப்பை நீக்கின் தமிழ் சிறக்கும் என்றார்.",False
1494,நவசக்தி இதழாசிரியராக இருந்த திரு.வி.க.,False
1495,நவம் புதுமை.,False
1496,சிறுபறைப் பருவம் குழந்தையைச் சிறுபறை கொட்டி விளையாடுக என வேண்டுவதாகத் தெரிவிக்கும் பருவம் சிறுபறைப் பருவமாகும்.,False
1497,ஒலி இன்பம் குழந்தையைக் கவருமாதலின் குழந்தை பறை முதலியவற்றைக் கொட்டிக் கொண்டு விளையாடும்.,False
1498,இது குழந்தையின் பத்தொன்பதாம் திங்களில் பாடப்பெறும்.,False
1499,"புராணங்களில் கடவுளர்க்கு அவதாரம் கூறி, மனிதப் பிறப்பு எடுப்பதாகக் கூறப்படும் செய்தியை அடிகள் வன்மையாய் மறுத்தனர்.",False
