Line Number,Sentence
4479,முடியை அடைதற்குப் படிகளும் அமைந்திருக் கின்றன.
4480,காடு பசுமை அமைதியைக் காட்டுகிறது.
4481,கடல் கருமை அமைதியை வழங்குகிறது.
4482,வான் நீல அமைதியைப் பொழிகிறது.
4483,"இவையெல்லாம் ஒன்றி, உச்சியிலிருப்போரை அமைதி மயமாக்கி, அமைதியின்கண் அவரைத் திளைக்கச் செய் கின்றன."
4484,அடியிற்றோன்றிய அச்சங்களெல்லாம் எங்கேயோ பறந்தோடின.
4485,குணத்துக்கும் மலையைப் போலவே கீழ்நிலையுமுண்டு மேல்நிலையுண்டு.
4486,காடுகள் புறத் தத்துவக் காரியங்கள்.
4487,விலங்குகள் முக் குணக் காரியங்கள்.
4488,படிகள் உள்தத்துவக் காரியங்கள்.
4489,உச்சி அமைதி.
4490,அமைதியில் விளங்குவது அருளறம் அதுவே குணம் என்பது.
4491,"காடு, விலங்கு, படி, உச்சி எல்லாஞ் சேர்ந்த ஒன்றே மலை யென்பது."
4492,அதன் அடி அச்சமூட்டுகிறது முடியோ அமைதி யூட்டுகிறது.
4493,"மேல்நிலையின் அடைவு, கீழ்நிலையின் தீமைகளையும் நல்லனவாகவே உணர்த்தும்."
4494,மலையும் நீத்தாரும் நீத்தார் புறவுலகில் வாழும்போதும் அவர் அடிக்கடி மலையின் உச்சி நண்ணித் திரும்புவது வழக்கம்.
4495,"அகமலையின் உச்சியிலுள்ள சாந்தத் தெய்வத்துடன் உறவுகொண்டுள்ள அவர்க்கும், புறமலை அமைதியில் விருப்பம் எழும்போலும்."
4496,உல கோர்க்கு மலையின் மாண்பை அறிவுறுத்த வேண்டுமென்பதும் அவர்தங் கருத்தா யிருக்கலாம்.
4497,"பொதுவாக மக்கள் உடல்நலங் கருதியும், மன அமைதி விரும்பியும் மலைக்குச் செல்வது கண்கூடு."
4498,மலைவாழ்வில் பலதிற நலன்கள் விளையும்.
4499,"மலையின் சிறப்பைப் பற்றி, இமய மலை அல்லது தியானம் என்னும் நூலில் விரித்துக் கூறி யுள்ளேன்."
4500,விளக்கம் அந்நூலிற் பார்க்க.
4501,அச்சத்தால் படிகளிலேயே தயங்கி வழுக்கி வீழாது இவர்ந்து நடக்க உரம் வேண்டும்.
4502,அவ்வுரமே சீலம் என்பது.
4503,அது குறித்தே ஏறி என்பதற்குச் சீலக்கால் கொண்டு ஏறி என்று விளக்கஞ் செய்யப்பட்டது.
4504,மண் பரலாகிப் பரல் கல்லாகிக் கல் பாறையாகிப் படிப் படியே அடுக்கலாகி ஓங்கலாகி மலையாகும்.
4505,அதுபோலச்சீலம் ஐந்தாகி எட்டாகிப் பத்தாகி நூறாகி ஆயிரமாகிப் பலவாகிப் படிப்படியே விரிந்து பெருகி வளர்ந்து ஓங்கிக் குணமலையாகும்.
4506,அவ்வாறே தத்துவப் படிகளைக் கடந்தேறும்போதும் இடையில் நின்று வீழ்தலா காது.
4507,சீலக் கால்கொண்டு நடந்து நாதாந்த உச்சி நண்ணிச் சாந்தத்தில் உறைந்து உரமாக நிற்றல் வேண்டும்.
4508,இந்த நுட்பங்கள் நின்றார் என்பதில் விளங்குகின்றன.
4509,நின்றார் இங்கே நீத்தார் புலன்களை வென்று உரனில் உறைந்து நின்றவர் மனமாசுகளினின்றும் விடுதலையடைந்து நின்றவர் தத்துவங்களைக் கடந்து நின்றவர்.
4510,சலியாமையும் பெருமையும் பற்றிக் குணங்களைக் குன்றாக உருவகித்தார்.
4511,குணம் சாதியொருமை என்பது பரிமேலழகர் குறிப்புரை.
4512,வெகுளி கணமேயும் காத்தலரிது திருவள்ளுவர் காலத்தில் சமணமும் பௌத்தமும் ஆக்கம் பெற்றிருந்தன.
4513,"அது காரணமாகப் பகவன், கணம் முதலிய சொற்கள் கற்றவர் நாவில் உலவி வந்தன."
4514,கற்றவர் நாவில் உலவுவன இலக்கியங்களிற் புகுதல் இயற்கை.
4515,பௌத்தரின் கணபங்க நியாயத்தினின்றும் கணம் என்னுஞ் சொல் புலவர் நாவில் பெரிதும் உலவி யிருக்கும்.
4516,காத்தல் பாதுகாத்தல் தாங்குதல் பேணுதல் வைத்திருத்தல்.
4517,"அரிது, ஈண்டு இன்மைப் பொருளின் மேற்று."
4518,அறிகுறி குணமென்னுங் குன்றேறி நின்றார்க்கு அறிகுறி என்னை?
4519,அவர்மாட்டு வெகுளி எழாமை என்க.
4520,"இது பற்றியே, குண மென்னுங் குன்றேறி நின்றார் வெகுளி கணமேயுங் காத்தல் அரிது என்றருளினர்."
4521,வெகுளி வெகுளி கணமேயுங் காத்தல் அரிது என்பது வெகுளி எழாமையை உணர்த்துவது.
4522,குணமென்னுங் குன்றேறி நின்றார்க்கு வெகுளி எங்கிருந்து பிறக்கும்?
4523,அவர்கட்கு வெகுளி ஏது?
4524,வெகுளியினின்றும் விடுதலையடைந்தவரே குண மென்னும் குன்றேறி நின்றவர்.
4525,அவரே நீத்தார்.
4526,இவ்வதிகாரம் நீத்தார் பெருமை கூறுவது என்பதை மறத்தலாகாது.
4527,"இக்குறட்பாவிற்குப் பண்டை உரையாசிரியர் கூறியுள்ள பொருள், பெரிதும் சில புராணக் கதைகளை உளங்கொண்டு திகழ்கிறது."
4528,இருடிகள் வெகுண்டு சபித்த கதைகள் சில புராணங் களில் சொல்லப்பட்டிருக்கின்றன.
4529,அக்கதைகள் உரையாசிரியன் மாரைத் தங்கள் வயப்படுத்திவிட்டன.
4530,நகுஷன் பெரும் பாம்பாயினான்.
4531,இது வெகுளியால் பொறுத்தலரிதென்றது என்றொரு குறிப்பும் அவரால் பொறிக் கப்பட்டது.
4532,நகுஷன் கதை புராணேதிகாசங்களி லிருப்பது.
4533,வெகுளாமை என்றோர் அதிகாரம் நூற்கண் உளது.
4534,அதிற் போந்துள்ள தன்னைத்தான் காக்கின் சினங்காக்க காவாக்கால் தன்னையே கொல்லுஞ் சினம் என்னும் பாட்டை நோக்குக.
4535,இஃது ஆசிரியரின் உள்ளக்கிடக்கையை இனிது விளக்கும்.
4536,சினத்தை நிந்தனை செயுமுனி வரர்தொழ எனவருந் திருப்புகழில் முனிவரியல் விளங்குதல் காண்க.
4537,ஆறுவது சினம் என்னும் ஔவை மொழியை ஓர்க.
4538,விரிவு ஈண்டைக்கு வேண்டுவதில்லை.
4539,"தீக்குங்கள் பலகிடப்ப, அவைகளை விடுத்து, வெகுளியை மட்டும் ஈண்டுச் சிறப்பாக ஆசிரியர் குறித்த தென்னை?"
4540,வெகுளியுடையார் நீத்தா ராகார்.
4541,வெகுளியில்லாரே நீத்தாராவர்.
4542,வெகுளி சிறிதுடையாரும் ஒரோவழி எழுதலுடையாரும் நீத்தாராகார்.
4543,வெகுளி முற்றிலும் அற்ற ஒருவரே நீத்தாராவார்.
4544,வெகுளி தத்துவக் காரியங்களில் ஒன்று.
4545,அஃதுள்ள வரை தத்துவச் சேட்டையும் புலக்குறும்பு மிருக்கும்.
4546,நீத்தார் பெருமையில் புலக்குறும்புக்கு இடமேது?
4547,"ஆகவே, வெகுளிக்கும் இடமில்லை யென்க."
4548,வெகுளி பொல்லாதது.
4549,அது மூலமலவேர் அறும்வரை தலைகாட்டுந் தன்மையுடையது.
4550,காமமற்ற இடத்திலும் வெகுளி எழுதலுண்டு.
4551,வெகுளியின்மை தத்துவச் சேட்டைகள் முற்று மின்மையை உணர்த்துவது.
4552,வெகுளியுண்மை தத்துவச் சேட்டை களுண்மையைக் குறிப்பது.
4553,தத்துவங்கடந்தவரே குணமென்னுங் குன்றேறி நின்றவர்.
4554,"இவர் தத்துவச் சேட்டையைக் கடந்தவர் என்பதை விளக்கவே, வெகுளி கணமேயுங் காத்தலரிது என்றார்."
4555,அவர் குறையுடையாரே யாவார்.
4556,வெகுளி முற்றும் அற்றவரே நீத்தாராவார் முனிவராவர் கறை கடந்தவராவர்.
4557,கணமேயும் குணமென்னுங் குன்றேறி நின்றார்மாட்டு வெகுளி ஒரு நொடிப் பொழுதும் எழாதென்பதை வலியுறுத் தற்பொருட்டுக் கணமேயும் என்றார்.
4558,"காத்தல் அரிது நினைவளவிலும் இருத்தலாகா தென்பார், காத்தல் அரிது என்றார்."
4559,"அரிது, அறவே முற்றும் இன்மையை உணர்த்துவது."
4560,இவை குமென்னுங் குன்றேறி நின்றரைப் பழிப்பனவாகும்.
4561,வெகுளி எழுதலும் மிகுதலும் நீத்தார் நீர்மையல்ல.
4562,வெகுண்டெழுந்து சாபமிட்டவரை முனிவர் என்று கொள்ளற்க.
4563,ஐந்தவித்துக் குணமென்னுங் குன்றேறி நின்றவர் சாந்தத் தெய்வத்தைச் சார்ந்து நிற்பவர்.
4564,அவர் பொறுமை பூமிக்கும் இராது.
4565,தமக்குத் தீங்கு செய்வோரையும் அவர் முனிந்து கடிவ தில்லை.
4566,தீயரைச் சபியாது அவரிடத்தும் கருணை காட்டி அவரைத் திருத்தவே முயல்வது குணமென்னுங் குன்றேறி நின்றாரியல்.
4567,சான்றுகள் கிறிது பெருமான் வரலாற்றை நோக்குங்கள்.
4568,கிறிதுவை மாற்றார் என்னென்ன செய்தனர்?
4569,பெருமான் வெகுண்டனரா?
4570,"மனமிரங்கி, பிதாவே!"
4571,இவர்களுக்கு மன்னியும் தாங்கள் செய்கிறது இன்னதென்று அறியாதிருக்கிறார்களே என்றார்.
4572,இவரல்லரோ குணமென்னுங் குன்றேறி நின்ற பெரியார் நீத்தார் முனிவர்?
4573,"மெய்ப் பொருள் நாயனார் வரலாறும் ஈண்டு நினைவுக்கு, வருகிறது."
4574,தம்மைக் கொலைசெய்த ஒருவனிடத்தும் நாயனார் அருள் சுரந்ததைச் சிந்தியுங்கள்.
4575,குமென்னுங் குன்றேறி நின்றவர்க்கு அருளன்றோ பெருகிப் பெருகி வழிந்து கொண்டி ருக்கும்?
4576,இன்னோரன்னோர் இயல்புகளை யெல்லாம் இந்நாளில் வளர்க்க வந்தவர் காந்தியடிகள்.
4577,அவர்தம் வரலாற்றை நோக்குக.
4578,"சிறியோர் அறியாமைக் கிரங்கி அவரிடம் அன்பு பூண்டு, அவரைத் திருத்தவே பெரியோர் முயலல் வேண்டும்."
4579,காழ்ப்புக் கொண்டு வெகுண்டு பழிக்குப் பழிவாங்கப் புகுவது பெரியோர் செயலாகாது.
4580,அது சிறியோர் செயலேயாகும்.
4581,பெரியோர்க்குரிய பூண்பொறுமை பொறாமை மற்றையோர் உடைமை.
4582,சோதனை பெரிதுஞ் சிறியோர் வாயிலாகவே நிகழும்.
4583,அதற்கு இரையாவோர் பெரியோராகார்.
4584,அதில் தேர்ச்சி பெறுவோரே பெரியோராவர்.
4585,சகம்பேயென்றுதம்மைச்சிரிப்ப நாணதுஒழிந்துநாடவர்பழித்துரைபூணதுவாக....
4586,"என்றும், நாட்டார் நகை செய்ய நாமேலை வீடெய்த என்றும் வரும் மணிவாசகரின் பொறுமைப் பூணை அணிந்து பார்க்க."
4587,செத்தாரைப் போலே திரி என்பது பட்டினத்தடிகளின் பொன்மொழி.
4588,செத்தாரைப் போலத் திரிவது குணமென்னுங் குன்றேறி நின்றாரின் இலக்கணம்.
4589,அது வெகுளியின்றி வாழ்வது.
4590,தீமையை எதிர்த்து நிற்கவேண்டா உன்னை வலது கன்னத்தில் அறைகிறவனுக்கு மறு கன்னத்தையும் திருப்பிக் காட்டு......
4591,உங்கள் சத்துருக்களில் அன்பு கூருங்கள்.
4592,உங்களை இம்சைப் படுத்துகிறவர்களுக்காக ஜெபஞ் செய்யுங்கள்.
4593,இப்படிச் செய்தால் பரலோகத்திலிருக்கிற உங்கள் பிதாவுக்குப் பிள்ளைகளா யிருப்பீர்கள்...
4594,இத் திருமொழிகள் கிறிதுவின் மலைப்பொழிவில் உள்ளன.
4595,இவை இக்குறட்பாவில் விரிவுரை போன்றிருத்தலைக் காண்க.
4596,குணமென்னுங் குன்றேறி நின்றாரியல் வெகுளியற்றி ருத்தல் என்பது பாட்டின் உள்ளுறை.
4597,நிறைமொழி மாந்தர் பெருமை நிலத்து மறைமொழி காட்டி விடும்.
4598,கருத்து நீத்தார் பெருமை அவர்தம் மொழியால் விளங்கும்.
4599,விருத்தி மேலே ஐந்தவித்தார் குணத்திறன் கூறப்பட்டது.
4600,இங்கே அன்னார் மொழித்திறன் கூறப்படுகிறது.
4601,குணமென்னுங் குன்றேறி நின்றார் மொழியே நிறையுடைய மறையாகும்.
4602,மொழி வாக்கு முக்கரணங்களில் ஒன்று.
4603,மாந்தர் மக்கள் ஆறறிவுடையார்.
4604,"நிறை மொழி நிறை நிறுத்தல், அடக்கம் ஈண்டு மனத்தின் மேற்று."
4605,மனம் ஒருவழியில் நிற்பின் புலன்களும் அவ்வழியில் நிற்கும்.
4606,இவ்வதி காரம் நீத்தார் பெருமை கூறுவது.
4607,நீத்தார் பெருமைக்குப் புலனடக்கம் இன்றியமையாதது.
4608,"இதனை, சுவை....."
4609,ஐந்தின் வகை தெரிவான் உரன்...
4610,ஓரைந்துங் காப்பான் ஐந்தவித்தான் எனவரூஉம் இவ்வதிகாரப் பாக்கள் நன்கு விளக்குகின்றன.
4611,"இவற்றைத் தொடர்ந்து நிற்கும் இப்பாட்டிலுள்ள நிறை, மனநிறையை உணர்த்துவதென்று கொள்ளுதல் பொருத்தம்."
4612,"எனவே, நிறை என்பது, மனநிறுத்தத்தை அடக்கத்தை பொருளாக் கொண்டதென் றுணர்க."
4613,உண்மை வாய்மை மெய்ம்மை மனத்தில் இருவித நிலையுண்டு.
4614,ஒன்று அலைவது மற்றொன்று அலையாதது.
4615,அலையும் மனம் உரன் சக்தி அற்றது அலையா மனம் உரன் உற்றது.
4616,சத்தியம் முன்னைய தால் விளங்காது பின்னையதால் விளங்கும்.
4617,அலையா மனமே அடங்கியது.
4618,அடங்கிய மனத்தில் சத்தியம் விளங்கும் வாய்ப்புண்டு.
4619,சத்தியம் மனத்தளவில் அரும்புவதால் பயன் விளையாது.
4620,அது வாக்கிலும் மலர்தல் வேண்டும் காயத்திலும் காய்த்தல் வேண்டும்.
4621,சத்தியம் வாழ்வில் கனிதல் வேண்டும் என்று தொகுத்துக் கூறலாம்.
4622,மனம் உள்ளம் வாக்கு வாய் காயம் மெய்.
4623,மூன்று கரணத்திலும் சத்தியமே திகழ வேண்டுமென்று எண்ணித் தமிழ்ப் பெரியோர்கள் சத்தியச் சொற்களைக் கரணங்களை ஒட்டியே வகுத்துள்ளார்கள்.
4624,அவர்களது வகுப்பு முறை போற்றற்குரியதே.
4625,"அவர்கள் கண்ட சத்தியச் சொற்கள் உண்மை, வாய்மை, மெய்ம்மை என்பன."
4626,மூன்றற்கும் பொருள் ஒன்றே.
4627,உள்ளத்தில் நிகழ்வது உண்மை உள் மை வாயில் நிகழ்வது வாய்மை மெய்யில் நிகழ்வது மெய்ம்மை.
4628,அவ்வேட்கைப்படி முக்கரணமும் சத்திய மயமாயின் சத்தியப் பொருள் விளங்குதல் ஒருதலை.
4629,"உண்மைக்கென்றே உள்ளமும், வாய்மைக்கென்றே வாயும், மெய்ம்மைக்கென்றே மெய்யும் அமைந்திருத்தலை உணர்ந்து வாழ்வு நடாத்துவது அறிவுடைமையாகும்."
4630,முதலாவது உண்மை எழும் உள்ளம் பெறுதல் வேண்டும்.
4631,இதற்கு அலையாது அடங்கிய ஒருமை உள்ளந் தேவை.
4632,"ஒருமை உள்ளத்தினின்றும் எழும் உண்மை, வாய்மையையும் மெய்ம்மையையும் தானே நல்கும்."
4633,"ஒருமை உள்ளமே, நிறை நிறுத்தல் அடக்கம் உடையது."
4634,உள்ளத்தினின்றும் அதாவது ஒருமையில் நின்ற உள்ளத்தினின் றும் பிறப்பது உண்மை.
4635,இதனால் நிறையை உண்மை என்றுங் கூறலாம்.
4636,நிறை மனநிறை மன அடக்கம் மன ஒருமை.
