Line Number,Sentence
655,ஊடலொடு துயில்வோர் தாமே துணையைத் தழுவவு மென்க.,False
656,"கடிப்பகை பேய்க்குப் பகை வேம்பும், வெண்சிறு கடுகும் இக் காதையுள் மேல்வருதல் காண்க.",False
657,காவற்பெண்டிர் துயில் வதியவும் என்க.,False
658,"அழுந்தி, அடங்கி, துயின்று என்னும் இடத்து நிகழ்பொருளின் றொழில்கள் இடத்தின் மேல் நின்றன அழுந்தி முதலியவற்றைச் செயவனெச்சமாகத் திரித்தலுமாம்.",False
659,ஒலியாகிய அரவமென்க அரவம் தமிழ்ச்சொல்லே.,False
660,தோப்பி நெல்லாற் சமைத்த கள்.,False
661,பழஞ்செருக்குமுதிர்ந்த களிப்பு.,False
662,அனந்தர்கள்ளுண்ட மயக்கம்.,False
663,புனிறு தீர்ந்த மகளிர் மயக்கந்தீர்ந்த மகளிர் எனத் தனித்தனி முடித்தலுமாம்.,False
664,பத்தாவது இரவில் நீராடவேண்டும் என்பர்.,False
665,ஆடவர்ஈண்டுப் பகைவர்.,False
666,பலியிடும்பொழுது நெடுங்குர லெடுத்துக்கூப்பிடுவராகலின் பலியினெடுங்குரல் என்றார் .,False
667,பல்வேறு ஓதையும் பரந்து ஒருங்கிசைப்ப ஆகிய பலவேறு வகைப்பட்ட ஓசையும் பரந்து ஒன்றாக முழங்க .,False
668,அந்தில்ஆங்கென்னும் பொருட்டு.,False
669,காட்டிய செய்யியவென்னும் வினையெச்சம்.,False
670,வருவதனை உரைப்பது தெய்வத் தன்மையாம் என்று கொண்டு திப்பிய முரைக்கும் என்றார்.,False
671,தெய்வக்கிளவி தெய்வத்தின் மொழி.,False
672,துச்சயன் சுதமதியின் முற்பிறப்பிற் கணவனாயிருந்தவன்.,False
673,தாரை சுதமதியின் முற்பிறப்பில் தமக்கையாயிருந்தவள்.,False
674,வீரை யானையால் இறந்தது கேட்டு இவள் இறந்தமையால் தாரை சாவுற என்றாள் சாவுற எதிர்காலத்தில் வந்தது.,False
675,கௌசிகன் சுதமதியின் தந்தை.,False
676,புலம்புரியாகிய சங்கமென்க.,False
677,புகர்முக வாரணம் கவளம் வேண்டிக் கூப்பிடாநிற்கும்.,False
678,"வண்டு, வளையல், தெய்வங்கட்கு இரவிற் பலி கொடுப்பாராகலின் அது முடிவுற்ற தென்றார், பூ பொலிவு.",False
679,பண்இயம்பண்ணப்பட்ட வாத்தியம் என்றுமாம்.,False
680,புகுந்ததையெல்லாம் ஒருமையிற் பன்மை.,False
681,துயிலெழுப்பிய காதை முற்றிற்று.,False
682,உதித்தவுடன் அவள் இவ்விடம் உவவனத்தில் முன்னம் கண்டறியாத ஒரு பகுதியோ!,False
683,இது நனவோ கனவோ என்பதை அறிகின்றிலேன் மனம் நடுங்கு கின்றது சுதமதி எங்கொளித்தாய் ?,False
684,ஓர் மாற்றம் தருகின்றிலை இருள் கழிந்தது மாதவி வருந்துவள் இது விஞ்சையுடன் தோன்றிய அம் மடந்தை செய்த வஞ்சமோ!,False
685,ஒன்றும் தெரிய வில்லையே!,False
686,தொடுப்பு விதைப்பு தொடுப்பி னாயிரம் வித்தியது விளைய என்பது காண்க விளாக் கொண்டு உழுதலுமாம்.,False
687,"முரி என்பதற்குச் சிதறிய என்றும், ஒளிவிடு மென்றும் உரைத்தலுமாம்.",False
688,அறல் நீர் அரித்து ஒழுகுவதால் மணல் அற்று அற்று இருப்பது.,False
689,மணிபல்லவத் திடைப் பரப்பில் இலஞ்சிக் கரையில் மணலிற் பள்ளியில் துயிலெழுந்த மணிமேகலை யென்க.,False
690,நெட்டிடை அன்றியும் நெடுந்தூரம் அன்றாக அணிமையில் உம் அசை.,False
691,உவவனம் என்பது முதல் மணிமேகலை கூற்று.,False
692,ஓரிடங்கொல்முன் கண்டறியாத ஓரிடமோ வென்க.,False
693,"வாராய் வருகின்றிலை எனவும், வராது எனவும் உரைத்தலுமாம்.",False
694,மெல்வளை யென்றலுமாம்.,False
695,விரிசிறைப் பறவை போதா முதலியன.,False
696,எழுந்துவீழ் சில்லை சிரல் முதலியன.,False
697,திரை தவழ் பறவை முதலிய நான்கும் நீர்வாழ் பறவைகள்.,False
698,பறவையும் பறவையும் சில்லையும் முழுவலுமாகிய பன்னிறப் புள்ளினம் என்க.,False
699,பாசறை மன்னர் போர் குறித்துப் பாசறையிற் சென்று தங்கியிருக்கும் மன்னர்.,False
700,பல்வேறு குழூஉக்குரல் பரந்த வோதையும் என்பது ஈண்டு ஒத்து நோக்கற்பாலது.,False
701,"அரற்றினள், அழுதனள் என்பன முற்றெச்சம்.",False
702,உறுவோள் விழுமக்கிளவியின் அழுவோள் எனக் கூட்டுக.,False
703,உருப்ப முதிர வெகுள என்றுமாம்.,False
704,ஓகாரம் புலம்பலில் வந்தது.,False
705,விதி செய்கை.,False
706,பதுமம் புத்தன் பாதமும் ஆம்.,False
707,"மீமிசை, ஒரு பொருட் பன்மொழி.",False
708,"மரம் பிற சொரியாது, பறவை சிறை அதிராது, அவ்வாறாகத் தேவர் கோன் இட்ட பீடிகையென விரிக்க.",False
709,கீழ்நில மருங்கின் நாகநாடு ஆளும் கீழ்த் திசைக்கண் உள்ள நாக நாட்டினை ஆளும்.,False
710,நாக இலச்சினை யுடைமையால் நாகரெனப் பெயர்பெற்ற ஒருவகை மக்கள் வாழும் நாடு நாகநாடு என்பர்.,False
711,இந்நாட்டின் பெயர் பின்னரும் இந்நூலிற் பலவிடத்து வந்துளது.,False
712,"தம, அஆறனுருபு.",False
713,"மாமணிப் பீடிகை, அறத்தகையாசனம், தரும பீடிகை என்பன ஒரு பொருள்மேல் வந்தன.",False
714,அழுவோள் முன்னர் பீடிகை தோன்றிய தென்க.,False
715,மணிபல்லவத்துத் துயருற்ற காதை முற்றிற்று.,False
716,உரை .,False
717,முத்தம் என்றது நீர்த்துளியை.,False
718,செங்கண் கலுழ்ந்து முலைமேல் உகுத்தென மாறுக.,False
719,"மின் உருவத்திற்கும், முகில் கூந்தலுக்கும் உவமை.",False
720,நிலஞ்சேர்ந்து வணங்கி யென்றபடி.,False
721,துணிபொருள் தெளியப்பட்ட பொருள்.,False
722,"உரைத்ததை ஐ சாரியை, வாய் உண்மை.",False
723,பொறை ஈண்டு பாவச்சுமை.,False
724,வாழும் வேந்தன் என்க வாழும் பிரமதருமன் எனினுமாம்.,False
725,பிரமதருமன் விளி.,False
726,"ஆகலின், இதன்பால் ஒழிகென இந்நகரத்தைவிட்டு நீங்குக என்று கூற நாவலோங்குந் தீவு நாவலந் தீவு சம்புத் தீவு.",False
727,உரைக்கும் நீ வேந்தே!,False
728,கேடெய்தும் ஆகலால் இதன்பால் ஒழிகவென என்க.,False
729,பாடி படைவீடு.,False
730,வேந்தனும் சாற்றிச் செல்வோன் இருப்ப வென்க.,False
731,ஏத்திய ஏத்த ஏத்திய அந்நாள் அருளிய அந்நாள் எனத் தனித்தனி முடித்தலுமாம்.,False
732,இன்பத்து இன்பத்தை சாரியை நிற்க உருபு தொக்கது.,False
733,அலத்தகன் செவ்வரக்கு என்பாருமுளர்.,False
734,பிறந்து பெயர் பெற்றேன் என விகுதி பிரித்துக் கூட்டுக.,False
735,கதிர் ஞாயிறு என்க.,False
736,இந்நூலின்கண் பின்பு . பலவிடத்து இது கூறப்பட்டுள்ளமை காண்க.,False
737,திட்டியின் விட மன்ன கற்பின் செல்வியை என்றார் கம்பரும்.,False
738,மனமாசு காம மயக்கங்கள்.,False
739,அறச்செவி அறங்கேட்டற்குரிய செவி.,False
740,திறந்து என்றார்.,False
741,"கேட்பினுங் கேளாத் தகையவே கேள்வியாற், றோட்கப் படாத செவி என்பவாகலின்.",False
742,மறச்செவி அடைத்துசெவி மறவுரையைக் கேளாது அடைத்து.,False
743,சா துயர் சாகுந் துயர்.,False
744,பைந்தொடி முன்னிலை.,False
745,பிறப்பும் உம்மை இறந்தது தழீஇய எச்சப்பொருளது.,False
746,அதுகண்ட ஆயிழை தன்னை அறியாளாயினாள் அப்பொழுது அவள் கைகள் தலைமேற் குவிந்தன.,False
747,பீடிகை கண்டு பிறப்புணர்ந்த காதை முற்றிற்று.,False
748,பெற்றி பேறு பிணிப்பறுத் தோர்தம் பெற்றி யெய்தவும் என்பதிற் போல.,False
749,பூங்கொடி ஏந்தி இழிந்து பொலிந்தெனத் தோன்றிய தெய்வ மென்க.,False
750,"அறம்பாடு என்பதற்கு அறத்தின் தோற்றம் என்றும், சுடர் என்பதற்கு ஞாயிறு என்றும் கூறுதலுமாம்.",False
751,பூ நெஞ்சத் தாமரை.,False
752,புலத்தை ஊடற்றன்மை ஊடற் கூறுமாம்.,False
753,இடங்கழி காமம் வரம்பு கடந்த காமமுமாம் இடங்கழி என்பதே காமத்தை யுணர்த்தலுமுண்டு.,False
754,"மெல்லியல் மலர் எனக் கொண்டு, மென்மைத் தன்மையுடைய மலர்போலும் அடி யென்னலுமாம்.",False
755,"இரத்தின தீவம்இது மணிபல்லவத்திற்கு அயலிலுள்ளதோர் சிறு தீவு இத் தீவும், இதிலுள்ள சமந்தமென்னும் மலை முதலியவும் வரும் காதையானறியப்படும்.",False
756,"தருமத்தைத் தடையின்றிச் செலுத்தினானென்பார், அதனைச் சக்கரமாக உருவகப்படுத்தி, உருட்டினான் என்றார்.",False
757,முன்பு அறக்கதி ராழி திறப்பட வுருட்டி . என்றமையுங் காண்க.,False
758,சாதுசக்கரன் திரிவோன் வருவோன் வந்து தோன்றுதலுமென்க.,False
759,கணவன் தன் அடியில் வணங்குழிவந்தனனாகலின் நாணு தலுற்றாளென்க.,False
760,மயங்குதல் முதலியன இறைபொருளாகப் பிறந்த அச்சமென்னும் மெய்ப்பாடு.,False
761,இராகுலன் வெகுண்டமை குடிகோள் பற்றி வந்த வெகுளி யென்னும் மெய்ப்பாடு.,False
762,வானூடிழிந்தமையே அவனது பெருமையை விளக்குமென்று குறிப்பித்தவாறாயிற்று.,False
763,நாவானது சாரணனைத் துதித்தலாகிய பயன் கொள்ளாமையின் நா வறுமையுற்றாய் என்றாள்.,False
764,பகை காம வெகுளி முதலிய உட்பகை.,False
765,"பாத்தியன் அடியான் என்னும் பொருட்டு நம்பியாண்டார் நம்பிகள் மாணிக்கவாசகரைத் திருவாதவூர்ச் சிவ பாத்தியன், என்று கூறினமையுங் காண்க.",False
766,உண்டி உண்ணுதி வேண்டிக்கோடலில் வந்தது.,False
767,அவன் அன்றியும் அவன் உன்பால் உள்ளம் நீங்காதிருப்பதன்றியும் என விரித்துரைக்க.,False
768,மணிமேகலையின் உயர்வுபற்றிக் கந்தசாலியை உவமை கூறினார்.,False
769,போன்ம் ஈற்று மிசை யுகரங்கெட்டு மயக்க விதியின்மையின் லகரம் திரிந்து வந்தது.,False
770,சென்ற அறவணனையென மாறுதலுமாம்.,False
771,"மறவண நீத்த மாசறு கேள்வி, அறவண வடிகள் . என முன்பு வந்தமையுங் காண்க.",False
772,"எழுந்தவன்எழுந்தோன் என்றுமாம், பாங்குஇயல்பு, சிறப்பு, உளிஉள்ளி.",False
773,கேட்டோர் உள்ளம் கசிந்து உக என்றுமாம்.,False
774,உரைத்த குன்றமாவது மகததேயத்தின் இராசதானியாகிய இராசக்கிருக நகரின் அருகிலுள்ள கிருத்திர கூடம் என்னும் மலையென்பர்.,False
775,பாதபங்கயம் புத்தனுடைய பாததாமரை.,False
776,"அறம்பாடு அறத்தின் கூறென்றும், அறத்தின் இயல்பென்றும் உரைத்தலுமாம்.",False
777,பிற அறம் என்றது பிற சமயக் கொள்கைகளை.,False
778,பெற்றி பேறு இயல்பென்றுமாம்.,False
779,அல்லியங்கோதை அகவிதழ்களாலாகிய மாலையை யுடையாள் ஈண்டு முன்னிலை.,False
780,வாய்மையின் உண்மையுடன் என்றுமாம்.,False
781,மங்கலம் நன்மை.,False
782,புத்தன் ஞானம்பெற்ற நாள் வைகாசித் தூய நிறைமதி நாள் ஆகலின் அதனை மங்கலத் திருநாள் என்றார்.,False
783,புத்தன் பிறந்த நாளும் அதுவேயாகும்.,False
784,பொது வறிவு சிறப்பில்லா அறிவு சாமானிய ஞானம் என்பர் வடநூலார்.,False
785,புலம் மெய்யுணர்வு.,False
786,நால்வகை வாய்மையும் அறிதற்குரிய சிறப்பறிவு.,False
787,சித்தம் உறுதி.,False
788,கொள்கை கோட்பாடுமாம்.,False
789,உணவின் பிண்டம் உணவாலாகிய தொகுதி உண்டி முதற்றே யுணவின் பிண்டம் என்றார் பிறரும்.,False
790,மந்திரங் கொடுத்த காதை முற்றிற்று.,False
791,"கேட்டலும், மணிமேகலை அவளை நோக்கி, பூங்கொடி போல் வாய்!",False
792,யார் நீ? என்றது எனது எப்பிறப்பினைக் கருதி?,False
793,"உடனே அவள் அளவற்ற மகிழ்ச்சியடைந்து நின்று, புத்ததேவரைப் பலவாறு துதித்தாள்.",False
794,பூக்கள் விரிந்த சோலையுமாம்.,False
795,"காதம் காவதம் என விரிந்து நின்றது வ, பகுதிப் பொருள் விகுதி யென்பர் அடியார்க்கு நல்லார்.",False
796,தனித்து ஓர் தீவில் வந்திருத்தலின் கலங்கவிழ் மகளிர் போல் என்றாள்.,False
797,செவ்வனம்நேரே யென்றுமாம் .,False
798,"ஆய இப்பொழுது உளதாகிய, பீடிகைபீடிகையால் மூன்றனுருபு தொக்கது.",False
799,எய்தியவந்தமையாலாகிய என்றுமாம்.,False
800,பயன் இது என்றது பழம்பிறப் புணர்ந்தமையை.,False
801,"சமந்தம் சமனொளி யெனவும் வழங்குமென்பது, இலங்கா தீவத்துச் சமனொளி யென்னுஞ் சிலம்பினை யெய்தி என்று பின் வருவதனா லறியப்படும்.",False
802,"சமந்தம் என்பதும், சமனொளி என்பதும் இலங்கையிலுள்ள ஆடம்ஸ் பீக் என ஆங்கில மொழியில் வழங்கும் மலையையே குறிக்குமென்று கருதுவர்.",False
803,அறவி அறம்.,False
804,காரண காரியத் தொடர்ச்சியாய்க் கரையின்றி வருதலின் பிறவியைப் பெருங்கடல் என்றார்.,False
805,அறவி நாவாய் அறவுருவினதாகிய நாவாய் என்றுமாம்.,False
806,நோன்பினராய்க் கண்டு தொழுவோர் என்றலுமாம்.,False
807,அவர்க்கு அறமொழி உரியது என்பது அவர் அறமொழி கேட்டற்குரியர் என்றபடி.,False
808,பெரும் பெயர்ப்பீடிகை வீடு பயக்கும் பீடிகையுமாம் முன்னதாகிய இலஞ்சியில் என்க.,False
809,இளவேனிலாகிய இருதுவில் என மாறுக.,False
810,"இளவேனில் சித்திரைத் திங்களும் வைகாசித் திங்களும் சேர்ந்த பெரும்பொழுது, எரிகதிர் வெங்கதிர் ஞாயிறு இடபத்தி லுள்ள திங்கள் என்க.",False
811,இருதிள...பொருந்தி என்பது இவ்வாறே பின்பும் வருதல் காண்க.,False
812,முன்னொரு காலத்திற் கார்த்திகை முதலாக நாட்கள் எண்ணப்பட்டமையின் இருபத்தேழு நாட்களில் விசாகம் பதினான்காவதாகிய நடுநாளாயிற்று.,False
813,அரசு மரங்களுட்சிறந்ததென்பது பகவற்கீதை முதலியவற்றானும் அறியப்படும்.,False
814,போதி என்பது ஞானம் என்ற பொருளில் வருதலும் உண்டு.,False
815,தான் என்றது சோற்றை.,False
816,முயலுத லாவது அறத்தினை அறிவுறுத்தல் பிறர் பொருட்டு அறத்தினை முயன்று செய்யும் என்றுமாம்.,False
817,அழிவற்ற நிருவாணமே முத்தியே அவனால் விரும்பப்பட்டமையின் அழியு மியல்புடைய துறக்கம் வேண்டப் படாதாயிற்று.,False
818,பிறக்குபின் துறைபிறக் கொழியப் போகி என்பது காண்க.,False
819,"தீமொழிபொய், குறளை, வன்சொல், பயனில்சொல் என்பன.",False
820,நரகர் சிலரது துன்பந் தணித்தற் பொருட்டுப் புத்தன் ஒரு பிறப்பில் நரகலோகத்திற்குச் சென்றான் என்பர்.,False
