Line Number,Sentence
2285,பரிமாணனார் நூலிலிருந்து சில சூத்திரங்களையும் மேற்கோள் காட்டுகிறார்கள்.
2286,"இந்தப் பரிமாணனார் என்பவர் யார், எந்தக் காலத்தில் இருந்தவர்."
2287,இவர் செய்த யாப்பிலக்கண நூலின் பெயர் என்ன என்பவை ஒன்றும் தெரியவில்லை.
2288,இந்நூல் இப்போது கிடைக்க வில்லை.
2289,வஞ்சி தானே யடிவரம் பின்றி யெஞ்சா விசைநிலை தூங்க லெய்தியும் ஆசிரிய மாகியு முடியு மென்ப.
2290,அவர் இயைபுத் தொடைக்கு விகற்பம் வேண்டிற்றிலர்.
2291,என்னை?
2292,அது விதந்த மொழியினம் வேறுஞ் செப்பும் என்றார் பரிமாணனார் என்பது.
2293,.
2294,பல்காப்பியம் பல்காப்பியனார் இயற்றிய பல்காப்பியம் என்னும் இலக்கண நூல் ஒன்று இருந்ததென்பது பேராசிரியர் உரையினால் தெரிகிறது.
2295,"பல் காப்பியம், தொல்காப்பியத்தின் வழி நூல்."
2296,இது செய்யுளிலக்கணத்தை மட்டும் கூறுவது.
2297,இந்நூலைப் பற்றி வேறு செய்திகள் தெரியவில்லை.
2298,தொல்.
2299,என்னை?
2300,செய்யுளிலக்கணம் அகத்தியத்துட் பரந்து கிடந்த தனை இவ்வாசிரியர் தொல்காப்பியர் சுருங்கச் செய்தலின் அருமை நோக்கிப் பகுத்துக் கூறினாராகலானும்.
2301,அவர் தந்திரத்துக் கேற்ப முதனூலோடு பொருந்த நூல் செய்தராகாலானும் அமையுமென்பது. பல்காப்பியர் சூத்திரங்களுள் ஒன்றேனும் கிடைக்கவில்லை.
2302,.
2303,பல்காப்பியப் புறனடையைப் பல்காப்பியனாரே இயற்றியிருக்க வேண்டும் என்று கருதலாம்.
2304,இந்நூலைப் பற்றி வேறு செய்திகள் கிடைக்கவில்லை.
2305,.
2306,"பல்காயம் பல்காயனார் இயற்றிய பல்காயம் என்னும் நூல், யாப்பிலக்கணத்தை உணர்த்துவது."
2307,அவை வருமாறு முதத் தொன்றின் மோனை யெதுகை முதலெழுத் தளவோ டொத்தது முதலா அதுவொழித் தொன்றி னாகு மென்ப.
2308,வஞ்சி விரவ லாசிரிய முரித்தே வெண்பா விரவினுங் கடிவரை யிலவே.
2309,அடிமுதற் பொருளைத் தானினிது கொண்டு முடிய நிற்பது கூனென மொழிப.
2310,தூக்கும் பாட்டும் பாவு மொன்றென நோக்கிற் றென்ப நுணங்கி யோரே.
2311,உயிரீ ராறே மெய்ம்மூ வாறே அம்மூ வாறு முயிரோ டுயிர்ப்ப இருநூற் றொருபத் தாறுயிர் மெய்யே.
2312,குறிலொரு மாத்திரை நெடிலிரு மாத்திரை யளபெடை மூன்றென் றறையல் வேண்டும்.
2313,எழுவகை யிடத்துங் குற்றிய லுகரம் வழுவின்றி வரூஉம் வல்லா றூர்ந்தே.
2314,யகரம் முதல்வரின் உகரம் ஒழிய இகரமுங் குறுகும் என்மனார் புலவர்.
2315,தற்சுட் டேவல் குறிப்பிவை யல்வழி முற்றத் தனிக்குறின் முதலசை யாகா.
2316,நெடில்குறி றனியாய் நின்றுமொற் றடுத்துங் குறிலிணை குறினெடி றனித்துமொற் றடுத்து நடைபெறு மசைநேர் நிரைநா லிரண்டே.
2317,அசையே யிரண்டு மூன்றுந் தம்முள் இசையே வருவன சீரெனப் படுமே.
2318,ஈரிரண் டாகியு மொரோவிடத் தியலும்.
2319,நாலசை யானு நடைபெறு மோரசைச் சீர்நிலை யெய்தலுஞ் சிலவிடத் துளவே.
2320,நாலசைச் சீரு மொரோவிடத் தியலும் பாவொடு பாவினம் பயிற லின்றி.
2321,ஓசையி னொன்றி வரினும் வெண்சீரு மாசிரிய வடியுட் குறுகு மென்ப.
2322,அகவலுட் டன்சீர் வெண்சீ ரொருங்கு புகலிற் கலியுடன் பொருந்து மென்ப.
2323,வஞ்சியு ளாயி னெஞ்சுத லிலவே.
2324,இயற்சீ ரிறுதிநே ரிற்ற காலை வஞ்சி யுள்ளும் வந்த நாகா வாயினு மொரோவிடத் தாகு மென்ப.
2325,ஆசிரி யத்தொடு வெள்ளையுங் கலியும் நேரடி தன்னா னிலைபெற நிற்கும்.
2326,வஞ்சி விரவல் ஆசிரிய உரித்தே வெண்பா விரவினுங் கடிவரை வின்றே.
2327,முதலெழுத் தளவொத் தயலெழுத் தொன்றுவ தெதுகை யதன்வழி யியையும் பெறுமே.
2328,முதலெழுத் தொன்றுவ மோனை யெதுகை முதலெழுத்த தளவோ டொத்தது முதலா வதுவொழித் தொன்றினாகு மென்ப.
2329,விவ்விரு தொடைக்குங் கிளையெழுத் துரிய.
2330,சொல்லினும் பொருளினு மாறுகோண் முரணே.
2331,இயையே யிறுசீ ரொன்று மென்ப.
2332,அளபெடைத் தொடைக்கே யளபெடை யாகும்.
2333,அசையினுஞ் சீரினு மிசையினு மெல்லா மிசையா தாவது செந்தொடை தானே.
2334,முழுவது மொன்றி னிரட்டை யாகும்.
2335,விகற்பங் கொள்ளா தோசையி னமைதியும் முதற்க ணடிவயின் முடிவ தாகும்.
2336,உரையொடு நூலிவை யடியில நடப்பினும் வரைவில வென்ப வாய்மொழிப் புலவர்.
2337,மொழிபிசி முதுசொன் மூன்று மன்ன.
2338,செயிர்தீர் செய்யுட் டெரியுங் காலை யடியி னீட்டத் தழகுபட் டியலும்.
2339,ஒரோவடி யானு மொரோவிடத் தியலும்.
2340,"அவைதாம், பாட்டுரை நூலே மந்திரம் பிசியே முதுசொல் லங்கதம் வாழ்த்தொடு பிறவும் ஆக்கின வென்ப வறிந்திசி னோரே."
2341,பல்காயனார் நேரீற் றியற்சீர் வஞ்சியடியி னிறுதியும் அருகி வரப்பெறு மென்றார்.
2342,"பன்னிரு பாட்டியலில், பல்காயனார் இயற்றிய சூத்திரங்கள் நான்கு காணப்படுகின்றன."
2343,அவையாவன இரண்டு பொருள்புண ரிருபத் தெழுவகைச் சீரிய பாட்டே தாரகை மாலை.
2344,எப்பொரு ளேனு மிருபத் தெழுவகை செப்பிய நெறியது செந்தமிழ் மாலை.
2345,அறுசீர் ரெண்சீ ரடிநான் கொத்தங் கிறுவது தாண்டக மிருமுச் சீரடி குழியது திருநாற் சீரே.
2346,.
2347,பனம்பாரம் பனம்பாரம் என்னும் பெயருள்ள இலக்கண நூலை ஆசிரியர் பனம்பாரனார் இயற்றினார்.
2348,இவ் விரண்டு சூத்திரமும் பனம்பாரம் என்று எழுதுகிறார் மயிலைநாதர்.
2349,எனவே.
2350,நன்னூலில் உள்ள இச் சூத்திரங்கள் பனம்பார இலக்கணத்துச் சூத்திரங்கள் என்று தெரிகின்றன.
2351,இந்நூலைப்பற்றி வேறு செய்திகள் தெரியவில்லை.
2352,.
2353,பன்னிருபடலம்.
2354,அளவினாற் பெயர்பெற்றது பன்னிருபடலம் என்று கூறுகின்றார் இறையனார் அகப்பொருள் உரையாசிரியர்.
2355,ஒத்தினாற் பிண்டமாயிற்று பன்னிருபடலம் என்று கூறுகிறார் இளம்பூராண அடிகள்.
2356,தொல்.
2357,பொருள்.
2358,செய்யுள் ஆம் சூத்திர உரை.
2359,இடைக்காலத்திலே பெரிதும் பயிலப்பட்டது பன்னிரு படலம் என்பது நன்கு தெரிகிறது.
2360,இந்நூலைப் பின்பற்றி இதற்கு வழி நூலாகப் புறப்பொருள் வெண்பாமாலை என்னும் நூலை ஐயன் ஆரிதன் என்பவர் இயற்றினார்.
2361,பன்னிருபடலம் முதல் நூலாக வழிநூல் செய்த வெண்பாமாலை ஐயனாரிதனாரும் இது கூறினார் என்று பேராசிரியர் தொல்.
2362,பொருள்.
2363,"மரபு, தமது உரையில் எழுதுகிறார்."
2364,பன்னிருபடலத்தின் வழிநூலாகிய புறப்பொருள் வெண் பாமாலை இப்போது முழுவதும் இருக்கிறது.
2365,ஆனால் முதனூலாகிய பன்னிருபடலம் மறைந்துவிட்டது.
2366,என்னை?
2367,பன்னிருப்படலத்துச் சூத்திரம் ஒன்றை இளம்பூராண அடிகள் தொல்.
2368,"புறத்திணை, அறுவகைப்பட்ட பார்ப்பன பக்கமும் என்னும் சூத்திர உரையில் மேற்கோள் காட்டுகிறார்."
2369,பல்லாக் கொண்டார் ஒல்லா ரென்னும் பூசல் கேட்டு கையது மாற்றி என்னும் பன்னிருபடலச் சூத்திர அடிகளை மேற்கோள் காட்டுகிறார்.
2370,"யாப்பருங்கல விருத்தியுரைகாரர், கீழ்க்காணும் பன்னிருபடலச் சூத்திரங்களைத் தமது உரையில் மேற்கோள் காட்டுகிறார் அகத்திணை யகவலுள் வஞ்சி வாரா."
2371,என்னை?
2372,"புறத்தினையியல், உரை ஆய்ந்த அகப்புறம் ஐயிரண்டு மாயுங்கால் காந்தன் ..."
2373,...
2374,...
2375,பொருளதிகாரம் மேற்கோள் காட்டுகிறார்.
2376,"அதனால், பன்னிரு படலத்துள் வெட்சிப்படலம் தொல்காப்பியர் கூறினாரென்றால் பொருந்தாது."
2377,என்னை?
2378,பொருள்.
2379,பொருள்.
2380,மரபு எனவும் கூறிய ஆசிரியர் தாமே மாறுகொளக் கூறல்.
2381,"குன்றக் கூறல், மிகைபடக் கூறல், பொருளில கூறல்."
2382,"மயங்க கூறல், தன்னானொரு பொருள் கருதிக் கூறல் என்னும் குற்றம் பயக்கக் கூறினாரென வருமாகலான் தொல்."
2383,ஏனையவும் இவ்வாறு மயங்கக் கூறலும் மிகைபடக் கூறலும் ஆயவாறு எடுத்துக்காட்டின் பெருகுமாத லான் உய்த்துணர்ந்து கண்டு கொள்க. தொல்.
2384,"புறத்திணையியல், வெறியறி சிறப்பின் என்னும் சூத்திர உரை."
2385,"ஆனால், இந்நூல் இடைக் காலத்திலே பெரிதும் பயிலப்பட்டது என்பதும் தெரிகிறது."
2386,இப்போது இந்நூல் மறைந்து விட்டது.
2387,இதன் வழி நூலாகிய புறப்பொருள் வெண்பாமாலை இப்போது வழங்கிவருகிறது.
2388,.
2389,"யாப்பருங்கலம், ஒழிபியலில் விருத்தியுரைகாரர் இந்நூற் சூத்திரம் ஒன்றை மேற்கோள் காட்டுகிறார்."
2390,பொருள் காண்க. இந்நூலைப்பற்றியும் இதை இயற்றிய பாடலனாரைப் பற்றியும் வேறு செய்திகள் தெரியவில்லை.
2391,.
2392,"பாட்டியல் மரபு இந்த யாப்பிலக்கண நூலை, யாப்பருங்கல விருத்தியுரைகாரர் தமது உரையில் குறிப்பிடுகிறார்."
2393,"இந்நூலாசிரியர் யார், இது எந்தக் காலத்தில் இயற்றப்பட்டது என்பன தெரியவில்லை."
2394,இதற்குப் பாட்டியல் என்றும் பெயர் உண்டு.
2395,அவ் வாரிடச் செய்யுள் பாடுதற்குரியார் ஆக்குதற்கும் கெடுத்தற்கும் ஆற்றலுடையராகி இம்மை மறுமை முக்காலப் பண்பு முணர்ந்த விருடிகளெனக் கொள்க.
2396,என்னை?
2397,...
2398,...
2399,"பாட்டியன்மரபு, பூதபுராண முதலாகிய தமிழ்நூலுள்ளும் பகுதி யுடையார் வாய்க் கேட்டுக் கொள்க."
2400,"அவை யீரண்டுரைக்கிற் பெருகும். யாப்பருங்கலம், ஒழிபியல், விருத்தியுரை .புணர்ப்பாவை."
2401,.போக்கியம்.
2402,.கிரணியம்.
2403,.
2404,வதுவிச்சை யாப்பருங்கல விருத்தியுரைகாரர் இந்நூல்களைக் குறிப்பிடு கிறார்.
2405,"யாப்பருங்கலம், ஒழிபியலில் சித்திரக் கவிகளைப் பற்றிக் கூறுகிற இடத்தில் இந்நூல்களைக் கூறுகிறார்."
2406,"இவற்றை இயற்றியவர் யாவர் என்பதும், இவை எக்காலத்தில் இயற்றப்பட்டன என்பதும் தெரியவில்லை."
2407,.
2408,பெரிய பம்மம் பெரிய பம்மம் என்னும் இலக்கண நூல் ஒன்று இருந்த தென்பது யாப்பருங்கல விருத்தியுரையினால் தெரிகிறது.
2409,"எழுத்தோத்து, ஆம் சூத்திர விருத்தியுரையில் உரையாசிரியர், பெரிய பம்மச்சூத்திரம் ஒன்றை மேற்கோள் காட்டுகிறார்."
2410,இது பெரிய பம்மம். இந்தப் பெரிய பம்மத்தைப் பற்றி வேறு செய்திகள் தெரிய வில்லை.
2411,.
2412,பெரிய முப்பழம் இந்நூலின் பெயர் யாப்பருங்கல விருத்தியுரையினால் தெரிகிறது.
2413,இந்நூலைப் பற்றிய வேறு செய்திகள் தெரியவில்லை.
2414,.
2415,மயேச்சுவரருக்குப் பேராசிரியர் என்னும் சிறப்புப்பெயரும் வழங்கி வந்தது போலும்.
2416,யாப்பருங்கல விருத்தியுரைகாரர் மயேச்சுவரராகிய பேராசிரியரைப் பற்றிப் பலவாறு புகழ்ந்து எழுதுகிறார்.
2417,அவர் எழுதுவது வருமாறு பிறைநெடுமுடிக் கறைமிடற்றரனார் பெயர் மகிழ்ந்த பேராசிரியர்.
2418,"இவ்வாறு பேராசிரியருக்குப் பல அடைமொழி கொடுத்து கூறுகிற யாப்பருங்கல விருத்தியுரைகாரர், பல இடங்களில் மயேச்சுவரர் என்னும் பெயரையும் குறிக்கிறார்."
2419,இவை மயேச்சுவரர் பெயரால் காட்டப்பட்ட சூத்திரங்கள் சீர்தளை சிதைவுழி யீருயிர்க் குறுக்கமும் நேர்த லிலவே யுயிரள பெடையும்.
2420,நேர்நிரை நேர்பு நிரைபென நான்கும் ரடருடு வடிவாக விடுவா ருமுளர்.
2421,நேர்நிரை நேர்பு நிரைபென நான்கும் ரடருடுப் போல வொருவிர னேரே.
2422,விரலிடை யிட்டன வசைச்சீர் நாலசை விரல்வரை யிடையினு மானமில்லை.
2423,விரலிடை யிட்டன ரடருடு வாடரு வெடிவரி னிரல்பட வெழுதி யலகு பெறுமே.
2424,இயற்சீ ருரிச்சீர் பொதுச்சீ ரென்னும் நிகழ்ச்சிய வென்ப நின்ற மூன்றும்.
2425,நேரு நிரையுஞ் சீராய் வருதலுஞ் சீருந் தளையுஞ் சிதைவுழிக் கொளலும் யாவரு மறிவர் நால்வகைப் பாவினும்.
2426,நேரீயற் றியற்சீர் கலிவயிற் சேரா நிரையிற நிற்ற நாலசை யெல்லாம் வரைதல் வேண்டும் வஞ்சியில் வழியே.
2427,நிரைநடு வியலா வஞ்சி யுரிச்சீர் வரைதல் வேண்டு மாசிரிய மருங்கின்.
2428,ஈரசை யியற்சீ ரொன்றிய வெல்லா மாசிரி யத்தளை யென்மனார் புலவர்.
2429,இயற்சீ ரொன்றா நிலையது வெண்டளை யுரிச்சீ ரதனு ளொன்றுத லியல்பே.
2430,நேரு நிரையுமா மியற்சீ ரொன்றின் யாவரு மறிப வாசிரி யத்தளை.
2431,வேறுபட வரினிது வெண்டளைவெண்சீர் ஆறறி புலவர்க் கொன்றினு மதுவே.
2432,வெண்சீர்ப் பின்னர் நிரைவருங் காலைக் கண்டனர் புலவர் கலித்தளை யாக.
2433,வஞ்சி யுரிச்சீர் வந்தன வழிமுறை யெஞ்சிய வரினும் வஞ்சித் தளையே.
2434,இருசீ ரடியும் முச்சீ ரடியும் வருதல் வேண்டும் வஞ்சியுள்ளே.
2435,பொருளினுஞ் சொல்லினு முரணத் தொடுப்பின் முரணென மொழிப முந்தை யோரே.
2436,ஈற்றயல் குறைந்த நேரசை யிணையா மேற்ற வடியி னிடைபல குறைந்தன.
2437,எவ்வடி யானு முதனடு விறுதி அவ்வடி பொருள் கொளின் மண்டில யாப்பே.
2438,ஒத்த வடியின நிலைமண் டிலமே.
2439,ஒத்த வொருபொருண் மூவடி முடியினஃ தொத்தா ழிசையா முடன்மூன் றடுக்கின்.
2440,தளைகலி தட்டன தன்சீர் வெள்ளை களையுந வின்றிக் கடையடி குறையின விரவர லில்லா வெண்கலி யாகும்.
2441,ஐஞ்சீர் நாற்சீ ரடிநான் காயி னெஞ்சாக் கலியின் றுறையும் விருத்தமும்.
2442,இருசீர் நாலடி மூன்றிணைந் தொன்றி வருவது வஞ்சித் தாழிசை தனிநின் றொருபொருண் முடிந்தது துறையென மொழிப.
