Line Number,Sentence
1345,"அவள், நமக்கு முன்னாடி எழுந்திருக்கிறவளாயிருந்தால், நாம் விழித்துக் கொண்டவுடன் அவளைப் பார்க்கலாம்."
1346,ஆனால் அவள் விழித்துக் கொண்டவுடன் முதன் முதலாகப் பார்க்கிற பொருள் நாமாகத்தானே இருக்கிறோம்?
1347,ஆண்கள் எழுந்திருப்பதற்கு ஒரு மணி நேரம் முந்தி பெண்கள் எழுந்திருந்தால் போதாதா வென்பது அவள் கட்சி.
1348,அவள் கட்சிக்கு எதிர்க்கட்சி நம்மால் பேச முடியுமா?
1349,"இப்பொழுதெல்லாம், காலையில் எழுந்தவுடன் முதன் முதலாகப் பார்க்கக் கூடியது காபிதான்."
1350,காபியே!
1351,உன்னைப் பார்த்தாலே போதும் பரவசமுண்டாகிறது.
1352,உன்னுடைய வாசனையே போதும் பசி தீர்ந்து விடுகிறது.
1353,உன்னிடமிருந்து எவ்வளவுக் கெவ்வளவு அதிகமாக நுரை வருகிறதோ அவ்வளவுக்கவ்வளவு குடிக்கிறவர்களுடைய அந்தது உயர்கிறது.
1354,காட்டுமிராண்டித் தனத்திலிருந்து நாகரிக பாதைக்கு எங்களைக் கொண்டு விட்டிருக்கிற புனிதமான இரண்டெழுத்துச் சொல்லே!
1355,நீ வாழ்க!
1356,"ஆனால் காபியே, நீ எங்கே பிறந்தாய் என்பதுதான் சரியாகத் தெரியவில்லை."
1357,ஆப்பிரிக்காவில் பிறந்ததாகச் சொல்கிறார்கள் சிலர் அரேபியாவில் பிறந்ததாகச் சொல்கிறார்கள் சிலர்.
1358,.
1359,கோணங்கிராயன் குடும்பம் உலகத்தில் யாருக்கும் ஏதாவது ஒரு குறை இருக்கத்தான் செய்கிறது.
1360,"பார்க்கிற உத்தியோகமா, செய்கிற வியாபாரமா, நடத்துகிற குடும்பமா, வாழ்கிற ஊரா, இப்படி எல்லாவற்றிலும் குறைதான்."
1361,ஒவ்வொருவருக்கும் ஒவ்வொரு விதமான குறை.
1362,குறையின் தரத்திலே வித்தியாசம் இருக்கலாம் குறையில் கூடுதல் குறைச்சல் இருக்கலாம் ஆனால் எல்லோருக்கும் குறை யென்னவோ குறைதான்.
1363,காலையில் எழுந்து தெருப்பக்கம் வந்தேன்.
1364,முதன் முதலாகத் தென்பட்டான் கோணங்கிராயன்.
1365,அவனுக்கும் எனக்கும் லேசான பரிச்சயம்தான்.
1366,எப்பொழுதாவது தெருவிலே போகிறபோது வருகிறபோது அவன் என்னைப் பார்த்து லேசாகச் சிரிப்பான் நான் அவனைப் பார்த்து லேசாக சிரிப்பேன்.
1367,அவ்வளவுதான்.
1368,அவன் என்ன உத்தியோகம் செய்கிறான்.
1369,"அவனுடைய குடும்ப நிலவர மென்ன, இவைகளைப்பற்றி யெல்லாம் எனக்கொன்றும் தெரியாது."
1370,நானும் இதுவரை அவனைக் கேட்டதில்லை.
1371,இருவருக்கும் நெருங்கிய பழக்கமில்லையல்லவா?
1372,"அன்று அகமாத்தாக, நான் தெருப்பக்கம் வந்து நின்றதும், அவன் என் கண்ணுக்குத் தென்பட்டதும் ஒன்றாயிருந்தன."
1373,"ஏதோ அவசர காரியமாக வந்திருக்கிறான் போலிருக்கிறது என்று நானும் எண்ணிக்கொண்டு, அவனுக்கு எதிர்ப்புறமாகத் திண்ணையில் உட்கார்ந்தேன்."
1374,என்ன விசேஷம்?
1375,என்று கேட்க வாயெடுத்தேன்.
1376,"., உடனே, தன் குடும்பத்தைப் பற்றி ஒரு குறை அழுது தீர்த்துவிட்டான்."
1377,ஆனால் அஃது அவன் சொந்த விஷயமல்லவா?
1378,"அவன் சொன்னதை, அப்படியே, அவன் சொன்ன படியே உங்களுக்குச் சொல்லிவிடுகிறேன்."
1379,ஏன் கல்யாணம் செய்து கொண்டோமென்று இப்பொழுது தோன்றுகிறது.
1380,இப்பொழுது தோன்றி என்ன பயன்?
1381,ஆனால் சர்க்கரை விலைதான் ஏறு முகத்திலிருக்கிறதே?
1382,உப்பு நீரைக் கொண்ட சாகரத்தில் திமிங்கிலங்களும் சுறா மீன்களும் இருக்கின்றன கூடவே முத்தும் பவழமும் அகப்படு கின்றன.
1383,"தித்திப்பான இளநீரைக்கொண்ட சாகரமா யிருக்கு மென்று கருதி, இந்தச் சம்சார சாகரத்தில் இறங்கினேன்."
1384,இங்கே முத்தையும் காணோம் பவழத்தையும் காணோம்.
1385,ஆனால் திமிங்கிலங்களுக்கும் சுறாமீன்களுக்கும் குறைவில்லை.
1386,"ஒரு சமயமில்லா விட்டால் ஒரு சமயம், அந்த உப்புச் சமுத்திரத்தில் போய் இறங்கிவிடலாமா வென்றுகூடத் தோன்று கிறது."
1387,அப்படித் துணிந்து இறங்கினால்தான் விமோசனம் ஏற்படுமே?
1388,மகா விஷ்ணுவைப் போல் அதிலே படுத்துக் கிடக்கலாமே?
1389,ஆனால் அதற்குத் தைரியம் வரவில்லை.
1390,என்ன செய்வதென்று தெரியாமல் திகைத்துக் கொண்டிருக்கிறேன்.
1391,கேளுங்கள் என் குடும்பக் கதையை.
1392,எனக்கு ஒரு மகள் ஒரு மகன் ஒரு மனைவி ஒரு மாமியார்.
1393,இவர்கள்தான் என் குடும்பம்.
1394,"என்னையும் சேர்த்துக் கொண்டால், நாங்கள் பஞ்சபூதங்களாகிறோம்."
1395,"ஆம் என் மகள் மண்ணாங் கட்டி யென்றால், என் மகன், ஆற்று நீராய் ஓடுகிறான் சமுத்திர நீராய் அலைபாய்கிறான்."
1396,"சுருக்கமாக, அவன் நின்ற நிலையில் நின்று நான் பார்த்தறியேன்."
1397,"என் மனைவி நெருப்பென்றால், என் மாமியார், காற்றாயிருந்து அதனைச் சதா ஊதிக்கொண்டே யிருக்கிறாள்."
1398,நானோ ஆகாசமாய் எட்டினாற்போலிருந்து எல்லாவற்றையும் பார்த்துக் கொண்டிருக்கிறேன்.
1399,"அநேக சமயங்களில், நானே இந்தப் பஞ்சபூதங்களாகவும் நடிக்க வேண்டியிருக்கிறது."
1400,நடிக்கவேண்டி யிருக்கிறதென்ன?
1401,நடந்து கொள்ளவே வேண்டியிருக் கிறது.
1402,இந்த நான்குபேருடைய அசட்டுத் தனத்தையும் அகம்பாவத்தையும் பொறுத்துக் கொள்வதில் நான் பெரும்பாலும் பூமாதேவியா யிருக்கிறேன்.
1403,"சில சமயங்களில், என்னையும் மிஞ்சிப் கோபம் வந்து விடுகிறது."
1404,"ஒவ்வொரு சமயம், இந்த நான்குபேரும் ஒன்றுகூடி ஏதோ ரகசியம் பேசுவார்கள்."
1405,அதைப் பார்த்ததும் எனக்கு ஆத்திரம் வந்துவிடும்.
1406,அப்பொழுது நான் பேய்க்காற்று தான் ஹா!
1407,ஹா!
1408,என்று அலறல் போடுவேன்.
1409,நான்கு பேரும் மூலைக் கொருவராகப் பிய்த்துக்கொண்டு ஓடுவார்கள்.
1410,"ஆகவே, அந்த விஷயத்தில் நான் ஓர் ஆகாசந்தானே?"
1411,"ஒவ்வொரு சமயம், நான் கற்பனை உலகத்திற்குச் சஞ்சரிக்கப் போவதுண்டு."
1412,"அங்குச் சென்று பார்த்தால், நாங்கள் ஐந்து பேரும் ஐந்து பொறிகளாக, அதாவது பஞ்சேந்திரியங்களாக எனக்குத் தோன்றும்."
1413,என் மகன் பெயர் காசி மகள் பெயர் சேது.
1414,காசிக்கும் ராமேசுவரத்துக்கும் நான் போவானேன்?
1415,என் மனைவி காவேரி என் மாமியார் கங்காபவானி.
1416,புண்ணிய நதிகளைத் தேடிக் கொண்டு நான் அலைய வேண்டியதில்லை.
1417,"பிள்ளையார், தமது பெற்றோர்களான பார்வதியையும், பரமேசுவரனையும் சுற்றி வலம் வந்துவிட்டு, உலகத்தை யெல்லாம் சுற்றிப் பார்த்துவிட்டதாகச் சொன்னாராம்."
1418,"அதைப்போல் நானும் வீட்டுக்குள்ளிருந்து கொண்டே க்ஷேத்திர தரிசனமும், தீர்த்த யாத்திரையும் செய்து கொண்டிருக்கிறேன்."
1419,அதை ஏன் கேட்கிறீர்கள்?
1420,சொன்னால் வெட்கக் கேடு.
1421,"என் மகன் காசி இருக்கிறானே, அவன் ஒரு செல்லாக்காசு."
1422,குட்டிச்சுவர் மாதிரி பதினெட்டு வயது ஆகிறது.
1423,இன்னும் எட்டாவது வகுப்பை எட்டிப் பார்க்கவில்லை.
1424,ஏழாவது வகுப்பில் மூன்று வருஷமாக ஒரே பெஞ்சியைத் தேய்த்துக் கொண்டிருக் கிறான்.
1425,அவனுக்குச் சொல்லிக் கொடுக்கிற வாத்தியார்கூட மூன்று வருஷமாக அந்த அழுமூஞ்சி அர்த்த நாரீச பண்டிதராகவா இருக்க வேண்டும்?
1426,"அவன், பள்ளிக்கூடத்தில் உட்கார்ந்திருக்கிற அறை இருக்கிறதே, அதைக் கூடவா மூன்று வருஷமாகச் சுண்ணாம்பு அடிக்கக்கூடாது?"
1427,கஷ்டகாலம்.
1428,என் பையனுக்கு மூளை இல்லை.
1429,பள்ளிக்கூடத்திற்குப் பணமில்லை.
1430,"என் பெண் சேது, மகா சாது."
1431,"என் வீட்டுக் கூடத்தில், ஒரு மண் உறை இருக்கிறது."
1432,அவள் பிறந்த அன்றுதான் அதைக் கட்டிமுடித்தேன்.
1433,"ஆகவே, இருவருக்கும் ஒரே வயதாகிறது."
1434,அப்பொழுதுதான் அவள் தலை கனம் குறையும்.
1435,சொல்லி விட்டு வீடு வந்து சேர வேண்டியதுதான் அவள் பின்னால் பத்துபேர் வந்து அப்படிச் சொன்னீர் களாமே?
1436,சேது அழகிலே எப்படி என்று கேட்கிறீர்களா?
1437,ஒரே மொத்தாகாரம்.
1438,கொழுக்கட்டைக்குக் கண்ணும் காலும் வைத்தால் எப்படியோ அப்படி.
1439,என் பெண் என்பதற்காக நான் ஒசத்தியாகச் சொல்லிவிட முடியுமா?
1440,எனக்கு அந்தப் பட்சபாதமெல்லாம் கிடையாது.
1441,"சேதுவுக்கு, அழகில்லாமல் போனால் போகிறது குணமாவது உண்டா?"
1442,சொன்னதைக் கேட்கமாட்டாள் தனக்காகவும் தெரியாது.
1443,வேறென்ன வேண்டும்?
1444,"புத்தி, வக்ரபுத்தி."
1445,"குணம், நிர்க்குணம்."
1446,சேதுவுக்குப் பாட்டு ஏதாவது சொல்லிக் கொடுத்திருக் கிறீர்களா வென்று என்னைக் கேளாதீர்கள்.
1447,ஒன்றுக்கும் குறைச்சலில்லை.
1448,யாராருக்கு எவ்வளவு எவ்வளவு அழவேண்டுமோ அவ்வளவையும் அழுதுவிட்டேன்.
1449,பலன் நிஷ்பலன்.
1450,அவ்வளவு நயமான குரல்!
1451,பாடினால் கேட்க வேண்டுமா?
1452,"என் தர்ம பத்தினி காவேரி இருக்கிறாளே, அவளை நானாகப் பார்த்துக் கல்யாணம் செய்து கொள்ளவில்லை."
1453,என் தகப்பனாராகப் பார்த்து நிச்சயம் செய்துவிட்டார்.
1454,மணப் பந்தலில் தான் முதன் முதலாக அவளைப் பார்த்தேன்.
1455,"மகாவிஷ்ணு, வராக அவதாரம் எடுத்ததாகப் படித்திருக்கிறேன்."
1456,உண்மையில் அப்படி ஓர் அவதாரத்தை அவர் எடுத்திருப்பாரா என்பது எனக்குச் சந்தேகமா யிருந்தது.
1457,"என் மனைவியைப் பார்த்த பிறகு, நிச்சயமாக அவர் வராக அவதாரம் எடுத்திருப்பார் என்று உறுதி செய்து கொண்டேன்."
1458,அட கடவுளே!
1459,ஒரு பொருத்தம்கூட இல்லை.
1460,நான் தேவகணமா யிருந்தால் அவள் ராட்சஸ கணமாயிருக்கிறாள்.
1461,எங்கள் வாழ்க்கையில் எவ்வளவு இனிமை இருக்குமென்பதைப் பற்றி நான் இன்னமும் சொல்லிக் கொண்டிருக்க வேண்டுமா?
1462,என் மாமியார் பெயர் கங்காபவானி என்பதுதான் உங்களுக்கு ஞாபகமிருக்குமே.
1463,ஒரு பாறாங்கல்லை எடுத்து அவள் தலையிலே போடுங்கள்.
1464,அப்பொழுது கூட அவள் கண்களிலிருந்து ஒரு பொட்டு தண்ணீர் வராது.
1465,"உள்ளே, அதாவது மனத்தில் ஈரமிருந் தாலல்லவோ வெளியிலே நீர்வரும்?"
1466,என் சீமந்தத்தின் போது என் வீட்டிற்குள் நுழைந்து கூடாரமடித்துக் கொண்டு விட்டாள்.
1467,பதினெட்டு வருஷமாகிறது.
1468,இன்னும் அவளுக்குக் காலம் வர வில்லை.
1469,காலனிடமிருந்து பென்ஷன் எதிர்பார்க்கிறாள் போலிருக் கிறது.
1470,இந்த மாதிரியான குடும்பத்தில் எனக்கு நிம்மதி கிடைக்கு மென்று எதிர் பார்க்கிறீர்களா?
1471,கூறாமற் சந்நியாசங் கொள் என்று யாரோ சொன்னார்களாமே அவர்களை அடிக்கடி நினைத்துக் கொள்கிறேன்.
1472,அவ்வளவுதான் என்னால் செய்ய முடிகிறது.
1473,எனக் கென்னவோ இவ்வளவு அவசரம் எதற்கு என்று தோன்றுகிறது.
1474,"ஏனென்றால், என் மாமியாரின் மூச்சும் இப்பொழுது நிற்கப் போவதில்லை கண் பார்வையும் மங்கப் போவதில்லை."
1475,"அப்படி ஏற்பட்டால் தான், என் குடும்ப பாரம் கொஞ்சம் குறையுமே?"
1476,"ஒரு நாளில் ஒரு மணி நேரமாவது என் மனைவி, என்னுடன் சுமுகமாகப் பேசுவாளே?"
1477,"தவிர, இந்தக் காலத்தில், நல்ல பிள்ளையாகப் பார்த்து நிச்சயம் செய்வதென்பது அவ்வளவு சுலபமாயிருக்கிறதா?"
1478,எல்லாம் வெள்ளையப் பனை பொறுத்த விஷயமாகவல்லவோ இருக்கிறது?
1479,"இப்படி அடுக்கடுக்காகக் கேள்விகள் கேட்க, நாமும் ஏதோ நம்மால் முடிந்தவரையில் பதில் சொல்லி வந்தால், அதில் திருப்தியடை கிறார்களா?"
1480,இவற்றோடு விட்டாலும் பரவாயில்லை.
1481,பெண் பாடுவாளா?
1482,ஆடுவாளா?
1483,என்ன படித்திருக்கிறாள்?
1484,ஹிந்தி யில் என்ன பா செய்திருக்கிறாள்?
1485,என்னென்ன நகைகள் இப்பொழுது போட்டிருக்கிறீர்கள்?
1486,கல்யாணத்தின்போது என்னென்ன போடுவதாக உத்தேசம்?
1487,வெள்ளிப் பாத்திரங்கள் எவ்வளவு செய்து வைத்திருக்கிறீர்கள்?
1488,"எவர்சில்வரில் ஒரு செட், வரிசையாக வைப்பீர்களல்லவா?"
1489,சரமாரியான இந்தக் கேள்வி களுக்கும் ஒருவாறு பதில் சொல்லியாகிறது என்று வைத்துக் கொள்ளுங்கள்.
1490,"பிறகு, பெண் சிரித்த முகமாயிருப்பாளா?"
1491,"தலை மயிர் நீளமா, குட்டையா?"
1492,சவுரி வைத்துக் கொள்ளும் வழக்கம் உண்டா?
1493,கண்ணில் மை இட்டுக் கொள்வாளா?
1494,எல்லாப் பற்களும் வரிசையாக இருக்கின்றவா?
1495,"பேசுகிறபோது படபடத்துப் பேசுவாளா, நிதானமாகப் பேசுவாளா,?"
1496,கீச்சுக் குரலா?
1497,கட்டைக் குரலா?
1498,எங்களுக்குத் தெரிந்தவர்களோடெல்லாம் சகஜமாகப் பழகுவாளா?
1499,"இல்லை, மூஞ்சியைத் தூக்கி வைத்துக் கொண்டு மூலையில் போய் ஒதுங்கி இருப்பாளா?"
1500,அடிக்கடி சினிமா பார்க்க வேண்டுமென்ற ஆசையுண்டா?
1501,வாரத்தில் எத்தனை படங்கள் பார்க்க வேண்டுமென்று கேட்பாள்?
1502,அட கடவுளே!
1503,"இவ்வளவுக்கும் பொறுமையாகப் பதில் சொல்லித் தொலைத் தாலும், விடுகிறார்களா?"
1504,பெண்ணுக்கு பெட்காபி அதாவது காலையில் படுக்கை யிலேயே காபி சாப்பிடுகிற பழக்கம் உண்டா?
1505,அப்படியானால் எங்கள் வீட்டில் ஏழு மணிக்கு மேல் தான் பால்காரன் வருவான்?
1506,அவளுக்கு இது சரிப்படுமா?
1507,அவளுக்கே காபி போடத் தெரியுமா?
1508,சமையல் சுமாராகச் செய்வாளா?
1509,சாணத்தைக் கையால் தொடுவாளா?
