Line Number,Sentence
1,இளங்குமரனார் தமிழ்வளம் திருக்குறள் கட்டுரைகள் இரா.
2,இளங்குமரன் வளவன் பதிப்பகம் சென்னை .
3,நூற் குறிப்பு நூற்பெயர் இளங்குமரனார் தமிழ்வளம் ஆசிரியர் இரா.
4,இளங்குமரன் பதிப்பாளர் இ.
5,"படிகள் நூலாக்கம் பாவாணர் கணினி தி.நகர், சென்னை ."
6,அட்டை ஓவியம் ஓவியர் மருது அட்டை வடிவமைப்பு வ.
7,"மலர் அச்சிட்டோர் ஸ்ரீ வெங்கடேசுவரா ஆப்செட் பிரிண்டர்சு இராயப்பேட்டை, சென்னை ."
8,"வெளியீடு வளவன் பதிப்பகம் எண் சிங்கார வேலர் தெரு, தியாகராயர் நகர், சென்னை ."
9,இவர் தந்நலம் கருதாமல் தமிழ் நலம் காத்து வருபவர்.
10,தம்மைமுன்னிறுத்தாது தமிழை முன்னிறுத்தும் பெருந்தமிழறிஞர்.
11,தமக்கென வாழாது தமிழ்க்கென வாழ்பவர்.
12,ஒருநாளின் முழுப்பொழுதும் தமிழாகவே வாழும் தமிழ்ப் போராளி.
13,சங்கச் சான்றோர் வரிசையில் வைத்து எண்ணத்தக்க அருந்தமிழறிஞர்.
14,தமிழ் இலக்கண இலக்கிய மரபைக் காத்து வரும் மரபு வழி அறிஞர்.
15,மொழிநூல் கதிரவன் பாவாணரின் வேர்ச்சொல் ஆய்வில் அவர் காட்டிய வழியில் தம் தமிழாய்வைத் தொடர்பவர்.
16,தமிழர் இல்லம்தோறும் இருக்கத்தக்க இவ்வருந்தமிழ்ச் செல்வங்களைத் தமிழ் இளம் தலைமுறைக்கு வைப்பாகக் கொடுத்துள்ளோம்.
17,ஒண்டமிழ்த்தாய் சிலம்படியின் முன்னேற்றம் ஒவ்வொன்றும் உன்முன் னேற்றம்!
18,..........
19,.....
20,இதுதான்நீ செயத்தக்க எப்பணிக்கும் முதற்பணியாம் எழுக நன்றே.
21,எனும் பாவேந்தரின் தமிழியக்க உணர்வுகளை நெஞ்சில் ஏந்தி வாழ முற்படுவோம்.
22,பதிப்பாளர்.
23,பெறும் பேறு வளம் எங்கே இருக்கிறது?
24,வளம் எங்கேயும் இருக்கிறது!
25,அஃது இல்லாத இடமே இல்லை!
26,வளம் எங்கும் இருப்பதை எப்படி அறியலாம்?
27,"வளத்தைத் தேடும் உளம் இருந்தால், வளம் எங்கேயும் இருப்பதை அறியலாம்?"
28,வளத்தின் அளவு என்ன?
29,வளத்தின் அளவும் உளத்தின் அளவேயாம்!
30,"உளத்தில் வளம் இல்லையானால், உள்ள வளமும் உடையவனுக்கும் உதவாது ஊருக்கும் உலகுக்கும் உதவாது!"
31,வளத்தைத் தரும் உளத்தை ஒருவர் வாய்க்கப் பெற்றால் போதும்!
32,அவ்வளம் குன்றியளவானால் என்ன?
33,குன்றத்தனைய வளமானால் என்ன?
34,தினை அளவானால் என்ன?
35,பனை அளவானால் என்ன?
36,வளம் வளமே!
37,தேனீ வளம்?
38,"தினைத்தனை அளவுப் பூவில், தேனீ கொள்ளும் தேன் எவ்வளவு இருக்கும்?"
39,கோத்தும்பி கொணரும் தேன் வளம் எவ்வளவு இருக்கும்?
40,"கோத்தும்பி கொணர்வதே வளம், தேனீ கொணர்வது வளமில்லை என எவராவது கூறுவாரா?"
41,வளம் வளமே!
42,"அவரவர் உழைப்பு, அறிவுத்திறம், உண்மையறிவு, பட்டறிவு, காலஇடசூழல் கொடை ஆகியவற்றைப் பொறுத்தது அது."
43,பொருள் மட்டுமா வளம்?
44,புலமை வளமில்லையா?
45,ஊக்குதல் உதவுதல் உறுதுணையாதல் ஒன்றுதல் ஆயவை வளமில்லையா?
46,எல்லாம் வளமே!
47,மல்லல் வளனே என்பது தொல்காப்பியம்.
48,உரி. உடலாலும் வளம் உழைப்பாலும் வளம் உணர்வாலும் வளம் உரையாலும் வளம் வளம் பட வாழ வேண்டாதார் எவர்?
49,வளம் பெற வேண்டாதார் எவர்?
50,வளந்தலை மயங்கிய வஞ்சி முற்றம் என்பது சிலம்பு!
51,"வளத்தின் அளவு, அளந்து கடை அறியாவளம் என்பது நாடென்ப நாடா வளத்தன என்பது நாட்டின் இலக்கணம்!"
52,"எளிமை, இனிமை, இறைமை, நிறைமை என மக்கள் வாழ்ந்த நாள் இலக்கணம்!"
53,"இன்றோ, நானில வளங்களையும் நாடா நாடில்லை!"
54,எந்த நாடு ஏற்றுமதி செய்யவில்லை?
55,எந்த நாடு இறக்குமதி செய்யவில்லை?
56,"பாலைவளத்தை நாடிச்சோலை நிற்றல் வெளிப்படை என்றால், சொல்வானேன்?"
57,நாடாவளத்தில் குப்பைக்கீரை சேராதா?
58,குறுந்தூறு சேராதா?
59,வளத்தை வழங்குதல் தான் பிறவிக் கடனே யன்றி அளவிடும் பொறுப்பு வழங்குவார்க்கு இல்லை!
60,பெறுவார் பொறுப்பு.
61,பெற்றவர் வழியாகக் கருவிலே பெற்ற திரு என்ன!
62,கற்ற கல்வியால் பெற்ற வளம் என்ன!
63,பட்டறிவால் ஆழ்மன ஆய்வால் தேடிக் கொண்ட வளங்கள் என்ன என்ன!
64,"கூற்றையும் ஆடல் கொள்ளும் கொள்கை இதுவென உணர்வார் ஓயார், ஒழியார் சாயார் சரிந்தும் போகார்!"
65,"என் இளந்தைப் பருவமே, ஆசிரியப் பருவமாகிவிட்டது."
66,அக்காலச் சூழல் அது.
67,மூன்றாண்டு ஆசிரியப் பணி செய்தால் போதும்!
68,புலவர் தேர்வைத் தனியாக எழுதலாம் என்னும் வாய்ப்பு!
69,"உயர்பள்ளி, மேல்பள்ளி என்பவற்றிலும் பல்கலைக் கழகத் தமிழியல் ஆய்வுக் களத்திலுமாக ஏறத்தாழ ஆண்டுகள் தமிழ்வாழ்வாக வாழ வாய்த்தது."
70,"தமிழ்த்தொண்டும், தமிழ்நெறித் தொண்டும் என்றும் விடுதல் அறியா விருப்பொடு செய்து கொண்டிருத்தலே இயற்கையோடு இயைந்த வாழ்வாகி விட்டது!"
71,"புலமைத் தேர்வுக்குரிய பாடத்தளவிலோ, நூல்களின் அளவிலோ என் கல்வி நின்றது இல்லை!"
72,தொல்காப்பியம் முதல் இற்றைநாள் நூல்கள் வரை இயன்ற அளவால் தமிழ்வளம் பெறுதலை நோன்பாகக் கொண்டு கற்கும் பேறுபெற்றேன்.
73,"இளந்தைப் பருவத்திலேயே பாவேந்தர், ஓகி சுத்தானந்த பாரதியார், கவிமணியார், கவிராச பண்டித செகவீர பாண்டியனார், அறிஞர் மு.வ."
74,ஆயோர் அரிய காட்சியும் சின்முறைச் சந்திப்புகளும் என்னுள் பசுமை நல்கின.
75,"தமிழ்ப் பொழிவுகளும், ஆய்வுக் கட்டுரைகளும், குடும்பச் சடங்குகளும் என் மீட்டெடுப்புப் பணிகள் ஆயின!"
76,எம் குடும்பக் கடமைகள் எம் பணியையோ தொண்டையோ கவர்ந்து கொள்ளா வகையில் இனிய துணையும் மக்களும் அமைந்தனர்.
77,"அதனால், காலமெல்லாம் கற்கவும் கற்பிக்கவும் நூல் படைக்கவும் வாய்த்த வாய்ப்புப் பெரிதாயிற்று."
78,"செந்தமிழ், செந்தமிழ்ச் செல்வி, தமிழ்ப்பாவை, குறள் நெறி, குறளியம், மலர்கள், ஆய்வரங்கங்கள் எனக் கட்டுரைகள் பெருகின."
79,அச்சுக்கு வாராதவையும் ஆகின!
80,இவை என்றும் ஒருமுகமாய்க் கிடைக்க வாய்ப்பில்லை.
81,எம் நூல்கள் எம்மிடமே முப்பதுக்குமேல் இல்லாமல் மறைந்தன.
82,எழுதியன எல்லாவற்றையும் ஒருமுகமாகப் பெறப் பலர் அவாவினார்.
83,தவத்திரு ஆத்துமானந்த அடிகளார் ஆருயிர்க்கு அன்பர் அதில் தலைப்பட்டு நின்றார்.
84,ஆயர் ஆண்டகை சூசைமாணிக்கனார் சுடரேற்றினார்.
85,பாரதிதாசன் பல்கலைக்கழகம் மதிப்புறு முதுமுனைவர் பட்டம் வழங்கியது.
86,"அதற்கு மகிழ்வுற்ற வகையால் பாவாணர் தமிழியக்கம் முதலாம் அமைப்புகளும், முனைவர் திருமாறனார் முதலாம் ஆர்வலர்களும் விழா ஒன்று எடுத்தனர்."
87,அவ்விழாத் தலைமையைத் திருத்தகு துணைவேந்தர் பொன்னவைக்கோ ஏற்றார்.
88,தவத்திரு ஆத்துமானந்த அடிகளார் வாழ்த்துரைத்தார்.
89,தமிழாக்கப் பதிப்பே வாழ்வாக ஒன்றிய இளவழகனார் முழுதுற அச்சிட ஒப்பினார்.
90,அடிகளார் வெளியீட்டுப் பொறுப்பு ஏற்பதாகக் கூறினார்.
91,"அவ்வகையில் வாய்ப்பதே, இளங்குமரனார் தமிழ்வளம் என்னும் இத் தொகை நூல்களாம்!"
92,"இத் தொகையில் விடுபடும் நூல்கள் கட்டுரைகள், பாடல்கள் பல்லபல."
93,தொகுக்க வாய்க்கா வகையில் கிட்டாவகையில் மறப்பு வகையில் விடுபாடுடையவை உள.
94,எனினும் தொண்ணுறு விழுக்காடேனும் ஒரு முகமாகப் பெறும் பேறு வாய்க்கின்றது என்பது மகிழ்வூட்டுவதாம்!
95,மக்கள் வாழ்வு வளர்நிலையது!
96,நூல்களும் வளர் நிலையவை!
97,ஆதலால் ஒருவாழ்வுக் கொடை மட்டுமன்று ஈது ஒருவாழ்வு பெறத் தக்க பல்பருவக் கொடையுமாம் எனல் சாலும்!
98,இவ்வளத்தை முழுதுற எண்ணின் ஒன்று உறுதியாக வெளிப்படும்.
99,நலவாழ்வு நல்வாழ்வு கருதாத இயற்கை இறைமைப் பொதுமை கருதாத எப்படைப்பும் எம்படைப்பில் இரா என்பதேயாம்.
100,இவற்றைப் பயில்வார் பெறும் பேறும் அதுவாக அமையின் அப்பேறே யாம் பெறும் பேறாம்.
101,இவ்வளம் வெளிவர விரும்பினோர் உழைத்தோர் உதவினோர் ஆய அனைவர்க்கும் நன்றிக் கடப்பாடுடையேன்!
102,வாழிய நலனே!
103,வாழிய நிலனே!
104,இன்பம் வேண்டுமா?
105,.
106,எது அமிழ்து?
107,.
108,ஐந்து யானைகள் .
109,பழிவழியைப் பாராதே!
110,.
111,இனிய சோலை .
112,உண்டா?
113,இல்லையா?
114,.
115,யாருக்கு இன்பம்?
116,.
117,கதவு இல்லாத வீடு .
118,பார்க்க வாடும் பனிப்பூ .
119,இரும்பும் கரும்பும் .
120,இழிவும் உயர்வும் .
121,குருட்டு நீதிபதி .
122,அடக்கு!
123,அடங்கு!
124,.
125,கல்லார் மிக நல்லர் .
126,குடிகேடன் .
127,அழியும் உலகில் அழியாப்புகழ் .
128,பொறுக்க முடியாதா?
129,.
130,பூனையும் புலியும் .
131,மக்கட் பதடி .
132,தீயும் தீமையும் .
133,மருந்து மரம் .
134,எது ஈகை?
135,.
136,சிறியர்க்கு அரியதும் பெரியர்க்கு எளியதும் .
137,அருட் செல்வர் .
138,படைகொண்டார் நெஞ்சு .
139,புகழ்மிக்க தவம் .
140,எண்ணமும் செயலும் .
141,வழி நடையும் வாழ்க்கை நடையும் .
142,காவற் கடன் .
143,துன்புறுத்தாத் துறவு .
144,ஒன்றே ஒன்று .
145,எது வியப்பு?
146,.
147,ஆசை அறுமின்கள் .
148,கணையும் யாழும் .
149,நோயெல்லாம் நோய் செய்தவருக்கே .
150,வகுத்தான் வகுத்த வகை .
151,உலகு புகழ் உயர்நூல் திருக்குறள் கட்டுரைகள் .
152,இன்பம் வேண்டுமா?
153,குழந்தாய்!
154,உனக்கு என்ன வேண்டும்?
155,என்று பெற்றோர்கள் கேட்கின்றனர் பெரியவர்கள் கேட்கின்றனர்.
156,குழந்தை விரும்புபவற்றைக் கேட்கின்றது.
157,அவ்வாறு கேட்பவற்றிலே குழந்தையின் தன்னலமும் புலப்படும் பொது நலமும் புலப்படும் குறுகிய உள்ளமும் புலப்படும் விரிந்த உள்ளமும் புலப்படும்.
158,எப்படியானாலும் தனக்கு.
159,விருப்பானவற்றையே குழந்தை கேட்கும்.
160,வெறுப்பானவற்றைக் கேட்காததுடன் கிடைத்தாலும் உதறியடிக்கும்.
161,"விம்மி விம்மி யழுது, பாலைப் பெற்றுப் பருகும் குழந்தை, மருந்தைக் கண்டதும் முகம் வீங்க அழுவது ஏன்?"
162,இவ்வளவும் ஏன்?
163,விருப்பு வெறுப்பு என்னும் உணர்ச்சிகளின் விளைவேயாம்.
164,தம்பி!
165,"பந்து விளையாடு என்று கட்டளை இடும் பொழுது ஏற்படும் இன்பம், தம்பி!"
166,பலசரக்கு வாங்கி வா என்று வேண்டும் பொழுது இருப்பது இல்லையே!
167,ஏன்?
168,விளையாட்டில் உள்ள விருப்பும் வேலையில் உள்ள வெறுப்பு மேயாம்.
169,"குழந்தைகள், சிறுவர்கள், இளைஞர்கள் இவர்களிடம் மட்டும்தான் இவ்விருப்பு வெறுப்பு உண்டா?"
170,இல்லை வளர்ந் தவர்களிடமும் உண்டு முதியவர்களிடமும் உண்டு.
171,பருவத்திற்கு ஏற்றபடி வெவ்வேறு வழிகளில் விருப்பு வெறுப்பு ஏற்படும்.
172,சிறுவர் விருப்பு வெறுப்புகளுக்கும் பெரியர் விருப்பு வெறுப்பு களுக்கும் உள்ள வேற்றுமை இவ்வளவு தான்!
173,"தம் இனத்தினர், கொள்கையினர், நிறத்தினர், கட்சியினர் சமயத்தினர் ஆகியோரை விரும்புகின்றனர்."
174,இவ் விருப்பை மற்றவர்களிடம் குறைக்கின்றனர் வெறுக்கத் தொடங்கு கின்றனர் வெறுப்பிலேயே நிலைக்கவும் செய்கின்றனர்.
175,பெறுதற்கரிதாம் மானிடப் பிறவி பெற்றதன் பயன் என்ன?
176,விலங்குகளுக்கும் பறவைகளுக்கும் இல்லாத ஆறாம்அறிவாம் பகுத்தறிவைப் பெற்றதன் பயன் என்ன?
177,"ஆன்றோர்களும், சான்றோர்களும் அருளிய நூல்களைக் கற்றதன் பயன் என்ன?"
178,தனித்தனி பெற்ற பட்டறிவின் பயன் என்ன?
179,எந்த ஒன்றாலும் பயனில்லை என்றால் மாந்தர் வாழ்வுக்கு என உள்ள சிறப்புத் தான் என்ன?
180,ஐந்தில் வளையாதது ஐம்பதில் வளையுமா?
181,என்று சொல்லுகிறோம்.
182,"ஐந்தில்வராத பண்பாடு, அறிவு, திறமை ஐம்பதிலோ அதற்கு முன்னோ பின்னோ வரட்டுமே!"
183,வந்தால் நன்மை தானே.
184,ஐந்திலே ஏற்படும் விருப்பு வெறுப்பு நிலைமைகள் ஐம்பதிலுமா அழுத்தமாக நிற்க வேண்டும்?
185,விருப்பு வெறுப்பு எப்படி ஏற்படுகிறது?
186,ஒன்றைப் பார்த்து ஒன்று செய்யப்படுகின்றது.
187,பிறகு ஒன்று போல நடக்காதா?
188,துறவியின் வளர்ப்புக் கிளி எவர் வந்தாலும் அடிகாள் வருக!
189,அமர்க!
190,நீர் பருகுக!
191,களைப்பு ஆறுக என்னும் மொழிகளைக் கூறி இன்புறுத்திற்று.
192,புலவுக் கடைக் கிளியோ எப்பொழுதும் வெட்டு குத்து ஆட்டுக்கறி ஆறணா கோழிக்கறி நாலணா என்று கத்திக் கொண்டு இருந்தது.
193,காரணம் என்ன?
194,ஒரே தாயின் இரட்டைக் குஞ்சுகள் இயல்பில் ஏன் இவ்வேற்றுமை?
195,சேர்ந்த இனத்தைப் பொறுத்தது பண்பாடு என்பது தெளிவாக வில்லையா?
196,ஏன்?
197,அதனால்?
198,இந்நிலைமையில் இன்ப துன்பம் ஆக்கும் விருப்பு வெறுப்பு அகல யாரைச் சேர்வது?
199,துலைக்கோல் தட்டு உள்ளது.
200,பொருள் வைக்கவும் எடுக்கவும் தாழ்கிறது உயர்கிறது.
201,ஏறி ஏறி இறங்குகிறது.
202,இப்படித் தான் மனிதனும் இன்ப துன்பங்கள் அடைந்து மேலும் கீழும் ஏறி இறங்கித் துன்புறுகின்றான்.
203,துலைக்கோல் தட்டில் எப்பொருளும் இல்லாவிடில் ஏறவும் செய்யாது இறங்கவும் செய்யாது சமனிலையில் நின்றுவிடும்.
204,இந்நிலைமையை மனிதன் அடைந்து விட்டானோ இன்பமில்லை துன்பமில்லை!
205,இதனைப்பெற வழியென்ன?
206,இதனை இயல்பாகக் கொண்டிருக்கும் இறைவனை அடைக்கலம் ஆதல் வேண்டும் என்பது ஆன்றோர் நெறி.
