Line Number,Sentence
1121,காட்சியுத்தி யென்று இவற்றைக் கூறியவதனான் நூலுட் காணப்படுமென்ற ஐந்து குற்றத்தோடும் ஒத்தல் கொள்ளப்படும் அவ்வந்நூற்குப் பயம்படவரும் பகுதியானென்பது.
1122,உம்மையெண்ணாகலின் தொகையின்றியுஞ் சில்வகை யெழுத்திற் செய்யுட்டாக வழக்கியலானே சுருங்கச்செய்வதோர் ஆறுளதாயினும் அப்பதினைந்துமெனத் தொகுத்துக் கூறல் உத்திவகையான் அமையுமாகலினென்பது கருத்து.
1123,"இங்ஙனந் தொகைகூறுதல் வெள்ளிதன்றி ஒள்ளிதாகல் அவை, பதினைந்து பெயருமே ஒருநிகரனவென்பது அறியலாகுமென்பது."
1124,"இனி, மெய்பெறு மரபிற் றொடைவகை தாமே தொல்செய் என்னுஞ் சூத்திரம்போல்வன பிறிதொருபொருள் பயக்கு மென்றலும் அச்சூத்திரத்துட் காட்டப்பட்டது."
1125,இவ்வாற்றான் இவ்வுத்திவகை எல்லா நூற்கும் இன்றியமையாவாயின.
1126,"மற்று, வகையெனப்படாது செவ்வனஞ்செய்யும் உத்தி யாவன யாவையென்னின்."
1127,"இயற்கைப் பொருளை யிற்றெனக் கிளத்தல் தொல்சொல்கிள என்றாற்போலச் சொல்லியொழிவன, பிறவும் அன்ன."
1128,விரிப்பி னென்ற வினையெச்சஞ் சேர்த்தி யுணர்த்தல் வேண்டு மென்ற முற்றுவினைகொண்டு முடிந்தது.
1129,"இனி, வழக்கியலும் வழக்கியலாற் செய்யப்பட்ட செய் யுளியலும் பற்றி எழுந்த இலக்கணம் இயற்றமிழெனப்படும்."
1130,"பிறவும் அன்ன அதிகாரமென்ற பொருண்மை யென்னையெனின், முறைமை யெனவும், இடமெனவுங், கிழமையெனவுங் கொள்ளப்படும்."
1131,"எனவே, இடமெனப்பட்டதுதானே முறைமைப் பொருளும் படுமாயினும் இச்சூத்திரத்துள் அதிகாரமெனவும் முறைமையெனவுங் கூறினமையின் ஈண்டு இடமுறைமை யென்பதே கருத்தாயிற்று."
1132,ஒழிந்த மூன்று சொல்லும் இயற்சொல்லின் வேறுபட்டமை கூறுமாகலி னென்பது.
1133,மெய்யென்றதனான் வகுத்தவற்றைப் பின்னும் வகுத்து நிறுத்தல் கொள்ளப்படும் என்னை?
1134,மெய் யென்றதனான் வகுத்தவற்றைப் பின்னும் வகுத்து நிறுத்தல் கொள்ளப்படும் என்னை?
1135,மொழிந்த பொருளோ டொன்ற வவ்வயின் மொழியாததனை முட்டின்று முடித்தல் எடுத்தோதிய பொருண்மைக்கு ஏற்ற வகையான் அப்பொருண்மைக்கட் சொல்லாததொன்று கொள்ளவைத்தல்.
1136,முட்டின்றி முடித்தலென்றதனான் எடுத்தோதாதும் எடுத்தோதியதனோடு ஒக்குஞ் சிறப்பிற்றென்றவாறாம்.
1137,ஒன்றென முடித்த றன்னின முடித்த லெனினும் இழுக்காது.
1138,வினையியலுட் பெயரெச்ச மென்று ஆளுதலும் அது.
1139,ஈற்றசை யிவ்வைந் தேகாரம் தொல்சொல்இடை என இடைச்சொல்லினை எழுத்துச்சாரியை பெய்தோதிய கருத் தானே இப்பொருண்மைகொள்ள வைப்பானாயிற்று மென்பது.
1140,"மற்று இவை எதிரதுபோற்றலாகாவோவெனின், அது பொருட்படைக் கண்ணதெனவும் இவை ஆட்சியுங் குறியீடும் பற்றியதோர் பகுதி யெனவும் கூறி விடுக்க."
1141,"அஃதேற், குறி யீட்டால் ஈண்டாராயானோவெனின், இவை உத்திவகை யாகலானும் அது தானே உத்தியெனப் படுமாதலானும் அதனை ஈண்டு ஆராயானென்பது."
1142,"இனி, மூன்று தலையிட்ட முப்பதிற் றெழுத்தின் தொல்எழுத் புண என்றாற்போல்வன இன மெனப்படும்."
1143,புள்ளி யில்லா வெல்லா மெய்யும் தொல்எழுத்நூன் என்பது மெய் முற்கூறினமையின் இதுவும் இதற்கு உதாரண மெனப்படும்.
1144,இஃது இன்னதன்றி இங்ஙனம் மயங்கக் கூறல்வேண்டும்.
1145,"பொருண்மைத்தாகி வருமென்பது அஃதேல், இது மாறுகொளக்கூறலென்னுங் குற்றமாகாவோ வெனின், ஆகாது என்னை?"
1146,இது முற்கூறிய பொருளை மாறுபடாமை யானும் நிறுத்தமுறை தலைதடுமாற வைக்குந் துணையாகலானு மென்பது.
1147,ஒப்பக்கூறல் ஒன்று கூறுங்கால் இருபொருட் குறித்த தென்று இரட்டுறச்செய்தல்.
1148,"அது, இன்னி னிகர மாவி னிறுதி முன்னர்க் கெடுத லுரித்து மாகும் தொல்எழுத்புண என்றாற்போல்வன."
1149,உடம்பொடுபுணர்த்துச் சொல்லுவன அதற்கு இன மெனப்படும்.
1150,விதியல்லாதது விதிபோல மற்றொரு வழிச் சேறலின்.
1151,இவைதாங் கூறுவலென்று புகுந்த வற்றுள்ளும் ஒரு பொருளானவற்றை வரைந்து கொண்டமையின் அவற்றுள் விரியெனப்பட்டன.
1152,"இனி, மீயென மரீஇய விடம்வரை கிளவியும் தொல்எழுத்உயிர் என்புழி மேலென்பது இலக்கணமென்று எடுத்தோதியதனை மரூஉவென்றமையின் அதுவும் அதன்பாற்படும்."
1153,முதனூலுட்கொண்டவாறறிந்து மற்று அதனைத்தான் இச்சொல் இன்னவாறாயிற்றென்று இலக்கணங்கூறாது உடம்படுதலின்.
1154,மற்று அதனை இனமென்பதெற்றுக்கு?
1155,முதனூலிற் பிறழாமை நூல்செய்யுமாயினென மறுக்க.
1156,"அவ்வே, இவ்வென வறிதற்கு மெய்பெறக் கிளப்ப என்பதூஉம், அவ்விளியேலா என்றதூஉம் அவ்விளியிலக்கண மென்றற் பயம் பட வந்தது."
1157,அவையும் முன்னர்ப் போய் மொழிவனவற்றை அவாவி நின்றமையி னென்பது.
1158,இவை அகப்பொருட்கும் புறப்பொருட்கும் ஓதிய இலக்கணஞ் செய்யுளுள்ளும் அவ்வாறெய்துவித்த வாறாயிற்று.
1159,முடிந்தது காட்டல் சொல்லுகின்ற பொருட்கு வேண்டுவனவெல்லாஞ் சொல்லாது தொல்லாசிரியர் கூறினா ரென்று சொல்லுதல்.
1160,நுண்ணிதி னுணர்ந்தோர் கண்டவாறே தொல்எழுத்நூன் என்றாற் போல்வன அதற்கு இனமெனப்படும்.
1161,ஙஞந ஆதற்கும் இஃதொக்கும்.
1162,ஓம்படை யாணையிற் கிளந்தவற் றியலாற் பாங்குற வுணர்த லென்மனார் புலவர் தொல்சொல்உரிச் என்றாற் போல்வன அதற்கு இனமெனப்படும்.
1163,இதனை ஏற்புழிக் கோடலெனவும் ஒருபுடைச் சேறலெனவுஞ் சொல்லுப.
1164,"உருவென மொழியினும் தொல்சொல்கிளவி என்றலும், இதன திதுவிற்று தொல்சொல்வேற்ம என்றலும் போல்வன அதற்கு இனமெனப்படும்."
1165,மறுதலைசிதைத்துத் தன்றுணிபுரைத்தல்ஒரு பொருளினை ஒருவன் வேறுபடக்கொள்வதோர் உணர்வு தோன்றியக்கால் அவ் வேறுபாட்டினை மாற்றித் தான் துணிந்தவாறு அவற்கும் அறிவுறுத்தல்.
1166,இது மறுதலை சிதைத்தலுடைமையின் வாளாது தன்கோட் கூறலின் அடங்காதாயிற்று.
1167,அளபிற் கோட லந்தணர் மறைத்து தொல்எழுத்பிறப் என்பது அதற்கு இனமெனப்படும்.
1168,அவர் மதம் பற்றி இவர் கொள்வதொரு பயனின்றாகலி னென்பது.
1169,"இறந்தது காத்தலோடு இதனிடை வேற்றுமையென்னை யெனின், இறந்ததென்பது தான் துணிந்து சொல்லப்பட்ட பொருளாகல் வேண்டும்."
1170,முழுதுணர்ந்தாற் கல்லது பழுதறச் சொல்லலாகாமையின் அஃது அவையடக்கியல் போல்வதோர் உத்தியெனக் கொள்க.
1171,அதனைத் தான் உணர்ந்து.
1172,கடிசொ லில்லைக் காலத்துப் படினே தொல்சொல்எச் என்று கூறவே முற்கூறிய பொருளினை வற்புறுத்தலாம்.
1173,அது வென்பது.
1174,இங்ஙனந் திரிபுபடுதல் அறிந்தே கூறுதலானும் எதிர் பொருளாகலானும் இஃதறியாது உடம்படுதலினடங்காதாயிற்று.
1175,எச்சவியலுட் கூறிய பொருள் அகத்தோத்துக் கூறிய பொருளோடு ஒப்பக் கூறுதலும் அதன்பாற்படும்.
1176,பெயர்வினைக்கு ஓதிய இலக்கணம் ஒழிந்த சொற்குஞ் செவ்வானஞ் செல்லுமென்று கோடல் அதற்கு இனமெனப் படும் பிறவும் அன்ன.
1177,"சொல்லிய அல்ல பிற அவண் வருமாறும், அவை சொல்லியவகையாற் சுருங்க நாடி இனத்திற் சேர்த்துமாறும் மேற் காட்டப்பட்டன."
1178,வரம்புதமக் கின்மையின் என்பது எதிர்பொரு ளுணர்த்தலும் அறியாதுடன்படலுமாம்.
1179,ஓம்படை யாணை என்பது ஆணை கூறலாம்.
1180,மரபுநிலை திரியா மாட்சிய வாகி யுரைபடு நூறா மிருவகை நிலைய தொல்மர.
1181,என்பது முதலாக இத்துணையும் வழக்கு நூலிலக்கணங் கூறினான்.
1182,இனி உத்திவகையும் அவ்வாறே இன்றியமையாதனவெனப் படும்.
1183,"இனி, அவற்றை இத்துணையென வரையறாக்கால் எத் துணையும் பலவாகி இகந்தோடுதலும், வழிநூன் முதனூல் வழித்தன்றாகலும் படும்."
1184,முப்பத்து மூன்றெழுத் தென்றானாயினும் அப்பெற்றித்தன்றி அறுபத்தாறாகக் கொள்ளவைத்தானென்று உத்திகூறுதலும் உடம்படுவானாதல் செல்லுமென மறுக்க.
1185,உரைக்குங் காண்டிகைக்கும் இவற்றுள்ளும் ஏற்பன அறிந்து கொள்க.
1186,தந்திர மெனினும் நூலெனினும் ஒக்கும்.
1187,உத்தியென்பது வடமொழிச் சிதைவு.
1188,அது சூத்திரத்திற்கிடப்பதோர் பொருள் வேறுபாடு காட்டுவது என விளக்குவர் இளம்பூரணர்.
1189,உத்தியினை நூற் புணர்ப்பு என வழங்குதலும் உண்டு.
1190,உத்தி இன்ன தென்பதனை விளக்கும் முறையில் அமைந்தது.
1191,நூற்பொருள் வழக்கொடு வாய்ப்பக்காட்டி ஏற்புழி யறிந்திதற் சிவ்வகை யாமெனத் தரும்வகை செலுத்துதல் தந்திரவுத்தி நன்னூல்பாயிரம் சூத் எனவரும் நூற்பாவாகும்.
1192,எல்லா நூற்கும் ஆவதோர் இலக்கணம் உணர்த்துவதாக அமைந்தது.
1193,இதன்கண் முப்பத்திருவகையுத்தி எனத்தொகுத்துரைக்கப்பட்ட உத்திகளை விரித்துக் கூறித் தொல்காப்பியத்தின் மூன்றதிகாரங் கட்கும் வேண்டும் புறனடையுங் கூறுவது.
1194,இதற்கு இளம்பூரணரும் பேராசிரியரும் சில விடங்களில் வெவ் வேறு பாடங்கொண்டு உரை வரைந்துள்ளனர்.
1195,காட்சி யுத்தி என்று இவற்றைக் கூறியவதனான் நூலுட் காணப்படும்.
1196,"ஐந்து குற்றத்தோடும் கூறியது கூறல், மாறுகொளக் கூறல், மிகைப்படக் கூறல்."
1197,எனவே அங்ஙனம் ஒண்மையுடையதாதலே உத்தி என்பது தானே விளங்கும்.
1198,செவ்வனஞ் சொல்லாத தந்திரவுத்தி வகையும் அவ்வாறே ஒண்மையுடையவாம் என்பது இச்சூத்திரத்தின் கருத்தாகும்.
1199,எனவே செவ்வனஞ் செய்தலே உத்தி எனவும் நுதலியதறிதல் முதலாக இங்குச் சொல்லப்பட்டவை உத்தி வகையெனவும் கொள்வர் பேராசிரியர்.
1200,இவ்வுத்திவகை பற்றி இளம்பூரணரும் பேராசிரியரும் கொண்ட பாடங்கள் உத்திவகையின் பெயர்களிற் சில மாற்றத்தைக் குறிப்பனவாகும்.
1201,வந்தது கொண்டு வாராதது முடித்தல் என இளம் பூரணரும் வாராததுணர்த்தல் எனப் பேராசிரியரும் பாடங் கொண்டனர்.
1202,தன்கோட் கூறல் உடம்பொடு புணர்த்தல் என இளம்பூரணரும் தன்கோட்கூறல் முறைபிழைமை எனப் பேராசிரியரும் பாடங் கொண்டனர்.
1203,"மொழியாததனை முட்டின்றி முடித்தலாவது, எடுத் தோதாத பொருளை முட்டுப்படாமல் உரையினான் முடித்தல்."
1204,இதனை உரையிற்கோடல் என்ப என்பர் இளம்பூரணர்.
1205,வாராததனான் வந்தது முடித்தல் வந்தது கொண்டு வாராதது முடித்தல் என்னும் உத்திகள் சொல்லமைப்பில் நன்னூலில் இடம் பெறவில்லை.
1206,முந்துமொழிந்ததன் தலை தடுமாற்றம் என்பதனைத் தலைதடுமாற்றந் தந்து புணர்ந்துரைத்தல் என்பதோர் உத்தி என்பர் காரிகை யுரையாசிரியர்.
1207,ஒருதலைமொழியாவது ஏகாக்கரமென்னும் வடமொழிப் பொருண்மை.
1208,அஃதாவது சூத்திரத்துக்குப் பொருள் கவர்த்துத் தோன்றின் அதனுள் ஒன்றினைத் துணந்து கூறல் என்பர்.
1209,இளம் பூரணர்.
1210,ஒரு தலை மொழிதல் என்பதனை நன்னூலில் வரும் ஒருதலை துணிதல் என்னும் உத்தியாகக் கொள்ளலாம்.
1211,தன் கோட் கூறல் உடம்பொடுபுணர்த்தல் என்பது இளம்பூரணர் கொண்ட பாடம்.
1212,நன்னூலிலும் இவ்வாறே காணப்படுகிறது.
1213,தன்கோட் கூறல் முறைபிறழாமை எனப் பாடங் கொள்வர் பேராசிரியர்.
1214,", ."
1215,இறந்தது காத்தல் எதிரது போற்றல் என்னும் இரண்டும் யாப்பருங்கலவிருத்தியிலும் நன்னூலிலும் இறந்தது விலக்கல் எதிரது போற்றல் என ஆளப்பெற்றன.
1216,காத்தல் என்றது குற்றமே காக்க திருக்குறள் என்புழிப்போல விலக்குதல் என்ற பொருளில் ஆளப்பெற்றது.
1217,மொழிவாம் என்றல் என்பது இவ்விருநூல்களிலும் உரைத்தும் என்றல் எனக் குறிக்கப் பெற்றது.
1218,"கூறிற்றென்றல் என்பது, நன்னூலில் உரைத்தாம் என்றல் எனக் குறிக்கப்பெற்றது."
1219,தான் குறியிடுதல் என்பது யாப்பருங்கலவிருத்தியிலும் நன்னூலிலும் தன் குறி வழக்கம் மிகவெடுத்துரைத்தல் எனக் காணப்படுகிறது.
1220,ஆணை கூறல் என்பது யாப்பருங்கல விருத்தியிலும் நன்னூலிலும் காணப்பட்வில்லை.
1221,பல்பொருட்கேற்பின் நல்லது கோடல் இதனை ஏற்புழிக்கோடல் எனவும் ஒருபுடைச் சேறல் எனவும் சொல்லுப என்பர் பேராசிரியர்.
1222,எடுத்த மொழியின் எய்தவைத்தல் என்றுநன்னூலில் வரும் உத்தி இங்குக் கருதத்தக்கது.
1223,தொகுத்த மொழியான் வகுத்தனர் கோடல் சொல்லின் முடிவின் அப்பொருள் முடித்தல் நன்னூல் என்பதும் அது என்பர் இளம்பூரணர்.
1224,மறுதலை சிதைத்துத் தன்றுணிபுரைத்தல் என்பது யாப்பருங்கலவிருத்தியிலும் நன்னூலிலும் இடம்பெறவில்லை.
1225,", ."
1226,"பொருளிடையிடுதல் என்பது ஒரு பொருளை யோதிய வழி, அதற்கினமாகிய பொருளைச் சேரக் கூறாது இடையீடுபடக் கூறுதல் என்பர் இளம்பூரணர்."
1227,நன்னூலிலுள்ள முன்மொழிந்து கோடல் பின்னது நிறுத்தல் என்னும் இரண்டு உத்திகளும் இதன்கண் அடங்கும்.
1228,எதிர்பொருளுணர்த்தல் என்பது நன்னூலில் வரும் எதிரது போற்றல் என்ற உத்தியிலோ அல்லது முடிவிடங் கூறல் என்ற உத்தியிலோ அடங்கும்.
