Line Number,Sentence
595,"இவ்வாறு இவர் கருதுவதற்குக் காரணம், உரையாசிரியர் இவர் சங்ககாலத்திற்கு மிக மிகப் பிற்பட்டவர் கூறும் செய்தியே."
596,"அதாவது, தொன்மை என்பது உரை விராய் பழைமையாகிய கதைப்பொருளாகச் செய்யப்படுவது என்றவாறு."
597,அவை பெருந்தேவனாராற் பாடப்பட்ட பாரதமும் தகடூர் யாத்திரையும் போல்வன என்று பேராசிரியர் என்னும் உரையாசிரியர் தொல்.
598,செய்யுளியல்.
599,"தொன்மைதானே, உரையொடு புணர்ந்த பழைமை மேற்றே என்னும் சூத்திர உரை கூறுகிறார்."
600,இவ்வுரையாசிரியர் கூற்றை ஆதாராமாகக் கொண்டு தகடூர் யாத்திரை பிற்காலத்து எழுதப்பட்ட பழைய கதை என்று கூறுகிறார்.
601,என்னை?
602,"இது தகடூர் யாத்திரை சரித்திர நிகழ்ச்சி பற்றிய நூலாயினும், அந்நிகழ்ச்சி நடைபெற்ற காலத்துத்தானே இயற்றப்பெற்றதன்று."
603,மிகப் பிற்பட்ட காலத்திலே இது தோன்றியதெனக் கொள்ளல் வேண்டும்.
604,"ஏனென்றால், இதனைப் பழையவாகிய கதை பொருளாகச் செய்யப்படுகின்ற தொன்மை என்பதற்கு இலக்கியமாகப் பேராசிரியர் காட்டுகின்றனர் என்று ராவ்சாகிப் திரு."
605,எஸ் வையாபுரிப் பிள்ளை அவர்கள் புறத்திரட்டு நூன்முகத்தில் பக்கம் கூறுகிறார்.
606,"தகடூர் யாத்திரை என்னும் நூலில், நமக்கு இப்போது தெரிகிற வரையில், அரிசில் கிழாரும் பொன்முடியாரும் பாடிய பாடல்கள் காணப்படுகின்றன."
607,இவர்களுடைய செய்யுள்கள் தகடூர் யாத்திரையில் காணப்படுகின்றன.
608,"இங்ஙனமாக, இந்நூல் மிகப் பிற்பட்ட காலத்து நூல் என்று எவ்வாறு கூறமுடியும்?"
609,உரையாசிரியர் கூறுவதில் தவறும் இருக்கக்கூடும்.
610,நூலினுள்ளே அகச்சான்று கிடைக்கிறபோது அதனையே ஆதாரமாகக் கொள்ளவேண்டும்.
611,நமது நாட்டில் வழங்கும் நாட்டுப் பாடல்களே இதற்குச் சான்றாகும்.
612,அவை நிகழ்ந்த மிகப் பிற்பட்ட காலத்தில் தோன்றியவை அல்ல.
613,"எனவே, தமிழகம் முழுவதும் உள்ள மக்களின் மனத்தைக் கவர்ந்ததும், உணர்ச்சியூட்டியதும் ஆகிய தகடூர்ப் போர் இது."
614,"அது போன்றே, தகடூர் யாத்திரை என்னும் நூல், அப்போர் நிகழ்ந்த காலத்திலேயே கி.பி."
615,ஆம் நூற்றாண்டிலேயே எழுதப்பட்ட நூல் என்பது அதன் அகச்சான்றினால் தெரிகின்றது.
616,"அக்காலத்து வழக்கப்படி, தகடூர்ப் போரில் கலந்து கொண்ட வீரர்களின் வீரச்செயல்களையும் ஏனைய செயல்களையும் புலவர்கள் செய்யுளாகப் பாடினார்கள்."
617,"தமிழ்நாட்டிலே, தகடூர் யாத்திரை நூல் பல நூற்றாண்டுகளாக வழங்கி வந்தது."
618,"சென்ற ஆம் நூற்றாண்டுவரையில் ஏட்டுச்சுவடியாக இருந்த தகடூர் யாத்திரை, அந்த நூற்றாண்டின் இறுதியிலேயே மறைந்து விட்டது."
619,சங்க நூல்களை அச்சிடுவதற்காக ஏட்டுச்சுவடிகளைத் தேடிய டாக்டர் உ.
620,வே.
621,யாரிடமிருந்து வாங்கியது என்று குறிப்பிடவில்லை.
622,தொல்காப்பிய உரையில் தகடூர் யாத்திரை என்ற பெயர் வருகிறது.
623,இந்நூலின் மறைவினால் தமிழர் வரலாற்றின் ஒரு பகுதியே மறைந்துபோய்விட்டது.
624,இப்போது நமக்கு இந்நூலிலிருந்து கிடைத் துள்ள செய்யுள்கள் நாற்பத்தெட்டு.
625,அவற்றைக் கீழே தருகிறேன்.
626,முதல் நாற்பத்துநான்கு செய்யுள்கள் புறத்திரட்டில் தொகுக்கப்பட்டவை.
627,உண்டியின் முந்தா னுடனுண்டான்தண்டேறல் மண்டி வழங்கி வழீஇயதற்கோ கொண்டி மறவர் மறலிக் குயிர்நேர்ந்தார் மன்னர்க் குறவிலர் கண்ணோடா ரோர்ந்து.
628,நமையுள்ளு நல்லவை யெய்தார் பகைநலிய ...
629,..
630,...
631,..
632,...
633,..
634,...
635,..
636,...
637,..
638,...
639,..
640,...
641,..
642,...
643,..
644,வேற்றுக் களத்தி லொருவர்த மாறாகச் சென்றா லொருவர்மேற் புண்ணும் படுக்கலான் றான்படான் போந்தாரக் கண்ணும் படுங்கொல் கவன்று.
645,இவர் காட்டிய இச்செய்யுள் புறத்திரட்டில் காணப்படவில்லை.
646,"ஆனால், அவர் இச்செய்யுள்கள் தகடூர் யாத்திரையைச் சேர்ந்தன என்று குறிக்கவில்லை."
647,"எனினும், இவை தகடூர் யாத்திரையைச் சேர்ந்தன என்று ஐயமறத் துணியலாம்."
648,இது பொன்முடியார் தகடூரின் தன்மை கூறியது. .
649,"பெரும்பொருள் விளக்கம் இப்பெயருள்ள ஒரு நூல் இருந்ததென்பதைப் புறத்திரட்டு என்னும் தொகை நூலிலிருந்தும், நச்சினார்க்கினியர் எழுதிய தொல்காப்பிய பொருள்."
650,புறத்திணையியல் உரையிலிருந்தும் அறிகிறோம்.
651,"பெரும்பொருள் விளக்கத்தின் ஆசிரியர் பெயர், அவர் இருந்த காலம், நூலியற்றிய காரணம் முதலிய செய்திகள் ஒன்றும் தெரிய வில்லை."
652,கீழ்க்காணும் பெரும்பொருள் விளக்கத்துச் செய்யுள்களைப் புறத்திரட்டில் உள்ளபடியே தருகிறேன்.
653,இச்செய்யுள்களில் பலவற்றை நச்சினார்க்கினியரும் தமது உரையில் மேற்கோள் காட்டியுள்ளார்.
654,புறத்திரட்டுச் செய்யுள்களுக்குள்ளும் நச்சினார்க்கினியர் செய்யுள் களுக்கும் பாடபேதங்கள் உள்ளன.
655,பாடபேதங்களை இங்குக் காட்டவில்லை.
656,வென்று களங்கொண்ட வேந்தன்றே!
657,கூடல் சங்கமத்துப் பரணி சோழ அரசர்கள் மேலைச்சளுக்கிய அரசர்களுடன் பலமுறை போர்செய்தார்கள்.
658,அவ்வாறு போர்செய்த சோழ அரசர்களில் வீர ராசேந்திரன் கி.
659,பி.
660,என்பவனும் ஒருவன்.
661,வீரராசேந்திரனை வீரசோழன் என்றும் கூறுவார்கள்.
662,இவன் சளுக்கியருடன் மூன்று முறை போர் செய்து வென்றான்.
663,"சளுக்கிய அரசனான ஆகவமல்லனும் அவனுடைய படைத்தலைவர்களும், கடல்போன்ற சேனையும் வீரராசேந்திரனால் முறியடிக்கப்பட்டனர்."
664,"வீரராசேந்திரன் காலத்தில் இருந்த புத்தமித்திரனார் என்னும் புலவர், அவ்வரசன் பெயரினால் வீரசோழியம் என்னும் இலக்கண நூலை இயற்றினார்."
665,"வீரசோழியத்திற்கு உரை எழுதிய பெருந்தேவனார், தமது உரையில் இரண்டு வெண்பாக்களை மேற்கோள் காட்டுகிறார்."
666,அவ் வெண்பாக்களில் சோழன் பெற்ற கூடல சங்கமத்து வெற்றி கூறப்படுகிறது.
667,என்னை?
668,...
669,...
670,...
671,...
672,கூடல சங்கமத்துக் கொள்ளுந் தனிப்பரணிக் கெண்ணிறந்த துங்கமத யானை துணித்தோனும். என்று விக்கிரம சோழன் உலாவும்.
673,பாட வாரிய பரணி பகட்டணிவீழ் கூடலார் சங்கமத்துக் கொண்டகோன் என்று இராசராச சோழன் உலாவும் கூறுவது காண்க.
674,இந்தப் பரணி இப்போது கிடைக்கவில்லை.
675,இதைப் பாடிய புலவர் பெயர் முதலியனவும் தெரியவில்லை.
676,.
677,கொப்பம் என்னும் ஊர்.
678,கிருஷ்ணை ஆற்றங் கரையில் இருந்தது.
679,முதலாம் இராசேந்திர சோழன் கி.பி.
680,.
681,மேலச் சளுக்கிய அரசனான ஆகவமல்லனுடன் கொப்பத்தில் பெரும் போர் செய்து வென்றான்.
682,"இவனுடைய சேனைக்குப் படைத் தலைவனாக இருந்தவன், இவனுடைய மகனும் இளவரசனுமான இராசாதிராசன் என்பவன்."
683,"இதனை, ..."
684,...
685,...
686,கொலையானை பப்பத் தொருபசிப்பேய் பெற்ற வொருபரணிக் கொப்பத் தொருகளிற்றாற் கொண்டகோன் என்னும் கண்ணியினால் அறியலாம்.
687,இராசேந்திர சோழன்மேல் பாடப் பட்ட கொப்பத்துப் பரணி இப்போது கிடைக்க வில்லை.
688,இந்நூலை இயற்றினவர் பெயர் முதலியனவும் தெரியவில்லை.
689,.
690,தென்றமிழ் தெய்வப் பரணி இப்பெயருள்ள பரணி நூலைத் தக்கயாகப் பரணி கூறுகிறது.
691,இதனால் இப் பெயருள்ள பரணி நூல் ஒன்றிருந்த தென்பது தெரிகிறது.
692,"இத் தாழிசைக்கு உரை எழுதிய பழைய உரையாசிரியர், இவ்வாறு விளக்கங் கூறுகிறார் இப்பரணி பாடினார் ஒட்டச்கூத்தரான கவிச்சக்கரவர்த்திகள்."
693,இந்தப் பரணியின் பெயர் தெரியவில்லை.
694,கவிச்சக்கரவர்த்தி ஒட்டக்கூத்தர் விக்கிரமசோழன்மீது விக்கிரம சோழன் உலா என்னும் நூலை இயற்றியிருப்பதும்.
695,அவர் அவ்வரச னுடைய அவைக்களப் புலவராக இருந்தனர் என்பதும் கருதத்தக்கன.
696,ஒட்டக் கூத்தர் இயற்றிய தென்தமிழ்த் தெய்வப் பரணி கிடைக்கவில்லை.
697,.
698,இராசாதிராசன் கி.பி.
699,முதல் வரையில் அரசாண்டான் என்பர்.
700,"இவன் முடிசூடிய பின்னர், மேலைச்சளுக்கிய அரசனுடன் மூன்று முறை போர்செய்தான்."
701,இரண்டு தடவை போர் வென்றான்.
702,"மூன்றாவது முறை, போர்க்களத்தில் யானைமேலிருந்த படியே உயிர்விட்டான்."
703,"ஆகவே, கல்யாணபுரமும் கொல்லாபுரமும் எறிந்து யானைமேற் றுஞ்சின உடையார் விசய ராசேந்திர தேவர் என்று புகழப்படுகிறான்."
704,"மூன்றாவது முறை இவ்வரசன் போரில் இறந்த போதிலும், வெற்றி பெற்றவர் சோழரே."
705,இப்பரணியைத் தமிட் பரணி தமிழ்ப் பரணி என்று சாசனம் கூறுகிறது.
706,இப்பரணியின் உண்மைப் பெயர் இதுதானா அல்லது வேறா என்பது தெரியவில்லை.
707,இந்தப் பரணியைப் பாடியவர் யார் என்பதும் தெரியவில்லை.
708,"அந்தச் சாசனத்தில், பரணியிரண்டும் ஒருவிசை கைக்கொண்டு என்று கூறப்படுகிறது. இந்தப் பரணிகளின் பெயர் கூறப்படவில்லை."
709,அப்பரணிகளைப் பாடியவர் பெயரும் தெரியவில்லை.
710,"இதனால், சில பரணி நூல்கள் பண்டைக் காலத்தில் இருந்து பின்னர் அழிந்துவிட்டன என்பது தெரிகின்றது."
711,.
712,இந்தச் சாசனம்.
713,"புதுக்கோட்டை, திருமய்யம் தாலூகா, ராங்கியம் என்னும் ஊரில் உள்ள பூமீசுவரர் கோவிலின் தென்புறச் சுவரில் இருக்கிறது."
714,இந்தச் சாசனத்தின் வாசகம் இது.
715,வெள்ள நாயக்கர் கி.பி.
716,"ஆம் நூற்றாண்டின் முற்பகுதியில் இருந்தவர் என்று தெரிகிறபடியால், இந்நூல் அக்காலத்தில் இயற்றப்பட்டதாதல் வேண்டும்."
717,இந்நூல் இப்போது கிடைக்கவில்லை.
718,.
719,இந்தச் சாசனத்தின் வாசகம்.
720,வருமாறு ஸ்வஸ்தி ஸ்ரீ.
721,இதுக்குப் பொன்னமராபதிப் பெருமான் திருநாமத்தும் இயல் விண்ணப்பஞ் செய்வாராகவும்.
722,தான் வரி எப்பேற்பட்டனவும் இறுக்கக் கடவதல்லவாக.
723,இப்படி சம்மதித்துக் கல் வெட்டிக் குடுத்தோம்.
724,பன்மாஹேஸ்வரர் ரக்ஷை.
725,அவனி நாராயண தேவரும் பொன்னமராபதி முதல்லாகிய முதலிகளோம்.
726,வடகூறு இவர்களுக்கு சந்திராதித்தவரை செல்வதாகவும்.
727,திருநாளுங் ...
728,...
729,செய்விப்பார்.
730,"மஹேஸ்வர ராக்ஷை. இந்தச் சாசனத்தில் கூறப்படுகிற சோணாடு வழங்கிய சுந்தர பாண்டியதேவர் என்னும் பாண்டியன், கி.பி."
731,ஆவது நூற்றாண்டின் முற்பகுதியில் அரசாண்டவன்.
732,இந்தப் பாண்டியனுடைய படையின் ஒரு பகுதியைச் சேர்ந்தவர் மறமாணிக்கர் என்னும் பெயரினர் இவர்களுடைய வீரத்தையும் வெற்றியையும் கூறுவது.
733,பேர்வஞ்சி என்னும் நூல்.
734,பேர்வஞ்சி.
735,எனினும் பெருவஞ்சி எனினும் ஒக்கும்.
736,இவர் இயற்றிய பேர்வஞ்சியைப் பற்றி வேறு செய்திகள் தெரிய வில்லை.
737,இந்நூல் சரித்திரச் செய்திகள் சிலவற்றை அறிவதற்குத் துணையாயிருக்கும் இந்நூல் கிடைக்கவில்லை.
738,இலக்கிய நூல்கள் .
739,காவியம் .
740,"பழைய இராமாயணம் அகவற்பாவினால் இயற்றப்பட்ட பழைய இராமயணம் ஒன்று இருந்ததென்பது, ஆசிரியமாலை என்னும் தொகை நூலிலிருந்து தெரிகிறது."
741,"ஆசிரியமாலை, ஆசிரியப் பாக்களினால் ஆன நூல்களிலிருந்து சில பாடல்கள் தொகுக்கப்பட்ட செய்யுளைக் கொண்ட நூல்."
742,ஆசிரிய மாலையும் இறந்துபோன நூலே.
743,அதிலிருந்து சில செய்யுள்களைப் புறத்திரட்டு என்னும் தொகைநூலில் சேர்த்துள்ளனர்.
744,ஆசிரியமாலையில் தொகுக்கப்பட்டிருந்த பழைய இராமாயணச் செய்யுள்களில் ஐந்து செய்யுள்கள் புறத்திரட்டில் சேர்க்கப்பட்டுள்ளன.
745,ஆம் சூத்திரஉரையில் நச்சினார் கினியராலும் மேற்கோள் காட்டப்பட்டுள்ளது.
746,பொருள்.
747,"புறத்திணை, கட்டில் நீத்த பால் என்பதன் உரையில் மேற்கோள் காட்டியுள்ளார்."
748,.
749,ஜைன இராமாயணம் தமிழில் செய்யுள் நடையில் இயற்றப்பட்ட ஜைன இராமாயண நூல் ஒன்று இருந்தது.
750,அந்த நூல் இப்போது இறந்துவிட்டது.
751,பிறந்து தம்முள் போர்செய்த வரலாற்றைக் கூறுவது ஜைன இராமாயணமாகும்.
752,வால்மீகி இராமாயணத்துக்கும் ஜைன இராமாயணத்துக்கும் கதைப் போக்கில் சில வேறுபாடுகள் உண்டு.
753,அவற்றில் முக்கிய மானவை இராமனை ஒருவரும் ஆண்டு காட்டுக்கு அனுப்பவில்லை தசரதன் இறந்துவிடவில்லை.
754,இராமனும் சீதையும் தாங்களாகவே இயற்கைக் காட்சியைக் காணச் சித்திரகூடம் என்னும் காட்டில் சென்றிருந்தபோது இராவணன் சீதையைச் சிறைப்படுத்தினான்.
755,சூர்ப்பனகை என்பவள் இராவணனுடைய தங்கையல்லள் இராவணனுடைய பணிப் பெண்களில் ஒருத்தி.
756,சூர்ப்பனகையை இலக்குமணன் மூக்கை அரிய வில்லை.
757,இராமன் வாலியை மறைந்து கொல்லவில்லை.
758,"வாலி, போர்க் களத்தில் இலக்குமணனாலேயே கொல்லப்பட்டான்."
759,இவ்வாறு ஜைன இராமா யணம் கூறுகிறது.
760,"இனி, முநிஸுவ்ரத சுவாமி புராணத்தில் கூறப்படுகிற ஜைன இராமாயணத்தின் சில விஷயங்களை இங்கு முக்கியமாகத் தெரிந்து கொள்ளவேண்டும்."
761,அவை என்னவென்றால் இரத்தினபுரத்து அரசன் பிரஜாபதி அரசி குணகாந்தை.
