Line Number,Sentence
496,வாட்டங் கள்தீர்த்த தானைத் தலைவா!,False
497,சேனைப் புலவா!,False
498,தமிழர் மறையின் மலையே!,False
499,மறைமலை அடிகளின் வாரிசான மாணவர் பலர் உண்டு.,False
500,அடிகள் நாடு முற்றும் பவனி வந்து ஈசல் போல முளைத்த நாசகாரக் கும்பலைச் சொல் வன்மையால் அழித்தார்.,False
501,ஆணிப் பொன்னும் நாணிப் போகும் அழகுத் திருமேனி அன்னச் சோறே!,False
502,கன்னல் சாறே!,False
503,ஆளும் பஞ்சத்தில் தேனில் நாற்றே!,False
504,வானில் ஊற்றே!,False
505,தமிழர் மறையின் மலையே!,False
506,வெள்ளரி அடிகள் வெள்ளரிக்காய் போல இனிமையானவர்.,False
507,வெண்மையான சிங்கம் போல அரி எதிரிகளை அழிப்பவர்.,False
508,பித்துக் கொண்ட கொத்துத் தெங்கே!,False
509,பிஞ்சு வெள்ளரியே!,False
510,பேசும் வைகை!,False
511,பாடும் பொன்னி!,False
512,பெருகும் கொள்ளிடமே!,False
513,தத்துச் செல்லாப் பத்துப் பாட்டே!,False
514,தாலோ தாலேலோ!,False
515,தமிழர் மறையின் மலையே!,False
516,தாலோ தாலேலோ!,False
517,ஆடிக் காற்றே!,False
518,நாடி நரம்பே!,False
519,ஐப்பசி மாமழையே!,False
520,பெண்ணின் பெருமை பேசும் திரு.வி.,False
521,கல்யா ணப்பெரியோன் பேணிப் பேசிப் பாடிப் பரவும் பேழைச் செம்பொன்னே!,False
522,தண்ணீர்ப் பந்தல்!,False
523,கண்ணீர்க் கோவில்!,False
524,தமிழர் மறையின் மலையே!,False
525,அடிகளின் நிறம் வெள்ளை ஆகும்.,False
526,பெருகும் அடிகளின் கருத்து எங்கும் பெருகிப் பரவியது.,False
527,திருவையாற்று இறைவனிடம் அடிகளுக்கு ஈடுபாடு மிகுதி.,False
528,அடிகளிடம் திரு.வி.க.அவர்கட்கு ஈடுபாடு மிகுதி.,False
529,பெய்யென் றாலே பெய்யும் மழையே!,False
530,பேசும் கற்பகமே!,False
531,பிரள யத்தில் புரளும் மாலே!,False
532,பேசா அற்புமே!,False
533,நெய்யும் தறியே!,False
534,உய்யும் நெறியே!,False
535,நீற்றின் நாயகமே!,False
536,நெற்றிக் கண்ணன் பற்றிக் கொண்ட வெற்றிச் சிறுபறையே!,False
537,கையில் கோலும் மெய்யில் நீறும் காட்சி அளித்தோனே!,False
538,கடிதம் கொண்டு தமிழில் வரைந்த கன்னிக் கோகிலமே!,False
539,தையின் குளமே!,False
540,பையின் வளமே!,False
541,தமிழர் மறையின் மலையே!,False
542,தாலோ தாலேலோ!,False
543,அடிகள் எப்பொழுதும் நீறு பூசியிருப்பார்.,False
544,நெற்றிக் கண்ணன் சிவன்.,False
545,அடிகள் மறைந்து சிவன் கையில் சிறுபறை ஆனாரோ?,False
546,அடிகள் எழுதிய நூல் கோகிலாம்பாள் கடிதங்கள் என்பதாகும்.,False
547,புகழ்கோடி தேங்கியவா!,False
548,புதையலாய் வந்த செல்வா!,False
549,ஆச்சிமார் தாலாட்டே!,False
550,புன்னகையால் வென்ற கண்ணே!,False
551,சன்மார்க்க நெறிபேசும் சங்கத்தின் வழிகாட்டி!,False
552,சப்பாணி கொட்டி அருளே!,False
553,சத்தான மொழிபேசி வித்தான மறைமலையே!,False
554,சப்பாணி கொட்டி அருளே!,False
555,புதினம் நாவல்.,False
556,ஆச்சிமார் செட்டிநாட்டுப் பெண்கள்.,False
557,அடிகளின் மேனிநிறம் தங்கமாகும்.,False
558,சீதனமாய் வந்த செல்வா!,False
559,சுங்கத்து வரிநீக்கும் சோழற்குப் பின்வந்து சோதனை தீர்த்த மன்னா!,False
560,சுவைதேங்கு தமிழுக்குச் சுமைதாங்கி ஆனவனே!,False
561,சொல்மாரி பெய்த வேதா!,False
562,சங்கத்துப் புலவோராம் சிங்கத்தில் ஒருவன்நீ சப்பாணி கொட்டி அருளே!,False
563,சத்தான மொழிபேசி வித்தான மறைமலையே!,False
564,சப்பாணி கொட்டி அருளே!,False
565,ஈன்றோர்கள் கீர்த்திக்கும் இருந்தோர்கள் சீர்த்திக்கும் இம்மையில் பணிகள் செய்தே ஈசனைக் கண்டவா!,False
566,தாசரைக் கொண்டவா இயலிசைக் கூத்து மன்னா!,False
567,அவன் சுங்கவரி நீக்கியதால் சோதனை நீங்கியது.,False
568,அதுபோல் மறைமலை அடிகளின் தொண்டால் தமிழுக்கு ஏற்பட்ட சோதனை நீங்கியது.,False
569,சான்றோர்கள் உலகத்தில் ஆன்றோனாய் வந்தவா!,False
570,சப்பாணி கொட்டி அருளே!,False
571,சத்தான மொழிபேசி வித்தான மறைமலையே!,False
572,சப்பாணி கொட்டி அருளே!,False
573,சதை வளர்க்கும் உலகத்தில் விதைவளர்க்க வந்தவனே!,False
574,சப்பாணி கொட்டி அருளே!,False
575,சத்தான மொழிபேசி வித்தான மறைமலையே!,False
576,சப்பாணி கொட்டி அருளே!,False
577,இறைவன் தானாகத் தோன்றியவன்.,False
578,அவனது பாதத்தில் படைக்கப் பெற்றுள்ள தமிழைத் தன் தலையில் ஏந்தி பணிபுரிந்தவர் அடிகள்.,False
579,தமிழர் தம் வீர உணர்வையும் மொழி உணர்வையும் தட்டி எழுப்பியவர் அடிகள்.,False
580,வடமொழியும் கற்ற வள்ளல்!,False
581,ஊன்றாத கோலுண்டா?,False
582,உதவாத நூலுண்டா?,False
583,உலவாத காலும் உண்டா?,False
584,உணராத உலகத்தில் ஊன்றுகோல் நூலாகி உயர்காலாய் வந்த பாலா!,False
585,சான்றோர்கள் உலகத்தில் ஆன்றோனாய் வந்தவனே!,False
586,சப்பாணி கொட்டி அருளே!,False
587,சத்தான மொழிபேசி வித்தான மறைமலையே!,False
588,சப்பாணி கொட்டி அருளே!,False
589,பஞ்சமா பாதகங்கள் கொஞ்சமா உலகத்தில்?,False
590,பரமேசன் உலகில் வந்தால் படித்தோர்கள் மத்தியிலும் நடித்தோர்கள் மத்தியிலும் படைஏந்தி வாழ வேண்டும்.,False
591,"தஞ்சமாய் வந்தோர்க்குத் தஞ்சையாய் வாழ்ந்தவர்கள் தாராளம் கெட்ட தாலே தமிழுக்கும் நீரில்லை, தகுதிக்கும் ஆளில்லை தலைமைக்கும் வேலை இல்லை.",False
592,அன்னையும் அப்பனுமாய் உள்ள தில்லை நடராசப் பெருமானை வழிபட்டதால் அடிகள் இம்மைப் புகழ் பெற்றார்.,False
593,கால் பாதம் காற்று.,False
594,புஞ்சையாய்ப் போனதெலாம் நஞ்சையாய் மாற்றிடவே புகலாகி வந்த புத்தா!,False
595,புனலாகித் தமிழர்க்கு நனவாகி வந்ததனால் போராட்டம் தீர்த்த புனிதா!,False
596,சஞ்சலங்கள் இரிந்தோட சபையோர்கள் மகிழ்ந்தாட சப்பாணி கொட்டி அருளே!,False
597,சத்தான மொழிபேசி வித்தான மறைமலையே!,False
598,சப்பாணி கொட்டி அருளே!,False
599,அக்கார வடைசலுடன் உக்காரும் பாயசமும் அல்வாவும் போல வந்தே அவைதோறும் பரிமாறி சபைதோறும் நடமாடி அமுதாகி நின்ற ஐயா!,False
600,சர்க்கரை இப் பந்தலிலே தேன்மாரி கொட்டியவா!,False
601,சப்பாணி கொட்டி அருளே!,False
602,சத்தான மொழிபேசி வித்தான மறைமலையே!,False
603,சப்பாணி கொட்டி அருளே!,False
604,தமிழர்க்குப் புத்தராகவும் புனிதராகவும் அவதரித்தவர் மறைமலை அடிகள்.,False
605,"அக்கார வடைசல், உக்காரு, பாயசம், அல்வா தமிழ்நாட்டின் இனிப்பு உணவுகள்.",False
606,வேதனைகள் தீர்த்தோனே!,False
607,வெற்றிமுர சார்த்தோனே!,False
608,வீரங்கள் ஒன்று கூடி விளையாடு முருகாகி மழையாடு புனலாகி வினையாட வந்த வீரா!,False
609,சாதகமாய் நின்றோனே!,False
610,பாதகங்கள் வென்றோனே!,False
611,சப்பாணி கொட்டி அருளே!,False
612,சத்தான மொழிபேசி வித்தான மறைமலையே!,False
613,சப்பாணி கொட்டி அருளே!,False
614,எலியாகி அறுத்தோரும் புலியாகி ஒறுத்தோரும் ஏராள மான நாட்டில் எண்ணங்கள் புரியாமல் இதயங்கள் விரியாமல் ஏதேதோ பேசி வந்தார்.,False
615,"கலிகாலம் என்றேங்கி ஒலியாவும் கேட்டார்கள் கனிவான தமிழ நாட்டார், கடைகெட்ட காலத்தில் நடைபோட்டு வந்திங்கே கலிமாற்றி விட்ட கண்ணா!",False
616,"பொய்கையாகவும், புதையலாகவும், சான்றாண்மை மிக்க சாது ஆகவும் வாழ்ந்தவர் அடிகள்.",False
617,நலிவுற்ற துறையாவும் பொலிவுற்ற மறையாகி நடமாட வைத்த தாலே நயனங்கள் மொழிகாட்டப் பயணங்கள் வழிகாட்ட நாதனாய் வந்த வேதா!,False
618,சலியாத உளம்கொண்டு மெலியாத உடல்கொண்டு சப்பாணி கொட்டி அருளே!,False
619,சத்தான மொழிபேசி வித்தான மறைமலையே!,False
620,சப்பாணி கொட்டி அருளே!,False
621,சத்தியமே வெற்றியென நித்தியமும் பற்றியவா!,False
622,சப்பாணி கொட்டி அருளே!,False
623,சத்தான மொழிபேசி வித்தான மறைமலையே!,False
624,சப்பாணி கொட்டி அருளே!,False
625,மக்களுக்குப் புரியும்படியாகப் பேசியவர் மறைமலை அடிகள்.,False
626,நடிக்காமல் உண்மையாக வாழ்ந்தவர் அடிகள்.,False
627,அவருடைய நெஞ்சம் கண்ணாடி போன்றது.,False
628,முத்தான முத்தமிழை மொத்தமாய் மொழிந்தநல் வாயாலே முத்தம் தருகவே!,False
629,மூதறிஞர் பேரவையில் சீதனமாம் மறைமலையே முழுநிலா முத்தம் தருகவே!,False
630,காலகண்டன் சிவபெருமான்.,False
631,சிவபெருமான் நாகைப்பட்டினத்துக் காரோணம் என்னும் கோயிலில் வீற்றிருக்கிறார்.,False
632,நாகையைச் சேர்ந்த காடம்பாடி எனும் கிராமத்தில் சொக்கநாத பிள்ளைக்கும் சின்னம்மைக்கும் இல் பிறந்தார்.,False
633,மறைமலை அடிகள்.,False
634,முதுகுன்றாம் கழுக்குன்றப் பெருமானால் வந்தநல் வாயாலே முத்தம் தருகவே!,False
635,மூதறிஞர் பேரவையில் சீதனமாம் மறைமலையே!,False
636,முழுநிலா முத்தம் தருகவே!,False
637,அவரது தொடர்பால் அடிகள் புகழ்பெற்றார்.,False
638,பொது மக்களுக்குப் பல சொற்பொழிவுகள் நிகழ்த்தினார்.,False
639,திருக்கழுக்குன்றப் பெருமானைத் தாய் தந்தையர் வணங்கியதால் அடிகள் பிறந்தார்.,False
640,முத்தான மந்திரம் முப்பத்து பாட்டுக்கு மூலமாய் உரைகள் தீட்டி மூலைகள் தோறுமே சித்தாந்த தீபிகை முழங்கவே முனைந்த முதல்வா!,False
641,முத்தான முத்தமிழை மொத்தமாய் மொழிந்தநல் வாயாலே முத்தம் தருகவே!,False
642,மூதறிஞர் பேரவையில் சீதனமாம் மறைமலையே!,False
643,முழுநிலா முத்தம் தருகவே!,False
644,மூர்த்தியாய் வந்துதமிழ்க் கீர்த்தியை மொழிந்தநல் வாயாலே முத்தம் தருகவே!,False
645,மூதறிஞர் பேரவையில் சீதனமாம் மறைமலையே!,False
646,முழுநிலா முத்தம் தருகவே!,False
647,சித்தாந்த தீபிகை என்னும் மாத இதழுக்கு ஆசிரியராக இருந்தார்.,False
648,பரிதிமாற் கலைஞர் எனப்படும் வி.கோ.சூ.,False
649,அவர்களுடன் அடிகள் ஆம் ஆண்டு முதல் சென்னைக் கிறித்தவக் கல்லூரியில் ஆண்டுகள் தமிழ்ப்பணி புரிந்தார்.,False
650,"ஆங்கில நூல்கள் பலவற்றையும், எடிசனின் நூல்களையும் தமிழில் மொழி பெயர்த்தார்.",False
651,முனிசொன்ன சிவஞான போதத்தைக் கற்றநல் வாயாலே முத்தம் தருகவே!,False
652,மூதறிஞர் பேரவையில் சீதனமாம் மறைமலையே முழுநிலா முத்தம் தருகவே!,False
653,"தணிகைமணி செங்கல்வராயர், ரசிகமணி டி.கே.சிதம்பரநாதர், வையாபுரிப்பிள்ளை ஆகியோர் அடிகளின் மாணவர்கள் ஆவர்.",False
654,உருவுடன் வெளிவர எழுதுகோல் தீட்டிய ஒப்பிலா ஓவி யங்கள் உலகினை ஈர்த்ததும் உன்புகழ் ஆர்த்ததும் உன்னவோ கசியும் உள்ளம்!,False
655,முருகரின் மும்மணிக் கோவையைப் பாடிய வாயினால் முத்தம் தருகவே!,False
656,மூதறிஞர் பேரவையில் சீதனமாம் மறைமலையே!,False
657,முழுநிலா முத்தம் தருகவே!,False
658,குருவாகிய நாயகர் இல் மறைந்ததால் அவர் மீது சோமசுந்தரக் காஞ்சி எனும் நூலை அடிகள் பாடினார்.,False
659,ஞானசாகரம் அறிவுக்கடல் எனும் மாத இதழை அடிகள் ஆம் ஆண்டில் தொடங்கி நிறைய எழுதினார்.,False
660,முக்கியம் தமிழெனத் திக்கெலாம் மொழிந்தநல் வாயினால் முத்தம் தருகவே!,False
661,மூதறிஞர் பேரவையில் சீதனமாம் மறைமலையே!,False
662,முழுநிலா முத்தம் தருகவே!,False
663,சிறுவனாய் ஐயொரு மூன்றெனும் ஆண்டிலே செந்தமிழ் பயில வந்து திருக்குறள்.,False
664,மூதறிஞர் பேரவையில் சீதனமாம் மறைமலையே!,False
665,முழுநிலா முத்தம் தருகவே!,False
666,அடிகள் தொடங்கிய ஞானசாகரம் மாத இதழுக்கு வ.உ.சிதம்பரனார் அவர்களும் சந்தா செலுத்தி உறுப்பினர் ஆனார்.,False
667,அடிகளின் மாணிக்கவாசகர் கால ஆராய்ச்சி எனும் நூல் புகழ்பெற்றது ஆகும்.,False
668,ஐயொரு மூன்று .,False
669,அடிகள் தமது ஆம் வயதில் தமிழ்நூல்களை மனப்பாடம் செய்யத் தொடங்கினார்.,False
670,ஆறே ஆண்டுகளில் மேற்கண்ட நூல்களை நெட்டுருச் செய்து முடித்தார்.,False
671,சித்தாந்த சிவசபைத் தலைவனே!,False
672,மூதறிஞர் பேரவையில் சீதனமாம் மறைமலையே முழுநிலா முத்தம் தருகவே!,False
673,இதற்கு நாடு முழுதும் கிளைகள் தோன்றின.,False
674,"சென்னையில் திருவருட்பிரகாச சபை, மெய்கண்ட சந்தான சபை ஆகியன கிளைகள் ஆகும்.",False
675,"நாகை, திருச்சி, மலைக்கோட்டை, தஞ்சை, தூத்துக்குடி, சிதம்பரம் ஆகிய பல ஊர்களில் கிளைகள் தோன்றின.",False
676,சிதம்பரத்தில் ஆம் ஆண்டில் அடிகளால் முதல் மாநாடு சிறப்பாக நடத்தப்பெற்றது.,False
677,கொழும்பு இராமநாதத் துரை தலைமை தாங்கினார்.,False
678,முடித்திடா உரைகளைத் தொடுத்துளம் கவர்ந்தநல் வாயினால் முத்தம் தருகவே!,False
679,மூதறிஞர் பேரவையில் சீதனமாம் மறைமலையே!,False
680,முழுநிலா முத்தம் தருகவே!,False
681,எழுதத் தொடங்கி முடிக்காத பல உரைகளை அடிகள் பேச்சில் வெளிப்படுத்தினார்.,False
682,பண்டோர் அகத்தியனைக் கொண்டோர் உருவமெனப் பைந்தமிழ் தனைப்பருக வருகவே!,False
683,பல்லா வரத்திலெழு பிள்ளாய்!,False
684,தமிழ்ஒழுகு பச்சைக் குழந்தாய் வருகவே!,False
685,சென்னை முதல் குமரி வரை அடிகள் சொற்பொழிவாற்றினார்.,False
686,பூச்செண்டாக அவர் திகழ மக்கள் அவரை வண்டாகச் சுற்றினர்.,False
687,தமிழ் பிறந்த பொதிய மலையின் ஒரு துண்டு போல மறைமலை தொண்டு செய்தார்.,False
688,அகத்தியனின் மறுபிறவியாக வந்தார்.,False
689,நெல்லைப் பொருநையிலே கல்லைக் குடைவித்த நேர்த்திமிகு குறுக்குத் துறையோ?,False
690,பற்றிப் படர்தற்குப் பொற்றேர் கொடிக்கீந்த பாரிப் பறம்பு மலையோ?,False
691,பாலைக் கலந்து தமிழ்த் தேனைக் குழைத்துதரும் பண்பு வேத மலையோ?,False
692,பற்று தமிழுக்கு முற்றில் எனக்கண்ட பச்சைக் கிளியே!,False
693,பல்லா வரத்திலெழு பிள்ளாய் தமிழ்ஒழுகு பச்சைக் குழந்தாய் வருகவே!,False
694,தமிழும் பக்தியும் இயைந்த அருணகிரியோ?,False
