Line Number,Sentence
2960,கோவை உப்பிலிபாளையத்தில் உள்ள என் இனிய நண்பர் .
2961,இலட்சுமையாநாயுடுவின் புதல்வர் திரு.
2962,"இராமசாமியின் திருமணத்தின் பொருட்டு, இன்று பகல் மணி வண்டியிற் புறப்படலானேன்."
2963,கல்லூரிக்குப் பணம் சேர்ப்பதும் கருத்தா யிருந்தது.
2964,அதன் பொருட்டு திரு.
2965,குமார சாமிப்பிள்ளையும் உடன் வந்தார்.
2966,"திருப்பூந்துருத்தி, ."
2967,அருணாசலம் இங்கு வந்திருந்தவர் உடன் வந்தார்.
2968,இரவு மணிக்குமேல் கோயமுத்தூர் சென்றோம்.
2969,இரவு அருணாசலத்தின் இல்லிலே தங்கினேன்.
2970,"நேற்றுக் காலை பெண்வீட்டில் இராமசாமியின் திருமணம் நிகழ, நேற்று மாலையே மணமக்கள் உப்பிலி பாளையத்திற்கு வந்து சேர்ந்தார்களாம்."
2971,இன்று வரவேற்பு மிக்க சிறப்புடன் நடைபெற்றது.
2972,தியாகராஜபாகவதர் கச்சேரி செய்தார்.
2973,அவருக்கு ஊதியம் ரூ .
2974,அவர்பாட்டில் ஒரு சுவையும் காணப் படவில்லை.
2975,அவருக்குக் கொடுத்தது வீண் செலவே என நாயுடுவும் உணர்ந்தார்.
2976,"திருக்குறள் மூலம், திருவாசக மூலம், சிலப்பதிகாரவுரை என்னும் புத்தகம் மணமகனுக்கு பரிசிலாக நான் வழங்கினேன்."
2977,புலவர் கல்லூரிக்கு ரூ.
2978,என் அன்பர் திரு.
2979,நாயுடு இன்று கையொப்பஞ் செய்தார்.
2980,"என் அன்பருடைய இனிய குணமும், தாராள சிந்தையும் மேன்மேலும் பெருகுகின்றன."
2981,கடவுள் அவருக்கு நீண்ட நல்வாழ்வினை அளிப்பாராக.
2982,கோவையினின்று பகல் வண்டியில் வந்ததனால் உடல் நலிவுற்றது.
2983,வானொலியிற் பேசுவதும் வருத்தமாயிருந்தது.
2984,இன்று மாலை க.
2985,சங்க வினைக் குழுவினர் கூட்டம் கூடியது.
2986,நான் அதிற் சேர்ந்த பின் வது முறையாக இன்று அக்கூட்டத்திற்குச் சென்றிருந்தேன்.
2987,கார்த்திகை விரதம் ஒருவாறு நிறைவேறியது.
2988,இன்று புலவர் கல்லூரி திறக்கப் பெற்றது.
2989,"நான் சென்று பார்வையிட்டு, அப்படியே கூட்டுறவுப் பதிப்பகம் சென்று புத்தகங்கள் எடுத்து வந்தேன்."
2990,பாண் பெரியார் மூவர் ம் பதிப்பில் புத்தகங்கள் வந்து சேர்ந்தவை.
2991,இன்று ஆனி அமாவாசை தந்தையார் திதி.
2992,என் உடல்நிலை மிக மோசமாக இருந்தது.
2993,திதி ஒருவாறு நிறைவேறியது.
2994,இரண்டு மூன்று நாட்களாகக் கபம் அளவின்றி வருகின்றது.
2995,சிறிது காய்ச்சலும் தலைவலியும் இருந்தன.
2996,மருத்துவ சாலையினின்று வருவித்த ஆங்கில மருந்துண்டு சிறிது குணம் ஏற்பட்டுளது.
2997,இன்று எண்ணெயிட்டு முழுகினேன்.
2998,வருமான வரி மீட்சிக்காக இன்று மனுக் கொடுக்கப் பெற்றது.
2999,செங்கிபட்டியில் மைத்துனர் .
3000,தியாகராஜ மேற் கொண்டாரிடம் அவர் கொடுக்க வேண்டிய கடனுக்காக ரூ.
3001,க்கு நன்செய் புன்செய் நிலங்கள் விலைக்கு வாங்கப் பட்டிருந்தன.
3002,அதனால் மேற்படி நிலங்களை ஆண்டின் முன் திரு.
3003,மேற்கொண்டார் மூலம் மாற்றியடைக் கலாயினேன்.
3004,"மேற்கொண்டார் மிகவும் பிணங்கிக் கொண்டு, போக்குவர வின்றி இருந்தார்."
3005,சில மாதமாக ரூ. வாங்கிக் கொண்டு நிலங்களைத் தம்மிடம் விட்டுவிடும்படி சிலர் மூலம் கேட்டு வந்தார்.
3006,இன்று தமது இளைய மனைவியுடன் வந்து ரூ.
3007,"கொடுத்துவிட்டு, எஞ்சிய ரூ."
3008,ம் விரைவில் கொடுப்பதாகச் சொல்லிப் போயினர்.
3009,ம் பெற்றுக் கொண்டேன்.
3010,"தஞ்சை, க."
3011,பள்ளியில் ஆசிரியராயிருந்த ம.
3012,"அரங்கநாதன் நாகை, அரசினர் போதனா முறைப் பள்ளியில் தமக்குக் கிடைத்த வேலையை ஏற்றுக் கொள்ளுதற்கு இன்று வைகறையிற் புறப்படலாயினர்."
3013,அவர் இங்கிருந்தது எனக்குப் பெரிய பேருதவி.
3014,பெரும்பாலும் பார்சல்களுக்கு முகவரி எழுதும் வேலை அவரையே சார்ந்திருந்தது.
3015,இரவு தோறும் அவருடைய இனிய குரலில் திருமுறைப் பாடல்களைப் பாடக்கேட்டு இன்புற்று வந்தேன்.
3016,இஃது எளிதிற் கிடைக்கக்கூடிய பேறன்று.
3017,"அவரும் என்பால் அளவுகடந்த அன்பு வைத்து அதற்கேற்ப ஒழுகினதோடு, தொண்டுகளும் செய்து வந்தனர்."
3018,இறைவன் திருவருள் விரைவில் அவர் இந்நகருக்கே வருமாறு உதவி செய்ய வேண்டும்.
3019,"இன்று காலையில், புலிசையினின்று ."
3020,ஆறுமுகம் பிள்ளை என்ற அன்பர் மிகுதியான ஆரஞ்சுப் பழங்களுடன் வந்து பார்த்துச் சென்றார்.
3021,மிக்க அன்பும் பணிவும் உள்ளவராக இருக்கின்றனர்.
3022,மாலையில் அவ்வாறே புலிசையினின்று .
3023,ராஜகோபாலாச்சாரி நகை வியாபாரம் என்ற கல்வி விருப்பு மிக்க அன்பர் சிறந்த கிச்சிலிப் பழங்களுடன் வந்து கண்டு சென்றனர்.
3024,இவர் சிவப்புக்கல் பதித்த மோதிரம் ஒன்றும் பரிசிலாக அளித்துச் சென்றனர்.
3025,நெடுநாளாகக் குழந்தையைப் பார்க்க முடியாதிருந்த எங்கட்குக் களிப்பு மிகுந்தது.
3026,இன்று காலை திருவையாற்றிலிருந்தும் பார்வதியம்மாள் முதலிய யாவரும் வந்திருந்தனர்.
3027,எல்லோரும் அளவளாவி மகிழ்ந்தனர்.
3028,நேற்றும் இன்றும் கரந்தைத் தமிழ்ச்சங்கத்தின் ஆண்டுவிழா ஆசிரியர் வரதநஞ்சைய பிள்ளை தலைமையில் நடைபெற்றது.
3029,"திருவாளர்களான குமார வீரையர், இளவழகனார், ."
3030,"மீனாட்சி சுந்தரம் பிள்ளை, சேலம் கல்லூரித் தலைவர் இராமசாமிக் கவுண்டர் ஆகியோர் இருநாளிலும் சொற் பொழிவு செய்தோராவர்."
3031,"இன்று காலை சங்கமண்டபத்தில், பண்டிதமணி மு."
3032,கதிரேசசச் செட்டியாருக்கு ஓராண்டின் முன் மகாமகோபாத்தியாய பட்டம் கிடைத்ததைப் பாராட்டும் கூட்டம் நடந்தது.
3033,பண்டித மணியும் இராமசாமிக் கவுண்டரும் பகலுணவிற்கு என்னால் அழைக்கப் பெற்று வந்து உண்டு சென்றது மகிழ்ச்சிக் குரியது.
3034,இரவு மணிக்கு மேலே ஆண்டுவிழாக் கூட்டம் முடிவுற்றது.
3035,ராஜமும் குழந்தையும் இங்கிருக்க வேண்டிய நிலைமையில் வந்ததால் நடராஜன் மட்டும் இன்றிரவு நீலகிரிக்குப் புறப்படலாயினன்.
3036,குழந்தையின்பால் அளவு கடந்த பாசம் வைத்திருப்பவன் குழந்தையைப் பிரிந்திருப்பது வருத்தமே.
3037,தஞ்சை ஜில்லாக் கல்வியதிகாரி உதவியதிகாரிகளுடன் இன்று கரந்தைப் புலவர் கல்லூரிக்கு இன்ஸ்பெக்ஷனுக்கு வந்திருந்தனர்.
3038,"புகுமுக வகுப்பு இருத்தலாலும், அரசினர் உதவியை வேண்டுதலாலும் கல்லூரிக்கும் அவர்கள் சம்பந்தம் ஏற்படலாயிற்று."
3039,நான் காலை மணிக்குச் சென்று மாலை மணிக்கு வீடுவந்து சேர்ந்தேன்.
3040,"இன்று காலை, எந்தக்கோளின் கொடுமையோ தெரியவில்லை."
3041,இன்று கார்த்திகை விரதம் வழக்கம் போல் நடைபெற்றது.
3042,ஞாயிற்றுக் கிழமையாகிய இன்று க.
3043,சங்கத்து வினைக் குழுவிற்குச் சென்றேன்.
3044,இன்று சுந்தரர் திருநாளாகலின் புலவர் கல்லூரி மாணாக்கர்களையெல்லாம் மன்றத்தில் இருக்கச் செய்து சுந்தரரைக் குறித்துச் சொற் பொழிவு செய்தேன்.
3045,சமய குரவர் நாட்களைத் தக்கவாறு கொண்டாடாத இழுக்குடையேனாயினும் இன்று இவ்வாறு செய்தது சிறிது ஆறுதலளிக்கிறது.
3046,இன்று மருமகள் ராஜத்திற்குச் சிறிது உடல் நோவுற்றது.
3047,"மருத்துவச்சி வந்து பார்த்து, இன்னும் நாலைந்து நாளில் குழந்தை பிறக்கலாம் என்று கூறிப்போயினள்."
3048,இன்று கார்த்திகை விரதம் இனிது நிறைவேறியது.
3049,"திங்கட்கிழமை, அமாவாசையாகிய இன்று பகல் மணி க்கு நாழிகை அளவில் சௌ."
3050,இராஜம்மாளுக்குப் பெண் குழந்தை பிறந்துளது.
3051,தாயும் குழந்தையும் நலமாக இருக்கிறார்கள்.
3052,திருவருளைப் போற்றுதல் வேண்டும்.
3053,"பூதலூரில் ஒரு கல்யாணத்திற்குக் காலை வண்டியில் சென்று, பகல் வண்டியில் மீண்டேன்."
3054,திரும்பும் பொழுது கூட்டம் மிகுதியாயிருந்தமையின் டிக்கெட் கொடுக்கப்பட வில்லை.
3055,டிக்கெட் இன்றிப் பிரயாணஞ் செய்த பலருள் யானும் ஒருவனானேன்.
3056,வண்டியில் ஆடவரும் மகளிருமாய் அலங் கோலமாய் நின்று கொண்டிருந்த படியே வந்து சேர்ந்தேன்.
3057,சிதம்பரம்பிள்ளை அளித்த அயத்தங்க செந்தூரம் இன்று உண்ணத் தொடங்கியுள்ளேன்.
3058,தஞ்சை நகராண்மைக் கழகத் தலைவரானமை குறித்து இராவ்பகதூர் அருளானந்தசாமி நாடாருக்கு க.
3059,சங்கத்தில் இன்று ஒரு வாழ்த்துப் பத்திரம் அளிக்கப்பெற்றது.
3060,யான் மூச்சுத் திணறுதலால் மிகுந்த சங்கடத்துடன் சில சொற்கள் பேசினேன்.
3061,"புதிய மருந்துண்டதனாலோ, சந்தனாதி தயிலம் தேய்த்து முழுகிய தனாலோ நோயின் தொந்தரை மேலும் மிகுவதாயிற்று."
3062,சிறிது காய்ச்சலும் ஏற்பட்டது.
3063,மீட்டும் மருத்துவர் கோபாலசாமி வந்து பார்க்கிறார்.
3064,உடம்பு குணமடைந்து வருகிறது.
3065,மைந்தன் நடராஜன் வாரம் லீவு எடுத்துக் கொண்டு இன்று வந்து சேர்ந்துளன்.
3066,இன்று கார்த்திகை விரதம் இனிது நிறைவேறியது.
3067,வடக்கு வாசல் முருகர்கோயிலில் இன்று அபிடேக அருச்சனைகள் செய்து வழிபட்டோம்.
3068,நாடோறும் நாலைந்து வகை மருந்துகள் உண்ணுகின்றேன்.
3069,"இன்று கொப்பனாப்பட்டி, கலைமகள் கல்லூரி, பட்டமளிப்பு விழா பண்டிதமணி மு."
3070,செட்டியார் தலைமையில் நடக்கிறது.
3071,அதில் சொற்பொழிவு செய்தற்குச் செல்வி பார்வதியம்மாளை அழைத்திருந்தனர்.
3072,"அதற்கிணங்கி, செல்வன் நடராஜனைத் துணைக்கு அழைத்துக் கொண்டு இன்று வைகறை மெயிலில் புறப்பட்டுச் சென்றுளது."
3073,மாப்பிள்ளை .
3074,திருச்சி வானொலியில் இன்று பேசுதற்குச் சென்றார்.
3075,"பார்வதியம்மாளும், நடராஜனும் இன்று திரும்பி வந்தனர்."
3076,"கொப்பனாப்பட்டியில் பார்வதியம்மாளும், திரு."
3077,"முதலியாரவர்களும், ஒளவை, சு."
3078,பிள்ளையும் பேசினார்களாம்.
3079,காரைக்கால் அம்மையார் என்னும் பொருள் பற்றிப் பார்வதி யம்மாள் பேசிய பேச்சு முதன்மையாயிருந்த தென்று நடராஜன் பாராட்டிப் பேசினன்.
3080,"மைந்தன் நடராஜன் வாரமாக இங்கிருந்துவிட்டு, இன்று அருவங்காட்டிற்குப் புறப்பட்டுச் சென்றுளான்."
3081,இன்று சென்னை வித்.
3082,பரீட்சகர் கூட்டம் கரந்தைப் புலவர் கல்லூரியில் நடைபெற்றது.
3083,உடல் மெலிவாலும் மயக்கத்தாலும் பல நாட்களாக வினாத்தாள்கள் தயாரிக்க முடியாதிருந்தேன்.
3084,செய்து முடிக்கவியலாதவளவு வேலையிருப்பதனை நாளின் முன் உணர்ந்தேன்.
3085,"பின், பகலிலன்றி, நடுஇரவிலுங்கூட வேலை செய்து நேற்றிரவு ஒருவாறு முடித்தேன்."
3086,எஞ்சிய சிறு பகுதியை இன்று கூட்டத்திலிருந்து கொண்டு எழுதி முடித்தேன்.
3087,"இங்ஙனம் வேலை செய்ததும், நிறைவேறியதும் வியப்பு விளைத்தன."
3088,இறைவன் அருள் இருந்தவாறு!
3089,திருச்சி எஸ்.
3090,கல்லூரியில் நெடுங்காலத்தின் முன் ஆசிரியராயிருந்த .
3091,கிருஷ்ணசாமி ஐயங்கார் என்ற அன்பர் இன்று வீட்டிற்கு வந்து அரைமணிநேரம் வரையில் பேசிக் கொண்டிருந்து சென்றார்.
3092,"இவர் கிறிஸ்து சமயத்திற்குப் போய், மீண்டும் இந்துவாகத் திரும்பியவர்."
3093,இவரது வாழ்க்கை விநோதமானது.
3094,சிறுபிராயத்திலிருந்தே ஏதோ பாரமார்த்திக நாட்டமுடையவராகக் காணப்படுவர்.
3095,அத்தகைய பேச்சுக்களே பேசுவர்.
3096,இப்பொழுது அது பின்னும் முதிர்ந்துளது.
3097,அவரே சொல்லுகிறபடி பலர் அவரைப் பித்தராக நினைக்கக்கூடும்.
3098,ஆனால் அவரது பேச்சு மிகுந்த பயனுள்ளதாகும்.
3099,அதன்முன் எனது சிறுமை புலனாகின்றது.
3100,இன்று கார்த்திகை விரதம் இனிது நிறைவேறியது.
3101,"நடுக்காவேரி ஆற்றோரம் படுகையில் சென்ட் நிலம் ரூ.க்குக் கிரயத்திற்கு வாங்கி, இன்று பத்திரம் எழுதப்பெற்றது."
3102,"இன்று வைகறையில் தீபாவளி முழுக்கும், பகலில் பண்டிகையும் நிகழ்ந்தன."
3103,மைந்தன் நடராஜன் மட்டும் அருவங் காட்டில் இருத்தலின் உடனிருத்தற்கில்லை.
3104,"மகள், மருகர், மருமகள், பேரக்குழந்தைகள் எல்லோரும் உடனிருந்தனர்."
3105,"இன்று பிற்பகலில், க."
3106,கல்லூரி மாணவர்கள் பேர் வரை வந்து பலகாரம் உண்டு சென்றது மகிழ்ச்சியளித்தது.
3107,நான்கு நாளாக உடல் செம்மையில்லாதிருத்தலின் யாதும் வேலை செய்யக்கூடவில்லை.
3108,வாழ்க்கையின் போக்கில் பெரியதோர் மாறுபாடு.
3109,முன்பு முறையோ?
3110,சில சில யாண்டுகள் ஊனுண்டல் துறந்திருந்தேன்.
3111,இம்முறை ஆண்டுகளுக்கு மேலிருக்கலாம் வீட்டில் யாருமே உண்பதில்லை.
3112,நரகத்திலிருந்து மீண்டது போற்காணப்பட்டோம்.
3113,வீடு தூய்மையாக இருந்தது.
3114,"இனி, உயிர் போயினும், இவ்விரதத்தை விடுவதில்லை என்னும் உறுதியோடேயே இருந்தேன்."
3115,என் உறுதி பயனற்றதாயிற்று.
3116,பலமுறை விரதத்தைக் கைவிட்ட தீவினையு முடையேனா யினேன்.
3117,நோயால் நாளுக்குநாள் உடல் மெலிந்து வந்ததோடு வலி குன்றிவந்தது.
3118,இரண்டொரு மாதமாக உடம்பில் சிறிதும் வலிமையிலாதாயிற்று.
3119,வீட்டினுள்ளே நடப்பது கூட மலையைச் சுமப்பது போலாயிற்று.
