Line Number,Sentence
580,"என்பதாகலின், இடத்தொடு பார்த்து ஏற்கும் பொருட்கட் கூறுவது.",False
581,மேலைச்சூத்திரத்தளவும் பிறிதுபொருளொடு உவமைகூறிப் போந்தார்.,False
582,இனிப்பொருள்தன்னோடேயுவமை கூறுகின்றார் என்று கொள்க.,False
583,நிலவுக்காண் பதுபோல அணிமதி ஏர்தர கலித்.,False
584,என்றவழிக் காணப் பிறிதாகிய பொருளொடு உவமை கூறாமையிற் பிறிதொடு படாதாயிற்று.,False
585,மதியினது எழுச்சியை நோக்கிதலிற் பிறப்பொடு நோக்கிற்று. அவ்விடத்திற் கேற்பக் கூறுதலின் முன்னமாயிற்று.,False
586,அம் மதியின்று தோற்றம் இத்தன்மைத்தெனத் துணிதலின் அதன்கண் உவமைச்சொல் வந்தது.,False
587,"எனவே, அஃது எல்லார்க்கும் புலனன்று நல்லுணர்விடை யோர்க்கே புலனென்பதூஉம் அவர் கொள்ளச் செய்ய வேண்டுமென்பதூஉங் கூறியவாறு.",False
588,இதனானே செய்யுளுட் பயின்று வருமென்பது கூறினானாம்.,False
589,அவற்றிற்கு உதாரணம் மேற்காட்டுதும்.,False
590,மற்றிதனை உவமையென்ற தென்னை?,False
591,"இவற்றை உவமப்போலி யென்று கூறுமாகலின். ஆய்வுரை இஃது, உள்ளுறையுவமத்தின் இலக்கணம் உணர்த்துகின்றது.",False
592,"பிறிதொடுபடாமையாவது, உவமத்தின் வேறாக உமமேயப் பொருள் இதுவென வெளிப்பட நிறுத்தாது உவமப்பொருளை மட்டும் கூறுதல்.",False
593,"உவமையும் உவமிக்கப்படும் பொருளு மாக ஒருங்குவைத்துக்கூறப்படாத நிலையிலும், உள்ளுறையாகிய இது, உவமம்போன்று பொருள்கொள்ளப்படுதலின், இதனை உவமையென்றார்.",False
594,உள்ளுறையுவமை யென்புழி உவமை என்பது ஒப்பினாலாயபெயர்.,False
595,உவமம் போன்று பொருள் கொள்ளப்படுதலின் இதனை உவமப்போலி யெனவும் வழங்குவர் தொல்காப்பியர்.,False
596,உவமப் போலி ஐந்தென மொழிப.,False
597,இளம்பூரணம் என்எனின்.,False
598,இதுவுமோர் உவமைவிகற்பங் கூறுதல் நுதலிற்று.,False
599,இள் உவமையைப் போன்று வருவன ஐந்தென்று சொல்லுவர் என்றவாறு.,False
600,பேராசிரியம் இது மேற்கூறிய உள்ளுறையுவமை ஐவகைப்படுமென்கின்றது.,False
601,இ ள் உள்ளுறையுவமை ஐந்துவகையெனக் கூறுவர் புலவர் எ .,False
602,ஆய்வுரை இது மேற்குறித்த உள்ளுறையுவமம் ஐந்து வகைப்படும் என்கின்றது.,False
603,தவலருஞ் சிறப்பினத் தன்மை நாடின் வினையினும் பயத்தினும் உறுப்பினும் உருவினும் பிறப்பினும் உருஉந் திறந்த வென்ப இளம்பூரணம் என்எனின்.,False
604,மேலதற்கோர் புறனடை.,False
605,இ ள் மேற்சொல்லப்பட்ட ஐந்தும் உரைத்த வாய்பாட்டாற் கூறும்வழிச் சொல்லப்பட்ட ஐந்தினும் ஏதுவாகச் சொல்லிப் பின்னர்க் கூறவேண்டும் என்றவாறு.,False
606,இள். வினைபயன் மெய் உருவென்ற நான்கினானும் பிறப்பினானும் வரும் மேற்கூறிய ஐந்தும் .,False
607,"உறுப்பென்றது மெய்யினை உடம்பினை உறுப்பென்ப வாகலானும் மெய்யுவமமெல்லாம், உறுப்பினையேபற்றி வருதல் பெரும்பான்மைய வென்றாகும் அவ்வாறு கூறினானென்பது.",False
608,தவலருஞ் சிறப்பினத் தன்மை நாடின் என்றதனான் ஏனை யுவமத்தினும் உள்ளுறை யுவமமே செய்யுட்கும் பொருளிலக் கணத்திற்குஞ் சிறந்த தென்பது.,False
609,என்பது என்னை?,False
610,தாமரையினை விளைப்ப தற்கன்றிக் கரும்பு நடுதற்குச் செய்த பாத்தியுள் தானே விளைந்த தாமரை சுரும்பின் பசி தீர்க்கு மூரனென்றாள்.,False
611,அவற்றுள்ளும் இது சுரும்பு பசிகளையுந் தொழிலோடு விருந்தோம்புதற் றொழில் உவமங் கொள்ள நின்றமையின் வினையுவமப் போலியாயிற்று.,False
612,"அல்லாக்காற் கரும்புநடு பாத்திக் கலித்த தாமரை, சுரும்புபசி களையும் பெரும்புன லூர என்பது பயமில கூறலா மென்பது.",False
613,என்பதும் அது.,False
614,என்பது என்னை மிதியுண்டு வீழ்ந்த வேங்கை குறையுயிரோடு மலர்ந்தாற்போல யானும் உளேனாயினே னென்றமையின்.,False
615,இது நிறமன்றாலேனின் நிறமும் பண்பாகலின் அந்நிறத்தோடு நிறமல்லாத பண்புங் கொள்ளப்படுமென்பது வகை பெறவந்த உவமத்தோற்றம் தொல்.,False
616,என்புழிக் கூறினானென்பது.,False
617,"இவையெல்லாங் கருதிக் கூறிற் செய்யுட்குச் சிறப்பா மெனவும், வாளாது நீர்நாய் வாளை பெறூஉ மூரனென்றதனான் ஒரு பயமின்றெனவுங் கொள்க.",False
618,"என்றவழித், தன் பார்ப்புத் தின்னும் அன்பில் முதலை யென்பது இன்னுந் தலைமகனது கொடுமைக்கு உவமையாயிற்று.",False
619,வெண்பூம் பொய்கைத்து அவனூரென்பது தலைமகள் பசப்புநிறம் பற்றி உவமையாயிற்று.,False
620,ஆதலான் வினையுவமமும் உருவுவமும் ஒரு செய்யுளுள்ளே தொடர்ந்து ஒருங்குவருதலும் உடையவென்பது.,False
621,"அவை தன் பார்ப்புத் தின்னு மன்பின் முதலையொடு... போற் செய்யு மூர்கிழ வோனே என்றவழி, இன்னதிறத்தனென்தனானேஇத்தன்மைத்தாகிஊரனையாளெனசொல்லுதலுந்,தலைவனூரின்கணுள்ளசொல்லதலைவற்கேயன்றிதலைவிகேற்உவதோன்றசெய்தலுமெஉவமகூறிவஉள்ளுறையுவமகோடலும்,பிறவாவருவனவுவாயினுஎல்லாகொள்க.",False
622,தேர்வண் கோமான் றேனூ ரன்னவிவள் ஐங்குறு. என்பது அவனூரனையாளென வந்தது.,False
623,ஆய்வுரை இஃது உவமப்போலி ஐந்தாமாறு இவையெனக்கூறகின்றது.,False
624,"வினை, பயன், மெய், உரு என் பனபற்றி வரும் ஊள்ளுறையுவமைகளும் இவ்வாறே கருதியுணரப் படும்.",False
625,கிழவி சொல்லின் அவளறி கிளவி.,False
626,இளம்பூரணம் என்எனின்.,False
627,மேற்சொல்லப்பட்ட உவமை கூறுவார் பலருள்ளுந் தலைமகட்குரியதோர் பொருள் வரையறுத்துணர்த்துதல் நுதலிற்று.,False
628,உதாரணம் தலைமகள் கூற்றுட் கண்டுகொள்க.,False
629,தோழிக் காயின் நிலம்பெயர்ந் துரையாது.,False
630,இளம்பூரணம் என்எனின்.,False
631,இது தோழியுவமை கூறுமாறு உணர்த்துதல் நுதலிற்று.,False
632,இள். தோழி உவமைசொல்லின் அந்நிலத்தினுள்ளன வன்றிப் பிறநிலத்துள்ளன.,False
633,கூறப் பெறாள் என்றவாறு. உரையாது உவமம் என ஒருசொல் வருவிக்க.,False
634,உதாரணம் தோழி கூற்றுட் காண்க.,False
635,"பேராசிரியம் இது, மேற்கூறிய உள்ளுறையுவமைக் காவதோர் இலக்கணம்.",False
636,தன் பார்ப்புத் தின்னு மன்பின் முதலை ஐங்குறு.,False
637,என்பது தோழி கூற்று.,False
638,இது மேற்குறித்த உள்ளுறை கூறுதற்குரியாருள் தலைவியும் தோழியும் அடங்குவர் எனவும் அவர் கூற்றிலமைதற்குரிய பொருட்பகுதி இவையெனவும் உணர்த்துகின்றது.,False
639,இள் தலை மகள் உள்ளுறையுவமங்கூறின் அவளறிந்த பொருள் பற்றிக் கூறப்படும்.,False
640,கிழவோற் காயின் உரனொடு கிளக்கும் இளம்பூரணம் என்எனின்.,False
641,இது தலைமகன் உவமை கூறுமாறு உணர்த் துதல் நுதலிற்று.,False
642,உதாரணம் தலைவன் கூற்றுட் காணப்படும்.,False
643,ஏனோர்க் கெல்லாம் இடம்வரை வின்றே.,False
644,இள். மேற்சொல்லப்பட்ட மூவருமல்லாத நற்றாய் செவிலி முதலாயினரர்க்கு உவமை கூறுமிடம் வரையறுக்கப்படா தென்ற வாறு.,False
645,பேராசிரியம் கிழவோற் காயி னுரனொடுகிளக்கும் ஏனோர்க் கெல்லாம் இடம்வரை வின்றே.,False
646,இதுவும் அது.,False
647,ஒழிந் தோராயின் வரையறையின்மையிற் காட்டாமாயினாம்.,False
648,அவை வந்துழிக் கலி.,False
649,ஆய்வுரை இவ்விரு சூத்திரங்களையும் ஒன்றாகக் கொண்டு உரை வரைந்தார் பேராசிரியர்.,False
650,இள் தலைவன் உள்ளுறையுவமம் கூறுங்கால் தனது உரனுடைமை தோன்றச் சொல்லப்பெறும் ஏனையோர்க்காயின் இடம் வரையப்படாது.,False
651,"எறு. தலைமகன் தன் உரனுடைமை தோன்றச் சொல்லுதலாவது, எந்நிலத்துக்கருப்பொருள் நிகழ்ச்சிகளையும் உள்ளவாறுணர்ந்த தனது பயிற்சியுணர்வு புலப்பட விரித்துரைத்தல்.",False
652,ஏனையோர்க்காயின் இடம் வரையப்படாதென்றது.,False
653,இனிதுறு கிளவியும் துனியுறு கிளவியும் உவம மருங்கில் தோன்றும் என்ப இளம்பூரணம் என்எனின்.,False
654,இது தலைவற்குந் தலைவிக்குந் தோழிக்கு முரியதோர் மரபு உணர்த்துதல் நுதலிற்று.,False
655,வானத் தணங்கருங் கடவு ளன்னோள் நின் மகன் தா யாதல் புரைவதால் எனவே அகம். என மகிழ்ச்சிபற்றி வந்தது.,False
656,பிறவும் அன்ன.,False
657,பேராசிரியம் இதுவும் மேலதற்கே யாவதோர் வேறுபாடுணர்த்துதல் நுதலிற்று.,False
658,இள் மேற் கூறப்பட்ட உள்ளுறையுவமம் இன்ப துன்பங்கள் தோன்றச் சொல்லவும்படும் .,False
659,"தாய்சாப் பிறக்கும் புள்ளிக் கள்வனொடு பிள்ளை தின்னு முதலைத்து ஐங்குறு. என்பது, தலைமகன் கொடுமை கூறினமையின் துனியுறுகிளவி யாயிற்று.",False
660,இவ்விரு பகுதியும் படச் செய்யப்படும் மேற்கூறிய உள்ளுறையுவமமென்பது இதன் கருத்து .,False
661,ஆய்வுரை இது மேற்குறித்த உள்ளுறையுவமையில் இடம்பெறும் பொருள் வேறுபாடு பற்றிய சொல்வகை உணர்த்துகின்றது.,False
662,இள் இன்பத்தினை விளைக்குஞ்சொல்லும் துன்பத்தினைப் புலப்படுத்துஞ் சொல்லும் இவ்வுள்ளுறையுவமையிடத்தே தோன்றும் எறு.,False
663,"இறுதுறுகிளவியாவது, இன்பவுணர்வாகிய மகிழ்ச்சியினைப் புலப்படுத்துஞ் சொல்.",False
664,"துனியுறுகிளவியாவது, பிரிவும் புலவியும் ஆகிய துன்பவுணர்வினைப் புலப்படுத்துஞ் சொல்.",False
665,கிழவோட் குவமை ஈரிடத் துரித்தே இளம்பூரணம் என்எனின்.,False
666,தலைமகள் உவமை கூறுமிடன் உணர்த்துதல் நுதலிற்று.,False
667,இள் தலைமகள் இரண்டிடத்தல்லது உள்ளுறையுவமை சொல்லப்பெறாள் எறு.,False
668,இரண்டிடமென்பன மருதமும் நெய்தலும் அந்நிலத்துப் பிறந்த பொருள் பற்றியல்லது உள்ளுறையுவமஞ் சொல்லுதல் கிழத்திக்குரித்தன்றென்பது கருத்து.,False
669,என்றவழி வண்டூது பனிமலரெனப் பிறர்க்குரிய மகளிரெனவும் அவரை நயப்பாயெனவும் உள்ளுறையுவமம் மருதத்துக்கண்வந்தது.,False
670,என்பது .,False
671,இதனுட் கழியமுண்டக மலரும் என முள்ளுடையதனைப் பூமலருமென்று உள்ளுறுத்ததனான் இருவர் காமத்துறைக்கண்ணும் ஒருதலை இன்னா ஒருதலை இனிதென்றா ளென்பது.,False
672,பிறவும் அன்ன.,False
673,யாதானுமொரு நிலத்தாயினும் பிரிந்திருந்தவிடத்து உள்ளுறையுவமங் கூறப்பெறுங் கிழத்தி யென்பது இதன் இருத்து.,False
674,பெருந்தண்வாடையின் முந்து வந்தோனென்பது பிரிவின்றாகலின் ஈரிடமென்றலே வலிதென்பது.,False
675,"ஆய்வுரை இது, தலைவி உள்ளுறை கூறுதற்குரியசூழ்நிலையிதுவென உணர்த்துகின்றது.",False
676,இள் தலைவி கூறுதற்குரிய உள்ளுறையுவமை இரண்டிடத்து உரியதாகும் எறு.,False
677,இரண்டிடமாவன மேற்குறித்த இனிதுறுகிளவியுந் துனியுறு கிளவி யுமாகிய இரண்டிடங்கள்.,False
678,இவ்விரு நிலைகளில் தலைவி உள்ளுறை கூறுதற்குரியன் எனவே இவ்விரண்டுமல்லாத ஏனைய நிலைகளில் தலைவி உள்ளுறையுவமம்கூறப்பெறாள் என்பதாம்.,False
679,கிழவோற் காயின் இடம்வரை வின்றே. இளம்பூரணம் என்எனின்.,False
680,தலைமகற்குரியதோர் மரபு உணர்த்துதல் நுதலிற்று.,False
681,இ ள். தலைமகன் உவமை கூறுதல் எப்பொருட்கண்ணுமாம் என்றவாறு. பேராசிரியம் மேல் உரனொடு கிளக்கும் தொல்.,False
682,இ ள் இன்பத்தினை விளைக்குஞ்சொல்லும் துன்பத்தினைப் புலப்படுத்துஞ் சொல்லும் இவ்வுள்ளுறையுவமையிடத்தே தோன்றும் எ .,False
683,"இனிதுறுகிளவியாவது, இன்பவுணர்வாகிய மகிழ்ச்சியினைப் புலப்படுத்துஞ் சொல்.",False
684,"துனியுறுகிளவியாவது, பிரிவும் புலவியும் ஆகிய துன்பவுணர்வினைப் புலப்படுத்துஞ்சொல்.",False
685,தோழியுஞ் செவிலியும் பொருந்துவழி நோக்கிக் கூறுதற் குரியர் கொள்வழி யான்.,False
686,இளம்பூரணம் இள் தோழியுஞ் செவிலியும் உவமை கூறுங்காற் பொருத்து மிடம் பார்த்துக் கூறுதற்குரியர் கேட்டோர் கொள்ளு நெறியான் என்றவாறு.,False
687,பருதியஞ் செல்வன் விரிகதிர்த் தானைக் கிருள்வளை வுண்டமருள் படு பூம்பொழில்.,False
688,". பேராசிரியர் இது, தோழியுஞ் செவிலியும் உள்ளுறையுவமங் கூறுமிட முணர்த்துதல் நுதலிற்று.",False
689,"ஏனோர்க் கெல்லா மிடம்வரை வின்றே என்றவழி, எல்லாரும் உள்ளுறையுவமஞ் சொல்லப் பெறுவரென்பது பட்டது.",False
690,கொள்வழி யென்றதனால் தோழிக்குப் போல நிலம் பெயர்ந்துறையாத பொருளான் உள்ளுறையுவமங் கூறுதலே செவிலிக்கு முரித்தென்பது கொள்க.,False
691,மற்றிவையெல்லாம் அகப்பொருட்கே யுரியவாக விதந்தோதிய தென்னை?,False
692,"செவிலி பொருந்து வழிக் கூறுவனவுங் கண்டுகொள்க, இலக்கண முண்மையின் அவையும் உளவென்பது கருத்து.",False
693,"ஆய்வுரை இது, தோழியுஞ் செவிலியும் உள்ளுறையுவமங் கூறுதற்குரிய இடம் உணர்த்துகின்றது.",False
694,"பொருந்துவழிநோக்கிக் கொள்வழியான உள்ளுறையுவமம் கூறுதற்குரியர் என இயையும், உள்ளுறையுவமம் என்பது அதிகாரத்தால் வந்தியைந்தது.",False
695,வேறுபட வந்த உவமைத் தோற்றம் கூறிய மருங்கிற் கொள்வழிக் கொளாஅல்.,False
696,இளம்பூரணம் என்எனின்.,False
697,மேலனவற்றிற் கெல்லாம் புறமமையுணர்த்துதல் நுதலிற்று.,False
698,இள். ஈண்டு எடுத்தோதப்பட்ட இலக்கணத்தின் வேறு பட்டுவந்த உவமைத்தோற்றம் எடுத்தோதிய நெறியிற் கொள்ளும் வழிக் கொளுவுக என்றவாறு.,False
699,பருதியஞ் செல்வன் விரிகதிர்த் தானைக் கிருள்வளை வுண்ட மருள்படு பூம்பொழில் எனவரும். பிறவுமன்ன.,False
