Line Number,Sentence
3765,எப்பொழுதாவது வருகின்றான் ஆதலால் வருந்துகின்றேன்.
3766,விளக்கம் இது வெண்மணிப்பூதி என்னும் புலவர் செய்யுள்.
3767,தலைவன் மறைவிடத்தில் வந்து நின்றான்.
3768,அவன் காதில் கேட்கும்படி தலைவன் தன்னை மணந்து கொள்ளுவது தான் நலம் என்ற கருத்தைத் தோழியிடம் தெரிவித்தாள்.
3769,தலைவி கூற்று.
3770,நெய்தல் திணை.
3771,என் தடம் மென் தோள் ஞெகிழ்ப என்று இறுதி அடி மாற்றப்பட்டது.
3772,இது மற்று எவனோ தோழி என்று முதல் அடியை இறுதியில் வைத்துப் பொருள் சொல்லப்பட்டது.
3773,"மற்று, ஓ, ஏ, மன், அசைச் சொற்கள் முதுநீர் பழமையான நீர்."
3774,புணரி கடல்.
3775,எக்கர் மணல்மேடு.
3776,ஞெகிழ்தல் சோர்தல்.
3777,"உலகமே கிடைத்தாலும் உன்னைக் கைவிடேன் பாட்டு ஒரு ஆண்மகன், ஒரு மங்கையைக் குறிஞ்சி நிலத்திலே சந்தித்தான்."
3778,இருவரும் ஒருவர் மீது ஒருவர் காதல் கொண்டனர்.
3779,காந்தர்வ மணம் போன்ற காதல் மணம் களவு மணம் புரிந்து கொண்டனர்.
3780,நீண்ட நேரம் அவர்கள் இன்பத்திலே திளைத் திருந்தனர்.
3781,தான் பிரிந்து போய் மீண்டும் வருவேன் என்பதற்காகவே இவ்வாறு சொன்னான்.
3782,இதைக் கேட்ட தலைவி தலைவன் பிரிகின்றான் என்று எண்ணி அஞ்சி ஏங்கினாள்.
3783,தலைவியின் உள்ள நடுக்கத்தைக் கண்டான் தலைவன்.
3784,காதலியே நீ சிறிதும் அஞ்சாதே!
3785,நான் உன்னைக் கைவிட மாட்டேன்.
3786,"இவ்வுலகமே எனக்குப் பரிசாகக் கிடைப்ப தாயினும், அதைக் காட்டினும் உன்னையே பெரிதாகக் கருதுவேன் என்று உறுதிமொழி உரைத்தான்."
3787,இந்த நிகழ்ச்சியை உரைப்பதே இச்செய்யுள்.
3788,குவளை மலர்களின் மணம் வீசுகின்ற அடர்ந்த நீண்ட கூந்தலையுடையவளே!
3789,ஆம்பல் மலரின் மணம் வீசுகின்ற தேன் போன்ற இனிய மொழியும் நீரும் பொருந்திய சிவந்த வாயை யுடையவளே!
3790,ஆழமான நீரிலே முளைத்துப் பூத்திருக்கின்ற தாமரை மலரில் உள்ள மகரந்தத்தைப் போன்ற சிறிய பல தேமல் புள்ளிகளையுடையவளே!
3791,மாமைநிறம் பொருந்திய என் மனங்கவர்ந்த மங்கையே!
3792,நான் பிரிய மாட்டேன் நீ அஞ்சாதே என்ற என் சொல்லைக் கேட்டு நீ சிறிதும் அஞ்ச வேண்டாம்.
3793,நான் உன்னை எக்காலும் கைவிடமாட்டேன்.
3794,நீயே அஞ்சல் என்ற என்சொல் அஞ்சலையே!
3795,பதவுரை குவளை நாறும் குவளை மலர்களின் மணம் கமழும்.
3796,குலை இரும் கூந்தல் அடர்ந்த நீண்ட கூந்தலையும்.
3797,ஆம்பல் நாறும் அல்லி மலரின் மணம் வீசுகின்ற.
3798,தேம்பொதி துவர்வாய் இனிமை நிறைந்த சிவந்தவாயையும்.
3799,குண்டு நீர்த் தாமரை ஆழமான நீரிலே முளைத்தெழுந்த தாமரை மலரின்.
3800,கோங்கின் அன்ன மகரந்தப் பொடிகளைப் போன்ற.
3801,நுண்பல் தித்தி சிறிய பல தேமல் புள்ளிகளையும் உடைய.
3802,மாயோய் ஏ மாமை நிறம் பொருந்தியவளே.
3803,நீஏ நீ.
3804,அஞ்சல் என்ற அஞ்சாதே என்று உரைத்த.
3805,என் சொல் அஞ்சலை ஏ என் சொல்லைக் கேட்டு அஞ்ச வேண்டாம்.
3806,யான் ஏ நான்.
3807,குறும் கால் அன்னம் குறுகிய கால்களையுடைய அன்னப் பறவைகள்.
3808,குவவு மணல் சேக்கும் குவிந்த மணல் முட்டுக்களிலே தங்கியிருக்கும் கரையை யுடைய.
3809,கடல் சூழ் மண்டிலம் கடல் சூழ்ந்த இந்தப் பூமண்டலத்தையே.
3810,பெறினும் பரிசாகப் பெறுவேன் ஆயினும்.
3811,நான் நின்னுடைய நட்புஏ நான் உன்னுடைய உறவை.
3812,விடல் சூழலன் விட்டுவிட நினைக்கவே மாட்டேன்.
3813,கருத்து நீயே எனக்குயிர் உன்னை என்றும் பிரிய மாட்டேன்.
3814,விளக்கம் இது சிறைக்குடி ஆந்தையார் என்னும் புலவர் பாட்டு.
3815,முதல் முதல் காதல் கொண்டு கலந்து களித்த தலைவன்பிரிய எண்ணியது கண்டு தலைவி அஞ்சினாள்.
3816,அப்பொழுது தலைவிக்குத் தலைவன் தந்த உறுதிமொழி.
3817,தலைவன் கூற்று.
3818,நான் நின்னுடைய நட்பு ஏ விடல் சூழலன் என்று இறுதி அடி மட்டுமே மாற்றப்பட்டது.
3819,தேம் இனிமை.
3820,தேன் என்றும் பொருள் கூறலாம்.
3821,துவர் சிவப்பு.
3822,கொங்கு மகரந்தம்.
3823,மாஅ யோய் உயிர் அளபெடை.
3824,"ஏ, அசைகள்."
3825,பண்டைக்காலத்தில் ஒரு முறை காதலித்த ஆணும் பெண்ணும் தங்கள் வாழ்நாள் முழுவதும் ஒன்றுபட்டு வாழ்வார்கள்.
3826,அவர்கள் காதல் தெய்வீகக் காதல் ஆகும்.
3827,இவ்வுண்மை இச் செய்யுளில் அமைந்து கிடக்கின்றது.
3828,இரவிலும் உறங்கேன் பாட்டு தலைவன் தலைவியை மணந்து கொள்ளும்பொருட்டுப் பொருள் தேடப் போய் இருந்தான்.
3829,அப்பொழுது தோழி தலைவியை நோக்கி நீ தலைவன் பிரிந்ததனால் உண்டாகும் துன்பத்தைப் பொறுத்துக் கொண்டிருக்க முடியுமோ?
3830,அத்தகைய ஆற்றல் உனக்குண்டோ?
3831,என்று கேட்டாள்.
3832,அதற்குத் தலைவி.
3833,அவன் விரைவில் வரவில்லை ஆயினும் அவன் வருவான் என்ற நம்பிக்கையால் உயிர் வாழ்கின்றேன்.
3834,அவன் வந்துவிடுவான் என்ற நினைவால் நான் இரவில் உறங்காமல் இருக்கின்றேன் அவனையே எதிர்பார்த்து விழித்துக் கொண்டிருக்கின்றேன் என்றாள்.
3835,இந் நிகழ்ச்சியை உரைப்பதே இச்செய்யுள்.
3836,"மத்தளத்தைப் போன்ற அடிப்பாகத்தை யுடைய பனைமரம், அது வளைந்து வளர்ந்து நிற்கின்றது."
3837,அதன் செழித்த மடலிலே கருமையான கால்களையுடைய அன்றில் பறவைகள் சிறிய குச்சிகளைக் கொண்டு கூடு கட்டியிருக்கின்றன.
3838,"அக் கூட்டிலேயுள்ள அழகிய முதிர்ந்த கருவையுடைய அன்றிற் பறவை வருத்தத்துடன், நள்ளிரவிலே தனது ஆண் பறவையை அழைக்கும்."
3839,இத்தகைய நள்ளிரவிலே என் தலைவர் தேரில் ஏறி வருவதுண்டு.
3840,என் காதிலே அவர் வருவது போன்ற ஓசை கேட்பதனால் என் கண்கள் தூங்குவதை மறந்து விட்டன.
3841,பதவுரை முழவுமுதல் அரைய மத்தளம் போன்ற அடி மரத்தையுடைய.
3842,தடவுநிலைப் பெண்ணை வளைந்து நிற்கின்ற பனைமரத்தின்.
3843,கொழுமடல் இழைத்த செழித்த மடலிலே கட்டிய.
3844,சிறு கோல் குடம்பை சிறிய குச்சிகளால் ஆகிய கூட்டினுள் இருக்கின்ற.
3845,கருங்கல் அன்றில் கருமையான கால்களையுடைய.
3846,வயவுப்பெடை வருந்துகின்ற பெண்.
3847,அன்றில் அகவும் தன் துணையை அழைக்கின்ற.
3848,பால்நாட்கங்குல் பாதி நாளாகிய இரவிலே.
3849,மன்றம் போழும் மரத்தடிகளில் உள்ள நிலத்தைச் சக்கரத்தால் பிளந்துகொண்டு வருகின்ற.
3850,இனமணி நெடுந்தேர் என் காதலனுடைய வரிசையாக மணி கட்டிய பெரிய தேரானது.
3851,வாராது ஆயினும் வராவிட்டாலும்.
3852,வருவது போலச் செவி முதல் இசைக்கும் வருவது போலக் காதிலே கேட்கின்ற ஓசையினால்.
3853,தோழி என் கண் ஏ தோழியே என் கண்கள்.
3854,துயில் துறந்தனவால் தூக்கத்தை விட்டன விழித்திருக்கின்றன.
3855,கருத்து தலைவன் வரவை எதிர்பார்த்து இரவில் தூங்காமல் விழித்திருக்கின்றேன்.
3856,விளக்கம் இது குன்றியன் என்னும் புலவர் பாட்டு.
3857,தலைவன் பிரிவை உன்னால் பொறுத்துக் கொண்டிருக்க முடியுமோ என்று கேட்ட தோழிக்குத் தலைவி கூறியது.
3858,"தோழி என் கண் ஏ, துயில் துறந்தன ஆல் என்று இறுதி அடி மட்டும் மாற்றப்பட்டது."
3859,"முழவு மத்தளம், பனைமரத்தின் அடிப்பாகத்திற்கு உவமை."
3860,"தடவு வளைவு, குடம்பை கூடு."
3861,அரை அடிமரம்.
3862,ஊருக்கு அஞ்சுவதால் என்ன பயன்?
3863,அதைக் கண்ட தலைவி தலைவனைப் பிரிந் திருப்பதனால் வரும் துன்பத்தை நம்மால் பொறுக்க முடியவில்லை.
3864,இதை விட இறந்துபடுவோம் என்று நினைத்தால் அதுவும் அஞ்சுதற்குரிய செய்கையாகும்.
3865,தலைவன் ஏன் இன்னும் வரவில்லை?
3866,ஊரார் கூறும் பழிச் சொல்லுக்குப் பயந்து கொண்டு வந்திலன் என்று நினைக்கின்றேன்.
3867,"அவனையும், எம்மையும் சேர்த்து ஊரார் உரைக்கும் சொல்தான் எம் உயிரைக் காப்பதாகும்."
3868,"இந்த உண்மையை உணராத தலைவன், ஊரார் சொல்லுக்கு அஞ்சுவது, நன்றாகாது என்று உரைத்தாள்."
3869,இந்நிகழ்ச்சியை உரைக்கின்றது இச்செய்யுள்.
3870,"தோழியே, தலைவன் பிரிந்ததனால் உண்டான கொடிய துன்பத்தைத் தாங்குவதற்கும் ஆற்றல் இல்லை."
3871,இவ்வாற்றல் இல்லாத காரணத்தால் இறந்து விடுவோம் என்று நினைப்பது இன்னும் அச்சத்தைத் தருகின்றது.
3872,ஆதலால் இறப்புக்கும் அஞ்சுகின்றோம்.
3873,"நாமும், தலைவனும் பிரியாத உறவுள்ளவர்கள் என்று ஊரார் உரைக்கின்றனர்."
3874,"நமது மலை நாட்டுத் தலைவன், ஐயோ!"
3875,இந்த அலர்மொழிக்கு அஞ்சுகின்றானோ ஆதலால்தான் அவன் பலரும் தூங்குகின்ற நள்ளிரவிலே கூட இவ்வூரில் வர அஞ்சுகின்றான்.
3876,"என் நெஞ்சத்தில் வருகின்றானே அல்லது, நேராக வருவதற்கு அஞ்சுகின்றான்."
3877,இது தலைவனுக்குப் பெருமை தரும் செயலாகுமா?
3878,தோழியே நீயே சொல்லுக.
3879,"பாட்டு உரைத்திசின் தோழி, அது புரைத்தோ!"
3880,அன்றே அரும்துயர் உழத்தலும் ஆற்றாம் அதன் தலைப் பெரும் பிறிது ஆகல் அதனினும்!
3881,அஞ்சுதும் அன்னோ!
3882,பதவுரை அரும்துயர் உழத்தலும் ஆற்றாம் தலைவன் பிரிவினால் உண்டான கொடிய துயரத்தால் வருந்துவதையும் பொறுக்க மாட்டோம்.
3883,அதன் தலை அதே சமயத்தில்.
3884,பெரும் பிறிது ஆகல் இறந்துபடுவதை.
3885,அதனினும் அஞ்சுதும் அதைக் காட்டிலும் அஞ்சுகின்றோம்.
3886,அன்னே இன்னும் ஐயோ இன்னும் கூட.
3887,நன் மலைநாடன் நல்ல மலை நாட்டையுடைய தலைவன்.
3888,பிரியா நண்பினர் இருவரும் பிரியாத உறவுள்ளவர்கள் அவர்கள் இருவரும்.
3889,என்னும் அலர் அதற்கு என்று ஊரார் உரைக்கின்ற பழிமொழிக்கு.
3890,அஞ்சினன் கொல் ஓ பயந்த விட்டானோ.
3891,பலர் உடன் துஞ்சு ஊர் பலரும் நன்றாக உறங்குகின்ற இவ்வூரிலே.
3892,யாமத்தானும் நள்ளிரவிலுங்கூட.
3893,என் நெஞ்சத்து அல்லது என் உள்ளத்திலே வந்து புகுவானே அல்லாமல்.
3894,வரவு அறியான் ஏ நேரே வருவதற்கு எண்ணாதவனுடைய அது.
3895,புரைத்தோ அச்செய்கை சிறந்ததோ.
3896,உரைத்திசின் தோழி நீயே கூறுவாய் தோழியே.
3897,கருத்து தலைவனை நான் எப்பொழுதும் நினைத்துக் கொண்டேயிருக்கின்றேன் ஆனால் அவன் மட்டும் வரவில்லை.
3898,"விளக்கம் இது, மாங்குடி கிழார் என்னும் புலவர் செய்யுள்."
3899,தலைவன் பிரிவால் வருந்தியிருக்கும் தலைவியைக் கண்டு தோழி வருந்தினாள் இவள் இத்துயரத்தை எப்படிப் பொறுப்பாள் என்று ஏங்கினாள்.
3900,அப்பொழுது அவளுக்குத் தலைவி உரைத்தது.
3901,அது புரைத்தோ அன்று ஏ உரைத்திசின் தோழி என்று முதல் அடியை மாற்றி இறுதியில் வைத்துப் பொருள் உரைக்கப்பட்டது.
3902,"ஏ, ஓ, ஏ, அசைச் சொற்கள்."
3903,புரைத்தோ பெருமையோ.
3904,"அதன் தலை அதற்கு மேலும், பெரும் பிறிது பெரிதும் வேறானது இறத்தல் அன்னோ ஐயோ."
3905,"தலைவியின் துயர் தீர வழி தேடுக பாட்டு தலைவியின் உள்ளத்திலும், உடலிலும் உண்டான வேற்றுமையை அவள் தாய் கண்டாள்."
3906,அவளுடைய நடத்தையிலே ஐயுற்றாள்.
3907,ஆதலால் அவளை வெளியே போக விடாமல் வீட்டிலேயே வைத்து விட வேண்டும் என்று நினைத்தாள்.
3908,தாயின் இவ்வுள்ளத்தை அறிந்தாள் தலைவியின் தோழி.
3909,அடுத்த நாள் தலைவியைக் காண வந்தான் அவளைக் காதலித்து வாழும் தலைவன்.
3910,"அவனிடம் தோழி, தலைவியின் தாய் செய்யக் கருதி இருப்பதைக் கூறினாள்."
3911,இனி நீ தலைவியுடன் சேர்ந்து இன்பம் துய்க்க வேண்டுமானால் அவளை மணந்து கொண்டால் தான் முடியும்.
3912,"இப்பொழுது போல் இரவிலோ, பகலிலோ தலைவியை மறைவிலே காணமுடியாது என்று இச் செய்தியை உரைப்பதே இச்செய்யுள்."
3913,கடல் துறையையுடைய தலைவனே!
3914,உன்னுடைய கடற் கரையிலே தாழை மரங்கள் நிறைந்திருக்கின்றன.
3915,அவை பெரிய கடலிலே காற்றால் எழுந்து உடைந்து விழுகின்ற அலைஓசையை இனிய கீதம் போலக் கேட்டுக் கொண்டு உறங்கும்.
3916,இத்தகைய கடற்கரையை உடையவன் நீ.
3917,"என்னுடைய தோழியாகிய தலைவி என்னோடு கூடி, பிரகாசிக்கின்ற பூங்கொத்துக்களையுடைய புன்னை மரநிழலிலே நண்டுகளை விரட்டிக்கொண்டு விளையாடிக் கொண்டிருந்தாள்."
3918,அப்பொழுது அவளுடைய பழமையான வளையல்கள் தாமே கழன்று வீழ்ந்தன அவளும் இங்கே மிகவும் பசலை நிறத்தை யடைந்தாள்.
3919,தொல் நிலை நெகிழ்ந்த.
3920,அசைஇய உண்டு தங்கிய.
3921,கரும் கால்வெண்குருகு கருமையான கால்களையுடைய வெண்மையான நாரைகள்.
3922,அடைகரை தாழை மணல் அடைந்த கரையிலுள்ள தாழை மரங்களிலே.
3923,குழீஇ கூடியிருந்து.
3924,பெரும் கடல் உடைதிரை ஒலியின் பெரிய கடலில் காற்றால் எழும்பி உடைந்து விழுகின்ற அலையோசையினால்.
3925,துஞ்சும் துறைவ தூங்கிக் கொண்டிருக்கின்ற கடல் துறையை யுடைய தலைவனே.
3926,அம்புகர் நிழல் அழகிய புள்ளி பொருந்திய நிழலிலே.
3927,பொன்வரி அலவன் பொன் போன்ற கோடுகளையுடைய நண்டுகளை.
3928,ஆட்டிய ஞான்று வருத்தி விளையாடிய பொழுதில்.
3929,ஆதலால் அவளை அவள் தாய் இனி வெளியில் வரவிட மாட்டாள்.
3930,கருத்து தலைவியை அவள் தாய் இனி வீட்டிலே வைத்துப் பாதுகாப்பாள் ஆதலால் அவளை இனி நீ மணந்துகொள்ள வேண்டும்.
