Line Number,Sentence
1760,"கூந கடிசஅயவடி டிக அடிளவ யீசநவநசவைநள, யள ஞநசளயை லெ வாந யனனவைடி டிக ன."
1761,.
1762,கூந கடிசஅயவடி டிக ளடிஅந யீசநவநசவைநள லெ வாந சநனரயீடஉயவடி டிக ய யீடிசவடி டிக வாந சடிடிவ.
1763,.
1764,"எ கண்காண் உரபே ஆநு, மடிறந ஆநு."
1765,"ளுமவ. கள் வழிப் பிறந்த நெருப்பின் பெயர்கள் உரடளடிட டு, ளர நவஉ."
1766,.
1767,அருளி மொழியியல் உரைகள் மடலம் பாண்டிச்சேரி மற்றும் பின்னாளில் எழுதிய தென்மொழிக் கட்டுரைகள்.
1768,கு.
1769,.
1770,எச்.எஸ்.
1771,.
1772,ஞானப்பிரகாசர் தேவநேயன் கோட்பாட்டின்படி இன்றைய நாஸ்திராதிக் ஆய்வாளர் கருத்தும் அதுவே கி.மு.
1773,க்கு முன்னரே தொல் இந்தோ ஐரோப்பியம் பேசுநர் தொல் திராவிடம் பேசுநரிடமிருந்து பிரிந்து விட்டனர்.
1774,"மைய ஆசிய புல்வெளிகளில் சில ஆண்டுகள் வாழ்ந்தனர், அவர் களில் சில குழுவினர் கி.மு."
1775,அளவில் மேற்கு நோக்கி ஐரோப்பாவுக்குச் சென்றனர்.
1776,ஐ ஒட்டி ஆகும்.
1777,"அவ்வாறு கிழக்கே வந்த குழுவினர் மொழி களில் அதாவது இந்தோ ஆரிய, இரானிய மொழிகளில் பண்டு அதாவது கி.மு."
1778,அத்தகைய இரண் டாவது கட்ட நிகழ்வுகளை அடுத்த பகுதி உ விளக்குகிறது.
1779,.
1780,இறுதியாக இப்பகுதியில் ஞாலமுதன்மொழி ஆய்வாளர் களின் அண்மைக்கால ஆய்விலும் தமிழ் முதன்மை பெற்றுள்ளதைக் காண்போம்.
1781,.
1782,அக்கருத்துகளுக்கு ஞால முதன்மொழியில் என்ன வேர்ச்சொல் இருந்திருக்கலாம் என்று ஊகிக்க அது முன்னோடி யாகும்.
1783,அவற்றுள் பலவற்றுக்கு ஏறத்தாழ க்குத் தமிழ்ச் சொற்களே பொருள் பொதிந்தனவாகவும் ஞாலமுதன்மொழியின் வேர்ச்சொல் வடிவை விளக்குவனவாகவும் அமைந்துள்ளன.
1784,தமிழே இயன்மொழி எனப் பாவாணர் செப்பியதை இது மெய்ப்பிக்கிறது ஞாலமுதன்மொழி வேர் திராவிடச் தமிழ் சொல் .
1785,"ஹதய அடிவாநச, டிடனநச கநஅயடந சநடயவஎந ஆய் அடிவாநச ."
1786,"க்ஷர சூ முஹ மநேந, வடி நெனே வாங்கு வடி நெனே ."
1787,"க்ஷருசு ஹளாநள, னரளவ பூழி யீடிறனநச ."
1788,"முடீடுடீ டிடந ஒள் வடி யீநைசஉந, வடி அயமந டிடந ."
1789,முருஹசூ னடிப குக்கல்குக்கன் குரைப்பது .
1790,"முருசூஹ றடிஅய பெண் கிரேக்கம் பரநே , , க்கு ரூலன் திராவிட மொழிச் சொல் தரவில்லை."
1791,மேலே தந்துள்ள தமிழ்ச் சொற்கள் இவ்வாசிரியன் தந்தவையே .
1792,ஆஹமுடீ ஊடைன மகன் மழஇளமை .
1793,"ஆஹடுஐணுஹ வடி ளரஉம, ளரஉமடந, மெல்லுதல் ரேசளந, செநயளவ ."
1794,ஆஹசூஹ வடி ளவயல ய யீடயஉந மன்னுதல் வடி நெ யீநசஅயநேவே .
1795,ஆஹசூடீ அய மன் கசடிஅ மகன் .
1796,ஆநுசூஹ வடி வாமே யடிரவ முன்னுதல் வடி வாமே .
1797,"ஞயட பால் யீயசவ, யீடிசவடி ."
1798,ஞஹசு வடி கடல பற வடி கடல .
1799,ஞருகூஐ எரடஎய பொச்சு .
1800,"கூநுமுரு டநப, கடிடிவ தாவு தரஅயீ பர்ஜிவயம தாக் நட ."
1801,"கூஐமு கபேநச, டிநே ஒண்ணு ஒண்டி தெலுங்கு ஒகடி உரால் டினமை ."
1802,கூஐமுஹ நயசவா துகள் னரளவ மெரிட் ரூலன் எ இந்து சமயத்தின் திராவிட தமிழிய அடிப்படை .
1803,"மறைமலையடிகள் முல்லைப்பாட்டு ஆராய்ச்சியுரை, தமிழர் நாகரிகம், தமிழர் மதம் பி.டி."
1804,சீனிவாச ஐயங்கார் ழளைவடிசல டிக வாந கூயஅடைள கா.
1805,சுப்பிரமணிய பிள்ளை தமிழர் சமயம் தேவநேயப் பாவாணர் தமிழர் மதம் ஆகியோர் உட்பட.
1806,"ஆரிய வேதங்களிலிருந்து மாறுபட்ட, அவற்றுக்கு முந்திய தமிழ் நான் மறைகள் இருந்தன வென்னும் கோட்பாட்டையும் கா."
1807,சுப்பிரமணிய பிள்ளை கூந ஆயனசயள ஊசளைவயை ஊடிடடநபந ஆயபயணநே பின்னர் செந்தமிழ்ச்செல்வி முதலியோர் கொண்டிருந்தனர்.
1808,பிப்ரவரி மாதத்தில் மயிலாடுதுறை செம்பியன் கண்டியூரில் வி.
1809,சண்முகநாதன் கண்டெடுத்த புதுக் கற்காலக் கருவி ஒன்றில் சிந்துவெளி எழுத்துக்கள் நான்கு உள்ளன.
1810,அவற்றை ஐ.
1811,மகாதேவன் முருகுஅன் முருகன் என்று படித்துள்ளார்.
1812,அக்கருவியின் காலம் கி.மு.
1813,ஆக இருக்கலாம் என்று அவர் கருதுகிறார்.
1814,.
1815,"சிந்துவெளி நாகரிகம் சார்ந்த, பண்டைய தொல்லிந்திய தமிழிய நாகரிகத்தின் புத்துயிர்ப்பே, மறுமலர்ச்சியே இன்றைய இந்து மதம் ஆகும்."
1816,பழைய உபநிடதங்களில் மறுபிறவிக் கொள்கை புதுமையானதாகவும் சிலருக்கு மட்டும் தெரிந்த மறை பொருளாகவும் குறிப்பிடப்பட்டு இருந்தது.
1817,இருந்தும் பின்னர் அக்கொள்கை புத்த சமண சமயங்கள் வழியாக விரைந்து அனைவராலும் பின்பற்றப்பட்டது எவ்வாறு?
1818,"எந்த மக்கள் சமூகத்தினரிடம் இருந்து புத்தர் தோன்றினாரோ, அவர்களிடையே அக்கொள்கை இருந்து இருக்க வேண்டும்."
1819,எனவே தான் அது விரைவில் அனைத்து மக்களின் கோட்பாடாக ஏற்றுக் கொள்ளப்பட்டது. பிராகிங்டன் து.டு.
1820,அத்தகைய மேன் மக்கள் குடும்பங்கள் வலுவிழந்து வீழத் தொடங்கின பின் முந்தைய உள்ளூர் ஆளுங் குடும்பங்கள் மீண்டும் வலுப்பெற்றன.
1821,எடுத்துக்காட்டாக சந்திரகுப்த மௌரியன் இத்தகைய குடும்பத்தைச் சார்ந்தவன்.
1822,புத்தரும் அவ்வாறே.
1823,தாமஸ் டிரௌட்மன் திராவிடர் உறவு முறை ரிக்வேதம் தொகுக்கப்பட்ட காலம் கி.மு.
1824,ஆகம்.
1825,இந்தோ ஆரிய மொழிப் படைப்புகளில் மிகப்பழையது அதுவே.
1826,கி.மு.
1827,எ இந்தியாவில் வழங்கும் சாதி முறை .
1828,.
1829,மறைமலையடிகள் சாதி வேற்றுமையும் போலிச்சைவரும் ஏ.எல்.
1830,"பஷாம் , கே.கே."
1831,இந்தியக் காவியங்களின் சமயக் கோட்பாடுகளில் ஆரியமல்லாத பெரும்பாலும் திராவிட கோட்பாடுகளே மிகுந்துள்ளமையை ஆந்த்ரே எப்.
1832,ஸ்ஜோபெர்கு ஹனேசநய கு.
1833,அந்த கட்டுரையின் தமிழாக்கம் மட்டும் சிலேட்டர் நூல் முடிந்தபின்னர் இணைப்பாகத் தரப்பட்டுள்ளது.
1834,பொருளடக்கம் பக்கம் .
1835,திராவிடர் .
1836,ஆரியர் .
1837,திராவிட நாகரிகத்தின் தொல்பழமை .
1838,இந்திய சமயக் கருத்துகளின் வளர்ச்சிமுறை .
1839,திராவிடப் பண்பாட்டுக் கூறுகளின் பொருளாதார அடிப்படை .
1840,திராவிட நாகரிகத்தின் சிறப்புக் கூறுகள் .
1841,ஜோபர்க்கு கட்டுரை.
1842,.
1843,திராவிடர் திராவிடர் என்ற பெயர் ஒரு குருதியினத்தைக் சயஉநகுறிக்கிறது என்று கொள்வதைவிட ஒரு மொழியினத்தைக் குறிப்பதாகக் கொள்ளுவதே பொருத்தமானது.
1844,ஆம் ஆண்டைய மக்கட் கணிப்பின்படி. கோடி மக்கள் பேசிய பதினைந்து மொழிகள் திராவிட மொழிகளாக ஒப்புக் கொள்ளப்பட்டுள்ளன.
1845,.திராவிட மொழிகளுள் பண்பாட்டில் தலைசிறந்ததும் தூய்மை மிக்கதும் தமிழே.
1846,சென்னைமுதல் கன்னியாகுமரிவரை அதுவே தாய்மொழியாயுள்ளது.
1847,தெலுங்கு மொழியை .கோடி பேர் சென்னைமுதல் கஞ்சம் மாவட்டம் வரைப்பேசுகின்றனர்.
1848,அது கிட்டத்தட்ட எழுபது லட்சம் மக்கள் பேசுவது.
1849,இவையே தலையான திராவிடமொழிகள்.
1850,.
1851,"தெலுங்கு, கன்னடம், மலையாளம் ஆகியவை தமிழைவிட மிகுதியாகச் சமஸ்கிருதச் சார்பான மொழிகளிலிருந்து சொற்களைக் கடன் பெற்றுள்ளன."
1852,ஐஐஇந்நான்கு மொழிகள் நீங்கலான மற்ற பதினொரு திராவிடமொழிகளும் இலக்கியத்துறைச் சிறப்பு அற்றவை.
1853,பிராகுவியின் இந்நிலைமை குருதியினத்தொடர்பின் சயஉந காரணமாக இருக்கலாம்.
1854,என்பது குறிப்பிடத்தக்கது.
1855,.
1856,"ஆனால், இந்தியாவில் தென் இந்திய திராவிடருக்கும், வடஇந்திய மக்களுக்குமிடையே உடற்கூறு சார்ந்த இனவேறுபாட்டு எல்லைகளைக் காணஇயலாது."
1857,.
1858,என்று வகுக்கின்றனர்.
1859,.
1860,திராவிட இனம் என்ற தொடரை வழங்கமுடிவது இதனாலேயே.
1861,.
1862,அது போன்றதே இதும்.
1863,"ஐஇத்தகைய சூழல்களில் இருமொழிகளுக்கிடையே ஏற்படும் போராட்டங்களில் வெற்றிதோல்விகளின் முடிவு ஓரளவு சுற்றுச்சார்புகளையும், ஓரளவு மொழியின் பண்புகளைம் பொறுத்தது ஆகும்."
1864,.
1865,திராவிடமொழிகள் யாவுமே கற்பதற்கு மிகவும் கடுமை யுடையவை.
1866,வடமொழிச் சார்பான மொழிகளைவிட அவை கடுமையானவை என்பது எவ்வளவு தொலைவு உண்மை என்று இன்றும் காணலாம்.
1867,ஏனைய இந்தியப் பகுதி களிலோ அது எப்போதும் இந்துஸ்தானியாகத்தான் இருக்கிறது.
1868,"சென்னையில் பக்கிங்காம் கர்நாட்டிக் ஆலைகளை ஐரோப்பிய மேலாண்மை நிறுவியபோது, இந்திய மொழிபெயர்ப்பாளர்களை வைத்துச் செயல்படவில்லை."
1869,மாற்றுமுறை ஒன்று காணப்பட்டது.
1870,.
1871,குருதியினப் பரவல் சயஉயைட ளயீசநயனசான்றுகளால் இந்தியாவின் இனஆக்கத்தில் திராவிட இனக்கூறே மற்றெல்லா இனக்கூறுகளையும் விஞ்சிக் காணப்படுகிறது.
1872,மொத்தத்தில் இன்று மொழிகளின் பரவல் குருதியினப் பரவல் இரண்டும் ஒன்றுபோலவே உள்ளன.
1873,இதுமட்டுமன்று வேறு ஒரு செய்தியும் குறிப்பிடத்தக்கது.
1874,"சமஸ்கிருதத்தின் ஒலிப்புமுறை யானது, தமிழ்போன்ற திராவிட மொழிகளுக்கும், மற்ற இந்தோ ஜெர்மானிய ஆரியஇன மொழிகளுக்கும் இடைப்பட்ட நிலையிலேயே அமைந்திருக்கிறது."
1875,.
1876,"இங்ஙனமாயின், இத்திராவிடர் யார்?"
1877,இந்தியாவுக்கு வெளி யேயுள்ள மக்கட்பகுதியினருடன் அவர்கள் இனமுறைத் தொடர்புகள் எத்தகையவை?
1878,அவர்கள் இந்தியாவுக்கு எவ்வாறு வந்தனர்?
1879,நடுநிலக்கடல் இனம் ஆநனவைநசசசயநேய சயஉந.
1880,.
1881,இரு சாரரிடையேயும் மிகத் தெளிவாகக் குறிப்பிடத்தக்க வேறுபாடு ஒன்றே ஒன்றுதான்.
1882,அதுவே மேனிநிறம்.
1883,பொதுவாகத் திராவிடர் நிறம் மற்றவரைவிடக் கறுப்புச்சாயல் மிக்கது.
1884,"மயிர்நிறம், முகத்தோற்றம் முதலியவற்றில் வேறுபாடுகள் காணப்பெறுகின்றன ஒரு முனையில் பம்பித்த சுருட்டை மயிரையும் மறுமுனையில் மென்மையையும் காணலாம்."
1885,நடுநிலக் கடற்பகுதி மக்களைவிடத் திண்ணமான உதடுகளும் சப்பையான மூக்குகளும் அவர்களில் சிலரிடம் உள்ளன.
1886,.
1887,திராவிடர் இக்கலப்பினால் மேனிநிறம் மாறி வெப்பமண்டலத்தில் பிழைத்து வாழும் ஆற்றலைப் பெற்றிருக்க வேண்டும்.
1888,இம்மாறுதலால் அவர்கள் அழகமைதி ஒரு சிறிது குறைந்துள்ளது சிறப்பாகத் தமிழகத்தில் தான் இது ஏற்பட்டுள்ளது.
1889,.
1890,ஆங்கிலோ இந்தியர் என்று முன்பு அழைக்கப்பட்ட இந்திய வாழ் ஐரோப்பியரிடையே சென்னையில் வழங்கிய பழமொழி.
1891,தீவினையின் மருட்சிவலையிலிருந்து எம்மைக் காப்பாற்றுவீராக என்ற வேண்டுகோளுக்கு இணங்கிக் கர்த்தர் உலகுக்குத் தமிழக நங்கையை அனுப்பினார்! என்பதாகும்.
1892,திராவிட மக்களில் தென்கோடியிலுள்ள தமிழ்ப் பெண்டிரைப் பொதுவாகக் குறிப்பதில் இது சற்று மிகைப்படுத்தியதாகும்!
1893,"தெலுங்கர், கன்னடியர், மலையாளிகள் ஆகியவரைப் பார்க்கிலும் தமிழர் கருமைச்சாயல் கூடியவராயும், மேனிவனப்புக்குறைந்தவராகவுமே உள்ளனர்."
1894,ஐ திராவிடரின் நிற மாறுபாட்டுக்குக் காரணமான பண்புக் கூறுகள் இரண்டு வகைப்பட்டவை.
1895,மிகப்பெரும்பாலான பொதுமக்கள் கடுவெயிலில் இருந்து உழைக்க வேண்டியவர்களாயிருக்கிறார்கள்.
1896,அத்துடன் அரையில் இரண்டு முழத் துணியும் தலைக்குட்டையையும் தவிர வேறு பாதுகாப்பு இல்லை.
1897,எனவே தோலின் கருநிற அணுக்கள் நல்ல பாதுகாப்பாக அமைகின்றன.
1898,இந்நிலையில் இயற்கையின் தேர்வுமுறைப்படி எல்லா இந்தியரையும் போலவே திராவிடரும் வெண்பொன்னிறத்தையே பெரிதும் பாராட்டுகின்றனர்!
1899,ஐஐ நாடகமேடைகளில் பெண்களாக நடிக்கும் சிறுவர்கள் முகத்தில் வெண்பொடி பூசி அதை வெண்பொன்நிறமாக்க அரும்பாடுபடுகின்றனர்.
1900,ஐரோப்பியர் பார்வையில் அது முழு வெற்றி பெறவில்லைஎன்பது வேறு!
1901,மணப் பெண்கள் வகையில் செந்நிறத்திற்கேற்ப மதிப்பு உயர்கிறது.
1902,"மண விளம் பரங்களில் மாப்பிள்ளை வீட்டார், பெண்வீட்டார் ஆகிய இரு சாராருமே நிறத்தை வற்புறுத்துகின்றனர்."
1903,ஐஐஐ மேல்நிலைக்குடும்பங்களில் மாப்பிள்ளையை இணங்கச் செய்வதற்காக மாமனார் தரும் சீதனம் பெண்கள் செந்நிறமாயிருக்கும் அளவுக்குக் குறைவு.
1904,"இதனால் செந்நிறம், சாதியைக் குறிக்கும் வடமொழிச் சொல்லே முதலில் நிறத்தைக் குறிக்கிறது."
1905,"சாதிமுறை உயர்வு தாழ்வும் ஓரளவு செந்நிறம், கருநிறம் என்றவாறே அமைந்துள்ளது."
1906,.
1907,எலியட் சுமித்.
1908,.
1909,"இக்கோட்பாட்டுக்கு எதிர்க் கோட்பாடு, நடுநிலக்கடல் இனத்தின் மூலமுதலிடமே இந்தியாவில்தான் என்பதே."
1910,அப்பொழுது மனிதக்குரங்கு இனம் கூட உருவாக வில்லை!! .
1911,.
1912,"திராவிடர் வெளியிலிருந்து வந்தார்களானால், எந்த வழியாக வந்திருக்கலாம்?"
1913,அவர்கள் கி.மு.
1914,"முதற்கொண்டு, பொதுவாகவும் சிறப்பாக, கி.மு."
1915,எனவே அப்படிக் குடியேறிய வருள் ஆடவர் பலராக இருந்திருக்க முடியாது பெண்டிர் சிலர்கூட இருத்தல் அரிது.
1916,கி.மு.
1917,காலகட்டத்துக்கு முன்னரே திராவிடர் இந்தியாவுக்குள் வந்திருக்க வேண்டும் என்பது தெளிவு.
1918,.
1919,திரு.
