Line Number,Sentence
654,மறுநாள் சுயம்பிரபைக்கு மங்கல நீராட்டி அரசமாதேவி என்னும் பட்டம் அளிக்கப்படுகிறது.
655,விஞ்சை வேந்தர்க்கும் பிறர்க்கும் அவரவர்க்குரிய முறைப்படியே சிறப்புச் செய்யப்படுகிறது.
656,"சின்னாள்கழிய, சடியரசனும் அவன் மக்களும் இளையரும் ஏனை விஞ்சை வேந்தரும் விடைபெற்றுத் தத்தம் நாட்டிற்கு ஏகுகின்றனர்."
657,திவிட்டன் சுயம்பிரபையுடன் செல்வக் களிப்பில் திளைத்து மகிழ்கின்றான்.
658,.
659,"திவிட்டன் அதற்கு இசைந்து, தன்பால் இருந்த வேதிய விதூடகன் ஒருவனை உடன் அழைத்துக்கொண்டு பூஞ்சோலைக்குச் செல்கின்றான்."
660,"பூங்காவில், சுயம்பிரபை வந்து அடையுங்காறும் திவிட்டன் சோலைக்காட்சியில் இன்புற்று வருகின்றான்."
661,அவன் எதிரே விதூடகன் இனிது பாடியாடித் தன் குறுங்கையால் பெருவ யிற்றைப் பிசைந்து கொண்டு புரள்கின்றான்.
662,திவிட்டன் அவற்றை நீ என்று உண்டனை?
663,"விதூ அரசே, அரசியார் இன்று புரியப் போகும் மண வினையில் யான் மிகுதியாக உண்பேன்."
664,"திவிட் நகைத்து மணவினைக் காலத்தில், வேதமோதும் வேதியர்க்கே யன்றி வேதமறியாத நினக்கு ஈயமாட்டார்களா, என் செய்குவை?"
665,விதூ வேதம் வல்ல வேதியரை யான் வென்று விடுவேன் அதனால் எனக்கே மோதகம் மிகுதியாகக் கிடைக்கும்.
666,என் வன்மையை அரசியார் நன்கு அறிவர்.
667,திவிட் எவ்வாறு வெல்வாய்?
668,இருவரும் பேசிக்கொண்டே இனிய கனிகள் தூங்கும் பொழிற்குட் புகுகின்றனர்.
669,"அரசன், நாம் உண்ணும் கனிகள் எதிர்வில் உள்ளன, வருதி என அழைத் தேகுகின்றான்."
670,"இடையிடையே விதூடகன், அரசற்கு நகை தோன்றுமாறு அசதியாடிச் செல்கின்றான்."
671,அவர்கள் எதிரே அசோகம் ஒன்று நிற்பதை விதூடகன் காண்கின்றான்.
672,"விதூ அரசே, இவ்வசோகு முடிமிசையே யன்றி, அடியினும் தளிர் ஈன்றிருப்பது என்னையோ?"
673,"திவிட் இவ் வடியில் உள்ளன தளிரல்ல மகளிர், இதற்கு வயவுநோய் தீருமாறு வைத்த சீறடிச் செம்பஞ்சுகள்."
674,"விதூ நன்று, நன்று."
675,திவிட் நீ சொல்லும் பூதம் இவ்விடத்தே எங்கே உளது?
676,விதூ இச் சிலாவட்டத்தின் கண்ணே உளது.
677,திவிட் அஃது எவ்வாறு இருப்பது?
678,விதூடகன் தான் அணிந்திருந்த அணியும் தன் உருவ அமைதியும் அதன்பால் உள என்று அச்சிலாதலத்தைக் காட்டு கின்றான்.
679,"அவன் கண்டு வெருவுவது அவனது மெய்ந்நிழலே எனத் தெளிந்த திவிட்டன், இது பூதம் அன்று நின் நிழலே என்கின்றான்."
680,"விதூ என் நிழல் என்னோடு இருப்பதல்லது, சிலாவட்டத் தினுள் இராதே!"
681,"அதுபோது, சுயம்பிரபை அங்கே வந்தவள் தன் விஞ்சையான் இவ்விருவர் கண்ணுக்கும் தோன்றாது திவிட்டன் அருகே நிற்கின்றாள்."
682,அவளைக் கண்டதும் விதூடக வேதியன் வீறிட்டோடி ஒரு புதர்க்குள் ஒளிந்து கொள்கிறான்.
683,அவள் சிவப்பாற்றுவது குறித்துத் திவிட்டன் மன்னன் மகளே!
684,மடந்தாய்!
685,அன்னம் அனையாய்!
686,அமிழ்தினும் அமிழ்தே!
687,உற்றது என்னை? என இரந்து கேட்கின்றான்.
688,"விடுதலை பெற்ற விதூடகன் ஆடிப் பாடுதல் ஓடுமே மனம் ஓடுமே, கூடுமேதணி கோதையாய்!"
689,காடுசேர்கனி காண்தொறும் ஓடுமேமனம் ஓடுமே.
690,ஊறுமேஎயிறு ஊறுமே வீறுசேர்விரி கோதையாய்!
691,சேறுசேர்கனி காண்தொறும் ஊறுமேஎயிறு ஊறுமே.
692,வேண்டுமேமனம் வேண்டுமே பூண்டபொன்னணி மார்பினாய்!
693,நீண்டமாங்கனி நேர்தொறும் வேண்டுமேமனம் வேண்டுமே.
694,யாவரும் இன்புற்ற காலத்தே திவிட்டன் தன் விஞ்சையால் வேதியனுடன் மறைந்துகொண்டு மகளிர் வினையாட்டயர் தலைக் காணலுறுகின்றான்.
695,"மகளிர் பலரும் பலவேறிடங்கட்குச் சென்று பூப்பறித்தும், மாலைதொடுத்தும், மயிலொடு மாறாடியும், குயிலொடு மாறுகூவியும் விளையாடுகின்றனர்."
696,திவிட்டன் தன் விஞ்சையால் சுயம்பிரபை இருந்த பாங்கரில் யானை யொன்று வருவிக்கின்றான்.
697,யானை வரக்கண்டதும் சுயம்பிரபை பேரச்சம்கொண்டு அலமரு கின்றாள்.
698,"திவிட்டன் சென்று யானையை அகற்றி அவளது அச்சத்தைப் போக்கி, அணிகளைத் திருத்தி மகிழ்விக்கின்றான்."
699,பகற்போது மிகுகிறது.
700,மகளிர் பற்பல வாவிகளிலும் புக்கு நீராடுகின்றனர்.
701,பின்பு அனைவரும் சந்திரகாந்த மண்டபம் அணைந்து இனிய போனகமுண்டு இன்பமுறுகின்றனர்.
702,அப்போழ்தில் விஞ்சையர் தூதன் ஒருவன் திருமுகமொன்று கொணர்கின்றான்.
703,அதனை மகளிருள் ஒருத்தி மன்னன் குறிப்பறிந்து பெற்றுப் படிக்கின்றாள்.
704,இச்செய்தியையே அத்தூதுவன் தன் வாயாலும் எடுத்து இனிதே உரைக் கின்றான்.
705,யாவரும் பேரின்பம் எய்துகின்றனர்.
706,பின்பு அத்தூதன் பெறுதற்குரிய சிறப்பு மிகப் பெற்று நீங்கு கின்றனன்.
707,மகளிரும் திவிட்டனும் அரசப் பெருங்கோயிலை அடைகின்றனர்.
708,"அன்றிரவு, சுயம்பிரபை, தன் வயிற்றில் வானத்து மதியம் வந்து புகுந்ததாகக் கனாக்கண்டு வெருவுகின்றாள்."
709,"அஞ்சல், என்று கருமணி வண்ணன் தேற்றப் பணம் குலாம் பரவை அல்குல் பாவையும் பரிவு தீர்ந்தாள்."
710,"இச்செய்தியைச் சடிவேந்தற்குத் தெரிவிப்பான் இருக்கையில், இரத நூபுரத்திலிருந்து விமானமொன்று வருகிறது."
711,பின்பு ஐந்து யாண்டுகள் கழிகின்றன.
712,"சின்னாட்குப் பின் சுயம்பிரபை வேறொரு பெண்மகவைப் பயந்தாளாக, அவட்குச் சோதிமாலையெனத் திருப்பெயரிட்டுச் சிறக்கின்றனர்."
713,சோதிமாலையும் செவ்வே அழகு திகழ வளர்கின்றாள்.
714,அமைச்சர் முதலியோர் அதுவே தக்கதென்ன மணமுரசறையப்படுகிறது.
715,சுயம்வரத்திற்காக விஞ்சையரும் மண்ணவருமாக வேந்தர் எண்ணிறந்த பேர் வருகின்றனர்.
716,அவரவர்க்கும் தனித்தனியே இடங்கள் அமைக்கப்பெற்றுள்ளன.
717,"இரதநூபுரத்திலிருந்து அருக்க கீர்த்தி, தன் மனைவி சோதிமாலை, மகன் அமிததேசன், மகள் சுதாரை என்ற இவர்களுடன் வருகின்றான்."
718,அவனைத் திவிட்டன் சென்று வரவேற்று விருந்தயர்கின்றான்.
719,இவ்வாறே ஏனையரசர் களும் திவிட்டனால் வரவேற்கப் பெறுகின்றனர்.
720,சுயம்வரநாளன்று குறித்த நாழிகையில் அரசகுமரர் அனை வரும் சுயம்வர மண்டபம் புகுந்து தத்தம் இருக்கையில் இருக்கின்றனர்.
721,"இவருள் அயோத்தி வேந்தன், அத்தினபுரத்தரசன், குண்டலபுரக் கோமான், வாரணவாசி மன்னன், சூரியபுரத்து மன்னன், மதுரையரசன் முதலாயினார் சிறப்ப ஓதப்பெறுகின்றனர்."
722,போக பான்மையே பலித்ததுஅன்றே.
723,.
724,சுரமை நாட்டின் அரசனான பயாபதி தன் உரிமையுடன் மிக்க இன்புற்று இருக்கின்றான்.
725,திவிட்டனாலும் அவன் மக்களாலும் தனக்குண்டாகிய சிறப்பும் செல்வமும் கண்டு செம்மாந்து வீற்றிருக் கின்றான்.
726,ஒருநாள் திவிட்டனும் மக்களும் போந்து அவன் அடியில் வீழ்ந்து வணங்கி இன்புறுகின்றனர்.
727,"பின்பு அவன் இளமை, யாக்கை முதலியவற்றின் நிலையா மையை நினைந்து, மந்திரசாலையடைந்து அமைச்சரைக் கூட்டிச் செய்தற்குரியவற்றை ஆராய்கின்றான்."
728,"வருவது மற்றும் உண்டோ, கோள்வினை பயின்ற கூற்றம் குறுகல தாயின்? என்றார்."
729,பயாபதி கூற்றுவனை வெல்லுமாறு உண்டோ என வினவுதல் சந்தினால் தவிர்க்க லாமோ?
730,சார்பினால் ஒழிக்க லாமோ?
731,பந்தியா முன்னம் தாமே பகைத்திருந்து உய்ய லாமோ?
732,வெந்திறல் காலன் தன்னை மேற்சென்று வெல்ல லாமோ?
733,உய்ந்துஉயிர் யாங்கள் வாழும் உபாயம்நீர் உரைமின் என்றான்.
734,"பயின்றிலம் யாங்கள், என்றார்."
735,"விசயதிவிட்டரும், பிறமகளிரும் மக்களும் வந்திருக்கின்றனர்."
736,பயாபதி அருகனைப் பரவிப் பாடுதல் ஒளியாகி உலகாகி நீவிரிந்தாய் என்கோ!
737,உலகெலாம் நின்னொளியின் உள்ளடங்கிற் றென்கோ!
738,அளியார உலகம்நீ ஆள்கின்றாய் என்கோ!
739,அமருலகு தான்நின்ன தடியடைந்த தென்கோ!
740,விளியாத மெய்ப்பொருளை நீவிரித்தாய் என்கோ!
741,நீவிரித்த வாறேமெய்ப் பொருள்விரிந்த தென்கோ!
742,தெளியாமல் இல்லைநின் திருவடிகள் மெய்ம்மை.
743,தெளிந்தாலும் செவ்வனே தெரிந்து உரைக்கலாமே.
744,செங்கண் நெடுமாலே!
745,செறிந்திலங்கு சோதித் திருமுயங்கும் மூர்த்தியாய்!
746,செய்ய தாமரையின் அங்கண் அடி வைத்தருளும் ஆதியாய்!
747,ஆழி அறவரசே!
748,"அவனைக் கண்டு வேந்தன், திருவடியில் வணங்கியிருப்ப, மந்திரச் சுற்றத்தார், பிறவியறுக்கும் அறவமுது அளிமின் என வேண்டு கின்றனர்."
749,செல்வம் மிக்க வேந்தனொருவன் செயல் இதுவே என அமைச்சர் கூறுதல் அடிகள்!
750,"பின்பு முனிவன் அரசனுக்கு நால்வகைக் கதியியல்பும், வினைவகையும், வினையை வெல்லும் திறமும், வீடு பேற்றின் மாண்பும் உரைக்கலுறுகின்றான்."
751,நால்வகைக் கதியினையும் முறையே கூறத்தொடங்குகின்றான்.
752,இரங்கும் தகைத்தே.
753,"விலங்குகதித் துன்பம் ஓரறி வாகி உழக்கும் உயிர்களைப் பேர்அறி வாரும் பிறர்இல்லை இன்னவை, யார்அறி வார்?"
754,"அழியும் திறம் யாதுஎனில், கூரறி வில்லவர் கொன்றிடு கின்றார்."
755,"அறிபவர் மற்றுஇல்லை, மன்னோ."
756,மக்கட்கதித் துன்பம் அம்முனிவனே மக்கட் கதித்துன்பம் கூறலுறுகின்றான்.
757,"மக்கள் சேகர், மிலேச்சர், மனிதர், திப்பியர் என நால்வகைப் படுவர்."
758,மிலேச்சர் பூவும் பழமும் நுகர்ந்து பொழில்களில் வாழ்வர்.
759,"கொடுந்தொழிலும், குதர்க்கம் பேசலும் பிறவும் செய்வோர் இப்பிறவியை அடைவர்."
760,"நல்ல நிலத்தே, நல்ல வடிவுடன், நற்குடியிலே, உறுப்புக் குறைவின்றி, உணர்வு சிறக்கும் மக்கட் பிறப்பு எய்துவது அரிது."
761,"தானப்பயன் கூறல் ஒத்த குணங்கள் அமைந்தாங்கு உறுவர்க்குத் தத்துவம் தேறி யவன்செய்த தானங்கள் முத்திறத் துள்ளும் படாது, முடிமன்ன!"
762,உத்தமத் தேவருள் உய்க்கும் உணர்நீ.
763,"ஆம்எனின் வெல்லா வகையில்லை, வீங்குஎழில் தோளாய்!"
764,நல்ல ஞான நிகழ்வே.
765,போக மனிதர் இயல்பு கூறல் தக்கமிகு தானமுத லாயதலை நிற்கும் மக்கள்இவ ராவர்மத யானைமற வேலோய்!
766,புக்கவரு ளேபடுவர் போகநிலம் சார்ந்தார் ஒக்கஅவர் தன்மையும் உரைக்க உலவாவே.
767,"தேவர்கதித் துன்பம் தேவர்கள், பவணர், வியந்தரர், சோதிடர், கற்பகர் என நால்வகைப்படுவர்."
768,இவர்கள் ஒருவரின் ஒருவர் உயர்ந்திருப்பர்.
769,கூறுபா டுடையவரே.
770,"குலகிரியும் மலையரசும் குளிர்பொழிலும் நளிர்கயமும் பலகிரியும் தீவகமும் படுகடலும் படிநகரும் உலகிரிய வெளிப்பட்டும் ஒளிகரந்தும் உறைந்தியல்வர், அலகிரியும் பலகுணத்தோய்!"
771,அமரர்கள் ஏனைப்பலரே.
772,சுடர்பவரும் சோதிடரே.
773,சுரருடைய குணங்களே.
774,அவர் எய்தும் துன்பம் அளிதருசெங் கோலுடையாய்!
775,அமரருக்கும் அந்தரமுண்டு ஒளியோடு பேரின்பம் உயர்ந்தவர்க்கே உயர்ந்துளவாம் தெளிதருநல் காட்சியது திருந்தியமேல் நெடுந்தகையோர்க்கு எளிதகவும் பெரும்பாலும் பெறல்ஏனோர்க்கு அரியவே.
776,"உறுதிகளை நன்கு உரைக்குங்கால், கேட்டு மகிழ்ந்த பயாபதி, பேரின்பம் பெறுதற்குரிய நெறிகளையும் உணர்த்துமாறு அம்முனி வனை இரந்து வேண்டுகின்றான்."
777,அவனும் அவற்றை விளங்க உரைக்கின்றான்.
778,.
779,"அணிமுடி துறமின், எம் அடிகள்! என்றனர் மணிமுடி மன்னவற்கு அமைச்சர் என்பவே."
780,"திருமகட்கு ஒருவர் பாலும் நிலைத்த உறவு இல்லையென்று கூறுதல் திருமகள் நிலைமையும், செல்வர்!"
781,"கேட்டிரேல், மருவிய மனிதரை இகந்து, மற்றுஅவள் பொருவறு புகழினர் புதிய காமுறும் ஒருவர்கண் உறவிலள் உணர்ந்து கொண்மினே."
782,ஆதலால் அவள்திறத்து அன்பு செய்யன்மின் ஏதிலார் எனஇகழ்ந் தொழியும் யாரையும் காதலார் ஆபவர் கற்ற மாந்தரே போதுலாம் அலங்கலீர்!
783,புரிந்து கேண்மினே.
784,தன்னுயர் மணலினும் பலர்கள் தன்நலம் முன்நுகர்ந்து இகந்தவர் மூரித் தானையீர்!
785,"பின்னும்வந் தவரொடும் சென்று பேர்ந்திலன், இன்னும்அஃது அவள்தனது இயற்கை வண்ணமே."
786,பயாபதி தான் துறவு பூண்பதனை அவர்கட்கு மொழிதல் மீன்இவர் விரிதிரை வேலி காவல்மேல் ஊன்இவர் வேலினீர்!
787,உங்கள் பாலதால் யான்இனி எனக்கு அரசாக்க லுற்றனன் தேன்இவர் அலங்கலீர்!
788,செவ்வி காண்மினே.
789,"உற்றநாள் சிலஉமக்கு என்னொடு அல்லது மற்றநாள் பல, அவை வருவ ஆதலால், கற்றமாண் சிந்தையீர்!"
790,கவற்சி நீங்குமின் இற்றையான் துணிந்ததுஎன்று இறைவன் செப்பினான்.
791,அவர்கள் அவன் முன்பே தவம் பூண்டுவிடுகின்றனர்.
792,பின்பு பயாபதி அமரர் கொணர்ந்த பாற்கடல் அமுத நீராடி அணிந்திருந்த கலன்களை நீக்குகின்றான்.
793,அமைக எனப் பெய்யப் பட்டதே.
794,இவ்வாறே ஏனை அணிகள் பலவும் கழிக்கப்படுகின்றன விசயனும் திவிட்டனும் கண்டு கண்கலுழுகின்றனர்.
795,ஏனையரசரும் இவ்வாறே வருந்துகின்றனர்.
