Line Number,Sentence
565,"எனவே, தண்ணீரில் முதலில் மாவைக் கரைத்துக்கொண்டு சிறிது சிறிதாக வெந்நீரை விட்டால் மா வெந்நீரில் கரையும்."
566,"இதைப் போலவே, எச்செயலையும் வற்புறுத்திப் பலாத்காரமாகச் சாதித்துவிட முடியாது."
567,மெல்ல மெல்ல அறிவு புகட்டும் முறையினால்தான் சாதிக்க முடியும்.
568,நற்செயல் செய்தால் நம் ஒழுக்கம் அழகு பெறுகின்றது.
569,தீச்செயல் செய்தால் அதற்கேற்றவாறு நம் ஒழுக்கம் பழுதாகிப் போகின்றது.
570,எச்செயல் செய்தாலும் இதை நினைவில் வைத்துக்கொள்ள வேண்டும்.
571,நாம் நண்பர் ஒருவர் இல்லம் செல்கிறோம்.
572,நமக்குத் தேநீர் அருந்தும் வழக்கமில்லை.
573,நண்பர் தேநீரளித்து அருந்தச் செய்கிறார்.
574,"அதே போன்று, ஏதோ ஒரு காரணத்தால் இன்று பொய்பேசத் தொடங்கினால், அந்த அளவுக்குப் பொய்யராகிறோம்."
575,மறுமுறை பேசத்தயங்குவதில்லை.
576,மூன்றாம் முறை அற்பத்திற்கும் நாமாகவே பொய் பேச ஆசைப்பட்டு விடுகிறோம்.
577,இதனால் நம்முடைய ஒழுக்கம் அடியோடு சிதைந்து போகின்றது.
578,நம் எண்ணமும் செயலும் நம் ஒழுக்கத்தைத் தாக்குவது உண்மைதான்.
579,"ஆனால், நாம் அதே சமயத்தில் அதைப் பழுது பார்த்துச் சரிப்படுத்த முடியும் என்பதும் உண்மையாகும்."
580,பித்தளையாலோ செம்பாலோ ஓர் உருவம் செய்கிறோம்.
581,"உருவம் தவறிவிட்டால், மீண்டும் அதை அடித்து ஒழுங்காகச் செய்துவிடுகிறோம்."
582,"அதே போல, நம்முடைய ஒழுக்கமும் கெட்டிருந்தாலும் நல்லதாகச் செய்து விடலாம்."
583,தவற்றுக்கு நாம் இடங்கொடுத்திருந்தால் அதை ஒழித்துச் செம்மை செய்து கொள்ளலாம்.
584,ஓர் அடியில் ஒரு பயன் விளைந்தால் மற்றோரடி மூலம் அதை மாற்றியமைத்துவிடலாம்.
585,நாம் செய்யும் செயல்தான் மிகவும் முக்கியமானது என்று ஒவ்வொருவரும் இறுமாப்புக் கொள்வது இயற்கையா யிருக்கிறது.
586,"அப்படி நாம் இறுமாப்புக்கொள்வோமானால், இதே போன்று பிறர் கொள்ளும் இறுமாப்புக்கு நாம் ஏன் பங்கம் விளைவிக்க வேண்டும்!"
587,புகைவண்டி ஓடும்போது அதிலுள்ள ஒவ்வொரு பகுதியும் அதிருகின்றது.
588,"அதைக்கண்டு சக்கரம் மற்றப் பகுதிகளைப் பார்த்து, நீங்கள் ஏன் இப்படி அதிருகிறீர்கள்!"
589,"நம் குழந்தைகளை நாம் பார்ப்பது போல, அதைப் பார்க்கக்கூடாது."
590,"வெளியார் பார்ப்பது போல, நாம் எழுதியதைப் பார்க்க வேண்டும்."
591,"வேறு எவரோ ஒருவர் கூற, நாம் அதைக் கேட்பது போலப் பாவனை செய்து கொண்டு, படித்துப் பார்க்கவேண்டும்."
592,"அப்போது தான், நாம் எழுதியிருப்பதில் உள்ள குறைபாடுகள் நமக்கு நன்றாக விளங்கும்."
593,"நாம் எழுதும்போது, நம் மனத்தில் தோன்றும் பொருள் முழுவதும் அமையுமாறு எழுத வேண்டும்."
594,"பொருளின் உருவ முழுவதையும் மனக் கண் முன் நிறுத்தி, அதற்கும் எழுதிய எழுத்துக்களுக்கும் ஒற்றுமையுளதா என்று பார்க்கவேண்டும்."
595,உருவத்தின் ஒவ்வோர் அங்கமும் மொழியில் அமைந்திருக்கிறதா என்று சரிபார்க்க வேண்டும்.
596,"துவக்கத்தில், சொல்லழகும் பொருட்செறிவும் கொண்ட முறையில் எழுதி, போகப் போகப் பொருட் செறிவும் சொல்லழகும் குறைந்துபோகக் கூடாது."
597,"மொழியழகும், பொருட்செறிவும், கதையின் சுவையும் மேலும் மேலும் வளர்ந்துகொண்டே சென்றால்தான் படிப்போர் மனத்தைக் கவர்ந்துவிடும்."
598,"கதை, கட்டுரை, நாடகம், பேச்சு முதலிய எதனை எழுத வேண்டும்."
599,இந்தியக் குடியரசுத் தலைவர் டாக்டர் இராஜேந்திரப் பிரசாத் .
600,இதுகொண்டே இராஜேந்திரருடைய உயர் குணங்களை உய்த்துணரலாகும்.
601,அன்பையும் தொண்டயுமே பற்றுக்கோடாகக் கொண்டுள்ள நம் தலைவரது சீரிய வரலாறு நமக்கு வாழ்க்கை வழிகாட்டியாக அமையத் தகுவது.
602,"ஆதலின், அப்பெரியார் வரலாற்றினைப் படித்தறிதல் இந்திய இளைஞராகிய நம்மவர்க்குக் கடமையாகும்."
603,"பீகார் மாகாணம் வரலாற்றுப் புகழ்பெற்ற அலெக்ஸாண்டர் காலத்தில் வடஇந்தியாவில் சீரும் சிறப்பும் பெற்று விளங்கிய அரசு, நந்தர்கள் அரசாகும்."
604,அது பீகார் மாகாணத்தில் அமைந்ததே யாகும்.
605,அதன் தலைநகராகிய பாடலிபுரம் இருந்த இடத்திற்றான் இக்காலப் பாட்னா நகரம் அமைந்திருக்கிறது.
606,உலகம் போற்றும் உத்தமப் பேரரசனாகிய அசோகன் ஆண்ட இடமும் அதுதான்.
607,இத்தகைய வரலாற்றுச் சிறப்பு மிகுந்த பீகார் மாகாணத்திற் பிறந்து வளர்ந்தவரே நமது குடியரசுத் தலைவராகவுள்ள இராஜேந்திரர்.
608,இராஜேந்திரர் பிறப்பு பீகார் மாகாணத்தின் வடபகுதியில் உள்ள மாவட்டங்களில் சாரன் என்பது ஒன்று.
609,அம்மாவட்டத்தி லிருந்த நிலக்கிழவருள் மகாதேவ சகாயர் என்பவர் ஒருவர்.
610,அவர் சிறந்த பரம்பரையில் வந்தவர்.
611,அவர் காயஸ்தர் என்னும் கணக்கர் வகுப்பினர்.
612,காயஸ்தர் கணக்கில் வல்லவர்.
613,வட இந்தியாவில் அரசாங்க அலுவலகங்களிலும் பிற அலுவலகங் களிலும் அவர்கள் திறம்பட வேலை செய்து வருகின்றனர்.
614,மகாதேவ சகாயருக்குப் பிள்ளைகள் ஐவர் தோன்றினர்.
615,நமது இராஜேந்திரர் ஐந்தாம் பிள்ளையாவார்.
616,அவர் ஆம் ஆண்டு டிசம்பர் மாதம் மூன்றாம் நாள் பிறந்தார்.
617,தவழ்நடைப் பருவம் இராஜேந்திரர் கடைப்பிள்ளை ஆதலின் பெற்றோராற் பெரிதும் சீராட்டி வளர்க்கப்பட்டார்.
618,அவர் மந்தமாக இருந்த நேரமே இல்லை உறங்கும் நேரம் தவிர எஞ்சிய நேரத்தில் சுறுசுறுப்பு மிக்கவராகவே காணப்பட்டார்.
619,"இவன் தக்க வயதில் சிறந்த அறிஞனாக விளங்குவான், என்று அவரைப் பார்த்த பெரியோர்கள் அப்பொழுதே சோதிடம் கூறினர்."
620,விளையும் பயிர் முளையிலே தெரியுமன்றோ?
621,அவர் முதல் வகுப்பிலேயே ஆசிரியர்கள் கவனத்தைத் தம் பால் இழுக்கலானார்.
622,அவர் ஒவ்வொரு வகுப்பிலும் முதல்வராகத் தோன்றினார்.
623,"அவருடைய அன்பு, நாநயம், நன்னடத்தை முதலியன ஆசிரியரையும் மாணவரையும் ஒருங்கே கவர்ந்தன."
624,அவர் தம் அறிவாற்றல்களால் மாணவர் தலைவராய் விளங்கினர்.
625,இராஜேந்திரர் பலவகைப் பள்ளி விளையாட்டுக்களில் பெருவிருப்பங் கொண்டவர் கால்பந்து விளையாட்டில் முதன்மையானவர்.
626,இராஜேந்திரரது மாணவப் பருவத்தில் பீகார் மாகாணம் தனித்தியங்கவில்லை.
627,அது வங்க மாகாணத்துடன் இணைந் திருந்தது.
628,அப்பெரிய மாகாணத்தின் தலைநகரம் கல்கத்தா.
629,பீகார் மாகாண மக்கள் வங்கமக்களைவிடக் கல்வியிற் குறைந்தவர்கள் என்பது அக்கால வங்காளிகள் எண்ணம்.
630,"அப்பொழுது பீகாரில் நடைபெற்றுவந்த ஹிந்துஸ்தான் ரெவ்யூ என்னும் திங்கள் தாளின் ஆசிரியர் அத்தாளில், இராஜந்திரர் பீகாரின் தலை மணியாவர்."
631,அவர் கல்லூரியிலும் இவ்வாறே விளக்கம் பெறுவார் என்று எதிர்ப்பார்க்கிறோம்.
632,"அவர் எதிர் காலத்தில் இந்தியாவிற் பெயர் பெறுவார், என்று பாராட்டுரை வரைந்தனர்."
633,அக்காலத்தில் இந்திய வைசிராயாயிருந்த கர்ஸன் பிரபு வங்கத்தை இரண்டாகப் பிரித்தார்.
634,வங்கத் தலைவர்கள் அப்பிரிவினையை எதிர்த்தனர்.
635,அவர் பீகார் மாணவர் மாநாடு ஒன்றை முதன் முதற் கூட்டினார்.
636,அவருக்கு முன் இங்ஙனம் இந்தியாவில் எந்த மாகாணத்திலும் மாணவர் மாநாடு கூட்டப்பட்டதில்லையாம்.
637,இராஜேந்திரர் இங்ஙனம் அரசயில் கிளர்ச்சியில் மிக்க ஈடுபாடு கொண்டிருந்தபோதிலும் கல்லூரிப் படிப்பை மறக்கவில்லை.
638,அவர் இல் எப்.
639,தேர்வில் சிறப்புறத் தேறினார்.
640,இல் பி.
641,தேர்விலுஞ் சிறப்படைந்தார் அவர் எம்.
642,தேர்வுக்காகப் படித்து வந்தபொழுது தந்தையார் காலமானார்.
643,"எனினும், இராஜேந்திரர் தம் தமையனார் மகேந்திர பிரசாத் என்பவர் ஊக்கமளிக்க, எம்."
644,தேர்வுக்குப் படித்தார் பிறகு இல் எம்.
645,பட்டமும் பெற்றார் ஓராண்டு ஒரு கலாசாலையில் ஆசிரியராயிருந்து பின்னர்ச் சட்டக்கல்லூரியிற் சேர்ந்து படித்தார் இல் பி.
646,பட்டம் பெற்றார்.
647,இராஜந்திரர் இங்கிலாந்து சென்று ஐ.
648,பட்டம் பெறவேண்டும் என்பது தமையனார் அவா.
649,நாட்டுக் கிளர்ச்சியில் ஈடுபட்ட இராஜேந்திரர் அதனை விரும்பவில்லை.
650,"அவர் கல்கத்தா உயர் நீதிமன்றத்தில் வழக்கறிஞராகத் தம்மைப் பதிவு செய்து கொண்டு, தொழில் பார்க்கலானார்."
651,தொண்டில் ஆர்வம் இந்திய ஊழியர் சங்கம் கோபால கிருஷ்ண கோகலே என்னும் மஹாராஷ்டிரப் பெரியார் சிறந்த கல்விமான்.
652,அச்சங்கத்தார் கல்லூரி வாயிலாகக் கல்வி பரவச் செய்தனர்.
653,பலவகைக் கொடிய நோய்கள் பரவுதலைத் தடுக்க ஏற்பாடு செய்தனர் நோய்கள் பரவிய இடங்களிற் சென்று தொண்டு புரிந்தனர்.
654,இத்தகைய தியாகங் களைக் கொண்ட சங்கத்தைத் தோற்றுவித்தவர் கோகலே என்பவர்.
655,"காந்தியடிகளே அவரைத் தம் அரசியல் குருவெனக் கொண்டாடினர் எனின், அவரது சிறப்பை என்னென்பது!"
656,"இளைஞரது நாட்டுப்பற்றையும் தொண்டு செய்யும் விருப்பத்தையும் கண்ட கோகலே, அவரை இந்திய ஊழியர் சங்கத்திற் சேர்ந்து தொண்டாற்றும்படி அழைத்தார்."
657,"இளைஞர், தம் தமையனார் இசைவு பெற்றுப் புனா வருவதாகக் கூறினார்."
658,தங்களிடம் நேரிற்பேச அஞ்சியே இக்கடிதம் தங்கட்கு வரையலானேன்.
659,இதனை முழுவதும் படித்துத் தங்கள் முடிவான கருத்தினைத் தெரிவிக்க வேண்டுகிறேன்.
660,நான் தங்கள் ஆணைப்படி நடப்பேன் என்று உறுதி கூறுகிறேன்.
661,கோபாலகிருஷ்ண கோகலே அவர்கள் என்னைத் தமது இந்திய ஊழியர் சங்கத்திற் சேரும்படி கூறினார்.
662,நான் அதுபற்றி ஆழச் சிந்தித்தேன்.
663,நாட்டுப்பணி செய்வதே நல்லதுஏழைகட்குத் தொண்டு செய்வதே ஏற்றது என்பது எனது கருத்து.
664,நான் அதற்காக என் வாழ்நாட்களைத் தியாகம் செய்ய விரும்புகிறேன்.
665,நம் தந்தையார் மறைந்தபிறகு நமது குடும்பப் பொறுப்புத் தங்களைச் சார்ந்திருக்கிறிது.
666,"நான் பொருளீட்டுவேனாயின், தங்கள் சுமை குறையும்நமது குடும்பமும் தலைநிமிர்தல் கூடும்."
667,தாங்கள் முற்றிலும் என்னை நம்பியிருக்கிறீர்கள் என்பதை நான் நன்கு அறிவேன்.
668,என்னைச் சிறப்பாக நம்பியுள்ள நமது குடும்பத்தைத் தவிக்கவிட்டுப் போவது எப்படி என்னும் கவலை என்னையும் வாட்டுகின்றது.
669,"ஆயினும், நமது ஒரு குடும்பக் கவலையைவிட ஒரு நாட்டுக் கவலைகோடிக்கணக்கான ஏழைகள் பற்றிய கவலைமிகுதியாக என்னை வாட்டுகின்றது."
670,"அண்ணா, நான் இக்குடும்பத்தில் இல்லை எனின், நமது குடும்பம் எப்படியோ நடைபெறும் அன்றோ!"
671,"அவ்வாறு கருதி என்னை மறப்பின், நான் பொது நலத் தொண்டில் ஈடுபட முடியும்."
672,நான் எளிய வாழ்க்கை வாழ நன்கு பழகியுள்ளேன்.
673,இந்திய ஊழியர் சங்கத்திற் கிடைக்க இருக்கும் வருவாய் எனது எளிய வாழ்க்கைக்குப் போதும்.
674,"ஆயின், என்னைப் பெரிய துணையென நம்பிய நமது குடும்பம் ஏமாற்ற மடையுமே என்ற கவலைதான் என்னை அடிக்கடி வாட்டுகின்றது."
675,தாங்கள் என்ன நினைப்பீர்களோ என்பதை எண்ணும்போது என் மனம் கவலைப்படுகின்றது.
676,நமது குடும்ப வறுமையைப்பற்றித் தாங்கள் கவலைப்பட வேண்டா.
677,பிறக்கும் பொழுது ஒருவரும் செல்வத்தை உடன் கொண்டு வரவில்லை போகும் பொழுதும் உடன் கொண்டு செல்வதில்லை.
678,செல்வம் இடையில் வருவது இடையிற் போவது.
679,உலகில் தோன்றிய பெரியார்கள் எளிய வாழ்க்கைய வாழ்ந்தனர்.
680,"உலகம் ஒழுக்கத்திற்கே மதிப்பளிப்பது செல்வத்திற்கு மதிப்பளிப்பதாயின், கோடீசுவரர்கள் மகான்களாகக் கருதப் பட்டிருப்பார்களே!"
681,அஃது உலக இயற்கை அன்று.
682,ஆதலின் ஏழ்மை குறித்துக் கவலைப்படத் தேவையில்லை.
683,"உணவுக்கு ஓரளவு வழியிருத்தலே போதும் என்று உள்ளம் அமைதி பெறின், நமது குடும்பம் என்னைப் பற்றிப் கவலையுறல் தேவையில்லை."
684,எனது இந்த முடிவைக் குறித்து என் மனைவிக்கும் கடிதம் வரைந்துள்ளேன்.
685,நமது தாயார் தமது முதிய பருவத்தில் கவலையுறுவார் என்றஞ்சிக் கடிதம் எழுதவில்லை.
686,"தங்கள் பதிலை ஆவலுடன் எதிர் நோக்கும் தங்கள் அன்புள்ள தம்பி, இராஜேந்திரப் பிரசாத்."
687,உடன் பிறந்தார் உள்ளக்கனிவு.
688,கடிதத்தைப் படித்த தமையனார் மனங்கலங்கினார் குடும்பம் தந்தையாரை இழந்தது.
689,குடும்பச் சுமை தாங்க முடியவில்லை.
690,தம்பி படித்து அலுவல் பார்ப்பான் குடும்பம் கவலையற்று வாழும் என்று நினைத்தேன்.
691,ஈன்ற அன்னையாரா நோயால் நலிவுற்றுப் பாயும் படுக்கையுமாக இருக்கின்றார்.
692,இந்நிலையில் தம்பி நாட்டுப் பணி செய்ய விரும்பி வீட்டுப் பணியைக் கைவிடப்பார்க்கிறானே! என்று எண்ணினார்.
693,அவர் கண்களிலிருந்து முத்து முத்தாக நீர் வெளிப்பட்டது.
694,பின்னர் இருவரும் பேசாது பிரிந்தனர்.
