Line Number,Sentence
814,அவர்களாற் குற்றமெனப் பட்டவை சங்கப்பாடல்களுள்ளும் பிற சான்றோர் செய்யுட்களுள்ளும் காணப்படுதலால் அவை குற்றமெனப்படா.,False
815,ஆதலின் செய்யுட்கு அணியாவன இவையெனவும் குற்றமாவன இவையெனவும் தனித்தெடுத்துக் கூறவேண்டிய இன்றியமையாமை தொல்காப்பியனார்க்கு இல்லையென்பதாம்.,False
816,"ஆய்வுரை இது, பொருள்கோள்வகையுள் ஒன்றாகிய நிரனிறைப்பொருளில் உவமம் வருமாறுணர்த்துகின்றது.",False
817,வரைநிலைவைத்த சுண்ணம் முதல் மூன்றலங்கடை நிரல் நிறுத்து அமைத்தல் நிரல் நிறை என இயைத்துப்பொருள் கொள்க.,False
818,சிதர்ந்துள்ள பொடிபோன்று சொற்கள் சிதர்ந்து கிடப்ப அவற்றையியைத்துப் பொருள் கொள்ளப் படுதலின் சுண்ணம் எனப்பெயர் பெற்றது.,False
819,"சுண்ணம் என்பது, நாற்சீரடி இரண்டின்கண் அமைந்த எண்சீர்களைப் பொருள் இயைபறிந்து கூட்டியுணரும் பொருள்கோள்.",False
820,"எனவே, இதன்கண் உவமையும் பொருளும் வேறுவேறு நிற்க உவமஞ் செய்தல் பொருள் புலப்பாட்டுக்கு ஒவ்வாது.",False
821,இங்ஙனம் அடிகள் முன்பின்னாக மாறும் நிலையில் ஓரடியில் உவமங்கூறிப் பிறிதோரடியில் உவமேயத்தினை வைத்தால் பொருள் இனிது விளங்காது.,False
822,"மொழிமாற்று என்பது, செய்யுட்களில் முன்னும் பின்னும் அமைந்த சொற்களைப் பொருள் இயையும்படி இடம் மாற்றிப் பொருள் கொள்ளுதல்.",False
823,வரை நிலைவைத்தலாவது உவமஞ்செய்தற்கு ஒவ்வாத பொருள்கோள் இவையென நீக்கிவைத்தல்.,False
824,விரவியும்உரூஉம்... .,False
825,உயர்ந்ததன் மேற்றே... .,False
826,சிறப்பே நலனே ...,False
827,கிழக்கிடும் பொருளோடு...,False
828,சுட்டிக் கூறா...,False
829,உவமமும் பொருளும் ... .,False
830,பொருளே வமம்... .,False
831,பெருமையும் சிறுமையும்... .,False
832,அன்ன வாங்கு ...,False
833,அன்ன என்கிளவி...,False
834,.எள்ளவிழைய... .கடுப்பஏய்ப்ப...,False
835,தத்த மரபிற்...,False
836,பெருமையும் சிறுமையும்... .,False
837,உவமப் பொருளின்...,False
838,உவமப் பொருளை...,False
839,இரட்டைக்கிளவியும்... .,False
840,பிறிதொடு படாது...,False
841,உவமப் போலி ...,False
842,தவலருஞ் சிறப்பின்...,False
843,கிழவி சொல்லின்... .,False
844,தோழிக்காயின்... .,False
845,கிழவோற் காயின் ...,False
846,கிழவோட் குவமை...,False
847,கிழவோற் காயின் ...,False
848,தோழியுஞ் செவிலியும் ... .,False
849,ஒரீஇக்கூறலும்... .,False
850,உவமைத் தன்மையும்... .,False
851,தடுமாறு வரலும் ... .அடுக்கியதோற்றம்...,False
852,உவமவியல் என்பது பேராசிரியர் கொண்ட பாடம் உவமத் தோற்றம் பா.,False
853,புடை பக்கம் பகுதி.,False
854,ஒருபுடையொப்புமையாவது ஒரு பொருளின் வினை பயன் மெய் உரு முதலியவற்றால் ஒருபகுதியொத்திருத்தல்.,False
855,"மெய்ப்பாடுபற்றிக் தோன்றிவழங்குதலாவது, பொருளின் தோற்றப் பொலிவு குறித்து மக்களது முகமலர்ச்சிக்கும் ளிதிகழ்னப்புக்கும்சந்தாமரைலரும்றைமதியும்பால்வனபுமையுடையனவாகஉமக்கள்பலலும்பேசபட்டுவருத.",False
856,புலன் அல்லாதனஇதுகாறும் பொறிகளால் அறியப்படாத பொருள்கள்.,False
857,புலனாதல்விளங்கித் தோன்றுதல்.,False
858,"பாகுபடவருதலாவது, கண்முதலிய பொறிகட்குப் புலனாவனவும், பொறிகட்குப் புலனாகாது மனத்திற்குப் புலனாவனவும் என இருவகைப்பட வருதல்.",False
859,ஒருபொருளோடு ஒருபொருளை ஒப்புமை கூறி விளக்குதல் உவமம் எனப்படும்.,False
860,அகத்திணை இயலுள் உவமத்தினை உள்ளுறையுவமம் ஏனையுவமம் என இருவகையாக்கிக்கூறினார்.,False
861,அவ்விரண்டினையும் விரித்துக்கூறுவது இவ்வுவமவியலாகும்.,False
862,உலகவழக்கிலுஞ்செய்யுள் வழக்கிலும் வருவது ஏனையுவமமாகலின் அதனை இவ்வியலின் முற்கூறினார்.,False
863,எனவே எழுத்திகாரத்திலும் சொல்லதிகாரத்திலும் செய்யுட்குரிய விதிகளைத் தனித்தெடுத்துக் கூறியதுபோலவே இப்பொருளதி.,False
864,காரத்தும் தனித்தெடுத்துக் கூறியுள்ளமை ஒருவகையாற் புலனாம்.,False
865,யாப்புடைமைநோக்கி பரப்புடைமை நோக்கி எனவும் பாடம் .,False
866,ஆகவே மேற்பொருள்புலப்பாடு கூறிய மெய்ப்பாட்டியலோடு இயைபுடையது இவ்வுவமஇயல் ஆதலின் அதனை அடுத்து வைக்கப்பெற்றது.,False
867,இவ்வோத்தின் தலைச் சூத்திரம் இவ்வியலின் முதற்சூத்திரம்.,False
868,வினைபயன்மெய் உரு என்னும்வைப்பு முறைக்குககாரணம் கூறுவதாக அமைந்தது இவ்வுரைப்பகுதியாகும்.,False
869,வினையால் விளைவது பயனாதலின் இது வினையின் பிற்கூறப்பட்டது.,False
870,அதுபோல் வடிவினால் தோன்றுவது நிறமாதலின் மெய்யின்பின் உருவைக்ககப் பெற்றது.,False
871,பயன் என்பதும் பொருளாதலால் மெய்யினையும் வடிவென்னும் பொருளினையும் அதனுடன் வைத்தார்.,False
872,"புலியன்னமறவன் என்பது, புலிபாயுமாறேபாய்வன் என்னுந்தொழில் பற்றி ஒப்பித்தமையின் வினையுவமம்.",False
873,ஆகம் மார்பு அகன்று காட்டுதல்விரிந்து தோன்றுதல் அஃகித்தோன்றுதல்சுருங்கித் தோன்றுதல் .,False
874,"உவமத்தோற்றம் என்பது, உவமத்தாற்பொருள் தோன்றும் தோற்றம் என விரிதலின், மூன்றாம் வேற்றுமைத் தொகையாகும்.",False
875,இது பொருளாராய்ச்சி பற்றி அதிகாரமாதலால் கட்புலனாம் பண்பாகிய வண்ணத்தினையும் உற்றுணரும் பண்பாகிய வடிவினையும் ஆசிரியர் வேறாகப்பகுத்துரைத்தார்.,False
876,இவ்வாறு பகுத்துரையாது வடிவும் வண்ணமும் ஒன்றாகக்கூறின் பகற்குறிக்கட்கூறப்படும் வண்ணம் முதலாயினவும் பண்பென்னும் பொதுவகையான் இரவுக்குறிக்கண் எய்துவான் செல்லும்.,False
877,ஆதலால் அது பண்பென அடங்காது.,False
878,"பாவையியல் கற்றன்னவொழுக்கினள் எனவடிவுபற்றி உவமங்கொள்ளுங்கால் வடிவுபண்பி பண்புடையபொருள் ஆதலின், அது பண் பெனப்படாது.",False
879,"அளவு, சுவை, தண்மை, வெம்மை, நன்மை, தீமை, சிறுமை, பெருமை முதலாயினபற்றியும் உவமம் வரும்.",False
880,பண்பிழிபாகலின் என்பது பண்பியாகலின் என்றிருத்தல் வேண்டும்.,False
881,குறித்த பருவங்கழிந்ததென்னும் பொருண்மை விளங்கிற்று உருவுவமம்!,False
882,என மேலுள்ள தொடருடன் இயைத்து முடிக்க.,False
883,ஒலித்தல் வினைபற்றி எனத்திருத்துக.,False
884,"நோக்கினாற் கொல்வான்போல் கடைக்கண்ணால் நோக்கினன், என்பார் கடைக்கண்ணாற் கொல்வான்போல் நோக்கி என்றமையின் இது வினையுவமத்தின் வகையெனப்படும்.",False
885,கொடைப்பொருள் இரண்டும் ஒத்தமையின் மெய்யுவமம் எனப்படாது கொள்வார்க்குப்பயம் ஒத்தலாற் பயவுவமத்தின் வகையாயிற்று.,False
886,நிலம் போலும் கொடை என்பதும் அது என இயைத்துப் படித்தல் பொருத்த முடையதாகும்.,False
887,அஃது அன்னவாகலின் என்பது அஃது அளவாகலின் என்றிருத்தல் பொருட்பொருத்தமுடையதாகும்.,False
888,இனி அன்மையும் சேய்மையும் அளவு என்னும் குணமாதல் ஒப்புமையால் அவை நிறப்பண்பிற்கு இனமெனவுங்கொள்ளப்படும்.,False
889,இனி அண்மையும் சேய்மையும் அளவு என்னும் குணமாதல் ஒப்புமையால் அவை நிறப்பண்பிற்கு இனமெனவுங் கொள்ளப்படும்.,False
890,"விரவுதல்கலத்தல் அஃதாவது, வினை பயன் மெய் உரு எனமேற் குறித்த ஒப்புமைப்பகுதிகளுள் இரண்டும் பலவும் கலந்து வருதல்.",False
891,இதுவே ஓத்தாகஇதுவே ஓதப்பட்ட விதியாக.,False
892,விரவுதல் கலத்தல் .,False
893,உயர்தல் வினைபயன் மெய் உரு எனச்சொல்லப்பட்ட ஒப்புமைத்திறத்தால் உயர்தல்.,False
894,துப்புடையன வலிமையுடையன.,False
895,"அரிமாசிங்கம், உழுவைபுலி, ஆணி யூசியென்றது போழ்தூண்டூசியினை.",False
896,"முன்னத்தில் உணருங்கிளவியாவது, சொல்லுவான் குறிப்பாற்பொருளுணரப்படுஞ் சொல்.",False
897,"என்யானை, என்பாவை என்புழி யானை எனவும் பாவை எனவும் குறிக்கப்பட்டோர் யானைபோல்வானாகிய மைந்தனும் பாவைபோல்வாளாகியமகளும் ஆவர்.",False
898,அவை முன்னத்தான் உவமஞ்செய்தன.,False
899,செய்யுள் செய்வார் உவமத்தாற்செய்யும் பொருட்படைப்பகுதி எண்ணிறந்தன வாகலின்.,False
900,இத்தகையகுறிப்புவமைகளை இக்காலத்தார் உருவகமென்றே வழங்குவர்.,False
901,மதிங் கொல்லோ மறுவில்லையென்று உவமைக்குக்குறைபாடு கூறுதல் விலக்குவமையின்பாற்படும்.,False
902,நிலைக்களம்உவமம் கூறுதற்கு அடிப்படையான உணர்வு நிலையாகிய இடம்.,False
903,"படுத்துபொருத்தி, பகுத்து என்றிருத்தலும் பொருந்தும், .",False
904,கிழககிடு பா.வே.,False
905,"உயர்ந்ததன்மேற்றேயுள்ளுங்காலை என உவமேயமாகிய பொருளிலும் உவமையினை உயர்ந்ததாக வைத்துரைத்தலின், இச்சூத்திரத்திற் கிழக்கிடுபொருள் என்றது.",False
906,ஒரு பொருளினது இழிவினைக்கூறுவான் உவமையினால் அதனைப் புலப்படுத் தலின் அவ்விழியும் உவமைக்கு நிலைக்களமாயிற்று.,False
907,அவ்வாறு இங்கு உவமைக்கு நியமமில்லையென்றவாறாயிற்று என்றிருத்தல் பொருட்பொருத்தமுடையதாகும்.,False
908,விசும்பு என்பது அருவப்பொருளாதலின் அதற்கு முதல் சினை என்னும் வடிவகுப்பு இல்லை.,False
909,எனவே அதனை முதற்பொருளாகவே கருதியுணர்தல் வேண்டும்.,False
910,"இலேசுகொண்டுரைப்ப என்றது, சொல்லதிகாரம் இளம்பூரணர் உரையைக் குறித்தது போலும், செப்புமிடத்தும் வினாவுமிடத்தும் சினைக்கிளவிக்கும் முதற்கிளவிக்கும் முதலொடு முதலே பொரூஉக.",False
911,"சினையொடு சினையே பொரூஉக எனவும், அப்பொருளாகும் என்றானா தலின் அவ்வச்சினைக்கு அவ்வச்சினையேபொரூஉக.",False
912,"என்றது இது முதற்கும் ஒக்கும் என உரைவரைந்த இளம்பூரணர், இச்சூத்திரத்தில்.",False
913,"சினையை முற்கூறிய முறையன்றிக் கூற்றினால் முதலுஞ்சினையும் உறழ்ந்து வருவனவும் உள, குணமருங்குபற்றி என இலேசினாற் கொண்டார்.",False
914,எடுத்தோதது இவ்வழியே உயத்துணர்வதாதலின் எனவரும் உரைத்தொடர் இங்கு நினைத் தற்குரியதாகும்.,False
915,உவமவாய்பாடு தோன்ற உவமம் பொருட்குப்புணராக்கண்ணும் உவமைஉள எனத் திருத்திப் படித்தல் பொருள் விளக்கத்திற்கு ஏற்புடையதாகும்.,False
916,"சுட்டிக்கூறாவுவமம் என்பது, உவமைக்குகும் உவமேயத்திற்கும் பொதுவாகிய ஒப்புமைக்குணத்தினைக் குறிப்பிட்டுரைத்தலின்றிப் பவளவாய் என்றாங்குத் தொகுத்துக் கூறும் உவமம்.",False
917,ஒத்தது அறிவான் குறள்.,False
918,"என்புழிப்போல இங்கு ஒத்தல் என்றது, உலகநடையுடன் ஒத்து அமைதலை.",False
919,உமேயம் எனப்படும் பொருளையே உவமையாக்கிக்கூறினாலும் மயக்க மற்ற சிறப்புநிலைமையால் அஃது உவமமாகவே நின்று பொருள் புலப்பாட்டிற்குப் பயன்படும் என்பதாம்.,False
920,"பொருளே உவமஞ்செய்தலாவது, பொருள் புலப்பாட்டுக்குரிய உவமேயமாகிய பொருளையே உவமையாக்கி உலகத்தார் மரபாக வழங்கும் உவமையை உவமிக்கப்படும் பொருளாக்கிக் கூறுதல்.",False
921,தாமரைபோன்று மலர்ந்தமுகம் என்புழிமுகம் என்பது உவமிக்கப்படும் பொருள்.,False
922,தாமரை என்பது முகத்திற்கு உவமை.,False
923,இங்ஙனம் உவமம் கூறுதலே இயல்பானமரபு.,False
924,"அஃது என்பது, அஃதேல் என்றிருத்தல் பொருத்தமாகும்.",False
925,"ஒப்பமுடிதல் ஆவது, உலகிற்பெரும்பாலோரால் உடன்பட்டு ஏற்றுக் கொள்ளப்படுதல்.",False
926,"சிறப்பிற்றீராக்குறிப்பு என்றது, உவமையின் ஐவகை நிலைக்களன்களுள் ஒன்றாகிய சிறப்பென்னும் நிலைக்களத்தின் நீங்காக்குறிப்பொடுகூடிவரும் வழக்கு நெறிப்பயிற்சியினைக் குறிப்பதாகும்.",False
927,இறப்ப இழிதல்மிகச் சிறியதாதல் இவையும் பெருமையுஞ்சிறுமையுஞ் சிறப்பிற்றீராக் குறிப்பின்வந்த வழக்காதல் அமைந்தனவென்பதுஎன இத்தொடர் அமைந்திருத்தல் வேண்டும்.,False
928,ஆறாறவையும் என்றிருத்தல் வேண்டும்.,False
929,என்பது பேராசிரியருரையில் புலானம்.,False
930,உவ வுருபுகள் வினைபயன் மெய்உரு என்னும் பலவகைப்பொருள்களைக் குறிப்பான் உணர்த்திநிற்றலின் இவ்வுருபுகளைச் சொற்கள் எனக்குறித்தார் இளம்பூரணர்.,False
931,சொல் என்றது உவமவுருபினை.,False
932,தேன்போல இனியமொழி என்புழிப் போல வென்னும் உவச் சொல்லும் இனிமை என்னும் பொதுத்தன்மையும் விரிந்துநின்றன.,False
933,தேன் போலும் மொழி என்புழிப்போலும் என்னும் உவமச்சொல் விரிந்தும் இனிமையாகிய ஒப்புமை தொக்கும் நின்றன.,False
934,தேமொழி என்புழி உவமச் சொல்லும் பொதுத் தன்மையும் ஒருங்கே தொக்கன.,False
935,ஒப்பித்தல் ஒப்புமை கூறிவிளக்குதல்.,False
936,இனைத்து இத்தொகையினது.,False
937,இச்சூத்திரத்தில் எண்ணப்பட்ட முப்பத்தாறு உருபுகளும் வினைபயன் மெய் உரு என்னும் நான்கு உவமத்திற்கும் பொதுவாகும்.,False
938,"உவமச்சொல்லே வரம்பிகந்தனவே எனவரும் இந்நூற்பா, எந்த நூலுக்குரிய தெனக் தெரியவில்லை.",False
939,கயமூழ்கு மகளிர் கண்ணின் மானும் குறுந்.,False
940,வரைவு இன்றி வினை பயன் மெய் உரு என்பவற்றுள் இன்னவகைக்கு உரியது என்னும் வரையறையின்றி.,False
941,ஐம்தாம்வேற்றுமைப்பொருள் வந்த உவமங்களும் உவமவுருபு தொகைப் படாமையின் உவமத்தொகையெனப்படா என இயையும்.,False
