Line Number,Sentence
1853,அடும்புக் கொடிகள் படர்ந்து கிடக்கும் அக் கொடிகளில் உள்ள இலைகள் குதிரையின் குளம்பைப் போலப் பிளவுபட்டுக் காணப்படும்.
1854,அக் கொடிகளிலே பூத்திருக்கும் மலர்களோ குதிரையின் கழுத்திலே போட்டிருக்கும் மாலையில் உள்ள மணிகளைப் போலக் காணப்படும்.
1855,இவ்வாறு பெண்கள் விளையாடிக் கொண்டிருப்பார்கள்.
1856,"பல பறவைகள், கடலிலும் கடற்கரையிலும் பறந்தும், உட்கார்ந்தும், ஓசையிட்டுக் கொண்டிருக்கும்."
1857,இத்தகைய காட்சியையுடையது கடற்கரை.
1858,பதவுரை தோழி மான் அடி அன்ன குதிரையின் பாதத்தில் உள்ள குளம்பைப் போல.
1859,கவட்டு இலை அடும்பின் பிளவுபட்ட இலைகளையுடைய அடும்பங் கொடிகளில் உள்ள.
1860,தார் மணி அன்ன குதிரையின் கழுத்தில் கட்டிய மாலையில் உள்ள மணி போன்ற.
1861,ஒள்பூ கொழுதி ஒளி பொருந்திய மலர்களைக் கையால் வலிந்து மலரச் செய்து.
1862,ஒள் கொடி மகளிர் ஒளி பொருந்திய வளையல்களை அணிந்த பெண்கள்.
1863,வண்டல் அயரும் விளை யாடுகின்ற.
1864,புள் இமிழ் பறவைகள் ஒலித்துக் கொண்டிருக்கின்ற.
1865,பெரும் கடல் சேர்ப்பனை பெரிய கடற்கரையின் தலைவனை.
1866,உள்ளேன் இனி நினைக்கமாட்டேன்.
1867,என் கண் ஏ படீயர் என் கண்களே இனி நன்றாக உறங்குவனவாக.
1868,கருத்து தலைவனை நினைக்காமலிருக்க முடியவில்லை.
1869,ஆதலால் என் துன்பமும் தணியவில்லை.
1870,விளக்கம் இது நம்பி குட்டுவன் என்னும் புலவர் பாட்டு.
1871,தலைவியின் துன்பத்தைக் கண்டு நீ பொறுத்திருக்க வேண்டும்.
1872,என்று வலியுறுத்திய தோழிக்குத் தலைவி கூறியது.
1873,என் கண் படீஇயர் என்று இறுதித்தொடர் மட்டும் மாற்றப்பட்டது.
1874,படீஇயர் உயிர் அளபெடை.
1875,ஏ அசை.
1876,மான் குதிரை.
1877,தார் மாலை.
1878,கொழுதி கையால் கோதி.
1879,இமிழ் ஒலிக்கின்ற.
1880,அடும்பின் இலைக்குக் குதிரைக் குளம்பு உவமானம்.
1881,அடும்பு மலருக்கு மாலையில் உள்ள மணி உவமானம்.
1882,அடும்புக் கொடி படர்ந்து கிடக்கும்.
1883,அதன் இலைகள் குதிரைக் குளம்புகள் போன்றவை.
1884,அதன் மலர்கள் மாலையில் தொடுத்த மணிகள் போல் காணப்படும்.
1885,பெண்கள் அம்மலர்களை அலர்த்தி விளையாடிக் கொண்டிருப் பார்கள்.
1886,பறவைகள் பல ஓசையிட்டுக் கொண்டிருக்கும்.
1887,இக் கடற்கரையின் காட்சி.
1888,இக் காட்சியை இச் செய்யுள் அப்படியே படம் பிடித்துக் காட்டியிருக்கின்றது.
1889,காதலன் மணந்து கொள்வான் பாட்டு காதலனுக்கும் காதலிக்கும் சந்திப்பு ஏற்பட்டுப் பல நாட்களாயின.
1890,காதலியைக் காவலிலே வைத்துவிட்டனர்.
1891,ஆதலால் அவளைச் சந்திக்க காதலனால் முடியவில்லை.
1892,நீண்ட நாள்கள் காதலனைப் பற்றிய செய்தி ஒன்றும் காதலிக்கு தெரியவில்லை.
1893,அதனால் அவள் கவலைப்பட்டாள்.
1894,காதலன் தன்னை மறநது விட்டானோ?
1895,கை விட்டானோ?
1896,என்பதுதான் அவள் கவலை.
1897,காதலன் சும்மா இருக்கவில்லை.
1898,காதலியின் பெற்றோரிடம் பெண் கேட்டு விட்டான்.
1899,அவர்களும் சம்மதங்கொடுத்தும் விட்டனர் விரைவில் திருமணம் நடக்கப் போகின்றது.
1900,இச் செய்தியைத் தோழி அறிந்தாள்.
1901,உடனே அவள் தலைவியிடம் உரைத்தாள்.
1902,கவலையுடன் இருக்கும் தலைவியின் உள்ளத்திலே களிப்பூட்டினாள்.
1903,இந்த நிகழ்ச்சியை எடுத்துரைப்பதுதான் இச்செய்யுள்.
1904,இச்செய்யுளிலே இரண்டு அறங்கள் அமைந்துகிடக்கின்றன.
1905,ஒன்று திறமையுள்ளவர்கள் அறமுள்ள செயல்களைச் செய்வார்கள் என்பது.
1906,மற்றொன்று இல்லத்தார் கடமை தம் சுற்றத்தினரைக் காக்கவேண்டும் என்பது.
1907,இச்சிறந்த நீதிகளைக் கொண்ட அரிய செய்யுள் இது.
1908,வேங்கை மரத்தின் வலிமையான கிளை களிலிருந்து நிறைந்த மலர்கள் கீழே சிந்திக்கிடக்கும்.
1909,அந்த மலர்களை மெல்லிய படுக்கையாகக் கொண்டு யானைகள் உறங்கும்.
1910,அப்பொழுது அவைவிடும் குறட்டை ஒலி கேட்கும்.
1911,இத்தகைய சிறந்த நாட்டின் தலைவன் நம்மை மறந்து விடவில்லை.
1912,அவனுடைய மார்பைத் தழுவிக்கொண்ட குற்றமற்ற நட்பு வீணாகி விடவில்லை.
1913,அந்த நட்பு மிகவும் அழகானது.
1914,அந்த நட்பின் பயனை விரைவில் அடையப் போகின்றோம்.
1915,திறமையுள்ளவர்கள் தீமை தரும் செயல்களைச் செய்யமாட்டார்கள்.
1916,அவர்கள் செய்வது அறத்தை அடிப்படையாகக் கொண்டதாகத் தான் இருக்கும்.
1917,நமது காதலர் திறமையுள்ளவர் ஆதலால் அவர் நல்லது செய்யவே துணிவுகொண்டார்.
1918,"அவர் செய்யும் இச்செயல் நமது உறவினர்க்கு ஒரு ஆதரவாகவும், பற்றுக்கோடாகவும், இருக்கப் போகிறது."
1919,இவ்வுண்மையை நான் அறிந்தேன்.
1920,ஆதலால் நீ வருந்தாமல் இரு.
1921,வேங்கை வேங்கை மரத்தின்.
1922,வீயாமென்சினை கெடாத மெல்லிய கிளைகளில் உள்ள.
1923,வீ உக மலர்கள் கீழே விழுந்துகிடக்க.
1924,யானைகள் ஆர்துயில் அம் மலர்களின் மேல் யானைகள் படுத்துறங்கும்போது விடும் மூச்சுக் காற்றின் ஒலி.
1925,இயம்பும் எங்கும் கேட்கின்ற.
1926,நாடன் சிறந்த மலைநாட்டையுடைய தலைவனுடைய.
1927,மார்பு உரித்தாகிய மார்பைத்தழுவும் உரிமை பெற்றதான.
1928,மறு இல் நட்பு ஏ குற்ற மற்ற உறவானது.
1929,எழில்மிக உடையது மிகவும் அழகுடைய தாயிற்று.
1930,ஈங்கு அணிபடும் அந்த நட்பின் பயன் இங்கே விரைவிலே கைகூடும்.
1931,திறவோர் செய்வினை திறமையுள்ளவர் செய்கின்ற காரியம்.
1932,அறவது ஆகும் அறமுடையதாகவே இருக்கும்.
1933,கிளையுடை மாந்தர்க்கு உறவுத்தன்மையுள்ள மக்களுக்கு.
1934,புனையுமார் இல் ஆதரவாகவும் இருக்கும் இச்செயல்.
1935,என ஆங்கு அறிந்திசின் என்று அங்ஙனம் அறிந்துகொண்டேன்.
1936,கருத்து தலைவன் விரைவிலே வந்து உன்னை மணந்து கொள்வான் மனம் வருந்தாதே.
1937,விளக்கம் இது சேந்தம் பூதன் என்னும் புலவர் பாட்டு.
1938,இதை நான் அறிவேன் என்று தோழி கூறிய உறுதி மொழி.
1939,படூஉம் உ உயிர் அளபெடை.
1940,ஏ அசை.
1941,அணிபடும் அண்மையில் உண்டாகும்.
1942,திறவோர் திறமை உள்ளவர் நீதி நூலோர்.
1943,புணை தெப்பம் ஆதரவு.
1944,அறிந்திசின் அறிந்தேன்.
1945,"வீயா கெடாத, வீ மலர்."
1946,ஆர் பொருந்திய.
1947,தாய்க்குத் தலைவனைத் தெரியும் பாட்டு காதலனை இரவிலோ பகலிலோ சந்திக்கமுடியவில்லை.
1948,அவன் இன்னும் தன்னை மணம் பேசி வந்ததாகவும் தெரியவில்லை.
1949,அவன் விரைவில் மணப்பேன் என்று கூறிய உறுதிமொழியை அவன் நிறைவேற்றுவதற்கு என்ன முயற்சி எடுத்துக்கொண்டான் என்றும் தெரியவில்லை.
1950,இதனால் தலைவி உள்ளம் வருந்தி யிருந்தாள்.
1951,ஆனால் தலைவியைப் பெற்ற தாய் சும்மா விருக்கவில்லை.
1952,தன் மகள் துன்பத்தைக் கண்டு தெய்வக்கோளாறோ என்று வருந்தினாள்.
1953,ஆதலால் வேலனுக்குப் பூசை போட்டாள்.
1954,வெறியாடும் வேலன் உண்மையைச் சொல்லிவிட்டான்.
1955,உன் மகளுக்கு வேறு எத்துன்பமும் இல்லை.
1956,முருகன் போன்ற ஒரு இளைஞன்மேல் காதல் கொண்டாள்.
1957,அதுதான் அவளது மாற்றத்திற்குக் காரணம் என்று சொல்லிவிட்டான்.
1958,தாயும் அன்று முதல் தன் மகள் காதலித்த மணாளனைத் தேடிக் கண்டுபிடிக்க முயன்று கொண்டிருக்கிறாள்.
1959,இது தோழிக்குத் தெரியும்.
1960,வருந்தியிருக்கும் தலைவியினிடம் தோழி இச்செய்தியைக் கூறி அவள் துன்பத்தை அகற்றுகின்றாள்.
1961,இந்த நிகழ்ச்சியை உரைப்பதே இச்செய்யுள்.
1962,கடற்கரைச் சோலையிலே அடும்புக்கொடிகள் படர்ந்துகிடக்கின்றன.
1963,மணற்குவியல் வர வர உயர்ந்து கொண்டே போகிறது.
1964,கோடைக் காற்று மணலைக்கொண்டு வந்து குவிப்பதனால் அக்குவியல் உயர்கின்றது.
1965,மணற்குவியல் உயர்வதனால் அங்கே வளர்ந்திருக்கின்ற பனைமரங்களின் அடிப்பாகம் மணலிலே புதைகின்றது.
1966,அதனால் அம்மரங்களின் உயரம் குறைகின்றது குள்ளமாகின்றது.
1967,ஆதலால் நாம் விரும்பும் அந்தத் திருமண நாள் இனிவராமலிருக்க முடியாது விரைவில் வரப்போகின்றது.
1968,அக்காதலன் மார்பைத் தழுவி இன்புறுக என்று கூறும் நாள் நெருங்கி வந்துகொண்டிருக் கின்றது.
1969,இப்படிப்பட்ட காலத்தில் உனக்கு ஏன் துன்பம் உண்டா கின்றது?
1970,நீ துன்புறுவது தகாது இன்புறும் நாள் நெருங்கிக் கொண்டிருக்கும் போது யாரேனும் துன்புறுவார்களோ?
1971,"பாட்டு அதுவரல் அன்மையோ அரிதே, அவர் மார்பு உறுக என்ற நாளே குறுகி, ஈங்கு ஆகின்றே தோழி!"
1972,பதவுரை தோழி தோழியே.
1973,கானல் கடற்கரைச் சோலையில் உள்ள.
1974,ஆடு அரை புதைய அசைகின்ற அடி மரம் புதையும் படி.
1975,கோடையிட்ட மேல் காற்றால் கொண்டுவந்து குவிக்கப்பட்ட.
1976,அடும்பு இவர் அடும்புக் கொடிகள் படர்ந்த.
1977,மணல் கோடு ஊர் மணல் குவியல் மேலும் உயர்ந்ததனால்.
1978,நெடும்பனை நீண்டபனை மரங்கள்.
1979,குறிய ஆகும் குட்டையாகப் போகும்.
1980,துறைவனை கடல் துறையையுடைய நமது தலைவனைப் பற்றி.
1981,பெரிய கூறி தெய்வச் செயலால் சேர்ந்ததென்று கூறியதனால்.
1982,"யாய் அறிந்தனள் ஏ தாய், தலைவன் இன்னார் என்று தெரிந்து மணத்திற்கான ஏற்பாடுகளைச் செய்து கொண்டிருக்கின்றாள்."
1983,அது ஆகையால் அத்திருமணம்.
1984,வரல் அன்மையோ அரிது ஏ வராமல் இருப்பதில்லை.
1985,அவன் மார்பு உறுக என்ற நாள் ஏ அவன் மார்பைத்தழுவி இன்புறுக என்று கூறும் நாள்.
1986,குறுகி நெருங்கி வருகின்றது.
1987,ஈங்கு ஆகின்று ஏ நீ இங்கு இவ்வாறு வருந்தியிருப்பது தகாது மகிழ்ந்திரு.
1988,கருத்து விரைவில் திருமணம் நடக்கப்போகின்றது.
1989,இச் சமயத்தில் நீ துன்பத்தைப் பொறுத்துக் கொள்ளாமலிருப்பது நன்றன்று.
1990,விளக்கம் இது உலோச்சன் என்னும் புலவர் பாட்டு.
1991,திருமணம் நடைபெறும் நாள் நீண்டு கொண்டே போயிற்று.
1992,அதனால் தலைவி வருந்தியிருந்தாள்.
1993,அப்பொழுது அவளை நோக்கித் தோழி கூறியது இச்செய்யுள்.
1994,கரை அடிமரம்.
1995,கோடை மேல் காற்று.
1996,ஊர உயர.
1997,பெரிய கூறி தெய்வத்தால் நேர்ந்தது என்ற பெரிய உண்மையைச் சொல்லி.
1998,இக்குறிப்பு இச்செய்யுளில் அடங்கியிருக் கின்றது.
1999,மணல் மேடு உயர உயரப் பனை மரத்தின் உயரம் குறுகுவது இயற்கை.
2000,மலைக்காட்சியால் மனத்துயர் நீங்கினேன்.
2001,பாட்டு தலைவன் பொருள் தேடப் பிரிந்தான்.
2002,அப்பொழுது தலைவி யிடம் வேறுபாடு காணப்பட்டது.
2003,அவள் நெற்றியிலே பசலை நிறம் படரத் தொடங்கியது.
2004,முகத்திலே கவலைக்குறி தோன்றியது.
2005,அதைக் கண்ட தோழியின் உள்ளமும் வருந்தியது.
2006,தலைவன் பிரிகின்ற இப்பொழுதே நின் அழகு குன்றுகிறது.
2007,உன் மேனியின் நிறத்திலே மாறுதல் காணப்படுகின்றது.
2008,"இப்பொழுதே இப்படி யானால், தலைவனைப் பிரிந்திருக்கும் காலம் முழுவதும் உன்னால் துக்கத்தைத் தாங்கிக் கொண்டிருக்க முடியுமா?"
2009,அதற்கேற்ற ஆற்றல் உனக்கு உண்டா?
2010,என்று கேட்டாள் தோழி.
2011,உடனே தலைவி நான் தலைவனது குன்றத்தைப் பார்த்து உளத்திலே மகிழ்ச்சி அடைகின்றேன்.
2012,அக்குன்றத்தின் காட்சி என் மனக் கவலையை வளர விடாமல் தடுக்கின்றது.
2013,நானும் மனத்துயரம் நீங்கினேன்.
2014,இப்பொழுது என் நெற்றியைப் பார்.
2015,"தலைவன் பிரிவதற்கு முன் எப்படி அழகுடன் விளங்கியதோ, அத்தகைய அழகுடன் விளங்கவில்லையா?"
2016,நான் இனி நெஞ்சம் துணுக்குற மாட்டேன்.
2017,காதலனுடைய மலைக்காட்சியை இங்கு இருந்தபடி கண்டு என் துன்பத்தை அடக்கிக் கொண்டிருப்பேன்!
2018,தலைவியின் இக்கூற்றை எடுத்துரைப்பதே இச்செய்யுள்.
2019,கூட்டமாக மயில்கள் உட்கார்ந்து மேகங்கள் வானத்திலே தவழ்வதைக் கண்டு ஆனந்தமாக அகவிக்கொண்டு இருக்கின்றன.
2020,இத்தகைய மயில்கள் நிறைந்த மரங்கள் நெருங்கியசோலை.
2021,"இச் சோலையிலே வெள்ளை முகத்தையுடைய கருங்குரங்களும், இருக்கின்றன."
2022,அவை தங்கள் குட்டிகளுடன் குளிர் தாங்காமல் நடுங்கும்படி ஓவென்ற இரைச்சலுடன் மழை பொழிகின்றது.
2023,இத்தகைய மலைச்சாரலையுடைய அவர் நாட்டில் உள்ள அவருடைய மலையை நோக்கினேன்.
2024,அம்மலையில் உள்ள இனிய காட்சி என் உள்ளத்தைக் கவர்கின்றது.
2025,அதனால் நான் அவர் பிரிந்த துக்கத்தை மறந்தேன்.
2026,இப்பொழுது எனது நெற்றியைப் பார்.
2027,அவர் பிரியாமல் என்னுடன் சேர்ந்திருந்த போது எப்படி அழகாக விளங்கிற்றோ அப்படியே அழகாக விளங்கவில்லையா?
2028,பண்டை அற்றோ!
2029,கண்டிசின் நுதலே!
2030,பதவுரை தோழி தோழியே!
2031,இனமயில் அகவும் கூட்டமாக மயில்கள் உட்கார்ந்து ஆரவாரித்துக் கொண்டிருக்கின்ற.
2032,மரம் பயில் கானத்து மரங்கள் நெருங்கியிருக்கின்ற காட்டிலே.
2033,நரைமுக ஊகம் வெளுத்த முகத்தையுடைய கருங்குரங்கு.
2034,பார்ப்பொடு பனிப்ப தம் குட்டியோடு குளிரால் நடுங்கும்படி.
2035,படு மழை பொழிந்த ஒலியுடன் மழை பெய்த.
2036,சாரல் மலைச் சாரலையுடைய.
2037,அவர் நாட்டு அவருடைய நாட்டில் உள்ள.
2038,குன்றம் நோக்கினேன் மலையைப் பார்த்தேன்.
