Line Number,Sentence
1,தமிழமுது மறு பதிப்பு தாள் . கி.
2,மேப்லித்தோ அளவு தெம்மி பக்கம் படிகள் விலை உரூ.
3,நூலாக்கம் டெலிபாய்ண்ட் சென்னை .
4,அட்டை வடிவமைப்பு வி.
5,"சித்ரா அச்சு வெங்கடேசுவரா ஆப்செட் பிரிண்டர் இராயப்பேட்டை, சென்னை ."
6,"பதிப்புரை ஆம் நூற்றாண்டின் இறுதிப்பகுதியும், ஆம் நூற்றாண்டின் தொடக்கப்பகுதியும் தமிழ்ப்புலமையும் தமிழாய்வும் மேலோங்கி வளர்ந்த பொற்காலமாகும்."
7,இப் பொற்காலப் பகுதியில்தான் தமிழ்ப்பேரவைச் செம்மல் பெருந்தமிழறிஞர் க.
8,வெள்ளைவாரணனார் தோன்றி வளர்ந்து வாழ்ந்து தாய்மொழித் தமிழுக்கு வளமும் வலிமையும் சேர்த்தார்.
9,கைக்குக் கிடைக்கப் பெறாத நூல்களைத் தேடியெடுத்து இனிவரும் காலங்களில் வெளியிட முயல்வோம்.
10,"தம்முடைய தமிழாய்வுப்பணி மூலம் தமிழ் வரலாற்றில் நிலைத்து நிற்பவர், தமிழையும் சைவத்தையும் இரு கண்களெனக் கொண்டவர்."
11,தம் ஆய்வுப் புலமையால் பல புதிய செய்திகளையும் தமிழ் உலகுக்கு அளித்தவர்.
12,இவர் எழுதிய நூல்கள் தமிழ்உலகிற்குப் பெருமை சேர்ப்பன.
13,தமிழ் இலக்கிய வரலாற்றிற்கு கூடுதல் வரவாக அமைவன.
14,இவருடைய அறிவுச் செல்வங்கள னைத்தையும் ஆவணப்படுத்தும் நோக்குடன் தொகுத்து தமிழ் உலகிற்கு வைப்பாகக் கொடுத்துள்ளோம்.
15,எம் தமிழ்க் காப்புப் பணிக்கு துணை நிற்க வேண்டுகிறோம்.
16,பதிப்பகத்தார் அணிந்துரை டாக்டர்.
17,இராம.
18,தமிழரிலும் அப்பெருநூலைக் கற்றவர்கள் விரல்விட்டு எண்ணத் தக்கவர்களாகி விட்டனர்.
19,பேராசிரியர் க.
20,"இப்பல்கலைக்கழகத்தில் தமிழியற்புலம் என்று ஒன்று தொடங்கப்பட்ட பொழுது அதன் முதல் ஆய்வறிஞராகவும், ஒருங்கிணைப்பாளராகவும் பணிபுரிந்தவர் பேராசிரியர் க."
21,வெள்ளைவாரணனார் ஆவார்.
22,அவர்கள் இங்குப் பணிசெய்த காலத்தில் புறத்திணையியல் முதல் உவமயியல் ஈறானவற்றிற்கு மட்டுமே உரைவளம் பதிப்பை உருவாக்கினார்கள்.
23,"இந்நூல் வரிசை சிறந்த அமைப்புடையதாய், இளம்பூரணர் முதல் சோமசுந்தர பாரதியார் வரையிலான உரைகளை உடைய தாய்த் திகழ்கின்றது."
24,ஒவ்வொரு நூற்பாவின் இறுதியிலும் உள்ள வெள்ளைவாரணரின் ஆய்வுரைக் கருத்துத் தெளிவுதந்து தொல்காப்பியக் கல்விக்கு வழிகாட்டுவதாய் அமைகிறது.
25,"மேலும், வெள்ளைவாரணனார் தாம் தந்திருக்கும் அடிக்குறிப்புக்களின்வழி மூலத்திலும் உரையிலும் கண்டிருக்கும் பிழைபாடுகளை நீக்கத் துணைபுரிகின்றார்."
26,ஆராய்ச்சியாளர்களுக்கும் மாணவர்களுக்கும் இப்பதிப்புக்கள் பெரிதும் பயன்படும்.
27,மதுரைக் காமராசர் பல்கலைக்கழகத்திற்கும் பேராசிரியர் க.
28,வெள்ளைவாரணனார் அவர்களுக்கும் தமிழுலகம் மிகவும் கடமைப்பட்டிருக்கின்றது.
29,இவ்வுரைவளப் பதிப்புக்களின்வழித் தொல்காப்பியக்கல்வி வளரும் வகை செய்தல் வேண்டும்.
30,அதுவே அமரராகிவிட்ட பெரும் பேராசிரியர் வெள்ளைவாரணனாருக்குத் தமிழுலகம் செய்யும் அஞ்சலியாகும்.
31,தமிழண்ணல் தமிழ்ப்பதிப்பு முன்னோடிகளை வணங்குவோம்!
32,தமிழாராய்ச்சியின் வளர்ச்சியில் புதிய போக்குகளை உண்டாக்கிய பெருமைக்குரியவர்கள் பழந்தமிழ் நூல்களைப் பதிப்பித்த அறிஞர் களேயாவர்.
33,"மேலை நாட்டார் வருகையினால் தோன்றிய அச்சியந்திர வசதிகளும், கல்வி மறுமலர்ச்சியும் புதிய நூலாக்கங்களுக்கு வழி வகுத்தன."
34,ஆறுமுக நாவலர் சிவை.
35,"தாமோதரம் பிள்ளை , உ.வே."
36,"சாமிநாதையர் ஆகியோர் தமிழ்ப்பதிப்பு முன்னோடிகளாய் விளங்கித் தமிழுக்கு வளம் சேர்த்தனர் என்று தமிழ்ப் பல்கலைக்கழகத்தின் மேனாள் துணைவேந்தர், இ."
37,சுந்தரமூர்த்தி தனது பதிப்பியல் சிந்தனைகள் எனும் நூலில் பதிவு செய்துள்ளார்.
38,இந்நூல் தொகுதிகளை வெளியிடுவதன் மூலம் தமிழ்ப்பதிப்பு முன்னோடிகளை வணங்குவோம்.
39,சுருக்க விளக்கம் அகம் அகநானூறு ஆசாரக் ஆசாரக்கோவை உ.
40,வே பாடவேறுபாடு பு.
41,வெ புறப்பொருள் வெண்பாமாலை புறம் புறநானூறு பெரும்பாண் பெரும்பாணாற்றுப்படை மலைபடு மலைபடுகடாம் முத்தொள் முத்தொள்ளாயிரம் மொழி மொழிமரபியல் யா.
42,காரிகை யாப்பருங்கலக் காரிகை யா.
43,"பொற்றடங்கண்ணி, மகள் திருமதி."
44,மங்கையர்க்கரசி திருநாவுக்கரசு கல்வி திருப்பெருந்துறைத் தேவாரப்பாடசாலை .
45,"அண்ணாமலைப் பல்கலைக்கழகம் வித்துவான் அறிஞர் கா.சுப்பிரமணியப் பிள்ளை, சுவாமி விபுலானந்தர், நாவலர் சோமசுந்தரபாரதியார் ஆகியோர் ஆசிரியர்கள்."
46,ஆய்வு மாணவர்.
47,அண்ணாமலைப் பல்கலைக் கழகம் நாவலர் சோமசுந்தர பாரதியார் வழிகாட்டி தொல்காப்பியம் நன்னூல் எழுத்ததிகாரம் ஒப்பாய்வு.
48,"காக்கை விடுதூது இந்திமொழி கட்டாயப் பாடம் எதிர்ப்பு, ."
49,தொல்காப்பியம் நன்னூல் சொல்லதிகாரம் .
50,"இசைத்தமிழ் , சிதம்பரம்."
51,"திருத்தொண்டர் வரலாறு சுருக்கம் , அரிமளம்."
52,"தொல்காப்பியப் பொருளதிகார ஆய்வு, தஞ்சாவூர் சைவசித்தாந்தச்சாத்திர வரலாறு சைவசித்தாந்தத்தத்துவத்தின் வேர்கள்."
53,"உரை அற்புதத்திருவந்தாதி, சிதம்பரம் திருவுந்தியார், திருக்களிற்றுப்பாடியார் திருப்பனந்தாள் திருமந்திர அருள்முறைத்திரட்டு சிதம்பரம் கம்பராமாயணத்தில படலங்கள் திருவருட்பயன் சென்னை."
54,அபதிப்பு பரதசங்கிரகம் அண்ணாமலைப் பல்கலைக் கழகம் சிதம்பரம் உரைவளப் பதிப்பு .தொல்காப்பியம் புறத்திணையியல் .
55,தொல்காப்பியம் களவியல் .
56,தொல்காப்பியம் கற்பியல் .
57,தொல்காப்பியம் பொருளியல் .
58,தொல்காப்பியம் உவமையியல் .
59,தொல்காப்பியம் மெய்ப்பாட்டியியல் .
60,தொல்காப்பியம் செய்யுளியல் ஆகியவை மதுரைக்காமராசர் பல்கலைக்கழக வெளியீடுகள்.
61,சிறப்புகள் .
62,சித்தாந்தச்செம்மல் தூத்துக்குடிச்சைவசித்தாந்த சபை .
63,திருமுறை ஆராய்ச்சிக் கலைஞர் தருமபுரம் ஆதீனம் .
64,திருமுறை உரைமணி காஞ்சிபுரம் ஸ்ரீசங்கரமடம் .
65,"கலைமாமணி தமிழ்நாடு இயல் இசை, நாடக மன்றம் ."
66,தமிழ்ப்பேரவைச் செம்மல் மதுரைக்காமராசர் பல்கலைக் கழகம் .
67,தமிழகப் புலவர்குழு உறுப்பினர் .
68,திருச்சிராப்பள்ளித்தமிழ்ச்சங்கத் திரிசிரபுரம் மகாவித்துவான் மீனாட்சிசுந்தரம் பிள்ளை நினைவுப்பொற்கிழி தொல்காப்பியம் பொருளதிகாரம் செய்யுளியல் இரண்டாம் பகுதி .
69,மண்டிலங் குட்டம் என்றிவை இரண்டும் செந்தூக் கியல என்மனார் புலவர்.
70,இளம்பூரணம் என்எனின்.
71,மேற் சொல்லப்பட்டவற்றுள் மண்டிலம் குட்டம் என்பவற்றிற்குரியதோர் ஓசை வேறுபாடு உணர்த்துதல் நுதலிற்று.
72,இ ள். மண்டிலமாகக் கூறப்படும் பாவும் குட்டமெனக் கூறப்படும் பாவும் அகவலோசை இயல என்றவாறு.
73,உதாரணம் முன்னர்க் காட்டுதும்.
74,ஆசிரியப்பாவாவது பெரும்பான்மை இயற்சீரானும் ஆசிரிய வுரிச்சீரானும் ஆசிரியத்தளையானும் அகவலோசையானும் நாற்சீரடியானும் சிறுபான்மை ஒழிந்த சீரானும் தளையானும் அடியானும் வருவது.
75,அவ்வாறாதல் மேற்கூறப்பட்ட சூத்திரங்களான் உணர்க.
76,இப்பாவிற்கு ஈற்றெழுத்து வரையறுத்துணர்த் தாமையின் எல்லா வீறுமாம்.
77,எற்றுக்கு?
78,"அகவல் இசையன அகவல் மற்றவை ஏஓ ஈஆ, என் ஐ என் றிறுமே யாப், வி."
79,ப.
80,வி.
81,ப.
82,எனப் பிறவாற்றானும் வருதலின் ஈறு வரையறுக்கப்படா தென்று கொள்க.
83,இனி இவ்வாசிரியப் பாவினை அடிநிலையாற் பெயரிட்டு வழங்கலாம். அஃதாமாறு ஈற்றயலடி முச்சீரான் வருவதனை நேரிசையாசிரியம் என்ப.
84,உதாரணம் முதுக்குறைந் தனளே முதுக்குறைந் தனளே மலையன் ஒள்வேற் கண்ணி முலையும் வாரா முதுக்குறைந் தனளே யாப்.
85,வி.
86,ப.
87,எனவரும்.
88,இடையிடை முச்சீர் வரின் இணைக்குறளாசிரியம் என்ப.
89,வி.
90,ப.
91,எனவரும்.
92,எல்லா அடியும் ஒத்துவருவதனை நிலைமண்டில ஆசிரியம் என்ப.
93,இதற்கு இலக்கணம் முன்னர்க் காட்டுதும்.
94,எனவரும்.
95,இனி எல்லா அடியும் ஒத்துவரும் பாட்டினையே அடிமறிமண்டில ஆசிரியம் என்று வழங்குப.
96,இதற்கிலக்கணஞ் சொல்லதிகாரத்துள் நிரனிறைசுண்ணம் எச்சவியல்.
97,என்னும் சூத்திரத்தாற் கொள்க.
98,ப.
99,எனவரும்.
100,இதனுள் யாதானும் ஓரடியை முதலுமுடிவுமாக உச்சரித்தாலும் ஓசையும் பொருளும் வழுவாது வருதலின் அடிமறியாயிற்று.
101,இதற்கு இலக்கணம் வெண்டளை விரவியும் ஆசிரியம் விரவியும் ஐஞ்சீ ரடியும் உளவென மொழிப தொல் செய்.
102,செய்.
103,ஆசிரிய நடைத்தே வஞ்சி தொல்.
104,செய்.
105,எனவும் ஒற்றுமைப் படுத்துதலானுங் கொள்க. உதாரணம் சிறியகட் பெறினே யெமக்கீயு மன்னே புறம்.
106,இப் பதினேழடி யாசிரியத்துள் ஏழாமடியும் பன்னிரண்டா மடியும் முச்சீரான் வந்தன.
107,மூன்றாமடி முதலாக ஆறாமடி யீறாக நான்கடியும் பதினாலாமடியும் ஐஞ்சீரான் வந்தன.
108,இரண்டா மடியும் பதினொன்றாமடியும் அறுசீரான் வந்தன.
109,எனைய நாற்சீரான் வந்தன.
110,"இதனுள், உப்பிலாஅ அவிப்புழுக்கல் என்பது முதலாக மூன்றடியும் வஞ்சியடி."
111,இனி வஞ்சிப்பா ஆவது வஞ்சியுரிச்சீரானும் ஏனைச்சீரானும் இருசீரடியானும் முச்சீரடியானுந் தூங்கலோசையானும் வந்து தனிச்சொற் பெற்று ஆசிரியச் சுரிதகத்தான் இறுவது.
112,இதற்கு இலக்கணம் வஞ்சிச் சீரென வகைபெற் றனவே வெண்சீ ரல்லா மூவசை யென்ப தொல்.
113,செய்.
114,தன்பா வல்வழித் தானடை வின்றே தொல்.
115,செய் வஞ்சி மருங்கின் எஞ்சிய வுரிய தொல்.
116,செய் வஞ்சி யடியே இருசீர்த் தாகும் தொல்.
117,செய் முச்சீ ரானும் வருமிடன் உடைத்தே தொல்.
118,செய்.
119,வஞ்சித் தூக்கே செந்தூக் கியற்றே தொல்.
120,செய்.
121,என்பனவற்றாற் கொள்க.
122,"இப்பா இருசீரடி வஞ்சிப்பா, முச்சீரடி வஞ்சிப்பா என இருவகைப்படும்."
123,புணையெனத் திருவுறு திருந்தடி திசைதொழ வெருவுறு நாற்கதி விடுநனி எளிதே.
124,யாப்.
125,வி.
126,பக் இது முச்சீரடி வஞ்சிப்பா.
127,கோழி எறிந்த கொடுங்காற் கணங்குழை என்பது வெண்பாவடி.
128,வயலாமைப் புழுக்குண்டு வறளடும்பின் மலர்மலைந்து என்பது கலியடி.
129,இனி வெண்பா வாமாறும் கலிப்பா வாமாறும் முன்னர்க் காட்டுதும்.
130,"பேராசிரியம் இது, மண்டிலமுங் குட்டமும் வருமிட னுணர்த்துதல் நுதலிற்று."
131,"இள் மேற்கூறிய மூன்றனையும் இன்ன பாவென்பது உணர்த்தினான் அவற்றுள், இறுதி நின்ற மண்டிலமுங் குட்டமும் ஆசிரியப்பாவினை உறுப்பாகவுடைய எறு."
132,"எனவே, ஒத்தாழிசையாகிற் கலிப்பாவினை உறுப்பாக வுடைத்தென்பது பெறுதும் என்னை?"
133,அடிமறித்தல் பொருள்கோட்பகுதியாகலான் அஃதமையும் அங்ஙனங்கொள்ளின் நிரனிறை முதலிய பொருள்கோட்பகுதி யானுஞ் செய்யுள் வேறுபடுமென மறுக்க.
134,"இனிக் குட்டமும் இருவகைக்தென்ப, இணைக்குறளாசிரியப்பா, நேரிசை அவை அவ்வாறு கொள்ளின் யா.வி.சூ இழுக்கென்னை?"
135,செந்தூக்கென்பது பாவினைத் தூக்கெனவுஞ் சொல்லுப .
136,இயல வென்பது அப்பாவானே நடக்கு மென்றவாறு.
137,இதுவும் இன்ன செய்யுட்கு உரித்தெனப் பாவினை வரையறுத்ததாம்.
138,நச்சினார்க்கினியம் இது முற்கூறிய மண்டிலமுங் குட்டமும் ஆசிரியத்துக்குப் பெரும்பான்மை வருமென்கின்றது.
139,இள் மண்டிலங்...
140,யிரண்டும்.
141,"எது, மண்டிலங் குட்ட மென்று முற்கூறியவையிரண்டும்."
142,செந்தூக்....
143,"எது, ஆசிரியப்பாவின் கண்ணே பயில நடக்குந் தன்மையையுடைய என்று கூறுவர் புலவர்."
144,எறு.
145,"எனவே, வெண்பாவின்கண் சிறுபான்மை வருமென்றவாறா யிற்று."
146,இரண்டுமங்ஙனம் வருதல் சான்றோர் செய்யுளுட் காண்க.
147,"ஆய்வுரை இது, மண்டிலமும் குட்டமும் பயிலுமிடம் உணர்த்துகின்றது."
148,இள் மண்டிலம் குட்டம் என மேற்கூறியவை இரண்டும் ஆசிரியப்பாவின்கண்ணே பயில நடக்குந் தன்மையன என்பர் ஆசிரியர் எறு.
149,.
150,நெடுவெண் பாட்டே குறுவெண் பாட்டே கைக்கிளை பரிபாட் டங்கதச் செய்யுளோ டொத்தவை எல்லாம் வெண்பா யாப்பின.
151,இளம்பூரணம் என்எனின்.
152,வெண்பாவாமாறு உணர்த்துதல் நுதலிற்று.
153,இள். நெடுவெண்பாட்டு முதலாக அங்கதச்செய்யுள் ஈறாகச் சொல்லப்பட்டவையும் அளவொத்தவையும் எல்லாம் வெண்பா யாப்பினை யுடைய என்றவாறு.
154,"வெண்பா யாப்பாவது, வெண்சீரானும் இயற்சீரானும் வெண் டளையானும் செப்பலோசையானும் அளவடியானும் முச்சீரீற்றடி யானும் வருவது."
155,இவற்றிற்கு இலக்கணம் மேலோதப்பட்டது.
156,ஈண்டு ஓதப் பட்டன வெல்லாம் இவ்வாறு வரும் என்றவாறு.
157,இவையெல்லாம் ஓசையான் ஒக்குமாயினும் அளவானுந் தொடையானும் பொருளானும் இனத்தானும் வேறுபடுத்திக் குறியிடுகின்றார் என்றுகொள்க.
