Line Number,Sentence
1751,உடன் போனபின் இந்நால்வர்க்கும் பால்கெழு கிளவி நடக்கு மென்பதாம்.
1752,"தோழியும் உடன்பட்டுத் தலைவியை அனுப்புதலின், தோழி கூறாள்."
1753,பாங்கன் அறியவே உடன் போக்கு நிகழ்தலின் பாங்கனும் கூறான்.
1754,"ஒருகால் பாங்கனறியாமல் உடன்போக்கு நிகழின், பாங்கன் கூறுவான்."
1755,இது அருகி நிகழும்.
1756,தலைவியைக் காப்போர் .
1757,உயிரு நாணும் மடனு மென்றிவை செயிர்தீர் சிறப்பின் நால்வர்க்கு முரிய.
1758,"இது, தலைவனால் தலைவிக்கு வேறுபாடு தோன்றிய வழி, அதனைக் காத்தற்குரியோர் இவரென்கின்றது."
1759,தலைவன் பிரிவு நீட்டியாது காத்தல்.
1760,உம்மை எச்சம்.
1761,"பாங்கன், பிரிவு நீட்டியாது களவினும் கற்பினும் தலைவனைக் கூட்டுவித்துக் காப்பானாகலான், தலைவனை யொழித்துப் பாங்கனொடு நால்வர் எனினுமாம்."
1762,தலைவி உறுப்பினை உணர்ந்தபோலக் கூறல் .
1763,வண்ணம் பசந்து புலம்புறு காலை உணர்ந்த போல உறுப்பினைக் கிழவி புணர்ந்த வகையிற் புணர்க்கவும் பெறுமே.
1764,வண்ணம் பசத்தல் உடல் பசுமைநிற மாதல்.
1765,இது காதல் நோயால் ஏற்படும் நிறவேறுபாடு.
1766,"புலம்புறுதல் தனிப்படர் உறுதல் அதாவது, தலைவன் பிரியத் தனித்திருக்க ஆற்றாது துன்பமிகுதல்."
1767,புலம்பு தனிமை.
1768,படர் துன்பம்.
1769,"புணர்ந்த வகை என்றதனால், காதும் ஓதியும் முதலாயின கூறப்பெறா."
1770,கண்ணும் தோளும் மார்பும் கூறப்பெறும்.
1771,இவற்றைத் தலைவன்பாற் செலவு வரவுடையன போலக் கூறுவாள்.
1772,காட்டு .
1773,"தணந்தநாள் சால அறிவிப்ப போலும் மணந்தநாள் வீங்கிய தோள். குறள் இது, தோளினை அறிவுடையது போல் கூறியது."
1774,"கண்ணுங் கொளச்சேறி நெஞ்சே யிவையென்னைத் தின்னு மவர்க்காண லுற்று. குறள் இது, கண்ணினைத் தலைவனிடம் செல்வனவாகக் கூறியது."
1775,தலைவனைச் சேராமை .
1776,உடம்பும் உயிரும் வாடியக் காலும் என்னுற் றனகொல் இவையெனி னல்லது கிழவோற் சேர்தல் கிழத்திக் கில்லை.
1777,களவு கற்பு இரண்டினும் சேராளென்க.
1778,காதல் மிகவும் கணவனைச் சேராது வஞ்சம் போன்றொழுகல் வழுவாயினும் அமைக்க வென்பதாம்.
1779,"இது நம்மால் சிரிக்கத்தக்க இயல்பினை யுடைத்து எனத் தலைவி, இக்கண்களுக்கு என்ன வருத்தமுற்றவோ எனக் கூறியவாறு காண்க."
1780,அன்று இயற்கைப் புணர்ச்சி நடந்த போது. .
1781,தலைவி நெஞ்சொடுசாவுதல் .
1782,ஒருசிறை நெஞ்சமோ டுசாவுங் காலை உரிய தாகலும் உண்டென மொழிப.
1783,ஒரு சிறை ஒரு பக்கம்.
1784,"அதாவது, தனது நெஞ்சத்தைத் தன்னின் வேறாகக் கொண்டு வினாவுதலாம்."
1785,"உம்மையால், தோழியொடு உசாவுதலுங் கொள்க."
1786,உசாவுதல் வினாவுதல்.
1787,உணர்ப்பு வயின் வாரா ஊடல் தலைவன் உணர்த்த உணராது தலைவி ஊடல்.
1788,காட்டு .
1789,மாண மறந்துள்ளா நாணிலிக் கிப்போர் புறஞ்சாய்ந்து கண்டைப்பாய் நெஞ்சே!
1790,தலைவி மடனழிதல் .
1791,தன்வயிற் கரத்தலும் அவன்வயின் வேட்டலும் அன்ன விடங்கள்அல்வழி யெல்லாம் மடனொடு நிற்றல் கடனென மொழிப.
1792,வயின் இடம்.
1793,வேட்டல் விரும்பல்.
1794,"கரத்தல் ஒளித்தல், மறைத்தல்."
1795,"எனவே, தன்வயிற் கரத்தலும், அவன் வயின் வேட்டலு மாகிய ஈரிடத்தும் தலைவி மடனழிந்து கூறுவளென்பதாம்."
1796,மடம் சொன்னதை மெய்யெனக் கொண்டு அதை விடாமல் இருக்கும் மனவடக்கம்.
1797,மடம் மடன் போலி.
1798,வழங்கிவருதல் ஏறி வருதல்.
1799,உண்டற்குரிய வல்லாப் பொருள் .
1800,உண்டற் குரிய வல்லாப் பொருளை உண்டன போலக் கூறலு மரபே.
1801,இ ள் உண்டற்கு உரியவல்லாத பசலை முதலியன பொருளை உண்டன போலக் கூறலும் முறையேயாம் என்றவாறு.
1802,"உய்த்துக்கொண் டுணர்தலான், உண்ணப்படுதற்குரிய வல்லாத நலன், குணம் பொருளைப் பிறரால் உண்ணப்பட்டது போலக் கூறுதலுமாம்."
1803,மரபு முறை.
1804,காட்டு .
1805,பசலையால் உணப்பட்டுப் பண்டைநீர் ஒழிந்தக்கால். கலி எனவரும்.
1806,"நீர் தன்மை, அழகு."
1807,தலைவியின் அழகைப் பசலை உண்டதாகக் கூறியது காண்க.
1808,தோழியின் உரிமை .
1809,இ ள் .
1810,"தாயத்தின்அடையா பெற்றோருடைய பொருள்களாய் மக்களால் அடையமுடியாதனவும், ."
1811,"ஈயச் செல்லா பிறர்க்குக் கொடுக்க அவர்பாற் செல்லாதனவும், ."
1812,"வினைவயின் தங்கா எடுப்புப் பிள்ளைகள் போல் தனதாக்கிக் கொள்ள முடியாதனவும், ."
1813,தாயம் பெற்றோர் பொருள்.
1814,எடுப்புப் பிள்ளை வளர்ப்புப் பிள்ளை சுவீகாரம்.
1815,தனதாக்குதல் தனக்குரிய தாக்குதல் சுவீகரித்தல்.
1816,எம் என வரும் கிழமை தோற்றம் தோழி எம்முடைய என்று சொல்லும் உரிமையையுடைய தலைவி உறுப்புக்கள்.
1817,"உறுப்புப் பார்க்கப்படுதலின், தோற்றம் என்றார்."
1818,பொருள் முதலியன ஒருவர்க்குச் சொந்த மன்மையால் எம்முடைய வெனக் கூறப்படா.
1819,உறுப்புக்கள் தம்முடன் கூடியன வாகையால் எம்மெனக் கூறலாமென்பதாம்.
1820,ஒருவர் உறுப்புக்களை மற்றொருவர் எவ்வகையினும் அடையமுடியாமை யறிக.
1821,"உள என்றதனால், சிறுபான்மை தலைவி தோழியுறுப்பினைத் தன்னுறுப்பாகக் கூறுதலுங் கொள்க."
1822,நின்கண்ணால் காண்பன்மன் யான். கலி எனவரும்.
1823,வாழ்க்கையுள் இரக்கந் தோன்றக் கூறல் .
1824,வருத்த மிகுதி சுட்டுங் காலை உரித்தென மொழிப வாழ்க்கையு ளிரக்கம்.
1825,வருத்த மிகுதி ஊடல்.
1826,வாழ்க்கையுள் இரக்கமாவது நீ இவ்வாறு செய்யின் நுமது வாழ்க்கை கேடுறுமெனத் தமது வருத்தந் தோன்றக் கூறுதல்.
1827,காட்டு .
1828,"எம்மை என்றது, தன்னையும் தலைவியையும்."
1829,இல்லறத்தினைத் துறத்தல் தலைவியைப் பிரிந்து பரத்தையிடம் செல்லுதல்.
1830,ஓராவல்சி பருக்கை யற்ற கூழுணவு.
1831,சீறில் வாழ்க்கை வறுமை வாழ்வு.
1832,இனியும் நீ இவ்வாறு நடந்துவரின் அவள் தாய் வீடு செல்வள் என்பதாம்.
1833,உறழுங் கிளவியும் ஐயக் கிளவியும் .
1834,உயர்மொழிக் குரிய உறழுங் கிளவி ஐயக் கிளவி ஆடூஉவிற் குரித்தே.
1835,உறழ்தல் மாறுபடுதல்.
1836,உறழுங் கிளவி தலைவிக்கும் தோழிக்கும் உரித்தென்க.
1837,தோழி உயர்மொழி கூறியவழித் தலைவி உறழ்ந்து கூறுவள்.
1838,தலைவி உயர்மொழி கூறியவழித் தோழி உறழ்ந்து கூறுவள்.
1839,", ."
1840,தலைவன் உயர்மொழி கூறியவழித் தலைவியும் தோழியும் உறழ்ந்து கூறுவர்.
1841,காட்டு .
1842,"இது, தலைவி கூற்றுக்கு மாறாகலின் வழுவாய், தலைவன் சிறைப்புறமாகக் கேட்டு வரைதல் பயனாகலின் வழுவமைதி யாயிற்று."
1843,"சொல்லின் மறாதீவாள் மன்னோ இவள். கலி என, ஐயக்கிளவி தலைவற் குரியவாய் வந்தது."
1844,தோழி அறிவுடையளாகக் கூறல் .
1845,உறுக ணோம்பல் தன்னியல் பாகலின் உரிய தாகுந் தலைவற் குரியவாய் உரனே.
1846,உறுகண் துன்பம்.
1847,உரன் அறிவுடைமை.
1848,"அதாவது, தலைவன் பிரியக் கருதின் அப்பிரிவினால் பயனில்லையெனக் காரணங் காட்டி விலக்குதல்."
1849,ஒன்றென முடித்தலான் தலைவி உரனுடையளாகக் கூறலுங் கொள்க.
1850,தலைவி கூற்றுக் கிலக்கியம் வந்துழிக் காண்க.
1851,தோழி உயர்மொழிக் கிளவி கூறல் .
1852,உயர்மொழிக் கிளவியு முரியவா லவட்கே.
1853,"இ ள் அவட்கு தோழிக்கு, உயர்மொழிக் கிளவியும் உரிய தலைவனையும் தலைவியையும் உயர்த்துக் கூறுதலும் உரியவாம் என்றவாறு."
1854,உயர்த்தல் மிகச் சிறப்பித்தல்.
1855,ஒரோவோரிடத்து உரியவென்க.
1856,மார்பினை விலக்குதல் பிரிந்து ஆற்றியிருத்தல்.
1857,ஆற்றியிருத்தலில் வல்லள் எனத் தலைவியைச் சிறப்பித்தவாறு.
1858,"உலகம் புரப்பான் போல்வதோர் மதுகையு முடையான். கலி இது, தலைவனை உயர்த்துக் கூறியது."
1859,மங்கல முதலிய மொழிகள் .
1860,மங்கல மொழியும் வைய மொழியும் மாறில் ஆண்மையிற் சொல்லிய மொழியும் கூறியல் மருங்கிற் கொள்ளு மென்ப.
1861,"இள் மங்கல மொழியும் தலைவற்குத் தீங்கு வருமென் றஞ்சித் தலைவியும் தோழியும் அவனை வாழ்த்துதலும், ."
1862,"வைய மொழியும் தலைவன் தம்மை வஞ்சித்தானாகத் தலைவியும் தோழியுங் கூறுதலும் வைய மொழி தீங்கை உள்வைத்த மொழி, வஞ்சனை."
1863,ஆண்மை குற்றங் களைந்து குணங் கைக்கொண்டு நடத்தல்.
1864,"அதாவது, நல்லொழுக்கத்தை யாளுதல்."
1865,ஆண்மை யின்மை நல்லொழுக்கத்திற் றவறி நடத்தல்.
1866,"மங்கல மொழி பிரிவிடத்தும், ."
1867,"வைய மொழி பிரிவு நீட்டிப்பினும், ."
1868,ஆண்மையில் சொல் தலைவன் வலிதிற் புகுதல் முதலிய தவறு செய்த விடத்தும் கூறுவனவாம்.
1869,காட்டு .
1870,"நோயில ராகநங் காதலர் அகம் இது, நம்மை அறனன்றித் துறத்தலின் தீங்கு வருமென்றஞ்சி வாழ்த்தியது."
1871,நம்பொருட்டு அவர்க்குத் தீங்கு வருமென்று நினைத்தலின் வழுவமைந்தது.
1872,"வையினர் நலனுண்டார் வாராமை நினைத்தலின். கலி இது, வஞ்சித்தமை கூறிற்று."
1873,வையினர் வஞ்சகர்.
1874,வருவதாகக் கூறி நலனை யுண்டு வாராமையின் வஞ்சகர் என்றார்.
1875,வலிய எனது கூந்தலைப் பிடித்தல் உனது ஒழுக்கத்திற்கு ஏற்றதல்ல எனக் கூறுதல் காண்க.
1876,படிறு கொடுமை.
1877,மெய்ப்பாட்டமைதி .
1878,சினனே பேதைமை நிம்பிரி நல்குர வனைநால் வகையும் சிறப்பொடு வருமே.
1879,"இது, மெய்ப்பாட்டியலில் சூ ஆகாவென்பவற்றுள் சில இவ்விடத்து அமையுமென வழுவமைக்கின்றது."
1880,பொது வாகக் கூறலின் தலைவிக்கும் தோழிக்குங் கொள்க.
1881,"இ ள் சினம், பேதைமை, நிம்பிரி, நல்குரவு என்னும் இவை நான்கும் காதலைச் சிறப்பித்துக் கூறுமிடத்து வரும் என்றவாறு."
1882,"சினம் சினம், நீட்டித்தல்."
1883,பேதைமை அறிவின்மை.
1884,நிம்பிரி பொறாமை.
1885,நல்குரவு செல்வமின்மை.
1886,காட்டு .
1887,தொடிய வெமக்குநீ யாரை?
1888,"பெரியார்க் கடியரோ ஆற்றா தவர். கலி இதனுள், என்னைத் தொடாதே எமக்கு நீ யார்?"
1889,பிரியவல்ல பெரியார்க்குப் பிரிவாற்றாதவர் தலைவியர் அடியரோ? எனச் சினந்து கூறியவாறு காண்க.
1890,"இது சினம் பற்றி வரினும், தன் காதலைச் சிறப்பித்தலின் அமைந்தது."
1891,உறல் யாம் உறலியாம் தன்னை உறுதற்குரிய யாம்.
1892,காட்டலாகாப் பொருள் .
1893,"இது, காட்சிப் பொரு ளல்லாத கருத்துப் பொருளையும் காட்சிப் பொருள் போலப் பொருள் கொள்ளப்படும் என்கின்றது."
1894,மனவுணர்வா னன்றிப் பொறியான் உணரப்படா வென்பதாம்.
1895,என்றா என்பன எண்ணிடைச் சொற்கள்.
1896,"ஒப்பு ஒத்த கிழவனும் கிழத்தியும் கள என்றவழி, அவரொப்புமையை மனவுணர்வானன்றி மெய்வேறு பாடு பற்றிப் பொறியான் உணரலாகா தென்பது."
1897,"அதாவது, கண்ணால் பார்த்து இவனும் இவளும் ஒப்பர் எனக் கூறமுடியா தென்பதாம்."
1898,தந்தையர் ஒப்பர் மக்கள் என்பது மது.
1899,உரு அச்சம்.
1900,"அதுவும் பொறிநுதல் வியர்த்தல் போல்வன வற்றாலன்றி, வடிவு பற்றி உணரலாகாது."
1901,"வெறுப்பு செறிவு, மனவிறுக்கம்."
1902,அதுவும் பொறியாலு ணரலாகாது.
1903,கற்பு மனைவிக்குக் கணவனிடத்து ஏற்படும் அன்புணர்ச்சி.
1904,இது கணவற்கும் ஒக்கும்.
1905,ஏர் எழுச்சி மனவெழுச்சியாலேற்படும் உடலெழுச்சி.
1906,"இது, தன்னையறியாமல் நிகழ்வதாம்."
1907,"இது, எழுகின்ற நிலைமை என நிகழ்காலமே குறித்து நிற்கும்."
1908,"எழில் அங்ஙனம் வளர்ந்தமைந்த பருவத்தும், இது வளர்ந்து மாறிய தன்றி இன்னும் வளரு மென்பது போன்று காட்டுதல்."
1909,"அதாவது, எழுச்சியா லேற்படும் அழகுணர்ச்சி யென்க."
1910,சாயல் ஐம்பொறியால் நுகரும் மென்மை மென்மைத் தன்மையாகும்.
1911,நாண் செய்யத் தகாதனவற்றைச் செய்ய நாணுதல்.
1912,மடன் கொளுத்தக் கொண்டு கொண்டது விடாமை.
1913,"அதாவது, அடக்கம், கொளுத்த சொல்ல."
1914,நோய் நோதல்.
1915,வேட்கை பொருள்கள்மேல் தோன்றும் பற்றுள்ளம் காணும் பொருள் களையெல்லாம் தனக்குரியனவாக எண்ணுதல்.
1916,நுகர்வு இன்ப துன்பங்களை நுகரும் நுகர்ச்சி.
1917,பிறவாவன ஒளியும் அளியும் காய்தலும் அன்பும் அழுக்காறும் பொறையும் நிறையும் அறிவும் முதலியன.
1918,ஒளி அறிவு நுணுக்கம் வெள்ளறிவின்மை என்க.
1919,அளி அன்பு காரணத்தால் தோன்றும் அருள்.
1920,காய்தல் வெகுளி.
1921,அன்பு மனைமக்கள் முதலிய சுற்றத்தாரிடம் மனமகிழ்ச்சி யுண்டாக்கிப் பிணித்து நிற்கும் உணர்ச்சி.
1922,அழுக்காறு பிறர் பொருள் முதலிய கண்டு பொறாமை.
1923,அழுக்காறு பொறாமை.
1924,பொறை பிறர் செய்த தீங்கைப் பொறுத்தல்.
1925,நிறை மறை பிறர் அறியாமல் ஒழுகுதல்.
1926,மறை களவொழுக்கம்.
1927,அறிவு நல்லதன் நலனும் தீயதன் தீமையும் உள்ள வாறறிதல்.
1928,இவை எட்டும் காணப்படாப் பொருளேனும் பொருளாகக் கொள்க என்பதாம்.
1929,இவை அகத்தும் புறத்தும் வரும்.
1930,அறம்பொருளின்பம் .
1931,இமையோர் தேஎத்தும் எறிகடல் வரைப்பினும் அவையல் காலம் இன்மை யான.
1932,இள் தேவருலகத்தும் மண்ணுலகத்தும் அறம் பொருளின் பங்களின் நுகர்வில்லாத காலம் இல்லை என்றவாறு.
1933,எங்கும் என்றும் உண்டென்பது.
1934,"எனவே, அறம்பொருளின்பங்களும் காட்டலாகாப் பொருள்களேயா மென்பதாம்."
1935,தேம் இடம்.
1936,எறிகடல் வரைப்பு அலைகடல் சூழ்ந்த உலகம்.
1937,தேவருலகம் ஓரிடம்.
