Line Number,Sentence
261,சிரவண பெல்கோலாவில் காணப்படும் கல்வெட்டுக்களெல்லாவற்றிலும் இவர்கள் பிற சமயத்தவரோடு சொற்போர் செய்து பெற்ற வெற்றிச் சிறப்பையே விதந்தோதுவதைக் காண்கின்றோம்.
262,"பிற சமயத்தவர் பலரும் சைவரும், பாசுபதரும், புத்தரும் காபாலிகருமாகவே காணப்படுகின்றனர்."
263,திருஞான சம்பந்தரும் அவர்களைச் சாவாயும் வாதுசெய் சாவகர் . என்பது காண்க.
264,இவற்றால் சமண் சான்றோர் சொற்போரில் பேரார்வமுடைய ரென்பது பெறப்படும்.
265,அச்சுவகண்டன் என்பான் திவிட்டன்மேல் எறிந்த ஆழிப்படை திரும்பிப்போந்து அவ்வச்சுவகண்டனையே கொன்ற செய்திக்கு ஆசிரியர் ஓர் உவமம் காட்டுகின்றார்.
266,அவ்வுவமம் சொற்போர் பற்றியதாகும்.
267,"நெறிதலை திரிவிலான்மேல் நினைவிலான் மொழியப்பட்ட, மறுதலை முடிக்கும் ஏதுவாய் வழியழிப்பதே போல் என்பது அவ்வுவமானமாகும்."
268,பிறவும் இவர்க்குச் சொற்போர்க்கண் இருந்த வேட்கை இத்தன்மைத் தென்பதை வற்புறுத்துகின்றன.
269,"இனி, தோலாமொழித் தேவர் இந்நூல் வரலாற்றை ஆருகத மாபுராணத் திலிருந்து எடுத்தோதுகின்றார்."
270,"இதனை, செஞ்சொற் புராணத்து உரையின் வழிச்சேறும் அன்றே என்று கூறுகின்றார்."
271,"இந்நூல் உரைக்கும் நிகழ்ச்சியை, பதிப்பாசிரியராகிய சி.வை."
272,தாமோதரம் பிள்ளையவர்கள் மிகச் சுருக்கமாகவும் அழகாகவும் கூறியிருத்தலின் அதனையே ஈண்டுத் தருகின்றோம்.
273,அவை நாட்டுச் சருக்கம் நகரச் சருக்கம் முதலாகத் துறவுச் சருக்கம் முத்திச் சருக்கம் ஈறாகப் பன்னிரண்டாகும்.
274,சமண் சான்றோர் எழுதிய காவியங்களுள் இதன்கண்தான் பிற்காலச் சைவ வைணவ நூல்களுட்போல நாடுநகரச் சருக்கங்கள் தனித்தனியாக வைத்து உரைக்கப்படுகின்றன.
275,"இந்நூற்பாயிரம், நூற்பொருளும், நூலாசிரியருடைய அவையடக்கியலும், நூலரங் கேற்றமும், நூல்வந்த முறையும் விளங்கவுரைக்கின்றது."
276,தோலாமொழித் தேவர் நுண்ணிய புலமையும் அரசியல் நுட்பமும் இயற்கையழகில் ஈடுபாடும் மக்கள் மனவமைதி தேர்ந்துரைக்கும் மாண்பும் உடையவராவர்.
277,இவரது புலமை நலம் தம் மனக்கண்ணில் தோன்றும் கருத்துக்களை எடுத்துரைக்கும் திறத்தால் நன்கு புலனாகிறது.
278,பெரியோர் தமது பெருமையினைப் பொருளாக உணர்தலும் கொள்ளுதலும் செய்யார் பிறர் பால் காணப்படும் பெருமைகளையே பெரிதும் நினைந்து மகிழ்வர்.
279,"பெரியோர், தம்பாலுள்ள பெருமையால் பிறர் பாலுள்ள பெருமை யினையே காண்பர் சிறுமை அவர் கண்கட்குப் புலனாகாது."
280,"ஒருகாற் புலனாயினும், அதனைப் புறக்கணித்து மறைப்பதே அவர்க்கு இயல்பாகும்."
281,திருவள்ளுவரும் அற்றம் மறைக்கும் பெருமை என்றே கூறினர்.
282,"ஒருவர்பால் குற்றமுண்டாதற்குரிய காரணங்களுள் அவர்தம் அறிவு, அவர் மனத்தெழும் இச்சை வயப்பட்டொழுகுவதும் ஒன்றாகும்."
283,தோலாமொழித் தேவர் இச் சூளாமணியைப் பாடுதல் வேண்டுமென்று காதல் கொண்டு தம் அறிவை அக்காதற்கு அடிமைப் படுத்தி விடுகின்றார்.
284,"ஆகவே, குற்றமுண்டாதற்குரிய இடம் தோன்றி விடுகிறது."
285,"இதனைக் கூறவே, குற்றம் உளதாம் என்பதையும் அவர் உணர்ந்தாராயிற்று."
286,இவ்வாறே இவர் தம் நுண்மாண் புலமையை விளக்கும் பாட்டுக்கள் மிகப் பல.
287,இதன்கண் செறிந்துள்ளன.
288,அரசியலை எந்திரம் என்று இவர் கூறுவது போல இக்கால அரசியலும் அறிஞர்களால் எந்திரமென்று கூறப்படுவதுண்டு.
289,அரசர்க்கெனச் சிறப்பியல்கள் சில இந்நூலில் கூறப்படுகின்றன.
290,இவ்வாறு அரசியல் நலம் பற்றி இவர் கூறுவன மிக்க இன்பந்தருவனவாகும்.
291,சிறை வாழ்க்கையின் சிறுமையும் அடிமை வாழ்வின் அமைதியின்மையும் தக்காங்கு இந்நூற்கண் எடுத்துக் காட்டப்படு கின்றன.
292,"இவ்வாறே தவத்தின் மாண்பும் அருளறத்தின் சிறப்பும், பொருளின் இன்றிய மையாமையும் பிறவும் விரித்துக் கூறப்படுகின்றன."
293,அது மானமுடையார்க்கு வருத்தம் தருவ தொரு நிலையாகும்.
294,அந்நிலைமை ஒருவன் அடைவதற்குக் காரணம் இறைவனன்று அவனே என்பர்.
295,இவ்வடிமை வாழ்வு டையார் புலமை மிக்குடையரேனும் ஒருவனுக்கு ஒருத்தன் கூறக்கேட்டுற்றுச் செய்து வாழ்வது குறைவே என்பர்.
296,மகளிர் திருமணம் குறித்துக் கூறுவன இக்காலக் கொள்கைகட்கு மிகவும் ஏற்றனவாக இருக்கின்றன.
297,"நீ வளர நம் குடி, தான் அகத்து இருள்கெடத் தயங்குகின்றதே என்று கூறுகின்றார்."
298,"பெண்கள் மணமின்றியிருப்பது பெண்ணுக்கும் பெண்ணைப் பெற்றோர்க்கும் பெருமை தாராது என்பதை, பெண்ணலம் கனிந்த பேதை இருப்பதும் பெருமையன்று என்பர்."
299,"இவ்வாறே, மக்கள் இன்பவாழ்வு வாழ்தற்கு வேண்டும் அரிய கருத்துக்கள் பல இந்நூற்கண் நன்கு கூறப்படுகின்றன."
300,"இனி, தோலாமொழித் தேவர் இயற்கையின் அழகில் மிக்க ஈடுபாடுடையராய்த் திகழ்கின்றார்."
301,இயற்கையில் தோன்றுவன பலவும் மக்கள் வாழ்க்கைக்குப் பயன்படுவனவாகவே இவர் கண்ணுக்குக் காட்சியளிக்கின்றன.
302,வேனிற்கால வரவில் கோங்க மரமெல்லாம் பூத்து நிற்கின்றன அப்பூக்களில் மணமில்லை.
303,ஆயினும் பொன்னிறமான அப்பூக்களின் மிகுதி கண்ணைக் கவர்கிறது.
304,இதனை வயந்தமாலையென்னும் தோழி போந்து சடியரசனுக்கு உரைக்கலுற்று.
305,அச்செய்கை உறின் நட்டு அறின் ஒருவி நீங்கும் மக்களையும் உற்ற பொருள் நீங்கிய செல்வரையும் நினைப்பிக்கின்றது.
306,"அதனால், தேவர் செல்வரேனும் தாம் சுவை பிரிந்த பின்றைச் சார்பவர் இல்லை யன்றே என்று தெரிவிக் கின்றார்."
307,நல்ல அறிவும் ஒழுக்கமும் செம்மையுமுடைய நல்லோரிடையே நிகழ்ச்சிகள் சிறிதும் அவ்வறிவொழுக்க நெறிகளில் வழுவுதல் கூடாது.
308,"பயாபதியென்னும் வேந்தன் இக்குணநல மனைத்தும் உடையன், மாறி நின்ற வரையும் வணக்கினல்லது, சீறி நின்றெ வரையும் செகுப்பதில்லை ."
309,"இவ்வாறே சடிவேந்தன், வெச்செனச் சொல் ஒன்றுமே விடுத்து மெய்ம்மை மேயினான் ."
310,சடிவேந்தன் தன் மகள் சுயம்பிரபையைப் பயாபதி மைந்தனான திவிட்டனுக்கு மணம் செய்துகொடுக்க வேண்டித் தன் தூதுவன் ஒருவனை விடுக்கின்றான்.
311,பயாபதி மண்ணுலக மன்னன் சடியோ விஞ்சையர் வேந்தன்.
312,சடி விடுத்த தூதன் தன் அரசன் விரும்பும் மகட்கொடையை யுணர்த்தும் திருமுகத்தைக் கொடுக்கின்றான்.
313,பயாபதியோ மகிழ்ச்சி மிகுதியால் ஒன்றும் உரையாடமாட்டாது சிறிது போது அமைந் திருக்கின்றான்.
314,அவ்வமைதி தூதனுக்குத் தன்னரசனை யவமதிப்பது போலத் தோன்றுகிறது.
315,"இம்மட்டோ, திவிட்டன் மகள் சோதிமாலை யென்பாட்குச் சுயம்வரம் நடக்கிறது."
316,வேந்தர் பலர் அதற்கு வருகின்றனர்.
317,சோதிமாலை அமிததேசனுக்கு மாலையணி கின்றாள்.
318,ஏனை வேந்தர் என்ன செய்கின்றனர்?
319,ஏனை நூல்களிற் காணப்படும் சுயம்வரங்கட்கு வரும் வேந்தர்கள் யாது செய்கின்றனர்?
320,வறிதே மாலைபெற்றோன் பால் அழுக்காறு கொண்டு போர் தொடுத்து முதுகிட்டோடும் பேதை மாக்களா கின்றனரன்றோ?
321,இவரது மனப்பெருமையைக் காண்மின்!
322,"சுருங்கச் சொல்லுமிடத்து, இச்சூளாமணியாசிரியர் நிரம்பவும் உலகியலறிவில் சிறந்திருக்கின்றார் என்பது சாலும்."
323,ஒருவன் இரு மனைவியரை மணந்து அவ்விருவர்க்கும் இனியனா யொழுகுந்திறம் அரிதென்பது உலகியலில் கண்டதொன்று இன்னாராதலே பெரும் பான்மையாகும்.
324,அவற்றையெல்லாம் ஈண்டு விரிப்பிற் பெருகும்.
325,இதன்கண் செய்யுட்கள் உள்ளன.
326,புறத்திரட்டால் மூன்றும் வேறு சில பிரதிகளால் நான்கு மாகச் செய்யுட்கள் சில விடுப்பட்டிருப்பது தெரிகிறது.
327,"இதன் அச்சுப்பிரதி கிடைப்பது அரிதாய தொருபுறம் நிற்க, கிடைப் பதனையும் படிப்போர் மிகக் குறைந்திருக் கின்றனர்."
328,பலரும் இனிது எளிதிற் படித்து முதனூலைப் படித்து இன்புறுதற்கு வாயிலாக இச்சுருக்க நூல் தொகுத்துக் குறிப்புரையுடன் வெளிவருவதாயிற்று.
329,ஒளவை.
330,சு.
331,துரைசாமி.
332,பாயிரம் முடிந்தது.
333,.
334,மழை முழக்கத்தைக் கேட்குந்தோறும் மயிலினம் ஆளும்.
335,சந்தனச் சாரலின் களிற்றினம் உண்பன உண்டு உறங்குகின்றன.
336,கொன்றை முதலிய மரம் பூத்துத் துளிக்கும் தேன் மழையால் பசும்புல் தழைத்து ஆனிரைகட்கு நலம் செய்கின்றது.
337,பொய்கைகளில் புள்ளினம் ஈட்டம் குறையாது இருக்கின்றன.
338,மோடுகொண்டெழு மூரிக்கழைக் கரும்பு ஊடுகொண்ட பொதும்பரொடு உள்விராய்த் தோடுகொண்ட பைங்காய் துவள் செந்நெலின் காடுகொண்டுள கண்ணகல் நாடெலாம்.
339,.
340,அரசனாகிய பயாபதிக்கு உரிமை மகளிர் ஆயிரவராவர்.
341,அவர் இளமையும் வனப்பும் வளம்பெற உடையர் கற்பினும் பொற்பினும் கற்பகநாட்டு மகளிரை யொப்பர்.
342,"இவருள் அரசனுக்கு மிகச் சிறந்தவர் இருவராவர் அவர், மிகாபதி, சசி யென்னும் பெயரினர்."
343,.
344,மிகாபதி விசயனைப் பெறுதல்.
345,சசி திவிட்டனைப் பெறுதல்.
346,மக்கள் பிறந்ததனால் மகிழ்ச்சி மிகுந்த மன்னன் சிறப்புச் செய்தல்.
347,"அரசனும் இவர்களின் அறிவு, ஆண்மை, பெருமை முதலிய நலமிகுதி கண்டு இன்பம் சிறக்கின்றான்."
348,"இவ்வாறிருக்க, பயாபதி ஒருநாள் அரசவைக்கு வருகின்றான்."
349,"அவன் கண்ணாலும் கையாலும் குறித்தவண்ணமே புரோகிதர், அமைச்சர், சான்றோர் முதலிய பலரும் தத்தமக்கு உரிய இருக்கையில் இருக்கின்றனர்."
350,அரசர் பலர் வந்து அவனை வணங்கித் தமக்குரிய இருக்கையில் அமர்கின்றனர்.
351,தானை வீரரும் வந்திருக்கின்றனர்.
352,"நீ வரவிடு, காவல், என்றான்."
353,"வந்தவனுக்கு அரசன் இருக்கை காட்ட, இருந்த நிமித்திகன், தன் புலமை தோன்றக் கூறலுறுகின்றான்."
354,அவனே அக் கனாவின் பயனும் கூறல் மல்மலர்ந் தகன்ற மார்ப!
355,இதற்குள் குறித்த நாழிகை முடிகிறது.
356,"அரசன் மந்திரக்கிழவர் தொடர, அகமந்திரசாலை யடைகின்றான்."
357,"ஆங்கே, அவன் அவர்கட்குத் தான் கனவு கண்டதும் நிமித்திகன் கூறியதும் மீட்டும் கூறுகின்றான்."
358,பண்டும் கேட்டுமே.
359,"நிமித்திகன் கூறியவண்ணம், விஞ்சைவேந்தன் மகள் திவிட்டனுக்கு உரியளாய் வந்தால், அரசாட்சியும் இனிது நடக்கும்."
360,நாம்இனி மற்றவன் மொழிந்த நாளினால் தேமரு சிலாதலம் திருத்தித் தெய்வமாம் தூமரு மாலையாய்!
361,துரும காந்தனைக் காமரு பொழிலிடைக் காவல் வைத்துமே.
362,"இவ்வாறு மந்திரக் கிழவர் கூறியவற்றைக் கேட்ட அரசன், புட்பமாகாண்டப் பொழிலில் சிலாதலம் அமைக்கப் பணித்து விட்டு அந்தப்புரம் அடைகின்றான்."
363,சிலாதலம் திருத்தப் பெறுகிறது.
364,.
365,அங்கு வாழ்பவர் விஞ்சையராவர்.
366,இவ்வழகிய நாட்டிற்குத் தலைநகர் இரதநூபுரச் சக்கரவாள மென்பது.
367,சுயம்பிரபை பெண்மை நலம் கனிந்து மணப்பருவம் எய்து கின்றாள்.
368,அவளை மணத்தல் வேண்டி விஞ்சையர் நாட்டு அரசர் பலர் வேட்கைமிக்கிருக்கின்றனர்.
369,"இங்ஙனம் இருக்க, அந்நாட்டில் வேனிற் பருவம் வருகிறது."
370,வயந்தமாலை யென்னும் தோழி வேனில் நுகர்வு குறித்து அதனை வேந்தனுக்கு உரைத்தல் தேங்குலாம் அலங்கல்மாலைச் செறிகழல் மன்னர் மன்ன!
371,கோவைவண்டு ஊதுகின்ற குரவெனும் குரைகொள்மாதர் பாவைகொண்டு ஆடுகின்ற பருவத்தே பயின்ற காமன் ஆவிகொண்டு இவளைக்கைவிட்டு அகலுமோ?
372,அவனுடைய உரிமை மகளிரும் உடன் போகின்றனர்.
373,உரிமை காப்பவர் ஒருங்கே சூழ வருகின்றனர்.
374,நும் செல்வம்போல் பொலிந்ததே.
375,மாந்தளிர் இங்குஇவை நுமது நிறம்கொண்டு வளர்ந்தனவே ஏந்து இளம்தீங்குயில் இவைநும் சொல்கற்பான் இசைந்தனவே தேம்தளங்கு குழலீர்!
376,நும் செவ்வாயின் எழில்நோக்கித் தாம்தளிர் மென்முருக்கு இனிய தாதோடு ததைந்தனவே.
377,காவியும் செங்கழுநீரும் கமலமும் கண்விரிந்து நளி வாவியும் மண்டபமும் எழில்மதனனையும் மருட்டுமே தூவியருங் கிளிஅன்ன சொல்வீர்!
378,"நீர் துணையில்லார் ஆவியுய்ந்து உள்ளாராதல் அரிதே, இவ் விளவேனில்."
379,"இவ்வாறெல்லாம் சோலையில் வேனில் நுகர்ச்சியெய்தி இன்புற்ற வேந்தன், அச்சோலையகத்தே இருந்த அருகன் கோயிலை யடைந்து அதனை வலம் வருகின்றான்."
380,அப்போது மூடப்பெற்றிருந்த கதவுகள் திறக்கின்றன.
381,"வேந்தன், அருகனை வழிபடுகின்றான்."
382,சடியரசன் பாடிய பாட்டு அணியாதும் ஒளிதிகழும் ஆரணங்கு திருமூர்த்தி கணியாது முழுதுணர்ந்த கடவுள்என்று அறையுமே!
383,"கணியாது முழுதுணர்ந்த கடவுள்என்று அறைந்தாலும் அணிஞாலம் உடையாயை அறிவாரோ, அரியரே?"
384,திருமறுவு வலன்அணிந்து திகழ்கின்ற திருமூர்த்தி ஒருமறுவும் இலையென்பது ஒழியாமல் உணர்த்துமே!
