Line Number,Sentence
829,"இங்ஙனமே ஐகாரம் வரும் சொல்லையும் அசை பிரித்து வெவ்வேறு சீரிலும் அடியிலும் நிறுத்திவிடின், ஓரளபாகக் குறுகாது."
830,குற்றியலுகர குற்றியலிகரங்களையோ இங்ஙனம் பிரித்து நிறுத்த முடியாது.
831,"ஆகவே, இகர வுகரம் முந்தித் தோன்றியவை என்பது மட்டுமன்றி, குற்றியலிகர குற்றியலுகரங்கள் ஒழுங்குபட்டவையாயு மிருக்கின்றன."
832,அவ்வாறு அவர் பெயர் கூறக் காணோமே!
833,ஐகார ஔகாரங்கள் முதன்முதலாகத் தமிழ் நெடுங்கணக்குத் தோன்றியபோதே பிறவுயிர்களோடு தோன்றிய தனியுயிர்களல்ல சற்றுப் பிந்தியமைந்த புணரொலிகள் .
834,"பொள்பொய்பய்பை துளையுள்ளது, குழிவானது, உள்ளீடற்றது."
835,"பள்பய்பயம்பு பள்ளம், குழி."
836,"அம்மை அவ்வைதாய், பாட்டி, ஒ.நோ செம்மை செவ்வை."
837,அவ்வை ஔவை.
838,வாவல்சிறகால் வாவிச் செல்வது.
839,வாவல் வவ்வால் வௌவால்.
840,பெரு வௌவால் வாவிப் பறப்பதையே எங்கும் காண்க.
841,முதற் காலத்தில் தோன்றிய தனியொலி நெடில்கட்குக் காரச்சாரியை கொடுக்கப்பட்டது.
842,பிற்காலத்தில் தோன்றிய புணரொலி நெடில்கட்கோ அதனின்றும் வேறான கான் சாரியை கொடுக்கப்பெற்றது.
843,"மேலும், குற்றியலுகரம் போல் ஐகார ஔகாரக் குறுக்கங்கள் புணர்ச்சி வேற்றுமைப் படாமையின், சார்பெழுத்துத் தன்மையைப் பெற்றனவாகா."
844,ஆய்தம் என்பது மெல்லிய ககரமான ஒரு நுண்ணொலி.
845,ஆய்தம் நுணுக்கம்.
846,ஓய்தல் ஆய்தல் நிழத்தல் சாஅய் ஆவயின் நான்கும் உள்ளதன் நுணுக்கம் உரி.
847,என்று தொல்காப்பியங் கூறுதல் காண்க.
848,"சார்பெழுத்துகளென்று தொல்காப்பியங் கூறும் மூன்றனுள், இரண்டு உயிரெழுத்துகளும் ஒன்று மெய்யெழுத்துமாகும்."
849,"உயிரெழுத்துகள் அளபிற் குன்றியது மட்டுமன்றி, ஒலியிலும் வேறுபட்டவை."
850,மெய்யெழுத்தான ஆய்தம் ஒலியில் மட்டும் வேறுபட்டது அளபிற் குன்றியதன்று.
851,"அது ககரத்திற் கினமானதென்பது, அஃகேனம் என்னும் பெயரினாலேயே அறியப்படும்."
852,அஃது ஏனச் சாரியை பெறும்போது வேறெம் மெய்யோடும் புணராமை காண்க.
853,குற்றியலுகர குற்றியலிகரங்கள் முற்றியலுகர முற்றியலிகரங்கள் போல் பதினெண் மெய்யொடும் கூடி வருவனவல்ல.
854,ஆய்தம் ஓருயி ரொடும் கூடி வருவதன்று.
855,ஐகார ஔகாரங்கள் குறுகுவது இடம்பற்றியே யன்றிப் பற்றுக்கோடும் சார்பும் பற்றியன்று.
856,எடு போன்ம்என்றுபோன்மென்று.
857,"இத்தகைய வேறுபாடும் சிறப்பியல்பும் நோக்கியே, முதனூலார் சார்பெழுத்து மூன்றே யெனக் கொண்டார்."
858,அதையே பல்லாயிரம் ஆண்டிற்குப் பிற்பட்ட தொல்காப்பியரும் தழுவிக் கூறினர்.
859,"என்று வழிநூன் முறையிற் கூறியிருப்பதையும், கூர்ந்து நோக்குக."
860,"அன்றியும், ஒரு மாத்திரை அளவுள்ள முற்றுகரமே குறுகி அரை மாத்திரையாக ஒலிப்பதாயின் நன்னூலார் போலத் தொல்காப்பியரும்."
861,நெடிலோ டாய்தம் உயிர்வலி மெலியிடைத் தொடர்மொழி இறுதி வன்மையூர் உகரம் அஃகும் என்றன்றோ கூறியிருப்பர்.
862,அவர் அங்ஙனம் கூறிற்றிலரே!
863,"குற்றியலுகரம் தனி நெடிலுக்குப் பின்னரும், தொடர்மொழி இறுதியிலும் வரும் வல்லொற்றை ஊர்ந்து வரும் என்றுதானே கூறியுள்ளார்."
864,நெட்டெழுத் திம்பரும் தொடர்மொழி யீற்றும் குற்றிய லுகரம் வல்லா றூர்ந்தே மொழி.
865,"முன்னூலாசிரியர் இவ்வாறு தெளிவுறக் கூற, காரணமின்றி நன்னூலார் அவரோடு முரணுவானேன்?"
866,"குற்றியலுகரம் குறுகியவியல்புடைய தென்பதும், அது நிற்குஞ் சொல் ஈற்றயலெழுத்துப் பற்றி அறுவகைப்பட்ட தென்பதும், தொல்காப்பியர் கூறிய கூற்றுகளே!"
867,நன்னூலாரும் இங்ஙனம் கூறியது அவரை முற்றும் தழுவியே.
868,ஓரெழுத் தொருமொழி ஈரெழுத் தொருமொழி இரண்டிறந் திசைக்குந் தொடர்மொழி உளப்பட மூன்றே மொழிநிலை தோன்றிய நெறியே மொழிமரபு.
869,"ஆகவே, நெடிலோ டாய்தம் உயிர்வலி மெலியிடைத் தொடர்மொழி இறுதி வன்மையூர் உகரம் அஃகும் பிறமேல் தொடரவும் பெறுமே நன்."
870,என்று நன்னூலார் கூறியுள்ளது முற்றும் உண்மைக்கு ஒத்ததும் தொல் காப்பியத்தொடு இம்மியும் முரண்படாததுமாகும்.
871,"ஆனால், அவ் வுகரம் முற்றுகரமாகவன்றோ உள்ளது."
872,"எனவே, இடமும் பற்றுக்கோடும் குற்றியலுகரம் வருவதற்குச் சார்பே தவிர, உகரம் குறுக்கம் பெறக் காரணங்கள் ஆகா."
873,"இடமும் பற்றுக்கோடும் கரணியமாக முற்றுகரம் குறுகி யொலிக்கு மென்று இலக்கணியர் கூறியது, தமிழ்ச்சொற்களையே யன்றிப் பிறமொழிச் சொற்களை நோக்கியன்று."
874,"மேலும், ஏது, தாது என்பவை வடசொற்கள் என்னும் பண்டைக் கொள்கை இனிச் செல்லாது."
875,"அது குற்றியலுகரத்துடன் உயிரேறித் தென் மொழிப் புணர்ச்சி கொண்டதும், அதன் தென்சொற்றன்மை யினாலேயே என அறிக."
876,தாது என்னும் சொல்லின் வேர்ப்பொருள் நுறுங்கு அல்லது தூள் என்பதே.
877,ததைதல் .
878,சமந்ததைந்த வேல் பதிற்.
879,ததைந்தது தாது.
880,தாது .
881,"நீறு, பொடி, மதுரைக்."
882,", உரை ."
883,பூந்தாது பூஞ்சுண்ணம் தாதுண் வண்டினம் மணிமே.
884,உடலின் எழுவகைக் கூறு பிங். .
885,விந்து பிங் வெயிலிற் காய்ந்து தூளாக உதிர்ந்துபோன சாணத்தைத் தாதெரு என்பது செய்யுள் வழக்கு.
886,தாதெரு மறுகின் மூதூ ராய்கண் அகம். தாதெரு பரந்து கிடக்கும் ஊர்ப்பொதுவிடம் தாதெரு மன்றம் எனப்படும்.
887,"தாதெரு மன்றத் தயர்வர் தழூஉ கலித் தாது எரு தாதெரு, இதுவும் தமிழிலக்கண நெறிப்பட்ட குற்றிய லுகரப் புணர்ச்சியே."
888,"சில குற்றியலுகர வீற்றுச் சொற்களை வடசொல்லென வழுப்படக் கொண்டு நீண்டகாலமாக இதழ்குவித் தொலிப்பதனாலேயே, அவை வடசொற்போல் தோன்றிவிடுகின்றன."
889,"ஏதீடு, தாதெரு என்பன இலக்கணப் போலியான மரூஉக்களல்ல."
890,அவை முதற்காலத்துத் தோன்றிய நெறிப்பட்ட புணர்ச்சிகளே.
891,"அவற்றின் ஈற்றுகரங்களை முற்றுகரமாக ஒலித்தலாலேயே, அவை, கிட்டுவை, கிட்டுவினால், கிட்டுவிற்கு எனவும்."
892,"தம்புவை, தம்புவினால், தம்புவிற்கு எனவும் வேற்றுமை யேற்கின்றன."
893,"இவ் விரண்டனுள், கிட்டு என்பதை வடசொற் றிரிபென வரைந்தொதுக்கினும், தம்பு என்பதை எங்ஙனம் தள்ளவியலும்?"
894,இவற்றுள் ஓசை செய்யுட்குரியது அலகுமட்டம் பெரும்பாலும் இசைக் குரியது ஏனையவெல்லாம் உரைநடைக்கும் செய்யுட்கும் பொதுவாகும்.
895,"இயற்றமிழ் உரைநடையில் இயல்பு, பொருள் வேறுபாடு, சொற் பிரிப்பு என்னும் மூவகையில் ஒலியழுத்தம் நிகழும்."
896,"இவற்றுள், இயல்பு தமிழ் இலக்கண நூல்களிற் கூறப்பட்டில."
897,"ஆயினும், மேலையிலக்கணத் துணைக்கொண்டு இலக்கியங் கண்டதற் கிலக்கணங் காணும் முறையில் அதனை அறிந்துகொள்ள முடியும்."
898,வன்புறையைப் பொதுவாக ஒலியழுத் தத்திற் சேர்ப்பதில்லை.
899,இயல்பு இயல்பு என்பது இயல்பாக அல்லது வழக்கமாக ஒலிக்கும் முறை.
900,"பொதுவாக, எவ் வினையிலும் தொடக்கத்தில் முயற்சி மிக்கிருப்பது, அனைவரும் அறிந்ததொன்று."
901,"ஒலிப்பு முறையிலும், சொற்களின் முதலசையில் அல்லது முதல் எழுத்தில் முயற்சி மிக்கழுந்துகின்றது."
902,இவ் வுண்மையை எச்சொல்லையும் ஒலித்துக் காண்க.
903,", , , , , ?"
904,"முதலிய தொடர்ச்சொற்களிலும், முதலசையிலேயே அல்லது முதலெழுத்திலேயே முதன்மையாக ஒலியழுந்துவதைக் காண்க."
905,"ஒலியழுத்தம் மூவகைப்படும் என மேற்கூறப்பட்டிருப்பினும், சிறுப்பாக, அது எடுத்தல் வகையையே உணர்த்தும்."
906,"அண்ணாமலையரசர் என்னுஞ் சொல்லில் முதலசையில் அழுத்தம் எனின், முதலசையில் எடுப்பொலி என்பது பொருளாகக் கொள்க."
907,"பொருள் விளங்குமிடமெல்லாம், ஒலி யழுத்தம் என்னுங் குறியீட்டை அழுத்தம் எனச் சுருக்கியும் வழங்கலாம்."
908,அவன் என்ன செய்தான்?
909,அவன் என்ன செய்தான்?
910,"என முழுச்சொல்லையுமேனும், மாணவர் எல்லாரும் நாளைக் கூட்டத்திற்கு வரவேண்டும் என முழுச் சொற்றொடரையு மேனும் தழுவும்."
911,"ஒலியழுத்தத்திற்கும் வன்புறைக்கும் வேறுபாடுள்ளதேனும், ஒருபுடை யொப்புமைபற்றி, தனியசை வன்புறையை மட்டும் ஒலியழுத்தத்தின் பாற்படுத்திக்கொள்ளலாம்."
912,பொருள் வேறுபாடு உப்ப காரம் ஒன்றென மொழிப இருவயின் நிலையும் பொருட்டா கும்மே என்பது தொல்காப்பியம்.
913,இதற்கு நச்சினார்க்கினியர் உரை வருமாறு இஃது ஒரு சொல் வரையறையும் அஃது ஓசை வேற்றுமையால் இருபொருள் தருமெனவுங் கூறுகின்றது.
914,உகரத்தோடு கூடிய பகரம் ஒரு மொழிக்கல்லது பன்மொழிக்கு ஈறாகாதென்று கூறுவர் புலவர்.
915,அதுதான் தன்வினை பிறவினை யென்னும் இரண்டிடத்தும் நிலைபெறும் பொருண்மைத்தாம் என்றவாறு.
916,எடுத்துக்காட்டு தபு என வரும்.
917,"இது படுத்துக்கூற, நீ சாவெனத் தன்வினையாம்."
918,எடுத்துக் கூற நீ ஒன்றனைச் சாவப்பண்ணெனப் பிறவினையாம்.
919,உப்பு சப்பு என்றாற் போல்வன குற்றுகரம்.
920,உகரத்தோடு கூடிய பகரம் ஒன்றெனவே ஏனை யுயிர்களோடு கூடிய பகரம் பன்மொழிக்கு ஈறாய்ப் பல பொருள் தருமென்றா ராயிற்று.
921,"மறந்தப துப்பா என எச்சமாயும், நம்பி செம்பூ பே பெதும்பை எனப் பெயராயும், போ என ஏவலாயும் வரும்."
922,இவற்றைப் பிற சொற்களோடும் ஒட்டுக.
923,ஏனை ஈகார பகரம் இடக்கராய் வழங்கும்.
924,"பிறவினை நிலையில் ஈரெழுத்தும் அதாவது சொல் முழுதும் எடுத்தொலிப்பின், அது சினத்தாலெழுந்த உச்ச அலகுநிலையென அறிக."
925,"ஆயின், காது என்னுஞ் சொல்லை இதழ் குவித்துச் சொல்லுமிடத்து முற்றியலுகரமாம்."
926,அதற்குப் பொருள் கொல் என்பது.
927,அதனை இதழ் குவியாமற் சொல்லுமிடத்துக் குற்றியலுகரமாம்.
928,அதற்குப் பொருள் காது என்னும் உறுப்பு.
929,பிறவும் இவ்வாறே பொருள் வேற்றுமை உடையவாதல் அறிந்துகொள்க.
930,குற்றியலுகரத்துக்கும் முற்றியலுகரத்துக்கு முள்ள பொருள் வேற்றுமை இவையே என்று திரு.
931,கணேசையர் தொல்காப்பிய இரண்டாம் நூற்பாவிற்கு அடிக்குறிப்பு எழுதியிருப்பது பொருந்தாது.
932,ஈரெழுத் தொருமொழி உயிர்த்தொடர் இடைத்தொடர் ஆய்தத் தொடர்மொழி வன்றொடர் மென்றொடர் ஆயிரு மூன்றே உகரம் குறுகிடன் தொல்.
933,என்றார் தொல்காப்பியராதலின்.
934,ஒலியழுத்தம் வேறு இதழ் குவிவு வேறு.
935,"இனி, முற்றியலுகர, குற்றியலுகரங்கள் பொருள் வேறுபடுவதும், அளவு, அளபு உருவு, உருபு முதலிய ஒருசில சொல்லிணைகளிடத்தே யென்க."
936,உருவு என்பதன் ஈற்றிலுள்ளது முற்றியலுகரம் அச் சொற்பொருள் வடிவம் என்பது.
937,உருபு என்பதன் ஈற்றிலுள்ளது குற்றியலுகரம் அச் சொற்பொருள் வேற்றுமைவடிவம் என்பது.
938,வீடு என்னும் வினைச்சொல் விடு எனப் பொருள் படுவதுங் காண்க.
939,"சார்பெழுத்துகளின் தொகை கூறும் தொல்காப்பிய நூற்பாவுரையில் இகர உகரங் குறுகி நின்றன, விகார வகையாற் புணர்ச்சி வேறுபடுதலின்.."
940,"சொற்பிரிப்பு சில சொற்கள் புணர்ந்து நிற்கும் நிலையில், இரட்டுறலும் கவர்படு பொருளுங் கொண்டு பல்வேறு சொற்களாகப் பகுத்தற் கிடந்தரும்."
941,சொல் வேறுபாட்டிற்கேற்ப அழுத்தநிலை மாறும்.
942,புணர்ந்து நிற்கும் சொற்கள் இன்னவென அறிதற்குப் புணர்ச்சியிடத்து ஒரு குறிப்புமில்லை.
943,இடம் நோக்கியும் சொல்வான் குறிப்பறிந்துமே இன்ன சொற்கள் எனத் துணிதல் வேண்டும்.
944,"இவற்றை, எழுத்தோ ரன்ன பொருள்தெரி புணர்ச்சி இசையில் திரிதல் நிலைஇய பண்பே தொல்."
945,அவைதாம் முன்னப் பொருள புணர்ச்சி வாயின் இன்ன வென்னும் எழுத்துக்கடன் இலவே தொல்.
946,என எடுத்தோதினார் தொல்காப்பியர்.
947,"செம்பொன்பதின்றொடி, செம்பருத்தி, குறும்பரம்பு, நாகன்றேவன் போத்து, தாமரைக்கணியார், குன்றேறாமா என இவை இசையிற் றிரிந்தன."
948,"பல பொருட்குப் பொதுவென்ற புணர்மொழிகள்தாம், குறிப்பான் உணரும் பொருண்மையினையுடைய, புணர்ச்சியிடத்து இத்தன்மைய வென்னும் எழுத்து முறைமையை உடையவல்ல என்றவாறு."
949,"செம்பொன் பதின்றொடி என்றுழிப் பொன்னாராய்ச்சி யுளவழிப் பொன்னெனவும், செம்பாராய்ச்சியுளவழிச் செம்பெனவும், குறிப்பான் உணரப்பட்டது."
950,"இசையிற் றிரிதலென்றது ஒலியெழுத்திற்கெனவும், எழுத்துக் கடனில வென்றது வரிவடிவிற்கெனவும், கொள்க."
951,செம்பொன்பதின்றொடி முதலிய எடுத்துக்காட்டுப் புணர்மொழி களை அல்லது தொடர்மொழிகளைப் பின்வருமாறு பல்வேறு வகையிற் பகுக்கலாம்.
952,செம்பொன்பதின்றொடி .
953,செம்பு ஒன்பதின்றொடி .
954,செம்பொன் பதின்றொடி தொடி பலம் செம்பருத்தி .
955,செம் பருத்தி .
956,செம்பு அருத்தி.
957,அருத்தி விருப்பம் குறும்பரம்பு .
958,குறு பரம்பு .
959,குறும்பர் அம்பு நாகன்றேவன்போத்து .
960,நாகன் தேவன் போத்து .
961,நாகன்றே வன்போத்து .
962,நாகன் தே அன்போத்து .
