Line Number,Sentence
1,தமிழ் இலக்கணப் பேரகராதி பொருள் அகம் ஆசிரியர் பண்டித வித்துவான் தி.வே.
2,கோபாலையர் தமிழ்மண் பதிக்கம் ..
3,", ."
4,இடையிடையே பணிக்கப்பட்ட ஏனைய பணி களுக்கு இடையிலும் அகராதிப் பணியைத் தொடர்ந்து இல் ஓரளவு அதனை நிறைவு செய்தேன்.
5,சென்ற நூற்றாண்டில் வெளிவந்த இலக்கணம் பற்றிய கட்டுரைகள் பல இருப்பினும் அவையெல்லாம் இவ்வகராதி யில் இடம் பெறவில்லை.
6,எடுத்துக்காட்டாக வழக்கு என்ற சொல் தொல்காப்பியச் சிறப்புப் பாயிரத்தில் முதற்கண் வருவதால் அச்சொல் பாயிரம் பற்றிய பகுதியில் விளக்கப்பட்டிருக்கும்.
7,தலைப்புக் களின் அகராதி அமைக்கப்பட்டபின் அத்தகைய சொற்களின் இருப்பிடம் அறிதல் எளிதாகும்.
8,"சரவணன், செல்வன் இ."
9,"இனியன், செல்வன் மு."
10,"கலையரசன், அரங்க."
11,"குமரேசன், வே."
12,"தனசேகரன், மு.நா."
13,"இராமசுப்பிரமணிய இராசா, நா."
14,"வெங்கடேசன், இல."
15,தர்மராசு ஆகியோர் இந்நூல் செம்மையாக வெளிவரப் பெரிதும் முயன்றுள்ள செயலைப் போற்றுகிறேன்.
16,இவர்கள் நோய்நொடி இன்றிப் பல்லாண்டு வாழ வாழ்த்துகிறேன்.
17,இந்நூலை வெளியிட உதவிய எங்கள் தொலைக் கீழைப் பிரஞ்சு ஆராய்ச்சிப்பள்ளி நிறுவனத்தாருக்கு நன்றியைத் தெரி வித்துக்கொள்கிறேன்.
18,இக்காலத்தில் தொல்காப்பியக் கடல் என்று போற்றப்படும் அந்நூல் இயற்றப்பட்ட காலத்தே அது சிறுநூலாகவே யாக்கப் பெற்றது.
19,அதன் எழுத்துப் படலத்தில் உள்ள இயல்களிலும் விதிக் கப்படுவன எல்லாம் கருவியும் செய்கையும் என இருவகைப்படும்.
20,"அவற்றுள் கருவி நூல்மரபு முதலிய நான்கு ஓத்தும், செய்கை தொகைமரபு முதலிய எஞ்சிய ஐந்து ஓத்தும் ஆம்."
21,கருவிதானும் பொதுவும் சிறப்பும் என இருவகைத்து.
22,முதல் மூன்று ஓத்தும் பொதுக்கருவி செய்கை ஒன்றற்கேயுரிய புணரியல் சிறப்புக் கருவி.
23,"அடுத்து, மொழிமரபு கூறும் விதிகள் நூல்மரபின் ஒழிபாக அமைந்துள்ளன."
24,"பிறப்பியல், உயிர் மெய் சார்பெழுத்துக்கள் என்பவற்றின் பிறப்பிடங்களும் முயற்சியும் பற்றி மொழிகிறது."
25,"உருபியல், உருபேற்ற பெயர் சாரியை பெற்றும் பெறாமலும் ஒரோவழி நெடுமுதல் குறுகியும் வருமொழியொடு புணருமாறு கூறுகிறது."
26,உயிர்மயங்கியலிலும் புள்ளிமயங்கியலிலும் அல்வழிப் புணர்ச்சி பெரும்பாலும் எழுவாய்த்தொடர்க்கே கொள்ளப்படு கிறது.
27,வேற்றுமைப்புணர்ச்சி வேற்றுமையுருபுகள் தொக்க வேற் றுமைப் புணர்ச்சிக்கே கொள்ளப்படுகிறது.
28,ஆசிரியர் ஈரெழுத்தொருமொழி என்று கூறியமை ஈரெழுத்துக் குற்றுகரச் சொல்லைத் தம் மனத்துக் கொண்டமையாலாம்.
29,குற்றிய லுகரம் புள்ளியீறு போல உயிரேற இடங்கொடுக்கும்.
30,உயிரள பெடை என்பது நெடிலை அடுத்து வரும் ஒத்த இனக்குற்றெழுத்தே.
31,புணர்ச்சியில் தொல்காப்பியனார் குறிப்பிடும் எழுத்துப்பேறள பெடை பிற்காலத்தே வழக்கு இறந்தது என்று கோடல் தகும்.
32,அந்நூலும் அதனுரையும் வழக்கிறந்து விட்டன.
33,தொல்காப்பியத்தை அடுத்து இன்று வழக்கில் இருக்கும் ஐந்திலக்கண நூல் பெருந்தேவனார் உரையொடு கூடிய வீர சோழியமே.
34,ஆம் நூற்றாண்டளவில் தோன்றிய வீர சோழியம் இக்கருத்தையுட்கொண்டு இயற்றப்பட்ட இலக்கணமே.
35,"வீரசோழியத்தின்கண், உயிரெழுத்துக்களை அடுத்து மெய் யெழுத்துக்களின் முன்னர் நெடுங்கணக்கில் ஆய்தம் இடம் பெற்ற செய்தி கூறப்படுகிறது."
36,"வடமொழிப் புணர்ச்சியில் அல்வழி, வேற்றுமை என்ற பொருள் பற்றிய பாகுபாடு இல்லை."
37,"ஆகவே, வீரசோழியச் சந்திப் படலத்திலும் அல்வழி வேற்றுமைப் பாகுபாடு குறிப்பிடப்பட்டிலது."
38,வடமொழிச்சொற்கள் தமிழொலிக்கேற்பத் திரித்து வழங்கப்படுமாற்றிற்கு இந்நூல் கூறும் விதிகளே நன்னூல் முதலிய பின்னூல்களிலும் கொள்ளப்படலாயின.
39,இச்செய்தியை நேமிநாதம் நன்னூல் போன்ற பின்னூல்கள் குறிப்பிடவில்லை.
40,ஏ யா எ என்பன சொல் முதலில் வினாவாகும் என்ற இவர் கருத்தைப் பிற்காலத்து நூலார் பலரும் ஏற்றுக்கொண்டவராவர்.
41,"அடுத்து வந்த நேமிநாதமும், நெடுங்கணக்கு வரிசையை , உயிர் அடுத்து ஆய்தம் அடுத்து மெய் என்றே குறிப்பிடுகிறது."
42,"இந் நூலுள் குற்றியலிகரம், குற்றியலுகரம், ஐகாரக் குறுக்கம் என்னும் இவற்றோடு ஒளகாரக் குறுக்கமும் குறிக்கப்பட்டுள்ளது."
43,வடமொழித் தத்திதாந்த நாமங்களும் எதிர் மறை யுணர்த்தும் நகர முன்னொட்டுப் புணர்ச்சியும் வீரசோழி யத்தைப் பின்பற்றியே கூறப்படுகின்றன.
44,வீரசோழியம் விதிக்கும் வடமொழியாக்கம் நேமிநாதத்தில் இல்லை.
45,தொல்காப்பியத்தை அடுத்து மக்கள் உள்ளத்தே சிறப்பாக இடம்பெறுவது பவணந்தி முனிவர் இயற்றிய நன்னூலே.
46,"உயிரளபெடை நெட்டெழுத்தின் நீட்டமாகிய மூன்று மாத்திரை, குறில் அறிகுறி யாக வருவதே என்ற செய்தி குறிப்பிடப் பட்டுள்ளது."
47,"பதவியலில், பகுபதம் பகுதி விகுதி முதலிய உறுப்புக் களாகப் பிரித்துக் காட்டப் பட்டுள்ளது."
48,பகுபத உறுப்புக்கள் விளக்கப்பட்டுள்ளன.
49,பதவியல் நன்னூல் குறிப்பிடும் ஒருமொழிப் புணர்ச்சியாகிய புதுச் செய்தியே.
50,இதன் இறுதியில் வடமொழி ஆக்கம் வீரசோழியத்தைப் பின்பற்றி வரையப்பட்டுள்ளது.
51,ந என்ற எதிர்மறை முன்னொட்டுப் பற்றிய செய்தி பேசப்பட்டிலது.
52,தொல்காப்பியத்திற்கு இளம்பூரணர் வரைந்த உரையையும் உட்கொண்டு இயற்றப்பெற்ற நன்னூலில் தொல்காப்பியச் செய்திகள் பலவற்றொடும் அவ்வுரையாசிரியர் குறிப்பிட்ட செய்திகளும் இடம்பெறுகின்றன.
53,தொல்காப்பியம் குறிக்கும் புணரியல் தொகை மரபு உயிர்மயங்கியல் குற்றியலுகரப் புணரியல் பற்றிய செய்திகள் பலவும் உயிரீற்றுப் புணரியலுள் அடக்கப்பட்டுள்ளன.
54,அல்வழி யாவன இவையென விளக்கப்படுகிறது.
55,"உடம்படுமெய், குற்றுகரம் உயிர்வரக் கெடுதல் போன்றவை வீரசோழியத்தைப் பின்பற்றியனவாம்."
56,நன்னூலில் காணப்படும் மாற்றங்கள் மரபு நிலை திரியாது அமைந்தன என்ப.
57,"இலக்கணவிளக்கம், நன்னூல் தொல்காப்பியத்தொடு மாறு பட்டுக் கூறும் ஒரு சில இடங்களைச் சுட்டி விளக்குகிறது."
58,தனக்கு முற்பட்ட நூல்களில் விளக்கப்படும் வடமொழியாக்கத்தை இவ் விலக்கணநூல் நெகிழ்த்துவிட்டது.
59,"இலக்கணக்கொத்து, பிரயோக விவேகம் என்பனவற்றில் சில அரிய புணர்ச்சிவிதிகள் குறிப்பிடப்பட்டுள்ளன."
60,அ அந் ந நி கு வி புணரப் புணர்ப்பது வடமொழியில் எதிர்மறையாகும் என்ற செய்தி இலக்கணக்கொத்தில் விளக்கப்பட்டுள்ளது.
61,தமிழ்ச் சிறப் பெழுத்து ஐந்தானும் திரிந்து ஆரியச்சொல் வடசொல்லாகித் தமிழில் வழங்கும் செய்தி இவ்விரண்டு நூல்களிலும் விளக்கப்படு கிறது.
62,இச்செய்தி நன்னூலில் இடம் பெற்றிலது.
63,தொன்னூல் விளக்கம் நன்னூலைப் பெரிதும் பின்பற்றியது வடமொழியாக்கத்திலும் நன்னூலைப் பின்பற்றியுள்ளது.
64,முத்து வீரியத்தில் தீர்க்கசந்தி முதலியவற்றிற்கு விதிகள் தனித்தனியே கூறப் பட்டுள.
65,"கோ இல் கோயில், மா இரு மாயிரு முதலிய வற்றிற்குத் தனியே விதிகள் வகுக்கப்பட்டுள."
66,சுவாமிநாதத்தில் குறிப்பிடத்தகும் விசேடமாக ஏதும் இன்று.
67,அதன் ஆசிரிய விருத்த யாப்பு நயனுறுமாறு இல்லை.
68,"தொல்காப்பிய எழுத்ததிகாரத்து இளம்பூரணர் உரை நச்சினார்க்கினியர் உரை சென்ற நூற்றாண்டு மொழியியல் வித்தகராம் வேங்கடராசுலு ரெட்டியார், பி.சா."
69,அன்ன திருத்தங்கள் நன்றி யறிதலோடு ஏற்கப்படும்.
70,தி.வே.
71,"கோபாலையர் , ."
72,.
73,.
74,", , , , ."
75,", , , , ."
76,", , , , , ."
77,", , ."
78,", , , ."
79,.
80,", , , , .."
81,.
82,", , , , ."
83,", , , , , ."
84,", , , ."
85,", , , ."
86,", ."
87,.
88,.
89,.
90,", , ."
91,", , ."
92,", , , , ."
93,", .."
94,", ."
95,.
96,", , ."
97,", , , ."
98,", ."
99,", ."
100,", .., , , , , ."
101,", , ."
102,.
103,", .."
104,", , ., , ."
105,", ."
106,.
107,.
108,", ."
109,", , , , , , ."
110,.
111,.
112,..
113,", ."
114,..
115,", , ."
116,.
117,", , , ."
118,", ."
119,", , , ."
120,"ஈவா வில்டன் பிரஞ்சு இந்திய ஆய்வுப் பள்ளி டுமாஸ் தெரு புதுச்சேரி மையம் பாண்டிச்சேரி, ஆகஸ்டு ."
121,அச்சிந்தனைகள் பிறமொழிகளின் குறிப்பாக வட மொழியின் இலக்கண இலக்கியங்களோடு உறழ்ந்து வந்துள்ளதை யும் காண்கிறோம்.
122,தோராயமாகச் சொன்னால் முதல் ஆயிரம் ஆண்டுகளில் தமிழிலக்கியத்திற்கு முழுமையான அடிப்படையாக அமைந்துள்ள ஒரே பெரும் பேரிலக்கணம் தொல்காப்பியம் ஆகும்.
123,அஃது மூன்று அதிகாரங்கள் கொண்டது எழுத்து ஞாடிடிடடிபல சொல் ஆடிசயீடிடடிபல யனே ளுலவேயஒ பொருள் ஞடிநவஉள.
124,சில காலம் கழித்துப் பொருள்இலக்கணத்தின் ஒரு பகுதியான அகம் பற்றி இறையனார் அகப்பொருள் என்னும் சிறுநூல் ஒன்று தோன்றியது.
125,கி.பி.
126,க்குப் பின்னர் தமிழகத்தில் சமுதாய கலாசார மாற்றங்கள் விரைவுபெற்றன.
127,அக்காலகட்டத்தில் தோன்றியதே விரிவாக உரையெழுதும் முறையாகும்.
128,"இலக்கண நூல்களுக்கு மட்டு மன்றி, பழைய தமிழ் இலக்கியங்களில் பெரும்பாலனவற்றுக்கும் இவ்வாறு உரைகள் தோன்றின."
129,அப்பழநூல்களின் பொருளைத் தெரிந்துகொள்ளப் பெருமளவுக்கு அவ்வுரைகளையே நாம் சார்ந் துள்ளோம்.
130,எனினும் அக்காலகட்டத்தில் தமிழ் இலக்கணத்தின் உட்பிரிவுகள் பற்றிப் புது நூல்களும் தோன்றலாயின.
131,முதன்மையான சிலவற்றைக் காண்போம்.
132,இந்நூல்கள் பொருளை யாப்பு ஆநவசஉள அணி குபைரசநள டிக ளுயீநநஉ என்று மேலும் இரு பிரிவுகளாக ஆக்கியுள்ளன.
133,பொருளின் பிரிவுகள் பற்றியும் உட் பிரிவுகள் பற்றியும் எழுந்த புது இலக்கணங்கள் மிகப்பல.
134,"எழுத்துக்கு , சொல்லுக்கு , பொருளுக்கு ஆக தொகுதிகள் கொண்டது இவ் வகராதி."
135,பொருள்களைத் தெள்ளிதின் உணர்ந்து முறைப்படி விளக்கும் இத்தகைய பேரகராதியின் இன்றியமையாத் தேவை நெடுநாளாக ஆய்வுலகத்தால் உணரப்பட்டுவந்ததாகும்.
136,மிக விரிந்த இவ் விலக் கணநூல்களும் உரைகளும் திட்ப நுட்பமான நடையிலமைந்தவை யாகையால் இன்று எளிதில் படித்துணரத்தக்கவை அல்ல.
137,அவற்றில் காணத்தகும் இலக்கணச் செல்வங்களுக் கெல்லாம் புலமை சான்ற விளக்கங்களை இங்குக் காணலாம்.
138,"கோபாலையரின் படைப்பான இப் பேரகராதி தமிழ் இலக்கண, இலக்கிய அறிஞர்கள் அவர்பால் நன்றி பாராட்டுதற்குரிய ஒன்றாகும்."
139,இல் அவர் திருவையாறு அரசர் கல்லூரியில் ஆசிரியப்பணி ஆற்றினார்.
140,"அப்பொழுதே பதிப்புப் பணியை, குறிப்பாக பழந்தமிழ் இலக்கண உரைநூல்களைப் பதிப்பிக்கும் பணியைத் தொடங்கினார்."
141,அவர் இன்று ஆய்வுப் பணி செய்யும் அந்நிறுவனம் பிரான்சு நாட்டு அரசு நிதி உதவியுடன் நடைபெறுகிறது.
142,அவ் வமைப்பிற்கு ஆசிய நாடுகளில் மொத்தம் ஆய்வுமையங்கள் உள்ளன.
143,பாண்டிச்சேரி மையம் உட்பட.
144,"இவை ஆசிய குறிப்பாக இந்திய மொழிகள், பண்பாடுகள், சமயங்கள் ஆகியவை குறித்து ஆய்வு செய்கின்றன."
145,இப்பேரகராதிக்கு அடிப்படையாக அமைந்தவையும் கோபாலையர் பதிப்பித்தவையுமான வேறு சில நூல்களையும் குறிப்பிட்டாகவேண்டும் அவை திரு.
146,கோ.
147,தமிழ் இலக்கிய இலக்கண வரலாற்றை ஆய்வு செய்திட இன்றி யமையாத கருவி இப் பேரகராதி.
148,இறுதியாக இம்மாபெரும் பணி வெற்றிகரமாக நடைபெறப் பெரும்பங்கு ஆற்றிய மூவருக்கு நன்றி கூறியாக வேண்டும்.
149,முதலா மவர் திரு கோபாலையரின் இளவல் திரு கங்காதரன் அவர்கள்.
150,அவர் முன்னர்ப் பிரெஞ்சு நிறுவனத்தில் பணி செய்தவர்.
151,இப்பொழுது பி.இ.ஆ.ப.
152,"பாண்டிச்சேரி மையத்தில் அவர் ஆய்வறிஞர், பணியில் உள்ளார்."
153,நூல் முழுவதையும் தம் கைப்பட அழகாக எழுதியவர் அவர்.
154,மூன்றாமவர் திரு கோ.
155,இளவழகன்.
156,அவர் இந்நூலின் சிறப்பையும் பயனையும் உணர்ந்து அதை வெளியிட முன்வந்தவர்.
157,தமிழ் வாழ்க!
158,"தலைமாமணியெனத் தமிழிலக்கணப் பேரகராதியை வரைந்தருளிய கலைமாமணி, பண்டிதவித்துவான் தி.வே."
159,கோபா லையர் வண்டமிழ் போல வளமெலாம் மேவி மண்டலம் புகழப் பல்லாண்டு பல்லாண்டு வாழ்கெனப் போற்றி வாழ்த்துதும் உவந்தென்.
160,தஞ்சாவூர் .. பாவலரேறு ச.
161,பாலசுந்தரனார் கனி தந்தால் கனி உண்ணவும் வல்லிரோ முதுபெரும் புலவர் இலக்கணக் கடல் உயர்திருவாளர் தி.வே.
162,"கோபாலனார், தமிழ்வளக் கொடையாக, அரும்பதிப்புப் பெருந்தகை கோ."
163,"இளவழகனார் வழங்கும், தமிழ் இலக்கணப் பேரகராதி மடலங்கள் பதினேழனையும் ஒருங்கே கண்டதும், காரே!"
164,"அவர்தம் இவ்வகராதிக் கொடை, தமிழுலகு காலத்தால் பெற்ற கவின் பரிசிலாம்!"
165,அம்மம்ம!
166,எழுத்து இரண்டு மடலங்கள் சொல் நான்கு மடலங்கள் இவ் ஆறு மடலங்களைத் தானே மற்றை மற்றை மொழிகள் பெறக்கூடும்!
