Line Number,Sentence
1,கல்வி உளவியல் கோட்பாடுகள் ஆசிரியர் பேராசிரியர் டாக்டர் ந.
2,சுப்பு ரெட்டியார் தமிழ்மண் பதிப்பகம் சென்னை .
3,நூற் குறிப்பு நூற்பெயர் கல்வி உளவியல் கோட்பாடுகள் உரையாசிரியர் ந.
4,"சுப்பு ரெட்டியார் பதிப்பாளர் கோ, இளவழகன் மறுபதிப்பு தாள் .கி."
5,என்.எ.மேப்லித்தோ அளவு தெம்மி எழுத்து புள்ளி பக்கம் நூல் கட்டமைப்பு இயல்பு சாதாரணம் விலை உருபா.
6,"படிகள் நூலாக்கம் பாவாணர் கணினி தி.நகர், சென்னை ."
7,அட்டை வடிவமைப்பு வ.
8,"மலர் அச்சிட்டோர் வெங்கடேசுவரா ஆப்செட் பிரிண்டர்சு, இராயப்பேட்டை, சென்னை ."
9,வெளியீடு தமிழ்மண் பதிப்பகம் .
10,"சிங்காரவேலர் தெரு, தியாகராயர்நகர், சென்னை ."
11,பதிப்புரை கல்வி உளவியல் கோட்பாடுகள் எனும் இந்நூல் தமிழறிஞர் ந.
12,சுப்புரெட்டியார் அவர்களால் எழுதப்பட்டு மாணிவாசகர் பதிப்பகத்தால் இல் முதல் பதிப்பாக வெளியிடப்பட்டுள்ளது.
13,மாணிவாசகர் பதிப்பக நிறுவனர் அய்யா ச.
14,"மெய்யப்பன் அவர்களின் அறிமுகவுரையும், திரு."
15,"மாணிக்கம் அவர்களின் அணிந்துரையும், ஆசிரியரின் நூல்முகமும் இந்நூலைப் படிக்கத் தொடங்கும் அனைவரும் முதலில் படிக்க வேண்டிய செய்திகளாகும்."
16,ஒவ்வொரு பக்கத்தின் இறுதி வரிகளுக்குப் பிறகு குறிக்கப்பெற்றுள்ள அடிக்குறிப்புக்கள் படிப்பவர் அனைவருக்கும் மிகுந்த பயனைத் தரவல்லவை.
17,"கல்வியாளர்கள், மாணவர்கள் வாங்கிப் பயன்கொள்ள வேண்டுகிறோம்."
18,"சைதை ஆசிரியர்க் கல்லூரி உளவியல் பேராசிரியர் குருசாமி ரெட்டியார் எம்.ஏ., ..."
19,மெய்யப்பன் எம்.
20,அண்ணாமலைப் பல்கலைக் கழகம் மணிவாசகர் பதிப்பகம் சிறந்த நூல்களைத் தொடர்ந்து வெளியிட்டு வருகிறது.
21,தரமான முதல்தரமான கல்லூரிப் பாடநூல்களை வெளியிடும் பெரிய நிறுவனமாகப் பதிப்பகம் வளர்ந்து சிறந்துள்ளது பேரும் புகழும் பெற்றுத் திகழ்கிறது.
22,சில நூல்கள் அவற்றின் தரத்தாலும் தன்மையாலும் பொருளமைப்பாலும் பலமுறைப் பாட நூல்களாக ஏற்றுக் கொள்ளப்படுகின்றன.
23,அதனால் அவை பல பதிப்புகளைப் பெறுகின்றன.
24,நல்ல கல்விக்குச் சிறந்த பாட நூல்கள் உறு துணையாகின்றன.
25,"அதற்கு மணிவாசகர் பதிப்பகத்தின் பங்களிப்பு பெரிது, மிகப் பெரிது."
26,தொடக்க நாளிலிருந்தே கல்வியியல்பற்றிய பல ஆய்வு நூல்களைப் பதிப்பகம் வெளியிட்டு வருகிறது.
27,இப்பொழுது இந்த வரிசையில் பேராசிரியர் ந.
28,சுப்புரெட்டியார் அவர்களின் கல்வி உளவியல் கோட்பாடுகள் எனும் ஆய்வு நூலைப் பேர வாவுடன் வெளிக் கொணர்கிறது.
29,வளர்ந்து வரும் உளவியலையும் நாளும் சிறந்து வரும் கல்வியியலையும் நன்குணர்ந்த பேராசிரியர் சுப்புரெட்டியார் திட்ப நுட்பத்துடன் இந்நூலை ஆக்கியுள்ளார்.
30,கல்வியியல் மானிடவியலின் எல்லா இயலுக்கும் அடிப்படை இயலாகும்.
31,மேலைப் புலங்களில் மெத்த வளர்ந்துள்ள உளவியல் கோட்பாடு ஒவ்வொன்றும் எளிய தமிழில் எல்லோருக்கும் விளங்கும் வண்ணம் எழுதப்பட்டுள்ளது.
32,வேங்கடவன் பல்கலைக்கழகத்தில் தமிழ்த்துறையைத் தோற்றுவித்து வளர்த்த பெருமகனார்.
33,எடுத்த காரியத்தைச் செம்மையாக முடிக்கும் இயல்பினர்.
34,சிறப்புமிகு தமிழ்க் கலைக்களஞ்சியத்தின் தலைமைப் பதிப்பாசிரியராகவும் திகழ்ந்தவர்.
35,அவரே ஒரு கலைக் களஞ்சியம்.
36,அணிந்துரை திரு.
37,"மாணிக்கம், எம்."
38,சுப்புரெட்டியார் அவர்களால் தமிழன்னையின் திருவடியில் சூட்டப்பெற்ற அழகிய அணி கலன்களுள் தலைசிறந்தது.
39,இறவாத புகழுடைய புது நூல்கள் இயற்றல் வேண்டும் என்ற தேசியக்கவி பாரதியாரின் அறைகூவலுக்கு விடையளிக்கும் பாங்கில் அமைந்துள்ளது.
40,உளவியல் அண்மைக்காலத்தது.
41,சென்ற நூற்றாண்டிலும் அதற்கு முன்பும் மெய்ப்பொருளியலின் ஒருபகுதியாகக் கருதப் பெற்ற உளவியல் துறை அதே நூற்றாண்டில்தான் தனியாகப் பிரிந்தது.
42,அறிவியல் என்ற சிறப்பும் பெற்றது.
43,"ஆனால், கல்வி உளவியல் இருபதாம் நூற்றாண்டில்தான் அறிவியல் நிலையை அடைந்தது."
44,இன்று இது பொதுஉளவியலுக்கே சில உண்மைகளை எடுத்தியம்பும் நிலையும் பெற்றுள்ளது.
45,மக்கள் கற்கக்கூடும் கற்கத்தான் செய்கின்றனர்.
46,எனினும் ஒழுங்காகவும் பயனுடனும் கற்க உளவியல் அறிவு வேண்டும் பக்.
47,என்ற பேருண்மையினை இந்நூலெங்கும் பரக்கக் காணலாம்.
48,இலக்கியத்திற்கும் உளவியலுக்கும் நெருங்கிய தொடர்பு உண்டு.
49,பெருங்காப்பியத்திலுள்ள கதை மாந்தர்கள் வாழ்க் கையிலுள்ள போராட்டங்கட்குக் குறியீடுகளாக அமைந் திருப்பது போல் தோன்றும்.
50,"உண்மையில், அப்போராட்டங்கள் யாவும் தனிமனிதனின் உள்ளத்திலேயே தொடங்குகின்றன என்பது சிந்தித்து நோக்குவார்க்குப் புலனாகாமற் போகாது."
51,இவைகளே தற்கால உளவியலின் பொருளாகவும் அமைகின்றன.
52,விலங்கியல் ஆராய்ச்சியில் கண்ட உண்மைகளும் உளவியலில் ஏற்ற பெற்றி எடுத்துக்கொள்ளப் பெற்றுள்ளன.
53,ஆங்கிலத்திலுள்ள சிறந்த உளவியல் நூல்களில் ஆங்காங்குச் சிறந்த ஆங்கில இலக்கிய மேற்கோள்கள் காட்டப் பெறுகின்றன.
54,இவை படிப்போருக்கு ஒருவிதத் தனி இன்பத்தை நல்குகின்றது.
55,இவை தமிழில் உளவியலைக் கற்பாருக்கு உளவியல் உண்மைகளைத் தெளிவாக மனத்தில் அமைத்துக் கொள்ளத் துணைபுரியும் என்பதற்கு ஐயமில்லை.
56,"இவை கல்வி கற்பிக்கும் ஆசிரியர்களும் மாணாக்கர்களின் பெற்றோர்களும், கல்வியில் ஆர்வங்காட்டும் பொது மக்களும் கருத்தில் இருத்த வேண்டியவை."
57,ஒழுக்க வளர்ச்சிபற்றிய விளக்கம் இயல் ஆசிரியர்களும் பெற்றோர்களும் கருத்தில் இருத்த வேண்டியது இன்றியமையாதது.
58,ஆசான் இயல் என்ற தலைப்பிலுள்ள செய்திகள் ஆசிரியர்கள் தற்சோதனை செய்து கொள்வதற்குத் துணை செய்யும்.
59,இந்நூலில் கையாளப்பெற்றுள்ள கலைச் சொற்கள் பக்கங்களில் அடிக்குறிப்பாக அமைந்துள்ளன.
60,படிப்போருக்கு இவை பெருந்துணையாக அமையும்.
61,இச்சொற்கள் அகர வரிசைப் படுத்திப் பின்னிணைப்பு ஆக இணைக்கப்பெற்றிருப் பது நூல் எழுதுவோருக்குப் பயன்படும்.
62,இங்ஙனம் ஒரு முறையான அமைப்பில் தரமான விழுமிய நூலைப் படைத்த பேராசிரியர் ரெட்டியாரின் பெருந்தொண்டு பாராட்டப் பெற வேண்டியதாகும்.
63,". அண்ணாநகர், கே."
64,ஆ ர்.
65,மாணிக்கம் சென்னை பொருளடக்கம் பதிப்புரை அணிந்துரை நூல் முகம் .
66,கல்விஉளவியலின் இயல்பும் அளவும் .
67,மனிதனும் சூழ்நிலையும் .
68,குழந்தைகளின் வளர்ச்சியும் துலக்கமும் .
69,குடிவழியும் சூழ்நிலையும் .
70,ஊக்குநிலையும் உள்ளக்கிளர்ச்சிகளும் .
71,கற்றல் .
72,கற்றலில் அடங்கிய மூலக்கூறுகள் .
73,அறிதிறனும் தனியாள் வேற்றுமைகளும் .
74,உடல் நலமும் உடல்நல வியலும் .
75,இயல்பு பிறழ்ந்த நடத்தை .
76,ஒழுக்க வளர்ச்சி .
77,மதிப்பீடும் சோதனையும் .
78,ஆசான் பின்னிணைப்பு பின்னிணைப்பு பின்னிணைப்பு பேராசிரியர் ரெட்டியாரின் நூல்கள் நூல் முகம் என்னுடை உயிரே!
79,என்னுளத் தறிவே!
80,என்னுடை அன்பெனும் நெறியாய்!
81,கன்னல்முக் கனிதேன் கண்டமிர் தென்னக் கலந்தெனை மேவிடக் கருணை மன்னிய உறவே!
82,பாடத்தை மையமாகக் கொண்டு பயிற்றும் முறை மாறிக் குழந்தையை மையமாகக் கொண்ட முறை வழக்கில் வந்துவிட்டது.
83,இந்தப் புதிய முறைக்கு முதன் முதலில் வித்திட்டவர் ரூஸோ என்ற பேரறிஞர்.
84,அவர் எழுதிய ஒமிலி என்ற நூல்தான் புதிய முறைகளின் வித்து எனலாம்.
85,இதனால்தான் ரூஸோவைக் கல்வி முறையின் காபர்னிக என்று வழங்குகின்றனர்.
86,குழந்தையை நன்றாக ஆராயக் குழந்தையை அறிவது எளிதல்ல.
87,குழந்தையைக் கவனி இயற்கையோடு இசைந்துநட என்பவை ரூஸோ கல்வித் துறையில் பணியாற்றுபவர்கட்குக் காட்டிய மாபெரும் உண்மைகள்.
88,இவர் கொள்கை உளவியல் உண்மைகளை ஒட்டியும் உள்ளது.
89,இக்கொள்கைகளைப் பயிற்சி பெற்ற ஆசிரியர்கள் அனை வரும் அறிவார்கள்.
90,இல்லத்தில் கற்பிக்கும் தாய்மார்களும் குழந்தைகளை நாடாப்பதிவு களாக்குகின்றனர் ஒலித்தட்டுகளாக்குகின்றனர்.
91,இப்படிக் கிளிப்பிள்ளைகள் போல் ஒப்புவித்தற்கு ஆசிரியர்களும் அதிக மதிப்பெண்கள் வழங்குகின்றனர்.
92,இந்த மதிப்பெண் மாயத்திலும் வகுப்பில் பெறும் நிலை மாயத்திலும் பெற்றோர்கள் மயங்கி மதி இழக்கும் நிலைக்குள்ளாகின்றார்கள்.
93,"சிறுவர் கல்வியில் அக்கறை கொள்ளும் பெற் றோர்கள், ஆசிரியர்கள், பொதுமக்கள் இவர்கட்கு இன்றியமையாத செய்திகள் பலவும் இந்நூலில் அடங்கியுள்ளன."
94,"தரமான நூல்களை வெளியிட்டு வெள்ளிவிழாக் காணும் மணிவாசகர் பதிப்பகத்திற்கும், என்னிடம் அன்பு காட்டும் குறிப்பாக எஸ்."
95,"மெய்யப்பன் அவர்கட்கும், இதற்கு முதற்காரணமாக இருந்த மணிவாசகர் நூலக மேலாளர் திரு."
96,"குருமூர்த்தி அவர்கட்கும், இந்நூலை அழகுற அச்சிட்டு உதவிய கற்பகம் அச்சக மேலாளர், செய்வன திருந்தச் செய்யும் திரு."
97,நாராயணன் அவர்கட்கும் என் மனம் உவந்த நன்றியைப் புலப்படுத்திக் கொள்ளுகின்றேன்.
98,இந்நூலுக்கு அணிந்துரை வழங்கிய திரு.கே.ஆர்.
99,"இரண்டு ஆண்டுகள் ஆசிரியப் பணி ஆற்றி, நான்கு ஆண்டுகள் போர்த்துறையில் பங்கேற்றுப் பணிபுரிந்தவர்."
100,பணியாற்றிய காலத்தில்.
101,இங்குக்கூறிய பெருமைகள் எல்லாம் பெற்ற நண்பர் இந்நூலுக்கு அணிந்துரை வழங்கியமைக்கு என் அன்பு கலந்த நன்றி என்றும் உரியது.
102,பேராசிரியர் குருசாமிரெட்டியார் சைதை ஆசிரியர் கல்லூரியில் என் உளவியல் பேராசிரியர்.
103,ஆக்ஃபோர்டு பல்கலைக்கழகத்தில் எம்.
104,பட்டம் பெற்று இந்தியக் கல்விப் பணியாளராகப் ஐ.நு.ளு பணியாற்றியவர்.
105,சிறந்த முறையில்ஆனால் சற்று விநோதமான முறையில்கற்பிப்பவர்.
106,அளக்கலாகா அளவும் பொருளும் துளக்கலாகா நிலையும் தோற்றமும் உடையவர்.
107,ஐயந் தீரப் பொருளை யுணர்த்தும் திறம் படைத்தவர்.
108,இவற்றால் பெரும்பயன் பெற்றவன் அடியேன்.
109,இவருடைய பேருரைகள் இன்னும் என்செவியில் ஒலிப்பன போன்ற பசுமையான உணர்வு உண்டாகின்றது.
110,இத்தகைய பெரும் பேராசிரியருக்கு இந்நூலை அன்புப் படையலாக்கி மகிழ்கின்றேன்.
111,என்னுடைய நெஞ்சில் நிலையாக இடம் பெற்றவன் வேங்கடம் மேவியவிளக்கு எப்படி இடம் பெற்றான் தெரியுமா?
112,அன்பர்பணி செய்யஎனை ஆளாக்கி விட்டுவிட்டால்இன்பநிலை தானே வந்து எய்தும் பராபரமே. தாயுமான அடிகள்.
113,"வேங்கடம் ,அண்ணாநகர் ந."
114,சுப்புரெட்டியார் சென்னை இயல் கல்விஉளவியலின் இயல்பும் அளவும் கல்விஉளவியல் கோட்பாடுகள் என்னுந் தொடரில் கல்வி யாவது எதனைக் குறிக்கின்றது?
115,உளவியல் எதனை உணர்த் துகின்றது?
116,கோட்பாடுகள் யாவை?
117,என்பவற்றை ஆராய்தல் வேண்டும்.
118,"முதலில், கல்வியைப்பற்றிச் சிறிது ஆராய்வோம்."
119,இது முற்றிலும் சரி என்று சொல்ல முடியாது.
120,அடிப்படைப் பாடங்களில் பயிற்சி பெறுதல் மட்டும் கல்வியன்று அஃது அதனிலும் சாலப்பெரிது.
121,"மாணாக்கனின் உள்ளம் ஒரு வெற்றிடமாகவும், அதை ஆசிரியர் அறிவுத்துணுக்குகளால் நிரப்புவதாகவும் கொள்ளப்பெற்றது."
122,கல்வி என்பது நாம் ஒருவனுக்கு ஊற்றக் கூடிய பொருளன்று ஊட்டக்கூடிய பொருளுமன்று.
123,அஃதை அவனே அடைதல் வேண்டும்.
124,கல்வியில் மூன்று அடிப்படைக் கூறுகள் உள.
125,"அவை தனியாள், அவன் வாழும் சூழ்நிலை, தனியாளுக்கும் சூழ்நிலைக்கும் இடையில் நிகழ்கின்ற இடைவினை."
126,மனிதனின் பிறப்புமுதல் இறப்புவரை யில் அவனுக்கும் அவன் வாழும் சூழ்நிலைக்கும் இடையறாத இடைநிகழ்ச்சியும் இடைவினையும் நடைபெற்று வருகின்றன.
127,தனியாள் சூழ்நிலையால் பாதிக்கப்பெறுகின்றான் சூழ்நிலை அவனை மாற்றுகின்றது.
128,அவன் இடையறாது.
129,இயற்றும் இடை வினைகளால் சூழ்நிலையும் மாற்றப் பெறுகின்றது.
130,இந்த இடை வினைகளால்தான் கல்வி ஏற்படுகின்றது.
131,குழந்தை அழுகின்றது.
132,தாய் அதனை எடுத்துப் பாலூட்டு கின்றாள்.
133,அழுகை நின்று போகிறது.
134,பிறிதொரு சமயம் அழு கின்றது இப்பொழுது பசியால் அல்ல சிறுநீர் விட்டதால் ஆடை நனையவே குளிரால் அழுகின்றது.
135,தாய் நனைந்த ஆடைகளை நீக்கி வேறு ஆடைகளை உடுத்துகின்றாள் படுக் கையையும் மாற்றுகின்றாள்.
136,அழுகை நிற்கிறது.
137,அழுதால் பல நலன்களைப் பெறலாம் என்ற அநுபவத்தைக் குழந்தை பெறு கின்றது.
138,"ஆகவே, கற்போரின் செயலையோ, உணர்ச்சியையோ, எண்ணத்தையோ மாற்றுவதே கல்வியெனப் படுகின்றது."
