Line Number,Sentence
615,யாப்பு செய்யுள் என்னும் பொருட்டு.
616,கொணர்கென அகரந்தொகுத்தல்.
617,பொருளின் றொடர்ச்சி என்பதனைத் தொடர்ந்த பொருள் என மாறுக.
618,சொல்லும் பொருளுமாம் என்பதற்கு மேல் எடுத்துக்காட்டினமை காண்க.
619,இதற்குச் சொல்லின் தொடர்ச்சியும் பொருளின்றொடர்ச்சியும் ஆராய என்றுரைப்பாருமுளர்.
620,முதுவாய பாடல் என்பதற்கு முதிர்ந்த வாயிடத்தவான பாடல் என்றுரைத் தலுமாம்.
621,என்ப அசை.
622,ஒல்லென விரைவுக் குறிப்பு.
623,ஒல்லென இருத்தினார் எனக.
624,"மதுரேசர் சோமசுந்தரக் கடவுள், மாநடு நாயகம் மணி என்ன வீற்றிருந்தார் பெருமை பொருந்திய நடுநாயகமணி என்னுமாறு வீற்றிருந்தனர்."
625,நாயகமணி தலைமை மணி.
626,தமிழ் என்றது தமிழ்ச் செய்யுட்களை யுணர்த்திற்று.
627,முதிய என்றது தமிழுக்கு அடை.
628,மதிவிளங்க என்பதற்குப் புலமைத்திறம் வெளிப்பட என்றுரைத்தலுமாம்.
629,வங்கிய சூடாமணிக்கு என நான்கனுருபாகத் திரிக்க.
630,பாச வினை வினைக்கயிறு பாசமாம் வினைப் பற்றறுப்பான் என்னும் திருத்தொண்டர் புராணச் செய்யுளும் நோக்குக.
631,சார்பு முத்தி நிலை என்னும் பொருட்டு.
632,ஆகச் செய்யுள் .
633,"சொற்குவை பெயர் வினை இடை உரிகள் ஆகும் செஞ்சொல், ஆக்கச் சொல், குறிப்புச் சொல் என்பன."
634,தொகுபீடம் தொக்கிருக்கும் பீடம் சங்கப் பலகை.
635,ஆல் அசை.
636,உவை சுட்டிடைச் சொல் அடியாகப் பிறந்த பலவின்பாற் பெயர்.
637,நந்தவனம் நந்தனம் என மரீஇயது மகிழ்ச்சியைத் தரும் பூந்தோட்டம் என்பது பொருள்.
638,"முப்போது காலை, நண்பகல், மாலை என்பன."
639,கமழ என்பது கமழும் படி என வழக்கில் வந்தது.
640,மகரந்தத்திற் படிந்து என்றுமாம்.
641,"புலப்படாமையின் பொய்யென்று கூறத் தக்க இடையென்பார், பொய்த்திடு நுண்ணிடை என்றார்."
642,"பூண்டார் என்னும் முற்று, தொழில் மேனின்றது."
643,அரும்பர் ஈற்றுப்போலி.
644,அரும்பருடைந்து என்னுஞ் சினைவினை முதன்மேல் நின்றது.
645,பைத்து பசுமை யென்னும் பண்படியாகப் பிறந்த வினையெச்சம்.
646,அன்ன அகரச் சுட்டின் றிரிபு.
647,தாழ்வோனாகிய தென்னன் எனக் கூட்டுக.
648,சண்பகசுந்தரர் என்று பெயர் கூறி வணங்கினன் என்க.
649,"அன்னது, இன்னது என்பன சுட்டுத் திரிபுகள்."
650,ஓர் விகாரம்.
651,இறுதியிலுள்ள உம்மை எச்சவும்மை.
652,நண்பு நண்ணுதல் என்றுரைப்பாருமுளர்.
653,எய்வானாகிய ஒரு சொல் செய்யிய வென்னும் வினையெச்சம்.
654,வந்தன்று உடன்பாட்டு முற்று.
655,பெருங்காப்பியத்திற்குரிய பருவ வருணனை இது முதலிய செய்யுட்களாற் கூறப்படுகின்றது.
656,சிவத்தல் வெகுளலும் செந்நிற முறுதலும் ஆம்.
657,"புளிமா ஒன்றுள தாதலாற் பிறிதினியைபு நீக்கிய விசேடணந் தந்து, தேமா என்றார்."
658,தைவர தடவ.
659,நிவந்த அன்பெறாத பலவின்பால் முற்று.
660,"செருந்தி மலர் பொற்குழை போன்றும், வண்டு நீலமணி போன்றும் விளங்கின வென்க."
661,மரவம் வெண்கடம்புமாம்.
662,பூத்த முற்று.
663,உவமம் நான்கும் உருவு பற்றியன.
664,இதனைப் பலவயிற் போலி யுவமை யணியின்பாற் படுத்தலுமாம்.
665,"எக்கரை அல்குலாக உருவகஞ்செய்து கரையைப் பெண்ணாக உருவகஞ் செய்யாமையால் இது வியனிலை யுருவகமும் மரகதம், முத்து."
666,உகுப்ப முற்று.
667,திரைகடல் வினைத்தொகை.
668,பசலை பூத்து.
669,"அலர் மலர், பழிச்சொல்."
670,இது பலவயிற் போலியுவமையணி.
671,நின்ற அன் சாரியை பெறாத பலவின்பால் முற்று.
672,இது தொழிலுவமையணி.
673,திகை திசை.
674,கொம்பர் இறுதிப்போலி.
675,கொம்பர் ஆடல் பாவைமார் ஆடல் போன்றன என மாற்றித் தொழிலுவமை யாக்கலுமாம்.
676,"இளவேனிற்காலத்தில் மாமரம் தளிர்த்தலும், குயில்கள் அதன் மீ திருந்து கூவி மகிழ்தலும், மயில்கள் கூவா தொடுங்கலும் இயல்பு."
677,நறுந்தளிர் எனப் பின்வருதலின் நாறிய என்பதற்குத் தோன்றிய என்றுரைக்க.
678,இளவேனிலைச் செங்கோல் வேந்தனாகக் கொள்க.
679,நாடு காவல் மாறி யொடுங்கிய குறுநில மன்னன் என விரித்துக்கொள்க.
680,பந்தர் ஈற்றுப்போலி.
681,களாஞ்சி காளாஞ்சி தாம்பூலமெடுக்குங் கலம்.
682,இங்கே கூறியவெல்லாம் ஓர் அரசற்கும் மன்மதனுக்கும் பொருந்துமாறு காண்க.
683,வேனிற் கோமகன் என்பதற்கு வேனிலாகிய அரசன் என்றுரைப்பாருமுளர்.
684,இச்செய்யுள் உருவகவுயர்வு நவிற்சி.
685,கலை நிறைதல் இந்துவுக்கு அடை.
686,இந்து காந்தம் சந்திரனைக் கண்டு நீர் கக்கும் கல்.
687,எழுது மாடம் சித்திர மண்டபம்.
688,சந்திர காந்த மண்டபம் முதலிய இடங்களில் மகளிர் முலைத்தடத்தில் என்பது கருத்தாகக் கொள்க.
689,மாடக் கூடல் நான்மாடக்கூடல் என்பது முதல் குறைந்து நின்றது என்றுமாம்.
690,வீழும் விரும்பும்.
691,நாகநாடு விண்ணுலகம்.
692,நுகர்வான் வினையெச்சம்.
693,"யானைமீது சிங்கம் செல்வது போலவும், குதிரைமீது யானை போவது போலவும், மலை நடப்பது போலவும் என இல்பொருளுவமையாக்கலுமாம்."
694,"ஆதித்தர் பன்னிருவராகலின், பாத்தார் என்றார்."
695,தேன் தேம் எனத் திரிந்தது.
696,செல்வாரும் போவாரும் ஊர்வாரும் நடக்கின்றாரும் ஆகிய ஆடவரும் என ஆம் செய்யுளோடு இயைக்க.
697,செறிக்கொள்வாரும் செல்வாரும் ஊர்வாரும் போவாரும் ஆகிய படையன்ன மகளிரும் என வருஞ் செய்யுளோடு இயைக்க.
698,"சுரும்பு, கரும்பு என்பன வலித்தல் பெற்றன கருவிப் படை கருவியாகிய படை இருபெயரொட்டு."
699,கொழுநரின் தோளைத் தழுவினமையால் அத்தோள்மீது இருக்கும் விசய இலக்குமி போல் விளங்கின ரென்க.
700,ஊர்வார் தழுவா இழிந்து உகப்போய்ச் சார்ந்தார் என வினை முடிக்க.
701,"ஏமாசலம், காமாயுதம் என்பன வடமொழித் தீர்க்கசந்தி."
702,"போல் என இயல்பாகப் பாடமோதி, போலுங் கைதை எனப் பொருளுரைத்தல் சிறப்பு."
703,ஆயினர் என ஒருசொல் வருவித்து முடிக்க.
704,கருவி தொகுதி.
705,களிப்பால் ஆடும் என்க.
706,கொடியின் சாரியை நிற்க உருபு தொக்கது.
707,அயில்வான் வினையெச்சம்.
708,நாணி ஒதுங்கும் என மாறுக.
709,"நாணுதல் தம் அறியாமையை உணர்ந்து வெள்குதலும், இசைக்குத் தோற்று நாணலும் ஆம்."
710,"கூந்தலை மேகம் எனவும் கண்ணை அம்பெனவும் மயிலும், உருவை மாந்தளிரெனக் குயிலும் மயங்கினவெனக் கூறுதலால் இது மயக்கவணி."
711,குவளை முதலியவற்றைக் கோடு பூத்தவென்ன என்றது இல் பொருளுவமை.
712,கொடிகள் மிடைந்த இல் இல்போன்று கொடிமிடைந்த இடம் லதாக் கிருஹம்.
713,சேடியர் செய்யும் பணியைத் தாம் செய்தலால் அவர் கைக்குதவியாவார் என்றனர்.
714,வளைப்பார் முதலியவற்றை எச்சமாக்காது தனித்தனி முடித்தலுமாம்.
715,குமிழ் குமிழம் பூப்போலும் மூக்கு.
716,கொம்பர் ஈற்றுப்போலி வருஞ்செய்யுளிலும் இது.
717,புத்தேள் புதுமை என்னும் பொருட்டு.
718,"தெத்தே, அனுகரணம்."
719,துணையுடன் ஏழிசைபாடி அதற்குப் பரிசிலாக் கள்ளினைப் பெற்றுண்ணும் பாணர் போல வண்டு பெடையுடன் பாண் செய்து தேனருந்தும் என்க.
720,இது பரிவருத்தனையணி.
721,"மலர் முகம் மலரினிடம், மலர் போலும் முகம்."
722,"கண்ணீர் கள்ளாகிய நீர், விழி நீர்."
723,உலகியல் என்றது ஆடவர் ஒழுகுந்தன்மை.
724,மெய்யே போலும் என்றது தற்குறிப்பு.
725,நேர்படாமையின் என உருபு விரிக்க.
726,யானிருக்க நீ இளைப்ப தென்னை என்றானென்க.
727,இது கலவியைக் குறிப்பாலுணர்த்தலின் உதாரம் என்னும் குணவணியாகும்.
728,வளைக்க என ஒரு சொல் வருவிக்க.
729,ஒய்யென விரைவுக் குறிப்பு.
730,ஓய்யென வளைத்து நின்றான் என இயைக்க.
731,இது தூரகாரிய வேதுவின்பாற்படும்.
732,திக் என்னும் வடசொல் திரியாது நின்றது.
733,எங்கை என்றது பரத்தையை.
734,இடு இடுதி என வெகுளியால் இருகாற் கூறினாள்.
735,கடைக்கணித்தல் கடைக்கண்ணோக்கால் கலவிக் குறிப்புணர்த்தல்.
736,நாணம் மகளிர்க்கு இயல்பாய குணம் ஆகலின் வாயாற் கூறாளாயினாள்.
737,தன் ஆவி ஆறாம் வேற்றுமை ஒற்றுமைக் கிழமைப் பொருளில் வந்தது.
738,கடைக்கணித்து பெயரடியாகப் பிறந்த இறந்தகால வினையெச்சம்.
739,பந்தர் போலி.
740,பசுமை என்பதன் ஈறுகெட்டு முதல் நீண்டது.
741,ஆற்றாப்புலவியாள் தலைவனுடன் ஊடிநின்றவள் பின் அவ்வூடல் நீட்டிக்கப்பொறாதவளாய்.
742,காஞ்சி இடையிலணியும் அணிவிசேடம் எண்கோவையுடையது.
743,"கலவியினுருவம் பற்குறி நகக்குறிகள் பாணி கொடு தட்டல், நற்கமிழ்து துய்த்தல் களி நன்கெழ அணைத்தல் முதலியன."
744,இச்செய்யுள் உதாரம் என்னும் குணவணி தொழில் நுட்பமும் ஆம்.
745,தோய்ந்த என்னும் பெயரெச்சம் காரணப்பொருட்டு.
746,இங்ஙனமாய எச்சவும்மையைப் பிறமகளிரையன்றி உன்னையும் சுமந்து என்னும் பொருட்டாகக் கொண்டு தலைவி வெகுண்டு நின்றாள் என்க.
747,மற்றொருத்தியைத் தலையிடை ஒளித்துவைத்திருக்கின்றீர் என்பாள் கங்கை மணாளனை யொப்பீர் எனச் சுருங்கச் சொல்லல் என்னும் அணிதோன்றக் கூறினாள்.
748,"வெகுளியால் எம்மை என்றும், பணிவது கரவு என்பது தோன்றப் பணிவது என் என்றும் கூறினாளென்க."
749,முன்னிருந்த துன்பத்தின் மேலும் மிக்க துன்பம் விளைத்தனள் என்பார் பரிவுமேற் பரிவு செய்தாள் என்றார்.
750,நினது புன்னகையாற் றலையளி செய்ய வேண்டுமென இரப்பான் மூரல் எப்போது அதனை வாய்திறந்து காட்டுக என வேறோராற்றாற் கூறினான்.
751,நும் என்றும் போமின் என்றும் பன்மையாற் கூறினது தன் எளிமை தோன்ற அவளை உயர்த்துச் சொல்லியவாறு.
752,இது வஞ்ச நவிற்சியணி.
753,பூம்படம் பூத் தொழிலமைந்த ஆடையுமாம்.
754,போக என்னும் வியங்கோள் ஈறு தொக்கது.
755,பற்றி என்பதற்கு உடையைப் பற்றிக் கொண்டு என்றுரைத்தலுமாம்.
756,செம்மல் பழம்பூ.
757,சினையினின்றும் கோதை மேல் வீழ்ந்த வண்டு பேதையர் போன்றது என முடிக்க.
758,"அன்று, ஏ அசை."
759,கவர்ந்தார் என்பது தொழிலையுணர்த்திற்று.
760,அல்லி பூவின் அகவிதழ்.
761,இல்லி இகர விகுதி வினைமுதற் பொருள் குறித்தது.
762,"அவ்வேறு பாடாவன கண் சிவத்தல், இதழ் வெளுத்தல், கொங்கை மேற் சந்தனக்கோலம் அழிதல், உடம்பு அலசல் முதலியன."
763,கொழுநரின் வேற்றுமை செய்யும் பொய்கை என்றதும் அவர்கள் காமக் குறிப்புடன் திளைப்பச் சென்றன ரென்பதைக் குறித்தற் பொருட்டாம்.
764,அரோ அசை.
765,பெருங்காப்பியத்துட் புனைந்து கூறுதற்குரிய புனல் விளையாட்டு இச்செய்யுள் முதலாகக் கூறுகின்றார்.
766,இந்நூலாசிரியர் கயந்தலை என்பதனைக் கயமென்னும் பொருளிற் பலவிடத்தும் வழங்குவர்.
767,நன்னர் பண்புப் பெயர் நல் பகுதி நர் விகுதி.
768,அகன்ற அன்பெறாத பல வறிசொல்.
769,ஓகாரம் எதிர்மறை.
770,குறுகு முன் அகன்றன இரிந்தன என்பது விரைவுயர்வு நவிற்சி.
771,மலர்கள் மகளிர் அவயவங்களோடு தாக்கல் மலைதலை யொத்தன வென்க.
772,தொறும் தொழிற் பயில்வுப் பொருளில் வந்த இடைச்சொல்.
773,மலைவன தொழிலை யுணர்த்திற்று.
774,அலைவனவாகிய அரும்பையும் மலரையும் ஒத்திருந்தன வென்க.
775,கொங்கையும் முகங்களும் அசைதல் அரும்பொடு மலர்த் தொகுதி அலைதலையொத்தன என ஒரு சொல் வருவித்துரைத் தலுமாம்.
776,மருங்கர் போலி.
777,அலைவன தொழிற் பெயர்.
778,"வாயுங் கண்களும் வேறுற்ற வண்ணம் செந்நிறமுடைய வாய் வெண்ணிறமாகவும், வெண்ணிறமுடைய கண் செந்நிறமாகவும் மாறிள் தன்மை."
779,அது கேட்ட தலைவி அவன் மற்றொருத்தியைத் தன் இன்னுயிரனையளாகக் கொண்டு வினாவினன் எனக் கருதி வெகுண்டு அழுதனள் என்க.
780,காயும் பகைவரைக் கொல்லும் என்றுமாம்.
781,காயும் வேற்கணாள் என்றது அவளது வெகுளியைக் குறித்தவாறு.
782,கண்ணீரால் என உருபு விரிக்க.
783,மிக அழுதாள் என்பதனை வேறு வகையாற் கூறினார்.
784,ஆடுவான் வானீற்று வினையெச்சம்.
785,பற்றினள் முற்றெச்சம்.
786,ஏகுவாள் பெயர்.
787,சீ சீ இகழ்ச்சிக் குறிப்பு.
788,பைங்கழல் பசும் பொன்னாற் செய்யப்பட்ட கழல்.
789,தலைவன் மார்பிலே தாமரை மொட்டு அழுந்திய வடுவைக் காமக்கிழத்தியின் முலைச்சுவடாகக் கருதித் தலைவி புலந்தனள் என்க.
790,எரியெனச் சினமிக்கு என விரித்துரைத்துக் கொள்க.
791,புலவி துன்பஞ் செய்தலின் அதனைப் பொறாளாயினள் என்க.
792,தலைவன் தன்னை அணைத்து எடுக்குங் கருத்தினளாய் நீரில் அழுந்துவாள் போன்று அயர்ந்து அன்னத்தை நோக்கி இரப்பாளாயினள்.
793,தாழ்த்ல் தாங்குதல்.
794,"கரும்பு அதன் சாற்றிற்கும், கமலம் அதன் மலருக்கும், முல்லை அதன் அரும்புக்கும் ஆகுபெயர்."
795,முல்லையரும்பு பற்களை உணர்த்திற்று.
796,கூந்தலாற் சூழப்பட்ட முகம் வண்டு சூழ்ந்த கமலம் போன்றிருந்தது.
797,"இதன்கண் ஐயவணியும், தெரிதருதேற்ற வுவமை யணியும் விரவியுள்ளன."
798,"நீட்டினள், கண்டிலள், தடவினள் என்பன முற்றெச்சம்."
799,"சலத்துள் ஒளித்தியோ என்பதனை இரட்டுற மொழிதலாக்கி, வஞ்சத்தால் உள்ளே மறைந்தனையோ என்றும் உரைத்தல் அமையும்."
