Line Number,Sentence
4356,அம்மையார் விரும்பிய பொறுப்பாட்சி உறுதிமொழி அரசாங்கச் சார்பில் பார்லிமெண்டில் பிறந்தது.,False
4357,அது போழ்து இந்திய அமைச்சராயிருந்த திரு மாண்டேகு இந்திய நிலைமையை நேரில் உணர்தற்கு இந்தியா போந்தனர்.,False
4358,அந்நிலையில் முப்பத்திரண்டாவது காங்கிர கல்கத்தாவில் அன்னிபெஸண்ட் அம்மையார் தலைமையில் கூடிற்று.,False
4359,ஐயாயிரம் பிரதிநிதிகள் குழுமினார்கள்.,False
4360,தீர்மானங்கள் பல நிறைவேறின.,False
4361,"அவற்றுள் பொறுப்பாட்சித் தீர்மானமும், அலி சகோதரரின் விடுதலையைப் பற்றிய தீர்மானமும் மக்கள் நெஞ்சைக் கவர்ந்தன.",False
4362,ஆம் ஆண்டில் மாண்டேகுவின் அறிக்கை வெளிவந்தது ஐரோப்பா யுத்தம் முற்றுப்பெற்றது டெல்லியில் பண்டித மாளவியர் தலைமையில் காங்கிர நடைபெற்றது.,False
4363,அக்கூட்டம் விசாரித்து வெளியிட்ட அறிக்கையை அடிப்படையாகக் கொண்டு இந்தியச் சட்டசபையில் ஒரு மசோதா கொண்டுவரப்பட்டது.,False
4364,அதைச் சட்டசபைப் பிரதிநிதிகள் மறுத்தார்கள் நாடே மறுத்தது.,False
4365,அரசாங்கம் பிடிவாதத்தில் நின்று மசோதாவைச் சட்டமாக நிறைவேறச் செய்தது.,False
4366,மகாத்மாவின் சிந்தை நாட்டின் மீது நடந்தது.,False
4367,அவர் நாடு முழுவதுஞ் சுற்றிச் சுற்றிச் சத்தியாக்கிரகத்துக்கு நாட்டைப் பண்படுத்த முயன்றனர்.,False
4368,"சத்தியாக்கிரகம் தொடங்குதற்கு முன்னர், நாட்டின் நிலையைச் சோதிக்க வேண்டி, சத்தியாக்கிரக முறையில் ஒருநாள் கொண்டாடப்பட வேண்டுமென்று காந்தியடிகள் விரும்பினர்.",False
4369,அதற்கென ஓர் அறிக்கை அவரால் விடுக்கப்பட்டது.,False
4370,அது வருமாறு பல கூட்டங்களில் யான் விளக்கிக் கூறியபடி சத்தியாக் கிரகம் ஒரு சமய சம்பந்தமான இயக்கமே.,False
4371,அது தூய்மைக்கும் கழுவாய்க்கும் உரிய முறையாகும்.,False
4372,"தனக்குத்தானே வருந்துவது, சீர்திருத்தத்தையோ அல்லது துக்க நிவர்த்தியையோ நல்கும்.",False
4373,நமது மனோநிலையைத் திறம்பட வெளியிடும் வழியில் செவ்வனே ஒழுங்காக அந்நாளைக் கொண்டாடச் சில முறைகளை ஈண்டு குறிப்பிடுகிறேன்.,False
4374,"பட்டினி குறிக்கும் முறை யிலாவது, அரசாங்கத்தை வருத்தும் நோக்குடனாவது இந்த நோன்பை ஏற்றலாகாது.",False
4375,பொது நலத்துக்கு இன்றியமையாத சில வேலைகள் தவிர மற்றவேலைகளெல்லாம் அன்று நிறுத்தப்படல் வேண்டும்.,False
4376,சந்தையும் மற்ற வாணிப நிலையங்களும் மூடப்படல் வேண்டும்.,False
4377,ஞாயிற்றுக் கிழமைகளிலும் வேலை செய்வோர் முன்னரே ஓய்வு கேட்டுப் பெற்று வேலை செய்யாமலிருக்கலாம்.,False
4378,இவ்விரண்டும் அரசாங்க ஊழியராலும் கொள்ளப் படலாமென்று தயங்காது கூறுவேன்.,False
4379,"அன்று இந்தியா முழுவதும், கிராமங்களிலும் பொதுக் கூட்டங்கள் கூடி கொடுஞ்சட்டங்கள் திரும்ப வாங்கப்படல் வேண்டுமெனத் தீர்மானங்கள் நிறைவேற்றல் வேண்டும்.",False
4380,"இவை அங்கீகரிக்கக் கூடியனவாயின், ஆங்காங்குள்ள சத்தியாக்கிரக சங்கத்தார் தக்க ஏற்பாடு செய்யும் பொறுப்புடையவராகிறார்.",False
4381,மற்ற மற்ற சங்கத்தாரும் இம்முயற்சியில் தலைப்பட்டுழைப்பாரென நம்புகிறேன்.,False
4382,பஞ்சாப் படுகொலை காந்தியடிகள் விரும்பியவாறு சத்தியாக்கிரக நாள் யாண்டுங் கொண்டாடப்பட்டது.,False
4383,அத்திருநாளைப் பாஞ்சாலம் மிகச் சிறப்பாகக் கொண்டாடியது அதன் பயனாகப் பாஞ்சாலம் என்ன கண்டது?,False
4384,அடக்குமுறை கண்டது இராணுவ ஆட்சி கண்டது ஜாலியன் வாலாபாக் கொலை கண்டது.,False
4385,ரௌலட் சட்டத்தால் கனன்று கொண்டிருந்த நாடு பஞ்சாப் படுகொலையால் எழுநாவிட்டு எரியலாயிற்று.,False
4386,அச்சமயத்தில் பிரிட்டிஷ் அரசாங்கத்தால் கிலாபத்துக்கு நியாயம் பிறவியாமையும் உடன் கலந்தது.,False
4387,"ரௌலட் சட்டமும், பஞ்சாப் படுகொலையும், கிலாபத் கிளர்ச்சியும் ஒன்றுபட்டுச் சுயராஜ்ய வேட்கையை எழுப்பின.",False
4388,நாடும் அவ்வாறே கொண்டாடி வருகிறது.,False
4389,நாட்டு வாரக் கொண்டாட்டத்தைக் குறித்து ஏறக்குறைய ஒவ்வோர் ஆண்டும் காந்தியடிகள் ஒவ்வொருவித அறிக்கை விடுப்பது வழக்கம்.,False
4390,முதலிரண்டாண்டின் அறிக்கைகள் வருமாறு ரௌலட் சட்டத்தின் ஆற்றலை வீழ்த்தி அதைத் துருப்பிடிக்கச் செய்த நாள் ஏப்ரல் ஆறாம் நாளாகும்.,False
4391,அந்நாளில் மக்கள் உள்ளத்தில் பகைமையாதல் சின மாதல் ஊர்தலாகாது.,False
4392,அன்று உயிர் துறந்த ஒன்றுமறியா நம் மக்களை நினைந்து சீராட்டல் அறம்.,False
4393,அன்று நிகழ்ந்த கொடுஞ் செயல்களை நினைத்தல் கூடாது.,False
4394,நாடு தியாகத்துக்குச் சித்தமாக எழ வேண்டுமே யன்றிப் பகைமை பாராட்டிப் பழிக்குப் பழி வாங்க இகல் கொள்ளலாகாது.,False
4395,"காழ்ப்பு, இன்னாச்சொல் சிறிதுந் தலைகாட்ட லாகாது.",False
4396,ஆனால் அஞ்சாமையும் உறுதியும் நிலைத்து நிற்றல் வேண்டும்.,False
4397,ஏப்ரல் ஆறும் பதின்மூன்றும் வரப்போகின்றன.,False
4398,"ஆறு, இந்தியாவின் விழிப்பைக் கண்டநாள்.",False
4399,பதின் மூன்று துன்பங் கண்டநாள்.,False
4400,இவ்விரண்டு நாளையும் சென்ற ஆண்டு இந்தியா ஊக்கத்தோடு கொண் டாடிற்று.......,False
4401,சென்ற ஆண்டு நம்மக்கள் இரத்தஞ் சிந்திய இடத்தை விலைக்கு வாங்கும் பொருட்டு நிதி திரட்டுவதில் கருத்துச் செலுத்தி னோம்.,False
4402,பின்னே பெரு நிகழ்ச்சி நேர்ந்திருக்கிறது.,False
4403,"இப் பொழுது கிலாபத்துக்கும் பஞ்சாப்புக்கும் நியாயம் பிறப் பிக்கவும், சுயராஜ்யத்தை நிலை பெறுத்தவும் நாடு உறுதி கொண்டு நிற்கிறது.",False
4404,"டிசம்பர் காங்கிர, ஓராண்டிற்குள் சுயராஜ்யம் பெறத்தான் கொண்ட விருப்பத்தை வெளி யிட்டிருக்கிறது.......",False
4405,இம்முறை ஆறுவித கருமங்கள் ஆற்றப் பெறல் வேண்டும்.,False
4406,நாம் இன்னும் நமது உள்ளத்தைத் தூய்மைப் படுத்தல் வேண்டும்.,False
4407,ஹிந்து முலிம்களாகிய நாம் ஒருவரை ஒருவர் ஐயுறுவதை அறவே ஒழித்தல் வேண்டும்.,False
4408,நமக்குள் ஒருவருக்கொருவர் பிழைபாடு நிகழ்த்திக் கொள்ள இயலாதவர் என்னும் உறுதிபெறல் வேண்டும்.,False
4409,ஹிந்துக்களாகிய நாம் நம்மின்னும் தூய்மை யில்லாதவன் அல்லது இழிவானவன் அல்லது தாழ்ந்தவன் என்று ஒருவரையும் நினைத்தலாகாது.,False
4410,ஆதலால் பறையர் வகுப்பினரைத் தீண்டாதாரெனக் கருதுவதை அறவே விட்டொழித்தல் வேண்டும்.,False
4411,நம்முடன் பிறந்த ஒருவனைத் தீண்டாதானென எண்ணுவது பாவமென்று கொள்ளல் வேண்டும்.,False
4412,இவை மூன்றும் அகநிலை மாற்றத்துக் குரியன.,False
4413,இவைகளின் பயனை நமது நித்திய நடைமுறையில் காணலாம்.,False
4414,குடியை நிறுத்த ஒவ்வொருவரும் இவ்வாரத்தில் பெரு முயற்சி செய்தல் சிறப்பு.........,False
4415,எதற்கும் மூர்க்கத் துறை நண்ணுதல் கூடாது.,False
4416,உறுதிகொண்ட அமைதியான முயற்சி வெற்றியளிக்கும்.,False
4417,"ஒவ்வொரு வீட்டிலும் இராட்டை சுழற்ற, கதராடை பெருக்கலும் அணிதலும், அந்நிய ஆடையை அறவே தொலைத்தலும் நிகழல் நேர்மை.",False
4418,இடையீடின்றித் திலகர் சுயராஜ்ய நிதிக்குப் பொருள் திரட்டல் வேண்டும்.,False
4419,ஜனப்பிரதிநிதிகளும் நாடும் ஒருமுகமாக எதிர்த்தும் அரசாங்கம் ரௌலட் சட்டத்தை நிறைவேற்றியே தீர்த்தது.,False
4420,ஆனால் அச்சட்டம் நாட்டின் மீது பாயவே இல்லை.,False
4421,அஃது அரசாங்கத்தின் அம்பறாத்தூணியில் கிடந்து துருப்பிடித்தே ஒழிந்தது.,False
4422,எதிர்ப்புக் கிடை அம்பறாத் தூணியில் கிடக்குமாறு ஒரு சட்டத்தை ஏன் நிறைவேற்றல் வேண்டும்?,False
4423,ஜனநாயக உணர்வின்மை!,False
4424,ஜனநாயக உணர்வுக்குச் சுயராஜ்யம் தேவை.,False
4425,"ஆகவே ரௌலட் சட்டமும், பஞ்சாப் படுகொலையும், கிலாபத் கிளர்ச்சியும் சுயராஜ்ய வேட்கையை எழுப்பின என்க.",False
4426,இரட்டை ஆட்சி ஆம் ஆண்டிலேயே மாண்டேகு செம்பர்ட் சீர் திருத்தம் பார்லிமெண்டில் நிறைவேறியது.,False
4427,அதில் இரட்டை ஆட்சி முறை அமைந்திருந்தது.,False
4428,அஃது இந்தியாவில் எழுந்த எரியைத் தணிக்கு மென்று பிரிட்டனில் எதிர்பார்க்கப்பட்டது.,False
4429,பிரிட்டன் ஏமாற்ற மடைந்தது.,False
4430,ஒரு பக்கம் துப்பாக்கி மற்றொரு பக்கம் சீர்திருத்தமா என்று மக்கள் பேசலானார்கள்.,False
4431,மக்களிடைச் சுயராஜ்ய வேட்கையே முருகி எழுந்து நின்றது.,False
4432,சுயராஜ்ய திலகர் ஆம் ஆண்டு இவ்வுலக வாழ்வை நீத்தனர்.,False
4433,அவ்வாண்டு முப்பத்தைந்தாவது காங்கிர நாகபுரியில் ஸி.,False
4434,விஜயராகவாச்சாரியார் தலைமையில் கூடியது.,False
4435,அன்று முதல் இன்று வரை காங்கிர காந்தியடிகள் வழியே நடைபெற்று வருகிறது.,False
4436,சத்தியாக்கிரகம் காந்தியடிகள் பலமுறை பல காரணம் பற்றிச் சத்தியாக்கிரகப் போர் நடாத்தியுள்ளனர்.,False
4437,அவற்றுள் சிறந்தன இரண்டு.,False
4438,ஒன்று இல் தொடங்கப் பெற்றது மற்றொன்று இல் துவங்கப் பெற்றது.,False
4439,இரண்டும் நாட்டின் விடுதலையைக் குறிக்கொண்டு நிகழ்ந்தவை.,False
4440,இரண்டு முறையும் பல்லாயிரக்கணக்கான மக்கள் சிறை புகுந்தார்கள்.,False
4441,சத்தியாக்கிரகப் போரால் நாடு முழுவதும் விழிப்புற்றது.,False
4442,காந்தியடிகளின் ஒவ்வொரு செயலும் அச்சத்தை அகற்றுவதென்பது உலகறிந்ததொன்று.,False
4443,"சுயராஜ்யக் கட்சி காந்தியடிகளின் அறக்கிளர்ச்சியால், மாண்ட் போர்ட் சீர்திருத்தம் காங்கிரஸின் ஒத்துழைப்பைப் பெரிதும் பெறவில்லை.",False
4444,இடையில் இல் காங்கிரஸுக்குள் தேசபந்து தா தலைமையில் சுயராஜ்யக்கட்சி என்றொரு கிளை பிரிந்து சட்ட சபைகளைப் பற்றலாயிற்று.,False
4445,அதனால் எதிர்பார்த்த பயன் விளையவில்லை.,False
4446,காங்கிரஸுக்குள் சுயராஜ்யக்கட்சி என்று ஒன்று தோன்றிய தற்குக் காரணம் சத்தியாக்கிரகப் போருக்குப் பின்னே நாட்டிடைத் தோன்றிய சோர்வேயாகும்.,False
4447,ஆக்கவேலையில் மக்களுக்கு ஊக்கம் பிறக்கவில்லை.,False
4448,"அது கண்ட ஸி.ஆர்.தா, சுயராஜ்யக் கட்சியைத் தோற்றுவித்து, நாட்டிடை ஊக்கமூட்டினார்.",False
4449,அவ்வூக்கமும் நிலையாக நிற்கவில்லை.,False
4450,அதனால் காங்கிர தலைவர் சிலரிடைச் சுத்த சுயராஜ்ய சுயேச்சை உணர்ச்சி தோன்றியது.,False
4451,அது குறித்து முயன்றவர் திரு .ஸ்ரீ ஐயங்கார் உள்ளிட்ட சிலர்.,False
4452,சுத்த சுயராஜ்யத் தீர்மானத்தைக் காந்தியடிகள் ஏற்க ஒருப்படவில்லை.,False
4453,வேற்றுமையுணர்வு பெருகிப் புயலாகாதவாறு ஒருவித முடிவு காணப்பட்டது.,False
4454,காங்கிர எதிர்பார்த்தபடி அரசாங்கத்தினிடமிருந்து பதில் கிடைக்கவில்லை.,False
4455,பின்னே காந்தி இர்வின் உடன்படிக்கை காரணமாகப் போர் ஓரளவில் நின்றது.,False
4456,நாற்பத்தைந்தாங் காங்கிர வல்லபாய் படேல் தலைமையில் கராச்சியில் கூடியது.,False
4457,லார்ட் வில்லிங்டன் ஆட்சியில் அடக்குமுறை மீண்டும் சண்டதாண்டவம் புரிந்தது.,False
4458,நாற்பத்தாறாவது காங்கிர பாபு இராஜேந்திர பிரஸாத் தலைமையில் பம்பாயில் நடைபெற்றது.,False
4459,அன்று முதல் இன்று வரை காங்கிர நிலைமை மாறி வரலாயிற்று.,False
4460,"அக்கூட்டம், இந்தியா போந்து விசாரணை தொடங்கியபோது, அதனுடன் காங்கிர கலந்து கொள்ளவில்லை.",False
4461,காங்கிர விலகியே நின்றது.,False
4462,சைமன் குழு தனது கடனை ஒருவாறு ஆற்றிப் பார்லி மெண்டுக்கு அறிக்கை செலுத்தியது.,False
4463,"அதனையொட்டி, ஒரு வெள்ளை முடங்கல் பார்லிமெண்ட் சார்பில் வெளிவந்தது.",False
4464,இரண்டு முறை வட்டமேஜை மகாநாடு கூடிற்று.,False
4465,வட்டமேஜை மகாநாட்டின் பயனாகப் பார்லிமெண்டில் ஆம் ஆண்டு இந்திய அரசியல் சீர்திருத்தம் சட்டமாக நிறைவேறியது.,False
4466,அதில் ஒருவித மாகாண சுயஆட்சி வழங்கப்பட்டது.,False
4467,பதவி ஏற்பு இல் புதிய அரசியல் சீர்திருத்தத்தை யொட்டித் தேர்தல் நடைபெற்றது அதில் காங்கிர கலந்து கொண்டது.,False
4468,வெற்றி காங்கிரஸுக்குப் பெருமிதமாக விளைந்தது.,False
4469,நாடு காங்கிர பக்கம் நிற்றல் வெள்ளிடை மலையெனப் பிரிட்டனுக்கு விளங்கலாயிற்று.,False
4470,காங்கிர சார்பில் முதன் முறையாகப் பதவி ஏற்கப்பட்டது.,False
4471,நாடு அமராவதி யாகுமென்று மக்கள் கருதலானார்கள்.,False
4472,நாளடைவில் எல்லாம் உருவெளியாயின.,False
4473,இரண்டரை ஆண்டு பல மாகாணங்களில் காங்கிர சார்பில் ஆட்சி முறை நடைபெற்றது.,False
4474,நாடு எதிர்பார்த்தபடி ஆட்சி நடை பெறவில்லை.,False
4475,காரணம் பலபடக் கூறலாம்.,False
4476,சிலவற்றை ஈண்டுக் குறிப்பிட்டு மேற்செல்கிறேன்.,False
4477,சில குறிப்புக்கள் அபேட்சகரை தெரிந்தெடுத்ததில் காங்கிர பார்லி மெண்ட் போர்டு நேரிய முறையில் கவலை செலுத்தவில்லை.,False
4478,அது சட்டசபையின் பொறுப்புணராமலே தன் கடனை ஆற்றியது என்று கூறல் மிகையாகாது.,False
