Line Number,Sentence
954,"அரோரா அவன் நிலைக்கு இரங்கினாள் ஆனால், முன்பு அவன்மீது அவள் கொண்டிருந்த காதல் அற்றுப் போய்விட்டது.",False
955,அவனும் அவள் ஒருத்தி இருப்பதையே உணரமுடியாதவனாகிவிட்டான்.,False
956,"எனவே, அவள் அவனை மீண்டும் பூவுலகிற்கே இட்டு வந்து, வெட்டுக்கிளியாக உருமாற்றி அங்கேயே விட்டுச் சென்றாள்.",False
957,"புல் வெளியில் கிரீச், கிரீச் என்று பச்சை வெட்டுக்கிளி இரையும்போது அரோராவின் கணவனான டிதோனசை நினைவுகொள்ளுங்கள்.",False
958,"கிரேக்கர்கள், இரவில் தண்ணொளி வீசி எல்லாரையும் மகிழ்விக்கும் வெண்மதியைப் பெண்ணாக உருவகித்து அவளை டயானா என்று குறிப்பிட்டு வந்தார்கள்.",False
959,டயானா ஒரு வேட்டுவப் பெண்ணாக அவர்கள் கண்களுக்குத் தோன்றினாள்.,False
960,அவள் கையில் வெள்ளியினாலான வில் ஒன்று இருக்கும்.,False
961,அவள் அம்புகள் வெள்ளி முனை படைத்தவை.,False
962,டயானாதான் வேட்டைத் தொழிலுக்கு இறைவி.,False
963,வேட்டையாடுவதற்கு வசதியாகச் சல்லடம் கட்டுவதுபோல் அவள் ஆடை தொடைவரையில்தான் தொங்கும்.,False
964,அவள் முதுகில் அம்புக்கூடு தொங்கும்.,False
965,அவள் மேலாடை நெடுக விரிந்து பரவிக் கிடக்கும்.,False
966,அந்த ஆடை முழுவதிலும் விண்மீன்கள் சுடர்விட்டு ஒளிவீசும்.,False
967,அவள் நெற்றியில் இளம்பிறை திகழும்.,False
968,"இந்த அழகு வர்ணனை, நட்சத்திரங்கள் மின்னும் இராக்கால வானத்தை நம் அகக் கண்முன் கொண்டு வருகிறதல்லவா?",False
969,டயானா அழகும் எழிலும் நிறைந்த ஒரு தெய்வமகள்.,False
970,தன் தோழியரைவிட அவள் ஒரு பிடி உயரமானவள்.,False
971,நீரணங்குகளும் மரக்கன்னியருமே அவளுக்குத் தோழிகள்.,False
972,ஒருநாள் அப்பாலோ கடலில் தென்பட்ட கருநிறப் பொருள் ஒன்றை அவளுக்குச் சுட்டிக் காட்டினான்.,False
973,அப்பாலோவுக்கு அந்தக் கருநிறப் பொருள் என்ன என்பது நன்றாகத் தெரியும்.,False
974,அது ஓரியன் என்னும் ஒரு பூதகணத்தவனின் தலை.,False
975,ஓரியன் கடலுக்கு இறைவனான நெப்டியூனின் மகன்.,False
976,கடலில் நடந்து செல்லும் பேராற்றலை நெப்டியூன் தன் மகனான ஓரியனுக்கு வழங்கியிருந்தான்.,False
977,அப்பாலோவுக்கு ஓரியன்மீது பொறாமை இருந்து வந்தது.,False
978,"ஓரியன், டயானாமீது அன்புகொண்டிருந்தான்.",False
979,அவன் அடிக்கடி கடலைக் கடந்துவந்து அவளைக் கண்டு போவான்.,False
980,அப்படி வரும்போது அவன் தன் தலைமட்டிலும் கடல் அலைக்கு மேலே தெரியும்படி நடந்து வருவான்.,False
981,"ஆனால், அன்று, நெடுந் தொலையில் வந்த ஓரியனை டயானாவினால் தெரிந்துகொள்ள முடியவில்லை.",False
982,"ஐயோ, சிரியசே!",False
983,டயானா ஓரியனை விண்மீன் மண்டலத்தில் என்றும் விளங்கும்படி செய்துவிட்டாள்.,False
984,"அவள் ஆணைப்படி ஓரியனின் நாய் சிரியசும், அவனது வாளும், இடுப்புக் கச்சையும் அவனுடன் விண்மீன்களாக இன்றும் விளங்குகின்றன.",False
985,டயானா எத்துணை ஆற்றல் படைத்த பெருந்தெய்வம் என்பதை நீங்கள் இக்கதையிலிருந்து தெரிந்து கொண்டிருப் பீர்கள்.,False
986,அவள் உலக மக்களுக்கு உற்ற துணைவி.,False
987,"ஆனால், அவளைப் பகைத்தவர்களுக்கு அவள் மிகவும் பொல்லாத எதிரி.",False
988,"ஆனால், ஆகமெம்னன் அதற்கு முதலில் இணங்கவே இல்லை பலநாள் பிடிவாதமாக மறுத்து வந்தான்.",False
989,"ஆனால், இறுதியில் வேறு வழியில்லாது போகவே அவன் அவளை அதற்கு ஒப்படைக்க இணங்கினான்.",False
990,அந்த இளநங்கையும் காலும் கையும் கட்டுண்டு பலிபீடத்தில் தலைவைத்துக் கிடந்தாள்.,False
991,அவள் தலையை வெட்டுவதற்குக் கத்தியையும் ஓங்கியாகிவிட்டது.,False
992,"ஆனால், அந்நொடியில் நிலவுத் தெய்வத்தின் நெஞ்சு இளகி விட்டது.",False
993,அப்பெண்மீது அவள் இரக்கங்கொண்டாள்.,False
994,அவளை டயானா ஒரு மேகப்படலத்தில் மறைத்துச் சுற்றி எடுத்துக் கொண்டு போய்விட்டாள்.,False
995,அவளுக்குப் பதிலாக ஒரு மானை அவள் பலிபீடத்துக்கு அனுப்பி வைத்தாள்.,False
996,"ஆனால், மற்றொருதடவை, ஆக்டீயன் என்னும் வேட்டுவச் சிறுவன் ஒருவன் தவறிழைத்தபோது அவள் இவ்வாறு பரிவுடன் நடந்துகொள்ளவில்லை.",False
997,அவள் தன் தோழியருடன் ஒருநாள் ஒரு சுனையில் நீராடிக் கொண்டிருந்தபோது அவ்வேடன் ஒளிந்திருந்து பார்த்துவிட்டான்.,False
998,டயானாவுக்கே தனியுரிமையுள்ள காட்டுச் சுனையின் தெள்ளிய நீரில் அவளும் தோழியரும் நீரை ஏற்றி இறைத்து நீராடிக் கொண்டிருந்தனர்.,False
999,அச்சுனையைச் சுற்றி வளர்ந்திருந்த செடிகளின் இலைகள் திடீரென விலகி இடைவெளி தெரிந்தது.,False
1000,அதன் வழியே ஓர் ஆண் மகன் உற்றுப் பார்ப்பதை அவர்கள் கண்டார்கள்.,False
1001,ஒருவேளை அவன் தெரியாத்தனமாக அப்படிப் பார்த்திருக்கலாம்.,False
1002,டயானாவின் கண்கள் சீற்றத்தால் சிவந்தன.,False
1003,"சிறிது நீரை வாரி அவன்மீது தெளித்து, ஓடிப்போ என்று அவள் விரட்டினாள்.",False
1004,ஆக்டீயோன் ஓடிச்செல்லும்போதே அவன் உடல் முழுவதிலும் மயிர் முளைத்து வந்தது தலையில் கொம்புகள் கிளம்பின.,False
1005,"சிறிது தொலைபோனதுமே அவனுக்கு, கைகளையும் கால்களையும் ஒருப்போல ஊன்றி ஓடினால் விரைவாகச் செல்லலாம் என்ற உணர்ச்சி ஏற்பட்டது.",False
1006,"அதேபோல், அவனும் அக்காட்டினூடே ஒரு விலங்குபோல் விரைந்து ஓடினான்.",False
1007,தனக்கு என்ன நேர்ந்துவிட்டது என்பதை அவன் முதலில் உணரவில்லை.,False
1008,ஒரு நீரோடை அருகில் வந்தவுடன் தண்ணீரில் தன் உருவத்தை அவன் கண்டான்.,False
1009,டயானா தன்னை ஒரு மானாக மாற்றிவிட்டிருப்பதை அவன் உணர்ந்தான்.,False
1010,சற்று நேரத்துக்குள் அவன் நாய்களே அவனை விரட்டத் துவங்கின.,False
1011,"தான் யார் என்பதை அவைகளுக்கு அவனால் உணர்த்த முடியாமற்போகவே, அவை அவனை வேட்டையாடிக் கொன்றுவிட்டன.",False
1012,அந்நிகழ்ச்சி நடந்ததிலிருந்து கிரேக்க வேட்டைக்காரர்கள் டயானாவின் சுனைக்குப் பக்கத்தில்கூடச் செல்வதில்லை.,False
1013,"சினம் மூண்டால் டயானா இவ்வாறு கடுமையாக நடந்து கொள்வாளாயினும், இயல்பாக அவள் இரக்கமுள்ளவள் தான்.",False
1014,கிரேக்க மாவீரன் ஹெர்க்யூலிஸ் ஆற்றிய பன்னிரு அருஞ் செயல்களுள் நான்காவது பணி டயானாவின் மானைப் பிடிப்ப தாகும்.,False
1015,அம்மானை அவன் ஓராண்டு காலம் ஓடித் துரத்தினான்.,False
1016,சற்றே களைத்த மான் டயானாவைத் தஞ்சமடைந்தது.,False
1017,டயானாவின் இயற்கை இயல்பை இது எடுத்துக் காட்டும்.,False
1018,ஒலிம்பசு மலையில் இருந்த பல தெய்வமாளிகைககளில் ஒரு மாளிகை பெரும்பாலும் ஆளில்லாமல் வெறுமனேயே இருக்கும்.,False
1019,எப்போதாவது கடவுளர் பேரவை கூடும்போது மட்டிலும்தான் அதன் தலைவன் அங்கே வந்து இருப்பான்.,False
1020,"மிச்ச நாட்களில் அவன் தன் தனிப்பட்ட தலைமை மாளிகையில், இதைவிட இன்னும் பேரழகுவாய்ந்த பொற்கோயிலில், கொலுவிருப்பான்.",False
1021,அப்பொற்கோயில் எங்கே இருந்தது என்று உங்களால் கூறமுடியுமா?,False
1022,அது கடலுக்கடியில் இருந்தது!,False
1023,தனித் தங்கத்தினால் ஆன அம்மாளிகை மிகவும் பெரிது.,False
1024,ஆயிரக்கணக்கானபேர்கள் அங்கே வாழ இடமுண்டு.,False
1025,அதன் அடித்தளத்தில் நுண்ணிய வெண்மணல் பரப்பப்பட்டிருந்தது.,False
1026,அம்மணலுடன் முத்தும் வயிரமணிகளும் விரவப்பட்டிருந்தன.,False
1027,அந்த அரண்மனைப் பூங்காவில் பவளத்தாலான செய்குன்று களும் படிகமலைகளும் இருந்தன.,False
1028,அழகிய பலநிறப்பூக்கள் நிறைந்த கடற்செடிகளும் பச்சைப் பசேரென்ற கடற் பாசிகளும் அங்கே இருந்தன.,False
1029,சிறுசிறு மீன்கள் உள்ளே வந்து ஓடி ஆடித் திரியும் அங்கே பல குகைகளும் கெவிகளும் இருந்தன.,False
1030,அவைகளில் கடல் கன்னியர் வாழ்ந்து வந்தார்கள்.,False
1031,அந்த அரண்மனையின் அரசன் நெப்டியூன்.,False
1032,அவன் தான் கடல் இறைவன்.,False
1033,அவன்தான் கடலுக்கடியில் இப்பெரு மாளிகையைக் கட்டியிருந்தான்.,False
1034,அங்கே அவன் கொலுவிருந்தான்.,False
1035,"அவனுடன் அவன் மனைவி ஆம்பிட்ரைட் என்பவளும், மகன் ட்ரைட்டனும் வாழ்ந்து வந்தார்கள்.",False
1036,நெப்டியூன் கையில் மூவிலைச்சூலம் ஒன்று இருக்கும்.,False
1037,அவன் அச்சூலத்தை நிலத்தில் ஊன்றினால் அதிலிருந்து தெள்ளிய இனிய நீர் ஆறாகப் பெருகும்.,False
1038,"நெப்டியூன் தன் விருப்பம்போல் கடலில் சூறைக் காற்றைக் கிளப்பிக் கடலைக் குமுறவைக்கவும், இல்லையேல், அமைதியை ஏற்படுத்தவும் வல்லவன்.",False
1039,மீண்டும் கடலில் அலை அடங்கி அமைதியான நீலக்கடலாக அது தோற்றமளிக்கும்போது அவனது சீற்றம் தணிந்துவிட்டதாக அவர்கள் கூறுவார்கள்.,False
1040,"டிரைட்டன் ஒருபாதி மனிதனும், ஒருபாதி மீனுமாக அமைந்தவன்.",False
1041,இடுப்புவரையில் மனித உடலையும் அதற்குக் கீழே மீன் உடலையும் அவன் பெற்றிருந்தான்.,False
1042,வலம்புரிச்சங்கு ஒன்றை அவன் வைத்து முழங்குவான்.,False
1043,அது பேரிடி முழக்கம்போல் வானம் அதிரக் கேட்கும்.,False
1044,நெடுந்தொலையில் பேரலைகள் கற்பாறைகள் மீது மோதும்போது அம்முழக்கந்தான் கேட்கும்.,False
1045,டிரைட்டனின் தாய் ஆம்பிட்ரைட் முன்பு மச்ச கன்னியாக இருந்தவள்.,False
1046,அதனால் அவள் இடுப்புக்குக் கீழே மீன் வால்போல் அமைந்துவிட்டது போலும்!,False
1047,"ஆம்பிட்ரைட் மிக்க அழகுள்ளவளாக இருந்தமையால், நெப்டியூன் அவளை மணந்துகொண்டான்.",False
1048,"ஆனால், பிற பல தெய்வங்களைப்போலவே, அவன் அன்பும் ஒரே இடத்தில் நிலைத்திருக்கவில்லை.",False
1049,பிறகு அவன் சில்லா என்னும் அழகிய பெண்ணைக் காதலித்தான்.,False
1050,ஆம்பிட்ரைட் அதனால் பெருஞ்சினங்கொண்டாள்.,False
1051,ஒருநாள் அவள் சில்லா குளித்துக்கொண்டிருந்த சுனையருகே வந்தாள்.,False
1052,சில்லா திரும்பிப்பாராமல் குளித்துக் கொண்டிருக்கவே தன் கையிலுள்ள சில பச்சிலைகளை ஆம்பிட்ரைட் அச்சுனைநீரில் போட்டாள்.,False
1053,உடனே சில்லா பெரிய கடல் பூதமாகிவிட்டாள்.,False
1054,சில்லாவின் கால்கள் தந்தம்போல் கடைந்தெடுத்த கால்கள் என்று நெப்டியூன் அன்புடன் பாராட்டியிருந்தான்.,False
1055,"எனவே, ஆம்பிட்ரைட், அப்பூதத்துக்குப் பன்னிரண்டு கோணலான கால்களைக் கொடுத்துவிட்டாள்.",False
1056,ஒடுங்கி நீண்ட கழுத்துகளுடன் ஆறு தலைகள் ஏற்படும்படியும் சபித்துவிட்டாள்.,False
1057,அப்பாறை இன்றும் சில்லா என்றே கூறப்படுகிறது.,False
1058,அவ்வழியே சென்ற கப்பல்கள்மீது பாய்ந்து தாக்கி உடைத்து மாலுமிகளை விழுங்கிவந்தாள்.,False
1059,"கடலில் மரக்கலங்கள் உடைந்து மாலுமிகள் உயிரிழப்ப தற்கு, கிரேக்கர்கள் இதையே காரணமாகக் காட்டிவந்தார்கள்.",False
1060,இன்றுங்கூட யாராவது அப்பாறை அருகில் சென்றால் உயிரிழக்க வேண்டியவர்கள் தான்.,False
1061,"ஆனால், நாம் இப்போது ஆள் விழுங்கும் சில்லா என்னும் பூதம் இருப்பதை நம்புவதில்லை.",False
1062,ஒருநாள் நெப்டியூனுக்கும் அத்தீனி என்னும் தெய்வத்துக்கும் ஒரு நகரத்தின் பெயர் குறித்து வழக்கு ஏற்பட்டது.,False
1063,அத்தீனி அந்நகர் தன் பெயரால் வழங்க வேண்டு மென்றாள்.,False
1064,நெப்டியூன் அது தன் பெயரால் வழங்க வேண்டுமென்றான்.,False
1065,"இருவரும் ஒரு உடன்பாட்டுக்கு வரமுடியாமற் போகவே, நெப்டியூன் அதுபற்றி முடிவு கூறுமாறு மற்றத் தெய்வங்களைக் கேட்டுக்கொண்டான்.",False
1066,அதுதான் உலகத்தில் வந்த முதலாவது குதிரை.,False
1067,"நான் ஆலிவ் மரத்தைத் தருகிறேன் என்று அத்தீனி கூறி, தன் கைத்தண்டால் நிலத்தைக் கீறினாள்.",False
1068,உடனே ஒரு மரம் முளைத்தது.,False
1069,"அத்தீனியின் பெயர்தான் அந்நகருக்கு வழங்கவேண்டும், என்று பிற கடவுளர்கள் முடிவு கூறினார்கள்.",False
1070,அதன்பின் அத்தீனி அந்நகருக்கு ஆதென்ஸ் என்று பெயரிட்டாள் அதையே நாம் ஏதென்ஸ் என்று கூறுகிறோம்.,False
1071,நெப்டியூன் அடங்காச் சினத்துடன் தன் கடல் மாளிகைக்குச் சென்றுவிட்டான்.,False
1072,"ஏதென்ஸ் செழித்து வாழாது, பாழடைந்துவிடும் என்று நெப்டியூன் நம்பினான்.",False
1073,"ஆனால், அது புகழ் மிகுந்து விளங்கி, உலகின் தலைசிறந்த நகரமாகத் திகழ்ந்தது.",False
1074,"ஆயினும், குதிரையும் மக்களுக்கு மிகவும் பயனுள்ள விலங்கினமாகவே அமைந்தது.",False
1075,"அதை நெப்டியூன் அமைதியுள்ள விலங்காகப் பழக்கி, அதன்மீது ஏறிச்செல்வது எப்படி என்பதை மக்களுக்குக் கற்றுக் கொடுத்தான்.",False
1076,"கிரேக்கர்கள் குதிரை பூட்டிய தேர் ஏறி ஓட்டப்பந்தயங்கள் நடத்திய காலத்தில், முதல்நாள் விழாவை நெப்டியூன் விழாவாகவே கொண்டாடினார்கள்.",False
1077,"பரிதிக்கடவுளான அப்பாலோவும், நிலவொளித் தெய்வமான டயானாவும் இரட்டைப் பிள்ளைகளாகப் பிறந்த உடன் பிறந்தவர்கள்.",False
1078,அவர்கள் கைப்பிள்ளைகளாக இருக்கையில் அவர்களின் தாயைச் சீயஸ் கடவுளின் மனைவியான ஹீரோ மிகவும் கொடுமைப்படுத்தினாள்.,False
