Line Number,Sentence
2233,"ஒருகால் இவர்களிடையே கருத்து வேறுபாடு உண்டாகவே, ஆனைகுந்தி கிருட்டினராயரை வேண்டிக் தமக்கோர் அரசனை நல்குமாறு கேட்டுக் கொண்டனர்.",False
2234,"அவர் ஒரு சத்திரியனைச் சேரமான் பெருமளாய் ஆட்சிநடத்தும் அமைதிபெற்றான், அந்நாளில் கிருட்டினராயர் மலையாள நாட்டின்மேற் போர் தொடுக்கலுற்றார்.",False
2235,அதனையறிந்த சேரமான் அவரோடு பொருது முதற்கண் தோல்வி யெய்தினும் மறுமுறை வெற்றி பெற்றான்.,False
2236,பின்பு சங்கரா சாரியார் தோன்றிக் கேரளநாட்டு வரலாற்றை எழுதியதோடு பிரர்மணர்களுக்கு ஒழுக்க நெறிகள் பல ஏற்படுத்தி நல்வரிப்படுத்தினார்.,False
2237,முடிவில் இச் சேரமானம் மெக்காவுக்குப் போனான் என்று கேரளோற்பத்தி கூறுகிறது.,False
2238,இக்காலத்தே கேரளநட்டின் புறத்தில் பாண்டிநாடும் கொங்கு நாடும் துளுநாடும் வயநாடும் புன்னாடும் இருந்தன.,False
2239,இச் சேரமான் கேரளத்தைப் பதினெட்டுச் சிறுநாடு களாக வகுத்து ஆட்சி செய்தான்.,False
2240,ரேகளமான்மியம் என்னம் வடமொழி நூலும் கேரளோற்பத்தி கூறியதையே சிறிது வகுத்தும் விரித்தும் கூறுகின்றதே யன்றிப் புதுவதாக ஒன்றம் கூறவில்லை.,False
2241,இதன் இடையிடையே வேதியர்கட்கு உள்ள சிறப்பும் நாட்டு வாழ்க்கையில் அவர்கட்கிருந்த உரிமையும் செல்வாக்கும நன்கு விரித்துக் கூற்பபடுகின்றன.,False
2242,இதனால் கி.மு.மூன்றாம் நூற்றாண்டிலேயே சேரநாட கேரளநாடென வடவரால் வழங்கப்பெற்ற தென்பது விளங்குகின்றது.,False
2243,அக்காலத்தில் மேலைநாட்டிலிருந்து கிரேக்கர்களும் யவனர்களும் பாபிலோனிய நாட்டுக் கோசியர்களும் பிறரும் மேலைக்கடலில் கலம் செலுத்திவரலாயினர்.,False
2244,எகிப்து நாட்டு வேந்தர்கீழ் வாழ்ந்த போனீசியர்களே முதற்கண் அரபிக்கடலில் கலம் செலுத்தி நாடுகாணும் நாட்டம் கொண்டனர்.,False
2245,அவருடைய முயற்சி முற்றும் வாணிகம் செய்து பொருளீட்டுவதிலேயே கழிந்த மையின் அவர்களுடைய குறிப்புக்கள் கிடைப்பது அரிதாய் விட்டது.,False
2246,கி.மு.ஐந்து ஆறாம் நூற்றாண்டில் கிரேக்கர் முற்போந்து கடல்கலம் காணமுயன்றனர்.,False
2247,அவர்கள் தொடக்கத்தில் மத்திய தரைக்கடலையும் கருங்கடளையும் அகலங்கண்டனர்.,False
2248,அந் நாளில் அலெக்சாந்தர் விடுத்த கிரெக்கர்களை வடஇந்தியாவின் சோலைப் பகதியான சிந்துநதி நாட்டைக் கண்டுகொண்டு திரும்பினர்.,False
2249,அவர்கட்குத் தலைவனான நியூயார்க்கசு தரைவழியாகச் சிந்து நதிக்கும் யூபரடீசு டைகரீசு ஆற்றுக்கும் இடையிலுள்ள நிலப் பகுதியில் வழிகண்டான்.,False
2250,அது முதல் நமது இந்தியநாட்டின் செல்வ நிலையில் வழிகண்டான்.,False
2251,அது முதல் நமது இந்தியநாட்டின் செல்வ நிலை கிரேக்கர் உள்ளத்தில் மதிப்பு உண்டுபண்ணிற்று.,False
2252,அக்குறிப்பினுள் தென்தமிழ்நாட்டு வேந்தர்களான சேர சோழ பாண்டியர்களைப் பற்றிய குறிப்புக்கள் உள்ளன.,False
2253,அவர்கட்குப்பின் யவனர் தோன்றி நம் இந்திய நாட்டோடு வாணிகம் செய்யத் தலைப்பட்டனர்.,False
2254,அதன்பின் யவன வாணிகம் பெரிதும் வளம்பெற அவர்களிடையே நடைபெறுவதாயிற்று அப் பருவக்காற்றுக் களையும் அவர்கள் இப்பலசு என்றே வழங்கினர்.,False
2255,இக் காலத்தே மேனாட்டுக்குத் தென்தமிழ் நாட்டினின்று தூதொன்று சென்று யவனவேந்தரான அகசட்டசு என்பாரது தொடர்புபெற்று சுபெயின் நாட்டுக்குச் சென்றது.,False
2256,இத்தூது தென்பாண்டிநாட்டு வேந்தனொருவன் விடுத்ததென்பர். வடநாட்டுப் பேரசு என்னும் வேந்தன் விடுத்தது என்பார் உளராயினும் அவர் கூற்று வலியுடையதாயில்லை.,False
2257,அவற்றுள் எரித்திரையன் கடற்செலவு என்று பெயரிய இரு நூல்கள் உண்டாயின.,False
2258,ஒன்று ஆசிய நாட்டுக் கடற்செலவையும் மற்றொன்று ஆப்பிரிக்கா நாட்டுக் கடற் செலவையும் கூறுவன. இது கி.மு.,False
2259,முதல் நூற்றாண்டில் தோன்றிதென்பது அறிஞர் கொள்கை.,False
2260,முதல் நூற்றாண்டில் பிளினி என்பார் மேலைக்கடற் செலவுபற்றிய நூலொன்றை எழுதியுள்ளனர்.,False
2261,அதன்கண் இக்கடற்செலவு சார்பன செய்திகள் பவ விரிவாகஉரைக்கப் பட்டுள்ளன.,False
2262,கி.மு.முதல நூற்றாண்டின் தொடக்கத்தில் வாழ்ந்த பெட்ரோனியசு என்பார் அந்நாளை யவனச் செல்வமகளிரின் பெருமித வாழ்வைக் கண்டித்து நூலொன்றை எழுதியிருக்கிறார்.,False
2263,முசிறித்துறை வணிகப் பொருள் மிகுதியாக வுடையதன்று.,False
2264,முதல் நூற்றாண்டில் சேரநாடு தென்கொல்லம் வரையிற் பரந்திருந்தமையும் அதன் தென் பகதி தென்பாண்டி நாடென்பதும் தெளிவாய் விளங்குகின்றன.,False
2265,இவ் வகையில் பெரிப்புளுசு நூலாசிரியர் கூறுவனவும் ஒத்திருக்கின்றன.,False
2266,கி.பி.இல் வாழ்ந்த தாலமி என்பார் எழுதியுள்ள குறிப்பில் சேரவேந்தர் கேரள போத்திரசு என்றும் குறிக்கப்படுவது காண்கின்றோம். கி.பி.,False
2267,ஆகவே சங்கத் தொகை நூல்கள் பலவும் கி.பி.,False
2268,மூன்றாம் நூற்றாண்டிற்கும் முற்பட்டன என்பது தேற்றமாம்.,False
2269,இச் சங்கவிலக்கியங்கள் யாவும் சேரநாட்டைச் சேரநாடென்றும் அந்நாட்டவேந்தர்களைச் சேரரென்றும் சேரலரென்றும் தெளியக் கூறுகின்றன.,False
2270,பிற்காவத்துத் தமிழ்நூல்களும் அந்நெறியில் வழுவியது கிடையாது.,False
2271,வடநாட்டு வடமொழி நூல்களுள் வேதங்களும் இதிகாசங்களும் சேரர்களைச் சேரரென்றே குறிப்பதை முன்பே கண்டோம்.,False
2272,செல்யூகசு நிகேட்டர் காலத்து மெகசுதனிசு என்பார் கங்கைக்கரைப் பாடலிபுரத்திலிருந்து எழுதிய குறிப்பும் சேரர்களைச் சேரமான்களென்றே குறித்துள்ளது.,False
2273,ஆனால் அசோக மன்னனுடைய கல்வெட்டுக்கள் சேரர்களைக் கேரளபுத்திரர் என்ற கூறுகின்றன.,False
2274,ஆயினும் அத்தொடர் சேரல புத்திரர் என்று படிக்குமாறும் அமைந்திருக்கிறது.,False
2275,மற்று அவற்றைப் படித்த அறிஞர் பலரும் கேரள புத்திரர் என்றே படித்து வந்திருக்கின்றனர்.,False
2276,"பிற்கால வடநூற்பயிற்சியால் அசோகன் கல்வெட்டுக்களைப் படித்தோர், கேரளபுத்திரர் என்று கருதி விட்டிருக்கலாம்.",False
2277,இதனை ஆராயுங்கால் கேரளர் என்ற சொல் வழக்குக் காஊப்படவில்லை.,False
2278,இதனை ஆராயுங்கால் கேரளர் என்ற வழக்காறு சோழ பாண்டிய நாட்டில் கி.பி.எட்டாம் நூற்றாண்டில் தான் உண்டாயிற்றென்பது விளங்குகிறது.,False
2279,ஆனால் மேனாட்டு கிரேக்க யவனர்கள் கி.பி.மூன்றாம் நூற்றாண்டு வரையிலும் சேரர்களைச் சேரர்கள் என்றும் சேரமான்கள் என்றுமே வழங்கி வந்திருக்கின்றனர்.,False
2280,"வேறொன்று, தம்மொழி நடைக் கொத்தவற்றை ஒரு திரிபுமின்றி ஏற்றுக் கொள்வது.",False
2281,"அம் முறையில் மணி, மீன், நீர் என்பவற்றை வடமொழியில் ஏற்றுக்கோண்டுள்ளனர்.",False
2282,இந்தச் சீரியமுறையை வடவர்க்கு வடமொழி ஆசிரியர் வகுத்துரைக்கவில்லை போலும்.,False
2283,"இவ்வாற்றால் வடவர் கூட்டு கேரள நாடென்றும் வடவர் வழங்கியரென்றும், தங்கவாராயினர்.",False
2284,இன்றும் தென்னாட்டவருள் தமிழரொழிவாறே வரும் தங்களை வடவரிட்ட பெயராலேயே வழங்குவதும் தக்கது.,False
2285,சேரநாடு செந்தமிழ் மொழி வழங்கும் திருநாடாக விளங்கிய காலதிது வேந்தர்களே நாம்காணலுறும் சேரமன்னர்கள்.,False
2286,இவற்றைக் கொண்டு பண்டைநாளைச் சேரநாட்டைக் காண்பதற்கு வழியில்லை.,False
2287,இவற்றுள் சங்க காலத்துக்கும் விசயநகர வேந்தர் காலத்துக்கும் இடைப்பட்ட காலத்து நிகழ்ச்சிகளுட் சில இவை கூறும் வரலாற்றுள் மறைந்திருக்கலாம்.,False
2288,தொன்மையுடைய பொருளே பெருமையுடைய தென்றொரு கொள்கை இடைக்காலத்தே அறிஞர் சிலருடைய கருத்தில் உண்டாயிற்று.,False
2289,அதனால் பல நூல்களைப் பல ஆயிரக்கணக்கான ஆண்டுகட்கு முற்பட்டவை என்று கூறும் செய்ல தோன்றிற்று.,False
2290,"இவ்வாறன்றி, காய்தல் உவத்தல் இன்றி நடுநிலை திறம்பாது பண்டைநாளை நிலையினைக் காண்பது இப்போது மிக இன்றியமையாத தாகிறது.",False
2291,மேலும் இடைக்காலத்தில் இருந்து ஆராய்ச்சி நிகழ்த்தி யோரினும் இக் காலத்து ஆராய்ச்சியாளர்கட்குக் கருவிகள் விரிவாகக் கிடைத்துள்ளன.,False
2292,நிலவுலகத்தில் ஆங்காங்கு வாழும் மக்களுடைய தொன்மையும் வரலாறும் வழக்காறும் அறிந்து கொள்ளத்தக்கவகையில் நூல்கள் வந்துள்ளன.,False
2293,"இலக்கிய நூல்கட்குத் துணையாகக் கல்வெட்டுக்களும், செப்பேடுகளும் அவற்றைப் பற்றிய ஆராய்ச்சியுரைகளும் பெருகக் கிடைத்திருக்கின்றன.",False
2294,ஒருகாலத்தில் உண்மையெனக் காணப்பட்டதொன்று பிறிதொரு காலத்தில் தவறுபடுவதும்.,False
2295,அதனால் ஆராய்ச்சியாளர் உண்மையைக் கடைப்பிடித்துக் கிடைக்கும் கருவிகக கொண்டு அச்சம் இன்றித் தமது ஆராய்ச்சியை நிகழ்த்தத் தலைப்பட்டுவிட்டனர்.,False
2296,"விஞ்ஞானத் துறையிலேயே வரம்பறுக்கப் பட்டவுண்மைகள் பல போலியாய் ஒழிகின்றன எனின், வரலாற்றா ராய்ச்சிக்கு வேறு கூறுவது மிகையன்றோ!",False
2297,இந்நெறியே நின்று நோக்கும்போது மேனாட்டுயவனர்களும் வடநாட்டு வடநூல்களும் கூறுவனவற்றால் சேரரது தொள்மை வேதகாலத்தேயே விளங்கியிருந்தமை தெளிவாயிற்று.,False
2298,சங்க இலக்கி யங்களுள் சேரர்கள் சார்பாக நிற்கும் பாட்டுக்களிற் காணப்படும் ஊர்களும் நிகழ்ச்சிகளும் கிரேக்கயவனர் குறிப்புக்களிலும் ஒப்பக்காணப்பெறுகின்றன.,False
2299,அக்குறிப்புக்களின் காலம் கி.பி.,False
2300,முதலிரண்டு நூற்றாண்டில் நிலைபெறுகிறது.,False
2301,"அவற்றுட்சில சங்க இலக்கியங்களில் காணப்படாத குறிப்புக்களை உணர்த்து மாற்றால், காலத்தால் சங்க இலக்கியங்கட்குப் பிற்படுகின்றன.",False
2302,"படவே, சங்க இலக்கியங்கள் கி.பி.இரண்டாம் நூற்ாறண்டிற்குப் பிற்பட்டன வல்ல வென்பது உறுதியாகிறது.",False
2303,சேசையர் முதலியோர் சேரவேந்தர்களை கி.பி.மூன்றாம் நூற்றாண்டுமுடிய இருந்தனர் என்று கூறுகின்றனர்.,False
2304,"சான்றாக, ஆங்கிலேயத்தீவகமும், அமெரிக்காவுமே முன்நிற்கின்றன.",False
2305,"இவ்விரண்டு நாடுகளின் சிறப்பும் அந்நாட்டு மக்களின் கல்வி நலத்தையும், செல்வநலத்தையும் சார்ந்து நிற்றல் வெளிப்படை.",False
2306,"அவற்றுள் கல்விநலமாவது மக்கள் கல்வியறிவு நிரம்பிய வராயிருத்தல், அது நிரம்பியகாலத்து.",False
2307,"மக்கள் தம் இம்மை, மறுமை வாழ்க்கைக்குரிய உறுதிப்பொருள்களைத் தேடிக்கொள்ள முயல்வர்.",False
2308,"இம்மைக்குரிய உறுதிப் பொருள்களைத் தேடிக் கொள்ளுதலாவது, பொருளீட்டுமாறும், அவ்வாற்றிற்கேற்ற கருவிகளை ஆக்கிக்கொள்ளு மாறுமாம்.",False
2309,"அறநூல்களையாராய்ந்து, அவற்றிற்குத் தகநின்று, அறவினையாற்றுதலே மறுமைக்காய உறுதிப்பொருளாம்.",False
2310,"ஆங்கிலேயரும், அமெரிக்கரும் கல்வியறிவு நிரம்பியிருத்தலும், செல்வமிக்குடையரா யிருத்தலும் மேற் கூறியவற்றிற்குச் சான்றாதலும் காண்க.",False
2311,"இக்காலத்தில், பிறநாடு களையொப்ப, நம்நாடு தன்சிறப்புடைமையிழந்து நிற்றல், அவ் விருநலங்களின் குறைபாட்டினால் என்பது நன்குதோன்றுகின்றது.",False
2312,"தோன்றவே, எந்நாடு, எல்லாநாடுகளாலும் பெரிதும் பாராட்டப்படுகின்றதோ.",False
2313,"அந்நாடு கல்விநலம், செல்வ நலம்ஆகிய இருநலங்களும் பெற்று விளங்குதல் ஒருதலை யாதல்பெற்றாம்.",False
2314,"அதனாற் பிற தேயத்து மக்கள், தன் கண் வந்து வாழ்தலும், வாழ்வார்க்கு நல்ல பயத்ததாதலும் உற்று, இது விளங்கிநின்றது.",False
2315,கல்விநலங் குன்றாதிருந்த நம்நாடு குன்றியதற்குக் காரணம் கால வேறுபாடே யன்றிப் பிறிதொன்று மில்லை.,False
2316,"கல்விநலஞ் சிறந்திருந்த காலத்தில், நம் நாட்டு மக்கள் வழங்கிய மொழி தமிழ் மொழியே.",False
2317,"அரசியல் வாணிபம் முதலிய பொருள், அறம் முதலி யவற்றை யீட்டுந் துறைகளில் வழங்கப்பெற்ற மொழியும் தமிழ் மொழியே.",False
2318,அத்துறைகளுக்கு வேண்டிய கல்வியறிவைத் தரற்கெனத் தோன்றிய சான்றோர் பலராவர்.,False
2319,"அச்சான்றோர்கள், தமிழ் மொழியைக் கற்றுத் துறைபோகிய நல்லிசைப்புலவர் களாவர்.",False
2320,"அவர்கள் தம்மனக்கண்ணிற்றோன்றும் பொருளனைத்தையும் மக்களுக்கு நூல்களின் வழியாகவும், இனியபாக்களின் வழியாகவும் உணர்த்தி அம்மக்கள றிவைப் பண்படுத்தினர்.",False
2321,"நிற்க, இச்சான் றோர்கள் பெரும்பாலராய் விளங்கிய காலத்து அவர்களைக் கருந்தனமாகக் கருதிப் புரந்தவர்கள் கணக்கிலடங்கார்.",False
2322,"இவர்களுள், மன்னுயிர் மாட்டுப் பேரருளும், அவர் கேட்டவற்றை வரையாது கொடுக்கும் பெருந்தன்மையும் பொருந்திய பெரியோர் களு மிருந்தனர்.",False
2323,அவர்களை வள்ளல் களென்பதே வழக்கு.,False
