Line Number,Sentence
1,தமிழமுது மறு பதிப்பு தாள் . கி.
2,மேப்லித்தோ அளவு தெம்மி எழுத்து . புள்ளி பக்கம் படிகள் விலை உரு.
3,நூலாக்கம் டெலிபாய்ண்ட் சென்னை .
4,அட்டை வடிவமைப்பு வி.
5,"சித்ரா அச்சு வெங்கடேசுவரா ஆப்செட் பிரிண்டர் இராயப்பேட்டை, சென்னை ."
6,"பதிப்புரை ஆம் நூற்றாண்டின் இறுதிப்பகுதியும், ஆம் நூற்றாண்டின் தொடக்கப்பகுதியும் தமிழ்ப்புலமையும் தமிழாய்வும் மேலோங்கி வளர்ந்த பொற்காலமாகும்."
7,இப் பொற்காலப் பகுதியில்தான் தமிழ்ப்பேரவைச் செம்மல் பெருந்தமிழறிஞர் க.
8,வெள்ளைவாரணனார் தோன்றி வளர்ந்து வாழ்ந்து தாய்மொழித் தமிழுக்கு வளமும் வலிமையும் சேர்த்தார்.
9,கைக்குக் கிடைக்கப் பெறாத நூல்களைத் தேடியெடுத்து இனிவரும் காலங்களில் வெளியிட முயல்வோம்.
10,"தம்முடைய தமிழாய்வுப்பணி மூலம் தமிழ் வரலாற்றில் நிலைத்து நிற்பவர், தமிழையும் சைவத்தையும் இரு கண்களெனக் கொண்டவர்."
11,தம் ஆய்வுப் புலமையால் பல புதிய செய்திகளையும் தமிழ் உலகுக்கு அளித்தவர்.
12,இவர் எழுதிய நூல்கள் தமிழ்உலகிற்குப் பெருமை சேர்ப்பன.
13,தமிழ் இலக்கிய வரலாற்றிற்கு கூடுதல் வரவாக அமைவன.
14,இவருடைய அறிவுச் செல்வங்கள னைத்தையும் ஆவணப்படுத்தும் நோக்குடன் தொகுத்து தமிழ் உலகிற்கு வைப்பாகக் கொடுத்துள்ளோம்.
15,எம் தமிழ்க் காப்புப் பணிக்கு துணை நிற்க வேண்டுகிறோம்.
16,பதிப்பகத்தார் தமிழ்ப்பதிப்பு முன்னோடிகளை வணங்குவோம்!
17,தமிழாராய்ச்சியின் வளர்ச்சியில் புதிய போக்குகளை உண்டாக்கிய பெருமைக்குரியவர்கள் பழந்தமிழ் நூல்களைப் பதிப்பித்த அறிஞர் களேயாவர்.
18,"மேலை நாட்டார் வருகையினால் தோன்றிய அச்சியந்திர வசதிகளும், கல்வி மறுமலர்ச்சியும் புதிய நூலாக்கங்களுக்கு வழி வகுத்தன."
19,ஆறுமுக நாவலர் சி.வை.
20,"தாமோதரம் பிள்ளை , உ.வே."
21,"சாமிநாதையர் ஆகியோர் தமிழ்ப்பதிப்பு முன்னோடிகளாய் விளங்கித் தமிழுக்கு வளம் சேர்த்தனர் என்று தமிழ்ப் பல்கலைக்கழகத்தின் மேனாள் துணைவேந்தர், இ."
22,சுந்தரமூர்த்தி தனது பதிப்பியல் சிந்தனைகள் எனும் நூலில் பதிவு செய்துள்ளார்.
23,இந்நூல் தொகுதிகளை வெளியிடுவதன் மூலம் தமிழ்ப்பதிப்பு முன்னோடிகளை வணங்குவோம்.
24,பேராசிரியர் வெள்ளைவாரணனாரின் வாழ்வியல் காலநிரல் தி.
25,"நெல்லையப்பன், எம்.ஏ., எம்.நில்., ஆம் ஆண்டு சனவரி ஆம் நாள் தஞ்சை மாவட்டம் திருநாககேச்சரத்தில் வெள்ளைவாரணனார் பிறந்தார்."
26,"தந்தை கந்தசாமி முதலியார், தாய் அமிர்தம் அம்மையார், செங்குந்தர் மரபு."
27,சொர்ணம் என்னும் பெயருடைய தமக்கையார் ஒருவர்.
28,"பொன்னம் பலம், நடேசன் ஆகியோர் இவருடன் பிறந்த மூத்தவர்கள்."
29,வெள்ளைவாரணனாரின் பெரிய தந்தையார் பிறந்தநாளில் பிறந்ததால் அவரின் பெயரையே வெள்ளை வாரணனார் என இவருடைய தந்தையார் இவருக்குச் சூட்டினார்.
30,தந்தையார் கந்தசாமியாரும் பாட்டனார் மெய்கண்டாரும் தமிழிலக்கியப் புலமை உடையவர்கள்.
31,"குறிப்பாக, சைவ இலக்கியங்களில் ஈடுபாடு கொண்டிருந்தனர்."
32,வெள்ளை வாரணனாரின் இளமைக்காலம் ஆங்கிலேயர் ஆட்சி நடைபெற்ற காலம்.
33,ஆங்கில மொழியின் செல்வாக்கு மிகுந்து காணப்பட்டது.
34,வித்துவான் தேர்வில்கூட வடமொழித் தாள்களை எழுதி வெற்றிபெற வேண்டிய நிலை இருந்தது.
35,அத்தகைய சூழ்நிலையிலும் வெள்ளைவாரணனார் தமிழையும் தமிழிசையையும் கற்க விரும்பித் தம்மைத் தமிழில் ஆட்படுத்திக் கொண்டார்.
36,வெள்ளைவாரணனார் தொடக்கக் கல்வியைத் திருநாகேச்சரத்தில் பயின்றார்.
37,அப்பள்ளியில் மூன்றாம் வகுப்புவரை கல்வி பயின்றார்.
38,"ஆம் ஆண்டு திருநாகேச்சரத்தில் அருள்மிகு நாகநாத சுவாமிகள் ஆலயத்திற்கு வருகை புரிந்தவர், அரிமழம் அ.அரு."
39,அண்ணாமலைச் செட்டியார்.
40,ஆலயத்திற்கு வந்தவர் வெள்ளை வாரணனாரின் இல்லத்தில் தங்கினார்.
41,இவரின் வருகை வெள்ளைவாரணனாரின் வாழ்க்கை வரலாற்றில் திருப்பு முனையாக அமைந்தது.
42,"இறைஈடுபாடு, ஒழுக்கம் இவற்றால் கவரப்பெற்ற வெள்ளைவாரணனாரைத் திருப்பெருந்துறையிலுள்ள தேவாரப் பாடசாலையில் சேர்த்தார்."
43,அங்கு இவருக்கு ஆசிரியராய் இருந்தவர் காஞ்சிபுரம் பூசை நமச்சிவாய முதலியார்.
44,"அங்கு தமிழிலக்கியம், இசைப்பயிற்சி போன்ற வற்றைக் கற்று வந்தார்."
45,ஆம் ஆண்டு அண்ணாமலைப் பல்கலைக் கழகத்தில் வித்துவான் வகுப்பில் சேர்ந்து கல்வி பயின்றார்.
46,அப்போது அண்ணாமலைப் பல்கலைக்கழகத்தில் தமிழ்த் துறைத் தலைவ ராய் இருந்தவர்.
47,அறிஞர் கா.
48,சுப்பிரமணியப் பிள்ளை.
49,முதல் வரை விபுலாநந்தரும் முதல் வரை நாவலர் சோமசுந்தர பாரதியாரும் தமிழ்த்துறைத் தலைவர்களாக விளங்கினார்.
50,ச.சோ.
51,பாரதியின் உற்ற மாணவராக வெள்ளை வாரணனார் திகழ்ந்தார்.
52,"இவர்தம் பேராசிரியர்களாக இருந்தவர்களில் பொன்னோதுவார் மூர்த்திகள், சர்க்கரை இராமசாமிப்புலவர், ஆர்."
53,"கந்த சாமியார், தி.பொ."
54,"பழநியப்பப் பிள்ளை, இரா."
55,இராக வையங்கார் ந.மு.
56,வேங்கடசாமி நாட்டார்.
57,இரா.பி.
58,சேதுப் பிள்ளை போன்றோர் குறிப்பிடத் தக்கவர்கள்.
59,இவர்களின் புலமையும் ஆற்றலும் இவர்தம் வளர்ச்சிக்கு வழியமைத்துக் கொடுத்தன எனலாம்.
60,பின்னர் அண்ணாமலைப் பல்கலைக் கழகத்தில் ஆய்வு மாணவராகச் சேர்ந்தார்.
61,தொல்காப்பியம் நன்னூல் எழுத்ததிகாரம் என்ற ஒப்பீட்டு நூலை ஆகிய இரண்டு ஆண்டுகளில் எழுதி முடித்தார்.
62,இந்நூல் என்ற இதழில் முதல் தொடர்ந்து வெளியிடப் பட்டது.
63,பின்னர் இல் நூல் வடிவம் பெற்றது.
64,ஆம் ஆண்டு கரந்தைத் தமிழ்ச் சங்கத்தின் வெள்ளி விழா நடைபெற்றது.
65,அதன் தலைவராக இருந்தவர் த.வே.
66,உமா மகேசுவரனார்.
67,விழாவிற்குத் தலைமை தாங்கியவர் திருப்பாதிரிப் புலியூர் ஞானியார் சுவாமிகள்.
68,ச.சோ.
69,பாரதியின் சொல்லுக் கிணங்க க.வெள்ளைவாரணனார் கலந்து கொண்டு தொண்டாற்றினார்.
70,பின்னர் தலைவரால் ஈர்க்கப்பட்டார்.
71,கரந்தைத் தமிழ்ச் சங்க கல்லூரிக்கு அன்று ச.சோ.
72,பாரதியின் பரிந்துரையினால் வெள்ளை வாரணனார் விரிவுரையாளராக நியமனம் செய்யப் பட்டார்.
73,வரையில் அக்கல்லூரியில் பணிபுரிந்தார்.
74,ஆம் ஆண்டு வெள்ளைவாரணனாரின் திருமணம் செங்கல்பட்டு மாவட்டம் மானாம்பதி என்ற ஊரைச் சேர்ந்த ம.அ.
75,"கனகசபை முதலியாரின் இரண்டாம் மகள் பொற்றடங் கண்ணியை, சனவரித் திங்களில் திருமணம் செய்து கொண்டார்."
76,அதனை எதிர்த்து நடத்தப்பட்ட போராட்டத்தில் வெள்ளை வாரணனார் கலந்து கொண்டார்.
77,"தம் எதிர்ப்பினை, காக்கை விடு தூது என்னும் பெயரில் நூல் இயற்றி அரசுக்கு அனுப்பி வைத்தார்."
78,அந்நூலைப் பாந்தளுர் வெண்கோழியார் என்ற புனைப் பெயரில் விடுத்துப் பெரும் பரபரப்பை உண்டு பண்ணினார்.
79,"அந்நூலைத் தமிழ்ப் பொழில், விடுதலை, திராவிடநாடு ஆகிய இதழ்கள் வெளியிட்டுச் சிறப்பித்தன."
80,ஆம் ஆண்டு அண்ணாமலைப் பல்கலைக் கழகத்தில் விரிவுரையாளர் பணிக்கு அமர்த்தப்படுதல்.
81,"ஆம் ஆண்டு தூத்துக்குடி சைவ சித்தாந்தசபை, வெள்ளை வாரணனாருக்கு சித்தாந்தச் செம்மல் பட்டம் வழங்கி மகிழ்தல்."
82,"ஆம் ஆண்டு விபுலாநந்த சுவாமிகள் இயற்றிய யாழ் நூலுக்கு, வெள்ளைவாரணனார் சிறப்புப்பாயிரம் இயற்றி அளித்தது."
83,ஆம் ஆண்டு பொற்றடங்கண்ணிக்குப் பெண்குழந்தை பிறப்பு.
84,வெள்ளைவாரணனார் மங்கையர்க்கரசி எனப் பெயர் சூட்டி மகிழ்தல்.
85,இவர் எழுதிய குறிஞ்சிப் பாட்டாராய்ச்சி என்னும் நூல் சைவ சித்தாந்த நூற்பதிப்புக் கழகம் வெளியிட்டது.
86,இந்நூல் சொற்பொழிவு நூல்.
87,"ஆம் ஆண்டு வெள்ளைவாரணனார் எழுதிய தமிழ் இலக்கிய வரலாறு தொல்காப்பியம் என்ற நூலை, அண்ணா மலைப் பல்கலைக்கழகம் வெளியிட்டுள்ளது."
88,ஆம் ஆண்டு வெள்ளைவாரணனார் அண்ணாமலைப் பல்கலைக்கழகத்தில் இணைப் பேராசிரியராகப் பதவி உயர்வு பெறுதல்.
89,தொல்காப்பியம் நன்னூல் எழுத்ததிகாரம் அண்ணா மலைப் பல்கலைக்கழகம் நூலாக வெளியிட்டுச் சிறப்பித்தது.
90,"ஆம் ஆண்டு வெள்ளைவாரணனார் இயற்றிய தேவார அருள்முறைத் திரட்டு உரை நூல், வாழ்மங்கலம் அ."
91,மலைப் பெருமாள் முதலியார் மணிவிழா மலர் வெளியீடாக வெளியிடப் பட்டது.
92,ஆம் ஆண்டு இவரின் சேக்கிழார் நூல்நயம் என்னும் சொற்பொழிவு நூலைப் பெரிய புராணச் சொற்பொழிவு நூலாகக் கழகம் வெளியிட்டுள்ளது.
93,திருவண்ணாமலை குன்றக்குடி ஆதீனம் இவருக்கு தமிழ்ப் பெரும்புலவர் என்ற பட்டத்தை வழங்கியது.
94,அற்புதத் திருவந்தாதியுரை என்னும் நூல் ஒரத்தூர் குஞ்சித பாதம்பிள்ளை அவர்களின் மணிவிழா மலராக வெளியிடப் பட்டுள்ளது.
95,ஆம் ஆண்டு தருமபுரம் ஆதீனம் திருமுறை ஆராய்ச்சிக் கலைஞர் என்ற பட்டம் வழங்கியது.
96,தொல்காப்பியம் நன்னூல் சொல்லதிகாரம் நூல் வெளியிடப் பட்டது.
97,சொந்த வெளியீடு.
98,ஆம் ஆண்டு மகளின் திருமணம்.
99,மருமகன் சென்னை சொ.
100,முருகேசனாரின் மகன் திருநாவுக்கரசு.
101,இவர் மருத்துவத் துறையில் பட்டம் பெற்றவர்.
102,பன்னிரு திருமுறை வரலாறு முதற்பகுதியை அண்ணா மலைப் பல்கலைக்கழகம் வெளியிட்டது.
103,ஆம் ஆண்டுத் திருமந்திர அருள் முறைத்திரட்டு என்னும் நூல் தில்லைத் தமிழ் மன்றம் வெளியிட்டுள்ளது.
104,ஆம் ஆண்டு அண்ணாமலைப் பல்கலைக் கழகத்தில் சொருணாம்பாள் நினைவுச் சொற்பொழிவு நிகழ்த்துதல்.
105,பொருள் சிவஞான முனிவர்.
106,"ஆம் ஆண்டு அண்ணாமலைப் பல்கலைக் கழகத்தின் தமிழ்த் துறைத் தலைவர், இந்திய மொழிப்புல முதன்மையர் பதவி உயர்வு."
107,வரை இப்பதவியில் இருந்தார்.
108,ஓய்வு பெற்ற பின்பும்.
109,ஆம் ஆண்டு மதுரைக் காமராசர் பல்கலைக் கழகத்தில் சிறப்பு நிலைப் பேராசிரியராக அமர்த்தப்படுதல்.
110,இப்பதவியில் இருந்தபோதுதான் தொல்காப்பியம் பொருளதிகாரம் உரைவளப் பதிப்புகளை எழுதினார்.
111,வரையில் இங்கு பணிபுரிந்தார்.
112,இவரின் இசைத் தமிழ் நூலை இராமகிருஷ்ணா வித்தியா சாலை நிர்வாகக்குழு வெளியிட்டது.
113,ஆம் ஆண்டு தமிழ்ப் பல்கலைக்கழகம் தொடங்கப் பட்டது.
114,முதல் துணைவேந்தராக வ.அய்.
115,சுப்பிரமணியன் நியமிக்கப்பட்டார்.
116,இவர் அண்ணாமலைப் பல்கலைக் கழகத்தில் பயின்றவர்.
117,க.
118,வெள்ளைவாரணனாரின் புலமையை நன்கு அறிந்தவர்.
119,"அதனால் அவரை, தமிழ்ப் பல்கலையில் வந்து பணியாற்றும்படி அழைப்பு விடுத்தார்."
120,ஆம் ஆண்டு தஞ்சை தமிழ்ப் பல்கலைக்கழகத்தில் தமிழிலக்கியத் துறையில் சிறப்புநிலைப் பேராசிரியராகப் பணியாற்றினார்.
121,"துறைத்தலைவராகவும், நிகழ்நிலைப் பேராசிரியராகவும் பணியாற்றியுள்ளார்."
122,அங்கு சங்க இலக்கியப் பொருளடைவு என்ற தொகுதிகள் இவர் பொறுப்பில் முதலில் உருவாயின.
123,சைவ சித்தாந்த சாத்திர வரலாறு என்ற நூலையும் எழுதினார்.
124,ஆம் ஆண்டு தமிழக ஓதுவார் சங்கம் சங்கநூல் பெரும் புலமைச் சான்றோர் என்ற பட்டம் அளித்துள்ளது.
125,தொல்காப்பியம் பொருளதிகாரம் புறத்திணையியல் உரைவளம் நூல்கள் மதுரைக்காமராசர் பல்கலைக்கழகம் வெளியிட்டுள்ளது.
126,தொல்.
127,பொருள்.
128,"களவியல், தொல்."
129,பொருள்.
130,"கற்பியல், தொல்."
131,பொருள்.
132,பொருளியல் உரைவள நூல்கள் வெளியிடப் பட்டன.
133,ஆம் ஆண்டு காஞ்சிபுரம் ஸ்ரீ சங்கர மடம் திருமறை உரைமணி என்ற பட்டத்தை அளித்தது.
134,கரந்தைத் தமிழ்ச் சங்கம் செந்தமிழ்ச் சான்றோர் பட்டத்தை அளித்துள்ளது.
135,ஆம் ஆண்டு தமிழ்நாடு இயல் இசை நாடக மன்றம் கலைமாமணி விருது வழங்கியது.
136,.
137,தொல்காப்பியம் பொருளதிகாரம் உவமையியல் உரை வளம் வெளியிடப்பட்டது.
138,மதுரை காமராசர் பல்கலைக் கழகம் சு.
139,சாமிஐயா உரை எழுதிப் பதிப்பித்த நூல் மங்கையர்க் கரசி வெண்பா.
140,இந்நூலுக்கு அணிந்துரை அளித்தது.
141,நவம்பர் திங்கள்.
142,"ஆம் ஆண்டு காக்கை விடு தூது தனி நூலாக, சொந்த வெளியீடாக வெளியிட்டது."
143,தில்லைக்கோயிலில் திருமுறை ஓதவேண்டும் என்று முழக்க மிட்ட வ.சுப.
144,மாணிக்கத்துடன் தோளோடு தோள் நின்று போராடினார்.
145,தில்லைப் பெருங்கோயில் வரலாறு என்னும் நூல் தில்லைத் தமிழ் மன்றம் வெளியிட்டது.
146,.
147,சென்னை சிவநேயர் பேரவை சிவக்கவிமணி பட்டம் அளித்துள்ளது.
148,.
149,வெள்ளைவாரணனார் இல் இயற்கை எய்தினார்.
150,ஆம் ஆண்டு மறைவுக்குப் பின்னர் நிகழ்ந்தவை மதுரைக்காமராசர் பல்கலைக்கழகம் தமிழ்ப் பேரவைச் செம்மல் பட்டம் அளித்தது.
151,.
