Line Number,Sentence
1979,மறுநாள் பந்தயத்துக்கான நாள்!,False
1980,இறைவி அருள்பாலித்தால் போவது.,False
1981,"இல்லாவிட்டால், அட்லாண்டாவுக்காக, அங்கே மாள்வதை இங்கே இறைவிக்காக மாள்வது என்ற துணிவுடன் நின்றான்.",False
1982,"பலநாளாகக் காலுணவில் நோன்பிருந்து, அன்று முழு நோன்பிருந்ததால், தலை சுழன்றது கால்கள் தளர்ந்தன ஆனால், அவன் அசையவில்லை.",False
1983,நின்ற நிலையிலேயே நின்றான்.,False
1984,"கதிரவன் கடலில் குளிக்கும் நேரம், அரையிருளைக் கிழித்துச் செந்நிற முகில் ஒன்று கோயிலை நோக்கி மிதந்து வந்தது.",False
1985,அதன் ஒளி தாளாமல் மிலானியன் கண்களை நிலத்தில் பதியும்படி தாழ்த்தினான்.,False
1986,முகிலினின்று புறப்படுவதுபோல வெள்ளிமணி ஓசை போன்ற ஓர் ஒலி பிறந்தது.,False
1987,உன் ஆழ்ந்த அன்பழைப்புக்கேட்டு இறைவி அஃவ்ரோடைட் உளங்கனிந்தாள் உன் காரியம் கைகூடும்.,False
1988,பலிபீடத்தருகே மூன்று பொற்பந்துகள் இருக்கக் காண்பாய்.,False
1989,"பலிபீடத்தருகே உள்ள பொற்பந்துகள், கண்கண்ட இறைவியின் திருவருட் பேறுகளாக மிளிர்ந்தன.",False
1990,பந்தய நாள் வந்தது.,False
1991,ஒரு மாதம் முன்னறிவிப்பு இருந்த படியால் செய்தி நெடுந்தொலை பரந்திருந்தது.,False
1992,பல நகரங்களிலிருந்தும் இந்தப் புதுமைவாய்ந்த போட்டியைக் காணப் பல பெருமக்களும் பொதுமக்களும் திரண்டு வந்தனர்.,False
1993,மிலானியன் முகத்திலிருந்த நம்பிக்கையொளி கண்டு யாவரும் வியந்தனர்.,False
1994,அவன் நம்பிக்கை அட்லாண்டாவுக்குக்கூட வியப்பூட்டிற்று.,False
1995,அவள் முதல் தடவையாகத் தன்னுடன் போட்டியிடும் இளைஞனை நிமிர்ந்து பார்த்தாள்.,False
1996,முதல் தடவையாகவே அவள் பந்தயத்தில் தனது தோல்வியில் சிறிது ஆர்வங்கொண்டாள்.,False
1997,"ஆனால், பந்தயத்தில் இறங்கியபின் வழக்கமான போட்டியார்வம் இம்முதலுணர்ச்சியை மறக்கடித்தது.",False
1998,கிளர்ச்சியுடன் மிலானியன் அட்லாண்டாவுக்கு இணையாக முதற்சுற்று முடிவு அணுகும்வரை ஓடினான்.,False
1999,ஆனால் முடிவில் அட்லாண்டாவின் வலது கால் மிலானியனின் வலதுகாலைத் தாண்டி ஒரு அடி முன்செல்லத் தொடங்கிற்று.,False
2000,அச்சமயத்துக்கே காத்திருந்த மிலானியன் மடியிற் செருகி வைத்திருந்த பொற்பந்தில் ஒன்றை அவள்முன் உருட்டினான்.,False
2001,பொற்பந்து அட்லாண்டாவின் கண்களை மருட்டிற்று.,False
2002,அது அஃவ்ரோடைட் இறைவியின் ஆடற்பந்து என்பதை அவள் அறிவாள்.,False
2003,"அருந்தவங்கிடந்தும் பெறற்கரிய அப்பந்து காலடியில் வந்து விழ, அதை அசட்டைசெய்து அப்பால் செல்ல அவள் மனம் ஒருப்படவில்லை.",False
2004,ஓட்டத்திலேயே சற்றுத் தயங்கினாள்.,False
2005,"பின், நின்று குனிந்து, அதை எடுத்துக்கொண்டு மீண்டும் ஓடினாள்.",False
2006,"இந்தச் சிறிதுநேர ஓய்வுக்குள், மிலானியன் சிறிது தொலை முன்சென்றிருந்தான்.",False
2007,"ஆனால், அட்லாண்டா இரண்டாம் சுற்றின் தொடக்கத்துக்குள் பழையபடி அவனை எட்டி வந்துவிட்டாள்.",False
2008,அவள் தன்னம்பிக்கை பெரிதாயிற்று.,False
2009,இரண்டாம் சுற்றிலும் மூன்றாம் சுற்றிலும் மீண்டும் பொற்பந்தை எடுக்க அவளுக்கு அது துணிச்சல் தந்தது.,False
2010,"ஆனால், முதல் இரண்டு சுற்றிலும் பொற்பந்துகளை எடுக்கத் தங்கியதால், அட்லாண்டா முந்திக்கொள்ள முடியவில்லை.",False
2011,மூன்றாம் சுற்றிலோ அவள் பின்தங்கி விடவே நேர்ந்தது.,False
2012,"அவள் பந்தை எடுத்துக்கொண்டு எட்டிப்பிடிக்கத் தொடங்குமுன், மிலானியன் இலக்கை எட்டிப்பிடித்துப் பந்தயத்தில் வெற்றிபெற்றான்.",False
2013,மன்னனும் மக்களும் அடைந்த மகிழ்ச்சிக்கும் காட்டிய ஆர்வத்துக்கும் கிளர்ச்சிக்கும் எல்லை இல்லை.,False
2014,"அட்லாண்டா கூடப் பந்தயவெறி தீர்ந்ததே தான் தோற்றதுபற்றி மகிழ்ந்து, பந்தயத்தில் தோற்றேன் வாழ்க்கையில் வெற்றிபெற்றேன், என்று ஆர்வத்துடன் கூறினாள்.",False
2015,அட்லாண்டாவின் போட்டியற்ற வீரம் மிலானியனின் காதலில் முற்றிலும் தன் வயமிழந்து நின்று நிறைவெய்திற்று.,False
2016,பெர்ஸியஸ் கிரேக்க புராணக் கதைகளினிடையே ஓர் அழகிய சிறு காவியம் பெர்ஸியஸ் கதை.,False
2017,அதே ஆர்கஸ்நகரின் அரசன் அக்ரிசீனுக்குத் தனே என்ற ஒரு புதல்வி இருந்தாள்.,False
2018,அவள் வளரவளர அவள் அழகும் வளர்ந்தது.,False
2019,"ஆனால், அவள் தந்தை அவள் வளர்வது கண்டு மகிழ்வதற்கு மாறாகக் கவலை கொண்டான்.",False
2020,"ஏனென்றால், அவள் வயிற்றில் பிறக்கும் பிள்ளையே பாட்டனைக் கொன்று நாட்டைக் கைக் கொள்ளும் என்று வருபொருளுரைப்போன் ஒருவன் கூறியிருந்தான்.",False
2021,அவளைக் கொன்றுவிடலாமொன்று அவன் அடிக்கடி நினைப்பான்.,False
2022,அதற்கு மனம் வரவில்லை.,False
2023,"ஆகவே, அவள் பிள்ளையே பெறாமலிருக்கும்படியாக, அவளை ஆண்கள் கூட்டுறவிலிருந்து விலக்கி வைத்துவிட எண்ணினான்.",False
2024,"அதன் கீழறைகள் ஒருசிறு வாயில்தவிர, வேறு பலகணியோ வாயில்களோ இல்லாமல் செய்யப்பட்டிருந்தன.",False
2025,கீழறைகள் நிறைய உணவுப்பொருள்கள் நிரப்பப்பட்டிருந்தன.,False
2026,மேல்தளத்தில் பெண்களுக்கு வேண்டிய எல்லாத் தனியறை வசதிகளும் செய்யப்பட்டிருந்தன.,False
2027,"தனே பருவமடையும் தறுவாயில் அரசன் அவளையும், அவள் பாங்கியர்களையும் கோபுரத்தைப் பார்வையிடும்படி அழைத்துச் சென்றான்.",False
2028,கீழறைகளில் உணவுப்பண்டங்கள் கண்டு அவர்கள் வியப்படைந்தனர்.,False
2029,அவர்கள் அவற்றில் தம்மை மறந்து விளையாடி யிருந்தனர்.,False
2030,அரசனும் அவனுடன் வந்த ஒருசில ஏவலாளரும் இதுசமயம் பார்த்து மெல்ல நழுவிச் சென்றுவிட்டனர்.,False
2031,கோபுரத்தினுள் நுழை வதற்கான ஒரேவாயில் வெளியிலிருந்து அடைபட்டது.,False
2032,அதனை அடைவதற்கான ஒரே பாலமும் அழிக்கப்பட்டது.,False
2033,பெண்டிர் நெடுநேரம் சென்றபின்பு தாம் தனிப்பட்டு விட்டதையும் கோபுரத்தில் அடைபட்டதையும் கவனித்தனர்.,False
2034,அவர்கள் கூக்குரலிட்டனர் அழுதனர் தொழுதனர்.,False
2035,"ஆனால், அலைகளின் தொலை இரைச்சல் தவிர அவர்களை எதுவும் அணுகவில்லை.",False
2036,அவர்களுக்குத் துணையாக விடப்பட்ட ஏவலாள் ஒருவனே.,False
2037,அவனும் ஊமையும் செவிடுமான ஓர் அலி.,False
2038,நாட்கள் பல சென்றன தனே பருவமடைந்து முன்னிலும் அழகுடையவளாய்த் திகழ்ந்தாள்.,False
2039,"ஆனால், அவள் வாழ்வில் மகிழ்ச்சியில்லை.",False
2040,தன் தந்தையே தன்னைச் சிறைப்படுத்தியதை எண்ணி எண்ணி அவள் மனமாழ்கினாள்.,False
2041,தேவர்கள் தந்தையாகிய ஜீயஸ் பெருமானை அவள் நாள்தோறும் வழிபட்டுக் குறையிரந்தாள்.,False
2042,தனேயின் கனவில் ஜீயஸ் பொன்முகில்மீது தவழ்ந்து வந்து காட்சியளித்தான்.,False
2043,அவள் தன்வழிபாடு நிறைவேறியது கண்டு மகிழ்ந்து மெய்ம்மறந்தாள்.,False
2044,கனவு அரைக்கனவாக நீண்டது.,False
2045,ஜீயஸ் அழகிய மனித உருவுடன் வந்து அவளுடன் உரையாடி னான்.,False
2046,அவன் ஜீயஸ் என்பதை அவள் சிறிது நேரத்தில் மறந்தாள்.,False
2047,இளைஞன் உருவில் ஜீயஸ் அவளுடன் அளவளாவிப் பேசினான்.,False
2048,அடுத்தநாள் முதல் தனேயின் வாழ்வில் மாறுதல் ஏற்பட்டது.,False
2049,இரவில் கண்ட பொன்மயமான அழகிய வடிவிடம் அவள் ஈடுபட்டாள்.,False
2050,"தொடுத்து மூன்று இரவுகள் கழிந்தபின், ஜீயஸ் பழையபடி தன் ஒளி உருவம் காட்டி விடை பெற்றுக் கொண்டான்.",False
2051,"கண்மணி தனே, நான் உன் வழிபாட்டில் ஈடுபட்டு விட்டேன்.",False
2052,"ஆனால், அதற்காகமட்டும் வரவில்லை என் கூறாக உனக்கு இப்போது கரு விளைந்துள்ளது.",False
2053,"உன் மகன் உலகில் அரும்புகழ் நிறுத்துவான், என்று கூறி அவன் அகன்றான்.",False
2054,தனேயின் நாட்கள் முன்னிலும் மகிழ்ச்சியாகக் கழிந்தன.,False
2055,அவள் ஓர் அழகிய ஆண்மகவை ஈன்றாள்.,False
2056,பாங்கியரும் இச் சிறைக்கூடத்திலிருந்தே அவள் தெய்வ அருளால் இத்தகைய அருங்குழவி பெற்றதை எண்ணி மகிழ்ந்து கூத்தாடினர்.,False
2057,பெர்ஸியஸ் என்ற பெயருடன் குழந்தை சிறைக்கோபுரத்தில் வளர்ந்தது.,False
2058,சிறைக்குள்ளிருந்தே தனே தெய்வ அருட்குழவி ஒன்றை ஈன்றாள் என்ற செய்தி அரசனுக்கு எட்டிற்று.,False
2059,அவனால் இப்புதிய இடரைப் பொறுக்க முடியவில்லை.,False
2060,இருவரையும் தடங்கெட அழிக்க அவன் புதிய சூழ்ச்சி செய்தான்.,False
2061,தாயையும் சேயையும் அவன் சிறையிலிருந்து யாரும் அறியாமல் வெளியேற்றினான்.,False
2062,"ஒருவர் குந்தியிருக்கப் போதுமான மரத்தொட்டி ஒன்றில் இருவரையும் வைத்துக் கப்பலிலேற்றி, நடுக்கடலில் விட்டு விடும்படி அவன் கட்டளையிட்டான்.",False
2063,"தனேயின் கதறலோ, பிள்ளையின் மருட்சியோ அவன் உறுதியைக் குலைக்கவில்லை.",False
2064,தனேயின் கதறலை மனிதர் யாரும் கேட்கவில்லை.,False
2065,"ஆனால், இறைவன் ஜீயஸ் காதுக்கு அது எட்டிற்று.",False
2066,"அவன் தென்றலை அனுப்பி, அத்தொட்டியை அப்படியே மிதக்கவிட்டு, இறுதியில் ஸெரிஃவஸ் என்ற தீவில் கொண்டுபோய்ச் சேர்ப்பித்தான்.",False
2067,ஸெரிஃவஸ் வலைஞர்கள் வாழ்ந்த தீவு.,False
2068,பாலிடெக்டிஸ் என்ற வலைஞரின் தலைவனே அத்தீவின் அரசனாயிருந்தான்.,False
2069,"அவன் தம்பி டிக்டிஸ் வலைகளை உலர்த்தக் காலையில் கடற்கரைக்குச் சென்றபோது, தனேயும் குழந்தையும் மிதந்துவந்த தொட்டியைக் கண்டான்.",False
2070,"இருவரும் குளிராலும், ஈரத்தாலும், பசியாலும் குற்றுயிராயிருந்தனர்.",False
2071,"அவன் அவர்களை வீட்டுக்கு இட்டுச் சென்று, உலர்ந்த ஆடைகள் கொடுத்து உணவூட்டினான்.",False
2072,கடலில் மிதந்த அயர்வுதீரப் பலநாட்கள் ஆயின.,False
2073,பாலிடெக்டிஸ் அடிக்கடி தன் தம்பி இல்லத்துக்கு வருவதுண்டு.,False
2074,அச்சமயங்களில் அவன் தனேயைக் கண்டான்.,False
2075,அவள் அழகு அவனை மயக்கிற்று.,False
2076,அவன் அவளை மணம் செய்துகொள்ள விரும்பினான்.,False
2077,அடிக்கடி அவளிடம் தன்னை மணந்துகொள்ளும்படி வேண்டினான்.,False
2078,"ஆனால், பெருந்தெய்வ மாகிய ஜீயஸூக்கே தனே தன்னை உரியவளாகக் கருதிவிட்டாள்.",False
2079,எந்த மனிதரையும் அவள் மணக்க விரும்ப வில்லை.,False
2080,"ஆதலால், பாலிடெக்டிஸ் எவ்வளவு வற்புறுத்தியும் அவள் இணங்கவில்லை.",False
2081,தனேயை வயப்படுத்தும் எண்ணத்துடன் பாலிடெக்டிஸ் பெர்ஸியஸிடம் வெளிநட்புக் காட்டி வந்தான்.,False
2082,"ஆனால், வீரமும் கட்டழகும் வாய்ந்த அந்த இளைஞனை அவன் உள்ளூர வெறுத்தான்.",False
2083,எப்படியாவது பெர்ஸியஸை ஒழித்துவிட வேண்டும் என்று பாலிடெக்டிஸ் திட்டமிட்டான்.,False
2084,"ஒருநாள் பாலிடெக்டிஸ், பெர்ஸியஸை ஒரு விருந்துக்கு அழைத்தான்.",False
2085,"நட்புப்பேச்சுக்கிடையே அவன் பெர்ஸியஸிடம், நான் கேட்ட எதுவும் நீ கொடுப்பாயா? என்று வினவினான்.",False
2086,"அதை விளையாட்டாக எண்ணி, பெர்ஸியஸ் ஓகோ, கட்டாயம், என்றான்.",False
2087,"இதுதான் வாய்ப்பு என்று கருதிய பாலிடெக்டிஸ், எனக்கு நீ வல்லரக்கி மெடூசாவின் தலையைக் கொண்டு வந்து கொடுக்கமுடியுமா? என்றான்.",False
2088,பெர்ஸியஸ் திடுக்கிட்டான் மெடூசாவைப் பற்றி அவன் கோரமான செய்திகளைக் கேட்டிருந்தான்.,False
2089,அவள் இருந்த இடத் துக்கே யாரும் சென்றதில்லை.,False
2090,யாருக்கும் அதன் திசைகூடத் தெரியாது.,False
2091,"அவள் அழகிய பெண் முகத்துடன், பாம்புகளையே தலைமுடியாகக்கொண்டு, கழுகுகளின் இறக்கை போன்ற பெரிய இறக்கைகளை உடையவள்.",False
2092,மேலும் அவள் முகத்தைப் பார்த்தவர் கள் உடனே கல்லாய் விடுவார்கள்.,False
2093,"இத்தகைய வல்லரக்கியின் தலையை வெட்டிக் கொண்டுவரச் சொல்வதென்றால், சாகும்படி சொல்வதாகத்தான் பொருள்.",False
2094,"இங்ஙனம் சொல்பவன் நம் மாறாப் பகைவனே, என்று பெர்ஸியஸ் தனக்குள் கூறிக்கொண்டான்.",False
2095,கொடுத்த வாக்குறுதியை உயிர்கொடுத்தும் காக்க வேண்டும் என்ற எண்ணத்தால் பெர்ஸியஸ் கவலையுடன் அலைந்து திரிந்தான்.,False
2096,ஒருநாள் கடற்கரையோரமாக அவன் உலவும்போது ஒரு பேரொளி உருவம் அவன் முன் தோன்றிற்று.,False
2097,அதுதான் அதேனாதேவி.,False
2098,தேவர்களுக்கு உன்மீது பாசம் மிகுதி.,False
2099,உனக்கு என்மூலம் அவர்கள் எல்லாவகை உதவியும் செய்ய மனமுவந்து முன்வந்திருக்கின்றனர்.,False
2100,"இதோபார், அவர்கள் உனக்கு அனுப்பி யுள்ள பரிசுகளை!",False
2101,இது வெண்கலத் தலையணி இதை அணிந்தால் நீ எவர் கண்ணுக்கும் புலப்படாமல் எங்கும் திரியலாம்.,False
2102,இதோ இறக்கைகள் பூட்டிய மிதியடிகள்.,False
2103,"இவற்றில் ஏறிக் கொண்டு நீ நிலம், காடு, கடல், எதுவும் கடந்து செல்லலாம்.",False
2104,இந்தக் கேடயம் உன்னை இடர்கள் எல்லா வற்றிலிருந்தும் காக்கும்.,False
2105,இந்தக் கொடுவாள் உன் பகைகள் எதுவாயினும் ஒழிக்கும் என்று தேவி கூறினாள்.,False
2106,"பெர்ஸியஸ் துயர்நீங்கி அகமகிழ்வுடனும், நன்றியறி தலுடனும் மீண்டும் மீண்டும் தேவியை வணங்கினான்.",False
