Line Number,Sentence
1,"உண்மையில் பெண்களே ஆடவரிலும் உயர்ந்தவர்களாகவும், அவர்களைச் சீர்திருத்தியவர்களாகவும் காணப்படுகின்றனர்.",False
2,இன்று பெண்கள் ஆடவருக்கு அடிமைப்பட்டு இருப்பது பொருளாதார நிலை ஒன்றினாலேயே யாகும்.,False
3,தொடக்கத்தில் பெண்களே பயிர்த் தொழில் கைத்தொழில்கள் புரிந்து ஆடவருக்கும் உணவு அளித்து வந்தார்கள்.,False
4,"அதனால் ஆடவர், மகளிருக்குப் பணிந்து நடந்தார்கள்.",False
5,பெண்கள் ஆட்சியே ஆதியில் நடைபெற்றது.,False
6,பிற்காலத்தில் ஆடவர் சுயநலங் கருதி அவர்களின் பொருளாதார நிலையைப் பரித்து அவர்களைத் தமக்கு அடங்கி நடக்கும்படி செய்தனர்.,False
7,பெண்கள் ஆண்களுக்கு அடங்கி நடத்தல் இயற்கை விதியன்று ஆண்கள் பெண்களுக்கு அடங்கி நடத்தலே இயற்கை விதியாகும்.,False
8,இவைபோன்ற பெண்களின் பிறமாண்புகளை வரலாற்று முறையில் ஆராய்ந்து கூறுகின்றது இந்நூல்.,False
9,சென்னை .. ந.சி.,False
10,கந்தையா பெண்கள் புரட்சி தோற்றுவாய் ஆதியில் பெண்கள் ஆடவரைவிட உயர் நிலையில் இருந்தார்கள்.,False
11,அவ்வரலாறு இன்று மறக்கப்பட்டது.,False
12,சில செயற்கைக் காரணங்களால் இன்று அவர்கள் தமது உயர் நிலையினின்றும் வீழ்ச்சியடைந்தனர்.,False
13,பெண்களின் வரலாற்றை ஆராயுமிடத்து உண்மை இதற்கு நேர்மாறாகவுள்ளது.,False
14,ஆட்சியும் சொத்துரிமையும் நீண்ட காலம் பெண்களிடமே இருந்து வந்தன.,False
15,இதனால் ஆடவர் ஆளவும் பெண்கள் ஆளப்படவும் பிறந் தார்கள் என்னும் தவறான கருத்து மக்கட் சமூகங்களிடையே தோன்றி வலுவடைந்துள்ளது.,False
16,வரலாற்று முறையில் பெண்களின் பெருமையை உள்ளவாறு எடுத்து விளக்குவதே இந்நூலின் இலக்காகும்.,False
17,இதனால் சந்ததியைப் பெருக்குவது உயிர்களின் முக்கிய நோக்கம் எனத் தெரிகின்றது.,False
18,ஆண் பெண் விலங்குகள் சோடிகளாக வாழ்கின்றனவா?,False
19,பறவைகளுள் முட்டையிட்டு நீண்டகாலம் அடைகாத்துக் குஞ்சு பொரிப்பவைகள் சோடிகளாக வாழ்கின்றன.,False
20,விலங்குகளின் வாழ்க்கையை நன்கு பயின்றவர்கள் அவை சோடிகளாக வாழாது தனித்தனித் கூட்டங் களாக வாழ்கின்றன என்று கூறுகின்றனர்.,False
21,காட்டில் வாழும் விலங்குகள் பறவைகளுக்குக் கருக்கொள்ளும் உணர்ச்சி ஆண்டின் ஒவ்வோர் காலங்களிலேயே உண்டாகின்றது.,False
22,பெண் விலங்குகளும் ஆண் விலங்குகளும் தனித்தனிக் கூட்டங்களாகப் பிரிந்து வாழ்கின்றன.,False
23,பெண் ணினங்கள் கருத்தரிக்கும் காலத்தில் மாத்திரம் ஆண் விலங்குகள் பெண் விலங்குகளிடையே காணப்படுகின்றன.,False
24,ஆண் விலங்குகளிடையே பெண் விலங்குகள் காணப்படுவதில்லை.,False
25,கருத்தரிக்கும் பொருட்டு ஒரு பெண் ஒரு ஆணைத் தெரிந்து எடுப்பது இயற்கைத் தெரிவு எனப்படும்.,False
26,எப்பொழுதும் பெண் விலங்கு வீரமுடைய ஒரு விலங்கையே தெரிந்து கொள்ளுகின்றது.,False
27,அமெரிக்க துருவ மான்கள் ஒரிடத்தினின்றும் இன்னோரிடத்தில் தங்கி வாழும் பொருட்டுச் செல்லும்போது ஆண்களும் பெண்களும் தனித்தனிக் கூட்டங்களாகச் செல்லும்.,False
28,எல்லா இனமான்களிடையும் இவ்வியல்பைக் காணலாம்.,False
29,புரட்டாசி மாதத்துக்குப்பின் எருமைகளுள் ஆண் பெண் இனங்கள் தனித்தனி பிரிந்து வாழ்கின்றன.,False
30,ஆண் பெண் சேர்க்கைக்குப்பின் பெண் வெளவால் ஆண் வெளவாலைக் கடித்துத் துரத்திவிடுகின்றது.,False
31,பெண் வெளவால்களின் மத்தியில் ஆண் வெளவால்கள் காணப்படுவதில்லை.,False
32,கருக்கொண்டபின் பெண் யானைகள் ஆண் யானைகளைத் துரத்தி விடு கின்றன.,False
33,பெண் யானைக் கூட்டத்துள் ஆண் யானையைக் காண்டல் அரிது.,False
34,அணில்களும் இவ்வாறே பிரிந்து வாழ்கின்றன.,False
35,குரங்குகளைப் பற்றியும் இவ்வாறு சொல்லப் படுகின்றது.,False
36,ஒரான் ஊத்தான் என்னும் குரங்குகள் ஆணும் பெண்ணும் கலந்த கூட்டமாக வாழ்வதில்லை.,False
37,"ஆண்கள் ஒரு தனிக் கூட்டமாகவும், பெண்களும் குழந்தைகளும் மற்றொரு கூட்டமாக வும், கொரிலாக் குரங்குகள் வாழும். தாய்மார்.",False
38,ஆடவரும் மகளிரும் தனித்தனிக் கூட்டங்களாக வாழ்ந்தார்கள் விலங்கு நூல் முறையில் மனிதன் விலங்கினத்தைச் சேர்ந்தவன்.,False
39,ஆகவே அவனும் ஒரு காலத்தில் விலங்குகளை ஒப்பவே வாழ்ந்தான் என்று கூறுதல் பிழையாகாது.,False
40,ஆண்களும் பெண்களும் தனித்தனிக் கூட்டங்களாக வாழ்ந்தார்கள் என்பதற்குரிய சில வழக்கங்கள் இன்றும் காணப்படுகின்றன.,False
41,ஆகவே அவைகளை இவ்விடத்தில் விரித்து எழுதிற்றிலேம்.,False
42,பெண்கள் ஆடவரின் கலப்பின்றித் தனித்து வாழ்ந்தார்கள் அவர்கள் ஆடவர்களைப்போலப் போர் செய்யவும் வேட்டையாடவும் பழகியிருந்தார்கள்.,False
43,ஆண்டின் ஓரு முறையோ இரு முறையோ ஆடவர் பெண்களைச் சந்திக்கும்படி அனுமதிக்கப்பட்டார்கள்.,False
44,அவர்கள் வில்லை நன்றாக இழுத்து வளைக்கும் வாய்ப்புப் பெறுவதற்காக வலது தனத்தை வெட்டி எடுத்திருந்தார்கள்.,False
45,போர்ப் பிரியமுள்ள இக் கூட்டத்தினர் பிர்கிய என்னும் நாட்டின்மீது படை எடுத்தார்கள்.,False
46,உரோசருக்கு உதவியாகப் போர் செய்யும் பொருட்டுப் படைக்குத் தலைமை தாங்கிச் சென்ற அமேசன் இராணி அச்சில்லீஸ் என்பவனாற் கொல்லப்பட்டாள்.,False
47,காமம் என்பது யாது?,False
48,இவ்வுலகப் படைப்புக்கள் எல்லாம் ஆண் பெண் என்னும் இரு வகைகளாக அமைந்துள்ளன.,False
49,இவ்விரு இனங்களின் ஆண் பெண் சேர்க்கையால் உலகில் அவைகளை ஒத்த சந்ததிகள் தோன்றிப் பெருகு கின்றன.,False
50,சந்ததி பெருகுவதற்கு ஆண் பெண் சேர்க்கை அவசியம் வேண் டப்படுகின்றது.,False
51,இயற்கையாகவே எல்லா உயிர்களிடத்தும் தம்மைப் போன்ற உயிர்களைத் தோற்றுவிக்கும் இயற்கை உணர்ச்சி பதிந்து உள்ளது.,False
52,இவ்வாறு கிளர்ந்தெழும் வெறியே காமம் எனப்படுகின்றது.,False
53,வீடுகளிலே பூனைகள் இவ்வாறு செய்வதை நாம் பார்க்கின்றோம்.,False
54,சிங்கங்களும் புலிகளும் ஆண் பெண் சேர்க்கைக் காலங்களில் காட்டில் வாழும் உயிர்கள் எல்லாம் நடுங்கும்படி முழக்கஞ் செய்கின்றன.,False
55,விலங்குகளிடத்திற் காணப்படும்.,False
56,இவ் வகை இயல்புகள் மக்களிடையும் இருந்து சிறிது சிறிதாகப் பண்பட்டுள்ளன.,False
57,காதல் உணர்ச்சி ஆண் பெண் என்னும் இருபாலாரையும் அவர்களின் இளமை கழிந்த காலத்தும் இணைத்தும் வைப்பதாகிய உயர்ந்த பண்பு.,False
58,"தாய், பிள்ளைகளைப் பெறுகின்றனர் பெற்ற பிள்ளைகள் மீது அன்பு கொள்கின்றாள்.",False
59,இவ்வாறு தோன்றும் அன்பு தலைமுறை தலைமுறையாக வளர்ச்சியடைகின்றது.,False
60,இவ்வகை இளகிய உள்ளமுள்ள பெண் இயற்கைத் தெரிவு செய்யும்போது தான் தெரிந்தெடுத்த ஆடவன்மீது கசிந்த உள்ளமும் அன்புகலந்த உணர்ச்சியுமுடையவளாகின்றாள்.,False
61,ஆண் பெண் சேர்க்கைக் குப் பின்பும் அவ்வுணர்ச்சி அவளை விட்டுப்பிரியாமல் இருக்கின்றது.,False
62,இப் பண்பட்ட உள்ளப்பிணைப்பே காதல் எனப்படுகின்றது.,False
63,"தேன் கூட்டின் மத்தியில் இராணி, அல்லது தாய் ஈ இருக் கின்றது.",False
64,அதனைச் சூழ்ந்த அதன் பிள்ளைகளாகிய மற்றைய ஈக்கள் இருக் கின்றன.,False
65,இதனை ஒரு தாய் வட்டம் எனக் கூறலாம்.,False
66,இதனை ஒப்பவே மக்களும் தாய் வட்டங்களாகப் பெருகுகிறார்கள்.,False
67,பிள்ளைகளுள் ஆண்கள் வேட்டையாடு வோராக அலைந்து திரிந்தனர்.,False
68,பெண்கள் ஒரிடத்தில் தங்கி வாழ்ந்தனர்.,False
69,வயதின் மூத்த தாயே குடும்பத்தின் தலைவியாக விருந்தாள்.,False
70,அவள் சொல்லுக்கு எல்லாரும் அடங்கி நடந்தார்கள்.,False
71,தாய்க்கு அடுத்தபடி யில் அவளின் மூத்த குமாரி அதிகாரமுடையவளானாள்.,False
72,பெண்கள் ஒரிடத்திற் கூட்டமாக வாழ்ந்தமையின் அவர்கள் வாழும் இடங்களிலேயே உணவைப்பெற வேண்டியிருந்தது.,False
73,அதனால் சிறிது சிறிதாகக் கைத்தொழில் வளர்ச்சியடைந்தது.,False
74,அலைந்து திரி யாது ஒரிடத்தில் தங்கி வாழ்ந்தவர்களாகிய பெண்களே கைத் தொழிலையும் பயிர்த்தொழிலையும் வளர்த்தவர்களாவர்.,False
75,ஏர் பூட்டி நிலத்தை உழும் காலம் வரையில் ஆடவர் பெரிதும் வேட்டையாடும் நிலையிலேயே இருந்தார்கள்.,False
76,ஆடவர் சில சமயங்களில் பெண்களையே உணவின் பொருட்டு எதிர் பார்க்க வேண்டியிருந்தது.,False
77,பெண்கள் ஆடவரிலும் கண்ணிய முடையவர் களாகக் கருதப்பட்டார்கள்.,False
78,ஆடவர் பெண்களுக்குப் பணிந்து ஒழுகினர்.,False
79,உணவுப் பொருளே மக்களின் செல்வமாகக் கருதப்பட்டது.,False
80,பெண்களிடத்தி லேயே அதிக உணவு இருந்தது.,False
81,ஆகவே ஒரு தாய் வட்டத்திலுள்ள ஆடவரும் மகளிரும் திருமணக் கலப்புடையவராய்ப் பிள்ளைகளைப் பெறுதல் கடியப்பட்டது.,False
82,ஒரு தாய் வட்டத்தேயுள்ள பெண் பருவமடைந்தபோது இன்னொரு தாய் வட்டத்திலுள்ள ஆடவனைச் சேர்ந்து பிள்ளைகளை ஈன்றாள்.,False
83,பெண்ணின் கணவன் தனது தாய் வட்டத்தில் சென்று வாழ்ந்தான்.,False
84,பெண்ணின் தாய் வட்டத்தில் அவன் தங்கவில்லை.,False
85,தாய் பெறும் குழந்தைகள் குடும்பத்துக்குச் சொந்தமாக விருந்தன.,False
86,பிள்ளைகள் தந்தையரை அறியார்.,False
87,ஆகவே பிள்ளைகள் தாய் வழியில் அறியப்பட்டனர்.,False
88,தந்தைக்கும் பிள்ளைக்கும் எவ்வகைத் தொடர்பும் உண்டாகவில்லை.,False
89,பருவமடைந்த பெண்கள் சந்ததி விருத்தி யின் பொருட்டுத் தகுதியுள்ள ஆடவரைத் தெரிந்தெடுத்தனர்.,False
90,இவ் வழக்கி லிருந்து பெண்கள் தாம் விரும்பிய பலரைக் கணவராகத் தெரிந்தெடுக்கும் வழக்கு வளர்ச்சியடைந்தது.,False
91,அவர்கள் பெண்ணினால் வரையறுக்கப்பட்ட முறைப்படி அவளை அடைந்தார்கள்.,False
92,இவ்வுலகம் முழுமையிலும் இவ் வகை மணங்களே நடைபெற்றன இன்றும் சிற்சில நாடுகளில் காணப்படு கின்றன.,False
93,இவ்வகை மணங்கள் நடைபெற்ற காலத்தில் வியபிசாரமென்பது பொருளற்றதாயிருந்தது.,False
94,இவர்களின் மணமுறை பழைய தாய் வட்ட மணமுறையை ஒத்தது.,False
95,நாயர்க் குடும்பங்கள் தாய் வட்டங்களாகவுள்ளன.,False
96,ஒவ்வொரு குடும்பத் துக்கும் தாயே தலைவியாவள்.,False
97,சம்மந்த மென்பது சிலகாலத்துக்கு மாத்திரம் இருபாலாரும் கணவன் மனைவியராக இருக்கும் உடன்படிக்கை.,False
98,எப்பொழுது இருவரில் எவருக்கும் இக்கூட்டுறவு பிடிக்கவில்லையோ அப்பொழுதே அவர்கள் அதனை வெட்டிவிடுவர்.,False
99,பின்பு அவர்கள் தமக்கு விருப்பம்போல் வேறு வேறு சம்பந்தங்களை வைத்துக்கொள்ளலாம்.,False
100,"தந்தையின் சொத்தில், பிள்ளைகளுக்கு யாதும் உரிமை இல்லை.",False
101,பிள்ளைகள் தாய்வட்டத்தைச் சேர்ந்தனவாகும்.,False
102,தாய் வட்டத்துக்குரிய சொத்திலேயே அவைகளின் வாழ்க்கைச் செலவு நடை பெறுகின்றது.,False
103,தாயின் உடன் பிறந்தானுக்கே பிள்ளைகளைப் பாதுகாக்கும் உரிமை உண்டு.,False
104,அவனுடைய சொத்து அவனுடைய பிள்ளைகளைச் சேராது மருமக்களையே சேர்கின்றது.,False
105,பல ஆடவரை ஒரே காலத்தில் கணவராகக் கொண்டு ஒழுகும் ஒழுக்கம் நாயர்ப் பெண்களிடத்தில் உண்டு.,False
106,இதனை அவர்கள் சமூகம் தவறானதென்று உணர்வதில்லை.,False
107,தந்தையின் சொத்து பிள்ளைகளை அடையாமல் மருமக்களை அடையும் வழக்கு மருமக்கள் தாயம் எனப் படும்.,False
108,திருவிதாங்கூர் அரசுரிமையும் இவ்வகையினதே.,False
109,நாயர்ப் பெண்கள் பன்னிரண்டு கணவர்வரையில் உடையவர்களா யிருந்தார்கள் என்பதற்கு எழுத்து வகையான அதாரங்கள் இருக்கின்றன.,False
110,ஒவ்வொரு கணவனும் மனைவியால் வகுக்கப்பட்ட முறைப்படி ஒவ்வோர் நாளில் அவளை அடைவான்.,False
111,பெரும்பாலும் அக்கால எல்லை ஒரு நாள் மத்தியானம் முதல் அடுத்தநாள் மத்தியானம் வரையுமாக விருந்தது.,False
112,இவ் வகை வழக்கு இந்தியாவில் மாத்திரமன்று உலகம் முழுமையிலும் இருந்து வந்தது. தாய்க் கடவுள் தாயே எல்லா அதிகாரமுமுடையவளாயிருந்தாள்.,False
113,அக் காலத்தே மக்கள் எல்லா அதிகாரமுமுடைய தாயைக் கடவுளாக வழிபட்டனர்.,False
114,உலகில் முதன்முதல் தாய் வழிபாடே உண்டாயிற்று என மக்கள் நூலார் ஆராய்ந்து கூறுகின்றனர்.,False
115,எல்லா அதிகாரமுமுடைய தாய்க்கு விலங்குகளுக்குள் வீர முடைய சிங்கம் வாகனமாக்கப்பட்டது.,False
116,அவளே வீரத்தெய்வம் கொற்றவை ஆகவும் விளங்கினாள்.,False
117,உலகில் எல்லாப் பாகங்களிலும் தாய்க் கடவுள் கன்னித் தெய்வமாகவே கொண்டு வழிபடப்பட்டாள்.,False
118,முற்காலத் தாய் பிள்ளைகளைப் பெற்றபோதும் கலியாணமாகாதவள் என்றே கொள்ளப் பட்டாள்.,False
119,கலியாணம் என்பது கணவன் மனைவி என்னும் முறையில் ஒருமித்து வாழுதல்.,False
120,ஆபத்து நேரும்போது முன்னேவந்து அவைகளைக் காப்பது மூத்த பெண் விலங்கே யாகும். இதுவே இயற்கை விதிபோலும்.,False
121,மக்களுள்ளும் மூத்த பெண்ணே தலைவியாயிருந்தாள் என்று முன் படித்தோம்.,False
