Line Number,Sentence
1,தேவநேயம் பதிப்பாசிரியர் புலவர்.
2,இளங்குமரன் தமிழ்மண் பதிப்பகம் நூற்குறிப்பு நூற்பெயர் தேவநேயம் தொகுப்பாசிரியர் புலவர்.
3,இளங்குமரன் பதிப்பாளர் கோ.
4,இளவழகன் முதற்பதிப்பு மறுபதிப்பு தாள் . கி.
5,மேப்லித்தோ அளவு தெம்மி பக்கம் படிகள் விலை உரு.
6,"நூலாக்கம் பாவாணர் கணினி தியாகராயர் நகர், சென்னை ."
7,"அட்டை வடிவமைப்பு தமிழ்க்குமரன் அச்சு வெங்கடேசுவரா ஆப்செட் பிரிண்டர் இராயப்பேட்டை, சென்னை ."
8,கிறித்து பெருமான் சமய மீட்பர் காரல்மார்க்கசு பொருளியல் மீட்பர் மொழிமீட்பர் யானே என்னும் பெருமித மிக்கார் பாவாணர்.
9,இருபதாம் நூற்றாண்டைத் தம் ஆய்வு மதுகையால் தேவநேய ஊழி ஆக்கிய புகழும் வேண்டாப் புகழ் மாமணி தேவநேயப் பாவணர்.
10,"கோவலங்கண்ணனார் அவர்கள் தமிழ் விழா ஒன்றற்காகச் சென்னை வந்த போது யானும், முனைவர் கு."
11,தேவநேயர் படைப்புகள் அனைத்திலும் உள்ள சொல்லாய்வுகளைத் திரட்டி அகர நிரல் படுத்திப் பதின்மூன்று தொகுதிகள் ஆக்கினேன்.
12,இளவழகனாரிடம் ஒப்படைக்கப்பட்டு வெளியிடப்பட்டது.
13,"மொழி இன நாட்டுப் பற்றாளர் அனைவரிடமும் இருக்க வேண்டிய நூல், பல் பதிப்புகள் காண வேண்டும்."
14,வருங்கால இளைஞர்க்கு வழிகாட்டும் ஒளிவிளக்காகத் திகழ வேண்டும்.
15,அதற்குத் தூண்டலும் துலக்கலுமாக இருக்க வேண்டியவர்கள் தமிழ் மீட்டெடுப்புப் பற்றுமையரும் தொண்டரு மாவர்.
16,வெளியீட்டாளர்க்கும் பரப்புநர்க்கும் பெருநன்றியுடையேன்.
17,வாழிய நலனே!
18,இன்ப அன்புடன் வாழிய நிலனே!
19,இளங்குமரன் பதிப்புரை ஆம் நூற்றாண்டில் தோன்றிய இணையற்றத் தமிழ்ப் பேரறிஞர் மொழிஞாயிறு தேவநேயப் பாவாணர்.
20,இவர் வடமொழி ஆதிக்கத்திலிருந்து தமிழை மீட்டெடுப்பதற்காகத் தம் வாழ்வின் முழுப் பொழுதையும் செலவிட்டவர்.
21,"இவர் எழுதிய நூல்கள், கட்டுரைகள் அனைத்தையும் தொகுத்து ஒரு சேர தமிழ்மண் பதிப்பகம் வெளியிட்டதைத் தமிழ் உலகம் அறியும்."
22,முதுமுனைவர் இரா.
23,இளங்குமரனார் பாவாணர் வழி நிலை அறிஞர்.
24,வாழும் தமிழுக்கு வளம் பல சேர்ப்பவர்.
25,பாவாணரின் அறிவுச் செல்வங்களை யெல்லாம் தேவநேயம் என்னும் தலைப்பில் தமிழ் உலகம் பயன்கொள்ளும் வகையில் தொகுத்துத் தந்துள்ளார்.
26,இத்தேவநேயத் தொகுப்புகள் தமிழர்களுக்குக் கிடைத்த வைரச்சுரங்கம்.
27,இத் தொகுப்புகளை வெளியிடுவதில் பெருமைப் படுகிறோம்.
28,"அறிஞருலகமும், ஆய்வுலகமும் இவ்வருந்தமிழ்க் கருவூலத்தை வாங்கிப் பயன் கொள்வீர்."
29,பதிப்பாளர் கோ.
30,எருமை எல்லரி எல்லா எல்லாராய்ச்சியும் சொல்லாராய்ச்சியா?
31,இம் முன்மைச் சுட்டு இற்றைத் தமிழகத்தில் வழக் கிழந்தது.
32,"தி.ம. உவமை உவமை உபமா உத்தல் பொருந்துதல், உஓஓப்பு ஒப்புமை."
33,உ உவ் உவ.
34,"உவத்தல் ஒத்தல், விரும்புதல், மகிழ்தல்."
35,உவமைஒப்பு திவா.
36,மகிழ்ச்சிக்கு விருப்பமும் விருப்பத்திற்கு மனப்பொருத்தமுங் காரணமாம்.
37,"நாட, விழைய, வீழ என்னும் உவமவுருபுகள் விருப்பக் கருத்தையே அடிப்படையாகக் கொண்டுள்ளன."
38,"உவமை என்னுஞ் சொல் விருப்பப் பொருளை உணர்த்துவது மட்டுமன்றி, ஒப்புமைப் பொருளை இயல்பாகக் கொண்டும் உள்ளது."
39,உவமை உவமம் உவமன் ஓ.நோ பருமை பருமம் பருமன் முழுமை முழுமம் முழுமன் முழுவன் உவமை உவமி.
40,நோ ஒருமை ஒருமி.
41,"உவமித்தல் ஒப்பாக்குதல், ஒப்பாகக் கொள்ளுதல், ஒப்பிடுதல் தொல்காப்பியத்தில் ஆளப் பெற்ற வடிவம் உவமம் என்பதே."
42,வ.வ. உவமை என்னுஞ் சொல் வடமொழியில் உபமா என்று திரியும்.
43,"அதை உபமா என்று பிரித்து இருசொற் கூட்டாக்கி, ஒத்த அளவு என்று பொருள் கூறுவர்."
44,"தமிழில், உவமை என்பது., உப என்றும் முதனிலையும் மை என்னும் ஈறுங்கொண்ட ஒரு சொல்லே."
45,"இருக்கு வேதத்தில், உபமா என்பது கூட்டுச் சொல்லாயிருந்து முன் சொல்லிற் பொருள் சிறந்து, அளத்தில்."
46,"இதிலும், மான என்பது அளவு குறித்த மானம் என்னும் தென்சொல்லே."
47,என்று பரஞ்சோதி முனிவர் பாடுமாறு தமிழிலக்கணம்.
48,தனிப்பட்டதாயும் பிற மொழிகட்கில்லாத பொருளிலக்கணத்தைத் தன்னகத்துக் கொண்டு தலைமை வாய்ந்ததாயும் கி.மு.
49,உவமையென்னுஞ் சொல் ஒப்புமை யென்னுஞ் பொருளது.
50,இப் பொருள் அதன் முழுவடிவில் மட்டுமின்றி அதன் அடிவேரான உகரத்திலேயே கருக் கொண்டுள்ளது.
51,உகரமாகிய ஓரெழுத் தொரு மொழி ஒப்புமைக் கருத்துக் கொண்டி ருப்பதை உத்தி யென்னுஞ் சொல்லால் உணரலாம்.
52,உத்தல் பொருந்துதல் உத்தி பொருத்தம்.
53,மதிக்கும் அறிவிற்கும் பொருத்தமான செய்தி உத்தி எனப்படும்.
54,அவ்வுத்தியை அறியும் அகக்கரணத்தையும் உத்தி யென்பது ஆகுபெயர்.
55,நூலிற்கும் உரைக்கும் பயன்படும் உத்தி களான நெறிமுறைகள் முப்பத்திரண்டாகத் தொகுக்கப் பெற் றுள்ளன.
56,இவ்வுத்தியை யுக்தி எனத் திரித்தாள்வர் வடநூலார்.
57,இரு கட்சியர் விளையாடும் எல்லா விளையாட்டுகளிலும் கட்சி யமைத்தற்கு இவ்விருவராய்ப் பொருந்தி வருவதை உத்தி கட்டுதல் என்பர்.
58,கட்டுதல் என்னும் சொல் வழக்கே உத்தியென் னும் சொற்குப் பொருத்தப் பொருளுண்மையை உணர்த்தப் போதிய சான்றாகும்.
59,"கட்டுதல், பொருத்துதல், கள்ளுதல், பொருந் துதல், கள்ள என்பது பொருந்த என்று பொருள்படும் ஓர் உவம உருபு."
60,அவை என்னும் தொகுதிப் பெயரும்.
61,கட்சி கள்சி என்னும் பெயரும் இப்பகுதியதே.
62,உத்தி யென்பதனொடு தொடர்புற்ற உந்து என்றும் சொல் பொருந்துதற் பொருள்படுவது கவனிக்கத்தக்கது.
63,தானந்தோறும் உந்திடுங் கரணம் என்பது சிவஞான சித்தியார்.
64,. தமிழில் ஏறத்தாழ முக்காற் பகுதி உகரவடிச் சொற்கள்.
65,"அவை அள்ளை மோனை, பின்னை மோனை எனப்படும்."
66,"உகரச் சொல் முதலாவது முன்மைக் கருத்தையும், பின்பு அதன் வழியாகப் பின்மை, உயர்ச்சி, ஒப்புமை, ஆகிய கருத்துகளையும் கொண்டுள்ளது."
67,ஒப்புமைக் கருத்தில் உகரச் சொல் உ ஓ ஓ என மோனைத் திரிபடையும்.
68,"ஒத்தல் போலுதல், ஒவியம் ஒப்புமை பற்றிய வரைவுக்கலை."
69,ஓ தல் ஒத்தல்.
70,ஓ இயம் ஓவியம்.
71,பல மெய்களொடுஞ் சேர்ந்து பல ஒப்புமை அல்லது பொருந்தற் கருத்துச் சொற்களை உண்டுபண்ணும்.
72,"ஒக்கல், ஓச்சை, ஒட்டு, ஒண்டு, ஒண்ணு, ஒத்து, ஒப்பு, ஒம்பு, ஒல்லு, ஒவ்வு, ஒற்று."
73,"ஒன்று, ஒன்னு ஆகிய சொற்களை நோக்குக."
74,"மொழி வளர்ச்சியில், சொற்கள் பல்குதற் பொருட்டு அறுவகைச் செய்யுள் திரிபுகளும் மூவகைப் புணர்ச்சி வேறுபாடுகளும் முக்குறைகளும்."
75,முச்சேர்க்கை களும் முன்னோரால் கையாளப் பெற்றுள்ளன.
76,"முதற் சேர்க்கை இடைச் சேர்க்கை, கடைச் சேர்க்கை என்பன."
77,ஒப்புமைக் கருத்துள்ள உகரச் சொல் கடைச் சேர்க்கையாக லகரமெய் பெற்றுப் பல்வேறு திரிபடைந்து பற்பல சொற்களைப் பிறப்பிக்கும்.
78,ஓடப் புரைய என்றவை எனாஅ என்று தொல்காப்பியம் கூறுதல் காண்க.
79,ஓடாவி ஓவியன்.
80,ஓடு ஓட்டம் ஆட்டம் ஓப்பு குரங்காட்டம் ஓடுகிறான் என்னும் வழக்கை நோக்குக.
81,"ஒட்டை உடன், ஒத்த."
82,உல் உர் உறு உறழ் உர் உரி உரிஞ் உரிஞ்சு உர் உர் உரை உராய்.
83,உல் அடியின் அள்ளைத் திரிபு உல் அல்.
84,"அல்லுதல் பொருந்துதல், பின்னுதல், முடைதல்."
85,அம் அமர்தல் ஒத்தல்.
86,ளகர மெய்யீறு பல சொற்களில் யகரமெய் யீறாகத் திரியும்.
87,எடு தொள் தொய்.
88,பொள் பொய்.
89,"உவ், உவக்காண், உவை முன்மைச்சுட்டு."
90,"மனம் ஒத்திராவிட்டால், விருப்பமும் அன்பும் காமமும் இன்பமும் மகிழ்ச்சியும் எங்ஙனம் நிகழும்?"
91,இவற்றிற் கெல்லாம் அடிப்படை உளம் ஒத்தல் அன்றோ!
92,"மம் ஒரு தொழிற் பெயரீறு என்பது, உருமம், பருமம், முதலிய சொற்களால் உணரலாம்."
93,"உருத்தல், வெப்பமாதல், உருமம், வெப்பமான நண்பகல்."
94,மம் ஈறு மை யீற்றுத் திரிபெனக் கொள்ள இடமுண்டு.
95,ஒ.நோ செய்யாமை செய்யாமல்.
96,செய்யாமை போனான்.
97,"செய்யாமே போனான், செய்யாமற் போனான், என்னும் முத் தொடரும் ஒரு பொருளனவாதல் காண்க."
98,உவமை என்னும் பெயரினின்று உவமித்தல் என்னும் வினை பிறக்கும்.
99,"ஒருமை என்னும் பெயரினின்னு ஒருமித்தல் என்னும் வினை பிறந்திருத்தல் காண்க, உவமித்தல், ஒன்றனை ஒன்றிற்கு ஒப்பாகக் கூறுதல்."
100,"இங்ஙனமே, உவமானம் என்னும் பெயரினின்று உவமானி த்தல் என்னும் வினை பிறக்கும்."
101,தீர்மானம் என்னும் பெயரினின்று தீர்மானித்தல் என்னும் வினை பிறந்திருத்தல் காண்க.
102,"தீர்மானம், முடிவு தீர்மானித்தல் முடிபு செய்தல், உவமானித்தல், உவமித்தல்."
103,உவப்பு என்னும் சொல் முற்கூறியவாறு உயர்ச்சிப் பொருளையுந்தரும்.
104,உவ உவர் இவர்.
105,"இவர்தல் உயர்தல், ஏறுதல் உவ உவப்பு உயரம், உவஉவஉகப்பு உயர்வு உவ உவண் மேலிடம் உவண் உவணை தேவருலகம்."
106,தொல்காப்பியம் உயர்ந்தது என்று குறித்தது.
107,சிறந்தது என்னும் பொருளது.
108,"சிறப்பு, உயர்வு சிறப்பு, இழிவு சிறப்பு என இரு திறப்படும்."
109,உயர்ந்த பொருளுக்கு மிகவுயர்ந்த பொருளை யும் இழிந்த பொருளையும் உவமங்கூற வேண்டும் என்பதே தொல்காப்பியர் கருத்து.
110,வடமொழியில் உபமா உபமான என்னும் இரு வடிவுகளே உள.
111,"இவை முறையே, உவமை, உவமானம், என்பவற்றின் திரிபுகள், உவமம், உவமன், உவமி, உவமானி என்னும் வடிவுகளும் சொற்களும் வடமொழியிலில்லை."
112,அறியுங்கருவி அல்லது அளவைப் பெயர் ஆன என்று இறின்.
113,அதனால் அறியப்படும் பொருளின் பெயர் ஏய என்று இறுவது வடமொழி மரபு.
114,எடு ஞானம் ஞேயம் அனுமானம் அனுமேயம் பிரமாணம் பிரமேயம் இம்முறைப்படி உபமானத்தினால் அறியப்படுவது உபமேயம் என்றாயிற்று.
115,இது பிற்கால வளர்ச்சி மானம் என்பது தனிநிலையில் அளவு என்று பொருள்படும் தூய தென்சொல்.
116,படியை இன்றும் மானம் என்பர் வடார்க்காட்டார்.
117,உவமை தென் சொல்லே என்பதற்கு வேறு சில சான்றுகளுமுள.
118,வடமொழியில் உபமா என்னும் சொல்லில் உப என்பது இடைச்சொல்லான முன்னொட்டு உபசர்க்கம்.
119,"ஆகவே, மா என்பதே சிறந்த உறுப்பாம்."
120,உவமானம் என்னும் தமிழ்ச் சொல்லில் மானம் என்பது அடைமானம் அடைவு படிமானம் படிவு என்பவற்றிற்போல் ஒரு விகுதி.
121,"உபமான என்னும் வடசொல்லில், மான என்பது அளவு என்று பொருள்படுத்தப்படுஞ் சொல்."
122,"இங்ஙனம் வேறுபட்டிருப்பதால், தமிழ் உவமை வேறு வட மொழி."
123,உபமா வேறு என்று கருதற்க.
124,தொல்காப்பியத்திலும் தொன்னூல்களிலும் உவமை அணியிலக் கண முறையிற் கூறப்படாமல் பொருளிலக்கண முறையிலேயே கூறப்பட்டுள்ளது.
125,"வடமொழியில், யாப்பிலக்கணம் சந்தசு அல்லது சந்தோபிசிதி என்னும் நூல்களிலும், அணியிலக்கணம் அலங்காரம் என்னும் நூல்களிலும் வேறாகக் கூறப்படும்."
126,"தமிழிலோ, யாப்பும் அணியும் பொருளிலக்கணக் கூறுகள், அவை தனிநூற்களிற் கூறப்பட்டவிடத்தும், பொருள் இலக் கணக் கூறுகளாகவே என்றுங் கொள்ளப்பெறும்."
127,"உவமை அணி கட்கெல்லாம் தாயாதலால், அணியிலக்கணம் உவமவியலில் அடக்கமாம்."
128,"ஆயின், எச்சவியலில் உவமத்தொகை கூறப்பட் டிருப்பதால் அதன் மறுதலையாகிய உவம விரியும் கூறாமல் கூறப்பட்டதாகக் கொள்ளப்பெறும்."
129,"உவமம், உவமவுருபு, பொதுத்தன்மை, பொருள் என்னும் நான்கும் உவமை உறுப்புகளாம்."
130,இந்நான்கும் அமைவது விரியுவமை உவம உருபு அல்லது உவமவுருபும் பொதுத் தன்மையும் குறைவது தொகையுவமை.
131,இவை யெல்லாம் பிற்காலத்து வளர்ச்சியும் மொழிபெயர்ப்புமாகும்.
132,இதுகாறும் கூறியவற்றால் உவமை தென் சொல்லே என்றும் உவமவியல் தென்மொழி யிலக்கணக் கூறே என்றும் தேர்ந்து தெளிக.
133,உழுவார் உலகத்திற் காணியஃ தாற்றா தெழுவாரை யெல்லாம் பொறுத்து என்றார் திருவள்ளுவர்.
134,சிறப்பாக இரப்பார்க்கொன்றீபவரும் விருந்தினரைப் பேணுப வரும் உழவரேயாவர்.
135,"விருந்தோம்பலும் இரப்போர்க் கீதலுமாகிய வேளாண்மை செய்வதினா லேயே, உழவர் வேளாளர் எனப்பட்டனர்."
136,வேளாண்மையாவது பிறரை விரும்பிப் பேணு தலையாளுந் தன்மை.
137,வேள் விருப்பம்.
138,"உழவர் அமைதிக் காலத்தில் உழவுத் தொழிலைச் செய்து வந்ததோடு, போர்க்காலத்தில் போர்ப்பணியும் புரிந்து வந்தனர்."
139,வேந்துவிடு தொழிலின் படையுங் கண்ணியும் வாய்ந்தனர் என்ப அவர் பெறும் பொருளே என்று தொல்காப்பியங்கூறுதல் காண்க .
140,மருதநிலத்தூரில் நிலையாக வசித்து ஆறிலொரு கடமையை அரசனுக்கு ஒழுங்காக இறுத்துவந்தவரும் வேளாளரே.
141,"இதனால், அவர் பதினெண் குடிமக்கள் எனக் கூறப்பட்டு வேளாளருள் அடக்கப் பட்டனர்."
