Line Number,Sentence
777,உதயணனோ வாசவதத்தைபாற் கொண்ட காதலை வேற்றோன் போல மறந்து பதுமாபதியையே விரும்பி நிற்கின்றான்.,False
778,தோழர்கள் அவனது விடாப்பிடியை யுணர்ந்து இஃது ஊழ்வினை போலும் என்று தெளிய.,False
779,"அவர்கள் பலபட ஆராயத் தொடங்கிய காலை, முதற்கண், இரவலருருவில் உதயணனை அரசன்பாற் செல்ல விடுப்பதென எண்ணியவழி.",False
780,"ஒருவர் முற்போந்து, அவ்வாறு செய்யின்.",False
781,"அதற்கு அவர்கள் விடையிறுப்பாராய், மற்றவள் புகுதருமாடம்புகினே குற்றம்படுவ கூறக் கேண்மதி காவலாளர் கடுகுபு வந்தகத் தாராய்ந் தெதிர்ப்பரருநவையுறாது போரார்குருசில்!",False
782,போதரவுண்டெனின் உருவமாதர் பெருநலம் பெறுதி நன்றா வெய்தும் வாயிலவருனை என்றேயாயினு மிரவலனென்னார் வேண்டாவது என விதியிற் காட்டி மறுக்கின்றனர்.,False
783,"மற்று, உதயணன் மனமோ அதனையே துணிந்து நிற்கிறது.",False
784,"முடிவில் அவர்கள் உதயணன் கருத்திற்கிசைதலும், மறுநாள் முதியவேதியன் போல் உருக்கொண்டு உதயணன் சென்று காமன் கோட்டத்தே மறைந்திருக்கின்றான்.",False
785,அங்கே பதுமாபதி வருதலும் அவள்முன் தன் இளநலம் தோன்றநிற்கின்றான்.,False
786,இரு வர்க்கும் காதல் கைகடந்து செல்கிறது.,False
787,இருவரும் யாழோர் மணம்புரிந்து கொள்கின்றனர்.,False
788,பிறரறியாமல் உதயணன் வெளி வருகின்றான்.,False
789,வாயிலோனும் பெருமகிழ்ச்சியுடை யோனாய் வேந்தன் நல்லவையுள் இருக்கும் செவ்விகண்டு உதயணன் வரவைத் தெரிவிக்கின்றான்.,False
790,உதயணனும் சிறிதும் தயங்காது சென்று வைத் தோன்மீட்டும் எடுப்பது போலப் பொருட்குவையிருந்த விடத்தைக் காட்டுகின்றான்.,False
791,அவ்வாறே அவ்விடத்தையகழ்ந்தபோது அவன் உரை பொய்யாவகையில் நிறைந்த விழுப்பொருள் இருப்பக் கண்டெடுத்து எல்லையில் இன்பமெய்துகின்றான் தருசகன்.,False
792,வேந்தன் பெருமகிழ்ச்சியுற்று ஏவலரை நீரூற்றகழுமாறு ஏவு கின்றான்.,False
793,உதயணற் குறுதுணையாக உருமண்ணுவா ஆங்கே மறைந்துறைகின்றான்.,False
794,ஏனை இசைச்சனும் வயந்தககுமரனும் பதுமாபதியின் தாயுறையும் கோயிலில் தருமநூல் முதலியன வோது வோராய் அமர்கின்றனர்.,False
795,மற்றைய வீரரும் தக்கவாறு மறைந் தொழுகுகின்றார்கள்.,False
796,அவனும் அதற்கிசைந்து காமன் கோட்டத்தில் கரந்துறைகின்றான்.,False
797,ஏவலர் சிவிகையை அவ்வண்ணமே வைத்து நீங்குகின்றனர்.,False
798,சிறிதுபோதில் அவள் குறிப் பறிந்து போந்த யாப்பியாயினி.,False
799,"சிவிகை கொணரப் பெற்றபின், உதயணன் பிறரறியாதபடி சென்று சிவிகைக்குள் நுழைந்து ஒடுங்குகின்றான்.",False
800,பதுமாபதியும் அதற்குள்ளேறிக் கொள்கின்றாள்.,False
801,சிவிகையும் அவ்வாறே சென்று கன்னிமாடத்தைக் குறுகுகிறது.,False
802,அவ்விடத்தே இனிய நிழல்தரும் மரங்கள் தழைத்துநின்று இருள்செய்கின்றன காலமும் இருட்காலமாதலின்பேரிருள் சூழ்ந்து கொள்கிறது.,False
803,உதயணன் சென்று பள்ளியறையில் ஒடுங்குகின்றான்.,False
804,பதுமாபதியும் அவன் பின்னே சென்று சேர்கின்றாள்.,False
805,ஆங்காங்குத் தக்க காப்புக்கள் அமைக்கப் பெறுகின்றன.,False
806,நலனாராய்ச்சி விண்ணுறையும் தேவரும் விரும்பத்தக்க போகமகளிர் உறையும் பேருலகத்தைப் பெற்றோனைப் போல உதயணன் கன்னிமாடத்தேயிருந்து பேரின்பம் நுகர்ந்தொழுகுகின்றான்.,False
807,அவன் கூட்டத்திற் பிரியா துறையும் பதுமாபதியும் பிறர் காண்டற்கரியளாகின்றாள்.,False
808,இருவரும் இவ்வாறு எழுநிலைமாடத்துயர்நிலத்திருக்க ஏனை மகளிர் கேட்போர்க் குரைத்தல் வேண்டி.,False
809,அவ்வாறே யாவும் நடைபெறுகின்றன.,False
810,எழுநிலை மாடத் துயர்நிலத்துப் பேரறைவனப்பும் கட்டிலமைதியும் கண்கவர் ஓவியங்களும் உரைப்போர் உரையளவிகந்து விளங்குகின்றன.,False
811,கண்கள் கயலெனப் பிறழ்கின்றன திருநுதல் வியர்க்கின்றது முகம் நிறம் பெயர்கிறது.,False
812,தம்மால் வந்த தாங்கரும் வெந்நோய் தம்மை நோயதல்லது பிறரை எள்ளது நோவ வேதமுடைத்தெனச் சிலவாய சொற்கள் மிழற்றப்படுகின்றன.,False
813,நெற்றியின் மேற் சுருண்டு கிடந்த கருமயிர் கண்கவர் வனப்புடன் அசைகின்றது.,False
814,கண்களி லிருந்து நீர்த்துளிகள் வீழ்கின்றன வெய்துயிர்ப்பால் மார்பகம் வீங்கிவீங்கி யடங்குகிறது.,False
815,"இதனைக் காணும் உதயணன் நிலை கலங்கி, ஒருபிழையும் செய்திலேனே!",False
816,ஏன் இத்துணைப்புலவி என்று எழுந்து இரந்து நிற்கின்றான்.,False
817,இன்பச் செய்கைகள் பல செய்து காட்டினும் அவள் சிவப்பாறு கின்றாளில்லை.,False
818,தனது ஒவ்வொரு செய்கையும் அப்பதுமாபதியின் சினத்தை மிகுவித்தல் கண்டு மருள்கின்றான்.,False
819,அக்காலையில் எழுநிலைமாடத்து உச்சியில் நின்ற சத்திமேலிருந்த கூகையொன்று குழறுகிறது.,False
820,"இவ்வாறொழுகும் நாட்களில், பதுமாபதி தன் உயிர்த் தோழியுடன் யுசாவி உதயணனது கல்வி நலத்தையாராய வேண்டுமென வெண்ணுகின்றாள்.",False
821,வல்லேன்யான்என இசைக்கின்றான்.,False
822,"மகளிர் நகைத்து, நீங்குகின்றனர்.",False
823,பின்பொரு நாள் பதுமாபதி பயிற்றும் யாழைக்கொணர்ந்து அவள் கையில் தருகின்றனர்.,False
824,அவள்அதன் உறையைக் கழித்துத்திவவை நிறுத்த முயல்கின்றாள் அவளால் இயலவில்லை.,False
825,நாடினையாகின் அலைத்தல் கற்றல்குறித் தேன்யான் யாப்பி மற்போர் மார்ப!,False
826,இதற்குள் மாலைப்போதும் வருகிறது.,False
827,ஞாயிறு மேலைக்கடலையடைகிறது முல்லைமலர்கிறது.,False
828,தண்கண் வாடை சாலேக வழியே வருகிறது.,False
829,இவ்வாறு இசைவகையால் இன்புறுத்திய உதயணன் அவளோடு களவே மேற்கொண்டொழுகுகின்றான்.,False
830,அதனால் இஃது ஆகாது என்று மறுக்கின்றான்.,False
831,"அவளும் சென்று வேறு நரம்பு சில கொணர, அவற்றை உதயணன் குற்ற முடையவென மறுக்கின்றான்.",False
832,அவன் அவற்றை யாராய்ந்து யாழிலிட்டுச் செம்மை செய்து தருகின்றான்.,False
833,"யாப்பியாயினி அதனைப் பதுமாபதி யிடந்தர, அவளும் இசைத்துப் பாடியின் புறுகின்றாள்.",False
834,பதுமாபதியைப் பிரிந்தது உதயணன் காமன் கோட்டமிருந்த இளமரக்காவினுள் இருக்கை கொண்டானாயினும் பதுமையொடு களவொழுக்கத்தை மேற்கொண்டு ஒழுகிவருகின்றான்.,False
835,இவ்வாறு ஒரு திங்கள் கழிகிறது.,False
836,"அச்சுவப் பெருமகன், தான்இவர்ந்து போந்த யானையினின்றும் இழிந்து தருசகனை வணங்குகின்றான்.",False
837,தருசகன் அவனைத் தழீஇக்கொண்டு தன் அரண்மனைக்குச் செல்கின்றான்.,False
838,நகரமெங்கும் பதுமாபதியின் திரு மணங்குறித்த பேச்சே நிலவுகிறது.,False
839,அச்சுவப் பெருமகனும் இராசகிரியத் திற்றங்குகின்றான்.,False
840,இச்செய்தி தருசகற் கெட்டு கிறது.,False
841,எதிர்பாராவகையில் பகைவர் சூழ்ந்து கொண்டதனால் பெருங்கலக்கமுற்று அமைச்சரோடெண்ணி மாணகனுக்கு உதயணனுக்குத் தெரிவிக்க நினைக்கின்றான்.,False
842,இதற்கிடையே அயிராபதி போந்து உதயணற்கு நிகழ்ந்துள்ள செய்தியைத் தெரிவிக் கின்றாள்.,False
843,உதயணனும் இருதிங்களில் யான் போந்து பதுமாபதியை மணப்பேன் அதுகாறும் பிரிவாற்றி யிருக்க எனச் சொல்லிவிடுக் கின்றான்.,False
844,தானும் உருமண்ணுவாவும் இருந்து சூழ்கின்றனர்.,False
845,"உருமண்ணுவா, போருண்டாயது கண்டு, இதுவே வாயிலாக நம் கருமம் முடித்தல் கூடும் மிகை எண்ணி, தன் தோழரொடு ஆராயலுற்று.",False
846,தோழர் பலரும் உடன்வரச் சின்னச் சோலையென்னும் மலைச் சிகரத்தையடைந்து ஏனை வீரர்பலரும் வந்து சேருமாறு ஒருவகைப்பாட்டைப் பாடுகின்றான்.,False
847,அதனைக் கேட்டதும் அவரனைவரும் வந்து கூடுகின்றனர்.,False
848,செல்பவர் பகைவர் படியணு கவும் இசைச்சன் ஒரு குதிரை மேல் வருகின்றான்.,False
849,பகை மன்னன் படைத்திறங்கண்டுகூறும் இவர்கள் யாவராயினும் நமக்குத் துணையாவர் எனத் துணிந்த அப்பகைமன்னர் அவர்களைத் தம்பால் இருக்க விடுகின்றனர்.,False
850,"வணிகருருவொடுவந்த உதயணன் முதலியோர், பாடி வீட்டளவும், விறற்படைவீரமும், வேந்தர் குறிப்பும் பிறவும் நன்கறிந்து கொள்கின்றனர்.",False
851,இரவு வருகிறது.,False
852,"பகைவர் படைத்தொகை பலவும் அழியக் கண்டதும், வீரர் வத்தவன் வாழ்க என்று ஆரவாரிக் கின்றனர்.",False
853,வயந்தகனும் அவ்வாறே வீதியுள்ளோரெல்லாரும் அறியும்படி உதயணனே பகைவரை இரவில் வெருட்டி யோட்டினவன் எனப் பறையறைந்து சொல்கின்றான்.,False
854,"வயந்தகனுரைத்து வரும் செய்தியைத் தருசகன் கேட்டு, அவனைத் தன்பால் வருவிக்கின்றான்.",False
855,வயந்தகன் வருகையில் கேகயத் தரசனான அச்சுவப் பெருமகனும் உடனிருக்கின்றாள்.,False
856,"இருவரும் வயந்தகனைப் பேரன்புடன் வரவேற்க, வயந்தகன் நிகழ்ந்ததைச் சுருங்கவுரைக்கின்றான்.",False
857,இருவரும் அன்பிற் கலந்த இன்பக்கட்டுரை பயின்று இன்புறுகின்றார்கள்.,False
858,பக்கம் நின்றோர் உதயணன் ஆற்றலையும் குடிப்பிறப்பின் தொன்மைச் சிறப்பையும் தம்முட்பேசிக் கொள்கின்றனர்.,False
859,அதனை நாட்டு மக்கள் தருசகற்குத் தெரிவிக்கின்றார்கள்.,False
860,விருத்திகாரரும் வேறுண்டியது பெறும் உரத்தகையாளரும் ஒருங்கு வந்தீண்டுமாறு முரசறையப்படுகிறது.,False
861,சொல்வன்மை மிக்க வயந்தகனும் அவ்வண்ணமே தருசகன்பாற் சென்று உதயணன்உரைத்ததை யுரைக்கின்றான்.,False
862,"அவனும் மந்திரமாக்களொடு ஆராய்ந்து, உதயணன் உரைத்தாங்குச் செய்வதே உறுதியெனத் தெளிகின்றான்.",False
863,யானையும் புரவியுமமைந்த பெரும் படை பண்ணுமாறு தானைவீரர்க்கு ஆணையும் தரப்படுகிறது.,False
864,"பின்பு, தருசகன் உதயணன் கருத்தைத் தன் மைத்துனனான அச்சுவப் பெருமகற் குரைக்கின்றான்.",False
865,போர்க்கு வீரரனைவரும் புறப்படு கின்றனர்.,False
866,நால்வகைப்படைகளும் பண்ணமைந்து புறப்படு கின்றன.,False
867,முரசும் சங்கும் முருகும் என்ற பல்வகை வாச்சியங்கள் முழங்குகின்றன.,False
868,"காண்போர், ஈண்டுப்படும் உயிர்த்தொகைகட்கு நமனுலகு இடம் பற்றாதெனக் கூறிக் கொள்கின்றனர்.",False
869,சங்கமன்ன ருடைந்தது நால் வேறுபடைகளும் தம்முள் எதிர் எதிர் பொருகின்றன.,False
870,யானையின் கைகள் பனந் துணிபோல் வீழ்கின்றன.,False
871,தலைகள் துடித்தலைபோல உருள்கின்றன அற்று வீழ்ந்த யானையின் வால்கள் அறுப்புண்டு வீழும் விற்களைப் போலத் தோன்றுகின்றன.,False
872,இவற்றிடையே உதயணன் எலிச்செவியரசனுடைய தம்பி யேறியிருந்த களிற்றின் மேற் பாய்ந்து அவனைக் கொல்லாது கச்சினால் அவன் தோளைப் பிணிக்கின்றான்.,False
873,அதனை எலிச் செவி கண்டு போர் வெறி கொள்கின்றான்.,False
874,உடனே உருமண்ணுவாவும் கேகயத்தரசனும் எலிச் செவியை வளைத்துக் கொண்டு பொரு கின்றனர்.,False
875,"அப்போரில், எலிச்செவி கேகயத்தரசன் தலையை வெட்டி நிலத்தே புரள்விக்கின்றான்.",False
876,அதுகண்ட உதயணன்.,False
877,"உருமண்ணு வாவைக் கொல்லாதொழிகுவையாயின், உன் தம்பியை யான் கொல்லாதொழிகுவன் எனவுரைக்கின்றான்.",False
878,சிறிதுபோதில் மாற்றோர் படை உடைந்து கெடுகிறது.,False
879,உருமண்ணுவா பகை மன்னர்பால் சிறைப்படுத்தப்பட்டிருக்கின்றான்.,False
880,உதயணன் வெற்றி யுடன் தருசகன்பால் வருகின்றான்.,False
881,இருவரும் நகர்க்குள்ளே செல்கின்றார்கள்.,False
882,நகரமக்கள் பேராரவாரத்துடன் அவர்களை வரவேற்கின்றார்கள்.,False
883,வேறு சிலரும் பலரும் கூடிநின்று.,False
884,தருசகனும் உதயணனும் அரண்மனை சென்று சேர்கின்றனர்.,False
885,பின்னர்த் தன்கோயிலை யடைந்து அவளை வரைந்து கோடற்கு வேண்டும் சூழ்ச்சியினை நினைந்திருக்கின்றான்.,False
886,இதனை யறிந்த முதுமகளொருத்தி போந்து பதுமாபதிக்குத் தருசகன் செய்திருக்கும் முயற்சியைத் தெரிவிக்கின்றாள்.,False
887,உதயணன் தோழர் உடனிருக்கின்றனர்.,False
888,இதனைக் கேட்ட உதயணன் சிறிது நேரம் மறுமொழீயொன்றும் கொடானாய்த் தன் மனத்தே பலபட நினைக்கின்றான்.,False
889,"அமைச்சன், இவ்வுரை பெருங்குடி மாந்தர்க்கு ஒத்த தன்று என்பது போலும் சொல்பல சொல்லி வேண்டு கின்றான்.",False
890,அமைச்சனும் அகமகிழ்ச்சியுடன் மீண்டு செல்கின்றான்.,False
891,பதுமாபதி வதுவை உதயணன் உடன்பட்ட செய்தியை யுரைப்பக் கேட்டதும் தருசகன் கொண்ட மகிழ்ச்சிக்கு அளவில்லை.,False
892,பின்னர்த் தருசகன்.,False
893,தன் கருத்தைத் தன் தாய்க்குத் தெரிவித்து அவள் உடன் பாட்டைப் பெறல் வேண்டிச் சான்றோரை விடுக்கின்றான்.,False
894,யாப்பியாயினியின் திருமணத்துக்கு வேண்டுவன ஏற்பாடு செய்யப்படுகின்றன.,False
895,மணநாளும் குறிக்கப்படுகிறது.,False
896,இச்செய்தி பதுமாபதிக் கெட்டுகிறது.,False
897,குறித்த ஓரையில் திருமணம் செவ்வே நடை பெறுகிறது.,False
