Line Number,Sentence
3131,பயன் அதிகமாயின் கற்றலும் அதிகமாகின்றது என்பது சோதனை காட்டும் உண்மை.
3132,"பயன் அதிகமாயின் நோக்கம் நன்கு அமையும் நோக்கம் நன்கமையின், கற்றல் விரைவாகவும் திட்டமாகவும் நடைபெறும்."
3133,துலங்கலுக்கும் பயனுக்கும் இடையேயுள்ள கால இடையீடு குறையக் குறையக் கற்றலின் வன்மை அதிகரிக்கும்.
3134,வெற்றியையும் மனநிறைவினையும் தரும் செயல்களைத் திரும்பத் திரும்பச் செய்கின்றோம்.
3135,தோல்வியையும் மனநிறை வின்மையையும் தரும் செயல்களை மேற்கொள்ளாதிருக்கக் கற்கின்றோம்.
3136,உற்சாகம் எட்டப் பெறாதவர்கள்பால் தேர்ச் சிக்குறைவு உண்டாகின்றது.
3137,இதை நடைமுறையில் நாம் காண்கின்றோம்.
3138,வகுப்பறையில் பொருத்தம் வகுப்பறையில் இவ் விதியைக் கையாளும் வாய்ப்புக்கள் எண்ணற்றவை ஓரளவு வெளிப்படை யானவை.
3139,ஒரு சிலவற்றைமட்டிலும் ஈண்டு தருவோம்.
3140,மாணாக் கர்கள் பள்ளியில் பெறும் அனுபவங்கள் மகிழ்ச்சியையும் திருப்தியையும் அளிக்கக்கூடியவையாக இருத்தல்வேண்டும்.
3141,இரண்டாவதுபயிற்சி விதிஇவ்விதி பயிற்சியின் இன்றியமை யாமையை வற்புறுத்துகின்றது.
3142,பயன்விதி பயிற்சி விதியில் முடி கின்றது.
3143,"ஒரு செய்யுளை மனப்பாடம் செய்யவும், ஓர் இராகத்தை நன்றாகப் பாடவும், மிதிவண்டியிலேறிப் பாங்காகச் செல்லவும், அவற்றைப் பலமுறை பயிலவேண்டும்."
3144,எழுத்துத்திருத்தம் பெறுவதற்கும் பயிற்சி வேண்டும்.
3145,"சித்திரமும் கைப்பழக்கம், செந்தமிழும் நாப்பழக்கம் என்பது பழமொழியன்றோ?"
3146,வாய்ப் பாடு சம்பந்தமான சிறு கணக்குகளைப் பலமுறை போடுவதால் சிறுவன் வாய்ப்பாட்டைக் கற்கின்றான்.
3147,வீணையில் பயிற்சி பெறுவோர் அதனை மீண்டும் மீண்டும் பன்முறை மிழற்றிக் கற்கின்றனர்.
3148,நாட்டியம் ஆடுவோரும் பலமுறையில் தப்படி களைப் போட்டுப்போட்டுத்தான் கற்கின்றனர்.
3149,பயிற்சியின்மையால் பலவற்றை மறக்கின்றோம்.
3150,அடிக்கடிப் பயன் படுத்தும் வாய்ப்புக்களின்மையால் பல செய்திகள் மறந்து போகின்றன.
3151,அவற்றைச் சரியாகப் படியாமல் தேர்ச்சியுற்ற வேறொரு புலவர்.
3152,புலவர் வகுப்புக்குக் கற்பிக்கும் வாய்ப்புக்களினால் அவற்றை நினைவிலே வைத்துக் கொள்கின்றார்.
3153,இவை நடை முறையில் நாம் காணும் உண்மைகள்.
3154,இவ்விடத்தில் இன்னொன்று நினைவுகூர்தற்பாலது.
3155,பயிற்சி மட்டிலும் நிறைவினைத் தராது.
3156,"தகுந்த இயக்கங்களைத் தெரிந்தெடுத்து வலியுறுத்தியும், தகாத இயக்கங்களைத் தடுத்தும் செய்யும் பயிற்சியே தேர்ச்சியைத் தரும்."
3157,வகுப்பறையில் பொருத்தம் தமக்குத் தெரிந்தவற்றை யெல்லாம் அடிக்கடிப் பயன்படுத்தும் வாய்ப்புகளிருப்பின் மாணாக்கர் நன்கு கற்பர்.
3158,இது முற்றுதலுடன் தொடர்பு கொண்டது.
3159,ஆயத்தமாக இருக்கும்பொழுதுதான் கற்றல் நற்பயன் அளிக்கும்.
3160,இவற்றுள் சில பிறவிப் பண்புக் கள் சில கற்ற பண்புகள்.
3161,படித்தலுக்கு ஆயத்தம் வராத குழந்தைக்குப் படித்தலைக் கற்பித்தல் பயன்தராது.
3162,இந்த அளவு குழந்தை பக்குவமடையாவிட்டால் அது படிப்ப தற்கு ஆயத்தமாகவில்லை என்று கொள்ளவேண்டும்.
3163,ஆயத்தமாக இருப்பதற்குச் சில எடுத்துக்காட்டுக்கள் தருவோம்.
3164,வகுப்பில் அடங்கிக் கிடந்து வெளிவந்த சிறுவன் மாலை ஐந்து மணிக்கு விளையாட ஆயத்தமாக இருக்கின்றான் படிக்க ஆயத்தமாக இல்லை.
3165,வெற்றியைப்போல் வெற்றியைத் தருவது வேறோன்றுமில்.ல என்பது ஆங்கிலப் பழமொழி.
3166,ஒரு நாள் பிற்பகல் மணிக்குச் சூரியகிரகணம் பிடிக் கின்றது.
3167,வகுப்பி லுள்ள மாணாக்கர்களுக்குப் பாட வேளைப் பட்டியின்படி நடைபெறும் சமூகப் பாடத்தில் விருப்பமில்லை.
3168,எல்லோரும் புதிதாக நிகழவிருக்கும் சூரிய கிரகணத்தைக் காணத் துடித்துக் கொண்டிருக்கின்றனர்.
3169,இந்நிலையில் சுவை யற்றதாகவுள்ள சமூகப் பாடத்தைக் கற்பித்தலால் யாது பயன் விளையும்?
3170,புதுப்போக்கும் அனுபவமுள்ள ஆசிரியர் இந்நிலையை மிகத் திறமையாகச் சமாளிக்கலாம்.
3171,அதன்பிறகு பூகோளபாடத்தில் பல செய்திகளையும் விதிகளையும் பற்றிக் கற்பிக்கலாம்.
3172,மாணாக்கர்கள் எதற்கு ஆயத்தமாக இருக்கின்றனர் என்பதை அறியாது கற்பித் தால் சிறிதும் பயன் இராது.
3173,தன்னோக்கத்தை நிறை வேற்றும் செயல்கள் அனைத்தும் ஒருவரை ஆயத்தமாக்குகின்றன.
3174,தன் னோக்கம் ஒருவர் தன் வேலையை ஒரே மனத்துடன் செய்ய இடந்தருகின்றது.
3175,வகுப்பறையில் பொருத்தம் பெரும்பாலும் ஆயத்தக்கூறு முற்றிலும் புறக்கணிக்கப்பெறுகின்றது என்றே சொல்லலாம்.
3176,மட்டமான சிறுவர்களை வைத்துக் கொண்டு எப்படி மார் அடிப்பது?
3177,என்று பல ஆசிரியர்கள் அடிக்கடிச் சொல்லுவதிலிருந்தே இஃது ஓரளவு புலனாகும்.
3178,அவர்கள் கருத்தில் மட்டமான என்பதற்குக் குறைவான அறிதிறன் ஈவுள்ள என்பது பொருள்.
3179,"உண்மையாக நோக்கினால், ஆயத்தம் இல்லாத என்பதுதான் அதற்குப் பொருள்."
3180,இம்மாணாக்கர்கள் சில பாடங்களில் வெற்று நிலைப்பொருள்களை உணர்தல் மிகமிக அரிதாகும்.
3181,ஆயத்தம் வரும் வரையில் ஆசிரியர்கள் காத்திருக்க வேண்டியது மில்லை. சில முற்பயிற்சிகளால் இதனை விரைவில் சிறுவர்களிடம் உண்டாக்குதல் இயலும்.
3182,சிலநாட்டச் சோதனைகளால் சிறுவர்கள் எப்பாடங்களுக்குப் பொருத்தம் என்பதைக் கண்டறியலாம்.
3183,மேலே கூறிய மூன்று விதிகளும் தார்ன் டைக் கண்ட முதல்நிலை விதிகள் ஆகும்.
3184,இவற்றுடன் சேர்த்துப் பயில வேண்டிய ஐந்து துணைநிலை விதிகள் உள்ளன.
3185,அவற்றை உளவியல் நூல்களில் கண்டு கொள்க.
3186,இதற்குப் பிறகு மீண்டும் முன்னேற்றம் ஏற்படுகின்றது.
3187,இந்த முன்னேற்றமில்லாத காலப் பகுதி கற்றலில் தேக்கம் என வழங்கப் பெறு கின்றன.
3188,இந் தேக்கம் ஏற்படுவதற்குப் பல காரணங்கள் உள்ளன.
3189,"சிறிய சிறிய பகுதிகளைக் கையாண்டால், சில பாடங் களில் நல்ல தேர்ச்சி பெறலாம்."
3190,அடிப்படைப் பழக்கங்களில் தேர்ச்சி பெற்ற பிறகு சிக்கலான பழக்கத்தை அடைய முயன்றால் கற்றல் விரைவாகப் போகும்.
3191,சில சமயம் பழைய பழக்கங்களுக்கும் புதிய பழக்கங் களுக்கும் முரண் ஏற்பட்டுத் தேக்கம் உண்டாகலாம்.
3192,கற்றலில் உண்டாகும் அலுப்பும் களைப்பும் தேக்கதிற்குக் காரண மாகலாம்.
3193,பின்னால் விரைந்து கற்பதற்கு இஃது அடிப்படை என்பதை ஆசிரியர்கள் உணரவேண்டும.
3194,மேலும் சிலவற்றை ஈண்டு காண்போம்.
3195,ஒட்டுமை இரண்டு செயல்கள் ஒன்றாகவோ அடுத்த டுத்தோ நிகழ்ந்தால் அவை இயைபினால் இணைக்கப்பெறும்.
3196,கற்றலுக்கு இத் தொடர்பு இன்றியமையாதது.
3197,செயலுக்கும் அதன் விளைவிற்கும் கால இடையீடு அதிகரித்தால் கற்றல் அரிதாகும்.
3198,"எடுத்துக்காட்டாக மலேரியா என்ற குளிர்க் காய்ச்சலுக்கும், மஞ்சட்காய்ச்சலுக்கும் கொசுவே காரணம் என்பதை இரு பதாவது நூற்றாண்டின் தொடக்கத்தில்தான் கண்டனர்."
3199,அதுவரை மக்கள் கொசுவால் கடியுண்டதை அறியாமல் இல்லை.
3200,சிலகாலம் கழிந்தபிறகே அந்நோய்கள் அவர்களைத் தாக்கின.
3201,ஆராய்வு இஃதென்ன?
3202,என்று தொடர்ந்து கேட்கும் இயல்பும் விடுப்பு கற்றலுக்கு அவசியம்.
3203,"ஒரு குழந்தை தன் திறன் குறைந்த, துன்பம் நிறைந்த முறைகளாலும் ஒரு பொருளை ஆராயலாம்."
3204,ஸஎடு விளக்கு சுடும் என்று குழந்தை அறிவது.
3205,முதியோர்மூலம் அதிகத் தீங்கு நேரிடாதவாறும் அதனைக் கற்கலாம்.
3206,ஸஎடு வோல்ட்டு அபாயம் என்று செந்நிற அறிவிப்புப் பலகையால் மின்சாரத்தின் அபாயத்தை அறிதல்.
3207,ஒவ்வொருவரும் அதைத் தொட்டுப் பார்த்துத்தான் அறிய வேண்டுமென்ப தில்லை.
3208,நோக்கமுடைமை நோக்கமுடைமையும் கற்றலுக்கு இன்றியமையாத ஏது.
3209,இதனை முன்னரே விரிவாகக் கூறியுள்ளோம்.
3210,பிறர் தூண்டுதலின்றி மாணாக்கரே விரும்பியெடுக்கும் பாடங்களில் அதிக மதிப்பெண்கள் பெறுவதி லிருந்து இஃது ஓரளவு விளக்கமுறும்.
3211,ஊக்குநிலையில் உறைப்பு ஊக்குநிலையும் கற்றலுக்குச் சிறந்த நிலைமையாகும்.
3212,"பெரும்பாலும் கற்பித்தலுக்கிடையே ஆசிரியர் கூறும் காதல்,மனவசியநிலைபோன்ற செய்திகளை மாணாக்கர்கள் மறப்பதே இல்லை."
3213,செயலாற்றுதல் கற்போன் கற்கும் பொருளோடு செயலாற்றுதலும் கற்பதற்கு இன்றியமையாத நிலையாகும்.
3214,"நீந்துதல், இசை, தட்டச்சுப் பொறியினை இயக்குதல், குடும்பப் பொருளாதாரம், நூல் நூற்றல் போன்ற வற்றைச் சொற்பொழிவுகளால் கற்கமுடியாது."
3215,இவற்றைச் செயலாற்றிக் கற்றல் மிகவும் அடிப்படையானது.
3216,இன்றைய அடிப்படைக் கல்வித்திட்டம் இதனை அடிப்படையாகக் கொண்டது.
3217,அணிமைக் காலத்தியவை அண்மையில் நிகழ்ந்தவை நீண்ட நாட் களுக்கு முன்னர் நிகழ்ந்தவற்றைவிட மனத்திற்குத் தெளிவாக இருப்பவை.
3218,"ஆனால், உள்ளக்கிளர்ச்சிபற்றிய செயல்களைப் பொறுத்தவரை இது சரியாக இராது."
3219,முதன்மையானவை தொடர்பாக பெற்றவைகளில் முதலில் நடை பெற்ற செயல்களும் முதல் அனுபவங்களும் மனத்தில் நன்கு பதிகின்றன.
3220,"முதல் தேதி, பள்ளியில் முதல்நாள், மற்போரின் முதல்நாள் முதலியவை நன்கு நினைவில் இருப்பவை."
3221,கற்றலுக்கு இதுவும் ஒரு முக்கிய நிலை யாகும்.
3222,மேற்கூறிய நிலைமைகள் ஒவ்வொன்றும் கற்றலில் தனித் தனியாக அதிகப் பயன் தருவதில்லை.
3223,கற்றலில் இவற்றுள் சிலவோ பலவோ ஒரே சமயத்தில் பங்கு பெறும்.
3224,செயல்திட்டமும் செய்து ஈற்றலும் ஒவ்வொரு குழந்தையும் செயல் அடிப்படைத் தேவையாக விழை கின்றது என்பதற்கு ஏராளமான சான்றுகள் உள்ளன.
3225,"இச்செயல் விடுப்பு, உடலியக்கங்கள், தேடி ஆராய்தல், விளையாட்டுக்கள், புதிர் தீர்த்தல் என்ற வடிவங்களில் பரிணமிக்கின்றன."
3226,எல்லாத் தேவைகளிலும் செயலைப் போல் நேரடியாகக் கற்றலில் ஊக்குநிலையாகப் பயன்படுத்தும் தேவை யொன்றும் இல்லையென்றே சொல்லிவிடலாம்.
3227,பழையமுறைக் கல்வியில் இத்தேவை நிறைவேற்றப்பெறு வதே இல்லை நிறைவேற்றப்பட வாய்ப்பும் இல்லை.
3228,அதில் ஆசிரியருக்கும் பாடப் புத்தகத்திற்கும் முக்கியத்துவம் கிடைத் திருந்தது.
3229,மாணாக்கர்கள் செயலற்று வாளா இருக்கவேண்டிய நிலைதான் நிலவிற்று.
3230,"ஆகவே, மாணாக்கர்களிடம் ஈர்ப்புக்கள் உண்டாகின்றன."
3231,வகுப்பு முடிந்ததும் மாணாக்கர் வெளி வருங்கால் ஓட்டத்துடனும் உரத்த குரலுடனும் இவ் வீர்ப்புக் கள் வெளிப்படுவதைக் காணலாம்.
3232,ஒரு குறுகிய காலத்திற்குள் வெளிப்படும் ஆற்றல் மிகப் பெரிய அளவினது!
3233,"ஆனால், கற்றல் செயல்கள் தேவைகளுக்கேற்றவாறு தொடர்புகொண்டிருப்பின் இந்த ஆற்றலின் பெரும் பகுதியை வகுப்பறைகளில் ஆக்க முறைகளில் திருப்பிவிடலாம்."
3234,புதியமுறைக் கல்வியில் குழந்தைக்கும் வாழ்க்கை நிகழ்ச்சி கட்கும் முக்கியத்துவம் கிடைத்திருக்கின்றது.
3235,செய்கைத் திட்டமும் செயல் முறை யும் கிடைத்திருக்கின்றது.
3236,அது உளவியலை அடிப்படையாகக் கொண்டது.
3237,"கவர்ச்சி, நோக்கமுடைமை, வாழ்க்கைத் தொடர்பு போன்றவற்றைப் புதிய முறைக் கல்வி வற்புறுத்துகின்றது."
3238,செயல் முறைப்பள்ளியில் மாணாக்கர்கள் பொருள்களை ஏட்டுப்பாட மாகப் பயில்வதில்லை.
3239,"அங்குப் பொருள்களைக் கையாளுவதாலும், இயற்று தலாலும் நேரான அனுபவத்தைப் பெறுகின்றனர்."
3240,"பள்ளி, குழவிகள் கூடித் தங்கள் செயல்களைத் திட்டமிட்டு அவற்றை இயற்றும் இடமாகத் திகழ் கின்றது."
3241,"அங்கு அவர்கள் இயற்கையாகச் செயலாற்றுவதற்கும், அச் செயல் களின் பலனைக் காண்பதற்கும் அதிக வாய்ப்புக்கள் அளிக்கப் பெறுகின்றன."
3242,"சுருங்கக்கூறின், பள்ளி ஓர் ஆய்வுக் கூடமாகின்றது."
3243,குழந்தைகள் அங்குப் பல்வேறு செயல்களில் ஈடுபடுகின்றனர் ஒவ்வொருவரும் தத்தம் திறனுக் கேற்றவாறு தம் பங்குக்குரிய செயல்களைப் புரிகின்றனர்.
3244,ஜான் ட்யூயி என்பவர்தான் செய்தல் மூலம்கற்றல் என்ற கொள்கைக்கு முதன் முதலில் வித்திட்டவர்.
3245,பிற்கால வாழ்க்கையைக் குழந்தை ஓரளவு பள்ளியிலேயே கண்டுகொள்ள வேண்டுமென்பது இவர் கொள்கை.
3246,"பள்ளிநடைமுறை, கல்வி ஏற்பாடு, பாடத்திட்டங்கள் ஆகியவை யாவும் குழந்தையை நடுவாகவைத்தே அமைக்கப் பெறுகின்றன."
3247,நல்ல செயல் திட்டங்கள் பரம்பரைப் பள்ளியின் பாடப் பகுதியை நீக்கவோ ஒழிக்கவோ முயலுவதில்லை.
3248,இவர் கண்ட கல்விமுறை தன்னோக்க முயற்சி முறை என்று வழங்குகிறது.
3249,கில்பாட்ரிக் நான்கு விதமான திட்டங்களைக் கூறுகிறார்.
