Line Number,Sentence
823,இல் ஸ்ரீவைகுண்டம் அணைக்கட்டுக்கு அருகில் நீர் மட்டம் இருபதரை அடி வரை உயர்ந்து கடுஞ்சேதம் விளைத்தது.
824,மலைமீது அணைகள் ஏற்பட்ட பின்பு வெள்ளக் கொடுமை குறைந்துவிட்டது.
825,கரைகள் அணைக்கட்டுகள் கட்டப்பட்டிருக்கும் பல இடங்களில் நல்ல கரைகள் போடப்பட்டுள்ளன.
826,காலப் போக்கில் ஆற்றின் கழிமுகப்பகுதி அதிகரித்துக் கொண்டே வந்திருக்கிறது.
827,கடற்கரையை அடையும் போது ஆற்று நீர் வளைந்து வளைந்து செல்லும் உப்பங்கழிகள் மூலம் செல்லுகிறது.
828,புன்னைக் காயலில் உள்ள இரு முகத்துவாரங்களில் ஒன்று எப்பொழுதும் திறந்திருக்கம் மற்றொன்று சில மாதங்களில் மூடியிருக்கும்.
829,பெயர்க் காரணம் இதன் பழைய பெயர் பொருநை என்பது.
830,அப்பெயர் காலப் போக்கில் வழக்கிழந்தது.
831,இன்று இது தாம்பிர பரணி என்று வழங்கப்படுகிறது.
832,சம்கிருதத்தில் தாம்ரா என்பதற்குச் செம்பு அல்லது சிவப்பு என்பது பொருள்.
833,அச்சொல்லின் மறுபாதி பர்ணா இலை அல்லது மரம் என்ற சொல்லுடன் தொடர்புபடுத்தப்பட்டிருக்கிறது.
834,"ஆதலின் செம்பு நிறமான ஆறு என்றோ, செவ்விலை ஆறு என்றோ இதற்குப் பொருள் கொள்ளலாம்."
835,இவற்றுள் முதற் சொல்லே பொருத்தமாகத் தோன்றுகிறது.
836,ஆனால் தாம்பிர பரணி மகாத்மியம் என்னும் நூலின் ஆசிரியர் கூற்றின்படி இரண்டாம் பெயரே மக்களிடை வழங்கிவருகிறது.
837,பார்வதி பரமசிவன் திருமணத்தின்போது எல்லாக் கடவுளருமே கயிலையிற் கூடினர்.
838,அதனால் வடதிசை தாழ்ந்து தென்திசை உயர்ந்தத.
839,அதனைச் சமப்படுத்த அகத்தியர் தெற்கே அனுப்பப்ட்டார்.
840,அவர் தம்முடன் தாமரைப் பூமாலை ஒன்றைக் கொண்டு சென்றார்.
841,அம்மாலை சிவந்து அழகிய பெண்ணாக மாறியது.
842,"அப்பொழுது அகத்தியர் ஒரு விமானத்தில் ஆற்றுடனே சென்று, அதன் வழியில் தூய பல மண்டபங்களையும் நீராடு துறைகளையும் அமைத்தார்."
843,இவ்யாற்று நீரில் தாமிரம் கரந்திருக்கிறது.
844,"இதன் நீரை அலுமினியப் பாத்திரத்தில் எடுத்துச் சில நாட்கள் வைத்திருந்த பின், நீரின் அடியில் தாமிரம் படிந்திருப்பதைக் காணலாம்."
845,"இங்ஙனம் தாமிரம் கலந்துள்ள காரணத்தால் இவ்யாறு தாமிரபரணி எனப் பெயர் பெற்றது, என்று அறிஞர் அறைகின்றனர்."
846,பெரிய பொதிகைத் தெற்கேயுள்ள நாகபொதிகை என்றழைக்கப்படும் மலையில் பாம்பாறு தோன்றுகிறது.
847,"பாம்பாறும், சேர்வையாறும் பிறவும் பருவக் காற்றுகளின் மழையினால் தோன்றும் சிறப்பு ஆறுகள் ஆகும்."
848,சமவெளியில் துணையாறுகள் சமவெளியில் பொருநையிற் கலக்கும் முக்கியமான முதல் ஆறு மணிமுத்தாறு என்பது.
849,இது செங்கல் தேரியின் மேற்பாகத்தில் ஆழ்ந்த சோலை ஒன்றில் தோன்றுகிறது.
850,"இதனுடன் வறட்டாறு, குசன்குழியாறு என்பன சேருகின்றன."
851,கருமந்தி அம்மன் அணையிலிருந்து வெளியேறும் கீழ் மணிமுத்தாற்றில் தேவைக்கு மேற்பட்ட நீர் குசன் குழியாற்றிற் சேருகின்றது.
852,மலையடிவாரத்திலுள்ள மணிமுத்தாற்று அணைக்கட்டிலிருந்து தண்ணீரைக் கொண்டு செல்லும் பெருங்கால் என்னும் கால்வாயே சிங்கம்பட்டி ஜமீந்தாரிக்கு உயிர் நாடியாக இருக்கின்றது.
853,"கல்லிடைக்குறிச்சிக்கு இரண்டுகல் மேற்கே, கன்னடியன் அணைக்கட்டுக்கு மேற்கே குசன்குழியாறு பொருநையுடன் சேருகிறது."
854,குசன்குழியாறு சமவெளியை அடைவதற்குச் சிறிது தொலைவிற்குமுன்பு அருவியாக விழுகிறது.
855,இராம நதி என்பது.
856,மேலக் கடையத்தைச் சார்ந்த மலைப் பகுதியில் தோற்ற மெடுக்கிறது.
857,இவ்விரண்டு யாறுகளும் இரவண சமுத்திரம் என்னும் இடத்திற்க அருகில் கலக்கின்றன.
858,இங்ஙனம் இரண்டும் ஒன்றான புதியயாறு வராக நதி என்ற பெயருடன் பாய்கிறது.
859,"ஜம்பு நதியில் மூன்றும், .இராம நதியில் ஒன்றும், வராக நதியில் இரண்டுமாக அணைக்கட்டுகள் அமைந்துள்ளன."
860,கடனா நதி இது சிவசயிலத்திற்கு மேற்கேயுள்ள குன்றுகளில் தோன்றுவது.
861,இத்துணையாற்றில் ஆறு அணைக் கட்டுகள் உள்ளன.
862,பின்பு சிற்றாறு என்னும் பெயருடன் கிழக்கு நோக்கிப் பாய்கிறது.
863,குற்றாலத்திற்கு வடக்கேயுள்ள சொக்கம்பட்டி மலைகளி லிருந்து கறுப்பாறு என்பது தோன்றித் தென்கிழக்கிற் பாய்கிறது.
864,பம்புலி என்னும் இடத்திற்கு மேற்பாலுள்ள மலைகளில் தோன்றும் அநுமான் நதி என்பது தென் கிழக்காகப் பாய்கிறது.
865,இவ்யாற்றில் முன் சொல்லப் பெற்ற கறுப்பாறு கலக்கின்றது.
866,"இங்ஙனம் நீர்ப்பெருக்கம் மிகுந்த அநுமான் நதி, வீரகோளம் புதூர் என்னும் இடத்தில் சிற்றாறிற் கலந்து மறைகிறத."
867,"இவ்வாறு நீர் வளம் கொண்ட சிற்றாறு தென்காசி, திருநெல்வேலி தாலூக்காககளிற் பாய்கிறது."
868,சங்கர நயினார் கோவில் தாலூகாவில் உள்ள கழுகுமலைக் கருகில் சிற்றாறு ஒன்று தோன்றித் தெற்கு நோக்கி வருகிறது.
869,இதன் பெயர் உப்போடை என்பது.
870,இது கலப்புண்ட பின்னர்ச் சிற்றாறு தெற்கு நோக்கிப் பாய்ந்து சீவலப்பேரி என்னும் இடத்திற் பொருநையாற்றிற் கலக்கின்றது.
871,சிற்றாற்றின் நீளம் நாற்பது கல்.
872,இதனில் பதினெட்டு அணைக்கட்டுகள் அமைந்துள்ளன.
873,இவ்யாற்றின் நீர் ஏறத்தாழ முப்பதாயிரம் ஏக்கர் நிலம் பயிராக உதவுகின்றது.
874,"ஆற்று நீரும், கால்வாய் நீரும், குளத்து நீரும் நீர்ப்பாசனத்துக்கு நன்கு பயன்படுத்தப் படுகின்றன."
875,.
876,அணைக் கட்டுகள் காவிரியும் பொருநையும் தென்மேற்குப் பருவக் காற்றுப் பயனை அடையும் சிறப்பு ஆறுகளாகும்.
877,", , ., இதன் பாய்ச்சலைப் பெறும் நிலங்களில் பெரும்பாலும் ஆண்டின் இருபோகம் விளைகின்றது."
878,"கோடகன், கன்னடியன், பாளையன் கால்வாய்களுக்கு அருகில் உள்ள இடங்களில் ஏக்கருக்கு இரண்டு டன்னுக்கும் மேலாகவே நெல் விளைகின்றது."
879,"நிலத்தின் அடிமண், ஈரத்தையும் உரச் சத்தையும் நன்கு பாதுகாத்து நல்ல விளைச்சல் இருக்கும்படி செய்கிறது."
880,அணைக்கட்டுகள் பொருநையாற்றில் எட்டு அணைக்கட்டுகள் இருக் கின்றன.
881,ஸ்ரீவைகுண்டத்திலுள்ள எட்டாம் அணைக்கட்டைத் தவிர மற்றவை பழமையானவை.
882,அவை எப்பொழுது யாரால் கட்டப்பட்டன என்பதுபற்றித் திட்டமாக நமக்கு ஒன்றும் தெரியவில்லை.
883,இந்த அணைக்கட்டுகளிலிருந்து கால்வாய்கள் வழியாக அல்லது குளங்கள் வழியாகத் தண்ணீர் வயல்களுக்குக் கொண்டு செல்லப்படுகிறது.
884,"சில குளங்கள், ஒரு முறை நீர் நிரம்பிவிட்டால் விளைச்சலுக்கு வேண்டும் அளவு தண்ணீர் வழங்கத் தக்கனவாய் இருக்கின்றன."
885,கோடைமேலழகியான் அணைக்கட்டு இது பழைய காலத்து அணைக்கட்டு.
886,பாபநாசம் குன்றுகளிலிருந்து இறங்கும் பொருநையாறு குறுகிய இடுக்கு வழியில் செல்கிறத.
887,வழியில் குன்றுகளிலிருந்து விழுந்த பாறைகள் அதன் போக்கைத் தடுக்கின்றன.
888,அங்ஙனம் அவை தடுக்கும் இடத்தின் ஒரு கோடியிலுள்ள நீண்ட பாறைத் தொடரே அணைக்கட்டாக உதவுகிறது.
889,அப்பாறையில் துளைகள் உண்டாக்கப்பட்டுக் கால்பாய்கள் வழியே நீர் கொண்டு செல்லப்படுகிறது.
890,நதியுண்ணி அணைக்கட்டு இஃது அம்பாசமுத்திரத்திற்குச் சிறிது மேற்கே அமைந் துள்ளது.
891,"இது பாறை மீது கட்டப்பட்டுள்ளது, இவ்வணையி லிருந்து ஒரு கால்வாய் பிரிகிறது."
892,கன்னடியன் அணைக்கட்டு மணிமுத்தாறு பொருநையுடன் சேருமிடத்தை அடுத்து இவ்வணைக்கட்டு அமைந்துள்ளது.
893,ஹார்லி என்னும் துரைமகனார் இல் இதனைத் திருத்தி அமைத்தார்.
894,பின்னரும் இது நன்கு பழுது பார்க்கப்பட்டது.
895,ஆற்றின் தென்கரையில் இவ்வணையிலிருந்து ஒரு கால்வாய் பிரிகிறது.
896,இந்த அணைக்கட்டுத் தோன்றியது குறித்து ஒரு கதை கூறப் படுகிறது.
897,பசு சென்ற நெறியே கால்வாய் வெட்டப்பட்டது.
898,அது படுத்த இடத்தில் குளம் கட்டப்பட்டது.
899,"அவ்வணை ,ஆம் நூற்றாண்டுகளுக்கு இடையில் கட்டப்பட்டிருக்கலாம் என்று கால்டுவெல் பாதிரியார் கருதுகின்றார்."
900,"அரியநாயகபுரம் அணைக்கட்டு இவ்வணை, கன்னடியன் அணைக்கு ஆறுகல் தொலைவில் உள்ள அரியநாயகபுரத்தில் கட்டப்பட்டுள்ளது."
901,நாயக்கர் அரசியல் தளவாயாக இருந்த அரியநாத முதலியாரால் இது கட்டப்பட்டது.
902,ஆதலின் இப்பெயர் பெற்றது என்று அறிஞர் அறைகின்றனர்.
903,ஆற்றின் வலப்பக்கத்தில் கோடகன் கால்வாய்க்கு இவ்வணையிலிருந்து நீர் செல்லுகிறது.
904,இதுகாறும் கூறப்பெற்ற நான்கு அணைக்கட்டுகளும் அம்பாசமுத்திரம் தாலூகாவில் அமைந்திருப்பவையாகும்.
905,பழவூர் அணைக்கட்டு இது திருநெல்வேலித் தாலூகாவில் உள்ளது.
906,இங்குப் பொருநையாற்றின் வலக்கரையிலிருந்து பாளையன் கால்வாய் புறப்படுகின்றது.
907,இக்கால்வாய் கல் நீளம் உள்ளது.
908,இக் கால்வாய்க்கு நீர் வழங்க இவ்வணைக்கட்டு உதவுகிறது.
909,"பச்சையாறு, இக்கால்வாய் வெட்டப்பட்ட பின்பு இதனிற்றான் கருவை என்னுமிடத்தில் கலக்கின்றது."
910,சுத்தமல்லி அணைக்கட்டு இதுவும் திருநெல்வேலித் தாலூகாவில் உள்ளது.
911,இங்கு ஆற்றின் இடக்கரையில் பதினேழு கல் நீளமுள்ள திருநெல்வேலிக் கால்வாய் இவ்வணையிலிருந்து செல்கிறது.
912,"இந்த அணை ஆற்றின் குறுக்கே மிகச் சாய்வாகக் கட்டப்பட்டிருப்பதால், ஆற்றின் அகலத்தைவிட இதன் அகலம் நான்கு மடங்கு மிகுந்திருக்கிறது."
913,மருதூர் அணைக்கட்டு இதுதான் பழைய அணைக்கட்டுகளில் மிகப் பெரியது.
914,இது முக்கால் கல் நீளத்தில் குதிரை லாட வடிவில் அமைந் துள்ளது.
915,இஃது இங்குள்ள மக்களால் படிப்படியாகச் செம்மைப்படுத்தப்பட்டு வந்திருக்கிறது.
916,இது இல் பழுது பார்க்கப்பட்டது.
917,"ஆற்றின் வலப்புறத்தில் கீழக்கால் என்னும் கால்வாய் வழியாகவும், இடப்புறத்தில் மேலக்கால் என்னும் கால்வாய் வழியாகவும் நீர்பாய இவ்வணை உதவுகிறது."
918,இவ்வணை முன் சொல்லப்பெற்ற அணைக்கட்டுகளைவிட மிகுதியான அளவில் நீர்ப்பாசனத்திற்கு உதவுகிறது.
919,ஸ்ரீவைகுண்டம் அணைக்கட்டு இஃது ஆங்கிலேயர் ஆட்சியின்பொழுது கட்டப்பட்டது.
920,"இவ்வணைக்கட்டு மூலம் பயிராகும் நிலத்தில் ஏறத்தாழ , ஏக்கர்."
921,மருதூர்க் கீழக்கால்வாய் மூலம் நிரமபும் குளங்களால் பயிராக்கப்பட்டு வந்தது.
922,"மேலும், ஆற்றிலிருந்து நேரடியாகக் கால்வாய்கள் மூலம் கொற்கைக் குளம், ஆற்றூர்க் குளம் முதலியவை நிரம்பிப் பாசனத்துக்குப் பயன்பட்டு வந்தன."
923,ஆனால் இவை ஒழுங்காக நன்முறையில் பயன்படவில்லை.
924,ஆதலின் இல் கேப்டன் ஹார்லி என்ற பொறியர் இதுபற்றி ஒரு திட்டம் கொண்டுவந்தார்.
925,அத்திட்டம் அரசாங்கத்தினரால் ஏற்கப்பட்டது.
926,"இல் சிப்பாய்க் கலகம் குறுக்கிடவே, இத்திட்டம் நின்றது."
927,"பக்கிள் என்பவர் இல் விவசாயிகளை ஊக்கப்படுத்தி, அவர்களிடமிருந்து , ரூபாய் வசூலித்தார்."
928,பாளையங்கோட்டையில் இருந்த பழைய கோட்டையிலிருந்து கற்கள் முதலியன அங்குக் கொண்டு செல்லப்பட்டன.
929,. லட்சம் ரூபாயில் முப்பத்து மூவாயிரம் ஏக்கர் நிலம் பயிர் செய்யப்படலாம் எனத் திட்டமிடப்பட்டது.
930,எதிர்பார்த்த வசதிகள் அமையாததால் இத்திட்டம் இல்தான் முடிக்கப்பட்டது.
931,இல் தூத்துக்குடிக்குக் குடிநீர் ஏற்பாடுகள் செய்து முடிக்கப்பட்டன.
932,இல் ஆற்றின் தென்பாகத்தில் அறுபதாயிரம் ரூபாய் செலவில் ஐந்து குளங்கள் அமைக்கப்பட்டன.
933,அணைக்கட்டு விபரம் இவ்வணையின் நீளம் அடி.
934,இது உச்சியில் அடி அகலமுள்ளது.
935,இப்பொழுதுள்ள பாலம் இல் கட்டி முடிக்கப்பட்டது.
936,அடிக்கடி அழிவு நேரிடுவதைத் தடுக்க ஆற்றின் கரைகள் வலுப்படுத்தப்பட்டுள்ளன.
937,"மேலும் குளங்கள் மிக்க அளவில் நீரைக்கொள்ள, உயர்ந்த கரைகளை எழுப்பி வசதிகள் செய்யப்பட்டுள்ளன."
938,ஆதலின் ஸ்ரீவைகுண்டம் அணைக்கட்டை மேலும் பெரிதாக்க முயற்சி செய்யப்பட்டது.
939,"அம்முயற்சியின் விளைவாக, நீர்ப் பாசன வசதி பெறும் நிலங்கள் மிகுதிப்பட்டன."
940,வெள்ளக் காலத்தில் பெருகும் நீரை வீணாகவிடாது தேக்கி வைத்து நன்கு பயன்படுத்துவதே அதன் நோக்கம்.
941,ஹார்லி துரைமகனார் முதன்முதல் இதற்குத் திட்டமிட்டார்.
942,"ஆயின், அவரது திட்டம் நடைமுறைக்குக் கொண்டு வரப்படவில்லை."
943,பக்கிள் என்ற அறிஞர் இல் இத்திட்டத்தைச் சில மாறுதல்களுடன் அரசினர் பார்வைக்குக் கொணர்ந்தார்.
944,இல் தண்ணீர்த் தட்டு ஏற்பட்டது.
945,ஆயினும் உருப்படியாக ஒன்றும் தொடங்கப்படவில்லை.
