Line Number,Sentence
1,செந்தமிழ்ச் சொற்பொருட் களஞ்சியம் கு முதல் ங வரை ஆசிரியர் முதுமுனைவர் இரா.
2,இளங்குமரனார் பதிப்பாசிரியர் முனைவர் பி.
3,தமிழகன் பதிப்பாளர் கோ.
4,இளவழகன் நூற்குறிப்பு செந்தமிழ் சொற்பொருட் களஞ்சியம் கு முதல் ங வரை ஆசிரியர் முதுமுனைவர் இரா.
5,இளங்குமரனார் பதிப்பாசிரியர் முனைவர் பி.
6,தமிழகன் பதிப்பாளர் கோ.
7,இளவழகன் முதல்பதிப்பு பக்கம் விலை தமிழ்மண் பதிப்பகம் எண்.
8,", சிங்காரவேலர் தெரு, தியாகராயர் நகர், சென்னை ."
9,".. , செல் தாள் . கி."
10,"மேப்லித்தோ, அளவு தெம்மி எழுத்து . புள்ளி, பக்கம் இயல்பு படிகள் கணினி நூலாக்கம் நல்லதம்பி, கோ."
11,சித்திரா அட்டை வடிவமைப்பு செல்வன் பா.
12,"அரி ஹரிஷ் அச்சு வெங்கடேசுவரா ஆப்செட், ஆயிரம் விளக்கு, சென்னை ."
13,வெங்கடாசலம் எனும் இயற்பெயருடைய இவர் முதுகலை இயந்திரப் பொறியாளர்.
14,இவ்வருந்தமிழ்க் களஞ்சியம் நான்காம் தொகுதி வெளிவருவதற்கு உதவிய குவைத்து கொடையாளர்களுக்கு நெஞ்சம் நிறைந்த நன்றி.
15,"இதனை, ஊன்றியும் விரும்பியும் கற்பார் தாமும் இவ்வாய்வு செய்ய வியலும் என்பதைத் தூண்ட வல்ல ஆய்வும் இது!"
16,"ஆதலால், படிப்பாளியைப் படைப்பாளி ஆக்கவல்லது என்பதை என் பட்டறிவுத் தெளிவாகக் கண்டு வருகிறேன்!"
17,"எளிமையாய் ஆழ்ந்த நுணுக்கங்களை ஓரளவு கற்றாரும், கொள்ள வழிகாட்டும் கைவிளக்கு அன்னது இது."
18,இராமசாமி அவர்களே ஆவர்.
19,"ஆதலால், அவர்களை நெஞ்சாரப் போற்றுவது என் தலைக்கடனாம்!"
20,தமிழகனார் அவர்களுக்கும் நெஞ்சார்ந்த நன்றியுடையேன்.
21,படிக்கராமு அவர்களுக்கும் பெருநன்றியும் வாழ்த்தும் உடையேன்.
22,செழியனார் அருந்தொண்டைப் பாராட்டி நன்றி பெரிதுடையேன்.
23,"பணி நிறைவுப்பயன், தமிழ் கூறு நல்லுலகப் பயன்பாடு ஆதல் வேண்டும் என்பது தானே!"
24,இல்லாக்கால் செய்த பணியால் ஆவதென்ன?
25,செய்யாமை ஒப்பது தானே!
26,இளவழகனார் வெளியீட்டுப் பொறுப்பை ஏற்றுக் கொண்டு செயற்கரிய செய்வார் பெரியர் என்பதை நிலைநாட்டியதைப் போற்றுவதன்றி என் சொல்வேன்?
27,களஞ்சியம் கணினிப்படுத்திய அளவில் நிறைவுறுமா?
28,"பத்துத் தொகுதிகளையும் ஒருமுறைக்கு மும்முறையாய் முழுதுற மெய்ப்புப் பார்த்தல், எளிமைப் பாடா?"
29,தமிழகனார்க்குப் பெருங்கடப்பாடு உடையேன் பதிப்புச் சுமையை ஏற்றமை என் சுமை ஏற்றமையாம்!
30,வாழிய நலனே!
31,வாழிய நலனே!
32,களஞ்சியம் இருக்கும் வீடு என்றால் வளமிக்க உழவர்வீடு என்பது பொருள்.
33,அவ்வாண்டு முழுமைக்கும் பயன்படும்.
34,அடுத்த ஆண்டு விளைவு குறைந்தாலும் களஞ்சியப் பொருள் கவலையின்றி வாழ உதவும்.
35,இந்தியப் பரப்பில் தமிழ் மொழியில் தான் முதன்முதல் கலைக் களஞ்சியம் உருவானது என்பது பெருமிதப்படத்தக்கதாம்.
36,இராமசாமி அவர்கள் தூண்டல் வழியாகத் துலங்கிய துலக்கமாகும்.
37,ஆதலால் படைப்பாளன் என்ற நிலையில் நெஞ்சார்ந்த நன்றியுடையேன்.
38,இன்ப அன்புடன் இரா.
39,தமிழின் வளம் இலக்கியங்களிலும் மக்கள் வழக்குகளிலும் நிறைந்துள்ளது.
40,"சொற்களின் வளமும், பெருக்கமும் மொழியின் சிறப்பைக் காட்டும்."
41,"சொற்களின் பெருக்கைக் காட்ட எத்தனையோ நிகண்டுகளும், அகராதிகளும், களஞ்சியங்களும் தமிழில் வந்துள்ளன."
42,இவற்றுள் பல பிறமொழிச் சொற்களையும் தமிழ்ச் சொற்களாய்க் கருதிப் பொருள் தந்துள்ளன.
43,பிற மொழிகளில் ஏறிய தமிழ்ச் சொற்களும் வேற்றாடை உடுத்தியுள்ளன.
44,இத்தமிழ்ச் சொற் களஞ்சியம் சொற்களின் பொருளை மட்டுமா தருகின்றன?
45,ஒரு வினைச் சொற்கள் தொகை தொகையாகிய தொகை இக்களஞ்சியம்.
46,இவற்றின் தொகுப்பு கற்பாரை வியக்க வைக்கும்!
47,"இக் களஞ்சியத் தொகுதிகளுள் நூற்றுக்கணக்கில் மரபுத் தொடர்கள், இணை மொழிகள், ஒலிக்குறிப்புகள், அவற்றின் விளக்கங்கள் அடங்கியுள்ளன."
48,சொற்கள் விளக்கத்திற்கு அன்றாடச் செய்திகளும் செய்தித்தாள்கள் சான்றாகின்றன.
49,சிற்றிலக்கிய வகைகள் தொண்ணூற்றாறு என்பர்.
50,"ஆனால், பற்பல நூறுவகைகள் உள்ளமையை இக்களஞ்சியம் காட்டும்."
51,மேனாட்டு உடைகளை மாட்டியதால் தமிழர் மேனாட்டார் ஆகாரன்றோ?
52,பஜ்ஜி ஏதோ பிறமொழி என்றே மயங்கி நிற்பர்.
53,அது பச்சைக் காய்கறிகளால் செய்யப்படுவது.
54,"புழுதி, பூழ்தி, பூதி."
55,பல சொற்களின் பொருள் வேறுபாடுகளும் காட்டப்பட்டுள்ளன விரைப்பு விரைப்பு விறைப்பு தொய்வின்மை இக்களஞ்சியம் தவசங்களாம் சொற்கள் கொட்டப்பட்டு நிறைந்துள்ளது.
56,படிப்பார் தத்தமக்குத் தேவையான தவசங்களை அள்ளி அள்ளிப் பயன் கொள்ளலாம்.
57,எவ்வளவு அள்ளினும் என்றும் குறையாது இக்களஞ்சியம்.
58,"ஐயா முதுமுனைவர், இளமை முதல் தொகுத்த சொற்களஞ்சியங்களைச் சேர்த்துச் சேர்மானமாக்கித் திரட்டித் தந்துள்ளார்கள்."
59,இங்கே வம்மின்!
60,களஞ்சியம் கொண்மின்!!
61,தமிழை வளர்மின்!!!
62,இளங்குமரனார் அவர்களால் உருவாக்கப்பட்ட ஒன்றாகும்.
63,"அகரமுதலிகளில் இடம்பெறாத சொற்கள், மரபுச்சொற்கள், வட்டார வழக்குச் சொற்கள், பழமொழிகள் போன்றவை இக்களஞ்சியத்தில் இடம்பெறுவது குறிப்பிடத்தக்க தாகும்."
64,"இசை, மருத்துவம், கல்வெட்டு, அறிவியல் ஆகிய துறைகள் சார்ந்த இன்றியமையாத சொற்களுக்கும் பொருள் விளக்கம் தரப்பட்டுள்ளது."
65,அயன் மொழிச் சொற்கள் அறவே தவிர்க்கப் பட்டிருப்பது நூலின் தனிச்சிறப்பாகும்.
66,சொற்பொருட் களஞ்சியப் பணியை நிறைவேற்றும் வகையில் நூலாசிரியருக்குத் தூண்டுதலாக அமைந்தது ஒல்காப் புகழ் தொல்காப்பியமே.
67,"குறிப்பாக, எல்லாச் சொல்லும் பொருள்குறித்தனவே தொல்."
68,என்னும் நூற்பா.
69,இந் நூற்பாவினை மூல முழக்கமாகக் கொண்டது தமிழ்மொழி என்பதை விளக்கும் பொருட்டே இக்களஞ்சியம் உருவாக்கப் பட்டதென நூலாசியிர் குறிப்பிட்டுள்ளார்.
70,பொருள் விளக்கங்களினூடே கீழ்க்காணும் தொல்காப்பிய நூற்பாக்களின் பயன்பாட்டினையும் உணரலாம்.
71,பொருண்மை தெரிதலும் சொன்மை தெரிதலும் சொல்லின் ஆகும் என்மனார் புலவர்.
72,தெரிபுவேறு நிலையலும் குறிப்பின் தோன்றலும் இருபாற் றென்ப பொருண்மை நிலையே.
73,பொருட்குப் பொருள்தெரியின் அதுவரம் பின்றே.
74,பொருட்குத் திரிபில்லை உணர்த்த வல்லின் தொல்.
75,மொழிப்பொருட் காரணம் விழிப்பத் தோன்றா.
76,ஒரு பொருள் பல சொற்கள் மிகவும் நுட்பமாய் ஆராயப் பட்டுத் தொகுக்கப்பட்டுள்ளன.
77,பெருமதிப்பிற்குரிய ஐயா இளங்குமரானாரின் நெடுங்கால அவா இந்நூல் வெளியீட்டின் வழி நிறைவேறியுள்ளமை மகிழ்வளிக்கிறது.
78,இது காலத்தை வென்றுநிற்கும் நிலைத்த பணி.
79,தமிழ் ஆய்வாளர்களுக்குக் கிட்டியுள்ள தலைசிறந்த நோக்கீட்டு நூல்.
80,உலகெங்கும் வாழும் தமிழ் உணர்வாளர்கள் இந்நூலினை வரவேற்றுப் போற்றுவார்கள் என்பதில் எள்ளளவும் ஐயமில்லை.
81,களஞ்சியப் பணி ஒரு தொடர் பணி.
82,இப்பத்துத் தொகுதிகளை அடித்தளமாகக் கொண்டு தொடர்ந்து நூற்றுக்கணக்கான தொகுதிகள் வெளிவந்து தமிழிற்கு வளம்சேர்க்க வேண்டும் என்பது என் அவா.
83,தனித்தமிழ்ப் பற்றாளராகவும் அரிய தமிழ் நூல்களின் பதிப்புச் செம்மலாகவும் விளங்கும் தமிழ்மண் பதிப்பக உரிமையாளர் திரு.
84,இளவழகனார் இக்களஞ்சியத்தை அருமுயற்சியுடன் சிறப்புற வெளிக்கொணர்ந்திருப்பது பாராட்டிற்குரியதாகும்.
85,முனைவர் க.
86,"அவர் அருகில் இருக்கவும், அவருடன் உரையாடவும், வாழ்நாளில் எனக்குக் கிடைத்த பெரும் பேறாகவும் கருதுகிறேன்."
87,"மொழிஞாயிறு பாவாணர், செந்தமிழ் அறிஞர் இலக்குவனார், மூதறிஞர் செம்மல் வ.சுப."
88,மாணிக்கனார் முதலான பெருமக்களை எட்டி இருந்து பார்த்தவன்.
89,அவர்களின் அறிவு நலன்களைக் படித்துச் சுவைத்தவன்.
90,இப் பெருமக்களின் மொத்த உருவமாக அய்யா இளங்குமரனாரைப் பார்த்து நெஞ்சம் நெகிழ்பவன்.
91,வியந்து போகிறேன்.
92,இச்செந்தமிழ்த் தொகுப்பு தமிழ் அகராதி வரலாற்றில் தமிழுக்குப் புது வரவாகும்.
93,இதுவரை யாரும் செய்ய முன்வராத பெரும்பணி யாகும்.
94,"அய்யாவின் இலக்கிய, இலக்கணப் பெரும்பரப்பைத் தாங்கிவரும் இப்பொற் குவியலை உலகத் தமிழர்களுக்கு வழங்குவதில் பெருமகிழ்ச்சி அடைகிறேன்."
95,என் வாழ்க்கையில் கிடைத்த பெரும் பேறாகக் கருதுகிறேன்.
96,அந்த மலரில் மலேசியப் பாவரசு சு.ஐ.உலகநாதன் எழுதிய பாடலினை கீழே சுட்டியுள்ளேன்.
97,இளவழகன் ஆசிரியர் விவரம் முதுமுனைவர் இரா.
98,இளங்குமரனார் பிறப்பு .
99,தமிழ்ச் சொற்பொருள் களஞ்சியம் நாடகம்.
100,குழந்தைப் பாடல்கள் ஆய்வுப் பொழிவு தொகுப்பு நூல்கள் நாளொன்றுக்கு மணிநேர எழுத்துப் பணி திருவள்ளுவர் தவச்சாலை நிறுவி இயக்குதல்.
101,செந்தமிழ்ச் சொற்பொருட் களஞ்சியம் ...
102,"திருமணம் நிகழ்த்துதல் தமிழகம், சிங்கப்பூர், மலேயாவில் க்கும் மேற்பட்ட தமிழ்நெறித் திருமணங்கள் நிகழ்த்துநர்."
103,பதிப்பாசிரியர் விவரம் முனைவர் பி.
104,தமிழகன் பிறப்பு .
105,வேங்கடசாமி நாட்டார் கல்லூரியில் பேராசிரியர் பணி தொடர்தல்.
106,"இளங்குமரனாரோடு இணைந்து தமிழ்மண் பதிப்பகம் வெளியிட்ட முதுமொழிக் களஞ்சியம், சங்க இலக்கியம்."
107,பதிப்பாளர் விவரம் கோ.
108,இளவழகன் பிறந்த நாள் .. பிறந்த ஊர் உறந்தைராயன்குடிக்காடு அஞ்சல் உரத்தநாடு வட்டம் தஞ்சாவூர் மாவட்டம்.
109,பிறந்த ஊராகிய உறந்தைராயன்குடிக்காட்டில் ஊர்நலன் வளர்ச்சிக் கழகம் எனும் சமூக அமைப்பில் இருந்து ஊர் நலப்பணி ஆற்றியவர்.
110,இளம் தலைமுறைக்குத் தமிழ்த் தொண்டாற்றியவர்.
111,பேரறிஞர் அண்ணாவின் மதுவிலக்குக் கொள்கையை நெஞ்சில் ஏந்தி உரத்தநாடு மதுவிலக்குக் குழுவின் முக்கிய அமைப்பாளர்களில் ஒருவராக இருந்து செயலாற்றியவர்.
112,இல் தமிழ்நாடு சட்ட மன்றத்தில் உரத்தநாடு திட்டம் என்று பாராட்டப் பெற்ற மதுவிலக்குத் திட்டம் வெற்றி பெற உழைத்தவர்.
113,"பொதுநிலை தனித்தமிழ் இயக்கத் தந்தை மறைமலையடிகள், தந்தை பெரியார், பாவேந்தர் பாரதிதாசன், பேரறிஞர் அண்ணா, மொழிநூல் மூதறிஞர் ஞா."
114,"தேவநேயப் பாவாணர், பாவலரேறு பெருஞ்சித்திரனார் ஆகியோரை வழிகாட்டிகளாகக் கொண்டு அவர்தம் கொள்கைகளை நிறைவேற்ற அயராது உழைத்து வருபவர்."
115,நூலாக்கத்திற்கு உதவியோர் ஆசிரியர் முதுமுனைவர் இரா.
116,இளங்குமரன் பதிப்பாசிரியர் முனைவர் பி.
117,தமிழகன் கணினி மற்றும் நூல்வடிவமைப்பு திரு.
118,நல்லதம்பி யாழினி கணினி திருமதி.
119,சித்திரா மேலட்டை வடிவமைப்பு செல்வன் பா.
120,அரி ஹரிஷ் திருத்தத்திற்கு உதவியோர் முனைவர் பி.
121,தமிழகன் நூலாக்கத்திற்கு உதவியோர் திரு இரா.
122,"பரமேசுவரன், திரு தனசேகரன், திரு கு."
123,"மருது, திரு வி."
124,"மதிமாறன் அச்சாக்கம் நூல் கட்டமைப்பு வெங்கடேசுவரா ஆப்செட் பிரிண்டர்சு, ஆயிரம் விளக்கு, சென்னை."
125,பொருளடக்கம் .
126,கு வரிசைச் சொற்கள் .
127,கூ .
128,கெ கே கை .
129,கே .
130,கை .
131,கொ .
132,கோ .
133,கெள .
134,ங கு முதல் ங வரை கு வரிசைச் சொற்கள் கு ககர உகரக் குறில்.
135,"குகரம் என்பதும் இது குஎன்பது குக்கு, குக்கூஎன ஒலிக்குறிப்புக்கு முன்வரலுண்டு."
136,குக்கிராமம் என்பது இருபிறப்பி.
137,கு த.
138,குக்குடம் என்பது உருண்டு திரண்ட கோழி இலக்கிய வழக்கு.
139,இவ்வழியால் குக்குடம் உருண்டைப் பொருள் கொண்டு கு என்பதே உலகம்எனப் பின்னாளில் வழக்கில் வந்தது.
140,நெட்டெழுத் தேழே ஓரெழுத் தொருமொழி என்னும் தொல்லோன் ஆணைக்கு மாறாக வந்த பின்வழக்கு இது.
141,"நொ, து காண்க குகரம் குகரம் கு கரம் குகரம்."
142,கரம் சாரியை குகரம் நான்காம் வேற்றுமை உருபு.
143,அது என் வேற்றுமை உயர்திணைத் தொகைவயின் அது என் உருபுகெடக் குகரம் வருமே தொல்.
144,"குகரம் குடவரை, மலைக்குகைவெ.வி.பே குகு குகு கூகைக்குரல்."
145,குக்குக் குகு குகு திருப்.கட.
146,குகை குழை குகை.
147,"நோ. குழை முகைவ.வர. குடை, புடை முதலியவும் உட்டுளைத்தல் பொருளில் மக்கள் வழக்கிலும் இலக்கிய வழக்கிலும் உள்ளமை எண்ணலாம்."
148,"எடு குடைவரை, புடைக்கிணறு."
149,இயற்கையால் பாறை அல்லது மலையில் குடைவு அமைதலும் செயற்கையால் கருவி கொண்டு குடைவு செய்தலும் எனக் குடைவு இருவகையாம்.
150,குகைச்சி நிலத்தை அகழ்ந்து மேலே மூடுபோட்டு உள்ளே உறையும் கறையான் சேர்த்து வைத்த புற்றாஞ்சோற்றைக் குகைச்சி என்கிறது வெ.வி.பே.
151,குடைந்த .இடத்துச் சேர்த்தலால் குகைச்சி எனக் குறித்தது.
152,குகை காண்க.
