Line Number,Sentence
356,அது நன்னன் புள்ளுநாடு எனவருவது.
357,இப் புள்ளுநாடு என்பது பூழிநாடாதல் வேண்டும் என்று கருதினோர்.
358,"இதனைப் பூழிநாடு என்றும், இவனும் அப்பூழி நாட்டை யாண்ட குறுநில மன்னன் என்றும் கூறுவாராயினர்."
359,"இராமசந்திர செட்டியார் ...., அவர்கள் அழகு பெற முடிபு செய்கின்றார்."
360,"ஆனால் இவ்வாராய்ச்சியின் கண், கொங்கு நாட்டின் பண்டைக்கால எல்லை முடிபு கூறப் பெறவில்லை."
361,"இனி, இவனது கொண்கான நாட்டின்கண் பாரம்பிரம்பு வியலூர் என்னும் ஊர்களும் பாழி, எழில் முதலிய மலைகளும் இருந்தன."
362,என ஆசிரியர் இடையன் சேந்தன் கொற்றனார் விரித் துரைத்த வதனால் விளங்குகின்றது.
363,இக்கொண்கானம் புலவர் பாடும் புகழுடையது.
364,"இந்நாடு கொண்கானம் என்னும் மலையைத் தன்னகத்தே யுடைமையான், இப்பெயர் பெற்றது."
365,அறுவைத் தூவிரி கடுப்பத்துவன்றி மீமிசைத் தண்பல் இழிதரும் அருவிகளை யுடையது.
366,மலைபடு பொருளான பொன்னை மிகவுடையது.
367,இது பொன்படு கொண்கான நன்னன் நன்னா டெனப் பாலை பாடிய பெருங்கடுங் கோவாலும்.
368,"இதன் அண்மையிலேயே பாழிச்சிலம்பும் பாழி யென்னும் நகரும், இருந்தன வாதலால், அவையும் மிஞிலியின் காவற்குள்ளிருப்ப வாயின."
369,பிரம்பென்பது நீர்வளம் மிக்க ஊர்போல் தோன்று கின்றது.
370,"மலைநாடாதல் பற்றிச் சிறு குன்றங்களில் வீழ்தரும் அருவிகளும், அருவிநீர் நிறைந்து ஆம்பல் முதலியன தழைத்த துறைகளையு முடையது."
371,"இதனை, அருவி யாம்பல் கலித்த முன்றுறை, நன்னன் ஆஅய் பிரம்பு என்றனர் ஆசிரியர் பரணர்."
372,இந்நகரத்துக்கு ஆஅய் பிரம்பு என்பதும் பெயர் போலும்.
373,வியலூர் என்பது பசலைக்கொடி படர்ந்த வேலி யுடையதென்றும்.
374,இது நன்னனுக்கு உரித்தென்றும் ஆசிரியர் மாமூலனார் கூறுகின்றார்.
375,அது நறவுமகி ழிருக்கை நன்னன் வேண்மான் வயலை வேலி வியலூர் அகம்.
376,என வருவதாகும்.
377,பாழி யென்பது பாழி மலையை யடுத்திருந்த சீரிய காவலமைந்த பேரூராகும்.
378,இவ்வூரில் யாழ்வல்லவர் பலர் வாழ்ந்தனர்.
379,இது தன் முறையியல் வழா அது ஆற்றிற் பெற்ற நகரம்.
380,"இங்கே, நன்னன் தான் ஈட்டிய பொருளை வேளிர் பலர் காப்ப வைத்திருந்தான்."
381,இப்பாழிச் சிலம்பில் கடவுளர் இருந்து காவல் புரிந்தனர் எங்கும் பெரிய அடை பொருந்திய தேன் தூங்கி நலம் பயக்கும்.
382,"இது, சூழி யானைச் சுடர்ப்பூண் நன்னன் பாழி யன்ன கடியுடை வியனகர் அ."
383,"எனவும், முறையியல் வழா அது ஆற்றிற் பெற்ற கறையடி யானை நன்னன் பாழி அ."
384,இந்நன்னனும் நன்னன் வேண்மான் என்று வழங்கப் பெறுதலும் உண்டு.
385,"அதனால், இந்நன்னன் சேய் நன்னன் என்பாரும் இந்தக் கொண்கான நன்னனது குடிப்பிறந்தாரே யென்று துணிய வேண்டும்."
386,"இனி, நன்னன், வேண்மான் என்று வழங்கப் பெறு தலால் இவன் வேளிருள் ஒருவன் என்று கொள்ளல் வேண்டும்."
387,வேளிர் என்பார் மலைய மாதவனால் வடநாட்டினின்றும் கொணரப் பெற்றவர் என்பது தொல்காப்பிய நச்சினார்க் கினியர் உரையால் தெரிகின்றது.
388,இவர்கள் முடியுடை வேந்தர்க்கு மகட்கொடை நேர்தற்கு உரிய வேளாளருமாவர்.
389,இவர்களுட் சிறந்த நன்னன் குணங்களா லுயர்ந்த வள்ளலாவான்.
390,என்று கூறுதலால் விளங்குகின்றது.
391,"அது இன்களி நறவின் இயல்தேர் நன்னன் எனவும், நறவுமகிழ் இருக்கை நன்னன் வேண்மான் எனவும் வருவனவற்றால் அறிக."
392,"இவன் காலத்தில், நாண்மங்கலம் என ஆசிரியர் ஐயனாரி தனாராற் கூறப்பெறும் பிறந்த நாட் கொண்டாட்டம் நிகழ்ந்தது."
393,இவ்வழக்கம் இந்நன்னன் காலத்தும் நடைபெற்றதென மதுரைக்காஞ்சி யென்னும் ஒரு சிறந்த பாட்டு கூறுகின்றது.
394,அது பேரிசை நன்னன் பெறும் பெயர் நன்னாள் சேரி விழவின் ஆர்ப்பெழுந்தாங்கு என வருவதாம்.
395,ஏனெனில் புலமிக்கவரைப் புலமை தெரிதல் புலமிக்கவர்க்கே புலனாம் என்பர் முன்றுறையரையர்.
396,அதனால் இவன் வழிவந்தோர்க்கும் பழியொன்று நிலைபெறுவதாயிற்று.
397,"அதனை யுண்ணல் வேண்டும் என்பது நன்னனது வேட்கை போலும், அன்றி அது அவனது பொழில் பயந்தது போலும்."
398,அக்காய் இங்ஙனம் யாது காரணத்தாலோ யாற்றில் வீழ்ந்துவர இப் பெண் உண்டற்குரியதாயிற்று.
399,"இதனை இவன் ஆராயாது அக்காயை அவளுண்டதை யறிந்து, அக்குற்றம் நோக்கி, அவளைக் கொலைசெய்யத் துணிந்தான்."
400,"கொடுப்பவும் கொள்ளானாய், ஆறாச் சினங்கொண்ட நன்னன் அப்பெண்ணைத் தான் கருதிய வண்ணம் கொலையே புரிந்தனன்."
401,இதன்கண் நன்னனது தீச்செயல் நினைவுறுத்தப் படுதல் காண்க.
402,"மேலும், இச்செயல் புலவர் பலர்க்கு வெறுப்பை இவன் மாட்டு உண்டாக்கினமையும் இதனாற் பெறப்படுகின்றது."
403,"இனி, இவனது போர்ச்செயல்களை யாராய்வாம்."
404,மேற் கூறிய செய்தியில் இவன் ஒருகால் கொண்ட வஞ்சினம்.
405,உய்த் துணர்வது சொல்லில்வழி யாதலின் அதனை விரியக் கூறுகின்றோம்.
406,இவன் அரசுரிமை யெய்திய காலத்து இவனது கொண்கான நாட்டின் புறத்தே சில குறுநில மன்னர்கள் ஆண்டு வந்தனர்.
407,அவர்களுள் பெரும்பாலார் முடியுடை வேந்தருட் சேர மன்னர் தம் ஆணை வழி நிற்போராவர்.
408,"அவருள் பிண்டன், அதிகன் என்போர் சிறந்தோராவர்."
409,இவருட் பிண்டன் என்பான் மிக்க மெய்வலி யுடையவன்.
410,இதுபற்றியே இவன் பரணரால் மொய்ம் மூசு பிண்டன் என சிறப்பிக்கக் படுகின்றான்.
411,அதிகன் என்பான் பாண்டியன் ஆணைவழி நிற்கும் குறுநில மன்னன்.
412,அதனால் இவன் அதிகன் பசும்பூட் பாண்டியன் என்றும் வழங்கப் பெற்றான்.
413,"இங்ஙன் ஒரு பேரரசன் பெயரே அவன் கீழாண்ட சிற்றரசரும், தண்டத் தலைவரும் பெற்றிருத்தல் கல்வெட்டாராய்வார்க்குப் புதுமை யாகாது."
414,இவனது நாடு புள்ளுநாடு என்று முன்னர்க் கூறினாம்.
415,இப்போர் வாகைப் பறந்தலை யென்னு மிடத்தில் நிகழ்ந்தது.
416,இவ்வெற்றி கேட்ட கொங்கர் மிக்க மகிழ்ச்சி கொண்டார்த்தனர்.
417,"என்றும், நன்னன் உதியன் அருங்கடிப் பாழித் தொன்முதிர் வேளிர் ஓம்பினர் வைத்த பொன். அகம்."
418,"என்றும், பரணர் ஒருவராலே பாடப்பெற்று வருவனவற்றால் அறியப் படுகின்றது."
419,"இனியும், நன்னன் வேறுபல குறுநில மன்னர்களை வென்று கவர்ந்து கொணர்ந்த பொருளைப் பரிசிலர்க்கு வழங்கினமை, முன்னரே கூறினாம்."
420,"இவன் காலத்தும், அதற்குச் சிறிது முன்னும் வடநாட்டி னின்றும் நம்நாடு போந்து துளுநாட்டினையும், செல்லூர்."
421,"இதனை ஆசிரியர் பரணர், நன்னன் நறுமா கொன்று நாட்டிற் போக்கிய ஒன்றுமொழிக் கோசர்."
422,எனக் குறுந்தொகை யின்கட் கூறுகின்றார்.
423,இங்ஙனம் செல்லுமிடமெல்லாம் தன் வென்றியே விளங்கச் செய்த நன்னனுக்குத் தோழராகச் சில குறுநில மன்னர் இருந்தனர்.
424,"அவர் ஏற்றை, அத்தி, கங்கண், கட்டி, புன்றுறை முதலியோராவர்."
425,இவர்கள் ஒருங்கு கூடிக் கழுமலத்தில் அக்காலத்துவிளங்கிய சோழன் பெரும்பூட் சென்னியை அவனது நகரருகே எதிர்த்தனர்.
426,"இவருள் ஏற்றை, அத்தி, கங்கன் புன்றுரை ஆகிய இவர்கள் புலவர் கூறும் பேறு பெற்றிலர்."
427,இங்குக் கூறிய கணையன் என்பானும் கட்டிபோலச் சிறந்த வீரமுடைய வனல்லன்.
428,"இவற்றால், போர்வலிமிக்க நன்னன் அஃதில்லாத ஏனை ஏற்றை முதலானோரோடு கூடிப் பொறாது தோற்ற செய்தியைக் குடவாயிற் கீரத்தனார்."
429,"இனி, இவனது வெற்றிக்கெல்லாம் சிறந்த காரணமாக விளங்கிய தானைத் தலைவன் மிஞிலி யென்பவன்."
430,"அவன் நன்னனது பாழி, பாரம் முதலிய நகரங்களை நலம்பெற ஆட்சி செய்து வந்தான்."
431,நன்னனது வரலாற்றின் பிற்பகுதிக்கு இம் மிஞிலியின் வரலாறு இன்றிமையாமையி னீண்டுக் கூறுகின்றோம்.
432,பகுதி .
433,எனவரும் பரணர் பாட்டுக் கூறுகின்றது.
434,"இகலடு கற்பின் மிஞிலி எனக் கூறப்படுதலை நோக்க இவன் வீரமேயன்றி, வீரமுடைமைக் கேற்ற கல்வியும் வல்லனா யிருந்தமை புலனாகின்றது."
435,இவ்வீரனை மகனாகப் பெற்ற பெரியோன் அன்னி யெனப்படு வானாவன்.
436,"இது நோக்கியே, மிஞிலியும் அன்னிமிஞிலி யெனவும் கூறப்படு வானாயினன்."
437,"அது கொடுங்குழை அன்னிமிஞிலியின் இயலும் எனவும், அன்னி மிஞிலி போல எனவும் ஆசிரியர் பரணரே கூறுமாற்றால் உணரப்படும்."
438,அன்னியென்பான் சோழ நாட்டில் வாழ்ந்த ஒரு சிறந்த வீரனாவான்.
439,அன்னிகுடி யென்னும் ஊர் ஒன்று தஞ்சை சில்லாவில் இருக்கின்றது.
440,அதுவே இவன் வாழ்ந்த வூராதல் கூடும் என்றும் சிலர் முடிபு செய்கின்றனர்.
441,திதியன் என்பான் மிக்க செல்வ முடையவன்.
442,மேலும் இவனுக்குப் பொதியில் மலை உரியதாயிருந்தது.
443,எனவரும் பரணர் பாடலால் பெறப்படுகின்றது.
444,என மதுரை நக்கீரராலும் கூறப்படுதலால் அறியப் படுவனவாம்.
445,"இவனது நாடு மிழலைக் கூற்றம், முத்தூற்று முதலியவாம்."
446,இவனது சிறப்புப் பின்னர்ப் பரணர் இவன்மீது பாடிய பாடலை ஆராயுங் காலத்துக் கூறப்படும்.
447,கூறினும் என்!
448,அன்னி அடங்கானாய் அப்புன்னையைத் தடிந்து வீழ்த்தினன்.
449,இவனது புன்னையின் வீழ்வு பல புலவர் பெருமக்களாலும் எடுத்துக் கூறப்பெற்றுள்ளது.
450,"எனவும், அன்னியும் பெரியன் அவனும் விழுமிய இருபெரு வேந்தர் பொருகளத் தொழித்த புன்னை விழுமம் நற்."
451,எனவும் வருவனவற்றால் உணரப்படுகின்றது.
452,அவர்கள் அவனை வென்று இவனுடைய கண்களையும் களைந்தனர்.
453,இக்கோசர் திதியனது நாளவையிலும் படையிலும் இருந்து அவற்குப் பெரும்புகழ் தந்தோராவர்.
454,"இவ்வாறு, தந்தையின் கண்களைக் கோசர் களைந்து திதியனுக்குப் புகழ்விளைத்துக் கொடுத்தனர் என்ற செய்தி மிஞிலியின் செவிக் கெட்டியது."
455,எனவும் வருவனவற்றால் காண்க.
456,"நிற்க, வெளியம் என்னும் ஊரில் வேளிர் மரபில் ஆய் எயினன் என்பா னொரு வீரன், சேரனது படைத்தலைவனாக விளங்கினன்."
457,"சுருங்கக்கூறின், இவனது பகைக்கஞ்சி அகுதை யென்னும் வீரனொருவன் அடங்கிக் கிடந்தான் என்பதே சாலுவதாம்."
458,இந்த ஆஅய்எயினன் களங்காய்க் கண்ணி நார்முடிச் சேரல் என்னும் சேரவேந்தன் ஒருவனது படைத்தலைவனாயினன்.
459,இவன் மனைவி சிறந்த கற்புமேம்பாடுடையள்.
460,அவள் வண்டுபட ஒளிர்ந்த கூந்தல் அறஞ்சால் கற்பின் குழைக்கு விளக்காகிய ஒண்ணுதல் பொன்னின் இழைக்கு விளக்காகிய அவ்வாங்கு உந்தி.
461,விசும்பு வழங்கு மகளி ருள்ளும் சிறந்த செம்மீன் அனையள் நின் தொன்னகர்ச் செல்வி எனப் புகழப் பெறுகின்றாள்.
462,இவனுக்கும் நன்னனுக்கும் யாது காரணத்தாலோ பகைமை யுண்டாகி யிருந்தது.
463,"அதனால் இவனது படைத்தலைவனான ஆஅய்எயினன், நன்னன் படைத் தலைவனான மிஞிலியோடு பொரலாயினன்."
464,"தடுத்தும், எயினன் நில்லாது மிஞிலியைப் பாழியென்னும், பறந்தலையின்கண் எதிர்த்துப் போர் செய்யத் தொடங்கினன்."
465,"அதுபோது, நன்னன் போர்க்களத்தை நோக்கிச் சினஞ்சிறந்து அருள்பிறவாது நின்றான்."
466,உயிரிழந்து வீழ்ந்த ஆஅய் எயினன் மீது வெயில்படா வண்ணம் பறவைகள் தம் சிறகரால் மறைத்துச் சூழ்ந்தன.
467,எனவும் வருவனவற்றால் உணர்க.
468,"மேலும், இச்சேரலுக்கும் நன்னனுக்கும் இயற்கையிலே நாடாட்சி காரணமாகப் பகைமையும் இருந்ததென முன்னர்க் கூறினோமன்றோ."
469,அதுவும் இதுபோது இவன் போர்க்கெழுதற்கு ஏதுவாயிற்று.
470,நார்முடிச்சேரல் போர்க்கெழும் செய்தி நன்னன் அறிந்து தானும் திரண்டு தானை சூழப் பெருங்கடல் நடுவட்செலும் வங்கம் போலச் செல்வானாயினன்.
471,இருபடையும் கடம்பின் பெருவாயில் என்னுமிடத்துக் கைகலந்து பொரலாயின.
472,நன்னனும் பொருது களத்தேயே ஒழிந்தான்.
473,என்றும் கூறப்பட்டுள்ளது.
474,"மேலும், இதன்கட் காவல்மரந் தடிதலும் கூறப்பட்டிலது."
475,இவற்றால் நன்னனுக்கும் நார்முடிச் சேரலுக்கும் நடந்தது ஒரே போர் அன்று என்பது பெறப்படும்.
476,சிலர் நார்முடிச்சேரல் நன்னனை வென்று பெற்ற நாடு தான் இளமைக்காலத்தே இவனோடு பொருது இழந்த நாடு என்று கூறுகின்றனர்.
477,அது நன்னனது வெற்றிச் செயல்களுள் ஒன்றாதலால் அவனைப் பாராட்டிய புலவர்பெருமக்கள் அதனைக் குறியாதிரார்.
478,இதனை இன்னும் விரித்து ஆராய்வதற்கு இஃதிடமன்று.
479,வருந்திப் பொருள் கோடலும் அழகன்று.
480,பகுதி .
481,அஞ்சி இவன் அதியமான் நெடுமான் அஞ்சி எனப்பெயர் பெறுவான்.
482,இவ்வதியர் என்பார் சிறந்த வீரர்கள் என்பது இவன் செயல்களால் தெரிகின்றது.
483,மேலும் இவனது முன்னோர்கள் விண்ணுலகத்திலிருந்து இவ் வுலகத்திற்கு.
484,அமரரை வேண்டி ஆவுதி அருத்திப் பெறுதற்கரிய கரும்பினைக் கொண்டுவந்து விளைவித்த சிறப்பினை யுடையார்.
485,அது பெற்ற ஒளவையார்.
