Line Number,Sentence
1325,"அம்மேடு சரளைவெட்டும் இடமாகப் பயன்படுத்தப் பட்டதால், மேலும் பல பொருள்கள் அங்கு கண்டுபிடிக்கப்பட்டன."
1326,அரசாங்கம் அவ்விடத்தைச் சரளை வெட்டும் இடமாகப் பயன்படுத்தக்கூடாது என்று ஆணை பிறப்பித்தது.
1327,"திருவாளர் ரீ அவற்றை ஆராய்ந்து, பல உண்மைகளை வெளியிட்டார்."
1328,நைந்த துணியின் பகுதிகளும் அரிசி முதலிய தானியங்களின் உமியும் தாழிகளுள் காணப்பட்டன.
1329,பெரும்பாலான பாத்திரங்கள் மண்ணைக் கொண்டே செய்யப்பட்டுள்ளன.
1330,பித்தளைப் பாத்திரங்களும் சில கிடைத்துள்ளன.
1331,விளக்குகள் இரும்பால் செய்யப்பட்டவை.
1332,"பித்தளை நகைகள் அருகிக் காணப்படுவதிலிருந்து,பித்தளை அப்போது மிகுதியாகக் கிடைக்க வில்லை என்பது தெரிகிறது."
1333,நெற்றிச்சுட்டி போன்ற ஒன்றுதான் தங்கத்தால் செய்யப்பட்டது.
1334,"இங்கு வாழ்ந்த மக்கள் நேர்த்தியான பாண்டங்கள் வனைவதிலும், உலோக வேலைப்பாட்டிலும், நெசவுத் தொழிலிலும் மரவேலைப்பாட்டிலும் சிறந்திருந்தனர் என்பது தெளிவாகும்."
1335,"இரும்பு மண்வெட்டிகள் முதலிய வற்றை நோக்க, அம்மக்களது பயிர்த்தொழில் பண்பட்டது என்பது தெரிகிறது."
1336,"பித்தளையில் விலங்குகளைப் போல உருக்கி வார்த்திருப்பது, அவர்களது கைத்தொழில் சிறப்பை விளக்குகிறது."
1337,சில தாழிகளின் கழுத்துக்கள் நல்ல வேலைப்பாட்டுடன் விளங்குகின்றன.
1338,ஒவ்வொரு தாழிக்கும் மூடி இருக்கின்றது.
1339,சில தாழிகளில் மட்டும் முழு எலும்புக் கூடு இருக்கிறது.
1340,சிலவற்றில் எலும்புகளை மட்டும் வைத்துப் புதைத்திருக்கலாம் என்பது தெரிகிறது.
1341,அவற்றோடு மண்ணும் உலோகத்தாலான வேறு பல பொருள்களும் தாழிக்குள் வைக்கப்பட்டிருந்தன.
1342,முழு எலும்புக்கூடு இருக்கும் தாழிகளில் உடம்பு முடக்கி வைக்கப்பட்டது என்பது தெரிகிறது.
1343,சில தாழிகளில் எலும்புகளே காணவில்லை.
1344,சில மண்டை ஓடுகளில் நெற்றியில் துளைகள் உள்ளன அவை தலையில் தாக்கப்பட்டு இறந்த மக்களுடையன என்று ஆராய்ச்சியாளர் அறைகின்றனர்.
1345,சில தாழிகளில் சாம்பல் காணப்படுகிறது.
1346,அச்சாம்பல் பிணங்களைப் புதைத்தபோது செய்யப்பட்ட சடங்குகளில் எரிந்த மரத்தின் சாம்பலாக இருக்கலாம் என்று அறிஞர் கருதுகின்றனர்.
1347,"உலோகப் பொருள்கள் பூச்சாடிகள், மணி வடிவத்தில் வாய் கொண்ட ஜாடிகள், வளையல் முதலியன பித்தளையால் செய்யப்பட்டவை."
1348,இவை அனைத்தும் சிறந்த வேலைப்பாடு கொண்டவை.
1349,இவை பண்டை மக்களின் கலைத் திறமைக்குச் சிறந்த எடுத்துக்காட்டாகும்.
1350,.ப் பித்தளைப் பொருள்கள் பெரும்பான்மை தாழிகளின் உள்ளேயே காணப்படுகின்றன.
1351,"மண்வெட்டி, வாள், ஈட்டி, விளக்கு முதலியவை இரும்பால் செய்யப்பட்டுத் தாழியின் வெளிப்புறத்தில் இருந்தன."
1352,இவை சில இடங்களில் தாழியுள்ளும் காணப்பட்டன.
1353,இக்கருவிகளின் நுனிகள் கீழ் நோக்கி இருந்தன.
1354,இறந்தோரின் உறவினரால் இவை மண்ணிற் செருகப்பட்டிருக் கலாம்.
1355,"இவற்றுள் பல கருவிகள் துருப்பிடித்துள்ளன ஆயினும், உறுதியாக உள்ளன."
1356,சில கருவிகள் உருத்தெரியாமல் பொடியாய் விட்டன.
1357,தங்க நெற்றிச்சுட்டி தங்க நெற்றிச்சுட்டிகள் சில தாழிகளிற்றான் கிடைத்தன.
1358,சிலவற்றில் தங்கத் தகடுகள் காணப்பட்டன.
1359,இவற்றைக் கோக்க நூலே பயன்பட்டிருத்தல் வேண்டும்.
1360,இவற்றை அணியும் வழக்கம் இப்பொழுது இப்பகுதியில் இல்லை.
1361,இவற்றையுடைய தாழிகள் பத்து அல்லது பதினைந்து அடி ஆழத்தில் புதைக்கப்பட்டுக் கற்களால் நன்கு மூடப்பட்டிருந்தன.
1362,"இவை பெரிய தாழிகள், பித்தளை, இரும்பு இவற்றாலான பிற பொருள்கள் இவற்றில் நிறைந்துள்ளன."
1363,"இவ்வடையாளங்கள் இருப்பின், அங்குத் தங்கச்சுட்டி உறுதியாகக் கிடைக்கும் என்று சொல்லலாம்."
1364,சில தாழிகளில் தங்கச்சுட்டிகள் நொறுக்கிப் போடப் பட்டிருந்தன.
1365,சில சுட்டிகள் முட்டை வடிவில் அலங்காரம் எதுவுமின்றிக் காணப்பட்டன சிலவற்றில் புள்ளிகளும் கோடுகளும் இடப்பட்டுள்ளன.
1366,மட்பாண்டங்கள் பல மண் பானைகள் நன்னிலையில் காணப்படுகின்றன களிமண் தரையுள்ள இடங்களில் நொறுங்கிக் கிடக்கின்றன.
1367,மட் பாத்திரங்கள் தாழியின் உள்ளும் வெளியிலும் கிடைக்கின்றன.
1368,"சில பானைகள் நல்ல கருப்புக் களிமண்ணாலும், சில சிவப்புக் களிமண்ணாலும், சில இரண்டும் கலந்த கலவையாலும் செய்யப்பட்டுள்ளன."
1369,சில பானைகளுக்கு நிறம் கொடுக்கப்பட் டுள்ளது.
1370,இங்குக் கிடைத்துள்ள மட்பாண்டங்கள் இப்பகுதியில் இக்காலத்தில் பயன்படுத்தப்படும் மட்பாண்டங்களினின்றும் மிகுந்த வேறுபாடு உடையனவாகத் தெரியவில்லை.
1371,"அறிஞர் ரீ, இவ்விடத்தை நன்கு ஆராய்ந்தார்."
1372,பளபளப்புடன் காணப்படும் மட்பாண்டப் பொருள்கள் பல அங்கு கண்டறியப்பட்டன.
1373,கொங்கராய குறிச்சி என்ற இடத்தில் ஊர் அமைத்து வாழ்ந்த மக்களது இடுகாடாக ஆதிச்ச நல்லூர் மண்மேடு இருந்திருத்தல் வேண்டும்.
1374,பண்டைக் காலத்தில் இவ்விரண்டு இடங்களும் அடுத்தடுத்து இருந்தனவாதல் வேண்டும்.
1375,பிற்காலத்தில் பொருநையாற்றின் போக்கு இவ்விடங்களைப் பிரித்திருத்தல் வேண்டும் என்று அறிஞர் ரீ கருதுகின்றார்.
1376,ஸ்ரீவைகுண்டம் இவ்வூர் பொருநையின் வடகரையில் அமைந்துள்ளது.
1377,இது திருநெல்வேலியிலிருந்து திருச்செந்தூர் செல்லும் சாலையுடன் ஒரு பாலத்தால் இணைக்கப்பட்டுள்ளது.
1378,இங்கு ஸ்ரீவைகுண்டபதி சுவாமி கோவில் உயர்ந்த கோபுரத்துடன் காட்சியளிக்கிறது.
1379,அதனால் இவ்வூர் ஸ்ரீவைகுண்டம் எனப் பெயர் பெற்றது.
1380,இக்கோவிலில் இருக்கும் திருவேங்கட முடையார் மண்டபம் சிற்பங்கள் நிறைந்தது.
1381,ஏகாதசி மண்டபத்தின் கதவுகள் வைகுண்ட ஏகாதசி அன்றுதான் திறந்துவிடப்பெறும்.
1382,இப்பகுதியில் கயிலாசநாதசுவாமி கோவில் என்று ஒரு சிவன் கோவிலும் இருக்கிறது.
1383,கோட்டைப் பிள்ளைமார் ஊரின் வடகோடியில் பத்தடி உயரத்திற்க மண் சுவர்கள் உள்ள கோட்டை ஒன்று காணப்படுகின்றது.
1384,அதனுள் வாழ்பவர் கோட்டைப் பிள்ளைமார் என்று அழைக்கப்படுகின்றனர்.
1385,கோட்டையுள் வெளி ஆடவர் எவரும் செல்ல அநுமதியில்லை அரசாங்க அலுவலரும் போதல் இயலாது ஊர்ப் பெண்கள் கோட்டையுள் செல்லலாம்.
1386,பட்டணத்துப் பிராமணர் எனப்படுபவரே இவர்களுக்கு குருமார்.
1387,இவர்தம் பணிமக்கள் கொத்தமார் எனப்படுவர்.
1388,"இவர்களும் கோட்டைப் பிள்ளைமாருடன் பாண்டிய நாட்டின் வடபகுதியிலிருந்து வந்தவராம், இவர்தம் பெண்கள் கோட்டையுள் வேலை செய்கின்றனர்."
1389,தொடக்க காலத்தில் கொத்தமாரும் கோட்டையுள் வாழ்ந்தனர்.
1390,அவர்கள் வழக்கத்திற்கு மாறாகக் கல் வீடுகளும் ஓட்டு வீடுகளும் கட்டலாயினர்.
1391,அவ்வீடுகளை இடிக்கவேண்டுமென்று பிள்ளைமார் வழக்குத் தொடுத்தனர்.
1392,"அக்கோட்டையைக் கட்டியவர் தாங்களே என்றும், பிள்ளைமார்களுக்கு உரிய உரிமை தங்கட்கும் உண்டு என்றும் கொத்தமார் எதிர் வழக்காடினர்."
1393,"ஆயின், நீதிமன்றம் பிள்ளைமாருக்குச் சார்பாகத் தீர்ப்பளித்தது."
1394,அதன் பயனாகக் கொத்தமார் கோட்டைக்கு வெளியில் வாழ்ந்துவருகின்றனர்.
1395,கோட்டைப்பிள்ளைமார் இல் நானூறு பேர் இருந்தனர்.
1396,இப்பொழுது குழந்தைகள் உட்பட ஐம்பத்தைந்து பேரே இருக்கின்றனர்.
1397,வரவர மக்கள் தொகை குறைந்து வருகிறது.
1398,கோட்டைப்பிள்ளைமாருக்குக் கோட்டைக்கு வெளியில் விடுதிகள் இருக்கின்றன.
1399,இவர்கள் அமைச்சர் முதலிய பெருமக்களையும் எண்பர்களையும் இங்குத்தான் வரவேற்கின்றனர்.
1400,நமது மாநில ஆளுநராயிருந்த ஸ்ரீ பிரகாசா அவர்கள் கோட்டையினுள் விடப்படவில்லை.
1401,வெளி விடுதியிற்றான் அவருக்கு வரவேற்பு நடைபெற்றது.
1402,"அப் பெரியார், நீங்கள் உலக முன்னேற்றத்தைக் கண்டு உங்கள் பழக்க வழக்கங்களைத் திருத்திக்கொள்ள வேண்டும்."
1403,"தனித்து வாழ்தல் வளர்ச்சிக்கு ஏற்றதன்று , என்று இப்பிள்ளைமார்க்கு அறிவுரை புகன்றனர்."
1404,ஸ்ரீவைகுண்டம் நிலவளம் மிக்கது.
1405,கி.பி.
1406,ஆம் நூற்றாண்டில் சிறந்து விளங்கிய குமரகுருபர அடிகள் இப்பதியினரேயாவர்.
1407,ஆழ்வார் திருநகரி இது ஸ்ரீவைகுண்டத்திற்கு ஐந்துகல் தொலைவில் திருச்செந்தூர்த் தாலூகாவில் பொருநையாற்றுத் தென்கரையில் அமைந்துள்ளது.
1408,"இஃது ஆழ்வார் பன்னிருவருட் புகழ்பெற்று நம்மாழ்வார் இருந்து, தம் திருவாய்மொழி இயற்றியருளிய திருப்பதியாகம்."
1409,இதன் பண்டைப் பெயர் திருக்குருகூர் என்பது ஆற்றங்கரையில் அமைந்திருப்பதால் மருதவளம் மிக்குடையது.
1410,கோவிலுள் பல மண்டபங்களும் பல தெய்வங்களின் சிறு கோவில்களும் அமைந்துள்ளன.
1411,இக் கோவிலில் உள்ள புளியமரம் சிறப்பு வாய்ந்தது.
1412,அதன் பொந்தில் நம்மாழ்வார் இருந்து தவம் செய்தனர் என்பது தல வரலாறு.
1413,அதன் அடியிற்றான் நம்மாழ்வாரது பூதவுடல் அடக்கம் செய்யப்பட்டுள்ளது.
1414,அவ்விடத்தில் நம்மாழ்வார்க்கக் கோவில் கட்டப்பட்டுள்ளது.
1415,பெருமாள் கோவில் விழாக்களில் வைகாசி விழா சிறப்புடையது.
1416,இவ்விழாவில் நம்மாழ்வாருக்கே சிறப்பிடம் தரப்படுகிறது.
1417,"இக்கோவிலில் உள்ள திருமாமணி மண்டபம், திருமஞ்சன மண்டபம், கண்ணாடி மண்டபம் என்பன சிற்பவேலைப்பாடு மிகுந்தவை."
1418,மொட்டைக் கோபுரமும் அதில் அமைந்துள்ள உருவங்களும் சிறந்த வேலைப்பாடு கொண்டவை.
1419,வேறு எக்கோவிலிலும் காணக்கிடையாத கல்நாதசுரம் ஒன்று இக்கோவிலில் இருக்கிறது.
1420,இழ கருங்கல்லில் குடையப்பெற்ற இசைக்கருவி.
1421,இது ஏறத்தாழ ஓரடி நீளமுள்ளது.
1422,இதன் மேற்பகுதி கால் அங்குல அகலமும் அடிப் பகுதி ஓரங்குல அகலமும் உடையது.
1423,அடிப் பாகத்தில் பித்தளைப் பூண் பொருத்தப்பட்டுள்ளது.
1424,இவ்வொப்பற்ற இசைக்கருவி மதுரையை ஆண்ட கிருஷ்ணப்ப நாயக்கரால் இக்கோவிலுக்கத் தரப்பட்டது என்று கோவிலார் கூறுகின்றனர்.
1425,நம்மாழ்வார் தமிழ்நாட்டு வைணவத் தலங்களைத் தம் பாக்களில் குறித்துள்ளர்.
1426,"அவற்றுள் எட்டு, ஆழ்வார் திருநகரியைச் சுற்றி இருக்கின்றன."
1427,"அவை திருப்புளியங்குடி, நத்தம், ஸ்ரீவைகுண்டம், குளந்தை, தென்திருப்பேரை, துணைவில்லி மங்கலம் இங்கு இரண்டு கோவில்கள் உள்ளன."
1428,திருக்கோளூர் என்னும் இடங்களிலுள்ள திருக்கோயில்களாகும்.
1429,"இவற்றோடு திருக்குருகூரையும் சேர்த்து, மக்கள் நவ திருப்பதிகள் என்று கூறுவர்."
1430,இவற்றுள் திருக்கோளூரிற் பிறந்தவரே மதுரகவி யாழ்வார் என்பவர்.
1431,இராமாநுஜரும் இத் திருப்பதிக்கு வந்த நம்மாழ்வாரைத் தரிசித்துச் சென்றார்.
1432,பின்பு தோன்றிய வைணவப் பெருமக்கள் பலரும் இப் புனித நிலத்தை அடைந்து நம்மாழ்வாரைப் பணிந்து சென்றனர்.
1433,இத் தலத்திற்றான் மதுரகவியாழ்வார் நம்மாழ்வாருக்கச் சீடராகப் பல ஆண்டுகள் இருந்து பெருமை பெற்றார்.
1434,.
1435,"பொருநைக்கரை ஊர்கள் கொற்கை இலக்கியத்தில் கொற்கை கொற்கை, கடற்கரை உயர்ந்த மணல்மேடு வாய்ந்தது."
1436,அதை அடுத்துக் கடற்கரைச் சோலை அமைந்திருந்தது.
1437,அங்குப் பேயின் தலைபோல் தோன்றும் தாழை மரங்கள் படர்ந்திருந்தன.
1438,அவற்றில் முள் நிறைந்த புற இதழ்களையுடைய தாழைப் பூக்கள் தூய வெண்ணிறத்தோடு மலர்ந்து இருந்தன.
1439,அம்மலர்களின் மணம் கடற்கரையின் பிலால் நாற்றத்தைப் போக்கியது.
1440,கொற்கைக் கடலில் முத்து விளையும் சிப்பிகள் மிகுதியாக இருந்தன.
1441,அவை முத்துக்குளித்தவர்க்கே அன்றி மீன் பிடித்தவர்க்கும் அகப்பட்டன.
1442,"அங்ஙனம் அகப்பட்ட சிப்பிகளில் முத்துக்கள் இருக்குமாதலால், அவற்றை விலைகொடுத்து வாங்கக் கொற்கைப் பட்டினத்தார் கரையில் காத்திருந்தனர்."
1443,மீன் பிடித்தவர் தாம் கொண்டுவந்த சிப்பிகளை விலையாகக் கொடுத்து கள் வாங்கிக் குடிப்பது வழக்கம்.
1444,அப்பொழுது கொற்கை மக்கள் அவர்தம் வருகையை ஆவலுடன் எதிர்பார்த்துக் கரையில் நின்றிருப்பர் மகிழ்ச்சியோடு சங்குகளை முழக்கி ஆரவாரமாக வரவேற்பர்.
1445,நிறைமதி நாளன்று அந்திப்பொழுதில் சூரியன் மறைந்தபின் முழுநிலாக் கடலில் தோன்றிக் காட்சி அளிக்கம் அல்லவா?
1446,இயற்கையாகச் சிப்பிகளிலிருந்து வெளிப்பட்டுக் கரையோரத்தில் அலைகளால் தள்ளப்படும் முத்துக்களும் இருக்கம்.
