Line Number,Sentence
1599,இங்கே உயிருக்கு மூன்று நிலை உண்டாவது நோக்கற் பாலது.
1600,"அறிவும் மூளையும் இடை நிலையில், அறிவு பெருகப் பெருகக் கருவி கரணங்கள் மென்மையுற்றுக் கொண்டே போகும்."
1601,அறிவுக்கு நிலைக்களன் மூளை.
1602,மூளை மென்மை உறஉற அறிவு கூர்ந்து கூர்ந்து விளங்குவதாகும்.
1603,இஃது ஆராய்ச்சியாளரால் காணப் பெற்ற உண்மை.
1604,எடுத்துக்காட்டாக இரண்டொரு குறிப்பு வருமாறு மீன் மூளை கல்போலிருக்கிறது.
1605,அதன் கால் உறுப்புக்கள் கூராமல் உள்ளது சிறவாமல் கிடக்கின்றன.
1606,அது தரையில் நடமாடுவதில்லை.
1607,ஆமைக்கு ஐந்துறுப்பு உண்டு.
1608,அவ்வுறுப்புக் களைக் கொண்டு அஃது ஊர்கிறது.
1609,காரணம் என்னை?
1610,மீனின் மூளையினும் ஆமையின் மூளை மென்மைப் படுவதாகும்.
1611,மேலும் மூளை மென்மை உறஉற முன் காலிரண்டும் தரையில் படியாமல் கைகளாகி மேலெழுகின்றன.
1612,இந்நிலையில் உயிர்கள் இரண்டு கால் கொண்டு நடப்பனவா கின்றன.
1613,இருகால் பெற்ற மனிதப் பிறவி பரிணமித்த காலம் பலவாறு சொல்லப்படுகிறது.
1614,இப்பொழுது முப்பது லட்சம் ஆண்டுக்கு முன்னர் மனிதப் பிறவி தோன்றியிருத்தல் வேண்டும் என்ற ஆராய்ச்சி பிறந்திருக்கிறது.
1615,இவ்வாராய்ச்சி என்றும் ஒரு பெற்றியாயிராது.
1616,கால அளவு மாறுபட்டுக் கொண்டு போகும்.
1617,இதைப்பற்றிய கவலை இங்கே வேண்டுவதில்லை.
1618,"பல்லாயிரம் ஆண்டுகட்கு முன்னர் இருந்த மனிதருக்கும், இப்பொழுதுள்ள மனிதருக்கும், வேற்றுமை உண்டா இல்லையா என்பதே ஈண்டுக் கருதற்பாலது."
1619,மனிதர் தோன்றிய நாள்முதல் இன்றுவரை ஒரு தன்மையராயிருந்ததில்லை.
1620,"மனிதருக்குக் கோரைப் பற்களும், மிகப் பருத்த நீண்ட குடர்களும் இருந்த காலமும் உண்டு."
1621,"அவை, மூளை மென்மை உறஉறத் தேய்ந்துங் குறைந்தும் போயின."
1622,தேய்வு குறைவுக்கேற்ப அறிவு விளங்கிக் கொண்டு போதல் இயல்பு.
1623,முற்கால இடைக்கால மனிதரைப் பார்க்கிலும் இக்கால மனிதர் எவ்வளவு அறிவு விளக்கம் பெற்றுள்ளனர் என்பது வெள்ளிடை மலை.
1624,இவ்வறிவு சிற்சில சமயம் நேரிய வழியில் இயங்காதொழிவது ஒருவித குறைபாடு.
1625,நாளடைவில் குறைபாடு நீங்கும்.
1626,குறைபாடே போராட்டத்துக்குக் காரணம்.
1627,போராட்டம் என்றும் நிலவுவதன்று.
1628,போராட்டம் ஒருவித நிலை.
1629,இது பொது முறை.
1630,முற்கால இடைக்காலங்களில் தோன்றிய பெரியோர் தன்மைகளை உயிர் வளர்ச்சி ஆராய்ச்சி யில் நுழைத்துப் பார்ப்பது தவறு.
1631,இதுபற்றி இடம் நேர்ந்துழி விளக்குவன். இயற்கை நூல் ஆராய்ச்சியாளர் தற்கால மனிதன்வரை போந்துள்ளனர்.
1632,அவர்தம் ஆராய்ச்சி வளர வளரப் பலதிற நுட்பங்கள் வெளியாகும்.
1633,அவ்வாராய்ச்சி மனிதப் பிறவிக்கு மேலும் போகும்.
1634,மூளை மென்மை உறஉற அறிவு விளங்குதல் ஈண்டு உன்னற் பாலது.
1635,மூளைக் கேற்றவாறு கருவி கரணங்கள் அமைந்து வருகின்றன.
1636,"மூளை மென்மை உற்று உற்றுப் போவதைக் கொண்டு, கருவி கரணங்களே இல்லாத ஒருநிலை உண்மையை ஊகித்து உணரலாமன்றோ?"
1637,அதுவே தூய அறிவு நிலை.
1638,"முழு அறிவு மயம் உயிர், கருவி கரணமற்றுத் தூய அறிவாகும் பொழுது அதற்கொரு நிலைக்களன் ஏற்படுதல் வேண்டும்."
1639,அந்நிலைக் களன் தூய அறிவாகிய இறை.
1640,"அஃது, அறியாமையே இல்லாததாய், கருவி கரண உடல் தாங்காததாய், முழு அறிவு மயமா யன்றோ இருத்தல் வேண்டும்?"
1641,இறை அறியாமையே இல்லாதது கருவி கரண உடல் தாங்காதது முழு அறிவு மயமாயிருப்பது.
1642,அத்தகைய இறையைக் குரு நிலையில் வாலறிவன் என்றார் ஆசிரியர்.
1643,வாலறிவன் ஒருவன்.
1644,அவன் நிலையடைவோர் பலர்.
1645,அவர் அறிவரெனப்படுவர்.
1646,அறிவனையடைந்து அறிவன் நிலை அடைவோர் அறிவராதல் இயல்பு.
1647,"இறைவன் அறிவு என்பதையும், அறிவன் என்பதையும், கருவி கரணம் அற்றவன் என்பதையும் விளக்கும் அநுபூதி மான்கள் மெய்யுரைகள் பல."
1648,ஏனையோர் தாள்கள் நற்றாள்களல்ல.
1649,"வாலறிவன் இயற்கையாகவே கட்டில்லாதவனா தலானும், அவன் தாள் கட்டுடையார்க்கு நலஞ்செய்ய அவர்தங் கட்டறுக்குந் தன்மையுடையதாகலானும், அத்தாள் நற்றாள் என்னப்பட்டது."
1650,பிறவிப் பிணிக்கு மருந்தாகலின் நற்றாள் என்றார் என்று பரிமேலழகர் கூறியதும் ஈண்டு நோக்கத்தக்கது.
1651,"வாலறிவனவல்லாத ஏனையோர் கட்டுடையாராகலானும், அன்னார் வாலறிவன் நற்றாள் பற்றிக் கட்டறுக்க வேண்டு மாதலானும் அவர் தந் தாள்கள் நற்றாள்களாகா."
1652,முன்னே மாணடி என்றார் இங்கே நற்றாள் என்றார்.
1653,மாண் நல் இரண்டும் ஒரு கருத்துடையனவே.
1654,"மாண் நல் என்னும் அடைமொழிகள், பிறர் அடியினும் இறைவன் அடி அல்லது தாள் சிறந்தது என்பதை வலியுறுத்துவன."
1655,"பொருள் கொள்ளும்போது, மாண் அல்லது நல் என்னும் அடை மொழியைச் சேர்த்துக் கொள்வது பொருத்தமாகும்."
1656,"தொழாஅ ரெனின் தாளே தொழுதற் குரியதாதலின், தாள் தொழாஅ ரெனின் என்றார்."
1657,"அக்கூற்றில், இறைவன் தாளைத் தொழுதே தீரல் வேண்டும்."
1658,இல்லையேல் வாழ்வு என்னாம்!
1659,என்னும் உள்ளுறையும் பொலிவது காண்க.
1660,அளபெடை இசை நிரப்புவது அளபெடை என்று கூறுவோர் கூறுக.
1661,இலக்கண வரம்பு எதுவாயினுமாக.
1662,"இலக்கிய இலக்கணம் முறையாகப் பயின்ற பின்னர், இயற்கையில் ஒன்றி, அறிவை விடுத்துத் துழவும் பயிற்சியும் பெறுதல் வேண்டும்."
1663,ஈண்டுப் போந்துள்ள அளபெடை வெறும் இசையை மட்டும் நிரப்பி நிற்பதன்று.
1664,அது பொருளும் உடையது.
1665,"திருவள்ளுவர் நூல், குறள் வெண்பாக்களால் ஆக்கப் பட்டது."
1666,ஒவ்வொரு குறளிலும் ஒவ்வொரு கடலுண்டு என்று கூறல் மிகையாகாது.
1667,ஒருபோதும் பெய்யார்.
1668,"அவர்தம் வாய்மை யினின்றும் பிறந்துள்ள ஒவ்வோர் ஒலியும், ஒவ்வோர் எழுத்தும், ஒவ்வொரு சொல்லும் பொருளுடையனவாகவேயிருக்கும்."
1669,அவற்றை வெறும் இலக்கிய இலக்கணக் கண் கொண்டு பார்த்தல் மட்டும் போதாது.
1670,இயற்கைக் கண்கொண்டும் அவற்றை உற்று நோக்கல் வேண்டும்.
1671,இயற்கை நோக்குக்கு நுண்பொருள் புலனாகும்.
1672,"அளபெடை, அசைநிலை என்று பிறரால் கூறப்படுவன வெல்லாம், திருவள்ளுவர் மொழியில் பொருளுடையன வாகவே திகழும்."
1673,தொழாஅர் என்பதிலுள்ள அகர அளபெடையை நோக்குக அதனுடன் ஒன்றுக ஒன்றித் திளைக்க.
1674,எழுத்து மறையும்.
1675,எழுத்து இயற்கை ஒலியாகும்.
1676,அங்கே நுண் பொருள் விளங்கும்.
1677,தொழாஅர் என்பது இடையறாது தொழுது கொண்டி ருத்தலை உணர்த்துவது.
1678,தினைப் பொழுதுந் தொழுகையை மறத்தலாகாதென்பது அதன் நுண்பொருள்.
1679,பனைக்கை தினைத்த னைப்பொழு தும்மறந் துய்வனோ என்றார் அப்பர்.
1680,இக் குறட்பாவில் இடையறாது என்னுங் குறிப்பு யாண்டு மில்லை.
1681,அஃது அளபெடையிலேயே மிளிர்கிறது.
1682,தொழுகை தொழுகை வாழ்வுக்கு இன்றியமையாதது.
1683,தொழுகையற்ற வாழ்வு சிறை நீர் போன்றது.
1684,தொழுகையால் ஆவி சாவி ஆகாது.
1685,ஆவிக்கு ஆக்கமளிப்பது தொழுகையே.
1686,உடல் நலத்துக்கு உணவு.
1687,உயிர் நலத்துக்குத் தொழுகை.
1688,எவரைத் தொழுவது?
1689,மலக்கட்டால் தொடக்குண்டு கிடப் போரையா தொழுவது?
1690,இவரைத் தொழுவதால் மலக்கட்டு எப்படி அறும்?
1691,குருடனைக் குருடன் பற்றி நடந்தால் என்னாகும்?
1692,மலக்கட்டே இல்லாத வாலறிவன் நற்றாளே தொழுகைக்கு உரியது.
1693,அதனால் வாலறிவன் நற்றாள் தொழாஅ ரெனின் என்றார்.
1694,தம்மையே பொய்மை யாளரைப் பாடாதே எந்தை புகலூர் பாடுமின் புலவீர்காள் என்றார் வன்றொண்டரும்.
1695,"வாலறிவன் தாளைத் தொழாதார் என்னாவரோ என்பார், தொழாஅ ரெனின் என்றார்."
1696,"அவர் பிறவி நோக்கத்தை இழந்தவராவராதலின், அவரை என்னாவரோ என்று குறித்த ஆசிரியர்க்கு மனமெழவில்லை."
1697,இரக்கம் காரணம் போலும்!
1698,தன்னல அழிவு தொழுகையால் விளையும் நலன்கள் என்னை?
1699,தொழுகை யால் விளையும் நலன்களைப் பலபடக் கூறலாம்.
1700,அவைகளுள் விழுமிய ஒன்றை ஈண்டுக் குறிப்பிடுவது சிறப்பு.
1701,அது தன்னல அழிவு.
1702,தொழுகை என்னுஞ் சொல்லே நெஞ்சைக் கவர்கிறது.
1703,"அதில் தாழ்மையும், பணிவும், அமைதியும், அன்பும் பொலி கின்றன."
1704,இவ்வியல்புகளைத் தொழுகையால் பெறுதல் உறுதி.
1705,இவை தன்னலத்தை அழித்தல் ஒருதலை.
1706,"தொழுகை, மனம் மொழி மெய்களால் நிகழ்தல் வேண்டும்."
1707,மனம் மொழி மெய் மூன்றுந் தொடர்புடையன.
1708,அவை அரும்பு மலர் காய் போன்றன.
1709,உயிர்கட்குச் செய்யப்படும் பணி இருவிதம்.
1710,ஒன்று தன்ன லத்தை அடிப்படையாகக் கொண்டது மற்றொன்று பரநலத்தை அடிப்படையாகக் கொண்டது.
1711,பரநலத்தை அடிப் படையாகக் கொண்டது தெய்வ வழிபாடாகும்.
1712,தொண்டில் ஈடுபடப்படத் தன்னலம் படிப்படியே கெட்டுக்கெட்டு முறைமுறையே பரநலம் உறும்.
1713,இதை விரித்துக் கூறுவது திருவள்ளுவர் நூல்.
1714,"தன்ன லத்தை எப்படி அழிப்பது என்பதும், பரநலத்தை எப்படி வளர்ப்பது என்பதும் திருவள்ளுவர் நூலில் செவ்வனே அறிவுறுத்தப் பெற்றிருக்கின்றன."
1715,மனத்தால் இறைவனை உன்ன உன்ன இறைவன் இயல்பு களாகிய அன்பு முதலியன படியும்.
1716,அன்பு முதலியன படியப் படிய அவைகளுக்கு மாறுபட்ட இகல் முதலியன மடிந்து போகும்.
1717,இகல் மடிந்து அன்பு படிந்த உள்ளத்தினின்றும் பிறக்கும் மொழி எத்தகையதாயிருக்கும்?
1718,செயல் எத்தகையதா யிருக்கும்?
1719,அம்மொழி இறையினுடையதாகும் அச்செயலும் இறையினுடையதாகும்.
1720,இறைவன் எத்தகையன்?
1721,"அன்பாய், தன்னல மற்றவனாய், பரநலமே உடையவனா யிருப்பவன்."
1722,"அவன் இயல் படிந்த மனத்தினர் பேச்சையுஞ் செயலையும், அவன் பேச்சு அவன் செயல் என்று கூறுதல் தவறாகாது."
1723,"உயிரின் இயல்பு, சார்ந்ததன் வண்ணமாவது."
1724,அஃது ஆணவத்தோடிருக்கும்போது ஆணவ மயமாயிருக்கும் இறை யோடிருக்கும்போது இறை மயமாயிருக்கும்.
1725,ஆணவத்தோ டத்துவித மானபடி மெய்ஞ்ஞானத் தாணுவினோ டத்துவிதஞ் சாருநா ளெந்நாளோ என்றார் தாயுமானார்.
1726,உயிர் ஆணவத்தினின்றும் விடுதலையடைந்து தாணுவா தற்குத் துணை செய்வது தொழுகை.
1727,தொழுகை முதலாவது மனத்தைத் தூய்மை செய்கிறது.
1728,தூய நெஞ்சம் தன்னலத்துக்கு இடந்தராது.
1729,அதன் கண் பரநலமே நிலவும்.
1730,இந்நெஞ்சுடையார் செய்யுந் தொண்டே தொண்டாகும்.
1731,"மனமாசகன்ற அறவோர் நெஞ்சத் தாமரையில் இறைவன் விளங்கலால், அவர் என்றும் ஒப்புரவாளராய்ப் பயன் கருதாத் தொண்டு நிகழ்த்தியவண்ணமிருப்பர்."
1732,அவர் இறை போன்றவர் என்பது மேலே சொல்லப்பட்டது.
1733,"உயிர்க ளெல்லாம் தன்னைப் போலாதல் வேண்டுமென்று இயற்கையின் வாயிலாகவும், குருவின் வாயிலாகவும் இறைவன் தொண்டு செய்து கொண்டே யிருக்கிறான்."
1734,அவனுக்கு ஓய்வு என்பதே கிடையாது.
1735,அவனே பெருந்தொண்டன்.
1736,அத் தொண்டனைத் தொழுது தொழுது தொண்டராவோரும் என்றும் உயிர்கட்குத் தொண்டு செய்து கொண்டேயிருப்பர்.
1737,மேன்மக்கள் தொண்டே செய்து கொண்டிருப்பார்கள்.
1738,அவர்கள் இயற்கை கடந்த தனி இறையைத் தெளிந்து அதனுடன் ஒன்றுபடும்வரை ஓய்வை விரும்பமாட்டார்கள்.
1739,அவர்கட்கு வீடுபேறு தொண்டே ஓய்வு வீடு பேறன்று.
1740,இதுபற்றியே தொழாஅ ரெனின் என்பதற்கு வணங்கிக் கொண்டிராராயின் என்று பொருள் சொல்லப்பட்டது.
1741,அளபெடையின் நுட்பம் செவ்வனே விளங்குதல் காண்க.
1742,என் கடன் பணி செய்து கிடப்பதே எனவரூஉம் அப்பரெம் பெருமான் திருவாக்கை ஓர்க சிறப்பாகக் கிடப்பதே என்பதை ஓர்க.
1743,இத் தலைப்புக் கொண்ட ஒரு நூலும் என்னால் இயற்றப் பட்டது.
1744,"உயிர்கட்குப் பயன் கருதாப் பரநலத் தொண்டு செய்யும் பேறு, தொழுகையாலேயே கூடும்."
1745,தொழுகையால் மனம் தூய்மையுறுகிறது.
1746,தூய மனத்தில் இறையின் இயல்புகள் படிகின்றன.
1747,இவ்வியல்புகளால் தன்னலம் அழிந்து பரநலம் எழுகிறது.
1748,எல்லாவற்றிற்கும் அடிப்படை தொழுகை.
1749,அதன் பெற்றி நோக்கியே வாலறிவன் நற்றாள் தொழாஅரெனின் என்றார்.
1750,"இறைவன் தாள், திருவருளுக்கு அறிகுறி என்பது முன் பாட்டில் விளக்கப்பட்டது."
1751,வாலறிவன் நற்றாளைத் தொழு தலாவது அவன் திருவருளை உன்னி உன்னி அதுவாகிப் பயன் கருதாச் சேவை செய்வதென்க.
1752,சேவைக்கு அடிப்படை அருளன்றோ?
1753,"இது, சமயம் நேர்ந்துழி நன்கு விளக்கப்படும்."
1754,கற்றதனா லாய பயன் என்கொல்?
1755,ஆய ஆகிய பெயரெச்சம்.
1756,என் எவன் தொகுத்தல் விகாரம்.
1757,எவன் என்னும் வினாப்பெயர் என்னென்றாய் ஈண்டின்மை குறித்து நின்றது பரிமேலழகர்.
1758,எவனென்பதோர் பெயருமுண்டு அஃதிக்காலத்து என்னென்றும் என்னை யென்றும் நிற்கும்.
1759,ஈண்டுக் கூறப்பட்டது வினைக் குறிப்பு முற்றென்க சேனாவரையம் படுத்த லோசை யால் எவன் என்பது பெயருமாம்.
