Line Number,Sentence
3292,கொள்கை கொள்கை கொள்கை கோட்பாடு.
3293,ஆன்றவிந் தடங்கிய கொள்கைச் சான்றோர் புறம்.
3294,கொள்கை கொள்கை நோன்பு.
3295,வடுவில் கொள்கையின் உயர்ந்தோர் ஆய்ந்த கெடுவில் கேள்வியுள் நடுவா குதலும் பரி.
3296,கொள்கை கொள்கை கற்பு.
3297,செயிர்தீர் கொள்கை எம்வெங் காதலி புறம்.
3298,கொள்கை கொள்கை இயல்பு.
3299,துஞ்சாக் கண்ணர் அஞ்சாக் கொள்கையர் மதுரைக்.
3300,கொள்கை கொள்கை கொள்ளுதல்.
3301,"கொடுந்திமில் பரதவர், கொழுமீன் கொள்கை நற்."
3302,ச.இ.க கொள்முதல் ஒரு பொருளைக் கொண்டு இன்னொரு பொருளை வாங்குதல் வேண்டுமானால் கொள்வதற்கு முதல் வேண்டும்.
3303,இல்லையானால் கொள்ளவோ அதனால் ஊதியம் கொள்ளவோ இயலாது.
3304,ஆதலால் வணிகர் பொருளீட்டுதற்கு வழி கொள் முதல் ஆகும்.
3305,கொள்முதல் செய்ததை இருப்பு வைத்து வேண்டு மிடத்து வேண்டுங்காலத்து விற்று ஊதியம் பெறுவதற்கு அடிப் படை கொள்முதல் ஆகும்.
3306,கொண்டுள்ள முதலே கொள்முதல்.
3307,முதலிலார்க்கு ஊதியம் இல்லை திருக்.
3308,கொள்வனவு ஒரு பொருளை வாங்கிக் கொள்ளுதல் கொள்வனவு எனல் ஈழத் தமிழர் வழக்காக உள்ளது.
3309,கொள்வினை கொடுப்பு வினை என மணக்கொடை பற்றிய சொல்லாகத் தமிழக வழக்கில் உள்ளது.
3310,கொள்வது பற்றிய பொதுமைக் குறியோடு ஈழ வழக்குள்ளது.
3311,கொள்வினை கொடுப்புவினை கொள்வினை மணமகளை மணமகன் மணம் கொள்ளுதல்.
3312,கொடுப்புவினை மணமகனுக்கு மணமகளை மணமகள் வீட்டார் கொடுத்தல்.
3313,மணப்பெண் எடுத்தல் கொடுத்தல் ஆகிய சடங்குகளைக் கொள்வினை கொடுப்புவினை என்பர்.
3314,கொள்ளுதல் கொடுத்தல் என்பவை மிகப் பழங்காலச் செய்தியாம்.
3315,பெண் கொடுத்தல் பெண் எடுத்தல் என்னும் வழக்கமே இக்காலம் வரை உள்ளது.
3316,மாப்பிள்ளை எடுத்தல் கொடுத்தல் என்னும் வழக்கு இல்லாமையைக் கொண்டும் தெளிக.
3317,கொள்வோன் ஒருவர் ஒன்றைத் தர அதனைப் பெற்றுக் கொள்பவன் கொள்வோன் ஆவான்.
3318,கொள்ளும் கையும் கொடுக்கும் கையும் வளைவாக இருக்கும் அமைவை நினைக்க.
3319,கொள் என்னும் வளைவுப் பொருளும் விளங்கும்.
3320,பொருளைக் கொள்வோன் போல அறிவைப் பெற்றுக் கொள்வோனும் கொள்வோனே.
3321,அவன் மாணவன் ஆவன்.
3322,ஆசானிடம் கற்றுக் கொள்ளும் செயலால் பெற்ற பெயர் அது.
3323,கொடுப்பவர் ஆசிரியர்.
3324,"ஆதலால், கொள்வோன் கொள்வகை அறிந்தவன் உளம்கொளக் கோட்டமில் மனத்தில் நூல் கொடுத்தல் என்கிறது நன்னூல் ."
3325,கொள்ளாம் கொள்ளாம் என்பது கொள்ளத் தக்க நல்லது என்னும் பொருளில் விளவங்கோடு வட்டார வழக்காக உள்ளது.
3326,கொள்ள ஆம் என்பதன் புணர்ப்பு கொள்ளாம் ஆயது.
3327,கொள்ளாம் என்னும் எதிர்மறை வழக்குக்கு மாறான உடன்பாட்டுப் பொருள் வழக்கு இது.
3328,கொள்ளார் கொள்ளார் கொள்ளார் எதையும் ஏற்றுக் கொள்ளார்.
3329,ஒப்புக் கொள்ளார் எனக் கொள்ளார் பலர்.
3330,ஆனால் சீரிய கொள்ளாரும் உளர்.
3331,"அவர், கொள்ளெனக் கொடுத்தல் உயர்ந்தன்று அதனெதிர் கொள்ளேன் என்றல் அதனினும் உயர்ந்தன்று புறம்."
3332,"இத்தகையர், வேண்டாமை கொண்ட விழுச்செல்வர் திருக்."
3333,அவா வறுத்த துறவர்.
3334,கொள்ளார் கொள்ளார் பகைவர்.
3335,கொள்ளார் ஓட்டிய நள்ளி புறம்.
3336,"பிள்ளையும் இல்லை கொள்ளியும் இல்லை என்னும் மரபுத் தொடரில் பிள்ளை, ஆண்பிள்ளையையும், கொள்ளி எரி மூட்டலையும் குறித்தன."
3337,கொள்ளி கொள்ளி எரிவிறகு.
3338,"கொள்வது, கொள்ளி."
3339,"எதைக் கொள்கிறது என்றால், தீயை அல்லது எரியைக் கொள்கிறது."
3340,கல்லைத் தேய்த்தோ.
3341,தீக்கடை கோலால் கடைந்தோ உண்டாக்கப்பட்ட எரியைத் தான் கொண்டு எரிவதால் கொள்ளி எனப்பட்டது.
3342,கொள்ளி பற்றிய கட்டை கொள்ளிக்கட்டை.
3343,தீமை செய்வதைக் குறியாகக் கொண்டவனைக் கொள்ளி தீ முடிவான் எனப் பழித்தனர்.
3344,அது வசைமொழி வழக்கில் ஊன்றியது.
3345,கொள்ளி முடிவான் கொள்ளி முடிவான் ஓயாது தீமையாக்குபவன்.
3346,"கொள்ளி நெருப்பு முடிவான் முடிந்து வைப்பவன், தனக்கு முடிந்து வைப்பவன்."
3347,சில பேர் எப்போதும் ஏதாவது தீமையைக் குடும்பத்துக்கு ஆக்கிக் கொண்டே இருப்பர்.
3348,"அவரைக் கண்டாலே பெற்றவர், உடன் பிறந்தவர், கொண்டவர், கொடுத்தவர் ஆகிய அனைவருக்கும் என்ன செய்வாரோ என்னும் அச்சம் உண்டாகும்."
3349,அத்தகையரைக் கொள்ளி முடிவான் என்பர்.
3350,"கொள்ளுதல் பெற்றுக் கொள்ளல், எடுத்துக் கொள்ளல், வாங்கிக் கொள்ளல், கொடுத்துக் கொள்ளல், கெடுத்துக் கொள்ளல் எனக் கொள்ளல் பெருவழக்காம்."
3351,தினற்பொருட்டால் கொள்ளா துலகெனின் யார்யார்க்கும் விலைப்பொருட்டால் ஊன்தருவார் இல் என்னும் திருக்குறள் .
3352,கொள்ளுதல் என்பது மிகுதியானால் கொள்ளை எனப்படும்.
3353,"வாங்கிக் கொள்ளுதல், ஏற்றுக் கொள்ளுதல் போல உட்கொள்ளுதலும் கொள்ளுதல் எனப்பெறும்."
3354,உண்டைகொள் மதவேழம் என்றார் கம்பர் பால.
3355,"கொள்ளை ஆசை, கொள்ளை அழகு என உள்ள மிகுதி, கவர்ச்சி மிகுதி என்பவை கேட்கப்படுகின்றன."
3356,"மிகுதியாம் நீர்ப் பெருக்கைக் கொள்ளும் ஆறு, கொள்ளிடம்."
3357,தீயைக் கொண்டு எரியும் கொள்ளிக் கட்டை இறுதியில் உடலாம் கட்டைக்குக் கொள்ளி வைத்தல் சடங்கு.
3358,கொள் முதனிலை நீண்டு கோள் ஆகியது நாள் கோள்.
3359,"குறிக்கோள், கோள் கூறல் என விரிவாவதும் எண்ணலாம்."
3360,"கொண்டல், கொண்டி, கோள் காண்க."
3361,கொள்ளுதல் கொடுத்தல் கொள்ளுதல் பெண் கொள்ளுதல்.
3362,கொடுத்தல் பெண் கொடுத்தல்.
3363,"இதனைக் கொள்வினை கொடுப்புவினை என்றும், கொண்டவர் கொடுத்தவர் என்றும் கூறுவதுண்டு."
3364,கொள்வோர் கொடுப்போர் என்னும் குறியீடு தொல்காப்பியப் பழமையுடையதாம் .
3365,கொள்ளை பிறர்க்கு உரிமையாம் பொருளை வல்லாண்மையால் ஒரு சேரக் கொள்வதும் அழிவு செய்வதும் கொள்ளை ஆகும்.
3366,"கொள்வதால் பெற்ற பெயர் எனினும், கொள்ளும் போது கொள்ளி வைத்து ஊரையே அழிப்பதும் செய்தனர்."
3367,பகைவர் நாட்டை அழிப்பதில் அவ்வளவு கொடுமை.
3368,ஆங்குள்ள பொருள் களைக் கவர்வதுடன் பெண்டுகளையும் கொண்டு வந்தனர்.
3369,கொண்டு வந்த மகளிர் கொண்டி மகளிர் எனப்பட்டனர்.
3370,"அவர்கள் வைக்கப்பட்ட வளாகம் கொண்டி எனவும், வேளம் எனவும் வழங்கப்பட்டன."
3371,கொள்ளை நோய் தொற்றுநோய் ஒருவர்க்கு வந்தால் அவரையும் அவர் பயன்படுத்தியவற்றையும் நெருங்கியவர்க்கும் தொற்றித் துயர் ஊட்டும்.
3372,ஆனால் இக்கொள்ளை நோய் அதனினும் கொடிது.
3373,கொள்ளை நோய் உயிர் கொல்லி நோய் ஒருவர்க்கு அது வந்தால் அவரை நெருங்கியவரை யெல்லாம் உயிர் வாங்கும் கொடியது.
3374,பெருவாரி நோய்.
3375,எலியால் ஏற்படும் இந்நோய் அருமுயற்சியால் அழிக்கப்பட்டுள்ளது.
3376,ஆயினும் கழிச்சல் காலரா நோய் என்னும் பெயரால் ஆங்காங்குத் தோன்றி நான் அழிந்திலேன் என அடையாளம் காட்டாமல் இல்லை.
3377,பெரிய அம்மை நாட்டில் ஒழிக்கப்பட்டாலும் தலைகாட்டவில்லை என்று சொல்ல முடியாமை போன்றது இது.
3378,கொள்ளையில் போதல் கொள்ளையில் போதல் கொள்ளை நோயில் இறத்தல்.
3379,கொள்ளை என்பது பெருங்களவை ஊரெல்லாம் திரட்டியடித்துக் கொண்டு போன பெருங்களவை க் குறிக்கும்.
3380,கொள்ளை என்பது மிகுதிப் பொருளது.
3381,கொள்ளை விலை கொள்ளை கொள்ளையாய் விளையும் என்பவற்றில் கொள்ளை மிகுதிப் பொருளதாதல் அறிக.
3382,அதுபோல் பலரை ஒருங்கே கொல்லும் கொடிய கழிச்சல் நோய் காலரா கொள்ளை நோய் எனப்படும்.
3383,பெரியம்மை நோயும் ஒரு காலத்தில் கொள்ளை நோயாக இருந்தது.
3384,எலி வழியே பற்றும் பிளேக் என்பதோ பெருங்கொள்ளை நோய்.
3385,இந்நோய்கள் மக்களைப் பெரிய அளவில் வாட்டிய நாளில் கொள்ளையில் போதல் என்னும் வழக்கு எழுந்தது என்க.
3386,களமலி குப்பை காப்பில வைகவும் புறம்.
3387,அடையா நெடுங்கதவும் அஞ்சலென்ற சொல்லும் கம்பர்.
3388,கள்வார் இலாமைப் பொருட்காவலும் இல்லை கம்.
3389,என்பவை போல்வன கற்பனையோ இட்டுக்கட்டலோ எதிர்கால எதிர்பார்ப்போ என்று எண்ண வைக்கின்றன.
3390,கொறி கொறிப்பு என்பது மெல்லுதல் சற்றே கடுமையாக மெல்லுதலே கொறித்தல் எனப்படும்.
3391,"கொறித்தல் மணி, கொட்டை, தவசம், பருப்பு முதலியவற்றை அணில் தின்னல் போல் நுனிப் பல்லால் கடித்துத் தின்னல் கொறித்தலாகும்."
3392,"குளிருக்குக் கொறி என்று பயறு, கடலைகளை வறுத்துத் தருவது இன்றும் சிற்றூர் வழக்கமாம்."
3393,"கடித்தலுக்குக் கடைவாய்ப் பல்லும், கொறித்தலுக்கு முன்வாய்ப் பல்லும் பயன்படல் வேறுபாடாம்."
3394,கொற்கை கொற்கையில் இருந்த வெற்றிவேற் செழியனைச் சிலம்பு பாடுகின்றது.
3395,"வெற்றி வேற்கை வீரராமன் கொற்கையாளி குலசேகரன் புகல் நூல், இளஞ் சிறுவரும் அறிந்தது!"
3396,கொற்கையின் சிறப்பை முதற்கண் ஆய்வின் வழியே உலகுக்கு உணர்த்தியவர் முனைவர் கால்டுவெல்!
3397,கோநகர் கொற்கை என்னும் நூல் வழியே கொற்கையைத் தடம்பதித்துக் காட்டியவர் நுண்கலைச் செல்வர் அ.இராகவன்.
3398,அறிஞர்கள் கொற்கையின் இடமும் தடமும் கண்டு தெளிந்துள்ளனர் ஊர்ப் பெயர்க் கரணியம் பற்றியும் அறியத் தலைப்பட்டுள்ளனர்.
3399,"கொற்கை என்பது, கொல்கே, கொல்கீ என்று கிரேக்க நாட்டவராலும் உரோம நாட்டவராலும் குறிக்கப் பெற்றுள்ள தாம்!"
3400,திருச்செந்தூர் கல்வெட்டு ஒன்றில் கொல்கை என்ற குறிப்புள்ளதாம்.
3401,ஆதலால் கொல்கை என்னும் பெயரே கொற்கை ஆகியிருக்க வேண்டும் என்று அறிஞர் கால்டுவெல் ஒரு முடிவுக்கு வந்தார்.
3402,கொல்கை என்பதைக் கொல் கை எனப் பிரித்துக் கொலை செய்யும் கை போன்றது என்று பொருள் கண்டார்.
3403,தொன்முது மாந்தன் கொல் கருவி கையாகவே இருந்ததாகலின் அப்பெயர்ப் பொருத்தத்தால் கொற்கையாகி இருக்க வேண்டும் என்று விளக்கினார்!
3404,கொற்கையில் இருந்தவர் மட்டுமோ கொல்கையர்?
3405,இக்கொடுமைப் பெயரையோ தம் ஊர்க்குச் சுட்டி உவகையுறுவர்?
3406,முனைவர் கால்டுவெல் வரைந்த திருநெல்வேலி வரலாற்று நூலை மொழி பெயர்த்தவர் முனைவர் திரு.ந.சஞ்சீவி.
3407,அவர் இவ்வாய்வுக்கு ஒரு மேல் விளக்கக் குறிப்புக் காட்டினார்.
3408,அதற்குக் கடற்கரை மெலிக்கும் காவிரிப் பேரியாறு என்னும் சிலம்பின் அடியையும் மேற்கோள் காட்டினார்.
3409,இஃது அலைத் தாக்குதலை நிறுவும் சான்றே யன்றி ஊர்ப் பெயர் அமைதிக்கு உரிய சான்றாகாது என்பது வெளிப்படை.
3410,பொருளோடு பொருந்துவது அன்றாம்.
3411,"ஆனால், கொல் என்னும் சொல் பற்றி ஆய்ந்தே ஒரு முடிவுக்கு வர வேண்டும்!"
3412,கொல் என்பதன் பொருள் கொலைத் தொழிலொடு தொடர்பு கொண்டதோ?
3413,கொல்லுத் தொழிலொடு தொடர்பு கொண்டதோ?
3414,முதற்கண் ஆய்வுக்குரிய செய்தி ஈதே.
3415,ஒரே சொல் மூலத்தின் வழியே அமையும் பலபொருட் புணர்ச்சியை முட்டுறா வகையில் அமைத்தலே சங்கச் சான்றோர் வழக்கு.
3416,அவ்வழக்கினைக் கொண்டு ஆய்தலே முட்டறுத்து முடிவுறுத்த வல்லதாம்!
3417,கொல்லுதல் தொழில் சுட்டும் புணர்ச்சிகள் எல்லாம் இயல்பு வழிப்பட்டன.
3418,"கொல்குறும்பு, கொல்படை, கொல்பிணி, கொல்புனம், கொல்களிறு என்றே பழ நூல்களில் பயின்றுள."
3419,"கொற்குறும்பு, கொற்படை, கொற்பிணி, கொற்புனம், கொற்களிறு என எங்கும் லகரப் புள்ளி, றகரப் புள்ளியாய்த் திரிந்தன அல்ல."
3420,பல்குழுவும் பாழ்செய்யும் உட்பகையும் வேந்தலைக்கும் கொல்குறும்பும் இல்லது நாடு திருக்.
3421,சொல்லுறழ் மறவர்தம் கொல்படைத் தரீஇயர் பதிற்.
3422,கொல்படை தெரிய வெல்கொடி நுடங்க பதிற்.
3423,கொல்பிணி திருகிய மார்புகவர் முயக்கம் பதிற்.
3424,கொல்புனக் குருந்தொடு கல்லறைத் தாஅம் அகம்.
3425,இருஞ்சே றாடிய நுதல கொல்களிறு நற்.
3426,கொல்களிற்று ஒருத்தல் நற்.
3427,கொண்டி மறவர் கொல்களிறு பெறுக பதிற்.
3428,கொல்களிற்று உரவுத்திரை பிறழ பதிற்.
3429,கொடிநுடங்கு நிலைய கொல்களிறு மிடைந்து பதிற்.
3430,கொல்களிறு மிடைந்த பஃறோல் தொழுதி பதிற்.
3431,கொல்களிற்று மீமிசைக் கொடிவிசும்பு நிழற்றும் புறம்.
3432,கடுஞ்சினத்த கொல்களிறும் கதழ்பரிய கலிமாவும் புறம்.
3433,உயர்ந்தோங்கு மருப்பிற் கொல்களிறு புறம்.
3434,"கொல் எனும் இவையெல்லாம், கொலைத் தொழிற் பாற்பட்டு, வல்லின வருமொழி முன் இயல்பாய் நின்றன."
3435,"இனிக், கொல்லுத் தொழில் தொடர்பினவற்றைக் காண்போம்."
3436,"அவ்வாறு தனிச் சிறப்பாகக் கொல்லுத் தொழில் நடந்ததே யாமாயின், அதுதான் யாது என்பதை அறிவதே நிறுவும் சான்றாகும்."
3437,பொன்வகை ஐந்தென முந்தையோர் கண்டனர்.
3438,"அவை இரும்பு, ஈயம், செம்பு, வெள்ளி, தங்கம், என்பன."
3439,அவற்றைக் கொண்டு பணிசெய்வோர் பொற்கொல்லர் எனப் பெற்றனர்.
3440,அது காசு என்னும் நாணயம் செய்யும் கொல்லுத் தொழிலாம்.
