Line Number,Sentence
2894,குழந்தை கையில் கரியோ சுண்ணமோ எழுதுகோலோ கிடைத்தால் இயல்பாக வரைவது வட்டமே.
2895,வளையாமல் வட்டமேது?
2896,ஏன்?
2897,கோடு என்பதே வளைவு என்னும் பொருளதே.
2898,"கோட்டம், கோட்டகம், கோட்டி, கோட்டை இவையும் வளைவே!"
2899,கணை கொடிது யாழ்கோடு செவ்விது என்றாரே வள்ளுவர்.
2900,கோடு வளைவு அன்றோ?
2901,"மலைக்குக் கோடும், மரத்திற்குக் கோடும் வந்தமை வளைவால்தானே!"
2902,ஆகலின் பரவும் ஒன்று வளைதல் அல்லது வட்டமாதல் இயற்கை நியதி.
2903,இது கொண்டு பர் என்பதொடு இகரம் சேர்ந்த பரி வழிச் சொற்கள் வளைதல் பொருள் தருதல் தமிழியல் என்க!
2904,முழுதுறும் வளைவும் உண்டு.
2905,பரி முதற்சொற்கள் வளைதற் பொருளில் வருதலைக் காண்போம்.
2906,வளைதலின் அடிக் கருத்து எப்படி எப்படி அமையுமென விளக்குகிறார் பாவாணர்.
2907,"வளைவு என்னும் பண்பின் பெயரும், வளைதல் என்னும் வினையின் பெயரும் அப்பண்பையும் வினையையும் கொண்ட பொருள்களை ஆகுபெயராகக் குறிக்கும்."
2908,"கோணல், சாய்தல் என்பன வளைதலின் முந்திய நிலைகளாதலின் அவையும் அதனுள் அடங்கும்."
2909,"வேர்ச்சொற் கட்டுரைகள், ."
2910,அவ்வகையில் தன் பெயரைப் பெற்ற விலங்கு குதிரை.
2911,அது குதித்துக் குதித்து ஓடுதலால் குதிரைப் பெயரும் வளையமிட்டுச் செல்லுதலால் பரிப் பெயரும் பெற்றது.
2912,"அதன் ஆற்றல் திறமே, அறிவியல் மூளையிற் பரியாற்றலாய் மின்னளவீடாக இயல்கின்றது."
2913,வளைதலால் பரிப்பெயர் பெற்றதன் நடையும் ஓட்டமும் பரி எனப்பட்டன.
2914,"காலே பரி தப்பின என்னும் குறுந்தொகை செலவையும் , பரீஇ என்பது குதிரைக் கதியாம் ஓட்டத்தையும் புறம்."
2915,குறித்தன.
2916,குதிரை ஓட்டத்திற்குரிய வையாளி வீதி புரவிவட்டம் எனப்படுதல் அறியத் தக்கது சூடா.
2917,.
2918,குதிரை வடிவ விண்மீனாம் அசுவதி பரி எனப்படுவதையும் சூடாமணி சுட்டும்.
2919,அதற்குச் சகடம் என ஒரு பெயர் உண்மையும் அறியத்தக்கது.
2920,சகடம் சக்கரம்.
2921,குதிரை ஏற்றம் பரியேற்றம் எனப்படுதல் எவரும் அறிந்தது.
2922,உடைப்பில் நிறுத்தும் மரத்திற்குப் பரி என்பது பெயர்.
2923,குதிரை மரம் எனக் கூறுவர்.
2924,"பரி நிறுத்துவார் என்பது திருவிளையாடல், பிட்டுக்கு மண் சுமந்த படலத்து வரும் செய்தி."
2925,புறப்பாடல்களில் குதிரை மறம் தனிப்புகழ் வாய்ந்தது.
2926,"பாண்டியர்களின் பெரும்பொருள், குதிரை வாங்குதற்குச் சென்றதை வெளிநாட்டு உலாவாணர் வியந்துரைத்துளர்."
2927,"பரி என்பது பரிவின் மூலம், பரிவாவது அன்பு."
2928,அவ்வன்பும் அவ்வன்பினால் உண்டாம் பாதுகாப்பும் பரி எனப்படும்.
2929,பரி வளைதலாதலும் அன்பாதலும் பிறவாதலும் எப்படி?
2930,"ஆவும் கன்றும், தாயும் சேயும், பறவையும் குஞ்சும், சேவலும் பெடையும் வளைய வருதலை அறியோமோ?"
2931,அன்பினால் மட்டுமோ வளைதல்?
2932,"இதனால் அன்றே வள்ளுவப் பேராசிரியர், அறத்திற்கே அன்புசார் பென்ப அறியார் மறத்திற்கும் அஃதே துணை என்றார் ."
2933,"இவண் சாரச் சாரச் சார்ந்து, தீரத் தீரத் தீரா அன்பு வட்டமாதலைச் சார்புச் சொல்லால் குறித்தமை கொள்ளற் பாலதாம்."
2934,நம்மை மறந்தாரை நாம் மறக்க மாட்டேமால் என்னும் காதலன்பிற் குன்றியதோ அத் தாயன்பு?
2935,"காதல் முருகி முருகி வளர்ந்து, அருணிலைக் காதலாய்ப் பெருகிய தல்லவோ தாய்மை?"
2936,பரி என்பதற்கு வருந்துதல் பொருளும் உண்டு.
2937,இதன் மிகையைக் காட்டப் பரிபுலம்புதல் என்னும் ஆட்சியும் உண்டு.
2938,"பக்கம் சேர்ந்து, பரிபுலம் பினனிவன் தானே தமியன் வந்தனன் அளியன் என்பது சாத்தனார் வாக்கு மணிமே."
2939,.
2940,அன்புப் பொருளாம் பரி வருந்துதல் வருத்தம் ஆமோ!
2941,அது வருந்தாக்கால் எது வருந்துவது?
2942,"அருளாளர் வரலாறுகள், தமக்கு வருந்துவதையோ பொருட்டாக்கி யுரைக்கின்றன?"
2943,பிறபிற உயிர்க்கு இரங்கி பரிந்து இரங்கி வருந்தும் வருத்தத்தை யன்றோ புகல்கின்றன.
2944,"அவர்க்கென வந்த அல்லல் இல்லாமையால் அன்றோ, அல்லல் அருள் ஆள்வார்க்கு இல்லை எனத் திட்டமாக உரைத்தார் திருவள்ளுவர்."
2945,இதற்கு வளிவழங்கு மல்லல்மா ஞாலம் கரியாக சான்றாக இருத் தலைக் கண்டு தெளிக என வழிகாட்டினாரே திருக்.
2946,.
2947,இவற்றை எல்லாம் எண்ணினால் பரி என்பதற்கு வருத்தப் பொருள் வந்த வகை விளங்கும்.
2948,பரி என்னும் சொல்லுக்குக் கண்ட குதிரை என்னும் பொருள் வழியாகச் சில சொற்கள் வளர்ந்துள்ளன.
2949,"அவை பரிக்காரர், பரிக்கோல், பரிமா, பரிமுகம் என்பன."
2950,பரிக்காரர் ஆவார் குதிரைக்காரர்.
2951,குதிரை நடத்துவோர்.
2952,பரிக்கோல் என்பது குத்துக்கோல் பரிக்கோற்காரர் என்பார் குத்துக்கோற்காரர் இவர் யானைப்பாகர்.
2953,"மதத்தாற், பரிக்கோல் எல்லையில் நில்லாத களிற்றைக் காட்டுகிறது தொல்காப்பிய உரை தொல்."
2954,பொருள்.
2955,.
2956,பரிமா என்பது பரியாகிய விலங்கு.
2957,"கரிமா, அரிமா, நரிமா போல வழங்கும் வழக்கு."
2958,பரிமுகம் குதிரைமுக வடிவாக அமைந்த விண்மீன் அசுவிணி பரிமுக வடிவில் அமைந்த படகு பரிமுக அம்பி எனப்பட்டது.
2959,பரிச்சாத்து என்பதொரு சொல்.
2960,சாத்து என்பது வணிகக் கூட்டம்.
2961,வணிகர் தலைவனாக இருந்தவன் மாசாத்தன் எனப் பட்டான் அவன் கோவலன் தந்தை.
2962,"குதிரை வணிகம் பரிச்சாத்து எனப்பட்டு, அவ்வணிகத்தில் ஈடுபட்ட குழுவும் ஆகுபெயரால் பரிச்சாத்து எனப்பட்டது."
2963,வந்தது முதுபரிச் சாத்து என்பது திருவிளையாடற் புராணம் .
2964,பரி இறைவைச் சால் சதுரமானது.
2965,பரி என்பது இறைவைக் கூனை எனப்படும் வட்ட வடிவினது.
2966,பரி என்பது வட்டம் என்னும் பொருளில் வரும் முதனிலை.
2967,"பரிவட்டம், பரிவேடம் என்பவை அறிக."
2968,பரி என்பது இறைவைக் கூனைப் பொருளில் நாகர்கோயில் வட்டார வழக்காக உள்ளது.
2969,"கூன், கூனல், கூனை என்பவை வளைவே."
2970,"பரிகம் பரிகை பரிகம் என்னும் சொல்லுக்கு அகழ், மதிலுள் மேடை, வளைதடி ஆகிய பொருள்கள் வழங்குகின்றன."
2971,"கோட்டை வளைமதில் ஆதலால், அதனைச் சூழ அமைந்த அகழ் வளைந்து கிடப்பது என்பது வெளிப்படை."
2972,"பரி என்பது சூழ்ந்த மதிலைக் குறிப்பதாகி, அதன் மேல் அமைந்த மேடையைப் பரிகம் என்பது குறிப்பதாயிற்று."
2973,அகம் என்பது அம்மெனத் தொகுத்தல் வழக்கம்.
2974,அதன்படி பரியகம் பரிகம் ஆனதென்க!
2975,உ என்பது உயர்வு காட்டும் வேர்.
2976,"உப்பு, உப்புதல், உவணம் என்பவை உயர்வு காட்டுவன."
2977,அவ்வாறே உப்பரிகை உப்பரிகம் என்பவை மதின்மேல் அல்லது மாடிமேல் மாடியைக் குறிப்பதாய் அமைந்தன.
2978,பரி என்பதற்குப் பரிமரம் என ஒருபொருள் உள்ளமை முன்னர்க் கண்டோம்.
2979,அதன் வளர்ச்சிச் சொல்லாகிய பரிகம் என்பது அதன் வளர்ச்சிப் பொருளுக்கும் உரியதாக விளங்கு கின்றது.
2980,அஃது எழுமரம் என்பதாம்.
2981,இவ்வெழுமரம் கோட்டைக் கதவின் உட்புறத்தே குறுக் காகப் போடப்படும் வலியமரம்.
2982,எழூஉத் தாங்கிய கதவு என்பதொரு புறப்பாட்டு .
2983,பரிகம் என ஓர் இருப்புப் படைக் கலம் உண்டென உரைக்கும்.
2984,பரிகலக் குருத்து என்றார் சேக்கிழார் பெரிய.
2985,அப்பூதி.
2986,.
2987,"பரிச் சந்தம் சந்தம் என்பது நறுமணம், அமைதி, அழகு இனிமை முதலிய பொருள்தரும் சொல்."
2988,இத்தகைய பொலிவெல்லாம் திருவிழாவும் பெருவிழாவுமாம் அரசவிழா.
2989,தெய்வ விழாக்களில் சூழ வருதல் கண்கூடு.
2990,ஆதலால் பரிச்சந்தம் என்பது அரச பரிச்சின்னங்களைக் குறிப்பதாயிற்று.
2991,வீசுவெண் சாமராதி பரிச்சந்தம் முழுதும் விட்டார் என்பது மேருமந்திர புராணம் .
2992,பரிச்சின்னம் பரிச்சின்னம் என்பது அரச சின்னம்.
2993,அவை குடையும் கோலும் ஊர்தியும் பிறவுமாய் அரசனைச் சூழ அமைந்தும் வந்தும் பொலிவுறுத்தும் அடையாளங்களாம்.
2994,மணிமுத்தின் பரிச்சின்னம் வரம்பின்றாகக் காட்டுகிறது பெரியபுராணம் திருஞான.
2995,.
2996,பரிவாரம் காண்க.
2997,பரிச்சின்னம் என்பது நினைத்தவை நினைத்தபடி வைக்கப் படுபவை யல்ல!
2998,"இன்னவை இன்ன அளவு, இன்ன வகைத்து என வரம்பு கட்டப்பட்டு வருவது அல்லது அமைவதாம்."
2999,அதனால் பரிச்சின்னம் என்பது அளவிட்டது அல்லது அளவு பட்டது என்னும் பொருள் பெற்றது.
3000,பரிச்சின்ன ஞானம் பரிய என்பது சிவஞான முனிவர் நெஞ்சுவிடு தூது .
3001,பரிச்செண்டு செண்டு வெளி என்பது குதிரை வட்டமிடும் வெளியைக் குறிக்கும்.
3002,செண்டித்தல் என்பது துள்ளியோடல் என்னும் பொருளது.
3003,இன்றும் செண்டித்தல் அப்பொருளில் நாட்டுப்புறங்களில் வழங்குகின்றது.
3004,வளைபந்தைப் போட்டுத் துள்ளித் துள்ளியாடுதல் பரிச்செண்டு எனப்பட்டதாம்.
3005,அவ்வாட்டம் நின்றுகொண்டு ஆடுவதும் சுற்றி வந்து ஆடுவதுமென இருவகைத்தாதல் பெரியபுராணத்தால் அறிய வருகின்றது.
3006,நிலைச்செண்டும் பரிச்செண்டும் வீசிமிக மகிழ்வெய்தி என்பது அது சேரமான்.
3007,.
3008,"பரிசகம் வீடு, மனை, மாளிகை என்பவற்றின் வேறுபட்ட அமைப்பில் தனியே விளங்குமாறு கலைக்கூடங்களை அமைத்தல் வழக்கம்."
3009,அதனை இந்நாள் காட்சிக் கூட அமைப்புகளாக அமைப்பவற்றையும் கொண்டு தீர்மானிக்க முடியும்.
3010,விளக்குவது திருக்கோவையார் .
3011,படிச்சத மாக்கும் படமுளவோ நும் பரிசகத்தே என்பது அது.
3012,இப்பொழுது பரிசகமெனப் புத்தாட்சி ஒன்றும் நடந்து வருகின்றது.
3013,அப் பரிசுச் சீட்டு விற்பனையகம் பரிசகம் எனச் சில இடங்களில் பளிச்சிடுகின்றது.
3014,"பரிசு குலுக்கல், பரிசு வழங்கல் விழாக்களும் பரிய பரிய தலைகள் தலைமையில் நிகழ்கின்றன!"
3015,"இருப்பதை யெல்லாம் இழந்தாலும், ஏதோ ஒன்று விழுந்தால் விழுந்தது பரிசுதானே!"
3016,இது முன்னரே எடுத்துக்காட்டப்பட்டுள்ளது.
3017,ஒரு பெண்ணுக்குத் தலைவன் தரும் கையுறை வேறு.
3018,இவற்றின் வேறானது பரிசம் என்பது வெளிப்பட விளங்கும்.
3019,"ஊரவர்க்கும் உரிமையர்க்கும் அறிவித்து, அவர்கள் சூழ்ந்துள்ள அவையத்தில் அல்லது மன்றத்தில் மணமகன் வீட்டார் மணமகளுக்கு வழங்கும் கொடையே பரிசமாம்."
3020,ஆகலின் அவற்றைத் தனித்தனி விளக்க வேண்டியதில்லையாம்.
3021,"பரிசு கொடைப் பொருள் தருதலானபின் தன்மை, அல்லது குணம் என்னும் பொருளும் தருவதாயிற்று."
3022,கொடையால் புகழ் வருதலின் புகழ் என்னும் பொருளும் அதற்கு உண்டாயிற்று.
3023,பரிசு பெருமைப் படுத்துவதாம் வகையாக அமைந்தமையால் வகை என்னும் பொருளும் தந்தது.
3024,பரிசம் என்பது வட்டப் பெருந்தட்டாக அமைந்த ஓடம் ஆகலின் பரிசுக்கும் அப் பொருள் கண்டனர்.
3025,தக்கனும் எக்கனும் தம்பரிசு அழிய திருவா.
3026,இது புகழ்.
3027,பிள்ளை பரிசு இது என்றால் பெரிய.
3028,திரு.
3029,. இது தன்மை.
3030,நினைந்த அப்பரிசே செய்ய பெரியபு.
3031,மெய்ப்.
3032,இது வகை.
3033,பரிசு சிற்றோடம் செ.ப.க.
3034,அகராதி.
3035,"பரிசு, பெருமைப் பொருள் குறித்த பின்னர், பரிசு கெடுதல் என்பது சீரழிவைக் குறிப்பதாயிற்று."
3036,பரிசு கெட்டவன்ள் பரிசை கெட்டவன்ள் என்பவை வழங்குமொழிகள்.
3037,பரிசு பெறுவார் ஓர் ஒழுங்கொடும் பணிவொடும் பெறுவராகலின் அப்பரிசுக்கு ஒழுங்கு.
3038,வழி என்னும் பொருள்களும் உண்டாயின.
3039,பரிசொடும் பரவிப் பணிவார் என்பது தேவாரம் ..
3040,பரிசை பரிசு பரிசை என ஐகாரம் பெறும்.
3041,அது வெண்கொற்றக் குடை முதலாம் வெற்றி விருதுகளைக் குறிக்கும்.
3042,பரிசை என்பதற்குக் கேடயம் என்னும் பொருளும் உண்டு.
3043,நீடிய பரிசையே மாவட்டணம் நெடிய வட்டம் என்பது சூடாமணி நிகண்டு .
3044,வலயங்கற் பரிசை என்பது இராமாயணம் உயுத்த.
3045,", பா.வே.."
3046,"பரிசை, கேடயம் ஆகலின் அதனைப் பிடிப்பவன் பரிசைக் காரன் எனப்பட்டான்."
3047,குடை பிடிப்போனும் அவ்வாறே பெயர் பெற்றான்.
3048,பரிஞ்சு பரிஞ்சு என்பது இருபொருளுடன் வழங்குகின்றது.
3049,பரிந்து என்னும் சொல் பரிஞ்சு எனப் போலி வடிவம் பெறுதல் ஒன்று.
3050,பரிதல் அன்பு வழிப்பட்டதாகலின் வளைதற் பொருளாதல் தெளிவு.
3051,பரிஞ்சு இறை யழுங்கு கின்றேன் என்பது இராமாயணம் உயுத்த.
3052,", பா.வே.."
3053,இன்னொரு பொருள் வாளின் பிடி என்பது.
3054,வாளின் பிடி வளைவாதல் அறிக.
3055,"பரித்தல் பரித்தல் என்பது சூழ்தல், பொறுத்தல், பூணுதல், கட்டுதல் முதலிய பொருள்களைத் தரும்."
3056,புகழையார் பரிக்கற் பாலார் என்னும் கம்பர் வாக்கு பொறுத்தல் பூணுதல் ஆகிய பொருளது கிட்.
3057,.
3058,மண்டமர்ப் பரிக்கும் மதனுடை நோன்தாள் என்னும் புறப்பாட்டும் தாங்குதல் அல்லது பொறுத்தல் பொருளதே.
3059,உயிர்ப்பிடை பரிப்ப என்பது கட்டுதல் பொருளது கம்ப.
3060,கிட்.
3061,.
3062,பரிதல் பரிதல் வெளிப்படுதல் தோன்றுதல்.
3063,கதிர் ஈனல் என்பது பொதுவழக்கு.
3064,கதிர் ஈனுதலைப் பயிர் பரிதல் என்பது முகவை வட்டார வழக்கு.
