Line Number,Sentence
1,பாவாணர் தமிழ்க்களஞ்சியம் இலக்கணக் கட்டுரைகள் ஙரூபுஹது ஸநிகுணுடகுழூர ஞா.
2,"படிகள் நூலாக்கம் பாவாணர் கணினி தி.நகர், சென்னை ."
3,அட்டை வடிவமைப்பு வ.
4,"மலர் அச்சிட்டோர் ஸ்ரீ வெங்கடேசுவரா ஆப்செட் பிரிண்டர்சு இராயப்பேட்டை, சென்னை ."
5,பாவாணர் வழி நிலை அறிஞர்களான முதுமுனைவர் இரா.
6,"இளங்குமரனார் அவர்களும், மருத்துவர் கு.பூங்காவனம் அவர்களும் இவ்வரிய கட்டுரைப் புதையல்கள் நூல் வடிவம் பெறுவதற்கு மிகவும் உறுதுணையாக இருந்தனர்."
7,இப்பெருமக்களை நன்றியுணர்வுடன் நினைவுகூர்கிறேன்.
8,எதிரிகள் யார்?
9,பாவாணர் நூல்கள் அத்தனையும் தமிழ்மொழிக்கு ஏற்றம் உரைப்பன.
10,தமிழை ஆரிய இருளினின்று மீட்டுக் காப்பன.
11,வீழ்ந்து பட்ட தமிழனுக்கு விழிப்பூட்ட வல்லன.
12,பாவாணரைத் தூக்கிப் பிடித்தால்தான் தமிழினம் உருப் படமுடியும் உயரமுடியும்.
13,இவர்களை இவ்வெளியிட்டின் வாயிலாக நன்றியுணர்வோடு நினைவு கூறுகிறேன்.
14,"தந்தை பெரியாரின் தன்மதிப்பு இயக்கக் கொள்கை களாலும், மொழிஞாயிறு பாவாணரின் தனித்தமிழ் இயக்கக் கொள்கைகளாலும் ஈர்க்கப்பட்டவன்."
15,அத்தகு பின்புலத்தோடு பதிப்புப்பணியில் என் காலடிச் சுவடுகளைப் பதித்து வருகிறேன்.
16,"இளவழகன், பதிப்பாளர்."
17,வான்மழை வளச்சுரப்பு ஆழத்துள் ஆழமாய் அகழ்ந்து தங்கம் ஏன் எடுக்கப்படுகிறது?
18,"ஆழ்கடலுள் சென்று, உயிரைப் பணயம் வைத்து முத்துக் குளிக்கப் படுவது ஏன்?"
19,பவழப் பாளங்களை எடுப்பது ஏன்?
20,வயிரம் முதலாம் மணிக்குலங்களை இடையறாமல் தேடித் தேடி எடுப்பது ஏன்?
21,அணிகலப் பொருள்கள் என்பதற்கு மட்டுமா?
22,இவற்றினும் மேலாம் வைப்பு வளமும் உண்டோ?
23,அவை சான்றோர் நூல்கள்!
24,காலம் காலமாக அள்ளிக் கொண்டாலும் வற்றா வளமாய்த் திகழும் அறிவுக் கருவூலமாம் நூல்கள்!
25,ஒன்றைக் கற்றால் ஒரு நூறாய் ஓராயிரமாய்ப் பல்கிப் பெருகத் தக்க பெறற்கரிய தாய் நூல்களாம் பேறமைந்த நூல்கள்!
26,சேய்நூல்களை ஈனவல்ல செழு நூல்கள்!
27,நுண் மாண் நுழைபுலத் தாய் நூல்களாய் இருப்பினும்!
28,"அவற்றைத் தாங்கிய தாள்கள், எத்தகைய பேணுதல் உடையவை எனினும் கால வெள்ளத்தில் அழியக் கூடியவை தாமே!"
29,"கல்லெழுத்தே, கதிர் வெப்பாலும் கடலுப்பாலும் காத்துப் பேணும் கடப்பாடில்லார் கைப்படலாலும் அழிந்து பட்டமை கண்கூடு தானே!"
30,"அக்கடமையை அவர்கள் காலந்தோறும் கடப்பாடாகக் கொண்டு செய்ய, ஆளும் அரசும் வாழும் அறிவரும் அருந்நுணையாதல் தானே கட்டாயத் தேவை!"
31,"இவ்வாறு பதிப்பரும் அறிவரும் ஆள்நரும் தத்தம் மூச்சுக் கடனாக, நூற்கொடை புரிதலுக்கு மேற்கொடை இல்லையாம்!"
32,மொழிஞாயிறு பாவாணர் நூல்கள் ஒன்றா இரண்டா?
33,நமக்கு எட்டாதவை போக எட்டிய நூல்கள் .
34,கட்டுரை பொழிவு முதலாம் வகையால் கிட்டிய திரட்டு நூல்கள் .
35,இன்னும் எட்டாத தொகுப்பும் அங்கொன்றும் இங்கொன்றும் வர வாய்ப்புண்டு!
36,கடித வரைவு பா வரைவு என மேலும் பெருகவும் வாய்ப்புண்டு!
37,"இவற்றை எல்லாம் ஆயிரம் அச்சிட்டு அவ்வளவில் நின்று விட்டால், தேடுவார்க்குத் தேடும் பொழுதில் வாய்க்கும் திருவாகத் திகழக் கூடுமோ?"
38,மிக வேண்டும்!
39,இத்தகைய விழுமிய வீறுடையர் இனமானச் செம்மல் தமிழ்ப் போராளி திருத்தகு கோ.
40,தமிழுலகம் பயன் கொள்வதாக!
41,பயன் செய்வதாக!
42,வாழிய நலனே!
43,வாழிய நிலனே!
44,இன்ப அன்புடன் இரா.
45,உள்ளடக்கம் பக்கம் பதிப்புரை வான்மழை வளசிறப்பு நூல் .
46,தொல்காப்பியச் சூத்திரக் குறிப்புரை .
47,இலக்கணவுரை வழுக்கள் .
48,உரிச்சொல் விளக்கம் .
49,ஙம் முதல் .
50,தழுவுதொடரும் தழாத்தொடரும் .
51,நிகழ்கால வினை .
52,படர்க்கை இ விகுதி .
53,"காரம், காரன், காரி ."
54,குற்றியலுகரம் உயிரீறே .
55,குற்றியலுகரம் உயிரீறே .
56,ஒலியழுத்தம் .
57,தமிழெழுத்துத் தோற்றம் .
58,நெடுங்கணக்கு அரிவரி .
59,தமிழ் எழுத்து மாற்றம் .
60,தமிழ் நெடுங்கணக்கு .
61,ஐ ஔ அய் அவ் தானா?
62,எகர ஒகர இயற்கை .
63,அல்லாக்கால் அகத்திய முள்ளிட்ட முதனூலாராய்ச் சியே அமைந்திருக்கும்.
64,இஃதோர் அடக்க வழுவமைதி யென்றே கொள்க.
65,குறிப்புகள் வருமாறு .
66,சகரக் கிளவியும் அவற்றோ ரற்றே அஐ ஔஎனும் மூன்றலங் கடையே.
67,என்பது நன்னூல் மயிலைநாதர் உரை மேற்கோள்.
68,தமிழில் இதுபோதுள்ள சகரமுதற் சொற்கள் நூற்றுக்கு மேற்படு கின்றன.
69,சொற்களெல்லாம் ஆதியிலேயே அமைந்துள்ளன.
70,ஒலிக்குறிப்புச் சொற்களும் பிற குறிப்புச் சொற்களுமே புதிது புதிதாய்த் தோன்றுவனவாம்.
71,"சங்கிலி, சந்தம், சலி, சடுதி, துப்பாக்கி, குடாக்கு, கிண்கிணி, சதங்கை, மிருதங்கம் போல்வன ஒலிக்குறிப்புச் சொற்கள் ."
72,"சடை, சருச்சரை, சப்பாணி, பச்சை, மதர்ப்பு, மெத்தை முதலியன பிற குறிப்புச் சொற்கள்."
73,ஒருசார் திரிசொற்களும் புதிதாய்த் திரிக்கப்படுவனவாம்.
74,குற்றிய லுகரம் முறைப்பெயர் மருங்கின் ஒற்றிய நகரமிசை நகரமொடு முதலும் தொல்.
75,இதை விரித்துரைத்து விதியும் அறிந்துகொள்க என்பது நன்னூல் மயிலைநாத ருரை.
76,மகரத் தொடர்மொழி மயங்குதல் வரைந்த னகரத் தொடர்மொழி ஒன்பஃ தென்ப புகரறக் கிளந்த அஃறிணை மேன தொல்.
77,ஒன்பதிற்கு முதலாவது வழங்கின பெயர் தொண்டு என்பது.
78,தொண்டு பத்து தொண்பது தொன்பது ஒன்பது.
79,ஒன்பது .
80,எழுபது எண்பது ஒன்பது என்று ஒப்புநோக்குக.
81,தொண்டு நூறு தொண்ணூறு .
82,"எழுநூறு, எண்ணூறு, தொண் ணூறு என்று ஒப்புநோக்குக."
83,தொண்டு ஆயிரம் தொள்ளாயிரம் .
84,"ஏழாயிரம், எண்ணா யிரம், தொள்ளாயிரம் என்று ஒப்புநோக்குக."
85,தொண்டு என்னும் பெயர் எங்ஙனமோ தொல்காப்பியர் காலத்தில் உலக வழக்கற்றது.
86,ஆயினும் செய்யுள் வழக்கிலிருந்தது.
87,என்று கூறியுள்ளார்.
88,பின்பு ஆயிரத்தாம் தானத்திற்கு ஒன்பதாயிரம் என்ன வேண்டியதாயிற்று.
89,சொற்படி பார்ப்பின் ஒன்பதினாயிரம் ஆகும்.
90,ஒன்று முதல் பத்துவரை ஏனை யெண்ணுப் பெயர்களெல்லாம் தனி மொழிகளாகவும் ஒன்பதுமட்டும் தொடர்மொழியாயு மிருத்தல் காண்க.
91,தொன்பது என்னும் பெயரே முதன்மெய் நீங்கி ஒன்பது என வழங்கும்.
92,தெலுங்கில் முதன்மெய் நீங்காது தொனுமிதி எனவே வழங்குகின்றது.
93,சொற்கள் எங்ஙனம் நிலைமாறினும் புணர்ச்சி செய்யுங்கால் சொற்றொடர்ப்படியே செய்யவேண்டும்.
94,நும்மென் ஒருபெயர் மெல்லெழுத்து மிகுமே தொல்.
95,நிலைமொழி விகாரமொழி எட்டாம் வேற்றுமை யானாற்போல நும்மென்னு நிலைமொழி விகாரம் முதற் வேற்றுமையா மென்க எனக் கூறியுள்ளார் பிர.
96,", உரை."
97,நீன் என்னும் வடிவை இன்னும் தென்னாட்டுலகவழக்கிற் காணலாம்.
98,"தான் என்பது தன் என்று குறுகினாற்போல, நீன் என்பது நின் என்று குறுகும்."
99,நீன் என்பது இலக்கண வறியாமை காரணமாகக் கொச்சையாகக் கருதப்படு கின்றது.
100,நீனுக்குப் பன்மை நீம் என்பது.
101,மகரம் பன்மைப் பொருளுணர்த் தலை ஆங்கில இலக்கண நூல்களிலும் காணலாம்.
102,நீங்கள் என்பது விகுதிமேல் விகுதி பெற்ற இரட்டைப் பன்மை.
103,நீவிர் என்பது இலக்கணப் போலி.
104,நீயிர் என்னும் சொல்லே நீர் என இடைக்குறைந்து நின்றது.
105,இங்ஙனமன்றி நும் என்பது நீயிர் எனத் திரியுமென்றல் ஒன்பது பத்து தொண்ணூறு என்றதனோ டொக்குமென்க.
106,இயற்சொல் திரிசொல் திசைச்சொல் வடசொலென் றனைத்தே செய்யுள் ஈட்டச் சொல்லே.
107,வடசொற் கிளவி வடவெழுத் தொரீஇ எழுத்தொடு புணர்ந்த சொல்லா கும்மே.
108,இச் சூத்திரங்களால் மொழியாராய்ச்சி சிறிது முட்டுப்படுகின்றது.
109,வடசொற்கள் தொல்காப்பியர் காலத்து நூல்களில் வழங்கினவாகத் தெரியவில்லை.
110,தொல்காப்பியத்தில் வடசொல்லென் றையுறக் கிடக்கும் சில சொற்கள் செந்தமிழ்ச் சொற்களே.
111,இடப்பெயரும் இயற்பெயருமான சில வடசொற்களே வடவெழுத் தொருவியும் ஒருவாதும் வழங்கியிருத்தல் வேண்டும்.
112,அல்லாக்கால் தென்சொற்களே வடசொற்களாகத் திரிபுணர்ச் சியாற் கருதப்பட்டிருத்தல் வேண்டும்.
113,தொல்காப்பியர் சுருக்கமாகக் குறித்துள்ள வடசொல்லைப் பவணந்தியார் விரிவாகக் கூறிவிட்டனர்.
114,பெண்பால் ஐயை.
115,ஆசிரியன் ஆசு இரியன்.
116,"ஆசு குற்றம், இரிதல் போக்குதல்."
117,அந்தணன் அந்தண ரென்போர் அறவோர்மற் றெவ்வுயிர்க்கும் செந்தண்மை பூண்டொழுக லான் குறள்.
118,இராவணன் இராவண்ணன்.
119,இரா இருள் கருமை.
120,இருள்நிறப் பன்றியை ஏன மென்றலும்தொல்.பொருள்.
121,கும்பகர்ணன் கும்பகன்னன்.
122,கன்னம் காது.
123,இராக்கதன் இரா கதன் கதி அன் கதன்.
124,கதி செலவு இரவில் செல்லுபவன் இதே பொருளில் நிசாசரன் என்பர் வடமொழியில்.
125,நிசி இரவு சரம் செலவு.
126,இராக்கதன் இராக்கன் அரக்கன்.
127,ராக்ஷஸன் என்பதன் திரிபன்று.
128,அரக்கன் என்பதற்கு அழிப்பவன் என்றும் பொருள் கூறலாம்.
129,இத்துணையும் சில மாதிரிக் கெடுத்துக் கூறப்பட்டன.
130,இங்ஙனமே ஏனையவும்.
131,இவற்றின் விரிவை யெல்லாம் எமது முதற்றாய்மொழியிற் கண்டுகொள்க.
132,உச்ச காரம் இருமொழிக் குரித்தே.
133,தொல் எழுத்து.
134,"உசு, முசு என்ற இரு சொற்களே யன்றி, பசு, கொசு முதலிய பிறவும் உச்சகார வீற்றுச் சொற்களாதல் காண்க."
135,பசுவென்பதை ஆரியச் சிதை வென்பர் நச்சினார்க்கினியர்.
136,அது அஃதன்று.
137,ஒன்றறி கிளவி தறட வூர்ந்த குன்றிய லுகரத் திறுதி யாகும் தொல்.
138,து ஒன்றுமே அஃறிணை ஒருமை விகுதியாம்.
139,ஏனைய அதன் புணர்ச்சித் திரிபாம்.
140,எடு போ இன் து போயிற்று.
141,போ இன் அ து போயினது.
142,பால் து பாற்று.
143,"தாள் து தாட்டு, குறுந்தாட்டு."
144,"கண் து கட்டு, குண்டுகட்டு."
145,அம்ம என்னும் அசைச்சொல் நீட்டம் அம்முறைப் பெயரொடு சிவணா தாயினும் விளியொடு கொள்ப தெளியு மோரே.
146,அம்ம என்பது முறைப்பெயரோடு சிவணாமைக்கு எத்துணையோ காலஞ் சென்றிருத்தல் வேண்டும்.
147,அம்ம என்னும் முறைப்பெயர் விளியே கேட்பிக்கும் பொருளில் வரும்.
148,எடு அம்மை அம்மே!
149,ஐயன் ஐய!
150,அன்னை அன்னே!
151,அப்பன் அப்பா!
152,அச்சன் அச்சோ!
153,அத்தன் அத்தோ!
154,மெலித்தல் .
155,ஒன்றன் படர்க்கை தறட வூர்ந்த குன்றிய லுகரத் திறுதி யாகும்.
156,இது முன்னர்க் கூறப்பட்டது.
157,ஆஏ ஓஅம் மூன்றும் வினாஅ தொல்.
158,"இதில் எ, யா கூறப்படவில்லை."
159,"எ, ஏகாரத்தினும், யா, ஆகாரத்தினும் அடங்குமெனக் கொண்டார் போலும்."
160,நச்சினார்க்கினியர் உரையும் அஃதே.
161,ஒவ்வும் அற்றே நவ்வலங் கடையே தொல்.
162,இதில் நொ பகுதியாகக் கூறப்பட்டுள்ளது.
163,ஆனால் நோ என்பதே பகுதியாகி நொ எனக் குறுகி நிற்கும்.
164,"ஓசை நிறைத்தற்பொருட்டு ஒற்றில்வழி ஒற்றாக்குதலின், ஈண்டு ஆய்தமும் ஒற்றாய் வருமெனக் கொள்க என்றார் மயிலைநாதர்."
165,ஆகவே குறிலிணைக்கீழ் ஆய்தம் வாராதென்பது பெறப்பட்டது.
166,விகுதி புணர்ந்து கெடுவது இங்கிலீசு சமற்கிருதம் போன்ற ஆரியமொழிகட் கியல்பேயன்றித் தமிழுக்கியல்பாகாது.
167,", என்னும் வினைகள் இறந்த காலத்தில் விகுதி பெற்றிழந்து மீண்டும் பகுதி யளவாகவே யிருக்கும்."
168,"விகுதி புணர்ந்து கெடுவதாயின், அங்ஙனம் கெடாத சில வினைகளு மிருத்தல்வேண்டும்."
169,அங்ஙன மின்மையின் செய் என்னும் வாய்பாடே ஏவலொருமை யென்று துணியப்படும்.
170,"மேலும், செய்யாய் என்பது முன்னிலை எதிர்மறை ஒருமை எதிர்கால வினைமுற்றுச் சொல்."
171,ஏவலொருமை விகுதி புணர்ந்து கெடுவதாயின் ஏவற்பன்மையும் விகுதி புணர்ந்து கெடல் வேண்டும்.
172,"அங்ஙனம் கெடாமையின், ஒருமை விகுதி மட்டும் புணர்ந்து கெடுமென்றல் பொருந்தாது."
173,இன்னோரன்ன இடங்களிலெல்லாம் வடமொழியியல் வேறு தென்மொழியியல் வேறு என்பதைத் தெற்றென வுணர்தல் வேண்டும்.
174,கோள் என்பது ஒரு முதனிலை திரிந்த தொழிற்பெயர்.
175,பின்பு படு என்னும் துணைவினை சேர்ந்து அதுவும் முதனிலை திரிந்து பாடு என்றாயிற்று.
176,பாடு என்பது விகுதியாயின் கோள் என்பது பகுதியாதல் வேண்டும்.
177,அங்ஙனமாகாமையின் அஃதுரை யன்மை யறிக.
178,"புறப்படு, கடப்படு என்பவை புறப்பாடு கடப்பாடு என்றானாற்போலக் கோட்படு என்பதும் கோட்பாடு என்றாயிற்று."
179,வாய்பாடு என்பதிலோ வெனின் அதிலும் படு என்னும் துணை வினையே முதனிலை திரிந்ததாதல் வேண்டும்.
180,அவர் தமிழிலக்கணத்தையே அறியார்.
181,எழுவாய்க்கு இயற்கை வடிவன்றி வேறுருபில்லை யென்று தொல்காப்பியமும் நன்னூலும் துலங்கக் கூறும்.
182,வேற்றுமை உருபெல்லாம் பெயர்க்கு ஈறாயன்றித் தமித்து வாரா.
