Line Number,Sentence
5867,நாம் சம்மதித்த தனால்தான் அவர் போனார்.
5868,ஆதலால் அவரிடம் ஒரு குற்றமும் இல்லை.
5869,வாழ்க தோழியே!
5870,நான் ஒன்று சொல்லுகின்றேன் கேள்!
5871,அவர்களை வேடர்கள் இல்லாத வேறு வழியில் நடந்து போகும்படி செய்யும்.
5872,இத்தகைய பாலைவனத்தைக் கடந்து சென்ற அவரை நாம் தடை செய்யவில்லை!
5873,அப்பொழுது நாம் தடுக்காமல் ஒருப்பட்டோம்.
5874,இப்பொழுது வருந்துவதால் பயன் இல்லை பாட்டு அம்ம வாழி!
5875,முன்னின்று பனிக்கடும் குரையம் செல்லா தீம் எனச் சொல்லினம் ஆயின் செல்வர் கொல்லோ!
5876,பதவுரை வாழி தோழி அம்ம ஒன்று சொல்லுகின்றேன் கேள்.
5877,ஆற்று அயல் இருந்த வழியின் பக்கத்திலேயிருந்த.
5878,இரும் தோட்டு கூட்டமாகிய.
5879,அம்சிறை அழகிய சிறகுகளையும் நெடும்கால் நீண்ட கால்களையும் உடைய.
5880,கணந்துள் கணந்துள் என்னும் பறவைகள்.
5881,ஆள் அறிவுறீஇ தமக்குத் துன்பம் செய்யும் வேடர்கள் இருப்பதை அறிவித்து.
5882,ஆறுசெல் வழியிலே நடந்து செல்லுகின்ற.
5883,வம்பலர் படை புதியவர்களின் கூட்டத்தை.
5884,தலை பெயர்க்கும் வேறு வழியாக நடந்து போகும்படி செய்கின்ற.
5885,மலை உடை கானம் நீந்தி மலையமைந்த காட்டைக் கடந்து.
5886,நிலையாப் பொருள் நிலையற்ற செல்வத்தின்.
5887,பிணி ஆசையினால்.
5888,பிரிந்திசினோர் ஏ பிரிந்து சென்றவரை.
5889,முன்நின்று அவர் பிரியும் போது அவர் எதிரிலே நின்று.
5890,பனிகடும் குரையம் இனிவரும் பனிக்காலத்தின் கொடுமை தாங்க மாட்டோம்.
5891,செல்லாதீம் ஆதலால் பிரிந்து செல்லாதீர்.
5892,எனச் சொல்லினம் ஆயின் என்று சொல்லியிருப்போம் ஆனால் செல்வர் கொல் ஒ அவர் பிரிந்து போயிருப்பாரோ?
5893,கருத்து தலைவர் பிரியும் போது போக வேண்டாம் என்று தடுத்திருந்தால் அவர் போயிருக்க மாட்டார்.
5894,விளக்கம் தலைவன் பிரிவால் வருந்தியிருந்த தலைவியைப் பார்த்துத் தோழி கூறியது.
5895,இது ஆலத்தூர் கிழார் என்னும் புலவர் பாட்டு.
5896,வாழி தோழி அம்ம என்று முதலடி மாற்றப்பட்டது.
5897,கடும் குரையம் கடுமையை உடையோம்.
5898,செல்லாதீம் செல்லாதீர்.
5899,இரும்தோடு பெரிய தொகுதி.
5900,கணந்துள் கூட்டமாக வசிக்கும் ஒரு வகைப் பறவை.
5901,மலை உடை கானம் மலை அருகில் உள்ள பாலைவனம்.
5902,"உறீஇ உயிர் அளபெடை ஏ, ஓ அசைகள்."
5903,இனி பழிக்க இடமில்லை பாட்டு தலைவனுடைய உறவினர் தலைவியினுடைய பெற்றோரை அணுகினர்.
5904,தலைவனுக்குப் பெண் கேட்டனர்.
5905,அவர்களும் ஒருப்பட்டனர்.
5906,இந்நிலையில் உள்ள தலைவியைப் பார்த்துத் தோழி கூறுவதாக அமைந்தது இச்செய்யுள்.
5907,வளையலை அணிந்த தலைவியே நீ சிறிதும் அஞ்ச வேண்டாம் நான் மிகவும் மகிழ்ச்சியடைகின்றேன்.
5908,"விரைந்து செல்லும் தன்மையையும் வளைந்த கால்களையும் உடைய நண்டுகள், வளையிலே வாழும் தன்மையுள்ளவை."
5909,அவை கடற்கரையிலே தம்முடைய கூர்மையான நகங்களால் ஈர மணலிலே கோடுகள் போட்டிருக்கின்றன.
5910,"அவருக்குப் பெண் கேட்டு வந்தவரிடம், நீ அவருக்கே உரிமையானவள் என்று உரைத்துச் சம்மதம் தெரிவித்தனர் நமது பெற்றோர்."
5911,பாட்டு வளையோய்!
5912,பதவுரை வளையோய் வளையலை அணிந்த தலைவியே.
5913,உவந்திசின் நான் மகிழ்ச்சியடைந்தேன்.
5914,விரைவுறு கொடும்தாள் விரைந்து செல்லும் வளைந்த கால்களையுடைய.
5915,அளை வாழ் அலவன் வளையிலே வாழ்கின்ற நண்டுகளின்.
5916,கூர் உகிர் விரித்த கூர்மையான நகங்களால் கிழித்த.
5917,ஈர்மணல் ஈரமான மணலிலே.
5918,மலிர்நெறி விளங்குகின்ற கோட்டொழுங்கு.
5919,சிதைய அழையும் படி.
5920,இழும்என இழும் என்ற தன்மையுடன்.
5921,உரும் இசை இடியோசை பொருந்திய.
5922,புணரி உடைதரும் அலைகள் மறிந்து வீழ்கின்ற.
5923,துறைவர்க்கு நீர்த்துறையை உடைய தலைவருக்கு.
5924,உரிமை செப்பினர் நீ உரிமையாவாய் என்று கூறினர்.
5925,நமர்ஏ நமது பெற்றோர்.
5926,விரி அலர் புன்னை ஓங்கிய ஆதலால் மலர்கள் விரிந்த புன்னை மரங்கள் வளர்ந்த.
5927,புலால் அம்சேரி புலால் நாற்றம் வீசும் சேரியில் உள்ள.
5928,இன்நகை ஆயத்தாரோடு இனிய நகைப்பையுடைய பெண்கள் கூட்டத்தோடு.
5929,இவ்அழுங்கல் ஊர் ஏ இந்த ஆரவாரத்தை யுடைய ஊரில் உள்ளவர்களும்.
5930,இன்னும் அற்று ஏ இன்னும் முன் போல் பழி கூறுவரோ.
5931,கருத்து தலைவருக்கு உன்னை அளிக்கப் பெற்றோர் உடன் பட்டனர்.
5932,நீ அஞ்சற்க.
5933,விளக்கம் இச்செய்யுள் அம்மூவன் என்னும் புலவரால் பாடப்பட்டது.
5934,தலைவனுடைய உறவினர் பெண் கேட்க வந்தனர்.
5935,"அப்பொழுது தலைவி, தம் பெற்றோர் என்ன சொல்லினரோ என்று அஞ்சினாள்."
5936,"அதைக்கண்ட தோழி, தலைவிக்கு உண்மையை எடுத்துரைத்தாள்."
5937,தோழி கூற்று.
5938,நெய்தல் திணை.
5939,"இவ் அழுங்கல் ஊரே, இன்னும் அற்றோ என்று இறுதி அடி மட்டும் மாற்றிப் பொருள் கூறப்பட்டது."
5940,கொடும்தாள் வளைந்த கால்.
5941,அளை புற்று.
5942,மலிர் விளங்குகின்ற.
5943,இழும்என இழும் என்பது தொடர்ச்சியாகக் கேட்கும் ஓசை.
5944,அழுங்கல் ஆரவாரம்.
5945,ஏ அசை.
5946,இரவிலே எப்படி அறிந்தாய்?
5947,பாட்டு இரவிலே தலைவியைச் சந்தித்துக் கலந்து மகிழ்ந்து செல்வான் காதலன்.
5948,ஒருநாள் இரவு நல்ல மழை பெருமழை எங்குப் பார்த்தாலும் வெள்ளக்காடு.
5949,ஒரே இருட்டு.
5950,அந்த இருட்டிலும் நற்றிரவிலே அக்காதலன் தலைவியைக் காண வந்துவிட்டான்.
5951,அதைக் கண்டாள் தோழி அவன் அவ்வாறு இரவிலே வருவதை அவள் விரும்பவில்லை.
5952,தலைவியின் களவு மண வாழ்வையும் விரும்பவில்லை.
5953,"அவனும் தன் தலைவியும், கற்புமணம் புரிந்து கொண்டு வெளிப்படையாக வாழவே விரும்பினாள்."
5954,"ஆதலால், தலைவன் வருகையைக் கண்டு வருந்துவது போல அவனிடம் நீ இரவில் எப்படி வந்தனை என்று கேட்டாள்."
5955,உயர்ந்த மலையையுடைய தலைவனே விடாத மழை வானத்தையே மறைத்துக் கொண்டது.
5956,கதிரவன் மறைந்ததால் இருள் மிகுந்தது.
5957,எம் அன்னையர் மட்டும் அன்று ஊரினர் பலரும் படுத்துறங்குகின்றனர்.
5958,இந்த நள்ளிரவிலே நீ எப்படித்தான் வந்தனையோ?
5959,வேங்கை மரங்கள் பூத்து மணம் கமழும் எங்கள் சிற்றூரை இந்த நிலையில் எப்படித்தான் கண்டறிந்தனையோ?
5960,உனக்கு நேர்ந்த துன்பத்திற்காக நான் மிகவும் வருந்துகின்றேன்.
5961,ஓங்கல் வெற்ப வேங்கை கமழும் எம்சிறுகுடி.
5962,யாங்கு அறிந்தனையோ நோகோ யானே.
5963,பதவுரை ஓங்கல் வெற்ப உயர்ந்த மலையின் தலைவனே.
5964,பெயல் மழை.
5965,கண் மறைத்தலின் வானிடத்தை மறைத்ததனால்.
5966,விசும்பு காணலையே வானத்தையும் காண முடியாதவன் ஆயினை.
5967,நீர் பரந்து ஒழுகலின் மழைநீர் எங்கும் பரந்து ஓடுவதனால்.
5968,நிலம் காணலையே நிலத்தையும் காண முடியாதவன் ஆயினை.
5969,எல்லை சேறலின் சூரியன் மறைந்ததனால்.
5970,இருள் பெரிது பட்டன்று இருட்டு மிகுந்து விட்டது.
5971,பல்லோர் துஞ்சும் ஊரினர் பலரும் உறங்குகின்ற.
5972,பால்நாள் கங்குல் பாதி இரவிலே.
5973,யாங்கு வந்தனையோ எப்படித்தான் இவ்விடத்தைச் சேர்ந்தாயோ?
5974,வேங்கை கமழும் வேங்கை மரங்கள் பூத்து மணம் கமழும்.
5975,எம்சிறுகுடி எமது சிற்றூரை.
5976,யாங்கு அறிந்தனையோ எப்படித் தான் கண்டறிந்தாயோ.
5977,யான் நோகு உன் செயலுக்காக நான் வருந்துகின்றேன்.
5978,கருத்து நீ நள்ளிரவிலே இவ்வாறு வருவதற்காக நான் வருந்துகின்றேன்.
5979,விளக்கம் இது கபிலர் பாட்டு.
5980,இரவுக் குறியிலே வந்த தலைமகனிடம் தோழி வருந்திக் கூறியது.
5981,ஓங்கல் வெற்ப என்ற தொடரை வைத்துப் பொருள் சொல்லப்பட்டது.
5982,"நோகோ என்பதில் உள்ள ஓ, இரக்கத்தைக் காட்டும் இடைச்சொல்."
5983,ஏ அசை.
5984,பெயல் மழை கண் இடம் இங்கு வானிடத்தைக் குறித்தது.
5985,எல்லை கதிரவன்.
5986,யாங்கு எப்படி மழைபெய்யும் நள்ளிரவின் தோற்றத்தை இச் செய்யுள் காட்டுகின்றது.
5987,இந்த ஆற்றலை எப்படிப் பெற்றாள்?
5988,"பாட்டு தலைவி, தான் காதலித்த கணவனை வெளிப்படையாக மணந்து கொள்ள முடியவில்லை."
5989,அதற்கு ஏதோ தடையிருந்தது.
5990,ஆதலால் அவள் கற்பை வெளிப்படுத்தத் துணிந்தாள்.
5991,தன் காதலனுடன் புறப்பட்டுப் போய்விட்டாள்.
5992,வீட்டார் அறியாமல் புறப்பட்டுப் போன மகளைக் குறித்து தலைவியைக் குறித்து செவிலித்தாய் வருந்துகின்றாள்.
5993,இச் செய்தியை உரைப்பதே இப்பாடல்.
5994,வீட்டிலே பாலைக் குடிப்பதற்கு மறுப்பவள் பாலை நிலத்துச் சேற்றுத் தண்ணீரை எப்படித்தான் குடிப்பாளோ?
5995,பதவுரை கோல் அமை கோல் வடிவாக அமைந்த.
5996,குறுந் தொடி சிறிய வளையலை அணிந்த.
5997,தளிர் அன்னோள் தளிர் போன்ற தன்மையுள்ளவள்.
5998,ஏந்திய கையில் தாங்கிய.
5999,செம்பொன் புனைகலத்து சிவந்த பொன்னால் செய்த பாத்திரத்திலே.
6000,அம் பொரிக் கலந்த நல்ல பொரியுடன் கலந்த.
6001,பாலும் பல என பாலையும் மிகுதி என்று சொல்லி.
6002,உண்ணாள் உண்ணமாட்டாள்.
6003,நிழல் ஆன்று அவிந்த இத்தகைய என்மகள் நிழல் அடங்கி மறைந்த.
6004,நீர் இல் தண்ணீர் இல்லாத.
6005,ஆர் இடை அரிய பாலைநில வழியிலே.
6006,கழலோன் காப்ப வீரகண்டா மணியை அணிந்த காதலன் துணையாக வர.
6007,கடுகுபு போகி விரைந்து சென்று.
6008,அருசுனை மருங்கின் நீர் வறண்ட சுனையிலே.
6009,மறுகுபு வெந்த காய்ந்த சூடேறிய.
6010,வெம்வெம் கலுழி மிகுந்த வெம்மையான சேற்றுநீரை.
6011,தல்என தல்என்னும் ஒலியுடன்.
6012,குடிக்கிய குடிப்பதற்கு.
6013,யாங்கு வல்லுநள் கொல் எவ்வாறு துணிவு கொண்டனளோ?
6014,"கருத்து என் மகள் பாலைநிலத்தில் நடக்கவும், சேற்று நீரைக் குடிக்கவும் எப்படித்தான் துணிந்தனளோ?"
6015,விளக்கம் இது கயமள் அல்லது கயமனார் என்னும் புலவர் செய்யுள்.
6016,தலைமகள் காதலனுடன் பாலை நெறியைக் கடந்ததை எண்ணிச் செவிலித்தாய் கூறியது.
6017,கோல் அமைகுறும் தொடி தளிர் அன்னோளே.
6018,ஏந்திய செம்பொன் புனை கலத்து அம் பொரிக்கலந்த பாலும் பல என உண்ணாள்.
6019,இவ்வாறு இறுதி அடிகள் மாற்றப்பட்டு முதலில் வைத்துப் பொருள் சொல்லப்பட்டது.
6020,தான் ஏ ஏ அசைச் சொற்கள்.
6021,ஆன்று அவிந்த அடங்கி மறைந்த.
6022,மறுகுபு உலர்ந்து காய்ந்து.
6023,வெம் வெம் மிகுந்த சூடுள்ள.
6024,கலுழி சேற்றுநீர்.
6025,பல மிகுதி.
6026,கோல் குச்சி.
6027,அந்நாளில் அழகாக இருந்தன பாட்டு தலைவியை மணந்து கொள்ளாமல் தலைவன் காலங் கடத்திக் கொண்டே வந்தான்.
6028,இது தோழியின் ஆசை.
6029,ஆனால் அவள் தன் கருத்தைத் தலைவனிடம் நேரடியாகச் சொல்லவில்லை.
6030,"ஒரு நாள், தலைவன் தலைவியைக் காண்பதற்காக, மறைவிடத்திலே வந்துநின்றான்."
6031,"அப்பொழுது அவன் காதினிலே விழும்படி தோழி, தலைவியைப் பார்த்துப் பேசிய செய்தியை உரைப்பது இச்செய்யுள்."
6032,நீ உன் காதலனை அடிக்கடி காண முடியாமையால் மிகுந்த துன்பத்தை அடைகின்றாய் இரவில் கூட உன் கண்கள் உறங்குவதில்லை.
6033,"உன் கண்கள் சிந்தும் நீர், மூங்கில் போன்ற உன் அழகிய தோள்களிலே குறுக்காக விழுகின்றது."
6034,அதனால் உன் தோள்கள் இளைத்து இப்பொழுது மெல்லியதாகி விட்டன.
6035,தினைப்புனத்தைப் பரண் மேலிருந்து காப்போன் கையில் உள்ள கொள்ளிக்கட்டையைக் கண்டு பெரிய யானை அஞ்சி ஓடுகின்றது.
6036,இத்தகைய யானைகளையுடைய.
6037,வானத்தை அளாவிய மலையின் தலைவன் உன்னை மணப்பதற்கு முன்பு உன் தோள்கள் நன்றாக இருந்தன.
6038,கண்டோர் ஆசைப் படும்படி திரண்டு இருந்தன இவை அழகாக இருக்கின்றன என்று அனைவரும் பாராட்டும்படி இருந்தன.
6039,"பதவுரை முனிபடர் உழந்த வெறுக்கத்தக்க துன்பத்தால் வருந்திய, பாடு இல் தூக்கம் இல்லாத."
6040,உண்கண்பனி மையுண்ட கண்களிலிருந்து விழும் நீர்த்துளிகள் கால் போழ்ந்து குறுக்கே வீழ்ந்து அதனால்.
6041,பணைஎழில் மூங்கில் போன்ற அழகிய.
6042,நெகிழ் தோள் தளர்ச்சியடைந்த தோள்கள்.
6043,மெல்லிய ஆகலின்.
6044,இப்போது இளைத்து விட்டன ஆதலால்.
6045,ஏனல் அம் சிறு தினை தினையுள் அழகிய சிறிய தினைப்பயிர் செய்த புனத்தை.
6046,காக்கும் காவல் புரிகின்ற.
6047,சேனோன் பரண்மேல் உள்ளவன் கையில் உள்ள.
6048,ஞெகிழியின் பெயர்ந்த கொள்ளிக் கட்டையினால் அஞ்சி ஓடிய.
6049,நெடுநல் யானை பெரிய நல்ல யானையானது.
6050,மீன்படு நட்சத்திரம் விழுகின்ற.
6051,சுடர் ஒளி மிகுந்த ஓளியைக் கண்டு.
6052,வெரூஉம் அஞ்சுகின்ற.
6053,வான் தோய் வெற்பன் வானளாவிய மலையையுடைய தலைவன்.
6054,மணவா ஊங்கு உன்னை மணந்து கொள்ளாத அந்நாளில்.
6055,மேவரத் திரண்டு பிறர் விரும்பும்படி பருத்து.
6056,நல்ல அழகாக இருக்கின்றன.
6057,என்னும் சொல்லை மன்னிய பொருந்தியிருந்தன.
6058,கருத்து தலைவனை நீ அடிக்கடி பிரிந்திருக்க நேர்வதனால் உன் தோள்கள் இளைத்து மெலிந்து விட்டன.
6059,விளக்கம் இது கபிலர் பாட்டு.
6060,"தலைவியை மணந்து கொண்டு, ஒன்றாக இணைந்து வாழ்வதுதான் சிறந்தது என்ற கருத்தைத் தோழி கூறியது."
