Line Number,Sentence
714,இல் எழுத்துமொழியாய் வழங்கியதற்குச் சான்றுள்ள தென்றும் பிரித்தானியக் கலைக்களஞ்சியத்திற் கூறப்பட்டுள்ளது.
715,"தமிழகத்தினின்று சென்ற ஒரு கூட்டத்தாரே சுமேரியரின் முன்னோர் என்னும் உண்மையை, பேரா."
716,"முதலிரு கழகமும் வரலாற்றிற்கு முற்பட்ட நெடுஞ் சேய்மைக் காலத்தன வாதலின், அக்காலத்துப் புலவர் பெயர்களும் நூற்பெயர்களும் தவறாகக் கூறப்பட்டுள்ளன."
717,"கடைக்கழகத்திற்குக் குறிக்கப்பட்டுள்ள கால அளவில், இடைக் கழகத்திற்கும் அதற்கும் இடைப்பட்ட காலமும் சேர்க்கப் பட்டிருத்தல் வேண்டும்."
718,இடைக்கழகத்தில் எண்ணாயிரத் தெச்சம் தமிழ்நூல்கள் இருந்தன என்பது போன்றவை செவிமரபுச் செய்திகள்.
719,"பழக்கவழக்கங்கள் என்பன, இலக்கியத்திற் சொல்லப்பட் டுள்ளனவும் இன்று நடைமுறையிற் காண்பனவுமான பல்துறை மரபுவினைகள்."
720,"பல்வேறு ஊழிகளில், நீர்வினையாலும் நெருப்பு வினையாலும் தோற்றமும் மாற்றமுமடைந்த நிலப்படைகளும் பாறைகளும் மலைகளும் நிலநூற் சான்றுகளாம்."
721,"ஆதலால், கடைக்கழகத்திற்கு முற்பட்டது மக்கள் வரலாறாகவே யிருக்க, பிற்பட்டதே மக்கள் வரலாற்றோடு அரசியல் வரலாறாகவும் அமைதல் கூடும்."
722,கி.
723,பி.
724,க்கு முற்பட்ட தென்னாட்டுத் தமிழரையங்களின் துல்லியமான காலக்குறிப்போடு கூடிய தூய கிளத்தியல் சூயசசயவஎந அரசியல் வரலாற்றை இன்றெழுத வியலாது..............
725,இன்று தமிழக அரசியல் வரலாற்றை ஆம் நூற்றாண்டினின்று தொடங்குதல் கூடும்.
726,"அதனால், பெரும்பால் அதனையும், சிறுபால் இலக்கியத்தில் ஆங்காங் குள்ள வரலாற்றுக் குறிப்புகளையும், துணைக்கொண்டே இந் நூல் எழுதப்படுகின்றது."
727,அடிக்குறிப்புகள் .
728,சிலப் .
729,"தொல்காப்பியம், எழுத்ததிகாரம், நச்சினார்க்கினியம், சை.சி."
730,நூ.ப.க.
731,பதிப்பு .
732,ஊ.கூ.ளு.ஐ.
733,"ஏடிட.,யீயீ., ."
734,.
735,ஊ.கூ.ளு.ஐ.
736,"ஏடிட.,யீ.."
737,.
738,கால்டுவெல்.
739,.
740,ஆ.ஹ.ஆ.
741,ஞ.
742,பக் அடிக்குறிப்பு .
743,ஆ.ஹ.ஆ.
744,"ஞ., ப."
745,.
746,.
747,ஊ.கூ.ளு.ஐ ஏடிட.
748,", ப.."
749,.
750,"நுயசடல ஐனேயை, ஞஞ."
751,பாவாணர் தமிழ்க் களஞ்சியம் பக்.
752,குமரிக்கண்டம் தோரா.
753,"கிளேற்றர் இப் பழம் பெருங் கண்டத்தை, அதில் வதிந்திருந்த குரங்கொத்த உயிரிபிராணிபற்றி இலெமுரியா டுநஅரசயை என்றழைக் கின்றார்."
754,"இக் கண்டம் மாந்தனின் பிறந்தகமா யிருக்கக் கூடுமாதலின், மிக முதன்மையானது என்றார் பேரறிஞர் எக்கேல்."
755,ஒரு காலத்தில் தென்னாப்பிரிக்காவையும் இந்தியாவை யும் இணைத்துக்கொண்டு ஒரு தொடர்ந்த நிலப்பரப்பிருந்தது என்றார் அறிஞர் ஓல்டுகாம்.
756,கா.சுப்பிரமணியப் பிள்ளை.
757,கோடியாண்டுகட்குமுன்ஒருவேளை அதற்கு முந்திஒரு பெருங்கண்டம் ஆப்பிரிக்காவையும் இந்தியாவையும் இணைத்துக் கொண்டிருந்தது என்றார் திருவாளர் யோவான் இங்கிலாந்து.
758,குமரிநாட்டு மாந்தன் தோற்றம் தோரா.
759,கி.மு.
760,", என்று கணிக்கப்பட்டுள்ளது."
761,இதை அமெரிக்க மாந்தனூற் பேராசிரியர் சிலர் மறுத்துள்ளனர்.
762,", ஆண்டுகட்கு முந்திய தென்று மறுப்பச்ச மின்றிக் கூறலாம்."
763,குமரி மாந்தர் மொழியற்ற நிலை தோரா.
764,கி.மு.
765,"ஆகையால், அவன் மொழி சைகை மொழியாகவே ழுநளவரசந டயபேரயபந டிச ளுபை டயபேரயபந இருந்தது."
766,"உடற்சைகை, உறுப்புச் சைகை எனச் சைகை இரு திறப்படு மாதலால், முகச்சைகையாகிய வலிச்சமும் பசஅயஉந சைகையுள் அடங்கும்."
767,"மொழியற்ற நிலையில், மாந்தன் கருத்தும் எண்ணமும் உருவலிப்பாகவே அயபயேவடி இருந்துவந்தன."
768,"உருவலிப்பாவது, ஓர் இடத்தையோ, பொருளையோ, நிகழ்ச்சியையோ உள்ளத்திற் படம் பிடித்தல்."
769,மொழித்துணையின்றிக் கருத்து நிகழாதென்பது ஆராய்ச்சி யில்லாதார் கூற்றே.
770,இவ்வுண்மையை இன்றும் ஊமை யரிடத்துக் காண்க.
771,"மொழியமைந்த பின்பும், மாந்தன் கருத்திற் பெரும்பகுதி உருவ லிப்பே யென்பதை ஓர்ந்துணர்க."
772,"பாவாணர் தமிழ்க் களஞ்சியம் , பக்."
773,குமரிநாடே நாகரிக மாந்தன் பிறந்தகம் சான்றுகள் .
774,.
775,.
776,"ஆடும், மாடும், ஊனும் பாலுந் தோலும் ஒருங்கே உதவின."
777,.
778,.
779,முந்தியல் மாந்தர் பழக்க வழக்கங்களாகும்.
780,.
781,அநாகரிக நிலைக்கு அடுத்ததே நாகரிக நிலை.
782,.
783,மாந்தன் நாகரிக வளர்ச்சிக் கேற்றது குமரிநாடே சான்றுகள் .
784,.
785,.
786,இந்நிலைமை இற்றைத் தமிழ் நாட்டிலுமுண்டு.
787,"பஃறுளியாறும் குமரிமலைத் தொடரும் கங்கையும், பனி மலையும் போன்றிருந்தனவே."
788,"தேவநேயம் , பக்."
789,தமிழன் பிறந்தக தீர்மானிப்புக் கருத்தரங்கு அவைத்தலைவர் அவர்காள்!
790,புதுப்புனைவர் கோ.
791,து.
792,நாய்க்கர் அவர்காள்!
793,பேராசிரியர்காள்!
794,இங்குக் கூட்டப் பெறும் இக்கருத்தரங்கு உலகத் தமிழ்க் கழகத்தின் சார்பில் கூட்டப் பெறுகின்றது.
795,இதற்குப் பேராசிரியர் கள் பலரையும் அழைத் திருந்தோம்.
796,ஆனால் மிகவும் பொறுப்பு வாய்ந்த தமிழின்பால் அக்கறை கொண்ட பேராசிரியர்கள் சிலர்தாம் இங்கு வந்திருக்கின்றனர்.
797,இக் கருத்தரங்கு தமிழன் பிறந்தகத்தைத் தீர்மானிக்கும் கருத்தரங்கு ஆகும்.
798,அவர்களையும் கூட இக்காலத்தில் சிலர் மறுக்கத் தொடங்கியிருக்கின்றார்கள்.
799,"நான் மொழித்துறையில் மட்டும், மறைமலையடிகள் இல்லாத இக் காலத்திலே, இவ்வுலகத் தமிழ்க்கழகத்தை ஆற்றுப் படுத்தி வருகின்றேன்."
800,மறைமலையடிகள் இருந்திருந்தால் நான் அவரின் தொண்டராக அடித்தொண்டராக இருந்திருப்பேன்.
801,அவர்கள்தாம் இந்தத் தனித்தமிழ் உணர்ச்சியை நமக்கு ஊட்டியவர்.
802,நீண்ட காலமாக நம் தமிழ்மொழியானது மிக மறையுண்டும் புதையுண்டும் கிடந்தது.
803,"திரிசிரபுரம் என்கின்ற திருச்சிராப்பள்ளியிலிருந்து, பர்."
804,உ.
805,வே.
806,சாமிநாதையர் அவர்களுக்கும் ஆசிரியராக விருந்து கற்பித்த பெரும்புலவர் மீனாட்சி சுந்தரனார் அவர்களுக்குக் கழக நூற்கள் என்றால் என்னவென்றே தெரியாதாம்.
807,அந்தநிலை இந்தத் தமிழ் நாட்டிலே இருந்தது.
808,உயர்ந்த நாகரிகம் ஆரியருடையது என்று சொல்லி விட்டார்.
809,கொற்கையிலே தான் தமிழ் நாகரிகம் தோன்றியது என்றும் சொல்லிவிட்டார்.
810,அவர் காலத்திலே தொல்காப்பியம் போன்ற நூல்கள் இல்லை.
811,அது மறைந்து கிடந்தது.
812,நன்னூலும் திருக்குறளுந்தாம் பயிலப் பெற்று வந்தன.
813,அவ்வாறிருந்தும் தமிழ் மொழியானது ஆரியத்திற்கு முந்தினதே என்று மிகத் தெளிவாகப் பல இடங்களில் சொல்லியுள்ளார்.
814,"அவற்றை வைத்து, தமிழ்மொழிதான் ஆரியத்திற்கு மூலம் என்று சொல்லுகிறார்."
815,பலர் இதை இன்னும் சரியாகப் படிக்கவில்லை என்று நான் கருதுகின்றேன்.
816,கால்டுவெல் எழுதிய அந்த ஒப்பியல் இலக்கணத்தைத் திரும்பவும் சரியாகப் படித்துப் பாருங்கள்.
817,அதில் அந்தக் கருத்தைப் பலவிடங்களில் வலியுறுத்திச் சொல்லியிருக்கின்றார்.
818,அது மிகவும் உண்மை.
819,"அவர் எந்த அடிப்படையில் அதை ஆராய்ந்தார் என்றால், இந்தக் கொடிவழி முறையில் ஆராய்ந்துள்ளார்."
820,மொழியாராய்ச்சி இருவகைப்பட்டது.
821,ஒன்று கொடிவழி முறை என்பது இன்னொன்று வடிவியல் முறை அஃதாவது ஆடிசயீடிடடிபஉயட முறை.
822,கொடிவழி முறை என்பது ழுநநேயடடிபஉயட.
823,இந்தக் கொடிவழி முறையில்தான் உண்மையை அறிய முடியும்.
824,அதற்கு அவர்கள் ஆங்கில மொழியையும் அடிப்படையாக வைத்துக் கொண்டிருக்கின்றார்கள்.
825,"அவர்களுடைய முறையை எடுத்துச் சொல்வ தானால், ஓர் உவமையால் உங்களுக்கு விளக்கலாம்."
826,அவர்கள் வரலாற்றுத் துறையையே அடியோடு விட்டு விட்டார்கள்.
827,"அஃது, இப்பொழுது இங்கே உள்ள ஆரியச் சார்பானவர்களுக்கும், தமிழ்ப் பகைவர்களுக்கும் மிகவும் கொண்டாட்டமாயிருக் கின்றது."
828,அவற்றை அடியோடு மறைத்துக் கொள்ளுதற்கு இந்த வண்ணனை மொழியாராய்ச்சி வடிவியல் முறையை அடிப்படையாகக் கொண்டது அவர்களுக்குத் துணை செய்கின்றது.
829,ஒரு குடும்பத்தில் பெற்றோர் யார்?
830,பிள்ளைகள் யார்?
831,அண்ணன் தம்பி யார்?
832,அக்கை தங்கை யார்?
833,"என்றெல்லாம் ஆராய்ந்தறியாமல், ஒரு குடும்பத்தில் எத்தனைப் பேர் இருக்கிறார்கள்?"
834,எத்தனைப்பேர் நெட்டையர்?
835,எத்தனைப் பேர் குட்டையர்?
836,எத்தனைப் பேர் என்னென்ன நிறத்தி லிருக்கிறார்கள்?
837,என்னென்ன இயல்பு அவர்களுக்கு உண்டு இவற்றைத் தாம் எடுத்துச் சொல்ல வேண்டும்.
838,மற்றபடி ஒன்றுஞ் சொல்லக் கூடாது.
839,இதுதான் வண்ணனை மொழியாராய்ச்சி.
840,தெ.
841,பொ.
842,மீ.
843,என்னும் ஒருவரை உங்களுக்குத் தெரியும்.
844,நம் பேரா சிரியர்களுள் ஒருவர்.
845,"அவனுடைய வாழ்க்கைக்கும் இடமில்லை, இங்கே!"
846,தமிழ்மொழியே உலக முதன்மொழி.
847,அஃதாவது திரவிடத்திற்குத் தாயும் ஆரியத்திற்கு மூலமுமானது.
848,திராவிடத் திற்குத்தாய் என்று முதன்முதல் நமக்கு உணர்த்தியவர் மனோன்மணியம் சுந்தரனார் ஆவார்.
849,"சென்ற நூற்றாண்டிலே, இந்தியா முழுமையும் மட்டுமில்லை, உலக முழுமையும் ஓர் உயர்ந்த நிலையை அடைந்திருந்தது ஆங்கில மொழி."
850,அந்த மொழி ஒன்றுதான் உயர்வாகக் கருதப் பெற்றது.
851,அதில் பேசியவர்கள் தாம் உயர்ந்தவர்கள் என்றோ தேவர்கள் என்றோ மதிக்கப் பெற்றார்கள்.
852,தமிழ்மொழி தாழ்த்தப் பெற்ற ஒரு மொழியாக விருந்தது.
853,அது நமக்கு நன்றாகத் தெரிந்திருக்கும்.
854,"அந்தக் காலத்திலே, ஆங்கில அறிஞராக ஒருவர் தோன்றினார், தமிழ்த் தொண்டராக!"
855,அவர்தாம் பேரா.
856,சுந்தரனார்.
857,அவர்தாம் தமிழ்மொழி விழிப்பு உணர்ச்சியை முதன் முதல் தமிழர்களுக்கு ஊட்டியவர்.
858,அவர்தாம் தமிழுக்குப் பள்ளியெழுச்சி பாடினார் என்று சொல்லலாம்.
859,நீராருங் கடலுடுத்த என்னும் பாட்டு அது.
860,"அந்த அடியைத்தான் இப்பொழுது ஒழித்து விட்டார்களே, அக்கருத்து ஒரு சாரார்க்குப் பிடிக்கவில்லை என்று!"
861,ஆகையினால் அந்தப் பாட்டைப் பாடாமலே விட்டு விடுவது நல்லது.
862,அதை எழுதிய ஆசிரியரவர்கள் இந்தக் காலத்திலே இருந்திருப்பாரானால் அந்த நிலைக்கு மிக மிக வருந்தியிருப்பார்.
863,ஒரு வேளை அதன் பொருட்டு அவர் உண்ணா நோன்பு கூட இருந்தாலும் இருந்திருப்பார்.
864,இப்படி அந்தப் பாட்டின் கருத்து மறைக்கப்பட்டிருக்கின்றது.
865,"இக்கால், அமுதசுரபி என்னும் ஓர் இதழில் அகிலம் முழுவதும் அந்தணர் மயம் என்று ஒரு கட்டுரை வந்ததாம்."
866,அக்கட்டுரையில் அந்தணர் என்ற ஒரு சொல்லைச் சேர்த்துக் கொண்டதே தவறு.
867,அந்தணர் என்னுஞ் சொல் ஆரியர்களைக் குறிக்குஞ்சொல் அன்று.
868,ஆனால் அதை ஆரியர்களைக் குறிப்பதாகத் தவறாகக் கருதிக் கொண்டு எழுதியுள்ளார் அதன் ஆசிரியர் கிருஷ்ண ஸ்ரீநிவாஸ் என்பவர்.
869,கிருஷ்ணம் என்ற சொல்லுக்கு மூலம் க்ருஷ் என்பது அதற்குக் கருப்பு என்பது பொருள்.
870,க்ருஷ்ணபக்ஷம் கரும்பக்கம் க்ருஷ்ணஸர்ப்பம் கரும்பாம்பு என்று வரும்.
871,க்ருஷ்ணன் என்றால் மாயோன்.
872,மாயோன் கரியவன் என்பதையே மொழி பெயர்த்து வைத்திருக்கிறார்கள்.
873,ஒருவேளை வடநாட்டுக் கண்ணன் என்பானும் கரியவனாக இருந்திருக்கலாம்.
874,ஆனால் அவன் தமிழன் என்பதை நீங்கள் மறந்துவிடக் கூடாது.
875,இப்பொழுது அது மத்ரா என்று வழங்கி வருகின்றது.
876,அங்கே தான் கண்ணன் இருந்தான்.
877,அவன் ஆயர் குலத்தைச் சேர்ந்தவன்.
878,அவன் தூய தமிழன்.
879,"அங்குள்ள வழக்கத்தையெல்லாம் பார்த்தீர்களானால், கண்ணன் அக்கால் தென்னாட்டில் உள்ள வழக்கப்படியே நப்பின்னையை ஏறு தழுவி மணந்தான் என்று இருக்கின்றது."
880,இவ் வழக்கம் நம் நாட்டின் முல்லை நிலத்தின் விழாவை யொட்டியது.
881,அந்தப் பெண்ணுடன் அந்தக் கன்றும் நன்கு வளர்ந்து காளையாகும்.
882,அந்தக் காளையை எவன் பிடித்து அடக்குகின்றானோ அவனே அந்தப் பெண்ணை மணப்பதற் குரியவன் என்று தீர்மானிப்பார்கள்.
883,இதெல்லாம் அக்காலத்தில் இருந்த ஒரு வழக்கம்.
884,அந்த முறைப்படி அந்தக் கண்ணனும் மணந்தான்.
885,"இப்பொழுது, க்ருஷ்ண என்றால் கருப்பன் என்றுதான் பொருள்."
886,நீங்கள் அகர முதலியை எடுத்துப் பாருங்கள்.
887,அதிலே கருள் என்ற தூயதமிழ்ச் சொல் இருக்கும்.
888,கருள் என்றால் கருப்பு.
889,இந்தக் கருள் என்னுஞ் சொல்தான் வடமொழியில் க்ருஷ் என்று திரியும்.
890,சுள் என்று ஒரு சொல் உண்டு.
891,சுள் என்று வெயிலடிக்கின்றது என்று நாம் சொல்வ தில்லையா?
892,காய்ந்துபோன குச்சியைச் சுள்ளி என்று சொல்கிறோம்.
893,சுள் என்னும் மூலத்திலிருந்துதான் சுரம் என்று வெப்பத்தைக் குறிக்கும் சொல் பிறக்கும்.
894,அதை வடமொழியில் சுஷ் என்று வைத்திருக்கிறார்கள்.
