Line Number,Sentence
362,"ஆகவே, அவ்வெண்பா இயற்றப் பெற்ற காலத்தில் திருக்குறளுக்கு இளம்பூரணர் எழுதிய உரை வேறு பெயரோடு வழங்கியதாதல் வேண்டும்."
363,அங்ஙனமாயின் அவ்வுரை எப்பெய ரோடு வழங்கியிருத்தல் வேண்டும் என்பது ஈண்டு ஆராயற் பாலதாகும்.
364,மணக்குடியுடையான் என்னுங் குடிப்பெயரே மணக்குடிபுரியான் என்று பாயிரத்திற் கூறப் பட்டிருக்கின்றது.
365,"எனவே, மணக்குடியுடையான் என்பதும் மணக்குடையான் என்று அக்காலத்தில் வழங்கியிருத்தல் வேண்டும்."
366,"எனவே, இளம்பூரணர் என்னும் இயற் பெயரும், மணக்குடையார் என்னும் குடிப் பெயரும் ஒருவரையே குறிப்பனவாகும்."
367,"இனி, சில ஏட்டுப்பிரதிகளில் இவர் பெயர் மணக்குடையார் என்று குறிக்கப்பட்டுள்ளதாம்."
368,"அன்றியும், திருக்குறளுக்கு உரை கண்ட பதின்மர் பெயர் கூறும் பழைய வெண்பா விலும் மணக்குடையார் என்றும் பாடபேதம் காணப்படுகிறது."
369,அவ்வுண்மைகளை அடியிற் காண்க.
370,இளம்பூரணர் உரை மணக்குடையார் உரை அதிகாரம் .
371,ஒழுக்கமுடைமை ஒழுக்கமுடைமையாவது தம் ஒழுக்கமுடைமையாவது தம் குலத்திற்கும் இல்லறத்திற்கும் குலத்திற்கும் இல்லறத்திற்கும் ஒத்த ஒழுக்கமுடையராதல்.
372,ஒத்த ஒழுக்கமுடையராதல் அதிகாரம் .
373,அதிகாரம் .
374,வெஃகாமை வெஃகாமையாவது பிறர் வெஃகாமையாவது பிறர் பொருளை விரும்பாமை பொருளை விரும்பாமை.
375,அதிகாரம் .
376,தீவினையச்சம் தீவினையச்சமாவது தீவினையச்சமாவது தீவினையைப் பிறர்க்குச் தீவினைகளைப் பிறர்க்குச் செய்தலை யஞ்சுதல் செய்யாமை அதிகாரம் .
377,அதிகாரம் .
378,கள்ளுண்ணாமை கள்ளுண்ணாமையாவது கள் கள்ளுண்ணாமையாவது உண்டலைத் தவிர்த்தல் கள்ளுண்டலைத் தவிர வேண்டுமென்று கூறுதல் அதிகாரம் .
379,கொல்லாமை கொல்லாமையாவது கொல்லாமையாவது யாதொன்றையுங் கொல்லாமை யாதோருயிரையுங் கொல்லாமை அதிகாரம் .
380,கள்ளாமை கள்ளாமையாவது கள்ளாமையாவது யாதொரு பிறர்க்குரிய பொருளைக் பொருளையுங் களவிற் கொள்ளா களவினாற் கொள்ளாராதல் ராதல்.
381,அதிகாரம் .
382,போல வருந்தும் ஈரமுடைமை.
383,பத்து அல்லது பதினொரு பாட ல்களைக் கொண்ட அவர்களுடைய பதிகங்களும் தேவாரம் பதிகங்கள் என்று கூறப்படுகின்றன.
384,"எனினும், தேவாரம் என்பதன் பொருள் யாது என்பதைப் பற்றி ஆராய்ச்சிகள் நிகழ்ந்துள்ளன."
385,அன்னோர் இப்பொருளுக்கு வாரம் பாடுந் தோரிய மடந்தையும் என்ற சிலப்பதிகாரவரியை மேற்கோளாக எடுத்துக் காட்டுவர்.
386,மற்றுஞ் சிலர் அதனையே தேஆரம் எனப்பிரித்து அது கடவுளுக்குச் சூட்டப் பெறும் பாமாலை என்ற பொருளையுணர்த்தும் என்று கூறுவர்.
387,ஈண்டு ஆரம் என்பது ஹாரம் என்ற வடசொல்லின் திரிபென்பது அன்னோர் கருத்து.
388,இவையெல்லாம் சொல் கிடந்த முறையில் அவர்கள் கண்ட பொருளே எனலாம்.
389,அதன் முதற்காலத்தில் எப்பொருளில் வழங்கப்பட்டுள்ளது என்பதை ஆரய்வது இன்றியமையாத தாகும் .
390,சேக்கிழாரும் தம் பெரியபுராணத்தில் அச்சொல்லை எடுத்தாளவில்லை.
391,"ஆகவே பட்டினத்தடிகள், நம்பியாண்டார்நம்பி, சேக்கிழார் ஆகிய சைவப் பெரியார் காலங்களில் மூவர்பாடல்கள் தேவாரம் என்று வழங்கப்படவில்லை என்பது தெள்ளியது."
392,எனவே சேக்கிழார் காலத்திற்குப் பிறகே அவை தேவாரம் என்ற பெயரை எய்தி யிருத்தல் வேண்டும் என்பது தேற்றம்.
393,அவர்கள் தம் உலாவில் மல்லிநாத சம்புவராயனைப் பாராட்டியிருத்தலால் அவ்வேந்தன் காலத்தில் இருந்தவராதல் வேண்டும்.
394,முதல் வரையில் அங்கு ஆட்சி புரிந்தவன் வீரசம்பன் என்ற சிறப்புப் பெயருடையவன்.
395,அவ்வரசனைத் தம் உலாவில் புகழ்ந்துள்ள இரட்டையரும் அவன் ஆட்சிக்காலமாகிய கி.பி.பதினான்காம் நூற்றாண்டின் இடைப்பகுதியில் நம் தமிழகத்தில் வாழ்ந்தவர் ஆவர்.
396,ஆகவே கி.பி.
397,பதினான்காம் நூற்றாண்டு முதல் மூவர் பாடல்கள் தேவாரம் என்று வழங்கப்பெற்று வருகின்றன என்பது நன்கு தெளியப்படும்.
398,"இனி, கி.பி."
399,பதினொன்று பன்னிரண்டாம் நூற்றாண்டுகளில் அரசாண்ட சோழமன்னர்களின் கல்வெட்டுக்களில் தேவாரம் என்ற சொல் காணப்படுகின்றது.
400,அக்காலத்தில் அச்சொல் எப் பொருளில் வழங்கப் பெற்றுள்ளது என்பது ஆராய்தற்குரியதாகும்.
401,ஆம் ஆண்டில் எழுந்தருளுவித்த செய்தியை அக்கல்வெட்டு உணர்த்துகிறது.
402,அதில் பயின்றுவரும் தேவாரம் என்ற சொல் வழிபாடு என்னும் பொருளில் வந்திருத்தல் அறியத்தக்கது.
403,இக்கல் வெட்டில் குறிக்கப் பெற்ற கோயில் என்பது அரண்மனையாகும்.
404,தேவாரம் என்பது அரசன் நாள்தோறும் தன் வழிபடு கடவுளைப் பூசித்தற்கு அரண்மனையில் அமைத்திருந்த வழிபாட்டறையாகும்.
405,"ஆகவே, இக்கல்வெட்டில் வந்துள்ள தேவாரம் என்ற சொல் வழிபாடு நிகழ்ந்து வந்த இடத்தைக் குறித்தல் உணரத்தக்கதாம்."
406,"எனவே, அதன் பொருட்டுத் தனி அதிகாரி ஒருவன் அரசனால் அமர்த்தப் பெற்றிருந்தான் என்று உறுதி செய்துவிடல் ஏற்புடைத்தன்று."
407,அங்ஙனமாயின் திருமால் கோயில்களில் திருவாய்மொழி முதலானவற்றைப் பாடிவந்தவர்களைக் கண்காணித்தவன் ஒருவன் இருத்தல் வேண்டுமன்றோ?
408,சோழமன்னர்களின் ஆட்சிக் காலத்தில் திருமால் கோயில்களில் திருவாய்மொழி பாடப்பெற்று வந்தமை பல கல்வெட்டுக்களால் அறியக்கிடக் கின்றது.
409,"ஆனால், அந்நிகழ்ச்சகிளைக் கண்காணித்தற்குத் திருவாய்மொழி நாயகம் என்ற அதிகாரி இருந்ததாகத் தெரியவில்லை."
410,"ஆகவே, தேவாரநாயகம் என்பவன் வேறோர் அலுவல் புரிந்து வந்த அதிகாரியாயிருத்தல் வேண்டும் என்பது திண்ணம்."
411,"எனவே, அரசனது நாள்வழி பாட்டிற்குரிய பணிகளை மேற்பார்ப்பவன் என்பதே அத் தொடரின் பொருளாகும்."
412,அதிலுள்ள தேவாரம் என்ற சொல் வழிபாடு என்று பொருள்படுதல் அறிக.
413,அக்கல்வெட்டுப் பகுதிகள்.
414,நம் தேவாரத்துக்குத் திருப்பதிகம்பாடும் பெரியயோன் மறைதேடும் பொருளான அகளங்கப்பிரியனுக்கும்..........
415,வம்சத் தார்க்கும் காணியாக.....
416,செய்யக்கடவன எல்லாம்.......
417,மடபோகமாக நித்தம் தூணிநெல் கொள்ளச் சொன்னோம் அல்லூர்க்கல்வெட்டு என்பனவாம்.
418,அவை அரண்மனையிலும் கோயிலைச் சார்ந்த மடத்திலும் நடைபெற்றுவந்த நாள் வழிபாடுகளில் திருப்பதிகம் பாடியவர் இருவர் பெயர்களைக் கூறுகின்றன.
419,"அன்றியும், தேவாரத்துக்குத் திருப்பதியம் என்ற தொடரே தேவாரம் வேறு திருப்பதியம் வேறு என்பதை நன்கு வலியுறுத்துதல் அறியத் தக்கது."
420,பதினொன்றாம் நூற்றாண்டில் வரையப்பெற்ற இக் கல்வெட்டுக்களில் பயின்றுவரும் தேவாரம் என்ற சொல் வழிபாடு என்னும் பொருளில் அமைந்துள்ளமை காண்க.
421,இனி முதற்குலோத்துங்க சோழன் கி.பி.
422,அதில் வேந்தன் திருவூறலிறைவனை வழிபட்ட நிகழ்ச்சியை உணர்த்தும் பகுதி திருவூறல்பெருமானைத் தேவாரஞ் செய்து என்று குறிக்கப்பெற்றுள்ளது.
423,இதுகாறும் விளக்கியவாற்றால் கி.பி.
424,ஆகவே கல்வெட்டுக்களால் அறியப்பெற்ற இப்பொருள் நூல் வழக்காலும் உறுதியெய்துதல் காண்க.
425,எனவே இறைவழி பாட்டில் தேவாரத்தில் ஓதப்பெற்று வந்தமைபற்றி மூவர் பாடல்கள் தேவாரம் என்று வழங்கப் பெற்றனவாதல் வேண்டும்.
426,அவ்வருட்பாடல்களைத் தேவாரம் என்று தம் நூலில் முதலில் குறிப்பிட்டோர் இரட்டையரே என்பது முன்னர் விளக்கப் பெற்றது.
427,"ஆகவே, அப்புலவர்களின் காலமாகிய கி.பி."
428,பதினான்காம் நூற்றாண்டு முதல் மூவர் பாடல்கள் தேவாரம் என்று வழங்கி வருகின்றன என்பது தேற்றம்.
429,இந்நாற்பெருந் தெய்வங்களையும் ஞாலங்காக்குங் கால முன்பிற் றோலா நல்லிசை நால்வர் என்று ஆசிரியர் நக்கீரனார் புகழ்ந்து கூறியுள்ளனர்.
430,பௌத்தக் கொள்கையினரான இவ்வாசிரியரும் சிவபெருமானையே முதலில் வைத்துக் கூறியிருப்பது ஈண்டு அறியத்தக்கது.
431,"எனவே, கடைச்சங்க காலத்தில் சைவசமயம் மிகச் சிறந்த நிலையிலிருந்தது என்பது தேற்றம்."
432,"ஆனால், அக்காலத்திய சிவாலயங்களை இந்நாளில் காண்பது அரிதாகும்."
433,"ஆதலின், அப்பழங்காலத்துக் கோயில்களின் அமைப்பு எவ்வாறிருந்தது என்பது புலப்படவில்லை."
434,"ஆயினும், அக்கோயில்கள் செங்கற்களினால் எடுப்பிக்கப் பெற்றிருத்தல் வேண்டும் என்பது மாத்திரம் அறியப்படுகின்றது."
435,சைவசமய குரவருள் ஒருவராகிய அப்பரடிகள் இவ்வேந்தன் காலத்தில் விளங்கியவர்.
436,ஏழாம் நூற்றாண்டின் இறுதியிலும் எட்டாம் நூற்றாண்டின் தொடக்கத்திலும் வாழ்ந்த பல்லவ அரசனாகிய இரண்டாம் நரசிங்கவர்மன் காலத்தில் நிலவியவர் சுந்தரமூர்த்திகள்.
437,"எனவே சைவ சமய குரவர் மூவரும் வாழ்ந்த காலம் பல்லவ மன்னர்கள் அரசாண்ட ஏழு, எட்டாம் நூற்றாண்டுகளேயாம்."
438,இப் பல்லவ வேந்தர்களே சில கற்றளிகளை எடுப்பித்தனர்.
439,பிறகோயில்களெல்லாம் செங்கற் கோயில்களாகவே இருந்தன.
440,"அவற்றை யெல்லாம் ஆராய்ந்தால் கோயில்களின் அமைப்பும், சிற்ப நுட்பங்களும், அவற்றின் வளர்ச்சியும் பிற வரலாறுகளும் நன்கு விளங்கும்."
441,"இனி, சமயகுரவர்கள் அருளிய தேவாரப் பதிகங்களில் சில திருப்பதிகளிலுள்ள கோயில்களுக்குப் பெயர்கள் குறிக்கப் பெற்றிருத்தல் அறியற்பாலது."
442,அப்பெயர்கள் சில ஏதுக்கள் பெற்று வழங்கப் பெற்றிருத்தல் வேண்டுமென்பது திண்ணம்.
443,அவற்றுள் சிலவற்றை அடியிற் காண்க திருப்பதிகளின் அங்குள்ள கோயில்களின் பெயர் பெயர் .
444,காவிரிப்பூம்பட்டினம் பல்லவனீச்சுரம் .
445,பழையாறை பட்டீச்சுரம் .
446,திருப்பனந்தாள் தாடகேச்சுரம் .
447,திருநறையூர் சித்தீச்சுரம் .
448,கொட்டையூர் கோடீச்சுரம் .
449,உறையூர் மூக்கீச்சுரம் .
450,நன்னிலம் பெருங்கோயில் .
451,குடவாயில் பெருங்கோயில் .
452,கீழ்வேளூர் பெருங்கோயில் .
453,அம்பர் பெருங்கோயில் .
454,நல்லூர் பெருங்கோயில் .
455,தண்டலை நீணெறி பெருங்கோயில் .
456,தலைச்சங்காடு பெருங்கோயில் .
457,திருக்கச்சூர் ஆலக்கோயில் .
458,திருக்கடம்பூர் கரக்கோயில் .
459,திருக்கடம்பூர் ஞாழற்கோயில் .
460,திருக்கருப்பறியலூர் கொகுடிக்கோயில் .
461,திருமீயச்சூர் இளங்கோயில் .
462,திருமீயச்சூர் மணிக்கோயில் .
463,பெண்ணாகடம் தூங்கனைமாடம் .
464,ஈச்சுரம் இங்குக் குறிக்கப்பெற்ற கோயிற் பெயர்களுள் ஈச்சுரம் என்று முடிவன சில.
465,"அவற்றுள், காவிரிப் பூம்பட்டினத்துப் பல்லவனீச்சுரம் என்பது பல்லவ மன்னன் ஒருவன் திருப்பணி புரிந்து வழிபட்டதாகும்."
466,"இங்ஙனமே பட்டி, தாடகை என்போர் வழிபட்ட கோயில்கள் முறையே பட்டீச்சுரம், தாடகேச்சுரம் என்று வழங்கப் பெற்றன."
467,பிறவும் இத்தகையவே.
468,குறுநில மன்னர் அமைச்சர் முதலானோர் தம் அரசர் பெயரால் கோயில் எடுப்பித்து நிபந்தங்கள் விடுவதும் பழைய வழக்கமாகும்.
469,", டிக ."
470,இவ்வாறு எடுப்பிக்கப்பெற்ற கோயில்கள் நம் நாட்டில் பல உள்ளன.
471,"அன்றியும், இறந்த வேந்தர்களை நினைவு கூர்தற்குக் கோயில்கள் எடுப்பித்தலும் உண்டு."
472,அவை பள்ளிப் படை என்று கல்வெட்டுக்களில் குறிக்கப்பட்டுள்ளன.
473,இங்ஙனம் எடுப்பிக்கப்பெற்ற கோயில் ஒன்று பட்டீச்சுரத்திற்கு அண்மையில் திருமலைராயன் ஆற்றின் வடகரையில் உள்ளது.
474,அதனை இப்போது இராமநாதன் கோயில் என்று வழங்குகின்றனர்.
475,அது பஞ்சவன் மாதேவீச்சுரம் என்ற பெயருடையது என்பது அக்கோயிலிலுள்ள ஒரே கல்வெட்டால் புலப்படுகின்றது.
476,டிக வட ஆர்க்காடு சில்லா மேற்பாடியிலுள்ள ஒரு கோயில் அரிஞ்சயேச்சுரம் என்ற பெயருடன் உள்ளது.
477,அதனை இக்காலத்தில் சோழேச்சுரம் என்று வழங்குகின்றனர்.
478,ஐஐஐ சூடி.
479,பெருங்கோயில் சில கோயில்கள் பெருங்கோயில்கள் என்று தேவாரப் பதிகங்களில் குறிக்கப் பெற்றுள்ளன.
480,அவற்றையே மாடக் கோயில்கள் என்று கூறுவதும் உண்டு.
481,இப் பெருங்கோயில்களெல்லாம் அறுபத்து மூன்று நாயன்மார் களுள் ஒருவரும் பழைய சோழமன்னருமாகிய கோச்செங்கட் சோழரால் எடுப்பிக்கப் பெற்றனவாகும்.
482,"இதனை, எண்டோளீ சர்க்கெழின் மாடம் எழுபது செய் துலகாண்ட செங்கட்சோழர் என்னுந் திருமங்கை மன்னன் திருவாக்கினால் உணரலாம்."
483,பெருங்கோயில்களெல்லாம் செய்குன்றுகள் மேல் எடுப்பிக்கப் பெற்றவை.
484,"எனவே, இவற்றை மலைக் கோயில்கள் என்றும் கூறலாம்."
485,திருஞானசம்பந்தப் பெருமான் திருநல்லூரிலுள்ள பெருங் கோயிலை மலைமல்கு கோயில் என்று கூறியிருப்பது அதன் அமைப்பை ஒருவாறு உணர்த்துவதாகும்.
486,என்னும் அவ்வடிகளது திருவாக்கினால் அறியப்படுகின்றது.
