Line Number,Sentence
1,உரைவேந்தர் தமிழ்த்தொகை செந்தமிழ் வளம் கட்டுரைகள் ஆசிரியர் ஒளவை துரைசாமி இனியமுது பதிப்பகம் சென்னை .
2,நூற் குறிப்பு நூற்பெயர் உரைவேந்தர் தமிழ்த்தொகை ஆசிரியர் ஒளவை துரைசாமி பதிப்பாளர் இ.
3,"படிகள் நூலாக்கம் பாவாணர் கணினி தி.நகர், சென்னை ."
4,அட்டை ஓவியம் ஓவியர் மருது அட்டை வடிவமைப்பு வ.
5,"மலர் அச்சிட்டோர் ஸ்ரீ வெங்கடேசுவரா ஆப்செட் பிரிண்டர்சு இராயப்பேட்டை, சென்னை ."
6,"வெளியீடு இனியமுது பதிப்பகம் பி. குல்மொகர் குடியிருப்பு, செவாலிய சிவாசி கணேசன் சாலை, தியாகராயர் நகர், சென்னை ."
7,தொ.பே.
8,பதிப்புரை ஒளவை சு.துரைசாமிப் பிள்ளை தமது ஓய்வறியா உழைப்பால் தமிழ் ஆய்வுக் களத்தில் உயர்ந்து நின்றவர்.
9,ஆம் நூற்றாண்டில் தமிழ் மறுமலர்ச்சிக்கு புத்துயிர் ஊட்டிய தமிழ்ச் சான்றோர்களுள் முன் வரிசையில் நிற்பவர்.
10,"நற்றிணை, புறநானூறு, ஐங்குறுநூறு, பதிற்றுப்பத்து ஆகிய சங்க நூற் செல்வங்களுக்கு உரைவளம் கண்டவர்."
11,சைவ பெருங்கடலில் மூழ்கித் திளைத்தவர்.
12,உரைவேந்தர் என்று தமிழுலகம் போற்றிப் புகழப்பட்ட ஒளவை சு.துரைசாமிப் பிள்ளை இல் பிறந்து இல் மறைந்தார்.
13,வாழ்ந்த ஆண்டுகள் .
14,எழுதிய நூல்கள் .
15,இதனை பொருள் வழிப் பிரித்து உரைவேந்தர் தமிழ்த்தொகை எனும் தலைப்பில் தொகுதிகளாக வெளியிட்டுள்ளோம்.
16,இவருடைய நூல்களில் எம் கைக்குக் கிடைக்கப் பெறாத நூல்கள் .
17,மற்றும் இவர் எழுதிய திருவருட்பா நூல்களும் இத் தொகுதிகளில் இடம் பெறவில்லை.
18,அவர் காலத்தில் வாழ்ந்த சமகால அறிஞர்களால் போற்றிப் புகழப் பட்டவர்.
19,சைவ உலகில் தனக்கெனத் தனியிடத்தைப் பெற்றவர்.
20,இவர்கள் இத் தமிழ்த்தொகைக்கு தக்க மதிப்புரையும் அளித்து எங்களுக்குப் பெருமைச் சேர்த்து உள்ளனர்.
21,தமிழ் நூல் பதிப்பில் எங்களின் இந்த அரிய முயற்சிக்குத் தோள் தந்து உதவுங்கள்.
22,நன்றி பதிப்பாளர் பேருரை வரைந்த பெருந்தமிழ்க் கடல்!
23,வாக்கு நயங்காட்டிச் செவிக்குத்தேன் தந்த தாலே நக்கீரர்தான் தாங்கள் இந்த நாளில் கயன்மன்னர் தொழுதமொழி காத்ததனால் தொல் காப்பியர்தான்!
24,காப்பியர்தான் தாங்கள்!
25,எங்கும் தயங்காமல் சென்றுதமிழ் வளர்த்த தாலே தாங்கள்அவ்ஒளவைதான்!
26,"ஒளவை யேதான்! என்று புகழ்ந்ததோடு, அதியன்தான் இன்றில்லை இருந்தி ருந்தால் அடடாவோ ஈதென்ன விந்தை!"
27,தூயசங்கத் தமிழ் நடையை எழுத்து வன்மையிலும் சொல்வன்மையிலும் ஒருங்கு பேணிய தனித் தமிழ்ப்பண்பு ஒளவையின் அறிவாண்மைக்குக் கட்டியங் கூறும்.
28,"எட்டுத் தொகையுள் ஐங்குறுநூறு, நற்றிணை, புறநானூறு, பதிற்றுப்பத்து என்ற நான்கு தொகை நூல்கட்கும் உரைவிளக்கம் செய்தார்."
29,இவ்வுரை விளக்கங்களில் வரலாற்றுக் குறிப்பும் கல்வெட்டுக் குறிப்பும் மண்டிக் கிடக்கின்றன.
30,ஐங்குறு நூற்றுச் செய்யுட்களை இந்நூற்றாண்டின் மரவியல் விலங்கியல் அறிவு தழுவி நுட்பமாக விளக்கிய உரைத்திறன் பக்கந்தோறும் பளிச்சிடக் காணலாம்.
31,"உரை எழுதுவதற்கு முன், ஏடுகள் தேடி மூலபாடம் தேர்ந்து தெரிந்து வரம்பு செய்துகோடல் இவர்தம் உரையொழுங்காகும்."
32,தமிழ் இலக்கிய வரலாற்றில் நான்கு சங்கத் தொகை நூல்கட்கு உரைகண்டவர் என்ற தனிப்பெருமையர் மூதறிஞர் ஒளவை துரைசாமி ஆவார்.
33,இதனால் உரைவேந்தர் என்னும் சிறப்புப் பெயரை மதுரை திருவள்ளுவர் கழகம் வழங்கிற்று.
34,"சிலப்பதிகாரம், மணிமேகலை, சீவகசிந்தாமணி, சூளாமணி, யசோதர காவியம் என்னும் ஐந்து காப்பியங்களின் இலக்கிய முத்துக்களை ஒளிவீசச் செய்தவர்."
35,உரைவேந்தர் உரை வரையும் முறை ஓரு தனிச்சிறப்பு வாய்ந்தது.
36,அதனால் இரண்டாயிரம் ஆண்டுகட்கு முன் தோன்றிய நற்றிணையின் அருமைப்பாடு ஓரளவு எளிமை எய்துகிறது.
37,"இலக்கணநூற் பெரும்பரப்பும் இலக்கியநூற் பெருங்கடலும் எல்லாம் ஆய்ந்து, கலக்கமறத் துறைபோகக் கற்றுணர்ந்த பெரும்புலமைக் கல்வி யாளர்!"
38,"கலைப்பொலிவும், கருத்துத்தெளிவும், பொதுநோக்கும் பொலிந்த நம் உரைவேந்தர், வள்ளலாரின் திருவருட்பா முழுமைக்கும் பேருரைகண்ட பெருஞ்செல்வம்."
39,இஃது தமிழ்ப் பேழைக்குத் தாங்கொணா அருட்செல்வமாகும்.
40,"இனியமுது பதிப்பக உரிமையாளர், தமிழ்மண் பதிப்பகத்தின் உரிமையாளர் கோ.இளவழகனாரின் அருந்தவப்புதல்வி இ.தமிழமுது ஆவார்."
41,தமிழ்மண் பதிப்பகம் அவர்தம் நெஞ்சக் கனலுக்கு வழிகோலுவதாகும்.
42,இப்பதிப்புப் புதையலை பொற்குவியலை தமிழுலகம் இரு கையேந்தி வரவேற்கும் என்றே கருதுகிறோம்.
43,சங்க நூல்களுக்குச் செம்மையான உரை தீட்டிய முதல் தமிழர் இவர் என்று பெருமிதம் கொள்ளலாம்.
44,தமிழும் சைவமும் தம் இருகண்களாகக் கொண்டு இறுதிவரை செயற்பட்டவர்.
45,செந்தமிழ் அவர் எழுதட்டும் என்று காத்திருப்பதுபோல் அருவியெனக் கொட்டும்.
46,நினைவாற்றலில் வல்லவராதலால் எழுந்து சென்று வேறு நூல்களைப் பக்கம் புரட்டி பார்க்க வேண்டும் என்னும் நிலை அவருக்கிருந்ததில்லை.
47,எந்தெந்த நூல்களுக்குச் செம்மையான உரையில்லையோ அவற்றிற்கே உரையெழுதுவது என்னும் கொள்கை உடையவர் அவர்.
48,சைவ மாநாடுகளுக்குத் தலைமை தாங்கிச்சொற்பொழிவுகள் நிகழ்த்தினார்.
49,தம் உரைகள் பலவற்றைக் கட்டுரைகள் ஆக்கினார்.
50,"செந்தமிழ்ச் செல்வி, செந்தமிழ், குமரகுருபரன், சித்தாந்தம் முதலான பல இதழ்களுக்குக் கட்டுரைகளை வழங்கினார்."
51,"பெருந்தகைப் பெண்டிர், மதுரைக் குமரனார், ஒளவைத் தமிழ், பரணர் முதலான கட்டுரை நூல்களை எழுதினார்."
52,அவர் ஆராய்ச்சித் திறனுக்குச் சான்றாக விளங்கும் நூல் பண்டை நாளைச் சேரமன்னர் வரலாறு என்னும் ஆய்வு நூலாகும்.
53,அண்ணாமலைப் பல்கலைக் கழகத்தில் ஒளவை பணியாற்றியபோது ஆராய்ந்தெழுதிய சைவ சமய இலக்கிய வரலாறு அத்துறையில் இணையற்றதாக இன்றும் விளங்குகிறது.
54,சங்க நூல்களுக்கு ஒளவை வரைந்த உரை கற்றோர் அனைவருடைய நெஞ்சையும் கவர்ந்ததாகும்.
55,ஒவ்வொரு பாட்டையும் அலசி ஆராயும் பண்புடையவர் அவர்.
56,முன்னைய உரையாசிரியர்கள் பிழைபட்டிருப்பின் தயங்காது மறுப்புரை தருவர்.
57,தக்க பாட வேறுபாடுகளைத் தேர்ந்தெடுத்து மூலத்தைச் செம்மைப்படுத்துவதில் அவருக்கு இணையானவர் எவருமிலர்.
58,உழுதசால் வழியே உழும் இழுதை நெஞ்சினர் அல்லர்.
59,பெரும்பாலும் பழமைக்கு அமைதி காண்பார்.
60,அதே நேரத்தில் புதுமைக்கும் வழி செய்வார்.
61,"தமிழோடு ஆங்கிலம், வடமொழி, பாலி முதலானவற்றைக் கற்றுத் தேர்ந்தவர் அவர்."
62,எப்போதும் ஏதேனும் ஆங்கில நூலைப் படிக்கும் இயல்புடையவர் ஒளவை அவர்கள்.
63,"சமய நூல்களுக்கு உரையெழுதுங்கால் வடமொழி நூல்களிலிருந்து மேற்கோள் காட்டுவதும், கருத்துகளை விளக்குவதும் அவர் இயல்பு."
64,"அதுமட்டுமன்றி, ஒளவை அவர்கள் சட்டநூல் நுணுக்கங்களையும் கற்றறிந்த புலமைச் செல்வர்."
65,ஒளவை அவர்கள் கட்டுரை புனையும் வன்மை பெற்றவர்.
66,கலைபயில் தெளிவு அவர்பாலுண்டு.
67,நுண்மாண் நுழைபுலத்தோடு அவர் தீட்டிய கட்டுரைகள் எண்ணில.
68,ஒளவை நடை தனிநடை.
69,ஒளவை ஆற்றிய அருந்தமிழ்ப் பணிகளுள் தலையாயது பழந்தமிழ் நூல்களுக்கு அறிவார்ந்த உரைகளை வகுத்துத் தந்தமையே ஆகும்.
70,எதனையும் காய்தல் உவத்தலின்றி சீர்தூக்கிப் பார்க்கும் நடுநிலைப் போக்கு அவரிடம் ஊன்றியிருந்த ஒரு பண்பு.
71,அவர் உரை சிறந்தமைந்ததற்கான காரணம் இரண்டு.
72,"முதலாவது, வைணவ உரைகளில் காணப்பெற்ற பதசாரம் கூறும் முறை."
73,தாம் உரையெழுதிய அனைத்துப் பனுவல்களிலும் காணப்பெற்ற சொற்றொடர்களை இந்தப் பதசார முறையிலே அணுகி அரிய செய்திகளை அளித்துள்ளார்.
74,"இரண்டாவது, சட்ட நுணுக்கங்களைத் தெரிவிக்கும் நூல்களிலமைந்த ஆய்வுரைகளும் தீர்ப்புரைகளும் அவர்தம் தமிழ் ஆய்வுக்குத் துணை நின்ற திறம்."
75,ஜூரிஸ்புரூடன்ஸ் லா ஆஃப் டார்ட்ஸ் முதலானவை பற்றிய ஆங்கில நூல்களைத் தாம் படித்ததோடு என்னைப் போன்றவர்களையும் படிக்க வைத்தார்.
76,வடமொழித் தருக்கமும் வேறுபிற அளவை நூல்களும் பல்வகைச் சமய அறிவும் அவர் உரையின் செம்மைக்குத் துணை நின்றன.
77,"தேவைப்படும்பொழுது உயிரியல், பயிரியல், உளவியல் துறை நூல்களிலிருந்தும் விளக்கங்களை அளிக்கத் தவறவில்லை."
78,இவற்றை அவர்தம் ஐங்குறுநூற்று விரிவுரை தெளிவுபடுத்தும்.
79,ஒளவை அவர்களின் நுட்ப உரைக்கு ஒரு சான்று காட்டலாம்.
80,பின்னத்தூரார் தம் உரையில் அவ்வாறே எழுதி இருந்தார்.
81,இந்தப் பாடலை இயற்றியவர் பாரதம் பாடிய பெருந்தேவனார்.
82,இவரே வேறு சில சங்கத்தொகை நூல்களுக்கும் கடவுள் வாழ்த்து இயற்றியவர்.
83,ஒளவை உரை அமைக்கும் பாங்கே தனித்தன்மையானது.
84,முதலில் பாடலைப் பாடிய ஆசிரியர் பெயர் பற்றியும் அவர்தம் ஊர்பற்றியும் விளக்கம் தருவர்.
85,தேவைப்பட்டால் கல்வெட்டு முதலானவற்றின் துணைகொண்டு பெயர்களைச் செம்மைப் படுத்துவர்.
86,தும்பி சொகினனார் இவர் ஆய்வால் தும்பைச் சொகினனார் ஆனார்.
87,நெடுங்கழுத்துப் பரணர் ஒளவையால் நெடுங்களத்துப் பரணர் என்றானார்.
88,பழைய மாற்பித்தியார் ஒளவை உரையில் மாரிப் பித்தியார் ஆக மாறினார்.
89,வெறிபாடிய காமக்கண்ணியார் ஒளவையின் கரம்பட்டுத் தூய்மையாகி வெறிபாடிய காமக்காணியார் ஆனார்.
90,இவ்வாறு எத்தனையோ சங்கப் பெயர்கள் இவரால் செம்மை அடைந்துள்ளன.
91,"அடுத்த நிலையில், பாடற் பின்னணிச் சூழலை நயம்பட உரையாடற் போக்கில் எழுதுவர்."
92,அதன் பின் பாடல் முழுதும் சீர்பிரித்துத் தரப்படும்.
93,"அடுத்து, பாடல் தொடர்களுக்குப் பதவுரைப் போக்கில் விளக்கம் அமையும்."
94,பின்னர் ஏதுக்களாலும் எடுத்துக்காட்டுகளாலும் சொற்றொடர்ப் பொருள்களை விளக்கி எழுதுவர்.
95,தேவைப்படும் இடங்களில் தக்க இலக்கணக் குறிப்புகளையும் மேற்கோள்களையும் தவறாது வழங்குவர்.
96,உள்ளுறைப் பொருள் ஏதேனும் பாடலில் இருக்குமானால் அவற்றைத் தெளிவுபடுத்துவர்.
97,முன்பின் வரும் பாடல் தொடர்களை நன்காய்ந்து வினைமுடிபு தருவது அவர் வழக்கம்.
98,"இறுதியாகப் பாடலின்கண் அமைந்த மெய்ப்பாடு ஈதென்றும், பயன் ஈதென்றும் தெளிவுபடுத்துவர்."
99,ஒளவையின் உரைநுட்பத்திற்கு ஒரு சான்று.
100,பகைவர் புல் ஆர்க என்பது ஐங்குறுநூற்று நான்காம் பாடலில் வரும் ஒரு தொடர்.
101,மனிதர் புல் ஆர்தல் உண்டோ என்னும் வினா எழுகிறது.
102,"எனவே, உரையில் பகைவர் தம் பெருமிதம் இழந்து புல்லரிசிச் சோறுண்க என விளக்கம் தருவர்."
103,"இக்கருத்தே கொண்டு, சேனாவரையரும் புற்றின்றல் உயர்திணைக்கு இயைபின்று எனப்படாது என்றார் என மேற்கோள் காட்டுவர்."
104,மற்றொரு பாட்டில் முதலைப் போத்து முழுமீன் ஆரும் என வருகிறது.
105,"ஒளவை இளம்பூரணர், நச்சினார்க்கினியர் முதலான பழைய உரையாசிரியர் களையும் மறுக்கும் ஆற்றல் உடையவர்."
106,தன் பார்ப்புத் தின்னும் அன்பில் முதலை என்னும் பாடல் தலைவனையும் வாயில்களையும் இகழ்ந்து தலைவி கூறுவதாகும்.
107,"ஆனால், இதனைப் பேராசிரியரும், நச்சினார்க்கினியரும் தத்தம் தொல்காப்பிய உரைகளில் தோழி கூற்று என்று தெரிவித்துள்ளனர்."
108,ஒளவை இவற்றை நயம்பட மறுத்து விளக்கம் கூறித் தோழி கூற்றென்றல் நிரம்பாமை அறிக என்று தெளிவுறுத்துவர்.
109,ஒளவை ஒவ்வொரு நூலுக்கும் எழுதிய உரைகளின் மாண்புகளை எடுத்துரைப்பின் பெருநூலாக விரியும்.
110,தொகுத்துக் கூற விரும்பினாலோ எஞ்சி நிற்கும்.
111,கற்போர் தாமே விரும்பி நுகர்ந்து துய்ப்பின் உரைத் திறன்களைக் கண்டுணர்ந்து வியந்து நிற்பர் என்பது திண்ணம்.
112,இப்பதிப்பகத்தின் உரிமையாளர் செல்வி இ.தமிழமுது தமிழ்மண் பதிப்பகத்தின் உரிமையாளரின் மகள் ஆவார்.
113,வாழ்க அவர்தம் தமிழ்ப்பணி.
114,வளர்க அவர்தம் தமிழ்த்தொண்டு.
115,உலகெங்கும் மலர்க தமிழாட்சி.
116,வளம்பெறுக.
117,இத்தொகுப்புகள் உரைவேந்தர் தமிழ்த்தொகை எனும் தலைப்பில் இனியமுது பதிப்பகத்தின் வழியாக வெளிவருவதை வரவேற்று தமிழுலகம் தாங்கிப் பிடிக்கட்டும்.
118,தூக்கி நிறுத்தட்டும் என்று நெஞ்சார வாழ்த்துகிறேன்.
119,முனைவர் இரா.குமரவேலன் தண்டமிழாசான் உரைவேந்தர் உரைவேந்தர் ஒளவை.
120,"துரைசாமி அவர்கள், பொன்றாப் புகழுடைய பைந்தமிழ்ச் சான்றோர் ஆவார்."
