Line Number,Sentence
2632,"இன்னுஞ் சில பெற்றோர்கள், குழந்தைகளைக் கோழை களாக்கி விடுகிறார்கள்."
2633,"பெற்றோர்களே, நீங்கள் எத்தனையோ குழந்தைகளுக்குப் பெற்றோராயிருக்கலாம்."
2634,ஆனால் உங்களில் எத்தனை பேருக்குக் குழந்தைகளின் மனப்பான்மையை அறிந்து நடக்கிற சக்தி இருக்கிறது?
2635,சிறிது யோசித்துப் பாருங்கள்.
2636,உங்களுக்கு ஒரு வேண்டுகோள்.
2637,"உங்களுடைய குழந்தைகளின் சுயநல எண்ணத்தை வளர்ப்பதற்காக, மற்றவர் களுடைய உரிமைகளின் மீது கல் போடாதீர்கள்."
2638,உங்களுடைய உரிமைகள் மீது மற்றவர் தாக்கினால் உங்களுக்கு எவ்வளவு கோபம் வருகிறது?
2639,ஆதலின் மற்றவர்களுடைய உரிமைகளைக் காப்பாற்றுவதில் உங்கள் குழந்தைகள் கவனஞ் செலுத்துமாறு செய்யுங்கள்.
2640,"குழந்தைகளிடத்தில் குற்றமே கண்டுபிடித்துக் கொண்டிருந்தீர் களானால், அவைகளின் விரோதத்தைத்தான் நீங்கள் சம்பாதித்துக் கொள்ள முடியும்."
2641,"ஆனால் அதற்காக, அவை மீது குருட்டுத் தனமான அன்பு செலுத்திக் கெடுத்து விடாதீர்கள்."
2642,குழந்தைகளை வளர்ப்பதென்பது ஒரு தெய்விகமானகாரியம்.
2643,அதற்கு அதிகமான முன் யோசனையும் பொறுமையும் வேண்டும்.
2644,இவ்விரண்டையும் அன்பு வழியிலேயே செலுத்துங்கள்.
2645,.
2646,"ஆனால் உலக விவகாரங்களில் மூழ்கிக் கிடக்கும் நாமோ, நம்மைப்போல் குழந்தைகளை ஆக்கிவிட முயன்று கொண்டிருக்கிறோம்."
2647,"ஞானிகள், குழந்தைகளிடத்தில், எவ்வித பிரதிபலனையும் எதிர்பாராத அன்பானது ஆராவமுதமாகத் தேங்கிக் கிடப்பதைக் காண்கிறார்கள்."
2648,நமக்கு விமோசனம் ஏது?
2649,உலகத்திலே ஞானிகள் மிகக் குறைவான பேர்தான் குழந்தைகளோ கோடி கணக்கில்.
2650,"ஞானிகள், உலக ஆரவாரத்தி லிருந்து ஒதுங்கினவர் களாய், வெளியழகிற்கு முக்கியத்துவம் கொடாதவர்களாய், கடவுட் பித்தர் களாய் வாழ்கிறார்கள்."
2651,அப்படி ஆக முடியாமற் போனால் போகிறது.
2652,அந்தக் குழந்தைகளை நாம் அறிந்து கொள்ளவாவது கூடாதா?
2653,"அவைகள், அந்தக் குழந்தைகள், இலவசமாக நமக்கு எத்தனையோ பாடங்களைக் கற்பிக்கத் தயாராயிருக்கின்றன."
2654,ஆயினும் நாம் கற்றுக் கொள்ள மறுக்கிறோம்.
2655,"அவைகள் ஆடும்போதும் பாடும்போதும், உண்ணும் போதும் உறங்கும் போதும், அவைகளிடமிருந்து நாம் எத்தனையோ பாடங்களைக் கற்றுக் கொள்ளலாம்."
2656,ஆயினும் நாம் கற்றுக் கொள்ள மறுக்கிறோம்.
2657,ஒன்றுமட்டும் இங்கே நிச்சயமாகச் சொல்லலாம்.
2658,"குழந்தைகளைப் பற்றிய நூல்கள், குழந்தைகளுக்கான நூல்கள், உலகத்தில் எல்லாப் பாஷைகளிலும் எத்தனையோ வெளி வருகின்றன."
2659,குழந்தைகளின் அறிவு வளர்ச்சியையும் மன வளர்ச்சியையும் கணித்துச் சொல்வதற்கென்று எத்தனையோ விதமான பரிசோதனைகள் நடைபெறு கின்றன.
2660,தாங்களே குழந்தைகளாகிவிட முயன்றிருக் கிறார்கள்?
2661,"உலகம், சுரைகுடுக்கை மாதிரி லேசாகிக் கொண்டு வருகிறதென்றால் அதில் என்ன ஆச்சரியம்?"
2662,இந்தக் குழந்தை மனம் உலகத்திலே எல்லோருக்கும் ஏற்பட வேண்டுமென்று நாம் பிரார்த்தனை செய்வோமாக.
2663,"சாதாரணமாகக் குழந்தைகள், விடியற்காலையிலேயே தூக்கத்தி லிருந்து விடுதலை பெற்றுக் கொண்டு விடுகின்றன."
2664,"உடனே கைகளை ஆட்டிக்கொண்டும், கால்களை உதைத்துக் கொண்டும் விளையாடத் தொடங்கிவிடுகின்றன."
2665,தாங்கள் நித்திரையிலிருந்து எழுந்துவிட்டதைப் போல் மற்றவர்களையும் நித்திரையிலிருந்து எழுப்பி விடுகின்றன.
2666,குழந்தைகளைப்போல நீங்களும் விடியற்காலை துயிலைத் துறந்து பாருங்கள்.
2667,வைத்தியருக்குக் கை நீட்டுவது நிச்சயமாகக் குறையும்.
2668,"மற்றும் லோகோபகாரிகளான மகான்கள், தாங்கள் விழிப்புப் பெற்றதோடு திருப்தியடைய மாட்டார்கள் மற்றவர்களையும் விழிக்கச் செய்வார்கள்."
2669,"தாங்கள் விழிப்படைவது, மற்றவர்களை விழிப்படையச் செய்வதிலேதான் பூர்த்தியடைகிற தென்று அவர்கள் நம்புகிறார்கள்."
2670,குழந்தைகளிடமிருந்துதான் இந்த நம்பிக்கையை அவர்கள் பெற்றார்களோ என்னவோ?
2671,"குழந்தைகள், நாவின் ருசிக்காக ஆகாரம் உட்கொள்வதில்லை பசிக்காகவே உட்கொள்கின்றன பசிக்கின்றபோதுதான் தங்கள் குரலை எழுப்புகின்றன."
2672,"ஆனால், உருவத்திலே வளர்ந்துவிட்ட நாமோ, நமது ஆகார விஷயத்தில் நாவின் ருசிக்குத்தான் முக்கியத்துவம் கொடுக்கி றோம்."
2673,பசியைத் தீர்த்துக் கொள்வதற்காக ஆகாரத்தைத் தேடுகிறோ மில்லை.
2674,ஆகாரத்தைத் தீர்த்து விடுவதற்காகப் பசியைத் தருவித்துக் கொள்கிறோம்.
2675,விளைவு என்ன?
2676,அஜீரணந்தான்.
2677,குழந்தைகள் எப்பொழுதும் வெளிச்சத்தை நாடிச் செல்வதை நீங்கள் காணலாம்.
2678,என்ன அர்த்தம்?
2679,அறிவை நாடிச் செல்வதிலே அவைகளுக்கு அவ்வளவு ஆர்வம் என்றல்லவோ ஏற்படுகிறது?
2680,அறிவுடையவர்களென்று பெருமைப்பட்டுக் கொண்டிருக்கும் நமக்கோ நல்ல வெளிச்சத்தைக் கண்டால் கண் கூசுகிறது.
2681,எங்கே வெளிச்சமில்லையோ அங்கே சென்று ஆறுதலடையப் பார்க் கிறோம்.
2682,அனேகம் பேர் தூங்குகிறபோது வெளிச்சம் கூடாதென்று சொல்வதைக் கேட்டிருக்கிறீர்களா?
2683,"தூக்கத்திலே, இருட்டிலே பெரியவர்கள் ஆறுதல் காண்கிறார்கள்!"
2684,"விழிப்பிலே, வெளிச்சத்திலே குழந்தைகள் ஆர்வங் காட்டுகின்றன!"
2685,குழந்தைகளுக்கு அச்சமென்பது தெரியவே தெரியாது.
2686,கட்டெறும்பைப் பிடிக்கின்றன விஷப் பாம்பைத் தொடுகின்றன.
2687,"அவை, இடியோசையைக் கேட்டு உடல் நடுங்குவதில்லை அமாவாசை இருட்டைப் பார்த்து அலறுவதில்லை."
2688,நம்மிடத்திலே தேங்கிக் கிடக்கும் அச்சத்தை அவைகளுக்கு மெதுமெதுவாக இன்ஜெக்ஷன் செய்கிறோம்.
2689,குழந்தைகள் சமதிருஷ்டியுடையவை.
2690,"எல்லோருக்கும், எல்லாவற்றிற்கும் தங்கள் கல்மஷமற்ற மனத்தில் தாராளமாக இடங்கொடுக்கின்றன பரிவு காட்டுகின்றன."
2691,"தான் வேறு, மற்றவர்கள் வேறு என்ற வேற்றுமை எண்ணமே அவைகளுக்குக் கிடையாது."
2692,உலகம் யாவும் ஒரு குடும்பமாகும் நாள் எந்நாளோ என்று ஏங்கி நிற்கும் லட்சியவாதிகளே!
2693,குழந்தைகளை உங்களுக்கு வழிகாட்டிகளாகக் கொள்ளுங்கள்.
2694,ஒரு குழந்தைக்கு ஏதேனும் சிறிது தின்பண்டம் கொடுத்துப் பாருங்கள்.
2695,"அது, தானே தின்னாது தனக்கு மட்டுந்தான் அந்தத் தின்பண்டம் என்று கருதாது."
2696,தன்னைச் சுற்றி யார் இருக்கிறார் களென்று பார்த்து அவர்களுக்கு அதில் கொஞ்சம் பகிர்ந்து கொடுக்கும்.
2697,அப்படிப் பகிர்ந்துக் கொடுப்பதிலே அதற்கு ஒரு சந்தோஷம் தன் கடமையைச் செய்கிறதாக ஒரு திருப்தி.
2698,நாளா வட்டத்தில் அவை நம்மைப் போல் சுயநல வடிவங்களாக வளர்வதில் என்ன ஆச்சரியம்?
2699,நாம் வளர்த்துக் கொடுத்த இந்த சுயநலமானது நம்மையே பிற்காலத்தில் நிராகரித்து விடுகிறது.
2700,அப்பொழுது வருத்தப்பட்டு என்ன பலன்?
2701,சிறிது நேரத்திற்கெல்லாம் பாருங்கள்.
2702,தங்கள் சண்டையை மறந்துவிட்டு ஒன்றுசேர்ந்து பழைய மாதிரி விளையாடத் தொடங்குகின்றன.
2703,அவைகளுக் கேற்படுகிற கோபதாபங்க ளெல்லாம் க்ஷண நேரந்தான்.
2704,பெரியவர்களாகிய நாம் அப்படியல்லவோ இருக்க வேண்டும்?
2705,ஐம்புலன்களும் ஐவகை உணர்ச்சிகளும் அவைகளுக்குரிய வேலையைச் செய்து கொண்டிருக்கிற வரையில் கோபதாபங்கள் உண்டாவது சகஜந்தான்.
2706,"ஆனால், அவைகளை வளரவிடக்கூடாது உடனே அவை களை மறந்துவிட வேண்டும்."
2707,கோபதாபங்களை வளர விட்டோமானால் அவை காலக்கிரமத்தில் நம்மையே பொசுக்கி விடும்.
2708,"குழந்தையை, விஷமஞ் செய்ததற்காகத் தாயார் அடிக்கிறாள் அல்லது திட்டுகிறாள்."
2709,குழந்தையும் தேம்பித் தேம்பி அழுகிறது.
2710,தாயாரும் தன் காரியங்களைக் கவனிக்கப் போய்விடுகிறாள்.
2711,சிறிது நேரத்திற் கெல்லாம் என்ன ஆகிறது?
2712,தாயை நோக்கி குழந்தை ஓடி வருகிறது.
2713,ஏன்?
2714,அடித்த தாயை அடிக்கவா?
2715,இல்லை.
2716,இல்லை அடித்த தாயுடன் கொஞ்சி விளையாட.
2717,"குழந்தைகள், கட்டுப்பாட்டை அறவே வெறுக்கின்றன தங்கள் இஷ்டப்படி ஆடி ஓடுவதைத்தான் விரும்புகின்றன."
2718,ஒரு வீடு எவ்வளவு விசாலமுடையதாயிருந்த போதிலும் அதில் குழந்தைகள் புழங்க விரும்புவதில்லை யென்பதைக் கவனித்திருக்கிறீர்களா?
2719,"தோட்டத்திலே, திறந்த வெளியிலேதான் அவை அதிகமான குதூகலத்தை அடைகின்றன."
2720,"அதாவது அவை, சுதந்திர வாழ்க்கையி லும் இயற்கையோடியைந்த வாழ்க்கையிலும் இச்சையுடையவை என்பதே தாத்பரியம்."
2721,"ஆனால் நாமோ, திறந்த வெளியைக் கண்டு பயப்படுகிறோம்."
2722,சுதந்திர வாழ்க்கையின் லட்சணமென்ன வென்றுகூட நமக்குத் தெரியாது.
2723,அப்படித் தெரிந்து கொள்ள வேண்டுமென்ற ஆவலும் நமக்கு இருப்பதாகத் தெரியவில்லை.
2724,குழந்தைகளுக்கு எண்ணம் குறைவு செயல் அதிகம்.
2725,இதனால் தான் அவை வளர்ச்சி யடைகின்றன.
2726,நாமோ எண்ணத்தை வளர்த்துக் கொண்டிருக்கிறோம் செயலைக் குறைத்துக் கொண்டு விட்டோம்.
2727,நமக்கு வாழ்வானது ஊற்றுப் பெருக்கெடுத் தோடாமல் குட்டை நீராகத் தேங்கிக் கிடக்கிறது.
2728,"குட்டை நீரில் கொசுக்கள் மலிந்திருப்பதைப் போல் நம்முடைய வாழ்க்கையிலும், விகற்ப எண்ணம், விபரீத புத்தி எல்லாம் மலிந்து கிடக்கின்றன."
2729,"இவைகளை அகற்றி வாழ்க்கையைத் தூய்மை யுடையதாகச் செய்து கொள்ள, குழந்தைகளே!"
2730,நீங்கள்தான் எங்களுக்கு வழிகாட்ட வேண்டும்.
2731,மனிதன் யார்?
2732,.
2733,மனிதன் யார்?
2734,இவை மட்டும் போதா.
2735,"அவன், அறிவு, திறமை, வீரம் முதலியன நிறைந்த வனாகவும் இருக்க வேண்டும்."
2736,இத்தகையவனே மனிதன் என்று கடவுள் அழைக்கிறார்.
2737,அவனது நரம்புகள் உணர்ச்சி வேகத்தினால் முறுக்கேறி நிற்க வேண்டும்.
2738,"அவனது அறிவு, கூர்மை, ஆழம், விசாலம் இவற்றோடு கூடி இருக்க வேண்டும்."
2739,அவனது கரங்கள் எந்தத் தொழிலையும் செய்யக்கூடிய ஆற்றல் பெற்றிருக்க வேண்டும்.
2740,அவனது கண்கள் தூரதிருஷ்டிக் கண்ணாடி போல இருக்க வேண்டும்.
2741,"அவனது இருதயம் மிருதுவானதாய், மிகப்பரந்ததாய், பளிங்கு போல் இருக்க வேண்டும்."
2742,அவன்தான் மனிதன்.
2743,.
2744,பெரிய மனிதன் பெரிய மனிதன் என்று ஒருவனைப் பார்த்துச் சொல்கிறோம்.
2745,எந்த அர்த்தத்தில் அப்படிச் சொல்கிறோமென்பதை நாம் அதிகமாகச் சிந்தித்துப் பார்ப்பதில்லை.
2746,"ஒருவனுடைய உருவம், அவனைப் பெரிய மனிதனாக்கி விடாது."
2747,கல்லையும் கரைந்துருகச் செய்யவல்ல அவனுடைய பேச்சாற்றல் இப்படிப் போன்ற எதுவும் ஒருவனைப் பெரிய மனிதனாக்கிவிட முடியாது.
2748,"இவை பலவும் ஒருவனிடத்தில் ஒன்று திரண்டு அவனைப் பெரிய மனிதனாக்க முயன்றாலும், அந்த முயற்சி தோல்வியடையும்."
2749,"போகட்டும் அதிகார பீடத்தில் அமர்ந்திருக்கிறவனையோ, அமர்த்தப்பட்டிருக்கிறவனையோ பெரிய மனிதனென்று சொல்ல முடியுமா?"
2750,ஒரு போதும் முடியாது.
2751,அதிகாரத்தில் இருப்பதனால் ஒருவன் பெரிய மனிதனாகி விட மாட்டான்.
2752,பெரிய மனிதனாயிருக்கிறவன் அதிகார பீடத்தில் அமர்வதுதான் முறை அமர்த்தப்படுவது தான் நியாயம்.
2753,"இந்த நியாயம் கடைப்பிடிக்கப் பட்டால், உலகத்திலுள்ள எல்லா நாடுகளும் சகோதர உறவு பூண்டு வாழும்."
2754,ஆனால் அதிகார சக்தியும் மனிதத்தன்மையும் பெரும்பாலும் இணைந்து போவதில்லை.
2755,ஒன்றின் மீது மற்றொன்று ஆதிக்கங் கொள்ளவே பார்க்கிறது.
2756,கடைசியில் இரண்டில் ஒன்றுதோல்வி யடைந்து மற்றொன்றினிடம் சரண் புக வேண்டி வந்து விடுகிறது.
2757,யாரையும் நம்புகிறது எங்கணும் நன்மையையே காண்கிறது.
2758,இந்த நிலையில் இரண்டும் அதிகார சக்தியும் மனிதத்தன்மையும் இணைந்து போக வில்லை யென்றால் அதற்காக நாம் ஆச்சரியப்படத் தேவையில்லை.
2759,என்றாலும் ஆதிகாலத்திலிருந்து ஒரு சிலர் இரண்டையும் அணைத்துக் கொண்டு வாழ முயற்சி செய்யாமலில்லை.
2760,அதாவது பெரிய மனிதனாகவும் அதே சமயத்தில் மேலதிகாரியாகவும் இருந்து வாழ்க்கையை நடத்த முயன்றிருக்கிறார்கள்.
2761,இந்த முயற்சியில் இவர்கள் முழு வெற்றி கண்டார்களா என்பது வேறு கேள்வி.
2762,முயன்றதே பெரிய சாதனையல்லவா?
2763,அப்படிப்பட்டவர்களில் ஒரு சிலரே சரித்திர ஏடுகளில் இடம் பெற்றிருக்கிறார்கள்.
2764,"அவர்களை அந்தச் சரித்திர ஏடுகளிலேயே வீற்றிருக்கும்படி செய்து விட்டு,பெரிய மனிதன் யார் என்ற கேள்விக்கு விடை காண முற்படுவோம்."
2765,கி.மு.
2766,"அவன் தன்னுடைய அரசியல் அறிவு, அதிகாரசக்தி எதையும், தன்னுடைய நன்மைக்குச் சிறிதும் உபயோகித்துக் கொள்ளவில்லை ராஜ்ய நன்மைக்காகவே செலவழித்தான்."
