Line Number,Sentence
323,இம் மொழிகள் அனைத்தும் ஒன்றுடன் ஒன்று நெருங்கிய தொடர்புடையவை ஒரே பொதுவான தாய்மொழியின் வட்டார வழக்குகள் என்றே கூறலாம்.
324,.
325,சிந்து நாகரிகம் திராவிடச் சார்புடையதே என்பதற்கான பல துறை சார்ந்த ஆதாரங்களைப் பின்வரும் இயல்கள் விரிவாகத் தருகின்றன.
326,சிந்து நாகரிகக் காலத்திலேயே உலகிற்குத் தமிழிய நாகரிகம் பருத்தித் துணியை வழங்கத் தொடங்கிவிட்டது.
327,"வீடுகளில் பயன்பட்ட பொருள்கள் அம்மி, குழவி உட்பட, நகைகள், சிற்பங்கள் ஆகிய அனைத்தும் தமிழியச் சார்புடையவை."
328,இன்றை இசைக்கலை ஆரியர் தமிழரிடமிருந்து கற்றதே ஓ.
329,"கோஸ்வாமிஇந்திய இசை வரலாறு , ."
330,"இயல்கள் , , ஆகியவற்றில் இவற்றின் விரிவைக் காண்க."
331,தமிழரின் சிற்றிலக்க முறையையே சிந்து நாகரிக எடை அளவுகளில் காண்கிறோம் என்பதைச் செங்கம் கு.
332,வேங்கடாசலம் நிறுவியுள்ளார்.
333,இயல் இன்றைய இந்து மதத்தின் முதன்மைக் கூறுகள் அனைத்தும் திராவிட தமிழ் சிந்து நாகரிகக் கூறுகளே ஆகும்.
334,"சமண, பௌத்த மதங்களின் தோற்றத்திற்கும் சிந்து மற்றும் வடநாட்டில் பண்டு வாழ்ந்த திராவிட தமிழ் ஞானிகளே காரணமாவர்."
335,அதுபற்றிய சுருக்கம் அடுத்த பத்தியில்.
336,.
337,வேதமொழியாகிய இந்தோ ஐரோப்பிய மொழி இந்தியாவில் உருவாகியிருக்கலாம் என்று வேத சமஸ்கிருதப் பற்றாளர் கூறுவது அபத்தம்இது வேறு கி.மு.
338,கி.மு. காலக்கட்டத்தில் இந்தியாவிற்குள் வடமேற்கிலிருந்து நுழைந்தவர்கள் வேதமொழி ஆகிய இந்தோ ஆரிய மொழி பேசுநர் ஆவர்.
339,இவர்கள் சிந்து நாகரிக மக்களோடு ஒப்பிடும் பொழுது சிறு எண்ணிக்கையினராகவே இருந்திருக்கவேண்டும்.
340,"ஜெர்மானியம் இங்லிஷ் உட்பட பால்டிக் லட்வியன், லித்துவேனியன், ஸ்லாவ் ரஷ்யன் முதலியவை ஆகியவையாகும்."
341,அக் கால கட்டத்தில் அவர்கள் இந்தோ ஐரோப்பியத் தொன் மொழியைப் பேசிவந்தனர்.
342,"கி.மு. கால அளவில் அவர்களில் சில குழுக்கள் மேற்காகவும், சில குழுக்கள் கிழக்கு தென் கிழக்காகவும் நகரலாயினர்."
343,கிழக்கு தென்கிழக்காகப் பெயர்ந்த நாடோடிக் குழுவினருள் இந்தோ ஆரியமொழி பேசும் குழுவும் ஒன்று.
344,கி.மு. இல் அவர்கள் இந்தியாவுக்குள் இரானிலிருந்து நுழைந்தபொழுது அவர்களும் சிந்துப் பகுதித் தொல்தமிழ நாகரிகத்தினரிடமிருந்து விரைவில் நாகரிகம் பெற்றனர்.
345,நூலில்பிரிட்ஜட் மற்றும் ரேமாண்ட் ஆல்சின் தம்பதியர்.
346,ரிக் வேதம் தொகுக்கப்பட்ட காலமாகிய கி.மு.
347,", , , , , ."
348,", , ."
349,.
350,சிந்து நாகரிக நகர்ப் புறங்களின் வீழ்ச்சியும் அழிவும் கி.மு.க்கு முன்னரே தொடங்கிவிட்டது என்பார் பொசெல் .
351,.
352,சிந்து நகரங்களை ஆரியர் தாக்கியிருக்கலாம் இந்திரன் பெயரே புரந்தரன் நகரங்களை அழிப்பவன் தானே!
353,இயற்கை மாற்றம் மழைவளம் குறைவு .
354,இயற்கை உற்பாதங்கள் பூமி அதிர்ச்சியால் நிலப் பகுதிகளின் நிலையில் மாற்றம் கக்கார் சரஸ்வதி ஆறு வற்றி மறைந்தமை .
355,மாந்தர் செயல்கள் இந்தோஆரிய மொழிபேசுநர் இனக் குழுவினர் நுழைவு எலாம் சுமேரியா போன்றவற்றுடன் வாணிகத் தொடர்பு அற்றுப் போனமை.
356,.
357,தொற்று நோய்கள் .
358,இன்றைய நிலையில் ஆல்சின் உடைய இக்கருத்து ஏற்கத்தக்கதாக உள்ளது.
359,"ஏறத்தாழ இதே கருத்துடையவர்களே, பர்டன் ஸ்டெய்ன் கெனோயர் கராச்சி , பக்."
360,நயன்ஜோத் லாகிரி தாபர் டி.என்.ஜா முதலியவர்களுமாவர்.
361,.
362,சிந்து நாகரிக மக்கள் பெருமளவு வாழ்ந்த கிராமப்புறங்களில் அந் நாகரிகம் தொடர்ந்து வாழ்ந்தது.
363,"சுநீதி குமார் சட்டர்ஜி, வால்டர் பேர்சர்வீஸ், எஸ்.ஏ."
364,சர் ஜான் மார்ஷல் ராக்கல்தாஸ் பானர்ஜி தயாராம் சாஹ்னி சர் மார்டிமர் வீலர் ஆர்.
365,எஸ்.
366,ஏறத்தாழ லட்சம் சதுர மைல் பரப்புள்ளது.
367,முழு அதிகாரம் வாய்ந்த ஒரு மைய அதிகார அமைப்பும் இருந்திருக்கலாம் என்பது சில அறிஞர் கருத்து.
368,.
369,பழைய எகிப்து நாகரிகப் பரப்பை விட இது இரு மடங்கு பெரியது.
370,சிறப்புற்ற நிலை கி.மு.
371,"பற்றிய சான்றுகள் கிடைத்துள்ள முக்கிய இடங்கள் மொகெஞ் சொதரோ, ஹரப்பா, கலிபங்கன், சன்ஹூதரோ, லோதல் போன்றவை ஆகும்."
372,மொகெஞ்சொதரோவில் மக்களும் ஹரப்பாவில் மக்களும் வாழ்ந்திருக்கலாம் எனக் கருதப் படுகிறது.
373,.
374,ல் லாகூரிலிருந்து மூல்தான் வரை ரயில்பாதை அமைக்க தண்டவாளத்திற் கடியில் பரப்புவதற்காக ஹரப்பாவிலிருந்து செங்கற்களை எடுத்துச் சென்று பயன்படுத்தினர்!
375,அண்டை ஊர்மக்களும் அவ்வப் பொழுது செங்கற்களை எடுத்துக் கொள்வர்!
376,"கிர்சாரா லிருந்து கச் மாவட்டம் கிர்சாரா பற்றிய கட்டுரையை சூன் , இல் காண்க. ."
377,இதுவரை ஹரப்பா சிந்து நாகரிகச் சின்னங்கள் இருக்கும் இடங்களை க்கு மேல் கண்டுபிடித்துள்ளனர்.
378,அவற்றில் பெரும் பாலானவை இன்றைய இந்தியாவில் உள்ளன.
379,"சரஸ் என்றால் குளம், கண்மாய், ஏரி என்று பொருள்."
380,மறைந்த சரஸ்வதி ஆற்றுப் படுகைக்கு இப்பொழுது வழங்கும் பெயர் கக்கார் ஹக்ரா என்பதாகும்.
381,.
382,நகரங்களில் மட்டுமன்றி கிராமங்களிலும் சிந்துவெளி நாகரிக மக்கள் வாழ்ந்திருக்கவேண்டும்.
383,ஆனால் அத்தகைய கிராமப்புற மக்களின் வாழ்விடங்கள் இன்னும் அகழ்வாய்வில் அகப்படவில்லை.
384,நகரங்கள் கிராமங்களில் வாழ்ந்தவர்கள் தவிர நாடோடிகளாக வாழ்ந்தவர்களும் இருந்திருக்கவேண்டும்.
385,இவர்கள் வாழ்க்கை முறைகளையெல்லாம் காட்டும் அகழ்வாய்வுச் சான்றுகள் இல்லை.
386,எனினும் பெருமளவு ஊகிக்க இடமுண்டு.
387,இயல் ஐக் காண்க.
388,.
389,இல் கிரிகரி எஸ்.
390,பாசெல் எழுதியுள்ள சிந்துயுகம் தொடக்க நிலை என்னும் ஆயிரம் பக்க நூல் சிந்து அகழாய்வின் வரலாற்றை விரிவாகத் தருகிறது.
391,அத்துடன் கி.மு. காலச் செய்திகளையும் தருகிறது.
392,சிந்துச் சின்னங்கள் காணப்படும் இடங்களின் பட்டியல் பக்கங்கள் நூற்றொகை பக்கங்கள் ஆகியவையும் உள்ளன .
393,லோதல் துறைமுகம்?
394,நீர்த்தடத்தின் கிழக்கில் உள்ள அரப்பாவும் ஆகும்.
395,எனினும் அவை இரண்டும் ஒரு பேரரசின் இரட்டைத் தலைநகரங்கள் எனக் கருதத் தக்கனவல்ல என்பர் பொசெல் .
396,மொகெஞ்சொதரோ .
397,சிந்து நாகரிக நகரங்களிடையே செல்வச் செழிப்பைக் காட்டுவது இதுதான் ஆண்டு காலம் அது செழிப்புற்று விளங்கியது.
398,தமிழகத்தில் பாண்டியர் ஆட்சி வீழ்ந்தது இல் அதிலிருந்து வரை தமிழ்நாட்டு நகரம் ஒன்று சிறப்புற்று இருந்திருந்தால் எப்படி இருக்கும்!
399,அதுபோல.
400,.
401,உயர்ந்த பகுதியில் கோட்டை அமைந் திருக்கலாம் என வீலர் முதலியோர் கருதினர்.
402,.
403,.
404,.
405,.
406,.
407,.
408,.
409,.
410,.
411,மொகெஞ்சொதரோ நகரம் செவ்வனே திட்டமிட்டு உருவாக்கப்பட்டது என்பர் பொசெல்.
412,.
413,மொகெஞ்சொதரோ குடியிருப்புப் பகுதியில் பெரிய தெருக்கள் அடி அகலம் வரை தென் வடலாக நேராக அமைந்திருந்தன.
414,"கிழக்கு மேற்கான குறுக்குத் தெருக்களும் , , நேராக அமைந் திருந்தன."
415,"சில தெருக்கள் மட்டும், உடைந்த செங்கல் துண்டுகளையும் மட்பாண்டச் சிதைவுகளையும் கொட்டி, கெட்டிப்படுத்தப்பட்டிருந் தன."
416,வீடுகளைக் கட்ட வெயிலிற் காய்ந்த சுடாத செங்கற்களும் சூளை யிட்ட செங்கற்களும் இரண்டுமே பயன்பட்டன.
417,மொகெஞ்சொதரோ வில் சுடாத செங்கல் நிரப்பு வேலைக்கே பயன்பட்டது.
418,.
419,நாடெங்கும் செமீ செமீ செ.மீ என்ற ஒரே அளவுள்ள செங்கற்களே பயன்படுத்தப்பட்டன.
420,இத்தகைய சிறந்த சுட்ட செங்கற்கள் மத்திய கிழக்கு ஆசிய நாகரிகங்களில் இல்லை.
421,கற் கட்டடங்கள் எவையும் சிந்துவெளி நகரங்களில் இல்லை.
422,.
423,பெருந்தெருக்களை ஒட்டிக் கட்டிய வீடுகளுக்கும் வாயிலை அப்பெருந் தெருக்களில் வைப்பதில்லை.
424,சிறிய குறுக்குத்தெருக் களில்தான் வாயில் இருந்தது.
425,பலவீடுகள் மாடிவீடுகளாக இருந்தன.
426,சராசரி சதுர அடிக்குக் குறையாமல் பரப்பளவு இருந்தது.
427,பல வீடுகள் மிகப்பெரியவை.
428,அனைத்திலுமே முற்றங்கள் இருந்தன.
429,முற்றங்களில் மாடுகளும் கட்டியிருந்திருக்கலாம்.
430,இரண்டு வீடுகளின் வெளிச் சுவர்களுக்கிடையே இரண்டு அடி காலி இடம் விடப்பட்டு இருந்தது தகராறுகளைத் தவிர்க்கவோ?
431,"பெரிய வீடுகள் சில, இடையே நெடுஞ்சுவர்களால் பிரிக்கப்பட்டிருந்தன."
432,உடன்பிறந்தார் பாகம் பிரித்தனர் போலும்.
433,வீடுகளில் உயரத்தில் பல துளைகள் கண்கள் அமைந்த சிறு சன்னல்கள் இருந்தன.
434,சன்னலுக்கு இன்றும் தூய தமிழ்ச் சொல் பலகணிதான்.
435,.
436,வீடுதோறும் ஒரு குளியலறை இருந்தது.
437,கழிவுநீர் ஓட வடி கால்கள் இருந்தன.
438,.
439,பெரிய வீடுகள் ஒவ்வொன்றிலும் தனியே ஒரு கிணறு இருந்தது.
440,கிணறுகளை வட்டமாக வடிவுள்ள செங்கற்களால் இன்றும் தமிழ்நாட்டில் உள்ளது போல கட்டினர்.
441,.
442,மொகஞ்சொதரோ உயர்ந்த கோட்டைப் பகுதியில் அகழ்ந்தெடுக்கப்பட்ட தெப்பக்குளம் வியக்கதக்கது என்பர் மார்ஷல்.
443,மீ மீ நீண்டசதுர வடிவான அக் குளம் மீ ஆழ முள்ளது.
444,வடக்கிலும் தெற்கிலும் படிக்கட்டுகள்.
445,செங்கற்களால் அழகுறக் கட்டியது.
446,தளத்தில் நிலக் கீலை பயன்படுத்தி நீர்க் கசிவைத் தடுத்திருந்தனர்.
447,குளத்தைச் சுற்றி நடைபாதையும் தாழ்வாரங் களும் அறைகளும் உள்ளன.
448,அருகிலுள்ள ஒரு பெரிய கிணற்றி லிருந்து குளத்துக்கு நீர் பெறப்பட்டது.
449,தெய்வ வழிபாட்டுக்கு முன்னர் நியமப்படி குளிப்பதற்காக இத் தெப்பக்குளம் கட்டப்பட்டிருக்கலாம் என்பர் சிலர்.
450,கோட்டையில் தற்போதுள்ள கி.பி.
451,ஐ.
452,"மகாதேவனும் ஆகஸ்ட் இந்தத் தெப்பக்குளமும், குளியலறைகளும் களுக்காகப் பயன்பட்டிருக்கலாம் என்ற கருத்தை ஆதரிக்கிறார்."
453,தெப்பக் குளத்தருகே இன்னொரு பொதுக் கூடம் இருக்கிறது.
454,ஹாரப்பாவில் உள்ளது போன்ற களஞ்சியம் இது என்கிறார் வீலர்.
455,.
456,"ஹாரப்பா உயர் பகுதியில், ஒவ்வொன்றும் மீ மீ அளவுள்ள தானியக் களஞ்சியங்களைக் காண்கிறோம்."
457,"அருகில் தானியம் அடிக்கும் களமாகப் பயன்பட்ட, வட்ட வடிவமான செங்கல் தளங்கள் உள்ளன."
458,.
459,லோதல் நகரில் மீ மீ பரப்புள்ளதும் மீ உயரச் செங்கற்சுவர்களால் கட்டியதும் ஆன கப்பல்துறை ஒன்றைக் கண்டு பிடித்துள்ளனர்.
460,"இது குடிநீர் தேக்கிவைக்கும் குளம்தான் என்பது லெஷ்னிக், ஆல்சின், பொசெல் ஆகியோர் கருத்து ஆகும் ."
461,ஹாரப்பாவும் மொகெஞ்சொதரோவும் .. முதல் பாகிஸ்தானுக்குட்பட்டவையாயின.
462,இந்தியாவில் அவற்றுக் கொப்ப முக்கியமான சிந்து நாகரிகத்தலம்தான் ல் அகழத் தொடங்கிய தோலாவிரா ஆகும்.
463,அது குஜராத்தில் கச் பகுதியில் உள்ளது.
464,அங்கு அணைக்கட்டுகளும் அவற்றுக்கருகே அவற்றின் காவலர்? இல்லங் களும் கண்டெடுக்கப்பட்டுள்ளன.
465,தோலாவிராவில் கண்டெடுத்த அடி நீளப் பெயர்ப் பலகை எழுத்துகளை நாதன் பண்ணியன் நன் மன்னவன் என மதிவாணன் படிக்கிறார்.
466,தெப்பக்குளம் மொகெஞ்சொதரோ மொகெஞ்சொதரோவில் ஒரு கிணறு இயல் சிந்து நாகரிக மக்கள் வாழ்வியல் .
467,இந்தியர் கோடியினரில் தமிழ்நாட்டினர் கோடி.
468,?
469,வெறும் கி.மு. ?
470,?
471,லட்சம் கி.மு. ?
472,?
473,"கி.மு., கி.பி., கி.பி."
474,.
475,.
476,ஆடு மாடு மேய்த்துக் கொண்டு அவ்வப் பொழுது குடிபெயர்ந்து வாழ்ந்து வந்தவர்களும் இருந்திருப்பர்.
477,சிந்துப் பகுதியில் கி.மு.இல் இருந்த தட்பவெப்ப நிலை இன்று உள்ளது போல்தான் இருந்திருக்கும் என்பர் பொசெல் ..
478,.
479,.
480,கலிபங்கனில் ஆண்டுகட்கு முன்னர் உழுது பாத்தி கட்டிய அமைப்பு தொடக்ககாலச் சிந்து நாகரிகத்தைச் சார்ந்தது கிடைத்துள்ளது குறிப்பிடத்தக்கது.
481,"கோதுமையும் பார்லியும் முக்கியப் பயிர்களாகவும், உணவுப் பொருள்களாகவும் இருந்தன."
482,"சோளம், கம்பு, கேழ்வரகும் பயிராயின."
483,லோதலில் நெல் உமி அகழ்வாய்வில் கண்டு பிடிக்கப்பட்டது.
484,உலகிலேயே முதலில் பருத்தித் துணி உற்பத்தி செய்த நாடு இந்தியாவே.
485,மெகர்காரில் பருத்தி கி.மு. க்கு முன்னரே பயன்படுத்தப்பட்டுள்ளது.
486,"மொகஞ்சொதரோ, ஹாரப்பா நகரங்களில் கண்டுபிடித்த சில கட்டட எச்சங்கள் முன்னர் தானியக் களஞ்சியங்கள் எனக் கூறப் பட்டு வந்தன."
487,பக் .
488,குதிரை தவிர இன்று சிந்துப் பகுதியில் உள்ள அனைத்து விலங்குகளும் அன்றும் இருந்தன.
489,இன்று அப்பகுதியில் இல்லாத யானைகளும் காண்டாமிருகங்களும்கூட அன்று சிந்துப் பகுதியில் இருந்தன.
490,.
