Line Number,Sentence
2138,நான்கு பக்கங்களிலும் இந்த வளைவும் குழிவும் ஒரே அளவாகத் தெரிகிறது.,False
2139,வட்டவடிவமான இக்கல் அடி குறுக்களவு உடையது.,False
2140,தாமரை இதழ்போன்று செதுக்கப்பெற்ற இக்கல்லின் ஓரம் அடியிலிருந்து குறுகி வந்துள்ள விமானத்தின் சிகரத்திலுள்ள நாற்புரத்தையும் சேர்த்துப் பிடிக்கிறது.,False
2141,இந்த மாபெரும் கல்லின் மீதுள்ள விமானத்தின் உச்சியில் ஏற்றி வைக்கப்பட்ட ஒற்றைக் கலசம் சுமார் அடி உயரமுள்ளது.,False
2142,இந்த ஆம் நூற்றாண்டின் ஆரம்பத்தில் இக் கலயம் இருந்தது.,False
2143,இப்பால் நீண்டு விழுந்த இடியோசையின் அதிர்ச்சியால் இது கீழே விழுந்துவிட்டது.,False
2144,இக்கலயம் இன்னும் ஏற்றி வைக்கப்படவில்லை.,False
2145,இந்தக் கோயிலின் மூலதானத்தைச் சுற்றியுள்ள சுவர்களின் வெளிப்புறங்களில் சாசனங்கள் பொறிக்கப் பட்டுள்ளன.,False
2146,அவைகள் இன்று வாசிக்கும் நிலையில் இல்லை.,False
2147,இந்தக் கோயில் கிழக்கு நோக்கி இருக்கிறது.,False
2148,கர்ப்பக் கிரகமும் அர்த்த மண்டபமும் சேர்ந்தே கோயிலாகக் காட்சியளிக்கின்றன.,False
2149,இக் கோயிலின் முக்கியமான வாயில் கிழக்குத் திசையில் இருக்கிறது.,False
2150,இருமருங்கிலும் மிகச் கம்பீரமாக நிற்கும் பெரிய வாயிற் காவல் தெய்வங்கள் துவாரபாலகர்கள் படிமங்கள் காட்சி அளிக்கின்றன.,False
2151,"ஆனால் சிலர் அர்த்த மண்டபம் ஆதியில் அழகுடையதாய் கட்டப்பட்டு, பின்னர் ஏற்பட்ட சண்டைகளின் மூலம் அழிந்து போயிருக்கலாம்.",False
2152,சமீபத்தில் யாரோ இடிந்து போன கட்டிடத்தைச் செப்பனிட்டிருக்கலாம் என்று கூறுகிறார்கள்.,False
2153,அது ஏற்றுக் கொள்ளத் தக்கனவேயாகும்.,False
2154,இச்சிவன் கோயில் அருகே மன்னன் கோயில் இருந்தது.,False
2155,அது இடிந்து தகர்ந்தது இன்று மண்மேடாகக் காட்சியளித்துக் கொண்டிருக்கிறது.,False
2156,அவர்களின் ஆராய்ச்சி முடிவை தமிழுலகம் ஆவலோடு எதிர்பார்த்துக் கொண்டிருக்கிறது.,False
2157,சோழன் கேரளமன்னன் மீது கொண்ட வெற்றியின் நினைவுக்குறியாக மன்னனின் கோயில் பெயர் எழுந்தது போலும்.,False
2158,கங்கை கொண்ட சோழன் மகள் வயிற்றுப் பேரன் முதற்குலோத்துங்கன் இந்த மாளிகையில் இருந்தே ஆட்சி புரிந்தான்.,False
2159,இந்த மணி மாளிகையிலுள்ள மண்டபத்திலிருந்து தான் குலோத்துங்கன் மீது பாடப்பட்ட கலிங்கத்துப்பரணி அரங்கேற்றப் பட்டது.,False
2160,இடிந்து போன சோழ மாளிகைகள் சென்ற நூற்றாண்டின் இறுதி வரை நின்றதாம்.,False
2161,ஆங்கிலக் கிழக்கிந்தியக் கும்பினிக் கொள்ளையர்களே இந்த மாளிகையின் எஞ்சிய பகுதிகளையும் இடித்துத் தரை மட்டமாக்கிவிட்டனர் என்று தெரிகிறது.,False
2162,ஆனால் இப்பொழுது காணப்படும் பிரகாரமும் சுற்றுச் சுவரையும் சேர்த்துக் கோயில் அடி நீளமும் அடிஅகலமும் உடையதாகக் குறுகிவிட்டது.,False
2163,முன்னர் இக்கோயில் ஆறு கோபுரங்களைக் கொண்டதாக இருந்தது என்றும் கூறப்படுகிறது.,False
2164,இப்பொழுது கோபுரமே காணப்படவில்லை.,False
2165,கீழ்புறத்துக் கோபுரம் இடிந்து வீழ்ந்து கிடக்கிறது.,False
2166,முற் காலத்திலே மன்னர்கள் நெருக்கடியான கட்டங்களில் இக் கோயில்களை அரண்கள் போல் பாவித்துக் கோயிலினுள் இருந்து போரிடுவதும் உண்டு.,False
2167,"அவ்வாறே முலிம்களும், ஆங்கிலேயர்களும் படையெடுத்துவரும் காலங்களில் இக்கோயில் அவர்களது முற்றுகைக் குட்பட்டிருக்கலாம்.",False
2168,ஒவ்வொரு போரிலும் இக் கோயிலின் சிற்சில பாகங்கள் சேதமுற்றும் இருக்கலாம் என்று கூறத்தக்க சான்றுகள் காணப்படுகின்றன.,False
2169,ஆனால் எந்தப் போரின் காரணமாகவும் இக்கோயில் பெருஞ் சேதத்திற்கு உட்படவில்லை.,False
2170,"கொள்ளிடத்தில் அணைகட்ட கல்மண்டபங்களையும், வேறுபல வேலைகளுக்காக கற்றுச் சுவர்களையும் இடித்துக் கொண்டு போய்விட்டனர்.",False
2171,அக் காலத்திலுள்ள சைவப் பெருமக்கள் கிளர்ச்சி செய்து அடிமிதியும்பட்டு சிறைதண்டனைக்கு ஆளாயினர்.,False
2172,படிமங்கள் கங்கைகொண்ட சோழேச்சுரத்தில் எழுந்தருளியிருக்கும் கடவுளுக்கு கங்கைகொண்ட சோலழீர் சோளேச்சுரர் என்றும் பெரியநாயகர் பிருஹதீவரர் என்றும் கூறப்படும்.,False
2173,இந்தி பெரிய நகர் இலிங்க வடிவாக்க காணப்படுகிறார்.,False
2174,எனவே எதிரில் ஒரு சாரம் போட்டு அதன்மீது ஏறிநின்று அபிசேகம் செய்துவிட்டு மற்றொரு சாரத்தின்மீது பரிவட்டத்தைச் சாற்றிவிடுகின்றார்.,False
2175,இந்த இலிங்கம் கற்பனைக்கும் அப்பாற்பட்ட வடிவத்தில் காட்சி அளிக்கிறது என்பதை நாம் நினைவிற்கொள்ளவேண்டும்.,False
2176,இத்திருக் கோயிலின் வாயிலுக்கு கீழ்புறத்தில் ஒரு அழகு தவழும் செல்வத் திருமகளின் வடிவம் ஒன்று திகழ்கிறது.,False
2177,இதற்கு எதிர்ப்பக்கம் பிட்சாடன மூர்த்தியின் கற்படிவம் காட்சி அளிக்கிறது.,False
2178,வடபுறவாயிலின் கீழ்புறத்தில் கலைமகளின் கவின் பெறும் படிவம் காணப்படுகிறது.,False
2179,மேற்புறத்தில் சண்டேசானுக்கிரக மூர்த்தி திகழ்கிறார்.,False
2180,மிகச்சிறந்த சிற்பவடிவில் சிவபெருமான் திருஉருவம் அருகில் இடப்புறமாக அம்பிகை அமர்ந்திருக்கும் காட்சியோடு கவின்பெறக் காணப்படுன்கிறது.,False
2181,சிவபெருமானின் மடக்கி இருக்கும் திருப்பதத்தின் அடியில் கைகுவித்தவாறு சண்டேசமூர்த்தி அமர்ந்திருக்கின்றார்.,False
2182,அவரது முடியின் மீது அறக்கடவுள் அவரது அன்பின் அடையாளமாக அவர் அணிந்திருந்த அழகிய மாலையை எடுத்துச் சூட்டுகிறார்.,False
2183,வலதுகை மாலையின் மீது இருக்கிறது இடது கை சண்டேசர் முடியின் மீது காணப்படுகிறது.,False
2184,வாயில்களின் இருமருங்கினும் சுவரோடு இருபெரியகாவற் தெய்வங் களின் சிலைகள் சுவரோடு பொருந்தி இருக்கின்றன.,False
2185,இத்துவார பாலகர்களின் உருவம் மிகப் பெரியது.,False
2186,ஆனால் கண்கவர் வனப்புடையன.,False
2187,இங்குள்ள காளியின் படிவம் மிகப்பெரியது.,False
2188,இக் கோயிலின் அம்பிகையாகிய பெரிய நாயகிக்கு ஒரு கோயில்தான் அமைத்திருக்கின்றார்கள்.,False
2189,ஆனால் பெரிய நாயகியின் சிலை மிகவும் அழகுடையது.,False
2190,சண்டேச்சுர அனுக்கிரக மூர்த்திக்கு வலப்புறம் கணநாதர் ஆடிப்பாடிக் களித்து நிற்கின்றார்.,False
2191,இடப்புறம் பசுக்கள் வேதங்கள் நிற்கின்றன.,False
2192,"இக்கோயிலிலுள்ள படிமங்கள் சோழர் காலத்தில் எழுந்த எல்லா படிமங்களிலும் மிகுந்த கவர்ச்சிகரமானது, உறுதி வாய்ந்தன.",False
2193,தனிப்பெருமை வாய்ந்தன.,False
2194,தமிழர்களின் படிமச் சிறப்பிற்கு சிறந்த எடுத்துக்காட்டாக அன்று ஏன்?,False
2195,இன்றும் புகழுறப் பொலிவுற்று நிற்கின்றன.,False
2196,வைகுண்டப் பெருமாள் கோயில் காஞ்சிபுரத்தில் கற்றளியாக அமைக்கப்பட்ட இன்றும் வழக்கில் உள்ள மாடக்கோயில் ஒன்று உண்டு.,False
2197,அது பரமேசுவர விண்ணகம் என்று அழைக்கப்பட்டது.,False
2198,இன்று அது வைகுண்டப் பெருமாள் கோயில் என்று அழைக்கப்படுகிறது.,False
2199,"இப் பெருந்திருக் கோயிலை, தொண்டை நாட்டை ஆண்ட பல்லவப் பார்வேந்தன் பரமேசுவர வர்மன் கி.பி.",False
2200,இவனுக்கு நந்திவர்மன் என்ற பட்டப் பெயரும் உண்டு.,False
2201,நந்திவர்மப் பல்லவ மல்லன் வைணவபக்தன்.,False
2202,இவன் திருமால் மீது கொண்ட பக்தியால் கி.பி.,False
2203,இக்கோயில் அதனை எடுப்பித்த பரமேசுவரப் பல்லவன் பெயரால் பரமேசுவர விண்ணகரம் என்று அழைக்கப்படும்.,False
2204,இது காஞ்சிப் புகைவண்டி நிலையத்தின் அண்மையில் நகரின் கிழக்குப் பகுதியின் இறுதியில் இடம் பெற்றுள்ளது.,False
2205,காஞ்சி பல சமயங்களுக்கும் உறைவிடமாய் இருந்தது.,False
2206,ஆதியில் சைவசமயத்திற்குச் சிறப்பிடமாய் இருந்தது.,False
2207,அப்பால் பௌத்த நெறிக்கும் சமண நெறிக்கும் வாழ்விடமாய் இருந்தது.,False
2208,அப்பால் அப்பர் காலத்தில் மறுமலர்ச்சி பெற்ற சைவ உலகின் அருள் ஊத்தாக இருந்தது.,False
2209,பின்னர் வைணவ நெறிக்கும் சுமார்த்த நெறிக்கும் புகலிடமாய் உள்ளது.,False
2210,இங்கு இன்று சைவ வைணவத் திருப்பதிகள் பல உள்ளன.,False
2211,ஆம் நூற்றாண்டில் வாழ்ந்த முதலாழ்வார் களால் காஞ்சி விண்ணகரம் என்று உயர்த்தப் பெற்றுள்ளது.,False
2212,திருமங்கை ஆழ்வார் இத்தலத்தை பரமேசுர விண்ணகரம் என்று வியந்து பாடியுள்ளார்.,False
2213,வைகுண்டப் பெருமாள் கோயில் அழகு வாய்ந்தது.,False
2214,சிற்ப நலங்கள் செறிந்தது.,False
2215,கண்டோர் கண்களையும் கருத்தையும் கவரும் எழில் வாய்ந்தது.,False
2216,அங்குள்ள வரலாற்றுச் சிற்பம் வண்மை வாய்ந்தவை.,False
2217,இப்பொழுது நடக்கும் சம்பவங்கள் போலத் தோன்றும்.,False
2218,"இதை மாடங்கள் மணிமாடங்கள், ஒளிமாடங்கள் பொலி மாடங்கள், புகழ்மாடங்கள் நிறைந்த கச்சி, காஞ்சி என்று சமயப் பெரியார்கள் புகழ்ந்தேத்துகின்றார்கள்.",False
2219,கோயில் அமைப்பு காஞ்சிக் கைலாச நாதர் கோவில் கவின்பெறக் கட்டப் பெற்ற கற்றளியாகும்.,False
2220,இக்கோயில் விமானம் கயிலாசநாதர் கோயில் விமானத்தை ஒத்ததாக இருக்கும்.,False
2221,"ஆனால், இதன் தரைப்படம் வேறு விதமாக இருக்கிறது.",False
2222,விமானத்தைச் சூழ்ந்து எங்கும் மறைவிடங்கள் பல காணப்படு கின்றன.,False
2223,உட்புறமுள்ள கைப்பிடிச் சுவரில் இருவரிசையாக மிக உயரிய சிற்பக் கலைப்படைப்புகள் காணப்படுகின்றன.,False
2224,இதன் நடுவில் உள்ள பட்டைக் கோடுகள் தனிமுகப்பு உடைய அணியாகப் பிரிக்கின்றன.,False
2225,இந்தச் சிற்பங்கள் பழைய புராணக் கதைகளைச் சித்தரித்துக் காட்டுவதாக முன்னர் எண்ணப்பட்டு வந்தது.,False
2226,இதில் காணப்படும் சிற்பங்கள் பல வரலாற்று உண்மைகளை உணர்த்துவதாகத் தெரிகிறது என்று கூறியுள்ளார்.,False
2227,இந்தச் சிற்பங்களில் காணப்படும் முடிசூட்டும் விழாக்காட்சியை திரும்ப நினைவூட்டுவதாக இருக்கிறது என்ற கருத்தை உறுதிப்படுத்துகிறது.,False
2228,"திரு உண்ணாழிகையின் சுவர்களின் மீதுள்ள சிற்பங்களும், உட்புறமுள்ள பகுதியில் திருமாலின் பல்வேறு நிலைகளும் நன்கு எடுத்துக்காட்டப்பட்டுள்ளன.",False
2229,இங்குள்ள அழுத்தமற்ற மணல் அடுக்குக் கல் கால வெள்ளத்தால் துரதிட்டவசமாய் தூள்தூளாக உதிர்ந்து போய்விட்டது.,False
2230,இந்த விமானத்தின் கட்டிடப் பாங்கு மிகவும் சிறந்த தனிநலம் வாய்ந்தது.,False
2231,மேன்மாடத்திற்குச் செல்லும் இரண்டு படிகளின் திசை திரும்பாக் கூறுகளை தூய்மையான கோபுரத்தை அடைத்து வைத்துள்ளது.,False
2232,முதலில் இறைவன் இரங்க நாதன் பாம்பின் மீது சாய்ந்து நாகநாதனாக காட்சி தருகிறான்.,False
2233,இரண்டாவதாக திருமால் நின்ற கோலத்தில் காணப்படுகிறார்.,False
2234,இது மூன்று நிலையுள்ள முழு நிறைவான மாடக் கோயில் இரண்டாவது மாடிக்கு மட்டும் படியுள்ளன.,False
2235,மூன்றாவது மாடிக்குப் படிகள் இல்லை.,False
2236,முற்காலத்தில் மாடிகளுக்குச் செல்ல மரப்படிகள் அமைத்துள்ளனர் என்பதை இதன் மூலம் அறியக் கிடக்கின்றது.,False
2237,"அர்ச்சுன இரதம் அர்ச்சுனன் இரதம், மாமல்லபுரத்தில் திரௌபதி இரதத்திற்கு அருகில் தென்பக்கத்தில் உள்ளது.",False
2238,இளங்கோயில் அமைப்பை உடையது.,False
2239,இரு நிலைமாடங்கள் உள்ளது.,False
2240,இது சதுரமான அமைப்புடையது.,False
2241,"இக்கோயிலைச் சிங்கங் களும் யானைகளும் சுமப்பதுபோல் சிங்கம், யானை ஆகியவைகளின் உருவங்கள் அடிப்புறத்தில் அமைக்கப்பட்டுள்ளன.",False
2242,இது அடி நீளமும் அடி அகலமும் அடி உயரமும் உள்ளது.,False
2243,இந்த ஒற்றைக்கல் கோயிலின் அர்த்தமண்டபம் அழகானது இரண்டு சிங்கத் தூண்கள் முன்புறம் அழகுற நிற்கின்றது.,False
2244,இந்தத் தூண் களைப் பிற்காலத்தில் எழுந்த சைவ வைணவப் போராட்டத் தில் உடைக்கப்பட்டுவிட்டன.,False
2245,இப்பொழுது அரசாங்கப் புதை பொருள் ஆராய்ச்சித் துறையினர் அதற்குப் பதிலாகப் புதிதாக இருதூண் களை நிலைநாட்டியுள்ளனர்.,False
2246,உண்ணாழிகையில் தெய்வத்திரு உருவங்கள் எதுவும் இல்லை.,False
2247,"வடக்கு, கிழக்கு, தெற்குப் புறங்களில் அழகிய தூண்கள் அமைக்கப்பட்டுள்ளன.",False
2248,இத் தூண்கள் மரத்தூண் களைப் போல் எழில் பெற்றிலங்குகின்றன.,False
2249,தூண்களுக்கு இடையே யுள்ள கோஷ்ட பஞ்சரங்களில் வெகு அழகான சிற்ப உருவங்கள் புடைசிற்பங்களாக அமைக்கப்பட்டுள்ளன.,False
2250,மேலே கர்ணக் கூடுகளும் சாலைகளும் பஞ்சரங்களும் பல்லவர் பாணியில் அமைக்கப்பட்டுள்ளன.,False
2251,இரண்டாவது நிலையில் உண்ணாழிகை இல்லை.,False
2252,ஆனால் உண்ணாழிகையின் வாயிலைப் போல் நாற்புறத்திலும் வாயில்கள் சிற்ப உருவங்களாக அமைக்கப்பட்டுள்ளன.,False
2253,இரண்டாவது நிலைக்குமேல் எட்டுப் பட்டையுள்ள விமானம் அமைக்கப்பட்டுள்ளது.,False
